Title,News_Type,date,content,url
兩公約國際審查委員會爆千萬元未審先用 藍委、民團轟強推廢死如「司法殖民」,政治,2026/05/15 19:46,國民黨立委賴士葆（前排右二）、洪孟楷（前排右一）與民間團體召開「是國際審查還是政治施壓？民團質疑：誰在代表台灣人權聲音？」記者會。（記者方賓照攝）第四次兩公約國際審查會議日前結束，民間團體與國民黨立委今開記者會提出質疑，會前爆出國際委員會來台一週經費高達1020萬元，且涉及總預算未審先用爭議。民團痛批國際審查淪為特定意識形態與團體政治工具，其公開質疑台灣反廢死民意，形同衝擊民主；藍委賴士葆與洪孟楷則怒批，政府實質推動廢死是「司法殖民」且忽視被害者權益，並質疑預算流向，強調將持續追查、依法把關。藍委賴士葆指出，行政院長卓榮泰出席「兩公約」相關活動，整場會議從一開始就帶有既定立場，目的是將歐盟所謂「進步價值」移植到台灣，其中最具爭議的就是「廢死」議題。他質疑，民進黨一方面強調人權，卻只重視加害者權利，忽略被害者與家屬的痛苦。請繼續往下閱讀...賴士葆也批評，目前已有多名死刑犯判決確定卻遲未執行，顯示政府實質推動廢死。此外，此次兩公約審查早已「劇本寫好」，是將西方價值強加於台灣，形同「司法殖民」，台灣應保有自身主體性與價值判斷，不接受外界強行灌輸。對於活動經費來源，他也質疑總預算尚未通過，卻動用上千萬元舉辦活動，將持續追查預算流向。藍委洪孟楷表示，此次「兩公約」審查屬四年一次的新興計畫，過去數年並未編列相關預算，如今總預算仍在審查期間，法務部卻能動用上千萬元辦理活動，令人質疑是浮編預算或違法挪用一般行政經費。此外，目前仍有多名死刑犯三審定讞後遲未執行，認為政府只重視加害者人權，卻忽視被害者權益，強調死刑判決確定後就應依法執行。對於「鞭刑打詐」公投，針對詐騙、虐童與性侵等重大犯罪，除原有刑責外，應增加更具嚇阻力的處罰，以維護社會公平正義與多數守法民眾的人權。民間團體指出，第四次兩公約國際審查會議日前落幕，但因國際委員來台經費高達1020萬元，且涉及預算未審先用，引發外界質疑。會議期間，國家人權委員會還向國際委員反映立院刪減預算、安排與在野黨立委對談及索取立院審查資料，令人憂心國際審查機制淪為特定意識形態的政治工具。團體也批評，在死刑議題上，部分國際委員與人權團體質疑台灣主流民意，甚至認為不必參考民調，已衝擊民主制度基礎，因此提3大訴求，包含國際審查不得成為特定意識形態的政治工具、預算未審先用，行政程序應公開說明、尊重民主制度與台灣主流民意。    ,https://news.ltn.com.tw/news/politics/breakingnews/5438410
台版朝聖路徑  議員王立任等點名大甲媽、海線五寶拚文化觀光,政治,2026/05/15 19:38,台中市議員張玉嬿（左起）、王立任、謝志忠、黃守達，呼籲市府建構屬於台中的文化路徑。（記者蔡淑媛攝）歐洲文化路徑旅行近年盛行，除了最著名的聖雅各朝聖路徑，已發展49條路線，台中市議員王立任等人今天在議會總質詢指出，台中是有資格做文化路徑的城市，除了大甲媽祖遶境，還有台鐵海線五寶、百年七媽會、戴潮春事件等路線，進而推動台中觀光，對此，觀光局表示，今年大甲媽祖遶境有德國媒體採訪，以及中央推廣宣傳。請繼續往下閱讀...王立任、黃守達、謝志忠、張玉嬿呼籲台中市府應積極推動台中在地文化底蘊，建構屬於台中的文化路徑，以海線五寶來說，這是鐵道迷對台鐵海岸線上五座珍貴的日治時期木造車站的暱稱，中部就有兩座「日南車站」、「追分車站」。歐洲文化路徑是歐洲理事會發展的專案計畫，已成為全球最知名且主題最豐富的文化路徑品牌之一，藉由朝聖之路體現歷史、藝術和社會文化，進一步帶動觀光，許多國家也群起效猶。王立任表示，行政院推動台灣文化路徑部將近5年，質疑台中市府除了大甲媽祖遶境，是否有任何文化路線，以台中市以海線五寶來說，由歷史故事串聯海線鐵道文化，就能規畫文化路徑，他再指台中有許多作家，「台中的作之路在哪裡？」謝志忠進一步指出，文化路徑能整合宗教、產業、文化、觀光，「樟之細路」橫跨桃園龍潭至台中東勢，被譽為台灣七大國家級綠道之一，但以市客委會官網的旅遊地圖卻隻字未提，樟之細路專屬觀光集章護照，也獨漏南端起點客家文化園區，園區內「樟腦故事體驗館」，市府不再續約，舊倉庫也傳出要拆除。市府表示，台中發展眾多文化路線及旅行均在推廣，針對議員所提文化路徑規劃將研擬討論。    ,https://news.ltn.com.tw/news/politics/breakingnews/5438413
鄭麗文稱能搞定華府好選舉  趙少康酸：恭喜國民黨得此百年奇才,政治,2026/05/15 19:20,趙少康。（資料照，記者陳逸寬攝）國民黨今天（15日）舉辦內部空戰執行力培訓課程，主席鄭麗文擔任主講人，不僅大酸前中廣董事長趙少康講話沒人信，更指涉前任黨主席把國民黨「敗光光」，還說自己已經搞定北京，訪美再搞定華盛頓，選舉就好選了。對此，趙少康回應，「恭喜鄭麗文戰力無邊，發揮強大空戰威力」，「恭喜國民黨，得此奇才，百年不遇」。趙少康表示，鄭麗文在國民黨舉辦的「空戰執行力培訓課程」發揮強大空戰威力，罵遍一票人，罵他「無法講理，講話沒人信」，說馬英九「身體狀況很差，要馬英九家人趕快把他帶回家，不要讓馬英九上新聞」，罵國民黨「過去十年百廢待舉，前面的人都把國民黨敗光光」，前面當過主席的人有朱立倫、吳敦義的、洪秀柱、江啟臣，都被她罵了。請繼續往下閱讀...趙少康表示，鄭麗文還說「已經舉辦鄭習會，搞定了北京，接下來去美國，搞定華盛頓之後，大家選舉就好選了」，真的要大大恭喜國民黨！鄭麗文「一婦當關 萬夫莫敵」，國民黨只要靠鄭麗文一人，既能搞定北京，又能搞定華盛頓，還能會見美國總統川普，更可以得諾貝爾和平獎，將來還要重返聯合國，重振中華民國國威。趙少康酸，年底在鄭麗文的英明領導之下，不需要任何人協助，光靠她一己之力一定能在縣市長選舉大勝，2028也必定能在她帶頭衝鋒陷陣之下，重挫民進黨，拿下總統、副總統寶座。恭喜國民黨，「得此奇才，百年不遇」，「一人得道，所向披靡」，國民黨深慶得人，可喜可賀！    ,https://news.ltn.com.tw/news/politics/breakingnews/5438417
新聞360》最新預測國民黨2026「丟X個縣市」！綠民調狂追幕後關鍵曝光！,政治,2026/05/15 19:05,全新的視界！新聞話題不漏接，快訂閱YouTube 【自由追新聞】，記得開啟小鈴鐺哦！    ,https://news.ltn.com.tw/news/politics/breakingnews/5438422
政院指網路搜尋可查證賴總統政見 藍委：民眾「感覺」得出完全沒有落實,政治,2026/05/15 18:50,國民黨立委葛如鈞拿16公尺清單稱賴政府政見跳票。（資料照）立法院14日針對總統賴清德彈劾案進行審查會，國民黨立委葛如鈞上台時手持長達16公尺的政見清單，怒轟賴清德227項政見，目前僅兌現2項，行政院反駁網路搜尋就可查證。葛如鈞今日回應，問題在於他提出的幾個賴政府的空洞政策，根本不用上網查，也不用問AI，民眾都感覺得出完全沒有落實。如果政府的施政，還需要上網查、上行政院公報才能知道，不正是政府失能的表現嗎？行政院發言人李慧芝表示，在數位時代，透過搜尋引擎、AI工具及行政院網站即可查證公開資訊。葛如鈞既自詡為「科技立委」，更應先做好基本事實查核、以數據與事實為基礎評論公共政策，避免以訛傳訛，才不負「科技立委」之名。請繼續往下閱讀...葛如鈞說，他所提出的幾個問題，行政院問A答B：問衛星，答海纜；問青年使用AI，回覆海外圓夢計畫。一個「有能」的政府，其實不用上網查，也不需要問AI，都能知道他所問的問題，也就是民眾所關心施政空洞之處。希望政府能真正的問A答A、問B答B，要施政就要有作為，而不是讓人民在心裡有一張長長的賴帳單。葛如鈞指出，從三班護病比、設置青年發展基金、提升學生心理輔導資源，再到軍人加給、還假於民、普發現金政策等，又有多少是執政黨一拖再拖、一開始2年後實施，不只已經跳票而且還十分賴皮。把跳票的政策日期提早一點點、分階段實施政策也算是「現在有在落實政策」嗎？葛如鈞表示，如果「七成人民都是使用免費 AI 」不是政府應該關注的問題，為什麼賴總統當初競選政見要提AI平權？讓人民不因為經濟條件的不同，都有平等使用AI工具的機會，本就是政府的責任。賴總統曾承諾要「打造淨零創新科技平台」，但今天台灣的能源結構仍高度依賴天然氣與燃煤火力發電，「淨零碳排」在哪裡？現在核三廠之所以有延役可能，也是因為在野黨努力通過核管法修正。葛如鈞說，如果政府真的覺得台灣在全球AI供應鏈中很重要，為什麼現在台灣自己製造的先進晶片，人民卻看得到用不到？如果政府真的覺得自己有在改善交通安全，為什麼台灣現在的交通法規還是落後國際數十年？特斯拉的FSD自駕科技在台實施日期仍然遙遙無期？葛如鈞強調，這次的彈劾案，正是在野黨對選民的承諾，也是國會監督行政的應盡責任。「正因為我愛我的國家、正因為我珍惜民主，所以我們不能放任總統繼續失信於民、不能放任國家繼續在錯誤道路上『脫軌』」。    ,https://news.ltn.com.tw/news/politics/breakingnews/5438390
游淑貞普發「鄉長阿姨」御守給花蓮會考生 陳培瑜怒轟：目無法紀,政治,2026/05/15 18:44,民進黨立委陳培瑜。（資料照）有花蓮市的國中老師爆料，國民黨花蓮縣長參選人、現任吉安鄉長游淑貞日前將全縣26所公私立國中校長、主任全部請到吉安鄉公所，要老師幫忙分送「包中狀元」御守鑰匙圈給會考考生，批評是違反行政中立。對此，民進黨立委陳培瑜怒轟，游淑貞根本視「目無法紀」！陳培瑜在臉書發文表示，3月初游淑貞獲得國民黨提名的第一天，就在花蓮火車站舉辦造勢，大踩「行政中立」的紅線，更引爆民怨。近期適逢國中會考，游淑貞又把全縣26所公私立國中校長、主任全部請到吉安鄉公所，發贈印有「鄉長阿姨」的包中狀元御守給全縣2千多名考生，不但與校長、主任拍大合照宣傳，還要求各校老師幫忙發送，根本違反行政中立 。請繼續往下閱讀...陳培瑜質疑，為什麼一個吉安鄉鄉長，需要送全縣學生包中御守？還要要求各校老師幫忙發送御守？更可以讓全縣校長隨傳隨到？「我想這個答案，國中的孩子們看得清楚，大家也都心知肚明」。她指出，花蓮會被人稱為「花蓮國」不是沒有原因，因為一些最基本的「法」治觀念、最基礎的是非道德，到了這裡都會被「人」玩出屬於花蓮的「特色主義」。就像是游淑貞，在傅家的撐腰之下，吉安拿到了全縣最多的統籌分配款。而從選戰起跑至今，她更能利用公務車，在公務時間在全縣到處送禮品、送花圈。這其中到底有沒有用到公帑，絕對值得好好調查。陳培瑜呼籲國民黨與游淑貞，民主社會的競爭，應該是遵守規矩且有所底線的。不要再用「祝福」、「好意」的藉口，包裝「破懷行政中立」的事實。同時，更不是因為有人撐腰，就能濫用權力為所欲為。「我想，這絕對是所有守法且善良的花蓮人，所無法忍受的」。    ,https://news.ltn.com.tw/news/politics/breakingnews/5438345
股市集中高科技領域 卓榮泰：研議中小微企業轉型升級條例,政治,2026/05/15 18:40,行政院長卓榮泰今（15）日出席「高階決策AI治理共識營」。（行政院人事總處提供）台股站上4萬點，行政院長卓榮泰今（15）日出席「高階決策AI治理共識營」致詞時表示，目前雖然台灣經濟發展有十足進展，股市成交量集中在某些特定高科技領域，政府必須要有集體智慧，讓台灣成為更公平分配的台灣，必須思考如何讓中小微企業，跟著科技的成長一起發展，他已要求國發會、經濟部、勞動部，共同訂定「中小微企業轉型升級條例」，將協助中小微企業轉型升級納入國家計畫之中。卓榮泰指出，台灣沒有AI將不成台灣，政府已推動AI新十大建設，第一年已投入300億元預算，希望培育50萬名AI人才與協助中小微企業轉型，透過公務領域帶頭並結合民間，希望把台灣打造成智慧科技島，帶全民進入智慧生活圈，處處享有AI服務。台灣在2025年全球AI指數排名報告，從21名進步至16名，且在AI基礎建設、政府策略上獲致高分。請繼續往下閱讀...卓榮泰也提到，再過幾天就是賴清德總統就任兩週年，政府會向國人報告2年來，中華民國政府在台灣，經由賴總統以健康台灣、團結台灣、科技台灣帶領國家的同時，做了多少與世界對齊、帶領國人共同進步的工作。    ,https://news.ltn.com.tw/news/politics/breakingnews/5438354
「雙城論壇」恐成滲透破口？北市府回嗆沈伯洋：拿出證據,政治,2026/05/15 18:33,台北市政府副發言人葉向媛批評民進黨台北市長參選人、立委沈伯洋胡亂指控「雙城論壇」是滲透破口，若有實證就拿出來，沒有實證就公開承認並道歉。（台北市政府提供）民進黨台北市長參選人、立委沈伯洋認為「雙城論壇」效益低，很多時候還會成為滲透破口；台北市政府副發言人葉向媛今（15日）批評沈伯洋胡亂指控，若有實證就拿出來，沒有實證就公開承認並道歉。葉向媛說，沈伯洋說「雙城論壇很多時候都是造成滲透的破口」已經40天，請問「哪一位公務人員被滲透？哪一位公務人員是破口？」呼籲沈伯洋不要再迴避，說過這些話就出來面對；敢指控市府、公務人員被滲透、是破口，就拿出證據來。「事實上，全國人民現在只看到總統府、國安會、外交部以及民進黨黨中央有共諜而已」。請繼續往下閱讀...葉向媛說，沈伯洋對「雙城論壇」的觀光成果表示「城市外交不要推給中央」，可能是對市政不了解，不知道市府所說的成果是什麼；台北與上海在論壇上，取得陸方鬆綁陸客團來台的成果，卻被中央否決，這就是「北市已經談出階段結果，剩下就是中央要處理」。一個立法委員，就算對市政不熟，也不能對國政不熟，一直找人來洗「蔣萬安都是推給中央」這句話，反而會突顯心虛，以及對政策權責不熟的事實。    ,https://news.ltn.com.tw/news/politics/breakingnews/5438356
區桂芝自曝答應校長「1件事」 他再批北一女要護航到退休,政治,2026/05/15 18:17,北一女教師區桂芝。（資料照）北一女中教師區桂芝日前受訪高喊「零軍購」、「台灣人就是中國人」引發輿論炸鍋。面對外界一片要求裁處的聲浪，區桂芝近日自曝「答應校長退休前不討論時事」。對此，中央大學中文系助理教授胡川安15日再批，北一女持續護航到退休。胡川安15日曝光區桂芝的臉書發文，內文寫下「我答應校長：退休之前，不再接受媒體採訪，不再公開討論時事，各位媒體朋友們暫時再會了！所有因本人軍購論受到干擾的同仁，辛苦了。」請繼續往下閱讀...對此，胡川安表示，「最近在我揭露她惡質的教學行為時，她宣布再過幾個月退休之後才接受媒體訪問。北一女這幾天校長秘書都不接記者電話，護航Alice到她退休！這就是百年名校的高度，聽說校長很會治校，卻一直護著Alice。」胡川安更怒斥，區桂芝到時就可以一邊爽領台灣納稅人的退休金，一邊接受中國媒體的訪問。    ,https://news.ltn.com.tw/news/politics/breakingnews/5438344
國民黨苗栗鄉鎮市長登記完成 銅鑼、三義2鄉出現競爭局面,政治,2026/05/15 18:14,國民黨苗栗縣黨部主委李文斌表示，苗栗縣鄉鎮市長及縣議員參選同志均已完成登記，展現團結一致全力爭取勝選的堅定決心。（資料照）國民黨苗栗縣黨部115年地方公職人員選舉候選人登記作業，於今（15）日完成。鄉鎮市長計有8人登記，其中銅鑼、三義2鄉都有2人以上登記。縣黨部主委李文斌表示，原則上將採開放參選方式辦理。苗栗縣黨部統計登記名單，鄉鎮市長部分，苗栗市長余文忠1人登記，頭份市長徐功凡1人登記，西湖鄉長古秋雲1人登記，銅鑼鄉黃芳椿、李瑞廷、林九炲3人登記，三義鄉徐文達、鄭淑如2人登記。請繼續往下閱讀...縣議員部分有13人登記，分別為第一選區鄭碧玉、曾美露、孫素娥、張志宇、楊明燁、黃萬盛；第二選區的黎尚安；第四選區的李文斌、廖秀紅、林寶珠；第五選區的張淑芬、鄭聚然；第八選區的劉美蘭。李文斌表示，苗栗縣鄉鎮市長及縣議員參選同志均已完成登記，展現團結一致全力爭取勝選的堅定決心，相信在縣長鍾東錦超級強大母雞帶領下必能贏得勝選。    ,https://news.ltn.com.tw/news/politics/breakingnews/5438339
蔣萬安提實名制防偷拍  簡舒培批搞錯重點曝北市稽查量能不足,政治,2026/05/15 18:02,台北市議員簡舒培認為，台北市長蔣萬安6措施防偷拍搞錯重點，源頭管理不能取代稽查量能。（記者田裕華攝）知名醫美診所爆出裝設隱藏式攝影設備偷拍，台北市長蔣萬安表示市府已展開6大措施，並強調去年6月發函請行政院立法採實名制購買針孔攝影設備；台北市議員簡舒培今（15）指出，蔣萬安6大措施搞錯重點，源頭管理不能取代稽查量能，地方稽查才是真正關鍵，問題是台北市的稽查制度與稽查量能根本不足。簡舒培指出，愛爾麗偷拍案爆發後，台北市多家醫美診所接連遭檢警偵辦。衛生局與刑事警察大隊5月5日、12日聯合稽查50間診所，查獲1家裝設針孔攝影機卻未接線，另有3家出現疑似拆除痕跡。她強調，淘寶、蝦皮等境外平台，輕易能買到偽裝型錄影機，單靠實名制根本無法完全阻止設備流通。源頭管理重要，但關鍵還是後端有沒有落實稽查。請繼續往下閱讀...簡舒培說，北市於2025年修訂《台北市公共場所防止針孔攝影管理辦法》後，規定業者每月需自行檢查並提報主管機關，「但哪間業者會主動填報自己不合格？」也規定各機關每季需辦理現場稽查，目標值卻由各機關自訂，結果落差驚人。衛生局負責4950家醫事場所，2025年至今只稽查161家，比例僅3.3%；交通局稽查比例高達2758%、財政局更達4500%。同樣一套辦法，執行落差幾十倍？代表問題不是「有沒有法規」，而是市府到底有沒有足夠的稽查能力。簡舒培表示，目前北市的問題就是稽查量能明顯不足，如果稽查量能足夠、現場查核真正落實，就不會讓偷拍設備長期存在，也不會讓病患與消費者暴露在風險之中。要求蔣萬安全面檢討台北市針孔稽查制度，並研議引進第三方專業單位協助稽查，用民間力量補足量能缺口，讓防偷拍制度真正落實，而不是停留在紙上管理與宣示口號。    ,https://news.ltn.com.tw/news/politics/breakingnews/5438322
鐵路高架補助款藍綠攻防  陳文昌：不要政治操作、阻礙宜蘭發展,政治,2026/05/15 17:59,宜蘭鐵路高架案已獲中央核定。（資料照）宜蘭鐵路高架因33億元補助款未定案，引起藍綠攻防。民進黨宜蘭縣議會黨團總召、林國漳競選總部總幹事陳文昌指出，鐵路高架是宜蘭百年大計，其實不分黨派議員均有共識，「不要再吵了，趕快動工、趕快完工才是縣民所期盼」，有心人士切莫為了政治紅利刻意操作，阻礙宜蘭發展。陳文昌表示，宜蘭鐵路高架包含蘭陽溪鐵路橋改建在內550億元總經費，已獲行政院卓榮泰院長核定，並在陳金德政委的積極協調下落實，這份具體的公文與預算，代表中央對宜蘭最實質的支持。請繼續往下閱讀...陳文昌說，議會專案報告時，不分藍綠的議員都說得很清楚，大家要的是建設而非口水，既然跨黨派議員都認同應儘速推動，就不該再有政治因素干擾。陳文昌以競總總幹事身分重申，林國漳對鐵路高架有絕對的信心與責任感，林國漳的立場非常明確就是「已核定、快動工、協商我處理」；陳文昌呼籲不要再為吵而吵，宜蘭縣民盼望數十年的鐵路高架，不容有心人士因私心而拖延。    ,https://news.ltn.com.tw/news/politics/breakingnews/5438274
川普「right president」是指自己！卓冠廷批鄭麗文斷章取義,政治,2026/05/15 17:29,"國民黨主席鄭麗文（左）。（記者羅沛德攝）民進黨新北市議員卓冠廷今日發文，砲轟川習會才剛落幕，當全台都在密切關注國際局勢發展時，國民黨主席鄭麗文卻在國內大搞認知作戰，痛斥鄭麗文扭曲美國總統川普的發言，藉此抹黑總統賴清德、恐嚇台灣人民。卓冠廷今轉發媒體報導截圖，標題為「認川習會將舒緩美中角力 鄭麗文：只有賴清德像『滅絕師太』堅持錯誤兩岸路線」。請繼續往下閱讀...卓冠廷酸說，「身為最大在野黨主席，竟然連最基本的英文前後文都看不懂，或者根本是刻意指鹿為馬，實在令人直搖頭」。川普前幾天發言原文：「That would have never happened had the election not been rigged, that would have never happened.」「And Putin and I would talk about it, but there was never any...He would have never done it.」「Taiwan, I would equate it a little bit to that. If you have the right president, I don't think it'll happen.」「I think we'll be fine. I have a very good relationship with President Xi.」翻譯：「如果當初的選舉沒有被操縱，這一切根本不會發生，絕對不會。」「俄羅斯總統普廷和我曾談論過這件事，但當時從未有過任何行動跡象……他當初是絕不會輕舉妄動的。」「至於台灣，我認為局勢與烏克蘭有些許相似之處。如果有合適的總統領導，我不認為衝突會發生。」「我相信我們會安然無恙。我與習近平主席的關係非常好。」卓冠廷指出，如果有完成國民基本教育，看得懂前後文、看得懂烏克蘭、普廷、國際局勢，都知道川普口中那位「合適的總統（right president）」，指的就是「美國總統」他自己！川普的原意非常清楚：「只要美國有他這樣合適的領導人，烏克蘭跟台灣都不會發生衝突」。卓冠廷直指，面對如此清晰的發言，鄭麗文不僅配合錯假訊息滿天飛，甚至還大放厥詞批評賴總統。國民黨不去譴責真正在威脅台海和平的中國，反而急著斷章取義來唱衰台灣、大搞內部認知作戰。鄭麗文口中的「滅絕師太」，就是在說她自己！鄭麗文稱「川普說台灣有對的總統兩岸就不會戰爭」 民進黨昨已指是假訊息網傳川普批台灣總統導致衝突 民進黨翻原文駁「假訊息」    ",https://news.ltn.com.tw/news/politics/breakingnews/5438210
