Title,News_Type,date,content,url
金溥聰開記者會讓真相大白？3人調查小組：沒看到馬英九委託書,政治,2026/05/22 05:55,馬英九基金會董事、3人調查小組發言人李德維。（記者田裕華攝）首次上稿 5-21 23:57更新時間 5-22 05:55前總統馬英九指控馬英九基金會前執行長蕭旭岑、王光慈破壞財政紀律，並認為3人調查小組拖延進度，表示將盡速召開記者會讓真相大白。3人調查小組聲明，3人小組多次要求與基金會無關之人前國安會秘書長金溥聰，出示馬英九的委託書，到現在也沒看到；並質疑基金會完全沒詢問當事人（指蕭旭岑、王光慈）的說法，何來「真相大白」？請繼續往下閱讀...3人調查小組成員為薛香川、尹啟銘與李德維。3人小組聲明，3月27日董事會已決議要求在調查有結果之前，基金會任何人不得對外洩露相關事件資訊，基金會卻以馬董事長之名，一而再再而三發表聲明，並干擾調查進度，極為不妥。3人調查小組表示，調查進度已近尾聲，很遺憾的是事件發動者之一高華柱董事迄今拒絕3人小組約談。此外，4月8日基金會私下委託律師對員工進行訪談的錄音紀錄亦拒絕提供；同時，3人小組一再要求與基金會無關之人金溥聰出示馬董事長的委託書，到現在也沒看到。3人調查小組表示，更遺憾的是，基金會再三強調的「財政紀律事件」，竟然完全沒有詢問當事人的說法，只是片面指控，何來「真相大白」？    ,https://news.ltn.com.tw/news/politics/breakingnews/5445392
蔡英文：要讓全世界覺得「不能沒有台灣」,政治,2026/05/22 05:54,前總統蔡英文（左）昨受邀到台北醫學大學演講。（蔡英文辦公室提供）首次上稿 00:39更新時間 05:54前總統蔡英文21日受邀到台北醫學大學演講，被學生問及如何看待香港2047大限及台灣未來定位？蔡直言，台灣必須為未來的每一天做準備，國人為了台灣何去何從辯論、互相挑戰不是壞事，才能為危機做準備，最關鍵的是台灣人有個重要使命：讓全世界「不能沒有台灣」。請繼續往下閱讀...面對學生提問香港「一國兩制」50年不變的期限將於2047年結束，也讓人思考屆時台灣將在國際上扮演什麼角色？蔡英文笑稱，這是她從擔任陸委會主委20、30年來，每天都要面對的問題，2047年太久了，現在才2026年，「你必須為未來的每一天做準備」。蔡英文指出，台灣社會看似紛擾，為了未來定位、何去何從吵吵鬧鬧，但「吵鬧不是壞事、有爭議也不是壞事」，當國家人民不辯論、不互相挑戰，大家都視一切理所當然、一片和諧，等到危機來臨時，就會措手不及。這個國家要何去何從、跟鄰居建構什麼樣的關係，是台灣獨有的問題，我們要自己找出解方。蔡英文強調，我們不能只是吵架，還是要理性對話，全台灣要有兩大共識，第一、民主自由不可被傷害、必須強化，第二、要讓全世界覺得「不能沒有台灣」，現在國際社會已經隱隱約約有所體會，「不然他們要到哪裡找晶片？」談及台灣的半導體與AI產業，蔡英文指出，台灣的晶圓產業不是平地而起，我們在AI世代的很多技術跟量能，都是從消費者的電子用品實際累積的，要找到有同樣能力的國家還真的不多，但如果停滯不前，總有一天會被趕上、甚至被取代。台灣人只有一個重要使命，千萬不能被取代，要讓全世界「不能沒有台灣」！蔡英文結束演講後，被學生簇擁合照。（蔡英文辦公室提供）    ,https://news.ltn.com.tw/news/politics/breakingnews/5445402
蔡英文：不能因「買不到」妥協 攸關國家生存「再困難也要開始」,政治,2026/05/22 05:53,前總統蔡英文應邀到台北醫學大學演講時，分享國艦國造、國機國造經驗。（蔡英文辦公室提供）首次上稿 5-21 23:53更新時間 5-22 05:53前總統蔡英文21日應邀到台北醫學大學演講，分享任內8年決策核心「強化台灣韌性」，舉潛艦國造為例強調，真正重要的決策往往伴隨爭議與質疑，但國家的安全不能只建立在別人願不願意賣，也不能停留在買不到就沒辦法的階段，「如果一件事對國家生存很重要，再困難也要開始」，困難不代表不該做、爭議不代表不能做，重點是理性評估風險、誠實面對問題、耐心溝通、修正並承擔。請繼續往下閱讀...蔡英文回顧8年總統任期，決策核心圍繞著一個重要議題：「台灣要怎麼樣變得更有韌性」，包含產業升級、能源轉型、社會福利（長照、托育、社宅），以及租屋補貼、TPass及學費補助等支持年輕世代的政策；在國防上，則推動國艦國造、國機國造，確保台灣具備自我防衛的決心和能力。蔡英文指出，過去台灣取得新的潛艦非常困難，潛艦是高度敏感的戰略裝備，還涉及戰鬥系統等複雜關鍵技術，有些設備可以自主研發，但仍須尋求國外的商源跟技術合作，受限於台灣的國際處境，要取得這些關鍵技術，並不是有錢、有決心就買得到，每一個環節都面臨外部壓力、每一次合作都要高度謹慎，每一項的進度都必須在保密安全與技術升級之間取得平衡。蔡英文坦言，當年決定推動潛艦國造時，有人質疑台灣沒有這樣的技術能力、最後會不會做不出來、會不會引來更大的壓力？在第一艘國造潛艦「海鯤號」下水後，社會仍有許多政治攻防，嚴厲甚至不公的批評，但是，國家的安全不能只建立在別人願不願意賣給我們，不能永遠停留在買不到就沒辦法的階段，「如果一件事對國家生存很重要，再困難也要開始。」蔡英文說，海鯤號從設計、建造、下水到測試的階段，走過非常漫長的路，這條路上有工程師、造船人員、海軍官兵、中科院研發團隊、國內外合作夥伴，也有很多不能公開的身影，多年來歷經無數次討論、嘗試、失敗、修正，再重新開始才走到今天；海上測試也不簡單，每一次都要確認系統安全、艦體狀態、操控性能、潛航能力，一個小問題都可能需要回港重新檢視、校正。但國艦國造更重要的意義是，台灣在過程中開始累積自己的技術、供應鏈與工程經驗，以及一個國家面對困難時的信心。蔡英文說，同樣的信念也體現在國機國造，台灣第一架自製高等教練機「勇鷹號」不只是一架飛機，代表的是台灣航太產業的能量，重新被串聯起來，代表的是工程師、技術人員、飛行員，國防團隊共同完成一個長期的任務，也代表我們願意相信台灣可以累積自己的技術，可以建立自己的供應鏈，也可以培養自己的下一個世代的人才。「真正重要的決策不會一開始就得到所有人的掌聲。」蔡英文指出，推動初期社會常有質疑、內部不同意見與外部壓力，但決策不能只挑最容易被稱讚的事情，也不能只做不會得罪人的事情，困難不代表不該做，爭議不代表不能做，「重點是有沒有足夠的理性去評估風險？有沒有足夠的誠實去面對問題？有沒有足夠的耐心去溝通、去修正、去承擔？」蔡英文說，國家的韌性不是口號，一個一個困難的決策、一個一個長期的工程、一代一代人才的累積，當我們願意開始做最困難的事，台灣才有能力在下一次變局來臨之前做最好的準備，讓我們的朋友也願意、也更願意協助我們。台灣的安全不是台灣人自己的事，更是區域間所有民主國家共同關注的事情。    ,https://news.ltn.com.tw/news/politics/breakingnews/5445393
金融時報：北京暫緩美官員訪中 施壓美台軍售,政治,2026/05/22 05:30,英國「金融時報」披露，中國暫緩美國戰爭部次長柯伯吉訪中行程，藉此施壓川普總統延後一四〇億美元對台軍售案。（路透檔案照）美國總統川普表示，將與台灣總統賴清德通話，白宮官員隨後指出，將在近期內就美國新一批對台軍售做出決定。英國「金融時報」則披露，中國正暫緩美國五角大廈政策次長柯伯吉的訪中行程，藉此施壓川普延後一四〇億美元對台軍售案。戰爭部次長柯伯吉 今夏訪中受阻白宮一名官員透過電子郵件以背景方式回應中央社，重申川普將在近期內，對新的對台軍售案做出決定，並強調川普首次總統任期內批准的對台軍售總額，超過其他任何一位美國總統；在第二次總統任期的第一年，對台軍售總額累計已超過拜登政府四年總和。請繼續往下閱讀...知情人士向金融時報指出，柯伯吉曾與中方官員討論今夏訪中事宜，但北京方面暗示，在川普決定如何處理對台軍售案之前，中方無法批准柯伯吉的訪問計畫。美國企業研究所（AEI）亞洲安全議題專家古柏認為，北京會利用未來柯伯吉或戰爭部長赫格塞斯訪中行程，作為施壓川普政府延後、拆分或降低對台軍售方案的籌碼。前中央情報局（CIA）資深中國問題專家韋德寧指出，北京非常清楚，川普不會終止對台軍售，但其最終目標是施壓美方，延遲宣布新的大型軍售案，直到九月底中國國家主席習近平訪問美國之後，「這與其說是考驗川普協助台灣防衛的承諾，不如說是讓習近平免於難堪的手段之一。」川普軍售籌碼說 美國會議員抨擊針對川普聲稱對台軍售是與中國談判的「籌碼」，美國聯邦眾議院外交委員會榮譽主席麥考爾向中央社表示，他認為削弱台灣自我防衛能力，並非好的政策，華府應該遵守台灣關係法。聯邦參議院外交委員會民主黨首席議員夏亨也說，她對川普前述發言感到擔憂，台灣安全並非談判籌碼，而是印太地區嚇阻核心。中國外交部發言人郭嘉昆廿一日回應稱，中方堅決反對美國與台灣展開官方往來，敦促美方「兌現所作承諾和表態」。    ,https://news.ltn.com.tw/news/politics/paper/1755742
歐洲議會決議 挺台參與國際組織 強調聯大二七五八號決議 未決定台灣主權,政治,2026/05/22 05:30,歐洲議會全會廿日通過「有關第八十一屆聯合國大會之建議」決議案，重申支持台灣有意義參與國際組織。（路透檔案照）台灣已連續第十年被世界衛生大會（WHA）拒於門外。歐洲議會全會廿日通過「有關第八十一屆聯合國大會之建議」決議案，重申支持台灣有意義參與國際組織，並關切台海及南海情勢，反對以武力或脅迫片面改變台海現狀。英國、加拿大、澳洲、法國、德國、日本、立陶宛、紐西蘭與波蘭等九國駐台機構，也於昨日發聲，支持台灣有意義參與世衛組織（WHO），並以觀察員身份參與WHA。歐洲議會決議案特別援引於二〇二四年通過的「中華人民共和國不當詮釋聯合國大會第二七五八號決議及對台灣持續軍事挑釁」決議案，強調聯大第二七五八號決議並未決定台灣主權，也沒有提到台灣，不可用此決議排除台灣的國際參與。歐盟應強化對台灣有意義國際參與的支持，以貢獻國際社會福祉。請繼續往下閱讀...該決議另強調，應透過外交途徑，避免台灣海峽及南海衝突升級，反對任何以脅迫或武力片面改變現狀的行為；並與理念相近夥伴深化合作，鞏固台海地區穩定與安全，強化對於脅迫或軍事行動的嚇阻；同時持續捍衛聯合國憲章禁止使用武力原則。決議並呼籲聯合國允許持有台灣護照的社運人士、公民社會代表及記者進入聯合國參與活動。英國在台辦事處、加拿大駐台北貿易辦事處、澳洲辦事處、法國在台協會、德國在台協會、日本台灣交流協會、立陶宛貿易代表處、紐西蘭商工辦事處以及波蘭台北辦事處等九國在台代表處昨日也一同重申，支持台灣有意義地參與WHO，並以觀察員身份參與WHA。九國駐台機構發聲 支持台灣參與世衛組織九國在台代表處表示，第七十九屆世界衛生大會在日內瓦召開，台灣仍被排除於全球國際衛生體系之外。聲明強調，台灣傑出的能力與作法，包括卓越的公共衛生專業、民主治理與先進科技，可為WHA的討論帶來極大助益。台灣被排除在這個全球最重要的公共衛生論壇之外，毫無正當理由。這破壞了這世界所迫切需要、同時也是WHO創始文件中所明載的精神，即兼容並蓄的全球公共衛生合作與安全。    ,https://news.ltn.com.tw/news/politics/paper/1755715
用國台辦用語批賴 梁文傑：國民黨勿做中共傳聲筒,政治,2026/05/22 05:30,陸委會副主委梁文傑昨表示，看到國民黨發的新聞稿，裡面用詞「倚美謀獨」、「以武拒和」，幾乎就是國台辦的用語。（記者羅沛德攝）國民黨主席鄭麗文批評賴清德總統就職二週年談話是「笑話」，國民黨更發聲明指責賴「倚美謀獨」的企圖已被川普總統戳破，卻執迷不悟，意圖「以武拒和」。陸委會發言人梁文傑昨痛斥，「倚美謀獨」、「以武拒和」幾乎就是國台辦的用語，國民黨作為一個創建中華民國的政黨，不要做中共傳聲筒。梁文傑在陸委會記者會表示，看到國民黨發的新聞稿，裡面用詞什麼「倚美謀獨」、「以武拒和」，幾乎就是國台辦的用語，「中國國民黨作為一個創建中華民國的政黨，應該要以保衛中華民國自居，千萬不要重複中共的語言，不要做中共傳聲筒，這個才是重點」。請繼續往下閱讀...對於海基會與中國海協會聯繫機制停擺十年，外界關注雙方是否能以「兩岸同屬中華民族」做為冷對抗的突破口？梁文傑回應，兩岸從來不是不同民族的爭執，而是制度之爭，一邊是專制政體，一邊是自由民主政體，所謂同屬中華民族或不同屬中華民族，這個問題從來不存在。梁強調，中共要的也不只是台灣承認自己是中華民族，中共要的是「以北京作為中央政府，台灣成為中華人民共和國的一省」。如果大家覺得自稱是中華民族，中共就會滿意，那也太天真了。    ,https://news.ltn.com.tw/news/politics/paper/1755744
醫界為巧慧加油 「她對問題感同身受」,政治,2026/05/22 05:30,民進黨新北市長參選人蘇巧慧昨推出「醫界為巧慧加油」系列影片；圖為蘇巧慧（右二）拜票畫面。（資料照）民進黨新北市長參選人蘇巧慧昨推出「醫界為巧慧加油」系列影片，由新北市中醫師公會前理事長陳建輝分享蘇巧慧對中醫界發展的長期支持。陳建輝表示，蘇巧慧「真的有把我們的問題放在心上」，在二〇一九年推動「中醫藥發展法」，並爭取國家中醫藥研究所轉型成為國家中醫研究院，也整合國家資源，協助產業發展出具台灣特色的中醫藥實證醫學與產學模式。推動中醫藥發展法 升級產業蘇巧慧表示，她成功推動「中醫藥發展法」，幫助中醫藥產業發展法制化，她也爭取「中醫藥振興計畫」，提供中醫藥產業五年十六．八億元的經費，她將持續推動中醫藥產業升級、中醫藥與數位醫療、精準醫療以及再生醫療合作，讓智慧中醫藥科技成為高齡照護的後盾。請繼續往下閱讀...讚蘇團隊務實、理性、專業陳建輝說，「中醫藥發展法」加速中醫藥產業轉型與升級腳步，對中醫藥產業發展有長遠影響；每當中醫界遇到困難，蘇巧慧總是迅速回報處理進度，在推動政策上，也綜整各方意見，提出具體、可行的方向，蘇巧慧團隊的執行力是「務實、理性、有專業」。陳建輝指出，蘇巧慧對中醫界遇到的問題能感同身受，並且給予解方，次次拜訪蘇巧慧，都感受到蘇巧慧對中醫界的了解超乎想像，她真的把中醫藥產業放在心上，相信蘇巧慧會用同樣的態度為市民服務。    ,https://news.ltn.com.tw/news/politics/paper/1755756
馬辦家變 「這關乎我個人最重視的清廉操守」 馬怒調查拖延 委託金溥聰盡速說明,政治,2026/05/22 05:30,馬英九基金會昨日召開董事會，僅前總統馬英九及董事高華柱出席，三人調查小組成員並未出席，出席董事未達法定人數而流會。（資料照）馬英九基金會昨日召開董事會，僅前總統馬英九及董事高華柱出席，三人調查小組成員並未出席，出席董事未達法定人數而流會。馬英九在會中表示，調查工作不應以各種理由與藉口刻意拖延，「這關乎到我個人一生最重視的清廉操守」，他將委託基金會執行長戴遐齡、國安會前秘書長金溥聰等人盡速召開記者會。馬英九認為，調查工作應該盡速完成，但三人調查小組發言人李德維昨在媒體上以不符事實的藉口，推翻了對他的承諾，拒絕出席董事會，同時也拒絕他提出寬延至廿七日提出調查報告的要求，「我對此感到非常遺憾」。請繼續往下閱讀...遺憾李德維拒絕出席董事會馬表示，基金會於三月廿七日召開董事會，會中成立前執行長蕭旭岑、前副執行長王光慈違反財政紀律案三人調查小組，期盼將該案調查水落石出；四月十三日召開董事會，原本希望新聘四位董事，但當日因出席董事人數不足而流會。馬表示，原本他是要請負責調查蕭旭岑、王光慈兩位涉嫌侵占與背信案的三人調查小組，在董事會盡快提出調查報告，讓證據說話，但調查小組成立至今已近兩個月，仍無結果；他多次透過戴遐齡催促調查小組對人證和涉嫌的物證資料進行深入調查，「這關乎到我個人一生最重視的清廉操守」。馬表示，他將委託戴遐齡、基金會委任的律師、會計師及協助調查的國安會前秘書長金溥聰等人，盡快召開記者會，詳細說明事件的始末及相關事實，讓真相大白，以昭公信。馬英九基金會聲明，昨天出席董事會的會計師再次強調，針對基金會內部調查事證中，出現來源不明的所謂「台商捐款」，確無入帳紀錄，三人調查小組應約詢他（指會計師），以釐清事實真相。    ,https://news.ltn.com.tw/news/politics/paper/1755718
翁曉玲促再提名大法官 潘孟安：已14位法學菁英被凌遲,政治,2026/05/22 05:30,國民黨立委翁曉玲昨質疑，賴總統未持續提名已違反憲法義務；總統府秘書長潘孟安則反批，共有十四位法界精英被否決，台灣法學界會對這樣的國會非常心痛。（記者田裕華攝）總統賴清德兩度提出司法院大法官提名名單，被立法院全數否決。國民黨立委翁曉玲昨質疑，賴總統未持續提名已違反憲法義務；總統府秘書長潘孟安則反批，共有十四位法界精英被否決，台灣法學界會對這樣的國會非常心痛，不會接受來這裡被凌遲、霸凌。司法院設大法官十五人，任期八年且不得連任。前司法院長許宗力等七位大法官於二〇二四年十月底屆滿卸任，賴總統先後提兩次大法官提名名單、共計十四人，皆遭立院否決，現任大法官僅剩謝銘洋、呂太郎、楊惠欽、蔡宗珍、蔡彩貞、朱富美、陳忠五、尤伯祥等八人。請繼續往下閱讀...立院司法及法制委員會昨審查今年度中央政府總預算案關於總統府主管收支部分。翁曉玲質詢指出，賴總統在兩年內不公布國會通過的五部法律，這是非常嚴重的違憲亂政。潘孟安反駁，立法院通過的法律已有多少案子被判定違憲？國會總不能任意自大，要叫總統公布一個窒礙難行的法案，總統及行政院並非橡皮圖章，這是權力分立制衡的五權憲法原則。未等潘孟安說完，翁曉玲便搶先抨擊，總統不是憲法法庭、大法官，無權自行宣告法律違憲，已違反第一個憲法義務；至於第二個憲法義務，大法官已缺額一年半，賴清德縱使曾提過兩次名單，但立法院審議不通過後，仍應基於憲法忠誠義務持續提名，而非讓大法官謝銘洋持續代理司法院長。潘孟安則表示，賴總統已送了兩次大法官人選，均遭立法院否決，「妳說還要再送嗎？要持續被你們否決嗎？」台灣法學界對這樣的國會非常心痛，所有法學精英不會接受來這邊被凌遲、霸凌，「我們也會適時提出」。潘：大法官提名 屬於總統職權潘孟安會後受訪說明，大法官提名是總統決定，他回應僅說明整個過程和事實，沒有講要或不要送，要不要送（提名名單）屬於總統職權。    ,https://news.ltn.com.tw/news/politics/paper/1755717
同台鄭麗文20秒閃人 李四川︰趕行程,政治,2026/05/22 05:30,全國公教軍警消聯合總會昨辦「力挺李四川團結大會」，國民黨主席鄭麗文（左二）與新北市長參選人李四川（右二）兩人短暫同台約廿秒。（記者黃政嘉攝）全國公教軍警消聯合總會昨在國民黨新北市黨部舉辦「力挺李四川團結大會」，國民黨新北市長參選人李四川在台上致詞時，國民黨主席鄭麗文抵達會場，雙方同台約廿秒，李四川便指著手錶向鄭說他要趕下個行程，相互微笑握手致意後，李四川就匆忙離去，甚至沒有合照，場面尷尬。匆忙離去沒合照 場面尷尬李四川事後回應，因行程排很滿，他跟鄭麗文報告要跑下個行程，鄭麗文也知道他參選的時間較晚，希望能盡快走遍廿九個區，「我們打個招呼，她也希望我盡快再去跑行程」，包含等她、握手、跟她說話的過程應該不只廿秒。李四川表示，只要對選舉有利，不管是鄭麗文或所有人，他都會邀請（同台）。請繼續往下閱讀...鄭麗文致詞時說，「川伯」是帶錘子要來做事的，四十年的公務員，沒有瑕疵，絕對禁得起考驗，感謝新北市民對國民黨的信任，未來李四川團隊只會加倍付出。鄭麗文離開時，面對媒體詢問是否覺得自己是票房毒藥、與李四川同台時間太短暫等問題皆未回應。喊「李四川凍蒜」 李不在台上民進黨新北市議員卓冠廷表示，現場喊「李四川凍蒜」時，李四川卻不在台上，一個在國民黨中央舉辦挺李四川的活動，居然見到黨主席只簡單互動廿秒，「這不就是害怕鄭麗文這個票房毒藥嗎」？綠︰鄭是票房毒藥 李嚇壞民進黨新北市議員張嘉玲說，理論上鄭麗文、李四川應該是兩個手牽手喊「凍蒜」，結果李四川跟鄭麗文說時間到了，他要走了，「這根本就是嚇壞了，趕快跑啊，這種『票房毒藥』，誰敢跟她同台」。張嘉玲說，很多縣市首長、縣市長參選人跟議員看到鄭麗文來，嚇都嚇壞了，李四川確定還要跟她同台？    ,https://news.ltn.com.tw/news/politics/paper/1755755
