Title,News_Type,date,content,url
中和毒駕奪命1死1重傷 相驗親友哀戚將擇期解剖,社會,2026/05/24 16:17,林姓姊姊的女兒在警方及犯罪被害人保護協會陪同下前往相驗。（記者陸運鋒攝）毒駕惡男王昶筌昨在新北市中和區景平路、大勇街口，自撞邊緣石後倒車又往前暴衝，撞輾騎機車雙載的林姓姊妹，造成姊姊重傷住院，妹妹全身多處重創急救不治，檢警今天下午前往醫院，相驗死者林姓妹妹遺體，由於死因暫時還不明確，為求慎重起見，將安排擇期解剖。據了解，林姓姊姊的2名女兒及其他親友，今天下午在犯罪被害人保護協會陪同下，前往新店慈濟相驗阿姨的遺體，過程中神情哀戚並未說太多話，而檢察官及法醫相驗約1個小時左右，尚無明確死因。請繼續往下閱讀...至於林姓姊姊經醫院診斷肋骨、骨盆及鼻梁骨折及全身多處擦傷，經緊急開刀後治療後暫無生命危險，但仍在加護病房觀察中，待病況好轉後將再由警方製作筆錄。    ,https://news.ltn.com.tw/news/society/breakingnews/5447889
高雄女逛街遭偷拍 夜市又驚見同一嫌犯,社會,2026/05/24 16:04,警方將偷拍的盧姓男子帶回偵訊。（圖由民眾提供）高雄一家人23日夜間逛百貨公司時，發現男子疑似偷拍30歲著短褲女子情事，沒想到全家轉往瑞豐夜市逛街時，又看到那名疑似偷拍的盧姓男子，女子丈夫向前理論，發現盧男手機內真有2段女子腿部畫面，警方獲報依性騷擾防治法偵辦後移送高市社會局審議裁處。左營分局新莊派出所昨天夜間9時許接獲偷拍報案，被害女子向警方表示，全家到博愛二路百貨公司逛街時，察覺到34歲盧男經未同意持手機拍攝腿部畫面，因為不敢確定而作罷，後來轉往瑞豐夜市，盧男竟也尾隨到了現場，經女子的丈夫察覺後當場喝止，並發現盧男手機內存有相關影片，遂報警處理。請繼續往下閱讀...據了解，盧男手機內有2段不到10秒女子著短褲的腿部畫面，畫面都是在百貨公司內拍攝，將盧男帶回派出所調查，盧男說因為壓力大才會拍攝女子腿部，警方訊後依法處理。    ,https://news.ltn.com.tw/news/society/breakingnews/5447828
宜蘭玉里橋頭臭豆腐礁溪店驚傳火警 消防局派員搶救,社會,2026/05/24 16:00,宜蘭縣玉里橋頭臭豆腐礁溪店，今天下午驚傳火警，消防員射水灌救。（圖由宜縣消防局提供）首次上稿14:26更新時間16:00（新增案情）宜蘭縣玉里橋頭臭豆腐礁溪店，今天（24日）下午1點44分驚傳火警，消防局出動第三大隊、壯圍、宜蘭、礁溪及頭城分隊到場灌救，初步了解，店內客人、員工已及時疏散，沒有人員受困，消防員到場時，現場外部冒出濃煙，布線搶救中。請繼續往下閱讀...玉里橋頭臭豆腐礁溪店位在礁溪鄉礁溪路三段，今天適逢週日，用餐人潮多，火災發生時，民眾打119報案，指稱有火煙冒出，店家緊急疏散客人，消防人員下午1點56分抵達現場，店內濃煙密布，2點10分撲滅火勢，沒有人員傷亡，初判是廚房排油煙機冒煙起火。事發當時，現場目擊者拍下影片傳到社群網站，畫面顯示，玉里橋頭臭豆腐礁溪店冒出火舌，火勢愈燒愈猛烈，客人奪門而出，個個驚魂未定，過沒多久，裡裡外外都是濃煙。玉里橋頭臭豆腐礁溪店位在礁溪鄉礁溪路三段，今天適逢週日，用餐人潮多，火災發生時，民眾打119報案，指稱有火煙冒出，店家緊急疏散客人，消防人員下午1點56分抵達現場，店內濃煙密布，2點10分撲滅火勢，沒有人員傷亡，初判是廚房排油煙機冒煙起火。玉里橋頭臭豆腐礁溪店發生火災，店內濃煙密布，所幸客人及員工及時疏散。（圖由宜縣消防局提供）玉里橋頭臭豆腐礁溪店火警，宜縣消防局初判是廚房排油煙機冒煙起火。（圖由宜縣消防局提供）    ,https://news.ltn.com.tw/news/society/breakingnews/5447777
密室逃脫女員工香消玉殞 6/1懷愛館追思告別,社會,2026/05/24 16:00,圖為落羽之丘。（圖擷取自民政局官網）台北市密室逃脫遊戲店「邏思起子」1名年近3旬的吳姓女員工，5月10日扮演吊死鬼時遭繩索勒頸窒息，送醫搶救一度恢復心跳，15日仍宣告不治。吳姓女員工的母親在社群平台「脆」上發文表示，愛女將長眠於富德公墓落羽之丘，6月1日在懷愛館舉行追思會。由於女兒生前不喜浪費，故不收白包、花籃、花圈與奠禮，只有簡單的離別會。吳姓女員工的母親在文中指出，吳姓女員工已於5月15日平和且安詳地離開去當天使，結束她精彩又溫馨的短暫一生，如今她即將展開另一段嶄新旅程，預告6月1日上午10點在懷愛館景行樓2樓「至孝一廳」舉行追思會，敬邀至親及摯友們參加。請繼續往下閱讀...文中提到，寶貝女兒不喜歡浪費，只有簡單的離別會，屆時會有孩子的好友及同學說說話，並播放其短暫人生的照片和影片，不收白包、花籃、花圈、奠禮，也無獻花、獻果、上香等儀式，「大家的好意，真心感謝」。    ,https://news.ltn.com.tw/news/society/breakingnews/5447863
竹市中華路轉紅燈轎車全速衝 女騎士起步被撞飛翻滾重摔,社會,2026/05/24 15:56,陳女騎機車行經竹市中華路六段巷口，遭闖紅燈轎車連人帶車撞飛。（民眾提供）蘇姓男子昨天上午9點多開車行經新竹市中華路六段路口直行時，疑因闖紅燈全速衝過路口，當場撞上騎乘機車綠燈剛起步的陳女，陳女連人帶車被撞飛，在空中翻滾數圈後重摔落地，當場失去意識送醫搶救。據了解，當時路口號誌已轉為紅燈，多輛車均停下，不料蘇男駕駛的黑色轎車卻毫無減速，依然闖紅燈直行衝過路口。年約20歲的陳女騎乘機車剛從巷口綠燈起步，根本閃躲不及，慘遭蘇男轎車猛烈碰撞，當場被拋飛重摔落地，失去意識躺在路旁。請繼續往下閱讀...竹市消防局接獲民眾報案後，立即出動1車2人趕往救援。救護人員到場發現，受撞擊的陳女肢體多處擦傷、意識不清，經現場緊急處置後，9點44分由救護車緊急送往苗栗為恭醫院搶救，所幸治療後無生命危險。警方表示，蘇男駕駛轎車於中華路六段闖紅燈直行，不慎與陳女騎乘的機車發生碰撞，雙方受傷送醫治療後均無生命危險。針對蘇男未遵守交通號誌的違規行為，警方後續將依道路交通管理處罰條例規定開單告發。    ,https://news.ltn.com.tw/news/society/breakingnews/5447839
駕車不斷閃雙黃燈 台南警攔查赫見「雙彈」法辦毒駕男,社會,2026/05/24 15:53,台南警方將車內藏有喪屍煙彈毒品與兩顆子彈的五十三歲郭姓男子（右者）帶回查辦。（民眾提供）53歲郭姓男子24日凌晨駕駛休旅車行經台南市區成功路、公園路口，不斷閃雙黃燈，南市警二分局員警覺得怪異上前攔查，赫然在郭男車內搜獲3顆依托咪酯（喪屍煙彈）、煙油與2顆子彈；郭男接受唾液快篩出現一、二級毒品的陽性反應，警方訊後依毒品、槍砲、公共危險等罪嫌將郭男移送法辦。南市警二分局員警於5月24日凌晨2點許攔查1輛休旅車，駕駛郭姓男子還質疑說「自己覺得沒有違規，是哪裡違規了？」員警回說「你車子的方向燈使用違反規定」進一步盤查郭男座車，於車內起獲依托咪酯（喪屍煙彈）毒品、煙油及子彈等，將郭男帶回警所調查。    ,https://news.ltn.com.tw/news/society/breakingnews/5447877
讓誰畢生難忘？彰化男車頂保鮮膜綁壽星遊街 二林警約談要罰,社會,2026/05/24 15:36,彰化壽星男被友人用保鮮膜綁在車頂柱子遊街。（民眾提供）彰化二林鎮一名年輕人被朋友用保鮮膜緊緊綑綁在車頂上「遊街示眾」，沿路播放康康的歌曲《快樂鳥日子》，影片被PO上網路引發網友熱議。後來證實「車頂男」當天正是壽星，朋友用這種誇張方式要讓他「畢生難忘」。這名壽星被人用保鮮膜牢牢固定在車頂上遊街，後車廂還大聲播放「Happy Birthday，哈哈哈，嘿嘿嘿，我祝你食甲兩千三百五十歲！」事件發生在23日晚間6點多，畫面被PO上網路。據了解，這部車從大城鄉一路開到二林鎮，距離約7公里，是否一路被綁在車頂上遊街，仍待進一步調查。請繼續往下閱讀...路邊民眾乍看以為是綁架案，後來聽到是生日快樂歌曲，有人隨即對著車大喊「生日快樂」，笑稱現在年輕人愈玩愈大，壽星真難當；也有人表示，這樣做很危險、有礙觀瞻，音樂又開得很大聲，把危險當有趣。二林分駐所副所長洪宗郎指出，針對民眾發文，有民眾被綁在轎車車頂上遊街一事，此行為實在太誇張。經查該車為林姓男子（39歲）駕駛，其行為已違反《道路交通管理處罰條例》第30條第1項第6款規定。警方表示，該所已通知車主林男到案說明，該行為可處新台幣3000元以上、1萬8000元以下罰鍰，並將加強交通違規取締。林男表示，因壽星人緣好，大家才想出「遊街示眾」的點子，希望讓他畢生難忘。    ,https://news.ltn.com.tw/news/society/breakingnews/5447831
竹市食品路轎車暗夜擦撞客運  失控暴衝撞進超商3人傷,社會,2026/05/24 15:28,新竹市21歲溫男今天凌晨1點開車行經新竹市食品路與明湖路口時，與一輛客運發生猛烈擦撞，轎車隨後失控暴衝，撞進路旁超商。（民眾提供）新竹市21歲溫男今天凌晨1點開車搭載2名友人，行經新竹市食品路與明湖路口時，與一輛客運發生猛烈擦撞，轎車隨後失控暴衝，撞進路旁超商，所幸車上3人無生命危險，肇事原因正由警方調查當中。新竹市消防局指出，今天凌晨約1點接獲民眾通報，指食品路和明湖路口發生客運與汽車擦撞意外，現場疑有2人受困。消防人員於凌晨1點10分抵達現場，確認現場為客運與汽車碰撞，車內原本受困的2名傷患已自行脫困，共計3人受到輕重傷。請繼續往下閱讀...消防局表示，救護人員到場後，立即對3名傷患初步救護。乘客38歲楊男意識清醒，臉部有約5公分的割傷且胸部疼痛；37歲黃男意識清楚，頭部有約10公分的撕裂傷及肢體擦挫傷；駕駛溫男則意識清楚、臉部擦挫傷，3名傷患送醫後無生命危險。警方說明，溫男駕駛轎車搭載楊男及黃男2人，在明湖路與食品路口與客運發生碰撞，轎車失控波及路旁便利商店，溫男等3人受傷送醫，均無生命危險。警方獲報後迅速到場採證，雙方駕駛酒測與毒測均呈陰性反應，全案肇事原因調查當中。    ,https://news.ltn.com.tw/news/society/breakingnews/5447830
離島不是化外之地 望安警分局同步實施毒駕攔檢,社會,2026/05/24 15:24,望安警分局在潭門港，同步實施毒駕攔截勤務。（望安警分局提供）以往澎湖離島常見不戴安全帽騎車景象，被外界視為「化外之地」。望安警分局為響應警政署「全國同步強化查緝毒駕及打擊喪屍煙毒」專案，因應近期新興毒品與毒駕引發的社會高度關注，今（24）日在海運交通要衢潭門港實施攔截，打破外界刻板印象。澎湖縣政府警察局望安分局，今日結合「南海之星」及民間觀光遊艇入轄的尖峰時段，在潭門港周邊部署專案路檢。此次行動由分局長許德海帶隊坐鎮指揮，展現警方淨化離島治安、守護鄉民安全的鐵腕決心。請繼續往下閱讀...望安警分局表示，未來將針對轄內易發生毒駕與危險駕車的高風險時段及路段，密切配合每日交通船與民間快艇的進港時段，彈性規劃路檢攔查與機動巡查。同時勤務將與常態巡邏、守望深度結合，全面拉高對可疑人車的查察與取締強度。勤務攔檢將精準聚焦於駕駛人是否出現精神恍惚、反應遲緩或明顯酒容等異常跡象；此外，針對車內是否散發異常燃燒味、化學性電子菸氣味等疑似毒駕徵候，警方也將進行嚴密過濾，誓從源頭阻斷毒品流入離島。望安分局長許德海強調，毒後駕車不僅是漠視自身性命，更是對無辜用路人生命安全的嚴重威脅。警方將持續透過專案執法、機動攔查及交通安全宣導等多元策略，全力遏止毒駕事故發生。亦呼籲民眾切勿心存僥倖、以身試法，共同營造安全有序的交通環境外，也特別叮嚀執勤同仁務必落實「執勤三安」原則，在確保自身、同僚及民眾安全的前提下，讓執法過程萬無一失。離島不是化外之地，望安警分局加強各類專案勤務。（望安警分局提供）    ,https://news.ltn.com.tw/news/society/breakingnews/5447805
前鎮公園離譜打童事件 3歲男童遭陌生婦人掌摑墜地,社會,2026/05/24 15:09,方姓婦人掌摑3歲幼童，警方訊後送辦。（民眾提供）高雄市前鎮區興仁公園23日許發生離譜傷害兒童事件，46歲方姓婦人在3歲楊姓男童父母面前，用力掌摑他致從搖搖馬摔落地面，方婦竟向警方稱男童罵她「妳吃屎」才會動手，楊姓父母氣炸，表示孩子根本不會講台語，2人也沒有互動，堅持提出告訴，警方依法送辦。前鎮分局前鎮街派出所昨天傍晚5時接獲110傷害報案，經查，楊姓男子陪同妻子及3歲兒子於公園遊玩時，方姓婦人突然走過來掌摑楊童左臉，強勁力道害男童從搖搖馬墜落，嚇得嚎啕大哭，楊父立即上前護子並報案。請繼續往下閱讀...方婦向警方說，她與男童言語互動時，男童用「妳吃屎」（台語）辱罵她，才會情緒失控下竟徒手掌摑幼童左臉。楊父說，事發時與妻子就坐在一旁，方女走過來後突然出手掌摑孩子，2人全程未對話，且孩子根本不會講台語，不可能用台語罵他。家屬已帶孩童前往醫院驗傷，幼童臉部紅腫，並將提出傷害告訴。前鎮分局分局長黃元民強調，對於任何涉及未成年孩童的暴力行為絕不寬貸，全案將依觸犯傷害罪及兒童及少年福利與權益保障法等罪嫌移請高雄地方檢察署偵辦。    ,https://news.ltn.com.tw/news/society/breakingnews/5447795
拐童大媽團現身？她攜子逛故宮南院 8歲童險被婦人帶走,社會,2026/05/24 14:54,1名女子攜子逛故宮南院，小孩險被婦人帶走。（民眾提供）拐童大媽團現身？彰化市1對夫婦昨天（23日）帶著8歲兒子到嘉義故宮南院遊玩參觀，不料就在逛兒童創意中心時，女子只是離開去找丈夫，一回頭竟發現1名中年婦人拉著兒子在攀談，還疑似要把她兒子帶走，她嚇得趕緊上前把兒子帶離開，婦人即悻悻然離去，兒子對她說「我好害怕，婦人突然出現在我後面」，讓她不禁懷疑是否有不法團體專門誘拐兒童從事不法，令人毛骨悚然，呼籲大家小心防範。該名女子說，昨天她與丈夫帶著8歲兒子到故宮南院參觀，參觀途中丈夫到其他展館，她與兒子則到兒童創意中心，期間她走出去要找丈夫時，突然一個回頭，發現1名中年婦人竟拉著她兒子在講話，且打開包包疑似要拿東西，她嚇得趕緊上前把兒子帶開，該名婦人即快步離去，她也跟出去要盯著對方，但婦人旋即不見蹤影。請繼續往下閱讀...女子指出，婦人靠近並疑似要引導兒子走向另一方向，在看到她靠近時才趕快離開，過程宛如誘拐，事後想起全身冒冷汗，現在中國活摘器官的風氣，讓人想起是否有不法集團專門誘拐小孩去做壞事；當下她也太緊張沒有拍照，不過婦人穿著就像鄰家大媽，看起來和藹可親，就是這樣才會讓人毫無戒心。還好她平時就有向孩子宣導，不可拿陌生人的東西；呼籲大家在外一定要緊緊牽著孩子的手，不要讓小孩離開視線。    ,https://news.ltn.com.tw/news/society/breakingnews/5447812
出租房屋卻變2死「凶宅」 殺人兇嫌判賠屋主上百萬損失,社會,2026/05/24 14:48,陳姓男子持刀闖入民宅殺害2名友人，逃逸時受傷被逮。（資料照）桃園市觀音區1處民宅去年8月2日發生2死命案，47歲陳姓兇嫌僅因3萬多元債務，持刀殺害林姓及盧姓男子，現場變成兩死凶宅，屋主對陳男提告求償，桃園地院判決陳男須賠償房屋價值減損及屋主租金損失失共144萬9615元。從事臨時工的陳男，當天趁著凌晨時分持刀闖入，先在2樓房間朝38歲林男胸口猛刺數刀，林男倒地後，陳再對躲在廁所的45歲盧男連續揮刀刺殺，陳男行兇後從2樓跳下逃逸，但因雙腳受傷無法行走，被獲報趕抵的員警當場逮捕，林、盧兩人送醫後均因傷重宣告不治。請繼續往下閱讀...屋主主張，他於2025年3月2日將房屋承租給盧男，租期至隔年3月1日，每月租金6500元，陳男闖入行兇不僅造成房屋成了凶宅，盧男因死亡也無法再支付後續租金，因此向陳男求償房屋價值貶損的損害141萬0615元，以及6個月的租金損失；陳男已被依殺人起訴，全案於桃園地院審理，對於屋主提出的民事求償，他未於言詞辯論日期到場，也未提出書狀聲明或陳述。判決指出，民法規定故意以背於良善風俗之方法加損害於他人者，應付損害賠償責任，陳男殺人行為是社會道德無法接受，自屬背於善良風俗；另依內政部公布的「成屋買賣定型化契約應記載及不得記載事項」，其中的附件「建物現況確認書」，以及強制執行法等，均有要求勾選或載明買賣建物有無發生過兇殺等非自然死亡情事，足見兇殺等事件縱然未對房屋造成物理損壞或使用效能，仍會因一般民眾對凶宅有嫌惡、畏懼等心理因素，造成房屋在不動產交易市場接受度降低，並影響買賣價格或出租收益。判決指出，陳男在行兇時，主觀上對殺人將導致房屋變成凶宅有所認知，卻仍執意為之，其殺人行為與房屋價值減損具有因果關係，依據不動產估價師鑑定報告，該房屋在兇案發生前的價值為348萬3000元，發生後降至207萬2385元，減損141萬0615元，而陳男殺害盧男後導致屋主無法繼續收取租金，屋主求償租金損亦應予准許，總計陳男應給付屋主144萬9615元，可上訴。    ,https://news.ltn.com.tw/news/society/breakingnews/5447773
屏東男子到處翻機車置物箱 警依竊盜未遂移送,社會,2026/05/24 14:17,44歲李姓男嫌（右）翻找機車置物箱意圖行竊，被警方依竊盜未遂罪嫌移送。（圖由屏東警分局提供）屏東市仁愛路近來出現1名行跡可疑男子，到處亂翻找停在路邊的機車，開座椅下的置物箱或摸腳踏墊上方的置物箱，民眾發現後PO網互相提醒小心；屏東警分局今（24）日表示，已在凌晨查緝到涉案的李姓男子，依竊盜未遂罪嫌移送。屏東警分局表示，屏東市仁愛路段23日晚上9點多，出現1名男子隨意開啟他人機車置物箱，警方獲悉後掌握犯嫌涉案情形立即展開調查。經查涉案者為44歲李姓男子，在案發路段徒手翻找2部普通重型機車置物箱意圖行竊，但均未取得財物便離去。請繼續往下閱讀...警方鎖定嫌犯身分後掌握行蹤，隨即展開查緝，在今（24）日凌晨0時30分將李嫌查緝到案，帶返派出所說明，同時通知受害車主製作筆錄，全案依竊盜未遂罪嫌函請屏東地檢署偵辦。    ,https://news.ltn.com.tw/news/society/breakingnews/5447738
醉女癱倒路中2警無奈拖拉她上警車 網友：警察真辛苦,社會,2026/05/24 14:15,徐女泥醉倒在路中間，警方要將人拉到路邊，她還不斷反抗。（記者姚岳宏翻攝）台北市信義夜店區今凌晨1時許發生酒醉鬧劇，徐姓女子酒後與丈夫在松壽路16巷口拉扯，遭路過民眾誤認為「撿屍」上前攔阻，進而引發推擠衝突，警方獲報到場隔開雙方，因徐女泥醉癱倒路中，2名員警合力將她拖拉至路旁並實施保護管束，事發影片在網路上引發熱議。社群平台上曝光影片顯示，當時徐女完全爛醉並癱軟在馬路中央，2名處理員警無奈下，只能1人一邊拉住徐女手臂，將她拖到路旁安全處，影片曝光後，不少網友紛紛在底下留言，直呼現在的警察真的非常辛苦。請繼續往下閱讀...轄區信義分局三張犁派出所指出，這起事件的起因是徐女酒後情緒不穩，其丈夫在現場試圖安撫並勸她返家，卻引來熱心民眾誤會男方意圖不軌，雙方溝通過程產生口角與肢體推擠，警方趕抵現場後將雙方隔離勸阻，才沒有讓衝突進一步擴大。事後參與衝突的當事人都不打算提出刑事告訴，不過為維護社會公共秩序，警方仍依社會秩序維護法將相關人等移請偵辦。至於喝醉的徐女，因已影響到自身與他人的安全，員警依警察職權行使法第19條規定進行保護管束，直到她情緒平復後，才交由家屬陪同帶回家。警方也呼籲民眾飲酒應適量，遇到糾紛務必保持理性，避免因誤會或一時衝動引發肢體衝突而觸法。警方到場處理。（記者姚岳宏翻攝）    ,https://news.ltn.com.tw/news/society/breakingnews/5447733
東北角濱海公路驚悚車禍！7旬翁開車進撞上 紅牌重機騎士命危,社會,2026/05/24 13:53,簡男被撞後機車全毀，失去呼吸、心跳。（記者吳昇儒翻攝）75歲李姓男子今日中午駕車行經新北市貢寮區台2線92.5公里處時，不慎與對向直行的大型重型機車發生猛烈碰撞，導致52歲簡姓重機騎士當場失去呼吸心跳（OHCA）。救護人員緊急將傷者送往貢寮衛生所澳底醫療救護中心搶救，情況並不樂觀，肇事原因則待警方進一步釐清。新北市警局瑞芳分局今日中午12時19分接獲報案，指稱貢寮區台2線92.5公里處發生車禍。警方趕往現場調查，初步了解75歲李姓男子當時駕車，從基隆往宜蘭方向行駛，行經該路段時準備左轉進入一旁的停車場。請繼續往下閱讀...未料，李男轉向時，不慎與對向直行、重型機車發生碰撞，導致52歲簡姓騎士當場倒地，失去生命跡象。救護人員抵達後，當場對簡男進行心肺復甦術（CPR）急救，但仍未恢復呼吸心跳，趕緊將人送往澳底醫療救護中心進行全力搶救。此外，該起車禍的強大衝擊力波及停放在停車場內轎車受損，'所幸事故現場車輛並未占用主要車道，並未影響車輛通行。警方調查，李男的酒測值為0.0MG/L，暫排除酒駕嫌疑；簡男的酒測值，則依法委託醫院代為進行抽血檢測，現已通知分局偵查隊鑑識人員前往現場進行採證與測繪，釐清事故原因。撞擊力道猛烈，車輛殘骸散落一地。（記者吳昇儒翻攝）    ,https://news.ltn.com.tw/news/society/breakingnews/5447743
台3線獅潭段重機失控衝撞！ 越南籍遊客觀戰「追焦」遭撞 騎士、遊客皆骨折,社會,2026/05/24 13:51,台3線獅潭段重機失控衝撞！越南籍遊客觀戰「追焦」遭撞，騎士、遊客皆骨折。圖為傷者送醫畫面。（民眾提供）苗栗縣獅潭鄉台3線120公里處（往獅潭方向）發生一起交通事故，一名25歲吳姓男子駕駛黃牌大型重型機車，行經該路段時不慎失控，直接衝撞2名正在路邊觀賞重機奔馳的越南籍遊客，越南籍女遊客右小腿開放性骨折、男遊客頭部撕裂傷、機車男騎士右手骨折。苗栗縣府消防局指出，今日早上8點多接獲警方轉報後，立即派遣3車6人趕赴現場緊急救援。現場共有3名傷者，其中26歲的越南籍女性遊客傷勢較為嚴重，右小腿呈現開放性骨折，另一名22歲的越南籍男性遊客則有頭部約2公分撕裂傷及左大腿擦傷；至於肇事的25歲吳姓重機騎士，現場右手骨折、口鼻出血。請繼續往下閱讀...救護人員在現場迅速為傷者進行包紮止血與骨折固定，隨後立即將3人送往醫院救治，警方指出，兩名越南籍觀光客事發當時正在該處觀賞台3線的重機奔馳，不料發生意外。詳細車禍原因與肇事責任，正由警方進一步調查釐清中。大湖警分局呼籲，轄區台3線獅潭路段彎道路段多，假日時常吸引民眾前往，導致多數路段易為事故熱點，用路人駕駛車輛須注意路況、保持專注與安全距離，務必遵守交通安全規則切勿違規，避免事故發生，維護用路人安全。    ,https://news.ltn.com.tw/news/society/breakingnews/5447704
