Title,News_Type,date,content,url
川普稱將與賴清德通話 民進黨團：突破歷史新進程,政治,2026/05/21 12:33,民進黨立院黨團書記長范雲。（記者田裕華攝）美國總統川普一週內兩度公開提及，將就軍售與台灣總統談話，民進黨立院黨團今日表示，黨團樂觀其成，若川普跟賴總統通話，也是突破歷史的一個新進程，從川普日前公開受訪、美國務院的訊息顯見，美國對台軍售只會和台灣討論，不會接受任何人威脅。黨團書記長范雲指出，賴總統昨在520記者會時有回應，若與川普通話，會表達四點重要原則包含，第一，台灣是台海和平穩定的守護者；第二，破壞台海與區域穩定的是中國；第三，台灣會持續強化自我防衛的能力，也會持續增加國防預算；中華民國台灣是個主權獨立的國家，沒有任何國家有權力併吞台灣，台灣也會跟民主盟友繼續合作努力，維繫台海的和平，相信全民會支持總統這樣的表達。請繼續往下閱讀...此外，原定美國官員預計訪問中國，如今全都遭中國決議暫緩，待美方將軍售處理完畢後才會放行。范雲直言，長期觀察美中關係的人都會發現，中國生氣的門檻非常低，他們再次生氣，民進黨團一點都不意外。范雲強調，美國務院上午發布新訊息，確定台灣關係法、6大保證並無改變，包含川普2度表態要和賴清德總統通話，態度相當明確，意即美國對台軍售只會和台灣討論，不會接受任何人威脅。川普在訪中上機前也告訴大家，中國國家主席習近平不斷和他表態，不過他沒有任何評論。她認為，這部分就回到台灣自身應該努力，與其憂心中國到底生不生氣，不如強化國防能力，把被刪除的4000多億國防預算補上。針對國民黨立委憂心，川普與賴清德通話是否代表第二波軍購發價書可能出現異動，或向台索取更多籌碼。范雲回應，在野黨經常就是不通話要罵，通話也要罵，有許多以各種「擔憂」為名的反對，重點在於台灣自身是否全力支持國防預算增加與國防能力提升。范雲認為，外交是內政的延伸，川習會之後，美國媒體曾進行調查，詢問美國民眾是否支持軍售台灣，有超過七成美國民眾支持美國對台軍售，美方「台灣關係法」也確立對美國支持台灣防衛能力的法律基礎；對台灣而言，應擔心是內部政黨是否刻意阻撓台灣取得防衛武器、無人機產業。    ,https://news.ltn.com.tw/news/politics/breakingnews/5444521
統一若是北京唯一選項 學者：兩岸關係只剩時間表,政治,2026/05/21 12:31,台北海洋科技大學21日舉行「賴總統就職二週年及川習會後的兩岸情勢」座談會，中興大學國際政治研究所教授譚偉恩（左起）、中央警察大學國境警察學系助理教授王智盛、東吳大學政治學系副教授陳方隅、台北海洋科技大學通識中心助理教授吳瑟致、台灣韜略學會副理事長張宇韶、台北海洋科技大學助理教授林威志等人出席。（記者羅沛德攝）「賴總統就職二週年及川習會後的兩岸情勢」座談會，今日在台北海洋科技大學登場。中興大學國際政治研究所教授譚偉恩表示，對中國而言，任何不承認九二共識的政治勢力，在北京眼中都會視為敵人「如果統一是北京堅持的唯一選項，兩岸關係就只剩下時間表而已」。譚偉恩指出，總統就職二週年是在台灣民主化30年的過程之中，他會跟川習會、鄭習會、普習會做一些討論。以習近平為中心的3場會晤，國民黨主席鄭麗文去北京見習近平，從國民黨內部屬性來看，這是政治安排所做的互動，複刻過去國民黨的模式，鄭想要贏得在國內話語權，實際上無法帶來台海安全的穩定。請繼續往下閱讀...川習會部分，譚偉恩談及，川普有美國期中選舉和對外壓力不得不去跟習近平見面，希望中國協助處理伊朗問題及美國部分經濟壓力，這是川普訪中主要目的，至於討論對台軍售比較是像儀式性的意義。普廷與習近平的會面，近年俄羅斯仰賴中共的比例逐漸升高，這次是普廷有求助於習近平的需求，所以是普廷去中國見習近平。譚偉恩分析，中國在區域的影響力漸漸增加，對台灣而言是負面訊號，但並不代表台灣毫無任何籌碼。賴總統昨天說台灣命運不能淪為他國的籌碼，總統看到華府、國內在野黨紛紛去跟習近平的見面，也認為台灣必須要有自主性。譚偉恩提到，從國台辦回應總統談話，主要是對接受九二共識及一中原則的立場。對中國而言，可以看出「任何不承認九二共識的政治勢力，在北京眼中都會視為敵人，如果統一是北京堅持的唯一選項，兩岸關係就只剩下時間表而已」。東吳大學政治學系副教授陳方隅表示，以兩岸關係來看，台灣是在大國夾縫當中求生存，然後慢慢推進實質獨立。李登輝總統卸任前提出「特殊的國與國關係」，後來2000年修正「國籍法」，把國籍定義在中華民國，而不是中華人民共和國，將中華民國與中華人民共和國切開，其實就是互不隸屬。陳方隅指出，川習會後，對台灣而言是一則以喜、一則以憂，目前華府認為東亞的麻煩製造者是中國，而且2018年後美國媒體都相當一致反中，這是沒有辦法回頭的，至於川普對中國的態度一直都曖昧不明的。陳方隅表示，習近平這次會面是在「洗腦」川普，可以看出川普會後接受福斯電視台訪問所說的是中共觀點，習近平成功將其觀點刻在川普的腦中，這是習近平的大得分。陳方隅說，不過，川普身邊的人正努力要把川普拉回來，至於美國政府、美國國會及智庫對台觀點是一致，說不定台灣會因禍得福，因為川普已說要跟賴清德總統通話，所以台灣不必太過關心，不用擔心台美關係出現裂痕。他強調，接下來兩岸關係不會有太大改變，因為兩岸關係是決定於中國。近期很多人要民進黨廢除台獨黨綱，只能說台灣有很多「有用的白痴」，即便廢除了台獨黨綱，它還是有理由可任意指控你是台獨，中國的要求是不可能停止下來的，不必太理會中國。    ,https://news.ltn.com.tw/news/politics/breakingnews/5444514
買波音當籌碼延後美對台軍售？ 黃重諺曝中國「分階段」議程,政治,2026/05/21 12:31,川習會5月在中國北京登場，但沒有重大突破，習近平（左）9月訪美可能是關鍵。（路透社檔案照）針對美中領導人川普、習近平的會談，國安會諮詢委員黃重諺今表示，今年還會有很多次「川習會」，從中國的角度，其實是將議程「分階段管理」；這次中國買200架波音，卻一度出現600架的數字，他認為中國是切成幾個節點，台灣軍售要不要延後、美國要不要調降，再200架、200架的談。黃重諺指出，撇開談到區域或台灣議題上的部分，今年還會有很多次「川習會」，包括9月24日中國國家主席習近平回訪美國，緊接著還有今年G20的、APEC，從中國的角度來說，其實是將今年的全議程「分階段管理」。請繼續往下閱讀...黃重諺表示，就這次「川習會」而言，中方除了對台灣議題窮追猛打，其他沒有特別成果，換個角度來說，美方也是，比如對伊朗的無核化，或是今年由美國主持的G20，希望雙方互相支持，到時候不要抵制或不參加等。黃重諺進一步表示，很明顯是2017年「川習會」後，有一筆2500億美元的大採購，包括大量的波音飛機採購案，當時也有很多其他對美投資的承諾，不過所有人都知道當時大部分沒有兌現，才會造成2018、19之後美中貿易戰的展開。黃重諺指出，這次說要買200架波音，其實一度在媒體出現過600架的數字。他認為，中國是切成幾個節點，先給200架，接下來看台灣軍售要不要延？要不要按照中國的意思？美國要不要調降關稅？要處理的話，下次再200架，以為可以這樣處理美國。    ,https://news.ltn.com.tw/news/politics/breakingnews/5444557
川普欲通話賴清德   林沛祥稱川普不可捉摸  致電盧蔣都不驚訝,政治,2026/05/21 12:26,"立院國民黨團今召開「揭密綠能吃飽、無人機再撈通吃內幕」記者會，黨團書記長林沛祥（中）受訪回應川賴可望通話等時事議題。（記者田裕華攝）美國總統川普昨表態將與總統賴清德通話，對此，立法院國民黨團書記長林沛祥今表示，川普特性不可捉摸，搞不好不小心給台中市長盧秀燕、台北市長蔣萬安打電話都不用驚訝，他並奉勸執政高層，一味妖魔化中國卻不知其面貌，對我方毫無幫助。林沛祥指出，川普原文是「I'll speak to everyone who's involved」，川普最大的特性就是不可捉摸，所以會忽然給誰打電話，搞不好不小心給盧秀燕打電話，給蔣萬安打電話，給誰打電話都不會驚訝，2017年川普也有打電話給時任總統蔡英文，賴清德不是第一個。請繼續往下閱讀...林沛祥表示，川普把過去幾十年台美關係最重要的「台灣關係法」、「六項保證」等全部推翻，直接與中國談對台軍售該怎麼處理，這是以前美國講過的話，都是對中國反悔，這是頭一次對中華民國反悔。彭博把這事情寫出來是好事，且他認為有溝通都是好事，不管是美台還是美中，還是中國與台灣之間的交流，有交流總是好事。林沛祥引用名言「Be close with your friends, but be closer with your enemies.」（跟你的朋友保持親近，但更應跟你的敵人保持親近），因為當想對抗、競爭的話，不可能對於對方什麼都不知道。這句名言他送給現在的執政高層，一味妖魔化中國，不知道中國長什麼樣子，其實對我方一點幫助都沒有。    ",https://news.ltn.com.tw/news/politics/breakingnews/5444509
共軍犯台恐回「改革開放前」 黃重諺：老共最忌憚台灣這3大利器,政治,2026/05/21 12:25,黃重諺分析，老共在國防特別條例不外乎在乎三個部分：遠距精準打擊、台灣之盾、無人機。圖為海馬士多管火箭系統。（資料照）國安會諮詢委員黃重諺今揭露，中國花非常大力氣干預美國對台軍售，並持續拖延我方防衛部署，中共高度忌憚我國1.25兆國防特別預算，尤其是遠距精準打擊、台灣之盾和無人機三部分。中方評估，若台灣七大防衛能力到位，共軍在台海妄動將付出慘重代價，「不敢說回到解放前、至少會回到改革開放前，所以他在意」。黃重諺接受廣播專訪指出，美方這段期間一再重申，「美國對台政策沒有改變」，他們也都不支持任何片面改變現狀，不只是因為在《台灣關係法》中，美國對台灣一個特殊的關係跟承諾，更重要是從《美國國家安全戰略》來說，台灣就是其在第一島鏈、西太平洋的核心利益。請繼續往下閱讀...談及中國短期很難撼動美國政策，只能干預美國對台軍售，黃重諺坦言，中國花非常大的力氣做這件事，我國整體議程的安排從一開始就不太順利，去年11月26日提出來後，在國會拖非常久，直到今年3月才處理、5月才通過，中間有非常長的時間，不知道為什麼一定要停在那裡，但所有人都知道中國因素非常高。被問及「中國不只對美國下手，對國內也有施力？」黃重諺說，這一點都不意外，這段期間把台灣說成挑釁者、把強化國防扭曲成「倚美謀獨」、「以武謀獨」，這類敘事不只是國台辦天天講、國內也常常聽到，而且是拿來當成擋軍購、阻止重要安全投資的理由，近日很多重要裝備的預算也開始被大規模凍結。黃重諺指出，中國如果要阻擋台灣的建軍，其實不一定直接在立法院以刪除預算作為結果，拖延也可以、延緩部署也可以，這些都是。他也分析，老共在這次國防特別條例不外乎在乎三個部分：遠距精準打擊、台灣之盾、無人機。首先，黃重諺表示，遠距精準打擊確實打破中國以往認知的，第一時間用遠火「洗地」，他們現在發現如果我方有高機動性多管火箭系統（HIMARS，海馬士），或有其他遠距精準打擊裝備，再加上智慧指管等，能進行快速的火力協調決策時，前述的佈局就會被打壞。第二，台灣之盾，黃重諺指出，如果台灣之盾被完整起來，未來共軍如果要「洗地」或破壞關鍵基礎設施的作為，就會被打折扣，而且是大打折扣，只要在戰術上持續消耗敵方的可能性，就能確保後續的安全。老共操作認知戰，就是希望國人每天心裡都很害怕，達成「首戰即終戰」的目標，最好還沒發動第一波你們就已經放棄了。最後就是無人機，黃重諺指出，這次國防特別條例中的七大防衛能力，其實是經過我方根據共軍可能作為不斷的模擬所做的整備，其實中方也有評估，一旦我們七大防衛能力到位，中共可能第一波就遇到非常慘重的代價，「不敢說他回到解放前，但至少會回到改革開放前說不定，所以他在意」。被問到這種情況發生，不就等於中共20年來的「軍事現代化」白做工？黃重諺說，確實如此，不管是空中、水下或者是水上各種無人機部署跟戰力的形成，即便像美國這樣的大國，遇到伊朗也非常困擾，更何況是以台灣的工業能力，若能形成有效戰力，任何人要在台海周邊妄動，都會帶來極高風險。國防部日前公布，「強化防衛韌性及不對稱戰力特別預算」籌獲項目包括精準火砲、遠程精準打擊飛彈、防空、反彈道及反裝甲飛彈（台灣之盾）、無人載具及其反制系統、強化作戰持續量能相關裝備、AI輔助與C5ISR系統及台美共同研發及採購之裝備、系統共7類。    ,https://news.ltn.com.tw/news/politics/breakingnews/5444532
新加坡首屆台灣蔬食國際美食節月底登場 運用AI推出雙語宣傳曲,政治,2026/05/21 12:23,駐新加坡代表處為推廣即將於5月底登場的首屆台灣蔬食國際美食節，創新運用人工智慧（AI）技術，首度推出華語與英語雙語宣傳歌曲。（圖擷取自YouTube）為推廣即將於5月底登場的首屆台灣蔬食國際美食節（Taiwan International Plant-Based Festival），駐新加坡代表童振源表示，代表處創新運用人工智慧（AI）技術，首度推出華語與英語雙語宣傳歌曲，展現台灣結合科技創新、文化創意與蔬食外交的嶄新能量，為台灣運用科技推動文化與農業開創嶄新模式。童振源今日於社群媒體指出，駐新加坡代表處運用Gemini協助填詞，並融合台灣流行音樂與國際流行樂風元素進行編曲，打造華語歌曲「台星交輝・蔬食盛宴」及英文歌曲「Taiwan and Singapore Shining Together: A Vegan Banquet」2首宣傳單曲，以創新多元方式向新加坡社會推廣台灣優質蔬食文化與高端農產品。請繼續往下閱讀...童振源說明，2首歌曲皆以輕快明亮、充滿活力的現代流行音樂風格呈現，透過科技與音樂的創新結合，巧妙融入台灣與新加坡文化交流意象，以及蔬食健康、永續與環保理念。歌曲內容以「台星友誼、健康蔬食與永續生活」為主軸。華語歌曲「台星交輝・蔬食盛宴」描繪台灣與新加坡攜手推廣蔬食理念的情誼，透過溫暖且富節奏感的旋律，展現蔬食帶來的幸福感與人文關懷；英文歌曲「Taiwan and Singapore Shining Together: A Vegan Banquet」則以國際化語言傳遞綠色飲食、環境永續與跨文化共享美食的理念，展現台灣蔬食文化兼具創意、美味與環保價值，期盼藉由音樂感染力，引發更多民眾對健康飲食與永續生活方式的共鳴。童振源表示，本次台灣蔬食國際美食節由駐新加坡代表處攜手台灣農業部，以及榮獲米其林綠星肯定的「陽明春天」純淨素餐飲集團共同策劃舉辦，首度在新加坡全面推廣台灣蔬食文化。活動希望透過台灣高端精緻蔬果與蔬食料理，將台灣農業品牌與健康永續理念帶入國際餐桌，進一步提升台灣蔬果在新加坡市場的形象與價值。童振源表示，台灣蔬食文化享譽國際，此次首度嘗試以AI創作雙語歌曲，不僅展現科技外交的創新實踐，也希望透過跨越語言與國界的音樂形式，吸引更多新加坡民眾及國際友人認識台灣精緻多元的蔬食文化，深化台星雙邊文化、美食與農業交流。此次活動也象徵台灣將數位創新、文化外交與農業品牌行銷相互結合，為國際推廣注入嶄新元素。台灣蔬食國際美食節系列活動預計自5月底展開並持續至9月底，包括5月31日至6月1日於佛光山新加坡分會舉辦蔬食烹飪交流與蔬食義賣活動；6月6日於慈濟基金會新加坡分會舉辦蔬食教育論壇；以及7月1日至9月30日於四川豆花飯莊推出期間限定蔬食料理。    ,https://news.ltn.com.tw/news/politics/breakingnews/5444475
川普頻喊台灣偷走美國半導體 潘孟安：這當然不是事實,政治,2026/05/21 12:22,立法院司法及法制委員會審查115年度中央政府總預算案關於總統府主管收支部分，總統府秘書長潘孟安與國安會秘書長吳釗燮兩人一同列席備詢。（記者田裕華攝）美國總統川普多次公開指控．台灣偷走美國的半導體及晶片。對此，我國總統府秘書長潘孟安今（21日）強調，「這當然不是事實」，台灣半導體是歷經30年的技術淬煉與供應鏈提升才有如今地位，政府關稅談判團隊已向美方說明產業結構，美國相關部會都非常清楚。立法院司法及法制委員會今天上午審查115年度中央政府總預算案關於總統府主管（不含中央研究院）收支部分。國民黨立委洪孟楷質詢時指出，川普不只一次提及台積電與台灣偷走晶片、半導體，但未見政府相關單位提出嚴正抗議、或是要求美方正視歷史事實。請繼續往下閱讀...潘孟安回應，這當然不是事實，台灣和台積電絕對沒有偷走美國的半導體，台灣政府也曾正式對外說明過。洪孟楷追問，若川普一而再、再而三，用這種扭曲、根本不是事實的話，會否建議總統賴清德在與川普談話時，請川普更正說法。潘孟安表示，台灣在30年前的確是向英特爾（Intel）購買技術移轉，經過30年的淬煉與整體供應鏈的提升，台灣才有今天的地位，這是全世界半導體產業鏈的現實與事實，「只是他太簡略了，他也不知道這些製造過程，過去他的專業背景或是他的幕僚，可能是在商業上，但製造業完全不是這麼一回事。」潘孟安說，當川普第一次提到這項說法時，台灣團隊在關稅談判過程中就已向美方如實說明．製造業與一般商品買賣不同。不過，洪孟楷質疑，川普持續發表相關言論，顯見團隊溝通並未下情上達，或是川普明明知情卻刻意扭曲？潘孟安則回應，自己不予揣測．美國財政部、商務部等單位都非常清楚整個產業結構鏈，「所以他才要求，他要成為AI的整個最重要的基地的時候，更需要台灣。」    ,https://news.ltn.com.tw/news/politics/breakingnews/5444548
楊寶楨退黨批霸凌文化 錢康明：我也被民眾黨議員霸凌過,政治,2026/05/21 12:22,曾任新竹市府發言人的楊寶楨不認同黨內霸凌文化退出民眾黨。（照片取自錢康明粉專）曾任新竹市府發言人的民眾黨員楊寶楨昨晚宣布退出民眾黨，其退黨理由是不認同黨內的霸凌文化，路線已不同，決定獨立參選。對此，也決定獨立參選新竹市議員的高虹安市府前文化局長錢康明提到，民眾黨的霸凌文化只有在黨內嗎？並點名稱民眾黨籍的竹市議員李國璋、宋品瑩，2023年也是開記者會霸凌他，並提到是當年還是民眾黨籍的高虹安授意，還是民眾黨的霸凌文化一直都在。錢康明說，民眾黨從不認錯、道歉、面對司法，偏偏沒骨氣的國民黨還配合。藍白合的立法院不審總預算，卻一直在「因人設事」改法律，最高目標就是癱瘓執政，收拾民進黨。台灣有藍白黨，還需要敵人嗎？市議員是要監督市長和市政府的。不是和市長做「項目合作」的，他也請有「項目合作」的市議員和局處長三思，看看柯文哲的前車之鑑，「天理昭彰、報應不爽」。請繼續往下閱讀...錢康明4月宣布已遷戶籍到新竹市，並決定要參選年底的市議員選舉，對楊寶楨退黨獨立參選，他也心有所感，並提到當年被民眾黨竹市議員開記者會霸凌的過往。竹市前文化局長錢康明感嘆，他也被民眾黨竹市議員開記者會霸凌過。（照片取自錢康明粉專）    ,https://news.ltn.com.tw/news/politics/breakingnews/5444496
環保流氓李四川胞弟李賜福認罪！周軒：黃國昌昔4度護航雙標,政治,2026/05/21 12:20,政治工作者周軒。（資料照）政治工作者周軒今（21日）發文批評，藍、白陣營過去全力護航的新北市長參選人李四川胞弟、涉嫌恐嚇取財的「環保流氓」李賜福，昨在法庭上正式認罪，坦承長期魚肉鄉民、以暴力恐嚇取財高達500多萬元，更一度造成屏東小琉球陷入垃圾圍島危機。沒想到有民眾黨新北市議員參選人今翻出4年前立委蘇巧慧妹妹、蘇巧純早已澄清未參與的標案進行抹黑攻擊，質疑根本是企圖幫犯罪集團轉移焦點。周軒今日發文指出，事實上，桃園市政府早在4年前就公開澄清，蘇巧純經營的「二三設計」公司完全沒有投標桃園市總圖標案，僅是參與營造公司在總圖內設置的多媒體設施。當時蘇巧純團隊的合作對象是得標廠商的下游廠商，這是原廠商在專業考量下，自行尋找團隊合作，沒有將標案轉包。請繼續往下閱讀...更重要的是，蘇巧慧的妹妹蘇巧純曾榮獲國際設計大獎，時常受邀擔任國內外各大獎項的評審，卻每逢選舉就淪為攻擊目標。周軒大酸，「我實在很訝異，黃國昌看待『李四川的犯罪家人』和『蘇巧慧的得獎家人』，竟然有如此巨大的雙重標準。」回顧過去，當李賜福遭到起訴時，民眾黨主席黃國昌竟前後護航高達4次，包括2月14日「沒有必要因為選舉，把家人其他的事情拿來做政治攻擊，大可不必」、2月15日「選舉就是選賢與能，不是在家族清算鬥爭、株連九族，用家人的事攻擊，對川伯不公平」、2月23日「個人的事不是不能檢驗，但你去牽扯到人家的家人，我覺得已經too much了」，2月28日更痛批綠營「一天到晚朝著候選人家人身上潑髒水，進行政治操作，這種雙標的行為，真的應該要讓我們好好重新省思」。周軒直言，蘇巧慧與其團隊從未對李四川及其家人進行任何攻擊。但是民眾黨現在選擇替犯罪集團圍事，攻擊在國際上得到大獎的設計團隊，這不是雙標，什麼才叫雙標？這就是黃國昌所說的新政治？藍營控蘇貞昌女兒拿桃市府標案 政院：合作對象是廠商勿混為一談恐嚇勒索清運業者 李四川胞弟李賜福當庭認罪    ,https://news.ltn.com.tw/news/politics/breakingnews/5444392
