Title,News_Type,date,content,url
鄭習會傳10日登場 張育萌：藍營一邊訪中一邊「躺平軍購」,政治,2026/04/10 08:00,國民黨主席鄭麗文訪中。（國民黨提供）國民黨主席鄭麗文7日起率團訪中，將與中共總書記習近平會面，引發國際關注。國民黨9日深夜曝光今日鄭麗文一行人的行程，發現上午時段留白，引發遐想；幾乎同一時間有最新消息指稱，「鄭習會」很可能在週五（10日）上午10點左右舉行。對此，台灣青年世代共好協會理事長張育萌表示，為了見習近平，國民黨費盡洪荒之力，鄭麗文竟把孫中山重寫成「抗日份子」。同一時間，解放軍對內高喊「備戰」，美方抵台盯軍購預算。只有國民黨，集體躺平「軍購協商」曠職。張育萌在臉書PO文表示，鄭習會前夕的三方對撞，鄭麗文今天就要見習近平。為了見到習近平，她竟然直接扭曲歷史，鄭麗文在中山陵，把兩岸問題講成是「甲午戰爭遺留的問題」，說孫中山是對抗日本殖民的領導人，梁文傑今天在記者會上，直接冷靜地打臉鄭麗文，幾乎可說是不留情面，因為，孫中山的革命事業，不管是在辛亥之前，或是革命之後，都跟日本關係非常密切。同盟會就是在日本東京成立，孫中山也多次希望日本政府協助革命。請繼續往下閱讀...張育萌分析，鄭麗文這麼做，唯一的目的，就是配合中共宣傳。因為把台灣冠上「日本軍國主義遺留的問題」，就可以用「皇民化」解釋，台灣人為什麼不願意被統一，梁文傑在記者會放影片，是鄭麗文訪中路上，一位男子跳出來喊「下架民進黨」，結果慘被維安架走，影片放完，梁文傑說「這位人士講的，對他們來說應該是很正確的說法。但重點不是你講得正不正確，重點是『你就是不能講話』，所以把你立刻架走。」這就是為什麼我們不要中共統治。張育萌指出，鄭麗文提到「中華民國」，是在南京中山陵說「當年孫中山創立了亞洲第一個民主共和國，中華民國」，陸委會今天特別點出來，中山陵是中共唯一讓國民黨講「中華民國」的地方，稱得上是「特別保護區」，離開中山陵，就是不准再講。歷屆國民黨主席，也都是用這種「隱晦」的方式講，這根本不是突破，從2005年的連戰開始，到吳伯雄、馬英九、洪秀柱到朱立倫，都是這樣，鄭麗文人在中國，中共的《學習日報》就發表〈高質量推進作戰能力建設取得決定性進展〉這篇文章，直接指名「解放軍要嚴肅整治虛假備戰，深入糾治『和平積弊』」，講白話文，就是解放軍東部戰區對自己人喊話，要黨政軍不要以為現在和平，未來就不會打，要「真抓打仗進行準備」，請問鄭麗文，中共有在跟你躺平嗎？張育萌續指，昨日一整天，中國又再發布黃海實彈射擊，黃海的軍演在大連威海，東風系列飛彈射程就橫越日本海，涵蓋日本全國，就這麼巧，日前，鄭麗文才在中山陵的慷慨演說中，提了日本11次，當然，論調全部都是對日本嚴厲的批判，大國角力正在台灣上演。美國眾議院的「共和黨研究委員會」國安任務小組主席 Zach Nunn 抵台，今年2月，Nunn 才在「中國問題特別委員會」聽證會，公開示警中共對台的威脅，發展成網路攻擊、資訊操控和經濟制裁，這種「灰色侵擾」已經超越傳統軍事威脅，Nunn 主席在總統府公開表達，「我們從華府帶來訊息，美國對台灣的支持非常強勁」。張育萌補充，同時，參議員 Jim Banks 也踏上台灣。Banks 在州參議院期間，就曾實際請假投入阿富汗的軍事行動，最重要的是，Banks 參議員就是聯名發函，要台灣儘快通過國防預算的議員之一。昨天，他也直接再次表態，「台灣立法院應發揮功能，通過特別預算。」原因很簡單，通過國防特別預算就是「向中國及國際社會清楚傳達台灣『以實力維持和平』的堅定立場。」華府和北京最大的共通點就是，沒有人在「躺平」。全世界大概只有國民黨公開許願要躺平，還身體力行，結果，為了讓鄭麗文成功見到習近平，國民黨今天送給北京的大禮，就是立法院《軍購特別條例》的黨團協商，國民黨零人出席，已經為了國民黨改兩次時間，國民黨還是全體曠職。所有人乾等40分鐘，國民黨不來就是不來，只能直接散會。張育萌直言，下週，輪到國民黨當國防外交委員會的召委，馬文君莫名其妙，排下週三四「考察東部地區」。很可能又沒時間排協商，沒有人在抹紅，國民黨從黨中央到黨團，都被鄭麗文加傅崐萁綁架，鄭麗文負責「改寫歷史」，當好統戰樣板；傅崐萁在立法院當內應，負責「躺平」拖軍購，「鄭傅體制」憑著少數極端選票，最終控制國民黨，把政治槓桿開到最大，用「台灣最大在野黨」的虛名，往北京急速暴衝，「鄭傅體制」不只是台灣內部，最可惡的利益結盟，而是足以在國際局勢中，製造風險的危險政治組合。    ,https://news.ltn.com.tw/news/politics/breakingnews/5399016
鄭麗文老公檔案揭多年謎底！范雲再爆：當年嫌我們不夠台獨,政治,2026/04/10 07:55,國民黨主席鄭麗文與其丈夫駱武昌。（資料照）國家檔案館的一份調查局校園佈建檔案，揭露國民黨主席鄭麗文的丈夫、文化大學財金系副教授駱武昌曾被接觸吸收為「運用人員」。對此，曾任野百合學運總指揮的立法院民進黨團書記長范雲直言，若此事屬實，她既驚訝也不完全驚訝，因為這將解開多年來的謎底，亦即駱為何從這麼台獨、痛恨國民黨轉向容忍伴侶改變立場，「他當年比我們更衝，還嫌我們不夠台獨！」鄭麗文1987年入學台大法律系的，加入台獨立場鮮明、抗爭路線較激進的校內社團「大論社」，結識當時就讀台大政治系大二、在社團擔任總編輯的駱武昌，2人朝夕相處下相戀。隔年（1988年）駱武昌成為大論社社長，鄭麗文則到著名社運人士鄭南榕創辦的《自由時代週刊》當校對，時常和駱到處噴寫台獨標語。而駱武昌自台大畢業後相當低調，成為鄭麗文「背後的男人」。請繼續往下閱讀...據《鏡報》報導，一份民國77年（1988年）8月17日的公文，主旨為「請核准台大學生駱武昌為佈建運用關係，請鑒核」，內容提到，擬先將駱列為運用關係，化名馬超，俟觀察渠活動能力、工作績效、安全狀況等作綜合評估後，再報請鈞局核准列為內線佈建。同年8月19日，另一份公文主旨寫道，「擬同意夏雨生提列台大駱武昌為佈建運用關係，請核示。」對此，范雲接受本報訪問回憶，駱武昌當年在台大與她同屆，但自己一直無法理解，當年這麼衝、這麼台獨、這麼痛恨國民黨的駱武昌，為什麼能容忍其伴侶在政治立場上產生180度的極端轉變。大家常以為鄭麗文是因為赴劍橋大學攻讀博士才如此，但駱武昌並沒有類似經歷，人的理念通常不會突然這樣改變。范雲進一步說明，如果有了這個背景，過去許多無法理解的部分就說得通了，當年駱武昌甚至嫌大家不夠衝、不夠台獨，但現在看來，很多謎底就揭曉了。她認為，該公文的真實性滿高，因為內容點到的人，都是當時社團內的核心份子。針對檔案的公開，范雲表示，這讓大家看到轉型正義和檔案揭露的重要性，若沒有前總統蔡英文卸任前，推動「政治檔案法」的改革，就無法知道這些被布建的「抓耙子」是誰。范雲強調，這些史料對很多人而言相當衝擊，但更多的真相和討論，讓大家了解民主運動時代的黑暗面，才更有辦法認清真實，尤其中共對台灣的滲透和布建更不止於此。立法院民進黨團書記長范雲曾任野百合學運「總指揮」。（資料照）    ,https://news.ltn.com.tw/news/politics/breakingnews/5399024
鄭習會今登場  國安官員：中共要創造「一畫面」削弱川普對台支持,政治,2026/04/10 07:42,國民黨主席鄭麗文赴中重頭戲「鄭習會」預計今天登場。（路透、資料照，本報合成）國民黨主席鄭麗文赴中行程的重頭戲「鄭習會」預計今天登場。我方國安官員研判，中共總書記習近平擬經過兩人會面，鞏固鄭麗文的黨內領導地位，並翻轉「統派」在台灣不受歡迎的弱勢。更重要的是在「川習會」前，創造「台灣人支持統一」的畫面，削弱川普政府對台灣的支持，無論在安全上或國際地位上。國安官員認為，習近平將在「習五條」脈絡下，重申北京定義的「九二共識」，也就是「一個中國」、「一國兩制」，而非國民黨過去主張，現在少講，今天在會場上不敢說的「一中各表」。此外，鄭麗文應將毫無意外的在習近平面前說出北京期待的：兩岸都是「中華民族」、「同根同源」等論述，並以再次陳述「九二共識、反對台獨」呼應習的主張。請繼續往下閱讀...官員指出，北京當局期待透過習、鄭兩人在「九二共識、反對台獨」的相互呼應中，實現確立「反獨一中」的框架，啟動並且加速今年對台工作會議訂定的目標：「兩制」（一國兩制）方案的推進。針對北京的出招，國安官員認為，中方希望經過習鄭會，鞏固鄭麗文領導地位，翻轉「統派」在台灣不受歡迎的弱勢，並結合「九二共識」與「和平」之名，包裝「一國兩制台灣方案」在台灣的正式推進，再來就是弱化台灣內部團結，為國民黨再次取得政權創造條件。國安官員並說，更重要的是，在川習會前，創造「台灣人支持統一」的畫面，削弱川普政府對台灣在安全或國際地位的支持。官員也觀察說，為了確保兩人會面要傳播的氛圍不會受到影響，過去幾天北京更透過台辦系統多方聯繫台灣在野公職、立場傾北京媒體，全力排除對北京不利的消息，包括外媒報導指中國在沿海劃設大範圍飛航限制區。另外，則指定攻擊日前揭露中國海軍艦艇在台灣周邊襲擾的海委會主委管碧玲。    ,https://news.ltn.com.tw/news/politics/breakingnews/5399019
參選台北市長態度曾鬆動！鄭麗君堅守談判崗位可能與「她」有關,政治,2026/04/10 06:49,傳出前總統蔡英文近期「勸進」行政院副院長鄭麗君出馬競選台北市長。（資料照）傳出前總統蔡英文近期「勸進」行政院副院長鄭麗君出馬競選台北市長，知情人士證實，蔡英文與鄭麗君今年兩度見面，一次在二月，一次是四月，席間雖聊到選舉議題，但沒有所謂「勸進」。他也坦言，府黨高層雖曾與鄭麗君討論過台北市長選舉，鄭在「前階段」並沒有「強烈認為一定不行」，但最後仍顧及台美關稅談判的大局勢，期盼後續把工作完成。知情人士解釋，鄭麗君與蔡英文今年確實有碰面，不過，不是為了台北市長選舉，而是一般聚會，席間大家聊的話題與議題很多，當然也會觸及今年底的選舉，但並沒有外界所謂的「勸進」。請繼續往下閱讀...對於是否參選台北市長，鄭麗君至今並未鬆口，她多次受訪也表示，這一題對她來說是考古題，考古題就是會一直出現，她已經回答這個問題超過10年，過去的回答都算數。鄭麗君也強調，自己出身智庫，喜歡思考政策與做政策，所以比較沒有思考選舉這條路。知情人士表示，府黨高層確實有跟鄭麗君討論過參選台北市長選舉議題，鄭麗君也知道綠營支持者對她有期待，也了解民進黨對她的定位，鄭麗君在前階段也沒有像之前一樣，「強烈認為一定不行」。不過，他也說，美國關稅仍有變數，鄭麗君還有任務在身，現階段很難規劃投入選舉，必須考量對美關係，以及美方對台的信任感，因此仍以關稅談判為最優先，要把後續工作完成。而其實台美關稅談判成敗、行政院政策推動，也會影響年底民進黨的選情。另名人士則分析，鄭麗君態度從一度有鬆動跡象，到後來還是決定堅守台美對等關稅談判的工作崗位，從時間點研判，恐與行政院經貿辦前副總談判代表顏慧欣罷凌案有關。現在總談判代表楊珍妮還在被調查中，如調查結果出爐，不利楊珍妮，勢必有相當的懲處，最嚴重恐去職，若未來主談的鄭麗君、楊珍妮都離職，誰要接手與美方談判？    ,https://news.ltn.com.tw/news/politics/breakingnews/5399004
鄭麗文老公被爆曾是抓耙仔  野百合世代曝情治單位「盧洨」過往！,政治,2026/04/10 06:22,許有為分享曾被情治單位試圖接觸的過往。（資料照）首次上稿 04-09 22:45更新時間 04-10 06:22國民黨主席鄭麗文的丈夫駱武昌，遭爆曾是國民黨威權政府情治單位放在校園裡的「佈建運用人員」，也就是協助情治人員蒐集資訊、監控特定對象的「抓耙仔」，引發熱議。對此，也是1990年「野百合學運」世代一員的行政院不當黨產處理委員會專任委員許有為，9日親曝過去相關情治單位也曾企圖接觸他的過往。請繼續往下閱讀...相關國家檔案披露，駱武昌就讀台大政治系時，當時威權政府的調查局就接觸了他，並想吸收他當線人，檔案內容記述情治單位「擬先將駱武昌列為運用關係，化名『馬超』，俟觀察渠活動能力，工作績效，安全狀況等作綜合評估後，再報請鈞局核准列為內線佈建。」目前亦擔任東吳大學政治學系兼任助理教授的許有為，9日晚在臉書發文表示，從他平時工作中能接觸到的史料判斷，號稱教育部教官的人，試圖接觸異議學生的事情，應當是真的，「史料中發生，由自稱教育部張教官打電話接觸異議學生，可能還有進一步的佈建等情節，也曾經發生在我身上。」他接著回憶道：「那是1987年9月間，還不是大一新生的我，正享受前所未有長達三個月的快樂暑假，準備迎接開學。剛剛恢復活動的大學新聞社，將我和後來成為我家一份的那位，與另一位大一新生同學，一同刊載於復刊的大學新聞上，宣告堂堂復出的幹部名單上。結果，據說，教育部和北一女再加上成功高中，大概電話打到線路快要燒起來，紛紛想要弄清楚事實。」「就在大學新聞復刊第二個禮拜，某晚十點就開始了某自稱教育部張教官的人士，定時打來想要邀約我一起吃飯，和我談談為何會加入大學新聞社那種『偏激學生團體』。這位張教官於是天天晚上10點準時打電話到我家，我跟他盧了一個禮拜，沒答應他吃飯。」「後來是我媽媽受不了，直接搶過電話，跟他說了一大段類似『我是新竹中學三民主義名師，跟你一樣姓張，我兒子很愛國，就算你告訴我，我兒子加入的社團是共產黨的組織，我還是相信我兒子愛國！請你以後不要再打電話來騷擾他，特別你是一個成年人，應該要懂點電話禮貌，不要在九點半以後打電話到不認識的人家裡，這是很基本的教養，你天天在十點打來，顯得你很沒教養……』之類的。從那晚起，教育部張教官就沒打過電話給我。我也無從成為另一個馬超班超什麼超。然後，從那晚起，我是真心誠意覺得：許媽媽真的很猛。」和駱武昌、鄭麗文一樣，許有為與妻子郝培芝在當年也是社運圈有名的情侶檔，2人從學生時代起就共同參與政治與社會改革運動，並在之後分別於學術界與政界發揮影響力。相關新聞請見：鄭麗文政治立場大變與他有關？ 國家檔案揭「驚人隱藏身分」！    ,https://news.ltn.com.tw/news/politics/breakingnews/5398873
李貞秀去留 柯：給她一點時間準備,政治,2026/04/10 05:30,民眾黨中配立委李貞秀昨在立院內政委員會再度「空氣質詢」，民進黨立委在台下舉牌「任公職禁止雙重國籍」抗議。（記者羅沛德攝）李稱柯是有高度政治家 「一定遵守柯指導」民眾黨中配立委李貞秀國籍爭議延燒，失言風波更引發黨內不滿。創黨主席柯文哲昨表示，李貞秀的去留問題，大家不要逼她，給她一點時間去準備。對此，李貞秀受訪回應，柯文哲是有高度的政治家，她一定遵守柯的指導；她也說，柯文哲一向主張按制度辦理，應該就是不要有太多其他雜音。請繼續往下閱讀...關於李貞秀被檢舉違反黨紀案，柯文哲表示，希望交由中評會處理，中評會原本九日要開會，但中評委有人出國，延至下週一。柯說，李貞秀的事件鬧太久了，他當初決定保留一席不分區立委給新住民代言人是對的，但台灣政治環境惡劣，他低估一件事，在台灣當立委沒有三頭六臂和超強IQ、EQ很難生存，希望「大家再給她一點時間」。李上質詢台 再度唱獨角戲立法院內政委員會昨邀內政部長劉世芳、國土管理署長蔡長展、交通部次長陳彥伯等人列席做專案報告。李貞秀持續在質詢台唱獨角戲，劉世芳、陳彥伯均未答詢。李貞秀先指責，前幾次質詢，執政黨都展現出傲慢，隨後話題轉為關切地方交通建設，李一人獨白的質詢結束後，主持會議的國民黨籍召委廖先翔說，李貞秀探討的議題都非常重要。對於柯文哲表示，李貞秀的去留問題，應該給她一點時間做準備。李貞秀受訪說，柯文哲是很有高度的政治家，對於柯的所有教誨，她身為民眾黨支持者、黨公職，一定會更加遵守。    ,https://news.ltn.com.tw/news/politics/paper/1750293
欣欣、大南公車環景系統 驚見「中國晶片」 退輔會：82輛違約 將求償、限期更換,政治,2026/04/10 05:30,民進黨立委林楚茵昨於立法院國防委員會質詢時踢爆，欣欣、大南客運82輛公車使用中國海思晶片。（林楚茵辦公室提供）民進黨立委林楚茵昨於立法院國防委員會質詢時踢爆，國軍退除役官兵輔導委員會轉投資的欣欣客運與大南汽車，其採購之電動公車環景系統竟暗藏中國華為子公司「海思半導體」開發之晶片，由於公車每天穿梭於雙北街頭，並拍攝大量路徑街景，憂心恐淪「中國間諜車」。對此，退輔會主委嚴德發坦言事態嚴重，並證實共有八十二輛公車之系統商違約使用中國製產品，目前已成立專案小組全面普查，將依約向廠商求償並要求限期更換。穿梭雙北拍攝街景 恐淪「中國間諜車」林楚茵質詢時出示照片證據指出，公車環景系統（ＡＶＭ）為確保行車安全，運作時會持續拍攝周遭大量路人、車輛與街景影像。然而，經直擊發現，該系統內部竟違規使用中國海思晶片，且相關廠商為了規避稽查，甚至企圖塗抹去除晶片上的商標標籤。請繼續往下閱讀...林批評，退輔會七日的回覆，仍聲稱相關零件產地為台灣與荷蘭，直到她提供照片事證並要求進一步抽查，退輔會才於八日更正資料，承認公車廠牌「創奕」所使用的「誠益」系統，其晶片產地確實來自中國。林楚茵強調，該批車輛採購時間為民國一一四年，顯示並非舊合約誤用，而是廠商明知故犯。林楚茵質疑廠商完全無視「禁用中國製產品」之切結規範，要求退輔會必須緊盯這八十二輛公車的系統更換期程，並將違約廠商列入黑名單，同時橫向通報經濟部與交通部，共同防堵資安漏洞。嚴德發答詢時表示，依據現行合約規範與廠商簽署之切結書，絕對不可以使用中國大陸產製之產品。雖然相關電動公車之車型與廠牌皆依「政府採購法」辦理公告，並獲得交通部審驗合格，但確實發生廠商私自違規的情形。嚴德發承諾，已要求相關客運業者立即啟動「重大事件處理機制」，並由退輔會成立專案小組進行全面普查。    ,https://news.ltn.com.tw/news/politics/paper/1750295
延宕逾200天 國民黨團今仍不處理總預算,政治,2026/04/10 05:30,民進黨團副幹事長陳培瑜（左）昨表示，若在野黨立委主張照顧人民需求與地方建設發展，就應該履行審查總預算案。圖為陳培瑜與民進黨立委范雲（中）、吳沛憶（右）昨召開記者會，針對國民黨主席鄭麗文、軍購案等議題發表意見。（記者羅沛德攝）中央政府總預算持續卡關，立法院國民黨團月初舉行內部會議，多名立委表達應該要盡快脫離總預算和軍購的戰場，傳出總預算可能在今天院會付委。但據了解，當天尚未形成黨團共識，除非今天上午黨團大會再討論，否則不會處理。立法院民進黨團對此批評，總預算已延宕逾二百天，造成縣市政府執行困難，在野黨立委若主張照顧人民與地方建設，應儘速依法審查、三讀通過總預算。民進黨團：藍喊照顧人民 就應儘速審查國民黨團內部會議隔天，立法院長韓國瑜與副院長江啟臣即呼籲朝野各界「各退一步」，對於立法院三讀通過之法律案，行政院即應依法副署並執行；對於總預算、特別預算，立法院基於憲法義務，理宜儘速審議。請繼續往下閱讀...國民黨立委表示，四月一日僅聽取大家意見，雖然多數藍委都有表達應該要審總預算和增加軍購預算，但還沒有「共識」決定怎麼做，消息就已經傳出去。如果要處理總預算，一定會在黨團大會討論，但目前還沒有正式開會決定。也有立委說，行政院不執行立法院通過的新興預算，也不打算依法編列立法院三讀通過軍警消待遇相關預算，變成國民黨團要一直讓，難道這是韓國瑜所說的「朝野各退一步嗎？」民進黨團副幹事長陳培瑜受訪表示，總預算案已延宕逾兩百天，在野黨必須對地方首長說明清楚，尤其是災防與新興計畫等預算，已造成各縣市政府執行困難，公務員也無法放心使用款項，風險非常大。若在野黨立委主張照顧人民需求與地方建設發展，就應該履行審查總預算案。民進黨也指出，藍白持續拿立法院決議「七一八億元新興計畫可先行動支」來混淆視聽，但這只是二讀決議案，不具法律效力。總預算案仍然必須整包審查、完成三讀，才能合法運用。若照藍白所說先行動支預算，未來立法院在審議預算時刪減支出，行政機關花出去的經費將無法核銷，導致違法；呼籲在野黨儘速依法審查、三讀通過總預算。    ,https://news.ltn.com.tw/news/politics/paper/1750349
徵召魏平政地方炸鍋 謝衣鳯：難帶動彰縣選情,政治,2026/04/10 05:30,「我的參選不需要經過家人許可」謝衣鳯坦言，她要選彰化縣長這件事，的確沒有尋求家人同意。（記者羅沛德攝）國民黨立委謝衣鳯表態參選彰化縣長，不過謝家卻不同意她參選，國民黨中央擬徵召前考紀會主委、律師魏平政參選。謝衣鳯昨表示，自己不是十八歲，「我們現在都是成年人了」，會繼續尋求家人支持，「現在不支持，不代表未來不會支持」。對於黨中央若徵召魏平政，自己是否會脫黨參選？謝說，話不用講到這，盼黨中央了解地方意見，做出最好決定。「我們都是成年人了」 謝：參選不需要家人許可請繼續往下閱讀...「我的參選不需要經過家人許可」謝衣鳯坦言，她要選縣長這件事，的確沒有尋求家人同意，身為一個政治人物對選民負責，她認為自己有能力繼續參選縣長且勝選，過去有一段時間她的民調非常高，高過其他人，現在也是。提到彰化縣議會議長、弟弟謝典霖，謝衣鳯說，她與謝典霖最大的不同，在於他認為參選必須要獲得家長或家人的同意；而她需要的不只是家人的支持，是所有彰化縣民的支持，是百工百業、每個團體來認可她能夠成為彰化的縣長，這是她需要尋求的支持，「只有家人的支持是不夠的」。至於魏平政，謝衣鳯說，傳出魏平政這個人選確實始料未及，她不會批評魏，「他是個好人」；但謝反問，「這時候跳出來，對魏平政好嗎？」魏過去有段時間不在彰化服務，如何能帶動彰化其他參選人？她認為徵召魏平政將影響彰化選情布局，希望黨中央不應忽略其他人的努力。面對民進黨派出陳素月參選，謝衣鳯表達對勝選深具信心，直言「成功不一定在我，有謝衣鳯一定會成功」。至於近日國民黨將她升任黨中央副秘書長一事，謝回應，「黨務不是我現在想做的事」，自己的首要目標就是參選彰化縣長並贏得勝選，尊重黨內安排，但不會因此改變想法。    ,https://news.ltn.com.tw/news/politics/paper/1750294
