Title,News_Type,date,content,url
人夫吵架竟被潑鹽酸失明 前妻判刑2年諭知緩刑,社會,2026/02/23 12:04,桃園人妻與丈夫吵架後潑酸，造成丈夫左眼失明，因自首且達成調解，桃園地院判處人妻2年徒刑並宣告緩刑4年。（記者余瑞仁攝）桃園市朱姓人妻2024年4月2日清晨與郭姓丈夫發生爭吵，她見丈夫回床繼續睡覺，怒氣未消之下從廁所拿來4瓶鹽酸對躺在床上的丈夫潑灑，造成郭男頭、臉及身體有30%受化學性灼傷，釀成左眼全盲、右眼視力嚴重受損；桃園地院審酌朱女罹患重度憂鬱症、犯案後自首且與郭男達成調解，依重傷害罪將她判處2年徒刑、緩刑4年，緩刑期間交付保護管束。判決指出，年逾50歲的朱女與郭男結婚多年，平常偶有爭吵，2024年4月2日清晨近6點時，朱女與丈夫因故在住家內爭吵，郭男吵架後返回房間繼續睡覺，朱女卻是怒氣上頭，頓時心生狠意，從浴廁拿出4瓶鹽酸朝郭男全身潑灑，隨後前往圳頂派出所報案指稱自己拿鹽酸噴濺丈夫，並請警方幫忙叫救護車。請繼續往下閱讀...郭男因遭潑灑鹽酸造成頭臉與身體嚴重灼傷，經緊急送醫治療，發現其頭、臉及身體軀幹有30%遭化學性灼傷，傷勢最為嚴重的左眼因萎縮而全盲，右眼視力則僅恢復至可辨指數狀態，造成無法逆轉的重傷害；事後，郭男與朱女以離婚收場。桃園地院審理時，朱女坦承對郭男潑酸，合議庭另囑託衛生福利部桃園醫院對朱女進行精神鑑定，鑑定結果顯示朱女罹有重度憂鬱症，案發時處於未經治療狀態，因刺激造成情緒低落、判斷力受損，辨識行為違法及控制衝動的能力顯著減低；合議庭審酌，朱女因情緒失控犯下重傷害罪，但符合「精神障礙減輕其刑」及「自首減刑」規定，因此遞減其刑，且朱女於審理過程中與郭男達成調解並獲寬宥，另考量朱女並無前科紀錄等一切情狀，審結判處2年徒刑並宣告緩刑，緩刑期間交付保護管束，以防再犯。法官並以朱女犯案後定期就醫、規律服藥，病況可獲相當控制，且與成年兒女同住，有家庭支持系統督促服藥，認無宣告監護處分（強制就醫）必要。可上訴。    ,https://news.ltn.com.tw/news/society/breakingnews/5348440
開學日新莊女童墜樓不治！校方：在校狀況正常 教育局啟動關懷機制,社會,2026/02/23 12:03,女童墜落社區中庭空景。（記者徐聖倫翻攝）今（23）日為各級中小學開學日，新北市新莊區卻傳出學童墜樓意外。上午7時許，一名12歲女童在住家社區大樓不明原因自高處墜落，倒臥中庭，救護人員到場時已無生命跡象，緊急送醫搶救不治，確切原因由警方調查釐清。校方指出，該生在校期間學習與生活狀況正常，人際互動及家庭情形均無特殊異狀；教育局則說，已請學校同步啟動班級及同儕關懷措施。另外，針對外界質疑女童因在校和同儕發生衝突造成情緒不穩，教育局表示，相關案情仍在調查中。請繼續往下閱讀...校方指出，該生在校期間學習與生活狀況正常，人際互動及家庭情形均無特殊異狀，事故發生原因仍待進一步調查。教育局表示，該名女童為新莊區某國小五年級學生，今天上午7時多於住家社區發生意外，校方接獲警方通報後已立即完成校安通報。市府要求學校啟動關懷機制，由校長及行政團隊趕赴醫院陪同家屬，協助聯繫及後續相關事宜。教育局強調，已請學校同步啟動班級及同儕關懷措施，視情況提供專業輔導資源，協助穩定師生情緒與身心狀況；同時持續督導各校落實情緒支持與危機辨識通報機制，強化生命教育，避免憾事再發生。相關新聞：開學日傳憾事！新北小五女童墜樓身亡    ,https://news.ltn.com.tw/news/society/breakingnews/5348447
另類秒殺！慣竊徒手扳機車坐墊10秒洗劫6千,社會,2026/02/23 11:45,慣竊僅花10秒即從機車坐墊竊走皮夾。（警方提供）另類秒殺！彰化市1名慣竊過年期間四處下手行竊財物，大年初三盯上彰泰國中大門前1輛機車，趁民眾離去時上前行竊，以徒手扳開機車坐墊將車內皮夾行竊得手，揚長而去，被害人返回欲取皮夾才發現遭竊損失6千元，調閱監視器發現慣竊徒手扳開坐墊前後竟僅花10秒鐘，今天（23日）將影片PO網呼籲大家小心，警方根據監視器發現竊賊是有數起竊盜前科的男子，積極追緝中。警方指出，民眾19日下午許乘坐友人機車前往彰泰國中打球，並將其黑色皮夾放置於友人機車置物箱內；傍晚5點半打完球離開前往用餐時，發現機車置物箱內的黑色皮夾不見，損失6000元。警方根據監視器追查發現，竊賊是有數起竊盜前科的男子，在彰化市街頭騎腳踏車四處尋找作案目標，專門徒手扳開機車坐墊下手行竊；從影片中發現慣竊從扳開機車坐墊到竊走皮夾，竟僅花10秒鐘左右，速度之快令警方咋舌。請繼續往下閱讀...民眾今天將遭竊影片PO網，並呼籲大家不要把財物放在機車內，不少網友附和說，該名竊賊很眼熟，以前疑曾被該名慣竊偷過財物，實在太可惡。警方說，一般竊賊盯上機車坐墊內的財物，多持T型扳手或是雙手用力一扳，就可以輕易拉開機車坐墊，尤其是車齡較久的機車，更容易偷竊得手，此外安全帽掛在機車後視鏡或坐墊上，也容易被竊賊當作內有值錢財物的「指標」；重要財物切記千萬不要放在坐墊內，停車後應隨身攜帶，以免遭洗劫。慣竊得手後將皮夾放入口袋從容離去。（警方提供）慣竊騎單車在彰化市街頭尋找做案目標。（警方提供）    ,https://news.ltn.com.tw/news/society/breakingnews/5348443
台江大道藍色奧迪飆飛50公尺  衝上台61施工高架橋駕駛魂斷,社會,2026/02/23 11:25,30歲王姓男子駕駛藍色奧迪轎車從台南安南區台江大道尾衝上施工中的台61線快速道路鋼架結構，車身嚴重變形，王男當場氣絕身亡。（民眾提供）首次上稿 10:28更新時間 11:25台南市安南區台江大道路尾的台61線興建施工路段，今天早上驚傳1件重大死亡車禍！1輛藍色奧迪轎車不明原因衝撞上台61線的施工鋼架路段，衝撞力道猛烈，引擎與車身分離，整輛車嚴重變形。消防員趕抵現場確認駕車的30歲王姓男子明顯死亡，未送醫。請繼續往下閱讀...據了解，王男是協尋人口，他是從台江大道路尾堤防斜坡快速衝上施工中的台61線高架橋面路段釀禍，據警、消估計，奧迪車從堤防斜坡騰空飛上高架橋面的直線距離長達50公尺、橋面距離地面約9公尺，足見該車車速極快、時速至少100多公里以上，確切肇事原因由轄區警方深入調查中。南市警、消單位於今天清晨7點許接獲民眾報案，指安南區台江大道路尾驚傳重大衝撞的車禍。警、消人員到場時，發現1輛藍色奧迪轎車卡在施工中的台61線快速道路鋼架結構上（奧迪車位置距離路面約9公尺），該車車身嚴重變形、引擎已從車頭分離出去，場面讓人怵目驚心。警、消人員檢視車內駕車的王姓男子已明顯死亡，未再送醫。警、消單位初步調查，王男是獨自1人駕駛這輛奧迪轎車沿台江大道往西方向行駛，速度相當快，一直到台江大道路尾時，他沒有減速，就這麼從青草崙堤防的斜坡衝上約有9公尺高的台61線施工中路段，釀成憾事。由於王男是被通報的協尋人口，其座車是否因車速過快、機械故障或是其他因素釀禍，警方將進一步做現場蒐證、調閱周邊監視器以調查釐清事故原因。警方也呼籲車輛駕駛人行經快速道路與橋面路段時務必減速慢行、保持安全距離，以確保行車安全。王姓男子駕駛藍色奧迪轎車從台南安南區台江大道尾衝上有9公尺高施工中的台61線快速道路鋼架結構，車身嚴重變形，王男當場氣絕身亡。（民眾提供）    ,https://news.ltn.com.tw/news/society/breakingnews/5348308
菲律賓移工放火砍死同鄉同事 曾入火場救火判15年刑定讞,社會,2026/02/23 11:20,紡織廠宿舍大火，移工跑到安全處待援。（資料照，民眾提供）彰化縣和美鎮某紡織公司的菲律賓移工尼克與同鄉同事葛雷恩，2023年11月在移工宿舍發生衝突，尼克持刀追殺對方，又用瓦斯噴燈攻擊，造成宿舍大火，葛雷恩身受多數刀傷和燒燙傷，送醫不治，另造成3人受傷。檢察官起訴求處無期徒刑，彰化地院國民法庭考量他犯後認罪態度，且尼克有進入火場救火，仍有人性基本良知，量處15年有期徒刑，二審、三審都維持原判，全案定讞。檢警調查，尼克、葛雷恩及其他2名同為菲籍移工，住在公司提供的宿舍，尼克因為懷疑葛雷恩向他已分居的妻子爆料他在台有女友，導致婚姻破裂，因而懷恨在心。但法官調查認定，沒有證據證明葛雷恩有爆料、刺激尼克情緒的行為，認定尼克有殺人的直接故意。請繼續往下閱讀...案發於2023年11月23日凌晨，該紡織廠移工宿舍發生大火，33名移工跳出屋外躲在鐵皮屋頂被救下，4人受傷送醫，警、消火場調查發現現場有不明血跡、傷者有刀傷，追查是尼克先持刀砍殺、再持瓦斯噴燈點火噴葛雷恩，引發火災。葛雷恩全身體表面積逾90%三度燒燙傷，合併胸前、左耳撕裂傷、肢體骨折，搶救至同年12月16日不治。尼克自己全身亦60％三度燒燙傷，急救後挽回一命；他坦承犯行，檢方依殺人、殺人未遂、放火燒燬等罪起訴。法院歷審認定，尼克朝睡覺中的葛雷恩潑汽油點火，葛雷恩驚醒逃出時，尼克又持鐮刀砍傷對方，迫使葛退回已著火的房間，致葛嚴重燒灼傷而死亡，其放火手段具有無法控制的高度危險性，手段殘忍。法院考量尼克雖是預謀犯案，但犯後自始坦承犯行，且於放火現場發現大火往走廊延燒，即不顧自身傷痛，持滅火器進行滅火，可見他仍有基本良知，判處15年徒刑定讞。    ,https://news.ltn.com.tw/news/society/breakingnews/5348378
總長票選2-2／檢察總長推薦票選5人名單關鍵 總統都從名單挑總長,社會,2026/02/23 10:54,檢察總長邢泰釗。（資料照）檢察官協會每次公布的檢察總長推薦票選名單，雖然對總統提名新任檢察總長人選並沒有任何拘束力，不過，近年來，不管藍綠誰當家，都把檢協會公布的5人名單當成提名人選的重要依據。依法院組織法規定，最高檢察署檢察總長由總統提名、立法院同意後任命，任期4年，不得連任，而檢察官協會公布的票選結果，是檢察官內部意見表達及推薦參考，是否納入人事考量，仍取決於總統的人事決策。請繼續往下閱讀...2014年，當時代理檢察總長林偕得任期屆滿前，檢察官協會向全國檢察官發出問卷，調查對下一任檢察總長人選的建議，不過，因該次問卷屬開放式填答，並未事先限定候選名單，協會事後以問卷回收數量僅約200餘份，遠低於全體檢察官人數，代表性不足，最後決定不公布票選結果。在沒有檢協會推薦名單的情況下，時任總統馬英九提名當時的最高檢察署主任檢察官顏大和出任檢察總長。立法院於同年4月底表決通過。2018年，顏大和任期屆滿前，檢協會在當年1月底舉行票選後，對外公布前5名推薦人選，總統蔡英文也提名在名單內的時任台中高分檢檢察長江惠民出任檢察總長，江成為第12任檢察總長。江惠民任期於2022年5月屆滿前，檢察官協會依慣例舉辦票選活動，並於2月16日公布票選結果，約1千1百名檢察官投票，由時任高檢署檢察長邢泰釗以552票奪冠，票選結果同樣送交法務部與總統府參考，當時的總統蔡英文提名邢泰釗出任檢察總長，並獲立法院同意。回顧3次票選與人事結果，可清楚看出，檢察官協會的票選雖不具法律拘束力，但在2018年及2022年，總統均從推薦名單中提名總長人選；至於2014年，則因檢協會未公布票選結果，最後回歸由行政部門主導人事提名程序。不過，檢協會在2010年，也曾經票選出當時的法務部次長黃世銘為檢察總長推薦名單第一名，並被時任總統馬英九提名為檢察總長，不過，黃在檢察總長任內捲入馬王政爭案，涉嫌向馬英九洩漏特偵組尚未偵結的辦案內容及監聽對象的通聯紀錄等機密，被依違反通訊保障及監察法、洩密罪判刑1年3月定讞。司法界人士分析，票選結果能否成為實質參考，關鍵仍在於參與率與代表性，若票選具備高度參與度，無論最終提名是否依照票數高低，至少可反映檢察體系內部的主流意見，而目前立法院朝小野大，若有票選結果背書，可能比較有機會通過立法院的審查。    ,https://news.ltn.com.tw/news/society/breakingnews/5348323
嘉義男超商亮刀、遊蕩碎念「想試刀槍會入嗎？」警當街查獲強制送醫,社會,2026/02/23 10:41,洪男在超商與店員口角後突亮刀，警方查獲並將他強制送醫。（警方提供）嘉義市昨深夜驚傳有男子走在路上持刀碎念「想試看刀槍會入嗎？」還在超商與店員爭執、亮刀威脅後離去。警方事後查獲洪姓男子涉案，在該男子身上查扣一把刀，因洪男精神不佳、情緒激動，通報119將他強制送醫，由於店員、路人暫未有人提告，是否涉違反恐嚇或社會秩序維護法，待進一步調查釐清。一名廖姓網友昨在「綠豆嘉義人」社群媒體貼文「嘉義市民小心這個人」，文內指出該男子在新榮路民族路口，與他僅兩步的距離，走在後面碎念「你想試看刀槍會入嗎？」因他沒搭理，該男子就離開走了一段距離，直到銀行門口員警巡邏查獲，呼喊這人手上有刀，當下上前將男子處理，該網友還說，陌生人毫無防備地亮刀威脅，真的越想越害怕。請繼續往下閱讀...警方22日晚間11點許獲報有男子在超商亮刀滋擾，警方到場，據超商店員供述，年約40多歲的洪男深夜持繳費收據來店裡聲稱多收錢，要求店員退費，店員說明與洪男發生口角，洪男就突亮刀，所幸無人受傷，待警方趕抵現場，洪男已離開。警方事發後在垂楊路查獲洪男，洪男坦承有持刀，並在與員警敘述過程中，仍情緒失控，警方先行將洪男強制送醫，雖店員表示暫不提出告訴，全案後續依法處理中。    ,https://news.ltn.com.tw/news/society/breakingnews/5348334
獨家》總長票選2-1／檢察總長推薦票選罕見難產 徐錫祥恐將無對手,社會,2026/02/23 10:35,總統府本月11日已核准法務部政務次長徐錫祥辭職，並轉任最高檢察署主任檢察官一職。（資料照）最高檢察署檢察總長邢泰釗將於5月7日任滿，檢察官協會過去都會在2月前舉辦新任總長推薦票選活動，不過，今年至今仍未公布何時舉行，可說相當罕見。根據法院組織法第66條規定，檢察總長於任滿前1個月，總統應提出新任人選，也就是說，最晚必須在2026年4月7日之前完成提名，並送交立法院行使「同意權」。請繼續往下閱讀...依慣例，由全體檢察官所組成的檢察官協會，會在現任檢察總長卸任前，舉行新任總長推薦票選活動，以2014年、2018年及2022年這三次為例，都在1月及2月間完成投票及公布票選結果，不過，今年至今，檢協會都尚未公布總長票選活動的相關資訊。據了解，活動至今難產，主要是基層檢察官分成兩派，有人主張要辦，理由是，票選活動行之有年，由全體檢察官以民主方式票選推舉總長人選，充份展現全體檢察官的想法，可以提供總統做為提名的參考。主張不要辦的檢察官則認為，以往出現過被列在票選名單上的檢察官，私下抱怨根本無意願參選，但仍被「趕鴨子上架」，而如果要檢察官自己報名參選，又好像怪怪的，此外，檢察總長雖然是全國檢察官的龍頭，但自從特偵組裁撤後，檢察總長實權大不如前，對基層檢察官而言，總長一職象徵意義大於實質意義，是否有必要再大張旗鼓辦票選，然後為總長人選背書，也有疑義。另外，有檢察官也認為投開票方式並不嚴謹，而在2018年曾發出聲明，主張檢協會應永續舉辦檢察總長推薦票選的檢察改革團體「劍青檢改」，今年內部也有不同意見，並未堅持一定要辦票選，據了解，檢協會先前曾開會討論到底要不要辦票選，但沒有做出結論。回顧2014年、2018年及2022年的最近三次票選結果，2014年因回收率不足未公布結果；2018年及2022年公布票選前五名，總統均從五人名單中擇一提名總長人選，並順利通過立法院同意，出任檢察總長。不過，檢察總長推薦票選結果，對總統提名何人擔任總長並無實質拘束力，總統府本月11日已核准法務部政務次長徐錫祥辭職，並轉任最高檢察署主任檢察官一職，外界普遍認為，是法務部為了向總統建議提名徐為下一任檢察總長的佈局。總長票選2-2／檢察總長推薦票選5人名單關鍵 總統都從名單挑總長    ,https://news.ltn.com.tw/news/society/breakingnews/5348306
開工首日北市承德路火警 附近住戶吸入濃煙不適,社會,2026/02/23 10:35,現場不斷冒出濃煙。（民眾提供）台北市承德路二段一棟住商混合大樓的地下室，在今天早上傳出火警，由於火勢猛烈，大量黑色濃煙不斷竄出，還有附近住戶因為吸入濃煙身體不適，被救護人員救出。經消防人員搶救約50分鐘，最終撲滅火勢。台北市消防局在今天早上9時41分接獲報案，報案民眾聲稱在承德路2段一處住商大樓的地下室傳出火警。請繼續往下閱讀...消防員立刻趕到現場救援，並部署水線開始搶救，同時疏散該大樓內部人員。消防員初步釐清，發現起火地點內部無人，並於10時6分控制火勢，最終於10時29分撲滅。消防局表示，有一名年約40多歲的男姓住戶因為吸入濃煙身體不適，幸虧他意識清楚，但為求慎重仍將他預防性送醫院，同時進一步勘驗火場釐清起火原因。（12:11更新）有住戶被濃煙嗆傷被救出。（民眾提供）    ,https://news.ltn.com.tw/news/society/breakingnews/5348326
高雄診所排隊糾紛爆肢體衝突  警方受理雙方提告,社會,2026/02/23 10:29,警方獲報處理診所內排隊糾紛。（民眾提供）高雄市林園區某診所發生2男子疑因排隊問題引發口角，進而引發肢體衝突，警方獲報處理，雙方皆提告傷害、公然侮辱等告訴。林園警分局21日上午9點11分接獲報案，稱林園區忠孝西路某診所內發生糾紛，立即派遣林園派出所員警到場處置。請繼續往下閱讀...員警到場時雙方衝突已結束，經了解為55歲李姓男子至診所看診時，因排隊問題與59歲林姓婦人、33歲劉姓男子母子發生口角，進而引發肢體衝突，後續雙方皆至派出所提出傷害、公然侮辱等告訴，警方已受理完畢，後續有待司法釐清相關責任。雙方互指對方先動手，劉姓男子事後在臉書尋找目擊證人。他說，當天一早他們去掛號看診，已看診結束，醫生通知要打點滴，等待護士小姐唱名繳費、打點滴，後來對方戴著安全帽進來掛號，剛好這時候護士唱名了兩次母親的名字繳費，雙方為了排隊問題發生口角，並發生肢體衝突。    ,https://news.ltn.com.tw/news/society/breakingnews/5348322
張錫銘「不予假釋」判決撤銷 南監：由上級單位依法執行,社會,2026/02/23 10:17,法務部矯正署台南監獄回應，張錫銘假釋部分，一切由上級單位依法執行。（資料照）曾犯下多起重大社會案件、人稱「惡龍」、「小黑」的張錫銘，落網後被判處無期徒刑，他目前打行政訴訟爭取假釋，高雄高等行政法院認定矯正署存在資訊蒐集不全，及未公平對待有利事證等瑕疵，判決撤銷「不予假釋」處分及復審決定；對此，法務部矯正署台南監獄回應，假釋部分，一切由上級單位依法執行。南監指出，張錫銘委由律師來處理假釋，高雄高等行政法院的判決，他應該已獲悉訊息；至於個人生活上的表現，因隱私保護，獄方不便透露。請繼續往下閱讀...張錫銘的友人則提到，他會持續以良好的表現來爭取假釋。高雄高等行政法院日前認定矯正署在審查張錫銘假釋案時，以2018年函詢地檢署卻未獲回覆的舊資料，判決撤銷「不予假釋」處分及復審決定，雖未直接准予假釋，但要求矯正署必須參酌判決意旨重新審議。目前在台南監獄服刑的張錫銘，2005年落網，2007年一審，2008年最終因連續擄人勒贖、持有步槍及殺人未遂等罪定讞，總計判處3個無期徒刑，以及55年6個月刑期，合併執行無期徒刑、併科罰金800萬元。因張錫銘最初的犯案時間是1995年的2月，適用受刑人口中的「舊法」，只要服刑滿10年就有假釋機會，所以從2017年開始聲請假釋。    ,https://news.ltn.com.tw/news/society/breakingnews/5348300
從3樓租到11樓！萬華「鑽石大樓」應召站被搗破 檢起訴9幹部,社會,2026/02/23 10:14,檢方審酌證據後認定，賴、許等9人意圖使男女與他人為性交或猥褻行為，並媒介、容留以營利，依法起訴。（記者劉詠韻攝）以賴姓、許姓男子為首的應召集團，涉嫌長期承租位於台北市萬華區康定路、俗稱「鑽石大樓」的多個樓層，經營應召站並媒介外籍女子從事性交易。台北地檢署調查後認為，該集團組織分工嚴密、營利事證明確，遂依妨害風化罪嫌起訴賴、許等幹部成員共9人。起訴書指出，集團經營規模不小，承租該大樓3樓、5樓、7樓、9樓、10樓及11樓等多間套房，作為性交易據點。組織分工細密，由賴、許二人統籌指揮，下設多名幹部，分別負責財務管理、現場把風、收帳及性交易用品補給等事務，運作相當制度化。請繼續往下閱讀...檢警查出，集團自2022年間透過通訊軟體Telegram群組「安安（或小安）2.0」招募外籍女子加入應召站；為確保據點穩定運作，早自2021年起即以每月4萬5000元至1萬3000元不等租金，向許姓、籃姓房東承租康定路多處套房。該應召站對外招攬不特定男客，每次性交易依半套或全套區分，收費約1000元至1800元。集團則從中抽取500元至800元作為仲介費，其餘款項始交付外籍女子；案經萬華分局搜索查緝，當場查獲6名越南籍女子正在從事性交易，並循線瓦解整個組織。檢方審酌相關證據後認定，賴、許等9人意圖使男女與他人為性交或猥褻行為，並媒介、容留以營利，已涉犯刑法第231條第1項罪嫌，依法提起公訴。    ,https://news.ltn.com.tw/news/society/breakingnews/5348292
兒子突失蹤老父竟稱「死了丟到溪邊」 警尋獲遺體追查死因,社會,2026/02/23 10:12,蘆竹警分局昨獲報黃姓男子失蹤，同住老父稱人死了丟溪邊，員警隨後於埔心溪尋獲黃男遺體，正調查清死因與案情。（資料照）桃園市蘆竹區黃姓一家人過年後發現平常與老父同住的55歲黃姓大哥無故失蹤，家人昨（22）日詢問87歲老父親時，老父卻回稱「人死了丟到溪邊」，家人當下向桃園市警局蘆竹分局報案，警方根據老父親的描述，果然在蘆竹區大新路大新二號橋下的埔心溪畔發現黃男遺體，初步勘驗死者衣著完整並無外傷，已報請桃園地檢署檢察官今日相驗，釐清案情與死因。警方指出，黃男家人昨天傍晚向大竹派出所報案指稱「大哥失蹤、老父親稱說把屍體運到溪邊丟棄」，員警獲報不敢大意，立即動員追問黃家老父，黃姓老翁稱說發現突然死亡，自己用推車把遺體拉到溪邊丟棄；警方根據老翁的描述與指引，果然在大新二號橋下方發現黃男遺體，初步勘驗死者衣著完整且無明顯外傷。請繼續往下閱讀...據了解，黃姓死者自幼即患小兒麻痺，常年需拄柺杖行動，始終未婚並與老父親同住大竹地區，警方不排除黃男是自然死亡、老父親不知如何處理而將遺體載往溪邊丟棄，已於今天報請桃園地檢署檢察官相驗調查死因，並持續釐清案情。    ,https://news.ltn.com.tw/news/society/breakingnews/5348265
