Title,News_Type,date,content,url
剴剴案》惡保母姐妹二審維持原判 劉彩萱無期徒刑、劉若琳18年,社會,2026/01/27 10:18,"涉嫌虐死男童剴剴的保母劉彩萱（右二）、劉若琳（左二）。（資料照，記者張文川攝）首次上稿 09:33更新時間 10:18台北市惡保母劉彩萱、劉若琳姊妹2023年凌虐1歲10月大男童「剴剴」致死，全案隔年3月才曝光，震驚各界；台北地院國民法官庭將劉彩萱重判無期徒刑，創下虐童案史上最重刑紀錄，劉若琳判18年徒刑，全案可上訴；高等法院今上午9時30分宣判，高院合議庭駁回上訴，劉彩萱、劉若琳上訴駁回、維持原判。請繼續往下閱讀...高院合議庭成員審判長廖建瑜、陪席法官黃怡菁、受命法官文家倩。北院一審判決指出，劉彩萱、劉若琳姊妹皆為專業保母，自2023年9月4日至12月23日晚間剴剴送醫為止，先由劉若琳以不明物體刮傷剴剴的頸部，再由劉彩萱以徒手或持物品毆打、捏拉耳朵、從後推倒撞地等方式傷害剴剴，並以毛巾綑綁、口罩蒙眼方式，限制剴剴的行動自由，劉彩萱還同時拍照傳送給劉若琳。劉彩萱命令剴剴裸體僅穿尿布罰站、洗冷水澡、在廁所內灌食不足每日營養需求的隔夜菜，姊妹並曾將剴剴綑綁後放入桶子裡，以裸體僅著尿布躺臥在地上、不得變換姿勢。劉彩萱、劉若琳見剴剴日益瘦弱且有外傷，均未積極帶他去就醫治療，終致剴剴營養不良、身體衰弱，全身至少42處虐待性傷勢，還得了憂鬱症，終至於同年12月24日凌晨因低血容性休克死亡。國民法官庭批評劉彩萱「以虐取樂」，判無期徒刑，劉若琳乃共同正犯，判刑18年。高院在上個月22日召開言詞辯論庭時，吸引婦女團體、民團和關心此案民眾等上百人到庭，擠爆最大的專一法庭，「時代力量」黨主席王婉諭、藝人郁方等人均到場旁聽，被害人家屬均未出庭。保母姐妹劉彩萱、劉若琳被控虐死剴剴案，台灣高等法院27日二審宣判上訴駁回、維持原判，剴剴戰士等民團在外舉雙手歡呼。（記者塗建榮攝）保母姐妹劉彩萱、劉若琳被控虐死剴剴案，台灣高等法院27日二審宣判上訴駁回、維持原判，剴剴戰士等民團相擁而泣。（記者塗建榮攝）保母姐妹劉彩萱、劉若琳被控虐死剴剴案，台灣高等法院27日二審宣判，剴剴戰士民團一早在外等候。（記者塗建榮攝）保母姐妹劉彩萱、劉若琳被控虐死剴剴案，台灣高等法院27日二審宣判上訴駁回、維持原判，藝人郁方到場關心。（記者塗建榮攝）    ",https://news.ltn.com.tw/news/society/breakingnews/5323123
太子集團涉詐精品拍賣 愛馬仕「檸檬黃」鱷魚包、Jordan潮鞋超搶眼,社會,2026/01/27 10:18,士林分署拍賣太子集團案二手愛馬仕鉑金包。（記者劉詠韻翻攝）法務部行政執行署士林分署將於2月3日（星期二）舉辦拍賣活動，上午10時30分在士林分署一樓拍賣室，辦理由台北地檢署囑託執行的「太子集團李姓被告動產案件變價拍賣會」；同日下午3時，則在同一地點舉行聯合拍賣會，並提醒應買人須攜帶身分證辦理登記，公司行號另須檢附公司登記事項卡，完成登記後方可入場競標。士林分署表示，台北地檢署檢察官偵辦太子集團人員涉嫌詐欺案件時，查扣李姓被告持有多項犯罪所得，包含二手名牌包、名牌鞋款及茶具等共33筆動產。其中不乏知名精品，如HERMES（愛馬仕）、STEFANO RICCI、CHROME HEARTS（克羅心）、GOYARD、PRADA、BALENCIAGA（巴黎世家）、DIESEL 等名牌包款，以及CHANEL（香奈兒）、CHRISTIAN DIOR、BALENCIAGA、JORDAN、NIKE等品牌鞋款。請繼續往下閱讀...本次拍賣中，最受矚目的標的是一只愛馬仕霧面鱷魚皮鉑金包，檸檬黃色系搭配鈀金配件，外型亮眼；另有多雙經典JORDAN系列運動鞋，兼具收藏與實穿價值，預料將吸引潮流與精品愛好者關注。士林分署指出，為儘早補償被害人所受財產損失，相關精品於案件偵查中即囑託辦理變價拍賣，盼透過公開競標加速返還被害人。至於下午場的123聯合拍賣會，不動產標的橫跨台北市北投區、南港區、內湖區、士林區，以及新北市汐止區、三芝區等地，合計超過27筆土地，並同步拍賣1個龍巖靈骨塔位；另包含詠嘉科技公司、國寶服務股份有限公司股票，元江投資有限公司出資額，以及數百件女裝等多項動產。士林分署提醒，上午場次（太子集團案物件）登記時間為上午10時至10時30分，10時30分準時開拍；下午場次（123聯合拍賣會）登記時間為下午2時30分至3時，3時整準時開拍。應買人須攜帶身分證辦理登記，公司行號另須檢附公司登記事項卡，完成登記後方可入場競標，呼籲有意參與民眾留意拍賣流程，準時到場，以免錯失機會。士林分署拍賣太子集團案NIKE品牌二手鞋。（記者劉詠韻翻攝）士林分署2月3日上下午場拍賣會海報。（記者劉詠韻翻攝）    ,https://news.ltn.com.tw/news/society/breakingnews/5323173
桃園醋男夥眾伏擊前女友新歡險奪命 檢依殺人未遂起訴2人,社會,2026/01/27 10:18,桃園市曾姓男子夥同冉姓男子等人持開山刀、棍棒伏擊前女友新歡，桃園地檢署依殺人未遂罪嫌分別起訴2人。（記者余瑞仁攝）桃園市35歲曾姓男子因不滿鄭姓前女友與趙姓男子交往，涉嫌夥同35歲冉姓及另名身分不明男子（A男）於2023年7月間設計闖入趙男住處後，由曾男持開山刀猛砍趙男，冉男、A男分持棍棒痛毆，砍殺到趙男無力反抗倒下才離去，趙男因此受有頭部、左手掌深部撕裂傷及右手多處撕裂傷及左側尺骨骨折等傷害，經送醫急救保住一命；警方獲報逮捕曾男送辦，經桃園地檢署後依殺人未遂罪嫌起訴，冉男事後被通緝到案，近日起訴。檢警調查，曾男因前女友鄭女與趙姓男子交往而有嫌隙，而與冉男、A男共謀教訓對方，2023年7月29日深夜分持開山刀、棍棒前往趙男與鄭女位於桃園市中壢區住處樓下，由曾男打電話將趙男騙下樓之際，再先行上樓誘騙鄭女開門進入屋內，待趙男下樓撲空返回之際，曾男二話不說持開山刀砍向趙男，冉男、A男也分持棍棒加入，趙男見狀以左手掌抵抗被深度砍傷，頭部、左肩、右手也分別挨刀見血，左側尺骨更被棍棒打到開放性骨折，曾男一夥見趙男倒地不起才離去。請繼續往下閱讀...趙男隨後報案被送醫急救始倖免於死，中壢警分局獲報查出曾男糾眾行兇後，循線逮捕曾男送辦，桃園地檢署偵辦期間傳喚冉男未到案而發布通緝；檢方認為，曾男等人持開山刀、棍棒加害，恐會造成被害人死亡結果，具不確定殺人故意，去年間先依殺人未遂罪嫌將曾男起訴，冉男近期被通緝到案，檢察官依殺人未遂罪嫌追加起訴。    ,https://news.ltn.com.tw/news/society/breakingnews/5323180
台62線暖暖交流道貨櫃車輪胎脫落起火 濃煙竄天嚇壞後方駕駛,社會,2026/01/27 10:08,一輛貨櫃車今天上午行經台62線萬瑞快速道路暖暖交流道時，輪胎突然掉落燒起來，嚇壞路過駕駛。（記者林嘉東翻攝）一輛貨櫃車今（27日）上午行經台62線萬瑞快速道路暖暖交流道時，輪胎突然掉落燒起來，嚇壞路過駕駛。所幸消防人員迅速到場灌救，現場無人傷亡。基隆市消防局於上午7時13分接獲報案稱，台62線東向9.2公里暖暖交流道前約100公尺處，發生輪胎掉落後起火燃燒。彭姓貨櫃車駕駛報案表示：「輪胎飛出去燒起來了！」消防局隨即派遣七堵分隊出動3輛救災車、7名消防人員趕赴現場支援。請繼續往下閱讀...消防人員抵達現場時，發現起火物為掉落路面的輪胎，冒出陣陣濃煙與火花，而非車體本身起火；消防隊員立即灌救滅火。經初步確認，現場無人員受困或傷亡，虛驚一場。警方初步調查指出，彭男當時駕駛貨櫃車行經該路段，疑因車輛右後中軸車輪故障，導致輪胎突然脫落並因摩擦引燃。警方隨後協助協調拖吊車到場移除障礙物，目前該路段已恢復通暢，詳細事故原因仍待進一步釐清。基隆市消防局呼籲，駕駛人上路前應定期檢查車輛狀況、胎紋深度及胎壓，以確保行車安全，避免發生意外。一輛貨櫃車今天上午行經台62線萬瑞快速道路暖暖交流道時，輪胎突然掉落燒起來，嚇壞路過駕駛。（記者林嘉東翻攝）一輛貨櫃車今天上午行經台62線萬瑞快速道路暖暖交流道時，輪胎突然掉落燒起來，消防隊員迅速趕抵滅火。（記者林嘉東翻攝）一輛貨櫃車今天上午行經台62線萬瑞快速道路暖暖交流道時，輪胎突然掉落，嚇壞路過駕駛。（記者林嘉東翻攝）    ,https://news.ltn.com.tw/news/society/breakingnews/5323171
辯眼睛不好！孫生母偷Gucci包遭活逮 移送士檢後請回,社會,2026/01/27 10:00,據悉，孫生媽昨天來到麵店外，觀察四下無人註意後進入店內，並往儲藏室一路走去；而店老闆其實早就發現孫生媽詭異行經，於是一路跟隨，下手時被老闆逮個正著，當場攔下她並報警處理。（資料照）曾因竊盜罪多次入獄的前「反骨男孩」成員孫生母親，昨日下午涉嫌在新北市淡水區一家麵店的員工儲藏室竊取Gucci名牌包等財物。警方晚間將人移送士林地檢署複訊後，檢方認尚無羈押必要，諭知請回。據了解，昨日下午2時許，69歲的孫生母親前往淡水區中山北路一段某麵店，趁店內員工忙碌、無人注意之際進入店內，並一路走向員工儲藏室，涉嫌竊走放在裡頭的一只Gucci包包。由於店家早已察覺其行徑異常，遂一路尾隨觀察，待她下手後當場攔下，隨即報警處理。請繼續往下閱讀...警方獲報到場後，當場扣回失竊財物，包含Gucci名牌包、提款卡及現鈔等，初估財損約3萬元，並將孫生母親帶回淡水警分局水碓派出所偵辦。警詢時，她則辯稱，「我眼睛不好，不知道拿了什麼東西」，否認有竊盜犯意。警方晚間依竊盜罪嫌，將孫生母親移送士林地檢署複訊；檢察官訊後，認定尚無羈押必要，諭知請回。孫生母親過去曾因多起竊盜案件遭判刑，台北地方法院曾判處她有期徒刑6個月，並與其他案件合併執行，總刑期達1年8個月，於2024年11月才出獄。不過，重獲自由後不久，去年2月3日又被控在台北市士林區一家名床門市，趁店員不注意時，徒手竊走放在櫃檯上的藍色皮夾，內有現金8000元、健保卡及提款卡等物，檢方已依竊盜罪提起公訴。孫生過去亦曾在節目中提及，童年時期因家庭狀況不穩定，小學時曾被同學誤認涉入竊盜事件，事後才發現與母親行為有關，相關經歷對其成長造成不小影響。    ,https://news.ltn.com.tw/news/society/breakingnews/5323155
不捐款就發動抗爭！ 高雄里長聯手宮廟主委勒索廠商被起訴,社會,2026/01/27 09:58,高雄永安區維新里無黨籍里長蔣福山向永安工業區外商勒索，被依貪污治罪條例等罪偵結起訴。（資料照）高雄市永安區維新里無黨籍里長蔣福山、與文興宮主任委員張財華、及洪姓社區協會會計，淪為地方惡霸！橋頭地檢署追查發現，3人以辦理進香繞境活動對外募款，憑藉里長權勢假藉發動抗爭、舉報稽查或開罰威脅，向永安工業區外商勒索財物，全案依貪污治罪條例等罪偵結起訴。橋頭地檢署主任檢察官陳竹君、檢察官嚴維德指揮廉政署去年11月底發動搜索，陸續傳喚被告蔣福山、張財華及洪姓社區協會會計證人等5人到案。請繼續往下閱讀...經查，蔣福山等3人，以宮廟進香遶境活動對外募款，向工業區廠商要求配合，威脅廠商幹部「看你們是不是要錢都繳去給政府，還是要給地方會比較省…不然你們就做到裡面完全沒有漏洞…」，放話若不配合捐款將發動里民抗爭，或通報權責單位辦理聯合稽查對廠商開罰，勒索5萬至50萬元不等款項。檢方掌握蔣福山以惡劣口氣對工業區廠商幹部索賄的不法事證，認定蔣福山、張財華等2人涉嫌貪污治罪條例的藉勢藉端勒索財物、刑法恐嚇取財等罪嫌重大聲押獲准，全案並於近日偵結起訴。蔣福山於11年前就曾被控使用相同手法，與張財華聯手向工業區廠商索賄，遭高雄地檢署聲押獲准及起訴，並被關押160天，不過最後獲判無罪，蔣男還因此獲得冤獄刑事補償32萬元，沒想到11年後又再度涉嫌勒索廠商起訴。    ,https://news.ltn.com.tw/news/society/breakingnews/5323147
逢甲商圈藏春色！台中警只著內褲混入 破同志交友會館,社會,2026/01/27 09:46,台中警方破獲同志交友會館，在包廂內查獲情趣用品。（記者陳建志翻攝）台中市第六分局日前獲報逢甲商圈一處同志交友會館，實則經營色情交易場所，由3名男警假冒成男同志，犧牲色相裸身僅著內褲「蒐證」，近日待時機成熟，持搜索票登門查緝，當場查獲2名男客裸身看A片，並在包廂查獲八爪椅、吊掛用具等情趣用品，還有保險套、潤滑液、蒙面面具等證物，將負責人姚姓男子（45歲）依妨害風化移送法辦，男客則依違反社會秩序維護法裁罰。台中市第六分局獲報，逢甲商圈一處會館表面上為男性交友休憩空間，實際上卻收取500元的入場費，另外還收包廂內，讓消費者在包廂內看A片，並自由從事色情活動。請繼續往下閱讀...警方為掌握事證，事前派出3名俊俏男警，假扮同志客人潛入蒐證，為避免遭拆穿，還跟著赤裸上身、僅著內褲跟大家打成一片，自然融入對話與互動，歷經多日觀察與蒐證，確認場內確實涉及不法色情交易。近日由專案小組持搜索票登門查緝，當場查獲2名赤身裸體的男客在包廂內看A片，並逮捕姚姓負責人（45歲），查扣不法所得、工作手機，以及店內提供給客人使用的保險套、潤滑液、蒙面面具等證物。警方調查發現，該同志會館約有10間包廂，裡面擺設八爪椅、吊掛用具等情趣用品，每人進場收500元的入場費，另外收包廂費，讓男客在裡面看A片助興，並從事性行為，依妨害風化將姚男移送法辦，另男客則依違反社維法裁罰。台中警方破獲同志交友會館，現場查獲保險套、潤滑液、蒙面面具等證物。（記者陳建志翻攝）台中警方破獲同志交友會館，現場查獲赤身裸體男客。（記者陳建志翻攝）    ,https://news.ltn.com.tw/news/society/breakingnews/5323126
汽車闖北埔平交道 花蓮鐵警：最高罰9萬且吊扣駕駛執照1年,社會,2026/01/27 09:44,有網友在社群平台 Threads 發文，看到花蓮新城鄉北埔平交道有一輛白色汽車卡在北埔平交道上。（民眾提供）有網友o.kuma在社群平台Threads發文，看到花蓮新城鄉北埔平交道有一輛白色汽車卡在北埔平交道上，鐵路警察局花蓮分局今指出，經查證該事件係發生於昨天中午，警鈴已響、號誌已顯示且遮斷桿已下降，該汽車仍闖入平交道範圍內，將依法告發，最高可處新台幣9萬元罰鍰，並吊扣駕駛執照一年。鐵路警察局花蓮分局指出，有關民眾於Threads上發文，汽車闖入平交道一案，用路人駕駛汽車行經花蓮縣新城鄉北埔平交道時，警鈴已響、號誌已顯示且遮斷桿已下降，該汽車闖入平交道範圍內，並直接停在黃色網狀線上，台鐵219列車立刻減速慢行通過，所幸未釀成事故。請繼續往下閱讀...針對該用路人違規之行為，鐵警花蓮分局指出，將依據違反道路交通管理處罰條例第54條第1項規定予以告發，處汽車駕駛人新台幣1萬5千元以上9萬元以下罰鍰，並吊扣其駕駛執照一年。因而肇事者，吊銷其駕駛執照。鐵路警察局花蓮分局再次呼籲用路人行近平交道時，應降速並保持安全車距，切莫以魚貫方式緊跟前車，遵守「停、看、聽」原則，遇警鈴已響、閃光號誌已顯示，應立刻停止於停止線後方；但若遇警鈴與號誌顯示，已行駛至平交道範圍內，為避免衍生事故，駕駛人應儘速通過該區域，以維持平交道範圍內淨空與安全。    ,https://news.ltn.com.tw/news/society/breakingnews/5323134
海洛因暗語「81砲戰」曝光！監聽錄音反成救命稻草 賣家翻盤無罪釋放,社會,2026/01/27 09:36,買家用「81砲戰」當暗語，此暗號成為法庭攻防的焦點，最後被告判無罪。（示意圖）彰化警方查緝毒品，在監聽的過程中聽到陳男向賣家說到「我要81砲戰」暗語，認定是毒品交易，逮捕陳男和賣家，陳男證稱是「8分之一錢的海洛因」，賣家否認販毒，仍被檢方起訴。該案進入彰化地院審理，法官擴大分析「我要81砲戰」的語意脈絡，發現「81砲戰」確是海洛因沒錯，但賣家並無意賣海洛因給陳男，因此判賣家無罪。陳男被逮後，向警方供稱，「81砲戰」就是海洛因的暗號，他要向賣家買1000元的海洛因，後來改稱買3000元，買家拿貨到他住處，一手交錢一手交貨。檢方據此將賣家起訴。請繼續往下閱讀...由於警方是監聽到「81砲戰」才動手逮人，此暗號成為法庭攻防的焦點。監聽譯文內容為，陳男打電話給賣家「我要81砲戰，我要看電影啦」，賣家回答「齁，蛤」，陳男再追問「你有給『流鼻仔』，甘嘸法度？」，賣家「甘有？沒有了啦!」陳男回「哪裡才有？」賣家再度說，「沒有了啦」。法官表示，細究雙方的對話內容，被告均回答沒有毒品，因此，就現存通話內容觀之，賣家似是拒絕購毒事宜，可見陳男的證詞已有瑕疵，其次陳男對於該次買1000元與3000元，說詞反覆，不能據此認定雙方有交易的事實，因此判處被告無罪。    ,https://news.ltn.com.tw/news/society/breakingnews/5323116
馬年推王爺平安吊飾 麻豆警結合神助守護治安交通,社會,2026/01/27 09:28,麻豆警分局結合轄內信仰中心「海埔池王府」，推出充滿手作溫度且極具收藏價值的「王爺馬符令平安吊飾」。（圖由警方提供）2026丙午金馬年，麻豆警分局結合轄內信仰中心「海埔池王府」，推出充滿手作溫度且極具收藏價值的「王爺馬符令平安吊飾」，限量吊飾將傳統池府千歲王爺馬文化與現代警政宣導結合，讓民眾在金馬年不僅有神明庇佑，更有警方守護祝福。分局指出，吊飾核心為超萌的「手工刺繡王爺馬」，馬兒背上繡著鮮紅亮眼的「金錢袋」，象徵金馬送財、富貴入袋，祝賀民眾新的一年財運亨通。配備2款特製布標，黃色布標印有「海埔池王府」池府千歲的神聖符令，象徵神明護佑、鎮煞祈安；深藍色布標則印上警徽及「治安平穩、交通順安」字樣，代表警方守護地方治安與交通的堅定決心。請繼續往下閱讀...麻豆警分局長洪國哲表示，與海埔池王府的聯名，是希望將的「反詐騙」與「交通安全」宣導訊息，透過民眾喜愛的文創平安吊飾，更貼近大家的生活。吊飾不僅是象徵平安的「吉祥物」，更傳遞了警方守護地方治安與交通的信念。為了讓更多民眾感受王爺馬的好運，麻豆分局將於過年前夕在「麻豆分局臉書粉絲專頁」舉辦線上有獎徵答活動，只要參與就有機會獲得吊飾。麻豆警分局結合轄內信仰中心「海埔池王府」，推出「王爺馬符令平安吊飾」。（圖由警方提供）麻豆警分局結合轄內信仰中心「海埔池王府」，推出充滿手作溫度且極具收藏價值的「王爺馬符令平安吊飾」。（圖由警方提供）    ,https://news.ltn.com.tw/news/society/breakingnews/5323107
台13線三義路段連環追撞 2輛警用大型重機被撞,社會,2026/01/27 08:43,苗栗縣警察局交通隊2輛警用大型重機遭追撞倒地。（圖由警方提供）台中市59歲童姓男子駕駛轎車，昨（27）日傍晚於台13線苗栗縣三義鄉八股路段，因未注意車前狀況，追撞前方一輛轎車，被撞的轎車又再追撞前方2輛警用大型重機，幸好警用大型重機2名騎士員警跳車，未受傷，但2輛新警用大型重機被擊落，得進廠送修。轄區苗栗警分局今天表示，該起事故發生於昨天傍晚5點14分許，童男駕駛轎車由台13線北往南直行，準備返家，至近八股路口時，未注意前方路口紅燈，追撞上前方由41歲徐姓女子駕駛的轎車。請繼續往下閱讀...徐女轎車遭撞後，車輛前衝，撞上前方苗栗縣警察局交通隊2名執行大型重機巡邏勤務的員警，2警跳車、未受傷，但徐女受瞬間撞擊受挫傷，由救護車送醫救治，無生命危險。警方調查，2名執勤員警及徐女沒有酒駕情形，童男經酒測，雖有酒精反應，但酒測值未超標，且通過生理平衡測試，後續依相關規定處理。苗栗警分局呼籲駕駛車輛除應全神貫注，更不得有酒後駕駛行為，以確保自己與用路人生命財產安全。苗栗縣警察局交通隊2輛警用大型重機遭追撞倒地，2警跳車未受傷。（圖由警方提供）童姓男子駕駛的轎車，因追撞前車，車頭毀損。（圖由警方提供）    ,https://news.ltn.com.tw/news/society/breakingnews/5323067
男稱提供帳戶可獲1500萬 卻要倒賠300萬還被判刑,社會,2026/01/27 08:39,陳男供稱提供帳戶可獲1500萬，卻要倒賠300萬，還被法院判刑。（資料照）羅姓婦人誤信詐騙技倆將300萬元匯入陳男的銀行帳戶後遭提領一空，警方據報將該帳戶持有人陳男查緝到案，陳男卻辯稱是基於未婚夫妻情誼才提供該帳戶，以為可獲得1500萬元入帳，沒想到會被作為詐騙工具；但法官並不採信，除依詐騙共犯判處陳男4個月徒刑，還要賠償羅姓被害人300萬元。羅姓婦人1年多前接獲自稱是檢察官的詐騙集團成員電話，指她被冒名申辦低收入戶補助，涉犯洗錢案件，須依指示操作才能暫緩凍結帳戶資金，羅婦信以為真，陸續將300萬元匯入詐騙集團指定的銀行帳戶，羅婦驚覺受騙後，已追不回匯款，經報警處理，警方遂將該帳戶持有人陳男依違反洗錢防制法送辦。請繼續往下閱讀...陳男卻辯稱，他認識1名王姓女子，王女說要幫他註冊公司創業還要跟他結婚，並要匯款1500萬元給他，他才提供銀行帳戶給王女匯款，根本沒想到會被詐騙集團作為犯罪工具。屏東地院認為陳男與所稱的王女從未見過面，僅憑電話連繫便論及婚嫁還要匯款1500萬元，有違社會一般大眾的認知，不足採信，陳男涉及詐騙被判4個月得易科罰金之刑確定，並應給付羅姓婦人損失的300萬元；可上訴。    ,https://news.ltn.com.tw/news/society/breakingnews/5323066
高雄加強春節交安維護 鎖定「機、老、大、酒、行」5族群,社會,2026/01/27 08:38,高雄市自1月24日至元宵節，強化酒後駕車重點執法。（高雄市交通大隊提供）因應農曆春節將至，高雄市警察局將自2月9日至23日加強交通安全維護，以「順暢」與「安全」為主軸，並以機（機車）、老（高齡者）、大（大型車）、酒（酒後駕車）、行（行人）5大族群為核心防制對象。高雄市交通警察大隊指出，年節期間交通疏導及安全維護整備，包含11處風景區、1處年貨大街及年節期間主要幹道，均為重要交通疏導重點，警察局均與道路主管機關積極聯繫配合，共同依據往年交通狀況，先期規劃停車區域、引導牌面、改道措施等相關作為，以確保市民年節前後交通順暢。請繼續往下閱讀...另在交通安全維護部分，以機車、高齡者、大型車、酒駕、行人5大族群為核心防制對象，並以「八大項重點違規」、「行人安全5項違規」及「大型車易肇事違規」為執法主軸，加強路口闖紅燈、嚴重超速、酒後駕車、不禮讓行人等重點違規執法及宣導，逐步降低重大交通事故發生。由於往年年初至過年前為交通事故高峰，尤其酒後駕車更為防範重點，警察局已於1月23日要求各分局全面強化事故防制作為，包括「自1月24日至元宵節強化酒後駕車重點執法」、「全面強化酒後駕車宣導及防制作為」、「加強大型車違規稽查及強化工區周邊交通疏導與安全巡查」、「結合交通疏導崗，針對行人及高齡者進行關懷宣導及安全維護」及「持續加強易肇事地點精準執法」，以維護高雄市的交通安全與秩序。    ,https://news.ltn.com.tw/news/society/breakingnews/5323065
