Title,News_Type,date,content,url
德國議員訪台惹中跳腳 我外交部：中國無權置喙,政治,2026/05/26 13:19,德國國會友台小組主席徐德分（Till Steffen）率領跨黨派議員會見賴總統。（總統府提供）德國國會友台小組主席徐德分（Till Steffen）率團於本月24日至30日訪台，遭中國外交部出言反對。對此，我國外交部發言人蕭光偉今（26）日表示，中國對台灣與各國國會議員交流互訪無權置喙，德國國會議員訪台是民主自由國家間增進相互瞭解，強化交流合作的正常行為。中國外交部發言人毛寧25日被問及德國議員訪團訪台一事表示，世界上只有一個中國，台灣是中國領土不可分割的一部分，中方一貫堅決反對建交國與台灣進行任何形式的官方交往。一個中國原則是公認的國際關係準則與國際社會普遍共識，也是中德關係的政治基礎，並敦促德方有關人士恪守一個中國原則，「停止向台獨分裂勢力發出錯誤信號，民進黨當局倚外謀獨注定失敗」。請繼續往下閱讀...蕭光偉今日於外交部例行記者會回應表示，中華民國台灣是主權獨立國家，與中華人民共和國互不隸屬，任何意圖扭曲台灣主權地位的說法，都是破壞國際和平與穩定的霸凌行徑，再多謊言也無法改變國際社會公認的台海現狀。蕭光偉指出，外交部長林佳龍昨天午宴德國國會友台小組主席徐德分以及所率跨黨派議員訪問團，並代表政府表達誠摯歡迎，以及感謝德國國會長期致力深化台德雙邊關係與各領域合作。蕭光偉說，台灣和德國是理念相近的夥伴，兩國都重視以規則為基礎的國際秩序，外交部感謝德國持續對維持台海和平穩定現狀的支持。台灣作為國際社會負責任的成員，將持續與民主友盟合作，共同維護台海與印太區域的和平穩定。此外，我國相信台德雙方近年在關鍵科技領域的持續合作，對於歐洲「再工業化」與「再武裝化」戰略目標，台灣是歐洲可信賴夥伴。蕭光偉表示，台灣與各國國會議員交流互訪，符合民主原則與國際慣例，中國無權置喙。德國國會議員訪台是民主自由國家間增進相互瞭解，強化交流合作的正常行為。中國以錯誤不當的政治言語並企圖施壓限制國際社會與台灣互動，這不僅是對民主國家內政的干預，也是對民選國會議員的不尊重。蕭光偉強調，我國將持續與全球民主夥伴深化對話與合作，也呼籲中國停止對他國民選議員與台灣國際交流的施壓干預。    ,https://news.ltn.com.tw/news/politics/breakingnews/5449890
引進史瓦帝尼移工？ 外交部：可行性評估台史勞務合作中,政治,2026/05/26 13:14,外交部亞西及非洲司司長顏嘉良26日表示，目前台史勞務合作，仍處於可行性評估階段。（資料照）外交部長林佳龍先前曾提及欲與邦交國史瓦帝尼發展職業訓練、勞務合作。對此，外交部亞西及非洲司司長顏嘉良今（26）日表示，目前台史勞務合作，仍處於可行性評估階段；外交部目前以協助史瓦帝尼升級職訓中心為優先目標，勞動部勞動力發展署目前正在史瓦帝尼實地評估考察當地職訓中心。史國時報（Times of Eswatini）月初報導曾指出，我國在3個月內援助史國超過新台幣240億元，且每年將從史瓦帝尼招募1千名移工。當時外交部發聲否認，指出相關內容毫無事實基礎，也未提出任何具體證據，屬於典型錯假訊息操弄。請繼續往下閱讀...針對台史勞務合作，顏嘉良今日於外交部例行記者會表示，林佳龍去年4月、今年4月兩次訪問史國，與史瓦帝尼相關部會就雙邊合作交換意見，台史勞務及職訓合作方面，目前以協助史國升級職訓中心為優先目標。外交部也協調勞動部勞動力發展署於本月24日至30日赴史瓦帝尼實地評估考察。顏嘉良說明，勞動力發展署考察重點主要為考察3所史瓦帝尼現有職訓中心，評估史國目前重點職業訓練領域的培訓量能，聚焦製造業、觀光服務業、能源、建設技能的培訓狀況，作為我國未來協助史瓦帝尼擴充職訓類別與可訓練人數的依據。顏嘉良指出，此計畫主要目的為有效提升史國青年就業競爭力、培育史國產業所需專業技術人才，未來可以優先由我國即將進駐史國「台灣產業創新園區」的台商進用，達成協助史瓦帝尼促進就業、提高勞動力專業度，推動產業升級的效果。至於未來是否要引進史國勞工或專業人才，顏嘉良表示，由於涉及層面與部會非常廣，任何國家移工來台，均需符合我國外籍移工引進相關法規，目前台史勞務合作，仍處於可行性評估階段。未來若有招募移工計畫，會以維護我國國家安全、公眾健康、保障國人就業為優先前提，也以填補我國特定產業勞動力缺口，及促進雙邊專業技術交流為考量重點。    ,https://news.ltn.com.tw/news/politics/breakingnews/5449872
什麼是「外框」？名嘴發問網歪樓「白嫖黨」：什麼錢都貪,政治,2026/05/26 13:12,民眾黨中央委員林昭印。（資料照）民眾黨醜聞連環爆，除了因選舉提名風波掀「退黨潮」，現任中央委員林昭印被揭，曾上酒店「外框」小姐出場卻賴帳。消息傳開後，「外框」一詞隨之爆紅，媒體人張益贍今（26）日在社群平台發問什麼是「外框」？結果引發網友歪樓回應。另有網友湧入林昭印的臉書留言狠酸「林八千」。鏡週刊報導，時任民眾黨中央委員的咼昇華透露，3年前他作東邀地方黨部成員聚餐後續攤赴酒店，參與者包括時任桃園黨部正副主委的林昭印、黃成峻等人。不過，他午夜離場後，卻從酒店幹部得知，林當夜「框小姐出場」，還把「外框檯」費用8000元算在他身上，最終拖欠10月才還清。請繼續往下閱讀...張益贍在臉書貼上林昭印的對話紀錄並發文：「什麼是『外框八千』呀？」網友對此討論熱烈，有人解釋：「外框就是帶小姐出場的意思」，更多留言稱「吃相難看，連做這檔事也想賴帳！」「才8000也能欠10個月？……什麼錢都貪！」「白吃白喝白拿白嫖，這堂口厲害了」。在林昭印的臉書貼文下，則出現網友留言：「哥喝酒框小姐要給錢啊」「8000也付不出來？」「連這種錢都敢欠，是要出來選什麼市議員」。    ,https://news.ltn.com.tw/news/politics/breakingnews/5449726
批釋放利多看顏色 新北民進黨團：同樣訴求侯卻優先回應國民黨,政治,2026/05/26 13:10,新北市長侯友宜今日在市政總質詢，答應市議會國民黨團多項福利爭取。（記者黃子暘攝）新北市長侯友宜今（26）日於議會宣布，明年起調升、新增計6項基層經費，總計擴編經費達5億4279萬元。新北市議會民進黨團總召集人陳永福等幹部批評，民進黨團多次要求提高里鄰志工聯誼費與鄰長工作津貼，遺憾的是，市府總是優先回應執政黨（國民黨）議員的訴求，難道換了政黨，市民需求的重要性也會跟著改變？呼籲侯友宜不要只對國民黨議員「秒讀、秒回、秒答應」，民進黨議員提出的建議也是市民的聲音。陳永福、幹事長周雅玲說，民進黨議員透過質詢爭取補助母嬰、孕婦及長者施打RSV疫苗、老人免費裝假牙、帶狀疱疹疫苗定額補助等政策，這些與市民健康及家庭負擔息息相關的需求，市長都始終未正面應允，今年市府突然新增許多福利政策，包括免費國中小營養午餐等，但去年議會審議預算時，市府並未編列相關預算，相關福利新制涉及龐大財政支出與後續執行規劃，民進黨團要求市府加開臨時會辦理追加減，針對今年新增推動的社會福利事項進行專案報告，向大眾說明財源依據、政策規劃及後續影響。請繼續往下閱讀...副召李倩萍、書記長李宇翔表示，學校導護志工也需要被重視，他們每天在校門口守護學生上放學安全，市府卻僅編列400元每位導護志工作為統籌經費，就連基本裝備保障都不足，市府不能只提升鄰里志工聯誼費用，卻持續忽視導護志工的辛勞；另外，敬老卡應撥出部分點數納入各區農會、藥局消費，讓使用方式更貼近長輩日常需求。民進黨團批評，市府「釋放利多看顏色，執政真香好快樂」，希望侯友宜不要只記得執政黨議員的建議，民進黨提出的訴求，同樣也是基層與市民的聲音。    ,https://news.ltn.com.tw/news/politics/breakingnews/5449875
打臉中國！德國會友台小組見賴清德 重申民主交流不受第三方干涉,政治,2026/05/26 13:09,德國國會友台小組主席徐德分（Till Steffen）率領跨黨派議員會見賴總統。（總統府提供）賴清德總統今接見德國國會跨黨派議員團時表示，國際局勢快速變化，民主夥伴唯有彼此合作，才能維護以規則為基礎的國際秩序，期盼台德在資安、國防產業、災害防救、社會韌性等領域持續深化合作；德國國會友台小組主席徐德分提到，中國外交部昨曾批評此次訪台，但「民主國家之間的往來不會接受第三方干涉」。賴清德指出，這是第21屆德國國會友台小組首次來訪，且由跨黨派議員組成，格外具有意義。訪賓包括德國國會友台小組主席徐德分（Till Steffen）、副主席萊爾榭（Markus Reichel）及艾欣（Mandy Eißing），以及議員魏爾胥（Klaus-Peter Willsch）、卡福特（Rainer Kraft）等人。請繼續往下閱讀...賴清德表示，面對國際局勢快速變化，民主夥伴唯有彼此合作，才能維護以規則為基礎的國際秩序，感謝德國政府及國會對台灣的重視與支持。賴提到，前年9月德國軍艦時隔22年再度通過台灣海峽，且強調台海屬於國際水域、捍衛自由航行權。德國國會友台小組也多次重申支持台灣的國際參與，在在都讓台灣更有力量，與更多夥伴攜手為全球發展貢獻心力。賴清德說，這幾年來台德除了不斷深化民主價值的連結，雙邊也在經貿、科技等領域持續拓展交流，台積電在德勒斯登投資設廠，更是台德產業合作的重要里程碑，促進台灣和歐洲產業交流，進一步提升台灣與德國對全球民主供應鏈韌性的貢獻；期待台德未來在資安、國防產業或災害防救、社會韌性等各面向深化夥伴關係，以經驗攜手鞏固民主韌性。徐德分表示，此次訪團成員來自德國不同地區，並充分展現德國跨黨派對台灣的支持。他說，德國政府與國會對台的立場都沒有改變，儘管與台灣交流時，中國有時候會發表意見，像是中國外交部昨天也對此次訪問行程有所看法，對此，他要簡單以「民主社會之間交流是正常的，不會接受第三方干涉」作為回應。談及總統日前出訪史瓦帝尼，徐德分認為，這是具有邦交關係國家間的正常交流，中國對此進行干涉也引起國際間高度關注。他強調，德國與台灣的關係歷經多年考驗，不會發生任何改變，然而面對外部環境的持續變化，兩國應持續加強雙邊交流，共同面對來自威權政體的威脅。徐德分表示，台灣與德國在全球布局、產業韌性、國防及民防等產業發展面臨相同挑戰，並有許多共同點及可以相互學習之處，期盼兩國在許多領域展開新的合作。訪賓包括德國國會友台小組主席徐德分（Till Steffen）、副主席萊爾榭（Markus Reichel）及艾欣（Mandy Eißing），以及議員魏爾胥（Klaus-Peter Willsch）、卡福特（Rainer Kraft）等人。（總統府提供）    ,https://news.ltn.com.tw/news/politics/breakingnews/5449871
鄰近專制中國仍成功民主化 美國NED創會主席盛讚台灣成就,政治,2026/05/26 13:08,與談的美國民主基金會（NED）創會主席卡爾．格什曼（Carl Gershman）今出席「公元兩千論壇」會前記者會時高度肯定台灣的民主成就。（主辦單位提供）前捷克總統哈維爾創辦的「公元兩千論壇」首度移師亞洲，明在台北登場。與談的美國民主基金會（NED）創會主席卡爾．格什曼（Carl Gershman）今出席會前記者會時高度肯定台灣的民主成就。他強調，台灣作為與龐大專制政權比鄰的華語國家，在經濟、科技與政治上的成功，充分證明了「民主不是西方的專利，而是全世界的普世價值」。格什曼表示，美國國家民主基金會由雷根總統於1982年倡議發起，在美國國會的跨黨派支持下挺過艱難處境、持續壯大。他預告，明天將在論壇談論台灣議題，因為NED的發展歷程，有一部分就是與台灣建立夥伴關係。請繼續往下閱讀...格什曼回憶，他1994年首度來台，當時便萌生「台灣應該建立一個類似 NED 的基金會」的構想，時任新聞局長胡志強當時有個宏大願景，希望台灣成為被世界認可的「第三波民主國家」。為此，雙方1995年在台灣舉辦史上最偉大民主會議之一的盛會，集結來自25國的60位全球頂尖政治學者，當時的總統李登輝、台北市長陳水扁、台灣省長宋楚瑜都與會演講，那場會議也凸顯「民主已經降臨台灣」的重大意義。談到台灣當前民主發展，格什曼表示，台灣的民主對全世界具有重要的象徵意義，台灣體積雖小，且緊鄰一個龐大的華語專制政權，但台灣的成就代表著，在具備儒家文化認同的華語國家中，完全具備實現民主的可能性。格什曼盛讚，台灣是非常成功的民主國家，不僅造福自己的人民，更象徵民主理念的普世性，證明民主不是西方的專利、已經傳播到全世界。民主國家內部必然存在分歧，這在美國等國都很正常，但台灣歷經數十年奮鬥，不僅成功轉型，在經濟、科技、政治上都取得卓越成就，這段歷程值得國際探討。    ,https://news.ltn.com.tw/news/politics/breakingnews/5449854
馬辦內鬨！粉專分析：金溥聰大戰蕭旭岑爭奪馬英九政治遺產,政治,2026/05/26 13:03,金溥聰昨表示，蕭旭岑稱他在基金會不管錢，但他們從王光慈電腦硬碟取得的照片顯示，蕭旭岑親手收受台商總會會長韓螢煥捐款，但在基金會帳戶未找到類似金額的入帳資料。（資料照）臉書粉專「聲量看政治」今日發文表示，前總統馬英九辦公室與基金會爆發嚴重內鬨，昨日記者會引爆宮鬥劇首波高潮，這場內戰表面上是財務爭議，實質上則是馬英九晚年政治遺產的正統爭奪戰。老臣金溥聰以護主姿態出刀，企圖奪回馬英九形象的解釋權；蕭旭岑則以遭抹黑、被清算強力反擊，全力捍衛自己作為兩岸路線代理人的政治位置。粉專「聲量看政治」分析，從大數據聲量圖來看，金溥聰在前幾天聲量低迷，直到昨日親自帶著律師與會計師出馬，並當場祭出關鍵的現金照片，聲量隨即爆衝。金溥聰過去慣用關鍵時刻出刀取得控制權，這次他將複雜的財務爭議，壓縮視覺畫面，成功發動心理戰。此舉不僅讓群眾產生直覺連結，更將蕭旭岑從幕僚直接打成嫌疑人。請繼續往下閱讀...粉專「聲量看政治」認為，金溥聰或許最在意的是馬英九的歷史形象不能被蕭旭岑、王光慈這批人重新定義。對他來說，馬英九是他一生政治工作最重要的作品。「聲量看政治」提及，金、蕭兩人最大的差異，在於金溥聰靠忠誠，搶奪誰最懂馬英九政治人格的忠誠正統；蕭旭岑則靠授權，伸張自己依循指示執行兩岸交流的執行者正統。「聲量看政治」直言，蕭旭岑的心理，則是新代理人面對舊馬系清算時的生存戰。他隨即採取法律行動反擊，將戰場拉回「程序正義」。他怕的是自己多年建立的兩岸人脈、政治角色與馬辦代表性一夕之間被打成貪腐、欺瞞與架空，這才是讓他寢食難安的事。「聲量看政治」指出，金溥聰在搶回馬英九本人的詮釋權，蕭旭岑則在保住自己身為馬英九路線的代理權。兩人都說自己是在保護馬英九，但真正被保護的，其實是各自的政治位置。馬辦風暴持續延燒。（圖擷取自「聲量看政治」臉書粉專）    ,https://news.ltn.com.tw/news/politics/breakingnews/5449632
馬英九基金會財務爭議 新北文化局將發函要求說明,政治,2026/05/26 12:59,針對馬英九基金會財務爭議，新北市文化局表示，將函請基金會就財務及帳務情形提出說明。（記者賴筱桐攝）前總統馬英九指控馬英九基金會前執行長蕭旭岑、王光慈涉破壞財政紀律，前國安會秘書長金溥聰指控，蕭在2023年曾親手收受台商韓螢煥捐款100萬元，但在基金會帳戶未找到入帳資料。主管機關新北市政府文化局今天表示，將發函給馬英九基金會，就財務及帳務情形提出說明，釐清是否違反《財團法人法》。馬英九基金會爭議延燒，金溥聰表示，基金會今年2月10日舉辦尾牙，王光慈當日私下發放年終獎金146萬元，還有不知總額的績效獎金，是基金會第一次改用現金。請繼續往下閱讀...王光慈回應，因捐款人不願意入基金會的帳目留下紀錄，改捐現金給馬英九個人；蕭旭岑也說，未入帳的捐款是因馬英九的卸任禮遇即將結束，部分企業與台商希望捐給馬個人，向馬請示之後，馬指示一切用於公務。因馬英九基金會登記地址在新北市淡水區，新北市政府文化局表示，依法設立的財團法人，其財務、會計及捐款收支，均應依《財團法人法》及相關規定辦理，並定期向主管機關申報財務資料。文化局表示，針對個案情形，目前仍須釐清相關款項究竟屬於基金會或是個人，文化局將函請馬英九基金會，就相關財務及帳務情形提出說明；如查有違反法規情形，將依《財團法人法》及相關規定辦理。據了解，若該筆捐款屬於馬英九基金會，依規定必須列入財務報表，否則涉嫌違反《財團法人法》，主管機關可請會計師查核，要求限期改善、補正資料等，屆期不改善者將處以罰款，若情節重大，得移送警察或檢調機關偵辦。不過，若該筆款項是捐給個人，可能涉及贈與稅議題。    ,https://news.ltn.com.tw/news/politics/breakingnews/5449874
0-18歲每人月發5000元成長津貼 卓揆：具體內容本週內向國人報告,政治,2026/05/26 12:53,行政院長卓榮泰今早赴立法院接受施政總質詢前接受媒體聯訪回應時事議題。（記者塗建榮攝）總統賴清德日前發表就職兩週年談話時，針對少子女化現象，他拋出18歲前每人每月5000元成長津貼，廣獲朝野認同也引發外界討論；對於政策具體進度，行政院長卓榮泰今指出，相關政策研擬已推動大半年以上時間，目前進入政策執行規劃最後階段，可望近2日內有所結果，並在本週內向國人報告具體內容。賴總統本月20日發表就職2週年談話，其中，他針對國家少子女化挑戰，公開提出「台灣人口對策新戰略」家庭支持篇相關政策，其中一項是提供0到18歲成長津貼，每人每月5000元，除獲朝野支持，也引發社會各界討論。請繼續往下閱讀...被問及上述政策目前最新進度為何？行政院長卓榮泰今（26）日上午赴立法院接受施政總質詢前受訪表示，台灣人口對策新戰略的規劃，政府已推動大半年以上的時間；目前已進行到最後，正在商討政策執行上的細節，並請各部會來推動。卓榮泰強調，至多1、2天內，相關政策規劃就會有所結果，可望在本週內有更詳細、具體的政策內容向國人說明。    ,https://news.ltn.com.tw/news/politics/breakingnews/5449832
蕭旭岑稱馬英九不宜出席活動 她揪細節：過年前還安排中評社專訪？,政治,2026/05/26 12:46,蕭旭岑昨透過聲明表示，周美青去年10月轉達醫師訊息，建議馬英九不宜再出席公開活動。顏擇雅比對時間點，質疑蕭旭岑為何在今年過年前還幫馬英九安排中評社專訪？（資料照）前總統馬英九指控馬英九基金會前後任執行長蕭旭岑、王光慈「破壞財政紀律」，但意外爆出馬疑似「失智」，使得馬英九的健康狀況受到關注。蕭旭岑昨透過聲明表示，周美青去年10月轉達醫師訊息，建議馬英九不宜再出席公開活動。作家顏擇雅比對時間點，質疑蕭旭岑為何今年過年前還幫馬英九安排中評社專訪？顏擇雅表示，馬英九「失智」消息去年秋天在台北政治媒體圈應該就不是秘密，儘管是口耳相傳，但大家都不敢講開，真正講開的時機點，是蕭旭岑今年3月24日那篇千字文，七度強調馬英九「都忘記了」。現在蕭旭岑最新爆料聲稱，周美青去年10月28日就轉達北榮醫師訊息，建議馬英九不宜再出席公開活動，而顏擇雅質疑：「為什麼今年過年前，他還幫馬英九安排中評社專訪？」請繼續往下閱讀...顏擇雅提到，中評社與台辦關係特殊，其記者寫稿除了公開刊出的新聞稿，還有高層才能讀到的內部報告。顏擇雅在貼文中貼出馬英九於今年2月14日刊出的報導，馬英九強調「旭岑最了解我的兩岸路線」，蕭旭岑現在輔佐鄭麗文，讓他深感欣慰很放心。顏擇雅指出，2月14日刊出的報導是政治部分，對於近來心智能力有第一手觀察的人可自行判斷，他是否依然具備如此複雜的表述能力，顏認為：「我讀到他大讚蕭旭岑那段是覺得假假的。」而在2月17日大年初一刊出的是馬英九談及「養身秘訣」，顏擇雅質疑：「這篇就是笑話了。如果早在10月底，蕭旭岑已知醫生建議馬英九不該再有公開活動，為什麼還安排這個專訪呢？為什麼是中評社？這個安排是為誰服務？顯然不是為了馬英九，不是嗎？還把馬英九包裝成養生專家！」    ,https://news.ltn.com.tw/news/politics/breakingnews/5449779
