Title,News_Type,date,content,url
綠營議員參選人定裝照曝光！ 賴瑞隆：高雄隊就定位,政治,2026/04/23 18:56,賴瑞龍與鄭孟洳。（賴辦提供）民進黨高雄市長參選人賴瑞隆昨、今連續兩天，與黨籍市議員參選人拍攝形象定裝照；賴瑞隆宣告「高雄隊就定位」，強調團隊秉持共同目標，團結一致守護高雄。賴瑞隆表示，這次拍攝象徵一支「團結、專業、協同打拚」的高雄隊正式成軍，無論是現任議員或新秀，皆在過程中發揮創意與個人特色，展現拚戰精神與活力。請繼續往下閱讀...拍攝現場亮點不斷。現任議員何權峰、郭建盟、鄭光峰、湯詠瑜著正裝展現穩健專業；張勝富抱著「高雄熊」玩偶、林志誠手捧「蜜柑站長」娃娃、張漢忠做出騎機車姿勢。黃飛鳳、黃秋媖推廣選區鳳梨跟芭樂等，曾為選手的黃文志持弓箭入鏡，黃明太呈現魄力氣勢，陳慧文、李雨庭、林智鴻換上球衣象徵強棒出擊；鄭孟洳戴上拳擊手套揮拳，黃文益則帶著愛犬「小花」一同拍攝，結果「小花」不時親近賴瑞隆。參選人蔡秉璁手持菜、餅、蔥，大玩諧音創意；尹立、黃敬雅擺出年輕流行手勢，顯示貼近新世代的風格；曾為運動員的洪村銘、蘇致榮發揮熱血活力；張以理、張耀中、鄧巧佩、吳昱鋒等人則以奔跑、跳躍、動漫姿勢等呈現巧思；陳琳潔則展現會計師專業形象。原住民議員參選人巫振興更邀請賴瑞隆穿著傳統服飾入鏡，反映出高雄多元共融的城市面貌。賴瑞隆指出，將扮演好「最強母雞」角色，與所有議員夥伴協同作戰，建立完整的服務體系，讓政策與在地需求無縫接軌；不僅要在2026年打出關鍵勝利，更要打造一支真正為高雄打拚、負責的專業團隊，與市民攜手拚出更進步、幸福的高雄。賴瑞隆與鄧巧佩。（賴辦提供）賴瑞隆與黃文志。（賴辦提供）賴瑞隆與張耀中。（賴辦提供）賴瑞隆與洪村銘。（賴辦提供）賴瑞隆與蔡秉璁。（賴辦提供）賴瑞隆與陳琳潔。（賴辦提供）賴瑞隆與蘇致榮。（賴辦提供）    ,https://news.ltn.com.tw/news/politics/breakingnews/5413906
批北士科產業專區開發率僅43％！秦慧珠呼籲儘速成立專案小組,政治,2026/04/23 18:44,北市議員秦慧珠指出，目前北士科產業專區開發率僅43%。（翻攝台北市議會直播）台北市議會今（23日）進行財政建設部門質詢，議員秦慧珠指出，目前北士科產業專區開發率僅43%，市長蔣萬安上任三年，T3、T4、T12三塊地都沒有招標出去，且輝達簽約後，市府仍未建立專案小組協助，呼籲市府應積極成立。產業發展局長陳俊安則指出，T3、T4、T12為地政局土地，將在下半年重啟招商，如果地政局需要提供潛在的媒合名單，將再提供給地政局。請繼續往下閱讀...秦慧珠表示，北士科園區從2016年開始開發，全區土地為94.38公頃，科技產業專區約25公頃，經過10年僅開發43%，還有57%的土地仍閒置，開發進度實在是太慢，「你花十年開發43%，剩下57%是不是還要再搞十幾年？」秦慧珠指出，北士科園區，市政的土地佔比4成，民間的土地佔6成，市府的土地共有5塊，2021年開始有T16與T17、18共兩筆土地招標出去，蔣萬安上任三年，剩下三筆T3、T4、T12的進度為0，都沒有招標出去。秦慧珠說，目前民間土地多為閒置地、需要去整合，後續再找科技業者有沒有興趣來蓋大樓，當時她也詢問有沒有專案小組來處理，結果也沒有，讓民間土地放牛吃青草，她記得輝達找地碰壁時，就有民間的業者說有地願意給輝達，代表民間也有意願，沒有人出來整合。秦慧珠指出，現在輝達都已簽約了，但是後續市府卻沒有專案小組來協助輝達，市府還告訴她，針對都市建築審議、建築執照核發、核准開工，將由都發局負責，市政府做行政協助，這樣的態度輝達哪一年才會蓋好？秦慧珠說，市府和輝達簽約的期限是118年3月12日前開工即可，開工後還需要至少3到4年的時間，市府應該積極成立專案小組，包括產發局、地政局、土地開發總隊、交通局、都發局、工務局、建管處、捷運局，市府立刻成立專案小組，功能包括北士科產專區剩下的57%區域，應有完整的開發期程，再來協助督導輝達。陳俊安表示，針對輝達部分，他們跟地政局的土地開發總隊簽約內容，是在取得用地後的五年內要完成興建，因此不會在三年之後才開工；雖然市政府專案小組，不過包括他與都發局、地政局，都有跟輝達保持聯繫。陳俊安受訪表示，T3、T4、T12為地政局土地，將在下半年重啟招商，如果地政局需要提供潛在的媒合名單，將再提供給地政局。    ,https://news.ltn.com.tw/news/politics/breakingnews/5413864
民進黨畫性平紅線 徐國勇：人事提名將高度重視性騷擾經歷,政治,2026/04/23 18:37,民進黨舉辦本年度首場中央黨部黨工性騷擾防治教育訓練。（民進黨提供）為持續強化性別平等與職場友善文化，民進黨今天（23日）舉辦本年度首場中央黨部黨工性騷擾防治教育訓練。民進黨秘書長徐國勇說，民進黨致力成為性別平權標竿，除要求黨工從內心建立正確觀念，由他律轉向自律外，未來在人事提名上，將高度重視候選人是否具備性騷擾相關經歷，以體現進步政黨價值。民進黨說明，本次課程邀請律師廖蕙芳擔任講師，以「職場性騷擾防治與實務案例解析」為題，引導黨工從法院判決觀點理解性騷擾行為之風險，並反思日常互動中可能造成傷害之言行，以建構更為紮實的職場安全網。請繼續往下閱讀...「開玩笑不是性騷擾的保命符！」廖蕙芳特別提醒，職場性騷擾樣態多元，包含交換式性騷擾與權勢性騷擾，並可能發生於工作時間內外，甚至延伸至具有業務往來關係的對象。她透過實際判決案例說明，如對他人穿著進行評價、講述帶有性意味的笑話、偷拍行為等，即使行為人主觀上認為是「玩笑」，但只要造成他人不適，即可能構成性騷擾。廖蕙芳強調，關鍵在於是否已逾越他人界線並造成傷害。她分享實務案例指出，有被害人於多年後才提出申訴，顯示性騷擾對個人心理影響深遠，提醒黨工應提高敏感度，避免任何可能造成傷害的言行。職場霸凌與性騷擾在部分情境中可能交錯發生，尤其當霸凌行為涉及性別歧視或性意味時，更需審慎處理。徐國勇則說，建立安全且友善的職場文化，是組織永續發展的基礎。許多性騷擾案例往往源於「無心的玩笑」或對界線的忽視，例如過度評論他人外貌、在公開場合拍照上傳並引發不當評論等，皆可能構成性騷擾。徐國勇說，除了依循現有制度，黨工更應從內心建立正確觀念，逐漸從「他律」轉成「自律」，強化自我規範能力。他更重申，民進黨致力於成為性別平權的標竿，在人事提名上，亦會高度重視候選人是否有性騷擾相關經歷，這正是進步政黨價值的體現。性別平等事務部主任李晏榕指出，打造性別友善職場不僅是制度責任，更需要每一位成員的共同參與，無論是當事人或旁觀者，都能在關鍵時刻做出適當回應。參與相關調查程序的黨工應嚴守保密原則，這在實務上雖具挑戰，卻是保障當事人權益的重要關鍵；期盼透過持續教育訓練，深化組織內部對性別議題的理解。    ,https://news.ltn.com.tw/news/politics/breakingnews/5413822
新聞360》藍白「嗆台驚句」連發！他邏輯打臉：這件事國民黨忘了嗎,政治,2026/04/23 18:30,全新的視界！新聞話題不漏接，快訂閱YouTube 【自由追新聞】，記得開啟小鈴鐺哦！    ,https://news.ltn.com.tw/news/politics/breakingnews/5413880
徐瑞希提確認黨員資格勝訴 民眾黨難以理解：會再上訴,政治,2026/04/23 18:25,徐瑞希被民眾黨認定臉書貼文「公示退黨」，提起民訴確認黨員資格，台北地院判她勝訴，可上訴。（記者翁靖祐攝）曾列民眾黨不分區立委的前公視董事徐瑞希2024年不滿前立委黃珊珊曾代理財團仲介法務、助長剝削移工，在社群發文宣布「退黨」，黨中央認為她公示退黨、剝奪其黨員權利，徐瑞希提出民事訴訟，要求確認黨員資格。台北地院今（23）判徐勝訴，可上訴。對此，民眾黨對於判決結果難以理解，表示後續待收到判決書確認理由後，將研議上訴。針對徐瑞希案判決結果，台灣民眾黨發言人張彤今天傍晚回應，民眾黨對結果難以理解，待收到判決書看到理由後，將再請律師研議提起上訴。請繼續往下閱讀...徐瑞希曾列民眾黨2024年不分區立委名單第17名，然而，她先前指控黃珊珊曾代理財團仲介法務助長剝削移工，於臉書上宣布將退黨，而民眾黨認定她「公示退黨」，進而剝奪其黨員權利。不過，徐瑞希認為民眾黨並無經過正式退黨程序，因此提告。徐瑞希上月於台北地院庭審上說，臉書發文的特性為供不特定人，屬個人情緒抒發，且貼文中並未標註、或是分享給民眾黨，不算是對民眾黨的意思表示；而她也非公眾人物，既無發布採訪通知或召開記者會，也未向民眾黨遞交退黨聲明，認為民眾黨應對貼文傳播效果進行舉證；民眾黨委任律師賴苡安指出，徐雖主張聲明是情緒抒發，那應在媒體報導其聲明內容時，立即向媒體澄清她並未退黨、不應過度解讀，然徐未立即刪除該貼文，且當時各大媒體已報導徐的退黨聲明，若民眾黨不承認其效力，恐導致法律狀態的不確定性。    ,https://news.ltn.com.tw/news/politics/breakingnews/5413840
兩岸新增航點無回頭客？梁文傑揭「1實情」讓航空公司評估,政治,2026/04/23 18:24,針對兩岸航班新增直航點，陸委會發言人梁文傑今天強調，這是特定旅遊點的包機，「回程並不會有新疆人、蘭州人、或哈爾濱人來台」。（記者叢昌瑾攝）中國呼籲全面恢復兩岸客運直航，陸委會回應「沒有回頭客」，全國商業總會理事長許舒博則質疑「哪一架飛機沒有回載率？」對此，陸委會發言人梁文傑今天強調，這是特定旅遊點的包機，「回程並不會有新疆人、蘭州人、或哈爾濱人來台」，所以就讓市場機制去解決，看航空公司評估說有沒有賺頭。鄭習會後，中共提出十大涉台措施，要求恢復烏魯木齊、西安、哈爾濱、昆明、蘭州等城市兩岸航班，以及開放中國上海、福建民眾來台自由行，日前還透過兩岸「民航小兩會」致函我方，呼籲全面恢復兩岸客運直航。全國商業總會則於20日召七大公協會「以商逼政」要求民進黨政府接受。請繼續往下閱讀...梁文傑今日在陸委會記者會嚴正表示，許舒博的說法稱「把乘客載過去，乘客就會回來」，其實來來去去指的都是台灣旅客。但陸委會說的是，航班將台灣旅客載過去後，回來的並不一定是同一批台灣旅客。應該要有中國旅客來台灣，這個航線才有長久經營的可能性，不然只是特定旅遊點的包機。梁文傑指出，中國所提出的烏魯木齊、蘭州、哈爾濱這些城市，基本上就是旅遊點，要台灣的旅客載過去，「回程並不會有新疆人、蘭州人、或哈爾濱人來台」。他強調，若只是為了特定的旅遊點，要把台灣的旅客載過去，那就讓市場機制解決，看航空公司評估有沒有賺頭。梁文傑說明，「如果航空公司覺得有盈利的可能性，那他們就會來申請，我們再評估看看」。如果航空公司覺得沒有盈利的可能性，也不會強迫航空公司去發展這個航線。另外，國台辦昨日聲稱，兩岸空中直航是便利人員往來的空中紐帶，今年一季度客座率超過8成。梁文傑回應，客座率超過8成是中國民航的統計，我方的數字大約是6成多，實際只有65％，「還是可以增班，只是航空公司沒有要增」。梁文傑強調，現在國際旅遊，不管是飛歐美或日韓，對航空公司來說，票價相對較高，也比較有賺頭。至於兩岸航線是否有興趣再增班，要尊重航空公司的意願。    ,https://news.ltn.com.tw/news/politics/breakingnews/5413855
外交家雜誌稱駐史瓦帝尼員工霸凌當地人  國合會：刻意抹黑、已要求更正,政治,2026/04/23 18:14,圖為2024史瓦帝尼王國投資商機說明會，現場並展示各式農產品，示意圖，與新聞事件無關。（資料照，記者田裕華攝）首次上稿 18:14更新時間 19:01雜誌「外交家」（The Diplomat）撰文指，我國於友邦史瓦帝尼推動的「台灣－非洲蔬菜倡議」（TAVI）計畫中，有職員霸凌當地員工。外交部轉述亞蔬說法說明，相關事項屬內部勞資糾紛，已進入史國司法程序，並指，該報導口徑與南非中資媒體Swaziland News不謀而合，且立場自相矛盾，痛批中國藉特定媒體與訊息管道散布未經查證、甚至刻意扭曲的內容，企圖干擾我國與友邦的合作關係。請繼續往下閱讀...TAVI計畫由農業部、外交部與亞蔬－世界蔬菜中心（WorldVeg）共同於友邦史瓦帝尼及非洲南部推動，旨在提升非洲各國蔬菜生產能力，改善糧食多樣性，並強調蔬菜營養價值，以促進當地民眾健康飲食習慣，與蔬菜消費文化的建立。「外交家」22日撰文表示，一名前亞蔬員工控訴，遭到TAVI計畫經理不當對待、霸凌、種族歧視，甚至被要求不得在台灣管理層及國合會員工之前用餐。對此，國合會今日澄清，該文章進行不實連結，刻意抹黑國合會形象，為正視聽，國合會駐史瓦帝尼技術團已正式去函「外交家」雜誌要求更正，對國合會的不實指控進行澄清。國合會表示，該文提及的「台灣－非洲蔬菜倡議」（TAVI）是由亞蔬－世界蔬菜中心所推動，並非國合會駐史瓦帝尼技術團與該機構共同簽約執行之合作計畫，文中所提及人員，更非國合會或駐團所屬人員。國合會表示，在進行國際合作與人道援助時，國合會始終秉持高標準的透明度、問責性與職場倫理，針對該文在未經事實查證、且未向國合會核實資訊的情況下指涉本會，刻意攻擊國合會形象一事，國合會除由駐地團長去函要求更正，也將保留法律追訴的權利。    ,https://news.ltn.com.tw/news/politics/breakingnews/5413820
讓「粉底液將軍」來台？ 梁文傑曝矛盾爭議：中國先去打一架,政治,2026/04/23 18:04,中國藝人張凌赫靠古裝劇《逐玉》引發台灣民眾關注，但遭中共解放軍的媒體平台批評為「粉底液將軍」。（圖擷取自微博）國民黨主席鄭麗文日前聲稱，有隨團訪中的年輕人認為兩岸關係太複雜，只要邀請中國藝人張凌赫來台灣就好了。陸委會發言人梁文傑今天表示，張凌赫雖然在台灣受歡迎，卻在解放軍旗下的媒體平台被批評為「粉底液將軍」，中國廣電總局指其「杜絕顏值崇拜」等爭議，中國官方自己至少要先打一架「打完再說」。鄭麗文日前在《千秋萬事》廣播節目專訪時說，有隨團年輕人向她表示，「你們大人為什麼把兩岸關係搞得這麼複雜？只要叫張凌赫來台灣就好了。」對此，中國國台辦發言人張晗昨天在例行記者會進一步說，中國一貫支持兩岸影視文化界「雙向奔赴」，樂見中國藝人赴台交流，與台灣民眾見面。請繼續往下閱讀...不過，對於是否歡迎張凌赫來台交流，梁文傑今日在陸委會記者會表示，昨天國台辦記者會出現張凌赫這位明星的名字，他還特別查了一下，好像《逐玉》這部劇在台灣滿受歡迎的，但這位張凌赫演員，好像在對岸，中國的宣傳部門對他就有很多批評。譬如說像解放軍下面的媒體平台，就說這個是過度塗脂抹粉的將軍，叫「化妝液將軍」還是「粉底液將軍」，好像是這樣。梁文傑直指，中國廣電總局又說要杜絕「顏值崇拜」，不能夠畸形審美，反正這些就是中國官方自己吵來吵去，可以先有一個定論後再來談交流，台灣這邊是不會去做這些批評，「但是中國官方自己至少要先打一架、打完再說」。    ,https://news.ltn.com.tw/news/politics/breakingnews/5413808
徐瑞希保住黨員資格！退黨反悔民事勝訴 籲民眾黨建構合法程序,政治,2026/04/23 17:48,徐瑞希守住黨員資格，受訪時直言對民眾黨感到失望。（記者翁靖祐攝）公共電視前董事徐瑞希2023年11月被民眾黨提名為不分區立法委員名單第17名，但民眾黨2024年8月接連爆發選務帳目申報不清等疑慮，徐瑞希以不滿副主席黃珊珊曾代理財團仲介法務、助長剝削移工為由，在個人臉書宣布退黨，民眾黨認為她已公示，完成退黨、剝奪其黨員權利。徐瑞希打民事訴訟要求確認黨員資格存在，並於今日獲得勝訴。宣判後，徐瑞希接受媒體受訪表示，民眾黨作為第三大黨，領1.5億補助費，應設立的正當法律程序卻都沒有設立。她說，當年很期待台灣新政治的出現，但結果卻讓大家感到失望，並呼籲民眾黨應趕快建構相關合法程序。請繼續往下閱讀...徐瑞希指出，民眾黨認為她為了不分區立委名次，而來爭取利益，但黨也是把政治職位當成是利益或者是權利在交換，實在是令人滿失望的。徐瑞希表示，從去年2月開始就是循著黨內途徑在申訴，但民眾黨作為台灣的第三大黨，每年領1.5億的政黨補助金，但部分依據《政黨法》應該要設立的一些正當法律程序的機制卻都沒有設立。徐瑞希舉例，民眾黨一直到去年8月才通過財務管理條例，去年10月才成立仲裁機制。徐瑞希直言，一個在2019年就成立的政黨，那麼多該依照《政黨法》去建立的機制卻通通都沒有設。徐瑞希說，當年很多人都是支持台灣有一個「新政治」，但是很遺憾，這些日子以來，對於台灣民主政治改革有期待的一些人非常失望。徐瑞希期盼，民眾黨在未來這段時間，能夠真正落實《政黨法》裡面民主運作的原則，然後把該做的事情、該訂的法律、程序都能夠建構起來。    ,https://news.ltn.com.tw/news/politics/breakingnews/5413780
新北藍白合民調將展開 黃國昌今騎自行車80公里掃街拜票,政治,2026/04/23 17:30,民眾黨新北市長參選人黃國昌（中）今早7點從汐止騎自行車，沿路騎經金山、石門、三芝、淡水到八里，爭取民眾支持。（圖取自「民眾之聲」YouTube）新北藍白合由誰出戰市長預計四月底出爐，近日將展開民調，民眾黨新北市長參選人黃國昌為呼應他提出的低碳交通政見，今早7點騎自行車從汐止運動公園出發，沿路騎經金山、石門、三芝、淡水到八里，總里程數80公里，衝刺爭取民眾支持，他明天將再從林口出發，一路騎到新北市府。黃國昌今與民眾黨新北市議員參選人陳語倢一同騎自行車到終點八里，「民眾黨新北隊」在終點開直播迎接，黃國昌說，他騎逾5小時，真的很硬，不是只有總里程80公里這麼簡單，沿途上坡、下坡，而且大逆風，今天騎完，體感差不多跟上次一日北高，大概騎到彰化的感覺。請繼續往下閱讀...黃國昌說，上、下班時間若用戰車掃街拜票，反會造成大家困擾，因此試試看，用不太一樣的方式，民眾黨本來就是勇於創新，大家會很驚訝（騎車拜票）。民眾黨新北市長參選人黃國昌明天將再從林口出發，一路騎到新北市府。（圖取自「黃國昌」臉書）    ,https://news.ltn.com.tw/news/politics/breakingnews/5413765
禁用中國「高德地圖」？陸委會：數發部研析報告出來後決定,政治,2026/04/23 17:25,陸委會副主委梁文傑今（23日）在例行記者會中回答媒體相關提問。（記者叢昌瑾攝）中國地圖應用程式「高德地圖」登台，新增可顯示「紅綠燈倒數計時」與3D街景功能，數據資料更會回傳中國，引發國安疑慮。對於是否朝向禁用方式處理？陸委會發言人梁文傑今（23日）強調，等到數發部的研析報告出來之後，就會立刻做一個決定。據了解，高德地圖的母公司是「高德軟件有限公司」（AutoNavi），總部設立於中國北京，該公司2014年被中國的阿里巴巴集團全資收購，現屬於阿里巴巴旗下業務。請繼續往下閱讀...在中國，地圖測繪屬於高度敏感的基礎數據產業，須持有中國政府核發的「導航電子地圖甲級測繪資質」許可證。地圖數據涉及國家安全敏感數據，涵蓋軍事、交通、地理資訊，高德在營運上受到中國政府的嚴格監管。梁文傑在陸委會例行記者會表示，技術層面的部分，這個是由數發部做研析，政策的部分當然就是大家會一起研商做決定。等到數發部的研析報告出來之後，就會立刻做一個決定，「因為這種事就是越快做決定，越早做決定越好」。關於未來是否禁用中國「高德地圖」，陸委會發言人梁文傑今日強調，等到數發部的研析報告出來之後，就會立刻做一個決定。（記者陳鈺馥攝）    ,https://news.ltn.com.tw/news/politics/breakingnews/5413766
民進黨澎湖縣黨部黨職改選抽籤 號次揭曉,政治,2026/04/23 17:23,許國英由民主前輩薛博遠代抽，抽中1號籤王。（許國英提供）年底澎湖5合1選戰將屆，民進黨澎湖縣黨部今（23）日舉行黨職改選抽籤號次，除第17屆主委雙雄對決外，第17屆縣黨代表、第22屆全國黨代表，幾乎都是「同額競選」，直接宣布當選，只有攸關年底選戰操盤手的澎湖縣黨部主委，呈現激烈角逐之戰。原本在澎湖擁有執政優勢的民進黨，在縣長陳光復大年初一意外摔倒受傷昏迷，主將缺席狀況下，讓整個佈局大亂，更顯操盤手重要性，但今年出現「民主戰將」許國英與「武轎之父」盧長在龍頭之爭，形成雙雄之爭，勝出者必須肩負年底大選勝敗重責，責任相當重大。經抽籤結果，許國英1號、盧長在2號。請繼續往下閱讀...至於第22屆全國黨代表，應選2席、參選2席，1號吳武宗、2號邱（羽（上）王（下）），等於同額競選。第17屆縣黨代表27人參選、應選26席，依抽籤順序1號許世隆、2號徐奕緁、3號陳雅惠、4號賴沛瑜、5號葉清平、6號蔡玉芩、7號宋靜怡、8號陳美珠、9號吳銘晃、10號徐婉怡、11號陳河財、12號洪涼好、13號蔡慧玲。14號薛沛婕、15號許家瑋、16號柯少嵐、17號許金仲、18號張傳玉、19號倪裕淵、20號盧嘉豪、21號歐月珠、22號許金慶、23號張平浪、24號張有修、25號阮氏鳳、26號陳萬福、27號陳麗花，5月24日進行選舉。    ,https://news.ltn.com.tw/news/politics/breakingnews/5413757
