Title,News_Type,date,content,url
政院版財劃法挹注地方逾1.2兆 蔣萬安：會議未看到具體數字,政治,2025/11/20 15:41,台北市長蔣萬安出席活動受訪指出，會議中並未告知地方政府，具體會獲配到多少的統籌分配款、一般性補助款，需要中央提供具體數字，才能有後續討論的基礎。（記者孫唯容攝）行政院會今（20）日通過院版《財政收支劃分法》修正草案，統籌稅款、一般性補助款、計畫型補助款加總來到1兆2002億，創下新高。台北市長蔣萬安出席活動受訪指出，會議中並未告知地方政府，具體會獲配到多少的統籌分配款、一般性補助款，需要中央提供具體數字，才能有後續討論的基礎。蔣萬安指出，今天上午收到行政院的會議資料，由李副市長代表出席行政院會，會議中看到的版本，行政院還沒有告訴各地方政府，北市府依照版本內容究竟具體會獲配到多少的統籌分配款、一般性補助款，可能還是需要中央提供具體數字，才能有後續討論的基礎。第三也就是行政院版本之後，相關事權的分配，都是接下來要進一步溝通、說明，希望透過理性溝通討論，能夠針對地方政府財源挹注、永續持續推動地方建設有幫助。請繼續往下閱讀...有媒體追問，行政院秘書長張惇涵表示中央沒有忘記或無視北市的財政努力，因此台北市統籌稅款仍是全國最高。對此，蔣萬安說，目前還不清楚地方政府實際能獲得多少經費數字，各地方政府到底會獲得多少分配稅款、一般補助款，還有計畫型補助款是否會有影響，都需要等待行政院進一步說明，因為目前在行政院的版本內容有很多概念與過往不同，需要請政院跟地方進行進一步的溝通。蔣萬安也認為，只要能夠理性溝通、說明清楚，接下來在立法院審議，也需要看立委針對政院版本會提出什麼疑慮，政院只要能充分解釋、對於地方政府財源挹注有幫助，可以持續推動各地方建設，不管是軌道建設、社福教育等，有具體有幫助的話，希望繼續跟中央溝通。熱門賽事、球星動態不漏接    ,https://news.ltn.com.tw/news/politics/breakingnews/5252476
黃國昌被打臉還扯蘇貞昌 蘇巧慧重話反擊,政治,2025/11/20 15:36,民進黨立委蘇巧慧。（資料照）民眾黨主席黃國昌昨聲稱，獲民進黨擬徵召參選新北市長的立委蘇巧慧透過多項管道鼓勵他「參選新北市長到底」，卻被蘇打臉；黃今（20日）諷刺貴人多忘事，並嗆蘇貞昌2018年違背對神明的承諾參選新北市長，「連神明都敢騙」。蘇巧慧回應，她從未影響其他人的參選決定，「對於這種奇怪的謠言，我希望適可而止」。國民黨主席鄭麗文與黃國昌的「鄭黃會」昨天登場，針對2026新北市長選舉合作，黃國昌表示，藍白合作過程中，民進黨一定會見縫插針，像蘇巧慧就透過好多管道鼓勵他，要他一定要選到底，強力支持他；蘇巧慧隨後回應強調，她向來是做好準備、面對一對一的選戰，「從未透過任何管道希望誰能選到底」。請繼續往下閱讀...不過，黃國昌諷刺說，「蘇委員貴人多忘事」，自己講的話自己都忘了，這讓他想到蘇巧慧父親、前台北縣長蘇貞昌在保安宮前面曾宣示，「他對新北有滿滿情感，但絕對不會選第三次」，2018年仍參選新北市長時，讓台灣社會質疑「連神明都敢騙」。蘇巧慧受訪表示，從民進黨選對會確認提名她的那天起，就做好面對一場「一對一」的選戰，自己會籌組最強的團隊，希望爭取服務全新北市民的機會。蘇巧慧強調，她對其他參選人一向是尊重和祝福，從沒有透過任何管道、或是授權任何人，去傳任何話影響參選決定，對於這種奇怪的謠言，希望適可而止。熱門賽事、球星動態不漏接    ,https://news.ltn.com.tw/news/politics/breakingnews/5252442
政院二備金改版「安全指引手冊」國民黨：把全民國防當私房錢玩？,政治,2025/11/20 15:34,國防部最近印製發放「台灣全民安全指引」改版手冊，今被國民黨質疑「把全民國防當私房錢在玩？」（擷取自國民黨臉書）針對國防部最近印製發放「台灣全民安全指引」改版手冊，國民黨今（20日）質疑經費竟是動用第二預備金，而且金額「剛好」低於送立法院備查門檻，「擺明刻意規避監督！」更誇張的是，這次「改版」的最大改變竟是印上賴清德總統的親筆簽名，「難道是要告訴全民：有賴皇加持，台灣就安全了？」該黨痛批「把全民國防當私房錢在玩？」國民黨表示，行政院第二預備金是用來應變緊急狀況的經費，國防部卻大手筆花了其中近4300萬元印製手冊，「請問民進黨政府，是發送賴總統親筆簽名比較重要，還是救災救命的錢比較重要？更可疑的是，國防部動支第二預備金的印製費用，恰巧低於立法院備查門檻5000萬元，這恐怕不是巧合，而是赤裸裸的規避民意監督！」請繼續往下閱讀...國民黨指出，國防部就為了新增「賴清德總統的簽名」，推出改版，還聲稱可以讓民眾覺得「更有信賴感！」難道是手冊的專業性和實用性漏洞太多，只好找賴清德幫忙背書？還是為了逢迎上位，不惜花人民納稅錢來造神？重新塑造賴神再臨？國民黨還說，當初推動修法為國軍加薪，民進黨一路反對，甚至拒絕依法編列預算，如此不尊重軍人、踐踏軍人權益的政府，寧願動用二備金加印有賴清德簽名的手冊，也不願意落實國軍應有權益，如何說服全民有心提升全民國防？如何讓人民對政府有信賴感？熱門賽事、球星動態不漏接    ,https://news.ltn.com.tw/news/politics/breakingnews/5252489
徐國勇批鄭黃會未提台灣安全極為失敗 民眾黨：膝反射式「聞過則怒」,政治,2025/11/20 15:34,民眾黨秘書長周榆修。（資料照）國民黨主席鄭麗文、民眾黨主席黃國昌昨天舉行會談，民進黨秘書長徐國勇今批評，藍白未提出對台灣安全及區域安全的論述，對國家沒有任何助益，極為失敗。民眾黨祕書長周榆修反批，面對在野黨提出當前國家面臨的困境與賴清德政府罔顧主流民意與國家正義的種種倒行逆施，膝反射式的「聞過則怒」，令人遺憾。周榆修表示，台灣是全體台灣人的台灣，絕非民進黨獨家代理，賴清德政府若真心顧台灣，國家就不會走到今天四分五裂的地步。請繼續往下閱讀...周榆修說，民眾黨的核心立場始終清楚—以行動顧「台灣」、守住國家利益，徐國勇沒有關心理解昨日在野峰會的訴求；面對在野黨提出當前國家面臨的困境與賴清德政府罔顧主流民意與國家正義的種種倒行逆施，膝反射式的「聞過則怒」，令人遺憾。周榆修強調，區域安全、保家衛國，台灣民眾黨從不缺席給予國防百分之百支持，但國防議題不是用來掩蓋賴清德政府執政無能的工具，請民進黨停止抹黑栽贓。若民進黨真心重視國防，為何一再阻擋提升軍人待遇的加薪案？更有甚者，軍購按時付出鉅額款項卻幾乎完全沒有依約獲得設備，到目前完全拿不出具體有效的作為。熱門賽事、球星動態不漏接    ,https://news.ltn.com.tw/news/politics/breakingnews/5252461
政院批准社安網2.0計畫 周道君：將增到宅育嬰指導,政治,2025/11/20 15:28,衛福部社家署長周道君說，社安網2.0計畫將提供家庭育兒支持服務。（記者林志怡攝）台灣出生率持續低迷，已連續58個月「生不如死」，少子女化危機加劇。衛福部社家署長周道君說，目前行政院已批准社安網2.0計畫，目前規劃新增育兒指導服務，提供新手爸媽到宅育兒方法教學與家庭環境檢視，另也將強化社安網不同單位的資訊橫向聯繫，以利相關單位了解案家情況，即時提供協助。周道君指出，依據衛福部提交給行政院的新一期社安網2.0計畫，除延續既有的前2期計畫內容，包括脆弱家庭協助、性暴力處遇、精神障礙協作外，也會增加對所有新生兒家庭，從前端提供育兒指導服務，讓家庭在育兒過程中有更多的幫助與資源。請繼續往下閱讀...對於社安網2.0計畫中提供的育兒支持服務，周道君說，過往策略偏重於事後協助的處遇救濟，新一期計畫希望往前走一步，從前端就與醫療體系合作，提供家庭充分的支持，不要等到家庭中發生顧慮或不幸事件後，才由社福體系提供協助。周道君表示，未來可能在媽媽第3孕期產檢時，就提供育兒可能需要知道的資訊，待孩子出生後，會由經過培訓的社工，或教保員、護理相關多元人力，到宅提供新手爸媽育兒方法與家中環境檢視等協助，且屆時不會單純由社工提供服務。此外，周道君說，社安網的目的是整合不同的服務體系，提供案家支持，但若家庭同時有長照、身障、家暴、脆家、低收入情況等不同需求，現行社會照顧體系偏向在不同面向上分別提供服務。周道君指出，這期計畫希望強化社安網中各單位的橫向訊息合作，讓參與照顧家庭的單位彼此知道情況，或在服務過程中出現需要注意事項，可以提供給網絡其他成員提供協助。熱門賽事、球星動態不漏接    ,https://news.ltn.com.tw/news/politics/breakingnews/5252478
日本台灣交流協會秋季旭日章 謝長廷、黃崑虎、李詩欽獲授勳,政治,2025/11/20 15:26,前駐日代表謝長廷（左起）、前台灣區電機電子工業同業公會理事長李詩欽及台灣之友會全國總會長黃崑虎，獲授日本台灣交流協會秋季旭日章。（圖由東海大學提供）日本台灣交流協會公布秋季「外國人叙勲」名單，前駐日代表謝長廷獲授「旭日大綬章」，台灣之友會全國總會長黃崑虎獲授「旭日小綬章」，而東海大學校友、前台灣區電機電子工業同業公會理事長李詩欽獲日本政府頒授「旭日中綬章」，東海大學校長張國恩說，李詩欽歷年捐助母校金額超過5千萬，今年更捐贈3千萬，專款建置輝達GB200 AI伺服器。日本台灣交流協會近年春、秋兩季，包括前台北駐日經濟文化代表處代表沈斯淳（2024年，旭日重光章）、前台灣日本關係協會會長邱義仁（2023年，旭日重光章）等多人獲授勳，協會指出，李詩欽是成功企業典範，2019年至2025年擔任台灣區電機電子工業同業公會理事長期間，致力於加強台日雙邊經貿合作，疫情期間，也推動線上國際展示會及商談會，疫後，多次率領產業代表團訪日，深化與日本企業及相關團體互動。請繼續往下閱讀...李詩欽從東海大學經濟系畢業後，與葉國一及鄭清和共同創辦英業達，今年專款捐贈3千萬元，供東海大學建置輝達GB200 AI伺服器，培育母校AI價值新世代人才。東海校長張國恩表示，李詩欽校友是他最欽佩的傑出校友之一，不僅為人謙和，常年默默貢獻母校，這些年捐助東海提升資訊設備金額，已超過5千萬，最近更捐贈Nvidia伺服器，讓東海躍升國內運算力最快AI大學之一。東海大學校長張國恩（左）感謝李詩欽捐贈3千萬，專款建置輝達GB200 AI伺服器。（圖由東海大學提供）熱門賽事、球星動態不漏接    ,https://news.ltn.com.tw/news/politics/breakingnews/5252450
質詢問「現場誰沒看過小紅書」？官員舉手 藍委尷尬笑了,政治,2025/11/20 15:22,國民黨立委萬美玲今日質詢教育部政務次長劉國偉時詢問：「今天在現場的，完全沒看過小紅書的請舉手？」結果留國偉及身後官員立刻舉手。（圖擷取自國會頻道）國民黨立委萬美玲今日質詢教育部政務次長劉國偉時詢問：「今天在現場的，完全沒看過小紅書的請舉手？」結果留國偉及身後官員立刻舉手，讓萬美玲尷尬地表示，「我剛是說我沒有要問啦，結果你們就通通不小心舉手了，真的很自動自發。」抖音短影音盛行，教育部透過「數位工具包」讓家長能夠管理子女手機使用。立法院教育及文化委員會今日邀請劉國偉、數發部及國家通訊傳播委員會官員，就「如何防範不當之短影音及社群平台兒少內容，加強數位及媒體素養」進行專題報告，並備質詢。請繼續往下閱讀...對此，萬美玲質疑「數位工具包」宣傳成效不彰，並認為不能僅靠現行管道宣傳。此外，萬美玲今日質詢劉國偉時出現有趣小插曲。萬美玲質詢當下表示，叫大家不要去看抖音、不要去看小紅書，「我都不好意思問大家，今天在現場的，完全沒看過小紅書的請舉手！」結果劉國偉及他身後官員立刻舉手。對此，萬美玲尷尬一笑：「呃……我……我剛是說我沒要問啦，結果你們就通通，不小心就舉手了，你們真的很自動自發。」她最後還是強調：「完全沒看過小紅書的喔，我說實話，我也不太相信，因為現在小紅書真的很多人在看。」相關片段被轉至Threads引發熱議，網友紛紛表示：「為什麼需要看小紅書」、「為什麼問了又不相信阿」、「為什麼要下載垃圾」、「完全沒看過」、「我也沒抖音跟小紅書啊」、「現在全台灣都知道她很愛看小紅書了」。     在 Threads 查看熱門賽事、球星動態不漏接    ,https://news.ltn.com.tw/news/politics/breakingnews/5252458
肯定政院提財劃法修正案 李四川籲同步劃分「權」,政治,2025/11/20 15:21,李四川建議，中央跟地方除了「錢」以外，「權」是不是也劃分清楚。（記者何玉華攝）行政院會今（20）天討論院版「財政收支劃分法」修正草案，代表台北市出席的台北市副市長李四川說，早上才拿到財政部的簡報跟修正條文資料，還來不及計算，需要時間消化、詳細研讀才能做反應。他以過去擔任過行政院秘書長的經驗說，肯定行政院願意提出修正版本，但也希望配合財劃法的修訂，重新劃分地方權責，有關地方自治的部分也回歸地方去處理。李四川表示，財政部早上才提供所有的簡報跟條文，代表六都去的大多是副市長，都是早上才拿到資料，有必要回去再詳細研讀。對各縣市最重要的是，行政院版本會讓各縣市在2027年分到多少統籌分配款，包括一般型補助款，還有計畫型補助款，到底多少錢？各縣市還要再消化一下，才能就財劃法去做反應。請繼續往下閱讀...李四川提到，他2014年當行政院秘書長時，就談財劃法修正，這一次行政院跟財政部長敢拿出財劃法修正草案，他表達高度肯定；但因所有的地方政府必須對市民、議會做交代，所以會有不同意的聲音。而財劃法一直修不好，最大的原因就是餅就這麼大，餅被拿走的人不高興，分到的人也不高興「為什麼我分那麼少？」永遠都沒有辦法滿足所有人。李四川說，他也向行政院長、財政部長建議，如果財劃法已經修訂，有關地方自治的部分，就回歸讓地方去處理。因為錢已經給了，責任也給，權力也給，就像捷運興建計畫，補助砍了75%，是不是還要再一次一次的把計畫報到中央，一報就要等個2、3年；3年前蓋一個房子，一坪約11、12萬，3年後一坪約25萬，錢都浪費在物調上了，效率也不好。建議除了「錢」以外，「權」也能夠做一次的劃分清楚，讓地方歸地方，中央歸中央，責任就能夠劃清。熱門賽事、球星動態不漏接    ,https://news.ltn.com.tw/news/politics/breakingnews/5252455
李乾龍：明年選舉藍白協商不成就以民調決定,政治,2025/11/20 15:16,國民黨副主席兼秘書長李乾龍20日於中央黨部一樓大廳，張貼第22屆中央委員選舉公告。（記者張嘉明攝）國民黨今日張貼第22屆中央委員選舉公告，訂於12月27日舉行投票，投票地點為各直轄市、縣市黨部投票所。國民黨副主席兼秘書長李乾龍受訪指出，中央委員名額共計190位，候補名額95位，依規定黨主席鄭麗文可以足額提名，而且一般都會尊重現任中央委員，只要有意願連任者，黨主席都會予以提名，但目前大概有近60位現任中央委員無意連任，不過，鄭麗文仍會足額提滿。此外，李乾龍指出，如果鄭麗文足額提名滿190人後，還其他的有意參選人，就要找到6位黨代表連同自己共計7人連署，即可取得參選資格。請繼續往下閱讀...針對明年地方選舉「藍白合」，新北市長侯友宜今天強調要有一個可行機制，李乾龍表示，鄭麗文昨天已經說得很清楚，民調是可行辦法，且行之有年，如果未來兩黨協商不成，就用民調決定。他並強調，經過今年大罷免，證明「藍白合」是成功例子，2024年「藍白合」破局是一次痛苦的經驗，大家應該記取經驗，朝向合作，兩黨主席昨已坦承相見並提出構想，而且多數的民意也支持「藍白合」。至於民眾黨方面拋出藍、白共組地方「聯合政府」的構想，李乾龍說，基隆市是一個成功的例子，至於其他縣市要看機緣，每個地方會有不同機制，但他認為，在地方政府進行合作應該可行。根據國民黨中央委員選舉公告規定，雖然具有黨權的第22屆黨代表都有資格成為中央委員選舉的選舉人，而且黨代表的募款責任額為鼓勵性質，但如果黨代表具有其他必須繳交募款責任額的黨公職人員身分，就仍應依規定先繳交111、112、113、114年度最高責任額職位的募款額度後，才能取得選舉人資格；至於候選人資格，除由黨主席提名者，第22屆黨代表經7人以上簽署，並依規定向黨中央繳交5000元作業費、10萬元保證金，同時已完成繳交111、112、113、114年度募款責任額者，即可登記為候選人，領表登記時間為本月24日至26日。此外，針對因為涉入京華城案，遭停止黨權處分的國民黨台北市議員應曉薇，未來恐將無法獲得國民黨提名參選，李乾龍指出，昨天中常會希望考紀會可以重新檢討，因此應曉薇的考紀案已經送回考紀會，最近會再重新審理應曉薇的資格問題。熱門賽事、球星動態不漏接    ,https://news.ltn.com.tw/news/politics/breakingnews/5252426
不是詐騙！嘉市議員顏翎熹發起募資活動要辦「田盛節」,政治,2025/11/20 15:10,嘉義市議員顏翎熹為兌現政見，發起募資活動將舉辦田盛節。（擷取自Molly 翎熹臉書）詐騙集團猖獗，臉書廣告真假難辨，近日有民眾瀏覽到嘉義市議員顏翎熹透過募資平台販售商品，想下單又擔心被詐騙。顏翎熹服務團隊今證實，議員透過「嘖嘖」群眾募資平台發起「田盛節：嘉義推動全面性教育與性別平等的公共行動」計畫，透過販售嘉義零食、高山茶等農特產禮盒，募資舉辦第一屆「田盛節」來兌現選舉政見，並非詐騙。顏翎熹日前透過個人臉書粉專貼文表示，2020年南投旭光高中性侵案，讓她第一次深刻體會到制度的冷漠；加害人因未成年被國家保護，受害者只能沉默，因此後來決定用自己的方式讓社會看見問題，把名字改成「顏色不分藍綠支持性專區顏色田慎節」參選嘉義市議員，那個16字的名字，是對體制的質問，也是一種呼喊。許多人或許覺得荒唐，但只要有一個人因此關注這起案件、開始思考性教育與尊重的重要，她都覺得值得。請繼續往下閱讀...她表示，田慎節是反思也是起點，它提醒我們，性暴力的根源往往來自教育的缺口、情感的失能。這些問題，不會靠一場選舉就能解決，但她願意一點一滴去改變。田盛節從政見走進現實，結合嘉義農產與性教育的節日，規劃講座課程、靜態展示和議題攤位，是延續初心的實踐。募資活動自11月1日至12月5日，目標25萬元，目前募款突破5萬7000元、目標進度約23%，募資經費全數將使用於舉辦本次活動所需的必要支出，包含活動人力、美術設計、回饋品製作與購買、場地與設備租借和稅務成本。熱門賽事、球星動態不漏接    ,https://news.ltn.com.tw/news/politics/breakingnews/5252445
鄭麗文、黃國昌昨會面 李四川：沒時間看也沒評論,政治,2025/11/20 15:08,台北市副市長李四川表示，不要讓民眾有政府每天都在選舉的感覺。（記者何玉華攝）國民黨主席鄭麗文與民眾黨主席黃國昌昨天會面，新北市長侯友宜認為若合作只是表象，意義不大；黨內新北市長選舉熱門人選、台北市副市長李四川今（20）受訪表示，昨天沒時間看黨的狀況，也不是市政府必要的工作，他沒有評論。李四川說，他昨天沒有時間去看黨的狀況，這部分也不是市政府必要的工作，所以他也沒有什麼評論。他重申之前所說，「黨如果要我負責任，或是要我承擔，我一定不會排斥」；對於記者追問民調的部分，他未做回應。請繼續往下閱讀...李四川強調，現階段距選舉的時間還很長，不要給所有的市民感覺這個政府天天都在選舉，如果到那個時候，他會跟各位報告。熱門賽事、球星動態不漏接    ,https://news.ltn.com.tw/news/politics/breakingnews/5252424
因應國會攻防急提勞保條例對案？ 洪申翰：一直有在研議修法,政治,2025/11/20 15:05,勞動部長洪申翰在院會後記者會表示，勞保條例撥補入法一直有在研議，而非突然提案。（圖由行政院提供）立法院17日衛環委員會審查勞保條例修正案，對勞保撥補法制化，行政院會今天也通過相關修法。對於院會臨時排案，是否在「財劃法」修法遭突襲後，因應立法院情勢調整，對此，勞動部長洪申翰在院會後記者會表示，一直有在研議修法，而非突然提案，而行政部門本應靈活、主動說服社會和國會。行政院會今天拍板「勞工保險條例」第66條、第69條修正草案，院長卓榮泰說，勞保是勞工最重要的退休保障制度之一，為穩定基金流量，政府自2020年起，逐年編列預算撥補勞保基金，撥補金額持續增加，搭配多元投資，基金規模已達1.2兆元，顯示政府撥補對勞保財務有正面助益。請繼續往下閱讀...修正草案明定政府撥補為勞工保險基金來源，將政府撥補法制化，至於撥補金額則要施行後由中央主管機關依政府財政及勞工保險財務狀況，每年編列預算撥補。此外，草案也規範，勞工保險財務應由中央政府負最後支付責任，且中央主管機關應至少每3年檢討勞工保險財務。對於勞保級距已多年未調，隨著近年薪資上調，未來是否調整？洪申翰表示，今年1月有做每3年一次的勞保精算，勞保財務問題的年限確實延後幾年，原因除撥補外，主因是這幾年基金投資有很好成果，勞動部也努力以各種方式開源節流。洪申翰說，至於勞保級距調整，社會的確有這樣聲音，也需要綜合考量級距調整可能對勞保財務的影響，因為勞保基金財務狀況還是要優先考量。立法院17日審查勞保條例修正案時，政院尚未提出對案，昨天傍晚5點半公布院會議程，僅有鳳凰颱風災害救助與財劃法修正兩案，但在議程公布4個小時後，晚上9點半才新增排入「勞保條例」修正案，是否在財劃法後，因應立院情勢急提對案？行政院發言人李慧芝說，勞動部一直有在討論，而行政院議程會視討論狀況，滾動式調整議程。洪申翰表示，勞動部與行政院一直有在研議修法，把政府負最終責任與撥補法制化，也持續進行溝通，並非突然提案。面對現在國會狀況，行政部門要保持靈活、主動說服社會與國會，考慮人民各種需求。熱門賽事、球星動態不漏接    ,https://news.ltn.com.tw/news/politics/breakingnews/5252447
