Title,News_Type,date,content,url
奪取伊朗石油島 美：隨時可以,國際,2026/03/22 05:30,美國總統川普與國務卿魯比歐廿日在白宮南草坪準備登上直升機陸戰隊一號。（美聯社）川普考慮「逐步結束」軍事行動美國和以色列聯手攻擊伊朗進入第四週，雙方持續交火。美國總統川普廿日暗示考慮「逐步結束」行動，稱美國已接近實現目標，伊朗需十年才能重建。白宮同日表示，美軍隨時可「奪取」伊朗石油樞紐哈格島，以迫使伊朗重新開放荷姆茲海峽。稱美已接近實現目標 以則嗆加強攻擊川普當天先向記者表示，他目前並未考慮與伊朗停火。同日稍晚，他又在「真實社群」發文，稱正考慮「逐步結束我們在中東的大規模軍事行動」，目標是徹底削弱伊朗彈道飛彈能力、摧毀其國防工業基礎、消滅海空軍、永遠不讓德黑蘭擁有核能力，並保護中東盟友。但他不久前才排除停火可能，且數千名美軍陸戰隊員正前往中東，凸顯他在戰爭的目標和計畫上持續發出截然不同的訊號。以色列國防部長卡茲廿一日則嗆聲，對伊朗的攻擊在未來一週會顯著增加。請繼續往下閱讀...針對承載全球五分之一石油運輸的荷姆茲海峽，川普表示應由最依賴中東能源的國家承擔安全責任，若這些國家請求，美國將協助，但威脅消除就無需這麼做。彭博批評川普此話甩鍋，忽視石油市場的全球影響力，指供應衝擊最終仍會影響美國消費者。已摧毀40多艘佈雷船 抨北約紙老虎川普還抨擊北約組織（NATO）未協助荷姆茲海峽安全，稱「懦夫，我們會記住這點」，也指責北約未加入阻止伊朗擁有核武的戰鬥，「沒有美國，北約就只是紙老虎」。白宮副新聞秘書凱利表示，只要總統下令，美軍隨時可奪取哈格島，川普已採取行動摧毀四十多艘佈雷船。德黑蘭重建恐需10年同日川普在MS NOW新聞頻道訪問中說，美以發動進攻後，伊朗需要十年重建，並強調推翻伊朗神權統治並非主要目標，「我現在就可以離開，他們也需要十年才能重建。但這不是可接受的局面。如果我們繼續待下去，他們就永遠無法重建」。他稱美國去年六月「午夜重鎚」行動已摧毀伊朗製造核武的能力，但境內仍有「核塵埃」即濃縮鈾。專家和政府官員表示，回收濃縮鈾將是漫長危險的行動，甚至可能需要地面部隊。專家稱奪哈格島危險 大增戰爭成本分析指出，奪取哈格島將使美軍面臨更大危險，並增加戰爭成本與規模。布魯金斯研究所國防戰略專家歐漢倫表示，此舉「無疑具有戰術優勢，但也可能代價高昂，且沒有明確的戰略最終目標」。彭博擔憂，無論川普意圖如何，這類行動可能像越戰、阿富汗戰爭與伊拉克戰爭一樣，從有限行動演變成曠日持久的戰爭，使美國陷入多年泥淖。    ,https://news.ltn.com.tw/news/world/paper/1747791
荷姆茲海峽封鎖 美內部評估最糟半年,國際,2026/03/22 05:30,美媒報導，五角大廈正部署二千二百至二千五百名美軍陸戰隊隊員前往中東，他們隸屬於基地設在加州的「拳師號」兩棲待命群以及陸戰隊第十一遠征隊。圖為拳師號兩棲攻擊艦。（法新社）美國對伊朗發動的「史詩怒火」行動初始取得顯著軍事成果，如今卻因荷姆茲海峽封鎖引發的全球能源危機陷入泥沼。根據一份近期在五角大廈流傳的美國國防情報局內部評估，最壞情況下伊朗封鎖荷姆茲的時間可能長達六個月。情報官員坦言，核心難題在於伊朗握有重新開放海峽的話語權，且無其他顯而易見的解決方案。白宮及五角大廈官員堅稱，該份報告未被認真列入考量，也未呈交戰爭部長赫格塞斯或總統川普，不會影響政治決策。國防部發言人帕內爾表示，國防情報局本就會為最壞情況制定計畫，不代表照單全收，「六個月的封鎖是不可能之事，對戰爭部長來說也完全無法接受」。白宮新聞秘書李威特則聲明，川普及其國安團隊對伊朗封鎖荷姆茲海峽保持充分準備，美軍專注於系統性消滅伊朗擾亂能源流動的能力。請繼續往下閱讀...官員向美國有線電視新聞網（CNN）解釋，對封鎖時長的分析幾乎每日變動，部分取決於美以持續進攻對伊朗軍火庫的衝擊程度。五角大廈和西方官員指出，美國雖重創伊朗海軍與飛彈武器庫，但未徹底摧毀短程飛彈庫存，伊朗仍保有以裝載爆裂物的小型船隻襲擊油輪或埋設水雷等選項。官員認為，華府必須面對的現實，在於重啟荷姆茲海峽的挑戰遠超出「史詩怒火」設下的軍事目標。一名情報官員表示，海峽海岸線綿延近一百英里，伊朗能在沿岸任何地點部署，難以憑單一行動有效剷除威脅。彭博引述西方情報分析，德黑蘭政府目前正加緊權力掌控，無意透過談判重啟海峽。川普廿日表示，確保荷姆茲海峽穿越安全需要非常多的協助，並再次要求日本、中國與南韓協助確保海峽安全。對此，南韓宣稱政府正與美國等主要友邦保持緊密溝通。傳伊外長與日密談船隻通行但據日本共同社報導，伊朗外交部長阿拉奇在電話專訪中透露，自戰爭爆發以來已與日本外相茂木敏充兩度通電，協商日本相關船隻航行事宜。阿拉奇強調，伊朗封鎖對象為敵國船隻，而非整個海峽，願在與日本等非敵國協商後提供通行安全保障。    ,https://news.ltn.com.tw/news/world/paper/1747795
抑制油價 美暫緩伊朗石油制裁,國際,2026/03/22 05:30,在阿拉伯聯合大公國與阿曼交界、靠近荷姆茲海峽處航行的油輪。（路透）為解決伊朗實質封鎖關鍵能源航道荷姆茲海峽引發的全球能源危機，美國除了採取空中行動消滅波斯灣水域的武裝威脅，另宣布解除伊朗海上石油銷售禁令卅天，藉此緩解飆升中的國際石油價格。美國財政部宣布，暫時解除已於三月廿日前裝船的伊朗石油、化石產品禁售令，直到四月十九日。但仍不得出售給古巴、北韓及烏克蘭的俄國占領區。美國才在十二日同樣對遭制裁的俄羅斯石油頒布「暫時性授權」卅天。請繼續往下閱讀...短期措施 解除伊海上石油銷售禁令卅天財政部長貝森特表示，此舉屬量身制定的短期措施，依循的是總統川普「使全球能源流動最大化」及「確保市場穩定」方針。他提到目前受制裁的伊朗石油正被中國低價囤積、「藉由替全球暫時解鎖既存供應，美國將迅速為國際市場挹注約一．四億桶石油，擴大全球能源總量，協助緩解因伊朗導致的暫時性供應壓力」。彭博引述高盛估算，伊朗海上原油數量為一．〇五億桶。貝森特強調，此措施意在利用伊朗石油對抗德黑蘭自身，在史詩怒火行動持續同時壓低油價，伊朗也難以從中收取任何收益。貝森特十九日接受「福斯商業」訪問時提到，釋出伊朗石油應能夠維持十至十四天的低價區間。伊朗石油部發言人在社群媒體回應，當前在海上並無多餘原油供應給其它國際市場，「美國財政部的聲明只不過是要提供買家希望」。彭博指出，當前伊朗石油的大宗買家為中國，雖然美國解除禁令按理能夠擴大潛在買家範圍，但因國際金融市場對德黑蘭的限制仍在，有意採購的新買家得設法處理制定協議所面臨的難題。美國能源部長賴特預期，亞洲會是伊朗石油解禁的主要受益者，預計三至四天內便能陸續運抵。除了受惠於制裁以低價購入伊朗石油的中國買家，二〇一八年美國重新制裁伊朗石油前，南韓、印度、日本、義大利和台灣也是該國原油的主要買家。    ,https://news.ltn.com.tw/news/world/paper/1747794
「史詩怒火」行動日誌,國際,2026/03/22 05:30,以色列反戰人士廿日在特拉維夫舉行抗議，要求結束對伊朗的戰爭。（歐新社）截至3/21◎美軍中央司令部表示，三週以來已打擊伊朗逾8000個目標，摧毀130艘船隻，本週使用多枚5000磅炸彈摧毀沿海地下設施，擊中反艦飛彈及雷達系統，削弱伊朗威脅自由航行能力。◎伊朗稱納坦茲核設施遭美以聯軍空襲，國際原子能總署（IAEA）監測顯示尚無放射性物質外洩。請繼續往下閱讀...◎伊朗試圖以飛彈攻擊4000公里外、位於印度洋的英美聯合軍事基地狄耶戈加西亞，雖未成功，卻凸顯飛彈射程實力。◎以色列國防部長卡茲預告，下週起將顯著增加對伊朗恐怖政權及其基礎設施的打擊強度。◎伊拉克首都巴格達的情報總部遭無人機攻擊，造成一名軍人喪生。◎約旦在戰爭第三週遭到22架無人機與14枚飛彈襲擊，開戰至今已有24人受傷。◎阿拉伯聯合大公表示攔截3枚彈道飛彈與8架無人機。◎以色列中部一所幼兒園遭伊朗飛彈碎片擊中，建物受損，但無人傷亡。資料來源：綜合外電整理：國際新聞中心「史詩怒火」行動日誌    ,https://news.ltn.com.tw/news/world/paper/1747796
空襲印度洋英美基地 伊朗未得逞,國際,2026/03/22 05:30,位於印度洋上的迪耶戈加西亞島設有美英聯合軍事基地。（美聯社檔案照）對狄耶戈加西亞島發射兩枚中程彈道飛彈英國官方消息人士廿一日證實美國華爾街日報稍早的報導，即伊朗對位於印度洋的狄耶戈加西亞島（Diego Garcia）上的英美聯合軍事基地發射飛彈，但稱該攻擊行動「未遂」。該消息人士證實，伊朗對狄島的「未遂」攻擊，發生在英國政府廿日宣布美國可使用狄島基地對付伊軍之前，此外便不願證實更多相關細節。根據華爾街日報稍早引述多名美國官員所作的報導，伊朗對狄島發射兩枚中程彈道飛彈，但皆未擊中島上的英美基地；據稱其中一枚飛彈在飛行途中故障，另一枚遭美國軍艦發射的一枚標準三型飛彈攔截，但無法判定是否攔截成功。美國五角大廈拒絕評論。請繼續往下閱讀...伊擬先發制人 英證實「未遂」位處印度洋重要戰略位置地狄島，是前英屬印度洋領地查哥斯群島中的最大島，英美在此有軍事合作並設有基地；而狄島基地正是英國允許美國在伊朗戰爭中從事「防禦行動」時可使用的兩個基地之一。英國政府廿日表示，允許華府使用狄島基地以及英格蘭西南部的費爾福德（Fairford）基地，「進行特定與有限度的防禦行動」，來對付「攻擊荷姆茲海峽船隻的伊朗飛彈基地與能力」。一枚半途掛點 一枚被攔截 最值得注意的是，伊朗飛彈發射點距離狄島約四千公里，遠超伊朗此前對飛彈射程自我設限的二千公里。美國長期質疑伊朗藉由太空計畫發展洲際彈道飛彈技術，此次攻擊似乎印證此一憂慮。伊朗外長阿拉奇十九日與英國外交大臣古柏（Yvette Cooper）通電話時曾出言警告，允許美國使用英國基地，會被視為「參與侵略」；但根據上述英國消息人士的說法，德黑蘭攻擊狄島在前，英國宣布美國可使用狄島基地在後，伊朗攻擊狄島應非報復反擊，而是先發制人。華爾街日報則說，狄島攻擊不但是伊朗首次實際動用中程彈道飛彈，也是德黑蘭當局試圖攻擊中東以外地區以及威脅美國利益。根據紐約時報，英國施凱爾政府是迫於美國川普政府的壓力，才放寬美軍使用英國基地的規定—英國原本只允許美軍使用英國基地，來對付曾攻擊英國基地與盟國的伊朗飛彈發射設施，並未論及荷姆茲海峽。    ,https://news.ltn.com.tw/news/world/paper/1747792
"中英對照讀新聞》Oscar-winner Sean Penn skips ceremony, takes train to Ukraine奧斯卡得主西恩．潘缺席頒獎典禮，搭乘火車前往烏克蘭",國際,2026/03/22 05:30,"美國知名男星西恩．潘缺席2026奧斯卡頒獎典禮，前往基輔與澤倫斯基會面。（路透）◎林家宇Film star Sean Penn stepped out of a train carriage in central Kyiv on ​Monday, thousands of miles away from the glitz of ‌Hollywood’s Dolby Theatre where he had failed to turn up to receive his third acting Oscar hours earlier.影星西恩．潘沒有現身領取他的第三座奧斯卡演員獎，而是步出位於基輔中心的列車車廂，距離星光熠熠的好萊塢杜比劇院有數千英里之遙。請繼續往下閱讀...Penn, 65, won the Oscar for best supporting ​actor for his role in the political thriller ""One Battle ​After Another"", but skipped Sunday’s ceremony to travel to ⁠meet Ukraine’s President Volodymyr Zelenskiy in the war-battered capital.65歲的西恩．潘以政治驚悚片「一戰再戰」贏得奧斯卡最佳男配角，但他缺席了週日的典禮，前往飽受戰爭摧殘的烏克蘭首都，與總統澤倫斯基會面。Penn, a long-time advocate for Ukraine, has visited the country several times during the four-year war with Russia.作為烏克蘭的長期支持者，西恩．潘在該國與俄羅斯作戰的4年間數度造訪。He ⁠filmed a ​documentary about Russia’s invasion that premiered in ​February 2023. Penn also lent Zelenskiy, a former comedian and actor, one of his ​other Oscars in 2022.西恩．潘拍攝過一部關於俄羅斯侵略的紀錄片，於2023年2月首映。他也在2022年把其中一座奧斯卡獎座，借給曾為喜劇藝人和演員的澤倫斯基。新聞辭典glitz：名詞，華麗、浮華。例句：He indulged in the glitz of the Palace of Versailles.（他沉浸在凡爾賽宮的富麗堂皇之中。）battered：形容詞，受重創的。例句：The country battered by a destructive storm recovered in just a few months.（這個國家僅花數個月便從毀滅性颶風的摧殘中恢復過來。）    ",https://news.ltn.com.tw/news/world/paper/1747769
伊朗地下設施出入口 被美以精準轟炸,國際,2026/03/22 05:30,美國中央司令部20日發布的影像顯示，伊朗哈吉阿巴德一處設施遭空襲後發生爆炸。（路透）美國中央司令部20日發布的影像顯示，伊朗哈吉阿巴德一處設施遭空襲後發生爆炸。美國有線電視新聞網（CNN）21日公布衛星照片分析調查，顯示美國與以色列透過大規模精準轟炸地下設施出入口，有效癱瘓伊朗彈藥儲備與飛彈發射能力。CNN審視32處深埋山體的伊朗飛彈基地，發現所有基地均曾遭空襲，目標鎖定隧道入口、地面建築與聯絡道路。在分析的107個隧道入口中，至少77%曾遭轟炸，衛星影像更捕捉到至少15台飛彈發射車被摧毀。專家指出，此戰術意在切斷伊朗「打擊鏈」，阻止其將飛彈運出掩體攻擊美軍及盟友。（國際新聞中心）    ,https://news.ltn.com.tw/news/world/paper/1747797
Axios：川普團隊研擬與伊朗和談策略,國際,2026/03/22 05:21,一名美國官員與一名知情消息人士透露，伊朗戰爭持續3週後，美國總統川普政府已就戰爭下一階段，以及可能與伊朗進行和平談判展開初步討論。美國新聞網站Axios報導，川普（Donald Trump）昨天表示他考慮「逐步結束」戰爭，不過美國官員預期戰事還會再持續2到3週。同時，川普的幕僚們希望開始為外交談判鋪路。請繼續往下閱讀...根據消息人士的說法，川普的特使庫許納（Jared Kushner）和魏科夫（Steve Witkoff）也參與了相關討論。任何結束戰爭的協議，都必須包含重新開放荷莫茲海峽（Strait of Hormuz）、解決伊朗高濃縮鈾庫存問題，並制定關於伊朗核計畫、彈道飛彈以及德黑蘭對區域代理人支持的長期協議。一名美國官員及兩名消息人士說，美國和伊朗近日並無直接聯繫，不過埃及、卡達與英國都曾為雙方傳遞訊息。埃及跟卡達已通知美國與以色列，伊朗有意談判，但也提出相當嚴苛的條件。伊朗的要求包括停火、保證這場戰爭未來不再重啟以及賠償。一名美國官員談到：「我們的看法是，我們已削弱伊朗擴張的實力。」此人相信伊朗終將坐上談判桌，並指出美方希望德黑蘭做出以下6項承諾：未來5年內不發展飛彈計畫。完全停止鈾濃縮活動。讓納坦茲（Natanz）、伊斯法罕（Isfahan）及福爾多（Fordow）等美以兩國去年轟炸的核設施的反應爐永久除役。針對可推進核武計畫的離心機及相關機械的製造與使用，實施嚴格的外部監督協議。與區域國家簽署武器管制條約，內容包含飛彈數量不得超過1000枚。不得資助黎巴嫩真主黨（Hezbollah）、葉門青年運動（Houthi）、加薩走廊（Gaza Strip）哈瑪斯（Hamas）等代理人組織。伊朗過去已多次拒絕上述數項要求，德黑蘭領導階層也表示，與一位先前曾展開對話，卻又突然發動轟炸的總統進行談判是困難重重。（編譯：洪培英）1150322    ,https://news.ltn.com.tw/news/world/breakingnews/5378314
英國官員證實　伊朗攻擊印度洋英美基地未遂,國際,2026/03/22 02:30,一名英國官員今天向法新社證實，伊朗試圖攻擊位於印度洋狄耶戈加西亞島上的英美聯合軍事基地但「未能成功」。「華爾街日報」先前報導，德黑蘭當局朝該基地發射了兩枚彈道飛彈。狄耶戈加西亞（Diego Garcia）距離伊朗國土約4000公里，是英國允許美國在伊朗戰爭中用於「防禦作戰」的兩座基地之一。請繼續往下閱讀...英國政府昨天宣布，允許華府使用位於狄耶戈加西亞以及英格蘭西南部費爾福（Fairford）的基地，以打擊伊朗「用於襲擊荷莫茲海峽（Strait of Hormuz）船隻的飛彈基地與相關軍事能力」。這名英國官員也證實，伊朗試圖攻擊狄耶戈加西亞未遂，是發生在倫敦當局宣布上述消息之前。美聯社報導，伊朗先前將其彈道飛彈計畫的射程限制在2000公里，但美國官員指出，伊朗的衛星發射系統可延長飛彈射程。英國國防及安全智庫「皇家聯合軍事研究所」（RUSI）資深研究員布朗克（Justin Bronk）說，伊朗的衛星運載火箭鳳凰號（Simorgh）能擴大飛彈射程，但可能會降低終端準確度。另一方面，根據英國廣播公司（BBC），英國首相官邸發言人表示，首相施凱爾（Keir Starmer）已透過通話告訴賽普勒斯總統克里斯托多里底斯（Nikos Christodoulides），英國位於賽普勒斯的阿克洛迪瑞（Akrotiri）空軍基地「不會參與」美國打擊伊朗的行動。（編譯：洪培英）1150322    ,https://news.ltn.com.tw/news/world/breakingnews/5378308
伊朗總統：美以立即停止侵略才能結束戰爭,國際,2026/03/22 01:21,伊朗駐印度大使館今天在社群平台X發文寫道，伊朗總統裴澤斯基安指出，美國和以色列的侵略行動必須「立即停止」，才能結束戰爭以及更廣泛的區域衝突。路透社報導，裴澤斯基安（Masoud Pezeshkian）今天稍早曾和印度總理莫迪（Narendra Modi）通話。請繼續往下閱讀...裴澤斯基安告訴莫迪，應有保障措施防止類似「侵略」事件未來再次發生，他也呼籲由主要新興經濟體組成的金磚國家（BRICS）發揮獨立作用，制止針對伊朗的侵略行徑。根據伊朗駐印度大使館的說法，裴澤斯基安還提議由西亞國家組成區域安全架構，以在不受外來勢力干預的情況下確保和平。另一方面，儘管美國總統川普（Donald Trump）先前表示考慮「逐步結束」對伊朗的軍事行動，以色列國防部長今天上午宣布，美以兩國本週將「大幅加強」對伊朗的打擊。莫迪今天稍早也在X平台發文寫道，他與裴澤斯基安通話時，曾譴責對中東地區關鍵基礎設施的攻擊。莫迪也重申維護航行自由、確保航道暢通安全的重要性。（編譯：洪培英）1150322    ,https://news.ltn.com.tw/news/world/breakingnews/5378304
「川習會」陷僵局！ 傳待伊朗戰事降溫  川普政府才願安排,國際,2026/03/22 00:12,美國總統川普與中國國家主席習近平，去年10月30日在南韓釜山會晤。（路透檔案照）美國Politico政治新聞網站21日獨家報導，隨著美國向波斯灣增兵、伊朗戰事升溫，原定3月底舉行的「川習會」陷入僵局。據多名知情人士透露，川普政府已向外國官員表明，在伊朗戰爭激烈階段結束前，不會重新安排美國總統川普與中國國家主席習近平的會晤。一位熟悉美中峰會籌備工作的駐華盛頓外交官向Politico證實，美國政府已明確表示：「川普與習近平的下次峰會日期，將待伊朗衝突的激烈階段結束後才會提出。」另一位同樣熟悉白宮峰會籌備工作、且與政府關係密切的駐華盛頓人士也證實，政府方面已透露了這一時間表。請繼續往下閱讀...但白宮發言人凱莉（Anna Kelly）否認此說，稱為「假新聞」，強調美國與中國正就重新安排川普總統的訪問進行建設性討論，相關公告即將發布。中國駐美大使館則表示沒有相關資訊。事實上，川普對會期說法反覆，先是說延後「一個月左右」，之後改口到「約一個半月」。白宮發言人李威特18日則暗示，會談可能要到5月之後才會發生。與此同時，伊朗戰爭已進入第四週，美方不僅考慮長期部署，甚至傳出擬定地面部隊進入伊朗的計畫，並已增派數千兵力。一名接近政府人士坦言，「在待在外國、特別是中國這種對手國家的情況下，要處理戰爭存在操作上的限制，在這種氣氛下進行川習會將顯得極其尷尬」。川普與習近平去年10月在南韓釜山會晤時，曾在緩解貿易戰方面取得進展。當時習近平承諾購買大豆等美國農產品，並取消關鍵礦物出口限制；川普則同意延長暫緩對中國商品徵收關稅的期限。前美國貿易代表署（USTR）談判代表卡特勒（Wendy Cutler）認為，即便兩人不見面，貿易穩定工作仍可繼續。然而，前拜登政府國家安全會議中國事務主任杜如松（Rush Doshi）警告，目前無法確定戰爭何時會結束，而在戰爭結束前，如果缺乏領導人之間的直接溝通，會讓雙邊關係存在真實的風險，恐會比外界原先預期的更加不穩定。    ,https://news.ltn.com.tw/news/world/breakingnews/5378298
