Title,News_Type,date,content,url
中東戰火有望平息？ 川普4/2早上9點發表全美演說,國際,2026/04/01 09:12,白宮新聞秘書李威特表示，川普將會在美東時間4月1日晚間9點針對伊朗問題發表全國演說。（彭博）美國總統川普3月31日表示，美國可能在兩到三週內結束對伊朗的軍事行動，白宮新聞秘書李威特（Karoline Leavitt）表示，川普會在美東時間4月1日晚間9點（台灣時間4/2上午9點）發表全國演說。綜合外媒報導，川普3月31日在白宮橢圓形辦公室表示，「我們很快就要離開了」，強調美國可能會在兩、三週內結束與伊朗的衝突，這也是川普迄今最為明確的表態。川普提到，伊朗新執政權更容易溝通，所以伊朗無須與美國達成協議，美國就會撤軍。川普強調：「當我們覺得他們長期處於石器時代，無法研製出核武器時，我們就會離開。無論我們是否達成協議，都無關緊要。」請繼續往下閱讀...川普也暗示，當美國撤離後，荷姆茲海峽（Strait of Hormuz）問題將會留給其他國家處理，「如果法國或其他國家想獲取石油或天然氣，他們會穿過荷姆茲海峽，他們會直接過去然後自己解決。我認為這實際上會非常安全，這與我們無關」。李威特指出，川普將發表全國演說，針對「伊朗的最新重要情況」進行概述。    ,https://news.ltn.com.tw/news/world/breakingnews/5389357
美軍重拳打擊！ 伊朗海空軍停擺、防空系統幾近瓦解,國際,2026/04/01 08:45,"美國中央司令部司令庫柏上將公布最新戰報，強調伊朗海空軍癱瘓、防禦系統瓦解，且美軍已有效消除伊朗對境外目標的投射力量。（美聯社）美國自2月28日發動「史詩怒火行動」（Operation Epic Fury）至今，摧毀伊朗境內大量軍事目標，美國中央司令部（CENTCOM）司令庫柏上將（Adm. Brad Cooper）3月31日公布最新戰報，強調伊朗海空軍癱瘓、防禦系統瓦解，且美軍已有效消除伊朗對境外目標的投射力量。庫柏上將在中央司令部於社群媒體「X」貼出的影片中指出，目前在中東有5萬美軍，此次是他六度針對「史詩怒火行動」進行戰況匯報，目前行動進入第五週，目標是削弱伊朗向境外投射軍事力量的能力。庫柏上將表示，近期戰況發展表明，伊朗的海軍活動、空中行動和防禦系統均受到顯著影響，「我們看不到他們的海軍出海，看不到他們的飛機飛行，他們的防空和飛彈防禦系統也基本上被摧毀」。請繼續往下閱讀...庫柏上將指出，儘管取得上述進展，但美軍仍保持警惕並做好戰鬥準備，行動效率取決於執行人員，部署在前線的部隊陸續做出傑出貢獻，美軍透過各軍種的協同作戰，有系統地拆解了伊朗的無人機、飛彈及海軍攻勢。包括海軍發射多輪巡弋飛彈，航艦則以艦載機發動打擊，空軍透過空中加油機延長了戰鬥機與轟炸機的打擊範圍，地面部隊為遠程作戰和防禦措施提供支持，保衛美軍及其合作夥伴，太空軍則提供關鍵優勢，為這場行動提供關鍵支援。在戰報最後，庫柏上將也對集結於中東的美軍聯合作戰部隊表示讚賞，這支部隊包括陸軍士兵、海軍水手、空軍飛行員、陸戰隊員、國民兵以及海岸警衛隊隊員，庫柏強調，他們是「世界上有史以來最強大軍隊」的一部分。Update from CENTCOM Commander on Operation Epic Fury: pic.twitter.com/x79frG3zwi— U.S. Central Command （@CENTCOM） March 31, 2026 Update from CENTCOM Commander on Operation Epic Fury: pic.twitter.com/x79frG3zwi    ",https://news.ltn.com.tw/news/world/breakingnews/5389297
53年來首度載人奔月！NASA阿提米絲2號升空倒數 直播看這裡,國際,2026/04/01 08:41,NASA阿提米絲2號火箭最快將於美東時間「愚人節」傍晚（台灣時間4月2日清晨）發射升空。（路透）美國國家航空暨太空總署（NASA）「阿提米絲二號」（Artemis II）任務火箭最快將於美東時間「愚人節」傍晚（台灣時間4月2日清晨）發射升空，這將是53年來再有載人月球任務。NASA將於今天晚間直播燃料加注作業，並於午夜後開始完整發射直播。綜合外媒報導，NASA在美東時間3月31日下午結束發射前最後一次記者會，確定阿提米絲二號任務在「愚人節」升空照原定計畫執行，發射窗口約2小時，最快於美東時間傍晚6時24分（台灣時間4月2日凌晨6時24分）開始，約有20%的機率可能因天氣狀況而受阻，若發射延期，4月6日之前都有機會發射。請繼續往下閱讀...NASA表示，將於發射日美東時間上午7時45分（台灣時間4/1晚間7時45分）起，在NASA的YouTube頻道直播燃料加注作業，屆時團隊將把推進劑裝入SLS火箭，完整發射直播則將於下午12時50分（台灣時間4/2凌晨0時50分）開始，民眾也可透過多種線上平台觀看。NASA表示，火箭升空前的最後整備進入關鍵階段，團隊已完成引擎與太空衣檢查、替獵戶座（Orion）太空船充電，接下來還將持續進行發射台清場、啟動地面發射序列器，以及火箭艙體空腔的氮氣切換等作業，為後續燃料加注與發射做準備。如果一切按計畫進行，4名太空人將執行為期10天的繞月飛行任務，於飛行第6天到達距離地球最遠點，飛越月球表面約8000公里，時長約6小時，最終返回地球。這趟測試飛行目標是驗證獵戶座太空船及其生命維持系統能否安全地將人類送上月球。NASA計畫2028年後重返月球。NASA阿提米絲2號火箭升空前的最後整備進入關鍵階段。（法新社）    ,https://news.ltn.com.tw/news/world/breakingnews/5389289
伊朗揚言炸18家美企報復！白宮：美軍已準備反制任何攻擊,國際,2026/04/01 08:38,伊朗革命衛隊警告，若再有伊朗領袖在「針對性暗殺」中喪生，將把蘋果、Google與Meta等美國頂尖科技公司列為攻擊目標。（資料照，法新社）近期中東局勢緊張，伊朗伊斯蘭革命衛隊（IRGC，Islamic Revolutionary Guard Corps）警告，若再有伊朗領袖因「針對性暗殺」喪生，將把美國蘋果、Google、輝達等18家頂尖科技企業列為攻擊目標。白宮對此發聲強調，美軍已做好全面準備，將反制任何來自德黑蘭的攻擊行動。伊朗革命衛隊3月31日發出聲明，指控美國政府與科技巨擘「無視我們一再警告必須停止」針對伊朗高層官員的行動，並質疑這些科技公司是「設計與追蹤暗殺目標的主要元素」。伊朗革命衛隊稱，如果再有伊朗領袖在「針對性暗殺」中喪生，將把蘋果（Apple）、Google與Meta等美國頂尖科技公司列為攻擊目標。請繼續往下閱讀...被列出的18家美企包含：英特爾（Intel）、微軟（Microsoft）、蘋果（Apple）、臉書母公司Meta（Meta Platforms）、谷歌（Google）、甲骨文（Oracle），以及電動車製造商特斯拉（Tesla）、AI數據分析公司帕蘭泰爾（Palantir）與晶片巨頭輝達（Nvidia），還有思科（Cisco）、惠普（HP）、國際商業機器公司（IBM）、戴爾（Dell）、摩根大通（JPMorgan Chase）、奇異（GE）、「Spire Solution」、AI巨頭「G42」及波音（Boeing）。針對這項警告，《路透社》引述一名匿名白宮官員回應稱，美軍在過去和現在都已準備好遏止伊朗的任何攻擊，並強調伊朗的軍事能力已明顯受挫，直言這個恐怖政權的彈道飛彈和無人機攻擊已銳減90%。    ,https://news.ltn.com.tw/news/world/breakingnews/5389284
俄羅斯An-26軍用運輸機克里米亞墜毀 29人全罹難,國際,2026/04/01 07:40,俄羅斯軍方一架「An-26」運輸機3月31日在克里米亞一帶墜毀，機上29人全數罹難。圖為同型機。（歐新社資料照）俄羅斯一架「安-26」（An-26）運輸機3月31日在俄羅斯佔領的克里米亞一帶墜毀，機上29人全數罹難。綜合外媒報導，俄羅斯國防部3月31日發表聲明，1架An-26軍用運輸機在克里米亞上空進行例行飛行時失去聯繫，該機於當地時間31日下午6點左右從雷達上消失。後續俄方搜救人員已找到運輸機墜毀地點，機上29人全數遇難，包括23名乘客和6名機組人員。請繼續往下閱讀...安-26是一架生產於蘇聯時代的雙引擎螺旋槳飛機，用於短途和中程運輸，可搭載多達40名士兵或5.5噸貨物。目前還不清楚安-26運輸機墜毀原因為何，烏克蘭軍方也尚未對這起墜機事件發表評論。    ,https://news.ltn.com.tw/news/world/breakingnews/5389285
荷姆茲海峽安全不關我事 川普講白了：2到3週內結束戰爭！,國際,2026/04/01 07:21,川普3月31日表示，美國可能在兩到三週內結束對伊朗的軍事行動，這也是川普迄今最為明確的表態。（彭博）中東戰火有望平息，美國總統川普3月31日表示，美國可能在兩到三週內結束對伊朗的軍事行動，這也是川普迄今最為明確的表態。此外，川普也提到，確保荷姆茲海峽（Strait of Hormuz）的安全與美國無關。綜合外媒報導，川普3月31日在白宮橢圓形辦公室表示，「我們很快就要離開了」，強調美國可能會在兩三週內結束與伊朗的衝突。川普被問到「成功的外交協調是否是讓美國結束衝突的先決條件」，川普則回應，伊朗不需要與美國達成協議，結束這場衝突的前提是讓伊朗無法在短時間內取得核武器，「讓伊朗回到石器時代」。請繼續往下閱讀...此外，川普當天也提到，確保荷姆茲海峽的安全與美國無關，美國不會插手荷姆茲海峽局勢，維護荷姆茲海峽暢通的責任將落在依賴它的國家身上。川普說：「我們沒有理由這麼做，那不是我們的事，那是法國的事，事關任何使用海峽的人。」川普指出，如果法國或其他國家想要獲取石油或天然氣，他們就可以穿過荷姆茲海峽，他們可以直接進入那裡，然後就自己看著辦了，「海峽裡發生什麼事，我們都不管了」。    ,https://news.ltn.com.tw/news/world/breakingnews/5389280
鬆口？伊朗總統稱有意結束戰爭 前提是「侵略不再重演」,國際,2026/04/01 06:55,伊朗總統裴澤斯基安強調伊朗有意結束戰爭，但前提是要有一個讓衝突不會重演的保障機制。（法新社）中東戰火有望和緩！伊朗總統裴澤斯基安（Masoud Pezeshkian）3月31日透過總統辦公室發表聲明，強調伊朗擁有「必要的意志」來結束與美國、以色列之間的持續戰爭，前提是要有讓衝突不會重演的保障機制。綜合外媒報導，聲明中指出，裴澤斯基安與歐盟理事會（European Council）主席通話時表示：「我們擁有結束這場衝突的必要意志，前提是滿足必要條件，特別是能預防侵略重演所需的保障措施」，聲明中特別提到，這是德黑蘭的主要訴求。請繼續往下閱讀...伊朗《Press TV》報導指出，裴澤斯基安強調：「我們在任何時候都從未尋求戰爭，只要必要條件得到滿足，尤其是防止侵略再次發生所需的保障，我們就有決心結束這場戰爭。」歐盟理事會主席科斯塔（António Costa）則是在社群發文提到，他在與裴澤斯基安的通話中呼籲各方緩和局勢、保持克制。科斯塔表示：「我敦促伊朗停止攻擊該地區國家，並積極參與外交途徑，特別是與聯合國合作，以確保荷姆茲海峽的航行自由。」    ,https://news.ltn.com.tw/news/world/breakingnews/5389270
伊朗政權最強保護傘！「軍事-宗教複合體」掌握逾半經濟命脈,國際,2026/04/01 06:29,70萬人組成的志願民兵「巴斯杰」，是德黑蘭政權的維穩幫手，協助鎮壓反政府的街頭抗議者。（美聯社檔案照）首次上稿 03-31 23:41更新時間 04-01 06:29部分專家認為，儘管美國總統川普認為擊斃伊朗最高領袖哈米尼（Ali Khamenei）和多名高層官員後，美國已達成讓德黑蘭「政權更迭」的目標，但伊朗龐大的安全機器並非僅靠意識形態來維繫，而是由一套經濟誘因系統所支撐，政權一旦垮台，將對其追隨者的生計構成直接威脅。請繼續往下閱讀...華爾街日報報導，研究伊朗政權的學者與分析人士表示，這個伊斯蘭共和國成立至今，已建立一個觸角廣泛的生態系統，控制超過一半的經濟活動，以現金、職業及其他機會獎賞效忠者，以換取他們鎮壓異己並對政權保持忠誠。儘管美國和以色列長達數週的空襲，削弱德黑蘭領導層與基礎設施，但這種社會與經濟契約的深度，正協助該政權維持凝聚力。最新民調顯示，只有20%的伊朗人支持該政權，但既得利益者構成一個比反對派更具凝聚力的集團，透過經濟利益，將執政的什葉派神職人員、準軍事部隊與平民綁在一起。智庫「國際危機組織」（ICG）伊朗專案負責人瓦艾斯（Ali Vaez）指出，這個系統將使那些從中獲利者，很難被說服去反對政權，「數百萬人因效忠政權而獲益。他們不想失去這些。」這些津貼福利包括現金券、優先進入大學、以優惠匯率取得外匯，或是廉價貸款。為保護政權而成立的精銳部隊「伊斯蘭革命衛隊」（IRGC），由至少12.5萬名支薪人員組成，在經濟中扮演重要角色，以準國家企業的形式運作，進行消費品貿易，並主導石油與天然氣、建築和電信等主要基礎設施部門。而在70萬人組成的志願民兵「巴斯杰」（Basij）協助下，德黑蘭政權也控制了反政府的街頭抗議者。根據巴斯杰的官方社群媒體帳號與伊朗政府員工的說法，巴斯杰成員就讀於伊朗的大學，並在大多數政府及與政權相關的公司中任職。與軍隊不同，「巴斯杰是社會的一部分」。根據革命衛隊公司高層與伊朗石油官員的說法，在10年前跨國公司因制裁而撤出伊朗能源部門後，衛隊附屬企業獲得無須競標的合約，以開發伊朗和卡達共有的南帕爾斯（South Pars）天然氣田。革命衛隊最大企業集團「哈塔姆安比亞」（Khatam al-Anbiya）估計，合約的長期價值約500億美元，相當於伊朗國內生產毛額（GDP）的14％。根據「荷蘭國際關係研究所」（Clingendael Institute）2025年12月發布的報告，與革命衛隊結盟的保守派神職人員，也控制大型宗教基金會（bonyads），這些基金會與衛隊企業共同控制超過50%的經濟活動。報告指出，這種「軍事—宗教基金會複合體」是伊朗政治經濟的基礎黏合劑，並支撐著國家的經濟實力；這個複合體依然牢不可破，而且幾乎不允許發生政治變革。    ,https://news.ltn.com.tw/news/world/breakingnews/5389221
英王本月將訪美 在野國會議員大罵首相沒出息,國際,2026/04/01 05:45,英國國王查爾斯三世（左）將在本月對美國進行國是訪問，美國總統川普（右）已透過社群平台表示歡迎。（法新社檔案照）儘管美國總統川普屢次批評英國政府未支持伊朗戰爭，英國國王查爾斯三世（King Charles III）仍將於4月對美國進行國是訪問。川普已透過社群平台表示歡迎，但英國國會議員對此頗有意見，反對黨黨魁大罵英國首相施凱爾（Keir Starmer）「沒骨氣」。白金漢宮（Buckingham Palace）3月31日宣布，查爾斯與王后卡蜜拉（Queen Camilla）將於4月下旬前往美國，慶祝美國獨立250週年。川普將日期訂為4月27日至30日。請繼續往下閱讀...川普在「真實社群」（Truth Social）發文表示：「我期待與我非常尊敬的國王共度時光。這將會非常棒（TERRIFIC）！」川普去年9月對英國進行國是訪問，被視為英國致力於鞏固兩國所謂「特殊關係」的努力之一，當時川普的「美國優先」（America First）政策正威脅既有的全球秩序。然而，這並未阻止川普指責英國拒絕讓美國軍機使用英國基地，對伊朗發動攻擊。川普在「真實社群」的1篇貼文中表示，那些因為荷姆茲海峽（Strait of Hormuz）周邊限制而無法獲得航空燃料的國家，應該「鼓起遲來的勇氣，前往海峽並直接奪取（TAKE IT）」。他屢次猛烈抨擊英國首相施凱爾，甚至一度稱他「不是邱吉爾（Winston Churchill，二戰時英國首相）」。此舉導致部分英國國會議員要求施凱爾取消查爾斯的此次國是訪問，以表明英國的不滿，並避免在兩國關係緊張之際讓國王感到尷尬。在野黨自由民主黨（Liberal Democrats）黨魁戴維（Ed Davey）表示，施凱爾允許國是訪問如期進行，顯示他「極度缺乏骨氣」，「在川普將我們的皇家海軍貶為玩具之後，還讓國王前往美國進行國是訪問，這是一種恥辱，也是一個政府軟弱到無法對抗惡霸的跡象。川普接下來還得做出什麼駭人聽聞的事，才能讓政府恢復理智並取消國是訪問？」君主在國內主持國是訪問，並應民選政府的要求出國訪問，政府則利用此類場合的盛大排場，來鞏固與世界各國的關係。繼續進行這項討論已久的訪問的決定，可被視為施凱爾政府為緩解戰爭引發之緊張局勢所做的努力，或者至少是不讓局勢火上加油。眾所周知，川普喜愛英國王室，並沉醉於去年對溫莎城堡（Windsor Castle）的訪問，當時他受到軍樂隊的歡迎。查爾斯在1個布滿鮮花與金箔的國宴廳為他舉辦晚宴。這次訪問的契機，源於施凱爾在川普展開第二任期僅5週後的2025年2月，匆忙趕往華府，並將國王的邀請函親手交給川普。這是首次有世界領袖獲得第二次國是訪問的殊榮，也是首次以國王私人信函的形式遞交邀請函；川普當時還在電視鏡頭前自豪地展示這封信。川普當時說：「這是一個非常、非常大的榮幸。」他還強調信中包括前往溫莎城堡的邀請，「這真的很了不起。」現在，查爾斯將前往華府進行回訪。查爾斯曾訪問美國19次，但這是他登基以來首次對美國進行國是訪問。他的母親伊莉莎白二世女王（Queen Elizabeth II）曾對美國進行過4次國是訪問。配合此次美國之行，國王也將前往百慕達（Bermuda），這是他做為君主首次訪問該海外領地。    ,https://news.ltn.com.tw/news/world/breakingnews/5389238
美82空降師抵達中東 奪島倒數,國際,2026/04/01 05:30,就在美國總統川普評估對伊朗的下一步行動之際，美國陸軍精銳第82空降師數千名官兵，已陸續抵達中東，將擴大川普政府對伊朗用兵的選項，包括發動奪島作戰。（美聯社檔案照）就在美國總統川普評估對伊朗的下一步行動之際，兩名美國官員透露，美國陸軍精銳第八十二空降師數千名官兵，已陸續抵達中東，此舉將擴大川普政府對伊朗用兵的選項，包括發動奪島作戰。路透報導，這批傘兵駐紮於北卡羅來納州布拉格堡。美國已增派數千名海軍、陸戰隊和特種作戰部隊人員前往中東地區。約二五〇〇名陸戰隊員在上週末抵達中東。請繼續往下閱讀...這次派遣的陸軍兵力包括第八十二空降師司令部單位、部分後勤及其他支援人員，以及一個旅級戰鬥部隊。兩名匿名官員並未具體說明這批傘兵的部署位置。其中一名官員透露，目前尚未決定派美軍進入伊朗，但這波增兵將強化美軍未來可能在中東行動的能力。這支部隊可能用於從事多項任務，包括試圖奪取伊朗石油出口樞紐哈格島。路透本月稍早報導，川普政府內部曾討論奪取哈格島的行動。此舉風險極高，因為當地位於伊朗飛彈和無人機射程範圍內。可能進入伊朗 或部署海岸線路透此前也報導，川普政府內部曾討論動用地面部隊進入伊朗，以提取高濃縮鈾，但此選項意味著美軍將更深入且更長時間駐留伊朗境內，試圖挖掘深埋地下的物質。川普政府內部討論還包括可能派遣美軍進入伊朗，以確保油輪安全通過荷姆茲海峽。雖然這項任務主要將透過空軍和海軍完成，但也可能會向伊朗海岸線部署美軍。報導指出，由於美國民眾對伊朗戰爭支持度偏低，以及川普曾在競選前承諾避免美國捲入新的中東衝突， 任何動用美國地面部隊的行動，即使是有限的任務，都可能為川普帶來重大政治風險。專家認為，奪佔哈格島不僅將危及美軍官兵的生命，而且可能依然無法結束戰爭。如果川普想藉由破壞伊朗石油工業來增加談判籌碼，更好的選擇可能是在海上建立封鎖線，對付在哈格島石油碼頭裝油的船隻。以色列智庫「國家安全研究所」伊朗事務資深研究員希特里諾維奇表示，奪取哈格島可能會使衝突升級，伊朗及其代理人，包括葉門叛軍「青年運動」，可能會加強報復，在荷姆茲海峽佈雷，或使用無人機打擊阿拉伯半島從波斯灣到紅海各地的目標。歐洲官員指出，伊朗正敦促「青年運動」再次對紅海航運發動攻擊，但這將取決於美國是否進一步升級戰事。彭博引述知情人士報導，「青年運動」在向以色列發射彈道飛彈後，正考慮更具侵略性行動，但該組織高層對採取何種策略存在分歧，有可能拖延決策，以維持對美國的籌碼。    ,https://news.ltn.com.tw/news/world/paper/1749133
