Title,News_Type,date,content,url
涉詐領健保費 新北菡生婦幼診所：積極配合司法調查,社會,2026/04/17 13:20,新北市板橋區菡生婦幼診所傳出涉嫌詐領健保費，新北地方檢察署昨（16）日率隊前往搜索，菡生今（17）日稍早透過粉專發布聲明。（記者黃子暘攝）新北市板橋區菡生婦幼診所傳出涉嫌詐領健保費，新北地方檢察署昨（16）日率隊前往搜索，菡生今（17）日稍早透過粉專發布聲明表示，院方正全力配合司法機關進行相關調查程序，相關細節因涉及偵查不公開原則，暫不便對外說明，也針對此事造成患者與社會大眾的不安與困擾，向大眾致歉。菡生指出，院方一向重視醫療品質與病人安全，未曾懈怠，將持續確保醫療服務之穩定與品質。新北市板橋區菡生婦幼診所傳出涉嫌詐領健保費，新北地方檢察署昨（16）日率隊前往搜索，菡生今（17）日稍早透過粉專發布聲明。（翻攝菡生粉專）    ,https://news.ltn.com.tw/news/society/breakingnews/5407012
台東年長漁民感冒仍工作不慎落海 海巡人員即時救起,社會,2026/04/17 13:17,岸巡人員立即救人。（第一三岸巡隊提供）今日8時44分，海巡署東部分署第一三岸巡隊金樽安檢所接獲民眾通報，本港籍「O聖仁」王姓船長失足落海，隨即由金樽安檢所人員趕赴現場救援。經岸巡初步了解，船長於整補魚貨時，因港區潮差過大，導致作業時不慎跌落港區水中，而68歲的船長今天其實還因感冒渾身無力，仍強撐工作，但意外發生後也無力爬上船。請繼續往下閱讀...金樽安檢所立即通報台東縣消防局成功大隊東河消防分隊派員協處，另方面，海巡人員趕赴現場後，見狀隨即將落海船長拉上船隻，經詢問身體狀況良好、意識清楚，無明顯外傷，隨後由海巡人員陪同返回家中。岸巡人員立即救人。（第一三岸巡隊提供）    ,https://news.ltn.com.tw/news/society/breakingnews/5407013
國藝獎得主撒古流性侵女子 判刑4年6月定讞,社會,2026/04/17 12:38,排灣族藝術家、國家文藝獎得主撒古流．巴瓦瓦隆遭女子指控性侵，一審、二審均依強制性交罪判有期徒刑4年6月。案經上訴三審，最高法院日前駁回上訴定讞。（資料照）排灣族藝術家、國家文藝獎得主撒古流．巴瓦瓦隆，遭女子指控性侵，一審、二審均依強制性交罪判有期徒刑4年6月。案經上訴三審，最高法院日前駁回上訴定讞。一審屏東地方法院判決指出，民國110年2月9日，撒古流．巴瓦瓦隆（Sakuliu Pavavaljung）在屏東縣三地門鄉住所內，與向他工作學習的女子飲酒談話後，邀約女子外出。隔天凌晨約1、2時許，撒古流駕駛小貨車載著女子前往三地門鄉大社溪溪谷河床，並鋪設睡墊、點燃柴火，與女子相鄰躺臥睡墊上。請繼續往下閱讀...判決書提及，撒古流以手摟住女子肩頭，女子推擋後猶未鬆手，並將女子強壓在睡墊上，要求性行為。女子因獨自身處陌生環境，恐遭不測，思緒混亂，不敢不從，撒古流無視女子以手推擋及出言拒絕，仍對女子進行性交行為。隨後撒古流友人接近，撒古流要求女子躲藏一旁，待友人離去後，接續強制性交。法官依女子診斷證明書及病歷、通訊軟體對話紀錄、現場照片等證據及證人，認定撒古流有違反女子意願強制性交犯行，審酌撒古流為女子學習對象，竟未能自制，動機及目的不良，且未尊重女子性自主決定權，造成女子心理上難以彌補陰影及創傷。犯後飾詞辯解，未見悔意，但與女子協商給付金錢，一審判處4年6月。案經上訴二審，由台灣高等法院高雄分院審理。合議庭認為，原審判決在認事用法上俱無違誤，量刑亦屬允當，並無任何偏重不當或違法之處，駁回上訴。撒古流不服判決結果提起上訴，最高法院審理後，認為二審判決並未違背法令，於本月1日駁回上訴，全案確定。撒古流．巴瓦瓦隆是三地門鄉出身的排灣族藝術家，住三地門鄉大社村，家族有多名藝術家，他從小耳濡目染，年輕時從事陶藝、繪畫和木、石雕等藝術創作，是第20屆國家文藝獎得主。（編輯：李錫璋）1150417    ,https://news.ltn.com.tw/news/society/breakingnews/5406948
因鍾文智逃亡被送懲戒法院 法官陳勇松出庭坦承疏失：應更謹慎周延,社會,2026/04/17 12:27,前「連一鮑魚」董事長鍾文智被重判後逃逸，法官陳勇松因未延長其科技監控等程序有違失，遭監院彈劾，並送懲戒法院。（資料照）前「連一鮑魚」董事長鍾文智因炒股被重判定讞後逃跑，監察院去年10月彈劾高等法院法官陳勇松，認定他於合議庭評議鍾文智加保、不延長科技監控後，未宣示裁定等，違反辦案程序及職務規定，全案移送懲戒法院審理。懲戒法院職務法庭今行準備程序，陳勇松坦言沒注意到鍾文智罪很重、此案屬重大程序案件，應更為謹慎；無論最後如何裁定，他都虛心接受。鍾文智涉違反證交法，被判合計30年5月徒刑，棄保潛逃遭檢方通緝。時任高院庭長邱忠義、法官陳勇松因未延長其科技監控等程序有違失，被移送法官評鑑委員會評鑑；法評會8月決議將邱移送司法院人審會議處，陳則須移送職務法庭審理、建議罰俸10個月。請繼續往下閱讀...監察院彈劾指出，陳勇松明知合議庭裁定須經宣示或送達始生效，卻未依法製作並送達裁定書，僅由書記官電話片面告知被告鍾文智之辯護人辦理加保及拆除監控，亦未通知檢察官，致其無從提起抗告，嚴重違反訴訟程序。另在被告鍾文智逃匿引發輿論抨擊後，法官又補作評議附件並指示抽換電話紀錄，違反辦案程序，損害司法信賴。監察院認其違反法官倫理規範，情節重大，依法提案彈劾並移送懲戒法院審理。懲戒法院職務法庭今行準備程序，陳勇松解釋當時為何會如此處理，並坦言沒注意到鍾文智罪很重、此案屬重大程序案件，應更為謹慎。司法院代理人譚虎認為，交保2000萬元就可停止科技監控這件事，本身無違法，重心在於真正有違失的地方應是後續流程。，監察院代理人黃俊燁認為，科控解除的處置不適當，歷次調查過程，審判長邱忠義、法官蔡羽玄陳述及司法院所回覆，均可看出當時所採取條件的法律見解，陳勇松的說法不可信。法官詢問，針對法評會建議罰俸10個月有何意見，或是建議何種懲戒？司法院代理人譚虎回應，同法評會意見。監察院代理人黃俊燁回應，請為妥適懲處，尊重貴院意見。陳勇松表示，請庭上依公平原則、比例原則妥適裁定，他都接受，受懲戒處分人或合議庭這部分的法律見解是否有不盡周延或檢討之處，他也都虛心接受。    ,https://news.ltn.com.tw/news/society/breakingnews/5406941
中油林園廠新三輕壓縮機跳車 燃燒塔冒出熊熊火光,社會,2026/04/17 12:21,新三輕壓縮機跳俥，燃燒塔冒出熊熊火光。（民眾提供）中央要求中油增產乙烯等石化原料，紓解中東戰爭引發的「塑膠袋之亂」，行政院長卓榮泰更親臨中油林園廠視察，未料林園廠新三輕工場今（17）日上午約11點左右壓縮機跳俥，燃燒塔冒出熊熊火光。議員邱于軒說，有民眾擔心是否因塑膠原料缺貨趕工，釀成跳俥事件；中油則否認說，兩者沒有關係。中油說，新三輕組低溫工場設備短暫異常，丙烯壓縮機C-1501跳俥，啟用北區燃燒塔安全裝置，中午12點左右恢復正常操作，不會影響供應量。請繼續往下閱讀...除了議員反映，部分民眾質疑跳俥與趕工塑膠原料有關。中油說，這次事件為設備檢修期間產生異常，啟動安全連鎖機制，將製程氣體排放至燃燒塔燃燒，與民眾所質疑的缺料趕工無關。發生跳俥的為新三輕工場，與中央要求提前開車生產的新四輕不同，卓揆1日曾視察新四輕工場，希望能增產石化原料，供中下游廠商製造塑膠粒，供應塑膠袋需求，新三輕同樣以生產乙烯、丙烯等石化原料為主，歲修時程與新四輕不同。    ,https://news.ltn.com.tw/news/society/breakingnews/5406928
南投雙龍瀑布七彩吊橋 桃園男墜百米溪谷身亡,社會,2026/04/17 12:15,南投雙龍瀑布七彩吊橋，有男子從橋上墜落百米溪谷，搜救人員透過垂降救援。（南投縣消防局提供）南投縣信義鄉雙龍瀑布七彩吊橋，16日1名桃園邱姓男子從橋上墜落，南投縣消防局今凌晨展開搜救，上午鎖定溪床墜落點，並從橋上垂降115公尺到溪谷，惟接觸邱某時已明顯死亡，隨後以軟式擔架將遺體拉回橋面，後續將交由檢警進行相驗。南投雙龍瀑布七彩吊橋驚傳男子墜橋，搜救人員透過垂降展開救援。（南投縣消防局提供）南投雙龍瀑布七彩吊橋，驚傳有男子墜橋卡在溪底。（南投縣消防局提供）    ,https://news.ltn.com.tw/news/society/breakingnews/5406937
鬼切釀禍！台中三寶女騎士突左轉 直行男閃不及雙雙掛彩,社會,2026/04/17 12:11,發生機車碰撞事故路口。（民眾提供）台中市北區英才路與博館一街路口16日下午傳出機車碰撞事故，一個看似平常的起步左轉，卻在瞬間變成驚險碰撞，37歲劉姓女子騎機車原本在路口路邊停等，見車流間隙後準備起步左轉，不料疑未充分注意內側直行車動態，突然切入車道，與34歲郭姓男子騎乘、沿英才路內側直行的機車迎面撞上，巨大撞擊力道讓雙方當場人車分離，現場一度傳出驚呼聲。事故發生後，劉女手腳及腰部受傷，仍能自行就醫，郭男則全身多處擦挫傷，由救護人員緊急送醫治療，警方到場後立即進行交通疏導與調查，並對雙方實施酒測，確認皆無酒駕情形。請繼續往下閱讀...經查，事故關鍵疑在劉女起步左轉時出現俗稱「鬼切」的危險行為，未禮讓直行車先行，導致對向來車反應不及釀成碰撞，詳細肇事原因及責任歸屬，仍有待進一步調閱路口監視器釐清。轄區第二分局分局長鍾承志呼籲，行經路口時務必減速慢行並注意周遭車輛動態，起步或轉彎時應確認安全距離後再行駛，以避免因視線死角或未注意車前狀況而發生交通事故，共同維護道路交通安全。警方獲報趕往處理。（民眾提供）    ,https://news.ltn.com.tw/news/society/breakingnews/5406905
最高檢推新書《台灣法學方法論壇精粹》 邢泰釗盼補強司法論理基礎,社會,2026/04/17 12:10,邢泰釗說，最高檢近年積極思考自身角色，不僅是偵查犯罪的機關，也應在法學研究上扮演推動者。（記者劉詠韻攝）最高檢察署今舉行《台灣法學方法論壇精粹》新書發表會，檢察總長邢泰釗直言，近年國內法理與方法論研究逐漸式微，檢察體系不能在這一領域「缺一塊」，因此推動編纂本書，盼補強司法論理基礎，並將國際法治經驗轉化為第一線檢察官可運用的實務工具。法務部長鄭銘謙致詞時則提及，該書堪稱台灣法學界的創舉，對法學方法研究具有里程碑意義。邢泰釗表示，該書籌備前後歷時約數年，期盼透過整理學界與實務界重要觀點，建立一套可供第一線檢察官參考的法學方法工具，反觀近年因考試導向與補習文化影響，法理與方法論研究逐漸式微，相關課程與研究能量明顯減少，「如果沒有紮實的方法論基礎，我們的論理能力，很難跟國外相比。」請繼續往下閱讀...邢泰釗說，最高檢近年積極思考自身角色，不僅是偵查犯罪的機關，也應在法學研究上扮演推動者。當本書準備出版時，他曾反思，「難道我們檢察機關在法學方法論這一塊，就只能是空白嗎？」因此即使準備時間有限，也決定從既有研究成果中重新整理、補充內容。邢泰釗也分享，自己長期關注國際法學發展，例如唐獎教育基金會邀請的多位國際法學家，在世界上享有盛名，但在台灣未必廣為人知。為此，他指示檢察官蒐集資料，深入研究並撰寫成果，盼將國際法治經驗轉化為國內可運用的知識，「既然社會花了大量資源邀請這些國際專家，我們就要思考，如何把他們的知識，變成我們自己能用的知識，這是最高檢察署應該做的事。」「在我們檢察系統裡面，對法學方法論跟法理學其實研究得很少，很少。」邢泰釗形容，推動法學方法論研究就像補上長期缺失的基礎工程，若現在才開始全面投入，難免顯得倉促，但仍必須逐步累積，為台灣法學建立更穩固的論理基礎。鄭銘謙致詞時指出，《台灣法學方法論壇精粹》堪稱台灣法學界的一項創舉，不僅為法學方法研究開拓新空間，也將成為檢察官辦案的重要工具，未來可望受到各司法機關重視與廣泛運用，包括書中匯集國內法學界重要學者與實務工作者的研究成果，期許該書能如同德國法學家Karl Larenz於1960年代出版的法學方法論一般，成為台灣建立本土化的法學方法體系。《台灣法學方法論壇精粹》籌備前後歷時約2年。（記者劉詠韻攝）法務部長鄭銘謙致詞。（記者劉詠韻攝）全體大合影。（記者劉詠韻攝）    ,https://news.ltn.com.tw/news/society/breakingnews/5406919
台61中彰大橋段追撞事故占全車道 估下午3時搶通,社會,2026/04/17 12:01,台61中彰大橋段嚴重車禍，2化學槽車、2小貨車撞成一團。（民眾提供）台61線西濱快速公路中彰大橋路段，今天凌晨發生5車追撞事故，造成1輛化學槽車翻覆，醋酸甲酯外滲路面，3人受傷送醫，雙向車道預計下午3時搶通，彰化縣環保局將依廢清法告發。彰化縣警察局和美分局說明，凌晨2時許彰化縣伸港鄉台61線161公里處發生交通事故，經初步了解，郭姓曳引車駕駛沿台61線北上行駛時，撞到莊姓民眾駕駛自小貨車後，再撞及中央紐澤西護欄，導致護欄倒在南下車道；孫姓民眾駕駛化學槽車往南下行駛，撞到事故倒下的護欄後翻覆，波及北上1輛自小貨車及1輛曳引車。請繼續往下閱讀...警方表示，孫姓駕駛臉部受傷送醫治療；經檢測肇事駕駛酒測值均為0。彰化縣消防局指出，另有2名傷者送醫，意識皆清楚。由於化學槽車翻覆造成槽內醋酸甲酯（也稱乙酸甲酯）外滲路面，彰化縣消防局和美分隊出動消防機器人出水稀釋現場濃度，並持續監控。交通部公路局中區養護工程分局表示，已於上午8時30分成立緊急應變小組，全力進行事故處理及現場排除作業，後續將針對肇事車輛釐清事故責任，並依法辦理相關求償事宜。中區分局表示，此次事故因占用台61線雙向全車道，為減少壅塞情形，建議南下車輛提前於龍井匝道駛離，改行台17線；北上車輛提前於伸港匝道駛離，改行台17線，預計下午3時搶通。彰化縣環保局告訴中央社記者，接獲通報後即派員前往現場，針對槽車翻覆洩漏，環境部應變隊也到場協助處置，易燃液體醋酸甲酯為非列管毒化物，環保局將針對污染路面情事，依廢棄物清理法予以告發，可罰新台幣1（編輯：李錫璋）1150417    ,https://news.ltn.com.tw/news/society/breakingnews/5406852
男朝普仁派出所投擲汽油彈 檢以公共危險罪嫌起訴,社會,2026/04/17 11:54,褚姓男子去年12月間朝中壢警分局普仁派出所投擲汽油彈，桃檢偵結以公共危險罪嫌起訴。（記者謝武雄攝）35歲褚姓男子去年12月29日凌晨1點20分左右，持裝有汽油的玻璃酒瓶點燃後，往桃園市政府警察局普仁派出所地下停車場入口投擲，所幸火勢微小，立刻被員警撲滅，警方調閱監視系統，循線於2小時內在褚男租屋處將其逮捕，桃園地檢署檢察官偵結認定褚男犯行明確，以公共危險罪嫌將他起訴。檢警調查指出，褚姓男子12月29日凌晨零點23分左右在新北市鶯歌區超商、加油站購買相關材料製造汽油彈後，隨後騎機車到普仁派出所，點燃汽油彈並往地下停車場入口投擲，旋即騎車逃逸，警方依監視器循線於當天清晨3點40分於褚男位於中壢區新中北路租屋處逮捕到案。    ,https://news.ltn.com.tw/news/society/breakingnews/5406898
音響店業者手機被偷 竊嫌還來電問：老闆的手機為什麼打不通,社會,2026/04/17 11:48,陳姓男子涉嫌偷竊音響店內的手機。（圖擷取自網路）陳姓男子16日下午4點多佯裝客人購物，進入桃園市楊梅區1處音響店後，趁業者不注意時，竊取業者放在一旁的手機，楊梅警分局獲報後鎖定陳男犯案，2小時多就逮到人，事後業者家人在社群網路發文指出，陳男偷走手機後，竟還打電話回來問說「老闆的手機為什麼打不通」。當天下午4點多，43歲陳男進到音響店後，趁業者不注意時，竊取手機得手隨即離去，業者發現手機遭竊，趕忙向警方報案；警方調閱監視器畫面鎖定陳男犯案，當晚6點多在新成路發現正準備找地方吃晚餐的陳男，立即逮人，還清查出他當天上午另偷竊1支手機，訊後依竊盜罪嫌究辦。請繼續往下閱讀...音響店業者的家人於發現手機遭竊後，將監視器畫面等發布上網，並指出「手機被偷了，我們學到的教訓就是手機不要亂放」，希望楊梅區的鄉親、店家一定要多加注意。陳姓男子偷竊手機被警方查獲送辦。（圖由警方提供）    ,https://news.ltn.com.tw/news/society/breakingnews/5406873
竊盜犯被保全發現後竟拿木棍打人 檢方以強盜罪嫌起訴,社會,2026/04/17 11:42,綽號阿鴻、阿墉男子開著偷來的小貨車到華映龍潭廠房行竊鋁板被保全發現，竟持木棍打傷保全後逃逸，檢方以竊盜、強盜罪嫌起訴。（記者謝武雄攝）45歲陳姓（綽號阿鴻）男子及52歲陳姓（綽號阿墉）男子，去年2月間在桃園市龜山區偷了1輛小貨車後，隔兩天開著贓車到龍潭區中華映管閒置廠房，爬牆進入偷竊5塊鋁板放在小貨車後，再次翻牆進入廠房偷竊時被保全發現，2人竟然持木棍攻擊保全致多處受傷，檢方偵結將他們以竊盜、強盜罪嫌起訴。檢警調查指出，阿鴻、阿墉去年2月7日下午7點30分左右，在龜山區茶專路偷竊某工程公司小貨車，9日上午10點多，由阿鴻駕車搭載阿墉前往華映龍潭廠，並趁廠房無人看管之際，翻牆進入廠房內竊取5片鋁板，兩人將鋁板放置在小貨車貨斗後，兩度翻牆進入廠房偷竊鋁板，柯姓保全發現後還阿墉壓制在地，阿鴻見狀竟持現場的木棍往柯的臉部戳擊，當場施以強暴，致柯姓保全的右手、嘴唇、牙齦與雙手挫擦傷等傷害難以抗拒，任由阿鴻、阿墉逃離。請繼續往下閱讀...檢方認為，阿鴻、阿墉偷竊小貨車屬於刑法竊盜罪，到華映偷竊過程對保全施暴，已違反刑法第329條「竊盜或搶奪，因防護贓物、脫免逮捕或湮滅罪證，而當場施以強暴脅迫者，以強盜論」，所以將他們以竊盜、強盜罪嫌起訴。    ,https://news.ltn.com.tw/news/society/breakingnews/5406857
任職11年女副理遭解雇怒提告 高院判美國運通公司賠550萬元,社會,2026/04/17 11:41,原在美國運通國際公司擔任副理、任職11年的于姓女子，於2022年3月16日被公司以業務調整為由，終止勞動契約，但整個部門卻僅有她「被離職」，她提起民事訴訟主張屬違法解僱。（示意圖）原在美國運通國際公司擔任副理、任職11年的于姓女子，於2022年3月16日被公司以業務調整為由，終止勞動契約，但整個部門卻僅有她「被離職」，她提起民事訴訟主張屬違法解僱，歷經一審敗訴後提起上訴，高等法院認定資方解僱理由不成立，須給付工資差額、年終獎金及退休金等相關費用約550萬元。于女主張，於2022年3月16日被公司通知解職，公司稱將她的職位裁撤，也沒提供她任何職缺、就職輔導、適任性評估，更說她不符資遣時其他職缺要求，若有意願就自行申請職缺。請繼續往下閱讀...于女控，公司後續於同年4月、7月、9月等有職缺釋出，卻未通知她、未評估適任性，沒安置義務，卻終止勞動契約違法，她認為僱傭關係仍存在，公司應按月給付薪資，按年給付加給工資及獎金，並按月提繳退休金。美國運通國際公司主張，于女無法達到職缺要求，也有告知上訴人若認可勝任職缺，可自行申請轉職。高院審理發現，公司雖主張因市場變化及組織精簡，但實際上業務仍持續運作，且相關職務並未真正消失，甚至仍有其他人員承接業務，難認有裁員必要。高院認為，雇主在終止勞動契約前，應善盡安置義務，但資方提供的職缺與原職務性質差異甚大，且未充分評估員工專長與能力，轉任安排流於形式，難認已盡合理安置責任；公司未提供完整培訓或合理過渡期間，要求員工接受並不合理，本案不符合「業務性質變更」解僱要件，屬違法終止勞動契約。在賠償部分，法院判決公司應給付員工自解僱日起至復職前的薪資損失，並補發年終獎金、績效獎金及退休金提撥差額，部分金額並須加計利息。于女受訪表示，2016年6月育嬰留停復職首日即遭公司要求資遣，經向北市勞動局檢舉才保住工作，但此後職權遭架空，原職務被分割，2016年至2022年間長期支援各單位，卻無升遷與加薪機會。于女感嘆，就算績效優異，每年為公司節省30%的預算、達成率超越100%，仍未獲公平評價，最終於2022年遭解職，一審期間歷經低潮，在律師支持下提起上訴，二審逆轉勝訴，雖法院認定僱傭關係仍存在，但她對回任仍有疑慮，憂心公司正準備裁減客服與風控部門，擔心再遭不當調動或變相裁員。于女最後強調，她始終熱愛美國運通這個品牌、這份工作曾帶來的成就感，「這場官司，我贏回了法律上的身分，但我更希望贏回的，是一個職場環境對勞動者最基本的尊重。」    ,https://news.ltn.com.tw/news/society/breakingnews/5406877
北車女子情緒不穩擾民 鐵警壓制送醫,社會,2026/04/17 11:33,余女在台北車站內情緒失控，被警方強制送醫。（記者劉慶侯翻攝）50歲余姓女子，今（17）日清晨6時44分，在台北車站北三門內不時來回逡巡，情緒躁動，並不時大聲咆哮騷擾過往旅客，造成民眾側目及驚慌。巡邏的鐵路警察獲報到場，經勸導無效，最終將失控的她壓制，送往北投三軍總醫院救治。鐵警局表示，余女是上午6時44分左右，出現在台北車站北三門內，但她不時來回跺步，明顯情緒極不穩定，且大聲咆哮，言語騷擾來來往往的旅客。請繼續往下閱讀...鐵警局巡邏員警接獲報案，先是包圍往余女，並多次勸阻，但余女情緒仍是躁動高亢，警方鑑於對方有危害公共安全之虞，於是進行壓制，再施以保護管束，隨後另通知衛生單位評估後，認為疑有精神方面疾病，於是將余女子送往北投三軍總醫院救治。余女在台北車站內情緒失控，被警方強制送醫。（記者劉慶侯翻攝）    ,https://news.ltn.com.tw/news/society/breakingnews/5406859
