Title,News_Type,date,content,url
苗栗醉男2個月打33次119 被收費6400元,社會,2025/09/15 14:19,酒後打119叫救護車，苗栗1男子2個月Call33次。示意圖。（資料照）〔記者蔡政珉／苗栗報導〕不少基層消防弟兄之前反映，部分不當使用者因為喝醉酒或是罹患小毛病，就致電消防分隊，要求救護車出勤載送到醫院，造成救護資源浪費，苗縣府消防局考量後訂定「苗栗縣消防救護車收費執行要點」，自2017年1月1日起實施。苗栗縣造橋鄉一名張姓男子，今年7月2日至9月3日約2個月間致電119共33次，因符合收費要點，縣府消防局也向他收費6400元，張男也成為今年唯一一名被收費縣民。苗縣府消防局指出，依據「苗栗縣消防救護車收費執行要點」，收費對象為經常性飲酒（1週累計3次或1個月8次以上）且經責任醫院急診檢傷分類為第四級或第五級者；到院後未經急診人員診治即離去者；有事實足資證明浪費緊急救護資源者。張男多為酒後撥打119，故符合要點。請繼續往下閱讀...苗縣府消防局表示，今年僅有張男一人因達到收費執行要點需繳費，由於苗栗縣幅員遼闊，救護人力需使用在刀口上，雖常接到張男電話，為避免發生狀況消防弟兄仍出勤，結果張男常常到急診室接受簡單治療，連醫院急診室也頭痛。由於救護車出動必須配備救護人員，基本費即為救護車出動需要600元，加上規定需配備2名消防員各收費500元，張男今年共需繳納4次費用共6400元。熱門賽事、球星動態不漏接    ,https://news.ltn.com.tw/news/society/breakingnews/5178669
高雄男嬰遭經營娃娃機狠父凌虐 1年多後最新狀況曝,社會,2025/09/15 14:19,經營娃娃機的蔡姓男子，涉嫌凌虐2個月大兒子，被高雄高分院判刑。（資料照）〔記者洪定宏／高雄報導〕高市經營娃娃機的蔡姓男子，2024年11月起涉嫌凌虐當時僅約2個月大的兒子，2025年2月被發現法辦，高等法院高雄分院依妨害幼童發育罪，判處徒刑2年半，他上訴被駁回，可再上訴最高法院。社會局表示，目前被害嬰兒約1歲，傷勢逐漸復原，醫療評估無須回診，身心發展已符合常態模式，現在由寄養家庭照顧，蔡男仍收押中，母親雖因照顧疏失被判刑，但尚未執行，可在社會局專人陪同下探視。請繼續往下閱讀...警方調查，2024年11月間，蔡男未對男嬰按時餵奶，讓他長期飢餓，造成營養不良、成長明顯遲滯；今年1月底至2月初，蔡男不滿兒子哭鬧，涉嫌徒手毆打胸口，造成左胸骨折。此外，蔡男將兒子放在高約50公分、四周卻未設圍欄床鋪邊緣的睡覺，導致男嬰墜落地面，造成頭部出血、骨折等傷勢。熱門賽事、球星動態不漏接    ,https://news.ltn.com.tw/news/society/breakingnews/5178668
新竹兩女居處製「喪屍煙彈」又藏毒 累犯各判9年4月、7年8月,社會,2025/09/15 14:15,詹姓、吳姓女子在居住處製造依托咪酯煙彈等一批，還藏放安非他命、海洛因數包準備販售牟利，新竹地方法院依毒品危害防制條例分別重判9年4月、7年8月有期徒刑。（記者廖雪茹攝）〔記者廖雪茹／新竹報導〕詹姓、吳姓女子在新竹市居住處，用原料製作依托咪酯煙彈（喪屍煙彈）、電子煙等一批，警方獲報蒐證後執行搜索，除了查扣毒品、煙彈、燒杯等容器與分裝袋，還在屋內和車上起獲安非他命、海洛因數包，準備販售牟利，現場宛如製毒實驗室；新竹地方法院審理後，依毒品危害防制條例重判毒品累犯的吳女9年4月，詹女7年8月有期徒刑。判決書指出，詹女、吳女自今年2月起在新竹市居住處，把依托咪酯原物料粉、丙二醇、丙三醇（甘油）等原料，加入燒杯等容器後，加熱並置入煙彈，製造依托咪酯油、依托咪酯煙彈1批，伺機販售予不特定人。同年3月13、14日間，她們又各自向桃園市綽號「阿邦」購得甲基安非他命7包，吳女購得托咪酯煙彈10袋、海洛因7包，放置詹女的車上。請繼續往下閱讀...警方在3月15日9點多持新竹地院搜索票，至詹女居處執行搜索，當場在詹女、吳女住處與車輛內查獲安非他命、海洛因、依托咪酯油與電子煙彈，並扣得分裝袋、燒杯等器具。送驗後以氣相層析質譜儀檢驗，均檢出毒品相關成分，製毒證據明確。案經新竹地方檢察署檢察官指揮新竹縣竹東警分局偵查起訴。法官審酌，詹女、吳女無視政府對杜絕毒品犯罪禁令，竟共同製造第二級毒品，並為貪圖不法利益，而分別意圖販賣而持有第一級、第二級毒品，助長毒品氾濫，戕害他人身心健康，並危害社會治安。尤其，詹女甫因2024年10月間製造依托咪酯煙彈，被判處3年8月徒刑，竟又再為此案製毒，顯然未從前案偵審程序有所警惕。詹女有多次毒品等前案素行，而吳女則有違反洗錢防制法、毒品、重利等，綜合判斷而分別裁定前述量刑。熱門賽事、球星動態不漏接    ,https://news.ltn.com.tw/news/society/breakingnews/5178658
象山步道晨運民眾聞惡臭報警 發現失聯8旬翁遺體,社會,2025/09/15 14:01,北市象山步道發生命案，警方圍起封鎖線。（記者姚岳宏翻攝）〔記者姚岳宏／台北報導〕今天清晨6時許，有晨運民眾行經台北市象山步道一線天山洞時，聞到現場傳出腐臭味，隨即打電話報案，警消獲報後趕抵現場，找到遺體後發現已死亡多日，警方查出，死者是82歲李姓老翁，初判無傷勢及外力介入，目前正聯絡家屬釐清死因。據了解，李姓老翁長期病痛纏身，本月初曾跟家人表示要去靈修，約略交代一些事情後即失去聯絡，家屬擔心報警，警方根據基地台位置，本月6日及7日曾在象山一帶尋人，但無所獲。請繼續往下閱讀...據了解，警消今天接獲民眾報案，從信義路五段150巷上去步行約15分鐘路程，在象山步道往一線天方向的岩壁中間找到老翁遺體，鑑識人員到場初判無傷勢及外力介入，目前還在調閱監視器，釐清老翁於山內活動情形。熱門賽事、球星動態不漏接    ,https://news.ltn.com.tw/news/society/breakingnews/5178654
兒偷拿母親土地權狀設定抵押借款 判刑4年6月,社會,2025/09/15 13:51,基隆地院近日審結，認定陳男觸犯偽造文書、偽造有價證券等罪，判處有期徒刑4年6月。（記者吳昇儒攝）〔記者吳昇儒／基隆報導〕這款兒子！基隆一名陳姓男子為了借錢，竟於2018年間在母親不知情的情況下，拿媽媽的土地權狀給王姓債主設定，讓她擔任連帶保證人，甚至偽造母親簽名，簽下本票。事後，陳男因付不出借款，土地被拍賣，陳母方知此事，大義滅親對兒子提告。基隆地院近日審結，認定陳男觸犯偽造文書、偽造有價證券等罪，判處有期徒刑4年6月。檢警調查，陳男2018年間，未經授權就取得母親的身分證及土地權狀，還盜取母親印章，簽下借款契約書後，在連帶保證人處，蓋上母親的印章。請繼續往下閱讀...同年6月26日持委任書及陳母印章到戶政事務所申請核發印鑑證明申請書，再將土地權狀及印鑑證明書交付給王姓債主，讓對方設定土地，擔保債權總金額1千萬元。王姓債主再陸續交付陳男649萬9970元萬元。隔年，陳男再偽造母親身分，開出1500萬元本票，交付給王姓債主，並佯裝陳母為連帶保證人。事後，因陳男無力還款，王姓債主持還款協議書及本票，向基隆地方法院聲請支付命令獲准；債主再向法院聲請拍賣陳母土地，而陳母接到法院通知後，方知土地將被拍賣，初步調查後，決定對兒子提出告訴。法官審理時，陳男坦承有拿母親的土地權狀、身分證及印章向王姓債主借款，但已經獲得母親諒解。法官認為，陳男雖獲得母親諒解，但並未賠償王姓債主損失，且其行為觸犯偽造文書罪中的行使偽造私文書罪及偽造有價證券等罪，分別判處有期徒刑1、4年，應併執行4年6月，不法所得649萬9970元沒收。熱門賽事、球星動態不漏接    ,https://news.ltn.com.tw/news/society/breakingnews/5178642
苗栗離譜爸媽騎機車「4貼」 網友酸：從小培養危險駕駛,社會,2025/09/15 13:28,1對夫妻騎機車「四貼」，其中小孩還站立，過程被後車PO網。（翻攝自WoWtchout - 地圖型行車影像分享平台 YT）〔記者張勳騰／苗栗報導〕苗栗市1對父母，日前騎電動機車共乘載2個年幼孩子「4貼」外出，其中一個幼童還站立在父母之間的機車坐墊上，沿途險象環生，過程被後車拍下PO網；苗栗警分局今（15）日執行網路巡邏，發現有民眾於網路社群PO文：「騎車四貼，小孩站立，從小開始培養危險駕駛」，警方指出，將依法開罰。從民眾PO網影片發現，該機車從國立苗栗高中前路段呼嘯而過，就看到家長前方站一個小孩，坐墊上又讓另一位小孩站立，連停紅綠燈也沒讓小孩坐下的意思，一路上搖搖晃晃，十分危險。請繼續往下閱讀...這對夫妻危險駕車的影像被後方車主拍下PO網，網友紛紛留言說：「騎車四貼，小孩站立，從小開始培養危險駕駛」、「這是在職前訓練，小小年紀多了一項技能，不錯不錯！」、「應該不是親生的」。苗栗警分局表示，經警方檢視影像後，發現影像內普通重機車行駛於道路乘載超過2人，依據道路交通安全規則第88條規定：「機車附載人員，小型輕型機車不得附載人員，重型及普通輕型機車在駕駛人後設有固定座位者，得附載一人。」該車乘載人數明顯已違反法規規定得附載一人之要件。苗栗警分局指出，依道路交通管理處罰條例第31條第5項規定，「機車附載人員或物品未依規定者，處駕駛人300以上600元以下罰鍰。」籲請民眾駕駛車輛務必遵守相關交通規則，以維護自身及他人交通安全。熱門賽事、球星動態不漏接    ,https://news.ltn.com.tw/news/society/breakingnews/5178608
外籍竊盜集團鎖定九份老街 專挑日、韓遊客下手,社會,2025/09/15 13:20,外籍竊盜集團鎖定日、韓遊客喜愛的九份老街，下手行竊。（記者吳昇儒翻攝）〔記者吳昇儒／新北報導〕九份老街深受日、韓遊客喜愛，卻也成了外籍竊盜集團下手的目標。新北市瑞芳警分局統計，今年1月至9月間，九份老街共發生6起竊盜案件，其中日籍遊客佔了5件，另1件則是他國遊客，而下手的竊賊經追查均為外籍竊盜集團犯案。新北市瑞芳警分局指出，為了保護外籍遊客安全，尤其是九份地區日、韓等國遊客比例較高，特別準備中、英、日、韓多國語言警示標語與防竊宣導，但仍有偶發性竊案發生。請繼續往下閱讀...經統計發現，該區域的竊嫌都是集團式犯案，3、4個人1組，分為把風、警戒及動手的3個部分，且得手之後，還會改往國內各大商圈、熱門景點繼續犯案，等警方查獲時，通常已經出境，查緝不易。此次特別針對曾經來台犯案的竊嫌進行篩選，果然揪出菲律賓籍的竊盜集團。熱門賽事、球星動態不漏接    ,https://news.ltn.com.tw/news/society/breakingnews/5178586
女子大年初一酒駕釀國道連環撞2死9傷 獲判緩刑,社會,2025/09/15 13:17,女子大年初一酒駕致國道連環撞釀2死9傷，獲判緩刑。圖為當時現場畫面。（民眾提供）〔記者蔡政珉／苗栗報導〕48歲陳姓女子2023年除夕當晚在台中市家人住家喝完2罐調酒後，於大年初一凌晨開車載著當時16歲兒子上國道，欲北上返回桃園市。不過，陳女開車行經國道1號北向127.2公里處內側車道時，因酒駕失控自撞護欄後，釀起連環撞導致2死9傷，死者包括客運駕駛楊男、貨車乘客許女。苗栗地院法官日前審理，認為陳女心存僥倖導致酒駕失控自撞，應對2名死者結果負責；但考量陳女自首且與死者楊男、許女家屬達成和解各賠償180萬、200萬，死者家屬願意寬恕，法官依不能安全駕駛致死罪判處陳女有期徒刑2年，緩刑5年，緩刑期間付保護管束，並向指定之政府機關、政府機構、行政法人、社區或其他符合公益目的之機構或團體，提供180小時之義務勞務，及接受法治教育5場次。請繼續往下閱讀...事發當時，陳女車輛有酒駕失控自撞護欄後打橫停擺在外側路肩及外側車道，導致後方蔡男駕駛的貨車、楊男駕駛的客運車及另3輛車撞上，蔡男駕駛的貨車與楊男駕駛客運車當場起火燃燒，楊男與蔡男車上乘客許女均因火燒車全身嚴重燒傷碳化、熱休克不治死亡，陳女酒測值達0.34mg/l。熱門賽事、球星動態不漏接    ,https://news.ltn.com.tw/news/society/breakingnews/5178581
家庭主婦投資虛擬貨幣被騙380萬 外籍車手取款遭逮,社會,2025/09/15 13:06,警方逮捕馬來西亞籍車手。（記者陸運鋒翻攝）〔記者陸運鋒／新北報導〕新北市楊姓女子落入投資虛擬貨幣詐騙陷阱，短短2個多月投入380萬元現金，直到無法出金才驚覺受騙上當，中和分局警方獲報後，將詐騙集團成員誘出面交，逮捕馬來西亞籍卓姓車手，發現他是在友人介紹之下，以觀光名義來台當取款車手，詢後移送偵辦。中和警分局調查，55歲楊女為家庭主婦，她於7月底看見臉書投資廣告，點擊後加入不明LINE帳號，對方以「穩賺不賠」、「高獲利」等話術洗腦，慫恿楊女投資泰達幣，楊女深信不疑，2個多月來與詐團成員面交5次共380萬元，直到楊女要出金時，還誆稱帳號涉及洗錢需繳交保證金，令楊女驚覺受騙。請繼續往下閱讀...據查，警方獲報後檢視楊女手機，發現她仍與詐騙集團成員有聯繫，於是將計就計，在前天（15日）下午約出對方，隨後在中和區德光路面交地點埋伏，一見到馬來西亞籍53歲卓男收款後，隨即上前壓制逮人，並查扣手機2支及面交款項100萬元等證物。警詢時，卓嫌稱是因友人介紹打工機會之下，8月底才以觀光名義入境來台，對於是詐騙行為豪不知情，警方詢後，將其依詐欺及洗錢防制法等罪嫌移送新北地檢署偵辦。熱門賽事、球星動態不漏接    ,https://news.ltn.com.tw/news/society/breakingnews/5178573
台中西屯女子墜樓喪命 檢警今相驗釐清,社會,2025/09/15 12:52,台中市西屯區福林路，昨晚傳出有女子墜樓喪命，初步排出外力介入。（記者陳建志攝）〔記者陳建志／台中報導〕台中西屯區福林路昨晚傳出女子墜樓，救護人員獲報到場後，發現44歲的劉姓女子已經明顯死亡，警方到場後，經調閱監視器及勘查現場跡證，未有外力介入，詳細死因已報請台中地檢署檢察官今天相驗釐清。台中市消防局昨晚8點29分接獲民眾報案，指稱西屯區福林路疑似有民眾墜樓，立刻派遣協和分隊出動救護車到場救護。救護人員抵達，發現44歲的劉姓女子墜樓、已明顯死亡，現場交由家屬及員警處理。請繼續往下閱讀...員警獲報到場，發現劉女已沒有生命跡象，經調閱監視器及勘查現場跡證，未發現有外力介入，詳細死因今天已報請台中地檢署檢察官相驗；警方呼籲，民眾應注意自身或家人身心狀況，並適時求助相關機構協助。熱門賽事、球星動態不漏接    ,https://news.ltn.com.tw/news/society/breakingnews/5178561
黑幫分子K完歌被噴1句竟掏刀奪命 判無期定讞,社會,2025/09/15 12:52,〔記者張文川／台北報導〕桃園市竹聯幫信堂成員陳瑋，前年11月間與朋友到中壢區一家KTV歡唱，離開前在大門口與謝姓、余姓男子等人起衝突鬥毆，陳瑋持彈簧刀刺傷謝男頭部、背部，余男見狀將陳瑋推倒在地，陳男起身持刀猛刺余男左腹、左胸，刺穿心臟，致余男當場死亡。桃園地院國民法庭將陳男判處無期徒刑；高等法院、最高法院皆維持原判，全案定讞。判決指出，28歲陳瑋與被害人余男、謝男互不相識，2023年11月19日清晨6時10分，陳瑋正欲離開KTV，在門口自認為被謝男以「衝三小（台語）」挑釁，怒毆謝男頭部，謝男出拳反擊，陳瑋取出彈簧刀劃傷謝男謝臉部、右側後胸。請繼續往下閱讀...余男見狀上前阻止推倒陳，陳起身持刀猛刺余男左側下腹、左側胸部，其中一刀刺穿余男心臟，致其胸腔內大量出血近2公升，當場失血過多死亡。陳瑋丟掉彈簧刀，拾起散落包包、拖鞋，從容搭車離開。一審桃院國民法官法庭審理後認為，陳瑋行兇時並未因酒醉致辨識能力降低；且他因販毒罪被判刑5年2月，服刑後獲假釋期間又犯此件殺人案。國民法庭認為陳男僅因一句不確定的挑釁言語，恣意持刀殺人，無視他人生命，天理難容，犯後否認殺人犯意、未達成和解，依殺人罪判處無期徒刑，褫奪公權終身。二、三審皆維持無期徒刑定讞。熱門賽事、球星動態不漏接    ,https://news.ltn.com.tw/news/society/breakingnews/5178552
台中西屯公墓突竄火光 警消合力滅火無人傷,社會,2025/09/15 12:17,台中西屯公墓今早發生雜草火警，消防人員獲報迅速到場撲滅火勢。（記者陳建志翻攝）〔記者陳建志／台中報導〕台中市西屯區七福寶塔公墓今天上午10點多突然傳出雜草火警，台中市消防局和第六分局協和派出所員警獲報都趕緊到場，發現大片雜草不明原因燃燒，火勢一度猛烈嚇壞附近民眾，所幸在消防人員全力灌救下迅速撲滅，並未傳出人員傷亡，詳細起火原因需進一步調查釐清。這起公墓火警發生在今天上午10點26分左右，第六分局協和派出所員警接獲通報，指稱西屯區七福寶塔公墓區傳出濃煙，員警迅速趕抵後，發現公墓內大片雜草因不明原因起火燃燒。請繼續往下閱讀...台中市消防局獲報，也立刻出動2車8人到場滅火，員警則在場協助拉起封鎖線、疏導交通，避免民眾圍觀造成危險，所幸火勢在警消人員全力灌救下迅速撲滅，無人員傷亡，詳細起火原因需由火調人員鑑識後釐清。警方也提醒，民眾掃墓或路過墓園時，務必注意火源，不可隨意丟棄菸蒂或燃燒紙錢，以免小火釀成大禍。熱門賽事、球星動態不漏接    ,https://news.ltn.com.tw/news/society/breakingnews/5178505
外籍詐欺車手、非法打工、陪侍通通查！ 中壢警大掃蕩查獲53人,社會,2025/09/15 12:13,中壢警方於中壢火車站週邊及中平商圈實施臨檢查察外籍人士涉案行動，共查獲53人帶回究辦。（記者李容萍翻攝）〔記者李容萍／桃園報導〕桃園市中壢區外籍人士涉及治安案件增加，中壢警分局執行雷霆除暴專案勤務，近日針對轄區特種營業場所及外來人口治安顧慮場所臨檢，先後查獲逾期居留移工及外籍詐欺車手、外籍非法打工女子53人，經統計今年以來共逮捕外籍詐欺車手達27人，其中馬來西亞籍10名、越南籍9名、泰國籍5名、香港籍3名，顯示外籍人士來台被詐欺集團網羅已成為治安隱患。中壢警分局副分局長高海源今（15）日表示，中壢警方本週聯合移民署桃園專勤隊、警察局外事科、刑事警察大隊等，針對外籍人士非法活動執行全面打擊，於10日晚間針對轄內外籍人士常聚集的特種營業場所同步實施臨檢，展開反毒、反詐宣導，更在中壢區3處小吃店查獲泰籍女子22人及越籍女子2人共24人非法打工，其中7名女子逾期居留，依違反「入出國及移民法」移請桃園專勤隊辦理，5名雇主違反「就業服務法」將函請市府勞動局裁罰。請繼續往下閱讀...中壢警分局昨（14）日晚間再集結警力33名，於中壢火車站周邊及中平商圈採取區域封鎖實施路檢盤查，並針對移工消費場所進行臨檢掃蕩，再查獲印尼籍失聯移工及越南籍逾期居留各1女，訊後移請桃園專勤隊辦理收容遣返事宜，展現警方全力遏止外來人口非法活動的決心。中壢警分局長林鼎泰提到，隨著中壢轄區外籍人士、移工人數成長，涉及治安事件頻傳，警方近日連續二波以中壢火車站周邊針對外籍人士執行雷霆除暴、外來人口治安顧慮場所臨檢查察專案勤務，動員大批警力針對特種營業場所、外來人口聚集處封鎖及路檢臨檢行動，尤其是外籍人士淪為詐欺集團車手犯罪值得重視，警方依法從嚴究辦執法絕不姑息，同時呼籲外來人士應遵守我國法令，切勿以身試法，警方必將依法從嚴究辦。中壢警方於中壢火車站週邊及中平商圈實施臨檢查察外籍人士涉案行動，共查獲53人帶回究辦。（記者李容萍翻攝）中壢警方於中壢火車站週邊及中平商圈實施臨檢查察外籍人士涉案行動，共查獲53人帶回究辦。（記者李容萍翻攝）中壢警方於中壢火車站週邊及中平商圈實施臨檢查察外籍人士涉案行動，共查獲53人帶回究辦。（記者李容萍翻攝）熱門賽事、球星動態不漏接    ,https://news.ltn.com.tw/news/society/breakingnews/5178502
開司馬限林道撞死自行車參賽選手 肇事駕駛函送法辦,社會,2025/09/15 12:13,休旅車開往雪見，在司馬限林道上撞上休憩自行車友釀1死。（民眾提供）〔記者蔡政珉／苗栗報導〕22歲吳姓男子13日下午3點多駕駛休旅車，由司馬限林道前往雪霸國家公園雪見遊憩區時，在司馬限林道約23.5公里處撞上一名正在路旁休息的自行車騎士，導致正跨坐在自行車上休息的48歲陳姓男子往後跌倒著地受傷，陳男送醫後傷重不治，目前大湖警方依過失致死罪函送吳男。據了解，陳男當時參加「2025台灣登山大滿貫自行車挑戰賽活動」，為參賽選手之一，不料休息途中遭遇憾事。請繼續往下閱讀...大湖警方今天表示，事發當時吳男因與其他車輛會車，視線注意左側，沒發現右方的自行車友陳男正跨坐在自行車上休息，結果休旅車撞到自行車後，陳男因此順勢倒地撞擊台階，造成陳男胸口、腳部有多處擦挫傷，警方與消防人員獲報後將陳男先送往泰安鄉象鼻衛生所初步治療，後續送往東勢農民醫院搶救，經搶救後仍宣告不治。大湖警方指出，相驗後發現陳男因創傷性休克併呼吸衰竭胸腹部擦挫傷、肋骨、胸骨骨折及血胸；肇事吳男並無酒駕，全案函送檢方偵辦。休旅車開往雪見，在司馬限林道上撞上休憩自行車友釀1死。（民眾提供）休旅車開往雪見，在司馬限林道上撞上休憩自行車友釀1死。（民眾提供）熱門賽事、球星動態不漏接    ,https://news.ltn.com.tw/news/society/breakingnews/5178496
亂丟垃圾、說停就停......恐怖無照駕駛！台中東勢民眾皮皮剉,社會,2025/09/15 12:07,民眾在臉書Po文提醒大家注意瘋狂駕駛。（擷取自臉書）〔記者歐素美／台中報導〕台中市東勢區有一輛轎車被檢舉無照駕駛，還沿路亂丟垃圾，不打方向燈，說停就停，危及其他用路人安全，民眾還在網路PO文提醒大家注意；東勢警分局今天表示，去年至今已針對63歲駕駛劉姓男子開出21張罰單。民眾在臉書社群「東勢大小事-大台中地區」PO文提醒民眾要小心一輛轎車，無照駕駛，整天在東勢街上晃，不打方向燈，說停就停，撞到還威脅人，車上垃圾沿路飛，並質疑「東勢分局警察，這樣還不捉嗎」？請繼續往下閱讀...東勢分局表示，自去年起，該車因交通違規遭民眾檢舉或員警攔查取締，累計已遭舉發21件，包含未依規定使用方向燈16件、貨物掉落2件、未依標線行駛1件、違規停車1件、無照駕駛1件，因為警方攔查只有一次，所以無照駕駛才只有1件。警方呼籲用路人應遵守交通安全規則，如有違反道路交通管理處罰條例，警方將依據民眾檢舉或勤務發現依法舉發，絕不寬貸，以維護道路交通秩序與確保用路人安全。熱門賽事、球星動態不漏接    ,https://news.ltn.com.tw/news/society/breakingnews/5178491
