Title,News_Type,date,content,url
美國情報指普廷企圖收復前蘇聯領土 克里姆林宮否認,國際,2025/12/22 18:47,美國情報指出，俄羅斯總統普廷（右）意圖佔領烏克蘭全境及部分前蘇聯加盟國，克里姆林宮發言人佩斯科夫（左）矢口否認。（歐新社）《路透》近期引述美國情報機構說法指出，俄羅斯總統普廷（Vladimir Putin）的野心不僅止於烏東四州，而是想要「收復」烏克蘭及部分前蘇聯加盟國，恢復過往蘇聯的疆域。克里姆林宮今（22）日對此回應稱，美國情報機構說法不實，「絕對不是真的」。《路透》上週引述6名不具名消息人士說法指出，美國情報的報告持續警告普廷並未改變他的野心，他的目標就是攻佔烏克蘭全境，收復原本屬於蘇聯的歐洲部分地區。請繼續往下閱讀...《路透》報導，克里姆林宮發言人佩斯科夫（Dmitry Peskov）今日對媒體表示，俄國不清楚《路透》消息來源的可信程度，但如果報導內容屬實，那美國情報機構的說法就是錯的。佩斯科夫強調：「這絕對不是真的。」普廷未曾公開宣稱他想征服整個烏克蘭，但他已多次表示，如果烏克蘭政府不同意割讓烏克蘭東部的頓巴斯地區（Donbas），那俄軍就會奪佔更多烏克蘭領土。普廷也說，他不尋求重建蘇聯，也不會攻擊北約成員國。他本月指出，俄羅斯不想與歐洲發生戰爭，但如果歐洲國家挑起戰爭，俄羅斯將會取得勝利。    ,https://news.ltn.com.tw/news/world/breakingnews/5286417
曾支持川普併吞主張 路易斯安那州長獲任命格陵蘭特使,國際,2025/12/22 18:30,川普任命路易斯安那州州長蘭德瑞為格陵蘭特使。（美聯社）美國總統川普對丹麥自治領地格陵蘭的覬覦，使得華府對努克（Nuuk，格陵蘭首府）的一言一行備受全球關注。川普21日在社群媒體宣布新人事，任命路易斯安那州州長蘭德瑞（Jeff Landry）出任格陵蘭特使，他曾公開對川普併入格陵蘭的主張表達支持。川普在真實社群寫道，「傑夫明白格陵蘭對我國國家安全的重要性，他將為我國盟友乃至全世界的安全、維安和生存強力推展美國利益。」請繼續往下閱讀...蘭德瑞對於接下特使一職感到榮幸，強調此任命不會對州長職務產生任何影響。蘭德瑞曾在1月於社群媒體表示，「川普總統完全正確。我們需要確保格陵蘭加入美國。對他們和我們都是好事，讓我們把這件事情搞定！」格陵蘭不但有豐富天然資源，其地理位置在美國、中國和俄羅斯的北極海競爭背景下極具戰略價值。川普先前表示，美國需要格陵蘭是出於「國際安全」，有許多美方重視的成員在該地區海岸航行，「我們得謹慎小心」。    ,https://news.ltn.com.tw/news/world/breakingnews/5286360
泰柬邊境激戰50萬人逃難！24日恢復談判 泰外長：上次協議太倉促,國際,2025/12/22 17:49,泰國外長希哈薩（Sihasak Phuangketkeow）22日在馬來西亞吉隆坡出席東協外長特別會議。他在會後宣布將與柬埔寨恢復停火談判，並直言先前的協議因配合川普出席的國際峰會時程而「過於倉促」，導致缺乏執行細節。（歐新社）泰國與柬埔寨邊境爆發嚴重流血衝突，導致逾50萬人流離失所。在局勢惡化之際，泰國外長希哈薩（Sihasak Phuangketkeow）22日宣布，兩國將於本週三（24日）恢復談判，試圖達成更持久的停火協議。西哈薩指出，雙方10月份簽署的協議之所以未能維持，是因為當時為了趕上美國總統川普出席的峰會時程而「倉促行事」，導致協議內容缺乏確保停火的關鍵細節。據《美聯社》報導，希哈薩在馬來西亞吉隆坡出席東協（ASEAN）外長會議後表示，泰柬雙方的「一般邊界委員會」將於週三會面，商討具體的停火措施。他強調，這一次的重點在於「敲定細節」，確保停火協議能反映地面實況且真正有效，而非僅是為了國際壓力而做出的公開宣示。請繼續往下閱讀...針對上次協議的失敗，希哈薩解釋，當時的協議是為了確保能由川普見證而倉促達成，因此缺乏足夠的執行機制。雖然柬埔寨近期公開宣稱願無條件停火，但曼谷方面認為這只是試圖將問題國際化的手段，並未收到實質提案。這場邊境衝突於12月8日急遽升溫，起因於一場造成兩名泰國士兵受傷的小規模衝突。隨後戰火迅速擴大，泰國空軍出動F-16戰機對柬埔寨境內目標實施空襲；柬埔寨軍隊則發射數千枚BM-21中程火箭彈進行反擊。官方數據顯示，過去一週的激戰已造成雙方邊境超過30人死亡，更導致超過50萬名平民被迫流離失所。美國國務院21日發布聲明，呼籲雙方結束敵對行動、撤出重型武器並清除地雷。除了重啟談判，地雷問題也成為雙方爭執焦點。泰國海軍21日證實，一名海軍陸戰隊員在前線誤觸地雷重傷。泰軍指控柬方蓄意埋設新雷；柬埔寨則堅稱是內戰遺留物。泰國外交部表示，東協觀察團已確認發現新埋設的地雷，將向柬埔寨及相關國際組織提出抗議。    ,https://news.ltn.com.tw/news/world/breakingnews/5286342
6連勝今破功！日H3火箭發射失敗 衝擊「日版GPS」布局,國際,2025/12/22 17:28,日本宇宙航空研究開發機構（JAXA）22日於種子島太空中心發射H3火箭8號機，搭載「引路5號」導航衛星升空。雖然火箭順利離地，但後續因第二節引擎發生異常，未能將衛星送入預定軌道，任務宣告失敗。（美聯社）日本太空計畫遭遇重大挫折！日本宇宙航空研究開發機構（JAXA）證實，22日發射的新一代主力運載火箭H3，因飛行過程中出現異常，未能將搭載的「引路5號」（Michibiki 5）導航衛星送入預定軌道。這是H3火箭繼2023年首飛失敗後，第二次遭遇發射失敗，不僅中斷了近期的成功紀錄，也為日本建構獨立衛星定位系統時程投下變數。據《美聯社》報導，這枚H3火箭週一從日本西南部鹿兒島縣的種子島太空中心升空，原本肩負著擴充日本「準天頂衛星系統」（QZSS）的關鍵任務。然而，JAXA發射指揮官岡田匡史在記者會上坦承，火箭的第二節引擎發生「意外的過早熄火」（premature cutoff），導致無法確認衛星是否已順利與火箭分離。請繼續往下閱讀...岡田匡史表示，目前尚不清楚衛星是被釋放到錯誤的太空軌道，還是已經墜毀，JAXA正在全力分析數據以釐清事故原因。就在這次發射的5天前，該枚火箭才因發射台噴水系統異常，在倒數最後17秒緊急中止發射程序。針對此次失敗，日本文部科學省官員近藤淳（譯音）向媒體表示「極度遺憾」，政府已立即成立專案小組徹查原因，並將採取必要措施以盡速「挽回信譽」。H3火箭是用來取代服役多年、可靠度極高的H-2A火箭，雖然在2023年3月的首飛中因第二節引擎點火失敗而自毀，但隨後連續6次發射均取得成功，原本被寄予厚望能以更低成本在國際太空運輸市場競爭。此次失敗對日本的國家安全與太空戰略造成雙重打擊。日本目前依賴名為「準天頂衛星系統」（QZSS）的區域導航系統，該系統自2018年啟用，現有5顆衛星運作中。「引路5號」原定成為該網絡的第六顆衛星，目標是在2026年3月前建構由7顆衛星組成的體系，最終在2030年代後期達到11顆，以實現不依賴美國GPS系統的獨立定位能力，這對智慧型手機定位、海上航行乃至無人機操作都至關重要。JAXA的H3專案經理有田誠強調，雖然H3仍處於營運初期階段，但仍具備全球競爭力，「我們將重整旗鼓，全面調查原因讓H3重回正軌，以免落後於競爭對手。」    ,https://news.ltn.com.tw/news/world/breakingnews/5286324
哥倫比亞18名士兵遭綁架 防長強烈譴責,國際,2025/12/22 17:20,哥倫比亞國防部長桑傑士表示，18名士兵在執行打擊哥倫比亞民族解放軍遊擊隊的行動時遭到綁架。（路透）哥倫比亞國防部長桑傑士（Pedro Sanchez）21日表示，18名士兵在執行打擊哥倫比亞民族解放軍（ELN）遊擊隊的行動時遭到綁架。根據《法新社》報導，桑傑士21日在X上指出，18名士兵被200人包圍，並被強行轉移到位於該國喬科省（Choco）的1個原住民保留地。桑傑士僅提到200人，未說其具體身分。請繼續往下閱讀...桑傑士譴責綁架士兵的行為，稱限制軍事行動將使當地社區面臨「嚴重風險」。他強調軍事行動旨在保護平民，特別是原住民社區，免受諸如招募未成年人、強迫流離失所和其他暴力行為等威脅。桑切斯說，他已要求內政部、喬科省政府和人權組織協助確保士兵安全返回。他補充，和平不是通過綁架士兵或削弱國家來實現的。哥倫比亞喬科省省長科爾多瓦（Nubia Cordoba）表示，在18名執行公務的士兵被拘留後，她召開了一次特別安全委員會會議，尋求釋放他們。哥倫比亞民族解放軍成立於1964年，是美洲現存歷史最悠久的遊擊隊組織。    ,https://news.ltn.com.tw/news/world/breakingnews/5286341
自由說新聞》不單純！北京超慘車禍畫面流出！中共「強制靜音」慘遭民怨洗臉,國際,2025/12/22 17:18,全新的視界！新聞話題不漏接，快訂閱YouTube 【自由追新聞】，記得開啟小鈴鐺哦！    ,https://news.ltn.com.tw/news/world/breakingnews/5286330
日中關係續緊張  未來2週中日46條航線班機清零,國際,2025/12/22 17:00,中國媒體報導，未來2週內有多達46條中日航線班機全數取，其中以飛往大阪的航班居多數。圖為關西大阪。（美聯社檔案照）日中關係緊張未解下，中國媒體報導，未來2週內有多達46條中日航線班機全數取消。而明年1月從中國往返日本的班機已有2195班次被取消，取消率逾4成。但經比對，上述班機歸零的航線多數是飛往大阪、名古屋，只有4條航線是飛往東京。澎湃新聞報導，根據最新統計數據，自今年12月23日至2026年1月5日這2週內，有46條中日航線班機全部取消，呈現「零航班」狀態，而這46條航線涉及中日兩國共38座機場。請繼續往下閱讀...報導提到，2026年1月，中國往返日本的班機取消量已達2195班次，整體取消率有40.4%。經過比對，在上述46條班機歸零的航線中，以飛往大阪的航班居多數，其次是名古屋，另有飛往福岡、札幌、仙台、沖繩等城市的航線；至於飛往東京的航線只有4條，分別是長沙、昆明、石家莊及煙台。日本觀光局17日公布，11月訪日的中國旅客為56.26萬人次，僅較去年同期略增3%，遠低於10月增幅22.8%及今年1至11月數據與去年同期相較的增幅37.5%。但訪問日本的外國旅客總數仍較去年同期增長10.4%，顯示受日中關係緊張的影響不大。    ,https://news.ltn.com.tw/news/world/breakingnews/5286302
香港10億日圓大劫案 警方逮捕15人,國際,2025/12/22 16:48,日企職員在香港被劫走10億日圓現鈔，港警宣布逮捕15名嫌犯。（圖擷自香港警察臉書）日本某加密貨幣與奢侈品公司的2名職員，18日上午9時許在香港上環皇后大道新紀元廣場附近被搶，以4個行李箱分裝的10億日圓（約新台幣2億元）現鈔全遭劫走，港警今（22日）宣布逮捕涉案的15名嫌犯。綜合港媒報導，這2名日企職員，本來是要到香港上環永樂街的外幣兌換所，怎知突然從路邊車輛衝出3名匪徒，其中1人手上拿著20公分長的刀械，短短30秒內就劫走款項。請繼續往下閱讀...港警指出，歹徒載走4個行李箱後，中途還換搭7人座車輛逃逸，並由另批共犯開走作案用車，將其棄置在港島中西區蘇杭街，警方後續在車上尋獲刀具、歹徒戴過的口罩和喝過的飲料。在經過調查後，港島總區刑事部警司冼國明、港島總區重案組第一隊總督察文智陽，今召開記者會宣布逮捕15人，分別為11名男性與4名女性，年齡介於20至69歲之間，都是香港本地人，部分具有黑道背景，至於現鈔下落還在追查中，後續不排除有更多人被捕。    ,https://news.ltn.com.tw/news/world/breakingnews/5286250
英嬤登機前疑早斷氣！航空公司硬放行 飛機延誤12小時乘客氣炸,國際,2025/12/22 16:44,89歲老婦在飛機準備起飛時，被發現已失去生命跡象，導致飛機緊急折返，全機乘客延誤長達12小時，示意圖。（路透）一架從西班牙馬拉加（Malaga）飛往倫敦蓋特威克（Gatwick）的班機上，一名89歲老婦在登機前，就被多名乘客目擊全身癱軟、頭部需由看護扶持。然而就在飛機準備起飛時，卻發現她已失去生命跡象，導致飛機緊急折返，全機乘客延誤長達12小時。綜合外媒報導，目擊者佩特拉（Petra Boddington）本身具備健康管理背景，她表示在候機時就注意到這名老婦，當時坐在輪椅上，身體癱軟呈現不自然的狀態，完全沒有任何生命氣息。多位目擊乘客更指出，老婦被推入機艙走道時，身旁的看護甚至必須扶住她的頭部防止垂落。當時機艙內已有多人議論，直呼「天哪，她看起來已經死了」！請繼續往下閱讀...雖然質疑聲不斷，但該名老婦仍被安排在特別協助座位。就在飛機準備起飛，空服員進行最後的安全檢查時，才赫然發現老婦情況不對勁，隨即通報機長，飛機因此中止起飛程序並折返登機門。急救人員檢查後，正式宣告老婦死亡。這起事件引發全機恐慌，機長隨後宣布因「醫療緊急狀況」必須清空機艙，乘客也因此延誤12小時才抵達目的地。事後，航空公司回應，該名乘客持有合法的「適航證明」，且陪同的看護堅稱老婦只是「身體不適且感到疲勞」，因此航空公司並無理由拒絕其登機。然而，乘客紛紛痛批，航空公司與地勤人員互推責任。目前該航班的副機師已承諾會針對乘客證詞撰寫調查報告，釐清老婦究竟是在何時死亡，以及登機程序的查核是否存在重大疏失。    ,https://news.ltn.com.tw/news/world/breakingnews/5286204
中國對台施壓、對日強硬 日媒：國會議員堅定態度密集訪台,國際,2025/12/22 16:42,賴清德總統22日接見日本自民黨代理幹事長萩生田光一。日媒報導，從現在到明年初的新年期間，訪台的日本國會議員人數約達30人。（總統府提供）日本《時事通訊社》21日報導，日本首相高市早苗在國會的「台灣有事」答詢引發日中關係惡化，也影響國會外交。日本眾議員、自民黨代理幹事長萩生田光一目前正在台灣訪問，且從現在到明年初，陸續前往台灣的日本國會議員人數約達30人，但日中友好議員聯盟（日中議聯）今年顯然難以訪問中國。萩生田光一目前也擔任「日華議員懇談會」（日華懇）幹事長，21日至23日率團訪問台灣，並於22日晉見賴清德總統。萩生田光一在2022年和2023年擔任自民黨政務調查會長期間也曾訪問台灣，當時被視為已故前首相安倍晉三的「繼任者」。請繼續往下閱讀...報導引述台灣外交部訊息指出，日本前法務大臣鈴木馨祐、前首相石破茂任內擔任首相輔佐官的眾議員長島昭久，以及前外相河野太郎等麻生派6名成員也將在24日訪台。從現在到明年初的新年期間，訪問台灣的日本國會議員人數約達30人。在中國對台灣施壓，並對日本採取強硬立場下，日本國會議員一連串訪台行動，可被視為日本重視日台合作的具體表現。1名資深保守派人士指出：「我們需要以堅定態度面對中國。」與此同時，「日中議聯」原本計畫在17日日本臨時國會閉幕後訪問中國，但在高市早苗11月7日國會「台灣有事可能構成日本存亡危機事態」答詢後，日中關係急轉直下。在「日中議聯」會長、前自民黨幹事長森山裕的授意下，「日中議聯」事務局長、自民黨成員小渕優子，以及立憲民主黨的近藤昭一等人，本月初曾秘密會見中國駐日本大使吳江浩，但雙方協調尚未取得任何進展。「日中議聯」1名資深成員坦言，「目前情況嚴峻」。報導說，由於長期以來在對中國會外交中扮演關鍵角色的自民黨前幹事長二階俊博已退出政壇，雙方的溝通管道明顯變窄。公明黨過去也在日中外交發揮重要作用，但自從退出與自民黨的執政聯盟後，公明黨在這次日中關係惡化中，並無明顯的動作。    ,https://news.ltn.com.tw/news/world/breakingnews/5286285
李在明加強對朝接觸 學者：對話不能在真空中進行,國際,2025/12/22 16:17,李在明上任後積極想與北韓恢復接觸，但目前舉措大多停在聲明階段，雙方尚未有實質溝通。（歐新社）南韓總統李在明上任後，積極加強對北韓接觸政策，透過一系列政策和公開談話表明其政策轉變，強調對話、謹慎管控軍事緊張局勢及有選擇地放鬆制裁，相關轉變在近幾週開始顯現。然而，南韓學者對此持保留態度，認為必須恢復某種形式的溝通，否則任何舉措都將停留在聲明階段。《韓國時報》22日報導，首爾當局過去幾週調整南北韓邊境軍事態勢，國防部也全面改革北韓事務機構，並重新討論放鬆單邊制裁的問題，此舉旨在恢復與平壤長期中斷的溝通管道。分析指出，此舉可能是為美國總統川普4月訪問中國期間可能舉行的美朝元首峰會做準備。請繼續往下閱讀...南韓國防部已決定恢復「對朝政策辦公室」，推翻前總統尹錫悅政府時期進行的重組。該辦公室先前更名為「對朝戰略辦公室」，主要負責制裁相關工作，但在新架構下，該辦公室將再次專注於韓朝軍事對話、建立信任措施及為潛在的軍事談判做準備。國防部官員表示，此舉旨在加強韓朝軍事溝通的制度基礎。過去，該辦公室負責監督工作層面的軍事會談，並在落實包括2018年「全面軍事協議」在內的韓朝各項協議方面發揮核心作用。李在明近期的演說也強化這個政策方向。上週，在外交部和統一部舉行的政策簡報會上，李在明將北韓近期在軍事分界線附近的活動，包括建造圍牆、切斷道路和橋梁，描述為防禦性行為，並表示平壤似乎擔憂邊境地區可能出現不穩定局勢。軍方也解釋在邊境附近進行演習的方式。1位國防部和聯合參謀本部官員在22日的簡報會上表示，韓方正在審查的任何調整，都僅限於北韓軍隊在軍事分界線附近進行日間活動的特定區域，旨在防止意外衝突，而不是削弱韓方的戰備狀態。南韓統一部也提出可能放鬆對北韓的部分單邊制裁，包括2010年北韓擊沉南韓「天安艦」後實施的所謂「524制裁」，主要內容包括中斷南北韓貿易、人員交流、禁止北韓船舶進入南韓海域等。李在明也表達類似的觀點，並表示南北韓之間目前沒有任何溝通管道，「我們需要保持耐心，積極主動地努力緩和南北韓之間的敵對情緒，建立互信」。然而，制裁政策限制首爾當局的迴旋餘地，因為任何實質的舉措都需要與美國協調，並仔細考慮更廣泛的國際規則。南韓政府已概述重啟與美國外交的計畫，官員在最近的簡報會上表示，南韓將尋求在重啟美朝對話中發揮促進作用，同時強調需要與華府密切協調。平壤當局將如何反應仍不明朗，尤其考慮到平壤長期以來對嚇阻實力和自力更生的重視。南韓朝鮮研究大學前校長楊武鎮表示，南韓政府強調接觸的立場傳遞一致的訊息，但他警告，進展將取決於韓朝是否恢復基本的溝通管道，「李在明政府明確表示希望進行接觸和對話，但如果韓朝之間連最基本的溝通管道都沒有，任何政策舉措都難以超越聲明階段」。楊武鎮補充道，除非同時進行工作層面的接觸，否則諸如解除制裁或調整軍事態勢等措施不太可能得到回應，「對話不能在真空中進行，首先必須恢復某種形式的溝通，無論是正式或非正式」。    ,https://news.ltn.com.tw/news/world/breakingnews/5286226
莫斯科驚爆暗殺！俄參謀本部中將遭炸死 現場畫面曝光,國際,2025/12/22 16:17,俄羅斯參謀總部行動訓練局局長薩爾瓦羅夫（Fanil Sarvarov）中將，22日在莫斯科遭預先安置在車底的炸彈暗殺身亡。圖為調查人員在爆炸現場對損毀嚴重的座車進行蒐證。（美聯社）俄羅斯首都莫斯科22日驚傳高階將領遭暗殺震撼彈！俄羅斯參謀總部行動訓練局局長、陸軍中將薩爾瓦羅夫（Fanil Sarvarov）在莫斯科南部因座車爆炸身亡。俄羅斯聯邦偵查委員會（Investigative Committee）已正式將此案定調為謀殺，並公開表示，目前的調查方向之一，鎖定為「烏克蘭特種部隊」策劃的襲擊行動。據《法新社》與俄國非官方的國際文傳電訊社（Interfax）報導，爆炸發生在22日上午，地點位於莫斯科南部的亞塞涅瓦亞街（Yasenevaya Street）。俄羅斯聯邦偵查委員會發言人佩特琴科（Svetlana Petrenko）證實，一個不明爆裂裝置被安裝在薩爾瓦羅夫的座車底部，「裝置被引爆後，薩爾瓦羅夫因傷勢過重當場身亡」。請繼續往下閱讀...俄羅斯獨立媒體《The Insider》引述Telegram頻道「Baza」與「Shot」的細節指出，遇襲車輛是一部白色的起亞（Kia Sorento）休旅車。當時56歲的薩爾瓦羅夫正準備駕車出行，車輛僅行駛了幾公尺後隨即發生劇烈爆炸。現場畫面顯示，爆炸威力集中在車輛前部，導致薩爾瓦羅夫身受多處彈片傷與骨折，最終不治。報導指出，薩爾瓦羅夫軍旅生涯資歷顯赫，不僅參與過俄羅斯全面入侵烏克蘭的軍事行動，此前也曾投入車臣戰爭、敘利亞軍事行動以及北奧塞提亞—印古什衝突。調查顯示，他至少在2020年就已取得案發地點附近的公寓產權，其座車資料也曾在先前的數據洩漏中曝光，顯示其行蹤可能早已被鎖定。針對這起發生在首都圈的刺殺行動，俄羅斯當局高度重視。佩特琴科表示，已依據俄羅斯刑法第105條（謀殺）與222.1條（非法持有爆裂物）立案調查，並指派中央單位的資深刑事偵查員介入。她明確指出，調查人員正在釐清各種可能性，其中一個主要版本是「該犯罪與烏克蘭特種部隊的組織有關」。目前警方正在詢問目擊者並調閱周邊監視器畫面，試圖追緝兇手下落。俄羅斯參謀總部行動訓練局局長、陸軍中將薩爾瓦羅夫（Fanil Sarvarov）22日在莫斯科遭汽車炸彈暗殺身亡，當局指控此案可能與烏克蘭特種部隊有關。（圖取自俄羅斯國防部網站）    ,https://news.ltn.com.tw/news/world/breakingnews/5286188
中國清潔工月薪不到台幣4500！民眾向省長投訴遭「查水表」要求撤件,國際,2025/12/22 16:08,中國四川省民眾投訴清潔工月薪最高僅有1000人民幣，竟被當局找來親戚上門要求撤件。（圖擷自bilibili）中國四川省熱心民眾，本月15日向省長信箱投訴，指稱達州市宣漢縣南壩鎮環衛工人（負責清掃街道、公共場所的清潔工），月薪最高僅有1000人民幣（約新台幣4478元），孰料卻被當局找來親戚上門要求撤銷投訴。從中國影音平台嗶哩嗶哩（bilibili）可以看到，投訴人本月7日、13日上傳在南壩鎮街頭訪問2名環衛工的影片，分別為紙橋街退伍老翁、鎮中心步行街64歲女性，前者月薪為950人民幣（約新台幣4252元），後者月薪則是1000人民幣。請繼續往下閱讀...投訴人向省長信箱反映此事後，卻只得到不痛不癢的回應，因此15日再度致函省長信箱，要求官方說明環衛工月薪僅1000人民幣是否違法。不過，投訴人在21日下午5時許，竟遇到親戚上門勸說他撤回舉報。投訴人將監視器影片上傳後，讓中國網友感到相當震驚，其中許多都支持投訴人為民發聲的行為，同時也感嘆影片之後可能會「被消失」，提醒投訴人要多注意自身安全。    ,https://news.ltn.com.tw/news/world/breakingnews/5286149
