Title,News_Type,date,content,url
機車中柱陷入水溝蓋縫隙  女子看診「卡關」警及時救援助「脫困」,社會,2026/07/18 18:47,女騎士機車因中柱深陷水溝蓋縫隙動彈不得，警消獲報眾人合力先將機車往一邊側倒，調整角度後成功讓中柱脫離縫隙。（警方提供）27歲陳姓女子前往楠梓區德民路某診所就醫，停放機車時，中柱不慎卡進水溝蓋縫隙，任憑她怎麼使勁也無法移動，眼看就醫行程受阻，只好報警求助及時脫困。楠梓警方獲報，所長蔣人戎、警員汪智欽與實習生林榆培趕赴現場，發現陳女的機車因中柱卡死而深陷水溝蓋縫隙，眾人合力將機車往一邊側倒，調整角度後成功將中柱脫離縫隙。陳女見愛車終於「脫困」，頻頻道謝，直呼原本擔心無法趕上看診，幸好有警方及時伸出援手。請繼續往下閱讀...楠梓分局提醒民眾停放機車時應留意周遭環境，尤其水溝蓋、排水孔等設施縫隙，避免中柱或側柱誤卡造成車輛受損或影響行程。    ,https://news.ltn.com.tw/news/society/breakingnews/5509849
台74線驚魂！25歲醉女突開車門跳車 滿臉血跪趴車道嚇壞用路人,社會,2026/07/18 18:41,張女在台74線快速道路酒醉突開車門跳車，嚇壞用路人。（脆友ruru920122提供）台中市25歲張姓女子滿身酒氣，今日下午搭計程車欲返家，行經台74線快速道路19.8公里處潭子路段，疑因酒醉突開車門跳車，臉頸鮮血直流，在車道路肩行走，嚇壞路過駕駛，警方將張女強制送醫，張女臉部及四肢有多處擦挫傷，意識清楚無大礙，已由家屬帶返家中。今日張女在台74線快速道路脫序行為，引起路過民眾拍照上傳網路，張女又跪又趴，滿臉鮮血，引起議論，有網友直呼計程車司機真倒楣。請繼續往下閱讀...大雅分局呼籲，飲酒後易影響判斷力及反應能力，民眾切勿酒後從事危險行為。另外快速道路等高風險路段，如遇突發狀況，應保持冷靜，優先確保自身安全，並立即撥打110或119尋求協助，以維護自身及其他用路人安全。    ,https://news.ltn.com.tw/news/society/breakingnews/5509854
砂石車自撞砂石灑落！台61線西濱後龍段雙向車道受影響,社會,2026/07/18 18:38,砂石車自撞內側護欄，砂石散落於北上、南下車道。（圖由民眾提供）一輛砂石車今（18日）下午5點許，行車台61線西濱公路北上109K苗栗後龍路段，自撞內側護欄，造成砂石散落於北上、南下車道，目前管制北上改由側車道通行，南下則採外線通過。路局苗栗工務段提醒用路人行經注意或提前改道。這起事故原因有待警方調查，不過，苗栗工務段表示，北上109K為下坡路段，也提醒大型車駕駛行駛下坡路段注意車速，以維護用路安全。砂石車自撞內側護欄，砂石散落於北上、南下車道。（圖由民眾提供）    ,https://news.ltn.com.tw/news/society/breakingnews/5509846
後龍濱海自行車道積水害摔骨折！女子請求國賠456萬 法院判賠40萬,社會,2026/07/18 18:22,苗栗地院審理認楊女、後龍鎮公所應各負擔一半之肇事責任，始為公允。楊女向後龍鎮公所請求賠償金額應為40萬4331元。（資料照）苗栗縣楊姓女子騎自行車經過後龍鎮濱海自行車道，因路面積水濕滑摔車，造成右腳骨折。她對農業部林業及自然保育署新竹分署、苗栗縣政府及後龍鎮公所提起國家賠償訴訟，連帶求償456萬餘元。苗栗地院審理，認楊女得請求應為80萬餘元，且其與後龍鎮公所責任各半，後龍鎮公所應支付楊女40萬餘元。楊女於2022年6月26日上午7點21分許，騎自行車行經後龍鎮山邊媽祖廟後方、靠近南港漁港前濱海自行車道路段，因路面積水濕滑摔車，造成她右脛下端骨折、右腓骨上端骨折、右膝挫傷等傷害。請繼續往下閱讀...楊女主張，她因此傷勢需長期回診、復健和接受極為痛苦之骨板拔除手術，種種身體疼痛及心理壓力導致她罹患憂鬱症，向土地管理機關林業及自然保育署新竹分署、督導機關苗栗縣政府及自行車道施設機關後龍鎮公所連帶求償醫療費用、看護費用、交通費用、不能工作收入損失、精神慰撫金等，共456萬4898元。法院審理，案發地點自行車道是由後龍鎮公所設置並負責管理維護，該處有潮濕、積水，顯見排水設計不良，設置顯有欠缺，認楊女摔車與此有因果關係，但與農業部林業及自然保育署新竹分署、苗栗縣政府無關。然法院調查，楊女得請求之醫療費用、醫療耗材、看護費、交通費、不能工作收入損失、精神慰撫金等項目，金額總計應為80萬8662元，且認為楊女行經該事發路段，也應減速甚至停車牽行通過，仍貿然逕行騎乘通過，導致摔倒受傷，也有相當過失，認楊女、後龍鎮公所應各負擔一半之肇事責任，始為公允。故楊女得向後龍鎮公所請求賠償之金額應為40萬4331元。    ,https://news.ltn.com.tw/news/society/breakingnews/5509838
台中午後大雷雨柳川水位暴漲 驚見半裸浮屍,社會,2026/07/18 18:11,台中市今天下午大雷雨突如其來，有民眾行經中區柳川西路時，赫然發現河面漂浮一具半裸浮屍，隨著暴漲水流載浮載沉，嚇得報警。消防人員獲報到場打撈。雨來得又急又猛，柳川水位暴漲，水流湍急，消防局獲報派遣中區、勤工及烏日等分隊到場發現，浮屍被大水往下游沖，漂向南區建國南路一帶，警消一路追蹤，同時評估水勢，在安全前提下，由搜救人員下水打撈。至於浮屍身分及落水原因，仍待調查釐清。    ,https://news.ltn.com.tw/news/society/breakingnews/5509823
台中年輕男信義鄉訪友戲水溺斃  失蹤第7天濁水溪尋獲遺體,社會,2026/07/18 17:55,信義警分局警、義消搜救人員，研判李男可能卡在灌溉溝渠引道下方。（信義警方提供）住在台中市20多歲李姓男子，11日到信義鄉訪友，後來到濁水溪玩水，當晚沒回家，家人報案協尋，信義警消12日在溪床發現其衣服、鞋子，研判李男可能溺水被往下沖，沿溪床往下游找尋，17日挖土機開挖下游一處灌溉溝渠引道，終於找到李男遺體，已是李男失蹤的第7天。李姓年輕男子11日中彰投放巴威颱風假，從台中搭車到信義鄉地利村找朋友，當天雨勢一陣一陣，他曾趁沒有雨的空檔到濁水溪畔玩水，傍晚朋友見他都沒有回來，打電話到李男家中探詢是否已回家，李男手機不通，家人焦急地報案協尋。請繼續往下閱讀...信義警分局12日接獲台中警方協尋轉報，動員在濁水溪床找尋，搜救人員在溪床上發現男子衣服、鞋子，家屬確認就是李男的，另有農民告知，11日曾看到一名年輕男子在溪畔玩水，搜救人員研判李男可能溺水，並被水流往下沖，警、消集結一路往下游方向找尋，從12日一直找到17日，搜救人員推測李男可能被吸進引道卡在裡面，當天一早請挖土機開挖，上午近10點找到一名男子遺體，經家屬指認確定就是失蹤第7天的李男。南投地檢署檢察官、法醫今天相驗，確認男子溺斃，遺體交家屬處理。挖土機在濁水溪下游溪床開挖找人。（信義警方提供）    ,https://news.ltn.com.tw/news/society/breakingnews/5509813
週日飆高溫！7縣市恐衝破36度,社會,2026/07/18 17:54,7縣市明天局部地局有36度以上高溫發生機率。（擷取自中央氣象署網站）氣象署今（18日）下午5點31分發布高溫特報提醒，明天台北市、新北市、桃園市、彰化縣、花蓮縣可能飆到36度，請注意防曬、多補充水分。氣象署指出，天氣高溫炎熱，明天白天台北市、新北市、桃園市、彰化縣、花蓮縣為橙色燈號，有連續出現36度高溫機率。基隆市、台東縣為黃色燈號，氣溫達36度以上，請加強注意。請繼續往下閱讀...氣象署提醒，天氣炎熱須避免非必要的戶外活動、勞動及運動，注意防曬、多補充水分、慎防熱傷害。室內保持通風及涼爽，建議採取人體或環境降溫的方法，如搧風或利用冰袋降溫等。關懷老人、小孩、慢性病人、肥胖、服用藥物者、弱勢族群、戶外工作或運動者，遠離高溫環境。    ,https://news.ltn.com.tw/news/society/breakingnews/5509818
三總採購弊案！前少校資訊組長洩漏招標內容 收賄200餘萬重判15年,社會,2026/07/18 17:51,士林地方法院依違背職務收受賄賂、公務員洩漏國防以外秘密等罪，判林靖有期徒刑15年。（資料照）曾任國防醫學院三軍總醫院醫學資訊室系統工程組組長林靖，涉利用督導資訊採購業務機會，洩漏招標內容、協助特定廠商量身打造標案，並收受現金203萬4554元及高價電子產品等賄賂。士林地院審理後，依違背職務收受賄賂、公務員洩漏國防以外秘密等罪，判處林靖應執行徒刑15年、褫奪公權5年。判決指出，林靖自2017年7月起擔任三總醫學資訊室系統工程組組長，負責督導資訊設備採購、交貨及驗收等業務，明知招標文件依法應保密，卻與永磐科技業務員勾結，以取得標案毛利約一成作為賄賂對價，讓業者提前參與採購規劃、掌握規格及數量，並承諾協助取得標案。請繼續往下閱讀...士林地院認定，林靖除指示承辦人直接採用廠商提供的規格、商情分析及招標文件，讓業者在公告前即掌握所有招標資訊，取得不公平競爭優勢外，還洩漏競爭廠商投標及提出異議等資訊，並指示承辦人放行不符規範的軟體授權證明文件，使廠商順利通過驗收。士林地院指出，林靖陸續收受現金賄款共203萬4554元，以及筆電、Apple Watch、iPhone等高價電子產品作為違背職務的對價；退伍前更要求未來成為合作公司的股東，以持續獲取利益。士林地院合議庭認為，林靖利用職務系統性洩漏採購秘密、護航特定廠商得標，嚴重破壞政府採購公平競爭及公務執行廉潔性，因此依法重判15年徒刑、褫奪公權5年，可上訴。士林地院合議庭另認定，三總約聘人員因配合洩漏招標資料、製作不實文件，判應執行有期徒刑2年、褫奪公權3年，緩刑5年；永磐科技主管判應執行1年8月、褫奪公權2年，緩刑5年；永磐科技業務員則判應執行2年、褫奪公權2年，緩刑5年，並須繳交公庫100萬元及履行義務勞務等條件。    ,https://news.ltn.com.tw/news/society/breakingnews/5509811
一年叫上百次救護車！24歲醫療惡霸踹傷輔大急診室女護理師、怒罵醫生聲押獲准,社會,2026/07/18 17:22,輔大醫院急診室15日發生一名24歲張姓男子不僅出言辱罵醫師，還踹擊護理師右腹部。（記者楊心慧翻攝）輔大醫院急診室15日發生一名24歲張姓男子不僅出言辱罵醫師，還踹擊護理師右腹部，據悉還是醫療惡霸，一年叫上百次救護車，到院卻又常不配合檢查大鬧急診室。警方調閱監視器確認犯行後，依違反醫療法、妨害名譽及傷害等罪嫌，將張男逮捕送辦；新北地檢署訊後向法院聲押獲准。新北市警察局林口分局表示，警方15日下午4時10分接獲報案，指新北市泰山區貴子路69號輔大醫院急診室發生緊急狀況，隨即派遣明志派出所員警到場處理。請繼續往下閱讀...警方調查發現，2002年出生的張男接受檢查時一度睡著，護理師與主治醫師將他喚醒、準備繼續進行醫療處置，張男卻突然以三字經辱罵醫師，隨後踹擊護理師右腹部。警方調閱院內監視器畫面，確認張男確有辱罵、攻擊醫療人員的行為，當天下午4時48分依準現行犯將他逮捕。林口分局指出，張男具有身心障礙身分，警詢時由法律扶助基金會指派律師到場陪同完成警詢，全案詢後依涉嫌違反醫療法、妨害名譽及傷害等罪嫌，移請新北地檢署偵辦，並建請檢察官聲請羈押獲准。林口分局偵查隊長黃文揚表示，警方接獲醫療暴力案件後，立即派員到場查處，確認犯嫌對醫師及護理師有言語辱罵及攻擊行為，依法逮捕送辦，以維護醫療場所安全及醫護人員執業權益。輔大醫護人員遭醫療暴力受傷 院方譴責、報警究責林口分局說明案情。（記者楊心慧翻攝）    ,https://news.ltn.com.tw/news/society/breakingnews/5509780
桃園工地工人3樓鷹架墜落  頭部撕裂傷送醫,社會,2026/07/18 17:04,工人工地鷹架墜落，消防救護員將他送醫救治。（圖擷取自網路）桃園市桃園區正光路1處工地，今天下午2點多，發生年約45歲男性工人，從3樓高的鷹架墜落，工人發現緊急報案將他送醫，目前仍在衛生福利部桃園醫院治療中；該名工人為何從鷹架墜落，仍待釐清。消防隊員說，男性工人從鷹架墜落，致肢體骨折、頭部撕裂傷，消防隊員趕抵時，緊急給予傷者包紮止血、頸圈長背板固定後，緊急送往部桃治療中。    ,https://news.ltn.com.tw/news/society/breakingnews/5509760
假少東豪框酒店妹！唬爛日本超跑事業、柬埔寨房產 90萬全賴帳慘了,社會,2026/07/18 17:01,陳姓男子包下酒店妹近3個月，90萬元費用卻賴帳，台中地院判陳男1年6月。（資料照）台中陳姓男子自稱國際物流公司「少東」，不僅吹噓家族企業財力雄厚，還宣稱在日本有超跑事業、柬埔寨有房產，豪氣包下酒店妹近3個月，不料80天累積90萬元費用卻賴帳，甚至害酒店妹代墊10萬元，台中地院審理後，依詐欺得利罪判陳男1年6月。經查，陳男明知自己根本沒有支付高額包場費用能力，卻於2023年11月主動聯繫酒店小姐及幹部，自稱某國際物流公司經理，還強調公司是家族企業，希望包場小姐約3個月，要求每週提供4次、每天約10小時的陪同服務，幹部信以為真，依照每天2萬元計價安排服務，總計約80天，累積費用高達90萬元。請繼續往下閱讀...包場期間，陳男不斷營造富豪形象，除了帶對方吃高級餐廳、住宿旅館，還帶她北上參加房地產展覽，聲稱要與柬埔寨老闆談投資案，又誇口自己在日本經營超跑公司、海外擁有房地產及民宿，甚至出示照片佐證，讓小姐及幹部深信不疑，然每當酒店催討費用時，陳男總以各種理由拖延，最後僅還款5萬元，其餘款項始終沒有下文。眾人這才驚覺受騙提告，陳男到案後否認詐欺，辯稱當時確實有消費能力，只是後來工作出狀況才無法付款，並非刻意欺騙，酒店幹部則證稱，陳男「非常會話術」塑造富二代形象，小姐也是因相信其財力才願意接受長期包場，甚至先墊款給公司。台中地院查出，陳男事發時僅是物流公司離職員工，公司根本不是其家族企業，另其存款餘額從未超過10萬元，顯然沒有能力負擔90萬元包場費用，認定他刻意虛構財力、傳遞不實經濟能力資訊，考量雙方事後以60萬元成立調解，依詐欺得利罪判1年6月，可上訴。    ,https://news.ltn.com.tw/news/society/breakingnews/5509755
離職勇警阻詐追回價值1400餘萬金條 曝家人昔日曾遭詐騙800萬,社會,2026/07/18 16:53,27歲前刑警鄭豪宏在台北市目睹老阿嬤交付財物給車手，一路從台北市大安區追蹤到新北市樹林區，拖延車手離去，與趕抵警力聯手緝捕周姓車手，找回阿嬤老本3.5公斤金條。（記者吳仁捷翻攝）27歲前刑警鄭豪宏在台北市目睹老阿嬤交付財物給車手，一路從台北市大安區追蹤到新北市樹林區，拖延車手離去，與趕抵警力聯手緝捕周姓車手，找回阿嬤老本3.5公斤金條，他事後想起緝捕車手驚險一刻，仍餘悸猶存，除擔心已沒有公權力，當時收水車手的車輛雖見他與取款車手周旋，急忙開走，但他也擔心詐團同夥回頭加入戰局，讓情況生變。鄭豪宏更透露，家人今年也遭詐800萬元，他得知後無能為力，以前當警察就算抓到詐團車手，也無法替被害人要回贓款，今天能以民眾身分，幫助別人的「家人」保住積蓄感到蠻欣慰，加上警方找到被害老婆婆，製作被害人筆錄，不忘鼓勵「臺灣警察的效率還是挺好的，讚讚！」請繼續往下閱讀...27歲的鄭豪宏警專37期畢業，從警4年，離職前在新北市中和警分局偵查隊服務，事後想起17日跟監、緝捕車手，仍餘悸猶存。他說，當時看到取款車手走向路邊唯一一台的銀色轎車，直覺是車手同夥、收水車手車輛，於是他衝上前大聲喝斥，叫住他勾住他的肩膀，看到周姓車手正用telegram回訊息，心裡更確信這就是車手！我就這樣一個人和他在原地僵持了幾分鐘，直到當地派出所員警趕到，老實說還蠻緊張的，怕收水的那台車繞回來跟我硬幹；最後警察在他的包包裡搜出4塊金磚，市值市價1475萬餘元。鄭豪宏透露，說來諷刺，以前自己當過警察，今年家人卻被詐騙800萬元，當時沒能及時阻止，事後也無能為力；他想起以前當警察，都偵辦已發生案件，就算抓到人被害人的錢也根本要不回來；而今天卻有機會，以一般老百姓身分，幫助別人的家人保住積蓄，也感到蠻欣慰的。鄭豪宏說，17日晚間做完證人筆錄，前同事告訴他已經找到被詐騙的阿嬤，也請她完成製作被害人筆錄了，鄭豪宏直呼真是太好啦，不忘稱讚台灣警察的效率。    ,https://news.ltn.com.tw/news/society/breakingnews/5509700
台東深夜「大場面」？男持大扳手砸賓士 警方揭真相,社會,2026/07/18 16:49,男持大扳手砸賓士擋風玻璃。（民眾提供）台東市長沙街深夜有人砸車，附近居民拍個正著。警方說，男子與酒友起口角，2人回家後，男子找到酒友停在住家附近的賓士車，拿扳手猛砸。網路影片及附近住家監視器畫面可看到，男子先大聲叫罵，「看我沒！（看不起我）」又與停車處附近住戶爆發口角，接著手持大扳手砸賓士擋風玻璃，從容步行離去。請繼續往下閱讀...警方調查，男子與賓士車主住家都離現場有段距離，現場與男子發生口角的住戶也非車主，警方獲報後通知男子到案，以毀損罪嫌函送。據了解，砸車男子疑似剛結束羈押、監禁，與車主等一群朋友酒過三巡，有酒友稱車主瞧不起他，引爆爭端。一群人圍觀畫面看似「聚眾滋事」，讓部分網友誤以為是「大場面」。警方說，本案是單純酒後口角糾紛，警方獲報到場，涉嫌人已離開，聚集的都是到場關心民眾，未參與糾紛。相關涉嫌人已查緝到案，將函送地檢署偵辦。擋風玻璃留下凹痕。（民眾提供）    ,https://news.ltn.com.tw/news/society/breakingnews/5509736
大天才！護照2023年過期 他在桃機拿筆手動改2028下場慘了,社會,2026/07/18 16:37,"桃園機場示意圖。（資料照）桃園機場發生一起令人啼笑皆非的護照變造案。一名陳姓男子在與同事搭機出國前夕，驚覺自己的護照早已過期，不料他竟與同行的葉姓同事在航廈行李托運處「臨場發揮」，由葉男執原子筆將護照有效期限的「2023」直接塗改成「2028」，隨後大搖大擺企圖通關，當場遭眼尖的移民署官員攔下移送。桃園地院日前審結，依共同犯行使變造護照罪，判處陳男有期徒刑1年2月、緩刑2年，還要向公庫支付新臺幣10萬元、並提供80小時義務勞務。桃園地院判決書指出，陳男與葉姓、林姓同事原定2024年2月底一同出國旅行。在出發前一天眾人輪流輸入護照資料訂購機票時，陳男就已發現自己的護照效期其實已經過期，當時他還無奈向同伴坦言這樣應該無法出國了。請繼續往下閱讀...豈料，一行人明知護照失效，隔天清晨仍抱著僥倖心態前往桃園機場第二航廈。就在準備行李托運時，眼見出境在即，葉姓同事竟突發奇想，提議「把數字3補上兩筆，看起來像8，不就能拉長效期了？」陳男當下雖然覺得荒謬，一度拒絕，但為了能順利出境，仍交付護照。葉男隨即在人來人往的機場大廳內，用原子筆大膽「手工改造」。結果當場被出境通關人員識破移送。在面對檢警偵訊時，陳男的辯詞更是一變再變。他起初謊稱護照上的墨跡是家裡4、5歲的小孩頑皮亂畫；眼見紙下包不住火，到了法庭上又改口高喊冤枉，辯稱雖然知道護照被改，但他是因為害怕葉男會威脅到自己的家庭，迫於無奈才屈服交出護照，堅稱自己也是受害者。對此，法官指出，此事發生時，陳男身在桃機第二航廈，屬公共場合，若被威脅可隨時向安檢人員、櫃台或移民署官員尋求協助或當場舉發。法官認為，陳男明知自己護照效期已過，仍持經變造之護照交付內政部移民署科員檢查而行使之，顯見確有利用葉男變造行為以遂行出國目的之情事，可認定其犯意。法院審酌，護照攸關國境秩序與國家主權管理，陳男僅因一己出境之私利，任同事塗改特種文書並行使，實屬不該。但考量其沒有前科，且實際動手塗改者為葉男，惡性與專業偽造集團有別。最終量處陳男有期徒刑1年2月，並給予自新機會宣告緩刑2年、付保護管束；然而天真的代價不菲，陳男必須在判決確定1年內，向公庫支付10萬元、提供80小時的義務勞務，並硬性參加3場法治教育課程。至於該名在機場大廳「熱心代筆」的葉姓同事，因在審理中發現其明確犯罪嫌疑，已當庭依法行使職權向檢察官告發，將由檢方另行分案偵辦。判決書也提醒，依據護照條例第29條，有買賣護照、以護照抵充債務或債權、偽造或變造護照、行使偽造或變造護照等情形，足以生損害於公眾或他人者，處1年以上7年以下有期徒刑，得併科新臺幣70萬元以下罰金。    ",https://news.ltn.com.tw/news/society/breakingnews/5509681
台中法警在司法大廈宿舍區架梯修剪樹木  疑大雨濕滑失足墜地身亡,社會,2026/07/18 16:32,消防救護車趕抵，王男經搶救仍宣告不治。（資料照）台中市18日下午突降大雷雨，司法大廈宿舍區不幸傳出意外，52歲王姓法警架鐵梯修剪樹木時，疑因雨勢來得又急又猛，導致梯子踏點濕滑，不慎失足自高處墜落，經救護人員到場搶救仍傷重不治，初步已排除外力介入，警方將報請檢察官相驗，進一步釐清確切死因。警方下午1時40分接獲報案，指林森路一帶住宅區周邊發生緊急救護案件，員警及救護人員趕赴現場後，發現王男已倒臥地面，經緊急施以急救措施仍宣告不治。請繼續往下閱讀...據了解，死者為法警，事發地點在台中司法大廈後方宿舍建築群，因樹木高大，平時需定期修剪，事發時王男正架設鐵梯修整樹木，不料午後雷雨突然襲來，梯具疑因此變得濕滑導致失足墜落身亡。    ,https://news.ltn.com.tw/news/society/breakingnews/5509723
