Title,News_Type,date,content,url
看似幫黨參選人站台 黨內人士：鄭更像替自己造勢,政治,2026/06/25 05:30,國民黨主席鄭麗文（後排中）昨天到台東召開行動中常會，為黨籍縣長參選人吳秀華（鄭左手邊）造勢。（記者黃明堂攝）為因應年底地方大選，國民黨主席鄭麗文昨啟動行動中常會下鄉輔選，首站來到台東，接下來將前進澎湖。黨內人士分析，鄭麗文雖然藉由行動中常會幫參選人站台，但更像在「替自己造勢」，不管是鄭自稱「很有票房」還是外界質疑的票房毒藥，都已可預見台中市長盧秀燕和立法院長韓國瑜將取代鄭麗文成為真正的藍營母雞。盧韓將取代鄭 成為真正藍營母雞國民黨昨天才發佈鄭麗文訪中和平之旅紀錄片「造局者」，宛如參選總統起手式。黨內人士表示，鄭麗文上任後除了兩岸路線備受關注，宣傳「鄭習會」的巨大成果，看不出對地方參選人和選舉有任何助益，種種行為皆是個人大於黨。包括韓國瑜受邀訪美這等黨內大事，鄭麗文也是在受訪時被動回應，還說比層級沒意義，為自己洗白。請繼續往下閱讀...黨內人士表示，鄭麗文身為黨主席，但關注都放在個人，反而盧秀燕不僅派副市長等核心幹部去機場為韓國瑜送機，也多次與國民黨縣市長參選人合體幫忙站台。雖然鄭麗文是黨主席，但盧秀燕做的更像是鄭麗文才要做的事。盧秀燕自四月起啟航為藍營縣市長參選人輔選，四月幫基隆市長謝國樑、新北市長參選人李四川、高雄市長參選人柯志恩站台，五月則為新竹市長高虹安、宜蘭縣長參選人吳宗憲和新竹縣長參選人徐欣瑩助選，六月則赴嘉義市力挺民眾黨的張啓楷。鄭麗文近期接受廣播專訪談及二〇二六地方選舉，聲稱自己「很有票房」，還說自己路線是國民黨非常大的資產。黨內人士則說，不少藍營參選人被問到是否會找鄭麗文站台，雖然沒有直接拒絕，但態度保留。畢竟是地方選舉，找一個人來自己的場子宣傳兩岸路線和鄭習會，完全沒有加分。    ,https://news.ltn.com.tw/news/politics/paper/1760170
蔡詩萍批以偏概全 沈伯洋再詳解首都2.0,政治,2026/06/25 05:30,台北市文化局長蔡詩萍（右）以千字文批評沈伯洋「以偏概全」。（資料照）民進黨籍台北市長參選人沈伯洋廿三日表示，台北城市脈動消失、停滯太久，要進入「首都二．〇」，學習建立更有歷史文化底蘊的景點。台北市文化局長蔡詩萍（見圖右，記者田裕華攝）以千字文批評沈「以偏概全」；市長蔣萬安受訪則細數大巨蛋、輝達等三年來政績作回應。而沈伯洋昨再說明，城市發展歷經卅、五十年後，要處理老屋延壽議題、加強人與人之間的連結，並為既有商圈注入強心針，就是進入「首都二．〇」，將歷史縫合到城市記憶中，讓台北再度進化。蔡詩萍在臉書發文「隨意開文化支票，其實是對文化最大的不敬」，指沈以台南林百貨，對比台北菊元百貨升格古蹟快慢，來批評台北發展停滯，真的「聽不懂」。蔡詩萍指出，台南市文化資產總數有二二三處，台北市約五三二處，紀念建築等二十多處，不解沈為討好台南鄉親就可「以偏蓋全」，藐視、抹殺歷任市長與文資工作者的努力，「我不覺得這是首都市長的格局」。    ,https://news.ltn.com.tw/news/politics/paper/1760197
提索資SOP化 沈伯洋：市府喜歡問A答B,政治,2026/06/25 05:30,台北市政府發言人團隊廿三日以「蔣市長上任以來，年度索資量排名第一的議員，不是簡舒培就是林延鳳」、「若真心希望減輕公務人員負擔，應先和黨內議員溝通減少過度索資做起」，回應民進黨籍台北市長沈伯洋提出將議員索資處理「SOP化」的想法。沈伯洋昨再次強調，議員索資天經地義，他談的是如何加快資料整理與回應，然市府卻喜歡「問A答B」。沈伯洋昨下午出席首場「基層無限談」受訪表示，北市府太喜歡「問A答B」，索資絕對是議員權利，也是議員監督市政必要之事，這是工作。他說，自己講的是希望公務人員整理資料回應時能「SOP化」，加快回應速度，減輕公務人員負擔，「除非特別隱瞞哪一個不要、要重新製作」，才會慢下來。請繼續往下閱讀...蔣團隊「問A答B」另有他例，藍營粉專發起拒投國民黨籍議員秦慧珠，市長蔣萬安卻回全力支持局處首長為政策辯護。沈伯洋聽聞先是一頭霧水，因蔣萬安沒有回答到問題，不太知道該如何評論。不過他認為，現在網路上有很多匿名粉專，背後看起來也是真的人，支持或不支持特定候選人有各別考量，提醒聆聽地方聲音、提出反映意見時，市府只要回覆市民疑惑即可，沒有必要攻擊其他參選人，因為市府一旦有回應並改善，市民自然會提高信任度，對台北市有益。    ,https://news.ltn.com.tw/news/politics/paper/1760195
獨家》戰甲車首度奔馳蘇花改 花防部深夜演練「跨區增援」,政治,2026/06/25 02:17,花防部演練跨區增援，CM-21甲車由隧道內駛出。（記者游太郎攝）蘇花改通車後首度出現戰車、甲車、火砲及各型戰鬥車輛！陸軍花東防衛指揮部昨天深夜演練「跨區增援」，從花蓮七星潭駐地一路往北馳援，戰術行軍順利抵達和平工業區，為日後從花蓮增援蘭陽平原及蘇澳港奠定基礎。花防部昨晚實施「立即備戰操演」中的重點科目，針對即將於7月1日改編的聯兵營進行實兵驗證，模擬共軍將登陸蘭陽平原，對蘭陽平原及蘇澳港造成嚴重威脅，國防部要求花防部立即跨越作戰區增援，經檢討兵力部署後，決定派出一個聯兵營星夜馳援宜蘭。請繼續往下閱讀...昨晚9時增援部隊完成集結後，10時獲令立即經由蘇花改駛往蘇澳地區，出動包括M-60A3戰車、CM-21甲車、155及105口徑火砲及後勤等車隊，以戰術行軍方式，針對沿途可能出現的敵情威脅，分批先行駛往和平工業區內整補，待命持續往北增援。花防部指出，這次的跨區增援為首度實施，考慮到沿途車流眾多，事前先協調公路局及警方等單位，在車輛機動時間實施交通管制，因沿途最大的挑戰為隧道及橋梁，自花防部成立30餘年來均未實施過，成效備受國防部及陸軍司令部重視，為了安全及汲取經驗，這次僅抵達和平工業區，近期內會再次配合演訓，全程演練增援宜蘭的各項作為。「跨區增援」為國軍因應全般情勢發展與作戰需要，自其他作戰區調派機動打擊部隊或資源，進入受支援或受災地區，以增強友軍戰力、執行反擊或協助災後重建的戰略與戰術運用；涵蓋軍事作戰與災害防救兩大領域，軍事層面「跨區增援」強調部隊的「機動力」與「打擊力」，希望以有限資源發揮最大戰術效益。至於在救災部分，去年的光復洪災，國防部就啟動了各軍團跨區增援模式，讓官兵救災的人力無縫接軌，成效也獲國人高度肯定。M-60A3戰車行駛在隧道內，考驗官兵膽識及駕駛技術。（記者游太郎攝）行駛在崇德隧道內的CM-21甲車。（記者游太郎攝）行駛在蘇花改中仁隧道內的花防部支援車隊。（記者游太郎攝）暗夜中急馳在蘇花公路上的M-60A3戰車。（記者游太郎攝）在蘇花公路中途和仁地區整補的M-60A3戰車。（記者游太郎攝）    ,https://news.ltn.com.tw/news/politics/breakingnews/5483090
批蔣萬安沒專業又「蔣不聽」 沈伯洋：把北市府當表演舞台,政治,2026/06/25 00:39,民進黨籍台北市長參選人沈伯洋出席首場「基層無限談」。（記者叢昌瑾攝）民進黨台北市長參選人沈伯洋24日在台大醫院國際會議中心出席首場「基層無限談」時說，蔣萬安知名度高，大家都認識，相較之下，自己才當兩年立委、政治資歷沒那麼長，大家認識較少，而且大部分是在國防、外交委員會，「但是我做事的資歷很長，過往參與很多民間活動，也比較沒有包袱，距離選戰剩下157天，對他來說，每一天都在戰鬥，要往前進也要有新的收穫，懇請與會里長等人給予意見。他也批評，蔣萬安沒專業，把台北市政府當成表演舞台。沈伯洋指出，身為民主守護者，除了要認識過去，更須把過去跟現在做連結，才能展望未來，他跟蔣萬安最不一樣的地方，首先是「蔣萬安並沒有在看過去，也沒有在展望未來」，所以台北在發展的過程中，歷史紋理保存很容易就消失，例如明治橋拆成碎塊後擺在那邊（應指馬英九市府將中山橋拆成石塊後，至今仍躺在舊再春泳池）。如果無法認識這塊土地的過去，如何知道未來5年、10年的台北，會是一座什麼樣的城市。請繼續往下閱讀...其次為「蔣萬安沒有在聽（即蔣不聽）」，蔣萬安把台北市政府當成是表演的舞台，提出要發展人工智慧（AI），但卻講不清楚AI產業、應用與一般市民的關係，令人覺得距離遙遠。沈伯洋提到，蔣萬安近日喊出無人自駕公車規劃，然大部分的人關心的是公車起步太快，乘客容易跌倒，此問題被反映許久，蔣仍不夠重視。「我們是會聆聽的人！」這段期間以來，民進黨籍議員參選人們持續將各區、各里的聲音反映給他，例如士林、北投用電需求，當地若要發展人工智慧產業，如何與地方共榮，塞車問題又何解；中正、萬華鄰近淡水河，親水設施能否方便到達、交通設計有無危險；中山、大同有市場改建後，動線設計不良致生意變差等，這些都是聆聽市民心聲後所得。沈伯洋調侃，蔣萬安有時候會說自己有在聽，例如社子島居民的想法，「但蔣聽了之後，沒了，還是柯文哲原來的方案，財務黑洞要怎麼解決？蔣有說嗎？也沒有講啊！」光是聽不夠，還要有專業才能解決，蔣萬安沒有專業、不尊重專業，沒有對過去歷史的了解，也無對未來的願景。「而我們是會聽、會做、有願景，也願意回顧過去，讓台北變得更好！」沈伯洋說，收到許多人反映現在台北市容不夠「美」，但「美」還要達到「真」和「善」，所謂「真」是要聆聽民意，像他可以走進鄰里聆聽意見，「善」要照顧弱勢、守護市民，讓台北共好，在革新的過程中自然就會產生「美」。蔣萬安沒在聆聽，無法反映民意，也不知道價值順序、守護的群體在哪，以及都市化社會人民感受孤單的點，蔣萬安只會告訴大家市府已經做得很好。相反的，民進黨團隊做得到，懇託選民支持。    ,https://news.ltn.com.tw/news/politics/breakingnews/5483076
前妻板橋車禍強忍悲慟 周勝考會勘鶯歌交通獲改善允諾,政治,2026/06/25 00:31,議員周勝考（左前白衣者）趕往鶯歌中湖街會勘交通改善。（記者吳仁捷翻攝）新北市議員周勝考前妻余蘭英昨天上午為兒子周韋翰到板橋區黃石市場拉票途中，不幸遭公車輾斃。周勝考跟家人初步協調治喪後，仍強忍哀慟趕往鶯歌區會勘交通設施改善，在他堅持下，於第3次會勘後，交通局總算允諾在中湖街258巷口增設號誌燈。周勝考表示，前妻車禍喪生，讓他體認到改善交通的迫切，加上接受陳情，遠道前來會勘，希望減少車禍傷亡，挽救每條寶貴性命。而周韋翰昨下午4時到新北殯儀館，會同檢警相驗母親遺體，因傷心過度，全程不發一語，合十婉拒發言，令人不捨。請繼續往下閱讀...新北市板橋北門街與西門街口，今天上午8時24分，驚傳一輛謝男駕駛的307公車，行經路口時，從後輾過通過斑馬線的行人余婦，消防、警方到場，救出命危傷者失去生命徵象，緊急送醫，到院後清查傷者身分時，赫見是周勝考前妻、新北市議員參選人周韋翰的母親，警方連忙通知周勝考，周勝考及周韋翰、女兒等家屬趕往醫院，到院被告知心肺受重創，失去呼吸心跳，搶救至9時30分宣告不治。周勝考與兒女、妻舅面對至親噩耗，難忍哀痛痛哭，交代兒女處理後事，便啟程趕往鶯歌中湖街258巷口交通改善會勘行程，他到場後，告知交通局人員，該路段為鶯歌通往桃園龜山工業區必經之地，不少大型車輛經過，因沒有號誌，威脅當地工業區及居民通行安全。會勘到一半，與會人員看到新聞快訊，得知周勝考前妻噩耗，周勝考感謝眾人關心。周勝考話鋒一轉，忍痛告知，他的前妻在走了35年的路口，最不可能發生車禍的路段，都慘遭車禍身亡，當地居民向他與市議員江怡臻陳情，因受人之託，帶喪忍痛來會勘，由於已是第三度會勘，希望交通局不要受限於法規，要正視車行實況與民情，從善如流，以自身慘痛經驗，向官員喊話。今天出席的除周勝考、包括江怡臻助理、當地里長也到場會勘，表達當地設置號誌的迫切性；周勝考呼籲，當地10年前拓寬大竹圍一號橋後，拓寬道路卻助長違規行駛，現在就是要亡羊補牢，不要等到悲劇發生再檢討，獲得交通局人員，允諾設置號誌，會同警方加強執法，及增加緩衝設施，降低當地社區的車禍發生。檢警相驗周勝考前妻余蘭英遺體，兒子周韋翰（白衣者）到場指認，難掩哀慟。（記者吳仁捷攝）檢警押解肇事的謝姓駕駛（中）到場相驗。（記者吳仁捷攝）    ,https://news.ltn.com.tw/news/politics/breakingnews/5483073
館長自爆為台灣同胞拒絕搬廈門年賺1億邀約  網酸：快走不送,政治,2026/06/25 00:14,網紅「館長」陳之漢。（資料照）舔共網紅「館長」陳之漢近日開直播時宣稱，有很多人都叫他搬去中國，但台灣人「需要」他，他「不能捨棄」台灣人，因此他決定不搬。一席發言分享到網上後，被大批網友噴爆。館長去年展開中國行後言行放飛自我，各種捧中貶台，不少人直言既然這麼羨慕、這麼喜歡中國，何不直接搬去中國？但館長全當耳邊風。日前館長又去中國展開「川渝行」，同桌一名中國女地陪看到館長花式誇讚中國，當面問「想不想在這定居？」結果館長裝沒聽到，即便對方再問了一次也不回。請繼續往下閱讀...23日晚間，館長在其YT頻道開直播又開始賣慘，稱自己賠了許多錢，但還是有很多人想幫他，中國那邊有人要他搬去廈門，保證過去之後一年賺的錢「不會低於一個億」，但他還是不過去，因為他留在台灣是要做事，只有2028拉下民進黨，替台灣人出口惡氣，再無後顧之憂後才去。館長一副正義凜然地說：「你說專心的搬過去、專心的賺錢，我說實在話，我怎麼捨得捨棄我的同胞，我怎麼可能捨得這些人。我是有商業價值，但是我知道我就是個笨蛋，心存善念、盡力而為，對的做、不對的不要做，所以我還是會把我的事情做完。」不過網友們紛紛開噴，「X的，理由伯，理由一堆」、「死賴在台灣幹嘛？你賤不賤啊」、「這廢咖連人家三流直播主都不如，沒了台灣有什麼價值」、「以為自己是救世主？」、「台灣人不需要你」、「不敢搬去就不敢搬去，在那邊嘰嘰歪歪一大堆」、「快走不送」、「有夠不要臉」、「不要自戀，趕快走吧！」、「台灣什麼時候需要你？」、「笑你沒膽量搬過去」。    ,https://news.ltn.com.tw/news/politics/breakingnews/5483009
立院訪團將赴華府  陳冠廷喊話：跨越政黨共促台美雙方利益,政治,2026/06/24 23:04,談及下一站華府行程，民進黨立委陳冠廷說，這次訪美團最大的意義，在於跨越政黨立場，共同思考如何促進台美利益，並將想法直接與美方交流分享，持續深化台美夥伴關係。（陳冠廷辦公室提供）台灣國會訪問團甫結束赴美行程首站亞利桑那州。訪團成員、民進黨立委陳冠廷表示，台美關係不僅存在於政府之間，產業之間的連結同樣重要，未來台灣將持續透過產業實力與軟實力深化與美國各州的夥伴關係，讓台美合作更全面、穩固。針對下一站華府行程，陳冠廷則說，這次訪美團最大的意義，在於跨越政黨立場，共同思考如何促進台美利益，並將想法直接與美方交流分享，持續深化台美夥伴關係。請繼續往下閱讀...陳冠廷指出，他此行親眼見證台灣重要產業在美國受到高度肯定，不論是對當地社區、州政府，甚至對美國整體產業發展而言，都展現出台美互惠互利、共同成長的成果，令人對未來雙方合作深具信心。陳冠廷表示，訪團此行也與亞利桑那州商務廳等相關單位深入交流，針對台灣企業赴美投資所面臨的機會與挑戰交換意見，並提出多項政策建議。會談期間雙方均認為應持續強化產業合作與投資環境，進一步擴大台美經濟夥伴關係。陳冠廷提到，在交流過程中，他特別建議州政府及地方政府能夠在企業投資初期提供更多支持與誘因，協助包括台積電及其供應鏈在內的台灣企業順利落地發展。陳冠廷指出，過去美國聯邦政府透過相關產業政策提供企業支持，成功促進半導體產業聚落形成，未來若能結合州政府與地方政府力量，將有助於打造更完整、更具競爭力的產業生態系。陳冠廷強調，台美關係不僅存在於中央政府層級，地方政府與地方政府之間、產業與產業之間的連結同樣重要。未來台灣也將持續透過產業實力與軟實力，深化與美國各州的夥伴關係，讓台美合作更加全面且穩固。談及接下來在華府的行程，陳冠廷表示，訪團將持續與智庫、國會及相關人士進行交流，就台美共同利益、區域安全、經貿合作等議題深入交換意見。他指出，此次訪團由來自不同政黨的立委共同組成，正是希望將台灣多元且真實的聲音帶到美國，向各界展現台灣民主社會的多元價值與對台美關係的共同期待。陳冠廷表示，這次訪美團最大的意義，在於跨越政黨立場，共同思考如何促進台美雙方利益，並將這些想法直接與美方交流分享。透過最直接的對話，持續深化台美夥伴關係，為雙方創造更多合作契機與共同利益。民進黨立委陳冠廷指出，訪團此行也與亞利桑那州商務廳等相關單位深入交流。（陳冠廷辦公室提供）    ,https://news.ltn.com.tw/news/politics/breakingnews/5483055
與AIT辦無人機論壇盧秀燕喊拚新護國神山 挨批玩「兩面手法」,政治,2026/06/24 22:59,總統賴清德日前到台中了解無人機產業。（何欣純辦公室提供）台中市將與美國在台協會（AIT）等合辦「台中無人載具產業與海外商機論壇」，台中市長盧秀燕盼透過產官學集思廣益，打造下一個護國神山；多名民進黨議員痛斥她「說一套做一套」，喊發展產業，卻縱容國民黨立院黨團砍預算，玩兩面手法讓台中相關產業鏈與台灣國防自主元氣大傷；國民黨議員則稱在AIT來台中辦論壇除肯定台中產業鏈完整，更提醒中央「資源不要放錯重點」。盧秀燕今指出，7月2日將與AIT在台中合辦無人機論壇，希望透過產官學集思廣益，打造台灣下一個護國神山、無人機產業，以台中市為主的中部地區，就是台灣要發展無人機產業最好的區塊，「我們準備好了」。請繼續往下閱讀...台中市議會民進黨團總召周永鴻指出，發展無人機產業不是光靠辦論壇或喊口號就能成功，須有穩定預算與完整法制，藍白卻在立法院大砍關鍵的商購、委製及台美共同研發等項目，促盧秀燕與其只辦論壇作秀，不如促國民黨團別再扯中央後腿，放任藍營繼續砍中央預算、拖法制，受傷最重的就是台中產業鏈與台灣的國防自主。民進黨市議員陳淑華也強調，盧秀燕宣稱要發展無人機產業，但她在任7年半以來完全未提出無人機發展政策，如今嘴說發展台中相關產業，卻放任藍白大砍無人機預算，阻礙台中產業鏈發展，「說一套做一套」玩兩面手法，已被看破手腳。國民黨議員陳文政及楊大鋐均強調，台中有全台最佳的無人機相關產業鏈，綠營一再喊藍白砍無人機預算，但行政院卻可以編400餘億到嘉義推無人機園區等，捨台中已成熟的產業鏈不顧，反另起爐灶，AIT選在台中辦無人機論壇，除肯定台中相關產業鏈外，更是提醒中央「資源不要放錯重點」。    ,https://news.ltn.com.tw/news/politics/breakingnews/5483054
又被暗指是「政客爽」影武者  林家興預告：假日進一步發文說明,政治,2026/06/24 22:37,林家興無奈一再被跟「政客爽」連結。（記者蘇孟娟攝）台北市議員秦慧珠昨（23日）臉書貼文指出，因對「殷瑋事件」發表評論，遭知名臉書粉絲專頁「政客爽」發起「讓我落選」活動，更點名「政客爽」主持人傳是台中「L姓」公務員，還喊話台中市長盧秀燕好好查一下；被影射的台中市工策會副總幹事的林家興開嗆「有證據請拿出來」，今晚還發文預告「假日進一步發文說明」。秦慧珠近來身陷評論風波，昨她發文感嘆被「政客爽」發起「讓我落選」活動，更指出，「政客爽」的主持人據說是現在台中市政府任職的「某L姓人士」，她想請盧秀燕幫忙了解是否有台中市府公務員一邊領市政府薪水，一面召集一群人做違法觸法的事，「特別是盧秀燕有意問鼎大位，這件事情必須查清楚，以免未來受他們的拖累」。請繼續往下閱讀...被影射的林家興昨直接在秦慧珠貼文下留言，澄清他不是政客爽主持人，讓不少人熱議何必「對號入座」。對此，林家興今說，他不是「政客爽」主持人，也不知道「政客爽」是誰，相關流言流傳多年，讓他不勝其擾，雖然無奈，但只要有人亂放話，他也無所畏懼，會一次次嚴正澄清以正視聽，「指控的人有證據就拿出來」。晚間林家興在臉書再發聲，指出，如果「黨內同志」面對造謠都不查證，在台北舒適圈這樣捅刀在艱困選區蹲點的人，「我只能心寒」，並預告「假日再來發文進一步說明」。    ,https://news.ltn.com.tw/news/politics/breakingnews/5483043
竹市新城市LOGO引議論 錢康明酸高虹安熱衷「消除」林智堅,政治,2026/06/24 22:22,新竹市上週新發表的城市品牌LOGO引議論，錢康明酸高虹安上任最熱衷的事是「消除」林智堅。（記者洪美秀攝）新竹市長高虹安上週（18日）大張旗鼓宣布新的城市品牌視覺LOGO及舉辦吉祥物皮卡2週年，新的LOGO引發網友議論，除3年內花265萬改2次LOGO，若加上吉祥物皮卡製作費138萬，已花403萬市民納稅錢。有網友批新LOGO像是新竹市府臉上三條線，有的則批403萬等於4.24個聶永真設計費用。前文化局長錢康明則酸高虹安任內，最想做的就是「消除」林智堅，只要是林智堅的政績就改掉，要不然就收割或甩鍋。錢康明認為，高虹安改城市LOGO，先不評論美醜，還以為是運動品牌新logo發布會，以三條溪為自然的元素做logo設計，很難將新竹市與三條溪產生連結，歷史、人文、產業的故事都還沒說，三條溪如同三條線，讓人不知所云。請繼續往下閱讀...且高虹安上任後，最熱衷做的事就是「消除」林智堅，印象最深刻的莫過於改公共工程圍籬上的標語，他記得任期內有市長室秘書叫他幫忙想新的標語，重點是要有「安」字，他認為，都已選上了，竟把公家的錢花在改標語，會讓人把選舉和執政聯想在一起，因為所有標語都藏了「安」，但新竹市一點都不安。他認為，城市行銷是長期累積的，想到什麼做什麼，別的縣市做什麼，新竹市就做什麼，但沒故事、沒配套，沒有長期計畫，改再多次的logo都沒用。就連吉祥物皮卡也是橫空出世，完全沒有新竹的故事連結，為何皮卡能做為吉祥物，完全說不通。新竹市上週新發表的城市品牌LOGO引議論，錢康明酸高虹安上任最熱衷的事是「消除」林智堅。（記者洪美秀攝）新竹市上週新發表的城市品牌LOGO引議論，錢康明認為三條溪如同三條線，讓人不知所云。。（記者洪美秀攝）    ,https://news.ltn.com.tw/news/politics/breakingnews/5483020
