Title,News_Type,date,content,url
本報專訪》美上將、AI霸主Palantir顧問：AI對台灣防衛至關重要,政治,2026/04/11 19:06,美國前太平洋陸軍司令佛林（Charles A. Flynn）11日在台北接受本報專訪。（記者方瑋立攝）台灣正積極透過國防特別預算等方式，尋求建立無人機產業聚落，並採購具AI輔助能力的C5ISR系統，現為戰場AI巨擘「Palantir」資深顧問的美國前太平洋陸軍司令佛林（Charles A. Flynn）今（11日）受訪直言，由AI驅動的情報蒐集、目標標定、部隊保護與維持能力，對台灣防衛絕對是關鍵所在。他也對去年觀察「漢光41號」演習給予高度評價，認為台灣軍隊訓練與高層支持，皆出現了跳躍式的改變。佛林今天受福和會邀請在台北晶華酒店出席「民主之盾：第一島鏈全社會韌性合作國際論壇」，與國內外專家學者、退伍將領，包括前日本自衛隊統合幕僚長岩崎茂、日本第32任海上幕僚長武居智久、日本第34任陸上自衛隊陸上幕僚長岩田清文、菲律賓前陸軍副司令基尼德（Leodevic B. Guinid）、前韓美聯合司令部副司令任浩永等人座談。請繼續往下閱讀...針對台灣政府欲透過國防特別預算，積極尋求國防自主、無人載具與整合AI的C5ISR系統，佛林接受《自由時報》專訪時強調，AI技術對台灣防禦是絕對不可或缺的，尤其是由AI驅動的情報蒐集、目標標定、部隊保護，乃至於實際維持部隊運作的能力，對台灣而言至關重要。佛林直言，美方從過去行動中汲取慘痛教訓，自去年「午夜之錘」行動以來，美國已加速推動相關部署，以確保擁有適當的AI能力，來應對大規模且極快速的作戰需求。他認為，美方必須持續與台灣分享在「絕對決心」與「史詩怒火」等行動中所獲取的實戰經驗。佛林去年曾訪台觀察「漢光41號演習」，他分享心得說，演習將第一線應變人員、後備部隊與現役部隊結合在一起，進行大規模動員演練，這對測試軍隊戰備水準極具價值。佛林強調，這項進展必須建立在獲民選文人政府高層支持的基礎上；這兩個層面的結合，代表台灣軍隊的訓練方式與獲政治領袖支持度上，出現了跳躍式的改變。但他也提醒，軍隊不能只停留在下達命令與演練計畫，必須每天實地演練，因為實際執行將需要極高的時間掌握、排序、同步性與協調性，絕不能等到危機發生才來解決。至於台灣仍被排除在國際聯合軍演外的困境，佛林認為，現在應該是各國克服政策挑戰的時候，應尋求具創意的方法讓台灣在海外訓練，或將區域夥伴與盟友帶到台灣協助訓練。他舉例，中國每年也會派約25名士兵參與在泰國舉行的「金色眼鏡蛇」（Cobra Gold）多國聯合軍演，但他們只做人道救援減災等科目。只要經過周密考量與發揮創意，必然能找到讓台灣參與多邊合作的途徑。    ,https://news.ltn.com.tw/news/politics/breakingnews/5400788
曝黃國昌造勢現場「悄悄做1事」！四叉貓笑瘋：避免太難看,政治,2026/04/11 19:01,四叉貓表示，本來媒體區後方有14排椅子，到後面僅收到剩下5排，還非常零散。他也忍不住大笑稱，來了一堆重要來賓，結果一千張椅子都坐不滿，還偷偷收掉後面的椅子避免太難看。（取自四叉貓臉書）民眾黨主席、新北市長參選人黃國昌今日下午在三重舉辦「411讓新北更有型」誓師大會。網紅四叉貓爆料，疑似因為工作人員發現現場人太少，竟在活動開始後悄悄把空椅子收起來，「避免太難看」。他也笑稱，黃國昌的YT直播鏡頭，根本不敢拍前十排以後空曠的場景。四叉貓今日在臉書發文，他表示，現場大約擺放1000張椅子，分前後兩部分，但連前半區500張都沒坐滿，他因此推測現場僅約300人左右，就算隨著活動進行人數增加，最後也頂多500到600人。請繼續往下閱讀...四叉貓還爆料，可能是現場人太少關係，活動開始後還把後面的椅子收掉了，本來媒體區後方有14排椅子，到後面僅收到剩下5排，還非常零散。他也忍不住大笑稱，來了一堆重要來賓，結果一千張椅子都坐不滿，還偷偷收掉後面的椅子避免太難看。四叉貓指出，有趣的是，黃國昌的YouTube頻道原本僅約2000到3000人觀看，活動開始一個多小時後，同時觀看人數突然在10分鐘之內暴增至4萬多人，且維持了一個小時。四叉貓對此表示：「可惜小草寧願在家看直播，最後現場1000張椅子才坐滿一半。」他也笑稱YT直播鏡頭根本不敢拍前十排以後空曠的場景。最後，他也不忘補刀，表示黃國昌的專屬座車以及其他宣傳車，在活動現場旁邊紅線違停超過一小時，「警察都沒抓！」黃國昌直播人數暴增至4萬人以上。（取自四叉貓臉書）    ,https://news.ltn.com.tw/news/politics/breakingnews/5400664
本報專訪》「川習會」前中國態度放軟？美前將領：對話是好事 但邪惡不能被姑息,政治,2026/04/11 18:58,美國前太平洋陸軍司令佛林（Charles A. Flynn）11日在台北接受本報專訪。（記者方瑋立攝）外界關注中國在5月「川習會」前是否刻意放軟姿態，美國前太平洋陸軍司令佛林（Charles A. Flynn）今（11日）受訪表示，兩國元首對話能避免戰爭，這對雙邊關係、區域和全球都有益；但針對國內部分論調認為台灣不應挑釁中國、不需斥資強軍，佛林直言，「這世界上存在著邪惡，而邪惡絕不能被姑息，必須被擊敗」。佛林今天受福和會邀請在台北晶華酒店出席「民主之盾：第一島鏈全社會韌性合作國際論壇」，與國內外專家學者、退伍將領，包括前日本自衛隊統合幕僚長岩崎茂、日本第32任海上幕僚長武居智久、日本第34任陸上自衛隊陸上幕僚長岩田清文、菲律賓前陸軍副司令基尼德（Leodevic B. Guinid）、前韓美聯合司令部副司令任浩永等人座談。請繼續往下閱讀...針對5月「川習會」會如何影響美中及台灣關係，佛林說，他不會去猜測是否會改變，但他重申已經倡議多年的觀點指出，當國家之間不交談時，往往就會走向戰爭；反之，若保持對話就不會交戰。他強調，本世紀將由美中關係來定義，當這些國家領袖坐下來交談、相互了解，絕對比互不理睬來得好，因為這些關係將有助於未來克服危機，甚至避免更糟的情況發生。然而，針對台灣內部有聲音認為不應花費巨資擴軍以避免激怒中國，佛林語重心長地重申，看看當今世界發生的事情，「這世界上存在著邪惡，而邪惡是無法被姑息的，邪惡必須被擊敗」。他強調，保衛人民、安全、領土完整和國家主權，是台灣人民的首要原則與責任。這不僅是政治領袖或軍事將領的責任，更是全體文人公民的共同責任。他提醒，世界上有邪惡的政權，且往往傾向於傷害那些不保護自己的人，當邪惡來敲門時，有準備總比沒準備好。佛林從2021年至2024年出任美軍太平洋陸軍司令，回顧中國過去10多年的軍事擴張，他坦言「令人擔憂」指出，共軍的能力增長、現代化措施以及部隊訓練的改變，在2014年至2016年期間開始匯集。他形容中國20多年來的行徑是漸進的、陰險的且不負責任的，中共不應將這種陰險的脅迫滲透全球與區域，他們更透過脅迫、法律戰和資訊戰來傾斜天平，加劇了這種危險的發展軌跡。不過，佛林也指出，目前美國處於一個有利的位置，考量到歐洲和中東的情勢，沒有人應該去質疑美軍的投射能力及致命性，他認為這在近幾個月中已獲驗證，從第一次針對伊朗核設施的「午夜之錘」行動開始。佛林說，台灣國軍正在做的事情，以及從文人領導層所獲得的支持，使其得以提升「全社會防禦」能力，這都是建構嚇阻的關鍵步驟，也有助於避免台海爆發危機或戰爭。美國前太平洋陸軍司令佛林（Charles A. Flynn）11日在台北接受本報專訪。（記者方瑋立攝）美國前太平洋陸軍司令佛林（Charles A. Flynn）11日在台北接受本報專訪。（記者方瑋立攝）    ,https://news.ltn.com.tw/news/politics/breakingnews/5400785
本報專訪》美前太平洋陸軍司令：美台軍售是長期合作 北京無權置喙,政治,2026/04/11 18:52,美國前太平洋陸軍司令佛林（Charles A. Flynn）11日在台北接受本報專訪。（記者方瑋立攝）針對外界揣測中國欲藉政治動作，當作未來干預美台軍售的籌碼，美國前太平洋陸軍司令佛林（Charles A. Flynn）今（11日）表示，美台軍售完全是美國與台灣之間的事，與中國將採取何種行動毫無關聯。他強調，美國與台灣擁有長期的關係，售台裝備已有數十載歷史，這將會持續下去，中國在美台關係中，沒有任何發言權，特別是在確知有效的軍事硬體、軟體及能力方面。佛林今天受福和會邀請在台北晶華酒店出席「民主之盾：第一島鏈全社會韌性合作國際論壇」，與國內外專家學者、退伍將領，包括前日本自衛隊統合幕僚長岩崎茂、日本第32任海上幕僚長武居智久、日本第34任陸上自衛隊陸上幕僚長岩田清文、菲律賓前陸軍副司令基尼德（Leodevic B. Guinid）、前韓美聯合司令部副司令任浩永等人座談。請繼續往下閱讀...針對外媒解讀中國藉「習鄭會」展現緩和的政治姿態，是為五月「川習會」降溫。佛林今天接受《自由時報》專訪時說，目前美國處於有利的位置，從過去幾個月的「午夜之錘」、「絕對決心」到最近的「史詩怒火」，我想沒有人應去質疑美軍的投射能力與致命性，台灣國軍正在做的事情，以及從文人民選領袖獲得的支持，提升「全社會防禦」的努力，這是建構嚇阻力的重要步驟，更有助於避免台海爆發危機或戰爭。佛林說，現在全球已經有兩場區域戰爭正在發生，俄烏及中東戰爭仍持續，最不需要的就是在台海爆發另一場衝突，這應非任何人的目標，努力解決當前發生的事情，對每個人都會有所幫助。至於中國是否會試圖藉此軟化或干預美國對台軍售立場，佛林直言，「這是美國和台灣之間的事情，我不認為這與中國要做什麼有任何關係」。他說，美台之間具有長期的關係，且幾十年來一直向台灣供售武器，因此他認為這種情況會持續下去。佛林強調，「我不認為中國在美台關係間有任何發言權」，尤其是涉及已知有效的軍事軟、硬體及作戰能力方面。    ,https://news.ltn.com.tw/news/politics/breakingnews/5400775
鄭習會中國網軍暴增 台灣網友出招「鄭上習下」成功反制,政治,2026/04/11 18:46,網友AI製作「鄭上習下」哏圖，在社群瘋傳。（取自Threads）「鄭習會」昨落幕，觀察網路發現相關新聞下方，出現大量可疑帳號、疑中國網軍號力捧國民黨主席鄭麗文，或出言批評民進黨或支持者。對此，台灣不少網友出奇招留言喊「鄭上習下」，據稱能有效抑止網軍發言，昨「鄭上習下」關鍵字在Threads上成為熱門趨勢，相關文章高達150萬篇以上，非常可觀。熟稔網路社群操作人士指出，昨日「鄭習會」後，社群網路上許多相關文章，只要損及甚至只是提到鄭麗文或習近平，下方就會湧出大量可疑帳號留言辱罵，或高喊「賴下鄭上」。尤其在臉書上，這些帳號都有共同點，關閉個人資料、無顯示過去任何貼文，同時沒顯示任何朋友。請繼續往下閱讀...經查，昨日鄭麗文會見習近平後，召開記者會的同時，美國在台協會（AIT）也發布文章紀念《台灣關係法》立法47週年，結果下方也罕見出現大量可疑帳號留言：「所以戰機什麽時候送過來？」、「想讓台灣變成烏克蘭嗎？」、「把人民當盤子的美國狗」。相關帳號不但大部分都有上述可疑特徵，同時部分帳號還不小心使用少量簡體字、異體字。對此，大量網友在相關貼文、留言下方留言「鄭上習下」、「習下鄭上」等方式反制，不少網友更直接以AI製成圖片、哏圖。還有不少網友惡搞，高喊「我是台灣人，我支持鄭習會。鄭上習下」、「支持國民黨重返中國執政」。Threads流行趨勢顯示，與該關鍵字有關文章已以突破150萬篇。國民黨主席鄭麗文赴中與習近平會面。（法新社）網友狂洗「鄭上習下」反制。（取自Threads）    ,https://news.ltn.com.tw/news/politics/breakingnews/5400719
卓榮泰批鄭麗文玩火 國民黨酸：兩岸23項協議民進黨一項都不敢廢,政治,2026/04/11 18:45,國民黨主席鄭麗文（左）與中共中央總書記習近平（右）。（國民黨提供）行政院長卓榮泰批評國共兩黨會談「沒了底氣」，並指國民黨主席鄭麗文推動兩岸和平制度化是「玩火玩過頭」。國民黨質疑，卓榮泰這番話說穿了還是民進黨老招：「自己處理不了兩岸，就先抹紅別人；自己拿不出辦法，就把和平講成危險」。真正把台灣推向險境的，不是主張避戰、對話的人，而是執政多年，卻只會不斷升高對立、製造敵意的民進黨政府。國民黨指出，所謂兩岸和平制度化，就是透過制度安排降低誤判風險，讓台灣少一分衝突、多一分穩定，這不是「玩火」，而是避戰。反倒是民進黨一邊把制度化和平抹成危險，一邊又對兩岸現有23項協議一項都不敢廢，這才是真正的自打嘴巴。請繼續往下閱讀...國民黨表示，若照卓榮泰的說法，這23項協議難道也都是「玩火」？如果真是玩火，民進黨為什麼執政到現在還繼續留著？嘴巴罵得很兇，制度照樣沿用，難道不是自相矛盾、自打嘴巴？國民黨強調，卓榮泰把「和平」直接扣上「玩火玩過頭」的帽子，才真的是把話說過頭。拿香港、西藏硬套台灣，拿恐嚇代替論述，除了暴露民進黨對兩岸問題束手無策，也再次證明民進黨最怕的，不是和平有風險，而是台灣人民發現：「原來兩岸不是不能談，和平不是不能談，真正不敢談、不會談的，是民進黨自己」。國民黨奉勸卓榮泰，少一點政治口水，多一點現實感；不要把對話都抹成投降，不要把和平都講成玩火。把台灣安全當成政治鬥爭工具反覆操作，這才是真正玩火，而且早就玩過頭了。    ,https://news.ltn.com.tw/news/politics/breakingnews/5400773
昔日反中、狠嗆國民黨主張被翻出  沃草：「一起協尋鄭麗文！」,政治,2026/04/11 18:31,國民黨主席鄭麗文訪中。（國民黨提供）「鄭習會」昨落幕，鄭麗文向習近平提出5點主張，包括要推動兩岸關係和平發展、恢復兩岸協商機制。對此，獨立媒體《沃草》表示，還記得當年那位在街頭熱血吶喊、痛批國民黨是「最可惡的統治者」的鄭麗文嗎？「對比現今的政壇身影，這段消失的記憶讓人印象深刻」。《沃草》在臉書發文直指「一起協尋鄭麗文！」，指出鄭麗文在1995年擔任台權會秘書長時曾說，台灣人應做自己的主人，更堅決主張：「在中國仍不願放棄武力犯台的主張之前，任何人都不應代表台灣人民與中國進行任何談判」，還曾呼籲中國政府立即停止一切對台灣主權造成威脅的外交和軍事行動，致力於改善中國自己內部的人權問題。請繼續往下閱讀...《沃草》表示，鄭麗文還曾說，台灣人民將義無反顧地維護島國主人的權利與尊嚴不受侵犯。而自欺欺人的大陸政策與統派的投降主義都將使台灣人民的人權成為中國野蠻霸權的盤中飧、俎上肉。他們直呼，「對比現今的政壇身影，這段消失的記憶讓人印象深刻」。    ,https://news.ltn.com.tw/news/politics/breakingnews/5400730
鄭習會落幕卻冷到不行！胡采蘋：連台灣民眾都不太關心,政治,2026/04/11 17:54,國民黨主席鄭麗文與中國共產黨總書記習近平會面。（美聯社）國民黨主席鄭麗文訪中進行「和平之旅」，其中「鄭習會」在昨天落幕。對此，財經網紅胡采蘋表示，鄭麗文去朝拜習近平的關注遠比她想像中少得多，直呼，「就連台灣民眾都不太關心」。胡采蘋在臉書發文表示，鄭麗文去朝拜中共皇帝引起的關注遠比她想像中少得多，根本沒什麼人討論，感覺真的是配合去演戲給中國民眾看，台灣民眾看起來就不太關心，有一種隔壁鄰居跑去中國旅遊的感覺。請繼續往下閱讀...胡采蘋指出，至於鄭麗文見了誰，那是更加不用知道，因為十年以後這些人不是被抓就是被殺。十年前她自己採訪過寫過的金融系統官員，現在一群人關在監獄裡，應該可以住滿台北101了，解放軍那邊可以再住兩棟。她說，十年後的國民黨黨主席如果還要去拜見中國皇帝，也滿有可能還是同一個皇上。    ,https://news.ltn.com.tw/news/politics/breakingnews/5400686
鄭麗文話沒講完就被清場！畫面曝光中國網友金句連連,政治,2026/04/11 17:50,"「鄭習會」昨舉行，外媒報導指出，國民黨主席鄭麗文在尚未讀畢講詞之前，進行直播的記者就被要求離場。（國民黨提供）「鄭習會」昨舉行，外媒報導指出，國民黨主席鄭麗文在尚未讀畢講詞之前，進行直播的記者就被要求離場，這是首次國民黨主席訪中，未在直播鏡頭下讀畢講詞。有網友將獲准採訪台媒捕捉到的現場畫面剪輯曝光，引發中國網友討論。外媒昨日報導指出，鄭麗文在致詞時，話還沒說完現場就進行「清場」，正在拍攝的記者被請離。鄭麗文超過3000字的講稿，大約只有3分之1出現在直播中。報導還引述美國德州山姆休士頓州立大學政治系副教授翁履中分析指出，如果用比較善意的方式來解讀，那就是超過約定好的講話時間後，就會請記者離場；另一種解讀是鄭麗文人氣不夠，中國會覺得自己已經非常給面子了，為何還要講這麼久。請繼續往下閱讀...中國自媒體帳號「財經冷眼」將台媒直播片段上傳至YouTube，可見鄭麗文才剛開始發言，沒多久後，畫面卻突然晃動，接著視角一路向外，可見大量人員離席，才知道是一眾記者被請離。「財經冷眼」也說，這簡直就是一種羞辱，台灣人應該張開眼睛，看清習近平和中共獨裁的本質。影片下方，網友紛紛留言表示：「活該！自找沒趣」、「真丢臉」、「到底要有多利益吸引她，要這般自取其辱」、「自己把臉湊上去被抽」、「真的太扯了」。該影片被轉至X平台後，也引發中國網友討論。不少網友大罵：「傻逼！難道要讓記者全程直播嗎？」、「又在造謠惑眾」、「真他X能造謠」、「閉門會議叫羞辱記者？」突发！习近平公然羞辱郑丽文！多家媒体直播被掐断…. Xi Jinping openly humiliates Cheng Li-wen! pic.twitter.com/MKXMRO3D3D— 新闻调查 （@xinwendiaocha） April 10, 2026 突发！习近平公然羞辱郑丽文！多家媒体直播被掐断…. Xi Jinping openly humiliates Cheng Li-wen! pic.twitter.com/MKXMRO3D3D    ",https://news.ltn.com.tw/news/politics/breakingnews/5400679
「水獺媽媽」獨立書店市集說故事！蘇巧慧：盼打造更友善育兒環境,政治,2026/04/11 17:48,民進黨新北市長參選人蘇巧慧（中）化身「水獺媽媽」，和大小朋友分享本土繪本故事。（記者翁聿煌攝）新北獨立書店「綠書店」於4月11日至12日在中和區4號公園創意廣場舉辦「2026淼渺書市集」，串聯60間獨立書店、出版社、非營利組織參與擺攤，新北市長參選人蘇巧慧11日也以「水獺媽媽」的身分，和大小朋友分享本土繪本故事。蘇巧慧表示，她經營Podcast頻道「水獺媽媽巧巧話」已5年多，至今錄製超過340集繪本故事，她與市集擺攤的許多獨立書店、出版社都很熟悉，為響應今年「淼渺書市集」活動主題「台灣．特有種」，她不僅準備關於台灣特有種的本土繪本故事，還現場上起「台語小教室」，帶領大小朋友學習穿山甲、台灣藍鵲、梅花鹿等台灣特有種動物的台語，許多小朋友踴躍舉手搶答，氣氛溫馨。請繼續往下閱讀...蘇巧慧說，不論是台語、客語、原住民語，甚至是新住民朋友的語言，每一種語言都可以打開一扇新的大門，她認為趁著小朋友還小的時候，多習慣聽故事、摸書本，以及在生活中聽更多不同的語言，也能讓孩子更加習慣世界的多元、多彩。除了和大小朋友說故事之外，蘇巧慧也逛起「淼渺書市集」，不僅與各書店互動、合影，也分享她長期支持台灣文創產業，並率先推動「公共出借權」過程，「公共出借權」政策近期再度因許多圖書作者在社群媒體上分享收到補償酬金的喜訊，重獲社會大眾關注，其實她從2019年就開始推動「公共出借權」，希望藉由引入公共出借權的概念，尊重著作權，並提供著作權人公平的報酬，未來補償酬金也將於3月、9月發放，讓更多創作者受惠。民進黨新北市長參選人蘇巧慧（右）參加中和區4號公園創意廣場舉行的「淼渺書市集」活動。（記者翁聿煌攝）    ,https://news.ltn.com.tw/news/politics/breakingnews/5400717
三重造勢「讓新北更有型」  黃國昌喊做不好隨時打包走人,政治,2026/04/11 17:41,新北市長參選人黃國昌（中）、創黨主席柯文哲（左）誓師大會11日在三重區向日葵廣場舉行，並與新北市議員參選人高呼勝選口號。（記者廖振輝攝）新北市長選戰升溫，民眾黨主席、新北市長參選人黃國昌今日下午在三重舉辦「411讓新北更有型」誓師大會，前黨主席柯文哲站台、館長陳之漢助陣，下午2點活動開始至4點許，現場觀察，未見民眾抗議，但可見部分座位空置。黃國昌在台上激昂喊話「若做不好，隨時打包走人」，柯文哲致詞時支持者也喊出「司法要正義」口號。黃國昌今天下午在三重舉辦誓師大會，除柯文哲到場助陣，妻子陳珮琪、陳之漢、基隆副市長邱佩琳，及新北市議員參選人陳世軒、陳怡君、陳語倢、吳亞倫、陳彥廷、林子宇等人也到場聲援、致詞喊話。不過，下午2點活動開始至4點許，現場觀察，雖未見民眾抗議，但現場也可見部分座位空置。請繼續往下閱讀...網紅四叉貓也在社群平台Threads發文，貼出活動現場的情況。他指到現場拍照時是2點10分，現場大約有1000張椅子，前半區、後半區各500張，但由於前半區椅子都還沒坐滿，他推估現場僅300人。活動接近尾聲，柯文哲上台喊話，支持黃國昌參選的原因很簡單，因為台灣需要新政治，過去30年台灣政治就是藍綠吵吵鬧鬧，雖然有政黨輪替，但問題沒有解決，人民還是面對低薪、高房租、高房價、缺水、缺電、缺工、缺地、缺人才，「唯一沒有缺的是缺德。」台灣不能再等，新北市也不能再等了，人民需要一個政治的新選擇。而黃國昌致詞承諾就任百天內為29區各區解決10個最迫切的問題，也請民眾黨市議員參選人進入議會嚴格監督他，如做不好，他隨時打包走人絕不戀棧。造勢現場未見民眾抗議，但可見部分座位空置。（記者羅國嘉攝）新北市長參選人黃國昌、創黨主席柯文哲誓師大會11日舉行，現場小草支持者聚集。（記者廖振輝攝）民眾黨今日下午在三重舉辦「411讓新北更有型」誓師大會。圖左至右為陳世軒、陳怡君、林子宇、柯文哲、黃國昌、周台竹、陳語倢、吳亞倫、陳彥廷。（記者羅國嘉攝）民眾黨前黨主席柯文哲表示，台灣不能再等，新北市也不能再等了，人民需要一個政治的新選擇（記者羅國嘉攝）館長陳之漢現身助陣。（記者羅國嘉攝）黃國昌致詞承諾就任百天內，為29區各區解決10個最迫切的問題。（記者羅國嘉攝）    ,https://news.ltn.com.tw/news/politics/breakingnews/5400708
