Title,News_Type,date,content,url
APEC峰會月底南韓登場 卓榮泰：領袖代表人選已定,政治,2025/10/03 18:12,立法院會今邀請行政院長卓榮泰率相關部會首長列席報告「中央政府因應國際情勢強化經濟社會及民生國安韌性特別預算案」編製經過並備質詢。（記者塗建榮攝）APEC峰會10月31日至11月1日將在南韓慶州登場，行政院長卓榮泰今天在立法院表示，台灣的領袖代表人選應該是決定了，總統府正在作業。對於立委建議，由有威望的半導體權威人士出任，卓說，相信府方會非常重視這樣的建議。立法院會今天邀請行政院長卓榮泰列席報告「中央政府因應國際情勢強化經濟社會及民生國安韌性特別預算案」編製經過並備質詢。請繼續往下閱讀...民進黨立委邱志偉在質詢時表示，10月底、11月初，APEC將於韓國慶州登場，詢問目前台灣的領袖代表是否已經決定了。卓榮泰回應，「應該是決定了」。邱志偉追問，人選是否跟半導體專業有關，卓榮泰笑回，人選由府方正在作業。邱志偉表示，這一定要跟APEC主辦方先有一些默契，期待是由半導體方面的領導者，或在全球半導體界有聲望的高層，有威望的半導體權威人士。因為很難得有機會跟各國領袖，特別是跟美國總統川普，做一些當面建議或會談。卓榮泰強調，委員這樣的建議，總統府一定非常重視。我方提出適當的人選，都會經過正常的管道，表達參與的意願。熱門賽事、球星動態不漏接    ,https://news.ltn.com.tw/news/politics/breakingnews/5199794
中華電信工會控替人喬升遷 陳玉珍：金門員工陳情遭幹部打壓,政治,2025/10/03 17:17,國民黨立委陳玉珍。（資料照）中華電信工會指控國民黨立委陳玉珍介入員工升遷情事。（讀者提供）〔記者劉宛琳／台北報導〕中華電信工會指控國民黨金門立委陳玉真介入金門區員工升遷情事，要求人事升遷尊重當地主管，不應受外力干涉。對此，陳玉珍回應，許多基層員工多次向她陳情，指若不順從特定幹部意志即遭暗中打壓，升遷無法循正途，形同以權謀私。她身為立委必將仗義執言，嚴格監督個案，督促中華電信公司應依公開、公平、公正的原則，依照年資、積分、績效等正當程序辦理升遷，杜絕任何陽奉陰違、上下其手之不法行徑。中華電信工會以「反對立委介入員工升遷 要求公司拒絕外力壓迫」為題發文，指近期發生金門陳姓立委介入本公司金門地區員工升遷情事，此舉嚴重損害基層員工的升遷權益與職場公平性，工會鄧理事長已強力要求公司，人事升遷須尊重當地主管職權，不受外力介入與干涉，並針對金門地區所屬營運處總經理採取行動，以保護員工權益、維護公司既有體制與公平，確保所有會員的努力和能力，做為升遷的唯一標準。陳玉珍表示，身為金門選出的立法委員，她一向以「捍衛基層、伸張公義」為己任，近日有不實抹黑之言論流傳，她提出四點聲明鄭重澄清。一，工會設立初衷，不容扭曲。工會之存在原本是替天行道、為民喉舌，應當為基層員工爭取合理權益，成為雪中送炭的力量，而不是仗勢欺人的工具，可惜部分不肖工會幹部，卻指鹿為馬、上下其手，濫用權柄，干涉升遷，甚至結黨營私、拉幫結派，嚴重打擊員工士氣。第二，基層心聲不容忽視。許多基層員工多次向她陳情，指出若不順從特定幹部意志，即遭暗中打壓、橫加阻撓，升遷無法循正途，形同以權謀私。這種打人喊救人的行徑，實為踐踏公平，背離工會初衷。第三，立委責無旁貸，必嚴格監督。她身為金門的立法委員，必將仗義執言、鐵面無私，嚴格監督個案，並督促中華電信公司應依公開、公平、公正的原則，依照年資、積分、績效等正當程序辦理升遷，杜絕任何陽奉陰違、上下其手之不法行徑。第四，與基層同心，決不退讓。陳玉珍重申，她必定立場堅定、寸步不讓，與最辛苦的基層員工站在一起。凡涉及打壓與不公，必會拔劍而起、奮力捍衛，讓基層員工安心打拚，不再受制於權力角力。她以最嚴正的態度，對金門鄉親、對基層員工承諾公平正義，不容踐踏。熱門賽事、球星動態不漏接    ,https://news.ltn.com.tw/news/politics/breakingnews/5199671
急轉彎！中秋連假 「南寮運動公園」爆竹煙火施放最晚到22時,政治,2025/10/03 16:58,新竹市府政「南寮運動公園」燃放炮竹煙火時段。（新竹市府提供）新竹市消防局日前公告，中秋連假10/4～10/6「南寮運動公園」可燃放炮竹煙火，甚至可一路放到凌晨1點，引發南寮居民不滿，市議員劉康彥等民代也抗議。消防局今指出，將取消延長施放時段，修正為4日至5日的6時至22時，開放民眾施放一般爆竹煙火。劉康彥指出，市府及消防局竟主動公告，開放所有民眾10/4～10/6三天連假可到「南寮運動公園」燃放炮竹煙火，甚至可一路放到凌晨1點，燃放炮竹煙火造成的空盒、碎屑，至少還可以善後，關鍵在於，公園裡有樹木、草皮、兒童遊戲器材、籃球場，更緊鄰住宅區，若不慎造成災害財損或人員意外，豈是市府一句「由施放人員負責」可推託？這是犧牲南寮居民安全與安寧，居民都表達嚴正抗議。請繼續往下閱讀...消防局表示，決定順應民意，取消中秋延長煙火施放並加強安全維護，且考量6日為連假最後1日，依據《新竹市爆竹煙火施放管制自治條例》第6條規定，修正於10月4日至5日的6時至22時，開放民眾施放一般爆竹煙火。而市府規劃的合法施放區域位於東大路四段、榮濱路及西濱路一段範圍內，嚴禁民眾在區域外施放爆竹煙火。將派消防人員及車輛現場駐守，確保安全管制與應變作業。熱門賽事、球星動態不漏接    ,https://news.ltn.com.tw/news/politics/breakingnews/5199665
鍾沛君惹怒災民！網發起抵制她老公居酒屋：反正不會餓死,政治,2025/10/03 16:53,台北市議員鍾沛君。（資料照）花蓮縣光復鄉上週因堰塞湖溢流遭受重創，有網友質疑「一堆便當放到臭掉」，卻有很多人沒吃到飯。不料，國民黨台北市議員鍾沛君卻表示「災民和志工有哪個是因為沒吃便當餓死嗎？」對此，有網友發起抵制鍾沛君老公開的「一氣水產居酒屋」：「因為看起來，她與她老公也不會餓死。」日前有網友質疑花蓮縣政府救災資源分配不均，一堆便當放到臭掉，卻有一票人吃不到飯，不過，鍾沛君在政論節目《新聞面對面》表示，「我們可以繼續在這裡爭執那1萬個便當浪費掉多可惜，縣府怎麼樣沒有把這些便當送到人民手中。那我就問一句，目前為止不管是災民或志工，有哪個人因為沒吃便當餓死嗎？沒有。」言論一出，引發爭議。請繼續往下閱讀...對此，有網友在Threads上發文表示 ，鍾沛君事後拒絕承認失言，反而把焦點拉回到「撤離不當」的責任問題，試圖把自己塑造成「直指問題核心」的議員，但問題是她先前那句話已經傷害了災民的感受，讓人覺得她缺乏同理心。該網友並表示，「所以，我想大家不要去她老公開的餐廳吧，因為看起來，她與她老公也不會餓死。」貼文下方，網友紛紛留言表示：「沒有人因為沒吃一氣水產餓死，所以不去也沒差吧」、「剛剛才看到食材不新鮮的串文」、「抵制，幫牠們別賺太多錢累死」、「這輩子都不吃這間也不會餓死」、「就算是他們的店倒掉，他們也不會餓死對吧」、「沒去給他的店留負評，算很客氣了」。熱門賽事、球星動態不漏接    ,https://news.ltn.com.tw/news/politics/breakingnews/5199421
日媒揭露台日海巡演訓常態化 管碧玲：樂見日本積極揭露,政治,2025/10/03 16:53,針對日媒揭露台灣海巡今年曾派「雲林艦」與日本海上保安廳聯合訓練，未來也不排除將常態化。海委會主委管碧玲3日答詢說，樂見日本更願意積極揭露。（圖取自國會頻道）針對日媒「讀賣新聞」披露台日海巡強化合作、甚至考慮與美國常態性聯合演習議題，海委會主委管碧玲今（3）日下午答詢指出，台日之間合作過去多由日方揭露，「我們樂見日本更願意積極揭露」。立法院會今邀請行政院長卓榮泰及相關部會首長列席報告「中央政府因應國際情勢強化經濟社會及民生國安韌性特別預算案」編製經過並備質詢。請繼續往下閱讀...民進黨立委王定宇詢問管碧玲，對日媒揭露台日美海巡可能常態性聯合演習有何評論？管碧玲說，相關行動揭露過去多由日方揭露，「我們樂於看到日本更願意積極揭露」。管碧玲指出，相關演習大致分布在南海、北方日本及南方菲律賓。王定宇追問，過去的台日或台美聯合海巡演習地點多在南太平洋或日本周邊海域，是否有可能在台灣周邊進行？由於質詢時間剛好結束，管碧玲笑而未答，僅說再跟委員報告。熱門賽事、球星動態不漏接    ,https://news.ltn.com.tw/news/politics/breakingnews/5199621
美國政府關門影響關稅談判？卓榮泰：爭取月底前有結論,政治,2025/10/03 16:42,民進黨立委王定宇3日關切台美關稅談判期程，是否會受美國聯邦政府關門影響？行政院長卓榮泰回應。（圖取自國會頻道）立法院今（3日）審查「中央政府因應國際情勢強化經濟社會及民生國安韌性特別預算案」，民進黨立委王定宇關切台美關稅談判是否受美國政府關門影響，行政院長卓榮泰表示，台美雙方已完成技術性磋商，正等待最後總結會議，雖未談定最後期限，但行政院也朝10月底前達成結論的方向努力。王定宇指出，美國聯邦政府因預算撥款不足暫時關門，75萬名聯邦僱員停擺，甚至連台灣的AIT官方email與網站都暫停部分服務。他質疑，這是否會拖延原本預計10月內完成的台美關稅談判結論，恐影響台灣眾多產業與勞工。請繼續往下閱讀...卓榮泰回應，目前雙方已完成最後的技術性磋商，但總結會議尚未召開，美方因內部情勢確有不確定性，「一個政府不會長時間停滯」，我方仍持審慎樂觀態度。卓榮泰並強調，據政院副院長鄭麗君訪美回報消息，雙方雖無設定最後期限，但都有共識儘快完成協議。他指出，若以10月底作為目標，「足以讓雙方政府在最後階段做更多準備，達成最後協議，我們也朝這個方式來進行」。王定宇追問，可否解讀為行政院期待10月底前有結論？卓榮泰回應：「我認為我們的產業界跟國人都很期待趕快定案下來」，落點確定後，產業支持方案才能全力啟動。王定宇也提醒，與美國或其他國家談判都有保密默契，但在不違反原則下，行政院應盡量讓業者知悉進度，避免中小企業因備料、產能閒置與待命開工問題受衝擊。卓榮泰則回應，行政院已透過產業座談向業者說明因應方式，並會持續努力讓各界掌握狀況。熱門賽事、球星動態不漏接    ,https://news.ltn.com.tw/news/politics/breakingnews/5199651
自由說新聞》災民「怒槓花縣府」季連成霸氣回應！吐金句網「四字」狂讚,政治,2025/10/03 16:37,全新的視界！新聞話題不漏接，快訂閱YouTube 【自由追新聞】，記得開啟小鈴鐺哦！熱門賽事、球星動態不漏接    ,https://news.ltn.com.tw/news/politics/breakingnews/5199634
國民黨主席選舉 被爆候選人未完成資格審查,政治,2025/10/03 16:27,前國民黨副秘書長張雅屏，擔任這次國民黨主席選舉中央選舉監察委員。（資料照）擔任這次國民黨主席選舉中央選舉監察委員的前國民黨副秘書長張雅屏今日在臉書發文質疑，中央選舉監察委員會在9月20日召開黨主席候選人資格審查會議，當時的選監委員都尚未經中常會通過，「開會當下9位委員皆僅是委員提名人」，直到9月24日中常會通過後，9名委員才算完成任命程序，「法規上並沒有明定可以追認完備程序」。據此，張雅屏進一步質疑，中央選舉監察委員會9月20日開完會先行公告的候選人名單，以及後續抽籤等程序的會議紀錄，應該盡快召開第2次已經完成中常會任命後的選舉監察委員會，以確認上次會議紀錄，才算完備候選人資格審查的法定程序，此事他已經在9月22日向黨中央反映，但迄今黨中央仍未召開第2次選舉監察委員會，「望請國民黨選務主辦單位，不要誤人誤己」，並留下「以上，公開示眾 留下紀錄」等文字。請繼續往下閱讀...張雅屏指出，今年是他繼2021年後，再一次接受候選人推薦擔任國民黨中央選舉監察委員，政黨辦理負責人等選任人員選舉，應公告選舉作業相關事宜，並載明起止時間、作業流程、候選人資格及有投票資格之人之認定等事項，選舉作業公告後應於5日內報請主管機關備查，而且候選人資格與投票資格認定事項，應依照公告辦理，如果有變更，也應該送主管機關備查，例如原定6月18日到期截止的有效黨權黨費繳納截止日，又延後改到9月10日的這個變更。他強調，政黨負責人選舉，不能算是家務事，而是涉及公眾利益的事，黨內的承辦人與主辦單位，千萬不要把這些作業程序，當作黨內的事情自己說了算，還是要照自己的選舉作業細則，需要選舉監察委員會討論通過的還是得送委員會處理，「尤其是，每次的會議紀錄需下次會議確認上次會議紀錄，以避免因委員聘任與會議辦理的時間差，導致會議結論的效力產生疑慮，真的不要便宜行事。」張雅屏打開天窗說亮話稱，「就是0920召開的黨主席候選人資格審查會議，當時的選監委員尚未經過中常會通過，開會當下9位委員皆僅是委員提名人。直到0924中常會通過之後，9位委員才完成任命程序。法規上並沒有明定可以追認完備程序。」他主張，9月20日開完會先行公告的候選人名單，以及後續抽籤等程序的會議紀錄，應該盡快召開經完成任命後的選舉監察委員會以確認上次會議紀錄，才算完備候選人資格審查的法定程序。熱門賽事、球星動態不漏接    ,https://news.ltn.com.tw/news/politics/breakingnews/5199505
傳內部民調鄭麗文領先！郝龍斌回參考就好、蔡志弘籲勿受選戰工具影響,政治,2025/10/03 16:19,國民黨黨主席6位候選人日前在彰化縣參加交流會，6人首次同框。（資料照，記者劉曉欣攝）針對近日傳出藍營內部有一份全黨員民調，國民黨主席候選人鄭麗文以30％的支持度大幅領先其他對手，郝龍斌17.4％居次，羅智強16.3％排名第三，國民黨主席候選人蔡志弘今日表示，很多民調早已成為「選戰工具」，他呼籲國民黨黨員千萬不要受到民調數據的影響；另一位候選人郝龍斌則說，自己只重視黨員投票這個民調，「其他委託者不明的民調，參考就好。」在該民調中領先的鄭麗文今日下午出席榮光社會工作基金會慶祝國慶聯誼餐會受訪說，對於每份民調結果都會積極參考，雖然該份所謂全黨員民調顯示自己領先對手，但未表態者比例還佔3成，足以影響最後投票結果，因此她會繼續努力，務必要在18日順利當選。請繼續往下閱讀...蔡志弘以立法院長韓國瑜2017年9月南下參選高雄市長為例表示，當時有誰能夠料想到韓國瑜當選高雄市長？當年高雄市長選舉後期，民調成為有心人士的選戰工具，某親綠電視台在2018年11月13日公布民調，陳其邁支持率43.6％、韓國瑜40.5％，但11月24日投票結果揭曉，韓國瑜卻以89萬2545票大贏陳其邁的74萬2239票，2021年國民黨主席選舉TVBS民調中心所做國民黨員手機調查，當時的候選人張亞中30.6％、朱立倫27.5％，但開票結果卻是朱立倫以8萬5163票大贏張亞中的6萬631票，他呼籲聰明的黨員千萬不要受到民調數據影響，要根據候選人的政見，在18日選出心目中最適合的黨主席人選。熱門賽事、球星動態不漏接    ,https://news.ltn.com.tw/news/politics/breakingnews/5199477
新北市三芝衛生所狹窄老舊 鄭宇恩籲與消防局改建共構,政治,2025/10/03 16:14,三芝衛生所。（資料照）新北市議員鄭宇恩今天質詢表示，三芝區還會再增2個大型長照機構，但當地醫療資源稀缺，肩負醫療重任的三芝衛生所老舊狹窄，盼與旁邊消防局改建共構。鄭宇恩表示，三芝未來將會增加2個大型長照機構，全滿預計將服務一千多名長輩，但北海岸就醫不易，三芝僅有2間診所，醫療量能仰賴現況老舊、擁擠的衛生所一樓，長輩頻頻抱怨到衛生所看病被趕來趕去，而眼科、代謝科等科別都用巡迴方式而非常駐門診，試問究竟有無機會改建衛生所？旁邊消防局也有整間意願，盼2局共商整合改建、共構。請繼續往下閱讀...衛生局長陳潤秋回應，衛生、消防局目前正在商議此事，也正在接洽以老人醫學為主的關渡醫院，市府盼其進駐長照機構可開放一般民眾掛號。市議員顏蔚慈則說，台灣長輩失智症盛行率達7.99%，推估新北市失智人口約5.5萬人，失智者平均每人每年總醫療費用達53萬元，因此及早發現、檢測、轉介尤為重要，市府佈建5000多個失智友善守護站，由各區衛生所協助轉介，考核上卻有9個衛生所轉介率不及格。陳潤秋說明，失智友善守護站為民間商家、企業等自發響應參與，經由衛生局訓練後，協助發掘社區疑似失智症個案轉介至轄區衛生所，過往因轉介需個案個資，守護站取得不易，衛生局已簡化資料需求，希望讓守護站通報更容易。新北市議員質詢鄭宇恩、顏蔚慈關心長輩就醫、失智症等議題，衛生局長陳潤秋答詢。（記者黃子暘攝）熱門賽事、球星動態不漏接    ,https://news.ltn.com.tw/news/politics/breakingnews/5199516
國民黨一條龍甩鍋中央 陳柏惟：為「傅」新詞強說愁,政治,2025/10/03 15:42,前立委陳柏惟。（資料照）樺加沙颱風挾帶豪雨釀災，導致花蓮光復鄉堰塞湖溢流，國民黨智庫副執行長凌濤昨質疑內政部延遲發布紅色警戒通報長達13小時。對此，前立委陳柏惟表示，在國民黨一條龍的惡意扭曲之下，硬將「白白布染黑」，議員、立委、副總統候選人與媒體為了轉移對花蓮縣政府的監督，為「傅」新詞強說愁，要吵，等忙完再吵，現在最不需要的是口水。陳柏惟在臉書PO文表示，國民黨正事不幹，浪費口水狂噴不同意見，因說明過後，趙少康、葉元之等人繼續惡意造謠，必須再次發文以正視聽，花蓮水災發生後，我們在實務中不斷為災民發聲，在民間募集資源，也不斷建議國軍妥善分配資源；媒體上除了政治攻防，更多的是爬梳歷史，反映現況。請繼續往下閱讀...陳柏惟指出，在國民黨一條龍的惡意扭曲之下，硬將白白布染黑，議員、立委、副總統候選人與媒體為了轉移對花蓮縣政府的監督，為「傅」新詞強說愁，以及議員失言說鏟子超人沒紀律跟編組，用沒當兵經驗的經驗法則，要求全國軍人進駐災區民宅，硬把我沒說的話跟國軍的紀律規則扭曲的臭不可聞。陳柏惟指出，他再次說明，該片段是強調「過去」國軍與志工的任務編組與分工，國軍與大型機具清除道路，志工在居民同意情況下進入家戶支援，語句如此，語意也是如此，不知道你們哪個字看不懂，變造我的語意不會改變花蓮的現況，你們明明有傅崐萁跟徐縣長的聯絡方式，這幾天的烏龍新聞只證明國民黨寧願把口水浪費在他們的眼中釘身上，而不敢把他們愚蠢的建議真的跟花蓮縣府溝通，想掩蓋「烏龍預警、調度失誤、撤離不實、物資屯積浪費，便當沒有餓死人」等話語，因為他們自己也知道自己做不好。陳柏惟直言，他們一言一行都希望資源分配與執行能夠最佳化，「要吵，等忙完再吵，現在最不需要的是口水，以上報告。」熱門賽事、球星動態不漏接    ,https://news.ltn.com.tw/news/politics/breakingnews/5199346
綠議員質疑中捷藍線開工造假 盧秀燕：我第一個完整規劃路網,政治,2025/10/03 15:21,台中市長盧秀燕表示，中捷7線齊發是可行性研究，她是歷任市長第一個把捷運路網規劃出來，不是傳統的土木動工才叫動工，開工才能發包。（記者蔡淑媛攝）台中市長盧秀燕喊出捷運7線齊發、並在6月舉行藍線開工典禮，市議員陳淑華、陳俞融、張家銨今天在議會質詢藍線機電標開工，僅在架圍籬、整理環境和探勘，車站也在設計階段，都市設計、土地徵收都沒進行，痛批根本在作秀、話術誆騙市民，還反指中央補助款縮水。盧秀燕則反擊，她是歷任市長第一個把捷運路網規劃出來，強調不是傳統的土木動工才叫動工，開工才能發包。陳淑華今在議會專案報告指出，台中捷運藍線進度明顯落後，藍線主體土建工程，第一標車站設計只進行期中報告，明年才可能辦招商、招標，第二標、第三標才要開始設計，根本不需經費建設，而中央是按照實際工程進度補助，盧市長竟謊稱中央倒扣40幾億，是造謠、抹黑。請繼續往下閱讀...陳俞融則指，藍線機電標開工，目前進度僅僅龍井機廠架圍籬、整地和探勘，車站也還在設計階段，藍線工程僅在車站設計，其他6線也全在可行性研究，盧市長竟大作開工秀、喊7線齊發，結果只作秀超前。張家銨也表示，盧秀燕6月26日在綠線市府站辦藍線機電開工典禮，因為市府根本在8月18日才公布實施土地變更，還喊出7線齊發，根本是話術、誆騙市民，用虛假來包裝的開工秀。盧秀燕則坦承，中捷7線齊發是可行性研究，她是歷任市長第一個把捷運路網完整規劃出來；強調未來路線規劃要完整，有幾條線要搞清楚，現在可行性研究出來了，不是紙上畫畫，都要送交通部評估。盧秀燕答詢說，藍線機電工程一次發包就成功很難得，不是傳統的土木動工才叫動工，要開工才能發包，選在市府站也是因為這是藍綠線交會處。台中市捷運工程局長蘇瑞文表示，目前藍線土建標第一標正在做高架站設計，B01到B09，現正期中報告，年終期末後要開始招標等作業，第二標是車站地下段B09到B14站，第三標是B15到B20站，明年才會進行期中報告。市議員陳淑華、陳俞融今天在議會質詢藍線機電標開工，僅在架圍籬，車站也在設計階段，都市設計、土地徵收都沒進行，痛批根本在作秀、話術誆騙市民，還反指中央補助款縮水。（記者蔡淑媛攝）中捷除藍線完成綜合規劃核定，其他6線都是可行性評估。（陳俞融提供）中捷藍線目前進行車站設計，未進行到都市設計、土地徵收。（市府提供）熱門賽事、球星動態不漏接    ,https://news.ltn.com.tw/news/politics/breakingnews/5199369
藍營人士發聲！黃國昌爭議延燒 陳學聖：政治倫理不該允許,政治,2025/10/03 15:09,"國民黨前立委陳學聖。（資料照）民眾黨主席黃國昌被爆料指揮狗仔跟監政敵，爭議持續延燒。國民黨前立委陳學聖，近日在政論節目中表示，這件事讓他對新聞倫理已經失去了判斷的基準。他還說，這件事就政治倫理來講，這不應該被允許。陳學聖近日在政論節目中表示，這件事情鬧這麼久，讓他對很多新聞倫理失去了判斷的基準。「政媒本來就不能夠雙棲，」陳學聖表示，如果黃國昌在2024年當立委以前，不管要怎樣養狗仔跟監，都沒問題，因為他是一般的人，只要不違法就行。請繼續往下閱讀...「但是你2024年以後，如果繼續做這件事，不管是不是要反制，這就叫做政治跟監，」陳學聖說，跟監的對象可能是政敵或是同黨的人，這樣收集的目的，就政治倫理來講，是不應該被允許，就新聞倫理來講，更不應該有這樣的事情出現。熱門賽事、球星動態不漏接    ",https://news.ltn.com.tw/news/politics/breakingnews/5199472
