Title,News_Type,date,content,url
中央社提告謝幸恩背信  黃國昌嗆：民進黨有事衝我來,政治,2025/10/01 16:53,中央社今發布聲明宣告，已向台北地檢署對謝幸恩提起背信等罪刑事告訴。對此，民眾黨主席黃國昌怒嗆，「民進黨有事衝著我來，去追殺這些無辜的小記者做什麼？」（記者羅沛德攝）民眾黨主席黃國昌遭指控涉及指揮狗仔跟拍政敵，其中中央社前北檢線記者謝幸恩不僅是狗仔成員之一，更以假名在黃所配合的媒體撰稿；謝近日請辭後，中央社今發布聲明宣告，已向台北地檢署對謝提起背信等罪刑事告訴。對此，黃國昌怒嗆，「民進黨有事衝著我來，去追殺這些無辜的小記者做什麼？」黃國昌表示，中央社告自己旗下記者，大家什麼時候聽過這種事，就因為她在外面兼差？國家機器又動起來、發動黨檢媒三位一體的操作又發動了，「民進黨有事衝著我來，去追殺這些無辜的小記者做什麼？」請繼續往下閱讀...另，針對民進黨立委林楚茵指出，蕭依依2023年8月獨家報導總統參選人郭台銘不公開行程，質疑跟監郭是否也是黃國昌指示。對此，黃則說，他不曉得怎麼回應這種毫無事實根據的潑糞，他覺得很奇怪，這是綠色律師的言論自由嗎？黃國昌也不滿抱怨，鏡週刊昨天指涉他的姻親設立凱思國際公司，但到底是哪個姻親？鏡週刊也沒有要回答這個問題，告訴我到底是哪個姻親設立？（昨日鏡週刊早已揭露黃利用姻親李麗娟當人頭，成立凱思國際公司支付狗仔薪水。）熱門賽事、球星動態不漏接    ,https://news.ltn.com.tw/news/politics/breakingnews/5197223
新北議員批黃國昌違法跟監政敵 侯友宜：爭議應回歸法律解決,政治,2025/10/01 16:45,新北市議員顏蔚慈呼籲從政人物要有高度與標準，不該為政治利益跨越紅線。（記者羅國嘉翻攝）民眾黨主席黃國昌指揮「狗仔集團」跟拍疑雲持續延燒，外界質疑此事件是否影響藍白合。新北市議會今（1日）市長施政報告中，議員顏蔚慈就此相關議題向市長侯友宜發問，並點名政治人物不該利用狗仔攻擊政敵；侯友宜回應說，跟監行為必須合法，相關爭議應回歸法律解決。針對近期藍白合議題，顏蔚慈當場詢問侯友宜是否曾遭狗仔跟蹤，侯友宜回應「我又沒有做什麼壞事，狗仔跟我沒用啊，我就上班，下班就回家，但如果狗仔願意跟也開心。但這點跟市政議題沒關係。」顏則說「看來侯不是黃國昌的政敵。」請繼續往下閱讀...顏蔚慈也詢問侯「做為政治人物，但是養狗仔集團去跟蹤政敵做政治攻擊，你的態度？」侯說，不要違法犯紀最重要，再者若涉及跟監行為也必須合法，這就是證據力的問題，但相關爭議應回歸法律解決。顏蔚慈直言，侯仍在幫藍白合擦脂抹粉，認為黃國昌這行為是合理的；侯友宜說「實際的證據力還不夠了解，且對這新聞沒什麼興趣，自己做好就好。」顏蔚慈指這件事情對新北很重要，政壇要抱持一定的標準，這種養狗仔集團，去針對自己的政敵，相信藍白再怎麼合也不樂見，提醒潛在黃國昌政敵的副市長劉和然，看身邊有沒有狗仔跟蹤。最後她呼籲從政人物要有高度與標準，不該為政治利益跨越紅線。相關行為若持續延燒，恐讓藍白合議題在新北發酵。熱門賽事、球星動態不漏接    ,https://news.ltn.com.tw/news/politics/breakingnews/5197211
指謝幸恩辭職必有高人指點！ 吳思瑤：唯有司法可查出真相,政治,2025/10/01 16:36,民進黨中常會，民進黨立委吳思瑤受訪。（記者王藝菘攝）民眾黨主席黃國昌指揮狗仔集團疑雲延燒，《中央社》提告前記者謝幸恩背信等罪。對此，兼任民進黨政策會執行長的立委吳思瑤今（25日）表示，這是一個分工綿密、部署浩繁的偷拍集團，共犯橫跨各領域及跨黨派立委，而謝幸恩的辭職背後必有高人指點，可能是為了規避調查，唯有司法調查權可讓真相水落石出。《中央社》今天發聲明表示，已於上午赴台北地方檢察署對謝幸恩提起背信等罪的刑事告訴，後續並將針對其侵害本社名譽一事，提起相關民事訴訟。至於謝在任職期間的行為，是否涉及違反本社相關規定，目前已交由調查委員會處理。請繼續往下閱讀...對此，吳思瑤今天出席民進黨中常會後受訪表示，她非常支持，並會全力持續監督，因為中央通訊社拿的是國家的預算，理應栽培出最具媒體意識、公正報導的專業媒體人，沒想到卻淪為打擊政敵的偷拍集團共犯。吳思瑤質疑，謝幸恩的辭職背後必然有高人指點，可能是為了規避《中央社》的調查，但即便辭職，謝仍需接受《中央社》相關權利義務之間的調查，而司法是最好的方式。至於相關跟拍案件，吳思瑤說，這當然是非常分工綿密、部署浩繁的偷拍集團，共犯甚至橫跨媒體界、司法界、以及跨黨派立委，彼此支援擔任爆料攻擊手，要破解當然就得透過司法力量，呼籲相關當事人基於捍衛隱私權，應當勇於站出來提告，唯有司法調查權可以讓真相水落石出，讓黃國昌或謝幸恩等涉案者無法指鹿為馬、轉移焦點。熱門賽事、球星動態不漏接    ,https://news.ltn.com.tw/news/politics/breakingnews/5197170
轟中國扭曲2758號決議 !外交部千字文怒批：聯合國秘書處偏頗無能,政治,2025/10/01 16:32,外交部重申聯合國大會第2758號決議文無涉台灣，也未排除台灣國際參與。（本報合成）中國長期扭曲聯合國大會第2758號決議文，意圖包裹其所謂「一中原則」打壓台灣國際參與及主權地位，中國外交部昨（9月30日）再次發布相關文件企圖混淆視聽，外交部今（1日）以逾千字新聞稿分析並打臉中方說法，重申2758無涉台灣，也未排除台灣國際參與，重申二戰後的「舊金山和約」已取代戰時「開羅宣言」等文件，並未將台灣交給中國。中國外交部30日發布「中方關於聯大第2758號決議的立場文件」，再次扭曲該決議並包裹偷渡其「一中原則」三段論立場。針對中方再發謬論，我國外交部今天發布近1500字新聞稿詳細論述，除打臉中方說法外，也對其表達最嚴厲的譴責。請繼續往下閱讀...面對中國意圖以2758偷渡「一中原則」，並試圖以所謂「繼承論」等法律戰打壓台灣主權，外交部指出，中方聲稱2758「確認並體現所謂一中原則」，並「從政治上、法律上及程序上徹底解決包括台灣在內全中國在聯合國的代表權問題」，是刻意誤導國際視聽，意圖為其改變台海現狀、未來武力侵犯台灣創造法理基礎。外交部強調，中國未曾統治台灣，兩岸互不隸屬，不僅是現狀也是國際社會公認的事實，唯有台灣的民選政府可以在聯合國體系及多邊國際機制代表台灣2300萬人民。外交部重申，中國惡意將2758號決議與其所謂「一中原則」掛勾，事實上該決議只決定「將蔣介石代表從其在聯合國及其相關組織中非法佔據的地位驅逐」，全文未曾提及台灣，更從未認定台灣主權歸屬，當然不可能聲明台灣是中國的一部分，在法理上也為授權中華人民共和國代表台灣及台灣人民。外交部痛批，中國錯誤詮釋聯大2758號決議，用以論證國際已形成「一中原則」，不僅是顛倒是非、荒謬至極，更凸顯中國意圖破壞以規則為基礎的國際秩序。外交部說，相關爭議應正確理解為，2758號決議無涉台灣，也並未排除台灣參與聯合國體系及其他多邊論壇。中國為孤立台灣故意誤用該決議，曲解他國政策，意圖限縮各國自由選擇的權利，其作為與「聯合國憲章」的普遍性原則相互矛盾；同時，中華民國台灣與中華人民共和國互不隸屬，後者更從未統治過台灣，唯台灣民主程序所選出的政府，才有權在聯合國代表台灣。外交部繼部長林佳龍7月提出論述後，再次強調，二戰結束後具國際法效力的「舊金山和約」，已取代「開羅宣言」及「波茲坦公告」等政治聲明。舊金山和約並未將台灣交給中華人民共和國，中華人民共和國從未統治過台灣。外交部指出，台灣自1980年代中期開始，由下而上推動政治自由化與民主化的轉型，並在1996年完成首次總統直選，至此中華民國政府的中央行政、立法代表皆由台灣人民選出，從此成為有效統治，並對外代表台灣的唯一合法政府，也確立中華民國台灣與中華人民共和國對等存在、互不隸屬的現狀，已是客觀的事實。外交部續指，此後中華民國台灣歷經2000年、2008年及2016年的三次政黨輪替，持續鞏固台灣的民主體制與主體意識，也反映出台灣人民對於追求自由與民主的堅定信念與意志。外交部也批評，聯合國秘書處長期屈從中國，錯誤詮釋聯大第2758號決議，打壓中華民國台灣的國際參與，意圖限縮各國自由選擇的權利。此舉不僅與「聯合國憲章」堅持的普遍性原則相互矛盾，更凸顯聯合國的偏頗與無能。外交部嚴正聲明，中華民國台灣與中華人民共和國互不隸屬，中華人民共和國更無權在國際社會上代表台灣。針對中方近來大肆進行不實的「法律戰」，以強化其「台灣問題內政化」的論據，意圖改變區域現狀並合法化其侵略行徑，破壞和平穩定。外交部強調，台灣作為國際社會負責任的成員，除將持續維護現狀外，也鼓勵更多夥伴國家明確反制中方的不實論述，台灣將持續與理念相近國家密切合作，共同確保區域及台海的和平，以及印太地區的安全繁榮。圖為聯大第2758號決議中文版內容。（資料照）熱門賽事、球星動態不漏接    ,https://news.ltn.com.tw/news/politics/breakingnews/5197133
高雄民主之路特展登場 權復會：10/18舉辦「名譽回復典禮」,政治,2025/10/01 16:31,威權統治時期國家不法行為權利回復基金會承辦的「裂痕與光：高雄民主之路特展—二二八、白色恐怖與美麗島事件的歷史現場」今天在高雄捷運美麗島站開展。（圖由權復會提供）為促進轉型正義深化，威權統治時期國家不法行為權利回復基金會承辦的「裂痕與光：高雄民主之路特展—二二八、白色恐怖與美麗島事件的歷史現場」今天在高雄開展，10月18日也將於高雄捷運美麗島站舉行「平復國家不法暨頒發名譽回復典禮」。權利回復基金會今日指出，為加強地方對於威權統治時期歷史的認識，由行政院指導，內政部、法務部主辦，高雄市政府、高雄市文化局、高雄市立歷史博物館、二二八事件紀念基金會協辦，權利回復基金會承辦的「裂痕與光：高雄民主之路特展—二二八、白色恐怖與美麗島事件的歷史現場」正式開展，展期自2025年10月1日至10月31日，於美麗島捷運站長廊（往5/6/7/8出口通道）展出。本次展覽介紹二二八事件於高雄的時序，以及高雄五處與白色恐怖相關的民主地景，並帶出台灣轉型正義的歷程。請繼續往下閱讀...權利回復基金會說明，「二二八在高雄」的展示內容中，可以看見二二八事件於高雄的發生經過，以及事件期間，高雄火車站所扮演軍民衝突點的重要角色。「高雄五處民主地景」，則分別介紹大榮中學、鳳山招待所、柯旗化故居、橋頭余登發紀念館、美麗島圓環等白色恐怖期間的重要座標。最後，以「回望傷痕，落實轉型正義」為題，敘述台灣自民主化以來轉型正義的推動時間軸，期待參展民眾對於台灣轉型正義的發展脈絡有初步的理解。權利回復基金會提到，為使觀眾更深入理解展覽內容並親臨歷史現場，本次活動搭配2場導覽行程。導覽時間為10月19日（日）與10月25日（六）14:00-16:00，路線為從展場開始，一路走到柯旗化故居參訪。每場次導覽限額20名，有意參與者歡迎至權復會粉絲專頁報名。除展覽外，平復國家不法暨頒發名譽回復典禮亦將於10月18日（六）於高雄捷運美麗島站舉行。熱門賽事、球星動態不漏接    ,https://news.ltn.com.tw/news/politics/breakingnews/5197151
出席德國國慶酒會 朱立倫：樂見與德國關係全方位深化,政治,2025/10/01 16:26,"國民黨主席朱立倫與新任德國在台協會處長狄嘉信。（國民黨提供）國民黨主席朱立倫9月30日晚上應邀出席2025德國國慶酒會，並向新任德國在台協會處長狄嘉信（Karsten Tietz）以及薩克森邦總理克里契麥（Michael Kretschmer）致意，朱立倫表示，非常歡迎狄嘉信派駐台灣，並期待在狄嘉信的帶領下，國民黨與台灣社會各界和德國開展廣泛交流。朱立倫回顧，1年多來，國民黨與德國基督教民主聯盟（CDU-CSU）、青年聯盟（Junge Union）、艾德諾基金會（Konrad Adenauer Stiftung,KAS）數次深度交流，9月16日他接見德國薩爾蘭（Saarland）邦的「聯盟基金會」（Union Stiftung）青年領袖訪團，則是在青年、地方政府層級開創新局，深化雙邊關係。請繼續往下閱讀...朱立倫提到，德國與台灣共同面對國家安全、能源供應、經濟發展，民粹主義等重大挑戰，德、台雖然政治體制不同，但國民黨與基督教民主聯盟同為國際民主聯盟（IDU）的重要成員，共享民主價值，近年累積深厚的政黨互訪、青年交流情誼，在多變的國際局勢下更顯珍貴。朱立倫表示，期待狄嘉信帶台灣企業到德國、到歐洲拓展商務，更期待他讓更多德國企業、智庫學者、青年來台灣訪問。熱門賽事、球星動態不漏接    ",https://news.ltn.com.tw/news/politics/breakingnews/5197136
奧地利友台協會主席：增國防預算非常必要 才能阻止非民主陣營不友善行動,政治,2025/10/01 16:24,立法院長韓國瑜接見「奧地利跨黨派國會議員訪問團」奧地利友台協會艾蒙主席一行人。（記者叢昌瑾攝）奧地利友台協會主席艾蒙（Werner Amon）率領的「奧地利跨黨派國會議員訪問團」今天下午拜訪立法院，艾蒙指出，現在許多的國家、政府，都在增加國防預算，這是非常必要要做的事情，才能阻止另一方非民主陣營採取不友善的行動，也許另一方陣營，沒有與我們共享相同的民主、法治、人權的價值，更重要的是理念相近的國家要通力合作，全球民主陣營居於少數劣勢，這個時機點必須要更緊密的合作。艾蒙說，訪團來台的時機點面臨許多挑戰，現在的世界面臨艱鉅的威脅，還有不同的狀況要應對，奧地利距離烏克蘭並不遙遠，因為現在俄國入侵烏克蘭的局勢及戰爭，整個歐洲都受到影響，非常重要的事情是，好像看到新的世界秩序，也就是說整個威權主義的陣營非常難以預測，相信在這個面向台灣非常清楚。請繼續往下閱讀...立法院長韓國瑜說，艾蒙主席已經是第9次來台，其他幾位議員是第一次來台，艾蒙主席應該已經充分理解及感受台灣人的熱情，也希望首次來訪的議員，對台灣留下美好的印象。奧地利是台灣在歐洲第十大商業貿易夥伴，這個比例偏低，未來雙方的經貿合作一定可以大幅提升。艾蒙說，他過去25年來被指派負責台灣與奧地利間的事務，直到5年前才正式成立奧地利友台協會，過去這段時間一直在鼎力相助支持台灣的發展。他也同意雙邊必須加緊合作，除了貿易，也擴及文化、教育，現在也有打工度假等相關計畫。熱門賽事、球星動態不漏接    ,https://news.ltn.com.tw/news/politics/breakingnews/5197085
「哪個災民沒吃便當餓死」言論挨轟 鍾沛君今再砲打中央：錯誤撤離帶走人命,政治,2025/10/01 16:20,國民黨台北市議員鍾沛君。（資料照）花蓮縣光復鄉上週因堰塞湖溢流遭受重創，針對外界質疑一堆便當放到臭掉，卻有許多人吃不到飯，國民黨台北市議員鍾沛君卻稱「災民和志工有哪個是因為沒吃便當餓死嗎？」一席話引發抨擊。鍾沛君今（10日1日）更貼文強調，中央荒腔走板撤離，才讓天災變人禍。鍾沛君日前於政論節目中表示，民眾滿不滿意花蓮縣府，下次選舉自然會用選票告訴大家答案；她也直言可以繼續爭執便當浪費可惜，但她要反問，目前為止不管災民還是志工，有人因為沒吃便當餓死？請繼續往下閱讀...鍾沛君批評，但是有人因為中央荒腔走板的撤離，帶走18條人命。她今於臉書再度貼出該片段，強調中央荒腔走板的撤離，才是天災變人禍的關鍵。鍾沛君受訪強調，她的原文在節目上表達很清楚，並沒有要多回應的。熱門賽事、球星動態不漏接    ,https://news.ltn.com.tw/news/politics/breakingnews/5197114
吳思瑤接民進黨政策會執行長 賴清德：行政立法溝通橋樑,政治,2025/10/01 16:17,兼任民進黨主席的總統賴清德今（1日）宣布，由立委吳思瑤接任政策會執行長。（記者王藝菘攝）兼任民進黨主席的總統賴清德今（1日）宣布，由立委吳思瑤接任政策會執行長。賴表示，吳思瑤一直是行政、立法部門的溝通橋梁，期許她能襄助秘書長徐國勇，跟行政、立法部門、地方黨部溝通，精準掌握輿論議題，快速反映人民生活所需。民進黨今天下午召開中常會，據轉述，賴清德指出，立委王義川已向他請辭政策會執行長一職，新任執行長特別邀請吳思瑤接任，同時也感謝王義川為黨部所做的努力與付出。請繼續往下閱讀...賴清德說，吳思瑤除了深知地方民意需求，也非常了解國會議事運作，一直是行政、立法部門的溝通橋樑；期許吳思瑤能襄助徐國勇，跟行政、立法部門、地方黨部溝通，精準掌握輿論議題，快速反映人民生活所需。吳思瑤會後受訪說明，雖然職務有調整，但業務與關心政策都是利用過去國會經驗，持續幫助黨產出的政策更貼近人民需求。展望立法院新會期，吳思瑤表示，行政部門會端出優先法案，政策會則要協助行政跟立法在優先法案的政策闡述與品質提升，政策會執行長的工作就是產出政策、溝通政策，協助行政立法部門推動優先法案，一起向民眾報告明年度中央政府總預算的政策面向及亮點。據轉述，兼任中常委的立委王定宇席間打趣說，吳思瑤繞了一圈，還是回到這個辦公室；吳思瑤則笑認，換了一個位置，一樣苦命。熱門賽事、球星動態不漏接    ,https://news.ltn.com.tw/news/politics/breakingnews/5197150
張之豪：國民黨主席選舉「越來越失衡」 基層要爽、菁英要贏,政治,2025/10/01 16:17,民進黨基隆市議員張之豪。（張之豪提供）國民黨黨主席選舉於10月18日投票；對此，民進黨基隆市議員張之豪表示，他昨日上節目被詢問對於國民黨主席選舉看法，由於被排到最後表達意見，故可能電視前的觀眾沒有聽見，他認為「國民黨的主席選舉，在穩定佈局軍陣，與追求聲量、辛辣、短線之間，似乎越來越失衡了」。張之豪今日於臉書粉專發文提及，昨天他被主持人趙少康大哥，詢問對於國民黨主席選舉的看法。由於這是他黨事務，故他當然是被排到後面講，前面表示意見的，都是國民黨人，或至少是泛藍的利害關係人。所以，輪到他講話時，已經是節目最尾聲，只有現場的人聽到，電視前的觀眾沒聽到。請繼續往下閱讀...張之豪說，國民黨人評論自己的主席選舉，是自己的同志、朋友，一些話，或許他們說不出口。最近幾場他們的主席辯論，甚至一些國民黨基層的聲音，他都有在留意。「我雖然是個局外人，但國民黨仍可能執政，仍能左右國家的政局與方向，甚至存續與否，所以我還是蠻關心的」。國民黨基層是很焦慮的，但或許也是這份焦慮，會吃緊弄破碗。國民黨已經3屆總統沒選上了，沒有執政的焦慮，是很真實的。對國民黨的政治菁英來說，要分配的資源，不好分配，要安插的位子，沒得安插，這對菁英是很不利的，所以菁英焦慮。利益型的基層支持者，就是需要國民黨執政，才能得到他們需要的資源。對理念型的國民黨基層來說，更焦慮，他們看到民進黨的任何人在位，都是渾身不對勁，他們覺得，再讓民進黨執政下去，中華民國要滅亡了，這些台獨要消滅他們的象徵、他們的圖騰、他們的中國人認同。國民黨的菁英知道不是這麼回事，但菁英需要讓基層這樣想，才能讓基層繼續含淚投票。另一邊，國民黨的基層還眼睜睜看著，柯文哲、黃國昌那票人，打民進黨似乎打得更帶勁兒，國民黨菁英這邊若不也下點猛藥，基層恐怕都要被白色給吸光了。焦慮，該怎麼辦？就如徐巧芯那樣，越逼越急，拿黃國昌狗仔的爆料也沒關係。但黃國昌的狗仔與爆料，恐怕不只針對綠營。張之豪指出，基本上，這本《百官行述》，黃國昌當然是誰都要記上一筆。電影《教父》說，「離你的朋友近些，但離你的敵人要更近」。黃國昌要掌握敵人的黑料，更要掌握盟友的黑料，因為，對一個自戀狂來說，誰都是敵人，誰都會在日後未知的一天，出賣自己，所以，現在就必須要把所有人的黑料掌握在手中。柯文哲自詡是多疑的雍正，殊不知，黃國昌也是，鶯鶯燕燕翠翠紅紅雍雍正正。所以，只要黃國昌繼續失態跳針無法處理這個政治風暴，他就會成為負資產。對國民黨如此，對民眾黨也是。這也間接幫國民黨處理掉藍白合困境，藍白合在2025有用，但到了2028，甚至2026，「那個」就「已經沒用了」。回到國民黨主席選舉，一些人算準了基層有這股焦慮，所以這幾位參選主席的，幾個人爭相做反綠急先鋒，誰更辛辣，誰更衝，誰就更獲得焦慮的基層支持者的青睞。但，國民黨自始至終，不是單靠「仇視民進黨」來支撐起自己天下的柯文哲黨、黃國昌黨。張之豪分析，國民黨真正的基礎，是侯友宜的「好好做代誌」，是盧秀燕的「媽媽市長」，基層組織，人人好大家好，雨露均霑的細膩操作。在2025的今天，除非住在一顆石頭底下，否則，大家應該都知道，2028國民黨唯一、最強、也最有希望勝選的總統候選人，就是盧秀燕。那，現在國民黨的新主席，唯一的任務，就是為盧秀燕抬轎，未來兩年的任務就是：把場子炒熱，把舞台搭好，讓盧秀燕隆重登場。既然如此，這個主席就必須要虛懷若谷，這個主席就必須要適時懂得把鎂光燈讓給真正的主角。所以，國民黨新主席，應該要是個抬轎者，應該要是個Queenmaker（女王製造者）。但，把黨主席選舉當作自己還在網路炒聲量的人，哪管自己是什麼maker，他們只在乎自己，所以一個比一個辛辣，一個比一個大聲。而焦慮的基層，也是很滿意，沒錯，就該這樣，就該像這些伶牙俐齒的年輕人一樣，對民進黨有壓制力，這才讓爺兒們大呼痛快。問題是，這是黨主席選舉，不是總統初選。基層要爽，菁英要贏，兩者要的不太一樣。對國民黨菁英來說，重點是要贏，不是一時的爽。而要贏，就要懂得忍，要把主席權柄交給能放得出去的人，因為，主角從不是主席，是總統候選人。真正的總部，是競選總部，不是國民黨部。找個打手來當主席幹嘛？打手是看門用的，當打手把人打到殘廢時，領袖再出來制止，還遞上傷藥，這才顯得出領袖的慈悲與高度。張之豪最後說，「在網路聲量、短影音、短注意力的時代，各個政黨在新時代、新民意、新科技的衝擊下，我自己的民進黨，與正在選主席的國民黨，都在努力調適中。這樣的問題，我們都有。但國民黨的主席選舉，在穩定佈局軍陣，與追求聲量、辛辣、短線之間，似乎越來越失衡了」。熱門賽事、球星動態不漏接    ,https://news.ltn.com.tw/news/politics/breakingnews/5196977
