Title,News_Type,date,content,url
曾是學霸、重金屬鼓手! 高市早苗因為「他」投入政界,國際,2025/10/04 19:16,眾議員高市早苗當選新任總裁，有望成為日本第一位女首相。（法新社）高市早苗當選日本自民黨新總裁，打破女性在日本政壇的天花板，引起歐美媒體的高度關注，高市早苗將成為日本首位女首相，也是少數非政治世襲出身的首相，她出身於奈良的雙薪家庭，父母希望她就讀短大，畢業後趕快找人成家平穩過日子，但她卻選擇走入政壇，並將帶領日本再度走上巔峰。1961年出生於奈良的高市，父親是上班族，母親是警察，小時候夢想是當「書法老師」，父母希望女兒不要飛太遠，找個好人家結婚平穩過日子，高中畢業考大學時，父母希望她就讀住家附近的短期大學，其他的學校一概不幫忙出學費。請繼續往下閱讀...高市早苗成績優秀考上了東京的名門私校慶應大學，但因無法承擔學費和生活費，最後放棄改讀國立的神戶大學。畢業時獲得多家大企業內定，但在因緣際會下，她發現了日本經營之神松下幸之助創辦「松下政經塾」正在招生，她放棄了內定的工作進入松下政經塾，成為松下的門生，24歲就立定志願將成為政治家。高市早苗是日本政壇出名的「政策控」，據說她具有接近「圖像記憶」超強記憶力，六法全書全部記在腦裡，而且也不擅於與人應酬，最大的樂趣就是關在家裡寫法案。但高市早苗並非如大家刻板印象中的「學霸」，她不但會讀書也很會玩，大學時曾獨自騎著機車完成日本一周的旅行。她在學生時代和朋友共組重金屬樂團，她擔任鼓手，2021年她首次參選自民黨總裁時，還曾和日本搖滾樂手世良公則秀了一段合奏。高市早苗在1992年首次參選參議員，因未爭取到自民黨提名敗選，1993年再度投入眾議員選舉，後援會都勸她不要冒進，結果原本反對他參政的父親卻在信件中鼓勵她不要放棄，還說可以動用他所有退休金。高市早苗在1993年首次當選，進入政壇，同年首次當選的還有已故的安倍晉三、前首相岸田文雄、前幹事長茂木敏充、前總務相野田聖子、東京都知事小池百合子，在野黨立憲民主黨黨魁野田佳彥和前黨魁枝野幸男，也是日本政壇有名的「九三年初當選組」，都是日本政壇上風風火火的一哥一姐。高市早苗做為「安倍路線」的繼承人，很多人以為她和安倍是「師徒」，但事實上兩人是「同級生」。高市早苗在44歲才結婚，丈夫是同黨的前眾議員山本拓，兩人在2004年結婚，當年高市早苗第二次落選變成浪人，山本以電話向她求婚，高市早苗曾訪談節目中說，兩人是「零日婚」，促成她決定結束單身生活的關鍵是山本在電話中告訴她「我有廚師執照」。這對於廚藝零分的高市而言是無上的魅力，馬上答應下嫁。高市早苗和山本在自民黨內屬於不同派系，兩人約好在家裡不談政治，但2017年兩人因為自民黨總裁支持人選不同發生齟齬，關係生變最後離婚，但2021年高市早苗出馬參選時，山本違背派系的決定力挺「前妻」，高市早苗落選後，山本也被拖累在當年的眾院選舉落馬。當時兩人關係已經修復，山本也經常進出高市的議員宿舍，為了怕被人拿來作文章，而且在安倍的鼓勵兩人再婚，不過這次兩人以猜拳決定姓氏，山本猜輸，現在冠上了高市早苗的妻姓成為「高市拓」。熱門賽事、球星動態不漏接    ,https://news.ltn.com.tw/news/world/breakingnews/5200739
高市早苗繼承強硬「安倍路線」 日與中韓關係恐生變,國際,2025/10/04 18:58,日本民眾搶拿高市早苗當選自民黨總裁的號外報紙。（美聯社）日本執政黨自民黨總裁當選人及即將出任首相的高市早苗，被視為前首相安倍晉三路線的繼承人，在國家安全、國防和移民問題上以強硬立場聞名。她雖主張加強日美安全同盟，但也在外交方面主張「日本優先」，可能影響與美國的貿易關係；她的民族主義立場鮮明，包括從不避諱參拜靖國神社，也可能動搖與南韓、中國的關係；而她建議日本與台灣建立「準安全同盟」，更是踩到中國的痛點。在安倍晉三遇刺身亡後，其為了將日本打造成對抗中國經濟和軍事崛起戰略力量的「自由開放的印太戰略」，被認為由高市早苗承繼。在國防和安全保障方面，高市力推自衛隊改為「國防軍」、支持修改憲法第九條「放棄戰爭」條款及增加國防預算等，都反映出安倍遺緒。高市強調日美同盟、強化印太安全合作、對中國採取強硬立場，包括建議日台建立「準安全同盟」等，都可能使日中關係複雜化。請繼續往下閱讀...外界也擔憂，高市掌權可能破壞現任首相石破茂近期改善對南韓關係的努力。儘管高市近期表示希望加強與首爾的關係，但她上月在一場辯論中仍提到，日本內閣大臣不必顧及面子，應該「放心前往」兩國之間存在主權爭議的島嶼，即竹島（韓稱獨島）。高市也認為，日本毋須進一步為二次世界大戰歷史道歉，並曾多次參拜供奉二戰期間被定罪戰犯的靖國神社。以上情況都讓首爾方面對她即將出任首相持謹慎態度。至於高市上位對日美同盟也不全然正向，尤其高市在此次競選期間才明確表示，有必要的話應重啟日美關稅協議談判，尤其若當中存在損害日本國家利益的因素，包括日對美五千五百億美元投資承諾。然而，曾擔任自民黨幕僚的政治分析家田村重信表示，川普應不會對高市採取強硬立場，因為日本仍是美國對中戰略的重要合作夥伴，高市內閣與川普政府之間的關係應該會很好。日本東京野村綜合研究所經濟學家木內登英分析，儘管高市已清楚闡明在外交和安全政策上的立場，但她身為內閣大臣的實際經驗有限，是一大隱憂，也讓人質疑她與即將在本月訪日的川普的默契程度。兩人可能在加強日本國防能力方面達成共識，但任何公開抵制美國要求的行為都可能導致摩擦。福岡金融集團首席策略師、前日本央行官員佐佐木融則說，高市應該會是一位強硬的談判者，她與川普的對話將會「很有趣」。熱門賽事、球星動態不漏接    ,https://news.ltn.com.tw/news/world/breakingnews/5200726
高市早苗將成首位日本女首相！矢板明夫曝面臨「三大挑戰」,國際,2025/10/04 18:31,前經濟產業相高市早苗成為自民黨新總裁。（美聯社）日本自民黨今日進行總裁補選，前經濟產業相高市早苗成為自民黨新總裁，可望成為日本首位女首相。對此，日本資深媒體人矢板明夫表示，高市早苗「是今天日本政壇最重視和台灣關係的重要人物」，他也在YouTube發表影片分析，未來執政路上將面臨三大嚴峻挑戰，包括黨內團結、外交政策與經濟改革，能否克服這些難題，將決定她首相任期的成敗。矢板明夫指出，高市早苗雖然在自民黨總裁選舉勝出，但她在黨內並非廣受歡迎的人選。她長期以來政治風格直率且不善於應酬，與多位前任首相及黨內大老關係緊張，據說選舉期間，前首相菅義偉、岸田文雄及石破茂均不支持高市早苗，甚至呼籲黨員投票給其他候選人。這意味高市早苗成為首相後，面對的是一個分裂嚴重、支持度並不鞏固的黨內環境。請繼續往下閱讀...矢板明夫強調，高市早苗若無法成功團結黨內力量，凝聚共識，不僅政策推動將受阻，甚至可能被內部勢力孤立，執政穩定性極為堪憂。她此前嘗試逐一爭取議員支持，顯示出努力彌合裂痕的決心，但真正的政治協調仍將是一大考驗。高市早苗在外交政策上的保守立場也引發矚目。她對靖國神社參拜持正面態度，這在日本國內及周邊國家尤其中國、韓國引發爭議。矢板明夫表示，這可能使日本在區域外交上面臨更大壓力和挑戰。此外，高市早苗在對美貿易及安全政策上的立場相對強硬，曾在美國關稅議題上公開表示若美國提出的條件損害日本利益，將重新談判。這樣的態度或加劇日美間的微妙關係。矢板明夫認為，高市早苗如何在強化日美同盟的同時，避免與中國、韓國關係過度緊張，是她面臨的第二大外交挑戰。日本經濟長期停滯，且近期通貨膨脹與高物價問題嚴重，高市早苗提出減稅和推動保守經濟政策，試圖刺激內需和企業活力。然而，黨內財政保守派如麻生太郎對減稅持保留態度，使，高市早苗的經濟改革道路充滿變數。矢板明夫指出，高市早苗的專業政策能力備受肯定，擁有30多年國會議員經驗及豐富政策研究背景，但如何在內部壓力與外部經濟環境中找到平衡，成功推動有效改革，將是她能否贏得民心及維持政權的關鍵。熱門賽事、球星動態不漏接    ,https://news.ltn.com.tw/news/world/breakingnews/5200714
哈瑪斯聲明vs.川普20點計畫 共識與分歧意見一次看,國際,2025/10/04 18:28,哈瑪斯已大致同意美國總統川普所提的加薩20點和平計畫，人質可望重獲自由。圖為民眾4日觀看張貼在以色列耶路撒冷街頭、被哈瑪斯俘虜的以色列人質的照片。（美聯社）巴勒斯坦伊斯蘭主義組織「哈瑪斯」（Hamas）3日回應美國總統川普稍早所提的加薩20點和平計畫，同意計畫若干關鍵內容，包括結束加薩戰爭、以色列撤軍與釋放人質等，但仍有細微差異；至於在未來治理加薩以及哈瑪斯參與加薩未來等方面，雙方看法明顯分歧。以下是哈瑪斯聲明與川普計劃的對比：1、釋放以色列人質與巴勒斯坦俘虜請繼續往下閱讀...哈瑪斯：將「在落實必要的換俘的實地條件下，根據川普總統提議中的交換辦法」，釋放被扣押在加薩的以色列人質，無論生死。但聲明中並未具體說明何謂「必要的實地條件」。川普：要求哈瑪斯在「以色列公開接受（川普版）協議的72小時內」，交還所有人質。2、停火、結束戰爭與以色列撤軍哈瑪斯：接受結束戰爭以及以色列「全面撤出」加薩走廊此一框架，但未提及撤軍階段；言明拒絕以色列佔領。川普：以軍撤至約定線以便為釋放人質做準備，期間以軍將暫停包括空襲與砲擊等軍事攻擊，「戰線維持凍結直至全面階段性撤軍的條件到位」。3、援助、復原與不驅逐巴勒斯坦人：哈瑪斯：歡迎川普在計畫中呼籲增援加薩以及未要求驅離巴勒斯坦人。川普：不會強迫人離開加薩，想走、想返回皆悉聽尊便；立即依照今年初協議的數量將救援物資送進加薩，以及將透過聯合國、紅新月會與其他國際組織馳援，修復加薩基礎建設與進駐必要機具。1、外國參與加薩臨時治理川普：一個非關黨派、由技術官僚組成的巴勒斯坦委員會，負責臨時過渡治理加薩；該委員會將接受新成立、由川普領導的國際性過渡機構的監督。沒有任何巴勒斯坦人或團體被點名參與過渡治理。哈瑪斯：同意把加薩行政權移交給「一個以巴勒斯坦民族共識為基礎、獲得阿拉伯與伊斯蘭國家支持的獨立的（技術官僚）巴勒斯坦機構。」2、哈瑪斯與加薩未來川普：哈瑪斯必須「同意不直接、間接或以任何形式，在加薩的治理上扮演任何角色」；將展開加薩「非軍事化」過程。哈瑪斯：仍堅稱自認是「全面性巴勒斯坦民族框架」的一部分；未論及加薩非軍事化，但過去曾表示反對。熱門賽事、球星動態不漏接    ,https://news.ltn.com.tw/news/world/breakingnews/5200705
高市早苗當選自民黨總裁  「造王者」麻生太郎發威,國際,2025/10/04 17:28,日本前經濟安保大臣高市早苗今天當選自民黨第29任總裁（黨主席），成為黨史首位女總裁。外界普遍認為，85歲的自民黨最高顧問麻生太郎是關鍵角色，他下令「決選投給第一輪黨員票最高票」，讓高市的議員票從第一輪的64票暴增至149票，成功當選。（中央社資料照）日本前經濟安保大臣高市早苗今天當選自民黨第29任總裁（黨主席），成為黨史首位女總裁。外界普遍認為，85歲的自民黨最高顧問麻生太郎是關鍵角色，他下令「決選投給第一輪黨員票最高票」，讓高市的議員票從第一輪的64票暴增至149票，成功當選。選前分析，日本前首相菅義偉、岸田文雄和石破茂都被認為傾向支持農林水產大臣小泉進次郎、官房長官林芳正。而在支持高市的議員中，舊安倍派占5成以上，麻生派約1成半，另有約30名舊安倍派和麻生派議員態度不明。請繼續往下閱讀...由於麻生掌握能左右數十名議員的影響力，選前除了與麻生關係微妙的林芳正之外，其餘4名候選人都展開「拜會麻生」行動爭取支持。不過，直到投票前夕，麻生才終於表態，以重視黨員票為由，下令議員把票投給「第一輪黨員票得票最高的人」，也就是高市早苗。另外，根據事前預測，如果進入決選，另一名候選人、前幹事長茂木敏充會與和他關係密切的麻生共同行動。麻生的指令，等同讓高市在決選吸收了茂木票。自民黨在政治獻金醜聞後，各主要派閥紛紛解散，唯一仍存在的麻生派目前在參眾議院擁有超過40名議員，因此麻生太郎被譽為自民黨的「造王者」。這次選舉，他再次展現了如同其名的威力。分析兩輪投票結果，第一輪投票中，高市與小泉分居第1、第2，但就議員票而言，高市僅排第3（64票），落後小泉（80票）、林芳正（72票）。然而麻生一聲令下，高市在決選投票拿下議員票149票、黨員票36票，小泉獲得議員票145票、黨員票11票，兩人在議員票方面幾乎打成五五波，高市以總票數勝出。麻生去年在總裁選舉也支持高市，不過在決選被石破茂翻盤。過去1年，高市在麻生太郎的建議下，積極增加與同僚議員的交流，專注於「經營人脈」。最近的參眾議院選舉中，她更是幾乎來者不拒，奔走全國助選，進一步鞏固黨員支持。政論家田崎史郎評論，自民黨的政治運作一方面看政策，另一方面是議員之間的「人情債」。從這次投票結果來看，高市對麻生和茂木都欠下了人情債，未來在黨務和內閣人事方面，必然要有所回報。對於麻生太郎的影響力，日本網友留言，「真的太強了，這就是麻生的力量」、「麻生太郎議員生涯的最後一場賭局贏了」、「麻生太郎的命令威力驚人」、「麻生太郎再次化身造王者」。此外，1979年、麻生38歲時受訪的舊影片也重新引發討論。當時年輕的麻生太郎說：「我想成為一位不讓日本走錯方向的政治家。那些太受媒體歡迎的人，往往都沒有成為真正偉大的人。」他還說：「就算被討厭也無所謂，被扔石頭也沒關係。只要最後人們評價，那個人作為國會議員，沒有讓日本在這世界偏離方向，只要能在歷史上被這樣銘記，我就滿足了。」這番話似乎也反映他身為「造王者」的政治信念。熱門賽事、球星動態不漏接    ,https://news.ltn.com.tw/news/world/breakingnews/5200636
高市有望成日本新首相  繼承安倍路線強化印太安全,國際,2025/10/04 17:17,日本執政黨自民黨總裁（黨主席）選舉今天投開票，前經濟安保大臣高市早苗當選，成為自民黨首位女總裁，可望成為日本史上首位女首相。（彭博）日本執政黨自民黨總裁（黨主席）選舉今天投開票，前經濟安保大臣高市早苗當選，成為自民黨首位女總裁，可望成為日本史上首位女首相。在經濟、外交、國防上，高市延續前首相安倍晉三的方針，可視為「安倍路線的繼承者」，主張經濟寬鬆政策，強化印太安全合作，提升自衛隊角色。自民黨總裁選舉今天投開票，高市早苗在第一輪投票拿到最高票，與農林水產大臣小泉進次郎進入第二輪決選，以185票當選自民黨總裁，是自民黨創黨70年以來首位女總裁。預定15日舉行的臨時國會的首相指名選舉，高市被指名為首相的可能性極高，如果高市被指名為第104任首相，將是日本憲政史上第一位女首相。請繼續往下閱讀...高市9月19日在國會大廈召開宣布參選自民黨總裁的記者會表示， 「日本正面臨來自內外的大危機，若要克服這巨大危機，需有能讓人民的生活及對未來的不安轉變成有夢想和希望的政治，需要有可迎戰巨大危機的強而有力的政治、能明示方向的政治」。高市從政逾30年，1993年以無黨籍身分參選，高票當選眾議員，前後一共當選9屆，1996年加入自民黨後任冲繩及北方擔當大臣、自民黨政務調查會長和總務大臣等要職。其政治生涯受到前首相安倍晉三提拔，2006年安倍首度執政時，高市首度入閣，擔任內閣府特命擔當大臣，涉及冲繩北方對策、食品安全、少子化、創新等領域。安倍2012年重返執政，高市2014年被延攬擔任日本首位女性總務大臣（內政部長），任期前後加起來將近1500天，屬日本歷代最長。另外，高市還曾任經濟產業副大臣、通商產業政務次官等，在自民黨內則出任3任政務調查會長等多項職位。高市早苗是自民黨內的保守派政治人物，與安倍派（清和政策研究會系統）關係密切。她長期主張憲法第9條修正、提升國防能力、強化國家安全，以及在經濟政策上偏好國家積極干預，特別是支持「投資、產業振興、技術創新」。在自民黨總裁選舉中，她的政見包含削減燃油稅、加速取消臨時稅率、設置福利稅收抵免、強化對外國投資的審查、制定反間諜法、加強日美同盟等主張。安倍晉三執政期間推出「安倍經濟學」三支箭：貨幣寬鬆、財政刺激、結構改革，主導日銀量化寬鬆，推高通膨以刺激成長。身為安倍學派傳人，高市之前曾提出「高市經濟學（Sanaenomics）」，這一政策名稱既是對其導師安倍晉三「安倍經濟學」的致敬，也體現她自身在經濟政策上的思路：支持寬鬆政策，主張政府應以擴張性財政支出與減稅來刺激成長，反對日本央行升息，認為過早緊縮只會抑制企業投資與家庭消費。在國防與安全保障方面，安倍晉三強調「積極和平主義」、擴大自衛隊角色。高市在國防與安全保障上也反映出安倍遺緒，像是她力推改自衛隊為「國防軍」、支持修改憲法第9條「放棄戰爭」條款，並增加國防預算。安倍晉三在外交上強調提倡「自由與繁榮之弧」與「印太戰略」；高市強調日美同盟、強化印太安全合作、對中國採取強硬立場。例如高市曾建議日本應與台灣建立「準安全同盟」，並表示將重新談判與美國總統川普（Donald Trump）達成的投資協議，以「日本優先」為政策原則。在對台關係上，高市承襲安倍晉三「台灣有事就是日本有事」的主張。高市9月19日在國會大廈召開宣布參選的記者會，她在回答媒體提問時重申「台灣有事就是日本有事」。「台灣有事就是日本有事」的說法是安倍晉三在2021年12月1日，透過網路視訊參加台灣智庫國策研究院的座談會時提出的主張。高市於本月1日投書華府智庫哈德遜研究所（Hudson Institute）指出，「台灣海峽的和平穩定是日本關注之事」，她也強調：「想與中國領導人率直對話」。高市指出，「絕對不能以武力或脅迫等方式片面改變現狀。台灣是日本極重要的友人」。她此番言論被解讀成意在牽制中國。在安倍晉三於2022年7月不幸遭槍擊離世後，高市受日本李登輝之友會邀請演說時，宣示將繼承安倍遺志，表明要更進一步強化日本跟台灣關係，稱不能讓台灣「變成第二個香港」，並指出「除了跟台灣間的友情外，雙方在政策面方面也必須強化合作才能相互保護」。高市表示，日本與台灣之間無正式邦交，僅維持實務關係。日本不像美國擁有一部「台灣關係法」協助台灣，但為了守護彼此的安全，真的是「台灣有事就是日本有事」，這是無庸置疑的。她指出，「台灣如果真的進入戰鬥狀態，成為有事的情況，如果想像（冲繩的）與那國島與台灣相距僅110公里，等於是東京與熱海之間有他國的戰艦布署，那麼台灣有事也是日本有事」。高市指出，在多變的國際情勢之下，日本、台灣、歐洲各國、澳洲、印度等有共同自由民主理念的國家，會變成類似準軍事同盟的關係，互相防衛才能保障安全。熱門賽事、球星動態不漏接    ,https://news.ltn.com.tw/news/world/breakingnews/5200580
高市早苗有望成日版鐵娘子  月底與川普東京會談,國際,2025/10/04 17:13,日本前經濟安保大臣高市早苗，自民黨總裁（黨主席）勝選後，今天成為自民黨創黨70年來首位女總裁，本月中旬有望成為日本憲政史上首位女首相。日美政府正在磋商安排美國總統川普月底訪日，日版「鐵娘子」高市或與川普在東京會談。（路透）日本前經濟安保大臣高市早苗，自民黨總裁（黨主席）勝選後，今天成為自民黨創黨70年來首位女總裁，本月中旬有望成為日本憲政史上首位女首相。日美政府正在磋商安排美國總統川普月底訪日，日版「鐵娘子」高市或與川普在東京會談。高市理想領導人是英國前首相、「鐵娘子」佘契爾（Margaret Thatcher）夫人，曾說憧憬台灣前總統蔡英文。日美政府正在磋商安排川普（Donald Trump）月底訪日，並舉行日美領袖會談。請繼續往下閱讀...高市早苗今天在自民黨總裁選舉勝出，有望於本月15日在臨時國會被指名為首相，成為日本憲政史上首位女首相。如果日美政府磋商順利，川普將成高市成為首相後接待的首位外國元首。日本放送協會（NHK）報導，日美相關人士透露，川普訪日期間，預定本月28日視察美國海軍橫須賀基地（位於神奈川縣），強調日美同盟的重要性。川普計畫出席10月31日起在韓國召開的亞太經濟合作會（APEC）領袖會議，日美政府正磋商安排川普在訪韓之前訪日，傾向安排川普於本月27日起在日本進行為期3天的訪問。川普第一次執政時期於2019年5月訪日之際，也視察美國海軍橫須賀基地，在泊靠中的水陸兩棲攻擊艦上發表演說。鑑於中國擴大海洋行動以及北韓的局勢等，預料川普這次也將到美國海軍橫須賀基地視察。日前有日媒報導，川普為出席APEC訪韓期間，有意與中國國家主席習近平舉行會談，因此日方希望在川普訪韓之前訪日，與日本共同體認日美同盟的重要性，磋商有關針對中國、北韓的基本政策，也希望促使「美國優先」的川普對東亞的關注更為確定。熱門賽事、球星動態不漏接    ,https://news.ltn.com.tw/news/world/breakingnews/5200550
