Title,News_Type,date,content,url
蘇貞昌、蘇巧慧父女逃不過「粉髮」 本人親回1句話笑翻網,政治,2025/10/16 16:05,網友將蘇巧慧及蘇貞昌換成粉紅色髮型，引來父女兩人幽默回應。（圖擷取自Threads）南韓女團BLACKPINK本週末將二度來台開唱，高雄市多處地標已提前點亮粉紅燈海迎接偶像，而「粉紅風潮」也從應援延燒至政壇。繼高雄市長陳其邁、前總統蔡英文曬出粉紅髮造型後，網友更發揮創意，將前行政院長蘇貞昌與立委蘇巧慧父女「P」成粉紅髮，釣出父女2人親自回覆。陳其邁昨（15）日率先在Instagram與Threads更換粉紅髮大頭貼，呼應BLACKPINK的應援色，掀起話題。前總統蔡英文隨後也在Threads曬出粉紅髮P圖，笑稱「別人（不是陳其邁）傳給我的，粉紅色，感覺不是很適合我？」貼文不到1小時吸引上萬人按讚。請繼續往下閱讀...在蔡英文的貼文下，有網友製作蘇巧慧與蘇貞昌父女的粉紅髮合成照，幽默標註「先發個不自殺聲明（逃）」，意外引來蘇貞昌本人親回：「無論白髮黑髮紅髮還是粉紅髮，有頭髮就是好頭髮」。網友紛紛熱烈回應，「這粉紅髮型很好看耶」、「其實蠻適合您」、「用一張照片就好，幹嘛用兩張？」、「巧慧姐你跟你媽媽長得好像喔（逃」、「這粉紅髮型很好看耶」、「看到有頭髮的衝衝衝，突然認不出來」，蘇巧慧也以一排笑哭表情回應。BLACKPINK開唱掀粉紅潮！蔡英文曬「粉髮照」自嘲：不太適合我？BLACKPINK颳粉紅旋風！賴清德「被染髮」 神回應笑翻網熱門賽事、球星動態不漏接    ,https://news.ltn.com.tw/news/politics/breakingnews/5213403
遭綠批黨工收中資參選遭重判！ 民眾黨駁：從未提名馬治薇,政治,2025/10/16 16:00,民眾黨發言人張彤。（資料照）民眾黨主席黃國昌今指控，總統賴清德呼籲朝野支持「國安十法」修法是帶頭造謠；民進黨痛批，黃國昌喊再多「執政黨造謠」，也抹不掉民眾黨候選人（民眾黨前桃園市黨部發言人馬治薇）收受中資遭判刑。對此，民眾黨表示，民眾黨從未提名馬治薇參選公職，民進黨竟顛倒是非。民眾黨發言人張彤痛批，民進黨身為執政黨，黨發言人竟然張口就造謠、連基礎事實都搞不清楚，通篇胡言亂語。民進黨近日結合特定媒體以假新聞造謠，惡意攻擊民眾黨主席，早被人民看破手腳，眼看抹黑不成，民進黨又來抹紅，黔驢技窮，實在可悲。請繼續往下閱讀...張彤指出，身兼民進黨主席的賴清德總統，昨天呼籲朝野政黨支持「國安十法」修法，遭黃國昌主席打臉。「資通安全管理法」早已三讀通過，賴總統怎麼被自家降智圖卡誤導？賴總統不知自省，竟惱羞成怒派自家發言人，使出抹紅大絕招。張彤強調，民眾黨從未提名馬治薇參選公職，馬治薇因此脫黨參選，本黨於2024年中央評議委員會決議開除其黨籍，民進黨竟顛倒是非、總統帶頭公然造謠、搞認知作戰，才是真正的國安危機。民進黨再怎麼轉移焦點，都無法掩飾民進黨執政的荒腔走板、失能無能；再怎麼抹紅，都無法掩蓋府院黨養共諜的事實。熱門賽事、球星動態不漏接    ,https://news.ltn.com.tw/news/politics/breakingnews/5213424
批盧秀燕任內商圈停滯不前 林祈烽：市府生不出也不會顧,政治,2025/10/16 15:59,市議員林祈烽批市府對商圈生不出又不會顧。（記者蘇金鳳攝）台中市有23個商圈，民進黨市議員林祈烽今天在市議會質疑，盧秀燕市長上任7年，全市商圈數仍維持在23處，甚至逐步沒落，不但一中商圈從過去排名全台十大商圈第一名，現今竟是第10名，逢甲商圈更是掉出10名之外，出租店面四處可見，批市府「生不出也不會顧」，認為市府應協助商圈，提高商圈的輔導獎勵補助，以提升商圈人氣。副市長黃國榮表示，他通常會逛離住家較近的逢甲、一中及勤美，都是他常去逛的商圈，而目前商圈所面臨的困境，租金是重大原因外，疫情後亦受全球地緣政治及美國關稅問題有所影響，不過，他坦承政府還是有責任振興經濟，也建議商圈可努力發展其特色及強化宣傳。請繼續往下閱讀...林祈烽指出，台中市商圈有23個，但卻發展停滯不前，盧秀燕上任7年，不但沒有再增加商圈，且還有12個行政區連一處商圈都沒有，現有商圈會員數更年年下滑，去年會員數從1250家減至1117家，市府有去了解原因嗎？林祈烽表示，根據媒體報導逢甲商圈租金高漲，租金每月高達5至22萬元，很多店家出走，市府應比照補助夜市待遇，協助商圈業者採購或改善設備，如油煙處理、淨水或油脂截流器，以降低商家營運成本、提升商圈消費品質。他提及，市府每年僅編列450萬元作為全市23處商圈的輔導獎勵補助，今年度有商圈獲40萬元補助，但也有18個商圈分不到20萬元，但盧市府卻砸下近4億元舉辦台中購物節，他呼籲市府應借鏡日本大阪心齋橋經驗，由專業團隊協助商圈挖掘文化底蘊、重塑品牌形象。台中市副市長黃國榮（左）表示，政府確實有責任要振興經濟。（記者蘇金鳳攝）熱門賽事、球星動態不漏接    ,https://news.ltn.com.tw/news/politics/breakingnews/5213229
柯文哲好友范有偉政治獻金500萬 自爆被蔡明興痛罵「搞什麼碗糕」,政治,2025/10/16 15:59,會計師范有偉作證提及，蔡明興是他的客戶、也是朋友，當蔡的名字因案子曝光後，曾生氣地打電話給他「你和柯文哲在搞什麼碗糕！」（記者王藝菘攝）台北地方法院今持續審理京華城案，傳喚會計師范有偉到庭作證，范為柯文哲相識逾20年好友，庭上坦承曾以個人名義捐贈政治獻金，並稱曾於自家地下停車場親手交付裝有500萬元現金的袋子給柯文哲。他表示，這筆錢是從家裡保險櫃取出，也因案件涉及客戶富邦金控董事長蔡明興，還一度被對方在電話中痛罵「你和柯文哲在搞什麼碗糕！」范有偉為國立成功大學工業管理學系碩士畢業，目前於某公司擔任會計師。庭訊中，他證稱認識柯文哲已經很久了、大概20多年，當時仍為醫師的柯文哲有學生不幸被撞死，因此成立防酒駕協會，並請他幫忙。請繼續往下閱讀...范有偉憶及與柯文哲的認識，忍不住落淚，哽咽表示，「我和我媽很感謝他，謝謝他可以讓我盡孝道…我們是好朋友。」他進一步指出，當年得知柯文哲要選台北市長，做為最忠誠的好朋友，也是給予很大的支持。沈慶京辯護律師徐履冰提問，是否曾以個人名義捐贈政治獻金？范有偉坦承，歷年來都有捐贈，包括國民黨、民眾黨，但相關金額及細節已記不清楚，並強調一向有進行公益項目。范有偉並指，當初所捐贈的30萬元是以最高限額決定。他再度強調，自己與柯文哲是忠誠好友，得知對方將參選總統、要一展鴻圖後，認為選總統應有基金會，曾建議他應尋找形象良好的集團公司如國泰、富邦、玉山、遠東與裕隆集團合作，但並未介紹相關人士；被問及如何得知裕隆集團事後拒絕募款，他則回應是打球聽到的消息。范有偉也抱怨，商界朋友有藍、有綠，卻因牽涉京華城案導致商界朋友「跑光」；起初不想承認捐款僅因想低調，包括柯文哲市長任內8年，也未向誰告知2人友好關係，也知道身邊很多朋友不太喜歡柯，之所以會捐款500萬，是希望他能成立像陳水扁、蔡英文或馬英九一樣的基金會和智庫，這也是初衷，而自己只想低調給予對方支持。范有偉提及，蔡明興是他的客戶、也是朋友，當蔡的名字因案子曝光後，曾生氣地打電話給他「你和柯文哲在搞什麼碗糕！」此時，徐履冰請范說明檢方當時以什麼方式傳喚作證，他停頓良久後回稱，「已經忘記傳票還是電話」；他強調，第一次偵訊時並未注意證據Excel檔有經理人蔡明興，但媒體報導後來卻指他暗示捐款人是蔡，並澄清此事與他無關，也不滿事情牽涉到客戶。「不用懷疑我有沒有500萬元。」范有偉表示，以其財力狀況而言，平常領了現金就會放在家裡保險櫃，並稱家中有不少錢、固定月領現金。他說，雖然500萬元對一般人來說算是很多，「但我們是隨時可以拿出來、隨時可以調得到的，我與柯P的關係不希望讓人知道，包括老婆。」此外，范有偉也聲稱當時於住家地下室B1停車場交錢給柯文哲，並說當時從後車廂拿出有拉鍊、裝著500萬元現金的袋子給柯文哲。徐履冰詢問，柯文哲是否透過他聯繫上蔡明興？他強調，「錢沒有喔，只是讓蔡確認。」徐履冰認為，范有偉前後陳述不一，改變陳述的原因是受到外界影響，尤其是後半段證詞不符常理，柯稱未到過地下室，檢方未有證據指工作簿Excel檔是柯所製作，批評檢方以此方式訊問堪稱誘導。檢察官林俊廷表示，范有偉因感念柯文哲而無條件支持，且證人第一次偵訊時並未說清楚，因此才有第二次的偵訊以釐清細節，也就是透過范有偉聯絡蔡明興，柯文哲因而認為范所交付的500萬元現金與蔡明興有所關聯，相關脈絡皆有跡可循。熱門賽事、球星動態不漏接    ,https://news.ltn.com.tw/news/politics/breakingnews/5213285
批新壽「詐騙式開工」自證己罪 吳思瑤：蔣萬安被當空氣,政治,2025/10/16 15:55,兼任民進黨政策會執行長的立委吳思瑤。（資料照）輝達台灣總部有意落腳北士科T17、T18基地，標得地上權的新光人壽今（16日）舉行開工動土典禮。對此，兼任民進黨政策會執行長的立委吳思瑤直指，新壽此舉頗有施壓意味，但詐騙式開工的如意算盤恐自證己罪；而台北市長蔣萬安無心市政、從頭到尾狀況外，難怪被當空氣。吳思瑤今受訪表示，新壽今天的大動作，要不就是不把台北市政府放在眼裡，把蔣萬安當空氣；要不就是台北市政府狀況外，才會發生今天這種新壽片面開工，北市府完全不知情的狀況。請繼續往下閱讀...吳思瑤說，新壽的開工動土看來是一個假動作，具有威脅性意味，希望藉由假開工動土脅迫北市府，在未來合議解約中獲取更好條件、更大籌碼，甚至也有詐騙式開工的意味。吳思瑤評估，新壽儘管是為了爭取未來斡旋有更好的條件，但其如意算盤可能適得其反，因為這不就證明這塊地荒廢了4年擺在那裡？這是自證己罪，沒有開發行為，現在卻急急忙忙在法律攻防上下其手。此外，吳思瑤也質疑，輝達能否留在北士科，是台北市政府的重中之重，但蔣萬安這幾天在北市議會備詢時，對於輝達案一問三不知，搞得連國民黨市議員也跳腳，把責任推給台北市副市長李四川，讓李背鍋擋子彈。吳思瑤批評，蔣萬安無心市政，這段時間卻插手國民黨主席選舉，不關心輝達案，不為台北市拚經濟，反而在搞政治；若蔣萬安不想當市長、或是不會當市長，就不要當市長，中央能幫忙的一定幫忙，但是中央幫了忙，台北市政府自己還在狀況外。熱門賽事、球星動態不漏接    ,https://news.ltn.com.tw/news/politics/breakingnews/5213386
貼「台中每人普發4萬」圖卡被送辦  法院裁定不罰：言論自由,政治,2025/10/16 15:54,台中市陳姓男子，今年7月上傳「台中每人普發4萬」圖卡，台中市政府還製作圖卡澄清是不實謠言，不過法院認為屬言論自由範疇，裁定不罰。（擷取自台中市政府網站）首次上稿13:18更新時間15:54（新增議員及市府意見）台中一名陳姓男子，今天7月底在Threads網站上張貼「年終獎金每人普發4萬，台中市超徵120億學者促還富於民」的圖卡，造成民眾瘋傳，台中市南區區公所接獲民眾詢問，除向市府反映也同步報警，警方獲報後查出是陳姓男子所為，依違反社會秩序維護法移送法辦，不過法官認為，陳男僅是就公共議題提出其個人意見，並無散佈謠言可言，屬言論自由範疇，裁定不罰。台中市政府表示，尊重司法判決。請繼續往下閱讀...台中市南區區公所，今年7月28日接獲民眾反映，有網友在群組中轉傳「台中市府要普發4萬元」的圖卡，認為該圖卡內容為假訊息，除通報市府，也同步報警處理；台中市府呼籲民眾切勿轉傳不實訊息，還製作圖卡澄清，提醒依社會秩序維護法第63條第1項第5款「散佈謠言，足以影響公共之安寧者，處3日以下拘留或新台幣3萬元以下罰鍰」。台中市警局事後查出圖卡是一名陳姓男子所發，依違反社會秩序維護法將他送辦，陳男坦承，今年7月28日凌晨在Threads網站，張貼以台中市市長盧秀燕照片為背景，其內容為「年終獎金每人普發4萬，台中市超徵120億學者促還富於民」的貼文。陳男開庭時，否認違反社會秩序維護法，辯稱自己支持這個意見是因為盧秀燕曾同意中央普發1萬元的這個議題，既然台中市政府也有超徵稅額部分，普發現金予台中市民應該也是合理的。法官認為「年終獎金每人普發4萬，台中市超徵120億學者促還富於民」等語，是就台中市長盧秀燕同意中央普發1萬元的公共議題提出其個人意見，進行公共討論，並無散佈謠言可言。且民眾詢問區公所，並非代表詢問的民眾有不安情形，僅是基於懷疑態度，或基於好奇心態，電話詢問有無此政策，尚難以此認定影響公共安寧，從貼文留言也可看到陳男確實係對公共議題發表意見，因此認定屬言論自由範圍，裁定不罰。對此裁定，台中市議員張芬郁、陳俞融、陳淑華、陳雅惠都認為，希望盧秀燕市長普發現金，是市民的心聲，市民說出心聲，卻要被市府告，實在沒有天理。盧市長自己可以要求中央發1萬，民眾不能說發4萬？這是針對公共議題的討論，難怪被法院打臉。如今法院還人民一個公道，盧市府不該再事不關己，應深刻反省、正視民意。台中市政府則表示，尊重司法判決，因網路傳播速度極快，涉及政府政策或公共資源分配等議題，提醒民眾以官方公告或正式新聞稿為準，避免誤導大眾造成誤解混淆。熱門賽事、球星動態不漏接    ,https://news.ltn.com.tw/news/politics/breakingnews/5213140
新壽T17、T18今動土 國民黨議員批北市府沒掌握「螺絲掉滿地」,政治,2025/10/16 15:43,國民黨士林、北投區市議員林杏兒質疑新壽在北市府頭上動土，市府對新壽動作沒有掌握，證明螺絲完全掉滿地。（林杏兒提供）新壽集團今天上午在北士科T17、18用地動土，國民黨士林、北投區市議員林杏兒質疑新壽在北市府頭上動土，市府對新壽動作沒有掌握，證明螺絲完全掉滿地，將會讓台北市長蔣萬安背黑鍋。林杏兒表示，輝達要進駐台北市，對於未來的經濟發展至關重要，對於新壽在市府內提出任何申請案或有任何動作，受理單位就應該有最基本的敏感度向上呈報，但據了解，市府高層並沒有接收到相關訊息，在市府即將與新壽展開合意解約談判之際，出現這場動土儀式，讓大家都感到市府又被新壽將了一軍。請繼續往下閱讀...她說，新壽雖然強調自己依民間習俗動土而非挑釁市府，但她認為新壽的做法是「項莊舞劍」，是在台北市政府頭上動土，雖然新壽一再對媒體表示與北市府是夥伴關係，都希望輝達能夠留在台北市，但新壽更重視的是市府到底要給多少「分手費」、到底要付多少錢來跟新壽解約。林杏兒認為，市府「該硬則硬，該談則談」，而新壽提出解約價格一定要合理，要有所本，如果是漫天喊價，要求上百億的50年利益，她絕對反對到底。熱門賽事、球星動態不漏接    ,https://news.ltn.com.tw/news/politics/breakingnews/5213384
藍黨魁選戰遭中國介入 郝龍斌、趙少康「超時空打臉」影片曝光,政治,2025/10/16 15:30,「戰鬥藍」發起人趙少康指出國民黨主席選舉遭中共介入。（資料照）國民黨主席選舉近日爆出遭中國介入操作，民進黨今（16日）表示，網路節目「爸媽叫我不要談政治」推出短影音，剪輯前中廣董事長趙少康、國民黨主席候選人郝龍斌昔日的發言，對照如今的指控「超時空打臉」。民進黨指出，國安局長蔡明彥證實，TikTok約有上千部影片討論國民黨主席選舉，YouTube也有23個帳號、逾半位於境外，明確顯示介選跡象；多位藍營人士皆指控出現大量境外假帳號、AI變造影片等情形，郝龍斌呼籲「境外抹黑到此為止」，趙少康更直言「若讓大陸介選，國民黨就完了」，有趣的是，這些呼籲與其過去否認「中國介選」的說法形成強烈對比。請繼續往下閱讀...民進黨說，影片也進一步揭露中共介選手法與現象。自2019年起，社群上出現「Spamouflage（垃圾偽裝）」行動，混合假訊息與真實內容、偽裝為一般用戶，持續散播親中敘事。微軟分析也揭露此行動曾介入台灣2024總統大選，甚至利用AI技術偽造聲音與影像，操弄選情；各項研究都指出是來自中國有指揮的行動。影片中也表示，面對中共認知作戰，近年持續以影片、資訊圖卡與闢謠素材，向社會揭露威脅，並推動「國安十法」，強化反滲透與資訊安全法制。影片結尾也呼籲，既然國民黨已親身體驗中共介選的危害，就不該推動不在籍投票法、兩岸人民關係條例修法等「助長介選」法案，而是應與民進黨攜手支持國安十法，鞏固國安防火牆，才能確保選舉公正與國家安全。        在 Instagram 查看這則貼文            爸媽叫我不要談政治（@taaaaalk_politics）分享的貼文爸媽叫我不要談政治（@taaaaalk_politics）分享的貼文熱門賽事、球星動態不漏接    ,https://news.ltn.com.tw/news/politics/breakingnews/5213312
藍黨魁選舉爆境外介選 聲量看政治：已淪為中國演算法操控實驗場,政治,2025/10/16 15:22,「聲量看政治」po出泛藍與泛紅陣營的YT聲量圖，表示其軌跡清楚顯示，這場國民黨主席選舉已經不是單純的黨內投票，而是被中國演算法「養成」的一場政治實驗。（圖擷自臉書）國民黨主席選舉18日將投票，候選人郝龍斌日前質疑有境外勢力介入黨主席選舉，對此長期觀察網路聲量的臉書粉專「聲量看政治」發文透過YT聲量圖分析，這場國民黨主席選舉已經不是單純的黨內投票，最關鍵的是紅色演算法開始學會如何操控民主。「聲量看政治」也直言，最終國民黨主席誰勝不重要，重點是已成中國演算法操控民主選舉的『重要實驗』」。「聲量看政治」在臉書發文指出，2025年的國民黨主席選舉，由於中國介入的痕跡非常強勢而顯見，這會是一場非常關鍵，攸關2026與2028台灣是否仍將持續享有民主的政治戰爭。根據聲量分析，這場選舉最後無論是鄭還是郝，都已經成為中國利用演算法介入操控民主國家選舉的一場「實驗典範」。請繼續往下閱讀...「聲量看政治」po出泛藍與泛紅陣營的YT聲量圖，表示其軌跡清楚顯示，這場國民黨主席選舉已經不是單純的黨內投票，而是被中國演算法「養成」的一場政治實驗。「聲量看政治」說明，在泛藍的趨勢圖裡，郝龍斌在9月底靠組織與媒體曝光領先；但10月中之後，鄭麗文的影片數與觀看數暴衝，短時間超越郝。這個暴增現象，是趙少康批評的中國介入，是演算法灌注與境外帳號推播的結果。「聲量看政治」分析，中國的策略很明顯：先測試誰能撐起話題，再利用流量將她推成焦點，觀察藍營內部的情緒反應。外表看似輔選，但實質上，是控制輿論。「聲量看政治」也解釋，在第三與第四張泛紅聲量圖中，我們可以看到一個微妙的分水嶺。10月初之前，郝龍斌在泛紅影片與觀看數上都領先；10月10日前後，鄭麗文的藍線急升、郝被壓下，但到了10月14日之後，郝又出現「後起直追」的回升曲線。「聲量看政治」分析，這可能是一種「雙測策略」，中國或促統頻道在實驗兩種模板：鄭麗文的「親中對話派」與郝龍斌的「傳統建制派」。當鄭的議題熱度達標、但外部反彈升高時，系統便回撥資源給郝，以測試「紅色聲量能否重新洗白溫和派形象」。換句話說，北京的介選策略也可能不是在「押一人」，而是「讓兩條線互相競爭」，讓整場選舉成為控制輿論節奏的「模擬實驗」。「聲量看政治」也指出，郝龍斌的後起直追，並非他在網路突然變強，而是結構性反彈。第一，他在被攻擊後公開喊「中國不要介選」，反而意外吸引中間與傳統藍營觀眾的關注，形成「被害者聲量」。第二，促統陣營內部也出現策略修正。一部分中國／紅媒帳號開始將郝重新包裝為「能穩定兩岸、避免藍營分裂」的替代選項。「聲量看政治」認為，對北京來說，若鄭麗文被批太親中導致形象反噬，那郝龍斌的「中庸保守」就成了修復輿論的備胎。至於第三，黨內其他候選人如張亞中、羅智強等人開始發聲批鄭，這些聲音雖不挺郝，但在演算法運算中卻間接抬高郝的搜尋與被關注頻率。結果就是，中國流量一度推鄭，卻在風向失衡後又用郝做修正。「聲量看政治」提到，在10月中後段，促統自媒體如「海峽之聲」與部分紅色頻道，開始出現「郝龍斌更務實」、「兩岸需要冷靜對話」等論調，暗示北京在測試誰掌控舞台，在台灣能獲得迴響。同時，趙少康呼籲「中國不要再插手」，被紅媒放大轉傳，變成「郝龍斌陣營能與紅方對話」的象徵。這是一種非常高明的操控：把反介選的聲音包裝成「理性、可交流」的形象，讓郝在紅藍之間重新獲得曝光優勢。「聲量看政治」也指出，張亞中直接批鄭「攻擊同志、不配領導」，雖然這是內鬥語言，但在演算法環境中，卻幫郝創造了更多被搜尋、被點擊的機會，結果紅色流量回流，郝的線再度上揚。「聲量看政治」表示，郝龍斌的後期回升，其實象徵中國輿論機器進入「AI平衡模式」。他們不讓一個候選人爆紅太久，而是利用資料調整讓兩邊交錯上升，確保雙方都被控制在「可操作區」。這樣的輿論動態能製造混亂、分散焦點，也讓外界難以辨認真正的主導力量。「聲量看政治」強調，郝龍斌的聲量回升，可能只是他被「演算法再分配」；鄭麗文的領先，不是民意爆發，而是被「流量推送」；整場選舉，本質上是一個由中國網軍帳號在運行的輿論實驗室。「聲量看政治」也總結，目前來看，鄭麗文在網路聲量上仍佔微幅領先（尤其泛紅觀看數）；郝龍斌的聲量回升，使得他重新取得傳統黨員與「理性藍」的信任。若中國帳號在選前最後48小時再次大量推播鄭的議題，可能出現「紅流尾盤」效應，使鄭逆轉小贏。「聲量看政治」也強調，但無論誰勝，國民黨已正式淪為中國AI演算法的測試場。這場選舉輸贏的，不只是候選人，而是藍營是否還擁有說話的主權。「聲量看政治」形容，「當民主變成數據劇本，藍營只是演員」，並直言，「這場國民黨主席的內部選舉，最關鍵的是紅色演算法開始學會如何操控民主。郝與鄭之間的聲量起伏，不只是人氣比拚，而是一場『演算法控制民意』的社會實驗」。「聲量看政治」在文末指出，中國不一定要派人來台選舉，只要在雲端按下指令，就能決定哪一方成為新聞焦點。「聲量看政治」也示警，「當民主被流量定義，國民黨只是第一個失去靈魂的政黨，下一個，可能就是整個台灣」。「聲量看政治」po出泛藍與泛紅陣營的YT聲量圖，表示其軌跡清楚顯示，這場國民黨主席選舉已經不是單純的黨內投票，而是被中國演算法「養成」的一場政治實驗。（圖擷自臉書）熱門賽事、球星動態不漏接    ,https://news.ltn.com.tw/news/politics/breakingnews/5212879
