Title,News_Type,date,content,url
柯志恩認政院版財劃法更細緻 賴瑞隆酸自打臉籲支持院版顧高雄,政治,2025/11/21 14:06,賴瑞隆呼籲國民黨與柯志恩支持行政院版財劃法，才是真正顧高雄。（賴瑞隆提供）行政院昨 （20日）提出院版《財政收支劃分法》修正案，納入民進黨立委賴瑞隆法案主張的產業外部污染、人口結構等指標，連國民黨立委柯志恩都表達肯定，認為院版的分配指標比現行制度更為細緻；對此，賴瑞隆指柯此番發言，等同自我打臉、呼籲國民黨與柯志恩停止獨厚台北、傷害南部，共同支持行政院版才是真正顧高雄。柯志恩表示，院版的分配指標比現行制度更為細緻，例如清楚區分「財政努力」與「基本建設」兩大指標，前者包括營利事業營利額、稽徵努力度；後者則涵蓋工業就業人口、農林漁牧人口與相關產值，同時也調整營業稅、貨物稅、菸酒稅的分配方式，並將22縣市納入一致公式，兼顧離島、考量人口結構，也照顧直轄市與工農業縣市的不同需求，這些制度性改善，都值得肯定。請繼續往下閱讀...柯志恩也說，行政院應盡速公布22市縣的試算結果，並誠懇徵求地方政府的認同與支持，讓社會共同檢驗是否公平合理。唯有透明公開、充分討論，才有機會完成真正的財政改革。她也期許最後朝野能達成共識，讓財劃法的爭議早日畫上句點。對此，賴瑞隆批評，身兼國民黨智庫執行長的柯志恩與藍白，主導通過首都3%、「獨厚台北」的法案，造成南北資源差距加劇惡果，也使高雄實質損失超過200億，這1年南部居民嚴重反彈。柯志恩一面發文肯定行政院版草案「加入更多指標更加細緻」，另一面又批政院「太慢」，然而他多次公開呼籲應重視人口等指標，柯志恩此刻說法，等同承認過去封殺賴版是悖離民意、屈從傅崐萁黨意、犧牲高雄利益。賴瑞隆批評，柯志恩的言論就是為了幫自己找台階下，等同承認國民黨的財劃法悖離民意、內容不公、立法過程倉促。「這1年來卻不敢為高雄發聲，這樣還想選高雄市長？全體市民都無法接受這樣欺騙、卸責、雙標的行為！」賴瑞隆強調，高雄人口多、土地大、承擔工業城市，支持行政院版本財劃法讓南部有更合理的財政分配，並導正藍白惡法影響南部未來數十年的建設發展。呼籲柯志恩與藍白兩黨盡速重新修正財劃法，支持行政院版本，不要再說一套做一套，還給高雄人最基本的公平正義，讓台灣的財政分配回歸正軌。熱門賽事、球星動態不漏接    ,https://news.ltn.com.tw/news/politics/breakingnews/5253541
交通助理員開單惹議 南市議員舉社區「自取店」違停案例力挺,政治,2025/11/21 14:04,台南市區常可見民眾為圖一時方便，隨意併排違停。（林依婷提供）台南市交通助理員取締違停引發爭議，目前市議會也正在審查南市明年度的總預算，在市長黃偉哲宣布暫緩開單後，連日來各界爭論不斷。台南市議員林依婷今天質詢，舉自己社區違停為例力挺交通助理員，呼籲市長堅持住助理員預算，也請議會同仁為了台南的交通，不要刪明年度預算。林依婷表示，他們社區前陣子開了一家蝦皮自取店，住戶原本很開心，結果卻是夢魘的開始。該店就在社區車道出入口旁，自開店後違停不斷，不管是取貨、送貨或保全來收錢全都違停，擋住了車道出入口視線，住戶每次要開車出門，險象環生，「還沒出家門，就先出車禍」。請繼續往下閱讀...林依婷說，要報警察，等警察來了，車也走了，不報警則一直違停，實在很困擾。後來社區提出兩方案，一是請蝦皮在上下班尖峰時段關閉取貨功能，但未獲官方回應；二是請社區保全站崗，驅趕違停，結果這比報警還有用。她說，社區保全不能開單也無強制力，但卻解決社區違停長期的困擾。她不敢說助理員可徹底解決南市交通違停問題，但從她社區案例顯示，為何台南需要交通助理員。其目的不是要開單而是驅離，讓大家在台南可以好好騎車、開車，不要像開障礙賽一樣。驅離的工作，社區保全做得來，助理員也可以，只要在重大違停熱區不斷地巡邏，並只對併排、路口、人行道違停等重點開單，相信市民也不會反對。市長黃偉哲表示，交通助理員的預算會來維護，也會請議會支持。社區保全都能做好的事，沒有道理交通助理員做不好。警察局長林國清則表示，助理員可以協助警方，減少交通事故發生，會要求助理員針對重大違停熱點執行。南市警局統計，8月交通助理員上路後，取締嚴重違停5038件、每人每天平均開單9件；9月3489件、平均開單6件；10月1131件、平均開單2件；原府城6區今年8至9月發生死傷事故3229件，較去年同期減少61件，減少1.9％。路口轉彎處違停嚴重影響交通，也險象環生。（林依婷提供）南市議員林依婷今天質詢，力挺交通助理員，主張加強驅離違停而非以開單為目的。（擷取自南市議網站）熱門賽事、球星動態不漏接    ,https://news.ltn.com.tw/news/politics/breakingnews/5253432
賴清德「吃壽司」文已破2000萬瀏覽！  登上所有主流日媒,政治,2025/11/21 14:03,"幾乎所有日本主流媒體報導都報導賴清德吃壽司的X文。（取自日媒，本報合成）日本首相高市早苗「台灣有事」表態，引發中日關係緊張。中國19日以「放射線檢驗不充分」為由，禁止日本水產品進口。對此，總統賴清德以行動表達力挺日本水產，在社群平台X上秀出「午餐壽司照」。目前該貼文在X上受到廣大日本網友轉傳，已突破2000萬次瀏覽，此事也被幾乎所有日本主流媒體報導。在高市「台灣有事」言論後，中國先在黃海實彈射擊，接著又發布旅遊警示，再來又禁止日本水產品進口。對此，賴清德在X上曬出午餐圖，表示20日午餐為壽司還有味噌湯，裡面有來自鹿兒島的鰤魚和北海道的帆立貝。請繼續往下閱讀...賴清德的舉動引起大量日本網友迴響，紛紛在推文下方留言：「看到台灣總統賴清德在社群媒體發布自己享用日本扇貝的照片，我深受感動」、「台日友好！」、「謝謝台灣總統」，目前該貼文已有超過2000萬次瀏覽，且瀏覽數還在快速攀升中。目前貼文也有超過4000則留言，26萬人點讚，並有2萬9千次以上的分享，已成為超熱門貼文。此外，《NHK》、《讀賣新聞》、《每日新聞》、《產經新聞》、《共同社》、「日本電視台」、「富士電視台」等主流媒體，全部都報導了賴清德的X貼文。部分媒體直接表示，台灣民進黨政府此舉，用意在表明對日本的支持；另也有媒體引述貼文下方留言表示，有台灣網友表示，日本過去曾力挺台灣鳳梨，「現在是回報的時候」。きょうの昼食はお寿司と味噌汁です????????#鹿児島産のブリと北海道産のホタテ pic.twitter.com/bww7iylzI4— 賴清德Lai Ching-te （@ChingteLai） November 20, 2025 きょうの昼食はお寿司と味噌汁です????????#鹿児島産のブリと北海道産のホタテ pic.twitter.com/bww7iylzI4熱門賽事、球星動態不漏接    ",https://news.ltn.com.tw/news/politics/breakingnews/5253280
桃市議員選舉起跑？ 爭取民進黨提名的張贊聞今早站路口,政治,2025/11/21 13:58,張贊聞（左）開始站路口爭取民眾支持。（記者周敏鴻攝）桃園市議員選舉預計明年（2026年）底舉辦，民進黨初選可能在明年4月登場，有意爭取民進黨提名在龍潭區參選市議員的張贊聞，今早已在龍潭區中正路口向忙著上班、上學的民眾爭取支持，讓許多經過的民眾好奇：「桃園市議員選舉，已起跑？」張贊聞站路口也發布參選宣言，盼以「龍潭出發，真心前行」為核心理念、以「看得見、找得到、放心托付」服務精神，結合民進黨正國會的力量與資源，推動地方發展，打造更有安全感、更有幸福感的龍潭家鄉。請繼續往下閱讀...談起從政前的經驗，張贊聞說，從小送報讓他具備了客家人的「硬頸」精神，服役時擔任憲兵指揮部指揮官隨行駕駛而學會「使命、責任與信任」的重要性，退伍後在車用電池買賣領域超過20年才深知企業經營與基層民生的不易，成為他想參選的動力。「我將從今天起，每天站路口，直到民進黨初選為止，盼讓更多龍潭鄉親認識我、認同我！」張贊聞說，站路口的第1天，他就感受到龍潭鄉親的友善與熱情，有人提醒他「天氣冷要多穿一點」，有人看到他熱情揮手，也在車陣中露出靦腆微笑回應「早安」，更讓他決心未來當選市議員後，一定要積極服務、帶來改變，讓所有人都能過更美滿的生活。熱門賽事、球星動態不漏接    ,https://news.ltn.com.tw/news/politics/breakingnews/5253525
普發1萬正在領 嘉縣梅山鄉民12月加碼領3000元,政治,2025/11/21 13:51,梅山鄉長林俊謀（右）推動梅山鄉韌性經濟方案，鄉代會主席林茂山（左）表達支持。（資料照）中央普發1萬元陸續開放不同管道提供民眾領取，嘉義縣梅山鄉公所推動「梅山鄉韌性經濟方案」普發鄉民慰助金每人3000元，將於12月8日至12日規劃18個場次發放，估計18個村約1萬7153人可領取。梅山鄉長林俊謀表示，7月的丹娜絲颱風、西南氣流豪雨重創嘉義，梅山鄉農業、觀光等產業受重創，民宅毀損嚴重，鄉民的家園與生計都受到影響，獲鄉民代表會支持，將發放「梅山鄉韌性經濟方案慰助金」，盼讓受災戶修復家園、活絡地方觀光經濟。請繼續往下閱讀...林俊謀說，鄉民慰助金3000元採實體發放，第一階段從12月8日至12日規劃18場次發放，鄉親可依照村別前往領取；發放對象為8月31日前設籍在梅山鄉且至今沒有遷出的鄉民，8月31日前出生還未辦理出生登記的新生兒，或初設戶籍登記的新生兒，在領取期限前辦妥戶籍登記也可領取。林俊謀表示，如沒有在發放期限內到各村領取者，將進行第二階段由民眾到公所社會課領取，今年12月31日前要領取，逾期視同放棄，相關日期與發放對象、方法，已經在公所網站上公告。梅山鄉公所公布慰助金發放對象。（梅山鄉公所提供）公所依村別規劃18場次發放3000元。（梅山鄉公所提供）熱門賽事、球星動態不漏接    ,https://news.ltn.com.tw/news/politics/breakingnews/5253420
「投降論」興起瓦解民心！ 清大學者警告︰城池恐不攻自破,政治,2025/11/21 13:49,投降比較安全？清大學者黃貞祥提醒國人，若輸了心城池恐不攻自破。（照片取自黃貞祥臉書）台灣中央政府近期透過村里系統發放「當危機來臨時」的《台灣全民安全指引》，但國民黨前發言人李明璇拿手冊當中的一句話來質疑政府，並稱「不投降從來都不是一個負責任的政府該做的，守護人民才是」，對國民黨這樣的說法，清大學者黃貞祥認為，中共長期持續的認知作戰，台灣社會正被推向一個危險的思考模式–有愈來愈多人認為投降比較安全。這種氛圍看似無害，但本質上正是心理戰最成功、也最具破壞力的結果，如果民主社會相信「抵抗沒有用」、「投降可以保命」，那真正的崩潰不會發生在戰場上，而是發生在民心的瓦解。若輸了心，城池恐怕不攻自破。在《台灣全民安全指引》手冊中的第19頁「倘若臺灣遭受軍事侵略，任何有關國家戰敗或政府宣布投降的訊息，都是假訊息」，此內容被李明璇解讀是政府在恐嚇人民、把責任丟給地方，而且強調「不投降從來都不是一個負責任的政府該做的，守護人民才是」。她這樣的言論也引發批評，黃貞祥認為，當投降比較安全的想法由政治人物帶頭倡議時，投降不僅成為輿論選項，甚至會被包裝為和平的選項。請繼續往下閱讀...但投降不會換來和平，投降後的台灣，不會如同許多人想像的那樣，繼續維持原本的生活方式。更可能發生的，是護照失效，鄰國限制入境，台灣人突然發現自己不能再自由旅行、不能再自由發聲、不能再自由選舉。更深層的，是銀行資產可能被凍結，網路被封鎖，新聞被統一口徑，甚至連「我是台灣人」這句話都會成為禁語。面對侵略者本身就是迫害者的情況，投降不能保護人民，只是把人民交出去任其宰割。政府在安全指引中強調「任何關於宣稱政府投降的訊息都是假訊息」並非散播恐懼，而是民主國家的基本責任。熱門賽事、球星動態不漏接    ,https://news.ltn.com.tw/news/politics/breakingnews/5253413
賴清德總統雲林參拜  喊「不同黨沒關係同國最要緊」籲各界團結一致對外,政治,2025/11/21 13:48,賴清德總統（中）與地方黨公職人員一起到西螺吳厝朝興宮參拜，並揭匾。（記者李文德攝）賴清德總統今（21）日到雲林縣西螺鎮吳厝朝興宮參拜並贈匾揭牌，受到當地民眾熱烈回應。賴總統致詞談到，政府訂定三大國政，打造「台灣之盾」、創造經濟繁榮、帶動社會福祉，並強調不同黨派沒關係，「同國最要緊」，媽祖也不會有黨派之分，希望各界能夠團結一心，面對外來威脅能夠一致向外抵禦。賴總統大約11點10分抵達廟宇，由朝興宮主委廖承洋與其管理委員會團隊，行政院雲嘉南聯合服務中心副執行長陳怡帆、西螺鎮長廖秋萍、崙背鄉長李泓儀、褒忠鄉長陳建名、縣議員洪如萍、林文彬等民進黨公職人員一同出席。請繼續往下閱讀...總統從大門口進場後，眾人大聲喊「總統好」，賴總統與廟方人員擊掌後，進入參拜、合影，最後正式揭開「慈雲吐澤」牌匾。賴總統首先致詞肯定朝興宮對於地方的付出，也肯定廟方協助擔任國軍後備工作，也為國民祈福，因為今年颱風接連重創雲、嘉、南、花、宜，祈求媽祖能夠庇佑全國。賴清德向民眾談到三項國家政策，他先說，面對中國威脅，要讓國家更加安全，因此更要提高國防力量，最重要也要維持國防自主產業，全世界現僅有5個國家有國防自主能力，包括美日韓中台，因此國防相關產業每個環節都需做好，因此他要為國家打造一座「台灣之盾」，保護2300多萬人民。賴清德再談，第二就是要再推動經濟發展，馬英九時代8年，總結算每年經濟平均成長率2.8％，股市大盤指數8000點，蔡英文總統成長為3.2%，指數上看2萬3000多點，直至今年第三季經濟成長率達7.6%，指數約2萬7000多點，整體經濟持續成長，現在國民年均所得上看3.8萬美金，贏過日韓，將持續推動高經濟政策，提高我國競爭力。賴總統表示，第三就是創造社會福祉，包含減稅、0到6歲國家一起養、育兒津貼、公共托育補助、私立大學補助學費等，讓民眾能夠感受到政府對人民的照顧。賴清德表示，執政黨不管在行政院、立法院都不斷努力推動政策，因為國家是大家共有的，因此民眾有需要時國家都要站在一起，「不同黨沒關係，同國最要緊」，像是媽祖婆也沒黨派之分庇佑民眾，希望各界團結努力，面對外來威脅一致對外抵禦。賴清德總統（中）與地方黨公職人員一起到西螺吳厝朝興宮參拜，並揭匾。（記者李文德攝）賴清德總統與地方黨公職人員一起到西螺吳厝朝興宮參拜，並揭匾。（記者李文德攝）賴總統談三項國政，更強調不同黨沒關係、同國最要緊，呼籲各界國結。（記者李文德攝）賴清德前往吳厝朝興宮參拜並贈匾，廟方回贈迷你公仔。（記者李文德攝）熱門賽事、球星動態不漏接    ,https://news.ltn.com.tw/news/politics/breakingnews/5253492
