Title,News_Type,date,content,url
苗栗小一女童遭虐「社工失能」？ 縣府嚴正駁斥,社會,2025/11/16 09:19,對於網友發文指苗栗小一女童遭虐「社工失能」？ 縣府說明並嚴正駁斥。（資料照）網路社群Threads一則發文指，苗栗縣一名國小一年級女童遭繼母施虐、社工失能未處理。苗栗縣政府社會處證實，該女童傷勢是遭繼母掌摑所致，已於7月介入查證並啟動處遇相關機制，絕無「社工失能」情事，惟考量該家庭照顧壓力，昨（15日）將女童安置。網友發文指出，苗栗有一名小一的小女生，被繼母虐待嚴重，全身是傷，學校老師通報社工，社工說繼母最近有改善照顧不錯，每天送回一樣的鬼地方被虐。最近發生半夜被繼母趕出家門，小一女童在外遊蕩被通報警察，警察送回繼母家，繼母拒收，說她不要這個小孩，然後警察帶去安置一晚，第二天再送回去鬼地方繼續被虐。請繼續往下閱讀...網友表示，社工有立案，但是就是拖拖拉拉失能狀態。繼母已經在社工以及小孩面前多次說不要這個小孩，社工鬼打牆說繼母最近照顧很好，反正就是沒有任何人可以幫助這個小孩，請問該怎麼辦？有屬於中央的社工警察可以立即介入嗎？社會處則表示，該個案於7月獲報後立即啟動社福中心、保護社工及教育單位共同介入，並持續家訪、關懷與風險評估。此次再接獲網友發文訊息後，也第一時間派員前往案家查證，未發現網傳之「嚴重虐待」情形，先前追蹤期間，雖確認家庭教養壓力較高，惟並無立即危險或外界所稱之嚴重虐打情況。社會處表示，網友發布女童傷勢照片，是7月遭繼母掌摑所致；另女童也無深夜在外遊盪之情，也無在警局過夜的狀況。社工昨天復訪後，考量家屬情緒不穩、教養方式不足，為保障兒童安全，已依法立即啟動安置措施並提供後續支持。社會處並說明，網友發文指出案主受到嚴重虐待，與事實不符，另女童也無深夜在外遊盪之情，係因案主與照顧者在生活照顧上議題的衝突，導致案家屬有情緒問題，後續經協調友人協助照顧一晚，並無在警局過夜的狀況。社會處強調，此案自7月正式立案後，社工介入從未延誤，依法執行風險評估、密集訪視、家庭功能連結、親職輔導、學校合作等服務，完全不是網路所稱之消極或放任。且兒少保護處遇決策需建立在專業判斷與風險評估，不可能因片段影像或未經查證的留言就任意做出判斷。對於網傳「社工失能」，縣府嚴正駁斥，並呼籲網友立即停止散播未經查證之內容，以避免對兒少造成二度傷害，共同守護兒少安全。網友在網路社群Threads一則發文指，苗栗縣一名國小一年級女童遭繼母施虐、社工失能未處理。（翻攝Threads）熱門賽事、球星動態不漏接    ,https://news.ltn.com.tw/news/society/breakingnews/5247519
台中妙齡女唱KTV突昏迷  警火速鳴笛護送就醫,社會,2025/11/16 09:08,台中謝姓女子近日唱KTV突然昏迷，友人發現焦急抱著下樓就醫，剛好碰到執勤員警，坐上警車火速送醫。（記者陳建志翻攝）台中市一名20多歲謝姓女子，近日深夜和友人到KTV唱歌，疑因舊疾發作陷入昏迷，包廂內友人發現，趕緊抱著她下樓送醫，所幸台中市警局第五分局的員警剛好在附近執勤，得知後立即請抱著謝女的男友一起坐上警車，火速鳴笛送醫，不到5分鐘就抵達醫院急診室，經就醫後已無大礙慢慢恢復，友人感謝員警的及時協助。本月12日凌晨0點30分左右，第五分局松安派出所員警陳佳瑋、王瑋祥，正在北屯區崇德十路執行守望勤務時，突然發現某KTV大廳內有人員騷動，接著有一群人跑出店外衝向員警，其中1名男子懷中抱著1名疑似昏迷的謝姓女子，眾人異口同聲表示女子身體不適，等不及救護車，請求員警幫忙緊急送醫。請繼續往下閱讀...員警確認狀況後，立即請抱著謝女的男友坐上警車，火速鳴笛送醫，不到5分鐘就抵達中國醫藥大學附設醫院急診室，經醫護人員處置後，才得知原來是謝女舊疾發作但未隨身攜帶藥物，導致情況緊急嚇壞友人，經醫護人員接手救治後已恢復意識，生命跡象穩定，感謝員警及時協助送醫。第五分局分局長劉其賢表示，為民服務是每一位警察的責任，雖然警方能在危急時刻提供協助，但仍呼籲民眾，若遇到緊急救護情況，應立即撥打119請求專業救護人員的協助，也能避免在前往醫院的途中衍生其它意外發生。台中謝姓女子近日唱KTV突然昏迷，友人發現焦急抱著下樓就醫，剛好碰到執勤員警，坐上警車火速送醫。（記者陳建志翻攝）熱門賽事、球星動態不漏接    ,https://news.ltn.com.tw/news/society/breakingnews/5247514
彰化市大樓暗夜狂燒！17名住戶睡夢中嗆傷被救出送醫,社會,2025/11/16 08:27,大火過後樓房被燻黑。（圖由消防局提供）彰化市中華西路一棟集合住宅大樓今天（16日）清晨突從1樓起火燃燒，火勢一度相當猛烈濃煙竄天，消防局派出52名消防人員趕抵搶救，大樓住戶睡夢中被驚醒後驚慌逃命，有不少人被濃煙嗆傷，消防員逐層搜索，陸續救出受困的住戶，經清點共有17名住戶嗆傷送醫，所幸都無生命危險；警方初步了解起火點疑為1樓機車，是否機車自燃或遭縱火已展開調查。彰化縣消防局今天清晨3點多獲報中華西路5層樓建築的集合式住宅大樓起火燃燒，還傳出有住戶受困火場待救，消防局派出52名消防員與消防車15輛、救護車11輛趕往現場搶救，彰化市長林世賢接獲通報也趕往現場關切。不少住戶被濃煙嗆傷送醫。（圖由消防局提供）彰化市中華西路大樓火災，火勢相當猛烈。（圖由消防局提供）住戶被濃煙嗆傷送醫。（圖由消防局提供）彰化市中華西路大樓火災，消防員部署水線搶救。（圖由林世賢提供）彰化市中華西路大樓火災，消防員部署水線搶救。（圖由林世賢提供）不少住戶被嗆傷。（圖由林世賢提供）熱門賽事、球星動態不漏接    ,https://news.ltn.com.tw/news/society/breakingnews/5247495
男猥褻友人9歲女兒 竟說「想要你幫我生小孩」,社會,2025/11/16 08:02,台東地方法院。（記者黃明堂攝）高姓男子覬覦友人的9歲女兒，兩度在對方住宅內實施搓揉胸部等強制猥褻行為，還對她說「想要你幫我生小孩」；經女童老師報案，檢方依對未滿14歲之女子犯強制猥褻罪起訴，高男坦承犯行，女童父還可憐損友沒錢，願意原諒，向法官求情，但台東地方法院法官認為高男逞一己私慾，枉顧女童身心健全，兩罪判3年6月。判決書指出，高男於前年某日在女童住處與其父飲酒時，見女獨自一人身處倉庫內，強行抓揉女胸部達10秒，以此方式為強制猥褻行為1次得逞。隔年則侵入女童住處後，強行抓揉胸部達10秒，並對女童稱：「想要你幫我生小孩」、「想吸你的胸部」等語，並作勢要親吻她的臉頰、嘴唇，經女童向老師告知後，警方報請檢方偵查起訴。請繼續往下閱讀...高男偵查中、法院審理中均坦承不諱，被害人父親表示他以及女兒都願意原諒被告，高男沒有錢，沒有要對他求償，高男之辯護人請求酌減其刑，但法官不接受，審酌高為逞一己私慾，罔顧被害人為年僅9至10歲之幼女，對其為強制猥褻行為，影響她的人格發展與心靈健全，念及被告犯後坦承犯行，犯後態度尚可，判處3年6月。熱門賽事、球星動態不漏接    ,https://news.ltn.com.tw/news/society/breakingnews/5247489
獨家》老天有眼！假冒檢察官詐640萬 彰化「收水手」屏東車禍被逮,社會,2025/11/16 06:01,吳男駕駛白色BMW轎車，在銀行對面馬路監控陳姓兄弟面交收款過程。（記者陳冠備翻攝）首次上稿 00:26更新時間 06:01吳姓板模工加入詐欺集團擔任「收水手」，平日行蹤飄忽，甚至租BMW豪車監控車手收取贓款。去年，他指揮陳姓兄弟到彰化員林假扮檢察官，向婦人詐走現金與黃金共640萬元後人間蒸發。警方苦於車主與駕駛身分對不上，追查一度斷線，未料案發7天後，吳男竟駕同一輛BMW在屏東肇事撞爛，身分也因此曝光，破案過程宛如電影橋段。彰化地院依加重詐欺等罪，判刑3年6月，可上訴。請繼續往下閱讀...判決指出，詐團於2023年5月冒用「警官」與「檢察官」名義，指控陳姓婦人涉入刑案，恐嚇若不繳交保證金就會遭拘提。婦人驚慌失措，陸續領出資金購買黃金500萬元，其餘140萬元則以現金支付，於5月11日至19日分4次交給由陳姓兄弟假扮的「檢察官」。警方循線逮到陳姓兄弟，兩人供稱「收水手」開著白色BMW監控取款過程，且事前還透過通訊軟體告知「我會在附近看」。警方調閱沿線監視器，果然拍到兄弟過馬路取款時，一輛白色BMW 3系列停在紅燈前。查車牌找到車主後，車主兒子卻表示，車子4月已租給一名余姓男子，但租賃文件遺失，真實身分不明，案情再度陷入膠著。正當線索卡住之際，車主的兒子又透露，該BMW於5月26日在屏東發生車禍後就放在當地保養場。警方立即向屏東警方調閱肇事資料，果然發現肇事駕駛正是吳男，「收水手」身分終於水落石出。彰化地院審理時，吳男否認犯行並辯稱，一切純屬巧合，他雖認識陳姓兄弟，但未涉犯行。法官質疑，取款當天吳男「剛好」開車在旁等紅燈、7天後又「剛好」撞車，加上兩名車手剛好」認識，證詞一致，實難想像會有如此之巧合，且吳男指揮未成年人犯案。全案依「成年人與少年共同三人以上冒用政府機關及公務員名義犯詐欺取財罪」判處吳男3年6月徒刑，並沒收640萬元贓款。熱門賽事、球星動態不漏接    ,https://news.ltn.com.tw/news/society/breakingnews/5247446
一點之差 換騙子虧大了／詐黃金500萬 判沒收1.6億,社會,2025/11/16 05:30,判決書中記者，被害人到銀樓花500萬元買683.32兩黃金。（記者顏宏駿翻攝）依詐團指示花500萬買黃金銀樓開具收據就誤植彰化縣陳姓婦人前年五月誤信詐騙電話，把所購五百萬元黃金與現金一四〇萬元，交給車手陳姓兄弟，再轉交上一層「收水手」吳恩廷，三人落網後，陳婦出示購買的六八三．三二兩黃金收據，彰化地院將否認犯行的吳男判處三年六月徒刑，未扣案現金一四〇萬元與六八三．三二兩黃金沒收；法官宣判沒收而要求詐欺集團被告交出的黃金重量，換算現值價高達一億六六四萬餘元。實際上，陳婦於二〇二三年五月掉入詐團陷阱後購買的黃金，實重為六八．三三二兩，但銀樓業者開具的收據誤植為六八三．三二兩，因一路下來無人發現糾正，彰院遂依此宣判，可上訴。請繼續往下閱讀...黃金價格 兩年多已翻倍陳婦購金當時，一兩市價七萬二三六五元，兩年多來黃金價格翻漲，以臺灣銀行最新公告的黃金存摺賣出價格，一兩十五萬六〇七五元計算，陳婦購買的六八．三三二兩黃金，現值一〇六六萬餘元，但「一點之差」造成法院認定陳婦被騙的黃金現值為一億六六四萬餘元。判決書指出，吳男是詐團「收水手」，指揮車手陳姓兄弟詐財，前年五月陳婦接到假檢警電話，指其涉入刑案，不交出財產將拘提羈押，陳婦嚇得領出一四〇萬元交給陳姓兄弟，又到銀樓花費五百萬元買黃金，也全部交給陳姓兄弟，二人均轉交給吳；警方拘捕三人時，未查獲黃金與現金。被告沒請律師、沒出庭檢審也未發覺數據有誤陳婦配合檢警偵辦，出示銀樓所開收據（憑證），相關被告均未聘請律師，檢、審也未發覺數據有誤。彰化地院認定黃金與現金最終流入吳男手中，吳又利用未成年人犯罪，應加重刑度，依「成年人與少年共同三人以上冒用政府機關及公務員名義犯詐欺取財罪」將吳判三年六月，黃金六八三．三二兩與現金一四〇萬元沒收；陳兄獲判一年九月、未成年的陳弟另由少年法庭審理。熱門賽事、球星動態不漏接    ,https://news.ltn.com.tw/news/society/paper/1732261
吵架手越門指人 遭辣椒水反擊／不算正當防衛 判拘,社會,2025/11/16 05:30,莊男在自家門前與鄰居口角，見鄰居手伸過鐵門，拿辣椒水反擊，致鄰居眼睛受傷。一審被判拘役10日，高院駁回上訴。（資料照）莊姓男子與鄰居不睦，去年見對方手指越過自家鐵門指向自己，拿出辣椒水噴灑，害對方雙眼受傷，台南地院依傷害罪判拘役十日、得易科罰金，高等法院台南分院也認定噴辣椒水非正當防衛，駁回莊男上訴，仍判拘十日。去年八月，莊男站在台南住處庭院內，鄰居則在馬路邊與其發生口角，走近柵門外抓住鐵門，左手一度伸入門的上方，用手指指向門內的莊男，雙方隔鐵門叫罵，但無肢體碰觸；隨後莊男拿出辣椒水朝鄰居臉部噴灑，對方眼睛灼痛就醫，報警提告。請繼續往下閱讀...一審法官勘驗畫面後認為，鄰居雖出言挑釁、伸手越過鐵門指人，但沒有打開柵門闖入，也沒揮拳攻擊。莊男若擔心人身安全，可保持距離或報警處理，卻選擇站在柵門內側近距離對峙，並朝對方臉上噴辣椒水，認定非單純排除干擾，構成傷害罪。莊男上訴時強調自己長期遭鄰居滋擾，過去常報警與提告，案發當天也曾打電話向警方求助，卻換來對方在家門前咆哮、攀扶鐵門，甚至接近門鎖。他在庭上表示，家中有失智祖母站在鐵門旁，他擔心鄰居衝進來傷人，只好在反覆喊「離開」並提醒那是辣椒水後才噴灑，當時是為保護自己與家人。台南高分院合議庭再次勘驗監視畫面後指出，畫面看不到鄰居打開鐵門或攻擊，只見人在門外指罵、抓著鐵門邊；莊男是在無肢體衝突、對方也未出現不法侵害時，用辣椒水噴人，不符合正當防衛要件，遂維持原判決，同時宣告沒收辣椒水。熱門賽事、球星動態不漏接    ,https://news.ltn.com.tw/news/society/paper/1732266
普發萬元詐騙 9人受害近千萬,社會,2025/11/16 05:30,表格假檢警手法最多 幫轉一六五反詐騙專線是陷阱「普發現金一萬元」正值領取熱季，政府之前已公布登記時間、領取方式及領取時日等，但詐騙集團提前趁著這股熱湖，結合假檢警、假網址與代領、冒領等手法設局行騙。刑事警察局統計，九月以來已有九位民眾受騙、財損九三三萬元，財損最多的是台北市一名退休婦人遭詐三二〇萬元；九案中已有六案逮獲嫌犯。請繼續往下閱讀...目前受害九案中，有五件是結合假檢警手法，一件是透過假的普發現金網站騙取信用卡資料盜刷，三件宣稱協助代領普發萬元現金，聳恿被害人透過超商寄出自己的提款卡等。刑事局統計，近期民眾來電反映，接獲與普發萬元現金有關的詐騙電話或簡訊約七、八十件。其中代領的詐騙手法為，先稱民眾身分遭盜用，有人登記代領現金，接著以驗證為由要求民眾提供個資，之後再假冒政府、金融機構寄送簡訊、打電話或傳連結，誘騙民眾點及網址、填資料、輸入驗證碼，甚至操作ATM，以騙取個資及金錢。退休婦被冒領手法詐三二〇萬刑事局表示，上月廿八日，北市一名七十七歲領勞保退休金的林姓婦人，接獲自稱「郵局人員」來電，聲稱有人冒用她的身分證去登記普發現金業務，隨後佯稱幫她轉接「一六五」反詐騙專線，由自稱警政署李姓警員接聽，假警指示被害人加入他的LINE，透過LINE通話與被害人確認名下帳戶金額狀況等。之後，又有自稱楊姓隊長來電告訴被害人，此案可能牽涉洗錢，還用LINE傳假的傳票、搜索票，誆騙若在家中被搜到現金，會被當成不法金流扣押，要被害人將家中現金、金飾等物，以「替你申報該筆錢，以免被當成非法款項」為由，約定面交財產監管。詐團見被害人深信不疑，又以幫忙向檢察官求情為藉口，要被害人加入假檢察官的LINE，還提醒事態嚴重須配合偵查不公開保密，婦人最後將家中三二〇多萬元現金全部交給詐團車手。熱門賽事、球星動態不漏接    ,https://news.ltn.com.tw/news/society/paper/1732264
68兩變683兩 無異議就屬有效判決,社會,2025/11/16 05:30,吳男被判3年6月，「黃金683.32兩」被沒收。（記者顏宏駿翻攝）彰化地院判決詐團「收水手」吳恩廷三年六月徒刑、未扣案現金一四〇萬元與黃金六八三．三二兩沒收，但判決書又記載，被害人「以五百萬元購買黃金六八三．三二兩」，記者發現數字有蹊蹺，彰化地院查證後驚覺有誤，不過本案已宣判，如若被告未提異議，就仍屬有效判決。據了解，陳婦買黃金時非常緊張，未發現收據記載有誤，陳姓兄弟收黃金時，也沒注意，吳則全盤否認犯行，當然也不會爭執黃金重量。全案從購買黃金，一路到檢警偵查與起訴，以及法官審判，皆未發現收據上的「一點之差」，加上被告沒聘律師，沒出庭，更沒聲明重量錯誤，終至做成「沒收億元黃金」的判決。請繼續往下閱讀...被告異議 若有誤將更正彰院表示，法官是依陳婦證述「領出五百萬元購買黃金六八三．三二兩，交給車手」，陳兄也自白承認收下這些黃金，隨後轉交收水手，因而做出判決。彰院認為此事應由吳男提起異議，合議庭循法定程序處理，如確認錯誤，將予以更正。宣告沒收黃金用心良苦不過有法界人士說，法官宣告沒收的是黃金，此為法官用心良苦，近年黃金飆漲，對被害者有利，吳男若沒提出異議，未來判決確定後拿不出黃金，執行檢察官就要查扣相當於六八三．三二兩黃金、換算市值逾億元的吳男財產。若異議後更正為六八．三三二兩黃金，被告也得交出一〇六六萬餘元的資產，而非當初被害人買黃金的五百萬元。惟被告吳男入監前從事板模工，日薪約二千至三千元，暫不論逾億元，目前身家有無千餘萬元，也有待了解。本案最先判決的是陳兄，案發時只領到一萬元報酬，彰院判陳兄一年九月徒刑，宣告沒收一萬元；陳弟由少年法庭審理中。熱門賽事、球星動態不漏接    ,https://news.ltn.com.tw/news/society/paper/1732263
水肥亂倒下水道罰不怕 黑心父子預防性羈押,社會,2025/11/16 05:30,"大江衛生工程有限公司長期違法將水肥傾倒至污水下水道。（記者陳彩玲翻攝）大江衛生劣跡斑斑台北地檢署偵辦水肥業者「大江衛生工程有限公司」長期違法將水肥傾倒至污水下水道案，前日以大江公司負責人陳世富、陳的兒子及游姓媳婦涉犯廢棄物清理法等罪嫌疑重大，且有反覆將水肥傾倒至污水下水道之虞，聲請預防性羈押，北院昨裁定將陳世富、陳的兒子羈押禁見，游婦十萬元交保。不法獲利上百萬媳婦十萬元交保北檢調查，台北市政府二〇一九年間曾發布新聞稿指出，大江公司遭民眾檢舉非法投肥，環保局調查後發現，大江公司將水肥車內糞尿傾倒入社區地下污水處理口，使社區瀰漫糞尿臭味，但大江未取得水肥車清除許可，依法開罰；大江公司早被環保局列為黑名單。請繼續往下閱讀...保七總隊今年再接獲檢舉稱，大江公司從二〇二〇至二〇二三年間，收取一家汽車貨運公司位在台北港區的水肥，但未清運至合格處理場，疑非法傾倒在污水下水道、水溝，並持偽造單據向委託運送業者請款，從中不法獲利上百萬元。台北地檢署十三日指揮保七總隊，會同新北市政府環保局，搜索陳世富、陳的兒子和游姓媳婦三人住居所及公司等處，拘提三人訊問，檢察官前天完成複訊，認定陳男三人涉違反廢棄物清理法、加重詐欺、偽造文書等罪嫌疑重大，有勾串、滅證及反覆實施之虞，向法院聲請預防性羈押。法官昨天裁定將陳世富、陳的兒子羈押禁見，游婦交保。熱門賽事、球星動態不漏接    ",https://news.ltn.com.tw/news/society/paper/1732265
撞車意外落網 未對黃金重量提異議,社會,2025/11/16 05:30,警方發現白色BMW在陳姓兄弟收款附近路口，駕駛這輛車的「收水手」七天後撞車，身分曝光。（記者陳冠備翻攝）詐騙車手會在無監視器拍錄的隱蔽處，將贓款交給上手「收水手」製造斷點，本案從陳姓兄弟處拿走黃金與現金的收水手吳恩廷，雖被警方發現駕駛租來的BMW轎車，案發前出現在附近路口，卻因租車人身分不明而一度斷線，但吳男賊星該敗，案發第七天自己開車肇事而「現形」落網。判決書指出，陳姓兄弟落網後，僅供稱收水手駕駛白色BMW，前年五月十九日向陳婦拿黃金前，收水手打電話告訴兄弟「我會在附近看」，兄弟二人一拿到黃金，立刻到附近停車場交給收水手，再自行搭高鐵回台南住處。請繼續往下閱讀...警方調閱監視器發現，兄弟過路口取款時，一輛頗新的BMW三系列轎車在附近路口，透過車牌號碼查到車主，不過車主的兒子說，車子已租給真實身分不詳的余先生。警方線索中斷之際，車主兒子抱怨說，這輛車在同年五月廿六日疑似超速撞壞，丟在屏東縣的保養廠。彰化警方趕緊調閱車禍資料，肇事駕駛就是吳男，收水手身分水落石出，但吳男否認犯行，僅承認認識陳姓兄弟。收水手否認犯行 服刑中彰化地院法官認為，雙方「剛好」認識，兄弟取款前，吳又「正好」在附近路口，七天後撞車的肇事者又「剛好」是吳男，不可能有這麼多巧合，認定吳男是陳姓兄弟的上手取走黃金與現金，依此判刑。由於該案審理時，吳、陳等人未聘律師，目前服刑中的吳男未出庭，也無被告對被害人收據誤植提出異議，全案因而「順利」宣判。熱門賽事、球星動態不漏接    ,https://news.ltn.com.tw/news/society/paper/1732262
驚悚！穿越馬路追上垃圾車回程卻與機車相撞 婦人、騎士雙倒地,社會,2025/11/15 23:59,紅色上衣的邱姓婦人倒完垃圾後，要穿越馬路回去，與機車相撞倒地，傷勢嚴重。（取自《仁德生活圈》）台南仁德區中清路今天（15日）晚上發生嚴重的交通事故，邱姓婦人穿越馬路，追上停等紅燈的垃圾車，丟完垃圾後回程，與1部微型電動二輪車相撞，她傷重倒地，外籍男騎士也噴飛出去，都被緊急送醫，全力救治，相關肇責正由警方釐清中；車禍過程被後方的行車紀錄器拍下，PO上社群，畫面曝光，相當驚悚。車禍發生在晚間接近7點，當時垃圾車正在停等紅燈，邱姓婦人提著垃圾，從對向跨越雙黃線而來，及時趕上，將垃圾丟路垃圾車內。請繼續往下閱讀...婦人順利丟完垃圾後，準備再穿越車道回去，但當時已經綠燈，對向車道已有車輛行駛而來，邱女疑因視線死角，一跨過雙黃線，就與1部微型電動二輪車嚴重衝撞。相撞後，婦人當場臉部朝下倒地，傷勢嚴重，被緊急送往成大醫院，而男騎士為外籍移工，也噴飛出去，一樣受傷，送高雄榮總永康分院；2人均無生命危險，移工酒測值未超標。肇事過程的畫面PO網後，引發熱議，相關肇責正深入調查中，並依法究辦；歸仁警分局也呼籲民眾，切勿貿然穿越道路，避免發生危險，車輛行駛街區，也要放慢速度，確保安全。歸仁分局強調，馬路如虎口，行人過馬路應注意交通號誌，並沿人行道快速通過，違者可依道路交通管理處罰條例第78條規定處新台幣500元罰鍰。紅色上衣的邱姓婦人提著垃圾穿越馬路趕上垃圾車，順利倒完垃圾。（取自《仁德生活圈》）紅色上衣的邱姓婦人倒完垃圾後，要穿越馬路回去，與機車相撞。（取自《仁德生活圈》）熱門賽事、球星動態不漏接    ,https://news.ltn.com.tw/news/society/breakingnews/5247444
