Title,News_Type,date,content,url
金門議會議程13分鐘結束 金酒廈門公司預算遭刪試圖翻案未果,政治,2026/04/24 14:07,當議長洪允典宣布議程結束，還有議案來不及問的董森堡（左一）留在位子久久無法釋懷；一旁的議員蔡水游（右一）則怒諷「主席最大」。（記者吳正庭攝）金門縣議會今天進行第8屆第7次定期會最後1天議程，議長洪允典遭議員周子傑質疑未依慣例確認前一天議事錄，有程序問題；洪允典堅持先審議縣府提案直到議程結束，全程歷時約13分鐘；部分議員原期盼將昨天遭刪除的金酒廈門公司預算翻案未能如願。議程開始，洪允典直接進入審議縣府提案，周子傑隨即發言，質疑「是不是應先確認昨天的開會紀錄？」、洪允典表示要先審議案，周子傑也反駁「沒有，要先確認，怎麼審議案？」，洪說「繼續」，周緊追表示「有程序問題」，洪問在場的議事主任陳勵志「有程序問題嗎？」，兩人交換意見後，洪說「先把縣府議案審完在說」，周丟下1句「你要這樣搞是吧」，現場氣氛緊繃，一觸即發。請繼續往下閱讀...洪允典審完縣府提案後，落槌宣布議程結束即離開會場，議程歷時12分51秒。議事結束前，議員董森堡擬出聲制止未果，他說，本來還有兩案要提，因沒有臨時動議而無法質詢。第2審查小組23日討論過的金門酒廠（廈門）貿易公司預算遭議員李養生1人提出全刪且通過的疑案，原擬在今天議程中翻案未果。該小組議員唐麗輝說，對於如此未按程序進行確認議事錄、臨時動議的不合理作法，將循求內政部協助釋疑。資深議員蔡水游面有慍色，怒諷「主席最大」。副縣長李文良說，對於金酒廈門分公司預算（約9.78億元）遭全刪一事，將透過提出覆議的方式循求解套的機會。議會人員指出，過去曾有類似情形，去函內政部說明略指，地方立法機關議事程序及議事規則等事項，由其依法訂定自律規則規範，至於「地方立法機關是否踐行其議事應遵守之程序，除有明顯牴觸上位法規外，乃其內部事項，屬其依自律原則應自行認定之範圍」；議會內部議事規範及議事運作，如有爭議應由議會本議事自律原則予以處理。金門議會最後一天議程進行約十三分即結束， 金酒廈門公司預算遭刪試圖翻案未果。（記者吳正庭攝）金門縣議會進行最後1天議程，議員周子傑質疑議長洪允典未依慣例確認前一天議事錄。（記者吳正庭攝）議長洪允典用手中的議事槌，掌握議事進行的節奏。（記者吳正庭攝）議員周子傑（左）與議會議事組主任陳勵志（右）、法制室主任吳鎔銘（中）交換意見。（記者吳正庭攝）金門縣副縣長李文良說，金酒廈門公司預算案遭刪除，將再了解能否從覆議角度尋求解套？（記者吳正庭攝）    ,https://news.ltn.com.tw/news/politics/breakingnews/5414596
卸任立法院厚生會長 蘇巧慧細數任內推動醫療福利、弱勢權益成績,政治,2026/04/24 14:00,立法院厚生會第34屆會長交接典禮，厚生會新任會長陳菁徽（右）贈禮給前任會長蘇巧慧（左）。（記者陳逸寬攝）立法院厚生會目前有75位立法委員加入，其中民進黨立委、新北市長參選人蘇巧慧過去一年擔任立法院厚生會第33屆會長，關注社會福利、衛生保健、環境保護等政策議題。蘇巧慧今（24）日出席會長交接典禮，她說，很榮幸在過去一年擔任厚生會會長，任內努力實踐厚生會長期為台灣醫療福利與弱勢權益努力的願景，期盼未來會務交接給新任會長陳菁徽後，持續為打造「健康台灣」而打拚。蘇巧慧表示，她在立委任內長期關心醫療實務與衛生保健政策，2023年起她陸續擔任厚生會秘書長、副會長等職務，更在2025年接任會長，是她難以忘懷的榮耀時刻，「以人為本」是厚生會核心精神，她在過去一年會長期間努力實踐厚生會為台灣醫療福利與弱勢權益努力的願景，也在長照、提升急救韌性、推動醫藥法制上持續努力。請繼續往下閱讀...蘇巧慧指出，在長照領域，她擔任厚生會「長照推動委員會」召集人，並針對醫療與照護整合、人力韌性不斷與衛生福利部進行溝通，確保長照資源能讓長者「看得到、找得到、用得到」；提升急救韌性方面，她在厚生會「急救賦能委員會」也持續和召集人黃捷推廣CPR與 AED的急救知識，也舉辦AED勸募活動，補足全國國中與派出所1200台AED的缺口，也培訓6.4萬餘人學習急救知識；推動醫藥法制方面，她成功推動衛福部編列癌症新藥百億預算，並獲得總統賴清德「用多少、補多少」的承諾。蘇巧慧說，她也以厚生會會長的名義積極參與各項活動，她在厚生會11個委員會的成績單非常厚實，交棒陳菁徽後，期許下一任會長傳承歷屆會長「不論政治利害，只計民生利益」的精神，持續為打造「健康台灣」而努力。    ,https://news.ltn.com.tw/news/politics/breakingnews/5414572
民眾黨來直播用餐！湳雅夜市「蚵仔之家」千金澄清：我家真的不是草店,政治,2026/04/24 13:53,民眾黨一行人到「蚵仔之家」用餐。（擷取自黃國昌YT）民眾黨創黨主席柯文哲日前和新北市長參選人黃國昌等人，到板橋湳雅夜市掃街拜票並同步直播。一行人到「蚵仔之家」用餐時，還因「吃素」問題掀起熱議，連帶讓店家受到討論。不過，除了「蚵仔之家」老闆當天就婉拒與柯文哲合照外，老闆女兒也在Threads上發文澄清「我家真的不是草店」，希望大家不要誤會。柯文哲等人日前在湳雅夜市掃街，網紅四叉貓統整一行人吃過、逛過的店家，表示有些真的是當地超級老店。有網友表示，被吃播過，感覺美味程度會下降，也有不少網友表示：「他們要進來消費，店家沒辦法！」「店家也來者是客，不好意思拒絕。」另外，還有網友表示，看直播時發現「蚵仔之家」老闆有拒絕拍照，而且還不只一次。請繼續往下閱讀...昨日該店老闆的女兒，也在Threads上轉貼四叉貓的貼文表示「蚵仔之家千金我本人想澄清我家真的不是草店」，還和網友喊話：「拜託大家不要誤會！」文章一出，網友紛紛留言表示：「居然驚動湳雅夜市蚵仔之家千金本人出面澄清」、「不是賣蚵的就是柯粉」；「也有網友說，出來做生意，最忌諱的就是被貼標籤。民眾黨最令人討厭的，就是那種硬給人貼標籤的宣傳手法。」    ,https://news.ltn.com.tw/news/politics/breakingnews/5414473
黨內初選紛擾 國民黨考紀會罕發聲：制度高於一時的民意結果,政治,2026/04/24 13:50,國民黨中央黨部。（資料照）國民黨新北市議員第11選區（汐止、金山、萬里）初選民調，日前由遭停權的國民黨前發言人蕭敬嚴勝出，蕭當時強調，議員黨內初選資格仍然有效，他一定會提出申訴，並稱「若地方黨部無故停止初選，將訴諸司法，守護黨員應有權利」；儘管事隔數天後，蕭又退出選舉，風波看似平息。不過，國民黨考紀會今（24日）罕見發出長文，再度引發討論。國民黨考紀會以「把民意當萬靈丹？這才是制度混亂的開始」為題發文，強調「制度本來就高於一時的民意結果」。如果連這一點都守不住，那未來不只是初選會失序，整個政黨的運作，都只會淪為「誰聲量大、誰就有理」的叢林法則。請繼續往下閱讀...國民黨考紀會指出，近期有人以「初選民調結果被沒收」為由批評國民黨考紀制度，這樣的說法看似替民意發聲，實際上卻是把不同層次的問題刻意混為一談。首先，黨紀與民意，本來就不是同一個層次的概念。民意可以表達偏好，但不能取代規範。考紀會舉例，否則不妨做一個民調：「是否同意把郭台銘的財產平均分給大家？」多數人可能會點頭，但這不會因此變成正當，因為這牽涉的是法律與制度，而不是多數決的情緒投射。黨紀的存在，本質上就是一種「規範秩序」，而不是「人氣競賽」。考紀會說明，考紀會作為政黨內部負責紀律審查與懲處的機關，其設立與運作並非任意為之，而是有明確的法律依據。考紀會的功能在於處理黨員違規行為、維護黨紀與組織秩序，並非為於選舉期間的手段，考紀必須有明確性，並且中立客觀。考紀會進一步指出，政黨紀律是法律層次，不是選舉操作。依據《政黨法》，政黨本就有權制定內部紀律規範，並透過黨代表大會、中常會等機制形成制度。這不是臨時起意，更不是為了某場初選量身打造，而是一套長期存在、經組織程序確立的制度。把考紀處分說成「干預初選」，等於否定政黨依法自治的正當性。考紀會表示，考紀會的正當性來自制度授權，而非民調高低。就像一個人是否犯罪，不會用選舉投票決定；同樣地，一名黨員是否違紀，也不會因為民調第一就自動「無罪」。若真如此，才是對制度最大的踐踏。考紀會說，真正該問的問題，不是「為何民調第一不能當選」，而是一個已進入紀律審查程序的個案，是否可以因為民調結果就被豁免？如果答案是「可以」，那未來所有政黨紀律都只剩一條路——比聲量、拚人氣、找操作，制度將全面崩解。考紀會表示，初選從來不是無條件的承諾，而是在既有規則之下進行的程序。規則本身，就包含紀律審查的可能性。否則，政黨乾脆取消黨章與考紀會，改成純民調公司決定一切，豈不更「民主」？考紀會強調，問題的核心，不在於考紀權力太大，而在於有人不願意承認：制度本來就高於一時的民意結果。如果連這一點都守不住，那未來不只是初選會失序，整個政黨的運作，都只會淪為誰聲量大、誰就有理的叢林法則。這才是真正該警惕的危機。    ,https://news.ltn.com.tw/news/politics/breakingnews/5414560
沈伯洋懂音樂！蔣萬安笑了 點名「這人」也很厲害,政治,2026/04/24 13:45,台北市長蔣萬安率領市府官員，前來議會向民眾黨黨團說明重大議法案，會前並先接受媒體聯訪。（記者田裕華攝）年底就要進行地方選舉，民進黨台北市長提名人選目前以立委沈伯洋呼聲高，民進黨立院黨團副幹事長陳培瑜、書記長范雲稱讚沈體育好、音樂強。媒體今（24）日問台北市長蔣萬安有沒有學過音樂？蔣萬安呵呵笑說小時候學過，並說他想起老朋友民進黨籍立委王世堅，同樣懂古典樂。蔣萬安今至議會民眾黨團說明重大議法案，會前媒體堵訪問他，國民黨籍市議員游淑慧說沈伯洋代表綠營恐影響整體投票率，讓藍營不好打？蔣萬安維持一貫回應，稱現階段專注市政，今天到議會來報告議法案。請繼續往下閱讀...媒體問蔣有學過音樂嗎？蔣萬安一聽呵呵笑說，小時候有學過；媒體再追問蔣是否懂巴哈、莫札特？可以不看稿講一小時？蔣萬安笑說，這讓他懷念起老朋友王世堅「堅哥」，王也非常懂古典樂，還會拉小提琴。另外，媒體關注地方選舉藍白合，蔣萬安是否幫民眾黨站台？蔣萬安說，黨部應該有相關規劃，尊重黨部安排。媒體也問，是否有南下輔選規劃，如果藍營台南市長提名人謝龍介、高雄市長提名人柯志恩邀請，會南下幫忙？蔣萬安說，一定全力幫忙。蔣萬安今至民眾黨團報告重大議法案。（記者甘孟霖攝）台北市長蔣萬安。（記者甘孟霖攝）    ,https://news.ltn.com.tw/news/politics/breakingnews/5414574
宜蘭迎接桐花祭 林國漳推覺醒客家政見,政治,2026/04/24 13:32,宜蘭客家桐花祭即將登場，民進黨宜蘭縣長參選人林國漳（左4）今到隱性客家信仰中心「大湖普恩廟」，發表「客底文化覺醒」系列政見。（記者王峻祺攝）宜蘭客家桐花祭即將登場，民進黨宜蘭縣長參選人林國漳今天到隱性客家信仰中心「大湖普恩廟」，發表「客底文化覺醒」系列政見，包括打造客家生活廊道、推動數位族譜、復興詔安腔客語、創立客底美食品牌及導入客庄實境解謎等，盼找回宜蘭客家底蘊。林國漳說，員山大湖底有近七成鄉親具備客家血緣，這群「客底」人雖然語言逐漸流失，但文化認同依然深厚，希望透過「客底文化覺醒」，讓這份隱藏在日常中的文化，被重新看見、連結。請繼續往下閱讀...他說，未來將打造「台7線客家森活廊道」，串聯員山、大同、三星、冬山聚落，並推動「數位族譜」找回家族記憶，以及「復興珍貴詔安腔」，將母語帶回校園，同時發展「HA-FOOD在地品牌」，結合三星蔥、員山韭菜、林美金棗等特色農產。林國漳說，為振興地方觀光，也將「導入AI與實境解謎」，讓文化體驗更有趣、更貼近年輕世代，重振宜蘭客家文化，成為地方創生的重要引擎，歡迎民眾趁著桐花祭走訪員山。宜蘭員山鄉長參選人李筱婷、縣議員參選人李姿婷也相繼提及，中央與地方已逐步投入資源，未來若能結合完整政策推動，將能讓客庄文化在生活、生產、生態中持續深化與傳承，找回先民拓墾的精神。    ,https://news.ltn.com.tw/news/politics/breakingnews/5414573
挺楊寶楨遭圍剿！江和樹點名「黨部的人」 民眾黨：無從介入,政治,2026/04/24 13:12,民眾黨發言人張彤回應，支持者經營粉專無從介入，強調黨內大鳴大放，黨團的團結不會輕易動搖。（資料照）台灣民眾黨中央委員江和樹力薦楊寶楨參選台中市議員，近日竟接連遭小草粉專網攻。江和樹雖撇清並非外傳的陳智菡主導，卻點名「一定是中央黨部的人」，重砲痛批部分粉專槍口向內「比民進黨更可惡」，更質疑黨中央視而不見。對此，民眾黨發言人張彤回應，支持者經營粉專無從介入，強調黨內大鳴大放，黨團的團結不會輕易動搖。台灣民眾黨中央委員江和樹力薦民眾黨前發言人楊寶楨參選台中市議員，這兩天連續遭到網路攻擊，甚至連小草粉專也參與其中。外傳此事是陳智菡主導，江和樹強調「不可能是陳智菡，但一定是中央黨部裡面的人」，並指這個粉專經常槍口向內，比民進黨更可惡，黨中央卻視而不見，長期以往「這個黨還要再繼續走下去嗎？」楊寶楨今天則在臉書發文表示「不論過程如何，就算遍體鱗傷，也會勇往直前。」請繼續往下閱讀...張彤表示，非民眾黨官方的粉絲專頁，皆是由支持者經營，黨中央未曾介入也無從介入，我們本來就是一個大鳴大放的政黨，不僅支持者，許多黨公職也經常公開發表對黨主席、中央黨部乃至地方議員和參選人的指教建議，黨中央都會虛心聆聽，「黨團的團結也不會這麼容易被動搖，也會持續前進。」    ,https://news.ltn.com.tw/news/politics/breakingnews/5414543
柯文哲認了赴新光醫院「看病歷」！醫揭小草檢舉護理師引網怒,政治,2026/04/24 13:12,前台北市長、民眾黨創黨主席柯文哲。（資料照）有醫護人員近日發文稱，有病患家屬為「前市長」員工，晚間將人請到醫院「電人」，更質疑當時僅有值班醫師與護理人員，為何仍要求說明病情，稍早PO文已刪除，柯文哲今上午證實的確在前天晚上去新光醫院。對此，醫師杜承哲嘆說，現在最可憐的是發文的護理師，即便內容屬實也只能默默刪文，甚至還遭到「小草」寫信至醫院檢舉，處境令人心疼。杜承哲今日上午10時52分於社群平台發文指出，此事情經柯文哲受訪、院方受訪，證實為真，現在最可憐的是發文的護理師，即使是真的，文章也默默的撤掉了。希望院方不要解決提出問題的人，希望小草不要針對他，夜班人力已經夠少了，他說的話是事實。請繼續往下閱讀...杜承哲嘆說「你說他（柯文哲）憑什麼進去坐在那裡呢？哎，我也當過值班仔，你敢不讓他進去？」杜承哲上午11時48分再度發文並附上一張網路轉傳截圖，他直言「新光醫院發聲明證實確有此事，也建議「於日間醫療時段，由主治醫師進行病情說明，這一點我很同意，我自己也建議這樣做」，不過「已經有民眾黨支持者對護理師施壓，護理師的文也悄悄地不見了，希望基層醫護平安無事」。根據截圖顯示，一名民眾黨支持者者開嗆已寄信給新光醫院稽核室，要求院方針對護理師「非公務目的使用手機、疑似拍攝到電腦螢幕的病患隱私、帶著個人偏頗解讀的發文」進行懲處。消息曝光後，許多網友紛紛留言，有人說「公然80醫護人員，可以這樣去欺壓醫護？」、「柯嫌所到之處，殘害忠良，擾人不斷，如此之徒，小草是眼濁嗎？」、「會變成『開電腦給看』的那個被懲處，看著好了」、「這樣算是下ORDER吧」、「現在護理人員大缺工，我要看看新光敢對此護理人員做什麼？」、「柯文哲自己都承認了，草到底是在那邊鬧什麼？」、「民眾黨支持者都是北七腦殘」。     在 Threads 查看     在 Threads 查看被爆去醫院「看病歷施壓」 柯文哲：我醫療專家柯文哲被爆夜赴醫院「看病歷」惹議 新光醫院回應了    ,https://news.ltn.com.tw/news/politics/breakingnews/5414387
民眾黨爆內鬨「自己人也被網攻」江和樹不忍了「一定是黨中央的人」,政治,2026/04/24 13:10,江和樹喊話黨中央不要視而不見，任由地方戰將被自己人攻擊。（江和樹提供）民眾黨前發言人楊寶楨傳有意參選台中市議員，連日來遭網路攻擊，連「小草粉專」也參與其中，甚至外傳是民眾黨立院黨團主任陳智菡主導；力薦楊寶楨到台中參選的民眾黨中央委員江和樹強調，「不可能是陳智菡」、「但一定是中央黨部的人沒錯」，他批評，願意為我們而戰的人還要被攻擊，比民進黨更可惡」，黨中央卻視而不見，「這個黨還要再繼續走下去嗎」。楊寶楨：就算遍體鱗傷也會勇往直前楊寶楨近來曝有意回台中故鄉參選台中市議員，江和樹也力薦，但楊寶楨連日受到網路攻擊，還有「小草粉專」也加入質疑，甚至傳出是陳智菡主導，民眾黨疑再爆內鬥，楊寶楨今在臉書發文，「不論過程如何，就算遍體鱗傷，也會勇往直前」。請繼續往下閱讀...力薦楊寶楨參選台中市議員的江和樹今則指出，不可能是陳智菡，但「一定是中央黨部的人沒錯」，這個特定粉專也常攻擊他，只要不是黨中央人馬就用此粉專攻擊、帶風向批評，長期都在攻擊黨內人員，但中央視而不見。江和樹說，地方戰將開疆闢土，未曾拿到中央任何福利還要被糟蹋，呼籲黨主席黃國昌、前主席柯文哲好好了解，黨現在最需要的是地方戰將、願意為黨而戰的人，卻還被攻擊，「比民進黨還可惡」，黨要好好了解一下，再繼續下去，「這個黨還要走下去嗎」。    ,https://news.ltn.com.tw/news/politics/breakingnews/5414549
表態參選2028總統？盧秀燕只說「謝謝」、轉頭推薦綠議員,政治,2026/04/24 13:09,台中市長盧秀燕大方推薦民進黨市議員林祈烽（左）是好議員。（記者歐素美攝）民眾黨台中市議員江和樹請台中市長盧秀燕表態2028參選總統，盧秀燕今天回應「謝謝議員」，卻又表示自己不選了，可以說實話，大方推薦西屯區民進黨議員林祈烽是好議員。台中市長盧秀今天出席西屯區協和里市民活動中心啟用典禮，她在致詞時大方推薦藍綠議員，強調黃馨慧是在地議員，一定要推薦，民進黨市議員林祈烽，地方建設也會私下找她，不像有些議員只會罵，盧秀燕強調，她年底即將御任，不會再選了，所以要說實話，強調林祈烽是好議員，就算是綠營的，她也推薦。請繼續往下閱讀...但記者隨後詢問「民眾黨台中市議員江和樹請台中市長盧秀燕表態2028參選總統」；盧秀燕只回應：「謝謝議員」。另記者詢問盧秀燕，假日輔行程滿檔，是最強母雞出動嗎？盧秀燕說，這本來就理所當然，她這麼多年來都會盡自己的本份，利用休閒時間幫自己同事的忙，只要是好的人選都會強烈推薦，利用假日時間去輔選也理所當然，強調一定會推薦好人選而且公平的推薦。    ,https://news.ltn.com.tw/news/politics/breakingnews/5414526
李四川嘆新北苦戰「1打2」 蘇巧慧霸氣回：候選人就是我,政治,2026/04/24 12:49,代表民進黨參選2026新北市長的立委蘇巧慧。（資料照）新北市長選戰煙硝味漸濃，國民黨籍參選人李四川近日感嘆「1個人對付2個人」，意指除民進黨參選人蘇巧慧外，還包括其父親、前台北縣長蘇貞昌。對此，蘇巧慧今（24日）強調，蘇貞昌已經退休，過去成績是讓新北市現代化的重要基礎，這些經驗和資歷都是自己未來的養分，「這次選戰中的候選人就是我，一定會讓市民相信我是最好的選擇。」對於李四川感嘆「1打2」一說，蘇巧慧今受訪表示，蘇貞昌其實已經退休，但他當年為國家擋下非洲豬瘟、推動同婚，甚至在百年疫情、百年大旱中，和前總統蔡英文一起帶領台灣的經濟，創下世界都看見的好成績。請繼續往下閱讀...蘇巧慧說，尤其是蘇貞昌過去在台北縣的成績，更是讓新北市現在能夠現代化的重要基礎，這些經驗和資歷都是自己未來的養分，也會努力學習。但她相信在這次的選戰中，候選人就是她自己，市民看的是誰比較有領導力、決斷力，甚至是活力，自己一定會繼續展現這些特質，讓市民相信她是這次最好的選擇。對於李四川的社群平台影片被揶揄為「老四川」，蘇巧慧回應，候選人經營社群本來就是很正常的事情，她自己在社群上會希望用更多創意的方式，更能貼近選民的方式，不管是各世代、年齡層，她都希望能夠把握被看到的機會，也會繼續用這樣創意、有活力的狀態，爭取更多的認同。針對未來可能面對「藍白合」，蘇巧慧說，她從選戰以來，都是以一對一的態度、心態在面對，而對手都還在初選當中，就祝福初選順利。媒體追問，民進黨在台北市長提名中，立委沈伯洋的呼聲越來越高，是否考量雙北選情。蘇巧慧表示，沈伯洋是自己很好的朋友，也認識很久，這兩年在立法院更是一起並肩作戰的好戰友，相信以其能力和資歷，在任何的位置上都能夠把工作做得很好；台北市長的候選人由民進黨中央決定，並向各界公告。    ,https://news.ltn.com.tw/news/politics/breakingnews/5414507
