Title,News_Type,date,content,url
摧毀童年！蘇格蘭教師告知學生「耶誕老人不存在」 驚動市議會,國際,2025/11/13 19:40,"留著白色大鬍子、身穿紅衣服，並在耶誕節乘坐馴鹿飛天雪橇到處送禮物的「耶誕老人」，是許多孩童的重要童年回憶與信仰。（資料照，法新社）每逢寒冷來臨，許多孩童都期待留著白色大鬍子、身穿紅衣服的「耶誕老人」（Santa Claus），會在耶誕夜那天乘坐馴鹿飛天雪橇到處送禮物。然而，蘇格蘭有國小教師今年卻在課堂上告訴學童「耶誕老人不存在」，摧毀童年行徑引發軒然大波，不僅讓大批家長氣炸投訴，當地市議會也因此展開調查。綜合外媒報導，這起事件發生在上月底，地點則是位在英國蘇格蘭亞伯丁（Aberdeen）的格林布雷小學（Greenbrae Primary School）。事發當天，這名教師在課堂上教導有關11月重大節日「諸聖節」（All Saints' Day）的歷史，期間學童提出各種與聖徒有關的問題，後來討論話題逐漸延伸到聖尼古拉（St Nicholas，相傳是耶誕老人的原型）。請繼續往下閱讀...教師聽到聖尼古拉、耶誕老人等關鍵字出現，直接對這群年約9到10歲的學童說出「聖誕老人不是真的」（Santa is not real），殘酷真相讓孩子當場錯愕不已。家長們聽聞此事，紛紛怒斥這名教師與校方提前毀了「耶誕節魔法」（Magic of Christmas），對這些並非在成長過程中自己發現這件事的孩子們，帶來巨大打擊。由於耶誕節將至，這起事件也引起當地市民譁然，隨著越來越多人發起討論與抗議，引起亞伯丁市議會關注。市議會發言人在近日證實，他們已針對此事展開調查，也強調市議會非常重視每年耶誕節帶來的「樂趣」與「魔法」，並向家長與其他市民保證，會與學校高層進行討論，確保未來教師在面對類似議題時，應該如何回應年幼的學生們。家長則在受訪時表達感到諸多不滿，有家長指出關於「耶誕老人是否存在」，本就不該成為學校上課話題；也有家長感嘆，孩子天真無憂的時光短暫，耶誕節對他們來說意義非凡，也是創造美好童年回憶的珍貴體驗；更有家長坦言，現代科技發達，確實很難長時間對孩子隱瞞耶誕老人的真實性，但仍會努力守護這份魔法到孩子長大的那一天。Exclusive: Council investigates after Santa bombshell dropped in Aberdeen primary classroom https://t.co/f6Yej7BDFf pic.twitter.com/W5VlbJwZq7— Evening Express （@EveningExpress） October 30, 2025 Exclusive: Council investigates after Santa bombshell dropped in Aberdeen primary classroom https://t.co/f6Yej7BDFf pic.twitter.com/W5VlbJwZq7Investigation into complaints primary school teacher 'told pupils Santa isn't real' concludes????Read the full story from our Scotland reporter @Jenster13https://t.co/88eaZBuo89— Sky News （@SkyNews） November 12, 2025 Investigation into complaints primary school teacher 'told pupils Santa isn't real' concludes????Read the full story from our Scotland reporter @Jenster13https://t.co/88eaZBuo89蘇格蘭1名國小教師在在課堂上告訴學童「耶誕老人不存在」，摧毀童年行徑引發軒然大波。示意圖。（資料照，美聯社）熱門賽事、球星動態不漏接    ",https://news.ltn.com.tw/news/world/breakingnews/5245225
「我只希望他活著！」安倍昭惠書信公開 憶丈夫臨終一刻全場鼻酸,國際,2025/11/13 19:14,安倍昭惠在信中回憶丈夫遇襲那天的種種，坦言「我只是希望他活著」、「希望他能長命百歲」，並透露自己握住安倍的手時，甚至感覺「他好像回握了一下」，深情告白令全場動容。（資料照）日本前首相安倍晉三遭槍擊身亡一案，今（13日）在奈良地方法院進行第7次開庭。檢方當庭公開安倍晉三夫人安倍昭惠於2023年8月提交的書面陳述。她在信中以近乎自白的方式回憶丈夫遇襲那天的種種，坦言「我只是希望他活著」、「希望他能長命百歲」，並透露自己握住安倍的手時，甚至感覺「他好像回握了一下」，深情告白令全場動容。綜合日媒報導，昭惠在信中提到，事件已經過去一年，一週年追思也已結束，「如今終於能稍微談談那天的事」。她回憶，2022年7月8日早上，全家三人在家中一起吃早餐，安倍精神狀況良好，上午8點左右出門，「我照平常一樣叮嚀他『路上小心』，真的是普通到不能再普通的一個早晨」。未料11點半後，她突然接到安倍辦公室的緊急電話：「先生被槍擊」，她震驚得大喊「欸—」，一時完全反應不過來。請繼續往下閱讀...昭惠立刻趕到東京車站搭新幹線，途中手機跳出大量訊息，全都是世界各地友人與政界人士傳來的祈福，希望安倍能撐下去。她表示，那一刻就隱約察覺情況恐怕不樂觀。下午5點前抵達奈良，但從車站到醫院的道路嚴重大塞車，「甚至覺得跑步可能還會更快」。抵達醫院後，醫師向她解釋情況，昭惠立刻明白「啊…可能救不回來了」。她形容安倍的臉看起來「像在微笑般安詳」。她握著丈夫的手，貼著耳邊喚著，「晉醬、晉醬。」她說，「我感覺到他好像有微微回握。」安倍的身體仍留有溫度，她相信是醫療團隊不放棄急救，「讓他撐到我趕到」。於是她對醫護人員說「已經可以了」，安倍就在她身旁斷氣。昭惠說，當下腦袋一片空白，「悲傷、痛苦都來不及湧上來，眼淚也流不出來」。她也在信中談到安倍的個性，形容他溫柔、不擺架子，對任何人都一視同仁，是非常努力的人，也是很孝順、很掛念母親的人。對她而言，「他是家人，是朋友，是夥伴，也是無可取代的人」。昭惠說，安倍在2020年因長年病情惡化辭去首相職務，休養後身體逐漸恢復，夫妻相處時間也變多。「事件前不久，我們還帶著家裡的收容犬一起散步，我真的以為那樣的日常會一直持續下去。」然而，命運卻在7月8日這天，那天同時也是安倍父親安倍晉太郎當年宣布參選的日子；安倍離世時的年紀，也與父親相同，都是67歲。「他過去多次在病痛中死裡逃生，全世界那天也都在替他祈禱…但這次沒能救回來。我覺得，這是命運。」她說，當她慢慢能面對丈夫離世的現實後，只要回想起當天、或想起安倍，眼淚就會不受控制地湧出。在安倍逝世一週年的追思儀式上，她看到安倍生前的好友們，腦海裡立刻浮現他最喜歡與大家熱熱鬧鬧在一起的模樣，但如今他卻不在了，「眼淚當場就停不下來」。昭惠在信末寫下讓人鼻酸的一句話：「不管怎麼想，我只是希望他活著，希望他能長命百歲。這就是身為妻子的我的心情。」熱門賽事、球星動態不漏接    ,https://news.ltn.com.tw/news/world/breakingnews/5245244
報告：中國監控北韓脫北者 疫情起搜集生物辨識資訊,國際,2025/11/13 19:10,北韓人權情報中心發表報告指出，疫情期間，中國政府開始搜集境內北韓脫北者的指紋、血液等生物辨識資訊，可能用於監視、追蹤。圖為北韓國旗。（路透檔案照）北韓人權情報中心今天發表一份報告指出，中國政府自COVID-19疫情期間開始搜集中國境內脫北者的指紋、虹膜、血液等生物辨識資訊，可能用以持續監視、追蹤脫北者。成立於2003年、旨在改善北韓人權狀況的北韓人權情報中心今天發布關於中國政府對脫北者數位監控狀況的報告，內容指出，中國政府從2020年起開始搜集虹膜、血液、髮絲、聲音樣本及體重等生物辨識資訊，並利用監視器網路、定位追蹤應用程式，控制脫北者行動。請繼續往下閱讀...這份報告對102名自2013年至今從中國逃往南韓的脫北者進行調查，其中30人（占比29.4%）表示曾被中國警方搜集上述生物辨識資訊，這些脫北者多曾居住在吉林、遼寧、黑龍江等中國鄰近北韓的邊境地區。這次調查報告首次證實了中國政府搜集脫北者生物辨識資訊的案例，報告指出，中國政府對來自越南、寮國等地的非法移民僅搜集臉部照片及指紋，卻對脫北者搜集多項生物辨識資訊，顯示中國政府可能將脫北者列為關鍵追蹤對象。據北韓人權情報中心估算，目前居住在中國的脫北者人數約在1萬到2萬人。脫北者在中國無法取得難民身分，實際上被剝奪了合法身分及應得的保護措施，這也使得他們從北韓脫逃至中國後，仍時時生活在隨時可能被遣返回北韓的陰影之下，不得不配合中國政府的無理要求與監控。根據一名脫北者在報告中的證詞，中國警方會透過微信等通訊軟體，要求脫北者及時報告行蹤，「我漏接了幾次電話，他們告訴我，如果不接電話就會被當成逃犯」。也有證詞稱，中國警方要求脫北者安裝即時定位的相機應用程式，透過程式即時搜集及分析拍攝者的行蹤。報告指出，即使這些脫北者離開中國，中國警方仍保留他們的生物辨識資訊與通訊紀錄，並利用這些資訊繼續控制他們。一名脫北者日後再次入境中國時被公安告知，「北韓人一心要抓你，別怪我們」，讓他即使生活在南韓，也無法感到自由。北韓人權情報中心指出，中國政府無差別地搜集、保留生物辨識資訊的做法，違反聯合國的「公民與政治權利國際公約」，且搜集虹膜及聲音樣本等高風險的敏感情報，可能不只用於管理非法移民，還存在用於長期追蹤監視的風險。熱門賽事、球星動態不漏接    ,https://news.ltn.com.tw/news/world/breakingnews/5245206
新聞360》台灣造「無人機牆」封殺共軍？專家模擬「護台情境」曝兩種可能,國際,2025/11/13 18:40,全新的視界！新聞話題不漏接，快訂閱YouTube 【自由追新聞】，記得開啟小鈴鐺哦！熱門賽事、球星動態不漏接    ,https://news.ltn.com.tw/news/world/breakingnews/5245270
配合當前局勢調整 自民黨下週啟動「安保三文件」修訂討論,國際,2025/11/13 18:39,日媒報導，自民黨預定從下週起針對「國家安全保障戰略」等「安保三文件」的修訂作業啟動黨內討論，首相高市早苗上任後宣布將配合目前的安全局勢進行調整。（法新社檔案照）日媒報導，自民黨預定從下週起針對「國家安全保障戰略」等「安保三文件」的修訂作業啟動黨內討論。預計18日至20日召開安保調查會，並預定明年春季彙整總建議，向政府提出修訂方向，以爭取在明年底前完成修訂。「安保三文件」指的是「國家安全保障戰略」（NSS）、「國家防衛戰略」（NDS）和「防衛力整備計畫」（FYDP），日本是在2022年底完成制定，重要內容包括以5年為目標，預定在2027年度將防衛費提高至GDP2%水準，另外就是明定擁有反擊能力。高市早苗上任後宣布將配合目前的安全局勢進行調整修訂，並提前於2025年度前達成防衛費占GDP2％的水準。另外，也將於明年配合修訂「安保三文件」。請繼續往下閱讀...日本共同社據多名政府和執政黨相關人士12日透露指出，自民黨預定下週啟動黨內討論作業。自明年初起，預計每週召開1次會議，並將舉辦專家聽證、意見交換會議。報導指出，安保三文件修訂的重點包括：非核三原則（不擁有、不製造和不攜入）的明確記載或檢討的必要性、防衛費與相關經費合併後對GDP比例的新目標、以無人機為中心的新作戰方式、持久戰能力的強化、戰略物資供應網的強化、是否擁有核動力潛艦，以及放寬防衛裝備輸出規則等。現行安保戰略寫明「堅持非核三原則的基本方針今後也不會改變」。高市早苗11日在眾院預算委員會被問及是否維持這一表述，迴避了明確表態。高市在2022年擔任自民黨政調會長時曾以「不攜入核武器」會削弱美國的核嚇阻力為由，要求重新修改。另在放寬防衛裝備輸出規則方面，自民黨與日本維新會在聯合執政協議中寫明，將廢除僅允許出口非戰鬥目的「5類」防衛裝備品的規則。自民黨正在探討今年內與維新會就此展開協商。熱門賽事、球星動態不漏接    ,https://news.ltn.com.tw/news/world/breakingnews/5245266
不忍了! Google控告中國詐團發「釣魚簡訊」 企圖騙取百萬人個資,國際,2025/11/13 18:35,Google公司標誌。（美聯社檔案照）美國網路搜尋引擎龍頭Google公司12日在加州聯邦法院提起訴訟，控告位於中國的犯罪分子，進行大規模簡訊釣魚（smishing）攻擊，以假簡訊竊取民眾個資和財務資料進行詐騙。美國哥倫比亞廣播公司新聞網（CBS News）報導，Google指出，這些詐騙簡訊是一個名為「燈塔」（Lighthouse）犯罪網的一環，該組織假冒企業或政府單位發出看似為真的「釣魚簡訊」，內容通常是警告對方有未繳的過路費、包裹寄送延誤等訊息，騙取收件人提供帳密、信用卡號等個資。請繼續往下閱讀...Google法務長普拉多（Halimah DeLaine Prado）向CBS新聞表示，「目前我們的估計，這些詐騙分子導致美國國內約1500萬至1億張信用卡資料可能外洩，受害者超100萬人」。她表示，這是首次根據「反勒索及受賄組織法」（RICO Act）提出訴訟，嚇阻這類網路詐騙；RICO通常用來打擊組織犯罪。Google列出「1到25名無名氏」（John Does 1–25）為被告，指控其建立一個「網路釣魚即服務」（phishing-as-a-service，PhaaS）平台，進行釣魚簡訊攻擊。Google找出超過100個假冒其品牌，騙取民眾提供密碼、信用卡號等資料。新聞網站Axios報導，根據訴狀，Google估計在一次為期20天的期間內，Lighthouse就被用來產生20萬個詐騙網站，在至少121個國家攻擊超過100萬名潛在受害者。資安公司Arkose實驗室（Arkose Labs）執行長高斯喬克（Kevin Gosschalk）表示，這類網路犯罪通常分布在像柬埔寨這類引渡法有限的外國國家，Google追訴難度高，但是採取法律行動，可有助於打亂詐騙分子的活動，「對整個生態系統產生衝擊」。熱門賽事、球星動態不漏接    ,https://news.ltn.com.tw/news/world/breakingnews/5245272
自由說新聞》11億蒸發掀大場面！中國人「火爆開戰」嗆政府：土匪！,國際,2025/11/13 18:22,全新的視界！新聞話題不漏接，快訂閱YouTube 【自由追新聞】，記得開啟小鈴鐺哦！熱門賽事、球星動態不漏接    ,https://news.ltn.com.tw/news/world/breakingnews/5245267
南韓貨車傳統市場內「暴衝150公尺」 已知2死18傷,國際,2025/11/13 17:58,"位於南韓京畿道富川市的第一市場，今（13日）上午發生一起重大交通事故，1輛藍色小貨車因不明原因高速暴衝，造成至少2人死亡、18人受傷。（美聯社）南韓京畿道富川市今（13日）上午發生一起交通事故，1輛開在當地傳統市場內的藍色小貨車，突然在狹窄通道內高速暴衝，期間撞上多家攤販、行走路人，最終在暴衝150公尺左右才停下。事故現場一片混亂，已知有2人不幸死亡、18人受傷送醫，肇事司機則被警方當場逮捕，目前正在調查事故發生原因。綜合韓媒報導，這起事件發生在富川市五井區元鐘洞的第一市場，根據目擊者向警方表示，這起事故發生在上午10點55分左右，當時市場內部人潮眾多，肇事貨車先是倒退20多公尺，緊接著車子又突然加速，沿著人行道一路暴衝150公尺左右，期間狠狠撞上擺攤商家與消費者，導致現場血跡斑斑、物品碎裂，其他民眾嚇得當場尖叫逃竄。請繼續往下閱讀...另據監視器畫面顯示，肇事貨車高速暴衝時，一些攤販與民眾有即時閃避逃離，但仍有不少人逃生不及，像是有3名70至80歲的女性，被貨車重傷倒地，送醫後其中2人宣告不治，另1人目前還在醫院搶救中；被撞傷的18人傷勢不一，從頭部出血到腰部受傷都有，被獲報趕往現場的警消協助送上救護車，並依傷勢嚴重程度送往不同醫院救治。報導指出，當地警消出動20多輛消防車、超過60名人員到場救援，富川市政府也派員進駐現場，協助後續受害者醫療與善後事宜。警方則表示，肇事司機是一名60歲男子，他平時就在市場內經營生意，事發後已被警方依《交通事故處理特別法》逮補，經過初步調查確認，他並非酒駕，簡易藥檢的結果也為陰性。肇事司機對警方聲稱，「我踩了煞車，但車子完全沒停下來」，但警方從監視器及行車紀錄器畫面推測，可能是他當下誤踩踏板，導致煞車失靈或操作失誤讓貨車發生暴衝，目前已求國家科學搜查研究院分析卡車的事故記錄裝置（EDR），以釐清事發經過。[영상] 후진하다 갑자기 앞으로 '돌진'…부천 시장 차량 사고 #뉴스1 https://t.co/1YGjvvVEzC pic.twitter.com/6c0IzNLcFT— 뉴스1 （@News1Kr） November 13, 2025 [영상] 후진하다 갑자기 앞으로 '돌진'…부천 시장 차량 사고 #뉴스1 https://t.co/1YGjvvVEzC pic.twitter.com/6c0IzNLcFT부천 시장에 화물차 돌진：2명 사망·18명 중경상#MBC #뉴스 #뉴스데스크 #MBC뉴스 #뉴스투데이ㅤⓒ MBC & iMBC 무단 전재, 재배포 및 이용（AI학습 포함）금지 pic.twitter.com/NeN9MLJSfW— MBC News （MBC뉴스） （@mbcnews） November 13, 2025 부천 시장에 화물차 돌진：2명 사망·18명 중경상#MBC #뉴스 #뉴스데스크 #MBC뉴스 #뉴스투데이ㅤⓒ MBC & iMBC 무단 전재, 재배포 및 이용（AI학습 포함）금지 pic.twitter.com/NeN9MLJSfW根據警方調查，肇事司機是一名60歲男子，已被警方依《交通事故處理特別法》逮補。（美聯社）熱門賽事、球星動態不漏接    ",https://news.ltn.com.tw/news/world/breakingnews/5245106
太空已成戰場！ 馬克宏宣布千億元強化法國太空軍力,國際,2025/11/13 17:56,馬克宏12日在土魯斯法國太空軍司令部發表談話。（歐新社）砸法國總統馬克宏12日警告，現代的衝突已延伸到太空，「明日的戰爭將在太空展開」，宣布將在2030年前，追加42億歐元（約1516億台幣）強化太空軍事能力。《法新社》報導，馬克宏12日在法國航太重鎮、同時也是法國新設太空軍司令部所在地土魯斯（Toulouse）發表談話，表示「今天的戰爭已在太空中進行，而明日的戰爭將在太空展開」，「太空不再是和平的空間，它已成為一處戰場」。請繼續往下閱讀...馬克宏指出，俄羅斯自2022年全面入侵烏克蘭後，在太空進行「間諜」活動，包括俄國的太空載具監視法國衛星、大規模干擾全球衛星定位系統（GPS）訊號，以及針對太空基礎設施進行網路攻擊。他還指出，「俄羅斯的太空核武威脅格外令人震驚」，其後果「會是整個全世界的災難」。在這樣的安全情勢下，馬克宏宣布，法國將在2030年前追加42億歐元（約1516億台幣）用於太空領域軍事能力，但是他未透露具體細節。馬克宏強調，歐洲太空產業「脆弱的」，有必要「鼓勵我們的歐洲居領導地位者，在全球市場上具有競爭力」。他列出法國太空戰略的優先事項，包括發展可重複使用、低成本和高推進力的「下一代運載火箭」，表示這是陸海空軍事行動成功的一個條件，「依賴第三國或任何太空巨擘是不可能的」，這句話被認為意指美國富豪馬斯克（Elon Musk）的「太空探索科技」（SpaceX）和亞馬遜創辦人貝佐斯（Jeff Bezos）的「藍色起源」（Blue Origin）商業太空公司。馬克宏說，法國正與德國合作，加速發展先進預警能力，透過「黎明」（Aurore）雷達系統強化太空監視，降低對其他國家的依賴。他表示，法國正投資從地面到太空的行動手段，「會尊重國際法，但是不抱持一絲天真」。熱門賽事、球星動態不漏接    ,https://news.ltn.com.tw/news/world/breakingnews/5245211
傷患+3！曼谷救援隊「爭搶救人」 街頭槍戰畫面曝光,國際,2025/11/13 17:12,泰國曼谷2家民間救援組織疑似因搶傷患，而在事故現場發生槍戰。（擷取自Kulatorn Samaiporn/臉書）泰國曼谷近日傳出駭人槍擊案！兩家民間救援組織在車禍事故現場爆發衝突，最終演變成開槍事件，造成三人中彈受傷。警方初步研判，槍戰起因竟與「爭奪傷患」有關。綜合泰媒報導，6日晚間，曼谷汪通郎區（Wang Thonglang）發生一起機車事故，兩名傷者倒在地上。暹羅合心救援基金會（Siam Ruamjai Foundation）人員率先到場急救，隨後義德善堂（Ruamkatanyu Foundation）抵達，雙方因誰有權處理傷患發生爭執。期間有人被誤以為掏槍，引發對方先出拳攻擊，接著遭反擊開槍。請繼續往下閱讀...一名網友剛好騎車經過現場，行車紀錄器拍下多輛救護車停在現場，幾名人員站在路旁對峙，隨後傳出四聲槍響和此起彼落的尖叫聲。警方趕抵現場時，在人行道上發現血跡及五枚彈殼。中彈三人分別為27歲與36歲的義德善堂救援人員，分別受槍傷於頸部與胸部；另一名25歲志工則隸屬暹羅合心救援基金會，腹部中彈後被緊急送醫。目擊者指出，雙方原本都在搶救兩名車禍傷者。警方表示，泰國部分救援單位會依個案獲取財務補助，因此過去也曾出現「搶傷患」爭執，這起案件疑再度因利益衝突釀禍，但詳細事發經過仍在調查當中。義德善堂副負責人帕拉考翁受訪時澄清，團隊當時並無意爭執，只是到場後發現暹羅基金會已在處理，因此最初並未介入，後來僅是希望協助運送傷者。衝突雙方目前均遭起訴，罪名包括謀殺未遂、非法持槍與在公共場所攜帶武器等。熱門賽事、球星動態不漏接    ,https://news.ltn.com.tw/news/world/breakingnews/5245025
談判4年無結果 法國作家團體控告TikTok侵犯版權,國際,2025/11/13 16:57,"法國影視戲劇編劇團體13日提告TikTok侵犯版權。圖為今年9月11日拍攝的1群青少年在TikTok標誌前滑手機。（路透）代表約6萬名法國電影、電視、舞台劇與喜劇秀編劇的非營利團體「戲劇作家與作曲家協會」（Society of Dramatic Authors and Composers, SACD）13日表示，已就中國社群平台TikTok（抖音國際版）涉嫌侵犯版權一事，在巴黎對TikTok提起訴訟。SACD在發給法新社的聲明中說，TikTok多年來在未經授權下擅用SACD劇目中的受保護作品，以及從未對這些作品的作者提供令人可接受的補償，亦未曾應要求刪除這些作品。聲明中列舉遭TikTok盜用的法國作品，像是法國經典電影《阿斯泰利克斯歷險記》（Asterix the Gaul）或非主流喜劇《小子布里斯》（Brice de Nice）的對話或片段，還有動畫影集與搞笑短劇。請繼續往下閱讀...在毫無結果的4年談判後，SACD說，他們正尋求為其作品在TikTok上被剝削或播放的作者追討損失，以及呼籲TikTok公開財務數據，以判定支付給作品被盜用的版權所有人的金額。針對SACD的法律行動，Tiktok並未立即回應法新社的置評要求。本案將於明年3月18日舉行首場聽證。熱門賽事、球星動態不漏接    ",https://news.ltn.com.tw/news/world/breakingnews/5245079
