Title,News_Type,date,content,url
海馬士首期款已完成！顧立雄證實：週一政院已核定,政治,2026/05/27 10:18,國防部長顧立雄列席立院備詢。（資料照）立法院財政委員會、外交及國防委員會今（27日）上午已完成審查國防特別預算，面對我國對美軍購海馬士多管火箭案首期款支付期限將於5月31日到期，民進黨立委李坤城原提案，要求國防部除與在野黨溝通之外，也應積極與美溝通，但國防部長顧立雄證實，行政院本週一（25日）下午已經依「預算法」84條規定，核定通過動支8億首期款。立法院財政、外交及國防委員會今天上午聯席完成審查「115年度中央政府保衛國家安全及強化不對稱戰力計畫採購特別預算案」，針對立委關心海馬士多管火箭增購案首期款支付期限即將到期，顧立雄回應李坤城證實，行政院已於本週一下午核定，以預備金動支8億首期款。    ,https://news.ltn.com.tw/news/politics/breakingnews/5450940
馬英九基金會爭議 侯友宜：業務單位按相關規定辦理,政治,2026/05/27 10:12,針對馬英九基金會爭議，新北市長侯友宜表示，業務單位按照相關規定來辦理。（記者賴筱桐攝）前總統馬英九指控馬英九基金會前執行長蕭旭岑、王光慈涉破壞財政紀律，並指蕭2023年親手收受台商韓螢煥100萬元捐款，但在基金會帳戶未找到入帳資料。由於馬英九基金會主管機關為新北市文化局，市長侯友宜今天對此表示，「業務單位按照相關規定來辦理」。新北市文化局表示，依據財團法人法第25條，基金會應於每年1月底前繳交該年度工作計畫，5月底前繳交前一年度工作報告。請繼續往下閱讀...文化局表示，馬英九文教基金會已按期繳交，將依規定審查後函復。針對外界有關捐款疑慮，文化局回應，應由該基金會召開董事會釐清。    ,https://news.ltn.com.tw/news/politics/breakingnews/5450917
賴總統國安會議公布人口對策新戰略 藍委：大遲到的禮包,政治,2026/05/27 10:10,國民黨立委陳菁徽。（圖由陳菁徽國會辦公室提供）總統賴清德發表執政2週年談話時宣布發放0歲到18歲的成長津貼，每人每月5000元，賴總統今（27日）上午將召開國安會議，拍板「台灣人口對策新戰略—家庭支持篇」內容，除了成長津貼，還包括延長產假、陪產假等。國民黨立委陳菁徽表示，這些都是各界呼籲超久的政策，是一個大遲到的禮包，國政空轉兩年，現在開始亡羊補牢。陳菁徽指出，少子女化國安危機，在民進黨執政這10年間加劇，出生人口嚴重崩跌，年輕人對未來沒希望感，未來台灣這塊土地上，台灣人註定只會越來越少。這個災難，不是今天才發生，是長久未處理的結構性問題。是民進黨執政10年，做的最糟糕、完全不及格，被死當的政績。請繼續往下閱讀...陳菁徽表示，站在醫學的觀點，延長產假有其必要性。許多國際研究都指出，延長產假時間，可以讓母親有更多時間恢復健康，並專注於照顧新生兒，有助於提高母嬰的健康水平，減少母親因壓力和疲勞而產生的健康問題。而增加陪產假，也是許多即將成為新手爸爸媽媽迫切的需求。產前有一大堆檢查需要做，但過去的新手爸媽只能在工作，以及確保孩子健康之間，努力的擠出時間做檢查。陳菁徽說，去年11月總質詢，她就借鏡新加坡兒童培育共同儲蓄計畫 （CDA），向賴政府建議，應該要打造一套可以累積的兒童資產帳戶，給予家長安全感，真的感受到政府有一起幫忙養孩子。結果當時行政院長卓榮泰沒有正面回應，繼續吹噓自己已經做了很多了。後來，藍白再共同推出台灣未來帳戶的建議。當時民進黨以及一堆綠委，開始說在野黨無視財政紀律，提出肉桶錢坑法案，造成沉重的國家財政負擔，預算分配嚴重排擠。還說，在這樣的情況下，孩子們的未來又在哪裡？陳菁徽反問，民進黨拿著藍白的香跟著對拜，之前對在野黨的口水攻擊，現在要不要道歉？總不可能藍白提出的就是浪費錢，賴政府推出就是少子化大禮包。她最後強調，這是一個大遲到的禮包。今年出生人口是否能夠守住10萬大關，已經成定局，年底揭曉，年底跟賴政府算總帳。    ,https://news.ltn.com.tw/news/politics/breakingnews/5450909
北士科用電爭議延燒 林秉宥酸蔣萬安：輝達問題全推台電,政治,2026/05/27 10:07,民進黨新北市議員林秉宥（資料照）輝達（NVIDIA）進駐北投士林科技園區牽引發用電疑慮，台北市長蔣萬安指控，根本問題是國家整體的能源政策。對此，民進黨新北市議員林秉宥表示，輝達的問題解決，其他的問題推給台電，萬安計畫通，選我正解。林秉宥在臉書PO文表示，自己有過有一些協助產業園區開發的經驗，核心業務不外乎搞定土地/水/電/環保這四大項，其中最簡單的是電，台電很簡單，你給錢，他給電，沒有饋線？給錢就可以拉。沒有變壓站？給錢就可以蓋，但是台電也很硬，請台電做這類工程，沒有在依照施工進度付款的，就是一次付清，私人企業為了用電，一次就是幾億幾億在付款，從來沒有什麼公家機關幫你牽好線這種事情，這不難理解。請繼續往下閱讀...林秉宥指出，但是輝達太特別了，台灣當然要爭取，但是變壓站用誰的地？誰出錢蓋？我猜台電的方案是，要做一個全區域的，大範圍的改善工程，把輝達的需求包進來，比較不會有圖利特定對象的問題，不然同樣都是私人企業，為什麼要獨厚輝達？北士科也不是只有輝達一家公司。林秉宥續指，這個大區域的方案，用地範圍需要更大，工程金額更高，偏偏台電預算被藍白砍掉，急用的話可能要台北市政府來負擔，台北市府一急要趕快供電，二急不想從自己口袋掏錢，最後的方案就是找藍白紅大喊缺電，希望能逼迫台電就範，用一個根本不可能臨時的臨時變電所來解決輝達缺電的問題。林秉宥直言，輝達的問題解決，其他的問題推給台電，萬安計畫通，選我正解。    ,https://news.ltn.com.tw/news/politics/breakingnews/5450796
金溥聰上廣播跑錯棚 趙少康虧：現在流行失智,政治,2026/05/27 10:02,前國安會秘書長金溥聰。（資料照）馬辦家變越演越烈，受委託處理前馬英九基金會執行長蕭旭岑、王光慈違反財政紀律案的前國安會秘書長金溥聰，今天親上火線，接受前中廣董事長趙少康節目專訪。不過，金溥聰搞錯地點遲到，讓趙少康直呼：「現在流行失智」。趙少康表示，金溥聰剛打電話給他，說自己到了10樓，但找不到中廣，是一個科技公司，結果是金跑錯地方，跑到飛碟電台去了。於是他不好意思的對金說，「你失智啦，現在流行失智啦」，明明昨天才告訴金地址，他還以為是自己失智了。請繼續往下閱讀...金溥聰趕到後，連忙解釋「我不是失智」，而是他過去受訪都到飛碟，還說太太打電話給他，說節目底下留言都說他失智了，讓趙少康聽了一陣大笑。    ,https://news.ltn.com.tw/news/politics/breakingnews/5450886
王鴻薇提案刪光中選會媒宣費 游盈隆：積極溝通,政治,2026/05/27 09:52,中選會主委游盈隆。（記者林哲遠攝）中選會主委游盈隆今首度赴內政委員會備詢。針對國民黨立委王鴻薇提案全數刪減中選會780萬媒宣費，游盈隆會前受訪時說，會積極與委員們溝通，希望不要減列中選會很少、很少的媒體宣傳費；此外，面對中共介選問題，中選會會與國安系統等單位做好準備。游盈隆表示，中選會今天會積極地與委員們溝通，希望不要減列我們已很少很少的媒體宣傳費，他會很坦誠的跟內政委員會委員們進行溝通，希望他們不要一下子減列中選會7、800萬，中選會總數也不過7、800萬。請繼續往下閱讀...針對中共介選問題，游盈隆說明，中選會已經做好各項的準備，計畫都相當完備，今天來內政委員會跟國會做報告，大家也都知道選舉過程中有各種可能的事情發生，中選會在做好準備的情況之下，去因應包括大家所關切的境外勢力，對於年底九合一選舉的威脅、破壞，會與國安系統等各單位做好準備。此外，談及首度以中選會主委身分赴立院備詢心情？游盈隆表示，他今天特別告訴中選會同仁，從今天開始走進立法院，要帶著自信的微笑，中選會人少、事多、權力小，但負責非常重要的事情，會持續努力做好專業工作，這就是他的心情。    ,https://news.ltn.com.tw/news/politics/breakingnews/5450880
楊永明稱高市早苗支持率雪崩 葉耀元打臉：日多家民調皆逾6成,政治,2026/05/27 09:51,圖為日本首相高市早苗。（歐新社）中國山西省日前發生重大煤礦爆炸事故，日本首相高市早苗發聲哀悼，前國安會副秘書長楊永明卻在政論節目稱，高市一反常態釋出善意，不是真心想與北京和解，而是面臨支持率雪崩、經濟無能等，以及目睹「川習會」後深陷被美國拋棄的極大恐慌。對此美國聖湯瑪斯大學國際研究講座教授葉耀元發文直言，對災難表達哀悼是「正常人類」的反應，且楊永明提出的民調是來自某個左派媒體，但同時多家日媒調查，高市政府的支持率都在60-70%左右，這也表示多數日本民眾仍同意日本目前的政策。葉耀元在臉書發文強調，高市早苗不是在跟中國和解，她只是做出一個對鄰國大規模災難表達成任何一個「正常人類」應該有的反應。所以賴清德總統也有發文表示哀悼。他也為此提問「請問楊永明老師，賴清德總統也是在想辦法跟中國和解嗎？」請繼續往下閱讀...針對楊永明稱「高市早苗政府支持率跌至50%」，葉耀元指出，這些資料全部都是來自於《每日新聞》最新於5月25日公布的世論調查（民意調查），葉耀元為此還特地跑到《每日新聞》日本的官網去爬文找資料。但多數人不理解的是，《每日新聞》是一個左派媒體，他們超級討厭自民黨政府，所以他們的民調會有反自民黨的機構效應在所難免。因為你如果去看其他媒體同一時間做的調查，不管是NHK、朝日電視台、產經新聞、時事通信，基本上高市政府的支持率都在60-70%左右。葉耀元提到，沒有一個政府會持續維持超過7成的支持率，因為那只有在民粹的狀況會發生。通貨膨脹渲染全球，日本自然也沒有例外，所以民眾自然會因為自身的經濟壓力將之轉化爲對政府的不信任。但高市能持續維持超過6成的支持率，這表示多數日本民眾同意日本目前親美抗中以及經濟國防右派的政策。    ,https://news.ltn.com.tw/news/politics/breakingnews/5450779
北士科變電所拖1年！吳思瑤轟蔣萬安：只想跟黃仁勳同框,政治,2026/05/27 09:48,民進黨立委吳思瑤。（資料照）台北市長蔣萬安26日在市政總質詢表示，市府27日再和台電開會討論北士科變電所方案細節，一定會在輝達總部完工前，蓋好臨時變電所。對此，民進黨立委吳思瑤表示蔣萬安不只遲了48小時，文林變電所是拖了整整一年！如果蔣萬安解決北士科的用電，跟爭取跟黃仁勳同框同台有一樣的努力，那就好了。吳思瑤在臉書PO文表示，蔣萬安不只遲了48小時，文林變電所是拖了整整一年！北士科用電，蔣萬安被逼急了，昨天在議會慘被砲轟，才承諾「今天」5/27會與台電開會。吳思瑤跟沈伯洋早在「前天」5/25就跟台電共商方案。而這是吳思瑤一年來為北士科用電而開的第N次會議！請繼續往下閱讀...吳思瑤直言，自己跟沈伯洋都不是市長，但都以實際而負責的行動，支持輝達進駐北士科，努力解決產業面臨的問題，如果蔣萬安解決北士科的用電，跟爭取跟黃仁勳同框同台有一樣的努力，那就好了。    ,https://news.ltn.com.tw/news/politics/breakingnews/5450873
質疑韓螢煥現金來源！張育萌曝「3藍委過從甚密紀錄」檢調應徹查,政治,2026/05/27 09:48,前國安會祕書長金溥聰25日舉行記者會，公開了馬英九基金會前員工蕭旭岑、台企聯會長韓螢煥手拿現金合影照片。（資料照）前國安會祕書長金溥聰25日舉行記者會，公開了馬英九基金會前員工蕭旭岑、台企聯會長韓螢煥手拿現金合影照片，引發關注。台灣青年世代共好協會理事長張育萌表示，蕭旭岑手捧的百萬現金，來自在北京閱兵現場高喊「祖國民族復興」的韓螢煥；韓螢煥與國民黨關係密切，曾促使立委翁曉玲、葉元之和林思銘直飛廈門；金溥聰猛攻的當下，蕭旭岑卻在杭州高喊自己是「堂堂正正的中國人」。張育萌質疑，不論是蕭旭岑或是馬英九基金會，「拿這百萬難道心安理得？」馬英九基金會前員工蕭旭岑、王光慈遭質疑違反財政紀律，受前總統馬英九委託的前國安會秘書長金溥聰25日說，王光慈用現金發放年終獎金，但這筆錢最終未入帳，已違反財政紀律；他也出示1張蕭旭岑與台企聯會長韓螢煥手拿現金的合照，稱這也找不到入帳紀錄。請繼續往下閱讀...張育萌26日在臉書發布貼文稱，韓螢煥的「豐功偉業」相當多，韓是廈門台商協會的會長，去年就曾跟著同樣出生台灣的廈門市人大代表吳家瑩，赴北京天安門觀看解放軍閱兵。去年中共舉行「抗日戰爭80週年」閱兵，韓螢煥在現場告訴廈門日報記者，「看到祖國從積貧積弱走到如今的繁榮富強，特別是在中國共產黨領導下實現民族復興，我們由衷感到自豪。」他還表示，解放軍的強大是給台商「吃下了定心丸」，這樣大家在「祖國」投資，就可以更踏實、更有信心。張育萌披露，去年12月，國民黨立委翁曉玲、葉元之趁週末低調搭機飛往廈門，孰料卻是去見韓螢煥。致詞時，韓螢煥直接當著翁曉玲的面說，「兩岸同胞是血脈相連的一家人」；韓螢煥不只「以身作則」，他連任廈門台商協會會長時，更直接喊話新一屆理事會要「跟緊國家戰略、堅守民族大義，維護國家統一與領土完整」。張育萌說，韓螢煥是新竹人，去年底國民黨新竹立委林思銘也飛去廈門見韓螢煥。林思銘解釋說，「全球各地的台商，無論是在美國、日本，或是在廈門、深圳，都是中華民國的國民，都是辛苦在海外打拚的台灣子弟。」張育萌質疑，曾幾何時立委服務鄉親會跑去國外做選民服務，「我就很好奇，林思銘會周遊列國，……到處去見新竹縣民嗎？」張育萌進一步強調，廈門台商協會一直以來都不是普通的台商組織。2020年總統大選前夕，廈門台商協會試圖影響選舉結果，於2019年12月7日舉辦「返鄉投票大會」，要動員5000名協會會員返回台灣投票。去年，海基會舉辦台商春酒聯誼活動，廈門台商協會副會長葉永松竟然在總統賴清德致詞時，鬧場喊話「當家不鬧事」、「台商都不希望大罷免」。葉永松在廈門擔任「一帶一路委員會」的主委。葉永松鬧事後，韓螢煥立即出面接力稱，「中國大陸釋出的善意都說是統戰，那怎麼行呢？」張育萌直言，如今韓螢煥手捧百萬現金交給蕭旭岑的照片曝光，馬英九和蕭旭岑必然知道韓螢煥並非「普通路人」，也必然知道廈門台商協會並非「小小台商組織」。「不論是蕭旭岑或是馬英九基金會，拿這百萬難道心安理得？」他抨擊稱，「最可怕的是，這筆錢確定沒入基金會的帳，不論是誰授意，這背後都『紅影幢幢』。」張育萌補充，金溥聰爆料蕭旭岑的近2天，蕭旭岑都無法公開接受台灣媒體當面訪問，原因是他人就在中國，參加「浙江台灣合作週」。致詞時，蕭旭岑特別強調，「道道地地的台灣人，也是堂堂正正的中國人」、「兩岸人民都是中國人、都是一家人，兩岸的法律和體制，都是用一個中國架構來定位兩岸關係」。文末張育萌指出，韓螢煥等台商拿來的錢，是否入帳恐怕已經是「後端枝微末節的小事」。他質疑，一位卸任總統的基金會竟收受台商來路不明的現金，「來源到底是哪裡？馬英九到底知不知情？蕭旭岑有沒有跨過國安的紅線？這已經不是馬辦私人恩怨了，這是檢調應該徹查的大事。」    ,https://news.ltn.com.tw/news/politics/breakingnews/5450767
鄭麗文指控阻礙訪美 僑委會：毫無證據公然造謠 非常不可取,政治,2026/05/27 09:43,國民黨主席鄭麗文。（資料照）國民黨主席鄭麗文預計6月1日訪美，鄭麗文昨晚接受廣播專訪指出，僑委會竟跟美國人說，「鄭麗文要來了千萬別見她！」，阻礙其訪美行程。對此，僑委會今（27）日痛批，國民黨訪美行程安排不順，鄭麗文不思自家如何改善，反而故意毫無證據公然造謠，轉移焦點並打擊公務人員士氣，破壞僑委會名譽，非常不可取；鄭麗文應為無端造謠向僑委會致歉。僑委會表示，僑委會業務眾多繁雜，人力短少，同仁長期處在超量工作的狀態，鄭麗文還認為僑委會同仁具備隨時直接與國會山莊政治人物溝通能力，讓人苦笑不得，且鄭麗文訪美行程安排跟訪問對象是誰，僑委會都不清楚，如何能夠去阻撓、遊說？請繼續往下閱讀...僑委會指出，這顯示國民黨人士長期以來慣用威權思維，過去監控人民習慣，現在仍用同樣方式看待其他人事物。民主時代的僑委會，早已不是過去黨國威權時期的海工會，請鄭麗文勿再用親中威權的思維解釋及隨意控訴他人，並應為隨意無端控訴造謠，向僑委會致歉。    ,https://news.ltn.com.tw/news/politics/breakingnews/5450859
賄賂收購郭台銘連署書  屏縣議長周典論高雄高分院更審判處3年4月,政治,2026/05/27 09:37,屏東縣議長周典論涉嫌違反正副總統選罷法。（檔案照）屏東縣議長周典論涉賄賂收購鴻海集團創辦人郭台銘連署書二審判3年2月，最高法院撤銷發回高雄高分院更審今宣判，周典論被依違反正副總統選罷法之連署賄賂罪判處3年4月，併科罰金150萬元，褫奪公權5年。周典論針對判決結果表示遺憾，將在收到判決書後和律師研議並提出上訴。請繼續往下閱讀...周典論被控花500萬元為鴻海集團創辦人郭台銘參選總統時收購連署書，一審屏東地院依違反正副總統選罷法之連署賄賂罪，判處4年徒刑、併科罰金500萬元、褫奪公權6年；周與檢方均上訴。高等法院高雄分院認定僅成功連署4份，去年4月改判3年2月徒刑、併科罰金150萬元、褫奪公權5年；最高法院去年12月認為事實調查未盡、法律適用待釐清，撤銷發回高雄高分院更審。周典論上訴辯稱，他自掏腰包500萬元，給屏東縣潮州鎮長周品全（緩起訴確定），是為了激勵周品全努力找人連署，因周品全反映推動過程中，受限個資法等推動有困難，才會請他參考老鼠會的找人方式，一傳十、十傳百達到連署成效。周典論強調，他明確交代這筆錢是要推動連署的工作費，不能把錢拿給連署人，且全案他只跟周品全接觸，其餘人怎麼做他不知道，否認有違反選罷法犯意與犯行。高雄高分院則認為，連署工作費諸如人事、宣傳、各項庶務雜支等費用，均係由郭台銘辦公室負擔，實無由被告個人負擔，並私下交付大筆金錢由周品全處理之理，並參酌證人周品全、陳亮源及黃孝義等人之證詞，以及被告交付款項之後續流向，認該筆500 萬元並非單純作為工作人員之獎勵金使用，故被告確有共同對連署人交付賄賂使其為特定被連署人連署之犯行。考量被告提供之賄款雖高達 500 萬元，但實際發放予連署人之金額甚低，對於選情造成之影響不高，判處有期徒刑 3 年 4 月，併科罰金 150 萬元，褫奪公權 5 年。並沒收被告欲用於賄賂之 500 萬元。可上訴。    ,https://news.ltn.com.tw/news/politics/breakingnews/5450891
曬照曝早跟台電討論北士科變電所 吳思瑤批藍白刪預算又臨時抱佛腳,政治,2026/05/27 09:32,吳思瑤、沈伯洋、立委陳培瑜、議員林延鳳和台電開會討論北士科變電所。（圖片取自吳思瑤的Threads）首次上稿 05-27 01:00更新時間 05-27 09:32台北市長蔣萬安26日在市政總質詢表示，市府27日再和台電開會討論北士科變電所方案細節，一定會在輝達總部完工前，蓋好臨時變電所。對此，立委兼沈伯洋台北市長競選總幹事吳思瑤說，北士科用電問題，自己、沈伯洋、立委陳培瑜、議員林延鳳和台電25日已開會並討論方案，本來只想低調，眼見國民黨惡意炒作「缺電」，又把蔣萬安的「無能」甩鍋給中央能源政策，卻反過來臨時抱佛腳、向台電討救兵，因此才決定公開。請繼續往下閱讀...吳思瑤表示，身為北士科在地立委，找台電討論興建「文林變電所」，已經超過1年、至少開過10次會，而且早在輝達還未確定落腳北士科，就已爭取台電編列預算，強化園區電網韌性，滿足產業所需，台電也編列200億預算，不只包括北士科，更一併規劃改善全台產業園區、工業區電力系統。不過，她指出，去年8月立法院審查「因應國際情勢強化經濟社會及民生國安韌性特別條例」時，「這珍貴的200億預算，被藍白刪除了」，如今，蔣萬安為了應付黃仁勳才回頭向台電討救兵，但臨時變電所只能解燃眉之急，非長久之計。吳思瑤透露，她、沈伯洋已與台電討論的是永久變電所，感慨努力了這麼久，文林變電所「都卡在北市府消極抵制」， 加上藍白砍光北士科電力設施預算，也沒看蔣萬安出來為北士科說話；本來沒想曝光開會內容，然見國民黨惡意炒作「缺電」，又把蔣的無能甩鍋給中央能源政策，以及之前對台電提案置之不理，現在反過來臨時抱佛腳，只好公開。沈伯洋也在底下留言，透過這個專家會議，「其實全景圖和生態系已經越來越具體了，我再用我的專業作一些微調，之後馬上來跟市民朋友們報告！」林延鳳先前曾擔心，輝達預計2029年啟用，然供應60百萬伏安電力的臨時變電所才要開始施工、2031年加入系統運作，意味至少有3年需依賴仙渡變電所苦撐，可能引發廠商「搶電」大戰，而且即便完工合計108.6百萬伏安仍不足，永久變電所最快也要2036年才能供電。    ,https://news.ltn.com.tw/news/politics/breakingnews/5450714
