Title,News_Type,date,content,url
台南養蚵區劃漁業權上路 林俊憲：顧蚵農權益 助產業升級,政治,2026/04/21 17:59,立委林俊憲（中立者）參加在台南安平區社區活動中心召開的漁業產銷班聯合班會開會，並說南市淺海牡蠣養殖區劃漁業權正式公告受理申請。（林俊憲服務處提供）台南市淺海牡蠣養殖區劃漁業權正式公告受理申請，今（21）日在產銷班聯合班會中一併向漁民說明漁業權申請相關規定，為地方蚵農帶來重要制度保障。南市立委林俊憲與市議員黃麗招、林依婷及南市區漁會理事長方裕豐等人出席，關心政策推動進度與漁民實際需求。林俊憲表示，這項政策歷經多年努力推動，終於順利上路，未來蚵農在取得區劃漁業權後，將可直接申請農業部相關補助，面對天然災害時更有保障，不僅守住漁民生計、也有助於整體產業升級與永續發展。請繼續往下閱讀...本次區劃漁業權範圍涵蓋安平區、安南區及南區，總面積達1425公頃，涉及超過1萬棚牡蠣棚，是台南沿海重要養殖區域。林俊憲指出，過去蚵農長期面臨制度不明確、補助申請不易等困境，一旦遭遇颱風或極端氣候，往往難以及時獲得協助。而區劃漁業權制度的建立，等於替蚵農建立一套更完整的保障機制，讓辛苦打拚的蚵農、漁民不再孤立無援。同時，區劃漁業權的推動，不僅保障漁民權益，更是邁向「強化管理」的重要一步。透過明確劃設養殖區域與制度化管理，有助於提升養殖秩序與環境品質，減少無序擴張與環境負擔，讓產業發展與海域生態得以兼顧，實現漁民生計與環境的雙贏。此外，南市區漁會今年也積極推廣「台南蚵」品牌，經由品牌化行銷與品質提升，讓在地優質牡蠣走向更高價值的市場，進一步提升漁民收益。林俊憲認為制度保障結合品牌推廣，可強化整體蚵產業競爭力，打造台南特色漁業的新亮點。立委林俊憲（中立者）參加在台南安平區社區活動中心召開的漁業產銷班聯合班會開會，並說南市淺海牡蠣養殖區劃漁業權正式公告受理申請。（林俊憲服務處提供）    ,https://news.ltn.com.tw/news/politics/breakingnews/5411225
曾從太空拍攝台灣 NASA太空人林琪兒今抵台訪問5天,政治,2026/04/21 17:57,林琪兒。（擷取自美國在台協會AIT臉書）台灣出生、曾從太空拍攝台灣的美國太空總署（NASA）太空人林琪兒（Kjell Lindgren）醫師今（21）日起至25日訪台。美國在台協會（AIT）今日表示，林琪兒已經抵台，將進行一系列公開演講、會晤台灣產官學界領袖。AIT今日透過社群媒體表示，NASA現役太空人林琪兒已抵達台灣，自今日起至本週六，將展開一系列公開演講，會晤台灣產官學界領袖，並與民眾交流太空探索的未來。請繼續往下閱讀...AIT日前指出，林琪兒此行將參訪國家太空中心（TASA）、國立中央大學，也將參訪台中國立公共資訊圖書館、成功大學夏漢民太空科技中心、立方衛星研發中心，最後在台北市立天文科學教育館進行演講。AIT說明，林琪兒出生於台灣，母親為台灣人，父親當年以美國空軍身分駐紮台中。此次返台，對林琪兒而言既具專業意義，也具情感與文化溫度。AIT指出，林琪兒在執行國際太空站任務期間，曾從太空拍攝台灣，從外太空俯瞰地球，讓他更體悟到人類彼此之間深刻的連結，如今，曾從星空凝望台灣的林琪兒，再次親身踏上這片土地，用雙腳去感受它的溫度。    ,https://news.ltn.com.tw/news/politics/breakingnews/5411275
非洲唯一邦交國！建交逾半世紀  《BBC》曝史瓦帝尼對台關鍵地位,政治,2026/04/21 17:51,史瓦帝尼國王恩史瓦帝三世（右三）（King Mswati III）應我國政府邀請訪台，2022年搭乘專機抵達台灣桃園國際機場國賓門進行國是訪問，外交部長吳釗燮（右二）前往接機表達歡迎之意。 （記者劉信德攝）總統府在4月13日宣布，總統賴清德將於4月22日至27日訪問非洲友邦史瓦帝尼，慶祝史瓦帝尼國王恩史瓦帝三世（King Mswati III）登基40週年。外媒《BBC》特別專題報導，揭曉在中國不斷施壓、甚至祭出「貿易封鎖」的威脅下，台史關係為何仍能維持半世紀的背後關鍵。《BBC》報導指出，過去30年間，已有10個非洲國家先後與台灣斷交，轉向投奔北京。目前，史瓦帝尼成為台灣在非洲唯一的邦交國（1968年建交），更被台灣外交人士形容為「中國在非洲最想得到的最後一塊拼圖」。請繼續往下閱讀...面對北京的虎視眈眈，中國官方不僅多次喊話史瓦帝尼「認清大勢」，更在今年5月起給予53個非洲國家零關稅待遇時，唯獨排除史瓦帝尼。然而，北京在非洲大規模投入基建的策略也並非無往不利，報導引述政大教授楊昊分析，各國也在觀察，斷交後的利益承諾是否真的會落實，例如宏都拉斯在與台斷交後，白蝦出口中國的採購量便遠不如預期。史瓦帝尼是目前非洲唯一的「絕對君主制」國家，國王恩史瓦帝三世擁有實權。學者嚴震生指出，正是這種政治體制讓史瓦帝尼能抗拒中國壓力。由於國王是實質元首，「他說了算」，只要國王本人願意維持與台灣的邦交，國內便不會有太多雜音。此外，相較於中國偏好投資顯眼的基建，台灣則深耕醫療、農業與科技教育。從派遣醫療團隊為國王及其妃子治療新冠肺炎，到協助鄉村電氣化、推動王家科技園區，台灣的援助對當地人民而言更具「有感性」。目前更有超過600名史國學生在台求學，長期培養當地社會精英，鞏固台史情誼。現階段台灣邦交國數量處於12個的歷史新低，外界質疑守住這些小國的意義。嚴震生認為，這具有極大的「現實意義」，因為唯有正式邦交國，能在聯合國、WHO、ICAO等國際場合，為台灣正式提案並參與辯論。雖然美、日等國支持台灣，但在外交程序上，正式提案仍需依賴邦交國代勞。報導最後提到，台灣外交情勢有望「止跌回升」。中美洲友邦宏都拉斯近期因內部政治變動及中國承諾跳票，傳出在美方協助下有復交轉機。若能成功「回頭」，將成為台灣近 20 年來首個止跌回穩的里程碑。    ,https://news.ltn.com.tw/news/politics/breakingnews/5411129
中國介入施壓  總統賴清德明恐無法出訪史瓦帝尼,政治,2026/04/21 17:42,總統賴清德。（資料照，記者李惠洲攝）總統賴清德預計明（22日）至27日將率團出訪我國非洲友邦史瓦帝尼，然而就在出發前夕，總統府今（21日）傍晚突然發出採訪通知，將於6點緊急召開記者會，傳出恐因靠近非洲方面的航權問題，賴清德此行出訪恐無法成行。總統賴清德原定22日出訪非洲友邦史瓦帝尼，此行採取專機直飛、不過境任何國家，卻在出發前傳出中國因素介入施壓，有國家收回航權，賴清德恐無法順利出訪。請繼續往下閱讀...模里西斯3國無端取消飛航許可 賴清德暫緩訪問非洲    ,https://news.ltn.com.tw/news/politics/breakingnews/5411252
蕭旭岑早上才曝爆料者約談不順 馬英九基金會下午宣佈已約談,政治,2026/04/21 17:30,前馬英九基金會執行長、國民黨副主席蕭旭岑今上午表示，調查小組約談前隨扈（現為特助）的過程不是很順利；馬英九基金會下午聲明，從未有任何人杯葛調查。（記者方賓照攝）前馬英九基金會執行長、國民黨副主席蕭旭岑今上午表示，基金會內部同事透露，調查小組要約談前隨扈（現為特助）的過程不是很順利。而馬英九基金會下午聲明，調查小組已於今日下午完成約談第一位基金會人員，從未有任何人杯葛調查。馬英九基金會下午聲明，馬英九基金會董事三人調查小組已於今日下午完成約談第一位本會人員。對於約談事宜本會一直全力配合，從未有任何人杯葛調查，特此說明。請繼續往下閱讀...蕭旭岑稍早接受專訪表示，那位同事（指前隨扈）他也很熟，該同事本身是一位非常認真、盡責的好同事，當然可能有一些誤解。但是基金會內部同事透露的訊息是，好像調查小組要約談他的過程不是很順利。他是希望趕快約談他本人、王光慈等相關的人士，能趕快向董事會調查小組來說明。    ,https://news.ltn.com.tw/news/politics/breakingnews/5411229
臭爆！台中垃圾車「餿水倒水溝」 江肇國揭內幕：市府無能、基層遭殃,政治,2026/04/21 17:30,台中市環保局清潔隊在北屯區亂倒廚餘被民眾目擊拍下；左為台中市長盧秀燕。（本報合成，資料照、擷取自Threads）台中市北屯區昨日發生一起令人作嘔的公務爭議。有民眾目擊環保局垃圾車直接在路邊將車底廢水倒入排水溝，導致整條街道臭氣熏天。該名隊員當時無奈表示，因廚餘桶全滿「不知道怎麼辦」，才出此下策。針對此案，市長盧秀燕在市政會議上震怒，下令嚴懲並開罰司機，但此舉卻遭到市議員江肇國重砲回擊，痛批這是「責任全往基層推」的作風。江肇國今天在臉書發文表示，關於昨天的北屯清潔隊路邊傾倒廢水案，市長在市政會議表示要嚴懲開罰這位司機，這又是一件責任全往基層推的盧氏作風！「這位司機的做法的確不對，但為什麼他要半路傾倒廢水，而不回到隊部再處理呢？」請繼續往下閱讀...江肇國指出，因為市政府現在請民眾把廚餘都當垃圾丟，每一輛清潔車擠壓垃圾後流出大量廢水，車底的廢水槽一下就滿了，如果不找地方洩除，就沒有辦法繼續往下收取垃圾。如果司機不管水槽，硬著頭皮繼續收，那垃圾擠壓後的廢水就會滿溢出來，沿街滴流，惡臭留在街道上，影響範圍更廣！如果司機車子開了直接回隊部倒水，那車子就會脫班，民眾的垃圾就沒有人收，「司機雖然有錯，但是他的兩難是政策造成的，是盧秀燕無法處理廚餘所造成的！」江肇國直言，台中市廚餘失控，市府請民眾把廚餘當垃圾丟，造成垃圾車廢水槽滿溢，司機無計可施，為了繼續收垃圾只好找個地方先泄水，結果整個市政府把責任都丟給司機！這樣公平嗎？「市府無能，基層遭殃」就是環保局同仁的無奈！    ,https://news.ltn.com.tw/news/politics/breakingnews/5411214
左營區里長劉淯騰涉毒駕判刑   民進黨高市黨部：2026不提名,政治,2026/04/21 17:27,高雄市左營區自助里長劉淯騰。（翻攝臉書）高雄市左營區自助里長劉淯騰涉毒駕被判刑，民進黨高雄市黨部今指出，2026年里長選舉將不予提名，後續並依循黨內相關規定啟動評議機制，最嚴厲將處以開除黨籍。媒體披露，高雄左營區里長劉淯騰過去曾因施用第三級毒品愷他命後駕車上路，最終被法院判刑確定；消息人士質疑，這情況與綠營「毒駕零容忍」立場有強烈落差，也引發外界質疑。請繼續往下閱讀...民進黨高市黨部傍晚指出，針對自助里長劉淯騰毒駕遭判刑事件，今日里長提名小組會議中秉持「毒駕零容忍」立場，經討論後決議，2026年里長選舉不予提名劉淯騰，後續並依循黨內相關規定啟動評議機制，最嚴厲將處以開除黨籍處分。    ,https://news.ltn.com.tw/news/politics/breakingnews/5411227
蘆社大橋進度卡全因北市搞不定區段徵收 新北議員批李四川台北本位主義,政治,2026/04/21 17:21,"新北市議員顏蔚慈。（資料照）首次上稿16:08更新時間17:21（新增國民黨議員回應）淡江大橋通車在即，「蘆社大橋」恐淪下一條政見大橋？科技大廠輝達（NVIDIA）海外總部落腳台北市北投士林科技園區，然而淡水河對岸的新北市蘆洲、三重區聯外橋梁尖峰交通負荷量早爆表，新北市長侯友宜去年強調一定要做的「蘆社大橋」而今被國民黨新北市長參選人李四川拿來當政見，新北市議員顏蔚慈不禁批評，蘆洲人都知道蘆社大橋不斷延期，就是因為台北無法整合社子島開發爭議，李四川任內搞不定台北區段徵收，參選新北還用「台北市本位主義」思考。請繼續往下閱讀...銜接蘆洲和士林區社子島的蘆社大橋規劃多年，侯友宜去年答詢時指出，蘆社大橋一定要蓋，市府持續推動中，去年6月10日已辦理可行性評估招標，也會預留輕軌路廊。顏蔚慈批評，台北市遲遲不能整合社子島開發爭議，導致台北端的落點遙遙無期，李四川在台北市副市長任內主持無數次台北市都市計畫委員會，直到卸任前最後一刻都還搞不定社子島的區段徵收，如今跑來新北參選，竟以此作為政治提款機「情緒勒索」市民。顏蔚慈說，李四川作為新北市長參選人，想的不是替新北引進高科技產業、落實在地就業，「而是一心只想著用『台北市本位主義』思考，想蓋橋把新北人送去台北上班」，莫非新北市民只配當台北市的通勤工具人？她呼籲李四川放下台北本位主義，認真替新北的產業未來思考。至於蘆社大橋進度部分，新北市府新建工程處說明，因雙北市政府都市計畫相關程序仍持續辦理中，新北將持續配合2市都市計畫區段徵收開發期程，滾動檢討工程推動；另因此案涉及專業議題較廣，市府正辦理可行性評估作業，已於去年8月1日決標並啟動研究確認相關議題，已於今年4月20日召開可行性評估期中報告審查會議，正依照與會單位意見修正。新北市議員王威元則表示，事關民眾權益與各式立場時，就難以迅速解決，社子島問題即便是民眾黨執政也無法立刻解決，李四川願意挑戰，就是務實與勇氣，不需要冷嘲熱諷想解決問題的人，他反要請教民進黨新北市長參選人蘇巧慧有何想法？過去民進黨在台北縣執政期間是否想過蘆社大橋？    ",https://news.ltn.com.tw/news/politics/breakingnews/5411008
商總施壓中國涉台10措施 陸委會：「以商逼政」是公開秘密,政治,2026/04/21 16:59,陸委會副主委沈有忠。（記者陳鈺馥攝）習鄭會後，中共提出十大涉台措施，全國商業總會昨號召7大公協會呼籲政府接受。陸委會副主委沈有忠今日質疑，中共「以商逼政」做法已是公開秘密，呼籲業界朋友能看清中共對台統戰意圖，如果沒有國家主權，所有發展都是假的。全國商業總會理事長許舒博昨日聲稱，自己沒有收到中方壓力，倒是收到台灣政府電話。沈有忠受訪時表示，我們跟業者的溝通一直都是蠻順暢的，以這次情況來講，我們還是希望能讓業者了解到，經濟上的交流不能犧牲國家主權或說兩岸之間交流，應該儘量去政治化和去風險化。請繼續往下閱讀...沈有忠指出，我們希望能夠讓業者了解到在經濟交流的過程中，政府有政府的考量，希望說業者能夠跟政府站在一起，儘量以國家安全做為共同目標，一起來捍衛中華民國的主權，讓兩岸的交流健康有序。媒體問及，有無掌握中共動員台灣企業界出來支持惠台措施？沈有忠回應，我們目前沒有具體的一個情況，但是我們認為，中共「以商逼政」的做法，已經是一個公開秘密。沈有忠說，要繼續呼籲產業界的朋友能看清中共對台統戰的意圖，中共用「商業政治化」，逼迫台灣接受它們政治前提的一種做法。沈強調，希望業者能夠站在國家整體利益的前提上，與政府一起捍衛國家主權，因為如果沒有了主權，所有的發展都是假的！香港例子已經告訴我們，若沒有自由跟民主的話，所有的經濟產業都不可能永續發展。關於增加兩岸直航航點，沈有忠表示，一直以來我們都呼籲，要回到官方的交流和協商，現在看到中方希望開的這5個航點，基本上都是觀光航線，但現在包機的航點，也還有空的航點可以開放申請，看起來這五個航點，恐怕不是有第一迫切的需求。沈有忠質疑，若真的是站在對台商好或對兩岸民間交流好，還是再次呼籲，在直航議題上，兩岸已經有既有協議，所以回到協議並不難，不用透過特定政黨放話，也不用特別操作一些只有把台灣人帶去消費的一種觀光航線。沈有忠批評，有人評價說這個叫做「惠中政策」，不是惠台政策，這5個航點對台灣是不是真的有迫切需要，台灣社會自有公評。他指出，要強調兩個重點，一是任何跟公權力有關事項，請跟中華民國政府協商，不需要繞過中央政府跟特定政黨。二是真正要對兩岸的民間交流展開健康有序的話，請拋開政治考量，去政治化、去風險化，直接就民生議題來跟我國政府做接觸。    ,https://news.ltn.com.tw/news/politics/breakingnews/5411184
廣告時間對話外流！ 小草女神嗆來賓：懷疑是青鳥有問題？,政治,2026/04/21 16:54,柯文哲17日晚上到逢甲夜市掃街，疑似遭人噴辣椒水掩鼻，鬧了3天卻傳出是隨行的台中六分局分局長周俊銘誤噴。（資料照，劉芩妤提供）民眾黨前主席柯文哲逢甲夜市遭噴辣椒水一案昨日水落石出，第六分局長周俊銘因罐體破裂「試噴」釀禍，他也遭記過與拔官處分。對此，台中市西屯區市議員參選人「小草女神」劉芩妤昨日上政論節目，在廣告時間與來賓發生激烈交鋒。面對來賓質批評，不該在真相查明前就懷疑青鳥犯案、懷疑分局長是青鳥，劉芩妤竟稱自己的懷疑是有道理的，反嗆：「為什麼不可以？」劉芩妤昨日上政論節目《狠狠抖內幕》談到辣椒水烏龍事件。廣告時間，來賓鍾年晃批評，不該在事實出來就先懷疑他人。他質問劉，為什麼能懷疑青鳥、懷疑分局長是青鳥？劉芩妤則回，今天若是民進黨掃街被攻擊，也一定會懷疑是反對者所為。她表示，自己今天是受害者，所以能有這樣的懷疑，本身就是有道理的。鍾年晃則批，懷疑至少要有一點事實依據。劉芩妤則反問：「為什麼不可以（懷疑青鳥）？」請繼續往下閱讀...劉芩妤還表示，目前狀況就是分局長「因為反對我們，所以來噴我們，既然他是反對我們的人，我們懷疑他是青鳥有問題？」而主持人也跳出來問，怎麼現在就能斷定分局長反對你們？隨後主持人也突然想起要提醒劉芩妤，表示「我們廣告時間是有播出的喔。」相關討論就到此中斷。在進入廣告前，劉芩妤表示，噴辣椒水是分局長個人行為，並影射該分局長有「政治傾向」或對民眾黨有「仇恨」。對此，鍾年晃指出，此說法有「扣帽子」嫌疑，不該這樣影射。然而劉芩妤卻回答，不排除有這樣的問題，否則怎麼會在這樣的情況下誤噴四次，根本是接近「故意」的行為。針對有大量小草先前懷疑、指控是青鳥噴辣椒水，甚至民眾黨主席黃國昌評論此事時也扯到民進黨、總統賴清德。劉芩妤說，她本人沒有說過這樣的話，但她認為黃國昌的想法也是合理的。    ,https://news.ltn.com.tw/news/politics/breakingnews/5411094
李志鏞涉貪判刑12年 為宜蘭三星議員選舉投下變數,政治,2026/04/21 16:52,國民黨籍三星鄉長李志鏞涉貪被判刑12年，為年底三星議員選舉投下變數。（記者江志雄攝）國民黨籍宜蘭縣三星鄉長李志鏞涉貪案，今天（21日）一審被判刑12年，依選罷法第26條規定，刑期超過10年，不得登記為選舉候選人，判決結果讓他回鍋參選縣議員夢碎，也為三星鄉議員選情投下變數。三星鄉議員應選1席，民進黨現任議員陳文昌確定不連任，綠營改推前三星鄉代表會主席游正義女兒游雅絢參選。國民黨方面，李志鏞2屆鄉長任期即將屆滿，支持者鼓勵他回鍋選議員，但卡在涉貪官司，李遲遲未做決定，國民黨黨內提名登記已在本月10日截止，無人登記參選三星議員。請繼續往下閱讀...三星政壇人士指出，李志鏞涉貪官司宣判，年底確定無法成為候選人，國民黨內有意參選者，可能在近日內陸續浮上檯面，牽動藍營的選戰布局。    ,https://news.ltn.com.tw/news/politics/breakingnews/5411174
鄭麗文讚習近平「把我們當一家人」 陸委會：跨境鎮壓沒一天停過,政治,2026/04/21 16:29,中共拋出10項對台措施，國民黨主席鄭麗文近日大談 「兩岸一家人」，讚美習近平「對我們好都來不及了，怎麼會想打你呢？」（資料照）鄭習會後，中共拋出10項對台措施，國民黨主席鄭麗文近日大談「兩岸一家人」，讚美習近平「對我們好都來不及了，怎麼會想打你呢？」陸委會副主委沈有忠今日受訪駁斥，如果真的是這樣的話？為什麼中國軍機艦到現在沒停過，甚至是跨境鎮壓，為什麼一天都沒有停過。沈有忠指出，坊間過往一直都有所謂「疑美論」，但是我們現在非常擔心，因為習鄭會可能讓美國本身也出現所謂的「疑台論」，「疑台論」一出現的話對於中華民國來講，傷害當然會非常巨大。請繼續往下閱讀...沈有忠強調，兩岸的議題當然不是所謂中國人內部的議題，而是全球高度關注的議題，台海穩定、台海和平都是全球共同關注的議題，所謂「中國人不打中國人」或「一家人疼你都來不及，對你好都來不及，怎麼還會打你」云云。如果真的是這樣的話？為什麼中國軍機艦到現在沒有任何一天停過，所謂的環台軍演對於台灣的威脅來講，甚至是跨境鎮壓，為什麼一天都沒有停過。沈呼籲，用實力才是真正捍衛和平的做法，不是犧牲國家主權，不是用妥協，更不是用躺平，這樣會讓國際社會對於台灣有沒有自我防衛的決心都會產生動搖，這樣的情況對台灣的國際局勢是非常不利。    ,https://news.ltn.com.tw/news/politics/breakingnews/5411140
國民黨宜蘭三星鄉長李志鏞涉貪判12年 年底轉戰縣議員泡湯,政治,2026/04/21 16:25,宜蘭三星鄉長李志鏞。（記者王峻祺攝）國民黨籍宜蘭縣三星鄉長李志鏞，任內涉貪一審被判12年，褫奪公權3年，今天除依法被停職，也因有期徒刑超過10年以上，依據「公職人員選舉罷免法」，判決尚未確定者，不得登記為候選人，年底想要轉戰參選縣議員將泡湯！三星鄉長李志鏞涉嫌辦活動時圖利特定廠商、收取20萬元賄款，宜蘭地方法院今天依違反貪污治罪條例之違背職務收賄等罪判刑，連任2屆鄉長的他，年底有意轉戰縣議員，未料身陷官司，不僅被停職，還將無法投入選戰。請繼續往下閱讀...李志鏞今天一審被判12年，地方關心他未來是否仍有資格參選縣議員。宜蘭地院表示，根據「公職人員選舉罷免法」第26條第1項第10款規定，受死刑、無期徒刑或10年以上有期徒刑之判決，尚未確定者，均不得登記為候選人。宜蘭地院指出，李志鏞被判12年，依規不得登記，因此年底將無法參選公職。    ,https://news.ltn.com.tw/news/politics/breakingnews/5411108
