Title,News_Type,date,content,url
沈榮欽剖析鄭麗文訪美失利原因 批錯估美國形勢又誤判自身角色,政治,2026/06/24 09:22,國民黨主席鄭麗文。（資料照）國民黨主席鄭麗文先前結束訪美行程，在訪美期間引發諸多爭議，對此，加拿大約克大學副教授沈榮欽分析，鄭麗文訪美行受挫的根本原因，在於她錯估形勢，又執行不當，既有戰略上的錯誤，也有戰術上的錯誤。沈榮欽在臉書PO文表示，鄭麗文訪美行受挫的根本原因，在於她錯估形勢，又執行不當，既有戰略上的錯誤，也有戰術上的錯誤，以下分別述之：關於戰術錯誤，帶勤彭蓁出訪是鄭麗文犯的第一個錯，勤彭蓁所屬的台企聯屬於國台辦指揮，美國政府對於參訪國安單位的人都會做盡職調查，就算勤彭蓁不是「監軍」，鄭麗文帶勤彭蓁出訪也在外交上不得體，美方會認為所有會談的結果都會流向中共。請繼續往下閱讀...沈榮欽指出，鄭麗文缺乏發言系統，由於文傳會主委尹乃菁請辭中，副主委江怡臻也未隨行，本次並無發言系統參加，基本上由鄭麗文一人兼任。鄭麗文可能認為自己出身媒體，兼任發言人不成問題。但實際上，參訪團的發言任務繁重，通常必須一天發出數稿，鄭麗文不堪負荷之下，發言系統果然出現問題，加上本次參訪並無記者相隨，台美又有時差，造成參訪過程中出現許多質疑，都沒能在第一時間提供說法。連負責在國民黨官方帳號解釋行程的陳以信，直播時都老實交代，自己也只能從媒體上追蹤新聞，對於爭議毫無解釋，只能說些言不及義的話拖過時間。本身靠媒體宣傳起家的鄭麗文，卻在訪美宣傳上吃了大虧。沈榮欽續指，而中國統戰官員參加僑宴，包括中國統戰部官員俞國梁、同樣隸屬統戰部的「中國和平統一促進會」會長焦聖安，以及福建美國人協會會長、知名親中領袖陳恆等人都參加了鄭麗文的僑宴。此外，鄭麗文出席紐約「亞洲協會」座談時，一名中國籍男子 YiFeng Su 因在現場質疑鄭麗文「擁抱共產黨」而遭驅離，隨後場外便出現美國的福建黑幫成員對他威脅。這些都會引起美國情治單位的注意，尤其是俞國梁曾經介入波士頓市長選舉以及為中國軍工與高科技企業在美國招募，本來就在美方的觀察名單中，其實僑宴會出現哪些人，並非鄭麗文所能完全控制，但是僑宴參加者大多是透過人際網路邀請，這顯示出鄭麗文的僑界恐怕並非只是支持藍營華僑或是移民已久的老僑，也包括中國人在美國的人際網路，而這也助長了鄭麗文在僑宴中大舉讚揚習近平以及採用中國敘事，進一步流入美方，而加深對鄭麗文的不信任。沈榮欽分析，相較於戰術錯誤，更根本的是戰略錯誤，鄭麗文錯估自身位置，鄭麗文訪中因為獲得習近平加持，能夠提升聲望的原因是因為她成為代理人，佔據兩岸「結構洞」的位置。但是結構洞的優勢只有在雙方缺乏直接聯繫管道時（如中國拒絕與台灣政府溝通），才能發揮最大功效，一但雙方有更強的直接聯繫管道，結構洞的優勢也將喪失，也就是，當川普都和習近平能夠直接會面時，鄭麗文帶來任何中國訊息的價值都是 0，但是鄭麗文過度沈浸於習近平帶給她的地位，不僅以中國框架論述，還對谷立言行前的問題輕忽以對，不僅無意認真解釋自身立場，甚至極力讚美習近平，意圖以此改變美方政策（見以下說明），這種對於位置的錯估，使得她根本無法從美方的立場看待訪美行，還一心幻想著借美方提升聲望，美方自然不會讓其得償所願。沈榮欽補充，誤解美方政策，鄭麗文將第一島鏈稱為冷戰遺緒，要求逐步轉化為連結日本、韓國、台灣、中國大陸沿海及東南亞的重要經濟與交流節點，打造促進合作共榮的「和平繁榮之鏈」，她也因此將本次訪美稱為「和平繁榮之旅」，雖然第一島鏈的確是在冷戰初期美國前國務卿杜勒斯（John Dulles）圍堵蘇中之用，但是如今已經成為圍堵中國的重要防線，阻止中國從陸權國家成為海權國家。鄭麗文對美國政府的政策完全無知，還妄想以中國的論述要美國交出第一島鏈，這是戰略上的重大錯誤。沈榮欽強調，在白宮今年的《國家安全戰略》（NSS）中，第一島鏈是「拒止型嚇阻」的戰略樞紐，首要任務是維持軍事優勢以嚇阻台海衝突、防止敵方企圖奪取台灣或片面改變台海現狀。只是美國不願單獨承擔，要求並敦促第一島鏈沿線的盟友與夥伴（如日本、菲律賓、台灣）必須「大幅增加自身的國防預算」，投入更多資源於集體防衛。鄭麗文從刪減國防預算到主張翻轉第一島鏈，等於跟白宮「對著幹」，而她和團隊卻完全沒有意識到。除此之外，戰爭部的《2026年國防戰略》（NDS）中，同樣將第一島鏈視為拒止防禦的關鍵，部長赫格塞斯才剛到東亞強化第一島鏈，就不多贅述了。沈榮欽直言，其實鄭麗文不僅不了解美國政府，也不了解美國社會。例如鄭麗文演說時略述猶太人在美國的表現，然後說：「如果猶太朋友可以對美國有這麼關鍵的影響力，我們華人的智慧、華人的努力、華人的品德，絕不會輸給他們」等等，就是一個例子。鄭麗文的說法雖然在華人世界看來沒有問題，但卻踩到美國社會的紅線之一。在美國，鄭麗文的說法可能會被歸類為「反猶言論」，因為其背後隱含猶太人控制美國的陰謀論，而且暗示兩個種族之間應該競賽。可是不僅鄭麗文說這話時興高采烈，甚至也沒有任何幕僚提醒她踩了美國紅線，或是事後如何減少傷害，這都顯示鄭麗文對於美國十分陌生，也缺乏高明的幕僚。    ,https://news.ltn.com.tw/news/politics/breakingnews/5481907
黃智賢護兄深夜狂回「稱讚黃偉哲留言」 直播嘆：被抹黑還不辯解,政治,2026/06/24 09:09,近日有網友發文細數黃偉哲任內政績，黃智賢也留言為哥哥抱屈，黃智賢在直播時更分享，「黃偉哲是個喜憨兒你知道嗎？他連幫自己辯解都沒有能力，通緝犯還有媒體人栽贓他抹黑，他都講不清楚」。（圖擷自threads）資深媒體人黃智賢與台南市長黃偉哲雖是親兄妹，但兩人的政治立場完全不同，隨著黃偉哲在年底大選後將卸下台南市長一職，近日有網友發文細數黃偉哲任內政績，黃智賢也現身留言「認證」，並為哥哥抱屈，大嘆黃偉哲自我宣傳做得太差，引發網友熱議。昨深夜黃智賢更是對網路上稱讚黃偉哲的內容瘋狂回覆，逐一留言表達感謝。日前有網友在Threads發文分享，指高雄市長陳其邁持續塞活動給高雄市民、台中市長盧秀燕飛出國拓展自己，台南市長黃偉哲則是選擇飛出國賣農產。該文曝光後竟釣出黃智賢留言表示「台南也有塞活動喔，也幫台積電跟南科處理土地問題」。請繼續往下閱讀...昨日在社群又有網友分享一張在2024年12月拍下的照片，網友表示這是「你所不知道的黃偉哲」，並指當時是結束日本行程、在登機口前要搭最後一班航班回台灣，黃偉哲累到坐著睡著。照片曝光後再度引發網友熱議，並紛紛留言直呼「留友看，甚至還坐廉航去日本行銷台南的農產，羨慕台南有個好市長」、「一位只會行銷台南、不會行銷自己，出國談貿易不帶任何助理秘書，單槍匹馬上戰場，這種人打著燈籠都找不到」、「其實會做事的人真的不太會大剌剌的宣傳自己，默默的做，默默的承受」、「曾經家人在東京的東橫inn吃早餐遇到他！居然只住東橫inn，真是反觀」、「很不捨，為什麼他是六都滿意度最後一名」。黃智賢在直播時也分享，「黃偉哲是個喜憨兒你知道嗎？他連幫自己辯解都沒有能力，通緝犯還有媒體人栽贓他抹黑，他都講不清楚」、「至於黃偉哲的市政，我認為黃偉哲有做好的地方，有做不好的地方，人本身也有可以值得嘉獎的，也有值得批評的地方」、「我覺得黃偉哲他可不可以不要從政啊，我又不能跟他一起開賢哲公司撈錢，我們又不是這種人，那從政幹嘛」、「我問過他為什麼不花一些資源好好的行銷自己，或者把很多政策講清楚，他竟然回我，這個行銷的費用要花在台南市啊，不能行銷市長」，讓黃智賢直呼「你有病嗎？你會不會太蠢，如果你被黑到極致還怎麼為台南做事啦」。相關內容引發網友熱議之餘，黃智賢昨晚也持續「瘋狂點讚」，在社群上不斷回覆稱讚黃偉哲的內容，除了一一留言表達感謝，黃智賢在一些留言中也提到「南科，台積電，都是繁榮地方，把工作留在台南」、「謝謝。他大概就是會一直搭經濟艙」、「因為要幫台南省錢（去日本只住東橫inn）」、「許多活動都非常棒。但是，市長會一直被黑」。針對去年台南風災時，不少人質疑救災及復原進度緩慢，黃智賢也表示「沒有任何城市，可以在2週，甚至2個月內，幫居民修復1萬個屋頂。市府有補助災民，但也要時間造冊，取證，真的很無奈」、「現實世界的工具，物資跟工人人數的限制擺在那裡。地球上沒有任何市長，可以在幾週，或幾個月內，幫助居民修好屋頂」、「當時大量網軍是立刻痛罵他冷血，無能，甚至罵他害居民屋頂被颱風吹走。私人財產的屋頂被吹走」。也有網友發文表示「黃智賢真的是蠻令人敬佩的，即使她的政治立場很鮮明，但在討論政策的時候她不會偏幫跟自己立場接近的陣營，甚至會幫敵對陣營平反」。對此黃智賢也回應「謝謝您的理解，以及過譽。可能很多人不會理解，連馬李正皓去年被疑似黑幫者潑辣椒水時，我不過發文譴責暴力，我都被黑被罵被潑糞」、「如果每個台灣人都被洗腦成，只要這個人我不喜歡，就可以亂造謠，亂罵，用暴力對付。那麼，台灣就結束了」。     在 Threads 查看     在 Threads 查看昨日在社群又有網友分享一張在2024年12月拍下的照片，網友表示這是「你所不知道的黃偉哲」，並指當時是結束日本行程、在登機口前要搭最後一班航班回台灣，黃偉哲累到坐著睡著。照片曝光後再度引發網友熱議。（圖擷自threads）    ,https://news.ltn.com.tw/news/politics/breakingnews/5481863
網友貼文釣出黃偉哲胞妹 透露哥哥曾說過,政治,2026/06/24 09:02,網友意外捕捉到黃偉哲趕「紅眼班機」累著坐睡了。（圖擷自網路社群）有網友近日在社群平台發文分享台南市長黃偉哲務實，盛讚其任內政績不少，卻不擅長包裝自己。貼文意外釣出黃偉哲胞妹、資深媒體人黃智賢留言認證，透露哥哥曾說過1句話：「行銷的錢要花在行銷台南啊，不能行銷市長。」引發網友熱烈討論。有網友發文表示，曾在桃園機場，當時準備前往德國參展，在報到櫃檯遇見黃偉哲，因一直偷瞄對方，黃偉哲乾脆主動上前打招呼，得知他們此行是為台灣拚經濟，黃偉哲表示自己將前往波蘭拜訪姐妹市，臨走前還說出一句令他印象深刻的話：「你們這趟拚經濟，我們這趟拚外交，我們一起加油。」請繼續往下閱讀...說到黃偉哲最具代表性的「個人品牌」，不少網友則想到畢業季限定的「市長陪你拍」。自110學年度首創的傳統，由黃偉哲親自頒發市長獎，並配合畢業生指定姿勢合照，不論搞笑、創意還是高難度動作幾乎來者不拒，因此被戲稱創下無人能及的「黃偉哲障礙」。最令人印象深刻的是去（2025）年市長獎頒獎期間，1名男學生挑戰「揹市長」拍照，未料一時重心不穩，讓體重約87公斤的黃偉哲當場向後翻倒、四腳朝天摔在地上。累計與超過1萬名國中小畢業生完成創意合照，成為台南畢業季最具代表性的特色活動之一。2025年1場「市長陪你拍」活動，學生一時揹不穩，黃偉哲摔倒在地。（圖擷自活動畫面）    ,https://news.ltn.com.tw/news/politics/breakingnews/5481921
謝志偉酸鄭麗文、周錫瑋一搭一唱 批幫中國設局讓台灣出局,政治,2026/06/24 08:41,我國駐歐盟代表謝志偉。（資料照）國民黨主席鄭麗文日前結束訪美行程，前台北縣長周錫瑋日前聲稱中國軍事強大，是為了保護台灣不受外國欺負。對此，我國駐歐盟代表謝志偉表示，女的假造局，男的真造謠，讓中華民國台灣的自由民主「出局」，正是他們聯手準備設給我們的「終局」。謝志偉在臉書PO文表示，女的假造局，男的真造謠，嘴巴說是在為台灣「造局」，動作卻是在幫中國「設局」，讓中華民國台灣的自由民主「出局」，正是他們聯手準備設給我們的「終局」。請繼續往下閱讀...謝志偉直言，對了，除了一個女的假造局，還有一個男的真造謠，說中國的「導彈」是要保護台灣，噢，原來，「導彈」的意思是：被誤導的飛彈！    ,https://news.ltn.com.tw/news/politics/breakingnews/5481888
鄭麗文下鄉成票房毒藥？藍營人士：盧秀燕、韓國瑜可能取代成真正母雞,政治,2026/06/24 08:18,國民黨主席鄭麗文。（資料照）為因應年底地方大選，國民黨主席鄭麗文今啟動行動中常會下鄉輔選，首站來到台東，接下來將前進澎湖。但黨內人士分析，鄭麗文雖然藉由行動中常會幫參選人站台，但更像在「替自己造勢」，不管是鄭麗文自稱「很有票房」還是外界質疑的票房毒藥，都已可預見台中市長盧秀燕和立法院長韓國瑜將取代鄭麗文成為真正的藍營母雞。國民黨昨天才發佈鄭麗文訪中和平之旅紀錄片「造局者」，宛如參選總統起手式。黨內人士表示，鄭麗文上任後除了兩岸路線備受關注，宣傳自己在「鄭習會」的巨大成果，看不出對地方參選人和選舉有任何助益，種種行為皆是個人大於黨。包括韓國瑜受邀訪美這等黨內大事，鄭麗文也是在廣播被動回應，還說比層級沒意義，為自己洗白。請繼續往下閱讀...黨內人士表示，鄭麗文身為黨主席，但關注都是放在個人，反而盧秀燕不僅派人去機場為韓國瑜送機，也多次與國民黨縣市長參選人合體幫忙站台。雖然鄭麗文才是黨主席，但盧秀燕做的恐怕更像是鄭麗文才要做的事。不過，鄭麗文這兩天接受廣播專訪談及2026地方選舉，不僅稱自己「很有票房」，還說自己路線是國民黨非常大的資產，讓她感受到越來越強大的熱情，這種支持度不只2026年，還會延續到2028年。黨內人士表示，不少藍營參選人被問到是否會找鄭麗文站台，雖然沒有直接拒絕，但態度保留。畢竟地方選舉才是重點，而不是找一個人來自己的場子宣傳兩岸路線和鄭習會，就算不一定扣分，但也完全沒有加分。    ,https://news.ltn.com.tw/news/politics/breakingnews/5481903
秦慧珠批殷瑋反遭藍營側翼圍剿 詹凌瑀轟：連講真話都要被獵殺？,政治,2026/06/24 08:10,台北市長蔣萬安與研考會主委殷瑋（資料照）國民黨台北市議員秦慧珠向來問政犀利，即便針對國民黨執政的台北市政府，批評起來也毫不留情。日前她批評北市府研考會主委殷瑋在台北市長蔣萬安總質詢時對槓議員一事，引發藍營不滿，還有藍營粉專「政客爽」發起「拒投秦慧珠」活動。對此，媒體人詹凌瑀表示，這種風氣不能助長。「今天放過他們，下次被消音的就輪到你，蔣萬安，你的人在議會撒野，你的側翼在獵殺敢講話的人，你還要裝沒看到多久？」詹凌瑀在臉書PO文表示，「殷瑋是研考會主委，不是市府打手，但他現在做的事，就是市府打手。跑到質詢台上跟議員嗆來嗆去、搶答、大小聲，完全沒有一個官員該有的樣子。台北市議會沒見過這種場面，蔣萬安開了壞例，養鬥犬的是蔣萬安，放鬥犬出來咬人的也是蔣萬安。」請繼續往下閱讀...詹凌瑀指出，「秦慧珠講了真話，說殷瑋這樣只會害到蔣萬安，一句善意提醒，結果被藍營側翼『政客爽』圍剿，還發起拒投，看清楚了沒？他們要的不是討論，是讓不同的聲音閉嘴。連自己陣營講真話的人都不放過，這種黨同伐異的嘴臉，真的很噁心。」詹凌瑀直言，「這種風氣不能助長。今天放過他們，下次被消音的就輪到你，蔣萬安，你的人在議會撒野，你的側翼在獵殺敢講話的人，你還要裝沒看到多久？」    ,https://news.ltn.com.tw/news/politics/breakingnews/5481889
葛如鈞被爆「akaSwap」賣NFT 四叉貓：Discord群組突然關閉,政治,2026/06/24 07:24,民眾黨近日烏龍指控民進黨新北市長參選人蘇巧慧家族未利益迴避，領取政府補助，結果國民黨不分區立委葛如鈞才是威如科技的股東，並被爆出曾在蘇巧慧胞妹蘇巧純任職的「akaSwap」平台上販售NFT。（資料照）民眾黨近日烏龍指控民進黨新北市長參選人蘇巧慧家族未利益迴避，領取政府補助，結果國民黨不分區立委葛如鈞才是威如科技的股東，並被爆出曾在蘇巧慧胞妹蘇巧純任職的「akaSwap」平台上販售NFT，網紅「四叉貓」質疑葛如鈞投資威如卻沒有做財產申報、「故意隱匿」，今晨更指葛如鈞突然將之前賣NFT的Discord群組關閉，引發網友熱議。以黃國昌為首的民眾黨指控，蘇巧慧胞妹蘇巧純涉嫌透過關係企業「威如科技」非法領取政府補助、規避身分揭露，要求蘇巧慧道歉並退出新北市長選舉，怎料卻鬧烏龍爆料，意外打到國民黨立委葛如鈞。葛如鈞昨日證實自己才是威如股東，並稱僅是小額認購價值約10萬元的股份，並決定拋棄所持有該特定公司之一切股份及相關權益。請繼續往下閱讀...四叉貓發文質疑，葛如鈞財產申報的事業投資項目，沒有威如這筆投資（葛如鈞聲稱10萬元），四叉貓為此貼出2025年底的財產申報資料，並指「奇怪內！葛如鈞投資格里科技一萬元都會記得申報了，為什麼投資威如的10萬元沒有申報？請問葛如鈞這樣算不算『故意隱匿』投資財產」。針對葛如鈞也被爆曾在2021年11月11日透過蘇巧純任職的akaSwap，獨家販售個人首張單曲的限量版NFT，四叉貓昨也貼出，葛如鈞幾年前在Discord群組宣傳自己在akaSwap發行NFT的證據。今晨四叉貓更指出，「葛如鈞把他以前割韭菜（Ｘ）賣NFT（Ｏ）的discord房間，突然關掉了呀！還好該截圖該備份的對話紀錄我都存好了」。在發文底下網友也紛紛質疑「凡走過必留下痕跡」、「沒有錯幹嘛關呢」、「看來捅到自己的窩，馬上切割」、「科技立委遺漏一堆數位足跡」、「幹得好，一定要繼續追他這件事情」、「藍跟白比起來精太多了，壞事做到都知道如何危機處理成精了」、「果然是割技立委！」    ,https://news.ltn.com.tw/news/politics/breakingnews/5481850
被民眾黨烏龍爆料搞出「財產申報不實」  他籲葛如鈞「冤有頭債有主」,政治,2026/06/24 07:21,張育萌表示，麻煩葛如鈞趕快籌「財產申報不實」的罰款，冤有頭債有主，請去找民眾黨這兩個想選議員的算帳。（資料照）民眾黨指控民進黨新北市長參選人蘇巧慧胞妹蘇巧純，指她涉嫌透過關係企業「威如科技」非法領取政府補助、規避身分揭露，卻意外掀出國民黨立委葛如鈞擁有股份，葛昨日宣布將放棄股權。台灣青年世代共好協會理事長張育萌對此發文表示，麻煩葛如鈞趕快籌「財產申報不實」的罰款，冤有頭債有主，請去找民眾黨這兩個想選議員的算帳。張育萌表示，民眾黨林子宇和陳怡君，近一個月來瘋狂抹黑蘇巧慧家族，狂打「威如科技」拿了政府將近600萬補助，結果從股東到員工都沒有蘇家人，反而揭露葛如鈞是股東，葛僅低調解釋有「小額認購」大約10萬的股份。請繼續往下閱讀...張育萌指出，沒想到在葛如鈞出面後，林子宇不肯認錯、再度發文批評綠營「拿藍委任職股東與否來混為一談」。張解釋，葛如鈞承認自己是「威如科技」的股東，但他的最新一份財產申報，在「事業投資項目」只有他太太的兩筆投資，並沒有他承認的「威如科技」那10萬元股份，若申報不實可以直接罰120萬，就算最輕也要罰6萬，張育萌說：「誠心建議葛如鈞趕快籌錢。」張育萌提到，事情發展至今，陳怡君和林子宇還嘴硬「堅持不下車」，陳還嗆蘇巧慧「不要模糊焦點」，聲稱「股東根本不是公職人員利益迴避法的規範範圍」。張育萌強調：「你這樣說也沒錯，但害到葛如鈞的，一直都不是威如科技有沒有揭露葛如鈞是股東啊，是葛如鈞自己沒有申報，所以被你們搞到準備要罰錢啊。」張育萌指出，民眾黨的「小雞」沒有市長候選人，每個人都亂掃射，目光所及處處都認為有弊案，為了求生亂打一通的結果就是會誤傷友軍，「尤其你們的友軍，又是人脈金脈都盤根錯節的國民黨，實在是想避開都難」。張育萌也坦言：「畢竟黃國昌都落跑了，對民眾黨來說，為了選上一兩席議員，拉下幾個國民黨立委，好像也滿划算的？那只能說葛如鈞辛苦了，也不知道下個是誰，反正遇到民眾黨，大家準備好輪流倒楣。」    ,https://news.ltn.com.tw/news/politics/breakingnews/5481840
結束訪美返台 侯友宜：三鶯線獲營運許可 榮耀屬於新北市民,政治,2026/06/24 06:16,新北市長侯友宜結束訪問芝加哥行程，今晨搭機返回台灣。（記者朱沛雄攝）新北市長侯友宜結束訪問芝加哥行程，今晨搭機返回台灣，他在桃園機場表示，不論三鶯線通車或淡江大橋，所有的交通建設都不屬於特定個人或機關，最重要的是市民朋友的努力付出，這份榮耀屬於新北市民，至於三鶯線營運時間以及試乘優惠方案，透過充分討論後會再跟市民報告。新北市長侯友宜17日率團赴芝加哥參加自動化技術展，他今天返台表示，此行除協助企業拓展國際市場，並考察職棒球場及河岸觀光建設，於今天清晨搭乘長榮航空班機返抵桃園機機場。他在桃園機場接受媒體聯訪時表示，這次帶著新北市的企業及城市發展走向國際舞台，參加北美自動化技術展，市府特別設立新北館，讓新北企業優質的智慧製造讓國際看得到，在展覽過程中，協助企業跟國際合作、尋找更多商機。請繼續往下閱讀...此外，也特別到芝加哥2個大聯盟球場，了解大聯盟的經營，讓新北市大巨蛋在未來的規劃上能有所學習，另外也走訪芝加哥河岸的觀光休閒產業發展，新北市淡江大橋完工後，可以看到新北市沿著河岸觀光人潮增加，除如何帶動發展以外也要兼具安全，是此次參訪很重要的目的，讓新北能夠走向世界，也讓世界看見新北的國際化。侯友宜提到，剛剛在飛機上得知三鶯線允許經營後非常開心，謝謝新北市民一路的支持，也看見相關工程單位，不斷在細節上接受嚴苛挑戰才能順利完工，達到營運許可；至於營運時間以及試乘優惠方案，所有細節會趕快透過充分討論後做安排，確切的時間點會再跟市民報告。侯友宜表示，不管是三鶯線或淡江大橋，所有的交通建設都不屬於特定個人或機關，最重要的是市民朋友的努力付出，這份榮耀屬於新北市民的，要好好的善用三鶯線以及淡江大橋甚至所有的交通建設，讓新北市被看見。新北市長侯友宜結束訪問芝加哥行程，今晨搭機返回台灣。（記者朱沛雄攝）侯友宜在桃園機場表示，不論三鶯線通車或淡江大橋，所有的交通建設都不屬於特定個人或機關，最重要的是市民朋友的努力付出，這份榮耀屬於新北市民。（記者朱沛雄攝）    ,https://news.ltn.com.tw/news/politics/breakingnews/5481843
