Title,News_Type,date,content,url
前枋寮鄉長陳亞麟貪污案  屏東地院判刑8年,社會,2026/01/28 12:58,枋寮鄉前鄉長陳亞麟涉貪，屏東地院判處8年徒刑（資料照）屏東縣枋寮鄉無黨籍前鄉長陳亞麟2018年擔任鄉長後涉嫌透過私人特助與廠商圍標工程收受回扣，並且利用公務車到高雄看診、購物、飲宴，屏東地方法院判處陳亞麟有期徒刑8年，褫奪公權5年，全案可上訴，這也是枋寮鄉連續4名鄉長都涉及貪污案件，讓地方議論紛紛。現年40歲的陳亞麟當年崛起時標榜為時代力量清流，但以無黨籍當選鄉長，當時以32歲成為全國最年輕的鄉長，但任內就發生弊案涉貪，還被收押，去年4月監察院認為陳亞麟違反公務員服務法等，通過彈劾並移送懲戒法院，本屆鄉長選舉陳亞麟因官司纏身爭取連任失敗，一度加入柯文哲選總統幕僚，目前在台北擔任一家公司執行長，今天被判有罪，記者試圖聯繫，都未接電話。請繼續往下閱讀...陳亞麟涉貪的部分為，辦理枋寮鄉內公共工程採購時，利用私人特助黃男、調解委員會主席何男作為白手套，向投標廠商收取工程回扣及賄賂，勾結兩家圍標業者，洩漏投標廠商名稱及家數，使內定廠商得標。廠商再依決標金額4%至8%不等回扣款項，連同圍標費用，一併透過白手套轉交陳分配報酬，並且借用他人名義及證件參加投標名義承攬工程，廠商承攬小額工程採購案，收取每件小額工程採購案5000元至1萬元不等賄賂。陳亞麟還駕駛公務車往返高雄看診、購物及飲宴等處理私務使用共7次，指示鄉長辦公室機要秘書、鄉長司機填寫不實公里數並簽名，詐得無償使用公務車輛的不法利益，共計犯罪所得150餘萬元。    ,https://news.ltn.com.tw/news/society/breakingnews/5324738
精神科名醫李光輝官司纏身 月初已身故判公訴不受理,社會,2026/01/28 12:53,精神科名醫李光輝本月初已過世，生前多起官司纏身，預期都將獲判公訴不受理。（資料照，記者羅沛德攝）精神科名醫李光輝因與前台灣高等法院庭長、律師王炳梁的親戚有多起訴訟官司糾紛，將矛頭指向王炳梁，數度在法庭當庭詆毀王炳梁捲入翁茂鍾案、利用前法官的權勢影響審判，梁憤而提告，台北地檢署去年依3件誹謗罪起訴李光輝；台北地院法官日前開庭，查明李光輝已於今年1月5日死亡，判決公訴不受理。而李光輝生前涉及多起案件，預期法院也將會判公訴不受理。他被控以「印股票換鈔票」方式吸金，販賣他的生技公司未上市股票，違法吸金逾1億元，一審台北地院依違反證券交易法等罪，將他判刑10年，二審高等法院審理中，預料也將判不受理。請繼續往下閱讀...李光輝另有一件詐欺案於去年12月被判刑1年6月定讞，也將隨著他的死亡而無須入監。他向一名患大腸癌末期的女病患謊稱，可提供「自然殺手細胞」NK療法治療癌症，向她收費150萬元，實際上他只是向大學租借實驗室為她注射生理食鹽水，女病患12天後不治身亡，桃園地院依詐欺取財罪判李光輝2年徒刑，高等法院去年12月改判李1年6月刑，沒收追徵犯罪所得150萬元定讞；如今李去世，入監將不予執行，但可單獨執行沒收。至於本件誹謗王炳梁案，北檢起訴指出，李光輝因與王炳梁的姪子王伯綸有多起訴訟，心生不滿，2023年11月9日、10日、2024年8月15日，3度在高院、桃園地院、智財法院開庭時，當庭誹謗王炳梁於翁茂鍾案的相關判決「造成20幾個法官提前退休」、「利用其他檢察官、法官的把柄，讓我的案子不起訴」，並質疑他的案子被提前換法官也是王的手筆。王提告，北檢依3件誹謗罪嫌起訴李光輝。北院法官日前開庭，查出證實李光輝已於今年1月5日死亡除戶，有戶役政資訊網站查詢全戶戶籍資料為證，依刑事訴訟法的規定，本案不經言詞辯論，直接判決公訴不受理。可上訴。    ,https://news.ltn.com.tw/news/society/breakingnews/5324669
台中2搜救犬JACOB、WONDER榮退 開放領養條件曝,社會,2026/01/28 12:34,台中市消防局在消防節活動中為2隻搜救犬舉行退役儀式。（圖由台中市消防局提供）牠們曾在山林間奔跑、在災區中穿梭，用靈敏的嗅覺為迷途者與受困者找出一線生機，如今，完成階段性任務的台中市消防局2隻搜救犬JACOB（米克斯狼犬）與WONDER（拉不拉多犬），正式光榮退役，準備卸下使命，迎接屬於自己的平靜生活，也期待能遇見願意牽起牠們後半生的溫暖家庭。台中市消防局近日於119消防節系列活動中，為2犬舉辦退役及感謝儀式，局長孫福佑親自頒發退役證書與紀念領巾，感謝牠們多年來付出，消防局表示，JACOB、WONDER分別在民國105年及107年入隊加入搜救行列，皆接受完整且嚴謹專業訓練，並通過德國聯邦救難犬協會（BRH）路徑追蹤犬認證，是具備高度專業能力的人命搜救犬。請繼續往下閱讀...服役期間，牠們多次投入重大協尋與災害應變任務，協助搜救人員快速研判搜尋範圍，其中，JACOB曾支援114年花蓮馬太鞍溪堰塞湖潰決災情救災任務，展現豐富經驗與成熟判斷力；WONDER則以溫馴親人的特質，成為領犬員最信賴夥伴。消防局指出，2隻搜救犬在服役期間生活規律、紀律良好，習慣與人互動，對環境適應力高，退役後僅需適度運動與陪伴，即可融入一般家庭生活，依據消防局搜救犬退（除）役相關辦法，領養資格將依序開放予台中市政府消防局員工（含志工）、台中市政府員工（含志工），若無符合者，將進一步開放全體市民申請認養。JACOB的英姿。（圖由台中市消防局提供）WONDER的英姿。（圖由台中市消防局提供）    ,https://news.ltn.com.tw/news/society/breakingnews/5324714
嘉義年輕男子網路恐嚇公眾GG了 聲押獲准,社會,2026/01/28 12:19,嘉義地檢署偵辦年輕男子網路恐嚇公眾。（資料照）24歲洪姓男子涉嫌在臉書留言將於大眾交通運輸站對不特定民眾發動攻擊，經嘉義地檢署檢察官蕭仕庸指揮嘉義縣警察局刑事警察大隊、法務部調查局嘉義縣調查站偵辦，傳喚洪某到案漏夜訊問後，認為洪姓被告涉及恐嚇公眾罪嫌，犯罪嫌疑重大，有羈押之原因及必要，向嘉義地方法院聲押獲准。嘉檢指出，被告洪男於1月24日在網路上匿名於臉書爆廢公社公開留言，將於大眾交通運輸站對途經不特定民眾發動攻擊。專案小組於昨天持嘉義地方法院核發的搜索票，搜索被告住處，扣得犯罪工具手機，並以檢察官核發的拘票拘提到案。經檢察官漏夜訊問後，認為被告涉及恐嚇公眾罪嫌，有羈押之原因及必要，向嘉義地院聲押獲准。請繼續往下閱讀...嘉義地檢署檢察長蔡宗熙呼籲，司法偵查機關對於恐嚇公眾的模仿行為，必定積極從嚴從速查緝，切勿以身試法，共同維護社會治安，保護人民生命身體財產安全。    ,https://news.ltn.com.tw/news/society/breakingnews/5324644
台中婦撞倒騎士後趕買菜 折返辯「自摔」觸肇逃送辦,社會,2026/01/28 11:51,曾姓女騎士（右）擦撞後噴飛至南屯路口，經路人攙扶起身。（讀者提供）台中南屯文心路與南屯路口，發生曾姓女騎士在綠燈時經過路口，煞車不及撞倒前方林姓騎士事故，肇事機車擦撞後向前噴飛至南屯路口，場面驚險，曾女經路人攙扶起身後，竟在綠燈後直接騎車離去，警方表示，曾女「買菜」後折返頻向騎士道歉，當場依刑法肇逃罪嫌送辦。台中市第四警分局呼籲，道路發生交通事故，騎士均應立即停車報警處理，切勿因慌亂或心存僥倖離去，7日上午8時交通尖峰時間，曾女（66歲）趕買菜騎經文心路口，疑煞車不及擦撞前車林女，兩車雙雙倒地，肇事機車甚至向前噴飛至南屯路口，曾女起身後留下聯繫方式，也未報警，竟直接騎車離去，獨留林女在肇事路口。請繼續往下閱讀...警方持續蒐證並疏導交通，曾女神情緊張騎返事故地點，主動詢問員警「是否在處理交通事故」，並自述稍早於路口「自摔」，因趕赴市場買菜未多作停留便離去。警方比對監視器畫面發現，曾女騎車撞倒林女機車，並非自摔，離場行為構成肇事逃逸，經員警說明肇事逃逸所涉刑責後，曾女當場花容失色、頻頻致歉，坦承因一心要「趕著去菜市場」，誤判撞車不嚴重即離開，全案依刑法第185條之4肇事逃逸罪嫌，移送台中地檢署偵辦。    ,https://news.ltn.com.tw/news/society/breakingnews/5324643
嘉義市道路維修工程傳弊案 工務處科長交保候傳,社會,2026/01/28 11:37,嘉義地檢署指揮偵辦嘉義市道路工程弊案。（資料照）嘉義地檢署昨天指揮法務部調查局南部地區調查組，偵辦嘉義市政府市區道路維修相關工程涉嫌圖利特定廠商案，持法院核發搜索票前往涉嫌人員住居所及辦公室搜索，並傳喚市府工務處葉姓科長等4名人員到案說明。案件於今天凌晨1時許訊問完畢，檢方諭知葉姓科長5萬元交保。據了解，檢方接獲檢舉，指葉姓科長等人於2022年間辦理嘉義市市區道路維修相關工程時，涉嫌以虛假工程案的招標與得標方式，圖利特定廠商。經深入調查後，發現犯罪事證明確，昨由檢察官黃天儀指揮調查局南部組進行搜索與傳喚。請繼續往下閱讀...檢調昨天持搜索票前往葉男、施工廠商工地主任林姓男子等人住居所等6處執行搜索，傳喚葉男、林男、工程驗收邱姓男子等4人到案，並查扣手機等證物及釐清嫌疑人現金流向。嘉檢表示，經調查發現，自2019年起，市區道路維修水溝蓋等工程，林姓男子任職的廠商涉嫌找其他廠商陪標，並事先講好競標金額，最後均由林男的公司得標，涉嫌違反政府採購法。經檢察官覆訊，認為被告等人犯罪嫌疑重大，但無羈押之必要，分別諭知葉姓科長以5萬元交保、邱姓被告交保3萬元、廠商林男交保20萬元，其餘人員請回。    ,https://news.ltn.com.tw/news/society/breakingnews/5324586
攔計程車被拒竟惱羞成怒 兄弟檔當街毆打運將遭逮,社會,2026/01/28 11:36,四十九歲陳姓運將因為已有其他乘客預約而婉拒載客，未料戴姓兄弟竟因此勃然大怒，聯手將陳男拖下車痛毆。（記者鄭景議翻攝）36歲與31歲的戴姓兄弟，昨日晚間在台北市大安區忠孝東路4段攔下1輛計程車，49歲陳姓運將因為已有其他乘客預約而婉拒載客，未料戴姓兄弟竟因此勃然大怒，聯手將陳男拖下車痛毆。大安分局警方獲報後火速趕抵現場，依準現行犯將戴姓兄弟逮捕，訊後依涉嫌傷害及公然侮辱罪嫌移送台北地檢署偵辦。大安分局敦化南路派出所昨日晚間6時許接獲110通報，指稱轄內忠孝東路4段某處發生激烈的街頭暴力衝突，嚴重影響秩序。員警獲報立即派員趕赴現場查處，抵達現場時衝突已經平息，但陳姓運將頭部及頸部有多處明顯紅腫及挫傷，2名動手的戴姓男子則仍滯留在案發現場，警方隨即將相關涉案人員帶返派出所釐清案情。請繼續往下閱讀...警方調查發現，陳姓運將當時駕駛計程車行經該路段，戴姓兄弟突然上前攔車。陳男向2人表示，因為手機軟體已有其他乘客預約叫車，必須前往載客，因此婉拒這趟臨時攔車。沒想到戴姓兄弟聽聞後大感不滿，雙方先是爆發口角爭執，隨後兄弟2人情緒失控，竟強行將陳男拖下車並當街揮拳毆打，導致陳男頭部及頸部受傷。陳姓運將事後前往醫院驗傷，並對2人提出告訴。警方在調閱周邊監視器畫面並查明相關事證後，確認戴姓兄弟動手傷人罪行明確，當場將兩人逮捕。戴姓兄弟在偵訊時對於一時衝動引發衝突坦承不諱，全案詢後由警方依傷害與公然侮辱罪嫌移送法辦。    ,https://news.ltn.com.tw/news/society/breakingnews/5324565
6旬婦誤信投資險遭詐 龍潭警及時攔阻保住242萬元積蓄,社會,2026/01/28 11:18,桃園婦誤信長照投資高報酬警方及時出手保住積蓄242萬元。（圖由警方提供）農曆新年將至，桃園市平鎮區1名65歲邱姓婦人，日前前往龍潭區的郵局欲提領102萬元現金。郵局櫃員察覺婦人帳戶短時間內連續提領鉅款，疑似遭遇詐騙，立即關懷提問並通報警方到場協助，成功阻止婦人遭詐，於農曆年前守住婦人辛苦積蓄，合計阻詐金額達242萬元。龍潭警分局聖亭派出所巡佐傅錫城、警員劉憬霖及王瑋綸，當日執行巡邏勤務時接獲轄區郵局通報，報稱邱媂欲提領102萬元現金，警方隨即趕赴現場了解情況。請繼續往下閱讀...邱婦起初向警方表示，提領款項係用於「娶媳婦」，惟當警方進一步詢問迎娶相關細節時，邱婦卻支吾其詞、說法反覆，明顯依循詐騙集團常見的「教戰守則」回應，警方遂與郵局櫃員聯手耐心勸說。經警方以實際案例分析說明後，邱婦才吐露實情，坦言日前在網路上加入一個投資群組，對方宣稱「長照機構」為熱門投資標的，標榜可獲取高額報酬。邱婦於群組中頻見「投資人」分享獲利成果，禁不住誘惑，遂決定將積蓄分兩次提領進行投資。稍早她已先至另1間郵局提領140萬元，並暫時藏放於機車座墊下，準備連同本次提領的102萬元，共計242萬元全數交付對方。所幸警方及時到場攔阻，才未將現金交出。警方隨即協助清點140萬元現金，確認無誤後陪同邱婦將款項全數回存帳戶。邱婦得知遭詐後在現場頻頻向警方表達感謝，並感激表示，還好有警察提醒，不然這個年真的不好過。龍潭警分局長施宇峰今（28）日呼籲，詐騙手法不斷翻新，尤其是標榜「高獲利、零風險」的投資型詐騙，最容易讓人掉入陷阱，民眾切勿將大筆資金交由不明人士操作。如有任何疑慮，應立即撥打165反詐騙專線，或向警方諮詢查證；並強調，守護民眾安全是警方最重要的任務，警方將於春節前後加強金融機構、銀樓、加油站、彩券行等重點場所巡邏守護，全力確保民眾財產安全，讓大家安心迎接農曆新年。    ,https://news.ltn.com.tw/news/society/breakingnews/5324556
法院引農發條例繼承例外  判准原物分割、產權各自單獨,社會,2026/01/28 10:55,該筆土地位於新北市淡水區，屬山坡地保育區農牧用地，由原告、被告各持有一半；雙方因分割方式無法取得共識，原告遂依法請求法院裁判分割。（資料照）新北市三芝區一塊面積達1.4萬平方公尺（約4340坪）的農牧用地，因兩名共有人對於土地分割與利用方式無法達成共識，由原告江男訴請裁判分割。士林地方法院審理後認定，該土地雖屬耕地，但因雙方取得來源均符合農業發展條例中關於「繼承」例外規定，不受分割後每人所有面積須達0.25公頃限制，判准依江男主張方案進行「原物分割」，由二人各取得單獨所有權。判決指出，坐落於新北市三芝區橫山段之系爭土地，由原告江男與被告李男共有，應有部分各二分之一。江男於1975年間繼承取得，被告則於2017年間因分割繼承取得。江主張，雙方就土地無法達成分割協議，且法令並無禁止分割限制，為使產權單純化，遂依民法第823條規定提起訴訟。請繼續往下閱讀...本案關鍵在於該土地使用類別為農牧用地，屬「農業發展條例」定義的耕地。依該條例第16條原則規定，耕地分割後每人所有面積未達0.25公頃者不得分割。承審法官於判決中詳述，為解決耕地因繼承產生產權過度複雜的問題，「農發條例」第16條第1項第3款定有例外條款；不論繼承法律事實發生於2000年修正前後，凡因繼承而共有的耕地，均得辦理分割為單獨所有。此舉旨在貫徹立法目的，防止耕地因共有狀態導致難以利用，進而提升土地的經濟效用。經法官親自前往三芝山區現勘，系爭土地鄰近橫山國小，附近多野生植被，並有寬度僅供單車通行之道路。法官審酌原告提出之分割方案（分為A、B二部分）已獲被告同意，且分割後兩造取得的面積分別約7174.90及7174.89平方公尺，位置與形狀均利於個別處分及收益。法院認為，該方案無牴觸土地法令，且各部分換算面積均無因過小而難以利用之虞，能發揮最大經濟效益並符合共有人全體利益，遂判決准予分割。分割後，A部分由原告取得單獨所有權，B部分則由被告取得單獨所有權。    ,https://news.ltn.com.tw/news/society/breakingnews/5324491
柴犬也想趁過年掃貨？ 闖內湖賣場逛大街警助返家,社會,2026/01/28 10:49,1隻可愛的柴犬上週末趁著家人不注意時偷偷溜出家門，竟一路晃進台北市內湖區的1處大型賣場，在貨架通道間悠哉徘徊。（記者鄭景議翻攝）1隻可愛的柴犬上週末趁著家人不注意時偷偷溜出家門，竟一路晃進台北市內湖區的1處大型賣場，在貨架通道間悠哉徘徊，引起不少逛街民眾注目。內湖分局港墘派出所員警獲報到場，發現柴犬脖子上的項圈掛有名牌，隨即將牠帶回派出所提供飲水照料，並透過名牌上的電話成功聯繫上焦急的飼主，順利讓這隻「翹家」的柴犬平安返家。內湖分局港墘派出所表示，員警執行巡邏勤務時，接獲轄內大型賣場人員通報，指稱賣場內有1隻走失柴犬。員警抵達現場時，發現這隻柴犬不僅外觀乾淨且一點也不怕生，面對員警靠近還表現得相當溫馴，研判應該是附近的家犬不慎走失。考量賣場內人潮眾多且為了確保犬隻安全，員警隨即化身臨時保母，先將柴犬帶回派出所安置。請繼續往下閱讀...抵達派出所後，員警發現柴犬神情顯得有些疲憊，隨即提供乾淨飲水與休息空間，並細心檢查牠身上的項圈。員警很快就在項圈名牌上發現飼主的聯絡電話，隨即撥打電話告知。當時正為了愛犬失蹤而心急如焚的飼主，接到警方通知後喜出望外，立即趕赴派出所領回。飼主向警方表示，家中的柴犬平時很乖巧，沒想到當天會趁著家人進出大門不注意時，竟然自己「溜」出家門展開冒險，甚至還逛進了大賣場。家屬在確認愛犬平安無事後，對警方的即時協助與悉心照料表達由衷感謝，直言多虧警察幫忙，才能讓愛犬在短時間內重回懷抱。內湖分局提醒，民眾飼養寵物應妥善管理門戶安全，避免寵物自行外出引發交通意外或走失風險。警方建議，飼主應為寵物佩戴留有聯絡方式的項圈或植入晶片，這將能有效提高走失時的尋回機率。民眾如果在街頭發現疑似迷途的寵物，可撥打110報案，由警方第一時間介入處理，共同維護動物安全與社區秩序。內湖分局港墘派出所員警獲報到場，發現柴犬脖子上的項圈掛有名牌，隨即將牠帶回派出所提供飲水照料。（記者鄭景議翻攝）    ,https://news.ltn.com.tw/news/society/breakingnews/5324502
不滿20歲男沒禮讓優先席  7旬翁出拳傷人被法辦,社會,2026/01/28 10:39,台北捷運發生優先席讓座問題起糾紛，警方到場處理。（記者邱俊福翻攝）又見優先席讓座問題起糾紛！1名年近7旬的王姓男子，昨晚搭捷運時因不滿20歲潘男坐在優先席沒有禮讓，出言指責，雙方爆發口角後，王還直接出手攻擊潘，轄區台北市警信義分局五分埔派出所據報派員趕抵，將出手打人的王男帶返派出所，詢後依涉嫌傷害罪，移送台北地檢署偵辦。警方調查，昨天晚上6時許，王男自台北捷運的後山埤捷運站上車，當時有人讓座普通座位給王男，但王男見坐在優先席的潘男，沒有主動禮讓座位，便出言指責「教育失敗」等語。請繼續往下閱讀...潘男聞言，隨後起身上前理論，過程中王男徒手攻擊潘男右下巴及右手手腕，雙方隨後於永春站下車，由站務人員協助報案。轄區警方接獲報案，派員到場了解相關案情後，將涉及傷害的王男帶返偵辦。整起事件，有目擊者將影片PO在網路社群，也引發許多網友熱議，包括「正常來說是沒有義務一定要讓」、「明明旁邊有人讓座了，還得理不饒人⋯⋯還動手」、「沒有必要鬧到這樣」等等。    ,https://news.ltn.com.tw/news/society/breakingnews/5324476
行政執行署桃園分署年前封關拍賣 汽車、金店面、「韓虎嘯」商標在列,社會,2026/01/28 10:32,行政執行署桃園分署2月3日將拍賣中壢區金店面。（桃園分署提供）法務部行政執行署桃園分署將於2月3日舉辦農曆年前最後一場聯合拍賣會，此次拍賣標的眾多，有金店面、自用小貨車、4房打通的大坪數建物及土地等不動產，另有「韓虎嘯」餐飲集團系列商標等物件，歡迎民眾參與投標。桃園分署表示，聯合拍賣會於2月3日上午10點在桃園市桃園區富國路100號熱鬧登場，現場拍賣1部2015年出廠、排氣量2998c.c的白色中華小貨車，本次拍賣為再行拍賣，想在過年前添購車輛的民眾，可把握機會親臨現場參與競標。請繼續往下閱讀...不動產拍賣部分於當日下午2點半起，在桃園分署拍賣室（桃園市桃園區復興路186號13樓）進行，最受矚目的拍賣標的為臺灣桃園地方檢察署囑拍賣的中壢區「亞爵麗緻社區」1樓店面建物，該建物臨近國道交流道，交通便利，此次已為第三次拍賣，價格非常實惠；另有桃園區中正路「21世紀大廈」5樓的4房打通大坪數建物，位置接近觀光夜市，有興趣的民眾可以把握機會；另有位於蘆竹、觀音、龜山、楊梅、新屋區等處的多筆土地於同日進行拍賣。桃園分署表示，不動產拍賣兼採通訊投標，民眾不必出遠門，在家就可以輕鬆的投標，有興趣的民眾可至桃園分署官網「拍賣公告」專區瞭解各個不動產拍賣物件的詳細狀況。拍賣會當日下午3點半起，於桃園分署13樓拍賣室進行「韓虎嘯」餐飲集團系列商標拍賣，該餐飲集團因經營不善，積欠勞健保費等達783萬餘元未繳納，桃園分署依法查封該集團商標共21個進行拍賣，本次為再行拍賣，歡迎各界人士到場投標。行政執行署桃園分署2月3日將拍賣的小貨車。（桃園分署提供）行政執行署桃園分署2月3日將拍賣的餐飲集團商標。（桃園分署提供）    ,https://news.ltn.com.tw/news/society/breakingnews/5324472
朋友「黑吃黑」侵吞詐團340萬 高中情侶無辜揹鍋遭囚禁14小時,社會,2026/01/28 10:21,友人侵吞詐騙集團340萬元，高中小情侶無辜受牽連遭囚禁。示意圖（資料照）黃姓和盧姓（已歿）負責幫詐騙集團收款，他們透過未成年的友人找上一對高中情侶，情侶介紹友人「阿康」幫忙提款，結果「阿康」私吞340萬元，黃、盧不甘損失，叫小情侶出來面對，並將他們擄走後，家人急抱錢救孩子，小情侶遭囚禁14小時後平安獲釋報警，黃姓男子被依恐嚇取財等罪判刑2年。判決指出，2024年4月，盧姓車手頭叫小弟黃姓男子去收一筆詐騙款項，黃男把工作交給未成年的張簡少年，張簡又把工作「外包」給簡姓和王姓高中情侶，王姓少女再叫友人「阿康」幫忙提款，結果「阿康」直接把340萬私吞後人間蒸發，盧男無法向上級交待，只好叫情侶檔出來揹鍋。請繼續往下閱讀...同年4月13日下午5點，王、簡兩人赴約後即被控制行動，黃、盧兩人用小情侶機拍下他們被綁的畫面後，叫他們傳照片給家人求救，簡姓少年的爸媽接到消息，趕緊抱著40萬元去救兒子，簡姓少年被囚4小時後獲釋；但王姓少女的媽媽到場後說自己沒錢賠，黃、盧只好把少女帶互鳳山某摩鐵囚禁，王姓少女的媽媽對他們態度強硬，只好低下聲說自己會去借錢來賠，才讓被囚14小時的女兒獲釋。小情侶無辜受牽連報警，高雄地方法院審理時，黃姓男子坦承犯行，被法官依恐嚇取財等罪判刑2年；至於車手頭盧姓男子因過世免訴，張簡少年也被少家法院裁定交付保護管束。    ,https://news.ltn.com.tw/news/society/breakingnews/5324471
