Title,News_Type,date,content,url
嚇唬人？中東局勢升溫 俄羅斯放話擬提前斷供歐盟天然氣,國際,2026/03/19 09:07,克里姆林宮發言人佩斯科夫18日透露，俄方正深入研究提前對歐「斷氣」事宜。圖為俄羅斯總統普廷。（美聯社）針對歐盟有意逐步禁止進口俄羅斯天然氣，俄羅斯總統普廷先前曾揚言將提前停止對歐供氣。隨著中東局勢不斷升溫，克里姆林宮發言人佩斯科夫18日再度提到，俄方正深入研究提前對歐「斷氣」事宜。據外媒報導，佩斯科夫週三在例行記者會表示，針對普廷（Vladimir Putin）先前表示可能提前停止對歐盟市場供應天然氣，俄方正在深入研究該問題。請繼續往下閱讀...佩斯科夫指出，中東戰事導致能源市場急劇動盪，「這些動盪使得預測市場趨勢變得困難。因此目前正深入分析，考慮當前所有具體情況。」報導提到，普廷於本月初曾表示，鑑於歐盟有意徹底放棄購買俄羅斯油氣產品，俄羅斯可能會提前停止對歐洲市場供應能源。當時他強調這並非最終決定，將指示政府部門進行研究。    ,https://news.ltn.com.tw/news/world/breakingnews/5375206
川普政府評估對伊朗行動下一步 不排除部署地面部隊、佔領哈格島,國際,2026/03/19 08:36,《路透》引述美國官員及三名知情人士說法，指出美軍將為伊朗行動的下一步做準備，川普政府正考慮在中東部署數千名美軍，以強化其軍事行動。圖為載運陸戰隊的兩棲突擊艦「的黎波里號」。（路透）美國2月28日對伊朗發起「史詩怒火行動」（Operation Epic Fury），目前仍持續針對伊朗進行打擊。《路透》引述美國官員及三名知情人士說法，指出美軍將為伊朗行動的下一步做準備，川普政府正考慮在中東部署數千名美軍，以強化其軍事行動。《路透》報導，知情人士指出，川普政府討論過多個選項，包括確保油輪能安全通過荷姆茲海峽（Strait of Hormuz），部分人士認為，這項任務主要靠海軍與空軍力量來完成，不過有美國官員指出，要確保荷姆茲海峽的安全，代表可能會在伊朗海岸部署美軍地面部隊。請繼續往下閱讀...知情人士提到，川普政府也曾討論派遣部隊前往伊朗南部波斯灣外海的石油樞紐「哈格島」（Kharg Island），雖然美國已於3月13日對該島的軍事目標發動空襲，但軍事專家認為，有鑑於哈格島對於伊朗經濟的重要性，與其摧毀不如直接控制該島。針對此選項，有官員認為，在哈格島上部署美軍的風險極高，因為伊朗可以用飛彈或無人機攻擊該島。報導指出，動用任何美軍地面部隊都可能為川普帶來極大的政治風險，尤其是美國民眾對這場戰爭的支持度偏低，川普也在競選期間承諾避免讓美國捲入新的中東衝突。另一名知情人士提到，川普政府官員也討論過部署美軍以確保伊朗高濃縮鈾儲備安全的可能性，但即使對美軍特種部隊而言，確保伊朗核材料儲備安全也是一項高度複雜且風險極高的任務。一名白宮官員表示：「目前尚未決定派遣地面部隊，但川普總統保留所有選項。總統的重點是達成『史詩怒火行動』的所有既定目標，包括摧毀伊朗的彈道飛彈能力、殲滅其海軍、確保其恐怖代理勢力無法破壞區域穩定，並保證伊朗永遠無法擁有核武。」    ,https://news.ltn.com.tw/news/world/breakingnews/5375189
挪威王室風暴未歇！王儲繼子涉性侵 檢認39罪成立求重判7年7月,國際,2026/03/19 08:27,挪威王儲的繼子柏格荷伊（見圖）被控性侵等40項罪名，檢方認為其中39項應被判有罪，並求處7年7月徒刑。（法新社）挪威王儲的繼子柏格荷伊比（Marius Borg Hoiby）被控性侵等40項罪名，檢方週三指出，其中39項應被判有罪，包括4起性侵與傷害，並求處7年7月徒刑。29歲的柏格荷伊比（Marius Borg Hoiby）是挪威王儲妃梅特瑪莉（Mette-Marit）與前伴侶所生，為王儲哈康（Haakon）的繼子，柏格荷伊比無王室頭銜，也無正式職責。請繼續往下閱讀...《衛報》報導，柏格荷伊比正因性侵等40項罪名受審，在超過6週審理的倒數第二天，檢方18日表示，他們認為荷伊比在被起訴的40項罪名中，有39項有罪。這些罪名除性侵與家庭暴力外，還包括多次違反限制令、傷害、毒品及駕駛相關罪行。40項罪名中，有一項違反限制令罪名已被撤銷。柏格荷伊比先前已承認數項相對較輕的罪行，但否認被指控的性侵罪。檢方對柏格荷伊比求處7年7個月徒刑，也要求禁止他在2年內接觸其中一名據稱的受害者，並要求沒收數項裝置，包括3支iPhone與1台MacBook，同時吊銷其駕照，並禁止駕駛2年。檢方強調，不應因本案受到廣泛媒體關注，就給予柏格荷伊比「量刑折扣」。「在媒體聚光燈已經投向這樣一名知名人士之後，仍然犯下刑事罪行，這正說明他不應獲得減刑。」柏格荷伊比的母親梅特瑪莉也正面臨壓力，外界要求她說明自己與已故性犯罪者艾普斯坦（Jeffrey Epstein）之間的關聯。王室本週表示，患有肺纖維化的梅特瑪莉因健康惡化，將不會參加即將到來的國是訪問。    ,https://news.ltn.com.tw/news/world/breakingnews/5375175
川普延後訪中 白宮：中方已同意改期,國際,2026/03/19 07:33,白宮新聞秘書李威特18日表示，中國方面已同意延後「川習會」。（路透）由於中東戰事尚未平息，美國總統川普日前宣布延後訪中行程。白宮新聞秘書李威特（Karoline Leavitt）18日表示，中國方面已同意延後「川習會」。綜合外媒報導，川普原定於3月31日至4月2日訪問中國，此次行程將會是他上任14個月以來的首度訪問中國。先前川普曾表示，此次訪問將推遲到「大約五到六週後」進行，白宮方面則並未透露具體日期。請繼續往下閱讀...李威特18日指出，中方已同意延後川普原訂兩週後的訪問行程，白宮方面則在盡快協調新的訪問日期。中國駐華盛頓大使館針對此事回應時表示：「國家元首外交在為雙邊關係提供戰略指導方面有著不可取代的作用。中美雙方將繼續針對川普總統訪中事宜保持溝通。」    ,https://news.ltn.com.tw/news/world/breakingnews/5375171
伊朗飛彈攻擊卡達 全球最大天然氣樞紐遭殃 沙烏地、阿聯也遭襲,國際,2026/03/19 07:24,圖為位於拉斯拉凡工業市的液化天然氣生產設施，示意圖。（路透）中東地區衝突不斷升溫，戰火更擴大到油氣生產設施，在伊朗的天然氣田相關設施遭襲，並揚言對其他國家報復攻擊後，包含卡達、沙烏地阿拉伯、阿拉伯聯合大公國均遭到攻擊。其中在卡達境內的全球最大天然氣樞紐在遭伊朗攻擊後造成重大損害，卡達也為此要求伊朗駐卡達大使館的人員於24小時內離開。位於伊朗南部的大型天然氣田相關設施，週三遭到美以聯軍襲擊並引發火災。這也是戰爭爆發以來，伊朗油氣生產設施首度遇襲，受此影響國際油價應聲大漲。伊朗隨後也向沙烏地阿拉伯、阿拉伯聯合大公國及卡達發出警告，揚言鎖定波斯灣各地能源基礎設施。請繼續往下閱讀...卡達能源公司（QatarEnergy）發表聲明指出，拉斯拉凡工業市（Ras Laffan Industrial City）於週三晚間遭到飛彈攻擊。卡達為全球第二大液化天然氣（LNG）出口國。在伊朗發出威脅後，拉斯拉凡工業市已發布疏散令。除了卡達，沙烏地阿拉伯、阿拉伯聯合大公國也都遭到攻擊。其中沙烏地阿拉伯於週三表示，該國已攔截並摧毀4枚射向首都利雅德（Riyadh）的彈道飛彈，並挫敗一起針對該國東部天然氣設施的無人機襲擊企圖。沙國表示，飛彈碎片散落在首都各處，不過初步評估顯示沒有人員傷亡或財產損失。阿拉伯聯合大公國於週四上午也表示，哈布山（Habshan）天然氣設施和巴布油田也都遭到攻擊。當局提到，由於成功攔截一枚飛彈後發生兩起碎片墜落事件，哈布山天然氣設施目前暫停運作。拉斯拉凡工業市位於卡達首都杜哈（Doha）東北方約80公里，是能源產業中心，也是多家國際公司的所在地。該處有全球最大LNG生產設施，占全球LNG供應量的20%，在平衡亞洲與歐洲市場燃料需求方面扮演重要角色。卡達能源公司指出：「緊急應變團隊已立刻投入滅火工作，火勢造成重大損害。所有人員均已清點完畢，目前尚未傳出任何傷亡。」卡達外交部也發布聲明強烈譴責伊朗發動的「野蠻」攻擊，這次襲擊是危險的升級，是對卡達主權的公然侵犯，也是對卡達國家安全的直接威脅。卡達外交部也要求伊朗駐卡達大使館的軍事及安全人員，還有工作人員在24小時內離開該國，並宣布他們為「不受歡迎的人」。圖為位於伊朗南部布什爾省（Bushehr）阿薩盧耶市（Asaluyeh）的「南帕爾斯」（South Pars）大型天然氣田相關設施，示意圖。（法新社）    ,https://news.ltn.com.tw/news/world/breakingnews/5375155
伊朗被「史詩怒火」大幅削弱  美情報首長：政權仍保持完整,國際,2026/03/19 07:14,美國國家情報首長加巴德出席參議院情報委員會聽證會，她在發表開幕致詞時提到，伊朗很大程度上已經被「史詩怒火行動」削弱，但伊朗政權似乎依舊完好。（法新社）美國持續攻擊伊朗，美國國家情報首長加巴德（Tulsi Gabbard）18日出席參議院情報委員會舉行的年度聽證會，她在發表開幕致詞時提到，伊朗很大程度上已經被「史詩怒火行動」（Operation Epic Fury）削弱，但伊朗政權似乎依舊完好。綜合外媒報導，這場聽證會將中國、俄羅斯、北韓與伊朗列為美國的主要對手，但討論重點仍集中在對伊朗戰爭。多名國會議員表示希望能得知有關這場戰爭的更多相關資訊，加巴德引述情報評估報告內容，並指出目前伊朗已被大幅削弱，常規軍事力量與投射能力已基本被摧毀，伊朗的戰略地位也已經明顯降低，目前伊朗政權仍保持完整，但情報評估認為，隨著伊朗經濟狀況惡化，內部緊張局勢可能會加劇。請繼續往下閱讀...加巴德後續也點出隱憂，強調伊朗及其代理勢力仍具備攻擊美國及中東盟友利益的能力，並且持續發動攻擊，如果伊朗這個敵對政權得以存續，它將力求展開長達數年的重建計畫，以恢復其飛彈與無人機（UAV）戰力。    ,https://news.ltn.com.tw/news/world/breakingnews/5375157
高市早苗會川普！矢板明夫揭「日本3大目標」 台灣有機會也有壓力,國際,2026/03/19 06:59,高市早苗將與川普會晤。（路透檔案照）首次上稿 03-19 00:22更新時間 03-19 06:59日本首相高市早苗18日晚間啟程訪美，預計20日前後與美國總統川普舉行會談，引發各界關注。印太戰略智庫執行長矢板明夫表示，高市此行有「3個戰略目標」，分別是提升日本國際地位、進入對中戰略核心、將台海問題明確納入日美同盟，「對台灣而言，這既是機會，也是壓力」。請繼續往下閱讀...矢板明夫18日深夜在臉書發文，提到高市早苗赴美前表示，將會與川普討論中東局勢、能源安全和自由開放印太地區、安全與經濟合作等議題，「高市此行的本質，是重新定位日本的角色。第一個變化，來自日本國內。自民黨大勝後，已掌握國會主導權，與去年10月高市見川普時還在少數執政完全不同。當時高市的政策受制於國會，如今則具備完整執行力。對美國而言，她已從『有主張的政治人物』，變成『能落實戰略的領導人』，自然會對日本更加重視。」「第二，是國際時機。川普訪中行程已延後一個月，顯示美方眼前並不急於處理對中關係。在此情況下，日美合作反而更少顧忌。供應鏈、安全合作、技術聯盟等議題，可以更直接推進。高市此時訪美，是順勢擴大合作，而非被動配合。第三，是安全布局的落實。日本正加速軍備轉型，防衛預算、反擊能力與飛彈防禦體系都在快速推進。因此，此行重點不在表態，而在分工：日本在第一島鏈的角色如何強化？在台海與東海局勢中能提供什麼支援？在情報、後勤與防空體系中承擔多少責任？這些問題已進入具體階段。」最後矢板明夫指出，「在此基礎上，高市此行的三個戰略目標也更加清晰。一是提升日本國際地位；二是進入美國對中戰略核心；三是讓台海問題更明確納入日美共同戰略。對台灣而言，這既是機會，也是壓力。當日本已將台海安全視為自身利益，台灣也必須展現相應的防衛決心，否則將難以在新的戰略格局中取得主動。」    ,https://news.ltn.com.tw/news/world/breakingnews/5375112
伊朗高官接連被擊斃！穆吉塔巴不見人影 書面怒嗆「血債血償」,國際,2026/03/19 06:44,伊朗最高領袖穆吉塔巴。（歐新社）繼伊朗國安首長拉里賈尼（Ali Larijani）遭以色列擊斃，以軍18日證實，發動夜襲殲滅伊朗情報部長哈蒂柏（Esmail Khatib）。伊朗新任最高領袖穆吉塔巴（Mojtaba Khamenei）則在18日發表書面聲明弔唁拉里賈尼，並怒嗆「血債血償」揚言報復。綜合外媒報導，根據伊朗最高國家安全委員會發布的聲明，拉里賈尼與其子莫特札・拉里賈尼（Morteza Larijani）、辦公室主任巴亞特（Alireza Bayat）及數名隨行警衛一同在16日的空襲中喪命。請繼續往下閱讀...拉里賈尼被視為伊朗最具權勢的人物之一，是已故最高領袖哈米尼（Ayatollah Ali Khamenei）及其子、繼任者穆吉塔巴（Mojtaba）的親信。穆吉塔巴在聲明中對拉里賈尼被擊斃事件表示深切哀悼，並將拉里賈尼描述為博學多才、目光遠大、聰明睿智、盡職盡責，並在政治、軍事、安全、文化和管理領域擁有豐富經驗的人物。穆吉塔巴在聲明中強調，那些敵視伊斯蘭的人應該明白，在「伊斯蘭制度這棵參天大樹」腳下流血並不會削弱它，反而會使其更加強大。他還警告「每一滴血都有它的代價」，犯罪者很快就會為他們的行為付出代價。    ,https://news.ltn.com.tw/news/world/breakingnews/5375162
彭博：美情報機構對兩岸情勢評估大轉向 推翻戴維森窗口假設,國際,2026/03/19 06:07,美國情報機構的最新評估，撤回此前關於中國最快希望在2027年準備好武力犯台的預測，推翻「戴維森窗口」設定。（法新社檔案照）美國情報機構的最新評估，撤回此前關於中國最快希望在明年準備好武力犯台的預測，推翻了「戴維森窗口」（Davidson Window）設定，反映出川普政府為了對北京採取更具和解意味的基調，所做的更廣泛努力。彭博報導，18日發佈的這份年度威脅評估報告認為，北京沒有設定時間表，而且更傾向「如果可能的話，在不使用武力的情況下」與台灣達成「統一」。請繼續往下閱讀...報告指出：「中國領導人目前並無計畫在2027年執行入侵台灣的行動，也沒有實現統一的固定時間表。」此前的評估曾指出，台灣是美中之間「重大的潛在衝突引爆點」，而且北京將持續施加軍事與經濟壓力，以「將力量投射至台灣」。但今年的報告聲稱，「中國官員體認到，對台灣發動兩棲入侵將極具挑戰性，且伴隨極高的失敗風險，特別是在美國介入的情況下。」中國希望「在不發生衝突的情況下，為最終與台灣統一創造條件」，而且傾向於不使用武力。報導指出，這份評估凸顯美國對中國意圖的評估缺乏明確性，以及自2021年以來美國的預測發生極大轉變。當時領導印太司令部的海軍上將戴維森（Phil Davidson）曾暗示，中國希望在2027年前準備好入侵台灣。戴維森當時表示：「台灣顯然是他們在此之前的野心之一，我認為這種威脅在這10年間，事實上在未來6年內，將會顯現。」這些後來被稱為「戴維森窗口」的言論引發混淆。部分評論家認為，戴維森相信入侵台灣會在那個日期到來；官員則堅稱，這只是意味著中國希望在那之前為攻擊做好準備。五角大廈去年12月發布的一份報告，也呼應這個時間表，指稱中國正朝著其2027年目標取得穩定進展，包括北京「期望能夠在2027年底前打贏一場針對台灣的戰爭」。這份2026年報告所反映的觀點轉變，與川普總統團隊為了軟化對中國與中國國家主席習近平立場的廣泛努力相吻合。川普由於伊朗戰爭延後原訂與習近平的峰會，但他聲稱自己「與中國關係良好」，並「期待」見到這位中國領導人。這份最新的情報評估還散佈著其他美國立場軟化的跡象，包括刪除2025年報告指稱「中國是全球最能威脅美國利益的行為者」的用語。報告也刪除了指稱中國正部署脅迫措施，「以推進與台灣統一、將力量投射至東亞，並扭轉其所認定的美國霸權」用語。    ,https://news.ltn.com.tw/news/world/breakingnews/5375136
美情報界研判：中國目前無計畫在2027年犯台 沒有統一時間表,國際,2026/03/19 06:07,美國情報機構指出，中國目前並無計畫在2027年入侵台灣，而是尋求在不使用武力的情況下控制這個島嶼。（美聯社檔案照）就在美國總統川普延後訪問中國之際，美國情報機構18日指出，中國目前並無計畫在2027年入侵台灣，而是尋求在不使用武力的情況下控制這個島嶼。路透報導，情報機構在年度全球威脅報告中的這項評估，正值北京透過頻繁軍演加強對台施壓，但川普已淡化中國在他任期內採取軍事行動的可能性。五角大廈去年底表示，美軍評估中國正準備在2027年，即中國人民解放軍建軍百年時，具備在攻台戰役中取勝的能力，而且正在完善必要時動武奪取台灣的選項。請繼續往下閱讀...美國情報機構在報告中指出，儘管中國威脅必要時將動用武力達成兩岸「統一」，藉此反制其認為美國企圖利用台灣來破壞中國崛起，但如果可能的話，中國仍偏好在不使用武力的情況下實現「統一」。報告認為，美國「評估中國領導人目前並無計畫在2027年執行入侵台灣的行動，也沒有實現統一的固定時間表」。報告重申此前的觀點，即解放軍在可用於奪取台灣的能力上，正取得「穩定但不均衡」的進展。中國駐華府大使館並未立即回應置評請求。台灣駐美代表處也未立即回應。屢次宣稱自己與中國國家主席習近平「關係極佳」的川普，已淡化中國在台灣周邊軍演的威脅，並表示習近平曾告訴他，在他任內不會攻擊台灣，但北京從未證實此事。儘管美國國內外對川普是否支持台灣有所疑慮，其政府仍在去年12月公布破紀錄的110億美元對台軍售案，北京對此大為不滿，要求美方必須停止這類軍售。    ,https://news.ltn.com.tw/news/world/breakingnews/5375132
伊朗最大天然氣田遭襲起火 布蘭特原油期貨飆破109美元,國際,2026/03/19 06:04,卡達能源公司的液化天然氣（LNG）生產設施。（路透檔案照）首次上稿 03-18 23:21更新時間 03-19 06:04中東衝突持續升級，伊朗半官方媒體「塔斯尼姆通訊社」及國營電視台18日報導，位於伊朗南部布什爾省（Bushehr）阿薩盧耶市（Asaluyeh）的「南帕爾斯」（South Pars）大型天然氣田相關設施，週三遭到美以聯軍襲擊並引發火災。這是戰爭爆發以來，伊朗油氣生產設施首度遇襲，國際油價應聲大漲。請繼續往下閱讀...彭博報導，根據洲際交易所（ICE Futures Europe）數據，布蘭特原油期貨一度大漲6.1%，觸及每桶109.75美元的高點；歐洲天然氣基準價格更飆升高達9.1%。南帕爾斯氣田與卡達稱之為「北方穹頂」（North Dome）的氣田相連，構成全球最大的天然氣儲藏區，估計蘊藏量達1800兆立方英尺，足以供應全球需求達13年之久。該氣田供應伊朗國內約70%的天然氣需求，也是伊朗與卡達共有的戰略資源。分析師警告，此次襲擊可能引發伊朗對波斯灣國家能源設施的報復，特別是卡達境內由艾克森美孚（ExxonMobil）和康菲石油（ConocoPhillips）等美國能源巨頭參與合資的液化天然氣（LNG）設施。目前該設施具體受損程度尚不明朗。當地官員稱消防團隊已緊急趕赴現場控制火勢。伊朗伊斯蘭革命衛隊隨後向沙烏地阿拉伯、阿拉伯聯合大公國及卡達發出警告，並公布一份位於這三國的資產清單，稱這些設施在南帕爾斯遇襲後，已成為「直接且合法的打擊目標」，要求這些國家的多個石油設施人員進行撤離。此舉被視為潛在報復行動的前奏。目前，卡達因戰爭影響已完全關閉其液化天然氣（LNG）生產，導致全球約20%的LNG供應中斷。若南帕爾斯或卡達設施進一步受損，停產狀態恐將延長至5月以後，對全球能源市場造成更深遠衝擊。據路透報導，伊朗是石油輸出國家組織（OPEC）中第三大生產國，其石油產量約佔全球供應量的4.5%。然而，長期受西方制裁及技術限制影響，伊朗從南帕爾斯生產的天然氣絕大部分（94%）僅供國內使用。以色列在去年6月的「12日戰爭」中，也曾襲擊南帕爾斯的4座設施。    ,https://news.ltn.com.tw/news/world/breakingnews/5375104
中英對照讀新聞》Semiconductor giant SK hynix now makes chips you can eat 半導體大廠SK海力士推出可食用的「晶片」,國際,2026/03/19 05:30,"南韓SK海力士生產的可食用「晶片」。（法新社檔案照）◎孫宇青South Korea’s semiconductor giant SK hynix has made a foray into a new genre of chips － the kind that’s crunchy and goes with a beer.南韓半導體大廠SK海力士進軍一種新型態的「晶片」領域，不僅酥脆可口，還可以配著啤酒。請繼續往下閱讀...Packing 385 calories a bag, the company’s new ""HBM chips"" snack is a nod to its top-selling high-bandwidth memory semiconductors, in great demand to power AI systems.這款名為「HBM洋芋片」的零食，每包熱量385大卡，其名稱源自於該公司暢銷的高頻寬記憶體半導體產品，該產品因其在人工智慧系統領域的強大應用而備受青睞。But in this case, the acronym stands for Honey Banana Mat.不過，這裡的「HBM」是「Honey Banana Mat」（蜂蜜香蕉風味）的縮寫。The ""semiconductor-shaped"" chips are an ""initiative to bring semiconductors closer to everyday life and make the public feel more familiar with them,"" an SK hynix official told AFP.SK海力士一名員工告訴《法新社》，這種「半導體形狀」的洋芋片，「旨在拉近半導體與日常生活的距離，讓公眾更加了解半導體」。The supplier to US giant Nvidia made the world’s first HBM semiconductors in 2013, and remains one of the biggest manufacturer of the product.這家美國科技巨擘輝達的供應商，於2013年生產全球首款HBM高頻寬記憶體，至今仍是該產品的主要製造商之一。新聞辭典chip：名詞，洋芋片；晶片。本文以chip一詞的不同含義，營造詼諧文意。foray：動詞或名詞，初次嘗試；進行突襲。例句：The famous singer made a foray into musicals and earned extensive applause.（這位著名歌手涉足音樂劇領域，並贏得廣泛讚譽。）    ",https://news.ltn.com.tw/news/world/paper/1747437
福特號起火 全艦仍維持作戰能力,國際,2026/03/19 05:30,正參與對伊朗作戰的美國航空母艦「福特號」（USS Gerald R. Ford），由於艦上發生火災，導致近200名水兵因吸入濃煙接受治療，將從目前所在的紅海，駛往希臘克里特島的索達灣。（法新社檔案照）正參與對伊朗作戰的美國航空母艦「福特號」（USS Gerald R. Ford），由於艦上發生火災，導致近200名水兵因吸入濃煙接受治療，將從目前所在的紅海，駛往希臘克里特島的索達灣。匿名美國官員表示，目前仍不清楚福特號將在克里特島停留多久，但該艦整體仍維持全面作戰能力，飛彈巡洋艦「諾曼第號」、驅逐艦「哈德納號」等打擊群船艦將繼續在紅海運作。（法新社檔案照）    ,https://news.ltn.com.tw/news/world/paper/1747399
