Title,News_Type,date,content,url
鄭麗文當選國民黨主席 李昆穎：若沒被中共操控 請以行動支持國安修法,政治,2025/10/21 18:45,民進黨籍黨員、前綠委李文忠之子李昆穎籲國民黨主席鄭麗文支持國安修法、拒絕中國介選。（擷取自「李昆穎 穎向板橋」臉書）鄭麗文贏得國民黨主席選舉，被視為中共介入台灣政黨選舉首例，民進黨籍黨員、前綠委李文忠之子李昆穎爭取提名明年參選新北市板橋區議員，他日前指出，為什麼共產黨支持鄭麗文？如果鄭麗文真的沒被共產黨操控，那就請她以行動證明支持國安修法、拒絕中國介選。鄭麗文昨接受專訪表示，有意與中國國家主席習近平會面，並稱「九二共識」是兩岸通關密語。請繼續往下閱讀...李昆穎於個人臉書粉專PO文提到，攤開國民黨所有候選人的政見，不是要跟中共和談、就是要安排跟習近平會面，爭先恐後地在中國面前求表現。如果一個泱泱百年大黨只能等著中共「翻牌子」、「爭寵」、患得患失地擔心「天子無情」，中共介選不僅構成國民黨喪失黨格的烙印，更是國民黨化為中共台灣黨支部、中共直接控制台灣社會的前奏。李昆穎說，過去一週，他在板橋掛上看板，也街頭宣講，大聲呼籲國民黨支持國安修法、守護台灣民主，但鄭麗文仍當選國民黨主席。他強調，這不只是國民黨的內部選舉，而是台灣民主體制被滲透的警訊，國安修法是台灣的防線，不分藍綠。李昆穎認為，國民黨主席選舉不只是國民黨的家務事，身為國會最大黨、無數基層組織與地方黨公職，國民黨深入台灣社會的程度，正是中共執行養、套、殺劇本的理想對象，也是台灣民主的最大隱憂。李昆穎說，若國民黨投鼠忌器，身為民進黨青年世代，他很樂意向中共欽點人選正式提問：「鄭麗文，為什麼共產黨要支持你？」那天趙少康開記者會抗議中共介選，背後的質問應該是「為什麼選他？不是選我（們）！」熱門賽事、球星動態不漏接    ,https://news.ltn.com.tw/news/politics/breakingnews/5219065
新里程碑！考選部國家考試測驗研究中心今啟用,政治,2025/10/21 18:38,新里程碑！考選部今日啟用國家考試測驗研究中心。（圖由考選部提供）國考專業研發進入新里程碑，考選部今（21）日揭牌啟用測驗研究中心，將強化國家考試測驗技術研究與精進試題品質。考選部長劉孟奇表示，測驗研究中心將在現有基礎上持續精進，建立「研究—應用—改進」的循環機制，未來將在考量國內專業人才供給情境下，逐步試行與精進，讓考試更加貼近工作所需之基礎職能，同時亦將推動「教考用一體化」理念，積極與用人機關協作，使命題方向更切合機關核心職能與實際業務需求。請繼續往下閱讀...考選部於今年8月1日成立「考選部測驗研究中心」，並於今日正式舉行啟用揭牌典禮，典禮由劉孟奇主持，考試院院長周弘憲、副院長許舒翔及考試委員邱文彥、王秀紅、呂秋慧、黃東益及伊萬．納威出席，共同見證國家考選制度邁向專業研究與創新發展的新里程碑。周弘憲表示，建立專責測驗研究機構，有助於提升測驗品質進而增加選才效能，測驗研究中心的成立，是考試院長期推動考選制度改革的具體成果，象徵我國考試制度朝向「科學化、專業化」邁進，將為國家人力資源政策奠定更堅實基礎。許舒翔則指出，未來無論在公務人員考試或專技人員考試體系中，測驗研究中心都將扮演核心的專業支援角色，提供研究依據與政策建議，成為國家考試持續創新的智庫核心。劉孟奇說明，考選部啟用測驗研究中心，代表國家考試測驗研究正式邁入制度化與長期化的新階段，將為提升國家考試品質、精進選才機制及強化公共服務基礎注入新動能。熱門賽事、球星動態不漏接    ,https://news.ltn.com.tw/news/politics/breakingnews/5219069
決戰2026！民進黨明提名首波縣市長 賴清德為4戰將親授背帶,政治,2025/10/21 18:16,兼任民進黨主席的總統賴清德日前到台中，與即將代表民進黨參選台中市長的立委何欣純同台。（資料照）迎戰2026年縣市長選舉，民進黨明天中執會後將召開第一波提名記者會，由兼任黨主席的總統賴清德，親自為即將投入選戰的4名選將繫上競選背帶，展現團結氣勢，包含台東縣長候選人陳瑩、宜蘭縣長候選人林國漳、嘉義市長候選人王美惠、台中市長何欣純。根據規劃，明天記者會在賴清德與4名選將接連致詞後，賴將親自為候選人繫競選背帶，並大合照、呼口號，最後接受媒體提問。請繼續往下閱讀...據悉，民進黨選對會已有共識，2026縣市長提名將分4梯次公布，從現在開始推算，預計一個月提名一梯次，第一梯次就是明天率先提名的台東縣陳瑩、宜蘭縣林國漳、嘉義市王美惠、台中市何欣純。六都之中執政兩任屆滿的高雄市、台南市，因黨內多人有意角逐，預計透過初選民調產生候選人，提名時程將延至明年1月底，與其他縣市的最後一波提名同步完成。熱門賽事、球星動態不漏接    ,https://news.ltn.com.tw/news/politics/breakingnews/5219055
PO與高市早苗合照 吳釗燮日文道賀：台日就像一家人一樣！,政治,2025/10/21 18:05,"吳釗燮分享與高市早苗的合影（圖翻攝自吳釗燮X平台）自民黨總裁高市早苗今天（21日）獲得國會指名成為日本首位女首相，我國前外交部長、現任國安會秘書長吳釗燮特別在X平台以日文恭賀高市，表示台灣會持續和日本密切合作，共同推動自由開放的印太願景。日本臨時國會今天開議進行首相指名投票，高市早苗獲得多數支持，成為日本第104任首相。隨後，吳釗燮透過X平台分享自己過去與高市的合影，並以日文表示：「恭喜高市早苗眾議員當選日本首相！台灣會持續跟日本密切合作，共同推動自由開放的印太願景。台日之間共享民主、人權的普世價值，也有著促進彼此繁榮發展的共同利益，雙方情誼深厚，就像一家人一樣」。請繼續往下閱讀...高市的政治生涯深受前首相安倍晉三提拔與影響。2006年安倍首次執政時，她首次入閣，擔任內閣府特命擔當大臣；2014年，安倍再度執政時任命她為日本首位女性總務大臣。高市與安倍派「清和政策研究會」關係密切，為黨內保守派代表人物之一。她主張修改憲法第9條、提升自衛隊角色、擴大科技與產業振興政策，理念上延續安倍晉三「積極和平主義」與「自由開放印太」戰略，被外界視為「安倍路線繼承者」。在外交與安全政策上，高市將日美同盟視為日本外交與安全的基石，她強調在中國、北韓與俄羅斯軍事活動日益頻繁的情勢下，日美必須加強合作，共同應對挑戰，提升嚇阻力與反應力。另外，高市對中國立場強硬，長期關注台海局勢，主張「台灣有事就是日本有事」；她還說，雖然日本與台灣無正式邦交，但在經濟、科技與人道領域的實務合作「應該更加深化」。高市早苗衆議院議員 @takaichi_sanae、首相当選おめでとうございます。台湾は日本と緊密に連携し、自由で開かれたインド太平洋のビジョンの実現に取り組んで参ります。台日は民主主義と人権の価値を共有し、繁栄と発展において共通の利益を持ち、家族のような絆で結ばれています。#台日友好????????❤️???????? pic.twitter.com/y2JpNUSKqH— Joseph Wu （@josephwutw） October 21, 2025 高市早苗衆議院議員 @takaichi_sanae、首相当選おめでとうございます。台湾は日本と緊密に連携し、自由で開かれたインド太平洋のビジョンの実現に取り組んで参ります。台日は民主主義と人権の価値を共有し、繁栄と発展において共通の利益を持ち、家族のような絆で結ばれています。#台日友好????????❤️???????? pic.twitter.com/y2JpNUSKqH熱門賽事、球星動態不漏接    ",https://news.ltn.com.tw/news/politics/breakingnews/5219015
台日首位女領袖同框！ 蔡英文送高市早苗「珍視金句」,政治,2025/10/21 17:56,自民黨總裁高市早苗成為日本首位女首相，台灣第一位女總統蔡英文也發布合照祝福。（圖擷取自蔡英文臉書）日本臨時國會今開議投票，自民黨總裁高市早苗獲得國會指名成為日本首位女首相；台灣第一位女總統、前總統蔡英文也發布與早苗的二人合照，並送上自己珍視的一段話，衷心祝福早苗一切順利。蔡英文表示，恭喜高市早苗當選日本憲政史上第一位女性的首相。未來的道路將更加艱難，但她想與高市首相分享自己所珍視的一段話：「若有不一致，我們願帶來和諧；若有錯誤，我們願帶來真理；若有疑慮，我們願帶來信任；若有絕望，我們願帶來希望。」請繼續往下閱讀...蔡英文表示，衷心祝福高市一切順利，並展現卓越的領導與風采。熱門賽事、球星動態不漏接    ,https://news.ltn.com.tw/news/politics/breakingnews/5219027
澳洲跨黨派國會議員訪台 林佳龍：台灣願建構非紅供應鏈捍衛民主,政治,2025/10/21 17:46,外交部長林佳龍（中）與澳洲國會議員團眾議員喬傑納斯（左四）、眾議員契斯特（右四）及參議員寇貝克（左二）合影。（外交部提供）外交部長林佳龍今（21）日午宴歡迎澳洲跨黨派國會議員團。林佳龍表示，台灣願與澳洲及理念相近國家共同面對威權擴張的挑戰，建構「非紅供應鏈」，攜手捍衛民主價值與印太地區的和平繁榮。外交部說明，訪團成員由澳洲國會「移民聯席委員會」主席喬傑納斯（Steve Georganas）、「影子退伍軍人事務部長」契斯特（Darren Chester）及參眾兩院「選舉事務聯席委員會」副主席寇貝克（Richard Colbeck）組成。請繼續往下閱讀...林佳龍表示，台澳同為理念相近的民主夥伴，致力維護自由開放的印太地區，台澳經濟具高度互補性，澳洲是台灣最大的能礦供應國，且是我國赴海外留學人數第二多的國家，澳洲也是台灣第8大貿易夥伴；台灣是澳洲第6大出口市場，彼此經貿往來密切。林佳龍表示，感謝澳洲國會長期在國際場域為台灣發聲，例如去年通過友我動議，支持台灣的國際參與，台灣願與澳洲及理念相近國家共同面對威權擴張的挑戰，建構「非紅供應鏈」，攜手捍衛民主價值與印太地區的和平繁榮。外交部表示，台澳雙邊近年來在全社會韌性、能源、科研、教育、原民文化、運輸安全等領域的合作逐步深入。這次澳洲國會訪團來台，有助於促進台澳兩國情誼，並持續深化兩國互惠互利的友好關係。熱門賽事、球星動態不漏接    ,https://news.ltn.com.tw/news/politics/breakingnews/5218997
央廣案工程師陳情資安疑慮?洪婉臻：北市府相關單位沒掌握,政治,2025/10/21 17:27,央廣網站遭駭，北市議員洪婉臻今天質詢市府秘書長李泰興、政風處長高伯陽。（翻攝北市議會直播）中央廣播電台網站遭駭事件延燒，北市議員洪婉臻今（21日）質詢市府秘書長李泰興、政風處長高伯陽，洪婉臻表示，央廣涉案吳姓工程師，不僅向黃國昌陳情，也曾向1999通報、陳情相關資安疑慮，但相關單位直到現在都沒掌握情況，要求回溯調查、建立府級跨局處通報制度及資安白名單、重新審視資安外包風險。洪婉臻表示，央廣案的涉案廠商「創蹟數位科技有限公司」曾在107、108、109、112年共取得北市5件標案，承包北市文化局、建管處標案，不過創蹟董事長在中國四川有開公司，向黃國昌檢舉的吳姓工程師，也曾在9月17日跟台北市府的1999陳情，還跟廉政署檢舉，不過直到現在北市府都沒有掌握情況。請繼續往下閱讀...洪婉臻直批，有關標案的事情，政風處本來就該站在第一線好好瞭解，吳姓工程師檢舉的內容包含，第一，是否涉及中國地區開發人力或第三地委外或是轉委外。第二，交付品質是否符合政府資訊服務的資安與架構設計標準。第三，AWS架構是否存在錯誤或系統監控機制不足。第四，是否違反敏感性或國安採購相關規定。洪婉臻強調，主要的檢舉內容跟政風處有密切關係，且創蹟的董事長跟董事背後都有中國公司，資訊局表示北市府的標案，都不應該有中國影子產生，但是吳姓工程師早在9月就跟北市府檢舉，結果市府官員到現在都還不知道。政風處長高伯陽則說明，只要有檢舉都一定有收到，但是現在仍在釐清結果當中。洪婉臻指出，創蹟得標的標案，有北流、優化網頁的，網站的製作案，甚至民眾要去北流申請租用場地，租借系統都需要登錄身分證的，還需要正反面上傳，裡面都有民眾個資外洩的疑慮，結果你們到現在都沒有掌握，台北市民的個資誰來把關？洪婉臻強調，資安問題不容小覷，要求回溯調查，建立府級跨局處通報制度以及資安白名單，也需重新審視資安外包風險。熱門賽事、球星動態不漏接    ,https://news.ltn.com.tw/news/politics/breakingnews/5218961
陸委會提兩岸政策「四個不變」 邱垂正：台灣絕對不會投降,政治,2025/10/21 17:27,陸委會主委邱垂正（右）。（記者陳鈺馥攝）陸委會主委邱垂正今日在「美中競爭下的中國大陸情勢與兩岸關係」國際研討會圓桌論壇致詞表示，我國政府兩岸政策有「四個不變」：一、捍衛主權的決心不變。二、維護兩岸和平穩定現況的努力不變。三、致力於在兩岸平等互利的基礎上，進行健康有序的對話與交流的承諾不變。四、致力於世世代代守護自由民主生活方式的決心不變。邱垂正並強調，永遠不會屈服於來自中國的武力威脅和日益加劇的壓力，台灣絕對不會投降。邱垂正指出，美中台關係正處於二戰以來最複雜、最關鍵的時刻。中美領導人可能在不久的將來會晤，中共正在召開「二十屆四中全會」，此時此刻，探討美中台關係至關重要。請繼續往下閱讀...邱垂正談及，自2016年蔡英文總統當選以來，我國政府一直以維護台海和平穩定現況為基礎，推動兩岸政策。我國政府的立場堅定且一貫，也符合國際社會的期待和兩岸人民的福祉。邱垂正表示，我方一直不遺餘力地維持現狀，並維護兩岸關係的和平與穩定。我們維護台灣的民主、自由、人權、法治和普世價值，維護台海和平與穩定。邱垂正強調，雖然兩岸互動對話較以往有所降溫，但希望雙方能夠在相互尊重、對等尊嚴的基礎上，不設任何政治前提坐下來談。我們希望對岸領導人能展現智慧和靈活性，以實現兩岸共贏的未來。邱垂正進一步說，多年來，台灣堅持維持台海現狀的政策，但台海局勢並非一成不變、風平浪靜，而是瞬息萬變。究竟是誰在試圖單方面改變、破壞現狀？是北京當局不斷升級施壓，試圖抹殺中華民國台灣的主權，威脅台海和平穩定的現狀，以及台灣人民的福祉。對於中國對台政策，邱垂正直指，中國對台政策僵化、消極，缺乏彈性。他們堅持要求台灣接受所謂的「九二共識」，並將其定義為「一個中國原則」。邱垂正批評，如果接受九二共識，就意味著我們接受台灣是中華人民共和國的一部分，接受中國統一的框架和進程。正因如此，我們基於台灣主權和民主原則，過去沒有、將來也不會接受任何政治前提條件。邱垂正說，台灣拒絕接受中共的政治前提及其統一台灣的最終目標，因此面臨來自中國的挑戰和日益加劇的壓力，例如軍事威脅、外交打壓、經濟脅迫、法律戰和社會滲透。中共也對台灣採取一系列認知作戰、統戰和灰色地帶策略。邱垂正強調，儘管台灣面臨前所未有的壓力，但我們捍衛主權和民主制度的決心從未如此堅定，這是我們的底線。在這一點上，沒有任何妥協的餘地。永遠不會屈服於來自中國的武力威脅和日益加劇的壓力，台灣絕對不會投降（Taiwan never surrenders）。邱垂正表示，我國政府對兩岸關係和平穩定的政策承諾將維持不變，政府保持不挑釁、不冒險的態度，以防止台海爆發嚴重衝突。身為國際社會負責任的一員，如果北京當局真心希望解決兩岸分歧、改善兩岸關係，我方願意在對等、尊嚴原則下，促成有意義的對話。只要秉持理性、平等、相互尊重的原則，我們願意與北京當局共同努力，為維護台海和平穩定，達成雙方均可接受的安排，這是我們共同的責任。他強調，台灣人民不可能將未來寄託在中共領導人的善意上。未來，我們將落實賴總統提出的「和平四大支柱」行動計劃，捍衛台灣的民主與繁榮。這四大支柱分別是：一、強化國家自衛能力及非對稱作戰能力。二、提升經濟安全，增強供應鏈與社會韌性。三、持續與理念相近的民主國家建立夥伴關係。四、建立穩定而有原則的兩岸關係領導能力。熱門賽事、球星動態不漏接    ,https://news.ltn.com.tw/news/politics/breakingnews/5218969
自由說新聞》小粉紅瞎扯「統一台灣查血統」一片打臉！他霸氣開轟中共奧步,政治,2025/10/21 17:09,全新的視界！新聞話題不漏接，快訂閱YouTube 【自由追新聞】，記得開啟小鈴鐺哦！熱門賽事、球星動態不漏接    ,https://news.ltn.com.tw/news/politics/breakingnews/5218941
國軍今年已招募1.3萬人 留營率提升至86.7％,政治,2025/10/21 17:05,國防部今年度截至9月底招募人數1萬3030員。（資料照）國軍透過調整放寬招募徵選條件、調整待遇等措施，盼提升國軍招募效益。國防部最新書面業務報告指出，國防部今年度截至9月底招募獲得數1萬3030員，階段獲得率109.1%，留營率也顯較以往提升，為86.7％。立法院外交及國防委員會23日將邀請國防部部長顧立雄報告業務概況，並備質詢。書面報告今日送抵立院。請繼續往下閱讀...國防部書面業務報告指出，國軍持續透過完善編組、深耕校園、媒體宣傳、精進報名流程、適度調整放寬招募甄選條件及調整待遇等措施，提升招募效益。國防部指出，114年度招募目標1萬4563員，截至9月30日招募階段計畫數1萬1940員，階段獲得數1萬3030員，階段獲得率為109.1%。以軍校正期班為例，年度計畫數1476員，在各軍事院校戮力下，獲得數1687員，獲得率114.3％。國軍將持續運用階段節點管制與資源分配，確保 如期如質達成年度目標。留營率方面，國防部指出，今年度截至9月底留營率為86.7％，顯較以往提升；不適服人數也較同期減少1千餘員，有效提高留營意願。為改善官兵服役環境，國防部積極推動國軍老舊營舍整建，目前「興安專案」計畫執行103案，已完工87案，尚餘16案執行中；另於去年核定115至120年執行「展興專案」，規劃優先辦理官兵營舍及備勤大樓新建工程新建工程16案、職務宿舍新建工程9案。熱門賽事、球星動態不漏接    ,https://news.ltn.com.tw/news/politics/breakingnews/5218924
法國情資驚爆我副部長密訪以色列 台版鐵穹獲以國暗助,政治,2025/10/21 17:03,以色列「鐵穹」防空系統發射攔截飛彈。（圖：以色列國防部）台以關係出現重大突破！根據法國情資數位媒體「情報在線」（Intelligence Online）21日披露，我國一位副部長級特使近期已秘密訪問以色列；與此同時，賴清德總統宣示加速打造的「台灣之盾」（T-Dome）防空系統，被指與以色列「鐵穹」（Iron Dome）防禦系統概念相近，其核心技術更可能獲得以國暗中相助，雙方檯面下的夥伴關係正悄然升溫。賴總統在雙十國慶演說中，宣示要建構分層防禦的嚴密防空系統，其中備受矚目的便是我國最新的「強弓」反飛彈系統。報導指出，由中科院研發、攔截高度達70公里的「強弓一型」（天弓四型），其設計理念與以色列的「飛箭二型」（Arrow-2）飛彈及「綠松」（Green Pine）雷達系統，存在著驚人的相似之處。請繼續往下閱讀...值得注意的是，「飛箭二型」是由以色列航太工業公司（IAI）與美國波音（Boeing）合作研製，而波音目前也正與台灣方面密切合作。此外，「強弓二型」飛彈更有A、B兩種衍生型，A型彈目標攔截高度達100公里，B型彈射程則估計可達1000公里。國防部已向中科院下訂122套「強弓」系統，用於全台部署。報導分析，台以之間雖無正式國防協議，但哈瑪斯去年10月對以色列發動恐怖攻擊後，地緣政治格局出現劇烈轉變。中國在此事件中的立場，及其與伊朗日益加深的防務合作，已讓以色列對北京幻想破滅，不再如以往般顧忌中國反應，並開始積極「親台批中」。根據《上報》報導，淡江大學教授莫少白（Mor Sobol）便指出：「以色列官員永遠不會公開承認，但企業層級的合作確實可能存在。」事實上，近年以色列已放寬防禦性及軍民兩用技術的出口管制，我國的「劍翔」無人機就被指與以色列「哈洛普」（Harop）無人機高度相似。台以近期互動升溫，賴總統9月16日甫接見以色列國會友台小組主席杜伯斯基（Boaz Toporovsky）訪問團；以色列企業也在睽違24年後，高調重返台北國防展。此舉引來中國駐以色列大使館氣急敗壞地在社群媒體上發文，公開威脅杜伯斯基是「麻煩製造者」，若繼續一意孤行「將粉身碎骨」。對於台以關係的進展，莫少白直指：「這一切背後，應該都有某種程度的美方默許。」他進一步表示，考量到過去以色列「獅式」戰機技術曾外流成為中國殲-10戰機的範本，如今華府應更有理由放行台以之間尖端的防衛合作。熱門賽事、球星動態不漏接    ,https://news.ltn.com.tw/news/politics/breakingnews/5218925
APEC峰會月底韓國登場 徐斯儉、吳誠文、楊珍妮隨團,政治,2025/10/21 16:53,亞太經濟合作會議（APEC）年度峰會將於31日在韓國慶州登場，總統府今天舉行行前記者會公布代表團名單，總統府資政林信義今年第五度出任我國領袖代表。（記者羅沛德攝）首次上稿16:12更新時間16:53（更新內文與標題）亞太經濟合作會議（APEC）年度峰會將於31日在韓國慶州登場，總統府今天舉行行前記者會，據掌握，除了總統府資政林信義今年第五度出任我國領袖代表外，國安會諮委徐斯儉、國安會副秘書長趙怡翔、國科會主委吳誠文及行政院政務委員楊珍妮將隨團出發。請繼續往下閱讀...據了解，APEC企業諮詢委員會（ABAC）代表團與去年相同，包含宏碁股份有限公司董事長陳俊聖、台灣大哥大總經理林之晨及廣達電腦技術長張嘉淵。對於賴總統交付代表團向國際傳遞台灣3大主張，5度出任我國領袖代表的林信義表示，他將善用這次機會積極交流，並分享我國在人工智慧創新及數位健康合作上的具體成果，展現台灣是國際社會當中良善、可信賴，而且負責任的夥伴，為台灣凝聚更多國際支持與友誼。熱門賽事、球星動態不漏接    ,https://news.ltn.com.tw/news/politics/breakingnews/5218839
