Title,News_Type,date,content,url
藍政客突狂提馬鈴薯 吳音寧發聲：想起北農菜價之亂,政治,2026/04/24 16:06,吳音寧附上一張彰化縣溪州鄉田野裡剛採收的有機馬鈴薯照片，呼籲網友：「土生土長的台灣馬鈴薯，真的超級好吃。大家多多支持喔！」（取自吳音寧臉書）台灣進口美國加工馬鈴薯實施新規，遭外界質疑恐放寬發芽馬鈴薯進口；不少藍、白政治人物、粉專近日火力全開狂打此議題。前北農總經理吳音寧嘆，台北的藍營政客，平時從來不關心農業，突然跳出來講馬鈴薯，讓她想起多年前，在北農經歷的菜價之亂。她說，這次又要假藉馬鈴薯之名，操作政治鬥爭，實在是「有夠老套！」吳音寧昨日在臉書發文表示，長期以來，台灣人食用的馬鈴薯，不乏仰賴進口。進口量約為國產的兩倍。根據（107年）公告的「食用馬鈴薯輸入檢疫條件」，只要有五毫米以上芽體的馬鈴薯，就不得輸入。台美貿易談判之後，食用馬鈴薯的進口規範，完全都沒有變。而在今年（115年）二月，農業部另外公告了「美國產加工用馬鈴薯輸入檢疫條件」。請繼續往下閱讀...「根據最新的規定，大家知道，送達加工廠後，芽體多長的加工用馬鈴薯，就應棄置、不得進行加工嗎？」吳音寧在文中詢問網友，接著她也解答：「答案是，依然是五毫米。」她指出，而且加工用馬鈴薯，必須先行標註不會流入市面。必須備妥文件後，以安全防護措施直接運往加工廠。「所以，為何會有馬鈴薯之亂？為何台北的藍營政客，平時從來不關心農業，會突然跳出來講馬鈴薯？」吳音寧說，不免想起多年前，她在北農經歷的菜價之亂。從那之後，這群平時對農業不聞不問的台北政客，每隔一段時間，就要假借民生議題，把惡劣的政治鬥爭手法，一而再、再而三的重演。「這次，又要假藉馬鈴薯之名，操作政治鬥爭——實在是，有夠老套！」最後，她也附上一張彰化縣溪州鄉田野裡剛採收的有機馬鈴薯照片，呼籲網友：「土生土長的台灣馬鈴薯，真的超級好吃。大家多多支持喔！」    ,https://news.ltn.com.tw/news/politics/breakingnews/5414748
潘俊霖：陳智菡當年空降北市府當發言人不知是哪位「有力人士」推薦,政治,2026/04/24 15:49,台灣民眾黨立法院黨團主任陳智菡（左）、新竹市府前發言人楊寶楨（右）。（資料照 本報合成）新竹市府美女前發言人楊寶楨日前鬆口有意投入選戰，沒想到遭粉專「民眾講堂」引述網友留言攻擊。對此，楊寶楨親自留言「我知道你背後是誰在控，不要一直在黨內搞分裂了」引發討論。對此，前柯文哲攝影官潘俊霖表示，2020那一次大選楊寶楨有當苦工全台灣健走奔波輔選，大選後陳智菡莫名奇妙的空降到台北市政府當發言人，他到現在還很好奇是哪一位「有力人士」推薦。潘俊霖在臉書PO文表示，陳智菡，民眾黨創黨前根本不認識這個人，民眾黨創黨大會透過朋友來跟我索取VIP座位名額；楊寶楨或許她過往有些爭議，但在2020那一次大選楊寶楨有當苦工全台灣健走奔波輔選。請繼續往下閱讀...潘俊霖直言，然後當2020選舉後民眾黨有5席立委後，陳智菡莫名奇妙的空降到台北市政府當發言人，到現在還很好奇是哪一位有力人士推薦，可以讓柯文哲這麼信任她。民眾黨前美女發言人楊寶楨有意回家鄉台中選議員，但昨（23日）她控訴遭小草粉專「民眾講堂」帶風向製造分裂，稱知道「背後是誰在控制」，有網友就點名先前曾傳與楊內鬥的民眾黨立院黨團主任陳智菡。對此，陳智菡回應，認為要虛心接受支持者聲音，並要楊寶楨想選就按程序登記，沒人有特權。    ,https://news.ltn.com.tw/news/politics/breakingnews/5414595
暗酸柯文哲？石明謹憶警界關說神回覆 網笑：沒護理站情節？,政治,2026/04/24 15:45,"民眾黨創黨主席柯文哲。（資料照）民眾黨創黨主席柯文哲、前台北市長近日晚間闖護理站看病歷「電人」，今柯受訪證實有到醫院並稱「我自己是醫療專家」。對此，過去常有處理車禍案情時，常遇到不同人或長官介入「關切」的情形，曾任警察石明謹今分享過往自身面對長官關說時的應對，並坦言每逢重大車禍案，總會接到各種電話，從督察到資訊室主任都有，讓他感到相當困擾。石明謹今日於臉書發文指出，「以前常會碰到有人來關心車禍案情，尤其是重大車禍的時候就會很煩，什麼奇怪的長官都會打電話來問，從督察到資訊室主任都有」。請繼續往下閱讀...面對這些關心，他通常僅會口頭簡單描述案發經過，至於卷宗內容、監視器畫面及雙方的陳述等，他一律以「案件已移送、不在手上」為由回應。若對方搬出身分或背景，例如：聲稱與分局長關係匪淺，要求他打電話詢問，石明謹總是以「但是我跟我們分局長不熟、沒他電話，你熟可以自己問他」回擊。至於甚麼退休10多年的前松山分局長，跑到萬華分局調閱資料一說，石明謹直說「更是不可能」發生。他最後提出「善意提醒」，呼籲民眾別以為朋友是退休分局長就懂車禍分析，直指對方可能這輩子連一件車禍都沒處理過。消息曝光後，許多網友紛紛留言，有人說「您好像在臭某醫學教授，但是我沒有證據」、「故事中怎麼沒有護理站情節？」、「哈哈哈！某前台北市長」，還有網友反諷地說「人家分局長沒處理過車禍，但是出過很多次車禍讓人處理啊！久病成良醫」。被爆去醫院「看病歷施壓」 柯文哲：我醫療專家柯文哲被爆夜赴醫院「看病歷」惹議 新光醫院回應了柯文哲認了赴新光醫院「看病歷」！醫揭小草檢舉護理師引網怒石明謹。（資料照）    ",https://news.ltn.com.tw/news/politics/breakingnews/5414672
前高公局分局長賴榮俊涉收賄823萬護航圍標 監院彈劾並糾正高公局,政治,2026/04/24 15:43,監察院。（資料照）交通部高速公路局（下稱高公局）中區及南區養護工程分局前分局長賴榮俊，涉嫌長期收受廠商賄賂高達823萬元，洩漏採購機密並護航特定廠商詐術圍標高達30件、總金額逾8.6億元之工程。監察院除已另案通過彈劾賴榮俊外，並提案糾正高公局，嚴正指出三大嚴重行政違失，要求必須澈底檢討改善。監察委員蔡崇義、王幼玲、葉宜津深入調查後發現，高公局不僅內部採購與監督機制形同虛設，案發後更對賴員輕縱准予復職。調查指出，高公局長期便宜行事，於工程契約中違法包裹勞務需求，編列「工務作業費」逕行要求得標廠商提供「派駐人員」進駐機關協助行政庶務。賴榮俊即利用此制度漏洞，將廠商派駐人員廖嵐卿視為私人秘書，前後11次指示其攜帶現金前往銀行，替賴員及其配偶存匯達479萬元（其中368萬元為賄款），派駐人員淪為貪官「私人洗錢工具」，嚴重混淆公私分際。請繼續往下閱讀...此外，監委指出，底價核定權力過度集中於首長一人，淪為利益交換籌碼。高公局各分局長期放任分局長擁有底價核定之絕對權力，未成立客觀獨立之「底價審議小組」進行實質審查。賴榮俊隻手遮天，配合圍標廠商需求肆意洩漏及墊高底價；經查，本案30件圍標案中，存有高達12件於減價後，決標金額竟與底價相同，另有多起精準命中底價98%以上之異常現象，顯見底價資訊已遭嚴重外洩與操控。針對後續懲處，監委嚴正指出高公局「官官相護」，面對涉貪重罪竟輕縱復職。賴員違法亂紀長達8年，案情經檢方起訴且事證明確，然高公局召開考績委員會時，竟無視其犯行對機關聲譽之毀滅性打擊，以13票對1票之懸殊比例，決議僅予「一次記一大過」，未採免職處分。況賴員停止羈押後，高公局消極不行使「先行停職」權限，反率准其復職，並安排擔任局本部「主任工程司」之簡任要職，嚴重打擊奉公守法公務員之士氣。監委強調，公務員本應廉潔自持，高公局長期縱容主管廉政風險控管失靈，致使國家採購公信力遭受嚴重侵蝕。高公局應痛定思痛，全面檢討工程契約人力派駐之適法性，並建立底價異常檢核與覆核機制，杜絕「內神通外鬼」之貪瀆弊端再生，以昭公信。    ,https://news.ltn.com.tw/news/politics/breakingnews/5414688
柯文哲被爆到醫院「看病歷施壓」 律師：恐違反醫療法可處3年以下,政治,2026/04/24 15:31,前台北市長柯文哲被質疑施壓護理人員，他今上午稱是在前天晚上去新光醫院，並指是中央黨部員工媽媽開刀，並說「我自己也是醫療專家，員工一定會希望說，去找一個他認為很厲害的醫師去幫忙看一下」。（資料照）有醫護人員近日發文稱，有病患家屬為「前市長」員工，晚間將人請到醫院「電人」，更質疑當時僅有值班醫師與護理人員，為何仍要求說明病情？稍早PO文已刪除；柯文哲今上午證實的確在22日晚上有去新光醫院。律師陳君瑋認為，無論柯文哲是否為醫療專家，若不是本案醫師就是違法的行為，依照醫療法規定，施壓醫療人員，輕則罰3萬至5萬元，重則可處3年以下有期徒刑。有醫護人員近日在社群發文爆料，指有病患家屬為「前市長」員工，晚間將人請到醫院「電人」，並質疑當時僅有值班醫師與護理人員，為何仍要求說明病情？引發外界關注。貼文並附上一張背影照，被指疑似為民眾黨前主席、醫師柯文哲，相關內容在網路擴散後掀起爭議，但PO文已刪除。請繼續往下閱讀...柯文哲今上午稱，他是在前天晚上去新光醫院，並指是中央黨部員工媽媽開刀，稱「我自己也是醫療專家，員工一定會希望說，去找一個他認為很厲害的醫師去幫忙看一下」。陳君瑋指出，依《醫療法》，禁止對醫療人員施加強暴、脅迫、恐嚇或其他不法方式干擾醫療，護理師質疑「前市長」晚上到醫院施壓，柯文哲還說：「我是醫療專家」，但誰管他是不是醫療專家，若不是本案醫師，施壓就是違法的行為，輕則罰3萬至5萬元，若影響原本的醫療行為，重則可處3年以下有期徒刑。陳君瑋受訪分析，柯文哲若是強勢逼問、情緒威嚇、要求醫療行為改變，即使是醫師背景的柯文哲，只要不是該案醫療團隊，就不具決定權，若「指示」或「干預」治療方向，就可能侵害主治醫師的醫療自主權，甚至衍生醫療責任歸屬問題，尤其柯文哲具政治身分，即使沒有明確威脅，也可能形成「隱性壓力」。    ,https://news.ltn.com.tw/news/politics/breakingnews/5414713
立院三讀娛樂稅修正案 北市稅收影響近3億、蔣萬安稱推動演唱會經濟,政治,2026/04/24 15:16,台北市長蔣萬安。（記者甘孟霖攝）立法院會今（24）日三讀修正通過「娛樂稅法部分條文修正案」，刪除電影、職業性歌唱、說書、舞蹈、馬戲、魔術、各項競技比賽等的娛樂稅。台北市長蔣萬安說，兩年前他就宣示中央修法後會推動，很高興看到中央與立院通過修法。北市財政局表示，等總統公布生效實施後，就會停徵，稅收影響近3億元。蔣萬安今受訪說，兩年前就有公開宣示，如果中央修法通過之後，北市就會來推動，為了推動演唱會經濟，針對相關藝術文化產業來停止徵收娛樂稅，很高興看到中央還有立法院能夠順利通過修法，只要新法實施上路之後，就會針對包括電影、演唱會還有各項運動賽事來停止徵收娛樂稅，希望能夠帶動相關經濟的發展和提升。請繼續往下閱讀...台北市財政局局長胡曉嵐補充，北市府大力推動「演唱會經濟」等藝文產業發展，今日立法院三讀通過娛樂稅法，等總統公布生效實施後，北市即停徵電影、藝文表演、競技活動等項目娛樂稅，稅收影響將近3億元。    ,https://news.ltn.com.tw/news/politics/breakingnews/5414675
柯文哲夜進護理站「電人」？ 新光醫院：恐是「柯式語法」惹議,政治,2026/04/24 15:13,民眾黨創黨主席柯文哲遭爆晚上赴新光醫院護理站了解患者病情，並被質疑「電人」、對醫護施壓。（資料照）醫師出身的民眾黨創黨主席柯文哲遭爆晚上赴新光醫院護理站了解患者病情，並被質疑「電人」、對醫護施壓。新光醫院醫務副院長張益誠今（24）日表示，經院方了解，相關過程屬常見醫病溝通情境，並無明顯施壓情形，外界感受到的壓力，較可能來自所謂「柯式語法」，即使沒有惡意，「聽起來也都有壓力」。有醫護人員在社群網站Threads發文抱怨，指有病患家屬是「前市長」的員工，「就把前市長請來電人？晚上10點要求要病解？」、「虧前市長曾是醫療人員，而且這裡也不是台大，甚至要求夜班主護說明白天發生什麼事，到底憑什麼？真的是可憐值班醫師跟當班主護了。」該文所附影像可見柯文哲坐在護理站聽醫師解說病情，引發網友議論，但po文者已刪除該文。請繼續往下閱讀...張益誠指出，該名患者術後當天中午出現不適，家屬因焦慮，希望由認識的醫師協助了解病況，院方因此安排值班醫師進行說明。這類由醫界友人協助溝通的情況在臨床並不罕見，透過專業解釋，有助於病人與家屬理解醫療處置。針對外界質疑柯文哲進入護理站是否涉及介入醫療工作，張益誠說明，目前醫院採電子病歷系統，說明病情需透過電腦螢幕呈現影像與資料，因此在護理站開啟系統進行解說，是「滿標準的作法」，在醫療現場也相當常見。至於時間點為夜間，張益誠表示，醫院為24小時運作，雖多數情況會安排於日間說明，但考量民眾作息與需求，下班後或晚間進行病情解說亦非少見。當天柯文哲大約是晚上9點多到醫院，非門禁時間，由於主治醫師在開刀，因此由值班醫師負責說明，過程約半小時，提問不複雜，後續也未再提出疑慮。對於是否增加醫護負擔或涉及施壓？張益誠表示，院方已主動關心護理人員，目前掌握情況「不太像網路所說」，但也坦言，當有具知名度的「人物」到場，第一線人員難免感受壓力，較可能來自角色與語氣，而非實際要求。張益誠並指出，從相關資料觀察，柯文哲的表達方式屬外界常稱的「柯式語法」，「不是說『我要你怎麼樣』，而是講話的感覺」，即便沒有惡意，仍可能讓聽者感受到壓力；整體溝通過程順利，患者今日就可順利出院，可說是「Happy Ending」。新光醫院醫務副院長張益誠說明，柯文哲夜訪新光醫院探病過程。（新光醫院提供）    ,https://news.ltn.com.tw/news/politics/breakingnews/5414690
柯文哲夜闖護理站看病歷 馬郁雯怒轟：骨子裡全是傲慢,政治,2026/04/24 15:13,民眾黨創黨主席柯文哲。（資料照）民眾黨創黨主席被爆近日晚間赴醫院護理站看病歷「電人」，台北市議員參選人、前媒體人馬郁雯痛批，柯文哲是「不懂得節制權力與慾望的政治人物」，在柯身上只能看見傲慢與狂妄，一個卸任的前台北市長，竟大喇喇進入醫院值班台，要求值班醫師為他講解病患病情，令人咋舌。馬郁雯今日於社群平台發文指出，這起事件被醫護人員爆料後，柯文哲回應稱「我自己也是醫療專家，員工一定會希望說，去找一個他認為很厲害的醫師去幫忙看一下」，這種荒腔走板的行徑曝光後，柯文哲非但沒有反省，反而試圖以「醫療專家」的名號，來合理化自己逾矩的行為。請繼續往下閱讀...馬郁雯直指，不只醫界，柯文哲在辣椒水事件中，曾打電話給台中市警察局長吳敬田，針對警政人事指手畫腳。馬郁雯嘆說，已經卸任市長的柯文哲，似乎仍停留在擁有權力的幻覺與想像中，忘卻自己的身分。柯文哲的傲慢與狂妄，根本是打從骨子裡就是如此。     在 Threads 查看被爆去醫院「看病歷施壓」 柯文哲：我醫療專家柯文哲被爆夜赴醫院「看病歷」惹議 新光醫院回應了柯文哲認了赴新光醫院「看病歷」！醫揭小草檢舉護理師引網怒    ,https://news.ltn.com.tw/news/politics/breakingnews/5414522
民眾黨中市議員拱盧秀燕選總統 蔣萬安回應了,政治,2026/04/24 15:13,蔣萬安。（記者甘孟霖攝）民眾黨台中市議員江和樹日前喊話台中市長盧秀燕表態2028參選總統。台北市長蔣萬安今（24）日被問支不支持盧選總統？蔣萬安說，目前就是專注市政，為市民爭取最大福祉。蔣萬安今前往議會民眾黨團說明重大議法案，會後媒體堵訪問他，怎麼看有民眾黨議員拱盧選總統？蔣會支持盧嗎？另也有人認為蔣2028會出來選？蔣萬安回說，他就是專注市政，今天跟民眾黨團來說明重大法案，會持續跟議會來一起努力，為市民爭取最大的福祉。    ,https://news.ltn.com.tw/news/politics/breakingnews/5414669
蘇巧慧推「醫界為巧慧加油」系列影片 首集分享增設AED故事,政治,2026/04/24 15:08,民進黨立委、新北市長參選人蘇巧慧持續加強空戰宣傳，今（24）日推出「醫界為巧慧加油」系列短影音。（蘇巧慧辦公室提供）民進黨立委、新北市長參選人蘇巧慧持續加強空戰宣傳，今（24）日推出「醫界為巧慧加油」系列短影音。蘇巧慧競選辦公室指出，此系列為中西醫師、中藥商、物理治療師、癌症及罕病防治、長期照顧、幼兒醫療照顧等不同領域醫事人員拍攝影片，分享蘇巧慧長期為各級醫療、各類醫事人員、病友等爭取資源和完善制度的努力，首集影片由「台灣公眾除顫發展協會」理事長徐震宇敘述蘇巧慧與協會共同推動全國增設3千多台AED的故事。蘇巧慧說，她認為「急救是每個人的責任」，熟悉CPR與AED的操作就能減少憾事發生，因此過去她長期和立法院厚生會、厚生基金會合作推廣CPR與AED的急救知識，也舉辦AED勸募活動，實際體驗過很多次CPR與AED的操作，至今已培訓6.4萬多人學習急救知識；未來若當選新北市長，一定會繼續推廣急救知能，強化社區急救量能。請繼續往下閱讀...徐震宇表示，蘇巧慧2020年在立法院社會福利及衛生環境委員會提案要求衛福部修正關於「應置有自動體外心臟電擊去顫器之公共場所」相關規定，促使全國AED的數量增加3千多台，「等於為全台灣增加3千多個救命的機會」，蘇巧慧也響應立法院厚生會、厚生基金會的AED勸募活動，補足國中與派出所共1200台AED的缺口。徐震宇指出，他非常感謝蘇巧慧扮演官方與民間專業人士的溝通橋樑，她也來找他學習如何正確操作CPR與AED、止血帶等救命工具，對於蘇巧慧尊重生命、實事求是的精神相當感佩，AED雖然有救命效益，但是必須放在對的地方才有效益，「人也是一樣，要在對的地方，才能夠發揮更大的效益」，因此支持蘇巧慧當新北市長。    ,https://news.ltn.com.tw/news/politics/breakingnews/5414668
總統彈劾案5/19立院表決  民進黨團：政治鬧劇將不出席投票,政治,2026/04/24 15:06,立法院民進黨團幹事長莊瑞雄。（資料照）立法院朝野黨團今（24日）達成共識，將於5月19日上午10時進行賴總統彈劾案記名投票表決。對此，民進黨團幹事長莊瑞雄批，在野把憲政制度當成政治秀場，民進黨團拒絕為這場政治鬧劇背書，黨籍立委當天將不會出席投票。行政院長卓榮泰宣布不副署財政收支劃分法後，國民黨團、民眾黨團去年底對賴總統啟動彈劾案程序。全院委員會部分，已經於今年1月14日、15日舉行公聽會，1月21日、22日邀請被彈劾人賴總統列席說明，但賴並未出席。5月13日、5月14日將舉行第二次審查會，並於5月19日進行彈劾案投票。請繼續往下閱讀...對此，莊瑞雄受訪表示，在野黨把憲政制度當作政治的秀場，民進黨團反對此案，在程序上亦拒絕背書，不會配合這場政治鬧劇。莊瑞雄強調，民進黨現在最在意的是，希望讓攸關國家運作的總預算案加速審查，以及關係到全國2300萬人民身家安全、國防戰力提升的國防特別條例草案盡快有結論，因此對於國民黨搞的這齣政治鬧劇，民進黨團不奉陪、不會陪公子讀書。    ,https://news.ltn.com.tw/news/politics/breakingnews/5414660
柯文哲認赴醫院看病歷「自稱醫療專家」 粉專開嗆：你是貪污專家,政治,2026/04/24 15:05,民眾黨創黨主席柯文哲。（資料照）有醫護人員近日發文稱，有病患家屬是「前市長」員工，晚間將人請到醫院「電人」，更質疑當時僅有值班醫師與護理人員，為何仍要求說明病情，稍早PO文已刪除，柯文哲今（24日）上午證實前天晚上赴新光醫院，稱「我自己也是醫療專家」。對此，臉書粉專「Mr.柯學先生」大酸「不！你是貪污專家！」粉專「Mr.柯學先生」今日發文並附上圖卡，圖卡顯示「前員工家屬生病，柯文哲被爆深夜施壓護理人員，受訪反嗆我是醫療專家」，接著揶揄地說「 不不不！你是貪污專家！」請繼續往下閱讀...網友看到貼文後相繼留言，有人說「泥是～整天說謊講幹話的～貪污死不認錯專家！」、「以為自己是誰，他現在只有一個貪污犯的身分，怎麼到哪都可以有特權可以耍？」、「這傢伙的存在真的是社會的亂源，又貪污又愛說謊整天製造社會對立，希望他趕快進監獄」、「你是『在辦公室踩著飛輪的前醫療專家』請說清楚謝謝」。被爆去醫院「看病歷施壓」 柯文哲：我醫療專家柯文哲被爆夜赴醫院「看病歷」惹議 新光醫院回應了柯文哲認了赴新光醫院「看病歷」！醫揭小草檢舉護理師引網怒    ,https://news.ltn.com.tw/news/politics/breakingnews/5414435
綠讚沈伯洋懂音樂、體育 民眾黨北市議員：選市長不是才藝大賽,政治,2026/04/24 14:53,"陳宥丞（右）說，綠營讚沈伯洋懂音樂、體育是搞錯重點，重點還是在觀眾（市民）埋不埋單。張志豪（左）說，選市長不是才藝大賽，民眾黨著重在地深耕，與沈伯洋沒有特別相同地方。（記者甘孟霖攝）民進黨的台北市長提名人選中，立委沈伯洋呼聲越來越高。民眾黨籍北市議員陳宥丞說，綠營讚沈伯洋懂音樂、體育是搞錯重點，重點還是在觀眾（市民）埋不埋單。至於是否有機會與沈有議題合作？民眾黨籍議員張志豪說，選市長不是才藝大賽，民眾黨著重在地深耕，與沈伯洋沒有特別相同地方，「但如果要切磋球技沒問題」。陳宥丞表示，台北市長蔣萬安目前是北市的主旋律，議會的議員則是合奏，讓府會和諧，市民才會埋單買票進場，今天不是誰可以一個人不看稿聊巴哈、莫札特，就可以的。請繼續往下閱讀...媒體問，沈伯洋是否在某些議題有符合民眾黨價值？雙方有可能有合作？張志豪說，有不同才藝是好事情，但選市長不是才藝大賽，還是要對市政議題有著墨，且要在地深耕才是當市長條件，而民眾黨議員都追求在地服務、深耕，好像跟沈伯洋沒有特別相同的地方，「但如果要切磋球技，我是覺得沒問題」。    ",https://news.ltn.com.tw/news/politics/breakingnews/5414651
