Title,News_Type,date,content,url
政院顧問岩崎茂遭中國制裁 我外交部嗆：無助促進區域穩定,政治,2025/12/15 20:14,中國外交部15日宣布制裁我國行政院政務顧問、日本自衛隊前統合幕僚長岩崎茂，我國外交部表達嚴正關切。（資料照）中國外交部今（15）日宣布制裁我國行政院政務顧問、日本自衛隊前統合幕僚長岩崎茂。我國外交部表達嚴正關切，並重申我國政府的立場與原則，呼籲中方應避免將正常的國際交流與專業合作政治化，或以片面立場加以詮釋，此類作為無助於促進區域穩定。外交部指出，中華民國台灣與中華人民共和國互不隸屬，是國際社會普遍理解的客觀現狀，中國對台灣人民及其他國家公民在台灣或第三地參與相關政治、公共事務及民主活動，並不具任何管轄權。任何以國內法或政治理由，對他國人民進行跨國鎮壓或干預的作為，均與國際法精神及國際人權規範不符。請繼續往下閱讀...外交部進一步說明，我國基於國家發展及公共政策需要，依法聘請具專業背景之國際顧問，屬於正常且合法的主權行使，也是國際間常見的交流合作模式。岩崎茂長期致力於區域安全與和平相關事務，其個人專業參與符合國際慣例，也不涉及任何對他國內政之干預。外交部呼籲，中方應審慎看待相關議題，避免將正常的國際交流與專業合作政治化，或以片面立場加以詮釋，此類作為無助於促進區域穩定，反而可能對各方交流互信造成不必要影響。外交部強調，台灣一向重視與區域內各方的和平共處，並致力於與理念相近國家深化合作，共同維護台海及印太地區的和平、穩定與繁榮，對於任何因參與民主或公共事務而遭受不當對待的台灣人民及在台其他國家公民，我國政府均將依法提供必要保障。    ,https://news.ltn.com.tw/news/politics/breakingnews/5279186
「廟口開講才有FEEL」劉世芳白沙屯宣講臨時改場 鍾東錦誇她豪氣,政治,2025/12/15 20:09,內政部與非六都16個縣市宮廟合作，辦理「台灣全民安全指引宣講會」，今日下午在苗栗縣通霄鎮白沙屯拱天宮舉辦，內政部長劉世芳到場主講，並將原安排的室內會場拉到廟口開講。（記者彭健禮攝）內政部與非六都的16個縣市宮廟合作，辦理「台灣全民安全指引宣講會」，今日下午在苗栗縣通霄鎮白沙屯拱天宮舉辦，內政部長劉世芳到場主講。劉世芳將原安排的室內會場拉到廟口開講，一度引發騷動，她說明，今天天氣好，所以提出轉到廟口宣講，希望能讓更多參拜香客聽見。此舉也獲苗栗縣長鍾東錦認同「廟口開講才有FEEL」，並誇劉是「女中豪傑」。劉世芳與國安會諮詢委員劉得金、消防署長蕭煥彰到拱天宮進行「台灣全民安全指引宣講會」，行政院中部聯合服務中心副執行長李貴富、苗栗縣長鍾東錦，及縣議員陳品安、陳春暖、羅貴星、陳光軒、翁杰，與通霄鎮長張可欣等人出席。請繼續往下閱讀...宣講會場原本安排在拱天宮香客大樓3樓，劉世芳進入會場，與鍾東錦交頭接耳討論後，將宣講會場拉到拱天宮廟門前。因事出突然，內政部、消防署等單位工作人員趕忙將海報背板等攜往，節目表演的「替代役公益大使團」也抱著樂器轉移陣地，引發騷動。雖因此延誤開講時間，但在廟口宣講著實吸引許多香客，鍾東錦致詞也認同「廟口開講才有FEEL」，並誇劉是「女中豪傑」。劉世芳表示，台灣天災多，像今年丹娜絲颱風在雲嘉南地區造成嚴重災損、花蓮也發生堰塞湖溢流，另地震、土石流、海嘯都會發生。當面臨這類大災害時，需要全民投入，彼此互相協助，這本「台灣全民安全指引」小橘書就提供重要的防災觀念，讓民眾第一時間能自保，進而有餘力去協助別人。「有準備更安全！」劉世芳也舉白沙屯媽祖婆每回進香出巡，都有成千上萬信眾跟隨「粉紅超跑」，信眾背包一定少不了飲用水、防寒衣物等，因此防災觀念中的緊急避難包，就是像媽祖婆學習，所需內容物小橘書也有詳細記載。劉世芳感謝鍾東錦及縣府團隊、各鄉鎮市公所、村里長協助在縣內發送21萬本小橘書到各戶家庭，籲請鄉親多多閱讀，除了防災觀念、緊急避難包準備物品，另也能了解警報發布訊號，第一時間做出因應。國泰民安、風調雨順是眾人所祈，保全生命財產安全是首要，期許藉此「台灣全民安全指引」及媽祖的庇佑，大家家戶平安。會後，劉世芳表示，前兩天天氣冷，活動安排在室內，今天天氣好，為了希望讓更多香客能聽見，經她向鍾縣長及拱天宮人員反映後，同意改在廟口開講；調整音響花了點時間，可惜受限空間較小，不然「替代役公益大使團」表演會更精采。苗栗縣長鍾東錦讚許「廟口開講才有FEEL」，還誇內政部長劉世芳是「女中豪傑」。（記者彭健禮攝）內政部與非六都16個縣市宮廟合作辦理「台灣全民安全指引宣講會」，今日下午在苗栗縣通霄鎮白沙屯拱天宮舉辦，內政部長劉世芳到場主講。（記者彭健禮攝）    ,https://news.ltn.com.tw/news/politics/breakingnews/5279166
兩岸觀光「北京頻釋善意台灣躊躇不前」？陸委會駁斥不實報導,政治,2025/12/15 20:06,針對《中國時報》報導聲稱，「禁團令未解，兩岸今年觀光逆差」及「北京頻釋善意，台灣躊躇不前」，陸委會今日駁斥報導不實。示意圖。（資料照）針對《中國時報》報導聲稱，「禁團令未解，兩岸今年觀光逆差」及「北京頻釋善意，台灣躊躇不前」，陸委會今日駁斥報導不實，直指報導對政府兩岸觀光政策諸多曲解，對兩岸互動不明就理、誤導民眾認知。陸委會指出，政府持續展現善意，過去已宣示的政策不會改變，也沒有改變，只要中方正面回應，即可推進。一、政府逐步恢復兩岸健康有序交流，推動兩岸雙向平衡觀光的政策沒有改變。我方希望以對話取代對抗，交流取代圍堵。請繼續往下閱讀...陸委會批評，反觀中方持續對台軍事壓迫、跨境鎮壓，升高兩岸緊張情勢，造成兩岸交流阻礙。我方呼籲中方停止複合施壓，為恢復兩岸觀光交流創造有利條件。陸委會強調，二、政府維護國人赴中旅遊安全的政策沒有改變。近年中方持續增修國安法規、發布「懲獨22條意見」，恣意膨脹國安定義及司法管轄範圍，今年1月至11月接獲國人赴中失蹤、遭留置盤查，限制人身自由的陳情案例累計已達201人，為去年全年55人將近4倍，更存在為數不少家屬不願曝光黑數。陸委會說明，過去國人赴中旅遊遇有緊急事故或旅遊糾紛等事件，可由觀光「小兩會」即時聯繫處理，惟因中方片面中斷雙方聯繫，導致國人赴中旅遊品質、安全等問題無法獲得有效處理及保障，赴中旅遊風險上升。解除「禁團令」，仍必須以中方保證維護國人赴陸旅遊安全為前提。陸委會提及，政府歡迎中客來台觀光的政策沒有改變。政府歡迎世界各地旅客包含中國旅客來台觀光。政府已就可操之在我的部分推動，包括恢復第三地中客來台觀光、中客到金門及馬祖旅遊。至於中客來台觀光，因須中方核發大通證，期待兩岸雙方相互配合，避免過去亂象再度發生，也希望減少過度依賴單一市場。陸委會也說，恢復兩岸觀光，須先由「小兩會」溝通的政策沒有改變。中客來台觀光已中斷多年，國人赴中旅遊人身安全，也因中方不斷增修新規而產生新的威脅，必須由雙方業務主管部門就相關事項進行協調及溝通，並避免過去亂象。尤其中方慣以觀光作為經濟脅迫工具，近期中方因為日本高市首相涉台發言，而暫停中客赴日旅遊即為明例。陸委會表示，為確保兩岸旅遊安全、品質、穩定性、公平性等，我方台旅會已於今年2月正式去函海旅會表達溝通的意願，若中方有恢復兩岸觀光的誠意，應由海旅會盡速回覆我方。依陸委會今年10月份所作民調，逾7成民眾（73.2%）支持政府「先溝通，再開放」的作法。政府要再次強調，兩岸觀光「小兩會」的溝通，從不涉及政治問題，沒有政治化的問題。由於溝通事項涉及公權力，並非民間旅遊公協會或業者與中方的交流可替代，希望中方務實處理。陸委會指出，政府已重申善意及恢復健康有序兩岸觀光的堅定立場，呼籲中方為恢復兩岸觀光創造條件，而非設置障礙。請中方停止對台軍事脅迫、跨境鎮壓，儘速由海旅會回覆我方2月去函才是正辦，任何不實指摘及放話，只會對兩岸關係造成負影響，無助於推動恢復兩岸觀光政策。    ,https://news.ltn.com.tw/news/politics/breakingnews/5279181
中國成美國首要戰略對手 余茂春：保護台灣也是保護美國利益,政治,2025/12/15 19:38,美國華府智庫「哈德遜研究所」中國中心主任余茂春出席臺灣教授協會舉辦的座談會，從中共犯台意圖及川普總統的印太戰略，談台灣強化自衛能量及區域安全合作必要性。（記者林正堃攝）針對美國軍事戰略佈局，美國總統川普首次任期的中國政策重要智囊、現任華府智庫「哈德遜研究所」中國中心主任余茂春今日表示，川普總統上任後將美國首要戰略敵人從俄羅斯轉移至中國，且較於前任總統拜登更著重於「嚇阻」。此外，在台灣不受中共侵犯議題上，保護台灣不只是保護台灣利益，也是美國利益。台灣教授協會今日邀請華府哈德森智庫資深研究員兼中國研究部主任余茂春、前國防部長蔡明憲、台灣教授協會長薛化元於濟南教會召開從中共犯台意圖及川普總統的印太戰略，談台灣強化自我防衛能量及區域安全合作的必要性」論壇。請繼續往下閱讀...針對美國國防安全戰略變革與演進，余茂春指出，首次出現重大戰略轉變的時間是在1947年，因應蘇聯擴張，美國通過「國家安全法」整合工業、科技、國防、情報及教育體系，將對付蘇聯所領導的共產主義，作為目標建立冷戰時期的戰略架構。余茂春續指，近期的戰略改變則發生於2015年川普宣布競選總統開始，川普2016年當選美國總統後，在2017年10月推出國家安全戰略，將首要戰略敵人從俄羅斯轉移至中國。其原因包含，俄羅斯經濟實力不足中國十分之一，加上中共近年來軍備發展迅速。對比川普、前美國總統拜登在對中戰略的差異，余茂春分析，拜登提出「競爭與合作」的政策略述；相較之下，川普更著重於嚇阻。余茂春說明，嚇阻的方式包含，提升盟友國際地位包括強化澳洲與日本的角色，並與盟友共同防禦、分擔安全責任，若盟友沒有決心，美國也不會給予幫助。他列舉，川普的國防觀以自我防衛、全民皆兵為核心，如以色列在美國不同意的情況下，仍以自身利益行動，美國一方面譴責其軍事行動，同時又持續援助；而韓國則與美軍指揮體系整合度高，且韓國的軍事、半導體工業也深度連結國防。談及台灣，余茂春表示，美國一直以來將台灣視為亞洲民主燈塔、自由象徵，近期除美國外，澳日歐洲等國更強調保護台灣的必要性，在台灣存亡、不受中共侵犯等議題上，保護台灣不只是台灣利益、也是美國利益，既是利他主義，也是利己主義。若台灣失守，第一島鏈戰略將遭受重大破壞，而丟了身為半導體工業世界龍頭的台灣，對美國打擊很大。    ,https://news.ltn.com.tw/news/politics/breakingnews/5279149
卓榮泰不副署財劃法 侯友宜：政治衝突難解僵局,政治,2025/12/15 19:33,新北市長侯友宜表示，訴諸政治衝突無法解決僵局。（資料照）行政院長卓榮泰今天宣布不副署財政收支劃分法，新北市長侯友宜表示，訴諸政治衝突無法解決僵局；新北市政府財政局長陳榮貴說，不影響新北市府115年度總預算案編列。此外，苗栗縣長鍾東錦表示，苗栗財政仍受中央控管，殷切寄望盡快實施財劃法，改善地方財政，順利推動縣政。財劃法修法已三讀通過，應先實施，如果有檢討必要再檢討改進，「政治應該是妥協衝突，而不是一直衝突下去，沒完沒了」，現在僵住，唯有總統賴清德有足夠高度化解；如果一直朝野對抗，非國家、百姓之福。請繼續往下閱讀...卓榮泰稍早舉行記者會說，新版財劃法侵害行政權、修法過程違反公開透明實質討論民主原則、施行將造成國家發展有無法回復的重大危害，將依憲法不予副署。新北市府透過訊息告訴媒體，侯友宜表示，市府立場很清楚，就是確保市民最需要的福利與建設持續推動。陳榮貴告訴中央社記者，以目前情況，不影響115年度新北總預算案編列，計畫型補助及一般型補助應依預算法規定，可照前一年度金額補助撥款。    ,https://news.ltn.com.tw/news/politics/breakingnews/5279154
就職7周年 彰化市長林世賢談5大願景,政治,2025/12/15 19:23,彰化市長林世賢於就職7週年典禮上談未來5大願景。（記者湯世名攝）彰化市公所今天（15日）舉辦市長林世賢就職7周年典禮，林世賢在典禮上強調目前已初步建置3大國際戰略平台，並感性說出建立綠能基地、無人機科技、AI中心城、智慧製造、科技農業等5大願景，引領彰化朝向更創新、更永續、更國際化的城市目標穩健邁進。林世賢在典禮上表示，市公所榮獲鄉鎮市公所史上唯一「7個國家級大獎」的肯定，不僅反映建設成果，也象徵公務體系行政效率與政治文化的正向轉變。林世賢除了感謝市公所同仁的齊心投入，也向市民、全體里長及各社區發展協會理事長致意，強調城市進步不單單是靠市公所，而是全民共同努力的成果，才能累積出今日的豐碩成就。請繼續往下閱讀...面對產業轉型趨勢，林世賢指出，未來將以「綠能」與「AI算力中心」等新產業政策為核心，帶動彰化既有的精密機械、工具機等傳統產業升級，進一步切入無人載具、機器人、機器狗等高附加價值的產業鏈，打造更具競爭力的產業新樣貌。他並強調，彰化的市場不應侷限於國內，更要接軌國際、與世界組隊合作。目前已初步建置3大國際戰略平台，平台之一為「無人載具大聯盟」與「複合材料低碳聯盟」將組隊前進美國無人機戰略平台，爭取國際合作與商機。第2個平台是，市公所持續推動與印度交流，印度將是台灣連結中東、歐洲的重要門戶；另外，已與全球工業級3D列印領導廠商美商 Markforged 結盟，期盼以先進製造技術帶動產業升級、提升國際競爭力。彰化市長林世賢（右）就職7周年典禮座無虛席。（記者湯世名攝）    ,https://news.ltn.com.tw/news/politics/breakingnews/5279150
新聞360》藍白急了喊「不副署=獨裁」！律師邏輯打臉：濫權者心虛,政治,2025/12/15 19:22,全新的視界！新聞話題不漏接，快訂閱YouTube 【自由追新聞】，記得開啟小鈴鐺哦！    ,https://news.ltn.com.tw/news/politics/breakingnews/5279085
上校爸50歲退休爽領逾3千萬退休金 兒嗨喊：「謝謝藍白選民」,政治,2025/12/15 19:15,立法院國民黨團強推反年改修法，本月12日立法院會三讀通過國民黨版本再修正動議條文。（資料照）立法院國民黨團不顧民意多數反彈，上週五（12日）在民眾黨選擇「棄權」的情況下，挾人數優勢三讀通過「公務人員退休資遣撫卹法」部分條文修正案，引爆怒火，退撫基金恐提前破產的質疑聲浪不斷。「昆蟲達人」張永仁近日在社群以充滿嘲諷的語氣PO文表示，自己的父親是提早退休的中科院海軍上校，光是他一人領的退休金就超過3000萬，反年改修法通過，他絕對是「真心謝謝」藍白選民！張永仁近日在臉書發文，「我老爸是50歲不到就由蔣經國批准提早退休的中科院海軍上校，今年93歲。他一人領過的退休金早已超過3000萬。（何德何能是吧？）感謝啊怎麼可以不感謝！謝謝一堆不是軍公教還票投藍白的製杖北區，我老爸領更多就是我領更多。信不信，這幾年來每年過年，我們四兄弟夫妻八人都會拿到老爸給的一疊大約1公分的大紅包。（花不完的以後變遺產我還能分到1/4，該不該謝謝北區製杖朋友們啊？）」請繼續往下閱讀...張永仁接著酸：「對了，票投藍白的50歲以下軍公教選民，你們也沒聰明到哪裡去，被立法院藍白共匪惡修的反年改惡法所致，等你屆齡退休時年金早就破產，萬一真領不到那就恭喜戲鶴（台語：死好）啊！」貼文曝光後吸引上萬人按讚，「期待破產，一起爛，一起慘」、「安啦！過幾年會說法案過時是民進黨執政，所以是民進黨的錯，怎麼做都贏」、「反正搞垮臺灣是藍白的目的，我們60歲的年紀已經差不多個個離開了，剩下來的是新ㄧ代了，只能好自為之了」、「台灣人還不醒？選出這些垃圾立委！」、「罷免不了的結果逐一浮上檯面」、「不知道要多少迴力鏢才能打醒藍白選民」。    ,https://news.ltn.com.tw/news/politics/breakingnews/5279079
憲政首例！卓榮泰「不副署」財劃惡法 加註意見全文曝光,政治,2025/12/15 19:13,行政院長卓榮泰今天宣布，將依照憲法第37條規定，不予副署財劃法修正案，並強調已在總統令稿上加註意見，以示對憲法之忠誠。（擷取自卓榮泰臉書）藍白惡修「財劃法」掏空中央政府財政，府院高層拍板「不副署」、「不公布」，成憲政史上首例。行政院長卓榮泰今天宣布，將依照憲法第37條規定，不予副署財劃法修正案，並強調已在總統令稿上加註意見，以示對憲法之忠誠。賴總統批示內容為，「前次修法已有侵犯行政權之虞，行政院已申請釋憲在案，此次修法不僅削弱中央財政，影響施政決策，且擴大中央地方垂直及水平分配不均，破壞財政永續，加劇排擠政府推動重要民生政策，阻損守護國家安全及因應天然災變之能力。各方允應在合憲途徑下，建構兼顧中央財政韌性與地方均衡發展，讓國家能長治久安之制度」。請繼續往下閱讀...卓揆附加意見內容提到，「依憲法第37條規定，總統依法公布法律，須經行政院院長副署，而在憲法上，本院與立法院分別有預算提案權與議決權，以形成國家預算秩序」。卓揆更寫下，「惟立法院本次修正財劃法，過程與內容悖離民主原則及權力分立，侵害本院行政權，違憲重大且明顯。是本人為維護憲法賦予之預算編列權，並承擔施政責任，決定基於行政院院長副署權，就本次財劃法修正條文不予副署，以示對憲法之忠誠」。卓榮泰在行政院記者會上強調，他身為行政院長，如果被一個國會和政黨提出倒閣不信任案，那將會是他畢生的民主勳章。「我願意成為護憲的鬥士，我願意跟勇敢的國人站在一起，走上這一條護憲、護國的道路」。    ,https://news.ltn.com.tw/news/politics/breakingnews/5279057
藍白氣炸反控違憲 律師：不敢倒閣就證明卓揆不副署具憲法正當性,政治,2025/12/15 19:08,行政院長卓榮泰宣布不副署違憲的財劃法修法，藍白反過來痛罵中央這是「違憲亂政」。圖為國民黨團總召傅崐萁（右）和民眾黨團總召黃國昌（左）。（資料照）藍白聯手通過修惡版《財政收支劃分法》，還果斷否決政院所提覆議案，行政院長卓榮泰今天（15日）正式宣布將不副署，堅決捍衛民主憲政，讓藍白氣炸，反過來砲轟中央此舉才是「違憲亂政」，卓榮泰則霸氣表示立院反對的話可以依照憲法對他提出不信任案。對此，律師黃帝穎直言，藍白如果不敢提倒閣，即證明閣揆的不副署具憲法正當性，符合憲法忠誠！黃帝穎今天傍晚在臉書發文指出，面對卓揆宣布不副署《財劃法》修法，立法院在憲政上有兩大制衡行政院的機制。其一為提憲法訴訟主張閣揆應副署，「憲法法庭有權審判閣揆『不副署』法律是否違憲，針對國會過半通過的法律，卻因閣揆不副署無法生效，國會當然可以提憲法訴訟主張閣揆應副署，但藍白作法自斃，除非修法讓憲訴法回到常軌，否則國會已把自己憲法救濟途徑堵死。」請繼續往下閱讀...「藍白以《憲訴法》修惡及二度全面封殺大法官人事等手段癱瘓憲法法庭，目前已無大法官審查制衡『違憲惡法』，在全球民主國家中，台灣是唯一失去大法官守護民主憲政功能的國家，更凸顯閣揆『不副署』違憲惡法的憲政必要性及正當性。」其二為倒閣，「依據《憲法增修條文》第3條第2項第3款，立院有權對行政院長提出不信任案，但立法院如果不敢對閣揆提出不信任案，即代表行政院『守護民主憲政』的不副署具有高度憲法正當性。」最後黃帝穎直言，「藍白癱瘓憲法法庭，作法自斃，讓藍白只剩下『倒閣』選項，藍白若不敢倒閣，即證明閣揆保護人民、保護國家、守護民主憲政的『不副署』，符合憲法忠誠義務，具有高度憲法正當性。」    ,https://news.ltn.com.tw/news/politics/breakingnews/5278902
為參選暖身？基隆7區掛政績看板 童子瑋：迎接新一年起點,政治,2025/12/15 19:08,基隆市議長童子瑋今天（15日）在臉書貼文，他彙整自己及議會同仁意見爭取各個行政區的地方建設，圖為仁愛區的政績看板。（圖為基隆市議長童子瑋提供）民進黨基隆市長提名作業最快將在今年12月底前公布，外界普遍看好賴清德總統外甥、基隆市議長童子瑋將被徵召，代表民進黨披掛上陣。距離年底只剩下半個月，童子瑋於基隆7大行政區陸續掛出「年度服務重點報告」政績看板，他也在今天（15日）在個人臉書貼文表示，一年即將告一段落，希望將這一年來在各區的努力爭取的建設成果與民生福利，向市民報告，也作為迎接新一年的起點。童子瑋指出，這次所公布的政績看板，彙整了他與多位議會同仁，針對不同區域需求，向基隆市政府及中央爭取的重要建設與改善成果，涵蓋交通安全、公共空間、長照照顧與生活環境等市民最切身相關的議題。請繼續往下閱讀...在暖暖區，爭取改善暖暖運動公園壘球場設施，並協助升級暖同里照服據點設備，強化長者與社區照顧量能；信義區方面，成功爭取1813K客運新增清晨6點45分班次，回應通勤族需求，同時推動深澳坑路人行道改善，提升行人安全；安樂區則著重於社會照顧與學童通行安全，爭取關懷據點供餐福利，並改善校園周邊通學步道。在仁愛區，積極爭取南榮路人行空間改善工程，總經費達2億2千萬元，並推動騎樓整平4年期計畫，累計經費共3000萬元，同時爭取獅球嶺砲台歷史場景規劃，結合城市記憶與觀光潛力；中正區方面，推動真砂公園健康步道建設，提供市民更完善的休憩與運動環境。在中山區，成功爭取登山步道建設，串聯球子山至白米甕砲台，強化山海城市特色與觀光動線；七堵區則聚焦基礎建設與校園安全，爭取長興里產業道路災損修復，同時改善校園周邊通學步道，讓孩子上下學更安心。童子瑋強調，每一項成果的背後，都是市民朋友一次次的提醒與反映，是無數場會勘、電話聯繫，以及與市府、里長和地方團隊反覆討論所累積的成果。他強調，這些改變或許不一定立刻翻轉整座城市，但每一步進展，都承載著市民對生活改善的期待。童子瑋說，「謝謝每一位曾經向我反映問題、提供意見的民眾。」未來他將持續把市民需求放在心上，以更踏實、穩健的腳步，陪伴基隆大步向前，讓城市的每個角落，都能持續變得更好。基隆市議長童子瑋今天（15日）在臉書貼文，他彙整自己及議會同仁意見爭取各個行政區的地方建設，圖為中正區的政績看板，向市民報告的市政建設。（圖為基隆市議長童子瑋提供）基隆市議長童子瑋今天（15日）在臉書貼文，他彙整自己及議會同仁意見爭取各個行政區的地方建設，圖為安樂區的政績看板。（圖為基隆市議長童子瑋提供）    ,https://news.ltn.com.tw/news/politics/breakingnews/5279136
