Title,News_Type,date,content,url
分析「川習會」 外交部：美中競爭本質不變 中方利用「時差」手段談台灣未奏效,政治,2026/05/22 18:04,外交部最新書面報告分析指出，現階段美中透過元首外交尋求戰略穩定關係，惟其戰略競爭本質不變。（資料照）針對美國總統川普於本（5）月13至15日訪問中國，外交部最新書面報告分析指出，現階段美中透過元首外交尋求戰略穩定關係，惟戰略競爭本質不變；至於中方過去慣用時差優勢，多次搶先發布新聞聲明曲解美方發言，本次美方在公眾訊息的規畫上頗見用心，包括川普總統數度強調美國對台政策未變，並表示未對習近平就台灣議題作出承諾。今年首次川習會日前落幕，立法院外交及國防委員會下週一（25日）將邀請外交部長林佳龍、國安局局長蔡明彥報告「美中元首峰會後地緣政治新局對我國外交及總體國家安全之衝擊評估與因應」，併請陸委會列席，並備質詢。請繼續往下閱讀...外交部送抵立院最新書面報告指出，本次川習會雙方透過元首會晤及儀式性安排和友好言詞，均希望穩定美中關係。不過，習近平同時也提出美中應該避免陷入「修昔底德陷阱」，各界多稱其暗示東升西降，與美方競爭的野心一覽無遺。美中雖有意尋求「戰略穩定」，然美中競爭的本質並沒有改變。尤其美中戰略競爭下，雙方地緣政治目標恐非一致。美方也清楚瞭解中方野心，美國國務卿魯比歐會前即明確指出，中方野心不僅限於台灣、而是希望將實力投射至全世界，也強調，中國是美國首要地緣政治挑戰。外交部分析，除地緣政治外，美中兩國在AI、關鍵礦物等重要議題的核心利益也是南轅北轍。白宮科學與技術辦公室於4月23日發布備忘錄，指控中方大規模竊取美國人工智慧（AI）技術；財政部長Bessent翌（4/24）日受訪時指出，美需在對中AI競賽中勝出。正如同魯比歐國務卿先前表示，中國剽竊美國AI相關智慧財產權，已對美國構成嚴峻之國安及經濟威脅，美方雖尋求與中國達成戰略穩定，但不會忽視中國對美國的威脅。外交部說明，川普總統前次訪中隔（2018）年，美中即爆發關稅戰，美中本次會後包含採購、稀土供應等談判成果是否實際落實，以及會否牽動美中互動氣氛，將是外交部後續觀察重點。美國財長貝森特（Bessent）本月19日接受媒體訪問時也指出，中方在「實踐自身對於關鍵礦物的承諾上難謂理想」。關於中方輿論操作，外交部直言，中方搶先發布新聞稿，並單方面談及台灣，顯欲操作輿論方向。中方於首日擴大雙邊會談開始不到半小時，即搶先發布新聞稿，大篇幅闡述中國對台立場，美方該場次新聞聲明則隻字未提台灣。中方的操作明顯試圖引導國際與國內媒體聚焦於台灣相關議題。不過，外交部指出，中方過去慣用時差優勢，多次搶先發布新聞聲明曲解美方發言，我方曾多次提請美方注意中方手段，本次美方在公眾訊息的規畫上則頗見用心。包括川普總統數度強調美國對台政策未變，並表示，未對習近平就台灣議題作出承諾；國務卿魯比歐訪中前即兩度公開重申對台政策不變，以及對台海和平穩定的重視；去程在空軍一號接受專訪時，也指出在印太、台灣及其他地區，任何一種被迫改變現狀之情形，均不符合中國或任何一方之利益，該地區維持穩定相當重要；在首日雙邊會談後的專訪也提出完整涉台論述並揭露中方野心等。外交部續指，美國駐中大使龐德偉（David Perdue）、駐聯合國大使瓦爾茲（Mike Waltz）、美國貿易代表葛里爾（Jamieson Greer）及國務院會後多次再度重申美國對台政策不變。外交部認為，這些不僅是對中方釋出的嚇阻訊號，也是對理念相近國家傳遞的重要訊息。另，外交部也說明，川普總統已正式邀請習近平夫婦於今年9月24日訪美，王毅並證實習近平將於今年秋季訪美。此外，川普總統也表示，將視情況應邀於11月再度訪問中國參加APEC峰會，也希望習近平12月再度訪問美國參加G20峰會。今年川習可能仍有3次會晤機會，外交部將持續密切關注美中互動情形，並與美方緊密協調。    ,https://news.ltn.com.tw/news/politics/breakingnews/5446227
現身駁失智！馬英九砲轟蕭旭岑、王光慈 卻「叫錯律師姓名」,政治,2026/05/22 18:00,前總統馬英九出面說明自己的健康情形。（馬英九辦公室提供）前總統馬英九指控馬英九基金會前執行長蕭旭岑、王光慈破壞財政紀律一事持續延燒，外界更盛傳馬英九已失智。對此，馬英九今天在前國安會秘書長金溥聰、基金會代理執行長戴遐齡及律師陪同下錄製影片，駁斥相關傳聞。過程中，馬英九對著律師詢問，「你是簡律師嗎？」不過，對方其實是黃律師。馬英九辦公室今天提供的影片可看到，馬英九聲稱他失智的傳聞「非常可笑」，自己現在每天依然讀報看書及運動，與過去數十年並無二致。馬英九也火力全開，痛批蕭旭岑、王光慈是貪汙犯，培植他們十多年，又邀他們來共事，他對他們自然充分信任，萬萬沒想到，他們在財務上做了許多涉嫌刑法背信與侵占罪的事，讓他深感痛心疾首。請繼續往下閱讀...過程中，金溥聰詢問律師，看到的事證調查，是否都有參與？兩人是否有重大涉嫌的可能，總統是否也知道這樣的報告？律師則回應，前面有幾次董事會雖然流會，但還是有用會議的形式，向馬英九及會計師報告。金溥聰則點頭表示，換句話說，就是律師都有跟馬英九報告過他們涉嫌犯罪的事證。此時，馬英九突然抬頭問：「你是簡律師嗎？」律師則回答：「我是黃律師。」    ,https://news.ltn.com.tw/news/politics/breakingnews/5446158
稱馬英九聲明沒法律效力！律師王至德：更證實大家對失智的猜測,政治,2026/05/22 17:55,前總統馬英九出面說明自己的健康情形。（馬英九辦公室提供）馬英九基金會茶壺風暴持續延燒，馬英九今（22日）罕見發聲駁斥自己已失智，並對妻子周美青委託大姊馬以南擔任醫療照護執行者的聲明感到錯愕與遺憾。對此，律師王至德表示，馬英九的聲明「更證實了大家對於他失智的猜測」，因這個公開聲明根本沒有法律上的效力，反而只是讓大家產生更多的懷疑而已。王至德在臉書發文表示，看完馬英九打臉周美青與馬以南的聲明，更證實了大家對於他失智的猜測。如果是一個精神狀況正常的資深政治人物，那周美青跟馬以南無論怎麼說都不會影響自己。他認為，「正常的做法應該是盡快跟周美青、馬以南詢問她們是在發什麼神經，我馬英九的事情還輪不到妳們來幫我安排」，而不是急著公開聲明反擊。請繼續往下閱讀...王至德指出，反而是已經失去正常判斷能力的人，才會急著發這種公開聲明來反對周美青、馬以南的安排。因為這個公開聲明根本沒有什麼法律上的效力，反而只是讓大家產生更多的懷疑而已。由此可見，馬英九可能真的已經失去正常判斷事務的能力了。王至德強調，雖然目前網路上的影片看起來馬英九說話還是很清楚，不過失智的狀況本來就是時好時壞，很難從單一影片判斷是否有失智的狀況，「不過這個已經太專業了，應該要交給醫生評論。是說如果馬英九現在是完全正常的話，那不正常的就是周美青或馬以南了」。    ,https://news.ltn.com.tw/news/politics/breakingnews/5446212
藍營南投縣議員提名出爐  林昆熠、羅俞欣受矚目,政治,2026/05/22 17:51,南投縣議會正在進行定期會，下屆議員將在11月28日投票，藍綠陣營提名名單都已出爐。（資料照）國民黨今日公布南投縣議員各選區提名，最受矚目的是第二選區提名林昆熠，是現任議員唐曉棻的先生，算是回鍋參選，且外傳要角逐議長；第五選區提名的新人羅俞欣，是現任副議長潘一全的妻子，她將代夫出征。國民黨南投縣黨部今天公布各選區提名名單，第四選區和第六選區未提名，但第四選區有兩名新人報准參選；第一、第三選區各提名3人，而第二選區和第五選區各提名2人，都是現任議員和新人各1名。請繼續往下閱讀...第二選區除現任的李洲忠，「新人」則是現任草屯鎮農會理事長林昆熠，他在2010到2014年曾當過一屆縣議員，後宣布因生涯規劃不競選連任，後來由他的太太唐曉棻出馬參選，此次回鍋參選，且外傳要角逐議長。無獨有偶地，第五選區現任議員也僅提名林芳伃，另提名新人羅俞欣，她是現任副議長潘一全的太太，因潘一全受公職人員選罷法排黑條款的影響無法參選，由她代夫參選，外界也盛傳她是角逐副議長的人選。而民進黨南投縣黨部，早在2月下旬就進行縣議員等公職黨內登記，並確定提名名單，第一選區和第二選區、第五選區各提3人，其中第五選區的廖崑堯是新人，其餘皆是現任議員。第三、第四選區各提1人，外傳黨中央要徵召第一選區的現任議員沈夙崢轉戰南投市長，但她否認轉換跑道。縣黨部表示，目前維持該名單不變，提名人數也不會改變。    ,https://news.ltn.com.tw/news/politics/breakingnews/5446217
談軍售議題 外交部：美方強調對台政策不變 肯定賴總統傳達立場,政治,2026/05/22 17:51,外交部書面報告指出，美方於川習會前、中、後有節奏的傳遞「美對台政策不變」、「重視台海和平穩定、反對破壞現狀」等重要訊息。（資料照）針對川習會後美中互動，外交部書面報告指出，美方於川習會前、中、後有節奏的傳遞「美對台政策不變」、「重視台海和平穩定、反對破壞現狀」等重要訊息，彰顯美方對台灣議題的重視；至於軍售議題，美方已強調對台政策不變，華府政策圈亦呼籲持續對台軍售，並指出台灣並非挑釁方。美方對賴清德總統就川習會傳達之立場與就職兩週年演說，均予以肯定。美國總統川普本（5）月13至15日訪問中國，是自2017年以來時隔近十年再次訪中。立法院外交及國防委員會下週一（25日）將邀請外交部長林佳龍、國安局局長蔡明彥報告「美中元首峰會後地緣政治新局對我國外交及總體國家安全之衝擊評估與因應」，併請陸委會列席，並備質詢。請繼續往下閱讀...關於川普曾就軍售議題稱，取決於中國以及軍售為籌碼等，外交部在最新書面報告中表示，不便代其解讀其發言，但盼各界注及，美方長期的政策立場為是否逐步減少對台軍售，取決於中方對台威脅程度下之台灣防禦需求。此外，美駐中大使龐德偉（Perdue）也於會後專訪中強調，川普總統於台灣議題上堅守底線，任內對台軍售規模已超過自1979年以來歷任美國總統。外交部指出，美國在台協會（AIT）處長谷立言（Raymond Greene）日前接受專訪，也強調，美國對台政策不變，且已明確向中方表達此立場，美方持續關切台海現狀遭逐步侵蝕，因此高度重視透過強化台灣自我防衛能力，重建台海平衡。另外，華府政策圈高度關注川習會，並公開表達對台灣的支持；美國國會兩院跨黨派挺台力道強勁，包括聯邦眾院議長強生（Mike Johnson）於第一時間重申對台支持，並強調國會一向高度關切台海，且明確表達美方在台灣議題的立場是「台灣必須保持自主與安全（They need to stay independent and secure there）」。外交部續指，此外，多位跨黨派聯邦參、眾議院領袖級議員均已公開強調，美國應履行長期以來對台承諾，推動對台軍售，持續協助台灣取得必要之防衛性武器，並建立嚇阻力量；華府跨黨派智庫也指出，台灣從未挑釁，中方才是改變現狀之一方，呼籲持續對台軍售，強調對台軍售是為維持台海現狀，並涉及印太地區安全穩定及美國聲譽。外交部強調，賴清德總統已公開強調，維持台海及區域和平穩定現狀，是中華民國一貫且堅定的立場，也是台灣2300萬人民的最大共識，以及我們所要捍衛的現狀，沒有所謂的「台獨」問題。台美長期安全合作與軍售，不僅是美國對台灣的安全承諾，也是長久以來，反制破壞區域和平穩定的最重要嚇阻力量。外交部也指出，我方樂見谷立言表達美方歡迎賴總統重申維持兩岸現狀，以及希望北京不設前提與台灣民選領導人交流。美國國務院發言人也於5月20日針對賴總統就職兩週年談話表示，美國對台的堅定承諾仍持續，如同40多年來之立場，美國對台政策並未改變。美方期待與賴總統及台灣持續合作，推進雙方共同利益，並維護台海和平與穩定，另敦促北京停止對台軍事、外交及經濟施壓，轉而與台灣進行有意義的對話。外交部強調，穩定的美中關係與強健的台美關係並不衝突，美中的互動也不影響台美在各領域合作的持續深化。外交部亦將持續深化與美國的夥伴關係，透過「總合外交」及「三鏈戰略」的戰略布局，強化與美國等理念相近盟友的協調合作。    ,https://news.ltn.com.tw/news/politics/breakingnews/5446222
自由說新聞》北市新政狂出包！綠議員一句話蔣萬安尷尬了,政治,2026/05/22 17:45,全新的視界！新聞話題不漏接，快訂閱YouTube 【自由追新聞】，記得開啟小鈴鐺哦！    ,https://news.ltn.com.tw/news/politics/breakingnews/5446231
泰國失聯3天險遭「活摘器官」？台男說詞落差大真相恐反轉,政治,2026/05/22 17:42,"4月中旬泰國潑水節期間，台灣1名林姓男子在芭達雅失聯3天，返台後向媒體控訴遭設局下藥、險被「活摘器官」。潑水節示意圖。（法新社）4月中旬泰國潑水節期間，台灣1名林姓男子在芭達雅失聯3天，返台後向媒體控訴遭設局下藥、險被「活摘器官」。惟據了解，全案真相恐怕出現大反轉，當事人說詞與駐處協處過程落差甚大，且其行徑已嚴重排擠其他國人急難救助資源。林男日前接受媒體訪問時，聲稱遭泰籍女友與同行台灣友人設局下藥，被送往醫院後遭施打不明針劑，血壓一度降至20到30，並被推到房間綁起來控制，直到台灣朋友直飛泰國循線救出。請繼續往下閱讀...然而據中央社報導，芭達雅旅遊警察局駁斥林男說法，指該男是在警方護送下就醫，並無明顯外傷，亦無遭暴力對待跡象，疑似是飲酒後與泰籍女友爭執後獨自外出，因精神狀況異常經通報送醫。當地警方並強調，林男就醫的芭達雅帕塔瑪坤醫院為當地大型公立醫院，「不可能發生」器官買賣情事。芭達雅警方對林男返台後的指控感到訝異，表示「我們都是在幫他，他怎麼會這樣說？」知情人士指出，林男當時透過友人向我國駐泰代表處求助，駐處也立即提供相關協助，但聯繫過程中，林男本人多次處於失聯狀態，駐處同仁致電詢問其所在位置或事件經過時，林男不是拒接電話，就是接通後語焉不詳、隨即掛斷，情況反覆發生多次。該人士透露，我國外交人員最後竟發現，林男是在當地超商破壞店內物品，當地警方據報到場後發現其精神狀況異常，才將他送醫治療。林男因在過程中出現掙扎行為，遭到保護管束，而院方在進行醫療救治時，發現林男身上對多種藥物呈現陽性反應。另外，駐處原詢問林男是否需要安排探視，並提供必要協助，未料林男返台後並未通知駐館，而是直接接受媒體採訪，指控遭人設局、險被摘取器官。駐館更是看到國內新聞報導後，才知道林男已經自行返台並主動聯繫家屬。針對林男聲稱在醫院聽到醫護人員討論販賣其器官一事，知情人士直言，問題是，「他聽得懂泰文嗎？」此外，林男起初媒體報導指其赴泰是參加潑水節旅遊，後來又改口稱原本就在當地做生意，前後說詞有相當程度的落差。據了解，駐處後續也多次告知林男，可協助尋找通曉中文的當地律師，循正常法律程序對泰國警方調查提出救濟，但林男始終拒絕，反而持續向媒體投訴駐館未提供協助，實令外交部難辦。該人士指出，此案在泰國當地社群媒體已引發討論，部分泰方人士認為此類指控影響泰國觀光形象。他也感嘆，駐館緊急救助電話由外交人員24小時輪值，林男的行為形同亂撥119、110佔線，恐排擠真正有需求的國人同胞。針對前述知情人士說法，外交部表示，因涉及當事人隱私，不便對外說明協處過程細節。外交部將持續協助旅外國人緊急危難需求，也願協助當事人及家屬循法律救濟途徑維護自身權利。    ",https://news.ltn.com.tw/news/politics/breakingnews/5446165
藍委質疑花3億幫來台藝人宣傳演唱會 觀光署回應了,政治,2026/05/22 17:42,國民黨立委黃健豪。（資料照）立法院近日審查115年度中央政府總預算，國民黨立委黃健豪今天（22日）說，監督交通委員會相關預算時發現，今年第4季確定來台開演唱會的國際藝人，交通部觀光署花3億元宣傳，方式與目的都太淺薄，不知道是政府太有錢，還是根本不懂流行文化宣傳模式？他在接下來審議時會嚴格監督，刪減沒有效益的預算，為國人把關。觀光署說明，為強化國際觀光動能，今年預計推動「國際標竿型演唱會支持方案」，針對今年第4季來台在大型場館演唱的國際藝人，透過標案方式，請藝人在社群平台PO文宣傳將來台辦演唱會，或是透過駐外館投放演唱會相關資訊廣告，目的是希望讓其它國家知道台灣有能力、也歡迎各國藝人來辦演唱會，藉此讓更多外國觀光客來台，今年度共編列3億元。請繼續往下閱讀...黃健豪指出，相較新加坡2024年邀請泰勒斯獨家（東南亞地區）舉辦6場演唱會，從演出許可、簽證辦理到設備通關一站式服務。而30萬張門票採抽籤方式，創造2200萬筆註冊登記紀錄；同時與飯店結合，超過60萬名用戶湧入APP搶購演唱會門票和住宿體驗等項目。分析師估計，泰勒絲演唱會帶動的相關旅遊收入約台幣百億元，估計佔新加坡第一季國內生產總值的0.2％。逼使亞洲許多國家為競爭演唱會經濟，紛紛提出修法或優惠方案，這已經成為國家級投資競爭項目。黃健豪認為，相較於亞洲其他國家，觀光署這3億元方案顯得太淺薄。已經確定來台做大型演唱會的藝人，本來就會進行各種實體與線上宣傳，不需要觀光署再花錢要藝人提到來台表演，何況歌迷本來就會注意歌手的動態，不需要額外花錢提醒。這筆錢既不是邀請大咖藝人來台表演，也沒讓地方政府參與或對歌迷有所優惠，3億元就只是投放廣告宣傳來台，亞洲各國拚演唱會經濟，觀光署連抄都不會抄。黃健豪說，這筆錢是由觀光署公務預算撥補3億元到觀光發展基金，執行「國際標竿型演唱會支持方案」。他將嚴審這筆計畫，同時嚴查其它相關計畫，不能讓納稅錢這麼隨便花掉，也希望相關單位能提出更加嚴謹專業、對台灣觀光發展有實質幫助的計畫。    ,https://news.ltn.com.tw/news/politics/breakingnews/5446146
賴士葆拋加碼「生1胎給百萬」 卓榮泰：更要考慮財政問題,政治,2026/05/22 17:37,行政院長卓榮泰今到立法院備詢。（記者陳逸寬攝）面對少子化，賴清德總統宣布0到18歲每人每月5000元成長津貼重大福利政策，引起各界關注。國民黨立委賴士葆今質詢表示，因應少子化年編1200多億元預算，去年出生數卻僅10萬7千人，台灣面臨亡國危機，雖然不反對補助大方向，但明年就要實施，每年高達2000億元的財源從何而來？對弱勢家庭而言，每月5千仍不夠，政府不如認真思考「生一胎給一百萬」政策。行政院長卓榮泰回應，這更要考慮財政問題了。賴士葆指出，少子化一年編列1200多億預算，結果去年出生數僅10萬7千，不到死亡人數一半，很可憐！說起來台灣快要亡國。卓榮泰回應，所以政府必須要有一個新的對策，每人每月5千只是一部分政策。請繼續往下閱讀...對於全新的少子化政策，賴士葆指出，這個方向沒有人反對，大方向一起努力，但有幾個要考慮，第一、每年要2千億從哪來？明年就要開始實施了。卓榮泰回應，考慮這個政策時，當然有考量國家財政結構跟能力。賴士葆表示，「你講的很簡單」，但對於一些比較辛苦弱勢的家庭，還是不夠啦！老實講，還不如提出政策說生一胎給一百萬，這更好，請政府認真思考，「我算過，這沒有多少錢」。卓榮泰僅回應，這樣更要考慮財政問題了。    ,https://news.ltn.com.tw/news/politics/breakingnews/5446218
馬英九發聲駁失智！他直言：周美青朝夕相處最清楚日常精神狀態,政治,2026/05/22 17:35,前總統馬英九及夫人周美青。（資料照）馬英九基金會茶壺風暴持續延燒，馬英九妻子周美青昨（21日）發出聲明，考量馬英九日後醫療需求與照護等安排，委請大姐馬以南作為主要執行者。不過馬英九今出面駁斥失智，還對聲明「深感錯愕與遺憾」，且完全不能同意馬以南的主張。對此，媒體人趙曉慧表示，周美青身為每天朝夕相處的太太，最清楚馬英九的日常精神狀態，直言「我寧願相信周美青」。趙曉慧在臉書發文表示，周美青長年以來的形象就是「酷酷姐」，她一向遠離政治、忠於自己，不願當馬英九的官太太。她身為每天朝夕相處的太太，最清楚馬英九的日常精神狀態，她會選擇發表聲明，通常是基於保護家人、希望外界給予空間的務實態度。趙曉慧認為，周美青不需要為了政黨的顏面去粉飾太平，所以她的觀察往往最沒有政治水分。請繼續往下閱讀...趙曉慧指出，而馬以南的聲明是「馬家人」宗親的代表，阻止馬英九的健康狀況被拿來當作政治話題。至於馬英九本人的駁斥，對一個當過8年總統、自豪締造兩岸歷史定位的人，要他承認自己「失智」在心理上是極大的打擊。她認為，馬英九親自出面駁斥，很大一部分是為了維持政治尊嚴，證明自己還能戰、還清醒。但這往往是出於意志力，而非醫學上的真實狀態。政治人物的「意志」可以假裝，但日常生活的「細節」騙不了人。如果要證明自己沒有失智，何必發表聲明呢？趙曉慧分析，失智症患者常見的徵兆，是反覆詢問同一個問題，眼神惶然或詞不達意。所以最有效的證明，就是公開、無劇本的即時互動。她說，若馬英九接受媒體即時聯訪，親自站到鎂光燈前，面對記者隨機、甚至具備攻擊性的提問，能夠在不看讀稿機的情況下，邏輯清晰、引經據典地給出回應，才能證明自己沒有失智。趙曉慧也感嘆地說，再精彩的人生，終究有「登出」的一天。不如趁著自己的狀態還有最後一點體面的時候，選擇轉身告別。    ,https://news.ltn.com.tw/news/politics/breakingnews/5446129
