Title,News_Type,date,content,url
管碧玲po共艦擾台圖挨告洩密 北檢派黑金組主任分「他字案」偵辦,社會,2026/04/13 17:55,海委會主委管碧玲批評中國共機共艦長期對台侵擾，6日晚公布6艘共艦、2艘海警船位在台海周邊位置。（擷取自管碧玲臉書）海委會主委管碧玲近期在臉書發布「海面態勢圖」，引發藍營質疑涉嫌洩密，國民黨台北、新北市議員擬參選人楊智伃、鄧凱勛認定她涉犯洩漏交付國防秘密等罪，9日（上週四）前往台北地檢署告發。據了解，北檢收案後，目前已依程序分「他」字案辦理，並指派檢肅黑金專組主任檢察官負責偵辦。事情起因於管碧玲在社群平台發文，為捍衛海巡執法立場並還原現場真相，對外公開了一份「海面態勢圖」。不過，國民黨陣營質疑，該圖詳細標註兩岸艦艇的位置、航跡以及敏感的海域參數，認為相關資訊未經去識別化，恐讓對岸掌握我方海巡與海軍的偵巡節奏與部署邏輯，涉及國安風險。請繼續往下閱讀...國防部長顧立雄日前受訪時則回應，該圖屬經去機敏化處理的「示意圖」性質，並未呈現確切船艦位置，包括航位、經緯度及時間等具體資訊，此類示意圖係將資料去機敏化後，套疊於公開地圖上，僅供說明用途；國防部過去在中共對台針對性軍演期間，也曾以類似示意圖方式對外說明相關動態。楊智伃、鄧凱勛於告發時指出，管碧玲身為中央部會首長，卻為了政治辯護而輕忽國安風險，將國防秘密當作個人政治攻防籌碼，行為涉犯刑法第109條「洩漏或交付國防秘密罪」、132條「洩漏國防以外秘密罪」等罪嫌。據了解，北檢完成收案後，目前已正式編列「他」字案偵辦中，檢方後續將先確認該「海面態勢圖」是否屬依法應保密的國防或公務機密，以及公開內容是否已完成必要去識別化程序，評估是否涉及刑事責任。    ,https://news.ltn.com.tw/news/society/breakingnews/5402555
南投露營業者兒涉性侵案外案 仁愛分局刑警洩密筆錄被起訴,社會,2026/04/13 17:39,南投仁愛鄉某露營區許姓業者的兒子，涉性侵15歲少女疑案扯出案外案，承辦該案的包姓偵查佐被依洩密罪嫌起訴。此為露營區外觀照。（資料照）15歲少女去年8月與家人到仁愛鄉某露營區慶生，疑遭許姓業者的兒子性侵，露營區業者當時公開強調「非性侵」，為文內容露餡而扯出案外案，被害人控訴仁愛包姓偵查佐讓許男和謝姓假律師拍下相關資料，包姓偵查佐被檢方以洩密罪嫌起訴，仁愛警方強調，後續會追究行政責任。1名15歲少女去年剛錄取明星高中，去年8月其母帶她和其他朋友到仁愛鄉露營區慶生，該少女疑遭露營區許姓負責人的兒子性侵，這對母女幾近崩潰，報警提告，其友人並在各網路平台揭露此事引發熱議。請繼續往下閱讀...當時該露營區許姓業者公開在網路貼文道歉，指當天是少女主動要認識其兒子，兒子和少女互動融洽，且是女生主動來認識其子，監視器有拍到2人手牽手；兒子與未成年少女發生性行為，會負責到底，如果法院認定有罪，兒子就必須接受法律制裁。由於許姓業者回應文提到「少女主動想認識其子，也刊載在警訊筆錄中…」等文字，回應的文字中露了餡，被害人再提告偵辦案件的包姓偵查佐，及自稱是律師的謝姓男子。南投地檢署近日以對14歲以上未滿16歲少女妨害性自主罪嫌起訴許男，另以洩漏國防以外秘密罪嫌起訴包姓偵查佐，並以詐欺、妨害秘密、違反律師法等罪嫌起訴謝姓男子。仁愛警分局針對包姓偵查佐涉洩密案強調，後續該分局會追究包員的行政疏失及各級幹部監督不周責任，並會加強內部管理及員警法治觀念教育。    ,https://news.ltn.com.tw/news/society/breakingnews/5402537
香燈腳累過頭 彰化火車站月台擦撞列車,社會,2026/04/13 17:10,彰化火車站湧入不少參加白沙屯媽祖進香的香燈腳。（圖由民眾提供）台鐵彰化火車站今天（13日）下午發生一起驚險事件，1名參加白沙屯媽祖徒步遶境的香燈腳站在月台時突然暈眩往前傾，不慎擦撞到一列正在緩慢行進的列車，所幸有民眾發現大聲呼喊，台鐵人員及時呼叫列車停車，並未發生嚴重意外，該名香燈腳向台鐵人員表示是因疲勞過度而暈眩，並表示拒絕送醫後自行離開，虛驚一場。台鐵公司今天下午發聲明表示，中午12點半時彰化站2股道執行2521次到站清車完畢，進行編組調移行進中，忽有一名旅客往列車方向傾倒遭擦撞倒於月台上，車長即刻以行調電話呼喊停車，車站同仁同時上前關懷旅客及通知119救護。據旅客自述因疲勞過度而暈眩，並拒絕送醫自行離開。請繼續往下閱讀...由於白沙屯媽祖即將在明天清晨進入彰化市，彰化火車站今天湧入不少香燈腳，該名遭擦撞的民眾頭戴白沙屯帽子，疑似參加遶境進香的香燈腳，是否因為徒步進香過累而暈眩，或正好要搭車到台中參加進香活動，還要進一步釐清。    ,https://news.ltn.com.tw/news/society/breakingnews/5402504
台中警斬斷「喪屍」毒脈 逮捕藥頭起出槍、彈送辦,社會,2026/04/13 17:07,台中市第三分局去年8月逮捕販毒的李姓男子，並在現場起出改造手槍、子彈。（記者陳建志翻攝）台中市第三分局偵查隊去年破獲毒品案件向上溯源，發現李姓男子（49歲）是供貨的藥頭，且還擁槍自重，去年8月前往李男在大雅的住處搜索、查緝，當場逮捕李男，現場查獲海洛英、依託咪酯「喪屍菸彈」等市價約110萬的大批毒品，還起出改造手槍1支、子彈6顆，檢方近日偵結，依販賣毒品、非法持有槍枝等罪嫌將他起訴。台中市警局第三分局偵查隊長詹前祈表示，去年偵查毒品案件查獲「藥腳」，經向上溯源，鎖定李姓嫌犯（49歲）涉嫌販毒，且疑似擁槍自重。立刻報請台中地檢署檢察官指揮偵辦，經暗中蒐證，待時機成熟，去年8月持搜索票前往李嫌位於大雅區住處執行搜索，當場將他逮捕。請繼續往下閱讀...警方並在屋內查獲改造手槍1支、子彈6顆，以及海洛因、安非他命、依託咪酯粉末、依託咪酯菸彈、依託咪酯油等毒品，總重共450公克，市價約新台幣110萬元；現場另查扣攪拌器、量杯、磅秤、分裝袋等大批毒品分裝工具，宛如小型毒品加工廠。全案經警詢後，依違反《槍砲彈藥刀械管制條例》、《毒品危害防制條例》等罪嫌移送台中地方檢察署偵辦，檢方近日偵結，將李男依販賣毒品、非法持有槍枝等罪嫌起訴。台中市第三分局去年8月逮捕販毒的李姓男子，並在現場起出大批毒品。（記者陳建志翻攝）    ,https://news.ltn.com.tw/news/society/breakingnews/5402501
高金素梅親信張俊傑 延押禁見2個月,社會,2026/04/13 16:27,無黨籍立委高金素梅的助理張俊傑。（資料照）無黨籍立法委員高金素梅，涉嫌詐領助理費、違法輸入中國快篩試劑、利用協會詐領補助款，台北地檢署今年2月11日聲押禁見高金素梅的國會辦公室前主任、現任助理張俊傑（歌手Matzka的岳父）獲准；由於押期2個月將屆，檢方聲請延押，台北地院裁准延押禁見2個月。北檢指出，高金素梅團隊疑涉不法，據悉，偵辦方向有三，一是疑以人頭充任助理，向立法院詐領助理費；二是涉以人頭違法輸入中國製快篩試劑，且用途非屬自用；三為透過其成立的「台灣原住民多族群文化交流協會」與廠商合作，向原民會、台電、中油申請補助款，辦活動也疑有浮報經費。請繼續往下閱讀...檢調追查發現，張俊傑過去曾為高金素梅辦公室主任，現為其立院助理，高金素梅涉詐領台灣原住民多族群文化交流協會補助款，而張俊傑疑似為協會的實際負責人，是本案的幕後核心要角，除掌控補助款的作業流程外，還涉嫌利用女兒雲雅舜帳戶收補助款來掩蓋金流，並蒐集人頭名單供輸入中製筷篩試劑使用。據悉，檢調原先以國安法立案調查，進一步追出高金涉貪情事，涉案三大區塊分別是利用人頭充當助理向立院詐領補助款、違法輸入中國製快篩劑且非供己用、透過原住民多族群文化交流協會向原民會、國營事業詐領補助款，全案朝涉犯貪污治罪條例中的利用職務機會詐取財物、醫療器材管理法及刑法詐欺等罪嫌偵辦。北檢今年2月發動搜索約談18名被告後，聲押禁見張俊傑獲准，並諭知高金素梅100萬元交保，其餘部分交保、部分請回。持續偵辦中，檢方聲請延押禁見張俊傑獲准，押期至6月10日。    ,https://news.ltn.com.tw/news/society/breakingnews/5402412
台中女子上週五傳身體不適  今被發現命喪租屋處,社會,2026/04/13 16:22,台中市一名穆姓女子上週五曾向同事表示身體不舒服，今天未上班卻被發現死在租屋處。（記者陳建志攝）台中一名穆姓女子（46歲），上週五曾跟同事表示身體不舒服，今天上午沒有到公司上班，聯繫也沒回應，同事覺得奇怪，近中午時前往西屯區工業區三十八路租屋處查看，並連繫警消到場破門，進屋後發現已經明顯死亡，初步懷疑是疾病因素，將報請台中地檢署檢察官相驗釐清。台中市消防局今天上午11點47分接獲員警轉報，表示西屯區工業區三十八路一處出租套房需協助破門，立刻派遣犁份分隊及工業區分隊，出動消防車2輛、救護車1輛，以及8名消防人員，由犁份分隊小隊長莊家榮帶隊前往搶救。請繼續往下閱讀...到場後有民眾表示，穆姓女同事上週五有反應身體不舒服，今天早上未到公司上班，破門後發現穆女在房內已明顯死亡，初步懷疑是疾病因素，不過詳細死因將由檢方會同法醫相驗釐清。    ,https://news.ltn.com.tw/news/society/breakingnews/5402417
台南鹽水轎車、機車對撞 2人傷重不治,社會,2026/04/13 15:49,台19線台南鹽水舊營段一處彎道的路口，在北向車道發生轎車和機車對撞事故，造成開車的女駕駛、機車騎士雙雙傷重不治。（民眾提供）台19線台南鹽水舊營段今天（13日）傳轎車和機車對撞，轎車丁姓女駕駛、機車楊姓騎士皆70歲，送醫後雙雙不治，車禍原因有待調查釐清。車禍地點在台19線舊營段一處彎道，70歲楊姓男子騎機車要回舊營住家，疑從台19轉入舊營產業道路，與70歲丁姓婦人駕駛的轎車往北在路口發生碰撞；因撞擊力大，轎車往前推行後再撞上路旁護墩，車頭毀損，楊男倒地不起，丁婦一度受困車內，都OHCA失去生命徵象。請繼續往下閱讀...台南市消防局第一大隊調派鹽水、新營消防分隊8人趕往救援，將楊男送至柳營奇美醫院急救，丁婦則被送至衛福部新營醫院急救，但因傷重，都宣告不治。肇事路段、路口並無監視器，肇事原因由新營警方調查釐清。台19線台南鹽水舊營段發生重大車禍，轎車撞機車後再撞護墩，開車的婦人由消防隊救護人員現場急救，送醫仍告不治。（民眾提供）    ,https://news.ltn.com.tw/news/society/breakingnews/5402372
李貞秀抓耙仔2-1》檢舉函曝光！她控高虹安與男友合謀詐助理費、替鴻海喬案,社會,2026/04/13 15:47,民眾黨立委李貞秀。（記者廖振輝攝）民眾黨立委李貞秀上任以來爭議不斷，本報日前獨家報導，新竹市長高虹安過去涉助理費案時，李貞秀是向檢調檢舉的證人之一，以「內部吹哨者」名義簽名。如今該份檢舉函也曝光，李貞秀當時檢舉高虹安的男友李忠庭當人頭助理申請公費助理補助費，其補助費卻未用於立委公務上，並藉由立院與永齡基金會之雙重身分獲取不法所得超過千萬，更指高明顯知道自己涉貪並規避。李貞秀在檢舉函提到，高虹安透過男友李忠庭當人頭助理申請公費助理補助費，其補助並未使用於立委公務上，且自2020年至2021年間，高虹安及李忠庭基於違反貪污治罪條例及政治獻金等犯意聯絡，藉由立法院與永齡基金會之雙重身分獲取不法所得，超過新台幣千萬元，規避政治獻金法，進行利益輸送。請繼續往下閱讀...該檢舉函提及，兩人替鴻海集團找來相關部會，就鴻海的問題進行協商，及醫療三法立法的推動等，有違反貪污治罪條例及政治獻金法之嫌，其中李忠庭雖以公費助理身分任高虹安國會辦公室助理，但實際任職於永齡基金會，幾乎未進出委員辦公室，更未進行立法院辦公室實質工作，薪資由高虹安領取供2人私人支配使用，並未使用於立委公務之上。檢舉函也寫出，李忠庭每月於永齡基金會收取50萬元，年收入達600萬元，與永齡基金會其他雇員薪水有極大落差，而他的工作內容也沒有在替永齡基金會從事健康、文教等方面公益事業，該等薪資收入顯然非正常薪資，疑似充作高虹安政治獻金。「李忠庭與高虹安兩人金錢往來密切，近期新竹市長選舉，高虹安地方事務與辦公室資金都要由李忠庭掌管，必須經過他核可之後才會撥款，帳戶資金往來複雜，大到活動經費，小到辦公室零用都由其統一管控，可說是高虹安的實質大掌櫃。」檢舉函指出，高虹安在擔任新竹縣市、台中黨部主委期間，相關宣傳經費與發包案件也均跨過正常簽核途徑，而係由李忠庭處理，該黨部資金運用除李忠庭、高虹安2人知悉外，並無第三人可以置喙。最後李貞秀更以「內部吹哨者」名義簽名：「本案茲事體大，本人身為內部吹哨者，希望能保守本人之身分資料」。民眾黨立委李貞秀被日前本報揭露是檢舉新竹市長高虹安涉貪助理費案的檢舉人；據悉，該案檢舉函是2022年10月送到調查局，此事在2023年下半年就開始在民眾黨內盛傳，甚至近兩年來開始有不少人稱有看過此檢舉信，民眾黨去年8月召開黨代表大會時，就有黨代表說李貞秀是高虹安案的「抓耙仔」，認為黨不該讓她當立委。李貞秀抓耙仔2-2》一度願請辭卻反悔 獅子大開口要黨負責生活問題民眾黨立委李貞秀2022年10月的檢舉函。（記者楊心慧翻攝）民眾黨立委李貞秀2022年10月的檢舉函。（記者楊心慧翻攝）    ,https://news.ltn.com.tw/news/society/breakingnews/5402367
少女只顧低頭滑手機惹怒大叔嗆：再看就摔手機   挨告恐嚇判刑,社會,2026/04/13 15:40,少女只顧低頭滑手機惹怒大叔。（情境照）大叔別多管閒事！高雄市杜姓男子去年3月，邀約才剛認識的2名未成年少女到朋友的聚會場所聊天作樂，未料，2名少女到場只顧低頭滑手機，不與人互動，杜男怒嗆「再看手機就摔你們的手機」，過程被少女PO上IG並報警提告，杜男被依成年人故意對少年犯恐嚇危害安全罪，處有期徒刑3月。可上訴。判決指出，杜男與A女、B女素不相識，但從樣貌以觀，A女、B女均為未成年人，去年3月6日23時許，杜邀約剛認識的A女、B女至朋友的鐵皮屋內一起飲酒聊天，2女應邀前往。請繼續往下閱讀...但與大家初次見面的A女、B女有點害羞，2女只顧低頭使用手機而不與其及在場友人聊天作樂，杜男語帶威脅對A女、B女稱：「再看手機就摔你們的手機」，恫嚇A女、B女使其等均心生畏懼。少女事後將這段過程PO上IG，經B女向六龜警分局報案訴警偵辦，經調閱監視器、以及相關證人，杜男坦承所為，法官根據被害人A女及告訴人B女張貼之IG限時動態截圖、被害人A女與告訴人B女間之對話紀錄截圖、告訴人B女與友人之對話紀錄等，認定杜男涉犯成年人故意對少年犯恐嚇危害安全罪，處有期徒刑3月，得易科罰金9萬元。    ,https://news.ltn.com.tw/news/society/breakingnews/5402363
嘉縣義竹消防隊新廳舍融入鴿笭文化 屋頂營造休憩空間,社會,2026/04/13 15:34,義竹消防分隊建物外觀有格柵設計。（記者林宜樟攝）嘉義縣政府投入7000多萬元經費興建義竹消防分隊廳舍，建物結合在地鴿笭文化意象及消防鳳凰徽章形象，兼具防災機能與休憩功能，屋預計本月底完工，9月進駐，提升消防人員值勤品質並提供休憩空間。嘉義縣長翁章梁今天與縣議員翁聰賢、義竹鄉代表會主席黃金獅、縣消防局長蔡建安等視察義竹消防分隊廳舍工程進度、品質管理及施工安全措施。請繼續往下閱讀...義竹消防分隊重建工程經費由中央補助4319萬餘元，地方自籌2745萬餘元，由中友營造公司承攬施工，前年3月動工，面積831平方公尺，總樓地板面積836.22平方公尺，為地上三層鋼筋混凝土建築物。建物東南側以義竹傳統建築斜屋頂天際線搭配金屬隔柵，結合傳統鴿笭文化竹簍與消防鳳凰徽章形象，西北側延伸農耕地景模式，以木格柵搭配爬藤植物作立面分割，將綠化延伸至屋頂，營造兼具防災機能與休憩功能。翁章梁說，義竹分隊廳舍由建築師設計，景觀審議委員會多次修改，讓消防隊員值勤時能有放鬆的休憩空間；建物制高點平台上可俯瞰義竹街景與動態，類似早期的消防觀測塔，希望能提升建築美感與工作舒適度，成為義竹地標。建築設計具有特色的義竹消防分隊廳舍。（記者林宜樟攝）義竹消防分隊廳舍屋頂設計融合在地特色，並兼具防災與休憩功能。（記者林宜樟攝）    ,https://news.ltn.com.tw/news/society/breakingnews/5402353
8人損失1.5億！「台版地面師」幕後貸款公司 聯手假檢警辦案詐財,社會,2026/04/13 15:26,警方查扣資產公司不法文件。（記者王冠仁翻攝）刑事局今天宣布偵破以蔡姓主嫌為首的「台版地面師」案外案。蔡等人以偽造獨居老人代筆遺囑的手法，過戶其名下不動產牟利；警方發現蔡嫌當時曾用被害人房產，向49歲郭姓男子的資產公司辦理貸款。警方研判郭嫌公司「有鬼」，深入追查，揪出郭居然與假檢警詐騙集團合作，至少有8名被害人被連續行騙，相關財損高達1.5億元。警方調查，蔡姓主嫌結合律師、台北市員警駱勁達、現卸任里長、法院書記官等人，以偽造獨居老人代筆遺囑的手法，過戶其名下不動產牟利，3年期間詐得11間房、獲利逾1.4億元，這組犯罪集團在前年被警方破獲。請繼續往下閱讀...警方深入追查，發現蔡嫌曾以被害人的房產，向郭姓男子的資產公司辦理貸款，警方進一步清查郭的資產公司，赫然發現該公司居然與詐騙集團聯手詐騙。警方查出，有一組專門以假檢警方式行騙的詐騙集團，透過網路、亂槍打鳥向被害人行騙，謊稱他們涉入刑案，必須將名下財產交出保管。詐團假扮成檢察官、警察，指示被害人去設定網路銀行並交出帳號密碼，將被害人的財產提領一空。詐團行騙時，還會趁機打探被害人名下是否有不動產，若有，詐團就會要被害人提供不動產資訊給配合的不動產公司，隨後再轉手給郭嫌的資產公司來進行估價，再帶著被害人去地政事務所簽約並辦理不動產抵押設定。警方說，郭嫌的資產公司根本是「吸血鬼」，他們設定的貸款期限只有3個月，且月利率1.3%，若無法如期清償就隨即將房屋法拍，並要求高額違約金，多名被害人因此身心俱疲，被迫向親友借貸，郭嫌公司至少獲利1400萬餘元。刑事局在去年11月與近期先後發動2波搜索行動，在雙北地區逮捕郭等21嫌，查扣贓款79萬餘元、手機15支、電腦4台、筆電5台、被害人貸款文件等，全案依詐欺、洗錢防制法及組織犯罪防制條例送辦。警方呼籲，民眾面對不明融資或借貸訊息仍需多方查證，切勿輕信誇大不實的廣告，以免淪為詐欺集團肥羊。警方查扣贓款與電腦等證物。（記者王冠仁翻攝）警方說明犯案流程。（記者王冠仁翻攝）    ,https://news.ltn.com.tw/news/society/breakingnews/5402328
新莊廢車工廠大火濃煙瀰漫 壽山路山區路段恢復通行,社會,2026/04/13 14:47,新北市新莊區壽山路因昨天報廢車工廠大火，現場濃煙瀰漫。（圖擷取自「新莊警好讚」臉書）首次上稿08:50更新時間14:47（新增恢復通行）新北市新莊區壽山路因昨天下午發生報廢車工廠大火，因現場濃煙瀰漫，壽山路山區路段目前仍封閉中，今早不斷有民眾欲行經該路段往林口方向，被交警指揮往青山路方向前進，新莊區公所提醒，請往返林口與新莊的用路人提早繞道青山路或其他道路行駛，警方也在現場疏導。請繼續往下閱讀...因現場濃煙瀰漫，為確保用路人安全，壽山路山區路段實施道路封閉管制，新莊警分局今早已派員進行交通疏導，呼籲用路人配合現場指揮，減速慢行、注意安全。新莊區公所表示，經確認，警方已於12點28分解除管制，恢復壽山路全線通行，清潔隊後續做現場清理，預估今午3點半左右清理完畢。    ,https://news.ltn.com.tw/news/society/breakingnews/5401841
香燈腳注意！ 苗警結合「粉紅超跑」推限量打詐神轎,社會,2026/04/13 14:41,香燈腳注意！苗警結合「粉紅超跑」推限量打詐神轎。（苗縣警察局提供）年度宗教盛事白沙屯拱天宮媽祖婆徒步進香於今天凌晨0點多出發，展開為期8天7夜的旅程，今年報名人數再創新高，突破46萬人報名，苗栗縣警察局獲得拱天宮管委會授權，製作等比例縮小版限量打詐神轎，信眾隨香之餘可回答相關防詐問題，就有機會抽中。苗栗縣警察局指出，每一頂限量打詐神轎皆有獨立編號，更具收藏價值，信眾只要完成三個步驟，就能參加抽獎。步驟一為追蹤臉書FB「苗栗縣警察局粉絲團」；步驟二為按讚活動貼文並留言標註兩位朋友「一起看反詐影片抽粉紅超跑小神轎」；最後一步回答問卷，全數答對者即可參加抽獎。請繼續往下閱讀...活動獎品包括限量版粉紅超跑限量打詐神轎5名、刑警熊2名、防彈衣杯套10名、密封食物罐20名。活動將於21日下午4點截止，並於22日上午10點抽獎，得獎名單將公布於「苗栗縣警察局粉絲團」。    ,https://news.ltn.com.tw/news/society/breakingnews/5402283
北市警辦案直擊退休婦遭詐面交 活逮女車手扣現金50萬,社會,2026/04/13 14:14,警方查扣詐騙款項50萬元。（記者陸運鋒翻攝）台北市大安分局員警因偵辦一起詐欺案件，前往新北市板橋區調查時，發現曾姓女子形跡相當可疑，尾隨後目擊她與梁姓老婦人相約面交50萬元，上前盤查詢問後，意外得知曾女是其他詐騙集團車手，隨即將其逮捕並查扣相關證物，詢後移送偵辦。警方調查，85歲梁姓老婦於上月底，在臉書看到投資廣告後，隨即點擊加入LINE投資群組，詐騙集團以專人代操股票、穩賺獲利等話術博取信任，梁婦不疑有他，深信真的能賺錢，因此與對方約定交付款項。請繼續往下閱讀...據知，大安分局瑞安派出所員警本月上旬因偵辦其他詐騙案，前往新北板橋區調閱監視影像時，發現57歲曾女正在打視訊電話，且交談內容相當可疑，隨即尾隨她一路跟到板橋民族公園。據指出，警方發現曾女準備與梁姓婦人收取50萬元款項時，立即上前盤查後，意外發現曾女是其他詐騙集團的車手，當場將其逮捕，查扣現金50萬元及手機等相關證物，警詢後依詐欺及洗錢防制法等罪嫌移送台北地檢署偵辦。警方呼籲，網路投資廣告多屬詐騙手法，民眾切勿輕信穩賺不賠等話術，如有疑問可撥打165反詐騙專線查證，以保障自身財產安全。警方發現曾姓女子行跡可疑，尾隨後發現她與梁姓老婦人收取詐騙款項，隨即將其逮捕。（記者陸運鋒翻攝）    ,https://news.ltn.com.tw/news/society/breakingnews/5402257
