Title,News_Type,date,content,url
食人族為何消失？研究：「同類相食」染病風險極高恐滅族,國際,2026/07/01 22:40,前剛果民主共和國叛軍領袖倫巴拉被法國反恐當局指控犯下「共謀危害人類罪」，聯合國調查人員懷疑，他領導的組織在1998至2002年內戰期間，犯下法外處決、性侵與同類相食等罪行。（法新社檔案照）波蘭與捷克的科學家發現，在人類社會中，同類相食（Cannibalism）之所以成為禁忌，並非出於本能的厭惡，而是因為這種行為會對群體造成危害。路透報導，波蘭弗羅茨瓦夫大學（University of Wroclaw）的米西亞克（Michal Misiak）與布拉格查理大學（Charles University）的圖雷切克（Petr Turecek）運用數學模型指出，長期同類相食，會導致食用他人者染病，進而引發人口崩潰。請繼續往下閱讀...米西亞克在弗羅茨瓦夫大學1日發布的聲明中表示：「我們將人體視為潛在的食物來源，分析其能帶來的能量與隱藏成本。」他指出：「從熱量的角度來看，一個人充其量就是普通的一餐…然而，關鍵問題在於其他方面：感染風險。病原體的任務變得更容易，因為它們最終會進入一個生理結構幾乎完全相同的生物體內。」他們的模型顯示，當食人者吃掉其他食人者時，染病風險會呈指數級攀升；因為即使經過烹煮，也無法消除可能引發致命神經系統疾病的普恩蛋白（prions，或稱異常折疊蛋白）。其中一種名為庫魯病（kuru）的疾病，過去在巴布亞紐幾內亞（Papua New Guinea）的法雷人（Fore）部落中相當常見。他們會烹煮並吃掉已故親屬，相信這麼做能解放死者的靈魂。研究人員表示，這些風險可能促成人類最強烈禁忌之一的出現，而這項禁忌至少在一定程度上是基於其保護功能。米西亞克說：「禁忌發揮了演化保障的作用」，「我們的研究結果表明，這是對日益增加的流行病風險所做出的、具有生物學合理性的反應。沒有遏制同類相食的群體，單純就是無法存活下來。」    ,https://news.ltn.com.tw/news/world/breakingnews/5490838
美伊會談進展順利 川普：我們拭目以待,國際,2026/07/01 22:33,美國總統川普透露，美國與伊朗在卡達的會談進行的很順利，且雙方相處的很融洽。（法新社）美國總統川普透露，美國與伊朗今（1）日在卡達首都杜哈（Doha）的會談進行的很順利，且雙方相處的很融洽，「我們拭目以待。」《路透》報導，川普向媒體表示，據他所知，伊朗無核化的議題進展很順利，「他們的會面談得不錯，我們拭目以待。」請繼續往下閱讀...川普補充說，美國與伊朗代表相處的很融洽，且伊朗「已經進步很多」，並表示「我覺得他們沒問題」。一名伊朗官員與一名了解談判情形的消息人士指出，美國與伊朗的代表尋求在荷姆茲海峽航運以及維持停火等議題上達成共識。    ,https://news.ltn.com.tw/news/world/breakingnews/5490805
美伊展開間接會談  川普暫擱置「恢復全面戰爭」選項,國際,2026/07/01 22:19,美國總統川普近日聽取五角大廈簡報軍事選項，權衡了是否恢復對伊朗全面戰爭，但是目前維持繼續外交談判。（法新社）美國和伊朗1日在杜哈透過居間斡旋國，展開間接會談，平息日前兩國在簽署諒解備忘錄後首次交火引發的緊張，同時力圖推進最終結束戰爭的談判進展。另一方面，美國總統川普近日聽取五角大廈簡報軍事選項，權衡了是否恢復對伊朗全面戰爭，但是目前維持繼續外交談判。一名外交官1日向法新社透露，美伊雙方將透過卡達和巴基斯坦斡旋者，進行「間接技術性會談」，並於隨後證實當天正在進行會談。這名要求匿名的外交官員表示，會談以「琉森湖峰會達成的進展為基礎」，屬較低層級會談，聚焦在諒解備忘錄細節，前一日已與卡達總理穆罕默德（Mohammed Bin Abdulrahman al-Thani）會面的美國特使庫希納和魏科夫並未參與。請繼續往下閱讀...美國和伊朗雙方都派官員到杜哈，並表示將討論該諒解備忘錄，但是伊朗駁斥稍早川普稱會在杜哈直接談判的說法。伊朗外交部發言人貝卡伊（Esmaeil Baqaei）表示，伊朗代表團由外交部副部長加里巴巴迪（Kazem Gharibabadi）率領，但是「並無計畫於未來幾天與美方進行任何層級的談判」。阿拉伯波斯灣國家研究所（AGSI）非常駐研究員賈可布斯（Anna Jacobs）表示，現仍處於「談判過程的非常初期階段，正在私下和公開地角力」，但是「整體的正面訊息是，經過上週的衝突後，他們持續接觸」。另一方面，華爾街日報6月30日獨家報導，川普近日與戰爭部長（國防部長）赫格塞斯和參謀首長聯席會議主席凱恩會談，聽取軍事選項簡報，權衡了是否恢復對伊朗全面戰爭，但是目前決定繼續談判。官員透露，一些官員將恢復全面戰爭形容為「完成任務」，但是川普已向幕僚表示，新一輪全面戰爭可能破壞外交談判，並有損華府最終解除伊朗核計畫的機會；川普還說，與伊朗的談判即使超過8月18日、即美伊6月中簽署諒解備忘錄所定出，達成解決核問題協議的60天期限，他也覺得無妨。一名白宮官員說，川普的首選始終是外交，伊朗若能與美國達成一份好的協議，會是明智之舉。赫格塞斯和凱恩的發言人拒絕評論此事。    ,https://news.ltn.com.tw/news/world/breakingnews/5490798
首搭新「空軍一號」 川普：非常驕傲,國際,2026/07/01 22:16,美國總統川普1日準備登上新「空軍一號」專機。（美聯社）美國總統川普1日首次搭乘以卡達贈送豪華客機改裝的新空軍一號專機，飛往北達科他州，出席前總統羅斯福（Theodore Roosevelt）紀念圖書館的活動。川普說，非常以新專機為傲。路透1日報導，新空軍一號專機這趟首次搭載總統飛行，時值川普正以一系列活動，迎接7月4日美國建國250週年。而川普此行以該紀念圖書館致敬對象、共和黨籍前總統羅斯福的歷史遺產，宣揚他所傳達的美國偉大敘事。請繼續往下閱讀...新空軍一號由卡達贈送的波音747客機改裝，日前才正式公開亮相，機身塗裝一改沿用數十年的「甘迺迪藍」和白色，採用川普選定的紅、白、深藍與金色塗裝。川普多次駁斥外界對接受這項外國豪華贈禮的質疑聲浪。1日登上新專機前向記者說，卡達「對我們非常好」，贈機這架客機的卡達領導人「非常好」。被問到納稅人負擔時，川普說，相較於若採用其他做法，採用這架贈機的成本「非常低」。川普說，這架飛機已經被改裝成「適合總統」使用，意思是安全和其他各種複雜配備。他說，「我們對此感到非常驕傲，國家非常引以為傲」，並說舊版空軍一號「看起來與我們國家不相稱」。由卡達贈機改裝的新空軍一號1日首次搭載美國總統川普飛行。（路透）    ,https://news.ltn.com.tw/news/world/breakingnews/5490817
中國民族團結法上路 李察吉爾：北京正將「跨國鎮壓」合法化,國際,2026/07/01 22:07,長期關注西藏人權的好萊塢知名影星李察吉爾指出，中國政府正利用「民族團結進步促進法」，將國內抹除少數民族文化的行為制度化，而且明確授權追捕居住在任何地方的中國政策批評者。（法新社檔案照）針對1日生效的中國「民族團結進步促進法」，長期關注西藏人權的好萊塢知名影星李察吉爾（Richard Gere）在華爾街日報撰文指出，該法是習近平統治時代影響最深遠、卻最少受到關注的法律之一，中國政府正利用該法，將國內抹除少數民族文化的行為制度化，而且明確授權追捕居住在任何地方的中國政策批評者、包括美國本土在內，呼籲美國決策者認清該法的壓迫性本質。李察吉爾指出，中國在7月1日達賴喇嘛91歲生日前幾天，正式實施民族團結法，在提及「團結」、「社會和諧」與「命運共同體」等看似無害的內容之外，該法第63條指示中國當局，對中國境外任何「破壞民族團結進步、製造民族分裂」的組織與個人採取行動，顯示北京主張其擁有法律權限，得以針對外國公民發表中共認為威脅其關於西藏、新疆或任何宗教及少數民族論述的言論進行追究，包括美國人。請繼續往下閱讀...文章指出，中國早已不遺餘力地監控與恐嚇海外的中國異議人士。紐約布朗克斯區（Bronx）居民、美國公民盧建旺（Lu Jianwang）由於在曼哈頓經營中國「海外警察站」，今年5月被判充當中國公安部非法代理人罪名成立。檢方出示的證據指出，盧建旺受中國官員指使，在美國領土上鎮壓異議人士。他面臨最高30年徒刑。如今，民族團結法為他的這類行為提供了明確的法律掩護。要了解這將導致什麼後果，看看西藏就知道。如今的西藏充斥著警察檢查哨、臉部辨識技術與通訊監控。中共幹部直接進駐村落與寺廟，被指派監控藏人家庭，並確保他們的政治忠誠。僧侶必須接受「愛國主義教育」運動。作家面臨牢獄之災，包括藏族作家岡吉．竹巴嘉（Gangkye Drubpa Kyab），他因「煽動分裂國家罪」正在服14年刑期，先前更曾因展示達賴喇嘛的照片而入獄。民族團結法強制規定漢語（普通話）為教育、政府與社會組織的主要語言。儘管北京否認，但這些規定直接牴觸中國憲法保障不同民族擁有使用自己語言與習俗的權利。民族團結法也強化了殖民式寄宿學校系統，在該系統下，約有100萬名西藏兒童已與他們的家庭和社區分離，並接受共產主義思想灌輸。民族團結法要求所有宗教活動必須支持「民族團結」，並接受「中國化」。對於語言、文化及社區密不可分的藏傳佛教而言，這形同國家主導的文化抹除。在達賴喇嘛的繼任問題上，風險將進一步升高，這可能是未來10年影響最深遠的宗教與政治衝突點之一。中國可能會任命自己的達賴喇嘛，並利用各種外交與其他工具，在國際舞台上確立其合法性。李察吉爾呼籲，美國決策者應認清民族團結法的本質，這是一項宣告，表明北京的意識形態管轄權已延伸至其國界之外。這項法律與在西藏的壓迫，正處於自由與專制之間更大規模鬥爭的支點。當北京採取行動，將外國對其民族政策的批評定為犯罪時，它正在測試國際社會是否會接受這樣一個前提：任何地方的任何人，都不能挑戰中共所偏好的歷史版本。這是一個美國絕對輸不起的考驗（a test the U.S. can't afford to fail）。    ,https://news.ltn.com.tw/news/world/breakingnews/5490815
市川市動植物園祭「紅色臂章」新規 嚴禁遊客拍攝部分飼育員,國際,2026/07/01 21:58,"市川市動植物園公告，自6月30日（二）起，部分飼育員可能會配戴如照片所示的臂章。此時，請勿拍攝該名飼育員的身影。（圖擷取自@ichikawa_zoo社群平台「X」）日本千葉縣市川市動植物園因一隻被暱稱「Panchi」（パンチ，又名Punch）的小獼猴而在全球引發話題。不過，該園區於1日透過官方X（原推特）更新公告，宣布自6月30日起，部分飼育員將會配戴象徵「禁止拍攝」的紅色臂章，並向到訪遊客呼籲，嚴禁對這些飼育員進行拍攝以及將照片、影片上傳至社群平台。綜合媒體報導，園方在公告中指出：「【通知】自6月30日（二）起，部分飼育員可能會配戴如照片所示的臂章。此時，請勿拍攝該名飼育員的身影。」從園方公開的照片中可以清楚看到，在飼育員制服的手臂處，綁著一條寫有醒目「拍攝禁止」與「NO PHOTOS」字樣的紅色臂章。請繼續往下閱讀...此外，考慮到近期社群平台上影片與照片分享的普及化，園方也展現強硬態度表示：「若在社群平台上發現含有此臂章的照片或影片，皆屬於違規行為，園方將會採取檢舉等對應措施，請大家務必多加注意。」這項公告發布後，隨即引來眾多網友的贊同與支持，紛紛留言表示：「配戴臂章很清晰明瞭，非常贊成」、「全面支持園方的做法」、「這個對策很好」、「這是為了保護第一線工作人員理所當然的舉動」、「我認為這是一個很好的措施」。【お知らせ】6/30（火）より、飼育員が写真のような腕章を付けている場合があります。その場合、当該飼育員の姿は撮影禁止です????この腕章が写っている画像や動画をSNSで発見した場合違反行為ですので通報等の対応をいたします。十分ご注意くださいますようお願いいたします。#市川市動植物園 pic.twitter.com/nMy28rkk5K— 市川市動植物園（公式） （@ichikawa_zoo） June 29, 2026 【お知らせ】6/30（火）より、飼育員が写真のような腕章を付けている場合があります。その場合、当該飼育員の姿は撮影禁止です????この腕章が写っている画像や動画をSNSで発見した場合違反行為ですので通報等の対応をいたします。十分ご注意くださいますようお願いいたします。#市川市動植物園 pic.twitter.com/nMy28rkk5K    ",https://news.ltn.com.tw/news/world/breakingnews/5490658
美14跨黨派議員致函魯比歐 促反制中國民族團結法,國際,2026/07/01 21:44,美國民主黨籍聯邦眾議員麥高文等14名跨黨派眾議員，聯名致函國務卿魯比歐，要求譴責中國民族團結進步促進法為強迫同化、意識形態控制及跨國鎮壓的工具，並與其他志同道合國家予以反制。（法新社檔案照）中國的「民族團結進步促進法」1日正式生效。美國民主黨籍聯邦眾議員麥高文（Jim McGovern）、肯納（Ro Khanna）與共和黨籍眾議員史密斯（Chris Smith）等14名跨黨派眾議員，聯名致函國務卿魯比歐，要求譴責該法為強迫同化、意識形態控制及跨國鎮壓的工具，並與其他志同道合國家予以反制。議員們在聯名信中寫道：「這項法律絕非促進各民族間的真正平等，而是將中國共產黨針對藏族、維吾爾族、南蒙古族及其他非漢族社群的強迫同化運動，加以明文規定並擴大實施。」「我們誠摯敦促國務院在該法於2026年7月1日生效前，公開且強力地做出回應，並明確表示美國拒絕接受中共企圖將強迫同化偽裝成『民族團結』的行徑。」請繼續往下閱讀...議員呼籲魯比歐公開譴責該法，向中國官員提出此事，並與理念相近國家協調，在雙邊對話、聯合國人權理事會，以及相關聯合國機構與特別程序中加以應對，強化美國反制中國跨國鎮壓的作為，加強執行「防止維吾爾人強迫勞動法」，並與理念相近的盟友合作擴大執法範圍。    ,https://news.ltn.com.tw/news/world/breakingnews/5490801
日本岩手縣外海規模6.0強震 岩手、青森最大震度4,國際,2026/07/01 21:10,"岩手縣外海今日（26）晚間發生規模6.0強震，震源深度約40公里。（圖擷取自日本氣象廳官網）日本東北地區近期地震頻繁，今日（26）日本當地時間晚間9時08分（台灣時間晚間8時08分），岩手縣外海發生規模6.0強震，震源深度約40公里，岩手縣與青森縣均觀測到最大震度4，氣象廳表示此次地震沒有引發海嘯之虞。另據日本氣象廳官網資料，岩手縣外海今年6月25日發生規模6.9強震，最大震度觀測到「6強」；同月28日，同一位置發生6.1強震，最大震度達「5弱」；今天發生規模6.0強震，震源位置與前2次相同。請繼續往下閱讀...氣象廳提醒，大型地震發生後，再發生同等規模地震的比例約為10%至20%，震感強烈的地區，需注意再次發生同等規模的地震。【地震速報】青森県、岩手県で最大震度4の地震が発生 津波の心配なしhttps://t.co/anYaRLl8Rg21時8分頃、岩手県沖を震源とする地震があった。震源の深さは約40km、地震の規模はM6.0、最大震度4を青森県、岩手県で観測している。この地震による津波の心配はない。 pic.twitter.com/X1W1yYHsyE— ライブドアニュース （@livedoornews） July 1, 2026 【地震速報】青森県、岩手県で最大震度4の地震が発生 津波の心配なしhttps://t.co/anYaRLl8Rg21時8分頃、岩手県沖を震源とする地震があった。震源の深さは約40km、地震の規模はM6.0、最大震度4を青森県、岩手県で観測している。この地震による津波の心配はない。 pic.twitter.com/X1W1yYHsyE    ",https://news.ltn.com.tw/news/world/breakingnews/5490767
以色列出言挑釁 伊朗外長警告川普：管好你家寵物,國際,2026/07/01 20:50,"伊朗外交部長阿拉奇（見圖）發文警告美國總統川普，要他管好以色列。（美聯社資料照）以色列國防部長卡茨（Israel Katz）近期表示，已將伊朗最高領導人穆吉塔巴．哈米尼（Mojtaba Khamenei）列為追殺目標。伊朗外交部長阿拉奇（Abbas Araghchi）今（1）日發文警告美國總統川普，管好以色列這隻「寵物」，如果寵物不聽話，伊朗會代為出手管教。阿拉奇在X平台發文說：「伊斯蘭馬巴德備忘錄的條款再明白不過，大家都看得到。美國總統已承諾，美國會給他們那些在特拉維夫（Tel Aviv，以色列首都）的寵物戴上口套。如果他們不聽主人的話，那伊朗會管教他們。」請繼續往下閱讀...阿拉奇還強調：「任何針對我國人民與領導層的威脅，都會得到即時且強而有力的回應。」阿拉奇的這篇文章還搭配了一張圖片，圖中可以看到卡茨聲稱，以色列已將伊朗最高領導人穆吉塔巴列為暗殺目標。The terms of the Islamabad MoU are crystal clear and public for all to see.POTUS has committed the U.S. to muzzling its pets in Tel Aviv. If they ignore their master, Iran will school them.Any threat against our People and Leadership will receive Immediate Powerful Response. pic.twitter.com/VrKa259gYd— Seyed Abbas Araghchi （@araghchi） July 1, 2026 The terms of the Islamabad MoU are crystal clear and public for all to see.POTUS has committed the U.S. to muzzling its pets in Tel Aviv. If they ignore their master, Iran will school them.Any threat against our People and Leadership will receive Immediate Powerful Response. pic.twitter.com/VrKa259gYd    ",https://news.ltn.com.tw/news/world/breakingnews/5490727
美限縮「出生公民權」最高法院駁回  川普轉施壓國會立法,國際,2026/07/01 20:45,美國民眾4月在最高法院前，表達支持現行憲法保障之出生公民權。（法新社檔案照）美國最高法院6月30日駁回總統川普限制「出生公民權」的行政命令，重新確認幾乎有所在美國出生者即具有美國公民身分，此為受憲法保障的「出生地原則」。川普在最高法院做出裁定後，轉向國會施壓，要求共和黨議員立刻推動立法，終結他所說這種「成本高且不公平」的制度。最高法院以6票對3票做出這項裁定，首席大法官羅伯茲（John Roberts）撰寫的多數意見書指出，川普該項行政命令違反了憲法第14修正案所保障的權利，也就是在美國出生的兒童，除外交官子女等少數例外，均自動取得公民身分，無證移民或者暫時居留美國之父母所生子女，亦是出生即為美國公民，「第14修正案的制定者將此承諾擴展到對『每一名在這片土地上自由出生者』」，「我們今日依然維持這個承諾」。請繼續往下閱讀...川普隨即在自家社群平台發文表示，這項裁定對國家來說「太糟糕」，國會應「今天就開始，著手終結對我國來說昂貴且不公平的出生公民權」，並稱國會透過立法「輕易」就可處理，「不需要冗長且繁瑣的憲法修正案」，他將「全力支持」國會行動。羅伯茲的多數意見書獲得其他2名保守派、3名自由派大法官認同。持異議的保守派大法官阿利托（Samuel Alito）寫道，「這是最高法院歷來數一數二重要的裁決，我的判斷是，法院犯了嚴重的錯誤」，稱這項裁決會助長非法移民湧入美國。川普去年上任後立即簽署行政命令，排除非法居留者或者持工作、旅遊、就學或人道簽證者在美所生子女享有出生公民權，此為川普移民政策的一大支柱。紐約時報指出，從確認現行出生公民權的大法官人數已超過半數來看，不論是透過提出法案或者憲法修正案，要推動限縮此權利，可能都並非如川普發文所稱「輕易」就能辦到。華盛頓郵報報導也指出，國會長期以來在移民議題上陷入僵局，部分法學專家也認為，若要限縮，不可避免需要修憲，但不清楚共和黨要如何才能獲得多數的支持，就一項已證明具有政治複雜性之議題，推動立法。    ,https://news.ltn.com.tw/news/world/breakingnews/5490756
探測車拍到「火星有槍」？ UFO研究員曝：NASA早已知情,國際,2026/07/01 19:58,"機會號拍攝到火星疑似出現槍枝的照片。（擷取自X @EvanKirstel）美國航太總署（NASA）2014年拍攝的火星照片，近日在網路上掀起討論。有網友發現，畫面中竟出現一把酷似「槍枝」的神祕物體，甚至有不明飛行物（UFO）研究員宣稱，NASA派遣探測車前往火星的真正目的，就是為了尋找這項疑似外星人遺留的「槍」。根據《每日郵報》報導，引發討論的照片是由NASA「機會號」（Opportunity）探測車於2014年拍攝。不明飛行物研究者史考特近日再次翻出這張影像，並發文表示，畫面中有一件長約1英尺（約30公分）的神祕物體，外型與槍枝極為相似，位置在火星艾吉坎山（Mt.Edgecumbe）與沃多維亞克山脊（Wdowiak Ridge）之間。請繼續往下閱讀...史考特大膽推測，NASA早已知道這項神祕物體的存在，派遣探測車前往火星的真正目的，就是調查這件疑似外星文明留下的「槍」。事實上，機會號於2004年1月25日成功登陸火星，在子午線高原（Meridiani Planum）的老鷹隕石坑（Eagle Crater）展開探測任務，直到2018年6月，一場席捲火星的沙塵暴遮蔽陽光，使依靠太陽能供電的機會號電力耗盡，最終與地球失去聯繫，NASA於2019年2月正式宣布任務結束。對於所謂的「外星槍枝」，科學界始終持保留態度，認為這很可能只是「空想性錯視」（Pareidolia），也就是人類大腦傾向將隨機的岩石、陰影或自然紋理，誤認為熟悉物體的心理效應。NASA也多次強調，截至目前為止，尚未發現任何足以證明火星存在外星生命，或曾存在生命的確切證據。Strange formation in NASA's Mars photo fuels claims of extraterrestrial life on the Red Planet https://t.co/0mkSFWTJOP pic.twitter.com/IYSLMSzPQS— Evan Kirstel #B2B #TechFluencer （@EvanKirstel） July 1, 2026 Strange formation in NASA's Mars photo fuels claims of extraterrestrial life on the Red Planet https://t.co/0mkSFWTJOP pic.twitter.com/IYSLMSzPQS    ",https://news.ltn.com.tw/news/world/breakingnews/5490669
