Title,News_Type,date,content,url
自由說新聞》中國「愛爛尾」抖音酸恥辱柱！美學者嗆：什麼都沒兌現過,國際,2026/04/02 18:06,全新的視界！新聞話題不漏接，快訂閱YouTube 【自由追新聞】，記得開啟小鈴鐺哦！    ,https://news.ltn.com.tw/news/world/breakingnews/5391523
強化反擊能力 日本擬研發低成本飛彈,國際,2026/04/02 18:04,圖為日本陸上自衛隊12式陸基反艦飛彈。（美聯社檔案照）多名相關人士透露，鑑於俄羅斯侵略烏克蘭的教訓，日本政府已著手利用民生用品，探討開發低成本飛彈，做為「反擊能力」（對敵基地攻擊能力）的手段。共同社2日獨家報導，日本政府力圖透過引進價格低廉、且能縮短製造週期的飛彈，為長期戰爭做好準備，正構想將這種飛彈與具有長程飛行能力的攻擊型無人機結合，構成「新型作戰方式」，計畫今年內在3份安保相關文件中明確記載。請繼續往下閱讀...據報導，低成本飛彈預計將確保射程超過1000公里，並做為攻擊對方國家飛彈發射基地及船艦。據悉將在日本防衛政策基本方針「專守防衛」的範圍內運用，專守防衛將保衛日本的防衛力限制在必要最低限度。根據設想，這種低成本飛彈，將利用與飛機相關的現成零組件等，組裝引擎部分和導引系統，以大幅壓縮單枚據稱達數億日圓以上的長射程飛彈製造成本。相較於現有飛彈，重點在於命中精度，和躲避攔截能力。防衛省今年3月在自民黨會議上提出「防衛力變革方向性」。為應對長期戰事，除了實現飛彈低成本之外，還舉例提出以大量消耗裝備品和彈藥為前提，確保防衛產業製造能力，並與盟國及志同道合國家合作。目前還在探討防衛裝備品工廠國有化。    ,https://news.ltn.com.tw/news/world/breakingnews/5391592
印度軍火出口額創新高 高達3842億,國際,2026/04/02 18:03,印度國防部長辛格指出，印度2025至2026財政年度國防出口額為3842.4億盧比，達到歷史新高。（路透）印度國防部今（2）日說，截至3月的財政年度，印度軍火出口額達到3842.4億盧比（約台幣1321億元），較上一財年增長超過62％。根據《路透》報導，印度國防部指出，印度在2024年4月至2025年3月期間，國防出口額為2362.2億盧比（約台幣812億元），而2025年4月至2026年3月國防出口額，增加了1480.2億盧比（約台幣509億元）。請繼續往下閱讀...印度國防部長辛格（Rajnath Singh）強調，國防出口大幅增長，反映全球對印度自主研發能力和先進製造實力的信任日益增長。印度政府說，目前印度向80多個國家出口國防裝備。印度近年大力推動從槍枝、無人機到戰鬥機和潛艦等各類軍武的國產化，既有自主研發，也有與外國夥伴合作生產。另外根據斯德哥爾摩國際和平研究所的最新數據，印度是世界第五大軍費開支國，也是僅次於烏克蘭的第二大武器進口國。    ,https://news.ltn.com.tw/news/world/breakingnews/5391426
川普嗆把伊朗「帶回石器時代」！胡采蘋：他就是要滅了神學政權,國際,2026/04/02 17:47,美國總統川普。（法新社）美國總統川普於美東時間1日晚間9點，針對伊朗問題發表全國演說，川普威脅未來2到3週，將對伊朗進行極其嚴厲的打擊，「把他們帶回石器時代，讓他們回到他們本來應該待著的地方」。對此，財經網紅胡采蘋分析，川普就是要滅了伊朗神學政權，那些打著真神名號做壞事的惡魔，就是應該要徹底剷除。胡采蘋於臉書粉專「Emmy追劇時間」發文表示，先前傳出美軍要撤軍、結束戰爭，但她說川普講什麼鬼話她都不信，直指川普就是要滅了伊朗神學政權。「伊朗總統自己都說他只剩下三週到一個月的錢了，而且這還是幾天前講的，現在應該2.5週到3.5週了」。請繼續往下閱讀...胡采蘋指出，這跟他們之前做研究的結果吻合，伊朗政府的現金只能撐三個月，目前已經過了一個月，伊朗總統講的情況比她預計得還差。政府關閉以後就會漸漸陷入交通水電公務全面停擺的狀態，全國經濟凍結。她認為，革命衛隊現在是已經被打進延安窯洞，接下來就是整個伊朗變成一個延安大窯洞。胡采蘋說，除非真的美軍走了我才相信是撤軍，那些打著真神名號做壞事、貪污、強姦幼女、屠殺人民的惡魔，就是應該要徹底剷除，真神也會來幫忙的。絕對不可以讓他們擁有核彈跟中長程飛彈。    ,https://news.ltn.com.tw/news/world/breakingnews/5391469
遊日注意！東京千鳥之淵70年櫻花樹倒塌 封鎖部分水域,國際,2026/04/02 17:46,千鳥之淵今日傳出有顆櫻花樹倒了，目前尚未傳出有人因此受傷。（圖取自@ntv_news「YouTube」）以賞櫻勝地聞名的東京都千代田區千鳥之淵，今日（2）清晨發現1棵正在開花的櫻花樹倒向皇居護城河一側，所幸未傳出人員傷亡。千代田區已於同日對外說明相關情況。根據區方表示，當天清晨約5時50分，有位行人發現櫻花樹倒塌並通報警方，研判樹木於清晨時分傾倒。倒下的為種植於護城河側斜坡上的染井吉野櫻。請繼續往下閱讀...千鳥之淵綠道沿線共約150棵櫻花樹，由國家與千代田區共同管理，此次倒塌的樹木屬於國家管理範圍。環境省指出，該樹高約8公尺、樹幹周長約2公尺，樹齡約70年，經檢查未發現根部或樹幹內部有腐朽等異常情形。環境省進一步表示，綜合現場狀況，推測倒木原因為前一晚的強風與降雨所致。受倒木影響，現場已設置交通錐並實施單側通行管制，同時配置人員避免觀光船靠近相關水域。千鳥之淵目前正舉辦「千代田櫻花祭」（至4月22日，夜間點燈至4月6日），主辦單位表示活動未受影響，遊船仍可正常運行，但部分水域已暫時封鎖，並呼籲遊客注意安全。    ,https://news.ltn.com.tw/news/world/breakingnews/5391497
澤倫斯基提議4/12復活節休戰 俄羅斯700架「見證者」空襲回應,國際,2026/04/02 17:08,烏克蘭總統澤倫斯基表示，與美方協商團隊的最新對話進展正面。（路透）烏克蘭總統澤倫斯基控訴，在他向俄羅斯提出復活節休戰的提案後，莫斯科的回應是在1日發動空襲。另外，他讚揚與美國代表針對烏俄和平進程的最新談話進展正面。澤倫斯基1日與美國特使魏科夫（Steve Witkoff）、川普女婿庫希納（Jared Kushner）、美國參議員葛拉漢（Lindsey Graham）和北大西洋公約組織秘書長呂特（Mark Rutte）等人視訊會議。澤倫斯基會後向美方為烏俄和平付出的心力表達感激，美烏雙方已同意加強制定美國安全保證文件的工作，強調此舉是能夠使戰爭確實走向終結的重要因素。請繼續往下閱讀...針對基輔提出的4月12日復活節休戰提案，俄羅斯外交部1日斥其為「公關噱頭」。澤倫斯基指出，俄軍當日罕見朝烏克蘭發動日間空襲，發射超過700架無人機，當中許多為伊朗設計的「見證者」，「俄羅斯用見證者無人機作為回應，持續對我們的能源領域和基礎建設進行恐怖活動。」    ,https://news.ltn.com.tw/news/world/breakingnews/5391470
日40多歲男子墜入釀酒桶身亡 警將釐清事故發生原因,國際,2026/04/02 16:55,日本1名身分不明的40多歲男子今早墜入釀酒桶中不幸身亡；示意圖，圖與新聞事件無關。（資料照）日本秋田縣橫手市1間酒造公司，今天有位40多歲男子不明原因掉入酒桶後死亡，警方正在調查事故發生原因。《秋田放送》報導，根據警方與消防單位表示，上午7點40分左右，橫手市大森町的一間酒造公司通報消防隊，稱「好像有人掉進釀酒用的酒桶裡了」。救護人員到場後發現，1位疑似員工的40多歲男子掉入直徑約2公尺、深約2公尺的酒桶中。請繼續往下閱讀...男子被救出後緊急送往橫手市內的醫院，但到院後確認死亡。事發當時，酒桶內裝有約1公尺深的酒醪（未完成發酵的酒液）。目前警方正在調查事故發生時的詳細情況與原因，同時也在確認死者身分。    ,https://news.ltn.com.tw/news/world/breakingnews/5391383
美駐伊拉克使館示警！親伊朗民兵恐在48小時內攻擊巴格達,國際,2026/04/02 16:49,"美國駐伊拉克大使館緊急發出警告，親伊朗民兵組織可能在巴格達市中心發動攻擊。（法新社）伊朗戰爭進行至33天，戰火逐漸對外蔓延，美國駐伊拉克大使館緊急發出警告，親伊朗民兵組織可能在未來24至48小時內，在巴格達市中心發動攻擊，呼籲美國公民應該立即離開伊拉克。綜合外媒報導，美國駐伊拉克大使館在X平台緊急發出警告，與伊朗結盟的伊拉克恐怖民兵組織，可能計劃在未來24至48小時內襲擊巴格達市中心，這些組織可能以美國公民、企業、大學、外交機構、能源基礎設施、飯店、機場等，被認為與美國有關的地點，以及伊拉克機構和民用目標為攻擊目標。請繼續往下閱讀...大使館指出，這些親伊朗民兵組織也曾綁架美國公民，疾呼美國公民應立即離開伊拉克，目前伊拉克旅遊警告為第四級「請勿前往伊拉克」，建議美國公民，無論出於任何原因，都不要前往伊拉克。如果已經身處伊拉克，請立即離開。親伊朗的伊拉克什葉派武裝團體「人民動員力量」（PMF）表示，在過去24小時內，其部隊，已經遭到美國與以色列兩次空襲，稱兩次攻擊均未造成任何人員傷亡。تحذير أمني – سفارة الولايات المتحدة في بغداد، العراق – ٢ ابريل/ نيسان 2026الموقع: العراققد تعتزم ميليشيات إرهابية عراقية متحالفة مع إيران تنفيذ هجمات في وسط بغداد خلال الـ 24 إلى 48 ساعة القادمة. وقد نفّذت إيران والميليشيات الإرهابية المتحالفة معها هجمات واسعة ضد مواطنين… pic.twitter.com/cavWqbtSyn— U.S. Embassy Baghdad （@USEmbBaghdad） April 2, 2026 تحذير أمني – سفارة الولايات المتحدة في بغداد، العراق – ٢ ابريل/ نيسان 2026الموقع: العراققد تعتزم ميليشيات إرهابية عراقية متحالفة مع إيران تنفيذ هجمات في وسط بغداد خلال الـ 24 إلى 48 ساعة القادمة. وقد نفّذت إيران والميليشيات الإرهابية المتحالفة معها هجمات واسعة ضد مواطنين… pic.twitter.com/cavWqbtSyn    ",https://news.ltn.com.tw/news/world/breakingnews/5391438
和平也回不去了！歐盟執委示警：高油價將成「常態」,國際,2026/04/02 16:42,歐盟能源執委約根森表示：「即便明日達成和平協議，能源市場在可預見的未來也無法回到常態」。（歐新社）歐盟能源執委約根森（Dan Jorgensen）週二發出嚴厲警告，受伊朗戰爭影響，歐洲油氣價格飆升的壓力在短期內難以緩解。他強調，「即便明日達成和平協議，能源市場在可預見的未來，也無法回到常態。」目前歐盟正研議減稅及徵收「暴利稅」等措施，以應對高昂的能源帳單。據《美聯社》報導，約根森在歐盟能源部長會議後的記者會上指出，儘管歐盟27個成員國目前暫無立即性的供應短缺，但柴油與航空燃料的供應已面臨壓力。此外，全球天然氣市場的「限制增加」導致電力價格同步攀升。數據顯示，戰爭爆發以來，歐洲天然氣價格上漲約70%，石油價格則上漲60%，歐盟進口化石燃料的開支，累計已增加140億歐元。請繼續往下閱讀...為了減輕家庭與企業的負擔，歐盟執委會正準備推出一系列協調行動。約根森透露，這套「工具箱」措施將於近期公布，重點包括簡化成員國將天然氣價格，與電價「脫鉤」的程序，並研議調降電稅。針對獲取巨額利潤的能源公司，約根森表示，雖然不預見會重演2022年的天然氣危機，但仍不排除徵收一次性的「暴利稅」，以資助弱勢族群與承受劇烈壓力的產業。除了財政補貼，約根森也呼籲成員國採納國際能源署（IEA）的節能計畫，包括鼓勵遠距辦公、降低高速公路限速、推廣大眾運輸及共乘制度。在能源安全戰略方面，約根森重申，歐盟將堅持禁購俄羅斯天然氣的立場。歐盟對俄氣的依賴度，已從戰前的45%大幅降至10%，最終目標是降至零。他強調，歐盟將擴大與美國、亞塞拜然、阿爾及利亞及加拿大的合作，開發多元能源來源。約根森正色表示，歐盟絕不能重複過去的錯誤，讓普廷將能源「武器化」來勒索成員國，更不能讓能源採購資金，間接資助俄國在烏克蘭的侵略戰爭。    ,https://news.ltn.com.tw/news/world/breakingnews/5391424
美國防部員工搭機中猝逝！大韓航空「氧氣罩沒接氧氣」挨告,國際,2026/04/02 16:34,大韓航空遭指控，機上的氧氣罩沒接氧氣，導致美國國防部女員工死亡。（法新社）大韓航空近日因空服人員危機處理不佳挨告。美國國防部一名女員工，因公務搭乘大韓航空前往首爾，不料，在飛行過程中突然昏迷，雖飛機緊急迫降大阪，但女子最終仍宣告不治。事後親友指控，是因為空服員在機上過於慌亂，忘記將氧氣罩接上氧氣筒，才導致女子失去搶救機會。據《獨立報》報導，這起事故發生在去年3月24日，當時女子起身前往廁所，突然身體不適倒地大喊「我無法呼吸」。儘管空服人員提供氧氣罩，但女子還是無法呼吸，過沒多久失去意識，空服員提供醫療箱注射腎上腺素也未緩解。最後飛機迫降大阪讓女子緊急送醫，但女子最後仍不治，醫師判斷是因為急性心臟衰竭死亡。請繼續往下閱讀...親友事後指控，空服員當時危機處理不當，只是驚慌失措，一下觀察情況，一下記錄情況，未提供實質協助。離譜的是，機上備有AED，受訓過的機組人員卻沒有人指導乘客如何操作。最扯的是，他們在下機前才驚覺氧氣罩從頭到尾都沒有接上氧氣筒，等於女子完全沒有被急救到。對此，親友怒告大韓航空的空服員違反公司規定，沒有及時提供救助且延遲宣布緊急醫療狀況，要求陪審團裁定大韓航空賠償金額，目前官司仍在進行中。    ,https://news.ltn.com.tw/news/world/breakingnews/5391355
南韓被川普點名「沒幫上忙」！韓媒評「陷入兩難」狀態,國際,2026/04/02 16:22,美國總統川普。（法新社）美國總統川普於美東時間2日針對伊朗戰事引發的能源危機發表談話，直接點名南韓對華盛頓「沒幫上忙」，並強硬要求盟友應自行承擔荷姆茲海峽的護航責任。此番言論引發國際關注，也讓受制於美韓同盟與中東經貿關係的首爾當局陷入極大的外交兩難。根據《韓國先驅報》報導，川普在白宮復活節午宴上指出，荷姆茲海峽作為全球石油運輸動脈，目前因伊朗的報復攻擊陷入癱瘓，但高度依賴該航道的南韓、日本及歐洲國家，卻未能在安全維護上發揮更大作用。請繼續往下閱讀...發言時，川普特別點名南韓，批評其對提供海軍援助的呼籲，一直以來的態度都十分消極，川普批評，儘管美軍駐紮在靠近北韓核武的「危險地帶」，但南韓對華盛頓卻「沒什麼幫助」。川普直白表示：「我們有4萬5000名士兵在那裡的危險地帶，就在核武部隊旁邊。讓南韓自己去處理吧。」（實際上是2萬8500名美軍）。面對川普的公開施壓，南韓政府目前表現得極為謹慎。儘管美方促請盟友派遣軍艦護航，但首爾當局至今尚未承諾出動海軍，僅表示正在「仔細評估」局勢。南韓官員私下透露，若直接介入軍事衝突，恐將嚴重衝擊與伊朗及其他中東夥伴的關係；然而若持續拒絕美方要求，則可能導致美韓在核動力潛艦研發、雙邊核能合作等關鍵領域的協商陷入停滯。對此，韓國國防研究院（KIDA）研究員柳智勳分析，南韓正面臨維護國際導航自由原則與管理即時經濟風險的雙重挑戰。他指出，若美國決定減少在荷姆茲海峽的參與，南韓等能源進口國將直接面臨能源安全、物價通膨及工業成本飆升的壓力。他建議，首爾應採取多邊合作模式，與歐洲、日本等國共同應對，而非單獨與伊朗談判，以免變相承認德黑蘭對海峽的控制權。他也說：「從原則立場來看，維持不承認伊朗單方面控制或徵收通行費的立場是理想的。」    ,https://news.ltn.com.tw/news/world/breakingnews/5391368
194歲 「龜瑞」被宣告死亡！假獸醫發訃文騙加密貨幣  BBC也誤報,國際,2026/04/02 16:05,今年194歲的塞席爾象龜「喬納森」（Jonathan）在英屬聖赫勒拿島草地上悠閒生活。（圖：Kevin Gepford／維基共享，CC BY-SA 4.0）全球最年長的陸地動物之一、約194歲的巨龜「喬納森」（Jonathan），近日一度被傳出死亡消息，甚至被多家國際媒體引用報導。不過事後證實，相關消息來自一個冒充獸醫的假帳號，實際上是為了誘導民眾進行加密貨幣捐款的詐騙手法。根據英國《衛報》報導，該假帳號在社群平台X上，冒用Jonathan獸醫名義發文，聲稱這隻長壽陸龜已「安詳離世」，並附上悼念文字。該貼文迅速擴散，包括英國廣播公司（BBC）、《每日郵報》（Daily Mail）及《今日美國報》（USA Today）等媒體，一度引用相關內容發布報導。請繼續往下閱讀...不過經查證發現，該帳號實際來源位於巴西，並非真正的獸醫本人。真正負責照顧Jonathan的獸醫表示，他並未使用X平台，並強調Jonathan「仍然活著」，且相關貼文同時帶有加密貨幣募款連結，屬於詐騙行為。報導指出，Jonathan目前仍生活在南大西洋聖赫勒拿島的總督官邸草地上。當地官員在消息傳出後，甚至親自前往查看，確認牠正在樹下休息，狀況正常。Jonathan是塞席爾象龜（Seychelles giant tortoise），據信於19世紀初出生，1882年被送往聖赫勒拿島，至今已成為當地象徵之一。儘管牠已因白內障失明、嗅覺退化，但仍維持正常進食與活動能力。這起事件也再次引發對社群平台假消息與詐騙內容的關注。報導指出，即使是具高度可信度的訊息來源，一旦缺乏查證，也可能在短時間內被大量轉載，進一步放大錯誤資訊的影響。    ,https://news.ltn.com.tw/news/world/breakingnews/5391399
上海交大校慶片翻車！男當電競大神、女變「寶媽」遭炎上,國際,2026/04/02 15:35,"中國上海交大130周年校慶微電影出現一段旁白「電競大神敲上了代碼，舞台C位變成了寶媽」，引發性別歧視的批評浪潮。（擷取自微博）中國上海交通大學近日慶祝130週年校慶，其發布的微電影《東川路800號》因一段旁白涉及性別歧視而引發輿論撻伐。片中將男學生描述為「電競大神」，女學生則定義為「寶媽」，引發漠視女性職業成就、嚴重缺乏性別平等意識等批評聲浪。綜合中媒報導，該爭議源於影片一段對比鏡頭，畫面中男生在宿舍玩遊戲，女生則在練舞，旁白稱「電競大神敲上了代碼，舞台C位變成了寶媽」，被大批網友批評影片強行將女性與生育及家庭身分綁定，反觀男性卻能追求職業夢想。請繼續往下閱讀...參與演出的女學生更透過社群憤怒發聲，表示看到文案後「天都塌了」，質疑女性無論在大學多麼精采，最後身分難道只能是寶媽？她更直指校方從頭到尾竟無人發現問題，「從一開始寫文案的人，到最後過審的人，到配音的人，都不覺得有問題，這才是最大的問題。」儘管有少數網友認為職業不分貴賤、成為「寶媽」並非侮辱，但多數輿論質疑為何男生的落點是職業，女生卻是家庭角色，「這難道就是交大對女同學的期許嗎？」、「名校之大，不在大樓，而在大氣、在格局。連基本性別平等都做不到，再輝煌的校史也顯得蒼白。」面對排山倒海的負面評價，上海交大多名學生證實，校內論壇已出現製作單位「融媒體中心」的致歉聲明。校方在聲明中坦承，微電影因把關不嚴與工作疏漏引發社會關注，對此致以誠懇歉意。目前相關影片已全面下架，校方表示已與參演同學溝通道歉，將盡全力降低事件影響。上海交通大学微电影《东川路800号》中的台词“舞台C位变成了宝妈”引起了女演员本人的愤怒。她是一位女权主义者，认为该微电影只强调了女性的生育价值，是辱女。目前，上海交大已删除该微电影。 pic.twitter.com/ZKygp2T1BT— Sagêr Gyaebo ♂⚖️ 萨格杰布 （@SagerRgyalpo） April 1, 2026 上海交通大学微电影《东川路800号》中的台词“舞台C位变成了宝妈”引起了女演员本人的愤怒。她是一位女权主义者，认为该微电影只强调了女性的生育价值，是辱女。目前，上海交大已删除该微电影。 pic.twitter.com/ZKygp2T1BT    ",https://news.ltn.com.tw/news/world/breakingnews/5391283
戰小草爆紅！日議員上畠寬弘承諾：破10萬將訪粉絲最多台灣城市,國際,2026/04/02 15:21,日本神戶市議員上畠寛弘。（圖擷自「@NorihiroUehata」X）日本神戶市議員上畠寛弘日前「因表態不應允許『試圖逃避司法的柯文哲』入境之言論」遭「小草」出征，他在與民眾黨支持者隔空筆戰後爆紅，吸引大量台灣粉絲追蹤。對此，上畠寛弘今表示，目前他的社群粉絲追蹤數已達8萬7千人，未來若破10萬大關，預計將拜訪粉絲最多的台灣城市。上畠寛弘今（2日）上午於Threads發文提到，他的脆帳號粉絲數已經來到8萬7000人了，「真的非常感謝一路以來支持我的大家！」上畠寛弘更笑稱，「如果達成10萬人的話，我想前往粉絲最多的台灣城市拜訪大家！！今後也請多多指教！」請繼續往下閱讀...網友見狀紛紛留言，有人說「希望你願望很快達成」、「謝謝議員一直為台灣發聲，由衷感謝」、「歡迎議員來台喔！哪裡都好。就是支持台灣！讚」，也有人敲碗建議，「請一定要拜訪高雄，海景會讓您驚豔」。     在 Threads 查看    ,https://news.ltn.com.tw/news/world/breakingnews/5391082
川普嗆轟回石器時代！伊朗怒回戰到底：還沒用全力 更猛攻擊要來了,國際,2026/04/02 15:08,伊朗軍方回應川普演說，稱美、以對伊朗的軍事力量一無所知，誓言將持續戰爭，直到敵人「徹底投降」。圖為德黑蘭國防博物館外的伊朗飛彈模型。（法新社）美國總統川普於美東時間1日晚間9點針對伊朗問題發表全國演說，川普威脅未來2到3週，將對伊朗進行極其嚴厲的打擊，「把他們帶回石器時代」；對此，伊朗軍方回應，美、以對伊朗的軍事力量一無所知，誓言將持續戰爭，直到敵人「徹底投降」。綜合外媒報導，伊朗軍方作戰指揮部「哈塔姆・安比亞」（Khatam Al-Anbiya）透過伊朗半官方組織《塔斯尼姆通訊社》（Tasnim）發布聲明回應川普，稱「你們對我們的軍事力量與裝備的了解是不完整的、對我們龐大且具戰略性的能力一無所知。」請繼續往下閱讀...「哈塔姆・安比亞」發言人表示：「不要以為你們已經摧毀了我們的戰略飛彈生產中心、長程攻擊與精準打擊無人機、現代化防空系統、電子戰系統，以及特殊裝備。」強調伊朗的戰略軍事生產是在美、以完全不知情、也永遠無法觸及的地方所進行，目前遭攻擊的據點「無關緊要」。發言人警告將採取「更加猛烈、更大規模且更具破壞性的行動」，並誓言將持續戰爭，直到敵人「永久、徹底且最終的投降」。    ,https://news.ltn.com.tw/news/world/breakingnews/5391266
