Title,News_Type,date,content,url
踹桌替災民討公道遭傅崐萁怒告  張峻再轟：只懂欺騙鄉親！,政治,2025/10/29 16:36,張峻砲轟傅崐萁只會表演、欺騙鄉親。（資料照）國民黨立委傅崐萁27日回花蓮舉辦「光復鄉堰塞湖受災區重建座談會」，但只邀自己人和樁腳，大批災民事情未收到通知，到現場抗議卻被擋在門外，縣議會議長張峻得知此事後帶領災民闖入會場，怒踢傅崐萁桌子，相關畫面曝光引發外界熱議。今天（29日）張峻又痛批，傅崐萁從頭到尾只懂表演、欺騙鄉親！張峻27日帶領被拒在門外的災民闖進傅崐萁等人主辦的受災區重建座談會，一進去就怒氣沖沖的踹了傅崐萁的桌子，不斷質問為何沒有通知災民有這場座談會。傅崐萁起先似乎被這突如其來的舉動嚇到，回過神後相當不爽地嗆張峻是「流氓」，還稱當天是「國會在開會」，要警察抓人。隔天傅崐萁更大動作對張峻提告，但張峻直言，為了災民踹這一腳，被告也值得，當然他也會做出反擊。請繼續往下閱讀...今天張峻在其臉書貼文留言區又說：「傅崐萁口中的『國會開會』，其實只是場政治秀！傅崐萁日前跑到光復鄉開座談會，聲稱『這是國會在開會』。但實際上，立法程序並不是這樣走的。目前《樺加沙風災暨花蓮馬太鞍溪堰塞湖潰壩災後重建特別條例草案》早已逕付二讀。所謂『逕付二讀』，是指法案在立法院一讀時，若有立委提議並獲得20位以上委員連署或附議通過，即可跳過委員會審查程序，直接進入二讀會。在二讀階段，立委會逐條討論、修改、協商，是整個立法過程中最關鍵的實質審查階段。」「換句話說，法案現在重點在於協商與表決，不是靠辦幾場地方座談會就能推進。 因此，傅崐萁口中的『座談會』或『形式會議』，根本沒有任何法律效力。這樣的活動，就算開到天亮，也不會讓法案更快通過！如果傅崐萁真的關心災民、真心想促進重建，他應該投入跨黨協商，爭取讓條文更完善、預算更快下達。並同時回到地方傾聽每一位受災民眾的意見，把民眾的實際需求轉化為具體的政策工具。」張峻接著道：「更令人遺憾的是，傅崐萁還說『沒有一個場地能容納全部8600多名災民』，但若他真有心要傾聽，就應該多辦幾場座談會，一場場收集災民的聲音與訴求，這樣的行動，才稱得上真正在乎人民。結果呢？他又來老套路，開會、拍照、發新聞稿、辦一場過水的座談會、上傳社群、發地方媒體，畫大餅、搶功勞、代言縣政府。傅崐萁與這些『傅崐萁們』，仍舊一樣在利用資訊落差欺騙鄉親，把災後重建當成政治表演的舞台，根本沒在做實質有意義的事情。災後重建不是政治秀，也不是少數人用來收割的工具。」最後張峻表示，「花蓮的鄉親需要的，是誠意、效率與實質行動，而不是『我給你恩惠』的姿態與空洞口號。真正可悲的，不是災民不了解立法程序，而是那些口口聲聲說『我最懂』的人，其實從頭到尾，都只懂得表演、欺騙鄉親。」熱門賽事、球星動態不漏接    ,https://news.ltn.com.tw/news/politics/breakingnews/5227794
索資觀旅局媒宣經費僅回覆200萬 中市議員批刻意模糊、閃避監督,政治,2025/10/29 16:33,台中市議員周永鴻（左）和蔡耀頡質疑市府觀旅局，每年在媒體行銷與廣告上的支出超過2500萬元。（記者張軒哲攝）台中市議員周永鴻和蔡耀頡今（29日）指出，觀光旅遊局在議員要求提供「媒體與宣傳」經費明細時，僅回覆一筆200萬元的「一般事務費」，刻意模糊、閃避監督。實際上，觀旅局每年在媒體行銷與廣告上的支出超過2500萬元，最大單一標案金額甚至突破600萬元，與觀旅局資料明顯不符，痛批觀旅局長陳美秀是「說謊局長」。對此，陳美秀反駁說謊，「議員汙衊她人格。」台中市議員周永鴻和蔡耀頡今天在市議會交通地政業務質詢觀光旅遊局。周永鴻指出，觀旅局提供的資料僅列出一筆象徵性的每年200萬，卻避談各類「行銷推廣」、「宣傳計畫」與「節慶整合」等預算，以去年為例，整體項目合計約2541萬元。他批評觀旅局，明明一年花了兩千多萬在打廣告、拍影片、辦活動，卻只願意承認200萬。請繼續往下閱讀...周永鴻指出，他之前跟市府所有局處索取媒體與宣傳預算資料，全部局處提交的資料共有280頁，但觀旅局就只提出3筆，合計不到1頁，觀旅局近年的媒體標案金額動輒數百萬。舉例來說，「台中市全域觀光行銷宣傳案」預算就高達650萬；另外「摘星台中推廣案」預算也高達250萬不等，與官方資料落差極大。蔡耀頡表示，台中知名的三大商圈人口流失近百萬，觀光財流失慘重，但觀旅局長依舊自我感覺良好，以統計數據有上升來自我安慰，即將到來的聖誕節跨年商機，也是都一成不變了無新意，台中市政府從上到下都非常傲慢，認為把台中行銷宣傳的很好，市政推動非常棒，但事實上完全跟現實脫節。熱門賽事、球星動態不漏接    ,https://news.ltn.com.tw/news/politics/breakingnews/5227814
傳罷團挺沈伯洋出戰北市長 王世堅加碼點名「這3人」,政治,2025/10/29 16:27,民進黨中常會，民進黨立委王世堅受訪。（記者王藝菘攝）民進黨布局2026地方選舉，外傳罷免團體力挺民進黨立委沈伯洋出戰台北市長。對此，民進黨立委王世堅今（29日）評估，沈伯洋是好人選，而民進黨人才濟濟，包括民進黨秘書長徐國勇、立委莊瑞雄、前立委高嘉瑜，都是全方位全能型的人選。民進黨針對非執政的直轄市長、縣市長選舉，訂定參選意願表達期限，在10月31日下午5時前，有意參選者可以填寫參選意願表，送至中央黨部，選對會預計於11月5日開會討論。請繼續往下閱讀...對於沈伯洋獲推薦參選的傳聞，王世堅今出席民進黨中常會前受訪表示，沈當然是好人選，民進黨人才濟濟，例如徐國勇、莊瑞雄、高嘉瑜，都非常適合，是全方位全能型的人選；民進黨在22縣市一定是讓最強的出來，跟其他政黨比賽，讓選民抉擇。媒體詢及，壯闊台灣聯盟創辦人吳怡農可能遞交參選意願書？王世堅認為，這也很棒，就是「雙帥對決」，或是像高嘉瑜是「俊男跟美女對決」，又或者像徐國勇、莊瑞雄都是法律政治專業，可以讓選民看到民進黨有這麼多好的人才。此外，吳思瑤則表示，沈伯洋應該沒有參選台北市長的意願，沈是專業的國防、國安立委，是民進黨非常專業優質的不分區立委，戰場就在國會。至於自己也被點名出戰，吳思瑤強調，她的戰場在立法院，現在又承擔民進黨政策會責任，縱觀中央地方的執政，全方面的政策要更精進，提出更亮眼、更前瞻、更進步的政策，這是自己眼前最重要的工作。吳思瑤說，民進黨對於台北市長人選會徵詢多方意見，有意願者都可以表達，尊重黨內民主機制，但要如何有創意、如何端出新鮮又有戰鬥力的人選，確實值得選對會成員傷腦筋。吳坦言，畢竟在台北市藍綠結構相對失衡，藍營占贏面、綠營比較弱勢，提名人選需要多加思量，但最終不管提名誰，都要全黨齊心作戰才會贏。熱門賽事、球星動態不漏接    ,https://news.ltn.com.tw/news/politics/breakingnews/5227795
卸任後永遠是國民黨志工 朱立倫曝子弟兵下一步,政治,2025/10/29 16:27,即將卸任黨主席的朱立倫29日主持任內最後一場中常會，會後準備了小點心與在媒體室的採訪記者握手道別、合影，即將卸下重擔的好心情寫在臉上，場面溫馨。（記者張嘉明攝）國民黨主席朱立倫今日最後一次主持中常會，對於卸任後規劃，文傳會主委林寬裕受訪表示，所有人都會團結，不管朱立倫在哪、在什麼地方，「他（朱立倫）永遠是國民黨的志工，會為台灣、中華民國、國民黨繼續打拚」。黨發言人楊智伃、鄧凱勛被問到下一步，也強調不管在哪個位置，都會在未來繼續幫助國民黨。朱立倫則在會後與媒體寒暄時，意有所指說：「我們祝福楊議員」。楊智伃說，不管在哪都會替國民黨加油，接下來2026、2028都是重要戰役，這4年她在黨中央歷練過非常多場、非常扎實的一戰戰役，接下來會繼續把這段時間累積的能量及經驗，在未來繼續幫助國民黨。鄧凱勛也說，這2年10個月在青年團、發言人任內學習且歷練很多，接下來不管在任何地方，都會貢獻自己的經驗，一定會用盡全力替中華民國、替台灣謀求更好的福祉。請繼續往下閱讀...朱立倫會後到記者室與媒體寒暄，感嘆卸任新北市長已經7年多了，時光飛逝，他在新北市長任內的三個發言人葉元之、江怡臻、黃詩婷，現在都在各領域發光發熱，副秘書長江俊霆當年還是滿頭茂密的頭髮，並透露林寬裕與台中市長盧秀燕同年，兩人是同期的主播。朱也爆料，楊智伃目前還未婚，也沒有男朋友」，對於楊智伃的下一步，朱更意有所指說：「我們祝福楊議員」。被問到子弟兵楊智伃下一步，朱立倫意有所指說：「我們祝福楊議員」。（記者林欣漢攝）熱門賽事、球星動態不漏接    ,https://news.ltn.com.tw/news/politics/breakingnews/5227796
台中豬瘟疫調荒腔走板 何欣純:做市長就是要解決問題,政治,2025/10/29 16:15,台中豬瘟防疫荒腔走板 何欣純展行動力，跟市場豬肉業者座談。（記者許國楨攝）台中爆非洲豬瘟，疫情爆發都已第8天，市府還在「更新」通報時間、通報人及獸醫數，民怨四起；立委何欣純今天接連拜訪中興大學，請益討論廚餘去化新技術，同時跟豬肉販賣業者座談，她強調，將向中央轉達相關建議，期與地方一起合作努力，度過艱困這一關，強調「做市長，就要解決問題」。台中市爆非洲豬瘟後，台中市府疫調作為接連被爆漏洞百出，疑延遲採檢、檢體用宅急便寄送，市長盧秀燕領導的盧市府團隊更是說謊連環爆，不但當事豬場廚餘蒸煮多月未查，連病豬出現後下指示的「獸醫師」竟只是「獸醫佐」，甚至到昨天都還在「更新」通報時間、通報人及獸醫數，連豬隻死亡數都「校正回歸」，廚餘滿成「燕垃湖」，民怨四起。請繼續往下閱讀...何欣純今指出，台中市配合豬瘟防疫禁用廚餘餵豬政策，廚餘處理竟挖了11處土坑，沒有防護、直接曝曬、掩埋，讓大量未經處理過的廚餘「野地獻曝」，環境惡臭噁心，而且都是在原縣區，除讓市民怵目驚心，更憂很環境污染，甚至影響健康。何欣純說，日前中興大學校長詹富智，透過學校中研院院士楊秋忠開發的「TTT酵素處理技術」，可短時間內把廚餘處理成有機肥料，基於各種解決廚餘去化的方式，她即約訪詹校長及楊院士等其他專家，請益討論廚餘去化新技術，及建置所需的條件、評估等；今日下午她另與台中市場豬肉販賣業者對談，希望了解第一線相關業者所受衝擊。何欣純展現行動力強調，她處理事情的原則就是「遇問題、找專家、提解方」，「現在不做，一定後悔」，如果有好的政策、好的措施，一定要做，想盡各種辦法也要處理解決，她會持續跟中央溝通，向中央要求，「期與地方一起合作努力，度過艱困這一關」。已確定代表民進黨參選明年台中市長選舉的何欣純，更意有所指說，「做市長，就要解決問題」。台中豬瘟防疫荒腔走板 何欣純展行動力，跟市場豬肉業者座談。（記者許國楨攝）熱門賽事、球星動態不漏接    ,https://news.ltn.com.tw/news/politics/breakingnews/5227786
朱立倫將率員總辭被批內鬥 鄭麗文：當善意給新主席最大人事空間,政治,2025/10/29 16:12,針對朱立倫將率黨員總辭，鄭麗文表示是給新主席最大人事空間。（記者張協昇攝）國民黨新當選主席鄭麗文11月1日即將走馬上任，針對即將卸任的朱立倫表示為了「建立慣例」，將帶著221位黨員「一次性總辭」，引發黨內不同聲音，並被批評是內鬥，鄭麗文今（29日）出席南投縣議會感恩餐會時表示，她寧可把朱主席的這個動作看做是一種善意，目的希望把最大的人事空間，留給她這位新任的主席。鄭麗文表示，黨內什麼聲音都有，她寧可把朱主席的這個動作，作為是一種善意，目的是希望把最大的人事空間，留給新任的主席，所以第一個她要謝謝朱主席，也要謝謝不管是義務職或者是有給職的這次一起總辭的黨工朋友們，感謝他們過去這段時間對國民黨的付出。國民黨新當選主席鄭麗文29日到南投縣議會拜會，縣長許淑華熱絡接待。（記者張協昇攝）熱門賽事、球星動態不漏接    ,https://news.ltn.com.tw/news/politics/breakingnews/5227792
謝龍介稱林俊憲民調拉近中 陳亭妃嗆「不演了」：直接介入綠初選,政治,2025/10/29 16:09,立委陳亭妃。（資料照）2026地方選舉起跑，有意角逐台南市長選舉的國民黨立委謝龍介稱，民進黨立委林俊憲的支持度上升當中，與其初選對手陳亭妃的距離會不斷拉近。對此，陳亭妃今天表示，謝龍介不演了，直接介入民進黨的初選，質疑他在怕什麼。謝龍介日前在直播中表示，曾有媒體人找他跟陳亭妃一起直播，結果陳當天說生日沒出現，但媒體人已經找過他跟林俊憲直播一次了，但陳亭妃不能來，訪問謝龍介就夠了？不是，對方又去找林俊憲來，「講這些是要表示，林俊憲在上升當中，跟陳亭妃的距離會不斷拉近」。他也提到，若接到民進黨初選的電話，都說支持謝龍介就好。請繼續往下閱讀...陳亭妃說，隨著民進黨黨內民調時程接近，謝龍介終於露出馬腳不演了，直接用荒謬言論影響賴清德總統的形象，企圖影響民進黨黨內初選，分化民進黨的團結，也顯現出謝龍介對陳亭妃的害怕。陳亭妃表示，當這些所謂的「內幕」想操作民進黨分裂的時候，她在此要呼籲所有支持者，更應該團結起來，集中選票支持讓謝龍介最害怕的陳亭妃，2026能六戰六勝謝龍介的陳亭妃，一起拒絕國民黨這些低劣的政治操作。熱門賽事、球星動態不漏接    ,https://news.ltn.com.tw/news/politics/breakingnews/5227732
北市沒條件普發現金 苗博雅批蔣萬安自業自得、咎由自取,政治,2025/10/29 16:06,蔣萬安強調，台北市相比中央沒有條件普發現金。（記者田裕華攝）藍白陣營過去一年鼓吹普發現金還稅於民，立院也三讀通過韌性特別預算條例將普發萬元。北市藍綠黨團也提案，北市也可以普發現金，但市府以財源不確定性認為沒有條件普發。社民黨議員苗博雅今（29日）嗆，是誰讓人民有錯誤認知，就是台北市長蔣萬安自業自得。蔣萬安今赴議會進行追加減預算報告，苗博雅指出，決算報告指出，北市過去10年超收868億元，包含遺產稅、贈與稅與印花稅等，而蔣萬安現在的態度是，北市沒有相關條件。請繼續往下閱讀...蔣萬安強調，中央是稅收超收，且達到5200多億，台北市相比之下沒有條件。苗博雅說，台北市超收也是超收，他也反對沒來由的普發現金，但是現在社會上人民普遍有錯誤認知，覺得超收、超徵就是要還給人民，造成這樣的結果，就是藍白過去大力宣傳的結果，這也包括蔣萬安自己。苗博雅批，蔣萬安自己自業自得、咎由自取。蔣萬安則回嗆苗博雅雙標。雙方唇槍舌劍直至質詢時間結束仍未停歇，最終議長戴錫欽出面緩頰稱時間已經結束，雙方才消停。熱門賽事、球星動態不漏接    ,https://news.ltn.com.tw/news/politics/breakingnews/5227778
批謝龍介質詢再爛都無法可治 吳思瑤：應檢討不分區立委制度,政治,2025/10/29 15:55,民進黨中常會，民進黨立委吳思瑤受訪。（記者王藝菘攝）國民黨立委謝龍介今（29日）在立法院內政委員會質詢時，將海委會主委管碧玲錯認為內政部長劉世芳。對此，兼任民進黨政策會執行長的立委吳思瑤批評，立委「認不對人」前所未見，不分區立委不需要面對民意課責，再怎麼混、再怎麼爛，都無計可施無法可治。吳思瑤今天出席民進黨中常會前受訪直言，謝龍介從政非常久，居然連劉世芳和管碧玲、內政部和海委會都分不清楚，立法院常見立委問政文不對題，但認不對人倒是前所未見。請繼續往下閱讀...吳思瑤說，這笑話發生在謝龍介身上，大家都說這是ㄧ個好笑的事，但她笑不出來，因為這些不適任的不分區立委，不需要接受民意的檢驗，一再於國會議事殿堂荒腔走板；不分區立委的適任性與否，不受民意究責的部分，值得讓台灣社會好好思考，制度應當要調整。「謝龍介到底是有多混？劉世芳、管碧玲傻傻分不清楚，這是國民黨不分區立委的素質水平嗎？」吳思瑤表示，謝龍介一再被評鑑為待觀察名單、執行率吊車尾，各黨對於提名的不分區立委都有政治責任。吳思瑤強調，不分區立委沒有被罷免的風險，也不需要對民意負責，國民黨、民眾黨不是要修憲嗎？在憲政的制度上，呼籲大家可以好好深思。熱門賽事、球星動態不漏接    ,https://news.ltn.com.tw/news/politics/breakingnews/5227716
黨工統一總辭被質疑刁難鄭麗文 朱立倫：是給最大的空間,政治,2025/10/29 15:53,國民黨主席朱立倫29日主持任內最後一場中常會。（記者張嘉明攝）國民黨新任主席鄭麗文將於11月1日上任，國民黨主席朱立倫日前宣布，為建立慣例，包括黨主席、副主席、秘書長、一級黨務主管等所有相關專職幹部及各縣市地方黨部主委，總計211位專職、非專職人員將統一在本月底提出總辭。對於外界質疑總辭是故意在刁難鄭麗文，朱立倫今日主持中常會時表示，總辭是方便給鄭麗文主席最大的空間，哪些人可以留任、可以新聘，都尊重主席，不要造成新主席任何一點困擾，「這些都是4年前沒有的」。朱立倫子弟兵、國民黨智庫副執行長凌濤也表示，總辭沒有說不能回聘，這是要給新任黨主席最大的空間，也是建立一個最好的民主慣例。這沒有刁難的問題，新任主席鄭麗文如果想要去各自接觸回聘，那都是尊重跟祝福。請繼續往下閱讀...朱立倫日前對外宣布，為建立慣例，包括黨主席、副主席、秘書長、一級黨務主管等所有相關專職幹部及各縣市地方黨部主委，總計211位專職、非專職人員將統一在本月底提出總辭，以尊重新主席鄭麗文的任命權。「鄭中央」交接小組人員27日由即將出任副主席兼任秘書長的李乾龍率隊，前往中央黨部與現任「朱中央」黨務團隊進行黨務交接工作。朱立倫今日表示，這次黨主席選舉競爭很激烈，但是選後第一時間，他就與新任主席鄭麗文通電話，強調國民黨一定要團結，他只期待國民黨更好、更強，在鄭麗文帶領下，大家能團結一致。他上禮拜也與鄭麗文見面，詳細談了很多包括人事、預算、黨務、選務，做了最好的溝通，也希望做最適切的安排。朱立倫指出，週一新任的秘書長李乾龍、黃健庭等多位黨務幹部，也做了相關明確的交接，「這些都是4年前沒有的」，包括為什麼要總辭，就是方便給鄭麗文主席最大的空間，哪些人可以留任、可以新聘，都尊重主席，不要造成新主席任何一點困擾，選務、黨務及未來的工作，都是要靠黨內大家團結，不要再有任何對立。熱門賽事、球星動態不漏接    ,https://news.ltn.com.tw/news/politics/breakingnews/5227733
王世堅嗆「沒格調老太太」 周玉蔻罵「又髒又醜又笨」,政治,2025/10/29 15:52,民進黨中常會，民進黨立委王世堅受訪。（記者王藝菘攝）民進黨2026台北市長參選人備受討論，對於網友推薦民進黨立委王世堅角逐，資深媒體人周玉蔻痛斥「堅屁啦！醜又髒」。對此，王世堅今（29日）回嗆，極少數「沒格調的老太太」，可能是「維生的掃把掉了，就慌了」，所以不評論她。周玉蔻下午再反擊王世堅「肉麻當有趣」，「不只又髒又醜，還又笨」。民進黨布局2026選戰，周玉蔻今於社群平台發文表示，「民進黨會提名沈伯洋參選台北市長嗎？我猜不會」，並直指現在民進黨的領導群及支持者「完全缺乏想像力」。有網友留言推薦王世堅參選，周玉蔻則抨擊「堅屁啦！醜又髒」。請繼續往下閱讀...對此，王世堅出席民進黨中常會前受訪表示，自己一向不評論周玉蔻，第一，只評論有格調的人；第二，他對老太太一向敬老尊賢。王世堅說，絕大多數的老太太都是在家裡含飴弄孫、貽養天年，但有一些有失落感的老太太們，極少數沒有格調的老太太，可能是掃把掉了，她就慌了，因為掃把是她維生的功能，可以騎著掃把到處亂飛，所以自己不予評論。王世堅也重申，他根本完全沒有做參選台北市長的規劃打算，「完全沒有，我完全沒有。」周玉蔻則為此發文反擊：「跟我周玉蔻談格調？你王世堅也配？！」她列舉王世堅「帶椿腳女兒開房間，小里小氣上摩鐵、匆匆忙忙、草率粗糙、還不認帳」，「綠營選區取暖」才能當選立委，卻一天到晚扯自己人後腿「抱柯文哲白營大腿」，「三番兩次格調來格調去，肉麻當有趣」，「居然敢老女人來老女人去的，先擦乾淨你的盲眼睛」，「不只又髒又醜，還又笨」！（10/30 08:27更新）熱門賽事、球星動態不漏接    ,https://news.ltn.com.tw/news/politics/breakingnews/5227746
習近平賀電指明兩岸發展方向？ 鄭麗文：國民黨有兩大堅守底線,政治,2025/10/29 15:49,國民黨主席當選人鄭麗文表示，不管兩岸如何發展，國民黨將堅守尊重台灣2300萬人意願的底線。（記者張協昇攝）針對中國國台辦主任宋濤，28日接見即將接任國民黨副主席的馬英九基金會執行長蕭旭岑時指出，習近平主席發賀電給國民黨主席當選人鄭麗文時指明了兩岸關係的發展方向，鄭麗文今（29日）在南投強調，不管兩岸如何發展，國民黨處理兩岸關係的原則，有兩大堅守的底線，第一是和平，第二就是必須尊重台灣2300萬人的意願。鄭麗文指出，感謝習主席的賀電，由於現在大家都把台海當作是全世界最兵凶戰危的一個區域，我們希望能夠逐漸緩和穩定台海這種處境，希望能夠積極爭取開創和平的氛圍，因此她也一直不斷的勸告賴清德總統，一定要更加謹慎、更有智慧的處理兩岸關係，千萬不要讓台灣捲入不必要的戰火當中。請繼續往下閱讀...鄭麗文強調，中國長期以來對於兩岸的期待，大家其實都非常清楚，但不管兩岸如何發展，對於國民黨來講必須堅守的底線，第一個就是和平，第二就是必須尊重台灣2300萬人的意願。熱門賽事、球星動態不漏接    ,https://news.ltn.com.tw/news/politics/breakingnews/5227696
