Title,News_Type,date,content,url
高雄酒吧外搶搭計程車爆衝突2傷 3人涉傷害送辦,社會,2026/05/17 08:37,高雄酒吧外搶搭計程車爆衝突2傷，3人涉傷害送辦。（民眾提供）高市新興分局於今（17）日清晨5時30分許接獲報案，指中華三路一處酒吧外發生肢體衝突，線上巡邏警組獲報後立即火速趕赴現場處理，據查雙方疑因搶搭計程車起衝突，造成1男1女受傷。警方以優勢警力強勢介入並隔離雙方，在第一時間有效制止衝突擴大，初步了解，雙方彼此素不相識，皆於酒吧消費後準備搭車離開，不料在店外疑因搶搭計程車引發口角，進而衍生肢體衝突。請繼續往下閱讀...過程中，朱男、（34歲）、朱女（27歲）與林女（29歲）、一時衝動，竟隨手拿起騎樓的告示牌朝對方攻擊，導致林男（41歲）及黃女（39歲）頭部腫脹受傷。執勤員警除在場強勢控制秩序外，也隨即通報救護車，協助將受傷的2人先行送往大同醫院救治，所幸均無大礙。警方釐清案情及確認雙方身分後，全案訊後將動手施暴的朱男、朱女、林女3人，依刑法傷害罪嫌依法移送高雄地檢署偵辦。新興分局嚴正呼籲，民眾飲酒務必克制，警方針對任何暴力行為絕不寬貸，勢必依法嚴辦，以全力確保市民安全與社會秩序。    ,https://news.ltn.com.tw/news/society/breakingnews/5439606
高雄捷運2警察驚傳互毆 互不提出告訴,社會,2026/05/17 08:23,高雄捷運警察傳出互毆。（資料照，與新聞事件無關）高雄市捷運警察隊2名員警，昨（16）日結束勤務返回駐地時，竟然驚傳在辦公室的電梯大打出手，導致雙方臉部輕微挫傷。警方調查，2人因個性不合早有嫌隙，目前互不提出告訴。這起人民保母互毆事件傳出後，高雄警界引起一片譁然，認為有損形象。高雄市捷運警察隊今（17）日指出，該隊同仁因個性不合存有嫌隙，昨天中午勤務結束返隊，搭乘電梯期間發生衝突，致雙方臉部輕微挫傷。雙方情緒已平復，並表示互不提出告訴。請繼續往下閱讀...捷運警察隊強調，後續已啟動關懷輔導機制，並加強宣導同仁應理性溝通、避免情緒衝突，以維護團隊紀律及機關形象。    ,https://news.ltn.com.tw/news/society/breakingnews/5439601
竹科男被狗追摔瞎眼 求償竹縣動保所、科管局國賠151萬,社會,2026/05/17 08:09,竹科男遭犬追摔瞎眼，向動保所與科管局提國賠151萬。（記者蔡彰盛攝）新竹李男112年間騎機車行經竹科二期擴建計畫用地時，遭遊蕩犬追逐摔車左眼失明，認為竹縣動保所怠於捕捉加上科管局未設圍籬，訴請國賠求償151萬元，新竹地院審理認為李男請求並無法律依據，事故發生誠屬憾事，判決駁回李男之訴。李男說，112年11月騎機車行經新竹縣寶山鄉竹科二期擴建計畫用地，遭群聚遊蕩犬追逐，致重心不穩倒地造成左眼眶底骨折、左眼外傷性視神經病變、左眼失明，認為新竹縣動保所怠於執行捕捉，使當地已成遊蕩犬群聚地盤。而竹科管理局未於施工區域設置圍籬，無從阻擋動物闖入工區，要求竹縣動保所與竹科管理局應連帶賠償151萬元。請繼續往下閱讀...法官調查，李男未舉證遊蕩犬於事故發生前，另有何無故侵害他人之事實，動保法僅規定主管機關對於有該條情事之動物「得」逕行沒入，竹縣動保所得衡量能否掌握該遊蕩犬動態及捕捉可能性，以決定是否捕捉，有相當行政裁量空間。此外，李男未提出竹科管理局有設置警示標誌或護欄義務之法律依據，請求賠償顯屬無據。法官認為李男因犬隻衝出而摔車倒地，其原因可能係因個人駕駛狀況等因素所導致，難認與動保所、科管局故意或過失不法行為、怠於執行職務、就公共設施之設置或管理有欠缺間有何相當因果關係，事故之發生誠屬憾事，判決駁回李男之訴。    ,https://news.ltn.com.tw/news/society/breakingnews/5439596
愛車開進保修廠4年還修不好  新竹車主憤而提告求償160萬,社會,2026/05/17 07:31,愛車開進保修廠4年還修不好，新竹車主憤而提告求償160萬！（示意圖）是什麼樣的車，開進保修廠4年還修不好？新竹胡男將愛車開進陳男的保修廠修理，屢次催促都無效，憤而提告要求陳男賠償160萬，新竹地院審理後判賠121萬。胡男說，111年5月將自小客車交給陳男經營的汽車保修廠修理，迄今已逾三年，未完成修復及交付，顯逾一般合理修繕期間，使他還需支付第二次維修費用20萬8657元、維修期間不能使用車輛，所需租車代步損失7萬6000元、因維修拆裝造成將來車輛出售價值貶損的損失63萬3333元，要求陳男共應賠償160萬元。請繼續往下閱讀...陳男說，雙方自始就未約定完工日期，依胡男存證信函所載催告期限訂於今年7月5日，他尚未逾越胡男所訂催告期日，且他早於去年1月初即通知胡男將車領回，然胡男卻不理會。法官審酌一般車輛修繕作業中，維修期間3個月應屬合理期間，胡男多次詢問陳男交車時間，不可能再將催告期限訂於1年後之「115」年7月15日，則此「115年」顯為「114年」之誤繕，不影響催告及解除契約效力。最後法官判陳男需賠償維修費18萬元、不能使用車輛損失72萬元、車輛價值減損31萬元，合計121萬元。    ,https://news.ltn.com.tw/news/society/breakingnews/5439590
三寶大挑戰？這路鬼切、逆向、行人違規通通有 員林警方不忍了,社會,2026/05/17 07:13,員林市育英路鄰近市場，常有民眾跨越雙黃線買菜。（翻攝自threads／yannnnn__147）首次上稿 05-17 00:29更新時間 05-17 07:13彰化縣員林市華成市場旁的育英路近日被網友熱議簡直是「地獄級道路」，一段行車紀錄器影片在網路瘋傳，短短不到100公尺，竟接連遇上機車鬼切、逆向硬切、跨越雙黃線，還有行人、自行車直接橫越馬路等驚險畫面，宛如真實版「障礙挑戰賽」，不少駕駛直呼「太扯」。員林警方檢視影片後，將依法對違規行為開罰。請繼續往下閱讀...影片中可見，該路段兩側店家與攤販密集，車流人潮交錯。一輛機車突從路旁鬼切竄出，險些擦撞；對向車道有汽車逆向跨越雙黃線逼車，白色轎車會車時幾乎貼身而過，後方駕駛頻頻急煞。更誇張的是，一名阿伯騎單車突然在路中央大迴轉，民眾提菜籃直接橫越馬路，還有一名撐傘阿嬤慢悠悠跨越雙黃線，彷彿把馬路當自家客廳。當地居民無奈表示，育英路鄰近市場，上午買菜時段最混亂，「每次開車都像參加障礙賽，只能自己閃快一點。」也有人苦笑說，這是員林日常，「保護自己比什麼都重要。」員林警分局檢視影片後指出，已確認有機車未依規定使用方向燈、不依規定駛入來車道、單車未依標線行駛、大貨車違規停車，以及行人未依規定穿越道路等情形，違反《道路交通管理處罰條例》，將依法舉發，並持續加強取締與交通疏導。育英路常見車輛併排，還有機車鬼切竄出，以及民眾牽腳踏車跨越馬路。（翻攝自threads／yannnnn__147）    ,https://news.ltn.com.tw/news/society/breakingnews/5439557
羈押獲釋又趕工 男子玉清宮前騙走200萬遭判3年6個月,社會,2026/05/17 06:19,羈押獲釋又趕工，男子玉清宮前騙走200萬遭判3年6個月。（資料照）洪姓男子前年因擔任詐騙集團車手被捕並遭法院羈押，獲釋出所後不但沒汲取教訓，竟立刻「重操舊業」。洪男加入另一詐團，去年佯裝成理財專員，在苗栗市玉清宮前與一名被害人面交200萬元，隨即搭車到高鐵苗栗站把贓款轉交詐團其他成員。苗栗地方法院審理後，認為洪男主觀惡性重大，依3人以上共同詐欺取財罪，判處有期徒刑3年6個月。判決書指出，洪男前因涉及他起詐欺案件，於2024年10月1日遭法院裁定羈押，同月16日才獲釋。未料洪男出所後又加入其他詐騙集團，該詐團在網路上架設假投資網站，誆稱操作虛擬貨幣可以穩賺不賠，一名被害人信以為真，與集團相約面交「投資」。請繼續往下閱讀...去年6月21日中午，洪男聽從集團指示，前往苗栗市玉清宮前與被害人碰面，當場收取200萬元現金，得手後隨即前往高鐵苗栗站，將贓款轉交給集團的收水手。法官審理後，認為洪男正值壯年、高中畢業，入監前在工地工作月入5萬多元，洪男更稱家中還有老父與4歲幼女需要扶養，卻在羈押出所後旋即再犯；非適度加重其刑不足使其覺悟，最終從重判處有期徒刑3年6個月。    ,https://news.ltn.com.tw/news/society/breakingnews/5439572
登玉山返程墜谷亡 13人接力帶他回家,社會,2026/05/17 05:30,地勢險峻難行，搜救人員輪流背負遺體。（南投縣消防局提供）三十八歲蔡姓男山友十五日與隊友登玉山，攻頂後回程途中在主峰下風口段，不慎失足墜落二百公尺深山谷，因山上大雨加濃霧且地面濕滑，直升機無法執行吊掛，搜救人員先以繩索拖拉並固定在一處地點，昨日輪流以繩索加背負方式，將遺體送到直升機吊掛點，再由直升機吊掛送到竹山消訓中心，交由警方和家屬處理。兩百米深谷 陡峭濕又滑南投縣政府消防局指出，一支六人登山隊攀登玉山，十五日上午五時三十分順利攻頂後下行，回程走不到六分鐘，來自高雄的三十八歲蔡姓山友，在主峰下風口段失足墜谷。隊友報案求援，前日上午九時多，玉管處人員即在步道下方約二百公尺的深谷處發現蔡姓山友，經現場評估確認已無生命徵象。請繼續往下閱讀...背到空曠處 交直升機吊掛前日玉山上風狂雨驟，直升機無法執行吊掛任務，而事故現場濃霧籠罩，且地勢陡峭、坡面極度濕滑，搜救人員先以繩索固定遺體，防止滑落。前晚增派山搜專技人員抵達排雲山莊，昨日清晨十三人從排雲山莊走到事故現場，將遺體以架繩拖拉及搜救人員輪流背負，帶至步道空曠處。直升機昨日順利起飛，八時三十五分完成吊掛，降落竹山消防訓練中心，將遺體移交警方及家屬進行後續處置。南投縣消防局第三大隊長林志信表示，玉山主峰部分路段有鐵鍊和護網，蔡姓山友滑落地點沒有鐵鍊，推測可能是山上大雨加濃霧，視線不佳或是恍神踩空。呼籲山友不管山上的路徑如何，即使再簡單的路線，或曾爬過多次，每一次都要極度專注，抱持「如履薄冰」的精神，讓自己快樂上山，平安下山。直升機接近現場，特搜人員下降，與搜救人員合力將遺體吊掛。（南投縣消防局提供）蔡姓山友墜落200公尺深山谷死亡，搜救人員輪流背負遺體。（南投縣消防局提供）    ,https://news.ltn.com.tw/news/society/paper/1755107
網路自學噴火槍 孫安佐稱不知道是犯法,社會,2026/05/17 05:30,孫安佐14日在社群平台上傳「自製火焰槍」影片，昨被拘提到案，訊後被移送士林地檢署。（記者陳奕全攝）藝人孫鵬與狄鶯的獨生子孫安佐，涉嫌在北市北投一處河堤測試「自製火槍」，昨被警方拘提移送法辦。警訊中，孫安佐承認是利用網路上自學研發火槍，辯稱不知道是犯法。另與他同案被捕的經紀人、陳姓網紅「重讀」，則是將過錯推給孫安佐，全案現由士林地檢署偵辦中。經紀人重讀也被捕 錯推孫安佐警方昨日查扣孫安佐的手機進行調查，意外發現他曾拍攝過多次玩火槍的影片，孫安佐對此供稱，他多年前就在研究火槍，先是利用上網自學，再透過網路商店購買零件組裝。他稱之前就曾經拍過類似影片，不知道這是違法行為。請繼續往下閱讀...爭議一籮筐 狄鶯又要救子了廿六歲的孫安佐，過去爭議事件，最早可追溯至二〇一八年。當時年僅十八歲的他在美國賓州就讀，因揚言要對就讀高中發動恐怖攻擊而遭美國警方逮捕。警方在寄宿家庭查獲大量軍火，包括手槍、超過一千六百發子彈及十字弓等。這起轟動國際的案件，讓孫鵬與狄鶯砸下近三千萬台幣赴美救子，奔波長達二六一天。最終孫安佐被聯邦法院判決刑滿獲釋，遭遞解出境且終身不得入境美國。返台回歸校園後，孫安佐並未收斂。二〇二四年中，他在泰國普吉島旅遊時疑似吸食大麻，精神恍惚下不僅私闖當地民宅閒晃，甚至當眾脫褲裸露臀部，驚動泰國警方。狄鶯再次跨海救子。同年六月，他又與經紀人在台北信義區公然持瓦斯火槍現身夜店，引發街頭騷動，遭北檢搜索後以三十萬元交保，責付給父親孫鵬。此外，他更曾宣稱要前往烏克蘭參軍等脫序言行，屢屢登上新聞版面。孫安佐的感情史和他本人一樣充滿爭議。最受矚目的莫過於他與網紅「米砂」的墮胎風波。二〇二四年他在直播中坦承，自己是在與「阿乃」交往期間與米砂發生關係，並自嘲：「這改變不了我變成一個渣男的事實。」孫安佐在社群媒體上分享自己「二〇二六新發明神級火箭槍」。（記者劉慶侯翻攝自孫安佐IG）孫安佐的陳姓經紀人、網紅「重讀」。（記者劉慶侯攝）    ,https://news.ltn.com.tw/news/society/paper/1755106
詐團被追捕 國道拋丟18萬想卸責,社會,2026/05/17 05:30,"周姓幼教老師被詐騙集團吸收擔任面交車手，雖與被害人和解並予以全額賠償，惟法官認為她先前已面交十多次，不能宣告緩刑。（記者陳鳳麗攝）周姓幼教老師被詐騙集團吸收擔任面交車手，四天面交十多次收取詐款達二〇六萬餘元，最後在中興新村面交五十五萬元時，被害人事先報警逮人，周女為獲判緩刑，與未失款的被害人和解並予以全額賠償，法官判刑六個月，惟法官認為她先前已面交十多次，不能宣告緩刑。想賺快錢 幼教師當車手有大學畢業學歷的周姓幼教老師，為賺外快而被吸收成為詐團的面交車手，從去年十二月十九日起，依指示坐租賃車到不同地點面交詐款，拿到錢後就交給詐團的收水手。請繼續往下閱讀...18萬贓款 警全數撿回十二月廿二日先到他處收取十八萬元，晚間七時許到中興新村，與林姓被害人面交五十五萬元，林女交款前感覺好像被詐騙而報警，中興警方埋伏，周女拿到錢後被捕。等在一旁的接應租賃車發現後火速逃逸，員警一路追上國道三號，車上詐團人員在國三南下二三八公里處（名間路段），把先前面交贓款十八萬元拋出車外，後來員警全數撿回。周女坦承想賺錢才當車手，每次面交取款後就當場拿酬勞，共拿了三萬多元，花掉二萬多元，被逮時身上的一萬一千元是尚未花掉的酬勞，她為請求法官宣告緩刑，與面交未遂的林姓被害人和解，允諾全額賠償五十五萬元，並已先付了三十萬元。賠55萬求免關 踢鐵板南投地院法官審酌，雖其最後一次未得手，被害人沒有損失，而她還願意全額賠償五十五萬元，惟她四天已面交十多次得手二百多萬元，因此無法宣告緩刑，並以三人以上共同詐欺取財未遂罪，判刑六個月。    ",https://news.ltn.com.tw/news/society/paper/1755109
越南移工淪車手 賺萬餘判3年半,社會,2026/05/17 05:30,黃文東負責持提款卡提領被害人匯入人頭帳戶的款項，再交給上手製造金流斷點。（資料照示意圖）越南籍男子黃文東來台工作，卻加入同鄉組成的詐欺集團當車手，短短二天就在彰化縣盜領八十三萬元，機動力頗強，不料，第二天被警察撞見形跡可疑，跟監至租屋處搜索，驚見四十三張提款卡與十一萬餘元現金，他坦承二天就賺了一萬二千元，彰化地院依加重詐欺罪判刑三年六月，刑滿後驅逐出境。身懷四十三張提款卡判決書指出，黃男以工作之名入境台灣，去年九月二日在彰化縣租房子，同月三日加入越南同鄉組成的詐欺集團，四日與五日他在彰化縣大肆領錢，被害人都是受假交友、假投資之害匯款，一名吳姓男子想交女友，對方指示要先匯款加入會員，他兩天匯款十萬元，立即被黃男領走。請繼續往下閱讀...五日傍晚黃男盜領贓款後，被警察跟監至租屋處搜索，當場查獲四十三張提款卡、現金十一萬餘元，黃男坦承犯行，也承認自己已經賺一萬二千元。彰化地院認為，黃男沒有與被害人和解，也未繳回犯罪所得一萬二千元，不得減刑，依加重詐欺罪判刑三年六個月，犯罪所得與扣案的贓款十一萬餘元均沒收，刑滿驅逐出境，可上訴。另外，馬來西亞籍男子鄭智亦，去年七月以觀光名義來台，卻是當詐欺車手，七月廿日至廿四日短短五天，在彰化縣提款近九十八萬元，共十八人受騙，彰化地檢署具體求刑廿年，彰化地院則認定他觸犯加重詐欺共十八罪，宣告刑判處廿二年三個月，應執行二年十一個月，刑滿後驅逐出境，另須賠償二名被害人共約十八萬元，可上訴。    ,https://news.ltn.com.tw/news/society/paper/1755110
焚竹林餘燼燒光99棵羅漢松 判刑還判賠,社會,2026/05/17 05:30,台中地院判黃須賠償219萬餘元，仍可上訴。（資料照）黃姓男子去年在自家農地焚燒竹子，未確認火勢完全熄滅便逕自離開，沒想到殘留餘燼隨風飄散引燃鄰地園藝，九十九棵平均樹齡廿年羅漢松慘遭燒得焦黑碳化、全數報銷，台中地院依失火燒燬住宅、建築物以外之物罪，判黃拘役五十日，另參考園藝行進貨價，判黃共須賠償二一九萬多元。事發去年一月廿一日上午，黃男在大安區自家農地整理環境時，點火焚燒竹子與枯枝，原以為火勢已熄便放心離開，不料到了近中午，殘留灰燼在強風吹拂下飄往鄰近卓男園藝農場，迅速引燃大片植栽與周邊設備，火勢一發不可收拾。請繼續往下閱讀...由於農場內種有大量羅漢松、杜鵑、枸杞等作物，其中最珍貴的是九十九棵羅漢松，卓男長年悉心照料，具有相當高園藝與市場價值，火勢造成整片羅漢松園全毀，樹幹焦黑、根部碳化，損失慘重，但黃男否認犯行，辯稱離開前火早已熄滅，認為不能僅憑火調報告中的「可能性」就認定是他造成火災。但火災現場僅西南側樹林有燒損跡象，火勢未波及他處建物，綜合判斷是該處農田耕地燃燒灰燼，不排除餘燼火種飛火引燃可能，而當天現場也只有黃男一人在燒竹子，法院認為，黃男未盡確認火源完全熄滅注意義務，與火災發生具有明確因果關係，且事後否認犯行，也未積極賠償，刑事部分判拘役五十日，得易科罰金。民事求償部分，由於羅漢松價值不菲，法院參考園藝行進貨價精算，根據九十九棵羅漢松樹齡均廿年，樹徑二點二至三十五公分不等，推斷每棵約八百元至十七萬元不等，九十九棵共二一三萬多元，連同受損設備、其他植物等，判黃須賠二一九萬八九六二元，仍可上訴。    ,https://news.ltn.com.tw/news/society/paper/1755108
約會許未來！ABC男友豪贈百萬 醫材女業務淪洗錢人頭,社會,2026/05/17 05:30,（刑事局提供）社群相親活動結識台北市一名卅歲醫材女業務，今年三月間透過臉書平台的社群相親活動媒合，認識自稱美國華僑的周姓「ABC」男子，隨後便在對方每日噓寒問暖的甜言蜜語攻勢下，發展為情侶關係，還碰面約會，上月底對方以要給予廿萬人民幣（台幣約九十餘萬元）當女友未來一個月的生活費為由，騙取她五個銀行帳戶、提款卡，結果立即淪為詐騙集團的洗錢人頭帳戶，遭警方通知女業務到案，她始知受騙上當，目前台北市警方受理偵辦中。給５銀行帳戶收款刑事局表示，今年三月間，被害人在臉書廣告看到優質ABC相親活動，經由臉書平台媒合認識一名自我介紹為ABC（在美國出生、接受美國教育長大的華人後代）的周姓男子，兩人加LINE後，對方聲稱自己從小在美國長大，不擅講國語，故皆以英文傳訊聊天，期間周男表達早年投資有成，現已有房有車、財富自由，爸媽希望他找一個同文同種的華人伴侶，因而來台相親，未來將共同赴美生活。請繼續往下閱讀...之後，二人每天都會聊天，迅速發展為情侶關係，也相約外出碰面過一次，上個月，周男藉口有投資的稅務問題要回一趟美國，並表示願意將近期投資獲利的廿萬人民幣支付給被害人當未來一個月的生活費，但因金額過大，需要她提供五個銀行帳戶分別匯款。警通知到案 才知上當被害人信以為真，提供了自己名下的三個帳戶和跟哥哥借用的二個帳戶給對方，對方後續又以香港外匯管理中心查證金流為由，要求她先寄出這五個帳戶的提款卡給指定銀行人士，以便確認帳戶乾淨，上月廿日被害人自便利商店寄出五張金融卡，五個帳戶隨即被當作人頭帳戶匯入詐騙款項；三天後，警方陸續接獲民眾報案，立即將這些帳戶凍結，並通知被害人到案，被害人這時才恍然大悟，但對方已失聯，悔不當初。刑事局提醒，近年「假相親、真詐騙」案件仍持續發生，犯罪態樣慣用「ABC華人」、「財富自由的海外成功人士」等精心包裝身分，透過每日關心問候逐步建立信任後，慫恿投資詐騙，或者誘使提供銀行帳戶、提款卡，讓戀愛腦的被害人成為詐騙集團洗錢的工具，民眾須特別小心。    ,https://news.ltn.com.tw/news/society/paper/1755105
秀火箭槍闖禍 孫安佐拘提聲押 涉犯恐嚇公眾、公共危險、槍砲等罪,社會,2026/05/17 05:30,孫安佐在IG社群平台上傳火箭槍影片，引發公眾安全疑慮，檢方昨聲押禁見。（取自孫安佐IG）知名藝人孫鵬和狄鶯的兒子孫安佐，十四日在IG上傳影片，分享自己發明的火箭槍，火箭槍噴出十多公尺的巨大火焰，孫還表示：「要把一些老鼠給清掉，拿這個就剛剛好」；台北市警局北投分局昨當著孫男父母的面拘提他到案，孫的陳姓經紀人一併被捕，警方依公共危險罪嫌移送士林地檢署偵辦，檢方複訊後對孫安佐聲押禁見。裝煤油點火 射程達10多公尺孫安佐是在IG上傳影片，「公開二〇二六最新發明神級火箭槍」，畫面中孫揹著類似瓦斯桶，填裝煤油後點火，立刻噴出超巨量火焰，射程達十多公尺，頓時黑煙竄天。他聲稱全程都有做好安全措施，還表示，「把一些老鼠給清掉的時候，拿這個就剛剛好這樣」。畫面曝光引發網路議論。請繼續往下閱讀...警方根據檢舉，認為孫安佐持用的噴火槍，射程及威力超出一般民用範疇，且是在北投溪畔測試，火焰效果巨大，又緊臨公眾通行道路及民宅，引發公眾安全疑慮，明顯涉犯公共危險及槍砲等罪，昨日清晨前往孫安佐北投住家搜索，將孫安佐帶回調查，並查扣噴火器。火焰效果巨大 引發安全疑慮警方隨後前往孫安佐的陳姓經紀人家中搜索逮人，陳男因涉嫌協助拍攝影片和持用火焰槍被列同案。陳男也是網紅「重讀」（又稱重讀天月），為YouTuber團體「大麻煩」成員，是孫長期合作的經紀人與格鬥賽夥伴。檢方認為，孫男涉犯恐嚇公眾、放火未遂、公共危險、槍砲等四罪，有逃亡、滅證及反覆實施之虞，聲請羈押禁見。    ,https://news.ltn.com.tw/news/society/paper/1755061
