Title,News_Type,date,content,url
賴清德立院報告「統問統答」 民眾黨團：「實問實答」能接軌民意,政治,2026/02/23 16:22,總統賴清德上午邀集立法院長韓國瑜等五院院長新春茶敘，韓國瑜會後表示，他邀請總統同到立法院國情報告獲欣然接受。（總統府提供）總統賴清德今偕五院院長進行閉門新春茶敘，其中，立法院長韓國瑜會後表態邀請賴赴立院國情報告獲接受，並強調採「統問統答」作為基本禮遇；對此，台灣民眾黨團今午表示尊重，除期許總統就軍購預算、台美關稅等重大議題詳細說明，更重申無論報告形式為何，都應「實問實答」落實責任政治，真正接軌民意。總統賴清德今邀集行政院長卓榮泰、立法院長韓國瑜等五院院長新春茶敘，創我國歷史首例；據了解，此次閉門茶敘先後就中央政府總預算、國防預算、台美關稅、財政收支劃分法等四大議題交換意見；總統府發言人郭雅慧會後指出談話氣氛和樂，展現跨院溝通、理性對話的誠意；並針對韓國瑜邀請賴清德向立委及全體國民國情報告一事，代為表達接受意願，只要合乎憲政程序與制度安排，總統將欣然前往立法院國情報告。請繼續往下閱讀...另一方面，台灣民眾黨黨團指出，如今賴總統既已表態接受邀請，期許賴總統能秉持誠信、履行承諾，體現責任政治的精神。面對日益嚴峻的國際情勢與內政挑戰，總統應就國人高度關切之軍購預算透明化、台美貿易暨關稅協定等重大國政議題，提出具體且深入的報告，並清楚說明何以總統竟違反憲法義務，拒絕公布立法院三讀通過之法律。此外，民眾黨團強調，依照現行「立法院職權行使法」規定，總統報告之具體形式，將交由黨團協商並尊重其決定，更重申無論「統問統答」或「依序回答」，國情報告的核心目標皆應「實問實答」，方能破除形式主義、達到實質透明且具意義的責任政治，真正與民意接軌。    ,https://news.ltn.com.tw/news/politics/breakingnews/5348798
面對魏嘉賢宣布參選壓力 游淑貞秀出與鄭麗文合照,政治,2026/02/23 16:20,國民黨花蓮縣長參選人游淑貞（右），在臉書秀出與黨主席鄭麗文（左）合照。（擷取自游淑貞臉書）國民黨花蓮縣黨部推薦的花蓮縣長參選人游淑貞，今天春節連假後開工日，請假以中央委員名義​受邀前往中央黨部參加新春團拜，她在臉書上秀出與黨主席鄭麗文相見甚歡照片，並強調受到前主席吳伯雄鼓勵；鄭麗文也下達今年最重要的新春動員令：面對年底的選戰「硬仗」國民黨要全力揮出「全壘打」，把勝利贏回來！游淑貞指出，外界關心身為國民黨花蓮縣黨部唯一推薦的參選人，對縣議員魏嘉賢宣布投入年底縣長選舉有何看法？她除了送上誠摯的祝福，並表示民主社會的多元與活力，是台灣珍貴且值得共同守護的價值，期盼每位參選人都能以理性、正面的良性競爭，讓花蓮因為各方的努力，變得更美好。請繼續往下閱讀...游淑貞並呼應黨主席鄭麗文的「全壘打」動員令，強調年底選戰十分重要，藍軍大勝才能讓中央執政者反省，進而終結各種亂象及台灣的內耗。無論局勢變化，始終堅持為民服務的初衷，她更是國民黨經過全民調程序、黨內共識下唯一參選人。她強調，承擔是黨部的信任與鄉親的期待，接下來只有加倍努力，團結前進。有信心為藍軍爭取勝選，以「貞心貞意」守護花蓮，擦亮青天白日的招牌；從民意代表到吉安鄉長，20年基層的歷練，始終一步一腳印走進巷弄關心民眾的需求，了解花蓮所面臨的現實挑戰。她將以真摯的熱忱與具體政見，逐步推出「交通無礙、觀光復甦、產業提升、社福無憾、防災韌性」等「美好花蓮」規劃藍圖，爭取每一位鄉親的認同與支持。國民黨花蓮縣長參選人游淑貞（右）參加中央黨部新春團拜，向前主席吳伯雄（左）問候及請益。（取自游淑貞臉書）    ,https://news.ltn.com.tw/news/politics/breakingnews/5348804
賴總統國情報告「統問統答」？  傅崐萁：問答環節須朝野協商,政治,2026/02/23 16:18,國民黨團總召傅崐萁。（記者方賓照攝）總統賴清德今天邀集立法院長韓國瑜等五院院長新春茶敘，韓國瑜會後表示，賴總統願意到立院做國情報告，在方式上將採取「統問統答」。立法院國民黨團總召傅崐萁表示，國民黨團表示尊重，畢竟把話說清楚，比隔空喊話更有效率。至於問答環節，必須透過朝野協商，來確認進行的方式。傅崐萁表示，對於韓國瑜公忠體國的辛苦推動朝野溝通與費心的安排，創造更多互動協調的空間，深表敬意與謝意。既然總統願意到立法院進行國情報告，並接受國會的監督與詢答，我們表示尊重，畢竟把話說清楚，比隔空喊話更有效率。請繼續往下閱讀...傅崐萁說，期待這場報告能真正「解惑」，讓立委與國人關心的重大議題，包括預算編列、國安挑戰與政策方向，都能向國會與國人講明白、說清楚，不必靠補充說明、更不用靠會後解讀。至於問答環節，必須透過朝野協商，來確認進行的方式。傅崐萁表示，相信最好的禮遇與溝通，就是據實回答問題；最好的溝通，就是有問有答、不閃不躲。只要資訊透明、內容清?相信不僅能化解誤會，也能讓全民一起放心開拓好年，認真為台灣拚未來。    ,https://news.ltn.com.tw/news/politics/breakingnews/5348780
藍北市議員擬提33席！本週開考紀會 戴錫欽：如停權無法代表參選,政治,2026/02/23 16:15,國民黨台北市黨部主委戴錫欽。（記者董冠怡攝）民進黨直轄市議員初選民調執行順序今出爐，台北市將於3月9日至15日登場。國民黨台北市黨部主委戴錫欽受訪表示，預計2月26日上午召開市黨部委員會議，確認提名席次與時程，初估規劃提名區域31席、原住民2席。另，本週也會召開考紀委員會議，只要因抵觸黨紀而被停權，將無法代表國民黨參選。戴錫欽表示，預定2月26日會開市黨部委員會議，屆時就會確認議員提名相關席次和時程，目前初估，預計規劃區域31席、原住民2席，共計提名33席，但尚待市黨部委員確認後才會正式公告，大約3月初公告、領表登記，完成後進行初步協調，包括各區登記狀況並邀集所有現任議員和新人一起協調，未來如果進行初選，初選方式、期程及進行模式，還有特定選區看看有無可能透過內部協調，或用內參民調的方式確認提名事宜。請繼續往下閱讀...戴錫欽指出，現今初步規劃方向，士林北投、內湖南港、松山信義各5席，中山大同、中正萬華各4席、大安文山8席。對於民進黨已要開始初選，國民黨期程會否較晚？戴錫欽說，就他所知，民進黨有2區大概不需初選，其他4區是跟全國一起進行，抽籤決定何時進行相關民調，國民黨時程跟過去相比並無較晚，大約都是在3、4月進行。本週除了召開市黨部委員會議之外，他提到，也會召開考紀委員會議，將來不管是在公告或正式登記過程中，現任或新人牽涉黨紀問題，不論司法判決或其他因素，都會按照黨紀規定處理，「不管是一審判決有罪，或是相關規定，只要抵觸黨紀，該停權就停權，一但因為黨紀而被停權，基本上就沒有辦法以國民黨的名義代表參選。」    ,https://news.ltn.com.tw/news/politics/breakingnews/5348754
民進黨7縣市長待提名 吳崢：未設具體完成時間表,政治,2026/02/23 16:12,針對尚未完成提名的7個縣市，民進黨發言人吳崢會後轉述，民進黨選對會尚無進一步建議提名，後續也沒有設定具體時間表。（記者陳昀攝）備戰2026地方大選，民進黨今召開選舉對策委員會，針對尚未完成提名的7個縣市進行全面盤點。民進黨發言人吳崢會後轉述，會中針對各區人選廣泛交換意見與資訊更新，但尚無進一步建議提名名單；對於後續提名作業，也沒有設定具體時間表。吳崢表示，選對會今聚焦全台尚未提名的縣市長選區，包括台北、桃園、新竹縣市、花蓮等，會中雖有進行意見交換、資訊更新，但未進入下一階段決策程序。會中特別關心澎湖縣長陳光復的身體狀況，盼他早日康復。請繼續往下閱讀...民進黨先前目標在農曆年前完成縣市長佈局，對此，吳崢表示，民進黨確實按照這個目標，在年前完成大部分縣市提名，剩下少數幾區就持續努力推進，「沒有設定具體時間點」。對於外傳黨內已有共識推派竹北市長鄭朝方親征新竹縣長，吳崢回應，選對會今天對各選區都有花時間討論，其中也包括竹縣，選對會委員有注意到地方推薦與社會點名的人選，同時密切關注對手陣營的動態，目前還在全盤規劃階段。    ,https://news.ltn.com.tw/news/politics/breakingnews/5348784
鄭麗文接受外媒專訪：兩岸須建立互信 否則最終將只剩下武器,政治,2026/02/23 16:11,國民黨主席鄭麗文近日接受丹麥媒體《貝林時報》（Berlingske）專訪。（記者林欣漢翻攝）國民黨主席鄭麗文近日接受丹麥媒體《貝林時報》（Berlingske）專訪，闡述國民黨的兩岸路線與務實避戰的堅定立場，鄭麗文表示，兩岸必須建立互信，「否則最終將只剩下武器來替我們發言」。國民黨將不畏艱難，積極尋求與對岸展開對話的空間，以最大程度地為台灣爭取和平的籌碼。 國民黨指出，隨著近年來兩岸局勢升溫，軍事演習頻繁，台灣已然成為中美博弈下的最大風險熱點。鄭麗文主席與國民黨團隊深知，若兩岸失去溝通管道，台灣的處境將極度危險。 鄭麗文在專訪中強調了重建兩岸溝通橋樑的急迫性：「我們必須建立互信。否則，我們最終將只剩下武器來替我們發言。」請繼續往下閱讀...國民黨表示，國民黨的核心理念在於「避戰」與「保護台灣人民的最大利益」。鄭麗文務實地指出，一旦發生衝突，「台灣無法贏得戰爭，台灣將成為最大的輸家。」 這正是國民黨必須竭盡全力避免的悲劇。國民黨指出，基於對台灣未來的強烈責任感，鄭麗文表示，國民黨將不畏艱難，積極尋求與對岸展開對話的空間，以最大程度地為台灣爭取和平的籌碼。國民黨也呼籲，真正的愛台灣不是將國家推向戰爭邊緣，而是透過對話化解分歧。國民黨將持續致力於扭轉當前的危險局勢，為台灣人民創造一個和平、繁榮且安全的未來。 國民黨主席鄭麗文。（記者方賓照攝）    ,https://news.ltn.com.tw/news/politics/breakingnews/5348771
中市府公務機關門口貼「馬上有錢」 民進黨議員：不怪嗎,政治,2026/02/23 16:05,江肇國質疑公家機關貼「馬上有錢」的春聯很奇怪。（江肇國提供）今天是春節9天假後首日上班日，民進黨中市議員江肇國在臉書PO文表示，看到幾個公務機關門口貼滿「馬上有錢」，連有些派出所正門口也是這四個大字，但他認為公家機關門口貼「馬上有錢」不是很奇怪嗎？要求主管機關應該要有點概念；有網友回應要貼「馬上辦理」、「馬上處理」，「政府官員有錢，會被抓去關吧」；對此，市府不回應。今天是開春第一天上班日，民進黨中市議員江肇國表示，今天開工上班，看到幾個公務機關門口貼滿「馬上有錢」，連有些派出所正門口也是這4個大字，市府單位貼市長春聯並不奇怪，但這4個字出現在公家機關門口，難免觀感上覺得怪怪的。請繼續往下閱讀...江肇國強調，盧市長今年印了3個版本的春聯，除「馬上有錢」外，還有「超級馬利」及「龍馬有春」，若要貼還是有其他的選擇。江肇國表示，這些公家機關的主管應該還是要有點概念才好。很多網友在底下留言，有人說「馬上有錢沒文化」、「寧願貼印製媽祖的春聯比較實在安心」，各大服務窗口應該貼「馬上就好」，提升行政效率。    ,https://news.ltn.com.tw/news/politics/breakingnews/5348736
何欣純提立法院遷建台中 楊瓊瓔、江啟臣都認同,政治,2026/02/23 15:54,立委何欣純呼籲朝野合作，共同支持「立法院遷建台中」。（擷取自何欣純臉書）立法院長韓國瑜拋出立法院遷建議題，但選在台北的圓山飯店、空總舊址，立委何欣純呼籲朝野合作，共同支持「立法院遷建台中」，國民黨立法院副院長江啟臣及立委楊瓊瓔對此不約而同支持立法院遷台中，但認為應理性、制度性的討論。楊瓊瓔表示，很感謝韓國瑜院長願意把這個議題拿出來討論，從2009年起，她就多次在立法院提案，從國土均衡、交通樞紐與行政效率等面向，主張評估將立法院遷建到台中。請繼續往下閱讀...楊瓊瓔指出，立法院遷建台中並不是今天才被提出的想法，而是包括她及歷屆中部立委多次討論、評估後，可以平衡北中南發展被認真看待且具備可行性的方案，現在包括何欣純等不同政黨的立委願意重新提出相關構想，讓更多不同政黨、不同世代的支持者重新關注這個議題，她認為這是好事，也樂見公共討論能夠持續深化，如果朝野能夠就「立法院遷建台中」展開理性、制度性的討論，相信這不只是對台中有利，更是對台灣整體發展負責。江啟臣則表示，台中地理位置得天獨厚，氣候環境天生麗質，且從國土戰略與區域平衡來看，非常適合成為國家政治中心或首都，立法院遷建與否，任何提案我們都尊重，也盼社會各界能充分討論，立法院是合議制，最終都還是需要經過院會作出決議。江啟臣表示，台中地理位置得天獨厚，氣候環境天生麗質，且從國土戰略與區域平衡來看，非常適合成為國家政治中心或首都。（擷取自江啟臣臉書）立委楊瓊瓔表示，從2009年起，她就多次在立法院提案立法院應遷建台中。（擷取自楊瓊瓔臉書）    ,https://news.ltn.com.tw/news/politics/breakingnews/5348753
開工上香祈福   鍾東錦：持續努力讓苗栗建設大步邁進,政治,2026/02/23 15:52,苗栗縣長鍾東錦（左4）於農曆年假後上班首日，率縣府團隊到苗市玉清宮、天雲廟上香祈福。（圖由苗栗縣政府提供）苗栗縣長鍾東錦今（23）日農曆年假後上班首日，率縣府團隊到苗市玉清宮、天雲廟上香祈福，並提出新年縣政規劃，包括陽明交大苗栗分校、頭份第二交流道、大矽谷計劃、總圖等重大工程能順利推進，讓苗栗建設大步向前邁進，邁向科技新都心城市。鍾東錦上午與副縣長邱俐俐、秘書長陳斌山及各局處長分別到玉清宮、天雲廟上香，祈求縣政順遂，縣境平安、鄉親身體健康。請繼續往下閱讀...鍾東錦隨後向鄉親報告新年期許，包括教育、觀光、交通及大矽谷計劃等重大建設都能順利推動，他會帶領縣府團隊持續努力，也請各級民意代表協助，讓苗栗各項建設都能大步邁前，並轉型為科技新都心。「小孩的成長不能等，投資教育就是投資未來」鍾東錦指出，除希望國立陽明交大苗栗分校工程順利招標，讓苗栗有好學校，學子有希望，他大年初三也趁總統賴清德蒞臨苗栗參拜時，當面爭取新建頭份國中35間教室、竹南國中30間教室，及建國國中慈輝分校新建一所國小，來紓解頭份、竹南地區日趨擁擠的教育需求。此外，苗62之1號跨越大湖溪大橋工程、國道1號頭份第二交流道已在規劃中，同時中石化公司29公頃土地位於頭份市精華地段，縣府會向經濟部爭取轉型來活化，還有大矽谷計劃、苗栗縣總圖書館、苗栗市圖書館興建及爭取頭份市立圖書館等都能順利興建。    ,https://news.ltn.com.tw/news/politics/breakingnews/5348768
五院院長新春茶敘 卓榮泰：朝野和諧、社會大吉,政治,2026/02/23 15:30,總統賴清德今（23）日與五院院長新春茶敘，行政院長卓榮泰會後在臉書發文表示，這不只是一場茶敘，更是在新年度的起點，為國家發展共同踏出堅實的一步。（圖取自卓榮泰臉書）總統賴清德今（23）日與五院院長新春茶敘，行政院長卓榮泰會後在臉書發文表示，行政院新春向大家團拜完後，他前往總統府，總統賴清德邀請五院首長一同交流，這不只是一場茶敘，更是在新年度的起點，為國家發展共同踏出堅實的一步。而桌上的「和」桃酥與金「吉」茶，也寓意朝野「和」諧、社會「大吉」。賴清德總統上午在總統府大禮堂與行政院長卓榮泰、立法院長韓國瑜、司法院代理院長謝銘洋、考試院長周弘憲、監察院代理院長李鴻鈞新春茶敘。請繼續往下閱讀...卓榮泰表示，面對多變的國際局勢與國內經濟挑戰，行政團隊的任務很清楚：穩定民生、強化產業競爭力、推動區域均衡發展。大家分處不同崗位，承擔不同職責，但目標一致，就是讓國人安心、國家持續向前。卓榮泰指出，桌上的「和」桃酥與金「吉」茶，也寓意朝野「和」諧、社會「大吉」，期盼新的一年，國人朋友也可以事事大吉！團結不是口號，而是持續溝通、彼此成就的行動。行政團隊將以更務實、更有效率的步伐，全力回應國人期待，攜手為國家穩健前行。卓榮泰上午在行政院新春團拜時也表示，行政與立法兩院也應積極化解過去存在許多溝通障礙，稍後賴總統將召集五院院長，就政府施政成果進行交流分享，並盼暫時擱置過去部分具爭議性的事務，尤其國家仍有許多工作必須大家齊步向前，期盼行政、立法兩院未來互動能更積極、更順暢。    ,https://news.ltn.com.tw/news/politics/breakingnews/5348744
考試院新春團拜  周弘憲期許公部門攬才及留才機制與時俱進,政治,2026/02/23 15:27,考試院今日舉行新春團拜，院長周弘憲期勉新的一年持續健全文官制度。（考試院提供）考試院今（23）日舉行新春團拜，考試院長周弘憲院長致詞時表示，面對AI浪潮與人口結構變化等挑戰，考試院團隊將持續健全文官制度，使公部門攬才及留才機制與時俱進，作為國家永續發展的堅實後盾。周弘憲指出，過去這一年，考試院完成許多制度改革，在人事制度方面，修正了公務人員保障法、考績法、安全及衛生防護辦法、公務人員激勵辦法等法規，讓公部門霸凌防治與安全衛生防護得以強化，並放寬指名商調限制、育孫留停、新增身心調適假、調高職務列等及強化即時獎勵機制等，致力營造更為友善的公務職場環境；在國家考試改革方面，成立了測驗研究中心，精進國考試題品質。在此感謝所有考試委員的支持，及所有同仁的努力。請繼續往下閱讀...周弘憲表示，新的一年，面對AI人工智慧的發展、人口結構的變遷等挑戰，考試院團隊將持續推動國考減科、擴大電腦化測驗規模，藉以吸引更多年輕世代的人才進入公部門服務，也要再精進考績法制，以發揮考績積極功能等，期勉團隊共同推動各項改革，齊心走在正確的道路上。新春團拜活動由周弘憲主持，副院長許舒翔、考試委員、部會首長等共同參與。考試院今日舉行新春團拜，院長周弘憲感謝院部會同仁齊心努力。（考試院提供）    ,https://news.ltn.com.tw/news/politics/breakingnews/5348711
與民眾黨接觸3次 謝龍介：議員選舉採藍白合提名基調,政治,2026/02/23 15:25,謝龍介表示，他已跟民眾黨接觸過，將會以藍白合為基礎做為市議員提名基調。（記者蔡文居攝）國民黨在台南市議會共有12席，目前有多名新人將投入選戰。對於年底市議員選舉，身兼國民黨台南市黨部主委的立委謝龍介今天表示，他已跟民眾黨台南市黨部接觸過3次，為贏得2026最大勝利，將會以藍白合為基礎，做為提名基調。未來有好的人才，不排除共同競選，甚至全力輔選。謝龍介表示，有關市議員提名進程，明天與國民黨中央開會後，將召集委員會討論，之後將公告提名進度與時程，並配合國民黨與民眾兩黨中央的「藍白合」若能成功，就能贏得2026最大勝利，因此，提名會以藍白合做為提名基調。請繼續往下閱讀...目前民眾黨在台南市有意角逐年底市議員選舉的參選人，包括大新營陳詩薇、永康選區林乃立、北區和中西區江明宗、南區和安平區蕭漍華、東區陳進男與南關線選區郭如芳。謝龍介說，他已經跟民眾黨台南市黨部主委顏耀星接觸過3次，未來有好的人才，不排除共同競選，國民黨會幫助民眾黨的參選人，並與國民黨所有提名者融為一體。他希望以過去總統選舉支持藍白的6成為基礎，在2026重新再凝聚，以「藍白合」贏得最後勝利。    ,https://news.ltn.com.tw/news/politics/breakingnews/5348701
