Title,News_Type,date,content,url
柯建銘卸25年總召重任 潘孟安感念「定海神針」為台灣民主擋下風雨,政治,2026/02/24 18:55,總統府秘書長潘孟安（左）在臉書發布與立院民進黨團總召柯建銘（右）合照，感謝他多年付出。（資料照）立法院民進黨團總召柯建銘今卸下長達25年的總召重擔，總統府秘書長潘孟安晚間在臉書以「一生懸命，守護台灣」為題發文，細數與老戰友並肩作戰的歲月，感謝民進黨在國會的「定海神針」柯建銘，為台灣民主擋下無數風雨，期待繼續一起為台灣打拚。潘孟安表示，柯建銘總召是他的老前輩，20多年來，老柯就像民進黨在國會的「定海神針」，當年他還是國會菜鳥的時候，是老柯帶著他熟悉立院議事規則；後來我擔任幹事長，也是老柯帶著這群黨團幹部為台灣守下一個又一個法案。請繼續往下閱讀...潘孟安形容，老柯是議場的魔術師，也是國會的活字典，在民進黨是國會少數的艱困年代，他憑藉著對議事規則的精準掌握，擋下無數不公義的錢坑法案。潘孟安回憶，最讓他印象深刻的，是318學運時期，他身為民進黨團幹事長、老柯是總召，一群人為學生守住議場的門，也為台灣守下民主與自由。「傳承，是為了走更遠的路。」潘孟安指出，老柯這輩子最精華的時光都奉獻給這座議事廳，老柯常說，民主不只是對抗，更是如何在法律與條文的細節中，尋求國家利益的最大公約數。潘孟安強調，柯建銘光榮卸任總召，交棒給蔡其昌委員，展現的是世代交替的高度與胸襟。「柯總召，辛苦了！謝謝你這25年來，在每一個關鍵時刻，為民進黨、為台灣擋下風雨，未來的路，我們還要一起為台灣繼續打拚！」    ,https://news.ltn.com.tw/news/politics/breakingnews/5350188
民眾黨團大換血、民進黨團迎新總召 王婉諭：盼朝野合作讓政治重回正軌,政治,2026/02/24 18:51,時代力量黨主席王婉諭。（資料照）立法院今（24）日正式開議，行政院長卓榮泰也順利完成施政報告並接受施政總質詢，與此同時，新會期也將迎來大幅換血的民眾黨黨團、以及睽違25年的民進黨新任黨團總召。時代力量黨主席王婉諭表示，這幾項新會期的正向發展，加上憲政互動突破、國防法案重回正軌，都讓國會運作出現久違希望。她希望這會期的立法院能與過去兩年不一樣，這不只是她個人的期待，也是整個台灣社會的共同期待。王婉諭指出，首先在國會運作上，朝野黨團出現關鍵變化。除了民眾黨團大幅換血外，民進黨團也由蔡其昌委員出任黨團總召，結束柯建銘委員長達25年的總召生涯。她回顧，早在2024年她就曾向藍、綠、白三黨主席提出更換總召的建言，希望能解開朝野僵局，如今相關期待已完成三分之二，值得肯定。請繼續往下閱讀...其次，王婉諭表示，賴清德總統與立法院長韓國瑜日前在茶敘中達成共識，將由總統親赴立法院，以合憲方式進行我國憲政史上首次的總統國情報告，這是憲政互動的重要一步，也象徵行政與立法之間有機會建立更成熟的溝通模式。第三，王婉諭指出，在野黨終於停止無意義的杯葛，於今日上午的黨團協商中，同意將行政院版國防特別預算條例送交委員會審查，讓國防議題回到理性討論的軌道。王婉諭強調，儘管已經浪費了好幾個月的時間，但只要國家能重新往前走，永遠都不算太晚。她指出，AI時代正快速到來，台灣在全球地緣政治與產業鏈中的角色，比以往任何時候都更加關鍵，立法院不能再深陷內耗與對立的泥淖中。王婉諭最後提醒，立法院本會期有三件事情不能再拖延，分別是台美軍購、台美關稅協議以及總預算審查。她期盼朝野領袖能展現智慧與責任，放下對立、共同合作，讓台灣人民重新相信，政治可以解決問題，也能帶領國家持續前進。    ,https://news.ltn.com.tw/news/politics/breakingnews/5350163
黃偵琳因酒駕退出左楠區議員黨內初選  賴瑞隆這樣說,政治,2026/02/24 18:20,黃偵琳（右）因為酒駕退出民進黨高市議員黨內初選。民進黨高雄市長參選人賴瑞隆（中）強調，酒駕零容忍，所有從政者都須嚴格、審慎面對。（翻攝臉書）投入民進黨高市左楠區議員黨內初選的黃偵琳，遭披露酒駕後宣布退選！民進黨高雄市長參選人賴瑞隆強調酒駕零容忍，所有從政者都須嚴格、審慎面對。黃偵琳遭披露酒駕後，引發各界議論！她今透過臉書指出，感謝所有朋友指教跟提醒，很抱歉造成社會紛擾，決定退出2026年高雄市左營、楠梓選區的市議員初選。請繼續往下閱讀...黃偵琳強調，做錯了事就該勇於承認、誠心悔過，做了嚴重的錯誤示範，讓所有支持她的朋友失望了，再次致上最深的歉意及檢討。在黃偵琳發出退選聲明前，高雄市長陳其邁今上午也對此發聲，強調酒駕零容忍是社會普遍的共識，相信黨中央及市黨部會妥善處理。賴瑞隆今下午也對此聲明，指出酒駕零容忍是社會共識，也是大家堅定的立場。他認為任何人只要違背法令、違反社會共識，就必須承擔起自己的責任，做出符合人民期待的決定，也期盼這樣的行為，讓所有從政者都需要更嚴格、審慎面對。民進黨高市左楠區預計提名4席，黃偵琳退選後，李雅慧、黃文志、尹立、張以理等4位完成登記者，原則上不用再民調。    ,https://news.ltn.com.tw/news/politics/breakingnews/5350141
總統國情報告形式 朝野協商破局 韓國瑜：擇期再協商,政治,2026/02/24 18:03,立法院朝野黨團協商總統國情報告形式，經過一個多小時討論仍無共識，立法院長韓國瑜裁示持續溝通，再擇期協商。（記者林欣漢翻攝）總統賴清德23日與五院院長茶敘，立法院長韓國瑜會後提及邀請總統赴立法院國情報告，並採「統問統答」作為基本禮遇。立法院今日下午進行朝野協商，經過1個多小時討論，立法院長韓國瑜表示，顯然沒辦法達成共識，持續溝通，再擇期協商。民進黨團總召蔡其昌今日就任後，首次參與協商。蔡其昌表示，賴總統很願意來立法院國情報告，若立委有任何想法要跟總統分享，也願意在國情報告後留下來聽，也願意第二次發言。但他也強調，最根本是不能違憲，「統問統答」有違憲爭議，要在遵守憲法及相關法規下來促成，若加碼違憲的東西以致事情辦不成，也辜負韓國瑜一番好意。請繼續往下閱讀...國民黨團總召傅崐萁說，開春希望能順利圓滿，希望賴總統能讓國人了解，總統希望迫切解決國家的問題是什麼，他的想法及具體做法，大家都很願意傾聽，很多事情在國會都可以溝通，歡迎賴總統來國會，成為寫歷史的人，希望在不設限的情況下，讓國人了解明白。民眾黨團總召陳清龍也說，希望確認賴總統的國情報告內容，要包括軍購案、台美貿易協定，還有賴總統不公布、行政院不副署立法院三讀通過的法律，建議賴總統要在國情報告說明，因為這牽涉到立法院的尊嚴和權益。韓國瑜建議，全程約2小時，「總統66歲，要考慮他的攝護腺，1個小時讓總統休息10分鐘。」隨後眾人在立委人數上難達成共識。韓國瑜最後表示，持續溝通，再擇期協商。    ,https://news.ltn.com.tw/news/politics/breakingnews/5350128
顧立雄籲請先授權簽署3項軍購案發價書 陳冠廷促朝野立委全力支持,政治,2026/02/24 17:37,民進黨立委陳冠廷強調，攸關戰力整備與嚇阻能力的軍購案刻不容緩，「全力支持、越快越好」，不宜拖延而影響台灣的自我防衛能力。（資料照）美國日前公布的對台軍售案中，3項包括拖式飛彈、M109A7自走砲、標槍飛彈在內的發價書草案，即將於3月15日過期，然而國防特別條例至今尚未付委審查。國防部長顧立雄今（24）日上午受訪表示，希望外交及國防委員會儘速授權簽署3項已收到的軍購發價書草案。對此，民進黨立委陳冠廷強調，攸關戰力整備與嚇阻能力的軍購案刻不容緩，「全力支持、越快越好」，不宜拖延而影響台灣的自我防衛能力。陳冠廷今天受訪說，目前美方提供之發價書草案均有期限壓力，若未能即時簽署並支付訂金，不僅可能面臨價格調整、交期延宕，甚至整案取消的風險，直接衝擊我國戰力建構與備戰節奏。請繼續往下閱讀...陳冠廷指出，強化台灣的自我防衛能力，是對國民負責任的作法。唯有確保我們有足夠能力保護自己，才能形成真正有效的嚇阻，避免錯誤判斷與誤判升高風險，維持區域和平穩定。他呼籲，立法院應展現負責任的態度，加速相關程序，讓國防部能依法完成簽署與後續作業，確保建軍備戰節奏不中斷。陳冠廷強調，面對區域安全情勢持續變化，台灣必須展現清楚立場與行動力，守護民眾的經濟成果，國防安全更需要快速同步。    ,https://news.ltn.com.tw/news/politics/breakingnews/5350084
被陳培瑜、卓榮泰稱「女士」而非立委 李貞秀憾批「公然霸凌」,政治,2026/02/24 17:30,民眾黨不分區立委李貞秀雙重國籍爭議延燒，今在議場高舉手寫「敬請遵守中華民國憲法」標語。（記者廖振輝攝）立法院新會期今（24）開議，行政院長卓榮泰也循例出席院會進行施政報告，接受各黨團質詢；在民進黨立委陳培瑜質詢期間，先是遇上地震、後又因拒稱中配李貞秀為「委員」而遭舉牌抗議，數度要求發言時間暫停。對此，李貞秀強調，她對中華民國忠誠，並批評此舉是「公然霸凌」，更對憲政體制有失尊重。行政院長卓榮泰今日上午新會期施政報告，並接受各黨團質詢，期間代表民進黨黨團的立委陳培瑜以內政名義，呼籲行政主管機關嚴正認定民眾黨不分區立委李貞秀的資格認定，更在院會中公開稱當時也在場的李貞秀為「女士」而非立委，直言李「沒有資格成為台灣的立法委員」，當下引起場外一陣議論。請繼續往下閱讀...本月3日赴立法院宣誓就職、報到的民眾黨不分區立委李貞秀，因其中國背景和雙重國籍問題引發爭議，李就職後多次宣稱她曾親赴中國申請放棄國籍未果，更經中選會頒發當選證書，公職資格無虞；但內政部後續要求繳交申請放棄文件佐證，陸委會更指出她在登記參選時未依法完成戶籍、國籍放棄，違反兩岸條例第9-1條規定，身分轉換程序不完整，定居許可恐遭撤銷。對於遭陳培瑜拒稱立委、並在院會場內舉牌抗議的李貞秀今午回應，她對於國家的忠誠無庸置疑，如同卓榮泰在今日施政報告中說，他「對中華民國國家的唯一效忠，對中華民國憲法的唯一忠誠，是全體國民，尤其是所有公職人員最基本的國家信仰」。李貞秀批評，陳培瑜委員及卓榮泰院長在立法院議場中不稱呼「委員」，而是直接叫我「李貞秀女士」，如此公然霸凌中華民國的立法委員，令人感到遺憾；更直言這不只是對我個人的不尊重，而是對人民選出的立法委員、對憲政體制的不尊重。    ,https://news.ltn.com.tw/news/politics/breakingnews/5350038
幕後》「柯建銘時代」平和交棒  「他」扮潤滑劑居中解僵局,政治,2026/02/24 17:27,民進黨團幹部改選最終協調以推舉方式完成，擔任總召長達20年的柯建銘正式交棒，結果出爐後，柯建銘和蔡其昌相互擁抱致意。（民進黨立法院黨團提供）民進黨立法院黨團幹部改選今天落幕，擔任20餘年的黨團總召柯建銘將正式交棒前立法院副院長蔡其昌。原先被視為可能上演派系角力的改選過程，最終卻在一片掌聲中溫馨收場。據轉述，柯建銘於會中發言一度語意不清，引發不同解讀，最終在蘇系立委吳秉叡的緩頰下，柯以「傳承」名義交棒，也讓這場世代交替在擁抱與掌聲中落幕。去年大罷免失利後，黨內檢討聲浪四起，矛頭一度指向力主罷免的柯建銘，黨團改選總召成為焦點。柯建銘當時以任期尚未屆滿為由挺過風波，但「世代交替」已成黨內潛流。本屆總召改選，蔡其昌正式表態參選，競爭態勢浮上檯面。請繼續往下閱讀...據轉述，今天閉門會議一開始，柯建銘率先發言，語氣懇切地向在場委員表達心聲，盼能繼續帶領黨團。他用台語直言：「拜託逐家予我繼續做。」隨後，表態參選的蔡其昌則強調，自己與柯私交深厚，此番承擔並非為個人利益，而是回應社會觀感與支持者對黨團運作的期待。會議中段氣氛轉趨微妙。柯建銘提出「我跟其昌自己去講、去處理」等說法，盼將議題轉為私下協調，引發黨團內部不同解讀。立委林淑芬當場質疑「我聽不懂耶」。沈發惠、郭國文等新系成員接連發言，認為應在當天拍板。柯建銘則回應：「我都講這樣了，你們還聽不懂。」僵持之際，吳秉叡出面緩頰，「大家還聽不懂嗎？總召的意思就是欲傳承予其昌啦！」他直言，柯建銘是黨團之寶，未來仍有諸多面向需倚重其經驗與份量。黨團成員才恍然大悟，理解柯所謂再與蔡其昌協商，實為透過協調完成推舉。隨著場內氣氛轉圜，全體委員報以掌聲，林淑芬第一個走向柯建銘，並對他「比讚」表達敬佩之意，吳秉叡在合照階段領銜黨團成員高呼「總召承擔」、「黨團之寶」，柯昌也在眾人見證下擁抱交棒，為這場世代交替的黨團改選劃下句點。最終黨團由蔡其昌接任總召，幹事長、書記長分別由莊瑞雄、范雲擔任，「柯建銘時代」正式落幕。民進黨立法院黨團幹部改選今天落幕，擔任20餘年的黨團總召柯建銘將正式交棒前立法院副院長蔡其昌。（記者王藝菘攝）    ,https://news.ltn.com.tw/news/politics/breakingnews/5350029
自由說新聞》鄭麗文被問「黃國昌不排除加入」驚嚇脫口這句！他大膽預言藍白劇本,政治,2026/02/24 17:24,全新的視界！新聞話題不漏接，快訂閱YouTube 【自由追新聞】，記得開啟小鈴鐺哦！    ,https://news.ltn.com.tw/news/politics/breakingnews/5350078
車輛拖吊索價10萬！蔣萬安痛批「惡霸」 要求訂定指引,政治,2026/02/24 17:21,台北市長蔣萬安出席台北市政府維護公共安全督導會報。（記者田裕華攝）近日雙北地區頻傳有拖吊業者索取高額拖吊費，車主如不從甚至會被威脅扣車，更有民眾投訴被收取10萬元。台北市長蔣萬安今（24日）於市政會議上直呼「荒謬、誇張」，甚至可以說是惡霸，要求交通局會同法務局消保官，在最短時間內研議相關作業指引，強化資訊公開透明，讓執法單位有依據可罰。有民眾在社群平台指出，過年期間車子拋錨，從烏來山區拖吊到新店市區，竟然要價10萬元，讓他直呼誇張。許多民眾也指出碰過類似事件，曾經機車拖吊不到6公里距離，就被收費4萬多元。請繼續往下閱讀...蔣萬安今於市政會議中指出，近期媒體報導民眾反映，一段道路救援就被廠商喊價要收10萬元，這實在太荒謬、太誇張，甚至可以說是惡霸的行為，根本就是趁火打劫。他說，這顯示了道路救援拖吊費用存在收費不清的問題，導致消費爭議。依照目前規定，警察只有在涉及詐欺等刑事責任時，才能介入處理；除了高速公路路段的道路救援是依中央法規辦理，在市區範圍，目前確實缺乏明確的規範可以依循。為保障消費者權益，蔣萬安也即刻要求交通局會同法務局消保官，在最短時間內研議相關作業指引，要求轄內道路救援拖吊業者清楚揭露各項收費內容，強化資訊公開以及透明機制。如同去年訂定的一番賞相關遊戲商家指引，對於道路救援的作業指引也要訂定清楚，若業者違反指引，就依《台北市消費者保護自治條例》要求改正，不配合者即依法開罰。要讓這一類漫天喊價事件，一旦發生在北市，執法單位有理有據可以依循，讓惡質商家無所遁逃。台北市議員陳宥丞也指出，接獲民眾陳情，有不法拖吊業者玩弄SEO關鍵字廣告，成立多家相關公司，讓消費者在Google搜尋時優先看到訊息，先用低價的假廣告吸引車主，等愛車上了拖吊車到達目的地，用各種名目來開出天價帳單，不給錢，就被威脅要扣車、變賣車輛，這是光天化日下的勒索。他說，不肖業者有系統性的犯罪邏輯，包含採取「車身字樣與掛牌不符」的手段，刻意提高民眾後續追償的搜尋成本，讓警察在追蹤時產生斷點；並將定型化契約傳在Line記事本，當民眾急於取車時，強迫簽署「封口條款」，將高額拖吊費藏匿於文字中，並要求市民承諾不得追責或向媒體申訴。更有民眾反映，在遭遇天價勒索後前往派出所報案，卻因不肖業者鑽研法律漏洞，將強迫簽署的契約包裝成商業行為，導致第一線員警常以民事糾紛為由建議民眾循消保官途徑。陳宥丞指出，北市警察局也承諾，曾遭遇拖吊天價勒索的民眾，只要案發地為台北市，派出所接可以受理「補報案」；此類涉及「高額收費、扣車勒索」案件，警察局刑事警察大隊立刻成立專案處理。    ,https://news.ltn.com.tw/news/politics/breakingnews/5350051
川普關稅變局 蔣萬安：賴政府應清楚跟國人報告,政治,2026/02/24 17:03,蔣萬安呼籲，重大決策應該公開透明、社會對話。（記者甘孟霖攝）美國總統川普上任後，引用「國際緊急經濟權力法」（IEEPA）對全球課徵關稅，如今被美國最高法院裁決違憲。台中市長盧秀燕今（24日）要求賴政府說清楚；台北市長蔣萬安也說，任何重大政策都應該資訊透明、社會對話，應該清楚跟國人報告。蔣萬安今出席北市府公安督導會報，會前受訪說，目前關稅還在變化當中，而任何重大政策都應該要資訊透明、社會對話，來做出完整評估，所以目前社會各界對於整體局勢變化，以及未來方向都還有疑問，包含日前和美國簽署的台美對等貿易協定（ART）是否還有效？受到影響層面等，都應該清楚向國人報告。請繼續往下閱讀...媒體也問，明日台北燈節登場，美國在台協會（AIT）也首度參與台北燈節，是否跟AIT處長谷立言同台？蔣萬安說，去年跨年晚會AIT也首度登台，這次更是第一次參與台北燈節，市府非常高興，美國這次慶祝獨立250週年，也展現雙方交流的深化與密切合作，未來希望能持續和美方保持這樣的良好互動。另外，谷立言曾說最喜歡的中文詞句是「紙上談兵」，因為在台灣大家都對國防預算有意見。蔣萬安說，他也一直強調支持厚植國防實力，也認為立院應該進行實質審查、嚴格把關。    ,https://news.ltn.com.tw/news/politics/breakingnews/5349918
馬年兩岸關係 海基會：願多1分理解、少1分寒意,政治,2026/02/24 16:56,海基會董事長蘇嘉全致詞。（記者廖耀東攝）農曆馬年展開，海基會今（24）日中午在台中市翔園舉行「大陸台商春節活動」，300多名台商齊聚，上個月甫上任的海基會董事長蘇嘉全說，願新的一年，兩岸多一分理解、少一分寒意。蘇嘉全致詞指出，台中市是台灣最重要的產業重鎮，精密機械、工具機、製造業與關鍵零組件在全球供應鏈，占有關鍵地位，更是串連南北產業布局的重要樞紐。許多台商正是從中部出發，走向世界，這次特別安排參訪台灣指標企業漢翔公司，了解在先進複合材料、航太製造、精密機械、民用飛機區段製造與飛航服務等領域，讓各位能夠掌握台灣高端產業的發展方向，也作為企業升級轉型與全球布局的參考。請繼續往下閱讀...蘇嘉全說，近年全球局勢變動快速，供應鏈重組、地緣政治升溫，但台商最令人敬佩的就是「一隻皮箱走天下」的韌性，為台灣經濟打下厚實基礎，政府不會忘記各位的貢獻，未來更需要大家與台灣一起布局全球。蘇嘉全表示，兩岸關係是大家關心的議題，他就職時提到，兩岸關係的根本不在口號，而在人民；不在對立，而在理解。交流或者有起伏，但人民往來與經貿連結早已深植社會。海基會將遵循政府政策，在對等尊嚴的原則下，持續推動健康有序的交流。只要有利於人民福祉，我們都願意遞出橄欖枝來改善兩岸關係。    ,https://news.ltn.com.tw/news/politics/breakingnews/5349934
放棄中國籍程序不完備 李貞秀：遵守中華民國憲法 沒有爭議,政治,2026/02/24 16:49,綠委質疑國籍與忠誠問題，李貞秀舉「霸凌」紙張抗議。（記者廖振輝攝）民眾黨不分區立委李貞秀未放棄中華人民共和國國籍，登記參選立委仍具「雙重戶籍」涉違反兩岸條例。立法院今日邀請行政院長卓榮泰提出施政方針及施政報告並備質詢，民進黨立委陳培瑜質詢時，質疑李貞秀的國籍與忠誠問題，並表示，「我不叫她李委員，我認為她沒有資格擔任台灣的立委，請允許我叫她李女士」。李貞秀則當場高舉「霸凌」、「敬請遵守中華民國憲法」紙張抗議，並於會後受訪表示，對中華民國憲法的唯一忠誠是全體國民，尤其是所有公職人員最基本的國家信仰。李貞秀說，今天所有的公職人員是不是對中華民國憲法宣誓，是不是遵守中華民國憲法？如果遵守中華民國憲法，今天沒有任何爭議。請繼續往下閱讀...李貞秀說，從前總統蔡英文、陳水扁、馬英九以來都是如此，希望賴清德總統好好地做全民總統，做中華民國的總統。李貞秀強調，自己對國家的忠誠無庸置疑，但陳培瑜及卓榮泰在議場中未稱呼她「委員」，而是直接稱「李貞秀女士」，此舉形同公然霸凌中華民國立法委員，令人遺憾。這不只是對她個人的不尊重，也是對人民選出的立法委員與憲政體制的不尊重。    ,https://news.ltn.com.tw/news/politics/breakingnews/5349852
肯定卓揆施政報告 藍委葛如鈞：積極推動「虛擬資產服務法」立法,政治,2026/02/24 16:49,立法院新會期今天開議，邀請行政院長卓榮泰提出施政方針及施政報告，並備質詢。（記者廖振輝攝）立法院新會期今天開議，邀請行政院長卓榮泰提出施政方針及施政報告，並備質詢。對於卓揆在施政方針報告提及主權基金、虛擬資產專法、新式核能技術與人工智慧等政策方向，國民黨立委葛如鈞予以肯定，但認為與國際相比，速度已經偏慢。本會期他將積極推動「虛擬資產服務法」立法，讓台灣在創新與監理之間取得平衡，正式跟上世界潮流。葛如鈞指出，台灣正面臨全球科技競逐與供應鏈重組的關鍵時刻，政府提出設立主權基金，打造國家級投資平台、布局全球產業，方向值得肯定。他早在多次質詢與政策倡議中即強調，台灣應整合國家資本力量，投資關鍵科技與戰略性產業，建立具有長期戰略視野的資本工具，以提升國際競爭力與經濟韌性。請繼續往下閱讀...在數位金融領域方面，行政院表示，將推動虛擬資產服務法的立法，研議穩定幣等制度設計。葛如鈞表示，這正是台灣銜接全球數位資產監理趨勢的重要一步。面對美國、歐盟與亞洲主要經濟體紛紛建立監管框架，台灣若無完整法制，不僅產業發展受限，更可能在國際競爭中失去話語權。葛如鈞強調，本會期將積極推動「虛擬資產服務法」立法，讓台灣在創新與監理之間取得平衡，正式跟上世界潮流。談及人工智慧政策，葛如鈞指出，上個會期立法院已三讀通過「人工智慧基本法」，為台灣AI發展建立法律基礎，確立倫理原則、資料治理與產業發展方向，這是台灣邁向AI國家重要里程碑。如今行政院將AI列為核心戰略產業，並推動AI新十大建設，顯示政府終於正視AI對國家競爭力的關鍵影響。葛如鈞也強調，AI發展不能只談應用與產業，更必須正視算力與電力密不可分的現實。高效能運算中心、資料中心與AI訓練模型都高度依賴穩定的電力供應。他長期主張務實檢討能源政策，並推動《核管法》修法，為核電機組在符合法規與安全前提下的再運轉，與延役排除法律障礙，替台灣核能發展解套。    ,https://news.ltn.com.tw/news/politics/breakingnews/5349921
