Title,News_Type,date,content,url
南投警破獲「喪屍煙彈」分裝場  逮捕4嫌查扣大量成品與原料,社會,2026/06/15 12:21,南投警分局破獲毒品分裝場，查扣「喪屍煙彈」成品與製毒原料、分裝器具。（警方提供）國內近期頻傳毒駕造成重大傷亡車禍事件，南投縣警察局南投分局執行「全國同步強化查緝毒駕及斷源緝毒專案」，在南投市破獲一處混合式毒品分裝場，逮捕陳姓男子等4嫌，現場查扣大量俗稱「喪屍煙彈」的依托咪酯成品與製毒原料、分裝器具，已依重大毒品案件通報警政署，並依毒品危害防制條例移送南投地檢署偵辦。南投警分局南投派出所近日在南投市1處出租套房破獲1處混合式毒品分裝場，逮捕53歲陳姓主嫌及3名吸毒男子，包括2名逃逸外籍移工，現場查扣大量俗稱「喪屍煙彈」的依托咪酯煙油、煙彈成品、分裝器具，還有安非他命、海洛因等毒品。請繼續往下閱讀...警方初步查出，陳嫌負責毒品分裝，再交由專人販售，目前正深入追查製毒原料來源及下游販毒管道，擴大偵辦中。南投警分局指出，該分局執行「全國同步強化查緝毒駕及斷源緝毒專案」，自5月底至6月初，共查獲毒駕6件6人及毒品案4件6人，仍持續採取「向上溯源、向下刨根」策略，針對轄區毒品犯罪展開全面查察，呼籲民眾遠離毒品，勿以身試法。南投警分局破獲毒品分裝場，查扣「喪屍煙彈」分裝工具與原料。（警方提供）南投警分局針對疑毒駕民眾進行唾液篩檢。（警方提供）    ,https://news.ltn.com.tw/news/society/breakingnews/5472614
無業男偷車代步  高雄網咖睡夢中落網,社會,2026/06/15 12:19,詹男無業偷車代步，網咖睡夢中落網被送辦。（民眾提供）高雄市詹姓無業男子行經鳳山區中崙三路，竟偷竊停車格內重機車，騎乘代步後隨意丟棄，警方循線於網咖逮獲詹男，睡眼惺忪美夢還沒做完，警訊後將他依竊盜罪嫌移送法辦。鳳山警分局今天表示，過埤派出所6日接獲武姓男子（44歲）報案，稱停放於鳳山區中崙三路停車格內重機車遭竊，警方獲報後成立專案小組展開調查，過濾清查沿線監視器畫面。請繼續往下閱讀...警方循線追查後，於鳳山火車站附近尋獲失竊機車，原本研判竊賊可能返回取車，埋伏現場守株待兔，不過經觀察多時，發現無人前來取車，研判竊賊只是將機車作為代步工具，使用後棄置現場，警方完成採證程序後，立即將機車發還失主。警方持續擴大追查，鎖定詹姓男子（39歲）無業涉嫌重大，並報請高雄地方檢察署核發拘票，經深入分析活動範圍及生活習性，發現詹男經常出沒網咖及旅館等場所，擴大清查詹男可能現身據點。警方終於10日清晨在前鎮區一處網咖內，發現詹男躺在座椅上熟睡補眠，警方上前表明身分，當場執行拘提，詹男還睡眼惺忪、一臉疑惑，不明白自己為何突然遭警方查獲，經警方告知竊車，他坦承以其他鑰匙開鎖，偷老車代步騎完丟棄，警訊後將他依竊盜罪嫌移送法辦。    ,https://news.ltn.com.tw/news/society/breakingnews/5472605
中市公益路招牌掉落將依法查處    目前已完成排除,社會,2026/06/15 12:18,台中西區公益路一處大型招牌14日晚上突然掉落，並砸中一輛轎車。（記者陳建志翻攝）首次上稿 06-15 10:42更新時間 06-15 12:18（補充畫面）近日因降下大雨，昨（14）日晚間公益路發生康是美店面廣告招牌掉落事件，台中市政府表示，目前掉落物及具危險性的懸掛招牌已全數排除，道路已於今晨恢復正常通車，並依法查處，要求業者限期改善，由於有車輛因招牌掉落而受損，也會要求業者依規辦理後續賠償。請繼續往下閱讀...市府表示，昨天晚上事故發生後已立即由消防局、警察局及都發局到場處理，現場除完成警戒管制及交通維護外，也同步展開安全評估及災後處置作業。目前掉落物及具危險性的懸掛招牌已全數排除，道路已於今晨恢復正常通車。都發局指出，案發時招牌突然掉落並波及路旁停放車輛，消防人員確認現場無進一步崩塌風險後，隨即協助受困女子脫困，經救護人員初步檢視並無明顯外傷，現場亦未波及其他民眾。後續人員受傷及車輛受損等相關事宜，將由業者依規辦理後續賠償。都發局表示，已於昨日晚間聯繫開口契約廠商進場處理，優先移除掉落面板及大型廢料，並於今日凌晨4時許完成外牆危險懸掛物拆除作業。初步研判，疑因連日豪雨造成招牌木質結構受潮、腐朽，含水量增加後不堪負荷而掉落。都發局強調，將依「招牌廣告及樹立廣告管理辦法」及「建築法」相關規定依法查處，並要求業者限期改善，同時呼籲各商家定期檢視招牌及廣告物安全狀況，落實自主維護管理，共同維護公共安全。驚！台中公益路超大招牌掉落 砸中轎車嚇壞女乘客昨晚公益路的康是美招牌招掉落。（警方提供）昨晚公益路上的掉落的康是美招牌已清除。（記者蘇金鳳攝）    ,https://news.ltn.com.tw/news/society/breakingnews/5472455
新竹台大男性護理長藉「重綁手術衣」看光病患 涉權勢性騷抗罰再吃敗訴,社會,2026/06/15 12:10,賴姓護理長姐藉由重綁手術衣為由，導致女病患隱私部位被其看光。（情境照）新竹台大分院賴姓的男護理長於2024年藉女病患手術衣未穿妥為由，將其單獨帶入更衣室並解開衣帶，導致僅著內褲的女病患胸、腰及腿部等隱私部位全遭看光。新竹縣政府調查後認定其構成「權勢性騷擾」並依法裁處。賴男不服，提出行政訴訟，台北高等行政法院審理後認為，賴男利用醫療照顧機會侵害病患隱私與身體自主權，判決駁回其訴，維持原處分。可上訴。判決指出，賴男於2024年11月21日上午擔任該院區護理長，當日病患報到時，賴男原欲帶領病患更衣，女病患以「『我來就好」回絕，女病患隨後自行於更衣室換妥手術衣。然而，當女病患步出更衣室於沙發區等候時，賴男見其手術衣鬆脫、露出乳溝，竟主動上前表示「我幫妳調整」。請繼續往下閱讀...隨後，賴男將女病患帶入更衣室，在未安排女性醫護陪同、未充分告知必要性及徵詢病患隱私意願的情形下，解開病患手術衣綁帶。讓當時僅穿內褲的病患胸部、腰部及大腿等部位完全被賴男看見，為此病患提出性騷擾申訴，新竹縣府認為「權勢性騷擾」事件成立，並對其發出行政處分。賴男不服，便提出行政訴訟，他在開庭期間辯稱，他是基於維護病患隱私與手術流程順暢的「協助心態」，強調過程中並無肢體碰觸，事前也已徵得病患同意，屬醫療行為中常見的近距離協助，絕無性騷擾意圖。賴男更主張，本案刑事部分已經是不起訴處分，行政機關在缺乏積極證據下不應逕行裁罰。台北高等行政法院指出，賴男身為具備相當資歷的護理長，理應熟悉院內保護病患隱私之規範。法官認為，當時並非急迫狀況，且現場尚有女性護理師可提供協助，賴男卻執意親自將病患帶入更衣室，且未事先說明須完全解開內、外側綁帶，致病患在無從表達隱私需求之下，任由胸部、大腿等隱私部位裸露於賴男眼前。台北高等行政法院認為，病患當下未能拒絕，是受限於醫病關係中對專業醫療人員之信任，絕非對賴男行為之「知情同意」。賴男假借醫療照護之機會，逾越醫療常規與醫患界線，客觀上已屬利用權勢實施與性別相關之冒犯行為，構成權勢性騷擾。此外，判決也指出，行政罰之成立不以刑事有罪判決為前提，賴男雖因未碰觸病患身體而獲刑事不起訴，惟其藉機觀看隱私部位之事實仍該當行政裁罰要件，故判決賴男敗訴。可上訴。    ,https://news.ltn.com.tw/news/society/breakingnews/5472576
我14歲你硬脫我褲子......女國中生網遊遇狼 雙方遊戲對話成鐵證,社會,2026/06/15 12:07,一名女國中生遭性侵，檢警從網路遊戲調出關鍵證詞。（示意圖）彰化一名餐廳服務生李男透過網路遊戲認識一名就讀國中的少女（A女），少女指控李男對她性侵，但李男矢口否認，檢方從網路遊戲中雙方的對話尋找線索，男方口口聲聲說自己是一個負責任的男人，但女方卻回說：「我14歲，你就性侵我，我一直說不要，你硬要脫我褲子！」該案進入彰化地院審理，男方坦承雙方發生3次性行為，其與女方家人達成和解，法官判處5月徒刑。該案起訴書指出，李男在餐廳擔任服務生，透過網路認識剛滿14歲的A女，雙方除了經常在網路玩「絕地求生」遊戲，兩人相戀，後來因故鬧翻，女方指控李男性侵她3次，但李男矢口否認，他辯稱，A女因求愛不成，憤而做虛假指控。請繼續往下閱讀...但檢方根據A女的供詞，雙方經常玩網路遊戲，從A女的筆電調出雙方的對話資料。去年4月27日，男方在網遊中說道「妳把一生都交給我，我不會辜負妳」，A女回答「我14歲，你對我做出性行為，你卻說，這樣不算傷害我，我說不要，你卻一直脫我褲子，這樣不算傷害我嗎？」男方回答「算」。此外，警方也根據供詞，調出男方帶女方去藥妝店買保險套的監視器畫面，足以證實男方確實與女方發生性行為。法官表示，被告知悉被害人未滿16歲，卻不知克制己身性慾，而與被害人為性交行為達3次，則被告所為對被害人之身心健康與人格發展有不良影響，惟考量被告坦承犯行，並與被害人及其家屬成立調解，約定分期賠償，則被告犯後態度尚稱良好，被害人在調解筆錄上同意，不追究，並同意讓被告獲得緩刑。被告因觸犯3罪，每罪5月，共應執行11月，緩刑3年。    ,https://news.ltn.com.tw/news/society/breakingnews/5472559
昔十大槍擊要犯林裕峰持雙槍闖彩券行！嘉檢聲押獲准,社會,2026/06/15 11:51,林裕峰涉持雙槍開槍又闖彩券行，嘉檢複訊後聲押獲准。（資料照）首次上稿 08:22更新時間 11:51嘉檢表示，林裕峰涉嫌6月13日晚間持槍恐嚇，並於彩券行內與警方對峙，檢察官賴韻羽指揮警方迅速動員，14日凌晨在嘉義縣太保市某彩券行，將林嫌逮捕到案，當場查扣長、短槍各1把等涉案物證，檢察官昨夜間訊問後，認其涉犯槍砲彈藥管制條例等罪嫌，犯罪嫌疑重大，有羈押原因及必要，向嘉院聲押禁見，獲嘉院裁准。請繼續往下閱讀...綽號「小蜜蜂」的56歲昔日十大槍擊要犯林裕峰，6月13日深夜涉嫌持雙槍在嘉義縣太保市開槍後又闖入彩券行，經警方、地方人士勸說下棄械投降。嘉義地檢署檢察官昨漏夜複訊，嘉義地檢署檢察官昨漏夜複訊，今天凌晨12點向嘉義地方法院聲請羈押禁見，嘉院上午裁定收押。嘉檢表示，林裕峰涉嫌6月13日晚間持槍恐嚇，並於彩券行內與警方對峙，檢察官賴韻羽指揮警方迅速動員，14日凌晨在嘉義縣太保市某彩券行，將林嫌逮捕到案，當場查扣長、短槍各1把等涉案物證，檢察官昨夜間訊問後，認其涉犯槍砲彈藥管制條例等罪嫌，犯罪嫌疑重大，有羈押原因及必要，向嘉院聲押禁見，獲嘉院裁准。    ,https://news.ltn.com.tw/news/society/breakingnews/5472307
台南運豬車失控追撞前方停等小貨車、機車  騎士當場死亡,社會,2026/06/15 11:44,省道台1線台南六甲段15日上午發生車亡車禍，載送豬隻的營業大貨車追撞等紅燈的工程小貨車和1輛機車，造成機車騎士當場明顯死亡。（民眾提供）台南地區今（15）日持續降雨，省道台1線台南六甲路段上午傳出死亡車禍，1輛載運豬隻的營業大貨車不明原因追撞前方停等紅燈的1輛工程小貨車及1輛機車，造成48歲陳姓機車騎士當場明顯死亡，相關肇事責任正由警方調查釐清中。陳姓騎士父母前往認屍，相當悲痛，僅說「遇到了，該怎麼處理就怎麼處理。」今天上午7時35分左右，30歲詹姓男子駕駛營業大貨車，從後壁欲載送豬隻前往善化肉品市場，由北往南行駛於台1線，在距離台南六甲區台1線與174線路口約100公尺時，看到燈號轉紅燈欲煞車，卻追撞前方正在停等紅燈的工程小貨車，再偏右撞上由48歲欲至官田工業區上班的陳姓男子所騎乘的機車，撞擊力造成機車卡在大貨車底下，路面散落許多零件，陳姓男子明顯死亡未送醫。請繼續往下閱讀...據了解，陳姓男子已離婚，目前與弟弟同住，上班途中停等紅燈卻遭遇死刼，由父母前往認屍，白髮人送黑髮人，老淚縱橫，悲痛不已。麻豆警分局呼籲用路人，雨天視線不佳且路面濕滑，駕駛人務必減速慢行並開啟大燈同時應拉長與前車的安全距離，以維持行車安全。省道台1線台南六甲段15日上午發生車亡車禍，遭撞的機車卡在大貨車底下，騎士當場明顯死亡未送醫。（民眾提供）    ,https://news.ltn.com.tw/news/society/breakingnews/5472551
轟！彰化線西三合院暗夜大火 濃煙四竄一片狼藉,社會,2026/06/15 11:39,三合院火災濃煙四竄，消防員噴水灌救。（彰化縣消防局提供）轟！彰化縣線西鄉一處三合院住宅今天（15日）清晨突起火燃燒，火勢一度相當猛烈，濃煙四竄，消防局據報派出16名消防員趕往搶救，火勢於半小時後撲滅，所幸無人員傷亡，惟屋內一片狼藉，起火原因與財物損失由消防局釐清中。消防局指出，這起三合院火災發生在今天清晨3點半多，住在附近的民眾發現火光後立即向消防局通報，消防局據報後派出第一大隊、伸港與和美等分隊共16名消防員、7輛消防車趕往搶救，現場由伸港分隊長張志豪指揮搶救；消防員發現火勢相當猛烈，還有濃煙竄出，所幸屋內無人員受困；消防員部署水線灌救，火勢於清晨4點多控制，10多分鐘後全部撲滅。線西三合院暗夜大火，火勢猛烈。（彰化縣消防局提供）消防員控制火勢後搶進屋內持續搶救。（彰化縣消防局提供）    ,https://news.ltn.com.tw/news/society/breakingnews/5472545
酒駕害己！男酒駕撞分隔島翻車  命大僅輕傷被移送法辦,社會,2026/06/15 11:31,潘男酒駕自撞分隔島翻車，命大僅輕傷被移送法辦。（民眾提供）高雄市潘姓男子半夜酒駕行經高楠公路，突然車輛偏移自撞分隔島翻覆，所幸潘男命大僅輕傷，自行爬出車外逃生，不過酒測值超標，警訊後將他依公共危險罪嫌移送法辦。楠梓警方今表示，昨天深夜23時許接獲民眾報案，指稱楠梓區高楠公路與水管路口，發生汽車自撞分隔島，立即派員前往處理。請繼續往下閱讀...警方調查，潘姓男子（53歲）駕駛轎車沿高楠公路南往北直行時，卻不明原因車輛偏移，導致自撞分隔島翻覆，潘男自行爬出車外，命大僅手肘擦挫傷，所幸沒有生命危險。不過警方發現他渾身酒氣，對他實施酒精檢測，數值高達每公升1.08毫克，將他帶回派出所偵辦。潘男車禍事故雖未傷及其他人車，但影響交通加上天雨路滑，警方漏夜進行交通疏導，大約花了45分鐘，於今天凌晨排除。警訊後將潘男依公共危險罪嫌移送橋頭地方檢察署偵辦。潘男酒駕自撞分隔島翻車，命大僅輕傷被移送法辦。（民眾提供）    ,https://news.ltn.com.tw/news/society/breakingnews/5472532
刺青師硬上醉女得逞！否認犯行還辯遭「仙人跳」 IG對話紀錄成鐵證,社會,2026/06/15 11:27,"劉男趁A女不勝酒力強制性交得逞。（情境照）在台北擔任刺青師的劉直樹於2025年4月間，在A女租屋處，趁對方酒醉之際，強壓女方頭部逼迫口交，隨後更強行脫下對方褲子進行肛交得逞。劉男事後在法庭上否認犯行，反咬女方是為索取金錢而設局「仙人跳」。台北地院認為，劉男在案發後面對女方質問時，曾多次回覆「對不起」、「不會有下次了」等語，故不採信其辯詞，依強制性交罪判處劉男有期徒刑3年8月。可上訴。判決指出，2025年4月22日凌晨4時許，A女在酒吧下班後帶著醉意回到台北市中山區居所，躺在地板睡著。清晨6時許，A女因聽到劉按門鈴，故開門讓其進入屋內。劉見A女站不穩後，將其扶至床上後便開始上下其手。過程中A女多次表達拒絕並用手推開，但劉男仍最終仍強制性交得逞。請繼續往下閱讀...A女事後向表哥B男吐露遭遇，才由B男陪同前往警局報案。劉男矢口否認犯行，辯稱是合意性交，甚至稱是A女主動拿取潤滑液；劉男同時指控，B男曾到他工作場所找他談論此事，質疑女方延遲數週才報警，目的是「仙人跳」。對於傳送道歉訊息，劉男則稱是因為知道A女患有憂鬱症及躁鬱症等身心疾病，為安撫其情緒才順著對方的話道歉 。法官查閱雙方Instagram對話紀錄發現，A女在案發隔日上午曾打電話並傳訊質問劉男「你還那樣對我，這算性騷擾嗎？」劉男並未反駁事實，反而立刻回覆「對不起，以後不會了」、「非常對不起」。法官認為，若劉男遭誣指犯罪，反應應有不同，其回覆明顯與常理不符；此外，B男前往劉男工作場所理論時，並無恐嚇索賠的客觀證據，且A女至今也未對被告提起刑事附帶民事訴訟求償，因此認定「仙人跳」僅是劉男的主觀臆測。法官痛批，劉男為滿足一己性慾，利用A女對其的信任違反意願強制性交，嚴重侵害被害人性自主決定權，且犯後否認犯行，至今未與被害人達成和解或賠償，致使女方承擔龐大壓力，多次在偵審期間情緒崩潰哭泣，最後依強制性交罪判處有期徒刑3年8月。可上訴。    ",https://news.ltn.com.tw/news/society/breakingnews/5472527
機場接送司機載客路不熟 邊開邊找地址撞轎車翻覆,社會,2026/06/15 11:23,機場接送陳姓司機今晨駕駛休旅車，行經新北市永和區秀朗路二段時，疑因路不熟未注意前方路況，撞擊路邊停放車輛後翻覆。（記者陸運鋒翻攝）機場接送陳姓司機今天凌晨駕駛休旅車，行經新北市永和區秀朗路二段載客時，疑因路不熟邊開邊找地址，撞擊路邊停放轎車後翻覆，警方獲報趕抵時，陳男已自行脫困並沒有受傷，至於詳細事故原因，仍有待進一步調查。永和警分局調查，從事機場接送工作的54歲陳男，今天凌晨2時許駕駛租賃休旅車，沿永和區秀朗路二段往成功路方向行駛時，因路不熟悉正尋找客人的地址時，不慎撞上路邊停放的轎車後，導致休旅車側翻，當地居民發現後連忙報案。請繼續往下閱讀...據指出，警方趕抵現場時，陳男已經自行爬出車外脫困，身上沒有明顯外傷，事故僅造成有車損，而陳男酒測值為0毫克，同時排除毒駕情事，警方已調閱相關影像還原事發經過，至於詳細肇事原因仍有待釐清。    ,https://news.ltn.com.tw/news/society/breakingnews/5472521
高雄左營轎車左轉釀3人受傷  警曝肇事原因,社會,2026/06/15 11:17,高雄轎車左轉與直行機車發生車禍，導致騎士與乘客共3人受傷。（記者洪定宏翻攝）33歲黃姓男子駕駛轎車左轉，與直行的2輛機車發生車禍，導致騎士53歲蔣姓男子、53歲劉姓婦女及其乘客22歲蘇姓女子輕傷，送醫治療。高雄警方強調，黃男左轉未讓直行車先行，開罰600元至1800元，詳細肇因送交通大隊分析研判。。高雄警方指出，今（15）日上午8點多，黃男駕駛轎車沿左營區軍校路南往北方向行駛，左轉時與對向直行的2輛機車碰撞，造成騎士蔣男、劉婦及乘客蘇女輕傷，汽機車駕駛人均無酒駕。    ,https://news.ltn.com.tw/news/society/breakingnews/5472514
高翠路氣爆災後說明會 竹市府提供協助與法律支援,社會,2026/06/15 11:12,竹市府14日召開高翠路氣爆災後說明會，跨局處提供協助與法律支援。（圖由市府提供）針對新竹市高翠路9日發生氣爆案件，市長高虹安責成市府團隊啟動跨局處關懷及協助機制，由消防局、民政處、社會處及東區區公所等單位於昨（14）日19時30分，在私立艾唯兒幼兒園共同召開災後協助說明會，向受災住戶說明各項補助、救助及後續協助措施。說明會過程順利，共有81戶住戶領取慰問金，市府也針對民眾關心事項逐一說明，協助受災戶掌握相關權益與申辦流程。高虹安表示，市民的生命財產安全始終是市府最重要的責任。面對此次突如其來的氣爆事故，市府第一時間即成立跨局處應變機制，投入救災、安置及後續復原工作。感謝受災住戶於說明會中理性溝通並提供寶貴意見，市府將持續整合各局處資源，全力協助受災民眾減輕負擔，以最快速度恢復正常生活。請繼續往下閱讀...消防局表示，針對房屋結構未受損如牆面坍塌、梁柱歪斜等需進一步進行結構鑑定或支撐、但有其餘建築或財物受損（不含汽機車）住戶，為因應未來由市府向法院提起民事訴訟求償之需要，處理流程將配合專業估算或鑑定，並依金額全額代墊。受災民眾於洽商估算受損項目時，請一併找市府委任相關公會或專業人員會同辦理。估算或鑑定完成後，市府將依據專業人員估算或鑑定金額，由市府「全額代墊」撥付求償救助金予受災戶。同時，受災戶於領取款項時，須簽署債權讓與契約，將對私人肇事第三人之損害賠償請求權無償讓與市府，後續由市府統一追償，免去市民面對繁複訴訟的奔波之苦。如有相關疑問可洽詢災害管理科03-5229508分機5433。工務處指出，針對因本次氣爆導致房屋結構受損嚴重如牆面坍塌、梁柱歪斜等建築物，市府將主動介入，先行代為辦理緊急支撐、危險物拆除以及結構安全鑑定，以防範二次災害發生並穩定公共安全。後續將視專業鑑定的最終結果，積極全力協助住戶辦理建築物之修繕或重建事宜。民政處表示，受災戶如有法律諮詢需求，可利用市府每週一、三、五下午2時至4時辦理之法律諮詢服務，並透過市民服務專線1999預約諮詢時段；相關服務資訊可至民政處官網查詢。東區區公所亦將持續協助受災戶聯繫市府相關局處，積極回應各項需求，並提供必要諮詢與協助服務，陪伴受災戶儘速恢復正常生活。社會處表示，高翠路氣爆案除了第一時間啟動關懷機制，並掌握受影響名單外，14日晚間的災後協助說明會上市府發放慰問金共計81戶。針對尚未領取的民眾，可於6月30日前洽社會處申領，自有住宅者請備妥戶籍資料、身分證及印章。若是租客則請備妥租賃契約、身分證及印章，如有相關疑問可洽詢社會處社會救助與老人福利科03-5352386分機203或205。另針對部分民眾住屋毀損，目前接受安置，仍有長期居住需求，後續也將積極協助媒合相關資源，以協助民眾度過難關。市府呼籲，請受災住戶在進行家園修復前、後，務必拍照留存。於修復完成、準備請款前，請廠商開立詳細報價單、發票或合法收據。特別注意，因後續市府需進行訴訟求償，發票及收據之抬頭「切勿」填寫機關名稱或機關統一編號，請務必填寫「受災戶姓名」及相關資料，以利後續各項代墊款項與救助作業之推動。    ,https://news.ltn.com.tw/news/society/breakingnews/5472509
