Title,News_Type,date,content,url
烏樹林廢棄物暫置場大火狂燒 台南「這5區」慎防空污,社會,2025/11/22 05:49,大火起初冒出大量黑煙。（記者楊金城攝）首次上稿 00:39更新時間 05:49台南後壁區烏樹林丹娜絲風災廢棄物暫置場21日晚上發生大火，台南市環保局立即調派機具與水車協助消防局滅火，連高公局、水利局都調派水車、抽水機支援，環保局啟動空品監測，北風不強，加上火場8、900度高溫，黑煙有減少趨勢，但提醒下風處的新營、東山、柳營、六甲家戶注意空品變化，做好防護。請繼續往下閱讀...環保局也透過官方臉書、第四台有線電視跑馬燈及跨局處系統完成通報，提醒後壁、白河、柳營、東山、六甲等可能受影響行政區民眾關閉門窗、減少外出，若需外出請配戴口罩做好自我防護。堆積的廢棄垃圾、廢木含有水氣、雜物，大火一開始冒出大量黑煙，往下風處擴散，環保局監測，現場吹北風，風速約2.1m/s，受東北季風影響，環境風場偏北向，煙流主要向南側、往上空傳輸。下風處監測站即時數據顯示：新營站 AQI 70（PM2.5：14 µg/m³）、善化站 AQI 77（PM2.5：19 µg/m³），均為「普通」等級；不過，依微型感測器資料研判，煙霧對下風處空氣品質已有一定程度影響。環保局持續密切追蹤監測數據，適時更新資訊。環保局說，後壁烏樹林風災廢棄物自7月8日進場量已累積超過25萬公噸。為加速清運，市府後續已向中央申請補助處理費用4億元；同時考量土地歸還時程及廢棄物暫存風險，市府已先行動用市庫代墊與災害準備金共3億500萬元，確保清運工程不受影響。環保局說，目前營建混合物及廢樹枝兩案均已進入發包程序，市府團隊將全力推動後續清運作業，並持續整合跨局處資源，力求在明年汛期前儘速清除部分廢棄物，騰出場地空間，降低環境及安全風險。大火起初冒出大量黑煙。（記者楊金城攝）火場高溫，煙變少。（記者楊金城攝）環保局現場監測風向、風速、空品，下風處也有監測站。（記者楊金城攝）台南市環保局提醒後壁、白河、柳營區、東山及六甲區居民注意空品變化，做好防護。（擷取自台南市環保局臉書） 熱門賽事、球星動態不漏接    ,https://news.ltn.com.tw/news/society/breakingnews/5254196
毒駕快篩大執法 一天查獲12件,社會,2025/11/22 05:30,永康警方以唾液快篩，查獲男子涉嫌毒駕，依法偵辦。（民眾提供）警政署為有效打擊吸食毒品後駕車案件，運用毒品唾液快篩試劑檢測，前天傍晚起上路執法。經統計，全國各警察機關執行到昨晚，透過唾液毒品快篩，已攔查取締十二件毒駕案，當中以台北市三件最多，快篩檢測呈安非他命等毒品陽性反應。台北市三件最多昨天下午四時許，警政署通令全國各警察機關正式啟動唾液毒品快篩試劑執法後，各警察機關隨即規劃相關勤務，依法將疑似毒駕駕駛人攔查後，告知其執法程序及快篩試劑使用方式、保存期限等規定，全程錄音錄影。請繼續往下閱讀...第一案在高雄市新制大執法展開後的第一案出現在高雄市，高雄市警鳳山分局於前晚七時許，在鳳山大東一路攔檢盧姓男騎士，快篩出其體內有海洛因毒品陽性反應，當場移置車輛保管，後續將採集盧男尿液送驗，待尿檢報告出爐確認吸食毒品，即移送高雄地檢署偵辦，追究公共危險與毒品罪刑責。毒駕快篩執法至昨天晚間，已查獲十二案，除高雄查獲首案外，台北市警察局自辦「擴大取締酒駕、毒駕兼防制危險駕車勤務」的結合性專案，查獲三件毒駕案，其次為新北市警局查獲二件，桃市、新市、中市、雲縣、嘉市與南市各查獲一件。永康警方以唾液快篩，查獲男子涉嫌毒駕，依法偵辦。（民眾提供）熱門賽事、球星動態不漏接    ,https://news.ltn.com.tw/news/society/paper/1733017
不配合就羈押 假檢警騙婦8300萬,社會,2025/11/22 05:30,一名新北市婦人遇假檢警詐欺，遭騙8300萬，由北檢偵辦中。（資料照）一名新北市婦人接到「假檢警」詐騙集團來電，以「不配合辦案就羈押你」等語，讓陷入慌亂的被害人把定存、保單金全部解約及賣掉股票，總共八三〇〇多萬元被轉入假的金管會監管帳戶，全部詐光。真檢警不會要求設轉帳帳戶受害慘重的她，期盼不要再有人受害，除了報案，並透過當過檢察官的律師何克凡，提醒社會大眾認清這種詐術。何表示，真正的檢警不會要求民眾設定約定轉帳帳戶、提供網銀帳戶密碼，也不會透過LINE偵訊等。請繼續往下閱讀...婦人於四月初接到自稱中華電信人員來電，稱有人拿她的身分證辦門號，說會幫轉接一六五反詐專線，假專線人員告知有人遭詐，匯款數千萬到她的帳戶，她已被告「你是詐團成員之一」，進而要求加入LINE群組，並以「偵查不公開」指示勿對外說。之後有假檢察官LINE稱不配合辦案會被羈押等，指示完成網銀帳密變更，詐團隨即登入，三個多月轉帳七十次，把婦人款項全捲走。檢警表示，假檢警手法並非受害件數更多案件，卻是個案遭詐金額最高的詐騙類型，一旦被害人相信「監管帳戶」往往會交出全部身家，一生積蓄化為烏有。熱門賽事、球星動態不漏接    ,https://news.ltn.com.tw/news/society/paper/1732991
矯正署：購干擾設備 科技阻絕,社會,2025/11/22 05:30,花蓮監獄的球類運動場，有排球、籃球場，監所人員目視發現無人機飛到約籃框的高度後將球往下丟，部分酒液有漏出。（警方提供）花蓮監獄管理人員今年九月中旬晚間，發現監獄上空出現無人機盤旋，隨後在球場上方空投違禁品進監獄。對此，法務部矯正署已要求各矯正機關加強空域監控，運用監視系統配合人員巡邏警戒，並與警方合作，發現異常立即通報排除，並依法移送檢調及權管單位取締、究辦。矯正署表示，另依「電信管制射頻器材製造輸入及申報作業管理辦法」，署方也督導各矯正機關採購干擾設備，評估應用偵防與阻絕科技，全面防制無人機侵擾行為。署方說，全國矯正機關皆為民用航空法規定的「無人機禁航區域」，呼籲民眾遵守法規，切勿以身試法。請繼續往下閱讀...警：所幸不是凶器、毒品花蓮傳出有出獄人員使用無人機，飛至花監上方空投違禁物給相熟的獄友事件。有資深警務人員認為，涉案人稱機上飛行軟體能破解禁航區防線，飛進飛出均無問題，如若被另有企圖者藉此將凶器、毒品等物送進監獄，可不得了，建議監所儘速建置最先進的阻絕設施，做好萬無一失的防範。熱門賽事、球星動態不漏接    ,https://news.ltn.com.tw/news/society/paper/1733013
假出金詐158億 26歲洗錢女帝 判24年,社會,2025/11/22 05:30,假出金詐騙集團女首腦歐俞彤。（取自IG）檢警去年底破獲全台最大假出金投資詐騙集團「美樂公司」，總計假出金八億四六九五萬餘元，導致五〇八二人受害，詐款達一五八億四九五〇萬餘元。台北地院昨依主持犯罪組織詐欺取財等一八五罪，將女首腦歐俞彤判應執行廿四年徒刑，另有八名核心幹部判逾廿年，有五十一人被判逾十年。韓星臉搭上竹聯組長走歪路外形神似韓星金智秀的廿六歲歐俞彤，原本是飯局妹，與在竹聯幫弘仁會擔任組長的男友吳漢威，共同成立與跨國詐團合作的「美樂公司」，除協助將贓款轉換為泰達幣或法幣，層層轉匯洗錢，並以假出金手法放長線釣大魚。據悉，吳男現仍在柬埔寨指揮詐團，北檢通緝中。請繼續往下閱讀...男友吳漢威 仍在柬埔寨作案台北地檢署今年四月起訴八十人，因有人審理期間逃亡被通緝，有人尚在拘提程序，有人因病停審，昨宣判七十六人，各被判二年至廿四年不等徒刑，尚有廿二人在押，還有數人另案發監服刑。判決指出，美樂公司架設二二三〇個假投資網站、手機APP程式，於社群、通訊軟體刊登假投資廣告，誘騙被害人面交或匯款；被害人上鉤後，假出金集團會匯出部分款項給被害人，致其誤信真有利潤而加碼投資，終致血本無歸。審理時歐女等五十六人認罪，十九人否認或只認輕罪，但事證明確，皆判有罪。合議庭痛批眾人正值青壯，竟為貪圖一己之私而犯案，致被害人蒙受重大金錢損失且難以追回贓款，其中十九人犯後態度不佳，未見悔意，分別量刑。北檢八月再起訴第二波十八人，被害人二二一人，北院另案審理中。收賄助詐 警所長判13年多定讞另一方面，已被免職的台北市警大同分局寧夏路派出所前所長葉育忻，收賄後協助「台版柬埔寨」詐團首腦「藍道」杜承哲，違法查詢個資及洩漏警方偵查行動，最高法院昨將葉男依違背職務收賄罪判刑十一年六月、洗錢罪判一年，偽造文書罪判一年二月，總刑度十三年八月定讞，將另定應執行刑期。熱門賽事、球星動態不漏接    ,https://news.ltn.com.tw/news/society/paper/1733014
A光洋科450公斤黃金 內賊判賠5.3億,社會,2025/11/22 05:30,高等法院台南分院認定，時任光洋應用材料科技貴金屬交易主管的陳男，違反受託義務侵吞黃金，造成公司損失一六九三多萬美元，判決全額賠償，依目前匯率換算，須賠約五．三億元台幣。（取自網站）光洋應用材料科技追討被侵占的四百五十公斤黃金，高等法院台南分院認定，時任該公司貴金屬交易主管的陳男，違反受託義務侵吞黃金，造成公司損失一六九三多萬美元，判決全額賠償，依目前匯率換算，須賠約五．三億元台幣。若以現今市值計算 超過18億本案判賠一千多萬美元，而如果是以其侵占的四百五十公斤黃金換算現值金額，高達十八億餘元。請繼續往下閱讀...判決指出，光洋應材的前許姓女主管，自設境外公司，與陳姓男主管配合，先讓光洋和銀行做預售交易，許女再拿與銀行談好的預售交易文件，把原本要給銀行的黃金，運到自己設置的境外公司，補短貨或轉賣吃價差。刑事部分，台南高分院已以違反證券交易法判刑十二年，而陳男讓異常交易順利過關，法院認定與許女有犯意聯絡，也判刑九年。民事方面，台南高分院認為，陳男是公司授權的貴金屬交易主管，處理交易應注意善良管理人原則，但他與許女共同侵占黃金四百五十公斤，換算損失為一六九三萬多美元，陳男應負賠償責任。陳男辯稱，自己只是衍生性交易課主管，沒有實體交易與授權名單決定權，文件簽核多屬形式，公司流程本就有問題，真正損失已被避險與其他交易利益填補，因此與他無關，但高分院不採信其說詞，認為陳男與公司屬於委任關係，應該負責。熱門賽事、球星動態不漏接    ,https://news.ltn.com.tw/news/society/paper/1733016
全國首見／無人機闖花監 空投違禁物,社會,2025/11/22 05:30,羅姓嫌犯把排球剪破後，裡面用小汽水瓶裝威士忌、檳榔送進監獄。（警方提供）2顆排球飛2次 內藏檳榔、威士忌 監所人員目擊 不動聲色逮取貨人檳榔、酒和香菸都是監獄違禁品，竟有人將威士忌和檳榔裝在排球內空投進監獄！今年九月十四日，矯正署花蓮監獄人員晚間十點多巡邏時，發現監獄上空有無人機盤旋，還空投兩顆「排球」進監，經查排球內塞了寶特瓶分裝的威士忌及檳榔，警方獲報逮捕曾在花監坐過牢的羅姓嫌犯，一併查扣無人機、遙控器及電池等證物移送法辦；本案是國內使用無人機運送違禁品進入監所的首例。請繼續往下閱讀...無人機飛手曾在花監服刑警方調查，曾在花監服刑的二十九歲羅男，熟悉監獄地形地貌，九月十四日晚間十點多，他鬼鬼祟祟地把車子停在監所圍牆旁的巡邏步道，被值晚班、開車進花監上班的監所管理員發現，立即通報處理。挑中放風日 送物資給朋友羅男見狀很快駛離，但獄方人員隨後發現，監獄上方出現一架無人機在球場上空盤旋，還先後兩次飛進監所、兩次空投「排球」到監獄球場。獄方人員前往察看，拿起兩顆排球發覺沉甸甸的，重量恐超過一公斤，且有剪破縫合痕跡，但被丟進球場前，又打氣充飽。獄方剪開排球，每一顆球內裝了三包檳榔、兩瓶六百CC、用七喜汽水瓶裝的威士忌洋酒，兩顆球共六包檳榔、四瓶酒，裝的瓶子未破，但有部分酒液漏出。當時監所人員目測，無人機飛到離球場地面兩公尺左右高度、約球場籃框的位置時進行「空投」，兩顆球落地時有發出聲響。獄方指出，當下不動聲色，將空投物當成「誘餌」，果然隔天出現陳姓受刑人前來取貨，經查陳男是羅男的朋友。據了解，空投隔天是花監每月一次的球場放風日，受刑人可以到球場打球，羅、陳疑因此安排前一天空運檳榔、洋酒進監，一併分給熟識的獄友。破解軟體 禁航區照樣飛行花蓮縣刑警大隊偵三隊長葉家福說，羅男嗜好海釣，常用無人機放長線釣魚，熟悉無人機操作，其無人機重量不到兩公斤，未逾民航局管制規定；羅男自稱花六萬元買材料自行組裝，其飛行軟體已破解「可以飛在禁航區」。花蓮縣警察局上空也是禁航區，警方測試發現，真的可以成功起飛。花監上空為禁航區，全案依違反民用航空法「在禁航或限航區飛行無人機」規定，可處三十萬元以上、一百五十萬元以下罰鍰，警方已移送縣府開罰。羅姓男子的空拍機是他自己花六萬元組裝，平常拿來海釣放長線，這次卻變作案工具，異想天開拿來投放違禁品進監獄。（警方提供）熱門賽事、球星動態不漏接    ,https://news.ltn.com.tw/news/society/paper/1733012
月世界垃圾山 16年環工里長是藏鏡人,社會,2025/11/22 05:30,高雄市岡山區碧紅里里長李有財。（取自高市府民政局網頁）李有財聲押、兒子收押高雄市燕巢區、田寮區月世界多處山坡地，遭傾倒廢棄物數百公噸案，橋頭地檢署搜索三家清運業者，先法辦收押指揮傾倒垃圾的男子蘇邦誠後，再查出幕後首腦是被稱為「環工里長」的高雄市岡山區碧紅里里長李有財，檢方指揮將李男及其兒子李子森等三人拘提到案，訊後李子森及男子施山正獲准收押，李有財聲押開庭中。有十六年里長經歷的李有財，自稱擁有環境工程碩士學歷，曾參選市議員未當選。去年初李男父子在岡山承租廠房堆放廢棄物，卻分別在元月、三月間二度引發大火，廢棄物燃燒造成地區嚴重的空氣污染，兩次均遭環保局各開罰十九．五萬元。不過李有財否認涉入濫倒案，辯稱是兒子所為。請繼續往下閱讀...李有財否認涉案 稱兒子所為檢方於十九日搜索勗瑞、貿毅、侑鴻三家合法清運業者及岡山一家茶行等處，認定拘提到案的蘇邦誠涉案重大，聲押禁見獲准，接著再拘提李有財父子、司機施山正等人到案。檢方追查，在台南立案的勗瑞、貿毅兩家公司，於台南市收攬一般家庭垃圾，為省去處理費用，未將垃圾運入焚化爐處理，而是轉運到高雄岡山交由侑鴻公司承租廠房囤積垃圾，累積一定數量後，再由蘇男指揮手下將垃圾載運到田寮山區產業道路邊傾倒；檢方查出，幕後就是侑鴻公司實際負責人李有財父子操控。檢察官認定李有財父子與蘇男、施男觸犯廢棄物清理法、組織犯罪防制條例等罪嫌重大，其中蘇已先收押，另有勗瑞公司業者鄭男六十萬元交保、貿毅公司業者黃男一百萬元交保，清運車司機林男、沈男、馮男各廿萬元交保。李有財從國民黨轉入民進黨，後以無黨籍參選里長，昨被民進黨高市黨部開除黨籍。李有財父子承租廠房堆放垃圾。（記者蔡清華翻攝）熱門賽事、球星動態不漏接    ,https://news.ltn.com.tw/news/society/paper/1733015
11/21今彩539頭獎開1注！800萬獎落南投,社會,2025/11/21 22:11,11月21日開獎的第114000282期今彩539頭獎開出1注；第114000107期大樂透頭獎摃龜。（台彩提供；本報合成）11月21日開獎的第114000282期今彩539頭獎開出1注，由南投縣魚池鄉日月村義勇街74號1樓的日月潭彩券行開出；第114000107期大樂透頭獎則摃龜。第114000107期大樂透中獎號碼「14、20、21、28、31、46，特別號：37」。頭獎摃龜；貳獎也摃龜；參獎共40注中獎，每注可得5萬2219元；肆獎共89注中獎，每注可得1萬5087元；伍獎共1725注中獎，每注可得2000元；陸獎共2355注中獎，每注可得1000元；柒獎共2萬3982中獎，每注可得400元；普獎共3萬1202注中獎，每注可得400元。請繼續往下閱讀...第114000107期49樂合彩中獎號碼為「14、20、21、28、31、46」。四合共8注中獎，每注可得20萬元；三合共88注中獎，每注可得1萬2500元；二合共2628注中獎，每注可得1250元。第114000282期今彩539中獎號碼為「05、10、17、28、35」。頭獎開出1注，可獲800萬元；貳獎共247注中獎，每注可得2萬元；參獎共9230注中獎，每注可得300元；肆獎共8萬7950注中獎，每注可得50元。第114000282期39樂合彩中獎號碼為「05、10、17、28、35」。四合共12注中獎，每注可得21萬2500元；三合共695注中獎，每注可得1萬1250元；二合共1萬8171注中獎，每注可得1125元。第114000282期3星彩中獎號碼為「465」。壹獎共55注中獎，每注可得5000元。第114000282期4星彩中獎號碼為「8600」。壹獎共7注中獎，每注可得5萬元。確切中獎號碼以台彩網站公告為主，請見「台灣彩券網站」。大樂透、今彩539、39樂合彩、3星彩、4星彩中獎號碼。（擷取自台彩官網）熱門賽事、球星動態不漏接    ,https://news.ltn.com.tw/news/society/breakingnews/5254149
台南新市7旬翁駕車失控連環撞 整排機車倒、險衝進麥當勞,社會,2025/11/21 21:55,轎車連環撞，掃倒整排停放的機車，現場一片混亂。（民眾提供）台南新市區20日下午發生連環車禍，70歲王姓男子開車行經台1線時，疑似先擦撞單車、分隔島後失控，往右偏移，掃倒停在路邊的整排機車，還險些衝入麥當勞，現場一片混亂，所幸僅2人受傷，送醫已無大礙。善化警方表示，該案並未涉及酒駕，肇事責任釐清中。當時王姓男子駕駛白色轎車沿中山路往北，在路口先擦撞林姓騎士的單車，再衝撞分隔島，並以飛快的速度，失控掃過麥當勞店外整排機車，一片狼藉。請繼續往下閱讀...單車騎士與轎車駕駛都有受傷，但意識清楚，肇事原因警方調查中，善化分局呼籲民眾應遵守交通規則，小心開車、減速慢行，以維用路人安全。70歲王姓男子開車行經台1線時，疑似先擦撞單車、分隔島後失控，往右偏移，掃倒停在路邊的整排機車，還險些衝入麥當勞。（民眾提供）熱門賽事、球星動態不漏接    ,https://news.ltn.com.tw/news/society/breakingnews/5254134
稱「日本熊出沒」取消出團 基隆退休族26人被詐騙損失近百萬,社會,2025/11/21 21:13,基隆市議員鄭文婷呼籲被蕭姓女子招攬旅遊受騙民眾要出面報案，保障自身權益。（鄭文婷提供）基隆市發生旅行社詐騙案，某旅行社一名蕭姓女子長期在基隆市區招攬旅遊團，卻在出團前夕突然以日本有熊出沒取消，受害26人大多是退休人員，不乏退休局長和前議員，受騙金額高達97萬5000元，市議員鄭文婷呼籲市民務必提高警覺，避免再度受騙。鄭文婷指出，這團民眾原預計11月7日前往日本東北旅遊，在6月每人繳交2萬元訂金，8月將全額團費都繳清。但蕭女11月5日晚上突然通知「日本有熊出沒」為由取消出團；11月7日又以「機票販售旅行社超賣、將賠償50%的違約金」等方式欺騙民眾，以博取信任。請繼續往下閱讀...鄭文婷強調，經了解後發現，旅行社從頭到尾根本沒有訂機票。目前已知受害者有26人，總金額高達97萬5000元，大多數是基隆市退休長者，其中不乏退休的消防局長、副總隊長和前議員等人。據民眾指出，蕭女在基隆旅遊界頗為活躍，以前常參加她的旅遊行程，沒想到這次卻發生被詐騙事件。鄭文婷也呼籲民眾，若有參加蕭姓女子招攬的旅遊行程，務必向警方報案或洽詢相關單位，避免像這批日本團成員一樣，遭遇同樣的詐騙手法。熱門賽事、球星動態不漏接    ,https://news.ltn.com.tw/news/society/breakingnews/5254101
金門染黃!外籍女觀光卻賣身  應召機房竟藏身台南透天厝,社會,2025/11/21 20:58,金門檢警查獲線上應召集團機房及工作人員。（金門地檢署提供）1名外籍女到金門觀光還從事性交易，檢警追出幕後集團藏身台南市區，還設立線上應召機房，並僱用10餘名員工組織化經營，每次性交易費用數1000元至1萬元以上不等，集團獲利逾1000萬元；檢方將王姓經營者自台南解送金門偵訊，日前向法院聲押獲准。金門縣警察局刑事警察大隊4月查獲1名以觀光名義入境的外籍女子，在金門某民宿與男客性交易，懷疑有賣淫集團從中媒介、營利，金門地檢署檢察官陳岱君指揮刑大成立專案小組，隨即將媒介賣淫女子的曾姓經紀人拘提到案，訊後向金門地方法院聲請羈押獲准。請繼續往下閱讀...金門地檢署向上溯源，由主任檢察官葉子誠、檢察官陳岱君協同專案小組持搜索票，11月13日在台南市中西區某透天厝內，當場查獲王男在內共14人經營的線上應召集團機房，並查扣大量電腦、手機、現金18萬6070元等證物，將集團王姓經營者解送金門地檢署，檢察官席時英漏夜訊問後，向法院聲請羈押禁見獲准，其餘現場工作人員分別以5萬元至20萬元不等交保。檢方指出，王男2023年起在台南市某透天厝等地架設應召網站，透過網路論壇刊登性交易廣告，提供應召女子照片、服務項目、費用等，若男客有需求，再將交易訊息轉知經紀人，指派應召女子與男客進行性交易，王男等依比例抽取佣金，曾媒介多名外籍女子到金門性交易；警方11月20日在金寧鄉某住宅內，又查獲2名外籍賣淫女子，扣得現金12萬8800元。葉子誠說，該案對社會治安有重大影響，檢警持續追查案情。金門警方查扣的電腦、手機、現金等證物。（金門地檢署提供）金門檢警查扣電腦、手機、現金等證物。（金門地檢署提供）熱門賽事、球星動態不漏接    ,https://news.ltn.com.tw/news/society/breakingnews/5254091
成功嶺替代役偷開連長車離營 十軍團：用車上證件矇騙大門衛兵,社會,2025/11/21 20:55,成功嶺傳出替代役男開走連長的車子離營。（資料照）台中成功嶺昨（20）日晚間爆出替代役男疑似逃跑事件，1名第一天入營270梯的李姓替代役男乘隙偷取連長鑰匙，開著連長的車輛離營，一路北上返回位於台北市北投區住家，當晚營內官兵發現他失聯後立刻展開搜尋，甚至在營區內徹夜尋人，情況一度引發逃兵疑雲。今（21）日上午，該名役男家屬主動向相關單位通報，人已在家中平安無事，成功嶺替代役男管理單位也證實確有1名役男在昨夜離營，初步研判與身心狀況有關，目前已順利聯絡上本人並在家休養；轄區警方表示，已連繫家屬將帶同該役男前來派出所製作筆錄，釐清案情。請繼續往下閱讀...陸軍第十軍團表示，大門衛兵有進行查驗動作，但李男拿著連長車上證件矇騙過關，大門安檢有疏漏，針對李男假冒軍人離營部分，將交由憲兵隊偵辦，並加強門禁管制。太狂！替代役男偷開連長車落跑 成功嶺漏夜大搜捕人已在家「休養」一路開綠燈！成功嶺替代役男入伍當晚尿遁偷車 離營開回台北睡覺熱門賽事、球星動態不漏接    ,https://news.ltn.com.tw/news/society/breakingnews/5254092
