Title,News_Type,date,content,url
葉元之嗆賴清德訪非受阻只會怪中共！ 她當場傻眼：就真的啊,政治,2026/04/23 15:24,"台北市議員林亮君。（資料照）賴清德總統原定出訪非洲友邦史瓦帝尼，卻因中國施壓塞席爾、模里西斯、馬達加斯加撤回飛航許可，行程被迫暫緩，引發國際譁然。對此，立委葉元之批評，難道因為有中共的存在，「我們都不用做任何的努力？」他還諷刺：「反正邦交國只要掉了，就是中共的錯。」針對賴清德出訪受阻，國民黨主席鄭麗文批評民進黨一意孤行、外交一路挫敗，「要先檢討自己」。昨日政論節目新聞面對面中，台北市議員林亮君痛批鄭麗文上述說法，葉元之則護航鄭麗文表示，「反正什麼都They的錯、什麼都中共的錯」。他還諷刺，所以只要有中共存在，我們都不用做任何的努力，不用想方法，反正邦交國家掉了就是中共的錯？請繼續往下閱讀...而林亮君則是無奈插話：「就真的就是中共的問題啊，我們已經盡了最大的努力，我們外交人員多麼努力在國際社會上夾縫求生？」針對主持人謝震武提問，「鄭習會」後中共應該更開放胸懷，給台灣一些空間，只是到非洲史瓦帝尼，沒必要搞成這樣吧？葉元之則說，國民黨很多人也覺得老共不必這樣，但也不能扯到鄭習會，這沒有因果關係。這件事只能解釋兩岸關係現在真的很不好，政府當然就要去了解這是會發生的狀況，以及找到因應辦法。    ",https://news.ltn.com.tw/news/politics/breakingnews/5413548
中國嗆不存在中華民國總統 林宜瑾揭「國共詐騙產業鏈」,政治,2026/04/23 15:22,立委林宜瑾。（資料照）國台辦昨召開記者會強調「台灣沒有總統」，國民黨文傳會主委尹乃菁則回應，中華民國的總統「當然在」，隨後中方再嗆「中華民國總統早已不存在」。立委林宜瑾今在臉書發文火力全開，直指中國共產黨在「消滅中華民國」這件事上，表現得比國民黨誠實許多，更嘲諷中國外交部早已表明世界上不存在「中華民國總統」，在一個中國框架下，根本沒有中華民國生存空間，但藍營現在仍喜孜孜談論「鄭習會」或惠台政策，「在中共眼裡不過是對前朝遺民的處置措施」。林宜瑾今日發文指出，中華民國在台灣已77年，主權行使範圍涵蓋台澎金馬，歷經7次修憲、8次總統直選及10次國會改選，每一張選票都在確認台灣共同體的組成。她認為，台灣人對民主的實踐、財產自由的保障，以及決定自身命運的能力，早已讓習近平統治下的中國完全看不到車尾燈。請繼續往下閱讀...林宜瑾指出，中華民國已在這塊土地落地生根，無論稱呼為台灣或中華民國台灣，都是 2300萬台灣人我們自己的事。但國民黨執意與中國搞「共同政治基礎」與「九二共識」、將台灣海峽說成中國內海，甚至要求政府必須獲得中國恩准才能進行外交。她質疑，「被中國准許來的外交，還叫外交嗎？」我們真的一點也不懷疑，國民黨要消滅中華民國的決心。林宜瑾最後重砲轟擊國民黨主席鄭麗文等促統之流，批評他們從未講清楚所謂的跟中國的「共同政治基礎」、「九二共識」到底是什麼。她形容這是一場「國共詐騙產業鏈」，講好聽點國民黨是不願醒來的詐騙受害者，講難聽點就是詐騙集團小弟，利用似是而非的話術要來騙光受害者祖產，而台灣就是那隻富裕發達的待宰肥羊。中國稱世界不存在「中華民國總統」 尹乃菁：當然在    ,https://news.ltn.com.tw/news/politics/breakingnews/5413503
軍購條例協商立法意旨  藍白堅持刪「中共軍事威脅」、「國防產業」,政治,2026/04/23 15:21,立法院23日下午進行朝野黨團協商「強化防衛韌性及不對稱戰力計畫採購特別條例草案」等案，立法院長韓國瑜主持會議。（記者羅沛德攝）立法院朝野黨團今（23）日繼續協商「國防特別條例草案」，針對第一條條文立法意旨，國民黨團堅持刪去「中共軍事威脅」改為「因應敵情威脅」，民眾黨團則堅持將「國防產業」改為「國防實力」，最終經立法院長韓國瑜裁示，通過修改後刪去「中共軍事威脅」及「國防產業」等文字的版本。朝野黨團今針對行政院版1.25兆元「強化防衛韌性及不對稱戰力計畫採購特別條例草案」、台灣民眾黨團所提4000億元「保衛國家安全及強化不對稱戰力計畫採購特別條例草案」及國民黨黨團所提3800億元加N的「強化國防及對美軍事採購特別條例草案」等三案進行協商。請繼續往下閱讀...「國防特別條例」的條例名稱已在上次協商通過採用民眾黨團版本，即「保衛國家安全及強化不對稱戰力計畫採購特別條例」。今天協商從第一條立法意旨開始逐條審查，因國民黨團堅持刪去「中共軍事威脅條文」，民眾黨團堅持刪去「國防產業」，最終通過第一條條文版本為：「為因應敵情威脅及迫切之國防需要，建置可保衛國家安全以及強化不對稱戰力之武器及裝備，運用重層嚇阻，強化防衛韌性，厚植國防實力，以提升聯合作戰效能，確保國家安全，特制定本條例。」國防部長顧立雄一度提出在「厚植國防實力」中加入「厚植國防自主實力」，民進黨立委范雲則提出「厚植國防產業及實力」，皆被在野黨聯手否決，國民黨立委馬文君也直言「那不要外購了嗎？」回顧各版本，行政院第一條條文版本為：「因應中共軍事威脅持續擴增，為建置可強化國軍防衛韌性與不對稱戰力之武器及裝備，運用重層攔截網，打造臺灣之盾；引進高科技及人工智慧，加速擊殺鏈；厚植國防產業，打造非紅供應鏈之強韌防衛體系，以提升聯合作戰效能，確保國家安全，特制定本條例。」民眾黨團版本第一條條文為：「因應中共軍事威脅持續擴張，為建置可保衛國家安全及強化不對稱戰力之武器及裝備，運用重層嚇阻，發揮聯合戰力，以提升聯合作戰效能，確保國家安全，特制定本條例。」國民黨團版本第一條條文則是：「為因應國際情勢，厚植我國防實力，提升區域安全及現代戰爭型態及新興軍事科技發展演進，透過對美國政府及其授權體系之軍事裝備與相關服務採購，建構關鍵防衛能力、確保武器系統及後勤支援之即時取得與有效整合，確保國家安全，特制定本條例。」國民黨立委牛煦廷會中表示，三個版本文字各有落差，過去幾次國防特別條例寫法皆是「為因應敵情威脅及迫切之國防需要」，這和過去政院提出來的版本文字是一模一樣的，沒有政治色彩，比較有機會達成三黨共識。民進黨立委莊瑞雄強調，條文加進文字都非常好，可是「刻意去掉就不好」，例如為因應國際局勢是好事，但刻意刪掉「因應中共軍事威脅持續擴張」，這就沒必要，在座的將軍也很清楚，當一輩子軍人，怎麼可能會不知道我們真正最大的威脅是來自於中共持續武力擴張？刻意刪掉，就好像在閃躲什麼，又很奇怪。不過，國民黨立委徐巧芯會前受訪指稱，黨團共識版本目前方向沒有太大改變，但是相信後續藍白「整個在野黨會有共同協商」，最後結果會是如何現在還沒辦法給出肯定答案。徐巧芯說，他認為共識就是美方軍售給台灣的武器，國民黨會在合情合理的情況下予以支持，厚植我國國防實力。其餘部分建議編入到一般常規預算裡面，或者用其他的方式，在撙節國家預算的情況下，讓我國國防實力仍然能夠提升。立法院朝野黨團23日下午協商「強化防衛韌性及不對稱戰力計畫採購特別條例草案」等案，國防部長顧立雄會前受訪。（記者羅沛德攝）    ,https://news.ltn.com.tw/news/politics/breakingnews/5413554
連9年賸餘！卓榮泰：2025年總決算 實際賸餘破千億,政治,2026/04/23 15:15,行政院會今天通過2025年中央政府總決算暨附屬單位決算及綜計表（營業及非營業部分）。（圖由行政院提供）行政院長卓榮泰今（23）日在院會表示，近年台灣經濟穩定成長，中央政府財政管理審慎，2025年中央政府總決算扣除債務還本，實際賸餘1021億元；自2017年起，每年度總決算歲入歲出都有賸餘，「這是好紀錄」。行政院會今天通過2025年中央政府總決算暨附屬單位決算及綜計表（營業及非營業部分）、中央政府疫後強化經濟與社會韌性及全民共享經濟成果特別決算、中央政府前瞻基礎建設計畫第5期特別決算等，將於4月底提送監察院。請繼續往下閱讀...卓榮泰表示，近年台灣經濟穩定成長，中央政府財政管理審慎，2025年中央政府總決算歲入歲出賸餘2436億元，較原編列賸餘增加855億元，但2436億元如扣除債務還本，實際賸餘是1021億元。自2017年起，每年度總決算歲入歲出均有賸餘，這是一項好的紀錄。2025年決算部分，行政院主計總處會計決算處長許一娟補充，2025年歲入決算數3兆1776億元，歲出決算數2兆9340億元，歲入歲出相抵賸餘數2436億元，各機關開源節流有所成效，經扣除償還債務1415億元後，2025年收支賸餘為1021億元。在營業基金方面，2025年決算營業總收入3兆9231億元，營業總支出3兆5435億元，收支相抵淨利3796億元，較預算數1482億元增加2314億元，主要是中央銀行因外幣資產營運量及收益率較預算增加，使淨利增加719億元，以及台電公司電費收入增加，致淨利由原預算淨損704億元轉虧為盈，相差1450億元等。疫後強化韌性特別預算部分，預算編列3799億元，執行期間為2023至2025年，歲入結算1億元，歲出結算3690億元，兩者差短3689億元，但因2024年中央政府總決算尚有審定累計賸餘可供移用，因此依疫後強化經濟與社會韌性及全民共享經濟成果特別條例規定，優先全數移用以前年度歲計賸餘支應。    ,https://news.ltn.com.tw/news/politics/breakingnews/5413562
蕭景田喊話「把父母的話當一回事」 謝衣鳯回擊「我是新女性」,政治,2026/04/23 15:15,國民黨彰化縣立委謝衣鳯爭取縣長提名，立場堅定，強調自己是新女性。（資料照）國民黨彰化縣長提名亂流未歇，國民黨彰化縣黨部主委蕭景田日前受訪喊話立委謝衣鳯「把父母的話當一回事」，謝衣鳯今天（23日）回擊「我是新女性」，有女性獨立尊嚴，蕭景田不是家人，請不要代表她的父母發言，介入她的生涯規劃！謝衣鳯今天接受媒體人黃光芹專訪，堅定表達參選彰化縣長的決心，她表示，她有她個人獨特的政治魅力，有她自己的想法與理念，她是獨立個體，可以打破彰化傳統的偏見。家庭對她來說是避風港，她要在彰化打選戰，是因為「成功不一定要我」，但「有我一定成功」，可以贏得勝選。請繼續往下閱讀...謝衣鳯強調，她跟議長謝典霖是一家人，弟弟要當議長，這是由議員選出，而她參選縣長，這是由選民直接選舉，這是兩種完全不同的選舉。至於，弟弟能不能當議長，這是要看「議員的智慧」，總之，「姊弟登山，各自努力」。謝衣鳯指出，民進黨很早就提名立委陳素月參選縣長，國民黨迄今遲遲未拍板定案，她要請黨中央儘速用民調來敲定人選。當選情五五波時，中間選民與年輕族群就是勝選關鍵，如果由她來參選，她會爭取台積電與半導體產業到彰化，讓高科技有更多高薪工作，也要爭取好市多來設立，讓年輕人有高薪工作，有便利的生活，才能解決人口外流。最後，謝衣鳯強調，年底彰化縣長選舉，國民黨要儘速提名，讓選戰順利開跑，才能迎戰民進黨提名的新潮流陳素月，由她出線才是整合最大化，團結最大化！    ,https://news.ltn.com.tw/news/politics/breakingnews/5413564
選罷法修正案立院初審！詐欺犯不得參選、放寬受緩刑宣告者選舉資格,政治,2026/04/23 14:57,立法院內政委員會今日初審通過「公職人員選罷法第26條修正草案」、「總統副總統選罷法第26修正草案」增訂曾犯詐欺犯罪危害防制條例，經有罪判決確定，不得登記為候選人。另，朝野針對排除「受緩刑宣告者」參選限制達成共識。（記者羅沛德攝）立法院內政委員會今日初審通過「公職人員選罷法第26條修正草案」、「總統副總統選罷法第26修正草案」增訂曾犯詐欺犯罪危害防制條例，經有罪判決確定，不得登記為候選人。另，朝野針對排除「受緩刑宣告者」參選限制達成共識，但因民眾黨堅持納入「易刑處分者」，因此將條文保留送黨團協商。內政委員會今日逐條審查朝野所提「公職人員選舉罷免法第26條條文修正草案」、「總統副總統選舉罷免法第26條修正草案」，並邀請內政部長劉世芳、中選會代理主委吳容輝等人列席審查。請繼續往下閱讀...民進黨立委林淑芬提案指出，選罷法第26條是對候選人的消極資格限制，未區分罪質輕重及是否入監執行的必要性，導致非屬「黑、金、槍、毒」等特定重罪，且獲法院諭知「緩刑」者，其參政權受限程度竟長於易科罰金執行完畢者，顯有法律評價輕重失衡之違失，主張排除受緩刑宣告者之候選人消極資格限制 ，以符合比例原則與平等原則。國民黨立委陳玉珍提案表示，現行法將所有「緩刑」期間的犯罪輕微案件，一律排除參選資格，已過度擴大排黑打擊範圍，對鼓勵更生人的司法目的不符，顯有違反憲法比例原則之虞，因此主張排除受緩刑宣告者。不過，民眾黨團則主張進一步擴大放寬，提出「受緩刑宣告或易刑處分者，不在此限。」民眾黨立委許忠信說明，限制參選是褫奪公權，而第26條第15款已經有褫奪公權，但對輕罪緩刑時間與褫奪公權時間不一定一致，受緩刑宣告應不在此限。協商後，朝野立委針對「受緩刑宣告者，不在此限」達成共識，不過許忠信堅持納入「易刑處分者」；最後經國民黨籍召委廖先翔裁示，將相關條文保留送朝野協商。此外，針對民進黨立委李柏毅所提「總統副總統選罷法第26條修正案」及「公職人員選罷法第26條修正案」增訂第6款曾犯「詐欺犯罪危害防制條例」罪，經有罪判決確定，不得登記為候選人，該提案獲朝野共識，初選通過送交院會審查，無需再經黨團協商。易刑處分意旨，為對確定裁判所宣告的刑罰，基於刑事政策考量，避免短期自由刑所可能產生的弊端，對於原則上應依該確定裁判宣告之刑的執行，改以其他刑罰或處分為替代。易刑處分的種類分為四種包含，易科罰金（替代短期自由刑）、易服勞役（替代罰金刑）、易以訓誡、易服社會勞動。    ,https://news.ltn.com.tw/news/politics/breakingnews/5413523
李貞秀之亂誰扛責？ 柯文哲認被關導致訓練不足 吳靜怡：怪土城所長？,政治,2026/04/23 14:53,民眾黨創黨主席柯文哲。（資料照）中配李貞秀日前遭民眾黨開除黨籍後，已喪失立委資格，李日前透露已向北院聲請假處分，更赴台北高等行政法院提告中選會、立法院。民眾黨創黨主席柯文哲今受訪坦承，他應要為此負責，當時犯的錯誤是因為那2年以來自己在土城進修，導致備位立委訓練不足。對此，媒體人吳靜怡反諷地說「土城所長害到柯文哲！」據震傳媒昨（22日）公布最新民調顯示，針對民眾黨爆出李貞秀想用金錢對價作為辭去立委的補償，引發李貞秀與民眾黨公開互罵的亂象，25.9％受訪者認為李貞秀該為此事件負責，24.8％認為柯文哲該負責，至於15.0％受訪者則認為，現任民眾黨主席黃國昌該負責。請繼續往下閱讀...吳靜怡今日於Threads發文轉貼媒體報導標題「李貞秀之亂誰負責？柯文哲坦承『制度要檢討』：土城進修害黨亂七八糟」，更大酸「土城所長是誰？又你？害到柯文哲！」網友看到貼文後相繼留言，有人說「最沒有制度的就是你們垃圾民眾黨」、「意指代理主席做太差」、「翻譯：黃國昌搞的亂糟糟」、「懷疑柯犯正在偷臭黃嫌，但我沒有證據」、「搞笑起手式：制度、SOP，若照他的方式去管理國家，早就崩潰了，連民眾黨支持者都知道那位有問題，就他自己不知道」。     在 Threads 查看    ,https://news.ltn.com.tw/news/politics/breakingnews/5413320
黃偉哲快閃訪菲首站加美地 深化近半世紀姊妹市情誼,政治,2026/04/23 14:49,台南市長黃偉哲（右）贈送南市客製化行李箱給菲律賓加美地市長Denver Chua（左），表達城市友誼。（圖由台南市府提供）台南市長黃偉哲以不到2天的緊湊行程訪問菲律賓，展現高效率城市外交行動力！今（23）日清晨抵達後，首站即前往台南在當地的第1座姊妹市加美地市，凸顯對雙邊情誼的高度重視。黃偉哲表示，台南相當珍惜與加美地市長達近半世紀的深厚情誼。為回應加美地市長Denver Chua於上月親自率團訪問台南，此行特別將加美地市列為訪菲首站。他指出，兩市已建立穩固友好基礎，未來將在既有官方互訪之上，進一步拓展物產、觀光與教育等多元領域合作，並透過長期交流讓情誼延續至下一代。請繼續往下閱讀...此次訪問中，加美地市長Denver Chua與副市長Benzen Raleigh Rusit率市政團隊與市議員隆重迎接台南訪團，展現高度熱情。黃偉哲一下車即感受到當地的溫暖接待，雙方互動熱絡。Chua市長指出，今年3月訪問台南市期間，對台南在城市治理與文化保存上的成果印象深刻，也深受啟發。他期待未來雙方能進一步落實具體合作，特別是在青年教育交流方面深化連結，並誠摯邀請台南市民前往加美地市參訪交流。台南市政府新聞及國際關係處表示，黃偉哲此行以最精簡時間進行最具成效的交流，充分展現城市外交的行動力。隨著台菲互動持續升溫，市府未來也將持續拓展國際鏈結，提升台南市的國際能見度，為雙邊合作注入更多動能。加美地市於1980年與台南締結姊妹市，素有「臨海灣的歷史古城」之稱。上月Denver Chua市長曾率17人訪團造訪台南，參訪古蹟與在地企業，為此次交流奠定更深厚基礎。加美地市以當地精彩舞蹈歡迎南市府訪團到來。（圖由台南市府提供）菲律賓加美地市議員亦出席南市府訪團歡迎會。（圖由台南市府提供）    ,https://news.ltn.com.tw/news/politics/breakingnews/5413486
防資安外洩！顧立雄：全軍禁用「高德地圖」 私人手機一併納管,政治,2026/04/23 14:45,中國「高德地圖」登台，甚至具備「紅綠燈倒數」功能，遭疑有資安疑慮。（記者王藝菘攝）中國「高德地圖」登台，甚至具備「紅綠燈倒數」功能，遭疑有資安疑慮，甚至可透過超商分店等據點辨別營區。對此，國防部長顧立雄今（23）日說，國防部會依循數發部禁止立場，通令全軍遵循禁止使用的規範。媒體報導，中國「高德地圖」街景能以3D呈現，還有紅綠燈倒數功能，遭疑有資安及國安疑慮。針對媒體詢問，該地圖中的軍事營區雖已去識別化，卻仍可透過超商分店等資訊辨別，顧立雄今天說，中共的衛星每天都在經過，一旦有戰事發生固定陣地的位置都不會是完全安全的所在。請繼續往下閱讀...顧立雄指出，國軍早就在戰術的應用上，會找尋隱蔽及適合的戰術位置。這本來就在作戰面上面會考量的部分。媒體追問，私人手機是否也納管？顧立雄承諾，就了解數發部已經禁止，國防部會依循這個立場，對有資安疑慮的數位圖資軟體，通令全軍遵循規範，禁止下載使用。    ,https://news.ltn.com.tw/news/politics/breakingnews/5413516
這也不認？民眾黨稱柯文哲329遊行沒喊「賴祥德」,政治,2026/04/23 14:43,林子宇稱柯文哲喊的是「賴清德」。（取自黃國昌YouTube直播畫面）前台北市長柯文哲因涉京華城弊案一審被判17年，他3月29日在「上凱道討公道」集會中，歇斯底里怒吼：「賴祥德，沒有用的！我不會屈服！」口誤將賴清德喊成賴祥德，迷因持續流傳。昨日他與同黨籍新北市長黃國昌、新北市議員參選人林子宇等人到板橋湳雅夜市造勢，林子宇當面與柯文哲討論此事，並表示是大家聽錯，柯文哲喊的是「賴清德」，她還說：「幫你證明，他講的是賴清德。」柯文哲一行人昨日在湳雅夜市用餐時，林子宇好奇詢問柯文哲，知不知道大家為何看到他都會Cue「賴祥德」？柯文哲表示自己不曉得。林子宇則解釋，網路上流傳當時的影片中，柯文哲那時喊「賴清德，沒有用的」，但大家都聽成「賴祥德，沒游泳的」。請繼續往下閱讀...講到此處，林子宇也看向329遊行時就站在柯文哲身邊的黃國昌，而黃國昌只是微笑點頭輕笑幾聲。林子宇隨後又向柯文哲說：「我幫你證明。」並對著鏡頭喊：「他講的是賴清德！」根據當時影片，柯文哲確實喊出「賴祥德」。而林子宇、柯文哲對答時，柯文哲直播聊天室小草們也不斷留言：「​​賴祥德，沒游泳的」、「​​賴祥德。偶不會去扶的」、「賴祥德」、「​​賴祥德沒游泳」。    ,https://news.ltn.com.tw/news/politics/breakingnews/5413332
江和樹爆李貞秀「簡訊要錢」到底真假？  陳清龍：言過其實,政治,2026/04/23 14:43,民眾黨立法院黨團總召、立委陳清龍（中）。（資料照，台灣民眾黨提供）中配李貞秀在本月中旬遭民眾黨中評會開除黨籍後，繼上節目爆料砲轟黨中央後，近日更先後聲請法院假處分，並提告立法院、中選會，「開撕」戲碼延燒；台中市議員江和樹昨日更爆李曾「私訊」黨團總召陳清龍要錢，還提醒「記得錢要乾淨、金流要做好」，兩人隔空互嗆。對此，陳今回應，江並未參與對話，言論「言過其實」已屬不妥。江和樹昨（22）日接受政論直播節目「中午來開匯」專訪表示，李貞秀曾私訊民眾黨黨團總召陳清龍「要求金額」，更提醒「記得錢要乾淨、金流要做好」；引發李臉書上隔空開嗆江「無恥」，不只罵他沒證據就出來造謠當打手，要他好好做人，還曝他私下偷罵民眾黨周榆修壞人，要他出來「打球」，火藥味濃厚。請繼續往下閱讀...針對江和樹爆料與李貞秀的回應，立委陳清龍今（23）日上午回應，據他所悉，江和樹議員並未參與跟李貞秀前委員的任何溝通，並不瞭解事情全貌，坦言其說法已「過於誇大且言過其實」，實為不妥。陳清龍強調，這件事情其實該翻頁了，我已經多次說明，在我與李貞秀前委員溝通的過程中，李貞秀前委員都有表達其想法與條件，但立法委員的身分不能拿來交易，我也有把完整的溝通過程跟中評會報告。陳清龍重申，中評會既已做出決議，作為台灣民眾黨一員，就是遵守中評會決議，並對於李前委員要在法律訴訟中爭取權益一事，表示「那是她的權益，我都尊重」。    ,https://news.ltn.com.tw/news/politics/breakingnews/5413526
