Title,News_Type,date,content,url
鄭麗文派「血滴子」封殺軍購！賴瑞隆：以黨紀貫徹中共意志,政治,2026/05/02 18:05,民進黨立委賴瑞隆。（資料照）軍購案國民黨爆發內訌，繼國民黨副主席季麟連揚言開除立法院長韓國瑜黨籍後，國民黨考紀會主委兼大陸部主任張雅屏今（2日）也強調，「決策紀律比立場更重要」。對此，參選高雄市長的民進黨立委賴瑞隆直指，台灣社會對增強防衛能力有高度共識，國民黨主席鄭麗文卻派出「血滴子」，以黨紀處分操控國會、封殺軍購，貫徹中共的意志。兼任民進黨中評會主委的賴瑞隆接受本報訪問指出，全民對於增加軍購預算、強化防衛能力具有高度共識，同時也支持增強台灣與美國、日本等友邦的關係，並強化國內自主研發的產業能力，這對台灣絕對是最佳方案，許多有意參選的國民黨地方民代，都很清楚應支持國防預算。請繼續往下閱讀...不過，賴瑞隆質疑，國民黨在鄭麗文的帶領下走向親共路線，背後的「藏鏡人」就是中共，現在竟然連8000億元預算都得不到支持，並以3500億加N的版本，透過黨紀來壓制民意。等同讓中共藉由控制黨中央，進而控制民意代表。對於國民黨考紀會的強硬態度，賴瑞隆形容，該單位就是鄭麗文及中共的劊子手、血滴子，除了貫徹黨的意志，也貫徹中共的意志。賴進一步說明，若國民黨中央對其不分區黨籍立委祭出黨紀，不僅會使其失去立委資格，更可能影響未來的參選權，藉由這樣的方式強壓這些人。若考紀會成功決定台灣的軍購案方向，將形同中共操控國會的大勝利，也是台灣民主的大倒退。「你們還能夠沈默下去嗎？要完全照黨意來執行嗎？」賴瑞隆並呼籲，所有國民黨縣市長參選人及區域立委，包括同樣參選高雄市長的立委柯志恩，都應該把態度說清楚，別再閃躲問題，忠於台灣而非忠於中共，這是台灣人民的基本底線即要求，否則最終將被民意所淘汰。    ,https://news.ltn.com.tw/news/politics/breakingnews/5423251
柯文哲站台嘉縣萬家甫 盼延續近萬票在地扎根,政治,2026/05/02 18:01,民眾黨前主席柯文哲（右一）期許萬家甫（右二）能開出他參選總統時的票數。（記者蔡宗勳攝）民眾黨嘉義縣唯一徵召提名議員第四選區參選人萬家甫，2日下午在朴子市山通路成立競選總部，由前主席柯文哲與不分區立委王安祥、嘉義市長參選人張啓楷共同揭牌，柯文哲期許萬家甫將2024年總統大選他在此區得到的9800多票能在地扎根。柯文哲以自己2014年當選台北市長的成功經驗，期勉萬家甫勇於挑戰，強調千里之行始於足下，雖然做了不一定會成功，不做一定不會成功。萬家甫提到2024年總統大選他在此選區獲得9800多票，他完全不記得，但萬家甫的任務就是要找出這些票，落實服務，扎根地方，希望支持者將對他的熱情全力支持萬家甫，一起爭取最後成功。請繼續往下閱讀...前立委、嘉義市長參選人張啓楷說，他是東石長大的孩子，藍白合共推嘉義市長參選人，也是嘉義縣市黨部主委，尋找議員參選人過程，好不容易找到萬家甫，理解其理念後，成為嘉義縣首位提名議員人選，萬家甫除了將負責找出民眾黨選票，還要擴展更多票。本身是高雄人的萬家甫，從事職安工程相關事業，4年前因緣際會到朴子學習張天師道法，具道教「中國嗣漢張天師府特派上清五雷大法師」身分，也因而跟著祖師為朴子地區鄉親服務，加上2024總統大選柯文哲在此區獲9894票，都是他這次有信心參選的動力，他提出推動「建設東石鄉到澎湖的跨海大橋」政見，希望促進嘉澎的交通便捷、觀光發展。根據中選會資料，2024總統大選柯文哲在第四選區得票數分別是朴子5200票、東石2345票及六腳2349票。小草與民眾黨前主席柯文哲（右）及嘉義縣議員參選人萬家甫（左）合影。（記者蔡宗勳攝）民眾黨嘉義縣議員選舉第四選區徵召參選人萬家甫競選服務處成立。（記者蔡宗勳攝）    ,https://news.ltn.com.tw/news/politics/breakingnews/5423250
軍購案延宕對藍軍地方選舉不利  張斯綱：蔣萬安應表態,政治,2026/05/02 17:47,台北市長蔣萬安今天說，支持厚植國防。（記者甘孟霖攝）軍購特別條例遲未通過，國民黨內部也仍未有共識。國民黨籍台北市議員張斯綱今天認為，這議題持續發酵會讓年底的地方選舉變得政治化、意識形態化，對國民黨不是好事，呼籲盡快處理；他也說，台北市長蔣萬安對此問題避無可避，必須要有相應的表態。蔣萬安今被問到支持哪個版本的軍購案時表示，支持厚植國防，他也有與台北市國民黨籍立委開放式討論過，重要的是黨團要凝聚共識後決定。請繼續往下閱讀...張斯綱受訪表示，軍購案變成討論的議題，且更牽動「抗中保台」意識形態的對抗，各界關注焦點如果一直在這之上的話，年底的地方選舉就會變得很政治化、意識形態化，這樣是民進黨希望的結果，他認為國民黨應該快點結束此議題，繼續拖下去對國民黨選舉沒有太大幫助，原本地方選舉談城市治理、市政，都討論軍購案的話，就會失焦了，這對國民黨不利。至於蔣萬安是否應該有進一步表態，張斯綱說，六都的縣市首長、候選人一定都會被問到這個問題，這是逃不掉的，尤其蔣萬安或台中市長盧秀燕都是未來競逐總統大位的人選，在這個議題上要有自己的想法，沒辦法閃躲。    ,https://news.ltn.com.tw/news/politics/breakingnews/5423242
3800億+N到底誰在挺？16藍委名單曝 顏擇雅驚：一堆桃竹苗立委,政治,2026/05/02 17:36,"國民黨主席鄭麗文（左）與資深媒體人趙少康。（資料照）國民黨副主席季麟連「建請開除韓國瑜」事件爆發後，國民黨內針對軍購案議題的內鬥持續升級。作家顏擇雅引述媒體報導，指出16名立委與傅崐萁、季麟連站在一起，其中的王鴻薇、馬文君、陳玉珍她並不意外，但最驚訝的是，居然有桃竹苗一大堆區域立委。《上報》日前報導指出，國民黨4月29日召開的黨團大會中，有16名立委支持國民黨主席鄭麗文「3800億+N」方案，名單為吳宗憲、蘇清泉、翁曉玲、林倩綺、王鴻薇、涂權吉、魯明哲、呂玉玲、鄭正鈐、徐欣瑩、邱鎮軍、黃仁、馬文君、游顥、黃建賓和陳玉珍。請繼續往下閱讀...顏擇雅今日在臉書發文表示，目前國民黨親美派、親中派正在大亂鬥，表面上爭軍購案到底應該是「8000億」還是「3800億+N」，然而現在已經演變成，黨中央新聞稿出現「美國走狗」一語，挨轟的資深媒體人趙少康回應出現「中共走狗」一語。顏擇雅表示，她不屬於藍營基層，不能說什麼。但她認為大家都應該要知道支持「3800億+N」的16藍委是誰。「我們知道3800億+N，就是美國無法接受但中共可以接受的軍購案版本，也是傅崐萁與季麟連強力主張的版本。季麟連嗆『開除韓國瑜』，正因為韓國瑜挺的是8000億。」最後，顏擇雅也說，名單中王鴻薇，馬文君，陳玉珍她最不驚訝。「我最驚訝是裡面有桃竹苗一大堆區域立委。」    ",https://news.ltn.com.tw/news/politics/breakingnews/5423198
網傳蔣萬安市府滅鼠殺招「派人堵洞」？林亮君證實是真的,政治,2026/05/02 17:02,今日有網友目擊「災情重地」捷運雙連站出現市府派員用PU發泡劑堵「老鼠洞」。（取自林亮君Threads）台北近日傳出鼠患問題，民眾反映狀況嚴重。今日有網友目擊「重災區」捷運雙連站出現市府派員用PU發泡劑堵「老鼠洞」，消息一出引發批評。對此，台北市議員林亮君表示，經了解後，網友說的確實是真的。林亮君今日在Threads上發文表示，早上有人看到市府到雙連謙和市場，派人用PU發泡劑處理鼠道，「經我瞭解之後，沒錯。」他透露，目前公園處填鼠洞作業分五步驟：塞老鼠藥、用發泡劑堵住、填小截杉木柱（鼠洞比較深才會使用）、塞碎石、填土。請繼續往下閱讀...林亮君也附上現場作業照片，並又再額外發布一段影片表示，就在她現場了解狀況時，剛好又拍到一隻老鼠路過。貼文下方，網友紛紛質疑地留言表示：「跟四邊包繩完全不同，把洞口堵住，他們只會打更多的洞，沒人這樣解決的啦」、「有用嗎？」、「老鼠挖洞是常識吧？堵一個洞不會再挖一個洞嗎？」、「好荒唐」、「四邊包繩老鼠會打洞」。     在 Threads 查看    ,https://news.ltn.com.tw/news/politics/breakingnews/5423175
民眾黨市議員參選人喊「車子被放追蹤器」 四叉貓查出是「防丟器」,政治,2026/05/02 16:40,四叉貓查出民眾黨高市議員參選人發現的追蹤器相關資料，研判是定位器，官方警語內建反追蹤功能。（翻攝四叉貓臉書）民眾黨高市議員參選人莊貽量1日PO圖指出，在自己車上發現追蹤器，人身安全成疑慮，不過網紅四叉貓事後PO文指出，經查詢那應該是iFind全球定位器，官方警語提醒內建反追蹤功能，「不建議用來跟蹤」。四叉貓指出，昨天民眾黨某參選人在車上發現追蹤器，他上網查詢結果，應該是iFind全球定位器，也稱防丟器、寵物定位器，售價大約600元，官方警語提及內建反追蹤功能，不建議用來跟蹤。請繼續往下閱讀...四叉貓引述相關說明，iFind全球定位器內建反追蹤功能，如果把iFind全球定位器藏在某個人的身上或車上超過6小時，那個人又剛好使用iPHONE手機，iFind全球定位器就會主動傳訊息給附近的iPHONE手機，告知那個人可能已被跟蹤，且可由被追蹤者關閉追蹤功能，所以官方販售文宣有加註警語無法拿來跟蹤，正確來說是無法拿來跟蹤使用iPHONE手機的人。四叉貓擷取新聞畫面指出，這次事件的當事人，剛好就是使用iPHONE手機，當事人表示會去報案，希望真相可以早日水落石出。    ,https://news.ltn.com.tw/news/politics/breakingnews/5423172
老鼠藥丟公園寵物恐誤食  蔣萬安回「這句」律師林智群傻眼,政治,2026/05/02 16:29,"蔣萬安今受訪回應鼠患問題。（記者甘孟霖攝）台北市近日傳鼠患疑慮，大量網友在Threads上傳老鼠四處出沒影片。有民眾發現北市府直接將老鼠藥丟在公園，市議員林亮君質疑，會造成寵物、小朋友誤食問題。台北市長蔣萬安今日被問及相關問題，竟回應：「目前都是依照中央核可的環境用藥。」有媒體今日訪問蔣萬安時指出，立委沈伯洋說，使用國際上常用影響老鼠繁殖賀爾蒙的藥物比投藥還有用，詢問蔣的回應。蔣萬安表示，目前就是使用中央核可的環境用藥，包括沈的建議在內，每個選項在會議中都有討論到，一切尊重專家學者的意見、評估。請繼續往下閱讀...又有媒體問，議員有質疑，投藥可能會出現「誤食」狀況，蔣萬安卻再次表示：「目前都是依照中央核可的環境用藥。」對此，律師林智群今日在臉書發文表示，一個人頭腦好不好，看他回應有沒有抓到重點就知道。他指出，心臟病/癌症的藥也是中央核准的，但你把心臟病/癌症的藥放在小孩可以拿到的地方，讓小孩誤食了，就是大人的問題。他質疑：「合法的藥放在不對的地方，會因為藥是合法的，就變成沒問題嗎？」    ",https://news.ltn.com.tw/news/politics/breakingnews/5423133
盧送高虹安苦瓜讚政績 民代、里長酸3年前高喊遷建果菜市場只聞樓梯響,政治,2026/05/02 16:25,立委高虹安（右一）參訪台中建國市場，市長盧秀燕（右二）親自解說。（資料照）台中市長盧秀燕昨天到新竹市參觀南寮漁港新完成的直銷中心，除送給市長高虹安苦瓜、苦茶油，還讚高虹安政績，不過卻遭綠營民代打臉，南寮漁港的改變與直銷中心都是前市長林智堅任內改造及啟動的工程，反觀高虹安3年前到台中參觀果菜市場，作為竹市果菜市場遷建參考，但水源里長曾翰揚發文批，3年多過去了，果菜批發市場遷建案仍紙上談兵，只聞樓梯響，連地點都未確定，苦的是市場的攤商與市民。曾翰揚提到， 3年前高虹安去台中參觀果菜市場，然後說要推動竹市果菜市場遷建計畫，如今3年多過去了，果菜市場遷建案仍只是形式上辦共識凝聚說明會，連遷建地點都未確定，甚至還要等都市計畫變更，對攤商和市民來說，市府仍只停留在簡報階段，與實際使用需求間，還有一大段距離。蔬果公會幹部認為，如果未來只是換一個地方，卻無法改善腹地不足、動線混亂、交通壅塞等長期問題，那遷建的效益勢必會打折。請繼續往下閱讀...他認為市府所提的簡報規劃，除有都市計畫變更，基地面積與形狀是否影響使用效率？是否緊鄰主要幹道？整體動線與交通承載能力是否充足等？都關係到未來市場能否順利運作。但攤商得不到市府具體的回應，讓攤商留下更多疑問。也認為這樣的共識說明會仍只是紙上談兵。    ,https://news.ltn.com.tw/news/politics/breakingnews/5423107
攤商之子市場送康乃馨  賴瑞隆：祝生意興隆、母親節快樂,政治,2026/05/02 16:22,賴瑞隆今偕同民進黨左楠區議員、議員參選人、里長參選人，一起到黃昏市場送康乃馨。（記者王榮祥攝）民進黨高雄市長參選人賴瑞隆，今偕同左楠區4位民進黨議員與參選人、里長參選人們，一起到自由黃昏市場分送3千朵康乃馨，他介紹自己是攤商之子，除提前祝福媽媽們母親節快樂，也要祝福市場攤商生意興「隆」。賴瑞隆今與民進黨左楠區現任議員李雅慧、黃文志，議員參選人尹立與張以理，首度大合體掃街，連同多位民進黨里長參選人，一同在左營人氣指標自由黃昏市場分送康乃馨。請繼續往下閱讀...他表示，自己也是攤商之子，了解攤商的辛苦，來市場除了祝福全天下媽媽母親節快樂，也要祝福辛苦的攤商生意興隆、業績長紅。賴瑞隆特別提到左營楠梓這幾年進步很快，堪稱大高雄指標區，他希望爭取市民支持他與所有民進黨籍議員、議員參選人跟里長參選人都能當選，一起延續這份繁榮。部分攤商第一次近距離見到賴瑞隆，覺得他蠻「福氣、親切」，也有民眾當場表態支持，賴瑞隆感謝之餘，也沒忘記介紹身邊的議員參選人們，希望民眾一起支持。賴瑞隆送康乃馨祝福攤商。（記者王榮祥攝）賴瑞隆送花祝福攤商母親節快樂。（記者王榮祥攝）    ,https://news.ltn.com.tw/news/politics/breakingnews/5423154
為母方知不易 蘇巧慧分享「早產兒家庭照顧津貼」政見緣由,政治,2026/05/02 16:16,蘇巧慧出席蘆洲母親節活動，席間感性分享育兒往事，並向母親們致謝。（記者黃子暘攝）勞動節連假期間，民進黨立委、新北市長參選人蘇巧慧今（2）日持續勤跑陸戰，先後出席新莊保元宮建宮250週年首醮醮慶「保元大囍開鑼」開幕、蘆洲母親節「挺Women的歌」歌唱活動。蘇巧慧指出，新莊是先民早期移居的城市，盼有機會與眾人一起努力發揚新莊豐富人文。母親節在即，她也感性表示，身為人母方知為母不易，她的孩子是早產兒，深知早產兒照護的艱辛，因此提出早產兒家庭照顧津貼政見，希望幫助更多家庭。蘇巧慧在新莊保元宮指出，過去人們說「一府二鹿三新莊」，正是說明新莊發展早，也累積豐厚的文化底蘊，更形成新莊獨有的「廟街」商圈，感謝保元宮主任委員徐勝男、醮務局主任委員蔣根煌帶領保元宮不斷與時俱進，利用新觀念發揚傳統文化，盼未來有機會和眾人一起努力帶動新莊地方發展，讓更多人看見新莊人文風華；她也強調，保元宮是當地重要的信仰中心、文化資產，非常感謝保元宮長期投入社會公益，是關懷社會的重要力量。請繼續往下閱讀...蘇巧慧後續趕往蘆洲參加母親節活動，向母親們致謝並表示，「母親」這個角色相當不容易，她的孩子出生時不到1000公克，因此深知孩子長住保溫箱時，媽媽們的心情與經濟負擔，故而在六大福利政見中提出早產兒家庭照顧津貼，希望幫助更多家庭。蘇巧慧表示，民進黨婦女發展委員會已有30年歷史，30年前，台灣民主才剛萌芽，這有賴當時的年輕男女站出來為台灣民主發聲，才有如今民選總統、言論自由、青年爭取擔任民代的民主自由氛圍，以及多元族群在台灣這塊土地上一起生活，盼台灣民主自由可以持續傳承，也盼大眾給予民進黨新北隊機會，讓新世代用新觀念、新技術解決新北的既存問題，讓新北成為色彩最豐富的城市。新北市黨部婦展會長、市議員彭佳芸也出席蘆洲歌唱活動，市議員顏蔚慈、李倩萍、山田摩衣、石一佑、蘇錦雄，以及議員參選人戴翎育、羅文崇、陳俊諺、陳俊維、李昆穎都共襄盛舉，台日混血的山田摩衣更以和風美人扮相現身登台獻唱，氣氛歡樂。蘇巧慧出席蘆洲母親節活動，席間感性分享育兒往事，並向母親們致謝。（記者黃子暘攝）蘇巧慧出席新莊保元宮建宮250週年首醮醮慶「保元大囍開鑼」開幕，喊話希望有機會與眾人發揚新莊人文風華。（蘇巧慧辦公室提供）蘇巧慧出席新莊保元宮建宮250週年首醮醮慶「保元大囍開鑼」開幕，喊話希望有機會與眾人發揚新莊人文風華。（蘇巧慧辦公室提供）台日混血的新北市議員山田摩衣也以和風美人扮相登台獻唱，慶祝母親節。（記者黃子暘攝）    ,https://news.ltn.com.tw/news/politics/breakingnews/5423141
藍營「這些大咖」挺軍購逾8千億以上版本 黃暐瀚：國民黨考紀會這陣子會很忙,政治,2026/05/02 16:16,國民黨籍新北市長侯友宜（左一）、台中市長盧秀燕、前主席朱立倫（中）、立法院長韓國瑜、台北市長蔣萬安（右一）。（資料照）國民黨內部就軍購預算分岐持續擴大，在黨主席鄭麗文與黨團總召傅崐萁力守3800億版本之際，韓國瑜、盧秀燕、蔣萬安、侯友宜、朱立倫及趙少康等重量級人物，紛紛表態力挺8000億以上版本軍購。對此，資深媒體人黃暐瀚直言，國民黨考紀會這陣子可能會很忙。黃暐瀚今天在臉書發文表示，現在跑出來支持軍購8000億以上版本的國民黨員越來越多了，包括韓國瑜、盧秀燕、蔣萬安、朱立倫、侯友宜、趙少康，還有一堆立委，他諷刺地說：「國民黨考紀會這陣子可能會很忙」。請繼續往下閱讀...新北市長侯友宜近日受訪時強調，國防預算「該過就要過」，並重申他兩年前就主張國防預算不應低於GDP的3%，這項標準與行政院提出的1.25兆版本相去不遠；台北市長蔣萬安則表示，他支持厚植國防實力，並已與台北市黨籍立委交換意見，相信黨團會做出最終決定；台中市長盧秀燕日前結束美國參訪後，便表態屬意8000億軍購版本；今天面對媒體提問，僅簡單以5個字「家和萬事興」為近期黨內紛爭下註解。針對副主席季麟連揚言開除支持8000億版本的韓國瑜，「戰鬥藍」領袖趙少康則火力全開，反嗆黨中央互扣「走狗」帽子的行為毫無意義，更質疑若支持高額預算是賣黨求榮、美國的走狗，「那主張3800億的可不可以說是中共走狗？」。    ,https://news.ltn.com.tw/news/politics/breakingnews/5423105
擔任「大母雞」拉抬綠營北台選情？蘇巧慧：新北隊最有創意、活力,政治,2026/05/02 16:01,民進黨立委、新北市長參選人蘇巧慧出席蘆洲區母親節歌唱活動，席間受訪。（記者黃子暘攝）民進黨立委、新北市長參選人蘇巧慧出席蘆洲區母親節歌唱活動，席間受訪。外傳民進黨北台灣縣市首長選舉，可能由蘇巧慧擔任「大母雞」拉抬整體選情，並提出跨區域的北台灣政策，蘇巧慧被問及此事時回應，民進黨新北隊非常團結，相信是最有創意、活力的，民進黨新北隊會再次證明，2026年選戰中，民進黨的參選人就是能帶給新北最快進步、最豐富未來的團隊，他們正在為此努力。蘇巧慧指出，連假期間，她也馬不停蹄在新北走透透，前往汐止、鶯歌、新莊、蘆洲區，很感謝市議員參選人，不管她到哪，都非常團結一致，各區新北隊員合體，就是最有活力、創意的新北隊。請繼續往下閱讀...此外，蘇巧慧競選團隊日前公布競選架構，包括立委吳秉叡、張宏陸、林楚茵、前立委羅致政都入列，遭國民黨批評是前台北縣長蘇貞昌「蘇系老臣」、質疑是政治世襲。蘇巧慧對此回應，選舉期間，希望焦點與討論議題盡量以政見為主，希望焦點回歸到誰的政見能帶給新北較多進步。    ,https://news.ltn.com.tw/news/politics/breakingnews/5423086
遇到老鼠大如貓 胡采蘋酸爆：集資去德國請花衣吹笛手,政治,2026/05/02 15:49,台北市長蔣萬安。（資料照）台北市近來鼠患問題嚴重，遭戲稱為「安鼠之亂」。對此，財經網紅胡采蘋酸度滿點表示，指望台北市長蔣萬安是沒路用的，「我想大家還是湊一筆錢，去德國找一下有沒有一個穿花衣服正在吹笛子的吹笛手」。胡采蘋今日於「Emmy追劇時間」臉書粉專發文指出，「現在一大堆台北市民在講自己家的老鼠問題，醫生朋友說他們醫院都是老鼠，貴婦說仁愛路豪宅本週竟然抓到2隻大老鼠」。其實她前天晚上開車回家，也遇到一隻超大鼠橫穿馬路，size大到第一時間以為是貓，嚇得緊急煞車。請繼續往下閱讀...胡采蘋指出，她會領養貓咪，原因之一是自家慘遭老鼠入侵，廚房的油蔥酥與炸豆皮被咬破包裝，後來把一切吃的東西裝到冰箱，或用鐵盒子裝起來，糖果零食放在戶外後背包裡面收好，老鼠竟還咬破後背包，北海道薯條三兄弟被吃掉一半。神奇的是，自從黑貓「之之」進家門後，即便當時只是幼貓，老鼠便再也沒出現過，推測是「貓味」成功震懾八方來鼠。胡采蘋自我揶揄地說，「台北市的鼠患真的非常嚴重，而且已經持續好幾年了，謝天謝地大家都說出了自家災情，否則我還以為我們家風水出了什麼問題，怎麼會有老鼠竊佔薯條三兄弟這種逆倫事件、倒反天罡。」許多網友也紛紛留言，有人說「如果你晚上去永康公園，買了一個蔥抓餅和奶茶坐在長椅上，餅咬了兩口放旁邊，拿起奶茶打算插吸管，有機會老鼠上來要分享抓餅。經驗談」、「多年前辦公室鼠患，吃的東西都收在鐵盒，老鼠吃肥皂，益生菌。有一次一早上班，工程師說他昨晚加班時，聽到老鼠在我桌子下的鐵櫃裏面，啃咖啡豆！啊～瘋掉。忘記講，老鼠沒東西吃，生氣咬斷網路線」、「看來生活在台北的人只能養貓了」。胡采蘋今日於「Emmy追劇時間」臉書粉專發文透露，會領養貓咪，原因之一是自家慘遭老鼠入侵。圖為貓咪「之之」。（圖擷取自「Emmy追劇時間」臉書粉專）    ,https://news.ltn.com.tw/news/politics/breakingnews/5423030
李四川談輝達成績、TPASS加價搭高鐵 蘇巧慧這麼看,政治,2026/05/02 15:33,民進黨立委、新北市長參選人蘇巧慧今（2）日在蘆洲行程中受訪。（記者黃子暘攝）新北市長選舉持續升溫，國民黨新北市長參選人李四川陸續提及TPASS通勤月票加價搭高鐵、科技大廠「輝達」落腳台北等議題，引發討論。民進黨立委、新北市長參選人蘇巧慧今（2）日在蘆洲行程中受訪，被問及此事時回應，各運具都各有其功能，TPASS相關政見對手似乎還在討論中，就留待對手公布細節，各參選人都有不同的爭取支持策略，把過往成績拿出來談敘述，這是應該的，她都尊重。提及過往成績，蘇巧慧指出，她就是過去10年完全在新北茁壯成長、與大家一起努力解決新北的種種問題，其中不乏累積20、30的老問題，民進黨新北隊是用創新觀念、技術來解決，這是他們未來的方向。請繼續往下閱讀...至於交通部分，蘇巧慧說，不論交通幹道、運具載具，未來她會提出更多政見告訴大眾，民進黨新北隊真的能為人民爭取更好生活、為產業帶來更好發展。    ,https://news.ltn.com.tw/news/politics/breakingnews/5423099
