Title,News_Type,date,content,url
民進黨新北市議員卓冠廷服務處被搜索 前助理涉違個資法6萬交保,政治,2026/05/04 11:52,新北市議員卓冠廷。（資料照）首次上稿：11:01更新時間：11:52（內文更新）民進黨新北市議員卓冠廷服務處傳出遭檢調搜索。據悉，檢調單位上月29日前往其服務處等處所執行搜索，並約談相關人員到案說明，其中卓冠廷一名黃姓前助理訊後依違反個資法以6萬元交保，詳細案情仍待進一步釐清。請繼續往下閱讀...新北地檢察署指揮警方針對黃姓女子等3人進行拘提，並同步前往黃女曾任職處所執行搜索取證，當場查扣涉案手機4支及桌上型電腦主機1台等相關證物。據指出，黃女等人疑涉違反個人資料保護法第41條，涉及違反同法第20條「非公務機關非法利用個人資料」規定，另亦涉犯刑法第310條加重誹謗罪嫌，全案已移送法辦，後續將由檢方持續釐清相關犯行及責任歸屬。據了解，本案疑與新北市議員廖宜琨服務團隊於今年1月遭AI變造圖片抹黑一案有關；當時廖宜琨團隊已向警方備案並正式提告，目前相關單位尚未針對案情細節作進一步說明。服務處被檢調搜索！疑與初選競爭有關 卓冠廷：全力配合司法調查    ,https://news.ltn.com.tw/news/politics/breakingnews/5424553
吳宗憲出線選宜蘭縣長張勝德稱「祝福、保持中立」傳他曾對支持者這樣說,政治,2026/05/04 11:50,宜蘭縣長選舉，吳宗憲（左）代表在藍白出線，張勝德（右）表示：「祝福。」但他曾說，縣長選舉保持中立。（資料照）宜蘭縣長選舉，國民黨不分區立委吳宗憲在藍白合民調出線；曾與吳進行黨內民調落敗的議長勝德表示：「祝福。」就不願多談；但據了解，張曾在日前的總工會表揚活動稱，縣長選舉他保持中立，你們喜歡誰就支持誰。張勝德今天在議會面對媒體訪問，不願對該談話再多作詮釋，希望媒體不要再談到他的部分。國民黨初選後，民調一直未公開，坊間傳言紛紛，質疑吳宗憲是國民黨文傳會主委，參加地方初選竟不用辭職，掌握黨機器的運作與決策，初選怎麼會公平？黨中央還傳出人選3條件說，第一要能勝選、第二要能夠藍白合的人、第三要能夠在選戰中抵擋得住民進黨司法攻擊的人選；而且盛傳陳琬惠只願與吳宗憲藍白合，不願與張勝德合，擺明就屬意吳宗憲，張勝德怎麼會贏？請繼續往下閱讀...國民黨許多議員也難以置信，礙於黨紀敢怒不敢言；有人擔憂，提名吳宗憲，他們當然也是支持，但能不能動起來就很難說？但就目前情勢發展，藍營基層陷於分裂危機，挺張的樁腳、部分議員、社團幹部紛紛跳船，轉而支持民進黨林國漳，這部分情有擴大趨勢。張勝德的態度當然很重要，初選後，他曾說，現在的目標就是先選上議員，議員是門票，沒有選上講什麼都是多餘的，要不要選議長順其自然，現在的工作就是繼續服務，繼續做好議員與議長工作；對於今天吳宗憲代表藍白出線，張勝德僅說：「祝福。」但據了解，張勝德在4月30日的宜縣總工會模範勞工表揚活動說，這次縣長選舉他保持中立，你們喜歡誰就支持誰；張勝德今未否認，但不願再多作說明。    ,https://news.ltn.com.tw/news/politics/breakingnews/5424647
質疑雙北處理鼠患態度消極 張志豪批侯友宜、蔣萬安成「放爛兄弟」,政治,2026/05/04 11:44,新北市議員參選人張志豪指雙北市府處理鼠患態度消極，批侯友宜、蔣萬安成「放爛兄弟」。（摘自張志豪臉書）國內今年已出現兩例漢他病毒症候群病例，且包含死亡個案，疫情警訊明確，為此衛福部長石崇良公開呼籲雙北市府應比照南部登革熱防疫經驗，設專案小組處理鼠患，新北市議員參選人張志豪4日表示，中央已明確提具體建議，雙北市府卻以「已有跨局處機制」為由，拒絕成立專案小組，顯然對公共衛生危機態度消極，形同對疫情風險視而不見，侯友宜與蔣萬安已成「放爛兄弟檔」，完全無視市民健康與生活品質，令人遺憾。新北市長侯友宜上午出席三鶯線三峽站出入口1捷運開發案開工祈福典禮時，面對媒體表示，按照傳染病防治法，已責成衛生局、民政局、環保局全力按照中央的三個指示「不讓鼠住、鼠來、鼠吃」，針對地下水道或防火巷，還有周遭環境全力落實到位清理，希望大家一起合作讓鼠患不再。請繼續往下閱讀...張志豪指出，雙北鼠患問題持續擴大已是不爭的事實，近期鼠患頻繁出現在市場、巷弄甚至住宅區，根據民眾拍攝的影片和照片，連中和區也有鼠患災情，網友甚至製作「鼠患災情地圖」，顯示問題已從零星事件演變為系統性危機。令人憂心的是，鼠患具有擴散性，台北若未有效控制，恐已蔓延至新北，但市府至今仍未提出雙北聯防機制，長年以來的「雙北論壇」根本淪空談卻不做事張志豪痛批，「當人民用地圖呈現危機，市府卻選擇粉飾太平，這樣的治理態度實在荒謬。」他強調，鼠患防治不應等疫情升溫才行動，否則恐錯失防堵擴散的關鍵時機。最後他呼籲，雙北市府應立即啟動專案層級防治機制，全面盤點熱區、強化環境整頓，由市長親自公開說明處置進度，以具體作為回應市民期待，守住城市公共衛生底線，切勿繼續放爛。    ,https://news.ltn.com.tw/news/politics/breakingnews/5424641
批鄭麗文配合中國羞辱台灣 黃帝穎：舔中內鬼已徹底現形,政治,2026/05/04 11:37,鄭麗文今表示，賴政府大費周章的結果，換來的是「讓國際看笑話」。黃帝穎對此批評，鄭麗文配合中國羞辱台灣，「舔中內鬼」已經徹底現形。（資料照）總統賴清德2日突破中國封鎖，順利出訪友邦史瓦帝尼，國民黨主席鄭麗文今（4日）對此表示，賴政府大費周章的結果，換來的是「讓國際看笑話」。律師黃帝穎對此批評，鄭麗文配合中國羞辱台灣，「舔中內鬼」已經徹底現形。黃帝穎表示，賴清德突破中國封鎖訪問史瓦帝尼，中國外交部與國台辦氣憤跳腳不斷謾罵，而鄭麗文今日也和中國口徑一致，罵賴清德外交突圍是「讓國際看笑話」。請繼續往下閱讀...黃帝穎昨（3日）就已發文預判，賴清德外交突圍將如同一面「照妖鏡」，逼出「舔中內鬼」現形，而今日鄭麗文馬上配合中國辱罵台灣，黃帝穎說，賴清德外交突圍真的如同照妖鏡逼出「舔中內鬼」。黃帝穎強調，台灣外交受到中國蠻橫壓迫，以干預他國航權、影響飛安的方式來阻止賴清德出訪，鄭麗文為加害者中國找藉口「一中」，然後譴責被害者台灣，並持續配合中國羞辱台灣。最後黃也痛批：「舔中內鬼『鄭麗文之流』擺明胳臂向外彎，簡直民主之恥！」    ,https://news.ltn.com.tw/news/politics/breakingnews/5424614
季麟連嗆開除韓國瑜「已翻篇」 鄭麗文：一句話就受傷？韓這麼脆弱？,政治,2026/05/04 11:36,國民黨主席鄭麗文表示，季麟連嗆開除韓國瑜黨籍一事已經過去。（資料照）國民黨因軍購預算版本爆內鬨，副主席季麟連日前在中常會上公開指控立法院長韓國瑜「賣黨求榮」，要求開除黨籍，為此，前中廣董事長趙少康喊話黨主席鄭麗文應對季做出處置，並確認有無「影武者」。鄭麗文今（4）日表示，這件事已經過去了，「這麼一句話就有傷口了？韓院長有這麼脆弱嗎？」鄭麗文在廣播節目《千秋萬事》被主持人問到「處理」季麟連以及其情緒發言造成的「傷口」，鄭麗文回說，自己已經處理過了，她稱當天已經打電話給韓國瑜，強調「沒有傷口啦，這麼一點點，這麼一句話就有傷口了，國民黨有這麼脆弱嗎？韓院長有這麼脆弱嗎？這件事情已經翻篇、當然已經過去了。」請繼續往下閱讀...鄭麗文還稱，有人故意、不斷要在這上面做文章，要把這件事擴大，「讓人覺得非常奇怪。」她續指，季麟連說他跟韓國瑜幾十年的兄弟，他們倆兄弟的事情會自己解決。另外，鄭麗文也強調，季麟連於中常會上脫序、衝動談話，讓大家都非常傻眼，「中央黨部沒有任何人知道」，「沒有什麼陰謀論，不需要在這邊擴大」。她解釋，自己「後來聽說，季（中常會前）有事先跟媒體講說他有要講話，但事實上，我們真的不曉得，所以，當時季有這樣一個過於衝動，過激的發言，實屬意外。」鄭麗文並補充，自己在第一時間就說季麟連「情感太過豐沛」，這樣的談話太過衝動，其實，季麟連當時講話並未咬定韓國瑜；不希望大家繼續在這上面做文章，做不必要的發酵和擴大解釋。    ,https://news.ltn.com.tw/news/politics/breakingnews/5424495
宜蘭縣長選舉對決！吳宗憲贏藍白合 民進黨林國漳回應了,政治,2026/05/04 11:36,民進黨宜蘭縣長參選人林國漳，將以不分黨派的全民縣長當訴求爭取支持。（記者江志雄攝）宜蘭縣長選舉藍白合民調結果出爐，由國民黨吳宗憲勝出。民進黨宜蘭縣長參選人林國漳今天（4日）回應，恭喜吳宗憲出線，期盼雙方作君子之爭，他將以不分黨派的全民縣長當競選訴求，爭取選民支持。林國漳表示，任何黨派推人參選宜蘭縣長，他都表示尊重，不過，最終仍須接受選民檢驗，選民會依據候選人的政策、人格特質、對宜蘭土地熟悉度、認同感做出選擇。請繼續往下閱讀...媒體詢問林國漳，這份藍白合民調數據，與三月份美麗島電子報民調結果相較，他與跟宗憲差距有縮小。林國漳表示，民調可供參考，並轉化為前進的力量，藍白合民調未表態比率較高，他會鎖定未表態族群開拓票源。林國漳強調，不管對手是誰，他以不分黨派的全民縣長為訴求，透過政策與在地深耕經營，贏得大多數選民支持。    ,https://news.ltn.com.tw/news/politics/breakingnews/5424620
宜縣長初選落馬再遭李貞秀疑「月領20萬」 陳琬惠酸她「數學不好」,政治,2026/05/04 11:35,「藍白合」宜蘭縣長初選民調今出爐，國民黨參選人吳宗憲勝過民眾黨參選人陳琬惠，代表在野征戰東部關鍵版圖。（記者王藝菘攝）國民黨、民眾黨九合一選舉「藍白合」持續推動，繼日前拍板新北市長人選後，今再宣布宜蘭縣長初選由吳宗憲勝出，陳琬惠除恭喜對手，更稱他是藍白最強「隊長」，接下來還是隊友，一同守住宜蘭。不過，前中配立委李貞秀隨即發文質疑她「月領20萬」的傳聞，但陳回酸李「數學不好」，相信民眾黨會給予支持。國、眾兩黨今年3月展開政黨合作協議、4月啟動「藍白合」地方首長初選民調，繼嘉義市、新北市後，今（4）日接續公布宜蘭縣長民調結果，確定由國民黨參選人吳宗憲勝出，代表在野陣營征戰東部關鍵版圖。對於民調結果，陳琬惠除肯定吳的「即戰力」，更稱他就是藍白合宜蘭隊的「最強大隊長」，接下來會繼續以隊友身份，一同全力守住宜蘭。請繼續往下閱讀...然而，網紅「四叉貓」上月14日在個人臉書粉專揭露，民眾黨陳琬惠卸任立委後，柯文哲每個月用20萬養著她，總統大選結束後，柯文哲依然使用他的政治獻金專戶養人，強調「民眾黨立委卸任後的薪資價碼是每月20萬元」。而稍早國、眾兩黨宣布宜蘭縣長初選民調結果後，民眾黨前不分區立委中配李貞秀再於個人臉書發文指稱，「國昌骨牌繼續倒：陳婉惠還月領20萬？」引發討論。針對李貞秀對她質疑、更稱是黨主席黃國昌無緣征戰新北後的「骨牌效應」，陳琬惠無奈稱，大家應該再次確認消息本身內容，還酸李「數學不好」，沒有什麼好評論的，強調她相信民眾黨、宜蘭縣民，接下來會再努力。民眾黨參選人陳琬惠離開記者會場前回應李貞秀質疑。（記者陳治程攝）    ,https://news.ltn.com.tw/news/politics/breakingnews/5424619
吳宗憲：國民黨版「3800億+N」與8000億版本質一樣 沒討論誰支持哪個版本,政治,2026/05/04 11:33,國民黨立委吳宗憲。（記者王藝菘攝）國民黨內對軍購案金額意見分歧，國民黨主席鄭麗文今日表示，黨團多數是堅持黨版的「3800億元+N」，從來沒有動搖過，要改成8千億的從來都是少數意見。國民黨立委吳宗憲今日表示，黨版與8千億的本質一模一樣，+N就是8千億與3800億的差距，只是說要不要等美國發價書出來再編的問題，兩者的不同在於發價書要先匡給他，或發價書來再給他，就差在這裡而已。黨團當天的討論也沒有說誰支持哪個版本，「所以不要再扣我們誰支持什麼版本，那是非常荒謬的言論」。吳宗憲說，今天會混亂就是有心人士在造謠興風作亂，台灣關係法是美國的國內法，不是與台灣簽的條約，美方要出售任何武器給台灣，必須經過總統、國會的同意，才會有發價書出來，也就是說台灣向美國購買武器，不是像我們去超商一樣，有生產、有付錢就能拿到，這就是為什麼會有差距出來。請繼續往下閱讀...吳宗憲指出，有3800億是因為美方的發價書已經出來，+N是大家聽說之後整體大約會到8千億上下，+N的意思是美方發價書一來就馬上補上去，所以本質上是一樣的東西。至於支持哪個版本，吳宗憲表示，當天黨團大會沒有討論出結論，並沒有支持哪一個，今天被妖魔化、一刀切，支持什麼就是擋軍購，不支持什麼是愛國，不可以愚民到這樣，絕對不是花越多錢就叫越愛國，要買台灣最適合用的、要買會交貨的，他絕對百分之百支持國防，因為一家老小都在台灣這塊土地上，沒有雙重國籍也沒有綠卡，他們希望台灣更好，但是很奇怪的是有人會去妖魔化很多事情。他強調，絕對不是把所有台灣的預算都去買武器才叫愛台，真的要去思考適不適合我們、以及會不會交貨，就像他有小孩，買休旅車一定比買法拉利更適合家庭使用。因為預算彼此會有排擠的問題，這邊發掉一塊錢，那邊民生就少一塊錢，所有人都是用愛國的角度在思考每一件事情，但是最糟糕的是有一些政客去做政治攻擊。吳宗憲指出，國防採購是一個專業且不容易理解的事情，卻去一刀切的說不支持1.25兆就是不愛國，這是一個很悲哀的事，他在當檢察官時常有一個很感慨的事，在台灣要騙一個人很簡單，但是要告訴他你被騙了，真的不容易，直到最後一刻損失慘重才相信。吳宗憲表示，國民黨的每一位立委都絕對支持要有充足的國防來防禦一切要侵犯我們的人，我們就活在這塊土地上，在軍事採購上要買台灣適合的武器，要去思考我們的國防戰略是什麼，基於這個大的國防戰略之下，我們需要什麼武器、如何採購，以及是否會因為補給中東或別的地區，而無法交貨，可能現在下訂，15年後才拿得到，各種情況都需要考量。對於8千億與政院版1.25兆仍有差距，吳宗憲說，很多人罵他們說，這就是一些國內的採購等，為什麼不支持。他百分之百支持商購以及對於國內的軍事採購，但是這部分要像以前一樣回歸年度的常規預算，讓大家加大審查的力道，這樣才不會變成馬桶店買炸藥、小吃店買快篩等問題，「我們是為了人民把守荷包，我不是在阻礙國防，但是卻被有心人說我們在阻礙國防，這是我很傷心的地方。」    ,https://news.ltn.com.tw/news/politics/breakingnews/5424607
國民黨彰化縣長提名 李乾龍預告：本週應該會有好消息,政治,2026/05/04 11:31,國民黨副主席兼秘書長李乾龍。（資料照）國民黨彰化縣長提名人選持續卡關，國民黨副主席兼秘書長李乾龍今日表示，這禮拜應該會有好消息跟大家報告。國民黨爭取彰化提名的參選人除了謝衣鳯，還包括前立委柯呈枋、前彰化副縣長洪榮章、前國民黨考紀會主委魏平政，另傳出彰化縣長王惠美極力推薦新北市副市長劉和然，但劉表達沒有選彰化縣長的選項。請繼續往下閱讀...在多人競逐下，原本4月7日鄭麗文出訪中國之前，擬徵召前中常委、現任彰化縣黨部主委蕭景田力薦的魏平政，外傳因王惠美有不同聲音，鄭麗文希望取得共識而喊停，紛擾至今仍無法拍板。    ,https://news.ltn.com.tw/news/politics/breakingnews/5424618
拚苗栗市艱困選區 林月琴：義不容辭,政治,2026/05/04 11:30,民進黨立委林月琴。（資料照）行政院長卓榮泰昨出席牙醫活動時透露，民進黨立委林月琴已被徵召參選苗栗市長。林月琴今在立院受訪時說，苗栗是一個艱困選區，越艱困越需要有人能夠進駐，「我是苗栗女兒，若鄉親需要我的專業，我當然義不容辭。」林月琴指出，感謝卓榮泰對她的肯定，苗栗是一個艱困選區，不好選，她與黨內苗栗縣長參選人陳品安都很願意去承擔，越艱困越需要有人能夠進駐，「我是苗栗女兒，若鄉親需要我的專業，我當然義不容辭。」苗栗市長輩比較多，她的社福專業像長照等，可以來幫助苗栗市發展。請繼續往下閱讀...此外，她也透露，過年前賴總統就已有徵詢她的意見，苗栗幾乎沒有改變，若能夠回去她從小長大的苗栗市，她很期待能夠做到改變，看到新氣象。    ,https://news.ltn.com.tw/news/politics/breakingnews/5424615
宜蘭縣長藍白合民調國民黨吳宗憲勝出 政壇人士：「藍藍合」才是挑戰,政治,2026/05/04 11:19,宜蘭縣長選舉，國民黨不分區立委吳宗憲（右二）在藍白合民調中勝出。（記者王藝菘攝）宜蘭縣長選舉，國民黨不分區立委吳宗憲在藍白合民調出線；政壇人士分析，對於未來選戰，吳宗憲面對的挑戰很多，黨內的「藍藍合」遠比「藍白合」困難。吳空降宜蘭參選，沒有陸戰組織，議長張勝德在黨內民調跌破眼鏡輸給吳宗憲，「被做掉」的傳言迄今仍甚囂塵上，挺張樁腳紛紛跳船支持綠營對手，如何整合黨內「藍藍」勢力才是吳宗憲最大考驗。藍白民調前，陳琬惠大動作將整個民眾黨拉到宜蘭造勢，柯文哲接連進駐宜蘭4天，整個立院黨團、黨公職幹部都到宜蘭陪陳琬惠掃街造勢，連打多日空戰，態度相當積極。但事實證明，柯文哲到處被嗆貪污犯，還要「他不要亂了」，個人魅力不再，難引領風騷；再加上民眾黨在宜蘭無基層經營實力，在藍綠基本盤的宜蘭，無法撼動局勢，輸給吳宗憲實屬必然。請繼續往下閱讀...吳宗憲在藍白合民調中勝出，其中在與民進黨參選人林國漳的對比民調，仍輸給林國漳；未來的選戰，吳宗憲的挑戰很多，包括他不是宜蘭人，空降宜蘭參選，宜蘭人接受度仍待觀察，但這勢必是選戰過程操作的議題，如何說服宜蘭人，是他努力的目標。吳宗憲的最大考驗，其實是整合「藍藍」的問題，在國民黨內與議長張勝德民調前，就盛傳國民黨中央屬意吳宗憲，還提出3條件說，第一要能勝選、第二要能夠藍白合的人、第三要能夠在選戰中抵擋得住民進黨司法攻擊的人選；而且盛傳陳琬惠只願與吳宗憲藍白合，不願與張勝德合。擁有雄厚與基層陸戰組織的張勝德在黨內民調意外出局竟輸給吳宗憲，引起挺張椿腳、部分議員、社團幹部的不滿，近期都紛紛轉向支持林國漳。空降宜蘭，缺乏基層組織與陸戰能力的吳宗憲，若未能順利整合「藍藍」，這場戰勢必打得相當艱辛。    ,https://news.ltn.com.tw/news/politics/breakingnews/5424569
賴清德總統出訪史瓦帝尼  盧秀燕只說了一句話回應,政治,2026/05/04 11:18,台中市長盧秀燕祝福賴清德總統出訪邦交國史瓦帝尼順利。（記者歐素美攝）總統賴清德搭乘史國專機，突破中共封鎖，順利抵達出訪邦交國史瓦帝尼，台中市長盧秀燕對此表示，祝總統出訪勝利。台中市長盧秀燕今天出席外埔親子館開幕典禮，接受聯訪時，媒體詢問其對賴清德總統出訪史瓦帝尼的看法， 盧秀燕只有一句話回應，就是「祝總統出訪順利」。請繼續往下閱讀...    ,https://news.ltn.com.tw/news/politics/breakingnews/5424594
謝國樑談基隆捷運 童子瑋：基市府三大能力不足 捷運恐跳票,政治,2026/05/04 11:16,針對基隆市長謝國樑談基隆捷運可行性評估，今年底出爐；基隆議長童子瑋批評，基隆市政府三大能力不足，基隆捷運恐跳票。（童子瑋提供）針對今日（4日）有平面媒體刊登基隆市長謝國樑專訪，文中提及基隆捷運二階段議題，基隆市議長童子瑋回應，基隆市政府三大能力不足，基隆捷運支票恐跳票。童子瑋強調，基隆捷運的可行性評估已經做過不只一次，唯有完整的方案跟說明才是市民的期待，但目前基隆市府的規劃能力、財政能力跟執行力都不足，基隆市政府這三大能力不足，難以期待。請繼續往下閱讀...童子瑋強調，他也支持捷運要經過安樂線，但顯然市府方案專業不足，包含路廊、拆遷、工程等問題都無法解決，願景支票無法兌現，未來跳票可能性很高。有關聯合報今天刊登基隆市長謝國樑專訪，謝國樑被問到有關基隆捷運第二階段從八堵站到基隆火車站路線，究竟是走台鐵舊路廊或者走麥金路？謝國樑說，可行性評估預估今年底完成。如果走台鐵舊路廊，台鐵舊軌道必須拆除建新軌道，保守估計至少7到8年兩種軌道都不能用，對交通影響重大，但若是拉到麥金路，讓更多民眾共用捷運，對運量財務有助益。    ,https://news.ltn.com.tw/news/politics/breakingnews/5424577
賴清德出訪衍伸3種ATA  謝志偉點出「賣台的ATA」,政治,2026/05/04 11:14,謝志偉4日發文表示，此次賴清德出訪事件衍生出三個「ATA」，除了台灣的ATA，還有中國的ATA，以及「賣台的ATA」。（圖擷取自賴清德臉書粉絲專頁）總統賴清德2日突破中國封鎖順利出訪友邦史瓦帝尼，賴清德本次出訪是採用秘密抵達然後宣布的元首出訪「ATA模式」，駐歐盟代表謝志偉4日發文表示，此次事件有三個「ATA」，除了台灣的ATA，還有中國的ATA，以及「賣台的ATA」。謝志偉表示，ATA即「抵達後公開」，此次賴清德總統突破中國的重圍與封鎖，成功出訪史瓦帝尼，可謂意義重大，而此役之中ATA指涉的面向不止一個，而是三個。請繼續往下閱讀...謝志偉指出，台灣的ATA（Arrive then Announce）是「抵達，然後公開」；中國的ATA（Awake then Angry）是「醒來，然後氣炸」；賣台的ATA（Appease then Appendix）是「跪舔，然後報廢」。謝志偉解釋，「Appendix」是盲腸，本義為「增掛之物」，此「增」在此通「蹭」，指「多餘到令人嫌棄」之意；「掛」指「附」，無自主性也。    ,https://news.ltn.com.tw/news/politics/breakingnews/5424485
