Title,News_Type,date,content,url
阿蘇火山口熱門行程意外  觀光直升機墜毀引安全疑慮,國際,2026/01/20 23:51,日本熊本縣阿蘇火山是相當熱門的旅遊地點，當地有搭乘直升機從空中俯瞰火山口的體驗。（資料照，記者王錦義攝）日本熊本縣阿蘇市一架觀光直升機今天上午起飛不久後失聯。警消下午在阿蘇山中岳第一火山口週邊發現機體嚴重毀損，2名台灣籍觀光客與1名駕駛安危待確認。發生事故的中岳火山口周邊是人氣觀光景點，能夠近距離觀看火山口的觀光直升機，更是當地觀光招牌。每日新聞報導，根據日本環境署統計，2024年造訪包括阿蘇山在內的「阿蘇九重國立公園」訪日觀光客約118萬人次，在全日本的國立公園當中，僅次於擁有富士山的「富士箱根伊豆國立公園」，排名第2。請繼續往下閱讀...一名常帶中國與台灣旅客團的業者表示，阿蘇山火山口周邊因為能夠親身感受大自然的震撼力，在外國旅客間評價很高，尤其是觀光直升機，因為可以近距離觀看火山口而顯得相當新奇，常常出現排隊等候搭乘的盛況，「沒料到竟然會發生這種事故。」根據觀光直升機營運方網站，直升機觀光有多種行程，時間最短的4分鐘「阿蘇山麓行程」，大人收費6000日圓（約新台幣1200元），可以鳥瞰北外輪和米塚地區，被評為是有高性價比的航線。7分鐘、要價每位大人1萬日圓的「俯瞰震撼火山口」航線，號稱可以近距離從活火山上空俯瞰岩漿，感受來自大自然的超級震撼。10分鐘、每人1萬4000日圓的「超值感受阿蘇山」航線，鳥瞰包括米塚、草千里、中岳火山口等亮點。3人包一架直升機則要價6萬日圓，可以享受15分鐘空中觀光。然而，雖然能夠欣賞壯麗的大自然景色，阿蘇山中岳同時也是一座活火山。根據福岡管區氣象台，目前阿蘇山的噴火警戒等級為1，火山活動呈現低下狀態。地面是否實施管制，則是依據火山氣體狀況而定；空中飛行方面，只要氣象條件允許，並不存在特別危險。不過，在中岳火山口周邊1公里範圍內，原則上禁止使用無人機與遙控飛行器，因為如果墜毀將很難取回。有人駕駛的觀光直升機則不在禁止範圍內。報導指出，這次事故中，直升機機體被發現墜毀在中岳第一火山口北側斜坡，預料救援行動會在評估火山氣體濃度下進行。阿蘇市負責防災的相關人士表示，「過去不認為在火山口周邊飛行很危險，但針對這次事故，接下來要如何因應仍未確定。」目前事故原因仍在釐清當中。熊本縣民電視台報導，曾參與直升機事故調查的前日本運輸安全委員會航空事故調查官楠原利行表示，出事的羅賓遜R44（Robinson R44）機體結構較弱，加上火山口周邊容易出現下沉氣流與上升氣流，氣流相當紊亂，「恐怕因為一時疏忽而導致直升機墜落。」    ,https://news.ltn.com.tw/news/world/breakingnews/5316597
川普關稅案 美最高法院1/20仍未有裁定出爐,國際,2026/01/20 23:46,美國總統川普。（彭博）路透社及彭博（Bloomberg News）等媒體報導，針對美國總統川普的大規模全球關稅措施合法性，美國最高法院今天仍未作出裁決。美媒先前預計，美國最高法院可能於本月9日及14日針對川普（Donald Trump）政府關稅案作出裁決，但皆未有裁定出爐。    ,https://news.ltn.com.tw/news/world/breakingnews/5316605
北極冷空氣外流寒流橫掃亞洲 俄遠東地區60年最大暴雪,國際,2026/01/20 23:42,北極冷空氣外流。（擷取自鄭明典臉書）俄羅斯遠東地區遭遇60年來最嚴重降雪，今天積雪已達數公尺高。一波寒流橫掃亞洲，導致中國上海罕見降雪，日本西北部航班停飛。路透社報導，這波寒流導致區域內各地交通大亂，中國多處道路封閉、日本旅客滯留機場，而俄羅斯遠東地區（Russian Far East）則陷入局部癱瘓。請繼續往下閱讀...科學家表示，這次天氣異常與來自北極的冷空氣有關，除了同時影響俄羅斯東部和亞洲地區，另外一波則影響東歐。氣候科學家、世界氣候歸因組織（World Weather Attribution）極端天氣研究員基平（Theodore Keeping）表示：「這次是因為噴射氣流波動，導致兩股來自北極的冷空氣同時南下。」他指的是決定天氣模式的高層大氣環流。他指出：「盤踞北極上空的巨大冷氣團北極渦旋目前相對較弱，這讓噴射氣流不那麼強烈，進而導致冷空氣從北極南下。」●俄羅斯遠東巨大雪堆根據氣象監測站資料，堪察加半島（Kamchatka Peninsula）部分地區繼去年12月3.7公尺高積雪之後，本月上半月又降下超過2公尺高的雪，巨大雪堆擋住建築物出入口，車輛為之埋沒。堪察加半島首府彼得羅巴甫洛夫斯克—堪察加市（Petropavlovsk-Kamchatsky）有民眾被拍到行走在交通號誌燈號旁的雪堆上，還有人從高高的雪堆上跳下嬉戲。居住距莫斯科約6800公里處的當地居民形容積雪「就像沙丘一樣」。●上海罕見飄雪同一波冷氣團南下中國，為金融重鎮上海帶來難得一見降雪。官方警告嚴寒天氣將持續至少3天。上海上次出現大雪是在2018年1月。然而僅一週前，上海還迎來攝氏20度的少見暖冬天氣，形成強烈對比。據當地媒體報導，桂花樹甚至因此提早開花。中國官媒報導，包括江西、貴州等長江和淮河以南省分氣溫也驟降。浙江新聞報導，貴州當地預計將降溫10到14度。中央電視台報導，隨著冰凍天氣蔓延，當局關閉山西、內蒙古、黑龍江在內12省部分主要道路。●日本發布旅遊警報強風與大雪打亂日本西北沿岸交通，數十航班取消，正值滑雪旺季的旅遊區也受到影響。日本氣象廳警告，北部和西部地區21日至25日間將持續大雪，敦促民眾非必要勿外出。全日空（ANA）取消56班次、影響約3900名旅客；日本航空（Japan Airlines）取消37班次、影響2213人。全日空航班取消幾乎全部集中在北海道札幌（Sapporo）新千歲機場。    ,https://news.ltn.com.tw/news/world/breakingnews/5316601
極端氣候重創南歐！ 西班牙柑橘產量恐創16年新低、價格翻倍,國際,2026/01/20 23:26,西班牙柑橘2025至2026年的產量恐創下近16年新低。（彭博社）2026年開始，原為全球最大柑橘出口國之一的西班牙，受到極端氣候與地中海產區歉收的雙重打擊，預估將經歷16年來柑橘最慘淡的產季。根據《世界柑橘組織》（WCO）最新數據指出，2025至2026年產季的西班牙柑橘總產量預計僅為559萬噸，不僅較前一季下降9.72%。而歐洲蔬果網也預估，西班牙柑橘2025至2026年度的產量為544萬噸，較前一季下降了10.7%，也比過去五個季度的平均產量下降了14.2%，恐創下近16年來的產量新低。請繼續往下閱讀...綜合西媒報導，造成減產的主因在於2025年末的氣候異常，瓦倫西亞（Valencia）等核心柑橘產區先是遭遇反常的特大暴雨導致根部腐爛，隨後又在1月初迎來罕見的夜間超低溫凍傷，導致作為冬季主力品種的臍橙（Navelina Orange）與檸檬產量銳減，市場供需失衡已達臨界點。隨著收購價格攀升至近年高位，西班牙南部農村地區近期甚至出現了令人哭笑不得的組織性「柑橘竊盜團」。這些小偷專門鎖定如探戈（Tango）或納多柑（Nadorcott）等的高價品種，在深夜潛入果園大規模偷竊、採摘，而為了守住一整年的心血，不少西班牙果農也被迫加強巡邏，或在果園內安裝紅外線感應器與監控設備。當地警方也表示，這種針對「農產品」的組織犯罪，在以往豐收時期相當罕見。然而，西班牙的缺口卻成了競爭對手的契機，數據顯示，埃及與摩洛哥的柑橘產業正趁勢逐步蠶食南歐市場。農業分析師指出，這場危機也更加體現出氣候變遷導致地中海農業系統更加脆弱的問題，未來，傳統產區可能需要引進更耐旱、耐寒的改良品種，否則「昂貴」的果汁或柑橘製美食恐將成為歐洲消費者的生活常態。    ,https://news.ltn.com.tw/news/world/breakingnews/5316469
西班牙高鐵事故增至41死！現場發現「斷裂接頭」疑維護缺失,國際,2026/01/20 23:17,西班牙高鐵相撞事故的死亡人數已增至41人。（法新社）西班牙安達魯西亞（Andalusia）地區於18日發生高鐵脫軌相撞的重大事故，搜救現場傳來令人遺憾的消息，根據當地政府最新統計，隨著救難人員進入受損最嚴重的車廂深處，確認死亡人數已攀升至41人，成為西班牙近年來最慘重的鐵道交通災難。綜合外媒報導，最新消息指出，事故現場的調查人員在脫軌點發現了一處「斷裂的軌道接頭」，消息人士透露，從該接頭的斷裂面可判斷出為長期的金屬疲勞痕跡，並非撞擊當下才產生的新斷裂。請繼續往下閱讀...這項發現讓調查重心從單純的「機械意外」轉向「維護缺失」。目前相關單位正緊急追查國營軌道運營商「Adif」的維修紀錄，釐清為何這處致命的零件問題在多次例行巡檢中皆未被通報，不排除涉及人為監管疏忽，而西班牙國家鐵路公司「Renfe」表示，事故原因仍然不明，暫且不會先妄下定論，西班牙鐵路事故調查委員會「CIAF」則尚未對此作出回應。面對不斷攀升的傷亡數字，西班牙首相桑切斯（Pedro Sanchez）也正式宣布全國進入為期三天的哀悼日，自週二（20日）起，西班牙全境公共建築降半旗誌哀，原本熱鬧的街頭與官方慶祝活動悉數暫停。桑切斯再次視察現場時，除慰問救難人員外，也對外發布嚴正聲明，強調政府勢必會進行全面且透明的鑑定調查，並給受害者家屬與國民清楚的交代。受到該事件影響，西班牙交通部已下令對該路段同類型的軌道接頭進行「預防性全檢測」，目前連接馬德里與南部地區的高鐵動脈依然處於封閉狀態，數萬名旅客的行程受到影響，交通部表示，在確保所有軌道零件安全無虞前，該路段暫時不會貿然恢復通車。    ,https://news.ltn.com.tw/news/world/breakingnews/5316585
可恥、沒骨氣、出賣國安！英國批准中國超級大使館 罵聲四起,國際,2026/01/20 23:08,中國預定在倫敦興建的「超級大使館」在皇家鑄幣廠舊址。（法新社檔案照）中國擬在英國倫敦新建「超級大使館」案，儘管因間諜活動和安全疑慮倍受爭議，但是英國政府經過多次延宕後，20日決定批准此案。這項決定立刻引來反對黨痛批，首相施凱爾為了促進他和中國的關係而犧牲國家安全，是「可恥」、「懦弱、沒骨氣」。英國《衛報》、《天空新聞》20日報導，負責評估此案的英國住房、社區暨地方政府事務大臣利德（Steve Reed）20日宣佈批准這項大使館興建計畫。他在聲明中說，這項決定與去年2月間曾就此案舉行公眾諮詢的獨立規劃監察員之建議一致，他說，「在做這項決定時，所有實質因素都已納入考量」，此決定「現在是最後定案，除非在法院以司法挑戰成功」。請繼續往下閱讀...新建大使館預定地在英國皇家鑄幣廠舊址，鄰近倫敦景點「倫敦塔」，建成後將是中國在歐洲規模最大的大使館。這項大使館興建計畫遭英國不同政治光譜的居民、人權組織和對中強硬派反對，擔心將被用來監視和騷擾在英異議人士。在多方反對下，利德將原定去年10月做決定的期限，兩度延後，到今年1月20日。英國政府批准時間點，正值首相施凱爾預定本月底前訪問中國。保守黨影子社區事務大臣柯維立（James Cleverly）也批評工黨政府和首相這項決定，「是丟臉的懦弱行徑、完全沒有骨氣」。他說，任何政府的首要職責就是維護國家安全，「但是施凱爾確保這最重要的優先事項，置於他迫切想得到北京認可之後」，他批評工黨「出賣」行徑，證實該黨無法被信任能在國際舞台捍衛英國。現任國會議員、前保守黨黨魁史密斯（Iain Duncan Smith）在利德宣佈批准後，痛斥這項決定是「災難」。同黨議員巴特爾（Priti Patel）指控施凱爾，在使館案投降，「向中國出賣國安」。英國自由民主黨（Liberal Democrats）警告，批准這項計畫是首相「所犯的最大錯誤」，「將危害我國數據安全」。該黨外交事務發言人米勒（Calum Miller）說，「首相明知他今天的這個決定，將放大中國在英國的監控行為力度，並且危害我國數據安全，更不要說在英國的勇敢香港人的安全」，「他接受這些威脅，來促進他和中國的眉來眼去，這是大錯特錯」，「這個政府應該為其今天這項決定感到羞愧」。去年2月反中國在倫敦興建「超級大使館」的民眾，在使館預定地皇家鑄幣廠舊址前示威抗議。（法新社檔案照）    ,https://news.ltn.com.tw/news/world/breakingnews/5316490
畫面曝光！載2台人直升機墜毀阿蘇火山  前半段機體不見了,國際,2026/01/20 22:57,阿蘇火山直升機墜毀照片曝光。（圖翻攝自X平台）日本熊本縣一架載有2名台灣旅客的觀光直升機，今天（20日）在阿蘇火山發生空難，目前機上包括日籍飛行員在內3人生死未卜。據了解，已經找到失事直升機的殘骸，今晚墜毀照在網上曝光，讓人看了心涼大半。綜合日媒報導，台灣時間今日上午10點左右，從阿蘇卡德利動物樂園（阿蘇カドリー・ドミニオン）起飛的1架觀光直升機失去聯繫，超過預定返航時間仍未返回，機上有64歲日籍飛行員、41歲台籍男性乘客和36歲台籍女性乘客。據悉，事發當下直升機內一支智慧型手機，疑因受到強烈衝擊啟動自動通報系統，警消因此察覺異常，立刻與自衛隊展開搜救。請繼續往下閱讀...台灣時間下午3點多，警消已在阿蘇中岳第一火山口東北側的斜坡發現機體殘骸，肉眼辨識機身編號確認為失事直升機，但目前機上3人生死不明。今晚失事直升機的墜毀照在X平台被曝光，據了解是熊本縣警釋出畫面，可以看到機身毀損嚴重，前半段的機體碎片散落各處，僅剩後半段機身尚屬完整，可想當下撞擊力道之大。可礙於山區天氣影響能見度，搜救人員評估夜間行動的風險後，決定先暫時撤離現場，重新集中人力與裝備，預計明日上午再度展開搜索行動。    ,https://news.ltn.com.tw/news/world/breakingnews/5316576
雪梨海灘血案後 澳洲通過新法加強打擊仇恨犯罪與槍枝,國際,2026/01/20 22:41,一對槍手父子去年12月在澳洲雪梨邦代海灘的慶祝活動上開槍導致15人喪命，澳洲國會今天通過更嚴格的仇恨犯罪及槍枝管制法律。圖為槍手開槍後，海灘遊客紛紛逃離。（法新社檔案照）一對槍手父子去年12月在澳洲雪梨邦代海灘的猶太節日「光明節」慶祝活動上開槍，導致15人喪命後，澳洲國會今天通過更嚴格的仇恨犯罪及槍枝管制法律。法新社報導，澳洲國會兩院議員針對相關立法投下贊成票，以因應去年12月14日發生在雪梨知名景點邦代海灘（Bondi Beach）的槍擊案。請繼續往下閱讀...槍手阿克拉姆（Sajid Akram）與兒子納維德（Naveed Akram）涉嫌攻擊猶太光明節（Hanukkah）慶祝活動，這是澳洲近30年來最嚴重的大規模槍擊案。澳洲總理艾班尼斯（Anthony Albanese）在國會眾議院表示：「恐怖分子不僅心懷仇恨，手中還握有威力強大的步槍。」艾班尼斯說道：「我們正針對這兩個方面採取行動－打擊反猶太主義、打擊仇恨，並讓危險槍枝遠離街頭。」澳洲國會就仇恨言論及槍枝管制的法律改革分別進行表決。仇恨言論相關新法將對試圖散播仇恨、極端言論或宣揚暴力的人加重法律責任與刑罰。違法者若為布道者、其他領袖人物或試圖灌輸孩童激進想法的成人，新法將加重懲處。新法同時建立框架，讓特定組織能列為遭到禁止的仇恨團體。此外，新法也讓涉嫌從事恐怖活動或因種族、膚色、出身而鼓吹仇恨者更容易被拒發或撤銷簽證。在槍枝部分，澳洲將制定全國槍枝回購機制、加強武器進口規範，並擴大槍枝許可的背景查核作業，納入情報單位意見。根據澳洲政府，目前全國槍枝數量達到創下新高的410萬枝。不過，也有人批評仇恨言論相關立法過於倉促。澳洲參議員暨澳洲綠黨（Australian Greens）黨魁華特斯（Larissa Waters）指出，新法恐造成「嚴重意外後果」，包括限制人民的言論自由。她並呼籲反制仇恨言論的保護範圍擴及其他群體，包含因自身性傾向或身心障礙而成為攻擊目標的人士。    ,https://news.ltn.com.tw/news/world/breakingnews/5316556
俄羅斯再襲烏克蘭 車諾比核電廠外部電源全斷,國際,2026/01/20 22:40,烏克蘭車諾比核電廠。（法新社）聯合國原子能監管機構「國際原子能總署」（IAEA）在社群平台X發文指出，烏克蘭經歷今天上午的大規模軍事行動後，車諾比核電廠外部電源完全中斷。車諾比（Chornobyl）核電廠曾發生全球最嚴重的核電事故。請繼續往下閱讀...路透社報導，根據烏克蘭官員的說法，俄羅斯今晨對烏克蘭發動無人機與飛彈攻擊，導致首都基輔數以千計的公寓大樓在嚴寒天氣中停電且供暖中斷。國際原子能總署則表示，多座對核能安全至關重要的烏克蘭變電所受到軍事行動影響，其他幾座核電廠的輸電線路也遭受波及。    ,https://news.ltn.com.tw/news/world/breakingnews/5316581
上傳AI插旗圖公開私訊 川普矢言奪格陵蘭絕不回頭,國際,2026/01/20 22:26,川普上傳了多張AI生成圖，其中一張是他帶領副總統范斯與國務卿盧比歐，作勢在格陵蘭領土上插下美國國旗，一旁告示牌上寫著：「格陵蘭自2026年起成為美國領土」。（擷自Truth Social）美國總統川普今天矢言拿下格陵蘭「絕不回頭」，且不排除動用武力奪取。川普不但上傳在格陵蘭插上美國國旗的AI生成圖，還在社群平台公開與法國總統馬克宏的私人訊息內容。路透社報導，川普意圖從北大西洋公約組織（NATO）盟友丹麥手中奪取格陵蘭主權的野心，從他的社群貼文與上傳的人工智慧（AI）生成圖中表露無遺；此舉恐導致維繫西方安全數十年的北約同盟關係陷入分裂。請繼續往下閱讀...川普與北約秘書長呂特（Mark Rutte）通話後在自家社群平台真實社群（Truth Social）發文寫道：「格陵蘭對國家及世界安全至關重要。這點不容回頭，大家都同意！」川普還上傳了多張AI生成圖，其中一張是他帶領副總統范斯（JD Vance）與國務卿盧比歐（Marco Rubio），作勢在格陵蘭（Greenland）領土上插下美國國旗，一旁告示牌上寫著：「格陵蘭自2026年起成為美國領土」。另一張則是川普與多位政治領袖談話，一旁則是一張加拿大與格陵蘭被劃入美國版圖的地圖。此外，川普還公開了與法國總統馬克宏（Emmanuel Macron）的私人訊息內容，包括馬克宏質疑他對格陵蘭的意圖。川普先前已揚言對阻礙其計畫的國家施加關稅，將不惜對法國葡萄酒及香檳課徵200%的懲罰性關稅。丹麥經濟部長羅斯（Stephanie Lose）在布魯塞爾告訴媒體，這已非單純的丹麥內政，而是涉及整體跨大西洋關係。儘管美國財政部長貝森特（Scott Bessent）在瑞士達沃斯（Davos）年度世界經濟論壇（WEF）場邊表示，他有信心美國與歐洲將找到解決方案。然而，歐盟執委會主席范德賴恩（Ursula von der Leyen）在演說中指出，近期接二連三的地緣政治衝擊將迫使歐盟打造一個更獨立的歐洲。    ,https://news.ltn.com.tw/news/world/breakingnews/5316555
打造付費版安理會？消弭全球衝突 川普提「和平理事會」,國際,2026/01/20 21:47,歐洲國家對美國總統川普發起的「和平理事會」持保留態度。（美聯社）近日由美國總統川普提出的「和平理事會」架構中，以10億美元（約316億台幣）投資換取永久理事會資格的方案引發熱議，被形容是付費版本的聯合國安全理事會。「彭博」引述歐洲官員報導，基於匯聚國際力量重建加薩而創設的和平理事會，被川普擴大定位為解決其他區域衝突、處理國際事務的平台。理事會章程也確實未將加薩重建視為唯一目標，而是一個「尋求推動穩定，恢復可靠及合法治理，並在受到衝突威脅、影響的區域取得長久和平的組織」。章程主張，新理事會應具備「不被一再失敗的方法和機構侷限的勇氣」，展現川普政府對聯合國及其他主要國際組織的輕蔑。請繼續往下閱讀...根據章程草案，和平理事會由川普擔任創始主席，並握有對會員國去留的生殺大權，以及任命下一任主席的權力。另規定成員國任期不超過3年，但只要首年挹注10億美元現金，即可取得永久會籍。喬治華盛頓大學國際事務教授威廉斯（Paul Williams）向「法新社」指出，10億美元換取永久會籍的方案，顯示出川普「試圖把理事會轉變成付費參與的機構，作為聯合國理事會替代選項，川普則在其中獨享否決權」。    ,https://news.ltn.com.tw/news/world/breakingnews/5316541
格陵蘭爭端撕裂美歐 美財長卻稱：關係從未如此緊密,國際,2026/01/20 21:31,即便美歐緊張關係因格陵蘭問題加劇，美財長貝森特仍認為雙邊關係強勁。（美聯社）美國總統川普第二任期上任後與歐洲的緊張關係，在近日因格陵蘭主權爭端，揚言對歐洲8國課徵10％起跳關稅後進一步惡化。對此，美國財政部長貝森特試圖淡化美歐衝突，主張雙邊關係仍強而有力。出席瑞士達沃斯「世界經濟論壇」的貝森特認為，美國與歐洲的關係「從未如此親近」，敦促盟友「深呼吸」緩和情緒，讓當前的緊張態勢順勢發展。請繼續往下閱讀...然而，同場的歐盟執行委員會主席馮德萊恩在演說中強調，「歐盟與美國在去年7月達成了貿易協議。不管是政治還是商業，協議就是協議。朋友們相互握手必有其含義」。川普19日向媒體表示，不認為歐洲領袖會對美國收購格陵蘭的計畫有過大反彈，因為「他們無法保護格陵蘭」。隔日他在社群媒體宣布，與北大西洋公約組織（NATO）秘書長呂特進行一次良好通話後，同意出席在達沃斯舉行的格陵蘭議題多方會議。    ,https://news.ltn.com.tw/news/world/breakingnews/5316529
川普為格陵蘭動干戈？芬蘭總統不認為會動武,國際,2026/01/20 21:15,芬蘭總統史塔布不認為美國會因格陵蘭與歐洲兵戎相向。（歐新社）美國總統川普強勢表態，打算奪取格陵蘭主權，甚至不惜武力相向。芬蘭總統史塔布表示，雖然對盟國的關稅威脅令人無法接受，但不認為華盛頓會以武力奪取格陵蘭控制權。史塔布在達沃斯的記者會中表示：「同盟層級的關稅威脅令人無法接受，削弱了我們的跨大西洋關係。最糟糕的情況下，可能導致惡性循環」。被問及美國是否會動用武力奪取格陵蘭？史塔布說，「我不認為美國會以武力掌控格陵蘭。」請繼續往下閱讀...歐盟執行委員會主席馮德萊恩在「世界經濟論壇」演說中談到，「我們不僅視美國人民為同盟，更是朋友。把我們拖入下墜的漩渦之中，只會讓那些我們致力驅逐於戰略布局之外的對手稱心如意」，誓言歐盟會做出「堅決、團結、對等」回應。    ,https://news.ltn.com.tw/news/world/breakingnews/5316514
