Title,News_Type,date,content,url
是在哈囉？台中2警抓到毒駕沒記功 反因「不知如何處理」縱放送辦,社會,2026/05/10 18:49,台中市第五分局許姓、孫姓員警查獲邱姓男子毒駕，卻因不知如何處理將人放掉，檢方認涉犯公務員縱放職務上依法逮捕之人罪，做出緩起訴處分。（記者陳建志攝）台中第五分局四平派出所許姓、孫姓警員，今年1月巡邏發現邱姓男子涉嫌毒駕，進行唾液快篩呈現愷他命陽性反應，將邱男移送偵查隊，莊姓偵查佐告知沒有尿液檢驗報告拒絕收案，2人不知如何處理，將邱男帶返派出所後，竟直接放人，所長得知後通報送辦。台中地檢署檢察官調查，認2人涉犯公務員縱放職務上依法逮捕之人罪，考量2人已坦承犯行，深表悔悟，做出緩起訴處分。中檢調查指出，台中第五分局四平派出所許姓、孫姓警員今年1月19日凌晨2點多巡邏時，發現駕駛自小客車的邱姓男子，身上飄出濃濃愷他命味道，經邱男同意實施毒品唾液快篩試劑檢測，發現呈陽性反應，依公共危險毒駕將他逮捕，並在車上查獲毛重4.8公克的愷他命1包。請繼續往下閱讀...2人當天清晨4點55分，將邱男送往第五分局偵查隊，莊姓偵查佐告知須有鑑驗單位的尿液報告呈毒品陽性反應後，才可移送地檢署，拒絕收案，2人因不知如何處理邱嫌，將他帶回派出所後竟直接放人，所長當晚得知後通報全案才曝光。檢方偵訊時，許、孫2人坦承犯行，莊姓偵查佐則否認犯行，強調沒有說不收犯嫌，當時問他們送什麼案件，2人說是公共危險，因該案是第三級毒品愷他命，卻沒有尿液檢驗報告、只有快篩，認為他們應該要請示檢察官，不知道2人事後會把邱嫌放掉，因無證據顯示莊有指示許、孫2人放掉邱嫌，檢方做出不起訴處分。至於許員、孫員2人，檢方考量因一時失慮犯下此案，犯後已坦承犯行，深表悔悟，歷此司法偵查程序應有所警惕，認涉犯公務員縱放職務上依法逮捕之人罪，做出緩起訴處分，並向公庫支付新台幣5萬元；第五分局表示，相關行政處分目前已在簽核中。    ,https://news.ltn.com.tw/news/society/breakingnews/5432257
「汭恩產後護理之家」裝針孔偷拍？警檢測是「收音麥克風」,社會,2026/05/10 18:29,警方到號稱六星級、台北市知名月子中心「汭恩產後護理之家」檢測有無針孔。（記者王冠仁翻攝）號稱六星級、台北市知名月子中心「汭恩產後護理之家」，被民眾指控涉嫌裝設煙霧偵測器型的針孔鏡頭；警方前往調查，檢視哺乳衛教教室天花板上的煙霧偵測器，發現內部藏有線路。經檢測，警方發現該線路連接的並非針孔鏡頭，而是收音麥克風；由於民眾提告，再加上裝設錄音器的行為也有違反妨害秘密之虞，警方因此把全案依妨害性隱私、妨害秘密、醫療法等罪嫌移請檢方偵辦。北市警中正一分局在今天下午2時許接獲報案，報案人聲稱，在台北市中正區的「汭恩產後護理之家」中，哺乳衛教教室天花板上的煙霧偵測器中，發現疑似有針孔鏡頭。請繼續往下閱讀...警方派鑑識人員到場檢測，發現該月子中心的天花板上總共裝有3個煙霧偵測器，其中2個是真的煙霧偵測器，另外1個內部卻藏有線路。警方以紅外線反針孔偵測器進行偵測，在這個藏有線路的煙霧偵測器中沒有發現針孔鏡頭。經檢視，警方研判這個被民眾指控是針孔鏡頭的設備與線路，其實是收音麥克風。警方在場查扣煙霧偵測器與其線路、監視器主機及硬碟等，經初步檢視相關檔案，並沒有發現偷拍影像。不過，警方為求慎重，不排除相關可能性，因此仍將會全面檢視查扣回來的檔案，釐清有無用針孔偷拍的疑慮。警方說，此案由於民眾提告，再加上在民眾不知情下錄音，也有妨害秘密的嫌疑，因此警方通知連姓負責人前來說明，他目前已經在派出所內配合警方調查，警方將再進一步釐清案情。網友發文指控月子中心疑似裝設針孔。（取自Threads）    ,https://news.ltn.com.tw/news/society/breakingnews/5432245
台南研醫明醫美疑裝針孔 屏東分店今公休明稽查,社會,2026/05/10 18:24,屏東縣衛生局10日前往屏東「研醫明」展開行政調查，但該店無營業。（屏東縣府衛生局提供）台南市中西區的研醫明醫美診所昨（9日）在市府擴大啟動醫美診所專案稽查行動中，被發現在美容室天花板偵煙器內有疑似針孔攝影設備，檢警隨即展開偵辦；「研醫明」在屏東也有分店，屏縣府衛生局今（10）日也展開行政調查。屏東縣衛生局今（10）日說明，經查屏東「研醫明」商業登記為美容美體業，而非醫美診所，衛生局今日接獲相關訊息後，立即啟動行政調查，派員會同警方前往該店稽查，結果該店今日並無營業，聯繫業者也未果，預計明早（11日）將再前往行政調查。請繼續往下閱讀...衛生局強調，經行政調查若有查獲相關違法事證，將會依違反消費者保護法、個人資料保護法等相關法規處辦。    ,https://news.ltn.com.tw/news/society/breakingnews/5432182
高級月子中心爆「愛爾麗同款」偷拍  媽咪們驚呼：脫衣全看光！,社會,2026/05/10 17:56,北市汭恩產後護理之家也爆出裝設偷拍設備。（Threads:vika4599授權使用）連鎖醫美診所「愛爾麗」發生診間偷拍事件後，位於台北市中正區、號稱六星級月子中心的「汭恩產後護理之家」今天（10日）也爆出裝設針孔偷拍，爆料的媽媽直呼「太扯」，因為發現偷拍設備的地點就是媽咪們更衣的SPA室，引發輿論熱議。一位年輕媽媽今天在Threads上爆料自己待的月子中心也裝設偷拍設備，而且還是在SPA室，媽媽們都會直接在這邊更衣，春光全都外洩。原PO表示，這家月子中心就是中正區光復里中華路一段上的汭恩產後護理之家，她分享出影片和照片可以看到天花板上有不明管線，前端長得像鏡頭，隱藏在看起來像煙霧偵測器的裝置中。請繼續往下閱讀...網友紛紛驚呼，「我要瘋掉！我在這邊按摩已經4次了，其他媽媽也都在裡面脫衣服按摩欸」、「這一定是一整條產業鏈，到底哪裡是安全的？」、「孕婦的spa室也不放過，這世界怎麼了……」、「明明是女性服務人員為主的地方，怎麼會縱容這些事發生？」、「少子化已經很嚴重了，願意生的還要被偷拍」、「診所說要醫療行為裝，結果月子中心也裝，噁不噁心啊！」轄區警方今下午獲報到場，確認拆除下來的是偽裝成煙霧偵測器的偷拍攝影機，和愛爾麗診所的偷拍設備同款。綜合媒體報導，現場檢視沒有運作，汭恩的負責人聲稱不知情，但願意配合到派出所做筆錄，警方已將相關證據查扣，報案民眾提告妨害秘密等罪，警詢後預計將函送法辦。     在 Threads 查看    ,https://news.ltn.com.tw/news/society/breakingnews/5432121
六星級「汭恩產後護理之家」也驚傳裝針孔 負責人被帶回,社會,2026/05/10 17:28,「汭恩產後護理之家」被控疑似裝設針孔。（取自官網）在愛爾麗醫美診所爆發出偷拍風暴後，想不到全台各地多家醫美診所、月子中心也接連爆發出類似事件。台北市警方今天接獲報案，報案人指出，號稱六星級、位於台北市中正區的「汭恩產後護理之家」，疑似也裝設煙霧偵測型的針孔攝影機；警方今天前往現場調查，目前已經將相關設備、電腦主機、硬碟查扣，並將連姓負責人帶回派出所調查釐清。今天有民眾在社群上發文，聲稱在該月子中心發現被人裝設偷拍設備，而且還是裝在SPA室，大家都在這脫衣按SPA，直呼「太扯了吧！」請繼續往下閱讀...轄區中正一分局在今天下午2時許接獲報案，派員前往現場，報案民眾指控店家裝設針孔偷拍，但店家則推說不知情。警方為求慎重，將民眾指控是針孔的煙霧偵測器拔除，同時查扣相關電腦主機、硬碟，將進一步釐清是否確實為針孔設備。由於報案民眾提告妨害秘密，警方目前已經將連姓負責人帶回派出所調查釐清。對此，汭恩產後護理之家也在今天下午發表聲明，聲稱本機構秉持透明、負責之態度，主動配合主管機關監督，目前本館均已完成公部門聯合實地查核，本機構各項空間設施符合法規，無任何違規監控設備。網友發文指控月子中心疑似裝設針孔。（取自threads）    ,https://news.ltn.com.tw/news/society/breakingnews/5432181
球友大漢橋下打籃球  怪男持刀趕人：颱風來了快離開,社會,2026/05/10 17:28,一名怪男持刀告知大漢橋下打球球友，颱風來了盡快離開，球友隨即報案，警方逮捕潛姓男子、查扣刀械，將依違反社會秩序維護法裁處。（擷取自網路）新北市幾名球友相約到大漢溪堤外打球，一名怪男前來，告知他們颱風來了不能打球，要他們趕快離開，怪男手中還疑似持刀，球友們嚇得報案。警方到場，在附近草叢找到潛姓男子，他無法解釋為何持刀，警在一旁鐵馬菜籃中發現1把刀械，當場查扣，依違反社維法送辦。這起案件發生在9日下午5時20分，板橋區大漢橋下河堤外籃球場，新北市警海山分局獲報，有民眾運動時，1名男子喃喃自語說颱風快來，請他們盡快離開，手上還疑似持刀。請繼續往下閱讀...江翠所員警到場，於河堤草叢發現潛姓男子，在一旁腳踏車上發現1把刀械沒入，訊後依違反社會秩序維護法第63條移請新北地院簡易庭裁處，將被處3日以下拘留或新台幣3萬元以下罰鍰。    ,https://news.ltn.com.tw/news/society/breakingnews/5432144
落實檢察人事公平 檢協會：二審實任檢察官應經檢審、部長圈選任命,社會,2026/05/10 17:23,檢協會強調，二審實任檢察官在檢察體系中實質上等同於調陞制度的一環，應建立公平、公正、公開的人事制度配套。（資料照）適逢前檢察總長邢泰釗7日卸任之際，檢察官協會當天就「二審實任檢察官」選拔制度提出5項建議，主張應建立明確選任標準並經檢審會審議後，提供一定比例人選，由法務部部長圈選任命，以兼顧人事制度公信力與用人彈性。檢協會聲明指出，二審實任檢察官屬檢察體系重要幹部，亦為未來檢察首長儲備人選，制度設計應審慎規劃。此制度與現行一審調升二審的三專生、二專生制度同屬檢察官歷練體系一環，建議應比照既有作法，納入檢察人事審議委員會（檢審會）審議機制，以維持制度一致性與公信力。請繼續往下閱讀...檢協會建議，應建立二審實任檢察官明確選任原則與機制，使候選人與檢審委員均有所依循，並納入用人機關意見，以強化實務需求與人事配置連結。此外，建議由檢審會審議後，提出1.5倍人選供法務部部長圈選，以兼顧檢察業務推動效率與用人彈性。在人力遞補與長期規劃方面，檢協會呼籲應建立二審實任檢察官名額的長期配置機制，避免短期內消耗名額導致後續遞補困難，進而影響優秀人才晉升機會，造成制度性遺珠之憾，並不利檢察體系新陳代謝。檢協會強調，二審實任檢察官在檢察體系中實質上等同於調陞制度的一環，應建立公平、公正、公開的人事制度配套，以確保整體檢察人事制度運作健全。圖為檢協會第10屆理事長、前最高檢察署檢察總長邢泰釗。（記者劉詠韻攝）    ,https://news.ltn.com.tw/news/society/breakingnews/5432171
致命的巧合！台中機車騎士倒地遭輾壓  驚悚碰撞畫面曝光,社會,2026/05/10 17:16,台中市胡姓男子今天騎機車行經太平區太平路，疑似先碰撞騎腳踏車的陳姓女童後倒地，被旁邊閃避不及、由阮男駕駛的車子直接輾過，送醫不治。（記者陳建志翻攝）台中一名胡姓騎士（49歲）今天上午10點多騎機車行經太平區太平路，先與騎腳踏車的12歲陳姓女童發生碰撞，失控倒地後，由阮姓男子（25歲）駕駛的休旅車閃避不及、將他輾過還壓在車底送醫不治。現場的監視器畫面曝光，發現胡男倒地，不巧在一旁阮男的車子前，阮男閃避不及直接輾過並壓在車底，一旁湯姓騎士則被胡男的機車碰撞倒地，所幸女童和湯男都無大礙，詳細肇事責任和原因，警方將進一步釐清。台中市消防防局今天上午10點57分接獲報案，指稱太平區太平路發生車禍，有民眾受困汽車底下，立刻派遣太平、東英及赫力分隊出動6車12人，由太平分隊小隊長林智偉帶隊前往，抵達時發現1輛休旅車、還有兩輛機車和1輛自行車發生碰撞意外。請繼續往下閱讀...現場發現1名胡姓男騎士受困休旅車下，立刻將他救出，現場已經沒有呼吸心跳，立刻將他送醫，不過仍在12點多宣告不治，12歲陳姓女童和另一名湯姓騎士（32歲）則是輕傷。經警方調查，事故4人都無酒駕、毒駕情事，警方目前已調閱監視器及行車紀錄器還原事故經過，將釐清相關肇事原因及責任。今天稍早，現場的監視器影像也曝光，畫面中可看到，當時陳姓女童騎腳踏車從家門前剛起步，沒多久胡姓騎士騎機車從後方接近，疑似碰撞到女童腳踏車後失去重心往左倒，整個人不巧摔在一旁由阮姓男子（25歲）駕駛的休旅車前面，阮男閃避不及直接輾過，胡男並卡在車底下，現場失去生命跡象。而胡男的機車，也撞到同向剛好騎在內側車道的湯姓騎士（32歲），造成湯男人車倒地，所幸湯男和女童都輕微擦挫傷，經送醫治療無大礙。台中4車連環車禍    騎士遭休旅車輾壓困車底送醫不治    ,https://news.ltn.com.tw/news/society/breakingnews/5432175
載運蔬果中部北上精神不濟  貨車駕駛連撞護欄、路邊6機車,社會,2026/05/10 17:06,阮男駕駛貨車載運蔬菜水果，行經台北市大安區師大路時，因精神不濟偏離車道，先撞擊護欄及標誌牌後，再撞上停車格內6台機車。（記者陸運鋒翻攝）阮姓男子昨天（9日）清晨駕駛貨車載運蔬果，行經台北市大安區師大路時，因精神不濟偏離車道，先撞擊護欄及標誌牌後，再撞上停車格內6台機車，警方獲報趕抵，所幸事故沒有造成人員傷亡，已排除有毒、酒駕情況，後續將由阮男調解賠償事宜。大安警分局調查，42歲阮男駕駛公司貨車載送蔬菜及水果，從中部北上前往萬華環南市場，途中沿大安區師大路往北方向行駛，自稱長途駕車精神不濟未注意車前狀況，未能及時發現貨車偏離車道，導致車頭先撞上人行道護欄與標誌牌面後，再撞擊停車格內6台機車。請繼續往下閱讀...警方指出，獲報立即趕抵現場，事故造成人行道護欄與標誌牌面損壞，而貨車及6台機車均有車損，幸無人員受傷，另檢視阮男無酒味酒容未實施酒測，也沒有毒駕等情況，駕駛執照也正常，阮男當下表示願意賠償車損；另毀損護欄及標誌牌部分，警方已通報1999轉權責單位處理。警方呼籲，駕駛人行車前應充分休息，確認精神狀態良好，若有精神不濟或身體不適切勿勉強上路，以確保行車安全。    ,https://news.ltn.com.tw/news/society/breakingnews/5432156
台中東協廣場成「戰場」    10多外籍移工大亂鬥畫面曝光,社會,2026/05/10 15:55,台中市中區東協廣場，今天凌晨發生10多外籍移工大亂鬥，警方獲報帶回動手的4名印尼籍移工，將依違反社會秩序維護法送辦。（擷取自社會事新聞影音）台中市中區東協廣場，今天凌晨3點多，發生10多名外籍移工大亂鬥，台中市警方獲報，隨後在台中火車站附近，發現4名印尼籍的哈姓、阿姓、拉姓、歐姓等合法移工（皆年約30歲）又發生第二次衝突，將4人全帶回警局，調查後才知道4人酒後因言語不合大打出手，其他人則是出手勸架，將4人依違反社會秩序維護法送辦。台中市警方今天凌晨3點左右接獲民眾報案，指稱中區火車站廣場附近有移工發生衝突，員警獲報趕到後，只發現2人在場，經了解為印尼籍哈姓、阿姓、拉姓、歐姓等4名合法移工，先前已在東協廣場飲酒後，因酒後言語不合爆發口角衝突大亂鬥。請繼續往下閱讀...4人隨後又在台中火車站前廣場相遇，再次發生口角及徒手推擠，過程中哈姓移工因泥醉重心不穩跌倒，導致頭部受傷，其餘人員則無明顯傷勢。警方已將主要4名滋事的移工查緝到案，依違反社會秩序維護法送辦，另在場圍觀聚集的移工，警方也將依法告誡約制。    ,https://news.ltn.com.tw/news/society/breakingnews/5432081
悚！彰化工廠大火狂燒4小時 西濱驚見「黑龍沖天」長達數公里,社會,2026/05/10 15:37,彰化工廠大火狂燒4個多小時在天際捲起一條長達數公里的黑煙。（民眾提供）悚！彰化縣鹿港鎮一間工廠今天（10日）上午11點突然發生大火，整間廠房火勢迅速蔓延，濃煙竄天有如拉出一條長長的黑色巨龍凌空，消防局持續增援消防員趕往搶救，但火勢太過猛烈，濃煙還飄向緊鄰的省道台61線西濱快速道路，情況相當危急，警方與消防局都派人員在61線警戒，火勢從上午燒到下午已持續4小時之久，黑色濃煙竄天在天際捲起一道長達數公里的「黑龍」，景象駭人。消防局指出，現場為室外廢棄物燃燒波及3棟1層鐵皮廢棄物倉庫，室內外存放大量廢棄物，總面積約900坪，燃燒面積約600坪，由於火勢一度相當猛烈，溫度相當高，消防局還部署2台救災機器人及多條水線進行滅火攻擊及侷限火勢，及第三面靠近台61線部署車組及水線進行周界防護，並運用無人機監控火勢變化。請繼續往下閱讀...火勢於2個半小時內獲得控制，目前持續搶救到下午3點多，所幸現場無人員傷亡；總計消防局共出動各式消防車24輛、救護車1輛、救災機器人2台、無人機2架、消防人員51人、義消7人。在風勢助長下，火場溫度相當高，消防人員僅能先控制火勢，大火4小時所捲入天際的黑色濃煙也被風勢吹得長達數公里之遠，就連彰化市都看得到，且火場就在台61線西濱快速道路旁，濃煙也影響用路人通行，相當危險。環保局也派員到場監測是否造成空氣汙染，並呼籲下風處的民眾緊閉門窗以策安全。鹿港工廠大火溫度太高，消防局派救災機器人深入火場。（消防局提供）工廠大火緊鄰西濱快速道路，情況危急。（民眾提供）    ,https://news.ltn.com.tw/news/society/breakingnews/5432090
直播女消防員執勤喊「屁股好翹！」 新北警鎖定噁男通知到案,社會,2026/05/10 15:34,新北市一名噁男在板橋救災現場，拍攝一名蹲地執勤的女消防員臀部，直呼屁股好翹，真可愛，被旁人拍下PO網，女消防員今天報警提告。（警方提供）新北市板橋傳出消防單位獲報跳樓，到場架設氣墊，後來發現是誤報，1名女消防員穿整套消防衣蹲地收取氣墊時，遭1名變態噁男拍攝，還直播大叫「屁股好翹、好可愛」，民眾見狀PO網斥責，女消防員發現後，昨晚到警局了解、今天提告，警方將通知疑犯到案說明。新北市119於9日6時21分獲報，板橋德興街39號傳出跳樓案，消防人員到場，發現民眾只是探頭出窗查看，自行開門，狀況解除，後續家屬處理。但女消防員收氣墊時，傳出1名男子拍攝執勤中的女消防員，還說屁股好翹、好可愛，女消防員得知後今天到後埔派出所報案。請繼續往下閱讀...後埔所獲報，強調今天適逢母親節，警方和消防局不容忍對執法人員任何輕蔑或物化女性言行，目前鎖定特定犯嫌，後續必定會積極查辦到底。    ,https://news.ltn.com.tw/news/society/breakingnews/5432076
沒有大聲求救不算性侵？ 法官痛批「完美被害人」 男判4年10月,社會,2026/05/10 15:26,柯男性侵被害人，事後狡辯，被判4年10月徒刑。（情境模擬圖）彰化一名男子利用女子肚子痛，誆稱可「作法」減輕傷痛，將人載往摩鐵，性侵直到「硬不起來」才罷手。但男子到案後矢口否認，其律師更以「性侵完美被害人迷思」為被告辯護，也就是被害人事發後沒有出現立刻報警、大聲求救、情緒崩潰、衣衫不整等情狀，所以是女方誣陷男方，但女方私密處驗出男方DNA，法官認為，被告犯行明確，犯後還一意狡辯，又未與被害人和解，因此依強制性交罪判處4年10月徒刑。全案可上訴。判決書指出，被害人A女與柯男為朋友關係，前年4月間柯男載她去看夜景。A女途中突感腹痛不適，柯男帶她到醫院急診，凌晨1時33分出院後，竟未經A女同意，以公主抱方式將身體虛弱的她抱上車，載往彰化市一間汽車旅館。進入房間後，A女因不適躺臥床上，柯男竟以「幫你作法減輕疼痛」為藉口，壓在她身上，伸手撫摸胸部、親吻耳朵，性交得逞。A女不斷掙扎喊「不要」，卻因身體無力無法抵抗。隔天柯男又載A女至醫院就醫，直至A女家人與警方現身才離去。請繼續往下閱讀...柯男審理時否認犯行，辯稱是對方主動提議「閃婚」，當晚僅是帶她到汽車旅館休息，自己睡沙發，期間沒有任何身體接觸。辯護人則質疑女子未當場求救、未立即報警。檢方的起訴書指出，被告論辯的核心正是「完美被害人」思維，也就是性侵被害人應該是精神崩潰、立即報案、衣衫不整、多方求救。A女無一符合此標準，所以A女是想誣陷他。法官認為，女方私密驗出男方的DNA是鐵證，與其辯稱「無身體接觸」明顯矛盾，被害人案發後出現創傷症狀；女子事後主動向男友哭訴自責，顯非憑空捏造。法官於判決理由中明確打破「完美被害人」的迷思，指出遭逢性侵的被害人未必皆能立即反應或對外求救。反觀被告，犯後不僅始終否認，更毫無與女子和解，其犯行已對被害人留下長期且難以平復的身心創傷，判處4年10月徒刑。    ,https://news.ltn.com.tw/news/society/breakingnews/5432061
捲入偷拍風波 聖宜診所道歉：立即辦理現金退款,社會,2026/05/10 15:01,聖宜醫美診所捲入偷拍風暴。（圖取自聖宜醫美診所官網）自愛爾麗醫美診所被人發現裝有煙霧偵測器針孔攝影機後，接連有其他家醫美診所也被人發現疑似裝設針孔、偷拍顧客；其中位在台北市中正區知名「聖宜診所」，也遭指控疑未告知消費者，暗中偷拍下她們私密處除毛畫面。對此，聖宜診所今天透過臉書致歉，同時宣布顧客可至原購買分店辦理現金退款，也強調目前全台7間分店皆已備妥200萬以上現金來因應退款。據受害消費者指控，她自2023年起，在聖宜診所北市站前店進行私密除毛療程，近期在傳出醫美診所有針孔事件後，她前往詢問，得到員工證實「有裝監視器」，但強調「只會拍到醫師頭部」，她覺得氣憤，認為隱私權受侵害。請繼續往下閱讀...警方事後前往調查，發現各診室並沒有暗藏的針孔式攝影機，但確有裝設公開式的攝影監視器。警方目前排除有涉嫌裝針孔偷拍等情事，但診間設置公開的監視錄影器錄影內容，仍涉嫌違法，於是將李姓負責人製作偵訊筆錄，訊後依法函送法辦。對此，聖宜診所今天透過臉書致歉，強調近期事件造成部分消費者的不安與疑慮，感到萬分抱歉；他們會持續以積極負責的態度面對相關問題，並盡最大努力處理每一個顧客所提出的疑慮，同時發布三點聲明。一、目前我們已主動配合檢警進行調查，相關影像Log亦已送請專業單位進行復原。相關影像並非無故刪除，而是基於部分顧客對個人隱私及影像留存之疑慮，在接獲需求後進行處理，後續所有相關資料亦將提供檢警，以利後續調查與釐清。二、所有聖宜顧客對於既有課程無論有無爭議，歡迎親至原購買分店，診所會在完成身份確認後，當天立即辦理現金退款。三、近期事件造成第一線服務同仁承受極大壓力，過程中若有說明不完整、用詞不夠妥適，或行政流程上出現疏漏，導致消費者感受不佳，我們致上誠摯歉意，聖宜服務顧客的心永遠不變，也歡迎隨時撥打客服專線0800-588-161，將由總公司指派專人協助處理與回覆。聖宜醫美診所今發表聲明致歉。（取自聖宜醫美診所臉書）    ,https://news.ltn.com.tw/news/society/breakingnews/5432053
