Title,News_Type,date,content,url
計畫拍賣納粹大屠殺文物引公憤 德國拍賣行取消活動,國際,2025/11/17 10:28,在遭到納稅大屠殺倖存者的投訴後，德國取消了大屠殺文物拍賣會。圖為達浩集中營紀念館內的大衛之星。（美聯社）波蘭外交部長西科爾斯基（Radoslaw Sikorski）16日表示，在遭到納稅大屠殺倖存者的投訴後，德國取消1場令人反感的大屠殺文物拍賣會。根據《衛報》（The Guardian）報導，西科爾斯基在X上轉達德國外交部長瓦德福（Johann Wadephul）的意思。西科爾斯基稱他和瓦德福一致認為必需防止此類醜聞發生。請繼續往下閱讀...在拍賣會取消的消息宣布前，納粹大屠殺倖存者呼籲德國費爾茲曼（Felzmann）拍賣行取消將在今（17）日舉行的拍賣會。該拍賣行16日上午還在其網站列出拍賣訊息，但相關訊息到下午就消失了。《德國新聞社》（dpa）稱，該拍賣會名為「恐怖體系」（the System of Terror），本預定在德國杜塞爾多夫（Düsseldorf）附近的諾伊斯（Neuss）舉行。拍賣會預計將有超過600件踏圖商相關文物亮相，其中包括德國集中營囚犯寫給家人的信件、蓋世太保索引卡片等。總部位於德國首都柏林的倖存者團體國際奧斯維辛委員會（Auschwitz Committee）執行副總裁霍伊布納（Christoph Heubner）指出，對被納粹迫害倖存者來說，此拍賣會是厚顏無恥的行徑，令他們感到憤怒和無語。霍伊布納強調，倖存者和受害者的歷史以及苦難，被用於牟取商業利益。他聲稱，委員會敦促費爾茲曼拍賣行負責人展現一些基本道德感，將該拍賣會取消。熱門賽事、球星動態不漏接    ,https://news.ltn.com.tw/news/world/breakingnews/5248385
厄瓜多巴士翻覆山坡 至少12死10傷,國際,2025/11/17 10:22,厄瓜多巴士從山坡上翻覆，至少造成12死10傷。（圖擷自「@CuencaPlay」帳號）厄瓜多中部西米亞圖格（Simiatug）地區，16日發生巴士從山坡翻覆的意外，至少造成12人死亡、10人受傷，詳細原因還有待後續調查。據《BNO News》報導，事故地點位於安巴托（Ambato）至瓜蘭達（Guaranda）的公路上，目擊者透露巴士從1000英尺（約305公尺）高的山坡翻覆下來。請繼續往下閱讀...從社群媒體上的影片可以看到，這輛巴士翻滾時差點撞到一處民宅，山坡上到處散落著從巴士內甩出來的物品，當局獲報後立即派出消防隊和醫療人員前往救助。熱門賽事、球星動態不漏接    ,https://news.ltn.com.tw/news/world/breakingnews/5248374
日本官員赴北京協商 預計將重申「台灣有事」立場、要求處置薛劍,國際,2025/11/17 10:17,政府人士透露，日本政府已派遣外務省亞洲大洋洲局局長金井正彰訪問中國，將針對首相高市早苗在國會關於「台灣有事」的答辯內容和中方協商。圖為高市早苗。（法新社）日本首相高市早苗日前針對「台灣有事」發言，引起中國不滿，日中雙方也在外交上展開交鋒。日本政府人士透露，日本政府已派遣外務省亞洲大洋洲局局長金井正彰訪問中國，將針對首相高市早苗在國會關於「台灣有事」的答辯內容和中方協商。綜合日媒報導，政府相關人士指出，外務省亞洲大洋洲局局長金井正彰已在今日（17日）訪問中國北京，並於18日與中國外交部亞洲司長劉勁松等人會談，並說明高市早苗在國會的答辯內容並未改變日本一貫立場，並向中方轉達，即使雙方存在立場差異，也應該避免影響民間交流等看法。請繼續往下閱讀...另一方面，先前中國駐大阪總領事薛劍在網路上發表激進言論，金井正彰將再度對中國強烈抗議，並在朝野要求日本政府將薛劍驅逐出境的背景下，強調日方要求中方對此做出適當處置應對。熱門賽事、球星動態不漏接    ,https://news.ltn.com.tw/news/world/breakingnews/5248353
沖繩市長涉9起性騷 面臨第2次不信任案自行下台,國際,2025/11/17 10:05,日本沖繩縣南城市市長古謝景春涉嫌9起性騷，議會今將展開第2次不信任案表決，讓他決定先行辭職。（圖擷自古謝景春後援會臉書）日本沖繩縣南城市市長古謝景春，對市府職員犯下9起性騷擾案，包括親吻、摸大腿、強行握手等等，今（17日）將面臨議會第2次投票表決不信任案，由於肯定會獲得通過，古謝景春已先行提出辭職。據《沖繩時報》報導，古謝景春在性騷醜聞纏身後，議會於9月26日通過不信任案，雖然古謝景春10月16日出手解散議會避免下台，但11月9日議員改選時，屬於市長派的4名參選人只有2人當選。請繼續往下閱讀...南城市新議會今天的第2次不信任案若無意外將會通過，一旦完成表決後，古謝景春無法再次解散議會而是會被迫下台，對此他決定提前辭職。古謝景春將可獲得按任職天數比例計算的退休金、獎金以及88萬日圓（約新台幣17.6萬元）月薪。按照《公職選舉法》規定，南城將在50天內選出新市長，從日期來看必須要在明年1月6日前舉行。假如古謝景春參選並當選，那麼他只能做完自己辭職前的任期，亦即明年2月11日就得卸任；若是其他參選人當選，則可以做完4年任期。熱門賽事、球星動態不漏接    ,https://news.ltn.com.tw/news/world/breakingnews/5248315
福特號航艦進駐加勒比海 川普稱美可能與委內瑞拉總統討論,國際,2025/11/17 09:43,"美國總統川普表示，美國可能與委內瑞拉總統馬杜羅進行一些討論。（路透）美國總統川普16日表示，美國可能與委內瑞拉總統馬杜羅進行一些討論。與此同時美國「福特號」航空母艦（USS Gerald R. Ford）抵達加勒比海，讓美國進一步加強在委內瑞拉附近的軍事存在。根據《美聯社》報導，川普16日談到可能與馬杜羅進行討論，但未透露可能會討論的細節，僅稱委內瑞拉方面希望對話。請繼續往下閱讀...當記者詢問馬杜羅希望對話是什麼意思時，川普回說「什麼意思？你告訴我，我不知道。（What does it mean? You tell me, I don’t know.）」幾分鐘過後，川普補充說「我會和任何人對話。我們拭目以待。」與此同時美國海軍在聲明中宣布，「福特號」航艦和其他軍艦抵達加勒比海，標誌著美國政府禁毒行動的重要階段，但外界普遍認為這是對馬杜羅不斷升級的施壓策略。「福特號」航艦到達加勒比海，標誌著美國完成在該地區大規模軍事集結。除了該航母外，「南方之矛行動」（Operation Southern Spear）還包括近10艘海軍艦艇和約1萬2000名官兵。值得注意的是，美軍大規模集結正值其與千里達及托巴哥舉行聯合演習之際，且該島國距離委內瑞拉最近處僅11公里。千里達及托巴哥官員指出，軍隊已與美軍進行聯合訓練演習，演習將持續近1週的時間。另外委內瑞拉政府尚未對川普稱美國將與馬杜羅進行討論一事做出回應。熱門賽事、球星動態不漏接    ",https://news.ltn.com.tw/news/world/breakingnews/5248329
中國呼籲暫勿前往日本 日航空業者稱「並無具體影響」,國際,2025/11/17 09:41,中國官方呼籲中國公民暫勿前往日本，企圖以旅遊經濟層面向日本施壓。不過日本航空（JAL）及全日空（ANA）16日表示，中方警告未對其業務造成影響。（法新社）日本首相高市早苗日前針對「台灣有事」發言，引起中國不滿，中國官方呼籲公民暫勿前往日本，企圖以旅遊經濟層面向日本施壓。不過日本航空（JAL）及全日空（ANA）16日表示，中方警告未對其業務造成影響。根據日本《NHK》報導，日本國家旅遊局表示，今年1月至9月間，有748萬名中國旅客前往日本旅遊，為所有國家與地區中最多的。而中國外交部14日發表聲明呼籲中國公民暫勿前往日本，試圖反制日本政府。請繼續往下閱讀...不過日本航空及全日空表示，目前中方警告未對其業務造成具體影響，目前也沒有任何飛往日本的航班被取消。相較之下，中國主要航空公司響應外交部政策，中國航空在其官網貼出公告，表示針對往返東京、大阪及其他日本城市的航班採取特殊處置方案，11月15日至12月31日可免費改期，退票則免收手續費。中國東方航空與中國南方航空也發布類似公告。熱門賽事、球星動態不漏接    ,https://news.ltn.com.tw/news/world/breakingnews/5248296
漲價！川普政府取消南韓軍購非經常性費用豁免,國際,2025/11/17 09:09,消息人士16日透露，川普政府今年8月已取消南韓採購美製武器時的非經常性費用豁免政策。（彭博資料照）多名消息人士16日向韓聯社透露，美國政府今年8月已向南韓政府通報稱，決定取消外國軍事銷售（FMS）採購武器時適用的非經常性費用（NRC）豁免政策。政策廢除將對南韓方面造成負擔。韓聯社報導，NRC是指美國軍工企業開發、生產武器時發生的初期研發費用、設計費用、試驗費用等。此前，美國國防部針對滿足部份條件的情況豁免徵收NRC，南韓作為盟國即適用豁免政策，無需支付NRC。請繼續往下閱讀...然而多名消息人士證實，今後南韓政府採購美國武器時，就必須額外承擔NRC。分析人士認為，美方政策變化體現了川普的「交易型同盟觀」，以及其不斷強調「盟國長期與美貿易中累積過多貿易順差」的認知。消息人士稱，豁免政策此前為南韓採購美製武器時節省了約5%左右費用，但政策廢除後，南韓引進美製武器的成本負擔將加重。美韓領導人上月29日在慶州舉行會談，兩國以此為契機商定，南韓截至2030年將投入250億美元（約新台幣7640億元）採購美製軍事裝備。此時廢除豁免政策將對南韓造成相當程度負擔。熱門賽事、球星動態不漏接    ,https://news.ltn.com.tw/news/world/breakingnews/5248273
親赴北京確認？FBI局長：中國承諾限制芬太尼原料已見成效,國際,2025/11/17 08:49,美國聯邦調查局局長巴特爾12日出席白宮記者會。（歐新社資料照）美國聯邦調查局長巴特爾今天表示，相信中國會遵守限制芬太尼前體化學物的承諾。雙方雖然無法百分百達到目標，但目前已看到成果。美國聯邦調查局（FBI）局長巴特爾（Kash Patel）在福斯新聞（Fox News）節目，就中國是否遵守川習會中，對管制芬太尼源頭化學物的承諾指出，相信中方會遵守承諾並已見影響，總統川普（Donald Trump）認為美國必須與中國互動並達成協議。請繼續往下閱讀...他說，美中無法百分百（達到目標），但這可拯救數10萬計美國民眾生命，何樂而不為，目前也已看到成果。中方至少已經承諾限制芬太尼的前端，並依承諾行事。巴特爾8日訪問北京一日，期間會晤中方對口官員，是10多年來首位到訪北京的FBI局長。中國商務部、公安部等單位10日公布規定，將美國、墨西哥、加拿大列入「出口易製毒化學品」管理國家名單。他在白宮記者會表示，中方同意限制芬太尼前體化學物流通，列管13項生產芬太尼的前體化學物與7項化學衍生物。不同於天然物質生產的毒品與上癮性藥物，芬太尼為化學物合成產製的類鴉片藥物，成本較低，劑量不易控制，至今仍是美國藥物過量致死的主要原因，也是川普與中國國家主席習近平會晤的重要議題。美國長期質疑中國輸出的芬太尼前體化學物流入墨西哥、美國、加拿大等地，是致命毒品的前端原料來源。美國疾病管制暨預防中心（CDC）估計，2022與2023年因使用芬太尼致死人數超過7萬人，2024年降至約4萬8000人。熱門賽事、球星動態不漏接    ,https://news.ltn.com.tw/news/world/breakingnews/5248256
畫面曝光！美軍再轟運毒船釀3死 近期21次攻擊已擊殺逾80人,國際,2025/11/17 08:28,"美軍公布在東太平洋攻擊疑似運毒船隻的紅外線影像，畫面中船隻被擊中瞬間爆炸。此類「格殺勿論」式的攻擊，自9月初以來已累計造成超過80人死亡，其合法性備受爭議。（圖翻攝自美國國防部影片）美國在加勒比海地區的軍事行動持續升級。根據英國《衛報》報導，五角大廈證實，美軍「南方之矛」聯合特遣隊於14日在東太平洋國際水域，再次攻擊一艘疑似運毒船隻，造成船上3人死亡。此舉發生在美軍「福特號」航空母艦打擊群駛入加勒比海之際，其數代以來最大規模的火力集結，引發外界對其真實意圖的質疑。美國南方司令部在社群媒體上發文稱，「情報證實該船隻涉及非法毒品走私，正沿著已知的販毒路線航行，並載有毒品」。這是自今年9月初以來，美軍對運毒船隻已知的第21次攻擊，根據五角大廈的數據，這些攻擊已造成超過80人死亡。請繼續往下閱讀...然而，美軍採取直接攻擊而非登船逮捕的作法，已引發美國國會議員、人權團體及部分盟友對其合法性的質疑。川普政府堅稱擁有執行此類打擊的法律授權，但並未公開解釋為何選擇攻擊而非逮捕。與此同時，美國海軍宣布，其最先進的核動力航空母艦「福特號」（USS Gerald R. Ford）已於15日抵達加勒比海。隨著「福特號」及其護航艦隊的到來，「南方之矛」行動的總兵力已包括近12艘海軍艦艇與約1萬2000名官兵，構成美國在該地區數代以來最大規模的火力集結。打擊群指揮官藍齊洛塔少將（Paul Lanzilotta）表示，此舉將增強美軍戰力，以「保護我國安全與繁榮，對抗西半球的毒品恐怖主義」。美軍的大規模集結，正值其與千里達及托巴哥舉行聯合演習之際，該島國距離委內瑞拉最近處僅11公里。千里達及托巴哥政府稱演習旨在應對國內犯罪，並否認是針對委內瑞拉的行動前奏。然而，委內瑞拉政府已將美軍在該國的演習描述為「侵略行為」，並宣布將啟動「大規模動員」作為回應。美國總統川普曾表示，他相信委內瑞拉總統馬杜羅（Nicolás Maduro）的時日無多，並稱對委內瑞拉的「地面打擊」是可能的。CNN也曾報導，川普已聽取了在委內瑞拉境內採取軍事行動的選項簡報。美委雙方在加勒比海同步強化軍事部署，已引發外界對可能爆發更大規模衝突的擔憂。On Nov. 15, at the direction of Secretary of War Pete Hegseth, Joint Task Force Southern Spear conducted a lethal kinetic strike on a vessel operated by a Designated Terrorist Organization. Intelligence confirmed that the vessel was involved in illicit narcotics smuggling,… pic.twitter.com/iM1PhIsroj— U.S. Southern Command （@Southcom） November 16, 2025 On Nov. 15, at the direction of Secretary of War Pete Hegseth, Joint Task Force Southern Spear conducted a lethal kinetic strike on a vessel operated by a Designated Terrorist Organization. Intelligence confirmed that the vessel was involved in illicit narcotics smuggling,… pic.twitter.com/iM1PhIsroj熱門賽事、球星動態不漏接    ",https://news.ltn.com.tw/news/world/breakingnews/5248278
疑似遭熊襲擊 日本秋田縣老婦負傷陳屍農地,國際,2025/11/17 07:26,警方昨日在秋田縣鹿角市一處農田中發現一具老婦遺體，疑似遭熊襲擊而死。（歐新社）日本今年「熊害」頻傳，位於日本東北的秋田縣是熊害「重災區」，16日除了在該縣能代市有熊闖入「永旺」（Aeon）商場，下午在鹿角市花輪地區的一片農地中發現一具老婦遺體，由於身上出現多處傷痕，疑似遭到熊攻擊後身亡，目前當地警方正在持續調查。綜合日媒報導，16日下午3點30分左右，鹿角市警署接獲通報稱在鹿角市花輪地區一處農地中，發現一名高齡女性倒地，警方到場確認後發現老婦已身亡。請繼續往下閱讀...現場調查發現，女性的頭部、雙腿等部位有多處疑似被咬傷或抓傷的痕跡，警方認為她可能遭到熊的襲擊，正著手調查老婦身分。熱門賽事、球星動態不漏接    ,https://news.ltn.com.tw/news/world/breakingnews/5248241
中國客變少了！泰國政府急振興觀光 民眾卻覺得「挺好的」,國際,2025/11/17 07:24,泰國今年以來的中國觀光客銳減，但部分泰國人對此不以為意，甚至認為中國遊客變少「其實挺好的」。（歐新社檔案照）首次上稿 06:18更新時間 07:24針對日本首相高市早苗的「台灣有事」發言，中國政府呼籲公民近期避免前往日本，企圖藉此向日方施壓。而在一連串因素導致泰國今年以來的中國觀光客銳減後，儘管曼谷當局強調將全力振興觀光業，但部分泰國人對中國遊客減少不以為意，甚至認為中國遊客變少「其實挺好的」。請繼續往下閱讀...中央社16日報導，從中國演員王星在泰國拍戲時遭綁架，到緬甸地震及泰國和柬埔寨邊境爆發流血衝突等安全因素，讓中國觀光客對泰國卻步。泰國媒體報導，越南已取代泰國成為中國遊客新寵，泰國可能因此損失35億美元（約1075億台幣）。泰國觀光局預計，今年來泰國旅遊的國際觀光客人次約3340萬人次，比去年下降6％。今年上半年中國遊客赴泰人數大幅下降至226萬人次，比去年同期下降34％。泰國中央銀行預估，2025年全年赴泰的中國遊客人次約500萬，比去年減少近30％。報導指出，面對中國遊客銳減，政府和民間態度迥異，相對於政府的憂心，民間感受可能是「鬆一口氣」，因為泰國社會近年來對中國影響力日漸複雜的情緒，從早期親近與仰賴，逐漸轉為戒慎與懷疑。計程車司機普恩（Pun）便向中央社記者直言，「我們泰國人其實不太喜歡中國遊客，因為他們常做一些灰色地帶的交易，常遊走法律邊緣，我很討厭那樣」。普恩表示，中國觀光客過去偏好奢華消費，如今來旅遊的人多半是重視文化與體驗的自由行客群，他更歡迎這類遊客。當地旅遊業者表示，除了部分中國遊客或團體被指涉非法行為，一些泰國商家也抱怨，中國廉價商品與「低價購物團」行程，侵蝕生意空間，使他們對中國人的印象愈趨負面。近年中國人在泰國犯罪的案件時有耳聞，雖多屬個案，但經社群媒體放大後，逐漸強化中國人與「灰色產業」掛鉤的印象。雖然不少泰國人對中國投資抱持正面期待，但都會區的民眾對中國影響力的擔憂正在上升。繼中國外交部14日「提醒」中國公民近期避免前往日本後，中國文化和旅遊部16日也跟進，提醒中國遊客近期避免前往日本旅遊，並呼籲已在日本的中國遊客「密切關注當地治安形勢，提高安全防範意識，加強自我保護」。熱門賽事、球星動態不漏接    ,https://news.ltn.com.tw/news/world/breakingnews/5248226
反制高市早苗挺台》中國再炒「琉球地位未定論」 挑撥沖繩與中央關係,國際,2025/11/17 06:26,中國媒體再次炒作「琉球地位未定論」，試圖以戰爭威脅，分化沖繩與中央政府的關係。（歐新社檔案照）首次上稿 11-16 23:38更新時間 11-17 06:26在日本首相高市早苗的「台灣有事」發言後，日中關係再次緊張，除官方呼籲民眾避免前往日本，中國媒體也大打輿論戰，從軍方發表殺氣騰騰的文章，到引述台灣政治人物和日本國內的反對言論，一直延伸到再度炒作「琉球地位未定論」，試圖以戰爭威脅，分化沖繩與中央政府的關係。請繼續往下閱讀...有「中國日報」背景的「起底工作室」14日發布影片，強調琉球曾與中國維持長達500年的宗藩關係，其後遭日本併吞，但「開羅宣言」、「波茨坦公告」等文件明確限定日本領土僅限4大島，「琉球法律地位一直都是未定狀態，根本不是日本人聲稱的固有領土。」影片聲稱訪問1名沖繩人，該名受訪者聲稱，沖繩自古以來就是獨立國家，名為琉球，被中國、朝鮮、東南亞、美國、法國、荷蘭，甚至日本，都承認為主權獨立國家，但日本在1879年違背琉球人民意願，入侵併吞琉球，強行將其改名為沖繩縣，「這就是日本殖民琉球的開始」。該名受訪者又說，2次世界大戰期間，日本在琉球部署軍事力量，導致沖繩戰役爆發，1945年有3分之1的原住民被殺害，「幾乎每個琉球家庭都在那一年失去了親人」。對於高市關於台灣的言論，該名受訪者說，大多數沖繩人認為，高市的鷹派立場與前首相安倍晉三非常類似，她的台灣言論「幾乎等於對中國宣戰」，沖繩人對此非常擔心，因為一旦中日開戰，駐沖繩的日本軍力肯定成為首要打擊目標，將為沖繩再次帶來災難。中國社群平台「微信」公眾號「華山穹劍」則在15日發布影片，翻出10月9日中國駐聯合國副代表孫磊在聯大會議上敦促日本「停止對沖繩人等原住民的偏見與歧視」，聲稱這是中國首次界定沖繩原住民，「琉球棋局下得太妙」，還說在當時「引發日本方面強烈反應」。冲繩距離台灣不到750公里，境內有近3萬美國駐軍，預期將在「台灣有事」時，在日本自衛隊支援下扮演關鍵角色。「華山穹劍」12日發布的1篇文章還警告，若日本執意挑戰中國核心利益，中國完全有權利依據國際法，重新提出琉球地位問題。英國「每日電訊報」（Daily Telegraph）今年1月曾報導，北京正試圖透過宣傳、外交行動等途徑「無聲入侵」冲繩，為未來可能的犯台行動，預先鋪陳有利的政治和軍事形勢，手段之一就是挑撥冲繩當地居民與日本中央政府的爭端，包括渲染在地經濟問題，以及炒作日本兼併琉球等歷史恩怨。中文社群媒體也出現許多宣傳影片，聲稱多數冲繩居民支持獨立。熱門賽事、球星動態不漏接    ,https://news.ltn.com.tw/news/world/breakingnews/5248211
