Title,News_Type,date,content,url
出席許信良新書發表會 吳志揚：台灣應助中國民主化,政治,2025/11/19 16:49,許信良今天下午在台大醫院國際會議中心舉辦桃園中壢事件48周年紀念暨「天命」新書發表會，歷屆桃園縣市長包含國民黨籍的吳伯雄、朱立倫、吳志揚，以及民進黨籍前桃園縣代理縣長許應深應邀與會。（記者李文馨攝）前桃園縣長吳志揚今天受邀出席民進黨前主席許信良的新書發表會，他致詞時表示，現在是兩岸應該互相幫忙的時候，台灣的經濟不能沒有對岸，而台灣的使命要幫助（中國）大陸民主化、幫中國融入世界秩序，「他不融入的話，再強都沒有用，永遠跟一堆人為敵。」許信良今天下午在台大醫院國際會議中心舉辦桃園中壢事件48週年紀念暨「天命」上冊新書發表會，歷屆桃園縣市長包含國民黨籍的吳伯雄、朱立倫、吳志揚，以及民進黨籍前桃園縣代理縣長許應深應邀與會。許說，鄭文燦因憂心模糊簽書會焦點因此並未出席。請繼續往下閱讀...吳志揚表示，桃園是一個出好縣長的地方，桃園沒有分黨派，不同黨派只有在選舉的時候說「歹勢」，事後還是很會疼惜彼此的人才，他在桃園覺得非常幸福。什麼事件黨派不重要，人格很重要，人格不好再哪個黨都會被討厭。「台灣、桃園有不一樣的天命。」吳志揚說，台灣歷史的演變，很巧妙的把東方的中華文化留下來，在華人世界中，只有台灣真正接受西方的民主制度，而且實踐的非常好。而桃園發生中壢事件，讓桃園也是民主聖地，實現非常多次的政黨輪替，讓桃園成為民主、繁榮、和諧的地方。吳志揚認為，如果台灣有共識，可以跟對岸取得一定程度的理解，現在兩岸應該是要互相幫忙的時候，「全天下已經夠亂了，大家不要再亂了」。他說，台灣的經濟不可能沒有對岸，如何讓經濟體制結合，確保經濟不會停滯；台灣的使命要幫助大陸民主化，因為台灣有華人走近民主政治的經驗，我們幫中國大陸融入世界秩序，「他不融入的話，再強都沒有用，永遠跟一堆人為敵。」熱門賽事、球星動態不漏接    ,https://news.ltn.com.tw/news/politics/breakingnews/5251334
彰化文雅牧場1萬顆蛋流入新北 市議會民進黨團籲成立食安處,政治,2025/11/19 16:44,市議會民進黨團今（19）日指出，中部農產品事件接連外溢，新北始終處在資訊落後、補破網處境，籲市府成立「食品安全處」。（記者黃子暘攝）彰化縣衛生局通知新北市府，被驗出芬普尼超標的彰化縣文雅畜牧場有50籃（1萬顆）雞蛋被轉售給新北市蛋行，新北已將27籃退回上游，23籃（4600顆）已售出。市議會民進黨團今（19）日指出，從台中非洲豬瘟開始，中部農產品事件接連外溢，新北始終處在資訊落後、補破網處境，新北衛生局只有65人要同時負責醫政、藥政、食品、菸害、營業衛生等多項業務，呼籲市府成立「食品安全處」，以更大的預算、人力規模保護食安。衛生局回應，市府建置府層級食安五環管理平台，由秘書長主持跨局處合作，包含衛生局、農業局、教育局、環保局、經發局、警察局與法制局等協力維護食安，市府也每2個月定期召開「食品安全會報」，會議主席由市長擔任，並以衛生局擔任主政局處，以強化跨局處合作反應，並共同研商新北市食品安全衛生管理相關因應措施。請繼續往下閱讀...黨團總召集人廖宜琨、副召蘇錦雄表示，面對雞蛋問題，新北仍要仰賴外縣市通知才啟動回收，顯示新北面對跨縣市食安問題始終無法掌握主動權；新北2018年就通過「食品安全衛生管理自治條例」，對從業人員教育訓練、源頭監控都有明確規範，但執行單位至今仍只有衛生局，儘管今年稽查人力從去年的31名增至65名，但龐雜業務仍讓食安量能受限，盼藉由食安處成立，讓食安工作常態化、專業化，而不是每次出事才臨時動員。幹事長山田摩衣、書記長顏蔚慈說，市府應主動提供明確、可行的健康指引，比如芬普尼若攝入過量可能出現什麼不適症狀，以便民眾提高警覺、即時就醫，資訊越透明，民眾就越不會恐慌；中部農產品一再出現問題，新北卻要等外縣市通報才倉促行動，連基本的風險預警、進貨量比對、跨縣市資料連動都沒有建立。熱門賽事、球星動態不漏接    ,https://news.ltn.com.tw/news/politics/breakingnews/5251328
台灣電網「已開發國家中最脆弱」!美退將示警: 中國若封鎖恐危及全球經濟,政治,2025/11/19 16:39,德國在台協會處長狄嘉信（Karsten Tietz）（左一）、德國核子科技協會理事長湯馬士賽波特（Thomas Seipolt）（右二）、前美國雷神公司台灣區總經理、前美國國防部官員 胡振東（Tony Hu）（右一）19日參加「能源獨立與國家韌性論壇」座談，並與保衛民主基金會高級研究員蒙哥馬利（Mark Montgomery）少將（螢幕中）錄影連線。（記者劉信德攝）美國退役海軍少將蒙哥馬利（Mark Montgomery）今（19日）指出，「台灣有已開發國家中最脆弱的電網」，只要中國以各種管道成功攔截運載能源的船隻，台灣就可能面臨電網停擺的窘境，若中國試圖封鎖台灣電網，對台造成斷電危機，台灣甚至全球經濟都將面臨挑戰。社團法人台灣人間魚詩社文創協會今日下午舉辦「能源獨立與國家韌性論壇」，邀請德國在台協會處長狄嘉信（Karsten Tietz）、德國核能科技協會理事長湯馬士賽波特（Thomas Seipolt）、前美國國防部官員胡振東（Tony Hu）與會，捍衛民主基金會（FDD）高級研究員蒙哥馬利則線上發言。請繼續往下閱讀...蒙哥馬利指出，當兩岸發生衝突時，中國可能會瞄準台灣的金融、通訊、能源三大面向，當中重點將會放在能源；台灣有多達95%能源仰賴進口，其中近5成能源來源為液化天然氣，而液化天然氣需要由卡達、澳洲、美國等少數國家經海運進口，他沒有看過任何島國像台灣一樣如此依賴外部能源。蒙哥馬利示警，由於天然氣運輸需要航經複雜的航道咽喉點，且大部分會航經台灣海峽，中國可能運用外交手段施壓卡達等國對台禁運，也有可能攔截行經台灣海峽的船隻，台灣每年靠岸的運載能源船隻約有350艘，中國若能攔下其中10至15艘，台灣就可能面臨天然氣完全耗盡、電網停擺的窘境。蒙哥馬利認為，台灣有已開發國家中最脆弱的電網，台灣電網使用率相當高，目前約為75%，是因為過去30年間的製造業爆炸性成長，且當年國家領導人未能做好妥善能源規劃，他指出，若中國試圖封鎖台灣電網，對台造成斷電危機，台灣甚至全球經濟都將面臨挑戰。蒙哥馬利表示，認知到中國政府能源封鎖的可能性相當重要，美國可以開始提供協助，例如派遣海軍護送天然氣船等，也可以與台灣建立海上資訊共享中心，創建天然氣運輸航道，他認為，台美日都應致力於台灣的經濟及能源活力。狄嘉信表示，經濟體依賴化石燃料會面臨極大的問題，他舉德國為例，德國過往高度仰賴俄羅斯販售的能源，因此在烏俄戰爭爆發後，半數能源進口被俄羅斯切斷，導致能源價格大幅上漲，德國不希望重蹈覆徹。德國於2023年關閉最後三座核電廠，不再使用核能發電，但在逐步淘汰核能發電的過程中，遇到烏俄戰爭爆發，帶動天然氣等能源價格大漲。狄嘉信認為，唯一的解決方式就是離開化石燃料，達到「能源獨立」，並指出，核能與再生能源在德國都被稱為「自由能源」，不需要仰賴他們的慷慨，以期達成德國2035年碳中和的目標。熱門賽事、球星動態不漏接    ,https://news.ltn.com.tw/news/politics/breakingnews/5251321
許信良新書發表 吳伯雄讚「心存善念」：雙方做決策不會有大罷免,政治,2025/11/19 16:38,前民進黨主席許信良今天下午在台大醫院國際會議中心舉辦桃園中壢事件48周年紀念暨「天命」上冊新書發表會。（記者田裕華攝）國民黨前主席、桃園縣前縣長吳伯雄今天受邀出席民進黨前主席許信良的新書發表會，他致詞大讚許信良「心存善念」，在中壢事件發生後，很快就跟許「恢復邦交」；談及大罷免，吳伯雄打趣地說，若一年多前讓許信良做決策，「大概不會發起大罷免」，如果是他也不會發起反罷免。許信良今天下午在台大醫院國際會議中心舉辦桃園中壢事件48周年紀念暨「天命」上冊新書發表會，歷屆桃園縣市長包含國民黨籍的吳伯雄、朱立倫、吳志揚，以及民進黨籍前桃園縣代理縣長長許應深應邀與會。許說，鄭文燦因憂心模糊簽書會焦點因此並未出席。請繼續往下閱讀...許信良致詞表示，現在民主政治最難克服的困難是，主要政黨都想把自己「絕不妥協」的信仰，當做國家的基本立場，互相敵對、互不相讓，在正常的民主政治中，政黨當然會競爭，但絕非你死我活的鬥爭。他提到，1996年，他第二度當選民進黨主席的時候，「夜奔敵營」就是時任國民黨秘書長吳伯雄所做的安排，促成前總統李登輝同意政黨補助制度，讓現在的主要政黨包含國民黨都受惠。吳伯雄表示，許信良是「心存善念」的一個人，對他有仇恨感很難。很多人質疑中壢事件後他們兩個人仍處敵對立場，但其實40年前他跟許就「恢復邦交」了。他說，當年許信良選舉時，他一看就知道這一仗無役可敵，而且許的班底該狠的狠、該軟的軟，他給予高度評價，輸的心服口服。吳伯雄也打趣地說，許信良有愛心、沒有仇恨，值得學習，若一年多前讓許信良做決策時，大概不會發起罷免運動，如果他做決策的話，他大概也不會發起反罷免，「搞得好慘喔」，同樣鄰居互相怒視，「吃飽太閒」。朱立倫回憶，48年前他是建國中學高二的學生，曾自願擔任許信良的助選員到處拉票，甚至在班刊上寫了一篇桃園縣長之評析的文章，把許所受提名的委屈、輔選的過程到中壢做票事件寫出來，他為此還被叫到訓導處；他笑稱：「如果我被記了大過，我可能已經當過民進黨主席了。」許信良則說，國民黨若要找總統，最好的人選就是朱立倫，希望朱不要放棄他的夢，盼有一天能實現。前民進黨主席許信良舉辦桃園中壢事件48週年紀念暨「天命」新書發表會，會中並與前國民黨主席吳伯雄、朱立倫及前桃園縣長吳志揚一同合影。（記者田裕華攝）熱門賽事、球星動態不漏接    ,https://news.ltn.com.tw/news/politics/breakingnews/5251318
迎戰鍾東錦！民進黨選對會：徵召陳品安參選苗栗縣長,政治,2025/11/19 16:23,民進黨選對會今開會決議，建議徵召苗栗縣議員陳品安參選苗栗縣長。（資料照）民進黨佈局2026年地方選舉，選對會今（19日）開會決議，建議徵召苗栗縣議員陳品安參選苗栗縣長，迎戰尋求連任的國民黨籍苗栗縣長鍾東錦，待中執會確認後進行提名。民進黨選對會今天下午召開會議，據發言人吳崢轉述，選對會達成共識，建議中執會在苗栗縣徵召陳品安，代表民進黨參加2026苗栗縣長選舉。請繼續往下閱讀...媒體詢及，傳出擬由立委劉建國再戰雲林縣長？吳崢僅回應，「還在討論當中。」此外，選對會日前已拍板，建議徵召立委蘇巧慧參選新北市長。據了解，民進黨26日將召開中執會，預計將一併完成蘇巧慧及陳品安的提名程序。陳品安是律師出身，台灣大學財務金融學系管理學學士、科際整合法律學研究所法學碩士畢業，律師高考及格。2018年參選通苑選區縣議員，初試啼聲就當選，2022年選舉更獲該選區第一高票連任，當年也曾擔任民進黨苗栗縣長候選人徐定禎競選總部發言人。熱門賽事、球星動態不漏接    ,https://news.ltn.com.tw/news/politics/breakingnews/5251301
藍白黨魁會談 鄭麗文：今天是台灣民主發展新里程碑,政治,2025/11/19 16:21,鄭麗文在致詞時表示，今天是台灣民主發展迎來展新的里程碑，希望從今開始在民主政黨合作上面，從國會合作擴大深化到地方自治與選舉。（記者王藝菘攝）首次上稿15:44更新時間16:21（補充鄭麗文說法）國民黨主席鄭麗文今日下午率黨務幹部與民眾黨主席黃國昌舉行「以行動顧台灣」兩黨黨魁高峰會談，鄭麗文在致詞時表示，今天是台灣民主發展迎來展新的里程碑，希望從今開始在民主政黨合作上面，從國會合作擴大深化到地方自治與選舉，這也是在國際民主政黨合作史上重要的創舉，她期許未來的地方選舉能讓最好團隊、最強人選以及最符合人民期待的候選人順利當選，而且要發揮1+1大於2，在藍白合作過程中，因為良性競爭，使得每一個為民服務的政治人物能展現長才，也要因為藍白合作，可以全方位無死角，長短互補，讓人民受益。請繼續往下閱讀...鄭麗文說，兩黨除了要用行動來顧台灣，堅持中華民國的立國核心價值，民有、民治、民享，也要創造共享財富，並且兼顧分配正義，今天台灣民主自由法制的社會得來不易，但今天賴清德總統主政下，讓大家擔心幾10年來的辛苦可能會毀於一旦。鄭麗文表示，除了延續國會合作，捍衛憲政民主，照顧民生經濟，讓弱勢基層得到照顧，藍白兩黨還有全新的挑戰，財劃法修正案就凸顯執政黨蔑視地方自治，如何確保最好的人選與團隊在明年選舉可以當選，都是接下來在野黨必須專注努力的方向，她今天就是好的開始，可以讓國際社會看到藍白兩黨的堅持，對台灣未來的民主可以更正向發展。熱門賽事、球星動態不漏接    ,https://news.ltn.com.tw/news/politics/breakingnews/5251216
批王惠美一皮天下無難事 張育萌：無能豬隊友搞到全台連滾帶爬,政治,2025/11/19 16:18,彰化縣長王惠美。（資料照）被驗出芬普尼超標的彰化縣文雅畜牧場，經彰化縣衛生局通知新北市衛生局，該畜牧場有50籃共1萬顆雞蛋轉售給新北市蛋行。對此，台灣青年世代共好協會理事長張育萌痛批，王惠美到底還怎麼有臉說「希望畜牧場記取這次教訓」。真的是一皮天下無難事，最該記取教訓的就是神隱縣長王惠美。張育萌在臉書PO文表示，彰化又出包，萬顆問題蛋再流入新北，彰化縣府已經失能到匪夷所思的地步，彰化的畜牧場驗出雞蛋農藥超標，結果，下令移動管制期間，彰化縣府直接裝睡4萬顆問題蛋被偷賣到台中梧棲，3萬顆已經被民眾買走吃光光，盧秀燕已經不管彰化是同黨執政了，昨天爆料「不只流入台中市，其他縣市還有」。短短幾個字，讓人頭皮發麻，最可怕的事還是發生了。請繼續往下閱讀...張育萌指出，從頭到尾，王惠美就是神隱和扯謊。眼看事跡敗露，彰化衛生局才坦承，10天前有一萬顆蛋流入新北新莊，我的老天呀，王惠美這種豬隊友，從盧秀燕到侯友宜，直接對同黨發動無差別攻擊，一個鎖住蛋場就可以解決的事，被無能的縣長搞到全台灣都匆匆忙忙、連滾帶爬，全台灣一起陪彰化玩支援前線，一萬顆蛋流入新北，新北衛生局出動看能攔截多少，用力攔下了5400顆，漏掉的4600顆呢？沒辦法，早餐店和雜糧行買走了，民眾已經陸續吃進肚子裡。張育萌續指，原本偷賣到台中的問題蛋，有7600顆是台中衛生局主動出擊，查到就攔截下架；還有2600顆是靠檢調搜索，查出之後追回銷毀，「移動管制」就是管好畜牧場的蛋，一顆都不能拿出場，好想問王惠美，請問彰化縣府到底是哪個字看不懂？現在真相大白了，11月8日，彰化縣動防所打電話給畜牧場，口頭告訴牧場說「解除移動管制」，可以這樣嗎？不發書面公文，一通電話打去告訴牧場，可以解除管制？結果，兩天後，縣府自己採驗牧場的雞蛋，又驗出違法農藥。張育萌分析，原來彰化縣府從頭到尾就在不懂裝懂，大玩兩面手法，可惜，現在發現已經來不及了，彰化問題蛋搞到像星火一樣，遍地延燒超過兩週。那王惠美是什麼時候下令933個畜牧場全面啟動雞蛋檢驗？就是11月17日。張育萌直言，王惠美到底還怎麼有臉說「希望畜牧場記取這次教訓」。真的是一皮天下無難事，最該記取教訓的就是神隱縣長王惠美。熱門賽事、球星動態不漏接    ,https://news.ltn.com.tw/news/politics/breakingnews/5251044
中國禁止日本水產進口 陸委會酸：後續要接受九二共識？,政治,2025/11/19 16:16,陸委會副主委沈有忠。（資料照）日本首相高市早苗「台灣有事說」引發中國大動作反制，不只駐大阪總領事薛劍嗆聲「斬首」，呼籲中客勿前往日本旅遊，更禁止日本水產進口中國。陸委會副主委沈有忠今日大酸說，後續不知道是不是要日本接受九二共識，承認日本是中國神聖而不可分割的一部分，才恢復交流？高市早苗「台灣有事」日本將行使集體自衛權的發言惹怒中國。近十幾天來，中國外交部、國防部、國台辦、中共官媒、軍媒持續輪番上陣砲轟高市早苗。《人民日報》19日也發布「鐘聲」評論文章，稱高市早苗「毒化中日關係必將自食惡果」。請繼續往下閱讀...針對高市早苗挺台發言遭中國反制一事，沈有忠在Thread發文指出，中國對日本繼觀光制裁、黃海實彈射擊以後，今天又宣布禁止進口水產品，只為了「台灣有事，就是日本有事」這一句話。後續不知道是不是要日本接受九二共識，承認日本是中國神聖而不可分割的一部分，才恢復交流？沈有忠批評，如果沒寫對象是日本，這些新聞根本就是台灣的日常，也早已不是新聞了。今日台灣，明日日本，下一個是？以鄰為壑，煽動民族主義以軍事、經濟手段威嚇他國，都不是一個號稱有悠久文明的大國應該有的手段。這樣做更不會實現民族的偉大復興，只會繼續被視為麻煩製造者。熱門賽事、球星動態不漏接    ,https://news.ltn.com.tw/news/politics/breakingnews/5251289
鄭麗文：藍白合作不是為了位子 而是避免鷸蚌相爭,政治,2025/11/19 16:11,國民黨主席鄭麗文（右）今日下午率黨務幹部與民眾黨主席黃國昌（左）舉行兩黨黨魁高峰會談。（記者王藝菘攝）國民黨主席鄭麗文今日下午率黨務幹部與民眾黨主席黃國昌舉行「以行動顧台灣」兩黨黨魁高峰會談，鄭麗文指出，雖然藍白為不同政黨，各有不同背景與優先價值，但還是可以截長補短，發揮1+1大於2，兩黨不是為了合作而合作，更不是為了位子，而是不要因為遊戲規則，導致鷸蚌相爭，讓劣幣驅逐良幣。鄭麗文指出，兩黨合作要找出一條未來康莊大道，而合作模式既不同於傳統歐洲的內閣制，有一點像法國的雙首長制，也有一點像內閣制精神，要走出台灣獨特的道路，期許兩黨可以在很短的時間內達成政策、選舉共識，透過民主、公平、公開機制，共同推出符合人民期待的人選與政策，贏得選舉。請繼續往下閱讀...此外，鄭麗文痛批民進黨倒行逆施、毀憲亂政，而且無所不用其極，追殺在野力量，媒體全面綠化，司法全面淪陷，讓她與黃國昌身為法律人，悲憤痛心不已，今天在台灣關心政治、參與公共事務竟然要擔心被查水表，擔心被國家機器追殺打壓，民主政治已經倒退到威權統治時期，台灣開始有綠色恐怖幽靈。她強調，身為在野黨的政治工作者，絕對不能灰心喪志，中民進黨的計，落入民進黨的坑，雖然藍白過去合作曾經坎坎坷坷、千難萬險，但今天的台灣處境讓大家不能再懷憂喪志，只打自己心中的小算盤，雙方必須放大胸懷與視角，替未來的在野合作奠定無法摧毀的基石。鄭麗文還說，藍白兩黨為的是大義與大利，她有高度信心雙方合作之路可以禁得起各種挑戰與外來勢力的破壞，而且要做出莊嚴的宣示與許諾，她希望國民黨從上到下的同志，都要有共同的心理準備，而且執政黨只想政治鬥爭與政黨利益，充滿對在野黨的仇恨，台灣人民只能自救，所以在野黨責無旁貸，要扛起執政黨的責任，證明給全世界看，並聚集全台灣的專業力量，幫助台灣弱勢、基層勞工、農民與年輕人，尋找未來出路。熱門賽事、球星動態不漏接    ,https://news.ltn.com.tw/news/politics/breakingnews/5251277
被王世堅讚桃園市長好人選 何志偉：謝謝「從從容容」的鼓勵,政治,2025/11/19 16:09,總統府副秘書長何志偉稍早回應「謝謝世堅委員從從容容的鼓勵」。（圖由何志偉辦公室提供）民進黨布局2026桃園市長選戰，立委王世堅被視為奇兵，被問到是否與總統府副祕書長何志偉上演「堅偉大戰2.0」，王世堅今連忙否認，並稱許何年輕、肯學習、態度謙遜。何志偉稍早也對此回應「謝謝世堅委員從從容容的鼓勵」。王世堅在2024立委提名初選成功挑戰爭取連任的何志偉，如今在2026桃園選戰再掀討論。王世堅今出席民進黨中常會前受訪表示，何志偉規劃參選桃園市長，就自己所知已經有1年之久，相信不只是在行動上深入桃園基層，對未來的參選政見上也一定做了相當多琢磨和準備，所以是很好的人選。王也特別澄清，「從過去就沒有所謂的堅偉大戰，沒有、沒有、絕對沒有，過去的競爭也已經過去了」。請繼續往下閱讀...何志偉下午錄影回應：「謝謝世堅委員從從容容的鼓勵志偉，我們一起尊重黨內決策與安排。」熱門賽事、球星動態不漏接    ,https://news.ltn.com.tw/news/politics/breakingnews/5251278
太子集團大筆置產異常未申報  調查局長點名不動產經紀業、地政士,政治,2025/11/19 16:09,調查局長陳白立備詢時坦言，太子集團購置大筆不動產時，不動產經紀業、地政士均未依規定進行異常通報。（記者陳彩玲翻攝）太子集團利用空殼公司購入大筆不動產洗錢，相關單位竟未通報。立法院今邀集各部會進行專案報告，調查局長陳白立備詢時坦言，全案金管會有做好把關，調查局自2019年起陸續收到銀行提供的異常通報，但在集團購置大筆不動產時，不動產經紀業、地政士均未依規定進行異常申報，已在高檢署舉辦的檢討會議提出此情。金管會今在立法院備詢公布，太子集團與3家銀行有授信往來，主要是有美金定存，用來購買高價標的物，但集團不將定存解除，改用質借方式購屋，並強調3銀行均有盡到申報義務。對此，民進黨立委李坤城質疑，詐團用空殼公司買豪宅難道沒有防制作為？況且地政士若有異常通報，會由內政部管理，相關單位是否能夠將情資串接?請繼續往下閱讀...金管會銀行局長童彥章回應，依洗錢法治法規範，監理機關會要求所轄機構把相關情資統一送到調查局洗錢防制處（FIU），包括地政士也納管，在做大筆不動產買賣出現異常時，要提供相關情資。李坤城聽聞後，不斷地詢問，這次太子集團案買豪宅是否有通報？主責洗錢防制處的調查局長陳白立出面說明，依洗錢防制法規定，除金融機構有申報義務，不動產經紀業、地政士都有申報義務，但太子集團案有大筆不動產買賣異常時，均未收到相關通報。陳白立表示，太子集團案銀行端已盡到該盡的責任，但主嫌利用空殼公司購買多筆豪宅，實務上會經過地政士，應該做KYC，這部分還有精進的空間，10日高檢署就太子集團案進行跨機關討論時，檢察機關也有提出此情，所屬機關已進行討論，調查局未來會再和相關部會提出建議。熱門賽事、球星動態不漏接    ,https://news.ltn.com.tw/news/politics/breakingnews/5251246
