Title,News_Type,date,content,url
本屆聯大總辯論10國為我執言 友邦外長籲UN接納台灣有意義參與,政治,2025/09/30 18:45,我國友邦聖露西亞外長包提斯呼籲，聯合國應接納台灣有意義參與聯合國體系。（圖擷取自聯合國官網）第80屆聯大總辯論於本月29日落幕，本屆共有10國為我國執言，包含9個友邦與理念相近國家捷克。我國友邦聖露西亞外長包提斯（Alva Romanus Baptiste）呼籲，聯合國應接納台灣有意義參與聯合國體系。包提斯重申聖露西亞對多邊主義的承諾，並指出會員國必須在倘不及時遏制，則衝突和戰爭恐將蔓延的地區採取行動降低緊張並解決爭端。請繼續往下閱讀...包提斯表示，聖露西亞再次呼籲聯合國接納台灣有意義地參與聯合國體系，他嚴正聲明，1971年的聯合國第2758號決議並未排除台灣被納入及參與聯合國體系。友邦聖克里斯多福及維尼斯總理德魯（Terrance Michael Drew）表示，第80屆聯大的主題「攜手共進」號召我們想像一個落實包容的世界，將台灣排除在其有能力而且必須貢獻的機構如世界衛生組織（WHO）及國際民航組織（ICAO）之外，削弱了全球共同解決問題的能力。德魯指出，台灣在公共衛生、科技及災害應變領域的貢獻實際且不偏頗，關閉在這些領域合作的大門，將為世界帶來難以承受的風險，台灣海峽不僅僅是地圖上的通道，更是商業及連結人類的生命線。德魯表示，必須籲促冷靜、建議對話、選擇以外交溝通取代衝突對立，無論是在台北還是聖克里斯多福的兩大島間，旅遊、貿易及對話是保護民眾生計的方式。熱門賽事、球星動態不漏接    ,https://news.ltn.com.tw/news/politics/breakingnews/5196042
怪怪的！黃國昌記者會嘴唇、右臉「不自然狂抖」影片曝光,政治,2025/09/30 18:43,黃國昌（圖中）今日現身黨團記者會，回應「狗仔事件」爭議。（記者王藝菘攝）民眾黨主席黃國昌被《鏡報》爆料，疑似指揮狗仔跟監民進黨立委及官員，今日他在記者會中回應此事，並反嗆鏡傳媒才是全台灣養最多狗仔的集團。不過，有網友發現黃國昌回應過程中，嘴唇、右臉頻頻發抖，甚至連拿麥克風的手也在隱隱顫抖，畫面一出引發討論。黃國昌今日現身黨團記者會，回應「狗仔事件」爭議。不過，有網友發現過程中他的表情不自然，頻頻發抖，將畫面拉大後狀況更加明顯，可見黃國昌嘴唇、右臉不斷顫抖，甚至拿麥克風的右手也在顫抖。請繼續往下閱讀...粉專「峰狂打臉94爽」將相關畫面播出後引發網友討論，網友紛紛留言表示：「說謊的人臉皮跟手都會抖是正常的現象」、「心虛？」、「說謊的象徵」；也有網友擔心表示：「顏面失調？」、「小心中風前兆。」另外，粉專也在留言區貼出Google結果，只見AI分析「緊張時，臉部可能出現多種現象，包括臉部表情僵硬⋯⋯甚至全身性顫抖。」AI也提到，部分人眼皮跳動，連同嘴角或整張臉都可能出現不自主抽搐，醫學上稱為面肌抽搐或面肌痙攣，這可能由壓力、疲勞或神經壓迫引起。熱門賽事、球星動態不漏接    ,https://news.ltn.com.tw/news/politics/breakingnews/5195685
藍黨團將提「堰塞湖潰決災後重建條例」草案 卓揆：先用丹娜絲預算最快,政治,2025/09/30 18:27,農業部長陳駿季（左起）、行政院長卓榮泰、政務委員陳金德列席備質詢。（記者羅沛德攝）花蓮馬太鞍溪堰塞湖潰流重創光復鄉，釀18死、6失聯、114傷，立法院國民黨團將提出「樺加沙風災暨花蓮光復堰塞湖潰決災後重建條例草案」。國民黨立委羅智強今質詢時，詢問行政院長卓榮泰是否支持？卓揆表示可先引用丹娜絲及728豪雨災後重建特別條例和預算，是最快最有效率的方式。國民黨團總召傅崐萁今天表示，希望能夠比照莫拉克颱風特別條例，在20天內就能三讀通過「樺加沙風災暨花蓮光復堰塞湖潰決災後重建條例草案」，朝野一同完成，不要再有任何政治的想法和操作，這才是善良美麗的台灣。請繼續往下閱讀...卓榮泰表示，為了早日完成災後重建，以及現在投入災後救災，中央在丹娜絲颱風與728豪雨後的重建條例當中已經把花蓮當作災區，堰塞湖也是在丹娜絲之後所形成的，適用絕對沒有問題，該條例和特別預算絕對可以引用，也最快最有效率。羅智強表示，但農業部長陳駿季卻說經評估沒有立即危險；卓榮泰澄清，陳當時是在說8月12日面對楊柳颱風侵犯時沒有立即的危險，卓也說，若經費不夠（600億），可透過追加預算再增加預算，重建經費還要再詳細的評估，他希望中秋節前先讓大家回復正常的生活。卓榮泰強調，現在用丹娜絲特別條例的預算是最快的。但羅智強表示，雙軌可以並進，丹娜絲的特別預算是在堰塞湖還沒潰堤時編的預算，絕對是不夠的，這兩個災害的屬性不相同。卓榮泰說，他不是完全反對國民黨團所提的方式，而是現在的時間點，政府全力恢復基本生活正常，什麼方式最快，災民得到最快照顧，往這個方向來想。羅智強表示，這次颱風的災嘔有特殊屬性，應該在這個重建條例裡去檢視堰塞湖潰堤問題和未來警示的重要意義，它跟一般的災害重建條例是不相同的。卓榮泰回應，對於堰塞湖造成的災害情況，我們可以來討論。熱門賽事、球星動態不漏接    ,https://news.ltn.com.tw/news/politics/breakingnews/5196031
東區大小里差萬餘人 戶數不均 台中議員籲加速里鄰分家以利災害防救,政治,2025/09/30 18:24,記取花蓮堰塞湖溢流災害殷鑑，中市議員陳雅惠促市府加速分里分鄰。（陳雅惠提供）花蓮堰塞湖溢流造成光復鄉重創及嚴重人員傷亡，台中市議員陳雅惠曝台市里鄰不平衡，大者恆大不分里，市府始終拿不出明確的分里時程表與配套，讓里鄰長服務超載，憂若遇重大災害恐難及時照應，促市府加速分里分鄰。民政局長吳世瑋強調，分里分鄰首重溝通，分里分鄰沒有時程表，市府持續努力。陳雅惠舉東區東信里及樹德里人口已突破1萬，樹義里更衝到1萬6千人，對比東區富台里只有1800多人，積善里不到3千人，差距極大，鄰長也面臨戶數差異大，有的要顧200多戶，有的卻只顧30戶，「里鄰落差過大、資源不均」，不僅行政失衡，也讓基層怨聲載道。請繼續往下閱讀...陳雅惠指出，花蓮這次堰塞湖溢流災害造成重大死傷，萬一台中發生重大災害，需要撤離、安置，像東信里、樹義里這些大里，人口龐大又長者眾多，鄰長人力有限，黃金時間要怎麼確保弱勢能優先撤離，促市府應儘早提出「分里時程表」，訂出人口與戶數門檻，定期檢討、即時調整，並檢討鄰長補助是否與實際工作量相符，避免有人過勞、有人閒置。吳世瑋回應，分里涉及地方高度敏感，首重溝通，若只針對單一里別調整，恐怕難以在議會通過，市府會整體研議，並參考中央「行政區劃法」立法進度，目前沒有進度表。他也強調，各區公所都有撤離計畫，平時也會演練，請市民放心。熱門賽事、球星動態不漏接    ,https://news.ltn.com.tw/news/politics/breakingnews/5196011
菱傳媒狂曝柯案細節?蔡依澄直呼：一群人希望「阿北別出來」的設計,政治,2025/09/30 18:02,前台北市長柯文哲。（記者陳逸寬攝）民眾黨主席黃國昌被爆指揮狗仔跟拍政敵，甚至自家人也不放過。對此，醫師作家蔡依澄表示，前台北市長柯文哲被關這麼久，與民眾黨持續激怒檢調、交保就積極影響同案被告，與到處跟證人會面，還有訴訟時的奇怪策略很有關係，看完今日週刊相關報導後，他直呼：「原來都是一群人希望，讓阿北關到永遠不要出來的設計。」《鏡週刊》今日報導指出，黃國昌指揮狗仔事件牽連者眾多，《菱傳媒》社長陳申青發聲明已經間接承認與黃國昌合作密切，而從柯文哲案爆發後，《菱傳媒》就發出多篇相關獨家新聞。請繼續往下閱讀...蔡依澄今日在粉專「蔡依橙的閱讀筆記」發文，引述週刊報導表示，原來都是一群人希望讓阿北關到永遠不要出來的設計。蔡依澄指出，柯文哲整天罵賴清德跟民進黨，卻不知道自己身邊從黨員幹部到辯護律師，才是真正監視並讓他走到這一步的。「字面在罵賴清德，其實那個恨，可能都是針對黃國昌。」蔡依澄嘆，柯文哲自稱智商157，但民進黨優秀人才合作他不要，自己找來的一群戰狼戰狗抓耙子，能把自己搞成這樣也是經典，「最後，建議阿北，律師還是自己請比較好，免費的、有朋友價優惠的、黃國昌推薦的，還是別用了。」熱門賽事、球星動態不漏接    ,https://news.ltn.com.tw/news/politics/breakingnews/5195947
為跟拍潘孟安租停車位  黃國昌手下「狗仔頭」被爆竟留法務部地址,政治,2025/09/30 17:44,謝幸恩租了潘孟安住處的停車位，留下的通訊地址竟是法務部6樓記者室。（資料照）民眾黨主席黃國昌遭爆養「狗仔集團」跟拍民進黨政治人物，「狗仔頭」為中央社司法記者謝幸恩。週刊今（30日）踢爆，謝幸恩2023年為跟拍時任賴清德競選總幹事、現任總統府秘書長潘孟安，特地租潘孟安住處的停車位，但留下的通訊地址竟是法務部6樓記者室。政治工作者周軒要求法務部介入調查；民進黨立委林楚茵也要求中央社徹查到底，不要因為謝幸恩辭職就罷休。國民黨立委王鴻薇前年爆料，潘孟安選戰期間北上替賴清德輔選，入住力能能源科技董事長楊宗名下、位在萬華價值5000萬元的豪宅，狠酸「金屋藏潘」。潘孟安隨即提出租屋合約與每個月租金匯款為憑自清，提告求償並要求刪除臉書造謠貼文。法院一、二審均判王鴻薇敗訴且須賠償。請繼續往下閱讀...而當時王鴻薇曬出的爆料照片，拍攝地點被指是該豪宅社區的地下4樓，挨批非法入侵民宅，後續追查發現，協助拍攝照片的就是謝幸恩，當時她特地承租車位，合約起訖時間為2023年9月28日至2024年3月28日，共6個月，月租金5000元。而謝幸恩留下的通訊地址為台北市中正區重慶南路1段130號6樓，經查竟是法務部6樓記者室。對此，周軒在臉書發文，「請法務部務必調查清楚。黃國昌狗仔集團內重要角色，謝幸恩，疑似為了跟拍當時賴清德總統競選總幹事潘孟安，到其社區租停車位的合約，謝幸恩所留地址據悉是是法務部6樓記者室。法務部當然不會介入這等近乎政治偵防的爛事，可是，這段時間以來，有沒有什麼聯絡資訊，或是信件往來，是透過這個地址轉交給當事人的？還請法務部要多加注意。」林楚茵則PO文表示，「我出身媒體，最清楚『第四權』監督與『政治跟監』的差別！接受黃國昌下命令就是當政治打手！就算中央社記者謝幸恩辭職，我仍會要求、監督中央社徹查到底。身為官媒，怎能拿國家資源，幫特定政黨來跟蹤政敵？2022年12月傳簡訊自稱民報記者蕭依依，2024年7月同一支門號變成中央社記者謝幸恩，關鍵證據都在我手上，背後主使者是不是黃國昌？ 難道所謂『揭弊』需要用假名分飾兩角？」她接著質問：「2023年2月謝幸恩入職中央社；2023年9月謝幸恩住五股，卻冒用『法務部地址』承租我家（萬華）的停車場；2023年12月王鴻薇爆料潘孟安，同時曝光我與先生梁文傑的住處。謝幸恩租車位偷拍，是王鴻薇拿到照片，怎麼那麼巧？今天週刊報導，黃國昌養『狗仔團』花四千多萬，錢從哪裡來？如果凱思國際背後確實有港資、中資，那跟監國會議員已經是國安問題！黃國昌要不要正面交代？」熱門賽事、球星動態不漏接    ,https://news.ltn.com.tw/news/politics/breakingnews/5195819
4千億舉債不能再多了！卓榮泰：盼總預算審查有合理結果,政治,2025/09/30 17:33,立法院院會30日邀行政院長卓榮泰列席施政報告並備質詢。（記者羅沛德攝）立法院預算會期拉開序幕，行政院長卓榮泰今（30日）表示，115年度中央政府總預算案已送抵立院，編列增幅對於國家經濟發展和災後重建是不夠的，但現在已舉債4000億元，沒有再多的舉債空間，各部會將當用才用、絕不浪費；卓也特別提醒，「我們有去今年的例子，希望明年的預算能夠快速付委、詳實審查、合理結果」。卓榮泰今赴立法院進行施政報告，闡述行政團隊將落實總統賴清德指示，以「經濟、民生、弱勢、青年」作為四大優先原則，並推動「多元產業，創新經濟」、「減輕負擔，全齡照顧」、「世代支持，自我實現」、「均衡台灣，永續發展」及「社會韌性，國家安全」五大施政方向，以強化國家經濟韌性、促進產業發展，讓人民安居樂業。請繼續往下閱讀...卓榮泰表示，行政院將在國家利益與民主憲政的基礎下，為中華民國台灣的永續生存，不放棄任何合作的契機。行政院提出明年度中央政府總預算案，歲入編列新台幣2兆8623億元、歲出編列3兆350億元，與今年度總預算加上追加預算的總和相比，明年度歲出僅多了222億元、僅增加0.7%。不過，卓揆坦言，在國家正需要經濟發展和所有災後重建的過程中，這是不夠的，但現在已舉債4000億元，沒有再多的舉債空間，因此只能要求各部會須在有限資源下通力合作，「當用才用，絕不浪費」。卓也呼籲行政院與立法院、政府與人民，以及朝野之間，再次建立信任，期盼總預算案能快速付委、詳實審查，並得到合理結果，讓全民享受國家給予的種種福利照顧、以及國家安全需求。除了總預算案，卓榮泰特別提及，未來須面對「財政收支劃分法」的重新思考，只有兩個大項要處理，分別是「垂直劃分」和「水平均衡」。卓揆進一步說明，在垂直方面，必須劃分中央與地方的權限；在水平方面，較弱勢的縣市必須得到比較多的協助，不能只靠人口、土地或營業額等計算方式，導致強者越強、貧者卻不能夠變強的結果。行政院願在廣徵各界意見並與地方協調溝通後，提出一個可長可久、長治久安的「財劃法」，希望大家一起討論、通過並執行，讓中央與地方的合作變成真正可能。熱門賽事、球星動態不漏接    ,https://news.ltn.com.tw/news/politics/breakingnews/5195950
黃國昌稱與《民報》合作追天道盟案件遭施壓 梁文傑：沒能力施壓撤照,政治,2025/09/30 17:32,陸委會發言人梁文傑。（記者陳鈺馥攝）民眾黨主席黃國昌被爆組織「狗仔集團」跟拍政敵，透過合作媒體、藍營人物將跟拍素材爆料做負面攻擊。黃國昌神隱多日後，今天現身承認有與《民報》、《菱傳媒》合作，更加碼爆自己曾追天道盟「鐵霸」曾盈富案，發現鐵霸太太押人到時任北市議員梁文傑服務處簽本票，《民報》刊登後遭施壓撤照，讓他中斷合作。對此，陸委會副主委梁文傑回應，他當時剛落選議員，忙著收攤關門，沒有能力對《民報》施壓，更別說有辦法要《民報》撤下什麼照片。黃國昌稍早在記者會上坦承，對於陳申青、《民報》跟《菱傳媒》，的確過去有一些案子有合作，但是以《民報》當作例子，那時候他在追天道盟大哥「鐵霸」曾盈富的案子，鐵霸太太押人去逼人家簽本票、和解書，那個畫面非常驚悚，從內湖分局的門口，一幫小弟把人押上車，車子直接開到一個議員的服務處，逼人家簽本票，而那個議員服務處就是目前陸委會副主委梁文傑當時市議員的服務處。請繼續往下閱讀...黃國昌說，當時梁文傑地方服務處的主任，也涉及暴力討債，在追查當中，協會把整件事情調查完了以後，有跟民報合作，結果登了以後，民報因受壓力，就把梁文傑跟服務處主任合拍的照片撤下，他非常不高興，從此以後就中斷跟他們的合作，這個就是協會的風格，跟他合作過的媒體還蠻多的。對此，梁文傑表示，黃國昌委員與《民報》合作本案一事，本人早已知悉，本人對本案也曾多次說明。再次說明如下：一、本案發生在2016年，當時是有人稱有財務糾紛，向本人的議員服務處商借場地，並自帶律師在場自行調解，其一切內容皆與本人服務處無關，本人也毫不知情。梁文傑指出，二、本案早已判決確定，相關犯案人等也已服刑。黃國昌委員若有新的疑問或新的證據，建議不用再透過媒體，可以直接向地檢署提出告發。梁強調，三、《民報》首次刊出這則報導是在2022年12月20日，他當時剛剛落選議員，忙著收攤關門，面對《民報》記者的提問只能做澄清，沒有能力對《民報》施壓，更別說有辦法要《民報》撤下什麼照片。熱門賽事、球星動態不漏接    ,https://news.ltn.com.tw/news/politics/breakingnews/5195948
黃國昌爆「狗仔爭議」 王鴻薇力挺：可約束政治人物言行,政治,2025/09/30 17:28,立委王鴻薇。（資料照）民眾黨主席黃國昌遭爆料指揮狗仔，跟拍綠營政治人物，引發爭議。對此，國民黨立委王鴻薇今日受訪時表示，不需要將狗仔文化「完全地汙名化」，她還說，「只要你行得正、坐得直，那狗仔文化你何懼之有？」她還表示，狗仔文化可以制約很多政治人物的言行。綜合媒體報導，王鴻薇今日受訪表示，台灣狗仔文化不是第一天，現在講得好像黃國昌是「狗仔教父」。她表示，雖然很多政治人物、公眾人物，因為不希望被跟拍或私生活曝光，一聽到狗仔就「恨之入骨」，但不可諱言，在狗仔文化中，只要行得正坐得直，狗仔文化何懼之有？請繼續往下閱讀...王鴻薇還表示，只要沒有造謠或抹黑，狗仔文化可以去約束、制約政治人物言行，「政治人物如果行得正坐得直，就不需要這麼怕狗仔，怕被置之於死地。」熱門賽事、球星動態不漏接    ,https://news.ltn.com.tw/news/politics/breakingnews/5195929
黃國昌被爆指揮狗仔跟拍 沈伯洋：台灣法律沒想過有這種人,政治,2025/09/30 17:22,立委沈伯洋。（記者王藝菘攝）《鏡週刊》今日爆料，民眾黨主席黃國昌指揮狗仔跟拍立委沈伯洋以及總統府祕書長潘孟安等一眾綠營高官。對此，沈伯洋今日在臉書發文提出兩點回應。沈伯洋今日下午發文表示，不少媒體在問他「跟拍」的事情，先簡單兩點回覆。第一，法律責任方面，不容易涵攝，原因很簡單，當時各種台灣法律在設計的時候，沒有想過有黃國昌這種人。請繼續往下閱讀...第二，沈伯洋諷刺，其實台灣靜態拍出入的針孔就都是那樣原理，但自從他揭露之後，「根據這一個月的紅媒、國民黨立委、網紅、名嘴，這一切都是我在幻想，看來全台灣只有黃國昌是清醒的。」最後他也嘆道：「事實在這些人前面，永遠不值一哂。」針對此事，政治工作者周軒今日也表示，這半年來，中國、港媒、藍白、協力者，一直不停的在洗一個印象，就是沈伯洋精神有問題，疑神疑鬼，當時沈伯洋自己揭露被偷拍的事情，台灣媒體配合藍營名嘴還有公關公司就拿過去這個印象來把風向洗成「沈伯洋無的放矢」。「結果今天看起來，小丑好像不是沈伯洋。」周軒質疑，為什麼黃國昌的狗仔集團需要跟拍沈伯洋？沈伯洋對黃國昌造成什麼問題嗎？還是誰有跟拍沈伯洋的需求，請黃國昌這邊處理？「這些都是真正的國安問題。」熱門賽事、球星動態不漏接    ,https://news.ltn.com.tw/news/politics/breakingnews/5195911
林佳龍受邀出席華沙安全論壇 場邊會晤法國、烏克蘭國會議員,政治,2025/09/30 17:18,外交部長林佳龍27日起率團訪問波蘭，昨日受邀於「華沙安全論壇」發表專題演說，在場邊與法國、烏克蘭國會議員互動。（圖擷取自林佳龍臉書）外交部長林佳龍27日起率團訪問波蘭，昨日受邀於「華沙安全論壇」發表專題演說。林佳龍今（30）日於臉書PO出多張在場邊與法國、烏克蘭國會議員互動的合影。林佳龍於臉書表示，除了在論壇發表演講外，他也把握場邊時間，與法國參議院外交暨國防委員會副主席康慕蕾（Hélène Conway-Mouret）、烏克蘭國會議員暨對中政策跨國議會聯盟共同主席克尼茨基（Mykola Kniazhytski）、烏克蘭國會言論自由委員會主席尤契申（Yaroslav Yurchyshyn）、歐洲融合委員會主席伊凡娜（Ivanna Klympush-Tsintsadze），以及克魯科（Ivan Krulko）、芭布羅斯嘉（Solomiia Bobrovska）、盧布山斯基（Andrii Lopushanskyi）、琵帕（Nataliya Pipa）等多名烏克蘭國會議員深入交流。請繼續往下閱讀...林佳龍表示，與康慕蕾會談時，他特別分享台灣推動文化外交的成果，並介紹歐洲台灣文化年的專屬徽章。康慕蕾則慰問台灣的颱風災情，並期待未來有更多台灣官員能前往法國交流，讓法國社會能更即時地了解台灣，她強調，深化台法關係，就是提升台歐關係。林佳龍表示，與他會晤的烏克蘭議員們則坦言，俄羅斯對烏克蘭的侵略不僅是軍事上的壓力，更有資訊戰的威脅，他們認為台灣與烏克蘭面對中俄挑戰時，除了硬實力，也需要同步強化軟實力。林佳龍透露，烏克蘭議員也肯定「智慧城市解決方案」在重建烏克蘭上的重要性，俄羅斯非法入侵以來，台灣就運用資通訊產業的優勢，積極協助烏克蘭，今年3月更有來自烏克蘭的30多名城市代表，包括11名城市首長訪台，參與「2025台北智慧城市展」並舉辦專場論壇。外交部長林佳龍27日起率團訪問波蘭，昨日受邀於「華沙安全論壇」發表專題演說，在場邊與法國、烏克蘭國會議員互動。（圖擷取自林佳龍臉書）熱門賽事、球星動態不漏接    ,https://news.ltn.com.tw/news/politics/breakingnews/5195932
藍白受眾粉專看完黃國昌回應 逆風稱「不是說得很通」慘被罵翻,政治,2025/09/30 17:08,民眾黨主席黃國昌。（記者王藝菘攝）民眾黨主席黃國昌被爆指揮狗仔集團跟監政治人物，神隱多日後，今日現身駁斥報導內容，並稱自己是2023年被跟拍騷擾才進行反蒐證。對此，有藍、白粉絲受眾較多的粉專今日轉發相關報導，並簡短表示自己覺得黃國昌「不是很說得通」，結果就遭藍、白支持者批評。針對媒體報導，黃國昌回應，他是2023年被媒體騷擾，才去「反蒐證」，黃國昌還嗆聲，他的吹哨者保護協會是在揭發弊案，跟鏡週刊養狗仔、刊登下三濫的東西，完全不在同一個檔次上。請繼續往下閱讀...對此，粉專「麥克風的司法求生手冊」今日轉貼相關報導並表示，撇除掉證據不充分的報導，「那些『疑』的部分先不論，我自己是覺得用反蒐證當理由養狗仔，不是很說得通啦！讓我們繼續看下去。」沒想到，短短一句話就引發民眾黨支持者不滿，在貼文下方留言：「揭發弊案是不允許的喔」、「國昌老師為了揭弊自掏腰包砸大錢？為善不欲人知，還得被攻擊。是非何在？」、「狗仔？？蒐證揭發弊案很好啊」、「鏡週刊寫的還有人信喔」、「蒐證揭弊有啥問題？檢察官都說不違法了 有啥毛病」；還有人嗆他：「畢竟是會看四叉貓的人呢。」熱門賽事、球星動態不漏接    ,https://news.ltn.com.tw/news/politics/breakingnews/5195882
