Title,News_Type,date,content,url
讚賴清德「出訪即護國」 謝志偉：破解中國以「家務事」當攻台藉口,政治,2026/05/03 08:29,總統賴清德抵達史瓦帝尼王國進行國是訪問。（總統府提供）總統賴清德2日突破中國封鎖順利出訪友邦史瓦帝尼，中國對此跳腳大罵，駐歐盟代表謝志偉3日表示「出訪即護國」，總統此次出訪是向世界展示「自由民主的台灣不是專制極權中國的一部分」之事實，也因而破解了中國以「家務事」為藉口來侵略台灣之口實。謝志偉指出，正因為中國在所有國際場合都極盡封鎖台灣之能事，意圖造成「處理台灣」是「中國人的家務事，不容外人介入」的敍事基礎，這也是國民黨主席鄭麗文「賣台求榮」的具體內容，藉此達到「關起門來打狗」的最終目標。謝志偉說：「台灣必須創造各種機會，讓國際社會認知到這個小小美麗多山的民主國家，不管有沒有被承認、叫什麼名字，反正就是不屬於中國！」請繼續往下閱讀...謝志偉表示，最能體現這個「台灣不屬於中國」之事實的方式之一，就是讓台灣自由民主選出、作為國家最高領導人的正副總統在國際社會出現，中華民國台灣的正副總統出現在國際社會是一種名正言順、理所當然的護國行動。謝志偉強調：「成功固是護國，而就算失敗，也無損護國的神聖，因為『護國』始於決心，非始於成果！總統有了堅定決心，護國終有成果。成果也者，自由民主的台灣終將修成正果也！」至於中國外交部或國台辦的激烈反應，謝志偉笑說：「正好反證了『台灣是真的不屬於中華人民共和國』的事實。感恩配合！而那些對賴總統成功突破中國封鎖之行既冷嘲又熱諷的台灣人，當然看不到這層『護國』意涵，有共可舔而無國可護，那是他們的悲哀。」    ,https://news.ltn.com.tw/news/politics/breakingnews/5423550
中國狂罵賴清德出訪史瓦帝尼 沈有忠：中共玻璃心碎滿地,政治,2026/05/03 07:48,陸委會副主委沈有忠。（資料照）在中共外交打壓下，賴清德總統昨（2）日搭乘史國專機，成功抵達非洲友邦史瓦帝尼訪問。中國國台辦聲稱，「賴清德費盡心機炮製的所謂『外交成果』，不過是玩弄伎倆，貽笑天下。祖國必然統一大勢滾滾向前不可阻擋」。陸委會副主委沈有忠指出，賴總統代表中華民國順利出訪，讓中共大地震、玻璃心碎滿地。賴清德昨天凌晨搭乘「史王特使」史國副總理札杜莉（Thulisile Dladla）4月30日來訪台灣時所搭專機，經過14小時飛行後，於台北時間下午順利降落史瓦帝尼。賴清德昨晚6點多透過社群媒體公開出訪消息後，中國外交部晚間7時許火速回應，嗆聲賴清德在宜蘭地震後，「棄島內民生於不顧，偷偷鑽進一架外國飛機溜出台灣，大肆揮霍公帑，上演『偷渡式』外竄鬧劇」。請繼續往下閱讀...中國國台辦發言人陳斌華則指稱，「此前因有關國家堅持一個中國原則，賴清德企圖乘包機竄訪史瓦帝尼被迫取消，但其不甘失敗，竟然不顧顏面，以偷雞摸狗的方式外竄至史國。當前島內正遭遇地震，賴清德不管不顧。由此可見其對島內民眾冷血無情，台獨立場頑固，是徹頭徹尾的『麻煩製造者』」。陳斌華說，「堅持一個中國原則是國際社會人心所向、大勢所趨、大義所在，賴清德如同過街老鼠的齷齪行徑，必為國際社會所恥笑。維護台海和平穩定，過上安穩富足生活，是島內民意所盼，賴清德不顧民眾安危、肆意欺騙民眾，必為廣大台灣同胞所唾棄。陸委會副主委沈有忠發文指出，賴總統代表中華民國順利出訪，讓中共大地震、玻璃心碎滿地。台灣有權利走向世界，總統出訪證明，中共的一中原則只是自欺欺人。國人此刻應該團結，認清中共一中論述目的只是消滅我國家主權，更不應淪為配合中共做為傷害台灣自由民主的工具。    ,https://news.ltn.com.tw/news/politics/breakingnews/5423541
國台辦嗆賴出訪如過街老鼠齷齪 陸委會：潑婦罵街、無聊至極,政治,2026/05/03 07:43,陸委會指出，中華民國總統要去任何地方，不需要中華人民共和國同意。國台辦潑婦罵街，無聊至極。（資料照）賴清德總統昨（2）日搭乘史國專機，成功抵達非洲友邦史瓦帝尼訪問。中國國台辦嗆聲，「堅持一個中國原則是國際社會人心所向、大勢所趨、大義所在，賴清德如同過街老鼠的齷齪行徑，必為國際社會所恥笑」；陸委會今日痛批，國台辦潑婦罵街，無聊至極。國台辦發言人陳斌華指出，「此前因有關國家堅持一個中國原則，賴清德企圖乘包機竄訪史瓦帝尼被迫取消，但其不甘失敗，竟然不顧顏面，以偷雞摸狗的方式外竄至史國。當前島內正遭遇地震，賴清德不管不顧。由此可見其對島內民眾冷血無情，台獨立場頑固，是徹頭徹尾的『麻煩製造者』」。請繼續往下閱讀...陳斌華聲稱，「堅持一個中國原則是國際社會人心所向、大勢所趨、大義所在，賴清德如同過街老鼠的齷齪行徑，必為國際社會所恥笑。維護台海和平穩定，過上安穩富足生活，是島內民意所盼，賴清德不顧民眾安危、肆意欺騙民眾，必為廣大台灣同胞所唾棄」。陳斌華更說，「賴清德費盡心機炮製的所謂『外交成果』，不過是玩弄伎倆，貽笑天下。祖國必然統一大勢滾滾向前不可阻擋」。對此，陸委會表示，中華民國總統要去任何地方，不需要中華人民共和國同意。國台辦潑婦罵街，無聊至極。    ,https://news.ltn.com.tw/news/politics/breakingnews/5423535
無懼中國打壓！賴清德突圍訪史國 矢板明夫：出乎北京的預期,政治,2026/05/03 06:59,總統賴清德抵達史瓦帝尼王國進行國是訪問。（總統府提供）首次上稿 05-02 23:10更新時間 05-03 06:59賴清德總統突破中國外交封鎖，昨（2）日抵達非洲友邦史瓦帝尼正式訪問。對此，印太戰略智庫執行長矢板明夫分析，這一輪台灣與中國的攻防，結果應該出乎北京的預期。並用「三個因素」解釋台灣能撐過中國打壓的原因，「台灣的外交空間，不是可以被隨意壓縮的」。請繼續往下閱讀...矢板明夫在臉書發文表示，賴清德總統成功出訪史瓦帝尼，這趟行程的價值，不僅在於訪問本身，更在於它背後的一場攻防。出發前，傳出航線受阻、行程延宕，對台灣而言，這是熟悉的壓力測試。北京試圖透過各種方式，縮小台灣的外交空間，這一次也不例外。矢板明夫指出，但台灣沒有被攔住，這讓人想到一個比喻：台灣的外交，就像柳枝。風來時會彎，但不會斷，等風一過，又會回到原來的位置。這種韌性，不是口號，而是在一次次壓力中被證明出來的。他認為，這一輪台灣與中國的攻防，結果應該出乎北京的預期。原本想透過壓力讓台灣「走不出去」，最後卻讓整個過程被放大檢視。不僅沒有成功封鎖台灣，反而引來更多質疑與反感。在某種程度上說，這是一場「用力過猛」的失算。矢板明夫分析，台灣為什麼能撐過這一關？原因很簡單，但很關鍵，第一、是「正當性」。當一方試圖用政治壓力干預基本的國際運作，另一方只是在進行正常交流時，誰站得住腳，國際社會看得很清楚。這不是誰聲音大，而是誰站在規則的一邊。矢板明夫解釋，第二、是外部支持。近年來，美國與日本對台灣的態度愈來愈明確。不論是政策文件、國會決議，或政治人物的公開發言，都在傳遞一個訊號：台灣不應被排除在國際社會之外。當這樣的氛圍形成時，任何單方面的打壓，都會面臨更大的阻力。所謂「得道多助」，在這裡並不是抽象的道德，而是具體的國際現實。他說，第三、是台灣自己的態度。沒有高調對抗，也沒有情緒反應，而是在壓力之下持續推進，調整路線、重新安排，最後完成任務。這背後，是一整個外交體系的運作，許多暗中的協調與努力。矢板明夫強調，這三個因素交織在一起，促成了這次的訪問，並呈現一個清楚的結論：台灣的外交空間，不是可以被隨意壓縮的。他大讚，「這樣的台灣，值得鼓掌」。    ,https://news.ltn.com.tw/news/politics/breakingnews/5423470
突破中國打壓！賴清德順利抵史國  林俊憲揭：「保密」是關鍵,政治,2026/05/03 06:57,總統賴清德昨天抵達史瓦帝尼王國進行國是訪問。（總統府提供）首次上稿 05-02 22:59更新時間 05-03 06:57總統賴清德昨（2）日突破中國封鎖，抵達友邦史瓦帝尼訪問。民進黨立委林俊憲表示，這次賴總統出訪過程，正是一個讓我們得以一窺，多年來台灣的外交人員，要運用多大的智慧，才能突破中國的封鎖的好例子，為台灣爭取更多被世界看見的機會。雖然府方因安全理由，無法證實總統抵達史國的方式，但有一件事是可以確定的，「保密」，是讓一切實現的關鍵。請繼續往下閱讀...林俊憲在臉書發文表示，一開始原訂的行程之所以會受到中國打壓，就是因為過境國收到台灣請求後，馬上被當地中國使館得知，並施壓當地政府。不僅是台灣出訪，就連外國官員要來台，消息一走漏，也會同樣遭到中國威脅，完全無視他國主權。林俊憲指出，希望這次出訪行程，能夠更讓大家明白，台灣的對外關係，小至民間交流、大至總統出訪，甚至跨國軍購，一直要面臨許多「只能做不能說」的現實壓力，任何一點消息走漏，都可能讓中國找到機會從中作梗。林俊憲說，所以如果以後再看到有某些特定政黨的立委，老是喜歡在立法院逼問官員他們不該透露的外交軍事資訊，別懷疑，他們只是「代為發問」而已，真正想知道答案的，另有其人。總統賴清德昨天抵達史瓦帝尼王國進行國是訪問。（擷取自賴清德官網）民進黨立委林俊憲。（資料照）    ,https://news.ltn.com.tw/news/politics/breakingnews/5423465
苗栗公館鄉長選情丕變   館東村長劉學耆突然宣佈退選,政治,2026/05/03 06:46,苗栗縣公館鄉館東村長劉學耆，與擔任代的妻子吳瑞雲，兩人同時擔任民代，攜手為民服務。（擷取自劉學耆臉書）苗栗縣公館鄉長何在鑫將尋求連任，遇館東村長劉學耆表態挑戰；劉獲縣長鍾東錦支持，最近已積極展開拜票，但他昨天（2日）在臉書發出退選聲明，以身體健康及家庭、公館鄉的和諧等因素，不再投入下屆鄉長選戰；至於是否還有人要出馬挑戰，尚待觀察。公館鄉人口逾3萬，是全縣最大鄉。何在鑫本屆任內打通鄉內瓶頸路段、改善鄉立游泳池、提高學童營養午餐補助、調升婦女生育津貼，並長期關懷弱勢慈善，施政表現有一定基礎。劉學耆則是連任4屆館東村長，其妻吳瑞雲也是2屆鄉民代表，夫妻齊心為民服務，具基層實力，加上鍾東錦支持，實力不弱。請繼續往下閱讀...正當公館鄉長之爭，形成何在鑫及劉學耆兩人對決之際，劉學耆昨在臉書發退選聲明，劉說：「這段時間走在大街小巷，跟鄉親握手話家常，聽到大家對公館的期盼，我是真的很想拚，為鄉親多做點事。但身體就是不聽話，這陣子身體越來越糟糕，體力真的吃不消了。想想自己身體都顧不好，哪有辦法去服務鄉親大眾？」此外，劉學耆指出，孫子們住在外地，平時就難得見面，頂多週末假日才能回來讓阿公抱一抱。自從開始選舉家戶拜訪，天天早出晚歸，連這一個禮拜一次的見面機會都沒了。看著孫子失望的眼神，兒女心疼我搞壞身體，苦苦勸他踩煞車，心裡真的很難受。選鄉長固然重要，但他更想健健康康地陪孫子們長大，決定退出鄉長選戰。劉學耆強調，他服務鄉親的心意不會變，也懇請公館鄉親，把原本要給的支持，轉給他擔任鄉代的妻子吳瑞雲，吳瑞雲會繼續認真負責地替大家發聲，不管是爭取建設經費還是解決地方問題，她都會盡心盡力去做，不讓大家失望。    ,https://news.ltn.com.tw/news/politics/breakingnews/5423517
賴清德突破封鎖抵史瓦帝尼  中國國台辦跳腳：偷雞摸狗外竄,政治,2026/05/03 06:19,賴總統昨（2日）抵達非洲友邦史瓦帝尼訪問。（總統府提供）首次上稿 05-02 22:35更新時間 05-03 06:19賴清德總統昨（2）日抵達非洲友邦史瓦帝尼訪問，對此，中國國台辦跳腳聲稱：「賴清德費盡心機炮製的所謂『外交成果』，不過是玩弄伎倆，貽笑天下。祖國必然統一大勢滾滾向前不可阻擋。」請繼續往下閱讀...國台辦發言人陳斌華晚間指出，「此前因有關國家堅持一個中國原則，賴清德企圖乘包機竄訪史瓦帝尼被迫取消，但其不甘失敗，竟然不顧顏面，以偷雞摸狗的方式外竄至史國。當前島內正遭遇地震，賴清德不管不顧。由此可見其對島內民眾冷血無情，台獨立場頑固，是徹頭徹尾的『麻煩製造者』」。陳斌華稱，「堅持一個中國原則是國際社會人心所向、大勢所趨、大義所在，賴清德如同過街老鼠的齷齪行徑，必為國際社會所恥笑。維護台海和平穩定，過上安穩富足生活，是島內民意所盼，賴清德不顧民眾安危、肆意欺騙民眾，必為廣大台灣同胞所唾棄。賴清德費盡心機炮製的所謂『外交成果』，不過是玩弄伎倆，貽笑天下。祖國必然統一大勢滾滾向前不可阻擋」。    ,https://news.ltn.com.tw/news/politics/breakingnews/5423464
民眾黨前高雄主委自爆遭裝追蹤器 高市警：尚未報案,政治,2026/05/03 06:14,民眾黨前高雄主委莊貽量自爆遭裝GPS追蹤器，高市警方證實至昨尚未報案。（資料照）有意競逐高市左楠區議員的民眾黨高市黨部前主委莊貽量，在自己的臉書自爆自家車疑遭人安裝GPS追蹤器，個人隱私與人身安全造成嚴重疑慮，但高市警方截至今（3日）凌晨，仍未接獲莊的報案，昨透過親友聯絡莊均稱「忙」，警方呼籲他儘速報案才利追查，釐清真相並安民心。莊貽量之前PO的圖、文已刪除，但警方根據截圖研判所謂遭安裝的追蹤器，iFind全球定位器，一般而言，iFind全球定位器就會主動傳訊息給附近的iPhone手機，如果不是iPhone手機就無法收到訊號。請繼續往下閱讀...據了解，警方已著手調查積極偵辦中，因多次聯繫莊未果，陸續透過莊的服務處人員及家人聯絡，莊均表示忙碌，由於高市警方迄今未接獲莊報案，警方將詢問並確認有無向哪一縣市警局報案？此外，網紅四叉貓依圖索驥，認為該器材應該是iFind全球定位器，也稱防丟器、寵物定位器，售價大約600元，官方警語提及內建反追蹤功能，不建議用來跟蹤，警方對網紅的見解不表意見，強調會竭盡能力，保護每位市民的安全及社會安定。    ,https://news.ltn.com.tw/news/politics/breakingnews/5423502
賴清德突破封鎖抵史瓦帝尼 中國崩潰：「偷渡式」鬧劇,政治,2026/05/03 06:13,中國外交部發言人郭嘉昆。（歐新社檔案照）首次上稿 05-02 22:06更新時間 05-03 06:13總統賴清德昨（2）日突破中國封鎖順利出訪友邦史瓦帝尼。對此，中國外交部氣炸怒批，賴清德「棄島內民生不顧」，「偷偷鑽進一架外國飛機」溜出台灣，上演「偷渡式」外竄鬧劇。請繼續往下閱讀...中國外交部崩潰表示，賴清德「在宜蘭發生地震後僅幾小時，棄島內民生於不顧」，偷偷鑽進一架外國飛機溜出台灣，大肆揮霍公帑，上演「偷渡式」外竄鬧劇，淪為國際笑柄，拉長「台獨」醜行清單。中國外交部大嗆，賴清德之流在國際上灰頭土臉的遭遇再次表明，一個中國原則早已成為國際關係基本準則和國際社會普遍共識。無論民進黨當局怎麼勾連外部勢力、以什麼形式「豢養他人」，都是枉費心機，改變不了台灣是中國一部分的事實。無論「台獨」分裂勢力如何隱形變異，都改變不了「人人喊打、抱頭鼠竄」的命運。中國外交部說，他們奉勸史瓦帝尼等個別國家「看清歷史大勢、順應時代潮流」，不要為少數「台獨」分離主義者「火中取栗」。    ,https://news.ltn.com.tw/news/politics/breakingnews/5423440
史瓦帝尼專機助賴清德突破中國封鎖  軍事專家揭來自台灣的情誼,政治,2026/05/03 06:10,總統賴清德今天抵達史瓦帝尼王國進行國是訪問。（總統府提供）首次上稿 05-02 23:54更新時間 05-03 06:10總統賴清德昨（2）日突破中國封鎖抵達友邦史瓦帝尼訪問。對此，軍事科技評論家James Jseng揭密，賴清德搭的A340飛機原隸屬華航，2015年退役，2016年以約1200萬美元轉售給史瓦帝尼。他說，北京鎖的是「台灣的專機」，但這一次，「台灣沒有用自己的飛機，而是用一架曾經是台灣的飛機，載著台灣總統，飛過原本被封鎖的天空」。請繼續往下閱讀...James Jseng在臉書發文表示，4月21日，距離起飛不到12小時，塞席爾、模里西斯、馬達加斯加同步關閉飛越許可，台灣元首專機被拒絕過境，外交部、總統府宣布訪問非洲的行程停止，沉默，一如樓頂的國旗。然而，13天後，完全不同的劇本上演。James Jseng指出，5月2日凌晨0時37分，一架機號3DC-SDF的A340從桃園起飛，沒有預告、沒有航線、沒有公開節點，14小時後落地史瓦帝尼，傍晚六點，賴清德忽然對外宣佈，他人在史瓦帝尼。同一個目的地，兩次行動，結果截然相反，差別只在一件事：「保密」。他續指，這一次，沒有任何人能事先察覺異狀，沒有消息外洩的路徑，沒有可供預判的動作，沒有任何一家親中媒體得到訊息，整個行動被切割、被靜默、被壓縮在極小範圍內，外界唯一看到的，只是一架「別人的飛機」。但這架飛機，本身就是關鍵，它原本是台灣的飛機。James Jseng解釋，這架飛機機號B-18802，2001年交機，隸屬華航，2015年退役，2016年以約1200萬美元轉售給史瓦帝尼，經過兩年改裝，成為國王恩史瓦帝三世的專機，機號改為3DC-SDF，「這不只是單純交易，是延伸出去的邦誼」。James Jseng說，飛機賣出去了，但關係並沒有結束。這架A340的技術訓練、維修體系，長期由台灣支撐，華航維修體系持有史瓦帝尼民航局核發的維修證照，大型檢修仍需回到台灣機棚完成，一架飛機，實際上維繫著兩個國家的友情。他揭密，到2026年，這架飛機已經25年機齡，A340更早在2011年停產，全球逐步退場，零件取得困難、維修成本高昂，但它依然能完成14小時長程飛行，代表背後仍有完整且可靠的維修支撐。它不新，但它被照顧得足夠好，如果不是自己人維護，國安單位也根本不可能放行。James Jseng強調，北京鎖的是「台灣的專機」，但這一次，台灣沒有用自己的飛機，而是用一架曾經是台灣的飛機。一架從台灣起飛、被賣出、被維修、被維繫的飛機，在多年之後，載著台灣總統，飛過原本被封鎖的天空。外交、情報、技術，在這一刻交會。「這不是寓言，但它確實像一則，被精心寫好的童話」。這架A340飛機2016年以約1200萬美元轉售給史瓦帝尼，經過兩年改裝，成為國王恩史瓦帝三世的專機。（擷取自James Jseng臉書）    ,https://news.ltn.com.tw/news/politics/breakingnews/5423478
焦點評論》賴總統啟用「抵達後公開」模式,政治,2026/05/03 05:30,賴清德總統在台北時間週六下午三點（當地時間上午九點），抵達史瓦帝尼進行訪問。這次總統府採取國際常見的「抵達後公開」（arrive then announce）模式，排除外力介入。（取自臉書）記者鄒景雯／特稿經過十四小時的飛行，賴清德總統在台北時間週六下午三點（當地時間上午九點），抵達我們在非洲的邦交國史瓦帝尼進行訪問。鑑於中國之前無理的阻撓打壓，這次總統府採取國際常見的「抵達後公開」（arrive then announce）模式，排除外力介入，美國總統即經常使用。由於是正式的國是訪問，這次陪同總統一道出訪的包括總統府秘書長潘孟安、外交部長林佳龍、國安會諮詢委員黃重諺與副秘書長趙怡翔。陣容齊備。請繼續往下閱讀...賴總統原訂四月二十二日出訪，由於飛航許可遭塞席爾等三國無預警取消，不得不於二十一日宣布出訪暫緩。如今決定重新啟動出訪行程，賴總統係基於三點考慮：第一，走向世界是台灣人不可剝奪的天賦權利，也是中華民國作為國際社會一員的基本權利。第二，史國國王及政府的熱情邀請與全力支持。第三，作為國際社會一員，台灣有責任和所有民主友盟致力於國際規範與秩序的確保，不受到任何勢力的破壞。在決定堅持的出訪意義後，目標很清楚，就是所有的行程規劃，一定要符合國家尊嚴、國際規範及飛航安全原則，並且達成國家外交任務、周全元首及訪團安全。這些要素缺一不可。為此，政府做了兩個措施，一個是參採國際間高層外交常見的抵達後公開模式，事前不對外宣布出訪行程，好將各種可能來自敵對勢力干擾的不確定風險，降到最低。其次尤其關鍵，就是尋求多個理念相近的友方，當然也包括史國在內，一同協力，不僅是相關安全事務的部署安排，同時也包括消息的保密，大家在不對外透露工作內容的默契上，達成高度合作。賴總統近日曾公開表示：走向世界，是台灣人的天賦權利。也是台灣作為世界一員的權利。講這個話的當下，其實出訪準備已經在緊鑼密鼓著手之中，所以他是在說真的，不是說假的。之所以要這麼快的結束「暫緩」、兌現訪問承諾，在於不能讓中國的手段「成例」，而後在未來的日子裡，成為其拿捏國際、自訂規矩的手段。如果台灣摸摸鼻子自認倒楣，中共的行徑很可能即被漠視，一旦出現這種破口，由中國來畫紅線，對於台灣來說，更多的威脅和風險就將隨之而來，既有的規範與秩序，也將被惡霸所主導。於是，賴總統必須走出去，台灣必須走出去，台灣人的意志，以及台灣的國家意志，也必須走出去。相對於北京這個麻煩製造者，我們則是努力作為國際秩序的捍衛者。    ,https://news.ltn.com.tw/news/politics/paper/1753283
