Title,News_Type,date,content,url
「寶寶頭軟得像果凍」4歲女童遭虐終身失能 惡情侶1重判、1潛逃,社會,2026/03/28 05:54,彰化葉姓、林姓情侶檔聯手對4歲女童施暴逾月，葉男依成年人共同故意對兒童犯重傷害罪重判12年，林女畏罪更棄保潛逃。（記者陳冠備攝）首次上稿 3-27 22:35更新時間 3-28 05:54彰化一名4歲女童因生父入監服刑，被託付給父親前女友林女照顧，不料林女與同居男友葉男僅因不滿女童不服管教，竟聯手施暴逾月，導致女童嚴重腦傷、昏迷不醒，2人嚇得傳訊「寶寶頭軟得像果凍」才送醫。案發後2人互推責任，林女畏罪還棄保潛逃。彰化地院審結，將葉男依成年人共同故意對兒童犯重傷害罪，判處有期徒刑12年。請繼續往下閱讀...判決書指出，林女原與呂男交往，呂男於2023年4月入監後，將當時僅4歲的女兒交由林女照顧。不料林女隨即與前男友葉男復合，並自5月起將女童帶往葉男住處，由2人共同照顧。未料照顧不久即失控，2人因不滿女童不聽話，從5、6月至7月間頻繁施暴，手段包括持筷子夾手指、以「愛的小手」抽打雙腿、持棍棒敲擊頭部，甚至為嚇唬她，行經孤兒院時將她放下車後駛離，造成女童拉門跌倒、右手骨折，卻未送醫。7月3日上午更爆發致命施暴。葉男抓住女童雙腳，以頭下腳上方式使其頭部撞擊地板後拋出；林女則掐住女童脖子往後重摔，導致頭部著地，逐漸出現昏迷、意識不清等狀況，2人直到當天下午才將女童送醫急救。醫院診斷，女童顱骨骨折、硬腦膜下出血、顱內出血，並伴隨全身多處瘀傷與骨折。經手術搶救後雖保住性命，但已造成不可逆腦傷，智力、語言與自理能力嚴重受損，經鑑定，終生恐無法自理生活，屬重大不治或難治之重傷害。案發後2人否認犯行，急於滅證，還預錄音檔謊稱女童是「洗澡跌倒」。但法院根據醫院鑑定、現場跡證、DNA鑑定及2人通訊紀錄中「寶寶頭軟得像果凍」等證據，認定女童傷勢係長期遭2人聯手虐打所致。法官痛批，葉男明知女童年僅4歲、毫無反抗能力，仍長期施暴，手段殘忍，造成一生難以回復的傷害，且未認罪、未賠償、毫無悔意；又有毒品前科，5年內再犯，構成累犯，從重量刑12年。林女則於審理期間交保後失聯，遭認定逃匿，保證金沒入。    ,https://news.ltn.com.tw/news/society/breakingnews/5385165
女趴引擎蓋攔詐團車手 遭甩落再輾重傷,社會,2026/03/28 05:30,女子趴在詐團車手轎車的引擎蓋上，苦撐約1.5五公里被甩落。（資料照）一名女子為了替遭到詐騙的母親討回公道，與親友設局誘捕詐騙集團車手，對方發覺後駕車逃逸，她竟奮不顧身撲上引擎蓋攔車，整個人被強行載走狂飆，隨後女子遭甩落，還被車手兩度輾壓重傷。台中地院審理後，依殺人未遂等罪判吳姓車手八年九月。約詐團面交 為母討公道邱姓婦人是在去年九月誤信假投資與虛擬貨幣投資話術，分三次共交付一百三十萬元給車手後驚覺受騙，她與子女、親友共七人商議設局，假意要再交付四十萬元，與詐團約在台中市太平區見面。請繼續往下閱讀...當天三十七歲吳姓車手依指令抵達面交地點取款時，察覺異狀，踩油門加速逃逸，衝撞圍堵的邱婦親友，有人抓住車門遭拖行受傷，混亂中，邱婦的女兒衝到車前，整個人趴上引擎蓋試圖逼停車輛，但吳男未停車，反而高速蛇行、急煞甩動車身，企圖將她甩落。車手毒駕肇事 判八年多 女子趴在車頭苦撐約一點五公里，終於體力不支摔落地面，先遭吳男的車子前輪輾過；未料吳男為了逃逸再倒車，導致女子遭二度輾壓，造成六根肋骨骨折、骨盆碎裂及全身多處挫傷，當場失去意識。警方將吳男圍捕到案，查出他開車前吸食安非他命毒品，之後毒駕去取款及肇事。吳男辯稱，當時以為是遭警方追捕，因緊張才加速逃離；但法院認為，他明知車頭有人仍持續高速危險駕駛，且在被害人倒地後再度輾壓，行為足以致命，具有明確殺人未遂的不確定故意，依殺人未遂罪判刑八年、兩個傷害罪各判三月、共同詐欺取財罪一年八月、毒駕八月、毀損三月，合併執行八年九月，其中五個月可易科罰金。    ,https://news.ltn.com.tw/news/society/paper/1748637
防少年淪人球 少事法禁法院再移送 違憲,社會,2026/03/28 05:30,憲法法庭昨宣判一一五年憲判字第三號判決「少年保護事件禁止再行移送案」部分違憲。（記者楊心慧攝）桃園、屏東各有一名少年犯罪，因設籍在花蓮、無其他現居地，被事發地法院移送花蓮地院，實際上兩少年各住在桃、屏，盼能回到原法院審理，但少年事件處理法第十五條後段規定「受移送之法院，不得再行移送。」即案件一經移送，就不能再移轉；憲法法庭昨宣判「一一五年憲判字第三號」判決，認為「少年保護事件禁止再行移送案」部分違憲，要求相關機關自判決公告日起兩年內修改。兩年內修法憲法法庭書記廳長許碧惠說明，本案為花蓮地院少年法庭法官提出的兩件聲請案，兩案少年戶籍均在花蓮，由桃園、屏東地院移送給花院審理。但花院調查發現，兩少年未住在花蓮，均請求改由實際居住地的法院審理，卻因少事法規定而無法如願，花院法官認為該規定違憲，去年三月及七月向憲法法庭聲請釋憲。請繼續往下閱讀...憲法法庭表示「禁止再行移送」規定，原意在避免法院互相推諉案件，使少年淪為人球及延宕程序，目的尚屬正當，但實務上可能因調查不足、判斷錯誤，或少年生活環境變動，導致原受移送法院已非最適當法院，若仍不得再移送，反而不利少年最佳利益。憲法法庭認為，該規定違反憲法保障少年人格權及國家應負特別保護義務，亦不符比例原則，宣告相關部分自判決公告起失效，兩年內完成修法。修法前，受移送法院經調查後，如認其他法院更適合，得再行移送，當事人並得提起抗告；欠缺救濟途徑部分，也應一併檢討修正。此判決由五名大法官謝銘洋、呂太郎、蔡彩貞、陳忠五、尤伯祥評議，未參與評議的三名大法官蔡宗珍、楊惠欽、朱富美提出不同意法律意見書，指五名大法官所做判決不具效力，聲請案也不符法院聲請憲法審查的法定要件，應不受理，相關制度若有調整必要，屬立法政策修正問題。    ,https://news.ltn.com.tw/news/society/paper/1748641
豪奢度日 ３百多張紅單不繳,社會,2026/03/28 05:30,警方查扣現金約十一萬元，以及芋圓專專賣店名片盒、人頭金融卡、手機等贓證物。（記者邱俊福翻攝）「典芋長」負責人黃柏偉涉嫌以加盟連鎖店方式，坑殺十六名的股東、加盟主約一三〇〇萬元。檢警逮人後，發覺黃男口才一流，一直以經營不善等理由，試圖說服警方是真心想要經營，不是有心訛詐，但警方查知他詐取得來的加盟金，都花費在出國旅遊、買車等吃喝玩樂，以及每月六萬元供養越南籍范姓前女友，根本不是他口中所述全部用在事業上。警方調查，黃男的父親、大伯在新北市萬里區做芋圓，其父親原本在桃園夜市成立「典芋長」攤位販售甜湯，每周營業額約一萬元，之後攤位交由黃男經營，但黃男工作不踏實，後來將攤位頂給他人，自己開始透過社群網站平台投放加盟投資廣告，以可賺大錢的話術願景誘騙民眾投資。請繼續往下閱讀...由於黃男的品牌貸款不易，便找上李姓友人（已過世）合作，由李男經營的知名連鎖「日春」木瓜牛奶店名義，協助本金不足的加盟主貸款，貸款的款項，李男取得一成為佣金。加盟主花錢加盟後，黃男須負責裝潢、器材與提供手工芋圓原料、技術等，但許多店面裝潢到一半，號稱手工芋圓也只是機器生產，機具器材也不完備，導致加盟主無法開店營運，少部分加盟主還勉強自己想辦法開店，皆無法支撐，仍關店收場。警方追查，黃男詐來的金錢，先後購買四輛二手賓士轎車使用，以及出國旅遊，與范姓越南女友交往期間，每月花費六萬元供養；但二〇二四年開始，他積欠停車費，也拒繳違規紅單，二年來累積三百多張紅單未繳，高達約卅二萬元。此外，他曾在北市內湖區租房，但只給押金，拖欠租金，遭房東趕走後，大都投宿汽車旅館與商旅，沒錢時會到健身房洗澡。    ,https://news.ltn.com.tw/news/society/paper/1748640
恐怖情人沿街追殺前女友插喉亡,社會,2026/03/28 05:30,女子遭砍多刀，頸部還插著刀，失去呼吸心跳，救護人員到場急救。（民眾提供）路過情侶冒險援救 1男也遭砍傷臉 凶嫌自己手也受傷台中市西區街頭昨天傍晚發生駭人追砍情殺命案，三十歲陳姓男子多次聯繫廿六歲巴姓前女友未果，開車到對方住處「堵人」，見巴女獨自走在忠明路騎樓，下車攔人談判，疑因想復合遭拒，情緒失控下，接連使用雙刀砍刺，巴女當場遭頸部插刀，送醫不治，一名男子上前阻止也被砍傷，警方依殺人等罪偵辦陳男並建請羈押。請繼續往下閱讀...30歲男 開車到舊愛住處堵人犯案後陳男駕車逃逸，最終在北區西屯路巷弄內遭警方圍捕落網，他面對警方人員神情冷靜，承認雙方原本是情侶，其餘保持沉默，看不出情緒有明顯波動或悔意，目前戒護就醫中，據了解，案發於昨天傍晚五點多，兩人先在忠明路騎樓爆發激烈口角，陳男隨即亮出小刀猛追巴女，過程中不斷揮砍，造成女方臉部多處刀傷，鮮血直流的巴女仍設法掙脫逃跑，雙方在人行道與車道間拉扯、跌倒翻滾，場面驚悚。目擊者指出，現場傳出女子淒厲呼救聲，一對路過情侶見狀上前制止，其中三十一歲王姓男子挺身阻擋時，也遭陳男砍傷臉部，血流不止。女淒厲呼救 下班尖峰時嚇壞人駭人的是，巴女體力不支倒地後，陳男仍不罷手，竟取出另一把較大的尖刀，朝巴女頸部猛刺，刀尖直入要害，顯示陳男殺意堅決，巴女失去生命跡象，倒臥血泊中。因事發時正值下班尖峰時段，眾多民眾目擊，皆感驚惶。救護人員到場時，巴女身中多刀已無意識，其中頸動脈明顯遭重創，緊急送至中國附醫搶救，仍於晚間六時四十八分宣告不治。見義勇為的王男臉部撕裂傷，意識清醒，也送醫治療；凶手疑砍殺時用力過猛，自己手部也受傷。駕車逃、撞機車 圍捕落網行凶後的陳男駕駛白色轎車逃逸約六百公尺時，擦撞一輛機車後逃入巷弄，警方圍捕攔截，陳男見無路可逃，下車趴地就逮，座車方向盤滿是其雙手留下的血跡，其手部及虎口亦有刀傷，由員警戒護送往國軍台中總醫院中清院區治療，並報請台中地檢署指揮偵辦。陳男持刀追殺女友，女友一路逃跑。（民眾提供）陳姓男子持刀砍殺女友致死，開車逃跑被逮。（民眾提供）    ,https://news.ltn.com.tw/news/society/paper/1748636
騙加盟詐千萬 「典芋長」收押,社會,2026/03/28 05:30,「典芋長」負責人黃柏偉被移送偵辦。（記者邱俊福翻攝）至少16人血本無歸「典芋長」芋圓專賣店負責人黃柏偉，自二〇二三年起涉透過網路社群平台投放加盟投資廣告，稱可提供加盟創業輔導、設備及原料供應等一條龍式服務，甚至可協助貸款籌措資金，未料加盟人花錢加盟及裝潢店面後，黃男的器材設備、包裝等均未履約到位，店面無法開幕，血本無歸。刑事警察局偵四大隊第二隊據報逮捕黃男，檢方依加重詐欺、洗錢罪向法院聲押獲准；初步清查，至少有十六人受騙，財損約一三〇〇萬元。改名芋霸四海續騙檢警追查，不少股東、加盟人組自救會提起訴訟及投訴媒體後，黃男竟持續透過網路平台刊登加盟相關廣告，故意改以「芋霸四海」名義招攬加盟投資，十分惡質。請繼續往下閱讀...警方調查，黃男以甜品品牌「典芋長」名義，透過網路社群平台投放加盟投資廣告，吸引民眾上門洽詢加盟及投資，黃男於招攬加盟過程中，會向有興趣的民眾，以話術包裝加盟內容，加盟餐車開價四十萬至六十萬元，店面則要九十八萬元，並簽署不明確的加盟契約。不少加盟人簽約付錢後，找地點租店及裝潢好店面，卻發覺黃男承諾的設備、原料供應等加盟事項，均未依預期進行，一再拖延履約內容，造成無法開幕，不僅加盟金拿不回來，還要負擔租金、貸款，造成雙重損失，求償無門。警方於本月十一日，逮捕黃男與涉嫌提供帳戶的范姓越南籍女友到案，檢方複訊後將黃男聲押獲准，諭知范女限制住居。    ,https://news.ltn.com.tw/news/society/paper/1748639
迷玄學想裸奔 母阻止遭亂刀砍重傷,社會,2026/03/28 05:30,張男弒母後上街頭裸奔遭警方壓制。（民眾提供）70歲老母親 搶回一命台中市南區廿六日晚間驚傳駭人弒母案，卅九歲張姓男子疑思覺失調症、沉迷玄學宗教，案發時試圖裸體出門遭母親制止，張男涉持菜刀猛砍七十歲母親，造成頭、頸及四肢多處嚴重受創大量出血，幸搶救撿回一命，裸身跑上街頭的張男隨後遭警方逮捕並強制就醫，全案依殺人未遂罪法辦。據了解，張男原本有工作、行為正常，前陣子不知何故住院，近期迷上玄學宗教加上疑患思覺失調症，情緒不穩定。他前天下午就曾裸體衝上頂樓，被父親帶回家，對於為何脫光光出門說不出所以然，當晚他又要裸體出門，遭到母親制止時，竟揮刀砍傷母親。請繼續往下閱讀...渾身血 沿街狂奔被捕鄰居說，案發時張家傳出激烈爭吵與尖叫聲，隨後張男裸身從九樓住處衝出社區大樓，右手持菜刀、左手抱著AED（自動體外心臟電擊除顫器），身上沾滿血跡，沿街狂奔約一點四公里，路上民眾見狀驚恐閃避。轄區第三分局接獲通報趕抵，使用辣椒水將張男制伏上銬，強制送醫。喊為何殺我 強制就醫張男到院時情緒激動，不斷高喊：「為什麼要殺我？」但其身上看不出有傷，血跡均為噴濺血漬。警方查出，案發時張父外出買菜，返家驚見妻子倒臥血泊，立即報案求助，張母頭部及四肢有多處傷勢，張男也就醫中，警方將待兩人情況穩定再進一步調查，同時釐清張男的精神狀態。台中市社會局表示，該家庭沒有家暴通報紀錄，警方將協助相關人聲請緊急保護令，社工人員也將視當事人需求提供相關福利資源。    ,https://news.ltn.com.tw/news/society/paper/1748638
叭一聲被嗆！機車騎士掉頭理論 反遭檢舉違規吃單,社會,2026/03/27 23:37,因喇叭誤會引衝突，機車騎士（左）違規反遭檢舉挨罰。（民眾提供）高雄市新興警分局今（27）日上午時獲報行車糾紛，小貨車司機不滿被機車按喇叭，王姓騎士迴轉掉頭與司機潘男當街大吵。警方獲報處理，對騎車開罰600至1800元罰單。警方調查，57歲王姓騎擔心小貨車未留意太靠近他，恐發生擦撞，按喇叭提醒，50歲司機潘男怒嗆「叭三小」。請繼續往下閱讀...王男掉頭到小貨車旁，雙方在路上爭吵。警方獲報到場處理，經查閱檢舉人提供的行車紀錄器影像，確認王姓騎士涉嫌違規駛入來車道。警方依《道路交通管理處罰條例》第45條相關規定，針對王男交通違規部分開單，可裁罰新台幣600至1800元罰鍰。警方提醒民眾，行車時應相互禮讓，切勿因一時氣憤採取違規駕駛行為。若遇交通糾紛，請保持冷靜並撥打110報案，切勿有不理性行為，共同維護道路交通秩序。    ,https://news.ltn.com.tw/news/society/breakingnews/5385182
撞壞阿里山林鐵號誌桿肇逃  26歲男到案稱一時驚慌,社會,2026/03/27 23:24,劉男開車自撞阿里山林鐵平交道設施。（阿里山林鐵及文資處提供）26歲劉姓男子今清晨3點許，開車行經嘉義市博東路，自撞阿里山林業鐵路第15號平交道號誌桿等設施後，又撞上電線桿、路旁停放車輛，之後棄車逃逸；警方中午查獲劉男，聲稱驚慌失措才逃離現場。警方調查，劉姓駕駛沒有酒駕，供稱事故發生後，因一時驚慌、手足無措，才未依規定留在現場報警處理，而逃離現場。劉男涉及違反《道路交通管理處罰條例》，從嚴處以1000元至3000元罰鍰，並吊扣駕照1至3個月。請繼續往下閱讀...警方呼籲，民眾駕車應遵守交通規則，如發生交通事故，務必保持冷靜，留在現場處理及報警，勿肇事後逃逸，否則恐觸法。    ,https://news.ltn.com.tw/news/society/breakingnews/5385181
3/27 今彩539頭獎開3注！800萬落高雄、彰化、桃園,社會,2026/03/27 22:14,3月27日開獎的今彩539頭獎開出3注，獎落高雄、彰化、桃園。（本報合成）3月27日開獎的今彩539頭獎開出3注，由高雄市大寮區鳳林四路20之1號的「金正富彩券行」、彰化縣北斗鎮光復里復興路371號的「鑫永旺彩券行」及桃園市桃園區大有里大有路507號1樓的「長億彩券行」開出；大樂透頭獎摃龜。第115000039期大樂透中獎號碼「04、08、23、26、29、36，特別號：38」。頭獎摃龜；貳獎開出2注，可得70萬8995元；參獎共47注中獎，每注可得3萬4290元；肆獎共107注中獎，每注可得9174元；伍獎共2266注中獎，每注可得2000元；陸獎共2634注中獎，每注可得1000元；柒獎共2萬5167注中獎，每注可得400元；普獎共3萬7146注中獎，每注可得400元。請繼續往下閱讀...第115000039期49樂合彩中獎號碼為「04、08、23、26、29、36」。四合共5注中獎，每注可得20萬元；三合共133注中獎，每注可得1萬2500元；二合共3786注中獎，每注可得1250元。第115000077期今彩539中獎號碼為「08、18、24、34、35」。頭獎3注中獎，每注可得800萬元；貳獎共179注中獎，每注可得2萬元；參獎共6960注中獎，每注可得300元；肆獎共7萬8004注中獎，每注可得50元。第115000077期39樂合彩中獎號碼為「08、18、24、34、35」。四合共開出3注，每注可得21萬2500元；三合共223注中獎，每注可得1萬1250元；二合共1萬1071注中獎，每注可得1125元。第115000077期3星彩中獎號碼為「124」。壹獎共114注中獎，每注可得5000元。第115000077期4星彩中獎號碼為「1328」。壹獎共38注中獎，每注可得5萬元。確切中獎號碼以台彩網站公告為主，請見「台灣彩券網站」。大樂透、49樂合彩中獎號碼。（擷取自台彩官網）今彩539、39樂合彩、3星彩、4星彩中獎號碼。（擷取自台彩官網）    ,https://news.ltn.com.tw/news/society/breakingnews/5385149
按摩性侵女大生稱「她很享受」 足浴店長賠錢判2年4月,社會,2026/03/27 21:56,按摩店店長被控趁機性侵女大生，被高雄高分院判刑。（情境照）某大學附近小有名氣足浴會館，吸引不少女大生上門消費，歐姓店長替甲女按摩，涉嫌趁機性侵後，竟辯稱她很享受，被高等法院高雄分院判處徒刑2年4月。警方調查，2024年6月9日晚上10點半，高雄某足浴會館歐姓店長為大學生甲女提供按摩服務，趁她熟睡之際，涉嫌撫摸私處。甲女驚醒後，因全身無力，又遭歐男性侵得逞。請繼續往下閱讀...後來，甲女藉機支開歐男，穿上衣服後，放1000元在櫃檯離去，隔天向轄區分局報案，警方傳喚歐男到案製作筆錄後，依涉嫌乘機性交函送地檢署偵查、起訴。歐男一度願意賠償30萬和解，希望能夠從輕量刑，並寫信道歉，但被甲女拒絕。地院承辦法官調查，歐男在檢方偵訊時，辯稱甲女是合意性交，當時她很享受，否認犯行，直到院方審理才認罪，毫無悔意，判處有期徒刑3年半；歐男不服上訴，高雄高分院審酌他後來賠償和解，從輕改判2年4月，仍可上訴。    ,https://news.ltn.com.tw/news/society/breakingnews/5385137
求復合不成追殺前女友 台中雙刀狠男被捕只認這件事,社會,2026/03/27 21:40,陳男追殺前女友的驚悚畫面曝光。（民眾提供）台中市西區今（27）日傍晚發生情殺命案，30歲陳姓男子多次聯繫26歲巴姓前女友未果，竟開車到女友住處附近「堵人」，見她獨自走在忠明路騎樓，下車攔人談判，疑求復合未果，竟當街持刀追殺刺頸，釀成女方傷重不治悲劇。陳男犯案後開車逃逸，在巷弄內被警方圍捕落網。他被捕時神情冷靜，只承認雙方是前情侶關係，其餘保持沉默；戒護就醫中。請繼續往下閱讀...據了解，兩人下午5點多在忠明路騎爆發激烈口角，陳男亮小刀狂追前女友，不斷揮砍，巴女臉部多處刀傷、鮮血直流。兩人在人行道與車道間拉扯、跌倒翻滾，目擊者指出，女子呼救聲淒厲，一對路過情侶見狀上前制止，31歲王姓男子挺身阻擋，遭砍傷頭部，血流不止。巴女不支倒地，陳男仍未罷手，竟拿出另一把較大的刀具猛刺她頸部，插入要害，巴女當場失去生命跡象，倒臥血泊之中。陳男行凶後開車逃逸約600公尺，途中擦撞機車，逃入巷弄，圍捕警網在北區、西屯區一帶攔截，陳男見無路可逃，自行下車趴地就逮，車內方向盤滿是血跡，手部及虎口也有刀傷，由員警戒護送醫。全案已報請台中地檢署檢察官指揮偵辦，全案朝殺人罪偵辦，建請羈押。相關新聞：台中又爆情殺！女「脖子插刀」當街倒地送醫不治 行凶男抓到了女台中當街遇刺「脖子插刀」倒地 情殺現場驚悚畫面曝台中情殺狠男雙刀追殺！前女友倒地補刀插頸 正義哥阻擋也被砍台中男持刀追砍前女友 當街砍殺駭人畫面曝台中當街遭前男友追殺刺頸亡 職能治療師身分曝光    ,https://news.ltn.com.tw/news/society/breakingnews/5385107
2小時6火警！高雄大寮同條路連2天9起  林園警火速逮捕縱火男,社會,2026/03/27 21:18,林園警分局逮捕縱火吳姓男子。（民眾提供）高雄市大寮區河堤路連續2天發生9起雜草火警，最離譜的是，今（27）日上午2小時發生6起，其中更有2分鐘內接連發生，警方調閱監視器調查，晚間逮捕縱火的吳姓男子，他向警方說，因為失業心情不好縱火。警消近日因掃墓火警已經疲於奔命，吳男竟有惡意行為，警方將釐清真正原因。高市消防局表示，今大寮區連續接獲河堤路三段沿路雜草火警，報案時間分別於9時03分、9時30分、10時02分、10時04分、10時47分及11時02分共6件，雖然迅速撲滅，無人受傷受困，因起火地點分散且發生頻率異常，且昨天同地也有另3起火警，消防人員直覺不單純，立即通知員警。請繼續往下閱讀...林園分局成立專案小組展開調查，鎖定住在小港區46歲吳姓男子涉有重嫌，吳男獨自騎機車上河堤，使用打火機點火，警方晚間將吳嫌帶案調查，全案已報請高雄地檢署指揮偵辦，並依公共危險縱火罪嫌移送。大寮區河堤路2天發生9起火警。（民眾提供）消防人員連續接獲火警報案，疲於奔命。（民眾提供）    ,https://news.ltn.com.tw/news/society/breakingnews/5385109
手刀對獎！3/27大樂透、今彩539、3星彩、4星彩獎號出爐啦,社會,2026/03/27 20:54,大樂透開獎號碼。（擷取自三立iNEWS《全民i彩券》）今天（3月27日）台彩各項開獎獎項及獎號。大樂透：04、08、23、26、29、36，特別號：38。請繼續往下閱讀...49樂合彩：04、08、23、26、29、36。今彩539：08、18、24、34、35。39樂合彩：08、18、24、34、35。3星彩：124。4星彩：1328。確切中獎號碼以台彩網站公告為主，請見「台灣彩券網站」。今彩539、39樂合彩開獎號碼。（擷取自三立iNEWS《全民i彩券》）3星彩開獎號碼。（擷取自三立iNEWS《全民i彩券》）4星彩開獎號碼。（擷取自三立iNEWS《全民i彩券》）    ,https://news.ltn.com.tw/news/society/breakingnews/5385097
