Title,News_Type,date,content,url
建交後最大規模！視察史國戰略儲油槽、產創園區 賴總統：台灣是可靠夥伴,政治,2026/05/03 21:38,賴清德總統（中）前往三樓露天觀景台，俯視「台灣產業創新園區」第一期全景。（總統府提供）正在訪問史瓦帝尼的總統賴清德，當地時間3日在王家科技園區時表示，「戰略儲油槽」及「台灣產業創新園區」是兩國建交以來規模最大、最具戰略意義的計畫，面對全球供應鏈重組、氣候變遷及人工智慧浪潮，台灣就是史瓦帝尼既可靠又具韌性的合作夥伴，期待台史攜手開拓非洲市場，共創更大經濟價值。賴清德抵達後，分別聽取海外投資開發公司及台灣世曦工程顧問公司針對「戰略儲油槽」及「台灣產業創新園區」簡報，隨後前往三樓露天觀景台俯視第一期產創園區全景。賴指出，這兩項是兩國建交以來規模最大、最具戰略意義的合作計畫，象徵攜手邁向更加燦爛繁榮的未來，誠摯感謝恩史瓦帝三世國王、史瓦帝尼政府及人民，對台灣的充分信任和全力支持。請繼續往下閱讀...賴清德表示，「戰略儲油槽」代表的是因應風險與危機的能源安全與國家韌性；「台灣產業創新園區」代表的是面向未來的產業布局與發展希望。前者守護穩定，後者開創成長，這正是台史合作邁向下一個階段的重要里程碑。賴清德認為，面對國際情勢的快速變化，全球供應鏈的重組、氣候變遷的挑戰、人工智慧的浪潮，值得信賴的夥伴關係比以往都更加重要，而台灣就是史瓦帝尼既可靠又具韌性的合作夥伴。賴清德指出，史瓦帝尼是台灣在非洲的堅定盟友，也是台商前進非洲的重要門戶，期盼藉由「台灣產業創新園區」吸引更多台灣企業前往投資、帶動就業，並促進更多在地企業融入全球供應鏈，提升史瓦帝尼的國家經濟韌性。賴清德說，「台灣的產業走到哪裡，台灣的實力就延伸到哪裡；台商的腳步走到哪裡，台灣的友誼就播種到哪裡」，未來，台灣和史瓦帝尼將在製造業、農業加工、數位轉型以及人才培育等領域持續加強合作，促進產業升級與經濟多元發展，更希望與史瓦帝尼攜手開拓非洲市場，共同創造更大的經濟價值。賴清德強調，台灣需要世界，世界也需要台灣，台灣希望與史瓦帝尼攜手走進世界，將持續以「價值、韌性與科技」三大優勢，與史瓦帝尼及理念相近夥伴深化交流合作，打造更安全、值得信賴的供應鏈體系與夥伴關係。真正深厚的友誼落實在一項又一項的合作成果之中，盼台史攜手前行，讓兩國的繁榮前景在世界發光。賴總統聽取戰略儲油槽簡報。（總統府提供）「台灣產業創新園區」第一期全景。（總統府提供）    ,https://news.ltn.com.tw/news/politics/breakingnews/5424248
「水獺媽媽」板橋說繪本  蘇巧慧要當神隊友、打造育兒友善環境,政治,2026/05/03 21:00,民進黨新北市長參選人蘇巧慧（持麥克風）說，未來不論她在什麼樣的位置，都會繼續認真地講故事給小朋友聽，做爸媽的神隊友。（蘇巧慧辦公室提供）民進黨新北市長參選人蘇巧慧今天行程滿檔，她今午再化身「水獺媽媽」到板橋和親子分享繪本故事，也在母親節前夕，感謝全天下母親的辛勞，活動很快就報名額滿，她深受感動。蘇巧慧強調，未來不論她在什麼樣的位置，都會繼續認真講故事給小朋友聽；未來若有機會做新北市長，她也會努力打造更友善的育兒環境，做爸媽的神隊友。蘇巧慧今也和民進黨新北市議員戴瑋姍、石一佑、黃淑君、新北市議員參選人陳俊諺，帶著孩子們練習剪指甲、梳頭髮、按摩、散步等照顧及陪伴長輩的台語，讓小朋友在趣味互動中學習，蘇巧慧徵求志工爸媽上台，和她一起說故事，形成不論大人、小孩紛紛搶著舉手的有趣畫面，氣氛溫馨熱絡。請繼續往下閱讀...蘇巧慧成立《水獺媽媽巧巧話》Podcast頻道5年多，開播至今已播出超過340集，累積播放次數至今已突破500萬，蘇巧慧說，自去年起也走出錄音室舉辦實體活動，這次與出版社合作的說故事活動，40組名額不到1小時便額滿，讓她深受感動，有愈來愈多大小朋友收聽，現在任何地方都會巧遇小水獺粉絲，甚至有小朋友看見她就馬上衝過來抱住，讓她很感動。她強調，未來不論她在什麼樣的位置，都會繼續認真地講故事給小朋友聽。媒體問及，今天活動是不是再次積極搶攻親子票？蘇巧慧回應，每個活動她都認真參與，而且收穫滿滿，也看到大家很多的祝福，她真的非常喜歡跟小水獺們見面、說故事給他們聽。她指出，母親節是感恩的日子，這幾年她有機會得到大家疼惜，為全新北服務，心懷感恩，所以現在每天行程真的都非常滿；今午再排除萬難到板橋和「小水獺」粉絲相見歡，準備了《媽媽商店》、《阿祖的日子紙》繪本故事與親子分享，她非常感謝合作活動的出版社這幾年來和她一起為了親子教育議題努力，未來若有機會擔任新北市長，她也會努力打造更友善的育兒環境，讓小朋友安心、快樂地長大，做爸媽的神隊友。蘇巧慧（圖中持麥克風者）說，未來若有機會擔任新北市長，她會努力打造更友善的育兒環境，讓小朋友安心、快樂長大。（蘇巧慧辦公室提供）    ,https://news.ltn.com.tw/news/politics/breakingnews/5424217
估地方墊支TPASS恐6月見底 顏若芳籲：停止政治消耗速審總預算,政治,2026/05/03 20:42,台北市議員顏若芳呼籲，立法院既然已在4月21日將總預算付委，就該立刻停止政治消耗，全速完成全案實質審查，讓地方財政回歸正常。（取自顏若芳臉書）立法院近日朝野協商達成共識，將今年度總預算案交付委員會審查，也籲請政院執行718億元新興計畫預算，其中包含TPASS等項目。不過，因立院日前拒審總預算，TPASS 2.0的常客優惠回饋金仍然延遲發放，讓民眾權益受損，基北北桃市政府也需代墊預算。台北市議員顏若芳表示，鑑於中央總預算審查進度延宕，通勤月票補助款確實仍由地方政府先行墊支，但這終究治標不治本；地方政府不可能無限期舉債或挪用配合款來墊付缺口。她保守估計，這些代墊款撐到6月就會破產，唯一的解方根本不在於法律詮釋大戰，而是立法院既然已在4月21日將總預算付委，就該立刻停止政治消耗，全速完成全案實質審查，讓地方財政回歸正常。請繼續往下閱讀...顏若芳提到，部分藍營首長當初宣稱可以用去年度結餘款先墊，但基北北桃四市的結餘款僅約7億元，而台北市單月就需要補貼2.51億元，根本是杯水車薪。現在客運業與地方財政都在苦撐，在野黨不循正軌盡速審查預算，反而企圖用法律約束力存疑的公決案逼迫行政院違法動支，這是把政治鬥爭凌駕於民生福祉之上，令人感到非常遺憾與可悲。關於李四川提出擴大TPASS、納入高鐵，顏若芳直言，連最基礎的預算都還卡在立法院面臨斷炊危機，現在加碼喊出要納入高鐵，無疑是開出不知財源在哪的空頭支票。她也提到，政策是為減輕民眾日常市區通勤負擔，而高鐵屬於高單價且高度稀缺的長途運輸資源。目前高鐵尖峰時段運能早已飽和，若貿然納入這種低邊際成本的月票機制，不僅會大幅增加政府補貼負擔、排擠既有市區通勤資源，更會造成短途客占用尖峰座位，嚴重削弱高鐵服務品質。    ,https://news.ltn.com.tw/news/politics/breakingnews/5424216
川普若放棄台灣 法國大報專訪吳志中：美國將失去在亞洲信譽！,政治,2026/05/03 20:27,吳志中接受法國《世界報》專訪。（資料照）美國總統川普將於本月中出訪北京並與中國國家主席習近平會面，引發國際關注。曾擔任我國駐法代表的外交部次長吳志中，近日接受法國第一大全國性日報《世界報》（Le Monde）專訪，重申台灣在世界上越來越重要的戰略地位，直言若川普在與習近平見面時表露出放棄台灣的態度，那麼美國將失去在印太地區的信譽。法國《世界報》今天（3日）刊出吳志中的專訪報導，首先就提到我國總統賴清德日前遭受中國外交封鎖未能如期到訪友邦史瓦帝尼一事，吳志中直言這起事件恰恰體現中國對台不斷施加壓力，但這並不能阻止台灣成為世界不可或缺的一部分，全球約70%的半導體、95%的最先進晶片，以及100%的人工智慧（AI）晶片、80%的伺服器零組件均由台灣製造。請繼續往下閱讀...除此之外，台灣海峽是全球航運命脈，每年有6萬艘貨櫃船經過台海，是蘇伊士運河（Suez Canal）或巴拿馬運河（Panama Canal）的3倍，承載全球50%的貨物運輸量及88%的大型船舶。近年包括法國、荷蘭、德國、義大利等歐洲國家，都派遣軍艦或與日本舉行演習，是因為各國明白該區域穩定符合其共同利益。吳志中表示，自中國接管香港以來，台灣在政治上已經成為華語世界「最後的可靠夥伴」，不同於中國霸道的行事作風，台灣是「值得信賴的夥伴」，盼望在國際社會發揮積極作用，「『Taiwan can help』是我們的⼝號。有些國家選擇以粗暴⼿段爭取國際認可，但台灣選擇了不同的道路。」吳志中被問到對於北京指責賴總統是「分離主義者」的看法時回應道，台灣早已是個主權國家，不必另外尋求獨立，要去談「統一」這個議題，那麼就會落入中共的敘事陷阱，配合這種敘事方式將為中國侵略台灣提供正當性。就台灣的立場而言，我們竭力避免戰爭，但也會做好準備，只要我們不斷發出不同意中國吞併我們的信號，獲取更多國家的支持，中國要想破壞現狀就越發困難。至於接下來預計於本月中登場的川習會，吳志中指出，我方不希望台灣被提上議程，台灣對美國而言至關重要，若川習會真的談到台灣，而川普表露出「放棄台灣」的態度，那麼美國將失去在印太地區的信譽。吳志中更舉台積電當例子，許多美國大型企業都依賴台積電，例如輝達最先進晶片100%產⾃台灣，如果美國允許中國控制先進晶片製造技術，他們的損失將無法彌補。    ,https://news.ltn.com.tw/news/politics/breakingnews/5424148
賴總統突圍出訪史瓦帝尼 華爾街日報：台灣出奇制勝,政治,2026/05/03 19:55,總統賴清德突破封鎖抵達史瓦帝尼，華爾街日報（WSJ）報導，受中國打壓和爭取國際認同的台灣，在這場意志較量中出奇制勝。（擷自華爾街日報官網）總統賴清德原訂上月出訪友邦史瓦帝尼因非預期外力暫緩後，昨天發文說已抵達史瓦帝尼，華爾街日報（WSJ）報導，受中國打壓和爭取國際認同的台灣，在這場意志較量中出奇制勝。賴總統原訂4月22日出訪史瓦帝尼的行程暫緩。總統府表示，塞席爾、模里西斯和馬達加斯加3國在無預警狀況下，無端取消專機飛航許可，實際原因是中國以經濟脅迫在內的強力施壓。請繼續往下閱讀...不過，賴總統昨天在社群媒體發文表示，經過外交與國安團隊連日來的縝密安排，他已在當天稍晚順利抵達史瓦帝尼。至於如何抵達，賴總統並未公開說明。報導指出總統府隨後發布勝利的訊息。總統府發言人郭雅慧表示，儘管日前因為無端的外力因素導致總統行程暫緩，但這影響不了台灣走向世界的意志。華府智庫「大西洋理事會」（Atlantic Council）駐台北分析師宋文笛（Sung Wen-ti）認為，圍繞賴總統出訪史瓦帝尼的一連串爭議事件，凸顯北京不擇手段打壓台灣，「台灣將竭力證明自己不會任憑北京實質封殺台灣的國際能見度」。台灣官員表示，待總統結束國是訪問返台後，才會公布總統抵達史瓦帝尼的具體過程。    ,https://news.ltn.com.tw/news/politics/breakingnews/5424190
2026歐洲日音樂會衛武營登場  陳其邁：國際交流持續在高雄深化,政治,2026/05/03 19:36,歐洲日系列音樂會邀請奧地利鋼琴大師魯道夫．布赫賓德與貝桑頌國際指揮大賽三冠王吳曜宇、NSO國家交響樂團合作。（行國處提供）2026歐洲日系列音樂會首度在高雄登場，受邀出席的市長陳其邁指出，感謝歐洲頂尖音樂饗宴能來高雄，除代表台歐堅定情誼、也讓國際交流在高雄持續深化。歡慶歐洲日，歐洲經貿辦事處策畫「2026歐洲日系列音樂會」首度在高雄衛武營國家藝術文化中心登場，邀請奧地利鋼琴大師魯道夫．布赫賓德（Rudolf Buchbinder）擔綱演出。請繼續往下閱讀...布赫賓德被譽為當今維也納鋼琴學派權威指標，這次與貝桑頌國際指揮大賽三冠王吳曜宇及NSO國家交響樂團合作，攜手呈獻布拉姆斯（Johannes Brahms）鋼琴協奏曲，透過大師精湛的琴藝與交響樂團磅礴編制，讓觀眾感受歐洲古典音樂的深厚底蘊。歐洲經貿辦事處長谷力哲表示，今年為第二年以音樂會形式慶祝歐洲日，也是首次到高雄舉辦，盼透過歐洲音樂家與NSO國家交響樂團合作，展現台歐文化交流。陳其邁特地感謝谷力哲處長的支持，讓高雄加入歐盟「國際城市夥伴計畫」，在智慧交通與數位治理等領域與歐洲各城市展開深度交流；而高雄與歐盟合作日趨緊密，除經貿交流外，也拓展至文化、藝術及城市交流等多元面向。陳其邁強調，歐洲日象徵著和平與團結，在當今快速變動的地緣政治下，台灣與歐洲作為共享民主、自由與人權價值的堅定夥伴，雙方的合作不僅超越經貿，更在城市治理與區域安全上建立起緊密連結。歐洲日系列音樂會首度於高雄衛武營國家藝術文化中心登場，歐洲經貿辦事處谷力哲、高雄市長陳其邁連袂出席。（行國處提供）    ,https://news.ltn.com.tw/news/politics/breakingnews/5424183
罵斑斑「殘障」三腳狗犯眾怒 陳佩琪不解：有需要把我罵成這樣？,政治,2026/05/03 19:35,柯文哲妻子陳佩琪。（資料照）前民眾黨主席柯文哲的妻子陳佩琪，日前又在社群情勒社會大眾，抱怨「我的先生柯文哲，在你們這些人心目中，竟比賴清德的那隻殘障三腳狗斑斑都還不如」，這番明顯帶有歧視身障與動物的言論隨即引發輿論撻伐。今天（3日）陳佩琪再度發文回應外界抨擊，辯稱自己沒有歧視的意思，堅持不為失言道歉。陳佩琪上週三（4/29）在臉書嗆總統賴清德領養的愛犬「斑斑」是「殘障三腳狗」掀起軒然大波，但陳佩琪不覺自己失言，回嗆廣大網友稱自己也有多重殘障手冊，「殘障又怎麼嗎？」她還一副委屈隔空向斑斑說：「經過這幾天、這麼多人幫您出氣，把我這人類罵得體無完膚，數天有數十則，有些還高掛頭版頭條，斑斑您看了，心情應該好多了吧？我這人類啊，雖跟您一樣殘障，且是比您還凄慘的多重殘疾，但是實在不如您啦，被綠媒網軍柯黑名嘴攻擊到體無完膚，他們都幫您在罵我，讓我好生羨慕喔！」請繼續往下閱讀...網友怒火越燒越旺，陳佩琪今天下午再次發文，「當大家focus在狗狗不應該被人用『殘障』一詞形容的當下，在此要卑微的請求、我要請求台灣社會重視我的先生柯文哲的人權，特別是在司法方面，他在台灣貢獻了這麼多年，他當了25年的重症醫師、8年首都市長、5年創黨的黨主席，捫心自問何以致此、你們要如此對待他？」「另外這幾天有許多不知道是『人權』團體、還是『動保』團體的，出來說我不可用『殘障』一詞來形容狗，若是動保團體也就罷了，竟還有人權團體出來幫狗被用『殘障』一詞形容說話的，但這些人權團體卻無視我先生這些年來在司法和媒體上所受到的『豬狗不如』的待遇。」「他是一個當了25年的重症醫師、8年首都市長、5年創黨黨主席啊，所受待遇竟比狗被用『殘障』一詞形容還不重要？就算你們要維護狗權，也要重視狗在台灣角落有無數沒被善待的流浪狗啊，你們在關注我用什麼形容詞形容斑斑的同時，有沒有注意到斑斑有一群同伴、更需要你們的關注和援手呢？」她強調自己沒有歧視的意思，「我自己在外頭買交通票，也都跟人講『我有殘障手冊』，請問有需要我用一個『殘』字講斑斑這隻狗，就把我罵成這樣嗎？」陳佩琪還舉例，稱自己身為小兒神經科兼新生兒專科醫師，接觸過許多癲癇、因先天基因變異造成遲緩的患者，幫這些人開殘障手冊時也知道有機構建議不要用到「殘」這個字、避免使用「癲癇」一詞，但患者家屬都不以為然，認為這類稱呼並不構成歧視，她過去在臉書也寫過很多次文章，生病沒什麼好丟臉的。    ,https://news.ltn.com.tw/news/politics/breakingnews/5424135
央視插播痛罵賴清德「偷渡式外交」 謝寒冰補刀譏笑問1句被罵翻！,政治,2026/05/03 19:30,賴清德擺脫中國外交打壓，成功出訪史瓦帝尼。（圖翻攝自賴清德臉書）總統賴清德突破中國外交封鎖，成功抵達我國友邦史瓦帝尼。消息一出，中共官媒《央視》隨即插播新聞痛罵賴清德，還有親藍名嘴酸賴清德偷偷摸摸，並以充滿戲謔的口吻笑問「你要怎麼回來？」，遭台網砲轟。賴清德原定4月22日率團出訪史瓦帝尼，但因為中國施壓塞席爾、模里西斯、馬達加斯加3國取消專機飛航許可，導致行程在出發前夕臨時喊卡。可就在昨天（2日）傍晚，賴清德透過臉書無預警宣布，自己已順利抵達史瓦帝尼，引發熱烈討論。請繼續往下閱讀...據悉，經外交與國安團隊縝密安排，史王恩史瓦帝三世（H.M. King Mswati III）派出史國副總理札杜莉（Thulisile Motsa Dladla）擔任特使，搭乘國王專機來台，本月2日凌晨賴清德搭乘該專機從台北直飛史瓦帝尼，成功衝破封鎖。消息曝光後，《央視》緊急插播新聞，痛罵賴清德「偷偷鑽進一架外國飛機溜出台灣，大肆揮霍公帑，上演偷渡式外竄鬧劇，淪為國際笑柄」。另外，專門對台進行政治宣傳與資訊戰的抖音帳號「台海時刻」，也截錄名嘴謝寒冰在親藍政論節目上恥笑賴清德的片段，謝寒冰酸賴清德去個友邦要「弄得像小偷一樣，其實真的滿難看的」。謝寒冰還問賴清德，面對中國外交封鎖，「你要怎麼回來？」，接著露出嘲諷意味十足的笑容。網友看不下去，紛紛表示「謝寒冰你的譏笑法，真的醜陋到無下限，都不希望台灣變得更好嗎？請你滾出台灣去做中國人，丟臉！」、「牠真的很噁，匪台的紅嘴都面目可憎」、「我就ven 有花到中國的人民幣嗎」、「又不是花中共國的錢，花公帑怎麼了嗎」、「所以台灣總統若出事你們就這麼高興，總是有一群急著唱衰台灣」、「看到這些垃圾人的嘴臉真的覺得很好笑」、「真正難看的是你自己和中共，見不到總統好，見不得台灣進步，執政黨做什麼在你眼裡都是錯的」。     在 Threads 查看謝寒冰嘲諷味道十足地笑問賴清德要怎麼回台灣。（圖翻攝自Threads）    ,https://news.ltn.com.tw/news/politics/breakingnews/5424047
竹市「混夏趴！國國生活節」登場 高虹安與新住民打造多元文化城市,政治,2026/05/03 19:26,「混夏趴！國國生活節」今在大湳雅公園登場，市長高虹安（中）與新住民同樂。（記者蔡彰盛攝）新竹市新住民初夏盛會「混夏趴！國國生活節」，今在大湳雅公園熱鬧登場，吸引逾1500名民眾參加。活動除延續歷年廣受好評的「國國市集」外，更融合親子互動、文化展演及露天電影院等多元內容，打造豐富精彩的夏日饗宴。市長高虹安也親自到場與民眾同樂，並熱情推廣新住民特色私房料理與原創商品，邀請市民朋友一同感受多元文化魅力，度過輕鬆愉快的週日午後。高虹安表示，新竹市是一座文化共融的城市，市府持續致力於營造友善、多元且包容的生活環境，讓來自不同背景的市民都能安心生活、穩定發展。針對新住民照顧，市府更不遺餘力，為協助在竹市約1萬1000名新住民順利定居與發展，透過跨局處整合資源並結合民間力量，設置「新住民家庭服務中心」，提供諮詢、法律、親子及福利等多元服務。請繼續往下閱讀...此外，市府每年開設「新住民生活適應輔導班」及「新住民技能培訓專班」，並持續推動新住民增能計畫、親子活動及子女培力方案，從生活適應到能力培養全方位支持，協助新住民家庭加速融入在台生活，實現自我發展與向上成長。高虹安指出，本次由新住民家庭服務中心規劃辦理的「混夏趴！國國生活節」，延續已邁入第7年的「國國市集」，為市府每年重要的新住民特色活動之一。活動不僅提供新住民展現品牌特色與文化能量的舞台，也透過輕鬆有趣的親子互動設計，讓更多市民在參與過程中認識多元異國文化，進一步營造幸福、友善且包容的城市氛圍。社會處黃佳婷處長表示，今年活動導入「生活節」概念，整合特色市集、新住民藝文展演、親子闖關活動及露天電影院等多元內容，農業部動植物防疫檢疫署桃園分署亦帶領檢疫犬宣導及示範機場檢疫情形，讓民眾在初夏午後能與家人朋友一同放慢步調，享受輕鬆愜意的戶外時光，感受多元文化交織的溫度與魅力。社會處表示，今年「國國市集」集結18位新住民頭家熱情參與，帶來多元私房餐點與原創商品。美食愛好者絕不可錯過東南亞甜點專家「艷麗Pondoksunny」、「艾雷西亞法式烘焙」及「牛牛越式優格」，感受道地又富創意的異國風味；喜愛手作設計與質感生活的市民，也能在現場選購各式手工飾品、特色花藝與生活小物。活動透過多元文化交織激盪出創意火花，無論是品嚐美食或尋找獨具風格的手作商品，每一攤位都值得細細探索與體驗。    ,https://news.ltn.com.tw/news/politics/breakingnews/5424177
民眾黨「美女博士」脫黨轉戰北市議員 對手張志豪說話了,政治,2026/05/03 19:19,「美女博士」曾妍潔。（翻攝臉書「大姸的能源、建築、房地產手札」）「美女博士」曾妍潔。（翻攝臉書「大姸的能源、建築、房地產手札」）民眾黨台北市議員提名日前結束，原有意參選桃園市第二選區市議員的民眾黨「美女博士」曾妍潔，宣布自己將脫黨投入台北市第六選區（大安、文山）市議員選戰。她昨日發文表示，從決定參戰開始，就打定以無黨籍身分參選，沒要誰徵召，也沒要威脅誰，「因為我相信，實力，不需要附庸。我就是我！」拚連任的民眾黨大安文山市議員張志豪也回應曾參選是否有「搶票」疑慮，他強調，每個人參選意願都給予尊重跟祝福，「我們這邊就繼續、持續在地努力，繼續替大安文山付出。」曾妍潔在文中提到，從小從華聲幼稚園、木柵國小、萬興國小到萬芳國中⋯⋯一路走來，生於斯、長於斯。「家族在這片土地生活超過一甲子，文山區的點滴，我比任何人都熟悉；長期以來，文山被忽視、被邊緣，但這不代表我們應該被遺忘。」張志豪表示，台灣是自由民主國家，任何人都有參選參政權利。不過就他所知，目前台北市大安文山市議員提名作業已經完成，唯一提名張志豪。張志豪說，將會努力以赴、勤跑基層，實現選民希望跟付託。台北市議員張志豪。（記者蔡愷恆攝）    ,https://news.ltn.com.tw/news/politics/breakingnews/5424170
