Title,News_Type,date,content,url
南韓棒球名校嘲諷光州高中「去星巴克」 各界震驚恐影響未來選秀,國際,2026/07/01 14:22,南韓棒球名校培材高中，在和光州第一高中比賽時竟以「去星巴克」、「坦克日」等口號嘲弄對方。（美聯社）南韓首爾江東區棒球名校培材高中，29日在和光州第一高中比賽時，竟朝對手休息區大聲嘲弄「去星巴克」、「坦克日」等言語，消息傳出後引發各界震驚，可能會影響到培材本屆校隊球員未來的職棒選秀機會。據《韓聯社》報導，培材高中棒球隊嘲笑光州第一高中的口號，讓人想起南韓星巴克於5月18日推出「坦克日」爭議活動，當時外界抨擊這是在「5‧18」光州民主化運動的傷口上撒鹽、重現當年軍隊暴力鎮壓人民的情況，使得星巴克匆忙下架活動並道歉，近來還提前打烊讓全體員工進行歷史培訓。請繼續往下閱讀...據了解，光州第一高中在「5‧18」光州事件中發生時，棒球校隊差點遭到軍隊射殺，因此培材高中的口號被認為是在嘲笑該校傷痛，光州第一高中校長李圭淵（이규연，音譯）對此震怒向南韓棒壘球協會（KBSA）發出抗議信，目前已由KBSA體育道德委員會著手處理。南韓「5‧18」遺族協會、負傷者協會、功勞者協會、紀念基金會，對於培材高中球員的做法也都發聲抨擊，培材校方見狀倉皇發表道歉聲明，首爾教育廳已介入調查相關不當行為。培材高中透露，當時是有1名校隊成員在現有的加油口號上加入星巴克，其他球員聽到後也跟著起鬨。首爾教育廳今（1日）表示，培材校隊和教職員、家長希望前往光州第一高中致歉，不過由於光州第一高中指稱學生們在心理上還沒做好接受道歉的準備，之後培材還會再選擇恰當的時間到該校表達歉意。    ,https://news.ltn.com.tw/news/world/breakingnews/5490149
遠超官方數字！委國強震官員稱855棟建築受損 衛星照曝恐倒近6萬棟,國際,2026/07/01 14:03,委國官方數字表示，這起震災造成855棟建築受損，不過衛星照顯示災情恐遠超官方數字，衛星照分析，當地恐有逾5萬8870棟建築損壞或摧毀。（路透）委內瑞拉24日發生規模7.2和7.5雙強震，重創委國北部，目前官方數字表示，這起震災造成855棟建築受損，已釀1943死、1萬571傷，還有約5萬人失蹤；不過衛星照顯示災情恐遠超官方數字，NASA透過衛星照分析，當地恐有逾5萬8870棟建築損壞或摧毀。綜合外媒報導，根據美國太空總署發布報告指出，俄勒岡州立大學的研究人員分析歐洲太空總署「哨兵一號」（Sentinel-1）所拍攝的高解析度雷達影像，發現委內瑞拉大約有5萬8870座建築物可能遭到損壞或摧毀。請繼續往下閱讀...俄勒岡州立大學的研究人員分析，已被劃定為災區的拉瓜伊拉州（La Guaira）受創最重，該州29%的建築物可能遭到破壞，沿海地區受災更為嚴重。委內瑞拉官方數字顯示有855棟建築物遭到破壞，其中189棟完全倒塌。衛星數據分析曝光後，實際損失規模可能遠超出官方數字，加上仍有5萬人失蹤，專家擔心死亡人數將遠高於官方統計。與此同時，世界衛生組織（WHO）強烈警告稱，委內瑞拉的醫療設施已經超載，醫院人滿為患，連死者登記工作都未能妥善完成，恐會爆發大規模疫情。    ,https://news.ltn.com.tw/news/world/breakingnews/5490126
墨西哥厄瓜多踢出真火氣？ 胡采蘋曝斷交白蝦恩怨內幕,國際,2026/07/01 13:34,墨西哥以2：0擊敗厄瓜多，墨西哥球員在賽後慶祝。（路透）2026世界盃足球賽進行中，今天由墨西哥以2：0擊敗厄瓜多，挺進16強。對此，財經網紅胡采蘋今日直言，兩國私下早已累積深仇大恨，並笑說「因此如果您看球覺得雙方火氣怎麼那麼大，跟半夜瑞典帥哥們對法國的逆來順受完全兩樣風情，那表示您有很敏銳的嗅覺呢」。胡采蘋今於臉書粉專「Emmy追劇時間」發文指出，墨西哥跟厄瓜多其實雙方私下也是非常不爽，前年厄瓜多的前任左派總統因為貪腐問題被判刑，逃到了墨西哥大使館尋求政治庇護，沒想到厄瓜多現任總統非常兇，直接叫警方衝進使館抓人，墨西哥大暴怒，宣佈斷交。請繼續往下閱讀...厄瓜多新總統被斷交後，去年在川普對墨西哥課徵關稅時，竟然也跟進宣佈對墨西哥產品課徵關稅，墨西哥氣瘋，全面禁止厄瓜多白蝦進口。厄瓜多是世界第一白蝦大國，墨西哥不買，深受重創，只好跑去找中國買白蝦，中國經濟放緩，買蝦量本來就在下滑了，如何能再買？厄瓜多硬塞白蝦進來快要吃吐，也就更沒可能再買宏都拉斯白蝦了。世足》墨西哥2：0擊敗厄瓜多闖16強 收下40年來淘汰賽首勝厄瓜多警方硬闖使館抓前副總統 墨西哥總統震怒宣布兩國斷交    ,https://news.ltn.com.tw/news/world/breakingnews/5489946
中共成立105週年 習近平：堅決打擊台獨、反對外部勢力干涉,國際,2026/07/01 13:27,中國領導人習近平在中共成立105週年大會，強調會堅決打擊台獨分裂勢力、反對外部勢力干涉。（路透）中國共產黨成立105週年大會，今（1日）在北京人民大會堂舉行，中國領導人習近平強調會堅決打擊台獨分裂勢力、反對外部勢力干涉。習近平發表談話時向香港、澳門、台灣和海外僑胞問候，聲稱解決台灣問題、實現中國完全統一，是中共矢志不渝的歷史任務，是全體中華人民的共同願望，請繼續往下閱讀...習近平強調，未來必須要深入貫徹新時代黨解決台灣問題的總體方略，堅持「一個中國」原則和「九二共識」，團結廣大台灣同胞且深化兩岸交流合作和融合發展，堅決打擊台獨、反對外部勢力干涉。據《產經新聞》報導，習近平5年前在中國共產黨成立100週年大會上，對於台灣問題並未提到「外部勢力干涉」，可能是受到日本首相高市早苗去年11月對「台灣有事」表態所影響，特別在此次加入了「外部勢力」的內容。    ,https://news.ltn.com.tw/news/world/breakingnews/5490098
日本名古屋郵局疑遭噴灑防熊噴霧 7人感到不適,國際,2026/07/01 13:23,日本愛知縣名古屋流町郵局疑似被噴灑防熊噴霧，7人感到身體不適。（圖擷自Google街景）日本愛知縣名古屋市中區金山4丁目的「名古屋流町郵局」，今（1日）中午11時50分疑似有男子噴灑防熊噴霧，導致現場7人感到身體不適。據《產經新聞》報導，當時有民眾撥打119電話報案，指稱在名古屋流町郵局聞到類似防熊噴霧的味道，隨後郵局外面聚集了多輛警車和消防車輛，附近1名40來歲男子透露，他看到有女性從郵局內被抬出來到救護車上送醫。請繼續往下閱讀...愛知縣警方已帶回涉嫌噴灑噴霧的男子訊問，至於其身分、作案動機尚不清楚。名古屋流町郵局位於金山車站東邊300公尺處，周圍都是公寓大樓和餐飲店。    ,https://news.ltn.com.tw/news/world/breakingnews/5490043
談經濟比對日本！ 中國前清華大學教授遭舉報 課程中被警察帶出,國際,2026/07/01 13:07,"鄭毓煌課程中被警察帶出問話。（取自X）曾在中國清華大學任教16年的教授鄭毓煌，近日在課程中談到中國經濟「宏觀悲觀」，可能要持續20、30年，堪比日本經濟衰弱史，結果當場遭人舉報，不久後就有警察到場，把他帶出去談話。旅義華裔作家李穎今日在X上爆料指，鄭毓煌6月28日在北京《未來趨勢分析》講課過程中，2名民警突然到場將他帶出會場問話。根據在場網友爆料，鄭毓煌在課程中說中國未來經濟「宏觀悲觀」、「微觀樂觀」，估計要持續20至30年，並參考日本作為觀點，「其實老師也沒說啥」。請繼續往下閱讀...據查，鄭毓煌上個月在一段訪談中就曾談到，全球多國經濟正在飛快進步時，中國經濟卻不太好，「不是全球經濟不好，只是中國經濟不好」，只是他僅點到為止，並表示「不敢講太多」。鄭毓煌曾在清大任教16年，辭職後轉做自媒體，還創辦營創學院。6月28日，郑毓煌在北京《未来趋势分析》讲课过程中，两名派出所民警将其带出会场问话。据流出的课程内容，郑毓煌谈到“中国宏观悲观、微观乐观”“调整可能持续20至30年，参考日本”等观点。 https://t.co/786rQ58qEq pic.twitter.com/PRPuOdR9GL— 李老师不是你老师 （@whyyoutouzhele） July 1, 2026 6月28日，郑毓煌在北京《未来趋势分析》讲课过程中，两名派出所民警将其带出会场问话。据流出的课程内容，郑毓煌谈到“中国宏观悲观、微观乐观”“调整可能持续20至30年，参考日本”等观点。 https://t.co/786rQ58qEq pic.twitter.com/PRPuOdR9GL    ",https://news.ltn.com.tw/news/world/breakingnews/5490027
人倫悲劇！日本狠父砍死妻女 兒子倉皇逃出求救,國際,2026/07/01 12:58,日本長野縣男子持刀砍死妻子和女兒，兒子倉皇逃出家門求助。長野縣警車示意圖。（圖擷自「@119_utsugi」X帳號）日本長野縣東御市今（1日）早上7時15分許發生人倫慘案，46歲男子飯島啓輔不知為何持刀砍死妻子和女兒，14歲的兒子倉皇逃出家門後獲救。據《產經新聞》報導，劫後餘生的少年當時跑到住處附近的商店，向店家指稱自己遭到父親攻擊，業者見狀連忙撥打110報警，出勤警員前往少年住處後，發現屋內有1名成年女性和1名女孩的遺體。請繼續往下閱讀...警方隨後逮捕狠父飯島啓輔，將調查他殺害妻女以及殺害兒子未遂的罪嫌，案發民宅由飯島啓輔和妻子、兒女共4人居住，位於上越高速公路「東部湯之丸交流道」以東2公里處，附近都是住宅和農田。    ,https://news.ltn.com.tw/news/world/breakingnews/5489964
慘！美粗心父將小孩忘在車內 去托兒所接人才發現死在後座,國際,2026/07/01 12:06,美國佛州父親開車載兒子去托兒所，竟忘了讓小孩下車進去，等到放學開車來接人才發現孩子死在車內。圖為事發托兒所。（圖擷自Google街景）太粗心！美國佛州種植園市（Plantation）1名父親，6月29日開休旅車載著1歲11個月大的兒子去托兒所，竟然忘了讓小孩下車進去，等到下午開車來接人才發現男童死在車內後座，等於他一路載著兒子的遺體卻沒發覺。據《ABC》報導，種植園市警察局表示，29日下午5時39分許當地警消接獲報案，得知有兒童在車內無生命跡象，連忙趕往事發托兒所「A World of Discovery Academy」，但到場後發現小孩已明顯死亡。請繼續往下閱讀...托兒所老闆諾沃亞（Leslie Novoa）指出，這名父親開車前來準備接兒子時，到了停車場才發現自己把小孩忘在車內一整天，早上根本就沒有把孩子送進托兒所，警方後續在現場蒐集證據數個小時，截至6月30日下午尚未決定是否要提出任何指控。諾沃亞透露，這戶人家先前已有2個小孩讀過她的托兒所，她知道這是個充滿愛的家庭，很不幸發生了如此悲劇，她對此呼籲家長們在離開車子前務必反覆查看後座。    ,https://news.ltn.com.tw/news/world/breakingnews/5489858
南韓貨輪5月於荷姆茲海峽遇襲 最快7月中旬駛離,國際,2026/07/01 11:54,南韓貨輪「NAMU號」5月4日在荷姆茲海峽遇襲，南韓稱「納姆號」最快將於7月中旬駛離荷姆茲海峽。（路透）南韓航運公司「韓新遠洋船務」（HMM）名下1艘貨輪「NAMU號」5月4日在荷姆茲海峽遇襲並起火燃燒。南韓海洋水產部今（1）日表示，「納姆號」最快將於7月中旬駛離荷姆茲海峽，前提是該船在5月遇襲後受損的船體已修復。根據《路透》報導，南韓5月27日表示，「納姆號」遭襲擊可能與伊朗反艦飛彈相關，並召見伊朗大使要求其分享調查結果與提出抗議。伊朗駐南韓大使庫澤奇（Saeed Koozechi）否認伊朗與攻擊事件相關，南韓隨後表示無法確定攻擊責任方，也無法判定事件是否為蓄意攻擊。請繼續往下閱讀...南韓海洋水產部1日指出，目前有2艘船滯留在荷姆茲海峽，其中1艘船是「納姆號」，船上共有35名船員。海洋水產部補充，自美國和伊朗簽署停火協議後，已有21艘南韓運營的船隻安全通過荷姆茲海峽。另外HMM發言人向《路透》表示，公司將承擔「納姆號」維修費用，之後會向保險公司提出理賠申請。    ,https://news.ltn.com.tw/news/world/breakingnews/5489882
中共《民族團結法》今上路 美參眾議員發聲譴責,國際,2026/07/01 11:48,中國「民族團結進步促進法」即將上路，外界批評聲浪不斷。（路透資料照）中國今起正式實施「民族團結進步促進法」，該法被質疑至少違反12項國際人權規範，包含美國聯邦眾議院「美中戰略競爭特別委員會」主席穆勒納爾以及多名跨黨派參議員，也陸續表達反彈，多個國際人權組織和人權活動人士也都發出警告，批評該法將加速文化滅絕，並壓制海外異議人士。中國的「民族團結進步促進法」自去年9月送交全國人大審查就引發國際高度關注，國際社會已多次強烈呼籲廢除或修訂，北京仍置若罔聞，該法上路後包含中國人、港澳台民眾、海外華人及全球公民都全面納入管轄，若在境外被北京認定有國家分裂或民族分裂行為，將面臨紅色通緝、第三國遣返或國內家人連坐。持續對中國政權、民主狀況與人權問題發聲者，也都將籠罩在海外警察站監控與跨境騷擾的陰影中。請繼續往下閱讀...據美國之音報導，美國眾院中國問題特赦委員會週一發布聲明，批評該法「具有反烏托邦色彩且名稱極具欺騙性」。委員會主席穆勒納爾（John Moolenaar）指出，該法代表「中共的殘暴與偏執進一步升級」。他也批評中國不僅計畫利用該法「騷擾和恐嚇身處境外的批評人士」，中國也將藉此進一步實施暴行，並為其「針對藏人、維吾爾人、其他有信仰人士的虐待行為尋求合法性」。穆勒納爾質疑，在美國慶祝獨立250周年之際，「中共卻在開歷史倒車，再次表明它並不認同我們所享有的天賦人權」。上週五包含共和黨參議員匡希恆（John Curtis）、班克斯（Jim Banks），以及民主黨參議員羅森（Jacky Rosen）、墨克利（Jeff Merkley）等人，也聯合提出一項跨黨派決議，除了譴責《團結法》，關注該法對藏人、維吾爾人、蒙古人及其他受影響群體在權利、自由及身份認同方面的影響，也呼籲中國「停止侵權行為及跨國鎮壓行動；因為這些行動破壞了美國的主權，並威脅到美國境內民眾的安全與自由」。匡希恆也透過新聞稿指出，《團結法》標誌著北京長期以來抹除少數群體文化認同行動的進一步升級。這也為中共恐嚇身處中國境外、敢於批評其行徑的人士提供了藉口。匡希恆強調美國作為自由世界的領袖，必須堅定地與那些遭受迫害的人們站在一起，他也在社群平台X上表明「絕不容忍中共輸出壓迫、壓制那些揭露其侵犯人權行徑的聲音，以及破壞我們主權的行為」。「國際特赦」組織（Amnesty International）於週二也發布新聞稿，批評該法為那些「已經嚴重侵害」維吾爾族、藏族及其他非漢族裔群體權利的政策「提供了國家層面的法律框架」。該法可能為現有的跨國鎮壓行為提供更強有力的法律依據。好萊塢知名演員李察吉爾（Richard Gere）週日也在《華爾街日報》上發表題為《中國的「民族團結」法意味著無國界的鎮壓》的評論文章，批評中國政府利用《團結法》將國內文化抹除的行為（包括強制使用普通話和宗教「中國化」）制度化，並批評北京試圖控制達賴喇嘛的轉世程序，從而推行一種在西藏已趨完善的鎮壓模式。另外，包含海外的西藏、維吾爾族、香港人權團體也紛紛發文譴責《團結法》，批評該法加速文化滅絕，並壓制海外異議人士。    ,https://news.ltn.com.tw/news/world/breakingnews/5489628
原因曝！中國逮捕富士電機2日籍員工 恐長期拘留,國際,2026/07/01 11:36,消息人士透露，富士電機集團旗下2名日籍員工已於6月遭中國當局逮捕。（圖擷自wiki：Satoru Fujiwara）消息人士透露，日本富士電機集團（Fuji Electric）旗下2名日籍員工已於6月中下旬遭中國當局逮捕。共同社報導，多名消息人士1日透露，富士電機集團2名日籍員工5月因涉嫌走私中國禁止進出口貨物，在中國遼寧省大連市遭拘留後，當地海關機構已於6月中下旬正式逮捕2人，恐將面臨長期拘留。請繼續往下閱讀...據了解，當地海關機構認為，2人涉嫌將內含稀土磁鐵的馬達等產品，以可拆卸狀態組裝後出口。報導稱，中國當局可能懷疑2人目的是在出口後拆卸產品，並取出其中的稀土磁鐵。    ,https://news.ltn.com.tw/news/world/breakingnews/5489876
自由說新聞》烏軍又炸莫斯科震撼畫面曝光！俄民眾氣炸：希望烏克蘭贏,國際,2026/07/01 11:25,全新的視界！新聞話題不漏接，快訂閱YouTube 【自由追新聞】，記得開啟小鈴鐺哦！    ,https://news.ltn.com.tw/news/world/breakingnews/5489872
川普酸習近平「贏了」 最高法院保住出生公民權 司法部火速出招,國際,2026/07/01 11:14,美國總統川普。美國最高法院維持出生公民權後，川普發文批評判決，司法部隨後要求優先偵辦「生育旅遊」案件。（彭博資料照）美國最高法院6月30日以6比3裁定，駁回總統川普限制出生公民權的行政命令，維持「出生即享公民權」的憲法保障。不過，川普政府隨即調整執法方向，美國司法部數小時後即要求全國聯邦檢察官，優先偵辦涉嫌利用「生育旅遊」（Birth Tourism）替子女取得美國公民身分的案件。根據《路透》報導，川普今年重返白宮首日即簽署行政命令，要求聯邦機關不承認在美出生、但父母均非美國公民或合法永久居民子女的公民身分。不過，最高法院維持下級法院禁制令，使行政命令無法生效。請繼續往下閱讀...判決出爐後，川普隨即在社群平台「Truth Social」發文，諷刺中國國家主席習近平與中國「在出生公民權議題上取得重大勝利」，再度批評外籍人士赴美生產、讓子女取得美國國籍的「生育旅遊」現象，並呼籲國會修法改革出生公民權制度。就在最高法院裁決後數小時，美國司法部向全國聯邦檢察官發布備忘錄，要求優先調查涉嫌以虛假理由申請簽證赴美生產的案件。司法部表示，相關人士若涉及不實陳述，可能依簽證詐欺等罪名起訴。司法部高層官員麥唐納（Colin McDonald）在備忘錄中表示，司法部將積極調查並起訴利用移民制度從事詐欺的行為，並要求各地檢察官與國土安全部協調偵辦相關案件。撰寫多數意見的首席大法官羅伯茲（John Roberts）指出，美國憲法第十四修正案確立在美國出生者原則上享有公民身分，僅有外交官子女等少數例外；行政命令不能改變憲法保障的公民資格。這項判決使川普限制出生公民權的行政命令持續無法生效，而司法部已同步要求各地檢察官優先偵辦涉及「生育旅遊」的相關案件。    ,https://news.ltn.com.tw/news/world/breakingnews/5489855
教宗批美國移民政策 范斯稱梵蒂岡觀點令人擔憂,國際,2026/07/01 11:11,美國副總統范斯稱，梵蒂岡的移民觀點「令人擔憂」。圖為范斯2025年5月19日在梵蒂岡與教宗良十四世會晤。（路透）教宗良十四世（Pope Leo XIV）曾多次公開反對美國總統川普的移民政策，呼籲川普政府為對待移民的方式進行深刻反思。美國副總統范斯6月30日表示，他不同意梵蒂岡的移民觀點，稱其「令人擔憂」。根據《路透》報導，身為天主教徒的范斯在接受《福斯新聞》（Fox News）採訪時說「對於那些反對我們移民政策的天主教領袖，我都會告訴他們，我並沒有敵意。我歡迎彼此對話，但我也希望他們記得，大規模移民同樣會帶來受害者。」請繼續往下閱讀...川普推行強硬的移民打壓和驅逐行動，人權組織認為此舉侵犯了言論自由和正當程序權利，並造成了不安全的環境。對此川普主張他的目標是改善國內安全與遏制非法移民。值得注意的是，良十四世也批評過川普政府其他政策，例如美國與以色列2月28日空襲伊朗，導致伊朗戰爭爆發。良十四世近日稱讚美國與伊朗達成旨在結束衝突的協議，並強調希望協議能為衝突畫下句點。    ,https://news.ltn.com.tw/news/world/breakingnews/5489791
限制出生公民權遭最高法院駁回 川普酸：恭喜習近平贏了,國際,2026/07/01 10:57,美國最高法院駁回總統川普限制「出生公民權」舉措。川普對此酸：「恭喜中國國家主席習近平和中國獲得勝利。」（法新社）美國最高法院6月30日裁決，駁回總統川普限制「出生公民權」（birthright citizenship）舉措。對此，川普狠酸：「恭喜中國國家主席習近平和中國獲得勝利。」綜合外媒報導，川普去年在白宮展開第二任期的第一天，便簽署行政命令，規定父母為非法入境，或持臨時簽證者，其在美國出生的子女，將不會自動成為美國公民。不過當地時間6月30日，美國聯邦最高法院9位大法官以6比3的票數，裁定保留幾乎所有在美國領土出生者，獲得公民身分的權利。請繼續往下閱讀...首席大法官羅伯茲（John Roberts）表示：「父母為非法或暫時居留者而在美國出生的子女，『受美國管轄』，並根據第14修正案的公民權條款，在出生時即為美國公民。」最高法院此次駁回川普試圖終結出生公民權的行政命令，已是他本屆任期內遭遇第三度挫敗。對此，川普社群網路「真實社群」（Truth Social）發文狠酸，「我要恭喜習近平主席，以及偉大的中國大陸，贏得了有關『出生公民權』的重大勝利！」    ,https://news.ltn.com.tw/news/world/breakingnews/5489769
超狂獎勵！NASA：美國若奪世界盃冠軍 將讓足球登月,國際,2026/07/01 10:44,美國航太總署署長艾薩克曼試圖激勵美國隊，稱美國若在今年的世界盃上奪冠，將把1顆足球送上月球。（彭博）美國航太總署（NASA）署長艾薩克曼（Jared Isaacman）6月30日表示，美國若在今年的世界盃上奪冠，將把1顆足球送上月球。根據《法新社》報導，艾薩克曼在介紹NASA月球基地計劃的活動中提到將足球送上月球的構想。他說「這就是挑戰，美國隊，完成任務吧！」請繼續往下閱讀...艾薩克曼指出，美國太空人謝波德（Alan Shepard）1971年曾在月球上揮桿，當時他將1支高爾夫球桿和高爾夫球偷偷帶上月球。艾薩克曼說「我們要超越謝波德，要把足球送到月球上，這能給美國隊帶來動力。」如果足球真的踏上月球之旅，它將搭載包括科學儀器在內的有效載荷，這是美國未來幾年建造月球基地計劃的一部分。負責NASA月球基地計劃的專案經理賈西亞-加蘭（Carlos Garcia-Galan）表示，美國隊若要奪冠可能會面臨艱辛道路，足球能否登月將取決於美國隊表現。他稱「一切都取決於美國男足國家隊，祝他們好運。」    ,https://news.ltn.com.tw/news/world/breakingnews/5489693
