Title,News_Type,date,content,url
獨家》影像曝！台灣女學者入境肯亞被「關」留置室 管碧玲疑：中國打壓,政治,2026/06/16 22:48,台灣女學者入境肯亞被「關」機場留置室。（民眾提供）首次上稿 18:53更新時間 22:48肯亞政府惡意撤銷台灣參加第11屆「我們的海洋大會」，創下台灣首次正式獲邀後又遭撤銷的惡例；海委會主委管碧玲發出千字文斥責肯亞「毫不避諱的粗暴作為」。請繼續往下閱讀...最讓管碧玲震驚的是，獲邀出席會議的台灣某位國立大學女性學者，她6月12日率先出發前往肯亞，與外交部官員於14日抵達會場報到，被以護照有問題為由拒絕入場，2人隨即被帶回當地機場分開留置過夜，並扣留護照與手機超過20個小時，面臨近似遣返的處境，所幸她今天已平安回到台灣。根據接機者轉述，這位女性學者除了黑眼圈，一切都好，她在手機被扣留前1分鐘，拍下機場的留置室照片，「是真的有柵欄圍住」。她一個人被「關」在裡面當下，很緊張，也擔心安全，「瞬間紅了眼眶」。機場警衛看到她好像快要掉下眼淚，趕緊對她說「抱歉、抱歉」，一直對學者道歉，並強調「妳沒有違反任何規定，只是我們沒辦法」。然而，肯亞沒有提供餐飲，但學者也吃不下，只能拜託警衛買水給她喝，事後還多給費用表示感謝。在機場留置期間，警衛沒有對台灣女學者「偵訊」或「盤問」，彼此隔著柵欄門聊天，學者趁機教他們如何辨識簡體字和正體中文，她舉「愛」這個字強調：「中國的沒有心！」算是另類國民外交。最後學者先搭機返台，外交部官員也已離境。管碧玲表示，執行任務的肯亞警衛不斷對台灣學者道歉，且強調她沒有違反任何規定，警衛的行為證實肯亞粗暴的手段，是背後由上而下的決策指導所致。管碧玲認為「唯一可能的原因，只有中國一貫的打壓，才有可能導致這樣的結果」。管碧玲感謝學者的勇氣，尤其在面對不可知的留滯隔離時，克服恐懼，還以教育家的胸懷，啟發警衛人員，替國家做國民外交，表達最誠摯的感謝與最大的敬意。台灣女學者在肯亞的機場留置室，被扣留護照與手機。（民眾提供）    ,https://news.ltn.com.tw/news/politics/breakingnews/5474312
嗆柯志恩演唱會2.0「投機文宣」  尹立：不懂演唱會也不懂高雄,政治,2026/06/16 22:26,民進黨高市左楠區議員參選人尹立（中）發文嗆國民黨高雄市長參選人柯志恩所提「演唱會經濟2.0」是「投機文宣」，質疑柯不懂演唱會也不懂高雄。（記者王榮祥翻攝）國民黨高雄市長參選人柯志恩今發表演唱會2.0政策。前高市文化局長、民進黨高市左楠區議員參選人尹立感慨真的是昏倒，批評柯志恩完全不懂演唱會產業，也不懂高雄，是「2.0投機文宣」。尹立質問柯志恩曾去世運聽過任何一場國際演唱會嗎？如果不曾置身5萬人的主場館，不曾感受那種與全場歌迷同頻呼吸的震撼，才會寫出這種冰冷、短視的公務員計帳政見。請繼續往下閱讀...他形容柯志恩發表的是「2.0投機文宣」，看似理性政策藍圖，實則充滿政治投機、公務員計帳的短視，及對娛樂產業的極度無知，正是「在冷氣房裡憑空想像的房東」，而不是「真正跟國際經紀公司、樂迷、基層公務員並肩作戰的開拓者」。尹立說，看完柯志恩洋洋灑灑的「演唱會經濟2.0」政見後只有一個感想，過去不曾參與、甚至百般摧殘，現在榮景來了，卻突然從「唱衰者」搖身一變成了「指導者」。針對柯志恩建議鼓勵主辦單位以購票實名制換取免場租，尹立認為流行音樂產生的核心價值在於「巨大觀光溢出效應」（餐飲、交通、旅宿、地方稅收），國際巨星進駐高雄帶來的經濟效益動輒數十億元，豈是4344萬元場租所能衡量？他強調，免場租是高雄與台北大巨蛋競爭時最強大的戰略誘因，真正的2.0治理，應是將已17年的主場館編列更多預算去「優化」，提供演唱會更實際的硬體與軟體需求，觀眾座椅、廁所（直擊5萬人場館排隊的最痛點）、透過公共投資去升級、去維持國際競爭力，更完整的行政支援，國際行銷...等。而柯志恩卻滿腦子想著怎麼跟主辦方收租、搞繁瑣的行政審查，照她的邏輯，世運只會加速老化，最後直接被市場淘汰。    ,https://news.ltn.com.tw/news/politics/breakingnews/5474504
盧秀燕為禁海峽論壇早晚連嗆中央 他批「推農民被養套殺」,政治,2026/06/16 22:18,台中市長盧秀燕為禁「海峽論壇」連嗆中央，民進黨市議會黨團總召周永鴻批「推農民被養套殺」。（記者蘇孟娟攝）陸委會頒海峽論壇禁令，甫自歐洲訪問返台的台中市長盧秀燕今上班首日，卻早晚連嗆中央封殺農民、封殺人民、政治追殺首長；民進黨台中市議會黨團總召周永鴻痛批海峽論壇是中國國台辦主導的對台統戰平台，中國「養、套、殺」台灣農民數波操作，盧秀燕不譴責中國拿農民當籌碼，反幫腔「把農民往陷阱裡推」。黨團幹事長江肇國也批評盧秀燕訪歐號稱有跟捷克議長大談民主價值，一回來就幫中國北京主辦的統戰論壇護航，公然附和打壓台灣的中國，這兩件事說得通嗎？請繼續往下閱讀...盧秀燕今白天開市政會議前先痛批台灣國際處境困難，民進黨封殺縣市首長參加，就是封殺農民、封殺人民，更稱台灣國際處境困難，大家願意幫忙出訪，「總統應心存感激」；晚間又在臉書發文力挺以錄影方式參加論壇的台東縣長饒慶鈴，再批願意替農民發聲的首長，中央應該支持，而不是打壓、甚至政治追殺。周永鴻痛斥海峽論壇不是為農民發聲的地方，是中國國台辦主導的對台統戰平台，盧秀燕回國第一件事急著砲打中央，還說是「封殺農民」，但真正傷害台灣農民的，是中國長年「養、套、殺」的慣用手法，之前已有鳳梨、釋迦、石斑魚血淋淋的前例，盧秀燕不譴責中國拿農民當政治籌碼，去統戰舞台「替農民發聲」，根本是把農民往陷阱裡推。他說，盧秀燕任期剩不到7個月，對市政沒有急迫感，反對統戰論壇急著發聲、批評中央，包裝的都是自己的政治野心，若真要為台中農民著想，盧秀燕該做的是顧好在地農業，協助開拓中國以外的多元市場，不是替中國的統戰活動背書，「替農民找市場，不等於替統戰平台開門」。    ,https://news.ltn.com.tw/news/politics/breakingnews/5474491
蔣萬安新加坡峰會「台北火鍋說」  被抓包2年前訪美就有這橋段！,政治,2026/06/16 22:06,台北市長蔣萬安參加2026世界城市高峰會（WCS）。（台北市政府提供）台北市長蔣萬安近日到新加坡，參加2026世界城市高峰會（WCS），結果致詞的講稿又被網友抓包，和2年前赴美參訪時發表的演講幾乎一樣，「蔣稿機」的嘲諷聲浪再起。蔣萬安過去受訪的影片近期被翻出，因為明顯都在背稿，被網友們譏諷是「蔣稿機」、「背稿安」。本月15日，蔣萬安飛到新加坡出席WCS開幕式，致詞演講時表示，台北是座擁有先進系統和尖端科技的城市，但同時也有深厚的人文底蘊，台北因為有多元性，才能一直保持開放、創新和韌性。請繼續往下閱讀...蔣萬安將台北比喻成「火鍋」，各種食材丟進鍋中，味道卻能完美融合，讓人忍不住一口接一口，還問了現場來賓「有沒有吃過火鍋？」但就是這樣一段發言，讓網友覺得有些熟悉，原來在前一天（14日），蔣萬安到台北大巨蛋出席2026年國際扶輪社世界年會時，也講了同樣一段話；本月3日蔣萬安到大安森林公園為捷克建築師希佩克（Bořek Šípek）設計的藝術計畫「哈維爾的長椅」（Havel's Place）揭幕時，也有相同的致詞內容。不只如此，還有網友翻到2年前的影片，2024年9月9日，蔣萬安到美國波士頓，進行市政考察與交流，當晚到哈佛大學演講時，也以火鍋來做比喻，只是當時被比喻的對象是「台灣的民主」，形容方式、語氣、手勢，也和今天大家所聽到的幾乎一樣，連用「有沒有吃過火鍋？」這個問題來跟聽講者互動都照搬無誤。網友們看了直呼傻眼，「一稿多用，蔣萬安背出新高度了」、「越看他越可悲，沒料到這種地步他自己都不會恐慌嗎」、「為什麼要他背這麼多稿？人的腦容量有限，背太多稿，在不對的場合講出不對的稿怎麼辦？」、「一個火鍋放了兩年……」、「考古題背很熟」、「真的好丟台北人的臉」、「語氣也一樣，跟我們以前演講比賽一樣的方式」、「我都懷疑他是機器複製人了」、「都隔了兩年，還記得之前說過什麼再拿來用，記憶還不錯啦，但也就這樣而已」、「這鍋算殷瑋的還是蔣萬安的，拿舊的講稿出來改」。台北市長蔣萬安。（資料照）    ,https://news.ltn.com.tw/news/politics/breakingnews/5474451
蘇巧慧、李四川發言人PK   鄉民看這一幕搖頭：高下立判！,政治,2026/06/16 21:03,新北市長選戰是年底大選關注焦點之一。左為民進黨參選人蘇巧慧，右為國民黨參選人李四川。（資料照，本報合成）新北市長選戰是今年年底大選的關注焦點之一，國民黨參選人李四川近日宣布找來3名在黨內議員初選落敗的青年擔任其競辦發言人，民進黨參選人蘇巧慧的發言人隨後給予祝福，反觀李四川的發言人群上班第一天就開始狂罵蘇巧慧，讓鄉民們看了直搖頭，「真的不Ok餒！」李四川本月15日宣布，由棄選新北市議員的江怡臻出任競辦主任，另外找了陳欣怡、吳亮賢、郭音蘭3名青年擔任競辦發言人。針對李四川陣營公布辦公室新人事，蘇巧慧競辦發言人吳思萱表示，不同候選人團隊有不同的節奏，團隊都給予尊重和祝福。請繼續往下閱讀...但反觀李四川發言人群，陳欣怡和郭音蘭在上班首日就發稿攻擊蘇巧慧，指控蘇巧慧先前反對財劃法修法是在卡新北增加預算，以及反對禁伐補償，應該向原住民道歉。針對李四川陣營控訴，蘇巧慧回應，她是反對藍白不經討論就亂修法，但不反對地方財源增加，也不反對提高補償，不管是財劃法還是禁伐補償，她都希望能夠經過充分的討論。看到雙方陣營發言人的表現，有鄉民在PTT上直言，「李四川的發言人上任，蘇巧慧發言人給予祝福，但這兩個發言人上班第一天就一直罵蘇巧慧……我是建議團隊要演也要演一下啦，才第一天就這樣狂噴口水，顯得肚量很小一樣。而且不是遙遙領先嗎？頭一天就在潑婦罵街……這樣子真的不Ok餒！」其他鄉民紛紛表示，「兩邊高下立判，誰是民調落後的很明顯了」、「藍白都喜歡找中國狼性氣質的」、「國民黨好笑的點在於，自己撿選不上的當發言人就可以，別的黨找選不上的當發言人就罵人家撿破爛，嚴重雙標」、「怎麼是找這幾位？那國昌老師呢？」李四川找來3名在黨內議員初選落敗的青年擔任其競辦發言人。左起依序為陳欣怡、吳亮賢、郭音蘭。（李四川競辦提供）蘇巧慧競辦發言人吳思萱。（蘇巧慧辦公室提供）    ,https://news.ltn.com.tw/news/politics/breakingnews/5474369
藍營接連質疑反財劃法、禁伐補償 蘇巧慧：反對不經討論提無法接受的版本,政治,2026/06/16 21:02,藍營接連質疑民進黨新北市長參選人蘇巧慧（麥克風前）過去反對「財劃法」修法、反對原住民族爭取提高禁伐補償的立場，蘇巧慧今回應，她們反對的是不經討論就提出無法令人接受的版本，而非反對地方的財源增加與提高禁伐補償。（蘇巧慧辦公室提供）新北市長選戰煙硝味漸濃，民進黨參選人蘇巧慧說她是最瞭解新北現況、瞭解新北需求的人選，此話挑起藍營砲火，國民黨新北市議員江怡臻與同黨參選人李四川同一陣線，質疑蘇反對「財劃法」修法、反對原住民族爭取提高禁伐補償的立場，「新北市民要的不是選前承諾，而是經得起檢驗的立場及態度」；蘇巧慧今回應2點質疑說，她們反對的是不經討論就提出無法令人接受的版本，而非反對地方的財源增加與提高禁伐補償。針對蘇巧慧說「最懂新北、最了解新北現況」，江怡臻指出，市民檢驗一位市長參選人，看的從來不是口號喊得多響亮，而是過去站在哪一邊、做過哪些選擇，為市民爭取了什麼成果。若國民黨團總召傅崐萁版本的「財劃法」不好，民進黨是否提出更好版本？蘇巧慧是否曾提出自己的方案？新北市民期待看到實際增加資源，而非一次次反對的理由。請繼續往下閱讀...她說，蘇巧慧常以身為原住民媳婦自豪，強調關心原住民族，但當原住民族長期爭取提高禁伐補償時，她卻跟著民進黨反對，坐視行政院不編預算，「不選舉的時候就跟著民進黨作惡，要選舉的時候又想跟原住民要票」，前後不一的態度，原住民或市民絕對不能接受。對於藍營兩點質疑，蘇巧慧今早回應，她們反對的一直都是傅崐萁的版本，因為傅崐萁的版本讓新北市的人均變成是只有台北的二分之一，台北的人均竟然超過新北的人均這麼多，連新北市財政局長，甚至是她的對手也都提出過。所以她們認為這個版本當時就是不經討論，也沒有讓各縣市代表都能夠理解背後的意涵。被質疑反對禁伐補償，蘇巧慧則說，這其實和「財劃法」一樣，她們反對的是不經討論，就直接提出這種沒有辦法令人接受的版本，當時連國民黨的委員都說「蘇巧慧委員也支持提高禁伐補償」。「我們都贊成這個方向，但我們都反對不經預算討論就直接由立法院逕自增加預算」，這樣破壞憲政體制，而且沒有經過大家充分討論，不管是禁伐補償或是「財劃法」，都希望能經充分討論。國民黨新北市議員江怡臻質疑民進黨新北市長參選人蘇巧慧反對「財劃法」修法、反對原住民族爭取提高禁伐補償的立場。（新北市議員江怡臻提供）    ,https://news.ltn.com.tw/news/politics/breakingnews/5474423
退休金變少了？ 銓敘部澄清年改重審附表未列調整金額,政治,2026/06/16 20:55,退休金變少了？銓敘部今晚澄清，年改重審附表未列調整金額，退休人員實際領取的退休金仍會依規定調整後發放。（銓敘部提供）針對部分退休公務人員對年金改革重審處分附表所列退休所得金額提出疑問，銓敘部今（16）晚澄清說明，重審處分附表所載「審定金額」均依法律規定及法定公式計算，並非退休人員實際領取的退休金金額，因此不會包含歷次退休金調整方案增加的金額，退休人員實際領取的退休金仍會依規定調整後發放。銓敘部表示，重審處分附表中的「審定金額」是作為退休金調整方案計算的基準，因此金額固定不變，不會將退休金調整方案後的「實發金額」納入計算。退休人員實際每月領取的退休金，則會依適用的退休金調整方案，由資訊系統自動計算後交由發放機關按月發給。請繼續往下閱讀...銓敘部指出，此次配合退撫法第37條及第38條修正規定，退休所得替代率恢復以2023年1月1日至2023年12月31日期間為準。除2024年1月1日以後退休者須重新計算每月退休所得外，2023年12月31日前退休者的「審定金額」，均回復至原審定處分附表中2023年期間的審定金額，因此不會包含退休金調整方案增加後的實發數額。銓敘部表示，為避免退休人員誤解，已在重審處分附表備註及今（2026）年6月8日函文中說明，退休金實際發放金額應依附表所列審定金額，再按已公布的退休金調整方案計算。其中，2022年7月1日起調增2%，2024年1月1日起再調增4%，退休人員依退休時間不同，適用不同調整方式。銓敘部說明，2022年6月30日以前退休生效者，因歷經2次調整，實發金額將依審定金額先調高2%，再調高4%。例如審定金額為5萬元，實發金額為5萬3040元。2022年7月1日至2023年12月31日退休生效者，因僅適用2024年起4%的調整方案，例如審定金額為5萬2000元，實發金額為5萬4080元。至於2024年1月1日以後退休生效者，因尚未經歷退休金調整，因此實發金額即依審定金額發給。銓敘部強調，退休金調整後的實發金額均由資訊系統自動計算並提供發放機關據以發給，不需要退休人員自行換算，也不會影響退休人員依法應領取的退休給與。    ,https://news.ltn.com.tw/news/politics/breakingnews/5474415
提演唱會經濟2.0  柯志恩：杜絕黃牛票鼓勵購票實名制換場租優惠,政治,2026/06/16 20:53,國民黨高雄市長參選人柯志恩今提出「演唱會經濟2.0」方案。（記者王榮祥翻攝）國民黨高雄市長參選人柯志恩今提出「演唱會經濟2.0」方案，倡導從購票制度到周邊旅宿做出完整配套，評估把免場租當政策誘因，鼓勵主辦單位推動「購票實名制」，杜絕黃牛票與非法轉售。柯志恩指出，高雄演唱會經濟成果有目共睹，但根據審計部2025年報告，高雄市政府過去2年共舉辦18場大型演唱會，場館單一年度維護費用就高達4344萬元，演唱會經濟背後衍生公共成本、場館維護赤字、旅宿價格哄抬等亂象，需要解決。請繼續往下閱讀...她認為未來城市治理不能只停留在辦活動，現行場地收費標準應更進一步精進，喊話未來將把「免場租」從無差別優惠、轉型為有條件的政策誘因，例如主辦單位若願意從源頭推動「購票實名制」、全力杜絕黃牛票與非法轉售，市府將提供相對應的場租優惠，用制度設計保護歌迷權益。針對旅宿價格哄抬問題，她拋出嚴格管理與正向誘因並行的雙軌策略，透過串接平台數據，若大型活動期間，發現房價異常飆升超過平日2倍，市府將納入黑名單並調整補助資格；反之，若願意維持合理價格的業者，則給予「友善旅宿認證」，提供優先推薦、接駁支援及稅務優惠評估。柯志恩強調，「大港開唱」已成為高雄重要文化品牌，未來不僅要持續辦理，更要朝國際化方向升級發展，她主張參考美國Coachella、英國Glastonbury等國際知名音樂節成功經驗，打造國際級音樂節慶，讓台灣在地音樂站上世界舞台，使高雄成為亞洲流行音樂的重要輸出基地。柯志恩還承諾，未來將同步爭取國際級體育賽事落地高雄，例如近年在全球快速成長的HYROX體能賽事，結合運動觀光及健身產業，創造全新的經濟效益與財政收入。    ,https://news.ltn.com.tw/news/politics/breakingnews/5474398
火力全開！盧秀燕白天喊「封殺農民」 晚間再挺饒慶鈴批「政治追殺」,政治,2026/06/16 20:47,台中市長盧秀燕（左）今晚在個人臉書PO文再批中央政治追殺，力挺台東縣長饒慶鈴（右）願意替農民發聲。（擷取自盧秀燕臉書）陸委會禁止中央機關及地方政府人員參與「海峽論壇」相關活動，甫自歐洲訪問返台的台中市長盧秀燕今上班首日，痛批台灣國際處境困難，民進黨封殺縣市首長參加「海峽論壇」，就是封殺農民、封殺人民；晚間她力挺以錄影方式參加論壇的台東縣長饒慶鈴，再批願意替農民發聲的首長，中央應該支持，而不是打壓、質疑，「甚至政治追殺」。盧秀燕出訪歐洲10天返國上班首日先開嗆中央禁令「封殺首長就是封殺農民與人民」，更稱台灣國際處境困難，大家願意幫忙出訪，「總統應心存感激」。請繼續往下閱讀...晚間她又在個人臉書再PO文砲轟中央，力挺以預錄影片參與海峽論壇的饒慶鈴。她說，饒慶鈴透過錄影發聲，為台東農民爭取更多機會與市場，這不只是地方首長的職責，更是對鄉親的承諾，「願意替農民發聲的首長，中央應該支持，而不是打壓、質疑，甚至政治追殺」。盧秀燕說，中華民國以貿易與世界接軌，面對快速變化的國際局勢，更要廣結善緣、拓展市場，讓農民的辛苦獲得回報，「我始終相信，朋友越多越好，市場越大越好」、「為農民多爭取一個機會、多開拓一條出路，一直是我的施政理念」，她全力支持饒慶鈴照顧農民。    ,https://news.ltn.com.tw/news/politics/breakingnews/5474413
自由爆新聞》最新選情變化曝光！藍白遭控「擺爛爽玩」影響你的錢！,政治,2026/06/16 20:36,全新的視界！新聞話題不漏接，快訂閱YouTube 【自由追新聞】，記得開啟小鈴鐺哦！    ,https://news.ltn.com.tw/news/politics/breakingnews/5474427
自由爆新聞》最新選情變化曝光！藍白遭控「擺爛爽玩」影響你的錢！,政治,2026/06/16 20:36,全新的視界！新聞話題不漏接，快訂閱YouTube 【自由追新聞】，記得開啟小鈴鐺哦！    ,https://news.ltn.com.tw/news/politics/breakingnews/5474426
完全沒講過「沒想到內湖房價很高」 沈伯洋批紅媒造謠抹黑,政治,2026/06/16 20:35,民進黨籍台北市長參選人沈伯洋。（資料照）民進黨籍台北市長參選人沈伯洋日前上節目專訪時，談到內湖交通問題，有媒體報導沈稱「沒想到（內湖）房價很高」；對此，沈在社群平台「脆」上澄清「我根本沒講過」，當時講的是工時錯開並提供誘因，以及婚育宅、科技宅、青年宅，讓在內湖工作者有可負擔得起的居住選擇；反質疑「紅媒」是製造業，專門把他完全沒講過的話塞他嘴裡，然後還有人信。沈伯洋表示，當時講的是婚育宅與科技宅如何設計、工時等五層解方，根本沒有「沒想到房價很高」，並指紅媒是製造業，「專門把我完全沒講過的話塞到我嘴裡，然後還有人信。」請繼續往下閱讀...沈伯洋另於臉書發文指出，「脆」不知不覺突破40萬人，又開始面臨大量造謠，「又一樣，報導我完全沒講過的話，然後議員與側翼一條龍」，不過他覺得這些造謠都太明顯，反酸「你們前兩年抹黑我的時候，都還比較厲害一點。」https://www.threads.com/@pumashen/post/DZo8qExFM4N    ,https://news.ltn.com.tw/news/politics/breakingnews/5474405
議員批新北臨托「看得到用不到」 社會局：緊急需求可洽居家托育中心,政治,2026/06/16 20:13,議員陳乃瑜批評新北社會局臨時托育量能不足。（陳乃瑜提供）新北市社會局近日大幅宣傳全市設有22處定點臨時托育服務。議員陳乃瑜表示，社會局不應迴避家長真正的困境，臨托最重要的精神，就是當家長遇到臨時加班、緊急就醫、家庭突發事故時，能夠即時接住，而不是「看得到宣傳、用不到服務」。社會局表示，目前臨托仍以兩日前預約為作業原則，但若家長遇有緊急需求，仍可直接洽13家居家托育中心，即時協助媒合在地臨時或夜間托育資源。陳乃瑜指出，新北臨時托育名為「臨托」，實務上卻多要求家長提前兩個工作日預約，根本是「假臨托、真預約」，但如果家長遇到突發狀況，有緊急臨托需求，市府到底如何協助？但是社會局後續書面回覆，沒有提出清楚的緊急應變機制。請繼續往下閱讀...陳乃瑜表示，社會局回覆夜間及臨時托育需求，家長會考量兒童與照顧者間的依附關係及熟悉度，嬰兒突然交由陌生人短暫照顧，容易有分離焦慮，因此家長多會優先尋找親友，其次才尋找熟識的居家托育人員；若家長仍有需求，可接洽13家居家托育中心協助媒合在地臨時或夜間托育。陳乃瑜要求社會局應提出三項改善，第一全面盤點各行政區臨托與夜間托育量能，尤其偏鄉、據點不足及年輕家庭快速增加的區域，不能讓資源集中在少數地區；第二，針對突發急難需求，保留緊急臨托名額，讓真正遇到困難的家長能被接住；第三，建立即時空位查詢與媒合系統，讓家長在最慌張的時候，不必一通一通電話到處求援。社會局表示，市府已於全市設置22處定點臨托服務據點，並結合500多位簽約居家托育人員提供臨托照顧，協助家長因就醫、臨時重要事務獲得支持，目前以兩天前預約為作業原則，但若家長遇有緊急需求，仍可直接洽13家居家托育中心，後續也將優先擴充偏區定點臨托據點，持續提升服務量能與可近性。    ,https://news.ltn.com.tw/news/politics/breakingnews/5474172
