Title,News_Type,date,content,url
嗆黃國昌「躲在太太、小孩後面的小孬孬」李正皓預告：下週會有更大條新聞出來,政治,2025/10/17 14:31,名嘴李正皓（右）、民眾黨主席黃國昌（左）。（資料照）民眾黨主席黃國昌捲入指揮狗仔集團跟監政敵與駭客疑雲醜聞，面對記者的提問黃國昌今表示，在政治上面的攻擊衝著他來，搞到他的太太、未成年小孩的就學，有完沒完。對此名嘴李正皓怒嗆「黃國昌你就是一個躲在太太、小孩後面的小孬孬，如果面對爭議你敢正面回應，事情會燒到你的家人嗎？」李正皓在臉書PO文表示：「黃國昌：『針對政治攻擊，衝著他來，但搞到小孩和太太，甚至扯到小孩的就學有完沒完？可不可以有點基本新聞倫理？可以這樣搞喔？自己做了什麼違法事情就衝著他來，講清楚。』黃國昌，你就是一個躲在太太、小孩後面的小孬孬，如果面對爭議你敢正面回應，事情會燒到你的家人嗎？」請繼續往下閱讀...李正皓指出，問你是不是美國人的ㄚ爸？你回答：我太太非常生氣。你這種回應方式就把太太推到前面擋子彈，任何一個有卵蛋的男人都說不出口這種回覆，但你說的如此理直氣壯。李正皓續指，再來，問你認不認識凱思國際李麗娟？你回答：科幻小說。你有回答到問題嗎？現在根據公開資料 ，你夫人的戶籍就掛在凱思國際李麗娟的家裡，你還是不敢回應你認不認識凱思國際李麗娟，如果一開始你就面對問題，大家會查到你家人的戶籍嗎？李正皓直言，最噁心的部分，你竟然有臉跟大家講「新聞倫理」？你養狗仔無差別跟拍政敵，這種垃圾做的垃圾行為，然後今天記者會上跟大家講新聞倫理？下禮拜會有更大條的新聞出來，這種垃圾會有法律責任收拾他。熱門賽事、球星動態不漏接    ,https://news.ltn.com.tw/news/politics/breakingnews/5214447
「有人」不希望她當選 鄭麗文：黨內黨外都有......,政治,2025/10/17 14:28,國民黨主席候選人鄭麗文今天中午接受「中天新聞」專訪。（資料照）近期頻遭競爭對手質疑的國民黨主席候選人鄭麗文，日前感嘆「有人」不希望她當選，今天中午她接受「中天新聞」專訪時，面對主持人詢問所指為誰？鄭麗文說，「什麼樣的人都有，包括黨內」。鄭麗文說，就像黨公職募款責任額分攤金的問題，一定是黨內人士放的消息，她強調，當年立法院國民黨團因為助理太久沒加薪，要幫助理加薪，她有幫忙黨團養助理，黨團與中央黨部都有公文可以證明，自己也從未欠過黨部募款責任額分攤金，雖然登記前自己補繳了100多萬，但很多人跟她說不必補繳，但她已經不想再去計較了。請繼續往下閱讀...鄭麗文指出，這次的負面選舉超乎她的想像，各種對她的描述與奇怪傳聞，讓她現在身上貼滿各種標籤，有人說她是中共同路人、紅統，也有人說她是台獨，李登輝派來的人，「大家太抬舉我了」，還有最新的說法是她曾經喝酒喝嗨了，但自己這輩子從有生以來都未曾喝嗨過，只有不認識她的人才會這樣說，目的就是要破壞她的人設，但面對惡毒的抹黑，她都一笑置之，因為不想再讓大家看到國民黨的笑話與網內互打，而且她沒有做太多的澄清，只是不希望再造成槍口對內，「黨內黨外都有人希望我不要當選」。至於競爭對手郝龍斌質疑有「境外勢力」介選，張亞中批評她要拜訪日本自民黨總裁高市早苗，鄭麗文說，明天選舉結束後，這些紛擾就會自然而然結束，選舉過程中她不希望激化不必要的對立，破壞黨的團結，對未來推動兩岸關係產生不必要的困擾，自己並沒有感到什麼外部勢力介選，「很多人有選舉策略的考量與操作」，高市早苗的議題也是被帶歪了，「對我毫不留情的砍殺」，大家殺紅了眼，希望黨內不要犯民進黨的錯誤，當民進黨打「抗中牌」、搞鬥爭時，選民還是有智慧的，大家也要相信黨員的智慧。對於明日開票結果，鄭麗文表示，持審慎樂觀的態度，但也不敢掉以輕心，一般預估投票率會到5成，她同時也強調，有很多支持者焦慮，擔心黨部是否保持中立，並對黨部主持選務有很深的焦慮，這就凸顯國民黨需要革新，如果黨員對自己都沒有信心，國民黨真的要好好檢討，希望明日開票順利公正公平，她並呼籲支持者一起擔任監票員，在每一個投票所她也會指派監票員，希望儘量避免爭議，明天開票順利完成。熱門賽事、球星動態不漏接    ,https://news.ltn.com.tw/news/politics/breakingnews/5214436
八卦山「新地標」溜滑梯連傷2人！ 彰縣府道歉：申請理賠、除蠟降速,政治,2025/10/17 14:25,今年10月10日才試營運的八卦山上天空遊戲場，場內溜滑梯驚傳民眾摔傷骨折意外。（記者張聰秋攝）彰化八卦山最新人氣打卡點「天空遊戲場」才剛啟用就出事了！造價6000萬元的新地標，其中造型獨特的溜滑梯，卻接連傳出有14歲少女腳踝骨折、20多歲女子左手骨折的嚴重意外，被網友戲稱是「快到靠北」的溜滑梯。針對這兩起受傷事件，彰化縣政府城市暨觀光發展處慰問傷者並在今天（17日） 公開道歉，表明將除蠟降速並調整緩衝區，同時負起公共意外險理賠責任。溜滑梯啟用後因下滑速度太快、緩衝區不足，導致遊客摔傷骨折的消息迅速在網路上傳開，有傷者光醫療費就花了6萬元。對此，城觀處長王瑩琦對受傷民眾表達歉意，並表示已派員前往探視，啟動公共意外責任險理賠，讓傷者無後顧之憂。請繼續往下閱讀...城觀處進一步表示，這座搭配瞭望台、高低差約4公尺的溜滑梯，原設定是適合13歲以上「大朋友」使用的遊具，且經檢驗符合規定，現場也有清楚告示。不過，由於溜滑梯自10月10日開放後使用頻繁，加上滑道有「打蠟」造成滑度增加，才會讓下滑衝力變大，導致受傷事件發生。縣府已緊急召集設計與施工單位到場會勘，立即善後處理，針對滑道之前打蠟的部分將會去除，降低滑道坡面的滑度，減輕下滑衝力。同時，也會改善調整後續的緩衝區。城觀處強調，目前仍是試營運期間，平日會派員不定期巡查提醒，假日則會派專人在現場協助解說與引導，確保民眾正確使用。此外，城觀處也承諾會對民眾提出的建議，進行整體檢討與改善，確保所有遊樂設施的安全。城觀處重申，溜滑梯每次限1人使用，進入前務必確認前方無人，並嚴禁攀爬或頭下腳上等危險使用方式，請民眾務必遵守告示，才能玩得安心又盡興。溜滑梯入口處前架設提醒使用限對與方式的告示牌。（記者張聰秋攝）民眾使用溜滑梯後摔傷腿部送醫治療。（民眾提供）民眾玩溜滑梯摔斷腿，包紮固定後送醫治療。（民眾提供）民眾玩天空遊戲場內的溜滑梯摔傷腿部，消防人員協助包紮送醫。（民眾提供）熱門賽事、球星動態不漏接    ,https://news.ltn.com.tw/news/politics/breakingnews/5214449
路名外交奏效 「那珂街」、「台南道」台日互命路名締結跨國友情,政治,2025/10/17 14:22,那珂市先崎光市長（左6）偕木野廣宣議長（左5）訪團拜會台南市長黃偉哲（左7）。（圖由台南市府提供）台南「路名外交」奏效！日本茨城縣那珂市長先﨑光今（17）日率木野廣宣議長等訪團拜會台南市長黃偉哲，兩市再添跨國友誼新章。繼台南命名「那珂街」後，先﨑市長今天宣布，那珂市也將新闢道路命名為「台南道」，象徵雙向情誼「你有那珂街、我有台南道」。那珂市位於日本關東地區茨城縣中北部，距東京約100公里，是台南安南區飛虎將軍廟主祀神祇杉浦茂峰母親的出生地。兩市因信仰結緣，去年締結為友誼市後交流不斷，先﨑市長更連兩年親臨「台江水日」活動，展現滿滿誠意。今年5月那珂市長來訪時，黃偉哲宣布在南區新設道路命名為「那珂街」，以紀念兩市友誼。請繼續往下閱讀...此次來訪，先﨑市長特別全程以中文致詞，感謝台南以「那珂街」命名道路，讓那珂市民備感榮耀。他也透露，台南金鑽鳳梨在那珂市學童間掀起熱潮。為延續兩市情誼，那珂市將把道之驛周邊新路命名為「台南道」，並贈上命名證書給黃偉哲，象徵兩市情誼從地圖連到人心。黃偉哲回以感謝，提到那珂市在丹娜絲颱風後即捐款援助災後重建，令人感動。他說，台南與那珂關係密切，未來盼促成學生互訪，讓這份友誼代代延續。那珂市學童在營養午餐中品嚐到台南鳳梨，希望未來有更多台南農特產能登上日本餐桌，進一步促進物產交流。他並誠摯邀請那珂市參加11月登場的「大台南國際旅展」，向市民介紹那珂的自然與人文魅力。木野廣宣議長則表示，感謝飛虎將軍廟牽起兩市間的友好緣分，期待未來能有更多深入的交流。日本茨城縣那珂市先﨑光市長（左）致贈道路命名證書給台南市長黃偉哲（右）。（圖由台南市府提供）南區新闢道路命名「那珂街」，締結跨國情誼。（記者洪瑞琴攝）那珂市將把道之驛周邊新路命名為「台南道」。（圖由台南市府提供）台南市長黃偉哲（右）致贈市鑰給那珂市先﨑光市長（左）。（圖由台南市府提供）熱門賽事、球星動態不漏接    ,https://news.ltn.com.tw/news/politics/breakingnews/5214408
韓國瑜宣傳三芝茭白筍節 吳思瑤：可以幽默但不要消費到女性,政治,2025/10/17 13:59,韓國瑜宣傳三芝茭白筍節時提到美人腿，綠委提醒可以幽默但不要消費到女性，發言要再斟酌。（記者陳逸寬攝）新北市三芝區公所將於10月25及26日舉辦茭白筍節活動，今日於立法院舉辦宣傳記者會，立法院長韓國瑜致詞表示，茭白筍就是俗稱的美人腿，南投有茭白筍公主選拔，他有一年問主辦單位標準是什麼，對方回答，「茭白筍公主最重要的是小腿要漂亮，因為茭白筍跟小腿一樣」，聽了立委洪孟楷介紹，他發現三芝這一帶的茭白筍真的不是浪得虛名，形體、型態更漂亮。對此，民進黨立委吳思瑤說，韓國瑜對美白的小腿情有獨鍾，提醒可以幽默但不要消費到女性，發言要再斟酌。民進黨立委蔡易餘也說，茭白筍的重點在於白色漂亮，韓國瑜每次都要跟女性的小腿扯在一起，創意是有，但每次都用這種略帶顏色的詼諧，不一定大家能接受。請繼續往下閱讀...韓國瑜5年前代表國民黨參選總統時曾自曝，讀國中時會讀放牛班，是因為「每天都看女同學又白又漂亮的小腿」，當時被外界認為又失言且有物化女性之嫌。韓國瑜說，立法院是最高民意殿堂，全國人民有歡笑、有苦悶、有困難，有各種需求，身為立委都有責任幫大家解決，像林倩綺是今日壽星，她一面過生日，另一面還來賣茭白筍，可見立法院就是人民希望的所在。林林總總的農產品、漁產品，立委都有責任要幫忙找到通路、更好的管道。韓國瑜提到，在南投還有茭白筍公主的評比，他有一年問主辦單位標準是什麼，對方回答，「茭白筍公主最重要的是小腿要漂亮，因為茭白筍跟小腿一樣」，聽了洪孟楷的介紹，他發現三芝這一帶的茭白筍真的不是浪得虛名，形體、型態更漂亮。希望國人同胞25、26日連續假期都可以前往三芝，不僅幫助農友，也可以讓全家大小身心靈放鬆。尤其三芝背倚陽明山、面對台灣海峽，相信所有好朋友都會玩得非常盡興愉快。韓國瑜表示，希望台灣不是只有高科技、半導體業可以發展順利，而是希望每一個基層的農民、漁民、勞工、自由業，都能過著幸福的日子。這是所有立委的期待。洪孟楷表示，三芝茭白筍一年只有一採，也因為位於北海岸，有相當於西瓜、木瓜的7度甜度，加上位處陽明山國家公園腳下，水與土地都是自然的餽贈，所以茭白筍飽滿又漂亮。邀請所有貴賓25至26日，蒞臨三芝一起品嘗茭白筍的風味。新北市三芝區公所將於10月25及26日舉辦茭白筍節活動，今日於立法院舉辦宣傳記者會。（記者陳逸寬攝）熱門賽事、球星動態不漏接    ,https://news.ltn.com.tw/news/politics/breakingnews/5214382
白營新竹市長提名戰開打？ 邱臣遠︰性騷案和解 努力拚市政,政治,2025/10/17 13:50,民眾黨2026新竹市長選舉黨內互打開戰？代理市長邱臣遠（右二）與停職市長高虹安（左二）都積極爭取黨內提名的態勢已越演越烈。（記者洪美秀攝）新竹市是民眾黨前主席柯文哲故鄉，也是民眾黨執政縣市，面對2026年縣市長選舉，民眾黨力拚連任，但涉貪停職的市長高虹安需面對貪污與誣告兩大官司，而代理市長邱臣遠近期動作頻頻，積極爭取黨內提名參選明年市長選舉，相較高虹安的貪污與誣告官司未定，邱臣遠昨晚在臉書發文稱與前民眾黨巫姓女助理的性騷官司已達成和解，表態會努力拚市政，展現邱臣遠高度爭取黨內提名參選企圖，此舉也提前引爆民眾黨內「雙市長」的提名保衛戰。邱臣遠昨晚罕見在臉書發出與市政無關的貼文，內容提到他與前民眾黨女助理巫馥彤的性騷官司結果，內容指出「此案經過完整的法律程序與雙方溝通，巫馥彤女士已於2025年10月14日正式與我達成和解，並於2025年10月16日在其臉書公開聲明，確認當時的指控屬誤會，並刪除當時不實指控的貼文；且刊登啟事以回復我的名譽」。強調該官司已告一段落，他將繼續推動市政、建設城市。此官司源起於巫女曾在112年6月在其臉書發文指邱臣遠曾對其性騷擾，邱臣遠否認性騷並提告且求償新台幣60萬元，但台北地院一審判邱臣遠敗訴，邱臣遠上訴後，雙方10月14日達成和解。請繼續往下閱讀...除性騷官司告一段落，邱臣遠近期動作頻頻，接下民眾黨新竹黨部主委及黨內選舉決策委員會委員職務，更透過市政體系與里長辦座談會拉攏里長支持，在高虹安貪污與誣告官司未定讞前，邱臣遠已悄悄備戰2026竹市長選舉，且出現民眾黨內罕見「停職市長」與「代理市長」互別苗頭的精采戲碼。民眾黨2026新竹市長選舉黨內互打開戰？代理市長邱臣遠與民眾黨前女助理的性騷官司已和解，表態會積極拚市政，爭取明年黨內提名的企圖很明顯。（記者洪美秀攝）熱門賽事、球星動態不漏接    ,https://news.ltn.com.tw/news/politics/breakingnews/5214396
黃國昌嗆「衝著我來講清楚」 四叉貓：整天只會推老婆出來擋,政治,2025/10/17 13:33,民眾黨主席黃國昌（左）、網紅四叉貓（右）。（本報合成、資料照）民眾黨主席黃國昌捲入指揮狗仔集團跟監政敵醜聞，日前被爆旗下狗仔集團近年的薪資由凱思國際支付，而該公司負責人是黃的姻親李麗娟。名嘴李正皓、康仁俊又相繼揭露，黃國昌妻子高翔、兒子戶籍都登記在李麗娟的房產下。黃國昌表示，在政治上面的攻擊衝著他來，搞到他的太太、未成年小孩的就學，有完沒完。對此網紅四叉貓表示，講話是可以這樣包牌的嗎？四叉貓在臉書PO文表示，今（17）日記者詢問黃國昌，他老婆戶籍是否登記在「凱思國際狗仔公司老闆李麗娟」的家裡，黃國昌：「搞到我的太太、搞到我的小孩，還扯到我未成年小孩的就學，有完沒完啊？」、「我做了什麼違法的事情，衝著我來、講清楚。」請繼續往下閱讀...四叉貓直言：「不是啊！我本來就衝著黃國昌！問黃國昌認不認識狗仔公司老闆李麗娟又不承認，整天只會講『我老婆很生氣叫我不要回答』，推老婆出來擋，那我改問老婆的戶籍是不是登記在李麗娟他家，黃國昌又嚷嚷著說不要搞到他太太，講話是可以這樣包牌的嗎？」熱門賽事、球星動態不漏接    ,https://news.ltn.com.tw/news/politics/breakingnews/5214322
高雄8綠委提財劃法新版本  柯志恩：是否打臉當初配合政院？,政治,2025/10/17 13:31,高雄8綠委提財劃法新版本，柯志恩質疑綠營新版本是否打臉當初配合政院的最佳版本說。（記者王榮祥攝）高雄8位民進黨立委宣布共同提案財劃法新版本，強調「比柯志恩版多爭取150億元」!柯志恩表示，國民黨智庫去年提出版本是眾多學者專家共同研擬，而高雄民進黨立委如今提案，是否在打臉當初配合政院稱「現行版本就是最好版本」的自己？柯志恩強調，去年財劃法於朝野協商時，她「多次」公開呼籲民進黨提出黨版、行政院提出院版，共同把餅做大造福人民。但當時民進黨上下配合卓院長稱「現行版本就是最好版本」，就是為了配合大罷免當政治籌碼，降低在野黨修法正當性，同時聽從柯建銘總召指令，民進黨立委不提案，行政院也拒絕提出版本；如今大罷免失敗，高雄民進黨立委們終於醒了，如今提案是否在打臉當初配合政院，稱「現行版本就是最好版本」的自己？請繼續往下閱讀...針對民進黨立委稱其共同提案版本，高雄可比現行財劃法多150億元，柯志恩酸無稽之談，強調目前高雄財源短缺，是行政院以地方統籌分配款稅款比例增加為由，大砍高雄的一般性補助與計畫性補助。就算真比現行多150億，但仍比整體高雄能全部拿到的財源少，她想請問民進黨立委，到底要幫高雄爭取財源，還是幫行政院省錢？為何民進黨立委不願幫高雄市民要回被砍的補助，而是要配合行政院欺負高雄人？柯志恩說，不分黨派任何立委替高雄爭取預算，她都樂觀其成，但民進黨立委不是行政院長，也不是任何立委說要幫高雄多150億就有150億，朝野協商最後還是要行政院點頭，請民進黨立委諸公們除了開記者會，更重要的是督促行政院趕快回魂，提出院版，否則都是光說不練、假戲真演!熱門賽事、球星動態不漏接    ,https://news.ltn.com.tw/news/politics/breakingnews/5214314
高雄8綠委喊修財劃法！邱議瑩提案：比柯志恩為高雄多爭取150億,政治,2025/10/17 13:18,立委邱議瑩召開「重修財劃法，還高雄公平正義：高雄立委共提財政收支劃分法修正案」記者會，黃捷（左起）、林岱樺、賴瑞隆、邱議瑩、許智傑、李昆澤、李柏毅、邱志偉。（記者陳逸寬攝）「財政劃分收支法」二度修法備受關注，邱議瑩等8位高雄的民進黨立委今（17日）齊聚一堂，直指時任國民黨智庫執行長柯志恩主導版本修法後，高雄增幅49％淪六都最低，嚴重加劇南北失衡；她已提出修正草案，透過4大方向補正漏洞，比柯版為高雄多爭取150億，還給高雄應有的公平正義。邱議瑩今號召高雄立委全員到齊，與賴瑞隆、許智傑、林岱樺、李柏毅、邱志偉、李昆澤、黃捷等人，在立法院召開記者會。請繼續往下閱讀...邱議瑩說明，她提出的版本是為高雄爭取最大利益，透過「分配計算更公平、鼓勵縣市永續發展、補正藍營版算式錯誤、六都平衡城鄉共榮」等4大方向，試算後比柯志恩版本為高雄多爭取150億財源，將台北市過多的資源分出，讓新北、桃園、台中、台南及多數縣市都能獲得更多財源。邱議瑩亦質疑，柯志恩既然想選高雄市長，是否願意支持這份高雄立委共同相挺的新版「財劃法」，盼柯站在公平正義的立場，說服國民黨一起支持邱議瑩版本，否則將愧對高雄市民。立委邱議瑩召開「重修財劃法，還高雄公平正義：高雄立委共提財政收支劃分法修正案」記者會（記者陳逸寬攝）熱門賽事、球星動態不漏接    ,https://news.ltn.com.tw/news/politics/breakingnews/5214353
政院版「丹娜絲颱風及七二八豪雨災後復原重建特別條例」修正草案 今逕付二讀,政治,2025/10/17 13:15,行政院版本的「丹娜絲颱風及七二八豪雨災後復原重建特別條例」相關修正草案，於立法院會逕付二讀，與相關提案併案協商。（記者陳逸寬攝）馬太鞍溪堰塞湖潰流重創光復鄉，行政院版本的丹娜絲颱風及七二八豪雨災後復原重建特別條例」修正草案，今日於立法院會逕付二讀，與相關提案併案協商。民進黨立委陳培瑜也提出相關修法版本，同樣逕付二讀，將由立法院長韓國瑜召集朝野協商。行政院會9日通過「丹娜絲颱風及七二八豪雨災後復原重建特別條例」修正草案，匡列250億元挹注堰塞湖的調查、監測、洪氾區設置及土砂防治與受災民眾安置等5大重點事項。原條例匡列金額為600億元，此次修正後整體規模達850億元。請繼續往下閱讀...修正草案增訂整治及災區復原事項，包含一，堰塞湖的調查、監測、洪氾區設置及土砂防治；二，受災民眾安置；三，雨污水下水道、家戶污水與道路排水設施的清淤、修繕及新建；四，農田泥砂清運、農地復原、專案休耕、農田廢園重建及農業生產環境重建；五，災後砂土混雜廢棄物分類去化。民進黨團今日於立法院會提議，將政院版的災後復原重建特別條例修正草案逕付二讀，與相關提案併案協商，在場立委無異議，因此逕付二讀，與相關提案併案協商。陳培瑜也提出相關修法版本，同樣逕付二讀，將由韓國瑜召集協商。立法院會14日已無異議將國民黨團所提「樺加沙風災暨馬太鞍堰塞湖潰壩災後重建特別條例」修正草案逕付二讀，由韓國瑜召集協商。熱門賽事、球星動態不漏接    ,https://news.ltn.com.tw/news/politics/breakingnews/5214323
曝「蔥滿勝算號」改裝車違規紀錄 四叉貓：不依限期參加定期檢驗什麼意思？,政治,2025/10/17 13:14,民眾黨主席黃國昌。（資料照）網路紅人「四叉貓」今日稍早指出，民眾黨主席黃國昌有一輛名為「蔥滿勝算號」的車，他查了這輛車的相關資訊發現，這輛車有「不依限期參加定期檢驗」的違規紀錄。四叉貓今日在臉書PO出圖片，圖片左方是黃國昌與民眾黨員站在「蔥滿勝算號」的照片，而右方則是「蔥滿勝算號」的違規紀錄，從114年2月14日至114年7月8日之間有「在道路收費停車處所停車經催繳不依規定繳費」5次、「不依限期參加定期檢驗」3次、「汽車行駛於應繳費之公路經催繳不依規定繳費」1次、「在禁止臨時停車處所停車」1次。請繼續往下閱讀...四叉貓在貼文中表示，黃國昌有一輛「蔥滿勝算號」登記在「臺北市前進城市論壇協會」名下（註：這個協會當然是黃國昌成立的），「蔥滿勝算號」在黃國昌選舉期間，以及前陣子走讀活動時都有出現，臺北市前進城市論壇協會的統編是「88096331」。四叉貓直言，進入監理服務網法人交通違規繳費紀錄查詢，輸入統編「88096331」，車牌「BLE-8101」即可得知這輛車有那些違規紀錄，查詢不用花錢，四叉貓想發問，因為沒開車不太懂，請問「不依限期參加定期檢驗」是什麼意思？改裝車沒去驗車嗎？網路紅人「四叉貓」今日稍早指出，民眾黨主席黃國昌有一輛名為「蔥滿勝算號」的車，他查了這輛車的相關資訊發現，這輛車有「不依限期參加定期檢驗」的違規紀錄。（圖擷取自 臉書）熱門賽事、球星動態不漏接    ,https://news.ltn.com.tw/news/politics/breakingnews/5214219
