Title,News_Type,date,content,url
湖西鄉長陳振中競選澎湖縣長 將推幼兒園點心免費、廢棄校園轉型托嬰,政治,2026/06/22 13:25,湖西鄉長陳振中，視察幼兒園餐食品質。（湖西鄉公所提供）將代表國民黨競選澎湖縣長的湖西鄉長陳振中今（22）日前往湖西鄉立幼兒園訪視幼兒用餐情形，實地了解餐食供應及校園飲食安全管理措施，並與園方交流意見，確保幼兒享有安全、健康且營養均衡的餐食，他也在縣長選舉中提出將推動幼兒園餐食免費、廢棄校園轉型托嬰中心等競選政見。訪視過程中，陳振中深入了解餐點製作流程、食材來源及衛生管理情形，並查看當日供應菜單。園方表示，餐點均依幼兒營養需求規劃設計，搭配多元食材，兼顧營養與美味，希望讓孩子從小建立良好的飲食習慣。適逢午餐時間，陳振中也走入班級關心幼兒用餐情況，觀察孩子們的用餐狀態，並親切與小朋友互動，鼓勵大家均衡飲食、多吃蔬果，培養健康飲食觀念。請繼續往下閱讀...陳振中表示，孩子是國家未來的希望，幼兒飲食健康更是家庭與社會共同關心的重要課題。校園餐食是孩子每日營養攝取的重要來源，照顧幼兒健康成長也是鄉政工作的重要一環。未來將持續關注幼兒園餐食品質、食品安全管理及教學照護環境，透過不定期訪視與關懷，支持各項提升幼兒福利與教育品質的措施，提供孩子更安全、健康的成長環境。同時，也期盼園方、家長與公部門攜手合作，共同營造優質的學習與成長空間，讓家長安心、孩子開心，陪伴每位幼兒快樂學習、健康成長。另外陳振中即將代表藍營參選下屆澎湖縣長，針對澎湖縣國中小學午餐免費，提出向下延伸至幼兒園，同時針對澎湖的托嬰場所不夠，托嬰嚴重不足，考慮廢棄學校轉型托嬰中心。陳振中提出營養午餐免費，由國中小延伸至幼兒園。（湖西鄉公所提供）    ,https://news.ltn.com.tw/news/politics/breakingnews/5479937
總預算未審完立法院鬧空城 廖偉翔到台中關懷身障就業,政治,2026/06/22 13:18,國民黨立委廖偉翔（後排左3，灰西裝）到台中庇護商店瑪利MAMA手做麵包關懷就業現場。（記者黃旭磊攝）今年度中央政府總預算延宕即將300天，立法院今天（22日）全院常設委員會全都排考察，未留院審預算，國民黨立委廖偉翔擔任社會福利及衛生環境委員會代理召員，非負責延宕預算案召委，廖偉翔中午到台中庇護商店用餐，呼籲企業重視身障就業及庇護工場採購。行政院去年8月函請立法院審議今年度總預算，至今298天尚未審竣，立院今天全院常設委員會全都排考察，未留院審預算，民進黨在脆（Threads）等社群媒體發文，點名「羅廷瑋、廖先翔、黃建豪、馬文君、洪毓祥」，5名立委負責委員會還沒審完總預算，「什麼時候願意好好上班？」請繼續往下閱讀...廖偉翔擔任社衛環委員會代理召委，未被民進黨點名，中午在庇護商店瑪利MAMA手做麵包用餐，餐廳為瑪利亞社會福利基金會陪伴身心障礙者築夢場所，衛生福利部次長呂建德等人陪同。廖偉翔呼籲企業進行綠色採購，也可透過庇護工場採購、綠色餐桌消費，獲取ESG（企業永續評級）認證及政策相關補貼。衛福部次長呂建德陪同考察，呂建德說，庇護工場在CRPT（身心障礙者權利公約）有諸多討論，會與環境部及勞動部共同推動輔導政策。    ,https://news.ltn.com.tw/news/politics/breakingnews/5479936
蔣萬安說沒有想2028大選？ 沈伯洋：蔣喜歡談中國議題大於市政議題,政治,2026/06/22 13:15,民進黨籍台北市長參選人沈伯洋說，蔣萬安一直都喜歡談中國議題，大於市政問題。（圖由沈伯洋辦公室提供）台北市長蔣萬安接受媒體專訪表示，他關心台灣未來發展議題，但完全沒有想2028的事，還喊話賴清德「加油」。民進黨籍台北市長參選人沈伯洋說，蔣萬安最喜歡討論中國議題，卻不肯回應市政議題。沈伯洋說，當時藍營一直說他喜歡講中國議題，但現在看起來，最喜歡講中國議題的，「怎麼看都是蔣萬安」，不管是鳳梨釋迦、小貓熊、廢監院、軍購等等議題，蔣一直以來都針對國家議題發言，卻不肯回歸最簡單的市政問題，如商圈經濟振興，市場改建遺留下來的問題，一直得不到答案；包括北士科問題、衛生問題、食安問題等各式各樣的議題，都很希望市長親自出來回應。請繼續往下閱讀...另對於民眾黨指控民進黨新北市長參選人蘇巧慧涉家族企業補助與利益衝突，實則非事實；沈伯洋表示，最近針對他跟蘇巧慧大概不太知道要攻擊什麼，變成只有造謠方式之外，內容也開始針對家人，這是不健康的選戰方式，呼籲回歸市政。而國民黨及新北市長參選人李四川近來也頻頻關心台北市的交通，沈伯洋說，那表示他在台北市副市長任內還沒有處理完台北市的交通，他應該回到台北把沒有處理好的交通問題處理好，不然每一次都突然來回應台北市的交通問題，就只是在暴露現在對他過往沒有解決台北市問題的窘境。    ,https://news.ltn.com.tw/news/politics/breakingnews/5479931
廢監院爭論再起 陳昭姿嗆綠營速提修憲「一定支持到底」,政治,2026/06/22 13:15,民眾黨立委陳昭姿。（資料照）總統府日前提出下屆監委29人名單，引來在野黨團一致反對，更再度掀起監察院存廢議題，民眾黨呼籲執政黨速開修憲委員會「+1」；不過，民進黨團總召蔡其昌今上廣播節目受訪稱，民眾黨應先去跟藍營總召傅崐萁討論；對此，白委陳昭姿反嗆綠營過去擁抱廢監、執政後卻政策轉彎，要綠營趕快自提修憲案，「民眾黨一定支持到底」。第6屆監察委員任期即將屆滿，總統府先前公布第7屆監委提名名單，台北市長蔣萬安、民眾黨立法院黨團接連喊出修憲廢除監察院。民進黨立法院黨團總召蔡其昌今天表示，民進黨過去到現在都主張廢除監察院，「拜託民眾黨趕快跟國民黨團總召傅崐萁討論。」請繼續往下閱讀...媒體提問，民眾黨團主張修憲廢監院，而民進黨團總召蔡其昌稱如果藍同意，就能立刻修憲廢考監，詢問民眾黨是否已和國民黨就此進行溝通？對此，民眾黨立委陳昭姿回應，廢監當然是民眾黨主張，然而，廢考監、改三權分立這件事其實是民進黨數十年來的「一貫主張」，但很遺憾的，這項工作經常都是民眾黨在執行，反批民進黨「在朝之後就直接轉彎」。她強調，朝野本來就能進行議題合作，民進黨政府也提出相同主張，呼籲民進黨自提修憲案，「如果要廢除這個監察院，我們民眾黨一定支持到底」。    ,https://news.ltn.com.tw/news/politics/breakingnews/5479930
尹乃菁請辭獲准陳以信接任國民黨文傳會主委 傳黨內有「異」見,政治,2026/06/22 13:10,前國民黨立委陳以信。（資料照）國民黨文傳會主委尹乃菁5月12日因個人健康因素向黨主席鄭麗文請辭，國民黨今日發布黨務人事命令，由前國民黨立委、現任政策會副執行長陳以信接任，強化政策論述與對外溝通。據了解，由於鄭中央定調，所有的民選民意代表都不要，加上陳以信近來時常幫鄭麗文辯護和宣傳，鄭麗文屬意陳以信接任的風聲不脛而走，令數名有意願接任、卻未被徵詢的民代相當不滿。陳以信原本要爭取今年國民黨台南市長選舉人選，不過他去年底宣布，由於國民黨內參民調顯示謝龍介仍是國民黨最強候選人，他願意接受民調結果，不再爭取國民黨台南市長提名。而陳以信近日馬不停蹄的在台南幫謝龍介輔選，也為後年的立委選舉做努力，勤跑基層。請繼續往下閱讀...國民黨表示，陳以信具備深厚國際事務、政策研究與媒體溝通歷練，曾任第十屆立法委員、總統府發言人、國民黨發言人兼文化傳播委員會副主任委員、國際事務部主任、海外部主任及政策會副執行長等職務，長期參與國家政策、國際交流與公共論述工作；學術方面畢業於國立台灣大學政治學系，並取得英國倫敦大學亞非學院經濟學博士學位，曾於英國劍橋大學及倫敦大學從事研究工作。國民黨表示，當前台灣面臨國際局勢快速變動與國內重大政策挑戰，期待借重陳以信在政策論述、國際事務及媒體傳播方面的專業與經驗，進一步整合黨內政策溝通能量，強化對外論述與社會對話，讓國民黨的主張更有效傳達給社會大眾。    ,https://news.ltn.com.tw/news/politics/breakingnews/5479926
藍營推薦中選會委員引紅統見解稱「權威解讀」 邱志偉批中共代言人,政治,2026/06/22 13:07,新任中選會委員蘇嘉宏（右）以輔英科大教授名義發表投書文章，稱中國紅統學者見解是『權威解讀』。（資料照）中國海警船頻繁騷擾台灣東部海域之際，國民黨所推薦的新任中選會委員蘇嘉宏發表文章，大幅引用中國紅統學者見解，聲稱這是「權威解讀」。對此，民進黨立委邱志偉今日痛批，台灣很多「中共代言人」，在對中共立場「歌功頌德」，奉勸不要昧著學術良心，做傷害國家主權的事。蘇嘉宏在媒體上發表「從戰略反制到常態治理─中國近海治理東擴，台灣東部海域將成下一個內海？」文章，大量引述北京聯合大學台灣研究院教授朱松嶺、廈門大學台灣研究院講座教授鄭劍的觀點，聲稱中國此次執法與掃測行動，不僅是維護主權，更具有反制外部勢力介入、破擊拒止體系的重要戰略意涵。請繼續往下閱讀...離譜的是，鄭劍認為中國在台海問題上採取的是「後發制人」的反制模式，即「台獨挑釁一步，大陸反制一步」，每一次反制措施，都體現一次「兩岸同屬一個中國」的法理與事實，長期累積將有助於推進統一進程。蘇嘉宏竟撰文稱，「這兩位學者的見解可以說是『權威解讀』，值得台灣各界對照閱讀與深思」。對此，邱志偉受訪表示，台灣有很多「中共代言人」，不管是學界、政界或國民黨內，都在對中共官方立場「歌功頌德」，大力在講中國觀點，甚至是替這種觀點背書。邱志偉批評，須注意的是，此人是用輔英科技大學「學者」身分投書網路媒體，附和中國學者主張對台有管轄權的論點，可見中共統戰存在每一個領域，政界、學界很多都在唱和。「請這些學者不要昧著良心，做傷害國家主權的事！」邱志偉說，即便只是一篇投書，都可以看出這篇投書是帶有政治目的，一般受到科學訓練的人，從國際法的角度，怎麼會認為中國做法是正確的？怎麼會去附和中共學者說法！這種文章是違背學術良心，自甘充當中共統戰的馬前卒，變成中共對台統戰工具，非常悲哀。邱志偉質疑，他對這種學者的學術地位真的不敢苟同，發表這種投書文章一定是有政治目的，到底是自願，還是被教唆？或是有系統的行為？相關單位都要注意。    ,https://news.ltn.com.tw/news/politics/breakingnews/5479914
被酸「想要去北京交流」沈伯洋：蔣萬安要注意事實查證,政治,2026/06/22 13:07,沈伯洋今天在立法院受訪表示，蔣萬安對事實查證要注意。（沈伯洋辦公室提供）台北市長蔣萬安回應外界詢問他會不會找國民黨主席鄭麗文站台時，酸民進黨及台北市長參選人沈伯洋「不是說要去北京交流嗎？他們應該有很多共同的話題」；沈伯洋今（22）在立法院受訪表示，蔣萬安對於事實查證要注意，他是提到台灣跟中國交流必須首都對首都，不是說想要去北京。沈伯洋對於蔣萬安酸他「不是說要去北京交流嗎?」認為沈跟鄭麗文應該有很多共同的話題；沈伯洋今天說明，當時他是提到，如果台灣要跟中國交流，應該是首都對首都，所以台北要交流，也應該是跟北京，「根本就不是說我想去北京」，蔣萬安對於事實查證要注意。請繼續往下閱讀...沈伯洋說，不管是雙城論壇或鳳梨釋迦的題目，他的說法都是一樣的：不能只鎖在一個國家，應該要和很多國家做交流，尤其是和沒有政治前提的國家；若跟多個國家推銷，風險就分散，這跟他之前提到雙城論壇應該要變成無限城論壇，都是一樣的意思。而台北市作為一個水果行銷重要的城市，有責任幫農民做行銷，做沒有政治風險的行銷。    ,https://news.ltn.com.tw/news/politics/breakingnews/5479915
讚習近平手「柔軟像雲朵」 鄭麗文：他手是真的很軟,政治,2026/06/22 12:57,美方人士指出，鄭麗文稱4月10日的「鄭習會」上，她和習近平握手，感受到習的手又大又厚實，而且柔軟的像是雲朵。（美聯社檔案照）國民黨主席鄭麗文甫結束訪美行程，美方人士爆料，鄭麗文談到鄭習會，形容中國國家主席習近平的手摸起來「又大又厚實」、「柔軟的像是雲朵」，引發熱議。鄭麗文今日表示，習近平的手是真的很軟，但她已不記得是在哪個場合說的。本報日前獨家披露，幾位美方人士指出，鄭麗文在對話時描述，4月10日的「鄭習會」上，她和習近平握手，感受到習的手又大又厚實，而且柔軟得像是雲朵。鄭麗文並且向美國人分享，她曾經為此問了算命師，什麼樣的人的手會是這樣？算命師告訴她：「這是一個成功者的手相」。聽到的幾位美方成員，都感到驚訝到久久不能自已，不解「這是什麼狀況」？請繼續往下閱讀...「他手是真的很軟。」鄭麗文今日中午接受CNEWS匯流新聞網【中午來開匯】專訪，主持人黃光芹詢問，讚習近平手「柔軟像雲朵」是何時跟人講的，能否還原一下？鄭麗文說，「我已經不記得了」，因為她從北京回來之後，所有駐台外館、智庫、媒體，私下都會問她與習近平的直接接觸，印象是什麼等細節，也有人詢問握手的感覺。鄭麗文表示，這也不是什麼國防機密，她也不是全世界唯一一個跟習近平握手的人，也不覺得這有什麼特別敏感、放大的。因為很多智庫的交流是閉門、不公開的，媒體去訪問有參與的學者專家，可能因為大部分都不能講，他們就挑這個可以講的、講了也沒什麼，就是這樣。獨家》忘了我是誰？她描述習近平的手「柔軟的像雲朵」    ,https://news.ltn.com.tw/news/politics/breakingnews/5479909
讚習近平手「柔軟像雲朵」 鄭麗文：他手是真的很軟,政治,2026/06/22 12:57,美方人士指出，鄭麗文稱4月10日的「鄭習會」上，她和習近平握手，感受到習的手又大又厚實，而且柔軟的像是雲朵。（美聯社檔案照）國民黨主席鄭麗文甫結束訪美行程，美方人士爆料，鄭麗文談到鄭習會，形容中國國家主席習近平的手摸起來「又大又厚實」、「柔軟的像是雲朵」，引發熱議。鄭麗文今日表示，習近平的手是真的很軟，但她已不記得是在哪個場合說的。本報日前獨家披露，幾位美方人士指出，鄭麗文在對話時描述，4月10日的「鄭習會」上，她和習近平握手，感受到習的手又大又厚實，而且柔軟得像是雲朵。鄭麗文並且向美國人分享，她曾經為此問了算命師，什麼樣的人的手會是這樣？算命師告訴她：「這是一個成功者的手相」。聽到的幾位美方成員，都感到驚訝到久久不能自已，不解「這是什麼狀況」？請繼續往下閱讀...「他手是真的很軟。」鄭麗文今日中午接受CNEWS匯流新聞網【中午來開匯】專訪，主持人黃光芹詢問，讚習近平手「柔軟像雲朵」是何時跟人講的，能否還原一下？鄭麗文說，「我已經不記得了」，因為她從北京回來之後，所有駐台外館、智庫、媒體，私下都會問她與習近平的直接接觸，印象是什麼等細節，也有人詢問握手的感覺。鄭麗文表示，這也不是什麼國防機密，她也不是全世界唯一一個跟習近平握手的人，也不覺得這有什麼特別敏感、放大的。因為很多智庫的交流是閉門、不公開的，媒體去訪問有參與的學者專家，可能因為大部分都不能講，他們就挑這個可以講的、講了也沒什麼，就是這樣。獨家》忘了我是誰？她描述習近平的手「柔軟的像雲朵」    ,https://news.ltn.com.tw/news/politics/breakingnews/5479909
梁文傑稱「鳳梨釋迦台灣人幾乎不吃」 張麗善：別坐辦公室吹冷氣講風涼話,政治,2026/06/22 12:54,陸委會副主委梁文傑稱「鳳梨釋迦台灣人幾乎不吃」，雲林縣長 張麗善批別坐辦公室吹冷氣講風涼話。（記者黃淑莉攝）針對陸委會副主委梁文傑6月19日指出，「鳳梨釋迦這個產品台灣人幾乎不吃」，引起外界熱議，雲林縣長張麗善今（22）日受訪指出，不要坐在辦公室裡面吹冷氣講風涼話啦。台東縣長饒慶鈴日前以預錄影方式參與海峽論壇，推廣台東鳳梨釋迦等農產品，陸委會對外說要查處，梁文傑上週六對外又說，鳳梨釋迦台灣人幾乎不吃，90%都依賴中國採購。請繼續往下閱讀...張麗善表示，饒縣長身為農業縣的縣長站在第一線守護農民的立場，為農民發聲，維護農民的權益，幫農民爭取更多的行銷管道，是當然的，無論是銷往中國或其他國家，都是我們應該也必須要做的。張麗善說，農民辛苦、用心栽種，就是希望所生產的農產品要有出路，鳳梨釋迦一直以來都是銷往中國，也受到當地消費者的喜愛，台灣鄉親當然也非常喜歡吃鳳梨釋迦，沒有人會去種沒有市場的產品。張麗善指出，我們要肯定農民本身的栽培技術及農民的用心，任何一種水果都有它的好處，也有很多消費者喜愛，她個人就覺得鳳梨釋迦是一種很棒的水果，通路越廣對農民越有保障，不能因為要阻斷銷往中國，就去講一些傷害農民、傷害農產品的風涼話，讓人沒辦法接受，應該要站在農民的立場，體恤農民栽種的辛苦，這樣才對。    ,https://news.ltn.com.tw/news/politics/breakingnews/5479901
白營再咬未利益迴避胞妹  蘇巧慧競辦駁斥：烏龍爆料未道歉又抹黑,政治,2026/06/22 12:52,蘇巧慧競辦回應白營指控民進黨新北市長參選人蘇巧慧未利益迴避胞妹蘇巧純。（圖片由蘇巧慧競選辦公室提供）民眾黨陣營指控民進黨新北市長參選人蘇巧慧未利益迴避胞妹蘇巧純；蘇巧慧競辦今（22）日回應，蘇巧純非威如公司員工、未申請過相關補助，蘇巧慧未介入任何標案，白營上次指控烏龍都還沒道歉，又繼續抹黑，可見公信力有多薄弱。繼「曠世智能」，其威如科技旗下平台「akaSwap」也被質疑領取國家補助卻未依法揭露，民眾黨新北市議員參選人林子宇今指，蘇巧純自承是威如科技營運長，且補助計畫書就提及該平台，質疑蘇巧慧一手審預算又拿補助，要求道歉並退選請繼續往下閱讀...蘇巧慧競選辦公室發言人馬亨亨．夷將回應，白營上次開記者會，把國民黨執政的台東縣府發包的案子，和文化部對科技藝術創作的補助案混淆在一起，還把蘇巧純任職的akaSwap和威如公司混淆成同一個公司，針對這兩個烏龍都還沒道歉，現在又繼續抹黑蘇巧慧，相信社會都可以看到他們的公信力有多薄弱。他重申，蘇巧純不是威如公司的員工，蘇巧慧不但從未介入任何標案，蘇巧純也未申請過文化部或黑潮的補助。如果對手陣營真的認為有違法，可以去法院告發，就像讓國民黨新北市長參選人李四川環保流氓弟弟在法院認罪一樣，而不是在提不出違法事實下，連續開了一個月的記者會。馬亨亨·夷將指出，說到說謊該退選，李四川聲稱自己的豪宅是預售，卻被建商在法院說法，「我們是先建後售」打臉。李四川聲稱頭期款來自股利，但其申報的股票根本不可能有900多萬股利收入，李四川一再說謊被打臉，民眾黨難道要他退選？他強調，面對對手陣營的抹黑，蘇巧慧團隊還是會繼續秉持正面、陽光的選戰節奏，讓新北市民有機會選擇適合新時代、有創意和新觀念的蘇巧慧，成為新北市長。另外，文化部日前也發聲明澄清，黑潮計畫並未補助akaSwap，威如科技所獲的補助案也非黑潮計畫補助，文化部指出，民眾黨所指的黑潮計畫補助，經查應為文化部補助「文化黑潮之XR沉浸式影像創作補助」，獲補助單位及計畫為台北藝術大學及太極影音科技公司的「『三官出巡—鬧元宵』多人互動XR創作計畫」，全案去年初即結案。文化部說，威如科技承辦台東縣府今年2月主辦的「台東慶元宵」活動，發包單位也是台東縣府，與文化部黑潮補助案執行時間及獲補助單位並無關聯。控蘇巧純自爆是「威如科技」營運長 民眾黨再批蘇巧慧「一手審預算、一手拿補助」    ,https://news.ltn.com.tw/news/politics/breakingnews/5479873
白營扯蘇巧慧胞妹爭議應退選 戴瑋姍：李四川豪宅疑雲未解也該退選？,政治,2026/06/22 12:49,民眾黨召開記者會質疑民進黨新北市長參選人蘇巧慧胞妹蘇巧純未利益迴避，新北市議員戴瑋姍反嗆民眾黨雙標，並說國民黨新北市長參選人李四川豪宅疑雲交代不清，是否應該退選？（圖擷取自戴瑋姍臉書）台灣民眾黨黨團今天召開記者會，質疑民進黨立委暨新北市長參選人蘇巧慧胞妹蘇巧純旗下公司威如科技未利益迴避，蘇巧慧一手審預算、一手拿國家補助，應道歉退選。新北市議員戴瑋姍回嗆，請民眾黨不要雙重標準，國民黨新北市長參選人李四川造勢自稱「艱苦人」，但是李四川豪宅疑雲的3大謊言，始終交代不清，是不是也應該退選？戴瑋姍指出，李四川聲稱豪宅是預售屋，卻被建商廣告、李四川財產申報、法院判決三度打臉，證明豪宅就是「先建後售」，這是李四川第1個謊言。請繼續往下閱讀...再者，李四川聲稱自己買豪宅的近千萬頭期款，在財產申報中看不到來源，是他用股利收入去支付，但攤開李四川當年財產申報的持有股票，根本不可能達到900多萬元的驚人股利，錢到底哪裡來？這是李四川第2個謊言。此外，李四川聲稱豪宅興建時，自己並非發放建照的台北縣工務局長，但事實是，李四川在興建過程中，從台北縣副縣長做到新北市副市長，就是工務局長的頂頭上司，權力更大、官位更高，這是李四川的第3個謊言。戴瑋姍批評，候選人自我包裝行銷很正常，但是裝「艱苦人」形象，只是為了政治攻擊、向對手噴口水，那就非常虛偽。家族在小琉球恐嚇勒索、自己持有的農地還有違建，甚至到現在還沒拆除，李四川怎麼敢自稱「艱苦」人？戴瑋姍說，按照今天民眾黨記者會的說法，李四川的豪宅事件，說法一再改口，民眾黨是不是應該要求李四川退選？    ,https://news.ltn.com.tw/news/politics/breakingnews/5479869
