Title,News_Type,date,content,url
李四川提雙北共治  蘇巧慧：新北不是「細漢」、雙北合作不要共治,政治,2026/05/15 14:59,民進黨立委、新北市長參選人蘇巧慧今（15）日出席珍愛教育基金會「515國際家庭日 珍愛一家人」活動。（記者黃子暘攝）民進黨立委、新北市長參選人蘇巧慧今（15）日出席珍愛教育基金會「515國際家庭日 珍愛一家人」活動，席間受訪。國民黨新北市長參選人李四川提出雙北共治，要用軌道交通建設串連台北市，讓雙北變成「30分鐘生活圈」，蘇巧慧是否攜手黨籍台北市長參選人沈伯洋提出雙北交通政見？蘇巧慧說，新北市是人口最多的縣市，「我們不是別人的『細漢』。所以雙北既然是共同生活圈，其實兩個城市應該是要合作，而不是共治。」蘇巧慧說，比如當年SARS疫情時，台北市沒有處理好，變成台北縣（現新北市）的負擔，「是台北縣來幫台北市收拾爛攤子」；台北交通若做得不好，新北就會塞車回堵，台北鼠患若處理不好，新北市的環境也會大受影響，2市之間，「我們希望的是要能夠以新北市為主體提出種種的政策。」請繼續往下閱讀...蘇巧慧指出，她的團隊經過縝密研究，在各區認真研究能夠滿足新北自己需求的細項政見，希望新北各區都能夠是最漂亮、最能展現特色的區域，「未來，我們也會以新北市為主體，在各個面向上提出更多的政見，爭取新北市民的認同。」「我相信在這個新時代，市民會選擇一個以新北市為主體，能夠獨立思考，而且能夠論述（的參選人）」，蘇巧慧表示，而且參選人要具備能夠說服、帶動市民一起為新北付出的熱情，她就是這個新時代的適任新市長人選。此外，被問及國民黨市議員批評「收割」鶯歌區公八公園地下停車場工程，蘇巧慧回應，在地里長已說得很清楚，公八公園停車場將來會為地方增加將近300個停車位，大家都非常的期待，地方建設就是中央、地方一起努力，不用過多的口水，讓新北市更好。民進黨立委、新北市長參選人蘇巧慧今（15）日出席珍愛教育基金會「515國際家庭日 珍愛一家人」活動。（記者黃子暘攝）    ,https://news.ltn.com.tw/news/politics/breakingnews/5438008
漏網鏡頭》沈伯洋參選台北市長 新造型衝人氣,政治,2026/05/15 14:55,沈伯洋改變新造型衝人氣。（記者方賓照攝）民進黨本週提名立委沈伯洋參選台北市長，近日沈伯洋打造新形象，不僅在外表下工夫，除換新髮型外，服裝上也做出改變，今日穿上米色西裝出席院會，令人耳目一新，也讓黨籍立委爭相拍照。對於各界關注外型變化，沈伯洋表示，他現在參選台北市長，為了讓大家多認識他，勢必要到處掛看板。若今天他的爆炸頭將看板佔了一半，對城市美學會有一定傷害，因此服裝、儀容一定要注意。沈伯洋新造型衝人氣。（記者方賓照攝）沈伯洋新造型衝人氣。（記者方賓照攝）沈伯洋新造型衝人氣。（記者方賓照攝）沈伯洋新造型衝人氣。（記者方賓照攝）    ,https://news.ltn.com.tw/news/politics/breakingnews/5437992
澎湖5鄉發禮金大車拚  馬公市代表吳仁祥提案發放1萬元,政治,2026/05/15 14:48,馬公市代表吳仁祥提案，普發馬公市民每人一萬振興經濟禮金。（吳仁祥提供）澎湖縣5鄉都發放振興經濟禮金，唯一未發放的馬公市，代表吳仁祥今（15）日向代表會提案「馬公市振興禮金10000元」，由於馬公市人口6萬多人，經費高達6億多元，但馬公市稅收不及1億，就算達舉債上限，也無法籌足金額，恐淪為空談。吳仁祥表示，因應近期物價波動剌激民間消費動能，並減輕民眾生活負擔。提案建請馬公市公所辦理「振興經濟民生禮金」計畫，向馬公市民每人發放新台幣1萬元振興禮金。理由是受外部經濟環境波動及通膨壓力影響，民間消費力道趨於保守。透過普發禮金，可直接挹注家庭所得，帶動餐飲、零售及微型商圈之庶民經濟。請繼續往下閱讀...同時吳仁祥說明，鑑於稅收徵收狀況良好或年度預算賸餘，本於「還稅於民 」或「社會福利優化」之精神，將經濟成長成果與大眾分享，協助緩解民生物價上漲之壓力。吳仁祥提案獲得陳永澎、吳志宏代表附議，同時吳仁祥認為馬公市人口多、稅收多， 馬公市應該發的比各鄉發的多，並希望澎湖縣政府也能發放振興禮金。馬公市的資金來源，主要由自籌稅收、統籌分配稅款以及上級政府補助款組成。由於馬公市人口眾多，負擔龐大的基礎建設與社會福利開支，財政結構相當依賴非自籌財源，因此在歲收有限、人口達6萬多人，能否發放振興經濟禮金，成為各界關心焦點。馬公市代表吳仁祥提案，發放每人10000元振興經濟禮金。（吳仁祥提供）    ,https://news.ltn.com.tw/news/politics/breakingnews/5438021
蘇巧慧爭取3500萬治水補助 北大特區防洪排水工程完工,政治,2026/05/15 14:42,民進黨新北市長參選人蘇巧慧（右三）與市長侯友宜視察。（記者翁聿煌攝）民進黨新北市長參選人、立委蘇巧慧15日出席三峽北大特區治水改善成果視察，蘇巧慧表示，治水改善工程與市民生活息息相關，因此她不僅成功爭取中央補助北大特區防洪排水工程共3500萬元，佔總經費7成，也在2024年安排中央地方部會共同視察北大特區、浮洲地區治水工程進度，如今看見北大特區工程完工，眾人都十分高興。蘇巧慧強調，近幾年極端氣候下強降雨發生次數頻繁加劇，樹林、鶯歌地區也曾發生泄水不及的狀況，因此她多次舉辦協調會、會勘，蘇巧慧指出，治水基礎建設雖然不易被看見，但對城市發展至關重要，尤其樹林、鶯歌地區早期農業灌溉溝渠多，城市轉型過程中基礎設施更為關鍵。請繼續往下閱讀...蘇巧慧指出，北大特區因為橫跨都市計畫區與旁邊的非都市土地，同時加上既存的農業灌溉溝渠，以及整個市區的排水最後都匯聚於佳園路三段145巷，導致在排水治理上，格外有挑戰性，她長期與議員、里長敦促中央地方協力解決民眾淹水的困擾，爭取中央補助款3500萬元，施作抽水馬達、排水箱涵、滯洪池等。蘇巧慧說，治水不分中央和地方，此工程由中央提供經費上的支持，並由新北市政府趕在今年防汛期開始前完成工程施作，未來她和在地議員、里長們也將持續關心水溝保養、側溝清淤，以在未來颱風或強降雨來臨時有備無患。民進黨新北市長參選人蘇巧慧（中左）與市長侯友宜視察。（記者翁聿煌攝）    ,https://news.ltn.com.tw/news/politics/breakingnews/5437991
中信五號展現國造能力   韓碧祥強調不能事事靠政府,政治,2026/05/15 14:40,韓碧祥強調要保護台灣，就要有充足國防預算。（記者洪臣宏攝）國防特別預算預料朝野將展開新一波攻防，中信造船集團董事長韓碧祥今（15）日說重話，國防預算沒過對台灣人很不利，既然說中國好就去中國。他以無人船「中信五號」為例說明國防自主重要性，認為業者也要踏出第一步，不能凡事靠政府。海委會海巡署艦隊分署今在中信造船高鼎廠舉行「600噸級巡防艦第12艘CG-615命名下水典禮」，由主委管碧玲命名「東港艦」，屏東縣長周春米擲瓶祈福。請繼續往下閱讀...媒體詢問韓碧祥對國防預算案看法，他說，保護台灣國防要充足，不然怎麼保護台灣？他當然希望軍事預算能補足，每個國家也都會支持自己的國防，大家都住在台灣這塊土地，都希望台灣好，預算沒過對台灣人很不利，既然說中國好就去中國。中信無人船「中信五號」在國際航太暨國防展亮相後引發關注，韓碧祥說，中信五號曾開到小琉球、淡水測試，從無到有，但一定要去做，不然永遠都不會做，做了就知道缺點，才會愈做愈好，業者也要踏出第一步，不能凡事靠政府。至於承造海巡署艦艇甘苦談，韓碧祥說，7年前拿到海巡署81艘艦艇訂單，即歷經供應鏈重整、疫情缺工缺料，及俄烏戰爭帶來設備、運費大幅上漲，當初以為中信拿到這批訂單以後會「快活」，結果是「阿婆炊碗粿」做到倒貼，始料未及，但中信團隊仍是堅守崗位、堅持品質，甚至提前交艦。他認為，「東港艦」交艦典禮不是終點，而是新的起點，中信將帶著這次歷練的信念，迎接下個旅程。管委會主委管碧玲在致詞時說，相信國艦國造會持續深化，未來還會有下一波的造艦計畫。韓碧祥致贈東港艦船模給屏東縣長周春米。（記者洪臣宏攝）    ,https://news.ltn.com.tw/news/politics/breakingnews/5438007
蔡英文談決策 曝「這兩件事」是總統任內困難決定,政治,2026/05/15 14:25,蔡英文昨赴東海大學演講，暢談決策所面對的挑戰與態度。（蔡英文辦公室提供）蔡英文昨赴東海大學演講，談到在她擔任總統的8年裡，經常得面對一些非常困難的決定。小英並舉2017年開始推動的年金改革，是任內最具挑戰性的決策之一。此外，2018年的地方選舉，10個公投案有5個和同志婚姻、性別平權教育有關。顯見台灣社會對這議題有多麼分歧，政府所面對的壓力有多大。而後在2019年5月，完成婚姻平權立法，讓台灣成為亞洲第一個實現婚姻平權的國家。針對年金改革，蔡英文說，當時的情況很清楚：如果不改革，整個制度很可能在未來十幾年內面臨破產；而制度一旦失衡，最後承擔最大壓力的，往往就是還沒有發言權、也還沒有享受到制度保障的年輕世代。越晚改革，就越困難。馬英九前總統在交接時，也特別提醒她這項改革的急迫性。請繼續往下閱讀...但是，小英坦言，改革從來不只是把數字算清楚而已。它也會影響許多已經退休、或即將退休的人。這就是執政最困難的地方。很多決策，不是單選題，也不是改革的一邊全對，另一邊全錯。蔡英文說，當時的執政團隊，就是在這樣的情況下，面臨一個問題：是維持現狀，把問題留給下一代；還是承擔政治壓力，把制度調整到能夠長久運作？最後，我們選擇啟動改革。她說，從2018年到2024年，因為年金改革所省下來、並可提供退撫基金挹注的經費，累積已經達到2590億。但她也憂心，立法院去年底決議，終止這項改革繼續往前走，這將會相當程度地減緩改革力道。蔡英文再舉婚姻平權為例說，在不同世代、不同信仰、不同生活經驗之間，對婚姻、家庭和教育的想像，確實存在很大的差異。但是，我們頂住壓力，也走出去跟人民溝通。她回憶說，在許多年輕人的支持下，我們努力爭取更多社會理解。這段過程中，當時行政院長蘇貞昌也站上第一線，用他最熟悉、也最貼近人民的台語，和許多長輩溝通。同時，我們提出的方案，也做了一些修正。在2019年5月，我們完成婚姻平權立法。蔡英文總結說，做改革，不是只要方向正確就夠了。執政與決策的困難，在於當社會有不同意見、不同價值、不同焦慮的時候，政府要如何一邊堅持基本的價值，一邊保留對話的空間；一邊推動必要的改革，一邊讓社會感受到被尊重。溝通不是把自己的立場講得很大聲，也不是要求所有人都接受同一個答案。民主政治的責任，不只是做出決定；更是在做出決定之後，讓社會仍然願意彼此理解、繼續溝通，並且一起往前走。蔡英文昨赴東海大學演講，暢談決策所面對的挑戰與態度。（蔡英文辦公室提供）    ,https://news.ltn.com.tw/news/politics/breakingnews/5437933
「走新路」遭質疑否定林姿妙 吳宗憲批綠論述走向地下電台水準,政治,2026/05/15 14:23,「走新路」遭質疑否定林姿妙，吳宗憲批綠論述走向地下電台水準。（記者王峻祺攝）國民黨宜蘭縣長參選人吳宗憲喊「宜蘭走新路」引熱議，綠營也質疑是否定林姿妙執政，成為選戰攻防焦點。吳宗憲今天接受「品觀點─觀點芹爆戰」節目專訪，批綠論述要有高度，而不是「走向地下電台水準」，自己的政見是在成功基礎上「再升級」，非抹滅過去。吳宗憲今天接受資深媒體人黃光芹專訪，提及「宜蘭走新路」口號，被綠營質疑是否定以前國民黨政績。他直言，對手陣營發言人與地方黨部，將走新路訴求曲解為否定林姿妙，但難道對手是希望宜蘭永遠不進步？既然已經走到縣長層級選舉，「今天要有那樣的高度論述，而不是變成地下電台的水準。」請繼續往下閱讀...他說，「走新路」概念，是在「成功的基礎上面，我們要讓它更成功、更棒」。這就是現代企業一直在講的「創新」。這2個字，不管是在教育界、學術界、商業界，都可以看到常常在用。難道喊創新，就是否定自己去年的政策嗎？吳宗憲說，企業創新必須建構在舊有成功的成果之上，他要做的是「再往上加」，以林姿妙推動的「國中小營養午餐免費」為例，他當選後不但會延續，還會調高預算，應對物價並採購宜蘭在地優質食材；至於老人福利，也會延續林姿妙照顧長者的心意，進一步推動65歲以上健保費免費。他強調，宜蘭要「做大事」、「人留下」、「走新路」，首先是讓宜蘭青年不用「北漂」，透過招商引資讓青年能留鄉工作、陪伴家人；其次是強化觀光能量，「至少在宜蘭多住一個晚上」，帶動在地飯店與餐飲消費；最後則是「海納百川」，吸納各縣市與國外人才到宜蘭服務定居。吳宗憲說，宜蘭也不能單打獨鬥，必須結合北北基桃與花蓮的力量，目前也正積極接觸「矽光子元件」測試封裝廠、Google「算力中心」等科技產業，希望能建立完整產業鏈，而非只引進單一工廠；自己過去在行政機關待了20年，任何政策都會從預算精算、可行性評估出發，拒開隨便丟、無法執行的「芭樂票」。吳宗憲今天接受資深媒體人黃光芹專訪，提及「宜蘭走新路」口號被綠營質疑是否定以前國民黨政績。（圖擷取自「觀點芹爆戰」直播節目）    ,https://news.ltn.com.tw/news/politics/breakingnews/5437961
林亮君批反針孔偵測稽核覆蓋率太差 蔣萬安跳針回：源頭管理最有效,政治,2026/05/15 13:52,台北市長蔣萬安。（記者田裕華攝）台北市長蔣萬安今（15）赴議會進行專案北士科發展等專案報告，不過議場質詢內容多聚焦在近期持續延燒的醫美診所涉偷拍風波，面對多位民進黨議員詢問稽核覆蓋率過低，蔣表示，「源頭管理」是最有效的根本解決之道，多次強調去年6月就發函建請中央修法，以實名制購買隱藏式針孔攝影設備，但未獲重視，引發議員不滿。議員林亮君認為蔣文不對題，提醒目前討論的是稽核率太差，市府要先檢討，並以衛生局轄管場所4950家，但僅稽核33家、覆蓋率0.7％為例，反問蔣說偷拍零容忍，但這樣的成績單你滿意嗎？請繼續往下閱讀...林亮君指出，從2024年開始持續要求市府修正「台北市公共場所防止針孔攝影暫行管理辦法」，也在議會提案並研議將法律位階提升至「自治條例」的可行性，訂定行政罰則，獲得跨黨派議員支持，市長也在總質詢允諾研議，「然後就沒有下文了」，雖然市府有修正並更名為「台北市公共場所防止針孔攝影管理辦法」，但是不僅稽核覆蓋率過低，稽核方式也過於鬆散，導致針孔防治仍存在巨大漏洞。她進一步說，依據台北市刑警大隊提供最新一季的反針孔偵測稽核情形，其中覆蓋率的部分，以衛生局為例，所有轄管場所數4950家，今年第一季僅稽核33家、覆蓋率0.7％。此外，目前分成書面、現地稽核兩種方式，衛生局稽核的33家，都是書面稽核，沒有任何一家是現地稽核。「市長你滿意嗎？這是台北市偷拍零容忍的成績，理應覺得羞愧與檢討。」蔣回，已要求包括各轄管機關，一定要提高稽查頻率。蔣萬安說，除了稽查，最有效的還是要從源頭管理，也看到行政院長卓榮泰說願意積極研議。去年六月就發函建請中央透過實名制有效控管，北市也率全國之先訂定反針孔偷拍管理辦法，從原本的暫行條例修訂管理辦法。面對林亮君質疑稽核率太差，市府應先檢討；他再次主張源頭管理更重要，民進黨議員與立委也認同林亮君聞言直呼，她問的是稽核部分而非源頭管理，蔣萬安對於「北市針孔攝影防偷拍零容忍的成績單，你滿意嗎，根本不及格！」對此，蔣萬安仍說，最有效的根本解決之道，就是從源頭管理，反問但是這一年來中央政府在做什麼？民進黨政府在做什麼？一年前就已發文要求修法，為何一年後中央才想亡羊補牢，趕快積極補救。    ,https://news.ltn.com.tw/news/politics/breakingnews/5437894
卓揆提3方向補遭藍白砍4700億軍購 陳清龍：現有預算已足夠,政治,2026/05/15 13:46,民眾黨團總召陳清龍表示，現有預算已足以涵蓋對美軍購，而委製、商購等項目應回歸一般公務編列，嚴禁「綠友友」牟利。（記者羅國嘉攝）在藍白主導下，立法院三讀通過國防特別條例，預算上限為7800億元，較行政院版本短少4700億元。行政院長卓榮泰昨於院會表示，針對未納入項目，國防部將評估以再提特別條例、追加預算或擴大年度預算規模等方式，在符合憲法與預算法前提下儘速因應。對此，民眾黨團總召陳清龍表示，現有預算已足以涵蓋對美軍購，而委製、商購等項目應回歸一般公務編列，嚴禁「綠友友」牟利；立委王安祥則說，支持提升戰力但將審慎監督。陳清龍指出，民眾黨向來支持國防，但預算必須嚴格監督，浮編、濫編的預算更會強力把關，不容綠友友藉此發大財牟利。在軍購條例審查過程充分顯示，7800億特別預算已經足夠，全面涵蓋所有國防部提出的對美軍購項目。而年度國防預算的規模龐大且逐年增加，委製、商購及台美技術合作等項目，應該回歸一般公務預算編列，而非透過特別條例把納稅人當提款機。請繼續往下閱讀...民眾黨立委王安祥表示，無論行政院未來是透過再一次提出特別條例、追加預算或擴大年度預算規模來因應，民眾黨將秉持本黨一貫的立場，支持有助於我國戰力提升的作為；然而，對於行政機關提出的預算也會審慎的進行監督。    ,https://news.ltn.com.tw/news/politics/breakingnews/5437931
雲林縣議員超級戰區 18人激戰搶10席,政治,2026/05/15 13:38,年僅26歲的政治素人廖昶淳，代表時代力量投入雲林縣第一選區議員選戰。（記者黃淑莉攝）2026九合一選舉，雲林縣議員6個選區有意參選者明朗化，其中第一選區目前已知18人有意參選，被視為超級戰區。政治素人廖昶淳今（15）日在父母及時代力量黨主席王婉諭陪同下宣布參選第一選區議員。26歲廖昶淳老家在二崙，今天在父母陪同下宣布代表時代力量參選第一選區（斗六市、林內鄉及莿桐鄉）議員，廖昶淳表示，他是政治素人，台灣師範大學地理系畢業後，曾當過高中地理老師、政府專案經理。13歲時，原本是國道收費員的父親，因裁撤後沒有工作衝擊家庭經濟，這也是他對一個政策對人民影響關注的轉折點。請繼續往下閱讀...廖昶淳指出，就讀斗六高中加入論壇社團，接觸更多公共議題探討，激盪他對公共議題思考及想法，到台師大讀書後，參加過更多社團活動，平日對政治現況有想法，在個人社群發表，但從未想過要從政，因地方長輩勸進鼓勵有理想、沒背景的年輕人出來改變雲林政壇，思考後期待透過自己參選開拓一條路，讓更多年輕人關心家鄉。廖的父母說，今年春節時聽到兒子想投入選戰，因家中沒有人從政，有被嚇到，但聽完他的想法後，全力支持兒子。王婉諭指出，廖昶淳來自平凡勞工家庭，選擇返鄉服務，最了解基層的生活，一定能把鄉親的聲音帶進議會，也相信他會用年輕人的思維，為雲林的政治環境帶來正向的改變。雲林第一選區應選10席，現任鍾明馨、陳永修、曾博鴻、黃勝志、江文登、林岳璋及陳芳盈等7人要角逐連任外，有意參選的人還有林靖冠、張光儀、許百芳、林群力、廖郁賢、王峻毅、黃釋瑩、林聖智、楊朝祈、邱世文及廖昶淳。年僅26歲的政治素人廖昶淳在家人及朋友的陪同下，宣布代表時代力量投入雲林縣第一選區議員選戰。（記者黃淑莉攝）    ,https://news.ltn.com.tw/news/politics/breakingnews/5437912
全國12縣市原民特搜隊成軍 劉世芳：展現在地防災力量,政治,2026/05/15 13:30,全台12個縣市、共216名成員的「原住民族地區特搜隊」正式成軍。（記者鄭景議翻攝）內政部長劉世芳今日上午出席消防署於台北車站大廳舉辦的今年度「防颱整備記者會」，現場除展示AI洪水預報、無人機救災等多項最新防救災科技外，更與原民會共同見證全台12個縣市、共216名成員的「原住民族地區特搜隊」正式成軍。劉世芳強調，台灣正邁向科技防救災大國，透過跨部會整合與在地力量，目標落實「自救、救人、救社區」的精神，原民特搜隊更體現了「在地的力量」。這場記者會邀請了泰國代表文那隆、原民會主委曾智勇及教育部長鄭英耀共同出席。劉世芳致詞時指出，今年的防颱準備已從單純提醒提高到風險管理意識，並全面納入AI輔助系統。她特別感謝曾智勇及鄭英耀在在地人力整合與社會教育上的努力，並透露文那隆對台灣全民防災意識的高度評價，未來政府甚至研議開設泰語防災士班，讓在台的外籍朋友也能融入防救災體系。請繼續往下閱讀...在科技整備方面，會場展示了包含淹水CBS細胞廣播、大雷雨即時訊息升級及堰塞湖監測等最新成果。劉世芳表示，現在的預警不再只靠看天象，而是仰賴國科會與氣象署的AI數據。此外，台灣防災士培訓成效顯著，目前取得資格者已超過13萬人，今年有望突破20萬大關；企業界也積極投入，目前已成立190多個台灣企業防災隊。劉世芳強調，防颱準備是365天的跨部會工作，需要農業部的水土保持、經濟部的河川管理與交通部的軌道維護共同守護。面對複合型災害，有準備才能更安全，政府將持續透過公私部門與民間力量的跨域合作，構築更強韌的社會安全網，確保台灣人民的生命財產安全。此次記者會更宣布原住民特搜隊正式成軍，據了解，原住民特搜隊計畫核心在於強化原鄉部落的自救能力，發揮隊員對在地地形熟悉的優勢。目前已完成12個縣市的編組，每隊至少10人，優先招募具備巡山員、國軍特戰或醫療背景的義消，並需通過專業醫師的高山救援能力體檢。消防署強調，這216位隊員將成為偏遠地區災害應變的第一線戰力，大幅提升搜救效率。劉世芳強調，台灣正邁向科技防救災大國，透過跨部會整合與在地力量，目標落實「自救、救人、救社區」的精神。（記者鄭景議翻攝）    ,https://news.ltn.com.tw/news/politics/breakingnews/5437903
