Title,News_Type,date,content,url
桃園市下屆議員人數增加 民進黨提名反趨保守 較本屆少4席,政治,2025/12/16 18:09,桃園市下屆議員人數增加，但民進黨提名反趨保守。圖為桃園市議會。（資料照，記者鄭淑婷攝）民進黨桃園市黨部今召開執委會討論2026年三合一選舉市議員提名人數，據悉，桃園市議會下屆議員人數比本屆63席多2席，但民進黨提名從30席（不含原住民）縮減為26席，還禮讓無黨籍于北辰、楊家俍，值得一提的是龜山區目前4席議員當中，民進黨占2席，由於人口增加，應選席次由4席增為5席，但民進黨仍然提名2席，等於拱手將多出來的席次讓給國民黨。桃園市議員選舉共有14個選區，除大溪復興1個選區外，其餘11個行政區都是獨立選區，另外還有平地、山地原住民選區，本屆（第3屆）議會14個選區共選出63位市議員，而隨著人口自然成長，龜山選區及山地原住民選區將各增加1席，桃園市應選席次從63席增至65席。請繼續往下閱讀...主委黃傅淑香表示，這份名單還是要報黨中央定奪，保守提名的主要原因是議員們都抱怨自己的選區是一級戰區，希望能保守提名爭取連任，雖然提名人數不及本屆人數，但當選人數一定會超過，另外桃園提5席、平鎮2席都較本屆少1席，主要是禮讓于北辰、楊家俍（下屆將以無黨籍參選）；另蘆竹提名2席、觀音1席都較本屆減少1席。但有資深黨員認為，龜山國、民兩黨議員人數各半，牛煦庭黨選立委後，國、民變成1比2，如今龜山由4席增至5席，若僅提名2席，等於拱手把多出來的席次讓給國民黨；此外，蘆竹應選4席（含1席婦女保障名額），蘆竹提名2席，卻沒有婦女保障名額，等同拱手讓給國民黨現任女性議員。此次12個選區，僅八德選區應選5席提名3席，維持本屆提名，也是唯一提名過半選區，但地方人士擔心提名3人會有風險，畢竟國民黨僅提名2席、另無黨籍議員段樹文由妻子代為出征選情穩定，屆時民眾黨在八德提名人選，若一個不小心，民進黨會由現有的2席減至1席。    ,https://news.ltn.com.tw/news/politics/breakingnews/5280230
高雄市長最新民調曝光 ！民進黨「這4位」都輾壓柯志恩,政治,2025/12/16 18:05,擬代表國民黨出線參選高雄市長的柯志恩。（資料照）2026地方大選腳步將近，民進黨的高雄市長初選將在下月12日至17日舉行電話民調，一份綠營內參民調今（16日）被曝光，顯示綠營4位初選候選人（邱議瑩、許智傑、賴瑞隆、林岱樺）的支持度，都狠甩將代表國民黨出線的柯志恩！根據《NOWNEWS今日新聞》取得的綠營內參民調，邱議瑩獲得高達51.4%的支持度，第2名則是許智傑（48.5%），再來是賴瑞隆（48.4%）和林岱樺（48.1%）。分析數據顯示，邱議瑩的支持度穩定上升，甚至有加速衝刺的趨勢；而民調呈下滑的賴瑞隆，疑受到最近兒子被爆出學校霸凌事件、PO陳菊黑白照喊［想念花媽」惹議等事情影響。請繼續往下閱讀...若是與藍營柯志恩做「對比式民調」，邱議瑩領先柯志恩29.1%，未表態19.5%；賴瑞隆領先柯志恩29.5%，未表態22.0%；許智傑領先柯志恩30%，未表態21.5%；林岱樺領先柯志恩25.4%，未表態26.5%。粉專「Mr.柯學先生」下午轉發這份民調數字，網友紛紛表示，「別說爭議法案，光是財政預算不極力幫高雄爭取，只輕描淡寫推說誰能去講傅崐萁，那還有什麼好說的，高雄市民的福祉跟傅崐萁她都分不清楚該支持誰了，支持她幹嘛？」、「我高雄人，我可不想再來一個韓國瑜」、「經過韓國瑜事件，大部分的人都會分辨好壞」、「柯志恩從來沒有為高雄人打算過？就想著空降到高雄坐享其成？她以為高雄人是傻了嗎？」。    ,https://news.ltn.com.tw/news/politics/breakingnews/5280073
挺基層運動！蘇巧慧爭取近6千萬經費 為樹林區增蓋3座風雨球場,政治,2025/12/16 17:57,立委蘇巧慧、新北市議員廖宜琨為樹林區武林國小爭取經費蓋風雨操場，今進行開工動土。（立委蘇巧慧提供）新北市樹林區武林國小因腹地不足，籃球校隊一直缺少合適的練球場地，在立委蘇巧慧、新北市議員廖宜琨等人多次奔走會勘、爭取經費下，成功爭取教育部核定1870萬元，先替學校蓋風雨球場，今天進行開工動土典禮，蘇巧慧說，感謝中央、地方齊心協力，她會持續緊盯工程進度，盼明年暑假前讓師生有全新的運動環境，樹林還有三多國中、三龍公園的風雨球場陸續動工，盼為基層打造更完善的運動環境。武林國小校長莊見智說，只要遇到下雨，籃球校隊就須要移動到教師停車場練球，場地狹隘、空氣不流通，實在有點克難，感謝蘇巧慧、廖宜琨的共同爭取，幫助提升學校運動環境。請繼續往下閱讀...蘇巧慧表示，新北有許多優秀的國小球員，但在校內卻缺乏完善的訓練場地，例如武林國小曾在全國小學籃球錦標賽6年級甲組拿下亞軍，但校園缺少合適的練球場地，她從2016年擔任立委後，多次與教育部協調，盼為學校爭取新建體育館，但經工程評估，新建體育館恐大幅影響整體校園使用環境，且耗時較久，她和前新北市議員陳世榮、廖宜琨多次會勘，今年6月更邀集教育部體育署、國教署等部會會勘，最後達成共識先建風雨球場。廖宜琨表示，他和蘇巧慧一起找資源、找方法，也持續向市府爭取經費，希望為武林國小打造更好的練球空間，他也感謝蘇巧慧在地方長期重視基層運動選手的訓練環境，爭取中央資源，幫助地方培育優秀運動人才，也為社區打造更好的運動環境。蘇巧慧表示，她從擔任立委以來便積極為新北師生爭取更好的校園空間，也支持基層運動選手，打造更完善的運動環境，樹林區除了武林國小風雨球場動工，還有三多國中、三龍公園的風雨球場也陸續動工，爭取總經費共5701萬元。立委蘇巧慧、新北市議員廖宜琨為樹林區武林國小爭取經費蓋風雨操場，今開工動土，2人與學生擊掌。（立委蘇巧慧提供）立委蘇巧慧（左）說，她會持續緊盯武林國小風雨操場工程進度，盼明年暑假前讓師生有全新的運動環境。（立委蘇巧慧提供）立委蘇巧慧、新北市議員廖宜琨與樹林區武林國小師生合影。（立委蘇巧慧提供）    ,https://news.ltn.com.tw/news/politics/breakingnews/5280213
曾遭薛球綁架勒贖3億  前中市議長張宏年人生落幕,政治,2025/12/16 17:25,前台中市議長張宏年。（資料照）前台中市議長張宏年今天離世，張宏年曾是「張派」少主，叱吒台中政壇，不過2001年被薛球與陳益華犯罪集團綁架，付出3千萬贖金才獲釋，隔年又被林明樺犯罪集團電話恐嚇，2020年爆發盛唐中醫鉛中毒案，張宏年鉛中毒腦部受損約4成後，身體一直未好轉，今天離世享壽73歲，讓親友不捨。張宏年出身政治世家，1990年在父親張光儀與叔公的栽培下，當選台中市議員，從基層議員做起，因交友廣闊，一路登上議長大位，台中縣市合併升格前，可說是府會中呼風喚雨的關鍵人物。請繼續往下閱讀...不過一生也充滿驚險，2001年遭薛球與陳益華犯罪集團於服務處綁架，並要求新台幣3億元贖款，被綁3天後獲釋平安歸來，並付出新台幣3千萬元贖款。2002年連任第15屆台中市議員，並擔任台中市議會議長，不料又遭自稱耕讀園槍擊命案的林明樺犯罪集團電話恐嚇，隨後警方加強保護。2018年由兒子張彥彤接棒參選台中市中區、西區議員，並高票當選，不料卻在2020年7月爆發盛唐中醫鉛中毒案，造成數十人鉛中毒，張宏年與兒子張彥彤等家人吃了含有鉛的中藥，張宏年鉛中毒腦部受損約4成後，身體一直未好轉，並在今天過世。檢警調查，盛唐中醫診所負責人中醫師呂志霖（原名呂世明）、北區九褔中醫診所負責人中醫師洪彰宏，2016年將禁止入藥的硃砂加入中藥內，欣隆藥業公司負責人歐國樑又誤把鉛丹當硃砂賣給兩人，導致張宏年與兒子張彥彤等38人鉛中毒，一審依供應、調劑禁藥等罪名，判處呂7年6月、洪7年2月、歐6年徒刑，二審今年3月改判呂5年與2年徒刑（可聲請易服勞役）、洪6年、歐4年2月，全案上訴中。    ,https://news.ltn.com.tw/news/politics/breakingnews/5280156
卓榮泰喊不副署財劃法 藍白今三度封殺1.25兆國防特別預算,政治,2025/12/16 17:18,藍白兩黨立委今天在立法院程序委員會再度封殺行政院版財劃法，以及1.25兆元國防特別預算條例排入院會報告事項。（記者田裕華攝）行政院長卓榮泰昨天宣布不副署再修版的「財政收支劃分法」，引發在野黨不滿。藍白兩黨立委今天在立法院程序委員會，再度封殺行政院版財劃法以及1.25兆元國防特別預算條例排入院會報告事項。民進黨立委在表決報告事項前呼口號，「強化民主防禦能力 充足實力爭取和平」，呼籲藍白別再擋國防特別預算，但表決仍以8票對10票再度遭到封殺，這也是該預算三度遭到藍白阻擋。請繼續往下閱讀...民進黨立委羅美玲發言表示，1.25兆的國防特別預算條例已經在程序委員會被藍白惡意阻擋了兩次，民進黨團呼籲藍白兩黨不要再擋了，藍白兩黨如果對8年1.25兆的強化防衛韌性及不對稱戰力計劃採購特別條例有任何疑問就直接付委審查，而不是要用這種惡意阻擋不付委的方式來杯葛，「付委才能夠討論啊！你們所謂的這個疑慮才會有答案啊」。羅美玲強調，國家要安全，必須要加強我們的自我防衛能力，全世界竟然只有台灣的在野黨在扯自己國家後腿，試圖弱化台灣的國防防衛能力，真的是非常糟糕，也讓全世界看笑話。民進黨團再次呼籲，這次不要再擋這個特別預算了。    ,https://news.ltn.com.tw/news/politics/breakingnews/5280145
獨家專訪》「不副署」反年改？ 卓揆：上街也改變不了違憲事實,政治,2025/12/16 17:00,對於不副署反年改法案，退休公教人員恐上街頭？行政院長卓榮泰今日接受專訪表示，希望他們能夠冷卻下來，上街也改變不了違憲的事實。（記者陳鈺馥攝）藍白聯手反年改，立法院三讀通過「公務人員退休資遣撫卹法」、「公立學校教職員退撫條例」部分條文修正案，確定停砍公教人員年金，並停止退休所得替代率調降回溯至2024年。對於政院若「不副署」，退休公教人員可能上街抗議？行政院長卓榮泰今日接受本報專訪表示，不會考慮到支持者很多就去做，或支持者少就不做，而是會考量國家財政基礎及憲政秩序。他們應該要冷卻下來，上街也改變不了違憲事實。卓榮泰指出，年金改革重要的是，有無合乎財政紀律及憲政秩序，有無合乎世代正義，社會還有農民、勞工、漁民等，他們所拿到的社會保險相對比較低，現在你把公教人員所得替代率調降停止，將嚴重排擠年輕一輩的公教人員，也會影響其他類別的保險對象。請繼續往下閱讀...卓榮泰談及，這些被影響的人現在沒有站出來反對，倒是有一位「李先生」先站出來了。自己最近看了一部預告片，文案提到「人們總是在事後後悔悲劇的發生」，雖然這些人還沒站出來反對（指反對藍白通過的反年改法案），但反對的聲音漸漸出來了，要讓大家知道世代分配的不公平，會造成財政的影響。卓榮泰說，修法後要撥補、多支出7000億元，等於全民要負擔3萬元，這不只是錢多寡的問題。舉例來說，現在我們已在討論農保的問題，老農每個月只有8100多元。「你說公務員偉大，難道農民不值得偉大嗎，但農民只有8千多元，農民如果多一點，社會公平可以建立起來，我們正在討論這些！」卓榮泰直指，釋憲已對年改宣告合憲，合憲就是繼續往前走，不應該破壞憲法、破壞現狀，更何況已經執行那麼多年，「天下本來無事、何處惹塵埃」，不能為了滿足這些族群，而忽略其他族群的提升，我們注重的是這個，不然花錢買聲量誰都會做。卓榮泰認為，國家經濟發展很快，今年GDP規模已經來到28兆，明年編列歲出預算可以大幅增加，國家是有能力做更多的建設。對於人民的福祉、國家整體建設、AI新十大建設，都應該大刀闊斧，把錢用到這上面。希望他們能夠冷卻下來，上街也改變不了違憲的事實。    ,https://news.ltn.com.tw/news/politics/breakingnews/5280112
獨家專訪》從「不執行」到「不副署」 卓榮泰透露心路歷程,政治,2025/12/16 16:51,行政院長卓榮泰昨宣布不副署「財政收支劃分法」，以此捍衛民主憲政，卓榮泰今（16日）接受本報專訪時透露，去年上任沒多久後，面對藍白惡法時，他其實早已做好「不副署」的打算，只是考量上任不滿一年，不希望升高朝野對立。（記者鍾麗華攝）行政院長卓榮泰昨宣布不副署「財政收支劃分法」，卓榮泰今（16日）接受本報專訪時透露，去年上任後，面對藍白強修惡法時，他其實早已做好「不副署」的打算，只是考量當時上任不滿一年，不希望升高朝野對立。他也說，憲法法庭被藍白癱瘓已久，人民已失去耐心、也沒有信心，此刻他不得不捍衛民主憲政。卓榮泰指出，行政院提出覆議後遭立法院否決，有三個處理方式，一是副署並釋憲、一是副署但不執行，另外還有不副署；其實「副署不執行」，已有提高警消退休金的「警察人員人事條例」、志願役加薪的「軍人待遇條例」的例子，行政院也多次表示，會等待釋憲結果，如果釋憲結果合憲，就會編列預算追溯補發。請繼續往下閱讀...卓榮泰坦言，財劃法本想循前面不執行的方式，覆議否決後就釋憲，但憲法法庭被藍白癱瘓後，不知道何時能夠運作，況且這段被癱瘓期間，又有4、500件釋憲案，即便憲法法庭能重新運作，也應先處理超過9成的人民釋憲案。卓榮泰強調，如果此次覆議否決後不執行，如同前兩例一樣，人民會問，「案子要放到什麼時候」？在野黨提出這麼多的爭議法案，包括中配國籍的問題、救國團、還有反年改怎麼辦？「難道都要這麼做」？國人對釋憲已經沒有耐心了、也沒有信心，對於藍白惡法層不出窮，外界會質疑，政府無法阻擋、無法對國會生態做出改變。卓榮泰說，其實財劃法他本來是決定不覆議，但後來又決定再給立法院一次機會，但立法院過程依然非常粗糙，也不讓他到立法院說明報告，他無法接受。立法院是怕他去把事實講清楚，也怕人民清楚知道問題所在。卓榮泰也透露，去年520他上任沒多久後，面對藍白惡法時，其實早已做好不副署的打算，只是考量上任不滿一年，不希望升高朝野對立。他也說，在財劃法遭否決後，他第一時間面對媒體受訪時強調，「沒有必須執行的壓力」，其實幕僚擬的建議稿相對溫和，但他決定加重語氣，向國人說明政府的決心。    ,https://news.ltn.com.tw/news/politics/breakingnews/5280088
翁曉玲變更議程追究不副署法律責任 林月琴：憲政爭議一次說清也好,政治,2025/12/16 16:36,立法院司法及法制委員會國民黨籍召委翁曉玲增列本週四議程，針對「行政院長不副署、總統不依法公布施行（財劃法），追究法律責任」進行專題報告，並備質詢。（記者謝君臨翻攝）總統賴清德挺行政院長卓榮泰不副署「財政收支劃分法修正案」，引發在野黨批評。立法院司法及法制委員會國民黨籍召委翁曉玲更增列本週四議程，針對「行政院長不副署、總統不依法公布施行（財劃法），追究法律責任」進行專題報告，並備質詢。對此，民進黨團副書記長林月琴表示，「也好，讓大家對於憲政爭議一次說清楚。」卓榮泰昨宣布不副署「財劃法修正案」，以此捍衛民主憲政。賴總統昨晚也發布錄影談話，表態支持卓揆的決定，並誠摯、嚴正呼籲立法院，即刻撤回這些傷害國家、違背憲法精神的爭議法案。請繼續往下閱讀...對此，翁曉玲原排定立院司法委員會本週四議程為邀請法務部等單位，針對「綠能弊案肅貪成效、綠能發展之法制策進與防弊」進行專案報告。而今再增列議程「邀請總統府秘書長、行政院秘書長、司法院、法務部就立法院三讀通過之法律經行政院依『中華民國憲法增修條文』第3條第2項移請立法院覆議，經全體立委1/2以上決議維持原案，行政院長不依法副署、總統不依法公布施行，對我國憲政民主及法制之戕害及相關法律責任之追究進行專題報告，並備質詢。」對此，林月琴直言，「我覺得也好，讓大家對於憲政爭議一次說清楚。大家可以猜猜看，禮拜四的新聞版面會是（民眾黨立委）黃國昌的咆哮、還是翁大上人的金句、還是（民眾黨立委）張啓楷亂問被打臉，精彩可期，我們週四見！」    ,https://news.ltn.com.tw/news/politics/breakingnews/5280080
政院不副署藍白財劃法 牛煦庭：不用幫解套、法案會照推,政治,2025/12/16 16:36,國民黨立委牛煦庭（左）接受「千秋萬事」廣播主持人王淺秋（右）專訪。（圖由「千秋萬事」提供）藍白惡修「財劃法」掏空中央財源，政院所提覆議案又遭立法院否決，行政院長卓榮泰15日正式宣布「不副署」，成為憲政首例。身兼國民黨發言人的立委牛煦庭今日接受「千秋萬事」廣播專訪表示，民進黨已經沒招、沒步了，現在就是在賴皮。牛更重砲批評賴清德總統「就是個無賴、賴皮仔」，「我們以前受訪、上節目都還有所克制，因為都希望國家好、大家團結，但你今天糟蹋憲法、糟蹋在野、糟蹋國會及民意的時候，那跟你客氣什麼？」牛煦庭表示，民進黨政府「賴皮一時爽，一直賴皮一直爽」，又一直說在野不敢倒閣，但明眼人都知道，倒閣的背後就是免洗的行政院長換真刀真槍的國會，對民進黨是無本生意，賴總統換人沒有成本，也不需要經過國會同意，只要他不滿意，就再來一次。請繼續往下閱讀...牛煦庭指出，去年民進黨政府不講道理發動大罷免，不像倒閣全面重選，只有在野黨倒楣，不過他們最後全員存活，這就是民意再次給予社會明顯的信號，就是請你賴皮清德總統接受朝小野大的現實，再固執、再有想法也要尊重現實、順應民意；一年之後又來了，又再說倒閣，不服輸就翻桌、賴皮，很沒水準。牛煦庭說，民進黨已經沒招、沒步了，現在就是在賴皮，不用擔心他們接下來要幹嘛，照自己的節奏走就對了，連卓榮泰都跳出來說他要當憲法的守護者，到底憑什麼？憲法規定，行政院提出的覆議案，如經出席立委三分之二維持原案，行政院長應即接受該決議或辭職。現在卓揆說不副署、不接受、不執行，就是違憲。牛煦庭表示，這不需要大法官解釋，有眼睛、有基本法律素養的人就知道這是違憲，這世界上不是臉皮厚，所有事情就你說了算，社會正在見證這一齣荒唐的戲碼，法律白紙黑字、過去的憲政慣例都不遵守，就是賴皮、巨嬰。牛煦庭表示，很多人問國民黨該做些什麼，我們幹嘛急著做什麼，照妖鏡這麼大一面，民進黨巨嬰坐在地板上哇哇大哭，大家笑他不懂事、不講理、賴皮，我們幹嘛急著幫他解套，不用，幹嘛急著幫他換尿布呢？小朋友在地上哇哇大哭，你就一定要買糖給他吃、滿足他的要求嗎？牛煦庭說，謀定而後動，現在有個照妖鏡放在那邊，大家都說他們很糟糕，先讓大家看一下，讓社會大眾看一下這群巨嬰有多麼荒唐，我們再來決定因應措施，內部盤整溝通、集合藍白的力量再一起發動。對於賴總統表示，願意依據憲法增修條文第4條第3項之規定及憲法法庭所揭示的合憲方式，赴立法院進行國情報告，牛煦庭表示，在你聲稱要依憲法赴立院國情報告之前，要不要請你的行政院長先依照憲法接受立法院的覆議結果？憲法自助餐不是這樣吃的，吃相也不要太難看。牛煦庭強調，在野不是沒有動作，是挑最有利的時間、準備好才出手，打擊精準打到痛點。外界有很多不同建議，例如提彈劾案、開國際記者會、上街頭等，都是很好的建議，由於戰場在立法院，任何策略除了要先跟黨團商量，也要與民眾黨有默契、有節奏的進行。牛煦庭批評，沒有辦法得到多數民意的認同，就想要越過民意，這就是賴清德的風格，以前台南市長任內就不進議會，「他就是個無賴、賴皮仔」。我們以前受訪、上節目都還有所克制，因為都希望國家好、大家團結，但你今天糟蹋憲法、糟蹋在野、糟蹋國會及民意的時候，那跟你客氣什麼？當然要升溫，不會就這樣算了，方法有很多種。牛煦庭指出，昨天黨團也有在討論，法案會照推，副不副署是你家的事，我們代表民意行使職權，這是我們的工作，照常工作就越顯得你們荒唐，這也是方法。另一軸線是學術界怎麼看、社會大眾在想什麼，但凡有唸過書的人都知道這是很荒唐的事，該說點什麼吧？    ,https://news.ltn.com.tw/news/politics/breakingnews/5280070
表揚公務人員傑出貢獻 賴清德：年金改革非否定貢獻、不能走回頭路,政治,2025/12/16 16:33,總統賴清德16日出席考試院114年公務人員傑出貢獻頒獎表揚大會，並在會中致詞。（記者廖振輝攝）考試院今表揚具傑出貢獻的公務人員及團體，並由總統賴清德親自頒獎，賴總統致詞時表示，政府過去4年3度調升公務員薪資，而從2016年起推動的年金改革，並非否定任何人的貢獻，而是要確保財政永續，也不應該因倉促修法走回頭路。賴清德今受邀出席「114年公務人員傑出貢獻獎表揚大會」，他對每位獲獎個人及團體均一一唱名並隆重介紹，並代表政府與國人表達讚賞與感謝。他提到，公務人員是國家運作的基石，而政府職責是要讓承擔重任者能安心投入、長久服務，因此過去4年政府已3度調升軍公教薪資，包括今年加薪3%。請繼續往下閱讀...立法院近日才三讀通過反年改相關修法，導致年金破產時限將提前。賴清德在致詞時也指出，政府2016年起推動年金改革，從來不是否定任何人貢獻，是出於制度永續、世代都領得到之核心目標，而確保財政永續是政府對所有世代、對全民、對國家未來的共同承諾，公教年金制度不應該因倉促修法而走回頭路，更不應把年金破產風險推給下一代去承擔。相信人民都期待年金制度能在合法、合理、負責情況下，再次被審慎檢視，而政府也會持續努力，確保年金制度財務永續，並符合世代公平正義。此外，賴清德也期許，所有公務員面對快速變動的國際局勢與科技浪潮，都能與時俱進、善用數位與AI工具，讓國家治理、對人民服務都能一步步升級，如今年行政院人事總處與工研院攜手推動的「AI政府領航人才發展計畫」，就結合產官學界資源，培養更多具數位思維、善用科技並且堅守公共價值的公務人才，不僅讓公務體系更有效率，也讓服務更及時更貼近民眾需要。賴清德最後強調，除了恭喜所有得獎者，也要向在背後默默支持的家人致上最高敬意。讓大家一起繼續努力，用專業守護國家、用制度照顧人民，只要公共體系繼續勇敢創新，將能為台灣的未來發展打下更穩固基礎。    ,https://news.ltn.com.tw/news/politics/breakingnews/5280071
