Title,News_Type,date,content,url
黃國昌稱沈發惠禮讓遭打臉 詹凌瑀：那一席根本靠民進黨撐起來,政治,2026/06/16 09:02,民眾黨主席黃國昌（資料照）民眾黨主席黃國昌日前出版新書，書中宣稱2015年一群汐止民進黨支持者「對當地的（區域立委）選情感到絕望」找他出來「打敗國民黨的人選（李慶華）」。後續被導演陳文彬還原現場真相打臉。對此媒體人詹凌瑀表示，說謊不打草稿的髒東西，事實上，當年趁著大好時機，耕耘19年的沈發惠就是會贏，因為選民已經受不了馬英九8年爛帳了。詹凌瑀在臉書PO文表示，別再說沈發惠沒有禮讓你，事實就是沈發惠很大器的把經營19年的選區禮讓給黃國昌，還流露不捨與擔憂，但是黃國昌根本沒有要「鳥」沈發惠的意思，只說了一句「這跟我有什麼關係」。請繼續往下閱讀...詹凌瑀指出，關係可大了！老兄，這些選民未來就要交託給你了，你認為不重要嗎？看來黃國昌打從一開始就是棄選民如敝屣，沒有打算照顧選民，更以不跑紅白帖先作為自己的護身符，從此而後，黃國昌消失在汐金萬活動，就有一致對外的說辭了，黃國昌一定覺得自己聰明的不得了，寫出這樣的絕頂妙計，一句「老師還有更重要的事情要做，沒時間去跑紅白帖」，再趁機把紅白帖貶低為地方政治的陋習，從一開始就在為不跑選區鋪陳。詹凌與續指，有這種腦力，為何不多花心思放在地方建設及選民需求上，只會天天在立法院大小聲咆哮博版面，吵都吵死了，不如去跑選區，累的時候就對著天空又喊又叫，豈不是更快活更解氣，再說一句，2015年沈發惠如果沒有禮讓給黃國昌，黃能不能選上還是個問號，那場選舉全是靠民進黨幫忙才撐得起來，黃國昌是自以為有多厲害。詹凌瑀直言，這麼厲害怎麼接連操盤，你負責的小雞都死光光，不就證實了時代力量最大的冗員就是黃國昌啊！    ,https://news.ltn.com.tw/news/politics/breakingnews/5473364
返台即與日本八王子老友相聚  康裕成：撐起眼皮也要來,政治,2026/06/16 08:54,日北八王子市前市長、NPO八王子台灣友好交流協會理事長黑須隆一應邀來訪高雄，他分享八王子與高雄20年情誼的講座人氣超高。（康裕成提供）高雄市與日本八王子市締結姊妹市邁入20周年，八王子市前市長、NPO八王子台灣友好交流協會理事長黑須隆一應邀來訪高雄，剛從美國波特蘭返國的議長康裕成特別現身力挺好友，笑說「撐起眼皮也一定要到場支持」，見證兩城20年深厚情誼。黑須隆一這回是應高雄市立圖書館講座邀請，分享高雄與八王子20年來交流歷程與珍貴故事，吸引近百位市民到場聆聽；議長康裕成、日台交流協會高雄事務所所長奧正史、高雄市立圖書館館長李金鴦，蔡金晏、湯詠瑜、鄭孟洳、黃飛鳳等多位議員及張博洋議員助理出席。請繼續往下閱讀...康裕成才剛率團完成美國城市外交訪問返抵國門，隔日隨即出席活動力挺好友，笑稱自己還在調整時差，但聽說黑須理事長來到高雄，「撐起眼皮也一定要到場支持」，展現兩人深厚友誼。康裕成也提到高雄和八王子能緊密交流合作長達20年不間斷，互動過程中就像「熱烈愛慕對方的情侶」，彼此展現熱情與最好一面，相互學習、進步；她特別感謝黑須卸任市長後，仍以促進台日交流為終身志業，是推動高雄與八王子交流「Key Man」。黑須理事長表示，20年來無論八王子或高雄皆歷經市長輪替，在各界支持下，雙方交流未曾中斷：他表示，高雄早已成為他的第二故鄉，能促成兩市締盟是他的驕傲。近年來，高雄與八王子交流成果豐碩。黑須理事長積極促成高雄金鑽鳳梨進入八王子市學校營養午餐，讓當地學生透過味蕾認識高雄；高雄市議會也參與八王子市年度盛事「八王子祭」，深化文化與民間交流，讓兩市情誼更加緊密。康裕成剛從美國波特蘭回到高雄，隔天立刻出席好友黑須隆一的講座。（康裕成提供）    ,https://news.ltn.com.tw/news/politics/breakingnews/5473399
獨家》「半導體女王」之父入列！賴總統新聘蘇春槐等6資政,政治,2026/06/16 08:53,「半導體女王」蘇姿丰的父親、紐約台灣會館理事長蘇春槐2023年曾在美國出席僑宴支持賴清德。（資料照）總統府最新資政與國策顧問名單出爐！超微（AMD）執行長蘇姿丰之父、紐約台灣會館理事長蘇春槐獲聘為新任總統府資政，另有國家訓練中心董事長林鴻道、無任所大使吳運東等6位新聘資政；法醫高大成、麗寶集團董事長吳寶田、中華民國體育運動總會會長葉政彥、世界台灣商會聯合總會總會長吳光宜等12人則為新聘國策顧問。蘇春槐出身台南，台師大數學系畢業、取得清大數學所碩士後，赴美攻讀哥倫比亞大學數理統計所博士，並長年旅居紐約，活躍於本土派社團與海外僑界，曾任大紐約區臺灣大專院校校友聯合會董事長，現為紐約台灣會館理事長。最廣為人知的身分，則是養育出帶領AMD翻轉科技業的「半導體女王」蘇姿丰。請繼續往下閱讀...依「中華民國總統府組織法」，總統府資政不得逾30人、國策顧問不得逾90人，均為無給職，聘期不得逾越總統任期；上屆資政、國策顧問任期已於今年5月19日屆滿，最新名單近日陸續在總統府網站公告。新聘資政6人，除了蘇春槐之外，包含國家訓練中心董事長林鴻道、無任所大使吳運東、財團法人台灣醫界聯盟基金會董事長吳樹民；原任國策顧問的黃越綏、范振修則轉任資政。總統府最新公告之資政共29人，國策顧問共71人，完整名單如下：總統府資政： 田弘茂、吳運東、吳勝雄（吳晟）、吳樹民、李明亮、李茂盛、沈國榮、沈榮津、林全、林信義、林鴻道、邱義仁、范振修、姚嘉文、夏本‧嘎那恩、高英茂、張博雅、陳忠源、陳博志、陳繼盛、湯文萬、童永、黃崑虎、黃越綏、蕭新煌、韓良誠、顏志發、蘇貞昌、蘇春槐。國策顧問： 王永順、王政松、王康秀絹、王欽鈴、田詒鴻、江錫仁、余天、余文儀、何美玥、何黎星、吳光宜、吳靜吉、吳寶田、呂子昌、李伸一、李沛霖、李金龍、李輝煌、林光義、林見松、林金超、林建滄、林凱民、林逸民、林榮松、邱進福、施信民、柯孫達、柯富揚、紀政、高大成、康義勝、康銀壽、張田黨、張金華、張旻斌、張秋海、張貴木、張輝雄、莊和子、莊振輝、莊維周、許肇祥、陳天隆、陳永昌、陳志鴻、陳旺來、陳振文、陳朝龍、程文俊、黃行德、黃俊森、黃奕睿、黃員教、黃銘得、曾秋聯、葉政彥、趙中正、廖全平、廖美南、樊豐忠、鄭智仁、鄭慶祥、盧博基、賴倍元、賴博司、賴維信、謝美香、簡文仁、嚴雋泰、顧忠華。    ,https://news.ltn.com.tw/news/politics/breakingnews/5473371
批高金不只收錢還交報告給國台辦 張育萌：藍委也質疑發錢是選舉綁樁,政治,2026/06/16 08:38,無黨籍立委高金素梅因涉詐領補助款，另涉利用人頭輸入中國製快篩及以原住民多族群文化交流協會詐領補助，遭到檢調搜索及約談。（資料照）檢調偵辦無黨籍立委高金素梅涉詐領補助款，以及原住民多族群文化交流協會詐領補助等案，台灣青年民主協會理事張育萌發文質疑，「台灣哪個協會，會收從國台辦來的近億台幣，發完再交報告給北京？」過去連國民黨立委孔文吉，都質疑高金發錢是「選舉綁樁」。張育萌也批評高金，「台灣的選舉、台灣的民主，憑什麼用北京的錢來玩？」張育萌在臉書發文指出，在莫拉克的受災家庭，每戶發3萬台幣，總共發了2153戶（這部分總計約6500萬）。當年重災區的國中小學生，每人發5000元，發給3375人（這部分約1600萬）。高中以上學生也可以申請，每人拿1萬。請繼續往下閱讀...張育萌表示，全台灣2153個家庭，另外還有4769位學生拿到錢，這些錢通通來自北京，高金素梅見完胡錦濤後，國台辦「募集」再匯給高金成立的「多族群協會」。張育萌直言，「我怎麼知道發給多少人？因為國台辦當時告訴東南衛視的記者。那為什麼國台辦會知道這麼細節？因為這個『多族群協會』發完錢後，竟然還交報告給國台辦」。張育萌提到，連國民黨立委孔文吉，都質疑高金發錢是「選舉綁樁」，這是17年前，馬政府時期、國民黨在立法院還過半的時候。當時的內政部長叫江宜樺，還承諾會請協會一個月內上網公布收支情況。高金也理直氣壯地說，會在網路上公布領款名單。但至今，網站上只有公布發錢的時間、地點、村莊等等，沒有領款名單。張育萌質疑，台灣哪個協會，會收從國台辦來的近億台幣，發完再交報告給北京？張育萌提到，高金素梅用「無黨團結聯盟」總共參選4次，發完錢後那次選舉，「剛好」是得票率最高的一次，拿了2萬9520張選票，得票率超過 25%。張育萌強調，這真的無關意識形態。妳心向祖國，妳要見胡錦濤還是習近平，那是妳的自由。但妳以國會議員的身分，讓國台辦募集近億元的紅色資金流進台灣，發完還向北京報告。張育萌批評高金，「台灣的選舉、台灣的民主，憑什麼用北京的錢來玩？」    ,https://news.ltn.com.tw/news/politics/breakingnews/5473338
蔣萬安喊廢監院 黃暐瀚：跨過市政直挑國政 表態將選總統？,政治,2026/06/16 08:01,台北市長蔣萬安近期公開主張廢除監察院，引發各界討論。（資料照）台北市長蔣萬安近期公開主張廢除監察院，引發各界討論。資深媒體人黃暐瀚質疑，蔣萬安跨過市政直挑國政，突然丟出憲政話題，不免讓人聯想是在釋出將要「參選總統」的表態。此舉不僅與其他國民黨「有志者」出現微妙變化，若2032年成為總統，「一旦修憲未成，提不提名，將是兩難」。黃暐瀚在臉書以「萬安廢監院」為題發文指出，選戰酣熱之際，台北市長蔣萬安突然丟出「廢除監察院」的憲政話題。跨過市政（殷瑋代戰）直挑國政，蔣萬安強調「以後執政我也不改想法」的豪情壯志，不免讓人聯想，是在對社會釋出將要「參選總統」的表態。請繼續往下閱讀...黃暐瀚對此提出「與黨內有志者們（盧秀燕、韓國瑜、鄭麗文），將開始出現『微妙變化』」、「2032年若為總統，一旦修憲未成，提不提名，將是兩難」。黃暐瀚說明，因為修憲有「雙四三」門檻（立委85席出席會議、64席表決通過），之後還得冷靜半年，交由全體公民複決（980萬票），並不容易。到了2032年（下次監委提名）若修憲未過，可能已經擔任總統的蔣萬安，是要提？還是不提？黃暐瀚直言，不提，會被說是「違憲總統」；提了，又會與6年前承諾抵觸。屆時提與不提，都將兩難。    ,https://news.ltn.com.tw/news/politics/breakingnews/5473353
竹北藍白怎麼合？民眾黨縣議員林碩彥喊話「全民調政黨互比」,政治,2026/06/16 07:50,國民黨新竹縣黨部主委楊文科（右）昨晚宣布藍營代表參選的縣議員吳旭智（左）後，同時也說將建議黨中央，後續藍白合作用民調來決定。（記者黃美珠攝）國民黨竹北市長黨內內參民調，昨晚確定由縣議員吳旭智勝出，但後續藍、白該怎麼合？國民黨新竹縣黨部主委楊文科率先拋出，用2黨民調來互比做定奪。對此，台灣民眾黨竹北市長參選人邱臣遠說「尊重兩黨協調機制」，但縣議員林碩彥卻公開附和，認為後續藍白要合作、互動，就該用最公平、客觀且具社會公信力的科學機制：全民調來讓人信服。林碩彥是民眾黨攻克新竹縣議會的第1人，他起自竹北市代，轉戰成功進議會後，目標始終放在年底要選竹北市長，後因該黨徵召前新竹市副市長邱臣遠來選，他只好接受黨中央安排，留在議會領軍以擴大白營席次。請繼續往下閱讀...對於竹北市長選舉，獲悉由吳旭智勝出，林碩彥第一時間給予祝賀，肯定吳旭智在科技、教育、基層服務上的努力，但林碩彥也提醒：竹北市民對城市新局與政黨輪替有強烈渴望，藍白須用「公平、科學、客觀」的方式整合，才能成功共推出最強候選人。特別是竹北近年飽受交通壅塞、教育資源調配失衡以及公共工程品質有待提升等諸多考驗，市民期待的，是一個兼具前瞻思維、科技治理能力，且能超越政黨私利、真正為基層發聲的市長。如何回應民意以符合期待，並集結出最大的在野力量，將是後續藍白合的重要課題。他建議雙方秉持開放與良性對話的態度溝通，並支持雙方透過公平、客觀且具備社會公信力的科學機制，像是全民調來做整合和互動，這樣才能真正彰顯「民意的依歸在哪裡，最強的戰將就在哪裡！」的道理。竹北藍白後續怎麼合作？民眾黨新竹縣議員林碩彥（左1）支持全民調進行政黨互比。（記者黃美珠攝）    ,https://news.ltn.com.tw/news/politics/breakingnews/5473355
鄭麗文訪美踢鐵板 汪浩：紅色傳聲筒被華府國安圈看破手腳,政治,2026/06/16 07:36,國民黨主席鄭麗文不僅原訂會見白宮國安會官員臨時被取消，還傳出美國務院安排與鄭麗文會晤的人層級非常低，與過往台灣主要政治人物訪美規格相比明顯下降許多，引發輿論熱議。。（資料照）國民黨主席鄭麗文近日進行訪美行程，並於今晨搭機返台，她在訪美期間引發諸多爭議，作家汪浩更發文直言，鄭麗文事前放話要見川普、踏入白宮會晤國安高層，結果卻被美方國安會放鴿子，並遭美方無情降格至AIT華府總部，他諷刺鄭麗文是高度仰賴「習近平加持」的紅色傳聲筒，早已被華府國安圈看破手腳，美國官方的態度也釋放出清晰的訊號，顯示「美國認定鄭麗文無足輕重」。鄭麗文日前高調訪美，不僅原訂會見白宮國安會官員臨時被取消，還傳出美國務院安排與鄭麗文會晤的人層級非常低，與過往台灣主要政治人物訪美規格相比明顯下降許多，引發輿論熱議。請繼續往下閱讀...汪浩在臉書以「美國認定鄭麗文無足輕重」為題發文指出，鄭麗文與盧秀燕比拚規格的「高調訪美行」，最終在華府踢到了最冰冷的地緣政治鐵板。汪浩分析，事前放話要見川普、踏入白宮會晤國安高層的鄭麗文，不僅遭到美方無情降格至AIT華府總部、縮減會面層級到國務院科員，甚至在最後一刻被美方國安會在「未告知原因」的情況下放鴿子。美方用罕見的無預警拒見，給了這位自詡「A咖」的投機政客一記嚴厲的國際級耳光。汪浩表示，美國官方的態度釋放出清晰的訊號：白天在智庫拿反貪腐包裝反軍購、晚上在僑宴就切回「中華民族偉大復興」變臉秀，早已被華府國安圈看破手腳。在美國眼中，這位高舉北京統戰論述、民意基礎薄弱，卻高度仰賴「習近平加持」的紅色傳聲筒，在國際戰略棋局上根本「無足輕重」。汪浩也諷刺，美方反手便向過去曾放棄訪美的韓國瑜遞出邀請。這種精準的「紅統隔離」，徹底戳破了鄭麗文用大內宣編織的2028選總統政治童話，讓她這趟訪美淪為政壇笑料，2028總統夢幾乎破局。    ,https://news.ltn.com.tw/news/politics/breakingnews/5473346
日國會跨黨派新組織挺「台海和平」 召集人盼見證「台日復交」,政治,2026/06/16 07:20,矢板明夫分享，近年日本國會展開一場「為台灣正名」的運動，昨日更有跨黨派國會議員組成「思考台灣海峽和平與穩定國會議員之會」，代表日本國會正在以實際行動向國際社會表明立場，促使更多人認識到「台海和平是國際公共利益的重要一環」。（路透檔案照）日本首相高市早苗去年11月對「台灣有事」表態後，掀起外界關注台灣議題。資深媒體人矢板明夫分享，近年來日本國會逐漸展開一場「為台灣正名」的運動，昨日更有日本跨黨派國會議員組成「思考台灣海峽和平與穩定國會議員之會」，代表日本國會正在以實際行動向國際社會表明立場，促使更多人認識到「台海和平是國際公共利益的重要一環」，擔任總召集人的日本保守黨參議員北村晴男更直言，「希望在有生之年看到日本與台灣恢復邦交」。矢板明夫也透露，印太戰略智庫正規劃於今年9月邀請該團體成員訪問台灣，與台灣各界進行更深入的交流。矢板明夫在臉書發文指出，昨天日本國會出現了一個值得台灣高度關注的新動向。由跨黨派國會議員組成的「思考台灣海峽和平與穩定國會議員之會」正式成立。這個新組織雖然目前只有5位發起議員，但背後所代表的政治意義十分重大。請繼續往下閱讀...矢板明夫表示，發起人之一的日本維新會參議員石平，在成立大會上表示：「我雖然出生於中國，但作為日本國會議員，特別關心台灣問題。台灣海峽的和平與穩定，對日本而言極為重要。」這句話點出了日本政壇近年來最重要的共識之一，那就是台海安全已不再只是台灣的問題，而是日本自身的安全問題。矢板明夫指出，擔任總召集人的日本保守黨參議員北村晴男則進一步強調：「希望透過研究與政策提案，推動相關立法。」更引人注目的是，北村議員公開表示：「日本外交史上最大的錯誤，就是1972年日中建交時與台灣斷交。我希望在有生之年看到日本與台灣恢復邦交。」矢板明夫提到，近年來，日本國會已經逐漸展開一場「為台灣正名」的運動。過去長期存在的「日華議員懇談會」，日前正式更名為「日台友好議員聯盟」。而昨日成立的新組織，更直接將「台灣海峽和平」寫入名稱之中。這代表日本國會正在以實際行動向國際社會表明立場，促使更多人認識到「台海和平是國際公共利益的重要一環」。這是對中國近年來不斷升高軍事壓力與外交打壓的一種明確回應。矢板明夫透露，他也有幸參與這個團體成立的部分籌備工作。上星期在東京期間，他和這幾位國會議員舉行了小型座談，向大家介紹台灣目前的政治和安全保障現況，也分享了台灣社會對區域局勢的看法。可以明顯感受到，日本政界對台灣的關心程度正在快速提升，而且已經從過去的情感支持，逐漸進入具體政策討論的階段。矢板明夫說明，未來這個議員團體預計每月定期舉辦研究會，邀請專家學者討論台海局勢、日本安全保障以及日台合作等議題，將來有機會向國會提案成立和台灣相關的法律。他們也十分關心日本向台灣出售武器的話題。矢板明夫直言，印太戰略智庫正規劃於今年9月邀請該團體成員訪問台灣，與台灣各界進行更深入的交流。這個新組織的成立，對於日台關係而言，很可能是具有歷史意義的重要一步。矢板明夫指出，昨日跨黨派國會議員組成的「思考台灣海峽和平與穩定國會議員之會」，在日本參議院議員會館宣布成立。（圖擷自臉書）    ,https://news.ltn.com.tw/news/politics/breakingnews/5473322
鄭麗文訪美返台 抵機場面對追問只說「謝謝，大家早」,政治,2026/06/16 07:13,國民黨主席鄭麗文結束訪美行程，今天清晨搭乘華航CI23班機返抵桃園國際機場。（記者朱沛雄攝）國民黨主席鄭麗文結束訪美行程，今天清晨搭乘華航CI23班機返抵桃園國際機場，鄭麗文下機後沒有發表談話或受訪，對於媒體詢問出訪成果，鄭麗文也沒有回應，僅向在場媒體表示「謝謝，大家早」！隨後經由商務中心通關離去。鄭麗文1日啟程前往美國，先抵達西岸舊金山展開參訪行程，接著前往東岸的波士頓、紐約、華府等地與美國政界、智庫交流，最後再回到西岸洛杉磯進行拜會僑胞，結束為期2週訪問行程後，於今日清晨返抵台灣。請繼續往下閱讀...藍營「4顆太陽」近日接連出訪，除了鄭麗文，台中市長盧秀燕6日率團出訪歐洲德國、捷克、奧地利3國10天，台北市長蔣萬安14日晚間抵達新加坡，立法院長韓國瑜也擬於21日至27日率跨黨派立委前往美國推動國會外交。國民黨主席鄭麗文結束訪美行程，今天清晨搭乘華航CI23班機返抵桃園國際機場。（記者朱沛雄攝）國民黨主席鄭麗文結束訪美行程，今天清晨搭乘華航CI23班機返抵桃園國際機場。（記者朱沛雄攝）    ,https://news.ltn.com.tw/news/politics/breakingnews/5473325
民進黨「台灣好生活」宣講強化地方連結 下月全代會後進入熱戰 將擴大動員,政治,2026/06/16 05:30,民進黨啟動執政團隊「台灣好生活」全國宣講已在七縣市登場。圖為上週基隆場，行政院秘書長張惇涵（左三）和政務委員季連成（右二）挺基隆市長參選人童子瑋（右三）。（資料照）民進黨啟動執政團隊「台灣好生活」全國宣講，首站五月九日在高雄起跑，目前已在台中、嘉縣、彰化、基隆、屏東、宜蘭七縣市登場。黨務人士說明，現階段設定為針對產業或社團等特定受眾的小型說明會，七月中全代會後進入「熱戰」，將擴大動員規模；國民黨則批評，部會首長帶資源下鄉，是典型的「公器私用」。綠營人士分析，邀請行政團隊全國宣講，關鍵在強化執政團隊與地方基層的連結及溝通，這不是一夕扭轉或催化選票的特效藥，而是扎穩基礎的基本功，將第一線即時反饋的基層心聲，轉化為靈活的政策對策，實質提升綠營整體選戰策略的應變彈性。請繼續往下閱讀...主打新世代扛起新時代據了解，民進黨規劃兩階段選戰模式，第一階段從五二〇總統就職起，由政務官宣講打頭陣，一方面為政院宣傳預算遭砍的僵局突圍、一方面說明民生政策、關稅議題及地方產業推動等；第二階段從七月中旬全代會後開始，將強力主打「新世代扛起新時代」，全面擴大動員規模，期待透過明星級首長跨界，將政策紅利轉化為地方大選的致勝選票。民進黨高雄市長參選人、立委賴瑞隆指出，中央團隊走入地方，除了讓民眾更了解政策內容，也能第一時間反映基層聲音與地方需求，有助於政策滾動調整更貼近民意、施政方向能更符合人民期待。民進黨台中市長參選人、立委何欣純認為，每個縣市需求都不同，應依照不同縣市需求客製化內容，結合地方關心議題，才能將中央與地方發展的完整論述，讓民眾有感。對於賴政府政務官下鄉輔選，國民黨立委黃健豪昨直言，生活好不好不用靠政務官來說，實際現況是股市四萬點，但薪資中位數不到四萬元，大家看到政務官在台上宣講各項數據，只會把人民推的更遠。藍：典型的「公器私用」國民黨團書記長林沛祥也表示，與其說是在宣講政策，不如說是在巡迴搶救選情。行政院長卓榮泰、部會首長帶著國家資源下鄉跑透透，這不就是典型的「公器私用、綠能你不能」嗎？    ,https://news.ltn.com.tw/news/politics/paper/1758966
