Title,News_Type,date,content,url
戳破假惠台！ 中共斷賴總統出訪航線 涉外人士揭3大警訊,政治,2026/04/22 11:47,賴清德總統原定今啟程出訪非洲友邦史瓦帝尼，卻因中國施壓航經國家被迫暫緩。（資料照）賴清德總統原定今啟程出訪非洲友邦史瓦帝尼，卻因中國施壓塞席爾、模里西斯、馬達加斯加撤回飛航許可，行程被迫暫緩，引發國際社會譁然，包括美國國會、歐盟等接連表達關切。涉外人士點出此事件背後的「三大警訊」，中國正將「飛安武器化」，公然挑戰國際秩序，徹底戳破其「假惠台、真阻撓」的兩手策略，朝野應團結一致面對外部打壓。首先，涉外人士指出，由於以飛安施壓實為罕見，中國以政治脅迫介入第三國主權決定、衝擊國際秩序與飛航安全的重大案例引起國際關注，此事對台灣最直接的提醒，就是面對外部打壓，朝野不應再有模糊空間。當中國施壓的對象已不是單一政黨、單一政府部門，而是國家整體國際空間時，國會理應展現清楚而一致的國家立場。請繼續往下閱讀...立法院民進黨團今已在外交及國防委員會通過提案，譴責中國粗暴干預他國內政，在野黨的態度備受關注。涉外人士強調，此刻若國內政治競爭凌駕於國家利益之上，恐讓外界誤判台灣在重大主權議題上欠缺共識，進而削弱國際挺台力道；從戰略訊號來看，若能跨黨派共同譴責，就是在告訴國際社會：台灣在面對威權壓迫時，仍具備民主體制下的團結能力。第二，涉外人士表示，此事也再次揭露，北京所謂對台「善意」只是話術，北京宣布所謂「惠台」措施之際，實則透過經濟與外交壓力阻撓台灣元首出訪，這種兩面操作的目的從不是改善兩岸關係，而是要在國際上孤立台灣、在內部製造分歧。正因如此，台灣的嚇阻準備更應具體展現在制度與預算上，正如美國國會跨黨派人士近期所呼籲，北京政治威脅越是升高，台灣的國防立法與預算進程就越不能打折，並應加快。第三，涉外人士表示，從國際法與國際秩序角度來看，此次最值得警惕之處，在於中國將第三國的飛航許可與領空管理，變成地緣政治施壓工具，固然各國對領空享有主權，但誠如歐盟聲明所指，這類決定應建立在透明、可預測與飛安優先的基礎上。北京把攸關航空安全、經貿往來與外交運作的中立機制，強行拖入對台灣的政治鬥爭，若國際社會對此默許，中國勢必會在更多區域複製此類操作。值得注意的是，國際第一時間強力挺台，除了歐盟明確反對將領空管理作為政治手段，美國多位國會議員也公開譴責中國，IPAC更痛批北京的行徑對國際規範造成挑戰。涉外人士總結說，此次元首出訪受阻，對內考驗台灣朝野能否在主權與國際空間議題站穩一致立場，對外則揭露北京「善意是假、威脅是真」的本質，以及重塑國際秩序運作邏輯的企圖，對此，台灣需要的是更堅實的國防準備以及更主動的國際論述。    ,https://news.ltn.com.tw/news/politics/breakingnews/5411973
我政府不接受「糖衣毒藥大禮包」 中國國台辦聲援商總,政治,2026/04/22 11:44,中國國台辦發言人張晗。（翻攝直播）鄭習會後，中共提出10項對台措施，全國商業總會理事長許舒博本週一號召七大產業界代表要求政府接受，遭陸委會質疑是「以商逼政」、「糖衣毒藥大禮包」。中國國台辦今日聲援商總指稱，「民進黨當局」無視島內民意，無視台灣同胞利益福祉，妄想在不承認「九二共識」的情況下恢復兩岸協商對話。國台辦發言人張晗指出，台灣商業總會及相關產業界表達的心聲，充分反映了近期我們發布的10項「促進兩岸交流合作」的政策措施符合島內產業復甦需求，有利於解決經濟、民生痛點。請繼續往下閱讀...張晗嗆聲，「民進黨當局」無視島內民意，無視台灣同胞利益福祉，對於中方釋出的「善意誠意」和出台的「惠台利民」政策措施，只會一味抹黑攻擊，並藉機進行政治操弄，妄想在不承認「九二共識」的情況下恢復兩岸協商對話。這些慣用伎倆騙不了人，也不可能得逞，只會讓他們越來越站在島內主流民意的對立面。張晗聲稱，「交流融合」是兩岸同胞的願望所繫、福祉所在，兩岸同胞走親走近、走到一起的大潮流誰也阻擋不了。「民進黨當局」應停止政治操弄，順應民心所向和大勢所趨，在促進兩岸交流合作上轉變態度。陸委會多次指出，中共10項「促進兩岸交流合作政策措施」是分化台灣與「促統促融」的政治工具。強加政治前提，並且欠缺與我政府的協議與制度化的保障，只會讓台灣相關產業陷入中共的統戰圈套。陸委會強調，國家主權、自由民主不是交易事項，兩岸涉公權力事項請直接與我民選政府交流協商；政府也將加強與業者輔導溝通，看清中共政治意圖，勿再次落入中共「養套殺」的陷阱。    ,https://news.ltn.com.tw/news/politics/breakingnews/5411969
總統出訪受阻 汪浩：台灣須對中採取實質反制,政治,2026/04/22 11:42,作家汪浩。（資料照）賴清德總統原本預計今天（22日）出訪非洲邦交國史瓦帝尼，因專機航程途經的塞席爾、模里西斯、馬達加斯加等3個非洲國家，無預警取消飛航許可，遭到中國經濟施壓，導致總統暫緩出訪。對此，作家汪浩表示，台灣必須向國際社會傳遞清晰訊號：北京無權決定主權國家的外交路徑，台灣走向世界的決心，絕非威權脅迫所能阻擋。汪浩在臉書PO文表示，賴清德總統訪問友邦史瓦帝尼受阻，揭示了中共已將國際民航秩序「武器化」。透過經濟脅迫塞席爾、馬達加斯加等國撤回飛越許可，北京不僅在孤立台灣，更是在挑戰全球飛航自由。面對這種無所不在的威權擴張，台灣不能僅止於口頭譴責，必須採取實質且具痛感的反制行動。請繼續往下閱讀...汪浩指出，首先台灣應加強與美、日、歐的「民主供應鏈」整合，加大對高級晶片及關鍵高科技產品輸中的管制力度。既然北京將地緣政治凌駕於國際規則，台灣也應同步升級「矽盾」防禦，嚴查中國商品轉口台灣「洗產地」的投機行為，切斷其利用台灣資源發展威權技術的管道。汪浩續指，其次，對內必須強化「防衛性民主」，加強打擊滲透台灣內部的共諜與「第五縱隊」。當國人看到鄭麗文訪中唱雙簧、而總統出訪卻受阻時，這種統戰分化的壓力已至臨界點。政府應從法制面落實國安防護，提高民眾的敵情意識，防止民主韌性由內部被侵蝕。汪浩直言，最後，台灣應主動出擊，加大國際宣傳投入，向世界揭露中共如何將民航區政治化、威脅國際秩序的惡行。台灣應結合IPAC等國際友人，邀請各方反統促獨力量，召開國際會議反對中國的「中華民族促進法」。我們必須向國際社會傳遞清晰訊號：北京無權決定主權國家的外交路徑，台灣走向世界的決心，絕非威權脅迫所能阻擋。    ,https://news.ltn.com.tw/news/politics/breakingnews/5411830
美參眾議員齊批中國！ 籲反制模里西斯、憂國際秩序受威權主導,政治,2026/04/22 11:40,美國聯邦眾議院「美國與中國共產黨戰略競爭特別委員會」21日轉發總統賴清德的推文，並譴責中國施壓他國拒絕賴總統過境飛行。（圖擷取自X平台）總統賴清德原訂今（22）日率團出訪我非洲友邦史瓦帝尼，卻因模里西斯等3國在中國施壓下臨時撤回專機飛越許可，未能順利成行。美國共和黨聯邦參議院外委會非洲小組主席克魯茲（Ted Cruz）呼籲，美國在尊重模里西斯主權之餘，應採取行動予以反制並追究相關責任；參議員匡希恆也示警，若由中國主導國際秩序，跨國移動、言論等各項基本自由恐將受限。美國聯邦眾議院「美國與中國共產黨戰略競爭特別委員會」21日轉發總統賴清德的推文，並譴責中國施壓他國拒絕賴總統過境飛行，批評此為經濟脅迫而非外交手段，重申美國支持台灣與國際社會自由往來的權利。請繼續往下閱讀...美國聯邦眾議院外交委員會21日也推文表示，中共再度對台灣施壓與霸凌，並強調美國與台灣站在一起，反制此類公然脅迫的行為。美國聯邦參議院外委會非洲小組主席、參議員克魯茲（Ted Cruz）今日推文表示，模里西斯近期一方面在查哥斯群島（Chagos）議題上挑戰英國立場，另一方面又干預台灣飛往非洲的航線安排，顯見其不惜損害美國利益與中國共產黨結盟。克魯茲也主張，美國在尊重其主權之餘，應採取行動予以反制並追究相關責任。美國聯邦參議院外委會西半球跨國犯罪、民主人權事務小組主席、參議員匡希恆（John Curtis）今日也轉推賴總統推文表示，中國施壓各國孤立台灣的作為，再次凸顯威權體制不僅在國內限縮自由，亦試圖向外擴張控制力。匡希恆也示警，若由中國主導國際秩序，跨國移動、言論等各項基本自由恐將受限。美國聯邦眾議院「國會台灣連線」共同主席迪馬里（Mario Diaz-Balart）則推文譴責北京當局施壓塞席爾、模里西斯及馬達加斯加，迫使前述國家中止台灣之過境飛行權，並批評此種將航空安全「武器化」的恐嚇手段既魯莽且危險。美國共和黨聯邦參議院外委會非洲小組主席克魯茲（Ted Cruz）呼籲，美國在尊重模里西斯主權之餘，應採取行動予以反制並追究相關責任。（圖擷取自X平台）    ,https://news.ltn.com.tw/news/politics/breakingnews/5411949
中國打壓賴清德出訪史瓦帝尼 賴中強：就是要否定台灣存在,政治,2026/04/22 11:39,台灣公民陣線、台灣經濟民主連合舉行記者會，現場並由台灣經濟民主連合智庫召集人賴中強（中）說明。（記者田裕華攝）總統賴清德原訂今日啟程出訪非洲友邦史瓦帝尼，但總統府昨晚證實，因專機航路途經的塞席爾、模里西斯、馬達加斯加等三國「臨時取消」飛航許可，國安團隊決定暫緩行程，各界譁然。面對我國外交舉措再受中國打壓，經民連智庫召集人賴中強律師表示，此舉就是要否定我民選政府，以「經濟武器化」手段逼我們下跪，籲大眾破除幻想。賴中強直言，中國此舉就是要徹底否定台灣的民選政府，不讓我國在國際上有生存空間，然而，根據中國「反分裂國家法」條文，北京當局是會跟台灣談判，以提供符合其身分的適當國際空間，像是讓我國以「中國一省」身分出席WHA世界衛生組織大會；然而，從總統欲出訪邦交國受阻一事，可見中國仍要兼併我國，完成「中華民族偉大復興」，實現一國兩制。請繼續往下閱讀...賴示警，國人不應幻想中共會讓台灣加入國際組織，他以鄭麗文在「鄭習會」稱爭取台灣適當的國際空間一事解釋，這所有幻想的前提，就是要「向中國下跪」，像香港一樣承認是中國特區，而不承認的話，就如總統賴清德遇到的困境一樣，搭飛機出國訪問都會被阻止，即使是邦交國也會被阻撓。賴中強再指出，中國慣用「經濟武器化」的手段使外國對它依賴，這形同將自己的命運交給對方，就如同中國國台辦日前公告的「惠台十項措施」，他批評，一旦我國愈向中國出口、愈多中客來台，經濟上更靠攏中國，也就讓中國有更大的「籌碼」對我們施加脅迫，而這次它對馬達加斯加、塞席爾威脅收回貸款來換取消飛航許可，就是實證。    ,https://news.ltn.com.tw/news/politics/breakingnews/5411928
一帶一路變瘟神！作家趙曉慧揭非洲國家無法擺脫中共緣由,政治,2026/04/22 11:35,總統賴清德。（資料照）總統賴清德原定今（22日）出發前往非洲友邦史瓦帝尼訪問，但因飛航許可遭撤而暫緩。作家趙曉慧分析，非洲國家至今仍難擺脫北京的金錢攻勢，主因在於中共為與美國川普政府爭霸，已變更方針鎖定「關鍵礦產與綠能供應鏈」，企圖掌握電動車與AI晶片的命脈，並自今年5月起對53個非洲建交國實施零關稅，藉此孤立台灣友邦史瓦帝尼。趙曉慧今於臉書發文指出，中共財政狀況持續惡化，其推動的「一帶一路」在全球已淪為令人避之唯恐不及的「瘟神」。但為何非洲國家還是無法擺脫中共的金錢攻勢，導致賴總統出訪史瓦帝尼受阻？請繼續往下閱讀...趙曉慧分析，由於非洲擁有豐富的鋰、鈷、錳等戰略礦產，這些是電動車電池與AI晶片等製品的原料，故引起中共覬覦，用來保障中國的高科技產業的命脈，累積與美國川普政府對抗的本錢。中共在非洲推動的「一帶一路」從2024年開始改弦更張，鎖定建立關鍵礦產與綠能的供應鏈，取代過往的大撒幣蓋「大鐵路、大港口」的基礎建設模式。為將非洲的基礎材料與初級加工品與中國供應鏈綁定，中共自2026年5月起，對與其建交的53個非洲國家實施100％稅目產品零關稅待遇。非洲唯一沒有獲得這項待遇的國家，就是台灣的友邦史瓦帝尼。「一帶一路」淪為瘟神，讓非洲國家陷入債務陷阱。中共也不是省油的燈，開始縮減主權貸款，改由私營企業或半官方機構進行較小規模的技術性合作。不過，這種中國模式也不是沒有代價，充滿「黑箱協議」色彩的貸款條約，通常不公開，這容易導致非洲國家的政府染上貪腐弊案。奈及利亞、肯亞等非洲國家目前正處於數位與能源轉型爆發期，更需穩定電網與供電的「物聯網（IoT）晶片」（智慧水表、電力管理系統），以及「通訊與低軌衛星設備」，還有推動在地組裝與製造的「汽車與工業晶片」，台灣透過整合晶片、感測器與雲端平台，讓非洲數位生活高度依賴「台灣製造」，比單純買晶片更具吸引力。台灣不再對非洲提供單項產品，而是輸出「整合式解決方案」。面對習近平2024宣布未來3年提供3600億人民幣的驚人銀彈，趙曉慧認為，台灣雖然預算規模不及中共的千分之一，卻能以民主價值與智慧化外交取勝。目前台灣經營非洲的模式已進化為智慧農耕、高端醫療及戰略儲油槽。中共雖然用金錢蓋路，台灣則是用技術鋪網。趙曉慧強調，當非洲各國政府運作、農民耕作、病人看診都離不開「台灣系統」時，中共的政治封鎖勢將面臨非洲內部阻力。中國5月1日起對53個非洲建交國全面實施零關稅    ,https://news.ltn.com.tw/news/politics/breakingnews/5411818
國台辦嗆「台灣沒有什麼總統」大讚非洲3國阻賴清德出訪,政治,2026/04/22 11:34,中國國台辦發言人張晗。（翻攝直播）賴清德總統原定今日出訪史瓦帝尼，因中國以經濟脅迫等手段強力施壓，塞席爾、模里西斯、馬達加斯加三國在無預警狀況下，無端取消專機飛航許可，導致總統出訪告吹。中國國台辦發言人張晗今日大讚非州三國堅持「一個中國原則」，聲稱這是「得道多助、失道寡助」，並多次嗆聲「台灣是中國一部分，沒有什麼總統」。總統原訂22日應非洲友邦史瓦帝尼王國國王恩史瓦帝三世（H.M. King Mswati III）邀請，率團前往史國出席史王登基40週年暨史王58歲華誕慶典等系列慶祝活動。由於專機飛越許可遭塞席爾、模里西斯、馬達加斯加三國無預警臨時撤回，致使行程未能順利成行。請繼續往下閱讀...國台辦發言人張晗在例行記者會表示，「我們對有關國家堅持『一個中國原則』的立場和做法表示讚賞」。「得道多助、失道寡助」，事實再度證明「一個中國原則」是國際關係基本準則和國際社會普遍共識，是大勢所趨，是大義所在，是人心所向。媒體問及，賴清德總統出訪因中國打壓而取消，國民黨文傳會呼籲給予中華民國外交空間，民眾黨也譴責中國。關於是否擔心打壓中華民國總統，會將台灣人民越推越遠？張晗回嗆，「台灣是中國一部分，沒有什麼總統」。張晗聲稱，一個中國原則是公認的國際關係基本準則，我們一貫以一個中國原則來對待「台灣地區」對外交往問題，堅決反對任何企圖在國際上製造兩個中國、一中一台的行徑。張晗嗆聲，賴清德企圖通過外竄，散布台獨分裂謬論，煽動反中抗中，勾連外部勢力謀獨挑釁，升高台海對立對抗，破壞台海和平穩定，損害島內民眾利益，必遭反對和失敗。她又說，在一個中國原則的基礎上，通過兩岸協商，「台灣地區」對外交往問題，完全可以得到妥善解決，兩岸同胞是一家人，只要有話好好說，有事好商量，就沒有化解不了的矛盾分歧。對此，民進黨立委王美惠今日受訪駁斥，中國不要再欺騙全世界，馬英九也當過總統，中華民國怎會沒有總統。國民黨主席鄭麗文去中國講得那麼好聽，什麼兩岸和平，回頭中國就下毒手，完全不承認中華民國有總統。王美惠批評，台灣哪裡沒有總統？中國這次真的太惡毒，故意打壓不讓總統出訪，中共目的是要消滅中華民國的外交空間。「台灣是自由民主國家，跟中國那種不能選總統的國家完全不同，我們不會屈服的」。    ,https://news.ltn.com.tw/news/politics/breakingnews/5411941
綠營要求為柯P辣椒水烏龍道歉 黃國昌反斥：民進黨亂紥稻草人,政治,2026/04/22 11:34,民眾黨北市長參選人黃國昌。（記者翁聿煌攝）民進黨前主席柯文哲17日在台中逢甲夜市陪市議員參選人掃街，驚傳被不明人士噴辣椒水，事後證明根本是烏龍一場，綠營要求對先前批評言論道歉，黃國昌今（22）日表示，他當初就說事件要交由警方調查勿枉勿緃，提到總統賴清德「是要他思考台灣為何變得更暴力」，批評民進黨不願意冷靜反省、自己紥稻草人模糊問題焦點。黃國昌18日在新北市新店碧潭受訪時譴責暴力，20日上午在廣播節目受訪再批評總統賴清德「嘴巴裡面講的是團結」，民進黨「所展現出來的，卻是完全不一樣的作為」，「他們的SOP其實還蠻清楚的，就是找一些人，特定的行徑來鬧場，然後配合綠媒在媒體上面傳播」，質疑國家社會「搞到這樣子四分五裂」。而當天台中警方就宣布調查結果是分局長誤噴辣椒水波及柯文哲等人，綠營要求黃國昌道歉。請繼續往下閱讀...黃國昌表示，他當時評論此事，在網路上可能會因為支持柯文哲、支持民眾黨，就遭到霸凌、就遭到熱搜，反問他當時所講的「哪一個不是事實」？黃國昌批評，民進黨如今自己紥稻草人來模糊問題焦點，對台灣社會的和諧與共融，一點幫助都沒有。有媒體問黃國昌，前民眾黨不分區立委李貞秀跑到立法院求助院長韓國瑜，想要就假處分事件，和黃國昌對簿公堂、尋求對決，黃國昌只表示「沒有回應」。柯文哲疑被辣椒水攻擊 黃國昌再扯賴清德    ,https://news.ltn.com.tw/news/politics/breakingnews/5411901
國民黨中市后里豐原議員初選民調 翁子里里長連佳振勝出,政治,2026/04/22 11:34,國民黨中市后里豐原民調今天公布 ，由翁子里里長連佳振勝出。（資料照）國民黨中市黨部今天公布后里豐原區（第4選區）議員民調初選結果，由翁子里里長連佳振勝出。國民黨在台中市第4選區（后里豐原）提名3席，由於現任議員張瀞分不再連任，留下一席由社皮里長涂力旋及翁子里里長連佳振兩人角逐，黨部於19、20、21日進行3天民調。請繼續往下閱讀...國民黨中市黨部今天公布后里豐原區（第4選區）民調初選結果，由翁子里里長連佳振勝出，因雙方有協議，數據不公布。    ,https://news.ltn.com.tw/news/politics/breakingnews/5411943
黃國昌：民眾黨譴責中國打壓 外交部也要檢討為何前一天才知情,政治,2026/04/22 11:31,民眾黨新北市長參選人黃國昌。（記者翁聿煌攝）總統賴清德原本預訂22日出訪台灣在非洲的唯一友邦史瓦帝尼，外交部譴責中國打壓，民眾黨新北市長參選人黃國昌今天舉行原住民族政策說明會，被問到此事表示，民眾黨譴責中國打壓台灣國際外交空間，但外交部也要檢討為何在前一天才知情，來不及應變。黃國昌指出，台灣目前的外交處境屢屢遭到中國打壓，從過去到現在，中國對於台灣國際外交從未停止過，民眾黨在第一時間就發聲明譴責，希望中國不要再打壓台灣的外交空間。請繼續往下閱讀...他指出，在內政上，民眾黨對於總統賴清德的倒行逆施無法認同，提出譴責，但是走出台灣面對國際社會，台灣就是共同生命體，面對中國打壓台灣國際外交空間，他當然不分黨派一致譴責，希望中國不要再這樣繼續下去，在第二個層次，賴清德在出訪前一天，才突然說不能去了，真的是聞所未聞，外交部在相關事先準備，情資掌握和應變措施上的能力，是不是發生什麼問題，竟然導致總統在出訪前一天才突然取消，也要了解一下問題出在哪裡。    ,https://news.ltn.com.tw/news/politics/breakingnews/5411940
中共脅迫第三國撤銷賴總統專機航權 立院外委會通過提案強烈譴責,政治,2026/04/22 11:31,立院外委會通過提案，譴責中共脅迫第三國臨時撤銷我元首班機航權，打壓我國國際空間。（記者方瑋立翻攝）總統賴清德原訂出訪友邦史瓦帝尼，然而卻面對中共透過外交與經濟脅迫手段，迫使出訪航路經過的第三國臨時撤銷總統專機飛航許可。對此，立法院外交及國防委員會今（22）日通過臨時提案，由民進黨立委王定宇、林楚茵、沈伯洋、王義川、陳俊宇、羅美玲、陳冠廷等人共同提案，針對中共粗暴行徑予以「強烈譴責」。這項提案今天在外委會無異議通過。提案內容指出，我國總統出訪友邦是行使外交權利的主權作為，中國此舉不僅嚴重打壓我國國際空間，更涉嫌干涉他國內政，已公然違反國際慣例並破壞區域現狀。請繼續往下閱讀...沈伯洋說，飛航許可的核發在國際法上屬於主權行為，中國利用經濟手段迫使第三國撤權，是直接介入他國主權。此舉不僅違反《聯合國憲章》，更破壞了《芝加哥公約》所確立的國際民航秩序與非歧視原則，對台灣外交空間構成嚴重阻礙。提案也詳列中國違法的各項國際規範，包括違反《聯合國憲章》中關於「國家主權平等」與「不干涉內政」之原則、1970年聯大第2625號決議文禁止之「強制干預」，以及《芝加哥公約》確立之國際民航秩序與非歧視原則，更踐踏了《維也納外交關係公約》第40條關於「過境保障」的精神，構成對以國際規則為基礎之秩序的公然挑戰。提案認為，中共對我國的系統性打壓已非個案，委員會作為監督外交與國防事務之專責委員會，對此粗暴行徑表達強烈譴責。提案亦明確要求，外交部應採取積極措施，持續拓展國家外交空間並捍衛國家主權，同時應透過駐外館處及國際組織管道，將本次中共脅迫撤銷航權事件，列入國際民航組織（ICAO）及其他多邊機制之關注項目。提案也要求政府應積極爭取理念相近之民主夥伴的聲援與具體行動，以捍衛我國主權及國際生存權利。王定宇指出，我方早在數週前就已取得這三個國家的飛越許可，中共卻刻意採取「時間點突擊」，在專機出發前12小時，利用該三國陷入中國「債務陷阱」的困境進行經濟脅迫，迫使其取消許可。他批評，中共將所有互動工具化、武器化，已是典型的介入他國內政。國民黨立委徐巧芯表示，總統出訪友邦本是應有之義，對於被打壓或不公平對待，認同臨時提案的時效性，僅針對程序部分建議應同步知會外交部確認文字細節，並強調對案子本身沒有意見。立委林楚茵則呼籲，這是一份針對中共惡霸行徑的「譴責案」，並非針對行政部門，呼籲朝野不分黨派連署，向國際展現台灣對國家元首的支持與團結。    ,https://news.ltn.com.tw/news/politics/breakingnews/5411930
