Title,News_Type,date,content,url
傳黨內建議選市長「少統獨多市政」 沈伯洋：不同場合、一樣重要,政治,2026/04/25 15:12,民進黨籍立委沈伯洋披掛出征台北市長呼聲高，傳黨內人士擔憂其鮮明「抗中保台」色彩，建議沈伯洋多談民生，少談統獨、國安議題。（記者方賓照攝）民進黨籍立委沈伯洋披掛出征台北市長呼聲高，傳黨內人士擔憂其鮮明「抗中保台」色彩，建議沈伯洋多談民生，少談統獨、國安議題。沈伯洋今（25）日受訪說，講到台北就要談市政規劃，但他目前是在立院國防外交委員會，就會談到國安議題，在不同場合、談不同事情，但都一樣重要。沈伯洋今出席松山慈惠堂母娘文化季活動，會後受訪表示，目前民進黨積極準備台北市長選舉，一旦講到台北市，講的當然都是跟市政有關，不管民生、經濟、交通、文化、產業等，這都是應該要多談的。請繼續往下閱讀...他說，至於統獨議題，因為他現在在國防外交委員會，當然就比較會談到外交的處境，以及國防的困境，預算到底什麼時候才能過，「所以我覺得這是在不同的場合談不同的事情，但它們都一樣的重要」。媒體也詢問資安議題，沈伯洋說，很多中國的App都有一定的資安風險，要小心的是，很多人都只在意中國，但假設今天這個App不是中國的，卻把資料賣給中國，一樣也有資安風險。在看資安風險的時候，不能只用中國角度，而是要看背後的一些協議，有沒有賣給第三方的廣告公司，這些廣告公司，跟這些中國的業者到底關係是什麼，這個才是真的應該要去探求的。至於最近熱議的中國地圖App「高德地圖」，沈伯洋認為，這並不是統獨的議題，而是資料會不會被濫用，以台北市為例，如果今天收集這些交通數據交給其他的國家，都會有一定的危險，並不限於中國，如果今天是有第三國，但第三國又有新的廣告公司，該廣告公司又把這資料再賣回去給中國的公司，中國又可以從這個公司取得資料的時候，照樣都會有風險。    ,https://news.ltn.com.tw/news/politics/breakingnews/5415641
盧秀燕到新北首度輔選李四川  曝雙方有3個秘密、關係特殊,政治,2026/04/25 15:06,台中市長盧秀燕北上輔選新北市長參選人李四川，一起參拜板橋慈惠宮。（記者叢昌瑾攝）國民黨籍的台中市長盧秀燕，今天（25日）下午到新北市首度為黨籍的新北市長參選人李四川輔選，一起參拜板橋區知名廟宇慈惠宮，盧秀燕親切稱呼李四川為「小川哥」，她在致詞中自曝與李四川的3個「秘密」。盧秀燕指出，其一是「我們兩個有特殊關係」，她出任市長，其實也有拜託李四川，不過「那幾個男人主席、市長比我還需要（李四川）」，所以把李四川讓給時任高雄市長韓國瑜、現任台北市長蔣萬安；其二是李四川曾是她在國民黨黨職的長官。請繼續往下閱讀...至於第3個秘密，盧秀燕說，李四川的粗眉毛長得很像她喜歡的動漫角色「蠟筆小新」，看起來很有魄力，想稱呼他為「蠟筆小川」又怕沒禮貌，因此稱呼為「小川哥」，「小川哥」是中華民國最會做事、最有能力的人，但他的內心住了小男孩，李四川私下非常調皮創新、也愛開玩笑。李四川表示，感謝盧秀燕特地從台中到新北來為他加油，盧秀燕在台中市政的表現有口皆碑，「每一個人都說這一個市長真的就是媽媽」，因此偕盧秀燕來板橋的信仰中心參拜，慈惠宮平日香火鼎盛，盼媽祖保佑他們心想事成，以及黨籍市議員參選人、里長都高票當選。二人參拜完畢後，步行前往在地知名小吃「老曹餛飩」，過程中，李四川也向盧秀燕一一介紹當地周邊特色，途經市場，許多支持者、攤販高呼「凍蒜」、要求合照，展現不俗人氣。盧秀燕品嘗板橋在地小吃途中與支持者握手。（記者叢昌瑾攝）盧秀燕、李四川等人到板橋小吃名店用餐。（記者黃子暘攝）盧秀燕、李四川等人參拜完慈惠宮，徒步前往小吃名店，途中遇到許多支持者要求合照或握手。（記者黃子暘攝）    ,https://news.ltn.com.tw/news/politics/breakingnews/5415617
中網友問「全家人政治立場不同會怎麼樣？」 網舉「他」為例回應,政治,2026/04/25 15:04,哥哥黃偉哲為民進黨台南市市長，其妹妹黃智賢政治立場為統派，儘管政治立場相左，兩人感情依舊好。（資料照）日前有位中國網友在社群平台「Threads」上貼出一個問題「如果台灣有家庭，老爸支持國民黨，老媽支持民進黨，兒子台獨，女兒投共，以後會怎麼處理」，網友見了大笑回覆「這狀況不就是台南市長黃偉哲家嗎？」，黃偉哲為民進黨籍，妹妹黃智賢政治立場為統派，而弟弟蘇紫雲為國防安全研究院國防戰略與資源研究所所長。由於中國網友不懂民主國家制度與尊重各自的政治喜好，時常在「Threads」提出令人提笑皆非的問題。有網友就拿日前黃智賢替黃偉哲背書「黃偉哲只要幹了柯文哲的事情，我絕對說關的好、關到滿，就算他是我的哥哥！因為他如果做了柯文哲的事情，他背叛了人民，背叛這個社會，關好關滿剛剛好而已！如果有人有黃偉哲貪汙腐敗的任何資料，直接提告，直接按鈴申告，不要客氣好不好！」暴露兩人關係不會因為政治立場相左而有任何影響。請繼續往下閱讀...對此網友紛紛熱心提供答案，「黃偉哲：不知道欸，選市長吧」、「一個當市長，一個當節目主持人吧」、「猜你在找：黃偉哲一家」、「感情好的很，一個被罵另一個就會出來開噴」、「政治立場是自由的，你只要不犯法，甚至你跑去中國大喊支持共產黨也不會怎樣」。     在 Threads 查看    ,https://news.ltn.com.tw/news/politics/breakingnews/5415548
雲林林內鄉擬普發3000元！ 地方質疑鄉長選前「合法買票」,政治,2026/04/25 15:03,劉姿言宣布研擬普發3000元現金，草案已送代表會，預計5月定期會審議。（記者李文德攝）雲林林內鄉長劉姿言今（25）日在模範母親表揚活動宣布，因應國際情勢擬普發鄉內每人3000元，草案將於5月定期會審議，最慢年底發放。不過也被質疑現階段鄉長已表態爭取連任，此措施在選前，有「合法買票疑慮」。劉強調，該案需經代表會審議通過後才會辦理，沒任何買票或政治操作的意思。無黨籍的劉姿言擔任本屆鄉長時，2024年曾有部分鄉民提起罷免案，雖成功通過第一階段連署，但因二階連署人數未達原選舉區選舉人總數10％以上，宣告罷免案不成立，而此次她將爭取連任，但民進黨提名現任縣議員、前鄉長張維崢回鍋參選，對劉姿言連任之路有不小壓力。請繼續往下閱讀...今天鄉內模範母親表揚活動上，劉姿言宣布將普發鄉民每人3000元生活慰助金。她表示，因應國際情勢及物價上漲，希望與鄉親共同面對經濟壓力，因此不影響鄉內各項基礎建設下普發。經過財政盤點後，已將普發3000的草案在上週送交鄉民代表會，預計5月7日後的定期會將排審，後續會依照審議結果辦理後續作業。劉姿言指出，近年來公所對於各項經費撙節開支、能省則省，讓鄉庫內有4億多元的自主財源，屆時普發現金預計將有超過1.6萬名鄉親受惠，總支出金額將近5000萬元，如草案通過，第二階段的墊付案也如期通過，就會進行後續作業。最慢年底前發放完畢。消息一出，地方反應兩極。有民眾表示，部分外縣市鄉鎮有普發現金，對林內可說是小確幸；不過有民代指出，此政策在選前提出，加上鄉長要競選連任，恐難免引發外界聯想，若否決恐被質疑阻擋民眾福利，審議時恐騎虎難下；鄉代會主席許林玉琴表示，提案時機確實較敏感，不過仍需要待正式開議後討論。劉姿言回應，該案需經代表會審議通過後才會辦理，與選舉無關，並沒有任何買票或政治操作的意思，不希望把事情政治化。    ,https://news.ltn.com.tw/news/politics/breakingnews/5415625
NCC將陷「零委員」狀態新iPhone新機審查受阻 王鴻薇批情勒,政治,2026/04/25 14:43,國民黨立委王鴻薇。（資料照）國家通訊傳播委員會（NCC）3位現任委員將於7月任期屆滿，如行政院未能提名人選並經立法院同意通過，屆時NCC恐陷「零委員」，NCC官員則稱若無法克服NCC依法進行型式認證審查程序，iPhone恐怕都要面臨無法引進台灣的窘境。對此，國民黨立委王鴻薇今批「情勒」，NCC竟然把iPhone上市成為執政黨政治工具，並向社會施壓，已造成各界反感。NCC共配置7名委員，其中4人任期到2024年7月31日止，行政院2度提出人選名單，都未獲得立法院通過，缺額懸缺迄今。委員會議出席未過總額半數依法無法做出決議，目前暫以「諮議會議」消化部分可處理案件。然而，現任3名委員，即代理主委陳崇樹、委員王正嘉及王怡惠，任期將在今年7月31日屆滿，若委員提名進度遲未推進，NCC委員數恐掛蛋，連諮議會議都開不了，無法祭出行政處分，所有業務將停擺。請繼續往下閱讀...NCC官員日前稱今年不管是新上市的iPhone還是其它品牌進口的新手機或其它新款射頻器材，若無法克服NCC依法進行型式認證審查程序，恐怕都要面臨無法引進台灣的窘境。王鴻薇今表示，NCC又來情勒了。從iPhone16上市開始，每年差不多時間，NCC都會用蘋果產品上市來情緒勒索威脅國人，其中理由更是千奇百怪，包括預算、人事等，但是每年到了要上市，就各種鬼轉開脫，每一次都被國人譏笑，沒有例外。王鴻薇說，NCC一再當放羊的孩子，狼來了到底要喊幾次。兩天前，又出來放消息，說因為人事審查的關係「iPhone新機審查受阻今年恐無法登台」可能是之前太難看，行政院長卓榮泰留了後路，先說會盡力但坦言沒有十足的把握。王鴻薇回顧NCC過去的說法。iPhone16上市前威脅，因委員出席人數不足無法開會，連帶影響iPhone16上市時程。強逼立法院通過人事案；結果是人事案未通過，iPhone16如期上市。去年她已經說了，NCC就是「最大詐騙集團」，這種慣於用手機上市問題來向社會施壓，已經造成各界的反感，讓國人清楚，NCC竟把iPhone上市成為執政黨政治工具。    ,https://news.ltn.com.tw/news/politics/breakingnews/5415580
又被罵！被民眾指「這貪污那個」 柯文哲受不了回嗆：證據拿出來,政治,2026/04/25 14:37,民眾黨創黨主席柯文哲。（資料照）民眾黨創黨主席柯文哲今早陪同宜蘭縣長參選人陳琬惠至三星市場掃街拜票時，被一名乘坐電動代步車的長者喊「這貪污的那個」。而柯文哲則忍不住回嗆：「貪污也要拿人的錢哪，你（證據）拿出來！」柯文哲與陳琬惠一行人，今早前進三星市場與攤商、採買民眾互動。陳琬惠見一名乘坐電動代步車長者後，熱絡上前問候，但民眾卻絲毫不領情，不僅表明不用問好，更將頭轉向柯文哲大罵「這就貪污那個」。遭到批評，柯文哲當下忍不住，立刻雙手抱胸回嘴：「貪污也要拿人的錢哪，你（證據）拿出來！」請繼續往下閱讀...針對柯文哲回嗆民眾「拿出證據」，網友紛紛留言表示：「笑死人，對著一般民眾喊證據拿出來」、「證據寫在你的起訴書跟一審判決書裡」、「把判決書砸在他臉上」、「被嗆貪污還有臉叫人拿出證據」、「他怎麼有臉回嘴？」     在 Threads 查看    ,https://news.ltn.com.tw/news/politics/breakingnews/5415571
吳怡農不放棄爭取台北市長提名昨開立「政治獻金戶」 沈伯洋反應曝,政治,2026/04/25 14:29,民進黨籍立委沈伯洋（左一）披掛出征台北市長呼聲高，不過最先表態要參選的壯闊台灣創辦人吳怡農昨（24）日宣布開立「擬參選人政治獻金專戶」，仍照節奏爭取黨內提名。沈伯洋今受訪說，黨內優秀人才多，中央會有成熟的機制做決定。（記者方賓照攝）民進黨籍立委沈伯洋披掛出征台北市長呼聲高，不過最先表態要參選的壯闊台灣創辦人吳怡農昨（24）日宣布開立「擬參選人政治獻金專戶」，仍照節奏爭取黨內提名。沈伯洋今受訪說，黨內優秀人才多，中央會有成熟的機制做決定。吳怡農昨於臉書發文說，黨內的提名程序還未完成，因此他照著既定節奏，做該做的事，但身為民進黨的一員，會尊重黨中央最後的決定，除非獲得徵召，否則不會開始接受捐款。他也說，若開始募款，將只接受線上刷卡、超商繳款及銀行 ATM 轉帳，並會即時公布所有收款紀錄，供大家隨時查詢。希望未來有更多夥伴會主動在競選期間公開每一筆收入、並詳實申報所有支出，一起落實透明政治；此外，更希望政府與監察院對於「陽光法令」的改革、「政治獻金」的規範，會有積極的作為，提升民主品質。請繼續往下閱讀...沈伯洋今出席松山慈惠堂母娘文化祭活動，受訪被問到吳怡農開設政治獻金專戶，是否有進入黨內提名名單內？沈伯洋說，民進黨優秀人才非常多，現在大家都在規劃怎樣才是對台北市最好的狀況，最後究竟提名誰，還是由黨中央、選對會，會有成熟機制來做決定。他也說，今天不管是誰要來選台北市長，我們身為台北市民都是希望台北能夠變得更好。    ,https://news.ltn.com.tw/news/politics/breakingnews/5415563
國民黨在台北市執政70年 沈伯洋：挑戰者更要謙虛聆聽市民,政治,2026/04/25 14:19,台北松山慈惠堂25日舉行「2026台北母娘文化季保民繞境嘉年華起駕儀式」，立委沈伯洋應邀出席並接受媒體採訪。（記者方賓照攝）民進黨籍立委沈伯洋披掛出征台北市長呼聲高，沈伯洋今（25）日與台北市長蔣萬安同台松山慈惠堂母娘文化季。沈伯洋會後受訪被問到蔣萬安是否是強勁對手？他說，國民黨在北市已經70年，民進黨一直以來身為挑戰者，更應該謙虛，多聆聽市民聲音。沈伯洋說，從1949年算起，國民黨在台北執政也有70年了，中間只有經歷短暫前總統陳水扁執政的時代，在這盤根錯節當中，國民黨一直都是台北的衛冕者，民進黨都一直是挑戰者的角色。請繼續往下閱讀...他說，身為挑戰者，更應該謙虛、多聆聽市民聲音，要知道如何反映市民的心聲，如何做更好的規劃，所謂的真善美，真就是要民主，善就是要照顧弱勢、顧人權，這樣才會有均衡的美，城市設計也應該是如此。而今天不管是誰要來選台北市長，身為台北市民，都是希望台北能夠變得更好。媒體問，過去台北市也有多任無黨籍市長，並非都是國民黨籍？沈伯洋補充，1996年台灣經歷民主轉型，有新的立院改選，到歷經總統直選，在這之前，台灣並沒有經歷真正的民主，而在1996年民主化後，大部分時間確實都是由國民黨在治理，民進黨要讓大家知道由他們來治理也是有期待感的，而民進黨的任務就是謙卑地面對人民的聲音，並說服人民。沈伯洋也透露與蔣萬安互動，雙方在拜廟過程有小聊一下，聊抬轎的動線，雙方也有握手致意。另外，他與蕭美琴則聊到小時候在這周邊生活的小故事。針對台北市政，沈伯洋說，城市規劃如同生態系，牽一髮動全身，交通阻塞與勞工政策、育兒政策也都會有關聯，今天要探討城市，要看整體生態如何設計，讓人民在這住的舒服，這也是台北市民期待的事。台北市向來資源豐厚，但不論公務員、教師都出現「脫北潮」，首都要如何留住人才是重點，台灣現在已經走向了世界，應該也要讓台北走向世界。他說，人口流失原因錯綜複雜，有時候不只是房價，交通也有很大的關係，所以我們應該全面地去盤點要怎樣讓人留在台北。沈伯洋今至松山慈惠堂出席母娘文化祭活動。（記者甘孟霖攝）    ,https://news.ltn.com.tw/news/politics/breakingnews/5415543
人權會訪查國有地迫遷7案 住戶控國家信用危機,政治,2026/04/25 14:05,國家人權委員會今天辦理「適足居住權下公有財產管理與迫遷議題系統性訪查」公聽會。（記者羅國嘉攝）過去常有政府收回國有地導致原居民迫遷情況，引發爭議，監察院國家人權委員會今日召開公聽會。人權會指出，受限預算，現階段優先針對華光、大觀等7個指標性案例進行訪查，預計12月完成報告。台灣人權促進會秘書長余宜家強調，聯合國公約已明示居住權保障不以合法為前提，政府不應以「違法」為由直接拆遷。大觀住戶則控訴，政府層層卸責已形同「國家信用危機」。國家人權委員會今天辦理「適足居住權下公有財產管理與迫遷議題系統性訪查」公聽會。國家人權委員會指出，由於委員會去年預算遭刪，此次辦理系統性訪查，在整體預算有限情況下，現階段僅能先就歷次《兩公約》國際審查委員所關注公有財產管理7個案例（華光社區、台北臥龍街、板橋大觀社區、蟾蜍山聚落、新店瑠公圳、三峽龍埔里劉家及樂生療養院）進行系統性訪查。請繼續往下閱讀...人權會表示，系統性訪查主要係就制度性、系統性問題提出建議，並非探討個案違失。未來如預算較為充足，將持續就更多迫遷相關個案與類型進行訪查，逐步擴大制度檢視範圍，作為後續政策與法制檢討參考。人權會委員田秋堇也說，後續將於7月前辦理深度訪談成果初稿說明會、11月舉辦成果說明會，及12月完成系統性訪查報告書。另也期待立法院順利通過總統賴清德提名的人權委員，才有辦法繼續運作。公聽會現場，板橋大觀社區住戶裴女士痛陳，政府在處理過程中未進行社會調查，忽視其低收入戶及當時未成年等弱勢身分，導致救濟機制受限。她質疑，居民居住在先，政府事後才將土地登記為國有，卻反指居民占有更要求補償，此舉嚴重侵害私有財產權，形同「國家信用危機」。她批評中央與地方單位，如國防部、財政部層層卸責，讓住戶在法庭與行政處置上長期承受不公平對待。台灣人權促進會秘書長余宜家指出，「與法不合」僅是行政狀態，並非犯罪，政府直接採取拆遷作為是錯誤觀念。根據聯合國公約第四號一般性意見已明確說明，居住權與使用權的保障不以合法為前提，居住與占用仍應受到保障。「家」在政府眼中或許只是一間房子，但對居民而言是完整生活空間，政府應負起保障「家的權利」的責任，而非僅以清除建物為處理方式。人權會委員田秋堇說，後續將於7月前辦理深度訪談成果初稿說明會、11月舉辦成果說明會，及12月完成系統性訪查報告書。另也期待立法院順利通過總統賴清德提名的人權委員，才有辦法繼續運作。（記者羅國嘉攝）    ,https://news.ltn.com.tw/news/politics/breakingnews/5415549
黃敏惠爭取核定嘉義輕軌建設  卓榮泰：如政院版《財劃法》通過更能努力,政治,2026/04/25 13:59,行政院長卓榮泰致詞回應，嘉義輕軌建設要依照均衡台灣、軌道專案去處理，如政院版《財政收支劃分法》通過更能努力。（記者王善嬿攝）行政院長卓榮泰今由運動部政務次長黃啟煌等人陪同視察嘉義市西區全民運動館，嘉義市長黃敏惠致詞時再次呼籲中央早日核定補助「嘉義大眾捷運系統藍線建設計畫（輕軌藍線）」；卓榮泰回應，須從均衡台灣以及軌道專案處理，《財政收支劃分法》修正後中央財政能力與地方拉近，未來整個台灣還有幾千億元軌道建設正在規劃，常年預算難支應，還要與主計單位討論因應，未來如果政院版《財劃法》通過就更能努力。黃敏惠今致詞時說明嘉市推動運動成果，接著話鋒一轉提到，去年立委林倩綺曾在立法院質詢，卓院長曾表示中央願意支持工程費372億元、地方負責用地費，拜託院長成全、趕快啟動。請繼續往下閱讀...黃敏惠說，嘉義是全台最早台鐵、林鐵、糖鐵3鐵共構城市，未來嘉義輕軌建設串聯台鐵、林鐵、糖鐵、高鐵將形成5鐵共構，不只是區域建設更是國家建設，希望不分黨派，尤其現在經濟、科技發展加上台灣力量在全世界各地被尊重，中央與地方和諧攜手合作會更好。卓榮泰聽取簡報後正要走出會場時，黃敏惠將嘉義輕軌建設計劃資料交給卓榮泰，隨後陪同卓榮泰邊走邊談離場，原定的視察內部場館行程則臨時取消。她會後受訪說，嘉義輕軌建設在交通部1999年完成嘉義高鐵站輕軌聯外系統可行性報告，行政院2005年核准交通部所報「高鐵嘉義站聯外BRT執行方案」，行政院核復事項已明確指示「請貴部（即交通部）參考路廊運量之成長情形，再適時提出輕軌計畫」，現在此路廊台鐵及高鐵1年超過1400萬人次遊客，需求量非常大，因此向卓院長提醒，這是本來就規劃的高鐵、台鐵軌道路網，希望行政院正視此問題。她表示，全國第一期高鐵站唯一沒有軌道運輸就是嘉義站，這樣不做的話，嘉義人情何以堪，「沒有輕軌，就沒有選票」；國民黨執政、民進黨執政她都有提，現在要延伸加入軌道建設，嘉義輕軌建設早就應該做。嘉義市長黃敏惠（左）將嘉義輕軌建設的資料遞交給行政院長卓榮泰（右）。（記者王善嬿攝）黃敏惠拿出行政院公文，強調中央應兌現當年承諾。（記者王善嬿攝）    ,https://news.ltn.com.tw/news/politics/breakingnews/5415545
出席餐會與李四川同台 侯友宜：交棒給「踏實做事」的人,政治,2026/04/25 13:45,新北市長侯友宜（右二）與國民黨新北市長參選人李四川同台出席城市午餐祈禱會。（記者翁聿煌攝）國民黨新北市長參選人李四川25日出席「新北城市祈禱餐會」，與新北市長侯友宜合體同台，侯友宜致詞時強調，新北未來需要一位「踏實做事」的領導人，要把棒子交給做實事的人，讓城市繼續邁向偉大。李四川表示，自己是做工程出身，最了解「踏實做事」的價值，也深知市政建設需要一步一腳印的累積，他特別感謝新北各區聯禱會及眾多教會長期以來對弱勢族群、孩童課業的無私奉獻，為新北注入安定的力量。請繼續往下閱讀...李四川承諾，未來接下重任，定會延續市府團隊的良好基礎，秉持「少說話、多做事」的務實精神，結合宗教界愛的力量，持續推動新北向前發展，為市民打造平安喜樂的安居城市。李四川中午也出席新北市幼托職業工會會員大會。李四川在致詞時感謝工會夥伴長期以來協助政府推動各項托育服務，無論是公辦還是私立的托嬰托育機構，都是建構社會完善托育網不可或缺的重要力量。面對少子化的挑戰，李四川直言，要讓年輕人願意生養，政府必須努力扛起更多責任。他承諾，未來會透過公私協力、完善托育環境，減輕年輕父母的負擔，目標是把新北市打造成一個讓年輕世代「能安心生、安心照顧」的友善環境。國民黨與民進黨新北市長參選人李四川（右）與蘇巧慧（左）均出席城市午餐祈禱會。（記者翁聿煌攝）    ,https://news.ltn.com.tw/news/politics/breakingnews/5415524
