Title,News_Type,date,content,url
鳳山區大排水溝發現男屍  檢警將相驗釐清死因,社會,2026/07/16 10:42,王男陳屍鳳山區一處大排水溝，檢警將相驗釐清死因。（民眾提供）高雄市64歲王姓男子長住長照中心，昨天下午請假外出要找姊姊，不料今天上午被民眾發現陳屍鳳山區一處大排水溝，頭部有撞擊外傷，警方研判王男行經不慎跌落排水溝死亡，檢警將相驗釐清死因。鳳山警分局南成派出所今天上午接獲民眾報案，發現一名男子倒臥鳳山區南華一路與臨海路口附近大排水溝內，警方獲報後立即趕赴現場，會同消防局救護人員到場，警消先將男子救上岸，經救護人員確認男子已明顯死亡。請繼續往下閱讀...警方初步調查，死者王姓男子（64歲）住在一間長照中心10多年，昨天下午向長照中心請假外出要去找姊姊，不料一夜未歸，長照中心發現失聯後，依規定報請警方協尋，經長照人員到場指認，確認長照中心住民。警方勘查命案現場，發現王男倒臥於大排水溝內，頭部有撞擊外傷，手腳擦挫傷，現場水深約30公分，初步未發現外力介入情形，研判疑似不慎跌落大排水溝造成意外死亡，同步調閱周邊監視器影像，進一步釐清事發經過。    ,https://news.ltn.com.tw/news/society/breakingnews/5507014
黑幫租民宅設洗錢水房  贓款4度轉手再匯境外,社會,2026/07/16 10:40,警方逮捕李姓首腦旗下幹部成員共18人，並查扣車輛、贓款、黃金首飾、名錶等贓證物。（南打中心提供）刑事警察局南部打擊犯罪中心（南打中心）今日宣布偵破黑幫洗錢水房案，嫌犯租用民宅經營洗錢水房，清查被害人多達35人，財損金額逾2000萬元，警方發動三波查緝行動，逮捕李姓首腦旗下幹部成員共18人，法官裁定控盤首腦李男及水房幹部王男2人羈押禁見。南打中心是在偵辦假投資詐騙案過程溯源追查不法金流，發現有黑幫分子涉嫌租用民宅經營洗錢水房，經掌握犯嫌真實身分後，立即召集相關單位共組專案小組，報請高雄地檢署檢察官許紘彬指揮偵辦。請繼續往下閱讀...專案小組深入追查發現，該集團由控盤首腦李男負責與境外機房接洽，當接收被害人遭詐騙匯款信息後，以製造斷點方式指揮旗下車手、收水手分成四小組，分別在公園、旅館、停車場等偏僻處所，逐層傳遞贓款，以躲避查緝；經由4次轉手後，贓款最終匯集至李嫌的洗錢水房，李嫌再透過虛擬貨幣將贓款悉數轉移至境外機房，以賺取高額報酬。專案小組經過數月抽絲剝繭，釐清集團完整犯罪模式，見時機成熟，於李姓主嫌等人下榻旅館一舉緝捕到案，並查扣車輛、贓款、黃金首飾、名錶等贓證物，警方共發動三波查緝行動，查獲李姓首腦旗下幹部成員共18人，清查被害人達35人，財損金額逾2000萬元，全案詢後依涉嫌刑法加重詐欺罪、組織犯罪防制條例、詐欺犯罪危害防制條例、洗錢防制法等罪嫌移請高雄地檢署偵辦，其中李姓主嫌及王姓水房幹部2人經法官裁定羈押禁見。刑事警察局呼籲民眾，切勿聽信網路假冒名人或財經專家鼓吹點選來路不明網站進行投資，可撥打110及165反詐騙諮詢專線或搜尋打詐儀錶板查證，避免上當受騙，也提醒網路廣告、社團、群組的徵才訊息，應仔細詢問查證，切勿被利益誘惑，避免淪為詐騙共犯。刑事警察局南部打擊犯罪中心偵破一起黑幫洗錢水房案，警方查扣犯嫌證物。（南打中心提供）    ,https://news.ltn.com.tw/news/society/breakingnews/5507004
北市士林死亡車禍！接體車出勤載遺體 撞死7旬騎士,社會,2026/07/16 10:36,邱男駕駛接體車與機車騎士擦撞。（記者王冠仁翻攝）32歲邱姓男子在某殯葬業任職，他今天清晨駕駛接體車要前往接遺體，行經台北市士林區一處路段時右轉，疑因疏於注意路況，與同路同向的七旬賴姓機車騎士擦撞，賴被撞倒地，送醫後宣告不治。警方除了將邱依過失致死罪嫌送辦，也正在進一步釐清。警方調查，邱姓男子今天清晨6時許，駕駛接體車要前往新北市淡水區接遺體，他沿台北市士林區中正路第2車道東向西行駛右轉時，與同路同向其他車道的74歲賴姓機車騎士發生碰撞。賴被撞倒地，他雖然有戴安全帽，但因撞擊力道猛烈，導致頭部受到重創，送醫救治後仍宣告不治。請繼續往下閱讀...警方說，邱在車禍後一度嚇得說不出話，警方對他進行酒測、毒品唾液快篩，初步排除他酒駕、毒駕，警方研判他可能認為清晨時刻路上車少，因此疏於注意路況才釀禍。士林分局呼籲，駕駛人行駛於道路，務必遵守標誌、標線、號誌之指示，行經施工路段應減速慢行，右轉車應提前駛入外側車道，以維護自身及其他用路人之行車安全。邱男駕駛接體車與機車騎士擦撞。（記者王冠仁翻攝）    ,https://news.ltn.com.tw/news/society/breakingnews/5506994
女騎士遭曳引車輾斃 ​魂斷火葬場前,社會,2026/07/16 10:34,曳引車將騎士輾斃。（記者徐聖倫翻攝）新北市三峽區今清晨6時許發生死亡車禍，41歲陳姓女子騎機車沿介壽路3段往三峽方向行駛，行經火葬場附近時，機車後車尾突遭後方由59歲葉姓男子駕駛的曳引車碰撞，陳女當場連人帶車倒地，不幸遭曳引車沉重車輪輾過，下半身遭受大面積撕裂重創。消防救護人員趕抵現場時，確認陳女已明顯死亡、未送醫。​三峽警分局獲報後，火速派遣交通分隊及轄區橫溪所員警到場，拉起封鎖線進行事故測繪並管制交通，同時指派鑑識人員到場採證。警方初步調查，肇事曳引車當時為空車、未載貨，暫時排除超載可能。請繼續往下閱讀...​經檢測，葉男酒測值為零，亦排除毒駕，警方目前已調閱路口監視器以釐清確切肇因，訊後將依涉嫌過失致死罪將葉男移送法辦。警方將曳引車司機送辦。（記者徐聖倫翻攝）    ,https://news.ltn.com.tw/news/society/breakingnews/5506992
老翁困家門外尿失禁！重聽妻睡死 警鐵砂掌「敲門17分鐘」解危,社會,2026/07/16 10:34,老翁受困門外數小時，身體不適。（民眾提供）台中市潭子區前晚發生一起失智老翁半夜受困家門事件，86歲林姓老翁因失智半夜外出，未攜帶鑰匙，無法進入家中，無助地坐在門外樓梯枯等數小時，出現尿失禁與冒汗脫水情形，警方半夜到場大力敲門，老翁妻子才驚醒，結束一場受困門外烏龍事件。警方指出，前天凌晨接獲潭子區勝利路某社區大樓6樓樓梯口有老人受困門外，當時擔服巡邏勤務的警員劉采婷、鄭傑夫獲報後立即趕赴現場，林翁因外出未攜帶鑰匙，無法進入住家，社區主委表示，老翁與妻子及孫子同住，研判家中應有人在內，惟住家門鈴故障，警方多次敲門仍無人應答，聯繫家屬電話亦未果，一度陷入僵局，警方持續大力敲門17分鐘，終於喚醒在屋內的高齡妻子，老婦開門見警方站在門外時相當驚訝表示，丈夫第一次發生這樣的事情，未察覺老翁外出，因她本身患有重聽，直到走出房門如廁，才聽見有人敲門。請繼續往下閱讀...老翁已受困多時，出現全身冒汗脫水及尿失禁情形，警方隨即通報救護人員到場評估，確認其身體狀況沒問題，由家屬陪同返家休息，順利結束這場驚險過程。大雅分局呼籲，家中若有高齡長者，應多加留意其日常動向，並確保通訊設備及門鈴功能正常，以避免類似情形發生，共同守護長者安全。    ,https://news.ltn.com.tw/news/society/breakingnews/5506995
失聯移工攜毒遇盤查狂奔 北市警負傷跑百米逮人,社會,2026/07/16 10:28,在逮捕過程中高男極力扭打抗拒，導致3名員警手腳擦挫傷。（記者鄭景議翻攝）35歲越南籍高姓男子，本月7日深夜搭乘計程車遇警盤查，因本身是失聯移工又攜毒，心虛下當街狂奔企圖逃逸，台北市警局大安分局員警見狀隨即展開百米追逐。在逮捕過程中高男極力扭打抗拒，導致3名員警手腳擦挫傷，所幸員警忍痛負傷，強勢將他壓制逮捕，當場在身上起獲第2級毒品安非他命。全案詢後依法將高男移送台北地檢署及相關機關偵辦。大安分局瑞安街派出所警員林建希、卓裕偉、張庭禎，7日凌晨0時許在轄區執行酒測勤務，期間攔查一部計程車時，敏銳察覺坐在後座的2名越南籍男子眼神閃爍、神情異常緊張。員警直覺有異，隨即依法請2人下車配合身分查證。請繼續往下閱讀...不料，高男腳剛著地便突然推開員警，拔腿朝路口瘋狂奔逃。3名員警隨即在後方全力追緝，追逐約百公尺後順利在巷弄內將他合圍攔下。高男為了脫身瘋狂扭打掙扎、極力抗拒執法，導致3名追捕員警的手部、腳部受到多處擦挫傷與抓傷，所幸員警忍痛奮不顧身，合力強勢將高男反鎖上銬，送醫治療後都無大礙。警方隨後對高男實施附帶搜索，當場在他的左側褲口袋內，起獲第2級毒品安非他命1包、分裝勺1支及吸食器1組等證物。經警方系統查證，證實高男早已是逾期停留的失聯移工。高男在偵訊時坦承持有並吸食毒品，警方詢後依違反毒品危害防制條例、入出國及移民法，以及妨害公務等罪嫌，將高男移送台北地檢署及相關機關偵辦。大安分局瑞安街派出所警員林建希、卓裕偉、張庭禎。（記者鄭景議翻攝）    ,https://news.ltn.com.tw/news/society/breakingnews/5506983
檢方抗告成功！ 中聯油脂總經理2000萬交保遭撤銷,社會,2026/07/16 10:27,中聯油脂總經理余凌冲日前獲2000萬元交保。（資料照）中聯油脂公司大豆沙拉油驗出一級致癌物「苯駢芘」超標，衝擊全台食安，涉嫌違反食安法等罪的中聯油脂總經理余凌冲，日前雖獲台中地院裁定2000萬元交保，但檢方當庭提起抗告，台中高分院審理後，認定檢察官抗告有理由，今天撤銷原交保裁定，全案發回台中地院重新裁定。台中高分院指出，余凌冲身為中聯油脂公司總經理，居於企業決策核心，本案涉及犯罪態樣廣泛，不僅危害食品衛生管理，更對社會食安造成重大衝擊。隨著偵辦深入，余未來將面臨龐大的民、刑事責任，加上其長年深耕食品業界，擁有人脈與影響力，對涉案共犯及相關證人仍具有相當影響能力。請繼續往下閱讀...而原審也認定其具有高度逃亡動機及能力，在此情況下，僅以2000萬元具保、限制住居、限制出境出海及定期向警方報到等替代羈押措施，是否足以確保後續偵查程序順利進行，確有疑義。高分院並認為，檢察官已具體說明余凌冲有湮滅、偽造、變造證據，以及勾串共犯、證人的羈押原因與必要性，但原審裁定卻未逐一說明檢方提出的事證，何以不足以構成羈押必要性，即逕自認定無羈押必要，裁定理由顯有欠備，因此撤銷原裁定，發回台中地院重新裁定。    ,https://news.ltn.com.tw/news/society/breakingnews/5506990
國3南向74.3公里連環車禍 5車撞在一起 2人送醫幸無大礙,社會,2026/07/16 10:16,國道3號南向74.3公里（高原路段）處，今晨發生5車相撞、2人送醫的連環車禍。（警方提供）國道3號南向74.3公里（高原路段）處內側車道，今天清晨7點14分左右，發生5車相撞的連環車禍，其中胡姓（女、97年次）駕駛胸口疼痛；蔡姓（男、67年次）駕駛頭部撕裂傷，2人皆意識清楚，送位在龍潭區國軍桃園總醫院急救，幸無大礙，現場於7時51分排除，詳細肇事原因有待警方進一步釐清。警方初步調查，該起連環車禍疑似徐姓（67年次）駕駛轎車行駛內側車道時，疑因未保持行車安全距離撞擊前方李姓（81年次）駕駛之轎車，導致後方3輛由胡女（97年次）、蔡男（67年次）、楊男（73年次）等3位駕駛的車輛煞車不及，5車撞在一起。請繼續往下閱讀...國道警方表示，高速公路事故最常見的肇事因素，就是未保持安全距離，除處罰3000至6000元，若因而肇事致人重傷或死亡，將吊扣或吊銷駕照。    ,https://news.ltn.com.tw/news/society/breakingnews/5506965
桃園大園鐵皮工廠清晨火警 幸無人傷亡,社會,2026/07/16 10:06,大園區長發路1處鐵皮建築工廠清晨發生火警，黑煙一度直衝天際。（圖擷取自網路）桃園市大園區長發路1處4層樓鐵皮建築的工廠，清晨5點半發生火警，消防隊獲報動員趕往救援，到6點多撲滅火勢，幸無人員受傷或受困，但有民眾上午起床出門上班時，遠遠看到黑煙直衝天際，嚇了一跳，上網PO文祈祝：「希望沒什麼事！」消防隊員表示，該局勤務指揮中心清晨5點34分接獲工廠火警報案，緊急派遣消防隊員68名、消防車等救災車輛28輛前往救援，於清晨6點25分撲滅火勢；發生火警的地點為工廠3樓，是已經沒人使用的廠房，內部還存放塑料半成品，燃燒面積約5平方公尺，幸未造成人員受傷或受困，至於起火原因、財物損失等，都仍待消防局進一步調查。    ,https://news.ltn.com.tw/news/society/breakingnews/5506952
豬大骨摻農藥毒死鄰居愛犬 彰化男判罰21萬+拘役30天,社會,2026/07/16 10:05,楊男用納乃得毒死鄰居的黑狗，被判罰21萬，拘役30天。示意圖。（資料照）彰化楊男與鄰居交惡，看鄰居十分疼愛自己養的一隻黑狗，竟然使出「毒狗計」，他去年2月間把農藥納乃得，混入豬大骨，再包於塑膠袋內，丟在鄰居家門前廣場，結果黑狗跑來舔、啃，不久一命鳴呼。楊男遭依違反《動物保護法》起訴，法院判處拘役30日，併科罰金21萬元。鄰居見愛犬慘死，悲痛萬分報警，一開始就懷疑楊男搞鬼，但楊男否認，但經調閱監視器發現，楊男在案發前放一裝有東西的塑膠袋，此「毒食包」立即引來黑狗食用，結果隔天黑狗就暴斃。請繼續往下閱讀...楊男因違反《動物保護法》，經檢察官提起公訴，該案採協商判決，法官認為，被告犯非法宰殺動物罪，處拘役30日，併科罰金新臺幣21萬0000元。若不想被關，30天拘役得罰9萬元。全案仍可上訴。納乃得（Methomyl）是一種劇毒的氨基甲酸酯類廣譜殺蟲劑。主要用於防治蔬菜、玉米與果樹上的鱗翅目幼蟲（如斜紋夜蛾）與蚜蟲。因其對人畜具高度神經毒性，屬於管制農藥。    ,https://news.ltn.com.tw/news/society/breakingnews/5506948
彰化知名鴻詳家具300坪鐵皮倉庫狂燒9小時 損失數千萬元,社會,2026/07/16 09:21,彰化縣知名的鴻詳家具鐵皮倉庫傳出火災，火勢一發不可收拾。（民眾提供）彰化縣福興鄉知名的鴻詳家具倉庫，昨天（15日）晚間傳出火災，由於內部都是家具，加上是鐵皮倉庫，在狂燒9小時到今天（16日）清晨5點才撲滅，300坪鐵皮倉庫與大批家具全毀。彰化縣消防局長施順仁表示，因為起火點是2樓，內部易燃木製家具，濃煙竄升到3樓，必須出動挖土機進行倉庫破壞，才能往內射水，目前仍在監控避免復燃。施順仁指出，這起火災發生在昨天晚間8時許，發生地點是位於福興鄉秀厝一街的鴻詳家具倉庫，佔地300坪，倉庫挑高設計，內有3層樓高，起火點在2樓，保全發現火災後通報，現場也有2名移工試著滅火，但因為初期滅火失敗，移工也因輕微嗆傷送往彰濱秀傳醫院。請繼續往下閱讀...由於初期滅火失敗，消防局派出各式消防車23輛、救護車3輛、無人機1台、救災機器人2台，消防人員54名前往搶救，到場後發現，倉庫都是濃煙，火星讓木家具全面燃燒，擔心熱度造成鐵皮塌陷，人員只能從屋外射水降溫，但效果有限，最後只好出動挖土機破壞倉庫，終於在今天凌晨1點多控制火勢，清晨5點撲滅，並未造成延燒。福興鄉長蔣煙燈表示，在地經營將近50年的鴻詳家具，可說是彰化縣規模數一數二的家具業者，第一代侯金城從雕刻轉入家具業，具有生意頭腦的妻子更是銷售高手，在夫妻倆打拼下，兩個兒子侯志堅、侯志淵的成功接棒，鴻詳成為自有工廠、展示場的完整體系，近年也從實體店面走入網路行銷，除了傳統家具也有組合家具，也接客製化訂單。二代也積極參與社團與公益，在地方傳為佳話。彰化縣知名的鴻詳家具，因為鐵皮倉庫加上大批木製家具，火災後付之一炬。（民眾提供）彰化縣知名的鴻詳家具鐵皮倉庫傳出火災，火勢一發不可收拾。（民眾提供）彰化縣知名的鴻詳家具，其鐵皮倉庫傳出火災，全數付之一炬。（民眾提供）彰化縣知名的鴻詳家具鐵皮倉庫傳出火災，火勢一發不可收拾。（民眾提供）彰化縣知名的鴻詳家具鐵皮倉庫傳出火災，火勢一發不可收拾。（民眾提供）彰化縣知名的鴻詳家具，其鐵皮倉庫傳出火災，全數付之一炬。（民眾提供）彰化縣長王惠美、消防局長施順仁昨晚立即趕抵火災現場，了解情況。（民眾提供）彰化縣知名的鴻詳家具鐵皮倉庫傳出火災，火勢一發不可收拾。（民眾提供）彰化縣知名的鴻詳家具鐵皮倉庫傳出火災，火勢一發不可收拾。（民眾提供）    ,https://news.ltn.com.tw/news/society/breakingnews/5506905
教授砍死連襟！ 音樂教室宣布暫停營業 家長湧入留言悼念,社會,2026/07/16 09:04,在發生凶殺案後，音樂教室宣布將暫停營業至7月24日，許多家長也在臉書粉專底下留言哀悼。（資料照）陽明交大美籍教授林詩淳14日下午到新竹市三民路音樂教室涉嫌砍死紀姓連襟，雙腿被警方連開4槍後落網送醫，行凶動機仍待釐清。發生凶殺案的音樂教室在臉書粉專宣布暫停營業至24日，不少家長留言哀悼。如今變成凶案發生地點的音樂教室是林詩淳的妻子娘家所經營，在新竹市深獲好評，原本由林詩淳岳父母經營，後來由林詩淳妻子的姊妹接手，並由妹夫紀男擔任店長。警方初步掌握，林詩淳與紀姓連襟早有嫌隙，行凶動機疑似是因為音樂教室經營權和家產分配問題而起。請繼續往下閱讀...在事件發生過後，音樂教室在臉書粉絲專業宣布將暫停營業至7月24日，音樂教室強調：「請各位家長及同學放心，教室將持續關心每位學生與家長的需求，並妥善安排後續課程及相關事宜。如有任何最新消息或營運調整，我們將第一時間公告並通知大家。感謝各位家長、同學的理解、體諒與支持，敬請大家留意後續通知。」許多家長與網友也在貼文底下留言悼念：「謝謝紀老闆對學生及家長的付出，請節哀。」、「謝謝紀老闆，曾因展演需求接洽紀老闆租借鋼琴，專業貼心的服務銘記在心，也請家人保重。」、「紀先生人這麼好真的是...聽到好難過！加油！節哀保重。」、「謝謝紀老闆對羊角音樂的幫助，他是個很和善的人。請家人節哀，請保重。」    ,https://news.ltn.com.tw/news/society/breakingnews/5506868
暗槓民眾申辦「良民證」費17萬元 中和警判刑1年5月獲緩刑,社會,2026/07/16 09:03,新北地院。（資料照）時任新北市政府警察局中和分局防治組的陳姓警員，在負責辦理民眾申辦「良民證」（警察刑事紀錄證明）業務期間，因不堪經濟壓力，利用職務之便，將代收的款項據為己有，在長達1年3個月的期間內，侵占金額達17萬餘元，新北地院合議庭審酌陳員在偵審時坦承犯行、已全數繳回犯罪所得，減刑後依貪污治罪條例中的「侵占非公用財物罪」，判他1年5月徒刑，緩刑5年，褫奪公權1年，可上訴。檢方調查，陳員自2024年7月起至2025年10月間，擔任中和分局防治組警員，負責受理民眾申辦良民證、代收每份100元（同一次申請2份以上，第2份起每份20元）的證書費，及製發收據、按日轉交證書費給出納人員等業務。請繼續往下閱讀...怎料，陳員因個人經濟壓力，自2024年7月起，在收取民眾繳納的證書費後，不開立收據，也未將款項呈交出納而據為己用，直到2025年10月初，新北市警局發現中和分局民眾領取申辦良民證的比例偏低，派員稽查，陳員犯行才曝光；在東窗事發後，陳員已先後將侵占款項全數繳回。合議庭審酌，陳員於偵、審中均自白犯罪，並已主動繳回全部犯罪所得，依貪污治罪條例規定予以減刑。此外，陳員侵占財物價值非鉅，亦未對於公務機關運作或財務狀況造成重大影響，犯罪情節尚屬輕微，若依法減刑後仍須判處2年6月以上徒刑，不免「情輕法重」，客觀上足以引起一般同情，再依刑法第59條「情堪憫恕」條款遞減其刑。合議庭審酌，陳員身為警員，不思潔身自愛，知法犯法侵占公款，所為侵害國家權力的尊嚴與信用，並損及民眾對警察人員的期待與信任，更傷害其他恪盡職務的警員形象，但考量他犯後坦承犯行，並已自動繳回犯罪所得，素行及犯後態度均尚可等因素，判刑1年5月，並宣告緩刑5年以啟自新。    ,https://news.ltn.com.tw/news/society/breakingnews/5506882
塞車惹禍？國1彰化交流道大貨車、轎車3連撞零件噴飛,社會,2026/07/16 08:29,轎車車尾遭大貨車撞爛。（警方提供）國道1號彰化交流道昨天（15日）晚間發生3車連撞事故，1輛大貨車準備下交流道時，正好遇到前方從彰化市平面道路塞回國道匝道的車流，不料大貨車直接猛烈撞擊前方2輛轎車，零件瞬間噴飛，事故還造成其中1名轎車駕駛受傷，事故發生原因由國道警方釐清中；有用路人直指該處匝道經常性塞車，還曾發生過多起追撞事故，平面道路交通號誌儀控須檢討改進。這起車禍事故發生在昨天晚間6點多，國道1號南下196公里彰化交流道匝道大塞車，此時1輛大貨車疑似未煞車狀態直接撞擊匝道緩慢前進的2輛轎車，3車連撞造成零件噴飛在國道主線車道上，後方駕駛趕緊閃避，險象環生。請繼續往下閱讀...該起事故造成3車分別受到程度不一的毀損，其中1輛轎車駕駛頭部受傷，由消防局救護人員送醫治療；3車駕駛酒測值均為0；國道警方初步調查疑似大貨車司機未保持安全行車距離釀禍。不過國道1號彰化交流道每逢上午上班與晚間下班時間經常性的大塞車，長期為用路人詬病，以往也曾發生過多起因匝道壅塞的連環追撞事故，有用路人直指是彰化市下匝道後的平面道路交通號誌紅燈過久，造成車輛回堵到國道匝道，平面道路的號誌儀控須加以改善。國1彰化交流道大貨車、轎車3連撞零件噴飛。（民眾提供）國1彰化交流道出口匝道經常性的塞車，長期為用路人詬病。（民眾提供）    ,https://news.ltn.com.tw/news/society/breakingnews/5506857
