Title,News_Type,date,content,url
國1五股匝道箱型車冒煙燒成火球 司機急停路肩逃命,社會,2026/04/16 14:24,監視器拍下箱型車起火。（記者徐聖倫翻攝）​國道1號南向五股入口匝道傳火燒車意外！50歲洪姓男子駕駛箱型今中午行經該處，車尾處突然竄出濃煙，洪男警覺有異，隨即靠右停往路肩，不料車輛下秒便陷入火海，現場烈焰沖天，所幸洪男及時逃生，未造成人員傷亡。​警方、消防今中午12許接獲報案，即刻派員趕抵，迅速封閉外側車道及路肩進行射水灌救，火勢在短時間內獲得控制，仍一度造成五股交流道回堵至平面道路。國道警局指出，現場已通報警廣及交控中心提醒用路人避開壅塞路段，詳細起火原因仍待消防局火調科鑑識。請繼續往下閱讀...警方呼籲，民眾上路前應落實車輛機件檢查，若行駛中發現異狀，應冷靜啟動方向燈、漸進式滑離車道停靠路肩；若車輛受困車道，務必於後方100公尺處擺放故障標誌，利用「1968APP」報案，人員應退至護欄外安全處所，以確保自身安全。車輛被燒得剩下骨架。（記者徐聖倫翻攝）    ,https://news.ltn.com.tw/news/society/breakingnews/5405928
新北鶯歌砂石車翻覆波及5車釀6傷  砂石車駕駛、乘客受困中,社會,2026/04/16 14:24,砂石車不明原因翻覆。（記者徐聖倫翻攝）新北市鶯歌區今下午發生嚴重車禍！一輛砂石車行經八德路2巷口時，因不明原因突然失控翻覆，整輛車橫臥路面，現場黃土散落一地、一片狼藉。警方、消防接獲報案即刻派員趕抵，砂石車內有駕駛、乘客受困，目前得知傷者達6人。​消防人員表示，現場傷者分別為5名大人及1名小孩，除了受困的2人其餘意識均清楚，全數送醫。砂石車車體嚴重變形，導致車內受困的2人還在救援中，消防局不敢掉以輕心，第一時間即預先啟動「大量傷病患機制」及「U1嚴重創傷受困機制」，統籌周邊醫療資源待命。請繼續往下閱讀...​目前新北市消防局已派遣1個大隊、1個中隊及8個分隊，共計18輛各式救援車輛、40名消防與醫護人員在場搶救。搜救人員正利用破壞器材嘗試切割車體，務求在最短時間內將受困者救出送醫，詳細事故原因及砂石車翻覆過程，仍待警方進一步調查釐清。砂石車翻覆波及其他5車。（記者徐聖倫翻攝）    ,https://news.ltn.com.tw/news/society/breakingnews/5405955
法務部今發布國家級報告 接軌國際分享廉政治理成果,社會,2026/04/16 14:21,"法務部今日發布「聯合國反貪腐公約」第三次國家報告，並以中、英文版方式，上傳在廉政署網站。（翻攝自廉政署網站）為了展現我國接軌國際的決心及彰顯推廣廉政治理的豐碩成果，法務部今日發布「聯合國反貪腐公約」（United Nations Convention against Corruption, UNCAC）第三次國家報告，並以中、英文版方式，上傳在廉政署網站「聯合國反貪腐公約專區」，歡迎國人上線閱覽。法務部指出，「聯合國反貪腐公約」是全球反貪腐治理的最重要國際準則，內容涵蓋貪腐行為的預防措施、促進透明與課責制度、健全打擊貪腐體系、加強國際合作，以及不法資產追回等5大重點。請繼續往下閱讀...我國自2018年公布首次國家報告並接受國際審查以來，持續以國際標準檢視自身，2022年率先全球發布第二次國家報告，逐步建立完整反貪腐體系。此次第三次國家報告的發布，更象徵台灣廉政治理邁入制度化階段。第三次國家報告共計3冊，分為第一冊基本資訊，將詳述我國反貪腐法制架構及組織體系、執行公約最佳實務，以及第二次國家報告國際審查結論性意見之執行情形。第二、三冊則為專題領域探討，針對公約內容進行討論。文中也積極回應第二次國際審查提出的30項結論性意見，並針對公約重點章節提出10項最佳實務作法，展現我國廉政治理的進步與創新。此次報告編撰作業由18位國內專家學者進行全面檢視，並邀請非政府組織（NGO）參與6場次審查會議。此外，我國將於今年8月24日至28日，邀請5位國際專家學者來臺參加「聯合國反貪腐公約」第三次國家報告國際審查會議，進一步接受國際檢視；展現台灣在非聯合國會員身分下，仍積極遵循國際規範，主動接受審查的高度承諾。未來，我國也持續將依循聯合國反貪腐公約規範及國際審查建議，持續提升國家整體廉政治理效能，並為國際反貪腐合作貢獻台灣力量。    ",https://news.ltn.com.tw/news/society/breakingnews/5405878
基隆籍漁船釣魚台外海起火沉沒！6移工獲救、台籍船長失聯,社會,2026/04/16 14:00,基隆籍「全漁6號 」漁船今天清晨在釣魚台東北方海域突然起火後瞬間沉沒，船上6名外籍船員落海後，被附近作業的「全漁36」救起，但台籍張姓船長失聯。海巡署獲報馳援派遣「桃園艦」（見圖）全速趕往現場，預計今晚10時抵達。（海巡署提供）基隆籍「全漁6號 」漁船今天（16日）清晨在釣魚台東北方海域突然起火後瞬間沉沒，船上6名外籍船員落海後被附近作業的「全漁36」漁船救起，均無大礙，但「全」台籍張姓船長仍失聯。海巡署獲報馳援派遣「桃園艦」全速趕往現場，預計今晚10時抵達，與日方展開海空聯合搜救失聯船長下落。海巡署指出，今天清晨5時許接獲通報，基隆籍「全漁6」漁船在釣魚台東北方約77浬處（屬日本搜救責任區內）突然發生火警；由於火勢猛烈，整艘船迅速沉沒。案發時，船上共有7名人員，其中6名外籍船員在沉船後幸運被附近作業的友船「全漁36」及時救起，均無大礙，但台籍張姓船長在船隻沉沒時並未隨員脫困，至今仍失聯。請繼續往下閱讀...火燒船發生後船長家屬焦急萬分，海巡署與救起船員的「全漁36」保持聯繫，並監控失事海域的洋流與浮標狀態，盼能尋獲失聯船長，同時也立即啟動緊急應變機制，通報國家搜救指揮中心，協調日本海上保安廳共同投入搜救作業。北部地區機動海巡隊則已調派千噸級「桃園艦」緊急出勤，正頂著風浪全速北上，預計將於今天晚上10時抵達事故現場，搜尋失聯船長。海巡署呼籲，近期海上氣候多變，漁船作業時應加強機艙與供電系統檢查，並提高航行警覺；若民眾在海上遇緊急狀況，應立即撥打海巡「118」免付費專線，爭取黃金救援時間。    ,https://news.ltn.com.tw/news/society/breakingnews/5405890
這招也行？「傳教士」當街攔：蓋教堂需要錢 7旬翁險噴60萬,社會,2026/04/16 13:39,7旬翁被「傳教士」當街攔稱蓋教堂需要錢，險噴60萬。（圖由警方提供）這招也行？1名7旬老翁在彰化市街頭遇到1位騎腳踏車的男子，對方自稱是傳教士，表示欲興建基督教教堂需要捐款，希望老翁能「奉獻」60萬元現金，信仰基督教的老翁竟信以為真，到郵局提領60萬元現金，行員發覺有異向警方通報，員警懷疑是「假捐款」詐騙，老翁始恍然大悟，驚呼「60萬元積蓄差點飛了」。彰化警分局指出，該名老翁日前經過彰化市中山路成功公園前時，1名騎乘腳踏車的男子將他攔下攀談，閒聊之中，該男子自稱是傳教士，他們想興建教堂需要資金，希望老翁能奉獻60萬元現金協助蓋教堂，「傳教士」還說，希望老翁待會領錢之後，就直接到成功公園交錢。請繼續往下閱讀...老翁就近到郵局臨櫃要提領60萬元現金，郵局行員懷疑是詐騙，立即向彰化警分局民生路派出所報案，員警魏葉霖、林威宇立即到場，在了解來龍去脈後，員警告訴老翁，這是「假捐款」詐騙，員警耐心說，該名男子自稱是傳教士，卻沒有穿著傳教士的服裝，疑似利用攀談過程中抓住老翁對宗教熱忱之心進行詐騙。老翁聽了員警說明後，始恍然大悟說「對唷，我怎麼會被騙？」當場取消提款念頭，成功保住辛苦積蓄，並對警方及行員的及時攔阻，再三道謝說「差點60萬元就飛了」。    ,https://news.ltn.com.tw/news/society/breakingnews/5405865
諷王志安「中共大外宣、雙面諜」 名嘴胡忠信挨告獲判免賠,社會,2026/04/16 13:25,中國媒體人王志安（圖左）在網路節目「賀瓏夜夜秀」嘲諷身障律師陳俊翰惹議。（資料照）中國中央電視台前記者、網紅王志安2024年1月總統及立委大選後，在網路節目「賀瓏夜夜秀」上，模仿民進黨提名的重度身障不分區立委候選人陳俊翰，引發爭議，資深政治評論員胡忠信隨後在三立網路節目「94要客訴」上說王志安是「中共的大外宣、雙面諜、小罵大幫忙」，王志安認為名譽受損，控告胡忠信求償100萬元；士林地院審理後認定，胡所言並非全然憑空杜撰、並非全無所本，難以認定明知不實仍惡意評論，應受言論自由保障，判王志安敗訴，胡忠信免賠。王志安提告主張，自身於2019年6月因社群媒體帳號遭中國官方封禁，不得已遷居日本，目前經營YouTube及X（前Twitter）等社群平台，以自媒體形式繼續從事調查記者工作，持續揭露中共官媒無法報導的新聞真相，他的影片和言論多半在批評中共高層及領導人，但胡忠信卻在2024年1月24日，在三立電視製播的網路直播節目「94要客訴」說，「我當然認為王志安是中共的大外宣，而且是雙面諜…這叫小罵大幫忙嘛，對中國嘛，不是嗎？」。請繼續往下閱讀...王志安認為，胡忠信無端指責他遵從中國官方命令進行大外宣或間諜活動，對他的名譽嚴重指控，致閱聽大眾對他產生不良印象，貶損他的社會評價，訴請胡忠信賠償100萬元，並在自由時報等3家日報頭版刊登他的勝訴啟事。胡忠信答辯指出，他對王男的質疑言論並非憑空捏造，而是基於對王的公開言論、行為模式及其立場的觀察分析，認為王的言論確實呈現特定傾向，並在特定事件上的論述取向，與中共政治宣傳的話語體系高度一致，「大外宣、雙面諜」的實質意涵，在於指出王對中共「小罵大幫忙」的行為模式，屬意見表達，他的質疑有合理依據，此議題涉及台灣公共輿論環境的健全及國家安全議題，他是對可受公評的公共事務發表合理評論，言詞未逾越合理界限。士林地院法官認為，「大外宣、雙面諜」等詞的具體內涵應視前後文脈絡和表述方式決定，不可一概而論，而胡忠信發言的背景，是因王志安於2024年1月間，持觀光簽證在台觀察選情而參加網路節目的錄影，被指違反觀光目的，又在節目中批判執政黨將律師陳俊翰（已故）列為全國不分區立法委員候選人，並在造勢場合上台發言拉票的做法，當場模仿身障人士的言語、肢體特徵，引起各界譁然，胡忠信才在節目中針對此一爭議事件，評論王志安的言行。法官調查，王志安曾任中國央視記者、新京報調查記者，現旅居日本，經營自媒體及社群平台，其訂閱量超過170萬，屬主動進入公眾事務領域參與討論，並在網路上具有一定話語權及影響力的人物，胡對於王的批判或質疑言論，對公益論辯有一定程度的貢獻，應享有相對較大的容錯空間。法官指出，「大外宣」並非必然狹義指涉王志安是中國官方授意培養的海外自媒體人，或王男是藉由其製播的影片內容為中共當局進行輿論戰、認知戰等具體事實，根據台灣社會實際使用該詞彙的語境，也可泛指王男在特定議題上，與中國官方立場相近或相同，而與中國對外政治宣傳同調；或指稱王男雖在某些議題上曾批評中國政府，但其他議題仍自主配合中共當局的立場或敘事，形同為中共喉舌的宣傳工具。至於如何界定「大外宣」，法官認為端視各人立場、價值觀或解讀方式而有不同結果，難獲定論；而「雙面諜」一詞，法官考究胡忠信的陳述內容及前後脈絡後，認定胡的用意，並非指控王志安從事諜報活動，而是在批判王志安在面對不同對象或閱聽群眾時，其言論立場前後反覆不一的情況。法官指出，「中共的大外宣」、「雙面諜」等語雖有流於武斷、過於聳動之嫌，或許未臻公允，且帶有負面評價意涵，可能使王志安主觀上感到不悅，但審酌發表言論的時空環境及表達方式，仍未逸脫王志安模仿陳俊翰的爭議事件的公共議題，胡忠信依他的個人價值判斷，表達其評論意見，並非以貶損王志安的名譽為唯一目的，因此判王志安敗訴。可上訴。    ,https://news.ltn.com.tw/news/society/breakingnews/5405848
男租車不還持刀拒捕花蓮市區上演警匪追逐 跑一整晚車沒油被逮,社會,2026/04/16 13:21,鳳林分局豐濱派出所警員將逃跑整晚的張姓男子攔下，上手銬逮捕。（警方提供）一名50歲張姓男子在花蓮租賃一輛黑色豐田Altis轎車卻沒還車，業者昨天下午報案侵占，晚間警方發現車子後啟動圍捕攔截，但男子持刀拒捕，警匪上演超過10小時、破百公里的追逐大戰，過程中警車還與轎車發生碰撞，直到跑到車子沒油，今天早上在豐濱加油站加油時終於被逮。涉嫌侵占車輛的50歲張姓男子14日下午4點到租車店租車1天，依約定須在隔天下午5點之前歸還，業者昨天下午卻等不到還車，打電話也不接，向警方報案車輛被侵占。請繼續往下閱讀...昨晚9點多，花蓮警分局巡邏員警在花蓮市國興二街、國聯四路口發現黑色Altis轎車，立即啟動圍捕攔截，過程被目擊還po上網「警察真的不是吃素的」！起初張姓男子還配合警方將車子開到花蓮車站旁豐川派出所釐清，但眼見警方要他下車，張男突然態度丕變，情緒激動拿出長刀下車揮舞、作勢要攻擊警方，警方緊急拿出辣椒水狂噴，張男卻突然把刀子架在自己脖子退回車內，還大聲威脅警察不要靠近，警察拔槍喝令男子下車，他反而開車加速逃逸。雙方在花蓮市區發生追逐戰，一路從市區、中央路往鯉魚潭、晚間10點多還從東華大學門口經過，接著又過花蓮大橋走台11線南下，追逐時雙方還發生撞擊，造成警車車頭及輪框受損。台11線往南可選擇的重要路口很少，警方決定改採車牌辨識系統，在台11線沿線重要路口部署警網，透過追蹤嫌犯位置展開圍捕，今天早上7點半嫌犯侵占車輛被警方發現停在台11甲豐濱加油站，企圖從光豐公路轉往縱谷。從昨晚9點到今早7點半，開車逃了10個半小時，張嫌明顯疲累，跑了107公里後車子也沒油，加完油男子又企圖逃跑，早上8點多被鳳林警分局豐濱派出所警員在台11線攔下，最後張嫌終於不再抵抗，警方將張嫌上銬逮捕，車內也搜出長刀、鐵鎚等物。警方調查，張姓男子原本在桃園市擔任貨車司機，由於遭裁員心情不好，獨自回花蓮老家散心，警方今天依公共危險罪、妨害公務、侵占等罪嫌移送花蓮地檢署偵辦，沿路超速違反交通規定也將依法開單。警方掏槍喝令男子就逮，但男子拒捕反而縮回車內。（警方提供）警匪追逐畫面被目擊民眾拍下。（取自網路）    ,https://news.ltn.com.tw/news/society/breakingnews/5405818
剴剴案社工一審判決出爐 李怡貞斥兒福聯盟「拖所有社工下水」籲停捐,社會,2026/04/16 13:12,陳尚潔一審判決理由曝光，網紅律師李怡貞認為社工陳尚潔的判決沒有輕縱，傻眼的是兒福聯盟洗地發文，呼籲停捐。（資料照）台北市惡保母劉彩萱、劉若琳姊妹凌虐1歲10月大男童「剴剴」虐死案，涉案社工陳尚潔涉及偽造訪視紀錄、未依規定通報兒虐遭控過失致死，判決書今（16日）出爐，網紅律師李怡貞認為社工陳尚潔的判決沒有輕縱，但最讓人跌破眼鏡的是兒福聯盟第一時間繼續洗地，發表早就擬定好的版本，繼續牽扯所有社工下水，呼籲停捐兒福聯盟。李怡貞在臉書專頁「女人大律師李怡貞」發文斥責兒福聯盟的「洗地發文」，質問「兒福聯盟你們怎麼不說一下你們擁有鉅額善款，但是否將無背景無勢力的社工當免洗筷讓大多社工做到力不從心，做到熱情消失殆盡？」，否則為什麼連法院的判決書都認為陳尚潔工作並無超量。但是據她所知大部分的社工，工作量都是超量的，要叫社工再扛一個保證人地位，社工當然反彈。請繼續往下閱讀...李怡貞強調，如果社工都有做好最基本最基本該做的事，就像我們一般人吃飯睡覺大便基本的事情都有做到的話，根本不需要討論保證人地位。「這個案子的重點是陳尚潔不配稱為社工，因為她連最基本社工該做的的事都不做，但是又雞婆的鎖在剴剴身邊孤立剴剴」。李怡貞說，「正常工作的社工真的不需要被兒福聯盟這些偷換概念的洗地文給騙了。就不用說陳尚潔那些亡羊補牢的各種文件篡改以及官官相護的忝不知恥，否則檢察官不會依偽造文書起訴」。李怡貞也對在天上的剴剴說，「你小小年紀都都撐了114天，我們也一定可以，我們會繼續關注下去，大家會用愛撐著你委屈巴巴的靈魂」。    ,https://news.ltn.com.tw/news/society/breakingnews/5405790
彰化大葉大學火警地下游泳池冒白煙  師生緊急疏散,社會,2026/04/16 13:09,彰化大葉大學觀光餐旅大樓地下2樓游泳池區域冒出大量白煙，消防人員利用熱顯像儀進行搜索。（民眾提供）彰化大村鄉大葉大學今（16日）上午傳出火警，起火點位於校內觀光餐旅大樓地下2樓游泳池區域，現場冒出大量白煙，由於正值上課時間，驚動不少學生，幸好緊急疏散，未造成人員傷亡或受困。詳細起火原因尚待進一步調查釐清。彰化縣消防局表示，早上8點49分獲報該大樓地下室冒煙，立即派遣消防車15輛、消防人員29人趕赴現場搶救。消防人員抵達時，外觀未見明顯火煙，經校方引導進入地下2樓後，確認煙霧來源為游泳池區域。請繼續往下閱讀...彰化縣消防局指出，消防人員利用熱顯像儀（TIC）及五用氣體偵測器進行搜索，進一步在淋浴間發現天花板有燒熔情形，研判可能為起煙點，由於煙霧已透過空調系統流竄至其他空間，現場同步進行排煙作業，以防止危害擴大。大葉大學表示，校方第一時間發現異常煙霧後，立即啟動消防編組通報，並聯絡消防隊入校處理，全校師生安全無虞；消防局表示，現場未傳出人員傷亡或受困，詳細起火原因尚待進一步調查釐清。大葉大學地下2樓游泳池傳火警，消防人員在淋浴間發現天花板有燒熔情形。（民眾提供）    ,https://news.ltn.com.tw/news/society/breakingnews/5405831
壯陽偽藥誆保健品海撈8000萬 代言人「小哥哥艾里」逃過被訴,社會,2026/04/16 12:59,檢警查扣「30密碼」、「超能30」、「30而立」及「我弟很猛」等商品1萬7千盒。（記者蔡清華翻攝）橋頭地檢署指揮查緝Fans17網站涉犯兒少性剝削案，發現該網站銷售之保健食品疑似有壯陽偽藥成分，經送驗、蒐證及分析發現以健康食品名義販售，不法獲利逾8000萬元，全案偵查終結起訴4嫌，代言人「小哥哥艾里」稱自己也是被騙的受害人，未被起訴。橋頭地方檢察署主任檢察官陳竹君、檢察官施佳宏指揮高雄市刑大等單位，查獲由江姓主嫌自中國進口含有偽藥成分（即威爾鋼主要成分Sildenafil之類緣物，具有與「Sildenafil」相似藥理活性之壯陽藥物原料），交由李姓及王姓等共犯委託不知情之食品廠填裝膠囊後，於王嫌名下公司上網依「保健食品」名義販售。請繼續往下閱讀...專案小組去年7月會同新北市衛生局執行2波共21處搜索，查扣「30密碼」、「超能30」、「30而立」及「我弟很猛」等商品1萬7千盒、及偽藥粉末1包等證物，統計市面上販售上開偽藥已達14萬餘盒，經移送橋頭地方檢署偵辦。橋頭地檢署偵結起訴江、李、王、許等4嫌，主要代言人網紅小哥哥艾里，出具食品檢驗合格證明文件，辯稱自己也是被欺騙的受害人，逃過被起訴的命運。檢警查扣壯陽藥物原料。（記者蔡清華翻攝）    ,https://news.ltn.com.tw/news/society/breakingnews/5405793
全國青年盃泳賽爆偷拍 2少女如廁驚見隔板伸手機...噁男下場曝,社會,2026/04/16 12:50,台中地院判巫男應執行1年5月，緩刑3年。（資料照）全國青年盃游泳錦標賽去年在台中北區運動中心舉行，巫姓男子竟趁賽事期間潛入場館女廁內埋伏，還將手機伸進下方隔板偷拍兩名少女，結果被少女發現報警，巫男也當場被活逮送辦，案經審理台中地院考量他賠償獲原諒，依拍攝少年性影像罪判他1年5月，宣告緩刑3年，可上訴。案發於2025年6月6日，地點為台中市北區國民運動中心，當時場館內泳池賽事進行中，人員進出頻繁，巫男事先進入女廁並停留於隔間內等待時機，隨後見兩名少女進入如廁時，使用手機伸進下方隔板偷拍，其中一名少女察覺異常後立即反應並報警處理。請繼續往下閱讀...警方獲報趕抵現場時，巫男試圖刪除手機內相關影像準備滅證，但手機仍遭查扣並帶回調查，相關數位資料也同步保全，經查，巫男行為並非臨時起意，而是利用大型賽事期間人潮較多的環境進行埋伏，案件進入審理後，巫坦承犯行，兩名被害人說法一致，並有監視器及手機資料作為佐證，事證明確。中院審酌認為，被告明知對象為未成年人，仍於公共場所女廁內進行不當拍攝行為，侵害他人隱私權及人格法益，行為不當，考量事後已與兩名被害人達成調解並完成賠償，並獲得原諒，依兩個「拍攝少年性影像罪」各判處1年2月徒刑，應執行1年5月，宣告緩刑3年，並命接受法治教育課程，全案仍可上訴。    ,https://news.ltn.com.tw/news/society/breakingnews/5405777
