Title,News_Type,date,content,url
藍營嘉義縣長人選未定 王育敏：在野大聯盟會納優秀人選考量,政治,2025/12/13 13:14,國民黨嘉縣黨部舉辦131週年黨慶活動，主委王育敏（左六）與資深黨員切蛋糕慶生。（記者王善嬿攝）明年11月28日舉行嘉義縣長選舉，民進黨正進行黨內初選，由立委蔡易餘、縣議員黃榮利競爭；國民黨嘉義縣長提名人選未定，被點名可能人選之一的國民黨嘉義縣黨部主委王育敏今受訪說，現在擔任縣黨部主委，持續為鄉親服務，至於明年（縣長）大選，過去曾有組在野大聯盟打選戰經驗，與中央黨部有共識，如果有優秀人選，會結合所有在野力量共同打拚。嘉義縣黨部今在白人牙膏舉辦131周年黨慶活動，王育敏、國民黨副主席季麟連、縣議會國民黨黨團書記長李國勝、縣議員詹琬蓁、吳思蓉、王啓澧等人出席，與資深黨員一起切蛋糕慶生。請繼續往下閱讀...季麟連表示，縣市長提名辦法已經核定，主席鄭麗文指示要尊重制度、按標準程序做，地方現在問題就是人才太多，每個都很優秀，有審查委員會、協調委員會，最後一定推出最強強棒；鄭麗文交代時程會愈快愈好，但一定要照程序走，會盡快決定，讓大家盡早準備。國民黨日前傳出派「奇兵」中央選舉委員會代理主委吳容輝出戰嘉義縣長，被吳容輝否認。季麟連表示，這由第一階段審查小組處理，他並未接觸，他是擔任第二階段協調小組工作。王育敏今在活動向黨員喊話，明年嘉義縣長選舉，國民黨一定會推出優秀的候選人，並強化在野大聯盟的量能，希望黨員持續與國民黨站在一起、支持嘉縣黨部。她還說，近期因高麗菜在市場上供過於求導致價格下跌，為了支持高麗菜農，聯合嘉義縣民眾服務社、縣議會國民黨黨團，共同發起「好菜大放送」活動，向朴子市農民認購一分地、約3000顆高麗菜，今天黨慶活動首波發放500顆高麗菜，以實質行動挺農民、讓民眾吃到優質好菜。國民黨嘉義縣黨部舉辦黨慶活動，送高麗菜挺農民。（記者王善嬿攝）兼任嘉義縣黨部主委的國民黨立委王育敏。（記者王善嬿攝）    ,https://news.ltn.com.tw/news/politics/breakingnews/5276997
賴喊話韓國瑜「思考國政茶敘」 鄭麗文：「賴總統」該先跟「賴主席」談,政治,2025/12/13 12:45,針對賴總統邀韓國瑜國政茶敘遭婉拒話題，鄭麗文建議賴總統應和賴主席坐下來談。（記者李文德攝）賴清德總統邀請行政院、立法院及考試院院長下週一到總統府國政茶敘，立法院長韓國瑜婉拒出席，賴總統今早受訪再次喊話韓國瑜「再考慮一下」。國民黨主席鄭麗文今 （13）日上午受訪指出，賴總統有心彌補裂痕，不需要做虛假的動作，更應該回去與賴主席坐下來，好好審視執政以來犯了什麼錯。賴清德總統預定15日上午邀三院院長於總統府進行國政茶敘，不過總統府發言人郭雅慧昨晚表示，立法院長韓國瑜忽然表達不克出席一事，府方感到意外與不解。今賴清德出席弘道獎頒獎典禮受訪時表示，知道韓院長也有難言之隱，不過請他再思考一下。請繼續往下閱讀...鄭麗文表示，賴清德總統如真心彌補裂痕，團結在野，其實虛情假意大可不必，一定要真心誠意，更想問賴總統真的有面對過去執政的錯誤嗎？有面對大幅民意給賴政府的警訊嗎？賴總統真醒了嗎？否則虛假動作其實無助於朝野的團結，也無助台灣民主僵局解開，因為造成僵局的來源就是他自己。媒體續問「會不會覺得賴總統搞錯喝茶的對象？應該跟在野黨主席茶敘？」鄭麗文認為，賴清德不是對象找錯了，賴清德總統應該回去跟賴清德主席，好好地坐下來、靜下心，審視一下他自從執政以來，到底犯了什麼樣的錯誤，導致今日憲政僵局、朝野對立、社會撕裂，如他還想不清楚問題出在哪裡，找誰都沒有用。    ,https://news.ltn.com.tw/news/politics/breakingnews/5276968
走出8歲兒涉霸凌風波  賴瑞隆:鄉親給他很多鼓勵與支持,政治,2025/12/13 12:43,民眾獻花為賴瑞隆（左）加油打氣。（記者葛祐豪翻攝）爭取民進黨高雄市長初選的立委賴瑞隆，近日捲入8歲兒子涉嫌霸凌風波，目前他已走出低潮，參加公開活動，今（13日）出席大寮紅豆花田季開幕時，特別感謝最近鄉親給他很多鼓勵與支持，他會繼續往前走。綠營輔選人士認為，這起風波目前暫告一段落，已獲得對方家長諒解，賴瑞隆也持續帶孩子進行心理諮商，外界擔憂否會對初選選情造成衝擊?相信以賴瑞隆的智慧，應該能把衝擊減到最小。請繼續往下閱讀...賴瑞隆今天出席大寮紅豆花田季開幕典禮，受訪時表示，他就按照節奏來走，持續走市場、活動，走入基層，也謝謝最近鄉親給他很多鼓勵與支持，「我會繼續往前走，把過去的成績與未來想要做的事情，讓更多人知道!」也要謝謝不管到每個活動，鼓勵的聲音都非常多，「我會繼續加油，讓高雄讓台灣更好!」今天下午2點半，賴瑞隆將於圓山飯店5樓龍鳳廳，舉辦「來呦隆作伙-社團後援會政見說明會」；晚間6點15分於前鎮漁港西岸碼頭，參加2025大海開吃-高雄大鮪·魷· 秋季開幕儀式；明天（14日）下午2點半，則於茄萣金鑾宮舉行「來呦，隆作伙」茄萣場活動，並邀請資深媒體人王瑞德到場助講。賴瑞隆透露，這兩天前往小港區二苓市場掃街拜票，與攤商、民眾互動致意，過程中許多民眾主動趨前握手，更送上花束為他加油打氣，讓他深刻感受到高雄人的善良與溫度，這就是高雄人表達支持和鼓勵最直接的方式，這些真誠和叮嚀都是高雄很珍貴的價值，也是持續往前的力量，未來會持續保持這樣的步調、勤走基層。    ,https://news.ltn.com.tw/news/politics/breakingnews/5276970
反年改修法三讀惹議 鄭麗文：執政黨挑撥職業矛盾、別再扯後腿,政治,2025/12/13 12:35,針對反年改修法，國民黨主席鄭麗文表示，軍公教的年改應該到了做重新調整時機，執政黨卻視而不見，希望民進黨不要再扯後腿。（記者李文德攝）立法院國民黨團昨日挾人數優勢強行三讀通過反年改修法，引發朝野爭議。國民黨主席鄭麗文今（13）日到雲林出席縣黨部主委交接儀式，她會前受訪表示，軍公教的年改應該到了做重新調整時機，執政黨卻視而不見，更用惡言惡語挑撥不同職業矛盾，希望民進黨不要再扯後腿。立法院昨下午三讀通過反年改修法，修正「公務人員退休資遣撫卹法」、「公立學校教職員退撫條例」，要求所得替代率不再遞減，每月退休所得隨現值待遇調整，行政院長卓榮泰昨批立法院倒行逆施，將造成退撫基金提前3到4年破產，政府須額外挹注及撥補數千億，最終還是納稅人負擔，台灣不能走回頭路，會透過合法合憲途徑確保退撫基金財務永續。請繼續往下閱讀...鄭麗文說，軍公教的年改應該到了做重新調整、改革時機，當在野黨認真推動相關社會福利時，執政黨正事不做，反而一味的杯葛國會多數所通過的重要法案，包括提高職業軍人待遇，此次通過的年金改革，台灣一直無法招募足夠職業軍人，就連現在報考公教的人員都年年下降，軍公教難道不是國家安全防衛韌性最重要的基石嗎？鄭麗文表示，當基石不斷被腐蝕沖刷，執政黨卻視而不見，在國會通過法案後，仍舊杯葛、違憲破壞民主，做了最壞的示範，更用惡言惡語來挑撥不同職業之間的矛盾，製造世代之間的仇恨，如此才是真正瓦解台灣團結的最大罪魁禍首，大家最希望的是青銀共創、世代共榮，更希望軍公教能夠持續的成為中華民國最重要的穩定基石，更希望民進黨不要再扯後腿，破壞台灣的團結。    ,https://news.ltn.com.tw/news/politics/breakingnews/5276951
邀賴清德進行朝野「新團結十講」 國民黨團：保證讓總統講得盡興,政治,2025/12/13 12:18,國民黨團總召傅崐萁與書記長羅智強。（資料照）立法院國民黨團書記長羅智強今天表示，賴清德總統若真心實意希望朝野和解、化解僵局，和立法院對話。國民黨團將正式建請賴總統，邀請立法院朝野黨團進行「新團結十講」茶敘。國民黨團表示，面對賴清德總統昨天上午破口大罵，下午找人喝茶，國人錯愕不已。保持情緒穩定，是擔任總統的基本條件，只希望總統為國保重身體。請繼續往下閱讀...國民黨團表示，針對賴清德最關心的十大議題，和立法院朝野黨團交換意見，這十大議題分別是：編預算欺軍警消、光電弊案淘空國庫、濫用司法追殺在野、發動惡罷撕裂國家、放縱詐欺囂張橫行、打壓地方集權集錢、不斷引戰兩岸兵凶、邦交腰斬外交重挫、天價軍購不敢說明、藐視國會獨裁霸道。國民黨表示，全程公開，即問即答，時間、地點、場數，總統府決定。保證讓賴總統講得盡興，也保證讓與會的立委，問得詳細，讓國人充分了解賴清德總統的想法。    ,https://news.ltn.com.tw/news/politics/breakingnews/5276919
高雄超幸福！市民發文「兒子想看聖誕燈」高捷加班趕出來了,政治,2025/12/13 12:15,高捷表示，設備部同仁們加班處裡，已經提早點亮。（取自高捷Threads留言）高雄市近日連辦多場國際級活動，用心的態度，讓不少市民看在眼底。一名網友日前在Threads上發文笑稱自己3歲兒子的胃口已經「被陳其邁養大了」，表示兒子經過捷運美麗島站的時候，疑惑為什麼聖誕節快到了，燈還沒改成紅色、綠色的？沒想到，該篇文章竟獲高雄捷運小編親回，稱看到了貼文與小朋友的期待，「設備部同仁們加班處裡，已經提早點亮。」回文一出獲得大量網友稱讚，還有網友笑稱：「高市現在是打算跟高市早苗拚滿意度嗎？」、「高雄捷運是聖誕老公公嗎？」一名網友9日在Threads上發文表示，當天經過美麗島站出口的時候，兒子還問她：「為什麼聖誕節要到了，這裡的燈還是黃色的？不是紅色綠色呢？」她補充，去年這裡是紅色、綠色的燈，兒子記得很清楚，她也笑稱：「陳其邁已經把我3歲兒子胃口養大了！」請繼續往下閱讀...沒想到，高捷小編11日竟親自回應，PO出一張現場改亮起紅色、綠色燈的照片，並表示：「麻煩跟您家小朋友提一下，我們確實是看到你們的貼文，以及小朋友的期待，所以設備部門同仁加班處理，提早今天點亮了！」原PO則驚喜回應：「啊啊啊啊天啊！很不好意思讓你們加班！太狂了。」她也承諾：「明天就帶他去看！真的很感謝。」回文一出，引發大量網友稱讚，網友紛紛表示：「高市現在是打算跟高市早苗拚滿意度嗎？」、「高雄捷運是聖誕老公公嗎」、「高雄的市民好幸福」、「超扯」、「最強的市府團隊」、「謝謝你們完成小孩子的期待」、「朝聖，高雄真的不講武德」、「剛剛經過真的已經是紅綠了」。     在 Threads 查看    ,https://news.ltn.com.tw/news/politics/breakingnews/5276952
民眾黨誇韓國瑜拒被摸頭 吳思瑤秀經典畫面酸：沒人能贏黃國昌,政治,2025/12/13 12:12,國民黨團去年為國會擴權修法輪班守議場，黃國昌加入行列、還被傅崐萁摸頭。（圖擷自吳思瑤臉書）立法院長韓國瑜表示不克出席國政茶敘，民眾黨聲稱，對於韓拒絕成為行政權摸頭對象表達佩服。對此，兼任民進黨政策會執行長的立委吳思瑤今（13日）秀出一張民眾黨主席黃國昌被國民黨團總召傅崐萁摸頭的經典畫面，直呼被摸頭、刷存在感沒人贏得了黃，呼籲韓國瑜別被部分政黨勒住頭。賴清德原定15日邀請韓國瑜、行政院長卓榮泰與考試院長周弘憲，到總統府進行國政會商。韓建議改以茶會進行，賴表示尊重並更改形式，韓國瑜卻婉拒出席。請繼續往下閱讀...對此，吳思瑤今受訪表示，民眾黨力挺韓國瑜不參加院際協調，認為韓不該被摸頭，但當今政壇被摸頭最經典畫面，應該就是黃國昌。院際協調是總統依據憲法授權，可針對院與院之間的爭執召集對話，韓國瑜也曾參加過，並對總預算僵局提出一些解方。吳思瑤進一步質疑，韓國瑜現在稱立法院是合議制、不宜參與院際協調，但上一次韓參加有先徵求各政黨同意嗎？並不需要、也沒有這件事情，因為立法院長是全民院長、跨越黨派，而非只是藍白的院長，並不存在合議制。吳思瑤說，院際協調是憲法授權，不必以小人之心度君子之腹，懇切對話解決院際之間衝突，韓國瑜可能有難言之隱，也許碰到的難題是被某些政黨勒住了頭，但院際協調不會是摸頭，反而是韓國瑜要注意是否被部分政黨勒住了頭。此外，吳思瑤指出，民眾黨不僅不挺院際協調，還要求總統召開政黨對話，非常雙標！過去總統也曾邀請跨政黨參與國安簡報，無私與在野黨領袖分享國安資訊，當時告吹就是因為黃國昌的個人理由，現在又要求政黨對談，「被摸頭、刷存在感都沒人贏得了黃國昌，反對院際協調，恐怕只是他不能容忍沒有自己的畫面」。兼任民進黨政策會執行長的立委吳思瑤。（資料照）    ,https://news.ltn.com.tw/news/politics/breakingnews/5276947
農曆年後展開廟口開講  柯志恩誇口︰明年市長選舉會贏,政治,2025/12/13 12:05,柯志恩（中）受訪表示，明年農曆年後，將展開廟口開講。（記者葛祐豪翻攝）民進黨高雄市長初選競爭白熱化，原先民調居於領先集團的立委賴瑞隆，近日捲入8歲兒子涉嫌霸凌風波；相較之下，國民黨早就把柯志恩定於一尊，對於自己的選戰步驟，柯志恩今（13日）出席活動時受訪表示，明年農曆年後，將陸續發表政見，並展開宮廟的廟口開講，她認為會贏得最後的勝利。2022年高雄市長選舉落敗之後，柯志恩決定留在高雄，除了購屋宣示決心，也一步步跑基層，累積支持度。面對2026年市長選戰，國民黨雖尚未提名，但內部早就定於一尊，非柯志恩莫屬，相較民進黨仍在初選廝殺，柯明顯佔有先機。請繼續往下閱讀...針對自己的選戰步驟，柯志恩今天受訪時說，民進黨初選競爭激烈，候選人都跟著陳其邁市長，對國民黨來說，沒有初選的壓力，未來會等民進黨初選勝出的人選確定後，來調整步伐。預計農曆年後，就會開始發表政見，包括各宮廟的廟口開講 、議員及里長的座談，都會陸續展開，「總而言之，會根據自己的步伐，來決定未來的方向怎麼走！」對於民進黨初選態勢，柯志恩認為，目前為止他們都很有把握，「他們不弱，我們也頗強的」，不管誰出線與國民黨打選戰，以民進黨在高雄長期的執政與資源、人脈，對國民黨來說都非常辛苦；但是有議員與基層里長的力挺，相信這場仗會打得非常漂亮，且贏得最後的勝利。另對立院三讀停砍公教年金，柯志恩認為，行政院長卓榮泰還是不會執行，以他過去八次釋憲就看得出來。她強調，公教年金是有經過合理改革的，2016年就花了時間改革，這次是因為過去砍得太兇，只是停砍所得替代率，「民進黨不要造謠說多花7千億，請問7千億怎麼算出來的？」    ,https://news.ltn.com.tw/news/politics/breakingnews/5276929
賴清德訪中配大啖「包公私房麵」 郭明華：台灣是我的家,政治,2025/12/13 12:05,總統賴清德（右）今在YouTube頻道上線最新影片，他特地前往位於台北市中山區「開封包公府私房麵館」，拜訪靠著家鄉私房麵養大3個孩子、撐起一家4口的中配老闆郭明華（左），並大啖店裡招牌「包公私房麵」與老闆親手滷製的小吃。（圖擷取自賴清德臉書）立法院在野黨提出國籍法修正草案，中配不必放棄原國籍即可擔任公職，引發社會抨擊，批評製造外配與中配的對立。多次強調不分族群與來自何方，認同台灣都是國家主人的賴清德總統，今（13）在YouTube頻道上線最新影片，他特地前往位於台北市中山區「開封包公府私房麵館」，拜訪靠著家鄉私房麵養大3個孩子、撐起一家4口的中配老闆郭明華，並大啖店裡招牌「包公私房麵」與老闆親手滷製的小吃。中配郭明華表示，台灣是她生兒育女、做阿嬤的地方，「這裡更是我的家」。郭明華來自河南開封，20多年前從河南嫁來台灣，用一碗家鄉包公麵的好滋味，拉拔3個孩子、撐起一家4口。在鄰居眼中，郭明華就像現代版台灣阿信，不屈不撓的堅毅精神感動許多人，鄰居都稱她「雙連阿信」。來台定居至今，郭明華已經深耕台灣超過20年，影片中郭明華直言，「我就說中國大陸是我父母生我、養我的地方，嫁來台灣，我在這邊生兒育女、做阿嬤，子孫萬代都在這裡，這裡更是我的家」， 一席話令人動容。請繼續往下閱讀...賴清德一進店內，郭明華謙稱「小小店面」，總統直呼精緻。總統現場點了店內招牌「包公私房麵」以及幾樣小菜，據了解，小菜都是由郭明華店裡親手滷製。郭明華說，河南是旱地，飲食習慣為麵食，河南傳統私房麵是以手工麵條，拌著豆皮絲、雞蛋，經她改良豆皮絲以肉絲取代，據傳這也是「包青天」包公的養生餐，總統聽聞後笑稱，大力水手是靠菠菜，包公辦案則是靠養生餐。郭明華回憶當年來到台灣，一路打拚，從大同區起家至今，「真的感受到這邊（台灣）很有愛」，孩子也紛紛成家，至今已經有一個兩歲多的孫女，賴總統欣慰表示苦盡甘來，郭明華則說「有愛的政府才讓我好命」。郭明華的媳婦來自馬來西亞，和郭明華兒子一起開了間日本料理店，郭明華笑稱「一個家好幾個籍」，總統聽聞直呼非常特別，但「台灣就是多元文化」、「台灣愛心滿天下，歡迎來自各地方的人，來台灣生活、就業、打拚，台灣社會很歡迎」，一如賴總統所說「因為你認同台灣，你在台灣打拚，你就是這個國家的主人」。賴總統還當起美食部落客，分享口感與心得，最後一滴不剩「完食」、「清碗」，郭在旁表示，看著總統吃得津津有味，令人欣慰。賴則笑稱，以後開會也要吃，現場氣氛相當熱絡感動。賴清德另透過臉書表示，郭老闆的故事，說明了台灣是一個多元、開放的社會，不管你從哪裡來，只要認同台灣，就是這個國家的主人。總統賴清德現場點了店內招牌「包公私房麵」以及幾樣小菜，據了解，小菜都是由郭明華店裡親手滷製。（圖擷取自賴清德臉書）賴總統還當起美食部落客，分享口感與心得，最後一滴不剩「完食」、「清碗」。（圖擷取自賴清德臉書）    ,https://news.ltn.com.tw/news/politics/breakingnews/5276910
台灣沒有2028！李忠憲舉3國示警：民主制度正被合法掏空,政治,2025/12/13 11:55,成功大學教授李忠憲。（資料照）國內政治情勢一波未平一波又起，藍白立委昨挾人數優勢強行三讀通過反年改修法。對此，成功大學教授李忠憲以「從委內瑞拉、喬治亞、匈牙利，看台灣沒有2028」一文詳細分析，希望予以外界參考與討論。李忠憲今發文提及，「先講結論：如果沿著現在這條制度與政治路徑走下去，我認為台灣真的沒有2028。」很多人一聽到「台灣沒有2028」，第一個反應就是反感，然後假裝自己還身處承平時代。請繼續往下閱讀...李忠憲指出，一旦以「台灣沒2028」這個前提思考，很多看起來荒謬的選擇，反而都變得「合理」起來。假裝看不見、什麼都想防守、沒有優先順序：國防武器、洗中國人法案、小服貿自經區、年金改革、國家預算…全部都要、全部都不放，還以為時間站在我們這一邊。要不然找一些事情來做，例如用自然人憑證連署公投來救國。這種「只要還在做點什麼，就不必承認失敗」的心態，他在私人生活中見過一次。「想到我爸在台大醫院的最後時刻，他在外科手術失敗之後，醫生把我叫進去手術房，指著他打開的肚子給我看，說很抱歉、癌症已經擴散，我不記得我怎麼走出手術房。出來之後立刻打電話給在台大醫院當教授的學長，他馬上幫我爸轉診到腫瘤科醫師，改用化療看是不是能夠處理病情。學長應該有很多處理這種事情的經驗，重點不是治癒，而是帶著病痛活下去，醫生有時候治療的不是病人，而是身邊的家屬。只要還有治療就會有希望，但真的是這樣嗎？」李忠憲直指，「大罷免與接連的政治挫敗，至少已經清楚告訴我們一件事：這個國家的制度警報，響到震耳欲聾了」。歷史從來不會因為我們選擇忽視，就自動轉彎。最近諾貝爾和平獎的頒獎過程其實非常戲劇化，幾乎像一部政治驚悚片。來自委內瑞拉的公民社會代表、2025諾貝爾和平獎得主馬查多（Maria Corina Machado），在得獎前仍被政權監控，新聞說是被美國的軍機護送離開；而真正的反對派領袖，至今仍被關押、被禁止參政。這不是歷史，是現在進行式。委內瑞拉今天仍然有選舉、有投票，但國際社會早已承認：「那是一個有選舉、沒有民主的國家」。如果把目光拉遠一點，看3個彼此毫不相干、卻走上相似道路的國家。委內瑞拉、匈牙利、喬治亞，就會發現一件事：民主不是被一夜摧毀的，而是被一步一步、合法地掏空的。「委內瑞拉」的前總統查維斯（Hugo Chávez）不是靠坦克上台，而是靠選票。他沒有廢除民主，而是不斷強調自己「更民主」。他先改寫規則：司法變成忠誠者的法庭，國會被合法繞過，媒體被切斷資源，反對派被貼上「不愛國」標籤。等人民意識到不對勁時，選舉還在，但已經換不了政權。「匈牙利」不是軍政府，是歐盟成員國。奧班用國會多數修憲、掌控司法、集中媒體，把反對者說成「外國勢力代理人」。一切合法、程序正確。歐盟自己都承認：這是一個選舉式威權的國家。「喬治亞」沒有強人，只有一群看似溫和、實則親俄的政治菁英。慢慢阻擋司法改革、削弱反腐、攻擊公民社會。國家還在，主權卻被一點一點搬走。李忠憲直指，把這三個案例放在一起，結論其實很殘酷：民主不是被敵人奪走的，而是被一句「再等等看」讓出去的。台灣現在最危險的，不是明天會不會被武力攻擊，而是太多人仍然相信：制度會自己修正、再撐一屆看看、反正還有下一次選舉。但歷史一次又一次證明：當大部分人意識到沒有下一次時，通常已經沒有選擇了。除此之外，可能可以抓住的稻草，竟然是美國。連美國在台協會（AIT）處長谷立言（Raymond Greene）都公開表示願意到立法院報告台灣向美國軍事採購的預算案。這代表什麼？代表台灣內部的制度制衡，已經被美國懷疑是否還能正常運作。從總統、民進黨，到每一個仍然相信「還有下一次」的一般民眾，如果不把「台灣沒有 2028」當成思考的前提，那它就不會只是警告，而會成為現實。當我們把所有希望寄託在「還能再做一件事」上時，往往正是拒絕承認制度已經走到臨界點的時候，現在應該開始思考：要放棄什麼了。賴總統提1.25兆國防預算 美AIT處長谷立言盼台灣各黨團結一致AIT處長谷立言挺1.25兆國防預算！向藍白委員喊話：願跟立院朋友說明軍購問題！｜2025    ,https://news.ltn.com.tw/news/politics/breakingnews/5276892
