Title,News_Type,date,content,url
軍購支持徐巧芯8100億版本 趙少康：先過3500億剩下凍結,政治,2026/03/04 15:00,前中廣董事長趙少康今（4）日舉辦「軍購特別預算該怎麼審」戰鬥藍專題研討會。（記者田裕華攝）立法院國民黨團明天將舉行黨團大會，確認軍購特別條例版本。前中廣董事長趙少康今（4）日舉辦「軍購特別預算該怎麼審」戰鬥藍專題研討會，趙少康主張，將國民黨立委徐巧芯8100億元的版本，與國民黨智庫3500億+N的版本合併，匡列8100億元、通過3500億元，剩下的凍結，報告以後才能動支，前藍委吳斯懷也認同趙少康的看法。趙少康認為，國民黨版的軍購特別條例，徐巧芯提出8100億元的版本，智庫是3500億元+N，可以考慮合併在一起，匡列8100億元、通過3500億元，剩下的凍結，美方發價書已經同意賣給我們的再來審查，這樣就不會有好幾個版本的問題。美國發價我們就買，國內採購的部分，就不要編特別預算，編在每年的常態預算。請繼續往下閱讀...國民黨立委賴士葆也說，美國公開承諾要賣、我們需要的就編進來，重點在於要匡列多少，他認為可以把對國內採購的部分全數刪除，剩下的對外採購部分全放進來，不論是8、9000億元，都能考慮。趙少康說，如果美方不交貨，也要敦促他們趕快交貨，不交貨不是白付錢、白買了，不能一直delay，就算不能罰政府，美國政府也應該去罰廠商。我們應該要強力要求，一定要給壓力，不是交錢就不管了，不是有很多友台的國會議員嗎？請他們去push，一定要嚴格督促廠商交貨。徐巧芯說，週五只是將各黨團及行政院的版本送到委員會審查，後續審查過程中立委都能提出具體想調整的項目，金額部分也要持續關注美方與國際情勢的動態，在審查時進行專業的調整。    ,https://news.ltn.com.tw/news/politics/breakingnews/5358437
內幕》北京延後「鄭習會」 密切觀察國民黨擋軍購「根本決心」,政治,2026/03/04 14:58,國民黨主席鄭麗文（如圖）與中國國家主席習近平的會面，將延到「川習會」後登場。（資料照）「鄭習會」受中東戰火波及，原訂與中國兩會期間（3月5至11日）舉行的會面，預計推遲到「川習會」後、清明期間登場；據北京消息，中國今年對台工作重心在於推進「兩制」方案，延後會面也是觀察國民黨的具體表現，尤其是有沒有擋軍購的「根本決心」。據指出，中共推遲原訂3月中的「鄭習會」有三層戰略盤算，首先，要凸顯國共正朝向和平解決台灣問題的階段，藉此向國際主張合乎《八一七公報》意旨，讓川普順勢減少對台軍售；其次，透過國共共同營造「和平」氛圍，誘使川普這會更值得往「諾貝爾和平獎」得主推進。請繼續往下閱讀...據透露，第三，北京主張兩岸和平是奠基在「兩制」方案的核心精神，國民黨在這段期間必須有具體表現，基本條件就是對「兩制方案」表態，更關鍵的指標在於3月初台灣的軍購案已進入國會審查，要觀察國民黨是否展現成功否決軍購的根本決心。    ,https://news.ltn.com.tw/news/politics/breakingnews/5358572
花蓮縣長選舉「一藍兩無」三腳督 綠營支持者流向成關鍵,政治,2026/03/04 14:58,花蓮縣吉安鄉長游淑貞。（游淑貞提供）國民黨今日中常會提名花蓮縣吉安鄉長游淑貞參選縣長，民進黨近乎確定不推人選，預期禮讓無黨籍議長張峻，加上之前被國民黨停權的前花蓮市長魏嘉賢，縣長選戰演變為藍營分裂的「一藍兩無」三腳督之爭，3方實力逼近，綠營票源反倒在花蓮成為關鍵，但花蓮長期反綠情緒高，3方參選人都想要吸納綠營選票，但又擔心靠太近被反綠情緒影響失去原有的支持者，對綠營選票欲拒還迎。過去20年，傅崐萁打造的政治體系讓花蓮穩守傅家單一派閥掌握，雖然傅崐萁過去在全國調查中，負面聲量穩居藍營政治人物第一，但花蓮在地選民結構中，「反綠情緒比反傅情緒更強」，民進黨公開站台或者與參選人走得太近，反而傷害參選人，尤其是民進黨在花蓮原住民地區的選票，長期只在2成上下盤旋，7萬多票的原住民選票成為3名出身藍營的參選人都想要鞏固與爭取的對象。請繼續往下閱讀...地方人士認為，花蓮原民區對綠營的「反感」是結構性的，因此參選人深入原民選區時，要展現出極度正藍或超黨派的色彩，若被貼上「民進黨代理人」標籤，原民票會立即流失，但在三腳督（游、張、魏）的結構下，3人又想拿到那25%的綠營基本盤，參選人想要綠營選票的「肉」，但極度害怕綠營的「皮」，誰被冠上「小綠」，誰就在原民選區先輸一半。對綠營選民來說，張峻雖然出身藍營還擔任過國民黨主委，但從花蓮礦石景觀稅後跟傅崐萁交惡被開除黨籍，去年投入大罷免陣線，除吸納藍營內反傅勢力，更和罷團、綠營議員始終站在一起，是「一起戰鬥過」的夥伴，橫跨藍綠中反傅勢力。地方綠營人士認為，只有像張峻這樣擁有強大地方組織、敢於跟傅崐萁正面對槓的人，才有機會真正瓦解傅家20年的樁腳體系，是打破家天下的契機。魏嘉賢在大罷免時期曾發文支持罷團精神領袖「葉霸老師」，但最終未實際站出來登高一呼，維持一貫「 政治不沾鍋」的個性，想以溫和、專業、無色彩的形象，吸引北區大花蓮都會型選民，魏嘉賢雖然個人形象良好，但其家族過去涉案在花蓮政壇留下的痕跡卻是包袱，家族成員在市代、議員、市長職位上的接力與佈局，會讓選民質疑：「會不會又是另一個家天下，從傅家換成魏家而已？」而游淑貞獲國民黨提名，在地方上也經常與傅崐萁、徐榛蔚同台，被外界視為延續傅家王朝，但游淑貞上月底強調自己從政20年一步一腳印，相關建設成果受公評，也希望外界不要再貼上「傅崐萁接班人」標籤，強調地方建設的成績來自中央部會、地方首長、立委與議員等多方協力，也是想要跨越藍綠。藍中常會通過第2波提名 徵召陳玉珍、張嘉郡、游淑貞參選縣長花蓮縣長選舉》藍營提名游淑貞 議長張峻︰下週宣布參選藍提名游淑貞 葉耀輝宣示5月拚對比民調逆轉勝花蓮縣議會議長張峻。（張峻提供）前花蓮市長魏嘉賢。（魏嘉賢提供）    ,https://news.ltn.com.tw/news/politics/breakingnews/5358561
新北防災士突破2萬人 劉世芳：朝全台20萬人目標邁進,政治,2026/03/04 14:45,內政部長劉世芳出席致詞表示，新北市是防災士推動先行區域，去年全台已訓練超過11萬名防災士，其中新北市貢獻最多，今年目標朝10萬名防災士邁進，未來全台至少20萬人持有防災士資格。（記者羅國嘉攝）新北市防災士培訓人數突破2萬人。消防局今（4日）在慈濟三重靜思堂舉辦「防災士開訓典禮暨培訓2萬人里程碑活動」。內政部長劉世芳出席致詞表示，新北是防災士推動先行區域，去年全台已訓練超過11萬名防災士，其中新北市貢獻最多，今年目標朝10萬名防災士邁進，未來全台至少20萬人持有防災士資格；新北市長侯友宜則表示，2萬人培訓目標達成，象徵防災量能與意識同步提升，讓「自助、互助、公助」精神深植社區。消防局今天舉辦防災士開訓典禮暨培訓2萬人里程碑活動，劉世芳、消防署署長蕭煥章、新北市長侯友宜及立委蘇巧慧、洪孟楷等人皆到場出席，會中蘇巧慧與洪孟楷互動熱絡、相互講悄悄話，與侯友宜則握手致意。請繼續往下閱讀...劉世芳致詞指出，慈濟基金會長期在全球以慈愛拯救生命，用實際行動守護土地與生命，新北市更是防災士推動的先行區域。去年全台已訓練超過11萬名防災士，內政部推動成果成長達15倍，其中新北市貢獻最多；目前全台已有超過一半村里長投入防災士訓練，顯示基層防災制度正穩健扎根。劉世芳表示，面對氣候變遷帶來的洪澇、地震及各類複合式災變，中央與地方必須攜手合作，除公部門外，慈濟基金會等民間團體也投入最多資源，其他宗教團體、國際獅子會、主婦聯盟及世界展望會等也共同參與，推廣對象涵蓋媒體、計程車司機、保全業者及各社團。她指出，今年目標朝10萬名防災士邁進，未來全台至少20萬人持有防災士資格，在每個社區都能即時伸出雙手，用專業守護人民生命。未來災防法修正後，各區公所將成為災防訓練基地，讓防災士精神深入社區，使台灣在面臨重大災害時能團結應對、將損失降到最低。侯友宜表示，防災士制度推動以來，透過系統化培訓課程，強化民眾對於地震、風災及各類災害之應變知能，培養社區自主防災種子，逐步建構由下而上的韌性防災網絡。此次達成2萬人培訓目標，不僅象徵量能的提升，更代表防災意識深植社區，讓「自助、互助、公助」的防災精神落實於日常生活之中。新北市長侯友宜表示，2萬人培訓目標達成，象徵防災量能與意識同步提升，讓「自助、互助、公助」精神深植社區。（記者羅國嘉攝）新北市長侯友宜致贈慈濟基金會代表感謝狀。（記者羅國嘉攝）內政部長劉世芳、新北市長侯友宜向防災士表達致意。（記者羅國嘉攝）    ,https://news.ltn.com.tw/news/politics/breakingnews/5358559
藍中常會通過第2波提名 徵召陳玉珍、張嘉郡、游淑貞參選縣長,政治,2026/03/04 14:41,國民黨今日中常會通過第2波提名縣市，包括金門縣長徵召國民黨立委陳玉珍（右1），雲林縣長徵召國民黨立委張嘉郡（左2）參選，以及花蓮縣長徵召花蓮縣吉安鄉長游淑貞（左1）。（圖擷取自國民黨臉書直播影片）繼去年12月首波提名台南市、高雄市、屏東縣、台東縣長參選人後，國民黨今日中常會通過第2波提名縣市，包括金門縣長徵召國民黨立委陳玉珍，雲林縣長徵召國民黨立委張嘉郡參選，以及花蓮縣長徵召花蓮縣吉安鄉長游淑貞，並由黨主席鄭麗文親自為這3名女性參選人披掛彩帶，一起牽手高喊凍蒜、國民黨勝利等口號。鄭麗文強調，星期天就是「婦女節」，這3名參選人是國民黨最優秀、稱職的「女力」代表，而過去8年國民黨在東台灣、中台灣都是女力縣市長，並且交出傲人的成績單，奠定「藍色執政、品質保證」的品牌。請繼續往下閱讀...鄭麗文指出，游淑貞20年的基層服務經驗，一步一腳印，國民黨在西海岸有「盧媽媽」，東海岸有「游媽媽」，游淑貞過去20年的奉獻付出，為花蓮縣的發展而努力，也將在這次充滿挑戰的選舉中守住花蓮縣，為花蓮縣民打造更美好的明天，祝福游淑貞高票當選。鄭麗文表示，雲林縣作為台灣最大的農業縣，過去在張嘉郡的父親、姑姑執政下做前瞻性的佈局，並爭取到各方面的產業與建設，如今雲林縣已經展現與過去不同的風貌，張嘉郡也成為可以獨掌乾坤的女將，以柔克剛的功夫沒話說，體力、耐力好又勤跑基層，雲林縣交給張嘉郡將可以有更好的發展。此外，鄭麗文說，陳玉珍是「一女當關、萬夫莫敵」，國民黨真正的「女戰神、女戰將」，屢屢打破民進黨的邏輯，民進黨政治人物都辯不過陳玉珍，「肚子非常有料」，「在立法院有衝突時，只要有陳玉珍，就不怕打不過他們」，回到家鄉就爭取金門人的權益，相信陳玉珍未來能帶給金門縣全新的繁榮機會。最後，鄭麗文說，國民黨在過年後將全面迎戰，「馬上凍蒜、馬上成功」，相信團結一致的國民黨，將會守護台灣以及台灣的民主與福祉。    ,https://news.ltn.com.tw/news/politics/breakingnews/5358535
萬華里長控性騷案外案 洪健益批畜產公司功能不彰、蔣萬安允朝合作社轉型,政治,2026/03/04 14:31,台北市長蔣萬安在台北市議會答詢時，對於畜產公司收費爭議，表示會朝合作社方向研議。（資料照）台北市萬華區里長洪佳君年前自爆遭地方人士性騷擾，這「地方人士」傳出是台北市環南市場自治會會長林勝東，還扯出他地方勢力雄厚，為了台北畜產公司要調漲管理費一事，找議員跟市府、畜產公司對槓。去年屢次在議會質詢畜產公司調漲管理費一事的議員洪健益今（4）受訪表示，畜產公司完全沒有營運、管理、拍賣功能，成效不彰，經他質詢，市長蔣萬安也允諾朝合作社方式轉型。洪健益指出，管理家禽批發市場的台北畜產公司，每年屠宰約1700萬隻雞，占全國一半的量；公司每年近8、9000萬的開銷，都來自對承銷商的收費，卻不像北農、花卉、漁產公司有拍賣機制，說穿了就是市政府的二房東，向承銷商收租金，想漲價就漲價，沒有經過合理的訪價，尤其過去雞的成本低，現在雞的成本增加，畜產公司沒有功能還要加收管理費，公式的計算完全不合理。請繼續往下閱讀...洪健益去年質詢時也提到，市府2024年補助3000多萬元修繕，卻僅回收840萬元房租；2025年補助1165萬元，僅收回745萬元，畜產公司每年虧錢營運；若財政局依土地面積收租，每年可收租6500萬元，現在不僅收不到，還要倒貼維修費用。市府為什麼不乾脆自己當房東，直接租給由承銷商成立的合作社來承租？洪健益當時要求解散畜產公司，由市場處輔導承銷商成立合作社，直接向市府承租土地。居中協調的副市長李四川在答詢時則回應說，已向市長蔣萬安報告，長期會朝成立合作社方向推動。    ,https://news.ltn.com.tw/news/politics/breakingnews/5358524
起步被說太慢 李四川：「大隻雞慢啼」基礎打好才重要,政治,2026/03/04 14:29,國民黨主席鄭麗文（左）今日出席新北市婦女會新春團拜活動，與台北市副市長、有意角逐新北市長的李四川（右）互動熱絡。（記者羅國嘉攝）台北市副市長李四川爭取國民黨新北市長提名，不過傳出10日他的辭職才會生效，被認為起步太慢。對此，李四川今（4日）出席活動時表示，這幾天他被打得很慘，很多人都告訴他「你這麼慢，要趕快一點」，但是他要跟婦女會好姊妹報告，台灣人說「大隻雞慢啼」，所以大家不用緊張，尤其是做工程的人，一定要把基礎打好，房子越來越高。李四川今天出席新北婦女會團拜，受到各區婦女歡迎。他受訪指出，「回到這裡感受到很多溫暖」，被問到許多議員都已經準備好看板位置等他下令，他說「目前都正在準備」感謝大家支持。請繼續往下閱讀...李四川致詞也表示，這幾年在市長侯友宜領導下，新北市團隊努力，不管治安、建設都往前走。侯友宜常說「少說多做」，侯也從不爭聲量，而是用成績單來說話，所以應該讓新北繼續延續侯的施政。李四川也說，這幾天他也被打得很慘，很多人都告訴他「你這麼慢，要趕快一點」，但是他要跟婦女會報告，台灣人說「大隻雞慢啼」，所以大家不用緊張，尤其是做工程的人，一定要把基礎打好，房子才會越來越高。李四川表示，所以還是要代表台北市長蔣萬安祝大家新年快樂。如果29區婦女會有親戚朋友在台北市，請給蔣市長投一票；在新北市，當然也拜託支持他，還有所有藍營議員，讓他們高票當選、連任。台北市副市長、有意角逐新北市長的李四川今出席活動時表示，這幾天他被打得很慘，很多人都告訴他「你這麼慢，要趕快一點」，但是他要跟婦女會好姊妹報告，台灣人說「大隻雞慢啼」，所以大家不用緊張，尤其是做工程的人，一定要把基礎打好，房子越來越高。（記者羅國嘉攝）    ,https://news.ltn.com.tw/news/politics/breakingnews/5358522
傳賴清德擬拔王定宇中常委？ 王世堅：須經過一定程序,政治,2026/03/04 14:27,民進黨立委王世堅今天下午出席民進黨中常會前接受媒體聯訪。（記者劉信德攝）民進黨立委王定宇被爆出「奪小三」風波，傳出兼任黨主席的總統賴清德擬撤銷其中常委職務，引發討論。兼任民進黨中常委的立委王世堅今（4日）對此表示，中常委是黨員由下而上所選出，要解除其職務可以，但必須經過一定的程序。週刊昨天披露，王定宇頻繁出入自稱愛爾麗集團執行長的劉怡萱住所。對此，王世堅今天下午出席民進黨中常會前受訪直言，他對此事的內容完全不清楚，現在國家國事如麻，這屬於王定宇個人的私務，當然就要由王個人來負責答覆，自己對這件事情全然不知。請繼續往下閱讀...對於賴清德有意撤銷王定宇中常委資格的傳聞，王世堅表示，民進黨的中常委是由下而上所選出，代表全體黨員的關懷與託付，既然是這麼困難、繁複的程序，解職要有一定的程序，不能僅憑三言兩語就可以。王世堅說，黨主席當然可以發表很多對此事的看法，可以約束黨員私務，也可以做一些道德號召，可以有其好惡、決定事情應該從嚴辦理，這都沒問題；但要經過一定的程序，例如召開中執會、中評會進行檢討和決定才行。    ,https://news.ltn.com.tw/news/politics/breakingnews/5358533
批中央「國影二期」跳票 黃國昌喊當選將收回土地打造藝文中心,政治,2026/03/04 14:24,民眾黨新北市長參選人黃國昌今再提政見，針對「國影二期」建設延宕，他喊出收回土地，打造藝文複合藝文中心。（記者黃政嘉攝）民眾黨新北市長參選人黃國昌今與新北市議員陳世軒召開新北政見記者會，黃國昌提到前行政院長蘇貞昌承諾在國家電影及視聽文化中心第一期旁的閒置土地建置「國影二期」、中央政府全額出資，但迄今仍是閒置用地，他痛批中央建設大跳票，喊出他若當選新北市長，將收回土地打造「好停車、有綠地、重藝文」的複合藝文中心、平價展演場地，成為新北市的親子藝文休閒場所，滿足市民需求。黃國昌表示，新莊副都心中有1塊1.6公頃的閒置土地，前行政院長蘇貞昌2020年10月12日視察國影一期時，承諾將在此閒置用地興建「國影二期」，工程經費45.1億元，將由中央政府全額出資，並宣示將在2022年開工。但迄今，國影二期這塊地仍閒置，完全沒動工。請繼續往下閱讀...他說，國影一期完工時，蘇貞昌曾跟新北市長侯友宜說，請市府趕快進行地目變更及辦理撥用，不要延宕工程，然而市府完成地目變更、土地撥用，周邊店家也都進駐後，這塊蛋黃區的土地卻依舊閒置，蘇貞昌曾許的承諾，現在還算數與否？沒人知道。文化部說工程經費從45億元漲至逾90億元，導致中央政府無法負擔，然而是因為誰的延宕，導致建設遙遙無期？無怪乎新莊在地民代直言這塊地的建設「零零落落」，新北市議會、居民紛紛要求市府把地收回自己來建設。「中央大跳票、新北我來做！」黃國昌承諾，未來他若當選新北市長，他會收回閒置土地，這塊1.6公頃的土地，建蔽率60%、容積率440%，他規劃興建地下2層、地上5層的建物，提供800個汽機車停車位，解決周邊停車難題；保留40%空地，打造適合親子友善的公園，為新莊留片綠地；提供平價展演場地，把藝術帶到新莊，讓藝術融入市民生活中。「好停車、有綠地、重藝文」，讓這塊蛋黃區中的土地，不僅僅是成為新莊人親子友善的藝文複合空間，更能成為新北市民親子藝文的休憩場所。陳世軒說，他2022年參選市議員時提出的政見之一，就是要讓國影一期、二期成為新北的華山藝文中心，長輩及孩子的休憩中心。蘇貞昌承諾中央全額出資、2022年動工，但土地迄今一樣閒置，與他當初的承諾背道而馳。陳世軒提到，今年1月15日新北市府舉辦行動治理座談會，民進黨立委蘇巧慧也出席，但她面對議員及里長們提出市府收回這塊地的意見時，說大家建議很好，她會跟立委吳秉叡一起爭取，但4年過去，2席立委會比當時的蘇貞昌還來的有用嗎？他向蘇巧慧提問，「現在妳是支持新北市府收回這塊地自己做使用，還是妳要求新北市民給你更多時間，繼續向中央爭取全額的經費補助，請蘇巧慧正面回答我的問題」。新北市議員陳世軒問民進黨新北市長參選人蘇巧慧蘇巧慧，對於「國影二期」建設，是支持新北市府收回地使用，還是繼續向中央爭取經費補助。（記者黃政嘉攝）    ,https://news.ltn.com.tw/news/politics/breakingnews/5358517
健康不佳須長期靜養 宜蘭縣議會失聯秘書辭呈曝光,政治,2026/03/04 14:19,宜蘭縣議會秘書長官伸科拿出黃的離職申請書。（民眾提供）宜蘭縣議會9職等秘書51歲黃毓恒，「一家3口」驚傳失聯，震撼宜蘭政界，今早他請辦公室助理轉交辭呈，縣議會確認是「親筆簽名」，辭呈內容下午曝光，寫道是因個人健康狀況不佳，須長期靜養。不過，不放心的黃父，已向警方通報失聯。宜蘭縣議會秘書長官伸科說，黃毓恒平時為人客氣，去年因胰臟囊腫手術後健康欠佳，下半年起請假頻繁，過年前均依規辦理，不過年後假滿卻未現身，派員前往他的住處關心，發現大門深鎖、人去樓空。請繼續往下閱讀...他說，因一直聯繫不上他，也請黃父到議會，但父母都不知道一家3口去向，辦公室助理透過臉書聯繫後，轉知若不按規到職，恐要面臨免職處分，因此今天透過臉書傳親筆簽名的辭呈給助理後轉交議長，「我認得那筆跡，同事多年，是他親筆簽名。」官伸科也拿出黃的離職申請書，內容寫道「本人黃毓恒目前擔任宜蘭縣議會秘書一職，因個人健康狀況不佳，經醫師診斷需長期靜養治療，且另有生涯規劃與他就考量，經慎重考量後，僅此正式提出離職申請。」簽名外也蓋手印，日期為3月4日。但因黃父、親友及同事均聯繫不上黃毓恒，黃父已向警方通報失聯。宜蘭縣議會秘書「1家3口失聯」 助理今轉交「親筆簽名」辭呈宜縣議會秘書「1家3口」失聯！兒子遭通報中輟 縣府報警協尋宜蘭縣議會失聯秘書黃毓恒的辭呈曝光，內容寫道因健康不佳須長期靜養。（民眾提供）    ,https://news.ltn.com.tw/news/politics/breakingnews/5358518
自由觀點》「讓蔣介石出場」 國共「下場」不會好,政治,2026/03/04 14:19,    ,https://news.ltn.com.tw/news/politics/breakingnews/5358525
