Title,News_Type,date,content,url
曾預言黃國昌形象會「全面翻車」！占星師再預告：將從政壇摔落,政治,2025/10/15 18:57,民眾黨主席黃國昌。（記者陳志曲攝）民眾黨主席黃國昌近日醜聞纏身，過去「戰神」形象蕩然無存。就在今年7月黃國昌聲勢大漲，外界認為他有意角逐縣市首長時，一名占星師曾預言，黃國昌的公眾形象可能在此時「全面翻車」，「戰神」形象更是會受到全面質疑與崩塌。雖然該名占星師預估發生的時間在2026年，但部分內容確實吻合預言。而他近日也再度預言，「從政壇掏出摔落地面的政治人物，黃國昌也將名列其中，留給後世人警惕。」占星師小森今年7月初曾在粉專「占星論天下－小森」發文表示，黃國昌將在2026年遭遇「靈魂清算、信仰崩潰與權力反噬」，屆時黃國昌將「信仰崩塌、真相揭露與集體背離」，而黃國昌長年以「戰神」自居的形象，將在此時受到全面質疑與崩塌。請繼續往下閱讀...小森還說，屆時冥王星與月亮合相於水瓶座，並與太陽、木星在獅子座對衝，黃國昌的公眾形象與個人價值觀可能在此時「全面翻車」，其長期以來強調的正義與改革立場，將遭到輿論與盟友的反撲，過去被隱藏的矛盾也可能被攤在陽光下檢視，原先的信眾可能會轉而批判他，也表示他可能將面臨名譽與自我價值的大潰敗。儘管小森預言發生的時間「2026年」尚未到來，但近日黃國昌爆出的一系列醜聞，隱隱與預言相符。對此，小森再度發文表示，最近，黃國昌連續遭爆料養狗仔，現在又被爆出央廣的所謂駭客內鬼也跟他有關。如今的金星天秤正好與其本命金冥合天秤合相，整個風象的時代大風箏壓在黃國昌本命的「金冥合天秤」和「土巨蟹」上，這是他人生中一次很難逃避的現實考驗。用白話來說，這段時間就是權力被檢驗、形象被拆解、情緒堡壘開始鬆動的「官運下坡期」。小森說，金星和冥王在天秤的人，最在意別人怎麼看自己，也最會包裝自己。但現在流年金星回到天秤、冥王在水瓶轉順，同時，海王也在牡羊與之對衝，這些力量都在拆掉他過去精心設計的假面外表；黃國昌過去靠口才與形象建立的政治形象，現在反而開始被質疑。簡單來說，就是「你越想控制別人怎麼看你，別人就越不信任你」。這是宇宙要他學會誠實與謙卑的時候。小森最後表示，目前的「時代大風箏流年」正與黃國昌的土巨蟹形成衝突，讓他所有的「防衛」開始出現裂縫。他可能發現，權力不能帶來安全，反而讓人更孤單。這是他「權力慾與安全感」同時被考驗的時期。如果黃願意放下操控與政治表演，學會誠實與感受，他會重生；但若他仍選擇隱瞞、操縱、辯解，那麼失控與孤立，就會是他接下來的人生主題。「從政壇掏出摔落地面的政治人物，他將也名列其中，留給後世人警惕。」☆民俗說法僅供參考☆熱門賽事、球星動態不漏接    ,https://news.ltn.com.tw/news/politics/breakingnews/5212235
小草醫互打！蘇一峰質疑水質 沈政男：不會故意倒清潔劑啦,政治,2025/10/15 18:32,"民眾黨支持者、醫師蘇一峰在臉書發布圖卡表示，清潔工人用藥水清洗烏山頭水庫上面的光電板，最後給死忠的台南人喝。但一向力挺前民眾黨主席柯文哲的精神科醫師沈政男則有不同看法。（取自臉書）民眾黨支持者、胸腔科醫師蘇一峰日前在臉書發布圖卡表示，清潔工人用藥水清洗烏山頭水庫上面的光電板，最後給死忠的台南人喝，結果挨轟是「造謠」。對此，一向力挺前民眾黨主席柯文哲的精神科醫師沈政男則有不同看法，今日他在臉書發表長文，並表示：「我用直覺也可以推斷，人家不會故意把清潔劑洗到水庫裡啦！」沈政男今日在臉書發文表示，前年新北幼稚園餵藥烏龍事件，當時只有他主張「老師們不會做這種事！」但多少人，還是專家學者與網紅，信誓旦旦地說，如果沒有餵藥，怎麼會驗到濃度？「啊你們就沒有偵測下限的概念啊。同理，陰離子界面活性劑的偵測下限是多少？通常是0.025 mg/L。烏山頭水庫測到的濃度是多少？只比偵測下限稍微高一點。」請繼續往下閱讀...沈政男表示，要釐清這樣的問題，如果完全沒有水質檢驗專業也可以，就把歷年、其他水庫的水質數據都找出來，如果在烏山頭水庫安裝光電板以前，就有偵測到陰離子界面活性劑，而且數值差不多，那當然不是光電板安裝之故，或者其他沒有安裝光電板的水庫也可以驗到類似濃度，亦能證明。「問題是，我查了網路半天，烏山頭水庫網頁沒有安裝光電板以前的陰離子界面活性劑檢測數據，而其他水庫也沒有查到。」沈政男指出，如果是他，就會從頭開始，把水庫生態與陰離子界面活性劑的專業知識，從頭找一下，並吸收起來，再做判斷，「但即使沒有這樣的專業知識，我用直覺也可以推斷，人家不會故意把清潔劑洗到水庫裡啦！就好像幼兒園老師不會餵藥啦。」沈政男臉書貼文被轉至PTT後，不少網友打趣留言：「我宣布草醫內戰第一回合開始」、「草內互鬥」、「這次竟然沒上車」、「這咖居然跳車」、「快去幫另一個小草醫看診」、「藍有內戰 白的不甘寂寞」。熱門賽事、球星動態不漏接    ",https://news.ltn.com.tw/news/politics/breakingnews/5212363
郝龍斌PO與台北市長合照   鄭麗文曝下午與蔣萬安會面,政治,2025/10/15 18:31,國民黨主席候選人鄭麗文（左）與台北市長蔣萬安（右）會面。（圖由鄭麗文提供）國民黨主席選舉將於18日投票，候選人鄭麗文今天下午與台北市長蔣萬安會面，鄭麗文說，蔣萬安給他非常多積極的鼓勵與支持，兩人聊起同在立院奮戰反萊豬、監督執政黨的日子，他有戰鬥的意志、有論述的能力，要讓國民黨脫胎換骨，讓人刮目相看。候選人郝龍斌今日在臉書貼出與台北市長蔣萬安的合照，轉述蔣萬安認為郝是穩健務實合適的黨主席人選。而候選人鄭麗文下午也與蔣萬安會面。請繼續往下閱讀...鄭麗文表示，以前和蔣萬安一起在立法院共事的日子都還歷歷在目，無論是新冠疫情期間監督疫苗採購的弊案，還是堅定反對萊豬、捍衛全民健康的那段日子，他和蔣都是一起頂著「逆時中」壓力、共同並肩作戰的戰友，因為這份默契，彼此有著深厚的革命情感，他也相當珍惜這份情誼。鄭麗文轉述，蔣萬安說都有看黨主席的辯論轉播及政見發表會，現在的國民黨需要戰力和論述能力，面對民進黨的胡作非為一定要強力反擊，「沒什麼好客氣的」。鄭麗文說，未來若擔任黨主席，一定會繼續和蔣萬安並肩作戰，讓蔣在市政上無後顧之憂，全力為市民打拚，也要讓蔣在未來的連任之路上高票當選。熱門賽事、球星動態不漏接    ,https://news.ltn.com.tw/news/politics/breakingnews/5212399
林國漳披戰袍參選宜蘭縣長 綠營加速建構地方部隊備戰,政治,2025/10/15 18:24,民進黨林國漳（左起）以及國民黨吳宗憲、民眾黨陳琬惠、國民黨張勝德等4位下屆宜蘭縣長選舉熱門人選同框。（資料照）民進黨佈局2026地方縣市長選戰，選舉對策委員會今（15日）開會達成共識，將報請建議中執會，徵召宜蘭縣信賴之友會理事長林國漳參選宜蘭縣長，人選確定後，綠營將加速建構地方陸軍部隊備戰，勢必要將「藍天變綠地」。面對綠營人選林國漳的出線。藍營點名戰將中，包括宜蘭縣議會議長張勝德、認養宜蘭服務選區的不分區立委吳宗憲，均有可能參選。民眾黨部分，則是前立委、縣黨部主委陳琬惠多次表態「參選縣長目標不變！」無黨籍宜蘭縣代理縣長林茂盛民意呼聲也高，但尚未表態。請繼續往下閱讀...民進黨宜蘭縣黨部主委邱嘉進說，林國漳將成為宜蘭進步的新力量，對於後續輔選工作，將盡速安排下鄉勤走基層，並出席重要活動場合，爭取縣民支持，各鄉鎮黨公職也會進行編組，同時針對聯誼會部分，建構完整的陸軍部隊，以備戰2026大選。國民黨宜蘭縣黨部主委林明昌，因涉「幽靈連署」被檢方起訴後，鮮少對外發言，不過主委林明昌之子、縣議員林岳賢則表示，議長張勝德、立委吳宗憲確實都是縣長人選之一，不過仍待黨主席選後才會明朗，坦白張較占地方優勢，爸爸又是老議長，但最後不管是誰出線，只要能為縣民做的更多、更好，全黨都會傾力支持，也恭喜林國漳出線，盼未來選舉能是場「君子之爭！」陳琬惠指出，各黨皆推最強人選出戰，但林國漳過去沒有從政經驗，這次縣長選舉對縣民來說，是一個重要契機，可以重新選擇並規劃宜蘭未來的10年願景，自己長期深根地方，也歷經各1次的縣長、立委選舉，感謝鄉親支持，未來會持續爭取大家的認同。熱門賽事、球星動態不漏接    ,https://news.ltn.com.tw/news/politics/breakingnews/5212328
國安法案防中國介選  行政院：年底前完成修法,政治,2025/10/15 18:23,行政院說，賴清德總統國安17項因應策略，行政院規劃21部法律修正，包含海纜7法，規劃今年底前完成修正草案，並依時程送交立法院審查。（資料照）國民黨主席選舉傳出境外勢力介選，國安局長蔡明彥今天在立法院說，國安局調查中也發現法律工具不足，行政院已召集跨部會研議強化國安法制。對此，行政院發言人李慧芝說，賴清德總統提出國安17項因應策略，行政院為此規劃21部法律修正，包含海纜7法，規劃今年底前完成修正草案，並依時程送交立法院審查。李慧芝說，台灣是保障言論自由的民主法治國家，不過言論自由並不是毫無界限，但近期網路上出現以生成式AI等技術，散布仇恨性言論、恐怖主義或激化社會對立、消滅我國主權等言論，甚至鼓吹戰爭或散布危害國家安全、社會、財政或經濟安定之錯假訊息等。請繼續往下閱讀...李慧芝指出，賴清德總統已經召開國安高層會議，提出17項因應策略，行政院為此規劃21部法律修正（含海纜7法），有關「混淆國人對國家認同」這類威脅，包括前述散布虛假訊息或深偽影音等行為，也將會提出相關規範。政院人士補充，有關21部法律修正案，其中「資通安全管理法」修法已由賴清德總統於9月公布。此外，部分法案，如「人工智慧基本法」已送立法院審議。其餘法案則規劃在今年底前完成修正草案，並依時程送交立法院審查。熱門賽事、球星動態不漏接    ,https://news.ltn.com.tw/news/politics/breakingnews/5212351
中選會委員、公視董監事提名延宕 政院：積極進行徵詢作業,政治,2025/10/15 18:21,有關各界關注中選會委員及公視董監事提名人選，行政院發言人李慧芝今（15）日表示，中選會委員名單，目前正積極進行徵詢作業。（資料照，記者鍾麗華攝）有關各界關注中選會委員及公視董監事提名人選，行政院發言人李慧芝今（15）日表示，中選會委員名單，目前正積極進行徵詢作業，同時也敦請相關社會公正人士推薦適當人選，而公視董監事人選則是由文化部依據「公共電視法」進行徵詢作業，邀請具教育、藝文、學術、傳播及其他專業人士同意候選。李慧芝指出，行政院及相關部會持續積極物色適合人選，而過去也曾發生選任困難，希望在徵詢順利的情況下，於2份名單底定後儘速提出，分別送請立法院及提交公視董事、監察人審查委員會審查。請繼續往下閱讀...目前中選會共有10名委員，其中主委李進勇、副主委陳朝建、委員陳恩民、許惠峰、王韻茹及許雅芬共6人任期將在今年11月3日屆滿，而李進勇、陳朝建、陳恩民與許惠峰共4人已連任1次，依法須提名新任委員。至於本屆公視董事會已於5月31日任期屆滿，依法，行政院文化部應於6個月前進行新一屆董事會董監事提名作業。熱門賽事、球星動態不漏接    ,https://news.ltn.com.tw/news/politics/breakingnews/5212378
國台辦瞎扯5問 陸委會轟利用媽祖統戰：用國有器官也活不到150歲,政治,2025/10/15 18:13,陸委會副主委沈有忠日前表示，中國現在是「一個媽祖原則」，世界上只有一個媽祖，在湄洲的媽祖唯一合法代表，台灣媽祖也是中國媽祖的一部分，台灣人也是中國人，這就是中共手法。圖為湄洲媽祖金身。（資料照）中共利用宗教交流對台統戰，陸委會副主委沈有忠日前剖析，中國是「一個媽祖原則」，認為世界上只有一個媽祖，湄洲媽祖是唯一合法代表，台灣媽祖也是中國媽祖一部分，然後台灣人也是中國人，這就是中共手法。中國國台辦今天提出5個問題反問，質疑難道媽祖不是「中國神」嗎？批判陸委會意圖不讓台灣民眾信仰媽祖、關公，究竟在害怕什麼？對此，沈有忠痛批，利用媽祖來統戰台灣的人，就算用了國有器官，也不會活到150歲。國台辦發言人陳斌華聲稱，兩岸同屬中華民族，媽祖、關公等絕大多數島內民間信仰起源於中國，祖廟在大陸，這都是不爭的事實。想問陸委會這位人士5個問題。一，世界上是不是只有一位媽祖？二，媽祖是千百年來備受東南沿海民眾乃至海外華僑華人敬仰的中國神？請繼續往下閱讀...陳斌華質問，三，台灣的媽祖是不是分靈於福建湄洲島媽祖祖廟？四，關公是不是與媽祖類似、是不是世界上也只有一位關公？五，意圖不讓台灣民眾信仰媽祖、關公，究竟在害怕什麼？陳斌華說，廣大台灣信眾到中國進香交流、尋根祭祖、祈求平安，是他們發自內心的精神需求，何錯之有？民進黨當局一再對此扣上「統戰」的帽子，恰恰證明統戰工作光明正大，有利於兩岸同胞走近走親，厚植親情。他更嗆聲，一再干擾阻撓兩岸正常的宗教民間信仰文化交流，恰恰證明其不樂見「兩岸一家親」，而是想製造「兩岸一家仇」，為了獨謀這樣的倒行逆施不得人心，注定失敗。對此，沈有忠在Thread發文指出，國台辦對他提出「媽祖五問」，自己簡單回覆如下：一，台灣對於宗教信仰始終保持自由開放的態度。法輪功、一貫道，都和媽祖、關公一樣，可以自由的在台灣被信仰和尊重。我們從來不害怕法輪功、一貫道，更不害怕媽祖和關公。沈有忠強調，二，我們不會給媽祖和關公冠上國籍，把媽祖說成「中國神」，恰好凸顯出中共把神明當成政治工具的企圖。三，在湄洲的媽祖廟，文革時期被中共當局破壞殆盡，幸賴台灣的信眾大力捐獻，方得以重建。我們希望中共不要只是把媽祖當政治工具，也應該要尊重各種宗教信仰，讓中國人民可以真正得到宗教信仰的自由。沈有忠反批，四，兩岸宗教交流應該去政治化、去風險化。把媽祖和關公政治化進行對台統戰，不會拉近兩岸距離，也不會得到媽祖保佑。利用媽祖來統戰台灣的人，就算用了國有器官，也不會活到150歲。熱門賽事、球星動態不漏接    ,https://news.ltn.com.tw/news/politics/breakingnews/5212360
國台辦瞎扯5問 陸委會轟利用媽祖統戰：用國有器官也活不到150歲,政治,2025/10/15 18:13,陸委會副主委沈有忠日前表示，中國現在是「一個媽祖原則」，世界上只有一個媽祖，在湄洲的媽祖唯一合法代表，台灣媽祖也是中國媽祖的一部分，台灣人也是中國人，這就是中共手法。圖為湄洲媽祖金身。（資料照）中共利用宗教交流對台統戰，陸委會副主委沈有忠日前剖析，中國是「一個媽祖原則」，認為世界上只有一個媽祖，湄洲媽祖是唯一合法代表，台灣媽祖也是中國媽祖一部分，然後台灣人也是中國人，這就是中共手法。中國國台辦今天提出5個問題反問，質疑難道媽祖不是「中國神」嗎？批判陸委會意圖不讓台灣民眾信仰媽祖、關公，究竟在害怕什麼？對此，沈有忠痛批，利用媽祖來統戰台灣的人，就算用了國有器官，也不會活到150歲。國台辦發言人陳斌華聲稱，兩岸同屬中華民族，媽祖、關公等絕大多數島內民間信仰起源於中國，祖廟在大陸，這都是不爭的事實。想問陸委會這位人士5個問題。一，世界上是不是只有一位媽祖？二，媽祖是千百年來備受東南沿海民眾乃至海外華僑華人敬仰的中國神？請繼續往下閱讀...陳斌華質問，三，台灣的媽祖是不是分靈於福建湄洲島媽祖祖廟？四，關公是不是與媽祖類似、是不是世界上也只有一位關公？五，意圖不讓台灣民眾信仰媽祖、關公，究竟在害怕什麼？陳斌華說，廣大台灣信眾到中國進香交流、尋根祭祖、祈求平安，是他們發自內心的精神需求，何錯之有？民進黨當局一再對此扣上「統戰」的帽子，恰恰證明統戰工作光明正大，有利於兩岸同胞走近走親，厚植親情。他更嗆聲，一再干擾阻撓兩岸正常的宗教民間信仰文化交流，恰恰證明其不樂見「兩岸一家親」，而是想製造「兩岸一家仇」，為了獨謀這樣的倒行逆施不得人心，注定失敗。對此，沈有忠在Thread發文指出，國台辦對他提出「媽祖五問」，自己簡單回覆如下：一，台灣對於宗教信仰始終保持自由開放的態度。法輪功、一貫道，都和媽祖、關公一樣，可以自由的在台灣被信仰和尊重。我們從來不害怕法輪功、一貫道，更不害怕媽祖和關公。沈有忠強調，二，我們不會給媽祖和關公冠上國籍，把媽祖說成「中國神」，恰好凸顯出中共把神明當成政治工具的企圖。三，在湄洲的媽祖廟，文革時期被中共當局破壞殆盡，幸賴台灣的信眾大力捐獻，方得以重建。我們希望中共不要只是把媽祖當政治工具，也應該要尊重各種宗教信仰，讓中國人民可以真正得到宗教信仰的自由。沈有忠反批，四，兩岸宗教交流應該去政治化、去風險化。把媽祖和關公政治化進行對台統戰，不會拉近兩岸距離，也不會得到媽祖保佑。利用媽祖來統戰台灣的人，就算用了國有器官，也不會活到150歲。熱門賽事、球星動態不漏接    ,https://news.ltn.com.tw/news/politics/breakingnews/5212360
民眾黨拚中部議員「提名對國民黨釋善意」 台中名額曝,政治,2025/10/15 17:44,民眾黨台中市黨部主委陳清龍說，民眾黨第一階段先通過現任市議員名單。（記者蘇金鳳攝）民眾黨中央黨部今天（15日）公布中南部第一梯次提名名額，台中市黨部主委、選決會委員的議員陳清龍說，民眾黨的提名以現任議員為優先，分別是大里霧峰13選區的議員江和樹，他明年將擔任不分區立委，議員第4選區（后里、豐原）改由妻子連小華披戰袍，其他待國民黨主席選出後再說，這是對國民黨釋出善意。民眾黨中央在官網公布選舉決策委員會第三次會議結論，公告台中市、彰化縣、南投縣、雲林縣議員第一波提名名額及選區，陳清龍說，這6席都是現任議員，希望國民黨主席人選定案後，藍白包括縣市長、地方民代的競合方式，都能儘快協調。請繼續往下閱讀...他說，大罷免彰顯藍白合足以制衡民進黨，因此，地方的議員席次也需要好好跟國民黨談，而在台中市，民眾黨要參選者眾，需要內部先協調。陳清龍說，目前最競爭最烈的是北屯區，目前有4人表態，太平區也有2人，西屯有1人，每一區提名一人，需要一一協調，而北屯區會在最後協調。熱門賽事、球星動態不漏接    ,https://news.ltn.com.tw/news/politics/breakingnews/5212304
確定代表綠營挑戰中市百里侯 何欣純獻3大感謝,政治,2025/10/15 17:28,立委何欣純受總統賴清德肯定，民進黨選對會正式拍板由她披戰袍挑戰中市百里侯。（記者蘇孟娟攝）民進黨選對會今拍板由立委何欣純出戰明年台中市長選舉，何欣純表達3個感謝，除感謝總統兼民進黨主席賴清德，也感謝立委同事蔡其昌，更感謝「市民頭家」，她有機會服務台中是無上光榮，有服務更多市民的機會，她將全力以赴。民進黨選對會確定由何欣純出征明年台中市長選戰後，何欣純說，她感謝選對會所有前輩先進的建議與支持，未來還有黨內程序進行，一切尊重中央黨部的規劃與布局，全力做好準備。請繼續往下閱讀...她另表達有3感謝，感謝賴總統國政忙碌，不僅多次會晤關心台中、更多次親自來到台中，關心產業勞工、經濟民生，傾聽民眾意見，尤其關心台中未來發展，「把台中顧好、台灣未來一定好」。何欣純另對蔡其昌表達感謝，她說，感謝蔡其昌副院長，世界12強台灣勇奪冠軍，「台灣尚勇」響徹雲霄、台灣人走路都有風，就是擔任中華職棒會長的蔡其昌綿密協調後援、運籌帷幄，總統借重蔡其昌豐富的資歷，在中央協助總統國政，是台中之光、更是國家之幸。最後，何欣純說，她還要感謝台中這塊土地、所有市民頭家，給予她機會服務台中，這是她無上的榮幸，如果能有服務更多市民朋友的機會，她當然會全力以赴。熱門賽事、球星動態不漏接    ,https://news.ltn.com.tw/news/politics/breakingnews/5212302
烏山頭水庫光電板謠言延燒 賴清德當面要陳亭妃一起闢謠,政治,2025/10/15 17:22,經濟部公布烏山頭水庫水面型光電板清潔的完整流程，過程中清潔水源引自水庫水，並無使用一滴清潔藥劑。（資料照）台南烏山頭水庫光電板被指藥水清洗，民進黨立委陳亭妃日前質詢時，要求中央保證未來四大水庫，不得再核准任何光電執照」。兼任民進黨主席的總統賴清德今（15日）在中常會要求陳說明，並強調地方民代應與執政團隊一起澄清不實謠言；陳則回應，她有幫忙澄清相關謠言，但質詢發言有點被斷章取義。針對烏山頭水庫光電板清洗議題，陳亭妃日前在立法院經濟委員會質詢時，要求中央提出「四大安心承諾」，包括白河、烏山頭、曾文、南化四大水庫經濟部不得再核准光電執照等。請繼續往下閱讀...民進黨今天下午召開中常會。據與會人士轉述，賴清德特別提到，近日媒體報導陳亭妃針對光電板的質詢片段，並詢問陳「是否有政策上誤會」。陳亭妃則立即喊冤說，自己遭到斷章取義，質詢重點是水庫設置光電板需地方政府同意，若地方不同意就不應核發；自己是反映鄉親說法，也知道光電板「是用清水清洗」，並支持對散布假訊息者儘快提告。對此，賴清德嚴肅地說，現在出現許多謠言，執政團隊和黨部都很努力澄清，盼地方民意代表應協與執政團隊一起澄清不實謠言。熱門賽事、球星動態不漏接    ,https://news.ltn.com.tw/news/politics/breakingnews/5212288
