Title,News_Type,date,content,url
民眾黨提案譴責美降我國格、敦促軍售 時力：重申三公報是限縮台美關係,政治,2026/05/25 15:24,時代力量主席王婉諭。（資料照）台灣民眾立法院黨團上週五於立法院院會提案，要求外交部與國防部公開呼籲美方「恪守既有對台政策基礎，包括『台灣關係法』、三個聯合公報及六項保證」，引發各界議論。對此，時代力量今強烈批評民眾黨團對外交常識「極度無知」，不排除別有用心，直言美中三公報長期為中共打壓我國主權所用，如此強調形同親手幫北京開後門，強行對台灣戴上限制軍售的「緊箍咒」。時代力量指出，「三個聯合公報」是美國與中華人民共和國之間的政治文件，從來就不是美國對台關係的基礎。從《上海公報》美國「認知」到兩岸只有一個中國、《建交公報》承認中華人民共和國是中國唯一合法政府，到《八一七公報》美方表達將逐步減少對台軍售，這三份文件完全是中共長期拿來打壓台灣主權、壓縮台美關係與限制軍售的政治工具。請繼續往下閱讀...另一方面，《台灣關係法》與「六項保證」，正是為了抵銷三公報對台灣的傷害。美方基於戰略模糊，在處理兩岸議題時常將三者並列，作為平衡三方關係的外交語言，但台灣作為自我防衛的主體，絕對不該對此照單全收。台灣的立場非常清楚：台美關係應清楚建立在《台灣關係法》與「六項保證」之上，美方不得與中國協商對台軍售，不得將台灣安全作為美中談判籌碼，更不得片面改變對台安全承諾。時代力量示警，當台灣國會要求自己的外交部去呼籲美方「恪守三個聯合公報」，等於自認這三份損害台灣利益文件的正當性。尤其在「川習會」落幕之際，中共正急於向國際社會反覆強化「三個聯合公報是台美關係基礎」的論述。民眾黨這份提案無論最終是否通過，光是被提出，就可能成為北京對外宣傳的最佳材料，這絕非一個負責任的國會黨團應該交出的提案。時代力量呼籲，回應美國總統川普的爭議言論，要求美方恪守《台灣關係法》與六項保證、不得把台灣安全作為籌碼，這些都是對的方向。但絕不能為了回應美方，就把限縮台灣主權與國防發展的文件寫進自己的國會決議。時代力量呼籲民眾黨團，要捍衛台灣，請先搞清楚台灣的國家立場是什麼。    ,https://news.ltn.com.tw/news/politics/breakingnews/5448843
加拿大資安單位與台灣合作 何曼麗：盼能協助地方選舉,政治,2026/05/25 15:22,行政院長卓榮泰接見加拿大駐台北貿易辦事處代表何曼麗。（記者田裕華攝）行政院長卓榮泰今日下午於行政院接見加拿大駐台北貿易辦事處代表何曼麗一行。卓揆強調，期盼雙方能盡速簽訂貿易合作架構的協議，開拓更多商機；何曼麗則說，加拿大資安單位加強與貴國合作，防止境外不實訊息和資安的處理，在台灣地方選舉方面，希望能夠有所協助。卓榮泰致詞表示，台灣與貴國的雙邊關係，近年來在各領域都持續深化，無論是教育、人員交流、產業合作，以及各地方層級交流方面，都累積了相當成果。請繼續往下閱讀...卓榮泰指出，台加貿易的結構高度依賴，因為我們有共同的民主、人權及多元化、法治和基本價值，去年台灣經濟成長率比較高，我們一直希望在國內跟所有國人共享。在國際上，能夠跟理念相近的國家進行更多元化的交流，雙方建立更多共享的價值，這樣經濟才能真正有交流和韌性，一起發展與協助，所以我們誠摯希望台灣與加拿大共同努力。卓榮泰強調，2023年台加簽署投資促進保障協議，促進我國對於加拿大蒙特婁電子公司的一個併購案，台灣科技業向外佈局全球，充分展現與世界各國合作的模式，我們更期盼雙方能盡速簽訂貿易合作架構的協議，開拓更多商機。卓榮泰談及，加拿大軍艦多次航行台海，在國際海域適用國際法，行使國際自由航行權利，而且多次透過雙邊各種場域，與友盟發布共同聲明，傳達維護台海和平穩定現狀的決心，讓印太地區的自由開放得到更多的支持和維護，對此他要表達深摯的感謝。卓榮泰進一步說，在關鍵技術和合作方面，我們希望更加強各種合作的契機，譬如結合台灣半導體的優勢，跟加拿大AI研發的實力，共同加速發展AI產業應用及經營生態系。在供應鏈合作架構下，能更穩定半導體所需的各種關鍵資源，並結合加拿大首份的國防工業戰略，包括有無人機供應鏈在內，各種國防工業上雙方可以務實合作。卓榮泰指出，今年是加拿大駐台北貿易辦公室設立40週年，過去雙方累積了豐碩的共同成果，期盼未來能夠繼續加深合作，持續深化雙邊的夥伴關係，促進未來全方位、各方面的各種交流。何曼麗則表示，台灣和加拿大關係持續深化，加拿大眾議院議員上週才訪問台灣，也見到了賴總統，這代表著台加關係的深化。加拿大一直關注印太地區的發展，雙方的交流能夠加深彼此的了解，希望台加之間持續更多交流。何曼麗提及，今年是加拿大駐台辦事處設立40週年，駐處持續擴大業務，與台灣的關係持續成長，也持續深化與民間的關係，增進社會、文化、產業等各層面的關係，而且加拿大也是台灣留學生前五大的主要目的地之一。何曼麗也說，請容她談談近年台加合作成果，有海事安全及海洋方面相關合作，也有國會議員訪台，接下來7月在渥太華會連續第五年舉辦安全磋商會議。卓院長剛提到加拿大的戰艦有經過台灣海峽，因為和夥伴美國一樣，這是加拿大固定會做的事情。何曼麗強調，在資安方面，2024年起加拿大有派相關官員進駐在駐台辦事處，並加強加拿大資安單位與貴國的合作，以及加速反應防止境外不實訊息和資安的處理，接下來台灣地方選舉方面，希望能夠有所協助。何曼麗表示，未來幾年在能源、農業、IT、半導體、太空、航空等各領域，我們都會特別關注，也會進行金融方面的合作，加拿大也將投資400萬元跟工研院合作，以後也會有30家加國公司加入，這將是有史以來最大的。何曼麗說，加拿大資安單位加強與台灣合作，防止境外不實訊息和資安的處理，在台灣地方選舉方面，希望能夠有所協助。（記者田裕華攝）    ,https://news.ltn.com.tw/news/politics/breakingnews/5448846
川賴若通電話 盧秀燕：會建議總統反映台灣會成為區域和平守護者,政治,2026/05/25 15:13,市議員林昊佑詢問市長盧秀燕，若賴清德跟川普通電話，會給總統什麼建議。（記者蘇金鳳攝）國人都期待美國總統川普跟總統賴清德通電話，中市議員林昊佑今天表示，若一旦通電話成功，會建議總統跟川普如何反映台灣多元聲音？盧秀燕表示，要跟川普反映，台灣會成為區域和平的守護者，不會成為麻煩製造者，其次就是「美國應該重視台灣」，台美應該更緊密的結合。中市議員林昊佑今天在市議會指出，若川賴得以通話，盧秀燕會給賴清德什麼建議？盧秀燕表示，美中都非常重視區域的安全區域安全及穩定，所以台灣一定要向各方表示，台灣除了與鄰為善，台灣會成為區域和平的守護者，不會成為麻煩製造者。請繼續往下閱讀...盧秀燕表示，有些外國友人，認為台灣是麻煩製造者，因此台灣怎麼樣把握機會表示，台灣對於台海的穩定，對於亞太地區的穩定極為非常重視，而且會努力維護台海地區的和平穩定，這個非常重要，台灣不是麻煩製造者，所以這個非常重要的。其次要提到台灣處境為難，盧秀燕指出，台灣因為面臨外在的挑戰，也因此希望跟美國有盟友的關係，是為了美國的利益也是為了台灣的利益，雙方應該更緊密的合作，把餅做大，互相幫忙。盧秀燕強調，因此，「美國應該重視台灣」，台灣願意扮演我們和平關係的角色，但是也希望彼此盟友關係能夠堅定，不只是為台灣，也為了美國利益；一定要強調「彼此合作的必要性、重要性」，跟美國之間的關係才不會去斷絕或被邊緣化。她表示，簡單的說，建議要向川普反映，台灣願意成為和平地區區域和平的穩定者，不會成為麻煩製造者，第二件事情是如果亞太地區、東亞地區、兩岸要和平穩定的話，台灣跟美國盟友的關係要建立，跟中國之間也要釋出善意，只有跟周邊與鄰為善，那台灣才能安全，跟大家交朋友，為的是台灣人民的安全，。台中市長盧秀燕表示，若川賴通電話，會給2項建議。（記者蘇金鳳攝）    ,https://news.ltn.com.tw/news/politics/breakingnews/5448826
預算爭議未影響台船徵才  潛艦國造人才亟急,政治,2026/05/25 14:49,台船承擔國艦國造重責，需才孔急。（記者洪臣宏攝）儘管國民黨立委馬文君提案刪除無人載具預算，並凍結潛艦後續艦經費，台船今（25）日仍公告將招募283生力軍，起薪最高5萬5千元，台船表示，今年度因應潛艦、國艦國造、商船等「三大生產線」量能滿載，繼去年底大舉招募229名新進人員後，今年度必須再度強勢招考。國民黨立委馬文君提案刪除「無人載具前瞻技術多元整合開發計畫」，並凍結「潛艦國造第三階段後續艦籌建」預算，但不影響台船招募新血規劃。台船指出，近三千名員工中有八百餘位直接參與IDS潛艦國造計畫，需才亟急。請繼續往下閱讀...台船表示，本次招考將延攬工管類菁英共99名，包含造船、輪機、電機、機械、軟體開發、專案工程及各類管理人才。具備相關全職工作經驗工程師，進用起薪最高可達55000元，並將依據工作績效考核以逐年調薪。另外，釋出技術類職缺共184名。招募重點鎖定具備專業技能與證照的鉗工、電工、電子工、起重工，以及繪圖工等技術人才，並大量招募冷作工與電銲工人員，此二類別者不需具備證照，凡錄取者將安排基礎與生產實習訓練。甄試報名自即日起至6月17日（三）14:00 止，筆試日期為7月18日。詳細招考職類、資格條件及薪資待遇等，請詳閱甄試簡章及台船官網訊息。台船研發的軍用級無人船奮進魔鬼魚號。（記者洪臣宏攝）海鯤號持續推近海測進程，不受政治紛擾影響。（記者李惠洲攝）    ,https://news.ltn.com.tw/news/politics/breakingnews/5448820
輝達星群專案將啟動 都發局：尚未送都審、專案小組協助設計合法,政治,2026/05/25 14:40,台北市議員陳賢蔚在議會質詢關心輝達進駐北士科的進度；左為都發局長簡瑟芳。（圖擷取自台北市議會直播網站）輝達（NVIDIA）今（25）日上午正式發出通知，為慶祝台灣NVIDIA Constellation（星群）專案正式啟動，將於27日（本週三）上午在北投士林科技園區T17、T18預定地舉辦NVIDIA台灣員工大會，台北市長蔣萬安預料也將出席。台北市議員陳賢蔚今在議會質詢關心輝達進駐北士科的進度及法令相關問題，都發局長簡瑟芳表示，市府專案小組跟建築師、規劃單位保持密切聯繫，有法規的問題都會立即協助做設計面的調整。陳賢蔚今天指出，T17、T18即將有第2次的開工動土儀式，但氣氛背景與上一次新光為了跟市府打仗，弄了一個假開工截然不同；地方很開心也很關心進度，之前曾擔心新建造型不符合綠容率、無法設置光電板等，現在距離申請建照到實質動工，還有哪些步驟跟程序？專案小組協助的如何？請繼續往下閱讀...建管處長虞積學說明，輝達總部的建照還沒掛號申請；申請建照前要先將申請案送都市設計審議委員會審議，目前未送審。完成都市設計審議後，再到建管處掛號申請建照執照，才能依建築法規定申報開工，才能做建築工程的實際開工行為。簡瑟芳說，從已曝光的訊息看來，輝達並不是要動工。目前進度尚未送都市設計審議。而在實質進度有關都市計畫的部分，因為造型的緣故，涉及一些北士科牆面線的規定、建蔽率的放寬、綠容率協助不受綠化實施規則的限制，都有在幫輝達協助排除，但實質的內容要到都審去討論跟決定。簡瑟芳強調，建築師在設計過程都有跟專案小組互動，專案小組就以上相關問題都有給予建議，一直有跟規劃單位保持密切聯繫，有法規的問題都會立即協助做設計面的調整。陳賢蔚表示，輝達要在T17、T18基地上舉行員工大會，甚至準備要開工，展現集團要進駐北市科非常積極的態度跟企圖，市府必須積極的全力、主動的協助，把法規面向釐清，讓輝達趕快進場施作，才是全民的期待。    ,https://news.ltn.com.tw/news/politics/breakingnews/5448793
藍酸賴清德本命區「漏氣連連」 林志展：將促進黨內團結,政治,2026/05/25 14:19,民進黨南市黨部主委改選由副議長林志展（圖）以38票險勝立委郭國文。（記者王姝琇攝）民進黨南市黨部主委改選由副議長林志展以38票險勝立委郭國文，被外界認為是「賴系內戰」。議會國民黨團發言人蔡育輝今天諷刺，總統賴清德支持的林俊憲、郭國文都落敗，在本命區漏氣連連，是因失掉民心，民意反彈的結果。林志展今受訪表示，自己當選不僅不會影響賴清德總統在台南的威信，反而將成為黨內團結的最強助力。蔡育輝批評，賴清德口中喊著民主，在地方卻顯得言行不一，企圖以權力干預民主機制，先後在民進黨台南市長初選、市黨部主委選舉中力挺特定人選，卻未獲得壓倒性支持，甚至「漏氣」落敗，不僅引發基層反彈，更顯示出民心正在流失。請繼續往下閱讀...面對外界對黨內競爭可能引發裂痕，林志展認為，此次市黨部主委選戰對賴清德總統的政治威信不會有影響，反而對賴來說是好的，讓民進黨更加團結，民進黨本來就是競爭完就會團結的政黨，大家共同為台灣、為台南打拚。他強調，本身就是支持賴清德總統（賴系），只是我認為有辦法整合各派系，（參選）對民進黨是最大的幫助，這是我的堅持。林志展提到，市黨部核心價值在於「落實共治」，讓所有支持民進黨的黨員都能對黨部有信心，包括市黨部人事布局，秉持公開、透明、公正原則，針對即將到來的2026年市長、議員及里長選舉，黨部也將儘速啟動輔選與協調機制，包括規畫參選人與市長參選人合體拍照及相關文宣活動等，力求在地方選舉中達成「市長勝選、議員全壘打、里長大獲全勝」目標。    ,https://news.ltn.com.tw/news/politics/breakingnews/5448740
嫌馬英九「亂鬧」？ 李艷秋稱鄭麗文「輕蔑又輕浮」無最大黨主席格局,政治,2026/05/25 14:16,國民黨主席鄭麗文。（資料照）前總統馬英九指控馬英九基金會前執行長蕭旭岑、王光慈破壞財政紀律一事擴大，資深媒體人李艷秋指出，事發至今，風向已嚴重偏離是否侵吞捐款問題，強調馬英九有沒有生病和蕭、王二人有沒有財務問題是兩碼事；她也提到國民黨的反應「讓人感慨」，直指黨主席鄭麗文「輕蔑又輕浮」，不適合最大黨主席格局。李艷秋昨（24）日在臉書發文稱，整起事件在蕭旭岑第一時間稱馬前總統忘了很多事開始，風向就被導向馬英九健康問題；而「家屬的作為，等同對蕭旭岑的平反，也證實馬對蕭提出不實的指控。」請繼續往下閱讀...李艷秋拋出5點感慨，指馬英九如今拚命證明自己沒有失智，家人卻拚命證實他有病。這「等同宣告馬英九自此以後，就是個失智病人，大家不要在意，也不要相信他的言行。難道家人之間沒有緩和一點的作法，ㄧ定要搞到讓法院宣告馬英九失智嗎？」她還驚訝馬英九不知親人發公開信，顯示親人間已不再溝通，「很難想像曾經的第一家庭，會在這樣難堪的情況下，讓國人看到他們的家況。」李艷秋也將砲火對準國民黨中央，她揭露黨主席鄭麗文在內部訓練中，直言馬英九身體狀況很差，要求馬家人把他帶回家，不要再上新聞了。李艷秋痛批，可以理解蕭旭岑是鄭麗文與對岸溝通的重臣，不希望馬英九傷害到自己的愛將，「但是叫馬家人帶馬回家，下ㄧ句沒説出口的就是『不要讓他亂鬧啦！』這樣的口氣輕蔑又輕浮，不適合一個最大黨主席的格局」。針對蕭旭岑到底有沒有捲入財務問題，李艷秋狠酸，看鄭麗文偏袒的態度，民眾應該也不會從她這裡得到答案。曾照顧失智家人12年的李艷秋呼籲，遇此情況需要的是體諒與寬厚，但她也「無聊提醒一句」，既然馬英九如此在意清廉，就應該給他真相，「他有沒有生病」和「蕭王二人有沒有財務問題」，是兩碼事。    ,https://news.ltn.com.tw/news/politics/breakingnews/5448675
「你講的會計法規我比你還懂！」廖繼斌開嗆聲援蕭、王旁聽民眾,政治,2026/05/25 14:11,自稱會計人的旁聽民眾今日於馬英九基金會記者會上，公開主張應給基金會前執行長蕭旭岑、王光慈說明。（記者陳治程攝）馬英九委託人、前國安會秘書長金溥聰今召開記者會說明馬英九基金會前執行長蕭旭岑、王光慈涉嫌破壞財政紀律一事，槓上李德維為首的第三方調查小組。媒體提問期間，有自稱會計人的旁聽民眾質疑金擅開記者會揭露資訊不尊重董事會，強調應給蕭王說明，但隨遭基金會顧問廖繼斌回嗆「董事長不能開記者會？」並搶走麥克風，情緒相當憤怒。馬英九文教基金會今（25）日上午召開記者會，針對該會前首席執行長蕭旭岑、執行長王光慈涉嫌違背信侵佔之事進行說明，除金溥聰，馬英九基金會顧問廖繼斌、瀛睿律師事務所黃翊華律師和誠品會計師事務所台北所所長周志誠一同出席，分向大眾說明全案事證。請繼續往下閱讀...記者會媒體提問期間，有自稱「會計人」的旁聽民眾發表評論稱，通常會計的財務報表都是有憑證，收入、支出才能列帳，且有部分捐款人會願意透露名字，這類捐款進帳後，「或許就會放在我們一個組織裡面的，所謂的小金庫」。而這些錢到時也用在馬前總統、行政事務或年終獎金。他要求金溥聰等人要證實這些錢有進蕭王兩人口袋，有憑有證才能指控他們違反財政紀律。他再質疑，根據「財團法人法」，董事會是執行機關、為財團法人單位的決策與治理機構，認為任何調查報告都應由董事會主導決議通過；單憑業外管理階層召開記者會逕行揭露，是無法取代董事會的法定權責及決策地位，以及內部查核程序，其難保資訊的完整和公正性。金溥聰回應，他們目前的聲明都是在指他「涉嫌」，這也是馬前總統為何要「依法究辦」，強調把爭議交由法院釐清；然民眾也稱「也應該給蕭王說明的機會」，應該先循內控機制處理，程序才完整。不待民眾發言完畢，顧問廖繼斌發怒稱，我們基金會都太客氣了，反問「董事長不能開記者會？」，強調他比民眾還懂會計法規，「馬總統沒有問題」，隨即起身走至民眾旁把麥克風搶走，結束這段意外的互嗆插曲。馬英九基金會顧問廖繼斌公開與聲援蕭王、自稱「會計人」的旁聽民眾對嗆。（記者陳治程攝）    ,https://news.ltn.com.tw/news/politics/breakingnews/5448757
蘇巧慧「被球K到」與丈夫結良緣  「創意一句話」認識民進黨新北隊參選人,政治,2026/05/25 14:01,民進黨新北市長參選人蘇巧慧一句話創意自我介紹。（圖由蘇巧慧辦公室提供）民進黨新北市長參選人蘇巧慧今天在臉書發布「一句話認識民進黨新北隊」企劃，致敬日本大選的電視台「創意標題」文案，串聯黨內36位新北市議員、議員參選人，用一句話做創意自我介紹；蘇巧慧說，這項企劃是團隊的青年幕僚發想，盼透過幽默方式打破政治人物給人的嚴肅刻板印象，讓選民輕鬆認識新世代的新北隊。蘇巧慧先分享她與丈夫龍男的浪漫緣分，笑稱許多人看過專訪才知，她跟龍男當初相識的契機，竟然是因為在球場上被龍男投的球「K到」，才有牽手至今的緣分。請繼續往下閱讀...她笑說，新北隊的每位成員都很有創意，許多人有「吃貨魂」，例如市議員張錦豪自稱是「冰淇淋殺手」，市議員卓冠廷因愛吃西瓜，被長輩笑稱「西瓜太郎」，市議員參選人羅文崇是滷肉飯的狂熱者，市議員張嘉玲是堅定的「香菜派」，市議員參選人高乃芸則是手搖飲一定喝「全糖」，展現生活感的一面。新北隊成員也有多元跨界的「斜槓」實力，像市議員蘇錦雄在議會質詢結束後，會立刻到海邊mitafokod（撒網），市議員參選人陳俊諺因體格壯碩，曾被賴清德總統欽點為「板橋隊投手」，參選人陳韋任因開車技術一流，獲得「藤原拓韋」的稱號。此外，市議員顏蔚慈與廖宜琨都是資深的日本歷史迷，曾任英文老師的市議員李倩萍「以前拿筆改英文，現在拿筆改預算」，市議員李宇翔自爆以前不僅留過長髮，還曾是熱血的搖滾樂手，市議員張維倩則是「被政治耽誤的甜點烘焙師」，而市議員參選人吳奕萱因身材嬌小，自封為「海拔最低候選人」。蘇巧慧說，團隊挑戰用「一句話」，邀請民眾看見新北隊最真實的日常面貌，未來她與新北隊員會持續推出更多面向、照顧市民的具體政見，繼續帶著這份熱情與創意在基層團結打拚，一起為新北市帶來截然不同的新氣象。民進黨新北市長參選人蘇巧慧今於臉書發布「一句話認識民進黨新北隊」企劃，讓民眾輕鬆認識黨內36位參選人。（圖擷取自「蘇巧慧」臉書）民進黨新北隊參選人一句話創意自我介紹。（圖由蘇巧慧辦公室提供）民進黨新北隊參選人一句話創意自我介紹。（圖由蘇巧慧辦公室提供）民進黨新北隊參選人一句話創意自我介紹。（圖由蘇巧慧辦公室提供）民進黨新北隊參選人一句話創意自我介紹。（圖由蘇巧慧辦公室提供）    ,https://news.ltn.com.tw/news/politics/breakingnews/5448730
財劃法修法讓高雄少194億元   高雄藍營嗆陳其邁極不公道,政治,2026/05/25 14:00,陳其邁指財劃法修法讓高雄減少194億元，高市議會國民黨團搬數字嗆邁。（記者王榮祥攝）高雄市長陳其邁批評在野黨推動財劃法修法、害高雄短少194億元，高市議會國民黨團今天表示，115年度高雄市總預算追加減案，統籌分配稅款加補助及協助收入達1287億元，嗆陳其邁說法極不公道。高市議員李雅靜表示，財劃法修法前，高雄拿到的統籌分配款最高為112年度的526億元，她根據高市府最新送交議會的「115年度總預算追加減案」，統籌分配稅款高達799億元，加上補助及協助收入488億元，兩者加總達1287億元。請繼續往下閱讀...李雅靜進一步說明，相較於114年度統籌分配稅款520億元及補助與協助收入708億元（加總1228億元），115年度整體可支配財源不但沒減少，反而比114年度實質增加了59億元。黨團幹事長許采蓁指出，以高雄市113年度統籌分配款加計補助及協助收入，比前一年短少了62億元，整體財源直接縮水，但114年不但統籌分配款增加81億元，補助及協助收入也暴增192億元，整體財源較113年度大幅增加273億元。許采蓁說，這些數據清楚證明過去在財劃法中央與地方比例未調整的情況下，高雄市每年度可獲財源極度不穩定，呈現暴起暴落，讓地方施政充滿不確定性，推動修法不僅讓市政整體財源增加，更徹底解決地方財政不穩定的沉痾。市議員陳美雅則點出，市府推動各項社會福利都需要穩健的財政做後盾，她舉例如果沒有這次財劃法修法所挹注的財政空間，市府哪來資源可以順利推動公私立國中小營養午餐免費？陳美雅呼籲陳其邁，不應為選舉製造不實的政治口水，更應善用這筆實質增加的預算，專注於市政建設與市民福祉。    ,https://news.ltn.com.tw/news/politics/breakingnews/5448746
