Title,News_Type,date,content,url
駁斥陳智菡「繳不出卡費」指控 李貞秀轟她是民眾黨蛀蟲,政治,2026/04/15 16:09,被民眾黨中央除籍的前不分區立委、中配李貞秀。（記者塗建榮攝）民眾黨中配立委李貞秀遭到黨中評會除籍後，為捍衛自身人格清白，先是發聲明駁斥收錢並曝遭黨中央施壓，隔日更連上節目爆猛料，指控黃國昌立場前後不一、陳智菡向媒體放話李索要五千萬離職「對價」，但陳隨即反駁「子虛烏有」，反指李自陳經濟困難「繳不出卡費」，雙方持續互槓。李今續上節目回應，她支出一向精打細算，除之前車子意外爆胎，其他都是規劃好的花費，強調她是「不繳循環利息的」。李貞秀昨於三立節目「94要客訴」中表示，她之前收到訊息得知，黨團主任陳智菡已放消息給媒體說她要新台幣5000萬元才肯下台，被陳以「子虛烏有」駁斥，還稱李在就職前就透露過自己有經濟困難、卡費甚至繳不出來，籲李作為前民代，講話應有基本公信力。請繼續往下閱讀...李貞秀今（15）天中午上電視節目《中午鏡來講》表示，對於她爆料黨團主任陳智菡向媒體誆稱「她要5000萬」卻被否認一事，她解釋，她在就職前確實花了上千萬的「老本」，從競選、跑行程等都自己出錢，除了期間意外開車開到爆胎，她才向親友借8萬塊應急，她強調自己支出謹慎，「我都不要繳循環利息，是算好才繳的」，重申她為參選付出了許多金錢和精力。她接著批評，陳智菡向來會在黨內「鬥所有人」、是蛀蟲，跟黨主席黃國昌一起打壓老員工，甚至「歧視陸配、打壓陸配」，更說要不是之前被分配到司法法制委員會的黃國昌委員辦公室實習，他們兩人並不會有所接觸。主持人進一步問李貞秀，若她是因為沒人選黃所在的司法法制委員會才被派去實習，那是不是代表黃在黨內「人緣很差」？對此，李僅輕笑一聲，沒有予以回應。    ,https://news.ltn.com.tw/news/politics/breakingnews/5404774
博士論文被酸「維基貼上」陳亭妃怒告林國春、呂謦煒求償160萬一審敗訴,政治,2026/04/15 16:01,"民進黨立委陳亭妃（左）為了論文問題怒告林國春、呂謦煒2人。（資料照）國民黨新北市議員林國春2023年參選立委期間，與時任國民黨副發言人、現任基隆市政府民政處長呂謦煒合開記者會，控訴民進黨立委陳亭妃的長榮大學經管所博士論文涉抄襲，陳亭妃控告2人侵害名譽權，提民事訴訟請求連帶賠償160萬元；台北地方法院審理後，認為陳的論文引用資料方式，讀者若未查詢論文上所載的引用網址、並前後翻閱比對，將難以知道是引用別人的創作，2人已盡合理查證 且善意發表評論，今判決駁回陳亭妃之訴，林國春2人免賠。可上訴。林國春、呂謦煒於2023年指控，陳亭妃於2019年在長榮大學經營管理研究所所提交的博士論文「台灣六都行政管理績效衡量之研究」，經圖靈系統比對，有高達25%內容相似度，第25頁大幅摘錄維基百科條文，卻未標示出處，將條目網址直接列入正文，2人援引長榮大學規範，主張論文若非原創部分逾13%，即不具原創性，批評陳亭妃「抄襲、不法學位、智慧竊盜、學術詐欺集團」等。請繼續往下閱讀...陳亭妃認為，林、呂為了選舉操作而不實指控，不僅傷害其人格，也牽連無辜的指導教授，當年份該研究所的博士論文並未規定圖靈原創性比對須低於13%，且她的論文有引註引用的資料，合乎規定，2人未向長榮大學查證、確認其論文的引註方式合規，即以偏激、不堪的文字大筆批評，已逾越合理評論範疇，向2人求償160萬元。林、呂反駁指出，陳亭妃是5連霸立委，其誠信、操守與公共利益有高度相關，她的博士論文與維基百科內容有多處相同，他們以圖靈比對等方式查證後發表言論，已善盡合理查證義務，屬合理評論。北院法官比對後指出，陳的論文雖有註明資料來源，但引用資料格式確實有所不當，與學術倫理所要求的引註格式不符，確有瑕疵，論文是否挪用他人的創作，屬可受公評之事，2人已盡合理查證，評論用詞縱使尖酸，陳身為公眾人物，也應容忍退讓，故判2人無須賠償。    ",https://news.ltn.com.tw/news/politics/breakingnews/5404748
再槓陳智菡！ 李貞秀質疑「咬耳朵」事件早有預謀,政治,2026/04/15 15:56,李貞秀（圖左）3月16日第一次在立法院內政委員會質詢，但沒有官員上台備詢，民眾黨團主任陳智菡（圖右）上前「咬耳朵」救援李貞秀。（資料照，記者王藝菘攝）「中配立委」李貞秀前天被民眾黨中評會開除黨籍、失去立委資格，事後發文控訴黨中央以不正常管道施壓她離職，昨天接連上多檔政論節目陳述事發過程，如同對民眾黨主席黃國昌「開戰」。黃國昌今（15日）對此則冷處理，表示不會花太多時間在這件事上；李貞秀今日在《狠狠抖內幕》再度爆料，質疑3月自己對「空氣質詢」時，民眾黨團主任陳智菡上台「咬耳朵」的事情是預謀好的，因為那一天承受很多攻擊，說李貞秀是不適任立委。李貞秀在節目中還原3月16日站上立法院內政委員會質詢台，在質詢過程中無部會官員上台備詢，李貞秀對空氣質詢的過程，李貞秀指出，自己並沒有預期陳智菡會上質詢台「咬耳朵」，黃國昌事後還罵李貞秀，要準備好立委的事情，而針對「咬耳朵」事件，李貞秀事後對陳智菡說，雖然陳智菡是民眾黨官員，但還是要尊重中華民國憲法。請繼續往下閱讀...李貞秀指出，那一天許多媒體報導「咬耳朵」的事情，質疑李貞秀的能力與立委職位的不適任，質疑陳智菡這個行為從一開始就是有意為之，身邊的許多朋友也為李貞秀抱不平。台灣民眾黨黨團主任陳智菡（左）與中配李貞秀（右）。（資料照）    ,https://news.ltn.com.tw/news/politics/breakingnews/5404548
鄭麗文喊「鄭賴會」沒回應 國台辦嗆「道不同不相為謀」,政治,2026/04/15 15:54,國台辦發言人陳斌華。（翻攝直播）國民黨主席鄭麗文會見中共總書記習近平前，不斷喊話要見賴清德總統，聲稱沒「鄭賴會」就沒「賴習會」，至今仍未收到總統府正面回應。對此，中國國台辦發言人陳斌華今日以《論語》一句話回嗆說，「賴清德當局」頑固堅持「台獨」分裂立場，那就是「道不同，不相為謀」。陳斌華在國台辦記者會上表示，鄭麗文主席率國民黨訪問團訪問中國，順應了島內要和平、要發展、要交流、要合作的主流民意，對推動兩岸關係和平發展、維護台灣同胞利益福祉具有積極、重要的意義。而「賴清德當局」頑固堅持「台獨」分裂立場，處心積慮阻限破壞兩岸交流合作，違背民意，大失人心。請繼續往下閱讀...陳斌華嗆聲說，和平與戰爭、對話與對抗、合作與爭鬥，是截然不同的兩條道路。「因此，我用《論語》的一句名言來回應你的提問，那就是道不同，不相為謀。」鄭麗文今日則在國民黨中常會致詞，再度對賴清德總統喊話。她聲稱，放下個人的成見跟得失，為了整個國家、民族的未來以及和平大業，如果國共兩黨都可以坐下來談，為什麼民進黨跟在野黨不能夠坐下來面對面溝通？她祝福賴總統出訪順利，「麗文可以等你出訪回來」。    ,https://news.ltn.com.tw/news/politics/breakingnews/5404763
稱李乾龍座車被裝追蹤器  尹乃菁嗆賴清德要被彈劾,政治,2026/04/15 15:53,國民黨文傳會主委尹乃菁證實，副主席李乾龍的確在座車發現追蹤器，強調在民主國家發生這樣的事情「是足以被彈劾的」。（記者王藝菘攝）國民黨副主席李乾龍的座車傳出被裝追蹤器，國民黨文傳會主委尹乃菁今證實，李乾龍的確是在車的後方向燈發現追蹤器，她舉前美國總統尼克森的水門案為例，強調在民主國家發生這樣的事情「是足以被彈劾的」，更嗆賴清德總統，等他卸任失去保護傘，國民黨一定會追究到底，「你就天天去法院報到吧！」立法院5月19日將進行賴清德總統彈劾案表決，國民黨立院黨團更提前在4月13日就發出甲級動員令。請繼續往下閱讀...尹乃菁表示，在野黨被掌握到有情偵監系統的執政黨政府，不知道透過什麼樣的手段在車上裝追蹤器，這司空見慣，也不是第一次，來源也很難追查，所以李乾龍就覺得算了。我們抓到追蹤器後，就加強內部的各項安全檢查。尹乃菁說，但國民黨是最大的在野黨，今天掌握了情偵監和檢調系統的是賴清德總統，在在野黨的黨工職、候選人、縣市首長座車裝追蹤器，「在正常民主國家裡面，這是非常非常非常嚴重的事」。尹乃菁指出，大家都應該還記得前美國總統尼克森的水門案，他因為在民主黨裝了一個竊聽器，所以後來國會要對尼克森發動彈劾之前，他主動請辭，「在正常的民主國家發生這樣的事情是足以被彈劾的」。尹乃菁說，今天在中常會，討論到之前立委、中常委間散佈的一份名單，其中馬文君、王鴻薇等好幾位委員被點名要被追蹤，他們都表示非常擔心。國民黨有司法正義律師團，在整個大選的啟動和鄭麗文訪問大陸期間，不論是車子、手機和訊息等各方面，其實通通都在情治系統所監聽之中。尹乃菁表示，鄭麗文在出訪和入境時，所有的出訪行蹤、搭乘什麼樣的班機，要在哪個機場進出，如何做安全的部署，「我問問賴清德總統，你心知肚明，我們所有的單位是不是都跟你向上通報？」今天要不是國民黨空前的團結、做好保密的工作，賴清德是不是意圖要用這些側翼、網軍來擾亂鄭麗文訪問大陸的行程，「你不要以為我們不知道，我們都知道！」尹乃菁重申，李乾龍很寬厚、主席鄭麗文也很寬厚，覺得追蹤器司空見慣，反正也很難查到來源到底在哪裡。但身為國民黨的文傳會主委跟發言人，她要正告賴清德政府，從現在開始到未來大選的期間，如果再有任何一位國民黨的黨工職、參選人和現任的市長車上被發現追蹤器，我們一定會出動我們的司法正義律師團，上窮碧落下黃泉，找到這個追蹤器到底是出現在哪裡、是哪個單位所下的這麼糟糕的手段。尹乃菁對賴清德喊話，「賴總統，等你卸任之後，你失去了這個保護傘，我們一定也會追究到底，你就等著卸任以後天天到高檢署和法院去報到吧！」    ,https://news.ltn.com.tw/news/politics/breakingnews/5404755
軍購沒有親美反美問題 連勝文：1.2兆須嚴格審查反對空白授權,政治,2026/04/15 15:45,國民黨前副主席連勝文表示，軍購預算沒有親美反美問題，但1兆2千億元預算不能不謹慎，應嚴格審查，並反對空白授權，為民眾看緊錢包。（匯流新聞網提供）軍購特別預算遲遲無法推進審議，立法院長韓國瑜今召集朝野協商，討論今年度中央政府總預算案及「國防特別條例草案」。對此，國民黨前副主席連勝文今（15日）接受專訪表示，軍購預算沒有親美反美問題，但1兆2千億元預算不能不謹慎，應嚴格審查，並反對空白授權，為民眾看緊錢包。連勝文今天接受媒體專訪，針對軍購特別預算，連勝文表示，這並沒有反美親美問題，並引述前陣子新聞，連賣花、賣茶、賣鞋的都能成為軍火商，1兆2千億預算不能不謹慎，要為老百姓看緊錢包，且無論是台中市長盧秀燕、前國民黨主席朱立倫等人多個版本，目的就是不可能讓民進黨中飽私囊，無論是國民黨「3800億+N」版本，或黨內其他版本，他反對空白授權這件事，一定要針對有可能產生弊案的部分嚴格審查。請繼續往下閱讀...對於「鄭習會」提前，且「川習會」延期是否對美軍購有影響？連勝文認為，美國總統川普過去做房地產出身，針對國際關係操作模式都圍繞著衝突、擴大衝突、談判再妥協，進而得到既得利益。目前川普有幾個關注議題，其一是中國，再者是石油，而當美國人在中東遇到問題，美國人需要與中國維持友善關係。連勝文再指出，從911事件發生後，美國與中國持續維持著雙邊貿易的關係，且川普在中東的問題目前無法解決，只能拖延，當然希望能夠與中東談成協議，若沒有解決，是否有可能在亞洲發生大規模衝突且為了台灣都有待評估。談及黨內「連系」人事布局，連勝文表示，他不喜歡以派系區分，對他而言只有朋友與非朋友之分；弟弟連勝武負責青年事務推動，相關工作已持續進行，即使兩岸交流受限，仍會尋找其他方式推動青年交流與發展。    ,https://news.ltn.com.tw/news/politics/breakingnews/5404739
國民黨版軍購特別條例「3800億元+N」許毓仁：過去無此例華府感到陌生,政治,2026/04/15 15:43,"哈德遜研究所資深研究員許毓仁會中致詞。（記者田裕華攝）國民黨提出黨版「3800億元+N」的國防特別條例草案，與行政院1.25兆元預算規模相去甚遠。國民黨前立委、哈德遜研究所（Hudson Institute）資深研究員許毓仁今日受訪表示，台灣過去的立法程序沒有「+N」的案例，這樣的作法對華府來說是陌生的，國民黨主席鄭麗文需要對華府做完整的說明，雙方才能夠有比較好的了解。立法院長韓國瑜今日下午接見美國智庫「哈德遜研究所」、「保衛民主基金會」（Foundation for Defense of Democracies,FDD）及「胡佛研究所」（Hoover Institution）學者訪問團一行，許毓仁及美國退役海軍少將蒙哥馬利（Mark Montgomery）等專家與會，呼籲現在正是台灣展現國防決心的時刻。請繼續往下閱讀...許毓仁指出，目前國民黨提出來的版本，就美方來看的話，實際執行上面可能會有相當的難度。無論是預算還有相關彈性上的調整，希望透過協商還有調整的空間。也希望在「川習會」之前，儘快將軍購預算定案，這是一個非常重要的訊號。至於華府是否對國民黨等在野軍購特別條例的版本有意見，許毓仁表示，華府尊重中華民國的決定，但是就台灣目前面對比較險峻的國際局勢來說，華府希望台灣在自我防衛的部分，能做到自我承擔一些必須增加的預算。這樣子的話，就盟友之間在美國總統川普的眼裡，可能也會對台灣的印象會比較好。國民黨提出黨版「3800億元+N」的國防特別條例草案，是否受到中國因素影響，許毓仁說，並沒有實際的跡象，華府的評估是針對台灣目前的防衛需求，還有朝野各黨提出來的版本，是不是符合目前台灣實際的需要。對於國民黨的版本是否會影響鄭麗文赴美的待遇，許毓仁認為，的確會有影響，尤其以美方的觀點來說，台灣最大的反對黨當然要強力監督軍購，但是提出來的版本，也要兼顧可行性，以及過去立法程序上的慣例及做法。如果到時候通過的是一個比較不符合實際案例的做法，鄭麗文到華府可能要面對比較多的說明，尤其是在國會跟行政部門上面，可能都會有相關的質疑。    ",https://news.ltn.com.tw/news/politics/breakingnews/5404747
李貞秀今天生日！ 網友笑玩「可以對她說那4個字嗎」哏創意滿滿,政治,2026/04/15 15:39,有網友發現今天是被民眾黨開除黨籍的李貞秀生日，紛紛為她送上「4字祝福」。（記者塗建榮攝）日前遭民眾黨開除黨籍的中配立委李貞秀恰巧於今（15日）生日，網友不忘大玩創意哏「可以跟她說4個字嗎？」，有網友留下最初代表日本的排外名句「国に帰れ」、也有網友發揮諧音創意「貞眾再見」。自從社群平台「Threads」興起後，台灣人喜歡發一張代表自己今天生日的照片（如證件照、生日蛋糕），期待有人留言4個字「生日快樂」。而李貞秀的生日正好是今天，樂於在網路上玩哏的台灣網友當然不會放過這個大好機會，不約而同留下「国仁歸九」、「望你早歸（中國）」、「遣返中國」、「間諜遣返」。請繼續往下閱讀...還有些網友提到「消滅藍白」、「功在焚草」、「完事回中」、「爆破國蔥」、「血流成河」、「國昌老師」、「鈕鈷祿秀」等，創意無限。     在 Threads 查看    ,https://news.ltn.com.tw/news/politics/breakingnews/5404680
不滿部會約訪一直拖！周玉蔻揚言「回到一線」大鬧記者會,政治,2026/04/15 15:38,資深媒體人周玉蔻。（資料照）資深媒體人周玉蔻因不滿某中央部會官員，對於其節目的約訪一再拖延，今日在臉書發文表示，要是對方持續下去，她就要出席該部會的例行記者會。她還說，「COCO正義大鬧記者會」可是盛名在外的。國防特別條例、勞動部印度移工等各項議題受到廣泛討論之際，周玉蔻今日在臉書發文指出，立法院長卓榮泰率領的某中央部會首長，對於她的廣播節目「新聞放鞭炮」的約訪一直拖拖拉拉、公文來來往往。請繼續往下閱讀...周玉蔻透露，她已經麻煩中間幫忙聯繫的朋友轉告對方，再這樣下去，「姊姊我就要去出席他們部會的例行記者會啦！」周玉蔻也說，自己正考慮回到第一線採訪戰場中，她也表示，「Coco正義大鬧記者會可是盛名在外的啊！」    ,https://news.ltn.com.tw/news/politics/breakingnews/5404674
談中共惠台措施  連勝文稱「過去早就存在」、如今多是「重新恢復」,政治,2026/04/15 15:34,「鄭習會」後中共推出10項涉台措施，國民黨前副主席連勝文今受訪表示，這並不會是影響選戰的唯一利多，因為相關交流與政策「過去其實早就存在」。（匯流新聞網提供）針對「鄭習會」後中共推出10項涉台措施，是否有助國民黨2026選情？國民黨前副主席連勝文今（15日）接受專訪表示，並不會是影響選戰的唯一利多，因為相關交流與政策「過去其實早就存在」，這些機制如今多是「重新恢復」，但最重要的利多就是國民黨是少數能同時與中國、美國及日本溝通的政黨。連勝文今天接受媒體專訪。對於「鄭習會」後國民黨主席鄭麗文路線是否確立並凝聚黨內共識，連勝文指出，國民黨的凝聚力必須透過不停溝通，互動同時也要透過選戰勝利形成，並非單一事件就能讓黨凝聚，這是累積性的，作為領導人必須要透過獲勝，且不單是個人而要是黨的獲勝，才能有黨的共識，需要花時間耕耘。當然，黨主席工作註定會得罪人，要忍辱負重，遇到委屈只能吞忍，後續勝選證明自己是對的，久而久之就會吸引越多人認同，並非以單一事件定義。請繼續往下閱讀...另外，連勝文也說，所謂「鄭習會」後的10項惠台措施，並不會是影響選戰的唯一利多，因為相關交流與政策「過去其實早就存在」，包括農產品銷售、影視創作、兩岸經貿論壇等，都曾在過往推動過，並非現在才出現。這些機制如今多是「重新恢復」，但是否能在市場中取得實際利益，仍取決於個別企業自身能力，「門可以打開，但做不做得到是你自己的事」，台灣企業也不會單純認為只要政策開放就能獲利，仍需靠競爭力爭取機會。連勝文指出，相關交流不會是唯一利多，但更重要的是透過兩岸及與美國、日本的互動，凸顯國民黨是少數能同時與中國、美國及日本溝通的政黨，「有管道可以立刻溝通」，這本身就是一項優勢。相較之下，若政黨只能單向對抗或選邊站，反而容易陷入對立與衝突；能維持多方溝通、讓各方「至少表面上可以做朋友」。    ,https://news.ltn.com.tw/news/politics/breakingnews/5404714
張啓楷自爆「幫國民黨」延會 林俊憲：藍白在怕誰被抓？,政治,2026/04/15 15:34,民進黨立委林俊憲。（資料照）民眾黨團今日提案延長立法院第11屆第5會期至今年7月31日，民眾黨團提議將該提案逕付二讀，依各黨團共識進行表決。表決結果，贊成59人、反對47人，贊成者多數，民眾黨團提議照案通過，本案逕付二讀、交付黨團協商。對此，進黨立委林俊憲表示，張啟楷上禮拜在節目上承認「那時候國昌，我們幾個就討論說，老實講這有一點是幫國民黨，那我們就說去年就全部不休會。」請問又是有哪個藍白的罪犯害怕被抓到了嗎？林俊憲在臉書PO文表示，民眾黨這幾天真的很努力在刷新大家對自我打臉的認知下限，去年立法院一路延會，形同整年都沒有休會，當時張啟楷對外是怎麼說的？他強調：「是為了審查福國利民的法案」，還特地出面澄清，深怕外界有所誤會。結果有網友挖出，張啟楷上禮拜在節目上的發言。他突然一臉神秘地跟主持人說要「講內幕」，還一副得意的樣子爆料：「那時候國昌，我們幾個就討論說，老實講這有一點是幫國民黨，那我們就說去年就全部不休會。」請繼續往下閱讀...林俊憲指出，這段話擺明了就是替那些涉案的國民黨立委撐起立院保護傘，讓他們不用去坐牢，那請問，去年在高鐵上受訪、一本正經替延會辯護的那個張啟楷，是跟真的國昌老師一樣被關在地下室了嗎？民眾黨這8席雖然換來換去，但始終不變的是這種自我打臉的搞笑本色。林俊憲直言，現在預算愛審不審、軍購一拖再拖，前陣子又提案要延會，請問又是有哪個藍白的罪犯害怕被抓到了嗎？最後，還是引用黃國昌的名言送給你們：「貪汙就去坐牢，不要再鬼扯了」。    ,https://news.ltn.com.tw/news/politics/breakingnews/5404709
美國智庫拜會籲展現國防決心 韓國瑜：立法院也有荷姆茲海峽,政治,2026/04/15 15:24,"立法院長韓國瑜接見美國智庫學者訪問團一行，會中並與哈德遜研究所資深研究員許毓仁交換意見。（記者田裕華攝）立法院長韓國瑜今日下午接見美國智庫「哈德遜研究所（Hudson Institute）」、「保衛民主基金會（Foundation for Defense of Democracies, FDD）」及「胡佛研究所（Hoover Institution）」學者訪問團一行，美國退役海軍少將蒙哥馬利（Mark Montgomery）直言，台灣今年國防支出要達到GDP的3.6%，若台灣無法在這方面展現決心，美國總統川普會覺得全台灣不分政黨都有責任，現在正是台灣展現國防決心的時刻，而韓國瑜是解決紛爭的最佳人選；韓國瑜則回應，「中東有荷姆茲海峽，立法院也有一條荷姆茲海峽」。美國智庫「哈德遜研究所」、「保衛民主基金會」及「胡佛研究所」拜會韓國瑜，國民黨前立委、哈德遜研究所資深研究員許毓仁及蒙哥馬利等專家與會。許毓仁表示，很感謝韓院長安排這次會面，希望能將華府的聲音傳遞到台灣來。請繼續往下閱讀...蒙哥馬利指出，台灣GDP成長7%，民主看起來吵吵鬧鬧，非常蓬勃且有言論自由，不久前才去過烏克蘭，烏克蘭不只要對抗俄國，還有來自伊朗、北韓的壓力。烏克蘭的例子對台灣來說是一個值得參考的教訓，台灣必須要現代化自己的軍事能力，有能力製造自己的設備、系統，並具備彈性，烏克蘭的例子是最好的借鏡，後備軍人也需要有充足的軍力。蒙哥馬利說，烏克蘭的國防支出高達40%，當然不希望台灣面臨同樣的情況，台灣預計花費GDP的5%在國防支出上，若要達到這個目標，今年要達到GDP的3.6%，雖然他非常喜歡台灣，但他知道若台灣無法在這方面展現決心，美國總統川普會覺得全台灣不分政黨都有責任，現在正是台灣展現國防決心的時刻；他很高興今日來訪，因為韓院長是解決紛爭的最佳人選。韓國瑜則回應，中東有荷姆茲海峽，立法院也有一條荷姆茲海峽。韓國瑜表示，沒有安全就沒有一切，廣大台灣同胞的心中都慢慢浮現這樣的擔憂，看到4年前爆發的烏俄戰爭、泰柬衝突，以及近期的中東戰事，讓我們一而再、再而三地警惕自己，台灣同胞現在對安全的渴望與追求，以及心理上各個方面的安全意識是非常高的。總而言之希望台海安全、世界和平，地球村的人民安居樂業、平平安安，這是全人類共同的願望。    ",https://news.ltn.com.tw/news/politics/breakingnews/5404710
