Title,News_Type,date,content,url
川習會前接受英媒專訪 鄭麗文透露先見習近平原因,政治,2026/05/14 04:46,國民黨主席鄭麗文。（資料照）國民黨主席鄭麗文近日接受英國新聞頻道《Sky News》專訪，記者詢問，外界認為中共中央總書記習近平會利用這次川習會機會，向美國總統川普傳達「兩岸最終走向統一是不可避免的」。鄭麗文認為，川普最在乎的是美國國家利益，「我不希望台灣成為大國博弈的籌碼，這是為什麼我先到北京的原因」。此次英國《Sky News》專訪，鄭麗文以中文回答的方式進行。記者進一步詢問，光靠某種程度的外交手段，就能阻止中國得到最終想要的（統一），這樣的想法不會太天真（naive）嗎？鄭麗文表示，「大家的疑慮我都非常清楚，但我們不能因為這樣，就停止對和平的追求」。至於未來，大家所謂的終極安排是什麼？或許不是我可以主導或表達意見的。    ,https://news.ltn.com.tw/news/politics/breakingnews/5436259
赴中工作「疑配對成功」險困中國  她親曝國有器官鬼故事毛炸,政治,2026/05/14 01:02,中國活摘器官問題近年來受到國際高度關注。（歐新社）中國活摘器官問題近年來受到國際高度關注，儘管相關爆料、證據攤在眼前，台灣內部有些人仍當「都市傳說」看待。一名自稱曾是深藍支持者的網友近日在社群分享約莫10年前到中國工作，疑似「器官被配對」的遭遇，差點離不開中國，順利逃走後中方竟然還不斷打電話，以各種理由誘騙她再次去中國，這段「鬼故事」讓大批鄉民看了寒毛直豎。網友11日在Threads上發文說，2016年5月到上海工作，出發前必須去體檢，據了解，檢查報告會直接寄給中國政府。當年她抵達上海後，那邊的人告訴她，台灣人必須要再到上海主要服務外籍人士的醫院做檢查，「當時我完全沒有去想過國有器官是真的，我覺得是假的。」請繼續往下閱讀...到上海工作的第2年，原PO待的公司再次提供上海的國際醫院全身健檢，指稱是員工福利。原PO前一年檢查身體沒什麼毛病，這一年被醫生說心臟不好，當下原PO信以為真，醫師還強烈建議她在上海接受治療，後來陸續接著很多政府機關的通知，要她去報到，理由是說她稅務有問題，「於是我去問了總公司，總公司的人看到來自中國政府的信件，連看我都不敢看，只說不知道。」原PO起初只當自己收到詐騙信，沒有多加理會，後來直接收到中國政府的手機簡訊，內容指稱因為她都沒有去報到，將永遠不能離開中國，她才去了趟上海國稅局，但查稅結果卻是「繳稅金額0」。但她也沒有想太多，就這樣離開了國稅局。原PO接著說：「離開國稅局後，就想剛好休假應該去華夏銀行辦事。說也奇怪，華夏銀行經理似乎早已收到通知我會去那裡，拿出來了一張紙，上面是個人資料和家人資料，強迫我必須填滿才准離開。我說為何我台灣的資料必須要給中國政府？經理說今天沒填好不能離開。後續我發現我已經被政府派人跟蹤了，只是我至今還不知道是誰跟蹤我，開始想著是否是身兼共產黨黨員身分的同事。」越想越奇怪的原PO，同一年決定要離職回台灣，「當初跟公司談的，就是只要做滿5個月，公司就要免費提供回程機票。本來公司已經訂好一張來回機票給我，卻突然要我退還，他們重新訂，因為返台時間是十一連假，沒有票訂，也沒有告訴我何時可以離開，還要我立刻搬離宿舍。於是我偷偷在另外一個網站上訂好，我也不說我何時走，我感覺公司裡面有人跟中國政府說好不讓我離開。離開當天早上，我不敢跟人家說我要去機場，我是跑的，直到我上了飛機我才知道我是安全的。」原PO離開中國後，還是有在使用中國的微信，畢竟因為工作上會用到，沒想到某天又再次於微信收到中國政府的簡訊，要她回中國「配合調查」，「我不知道我做了什麼，我一直在想是跟我的心臟檢查有關係嗎？我返台後去找了很多心臟權威醫師，他們幫我做了很多檢查項目，我的心臟很好，沒有任何問題。」「因為中國政府用微信傳簡訊給我，我真的有點嚇到，我就想刪除微信帳號，但微信錢包還有錢，我想說用捐錢方式清空錢包，才能刪除帳號，但微信給我的答覆，要我回中國辦理才能刪除帳號。我後來刪除了微信軟體，再也不敢使用微信了。去年中國政府再次透過一家翻譯公司，邀請我去參加翻譯競賽，他們願意出所有費用，我拒絕了。」最後原PO寫道，「這是我親身經歷的中國鬼故事，我不知道我做了什麼。我以前是超級深藍支持者，我曾經超級挺深藍，曾經馬英九、韓國瑜都是我的偶像。我已經清醒，因為我知道國民黨就是共產黨！」其他網友們看完紛紛留言，「你真的算命大逃過一劫」、「天哪！好可怕，所以當中國人對你說身體某某地方不好會不會就是反話，因為他們相中你的器官了」、「這樣有點理解中國人為什麼很想來台看醫生，會不會就是知道自己國家的手段」、「應該是心臟跟某位大官或是權貴有匹配，所以想盡辦法要把妳抓進醫院。幸虧妳很聰明，要逃走前都守口如瓶」、「絕對是跟高官富商配對成功了，早期會用套路，現在是直接抓或是假車禍了」。     在 Threads 查看    ,https://news.ltn.com.tw/news/politics/breakingnews/5436227
遲遲不處理區桂芝 胡川安嘆：就讓統戰老師跟北一女連一起好了！,政治,2026/05/14 00:15,北一女教師區桂芝。（資料照）北一女中教師區桂芝近日上節目因為一席舔共言論引發輿論撻伐，還被中共官媒央視截錄下來做內外宣。面對外界一片要求裁處的聲浪，北一女中至今未有明顯動作，挨轟護航。中央大學中文系助理教授胡川安13日發聲慨歎：「北一女看來已經抱著要跟區桂芝的名譽綁在一起了」。胡川安13日曝光北一女校長發給全校老師的內部信件，並未表示要對區桂芝做出什麼懲處，還試圖護航區桂芝並非受邀上中國官媒，而是接受台灣某節目專訪，後續被剪接到到其他平台播放。至於其言論到底是不是屬於言論自由範疇，校方要另行請示教育主管機關。請繼續往下閱讀...胡川安怒斥，北一女校長根本無視區桂芝的言論已經對社會和這所擁有122年歷史名校很大的困擾，到現在還是官腔官調，放任學校因為區桂芝葬送校譽。14日晚間，胡川安又於臉書發文，「昨天將北一女校長秘書傳給全校老師的信公布，今天媒體都爆了。校務系統迂腐，不處理區桂芝，我實在不知道她有什麼強硬的背景，學校不敢處理她。不少學生反應她上課都在講現在的政治，不好好上她熱愛的古文，我覺得她的古文程度就國文的那幾篇啦！我作為一個中文系教授就看妳沒有。」「而且還會說學生被政府洗腦，課本都亂寫，建議學生看楊渡和蔡正元寫的《台灣史》，說有根據。蔡正元是階下囚，是罪犯，而且學過什麼歷史……這什麼！不是熱愛古文嗎？而且國文老師懂什麼臺灣史，不是歷史老師，在指點什麼歷史！北一女看來已經抱著要跟區桂芝的名譽綁在一起了，就讓統戰老師跟北一女連在一起好了，校友們、同學們、老師們，你們願意嗎？」不怕區桂芝毀校譽？他曝光北一女校長內部信：到底多站她那邊    ,https://news.ltn.com.tw/news/politics/breakingnews/5436151
為決策負責！謝衣鳯：彰化若敗選 鄭麗文應比照蔡英文請辭黨主席,政治,2026/05/13 21:49,國民黨立委謝衣鳯今晚接受資深媒體人黃暐瀚專訪。（翻攝自風傳媒YouTube）國民黨2026彰化縣長提名，徵召考紀會前主委魏平政參選彰化縣長，原本民調最高的立委謝衣鳯未獲提名。謝衣鳯今晚接受資深媒體人黃暐瀚專訪時表示，提名一個沒有民意基礎的人選彰化縣長，幾乎沒有贏的機會，如果將來敗選了，黨中央就要為這個決策負責。謝衣鳯舉2022年九合一大選為例，她說，當時民進黨主席蔡英文對很多縣市有個人想法，就跳過黨內初選或民調，直接以她的意志徵召，結果大敗，蔡英文就為自己的決策負責下台。請繼續往下閱讀...主持人追問，彰化若敗選，國民黨主席鄭麗文就要下台？謝衣鳯說，黨中央不聽基層的意見，光憑黨部主委的意見，就徵召一個沒有地方民意基礎的人出馬選縣長，就要為自己的決策負責。她說，去年12月鄭麗文到彰化來，還當著許多幹部、黨代表說「謝衣鳯就是最強人選」，怎麼換了新的縣黨部主委，就換一個過去經歷民調、沒經過選戰洗禮的人出馬選縣長。這是不是代表，以後選縣長，你都不用耕耘，只要縣黨部主委點頭，就可以獲得黨中央的提名。謝衣鳯還爆料說，魏平政曾當著媒體的面說，只要謝衣鳯要選、他就不選，結果今天魏平政被徵召了，他有說不要嗎？「我從來沒有說不選」，這是不是魏平政從頭到尾就把她抬出來作一個「幌子」，而那些一直期待她出馬的支持者，「我怎麼交代」。    ,https://news.ltn.com.tw/news/politics/breakingnews/5436162
國民黨彰化縣長提名歹戲拖棚 黨中央與地方派系妥協打破原則,政治,2026/05/13 21:35,國民黨中常會徵召考紀會前主委魏平政（右）參選彰化縣長。國民黨主席鄭麗文（左）說，國民黨是抱著必勝決心打彰化縣選戰。（記者羅沛德攝）記者劉曉欣、張瑞楨／特稿國民黨彰化縣長提名作業「歹戲拖棚」，諸多「髮夾彎」讓外界看得霧煞煞。表面上，黨中央未提名「最強參選人」謝衣鳯，原因是她的父母與弟弟反對；實際上，最終徵召魏平政，是國民黨中央與地方派系角力衝突與妥協的結果，如果敗選，將重創黨中央與鄭麗文威信，如何整合地方山頭派系，如何讓選民接受被視為「空降」的魏平政，是國民黨亟待克服的難題。這場提名之爭，原本是立委謝衣鳯與兩位前副縣長洪榮章、柯呈枋的三人競爭，最後卻是在縣黨部主委蕭景田力薦下徵召魏平政，民眾黨蔡壁如也在此時宣布參選彰化縣長，外界解讀是，國民黨大喊「藍白合」，卻推出目前支持度不高的人選，在「有機可乘」之下，蔡壁如希望自己能取而代之，成為藍白彰化縣的共主，是否能如願，目前仍混沌，但肯定會為國民黨的選情再添變數。請繼續往下閱讀...彰化縣是百萬人口大縣與「搖擺縣」，年底縣長選舉是兩年後總統大選的前哨戰，謝衣鳯被視為呼聲最高的接棒人選，原本期待透過民調取得提名，國民黨中央卻直接徵召，基層難以理解為何轉變，而徵召的「空降」人選，正是幫蕭景田打贏官司的「王牌律師」魏平政，20年前曾以無黨身分參選社頭鄉長，最後輸給了國民黨提名的蕭如意，這段過程並非「往事如煙」。這場彰化縣長提名大戲，明著是「政三代」謝衣鳯有家族不同意的障礙，卻暗藏著黨中央與地方派系的角力與妥協，國民黨需要鞏固藍營「農漁水、軍公教」鐵票，更需要派系角頭的人脈與財力相挺，從賽局理論的觀點分析，黨中央無力移除謝家的障礙，徵召實力與財力雄厚的蕭景田所推薦的人選，就成為最佳選擇，不過，成也派系勢力，敗也可能是派系角頭，未來如何整合，將是能否勝選的關鍵。國民黨彰化縣長參選人魏平政在國民黨彰化縣黨部主委蕭景田（左）、組發會主委李哲華（右）陪同下召開記者會，說明參選理念。（記者羅沛德攝）    ,https://news.ltn.com.tw/news/politics/breakingnews/5436156
彰化三傻他最悲情！起步最早輸給空降 黨工出身只能說「祝福」,政治,2026/05/13 21:33,彰化縣工策會總幹事洪榮章爭取國民黨縣長提名未果，各界都覺得惋惜。（洪榮章提供）國民黨徵召魏平政參選彰化縣長，最讓各界最不捨的是前彰化縣副縣長、工策會總幹事洪榮章，因為起步最早，為了爭取提名，已經跑了900多個日子，如今卻是真心換絕情，偏偏又是黨工出身，面對國民黨的提名只能說「祝福」！洪榮章表示，對於一路走來的支持民眾，他真心感謝，雖然他無法走到被提名縣長這一天，但只能說是自己努力不夠，相信人生的路，每段歷程都有其意義與安排。請繼續往下閱讀...洪榮章以往都是為別人助選、為國民黨提名人抬轎，為國民黨打贏勝選，這一次換自己上場，要爭取提名，爭取自己從小生長的家鄉彰化縣縣長提名，原以為他的對手是立委謝衣鳯、還有前副縣長柯呈枋，但最後徵召的是考紀會前主委魏平政，還讓謝衣鳯自諷他們三人是三傻。雖然被謝衣鳳說是「三傻之一」，但洪榮章對於國民黨提名作業，沒有任何怨言與批評，只因為他曾是黨工，他說自己能說的只有「祝福」，祝福未來一切順利。    ,https://news.ltn.com.tw/news/politics/breakingnews/5436150
卓冠廷要求跨縣市監測調查鼠患 新北市府將提合作建議,政治,2026/05/13 21:15,新北市議員卓冠廷引述市府研考會1999有關鼠患進線通報數據，自今年3月至5月12日止，相關通報已達429件。（翻攝新北議會YT頻道）台北市「安鼠之亂」鼠患受矚目，新北市淡水區日前也出現一例漢他病毒案例。新北市議員卓冠廷今（13）日質詢指出，今年3月至5月中旬，新北1999專線已接獲429件鼠患通報，5月份通報量有特別增加趨勢，要求市府也藉此機會進行鼠患監測模型等調查。副市長劉和然回應，可能因民眾近期提高警覺、見鼠即刻通報，使數據產生如此變化；至於議員要求向中央、周邊區域提出調查合作，市府願向中央、周邊縣市提出合作建議。卓冠廷引述市府研究發展考核委員會1999市民專線有關鼠患的進線通報數據表示，自今年3月至5月12日止，1999鼠患相關通報已達429件，其中包含清理鼠屍183件（需於2小時內清整完畢）、通報環境髒亂或老鼠蹤跡237件，及提供防治建議9件，其中5月出現特別增加趨勢。卓冠廷也詢問，鼠患增加是否可能與非洲豬瘟防範改變廚餘處理方式有關？請繼續往下閱讀...環保局長程大維說，目前氣候影響或廚餘議題，各方說法不同，尚無長時間明確資料可佐證。卓冠廷指出，台北市曾編列相關調查預算，而新北市在環保局預算中，僅看到人事加班費等執行滅鼠的經費，不見「鼠類族群調查」或「鼠患監測模型」的計畫，處理鼠患必須要有實質調查計畫，且應要跨縣市合作，中央有針對全國港區進行老鼠問題的專案調查與研究，要求市府加強與中央、周邊區域合作，儘速向相關單位提出合作計畫。劉和然說，市府以環境清理為要務，新北有里環境認證制度，借重里長、志工團隊定期維護，從源頭杜絕有利老鼠生存的環境，投藥如無配套，可能誤傷民眾寵物或野生動物；鼠患民眾憂慮的傳染病問題，現況觀察在控制中，至於議員建議是否可藉此機會展開鼠類族群等調查，市府將向中央、基北北桃提出合作建議。    ,https://news.ltn.com.tw/news/politics/breakingnews/5436144
納入再生能源、熱能! 政院明擬拍板「能源管理法」修正草案 ,政治,2026/05/13 21:15,行政院會明擬通過「能源管理法」修正草案。（資料照）為提升能源效率與強化管理，行政院會明擬通過「能源管理法」修正草案，將「再生能源」與「熱能」納入條文中的能源範疇，也將透過公開能源銷售統計資料、加重相關違法罰則等強化能源需求面管理。修正草案將「再生能源」與「熱能」納入能源範疇，藉以完整能源定義；為強化能源需求面管理，也將公開能源銷售統計資料，盼提升能源資訊運用效益，同時要求能源用戶應設置自用發電及儲能設備、強化地方政府執行節能與用能管理的稽查量能，並會加重違反「能源管理法」的處罰，及檢討相關違法態樣，盼促廠商及業者落實節能相關規範。請繼續往下閱讀...目前石油、天然氣、電業等已有相關法律管理其市場秩序及供應，為完善其他經中央主管機關指定的能源產品，因此草案明定，中央主管機關得公告指定「特定」能源產品的輸入、輸出、生產、銷售業務，業者應經許可並取得執照後始得經營，而經營許可、換發執照等管理事項，中央也得委辦地方縣市辦理。    ,https://news.ltn.com.tw/news/politics/breakingnews/5436146
Threads熱議「聶永真美學」 蔡英文暖回︰用設計建立尊重專業,政治,2026/05/13 20:52,目前社群平台Threads掀起挖掘聶永真「設計足跡」熱潮，有網友分享他在2016年為前總統蔡英文設計簡單明亮的競選視覺，意外釣出蔡英文回應。（圖擷取自Threads）台灣知名設計師聶永真近期因得標「改版台電LOGO」，被藍白連日指控涉嫌政治酬庸，兩黨支持者也輪番砲轟、圍剿台電花96萬浪費錢，輿論引發各界關注。隨著相關話題在網路延燒，陸續有網友分享翻閱聶永真過往設計，意外知曉他的美學融入台灣社會的各行各業之中，就連前總統蔡英文也讚不絕口。據了解，目前社群平台Threads用戶出現了挖掘聶永真「設計足跡」的熱潮，像是他曾經為周杰倫、張惠妹、蔡依林、五月天等著名藝人歌手操刀的專輯封面，為經濟部、監察院、數發部等公家機關設計的新LOGO，以及中國信託享想生活卡、台北101聯名信用卡、第50屆金馬獎主視覺、郭元益150與155週年伴手禮盒等。請繼續往下閱讀...還有人分享，瀏覽完聶永真截至今年5月為止的設計作品，自己最喜歡的設計是在2016年，聶永真為民進黨總統參選人蔡英文設計競選視覺，以及一系列卡片、專輯等周邊，更直言這是「台灣選舉美學的天花板，沒有之一」。該文發布後，還意外釣出蔡英文本尊暖回︰「用設計改變選舉文化，用設計建立尊重專業。」其他網友也留言回應，「當初真的有被驚艷到」、「這個真的超美，簡單有質感」、「好的設計過了幾年也不過時！」、「可惜台灣大多人還沒有尊重設計的觀念」、「記得是從這次開始，選舉的設計愈來愈被重視」、「2016 蔡英文競選視覺根本史上最美，整個國家大家一點一滴集合起來成為完美的圓」、「真的超美，平常不會想拿競選旗子，為了這個破例了，那時候深深感受到台灣美學進化」。另有人吐槽，「懂得尊重專業就不是藍白了」、「華國美學是『四邊包繩不打洞』  」、「這次設計爭議，再次證明為什麼隔壁兩棚的文宣總是醜到爆」、「只有民進黨懂得設計美學用專業，看看華國美學真是慘不能賭（慘不忍睹）！」、「大家都很羨慕日本很有美感，卻忘記了越是票投國民黨，越是離不開中華美學」、「講到LOGO，我只服張善政，沒有之一，疑似直接把自己的選舉LOGO拿過來改成桃園市的？」。台電新Logo遭轟政治酬庸！聶永真5點聲明：交出專業無愧於心藍白批中油、監院LOGO也都是他！聶永真「反串罵自己」網笑瘋小草狂罵台電LOGO！ 律師打臉：民眾黨淡藍色調就是聶永真做的台電LOGO改字體浪費錢？ 他舉台中春聯、花蓮燈會「一堆人安靜」聶永真爭議燒出「尋寶潮」！101聯名卡掀萬人朝聖 賈永婕一看也淪陷     在 Threads 查看     在 Threads 查看     在 Threads 查看     在 Threads 查看     在 Threads 查看     在 Threads 查看     在 Threads 查看     在 Threads 查看    ,https://news.ltn.com.tw/news/politics/breakingnews/5435840
曾當面問柯文哲這是不是買官  林靖冠踢爆朝天宮每年捐幾百萬給蔡春綢的基金會！,政治,2026/05/13 20:38,民眾黨立委蔡春綢。（資料照）曾擔任北港朝天宮董事長的80歲前立委曾蔡美佐，遭圍毆事件持續延燒，前陣子退黨的前民眾黨雲林黨部主委林靖冠昨（12日）爆料，現在由雲林縣議會副議長蔡咏鍀擔任董事長的北港朝天宮，每年都捐幾百萬到民眾黨現任不分區立委蔡春綢（蔡晉財的姑姑）當理事長的基金會！林靖冠還透露，過去他就曾當面質問前主席柯文哲「蔡春綢是不是買官？」但柯文哲到現在都不敢回答。蔡咏鍀之子蔡晉財本月7日撂人圍毆曾蔡美佐，被稱為「北港皇太子」的小霸王蔡晉財的背景，近日也被翻出來在網上受到熱議。爸爸不只從曾蔡美佐手中，接下北港朝天宮董事長位置，還是地方議會副議長；媽媽黃美蘭本身也是北港鎮民代表會主席，與警界人士私交甚篤；其姑姑更是今年上任的民眾黨立委蔡春綢。請繼續往下閱讀...林靖冠12日在政論節目《新台派上線》指稱，蔡家原本在雲林北港並沒有這麼大的勢力，是民眾黨讓他們一家在地方坐大。他還拿出曾蔡美佐家族提供的一份資料，指稱由黃美蘭成立、號稱致力關懷雲林偏鄉、照顧弱勢族群的社福組織「中華陽光推展關懷協會」，現任理事長就是蔡春綢，自成立以來每年都從蔡咏鍀當董座的北港朝天宮拿到幾百萬。從林靖冠出示在鏡頭前的資料可以看到，北港朝天宮擬在今年10月辦理第3屆「樂活長青繪愛北港」活動，指名讓中華陽光推展關懷協會承辦，預計給138萬6500元。林靖冠意有所指表示，「這個基金會每天在幹嘛，你們上網就知道，基金會成立這麼久以來，有沒有在好好工作？有沒有真的幫助人？你們上網去看就知道了，我是不予置評。這只是一張（資料）而已，還有很多啦，一年就是幾百萬。」根據中華陽光推展關懷協會官方臉書，最近一次更新是2月7日，簡介似乎是多年前所撰寫，一直未做更改，稱「中華陽光推展關懷協會於今年民國104年邁入第三年……」，推算該協會是在2013年成立。而蔡咏鍀是於2010年首度當選北港朝天宮董事長，並多次連任。林靖冠還透露，他早就懷疑不分區立委的位置是蔡春綢「買來的」，而且他老早就當面質問過柯文哲，約莫兩、三個月前他去嘉義張啓楷的競選服務處，他跟某中央委員就跟柯文哲提到地方盛傳蔡春綢「買官」，柯文哲卻支吾稱不知道，他要回去問看看，過了些時日再問，柯文哲又是說自己搞不清楚狀況，讓他和那名中央委員氣到拍桌。相關新聞請見：林靖冠 : 蔡晉財能被當「太子」 柯文哲和黃國昌要負很大責任前民眾黨雲林縣黨部主委林靖冠。（取自林靖冠臉書）    ,https://news.ltn.com.tw/news/politics/breakingnews/5435911
自由爆新聞》中國戰狼「口出狂言」！街訪台灣人「霸氣金句」反擊！,政治,2026/05/13 20:30,全新的視界！新聞話題不漏接，快訂閱YouTube 【自由追新聞】，記得開啟小鈴鐺哦！    ,https://news.ltn.com.tw/news/politics/breakingnews/5436093
