Title,News_Type,date,content,url
診所釀死亡意外貨梯未申請許可 南市府開罰30萬、移送地檢署偵辦,社會,2026/05/19 18:45,台南市東區林森路上一家眼科診所驚傳一名清潔婦人搭貨梯時遭貨梯夾斷頭的驚悚命案，警方封鎖現場調查。（民眾提供）南市某診所今（19）日中午發生電梯重大意外事故，造成1名員工不幸死亡，南市府接獲通報後，立即派員會同相關單位前往現場勘查。經初步確認為未申請的貨梯，將依建築法裁處建物所有權人、使用人30萬元，並停止使用貨梯及移送地檢署偵辦。後續將針對南市設置於2樓以上之診所其使用之電梯是否合法申請辦理聯合稽查，以確保使用人安全。工務局表示，經初步調查，事故現場疑為診所內部使用之貨梯設備故障，導致人員遭受重大傷害。消防單位受理報案後迅速到場處理，並由警方進行現場採證及事故調查。請繼續往下閱讀...工務局表示，該事故電梯未取得合法使用證明文件，涉有違反建築法第73條及第77條規定情事。依法建築物昇降設備應依法申請許可、完成檢查，並取得合法證明後始得使用，管理人亦應善盡維護及安全管理責任。工務局強調，各建築物所有權人、管理人及使用單位，應確實依規定辦理昇降設備之申請、檢查及維護保養作業，切勿使用未經合法檢驗或未取得許可之設備，以維護公共安全。    ,https://news.ltn.com.tw/news/society/breakingnews/5442487
又是高齡駕駛！台中80歲女連撞32輛汽機車  波及84歲行人送醫,社會,2026/05/19 18:43,80歲吳姓老婦人開車連撞32輛汽機車，現場一片狼藉。（記者陳建志翻攝）首次上稿18:17更新時間 18:43台中吳姓女駕駛（80歲），今天下午4點左右開車行經西區勤美商圈中興街與公正路口時，疑因身體不適，車子失控沿路撞倒停在路邊31輛機車及1輛自小客車，造成一名剛好走路行經該處的葉姓婦人（84歲），被倒下的機車波及輕微擦挫傷就醫，現場機車東倒西歪一片狼藉，肇事原因警方清中。這起車禍發生在今天下午4點左右，當時80歲的高齡吳姓女駕駛，開車由公益路沿中興街往向上路方向行駛，行經中興街與公正路口前時，吳女疑因身體不適，車子偏移車道撞倒停在路邊的31輛機車，直到擦撞林姓女子（36歲）的自小客車才停止。請繼續往下閱讀...猛烈的撞擊聲嚇壞附近民眾，現場機車更是東倒西歪，所幸都是停在路邊的機車，只有一名葉姓婦人（84歲）剛好走路行經該處，被倒下的機車波及輕微擦挫傷就醫。警方初步調查，吳姓老婦人沒有酒駕及毒駕，疑因身體不適釀禍，詳細肇事原因將進一步調閱監視器釐清。80歲吳姓老婦人開車連撞32輛汽機車，現場一片狼藉。（記者陳建志翻攝）    ,https://news.ltn.com.tw/news/society/breakingnews/5442456
8旬老翁深夜外出迷航孫女報案求助 警西門町商圈找回阿公,社會,2026/05/19 18:25,大理所警員張丞毅（左）、李柏霖（右）協助找到出門走失的黃翁，安全將他送回家。（記者劉慶侯翻攝）84歲黃姓老翁前晚出門散步，卻找不到回家的路，還好孫女察覺有異報案協尋，北市警萬華分局查詢各大醫院未果，出動警力四處搜尋，最終在西門商圈西寧南路找到黃翁，安全將對方送返歸家。北市警萬華分局大理街派出所，前晚9時許接獲一名女子報案稱她的高齡爺爺飯後外出散步，應是在大理街附近走失，家人四處尋找未果，心急如焚，只好尋求警方協助。請繼續往下閱讀...警員李柏霖、張丞毅獲報後，立即調閱監視器畫面擴大搜尋範圍，發現黃翁往西門町商圈方向行走。但因商圈人潮眾多，協尋工作一度遇到瓶頸、陷入膠著。李等2員逐一致電附近醫院，詢問是否有符合特徵長者就醫。警方也派出巡邏警力同步在西門町商圈搜尋，終於在西寧南路一帶發現老翁身影，確認身體狀況無礙後，立即陪同黃翁返所並通知家屬。家屬見到爺爺平安現身，終於放下心中大石，不斷向警方道謝，感謝鍥而不捨地協尋，讓家人得以平安重聚。警方表示，家中如有失智長者，應時刻注意長者動向，另可在長者身上配戴寫有聯絡資訊的手環、愛心布標或定位設備，也可向警察機關申請指紋建檔，以利不慎走失能即時辨識身分獲得協助。    ,https://news.ltn.com.tw/news/society/breakingnews/5442461
遭冒名投放廣告詐騙  台南教育局呼籲民眾提高警覺,社會,2026/05/19 18:16,假台南市教育局粉專誘導加入LINE詐取個資，市府已報案。（南市教育局提供）南市政府教育局近日接獲熱心民眾反映，有看到以「台南市政府教育局」名義臉書專頁投放廣告，推銷各種課程，對方並提供Line連結吸引民眾加入不明帳號，意圖詐取個資。教育局已於第一時間發布正式聲明澄清，向臉書檢舉冒名行為，通報165全民防騙網並報案，目前該冒名臉書已關閉，但LINE社群仍有假冒訊息，提醒民眾勿相信受騙。教育局表示，假冒「台南市政府教育局」名義於5月16日成立的臉書帳號，並無任何PO文，但卻盜用該局臉書粉專封面及頭貼照片，於臉書投放招生廣告，並試圖魚目混珠引導民眾誤加假冒教育局名義創辦的LINE帳號，藉此騙取個資。目前雖未接獲民眾反映錢財遭詐騙，但若不實資訊持續在網路散播，恐造成民眾權益受損，已向警方報案採取法律行動，並於臉書發表聲明提醒民眾。請繼續往下閱讀...教育局提醒民眾，教育局並未透過粉專投放廣告招生，絕對不會以任何形式強迫推銷課程，也沒有官方LINE帳號，請認明教育局官方臉書粉專「教育花路米—台南市政府教育局」（https://www.facebook.com/tnboe）。若再看到類似冒名粉專或LINE社群，協助按下檢舉，以遏止詐騙行為，若有相關權益受損，也請報警追究。台南市教育局澄清未投放招生廣告，提醒民眾注意。（南市教育局提供）    ,https://news.ltn.com.tw/news/society/breakingnews/5442362
又是「喪屍煙彈」！基隆毒蟲騎樓違規拒檢逃竄 撞傷行人被警壓制,社會,2026/05/19 17:54,林姓毒蟲違規騎車遇警攔查，在鬧區巷弄內高速竄逃，逃竄約10分鐘後，不慎撞傷72歲張姓老翁後摔車，被警方壓制在地。（記者林嘉東翻攝）基隆市驚傳男子毒駕後，為躲避警方追緝，在市區騎車亂竄，不慎撞傷行人事件！基隆市警一分局延平街派出所員警，昨天深夜11時騎警車巡邏至仁愛區仁一、愛六路口時，見1輛雙載的機車，違規逆向騎在騎樓上，趨前示意停車受檢；不料，該名騎士不僅不停車受檢，反狂催油門，加速逃逸。請繼續往下閱讀...警方調查，該名違規騎士在鬧區巷弄內高速竄逃，約10餘分鐘後鑽進愛三路98巷口，不慎攔腰撞上1名72歲張姓老翁，張翁當場倒地受傷，林嫌也摔車。員警見狀立即上前將該騎士強壓在地逮捕，並同步通報救護車將手腳受擦挫傷的張翁送醫，傷者經醫治後無生命危險，已返家休養。警員查出違規騎士為有毒品前科46歲林姓男子，在他身上起獲1顆依托咪酯煙彈及1支電子煙主機；經對林嫌施以唾液快篩，檢測結果呈第二級毒品安非他命陽性反應，當場人贓俱獲。警訊後，將林嫌依涉犯公共危險及違反毒品危害防制條例移送基隆地檢署偵辦。第一分局分局長温基興指出，為了強力遏止毒駕、酒駕狂飆，立法院針對擴大預防性羈押適用範圍的修法，已於本月13日正式生效。被告經法官訊問後，若認為犯下毒駕、酒駕等高度危險性犯罪，且嫌疑重大、有反覆實施之虞，得裁定預防性羈押。温基興強調，新制上路後基隆警嚴正執法「零容忍」，只要符合特定情事，一律建請檢察官向法院聲請羈押。分局自修法生效起，已建請檢察官羈押2例，其中1例獲准；對毒駕嚴正執法零容忍，以確保基隆市民交通安全。林姓毒蟲違規騎車遇警攔查，在鬧區巷弄內高速竄逃，逃竄約10分鐘後，不慎撞傷72歲張姓老翁後，摔車被警方壓制在地。（記者林嘉東翻攝）    ,https://news.ltn.com.tw/news/society/breakingnews/5442417
太子集團超正女特助首出庭！一頭長髮沒了…. 庭畢與閨密相擁落淚,社會,2026/05/19 17:34,太子集團超正女特助劉純妤，今日首次到台北地院出庭應訊。（記者塗建榮攝）柬埔寨太子集團來台設置洗錢據點，台北地檢署3月起訴62人。其中李添（太子集團陳志心腹）在台的女特助劉純妤，在第一波搜索時，被媒體捕捉到交保後燦笑離開引起討論，今日是她被起訴後首次出庭。劉女剪去長髮，留著一頭極短髮，身穿全黑並戴著黑色口罩出庭。她開庭全程幾乎一語不發，全交由律師代答法官的問題。庭畢後，劉女和同案被告、李添的貼身秘書林昱妏，在法庭外簡單寒暄以後，給彼此一個打氣的擁抱。之後劉女忍不住落淚，林女則從包包拿出衛生紙遞給她拭淚，本來就是好友的2人，今天看起來感情仍相當融洽。請繼續往下閱讀...劉純妤在偵查階段，曾3次來到北檢接受訊問，並全程配合調查、對於犯行坦承不諱，累計交保金額共65萬，並被諭令限制出境及出海。今日開庭，她維持認罪，僅透過委任律師表示，自己已於2023年6月離職，因此後續起訴書所載犯罪事實應與她無關。由於劉女的限制出境、出海期限只到7月9日，法官也詢問檢辯雙方對延長與否的建議。檢方認為，限境的理由尚未消滅，建請法官延長限境時間。劉女的律師則表示，劉女在偵查階段已經完全自白，並配合調查，態度良好，且已經交保65萬元。此外，劉女年邁的父母皆在台灣，並育有1歲多的小孩，並不可能拋下家庭逃亡海外。且劉女海外也並無置產，無逃亡海外的能力。況且有關劉女的其餘被告，答辯方向也和劉女不同，無串供或是滅證的可能性，盼法官能解除限境。開庭結束以後，劉女在2位律師的陪同下，離開法院。面對媒體的鏡頭，劉女模樣相當害怕，一手抓著律師的手，另一手則緊握的包包背帶，快步離開法院。根據起訴內容，太子集團高階幹部李添若要購買豪車、名酒、茶葉、雪茄等奢侈品，會先將款項匯至劉純妤等人的OJBK虛擬錢包中，並由劉純妤等人指示同案被告邱子恩、陽金泉前往特定地點，與太子集團合作之水房人員領取現金，完成購買。太子集團超正女特助劉純妤，今日首次到台北地院出庭應訊。（記者塗建榮攝）太子集團超正女特助劉純妤今日首次出庭，她維持認罪，並希望法官可以解除限境。（記者塗建榮攝）太子集團被告之一的林昱妏是劉純妤的好友，兩人今天庭畢後相擁，給予彼此鼓勵。（民眾提供）    ,https://news.ltn.com.tw/news/society/breakingnews/5442385
女駕駛轉彎打燈仍挨撞？ 網友：對付機車鑽車縫務必學會關門,社會,2026/05/19 17:16,駱男的機車擦痕。（記者姚岳宏翻攝）台北市民大道二段昨下午發生交通事故，胡姓女子開車由東往西方向、準備右轉進入長安東路一段30巷時，其右前車頭與同向直行的機車左側發生碰撞，造成機車駕駛駱男與後座乘客受傷送醫，胡女則未受傷，2車駕駛均無酒駕，警方還在釐清車禍肇責，同時提醒駕駛轉彎時應注意側邊車況並禮讓直行車。由於事故發生後，由於胡女車內的行車紀錄器沒有錄下聲音，曾遭到路人質疑，讓她懷疑自己是否忘記打方向燈；為釐清肇事責任，胡女的友人著急地在社群平台發文，尋求經過該路段的汽機車駕駛，提供後方行車紀錄器畫面，希望能還原事發經過。請繼續往下閱讀...此車禍引發網友熱烈討論，許多人針對台灣的交通現況給予建議，有網友指出，即使打了方向燈，仍有許多機車騎士習慣從右側鑽車縫，因此汽車駕駛在準備右轉前的100公尺就應該提早靠右行駛，將右側空間擋住，也就是俗稱的關門技巧，逼使機車自然從左側超車，才能有效避免機車從右側強行鑽縫而發生意外。友人也將網友的建議轉告胡女，提醒她未來轉彎務必要落實關門動作。胡女的車禍擦痕。（記者姚岳宏翻攝）    ,https://news.ltn.com.tw/news/society/breakingnews/5442098
台南眼科診所殺人貨梯 竟未申請許可,社會,2026/05/19 17:16,台南市東區林森路上一家眼科診所驚傳一名清潔婦人搭貨梯時遭貨梯夾斷頭的驚悚命案，警方封鎖現場調查。（民眾提供）台南市東區林森路1家眼科診所貨梯在19日中午發生驚悚奪命事故！66歲的蘇姓清潔婦人遭貨梯猛夾斷，頭顱掉在1樓、身體被貨梯送上2樓慘死。台南市府工務局人員下午前往稽查、初步確認此貨梯未申請許可，將依建築法對大樓所有權人與使用人開罰30萬元台幣，同時禁止再使用。市府工務局使用管理科說明，經調查，出事的診所大樓建築物設有兩座合法的升降設備，平日有按時申報保養；但這座出事的貨梯，初步確認是沒有申請的貨梯，將依建築法91條規定，對大樓建築物所有權人與使用人處以30萬元台幣罰款，同時禁止這座貨梯再繼續使用。    ,https://news.ltn.com.tw/news/society/breakingnews/5442364
不顧女移工正和老公講電話  噁男假冒移民署官員上銬性侵重判14年,社會,2026/05/19 16:59,台中市游姓男子佯稱移民署官員，搶走女移工手機，還上銬性侵，台中地院依強盜強制性交罪，重判14年。（記者陳建志攝）台中市游姓男子去年透過印尼籍女移工在網路上雇用女清潔工，一名印尼籍逃逸女移工前來應徵，游男卻佯稱是移民署官員，不顧女移工正和先生講電話搶走手機，還將女子上銬恐嚇若不和他「睡覺」將直接遣返，將女移工載往汽車旅館口交、性侵得逞，女子事後報案將游男逮捕，台中地院近日審結，依強盜強制性交罪，將游男重判14年。判決指出，游姓男子去年5月透過一名女移工，表示想以每月4萬5000元雇用外籍清潔工，一名印尼籍逃逸女移工主動聯絡，兩人相約6月1日在西屯區三信公園見面，女子上車後，游男先詢問是否是合法移工？女子告知是逃逸移工後，不顧她正和先生講電話，搶走女子手機。請繼續往下閱讀...游男接著佯稱自己是移民署官員，拿手銬將她雙手銬住，恐嚇「如果不想去移民署，就要跟我睡覺，你要給我乖乖聽話」，接著將車開到一家汽車旅館，先親吻女移工嘴巴，並強迫女移工幫他口交，接著性侵得逞。游男在台中地院審理時，坦承偽裝成移民署官員對女移工強制性交，但否認有強取手機的強盜犯行，強調當時只將手機放在擋風玻璃前，並沒有搶走手機，且事後還拿2千元給女移工。法官審理後認為，游男為逞一己私慾，僭行公務員職權犯下本案情節嚴重，且侵害被害人身體、行動自由及性自主權甚鉅，對告訴人身心造成傷害，犯罪手段嚴重危害社會治安，惡行令人髮指，依強盜強制性交罪，重判14年。    ,https://news.ltn.com.tw/news/society/breakingnews/5442337
未來毒駕同車乘客也要罰！ 交通部：4面向加嚴「6月底前提草案」,社會,2026/05/19 16:59,交通部和警政署合作，將毒駕並列為與酒駕同樣的危險駕駛防治重點；圖為台北市警察局執行酒駕、毒駕攔檢勤務。（資料照）酒駕致死傷人數逐年下降，新威脅是「毒駕」！政府為加強打擊毒駕，於5月11日跨部會開會研議修法加重罰責；交通部表示，擬提高累犯罰鍰、增訂乘客連坐罰、明定涉犯刑法毒駕嫌疑駕駛人施尿液採驗等4大加嚴罰則，預估6月底前預告草案。交通部與警政署推動「毒品唾液快篩試劑檢測」執法新制，員警執行酒測勤務或攔檢時若發現疑似有毒駕疑慮，例如車內有疑似毒品、或駕駛有毒品前科、開車不穩，可現場做唾液快篩檢測，陽性後才可報檢察官許可，強制採驗尿液並移送法辦。請繼續往下閱讀...吸毒後駕車是屬於嚴重危害道路交通安全的行為，同時涉犯行政罰道路交通管理處罰條例（道交條例）第35條，及刑事罰刑法第185條之3，且會優先依刑事法論處。依據「道交條例」第35條第1項規定，毒駕機車駕駛人處1萬5千元以上、9萬元以下罰鍰，汽車駕駛人處3萬元以上、12萬元以下罰鍰，並均當場移置保管該汽機車及吊扣其駕駛執照1年至2年，若載有未滿12歲兒童或因而肇事致人受傷者，並吊扣其駕駛執照2年至4年；致人重傷或死亡者，吊銷其駕駛執照，並不得再考領。累犯或拒測者依同條其他規定另有再加重處罰，如吊銷駕駛執照。交通部表示，近年已持續配合立法院修法加重毒駕相關罰責，並已依警政署實務執法需要完成道交條例與違反道路交通管理事件統一裁罰基準及處理細則修正，鑑於近期毒駕案件頻傳，也再於5月11日邀法務部、衛生福利部、內政部警政署等相關單位研商修正「道交條例」加嚴毒駕罰責，預計6月底前提出草案預告。包括：提高毒駕累犯罰鍰，第2次毒駕依35條第1項所駕駛車種最高額加罰9萬元；比照酒駕強制抽血規定，明定涉犯刑法毒駕嫌疑駕駛人，對其實施非侵入式尿液採驗之相關規定；增訂毒駕同車乘客處罰；以及比照酒駕接受酒駕防制教育或酒癮治療規定，增訂違反毒駕規定受吊銷駕駛執照處分，亦應接受毒駕防制教育或毒品戒癮治療後，始得重新取得考領駕駛執照。交通部指出，另針對提高毒駕相關刑事罰責部分，已於同一天函請法務部可再研議針對毒駕行為不得易科罰金（三振條款）、提高緩起訴附命戒癮治療比例、假釋條件及提高命強制戒癮治療比例等執行作為，共同防範惡性違規行為，警政署也可依新修正刑事訴訟法第101條之1規定對毒駕者進行預防性羈押。交通部提到，有關內政部建議對經查獲施用毒品者，預為進行駕駛執照管理，限制其駕駛資格，相關修法建議立意良善，且有助防制毒駕情形，敬表支持推動修法方向，今年6月底前將盡速邀集相關單位研議可行做法。    ,https://news.ltn.com.tw/news/society/breakingnews/5442340
台中三井LaLaport疑違法攝錄 經發局：加強百貨業聯合稽查,社會,2026/05/19 16:59,台中LaLaport北館4樓Under Armour運動用品店試衣間驚傳監視器疑違法攝錄，但業者已拆除。（記者廖耀東攝）台中三井LaLaport北館4樓Under Armour運動用品店試衣間監視器疑違法攝錄，台中市政府經發局表示，已於第一時間派員到場了解，要求百貨業者加強督導館內專櫃，目前品牌業者已拆除該監視器，司法單位已介入偵辦中，經發局也將加強百貨業聯合稽查，維護民眾隱私安全。經發局並表示，該總公司已啟動全台直營店監視器設備及拍攝角度全面檢視；另此案因涉及刑事犯罪，司法單位已介入偵辦中。請繼續往下閱讀...經發局指出，經查LaLaport館內備有反針孔偵測設備，業者定期針對廁所、哺乳室等隱私空間進行檢測，品牌櫃位也由樓層管理人員定期巡查；將要求轄內各大百貨公司加強更衣室、廁所等隱私空間巡檢及自主管理，經發局後續將於大型百貨聯合稽查時，同步稽核相關檢查紀錄，若有不法將予以嚴辦。    ,https://news.ltn.com.tw/news/society/breakingnews/5442349
一停就3年！台中大甲「幽靈車」欠費22萬元  女車主神隱內幕曝,社會,2026/05/19 16:58,紅色轎車停放大甲停車場三年多，欠費逾22萬元。（記者張軒哲攝）台中大甲區文昌國小地下公有停車場，有一部紅色轎車一停就是3年，來自桃園的女車主失聯至今，引擎蓋還被寫上到此一遊，引起大甲民眾議論。大甲區公所多次寄出催繳費通知，卻無法聯繫到女車主，目前欠費達22萬1580元。這部紅色轎車自2023年5月2號上午，停進文昌國小公有停車場後，一停就是3年。據了解，來自桃園的女車主因近年在大甲工作，租屋在大甲街上，她並未有狀況，疑似因車子已無法行駛，加上欠費金額過高，鴕鳥心態，不願出面移車，大甲區公所多次寄出催繳費通知到桃園老家，卻無法聯繫到女車主，一年前聯繫上車主的姊姊，當時欠費達17萬多元（一天200元計），姊姊以一個月薪水不到3萬，無力替妹妹收拾殘局。請繼續往下閱讀...大甲區長顏金源表示，研議由專業人員先行將車輛移置至停車場外，再由停管處拖吊至豐原車輛保管場保管，後續將依法向車主追繳停車費及相關拖吊費用。紅色轎車引擎蓋遭寫下到此一遊。（記者張軒哲攝）    ,https://news.ltn.com.tw/news/society/breakingnews/5442334
台南眼科診所貨梯清潔婦身首分離亡 死者夫心碎認屍：妻子很勤勞閒不下來,社會,2026/05/19 16:50,66歲蘇姓清潔婦人的丈夫（左上白衣者）趕到眼科診所了解妻子遭遇不幸的經過。（民眾提供）台南市東區林森路1家眼科診所貨梯在19日中午發生驚悚奪命事故！66歲的蘇姓清潔婦人遭貨梯猛夾，頭顱掉在1樓、身體被貨梯送上2樓慘死。死者的丈夫獲報到場哀戚地說：「妻子很勤勞、平日閒不下來，在診所工作已有7、8年，沒想到竟發生這種慘事。」蘇婦的丈夫心碎地說，他一接到電話就獲悉妻子已經離世，趕緊搭車趕到診所，太太為人很好、很勤勞打拚，平日閒不下來，在診所做了7、8年清潔工作，太太外出工作跟家庭經濟沒有什麼關係。請繼續往下閱讀...對於求償問題，蘇婦丈夫無奈表示，他也不知道能求償什麼，心想讓醫院自己去處理，他透露自己因健康問題提早退休，他們的小孩子都長大了，已經外出工作。診所的大樓管理員說，蘇婦1個人做很多工作，下班還兼差跑到附近飯店做清潔工作，事發時診所內的護理師都被嚇到崩潰大哭。警方調查表示，因貨梯內部沒有監視器，沒有蘇婦遇害時的影像，但可以確認的是當時蘇婦1人在貨梯內，沒有其他人進入，蘇婦疑有探頭看外面的舉動，因此遭啟動的貨梯夾斷頭部身亡，研判死因無他殺、外力介入因素。警方已報請檢方相驗並通知市府勞工局與電梯公司對貨梯做深入調查、了解是否有人為疏失或是機械故障問題，釐清責任歸屬。台南眼科診所殺人貨梯 竟未申請許可    ,https://news.ltn.com.tw/news/society/breakingnews/5442327
悚！南投埔里爆當街尋仇 莽男糾眾刺死人收押,社會,2026/05/19 16:49,南投埔里鎮發生當街尋仇殺人案，南投地檢署進行相驗，檢察長也偕同南投犯保協會慰問死者家屬。（南投地檢署提供）南投縣埔里鎮17日深夜發生當街尋仇殺人案，30多歲黃嫌因細故積怨，糾眾找40多歲楊男理論，雙方互毆扭打時，黃竟持刀刺殺楊男，事後楊送醫不治，檢警8日逮捕黃嫌，訊後依殺人罪送辦，並於今天聲請羈押禁見獲准。檢方表示，黃嫌近期與楊男因細故有糾紛，17日深夜約見面尋仇，惟黃男不僅糾眾助陣，甚至私自持刀赴約，雙方在大街上一言不合，當場扭打起來，過程中黃竟持預藏凶刀刺向楊男，楊受傷後被送往醫院急救，但經搶救仍於18日宣告不治。請繼續往下閱讀...檢警事後循線追查，發現與楊有細故口角糾紛的黃嫌涉嫌重大，經派員布線追查，順利於18日逮捕黃嫌，楊男遺體則在今日進行解剖相驗，檢方也向南投地方法院聲請羈押禁見獲准。    ,https://news.ltn.com.tw/news/society/breakingnews/5442332
