Title,News_Type,date,content,url
自由日日shoot》賴總統被迫暫緩出訪史瓦帝尼 立院外委會通過譴責中國粗暴行徑,政治,2026/04/23 05:30,立院外委會通過提案，譴責中共脅迫第三國臨時撤銷我元首班機航權，打壓我國國際空間。（記者方瑋立攝）總統賴清德原訂昨天出訪非洲友邦史瓦帝尼王國，中國透過外交與經濟脅迫手段，迫使馬達加斯加等三國臨時撤銷總統專機之飛航許可，立法院外交及國防委員會昨天無異議通過臨時提案，對中國的粗暴行徑表達強烈譴責。朝野立委通過臨時提案民進黨團總召蔡其昌說，黨團廿四日將在立法院院會，邀請朝野政黨共同發起譴責中國打壓中華民國外交空間的主決議，希望能獲得朝野支持並通過。請繼續往下閱讀...外委會昨由民進黨籍召委陳冠廷擔任會議主席，臨時提案時出席立委包含民進黨立委沈伯洋、王定宇、王義川、羅美玲、林楚茵、陳俊宇，以及國民黨立委黃建賓、徐巧芯。徐巧芯發言說，總統出訪友邦「本來就要去」，她對提案本身沒有意見也認同其時效性。不過她對流程提議，依往例同步知會相關部會，確認是否有需要修正文字細節的部分。民進黨立委林楚茵隨即反駁，這並非要求行政部門改進的執行案或修正案，而是一個針對中共的「譴責案」。林楚茵說，此刻是展現國防外交委員對國家忠誠與對元首支持的時刻，提案文字上沒有任何問題，倘若執意提出問題，反而是想要利用所謂程序，惡意讓譴責案無法曝光，呼籲在場委員不分黨派共同連署。王定宇：中共「時間點突擊」王定宇於會中揭露，我方早在數週前就取得塞席爾、摩里西斯與馬達加斯加等三國的飛越許可，中共刻意採取「時間點突擊」，在專機出發前十二小時，利用塞席爾等三國陷入中國債務陷阱的困境進行經濟脅迫，迫使其臨時取消許可。王定宇批評中共將所有互動武器化，是典型的介入他國內政。歐盟發言人及美國國會皆已聲援台灣，國內不應有任何藉口阻撓。他強調，台灣二千三百萬人走向國際，越被打壓就會越努力。沈伯洋：北京介入他國主權沈伯洋說明譴責案內容指出，飛航許可的核發在國際法上屬於主權行為，中國利用經濟手段迫使第三國撤銷權利，是直接介入他國主權。此舉不僅違反「聯合國憲章」的國家主權平等與不干涉內政原則，更破壞「芝加哥公約」確立的國際民航秩序與非歧視原則，對台灣外交空間構成嚴重阻礙。臨時提案經陳冠廷詢問在場委員無意見後，裁示照案通過。提案決議明確要求，外交部應採取積極措施持續拓展國家外交空間並捍衛國家主權，並透過駐外館處及國際組織管道，將本次中共脅迫撤銷航權事件，正式列入國際民航組織及其他多邊機制之關注項目，積極爭取理念相近民主夥伴之聲援與具體行動。    ,https://news.ltn.com.tw/news/politics/paper/1752049
中國施壓阻賴出訪 美參眾議員齊聲譴責北京,政治,2026/04/23 05:30,模里西斯等三國在中國施壓下臨時撤回專機飛越許可，阻止總統賴清德出訪我非洲友邦史瓦帝尼，美國聯邦參議院外委會非洲小組主席克魯茲，籲美國採取行動予以反制並追究相關責任。（美聯社檔案照）總統賴清德原定昨日率團出訪我非洲友邦史瓦帝尼，卻因模里西斯等三國在中國施壓下臨時撤回專機飛越許可，未能順利成行。美國聯邦參議院外委會非洲小組主席克魯茲指出，模里西斯近期一方面在查哥斯群島議題上挑戰英國立場，另一方面又干預台灣飛往非洲的航線安排，顯見其不惜損害美國利益與中國共產黨結盟，籲美國在尊重模里西斯主權之餘，應採取行動予以反制並追究相關責任。模里西斯結盟中共 損害美利益參院外委會克魯茲 促華府反制賴總統原預計昨日直飛訪問史瓦帝尼，因中國介入，總統府前晚臨時記者會宣告暫緩。國際友台政要紛紛聲援台灣，痛批中方蠻橫。請繼續往下閱讀...美國共和黨參議員匡希恆指出，中國施壓各國孤立台灣的作為，再次凸顯威權體制不僅在國內限縮自由，亦試圖向外擴張控制力，若由中國主導國際秩序，跨國移動、言論等各項基本自由恐將受限。美國聯邦眾議院「美國與中國共產黨戰略競爭特別委員會」及眾議院外交委員會廿一日亦推文譴責中國施壓施壓他國，拒絕總統賴清德過境飛行，再度對台施壓、霸凌；美國聯邦眾議院「國會台灣連線」共同主席迪馬里進一步批評，中國將航空安全「武器化」的恐嚇手段既魯莽且危險。歐洲方面，歐盟發言人廿一日強調，飛越領空權是國際民航的基礎，領空管理的可預測性與中立性，對於航空安全、經貿往來與外交關係皆至關重要，相關決定應以透明且可預測性為基礎，並以航空安全與營運穩定為首要考量，不應被作為達成政治目的的手段。英國駐台代表包瓊郁也說，空域管理相關決策不應出於政治目的。對中政策跨國議會聯盟（IPAC）也發聲指出，中國此舉足見北京無所不用其極孤立台灣，將政治意志凌駕於他國領空主權之上，賴總統作為民選領袖，應與其他國家元首一樣自由與國際夥伴往來，不受脅迫與干預，北京無權置喙。友邦部份，巴拉圭外交部推文說，譴責中國以施壓及經濟脅迫導致台灣總統訪問史瓦帝尼的飛行許可遭迫取消，並重申支持台灣，各國自由交往的權利不應受到任何不當干涉。    ,https://news.ltn.com.tw/news/politics/paper/1751973
嗆執政黨 鄭麗文：外交一路挫敗 要先檢討自己,政治,2026/04/23 05:30,國民黨中央昨日舉行中常會，黨主席鄭麗文針對總統賴清德暫緩出訪友邦史瓦帝尼一事，向民進黨政府提出批評。（記者羅沛德攝）賴清德總統暫緩出訪史瓦帝尼，總統府批評中國打壓，國民黨主席鄭麗文昨在中常會表達遺憾，但強調，全世界都能接收九二共識，不支持台獨，民進黨為什麼可以一意孤行，外交一路挫敗，「有時候我們要先檢討自己，不是總是檢討別人」。黃國昌：民眾黨譴責中國打壓民眾黨主席黃國昌則表示，民眾黨譴責中國打壓台灣國際外交空間，但外交部也要檢討在情資掌握和應變措施上，是不是發生什麼問題？為何出發前一天才知情，來不及應變。請繼續往下閱讀...鄭麗文表示，很遺憾，賴總統最後確定無法出訪，但更遺憾的是，發生事情後，總統府、國安團隊氣急敗壞，要不是躲進同溫層討拍、取暖，不然就把氣出在在野黨身上。這是重大的外交挫敗，不應該等閒視之，國安團隊是不是嚴重誤判局勢？鄭麗文指出，前總統馬英九任內主張外交休兵，我們參加很多國際組織，也成功維持邦交國。但政黨輪替後，民進黨執政十年，友邦關係如同雪崩般的結束，已被逼到退無可退的角落，難道不應該用更嚴肅的態度去面對、去檢討誤判了什麼形勢？為什麼誤判到出訪連落地轉機的地方都找不到。究其根源，難道不是整個兩岸論述的嚴重錯誤嗎？鄭麗文表示，國安單位指責非洲國家時，對方也發布新聞表示他們堅守一個中國政策。她請教民進黨政府，中華民國憲法難道不是一中憲法，「全世界請問賴總統、民進黨，有哪一個國家支持台獨？請告訴我」。對於賴總統出訪受阻，鄭麗文強調，全世界都能接受九二共識、不支持台獨，民進黨為什麼可以一意孤行，外交一路挫敗，造成國家舉步維艱，「有時候我們應該要先檢討自己，不是總是檢討別人」。蔣萬安：譴責任何打壓台灣行為台北市長蔣萬安受訪時則表示，譴責任何打壓台灣國際空間的行為，但這是中華民國史上第一次，元首出訪前一天臨時喊卡，我們也要省思，為什麼這一次發生這樣的狀況？民眾也關心中央政府能否拿出具體做法，為台灣走出一條務實可行的路。    ,https://news.ltn.com.tw/news/politics/paper/1752052
立院今協商》軍購條例上修8千多億 黃國昌：藍白一致方向,政治,2026/04/23 05:30,立法院今協商行政院1.25兆元國防特別條例草案，執政黨喊話支持政院版，外界關注藍白最新協商立場。圖為15日立法院長韓國瑜上週召集協商朝野三版本的國防特別條例草案。（資料照，記者田裕華攝）立法院今協商行政院一．二五兆元國防特別條例草案，執政黨喊話支持政院版，外界關注藍白最新協商立場。民眾黨主席黃國昌昨受訪稱，國、眾兩黨基於國防部所揭軍售金額，上限金額可至「八千多億元」，是「藍白一致方向」。國民黨文傳會主委尹乃菁對此表示，尊重黨團自主。國民黨團書記長林沛祥則說，有美方正式的發價書，在協商時一定會納入討論，應該會有良性的結果。國民黨團書記長林沛祥：美發價書將納入討論 「應會有良性結果」請繼續往下閱讀...韓國瑜上週召集協商朝野三版本的國防特別條例草案，會中僅就條例名稱達成共識，韓今天下午二度召集朝野黨團協商。民進黨團總召蔡其昌說，黨團會持續捍衛行政院版的一．二五兆元立場。民進黨團：持續捍衛1.25兆院版外媒路透社引述消息人士說法，稱國民黨高層已向美方保證，最終將通過一項「具規模的預算方案」。對此，國民黨團書記長林沛祥表示，目前沒聽到任何指令，有正式的發價書，在協商時一定會納入討論，應該會有良性的結果。國民黨一向支持國防，台灣需要好的、合用的、會到位的武器。至於藍委之間對於軍購金額不一，林說，這些都是預設立場，協商是進去談了才知道。黃國昌昨接受媒體訪問指出，民眾黨的軍購立場是，條例可以先過；至於軍購金額，若依國防部透露第二批軍購金額，在加總第一批金額後，「大概可以上調至八千多億元」。黃強調，他要求國防部要等到美國公布要賣什麼，才開始編預算；至於「商購」，黃仍堅持放回一般年度預算去編列。民眾黨團：黨版保留向上調整空間黃另透露，民眾黨團總召陳清龍、外交國防立委王安祥有跟國民黨團對接，細節未確定，但「了解到他們的立場也差不多」，金額範圍上也「差不了多少」。陳清龍說，民眾黨版的草案就是四千億元，但保留美方公布軍售並提供發價書後的向上調整空間；王安祥則說，對美軍購的項目放入軍購條文中，是民眾黨一直以來的立場。谷立言會鄭麗文AIT：兩岸分歧應以和平方式解決在軍購條例協商前夕，美國在台協會處長谷立言昨與國民黨主席鄭麗文會晤，令外界關注。AIT透過社群媒體表示，兩人於會談間表示，兩岸分歧應以和平方式解決，且應免於脅迫，並應透過兩岸人民皆能接受的方式。國民黨則說，雙方強調，兩岸和平不僅對區域穩定至關重要，也符合國際社會的核心利益。兩岸關係應持續透過對話與和平發展來推進。    ,https://news.ltn.com.tw/news/politics/paper/1752075
中方嗆「台灣沒有總統」 陸委會：國內政治人物應丟掉幻想,政治,2026/04/23 05:30,陸委會昨日指出，國台辦的發言完全顯示，中共的「一個中國原則」就是不允許中華民國存在，不承認中華民國的民選總統。（資料照）賴清德總統原定廿二日出訪史瓦帝尼，因中國粗暴打壓告吹。中國外交部及國台辦昨日公開讚賞馬達加斯加等三國堅持「一個中國原則」，並稱「台灣沒有總統」。陸委會痛批，國內一些政治人物應該丟掉幻想，停止為中共的對台政策塗脂抹粉。外交部也反擊，痛批國台辦與中國外交部相關言論是荒誕謬論。外交部嚴正譴責中國荒誕謬論中國以經濟脅迫強力施壓塞席爾、模里西斯、馬達加斯加三國，在無預警狀況下無端取消總統專機飛航許可，導致賴清德出訪非洲友邦史瓦帝尼的行程暫緩。請繼續往下閱讀...中國外交部昨宣稱，世界上早已不存在所謂「中華民國總統」，任何人以這種身分招搖撞騙，只會自取其辱。國台辦發言人張晗則表示，對有關國家堅持「一個中國原則」的立場和做法表示讚賞。得道多助、失道寡助，事實再度證明「一個中國原則」是國際關係基本準則和國際社會普遍共識，是大勢所趨、大義所在、人心所向。陸委會駁斥，國台辦的發言完全顯示，中共的「一個中國原則」就是不允許中華民國存在，不承認中華民國的民選總統。國內一些政治人物應該丟掉幻想，停止為中共的對台政策塗脂抹粉。外交部也表示，針對中國外交部及國台辦就我國總統暫緩訪問友邦史瓦帝尼王國一事，分別發表貶損我主權國家地位等荒誕謬論，我方予以嚴正譴責及駁斥。針對塞席爾及馬達加斯加外交部以不承認台灣主權及遵守「一中原則」為由，撤回我國專機飛越許可，外交部指出，這些說詞充分證明中國是操弄本次事件的背後主謀，對於中國以赤裸的政治力干預國際民航正常運作，將飛航情報區政治化、武器化，外交部予以最嚴厲的譴責，並對塞席爾及馬達加斯加扈從中國扭曲言論，挑戰國際一般慣例及飛航安全提出嚴正抗議。外交部鄭重呼籲，國際社會應正視中國長期使用經濟脅迫等手段，威逼他國改變其主權決定的行徑，不僅屢屢挑戰國際和平及秩序，更堂而皇之公然干涉他國內政，類此作為不僅針對台灣，更是對全球民主秩序與國際法治構成重大且影響深遠的挑戰。外交部重申，中華民國台灣是主權獨立國家，與中華人民共和國互不隸屬，擁有走向國際的正當權利，任何國家均無權加以阻撓或否定，任何片面政治宣示也都無法改變此一客觀現實。台灣將持續與理念相近國家深化合作，並以務實、穩健的方式拓展國際參與空間，不因外在壓力而動搖台灣走向世界的決心。    ,https://news.ltn.com.tw/news/politics/paper/1752051
鄭嗆兩岸論述錯誤 民進黨反批：砲口對內 與國際脫節,政治,2026/04/23 05:30,總統賴清德因中國施壓而暫緩出訪史瓦帝尼，國民黨主席鄭麗文昨指控，民進黨的兩岸論述錯誤且誤判局勢。民進黨發言人吳崢反批，鄭不思譴責施壓者，反而「砲口對內」要求檢討受迫害的政府，與國際脫節、嚴重違背國家路線。（記者王藝菘攝）總統賴清德因中國施壓而暫緩出訪史瓦帝尼，國民黨主席鄭麗文昨指控，民進黨的兩岸論述錯誤且誤判局勢，政府不自我檢討還把氣出到在野黨身上。民進黨發言人吳崢反批，鄭不思譴責施壓者，反而「砲口對內」要求檢討受迫害的政府，與國際脫節、嚴重違背國家路線。台灣被打壓 鄭卻不譴責施壓者 對於鄭麗文的說法，吳崢表示，國家元首代表國家，在國家外交處境艱困、中國粗暴施壓的時刻，被打壓的就是台灣，而鄭麗文不思譴責施壓者，反而「砲口對內」要求檢討受迫害的政府，鄭麗文才是真正檢討受害者的那個人。請繼續往下閱讀...吳崢談到，賴清德講得非常清楚，面對中國粗暴施壓、惡意打壓中華民國的外交空間，朝野應該不分黨派，認清中國的真實樣貌，團結守護國家尊嚴。在國家外交空間遭受打壓的時刻，鄭麗文卻急著把砲口對內，反過來檢討民進黨政府，令人遺憾。吳崢說，國台辦才重申「一個中國」老調，鄭麗文下午就接著附和，甚至聲稱世界都支持一中，這種說法與國際民主陣營力挺台灣走向國際舞台、譴責中國打壓台灣的事實完全脫節。吳崢並批評，中國惡劣施壓第三國、粗暴干涉台灣國際參與，現在最應該被譴責的，難道不是以粗暴手段干預台灣國際參與的中國嗎？難道鄭麗文眼裡只有中國，沒看到事發後，有多少國際民主盟友們紛紛發聲譴責中國蠻橫行徑，力挺台灣走向世界舞台嗎？鄭麗文此言嚴重違背中華民國台灣優先的國家路線，更不符合台灣主流民意的期待。「中共不到兩個禮拜就打臉十項惠台政策，鄭麗文情何以堪！」兼任民進黨中常委的立委王世堅表示，鄭習會就是一場假戲，中共講了那麼多的甜言蜜語，結果原來拿著蘿蔔，背後藏了這把棍子，台灣民眾都看在眼裡。王說，只要不逾越主權、不把台灣做小、不妨害國格尊嚴，他樂見赴中交流，但沒想到中共這麼不賞臉、直接打臉鄭麗文。    ,https://news.ltn.com.tw/news/politics/paper/1752053
美印太司令：台灣投資自身國防很重要,政治,2026/04/23 05:30,美國印太司令部司令帕帕羅廿一日對台灣面臨的軍事威脅提出警告，除了示警中國正企圖打造無人機部隊做為進攻先鋒，也強烈敦促台灣必須落實國防特別預算。（路透檔案照）美國印太司令部司令帕帕羅廿一日對台灣面臨的軍事威脅提出警告，除了示警中國正企圖打造無人機部隊做為進攻先鋒，也強烈敦促台灣必須落實國防特別預算。他強調，美國對台灣防務的重視程度，不能超過台灣自身，「如果讓雞挨餓，就得不到雞也得不到蛋」。「讓雞挨餓，就得不到雞也得不到蛋」美國聯邦參議院廿一日舉行有關印太司令部部署態勢的聽證會，參院外交委員會民主黨首席議員夏亨關切台灣通過國防特別預算的重要性。帕帕羅回應，「台灣關係法」實施近五十年，美國對台軍售並未超出常態，但台灣為自身國防提供經費至關重要，唯有投入資源，才能產生實質的防衛戰力。請繼續往下閱讀...夏亨也呼應，支持台灣通過這項預算，不僅是向中國傳遞嚇阻訊息，也是向美國國會展現台灣自我防衛決心。立院國防預算進展 美檢視關鍵指標國民黨主席鄭麗文日前訪問中國，共和黨籍參議員柯頓詢問是否會影響台灣國防支出的未來走向。帕帕羅直言，「空談不如實證」，台灣國防特別預算案的實質進展，將是檢驗台灣對自我防衛承諾有多堅定的關鍵指標。儘管預算面臨政治角力，帕帕羅對台灣的防衛意志仍持正面看法。他指出，在俄烏戰爭爆發前，烏克蘭的防衛意願民調相對偏低，但戰時的社會反應令人敬佩；而台灣目前的民調數據遠高於當時的烏克蘭，讓他對台灣役齡人口保衛家園的意願與能力深具信心。除了預算，議員也高度關切戰爭型態改變對台海局勢的影響。帕帕羅在書面聲明中指出，俄烏衝突與美伊戰事在在顯示，低成本、大規模的無人系統與精準打擊能力，已是現代戰爭核心。民主黨籍參議員布魯門塔與軍委會民主黨首席議員利德詢問，在無人化不對稱作戰的發展下，將如何影響中國對台的武力盤算。帕帕羅表示，北京正設法應對，目前的企圖是打造一支無人機部隊，做為未來進攻部隊的先鋒。為反制中國的侵略部署，帕帕羅強調「地獄景象」戰略的重要性。他指出，台灣應善用烏克蘭的無人機戰爭經驗，大量且持續地部署低成本、可消耗的彈藥與無人機，並結合人工智慧工具進行指揮。這種不對稱作戰能讓進攻的解放軍付出極為沉重的代價。帕帕羅重申，印太司令部將持續依循「台灣關係法」提供安全援助，協助台灣建立可靠、具韌性且具成本效益的不對稱戰力。他同時警告，北京從未放棄對台動武的可能性，解放軍近期在台灣周邊的軍事行動不僅是演習，更是為潛在的武力統一進行實質預演。    ,https://news.ltn.com.tw/news/politics/paper/1752076
致電史瓦帝尼國王 賴總統：兩國會更團結合作,政治,2026/04/23 05:30,總統賴清德（右）昨表示，他第一時間已致電史瓦帝尼國王恩史瓦帝三世（左），強調兩國邦誼不會受到影響。圖為二〇二四年五月恩史瓦帝三世來台參加賴總統就職大典。（取自總統府官網）賴總統訪問受阻 史瓦帝尼：不會改變史台雙邊關係兼任民進黨主席的總統賴清德原定廿二日率團訪問友邦史瓦帝尼，因中國施壓塞席爾、模里西斯、馬達加斯加突取消專機飛航許可，行程暫緩。賴清德昨表示，他第一時間已致電史瓦帝尼國王恩史瓦帝三世，強調兩國邦誼不會受到影響，在外力壓迫下只會更團結合作。請繼續往下閱讀...賴：中國越打壓 我們越要無畏無懼史瓦帝尼政府也對外做出回應。「史瓦帝尼觀察家日報」廿二日報導，史瓦帝尼政府代理發言人姆杜莉表示，雖然對於賴總統無法親自參加國王慶祝活動感到遺憾，「但我們完全理解，國際旅行安排有時會受到一系列後勤和外交因素影響，不是雙方可控制的」。對於賴總統此行遭遇阻礙，姆杜莉於報導中強調，「這不會改變史瓦帝尼和台灣之間長久的雙邊關係，因我們的友誼建立在相互尊重、合作和擁有共同發展目標基礎上」。她重申，史瓦帝尼將繼續奉行獨立自主、有原則的外交政策，優先考慮與國際社會所有成員建立和平、合作和互利夥伴關係。賴清德昨在民進黨中執會表示，他原本要率團出訪史瓦帝尼，祝賀國王恩史瓦帝三世五十八歲生日、以及慶祝中華民國和史瓦帝尼建交五十八週年，但中國政府施壓第三國臨時取消航空許可，因此不得不取消行程。賴清德說，他已經在第一時間親自致電國王祝賀生日快樂，也致歉無法親自參加慶祝活動。他和恩史瓦帝三世皆感到遺憾，也重申兩國邦誼不會受到影響，在外力壓迫之下，只會更團結合作。「當中國越是打壓，我們越要展現無畏無懼精神，持續強化國家實力，穩健走向國際。」賴清德直言，台灣是主權國家，是世界的台灣，二三〇〇萬的台灣人有權走向世界，沒有任何國家能阻擋，也無法阻擋。賴清德並呼籲國內朝野政黨，面對中國破壞區域和諧、侵犯台灣主權的行為，應更加清楚辨識中國的真實樣貌，不分黨派皆應團結，守護國家尊嚴。    ,https://news.ltn.com.tw/news/politics/paper/1752050
現身立院欲見韓國瑜撲空 李貞秀提告立院、中選會,政治,2026/04/23 05:30,遭民眾黨開除黨籍的陸配李貞秀（左）22日現身立法院收發室，她說，希望將行政訴訟起訴狀交給立法院長韓國瑜。（中央社）民眾黨中評會日前開除中配立委李貞秀黨籍，李喪失不分區立委資格，但李並未就此妥協，繼十九日於個人直播稱她赴北院聲請「假處分」；她也前往台北高等行政法院提告中選會、立法院，要求確認中選會註銷立委名籍處分無效及撤銷立法院免職處分。中選會回應，如收到李女士所提相關爭訟書狀，將依法向管轄法院提出答辯說明。李貞秀指出，民眾黨中評會不只用空泛理由將她開除，就連最基本的「會議記錄」都付之闕如，強調「絕不接受莫須有的指控」。請繼續往下閱讀...李貞秀昨早也無預警現身立院，欲見立法院長韓國瑜向其表達權益訴求，更隔空嗆聲民眾黨主席黃國昌「直球對決」，最終「撲空」無功而返；韓國瑜則在上午十一時半準時現身立院會客室，在大法官尤伯祥監誓下，成大教授許忠信完成遞補李貞秀席次的程序，宣誓就職不分區立委。    ,https://news.ltn.com.tw/news/politics/paper/1752080
