Title,News_Type,date,content,url
台鐵說話了！游淑貞千人接駕挨轟 花蓮站：有人推稱「處長｣准的,政治,2026/03/05 13:28,游淑貞在花蓮車站滴水線內對支持者講話，支持民眾聚集在車站前第一車道，造成車輛堵塞。（記者花孟璟攝）花蓮縣吉安鄉長游淑貞昨（4）日接受國民黨徵召參選花蓮縣長，搭車返回花蓮時卻在花蓮車站上演「宮廟、社團千人迎接」大場面，挨轟「知法犯法、帶頭違規」，立委陳培瑜也批評毫無法治精神；台鐵公司東區營運處代理處長楊舜安今天說，他第一時間到場了解，一名男子竟說「處長已准了｣，他回「我就是代理處長」，這男子隨後說「要去找主辦」之後人間蒸發！楊舜安說，他昨天到台北開會，晚上搭火車回花蓮，在火車上就接到花蓮站副站長的電話「東出口聚集很多社團、宮廟，號稱要迎接游淑貞回花蓮」，他立即要求「當然不行，車站要行政中立」！他第一時間立即請鐵路警察局花蓮分駐所警察前往支援，要求到場迎接民眾「退到站前廣場滴水線外」，也就是不能在車站遮雨棚範圍內。請繼續往下閱讀...楊舜安說，吉安鄉長游淑貞搭乘晚間7點59分抵達花蓮站的台鐵282次普悠瑪號，誤點6分鐘，晚間8點5分抵達花蓮站，他隨即到場了解，發現東出口聚集大批民眾，車站接送旅客的第一車道也交通打結，他詢問現場迎接的社團人員「你們不知道車站必須行政中立嗎，這麼多人影響出站動線」！那名男子卻回答「這是你們處長准的」，當他回答「我就是處長」，男子就說要去請問主辦人，然後人就不見了。游淑貞到站後現場大批支持社團、宮廟人員，高舉寫有宣傳標語的手板、戰旗迎接，游淑貞一一握手、擁抱，還在車站內以麥克風高分貝宣講，當下也引起站務人員反彈，剪票領班馬上出面喊「麻煩大家往後退，不要影響動線」，但當場人實在太多無法控制，直到晚間8點半人潮才散去。一名站務人員批評「當著代理處長的面說處長准了，完全是睜眼說瞎話」，現場麥克風「開得比車站廣播還要大聲」，要是有旅客因為沒有聽到廣播，錯過搭車時間，這筆帳要算誰的，希望游團隊可自律，否則對選情不會有加分。台鐵公司指出，游淑貞並沒有向台鐵提出申請，依照「交通部臺灣鐵路管理局場地短期出借作業須知」，明文禁止政治活動在站區、月台或場地內穿著競選背心、拉票、舉辦造勢活動均屬違規，已再次要求花蓮站、鐵路警察局，往後若有類似狀況必須保持中立，第一時間立刻處理，防止民眾愈聚集愈多失控。游淑貞昨天接受國民黨徵召參選花蓮縣長，搭火車返回花蓮後出現千人迎接場面，人潮進入站內還擋住車站動線，被批知法犯法。（記者花孟璟攝）第一時間鐵路警察局、花蓮車站站務員前往勸導迎接社團人員退後。（記者花孟璟攝）在台鐵花蓮站出站的第一車道聚集的大批迎接支持者，將道路堵住車輛難以通過。（記者花孟璟攝）游淑貞昨天接受國民黨徵召參選花蓮縣長，搭火車返回花蓮後出現千人迎接場面，人潮進入站內還擋住車站動線，被批知法犯法。（記者花孟璟攝）    ,https://news.ltn.com.tw/news/politics/breakingnews/5359780
中東戰火震盪台股 卓榮泰喊話：適時採取穩定措施,政治,2026/03/05 13:14,行政院長卓榮泰今（5）日在院會中表示，2日至4日台股跌幅，相較於日韓跌幅為低，目前尚在可控的範圍內，且今日已呈現大幅度上漲趨勢。（行政院提供）美國、以色列與伊朗的戰火讓台股連跌兩天，今天反彈開高，股市震盪大；行政院長卓榮泰今（5）日在院會中表示，從2日至4日台股跌幅，相較於日韓跌幅為低，目前尚在可控的範圍內，且今日已呈現大幅度上漲趨勢，但仍請財政部、金管會密切關注中東情勢發展及金融市場的動態，適時採取相關穩定措施。金管會指出，近期受中東情勢影響，國際股市及台股波動較大，統計3月2日至3月4日台股集中市場跌幅7.3%，亞洲主要股市上海跌1.93%、香港跌5.19%、日本跌7.82%、韓國跌18.43%，台股跌幅介於亞洲主要股市之間。請繼續往下閱讀...金管會說，台股短期雖受到中東情勢緊張影響，但股市長期仍將回歸基本面，台股集中市場今年截至1月底本益比約25.84倍，現金殖利率2.06%（加計股票股利為2.12%），國內上市櫃公司今年1月底營收金額為新臺幣4.724兆元，較去年同期成長30.96%，營收金額為歷年同期最高，台股基本面尚稱穩健。金管會強調，台灣證券交易所及證券櫃檯買賣中心已於4日發布新聞稿，呼籲投資人理性面對短期波動，另金管會將密切關注國際政經情勢發展及台股相關指標變化，適時採行相關措施，維護資本市場穩定。    ,https://news.ltn.com.tw/news/politics/breakingnews/5359768
台美關稅協定不必限時送立院  行政院舉往例說明,政治,2026/03/05 13:01,對於台美對等貿易協定，行政院發言人李慧芝今（30）日表示，我方將在與美方溝通後，再將文本及影響評估整體送交國會。（記者鍾麗華攝）台美對等貿易協定2月13日完成簽署，依照我國「條約締結法」規定要在30天內報請行政院送立法院審議，但美國最高法院判決對等關稅無效，協定生效陷入爭議，而距離法定時限僅剩約10天。對此，行政院發言人李慧芝今（30）日表示，30天是指主管機關報到行政院的期限，我方將與美方溝通後，再將文本及影響評估整體送交國會。根據「條約締結法」第8條規定，條約案經簽署後，主辦機關應於30日內報請行政院核轉立法院審議。不過，李慧芝解釋， 30天是指「主管機關報到行政院的期限」，例如我國跟帛琉共和國簽署的刑事司法互助協定，就是在2022年8月30日簽署，法務部是在當年9月22日報到行政院，是符合締結法30天內的期限，行政院是在同年11月函送立法院。請繼續往下閱讀...李慧芝說明，台美MOU或ART的部分都取得最佳待遇，在美國最高法院判決之後，談判團隊也已跟美方取得聯繫，並持續進行密切溝通中，確保我方取得的最佳利益，讓台灣產業能享有相對優勢及最佳待遇。李慧芝表示，目前雙方已有一定共識，美方承諾在完成內部行政作為及法律途徑後，就會依序通知已經簽約的國家，其中就包含我國在內。我方在跟美方溝通後，再將文本及影響評估整體送交國會，若有最新進度會持續跟國人做說明。    ,https://news.ltn.com.tw/news/politics/breakingnews/5359744
林佳龍跳吐瓦魯傳統舞 台吐簽署避免雙重課稅、贈海纜營運費,政治,2026/03/05 12:59,外交部長林佳龍在吐瓦魯總理戴斐立邀請下跳了一小段當地傳統舞蹈Fatele。（圖擷取自林佳龍臉書）外交部長林佳龍正以總統特使身分訪問友邦吐瓦魯。林佳龍代表我國政府與吐瓦魯正式簽署「避免所得稅雙重課稅及防杜逃稅協定」，並致贈去年底正式開通的吐瓦魯首條海纜「Vaka」的首年度營運費用。吐瓦魯總理戴斐立（Feleti Teo）特別以隆重國宴接待林佳龍的到訪，並安排傳統歌舞表演，讓他深刻體會吐瓦魯人民的熱情與善意。林佳龍並在戴斐立邀請下跳了一小段傳統舞蹈 Fatele，為雙方留下珍貴回憶。請繼續往下閱讀...在吐瓦魯代理總督皮塔（Afelee Pita）、國會議長伊塔雷理爵士（Sir Iakoba Italeli）等貴賓見證下，林佳龍代表我國政府正式簽署「避免所得稅雙重課稅及防杜逃稅協定」，進一步促進雙邊經貿交流，鼓勵企業赴吐瓦魯投資，持續深化台吐堅實邦誼。林佳龍指出，台灣與美國、日本、澳洲及紐西蘭合作協助吐瓦魯建置的首條海底電纜「Vaka」已於去年底正式開通，大幅提升吐瓦魯對外網路的頻寬與連線速度。此行他也代表政府致贈首年度營運費用，期盼持續協助吐瓦魯強化通訊韌性，讓世界看見吐瓦魯，也讓吐瓦魯與台灣、世界更緊密。林佳龍也特別感謝吐瓦魯長期在國際場域為台灣仗義執言，支持台灣有意義參與世界衛生組織、聯合國大會、聯合國氣候變化綱要公約及國際民航組織等國際組織。林佳龍表示，此行是他第3次訪問吐瓦魯，也是首次在當地過夜，近年來，台吐高層互訪頻繁，各項合作計畫務實推展，展望未來，期待台灣與吐瓦魯如同家人般更加緊密，共同實踐「kaitasi」（吐瓦魯語「家人」之意）的精神，繼續並肩向前、互相扶持。外交部長林佳龍以總統特使身分，代表我國政府與吐瓦魯正式簽署「避免所得稅雙重課稅及防杜逃稅協定」。（圖擷取自林佳龍臉書）    ,https://news.ltn.com.tw/news/politics/breakingnews/5359741
連任失利！民進黨初選沒過 高市議員黃彥毓：深深感謝、全力輔選,政治,2026/03/05 12:51,民進黨高雄市議員黃彥毓（左）競選連任，卻在黨內初選沒能過關。右為高雄市長參選人賴瑞隆。（記者王榮祥翻攝）民進黨高雄市前鎮小港選區市議員黃彥毓在黨內初選沒過關!他PO文指出，結果雖未如預期、感謝始終不變，接下來會全力投入市長與市議員的輔選工作。黃彥毓表示，民調結果雖未能如願，仍然要深深感謝前鎮、小港的鄉親朋友，這兩天幫忙顧電話、給彥毓支持與鼓勵。請繼續往下閱讀...他說，選舉有輸有贏，但服務地方的心不會改變，未來仍會繼續努力，關心地方、陪伴鄉親。黃彥毓進一步提到，接下來會全力投入市長與市議員的輔選工作，一起努力、讓立委賴瑞隆順利當選市長，議會席次過半，讓高雄持續向前，由衷感謝大家一路的支持與疼惜。爭取連任的民進黨高市議員黃彥毓，在黨內初選沒過關，他強調服務地方的心不變，接下來也會投入市長與議員輔選。（記者王榮祥翻攝）    ,https://news.ltn.com.tw/news/politics/breakingnews/5359724
中國軍費再增7％！ 學者：仍優先維持軍力擴張,政治,2026/03/05 12:49,中國全國人大今日開幕，國務院總理李強發表政府工作報告。2026年中國國防預算將增加7%，總額達到1兆9095億元人民幣（約新台幣8.77兆元）。（翻攝直播）中國全國人大今日開幕，國務院總理李強發表政府工作報告。2026年中國國防預算將增加7%，總額達到1兆9095億元人民幣（約新台幣8.77兆元）。涉台部分，他聲稱「堅持一個中國原則和九二共識，堅決打擊台獨分裂勢力，反對外部勢力干涉，推動兩岸關係和平發展，促進祖國統一大業」；學者分析，即使在經濟成長壓力與財政負擔增加情況下，中國仍然優先維持軍事能力擴張與現代化。前東海大學陸研中心副執行長洪浦釗今日受訪表示，李強在今年政府工作報告中的對台談話，從整體政策結構來看，其實呈現出一種「融合發展在前、軍事力量在後」的雙軌策略。報告內容大致延續過去幾年的政策框架，包括重申「一個中國原則」與「九二共識」，並再次強調「堅決打擊台獨分裂勢力，反對外部勢力干涉」，同時提出持續推動兩岸交流合作與融合發展。請繼續往下閱讀...洪浦釗分析，從文字表述來看，整體語氣並沒有明顯升高，但若放在中國整體政策與戰略環境中觀察，更值得注意的其實不是語言本身，而是政策結構所呈現的方向。中國在對台政策上，長期維持相對穩定的表述模式，既透過政治語言維持其主權立場與安全訊號，也持續強調經濟與社會層面的互動。洪浦釗進一步說，這種語言並不是單純的交流語言，而是一種治理語言。所謂「融合發展」，不只是兩岸經貿往來，而是透過產業合作、就業機會與制度安排，逐步讓人、資本與產業更深地嵌入中國的經濟與社會體系。從中國政治體系的運作邏輯來看，這是一種長期性的制度安排，而不是短期的政策宣示。洪浦釗強調，今年另一個非常明確的訊號，是中國軍事預算持續增加。今年軍費達到人民幣1兆9095億元，年增7%，而過去3年軍費增幅也大致維持在7.2%左右。這意味著，即使在經濟成長壓力與財政負擔增加情況下，中國仍然優先維持軍事能力擴張與現代化，顯示其對區域安全環境與戰略競爭的基本判斷依然明確。洪浦釗分析，換句話說，中國一方面透過融合發展與制度性互動維持影響力，另一方面則持續強化軍事能力，作為戰略壓力與嚇阻工具。從這個角度來看，單純比較語氣是否強硬，其實很難真正理解中國對台政策的走向，更重要的是觀察其長期投入的制度工具與戰略資源。洪浦釗說，在這樣的情勢下，當中國軍費持續增加並強化軍事能力時，國際社會自然也會關注台灣自身在安全上的投入與決心。如果台灣的國防預算在國內政治過程中長期受到制肘，外界會對台灣的安全承擔能力產生疑問。這不只是單純的預算爭議，是會被放在區域安全結構與戰略判斷中一起觀察。他強調，因此，當中國持續增加軍費並強化軍事能力時，台灣是否能夠展現穩定而清楚的防衛決心，將直接影響國際社會對台海安全局勢的評估。簡單說，如果台灣連基本的安全投入都無法形成共識，對外傳達的訊號就會變得模糊，這對台灣在國際安全體系中的位置並不是一件有利的事情。    ,https://news.ltn.com.tw/news/politics/breakingnews/5359723
傳出戰高虹安的奇兵？ 李慧芝：日常就是政務與政策,政治,2026/03/05 12:43,傳出行政院發言人李慧芝是適合出戰現任新竹市長高虹安的奇兵，對此，李慧芝今（5）日表示，她的日常就是政務與政策。（記者鍾麗華攝）九合一大選年底登場，國民黨各縣市長提名工作急起直追，預計3月底前完成主要布局，相較之下，民進黨仍有7縣市未定案，媒體報導，黨內也有人認為行政院發言人李慧芝是適合出戰現任新竹市長高虹安的奇兵。對於是否將參選新竹市長？對此，李慧芝今（5）日在行政院會後記者會表示，她的日常就是政務與政策，日常討論也是政務而非選務，所以今天以政務為主。媒體報導，對於民進黨新竹市長參選人，原呼聲最高的陽明交大法律學者林志潔，因其志趣在法律制定，而非城市治理，加上其父近來反覆入住加護病房，使其難有餘力思考選舉。請繼續往下閱讀...此外，黨內點名竹市信賴台灣之友會理事長吳國治是黑馬，吳國治是竹市著名醫師，其眼科診所在地方經營多年。而在考量竹市的都會特性、選民結構及對手特質的前提下，黨內也有人認為行政院發言人李慧芝是適合出戰現任市長高虹安的奇兵。    ,https://news.ltn.com.tw/news/politics/breakingnews/5359721
盧秀燕將訪美 鄭麗文：全力協助、對她有十足信心,政治,2026/03/05 12:43,盧秀燕將訪美，鄭麗文表示會全力協助，相信盧秀燕會做好城市外交。（記者蔡政珉攝）台中市長盧秀燕將於近期訪美，國民黨主席鄭麗文今天出席苗縣黨部活動被問及相關問題時表示，將責成國民黨駐華府代表處盡力協助，且盧秀燕曾是資深的委員，對盧秀燕有十足的信心、也全力的支持，相盧秀燕訪美行程會有滿滿收穫。鄭麗文說，國民黨很多縣市長除認真的推動相關的政務，也積極推廣城市外交，令她非常佩服、也非常支持；鄭麗文說，不只是城市外交，包括之前的雙城論壇，兩岸交流也努力進行中。請繼續往下閱讀...鄭麗文指出，關於盧秀燕訪美的行程，她責成國民黨在華府的駐美代表處全力協助、輔佐幫忙，務必一定要圓滿成功，至於盧秀燕行程，與台中市政府息息相關，一切尊重盧秀燕相關的安排，她對盧秀燕深具信心，相信盧秀燕會完成非常精彩的城市外交。鄭麗文也說，盧秀燕不只是一個好市長，過去也曾是國民黨非常資深的委員，所以對於相關問題的掌握、拿捏，對她有十足的信心，相信盧秀燕此行會有滿滿的收穫。    ,https://news.ltn.com.tw/news/politics/breakingnews/5359701
民進黨高市議員第三選區提名初選揭曉    林志誠奪冠,政治,2026/03/05 12:35,民進黨高市議員三選區初選民調，林志誠支持度最高。（記者王榮祥翻攝）民進黨高市議員第三選區（岡山等六區）提名黨內初選民調揭曉，4人爭取3席提名資格，最終由林志誠、黃秋媖、蔡秉璁出線。民進黨黨中央公布民調結果，依序為林志誠0.3799、黃秋媖0.3600、蔡秉璁0.2047、蔣宛庭0.0554。民進黨高市議員三選區初選民調，爭取連任的黃秋媖順利出線。（翻攝臉書）民進黨高市議員三選區初選民調四選三，蔡秉璁順利入榜。（記者王榮祥翻攝）    ,https://news.ltn.com.tw/news/politics/breakingnews/5359707
鄭麗文赴苗縣新春團拜 喊話力拚五合一選舉全壘打,政治,2026/03/05 12:27,國民黨主席鄭麗文，到苗栗縣黨部參加新春團拜，喊話力拚苗栗五合一選舉全壘打。（記者張勳騰攝）國民黨主席鄭麗文今（5）日到苗栗縣黨部參加新春團拜，面對年底的五合一選舉，強調苗栗人這麼看重國民黨，更要非常珍惜這份苗栗人的人情，國民黨一定要加倍努力；她並下達軍令狀，要求全力支持縣長鍾東錦連任，也要讓議長李文斌及黨籍議員高票當選，繼續連任，新任的也要努力，希望有所突破，揮出「全壘打」。鄭麗文是苗栗縣後龍鎮媳婦，她今天到苗栗縣黨部參加新春團拜時指出，在苗栗一直都是藍軍最團結、最堅強，綠營一直攻不破的地方。但是他們從來沒有因此而驕傲自大。相反的，苗栗縣民越支持國民黨，國民黨更要越謙卑，且要越認真加倍的努力來建設苗栗縣，讓苗栗縣成為最風光、最幸福、最發財的地方，吸引大家都想要來苗栗居住、投資及養老。請繼續往下閱讀...鄭麗文亦稱許鍾東錦傑出的縣政表現，並表示，鍾的魄力、眼光，讓苗栗縣一天一天欣欣向榮，年底的選舉，也務必要讓鍾縣長繼續高票連任，同時黨籍現任議長、議員要讓他們高票連任，新任的也要努力，希望他們能夠突破，揮出「全壘打」。    ,https://news.ltn.com.tw/news/politics/breakingnews/5359670
高雄市與關島締結姊妹市  陳其邁：同是充滿陽光、熱情的海洋城市,政治,2026/03/05 12:26,高雄市政府於3月5日與美國關島正式締結姊妹市。（高市行國處提供）美國關島總督古蕾露率團訪問高雄，並與高雄市長陳其邁共同簽署姊妹市協定，陳其邁表示，高雄跟關島同為充滿陽光、熱情的海洋城市，雙方將在觀光、文化、教育、農漁業及城市治理等領域展開多元合作。簽署儀式由美國在台協會高雄分處張子霖（Neil Gibson）、外交部駐關島辦事處總領事劉嘉平、聯合航空台灣區業務總經理唐靜儀共同出席見證。請繼續往下閱讀...陳其邁指出，高雄與關島在觀光產業、海洋永續及教育交流等面向具高度互補性，這次締結姊妹市，不僅象徵兩市情誼深化，也為未來合作奠定基礎，雙方將在觀光、文化、教育、農漁業及城市治理等領域展開多元合作。高市府說明，古蕾露總督曾於2025年率團訪高，這次率領關島觀光局、經濟發展局等代表團成員再度來訪，正式完成姊妹市簽署程序，展現雙方推動長遠夥伴關係的決心。古蕾露總督致詞首先感謝高市府團隊的熱情接待，強調關島與台灣共享南島民族文化，也廣納來自世界各地的族群及遊客，觀光資源是關島最重要的資產，盼提升兩地人民互訪及發展。她也提及高雄擁有半導體及水產養殖產業的成熟技術，期待未來在觀光、農漁業、醫療及智慧治理等領域深化交流，拓展技術合作機會。關島總督古蕾露（Hon. Lourdes A. Leon Guerrero）率團訪問高雄，與高雄市長陳其邁簽署姊妹市。（高市行國處提供）    ,https://news.ltn.com.tw/news/politics/breakingnews/5359699
立院藍黨團推3500億軍購條例 分階段通過、無懲罰條款,政治,2026/03/05 12:22,立法院國民黨團今天上午召開記者會，公布黨團版3500億元軍購特別條例草案，左起：立委王鴻薇、林沛祥、馬文君。（記者劉宛琳攝）立法院國民黨團今召開「支持對美軍購，捍衛國家安全」記者會，黨團書記長林沛祥表示，國民黨團版的特別條例草案中明確規定，取得美方正式報價書的採購項目才適用本條例（3500億元），第二階段軍購，只要美方正式提出新的報價書速立法審議，立院即召開朝野協商從速完成三讀程序。他也表示，條例中沒有懲罰條款，但要求國防部每會期向立法院提出執行報告，並請審計機關依法監督，執行進度嚴重落後就必須送監察機關調查。國民黨團上午召開黨團大會，僅討論「黨版」軍購特別條例，也就是智庫提出的3500億元版，沒有討論其它立委的版本。並僅針對智庫版本做部分做「微調」，也拿掉懲罰條款。目前條例尚在做調整，國民黨團尚未送出。請繼續往下閱讀...林沛祥表示，美國政府在去年12月18日正式通知通知我方金額約3500億的8項軍售案，包括海馬式、遠程精準打擊系統、M109A7自走砲、反裝甲無人機、飛彈器標槍及TOW飛彈，全部都是政府對政府、公開透明的正式軍售，軍售程序也就是所謂的Foreign Military Sales （FMS），國民黨的態度是全力支持、盡速推動。林沛祥表示，國民黨會負責任的支持這份條例的通過，然而在支持條例的同時也有責任把關，不是阻礙、而是守護，台灣過去曾經有慘痛的經驗，過去包括拉法葉、鐽震案，都是在商業採購過程中因為缺乏透明度，沒有懲罰條款，最終變成國際醜聞，更有人付出生命的代價。林沛祥表示，條例中明確規定，只有符合美國對台軍售程序FMS，有明確的台海作戰需求，且取得美方正式報價書的採購項目才適用本條例，這不是刁難，而是負責，3500億花的是全民的血汗錢，我們必須確保每一分錢都花的清楚、正確。林沛祥表示，國民黨在條例裡面會要求每會期向立法院提出執行報告，要求審計機關依法監督，若執行進度嚴重落後就必須送監察機關調查。這些設計只有一個目的，就是確保每一筆的軍購經費都確實用在提升戰力上，而不是留下任何的爭議空間。林沛祥表示，至於第二階段軍購，國民黨支持只要有明確依據就會積極推動，因此條例中已經明定，一旦美方正式提出新的軍售報價書，主管機關應立即研擬第二階段特別條例草案送請立法院審議，立法院也應即刻召開朝野協商，從速完成三讀程序。立即從速這四個字是我們寫入條文裡面的具體承諾，國民黨希望以分階段具體明確的方式來推進軍購，而不是一次性的授權，一張沒有金額上限、沒有內容明細的空白支票。國民黨立委王鴻薇強調，國民黨不是黨軍購，是支持國防，3500億確認是明確賣給台灣，未來只要美國啟動下一階段對台軍售，國民黨就會依據條文啟動第二階段的軍購，我們絕對是負責任的來支持國防，但不容許有任何黑箱、私相授受的局面。    ,https://news.ltn.com.tw/news/politics/breakingnews/5359672
