Title,News_Type,date,content,url
國防部特別預算草案8月送政院 卓榮泰：目前還沒看到,政治,2025/10/28 17:14,行政院長卓榮泰表示，為了充實台灣的國防，也考量到台灣的財政，政府如果有需要編列任何的特別預算，會照程序來進行。（記者劉信德攝）民進黨立委王定宇上週透露表示，台灣政府預計在10月底、11月初提出規模高達1.3兆元的特別預算。國民黨立委徐巧芯今天質詢關切特別條例進度與金額，國防部副部長鍾樹明答詢說，8月8日已送到行政院；行政院長卓榮泰表示，他目前沒有看到任何內容，且金額還要經業務處審核，委員講的事情政院無法證實。立法院會今天繼續進行施政總質詢。徐巧芯質詢詢問，除了今年國土預算的1000多億元，明年準備要審查的9500多億元，有立委表示，年底要再增列1.3兆的國防預算，請問是否屬實。請繼續往下閱讀...卓榮泰表示，為了充實台灣的國防，也考量到台灣的財政，政府如果有需要編列任何的特別預算，會照程序來進行。不過，到目前為止，任何有關特別預算的金額、方向、內容等等，都沒有在行政院，「我都沒有看到這個內容，也就是說，我們沒有進一步在討論。」徐巧芯追問，如果行政院要在年底前提一個1.3兆元的特別預算，現在要11月了，但卓現在什麼都還沒看到、什麼都還不知道。這麼大的金額都還沒有規劃，都還不清楚，到時候提出的特別預算能夠說服多少人。卓榮泰說，請委員更正一下，不是他都沒有規劃，是國防部等相關部會在規劃，到現在沒有任何案子讓他看到。如果真的有一個特別預算案，一定會請立法院在充裕的時間內，詳細的審查內容。徐巧芯接續詢問，國防部有無提報1.3兆的特別預算到行政院。鍾樹明答詢說，整個特別預算條例草案已經送到行政院審查，但還沒有到行政院長手上，並補充是在8月8號送出。徐巧芯說，現在已經10月28號，院長還沒拿到啊？並追問詳細金額。卓榮泰說，業務處一定是很慎重的審核，金額部分，還要經過行政院業務處的審核，才能夠對外說明。鍾樹明表示，國防部送出的相關特別預算的條例並非金額。徐質疑，有相關的品項就知道相關的金額，不要內行人說外行話；鍾回應，並不是每一個品項都一定會過，不是內行人說外行話。卓榮泰表示，未來在審查的過程，如果內涉機密，都有可能用機密的會議來進行，在這裡公開討論，他覺得是千萬不宜，況且現在沒有固定案子。徐則不滿反嗆，這是王定宇在美國的時候說的，既然有委員提出，她當然要詢問。卓榮泰也說，如果還在業務處審核的過程當中，這個案子並不是現在最後的結果，不是最後的結果，現在在這裡討論就沒有必要。徐巧芯問，所以1.3兆預算是一個假消息？卓回應，這個消息不是從行政院出去，委員講的事情，行政院沒有辦法做任何的證實。熱門賽事、球星動態不漏接    ,https://news.ltn.com.tw/news/politics/breakingnews/5226565
自由說新聞》尷尬瞬間！藍委扯和平被電爆！卓榮泰神回：國共越談越打越輸,政治,2025/10/28 17:13,全新的視界！新聞話題不漏接，快訂閱YouTube 【自由追新聞】，記得開啟小鈴鐺哦！熱門賽事、球星動態不漏接    ,https://news.ltn.com.tw/news/politics/breakingnews/5226589
歐洲擬建「海洋聯盟」防灰色破壞 歐議員：歐盟印太戰略應納台灣角色,政治,2025/10/28 17:00,2025福爾摩沙台北年會主席、歐洲議員柯理和（Rihards Kols）28日在台北召開國際記者會。（記者陳逸寬攝）2025「福爾摩沙俱樂部」年會主席、拉脫維亞籍歐洲議員柯理和（Rihards Kols）今（28）日在國際記者會受訪指出，歐洲內部正研議建立「海洋聯盟」（Union of the Seas）法制架構，針對波羅的海、北海、地中海等區域，賦予各國在特定情況下可依國內法對疑似破壞海底基礎設施的船隻進行拘留與調查，以防止「灰色地帶」行為持續威脅民主國家安全。柯理和指出，近年歐洲多起海底電纜與能源管線受損案例，與台灣周邊情勢高度類似，關鍵問題在於「如何蒐證、如何執法、如何追究責任」。他直言，若破壞事件頻率愈高、卻一再歸咎「人為失誤」，就應懷疑背後存在第三方操弄，企圖擾亂主權與國家安全，「我們不能再讓這些事件被『灰色地帶』掩蓋，最終沒人負責」。請繼續往下閱讀...他強調，現行國際海事組織（IMO）及國際海洋法已有基礎，但仍不足以應對現實威脅。歐洲國家因此討論建立「海洋聯盟」，在國際法與區域法律間建立銜接機制，並推動制度改革，使各國能在必要時執行執法行動。他坦言，這項改革需要時間，但若不正視問題，「潛在破壞者會發現這樣的手段有效」，威脅將蔓延至全球。針對歐台合作方向，柯理和表示，歐盟即將展開「多年期財務架構」（MFF）談判，規劃未來七年預算與政策優先順序，印太與跨大西洋戰略都將是焦點。他強調，歐盟的戰略藍圖必須與財務支撐相結合，否則將「淪為空談」。同時指出，當歐盟內部討論對東亞或印太政策時，「台灣的角色與合作層級應被納入、被反映」，並應由歐盟執委會與成員國共同落實執行。他並補充，歐盟在政策規劃上，應讓台灣被明確納入相關政策文件，作為深化合作與未來協議的基礎，「唯有在政策文件中被體現，才能落實為具法律效力的合作架構」。柯理和也稱讚台灣主動與歐盟、北約制裁政策接軌，防止高科技產品外流至俄羅斯，大讚台灣是「值得信賴、永不出賣的夥伴」。他說，歐盟與台灣共享相同價值，這段關係是透過多年合作逐步建立的，無論是打擊假訊息、強化社會韌性或民防領域。柯理和的主張亦與同場記者會中我國副總統蕭美琴的發言呼應；蕭美琴強調，海底電纜安全不僅是技術問題，更關乎國家安全、經濟穩定與民主體系的延續，呼籲台歐夥伴在「共同責任與透明信任」原則下持續深化合作，守護自由世界的通訊命脈。熱門賽事、球星動態不漏接    ,https://news.ltn.com.tw/news/politics/breakingnews/5226533
歐盟「再武裝」擬邀可信賴夥伴 歐議員柯理和點名台灣,政治,2025/10/28 16:56,2025福爾摩沙俱樂部台北年會主席、歐洲議員柯理和（Rihards Kols）。（記者陳逸寬攝）「福爾摩沙俱樂部」年會主席、歐洲議員柯理和（Rihards Kols）今（28）日在台北召開國際記者會指出，歐盟正在推動「2030戰備計畫」（Readiness 2030）與「歐洲再武裝」（ReArm Europe）政策，目標是強化歐洲防衛能量與供應鏈韌性。他強調，歐盟執委會已呼籲成員國在軍事採購與裝備上優先使用歐洲製造，但同時「邀請可信賴夥伴」共研、共製，「台灣正是能夠積極參與的夥伴之一」。柯理和在記者會上說，歐洲「再武裝」與「戰備計畫」的核心在於讓歐洲在面對新威脅時能提升整體防衛自給與生產能量，不僅強化歐洲內部的軍工體系，也為與民主夥伴共同合作開啟新契機。他指出，這兩項政策的精神，是要讓歐洲在維持自主的同時，與志同道合的夥伴建立可長期依賴的防衛合作網絡，而在國防產業專案上共同研發、合作，台灣正是能夠積極參與的夥伴之一。請繼續往下閱讀...他指出，無人機與自主水下載具等技術既具軍民兩用價值，也可應用於海底電纜防護與偵測，「這正是歐台合作可以落地的領域」。他並提及拉脫維亞已與台灣簽署無人機合作備忘錄，後續可進入研發與生產階段，歐盟各成員國的「無人機聯盟」（Drone Alliance）也在積極擴展合作範圍。柯理和進一步說明，歐盟正在啟動「連結歐洲設施」（Connecting Europe Facility）計畫，將軍事機動擴展至「反機動」領域，納入海上防護與關鍵基礎設施維修能力。他舉例，美國與芬蘭近期簽署共同生產十四艘破冰船協議，顯示歐洲在高北地區（High North）同樣面臨俄羅斯軍事化與中國「近北極國家」野心的威脅。他警告，若歐洲僅關注內部局勢而忽略外部安全，「將再次錯失時機、讓對手取得主動」。因此歐盟與可信賴夥伴必須透過「公私協力夥伴關係」強化供應鏈與防衛韌性，並確保海纜修復與能源設施不落入敵對勢力控制，「這正是我們從第一天起就必須謹慎面對的問題」。熱門賽事、球星動態不漏接    ,https://news.ltn.com.tw/news/politics/breakingnews/5226537
對何欣純很有信心！2026不選台中市長  蔡其昌親曝與總統對話內容,政治,2025/10/28 16:46,民進黨選對會日前拍板徵召立委何欣純（左）參選台中市長，民進黨立委蔡其昌今（28）日接受廣播節目《POP撞新聞》主持人黃暐瀚專訪時表示一定會全力支持。（資料照）民進黨選對會日前拍板徵召立委何欣純參選台中市長，民進黨立委蔡其昌今（28）日接受廣播節目《POP撞新聞》主持人黃暐瀚專訪時表示，他一定會全力支持、他對何欣純很有信心。黃暐瀚在節目上詢問蔡其昌明年台中市長選舉確定是何欣純出來選，他是被勸退嗎？真的會支持何欣純嗎？蔡其昌隨即回應：「我一定會支持！」並強調何欣純有任何需要都會幫忙。請繼續往下閱讀...蔡其昌說，總統希望他留在中央，地方讓欣純去選，所以他一定全力支持！他對何欣純很有信心！至於總統說的「留在中央」什麼意思？蔡其昌說總統沒有講，他也不知道，外界解讀可能明年他當立院總召？蔡其昌則說目前沒有這方面規劃。熱門賽事、球星動態不漏接    ,https://news.ltn.com.tw/news/politics/breakingnews/5226432
非洲豬瘟衝擊彰化排隊名店   楊子賢點名盧秀燕應向鄰近縣市道歉,政治,2025/10/28 16:30,彰議員楊子賢表示，非洲豬瘟對毛豬大縣的彰化縣，及爌肉飯、肉圓大縣的彰化縣，都是帶來重大衝擊。（楊子賢提供）台中梧棲爆非洲豬瘟，全國豬隻禁運禁宰延長10天，連帶彰化多家排隊名店的肉圓、爌肉飯，不是暫停營業就是要改賣新口味。彰化縣議員楊子賢表示，對於爆發豬瘟所造成的民生衝擊，台中市長盧秀燕應該向鄰近縣市道歉。楊子賢表示，不要小看非洲豬瘟，這對毛豬大縣的彰化縣，以及爌肉飯、肉圓大縣的彰化縣，都是帶來重大衝擊。上次美國關稅，盧秀燕就邀集「中台灣治理平台」共8縣市一起召開線上會議，研擬對策，這次非洲豬瘟事態嚴重，卻不見「中台灣治理平台」的危機處理，說好的聯合團結作戰因變之道在哪裡？請繼續往下閱讀...楊子賢強調，防疫最怕破口，防範非洲豬瘟也一樣，但目前卻只見到台中市政府選擇推諉卸責，面對問題避重就輕，說法還一變再變！但防疫不分黨派，也沒有藉口，面對豬瘟嚴峻挑戰，各地政府都該並肩作戰。熱門賽事、球星動態不漏接    ,https://news.ltn.com.tw/news/politics/breakingnews/5226492
中市民進黨團要求市府進行非洲豬瘟專案報告 朝野明協商,政治,2025/10/28 16:27,中市議會29日中午將進行朝野協商。（記者蘇金鳳攝）台中一養豬場爆發非洲豬瘟，由於市府說法反覆，引起民眾疑慮，民進黨市議會黨團總召王立任認為事件重大，要求議會應要求農業局、環保局、教育局到市議會專案報告；國民黨議會黨團書記長李中則表示，由於近期沒有大會，明天中午將進行朝野協商，預計挑選出1天業務質詢，在質詢結束後進行非洲豬瘟專案報告。台中市一豬場爆發非洲豬瘟，目前該場還被驗出2處陽性，而廚餘的處理更讓市民疑慮，民進黨中市議會黨團要求市府相關局處進行專案報告。請繼續往下閱讀...王立任表示，黨團認為事件重大，因此要求市議會針對非洲豬瘟問題召開專案報告，要市府的農業局、環保局、教育局進行專案報告，並成立專案小組，但因為近期中市議會沒有大會，因此可能在本週選一天業務質詢結束後，進行專案報告。李中表示，預計明天中午進行朝野協商，討論利用業務質詢後再開專案報告的可行性。熱門賽事、球星動態不漏接    ,https://news.ltn.com.tw/news/politics/breakingnews/5226392
福爾摩沙俱樂部》蕭美琴：歐18國議員齊聚挺台 明確傳達「台灣不孤單」,政治,2025/10/28 16:14,副總統蕭美琴28日應邀出席「2025年福爾摩沙俱樂部年會」國際記者會。（記者陳逸寬攝）副總統蕭美琴今（28）日在「2025年福爾摩沙俱樂部年會」國際記者會致詞指出，來自歐洲18國的跨國議員齊聚台灣，象徵台歐民主夥伴在威權擴張下更加團結，也明確傳達「台灣在這場使命中並不孤單」訊息。她感謝俱樂部長期為台灣國際參與發聲、支持台海和平穩定，並強調印太與歐亞安全緊密相連。蕭美琴今天下午出席福爾摩沙俱樂部國際記者會說，來自歐洲18國的「福爾摩沙俱樂部」國會議員齊聚台灣，展現民主國家在複雜國際局勢中的團結與支持。她感謝俱樂部多年為台灣的國際參與發聲，也持續關注中國威脅與台海穩定。她指出，當前印太與歐亞安全息息相關，身處威權擴張前線的台灣，始終堅守民主信念，而各國友人來訪，也明確傳達「台灣在這場使命中並不孤單」的訊息。請繼續往下閱讀...蕭美琴說，海底電纜是全球經濟的生命線與數位社會的骨幹，確保其安全與韌性不僅是技術議題，更攸關國際安全與民主穩定。今天舉行的「海底電纜安全合作論壇」正是台歐深化合作的實例，也特別強調「共同責任、透明信任」的重要性。她重申台灣已啟動「國際海底電纜風險管理倡議，象徵台灣願與國際社會攜手守護集體安全與繁榮，防範惡意勢力對關鍵基礎設施的破壞。她並指出，歐洲現行優先政策為「防衛、安全與競爭力」，台灣亦在正在強化國防與「全社會防衛韌性」概念，包括資安、關鍵基礎設施、防災、金融體系韌性等面向。她強調，台歐在「韌性建構」上有許多可互相借鏡的經驗，期待未來在安全與防衛議題上持續深化合作。年會主席、歐洲議員柯理和（Rihards Kols）致詞時表示，「福爾摩沙俱樂部」此次年會聚焦深化歐台合作與強化民間交流，並通過聲明重申支持台灣。他指出，民主國家面臨俄羅斯侵略與印太局勢變動的雙重挑戰，20世紀的「以力服人」舊思維再現，警醒民主陣營必須團結，並採取具體行動應對。柯理和指出，歐洲光是在波羅的海地區，近2年即發生12起海纜受損事件，以立陶宛為例，一旦網路連線中斷，影響的不只是商業交易，連醫院與國防通訊都會立刻受衝擊，凸顯問題的嚴重性已攸關國安。柯樂見台灣推動「海底電纜風險管理倡議」，並呼籲各國共同建立監測與防護機制，他說，「民主社會不能只是被動記錄，而應主動防範、保護與監測這些關鍵設施」。柯理和也指出，歐洲正逐步走出享受「和平紅利」的安逸思維，意識到嚇阻與備戰的迫切性。歐盟與台灣之間，在「地平線計畫」與「伊拉斯莫斯＋」等多領域合作不斷擴展，雖仍有成長空間，但他認為，透過持續交流合作，必能強化社會韌性，守護雙方珍視的民主價值。「2025年福爾摩沙俱樂部年會」主席暨歐洲議員柯理和（Rihard Kols）28日在台北召開國際記者會。（記者陳逸寬攝）副總統蕭美琴（左）28日應邀出席「2025年福爾摩沙俱樂部年會」國際記者會致詞，與年會主席暨歐洲議員柯理和（Rihard Kols，右）向媒體發表談話。（記者陳逸寬攝）熱門賽事、球星動態不漏接    ,https://news.ltn.com.tw/news/politics/breakingnews/5226469
普發現金將上路 新北綠營籲加碼 侯友宜：拜託議員謹慎評估,政治,2025/10/28 16:11,新北市長侯友宜回應，新北目前還有887億的債務要償還，這時若要發4.6萬給每位市民，那要他去賣公園？這不是在討價還價，而是現實的問題，錢要怎麼發得出來？拜託議員謹慎評估。（記者羅國嘉攝）普發現金11月5日開放登記，新北市議會民進黨團今（28日）在議會總質詢呼籲新北市加碼，市長侯友宜回應，新北目前還有887億的債務要償還，這時若要發4.6萬給每位市民，那要他去賣公園？這不是在討價還價，而是現實的問題，錢要怎麼發得出來？拜託議員謹慎評估。侯也尊重議會決議，但自治條例不能抵觸中央法律，照顧人民也要遵守財政紀律。新北議會民進黨團總召廖宜琨指出，以新北為例，404萬人口計算，可獲404億元，這是給新北市民最大禮包，也是給市府拚經濟的最佳時機，因為全體市民不是只有等待中央普發現金，市長應該要加碼，才可以促進經濟效應。請繼續往下閱讀...議員彭佳芸表示，新北市提出自治條例交付審查要4萬6千元，市府會跟進嗎？如果市長反對，那這項條款就很通過；鍾宏仁詢問侯要不要普發一句話，再來就是相對配套措施要出來，新北所有攤商、夜市都要有普遍平等被對待。侯友宜回應，就現實面，4.6萬發下去市府很難做事，如果議會在財政考量下，如果沒辦法做事，市府也很難發；財政局長陳榮貴回應，115年還要舉債134億，完全沒有能力發放現金。議員周雅玲舉過往2021年曾推出加倍券，確實也留一些經濟在新北，而高雄的演唱會非常多，但高市在去年沿用「加食延暢券」，把所有高雄經濟加碼給夜市等。所以針對新北可拿到的4百多億，該如何安排、把一萬元流動在新北市，讓經濟活絡。侯友宜表示，領一萬還是鼓勵消費方向。針對這次普發現金，特別補助、輔導商圈辦77場補助性的行銷活動，讓消費達到庶民經濟。議員鄭宇恩則說，普發現金1萬元即將上路，同時詐騙集團也趁勢佈局，既然新北有敬老金1千5百元，是65歲長者直接匯入帳戶或領現，建議中央沒有收集到的65歲以上長者，市府是不是可幫忙用敬老金的帳戶，讓普發現金可順利入帳？侯友宜回應，會在與中央協調研議。熱門賽事、球星動態不漏接    ,https://news.ltn.com.tw/news/politics/breakingnews/5226425
張峻踹傅崐萁桌挨告 鍾佳濱：深刻理解花蓮災民的怨與恨,政治,2025/10/28 16:03,立法院民進黨團幹事長鍾佳濱。（資料照）花蓮馬太鞍溪堰塞湖潰流釀災，國民黨立委傅崐萁昨舉辦災後重建座談會，花蓮縣議會議長張峻衝入會場抗議為何阻擋災民進入，並踹了傅的桌子，傅今控告張涉犯傷害、強制、恐嚇等6罪。對此，立法院民進黨團幹事長鍾佳濱表示，那一腳大家看得非常清楚，可以深刻理解花蓮有多少災民的怨與恨，這樣的怒氣是給執政者警惕，未來要遵循民意。傅崐萁昨舉行「光復鄉堰塞湖受災區重建座談會」，但一開始傳出只邀請縣府、地方鄉民代表、村長及部分災民，許多災民都不知道這場座談會引發不滿，還被擋在外面抗議，張峻進場後怒踢傅的桌子，怒嗆：「為什麼不通知災民？」傅則回嗆：「黑道、現行犯，抓起來」，場面混亂。請繼續往下閱讀...對此，鍾佳濱今於民進黨團輿情回應記者會中表示，傅氏夫婦過去這2、30年來在花蓮執政掌權，造成當地許多民怨，昨天（張峻）那一腳大家看得非常清楚，不只如此，還看到警力阻擋災民進入會場，「我們就可以深刻理解花蓮有多少災民的怨與恨，這樣的怒氣，我想是給執政者一個警惕，未來要遵循民意」。對於傅崐萁提告張峻，鍾佳濱認為，每個人有其法律權益，要如何爭取，這交給司法解決，但他要強調的是，包括花蓮在內，人民眼睛是雪亮的，大家對於過去的小恩小惠，在最關鍵危急時能否顧及其身家性命，這才是最關鍵的。「花蓮在經過這次災後重建，人民的感受，我想執政者要能夠了解、體會、接受」。熱門賽事、球星動態不漏接    ,https://news.ltn.com.tw/news/politics/breakingnews/5226437
APEC峰會會晤高市早苗？ 林信義僅神秘回2字,政治,2025/10/28 15:58,我國APEC領袖代表林信義接受僑胞子女獻花致意，並與現場僑胞合影。（記者黃靖媗攝）2025年亞太經濟合作會議（APEC）峰會本週在南韓慶州登場，我國APEC領袖代表林信義今（28）日下午4時抵達位於慶州的下榻飯店，並接受僑胞歡迎，被問到是否要會見高市早苗、會不會與美國談到關稅，林信義皆未正面回應，僅揮手道謝。林信義今日下午2時抵達釜山金海機場，由南韓APEC資深官員主席尹盛渼大使、慶尚北道副知事金學泓、南韓機場公社副社長李正基代表接機。請繼續往下閱讀...林信義從釜山金海機場到慶州的下榻飯店，路途中有前導警車開道，也有殿後警車，皆與其他經濟體同等待遇。抵達飯店後，林信義接受僑胞歡迎，也接受僑胞子女獻花致意，並與現場僑胞合影，未發表談話便離去。慶州華僑協會會長鄭承禮受訪表示，歡迎且高興林信義來到慶州，「希望有好的結果」，期望能繼續促進台韓國民互相來往。媒體追問林信義此行來韓是否要會見日本新任首相高市早苗，以及是否會與美國談到關稅問題，林信義僅揮手連聲說「謝謝」，未直接回應。我國APEC領袖代表林信義今日下午4時抵達位於慶州的下榻飯店，受到僑胞歡迎。（記者黃靖媗攝）我國領袖代表林信義今日下午2時抵達釜山金海機場，由南韓APEC資深官員主席尹盛渼大使等人代表接機。（APEC台灣代表團提供）慶州華僑協會會長鄭承禮受訪表示，歡迎林信義來到慶州「希望有好的結果」。（記者黃靖媗攝）林信義下榻的慶州江東飯店門口提前懸掛「歡迎林領袖代表暨女公子蒞臨慶州江東飯店」。（記者黃靖媗攝）熱門賽事、球星動態不漏接    ,https://news.ltn.com.tw/news/politics/breakingnews/5226439
