Title,News_Type,date,content,url
稱中國人有股「怪臭味」 外國網友搬過去住驚曝：我身上也有了！,國際,2025/09/27 18:09,網友說，過去從來沒有口臭困擾，但來到中國後，卻出現從未經歷過的濃烈口氣。圖為中國廣州，與新聞當事人無關。（彭博）一名外國網友近日在論壇 Reddit 上發文，直言自己從小就注意到「一些年紀較大的中國人」有一種特殊的口臭味，帶點金屬感與灰塵味，「像是鐵鏽一樣」。讓他驚訝的是，自從一個月前搬到中國居住後，自己竟然也染上了這股怪味，而且氣味「像從喉嚨深處冒出來」，甚至連自己都能明顯嚐到那種「噁心的味道」。該網友表示，過去從來沒有口臭困擾，但來到中國後，卻出現從未經歷過的濃烈口氣，牙齦也有些疼痛，儘管每天認真刷牙、用牙線、抗菌漱口水樣樣不缺，卻仍難擺脫這股怪味。讓他懷疑是否與當地飲食或水源有關，甚至暫時戒掉豬肉以排除可能原因。請繼續往下閱讀...這篇貼文迅速引起熱議，大量網友留言表示「我知道你說的是什麼味道」、「我也遇過」、「真的聞過類似口氣」，不少人直言這種氣味在中國的公共場合如地鐵、公車上並不少見。其中最多人提出的可能原因，是亞洲地區常見的幽門螺旋桿菌（Helicobacter pylori）感染。有網友指出：「我懷疑這就是 H. pylori 的味道，很多人都有但不知道」、「如果你覺得味道是從喉嚨出來，又有牙齦不舒服，真的該去檢查」、「你既然在中國，就去大醫院檢查，這邊健檢又快又便宜」。除了懷疑是幽門螺旋桿菌感染外，也有網友提出另一種可能——扁桃腺結石（Tonsil Stones）。有留言指出，這種結石常卡在喉嚨深處的扁桃腺窩內，會散發出強烈異味，當事人自己也能在嘴裡「嚐」到金屬或腐敗味，與原PO描述的症狀相似。有經驗者建議，若口臭來自喉嚨、且伴隨異物感或咳嗽時偶爾吐出「白色小硬塊」，就很可能是扁桃腺結石，應盡快就醫檢查。熱門賽事、球星動態不漏接    ,https://news.ltn.com.tw/news/world/breakingnews/5193110
控美國拿濃縮鈾換豁免制裁3個月 伊朗回嗆：無法接受,國際,2025/09/27 17:38,針對延後恢復制裁伊朗的決議草案，聯合國安全理事會成員國26日進行表決。（路透）伊朗總統裴澤斯基安（Masoud Pezeshkian）27日表示，美國曾要求伊朗交出其所有濃縮鈾，以換取豁免制裁3個月，他斥美方此議「無法接受」。裴澤斯基安在準備返回德黑蘭前，於美國紐約告訴記者，美國「希望我們交出所有濃縮鈾，作為回報，他們（美國）會給我們豁免制裁3個月…這絕對令人無法接受。」請繼續往下閱讀...英法等國上月以伊朗違規為由，主張恢復聯合國對伊朗的制裁；26日，安理會表決中國與俄羅斯所提、主張延後恢復制裁伊朗的決議草案，但該草案最後並未過關，依規定聯合國將在27日恢復制裁伊朗；德黑蘭當局已放話，一切後果由西方承擔。熱門賽事、球星動態不漏接    ,https://news.ltn.com.tw/news/world/breakingnews/5193071
國際帕委會:俄羅斯與白俄羅斯選手 可參加明年冬季帕運,國際,2025/09/27 17:12,2024年9月2日，俄羅斯殘障游泳選手舒羅娃（左）在2024年巴黎帕運女子50公尺仰泳-S3決賽中拿下銀牌。（歐新社）國際帕拉林匹克委員會（IPC）27日決定，解除自2022年俄羅斯全面入侵烏克蘭以來，對俄羅斯以及白俄羅斯（雙俄）所實施的部分禁賽措施。這項在南韓首爾舉行的國際帕委會大會上所做的決定，為俄羅斯及白俄羅斯運動員代表國家，參加2026年義大利米蘭科爾蒂納冬季帕運，開闢道路。請繼續往下閱讀...不過，哪些國家能在冬季帕運的6個項目中比賽，決定權操在各項運動的國際總會（International Federation）手中；而這些運動項目的國際總會，迄今仍持續禁止俄羅斯及白俄羅斯選手參賽。國際帕委會在聲明中指出，該解禁決定意味，白俄羅斯與俄羅斯的國家帕委會，「如今恢復其身為國際帕委會成員的所有權利與特殊待遇」；國際帕委會將與雙俄的帕委會合作，盡快讓實際安排就位。俄羅斯帕委員對此表示歡迎，稱此決定「公正」，是運動員的權利應受到保護，不該因國家或政治理由遭到歧視的典範。國際帕委會在2023年的大會上，通過對雙俄選手實施部分禁賽，但若干雙俄選手仍得以「個人中立運動員」身分，參加2024年巴黎夏季帕運。8天前，國際奧林匹克委員會（IOC）批准雙俄運動員以中立身分，參加明年的米蘭科爾蒂納冬季帕運。熱門賽事、球星動態不漏接    ,https://news.ltn.com.tw/news/world/breakingnews/5193040
暗殺美國總統福特未遂 她出獄後95歲高齡過世,國際,2025/09/27 16:52,美國女子摩爾，於1975年9月22日暗殺福特總統未遂。（美聯社）1975年9月22日，美國第38任總統福特在加州舊金山聯合廣場飯店外朝民眾揮手致意時，遭到暗殺未遂，開槍的女嫌摩爾（Sara Jane Moore）當場被捕，她被判無期徒刑後於2007年12月31日假釋出獄，親友透露摩爾本月24日以95歲的高齡在田納西州療養院過世。據《美聯社》報導，摩爾1930年2月15日出生於西維吉尼亞州，1974年她進入為貧窮民眾提供食物的單位「People in Need」工作，該組織是富豪赫斯特（Randolph Hearst）所創立，他的女兒當時被美國激進共產團體共生解放軍（SLA）綁架，SLA要求赫斯特向加州窮人提供食物才會放人。使得赫斯特不得不聽從。請繼續往下閱讀...摩爾在People in Need上班期間，開始和左派、前科犯、舊金山反主流人士有了聯繫，並且成為了聯邦調查局（FBI）的線人。不過，在暗殺福特的4個月前，FBI終止了和摩爾的合作關係。1975年9月5日，邪教曼森家族（Manson Family）的女性成員弗洛姆（Squeaky Fromme），在加州沙加緬度持槍對準福特總統，還未擊發就被特勤人員奪下槍械。僅僅過了17天，同年9月22日摩爾就在加州舊金山朝福特總統開槍，所幸人群裡的33歲海陸退伍軍人西普爾（Oliver Sipple）將摩爾的手槍打落，使得子彈沒有打中福特。摩爾被捕後，聲稱自己是擔心FBI線人的身分會曝光並遭遇生命威脅，「如果政府要殺我，我就要用行動來發聲」，但時至今日就連辯護律師也不知道她的確切動機。摩爾入獄7年後，對於自己暗殺失敗仍感到相當可惜，不過，在2007年年底突然假釋前，她又改稱對自己的行為非常懊悔，出獄後她隱姓埋名在秘密地點生活。摩爾2009年接受舊金山電視台採訪時，指稱自己捲入了1970年代的激進政治運動，假如有機會和福特說話，她會告訴他很抱歉發生這樣的事，但福特已於2006年逝世。摩爾被判無期徒刑但已在2007年假釋，她本月以95歲的高齡過世。圖為摩爾2009年受訪。（美聯社）熱門賽事、球星動態不漏接    ,https://news.ltn.com.tw/news/world/breakingnews/5192975
解密：季辛吉1974年曾提誘共軍到釣魚台 最終作罷,國際,2025/09/27 16:20,根據解密的美國外交公文，中華人民共和國1974年1月實際掌控南海的西沙群島時，時任美國國務卿季辛吉曾詢問部屬能否引誘共軍到釣魚台（日本稱尖閣諸島），但後來作罷。（路透資料照）根據解密的美國外交公文，中華人民共和國1974年1月實際掌控南海的西沙群島時，時任美國國務卿季辛吉曾詢問部屬能否引誘共軍到釣魚台（日本稱尖閣諸島），但後來作罷。日本共同社今天報導，當時國務院的幹部持反對意見，因此這個的提議並未付諸實行。請繼續往下閱讀...報導指出，季辛吉（Henry Kissinger）當時可能不滿日本在美國之前，先於1972年9月與中華人民共和國建交，且警戒日本向北京靠攏，他可能希望藉此「敲打」日本。不過，不清楚具體的引誘方式。中華人民共和國1974年1月19日與當時的南越交戰，並在同月掌控西沙群島全境。根據解密的公文，季辛吉同月31日在國務院與部屬開會，討論因應南海局勢時表示，「能否引誘他們（中國）到尖閣諸島，這樣一來就能教導日本人信念（religion）」。當時負責東亞與太平洋事務的助理國務卿哈默（Arthur Hummel）則詢問季辛吉，「我理解我們需要教導日本人信念，但是值得做到這個份上嗎？」季辛吉則回答「沒有」，並打消這個念頭。當時在美國駐日本大使館擔任外交人員、後來又在1990年代擔任美國駐日大使館副館長的狄明（Rust Deming）告訴共同社，他認為季辛吉當時是覺得「日本應該承擔更多防衛領土的責任」。季辛吉於已故前總統尼克森（Richard Nixon）任內的1969年，被任命為國安顧問，1973年9月起身兼國務卿和國安顧問。尼克森1974年下台後，他仍繼續在已故前總統福特（Gerald Ford）政府身兼這兩個職位，直到1975年11月卸下國安顧問一職，不過他仍持續擔任國務卿直到1977年。季辛吉曾經參與冲繩回歸日本相關談判，以及參與處理釣魚台列嶼的決策。他一方面促成尼克森在1972年訪問北京，並推動美國與北京當局在1979年建交，另一方面則在紡織貿易問題上與日本立場相左，並與日本保持距離。季辛吉於2023年11月辭世，享壽100歲。熱門賽事、球星動態不漏接    ,https://news.ltn.com.tw/news/world/breakingnews/5192955
盧特尼克：川普不會忘記馬斯克離任時的「負面情緒」,國際,2025/09/27 15:48,川普（左）與馬斯克（右）近日在美國保守派政治網紅柯克告別式上短暫同席交談。（美聯社）美國總統川普與億萬富翁馬斯克分道揚鑣一事，迄今仍為外人津津樂道。美國商務部長盧特尼克在受訪時表示，川普總統不會忘記馬斯克在卸下政府職務之際表現出的「負面情緒」。盧特尼克在接受《國會山莊報》（The Hill）姊妹報《NewsNation》節目「Batya」訪問時，稱馬斯克是川普「在政府中最好的朋友」，並補充說，川普會「原諒」馬斯克卸下「政府效率部」（DOGE）職務時的動盪，但不會忘記當時他散發出的「負面情緒」。請繼續往下閱讀...盧特尼克說：「我認為馬斯克確實做到這一點，他贏得總統的友誼和欽佩，但在離任時，他表達出自己非常負面的一面，總統不會忘記這種負面情緒。」根據聯邦選舉委員會的文件，馬斯克和川普在川普2024年總統競選期間結成聯盟，馬斯克花費超過2.9億美元（逾88億台幣）來支持川普和其他共和黨候選人。兩人的關係促使馬斯克出任政府效率部負責人，該部門旨在減少聯邦政府機構的浪費、欺詐和濫用。但由於馬斯克在DOGE的職位，他與其他內閣成員之間的緊張關係最終為川普與馬斯克的關係蒙上一層陰影。今年5月，馬斯克辭去DOGE的職務，並在幾天內公開反對川普的稅收和支出法案，稱其「極度令人憎惡」。自此，兩人的關係公開惡化，馬斯克甚至聲稱川普的名字出現在已故淫魔艾普斯坦的文件中。盧特尼克表示，川普未來會對馬斯克「友善」，「（川普）會很友好，他會很友善，因為總統人非常好，但他會忘記嗎？我不這麼認為」。熱門賽事、球星動態不漏接    ,https://news.ltn.com.tw/news/world/breakingnews/5192941
10多天後才公開！中國紹興地鐵撞清潔工3死1傷 當地人驚：完全不知,國際,2025/09/27 15:35,中國浙江省紹興市地鐵列車，9月13日深夜撞擊清潔工釀3死1傷，但消息直到24日才對外公開。（圖擷自微博）中國浙江省紹興市地鐵列車，9月13日深夜11時30分許撞上清潔工，造成3死1傷慘劇，但消息直到24日才對外公開，當地人驚呼根本不知道發生如此重大的事故。據中國官媒《新華社》等媒體報導，發生事故的是紹興地鐵2號線，當時已過了末班車階段，有4名清潔工在穿越軌道時，被返廠檢修的列車撞上，除了導致3人死亡之外，還有1名傷者仍在治療中。請繼續往下閱讀...初步調查顯示，之所以會有這起意外，是因為清潔工未按照規定路徑行走，進入了列車行駛區域，紹興市軌道運輸集團坦承公司在安全管理方面存在疏失，會配合調查並對外公布結果。當地網友得知消息後，紛紛感到不可思議，有人直說「本紹興人今天才知道這件事，當地的媒體都沒報導」、「9月13日的事情，過了10多天才報出來」；還有網友感嘆這種事故離譜到匪夷所思了，需要多個環節都出現疏失才有可能發生。熱門賽事、球星動態不漏接    ,https://news.ltn.com.tw/news/world/breakingnews/5192903
不給面子！南韓總統李在明中秋禮盒 在二手平台被轉售,國際,2025/09/27 14:46,南韓總統李在明贈送的中秋禮盒，沒過幾天就被放在二手平台轉賣。（圖擷自南韓論壇DAUM）太不給面子了！南韓總統李在明辦公室，23日公布了送給傑出貢獻者、災難受害者家屬、工安事故遺屬、弱勢家庭的中秋禮盒，孰料沒過幾天就被放在二手平台轉賣。據《YTN》報導，李在明的中秋禮盒包含了2支手錶、8個道（行政區）的特產和國產米，但25日就有人轉售，在二手交易網站karrot（당근）開價35萬韓元（約新台幣7562元）。請繼續往下閱讀...賣家指出．光是用35萬韓元買到這2支手錶就非常划算了，更何況還有特產。若實際到karrot搜尋，可以看到目前仍然有人在賣李在明中秋禮盒，整盒價格在35萬韓元上下；也有只賣2支手錶的，售價為20萬韓元（約新台幣4320元）。目前在karrot還有人賣李在明中秋禮盒，整盒價格35萬韓元。（圖擷自karrot）也有只賣禮盒裡2支手錶的，售價為20萬韓元。（圖擷自karrot）熱門賽事、球星動態不漏接    ,https://news.ltn.com.tw/news/world/breakingnews/5192864
南韓官員暗示 美朝「不排除」APEC峰會期間會晤,國際,2025/09/27 14:43,川普與金正恩2019年6月在兩韓交界處板門店碰面。（路透資料照）《法新社》27日報導，南韓外交部一位官員表示，美國和北韓「不排除」在下月底在南韓舉行的亞太經濟合作會議（APEC）領袖峰會期間舉行會晤。據報導，自2019年美國總統川普與北韓領袖金正恩備受矚目的「川金會」破裂以來，華府與平壤的關係一直處於深度凍結狀態。自那以後，北韓多次宣稱自己是「不可逆轉的」核武國家，直到最近金正恩才表示願意重啟與華府的對話。請繼續往下閱讀...南韓外交部一位高階官員26日在紐約表示，美朝官員的會談可能在定於10月底在南韓慶州揭幕的APEC峰會期間舉行，「我們不能排除這種可能性」。不過，該官員沒有透露美朝會談可能在何處舉行，以及會談將採取何種形式。川普和金正恩先前曾在南北韓非軍事區（DMZ）板門店會面，川普在第一任期內曾三度會見金正恩，還曾公開表示兩人「墜入愛河」。但2019年越南河內峰會後，美朝關係一度陷入危機，雙方因平壤在核計畫上願意做出的讓步而破裂。上個月，川普表示希望再次與金正恩會面，可能在今年。北韓官媒近日引述金正恩的說法指出，他對川普有著「美好的回憶」，如果華府不再要求平壤放棄核武，他願意在未來進行會談。金正恩本月罕見地出訪北京，與中國國家主席習近平和俄羅斯總統普廷一同出席在北京舉行的盛大閱兵儀式。預計習近平也將出席APEC峰會。分析人士稱，在普廷和習近平的支持下，金正恩預計將在未來與川普的會談中擁有更大的影響力。哈佛大學亞洲中心訪問學者兼研究員李承鉉（Lee Seong-hyon，音譯）告訴法新社：「金正恩現在不再將自己定位為一個孤立的獨裁者，而是被兩個擁核大國支持的關鍵利益相關者。這大大提升他在未來任何（美朝）雙邊談判中的籌碼。」熱門賽事、球星動態不漏接    ,https://news.ltn.com.tw/news/world/breakingnews/5192852
美備妥軍事打擊委內瑞拉境內毒販方案 兩國正進行談判,國際,2025/09/27 14:40,川普（左）指控馬杜洛（右）與販毒集團勾結，但馬杜洛持續否認。（法新社）《美國國家廣播公司》（NBC）27日引述4名知情人士披露，美軍正在擬定針對委內瑞拉境內販毒份子的軍事打擊方案，可能在幾週內付諸行動，目前總統川普尚未下令，兩國正透過中東中間人進行談判。據報導，這4名知情人士中，有2人是熟悉軍事打擊計畫的美國官員，另2人則熟悉美委談判情況。對委內瑞拉境內進行軍事打擊，將是川普政府針對販毒目標的軍事行動及其對委內瑞拉政府立場的全面升級。請繼續往下閱讀...川普在「真實社群」發文表示，最近幾週，美軍襲擊至少3艘來自委內瑞拉的船隻，據稱這些船隻載有可能威脅美國人安全的販毒份子和毒品。儘管美方尚未提供證據證明這些船隻上都載有毒品，但多明尼加一名官員和美國駐多明尼加大使館一名官員表示，在一次襲擊後，水域中發現毒品。據了解，美國近期升級軍事行動的部分原因是，認為委內瑞拉總統馬杜洛沒有採取足夠措施阻止非法毒品外流。美方正在討論的計畫主要集中在對販毒集團成員、領導層及毒品實驗室進行無人機襲擊。白宮在被問及此事時，援引川普先前的聲明：「我們將拭目以待。委內瑞拉正在向我們派遣他們的幫派成員、毒販和毒品。這是不可接受的。」此外，一名知情官員表示，部分川普政府官員對美國軍事升級似乎並未削弱馬杜洛的權力或引發任何重大回應感到失望。白宮在打擊販毒船行動中面臨的阻力超乎預期，促使他們認真考慮下一步。美國和委內瑞拉目前正透過中東領袖作為中間人進行談判。一位高階政府官員稱，馬杜洛已與這些中間人談及他願意為繼續執政做出的讓步。川普則表明「準備動用美國的一切力量，阻止毒品湧入我國，並將肇事者繩之以法」。當被問及美國在委內瑞拉境內發動襲擊的可能性時，委內瑞拉政治分析家伊斯梅爾（Anibal Sanchez Ismayel）透過通訊軟體WhatsApp告訴NBC：「對委內瑞拉領土發動襲擊將產生一系列後果，從引發外交抗議，到加劇對通敵者的政治迫害，再到進一步團結委內瑞拉人。」美軍表示，最近已向加勒比海地區部署至少8艘艦艇，載有4000多名人員，並向波多黎各派遣F-35戰機。熟悉政府想法的消息人士表示，如果不考慮所有選項，就不可能把那麼多資源調到該地區。2020年，在川普第一個任期內，美國司法部以販毒罪起訴馬杜洛。川普政府指控馬杜洛與販毒集團合作，並稱這些集團向美國輸送古柯鹼、芬太尼和販毒人士。美國政府最近更將緝拿馬杜洛的懸賞金額提高到5000萬美元。委內瑞拉並非古柯鹼的主要生產國，但被認為是將毒品運往其他國家的主要出發地。川普政府官員並未排除這些軍事行動的另一個目的，即推動委內瑞拉政權更迭。NBC先前報導稱，一位知情人士透露，川普政府的目標是迫使馬杜洛做出草率的決定，最終可能導致他在沒有美國地面部隊介入的情況下被趕下台。美國國務卿魯比歐一直是支持委內瑞拉政權更迭的聲音之一。根據委內瑞拉政府在社群媒體上發布的消息，本月稍早，馬杜洛致函川普，希望開啟對話。白宮新聞秘書李威特證實川普收到這封信，但對此表示譴責，「坦白說，我認為馬杜洛在那封信中重複很多謊言，而且美國政府對委內瑞拉的立場沒有改變。我們認為馬杜洛政權是非法的，總統已明確表示，他願意採取一切必要手段，阻止致命毒品從委內瑞拉政權非法販運到美國」。☆少一份毒品就多一份健康，自由時報提醒您遠離毒品☆熱門賽事、球星動態不漏接    ,https://news.ltn.com.tw/news/world/breakingnews/5192876
南海雙標失效？菲越海軍高層會晤 齊心反制中國擴張,國際,2025/09/27 14:31,在南海緊張加劇之際，越南人民海軍司令陳清延（左）23日會見菲律賓海軍司令艾茲伯里塔塔（右）。雙方表示，彼此擁有共同利益，也面臨共同困難，將深化海上安全合作、推進國防關係。（圖：中央社 /菲律賓武裝部隊）面對中國在南海持續擴張，菲律賓與越南海軍23日在菲律賓海軍總部舉行高層會晤，深化雙邊防務合作，展現聯手捍衛區域海上安全的決心。根據《馬尼拉時報》報導，此次會晤凸顯兩國在中國「雙重標準」策略下，仍堅持加強海上合作。會晤中，菲律賓向越南人民海軍司令陳清延致敬，雙方討論國防合作與海上安全策略。陳清延表示：「我們是海上鄰國，距離很近。越交流越了解彼此。我們擁有共同利益，也面臨相同困難，必須攜手維護和平與穩定。」菲律賓海軍司令艾茲伯里塔（Jose Ma. Ambrosio Ezpeleta）也對雙方日益密切的夥伴關係表達感謝。請繼續往下閱讀...菲越海軍自2011年起保持互助紀錄，菲律賓曾救援23名越南漁民，越南則拯救60名菲律賓漁民。陳清延讚揚這是「非常好的成果和協調」。雙方也成功舉行第八屆菲律賓—越南人員交流活動，並同意未來定期會面，探討海軍對談與區域安全合作，持續深化國防、軍事關係。華府智庫「新美國安全中心」（CNAS）客座研究員葛羅斯曼（Derek Grossman）指出，中國在南海對菲律賓與越南採取「雙重標準」。菲律賓海域如黃岩島（Scarborough Shoal，菲稱馬辛洛克灘）頻遭中國水砲攻擊，但對越南在南沙群島填海造陸卻反應較緩。葛羅斯曼分析，主因在於菲律賓傾向與美國加強戰略聯盟抗衡中國，而越南則對北京態度較柔和，並維持多元外交政策。面對中國不顧國際法庭裁決持續在南海擴張，馬尼拉與河內當局推進國防合作，強化海上安全。雙方去年會面時，已同意深化國防、軍事關係，確保南海的「和平、穩定、安全及航行與飛越自由」。此次高層會晤進一步鞏固菲越聯手反制中國在南海的擴張行動，對維護區域穩定具有關鍵意義。熱門賽事、球星動態不漏接    ,https://news.ltn.com.tw/news/world/breakingnews/5192843
川普18歲孫女推自創服飾品牌 在白宮拍宣傳照,國際,2025/09/27 14:26,美國總統川普週五於白宮外受訪時，特別介紹身旁的18歲孫女凱伊；凱伊是川普長子小唐納的女兒，近期於社群媒體宣布推出自創服飾品牌，並穿著自家設計的服裝亮相，成為媒體焦點。（美聯社）美國總統川普週五於白宮外受訪時，特別介紹身旁的18歲孫女凱伊（Kai Trump）。凱伊是川普長子小唐納（Donald Trump Jr.）的女兒，近期於社群媒體宣布推出自創服飾品牌，並穿著自家設計的服裝亮相，成為媒體焦點。據《法新社》報導，川普當地時間26日受訪時向華盛頓記者團介紹說：「順便介紹一下，這是凱伊。」這名川普最年長的孫女去年曾在共和黨全代會短講，凱伊與川普同樣熱愛高爾夫，2人接受訪問後隨即登上直升機，一同前往觀賞萊德盃高爾夫球對抗賽。請繼續往下閱讀...凱伊預計明年將進入邁阿密大學高爾夫球校隊，同時也積極發展個人品牌。她於25日透過社群平台IG宣布推出自創服飾，主打每件約130美元（約新台幣3914元）的素面圓領毛衣，胸前繡上縮寫、袖口留有簽名字樣，官網宣傳照可見她身穿長袖運動衫，於白宮草坪擺拍。據悉，凱伊父母已離婚，外媒傳其母親正與高爾夫球傳奇人物老虎伍茲（Tiger Woods）交往。報導分析，與歷任政府官員不同，川普以銷售各類個人品牌商品聞名。這位億萬富豪經常被指控利其職位來促進川普家族的金融利益，尤其涉及房地產或加密貨幣領域。        在 Instagram 查看這則貼文            Kai Trump（@kaitrumpgolfer）分享的貼文Kai Trump（@kaitrumpgolfer）分享的貼文凱伊是川普長子小唐納的女兒，近期於社群媒體宣布推出自創服飾品牌。（圖擷自凱伊IG）熱門賽事、球星動態不漏接    ,https://news.ltn.com.tw/news/world/breakingnews/5192711
