Title,News_Type,date,content,url
緬甸國會30日啟動總統選舉程序 軍政府領導人幾篤定當選,國際,2026/03/20 16:12,緬甸軍政府領導人敏昂萊可望靠本月底的總統選舉洗白成為緬甸新總統。圖為敏昂萊今年1月25日視察曼德勒的國會大選投票所。（法新社）官員20日表示，緬甸國會將於本月30日開始選舉新總統的程序。分析家估計，2021年靠政變上台的緬甸軍政府領導人敏昂萊（Min Aung Hlaing），幾乎篤定成為緬甸新總統。緬甸在去年底與今年初舉行自2021年政變以來的首場國會大選，軍方支持的政黨毫無意外大獲全勝；而今充斥軍方人馬的新國會將啟動選舉新總統的程序，軍方以及國會上下兩院各提名1名總統候選人。請繼續往下閱讀...緬甸聯邦議會代表委員會（Pyidaungsu Hluttaw）的官員表示，3名候選人將先接受資格審查，然後由國會從中選出1人擔任總統，另外2人出任副總統。但官員並未說明候選人資格審查的過程要花多久時間，亦未透露何時舉行總統選舉。外界普遍認為，緬甸軍政府領導人敏昂萊，將藉選舉洗白成為緬甸新總統。常駐泰國的獨立分析家丁覺艾（Htin Kyaw Aye，譯音）說，緬甸憲法禁止公務員成為總統候選人，預料敏昂萊會在3月30日以請辭軍事首長一職；「既然敏昂萊想當總統，根據2008年憲法，他就得辭去現任的三軍統帥才有資格參選」。丁覺艾還說，自去年12月與今年1月的分階段國會大選後，緬甸軍方與親軍方的「聯邦團結發展黨」（Union Solidarity and Development Party）便持續把持緬甸政治…「這不是邁向民主的過渡期，而是緬甸軍事獨裁政權從軍裝獨裁轉為便服獨裁。」緬甸軍方在2021年初發動政變，推翻由緬甸民運領袖、諾貝爾和平獎得主翁山蘇姬領導的民選文人政府；軍事政變曾引發群眾抗議，並演變為蔓延全國的反軍政府武裝叛亂，緬甸此後便一直處於動盪中。    ,https://news.ltn.com.tw/news/world/breakingnews/5377059
中東戰火升級   沙國預測：若打到4月底油價上看180美元,國際,2026/03/20 16:07,波斯灣最大產油國沙烏地阿拉伯警告，如果伊朗戰爭持續打到4月下旬，油價可能漲至每桶180美元以上。（法新社）伊朗戰爭持續升級，波斯灣產油國的能源設施陸續遭到攻擊，導致全球油氣價格飆漲。波斯灣最大產油國沙烏地阿拉伯警告，如果伊朗戰爭持續打到4月下旬，油價可能漲至每桶180美元以上，打破2008年創下的每桶147.5美元前紀錄。《華爾街日報》報導，為報復以色列18日對伊朗南帕爾斯（South Pars）天然氣田的攻擊，伊朗攻擊卡達最大的拉斯拉凡（Ras Laffan）天然氣設施，並攻擊波斯灣其他國家的能源基礎設施，包括沙烏地阿拉伯延布（Yanbu）的煉油廠，延布位於紅海，是1條輸油管的終點站，該油管可將原油繞過荷姆茲海峽，從紅海進行運輸。請繼續往下閱讀...這些攻擊事件發生後，19日布蘭特原油期貨價格一度飆升至每桶119美元，之後才回落至108美元；該原油價格歷史最高紀錄為2008年創下的每桶147.5美元。19日西德州中級原油期貨價格漲至95美元。而根據普式能源（Platts）的數據，19日杜拜原油價格漲至每桶166美元，創下歷史最高紀錄。杜拜原油價格通常遭到忽視，但在伊朗戰爭持續延燒下，如今被視為油價可能走向的重要指標。摩根大通大宗商品研究主管卡內瓦（Natasha Kaneva）表示，杜拜和阿曼原油現貨價格反映了波斯灣原油嚴重短缺問題，但這不代表美國市場可以躲過另一波價格飆漲。卡內瓦指出：「如果荷姆茲海峽沒有重開，杜拜油價和布蘭特、西德州油價之間的差異不可能持續下去。布蘭特和西德州油價終將定的更高，因大西洋盆地的庫存已耗盡，全球市場被迫在更嚴重吃緊的供應水準進行結算。」    ,https://news.ltn.com.tw/news/world/breakingnews/5377070
後悔認識艾普斯坦！ 挪威王儲妃稱被操縱與欺騙,國際,2026/03/20 16:01,挪威王儲妃梅特瑪莉因與已故淫魔富豪艾普斯坦存在聯繫而深陷醜聞。（法新社）挪威王儲妃梅特瑪莉（Mette-Marit）今（20）日接受挪威公共廣播公司NRK採訪時表示，她後悔與已故淫魔富豪艾普斯坦（Jeffrey Epstein）的友誼，並聲稱自己被操控與欺騙。根據《路透》報導，美國司法部之前公布數百萬份艾普斯坦的文件，揭露他與包括挪威王儲妃、挪威高級政要在內的眾多知名人士存在密切聯繫，此事深深震驚世界。請繼續往下閱讀...其中部分文件揭示，在艾普斯坦2008年承認引誘未成年少女罪名成立後，梅特瑪莉從2011年到2014年一直與艾普斯坦保持聯繫，並在2013年的一次私人旅行中，在艾普斯坦位於美國佛州棕櫚灘的住所住了4天。梅特瑪莉20日指出，自己被艾普斯坦操縱與欺騙，還說希望從未認識他。梅特瑪莉補充，自己從未見過艾普斯坦任何違法行為。值得注意的是，在梅特瑪莉說為認識艾普斯坦而後悔之前，1項對1009名受訪者進行的調查顯示，挪威王室的支持率在近幾個月下降。根據挪威公共廣播公司NRK於2月21日公布的Norstat民意調查，約60%挪威人支持君主制，低於1月的70%；而27%的人支持共和制，高於同期的19%。    ,https://news.ltn.com.tw/news/world/breakingnews/5377005
以色列稱伊朗被打到無力 伊斯蘭革命衛隊：仍持續生產飛彈,國際,2026/03/20 15:57,以色列海法煉油廠19日據稱遭伊朗攻擊。（路透）伊朗伊斯蘭革命衛隊發言人奈尼（Ali Mohammad Naini）20日強調，儘管與以色列和美國交戰，伊朗仍在繼續生產飛彈，試圖反駁以色列總理納坦雅胡關於伊朗已無力製造飛彈的說法。《美聯社》及《法新社》報導，納坦雅胡19日才表示，在美以兩國強烈轟炸下，伊朗已不再具備鈾濃縮和製造彈道飛彈的能力，但奈尼翌日做出反駁，「我們的飛彈工業堪稱完美…在這方面無需擔憂，即使在戰時條件下，我們也在繼續生產飛彈」。請繼續往下閱讀...奈尼也強調，這場戰爭還會繼續，並稱伊朗民眾「希望戰爭持續下去，直到敵人徹底筋疲力盡。只有當戰爭的陰影從這個國家徹底消失時，這場戰爭才必須結束」。20日，美以與伊朗的戰爭仍在繼續，波斯灣鄰國也直接捲入衝突。清晨，阿拉伯聯合大公國杜拜上空發生劇烈爆炸，防空部隊攔截來襲的砲火。當時，人們正在慶祝開齋節，標誌著穆斯林齋月結束。巴林內政部也表示，20日上午，該國一個倉庫被飛彈碎片擊中後起火。科威特指出，他們正在努力攔截來襲的伊朗砲火。沙烏地阿拉伯則稱，擊落多架瞄準其石油資源豐富東部省份的伊朗無人機。同日，以色列空襲伊朗首都德黑蘭；在伊朗民眾慶祝波斯新年諾魯孜節之際，德黑蘭市內多處都能聽到空襲聲。以色列雖已承諾不再對伊朗一處重要的天然氣田發動攻擊，但伊朗持續對波斯灣周邊國家的石油和天然氣設施發動攻擊，導致數百萬人湧入避難所，並對全球經濟造成衝擊。    ,https://news.ltn.com.tw/news/world/breakingnews/5377046
澳總理出席開齋節禮拜 加薩戰爭立場引民眾噓聲抗議,國際,2026/03/20 15:47,澳洲總理艾班尼斯今天至全國最大清真寺參加開齋節禮拜，遭到抗議民眾質問並報以噓聲，對他在盟邦以色列進攻加薩走廊議題上的立場表達不滿。（歐新社）澳洲總理艾班尼斯今天至全國最大清真寺參加開齋節禮拜時，遭到抗議民眾質問並報以噓聲，對他在盟邦以色列進攻加薩走廊議題上的立場表達不滿。路透報導，自加薩戰爭爆發以來，澳洲中左派政府審慎維持平衡，既對巴勒斯坦人表達關切並多次呼籲停火，同時也支持以色列自衛權，引發澳洲穆斯林和猶太社群部分人士不滿。請繼續往下閱讀...現場影像顯示，艾班尼斯（Anthony Albanese）與澳洲內政部長柏克（Tony Burke）抵達雪梨西區拉肯巴清真寺（Lakemba Mosque），與穆斯林民眾一同參與慶祝齋戒月（Ramadan）結束的儀式時，活動遭抗議者打斷。示威者發出噓聲，要求艾班尼斯和柏克「出去」，並稱他們是「種族滅絕支持者」。抗議人士指控，巴勒斯坦武裝組織哈瑪斯（Hamas）2023年襲擊以色列後，以軍在加薩走廊（Gaza Strip）殺害許多巴勒斯坦人。其中一位主辦人勸說群眾：「親愛的兄弟姊妹，請稍微冷靜下來。今天是開齋節，是充滿喜悅的日子。」此人呼籲大家坐下並停止拍攝衝突場面。現場可見一名保全將起鬨者壓制在地，隨後把他帶離現場。艾班尼斯和柏克離開時，有抗議者尾隨並高喊：「你們真丟臉！」儘管出現這段插曲，艾班尼斯稍後表示，這場在清真寺舉行的活動「非常正面」。他補充道，有些不滿情緒來自政府本月依法將伊斯蘭組織「解放黨」（Hizb Ut-Tahrir）列為被禁止的仇恨團體。當局援引的法律，是因應雪梨邦代海灘（Bondi Beach）去年12月14日的致命大規模槍擊案所制定。    ,https://news.ltn.com.tw/news/world/breakingnews/5377028
川普驚人語錄+1！拿《珍珠港》開玩笑 粉專：世界級地獄梗誕生,國際,2026/03/20 15:35,川普被記者詢問美國在攻打伊朗前，為何未事先知會日本等盟友回應表示，這是為達到出其不意的效果，並當場大開「珍珠港事件」玩笑稱「誰比日本更了解奇襲」。（圖擷取自臉書粉專「姆士捲」）日本首相高市早苗19日訪問白宮，受到美國總統川普熱情款待。川普被記者詢問美國在攻打伊朗前，為何未事先知會日本等盟友回應表示，這是為達到出其不意的效果，並當場大開「珍珠港事件」玩笑稱「誰比日本更了解奇襲」，使高市一度尷尬。對此，臉書粉專「姆士捲」揶揄，這簡直是「世界級地獄梗」。粉專「姆士捲」今發文指出，記者問到為什麼攻打伊朗時沒有通知日本？川普回答「日本攻擊珍珠港時也沒有通知我們啊」。請繼續往下閱讀...「姆士捲」笑說，「一個世界級地獄梗就此誕生了」、「驚不驚喜，意不意外」。網友看到貼文後紛紛留言，有人說「川普真的很會嘴人耶，不愧是吵架王」、「這真的瘋狂到以為是AI」、「這個老灰仔啊，不會聊天，把天聊死了啦」。川普受訪影片點此高市早苗被「突襲」！川普引「一事件」為攻伊辯護遭川普「珍珠港事件」殺球日記者被罵爆 「日本之恥」躍社群熱門關鍵字日本首相高市早苗19日訪問白宮，受到美國總統川普熱情款待。（美聯社）    ,https://news.ltn.com.tw/news/world/breakingnews/5376755
川普深陷伊朗危機延後訪中 《法新社》：北京恐掌握更多關稅談判籌碼,國際,2026/03/20 15:34,川普為了監督伊朗戰事，已延後訪中會晤習近平的行程。（法新社）美國總統川普深陷伊朗戰事混亂局面，促使他延後訪問中國行程。《法新社》20日分析，川普地位的削弱可能會讓北京更有本錢要求更大幅度的關稅削減，並限制華府在其他貿易問題－例如關鍵礦產的獲取－方面推動變革的能力。川普上月底決定與以色列聯手打擊伊朗，此舉使中東陷入暴力衝突，推高能源價格至多年來的最高點，並引發外界對全球能源供應短缺的擔憂。川普難以界定這項軍事行動將如何結束，而傳統盟友也不願支持他，但他或許需要一場外交勝利才能與中國國家主席習近平會晤。請繼續往下閱讀...國際危機組織（ICG）美中關係專家韋恩（Ali Wyne）表示，美國攻打伊朗的本意是要嚇阻北京，「結果適得其反，戳破美國無所不能的幻象」。他說，華府無力獨自重新開放遭伊朗封鎖的荷姆茲海峽，如今需要主要戰略競爭對手的幫助，才能應對這場危機。川普原本預計本月底訪中，但他證實將延後5到6週成行。這次峰會的目標是正式落實川普和習近平去年10月在南韓會晤時達成的關稅休戰協定，但川普地位的削弱可能會讓北京更有本錢要求更大幅度的關稅削減，並限制華府在其他貿易問題－例如關鍵礦產的獲取－上推動變革的能力。風險諮詢公司「歐亞集團」（Eurasia Group）中國團隊主任王丹表示，由於多年來在貿易、技術和權利問題上的爭端，美中雙邊互信度低下，因此在貿易方面取得重大突破的可能性「似乎有限」。美國對包括中國在內的60個經濟體的過剩工業產能展開新的貿易調查，也激怒北京。分析人士指出，隨著貿易戰持續，習近平將受益於對川普更大的戰略影響力，至少在短期內是如此。迄今為止，北京一直無視川普關於重新開放荷姆茲海峽的呼籲，也沒有放鬆對稀土出口的嚴格控制。稀土產業由中國主導，並為美國武器製造提供某些關鍵礦物。新加坡國立大學東亞研究所訪問資深研究員諸葛森（Jason Bedford）表示，美軍對某些「重」稀土的需求遠遠超過商業需求，這些武器被用於無人機、戰機、飛彈導引系統和雷達等設備。雖然美國軍火庫的規模是「嚴守的秘密」，但從理論上看，中國完全有能力阻止美國生產新的武器。王丹表示，雙方在荷姆茲海峽和稀土問題上沒有達成任何協議，這表明先前的貿易談判「沒有任何實質成果」。她說，習近平和川普今年還有其他會面機會，但除了降低關稅之外，取得突破的可能性似乎有限。在大多數美國人反對在中東採取軍事行動之際，中國也可能調整其行動，以削弱川普在國內的地位。上海復旦大學美國研究中心主任吳心伯表示，川普及其談判代表「希望中國購買美國農產品，這對共和黨的國會期中選舉至關重要」。如果川普政府不能穩定與中國的關係，就必須面對一些重大挑戰。川普政府19日宣布，正在考慮放鬆針對伊朗石油的部分制裁，以遏止油價上漲，此舉可能有利於中國。華盛頓近東政策研究所中國問題專家圖根哈特（Henry Tugendhat）表示，中國被認為是受制裁伊朗石油的主要買家，是德黑蘭的「主要經濟生命線」。他說，只要美國繼續向台灣提供武器，北京就沒有動力停止向伊朗出售武器。    ,https://news.ltn.com.tw/news/world/breakingnews/5376956
金主愛試駕新型戰車 接班北韓可能性上升,國際,2026/03/20 15:18,北韓領導人金正恩及其女兒金主愛在19日的大規模軍事演習中試駕新型主戰車。（歐新社）北韓官媒《朝中社》今（20）日稱，北韓領導人金正恩及其女兒金主愛19日在大規模軍事演習中試駕新型主戰戰車。《法新社》認為，這表明金主愛正在被培養成金正恩接班人。根據《法新社》報導，《朝中社》表示平壤第60訓練基地19日進行演習，裝甲部隊在演習中發射反坦克飛彈，後方分隊則攻擊模擬敵方無人機和直升機，為步兵和戰車開闢道路。請繼續往下閱讀...《朝中社》指出，金正恩與金主愛在演習中試駕戰車，並分享相關照片。照片顯示，金正恩愉悅地坐在行駛的戰車上，金主愛則從戰車艙口探出頭來。《朝中社》強調，該戰車擁有先進的機動性、火力以及包括飛彈和無人機防禦系統在內的先進防禦能力。《朝中社》聲稱，金正恩還興致勃勃地看戰車猛烈衝鋒，並表示戰車氣勢磅礴向前推進的壯觀景象，充分展現了北韓軍隊固有的勇氣和膽識。值得注意的是，南韓國家情報院2月就表示，據信年僅10幾歲的金主愛已被明確「指定為」接班人。而金主愛近期一系列高調亮相，包括上週試射手槍和上週末觀看核彈頭火箭炮實驗都強化此看法。    ,https://news.ltn.com.tw/news/world/breakingnews/5376936
中共中紀委公布  重慶市長胡衡華涉嚴重違紀違法被查,國際,2026/03/20 14:56,中共中央紀委國家監委網站今天公布，重慶市長胡衡華涉嫌嚴重違紀違法，正在接受調查。（中新社）中共中央紀委國家監委網站今天公布，重慶市委副書記、市長胡衡華涉嫌嚴重違紀違法，目前正接受中央紀委國家監委紀律審查和監察調查。中國內外網路社群近日流傳，胡衡華17日被帶走調查，18日缺席中共重慶市委理論學習中心組舉行的專題學習會，19日缺席重慶的義務植樹活動。當時網路流傳，胡衡華被帶走調查可能涉及湖南的貪腐案。請繼續往下閱讀...在重慶市人民政府官網上，目前市長仍是胡衡華。胡衡華1963年出生，湖南衡陽人，工商管理碩士，現任中共20屆中央委員，長年在湖南工作。胡衡華據指是今年3月首名落馬的正部級高官。    ,https://news.ltn.com.tw/news/world/breakingnews/5376960
自由觀點》日本南鳥島放核廢料  台灣重啟核電利多,國際,2026/03/20 14:30,    ,https://news.ltn.com.tw/news/world/breakingnews/5376133
怕美國動武接管格陵蘭 丹麥備戰：運血袋、擬炸機場,國際,2026/03/20 14:12,美國總統川普。（美聯社）美國總統川普頻揚言要控制丹麥的海外自治領地格陵蘭，北歐各國已加強合作。外媒披露，丹麥政府一度高度警戒，曾經做好最壞的情況下，會運送血袋與炸藥至格陵蘭，在必要時炸毀機場跑道，以阻止美軍降落與部署兵力。綜合外媒報導，川普在今年初再度強調格陵蘭對美國國安的重要性，並在美軍對委內瑞拉展開行動後，讓哥本哈根當局高度警覺，開始認真評估「美國入侵」的可能性，丹麥當局隨即調動軍力，將士兵與物資空運至格陵蘭首府努克（Nuuk）及重要機場所在地康克魯斯瓦格（Kangerlussuaq）。請繼續往下閱讀...消息人士指出，丹麥軍方攜帶爆裂物，準備在必要時摧毀跑道以阻止美軍飛機降落，同時也從國內血庫運送醫療用血，因應可能爆發的衝突傷患。該行動僅限少數高層知情，顯示情勢敏感程度極高。此外，丹麥也緊急與法國、德國及北歐國家進行密集磋商，尋求政治與軍事支援。隨後，由丹麥、法國、德國、挪威與瑞典組成的小規模聯合部隊進駐格陵蘭，後續更增派精銳部隊，並出動戰機與法國軍艦前往北大西洋。對外則以「北極耐力行動」（Operation Arctic Endurance）聯合軍演作為掩護。知情人士指出，部署多國部隊的目的是提高任何潛在軍事行動的政治與軍事成本，迫使美方若採取行動，將等同對多個歐洲國家採取敵對行為。一名丹麥國防消息人士坦言：「我們自1940年以來，從未面臨過這樣的局勢。」儘管丹麥與美國同為北約盟國，但格陵蘭議題已讓雙方與歐洲盟友關係出現裂痕。川普過去多次表達希望將格陵蘭納入美國版圖，格陵蘭與丹麥政府則一再拒絕。格陵蘭具高度自治地位，卻隸屬丹麥王國，其戰略位置與資源價值備受關注。目前，美方已改口表示希望透過談判解決爭議，為緊張局勢降溫，美國總統川普2月22日聲稱將派遣醫療船前往格陵蘭協助照顧病患，丹麥國防部長回應說，格陵蘭不需要多餘幫助，島上已有完善醫療體系。分析指出，川普對格陵蘭的行為、態度凸顯歐洲對自身安全的焦慮升高，也讓各國更加意識到，在面對不確定的國際局勢時，必須具備獨立應對危機的能力。    ,https://news.ltn.com.tw/news/world/breakingnews/5376837
川普證實五角大廈提6.4兆國防預算 稱「可2秒內」結束伊朗戰爭,國際,2026/03/20 13:50,五角大廈被爆將向國會提出超過2000億美元的撥款申請以支持伊朗戰爭，美國總統川普（圖右）在與日本首相高市早苗（圖左）會談後聲稱，這項請求是必要的，不過他也強調這筆預算有諸多用途、不僅限於伊朗問題。（彭博）中東戰事不斷升溫，五角大廈被爆將向國會提出超過2000億美元（約新台幣6.4兆元）的撥款申請以支持伊朗戰爭，對此美國總統川普在白宮與日本首相高市早苗會談後聲稱，這項請求是必要的，他也強調這筆預算有諸多用途、不僅限於伊朗問題，同時還稱當今世界局勢非常動盪，但如果你願意，還是可以在2秒鐘內結束這場戰爭。綜合外媒報導，美國總統川普19日在白宮會見來訪的日本首相高市早苗，在會後川普於回應記者提問時，證實五角大廈確實在申請資金，但他強調提出該項請求有許多原因，並不僅限於針對伊朗問題。請繼續往下閱讀...川普也提及前一任總統拜登，並稱美國需要大量的彈藥，但是因為向烏克蘭提供了太多，彈藥儲備就減少了。似乎想將增加軍事開支歸咎於拜登以及對烏克蘭的支持川普也稱，當今世界局勢非常動盪，但如果你願意，還是可以在2秒鐘內結束這場戰爭，只是「我們正非常謹慎地行事」。而在被問到是否會使用地面部隊時，川普稱他不會在任何地方部署軍隊，但又說「如果我要這麼做，我肯定不會告訴你」。外媒分析，川普的說法企圖淡化伊朗戰事對美國軍事物資造成的損失，也對伊朗的計畫含糊其辭。《紐約時報》更指，川普的說法雖企圖安撫民眾，但美國政府釋放出的信號表明，他們正準備打一場持久戰。    ,https://news.ltn.com.tw/news/world/breakingnews/5376719
川普提「珍珠港事件」再補刀問「好還壞記者」 外相反應全場笑翻影片曝,國際,2026/03/20 13:32,日本首相高市早苗、美國總統川普。（彭博）美國總統川普19日在白宮會見來訪的日本首相高市早苗。川普被日本記者千千岩森生問及為何美國在攻打伊朗前，未事先知會日本等盟友時表示，這是為了達到出其不意的效果，他還提及珍珠港事件，並稱「誰比日本更了解奇襲」，讓一旁的高市滿臉尷尬，川普接著補刀詢問日本外務大臣茂木敏充，千千岩森生是好記者還是壞記者，結果被回答「So So」。日本首相高市早苗19日訪問白宮，受到美國總統川普熱情款待，兩人在雙邊會前接受媒體提問。川普被日本記者千千岩森生問及為何美國為何在攻打伊朗前，未事先知會日本等盟友，川普回應表示，「我們沒告訴任何人，因為要的就是出其不意」。請繼續往下閱讀...川普話鋒一轉詢問高市早苗「他看起來像是你們國家的人，他是好記者還是壞記者？」高市尷尬不語，日本外務大臣茂木敏充趕緊救場「So So」眾人才哄堂大笑，緩解了現場尷尬的氣氛。川普補刀影片    ,https://news.ltn.com.tw/news/world/breakingnews/5376728
