Title,News_Type,date,content,url
軍購案藍營意見分歧 黨團大會仍無共識,政治,2026/05/05 10:39,國民黨團總召傅崐萁（左）受訪。（記者陳逸寬攝）國民黨內對軍購案金額意見分歧，國民黨團今日再召開黨團大會，藍委們討論約40分鐘後散會，仍無共識。國民黨團總召傅崐萁表示，各式各樣版本都有，大家還在努力討論中，怎麼樣能守護台灣，有一線的武器來台，把防弊的問題做好，這是大家共同在商議的問題，並不是所謂金額的問題，只要能好好保護台灣，大家都願意支持國防守護中華民國。國民黨內支持8000億元與支持黨版「3800億元＋N」的立委意見紛歧，國民黨主席鄭麗文堅持黨版，但支持8000億元的藍委占多數，黨團大會今日召開黨團大會，藍委賴士葆等人原本要提出「3800億元＋N」等於8000億元的版本，但眾人討論約40分鐘後散會，仍無共識。請繼續往下閱讀...傅崐萁說，各種版本最大的共識是一定要有發價書，來自美國官方同意賣來台灣，需要後續的維修、相關零件長久，不像商售後面會弊端叢生，對於品項、數量、價格、性能等能充分了解，這才是國會議員應該把關的。國民黨立委賴士葆。（記者陳逸寬攝）    ,https://news.ltn.com.tw/news/politics/breakingnews/5425672
基市新增副市長由秘書長方定安宣誓就職 謝國樑身體不適缺席,政治,2026/05/05 10:37,基隆市政府今天（5日）舉行新任首長宣誓典禮，圖由右至左依序為都發處長張書維、秘書長謝孝昆、副市長方定安、副秘書長陳耀川、法制處長劉邦繡。（記者俞肇福攝）基隆市政府今天（5日）舉行新任首長宣誓就職典禮。包含原秘書長方定安接任基隆市第2位副市長、原都市發展處長謝孝昆接任秘書長、原交通處長陳耀川接任副秘書長、都市發展處長由原副處長張書維接任，以及新成立的法制及勞動處長劉邦繡，5人皆於今日正式宣誓就職。值得注意的是基隆市長謝國樑缺席，創下首次副市長等首長宣誓就職，市長卻不在的紀錄。據了解，謝國樑生病身體不適，今天請假。基隆市副市長方定安，具備深厚的都市計畫與建築專業。方定安為成功大學都市計畫學士、碩士及文化大學建築博士，曾任台北市都市更新處處長、台北市政府都市發展局副局長等職務。請繼續往下閱讀...新任秘書長謝孝昆，國立台北大學都市計劃碩士學位、新加坡國立大學公共行政與管理碩士，曾任台北市政府都發局要職及基隆市政府都發處長，是兼具在地實務與國際思維的跨界人才。副秘書長由歷任市府工務處長及交通處處長職務的陳耀川接任，都市發展處長則交棒給曾任職台北市政府都市發展局正工程司的原副處長張書維。此外，基隆市政府 5 月新成立的「法制及勞動處」，特別禮聘具備深厚司法實務與學術權威的劉邦繡擔任首任處長。基隆市政府指出，為因應地方事務日益繁雜並強化市政運作，市府日前推動《基隆市政府組織自治條例》修正，增置第2位副市長與副秘書長各1名，並新設「法制及勞動處」以強化國家賠償機制及保護勞工權益。基隆市政府新市府團隊，圖由左至右依序為都發處長張書維、秘書長謝孝昆、副市長方定安、副市長邱佩琳、副秘書長陳耀川、法制處長劉邦繡。（記者俞肇福攝）    ,https://news.ltn.com.tw/news/politics/breakingnews/5425682
應對「安鼠之亂」毫無頭緒 詹凌瑀：蔣萬安的無能原形畢露,政治,2026/05/05 10:35,"詹凌瑀今表示「誰能想像得到，原本毫無瑕疵的蔣公子，竟被老鼠打回原型！」（資料照）台北市近期陷入「安鼠之亂」，惹得台北市民怨四起，台北市長蔣萬安的城市治理能力也備受考驗。媒體人詹凌瑀今（5日）表示：「誰能想像得到，原本毫無瑕疵的蔣公子，竟被老鼠打回原型！」詹凌瑀指出，蔣萬安原本形象好、連任勝算幾乎百分百，甚至是國民黨的未來新共主，結果沒想到一場「安鼠之亂」讓他的無能原形畢露。詹表示，台北市早在半年多前就出現老鼠橫行的情況，結果一直要到有人死亡才願意面對，處理方式又極為粗糙，大量在公園四處投藥，完全不顧其他動物可能誤食的後果。請繼續往下閱讀...詹凌瑀強調，蔣萬安至今也無法對於處理鼠患有一套完整的論述或解決步驟，只能不斷跳針「中央」、「謝謝」，讓人不禁懷疑，這個市長到底可以做什麼？詹凌瑀續指，現在國民黨台北市議員甚至為了「護蔣」，說鼠患是民進黨刻意炒作，還有藍營媒體說是「南鼠北送」，如此不負責任的說法，無法替蔣萬安洗白，只會讓市民更憤怒。    ",https://news.ltn.com.tw/news/politics/breakingnews/5425571
林亮君反應鼠患遭圍剿 張之豪轟蔣萬安：只會鬥政敵對鼠患束手無策,政治,2026/05/05 10:32,台北市長蔣萬安。（資料照）民進黨籍議員林亮君質疑北市府投藥方式恐致孩童與寵物誤食，卻遭控「自導自演」誘導市府投藥。民進黨基隆市議員張之豪痛批，台北市長蔣萬安面對市民生活環境惡化束手無策，卻只會集結政治力量圍剿提出問題的政敵，對藍白陣營而言，鼠患最麻煩的地方在於老鼠「不看中天新聞，也不看LINE群組」，若不確實剿鼠，鼠輩只會繼續在台北市肆虐。張之豪回憶，他3日帶著孩子經過台北市某公園，原想讓小孩下車玩耍，卻赫然發現溜滑梯上滿是排泄物。他憂心地指出，若是鴿子屎恐含腦膜炎病毒，若是老鼠屎則有傳染漢他病毒的風險，身為父母絕對無法容忍，最終只能無奈帶孩子離開。他感嘆，「鼠患橫行，這就是台北市的現況」。請繼續往下閱讀...針對近期藍白陣營聯手攻擊議員林亮君，甚至打著「應還基層公道」的口號，張之豪砲轟這是在「扯淡」。他認為市長無能卻拿基層員工當擋箭牌，林亮君將選區內嚴重的鼠患反映給市府，結果市府竟直接投老鼠藥到公園草叢，無論是小孩或寵物都極易接觸。面對林亮君質疑是否有更安全的放置方式？蔣市府的反應卻是透過放新聞、鋪天蓋地來打林亮君。張之豪酸說，面對政敵時「萬安很會」，但「面對攻擊老鼠，束手無策」。    ,https://news.ltn.com.tw/news/politics/breakingnews/5425591
比利時眾議員訪台盼增進對印太情勢瞭解 將拜會立法院、參訪國防產業,政治,2026/05/05 10:28,外交部次長吳志中（左）與比利時聯邦眾議院請願委員會副主席孔帕尼（右）合影。（圖由外交部提供）外交部次長吳志中昨（4）日午宴歡迎比利時聯邦眾院議員團一行6人。團長比利時眾議院請願委員會副主席孔帕尼（Pierre Kompany）表示，訪團關注人權、交通及移民等議題，盼此行能增進訪團成員對台灣與印太情勢的瞭解。訪團將拜會立法院、國安會、國內主要政黨國際事務部、赴台中參訪我國防產業。吳志中於致詞中表示，台灣與比利時是理念相近的夥伴，雙邊在半導體供應鏈、離岸風電及醫藥衛生等領域已有堅實合作基礎。請繼續往下閱讀...吳志中也表示，感謝比利時聯邦眾議院長期對台灣的支持，並盼未來在既有基礎上，持續拓展多元領域的合作。訪團團長比利時眾議院請願委員會副主席孔帕尼代表全體團員致詞表示，訪團成員來自比利時不同大區且關注人權、交通及移民等不同議題，盼此行能增進訪團成員對台灣與印太情勢的瞭解。外交部說明，本次訪團成員包含比利時聯邦眾議員戴蒙（Franky Demon）、藍布赫（Annick Lambrecht）、崔夢（Lieve Truyman）及凡潤柏（Kristien Van Vaerenbergh）及孔帕尼議員國會助理林登雅特（Isabelle Verlinden Jarbath）等；訪團在台期間將拜會立法院、國安會、監察院國家人權委員會、陸委會、經濟部國貿署及我國主要政黨國際事務部，並與智庫學者就反制外來資訊操弄及干預（FIMI）、國防整備、中國政軍發展等議題進行座談，另赴台中參訪我國防產業。外交部次長吳志中（右七）和比利時聯邦眾議院議員團團長孔帕尼（右八）等與宴貴賓合影。（圖由外交部提供）    ,https://news.ltn.com.tw/news/politics/breakingnews/5425654
無黨縣長參選人許智富 提政見剷除銀合歡還給澎湖乾淨土地,政治,2026/05/05 10:27,無黨澎湖縣長參選人許智富，提出剷除銀合歡政策。（許智富提供）澎湖群島因地勢平坦，年蒸發量大於降雨量，導致植樹不易，日治時期引進耐旱抗風銀合歡，當作柴火來源，卻因青壯人口大量外移，良田荒廢被銀合歡盤據，由於銀合歡繁殖力強，成為澎湖強勢外來種。澎湖縣長無黨參選人許智富，提出剷除銀合歡還給澎湖乾淨土政見。銀合歡為外來入侵植物，繁殖力強、再生能力高，長期影響澎湖生態與景觀。由於過去治理成效有限，關鍵在於缺乏持續管理與制度化的作法。許智富表示，未來澎湖縣政府應建立完整治理機制，做到一次有效剷除、後續長期控管，從根本解決問題。請繼續往下閱讀...由於銀合歡林在澎湖群島處處可見，遍及5鄉1市、大小島嶼。澎湖縣政府將以各鄉市公所為申請窗口，民眾如為私人土地，只需檢附地主同意書即可申請納入剷除作業。為防止藉機關代處理之便，於清除整理後在規範時效內，若地主需自行運用，澎湖縣府將酌收代整理費用以符社會公平正義原則，避免重蹈當年「青青草園」覆轍。另全縣將由澎湖縣政府成立「銀合歡剷除小組」，編列預算添購專業機具，培訓專責人員，統一調度執行，並於開花結籽前完成剷除，降低擴散風險。剷除後之枝幹將集中曬乾與破碎處理，並評估作為再生資源利用；土地覆蓋黑網抑制再生，搭配定期巡查與補除機制，必要時導入適合澎湖環境之原生或耐旱植栽，逐步恢復土地健康，打造永續生態環境。銀合歡為外來強勢種，澎湖文創希望化廢為寶。（記者劉禹慶攝）    ,https://news.ltn.com.tw/news/politics/breakingnews/5425657
墨鏡一戴帥度開外掛！賴清德訪史瓦帝尼掀「同款追問潮」,政治,2026/05/05 10:21,賴清德出訪史瓦帝尼墨鏡造型。（擷自賴清德臉書）總統賴清德成功出訪非洲唯一邦交國史瓦帝尼，不只外交成果受關注，連造型細節也意外成為話題焦點，戴上墨鏡亮相，畫面一出立刻被網友瘋傳，直呼「帥氣出手」、「總統也太潮了」。台南自1970年代以「眼鏡窟」聞名，曾是太陽眼鏡重要生產基地，產業轉型後由代工邁向品牌與研發，持續展現競爭力，已由製造重鎮升級為品牌與技術並進的創新基地。請繼續往下閱讀...例如安定區1家為專業運動太陽眼鏡品牌，結合輕量與高防護設計，並設立全台首座眼鏡觀光工廠，推廣產業文化；安南區另1家品牌則聚焦亞洲臉型，強調貼合與舒適，產品全數台灣設計製造，應用於自行車、跑步等運動。過去形象多以親民、穩重為主的賴清德，鮮少以墨鏡造型公開露面，這回在史瓦帝尼行程中一戴上，瞬間多了幾分俐落與自信感，不少「德粉」直呼反差魅力十足，甚至在社群平台敲碗：「到底哪裡買？什麼品牌？是不是台南帶去的？」對於這股「墨鏡旋風」，台南地方友人也幽默回應：「等他回來再問他啦！」一句話讓討論更添趣味。事實上，政治人物的穿搭常在無形中傳遞形象訊號，這次賴清德的「墨鏡時刻」，不僅讓外交行程多了點輕鬆話題，也拉近與年輕族群的距離。總統賴清德罕見潮帥亮相，引發「德粉」熱議。（擷自賴清德臉書）    ,https://news.ltn.com.tw/news/politics/breakingnews/5425653
賴總統怎麼從史瓦帝尼回來？逾萬人關注這班機,政治,2026/05/05 10:20,今上午8點多該班機已來到菲律賓上空，觀看人數已超過3500人，並成為目前追蹤度第1高的航班。（圖擷自Flightradar24）首次上稿 05-05 07:59更新時間 05-05 10:20總統賴清德上週六突破中國封鎖，搭乘史瓦帝尼專機前往非洲友邦史瓦帝尼展開國是訪問，外媒昨晚引述消息稱賴總統已結束訪問並搭乘專機離境，在網路上則有許多網友關注一架空巴A340的班機，到今上午10點已進入台灣本島領空，追蹤人數更逾1萬人，是此刻全球追蹤人數最多的航班。請繼續往下閱讀...總統賴清德原訂上月出訪友邦史瓦帝尼，卻因非預期外力暫緩，不過本月2日他突破中國封鎖成功出訪史瓦帝尼，外媒也盛讚，受中國打壓和爭取國際認同的台灣，在這場意志較量中出奇制勝。《法新社》昨晚引述機場消息人士報導，賴總統已結束訪問，稍早搭乘國王專機離境。外界推估賴總統將於今日上午返抵國門，不過相關細節府方尚未證實。在賴總統傳出已離開史瓦帝尼後，網路上也傳出他所搭乘的是一架空巴A340機型的班機，該班機在航班追蹤網站Flightradar24於清晨成為全球追蹤度第6高的航班，到今上午7點多該班機已位於婆羅洲上空，7點45分時則有超過2000人持續關注其動向，並躍升為全球追蹤度第4高的航班。透過航班路徑追蹤也可看到，該班機從史瓦帝尼離境後繞過了馬達加斯加飛航情報區，一路往東南方移動，沿著印度洋南側飛行，在通過法國位於印度洋的海外領地凱爾蓋朗群島北側上空後，才開始轉向東北飛行。史瓦帝尼國王恩史瓦帝三世的專機是空中巴士A340機型，原來是華航的客機，2001年交機，機號B-18802，2015年自華航退役，2016年以約1200萬美元賣給史瓦帝尼。外媒昨晚引述消息稱賴總統已結束訪問並搭乘專機離境，在網路上則有許多網友關注一架空巴A340的班機。（圖擷自Flightradar24）透過航班路徑追蹤也可看到，該班機從史瓦帝尼離境後繞過了馬達加斯加飛航情報區，一路往東南方移動，沿著印度洋南側飛行，在通過法國位於印度洋的海外領地凱爾蓋朗群島北側上空後，才開始轉向東北飛行。（圖擷自Flightradar24）    ,https://news.ltn.com.tw/news/politics/breakingnews/5425483
LIVE - 總統賴清德「出訪史瓦帝尼王國進行國是訪問」返國談話,政治,2026/05/05 10:20,    ,https://news.ltn.com.tw/news/politics/breakingnews/5425646
以色列前國會議長利維率團訪台 盼推動台以AI高科技合作,政治,2026/05/05 10:19,外交部次長吳志中設宴歡迎以色列國會跨黨派議員訪問團。（圖由外交部提供）外交部次長吳志中昨（4）日設宴歡迎由以色列前國會議長暨資深議員利維（Mickey Levy）所率領的「以色列國會跨黨派議員」訪問團一行5人訪台。吳志中表示，訪團在當前中東地緣政治充滿挑戰的情況下訪台，展現對台以關係高度重視；利維說，期待藉此次訪台，進一步推動兩國在AI及高科技等領域的合作。外交部說明，訪團成員包括友台小組主席杜伯斯基（Boaz Toporovsky）、國會議員米什拉基（Yonatan Mishraki）、國會議員卡茲（Ron Katz）及國會顧問楊格（Amitai Young）。雙方席間就中東區域情勢及台以雙邊合作與AI等具發展潛力的高科技議題廣泛交換意見。請繼續往下閱讀...吳志中致詞表示，歡迎利維及杜伯斯基在當前充滿挑戰的中東地緣政治環境下仍共同率團訪台，展現對台灣的堅定支持及對台以雙邊關係的高度重視，並再度感謝以色列國會對台灣國際參與的支持。吳志中表示，台灣與以色列同樣面對區域威權主義的威脅與挑戰，期許我國仿效「大衛對抗巨人歌利亞」精神，提升國家防衛韌性並深化兩國合作，共同對抗威權主義脅迫。此外，外交部近年持續與駐台北以色列經濟文化辦事處等單位共同舉辦國際猶太大屠殺紀念日活動，展現我國對以色列與共同維護人權的重視，台以共享自由、民主等核心價值，期待未來兩國在此基礎下，持續深化各領域的合作與交流。利維表示，感念在2023年10月7日哈瑪斯（Hamas）襲擊以色列後，台灣在第一時間展現對以色列及其人民的真誠支持，令他深為感動，在座訪團成員也紛表由衷謝意。利維也說，期待藉由本次訪台，進一步推動兩國在AI及高科技等領域的合作，持續深化兩國關係。外交部表示，台以兩國近年來持續深化雙邊在新創科技、民主供應鏈韌性、農業、衛生醫療與學術交流等領域合作，並已簽署逾36個合作協議及合作備忘錄，未來我國將在現有良好的合作基礎上，持續深化台以雙邊各項合作關係。外交部次長吳志中接見以色列國會跨黨派議員訪問團。（圖由外交部提供）    ,https://news.ltn.com.tw/news/politics/breakingnews/5425644
柯文哲曾拉攏侯漢廷入黨 葉耀元諷：兩岸一家親,政治,2026/05/05 10:08,民眾黨創黨主席柯文哲。（資料照）民眾黨陸續有黨員宣布退黨，包括南投縣議員簡千翔、民眾黨前發言人李有宜等，民眾黨創黨主席柯文哲的妻子陳佩琪近日透露，柯曾經邀請新黨戰將侯漢廷入黨。對此，美國聖湯瑪斯大學國際研究講座教授葉耀元諷刺地說，「民眾黨果然也是支持中共併吞台灣啊，真不愧是兩岸一家親」。葉耀元今於臉書粉專「葉教授的國際事務學院」轉發媒體報導截圖，內容提及「民眾黨最近不斷爆『退黨潮』，多名戰將及深耕地方的黨公職，陸續宣布離開。繼先前發言人李有宜、南投縣議員簡千翔、創黨元老朱蕙蓉、樹下里里長蔡志堅、台中市議員參選人陳諭韋等人陸續『跳船』，曾先後擔任雲林縣黨部主委的林淑芬、林靖冠都也陸續求去；後者更帶走百人以上、本人也加入民進黨。加上前後任黨主席柯文哲、黃國昌陸續捲入司法風暴，白營可謂風雨飄搖；但柯妻陳佩琪透露，柯曾嘗試邀請新黨戰將侯漢廷加入。」請繼續往下閱讀...葉耀元酸說，「新黨支持中國併吞台灣，陳佩琪建議柯文哲找侯漢廷入黨，所以民眾黨果然也是支持中共併吞台灣啊，真不愧是兩岸一家親。對了，現在民眾黨的黨主席好像是黃國昌而不是柯文哲呢，呵呵。」消息曝光後，許多網友紛紛留言，有人說「沒有靈魂的空虛政黨，100％泡沫命運註定」、「被叫成檳榔黨不是叫假的！」、「要不要把王炳忠也找進去，要紅也紅的徹底一點」。綠白合引爆爭議 民進黨雲林縣黨部緊急說明    ,https://news.ltn.com.tw/news/politics/breakingnews/5425582
藍營批「造鼠」 林延鳳秀北市府文件：沒問題何須寫精進計畫,政治,2026/05/05 10:03,民進黨籍議員林延鳳說，市府在4月6日生出一份「台北市鼠類防治精進計畫」，顯示確有老鼠問題存在。（取自林延鳳臉書）台北市鼠患問題，被國民黨籍立委王鴻薇指是民進黨在進行「大罷免模式」的病毒式傳播，操作「造鼠」計畫，民進黨籍市議員林延鳳公布一份市府於4月6日生出的「台北市鼠類防治精進計畫」說，如果真的都是南鼠北送或民進黨造謠，北市府每年的病媒管制計畫中，也有滅鼠工作規範，哪還需要市府公務員寫什麼跨局處精進計畫呢？台北市大安區今年1月30日出現今年首例全國漢他病毒症候群死亡案例，林延鳳說，蔣萬安在2月2日召開府級會議，這也是蔣萬安唯一主持的一場跟鼠患有關的會議，接著2月6日由副市長林奕華召開府內鼠類防治會議，直至4月17日，由副市長李泰興召開常態鼠疫防治會議。請繼續往下閱讀...林延鳳表示，市府回應鼠患問題，一是攻擊議員、一是說要去中央開會討論鼠患防治。問題是，5月4日才說要去中央討論怎麼處理老鼠問題，「請問過去3個月在幹嘛？」蔣萬安2月2日開了府級會議後，市府在4月6日生出「台北市鼠類防治精進計畫」，如果真的都是「南鼠北送」或民進黨造謠，蔣萬安做的好棒棒，北市每年都有病媒管制計畫，裡面也有滅鼠工作的規範呀，哪還需要請市府公務員寫跨局處精進計畫呢？林延鳳說，蔣萬安很愛用「基層公務員被民進黨議員欺負」的惡意言論攻擊某些議員，但真正造成公務員壓力的人是蔣萬安，將帥無能累死三軍以後，問題還是沒解決，然後再把責任推給中央，這就是「護蔣隊」一貫的操作模式。    ,https://news.ltn.com.tw/news/politics/breakingnews/5425624
國民黨氣急敗壞？吳思瑤：應對「總統出訪+安鼠之亂」荒腔走板,政治,2026/05/05 09:38,立委吳思瑤表示，在野無法面對總統出訪、蔣萬安處理老鼠不力，如今已演變成氣急敗壞、荒腔走板的狀態。（資料照）國民黨內部近期除了因軍購案版本陷入內鬨，因總統賴清德閃電出訪，也讓國民黨內部措手不及，主席鄭麗文僅能稱賴出訪是「國際笑話」。此外，台北市長蔣萬安近期陷入「安鼠之亂」，惹得台北市民怨四起，民進黨立委吳思瑤對此表示，如今已演變成氣急敗壞、荒腔走板的狀態。吳思瑤提到，她說的不只是再也無法面對總統賴清德的出訪捷報，同時也是蔣萬安無能因應「鼠情肆虐」而累積出來的滿街民怨，兩者都是因為措手不及而心慌意亂，最終演變成氣急敗壞荒腔走板的狀態。請繼續往下閱讀...許多網友也留言：「希望民進黨市議員、中央衛福部等人別多管閒事或聖母心，請讓蔣萬安自己處理。」、「看到老鼠要大叫王鴻薇。」、「可惡之人，必有可嘆之事。」、「無用的地方首長，每個只會甩鍋中央。」    ,https://news.ltn.com.tw/news/politics/breakingnews/5425548
傳賴清德搭國王專機返台 王定宇：越是打壓越應該走出去！,政治,2026/05/05 09:18,外媒報導指稱賴清德結束訪問，搭乘史瓦帝尼國王專機離境，目前航班已飛至菲律賓周邊。（圖擷取自Flightradar24）總統賴清德成功突破中共外交封鎖，順利抵達我國邦交國史瓦帝尼進行訪問，台灣時間4日晚間，外媒《法新社》引述機場消息人士報導指出，賴清德已結束訪問，搭乘史瓦帝尼國王專機離境，全程低調。民進黨立委王定宇今早在臉書發文指出：「越是打壓，我們台灣越應該走出去，讓國際看見這2300萬人的國家！」王定宇提到，《法新社》昨引述消息人士報導指稱總統賴清德已結束訪問，搭乘國王專機離境，外界推估賴總統將於今日上午返抵國門，但相關細節府方尚未證實。請繼續往下閱讀...王定宇表示，在賴清德離開史瓦帝尼之後，網路盛傳他搭乘1架空巴A340機型的班機，該班機在航班追蹤網站「Flightradar24」於清晨成為全球追蹤度第6高的航班。該班機在今日上午7點多已飛抵婆羅洲上空，躍升為全球追蹤度第4高的航班。王定宇強調，「越是打壓，我們台灣越應該走出去，讓國際看見這2300萬人的國家」。王定宇表示，原本這只是1場台史之間的國是訪問，結果因為中國打壓而舉世矚目，歐美日等國也聲援台灣，而台灣突破中國打壓後，賴清德總統的出訪，也成為突破獨裁中國圍堵的國際要聞。    ,https://news.ltn.com.tw/news/politics/breakingnews/5425523
