Title,News_Type,date,content,url
中國商務部制裁6家美國企業  多涉及對台軍售,國際,2025/09/25 19:10,中國商務部今天公告制裁6家美國公司，多與軍售台灣有關。（圖擷自中國商務部官網）中國商務部今天公告，將美國最大軍用造船廠杭廷頓英格爾斯工業公司等3家美國軍企列入「出口管制管控名單」，又將海上無人機國防科技公司薩羅尼克等3家美國企業列入「不可靠實體清單」實施制裁，多涉及對台軍售。中國商務部官網下午公告，為維護國家安全和利益，履行防擴散等國際義務，決定將杭廷頓英格爾斯工業公司（Huntington Ingalls）、扁平地球管理公司（Planate Management Group）、全球維度公司 （ Global Dimensions LLC）等3家美國實體列入出口管制管控名單。請繼續往下閱讀...公告表示，禁止向上述3家美國實體出口兩用物項；正在展開的相關出口活動應當立即停止。特殊情況下確需出口的，出口經營者應當向中國商務部提出申請，並於即日起實施。杭廷頓英格爾斯與扁平地球因為涉及對台軍售，3月4日已遭中國商務部列入不可靠實體清單實施制裁。網路資訊顯示，全球維度在台灣設有分公司，情資網媒「情報在線」（Intelligence Online）曾提到，該公司與台方商談一項武裝部隊培訓計畫。中國商務部官網同時公告，將薩羅尼克科技公司（Saronic Technologies）、愛爾康公司（Aerkomm）、國際海洋工程公司（Oceaneering International）列入不可靠實體清單，禁止從事與中國有關的進出口活動以及在中國境內新增投資。上述3家美企因為涉及對台軍售，去年12月27日已遭中國外交部公告祭出反制措施。據發布，中國商務部發言人稱，近年來，薩羅尼克科技公司、愛爾康公司、國際海洋工程公司等3家公司不顧中方強烈反對，與台灣展開所謂軍事技術合作，嚴重損害中國國家主權、安全和發展利益。中方「依法追究其法律責任」。中國商務部發言人並稱，中方一貫審慎處理不可靠實體清單問題，僅依法針對極少數危害中國國家安全的外國實體，誠信守法的外國實體完全無需擔心。熱門賽事、球星動態不漏接    ,https://news.ltn.com.tw/news/world/breakingnews/5191030
無人機入侵丹麥定調「混合式攻擊」！ 防長：專業行為者所為,國際,2025/09/25 18:13,丹麥國防部長波爾森（左）與司法部長胡默爾加德（右），25日在哥本哈根國防部舉行記者會，將近日多機場無人機入侵事件定調為「混合式攻擊」。  （歐新社）丹麥政府25日將本週多處機場及空軍基地遭無人機入侵事件，正式定調為一場由「專業行為者」策劃的「混合式攻擊」。根據《法新社》報導，這項最新判斷，凸顯歐洲正面臨日益複雜，且難以捉摸的非傳統安全威脅。丹麥國防部長波爾森（Troels Lund Poulsen）在記者會上明確表示：「毫無疑問，當我們談論如此系統化，且幾乎同時在這麼多地點進行的行動時，這一切都指向一個專業行為者。」他將此次事件形容為一場「混合式攻擊」，但強調丹麥「沒有直接的軍事威脅」。此類無人機飛行事件，繼波蘭、羅馬尼亞及俄羅斯戰機侵犯愛沙尼亞領空後頻傳，加劇了區域緊張。請繼續往下閱讀...多架無人機24日晚間至25日凌晨，現身奧爾堡（Aalborg）、埃斯比約（Esbjerg）、森訥堡（Sonderborg）等機場，以及斯克里斯楚普空軍基地（Skrydstrup air base）。其中奧爾堡機場被迫關閉數小時。司法部長胡默爾加德（Peter Hummelgaard）表示，丹麥將增購新武器以偵測無人機。他指出，這種混合式攻擊的目的是「散布恐懼、製造分裂並嚇唬我們」，但哥本哈根目前「不排除任何關於幕後黑手的可能性」。丹麥總理佛瑞德里克森（Mette Frederiksen）23日曾將早前哥本哈根機場的無人機入侵事件，形容為「迄今為止對丹麥關鍵基礎設施最嚴重的攻擊」。她強調，這是歐洲機場持續遭遇無人機攻擊、領空侵犯及網路攻擊趨勢的一部分。莫斯科方面否認涉入，並反駁波蘭、愛沙尼亞和羅馬尼亞的相關指控。熱門賽事、球星動態不漏接    ,https://news.ltn.com.tw/news/world/breakingnews/5191004
搭機幹走救生衣不是最誇張！空服員曝遭「順手帶走」20物品竟有它,國際,2025/09/25 18:07,空服員分享機上常被順手帶走的東西。示意圖。（美聯社）出國旅遊搭飛機，不少人難掩興奮心情，看到什麼都想「打包帶走」。國外一個擁有大量空服員關注的臉書社群近日發文問卦，「你曾經抓到乘客在飛機上偷什麼東西？」引發大量空服員踴躍回應，答案從救生衣到擴音器，甚至連座墊都有人偷，知名外國旅遊達人「Johnny Jet」也針對該文發表專欄，整理出20項物品，引發討論。「Johnny Jet」近日發布專欄說，名為「A Fly Guy」的資深空服員，最近在擁有150萬成員的臉書社群「A Fly Guy's Cabin Crew Lounge」發文，短時間就引起熱烈回應。請繼續往下閱讀...他也整理了20項空服人員分享的失竊物品：1.救生衣-有乘客竟將救生衣塞進後口袋帶下飛機。2.整組餐具-包含所有擺盤、器皿與容器。3.銀器餐具-不少人偷偷拿走金屬製刀叉湯匙。4.瓷盤與瓷器餐具-高級客艙餐具常成為「紀念品」。5.咖啡杯-有乘客想買，結果空服員直接免費送給他。6.玻璃酒杯-商務艙與頭等艙的玻璃杯都被拿走過。7.空服員制服毛衣-有人從機組儲物櫃偷走穿上。8.出口標示牌／安全告示-有人甚至拔下機門旁的牌子。9.鹽罐10.胡椒罐-特別是維珍航空的歌劇院造型款式。11.廁所備品-包括肥皂、濕紙巾、衛生紙、紙巾等。12.航空公司睡衣13.毯子與枕頭14.座椅用安全帶或延長帶15.整個座椅坐墊-被拆走帶下飛機。16.機組人員的包包17.頭等艙備品包（Amenity Kit）18.迷你吧物品-如酒類、零食、備用餐盒。19.擴音器（Megaphone）-有人打算拿回去開船用。20.聖經或充氣娃娃-各種個人宗教與娛樂物品也有人偷。有空服員透露，有些乘客甚至會趁機「掃貨」，將備品包、飲料、剩下的零食、機上商品一次打包塞進包包；也有長輩把洗手間內所有用品通通裝進隨身包帶走。雖然部分航空公司對於乘客「帶走紀念品」採取寬容態度，例如某些頭等艙航班會主動提供紀念用的鹽罐包裝盒，但大多數的行為仍然已構成竊盜行為。許多網友看完分享後驚呼：「太離譜了吧」、「連座墊都偷？這是犯罪了吧」、「等等！空服員的包包，還有個人制服？」「Johnny Jet」最後也補充，他自己搭過上千班飛機、飛行超過數百萬公里，也曾親眼看到乘客把耳機或毛毯偷偷塞進隨身包，讓他感到很尷尬也有點同情，「這些人不是缺東西，就是有偷竊癖。」熱門賽事、球星動態不漏接    ,https://news.ltn.com.tw/news/world/breakingnews/5190990
川普漸感「極其不耐煩」！ 范斯警告俄羅斯快帶著善意談判,國際,2025/09/25 18:03,美國總統川普（右）、俄羅斯總統普廷（左）。（路透檔案照）美國透過外交力促結束烏俄戰爭的努力已陷入僵局，華府對俄羅斯態度愈加強硬之際，美國副總統范斯24日警告，總統川普對莫斯科拒絕努力達成和平協議，「愈加感到極其不耐煩」。《法新社》、《基輔獨立報》報導，范斯24日在北卡羅來納州接受訪問時表示，川普「不認為他們拿出足以結束戰爭的條件」，若俄羅斯拒絕秉持善意談判，「對他們國家來說，會非常、非常糟糕」。請繼續往下閱讀...當天稍早，美國國務卿魯比歐在紐約與俄羅斯外長拉夫羅夫（Sergei Lavrov）會面，直言要俄羅斯「停止殺戮」，並要求莫斯科「採取有意義的步驟，邁向可長可久的解決方案」。根據俄國會後提供的兩人談話紀要，拉夫羅夫反駁魯比歐，強調「基輔與部分歐洲國家提倡的機制令人不可接受，意在延長衝突」。范斯指出，美國已經「抱著極大的善意與烏、俄雙方磋商」，而莫斯科持續拒絕也展現同樣的善意。他說，「（川普）希望這場戰爭結束，他正盡他所能結束戰爭，但是，注意了，若俄羅斯拒絕秉持善意談判，我想對他們國家來說，會非常、非常糟糕，這一點我想總統已經說清楚了」。范斯的談話時值川普23日出席聯合國大會後，對烏克蘭展現出令外界驚訝的態度逆轉，指烏國不僅能奪回被俄羅斯佔領的全部領土，甚至可能「走得更遠」。范斯說，川普和他的看法並非立場轉變，而是在華府持續推動結束戰爭的同時，「認識到實際情況」。他表示，川普「已愈加認為，這場戰爭對俄國不利......對烏克蘭、對美國也不是好事，我們希望殺戮能夠停止，這依然是總統的立場」。熱門賽事、球星動態不漏接    ,https://news.ltn.com.tw/news/world/breakingnews/5190999
中俄軍工合作鐵證曝光！路透爆中國專家助俄開發無人機,國際,2025/09/25 18:01,圖為俄羅斯對烏克蘭基輔實施無人機攻擊時，當地政府認為是伊朗製的「見證者-136」（Shahed-136）無人機。（路透資料照）儘管中國外交部一再否認提供致命武器，但《路透》獨家披露，歐洲安全官員及文件顯示，多批中國無人機專家已飛往俄羅斯，為受西方制裁的國有武器製造商伊熱夫斯克機電廠（IEMZ Kupol）提供軍用無人機的技術開發工作。此合作案凸顯中俄在無人機領域關係日益深化，並讓西方制裁形同虛設。據報導，自去年第二季以來，多批中國無人機專家已多次訪問伊熱夫斯克機電廠，協助進行軍用無人機的技術開發。同時，該電廠也透過受美國與歐盟制裁的俄羅斯國防採購公司TSK Vektor，接收了由四川騰盾科技（Sichuan AEE）及湖南昊天易（Hunan Haotianyi）製造的攻擊與偵察無人機。請繼續往下閱讀...文件顯示，這家電廠曾接收數十架四川騰盾科技生產的單向攻擊無人機，以及多架湖南昊天易製造、可用於情報、偵察及打擊的HW52V垂直起降（VTOL）無人機。歐洲安全官員擔憂，中方專家廣泛參與測試與技術工作，以及中國製攻擊無人機的持續運送，顯示伊熱夫斯克機電廠有意擴大生產新無人機型號，而中國已成為俄羅斯軍事供應鏈的關鍵一環。華府智庫「新美國安全中心」兼任高級研究員班迪特（Samuel Bendett）指出，中國零部件在俄羅斯軍事系統，尤其是在空中無人機方面，扮演著巨大的角色、影響和衝擊。報導揭露，TSK Vektor曾向伊熱夫斯克機電廠開出數十架四川騰盾科技無人機的帳單，該公司文件也確認了A140和A900單向攻擊無人機的交付。此外，中國專家團隊曾赴俄協助組裝無人機，並培訓伊熱夫斯克機電廠員工，更前往軍事試驗場參與A60、A100、A200等無人機的飛行測試。此外，還有來自中國專家團隊參與GA-21新型無人機的開發工作，該機種被評估為伊朗「見證者-107」（Shahed-107）的改進版本。針對相關指控，中國外交部表示不知情，並重申中方客觀公正，不提供致命武器。熱門賽事、球星動態不漏接    ,https://news.ltn.com.tw/news/world/breakingnews/5190986
中國男「瘋狂試吃日本葡萄」還硬撕保鮮膜 沒品行為挨轟,國際,2025/09/25 17:40,"中國男子連續試吃6次大阪心齋橋店家的葡萄，最後還一次串2顆，讓店員及廣大網友超傻眼。（擷取自X）最近社群平台瘋傳一段中國人在日本商店街瘋狂試吃水果的影片，他不僅重複使用竹籤，還硬撕保鮮膜要再吃，引發現場店員錯愕，最終吃了7顆葡萄。影片曝光後更在中日網路炸鍋。儘管男子事後刪除影片並解釋「沒有惡意」，仍遭到各界砲轟，批評此舉丟臉又失格。事件發生在大阪心齋橋附近「果物神社」店家，該名自稱「静水の年」的中國男網友，看到店家提供葡萄試吃時興奮上前。他在吃下第一顆葡萄後，無視店員示意將叉子丟棄，繼續用同一根叉子反覆試吃，並大讚「很好吃」。請繼續往下閱讀...即使店員將試吃盤蓋上保鮮膜，他仍要求再吃，甚至直接拉開保鮮膜，串起2顆葡萄一口吞下，令店員當場愣住。他甚至厚著臉皮詢問其他未拆封的葡萄能不能也試吃，遭到對方拒絕後還笑說「不讓吃了」，逼得店家用雙手放在試吃盤上方，防止他繼續硬吃。影片曝光後引爆熱議，許多網友留言痛批「你好意思吃，我都不好意思看」、「這種人丟臉丟到國外」、「能不能有點素質」、「別再出去說自己是中國人」。也有人指出，這類行為正是導致中國人在國際場合屢遭負面印象的原因。雖然該男子事後將影片刪除並強調「自己沒有惡意」，但相關片段已被大量轉載，在中日兩地掀起熱烈討論。【悲報】訪日中国人、スーパーの試食コーナーで6回も試食（実質7回分）するも商品は買わず去るpic.twitter.com/pOmsU9bIvl— 保守速報 （@hoshusokuhou） September 23, 2025 【悲報】訪日中国人、スーパーの試食コーナーで6回も試食（実質7回分）するも商品は買わず去るpic.twitter.com/pOmsU9bIvl熱門賽事、球星動態不漏接    ",https://news.ltn.com.tw/news/world/breakingnews/5190861
川普助攻 吉米金摩脫口秀復播創十年收視新高,國際,2025/09/25 17:13,美國知名脫口秀主持人金摩的「吉米夜現場」節目在23日復播。（法新社）美國知名脫口秀主持人金摩（Jimmy Kimmel）因在15日播出的「吉米夜現場」（Jimmy Kimmel Live！），發表關於保守派政治網紅柯克之死爭議言論，節目遭無限期停播，引發美國社會高度議論，但該節目在一週後於23日復播。據「ABC」電視台公布，復播集收視率創下十年來最佳紀錄。ABC表示，平均收看人數為142萬的吉米夜現場，復播集觀眾數達到626萬。由於ABC旗下的聯播台在數個主要市場沒有播放復播集，使得節目無法觸及約四分之一美國家庭。即便如此，ABC讚揚「吉米夜現場仍創下收視里程碑。」此外，截至24日下午，包括YouTube和Instagram等社群媒體上，金摩在復播集的開場獨白累積了2600萬次觀看數。請繼續往下閱讀...吉米夜現場最初遭停播時，美國總統川普大讚「對美國來說是個大好消息」，批評金摩是「沒才華也沒收視」的主持人。「路透」指出，ABC母公司迪士尼僅一週就讓金摩重回螢光幕的決策，是對美國總統川普藉由訴訟和監管威脅等手段加大打擊媒體政敵之際的反抗。不僅如此，迪士尼也面對來自金摩粉絲的壓力，因其在停播期間陸續取消迪士尼影音串流平台迪士尼+和Hulu的訂閱服務。「吉米夜現場」23日復播創下626萬人收視紀錄。（歐新社）熱門賽事、球星動態不漏接    ,https://news.ltn.com.tw/news/world/breakingnews/5190919
橫眉冷對千夫指 納坦雅胡預告將在聯大譴責各國承認巴勒斯坦國,國際,2025/09/25 16:59,以色列總理納坦雅胡。（路透）面對愈來愈多國家承認巴勒斯坦的國家地位，以色列總理納坦雅胡25日在啟程前往美國出席聯合國大會前放話說，他會趁稍後在聯大上發言時說出真相，以及譴責宣布承認巴勒斯坦國的各國領導人。根據納坦雅胡辦公室的聲明，納坦雅胡在搭機赴美前於班古里昂機場表示，他將在聯大上說出以色列的真相，包括以色列公民的真相、以色列士兵的真相，以及以色列國家的真相。請繼續往下閱讀...納坦雅胡還說，他還將譴責承認巴勒斯坦國的各國領導人，因為這些領導人不去譴責對兒童燒殺暴虐者，反而任之以色列正中央建國，「想都別想。」納坦雅胡此行訪美除了出席聯大與各國領導人見面，還將在26日於聯大上發表演說，以及29日在白宮與美國總統川普總統會面，為川普今年初重新上台以來的第4次川納會。3天前的22日，法國與沙烏地阿拉伯在聯大會外召開1場爭取全球多國領袖支持「兩國方案」（two-state solution）的特別峰會，包括法國在內的許多與會國家，都承認巴勒斯坦的國家地位。「兩國方案」是以巴衝突的政治解方之一，主張以巴各自建國；但納坦雅胡向來反對「兩國方案」與巴勒斯坦建國，並曾在24日表示，包括英法等多國近來紛紛承認巴勒斯坦國，但以色列毫無義務比照辦理，並斥這波承認潮是「部分領導人可恥地對巴勒斯坦恐怖主義豎白旗」。熱門賽事、球星動態不漏接    ,https://news.ltn.com.tw/news/world/breakingnews/5190899
川普司法清算再出手！前FBI局長柯米恐遭起訴 涉向國會作偽證,國際,2025/09/25 16:55,圖為前聯邦調查局（FBI）局長詹柯米2020年9月30日透過視訊在參議院司法委員會作證。美國司法部目前正準備起訴柯米，指控其在此次聽證會中提供不實證詞。（路透資料照）美國司法部正準備尋求起訴前聯邦調查局（FBI）局長柯米（James Comey），指控其於2020年9月30日在國會作證時提供不實證詞，涉及對2016年總統大選「通俄門」調查的處理失當。根據《華盛頓郵報》報導，此舉發生在總統川普公開要求司法系統懲罰政治對手後數日，被視為川普對政敵展開司法清算的最新行動。起訴柯米的期限將於9月30日（5年追訴期）屆滿。據消息人士透露，維吉尼亞州東區的檢察官最快將於25日向大陪審團提出此案。此前，維吉尼亞州東區聯邦檢察官西伯特（Erik S. Siebert）曾因認為證據不足而拒絕起訴柯米，隨後遭川普逼退。川普旋即任命沒有檢察經驗的白宮幕僚哈利根（Lindsey Halligan）為代理檢察官，司法部在她上任後，迅速重啟了對柯米的調查。請繼續往下閱讀...此案調查核心是柯米在2020年參議院司法委員會上的證詞。共和黨籍聯邦參議員葛蘭姆（Lindsey Graham）曾詢問，柯米是否知悉一份關於國務卿希拉蕊·柯林頓（Hillary Clinton）欲藉俄羅斯駭客干預2016年大選以轉移其私人電郵伺服器爭議的調查報告。柯米回應「這沒有讓我想起任何事」，葛蘭姆稱這「令人震驚」。另一位共和黨參議員克魯茲（Ted Cruz）也質疑柯米是否曾授權洩漏關於川普「通俄門」或柯林頓電郵門的調查資訊給媒體，柯米則堅持否認。川普在上週末的社群媒體發文中，公開敦促司法部長邦迪（Pam Bondi）立即起訴柯米及其他兩位政敵紐約州檢察長詹樂霞（Letitia James）和加州民主黨參議員謝安達（Adam Schiff）。川普寫道：「我們不能再拖延了，這正在扼殺我們的聲譽和公信力。他們彈劾我兩次，起訴我（5次！），都是白費力氣。正義必須現在伸張！！！」這場由總統直接下達指令的司法行動，引發了外界對司法獨立性的高度憂慮。熱門賽事、球星動態不漏接    ,https://news.ltn.com.tw/news/world/breakingnews/5190869
邊充電邊睡覺！櫻花妹行動電源爆炸釀火災 6住戶急送醫,國際,2025/09/25 16:34,日本東京一處公寓今天凌晨疑似因行動電源爆炸引發火災。（本報合成，擷取自@Gt8VUlzRG7buafO/X）日本東京杉並區阿佐谷南一棟5層樓公寓今天（25日）凌晨發生火警，造成6人送醫。住在起火房間的女子供稱，當時正邊充電邊睡覺，突然聽到爆炸聲，發現行動電源起火燃燒。綜合日媒報導，火警發生於凌晨2點左右，起火點在公寓2樓一間約20平方公尺的房間。住戶立即撥打119報案，消防單位派出29輛消防車趕赴現場，花了約兩小時才控制火勢。請繼續往下閱讀...火災共造成8名年齡介於10多歲到60多歲的男女住戶吸入濃煙或出現不適，包含起火戶女房客等6人送醫治療，所幸均為輕傷。起火房間的住戶是一名10多歲的年輕女性，她將手機連接行動電源後就睡著了，突然聽到「砰」一聲，發現開始燃燒，火勢迅速蔓延整個房間。事故地點距離東京地鐵丸之內線南阿佐谷站以東約200公尺，周邊為住宅與餐飲區。警視廳初步認定火災可能因行動電源起火引起，相關單位正進一步調查起火原因。熱門賽事、球星動態不漏接    ,https://news.ltn.com.tw/news/world/breakingnews/5190796
吉爾吉斯投票解散國會提前1年大選 意在為總統賈帕洛夫固權,國際,2025/09/25 16:24,吉爾吉斯將提前1年舉行國會大選，據信意在為總統賈帕洛夫固權。圖為吉爾吉斯總統賈帕洛夫23日在聯合國大會上發言。（法新社）吉爾吉斯國會25日投票通過解散國會提前大選。分析家指出，此舉可能意在為吉爾吉斯總統賈帕洛夫（Sadyr Japarov）固權。當地媒體引述吉爾吉斯國會議長圖爾貢別克（Nurlanbek Turgunbek）的話說，大選將於今年11月30日舉行；此日期比原定的2026年11月提早1年。此外，吉爾吉斯預定2027年1月舉行總統選舉。請繼續往下閱讀...根據了解，國會諸公之所以同意必須提前國會大選，在於原定的國會選舉與總統大選的時間過於相近，恐對本就相對貧困、經濟依賴在俄羅斯打工的僑民匯錢回國的吉爾吉斯，帶來沉重的財政與組織負擔。吉爾吉斯國會現由效忠賈帕洛夫的政黨主導。賈帕洛夫是民族主義兼民粹主義人士，2020年在選舉舞弊的抗議聲中上台執政。吉爾吉斯原被視為中亞地區最民主、媒體最自由的前蘇聯附庸國，2006年與2010年的抗議曾導致總統下台；但隨著賈帕洛夫上台，吉爾吉斯的政情便漸與其更專制的鄰國靠攏；獨立媒體被禁，記者被抓，網路也被當局全面管控。但憑藉近兩位數的強勁經濟成長，賈帕洛夫聲望居高不墜。柏林智庫卡內基中心（Carnegie Center）的中亞問題專家馬鐵木（Temur Umarov）說，國會提前大選是賈帕洛夫試圖在2027年尋求連任之前強化政治控制，是賈帕洛夫為革新政體與鞏固其政權而採取的更廣泛舉措的一環。熱門賽事、球星動態不漏接    ,https://news.ltn.com.tw/news/world/breakingnews/5190810
法國抓病假詐欺出新招 私家偵探出動跟蹤上班族,國際,2025/09/25 16:24,為法國南特市的社會保障機構，其上方標示著「法國健康保險」（l'Assurance Maladie）的標誌。該機構負責支付員工病假福利，而法國病假詐領問題日益嚴重，已成國家財政負擔。（路透）法國正面臨嚴峻的病假詐領問題，已成為國家財政的沉重負擔。根據《路透》報導，自2012年以來，法國病假天數激增60%，每年耗費逾100億歐元（約新台幣3574億元）。為此，私人偵探被大量僱用來跟蹤員工，揭發虛報病假行為，這項業務甚至超越傳統的婚姻調查，成為新主流。多位受訪偵探表示，詐領病假調查業務蓬勃發展。偵探黎曼（Fabrice Lehmann）指出，有目標被懷疑與競爭對手合作，或利用帶薪病假創辦公司。他的合作夥伴派勒貝克（Patrice Le Bec）甚至看過有人請病假後直接搭機度假。黎曼總結：「無論是在公司或家庭，歸根結底都是金錢或背叛。」法國國家健康保險局去年阻止了4200萬歐元的詐領，但這難以涵蓋實際規模。請繼續往下閱讀...法國前總理白胡（Francois Bayrou）曾將病假成本作為削減預算目標，稱檢查顯示超過18個月的病假有一半無正當理由。偵探波伊文（Bruno Boivin）透露，曾有客戶發現員工請病假10年卻仍每3年聯繫公司以更新配車，即使掌握證據也難以解僱。他認為政府打擊詐領的承諾是「胡說」，因違規行為很少受罰。官方數據顯示，疫情後法國缺勤率加速增長。經濟學家德爾熱訥（Jean-Claude Delgenes）分析，法國「垂直、專制」的管理風格，不符員工需求，導致「系統具壓迫性」。然而，隸屬左翼政黨的急診醫師貝納利（Sabrina Ali Benali）則駁斥企業誇大問題，稱大規模詐領是「純粹的幻想」。這場關於病假詐領的爭議，揭示了法國在財政、勞動權益與管理文化之間的深層矛盾。熱門賽事、球星動態不漏接    ,https://news.ltn.com.tw/news/world/breakingnews/5190823
