Title,News_Type,date,content,url
以軍迫擊砲彈「誤擊」加薩平民區 至少10傷部分命危,國際,2025/12/18 17:03,巴勒斯坦衛生官員統計，停火期間加薩地區已有超過370人死於以軍砲火。（美聯社）以色列與哈瑪斯之間的停火協議脆弱不堪，以色列軍隊近日在加薩走廊執行任務，朝分界線另一側平民區發射一枚迫擊砲，造成至少10人受傷，部分傷勢嚴重。據《美聯社》報導，以色列軍方說，迫擊砲彈是在「黃線」附近執行軍事行動時發射。黃線是停火協議中劃定的分界線，用以區隔以軍控制區與加薩其餘地區。軍方未說明部隊當時具體任務內容，也未證實是否越線，僅稱砲彈偏離原本目標，實際目標並未公開。請繼續往下閱讀...加薩阿赫利醫院（Al-Ahli Hospital）院長納伊姆（Fadel Naeem）指出，這起攻擊發生在加薩市中心，醫院收容10名受傷平民，部分傷者情況危急。這起事件並非10月10日停火生效以來首例，巴勒斯坦衛生官員統計，停火期間加薩地區已有超過370人死於以軍砲火。巴勒斯坦方面指出，平民傷亡與停火線標示不清有關。以軍近期以黃色水泥塊標示分界線，但部分地區尚未完成設置，居民難以辨識安全界線，增加誤傷風險。以色列方面則說，軍事行動多為回應哈瑪斯違反停火協議，多數死者為武裝人員。不過，不具名的以軍官員坦言，軍方知悉部分行動造成平民死亡，其中包括年幼孩童及開車外出的一家人。    ,https://news.ltn.com.tw/news/world/breakingnews/5282522
歐盟撤銷2035年燃油新車禁令 新規一覽,國際,2025/12/18 16:56,"歐盟執委會16日公布新方案，允許販售油電混合車、調降車輛減排目標等，形同撤銷原訂2035年起禁售燃油新車政策。示意圖。（路透）歐盟執委會16日公布新方案，允許販售油電混合車、調降車輛減排目標等，形同撤銷原訂2035年起禁售燃油新車政策，被視為向德、義等國及主要車商屈服。路透社指出，氣候倡議團體和以電動車為主的企業，一直主張應維持原本的目標不變，但最終不敵傳統車業激烈遊說。新方案內容重點包括容許不產生碳足跡油品、插電式油電混合車等過渡性技術，以及將2035年的目標調整為相較2021年，車輛廢氣排放減少90%，而非原本目標的全面歸零等。請繼續往下閱讀...以下是路透社整理歐盟新方案的重點。● 放寬「綠色」標準根據新方案，車商2035年之後仍可銷售插電式油電混合車與增程式車款（EREV,即以電池驅動車輪，當電池電量不足時，車上的內燃機引擎才會啟動為電池充電，但不直接驅動車輪，猶如帶著燃油發電機的電動車）；未能達成100%減碳的車商，必須另設法補足減排差額。碳中和燃料和低碳鋼材納入減排計算。前者係指整個生命週期（製造、使用）中，不會增加大氣中二氧化碳淨含量的燃料（例如用水和二氧化碳合成的油品）；後者代表若車廠使用在歐盟生產的低碳「綠色鋼材」，也能列入減排計算。然而採用前述「彈性機制」的車商，將不得與只生產純電動車的品牌（如特斯拉）合併計算排放量來達成減排目標。歐盟設有「碳排池」（Pools）機制，讓電動車銷量少的車商可向電動車銷量多的「盟友」買碳權或合併計算，以免碳排超量遭罰款。● 訂立企業用車電動化目標企業用車約占歐洲新車銷量的60%。新方案未來將依各會員國人均GDP設定具體、有約束力的電動化目標；但員工少於250人、年營業額低於5000萬歐元的中小企業將可豁免。歐盟成員國僅能對「在歐盟生產」的清潔能源車輛提供財務補助，這對主張在地生產的法國是一大勝利。推動企業用車電動化，也有助建立二手電動車市場；目前歐盟各國的零排放車市占率目標差異極大，例如保加利亞的2035年目標為32%，而多數較富裕國家則設定為 100%。● 新設「輕型汽車」分級  作為積分大補丸歐盟執委會將為車長少於4.2米的小型電動車設立一個全新分類，概念類似日本的「輕型車（kei car）」。這類車款在2034年前可適用「超級積分」制度，每銷售1輛可計為1.3輛，即賣出10輛輕型電動車，可算做13輛，有助歐洲車商的電動化目標。雷諾（Renault）與斯泰蘭蒂斯（Stellantis）一直遊說歐盟為輕型車設立新的分級，認為可降低成本，並讓電動車更平價。● 放寬廂型車減排規範廂型車等商用車到2030年底前的減排目標調降為40%，低於原本規劃的50%。此外，車廠可在2030至2032年這3年期間採平均計算，進一步提高彈性。● 祭出電池在地化利多新方案並納入一項全新的「振興電池配套」，在歐洲加速擴建超級電池工廠、提供業者與中國競爭時的財務補助。歐盟將投入18億歐元強化歐洲電池價值鏈，其中包括提供電芯製造商15億歐元無息貸款。    ",https://news.ltn.com.tw/news/world/breakingnews/5282505
阿根廷保育太成功？美洲獅「密度破紀錄」 竟把企鵝當主食,國際,2025/12/18 16:55,阿根廷巴塔哥尼亞地區的美洲獅數量回升後，發展出獵食麥哲倫企鵝的新習性，圖為美洲獅攻擊企鵝的畫面。（圖擷取自Gonzalo Ignazi /Facebook）生態保育的成功有時會帶來意想不到的結果。據美國廣播公司新聞網（ABC News）報導，阿根廷巴塔哥尼亞（Patagonia）地區的野生動物保育成效顯著，曾因過度獵殺而瀕臨滅絕的美洲獅（Puma）族群強勢回歸，密度創下歷史新高。然而，這些頂級掠食者在重返棲地後，發現了一種全新的主要獵物來源：麥哲倫企鵝（Magellanic penguins）。發表於《皇家學會期刊》（Royal Society Journals）的最新研究指出，GPS定位與攝影機數據顯示，巴塔哥尼亞地區目前的美洲獅密度達到每100平方公里13.2隻，這是該物種有紀錄以來的最高密度。這些大型貓科動物主要聚集在麥哲倫企鵝的棲息地周圍。這些企鵝每年約有6個月（9月至隔年3月）會在海岸生活。請繼續往下閱讀...研究主要作者、杜克農場（Duke Farms）生態學經理塞羅塔（Mitchell Serota）解釋，在美洲獅缺席的百年間，麥哲倫企鵝得以在內陸建立龐大的繁殖聚落。如今美洲獅回歸，這些在陸地上行動緩慢的企鵝便成了「容易得手」的目標。非營利組織「Rewild Argentina」科學主任多納迪奧（Emiliano Donadio）直言，企鵝位置可預測且毫無防禦能力，美洲獅獵殺牠們幾乎不需要消耗能量。相比之下，美洲獅的傳統獵物原駝（guanacos，一種野生駱駝科動物）體型大且難以捕獵。因此，只要企鵝在岸上，美洲獅就會優先選擇這頓「輕鬆的大餐」。美洲獅在20世紀初因威脅養羊業而被視為「害獸」（vermin）遭到撲殺，幾近從該地區消失。直到2004年蒙特雷昂國家公園（Monte Leon National Park）成立及後續保育措施，才讓牠們獲得喘息空間。研究強調，儘管被大量獵食，當地的企鵝種群數量目前看來仍保持穩定甚至增長。塞羅塔指出，這項發現凸顯了生態復育並非單純將時光倒流至過去，在改變後的景觀中恢復野生動物，往往會創造出全新的互動關係並重塑動物行為。    ,https://news.ltn.com.tw/news/world/breakingnews/5282534
無形健康威脅！家電排放大量超細懸浮微粒 「這個」最嚴重,國際,2025/12/18 16:50,研究顯示家用電器會排放大量超細顆粒物。示意圖。（彭博）南韓1項新研究測量日常家用電器排放的室內空氣污染，揭示人們使用哪些電器前可能需要三思而後行。研究發表在《危險物質》期刊上。根據科學網站《ScienceAlert》報導，南韓釜山國立大學的研究團隊建立一個特殊的實驗艙，測量各種家家排超細懸浮微粒（UFP）的排放量。這些超細顆粒尺寸小於100奈米，小到足以進入人體深處。請繼續往下閱讀...研究團隊測試了不同類型的烤麵包機、氣炸鍋和吹風機，發現大多數電器都會排放大量超細懸浮微粒。最嚴重的屬於彈出式烤麵包機，即使裡面沒有麵包，它每分鐘也會排放約1.73兆個超細懸浮微粒。雖然研究並未直接測量超細懸浮微粒對人體健康的潛在影響，但研究團隊的模擬表明，這些過於細小的超細懸浮微粒無法被鼻腔過濾掉，能夠深入成人和兒童的肺部。兒童的吸道較窄，可能更容易受到這些懸浮微粒長期滯留的危害。除了超細懸浮微粒，研究團隊還在空氣中的懸浮微粒中發現了重金屬，諸如銅、鐵、鋁、銀和鈦。這些金屬很可能來自電器的線圈和馬達。研究人員指出，這些重金屬顆粒進入人體後，會增加細胞毒性和發炎的風險。研究團隊希望未來能看到更多措施來提高家用電器的安全性，降低超細懸浮微粒排放量。研究成員說，製造商可以透過改進設計和提高效率來改善家用電器，但要真正實現變革仍可能需要更嚴格的監管。    ,https://news.ltn.com.tw/news/world/breakingnews/5282512
日本陸上自衛隊直升機 連續2天遭遇雷射照射,國際,2025/12/18 16:43,圖為日本陸上自衛隊立川駐屯地UH-2直升機進行飛行訓練。（圖取自x.com/CAMP_TACHIKAWA）日本陸上自衛隊立川駐屯地今天表示，隸屬陸上自衛隊東部方面航空隊的一架UH-1J直升機，昨天傍晚約6時50分起，在靜岡縣伊豆縱貫自動車道的三島加茂交流道附近上空，遭到約1分鐘的「綠色」雷射照射。日本東京放送電視台（TBS）、SBS TV報導，根據立川駐屯地，該架直升機當時結束在濱松飛行場的起降訓練，正在返回立川駐屯地途中，機上有機長、副操縱士等3人，無人受傷，機體也沒有受損。請繼續往下閱讀...此外，隸屬千葉縣木更津市的陸上自衛隊第1運輸直升機群第106飛行隊，16日在靜岡縣裾野市上空進行訓練時，一架CH-47JA直升機也在晚間8時至8時10分之間，遭到長達約10分鐘的雷射照射。根據木更津駐屯地，事發當時，直升機上共有包括飛行員在內共5人搭乘，無人受傷，機體也沒有受損。飛行隊已向木更津警察署及靜岡縣警方通報。這代表日本陸上自衛隊航空器連續兩天遭遇雷射照射。東部方面航空隊長、一等陸佐野澤友宏表示，「繼12月16日木更津駐屯地所屬直升機遭到雷射照射後，這次又發生訓練中隊員安全遭到威脅的惡質且危險行為，實在令人極為遺憾。這類行為絕不可被容許，我們將與相關機構合作，採取必要應對措施。」日本自衛隊戰機6日遭中國航空母艦遼寧號艦載機以雷達照射，引發日方強烈抗議，但這次使用的不是雷達，而是一般用於指示器等用途的雷射。    ,https://news.ltn.com.tw/news/world/breakingnews/5282452
邊打邊談和 ！烏軍喊收復戰略重鎮庫皮揚斯克近9成 俄酸反攻失敗,國際,2025/12/18 16:31,烏克蘭總統澤倫斯基日前親赴庫皮揚斯克前線宣揚烏軍戰果。（路透）各方緊鑼密鼓協商俄烏和平協議之際，任何領土得失都可能影響烏俄兩國談判本錢。烏軍總司令瑟爾斯基（Oleksandr Syrskyi）17日宣稱，當前控制北部戰略重鎮庫皮揚斯克（Kupiansk）9成領土。俄羅斯國防部則稱烏軍的反攻行動以失敗收場。《路透》報導，俄軍上月向總統普廷報告攻下庫皮揚斯克，烏方否認，更在上週宣布成功奪回城市，包圍俄軍。烏克蘭總統澤倫斯基甚至親赴現場激勵士氣並留影，宣揚烏軍重大戰果。請繼續往下閱讀...瑟爾斯基在社群媒體Telegram發文寫道，「有賴主動搜索和打擊行動，我們將俄軍驅逐出庫皮揚斯克並掌握了近9成的城鎮領土。」俄國防部長貝洛索夫（Andrey Belousov）則在後來的會議中向高階國防官員提到，烏克蘭部隊試圖奪取庫皮揚斯克的掌控權但未能成功。澤倫斯基12日親訪庫皮揚斯克前線時，強調前線戰果至關重要，如此以來烏克蘭才能在外交上取得成果。    ,https://news.ltn.com.tw/news/world/breakingnews/5282490
美對台軍售3500億耶誕禮包讓中國崩潰 跳腳嗆美「引火燒身」,國際,2025/12/18 16:27,美國川普政府17日宣布111億540萬美元（約新台幣3514億元）對台軍售案，其中包含60輛M109A7自走砲。（路透）美國川普政府17日宣布111億540萬美元（約新台幣3514億元）對台軍售案，涉及海馬士、M109A7自走砲、拖2B與標槍反裝甲飛彈等8大裝備，引發中國跳腳嗆美「以武助獨只會引火燒身」。國防部今天表示，美國政府於美東時間17日就國軍「台灣戰術網路（TTN）暨部隊覺知應用套件（TAK）」、陸軍「AH-1W型直升機零附件」、「M109A7自走砲」、「海馬士遠程精準打擊系統續購」、「拖式飛彈續購」、「反裝甲型無人機飛彈系統」、海軍「標槍反甲飛彈續購」、「魚叉飛彈可修件檢修」等8案，總額111億540萬美元（約新台幣3514億元）對台軍售案，進行知會國會程序，可望於1個月後正式生效，此次軍售案不只總金額龐大，對於國軍整體防衛戰力也將大大加分。請繼續往下閱讀...對此，中國外交部發言人郭嘉昆今（18日）在例行記者會跳腳稱「美國嚴重違反一個中國原則和中美三個聯合公報」，破壞台海和平穩定，向台獨分裂勢力發出嚴重錯誤信號，北京對此堅決反對強烈譴責。郭嘉昆老調重彈，批美國以武助獨，只會引火燒身，以台制華絕對不會得逞，揚言將採取堅決有力措施。售案內容。    ,https://news.ltn.com.tw/news/world/breakingnews/5282465
共軍反腐出新招  官網公開徵集違規採購問題,國際,2025/12/18 16:27,解放軍示意圖。（法新社）中共解放軍內部反腐持續擴大。共軍旗下的「軍隊採購網」15日罕見地發布「關於徵集空軍部隊違規採購問題公告」，公開向社會徵求提供中共空軍採購方面的違規線索，受理舉報期限到2026年6月30日止，引起關注。綜合香港南華早報等媒體報導及公開資訊，這項公告提到，此舉是為「進一步暢通違規採購問題回饋管道，廣泛接受社會監督」，因此「面向社會」公開徵集違規採購問題有關訊息。報導並提到，這是首次點名針對共軍特定軍種公開徵集違規線索。請繼續往下閱讀...公告表示，這次徵集主要受理中共空軍部隊組織展開的物資、服務類採購活動有關違規問題（含招標代理機構組織項目），包括但不限於需求編制、採購評審、合約履約、供應商處罰、招標代理機構遴選、網上採購等。這項公告說，凡參加空軍部隊採購活動的供應商、評審專家、招標代理機構、投標代理人，以及軍隊內部與項目相關人員，可採取郵遞方式實名回饋，並列出了受理郵寄的地址、聯絡人及受理電話。但公告強調，回饋問題應客觀真實、事實清楚、表述準確，相關佐證材料來源應合法合規、真實有效，「嚴禁藉機誣告亂告，擾亂軍隊採購秩序」。至於受理回饋截止時間是2026年6月30日。    ,https://news.ltn.com.tw/news/world/breakingnews/5282453
炸鐵路、燒倉庫！外媒揭俄國低成本戰術 意圖拖垮歐洲安全體系,國際,2025/12/18 16:24,波蘭總理圖斯克（右二）於2025年11月親赴現場，視察遭蓄意破壞的鐵路設施。該起攻擊導致載有平民的列車急煞，波蘭政府指控這是俄羅斯情報單位策劃的「混合戰」行動之一，意在製造恐慌並阻斷後勤補給。（美聯社檔案照）俄羅斯對歐洲的「混合戰」威脅引發高度關注。據《美聯社》調查，自2022年烏俄戰爭爆發以來，西方官員已追蹤到至少145起疑似由俄羅斯主導的破壞事件。情報官員指出，莫斯科正採取「低成本、高消耗」策略，透過招募罪犯作為「代理人」，意在耗盡歐洲國家的安全資源並測試防線漏洞。《美聯社》資料庫顯示，歐洲的縱火與爆炸陰謀案件顯著增加，從2023年的1起增至2024年的26起，2025年迄今也已記錄到6起。這些攻擊雖然大多僅造成輕微損害，但已迫使歐洲安全體系長期處於高負荷狀態。請繼續往下閱讀...今年11月，波蘭東部一列載有500人的火車因電纜遭破壞而急煞，隨後在同一條路線上發現針對貨運列車的爆裂物。波蘭政府指控這是俄國情報單位所為，並隨即部署1萬名士兵保護關鍵基礎設施。西方情報官員分析，俄羅斯情報機構（如GRU）調整了戰術，不再頻繁動用正規特工，而是轉向招募當地罪犯或有前科的外國人執行任務。波羅的海官員指出，這種模式讓俄方能以極低成本運作，即便行動失敗，也能消耗歐洲警方的調查資源。例如在愛沙尼亞的超市縱火案中，執行者是一名從未到過該國的摩爾多瓦人；在立陶宛，一名受僱的烏克蘭人被發現試圖將裝有炸藥的「玉米罐頭」安裝在無人機上。情報分析也注意到時間點的巧合。多名歐洲情報官員表示，這波破壞行動在2024年底至2025年初曾明顯趨緩。部分官員研判，這可能是莫斯科為了向新上任的美國總統川普示好而「暫時收手」。然而，隨著局勢發展，俄方的行動如今已被評估為「恢復全速」。儘管克里姆林宮發言人佩斯科夫（Dmitry Peskov）向《美聯社》否認與這些事件有關，但歐洲官員警告，俄方的手段不斷翻新，包括利用氣象氣球從白俄羅斯向立陶宛走私物品，迫使機場關閉，持續測試歐洲的應變能力。英國倫敦警方公布監視器畫面，顯示兩名嫌犯於2024年3月涉嫌在倫敦東部縱火焚燒倉庫。西方情報官員指控，這類針對歐洲基礎設施的破壞行動，背後多由俄羅斯情報單位策劃。（美聯社檔案照）    ,https://news.ltn.com.tw/news/world/breakingnews/5282473
影片曝光！泰軍轟炸柬埔寨賭城  邊境激戰失控80萬人被迫遠離家園,國際,2025/12/18 15:46,柬埔寨班迭棉吉省（Banteay Meanchey）一名男子，無奈望著遭泰軍砲火擊中受損的民宅，牆壁上彈孔清晰可見，屋頂也被掀翻。（法新社）東南亞戰火擴大，泰國與柬埔寨的邊境衝突已波及經濟重鎮。據《法新社》報導，柬埔寨國防部18日指控，泰國軍方當天上午轟炸了兩國邊境的主要陸路通道、同時也是賭場重鎮的波貝（Poipet）。這場自本月初爆發的武裝衝突，據官方統計已造成雙方數十人死亡，並導致約80萬人流離失所。柬埔寨國防部聲明指出，泰國部隊18日上午11時左右，在班迭棉吉省（Banteay Meanchey Province）的波貝市區域投擲了2枚炸彈。波貝緊鄰泰國，是柬埔寨著名的博弈特區。截至18日下午，泰國方面尚未對此攻擊指控發表評論。請繼續往下閱讀...這波衝突始於12月7日，雙方均聲稱是為了自衛，並指責對方先挑起戰端及攻擊平民。柬埔寨內政部16日曾透露，自開戰以來，該國至少有4家賭場因泰軍襲擊受損。官員表示，這場激烈的邊境戰爭已造成泰國至少21人、柬埔寨17人死亡。更令人擔憂的是，大規模的軍事行動已導致約80萬名居民被迫逃離家園，人道危機迫在眉睫。泰柬兩國的衝突根源，來自長達800公里的邊界劃分爭議，該邊界主要沿用殖民時代的劃定，雙方對邊境上散落的古代寺廟遺跡（如柏威夏寺周邊）的主權歸屬長期僵持不下。此次波貝遭轟炸，顯示戰火已從叢林遺跡擴散至人口稠密的商業中心。    ,https://news.ltn.com.tw/news/world/breakingnews/5282359
養女成後宮還不夠！日本「1夫2妻」仙人跳 偷拍販賣性愛片百人受害,國際,2025/12/18 15:45,日本男子與妻子、養女性伴侶透過仙人跳方式，偷拍、勒索上百名女性。（示意圖）日本東京39歲男子小野洋平16日遭警方逮捕，他涉嫌夥同28歲妻子晴香以及23歲的養女兼性伴侶凜，建立一條從偷拍、販售影片到現場勒索的仙人跳產業鏈，犯罪時間長達2年，受害者超過百名女性。綜合日媒報導，根據東京警視廳調查，小野洋平等人透過販售偷拍性愛影片為生。他們在飯店房間天花板安裝外型酷似「火災煙霧偵測器」的高精密隱藏式攝影機，由小野透過社群平台誘騙女性至飯店發生性行為，全程錄影並上傳至「myfans」等成人平台牟利。請繼續往下閱讀...更令人髮指的是，當性行為結束後，其妻晴香與養女凜會算準時機闖入房間，對被害女性咆哮：「妳對我老公做了什麼！」藉此實施「仙人跳」勒索，要求高額慰撫金，最高單筆得手300萬日圓（約新台幣60萬元）。3人在過去2年多以來，一直以此手法重複作案。警方在搜查過程中，於嫌犯住處起獲超過860支淫穢影片，受害女性至少達100人。此案之所以浮出水面，源於一名10多歲少女的逃脫報警。小野洋平涉嫌於今年10月，將該名少女監禁在東京新宿區的一處公寓長達2個月。期間，他對少女施以戴項圈、沒收手機及肢體暴力等非人道對待，並威脅「逃跑就殺了妳」。據受害少女證詞，小野洋平在家中自稱「頂級大叔」，並稱晴香為「企鵝」、稱凜為「兔子」。小野甚至曾透露一項瘋狂計畫，包含要「聚集4個妻子並生子」、不准女性上學且只能在家穿女僕裝，也不准她們與其他異性發生性關係等。直到11月24日，少女趁隙逃往大阪警察局報案求助，才終結這場噩夢。東京警方26日抵達現場時，小野洋平試圖從陽台跳樓逃逸，但摔傷尾椎遭制伏。警方共查獲37支智慧型手機、3台筆電以及電擊棒、手銬、項圈等監禁證物。目前小野洋平已對所有指控供認不諱，然而其妻晴香與養女凜則選擇保持緘默。警視廳正針對龐大的受害者名單與影片流向展開進一步深入調查。    ,https://news.ltn.com.tw/news/world/breakingnews/5282337
網路熱議「1644史觀」 中國官媒：警惕歷史被工具化,國際,2025/12/18 15:38,圖為天安門廣場。（法新社）中國網路近期掀起有關「1644史觀」的論戰，中共浙江省委宣傳部發文指出，應警惕歷史被任何政治意圖或非理性情緒工具化，「1644史觀」呼應了境外某些解構中國歷史連續性的敘事，為試圖否定中國統一多民族國家歷史合法性的論述提供口實。「浙江宣傳」微信公眾號17日發表題為「警惕『1644史觀』帶亂了節奏」的文章稱，所謂「1644史觀」的核心主張包括，將1644年明朝滅亡、清軍入關視為「華夏文明的中斷」，將清朝定位為「外來殖民政權」，並全盤否定清朝歷史。請繼續往下閱讀...文章指出，需要警惕所謂的「1644史觀」，因為「1644史觀」與境外某些旨在解構中國歷史連續性的敘事形成了呼應，為那些試圖否定中國統一多民族國家歷史合法性的論述提供口實。文章又指，「外部勢力長期以來對中國歷史的曲解有險惡目的」，就是通過強調中國歷史的「斷裂性」而非「連續性」，質疑現代中國作為統一多民族國家的歷史根基，進而妄圖干涉中國內政、破壞中國統一。香港01在17日刊文表示，近期有人將中國古典四大名著之一的「紅樓夢」解讀為悼念明朝的「反清懷明」之作，引發所謂的「1644史觀」熱議。文章指出，「紅樓夢」悼明背後掀起所謂「1644史觀」，有時候是大漢族主義或狹隘的民族主義觀念作祟，急於尋找對立者，這樣容易製造矛盾，妨礙社會和諧與國家健康發展。大漢族主義、狹隘民族主義問題已經成為中國在發展過程中不能忽略的問題。    ,https://news.ltn.com.tw/news/world/breakingnews/5282331
