Title,News_Type,date,content,url
民眾黨力拚高雄議員破蛋 徐尚賢、林于凱4強棒浮出檯面,政治,2026/02/25 19:59,徐尚賢(中)曾是高雄雙罷劫負責人。（圖擷自徐尚賢臉書）民眾黨力拚2026高雄議員選舉破蛋，透過精準提名，鎖定左楠、三民、鳳山、前鎮小港等4個選區，將推出強棒人選。莊貽量(右)持續勤走基層。（圖擷自莊貽量臉書）第4選區（左營、楠梓）浮出檯面的是民眾黨前市黨部主委莊貽量，2020年曾代表民眾黨爭取高雄第3選區立委，得票率5.17%；2022年再戰左楠議員也不幸落敗，2023年則列不分區第20名，累積豐富選戰經驗。此次捲土重來，雖然中央黨部尚未正式提名，他已準備穿上擬參選人的背心跑行程；另位原想參加民眾黨海選的左營區某里長，評估後可能以無黨籍參選。林于凱(中)有柯文哲(左)、黃國昌(右)的加持。（記者葛祐豪攝）第7選區（三民）是高雄人口第二大區，民眾黨力求突圍，時代力量前議員林于凱已宣布改披民眾黨戰袍。他2022年在藍綠夾殺下，在三民區拿下近9800票，成為遺珠之憾，這幾年持續關注地方公共議題，籌組高雄市行人路權促進會，替基層勞工與小家庭發聲，有一搏實力；另位2022年曾代表時力投入第3選區（大岡山區）議員選舉的黃思學，改投入民眾黨後，原本也有意在三民區參選，經市黨部協調後，最後決定退讓。第9選區（鳳山）是高雄最大行政區， 前罷捷（黃捷）發言人、高雄雙罷劫（黃捷、許智傑）負責人徐尚賢，已加入民眾黨，表明願意出戰。屬於行動派、戰力十足的他，知名度高，2022年以無黨籍在鳳山參選市議員，拿下3800票，實力不容小覷；另有一位也正評估是否參選。第10選區（前鎮、小港）的人選是小港區港明里里長李紘毅，在地人的他，十分關注民生及外籍移工問題，但知名度不若前三人，將有一番苦戰。民眾黨高雄市黨部主委劉家榮強調，民眾黨資源有限，高雄市議員選舉是採取精準提名，再報由中央選決會做最後決定，希望2026能搶佔市議會版圖。國民黨高雄市黨部主委柯志恩本月初拋出「藍白合」的風向球，指全市有3個選區具備與友黨合作的空間，可能是民眾黨或無黨籍，外界直指這3個選區就是左楠、三民與鳳山；對此，劉家榮表示，目前是先找黨內人才，才有合的可能，雙方迄今尚未提過如何合作。    ,https://news.ltn.com.tw/news/politics/breakingnews/5351502
「美女發言人」入黃敏惠小內閣 鄭雅文任嘉義市觀光新聞處長,政治,2026/02/25 19:52,「美女發言人」鄭雅文將接任嘉市觀光新聞處長。（嘉市政府提供）嘉義市政府新任觀光新聞處長底定由曾任黃敏惠連任市長競選總部美女發言人鄭雅文接任，將於明（26）日走馬上任。鄭雅文在國外念書成長，具國際視野，及10餘年的公關實務，她強調，將著力城市行銷，讓嘉市的風格與溫度，轉化為令人嚮往的生活品牌。44歲鄭雅文小時候在南美洲阿根廷讀書成長，精通外語，中正大學傳播學系畢業，曾投身Four Seasons跨國酒店營運實務與商務推廣、拉丁美洲國際旅展（FIT）亞洲區策展暨翻譯，亦獲聘台灣高等法院與Alphatrad Spain國際翻譯機構擔任特約通譯與翻譯。請繼續往下閱讀...鄭雅文說，飯店管理與行銷營運實務，促使在地文化轉化為具國際競爭力的品牌，並擴展至跨國經貿平台進行國際拓銷與推廣；策展規劃與溝通，則扮演文化轉譯，成功締結多項跨國提案，消弭文化隔閡並建立合作共識。過去10餘年，她深耕中正大學新聞公關領域，對嘉義在地文化底蘊與城市發展脈絡有深厚理解，扮演「學術價值產業化」推手，長期站在第一線協調危機處理，建立危機預警機制與溝通體系。鄭雅文表示，她對嘉義有著深厚情感，受黃敏惠市長邀請加入市府團隊，是責任更是榮幸，期許帶著國際多維視角與公關實務，著力城市行銷，讓嘉市的風格與溫度，轉化為令人嚮往的生活品牌。    ,https://news.ltn.com.tw/news/politics/breakingnews/5351507
柯文哲未強迫新北市長選到底 黃國昌：將展現聯合政府理念,政治,2026/02/25 19:46,主持人問，為讓民眾黨不要團滅，柯文哲有要求選到底嗎？黃國昌說「沒有」。（翻攝「POP Radio聯播網 官方頻道」YouTube）民眾黨主席、新北市長參選人黃國昌今天上廣播節目《POP大國民》專訪，主持人問到，為了讓民眾黨不要「團滅」，民眾黨前主席柯文哲有要求你無論如何就是選到底嗎？黃國昌表示，他跟大家公開地講「沒有」，他與柯文哲有高度共識，今年一定要展現給台灣人民看聯合政府的理念；而他日前上別的網路節目回應藍白合若李四川出線，是否不排除加入李的團隊後，被外界傳成選假的，他回應「我覺得真的是夠了」。黃國昌在節目中提到，他與柯文哲昨晚開會討論選舉，開會到非常晚，「他（柯文哲）也非常認同我的說法」，就是2026年一定要展現給台灣人民看聯合政府的理念，這樣子良性競爭是做得出來的，在這個基礎上，才有討論未來合作的可能性，這很重要，否則的話，如果連這1局都搞得亂七八糟，大家怎麼期待未來？主持人問「所以你跟柯文哲有高度的共識？」黃國昌回說「有」。請繼續往下閱讀...主持人問及，在新北市選戰有很多不同的聲音出現，說你要加入李四川團隊？黃國昌回應，「拜託，我真的覺得台灣可不可以停止做假新聞，我已經非常的困擾了」，他說，那天接受朱凱翔的訪問，問了很多他跟李四川彼此之間的互動 、未來競爭，也問了很多假設，說如果這樣子的話，未來你是不是也不排除、是不是也願意等等，「我說當然啊，但還是要尊重當事人的意願」，大概就講了這兩句話，結果竟然有綠媒開始說黃國昌選假的、要退選了、不玩了，「我覺得真的是夠了，台灣有太多重要的事情值得我們關注，我對於目前台灣的媒體環境變成這個樣子，我只能夠說我非常的感慨，也非常的傷心」。黃國昌提到，在與李四川競爭的過程中，他一直強調，政黨可以有競爭、也可以有合作，競爭過程中「可以展現出我們的格局、我們的氣度、我們的理性，不必要搞到你死我活」，甚至用各式各樣潑糞、抹紅、抹黑方式進行選舉，這就不健康嘛。他希望這次跟李四川彼此的競爭，能夠成為一個典範，可以良性的好好競爭。    ,https://news.ltn.com.tw/news/politics/breakingnews/5351483
獨家專訪》中國抗議李登輝赴日 泉裕泰憶促成日本對台免簽,政治,2026/02/25 19:45,前日本台灣交流協會駐台代表泉裕泰今日接受本報專訪時透露，過去他擔任日本外務省中國課長時，曾遭遇中國就日本向李登輝前總統發放赴日簽證提出抗議。（記者陳鈺馥攝）日本自2005年開放台灣人赴日短期觀光免簽證政策，台灣去年高達673萬人次赴日旅遊。前日本台灣交流協會駐台代表泉裕泰今日接受本報專訪時表示，過去他擔任日本外務省中國課長時，曾遭遇中國就日本向李登輝前總統發放赴日簽證提出抗議；當時正值愛知世博會，他提議對台灣和香港旅客實施簽證免除措施，如此一來，是否單獨為李登輝發放簽證的問題便自然消失。泉裕泰擔任駐台代表期間，促進台日各項交流，在武漢肺炎期間更協助台灣能夠獲得日本捐贈疫苗。泉裕泰說，他於2019年11月赴任台灣，自進入日本外務省以來，長期從事與中國相關的工作、也參與過台灣事務，當時也是第一次在台灣工作；到任後立刻感受到台灣人民非常親切、親日。請繼續往下閱讀...不過，泉裕泰指出，他聽說部分台灣民眾心中仍有「曾被日本拋棄」或「被聯合國排除在外的世界孤兒」之感；自己認為這種心態不應持續，因此把「鼓勵台灣、讓台灣建立自信」作為自己的首要任務，並始終將「台灣認同」這四個字放在心中。另一方面，台灣每天都面對來自中國的威脅。泉裕泰認為，日本的角色是透過日美同盟，牢牢維繋美國對台灣的承諾，這兩點就是他任內的主要使命。泉裕泰憶及，剛到任不久，便有機會訪問台南，時任副總統的賴清德也在台南，賴邀請他共進晚餐，雙方交談了約2個小時，是非常美好的回憶。他也與時任美國在台協會（AIT）處長酈英傑（Brent Christensen）建立了非常密切的關係，經常就如何支援台灣進行細緻討論。泉裕泰指出，當台灣在疫苗問題上遇到困難時，曾向作為疫苗生產國的美國求助，但美方未能立即行動。他得知此事後，立即拜會當時的國家安全會議秘書長顧立雄，促成台灣方面向日本提出正式支援請求，並緊急電報東京。泉裕泰說，同時也透過其他管道向安倍前首相轉達情況，並聯絡了台灣駐日副代表蔡明耀。日本外務省迅速行動，使疫苗得以及時運抵台灣，台灣各界送來大量感謝訊息與花束，「我至今難忘的回憶」。此外，在泉裕台駐台期間，李登輝前總統辭世，之後安倍前首相遇刺身亡。他當時感覺日台關係的兩座「羅盤」相繼消失。泉裕泰透露，過去他擔任外務省中國課長時，曾遇到中國就日本向李登輝前總統發放簽證提出抗議的問題。泉裕泰提及，當時正值愛知世博會，他負責外國旅客招攬工作，於是提議對台灣與香港旅客實施簽證免除措施；如此一來，是否單獨為李登輝發放簽證的問題便自然消失。他強調，如今台灣赴日旅客一年接近700萬人次，日台之間如此良好的國民感情，正是長期交流促進的成果，「蔡英文前總統每次見面都會提醒我，日本赴台旅客人數仍偏少，我總笑著回答，『我們還欠台灣幾百萬人次呢』。蔡總統對我非常照顧，離任時授予勳章，並在總統官邸為我舉行送別晚宴」。另外，泉裕泰曾派駐中國10幾年，熟稔中共政治體制。對於派駐中國與台灣有何不同？他直指，在香港與北京學習中文，中國朋友對他非常照顧，準確地說，「我在中國大陸工作了14年多，對許多人心懷感激」。不過，中國的政治體制不同，工作中確實有不少不便，在習近平體制下，這種情況恐怕更為明顯。泉裕泰表示，他常想到2位幾乎同時代的政治人物胡耀邦與李登輝。自己與李登輝先生未曾謀面，但曾與胡耀邦先生直接會面，兩人都關心國家與人民，志在推動改革與民主化。泉裕泰認為，李登輝幾乎以無流血方式完成台灣民主轉型，奠定發展基礎；胡耀邦卻被迫下台，隨後發生六四事件，中國民主化道路被關閉。兩人命運差異，源於大陸與台灣政治土壤的不同。「我有時會設想，如果胡耀邦的改革成功，中國今日會是多麼理想的國家」。他提到在任期間，每日目睹習近平政權對台灣施加的政治、經濟與軍事壓力。泉裕泰想對台灣人民說，「只要台灣內部團結、美國國內團結、日美同盟團結這三點維持運作，台灣安全便能確保。當前日美同盟更加鞏固，美國內部雖然政治分裂，但在台灣問題上高度一致」。泉裕泰說，最擔心的是台灣內部，對訪日的台灣政治人物，自己常勸告「在安全保障問題上，朝野必須合作，不可互相掣肘」，這不僅取決於政治人物，也取決於選民與媒體的責任。    ,https://news.ltn.com.tw/news/politics/breakingnews/5351498
盧秀燕證實3月中訪美：擔心「疑美論」赴美溝通避免對國民黨誤解,政治,2026/02/25 19:42,台中市長盧秀燕今天證實，3月中將到美國東岸訪問。（資料照）台中市長盧秀燕今天證實，她將在3月中到美國東岸訪問，許多行程超過城市外交的層級，她將善盡責任，化解美方對國民黨的誤解。據了解，盧秀燕這趟訪美行，將到訪紐約、華府、波士頓，在華府期間，將會晤美國政府高層官員。請繼續往下閱讀...盧秀燕直言，「疑美論」是很不好的發展，她非常擔心，事實上她在國民黨內接觸的多數人，大家都很珍惜與美國的友誼，她相對比較資深，必須要多做一點事情，也必須有所行動。盧秀燕說，國民黨與美國有長期的關係，她也有很多美方的好朋友，這次美方願意與她對話，她當然要善盡溝通的責任，做對的事，讓美國知道國民黨多元，不是單一化，基於國家安全，基於現實需要，要支持軍購，大家的選擇是很清楚的。所以她「自動補位」，赴美善盡國民責任。盧秀燕指出，其實不只美方，對於國內的台灣人民，國民黨也不能讓大家有錯誤的印象，政治人物一定戰戰兢兢，不過她相信台灣人民，台灣人民超厲害的，他們會有所抉擇，她並不悲觀。    ,https://news.ltn.com.tw/news/politics/breakingnews/5351505
贈勳聖文森首任駐台大使 賴清德：台聖相互扶持、持續前行,政治,2026/02/25 19:32,賴清德總統今頒授聖文森及格瑞那丁駐台大使柏安卓（Andrea Clare Bowman）「大綬景星勳章」。（總統府提供）賴清德總統今頒授聖文森及格瑞那丁駐台大使柏安卓（Andrea Clare Bowman）「大綬景星勳章」，表彰其深化兩國邦誼及協助台灣拓展國際連結的卓越貢獻。柏安卓是聖文森國首位駐台大使，並擔任使節團長超過3年，總統期盼在其建立的深厚基礎上，與聖國繼續提升兩國合作關係，為彼此人民創造更多福祉，也為世界的和平繁榮做出更多貢獻。賴清德表示，誠摯感謝柏安卓大使深化台聖邦誼所做的卓越貢獻，柏安卓2019年呈遞到任國書，成為聖文森國首位駐台大使，並開設聖國在亞洲的第一座常駐大使館，這不只是雙邊關係的重要里程碑，更為兩國的長遠合作奠定穩固且深厚的基礎。請繼續往下閱讀...賴清德也感謝柏安卓超過三年來擔任使節團團長，一起見證台灣許多重要的活動和時刻，也和其他駐台大使及代表合作，與外交部共同推動多項交流計畫。同時肯定柏安卓大使以真誠的行動投入外交工作，並協助台灣拓展國際連結、深化全球夥伴關係。總統也感謝聖文森國政府長期對台灣的重視與支持，在諸多國際場域積極為台灣發聲、大力支持台灣的國際參與，正因聖國政府對民主、自由與人權等普世價值的堅定信念，兩國才能在各種挑戰中相互扶持，持續前行，期待在柏安卓大使建立的深厚基礎上，繼續提升兩國合作關係，為彼此人民創造更多福祉，也為世界的和平繁榮做出更多貢獻。柏安卓大使表示，她對獲頒「大綬景星勳章」深感榮幸，6年多前她肩負籌設聖文森及格瑞那丁駐台大使館的重任，在大家的幫助下順利完成任務，在台灣建立合法的海外家園，至今仍是聖文森國在亞洲第一個、也是唯一的使館；同時她也得以兼任駐日本及韓國非駐地大使，並對此深感自豪。柏安卓指出，台灣這個美麗而民主的國家自2019年8月8日以來，以尊嚴與效率接待聖國駐台大使館。台灣外交部慷慨協助在台聖國僑民並提供各項支持，目前在台僑民人數已達182人。外交部亦促進使館與台灣社會各界的交流。台聖兩國的願景與連結相輔相成，直接提升了海內外雙方人民的福祉；在聖文森的台聖兩國人民每天也都能感受到這份友誼所展現的善意與成果。柏安卓提到，最具影響力的外交政策莫過於讓兩國人民建立相互同理與尊重的關係，正因有中華民國（台灣）政府與人民的接納，聖國大使館才能為這份深厚的盟誼奠定基礎。在即將告別台灣這個她深愛的海外家園之際，要由衷對兩國即將邁入45年且從未間斷的邦誼表達誠摯感謝，也很榮幸自2022年10月以來擔任駐台使節團團長。使節團象徵並代表台灣的主權，這份主權必須被保護，不僅是為了台灣人民，也是為了在全球情勢日益緊張下，所有發展中的島嶼國家。    ,https://news.ltn.com.tw/news/politics/breakingnews/5351432
美台共同繁榮！谷立言會晤潘孟安 聚焦「打造緊密夥伴關係」,政治,2026/02/25 19:29,美國在台協會（AIT）處長谷立言今晚在臉書發文透露，他與總統府秘書長潘孟安已會面，並就「台美共同繁榮」及「打造緊密夥伴關係」等議題交流。（擷取自臉書）美國在台協會（AIT）處長谷立言（Raymond Greene）今晚在臉書發文，透露他與總統府秘書長潘孟安會面，並就「台美共同繁榮」及「打造緊密夥伴關係」等議題交流；潘還特別致贈一把刻有谷立言肖像、展現台灣在地工藝的「恆春月琴」，象徵台美之間不僅有堅實的政治合作，更有溫暖的文化連結。谷立言在臉書以中英文雙語表示，他很高興能與潘孟安會面，討論如何進一步推動美台共同繁榮及打造緊密夥伴關係等議題。他也深感榮幸能收到潘致贈的一份別具新意的禮物，是一把由恆春工匠精心雕刻製作的月琴，手藝與心意兼具，展現台灣的溫暖與精神（Taiwan's warmth and spirit）。請繼續往下閱讀...值得注意的是，這把月琴的琴面上細緻地刻劃了谷立言戴著眼鏡、面帶笑容的肖像，並寫上「台美情誼堅若磐石，共創繁榮永固盟」，潘孟安將家鄉極具代表性的文化瑰寶當作禮物，格外用心。潘孟安也隨即在貼文下留言互動，重申「台美友誼長存，攜手共創和平繁榮與穩定」。    ,https://news.ltn.com.tw/news/politics/breakingnews/5351463
竹北天坑案遭求處逾10年徒刑 楊文科喊冤：我若違法怎會主動移送？,政治,2026/02/25 19:09,新竹縣長楊文科（左2）步出法院後受訪。（記者廖雪茹攝）竹北「豐采520」建案在施工期間釀5次道路坍塌，「天坑」事件引發全國矚目，新竹縣長楊文科等官、商、技師共8人，被新竹地檢署分依貪污治罪條例違反復工圖利等罪嫌起訴。新竹地院歷經1年9個月的審理，今天言詞辯論終結，公訴人對楊文科求處10年以上徒刑，並請求加重量刑；楊文科強調自己「無罪」，律師團請求法官依證據法則審判。公訴人在庭上表示，公務員或是建商都應以最低標準依法行事，但回顧本案卻一路都是以豐邑集團意見為意見，從未尊重或依據法律規定行事。「豐采520」建案一開始就沒有結構外審圖面施工、任意抽換圖面施工，未經專業人員簽證，後來本案應該做百貨竟然調整成住宅出售。經過關說過程，後來不用環評，也沒有依照環評跟住戶承諾，視法律為無物。請繼續往下閱讀...公訴人指控，本案發生多次道路坍塌、偷施工等情事，一再製造公共危險。3次坍塌後鑑定人告知結構計算書與圖面不符，豐邑高層讓鑑定技師拖延，還使公務員在無法抗拒上級長官壓力之下違法復工，甚至在檢察官介入後還偽造日誌、契約，規避調查，後來再發生第四次坍塌，「足見豐邑能夠控制縣長、施壓基層公務員，犯行明確」。公訴人強調，楊文科等人犯後態度不佳，在法院審理時一再抗拒、沒有認罪，因此就前開犯行都應該加重處分，否則無法警惕被告，避免日後類似情形再發生，造成社區居民安全的危害。楊文科在庭上陳述意見時表示，他今年70多歲，奉公守法。對於檢方指稱他與豐邑公司之間存在不當私交，這是他最難以接受的羞辱。「我在此鄭重聲明，我與該公司的負責人或相關人員，除了公務上的往來，私下完全沒有任何交情，更沒有任何不正當的往來」。檢方僅憑幾次公務場合的接觸或片面的通訊記錄，就試圖編織出所謂的私交與圖利，這不僅是對他人格的毀謗，更是對事實的嚴重扭曲。楊文科說，當豐邑520建地塌陷時，他展現最大的誠信與擔當去處理問題，並主動將全案移送檢察署偵辦，「殊不知，不移送還好，一移送，檢調竟然回過頭來對我們進行大規模搜索、羈押，甚至起訴。這在邏輯上何其荒謬？如果我與廠商有私交、如果我有違法勾當，我怎麼可能主動將案件送交司法機關審查？」這種「主動求真相，卻換來羅織構陷」的處境，實在令人遺憾。楊文科說，檢方僅憑片面的臆測與拼湊的對話，就將正常的行政溝通抹黑為違法關說。往後還有哪位公務員敢依法任事？造成「多做多錯」的寒蟬效應。楊文科強調，「我沒有罪」，他的一生清譽，請求合議庭，能洞悉這場起訴背後的偏頗與空洞，還給他一個遲來的公道，更還給新竹縣政府公務體系應有的清白與尊嚴。竹北「豐采520」建案施工期間釀5次道路坍塌，「天坑」事件引發全國矚目。（資料照）    ,https://news.ltn.com.tw/news/politics/breakingnews/5351448
李貞秀造成民眾黨極大困擾？ 陳培瑜爆：許多白營人士私下抱怨,政治,2026/02/25 18:34,民進黨立委陳培瑜質詢時質疑民眾黨立委李貞秀的國籍與忠誠問題，李貞秀高舉「敬請遵守中華民國憲法」紙張抗議。（資料照，廖振輝攝）立法院新會期昨（24日）開議，民進黨立委陳培瑜因拒稱中配李貞秀為「委員」而遭舉牌抗議，數度要求發言時間暫停。陳培瑜今日強調，全世界沒有任何一個民主國家，會允許沒有放棄國籍、沒有國家忠誠的敵對國家人士，來擔任國會議員。她還爆料，聽到許多白營人士私下抱怨，李貞秀惹出的爭議，已經造成黨內很大困擾。陳培瑜今日在臉書發文表示，關於李貞秀的爭議，她要再次強調，全世界沒有任何一個民主國家，會允許沒有放棄國籍、沒有國家忠誠的敵對國家人士，來擔任國會議員。包含德國、韓國、以色列，都是如此。更何況，回到台灣的法規層面，李貞秀就是有違法疑慮，而且一直無法提出清楚的說明。請繼續往下閱讀...陳培瑜引述《兩岸人民關係條例》規定指出，李貞秀確實不符參選資格。此外，《國籍法》也規定不允許雙重國籍，針對放棄中國國籍一事，李貞秀卻只說中國不受理，就想矇混過關。身為人民公僕，李貞秀應當做好表率，把戶籍與國籍爭議處理完善後，再就任立委。但是，她不僅毫不理會我國的法制程序，昨天更多次干擾議事。「這樣的人，真的適任立法委員嗎？」陳培瑜透露，最近聽到許多白營人士私下抱怨，李貞秀惹出的爭議，已經造成黨內很大困擾。她想提醒民眾黨，《公職人員選舉罷免法》第73條規定，只要李貞秀喪失黨籍，就喪失不分區立委資格，由同黨候選人名單依序遞補。「民眾黨不妨考慮一下我的建議，只要李貞秀喪失黨籍，這些煩惱就都沒有了。」    ,https://news.ltn.com.tw/news/politics/breakingnews/5351318
