Title,News_Type,date,content,url
輝達進駐北士科》批蔣萬安守著爭議合約不作為 北市議員提3解方,政治,2025/10/02 15:48,台北市議員陳賢蔚認為蔣萬安不應守著一份爭議合約，消極不作為。（取自陳賢蔚臉書）輝達落腳台北北投士林科技園區（北士科）新光人壽T17、T18基地卡關！台北市議員陳賢蔚表示，蔣萬安若只用「依法行政」當擋箭牌，除了講「依約興建再移轉」或「合意解約重簽」兩方案，再無積極作為，恐造成輝達放棄進駐台北市；他認為市府不應死守著一份有爭議的合約消極不作為，可以委託公正第三方釐清合理解約金額、或依議會調查報告提出解約訴訟，甚而在公開透明的前提下，同意新壽契約移轉給輝達。輝達與新壽的MOU在9月30日到期，傳出目前卡關在土地3方無共識；輝達希望取得基地完整使用權並自行興建總部，新壽希望直接移轉契約權利給輝達，市府擔心有圖利新壽之嫌、不考慮，而是希望與新壽合意解約，再重新設定地上權給輝達。但新壽期待的解約金與市府願意提供的金額落差高達100億，無法達成共識。請繼續往下閱讀...陳賢蔚認為，蔣萬安除了講「依約興建再移轉」或「合意解約重簽」兩方案，再無積極作為；若只用「依法行政」當擋箭牌而不提出解套方案，恐會因市府的無能作為，造成全民期待的國際AI科技龍頭企業放棄進駐台北市。陳賢蔚說，檢視新壽取得T17、T18地上權的過程，台北市議會2024年9月完成的調查專案報告結論指出，前朝柯市府於短短5個月內召開5場決策會議，一再放寬招標條件，已不符科技園區政策目標，並有諸多行政缺失及疑義，新壽取得地上權，並非對北士科及台北市最好的發展，而是柯市府爭議行政下的結果。陳賢蔚指出，新壽取得地上權的爭議正由檢調等機關調查釐清中，蔣萬安卻守著一份爭議合約，消極不作為。北市府應展現決斷力，從三方向著手。方案一：委託公正第三方釐清公平合理的解約金額，確保雙方權益。方案二：北市府依議會報告提出解約訴訟，避免延宕北士科後續開發期程。方案三：在相關權利義務及獲利公開透明的前提下，同意新壽契約移轉予輝達，符合市民期待輝達進駐，更可避免公共資產淪為新壽炒地皮獲利之用。陳賢蔚表示，蔣萬安若以上三方案都不願積極與新壽談判，放任新壽以充滿爭議所取得的契約為由，斷送國際AI科技龍頭企業輝達進駐。不免讓人質疑，蔣萬安是否基於藍白合作之政治盤算，放水給柯市府友好財團。北市府應堅持公共利益優先，強勢介入協調、整合三方歧見，讓輝達順利落腳北士科，才是全體市民期待。熱門賽事、球星動態不漏接    ,https://news.ltn.com.tw/news/politics/breakingnews/5198374
黃國昌養狗仔爭議資金哪來?  劉世芳: 有人提告檢調單位已介入查察,政治,2025/10/02 15:43,民眾黨主席黃國昌遭爆成立凱思國際公司養狗仔集團跟監，公司背後龐大金流疑有港資涉入。內政部長劉世芳今天在行政院會後記者會表示，已有媒體提告，如果有人提告，檢調單位就會介入查察，是否有僑外資介入，就會啓動檢調系統來查察。（行政院提供）民眾黨主席黃國昌遭爆成立凱思國際公司養狗仔集團跟監，公司背後龐大金流疑有港資涉入。內政部長劉世芳今天在行政院會後記者會表示，已有媒體提告，如果有人提告，檢調單位就會介入查察，是否有僑外資介入就會啓動檢調系統來查察。凱思國際公司背後龐大金流疑有港資涉入，對此，經濟部9月30日表示，查閱該公司的商工登記資料無僑外資，但具體的狀況須再釐清才能說明。請繼續往下閱讀...經濟部次長賴建信今天表示，據經濟部了解，公司的資本額沒有達到5億元，登記窗口是在台北市商業處。若是有具體的事證，涉及僑外資，經濟部商發署可發函，請公司主動揭露相關的數據。黃國昌被爆指揮狗仔集團行動，透過任職於《中央社》主跑北檢的S姓記者（謝幸恩）召集組成狗仔集團跟監政敵。《中央社》昨（1）日表示，已赴北檢對謝幸恩提起背信等罪之刑事告訴，後續並將針對其侵害名譽一事，提起相關之民事訴訟。劉世芳補充說，也有其他媒體詢問是否有檢調會介入，據她瞭解，已有媒體提告，如果提告，檢調單位就會介入查察，屆時對於是否港外資或是僑外資介入的話，就會啓動檢調查察。熱門賽事、球星動態不漏接    ,https://news.ltn.com.tw/news/politics/breakingnews/5198344
外交部2025雙十國慶影片曝光 13語描繪「堅韌的台灣」,政治,2025/10/02 15:42,外交部2025雙十國慶影片「堅韌的台灣」分別以13種語文版本描繪我國過去一年以來各領域豐碩成果。（外交部提供）為慶祝2025年雙十國慶，外交部今（2）日發表「堅韌的台灣」國慶影片，以13種語文版本，凸顯我國過去一年在運動賽事、智慧科技、多元文化及國防外交等領域豐碩成果。外交部今天說明，國慶影片全長約4分半，共製作中、英、西、越、泰等13種語文版，內容凸顯我國在過去一年運動賽事、智慧科技、永續發展、多元文化及國防外交等領域的豐碩成果。請繼續往下閱讀...外交部指出，藉此影片呈現台灣堅韌團結、不畏挑戰的精神，也積極呼應總統賴清德上任週年談話所勾勒的願景與期許，盼國人面對未來機會和挑戰，繼續堅持團結，「迎風轉型，穩健前行」。影片首先以我國自然風光與人文景緻揭開序幕，接著在運動主題中，透過台灣選手在國際賽事勇奪佳績的經典畫面，如世界12強棒球賽冠軍、世界少棒錦標賽冠軍及世運會女子拔河六連霸等榮耀時刻，也以賴清德「我們都是同一個隊，都是Team Taiwan」的理念，傳達國人在體育賽事的團結合作，讓世界看見台灣的實力與形象。科技主題則呈現台灣在全球高科技產業的核心地位與豐沛的創新能量，藉由半導體晶片、智慧農業、醫療科技、量子電腦等領域發展，強調台灣作為「AI科技島」的關鍵位置，將持續在全球產業鏈中扮演不可或缺的角色。永續發展主題聚焦於我國綠色轉型，以太陽能、離岸風電、海洋廢棄物回收再製等減碳行動，展現台灣致力於淨零轉型並與國際接軌的努力，以及落實與大自然永續共生的理念。文化主題中精選台灣宗教民俗慶典、表演藝術、創意展演、經典美食、國寶文物、匠人技藝等元素，勾勒出我國兼容並蓄的文化底蘊，邀請世界走進台灣，共同探索台灣的美好。國防外交主題則凸顯我國維護國家安全與拓展國際連結的決心，並以海鯤號、基隆級飛彈驅逐艦與漢光演習等畫面，彰顯我國致力加強國防自主與捍衛主權的意志，以及持續強化「全社會防衛韌性」的努力。同時，影片也收錄賴總統出訪友邦、政府團隊進行國際交流，以及全球友人支持台灣的國際參與、友邦為我執言，包括反駁中國曲解聯大2758號決議文等重要畫面，呈現國際社會肯定台灣貢獻，以及堅定支持台海和平穩定等客觀事實。影片以號召全民一心，繼續團結打拼的「台灣精神」總結，除了與全球友人分享「Team Taiwan」的榮耀，也向國際傳達「讓台灣成為世界之光」的期許。熱門賽事、球星動態不漏接    ,https://news.ltn.com.tw/news/politics/breakingnews/5198366
Motocycles?! 公館圓環號誌英文拼錯 民進黨：蔣萬安市府螺絲有多鬆？,政治,2025/10/02 15:31,台北市政府拆除公館圓環改正交路口，衍生交通亂象。（資料照）台北市政府拆公館圓環改正交路口，衍生交通亂象。民進黨今（2日）直指，公館圓環倉促拆除，連交通號誌英文也拼錯，把「Motorcycles」寫成少了一個r的「Motocycles」，台北市長蔣萬安螺絲到底有多鬆？民進黨今天在臉書撰文表示，蔣萬安先前不顧市民及學生反彈，一意孤行強拆公館圓環、填平公車專用地下道，結果導致了大塞車，讓機車族曝曬在烈日下，塞車塞到天荒地老。請繼續往下閱讀...民進黨說，從一開始的規劃粗糙、溝通不足，到施工過程倉促草率，如今連交通號誌英文都能拼錯，把「Motorcycles」寫成少了一個r的「Motocycles」，請問蔣萬安所帶領的台北市政府，螺絲到底要多鬆？還是這次也要通通把一切的錯都怪給廠商？熱門賽事、球星動態不漏接    ,https://news.ltn.com.tw/news/politics/breakingnews/5198354
韓傅訪日遭中常委質疑 朱立倫：國民黨友日是堅定立場,政治,2025/10/02 15:20,國民黨主席朱立倫。（資料照，記者張嘉明攝）上個月在中國共產黨與國民黨分別舉辦抗戰勝利與台灣光復紀念活動的前後，立法院國民黨團總召傅崐萁、立法院長韓國瑜曾先後率領龐大訪問團赴日本訪問，時隔近1個月後，國民黨中常委何鷹鹭昨日砲轟，當年就是日本侵略中國，國、共兩黨合作抗日，某些人卻帶團跑去日本，「到底什麼意思啊！」。國民黨主席朱立倫今日下午出席該黨立法實務研討會時受訪表示，國民黨的路線一向就是親美、友日、和陸，雖然黨內一定會有不同的聲音，但國民黨仍會堅定支持台日密切交流。朱立倫說，友日是堅定立場，而且國民黨向來與日本保持互動密切，這段期間以來不管是日本國會議員或日方重要人士都有來訪問國民黨，韓國瑜日前訪日非常成功，這就是國民黨的堅定立場，雖然黨內一定會有不同的聲音，但仍會堅定支持台日之間的密切交流。請繼續往下閱讀...針對立法院展開新的會期，朱立倫表示，經過大罷免的分擾，所有民眾都希望朝野和諧，可以針對民生重要法案進行推動，國民黨最重視民生議題，所以希望民進黨可以放下鬥爭的本質，好好為民眾的福祉思考，大家一起推動法案與預算。朱立倫即將於11月1日卸下黨魁職務，媒體詢問是否有離情依依的感覺，他說，自己永遠是國民黨員，過去一直與國民黨立委同志一起打拚，而且已經拚了4年，這個成果屬於全體立委與縣市長、黨務工作同仁。熱門賽事、球星動態不漏接    ,https://news.ltn.com.tw/news/politics/breakingnews/5198174
內政部防詐獎勵新辦法 檢舉詐欺犯罪「最高獎金千萬」,政治,2025/10/02 15:18,刑事局。（記者邱俊福攝）內政部本月1日公布「防制詐欺犯罪有功人員及檢舉人獎勵辦法」，明確規範檢舉詐欺犯罪的獎勵制度，凡檢舉人符合辦法所定要件，其所檢舉的詐欺案件經法院判決3年以上有期徒刑之罪者，將先依基準表所定金額核發1/3獎金，於有罪判決確定後，再行發給其餘獎金，合計最高可領取新台幣1000萬元檢舉獎金；刑事警察局表示，此能鼓勵全民投入防詐工作，強化社會共同打擊詐欺的力量。刑事局進一步說明，另依規定，檢舉人須於犯罪未被發覺前，親自向具有偵查權的檢察機關或司法警察機關提出檢舉，並製作檢舉筆錄，其所檢舉的犯罪必須經法院判決3年以上有期徒刑之罪，方可獲得獎勵；至於被害人就自身被害事實檢舉、匿名或拒絕製作筆錄者，以及涉及共同犯罪、教唆或幫助他人犯罪者，均不在獎勵範圍內。請繼續往下閱讀...刑事局表示，近來詐欺案件數與財損雖呈下降趨勢，但危害仍不容忽視，透過檢舉獎金制度，可望提高民眾檢舉誘因，吸引更多社會力量投入，共同築起防制詐欺的堅實防線，而將持續與各行政機關、地方政府及民間團體合作，落實獎勵措施，守護民眾財產安全。相關辦法條文可至行政院公報資訊網查詢。熱門賽事、球星動態不漏接    ,https://news.ltn.com.tw/news/politics/breakingnews/5198305
丹娜絲特別預算》政院加碼200億處理堰塞湖 傅崐萁：要看誠意再考慮,政治,2025/10/02 15:18,行政院院會今通過增加丹娜絲特別條例預算200億，處理這次風災花蓮光復鄉堰塞湖的問題。國民黨團總召傅崐萁（見圖）表示，要先看行政院長卓榮泰是否有確定的誠意。（記者王藝菘攝）行政院院會今通過增加丹娜絲特別條例預算200億（原600億），處理這次風災花蓮光復鄉堰塞湖的問題。國民黨團總召傅崐萁表示，國民黨團有自己重建的版本，要先看行政院長卓榮泰是否有確定的誠意，納入堰塞湖善後工作。傅崐萁說，每個地方的受損程度不同，是否能夠一體適用在同一個條例裡，國民黨團還要再研究。基本上國民黨團會有自己的條例，但行政院願意把光復災損的情況都納入，我們可以考慮在丹娜絲重建條例的600億裡面再加入200億，成為800億。請繼續往下閱讀...傅崐萁指出，針對堰塞湖災情一事，卓榮泰既然要查明真相，要貫徹究責，國民黨團表達高度支持，但必須公平、公正、公開，不可以徇私，不能像過去民進黨的弊案，再怎麼查都查不出來，都以沒有疏失為終結。民進黨的司法檢察體系是不是能夠接受人民的考驗，我們高度期待。傅崐萁強調，這麼嚴重的疏失，造成人民的損失和重大傷害，必須要啟動國賠，還有整個善後條例也必須跟人民講清楚說明白；對於沒有啟動海嘯警報，還有開口堤沒有補起來等問題，要求行政院必須查清楚、說明白。熱門賽事、球星動態不漏接    ,https://news.ltn.com.tw/news/politics/breakingnews/5198219
砸錢包裝自己不讓孩子免費吃營養午餐 市議員陳淑華狠批盧秀燕,政治,2025/10/02 15:12,民進黨議員陳淑華（右）批台中市行銷活動到處都可看到盧秀燕的照片。（記者蘇金鳳攝）日前有議員質疑台中市宣傳國慶晚會，在中捷綠線捷運貼上市長盧秀燕肖像，民進黨議員陳淑華今天在市議會痛批，每個縣市政府包括中央政府都會做宣傳，但是台中市各種活動都會看到市長盧秀燕的肖像，用公帑包裝個人，當作是私款使用，還把手伸到學校利用LED電子看板跟電視牆宣傳，批盧秀燕寧可砸錢來包裝自己，就是不肯免費讓孩子吃營養午餐。盧秀燕表示，市長本來就是城市代言人，從以前便如此，很樂意來為市政宣傳，很樂意被利用，台南燈會就會看到市長黃偉哲的代言。請繼續往下閱讀...陳淑華今天在市議會一一秀出盧秀燕在各項市政行銷照片，坐公車看到盧秀燕；到外縣市也看到盧秀燕；在捷運綠線站體照樣看到盧秀燕；坐個觀光巴士還是看盧秀燕；活動中心依舊盧秀燕；市場買個菜盧秀燕；坐個電梯我還是要看盧秀燕；國慶晚會宣傳在捷運車廂裡又是盧秀燕。陳淑華不滿的表示，盧秀燕無所不在，連校園也不放過，在學校也要看到盧秀燕，教育局公告很清楚，依照新聞局的公文要求各個學校利用LED電子看板跟電視牆等平台來播送宣傳盧秀燕的政績，不是說校園行政中立嗎？教育設備卻變成盧秀燕宣傳工具 ，盧秀燕寧可砸錢來包裝自己，就是不肯免費營養午餐。陳淑華痛批，各種市政行銷都有盧秀燕的照片，擺明就是在對市民洗腦，把宣傳的手伸進學校裡頭對幼兒、學童、青少年洗腦，民主社會卻非常的威權作為，到處亂花錢，有錢可以為盧秀燕擦脂抹粉，卻堅決不願照顧學生免費營養午餐。市長盧秀燕強調，市長是城市代言人。（記者蘇金鳳攝）熱門賽事、球星動態不漏接    ,https://news.ltn.com.tw/news/politics/breakingnews/5198177
揭國民黨主席選舉「難題」 小笠原：只有1人試圖面對九二共識,政治,2025/10/02 15:00,"日本政治學者小笠原欣幸。（資料照）國民黨主席選舉將於10月18日舉行。針對此次選舉中各候選人的兩岸政策立場，日本知名政治學者小笠原欣幸在臉書發文，分析三位被看好的候選人對「九二共識」的態度，直言「只有郝龍斌試圖面對問題」，他也指出，儘管國民黨將九二共識定義為「一中各表」，中國共產黨則堅持「一中原則」，這正是國民黨目前面臨的根本難題。小笠原今日在臉書發文指出，此次共有6位候選人登記參選，不過根據多數台媒報導，目前較被看好的為前台北市長郝龍斌、前立委鄭麗文，以及現任立委羅智強。他也特別為不熟悉台灣政局的日本讀者，引述媒體報導內容，分析三人對「九二共識」的立場與認同論述。請繼續往下閱讀...小笠原分析，郝龍斌主張「九二共識、一中各表」是過去兩岸對話的基礎與「通關密語」，但目前兩岸關係兵凶戰危。他強調「和中不舔共」，對話前提應是對岸釋出善意、尊重中華民國存在。他也指出，九二共識不等於「一國兩制」，並呼籲民進黨政府，凡是有助於「維持現狀」的作為應多做，反之應避免。鄭麗文則認為，九二共識本身並無問題，問題在於民進黨不承認並「步步進逼」，在「中華民國招牌下遂行台獨野心」。她主張必須在九二共識基礎上重啟對話與合作，以建立穩固的和平基礎，至於最終兩岸政治安排為何，應由雙方共同決定與接受。羅智強則以「我是台灣人、中國人為榮」為論述主軸，強調中華民國憲法體現「一中憲法」，而這個「一中」指的是中華民國。他認為，九二共識的特點是「創意模糊」，既沒談統，也沒談獨，彼此對「中國」的定義不同，兩岸之間未來政治安排是走向統一，或走向不統一，那是漫長的過程。然而，小笠原指出，儘管國民黨將九二共識定義為「一中各表」，中國共產黨則堅持「一中原則」，而且隨著習近平上台後，對「九二共識」的解釋趨於緊縮。2019年，習近平明言「九二共識就是一國兩制」，等同消滅中華民國，讓原本存在的模糊空間幾乎消失，國民黨內張亞中、洪秀柱也都提出同樣的觀點。小笠原直言，這正是國民黨目前面臨的根本難題。根據歷年民調，台灣社會多數傾向維持現狀或支持「各表」，支持統一的比例極低，而「九二共識」在台灣民意中的支持度也因此逐年下降。他分析三位候選人的說法後認為，只有郝龍斌試圖正視並回應這個問題。相比之下，鄭麗文雖強調九二共識，但多回顧馬英九時期成就，未談及其內涵的變化；羅智強則展現出一定的認知，但在公開論述中似乎刻意淡化其中矛盾。熱門賽事、球星動態不漏接    ",https://news.ltn.com.tw/news/politics/breakingnews/5198282
禁伐補償金提高至6萬元 原民會今如數撥付地方政府,政治,2025/10/02 14:55,今年度原住民保留地禁伐補償金，原民會今日撥付地方政府發放，以守護山林並保障族人權益。（原民會提供）自今（2025）年起，原住民保留地禁伐補償金，由每公頃新台幣3萬元提高至6萬元，原住民族委員會今（2）日表示，今年的原住民保留地禁伐補償金，今日如數撥付地方政府，以守護山林並保障族人權益。原民會表示，依法行政是法治國家行政權利的重要原則，去年11月行政院長卓榮泰與立法院朝野黨團會商，辦理追加預算予以支應，原民會積極協調行政院主計總處籌編相關經費，共追加經費計23億餘元。請繼續往下閱讀...原民會統計，截至今年9月底止，已有超過5.2萬名族人完成申請，合格面積約8.3萬公頃，補償金額約49.8億元，原民會表示，今日如數撥付地方政府，落實公務機關依法行政紀律、積極保障族人權益的使命，讓族人生計獲得穩固支持。原民會主委曾智勇Ljaucu‧Zingrur指出，禁伐補償政策是權益保障與自然保育並行的重要措施。未來將持續精進相關制度設計，積極傾聽部落心聲，確保執行效能持續提升，此政策也象徵政府與部落共同守護山林的決心，讓族人在傳統領域中能穩定生活並延續文化。熱門賽事、球星動態不漏接    ,https://news.ltn.com.tw/news/politics/breakingnews/5198257
爭取出戰2026台北市長 吳怡農：盼多關注花蓮災後重建,政治,2025/10/02 14:53,壯闊台灣聯盟創辦人吳怡農。（資料照）民進黨2026選舉對策委員會昨盤點各縣市首長戰將，傳出壯闊台灣聯盟創辦人吳怡農表達意願，爭取參選台北市長。對此，吳今（2）日證實，他確實會爭取服務市民的機會，但建議選對會斟酌是否趕在年底前完成提名，也希望社會多關注花蓮災後重建。民進黨選對會昨天下午召開第3次會議，會中廣泛討論各選區潛在人選。對於戰況未明的台北市，與會者向本報表示，吳怡農曾表達意願，希望能被列入討論；也有選對會成員提及，苗博雅雖非民進黨籍，但先前在立委選舉曾經合作過，也算是向社會取才，後續都還要再確認意願、進一步討論，未達協商階段。請繼續往下閱讀...對此，吳怡農今透過媒體群組說明，他確實會爭取機會服務市民，也相信社會需要翻過烏煙瘴氣政治的一頁。不過，將持續建議選對會再斟酌，是否需要趕在年底前完成提名。距離投票還有1年多，以台北市的情況來看，沒有必要急著啟動選舉。吳怡農強調，目前花蓮仍在災後復原階段，壯闊台灣的團隊與志工夥伴正持續投入重建與援助工作。我也希望社會能夠多關注災區基礎建設的修復、居民心靈的安定，以及更完善的防災準備，避免類似的災害再次發生，相信這些才是此刻大家最掛心的事情。熱門賽事、球星動態不漏接    ,https://news.ltn.com.tw/news/politics/breakingnews/5198287
桃園市議會通過普發現金1.5萬元  要求市府研議,政治,2025/10/02 14:51,桃園市議會臨時會通過普發現金1.5萬元提案。（記者謝武雄攝）桃園市議會臨時會今閉會，民進黨議員魏筠提案市府普發1萬5000元，國民黨議員詹江村提議研議適法性、待台南、高雄通發放後再跟進，議員林政賢要求爭取中央全額補助，議員舒翠玲認為只要中央不刁難一般性補助款及計畫性補助款，市府可考慮發放，最後主席議長邱奕勝徵詢在場議員意見後，通過魏筠等議員提案及附帶條件，建請市府研議。魏筠表示，市長張善政上任後，桃園獲中央超徵稅額約67億元、另桃園去年的「稅課收入」超徵47億元，「罰款及賠償收入」超收11億元、「規費收入」超收約5億元，前兩年市府標售土地230億元等金額足可支應235萬位市民普發現金1萬5000元。請繼續往下閱讀...魏筠說，7月11日立法院通過「普發現金1萬元」提案，「還稅於民」已經成為主流民意，故提案請市府研議推動普發現金1萬5000元，桃園市約235萬人，所需金額約350億元，也提供經費來源，希望市府能夠配合中央普發現金，讓市民每人可以領到2萬5000元。詹江村則要求考量適法性問題，不要為了發錢坐牢，最好等台南、高雄發放後再跟進，林政賢也認為桃園升格後歲入歲出累積短絀達740億元，已經沒有能力普發，建請爭取中央全額補助；舒翠玲認為只要中央一般性補助款及計畫性補助款正常發放不刁難，市府可以研議發放。議員于北辰也打圓場認為，沒有議員會反對普發現場，只是考量財源的問題，請市府研議，最後議會通過魏筠提案，並加上三位議員附帶決議，請市府研議。財政局長歐美鐶表示，「稅課收入」、「罰款及賠償收入」、「規費收入」、中央超徵補助只是歲入預算的一部分，去年總決算歲入審定數只較預算數多出1.88億元，年度歲入、歲出仍短絀56億元，也是全國22縣市唯一短絀的縣市。地政局長蔡金鐘說，賣地所得還是要償還開發金額，以航空城為例，目前已經賣了358億元抵費地，但向銀行借了7、8百億元，目前航空城還是負債。熱門賽事、球星動態不漏接    ,https://news.ltn.com.tw/news/politics/breakingnews/5198214
