Title,News_Type,date,content,url
台中驚傳7旬翁墜樓 送醫急救宣告不治,社會,2026/03/29 18:03,台中太平一名彭姓老翁，今天下午從住處頂樓墜樓，雖送醫急救仍不治。（記者陳建志攝）台中太平新平路一段，今天下午2點多，驚傳一名彭姓老翁（74歲）從住處9樓頂墜落地面，消防人員獲報趕至現場已經沒有呼吸心跳，雖立刻送醫仍不治。警方初步調查並無外力介入，詳細死因將報請台中地檢署檢察官相驗釐清。台中市消防局今天下午2點52分接獲報案，指稱太平區新平路一段有民眾疑似從高處墜落，倒臥地上沒有反應，獲報後立即派遣太平分隊及赫力高救隊、出動2車4人前往救護，抵達時發現彭姓老翁（74歲）已經沒有呼吸心跳，給予急救處置後，送往國軍台中總醫院急救。請繼續往下閱讀...彭姓老翁經急救仍宣告不治，警方初步調查，彭男是從住處9樓的頂樓墜樓，家屬表示老翁疾病纏身，經鑑識採證並未發現外力介入，詳細死因已報請台中地檢署檢察官相驗釐清。    ,https://news.ltn.com.tw/news/society/breakingnews/5386611
妻子拿掉孩子竟問前男友「有心疼過嗎？」 高雄男才驚覺被綠了,社會,2026/03/29 17:59,人妻拿掉孩子竟先問前任：有心疼過嗎？人夫崩潰向妻子前任提告求償。圖非當事人。（情境照）高雄陳姓女子婚後於去年2月懷孕，但堅持要拿掉孩子，術後竟發簡訊給前任男友「你有了解過我的不安嗎？」、「你有心疼過嗎？」丈夫發現後，驚覺引產的孩子可能不是他的！向前任李男求償50萬元，法院判賠40萬元，可上訴。判決指出，陳男主張，他和妻子陳女結婚前，妻與李男曾為男女朋友，但婚後仍未與李男斷乾淨；去年2月間，妻子察覺懷孕，但堅持不想將孩子生下來，到婦產科診所做人工流產。請繼續往下閱讀...事後陳男發現妻子手機與李男互動曖昧，妻子引產後還傳訊給李男「你有了解過我的不安嗎，你知道我拿掉小孩心裡有多難受嗎？」、「他看到我吃術後的藥一臉心疼，你有心疼過嗎？」才驚覺拿掉的孩子可能不是他的，向法院提告求償50萬元，並藉此釐清真相。李男辯稱在陳女離婚後兩人就沒聯繫，兩人只是普通朋友，但法官檢視雙方互傳的曖昧訊息，不僅互相分享目前行蹤，還互傳「你忙不忙我都想跟你一起睡，但不是為了幹嘛才跟你睡」、「在台中的時候很好，我感覺你那時候也沒有拘束，你敢直接牽我的手在路邊走，那時候我才覺得我們真的像情侶」。陳女並將拿掉小孩的心情告訴李男，且將陳男的反應與李男反應對比，陳女離婚後，和李男多次出國，認定李侵害原告配偶權，判李男應賠償40萬元。    ,https://news.ltn.com.tw/news/society/breakingnews/5386602
女子彰化王功大排落水 送醫鬼門關前救回一命,社會,2026/03/29 17:59,女子落水後被發現，一度OHCA，經搶救回後恢復心跳。（民眾提供）彰化縣芳苑鄉王功大排水溝有1名女子落水，海巡署王功安檢所派員攜帶救生裝備趕赴現場，同步通報彰化縣警局芳苑分局及彰化縣消防局第四大隊啟動聯合救援，將女子救起，現場急救後，再送醫搶救。昨天16時20分左右，海巡人員先抵達現場，發現該名女子已漂浮於水面，立即將人拉上岸並持續實施心肺復甦術（CPR）搶救，後續再由趕抵的消防救護人員接手處置，該名女子呈現心肺功能停止（OHCA）狀態，情況一度危急，現場急救後立即送往彰濱秀傳醫院全力急救，成功將女子自生死邊緣救回。請繼續往下閱讀...初步調查42歲陳姓女子不明原因落水，現在還在彰濱秀傳加護病房插管救治中，陳女意識仍不清楚，至於落水原因警方調查中。第三岸巡隊表示，相關該名女子落水原因及身分，仍待警方進一步調查釐清。若民眾發生危難、救生或救難等案件，可立即撥打海巡118免費服務專線，海巡人員將於第一時間全力教援。    ,https://news.ltn.com.tw/news/society/breakingnews/5386588
龍井2機車無號誌路口對撞 1騎士沒戴安全帽重摔亡,社會,2026/03/29 17:08,台中市龍井區三港路發生機車對撞事故，造成1死1傷。（讀者提供）台中市龍井區三港路28日晚間發生1死1傷車禍，56歲紀姓騎士下班返家途中，與20歲詹姓騎士在蚵寮路口擦撞，紀男未戴安全帽，重摔後在柏油路面翻滾數圈，頭部受傷當場失去心跳，送醫搶救仍不治，詹男滾落農田擦傷，訊後依過失致死罪嫌送辦。烏日警分局今天表示，28日晚間9時許，紀男騎車沿三港路往蚵寮路方向行駛，詹男沿三港路326巷往355巷方向行駛，雙方行經路口時碰撞，紀男未戴安全帽，被撞後在柏油路面翻滾數圈，頭部受到重創，當場失去呼吸心跳，詹男連人帶車衝進農田，身體多處擦挫傷，意識清楚送醫。請繼續往下閱讀...烏日交通分隊長劉于豪說，詹男經實施酒測並未飲酒，初步勘查駕駛人行經無號誌路口，未減速，且支道車未禮讓幹道車先行，詹男包紮後出院，訊後依過失致死罪嫌移請台中地方檢察署偵辦。紀男機車右側遭受撞擊扭曲變形，他未戴安全帽，被撞後在柏油路面翻滾數圈，頭部受到重創，當場失去呼吸心跳。（讀者提供）    ,https://news.ltn.com.tw/news/society/breakingnews/5386514
醉女情緒崩潰街上攔車大鬧    警急介入強制送醫,社會,2026/03/29 17:04,許女情緒崩潰，跑到大街上攔車、敲引擎蓋。（記者徐聖倫翻攝）家住新北市新莊的20歲許姓女子，昨在家喝太醉情緒崩潰，她竟跑到大街上隨意攔車，對著路過汽車大罵，還猛敲引擎蓋。警方獲報趕抵，即刻聯繫許女的母親到場，同時將其強制送醫，結束這場鬧劇。許女家住新莊區富貴路某社區大樓，她昨上午9時許在家喝酒，不料喝太醉，情緒突然潰堤，跑到家樓下大哭大叫，攔下路過汽車大罵還猛敲引擎蓋。駕駛見狀嚇得半死，趕緊倒車遠離許女，同時報警處理。請繼續往下閱讀...警方獲報到場，發現許女手腕上有傷，員警先是制止許女自殘，在釐清許女身分後即刻通知許母，在許母陪同下，許女被警方強制送醫。警方呼籲，民眾家中有情緒不穩，甚至患病的成員，務必時時注意並給予關心，協助其尋求醫療管道，若狀況緊急可即刻通報警方、消防，以免不必要的意外發生。    ,https://news.ltn.com.tw/news/society/breakingnews/5386509
暫停也要上鎖！YouBike被騎走恐賠1萬5 苦主報案只能算「遺失」,社會,2026/03/29 16:49,警方調閱監視器，發現不明男子擅自將別人借的YouBike騎到捷運永春站2號出口停放。（記者姚岳宏翻攝）台北市警方昨天接獲報案，有民眾停放於信義區永吉路連鎖便利商店外的YouBike微笑單車，遭不明人士騎走，由於承租人僅具保管責任而無所有權，車輛失聯一般只能以「遺失」或「誤騎」處理，若3個月未尋獲恐面臨高達1萬5000元的賠償金，且期間租借費仍會持續計算，讓承租民眾相當焦急，深怕車輛遭佔為己有甚至淪為犯案工具。所幸警方獲報後迅速調閱監視器與定位，成功尋回車輛。昨天下午4時許，陳姓民眾將YouBike停放在信義區永吉路的一處超商外，入內消費不到5分鐘，出來便發現車輛遭人擅自騎走，警方受理報案後，向單車公司申請定位資料，並同步調閱周邊的路口監視器畫面，經追查，發現1名男子將該輛YouBike騎走後，最終停放於捷運永春站2號出口外便逕自離去。請繼續往下閱讀...警方隨即派員前往現場，順利尋獲該輛單車並交還給報案人，結束這場驚魂記。有網友表示，由於YouBike採用租借模式，使用者僅具保管責任而非所有權，無法以失竊案件處理，只能以遺失方式報案，面對不斷累積的租借費用，受害者往往只能苦等，希望對方能夠盡快將車輛歸還。針對此類單車失聯案件，警方特別呼籲使用微笑單車過程中，若有臨時停放路邊或進入店家短暫消費的需求，切勿貪圖一時方便而將車輛隨意放置；務必善加利用YouBike車輛本身配備的暫時上鎖功能，確實將車輛上鎖，以防在承租期間遭有心人士擅自移置，進而衍生後續繁雜的賠償問題與困擾。    ,https://news.ltn.com.tw/news/society/breakingnews/5386508
毒駕狂飆自撞電桿！花蓮男車內起獲「喪屍菸彈」送辦,社會,2026/03/29 16:28,花蓮縣52歲林姓男子駕駛母親名下轎車在吉安巷弄內高速狂飆，失控撞擊路邊車輛飛起，最終猛力自撞電線桿才停下。（記者王錦義攝）花蓮縣52歲林姓男子駕駛母親名下轎車在吉安巷弄內高速狂飆，失控撞擊路邊車輛飛起，最終猛力自撞電線桿才停下。警方趕抵現場處理時，眼尖在車內後座發現電子菸彈，經採驗呈現安非他命及俗稱「喪屍菸彈」的依托咪酯（Etomidate）雙重陽性反應。全案偵訊後依《毒品危害防制條例》及《刑法》公共危險罪移送花蓮地檢署偵辦。吉安警分局今指出，仁里派出所24日晚間6點55分接獲報案，指稱吉安鄉文化八街發生嚴重車禍。林姓男子當時開著母親的座車在巷弄內疾速行駛，完全未見減速，整輛車失控後先是擦撞路邊停放的小轎車，強大撞擊力道導致林男座車彈飛，林男車輛最終撞上電線桿才止住衝勢，現場零件噴飛散落一地，林車車頭全毀、安全氣囊全數炸開，景象怵目驚心。請繼續往下閱讀...警消人員獲報趕抵後，發現林男臉部及胸口受有擦挫傷，意識尚清楚，隨即由救護車送往醫院醫治。處理員警在事故現場勘查時，眼尖發現林車後座竟直接擺放著電子菸桿與菸彈，察覺事態不單純，立即進行初步採驗，菸彈隨即呈現「依托咪酯」陽性反應。警方進一步在醫院對林男實施唾液快篩，確診呈現安非他命與依托咪酯成分，證實這場驚險車禍又是毒駕惹的禍。吉安分局呼籲，新興毒品「依托咪酯」會導致施用者產生幻覺、意識混亂及肌肉顫抖，吸食後駕駛車輛極易引發重大交通事故，嚴重威脅不特定用路人的生命安全。警方強調，對於毒品犯罪採取「零容忍」態度，將持續針對各類毒品加強查緝，請民眾切勿以身試法，若發現周遭有疑似毒品活動，請立即撥打110報案，共同守護社區治安與交通秩序。警方在車上起出毒品。（警方提供）    ,https://news.ltn.com.tw/news/society/breakingnews/5386493
先看到先贏？ 捷運座位起爭議  男稱替女友占位引口角,社會,2026/03/29 16:17,捷警到場將兩名男乘客請下車。（記者劉慶侯翻攝）台北捷運居然也發生「先看到先贏」的人肉佔位情事。有位乘客在善導寺站上車，見車廂內有空位便趨前想坐，怎料卻被身後的男子攔阻，表示「是要留給女朋友的」。兩人大聲爭執，引來捷運警察處理。警方最後將兩人都請下車，在互不提告下，讓他們各自離開。捷警隊是今（29）日上午10時50分接獲通報，指稱捷運板南線列車往南港展覽館站方向，有發生旅客衝突糾紛。警方隨即派員前往處理。請繼續往下閱讀...警方調查，1名男子上車時見車廂內有空位，欲入座時遭到後方男子阻止，表示那位置「要留給他的女性友人」，因此雙方發生口角爭執。捷警了解狀況後立即將雙方請下車，避免影響其他乘客，並告知雙方權益，雙方表示互不追究，各自搭車離去。捷運警察隊表示，旅客搭乘捷運時應保持冷靜，遇有糾紛務必理性溝通，以同理心互相體諒包容。如發生爭執或遇有危險情事，請立即撥打110報案電話，捷警將迅速趕赴現場處理，以維護捷運系統乘車秩序與安全。    ,https://news.ltn.com.tw/news/society/breakingnews/5386472
和女友吵架虐貓引網怒被肉搜 桃園科技男警局做筆錄,社會,2026/03/29 16:08,受虐小貓已被救出、帶離王男身邊。（擷取自桃園市議員黃瓊慧Threads）桃園市王姓男子疑因與女友吵架，竟把氣發洩在無辜小貓身上，虐貓影片曝光後引爆網友怒火，王男被肉搜是知名電子大廠員工，議員黃瓊慧向警方報案，小貓已被貓舍緊急帶離，王男於28日到警局做筆錄。桃市府動保處長王得吉表示，小貓目前安全無虞，明（30）日將依警方偵訊筆錄請王男陳述意見，並依動保法進行後續裁處。有網友透過Threads指控王男涉嫌虐貓，只見王男不僅隔著寵物外出袋狠狠拍打小貓，甚至直接拿蓮蓬頭朝牠瘋狂淋水，無辜小貓嚇到無處躲藏，模樣讓網友相當不捨。請繼續往下閱讀...虐貓影片引爆網友怒火，住在桃園區的王男連忙留言道歉，強調「小貓一切安好，沒有受虐，外界流傳資訊與事實有所出入，但任何生命都應該被尊重與善待，這次事件造成的負面影響絕非他樂見，但他也不會逃避應負的責任」，並PO出小貓躺在沙發的照片證明沒有受傷。不過，王男道歉止不住網友怒火，批「你是被流量嚇出來的道歉的吧」、「把貓交出來」。黃瓊慧收到陳情後隨即向桃園警分局埔子派出所報案，動保處長昨也到該電子大廠，但假日人資未上班，而王男已於28日到派出所做筆錄，小貓則由貓舍緊急帶離。黃瓊慧表示，小貓是王男花了14萬元買來討好女友，卻用虐貓、打貓行為來恐嚇女友回心轉意，真的很扯，已請動保處確認小貓狀況，並向王男告知他不適合再飼養任何寵物。王得吉表示，目前小貓已被帶離王男身邊，目前安全無虞，明日將依警方偵訊筆錄，通知王男陳述意見，並依動保法進行後續裁罰。    ,https://news.ltn.com.tw/news/society/breakingnews/5386461
桃園男大生走斑馬線遭公車輾壓 校園交通安全須檢討規劃,社會,2026/03/29 15:47,桃園男大生走在校內行穿道，遭左轉公車輾壓。（資料照，記者鄭淑婷翻攝）桃園男大生走在校園內行穿線遭公車輾過重創，國內大專校院因校區面積廣大，開放部分校園道路供車輛進出，卻屢屢傳出死傷車禍事故，校園交通安全亮紅燈，交通動線、交通工程規劃亟待檢討。去年5月南華大學21歲林姓女學生穿越校內馬路時，遭倒車中的校車擦撞並輾壓，造成骨盆腔碎裂、大腿骨折，送醫搶救後送進加護病房。而屏東科技大學校園也不時傳出交通事故，去年5月21歲謝姓學生騎機車行經校園內致智路與仁愛路口，與20歲張姓女學生駕駛的轎車碰撞，機車噴飛後翻滾一圈落地，謝男開放性骨折送醫治療；同年10月20歲邱姓大一新生在校內騎車，過彎時偏離車道，先後撞上分隔島和燈柱，人車甩飛送醫不治。請繼續往下閱讀...2024年8月台南市成功大學校區更發生嚴重事故，54歲圖書館林姓女職員駕駛白色小客車，從校區駛出時暴衝，波及2輛小客車與6輛機車，造成1死4傷悲劇；2022年11月，國立花蓮東華大學校1位男大生，騎機車疑似失控打滑，撞擊路樹送醫不治。桃園男大生校園遭公車輾壓重創   下腹部重創緊急手術保命    ,https://news.ltn.com.tw/news/society/breakingnews/5386421
宜蘭頭城追撞「嵌進」油罐車 男酒駕賓士車頭全毀,社會,2026/03/29 15:22,吳男駕駛賓士車追撞油罐車，賓士車頭嚴重受損，吳男酒測值0.29毫克，已超過安全標準值，被依公共危險罪移送宜蘭地檢署偵辦。（警方提供）宜蘭縣頭城鎮青雲路三段今天（29日）發生賓士轎車追撞停等紅燈的油罐車，31歲賓士駕駛吳姓男子酒測值0.29毫克，已超過安全標準值，被依公共危險罪移送宜蘭地檢署偵辦。頭城鎮青雲路三段一處路口，今天上午10點傳出交通事故，警方獲報到場，發現吳姓男子駕駛白色賓士轎車由北往南行駛，行經事故路口時，追撞前方停等紅燈的油罐車，賓士車頭嚴重受損，所幸無人受傷。請繼續往下閱讀...吳男接受酒測，酒測值0.29毫克，涉及公共危險罪，警詢後移送法辦。礁溪警分局呼籲用路人，酒後不要開車上路，切勿心存僥倖以身試法，警方將持續加強執法，確保用路人行車安全。宜蘭縣頭城鎮青雲路三段今天（29日）發生賓士轎車追撞停等紅燈的油罐車。（警方提供）    ,https://news.ltn.com.tw/news/society/breakingnews/5386409
半夜送YouBike想睡覺 貨車自撞1汽車、8機車幸無傷亡,社會,2026/03/29 15:08,監視器拍下自撞瞬間。（記者徐聖倫翻攝）首次上稿15:08更新時間18:4729歲王姓貨運司機載貨前往新北市板橋，返程時行經貴興路，疑似精神不濟擦撞路邊汽車，再連撞8部機車，王男才停下貨車，路人見狀報警。警方趕抵，確認王男沒有受傷，也沒有其他人受波及，而王男並未酒駕，詳細肇責將持續釐清。據悉，王男昨晚11時許開著貨車行經貴興路往高爾富路方向行駛，他一個恍神方向往路邊偏而不自知，撞上路邊停放的汽車，再撞停在路邊的8部機車，王男這才踩煞車停下。有路人經過嚇一大跳，趕緊報警處理。請繼續往下閱讀...警方到場即刻確認有無人受傷，所幸這起意外沒有任何人傷亡，緊接著對王男進行酒測，其酒測值為0。王男向警方供稱，他當時精神不濟恍神沒注意，所以才自撞，也承諾會負起賠償責任。警方呼籲，用路人務必保持精神飽滿，若稍有不濟，應立刻停車稍事休息，以免發生不必要的危險。警方於現場進行繪測。（記者徐聖倫翻攝）王男開貨車恍神自撞。（記者徐聖倫翻攝）    ,https://news.ltn.com.tw/news/society/breakingnews/5386384
台中白車科技執法路口擋救護車遭炎上    民反問：闖紅燈被拍照自己吞？,社會,2026/03/29 15:08,一輛白色自小客車，27日晚上在台中三民路未禮讓救護車遭檢舉，恐開罰還吊照，不過有民眾指該路口是科技執法，闖紅燈被拍照若事後無法舉證不就自己吞罰單？（民眾提供）有民眾在網路分享，一名駕駛人3月27日晚上行經台中三民路和五權路口時，後面有救護車鳴笛卻未立刻禮讓，警方表示可依法開罰，並吊銷駕駛執照及吊扣汽車牌照6個月。不過有民眾替這位駕駛人抱屈，強調該路口是科技執法路口，若禮讓闖紅燈事後收到罰單行車紀錄器早就覆蓋掉，到時候不就自認倒楣？第二分局警方表示，開單時會先審核，民眾也可提供行車紀錄器影像，或告知事發時間，審核後屬實都會撤單，請民眾無須擔心。一輛白色自小客車，本月27日晚上7點30左右，行經北區三民路3段和五權路口停紅燈時，後方一輛救護車鳴笛示意讓路，不過該名駕駛沒有立刻禮讓，停等一段時間才往前，有民眾拍下影片上傳引發民眾撻伐。請繼續往下閱讀...警方表示，該車於聽聞救護車警號時未立即避讓，相關違規情形將依《道路交通管理處罰條例》第45條第2項規定，汽車駕駛人於聞消防車、救護車、警備車、工程救險車或毒性化學物質災害事故應變車之警號時，如未立即避讓者，將處新台幣6000元以上3萬元以下罰鍰，並吊銷駕駛執照及吊扣該汽車牌照6個月。不過有民眾替這位駕駛人抱屈，強調該路口是科技執法路口，一旦闖紅燈往前禮讓救護車就會被拍照，因罰單不會馬上寄出，等到收到罰單時，行車紀錄器早就被覆蓋，到時候想申訴也沒證據，不就只能自己吞下？駕駛人可能就是怕被拍照才會沒有馬上禮讓。第二分局表示，科技執法路段，初步後台人工審核時，如有發現這種因禮讓救護車而違法的狀況就不會開單；如果民眾確實因禮讓救護車遭開罰，收到罰單後可檢附行車紀錄影像佐證提出申訴，若無行車紀錄器影像，也可提供事發當時時間，警方也會再度檢視當時的影像，進行撤單。    ,https://news.ltn.com.tw/news/society/breakingnews/5386404
趁女友酒醉性侵偷拍賠償和解 這原因「緩刑夢碎」關1年半,社會,2026/03/29 15:07,黃男請求緩刑，北院仍以其先前因妨害性隱私案件被判刑6個月確定，且在本案判決前已受有期徒刑宣告，不符緩刑要件，判決仍須入獄服刑。（記者劉詠韻攝）黃姓男子與女友交往期間，趁其酒醉泥醉之際實施性侵並偷拍，事後並將影片上傳至Telegram「TG霸社群組」，台北地方法院依乘機性交罪，處有期徒刑1年6月，可再上訴。儘管黃男已與A女達成和解，但北院調查發現，他先前另涉妨害性隱私案件且判決確定、不符緩刑要件，判決須入獄服刑。至於黃男將影像上傳至社群平台及群組，因屬重複起訴，則依「一事不再理」裁定免訴。判決記載，黃男2018年間與A女交往。某日清晨，黃男趁A女酒醉、無法抗拒，在其位於台北市大安區的住處對其性侵，並以手機非法錄製過程及裸露部位的影片。事後，黃男坦承全部犯罪事實，並與A女達成和解、如數賠償，A女亦表示願意原諒、不再追究，同意法院從輕量刑。請繼續往下閱讀...北院審理指出，黃男犯案時同時竊錄，行為涉及乘機性交罪、竊錄非公開活動與身體隱私部位罪；因兩罪具有行為重疊，依想像競合犯原則，從重以乘機性交罪處理，審酌其確有悔意、已與受害者和解，考量情輕法重，依刑法第59條裁定酌量減輕刑度。儘管黃男請求緩刑，但北院追查發現，黃男先前因妨害性隱私案件被台南地方法院判刑6個月確定，且在本案判決前已受有期徒刑宣告，認為不符緩刑要件，判決仍須入獄服刑1年6月。至於黃男將影片上傳至X平台及Telegram群組散布的行為，北院認此與其在台南地院已判決確定的案件屬同一行為，基於「一事不再理」原則，對重複起訴部分裁定免訴。    ,https://news.ltn.com.tw/news/society/breakingnews/5386376
