Title,News_Type,date,content,url
諾貝爾獎得主穆哈瑪迪被捕　伊朗家屬擔憂傷勢,國際,2025/12/17 05:36,2023年的諾貝爾和平獎得主穆哈瑪迪（Narges Mohammadi）上週再次被伊朗當局逮捕。她的家屬今天宣稱，她被捕期間遭到毆打，但當局拒絕讓穆哈瑪迪接受第三方的驗傷。穆哈瑪迪的法籍律師阿達卡尼（Chirine Ardakani）表示，穆哈瑪迪本月12日在伊朗東北部城市麥什赫德（Mashhad）追悼律師阿里科迪（Khosrow Alikordi）時，公開譴責他的死因可疑而遭逮捕。請繼續往下閱讀...麥什赫德檢察官赫馬蒂法爾（Hasan Hematifar）當天證實，追悼會結束後有39人被捕，穆哈瑪迪是其中一人。法新社報導，穆哈瑪迪的兄弟哈密德．穆哈瑪迪（Hamid Reza Mohammadi）目前居住在挪威，他透過視訊方式告訴法國巴黎的媒體，穆哈瑪迪14日已透過電話，簡短地告知其他名人在伊朗的兄弟，警察持警棍毆打她的臉部、頭部與頸部。他也稱，「她的頸部與臉部出現瘀青，身體狀況相當糟糕…另一名（人在）伊朗的兄弟已經嘗試說服當局讓她接受第三方醫師的檢查，以便確保她的頭部或其他臟器沒有內出血」。他補充說道，「但是他們還沒同意。我們非常擔憂她被關押的方式與被關押地點，以及如何被對待」。穆哈瑪迪的丈夫拉馬尼（Taghi Rahmani）目前住在巴黎。他表示，妻子的兄弟要求伊朗當局讓妻子接受第三方醫師的檢查遭拒，「我們現在非常擔心她的安危」。而穆哈瑪迪數名支持者本月15日表示，穆哈瑪迪被捕後，伊朗當局曾兩度送她去醫院。國際特赦組織（Amnesty International）今天另發聲明指控伊朗安全部隊在逮捕行動期間，「虐待被捕人士，以及以不人道方式對待被捕人士」，其中包括「暴力毆打」穆哈瑪迪與她的同伴。（編譯：楊惟敬）1141217    ,https://news.ltn.com.tw/news/world/breakingnews/5280531
團結挺烏 歐盟籌組多國維和部隊助重建,國際,2025/12/17 05:30,烏克蘭總統澤倫斯基、荷蘭總理史霍夫及歐洲理事會秘書長柏塞茲，16日在荷蘭海牙出席「烏克蘭國際索賠委員會」成立儀式。（路透）歐盟多國領袖十五日發表聯合聲明，重申力挺烏克蘭，並做出多項承諾，包括籌組由歐洲主導的多國部隊，協助烏克蘭重建軍事力量並保障安全；由美國主導停火監督機制，以及支持烏克蘭加入歐盟等。35國合組委員會向俄羅斯索賠包括烏克蘭總統澤倫斯基在內的歐洲卅五國領袖，十六日在荷蘭海牙會晤，正式同意成立一個國際索賠委員會（International Claims Commission），為未來向俄羅斯追究侵略與疑似戰爭罪行造成的鉅額損失鋪路。請繼續往下閱讀...歐盟發表由十位歐洲國家領袖，以及歐盟理事會主席柯斯塔（Antonio Costa）、歐盟執委會主席馮德萊恩（Ursula von der Leyen）共同署名的聲明，重申對於烏克蘭的支持，並強調國界不得以武力改變，任何關於領土的決定，應該在獲得強而有力的安全保障後，由烏國人民自行決定。聲明強調，歐盟將在終結戰爭的協議架構下，共同努力為烏克蘭提供強而有力的安全保障，並協助其經濟復原。歐盟承諾持續且大規模支持烏克蘭建設武裝部隊，使其具備嚇阻衝突並保衛領土的能力；同時，在「志願者聯盟」（Coalition of the Willing）架構下，籌組一支由美國支持、歐洲主導的多國部隊，協助重建烏克蘭的軍事力量，同時確保領空與海域安全。相關的安全保障承諾還包括由美國主導停火監督機制，以便對未來任何攻擊發出預警，並對違規行為做出回應；各國各自採取具有法律約束力的措施，明確規範在未來若發生攻擊時，得以採取武力、情報共享、後勤支援、經濟及外交制裁等行動，以恢復和平與安全。歐盟承諾將提供大量資源，用於復原烏克蘭經濟，建立彼此互利的貿易協議，並再次重申強力支持烏克蘭加入歐盟。十二位歐洲領袖明確指出，任何協議都應保障歐洲與大西洋地區的長期安全和團結，以及北大西洋公約組織（NATO）在提供強大嚇阻能力方面所扮演的角色。各國將持續加強對俄羅斯施壓，促使莫斯科認真投入談判。    ,https://news.ltn.com.tw/news/world/paper/1736193
遺憾黎智英被定罪 川普：曾請習近平考慮放人,國際,2025/12/17 05:30,香港壹傳媒創辦人黎智英觸犯「港區國安法」遭定罪，美國總統川普對此表示遺憾，並透露曾請求中國國家主席習近平考慮釋放黎智英。（美聯社檔案照）眾所矚目的香港「壹傳媒」創辦人黎智英觸犯「港區國安法」一案，香港法院十五日裁決一項「串謀發布煽動刊物罪」、兩項「串謀勾結外國勢力或者境外勢力危害國家安全罪」等三項罪名全部成立，最快明年初宣布刑期，可能面臨終身監禁。曾宣示將「盡其所能」拯救黎智英的美國總統川普對此表示遺憾，並透露曾請求中國國家主席習近平考慮釋放黎智英。川普十五日在白宮表示，由於黎智英年事已高，身體狀況不佳，「因此我提出這個要求，我們就靜觀事態發展」。川普並未提及何時向習近平提出這項請求，兩人八月通電話時，川普當時也提及向習近平關切黎智英案。另據「路透」報導，十月在南韓釜山舉行的美中領袖峰會期間，川普也呼籲習近平釋放黎智英。兩人最近一次談話是在十一月，但不清楚是否談論黎案。請繼續往下閱讀...川普並未批評港府或中共當局，但國務卿魯比歐發表聲明，譴責黎智英遭定罪反映北京對尋求保護言論自由及其他基本權利者的壓迫行徑，而且黎智英的健康狀況在超過一八〇〇天的關押期間嚴重惡化，敦促基於人道理由釋放黎智英。紐約時報、華盛頓郵報和華爾街日報等美國三大報，十五日均發表社論指出，川普和英國首相施凱爾都計畫訪問中國，應趁機要求習近平釋放黎智英。黎智英女兒黎采接受「美聯社」訪問時表示，五年的單獨監禁對黎智英的健康造成惡劣後果，患有背痛、腰痛、心悸、糖尿病等問題，還有指甲變色脫落、牙齒腐蝕，以及視力、聽力弱化等狀況。由於黎智英具英國公民身分，英國政府為此召見中國大使鄭澤光，以「最強烈措辭」傳達英方立場，但鄭澤光也就英方評論黎智英案裁決提出嚴正交涉。英國首相施凱爾發言人威爾斯（Tom Wells）表示，將持續呼籲立即釋放黎智英。民進黨：相信習近平 恐讓台灣淪威權修羅場民進黨中國部十六日強烈譴責並呼籲中共與港府應立即釋放黎智英、停止迫害言論與新聞自由，呼籲任何對「與中共和談能換來和平」抱有幻想的人，都應徹底清醒，國際與台灣社會都不該「相信習近平」、抱持任何錯誤的幻想，否則只會讓台灣成為繼香港之後的下一座「威權修羅場」。    ,https://news.ltn.com.tw/news/world/paper/1736197
美歐允諾類北約安保 烏克蘭停戰露曙光,國際,2025/12/17 05:30,美國、烏克蘭與歐洲15日結束在德國柏林的三方會談，美歐承諾將為烏克蘭提供與「北大西洋公約」第5條「集體防禦機制」類似、具備強大嚇阻力的安全保證。圖為烏克蘭總統澤倫斯基（右前4）與美、歐代表在會後合影。（路透）美國、烏克蘭與歐盟十五日結束在德國柏林的三方會談，美歐承諾將為烏克蘭提供與「北大西洋公約」第五條「集體防禦機制」類似、具備強大嚇阻力的安全保證。雖然攸關和平協議能否實現的烏克蘭東部「頓巴斯」（Donbas）領土問題尚待解決，美國總統川普仍樂觀表示，「和平比以往都更為接近」。德國總理梅爾茨也說，美烏與歐洲已就俄烏停火方案達成五點共識，柏林會談讓「停火可能性變得可以想像」。柏林會談5點共識 將提供類北約第5條「集體防禦機制」保證請繼續往下閱讀...川普十五日在白宮表示，自己與烏克蘭總統澤倫斯基、北約組織（NATO）及歐洲領袖進行「長時間且非常良好的通話」，「我們和俄羅斯總統普廷多次溝通，當前的進展比以往都更加接近（達成協議）」。俄羅斯外交部副部長雷雅布可夫也向美國廣播公司新聞網（ABC News）表示，普廷政府「已準備好達成協議」，但仍堅稱烏克蘭必須讓出烏東領土，莫斯科也不會接受北約部隊進駐烏克蘭。柏林會談由烏國總統澤倫斯基、美國特使魏科夫與川普女婿庫希納，以及北約秘書長呂特、歐盟執委會主席馮德萊恩，還有英國、法國、德國、義大利等歐盟十國領袖參與。澤倫斯基在會談結束後向媒體表示，談判涉及五份和平方案相關文件，其中部分需經美國國會通過，才具有法律效力，「我們沒有一個完美方案，但這是一個很可行版本」。他與川普的會面將視文件進展安排，不排除本週末前往美國。澤倫斯基說，相關文件涉及安全保障內容，包括類似北約第五條的條款，即對任何一個成員國的攻擊，視同對全體成員國的攻擊。此外，安全保障也包含具體的「嚇阻方案」，涵蓋烏軍所需的兵力規模、軍事訓練、武器裝備、實際士兵人數及軍事資源等。他表示，現有文件已不僅止於框架，而是具備細節，接近完成階段，但仍須確保相關條款具法律拘束力。頓巴斯領土權利 烏克蘭仍拒讓步除安全保障外，文件也納入戰後重建規劃，首次提出設立特別撥款機制，協助因戰火失去家園的民眾、對陣亡士兵家屬的經濟支援，以及基礎設施與能源體系重建，初步估計所需金額約七百億至八百億美元。澤倫斯基也重申，無論是法理或實際上，都不會承認俄羅斯對頓巴斯的領土權利。若莫斯科拒絕美烏歐三方擬定的和平草案，將要求美方對俄國施加制裁，並提供烏國更多包括長程武器在內的軍備。美國官員則說，柏林會談已對廿點停火草案的九成內容達成共識，但最棘手的領土問題懸而未決。「紐約時報」引述官員說法報導，川普告知澤倫斯基應該放棄領土，因為倘若戰爭持續下去，仍有相當大的可能性在未來數月遭奪取。領土問題最終將交由澤倫斯基和普廷處理。    ,https://news.ltn.com.tw/news/world/paper/1736192
日防相曬飛官手套 致敬自衛官冷靜應對共機雷達照射,國際,2025/12/17 05:30,日防相日本防衛大臣小泉進次郎十六日在社群平台X，秀出一只飛行員使用的手套，向日自衛隊飛行員致敬。（路透）日本航空自衛隊戰機在本月初，遭中國「遼寧號」航空母艦艦載機間歇性雷達照射長達卅分鐘。日本防衛大臣小泉進次郎十六日在社群平台X，秀出一只飛行員使用的手套，上面寫著「冷靜」、「嚴格」（嚴謹），除強調共軍挑釁的本質，也向承受重大壓力的自衛官表示敬意。防衛省統合幕僚監部日前指出，遼寧號六日上午通過沖繩本島與宮古島間海域後，當天下午在沖大東島西方約二七〇公里海域，艦載殲-15戰機向正在執行領空侵犯應對任務的日本F-15戰機，進行雷達照射，引發日方強烈不滿。請繼續往下閱讀...小泉發佈的手套，是由自衛隊統合幕僚長內倉浩昭提供。內倉在十一日召開記者會時，提到自己也曾執行過因應領空侵犯的任務，他以麥克筆在手套上寫下「冷靜嚴格」四字，每次升空前都會看著這四個字調整心情。內倉表示，自己從未遭受長達卅分鐘、且以間歇性方式進行的雷達照射，他可以理解執勤的隊員承受極大壓力。小泉表示，在長達卅分鐘遭到雷達照射的情況下，自衛官始終秉持「冷靜」、「嚴格」的態度，沉著地完成任務，讓他深感驕傲。小泉強調，此次事件的本質在於，長達卅分鐘的雷達照射是以間歇方式持續進行。日方不會被試圖轉移焦點的說法所左右，將持續以冷靜、嚴謹的態度加以應對。監控中國機艦沖繩離島將部署雷達部隊共同社報導，防衛省沖繩防衛局與沖繩縣北大東村（北大東島）十五日就村有地簽訂租賃合約，在當地部署航空自衛隊的移動式警戒管制雷達部隊，對經由沖繩本島與宮古島間進入太平洋的中國航艦與軍機，增強監視能力，預計二〇二六年元旦過後動工進行場地整備。北大東島位於沖繩本島以東約三一〇公里處。日本防衛大臣小泉進次郎十六日在社群平台X，秀出一只飛行員使用的手套，上面寫著「冷靜」、「嚴格」（嚴謹），，除強調共軍挑釁的本質，也向承受重大壓力的自衛官表示敬意。（取自小泉進次郎X）    ,https://news.ltn.com.tw/news/world/paper/1736195
日相重申立場 拒撤台灣有事發言,國際,2025/12/17 05:30,日本首相高市早苗在國會答詢時，仍不接受在野黨議員再次要求她撤回「台灣有事」發言。（法新社檔案照）日本首相高市早苗十六日在國會答詢時，被問及「存亡危機事態」要件中，所指的「與日本關係密切的其他國家」，是否包括台灣在內？她表示，「並非事先特定，而是須依個別、具體狀況來判斷」。而對於在野黨議員再次要求她撤回「台灣有事」發言，高市並未接受。高市上月初在國會答詢時提及「台灣有事可能構成存亡危機事態」，引發中國強烈反彈，並對日本持續施壓，不斷要求撤回發言。日本媒體的多項民調均顯示，認為高市發言適當的民眾仍居多數，但日本共產黨和立憲民主黨等在野黨的多名議員，仍再三要求高市撤回發言。請繼續往下閱讀...中國外交部發言人郭嘉昆十六日在例行記者會上，再次要求高市撤回發言，而立憲民主黨團所屬參議員廣田一，也在參議院預算委員會上重提「台灣有事」答詢，並要求高市撤回。然而，高市僅再次強調，關於何種事態符合存亡危機事態，政府已多次明確答覆，將依實際發生的事態，根據個別、具體情況，綜合所有資訊加以判斷。政府的立場是一貫的，並未接受廣田撤回發言的要求。廣田進一步質詢，存亡危機事態要件中所稱的「與我國關係密切的其他國家」，是否包括台灣。對此，高市表示，除同盟國的美國之外，實際上符合者可能性相當有限；至於台灣是否符合，她表示「並非事先特定，而是須依個別、具體狀況判斷」。中方在聯合國安理會又扯高市言論 日方反批離題與此同時，中國仍持續在聯合國針對高市的發言「告洋狀」。中國駐聯合國大使傅聰在十五日的安理會會議上批評日本，與日本駐聯合國大使山崎和之爆發激烈交鋒。讀賣新聞報導，傅聰指控高市的發言「對亞洲及世界和平帶來嚴重風險，不能允許軍國主義死灰復燃」，並要求日方撤回。山崎則強調，日本以「專守防衛」為基本方針，中方的指摘並不正確，並強調「意見分歧應透過對話加以解決」。安理會的議程原本是對下一任秘書長的角色進行討論，傅聰卻突然離題，對日本展開批評。山崎認為，傅聰的舉動「有損於關於聯合國未來的討論，並不恰當」。報導指出，中國在十一月中聯合國大會也曾不顧會議主題，主張高市的答詢內容「極為危險」，並要求撤回發言。後來又兩度致函聯合國秘書長古特瑞斯，聲稱「日本正在推進重新武裝」，呼籲所有會員國提高警惕。對此，日方均以「日本在戰後始終一貫為國際社會的和平與繁榮做出貢獻」進行反駁，並呼籲以對話方式冷靜應對。    ,https://news.ltn.com.tw/news/world/paper/1736194
中英對照讀新聞》Dutch warning over ’annoying’ chatbots荷蘭針對「惱人的」聊天機器人發出警告,國際,2025/12/17 05:30,"AI聊天機器人示意圖。（美聯社）◎管淑平Dutch authorities told companies and organisations on Thursday they should not rely solely on chatbots to communicate with consumers, describing their use as ""one of the biggest annoyances"" customers face.荷蘭政府週四告訴企業和組織，他們不應該只仰賴聊天機器人與消費者溝通，並形容使用機器人的作法，是顧客所面臨「最惱人的事情之一」。請繼續往下閱讀...""Organisations that use chatbots in their services must always offer people the option to speak with a representative,"" said the Dutch Data Protection Authority (AP) in a statement.「將聊天機器人用於其服務的企業組織，也必須提供民眾與真人代表對話的選項」，荷蘭資料保護局在一份聲明中說。Firms must also ensure consumers are aware they are interacting with chatbots and that the machines do not provide evasive or incorrect answers, the AP said.企業也必須確保消費者知道，他們是在與聊天機器人互動，而且這些機器人不會提供含糊閃避，或是不正確的回應，該局說。The watchdog voiced concern about the growing use of AI-powered chatbots and warned that regulators would be looking into stricter rules.該監管機關對人工智慧技術驅動的聊天機器人愈來愈被普遍使用感到憂心，並警告，主管機關將會考慮實施更嚴格的規範。新聞辭典annoying：形容詞，惱人的，惹人嫌的；名詞annoyance，惱人的事。例句：His loud music was really annoying.（他大聲播放的音樂真是惱人。）evasive：形容詞，閃避的、刻意迴避的。例句：His response was evasive.（他的回應避重就輕。）    ",https://news.ltn.com.tw/news/world/paper/1736220
日安保設施周邊不動產 地主近半是中資,國際,2025/12/17 05:30,日本政府公布2024年度安保等重要設施周邊土地調查，外國人或外國法人取得土地與建物的案件，共計達3498件，中國以1674件居首，占比接近五成。（彭博檔案照）日本政府十六日公布二〇二四年度安保等重要設施周邊土地調查，外國人或外國法人取得土地與建物的案件，共計達三四九八件，中國以一六七四件居首，占比接近五成；其後依序為台灣四一四件、南韓三七八件、美國二一一件。強化國土保安明年起移轉申報須登記國籍內閣府表示，外國人取得的不動產多為公寓或大廈。在首都圈地區，以中國人為主的投資購買行為已受到關注，但目前並未發現妨礙重要設施功能的案例。請繼續往下閱讀...為掌握外國人取得不動產的實際狀況，日本法務大臣平口洋表示，政府計畫從明年起推動新方針，強制要求在辦理不動產所有權移轉登記等申報手續時，必須登記國籍，並透過護照等證件進行確認。無論取得目的為何，只要是居住在海外人士取得日本不動產，都將要求申報國籍。日本為加強國土保安，在二〇二二年度實施「土地利用規制法」，將自衛隊基地、海上保安廳設施、核電廠等「重要設施」的周邊，以及國境離島等，依其安全重要性指定為「注視區域」或「特別注視區域」，政府可對這些區域的土地和建物買賣和利用情形進行調查，或要求在買賣前進行申報。去年底首次公布的調查區域較小，外國買主取得土地或建物的案件僅三七一件，這次調查的區域擴大到五八三個，件數也增為七倍的三四九八件。不過，在這兩次調查之中，中國買主的平均占比都是五成上下。依都道府縣別統計，東京都以一五五八件居冠。較為集中的地區包括陸上自衛隊衛生學校、防衛裝備廳艦艇裝備研究所，以及新山王美軍中心（New Sanno U.S. Army Center）周邊。另外，日本政府也首度針對外國人經地方自治體許可等程序抽取地下水的情況，進行全國性調查，顯示在十二個自治體中，共有四十九件案例，主要用途包括生活用水、回收業、融雪、酒類製造等，目前尚未發現有地下水枯竭或與居民發生糾紛的情況，但政府將檢討相關制度，以便更詳細掌握外國人或外國企業使用地下水的實際狀況。    ,https://news.ltn.com.tw/news/world/paper/1736196
謠言終結站》網傳勞保月退門檻上調至25年？內容農場錯誤訊息,國際,2025/12/17 05:30,謠言終結站網傳內容：勞保將於2028年破產，2026年將重新計算，未來領月退的門檻，將從15年上調至25年？查證結果：MyGoPen指出，網傳影片出自YouTube內容農場頻道，內容摻雜許多錯誤或過時資訊，最新精算報告（2023年）顯示勞保破產年份已延至2031年；現行勞保（勞工保險老年給付）請領資格，是勞保年資滿15年，2026年後須滿65歲才能請領，並未上調至25年。    ,https://news.ltn.com.tw/news/world/paper/1736198
泰國：柬埔寨須先宣布停火　才能結束兩國交戰,國際,2025/12/17 04:36,泰國與柬埔寨邊境衝突進入第2週，曼谷當局今天表示，柬埔寨必須先宣布停火才能結束兩國交戰。柬埔寨暫未對泰國這項聲明做出回應。法新社報導，泰國外交部發言人馬瑞迪（Maratee Nalita Andamo）在曼谷對記者表示：「柬埔寨是侵略泰國領土的一方，必須先宣布停火」，並表示柬國必須「真誠」配合邊境掃雷工作。請繼續往下閱讀...官員指出，泰國和柬埔寨本月稍早於兩國邊境再度爆發衝突，至少造成34人死亡，包含軍人和平民，並導致約80萬人流離失所。柬埔寨內政部指出，當地約17名平民在衝突中喪生。泰柬互相指責對方挑起衝突，各自聲稱是出於自衛，並互控對方攻擊平民。由於泰柬衝突蔓延至爭議邊境的沿海地帶，泰國14日宣布東南部噠叻省（Trat）實施宵禁。外媒披露，美國總統川普（Donald Trump）日前與泰柬兩國領袖通話時，以提高關稅作為威脅，使兩國同意停火。對此，泰國外交部發言人尼孔德否認，表示「未接獲任何來自美方的相關訊息」，強調當天通話未涉及關稅或停火要求。這場衝突源於殖民時期遺留下來的邊界劃分爭議，涉及泰柬兩國之間長達800公里的陸地邊界線。（編譯：洪啓原）1141217    ,https://news.ltn.com.tw/news/world/breakingnews/5280529
川普預告發表全國電視演說　稱期待見到大家,國際,2025/12/17 03:36,美國總統川普（Donald Trump）今天表示，他預計明天透過電視轉播發表全國演說，並補充說自他今年1月重返執政以來，對美國而言是「偉大的一年」，還說期待見到大家。法新社報導，川普今天在自家社群媒體平台「真實社群」（Truth Social）發文說：「我的美國同胞們：我預計於美東時間明天晚間9時在白宮發表全國演說，過程全程直播，屆時期待『見到』大家。」請繼續往下閱讀...他還說：「對我們國家而言這是偉大的一年，最精彩的還在後頭！」（編譯：洪啓原）1141217    ,https://news.ltn.com.tw/news/world/breakingnews/5280526
