Title,News_Type,date,content,url
醫美藏針孔偷拍風暴延燒！警政署速查401處、法辦9品牌70間分店,社會,2026/05/18 19:31,愛爾麗醫美集團日前遭踢爆診間裝設針孔攝影後，警政署速查全國共401處、法辦9品牌70間分店。（記者姚岳宏攝）針對醫美診所暗藏針孔事件，有立委今日在立法院關切內政部與警政署的查緝進度，警政署強調，自5月1日案發後，已展開全國反偷拍聯合行政稽查，截至5月17日共清查401處場所，行動中查扣台中「樂菲」與台南「研醫明」各1處疑似密錄設備，並將涉案的9家品牌、約70間分店報請檢察官指揮偵辦，全力阻斷影像散布。這起風暴源自愛爾麗醫美集團日前遭踢爆診間裝設針孔，檢警清查後，赫然發現北中南多家診所皆有類似情形，內政部長劉世芳對此說明，警政署已通令各地警局會同衛福部、運動部等主管機關展開聯合查察，警方在近期密集稽查中，已查核六都356處及其他縣市45處，並嚴格查扣異常設備，持續擴大追查幕後涉案人員與器材來源。請繼續往下閱讀...警政署重申，對偷拍行為絕對零容忍，全案正依《刑法》、《個人資料保護法》及《醫療法》專案偵辦中。至於外界呼籲對針孔設備實施實名制購買，內政部指出正與經濟部協調規範特殊器材。警政署也表示，考量設備販售情境多元，實名制成效將依行政院裁示研議，同時配合數位發展部強化電商管理，並釐清施工廠商監督機制，從源頭防制犯罪。    ,https://news.ltn.com.tw/news/society/breakingnews/5441305
獨家》大玩3P拍傳少女性愛片 拍攝與散布2少女有責還連累父親賠數十萬,社會,2026/05/18 19:20,乙姓少女私自拍下甲姓少女與A姓男子的性愛影片，再傳給丙姓少女PO網，台南地院判乙、丙兩女與她們的父親都要連帶賠償甲女與甲女的母親。（示意圖與本案人物無關，記者王俊忠攝）未滿14歲的甲姓少女與乙姓少女、成年的A姓男子是朋友關係，3人竟相約到台南1家飯店大玩3P性遊戲，乙女拿手機拍下甲女與A男上床的性愛影像，再把性愛片傳給另名丙姓少女PO到IG供網友觀賞。甲女與其母深受其害、提告求償。乙女、丙女及兩人的父親都被判連帶賠償甲女與甲女的母親。台南地院法官審認父親對未成年子女有監督照護之責，判乙女與其父要連帶賠償甲女50萬元、賠甲女母親30萬元；丙女與其父也要連帶賠償甲女40萬元、賠甲女母親20萬元。請繼續往下閱讀...甲女與其母親控訴，2024年5月25日下午，乙女與A男和甲女相約到台南市1家飯店「開房間」，乙女先與A男發生性關係，A男再和甲女上床嘿咻，在A男與甲女歡好時，乙女未經甲女同意拿手機拍下甲女與A男的性愛過程影像（即性愛片），並儲存在手機內。同年6月，乙女再把這段性愛影片傳給甲女的母親與另名丙姓少女。丙姓少女收到甲女與A男的性愛片後，在乙女慫恿下，丙女於同年6月間某晚把這段性愛片PO到其IG帳號限時動態上，使不特定的IG使用者都可觀覽到性愛影片。甲女與母親表示，被告乙女、丙女的犯行，經法官調查後裁定交付保護管束，被告兩人所為不僅侵害甲女的隱私權，也侵害甲女母親對甲女保護教養的親權，且情節重大；乙女與丙女在行為時都是未成年人，她們的父親應與兩名女兒各自負起連帶賠償責任。法官審認，乙女與丙女涉散布甲女的性影像，侵害甲女的隱私權，兩女與其父親確需賠償甲女；甲女的母親需因此特別關懷女兒的心理狀況、以更多心力教養甲女，保護甲女日後不再受害，為此，也判乙、丙兩女須與各自父親對甲女母親負起連帶賠償責任，判賠額度如上述，此案可再上訴。    ,https://news.ltn.com.tw/news/society/breakingnews/5441276
機車對撞大車 遊覽車車頭慘況曝光,社會,2026/05/18 18:59,遊覽車前保險桿和擋風玻璃都毀損。（埔里警方提供）遊覽車與機車對撞，機車的座墊與機車分開，掉在馬路上。（埔里警方提供）南投埔里郊區一處休閒農場附近，下午發生遊覽車與機車對撞的車禍，18歲的宣姓男子騎機車沿中山路往埔里方向騎乘，疑似跨越雙黃線，進入對向車道，與遊覽車碰撞，遊覽車玻璃破裂、前保險桿毀損，宣姓騎士身上多處擦挫傷，雙方都沒酒駕，詳細肇事原因有待警方進一步調查釐清。埔里警方指出，該起車禍發生在下午2時35分許，1部由18歲宣姓男子騎乘的機車，從仁愛往埔里方向行駛，騎到埔里鎮中山路一段176號前（台14線60.7公里處），與對向由54歲羅姓男子駕駛的遊覽車發生碰撞，從現場狀況來看，疑似機車騎士未注意車前狀況，跨越雙黃線進入對向車道肇事。機車與遊覽車撞擊後，遊覽車前保險桿毀損，左側擋風玻璃碎裂，機車則嚴重毀損，座墊還甩出在路上，而宣姓騎士身體有多處擦挫傷，經送往埔里榮民醫院治療後無生命危險，2名駕駛經酒測均無飲酒情形。詳細肇事原因仍待警方進一步調查釐清。埔里警方呼籲，駕駛人應隨時注意車前狀況，並遵守交通標線，千萬不要跨越雙黃線行駛，以維護自身及其他用路人安全。    ,https://news.ltn.com.tw/news/society/breakingnews/5441271
男警官被控在西門町搭訕泰國妹引衝突 萬華分局澄清是座位糾紛,社會,2026/05/18 18:49,萬華分局員警跟朋友喝酒，因座位糾紛與外國遊客拉扯。（記者王冠仁翻攝）今天有網友在社群上發文，聲稱昨天深夜在台北市西門町目擊，有3名泰國女子在西門町一家餐飲店用餐時，被隔壁桌另外2名台灣人騷擾，最終另桌2名波蘭籍男遊客看不下去，上前勸阻，沒想到2名台灣人居然拉扯波蘭遊客，甚至作勢揮拳。對此，轄區萬華分局今天表示，全案起因是拿鄰桌空椅子而起，並非搭訕；其中1名台籍男子是萬華分局王姓巡官，他雖然沒傷人，但為端正警紀，警方已將他與他朋友依違反社會秩序維護法裁處。這名網友發文說，台灣的渣男，騷擾隔壁桌的正在吃燒烤的泰國女生，人家不理她，還繼續騷擾，還讓坐在對面的波蘭人，過來幫忙阻止。結果這兩個中年男生，居然打這兩個幫忙保護女孩子的波蘭人，還在西門町鬧區，眾目睽睽之下追著打那兩個波蘭人，真的替台灣人感到抱歉。請繼續往下閱讀...萬華分局對此表示，在昨天深夜11時許接獲報案，報案民眾聲稱，峨眉街一家餐飲店外2名台灣人與外國人爆發糾紛，需要警方到場協助。西門町派出所警力趕到，發現原來當時是3名泰國女子在該處用餐，想拿取隔壁桌的空椅子，但坐在該處的2名台灣人被對方突如其來舉動不滿，雙方又因語言不通，雞同鴨講而起爭執。另桌2名波蘭遊客看不下去，上前制止，2名台人更加火大，出手拉扯波蘭遊客的手臂、作勢揮拳；波蘭遊客不願惹事想離去，2名台人還追上攔阻。警方事後清查相關人等的身分，赫然發現其中1名台人，居然是「自己人」，而且也是萬華分局王姓巡官。王員強調，自己並非搭訕，當時糾紛起因是座位問題、爭搶椅子。萬華分局指出，當時王姓巡官在非上班期間跟朋友飲酒，並沒有違反相關規定，再加上波蘭遊客與泰國女子都沒提告。不過，王姓巡官與朋友的行為已經違反社會秩序維護法第87條，警方依規定將其裁處。萬華分局強調，該名同仁除了違反社維法，警方也將從嚴追究相關人員行政責任，以端正警察風紀。警方查處員警風紀案件均採不掩飾、不庇縱、自檢自清之態度，從嚴、從速調查究責，亦將持續督飭所屬恪遵風紀要求，以維護警察形象。（18:49更新）萬華分局員警跟朋友喝酒，因座位糾紛與外國遊客拉扯。（記者王冠仁翻攝）    ,https://news.ltn.com.tw/news/society/breakingnews/5441012
攀登雪山失蹤18天的姚姓女子   空拍機找到遺體,社會,2026/05/18 18:45,姚女獨攀雪山失聯18天，台中市消防局多次派員上山搜尋。（民眾提供）上稿時間：11:25  更新時間：18:4548歲姚姓女子5月1日獨攀雪山失聯，至今已失聯18天，台中市消防局於5月5日接獲報案，搜尋多日，今早使用空拍機，終於發現疑似姚女遺體卡在200公尺深斜坡，搜救人員並於今天下午，將姚女遺體拉到稜線上，將等候明天空勤隊出動直升機，將其遺體吊掛運送下山。請繼續往下閱讀...女子獨攀失聯18天，親友及多位熱心山友紛上網發布協尋。 台中市消防局獲報後也持續投入人力搜尋，今天早上7點52分，搜救人員從空拍機搜尋發現，女子遺體在志佳陽往雪山約200公尺處下方的深斜坡，地面人員救援不易。台中市消防局原訂申請空勤總隊出動直升機，將遺體吊掛上來，再送往山下；不過，空勤總隊第2大隊第3隊，今天上午出動直升機抵達現場時，因雲層太厚，無法評估現場作業環境，僅將地面搜救人員申請的繩索設備放在雪山主峰，供地面搜救人員後續使用；台中市消防局表示，搜救人員在今天下午，已將姚女遺體拉上稜線，明天將再申請空勤出動直升機將體吊掛上機後運送下山。    ,https://news.ltn.com.tw/news/society/breakingnews/5440620
為了煮湯起爭執 嘉縣男子涉持菜刀砍傷6旬母被收押,社會,2026/05/18 18:17,嘉義地方法院。（資料照）嘉義縣一名48歲林姓男子在家中待業，5月15日中午因煮湯與68歲母親起爭執，竟失控持菜刀砍傷母親頭部及頸部，林母舉手阻擋，手臂也受傷，警方獲報逮獲林男，依涉殺害直系血親尊親屬未遂罪嫌移送嘉義地檢署，檢方複訊後，向嘉義地方法院聲請羈押，5月16日法院裁定羈押。據了解，林男在家待業，與6旬母親同住，曾有多次對林母家暴紀錄，不過林母未曾聲請保護令。15日中午，林男欲使用電鍋煮湯，林母指責兒子沒有工作賺錢，還不知道節省電費，林男因此被激怒，向林母大罵三字經，持菜刀朝林母頭部、頸部揮砍，林母舉起右手阻擋，導致頸部、手臂受傷，所幸未傷及生命。請繼續往下閱讀...嘉院16日開羈押庭，林男否認有殺人故意，法官認為林男涉殺害直系血親尊親屬罪嫌，犯罪嫌疑重大，林男雖坦承有攻擊母親事實，但對於取得菜刀過程與林母所述有明顯差異。2人為母子關係，殺人未遂與傷害罪刑度相差甚遠，有相當理由認為林男為求降低刑度而勾串林母，試圖降低犯罪情節嚴重性的可能。嘉院法官審酌林男有多次家暴行為，足認有反覆實施家暴犯罪之虞，且酒後持菜刀攻擊母親，嚴重危害社會秩序及林母生命身體安全，羈押並不違反比例原則，依法裁定羈押。    ,https://news.ltn.com.tw/news/society/breakingnews/5441228
王鴻薇爆料「喬貸款」挨告誹謗 林飛帆律師批：轉述不能免責,社會,2026/05/18 18:00,王鴻薇2023年12月開記者會爆料行政院長卓榮泰找公股銀行幫候選人喬貸款，其中一名便是林飛帆。林控王誹謗，本案今開庭，王否認犯罪。（記者翁靖祐攝）國民黨籍立委王鴻薇2023年12月開記者會爆料，指控行政院長卓榮泰找公股銀行幫候選人喬貸款，其中一名便是2024年原擬參選立委的林飛帆。林飛帆提出自訴，控王誹謗。本案於今日開庭，王否認犯罪，林的律師聲請傳喚合庫投信前董座林柏裕，全案候核辦。王鴻薇說，本案是吹哨者主動爆料，非她惡意指摘，她的助理也約自稱林柏裕司機的爆料人見面，當時對方也確實開著林的車前來。當天有對其言論錄音、錄影。此外，爆料人也提供手機以便查證，王更請具警察背景的林國春協助鑑定，林也在記者會上說錄音檔並無變造，王強調自己已盡查證義務。請繼續往下閱讀...王鴻薇的辯護律師陳佳瑤說，王鴻薇針對錄音檔經過多方查證，記者會所言也是根據錄音檔內容，符合公共利益和合理評論，主客觀上並無誹謗他人名譽之故意、行為，請求法官判處無罪。林飛帆的律師羅國豪除爭執王提出錄音檔的證據能力外，也聲請調閱林2023年12月28日至今的8家公股銀行貸款紀錄，並聲請傳喚林柏裕出庭作證。王鴻薇認為，調取貸款紀錄並無意義，因為林可以用其他法人、自然人、親友當人頭，若真的要調閱，應不分公股、泛公股、民營都調閱，而非只調閱公股銀行的貸款紀錄，至於傳喚林柏裕作證的部分則無意見。羅國豪表示，被告辯詞屬模糊焦點，稱依照過往見解，不會因為錄音檔為林柏裕的聲音，就免除被告查證義務，不然只要說「我只是轉述」就得恣意誹謗他人名譽。此外，由於先前王的律師希望法官可以當庭勘驗錄音檔，羅對此回應，錄音檔不可能單憑人耳多聽幾次，就能證明是林柏裕的聲音，且林若能到庭作證，也沒必要再勘驗錄音檔。法官最後准允聲請傳喚林柏裕出庭作證，至於是否需要進行手機錄音檔的勘驗，仍待後續審理期日再行斟酌，另外有關是否調閱林的貸款紀錄，法官則並未多做表示，全案候核辦。    ,https://news.ltn.com.tw/news/society/breakingnews/5441173
毒販請女友人跑腿送安非他命 各判14年、10年2個月,社會,2026/05/18 17:08,苗栗1名男子在超商外由女友人「開車外送」販賣第2級毒品甲基安非他命。苗栗地方法院審理後，判處該男有期徒刑14年；共犯女友人則判刑10年2個月。（資料照）苗栗1名男子在超商外由女友人「開車外送」販賣第2級毒品甲基安非他命。苗栗地方法院審理後，依販賣第2級毒品、意圖販賣而持有第2級毒品及轉讓禁藥等罪，判處該男有期徒刑14年；共犯女友人則判刑10年2個月。判決書指出，該男於2024年4月起聯絡販毒，曾於居所外以800元賣毒；另與其他毒客交易時，該男約定以「2條香菸」換取1公克毒品。同年6月，該男因故不便現身，將衛生紙包裹的毒品交給女友人開車前往超商外送並收取香菸。此外，他多次在住處提供毒品供毒友施用，涉犯轉讓禁藥罪。警方同年9月於該男住處搜出13包、純質淨重138.68公克的安非他命，為該男剛購買正要販售的貨源。請繼續往下閱讀...2人於偵查時認罪，卻在法院言詞辯論時翻供；該男與毒客勾串辯稱衛生紙包的是威而鋼，但該男稱未用夾鏈袋，毒客卻稱有夾鏈袋包裝，矛盾說詞被法官識破；涉案女友人雖辯稱以為是威而鋼，但法官認為主線謊言已被拆穿，且她偵訊時早就能精準供稱貨品以夾鏈袋包裝、說出內含毒品重量，戳破女子辯詞。法官審酌該男5年內再犯構成累犯，且最後關頭翻供、毫無悔意，不予自白減刑，依法判刑，全案仍可上訴。    ,https://news.ltn.com.tw/news/society/breakingnews/5441141
嘉義男子因煮湯起爭執涉砍傷母親頸部 法院裁押,社會,2026/05/18 17:02,嘉義縣林姓男子15日因煮湯方式與母親起爭執並大罵三字經，且涉嫌持菜刀砍傷母親頸部，幸未致命，警依殺害直系血親尊親屬未遂罪嫌移送，嘉檢向嘉院聲押獲准。嘉義地方法院今天表示，經訊問，林男否認有殺人故意，但依事證，涉及殺害直系血親尊親屬罪嫌重大。林男雖然坦承有攻擊母親事實，但對於取得菜刀過程所述和其母親有明顯差異。請繼續往下閱讀...嘉院說，林男與被害人為母子關係，殺人未遂與傷害罪刑度相差甚遠，有相當理由認為林男為求降低刑責而去勾串被害人，試圖降低犯罪情節嚴重性的可能。嘉院表示，林男已有多次對母親的家庭暴力行為，有事實足以認為林男有反覆實施家庭暴力犯罪之虞。這次林男酒後持菜刀攻擊母親行為，已嚴重危害社會秩序及被害人生命身體安全，因此，已於16日裁定羈押。檢警表示，48歲林男於15日中午想以電鍋熬煮海鮮湯品，不過，林母則當面告知現在電費很貴，且指責兒子又沒有在工作賺錢，還不知節電，當場被激怒的林男對著母親咆哮並大罵三字經，最後還持菜刀向母親揮了1刀，砍傷其左頸部，所幸並未致命。檢警說，林男供稱與母親起爭執時，是由林母先持菜刀作勢要教訓，才會奪下菜刀並向母親揮刀；另外，林母手臂也有利刃傷口，林男否認有持菜刀砍母親手臂，疑似爭執拉扯時造成。    ,https://news.ltn.com.tw/news/society/breakingnews/5441137
高雄狼警逼脫衣拍照至少6女受害 林于凱籲啟動預防性措施,社會,2026/05/18 16:42,林于凱（中）怒批近半年內，高市府發生多起利用職務性騷、性侵被害人案件。（資料照）原任職於高雄市三民區哈爾濱派出所的凃姓警員，被查出利用辦案名義，誘騙6名女性報案人脫衣供他拍照，全案於今年4月底正式偵結並提起公訴；對此，民眾黨市議員參選人林于凱今（18）日怒批，近半年內高市府發生多起利用職務性騷、性侵被害人的案件，呼籲公務系統在個人資料的保護上，需啟動預防性措施。對此，高雄市警局強調，警方高度重視員警違法偷拍相關案件，對於違法失職人員採零容忍態度，斷然淘汰，也將全力支持被害人依法聲請再議，並落實檢討執法與稽核機制，強化員警的性平教育。請繼續往下閱讀...林于凱指出，涂姓員警在「沒有女警、沒有第三人在場」的情況下，關上房門，要求女性報案人脫去外衣、僅剩內衣情況下進行私密部位拍攝，並且存檔在私人手機。全案在2024年12月高雄地檢署就已啟動偵查，偵查期間涂姓員警被調離現職並記一大過，但一直到今年4月底起訴後，才發現遭涂姓員警以類似手法拍攝私人特徵照片至少有6位受害者，才將他兩大過免職。林于凱說，這中間已經過了將近1年半，他好奇「這期間警局內部調查，難道都沒發現該員已是習慣性累犯？」且員警值勤在進行個人蒐證時，應該全程開啟密錄器，為何警局內部卻不知情？原來該員在犯案時，曾「多次關閉密錄器影像」。他認為，這種劇情好像不是第一次了，但為何警局內部對於執勤時密錄器中斷這件事卻好像習以為常。如果警界、檢察系統持續放任蒐證偵訊期間，錄影、密錄器可以隨意終止的事情繼續發生，就會有不肖的執法人員，透過這個便門，去危害個資、甚至演變成權勢性騷的狀況。林于凱批評，從六龜分局內部的權勢性騷、到三民一哈爾濱所對報案人的權勢性騷，警方對案件處理態度都是一再拖延，不是主動說明。近半年內高市府發生多起利用職務性騷、性侵被害人的案件，這已經不是個案，而是整個公務系統在個人資料的利用及保護上，需要啟動預防性措施。    ,https://news.ltn.com.tw/news/society/breakingnews/5441047
42次開相簿刪23照！惡警逼報案女脫衣拍照不起訴原因曝,社會,2026/05/18 16:34,高雄凃姓員警非法拍攝報案女性身體隱私，有6名報案女性案件已起訴，但另有1名女子被拍案，因罪證不足不起訴。市警局今天指出，已斷然淘汰凃男，支持被害人聲請再議權利。（資料照）高雄凃姓員警非法拍攝報案女性身體隱私，有6名報案女性案件已起訴，但另有1名女子被拍案，因罪證不足不起訴。市警局今天指出，已斷然淘汰凃男，支持被害人聲請再議權利。時代力量黨主席王婉諭昨天在臉書發文指出，一名化名Y女的女子在高雄飯店房間跟男友發生肢體衝突，驚慌失措的女子報警求助，卻遭三民一分局凃姓員警以檢查傷勢為由，要求脫到只剩內衣拍照。事後Y女報案提告卻因凃男涉嫌滅證，以證據不足獲檢方處分不起訴。Y女更指控高雄市政府跟警察局未曾關心，並聲請再議，希望檢方可以重新審視證據。請繼續往下閱讀...對此，高雄地檢署今天下午說明不起訴書內容，此案為檢警於民國113年12月27日發動搜索，查扣被告持用手機，並送請高雄市政府警察局刑事警察大隊科技犯罪偵查隊進行數位採證，結果顯示被告於案發時段分別有24次、18次開啟或操作手機相機、相簿紀錄；另在接獲警方來電後，還有42次開啟或操作手機相簿紀錄，包含刪除23筆照片。然而，因被告手機內部資訊已遭刪除並回溯，僅能還原操作紀錄，無從還原遭被告刪除照片。檢方據此無從還原，確認被告所刪除照片具體內容，也就無從證明被告曾拍攝或竊錄女子臀部或其他身體隱私部位影像資料，加上被告否認犯行，又查無其他事證佐證，因此依罪嫌不足處分不起訴。雄檢表示，此案經女子所提出的性騷擾申訴事件，經高雄市政府性騷擾防治審議會，認定被告行為確已成立權勢性騷擾事件，並依性騷擾防治法第27條第1項規定處以罰鍰。且被告手機中有利用執行職務，違法蒐集及利用其他報案女性身體特徵照片，涉犯違反個人資料保護法之情，此部分將另行提起公訴。且此件被告違反標準作業程序規定，也將函請其任職單位予以行政究責。高雄市政府警察局則發布訊息回應，警方高度重視員警違法偷拍相關案件，對違法失職人員採取零容忍態度，斷然淘汰。針對此案，檢方目前已偵查在案，警察局全力支持被害人依法聲請再議權利；也將落實檢討執法與稽核機制，並強化員警性平觀念教育。全案起於，高雄凃姓員警假借執行職務和檢查傷勢等名義，非法拍攝至少6名報案女性身體隱私合成裸照。雄檢依違反個資法等罪起訴。市警局表示，原記1大過調職，起訴後改記2大過免職。    ,https://news.ltn.com.tw/news/society/breakingnews/5440982
台中中區傳死亡案件 志工送餐驚見6旬獨居男躺床上無氣息,社會,2026/05/18 16:27,台中市中區王姓獨居男子（64歲），今天中午被送餐的教會志工發現躺臥床上，到場救護人員見王男明顯死亡未送醫，詳細死因正由檢警相驗釐清。（記者陳建志攝）台中市一名王姓男子（64歲），平時租屋獨居在中區中華路一棟大樓內，因身體不佳，平時中午、晚上都有教會志工送餐給他，今天上午11點多時，鄭姓志工（44歲）送午餐給他，叫人沒應門，進屋一看發現王男躺臥床上，疑似沒有氣息趕緊報案，救護人員到場確認明顯死亡未送醫，員警到場採證初步排除外力因素，詳細死因將由檢警相驗釐清。中市消防局今天中午11點25分接獲報案，指稱中區中華路1段某大樓有民眾躺臥家中床上需救護，救護人員到場時，發現王姓男子（64歲）明顯死亡，未送醫。請繼續往下閱讀...第一分局員警獲報，立即派鑑識人員到場採證，初步排除外力介入，全案報請台中地方檢察署司法相驗，以釐清確切死因。警方初步了解，王男平時在該處租屋獨居，已很久沒有跟家人連絡，身體狀況也不好，平時星期一至星期五都有教會志工送午餐、晚餐給他，今天中午，鄭姓志工（44歲）要送午餐給他，叫人沒應門，進屋一看發現他躺臥床上疑似沒有氣息趕緊報案。    ,https://news.ltn.com.tw/news/society/breakingnews/5441075
