Title,News_Type,date,content,url
普發現金1萬元假釣魚簡訊、電郵亂竄 有民眾不察遭盜刷5萬,社會,2025/09/23 14:42,刑事局公布詐騙假電郵。（記者姚岳宏翻攝）近期引起社會高度關注的「普發一萬」現金發放，民眾有望在10月領到現金，詐騙集團卻看準時機，開始大量發送假冒財政部等政府機關的電子郵件及釣魚簡訊，目前雖有民眾檢舉9件釣魚網站，另檢舉身分遭冒用的假檢警84件，但仍有民眾因點擊釣魚網站，輸入信用卡資訊，遭盜刷5萬餘元。刑事警察局提醒，政府發放現金絕不會以簡訊、Email或其他通訊方式，要求民眾預先點擊連結、填寫個人資料或轉帳匯款，請民眾務必提高警覺。刑事局指出，詐騙集團的首波攻擊手法，是以大量發送假冒政府機關的電子郵件及釣魚簡訊，內容多為「普發現金已開放登記」、「點此查詢領取資格」或「請盡速完成資料驗證」等，誘騙民眾點擊惡意連結，企圖竊取銀行帳號、信用卡資訊、身分證字號等重要個資。請繼續往下閱讀...165詐騙諮詢專線統計，自8月普發現金議題發酵開始，民眾檢舉釣魚網站9件、檢舉詐團以民眾身分遭冒用，需監管民眾帳戶84件，且已有民眾點擊釣魚網頁上當受騙，民眾經假冒政府Email連接假網址後，以假亂真的網頁教民眾輸入信用卡資訊，遭詐團盜刷外國貨幣、遊戲點數和禮券，收到簡訊驗證碼時，竟不疑有他的輸入OTP驗證碼，遭盜刷5萬多元。刑事局分析民眾檢舉的釣魚網站網址：https://mofy-gov.net/tw、https://mofb-gov.net/tw、https://6000-mof-tw.net/tw，及假冒Email：do_not_reply@on24event.com，皆是運用類同於政府官方網頁的帳號。對於此類假網站或假連結，刑事警察局已強力追查並予以封鎖屏蔽，並提供破解小撇步請民眾牢記：假網頁或假Email的網址，會是亂數，或「.com」、「.net」等商用網址，而非政府官方以「gov.tw」結尾的網址。刑事局表示，政府普發現金的相關細節，將會透過行政院官方管道正式公告，不會以個資遭冒用領取普發現金，而要求電話做筆錄、交出銀行帳戶給檢警單位監管等，請民眾保持警覺，切勿聽信不實訊息。刑事局公布詐騙假網址。（記者姚岳宏翻攝）刑事局提醒普發現金絕不會要求填寫信用卡資料。（記者姚岳宏翻攝）熱門賽事、球星動態不漏接    ,https://news.ltn.com.tw/news/society/breakingnews/5187929
剴剴案》民團：劉家姊妹是凌虐兒童為樂殺人魔 都應判無期,社會,2025/09/23 14:37,高等法院今（23日）下午首次開庭審理「剴剴案」，提訊保母劉彩萱、劉若琳姊妹。（記者陳逸寬攝）台北市惡保母姊妹劉彩萱、劉若琳被控於前年底凌虐1歲10月男童「剴剴」致死，台北地院國民法官庭將劉彩萱判處無期徒刑，創下虐童案件史上最重刑紀錄，劉若琳視為共同正犯判刑18年徒刑，劉家姐姊和檢方均上訴高等法院，高院今下午2時30分開庭，多個人權、婦女團體到場關切，民團兒虐容忍發言人鄭瑄霓指出，劉彩萱2姊妹就是「以凌虐兒童為樂的殺人魔」，建請高院都應重判，均判無期徒刑，沒有減輕刑責的可能性，政府亦應儘速成立兒少部，維護兒童的權益。劉彩萱2姊妹均上訴高院，劉彩萱否認「剴剴」的頭部、生殖器等傷勢是她造成，主張北院國民法官法庭判她無期徒刑過重，劉若琳則做無罪答辯；高檢署則針對劉若琳的部分提起上訴，主張一審判刑過輕。請繼續往下閱讀...今下午開庭，大批婦團、民團到場旁聽，兒虐容忍發言人鄭瑄霓指出，劉家姊妹虐死「剴剴」，下手之狠令人無法接受，一個不到2歲的孩童被劉家姊妹凌虐到精神崩潰，還得到憂鬱症，劉若琳上訴還主張她無罪，痛批「妳們最講，我們都不敢聽」，至少2姊妹都要判決無期徒刑。鄭瑄霓亦指出，我國保護兒少的權益非常不足，建請政府應儘速成立兒少部，像發生「剴剴」被虐死事件，至今有那些官員被追究責任？日本都先住國家都有類似政府部門。北院判決指出，劉彩萱、劉若琳姊妹皆為專業保母，自2023年9月4日至12月23日晚間剴剴送醫為止，先由劉若琳以不明物體刮傷剴剴的頸部，再由劉彩萱以徒手或持物品毆打、捏拉耳朵、從後推倒撞地等方式傷害剴剴，並以毛巾綑綁、口罩蒙眼方式，限制剴剴的行動自由，劉彩萱還同時拍照傳送給劉若琳。劉彩萱並命令剴剴裸體僅穿尿布罰站、洗冷水澡、在廁所內灌食不足每日營養需求的隔夜菜，姊妹並曾將剴剴綑綁後放入桶子裡，以裸體僅著尿布躺臥在地上、不得變換姿勢；見剴剴日益瘦弱且有外傷，年女均未積極帶他去就醫治療，終致剴剴營養不良、身體衰弱，全身至少42處虐待性傷勢，還得了憂鬱症，終致於同年12月24日凌晨因低血溶性休克死亡。北院國民法官庭今年4、5月間連續3週密集開庭10天，參酌解剖、兒科、精神醫學等鑑定報告，認定剴剴全身有42處傷勢、患憂鬱症等心理疾病，確實是遭劉彩萱綑綁、長時間罰站、凌虐、毆打所致，終因組織細胞血液灌流不足、血管塌陷終致死亡。國民法官庭判決痛批劉彩萱以虐為樂，動輒對無反抗能力的剴剴施暴凌虐，使無辜的剴剴長期遭受身體疼痛及饑餓終致死亡而無可挽回，且她直到在證據調查幾近完畢時，才坦承部分犯行，無助於釐清事實、節省刑事司法成本上，迄未與死者家屬達成和解、取得宥恕，故量處無期徒刑。至於劉若琳，國民法官庭認為，她雖非主要照顧者，但未阻止姊姊施虐，反而附和、迎合、鼓吹姊姊施虐，視為共同正犯，重判18年。劉家姐姊和檢方均上訴高等法院。高等法院今（23日）下午首次開庭審理「剴剴案」，提訊保母劉彩萱、劉若琳姊妹。（記者陳逸寬攝）高等法院外聚集聲援愷愷的民眾。（記者陳逸寬攝）民團兒虐零容忍發言人鄭瑄霓（中）痛批劉彩萱2姊妹都是以「凌虐兒童為樂的殺人魔」，至少都應判無期徒刑」，並建請政府儘速成立兒少部。（記者楊國文攝）熱門賽事、球星動態不漏接    ,https://news.ltn.com.tw/news/society/breakingnews/5187911
花蓮警車押解通緝犯疑天雨路滑撞燈桿 嫌犯不治 警1重傷、1輕傷,社會,2025/09/23 14:36,新城警分局加灣所一輛警車，今天下午在移送詐欺通緝犯前往分局路上，在台九線三棧路段，疑似路面積水發生車輛打滑現象，自撞路中安全島及燈桿，車輛嚴重變形，2人受重傷，其中通緝犯送醫不治。（民眾提供）首次上稿：13:52更新時間：14:36（新增通緝犯送醫不治）樺加沙颱風上午為花蓮帶來間歇大雨，新城警分局加灣所一輛警車，今天下午在移送詐欺通緝犯前往分局途中，在台九線三棧路段，疑似路面積水發生車輛打滑現象，自撞路中安全島及燈桿，車輛嚴重變形，坐在後座的警員與林姓通緝犯卡在車上、警車駕駛輕傷，3人緊急送醫，其中後座2人傷勢較為嚴重，林姓通緝犯下午2點多宣告傷重不治，詳細事故原因還需要進一步調查。請繼續往下閱讀...初步了解，29歲戴姓、李姓員警今天下午從加灣派出所要送36歲林姓通緝犯到新城分局偵查隊，行經台九線三棧路段時發生車禍，強大撞擊力讓坐在後座的李姓員警、林姓犯嫌受到車體變形擠壓受困車內，前座開車的戴姓員警臉部及身上多處擦挫傷。花蓮縣消防局獲報後出動新秀、美崙等車組及破壞器材到場救援，後座李姓警員腳部嚴重開放性骨折，林姓犯嫌傷勢嚴重一度失去生命跡象，經消防人員協助脫困後2人目前都在醫院搶救當中，林姓男子下午2點多宣告不治。新城警分局指出，詳細的車禍原因目前調查當中，初步懷疑天雨路滑。新城警分局加灣所一輛警車，今天下午在移送詐欺通緝犯前往分局路上，在台九線三棧路段，疑似路面積水發生車輛打滑現象，自撞路中安全島及燈桿。（民眾提供）新城警分局加灣所一輛警車，今天下午在移送詐欺通緝犯前往分局路上在台九線三棧路段自撞路中安全島及燈桿，車輛嚴重變形。（民眾提供）熱門賽事、球星動態不漏接    ,https://news.ltn.com.tw/news/society/breakingnews/5187857
拒捕強行駛離自撞電桿被逮 偷車賊與警都受傷,社會,2025/09/23 14:34,張嫌駕駛偷來的小貨車被警方圍捕時衝撞受傷。（擷取自黑色豪門企業）台中市東勢警分局今天上午10點多在東勢區新盛街與新盛九街口查獲涉嫌偷竊小貨車的張姓男子，上前攔查時，張嫌竟拒捕強行駕車離開，結果波及一輛轎車後並失控自撞電線桿，員警隨即破窗，運用優勢警力將張嫌制伏逮捕，並於車上起獲安非他命及海洛因等毒品，張嫌頭腳擦挫傷，經送醫治療後由警方戒護，逮捕過程中，警員戴鈞皓也手部受傷送醫治療。東勢警分局表示，日前接獲情資，指一輛被竊的小貨車出現在轄區，經調閱車行紀錄確認後，立即派員展開巡查，今天上午10點多，員警在新盛街口發現該車後，隨即埋伏監控，見時機成熟立即上前攔查。請繼續往下閱讀...不料，駕駛小貨車的張嫌（50歲）拒捕並駕車衝離，警車上前包抄，小貨車撞到停在路邊的一輛轎車，隨即失控自撞電線桿，員警旋即破窗，以優勢警力成功將張嫌制伏逮捕，並於車上起獲安非他命及海洛英等毒品。逮捕過程，張嫌因撞電線桿致頭腳擦挫傷，經送醫治療後由警方戒護，警員戴鈞皓也手部受傷，同樣送醫治療。警方鑑識小隊到場蒐證，並由交通分隊進行事故測繪，將偵訊後依法送辦。熱門賽事、球星動態不漏接    ,https://news.ltn.com.tw/news/society/breakingnews/5187918
寄提款卡可領284萬元補助？ 女臉書遇詐險淪詐騙共犯,社會,2025/09/23 14:28,警方拿出詐騙案例，打消顏女申辦帳戶念頭。（記者吳昇儒翻攝）又見臉書廣告詐騙！基隆一名34歲顏姓女子在臉書上看到廣告稱，只要寄出提款卡，就可以領取284萬補助款。顏女異想天開，昨日中午真的到銀行要申辦帳戶，準備將提款卡寄出。所幸行員發現異狀，趕緊通知警方到場。經員警勸阻後，顏女才打消申辦念頭。基隆市警察局第二分局八斗子分駐所接獲轄內金融機構通報稱，有民眾欲申辦帳戶用來請領補助款，警員詹元凱趕緊前往現場。顏女向警方表示，自己在臉書上看到廣告，上面寫著，只要寄出提款卡，就可領取補助款，最高可達284萬元。請繼續往下閱讀...詹員趕緊拿出相關詐騙案例，寄出提款卡給陌生人，可能會有不明金流匯入或匯出，而淪為人頭帳戶，淪為詐欺共犯。顏女才恍然大悟，打消申辦新帳戶念頭。第二分局八斗子分駐所所長陳志峰表示，詐騙集團常利用投放一頁式廣告，宣傳寄出個人帳戶可領取高額獎金等吸睛字眼，應多加查證，妥善保管個人金融帳戶，個資不外露，以免落入詐騙集團的利用，淪為人頭帳戶的陷阱，如有任何問題可撥打165反詐騙諮詢專線或110報案電話查詢。熱門賽事、球星動態不漏接    ,https://news.ltn.com.tw/news/society/breakingnews/5187901
才剛打死人！ 桃園狂男又持刀捅人險釀死還找少年頂罪 檢求刑8年6月,社會,2025/09/23 14:27,桃園市羅姓男子犯下傷害致死案才隔2個月，又因酒後細故持刀捅人，事後還找少年頂罪，桃園地檢署依殺人未遂罪嫌將他起訴求處8年6月重刑。（記者余瑞仁攝）桃園市24歲羅姓男子於2022年10月間才犯下一樁傷害致死案，時隔2個多月又於2023年1月間與友人在中壢區1家酒店前與不認識2名酒客起衝突，羅男又涉嫌持刀向對方胡姓男子背部捅了3刀導致氣血胸，胡男送醫緊急手術、住進加護病房才保住一命，羅事後還教唆蕭姓少年頂罪，蕭姓少年事後向桃園地檢署檢察官自首頂替，檢方認為羅男目無法紀、漠視他人生命且毫無悔意，偵結依殺人未遂等罪嫌起訴並具體求刑8年6月。檢警調查，羅姓男子與多名友人於2023年1月6日深夜11點多在中壢區復興路1家酒店前與2名不認識的酒客起口角，羅男與友人動手圍毆2人，羅男更到車上取出1把彎刀，趁對方胡姓酒客被打蹲在地上不及防備之際，對其背部捅了至少3刀，胡被砍殺倒地不起，羅又持刀欲追殺另1酒客，經同行友人攔阻，隨後上車逃離現場。請繼續往下閱讀...被捅3刀的胡姓酒客因胸部遭刺穿氣血胸，經119獲報派遣救護車送往林口長庚醫院急救，院方緊急開刀切除部分肺葉、固定肋骨與清創才救回1命，之後住進加護病房休養1個多月出院。案發後警方積極緝凶，羅男卻唆使蕭姓少年出面頂罪，允諾給予安家費並會幫忙委任律師，直到去年蕭姓少年良心不安向檢察官自首是為羅男頂替；檢方查出，羅男因於2022年10月4日犯下另起傷害致死案件，擔心再犯曝光被判重刑而找人頂罪，該起傷害致死案羅男被判刑8年。檢方認為，羅男此前犯下傷害致死案才過2個月，又再度涉犯持刀殺人未遂案，顯見羅男目無法紀、漠視他人生命且毫無悔意，偵結依殺人未遂罪嫌將他起訴，並向法院具體求處8年6月有期徒刑。熱門賽事、球星動態不漏接    ,https://news.ltn.com.tw/news/society/breakingnews/5187902
高雄大寮工廠火警  黑煙竄天幸無人傷,社會,2025/09/23 14:27,大寮區華中路工廠發生火警，冒出黑色濃煙。（民眾提供）高雄市大寮區華中路一家工廠今（23）日上午11時56分發生火警，廠區內冒出陣陣黑色濃煙，消防局出動11車30人馳援，佈置水線撲滅，火勢於12時15分火勢撲滅，無人員受傷受困。火警原因調查中。熱門賽事、球星動態不漏接    ,https://news.ltn.com.tw/news/society/breakingnews/5187904
竹市稅務局拍定千萬級欠稅人土地 為市庫挹注800萬,社會,2025/09/23 14:11,竹市稅務局拍定千萬級欠稅人土地，追回欠稅600萬。（市府提供）新竹市稅務局與行政執行署新竹分署聯手出擊，成功拍定一名長期欠繳地價稅大戶名下遭占用土地及私設通路，拍定金額近900萬元，追回地價稅600萬元，加計拍賣產生的土地增值稅200萬元，合計為市庫挹注800萬元。稅務局指出，吳姓欠稅人多年未繳納地價稅，列名新竹市公告的「千萬級欠稅人」。為維護租稅債權，稅務局成立「欠稅追追追小組」，針對其財產詳加分析，發現其名下土地遭鄰近住戶長期違法占用，並以帆布、鐵皮，甚至水泥搭建為車庫使用。過去雖多次辦理拍賣，均因流標未果。今年初重新勘查，發現占用情形加劇，且區域內停車需求殷切，評估具拍賣實益，與新竹分署合作再度啟動執行程序。請繼續往下閱讀...稅務局說明，為提升拍賣成功率，稅務局重新辦理土地鑑價，拍賣底價較前次調高一成，並主動將拍賣資訊提供給社區管委會與實際占用人，指出若不積極投標，未來可能面臨「一位難求、無位可停」的困境。在積極宣導與推動下，最終遭占用土地及私設通路以近900萬元順利拍定，成功標脫多年積欠案。針對吳男多次辯稱自己僅為「人頭戶」、只是名義上的所有權人，稅務局強調，依據《土地稅法》第3條規定，地價稅納稅義務人為土地所有權人，並不因為僅為名義登記，即可免除納稅義務。熱門賽事、球星動態不漏接    ,https://news.ltn.com.tw/news/society/breakingnews/5187883
醉漢起口角負氣下公車 竟昏睡馬路上挨罰,社會,2025/09/23 14:10,警方到場告誡王男，不要妨礙交通，並依法舉發，開出罰單。（記者吳昇儒翻攝）基隆一名王姓男子今日上午酒後搭乘公車返家途中，與乘客發生口角，一時氣憤之下直接下車，卻不勝酒力當場坐臥在馬路上。附近的義交發現後趕緊將他喚醒，並通知警方到場處理。員警到場後，勸導王男搭乘其他公車離去，另也依道路交通管理處罰條例對其開罰。基隆市警一分局忠二路派出所員警到場後，發現王男已經起身，但眼神渙散，經詢問得知他在公車上與其他乘客發生口角，最後決定在循環站提前下車，但因酒醉直接坐在馬路上昏睡過去。請繼續往下閱讀...警方告誡王男後，協助他搭乘其他班次公車離去，其妨礙交通行為，則依道路交通管理處罰條例第78條第一項第4款阻礙交通，開罰5百元。熱門賽事、球星動態不漏接    ,https://news.ltn.com.tw/news/society/breakingnews/5187877
只差900公尺！ 國3後龍段連2天車輛開輔助駕駛撞上工程車,社會,2025/09/23 14:09,只差900公尺，國道3號後龍段連2天車輛開輔助駕駛撞上工程車。（民眾提供）39歲黃姓男子今（23）日中午11時34分駕駛掀背車行經國道3號北上128.9公里處、苗栗縣後龍鎮路段時，先撞擊位於內側車道由20歲鄭男駕駛的工程警示車後，再往前撞上由64歲范男駕駛的施工緩撞車，警方於12點排除狀況，而黃男當時使用輔助駕駛功能，也是國道3號後龍鎮路段連2天發生車輛撞上工程車事故，今天事故地點距離昨天僅距離約900公尺。國道第二大隊表示，事發當時黃男駕駛車輛行駛於內側車道，疑因未注意車前狀況在事故發生地點先後撞上工程警示車與施工緩撞車，所幸無人受傷，3名駕駛酒測值均為0。至於當時工程車正在進行國道耐震補強作業。請繼續往下閱讀...由於35歲林姓男子於22日上午9點多駕駛休旅車行經國道3號北向128公里處、苗栗縣後龍路段時同樣在內側車道直接撞上施工緩撞車，林男駕駛的休旅車車頭因此撞爛，連續2天發生類似事故且地點不遠，國道警方也呼籲駕駛，開車時應保持專注，避免因一時疏忽釀成事故，使用自動輔助駕駛並無法應付所有突發狀況，如未注意車前狀態而肇事致人重傷或死亡，亦將吊扣或吊銷駕照。只差900公尺，國道3號後龍段連2天車輛開輔助駕駛撞上工程車。（民眾提供）只差900公尺，國道3號後龍段連2天車輛開輔助駕駛撞上工程車。（民眾提供）熱門賽事、球星動態不漏接    ,https://news.ltn.com.tw/news/society/breakingnews/5187880
北市轎車停路邊停車格  赫見男子陳屍車內死亡多時,社會,2025/09/23 13:57,救護人員到場時發現何男已經明顯死亡。（記者王冠仁翻攝）今天有民眾路過台北市重慶北路附近時，發現路旁有一輛廂型車，車內後座坐著一名男子動也不動，民眾擔心發生意外報警。救護人員到場時，發現該名男子遺體甚至出現僵硬情形，明顯死亡多時；轄區警方查出死者是54歲何姓男子，大同分局目前正在進一步釐清。台北市消防局在今天早上11時37分接獲報案，報案民眾聲稱，位在重慶北路三段一處路旁停車格內有輛廂型車，一名男子坐在車內後座動也不動。救護人員趕到現場時，發現該名男子已經屍僵，死亡多時。請繼續往下閱讀...警方初步調查，當時何男遺體趴在後座，身上沒有明顯外傷，車內外也沒有打鬥痕跡，也沒有在車內找到遺書，目前尚無法確認死因。警方查出何男身分後，現在已經聯繫上他位在中部的妹妹，將於明天北上處理後續事宜，並報請司法相驗進一步釐清死因。（14:29更新）救護人員到場時發現何男已經明顯死亡。（記者王冠仁翻攝）熱門賽事、球星動態不漏接    ,https://news.ltn.com.tw/news/society/breakingnews/5187862
板橋雨衣搶匪到按摩店恐嚇 要錢不成點汽油燒店,社會,2025/09/23 13:32,新北市板橋一處按摩院傳出遭縱火，消防人員趕往滅火。（記者吳仁捷翻攝）新北市板橋一間按摩店驚傳遭一名男子到店內櫃檯淋汽油，恐嚇要錢不成，憤而縱火後逃逸，店員嚇得滅火、報警，警方趕抵，火勢已熄滅，幸無人受傷；警方目前掌握嫌犯穿黃雨衣、戴安全帽逃離，手持家庭號鮮奶瓶裝滿汽油進入店內，犯案全程不到一分鐘，由於嫌犯知道櫃台內收銀機位置，懷疑是顧客所為，警方正全力緝捕縱火嫌犯到案中。警方調查，這起案件發生在今天上午11時許，板橋松江街一間按摩店傳出火警，報案店員指稱，1名男子進入店內潑灑汽油，要求店員提供現金，店員不從，男子憤而點火後匆忙離去。請繼續往下閱讀...海山警分局偵查隊、江翠所獲報後派員到場，警方掌握犯嫌身著黃色雨衣，頭戴安全帽，手持一個疑似家庭號鮮奶瓶大小的塑膠桶，11時17分進入店內將櫃台淋滿汽油，並向店員索抽屜現金未果，雖未要求金額，但犯嫌隨即持打火機點燃櫃台汽油後離去，全程約1分鐘。新北市板橋一處按摩院傳出遭縱火，警方封鎖現場採證。（記者吳仁捷翻攝）新北市板橋一處按摩院傳出遭縱火，警方封鎖現場採證。（記者吳仁捷翻攝）熱門賽事、球星動態不漏接    ,https://news.ltn.com.tw/news/society/breakingnews/5187815
泰女將倉鼠沖馬桶引眾怒 法院火速判拘役60日,社會,2025/09/23 13:29,泰國籍女子Promin，慘忍將飼養的10隻倉鼠丟進馬桶沖走，台中地院火速判拘役60日。（擷取自Threads）台中一名27歲泰國籍女子Promin，慘忍將飼養的10隻倉鼠丟進馬桶沖走，還把過程拍下傳到Instagram限時動態炫耀，引爆社會公憤，檢方在得知後8天就火速偵結，依違反《動物保護法》等罪提起公訴，台中地院審理10天，也迅速依違反《動物保護法》等罪判她拘役60日，併科20萬元罰金，可上訴。上月底，有愛鼠人士網友在Threads中PO出一段疑似泰國女子在IG限動PO出將10隻活蹦亂跳的小倉鼠，分批次丟馬桶沖掉畫面，只見倉鼠掉到水中時痛苦掙扎，直接被沖走，讓這位愛鼠網友非常痛心，而數萬網友也痛批殘忍。請繼續往下閱讀...檢察官調查，Promin上月27日傍晚在北區租屋處和男友起爭執，一氣之下竟將10隻活蹦亂跳的倉鼠沖進馬桶、溺水慘死，事後還將手機拍攝影片，製成4段限時動態公開張貼，供不特定人觀賞，引發網友強烈撻伐，不少人痛斥「手段殘忍」。台中市動保處獲報隨即告發，警方循線比對，確認影片中女子正是上月底因逾期居留2年而被移民署收容的Promin，隨即將案件移送檢方偵辦，她雖坦承但辯稱是因男友揚言要「把倉鼠拿去餵蛇」，才會將倉鼠丟進馬桶沖掉，台中地檢署依違反動保法將她起訴。台中地院法官考量，Promin將10隻飼養的倉鼠以丟入馬桶的方式致其死亡，造成其恐懼、痛苦，甚至還將虐待動物的影片上傳網路供人觀賞，影響社會善良風氣，審酌她已坦承犯行，依故意傷害動物致動物重要器官功能喪失罪，處拘役50日，併科20萬元罰金，散布虐待、傷害動物影像罪，則處拘役20日，兩罪合併處拘役60日，可上訴。熱門賽事、球星動態不漏接    ,https://news.ltn.com.tw/news/society/breakingnews/5187806
