Title,News_Type,date,content,url
「信賴台灣之友會」訪日拚觀光 日本政要：台日命運共同體須安全合作,政治,2025/12/04 16:50,信賴台灣之友會此行拜會大阪府議會、大阪市議會及神戶市議會。（圖由信賴台灣之友會提供）日本首相高市早苗表達挺台立場，總統賴清德則在社群平台分享品嚐日本水產，共同展現台日友好情誼。「信賴台灣之友會」總會理事長劉國隆今（4日）表示，台灣民間熱烈響應賴總統的台日友好立場，本週自發率團赴日交流參訪，也一起拚經濟，為受中國打壓的日本民生觀光注入活水，也與關西地區日本民代深入交流，並邀請日方組團回訪台灣，獲得盛情回應。「信賴之友會台日友好參訪團」此行拜會大阪府議會、大阪市議會及神戶市議會。神戶市議會由日台友好神戶市議會議員聯盟會長坊泰隆、長期挺台的神戶市議員上畠寬弘等人接待。坊泰隆表示，台日是命運共同體，須共同加強安全合作，台灣與神戶有直飛航班，期盼未來頻繁交流；大阪市議會議長杉村幸太郎也表示，加強台日緊密交流是大阪市致力的目標，將會一直延續下去不會間斷。請繼續往下閱讀...大阪府議會則為參訪團此行拜訪的最高層級，由大阪府議會議長金城克典、大阪府議會日華親善議員聯盟會長杉江友介議員與自民黨大阪府議員團幹事長鹿田松男接待。議長金城克典對於今年台灣風災表達關心慰問，也表示2025大阪關西世博的台灣館驚艷了非常多日本人，台灣小吃更獲得一致好評。希望以此為契機，更近一步加深台日交流與緊密合作。劉國隆表示，信賴台灣之友會願做為領頭羊，透過台灣民間自發的行動，響應賴清德總統的登高一呼，讓台日建立更穩固的情誼，除了政治與軍事合作，民間社團也能建立常態交流模式，讓互動更頻繁。此行也邀約日本政要組團訪台觀光，並獲得盛情回應，期盼早日訪台。熱門賽事、球星動態不漏接    ,https://news.ltn.com.tw/news/politics/breakingnews/5267877
新竹市2議員退出 「新聯線政團」面臨解散,政治,2025/12/04 16:45,新竹市2議員宣布退出，以民眾黨議員為主的「新聯線政團」面臨解散。（資料照，記者洪美秀攝）新竹市議會前天歷經占主席台及推擠拉扯大場面，今天再傳出，以民眾黨議員及友好議員為主的議會第4政團「新聯線政團」面臨解散。無黨籍議員鄭慶欽與退出國民黨團運作的原住民議員林慈愛雙雙宣布退出議會新聯線政團運作，需7席議員才得以成立的新聯線政團面臨解散。鄭慶欽受訪說，他原本就是無黨籍，服務不分黨派，但近期被貼上是民眾黨標籤，他已完成階段性任務，將退出新聯線政團，以無黨籍身分服務選民。新竹市議會由政黨組成的黨團包括國民黨、民進黨和時代力量，依照議事規則，政黨成立黨團需3人以上，而要成立新的政團需7名議員以上。民眾黨籍議員只有李國璋與宋品瑩，2022年當選後，為協助涉貪停職且退出民眾黨的市長高虹安推動市政工作，在議會尋求國民黨籍但2022年選舉陣前倒戈支持高虹安的副議長余邦彥及原國民黨籍的陳啟源和林慈愛、無黨籍的鄭慶欽與孫鍚洲共7人，在2023年成立議會第4政團「新聯線政團」，政團除了在議會支持高虹安推動市政，也被認為是民眾黨在議會的附屬政團，加上與國民黨團友好，外界統稱「白藍合」。請繼續往下閱讀...明年是選舉年，原是國民黨籍的林慈愛為爭取黨內提名，決定退出新聯線政團運作。無黨籍議員鄭慶欽則說，他本來就無黨籍，擔心被貼上民眾黨標籤，也宣布退出政團運作。無黨籍議員孫鍚洲受訪說，既然鄭慶欽與林慈愛都宣布退出，當然他也會退出，因為新聯線政團已無法運作，就無政團存在必要了。新竹市原國民黨籍的原住民議員林慈愛宣布退出議會第4政團新聯線政團。（記者洪美秀攝）新竹市無黨籍議員鄭慶欽宣布退出議會第4政團新聯線政團的運作，不希望被貼上民眾黨標籤。（記者洪美秀攝）熱門賽事、球星動態不漏接    ,https://news.ltn.com.tw/news/politics/breakingnews/5267823
女主持人提問李四川回「妳可能聽不懂」林楚茵轟：要選市長先補性平意識,政治,2025/12/04 16:44,國民黨籍台北市副市長李四川表態投入新北市長選戰。（資料照）國民黨籍台北市副市長李四川昨（3）日接受媒體人黃暐瀚「下班瀚你聊」網路節目專訪，表態參加新北市長黨內初選，但在面對女主持人雪寶的提問時，又脫口說出「妳可能不懂」，再度引發批評聲浪。民進黨立委林楚茵今（4）日發文痛批，若想選新北市長，「性平意識要先補起來」。她指出，李四川之前酸蘇巧慧「執政不是穿得漂亮」昨天又在節目裡質疑女主持人「你會聽不懂。」請繼續往下閱讀...林楚茵質疑，在李四川眼裡，女性是不是就等於不懂專業、不會執政？她反問，誰說女市長「穿得漂亮」就不會執政？誰說女主持人遇到專業議題會「聽不懂」？不懂尊重女性，要利用女性的時候卻很會！她更嘲諷，朱立倫選總統有「淡水阿嬤」，李四川選新北市長又有「板橋阿嬤」，國民黨這些政治人物選舉不能自己決定，每次都搬阿嬤出來背書？李四川不是口誤而是「老藍男」思想根深蒂固！林楚茵強調，台灣有不少優秀政治人物、部會首長是女性，女性還可以當總統，「楚茵懂國防，這也是對國家的關心、議題的學習，女性不是只能當男性的陪襯！李四川還有臉說民調第一，誰給的勇氣？」熱門賽事、球星動態不漏接    ,https://news.ltn.com.tw/news/politics/breakingnews/5267799
愛莉莎莎也在內！Threads新功能標示IP 「這些人」都在中國,政治,2025/12/04 16:44,有網友意外發現包含網紅「愛莉莎莎」、前立委蔡正元等部分知名人物所在地也被標示中國。（圖擷取自Threads）Threads近日推出新功能，網友可以查詢其他帳號主人「所在地點」，一票假扮台灣人的中國網軍因此現形。不過，有網友意外發現包含網紅「愛莉莎莎」、前立委蔡正元等部分知名人物所在地也被標示中國，目前並不知道Threads詳細的判斷標準，不過此事已經引發網路熱議。Threads最近新增查詢用戶所在地功能，使用者只要對著其他用戶個人檔案，就會顯示該用戶的所在地點。結果大量假冒台灣人的中國網軍因此現形，其中甚至有訂閱高達數十萬的網紅也被抓包。請繼續往下閱讀...此外，有網友意外發現不少台灣知名人士所在地也在中國，其中包含昨天才在發文、紀念和姊妹們第一次到杜拜旅遊的愛莉莎莎。此外還有前立委蔡正元，不過他目前帳號所在地已經轉為顯示「不分享」。另外，北市議員侯漢廷則被發現有2個Threads帳號，其中1個只有352名粉絲的帳號，所在地點也在中國，不過，不知道是否為本人經營。目前並不知道Threads所在地顯示的標準，但已經引起網友質疑：「中國幫忙經營粉專？」、「統一被代操嗎？」、「帳號都被網軍幫忙管理。」熱門賽事、球星動態不漏接    ,https://news.ltn.com.tw/news/politics/breakingnews/5267742
藍白反對！立院明處理財劃法覆議案不邀卓榮泰報告直接表決,政治,2025/12/04 16:38,立法院長韓國瑜主持朝野協商。（資料照）立法院長韓國瑜今天主持朝野協商，研商有關行政院針對立法院三讀通過修正「財政收支劃分法部分條文」移請立法院覆議案相關事宜。民進黨團主張讓行政院長卓榮泰來立法院報告，藍白黨團不同意認為表決即可，最後朝野無法達成共識，覆議案將於明天院會進行表決。民進黨團總召柯建銘說，財劃法在今年2月時行政院也有提覆議案，當時行政院長有來做報告，應該沿例邀請行政院長來備詢。請繼續往下閱讀...國民黨團總召傅崐萁說，此覆議案又創了中華民國憲政史上的特例，不只一任的行政院長內提了8次復議案，同一個法案還可以提兩次覆議，這真的是滑天下之大稽。在過去一次復議案成功被在野黨所否決，這個行政院長早就應該知所進退了。現在整個行政院已經把覆議當作日常，只要國會通過的、行政院不想實施就提覆議案，覆議案沒有通過他也不下台，繼續用蠻幹的方式，違法、違憲的來執政。民進黨團幹事長鍾佳濱說，行政院兩次提出覆議案，要檢討的其實不是行政院，是被憲法法庭打臉的立法院的國會多數。請主席就財劃法覆議案，立法院邀請行政院長來做說明，讓在野多數去理解為什麼行政院認為窒礙難行。國民黨團書記長羅智強說，要找藉口還怕找不到嗎，史上8次覆議的賴皮院長就是卓榮泰，這鐵板釘釘的事情。所以也不用那麼麻煩，賴皮院長覆議8次也不在乎立法院來報告什麼，所以不用來報告了，明天就直接來覆議表決否決回去，院長反正心意已決，來報告也是多此一舉，那不如我們就明天比較乾乾脆脆的來表決，看看這個民眾是不是能夠接受這樣一個賴皮覆議院長。民眾黨團總召黃國昌說，財政收支劃分法的修正案到底是發生了什麼事情？這段時間財劃法因為地方政府被綁票，所以在也對於追加預算才勉予同意，所以這一次針對財劃法卓榮泰要提覆議，那我們就按照議事規則表決，「沒有必要讓這個第8度提醒復議、中華民國憲政史上最會提醒覆議的院長再來立法院這邊做任何的報告」。朝野協商結論內容指出，一，各黨團同意12月5號院會報告事項處理完畢，同日改開全院委員會審查財政收支劃分法覆議案，審查的時候不邀請行政院院長列席說明，由各黨團推派一位委員發言，每位委員發言時間5分鐘 ，當次院會不進行國是論壇，不處理臨時提案，也不再處理變更議程，含抽出動議；二，全院委員會審查完畢，同日改開院會進行記名投票表決。熱門賽事、球星動態不漏接    ,https://news.ltn.com.tw/news/politics/breakingnews/5267813
陳玉珍推助理費除罪化 立院報告：美日皆納公務員職務犯罪,政治,2025/12/04 16:28,立法院議場。（資料照）國民黨立委陳玉珍提案將國會助理費除罪化，立法院法制局發布一份專題研究報告，說明美國及日本都將國會議員納入公務員職務犯罪範圍；德國聯邦議會則基於國會自律原則，若議員浮報國會助理工作費，由議會主席團裁處最高達議員年度報酬半額的行政罰，並將結果予以公開，以訴諸政治責任。立法院法制局今年曾發布「各國國會公費助理之比較研究—兼論立法委員聘任公費助理相關法制問題研析」專題報告，探討德、英、美、日、韓五國的國會公費助理制度，對於人事制度、工作職別及相關權利義務等法令進行比較研究。請繼續往下閱讀...在聘用資格方面，報告指出，美國國會助理無特別的資格條件限制，但議員個人助理必須迴避三等親親屬，委員會助理則須避免黨派關係任用。德國國會助理現為或曾為議員的血親、配偶、生活伴侶或姻親者，其助理費原則上不予補助。日本禁止採用65歲以上的人、或是議員本人配偶為秘書。英國自2017年6月8日大選後，進用配偶、共同生活伴侶或三親等關係的親屬助理，不予補助。韓國則禁止國家公務員法第33條所定不適任情事者，觸犯國會法第166條妨礙國會會議罪，被判處500萬韓元以上罰金，該刑罰確定後未滿5年者；以及國會議員的配偶、四親等內的血親或姻親者。至於國會議員是否適用公務員職務犯罪，報告說明，美國聯邦法將國會議員納入公務員收受賄絡罪適用範圍，日本刑法第7條亦將國會議員納入公務員職務犯罪適用範圍。德國未將國會議員納入公務員職務犯罪的適用範圍，而是針對其職務特殊性另行特別規定。對於議員的違紀行為，德國聯邦議會基於國會自律原則，由議會主席團裁處行政罰，最高可達議員年度報酬的半額，並將裁處結果對外公開，訴諸政治責任，而非以刑罰相繩。此外，報告提到，英國在2009年下議院發生號稱20世紀最大議員浮報津貼醜聞後，便成立獨立國會倫理基準委員會（IPSA）專責辦理費用核銷。熱門賽事、球星動態不漏接    ,https://news.ltn.com.tw/news/politics/breakingnews/5267845
盧秀燕拋第4次政黨輪替  何欣純神回「這句」,政治,2025/12/04 16:19,立委何欣純。（資料照，記者王藝菘攝）台中市長盧秀燕拋第4次政黨輪替，立委何欣純指出，台中昨才爆出有吸毒男持槍在游池對著小孩的重大治安事件，市政連番出狀況，盧秀燕卻「身體坐在市長室，心裡遙想著總統府」，何欣純說，「需要政黨輪替的，是台中市」。盧秀燕長期以來居「藍營一姐」，更被藍營視為是挑戰2028年總統大選的重要人選，但隨國民黨主席改選，新任黨主席鄭麗文稱「2028國民黨人選不只一個」，藍營挑戰總統大位是否仍「唯盧獨尊」，傳可能面臨挑戰，盧秀燕台中市長任期倒數計時不到1年，昨（3日）主動暢談總統大選，更喊話第4次政黨輪替，外界推測她一改「溫良恭儉讓」的態度，開始加溫自己的下一步，發言引關注。請繼續往下閱讀...今日盧秀燕被問第4次政黨輪替說，平時強調上班時間不談政治的她再度強調，台灣是民主國家，不應一黨獨大，「有競爭國家才會進步」，人民才能受到照顧。對此，何欣純不以為然指出，台中市昨天才驚傳有吸毒男到西屯的游泳池拿槍，指著小孩的重大治安事件，台中市民人心惶惶，更質疑台中市政連番出問題，台中治安讓人擔憂，但「市長身體坐在市長室，心裡遙想著總統府」。何欣純說，她真心覺得，「需要政黨輪替的，是台中市」。立委何欣純。（圖：何欣純服務處提供）熱門賽事、球星動態不漏接    ,https://news.ltn.com.tw/news/politics/breakingnews/5267815
稱台灣是極重要夥伴 隅修三：有人試圖以武力威脅改變現狀,政治,2025/12/04 16:08,台灣日本關係協會與日本台灣交流協會4日舉行「第49屆台日經濟貿易會議」，日方由日本台灣交流協會會長隅修三擔任代表團團長。（記者羅沛德攝）「第49屆台日經濟貿易會議」今（4）日在台北市圓山飯店登場，日本台灣交流協會會長隅修三致詞強調，面對國際環境動盪不安，甚至有人試圖以武力或威脅手段片面改變現狀，台灣是日本極為重要的夥伴和珍貴友人。台灣日本關係協會與日台協會今天在圓山飯店舉行第49屆台日經濟貿易會議，預計將在會中簽署分組會議議事錄，以及「地區海關合作備忘錄」及「台日數位貿易協議」。請繼續往下閱讀...隅修三自今年6月接下日台協會會長職務、9月初次訪台後，這是他第二次到訪台灣，他在開場致詞時說，非常榮幸能夠首次參加日台經濟貿易會議，當前我們看到國際環境動盪不安，前途發展形勢難測，長期以來支援全球貿易和投資發展的國際貿易體系，如今卻面臨日益緊張的局面。隅修三指出，甚至有人試圖以武力或威脅的手段，單方面來改變現狀；他強調，面對此情況，台灣是日本極為重要的夥伴和珍貴的友人，日本與台灣擁有同樣的基本價值觀，並且具有密切的經貿關係和人民的交流來往。他說，最近在韓國舉行的亞太經合會（APEC）領袖會議中，日本新上任的首相高市早苗，也與台灣代表林信義進行了會談，雙方同意繼續深化日台在經濟、防災等廣泛領域的合作與交流，更明確地展現出日台深厚的夥伴關係。隅修三也指出，截至今年10月為止，台灣赴日遊客的人次已累計超過560萬，今年全年訪日的人次，確定將超越去年的604萬人次，也藉此機會向所有造訪日本的台灣朋友致以最誠摯的謝意。蘇嘉全致詞時說，台日夥伴關係持續升溫，雙方在科技、能源及產業合作上成果豐碩；做為台日產業合作的指標，台積電熊本一廠已於2024年底投產，二廠正按計畫推進，目標於2027年底啟用，持續帶動上下游供應鏈與人才的交流。蘇指出，日本高市早苗新內閣於今年10月上任後，多次重申將持續推動穩健的印太外交政策，關注區域和平穩定與經貿合作發展，展現日本政府重視台海和平，以及支持自由開放印太區域的基本立場，也為強化台日經貿夥伴關係提供良好的基礎。不過，蘇嘉全也表示，近期中國持續對日本祭出經濟施壓與不當制裁，不禁想起中國也曾經禁止進口台灣鳳梨，造成台灣農民巨大的損失，當時日本前首相安倍晉三曾以堅定的行動力挺台灣，帶給台灣國民深刻且溫暖的支持。蘇嘉全強調，在此除堅定捍衛自由且公平的國際貿易秩序，也會以實際行動支持來自日本的安全優質農漁水產品，以展現民主夥伴之間的互信與情誼，攜手創造更加美好的未來。熱門賽事、球星動態不漏接    ,https://news.ltn.com.tw/news/politics/breakingnews/5267812
台智光案市警局一審敗訴 蔣萬安：明年全面改非對稱頻寬,政治,2025/12/04 16:07,民進黨市議員林世宗，就副市長李四川參選新北市長及台智光議題，質詢台北市長蔣萬安與副市長李四川。（記者田裕華攝）台北市警用監視器傳輸費爭議，台智光不服市府解約，提出民事訴訟追繳價差與延遲付款的利息，台北地院上月18日判市警局一審敗訴，議員林世宗今（4日）在議會總質詢時詢問是否上訴，市長蔣萬安強調，一定會提上訴，並承諾明年將採用非對稱頻寬。蔣萬安去年3月底宣布與台智光解除警察局監視器子約，警局去年4月8日發文給台智光，台智光去年4月19日回文否認合約終止，要求警局依約履行。市府在6月核定爭議期間3M費率，從2100元降至1761元。請繼續往下閱讀...台智光今年2月提出民事訴訟追繳價差與延遲付款的利息，法院一審認定北檢雖有另案偵辦警局監視系統案件，但至今未起訴、為有罪判決，不足為有利警局的認定，依光纖契約、協議書等，警局去年4月8日解約不合法，警局使用CCTV網路為民國113年1月1日生效，因此警局相關抗辯無理由，判決警局應給付5312萬1345元及利息。全案可上訴。林世宗質詢時指出，他曾質詢警局得到結論，若監視器傳輸方式選用非對稱頻寬，可以讓市府樽節新台幣7200萬元，認為基於傳輸的正當利益，應要積極全面上訴，絕對該跟台智光對抗到底。針對法院一審判北市警局敗訴，市府是否會提上訴？蔣萬安回應，基於市府立場一定會提上訴，且目前針對北市警局已使用400多支監視器都是採用非對稱頻寬，服務品質及效率都沒問題，且115年就會採用非對稱頻寬。北市警局則說明，北市共約1萬多支監視器，明年起將改採用非對稱頻寬。民進黨市議員林世宗，就副市長李四川參選新北市長及台智光議題，質詢台北市長蔣萬安與副市長李四川。（記者田裕華攝）熱門賽事、球星動態不漏接    ,https://news.ltn.com.tw/news/politics/breakingnews/5267818
南市長綠營初選開第一槍 邱莉莉重提「跑票事件」砲轟陳亭妃,政治,2025/12/04 15:55,南市議會議長邱莉莉（中）等21名泛綠議員，開記者會力挺市長參選人林俊憲，並重提當年議長選舉跑票事件、砲轟陳亭妃。（記者蔡文居攝）民進黨台南市長初選競爭激烈，台南市議會議長邱莉莉今天開第一槍，她率副議長林志展、總召周嘉韋等人共21名泛綠議員，砲轟陳亭妃、力挺林俊憲。邱莉莉重提當年李全教參選議長選舉及郭信良脫黨參選議長選舉的2次跑票事件，批評陳對黨不忠貞，呼籲市民支持一個遵守黨紀律的參選人，大家眼睛要亮一點，有些事可以暫時忘記，但做過的事卻無法被抹滅掉。邱莉莉表示，民進黨自創黨以來，一直是清廉勤政愛鄉土，更明確的是，對黨的路線及決議能否遵守。2014年議長選舉，陳亭妃當時是中常委，並擔任南市議長選舉總督導，當時民進黨議會過半，議員卻跑票讓李全教當選，陳說她在當立委不關她的事，她現在要幫陳把記憶找回來。請繼續往下閱讀...邱莉莉說，李全教當選後，修法正副議長選舉改記名投票；到了2018年，也在泛綠過半下，她獲黨提名參選議長，而郭信良在議場宣告退黨參選議長，當時投給郭而未投給她的第一個議員是陳亭妃的妹妹陳怡珍。當初不愛這個黨，公然支持退黨參選的候選人，現在卻要告訴我們她有多愛這個黨，她有多麼在民主進步黨這個黨章的規範下，這8年為台南市民做了什麼。邱表示，我們支持林俊憲，要用民進黨這招牌參選，需要一個清廉、乾淨，對黨的路線一致，可以遵守黨約束的候選人，大家眼睛要張大一點，有些事可以暫時忘記，但她做過的事卻無法被抹滅掉。陳亭妃則指出，賴主席在9月3日的中常會三令五申，黨內同志在競逐提名時，嚴禁發生互相攻擊，難道賴總統的話都不聽了嗎？這將是她對於同志攻擊最後一次的回應，「任何同志攻擊我、抹黑我、污蔑我的難聽字眼」，她會尊重賴主席的要求，一件一件堅強吞下去，當成是對自己的考驗，因為我們一定要大步向前，才能對得起台南市民對我們的期望。陳亭妃表示，我們的對手是國民黨、是謝龍介，不是自己的同黨同志，初選只是一個過程，我們不能中了國民黨的計，讓支持者失望，因為我們的目標只有一個，就是要最強候選人，才能贏得2026的大選，才能為2028賴清德總統連任奠下最大的底氣。南市議會議長邱莉莉率副議長林志展、總召周嘉韋等人共21名泛綠議員，砲轟陳亭妃，力挺林俊憲。（記者蔡文居攝）熱門賽事、球星動態不漏接    ,https://news.ltn.com.tw/news/politics/breakingnews/5267785
