Title,News_Type,date,content,url
鄭嗆兩岸論述錯誤 民進黨反批：砲口對內 與國際脫節,政治,2026/04/23 05:30,總統賴清德因中國施壓而暫緩出訪史瓦帝尼，國民黨主席鄭麗文昨指控，民進黨的兩岸論述錯誤且誤判局勢。民進黨發言人吳崢反批，鄭不思譴責施壓者，反而「砲口對內」要求檢討受迫害的政府，與國際脫節、嚴重違背國家路線。（記者王藝菘攝）總統賴清德因中國施壓而暫緩出訪史瓦帝尼，國民黨主席鄭麗文昨指控，民進黨的兩岸論述錯誤且誤判局勢，政府不自我檢討還把氣出到在野黨身上。民進黨發言人吳崢反批，鄭不思譴責施壓者，反而「砲口對內」要求檢討受迫害的政府，與國際脫節、嚴重違背國家路線。台灣被打壓 鄭卻不譴責施壓者 對於鄭麗文的說法，吳崢表示，國家元首代表國家，在國家外交處境艱困、中國粗暴施壓的時刻，被打壓的就是台灣，而鄭麗文不思譴責施壓者，反而「砲口對內」要求檢討受迫害的政府，鄭麗文才是真正檢討受害者的那個人。請繼續往下閱讀...吳崢談到，賴清德講得非常清楚，面對中國粗暴施壓、惡意打壓中華民國的外交空間，朝野應該不分黨派，認清中國的真實樣貌，團結守護國家尊嚴。在國家外交空間遭受打壓的時刻，鄭麗文卻急著把砲口對內，反過來檢討民進黨政府，令人遺憾。吳崢說，國台辦才重申「一個中國」老調，鄭麗文下午就接著附和，甚至聲稱世界都支持一中，這種說法與國際民主陣營力挺台灣走向國際舞台、譴責中國打壓台灣的事實完全脫節。吳崢並批評，中國惡劣施壓第三國、粗暴干涉台灣國際參與，現在最應該被譴責的，難道不是以粗暴手段干預台灣國際參與的中國嗎？難道鄭麗文眼裡只有中國，沒看到事發後，有多少國際民主盟友們紛紛發聲譴責中國蠻橫行徑，力挺台灣走向世界舞台嗎？鄭麗文此言嚴重違背中華民國台灣優先的國家路線，更不符合台灣主流民意的期待。「中共不到兩個禮拜就打臉十項惠台政策，鄭麗文情何以堪！」兼任民進黨中常委的立委王世堅表示，鄭習會就是一場假戲，中共講了那麼多的甜言蜜語，結果原來拿著蘿蔔，背後藏了這把棍子，台灣民眾都看在眼裡。王說，只要不逾越主權、不把台灣做小、不妨害國格尊嚴，他樂見赴中交流，但沒想到中共這麼不賞臉、直接打臉鄭麗文。    ,https://news.ltn.com.tw/news/politics/paper/1752053
美印太司令：台灣投資自身國防很重要,政治,2026/04/23 05:30,美國印太司令部司令帕帕羅廿一日對台灣面臨的軍事威脅提出警告，除了示警中國正企圖打造無人機部隊做為進攻先鋒，也強烈敦促台灣必須落實國防特別預算。（路透檔案照）美國印太司令部司令帕帕羅廿一日對台灣面臨的軍事威脅提出警告，除了示警中國正企圖打造無人機部隊做為進攻先鋒，也強烈敦促台灣必須落實國防特別預算。他強調，美國對台灣防務的重視程度，不能超過台灣自身，「如果讓雞挨餓，就得不到雞也得不到蛋」。「讓雞挨餓，就得不到雞也得不到蛋」美國聯邦參議院廿一日舉行有關印太司令部部署態勢的聽證會，參院外交委員會民主黨首席議員夏亨關切台灣通過國防特別預算的重要性。帕帕羅回應，「台灣關係法」實施近五十年，美國對台軍售並未超出常態，但台灣為自身國防提供經費至關重要，唯有投入資源，才能產生實質的防衛戰力。請繼續往下閱讀...夏亨也呼應，支持台灣通過這項預算，不僅是向中國傳遞嚇阻訊息，也是向美國國會展現台灣自我防衛決心。立院國防預算進展 美檢視關鍵指標國民黨主席鄭麗文日前訪問中國，共和黨籍參議員柯頓詢問是否會影響台灣國防支出的未來走向。帕帕羅直言，「空談不如實證」，台灣國防特別預算案的實質進展，將是檢驗台灣對自我防衛承諾有多堅定的關鍵指標。儘管預算面臨政治角力，帕帕羅對台灣的防衛意志仍持正面看法。他指出，在俄烏戰爭爆發前，烏克蘭的防衛意願民調相對偏低，但戰時的社會反應令人敬佩；而台灣目前的民調數據遠高於當時的烏克蘭，讓他對台灣役齡人口保衛家園的意願與能力深具信心。除了預算，議員也高度關切戰爭型態改變對台海局勢的影響。帕帕羅在書面聲明中指出，俄烏衝突與美伊戰事在在顯示，低成本、大規模的無人系統與精準打擊能力，已是現代戰爭核心。民主黨籍參議員布魯門塔與軍委會民主黨首席議員利德詢問，在無人化不對稱作戰的發展下，將如何影響中國對台的武力盤算。帕帕羅表示，北京正設法應對，目前的企圖是打造一支無人機部隊，做為未來進攻部隊的先鋒。為反制中國的侵略部署，帕帕羅強調「地獄景象」戰略的重要性。他指出，台灣應善用烏克蘭的無人機戰爭經驗，大量且持續地部署低成本、可消耗的彈藥與無人機，並結合人工智慧工具進行指揮。這種不對稱作戰能讓進攻的解放軍付出極為沉重的代價。帕帕羅重申，印太司令部將持續依循「台灣關係法」提供安全援助，協助台灣建立可靠、具韌性且具成本效益的不對稱戰力。他同時警告，北京從未放棄對台動武的可能性，解放軍近期在台灣周邊的軍事行動不僅是演習，更是為潛在的武力統一進行實質預演。    ,https://news.ltn.com.tw/news/politics/paper/1752076
致電史瓦帝尼國王 賴總統：兩國會更團結合作,政治,2026/04/23 05:30,總統賴清德（右）昨表示，他第一時間已致電史瓦帝尼國王恩史瓦帝三世（左），強調兩國邦誼不會受到影響。圖為二〇二四年五月恩史瓦帝三世來台參加賴總統就職大典。（取自總統府官網）賴總統訪問受阻 史瓦帝尼：不會改變史台雙邊關係兼任民進黨主席的總統賴清德原定廿二日率團訪問友邦史瓦帝尼，因中國施壓塞席爾、模里西斯、馬達加斯加突取消專機飛航許可，行程暫緩。賴清德昨表示，他第一時間已致電史瓦帝尼國王恩史瓦帝三世，強調兩國邦誼不會受到影響，在外力壓迫下只會更團結合作。請繼續往下閱讀...賴：中國越打壓 我們越要無畏無懼史瓦帝尼政府也對外做出回應。「史瓦帝尼觀察家日報」廿二日報導，史瓦帝尼政府代理發言人姆杜莉表示，雖然對於賴總統無法親自參加國王慶祝活動感到遺憾，「但我們完全理解，國際旅行安排有時會受到一系列後勤和外交因素影響，不是雙方可控制的」。對於賴總統此行遭遇阻礙，姆杜莉於報導中強調，「這不會改變史瓦帝尼和台灣之間長久的雙邊關係，因我們的友誼建立在相互尊重、合作和擁有共同發展目標基礎上」。她重申，史瓦帝尼將繼續奉行獨立自主、有原則的外交政策，優先考慮與國際社會所有成員建立和平、合作和互利夥伴關係。賴清德昨在民進黨中執會表示，他原本要率團出訪史瓦帝尼，祝賀國王恩史瓦帝三世五十八歲生日、以及慶祝中華民國和史瓦帝尼建交五十八週年，但中國政府施壓第三國臨時取消航空許可，因此不得不取消行程。賴清德說，他已經在第一時間親自致電國王祝賀生日快樂，也致歉無法親自參加慶祝活動。他和恩史瓦帝三世皆感到遺憾，也重申兩國邦誼不會受到影響，在外力壓迫之下，只會更團結合作。「當中國越是打壓，我們越要展現無畏無懼精神，持續強化國家實力，穩健走向國際。」賴清德直言，台灣是主權國家，是世界的台灣，二三〇〇萬的台灣人有權走向世界，沒有任何國家能阻擋，也無法阻擋。賴清德並呼籲國內朝野政黨，面對中國破壞區域和諧、侵犯台灣主權的行為，應更加清楚辨識中國的真實樣貌，不分黨派皆應團結，守護國家尊嚴。    ,https://news.ltn.com.tw/news/politics/paper/1752050
現身立院欲見韓國瑜撲空 李貞秀提告立院、中選會,政治,2026/04/23 05:30,遭民眾黨開除黨籍的陸配李貞秀（左）22日現身立法院收發室，她說，希望將行政訴訟起訴狀交給立法院長韓國瑜。（中央社）民眾黨中評會日前開除中配立委李貞秀黨籍，李喪失不分區立委資格，但李並未就此妥協，繼十九日於個人直播稱她赴北院聲請「假處分」；她也前往台北高等行政法院提告中選會、立法院，要求確認中選會註銷立委名籍處分無效及撤銷立法院免職處分。中選會回應，如收到李女士所提相關爭訟書狀，將依法向管轄法院提出答辯說明。李貞秀指出，民眾黨中評會不只用空泛理由將她開除，就連最基本的「會議記錄」都付之闕如，強調「絕不接受莫須有的指控」。請繼續往下閱讀...李貞秀昨早也無預警現身立院，欲見立法院長韓國瑜向其表達權益訴求，更隔空嗆聲民眾黨主席黃國昌「直球對決」，最終「撲空」無功而返；韓國瑜則在上午十一時半準時現身立院會客室，在大法官尤伯祥監誓下，成大教授許忠信完成遞補李貞秀席次的程序，宣誓就職不分區立委。    ,https://news.ltn.com.tw/news/politics/paper/1752080
賴總統被迫暫緩出訪史瓦帝尼 學者示警：中國打壓變本加厲 我須注意,政治,2026/04/23 05:30,賴總統暫緩出訪史瓦帝尼。東吳大學政治系副教授陳方隅指出，中國藉此展現其有能力施壓第三國取消國際航權，顯示中國運用打壓手段愈趨成熟。（資料照）總統賴清德原訂昨日率團出訪非洲友邦史瓦帝尼，卻因模里西斯等三國在中國施壓下臨時撤回專機飛越許可，未能順利成行。東吳大學政治系副教授陳方隅指出，中國藉此展現其有能力施壓第三國取消國際航權，顯示中國運用打壓手段愈趨成熟；政大政治系兼任教授嚴震生表示，應只有此次出訪史瓦帝尼的路線比較困難，未來若還規劃出訪，往東從美國過境較不會有問題。北京有能力施壓第三國嚴震生指出，臨時撤回專機飛越許可的三國中，馬達加斯加領空面積最大；模里西斯與塞席爾在民主、人權、自由度、治理等領域，都是非洲中發展名列前茅的國家，對中國外債占比也不多，且都是民主國家。請繼續往下閱讀...陳方隅認為，此次總統出訪受阻，代表中國藉由各種方式，變本加厲地加大打壓台灣的力道，並展現其有能力、做得到藉由經濟槓桿與債務等手段，施壓第三國取消國際航權，也顯示中國運用上述打壓手段已經愈趨成熟，對台灣而言是警訊，必須更加小心以對。陳方隅分析，前總統蔡英文曾於二〇二三年九月出訪史瓦帝尼，當時並未受阻，這次賴總統無法成行的原因，正是中國手段變得更加厲害，所施加的壓力變得更大。嚴震生則認為，只有這次規劃出訪史瓦帝尼的路線比較困難，未來若還有規劃出訪史瓦帝尼，應從美國過境，較不會有問題；現在美國川普政府將美洲當作其勢力範圍，中國則認定非洲為勢力範圍，這種中國施壓第三國取消我航權的狀況，應難以在非洲以外的地方如法炮製。    ,https://news.ltn.com.tw/news/politics/paper/1752054
謠言終結站》網傳今年所得稅申報至6月3日？財政部：6月1日截止,政治,2026/04/23 05:30,謠言終結站網傳內容：所得稅申報從5月1日到6月3日。查證結果：財政部官方臉書指出，114年度所得稅申報期間為 今年5月1日起，原定截止日5月31日適逢星期天，因此順延至次一工作日，務必在6月1日前完成申報。網傳為錯誤訊息。    ,https://news.ltn.com.tw/news/politics/paper/1752081
北市藍營松信選區初選出爐 加權制度挨批,政治,2026/04/23 05:30,國民黨台北市松信選區議員初選結果出爐，參選人展現團結。左起許原榮代理人、滿志剛、李明璇、戴錫欽、楊智伃及李煥中。（國民黨台北市黨部提供）李明璇、許原榮出線 滿志剛不滿「制度不允許深耕」 楊智伃落選哭了國民黨台北市議員初選第三選區（松山、信義）昨上午公布結果，由前黨發言人李明璇、立法院長韓國瑜辦公室主任許原榮出線，國民黨該區由這兩位新人與現任議長戴錫欽、議員秦慧珠、詹為元披掛出征。而前國民黨黨主席朱立倫子弟兵楊智伃落選，淚灑當場。上屆與本屆都於初選階段出局的資深幕僚滿志剛則不滿表示，是時候檢討國民黨加權制度，不是他不夠強，而是現行制度不允許他在松山信義深耕。國民黨台北市黨部主委戴錫欽坦言，這樣的加權比例跟大選最後的結果能不能夠吻合，這部分有很大的檢討空間。請繼續往下閱讀...黨部主委︰選前反映過 有很大的檢討空間此次參與初選的有李明璇、許原榮、楊智伃、滿志剛以及富錦里長李煥中共五人。昨日國民黨台北市黨部於議會黨團外召開記者會，除許原榮外其餘均有到場，戴錫欽宣布，由李明璇、許原榮出線。新人加30％ 35歲以下再加70％ 滿志剛無加權根據國民黨直轄市議員初選規則，首次參選者可加權卅％，卅五歲以下再加權七十％，合計最高可達一百％；此次松信初選，李明璇、楊智伃有一百％加權；李煥中、許原榮卅％；上屆落選的滿志剛則無加權。戴錫欽、秦慧珠、詹為元與2新人 代表國民黨出征滿志剛表示，他是唯一沒有被加權的參選人，這個遊戲規則他接受，但是時候應該要好好討論初選制度是否該修改了，他接受這次「以身試法」的結果，但是初選若全部都是新人，可以有更公平的方式，是否真的要加權到一百％，這是真正需要討論的地方。戴錫欽說，初選內容包括全民調或者是民調的題目、新人與青年加權，許多同志選前都有跟組發會、黨中央反映過；不過，最後還是要尊重黨中央所公布的加權辦法，而這樣的加權比例跟大選最後的結果能不能夠吻合，也可作為將來組發會在研究相關加權，看如何能夠更適切地反映出真實的狀況，這部分有很大的檢討的空間。    ,https://news.ltn.com.tw/news/politics/paper/1752034
議員許淑華︰蔣萬安輔選藍白 恐擠下綠席次,政治,2026/04/23 05:30,民進黨台北市議員許淑華說，若市長蔣萬安全力輔選藍白兩黨候選人，恐擠下民進黨席次。（資料照）台北市議員第三選區（松山、信義）應選九席，本屆當選四席的民進黨此次採保守提名四人，分別是現任議員許淑華、洪健益、張文潔以及新人郭凡。許淑華受訪說，民進黨不能輕忽市長蔣萬安影響力，若蔣全力輔選藍白兩黨候選人，恐擠下民進黨席次。松信提名4人 許︰各區都應採聯合競選許淑華受訪表示，民進黨希望廿五席都能當選，但每個區各別狀況都不一樣，還是要依照選區議員的意願來協調競選方式，五月底北市黨部主委改選後，到時就會召集各選區參選人協調是否聯合競選；她認為各區都應採聯合競選方式，因此次並沒有過度提名，初步聽起來大部分議員都頗有共識，只是聯合競選的強度如何還需討論，且現代的選戰配票也不是那麼容易。請繼續往下閱讀...不過，許淑華也點出，民進黨不能輕忽市長蔣萬安影響力，在民眾黨沒有推出市長人選下，蔣可全力輔選藍白兩黨候選人，屆時勢必極力要擠下民進黨席次。未來民進黨母雞出線後，綠營就要配合削弱蔣萬安的外溢效益，讓蔣顧及不了民眾黨，對民進黨才是一大利多。她也透露，近期有與有意參選台北市長的民進黨籍立委沈伯洋見面，她也提醒沈，統獨議題在台北市並不吃香，如果真宣布參選，起手式就應破題採較務實民生的選戰策略，她也與競選台北市黨部主委的立委吳沛憶討論過，台北這一場選戰希望定調是「非典型選戰」，盼吸納中間選民，以及擴大原本優勢的年輕人選票。郭凡說，前陣子各界眼光比較聚焦國民黨初選，因此他節奏有放慢，接下來就會照之前的腳步，開始跑母親節、端午等活動，民進黨在松信有四席的空間，接下來他也會增加空戰的比例，會結合自身國際關係的專業，希望把政策聚焦在如何讓台北市變得更加國際化；至於大選階段的競選策略，會配合黨部的安排。    ,https://news.ltn.com.tw/news/politics/paper/1752035
吳淑瑾「代夫出征」？ 馬公出現支持看板,政治,2026/04/23 05:30,馬公市區重要六岔路口，出現大型支持吳淑瑾看板。（記者劉禹慶攝）原本連任有望的澎湖縣長陳光復，因大年初一跌倒昏迷意外，打亂民進黨布局，一度傳出黨主席賴清德屬意由馬公市長黃健忠接棒參選縣長，但受到陳光復「夫人派」支持者反彈，澎湖開台天后宮主委蔡光明還連署，支持吳淑瑾「代夫出征」，馬公市區昨天豎立「守住澎湖、守護光復，我們支持吳淑瑾」大型看板，引發關注。民進黨在澎湖佔有執政優勢，但因陳光復昏迷，雖然身體逐漸恢復，經民進黨中央評估，即使清醒恐無法應付選舉壓力，「換將說」發酵，一度傳出賴清德希望馬公市長黃健忠接下重擔，但引發陳光復「夫人派」反彈，日前蔡光明率先連署吳淑瑾「代夫出征」，獲得四千多人支持。請繼續往下閱讀...四月初，陳光復妻子吳淑瑾偕同女兒在澎湖召開「感恩茶會」，縣府主管、各級民代都出席，展現基層實力。據了解，黨中央評估吳淑瑾年事已高，現在最重要任務是照顧在高雄住院的陳光復，一度否決由縣黨部主委顏家康提出的吳淑瑾「代夫出征」建議案；但根據蔡光明透露，近日黨中央態度已有所轉向，極可能在下個月提名吳淑瑾參選澎湖縣長。此外，屏東縣議長周典論涉賄賂收購鴻海集團創辦人郭台銘連署書二審遭判三年二月，最高法院撤銷發回更審，高雄高分院昨開庭，周典論出庭否認犯罪，請求法官無罪判決，全案辯論終結，定於五月二十七日宣判。    ,https://news.ltn.com.tw/news/politics/paper/1752088
日駐台代表》片山和之：台灣已民主化 由2300萬人民決定自己未來,政治,2026/04/23 05:30,日本台灣交流協會台北事務所代表片山和之昨受邀至師大通識講座演說談及日中關係時指出，台灣的存在對日本來說有生死攸關的重要性；台灣已實現民主化，會由兩千三百萬名台灣人決定自己的未來。（中央社）日本台灣交流協會台北事務所代表片山和之昨指出，台灣的存在對日本來說有生死攸關的重要性；台灣已實現民主化，會由兩千三百萬名台灣人決定自己的未來。根據中央社報導，片山和之於師大通識講座演說談及日中關係時指出，「朋友能夠選擇，鄰居無法選擇」，中國是日本一大貿易夥伴，雙方在經濟方面獲致穩定發展的關係、互相互惠創造雙贏；政治安保方面，日中在民主、自由、人權、法制有不同價值觀，這對現在與未來的兩國關係更加強不確定性。請繼續往下閱讀...針對台日關係，片山說，台日是非常重要的夥伴、無法取代的朋友，不僅共享自由、民主、人權、法治等基本價值，也是重要經濟貿易夥伴，雙方在防救災、農業、環保、衛生、經濟安保等方面有發展合作的潛力；雙方也有非常真誠的文化與人員交流。台灣重要性 攸關日本存亡他指出，台海和平穩定，對包括日本在內的國際社會繁榮安全是不可或缺的因素，台灣問題應透過對話和平解決，堅決反對單方面以武力或威脅改變現狀。片山和之的簡報上也以紅字寫著，「我們應該認識台灣的存在對日本來說有生死攸關的重要性」。在問答環節，片山和之表示，台灣已實現民主化，台灣社會將來不能忽視兩千三百萬台灣人的意見，不管是什麼方向，兩千三百萬名台灣人是這個社會的主人，並決定自己的未來。    ,https://news.ltn.com.tw/news/politics/paper/1752078
蔣萬安挺李四川蓋蘆社大橋 民進黨︰選舉年才提出,政治,2026/04/23 05:30,林亮君︰選舉年 只聞樓梯響國民黨籍新北市長參選人李四川近日表示，如果當選新北市長，將興建往來台北市士林區社子島與新北市蘆洲區的「蘆社大橋」，搭配已核定的北投士林科技園區至社子島的聯外橋樑，把新北市民送到輝達門口。台北市長蔣萬安昨天也呼應表示「朝這方向前進」；但台北市議會民進黨團幹事長林亮君則質疑，「每逢選舉年，只聞樓梯響」，同黨籍在地議員陳賢蔚也說，社子島開發案環評適法性訴訟中，將成不可預期的變數，不要再次淪為空頭支票。無黨籍市議員參選人陳怡潔也表示，蘆社大橋不應憑空出現，只有選舉年才被提出討論，其實它是附屬於社子島開發的交通配套之一，卻未列入蔣市府的重大交通建設藍圖。蔣萬安昨下午至台北市議會拜會民進黨團，說明本會期重大議法案，會後受訪表示，李四川之前就已提出，包括捷運工程局在內等相關單位，都在進行相關規劃作業，「所以未來我想就會朝這樣的方向來前進」，以言語和行動支持李四川。請繼續往下閱讀...屬社子島開發交通配套 未列重大建設陳怡潔表示，蘆社大橋不應憑空出現，只有選舉年才被提出來討論，其實它是附屬於社子島開發的交通配套之一。但從來沒有列入市府重大交通建設藍圖中。蔣市府如果重視社子地方的交通發展，應利用市長連任前提出可行性預算計畫及細部評估，尤其北士科的發展既然是蔣市長的重要政績，如何疏解北士科區段的交通瓶頸也必須一併提出。環評適法性訴訟中 恐成變數國民黨籍市議員林杏兒表示，蘆社大橋正在進行可行性評估，至少還要四、五年，但社子地區路幅不寬，未來蘆洲進來的可能車流，須妥善規劃當地交通與疏導計畫，避免塞車影響居民日常生活。北市府補充，蔣萬安上任後即與李四川、捷運局、地政局等相關局處推動興建蘆社大橋，這座橋樑將是新莊、泰山、五股、蘆洲、三重進入北士科的重要通道，雙北已多次開會交換意見，現正由新北市進行可行性評估與規劃，北市主責北市端的用地取得，未來經社子島串聯至北士科，共同務實推動雙北交通建設。    ,https://news.ltn.com.tw/news/politics/paper/1752036
賴總統出訪受阻 美國務院譴責中國濫用民航系統、威脅國際和平,政治,2026/04/23 02:05,美國國務院發言人批評，中國指使非洲國家阻撓賴清德總統出訪，是北京對台灣及世界各地台灣支持者發動威嚇行動、濫用國際民航系統，並威脅國際和平與繁榮的另一個案例。圖為美國國務卿魯比歐。（歐新社檔案照）由於塞席爾、模里西斯與馬達加斯加片面撤銷專機飛越其管理空域的飛行許可，賴清德總統出訪邦交國史瓦帝尼的行程被迫暫緩。美國國務院22日對此表示關切，並批評這些非洲國家在中國指使下，撤銷賴總統的飛越領空許可，是對國際民航系統的濫用。《路透》報導，這是台灣總統首次因遭拒絕進入空域，而被迫取消整個出訪行程，代表中國在加強扼殺台灣參與國際事務的努力中，採取一項新策略。請繼續往下閱讀...1名國務院發言人在未點名這些非洲島國的情況下向路透表示：「這些國家在中國指使下行事，干涉台灣官員例行旅行的安全與尊嚴。」發言人表示，這些國家對其主權領空之外特定國際空域的管理責任，「純粹是為了確保飛航安全，而非做為北京的政治工具」。發言人強調：「這又是北京對台灣及世界各地台灣支持者發動威嚇行動、濫用國際民航系統，並威脅國際和平與繁榮的另一個案例。」發言人還進一步表示，北京應停止對台灣的軍事、外交與經濟施壓。1名台灣國安高層官員曾向路透表示，中國對塞席爾、馬達加斯加與模里西斯施壓，威脅祭出包括撤銷債務減免在內的經濟制裁。中國國務院台灣事務辦公室（國台辦）否認這項說法，但對這3個國家堅持「一中原則」的立場與「作法」表示讚賞。多名美國國會議員也譴責中國，並表達對台灣的支持。    ,https://news.ltn.com.tw/news/politics/breakingnews/5412925
