Title,News_Type,date,content,url
"馬達加斯加大規模示威至少22死　總統宣布解散政府",國際,2025/09/30 03:15,馬達加斯加發生多起致命性示威，抗議反覆停水停電過後，總統拉喬利納今天宣布解散政府。聯合國（United Nations）表示，抗議至少造成22人死亡、逾100人受傷。綜合路透社與法新社報導，拉喬利納（Andry Rajoelina）在全國電視演說表示，「我已決定解除總理及政府的職務。在新政府成立之前，現任官員將擔任臨時部長。」請繼續往下閱讀...馬達加斯加位在非洲東南外海印度洋上。當地的抗議已經持續3天，是受到肯亞與尼泊爾Z世代的示威所啟發。Z世代（Gen Z）泛指從1997年到2010年代初期出生的人們。這不僅是馬達加斯加近年來最大規模示威，也是拉喬利納2023年連任以來，面臨的最大挑戰。拉喬利納也在演講中說：「若政府成員未執行他們被賦予的任務，我們承認並致歉」。聯合國人權事務高級專員指出，死傷者包括遭安全部隊擊斃的抗議民眾與路人；也有人在接著發生的大規模暴力與搶劫事件中，被抗議無關的人或幫派殺害。（編譯：楊惟敬）1140930熱門賽事、球星動態不漏接    ,https://news.ltn.com.tw/news/world/breakingnews/5195091
"颱風博羅依襲越南增至13死46傷　逾4萬戶民宅受損",國際,2025/09/30 01:54,越南政府表示，颱風博羅依（Bualoi）侵襲越南過後，死傷已經攀升到13死、46傷。颱風帶來的強風大雨，使當地超過4萬戶民宅受損，災情也包含停電與道路淹水。路透社報導，越南國家氣象局指出，颱風博羅依今天稍早登陸越南，沿著中北部沿岸移動時掀起高達8公尺的巨浪。之後，博羅依已經減弱為熱帶性低氣壓，並往寮國移動。請繼續往下閱讀...越南政府已經在颱風來襲前，預先撤離逾2萬8500人；由於中部行政區域內數座機場關閉，數百架航班也因此延誤或取消。根據越南政府表示，博羅依已經使4萬4000戶民宅受損、6000公頃農田被淹沒，也造成多區對外交通被阻斷。儘管鴻海、台塑、立訊、越南車廠Vinfast有些工廠，位在或靠近博羅依的路徑上，越南政府表示工業設施未出現重大損害。（編譯：楊惟敬）1140930熱門賽事、球星動態不漏接    ,https://news.ltn.com.tw/news/world/breakingnews/5195090
前北約秘書長爆料：川普2018年曾寫紙條 要求北約增國防開支須歸功於他,國際,2025/09/30 00:31,前北約秘書長史托騰柏格（左）在回憶錄中爆料，美國總統川普（右）2018年參加北約峰會時，一度因為國防開支問題想要拂袖而去。（路透檔案照）前北大西洋公約組織（NATO）秘書長史托騰柏格（Jens Stoltenberg）在回憶錄中爆料，美國總統川普2018年參加北約峰會時，一度因為國防開支問題想要拂袖而去，後來寫了1張紙條給他，希望史托騰柏格能將北約成員國提高預算的決策歸功於他，史托騰柏格也照辦之後，才讓川普留下來。史托騰柏格29日在挪威出版回憶錄《在我任內》（On My Watch），憶述他領導這個聯盟10年的歷程，提到他如何滿足川普的自尊心，到為烏克蘭和平提出「芬蘭方案」等重要歷史場景。請繼續往下閱讀...史托騰柏格披露，川普當年在首屆總統任期內參加北約布魯塞爾峰會，由於多個歐洲國家未能達到國防開支佔國內生產毛額（GDP）2％的目標，川普威脅要離席。當時，川普憤怒地表示，「我要離開這場會議。這裡已經沒有我待著的理由了。」川普尤其對時任德國總理梅克爾領導下的柏林感到不滿，因為德國距離支出目標仍相去甚遠。為了挽留這位美國總統，當時還是荷蘭首相、後來接替史托騰柏格出任北約秘書長的呂特提醒川普，歐洲國家其實在前一年已經增加330億歐元（約1.17兆台幣）的國防開支。史托騰柏格說，「過了一會兒，川普拿出他慣用的粗黑簽字筆，在1張紙上寫了點什麼，然後傾身將那張紙遞給我。」紙條上寫著：『秘書長，如果你能說北約盟國之所以大幅增加國防開支，是因為我的緣故，我想我們就能達成共識。』」史托騰柏格順從川普的要求，讓他得以宣稱勝利，從而降低美國退出北約的風險。史托騰柏格在2014年到2024年間擔任北約秘書長，他在書中也透露，曾敦促烏克蘭總統澤倫斯基考慮割讓部分領土給俄羅斯，以換取結束戰爭。他以芬蘭為例，指出該國在二次世界大戰期間，為了與蘇聯領袖史達林達成和平協議，而割讓10％領土。史托騰柏格坦承，在最初幾次暗示烏克蘭考慮「芬蘭方案」時，澤倫斯基明確拒絕割讓任何領土。但隨著時間推移，澤倫斯基和他的顧問「不再斷然否決暫時割讓土地，但條件是新的邊界與烏克蘭的安全，必須透過烏克蘭加入北約來獲得保障。」現年66歲的史托騰柏格曾兩度擔任挪威首相，目前擔任財政部長。他在書中還披露，法國在2021年對他領導北約的方式表達「強烈的挫折感」，指控他「讓自己處於更突出的位置」，並反對他的改革計畫，法國外交部高層官員為此「竭盡全力削弱我的影響力」。熱門賽事、球星動態不漏接    ,https://news.ltn.com.tw/news/world/breakingnews/5195079
五角大廈召集全球美軍將領開會 川普擬出席振奮「團隊精神」,國際,2025/09/29 22:07,美國總統川普將出席30日在維吉尼亞州匡提科舉行的美將領集會。（美聯社）全球約800名美國軍事將領在戰爭（國防）部長赫格塞斯要求下，於30日返回維吉尼亞州「匡提科」（Quantico）陸戰隊基地開會，迫切與不尋常程度引發各界關注、揣測。原先預料由赫格塞斯主導的會議，如今在美國總統川普計畫親自出席後可能產生變化。至於會議內容，川普表示屬於精神層面、振奮士氣的談話。在華盛頓郵報公布會議消息後，川普在國家廣播公司（NBC）新聞網的專訪中談到，會議性質著重「團隊精神」（esprit de corps）層面，「談論的是我們在軍事上的優秀表現，以及我們的良好狀態，還有許多正面的事情」、「你們表現得這是一件壞事一樣。讓全世界的人與我們聚在一起不是一樁美事嗎？」請繼續往下閱讀...川普接受路透訪問時則說，「我想告訴這些將軍我們愛他們，他們是備受尊敬的領袖，要堅強、堅韌、聰明，以及富有熱情…這都是為了團隊精神。是時候該有人做這件事情了」。熱門賽事、球星動態不漏接    ,https://news.ltn.com.tw/news/world/breakingnews/5195024
川普會晤納坦雅胡 白宮：非常接近達成加薩停火協議,國際,2025/09/29 22:02,白宮新聞秘書李威特說，總統川普（左）今日將與以色列總理納坦雅胡（右）討論一份多達21點的加薩和平計畫。（美聯社資料照）白宮新聞秘書李威特（Karoline Leavitt）今（29）日透露，以色列與巴勒斯坦激進組織哈瑪斯（Hamas）「非常接近」達成加薩停戰協議，但雙方可能不會對協議內容感到十分滿意。《路透》報導，李威特在《福斯新聞》（Fox News）的節目「福斯與朋友」上表示，美國總統川普今日會在白宮與以色列總理納坦雅胡（Benjamin Netanyahu）商議一份多達21點的和平計畫，稍晚川普還會與擔任以哈調解人的卡達領導人聯繫。請繼續往下閱讀...李威特說：「為了達成一份對雙方來說合理的協議，雙方都需要稍微讓步，可能在離開談判桌時會有一點不高興，但這就是我們最終結束這場衝突的方式。」熱門賽事、球星動態不漏接    ,https://news.ltn.com.tw/news/world/breakingnews/5194991
摩爾多瓦大選親歐派勝出 法國讚揚「確立邁向歐洲意願」,國際,2025/09/29 21:53,摩爾多瓦大選結果出爐，確立未來親歐路線。（彭博）被外界視為親歐與親俄關鍵的摩爾多瓦國會大選，29日結果顯示親歐盟的執政黨以過半數選票勝出。法國外交部長巴羅（Jean-Noel Barrot）對此展現歡迎之意，強調「即便有一個外國勢力想方設法試圖干預，沒有任何事情能夠阻止人民對民主與自由的選擇。」巴羅在社群媒體X寫道，「法國以手足情誼迎接摩爾多瓦人民的自主選擇，確立了朝歐洲邁進的意願」。請繼續往下閱讀...人口約250萬的摩爾多瓦1991年自蘇聯獨立，然而，境內聶斯特河沿岸目前仍置於俄羅斯部隊軍事佔領下，使得22年烏俄戰爭爆發後，摩爾多瓦的獨立與安全進一步受到考驗。即便國家規模有限，仍是當前歐洲與俄羅斯高度對峙情境下的關鍵角色之一。大選期間，流亡海外的摩爾多瓦富商紹爾（Ilan Shor）公然宣布要向參加反政府示威活動的民眾提供數千美元酬勞；法國總統馬克宏、德國總理梅爾茨及波蘭總理圖斯克則在上月底一同現身首都基希訥烏，讚揚該國面對莫斯科干預所展現的韌性，以及表達對總統桑杜及該國加入歐盟前景的支持。熱門賽事、球星動態不漏接    ,https://news.ltn.com.tw/news/world/breakingnews/5195017
美特使稱烏克蘭或可深擊俄 川普政府考慮援長程武器,國際,2025/09/29 21:17,美國總統川普的特使凱洛格表示，隨著美國政府對俄烏衝突立場轉變，烏克蘭有可能獲准使用美製武器對俄羅斯發動長程打擊，圖為凱洛格9月12日會見烏克蘭總統澤倫斯基時的畫面。（歐新社）美國總統川普（Donald Trump）的特使凱洛格（Keith Kellogg）表示，隨著美國政府對俄烏衝突立場轉變，烏克蘭有可能獲准使用美製武器對俄羅斯發動長程打擊。法新社報導，凱洛格昨天在福斯新聞頻道播出的專訪中被問及，川普是否已授權對俄羅斯本土進行深入打擊。此前，莫斯科剛被指控派遣戰機和無人機侵犯多個歐洲國家領空。請繼續往下閱讀...凱洛格表示：「從總統的公開發言、范斯（JD Vance）副總統和盧比歐（Marco Rubio）國務卿的講法來看，答案是肯定的。」「應善用深入打擊的能力，不存在什麼所謂的『避風港』。」副總統范斯在另外一場昨天於福斯新聞播出的訪問中提到，美國正在討論是否提供基輔長程戰斧（Tomahawk）巡弋飛彈，這項請求曾遭川普否決。范斯談及相關飛彈時表示，「最終決定權還是在總統手上」，並補充美方正在考慮歐洲國家的一些請求。克里姆林宮發言人培斯科夫（Dmitry Peskov）今天在例行記者會中則回應，烏克蘭政權在戰線上的情勢「沒有靈丹妙藥能改變」。「根本沒有什麼神奇武器。無論是戰斧或其他飛彈，都無法扭轉局勢。」川普上週與烏克蘭總統澤倫斯基會晤後曾表示，在歐洲聯盟（EU）的協助下，基輔有能力「奪回全部失土，恢復烏克蘭原有疆界」。俄羅斯2014年行動後佔領烏克蘭黑海半島克里米亞，並自2022年2月全面入侵以來控制烏東及烏南多個地區。對烏克蘭議題的這項新立場，顯示川普已有轉變。今年2月，他曾在白宮橢圓辦公室、與澤倫斯基的一場激烈公開交鋒中宣稱，基輔「毫無勝算」。俄羅斯則誓言在這場已歷時三年半的戰事中持續推進攻勢。對於川普稱俄國是「紙老虎」、經濟搖搖欲墜的說法，克里姆林宮近日也予以駁斥。熱門賽事、球星動態不漏接    ,https://news.ltn.com.tw/news/world/breakingnews/5194990
台日友好！ 日本人在名古屋車站「募款助花蓮」 畫面暖哭台灣人,國際,2025/09/29 21:12,"旅日民眾分享，她在28日經過名古屋車站前時，發現有一群日本人拿著寫有「天佑台灣」等字樣的布條，進行街頭募款活動。（Threads網友「kaigo_foo_d」授權提供）花蓮馬太鞍溪堰塞湖23日溢流，重創下游光復鄉，許多國內外民眾除化身「鏟子超人」趕赴現場協助救災，也盡己所能提供物資、捐款等幫助。有旅日民眾分享，她經過名古屋車站前時，發現有一群日本人拿著寫有「天佑台灣」等字樣的布條，進行街頭募款活動，畫面曝光後，令無數台灣網友感動落淚。美食部落客「kaigo_foo_d」昨（28）日下午在社群平台Threads分享一段影片，並透露拍攝地點是在愛知縣名古屋車站前。從畫面顯示，10多名身穿背心的日本人，一起拿著寫有「天佑台灣 身在日本心在花蓮」、「台灣花蓮水害 被害者支援募金」字樣的布條，以及災區照片的紙板，在街頭進行募款活動，希望為花蓮盡一份心力。請繼續往下閱讀...根據「kaigo_foo_d」描述，雖然她不確定這活動是不是旅日台灣人或相關團體所發起，但在異國還能看到有人如此關心台灣，讓她十分感動，另透露這個團體不只能捐日幣，還可以捐台幣，「希望大家不論在哪裡，有錢出錢，有力出力，沒有也沒關係，默默祝福就好，希望大家可以一起順利度過這個難關，順順利利平平安安。」影片曝光後，立即在網上掀起熱烈迴響，還有熱心網友留言告知，這項活動其實是由「日台青年交流會」的代表加藤秀彥先生所發起，他本人也在Threads發布光復鄉的災情說明，以及當天募款活動的資訊與圖文影音。加藤先生也透露發起募款原因，他認為台灣是日本的好鄰居和珍貴的朋友，因此希望能夠為鄰國災民提供支援。溫暖且真摯的關懷，讓眾多台灣網友感動不已，紛紛留言表達感謝之情，「日本人真的太有心了」、「我要哭死，怎麼能不愛日本」、「台日友好，謝謝日本一直惦記著台灣」、「太感人了，台日友好的情感就是對方有難就不故一切的幫忙及支援」、「我就問日本人！你們到底要記多久，讓人很感動又很歹勢，阿里嘎豆！」、「超感動，有些國家幫助他們一次，記一輩子；有些是不管幫助幾次，戰機陪一輩子」。也有不少台灣網友擔憂「善款遭濫用」，緊急用日文、英文等外國語言留言提醒熱心的日本民眾，千萬記得「不要捐給花蓮縣政府」，同時建議可以捐到由台灣衛福部所設立的財團法人賑災基金會「0923花蓮馬太鞍溪堰塞湖災害募款專案」。此外，根據加藤先生補充介紹，「日台青年交流會」是一個成立於2010年、以名古屋為據點的團體，目的是推動日本與台灣年輕世代之間的交流活動。該團體除了在28日為花蓮洪災發起募款，還曾在2014年高雄氣爆事故、2016年台南地震，以及2018年與2024年花蓮地震時發起募款活動，並曾獲得台灣政府衛生福利部頒發感謝狀。     在 Threads 查看     在 Threads 查看h4>相關新聞請見：日本「和平之風」送冷凍櫃支援花蓮災區 募款逾100萬元奈良美智舉辦「奇異筆刺青」募款 所得全數捐助花蓮賑災免費訂閱《自由體育》電子報熱門賽事、球星動態不漏接    日本「和平之風」送冷凍櫃支援花蓮災區 募款逾100萬元奈良美智舉辦「奇異筆刺青」募款 所得全數捐助花蓮賑災熱門賽事、球星動態不漏接    ",https://news.ltn.com.tw/news/world/breakingnews/5194893
資料中心大火、政府行政癱瘓 南韓調高國家網路危機警報,國際,2025/09/29 20:52,韓國國家資訊資源管理院日前發生大火，導致數百項政府線上服務停擺，預估至少需2到4週復原，韓國國家情報院（見圖）29日也將國家網路危機警報從「關心」上調至「注意」。（取自韓國國家情報院官網）韓國國家資訊資源管理院日前發生大火，導致數百項政府線上服務停擺，預估至少需2到4週復原，韓國國家情報院今天也將國家網路危機警報從「關心」上調至「注意」。位於韓國大田市的國家資訊資源管理院（National Information Resources Service）26日發生大火，火勢已於27日撲滅，但仍造成數百項政府線上服務停擺，截至當地時間今天下午4時，停擺的647項服務中只有73項恢復正常運作。請繼續往下閱讀...在此混亂狀況下，韓國國情院今天將國家網路危機警報上調，相當於認證有必要加強監控、避免駭客藉此機會採取不法行為，加上韓國將在下月底於慶州主辦亞太經合會（APEC）峰會，原就有監控國內外網路威脅的必要。考慮到駭客可能在韓國政府行政資訊系統癱瘓的情況下進行網路攻擊，韓國國情院要求各行政機關依照網路危機應對實務手冊，在發現網路攻擊、網路癱瘓等跡象時，立刻通報國家網路安保中心及國家安保室。據韓國中央災難安全對策本部報告，受到這次火災直接影響的96個系統規劃將遷移至大邱分中心重建，耗時估約4週，其餘551個系統的修復工作則將耗時約2週。熱門賽事、球星動態不漏接    ,https://news.ltn.com.tw/news/world/breakingnews/5194909
「鹽颱風」肆虐  美媒：中國國安部網路間諜能力增強,國際,2025/09/29 20:49,中國駭客行動「鹽颱風」侵入全球80多國通訊網路，引發各國關注。（彭博）中國駭客行動「鹽颱風」侵入全球80多國通訊網路引關注。紐約時報報導，中國國家主席習近平掌權後，將國家安全部提升為主要網路間諜機構，此次行動凸顯中國國安部日益增強的能力，恐威脅美國通訊、電力和基礎設施。紐約時報先前報導提到，中國駭客「鹽颱風」竊取幾乎所有美國民眾的個資，並鎖定數十個國家。一些受「鹽颱風」攻擊的國家在聲明中警告，竊取的數據可能使中國情報機構具備「識別和跟蹤目標對象全球通信及行動」的能力。請繼續往下閱讀...紐約時報28日報導，有美國和歐洲官員表示，中國國家安全部（國安部）成為該次網路行動的主要推手。報導提到，中國幾十年來一直雇用駭客入侵電腦網路和系統。近期「鹽颱風」的行動中，與中國國安部有關的入侵者會透過挖掘系統弱點潛入網路，竊取數據，在被攻破的系統間跳轉，並清除活動痕跡。「間諜與謊言：中國最大的秘密行動如何愚弄了世界」（Spies and Lies: How China's Greatest Covert Operations Fooled the World）作者周安瀾（Alex Joske）表示，「鹽颱風」顯示中國國安部網路行動的高技能和戰略性，此前人們更關注低品質的雇工駭客而忽略了這一點。報導也提到，美國官員於2023年發現中國政府控制的駭客，在美國關鍵基礎設施中植入惡意代碼。時任中央情報局（CIA）局長伯恩斯（William Burns）祕密前往北京，與中國國安部長陳一新交涉。伯恩斯警告，若北京啟用該惡意軟體將面臨嚴重後果。據前官員透露，面對美方擺出的網路行動細節，陳一新不露聲色，僅表示會向其上級轉告美國的關切。這次會晤的細節此前從未披露。專家們表示，從2015年前後開始，中國國安部將各省分支機構置於中央控制之下。陳一新要求地方國安部門毫不遲疑地執行北京的命令。報導提到，中國領導人於1983年組建國安部，跟蹤異議人士和共產主義統治的潛在敵人。該部門也從事網路間諜活動，但相比展開大規模網路間諜行動的軍方，國安部在很長時間裡的表現並不突出。直到2012年習近平成為中國最高領導人後重塑國安部，清洗被控腐敗和不忠的高級官員，緊縮中國軍方的駭客角色，將國安部提升為主要的網路間諜機構，並透過立法設立新委員會將國安置於議程核心。報導稱，中國國安部大多暗中運作，其官員鮮少公開露面或被提及，但曾任該部第十三局—「技術偵查」部門的高級官員吳世忠是例外，他以「中國信息安全評測中心主任」的身分參加會議和研討會。專家表示，該中心受國安部控制，為其提供漏洞和駭客人才的直接訊息管道。報導提到，吳世忠從未公開承認在國安部任職，但在2005年中國一所大學網站在會議通知中稱他在國家安全部任局長。周安瀾表示，吳世忠被廣泛認為是國安部網路能力創建的領軍人物。多名網路安全專家表示，中國國安官員已學會利用其國內公司和承包商為其工作，發現並利用電腦系統的漏洞和弱點。美國國家安全局（NSA）也囤積軟體漏洞知識供己用，但中國有額外優勢，即可利用該國科技公司為國家提供訊息。中國政府還規定，新發現的軟體漏洞需首先報告給一個數據庫。分析人士稱，該數據庫由國安部營運，讓安全官員優先獲取，還有一些政策獎勵科技公司，發現漏洞並提交到安全部控制的數據庫，每月達到一定額度可獲報酬。熱門賽事、球星動態不漏接    ,https://news.ltn.com.tw/news/world/breakingnews/5194963
印尼總統府掀新聞自由爭議後 恢復CNN記者採訪資格,國際,2025/09/29 20:48,印尼總統普拉伯沃（Prabowo Subianto）。（法新社檔案）美國有線電視新聞網（CNN）印尼頻道記者詢問政府免費學餐致食物中毒案，隨後遭總統府取消採訪資格，引發外界對印尼新聞自由的憂慮，總統辦公室今天恢復該記者的採訪資格。路透社引述CNN印尼頻道報導，該頻道總編輯羅斯瑪莎莉（Titin Rosmasari）與總統府人士會面，確認該名記者的採訪資格已經恢復。請繼續往下閱讀...報導並指出，印尼總統府已對撤銷資格一事致歉，還說不會再發生類似情況。印尼新聞理事會昨天表示，總統府應該解釋撤銷資格的理由，並恢復該名記者的權限，同時呼籲保障新聞自由。羅斯瑪莎莉今天稍早告訴路透社，總統府是在27日晚間撤銷該名記者的採訪資格。她也對時代報週刊（Tempo）表示，取消資格的原因與記者對總統普拉伯沃（Prabowo Subianto）提問數千名學童食用免費學餐後身體不適有關。新聞畫面顯示，該名記者27日詢問普拉伯沃，對負責免費學餐計畫的國家營養局（National Nutrition Agency）有無指示。普拉伯沃回說，他將召見該機構，還說「事關重大」，但計畫初期難免有缺失，呼籲勿將此事政治化。時代報週刊報導，現場其他記者只獲准詢問普拉伯沃上週造訪聯合國總部等出訪行程。根據政府資料，普拉伯沃今年1月推行數十億美元的免費學餐計畫以來，已有近6000名兒童食用餐點後不適，僅上週就有超過1000人。普拉伯沃今天再為這項雄心勃勃的供餐計畫辯護，表示食物中毒比例低，而且計畫還在摸索階段。熱門賽事、球星動態不漏接    ,https://news.ltn.com.tw/news/world/breakingnews/5194961
