Title,News_Type,date,content,url
以鉛筆刺童、孤立在角落 台南某幼兒園、老師判賠31萬給男童 ,社會,2026/06/16 18:01,台南市一家私立幼兒園黃姓女教保員涉以鉛筆刺傷5歲男童手臂，及將男童孤立在教室角落，侵害男童身心健康，台南地院判幼兒園與黃女須連帶賠償31萬多元給男童。（資料照，記者王俊忠攝）台南1名5歲男童在幼兒園被教保員當「出氣筒」，不僅被鉛筆狂刺右前臂，還被長期隔離在教室角落，獨自跪坐吃飯，如同遭到班級霸凌！男童與父母憤而提告，台南地院判決認老師與幼兒園須連帶賠償男童31萬餘元；男童父母因身分法益未受重大侵害，駁回各自求償25萬元，還可上訴。男童與其父母主張，2023年6月1日就讀台南1家私立幼兒園的男童，因拿鉛筆刺教室內地墊，引起黃姓女教保員不滿，黃女從男童手中奪過鉛筆，朝男童右前臂連刺數下，造成男童右臂留下多處開放性淺層小傷口。請繼續往下閱讀...此事後，男童父母追查更發現，從2022年10月至2023年6月，黃女長期把男童獨自安排坐在教室角落的積木區，未與其他幼童同桌，只有1張摺疊和室桌，沒有符合男童身高的正常桌椅，男童多數時間須「跪坐」吃飯、上課，其他同學更說「那是反省區，他每天都坐在那裡」。男童父母說，男童長期遭孤立與標籤化，且長時間跪坐、姿勢不良，造成雙膝脛骨生長板鈣化併早期密合，侵害其身心健康，因此產生嚴重焦慮、害怕上學，甚至向心理師哭訴「不想去上學，因為老師欺負我」。法官認為，這種長期標籤化的座位安排，已構成不當管教，嚴重侵害男童的人格身心發展權。幼兒園辯解黃女證照齊全、事發突然難以預防，想免除連帶責任。但法官批判園方未能提出事前的具體督導、考核紀錄，僅以事後安排研習課程推託，難認已盡選任監督義務，依民法判幼兒園與黃女須連帶賠償31萬多元。男童父母也各提求償25萬元精神慰撫金。法官解釋，男童父母雖因孩子受虐而感到痛苦，但這屬於「為人父母的不捨」，並非父母自身法律權益受侵害，且未達到「情節重大」程度，因此不予賠償。    ,https://news.ltn.com.tw/news/society/breakingnews/5474235
中和四號公園旁驚傳墜樓 62歲婦人重創搶救不治,社會,2026/06/16 17:54,新北市中和四號公園今發生墜樓事件，陳姓婦人從住家高處墜落後，經送醫搶救仍宣告不治，警方封鎖現場調查。（記者陸運鋒翻攝）新北市中和823紀念公園（四號公園）旁，今天下午發生一起墜樓事件，陳姓婦人從住家高處墜落後，被民眾發現倒臥在地，隨即通報救護車前來，警消趕抵時，發現陳女已失去呼吸心跳，緊急送醫搶救仍不治，經鑑識人員勘驗採證後，已排除外力介入，詳細原因仍有待調查。中和警分局調查，死者為62歲陳姓婦人，住在中和四號公園旁中安街社區大樓，今天下午3時許，從住家墜落至1樓地面，民眾見狀連忙報案，警消趕抵時，發現陳女全身多處重創，且已經沒有呼吸心跳，隨即實施CPR心肺復甦術，並送往永和耕莘醫院搶救，但仍宣告不治。請繼續往下閱讀...據知，警方趕抵封鎖現場，由鑑識人員勘驗採證，經通知陳女丈夫了解後，研判並沒有外力介入，已排除他殺之嫌，陳女也未留下遺書，確切死因仍有待檢方進一步相驗釐清。    ,https://news.ltn.com.tw/news/society/breakingnews/5474221
宜蘭消防局長徐松奕涉核銷不實弊案 檢方諭知50萬元交保,社會,2026/06/16 17:45,宜蘭縣消防局長徐松奕（白衣者）涉核銷不實弊案，檢方複訊後諭知50萬元交保。（記者王峻祺攝）宜蘭縣消防局捲入餐費核銷不實弊案，案情持續向上延燒，檢調繼5月發動首波搜索後，為追查不明資金流向，今天發動第2波行動，兵分2路搜索並約談消防局長徐松奕、餐廳業者，宜蘭地檢署今天下午複訊後，徐松奕被依涉犯貪污治罪條例諭知50萬元交保、林姓女業者涉犯偽造文書及違反「商業會計法」5萬元交保。檢方調查，徐涉嫌在辦理公務餐會核銷時，採取「以少報多」手法浮報經費，多出溢領款項被挪用於購買酒水，甚至用來支付私人餐宴；林姓業者則涉嫌從中配合，開立不實收據與發票，不法金額數萬元，目前正擴大釐清詳細金流與涉案事證。請繼續往下閱讀...檢調日前接獲情資，指消防局辦理「特種搜救隊國家認證計畫」結訓作業時，疑有承辦人以不實單據浮報、核銷數萬元宴飲餐費。檢方5月26日兵分5路進行首波搜索，約談時任搶救科長（現任第一大隊長）張舜堯等人。當時檢方複訊後，依涉犯貪污治罪條例及偽造文書等罪，諭知張舜堯、實際承辦的賴姓科員各10萬元交保，林姓科員5萬元交保，王姓科員無保請回；不過，檢調發現涉案餐會不只一場，為追查虛報資金流向，將「有無高層涉案」列為後續調查重點。宜蘭地檢署今天依貪污案件再向法院聲請搜索票，指揮宜蘭縣調查站前往消防局長徐松奕住處及辦公室搜索，並約談徐松奕及餐廳業者，全案朝採購及核銷流程是否涉及不法方向釐清，今天下午4點多，徐松奕及林姓業者分別移請地檢署複訊，訊後依涉犯貪污治罪條例，諭知徐松奕50萬元交保，林姓女業者涉偽文及違反商會法諭知5萬元交保。徐松奕今早被調查官帶出辦公室時，並未閃躲鏡頭，面對媒體追問檢調搜索行動是否「重傷消防局體系」？他語氣平穩、堅定回應「我相信我們同仁是清白的。」隨後在調查人員陪同下乘車離開。    ,https://news.ltn.com.tw/news/society/breakingnews/5474222
悚！花蓮轎車鬼切害騎士夫妻彈飛   慘遭迎面來車「二次撞擊」,社會,2026/06/16 17:42,銀灰色汽車起步直接左切，導致後方直行機車攔腰撞上。（警方提供）花蓮32歲王姓男子日前開銀灰色汽車準備起步，突從外側車道「鬼切」駛入內側，導致後方一輛直行機車閃避不及迎面撞上。機車遭受猛烈撞擊後，整輛車失控彈飛至對向車道，慘遭另一輛迎面而來的灰色汽車「二次撞擊」。事故造成機車上一對年輕夫妻重傷送醫，其中丈夫因顱內出血與頭部撕裂傷，目前仍在慈濟醫院插管急救中。吉安警分局今指出，這起驚悚車禍發生在14日晚間7點多。涉嫌肇事的32歲王姓男子，駕駛HONDA銀灰色汽車，沿著花蓮市建國路2段東向行駛，在準備起步加速時，疑似未注意車後狀況且未依規定禮讓，突然從外側車道切入內側車道。請繼續往下閱讀...當時後方正巧有一對年輕夫妻騎車準備前往市區，36歲胡姓男子載著32歲溫姓女子直行，面對突然橫切出來的汽車，完全來不及煞車便猛烈攔腰撞上。更慘的是，機車挨撞後連人帶車彈到對向車道，當場與對向由陳姓老翁駕駛、正準備返家的中華三菱灰色汽車發生二次猛烈對撞。救護人員趕抵現場時，現場零件碎屑散落一地。首當其衝的胡姓機車騎士頭部受到重創、出現大面積撕裂傷及顱內出血，傷勢相當危急，緊急送往花蓮慈濟醫院後進行插管急救；後座的溫姓女子則因劇烈拋摔導致腳部骨折及全身多處擦挫傷，幸意識清醒，救治後暫無生命危險。這起連環撞也波及到對向開車的七旬老夫妻，72歲的鄭姓老婦因目睹機車迎面飛來，駕駛雖緊急煞車，導致老婦頭頸部嚴重扭傷，更因過度驚嚇過度而臉色慘白、一度無法言語，最後由警方協助送醫。陳姓男子餘悸猶存地向警方表示：「我直直地開，機車是撞上對面車後，彈過來給撞到！」警方當場對肇事的王男及對向陳男實施酒測，兩人酒測值均為零、且持有合格駕照，兩人都沒有受傷；至於重傷的胡姓騎士則有待醫院抽血檢驗。吉安分局呼籲，駕駛人起步變換車道前應確實打方向燈並禮讓直行車，市區行車也應減速慢行，避免類似悲劇再度發生。銀灰色汽車起步直接左切，導致後方直行機車攔腰撞上，彈到對向車道再被撞到。（警方提供）銀灰色汽車起步直接左切，導致後方直行機車攔腰撞上，彈到對向車道再被撞到。（警方提供）    ,https://news.ltn.com.tw/news/society/breakingnews/5474207
海巡首屆無人機賽登場 56名飛手同場競技 以科技打造監偵防護網,社會,2026/06/16 17:41,海巡署今首度舉辦「2026年海巡專業技能競賽－無人機」大賽。（記者陸運鋒翻攝）海巡署今天在金馬澎分署無人機訓練場舉辦「2026年海巡專業技能競賽－無人機」大賽，海洋委員會主任委員管碧玲至現場加油打氣，海巡署長張忠龍更親自操控無人機起飛，為賽事揭開序幕，這也是海巡署成立以來首度辦理的全國性無人機競賽，集結來自全國8個分署、共56名持證精銳飛手同場競技，全面檢視飛手在個人操作與團隊分工上的臨場應變能力。管碧玲強調，面對中國灰色地帶襲擾，海巡署海域執法已邁向「科技海巡」的高空立體化新里程碑，將無人機導入第一線勤務，正是科技輔勤最具體的實踐。海巡署已編列21億元推動建案，將分年建構近程機、中程機、艦載機及特勤機等4類無人機，藉以擴增海域偵蒐範圍，建構立體情監偵系統，強化海域秩序維護的防範效能。請繼續往下閱讀...管碧玲表示，這場比賽讓她看到了海巡科技建軍的具體成果，不僅是在操作一架機器，更是將資訊科技、情資研判與海域執法完美結合。大家在賽場上沉著應變、靈活調度的表現，讓未來藍色國土的守護充滿了信心。管碧玲指出，再先進的裝備都須仰賴扎實訓練，唯有「人」才是科技輔勤成敗的關鍵，她也勉勵所有參賽同仁「競賽有輸贏，但科技精進沒有終點」，海巡任務瞬息萬變，最重要的是透過比賽看見別人的優點，發現自己的盲點，她期許大家回到崗位後，每個人都是科技執法的種子教官，把寶貴經驗散播出去。海巡署金馬澎分署表示，本次競賽分為團體組與個人組，並邀請中央警察大學及桃園市消防局等5名專家組成裁判團，賽事現場高潮迭起，選手須精準操控無人機進行「8字水平圓」盤旋並刺破氣球；「緊急處置程序」考驗遭遇突發狀況時即時研判航高、航線並穩定降落的應變能力；「儀表飛行尋物」則由團隊分工，模擬視距外飛行（BVLOS）搜尋並拍攝指定目標，展現查緝走私、海上搜救等任務所需的偵蒐航拍基本功。海巡署表示，未來將持續落實科技輔勤理念，朝「智慧巡防、科技執法、韌性文化」方向發展，深化無人機在巡防、查緝與海難救助等勤務中的應用，讓裝備與人才雙軌並進，打造更堅實的海域防護網。海巡署已編列21億元推動建案，將分年建構近程機、中程機、艦載機及特勤機等4類無人機。（記者陸運鋒翻攝）管碧玲強調，面對中國灰色地帶襲擾，海巡署海域執法已邁向「科技海巡」的高空立體化新里程碑，將無人機導入第一線勤務。（記者陸運鋒翻攝）    ,https://news.ltn.com.tw/news/society/breakingnews/5474167
國1三義段火燒車！槽車車頭起火 北上車流回堵3公里,社會,2026/06/16 17:40,國道一號北上153公里一輛槽車車頭起火停在路肩。（翻攝國道即時路況）國道一號北上153公里苗栗三義爬坡路段，今（16）日下午4點多發生火燒車事故，一輛槽車車頭起火停在路肩，台中市消防局后里分隊及國道3隊泰安分隊員警前往處理中，北上車流回堵3公里至大安溪橋。警、消獲報到場處理。（翻攝國道即時路況）國道一號北上153公里一輛槽車車頭起火停在路肩，北上車流因此回堵3公里至大安溪橋。（翻攝國道即時路況）    ,https://news.ltn.com.tw/news/society/breakingnews/5474212
撞上87歲騎單車老婦人竟肇逃   雨中躺路邊2小時送醫不治,社會,2026/06/16 17:31,台中87歲李姓老婦人，昨天凌晨騎單車行經霧峰錦州路，遭開車陳姓男子撞上卻肇逃，李女在路邊躺了2個多小時才被發現送醫不治。（記者陳建志翻攝）台中一名87歲李姓老婦人，昨天凌晨3點多騎單車想到廟裡拜拜，行經霧峰區錦州路時，卻被駕駛自小客車的陳男（38歲）撞上，陳男沒有停車肇事逃逸，李姓婦人直到凌晨5點多才被路過民眾發現報案送醫，仍因傷重不治，警方調閱監視器在昨天下午4點查獲陳男，陳男表示沒發現有撞到人，目前已移送檢方偵辦。台中市霧峰分局警方，昨天凌晨5點38分左右接獲民眾報案，表示霧峰區錦州路有老婦人騎單車被撞倒在路邊，現場一輛腳踏車被撞到輪子歪掉，地上則是血跡斑斑，消防人員獲報趕到，發現老婦人左腳開放性骨折、額頭撕裂傷，現場已經沒有呼吸心跳，雖送醫急救仍不治。請繼續往下閱讀...警方隨即調閱監視器，查出被撞的是87歲李姓老婦人，昨天是農曆初一，疑似是一大早要到廟裡拜拜，追查後並發現，老婦人在凌晨3點20分左右就被撞上，卻因肇事自小客車沒有停車處理肇事逃逸，造成受傷的李姓婦人，雨中在路邊躺了2個多小時，直到凌晨5點多才被路過民眾發現送醫。警方以車追人，昨天下午4點查獲肇事的陳姓男子（38歲），陳男表示沒有發現撞到老婦人，經酒測和毒品快篩，沒有酒駕和毒駕，全案目前由檢方偵辦中。警方呼籲駕駛人切勿疲勞駕駛，如遇交通事故，應立即留在現場、報警並依規定處理，切勿因心存僥倖選擇離開現場，否則不僅觸法，還將面臨吊銷駕照與相關刑事責任。另詳細肇事原因將送交通警察大隊分析研判。台中87歲李姓老婦人，昨天凌晨騎單車行經霧峰錦州路，遭開車陳姓男子撞上卻肇逃，李女在路邊躺了2個多小時才被發現送醫不治。（記者陳建志翻攝）陳姓男子昨天凌晨開車撞上李姓婦人，卻沒停車處理肇事逃逸。（記者陳建志翻攝）    ,https://news.ltn.com.tw/news/society/breakingnews/5474182
台鎔科技捐贈不鏽鋼杯助消防人員消暑 他再扮「蜘蛛人」現身,社會,2026/06/16 17:24,台鎔科技材料股份有限公司16日捐贈桃園市消防局400個環保不鏽鋼杯，由董事長陳麗麗（中）、總經理張德鈞（右1）代表捐贈，消防局局長龔永信（右2）代表消防同仁受贈，並回贈感謝狀。（記者鄭淑婷攝）台鎔科技材料股份有限公司今（16）日捐贈桃園市消防局400個環保不鏽鋼杯，感謝消防弟兄平日堅守崗位，守護市民生命財產安全，也提醒在炎熱夏季執勤時注意補充水分、維護身體健康，由董事長陳麗麗、總經理張德鈞代表捐贈、消防局長龔永信代表消防同仁受贈，並回贈感謝狀。陳麗麗表示，本次捐贈的環保不鏽鋼杯，具備可重複使用特性，能減少一次性用品使用，符合節能減碳及循環經濟理念，希望透過實際行動推廣環保觀念，共同為永續環境盡一份心力，而目前進入盛夏高溫季節，消防人員經常身穿厚重裝備執行救災救護勤務，不論是火場搶救、緊急救護或各項災害應變工作，體力與水分消耗都相當大，因此特別選擇捐贈不鏽鋼杯，希望鼓勵消防弟兄養成隨時補充水分的習慣，避免熱危害發生，維護身體健康。請繼續往下閱讀...她也表示，消防人員全年無休、24小時守護市民生命財產安全，每當災害發生時，總是奮不顧身站在最危險的第一線，展現鋼鐵般的意志與無私奉獻精神。此次捐贈除表達企業對消防工作的支持與感謝外，更向所有消防英雄致上最高敬意。龔永信表示，感謝台鎔科技以實際行動支持消防工作，不僅提供實質關懷，也讓第一線消防同仁感受到社會各界的溫暖與肯定。在捐贈儀式上，消防局人事室股長林宗禧再次穿上「蜘蛛人」裝現身，他說，蜘蛛人的形象代表正義及救災、救難，就跟消防人員一樣，10年前自己就開始穿上蜘蛛人裝，參與消防局大小活動，最早是消防局參加市府舉辦的公教杯羽球賽、桌球賽時，他便以這身打扮代表消防局持局處牌，10年來累積了2、30場活動，同仁對他的裝扮相當熟悉，在活動現場也很受到大小朋友歡迎，希望藉此讓更多民眾認識消防。台鎔科技材料股份有限公司16日捐贈桃園市消防局400個環保不鏽鋼杯，上頭特製吉祥物「消防豹」圖樣。（記者鄭淑婷攝）桃園市消防局人事室股長林宗禧再次穿上「蜘蛛人」裝現身捐贈儀式。（記者鄭淑婷攝）    ,https://news.ltn.com.tw/news/society/breakingnews/5474013
7旬男子墜落購物中心機車停車場外 警方拉起封鎖線採證,社會,2026/06/16 17:12,74歲男子墜落蘆竹區南崁大型購物中心機車停車場外，警方拉起封鎖線採證。（讀者提供）桃園市蘆竹區南崁知名大型購物中心今（16）日下午發生墜樓事件，74歲男子被目擊墜落機車停車場外，已明顯死亡未送醫，警方獲報拉起封鎖線採證，將報請桃園地檢署檢察官相驗及調查釐清墜樓原因。墜樓意外發生在下午3點多，有民眾目擊並驚訝問「發生什麼事」，警方拉起封鎖線在現場採證，初步研判應無外力介入，將報請桃檢檢察官、法醫相驗，釐清男子確切死因。    ,https://news.ltn.com.tw/news/society/breakingnews/5474158
宜蘭檢警持續掃蕩喪屍煙彈 藥頭、毒駕共3人遭羈押,社會,2026/06/16 17:10,宜蘭地檢署偕同警方掃蕩喪屍煙彈毒品，在蘇花公路攔獲毒駕，駕車的王姓嫌犯（中）被羈押。（保三總隊提供）宜蘭地檢署偕同警方持續掃蕩轄內喪屍煙彈毒品，昨天查獲7人到案，其中，王姓、李姓嫌犯涉嫌毒駕，連同洪姓藥頭共3人被羈押。保三總隊刑警大隊今天（16日）指出，保三總隊3月接獲情資，宜蘭縣洪姓主嫌涉嫌製造、分裝第二級毒品依托咪酯（喪屍煙彈），報請宜蘭地檢署檢察官郭欣怡指揮偵辦，並與宜蘭刑警大隊共組專案小組追查，經長期跟監掌握嫌犯身分與犯案事證，昨天兵分7路執行搜索拘提。請繼續往下閱讀...查緝過程發現，王嫌開車搭載李嫌上蘇花公路，行進過程有偏移情形，保三總隊刑事分隊長李彥蓉發動攔查即時上銬，在車內起獲依托咪酯煙油、煙彈、安非他命、吸食器等證物，察覺王嫌神情恍惚、眼神呆滯，經唾液快篩呈毒品陽性反應，依公共危險罪當場逮捕。專案小組乘勝追擊，隨後將洪姓販毒主嫌、共犯林嫌、李嫌、俞嫌、潘嫌拘提到案，一舉搗破該集團的毒品分裝廠，依違反毒品危害防制條例、公共危險等罪嫌移送法辦，這波查緝行動中的李嫌也涉嫌毒駕。檢察官認為，涉入毒駕的王嫌、李嫌罪嫌重大，可能再度毒駕，洪姓藥頭恐與購毒者勾串滅證，均有羈押必要，訊後聲押，法官昨深夜11點裁定3人羈押。宜蘭地檢署偕同警方掃蕩喪屍煙彈毒品，在蘇花公路攔獲毒駕，駕車的王姓嫌犯被羈押。（民眾提供）警方查扣的毒品。（保三總隊提供）    ,https://news.ltn.com.tw/news/society/breakingnews/5474156
運毒判6年潛逃竟再走私百億毒品 屏檢對惡劣船長許佳農求處無期刑,社會,2026/06/16 16:54,檢調破獲琉球籍「添發財38號」漁船走私黑市價格逾100億元的海洛因磚及K他命毒品案。（檢調提供）法務部調查局與新北檢、屏檢聯手破獲琉球籍「添發財38號」漁船走私黑市價格逾100億元的海洛因磚及K他命毒品案，遭到逮捕的船長許佳農先前因犯下漁船走私K他命毒品案被判刑6年定讞，不料卻在入監前潛逃，期間又犯下規模更大的毒品走私案，屏檢偵辦後認為許佳農惡性重大，連同參與走私的胞兄許偵倫及共犯戴盛均等3人，一併向法院求處無期徒刑。許佳農（原名為許禎哲）2021年1月間駕駛高雄港籍「連鴻號」漁船從國外走私48麻袋、重約962公斤的K他命，刻意以腐敗發臭的魚餌覆蓋遮掩，仍被海巡單位查獲送辦，許男於1年多前被法院依運輸第三級毒品罪判處6年定讞，卻在發監前潛逃無蹤，藏匿期間，又犯下規模更大的漁船走私毒品案，檢方這次不讓許男有逃跑的機會，直接入監關押。請繼續往下閱讀...屏檢偵辦後，認為許佳農於逃匿期間非但毫無悛悔實據，反而變本加厲，與其胞兄許偵倫共同犯下涵蓋292公斤多第一級毒品海洛因與353公斤多第三級毒品K他命等規模龐大的運輸毒品犯行，顯見其具備極高再犯危險性與極端惡劣的犯行，建請法院對許男處以無期徒刑，以昭炯戒。此外，檢察官認為同案被告許偵倫（在押），擔任海上漁船接駁重要角色，還帶領外籍船員共同涉案，與居中負責聯繫、並支付500萬元前金給許佳農的共犯戴盛均（在押），均屬犯行重大，戴男還否認涉案且拒絕供出資金來源，建請法院對2人處以無期徒刑。☆少一份毒品就多一份健康，自由時報提醒您遠離毒品☆檢調破獲琉球籍「添發財38號」漁船走私黑市價格逾100億元的海洛因磚及K他命毒品案。（檢調提供）    ,https://news.ltn.com.tw/news/society/breakingnews/5474040
汽車擋道未禮讓救護車  熱心騎士下車指揮才駛離,社會,2026/06/16 16:54,藍色汽車擋在路前未禮讓後方救護車，一名熱心機車騎士見狀下車指揮，藍車才駛離。（擷取自Threads）昨天上午7點多，1輛藍色轎車行駛在台中市沙鹿區忠貞路20巷附近，後方救護車不斷鳴笛，轎車卻遲未避讓，1名熱心的機車騎士見狀下車指揮，藍車才駛離，民眾忍不住在Threads上po文指出「不是阿，讓一下救護車有什麼困難」？清水警分局表示，目前尚未接獲民眾檢舉，調閱監視器畫面，發現該轎車確有不立即避讓救護車的情況，依道路交通管理處罰條例第45條第2項規定，可處汽車駕駛人6000元以上3萬元以下罰鍰，並吊銷駕駛執照及吊扣該汽車牌照6個月。請繼續往下閱讀...警方呼籲，聽聞救護車警號時，駕駛人及行人請務必立即避讓，以共同維護救護通道順暢。民眾若遇交通違規，可依道路交通管理處罰條例第7之1條，檢附舉證資料，向警察局系統檢舉。    ,https://news.ltn.com.tw/news/society/breakingnews/5474089
基隆男報復被毆打施虐 持西瓜刀猛劈仇家致殘疾,社會,2026/06/16 16:43,王男遭謝男持刀猛砍背部，大量失血。基隆市消防局消防隊員趕緊將他止血送醫急救，經醫院緊急輸血急救才救了他一命。（記者林嘉東翻攝）基隆市謝姓男子不滿曾遭王姓男子綁架毆打，獲知王男在基隆市八斗子夜市擺攤後，持西瓜刀趁王男背對他專心擺攤時，朝王的後背、上肩部狂砍，致王男嚴重氣血胸、失血性休克病危，幸經搶救後撿回一命，但右肩已嚴重殘疾。基隆地院近日審結，依殺人未遂罪判處謝男6年徒刑。判決指出，謝男與王男因網路博弈彩金結怨，謝男不滿曾被王男擄走毆打，前年11月間先到八斗子夜市確認王男工作攤位後，去五金行買1把西瓜刀，驅車前往伏擊，趁王男毫無防備，朝王男背部與上肩部揮砍砍多刀，致王男大範圍切割傷、骨折及氣血胸，當場血流如注。謝男行凶後駕車逃逸，並將凶刀丟棄在新北市路旁，不過仍基隆市警二分局警方循線逮捕。請繼續往下閱讀...王男送醫後因失血過多，醫院當晚緊急發出病危通知，所幸急救輸血才保住性命，不過，王男遭砍的右肩因肌肉、與韌帶斷裂嚴重，已達難治的重傷程度。法院審理時，謝男雖坦承砍人，但否認有殺人動機，但法官認為，謝男明知砍斷動脈會致死，卻仍預謀挑選鋒利兇器，朝王男致命部位猛烈攻擊，手段兇狠，依殺人未遂罪判處6年徒刑。可上訴。王男遭謝男持刀猛砍背部，大量失血，現場血跡斑斑，基隆市消防局消防隊員獲報緊急將他送醫急救。（記者林嘉東翻攝）謝男行凶後駕車逃逸，並將凶刀丟棄在新北市路旁，仍被警方循線逮捕。（記者林嘉東翻攝）    ,https://news.ltn.com.tw/news/society/breakingnews/5474034
