Title,News_Type,date,content,url
重點在做什麼？ 「鄭習會」落幕   國安人士曝後續觀察3指標,政治,2026/04/10 20:49,國民黨主席鄭麗文今天在北京會見中國領導人習近平。（路透）國安人士今天分析，「鄭習會」呈現幾項特點，包括把台灣抽出國際格局；強化「一中框架」；推進兩制方案；中共和戰兩手，以和平框架包裝統一進程，搭配軍事部署施壓；以仇日史觀試圖把台灣海峽「內海化」，把台灣議題「去國際化」。國安人士並說，「有點意外」是國民黨主席鄭麗文談話特別提到，台灣海峽不會成為外力介入的棋盤。但對台灣而言，所謂「外力介入」是指每天騷擾台灣的中國軍機軍艦、每天對台灣主權有圖謀的中國所採取的威權擴張的行為。該人士說，相對之下，台灣友盟主張自由航行、主張台海是國際水域，但國民黨為了「鄭習會」，往中國立場接近，令人感到比較憂心。請繼續往下閱讀...國安人士說，「鄭習會」後有三大觀察指標，首先，重點「不在說什麼？而在做什麼？」透過這場會見，北京是否傳達了對台灣人民的真正善意，關鍵在於從現在起，中國的軍機軍艦是否停止騷擾；北京對台灣的國際參與是否停止打壓；台灣不再有來自中國的滲透破壞，這才是真正的善意、和平的訊號。第二，「台灣是台灣人的台灣，是世界的台灣」。 國安人士說，台灣海峽不是民族主義的內海，而是繁榮世界的自由航道；台灣的未來，只有台灣人自己可以決定。台灣願意與全世界所有熱愛自由民主的國家並肩合作，共同致力於整體的和平、幸福與繁榮，而非為極權者的民族主義服務。第三，北京當局定義下的「九二共識」，就是「一個中國」、「一國兩制」。國安人士表示，台灣絕不接受「一國兩制」，台灣民意也堅決反對「一國兩制」，這就是台灣共識。作為民主國家，台灣的立場，就是民主的立場，而民主從來不是挑釁。國安人士也對中國喊話，提出「4個必須」。第一，中國必須正視中華民國台灣存在的事實，而不是否定台灣人民共同建立的民主國家體制；第二，必須尊重2300萬人民對自由民主的堅持，而不是以分化、利誘方式，介入台灣人民的選擇；第三，必須以和平對等方式處理雙方之間歧異，而不是用打壓、威嚇，企圖讓台灣人屈服。第四，必須是政府或政府所授權的公權力機構，坐下來談，任何沒有經過人民授權、監督的政治協商，都不能稱做是「民主協商」。    ,https://news.ltn.com.tw/news/politics/breakingnews/5400042
鄭習會落幕 葉耀元拋6問題：要不要說什麼是九二共識？,政治,2026/04/10 20:40,鄭麗文今與習近平會面。（美聯社）國民黨主席鄭麗文今日與中國領導人習近平在北京會面，習近平表示，無論國際、台海形勢如何變化，中華民族偉大復興的大趨勢不會改變，兩岸同胞走親、走近、走到一起的大潮流不會改變。對此，美國聖湯瑪斯大學國際研究講座教授葉耀元質疑習近平與鄭麗文各三個問題，直呼「講了老半天，你要不要說一下什麼是九二共識？」葉耀元今日於臉書粉專「葉教授的國際事務學院」發文表示，習近平說，兩岸同胞都是中國人、一家人。兩黨領導人今天見面，就是維護我們共同家園的和平安寧，推動兩岸關係和平發展，讓祖孫後代能夠在堅持「九二共識」、反對「台獨」的基礎上，加強交流對話。為民族謀復興，把兩岸關係的未來牢牢地掌握在中國人的手上。請繼續往下閱讀...他質疑習近平，一、台灣有超過六成的人不認為自己是中國人，所以哪來的兩岸同胞都是中國人的說法？二、兩岸關係本來就是和平的，是誰破壞了現存的和平，沒事就派軍機擾台或是做環島軍演？三、民族復興？你們好好的沒事要復興什麼？還有講了老半天，你要不要說一下什麼是九二共識？葉耀元指出，鄭麗文說，國共兩黨共同推動兩岸和平的制度化。在堅持九二共識、反對台獨的共同政治基礎上，兩岸應該進一步的籌畫與建構具制度性與可持續性的對話與合作機制，使兩岸的和平發展走向不可逆轉，從根本上消除所有的衝突誘因。希望台灣海峽將不再成為潛在衝突的焦點，更不會成為外力介入的棋盤。他質疑鄭麗文，一、什麼是兩岸和平的制度化？請問中共會同意在目前兩國主權獨立的狀態之下跟你談和平嗎？二、中華民國在台灣也是一種台獨，嚴格來說，對於中共而言，只要你不想要統一就是台獨。所以鄭麗文是要拋棄我國的主權嗎？三、外力介入的棋盤？目前唯一介入台海安全的是中共，而你現在的行為，就是去跟和平破壞者輸誠啊。    ,https://news.ltn.com.tw/news/politics/breakingnews/5399736
回應鄭習會 總統府：遺憾國民黨淪為讓台灣「被統一」的政治道具,政治,2026/04/10 20:40,"國民黨主席鄭麗文與中國國家主席習近平會面。（美聯社）國民黨主席鄭麗文今天（10）日與中國國家主席習近平會見，會中稱國民黨與共產黨具有「九二共識、反對台獨」等所謂「共同政治基礎」，並稱台灣海峽不為「外力」介入，共產中國的「中華民族偉大復興」是「兩岸人民的共同復興」等。總統府發言人郭雅慧說，這場「習鄭會」的本質，是中共領導人透過會見國民黨領導人，將台灣從世界舞台抽離，放入兩岸同屬一個中國的「一中框架」，鎖進共產中國「百年建國目標」（中華民族偉大復興）的政治議程裡。更明確的說，「習鄭會」所要凸顯的，就是「台灣屬於中華人民共和國一部分」，以及推進以「和平統一」為名、併吞台灣為實的「兩制台灣方案」。郭雅慧說，作為台灣主要政黨之一，國民黨在「習鄭會」中，未能堅持政黨主體性與國家立場，任由中國以所謂「兩岸同屬一個中國」為核心的「九二共識」，作為國共兩黨的「共同政治基礎」，將國際社會對台海和平的關注與支持，配合北京論調誣指為「外力介入」，淪為消滅中華民國、讓台灣「被統一」的出賣國家主權的政治道具，我們對這種失格、自我矮化的行為深表遺憾。請繼續往下閱讀...郭雅慧說，台灣是台灣人的台灣，是世界的台灣。台灣海峽不是民族主義的內海，而是繁榮世界的自由航道，台灣的未來，只有台灣人自己可以決定。台灣願意與全世界所有熱愛自由民主的國家並肩合作，共同致力於區域的和平、幸福與繁榮，不能也不會為極權者的民族主義服務。北京當局定義下的「九二共識」，就是「一個中國」、「一國兩制」。台灣絕不接受，台灣民意也堅決反對，今天這場被鎖進中國「統一」的政治議程及「一中」政治框架的政黨互動，絕不會影響我們對中華民國台灣主權地位的主張，也絕不會動搖我們對台灣前途必須由2,300萬台灣人民決定的堅持。    ",https://news.ltn.com.tw/news/politics/breakingnews/5400032
陳素月、黃柏瑜將成立聯合競總 「縣市合作」戰力極大化,政治,2026/04/10 20:14,民進黨彰化縣長參選人陳素月、彰化市長參選人黃柏瑜聯合競選，強調縣市同心。（黃柏瑜提供）年底選舉國民黨彰化縣長、彰化市長人選都敲不定，綠營則空前的大團結，彰化縣長參選人陳素月、彰化市長參選人黃柏瑜成立聯合競選總部，讓戰力極大化。陳素月說，她與黃柏瑜將成立聯合競選總部，人氣會旺上加旺，彰化縣民殷殷期待改變，能夠突破發展瓶頸，不要讓人口再流失，讓彰化縣有全新的產業，可以提更好的工作機會，留住青年在彰化工作，而彰化縣要大步向前走，人口最多的彰化市就是最重要的火車頭。請繼續往下閱讀...陳素月說，參選縣長就要讓全縣都能夠均衡的發展，更要與彰化市一起合作，這次她與黃柏瑜不只是看板「同框」，也將推出聯合競選總部，一起當選讓縣市合作一條心！黃柏瑜選舉看板主打「少年市長」，當他與陳素月「同框」競選看板還多了一句「縣市同心」。黃柏瑜說，這次是空前大團結，以往彰化縣長與彰化市長就算是同政黨，也可能因為選舉而心生芥蒂，但他與陳素月完全沒有這個問題，採取聯合作戰、聯合競選，只有「縣市同心」才是彰化市與彰化縣最大的福氣。黃柏瑜指出，彰化市人口是全彰化縣6分之1，是全縣的龍頭，只有彰化市的人口與經濟拉起來，彰化縣才有向前衝的最大本錢與動能，今年就是「縣市同心」的絕佳機會。    ,https://news.ltn.com.tw/news/politics/breakingnews/5399911
鄭麗文講稿與習近平「高度協同」 挨批如聯合聲明,政治,2026/04/10 20:03,國民黨主席鄭麗文今天在北京會見中國領導人習近平。（路透）國民黨主席鄭麗文今（10日）與中共總書記習近平在北京會面，雙方發表公開談話。交叉比對兩人講稿可發現，鄭麗文在核心論述與政治用詞上，與習近平呈現「高度協同」，兩人講稿結構與用詞走向更顯示，國民黨不僅緊扣「反台獨」、「九二共識」，更大量套用中共官方專屬詞彙，雙方講稿結構精確呼應，挨批如事先套好招的「聯合聲明」雙版本。檢視雙方講稿內容，鄭麗文在談話中主動且頻繁地使用中共官方的政治詞彙。例如，鄭麗文在會談中呼籲建構兩岸雙贏共榮的「命運共同體」，並多次提及「中華民族偉大復興」。這與習近平長期反覆強調的「中華民族偉大復興的大趨勢」、「命運共同體」如出一轍。請繼續往下閱讀...此外，鄭麗文更在講稿中，直接讚揚中共的內部施政成果，稱中國大陸在習領導下「實現了完全脫貧，建成全面小康社會」。在經濟發展框架上，鄭麗文也採用了中共的五年計畫語境，稱「十五五規劃剛剛開局，必將再上新台階」；這與習近平談話中定調「今年是大陸『十五五』開局之年」的說法完美契合，顯示國民黨在論述上，已大幅度向中共語彙靠攏。在政治價值與結構安排上，習鄭雙方講稿也展現出極高的呼應度。鄭麗文提出的「五點主張」與習近平的「四點意見」在主軸上高度重疊。鄭主張的「推動兩岸關係和平發展」及「謀求恢復兩岸協商機制」，對應了習近平的「以和平發展守護共同家園」及堅持「九二共識」前提；鄭呼籲的「持續發揮國共兩黨溝通平台功能」，則呼應了習的「團結奮鬥實現中華民族偉大復興」。在針對外部勢力與區域安全的論述上，鄭麗文強調台灣海峽「不會成為外力介入的棋盤」；習近平則明言「反對『台獨』分裂和外來干涉」，雙方皆將兩岸議題限縮在「同屬中華民族」、「中國人自己手中」的內部框架內，排斥國際社會的參與。儘管雙方在「民族認同」與「促統話語」上展現出驚人的默契，但國共講稿的差異也凸顯出赤裸裸的現實。鄭麗文在第四點主張中，特別訴求「在政治互信中增進台灣國際活動空間」，並具體點名希望重返「世界衛生大會（WHO）」與「國際民航組織（ICAO）」。然而，不管是習近平的現場談話與新華社發布的官方新聞稿，中共方面對此項訴求完全「已讀不回」，沒有給予任何對應的承諾或善意回應。習近平的談話僅單方面強調「台獨是破壞台海和平的罪魁禍首，我們決不姑息」，並將重點放在吸引台灣青年與農產品赴中。這顯示出，即便國民黨全面配合中共的話語體系與政治符號，要爭取實質國際空間讓步，最終仍只是「單向奔赴（中國用語，指單方面不對等的情感付出）」。不過，鄭麗文則在會後記者會轉述時宣稱，習近平對此的回應是特別正面的，除強調同源、民族，在這方面只要大家心靈契合，「什麼事情都是可以商量的」。對於她所提出的具體主張和期待，鄭麗文轉述習近平表示，種種件件都是可以全面的去積極的研究、配合、促成，他說會高度的重視，也會積極的考慮。鄭麗文說，「我認為習總書記是有非常清楚的傳達了非常正面的訊息，非常的在乎跟重視台灣這邊的期待跟需求」。國民黨主席鄭麗文講稿與中國共產黨總書記習近平高度協同，皆反對「外來介入」。（本報製圖）    ,https://news.ltn.com.tw/news/politics/breakingnews/5399987
民進黨台北市長參選人受關注 王世堅推薦名單曝光,政治,2026/04/10 19:39,民進黨立委王世堅今（10日）受訪談民進黨台北市長人選。（記者孫唯容攝）針對民進黨台北市長參選人議題，民進黨立委王世堅今（10日）受訪表示，按照諮詢順序，第一順位是鄭麗君（行政院副院長），第二順位理所當然是沈伯洋委員（立委）。媒體問及，是否認為民進黨秘書長徐國勇未將他自己放入名單內感到可惜？王世堅表示，「對，非常可惜」，他認為再來第三位人選應該是徐國勇，不過他個人推薦的順序，第一位是鄭麗君，第二位則是徐國勇。民進黨台北市長人選，外界聚焦行政院副院長鄭麗君、立委沈伯洋、范雲、壯闊台灣聯盟創辦人吳怡農。請繼續往下閱讀...針對近期民進黨北市市長佈局，王世堅表示，實務上或禮貌上，都應該等第一人選鄭麗君清楚表明意願後，再次來做其他人選的諮詢，不只是第一人選，未來在諮詢第二三四位順位時，也應等待每一位人選思慮清楚後，真的不願意再次諮詢下一位人選，這是起碼的禮貌，假設一次就講了好幾位，好像人人有希望，但各個沒把握，那請問到底要邀請誰？現在集合全民進黨的力量，來勸進鄭麗君，應該給鄭麗君一段時間，讓她可以充分考量後，正式給民進黨、給社會一個答覆。媒體追問，假設鄭麗君是第一順位，那會把自己跟沈伯洋排在第幾順位？王世堅趕忙說，「沒有我0順位、我0順位喔」，半年前有風聲時，當時他就很堅決否認，因為我在立院有很多任務、對自我的期許，對自己工作也很滿意，自認為是很稱職的立委，所以希望留在國會繼續奮戰。王世堅也表示，按照諮詢的順序，他覺得第一順位鄭麗君副院長，第二順位理所當然是沈伯洋委員。至於那會不會覺得徐國勇沒有把自己放在順位裡面，感到非常可惜？王世堅說，「對，非常可惜，他第一推薦鄭麗君、第二位則是徐國勇，再來還有莊瑞雄、高嘉瑜、吳思瑤」，他當時的順序是這樣推薦，現在情勢的發展似乎也是冥冥之中，按照當初講的順位在進行，也是非常好。王世堅也表示，徐國勇唯一的障礙就是他是民進黨秘書長，體制上來看，自己秘書長說自己說要參選也很怪，其實解決辦法很簡單，他只要辭掉秘書長，也是一位很好的人選。王世堅也細數，徐國勇擔任過北市議員、立委，過去在議員、立委都在北市，對北市很熟稔，還曾出任內政部長，在各項行政推動，可謂是瞭若指掌，隨時可以上位做事，他覺得假設如果沈伯洋委員也不願意，再來第三位人選應該是徐國勇秘書長。    ,https://news.ltn.com.tw/news/politics/breakingnews/5399974
中國「三無船」摸黑闖金門水域  海巡依法取締捍衛主權,政治,2026/04/10 19:31,中國「三無船」摸黑闖金門水域，金門海巡弟兄依法登檢取締，捍衛主權。（金門海巡隊提供）海巡署金馬澎分署第12巡防區今天在田埔西北方2.4浬，暗夜中對1艘中國「3無船（無船名、無船舶證書、無船籍港登記）」執行查察，該船雖一度拒檢，終在海巡依法登檢後就範，帶回船上2名中國籍船員、漁獲1批，無豬、牛肉等相關製品，全案將依違反兩岸人民關係條例行政處分，視情節罰款、遣返。海巡署金馬澎分署指出，第12（金門）巡防區凌晨0時許監偵到海面不明目標往岸際航行，隨即全程嚴密監控；金門海巡隊10073艇、CP-1022艇、CP-1051艇於田埔西北方2.4浬、禁止水域內0.6浬海域處，對1艘中國籍無船名漁船，依程序廣播並要求停船受檢，對方仍拒不配合，海巡隊員無畏兩船迫近引發的浪濤衝擊，以優勢警力登檢部署及扣留作業，2名船員被帶返隊部留置調查後，函報艦隊分署裁處。請繼續往下閱讀...金馬澎分署指出，越界作業的中國「3無船」，屬「無船名」、「無船舶證書」及「無船籍港登記」的非法船隻；「3無」船舶無從識別身分，船體結構及船員資格未經檢驗，存有航安疑慮，常因違規操作及蛇行拒檢，造成翻覆事故，引發海上執法危險及衝突；海巡署嚴格取締是類違法船舶，展現嚴正執法立場。海巡署強調，中國持續對我進行威脅與騷擾，從未間斷，海巡署24小時嚴密監控周邊海域動態，執行國安、治安及平安等任務，「這些實質的管轄行動就是國家主權的最佳體現」。海巡署表示，針對任何試圖挑戰我國管轄權或侵擾我國海域的行為，無論是灰帶活動或三無船舶，海巡署將持續站在國家的最前線，以實際執法行動堅定捍衛國家主權。中國「三無船」摸黑闖金門水域，金門海巡弟兄依法登檢查獲二名中國漁民。（金門海巡隊提供）中國「三無船」摸黑闖金門水域，金門海巡登檢取締，要求將漁獲海拋。（金門海巡隊提供）    ,https://news.ltn.com.tw/news/politics/breakingnews/5399912
柯文哲判決書公開！張育萌分析：把阿北「犯罪實錄」寫得一清二楚,政治,2026/04/10 19:17,"前台北市長柯文哲涉京華城、政治獻金等案，一審重判17年。（資料照）前台北市長柯文哲涉京華城、政治獻金等案，一審重判17年，391頁的完整判決書今天（10日）公開。對此，台灣青年世代共好協會理事長張育萌說，柯文哲是如何戴上「財團的魔戒」？法院用時序，把阿北的「犯罪實錄」寫得一清二楚。張育萌在臉書發文說，第一任的柯文哲，對「拿刀叉吃人肉」的財團深惡痛絕。2017年4月26日，柯文哲全程參與居住正義論壇，威京集團經理林青也在場。論壇上，柯文哲親口說「一放手100億就差100億」。閉幕致詞時，柯文哲說「京華城這案就回到法規」。6月6日，應曉薇質疑柯文哲說「給了560容積率就是圖利京華城」。柯文哲當時挺直腰桿，站在公務員這邊，堅持說「容積率後面有很多的錢，因為台北市房價很貴，公務員害怕會變圖利廠商」。請繼續往下閱讀...8月18日，沈慶京見到當時台北市的都發局長林洲民，沈慶京要求120,284.39平方公尺的樓地板面積，林洲民直接拒絕。4天後，林洲民告訴柯文哲，沈慶京見他的過程，並明確告訴柯文哲說，沈慶京的訴求根本沒有法源依據。隔年，2018年5月10日，柯文哲收到沈慶京的陳情書，親手批示「現在560已經通過，又要變成678％？」7月26日，內政部直接駁回京華城的訴願。張育萌指出，柯文哲連任後，彭振聲到公務員都還是使出洪荒之力，想擋下京華城案。2020年2月18日，應曉薇到當時副市長彭振聲的辦公室，要求「幫忙」、「放水」，又叫都發局長黃景茂，把樓地板面積回復的案子，送到都委會研議，彭振聲拒絕。張育萌續指，兩天後，2月20日，柯文哲單獨見了沈慶京大約一小時，從這開始，京華城案就在柯文哲的護航下，力排公務員的阻礙，一路放水硬闖過關。當天下午1點半，黃景茂就把「京華城案」排進隔天早上的晨會。為了隔天要開晨會，這天下午3點，就先開京華城案的「不公開」會前會。2月24日，都發局張姓公務員第一次簽呈，說明京華城案已經進入法律訴訟。黃景茂還沒確定柯文哲怎麼想，所以退回。公務員改了內容後，第二次上簽呈，再次被退。第三次提的簽呈，刪除「不同意提請都委會研議」就過了。3月10日，柯文哲批示「速審速決」。而3月10日這天，就是柯文哲和應曉薇的便當會，應曉薇提出的建議事項，主題就是「京華城容積爭議案」。3月24日到26日之間，沈慶京用七個人頭，把210萬元分七筆捐到民眾黨的政治獻金帳戶，朱亞虎用手機拍捐款的明細。4月1日，朱亞虎傳簡訊告訴李文宗和蔡壁如。4月15日，柯文哲親筆寫下那段經典的指示「TO：彭副，他們的結論是什麼？原則很簡單，公務員不坐牢，Ko」。張育萌提及，最扯的是，5月21日，應曉薇竟然利用「民意代表可以列席」都委會的規定，違法帶沈慶京出席都委會。主持都委會的彭振聲裁示，組成專案小組來討論京華城「恢復樓地板」面積的訴求。一個月後，6月20日，專案小組第一次開會，當時都委會的執行秘書邵琇珮，建議京華城用都是計畫申請都更容積獎勵。這是史上第一次，提出參考都更或現有容獎機制作為「補救方案」。張育萌分析，三天後，應曉薇在台北市議會開協調會，竟然直接找邵琇珮和京華城的董事長陳玉坤，一起討論《都市計畫法》的容積獎勵有哪些。7月16日，台北高等行政法院終於判決，判京華城敗訴。代表台北市府根本不用理京華城這些莫名其妙的訴求。10月12日，邵琇珮主持「專家學者諮詢會議」。超多代表直接在會議上就指出，京華城申請的容積獎勵，根本不適用《都更條例》。張育萌說，2021年4月21日，應曉薇又在便當會，跟柯文哲討論京華城的進度，柯文哲裁示都發局擔任 PM（專案負責人）辦理。到了7月，應曉薇直接把都委會執行秘書劉秀玲叫到辦公室罵。7月14日，應曉薇向市長室告狀，說「劉秀玲阻撓京華城案」。8月10日，再開便當會。應曉薇施壓，跟柯文哲討論都委會幕僚意見有問題，柯文哲改叫彭振聲當PM，加速京華城案送審議。8月17日，市府的都發局都市設計科用內部簽文，再次提醒京華城案獲利超過20億，對價性有問題。9月9日，彭振聲主持都委會，反對意見都不採納，通過京華城案。京華城取得最高20％的容積獎勵。張育萌提到，2022年2月7日，柯文哲再施壓產發局，在鼎越公司的陳情書上，親筆寫下「怎麼做都行，快就好」，就這樣，產發局同意了鼎越公司提出的條件。10月14日，威京集團發放「成功爭取容積」的獎金。簽呈明確寫著「經相關人員多方努力終獲台北市政府核定並於110年11月1日公告，原基礎容積560%、+20% 容積獎勵、+30% 容積移轉。」四天後，都發局核發建照給鼎越公司。2024年5月，京華城案終於爆發，全國輿論譁然，柯文哲傳LINE給彭振聲說：「既然是共識決就這樣解釋」。張育萌說，整個過程就是鐵證如山的「犯罪實錄」，看了讓人怵目驚心。沈慶京狂灑的賄款，除了分七個人給民眾黨的210萬之外，用中華工程公司「捐款」名義，給應曉薇的「華夏協會」帳戶，前後匯款600萬。又用威京集團的抬頭，給華夏協會在內的五個協會6張支票。兌現後高達4500萬。2022年，再用政治獻金或匯款給華夏協會，給應曉薇150萬。前後加起來，行賄金額是5250萬的鉅款。張育萌直指，這整段故事，在判決書裡只佔不到10頁。法官用盡畢生功力，把證據寫得一清二楚，時序擺在全台灣人眼前，就只是為了證明，阿北從來不是清清白白。黃國昌喊了一年多的「科幻小說」，如今判決擺在眼前。事實證明，阿北的「京華城實錄」根本不是科幻小說，而是紮紮實實的犯罪影集，如果登上大銀幕，肯定也是驚悚片。他呼籲，拜託小草們，不要再逃避現實。只要看完判決書，就會知道阿北早就踩著你們的信任，背叛理想，拿起刀叉，跟當初痛恨的財團，一起喝酒吃肉。「戴上財團魔戒的那一刻起，柯文哲早就不是『清清白白』」。    ",https://news.ltn.com.tw/news/politics/breakingnews/5399848
