Title,News_Type,date,content,url
台南男長照崩潰弒父 家屬求法官輕判,社會,2025/11/26 13:45,許姓男疑不堪長期照顧臥床父，以塑膠袋套頭弒父出庭認罪，胞姊和罕病女兒稱他一人扛照護，當庭求法官從輕量刑。（記者王捷攝）許姓男子今年過年前疑因不堪長期照顧臥病在床的老父，涉嫌以塑膠袋套住父親頭部，致父窒息身亡，被依殺害直系血親尊親屬罪起訴，為避免二度傷害，全案沒有在國民法官庭審理，台南地方法院今天程序庭，許男當庭認罪，胞姊與女兒出庭替他求情，希望法官從輕量刑。許姊供稱，這些年父母相繼臥病在床，主要都是弟弟在照顧。母親過世後，父親很快就無法行走，約在1、2年前臥床，其間曾因卡痰送急診，弟弟便學會抽痰，每2小時替父親換尿布、餵食，大小生活起居幾乎全由弟弟一人負擔，她只能抽空回家探視。請繼續往下閱讀...她說，過年前弟弟曾透露「自己很難過」，家人還來不及討論照顧安排，悲劇就發生。她向檢方表示，已以被害人家屬身分與弟弟無條件和解，只希望弟弟好好活下去。她強調弟弟從小與父母同住，對父母比她更用心，相信父親也不會希望弟弟再受打擊，她並不打算要求任何遺產，當庭拜託法官量刑時「能寬一點」。許男女兒則以輔佐人身分作證指出，自己罹患叢發性頭痛罕病，多數時間只能在家休養，家中照顧阿媽與阿公、處理家事幾乎全是父親在做。直到過年期間，父親身體愈來愈不舒服，還請她幫忙照顧阿公，她認為父親這幾年間一個人扛起照顧臥床雙親與家務，加上自己身心狀況欠佳，壓力早已瀕臨崩潰，也懇求法官盡量減輕父親刑度。本案目前仍由台南地院審理，法院將綜合被告認罪態度、長期照顧情形與家屬求情等因素，依殺害直系血親尊親屬相關規定決定刑度，全案尚待宣判。熱門賽事、球星動態不漏接    ,https://news.ltn.com.tw/news/society/breakingnews/5258604
開車迴轉失準害Gogoro掛彩！ 「扶正」快閃仍難逃「鏡頭君」,社會,2025/11/26 13:45,轎車迴轉時擦撞機車。（民眾提供）台中南區近日發生一起看似「輕微擦撞」的小事故，因肇事駕駛僅「扶正」Gogoro電動機車就快閃，最終仍難逃法規制裁，警方調閱監視器後迅速鎖定肇事者，71歲陳姓男子坦承誤撞，以為對方車損不大才離開，最終仍收到肇逃罰單，得不償失。台中市第三分局交通分隊警員張國峰，前天獲報前往南區高工路處理一起交通事故，報案的42歲許姓男子表示，當天早上將機車停放在公司附近路旁，下班準備騎車時卻察覺愛車有異樣。因平時對愛車呵護備至，一眼就發現右後車尾出現擦撞痕跡，懷疑遭人碰撞，遂向警方求助，希望能找出肇事者。請繼續往下閱讀...張員獲報後立即調閱周邊監視器，透過畫面顯示，一輛黑色轎車在迴轉時不慎撞上許男機車，駕駛隨後下車查看調整機車位置，卻未通報警方便逕自離去，警方循線迅速鎖定肇事車輛，通知71歲陳姓男子到案說明。陳男表示，當時到附近拜訪友人，迴轉時因距離未抓準才不慎撞到他車，因下車查看時誤以為對方車損不大，才將機車扶正後離開，對於未報警處理深感抱歉，承諾負起後續賠償責任。警方提醒，依據道路交通管理處罰條例第62條規定：「汽車駕駛人駕駛汽車肇事，無人受傷或死亡而未依規定處置者，處1千元以上3千元以下罰鍰；逃逸者，並吊扣其駕駛執照1個月至3個月。」民眾若不慎發生交通事故時，請務必留在現場並撥打110報警處理，避免因逃逸行為而面臨更嚴重的法律後果。陳男下車扶正機車後快閃。（民眾提供）陳男轎車車頭擦痕成鐵證。（民眾提供）熱門賽事、球星動態不漏接    ,https://news.ltn.com.tw/news/society/breakingnews/5258606
獨家》「Abc牙醫聯盟」謝尚廷兄弟等遭起訴 簡單回應5個字,社會,2025/11/26 13:34,Abc牙醫聯盟創辦人謝尚廷兄妹3人涉洗錢、詐欺罪被起訴。（記者許麗娟攝）首次上稿12:51更新時間13:34（新增Abc牙醫聯盟回應）高雄知名連鎖牙醫診所「Abc牙醫聯盟」創辦人謝尚廷及哥哥董事長謝尚人、妹妹謝素芬涉嫌逃漏稅及隱匿資產，今（26）日被高雄地檢署依洗錢、詐欺等罪起訴，記者致電謝尚人、謝尚廷兄弟，但都僅簡單回應「不清楚狀況」。請繼續往下閱讀...Abc牙醫聯盟先前才因涉詐領健保5700多萬元案，創辦人謝尚廷等25人雖獲緩起訴處分，但雄檢進一步追查，發現Abc牙醫聯盟旗下12間牙醫診所，從2016年至2023年間至少海撈29億元，卻以醫師現金領薪、少開自費收據、偽造合夥人分紅及收入隱匿、低報等，替聯盟全體醫師逃漏總額達9億1668萬餘元的個人綜合所得稅，其中謝尚廷、謝尚人逃漏稅額度就高達5億3622萬餘元。檢調發現，謝家3兄妹為了隱匿資產，以多筆小額現金存入兄弟兩人老婆名下帳戶，更以子女名義以交叉持股方式成立7家人頭公司後，再將多筆小額現金存入人頭公司帳戶購買基金、外匯等流動資產，以及購置不動產回租予聯盟旗下診所營業使用。對於涉嫌洗錢、詐欺遭起訴，謝家兄妹於檢警調查中皆否認犯案，雄檢今偵結後，依洗錢、詐欺等罪起訴謝家3兄妹和23位牙醫師、員工，記者致電謝尚人、謝尚廷兄弟，兩人都不願對案情多說，口徑一致皆僅回應「不清楚狀況」。稍早Abc牙醫聯盟發聲明回應，因目前尚未接獲正式起訴書，等接到起訴書之後，會與律師商議，爭取應有的權利。感謝社會各界關心，目前靜待判決結果，聯盟將不再對外發言。熱門賽事、球星動態不漏接    ,https://news.ltn.com.tw/news/society/breakingnews/5258549
噁心！ 超商男店員偷拆包裹 拿顧客胸罩「打手槍」還自拍遭起訴,社會,2025/11/26 13:31,起訴書指出，全家男店員深夜偷拆包裹、以女客胸罩自慰還拍片留存，事後將胸罩洗乾淨塞回原包裝。示意圖。（資料照）台北市士林區某全家便利商店一名李姓男店員，遭控趁深夜獨自值班時，擅自拆開顧客的網購包裹，取出其中的女性隱形胸罩進行自慰並射精，事後再將胸罩清洗後放回包裝，還拍攝整個過程、蒐集被害人個資，另創建IG群組保存相關影像。士林地檢署近期偵結，認定他犯行明確，依違反個人資料保護法將其起訴。起訴書指出，案發於去年11月25日凌晨4時許，李男發現店內一件待領包裹外袋開口較大、未完全密封，從縫隙看見內容物為女用隱形胸罩後，便擅自拆開包裹並將胸罩取出。隨後，李男將胸罩包覆於自身下體，進行上下抽動的自慰行為，並將精液射在胸罩上，造成物品污損無法使用，再他以手機拍攝整個行為過程。請繼續往下閱讀...為掩飾犯行，李男又將胸罩清洗、晾乾後，放回原塑膠套中，再透過包裝袋的破口將其塞回，使外觀不易察覺異狀。此外，李男還以手機拍攝包裹外貼的姓名與資料，自行建立名為「A女的祕密」的IG群組，將影像存放於手機內，藉此蒐集並保存被害人個資。案經A女報警後，警方調查時在李男手機內查獲多段影片，包括他以黑色蕾絲、卡其色且含鋼圈的胸罩包覆下體自慰的畫面。偵訊時，李男辯稱，包裹為塑膠袋材質、開口原本就較大，他從縫隙看見內容物後才取出。士林地檢署偵查後認為，李男行為已明確侵害被害人個資並涉不法，依違反個資法提起公訴。熱門賽事、球星動態不漏接    ,https://news.ltn.com.tw/news/society/breakingnews/5258594
債務協商變衝突！台中少年囂張嗆警「你辦我啊」慘了,社會,2025/11/26 13:16,王姓少年一方囂張嗆警。（擷自「社會事新聞影音」）台中市南區一間超商前今天凌晨傳出聚眾衝突！警方接獲報案，指稱街頭有人大聲叫囂推擠，火速到場後，發現竟是因債務協商引爆的對峙事件，由於現場涉及多人到場助陣，警方認定行為已觸及違法，全案依聚眾鬥毆及妨害自由等罪嫌究辦。經查，事發於今天凌晨3點多，地點在南區南和路某超商前，18歲李姓男子與友人張男（18歲）、游男（19歲）稱與16歲王姓少年間有17萬元投資債務糾紛，因此雙方約在超商前「談清楚」，然而王姓少年不但未單獨到場，還找了31歲林男及26歲楊男同行助陣，原本應是協商的會面，卻因情緒激動發生口角。請繼續往下閱讀...據了解，雙方對峙時氣氛緊繃，其中張男還遭對方揮拳擊中臉部，其餘人雖未受傷，但現場一度吵得路人不敢靠近，轄區警方獲報後第一時間趕抵，但王姓少年與同行林男、楊男已趁亂離開，更令人傻眼的是，王姓少年一方在被警方攔查時竟仍不耐嗆聲：「你辦我啊！」「莫名其妙，出來買個菸也被查！」態度相當囂張。警方隨後將李男等3人帶回釐清事件原委，目前王姓少年已到案說明，林男與楊男仍在查緝中，警方表示，雖然現場沒有演變成互毆，但少年一方明顯揪人助陣，且行為方式足以造成對方心生畏懼，已符合聚眾鬥毆與妨害自由相關要件，因此依法偵辦。第三分局強調，任何形式揪人助陣、聚眾鬥毆均屬違法，民眾遇任何糾紛都應循正當管道解決，切勿暴力相向；任何違法案件警方必將嚴正執法，請民眾切勿以身試法。熱門賽事、球星動態不漏接    ,https://news.ltn.com.tw/news/society/breakingnews/5258564
飯店老闆積欠8百萬元裝潢費不還 連月遭5惡煞撒冥紙、丟雞蛋,社會,2025/11/26 13:00,大同區某飯店被撒冥紙。（記者王冠仁翻攝）台北市大同區某知名飯店先前進行全面整修裝潢，仍有800多萬元的相關費用沒付給設計公司，儘管飯店老闆說會還，事後卻沒依約還款，還將飯店轉手給前妻經營，雙方鬧得不歡而散。不過，從今年8月起，潘姓男子等5人，經常性前往飯店外撒冥紙、丟雞蛋，還拿大聲公大吼「欠債還錢」；警方近期循線逮人，儘管潘等人沒交代是受誰指使，警方正深入追查幕後主謀。北市警大同分局從今年8月起，就陸續接獲某飯店報案，飯店人員聲稱，每個禮拜都會有2至5個人，拿著大聲公跑到飯店外大喊「欠債還錢」、張貼恐嚇字條，甚至還會朝飯店丟雞蛋、撒冥紙。儘管飯店人員上前勸阻，但對方依然故我，甚至在10月間還跑到飯店的其他分店鬧事，讓店家生意一落千丈。請繼續往下閱讀...警方深入追查，這才發現原來大同區這家飯店先前進行全面裝潢整修，但仍積欠設計公司800多萬元款項。雙方為了這筆錢，曾經透過法院調解，當時飯店老闆表明會負責還款，沒想到事後根本沒還錢，還把飯店轉手給前妻經營，雙方結下樑子。警方根據前來鬧事者的來去向動線，掌握他們分別是潘姓、賴姓、李姓、周姓男子與陳姓女子，他們從今年8月19日起，就開始到大同區這家飯店外鬧事，大約每週都會前來，每次2至5人不等。他們雖然沒有做出攻擊行為，但撒冥紙、丟雞蛋還拿大聲公大吼大叫，讓店家不堪其擾。警方蒐證完備後，近期兵分多路前往潘等5人的住處逮人，但是他們落網後並沒有透露是被誰指使，對相關案情也避重就輕、不願交代。警方最後將他們分別依恐嚇取財、組織犯罪等罪嫌送辦，同時也正深入追查幕後主嫌。大同區某飯店被撒冥紙。（記者王冠仁翻攝）大同區某飯店被丟雞蛋。（記者王冠仁翻攝）熱門賽事、球星動態不漏接    ,https://news.ltn.com.tw/news/society/breakingnews/5258553
「績效獎金」年年發！台水公司員工爭列入退休金！法院判決曝光,社會,2025/11/26 12:59,台水公司年年發績效獎金，有退休員工認為應列入年終獎金。（資料照）績效獎金屬於「勞務報酬」嗎？台灣自來水公司第11區營業處有4名退休員工，因不滿公司未將「績效獎金」計入退休金平均工資，他們認為，公司收入穩定，每年都付給員工2個月的績效獎金，這屬於經常性的發放，理應列入員工退休金，4人請求給付2.26個月退休金差額，要求補償40萬至75萬的退休金，但法院審理後認定，績效獎金屬恩惠性、勉勵性給與，不具勞務對價性及經常性，判決原告敗訴，全額駁回其請求。依據判決書內容，該4名員工原任職於台灣自來水公司第十一區管理處，皆於2019年間退休，並適用《勞動基準法》「舊制」退休金制度。原告主張，公司2019年度發放的績效獎金（2.26個月薪個月月薪）應計入退休金平均工資，但公司未將其納入計算，應該補償陳姓股長、賴姓股長、李姓及陳姓營業士，65萬、75萬、40萬及48萬元之退休金。請繼續往下閱讀...原告主張，績效獎金依《經濟部所屬事業經營績效獎金實施要點》發放，其計算基礎來自「員工貢獻」的盈餘，具勞務對價性，且公司長期穩定發放，已屬經常性給與，應視為工資一部分。四人依《勞基法》及《退撫辦法》規定，請求公司補發差額及法定利息。台灣自來水公司抗辯指出，劉、賴為派用人員，兼具公務員身分，應適用《退撫辦法》計算退休金。績效獎金屬「恩惠性給予」，非固定或經常性給與，亦不具勞務對價性，不應納入平均工資。退休金計算係依經濟部函頒的「給與項目表」辦理，該表未列入績效獎金。法院審理，依《勞基法》第2條及第29條規定，指出工資須具「勞務對價性」與「給與經常性」，而績效獎金發放取決於公司年度盈餘，且須經外部審議，非必然發放，性質與年終獎金、紅利相近，屬勉勵性給與。法院認為，績效獎金發放與否繫於公司年度盈餘，且受政策因素、經營環境等影響，非員工提供勞務即必然獲得，故不具對價性。儘管台水公司近年均發放績效獎金，但此係因經營績效穩定，不代表其已成為固定給與。儘管原告以最高法院判決及學者意見，主張績效獎金應屬工資，但法院認為個案背景與本件不同，且學者意見無拘束力，不予採納。熱門賽事、球星動態不漏接    ,https://news.ltn.com.tw/news/society/breakingnews/5258516
金山磺港轎車凌晨墜海 女駕駛疑不熟路況且視線不良喪命,社會,2025/11/26 12:59,台北市1名陳姓女子24日凌晨駕車前往金山區訪友途中，失控駛入新北市金山區磺港漁港，新北市消防局、海巡人員將她從駕駛座內救出時已無生命跡象。（記者林嘉東翻攝）台北市1名陳姓女子24日凌晨駕車前往金山區訪友途中，疑不熟悉路況，加上夜間視線不良，失控駛入新北市金山區磺港漁港；經新北市消防局、海巡人員將她從駕駛座內救出時已無生命跡象，送醫不治。基隆地檢署相驗後認定為一起意外事故，已將遺體發交家屬處理後事。新北市消防局24日凌晨3時許獲報，金山區磺港漁港有一起轎車墜海意外，消防隊、海巡人員花了1個半小時，把女駕駛從駕駛座上救出時，駕駛已無心跳呼吸；經送醫急救後仍不治。請繼續往下閱讀...警方獲報查出，死者為住在台北市的60多歲陳姓女子，事故前才剛動完眼部手術，加上監視器拍到陳女駕車墜海前，一度緊急煞車，但因煞停距離太短，最終仍墜海，研判應是不熟悉路況，加上夜間視力不佳，才會釀成事故。警方昨天報請檢察官會同法醫相驗後，檢察官認定為一起單純的意外事故，家屬也對陳女的死因無意見，因此在相驗後，已將陳女的遺體發交家屬處理後事。台北市1名陳姓女子24日凌晨駕車前往金山區訪友途中，失控駛入新北市金山區磺港漁港，拖吊車將陳女轎車吊上岸。（記者林嘉東翻攝）熱門賽事、球星動態不漏接    ,https://news.ltn.com.tw/news/society/breakingnews/5258540
網黃闖好市多掀衣露胸「把自己賣掉」  前鎮分局要查了,社會,2025/11/26 12:51,知名網黃在好市多黑色星期五購物週活動，於賣場區掀開上衣露胸拍照。（取自X，民眾提供）知名賣場好市多（Costco）「黑色星期五購物週」（Black Friday）24日開跑，卻傳出在X（推特）有高人氣網黃，在高雄某店寵物食品區掀開上衣裸露胸部，並將照片張貼在X，寫下「黑五逛完兩圈以後發現錢不太夠，所以決定把自己賣掉。」前鎮分局表示，目前未接獲報案，將主動調閱監視器查察。好市多「黑色星期五購物週」活動展開後，購物人潮洶湧，該名網黃竟然躲在商品區中，掀上衣裸露並由他人拍照，粉絲留言「哪裡還搶購的到？」、「提錯貨單在哪里？」。該篇貼文引發熱議，不過已經於今（26）日下架。請繼續往下閱讀...前鎮分局表示，尚未接獲報案，將主動調閱相關影像畫面，追查照片拍攝者到案，以釐清事發經過、還原事實，如有網路貼文所述行為，恐涉及妨害風化罪，將依法調查後移請高雄地方檢察署偵辦。前鎮分局呼籲，依據刑法妨害風化罪規定「意圖供人觀覽，公然為猥褻之行為者，處一年以下有期徒刑、拘役或九千元以下罰金。」，意圖營利而犯罪得加重，提醒民眾切勿在公共場所作出違反善良風俗的行為，以免觸法，另民眾如發現相關影片切勿轉傳以免觸法。好市多回應，供會員高品質的商品、服務與良好的消費環境，是好市多一貫的宗旨，針對該不當行為，賣場將禁止其再次進入賣場。好市多強調，若相關行為經查屬實，將移請警方偵辦，以維護其他會員不受違法干擾的權益。也藉此呼籲會員共同維護良好的消費環境，賣場將全力配合相關主管機關後續調查與處理。有「台灣臀后」之稱的吳姓女子，今年9月在高雄總圖拍攝成人影片，遭前鎮分局依公然猥褻罪嫌移送高雄地檢署偵辦。「網黃」大膽鑽貨架裸胸 好市多：將報警偵辦 禁止再次入場熱門賽事、球星動態不漏接    ,https://news.ltn.com.tw/news/society/breakingnews/5258528
台灣人在中國殺台灣人 中國坐完牢回台灣得再坐一次牢,社會,2025/11/26 12:48,趙姓台灣籍男子在中國殺害林姓台籍男子，在中國服完刑後回台再被高雄地檢署起訴。示意圖（資料照）趙姓男子在中國與同為台灣籍的林姓男子發生糾紛，雙方衝突過程中，趙男拿水果刀失手殺了林男，趙在中國被公安逮捕，並服完刑後，回台再被檢方起訴，並向法院聲請返還15萬元的犯罪被害人遺屬補償金獲准。判決指出，2017年1月18日下午3點多，趙、林兩人因幫人以台幣兌換人民幣，但交易沒有完成，林欠29萬元沒有還給趙男，趙向林男要錢時，雙方發生肢體衝突，林拿高壓鍋砸趙，趙反擊時拿了一把水果刀刺入林男的胸部，林送醫急救後仍宣告不治。請繼續往下閱讀...趙男行凶後在中國被公安逮捕，入獄服刑後返台，再被高雄地檢署依殺人罪再起訴一次，目前全案仍在高雄地方法院審理中，法官擔心他落跑回中國，也祭出限制出境、出海8個月的禁令。由於林男過世後，高雄犯保協會拿了15萬元給林家人作為犯罪被害人遺屬補償金，趙男回台後，雄檢聲請要求趙男返還這筆錢；高雄地方法院鳳山簡易庭審理時，趙男說，之前在中國服刑時，已賠償林家人20萬元人民幣，且林男欠他的29萬元也還沒還，不認為自己該賠這筆錢；但法官認為，當時趙男賠20萬元人民幣是給林母，而此次15萬元補償金是發給林父，因此認定雄檢聲請有理，判趙男應返還這筆費用。熱門賽事、球星動態不漏接    ,https://news.ltn.com.tw/news/society/breakingnews/5258511
超狠！新生男嬰被推落墜樓全身骨折不治 台中狠母被起訴,社會,2025/11/26 12:44,台中一名夏姓女子，去年11月在住處房間產下男嬰，竟因和男嬰生父爭吵，將剛出生的兒子從11樓推落，當場全身骨折不治，台中地檢署今天依殺人罪起訴。（記者陳建志攝）台中一名夏姓女子（23歲），去年11月28日凌晨3點多，在房間產下一名足月男嬰，因和男嬰的生父爭吵，一氣之下竟將剛出生，有呼吸、生命跡象的兒子，以毛毯包裹放置在11樓房間窗框，再將男嬰向外推落，墜落社區花圃，雖緊急送醫仍因全身多處骨折出血死亡，警方一度以為是意外，不過醫院通報社會局後深入追查，才揪出是生母狠心殺兒的案件，台中地檢署偵辦後，今天依殺人罪將夏女起訴。台中太平新吉路一處社區，去年11月28日凌晨3點多，有一名剛出生的男嬰，被發現墜落社區花圃，男嬰媽媽的乾爸、乾媽發現，趕緊將男嬰送醫急救，但送醫後發現全身多處骨折出血、臟器損傷死亡，原以為是單純意外，不過醫護人員認為傷勢不單純通報市府社會局，經深入追查才發現竟是一樁狠心的生母殺兒案。請繼續往下閱讀...檢警調查，夏女和莊姓男子交往，先在2023年9月生下長女，兩人後來在2024年3月分手，不過當時夏女已經懷有身孕，並在去年11月28日凌晨3點多，在太平區住處11樓的房間內，順利產下足月的男嬰，不料卻和夏男爭吵，一氣之下，以毛毯包裹有生命跡象的男嬰，先放置在11樓房間窗框，再將男嬰向外推落，墜落社區花圃不治。台中地檢署偵辦後，今天依家庭暴力之殺人罪起訴。熱門賽事、球星動態不漏接    ,https://news.ltn.com.tw/news/society/breakingnews/5258535
14歲國中生欠地下錢莊3萬被逼債 疑遭在電線桿貼「借錢獎狀」,社會,2025/11/26 12:42,14國中生向地下錢莊借錢，被公開貼「借錢獎狀」，成為網友的打卡點。（民眾提供）南彰化一名年僅14歲的國中生（化名小明），今年暑假疑似向地下鐵莊借貸3萬元未還，對方近來開始追債，逼得該名「脆」上公開求助，此事造成校園大轟動，還有人為該名學生製作「借錢獎狀」、「還錢獎狀」，張貼在街頭電線桿及反光鏡上，成為熱門的打卡點，此案警方已介入調查中。此事因小明上週六在「脆」上PO出自己被人逼債的訊息，他自爆自己被地下錢莊逼債，不知怎麼辦！畫面上他秀出向地下錢莊借款3萬元、年利率10%借據和本票。請繼續往下閱讀...14歲國中生向地下錢莊借錢，被人轉PO到網路，此事件鬧得沸沸揚揚，學校附近更有多枝電線桿張貼「借錢獎狀」、「還錢獎狀」，表面看似在表揚小明，實則在給小朋還錢的心理壓力，警方介入調查，此舉嚴重觸犯《個人資訊保護法》，也不排除是地下錢莊所為。這些非常具有針對性的獎狀被張貼在學校週邊，最多曾達上百張，但很快就被人撕掉，此事在網路哄傳後，僅存的「借錢獎狀」、「還錢獎狀」一度還成為熱門的打卡點。14歲的未成年人為何能簽下如此高額的借貸文件？校方表示，小明是名中輟生，經常不到校上課，個性好動，生活作息不正常，已多次與家長討論其狀況，日前透過網路訊息得知借貸事件後，立即啟動關懷機制，確認學生安全無虞，並同步通知家長共同處理。校方說明，家長已知悉孩子借錢情形，並已與對方聯繫，承諾將協助處理後續事宜。同時於週一朝會時安排法治教育宣導，強化學生正確金錢觀念，這也是校內首次遇到類似個案。警方表示，3萬元本票與10%高利率，調查是否涉及《刑法》第344條重利罪；其次，查辦張貼個資海報的違法行為，另外將與校安系統合作，釐清是否有不法組織介入校園或涉及賭博等情事。熱門賽事、球星動態不漏接    ,https://news.ltn.com.tw/news/society/breakingnews/5258500
