Title,News_Type,date,content,url
新北市議員江怡臻才宣布不選連任 出任李四川競選辦公室主任,政治,2026/06/15 10:09,議員江怡臻才宣布不選連任，出任李四川競選辦公室主任。（李四川競辦提供）國民黨新北市長參選人李四川15日宣布，新北市議員江怡臻將出任競選辦公室主任，實際由青壯世代擔綱競辦操盤手，主掌選舉事務，另由吳亮賢、陳欣怡和郭音蘭3名出身不同領域、與新北有深厚連結的青年擔任競辦發言人，李四川表示，從第一線基層人員一路走來40年，深知建設的推進、城市的發展，需要經驗傳承與人才培養，將凝聚跨世代及多元族群的想法與力量，以年輕夥伴的創意與活力作為團隊的動能，全力為新北市打拚。李競辦指出，江怡臻畢業於台大哲學系，擁有台大哲學系碩士、美國康乃爾大學公共事務學院行政碩士及香港科技大學經濟學碩士等「三碩士」學位，具備人文、公共事務與經濟產業等跨領域專長；江怡臻曾擔任總統府諮議、新北市市長秘書、新北市政府副發言人，2018年當選新北市土城、樹林、三峽、鶯歌區議員並連任至今，擁有地方到中央的豐富歷練，從行政體系到民意代表，表現皆相當傑出，獲得民眾高度肯定。請繼續往下閱讀...李競辦表示，江怡臻日前宣布不參選議員連任，並非退出公共事務領域，而是希望以不同形式繼續為市民服務，在李四川積極延攬下，今日宣布江怡臻擔任競選辦公室主任，以青壯世代作為選戰團隊的領頭羊，這不僅是縣市長選戰中的少見創舉，團隊成員也多為「7年級」、「8年級」的年輕夥伴，象徵李四川對於青年族群的高度肯定與重視。李四川同時宣布發言人名單，吳亮賢為土生土長新北在地青年，政治大學中文系畢業、就讀台大政治系碩士在職專班，具合格教師證，曾為中學教師，後投身媒體工作及公共事務領域，歷任有線電視、報社記者，並曾任新北市新聞局、城鄉局機要，先前為新北市長侯友宜競辦發言人、立委黃建賓國會辦公室主任。陳欣怡畢業於輔仁大學新聞系，曾任電視台記者、主播，主跑新北市新聞，後轉戰民間企業，擔任上市集團公關與執行長特助，熱愛戶外活動的她，經常透過短影音分享衝浪潛水、生活旅遊等片段，社群平台擁有數萬名追蹤者，具備跨領域的媒體事務與公關行銷經驗。郭音蘭畢業於世新大學法律系，目前就讀台北大學公共行政研究所碩士班，歷任新北市教育局、立委國會辦公室、台北市政府副發言人及台北市副市長室主任研究員、2025 年雙北世界壯年運動會發言人，深耕雙北多年，具備多元公共事務領域與政策推廣經驗。李四川競選辦公室發言人左起依序為陳欣怡、吳亮賢、郭音蘭。（李四川競辦提供）    ,https://news.ltn.com.tw/news/politics/breakingnews/5472401
國民黨曹爾元臉書宣布參選連江縣長 挑戰現任王忠銘,政治,2026/06/15 10:09,2026連江縣長選舉腳步逼近，曾向國民黨中央報准參選，角逐2022連江縣長的曹爾元，在臉書宣布參選2026連江縣長選舉。（翻攝自曹爾元臉書）2022年向國民黨中央報准參選連江縣長的曹爾元，今天（15日）在臉書宣布參選2026連江縣長選舉。他以「響應群眾，點起火光，為馬祖再衝一次」！曹爾元說，他深知這場選戰不只是個人之戰，而是所有渴望改變的鄉親，共同集結的改革之戰！2022年連江縣長選舉，民進黨提名李問參選，獲得586票，國民黨提名王忠銘4337票，曹爾元獲得3582票；由王忠銘勝出。請繼續往下閱讀...連江縣長王忠銘11日表示，他有意爭取連任，但優先尊重中國國民黨中央決定。王忠銘指出，他已獲國民黨連江縣黨部推薦，但中央黨部仍未宣布徵召人選，他不便早於黨中央發言，預計7月確定獲徵召後，再向鄉親說明。曹爾元今天在社群媒體臉書貼文指出，4年前，他高喊「創新改變，馬祖共好」，承蒙4成多的鄉親攜手相挺。一張票，一世情，是鄉親對馬祖興革的深切期待，是對爾元的鞭策，爾元始終銘記於心，片刻未忘！4年過去了，馬祖有變好了嗎？答案在大家眼中。4年前，因為誤選了領導人，造成地區諸多建設不僅停滯，更陷入亂象。因為誤選了領導人，馬祖的前途被蹉跎、被耽擱！鄉親不停地呼喚：唯有改革求變，才能開創新局。他深知這場選戰不只是個人之戰，而是所有渴望改變的鄉親，共同集結的改革之戰！曹爾元說，他今天鄭重宣布：再次參選連江縣縣長，讓權力回歸人民，讓施政回應民意，讓資源公平共享，讓成果歸屬全體縣民。    ,https://news.ltn.com.tw/news/politics/breakingnews/5472403
對2026、2028信心滿滿 鄭麗文：公平的競賽民進黨沒得比,政治,2026/06/15 10:08,國民黨主席鄭麗文。（資料照）國民黨主席鄭麗文今日於洛杉磯美西華人學會發表「美中台和平繁榮之旅」專題演講，於問答環節階段被問到「2026、2028如何帶領國民黨走出困境，爭取青年支持、推動藍白合，贏得選舉的具體規劃？」鄭麗文表示，雖然挑戰很巨大，2026、2028的選舉她還是信心滿滿，最主要的挑戰還是來自於民進黨的無所不用其極，因為如果是公平的競賽民進黨沒得比，所以他們只能用奧步、不公平的遊戲規則，「麗文在這邊不是抱怨，而是我們早就做好萬全的心理準備，絕對不能讓民進黨得逞」。鄭麗文指出，藍白合到目前為止，事實上還算是非常順利，立法院並不是每一個議題立場都一樣的，選舉上的提名各種複雜的合作，可以很負責任的向大家報告，上任以來與民眾黨間的溝通沒有任何障礙，大家有最重要的共識，2028年必須政黨輪替。請繼續往下閱讀...鄭麗文表示，台灣內部民主被破壞得非常嚴重，在野黨也面對民進黨用國家機器將我們團滅的重大壓力，民眾黨也面臨各種詆毀，包括對民眾黨前主席柯文哲的司法迫害，事實上民眾黨也有非常徹底的覺悟，過程中不能說簡單，但是有共同的目標，藍白合作到目前為止還是非常順利，跟大家擔心的2024年之前發生的情況，是完全不可同日而語，這部分在野的團結大家有最大的共識。鄭麗文表示，年輕選票也是很多人問起的，因為2019年香港反送中事件，讓本來已經在政治上幾乎被判死刑的前總統蔡英文面對賴清德的重大挑戰，一夕之間由黑翻紅、鹹魚翻身，2020年大選蔡英文獲得壓倒性的勝利，絕大多數是因為年輕選票的支持，但是短短4年的倒行逆施破壞她所有的承諾，讓約300萬的年輕選票對民進黨可以說是深惡痛絕，這是為什麼後來賴清德選票只剩下500萬的原因。鄭麗文指出，跑掉的多數選票是跑到民眾黨那邊，而不是國民黨，這也是事實，但是民進黨希望透過對柯文哲的迫害，讓這一些流失的年輕選票回籠到民進黨的企圖心，是完全徹底的失敗。去年大罷免他們以為可以把選輸的國會扳回一城，但是徹底失敗，因為他們過度打反中牌，各種行徑只是引起選民的深度反感，中間、年輕選民都出來投票。鄭麗文說，接下來要更直接毫無保留的與年輕選民溝通，用他們的語言，讓他們了解國民黨的主張、立場，跟他們對話讓他們覺得國民黨可以代表年輕選民對於台灣未來的期待。事實上多數年輕選民並不是大家看到的民進黨網軍、青鳥，那種歇斯底里、意識形態掛帥，台灣的年輕人絕對不是這樣，我們對台灣的年輕人還是深具信心，他們有熱情、也能明辨是非，給他們時間會越來越能知道，什麼樣的選擇才是對台灣未來的發展是正確的。「雖然挑戰很巨大，大家都很關心，到目前為止，2026、2028的選舉我還是信心滿滿。」鄭麗文表示，最主要的挑戰還是來自於民進黨的無所不用其極，國家機器不能用的都用了，司法、檢調、媒體、行政部門，沒有他們不敢做的，很多要參選的縣市長，都面臨民進黨無理的司法干擾，企圖剝奪他們的參選資格，因為如果是公平的競賽民進黨沒得比，所以他們只能用奧步、不公平的遊戲規則，「麗文在這邊不是抱怨，而是我們早就做好萬全的心理準備，絕對不能讓民進黨得逞」。    ,https://news.ltn.com.tw/news/politics/breakingnews/5472387
演講遇民眾抗議賣台 鄭麗文：沒有賣台 還真真實實的保台,政治,2026/06/15 10:02,國民黨主席鄭麗文。（圖由國民黨提供）國民黨主席鄭麗文今日於洛杉磯美西華人學會發表「美中台和平繁榮之旅」專題演講，當鄭麗文講到，「台灣之所以能順利民主化，是因為國民黨人普遍是真正相信民主的，所以不會阻撓民主化的進程」。突然有民眾在台下高聲抗議賣台，隨即被工作人員拖走。鄭麗文說，事實證明我們不但沒有賣台，還真真實實的保台，「真的不用這麼激動，慢慢走」。鄭麗文強調，不要用偏見、恐懼，讓大家沒有辦法心平氣和、理性的思考兩岸問題。鄭麗文表示，她雖然是一個理想主義者，但絕不是空想主義者。台灣現在擁有的一切，不會因為兩岸和平而犧牲，只會因為兩岸和平而壯大，這樣才能走得更強、更遠。請繼續往下閱讀...鄭麗文說，理想是務實地一步步往前走，結合更多支持的力量，反映兩岸人民共同的心願，甚至於是全球華人、全世界人類共同的心願，如果符合每一個國家的利益，那為什麼不能成功，她想不到一個不能成功的理由。提到課綱議題，鄭麗文表示，在國民黨執政後，一定要做全面的檢討與修改，去中國化是刻意的政治操作與干擾，台灣非常明顯是一個華人社會，血緣、文化、民族、歷史傳承，甚至很多人說「台灣的社會比大陸還中國」，對於台灣的熱愛、認同，絲毫不會因為我們是中華民族的一份子，而被貶低、排除，有所衝突。台灣跟中國不應該是對立、矛盾的概念，本來就應該是相融的。    ,https://news.ltn.com.tw/news/politics/breakingnews/5472399
水獺媽媽樂園6/27板橋盛大登場 蘇巧慧邀親子同樂,政治,2026/06/15 09:58,水獺媽媽樂園活動6/27在板橋盛大登場，民進黨新北市長參選人蘇巧慧以「質詢」方式宣傳活動。（圖擷取自「蘇巧慧」臉書）民進黨新北市長參選人蘇巧慧6月27日將化身水獺媽媽，在新北市板橋第一運動場盛大舉辦「水獺媽媽樂園」，宛如大型粉絲見面會，有舞台演出、親子互動與餐車美食等，在團隊年輕夥伴發想下，蘇巧慧也模擬質詢的方式，一一向水獺好朋友「質詢」出宣傳內容，一本正經地為小水獺關切活動籌備狀況。蘇巧慧指出，很多孩子和家長認識她，是從「水獺媽媽巧巧話」頻道開始的，她從2020年開始用Podcast說故事給孩子聽，6年來也已說了超過350集故事，陪伴大小朋友們度過無數的親子時光。這個暑假，她不只會一如往常到處去說故事，還要聚集許多人對這個城市的夢想，打造一座「水獺媽媽樂園」。請繼續往下閱讀...蘇巧慧透過模擬質詢的方式宣傳，讓「水獺好朋友」趣味說出，該活動於6月27日的早上9點至下午4點，採免費入場，現場不但有精彩的舞台演出與滿滿的親子互動，還有豐富的遊戲攤區，像是電動機車小騎士、探險穿繩、虛擬賽跑、美味餐車等等，讓暑假第一週就充滿笑聲與回憶，邀請大小朋友們一起來同樂！民進黨新北市長參選人蘇巧慧舉辦水獺媽媽樂園活動，6/27在板橋盛大登場。（圖擷取自「蘇巧慧」臉書）    ,https://news.ltn.com.tw/news/politics/breakingnews/5472395
警察節為警消請命  柯志恩籲高雄警勤務繁重加給調高至1.3倍,政治,2026/06/15 09:49,柯志恩呼籲行政院應盡快完成差額補發，讓警消及海巡人員獲得應有保障。（記者葛祐豪翻攝）今天（15日）是警察節，國民黨高雄市長參選人、立委柯志恩表示，警消同仁長期承擔出勤的高風險，但高雄警消領取的危險加給卻明顯低於雙北，她主張高雄應該比照雙北，全額加成1.3倍發給繁重勤務及危險加給；另針對已三讀通過的《警察人員人事條例》，明定警消及海巡人員的退休所得替代率最高提升至80%，柯也呼籲行政院應盡快依法完成差額補發，讓警消及海巡人員獲得應有保障。柯志恩今指出，警察長年不分晝夜、堅守崗位，守護城市治安與社會安定，理應獲得政府完善的待遇與保障，但根據修正後的「警察人員警勤加給表」，她發現雙北地區的勤務繁重加成上限已調高至1.3倍，高雄卻僅調高至1倍，導致高雄警消所領取的繁重勤務及危險加給，明顯低於雙北。請繼續往下閱讀...柯志恩認為，警消人員的工作性質同樣辛苦且極具風險，不應因地域不同而有差別待遇。過去台南殺警案震驚全台，凸顯出第一線執法人員的危險與壓力，她主張高雄警消的繁重勤務及危險加給，應比照雙北的1.3倍上限全額發放，讓基層同仁獲得公平合理待遇。此外，針對外界關注的《警察人員人事條例》修法議題，柯表示，相關法案已完成三讀程序並正式生效，明定警消及海巡人員退休所得替代率最高可提升至80%，並溯及已退休人員。但即使法律經過立法通過、總統公布以及銓敘部發函，行政院至今仍以釋憲程序中為由，拒絕落實，讓基層同仁失望。柯志恩呼籲行政院，應儘速落實相關法案，唯有透過實質的福利與制度保障，才能真正提升警消士氣，展現政府對第一線執法人員的支持與重視。    ,https://news.ltn.com.tw/news/politics/breakingnews/5472388
專家：中國研發機器狼用於台海衝突 台應多層次防禦,政治,2026/06/15 09:46,圖為2024年中國航空展兵器館所展出的四足機器人。（中新社）中國對台軍事威脅不斷之際，美國專家近期接受中央社記者專訪表示，中國正在研發「機器狼」，能在台海衝突初期派出機器人而非士兵，用於偵察登陸區、運送物資等，北京恐因此認為初期損失的政治成本變低；台灣應採取多層次防禦。華府智庫「捍衛民主基金會」（The Foundation for Defense of Democracies）中國計畫資深主任辛格頓（Craig Singleton）、資深研究分析員柏南（Jack Burnham）日前發表「中國的戰狼：從商業技術到戰鬥力」（China’s War Wolves: From Commercial Tech to Combat Power）報告。請繼續往下閱讀...報告摘要指出，中國人民解放軍對「智慧化戰爭」的擁抱，反映其正在系統性地將人工智慧（AI）、機器人技術及無人系統整合至前線行動之中。●機器狼打頭陣  戰爭初期用於偵察、運送物資辛格頓近日接受記者專訪表示，中國正在研發外觀類似「機器狼」的四足地面機器人，其大小和大型犬差不多，能搭載攝影機、感測器和光學雷達，並配備機載電腦，部分「機器狼」還能運送物資、配備武器、偵察地形，甚至集群行動。這些已出現在解放軍的訓練畫面和中國官媒中，「意味著中國軍隊正在測試如何將它們投入實際行動，且重點針對台灣」。他分析，台灣是中國最可能運用這些系統的實際場景。一場跨越台灣海峽的入侵行動將會極其危險，在最初幾個小時內，將會出現激烈的灘頭戰、城市巷戰、通訊中斷及慘重的人員傷亡，而機器人的加入，就能讓北京派出機器人打頭陣，而非派士兵。他指出，這些機器人可用來偵察登陸區、運送物資、繪製地形圖並清除障礙，有助中國在衝突最危險的階段保存兵力，「這確實改變了一場潛在戰爭初期的局勢走向」。辛格頓分析，機器人並沒有消除風險，只是「重新分配風險」，若由機器來承受第一波的危險，那北京可能會認定初期傷亡損失的政治成本變低了。●台應建立多層次防禦 透過反機器人技術嚇阻至於台灣該如何因應，辛格頓認為，台灣了解無人機，「而機器人技術正是下一個演進階段」。台灣需要的是可負擔的多層次防禦機制，像是偵測、干擾、電子戰，以及城市反機器人演習。在反制措施方面，他建議台灣優先考慮的事項包括，機器人高度依賴感測器和通訊，台灣應投入資源，提升快速發現並識別這些無人地面系統的能力；藉由干擾訊號來阻礙其導航及通訊連結，讓許多機器人系統癱瘓或功能降級；建立多層次的防禦體系，若其中一種方法失效，另一種隨時能補上。台灣面臨中國威脅之際，國家中山科學研究院6月初展示3型以美商Ghost Robotics機器狗為儎台、衍生研發的「偵蒐型」、「火力型」及「光達型」機器狗，未來可用於前線偵蒐、警戒巡邏及高風險任務。辛格頓分析，機器人確實會影響風險評估，若中國相信機器可減少人員傷亡，中國領導階層可能會認為，戰爭第一階段所需付出的政治成本較低，這雖不能保證一定會爆發衝突，但的確改變了衡量風險的方式。「這就是為什麼反機器人技術對台灣的嚇阻力與自身防衛而言，如此重要」。●美台加強夥伴關係簡化採購流程 晶片優勢可助攻在台美合作方面，他建議，美國可加強和台灣值得信賴的本土機器人公司的夥伴關係、簡化採購流程，並支持台灣反制無人系統的能力。他認為，最重要的是，美台雙方必須假設，「機器人技術將會是（台海）衝突爆發初期的一環，所有的準備工作都必須在危機發生前到位」。辛格頓也說，台灣擁有獲取全球最好、最先進晶片的管道，若能成功整合本土機器人公司和晶片製造商，台灣有可能開發出比中國更先進的機器人。（編輯：唐聲揚）1150615    ,https://news.ltn.com.tw/news/politics/breakingnews/5472292
提升警察安全 侯友宜：新北投入近5億元汰換老舊警用車,政治,2026/06/15 09:43,今天是警察節，警察出身的新北市長侯友宜向堅守崗位的警察致敬。（圖由新北市政府提供）今天6月15日是警察節，新北市長侯友宜官方Line發布貼文表示，為提升警察安全，市府投入近5億元經費，加速汰換老舊及逾齡警用車輛，並優化值勤環境，已有17座辦公廳舍落成。警察出身的侯友宜說，守護人民安全，是警察的使命；守護警察安全，是市府的責任。近年毒駕等新型態犯罪增加，警職工作的艱辛與風險遠超過想像，打擊犯罪、維護交通、捍衛治安，新北市政府和警察並肩作戰。請繼續往下閱讀...侯友宜指出，新北市投入近5億元經費，加速汰換老舊及逾齡警用車輛，優化值勤環境，目前已有17座警察辦公廳舍落成，15處正在規劃或施工中。此外，將打造AI輔助與大數據整合的決策系統，推動智慧科技警政。他說，今天是警察節，他向所有堅守崗位的警察致上最高敬意，「你們平安，才是民眾的幸福。」    ,https://news.ltn.com.tw/news/politics/breakingnews/5472384
轉達習近平「很在意」！鄭麗文：九二共識與一國兩制沒關係,政治,2026/06/15 09:37,國民黨主席鄭麗文。（圖由國民黨提供）國民黨主席鄭麗文今日於洛杉磯美西華人學會發表「美中台和平繁榮之旅」專題演講，鄭麗文表示，九二共識與一國兩制一點關係都沒有，2019年中共總書記習近平的演講，被民進黨刻意斷章取義簡化，九二共識的原始版本就沒有一國兩制。在問答環節時有人提問：「台灣多數人民不同意一國兩制，若國民黨2028年再次執政，有什麼好的主張讓兩岸人民都能接受？」對此，鄭麗文說，今年4月「鄭習會」的時候，習近平帶有情緒地說，九二共識的內容白紙黑字，有人「故意斷章取義」，「這種人內心很黑暗」，要不然就是有特別的意圖，「所以他還蠻在意他自己『被冤枉』的」。請繼續往下閱讀...鄭麗文說，她要再次鄭重澄清，九二共識與一國兩制一點關係都沒有，2019年習近平的演講被民進黨刻意斷章取義簡化，因為九二共識的原始版本就沒有一國兩制，故意說中共片面改變九二共識的內涵，與一國兩制掛鉤，這個完全不是事實，2019年習近平絕對沒有這樣講，但是九二共識因此背了黑鍋，好像不能翻身，這也是為什麼她重新開始講九二共識以後，很多人說她很勇敢，但她也沒有少一塊肉，而且再次證明這是兩岸和平對話的重要基石。鄭麗文強調，九二共識絕對不會犧牲、放棄中華民國在台灣建立的民主法制、自由經濟的成果，相反的因為兩岸的和平對話、穩定關係，是深化保障中華民國的民主自由及繁榮。「鄭習會」的時候，習近平也帶有情緒的說，九二共識的內容白紙黑字，有人故意斷章取義，這種人內心很黑暗，要不然就是有特別的意圖，「所以他還蠻在意他自己被冤枉的」。鄭麗文表示，沒有投降、繳械，相反的是因為我們對自己深具信心，我們的民主、經濟成就、在科技發展全球高科技供應鏈不可或缺的角色，都讓我們挺直腰桿，不用替國民黨擔心，也不用無謂的懷疑，唯有兩岸人民的意願受到充分的尊重，兩岸才有可能永續的走下去，相信兩岸的領導人、政黨，都要有同樣的體會。國民黨如果執政之後，也一樣往這樣的方向走，而不是先射箭才畫靶。    ,https://news.ltn.com.tw/news/politics/breakingnews/5472372
台北市長選戰局勢 他分析：票投蔣萬安就是票投馬英九,政治,2026/06/15 09:19,推動「台灣獨曆」的藝術創作者Mock Mayson指出，若是票投蔣萬安就是票投馬英九。圖為馬英九2019年為蔣萬安造勢。（資料照）今年11月28日將舉行地方選舉，台北市的局勢引發各界關注，推動「台灣獨曆」的藝術創作者Mock Mayson指出，若是民眾把選票投給蔣萬安，就等於是投給馬英九。Mock Mayson臉書表示，關於蔣萬安「好帥喔」、「有市長的樣子」、「氣宇非凡的一國之君」等說法，像他這種中年人在20年前就看過一輪了，「只不過當時那個草包不叫蔣萬安，叫馬英九。」請繼續往下閱讀...Mock Mayson說，過去媒體對於馬英九的吹捧，和現在的蔣萬安可以說是如出一轍，利如「馬英九10天沒穿內褲」可和「蔣萬安穿緊身衣秀，槓鈴臥推50kg，好身材藏不住」對比；「馬英九露胸肌，女學生口水直流」可和「「二頭肌藏不住！蔣萬安寫春聯秘辛大公開」對比；「小六女生高喊馬英九我愛你」可和「專情蔣萬安……撩到女主持摀嘴尖叫」對比等等。Mock Mayson指出，不只新聞的操作一模一樣，連講「謝謝指教」的習慣都一模一樣，蔣萬安和馬英九都很愛講「謝謝指教」，因為馬英九20年前也是和現在的蔣萬安一樣，什麼事情都不懂、什麼問題都不會回答，面對外界的質疑與批評一概只會說「謝謝指教」。Mock Mayson表示，投票給一樣的國民黨，就會得到一樣的結果，亦即施政一蹋糊塗與經濟一瀉千里，把整個年輕世代的所得、工作機會與產業發展都賠下去，最後換得一個爛台灣再賤價賣給中國，連子孫的未來跟器官都全給賣了。Mock Mayson認為，蔣萬安就是「馬英九二世」，票投蔣萬安就是票投馬英九，馬英九時代已經演過一遍了，至今才20年不應該就全部忘光，他對此不禁感嘆「台灣人可不可以跳脫這種只會投票給空殼草包然後把自己給害慘的不幸輪迴啊？」    ,https://news.ltn.com.tw/news/politics/breakingnews/5471760
