Title,News_Type,date,content,url
愛爾麗針孔案 拘提總裁常如山 設備商受指使 拆監視器滅證,社會,2026/05/07 05:30,愛爾麗連鎖醫美新北板橋店涉嫌裝設針孔鏡頭，檢警拘提總裁常如山。（記者王定傳攝）新北地檢署偵辦愛爾麗連鎖醫美新北板橋店涉嫌裝設煙霧偵測器偽裝的針孔鏡頭，追查發現，謝姓設備商在本案曝光後疑受人指示，從台北到台中沿途拆監視器主機涉滅證，昨啟動第二波行動，搜索愛爾麗台北辦公室、新北板橋、新莊、林口、永和四分店及愛爾麗總裁常如山台北住處、廠商辦公室等八處，並以妨害秘密、妨害性隱私等罪嫌拘提常及其特助張男、設備商謝姓工程師，同時約談總經理劉貞如，漏夜偵訊中。謝男從台北到台中 拆除主機 檢警搜索8處 偵訊總經理等全案起於一名卅歲女性顧客五月一日，前往愛爾麗板橋店進行體雕療程時，發現店內疑裝有煙霧偵測器針孔攝影機，除錄影存證、向警方報案，並在社群發文提醒大家小心。據悉，警方一日受理後約談板橋店員工，三日搜索時發現監視器鏡頭雖存在，但主機不翼而飛，循線發現是謝男所為，即報請新北檢指揮偵辦。請繼續往下閱讀...檢警調查，謝男一日疑受人指示，開車前往新北四分店、台北忠孝、站前、南京店、桃園店、台中文心、崇德共十家分店拆主機。警方三日晚間在台中發現謝男行蹤，並在謝男車上及辦公室查扣愛爾麗濁水溪以北共十家分店的監視器主機及部分針孔設備，且板橋店主機已遭格式化。檢警因此帶回常、劉等高層及以證人身分約談新北四分店負責人，釐清他們是否涉案、知情；據悉，分店負責人均供稱不知情，謝男則不願詳述是誰設計並將監視器裝設在診間。    ,https://news.ltn.com.tw/news/society/paper/1753783
愛爾麗爆針孔偷拍！常如山、特助聲押 女總經理500萬交保,社會,2026/05/07 02:54,愛爾麗偷拍案，愛爾麗總裁常如山（中）、特助張元齡（右）、針孔業者謝金亨（左）聲押禁見。（記者王藝菘攝）首次上稿 00:49更新時間 02:54（更新照片）愛爾麗連鎖醫美新北板橋店日前遭女客戶指控，店內裝有煙霧偵測器偽裝的針孔鏡頭；檢警發現，謝姓設備商在本案曝光後疑受人指示，從台北到台中沿途拆監視器主機運走涉滅證，做啟動第二波行動，搜索愛爾麗台北辦公室、新北4家分店及愛爾麗總裁常如山台北住處、監視器廠商辦公室等8處，並涉妨害秘密、妨害性隱私等罪嫌被告身分拘提常如山、常的特助張元齡、設備商謝金亨，另約談總經理劉貞華，今凌晨00時許聲押禁見常、張、謝共3人，劉女訊後諭知500萬元交保。檢方並呼籲，有查扣監視器相關各分店的被害人，如經警方聯繫，請配合確認並斟酌是否提出告訴；相關分店被害人亦可向警方洽詢是否有在監視器畫面保留區間內，並主動報案配合警方偵辦，以利進一步釐清案情。本案起因於，1名30歲的女性顧客5月1日前往愛爾麗連鎖醫美板橋店做體雕療程時，發現店內疑似裝有煙霧偵測器針孔攝影機，嚇得趕緊穿上衣服，除了對偷拍器材錄影存證外，也向新北市警察局海山分局報案，並在社群發文說明過程及相關照片提醒大家小心。據了解，警方5月1日受理報案後即約談板橋分店員工，3日搜索時赫然發現監視器鏡頭雖存在，但主機不翼而飛，發現是謝男所為，遂緊急報請新北檢指揮偵辦。檢警回溯發現，謝男在1日疑似受人指示，從台北、新北沿途開車往台中走，前往各分店拆主機。警方3日晚間在台中發現謝男行蹤拘提到案，並在謝男車上及辦公室查扣愛爾麗濁水溪以北共10家分店監視器主機及部分針孔設備，但因板橋分店主機已遭格式化，且尚須清查被害者身份並確認是否提告，檢方4日複訊後先將謝男請回。檢警逐一過濾監視器並調閱病歷，發現被害者眾多，目前已找到7名被害者，昨再啟動第二波行動，搜索板橋、新莊、林口、永和4分店、常位於北市住處及廠商辦公室共8處，鎖定常、劉等高層，拘提及常、劉等4名被告，並以證人身分約談新北4分店負責人到案，釐清他們是否涉案，今訊後依以涉無故攝錄性影像罪嫌、無故竊錄他人身體隱私部位，及違反兒童及少年性剝削防治條例拍攝兒少性影像及個人資料保護法聲押禁見常、張、謝共3人；劉女訊後500萬元交保。愛爾麗偷拍案，愛爾麗集團總經理劉貞華500萬交保，劉貞華兩手插在口袋步出地檢署。（記者王藝菘攝）    ,https://news.ltn.com.tw/news/society/breakingnews/5428233
台北暗夜槍響！轎車撞傷路檢警 遭警開7槍逃逸,社會,2026/05/07 00:44,轎車遇到台北市保安大隊警方路檢，撞傷1名警員逃逸。示意圖。（資料照）1輛轎車昨晚（6日）9點左右行經台北市松江路、民族東路口，遇上台北市保安大隊警方路檢，駕駛起初配合停車、出示證件受檢，卻突然加速衝撞警方，造成1名警員受傷，員警連開7槍，轎車仍強行突圍逃逸，警方已鎖定車號全力追緝中。台北市保大警方昨晚在松江路、民族路口路檢，這輛轎車緩緩駛入攔檢區，駕駛搖下車窗，出示證件突然重踩油門衝撞，1名警員遭撞倒地，身上多處擦挫傷。請繼續往下閱讀...現場警戒員警立即大聲喝令停車，果斷拔槍朝車輪連開7槍攔阻，駕駛仍高速逃逸。受傷警員送醫院急救，確認主要是四肢擦挫傷，意識清醒，無生命危險，留院觀察中。警方持續追查駕駛身分及動機。    ,https://news.ltn.com.tw/news/society/breakingnews/5428227
空殼貿易公司涉洗錢10億　北檢聲押禁見8嫌,社會,2026/05/07 00:39,男子周文傑設立順發成功貿易公司，涉嫌替詐欺及博弈集團洗錢逾10億元。檢警5日拘提、逮捕周男等12人移送北檢複訊，檢察官訊後聲押禁見周男等8嫌，另諭知2嫌交保、2嫌請回。檢警調查，周男涉嫌以貿易公司為幌子，替10餘家公司洗錢，這些錢多來自詐團及博弈集團。周男收款後以3種方式洗錢，包括指示員工大額現金提款、約定轉帳至特定個人或公司帳戶、或製作外匯假合約，將錢匯至境外。檢警初估，從去年3月至今，周男公司洗錢金額超過新台幣10億元。請繼續往下閱讀...台北地檢署檢察官5日指揮刑事警察局，持法院核發的搜索票，搜索周男的貿易公司及住居所等14處，拘提周男及其員工、上游公司吳姓負責人等11人，另逮捕1名因案遭通緝的員工到案，6日下午陸續移送北檢複訊。檢察官訊後認為周男及上游公司吳姓負責人、同案廖姓、陳姓、徐姓、洪姓、雷姓、蕭姓被告等8人涉嫌重大，向台北地方法院聲請羈押禁見；並諭知另1名洪姓及陳姓被告分別以30萬元、20萬元交保；其餘2人請回。（編輯：陳正健）1150507    ,https://news.ltn.com.tw/news/society/breakingnews/5428235
瓦解詐騙洗錢鏈》空殼貿易公司「順發成功」涉洗錢10億 8人聲押,社會,2026/05/07 00:26,順發成功公司負責人周文傑（後右2）。（記者吳昇儒攝）順發成功國際貿易公司涉嫌透過境外公司，以假交易協助詐團及非法博弈業者將不法所得轉匯海外，僅1年內經手金額逾10億元，且原資本額僅20萬元，卻在2週內增資至450萬元，疑藉此擴大交易及匯兌額度。台北地檢署6日指揮刑事局兵分14路搜索，拘提負責人周文傑等12人到案。檢方複訊後，認周等8人涉犯重大，向法院聲請羈押禁見；另洪男30萬元、陳女20萬元交保，其餘2人請回。檢警調查詐團金流時，發現包括鑫益、衍成工程行、醫康美慧等至少10家公司，均將款項匯入順發成功國際貿易公司帳戶。該公司疑利用法人與公司行號可進行大額金流往來，專門替詐騙集團及線上博弈業者進行洗錢，且原資本額僅20萬元，卻在2週內增資至450萬元，疑藉此擴大交易及匯兌額度。請繼續往下閱讀...檢警追查，順發成功收受大額資金後，先以人員分批提領方式將資金轉為現金流，再以假合約形式進行包裝，辦理外匯匯出至境外帳戶，形成多層金流斷點以規避追查。據統計，該公司成立1年間洗錢規模已超過10億元，顯示其規避金融機構防制洗錢機制的運作模式。北檢5日指揮刑事局兵分14路前往順發成功公司等處所進行搜索，並拘提包含負責人周文傑、醫康美慧公司吳姓負責人及相關空殼公司人員等共12名被告到案，全案將朝詐欺、洗錢及組織犯罪防制條例等罪嫌方向偵辦。檢警昨拘提負責人周文傑、醫康美慧公司負責人吳衡毅及相關空殼公司人員等共12名被告到案。（記者吳昇儒攝）檢警昨拘提負責人周文傑、醫康美慧公司負責人吳衡毅及相關空殼公司人員等共12名被告到案。（記者吳昇儒攝）    ,https://news.ltn.com.tw/news/society/breakingnews/5428225
彰化毒駕奪2命！肇事男IG炫富遭肉搜 惡霸行徑曝光,社會,2026/05/06 23:58,高男IG被肉搜出。（圖翻攝自IG）近日彰化一名30歲高姓男子毒駕撞死2人，引發社會怒火。有網友肉搜出毒駕男的個人社群，可以看到他時常在社群炫富，據悉本來就是地方上的頭痛人物。本月4日凌晨，30歲高姓男子駕駛BMW在彰化市接連撞死吳姓機車騎士與開車經過的翁姓女子，高男自己則因頭部撕裂傷內出血一度陷入昏迷，目前已恢復意識。警方抽血驗尿發現高男有毒品反應，證實為毒駕肇事。請繼續往下閱讀...這起事件曝光後，網友群起撻伐，還有人肉搜出高男的IG，可以看到他時常分享自己的豪車、名牌精品。鄉民們灌爆其IG，疑不堪輿論，目前高男IG已關版。有媒體披露，高男本來就喜歡在深夜飆車，巨大引擎噪音常吵到附近住戶，還會飆罵路人，是地方上的頭痛人物。    ,https://news.ltn.com.tw/news/society/breakingnews/5428178
狠父抓10月兒頭撞地、塞木箱罰站虐死大翻供 檢提2關鍵證據,社會,2026/05/06 23:52,廖姓男子（中）涉虐死10個月大兒子。（民眾提供）台中10個月大男嬰疑哭鬧，遭廖姓生父抓頭撞地板，塞在木箱罰站致死，台中地院國民法庭今天（6日）繼續開庭，廖男全盤否認，聲稱只有輕拍臉頰，男嬰是在南投還有住處從椅子與和室摔落地面，才造成腦傷。檢察官依據曾柏元法醫解剖報告和張鈺孜醫師作證指出，男嬰是因12小時內新生的嚴重顱內出血、橫紋肌溶解致死，而且是外力造成，直指廖男凌虐男嬰致死。中檢起訴指出，前年8月22日凌晨，廖男在住處和室陪10個月大的兒子睡覺，兒子凌晨4點多哭鬧，廖男先是打巴掌，接著抓住大腿倒吊懸空，還抓頭撞地板或牆壁，把兒子塞進木箱罰站，獨自回房間睡覺。直到當天下午5點多，前妻發現兒子全身發黑，沒有呼吸心跳，趕緊叫救護車送醫，兒子仍在當晚7點多因頭部外傷致顱內出血，併有橫紋肌溶解宣告不治；廖男被依成年人對未滿7歲兒童凌虐致死罪起訴。請繼續往下閱讀...警詢筆錄時，廖男坦承有打巴掌，把兒子放在木箱內罰站，還拿塑膠槌子敲他的頭10到20下，頭下腳上倒吊懸空懲罰。不過，他開庭時全盤否認，聲稱只有輕拍兒子臉頰，兒子的腦傷是在南投還有台中住處從椅子與和室摔落地面造成。但檢察官指出，法醫曾柏元的解剖報告顯示，男嬰是因嚴重顱內出血，導致在短時間死亡，而且是在12小時內造成的新傷勢；張鈺孜醫師作證時也說，男嬰不論是從高約34公分的木椅，還是45公分高的和室摔到地面，都不會造成這麼嚴重的腦損傷，認為是遭人抓頭撞硬物3次所造成的對撞傷，直指廖男就是元凶，應以成年人對未滿7歲兒童凌虐致死罪判刑。    ,https://news.ltn.com.tw/news/society/breakingnews/5428214
桃園藝文特區豪宅社區傳墜樓 年輕女子墜落馬路身亡,社會,2026/05/06 23:42,桃園藝文特區一處豪宅社區，今（6）日晚間9點多發生疑似墜樓案，年約20歲女子被發現倒臥在社區路旁，救護人員獲報趕抵，女子已明顯死亡，據悉，女子為住戶，墜樓原因仍待警方調查。事發時有不少民眾目睹，警方也在現場拉起封鎖線採證，有民眾說，騎車經過時剛好看到，真的驚魂未定，原以為是車禍但不是。    ,https://news.ltn.com.tw/news/society/breakingnews/5428218
彰化毒駕飆撞汽機車釀2死2傷  BMW男收押,社會,2026/05/06 23:11,吳男毒駕造成2死2傷。（民眾提供）彰化縣現年30歲的高男4日清晨吸食安非他命後，在彰化市駕駛BMW轎車，飆速先撞上64歲吳姓機車騎士，再衝上中華陸橋撞上對向轎車，造成新婚女駕駛喪命，這起毒駕造成2死2傷。檢察官吳皓偉今天指揮彰化分局警員前往醫院拘提甫出院吳男，訊問後認其毒駕致死罪嫌重大，且有勾串、逃亡之虞，聲押禁見。彰化地院今晚召開羈押庭，院方准予羈押，但並未禁見。這起事故發生在清晨4點，高男駕駛BMW沿中華路高速行駛，先從後方猛力撞擊吳姓騎士騎乘的機車，機車當場解體，吳男因傷重斷肢慘死。BMW撞擊後未減速，隨即衝上中華陸橋，逆向衝入對向車道，迎面撞上由翁姓女子駕駛的轎車，強大撞擊力導致翁女重傷，送醫後仍宣告不治。BMW隨後再撞斷路旁燈桿，車輛翻覆於橋面。高男因受傷住院，警方在旁戒護，檢方確定出院後，隨即予以拘提並聲押。    ,https://news.ltn.com.tw/news/society/breakingnews/5428195
消費女警車禍悲劇  AI變造肇事者影片吸「仇恨」流量,社會,2026/05/06 22:41,有網友疑似為了吸引流量，以AI變造影片，警三分局證實影片破綻重重，呼籲切勿轉傳。（記者王捷翻攝）上個月台南女警鄭詠心遭撞擊身亡，但近日網路流傳一段AI變造影片，內容是肇事的戴姓女大生反覆查看機車損壞的影片，網友懷疑是消費悲劇，藉此吸仇恨流量。警三分局表示，該影片並非監視器畫面，呼籲民眾切勿轉傳，但目前也未接獲戴女報案。經過變造的影片內容，監視器畫面作為基礎改編，假造影片中戴女仔細檢視自己機車的毀損狀況，有網友覺得不可取，懷疑該帳號借AI影片吸引仇恨流量。警三分局證實，因這段影片解析度清晰，與原本存查的監視器不符，可能是利用AI技術刻意生成，並非案發現場的原始影像。請繼續往下閱讀...但是，這段AI變造影片吸引許多網友群起圍攻，有網友從戴女機車型號的細節發現疑點，另外變造影片中的戴女走路姿勢不自然，還會「雙腳打結」，戴女案發時腳上穿的紅色漆皮鞋也變成黑色。PO出變造影片的帳號最近才成立，而帳號內的PO文都是改編新聞的聳動圖卡，並用這些新聞來吸引流量。三分局指出，案發現場的監視畫面受限於焦距與光線，沒有這麼清楚，如果惡意透過合成技術製造假訊息、或是影響他人名譽，可能違反個資法或妨害名譽，目前未接獲戴女提出告訴，此類假影片也有干擾秩序的疑慮，這起事故造成女警發生憾事，呼籲網友尊重司法調查程序，勿成假訊息傳播者。    ,https://news.ltn.com.tw/news/society/breakingnews/5428169
屏東瑪家草泥馬瀑布婦溺水亡！5天內兩起 上次是獅王瀑布,社會,2026/05/06 22:27,婦人在屏東瑪家草泥馬瀑布溺水，屏東縣消防局出動9車22人救援。（消防局提供）天氣漸熱，國境之南海邊、山區瀑布出現戲水人潮，屏東瑪家鄉草泥馬瀑布今天下午有人溺水，短短5天兩起瀑布溺水意外。屏東縣消防局指出，今天下午1點44分接獲110轉報，有民眾於瑪家鄉草泥馬瀑布疑似溺水，請求協助，立即出動瑪家、三地門、長治分隊、特搜大隊及第一大隊共9車22人趕往現場救援，由特搜大隊副大隊長鄭維勛現場指揮。請繼續往下閱讀...消防局人員下午3點20分確認溺者位置接近救援，3點32分回報已將年約61歲女性溺者拉上岸，但已無生命徵象，搜救人員合力搬運到救護車停車處，傍點6點由瑪家救護車送往龍泉榮民醫院急救。瑪家鄉數個瀑布長期被視為消暑景點，但不僅易侵犯原住民族聖地，更易因潛藏的安全風險溺水；5月1日下午才有25歲男子在「獅王」瀑布溺水，時隔5天，換草泥馬瀑布發生憾事。夏季到來，民眾親水活動頻率增加，屏東縣政府消防局提醒民眾，從事水域活動時務必提高安全意識，避免進入野溪、河川、瀑布、深潭及海岸等高風險水域，應選擇具備救生員及完善防護設施的合法場域，以確保人身安全。搜救人員合力救出溺水婦人，送醫搶救。（屏東縣消防局提供）    ,https://news.ltn.com.tw/news/society/breakingnews/5428143
5/6 今彩539頭獎開出2注！800萬獎落彰化、南投,社會,2026/05/06 22:09,5月6日開獎的今彩539頭獎開出2注，800萬獎落南投、彰化。（擷取自台彩官網、本報合成）5月6日開獎的今彩539頭獎開出2注，由南投縣埔里鎮北門里北環路32號1樓「財運到彩券行」、彰化縣埔心鄉東門村中正路一段292號「興鑫鑫來投注站」開出。第115000111期今彩539中獎號碼為「04、10、11、34、39」。頭獎開出2注，每注可得800萬元；貳獎共259注中獎，每注可得2萬元；參獎共9264注中獎，每注可得300元；肆獎共9萬1078注中獎，每注可得50元。請繼續往下閱讀...第115000111期39樂合彩中獎號碼為「04、10、11、34、39」。四合共3注中獎，每注可得21萬2500元；三合共491注中獎，每注可得1萬1250元；二合共1萬8833注中獎，每注可得1125元。第115000111期3星彩中獎號碼為「285」。壹獎共125注中獎，每注可得5000元。第115000111期4星彩中獎號碼為「4381」。壹獎共12注中獎，每注可得5萬元。確切中獎號碼以台彩網站公告為主，請見「台灣彩券網站」。今彩539、39樂合彩、3星彩、4星彩中獎號碼。（擷取自台彩官網）    ,https://news.ltn.com.tw/news/society/breakingnews/5428154
宜蘭冬山河自行車道開出首張罰單！汽機車闖入最高罰1800元,社會,2026/05/06 22:08,宜縣冬山河堤頂等多條自行車道，公告禁止汽機車進入，違反規定最高可罰1800元。（圖由宜蘭縣府提供）宜蘭縣政府2年多前將冬山河堤頂等多條自行車道，納入道路交通管理處罰條例適用範圍，並設置公告禁止汽機車進入，勸導期過後，今天（6日）會同警方在冬山河堤頂自行車道開出首張罰單，最高可處1800元罰鍰。宜蘭縣政府指出，為確保運動休閒及騎乘自行車民眾安全，改善汽機車闖入自行車道亂象，2024年2月10日起，把冬山河堤頂、羅東溪右岸、蘭陽溪堤頂、宜蘭河堤頂、猴洞溪堤頂、得子口溪右岸堤頂及宜蘭市鐵路高架下自行車道，納入道路交通管理處罰條例適用範圍，若有汽機車違規進入，可依違反道路交通管理處罰條例規定，處900元以上1800元以下罰鍰。請繼續往下閱讀...縣府工旅處表示，公告至今派員勸導，仍有汽機車闖入自行車道情形，造成運動休閒者、自行車騎士安全疑慮，今天會同宜蘭縣警局到冬山河堤頂自行車道稽查，發現機車騎士騎進自行車道，警方當場製單舉發。工旅處說，冬山河堤頂等自行車道，主要提供遊客步行或騎乘自行車使用，禁止汽機車進入，工旅處將會同警方持續執法，呼籲大家遵守規定，以免受罰。    ,https://news.ltn.com.tw/news/society/breakingnews/5428144
台中又有議員被盜圖借錢、邀投資 謝家宜急喊「直接封鎖」,社會,2026/05/06 21:41,中市議員謝家宜發現被盜圖設假帳號向人借錢邀投資。（擷自謝家宜臉書）近來股市屢創新高，詐騙蠢蠢欲動，台中市接連有市議員被盜圖，繼議員周永鴻昨（5日）晚發現IG頭像帳號被盜用，廣邀民眾加LINE「聊投資」後，另一名北屯區市議員謝家宜今晚也發現被盜圖，非她所創的帳號以她的頭像向人借錢或邀投資，讓謝家宜晚間喊話民眾「直接封鎖」，她不會主動借錢、邀投資，「這不是我，小心詐騙」。近來股市超夯，不肖分子又開始假藉投資名義企圖詐騙，周永鴻昨天發現他的IG頭像帳號被盜用，出現有以他為「人頭」的帳號，稱近來股價波動、美國市場波動大，「現在正是累積知識的好時機」，邀投資、借錢、加LINE及傳不明連結的訊息，讓周永鴻急澄清「全部都是詐騙」、「這不是我」，喊話民眾不要點、不要回並直接封鎖，以免上當受害。請繼續往下閱讀...今晚又有議員發現被盜圖，也是以不明帳號要民眾投資，謝家宜指出，接獲民眾反映有數個不明帳號盜用她的照片，創立假帳號，私訊民眾；她趕緊提醒澄清，她不會主動借錢、邀請投資、推廣連結或建立群組，籲民眾如收到任何可疑訊息，不要回覆、不要提供任何資料，「直接檢舉+封鎖」。    ,https://news.ltn.com.tw/news/society/breakingnews/5428106
台中又有議員被盜圖借錢、邀投資 謝家宜急喊「直接封鎖」,社會,2026/05/06 21:41,中市議員謝家宜發現被盜圖設假帳號向人借錢邀投資。（擷自謝家宜臉書）近來股市屢創新高，詐騙蠢蠢欲動，台中市接連有市議員被盜圖，繼議員周永鴻昨（5日）晚發現IG頭像帳號被盜用，廣邀民眾加LINE「聊投資」後，另一名北屯區市議員謝家宜今晚也發現被盜圖，非她所創的帳號以她的頭像向人借錢或邀投資，讓謝家宜晚間喊話民眾「直接封鎖」，她不會主動借錢、邀投資，「這不是我，小心詐騙」。近來股市超夯，不肖分子又開始假藉投資名義企圖詐騙，周永鴻昨天發現他的IG頭像帳號被盜用，出現有以他為「人頭」的帳號，稱近來股價波動、美國市場波動大，「現在正是累積知識的好時機」，邀投資、借錢、加LINE及傳不明連結的訊息，讓周永鴻急澄清「全部都是詐騙」、「這不是我」，喊話民眾不要點、不要回並直接封鎖，以免上當受害。請繼續往下閱讀...今晚又有議員發現被盜圖，也是以不明帳號要民眾投資，謝家宜指出，接獲民眾反映有數個不明帳號盜用她的照片，創立假帳號，私訊民眾；她趕緊提醒澄清，她不會主動借錢、邀請投資、推廣連結或建立群組，籲民眾如收到任何可疑訊息，不要回覆、不要提供任何資料，「直接檢舉+封鎖」。    ,https://news.ltn.com.tw/news/society/breakingnews/5428106
趁7歲女童落單撫摸私處 南部家扶志工強制猥褻判3年5月,社會,2026/05/06 21:19,南部家扶李姓志工在某辦公大樓猥褻女童，被高雄高分院判刑3年5月。（情境照）南部家扶基金會驚傳志工猥褻女童案！曾任保全的李姓男子在基金會某辦公大樓，涉嫌撫摸女童私處，被高等法院高雄分院依強制猥褻罪，判處有期徒刑3年5月。據了解，2023年5月21日上午，甲女到南部某家扶基金會辦公大樓後，自己去上才藝課程，把7歲大女兒A女留在沙發區，遭李姓志工撫摸私處，案經甲女向轄區警方報案後，員警傳喚他到案說明，並依涉嫌強制猥褻罪，函送地檢署偵查、起訴。請繼續往下閱讀...李男辯稱，當時要A女把坐在屁股下方的被子拿出來蓋，才坐到她跟前談話，完全沒有肢體接觸，否認犯行。他的辯護律師則說，監視器影像沒有攝得2人接觸的畫面，除A女向母親傾訴時有哭泣外，並無其他遭受侵害後的典型創傷反應。A女則說，案發當時穿短的牛仔褲坐在沙發上看手機，不認識的李男卻把手伸進去裡面，之前也未看過他。地院開庭調查後，認為李男所辯不足採信，依強制猥褻罪，判處有期徒刑3年半，他不服上訴，高雄高分院仍然認定有罪，改判3年5月，尚未定讞。    ,https://news.ltn.com.tw/news/society/breakingnews/5428112
