Title,News_Type,date,content,url
葛如鈞自認是威如股東 蘇巧慧談胞妹爭議：早說過是烏龍爆料,政治,2026/06/23 12:58,民進黨新北市長參選人蘇巧慧。（資料照）民進黨新北市長參選人蘇巧慧的胞妹蘇巧純遭控涉嫌透過任職的akaSwap母公司威如科技，違法領取政府補助，遭蘇辦駁斥為烏龍爆料，並揭藍委葛如鈞才是威如股東。對此，葛如鈞今（23）日證實此事，同時宣布將拋棄所有持股。蘇巧慧稍早表示，「早說過這是烏龍爆料」。面對民眾黨控蘇家違法鍊金，蘇巧慧競選辦公室發言人馬亨亨．夷將日前回應，威如的股東發文表示，蘇巧純並非威如公司的股東或職員，蘇巧純任職的akaSwap公司與威如公司僅有技術交流合作，威如公司如果賺錢或獲得任何補助，也跟蘇巧純無關。請繼續往下閱讀...此外，蘇辦也說，藍白不斷攻擊的這家公司，股東名單裡面沒有姓蘇的人士，而有名為葛如鈞的國民黨立委，威如公司如果賺錢，分潤的也是國民黨的葛如鈞，難不成藍白還要指控蘇巧慧違法在幫國民黨的立委爭取補助？葛如鈞今日說明，2021年他的同窗與學弟妹加入研發VR技術與Web3科技應用的新創公司，由於公司正值草創階段，亟需資金投入，出於支持與鼓勵，小額認購價值約10萬元的股份，於近千萬資本額中僅佔比不到2%。為避免外界持續產生不必要的揣測與誤解，甚至作出惡意解讀，他已決定拋棄所持有該特定公司的一切股份及相關權益，並就此事項以書面方式正式通知該公司。蘇巧慧今早在立法院出席「午餐吃飽、營養顧好，孩子才會好」學生餐盤體驗活動。她受訪時回應，她早就說過，這就是一個烏龍爆料，她妹妹蘇巧純根本不是威如科技公司的股東或職員。其實選戰應該回到比較各候選人的特質、能力，還有能帶給城市的願景跟希望，這種正向、樂觀的選戰，才是市民想看到的。    ,https://news.ltn.com.tw/news/politics/breakingnews/5481019
中國「提意見」施壓！我國睽違10年提APEC子基金 多花約1倍時間,政治,2026/06/23 12:58,外交部國際組織司長孫儉元（左）與APEC秘書處執行長佩德羅薩（右）在中國上海舉行的「第二次資深官員會議」（SOM2）期間簽署捐助備忘錄（MOU）。（外交部提供）我國於今年5月APEC「第二次資深官員會議」（SOM2）期間簽署捐助150萬美元備忘錄，正式成立「未來健康照護子基金」，是我國入會近10年來首度在APEC提出大型倡議。外交部國際組織司長孫儉元今（23）日指出，成立子基金的過程確實感受到中方壓力，中方對子基金提出許多「意見與看法」，部分意見不太合理，導致我國花費較長時間才成立此大型倡議。據了解，我國多花了約1倍的時間，才成功成立子基金。孫儉元今日於外交部例行記者會說明，「未來健康照護子基金」是我國10年來首個提出的項目，我國雖是亞太經濟合作會議（APEC）完整會員體，但因為中國亦是會員，導致我國在提出大型倡議的過程中，遭遇到許多困難。請繼續往下閱讀...孫儉元指出，經過了去年大約10個月的努力與漫長溝通，才促成「未來健康照護子基金」成立。由於APEC採共識決，所以任何會員提出的倡議與想法，都必須經過21個會員共同支持與決定，我國在推動成立子基金的過程中，中方提出許多意見與看法，有些意見看起來確實來自於專業看法，但另外也有些意見並不是那麼合理，導致我國花費了比其他會員更長的時間，才成功成立此倡議。確實感受到中方壓力。據了解，我國花費10個月的時間才完成子基金設立，大約是其他經濟體成立子基金所需時間的一倍。孫儉元指出，「未來健康照護子基金」的目標為鼓勵所有APEC相關會員政府及相關單位積極爭取子基金，促成能力建構與資訊分享。面對人口老化這個APEC所有會員共同面對的問題，如何確保健康照顧不會變成沉重的負擔。我國希望透過「未來健康照護子基金」，讓國內的長照經驗與優勢，被其他APEC會員看見，並藉機與其他APEC會員交流，進一步強化我國健康照顧體系。在成立「未來健康照護子基金」前，上一次於APEC獨自設立子基金為2006年的「人類安全子基金」。孫儉元表示，從去年12月至今，2026年由中國主辦的APEC已經過了一半，基本上與會大致都平順。針對過去曾發生的「不當中譯我國的會籍名稱」、「中方幾次公開表述的我國參與前提與條件」等狀況，我國皆有不斷與中方及理念相近會員國溝通、提出，以確保平等參與。針對下半年的會議，孫儉元說，外交部不會鬆懈態度，會持續針對各種可能發生的情境做沙盤推演，並且研訂應處方式。對於下半年會議與年底的領袖代表會議，外交部都在積極規劃與籌劃當中。    ,https://news.ltn.com.tw/news/politics/breakingnews/5481021
議員索行人遮陽傘資料獨缺成本頁 北市府：短時間大量索資造成遺漏,政治,2026/06/23 12:27,簡舒培今天（23日）偕同市議員參選人馬郁雯、陳又新召開記者會，質疑北市府行人遮陽傘工程諸多不合理的地方。（記者何玉華攝）台北市政府在信義區將打造的8座行人遮陽傘，每座造價高達740萬元，台北市議員簡舒培今（23日）爆索取資料過程中，市府「藏資料」把成本概估資料漏頁，質疑是在遮掩什麼？喊話政風處、監察院應該調查。台北市政府都發局表示，信義計畫區為台北市重要國際商業核心區，遮陽傘除降溫功能也須兼顧公共安全、都市景觀及後續維護管理需求；另因短時間內接獲議員大量索資，提供資料有頁面遺漏，已於當日補正，無規避監督或隱匿資訊。都發局說明，信義計畫區遮陽設施示範計畫是推動城市降溫與氣候調適政策的重要一環。並非單純購置市售遮陽傘，而是結合人行環境改善、都市景觀設計及降溫需求所推動的公共工程。相關經費除設施本體外，尚包含基地調查、規劃設計、結構計算、機電照明、排水設計、地下管線及施工整合等項目，不應僅以單一設施價格比較，更不應與量產型產品直接類比。請繼續往下閱讀...都發局說明，8座遮陽設施工程預算約4966萬元，另依公共工程規定編列設計監造費約991萬元。其中，遮陽設施本體、機電照明及排水等附屬設施的平均單座材料成本約146萬元，其餘則為整體公共工程所需的基礎設施、施工及相關配套費用。另設計監造費係依法獨立編列，在專業上非以全部計畫經費除以設施數量後，作為單一設施價格進行比較，以免造成誤解。都發局強調，信義計畫區為重要國際商業核心區，人流密集，相關設施除需具備遮陽降溫功能，也必須兼顧公共安全、都市景觀及後續維護管理需求。國際間有許多兼具公共藝術、環境調適與城市美學功能的遮陽設施案例，不僅改善步行環境，更成為城市特色地景與公共空間亮點。本案作為示範計畫，自規劃階段即以至少20年使用年限為目標，並從全生命週期成本角度進行設計。雖前期投入較高，但可有效降低未來更新及汰換頻率，追求的是更高的公共投資效益，而非一次性的短期建設。對於簡舒培質疑基本設計報告缺頁一事，都發局表示，因短時間內接獲議員大量索資，提供資料有頁面遺漏，已於當日補正完成。市府一向秉持公開透明原則，無需規避監督或隱匿資訊情事，本案預算均依公共工程及平均地權基金相關規定辦理，並經專業團隊規劃設計、預算編製及相關程序審查後提列。北市1座行人遮陽傘要740萬 簡舒培索資爆缺頁批市府「藏資料」    ,https://news.ltn.com.tw/news/politics/breakingnews/5480998
朝野立委訪美首站參訪台積電 協助排除投資障礙促進台美產業合作,政治,2026/06/23 12:27,立法院長韓國瑜應美國邀請率朝野立委訪美，首站抵達鳳凰城參訪台積電。（圖由立法院提供）立法院長韓國瑜應美國邀請率朝野立委訪美，首站抵達鳳凰城參訪台積電，立法院發出新聞稿表示，與會委員均高度關心台商赴美投資面臨之挑戰，除仔細聆聽廠商分享，亦表示將適時向美方相關機關反映，協助排除投資障礙，促進台美產業合作。立法院指出，立法院「赴美國推動國會外交」訪問團，美國鳳凰城時間6月22日下午前往台積電亞利桑那州廠參訪，抵達後首先與十餘家赴美投資之台積電供應鏈廠商座談交流，聽取業者分享在美設廠及營運情形，並就人才招募、法規調適、建廠成本及簽證申請等議題交換意見。請繼續往下閱讀...立法院表示，與會委員均高度關心台商赴美投資面臨之挑戰，除仔細聆聽廠商分享，亦表示將適時向美方相關機關反映，協助排除投資障礙，促進台美產業合作。立法院表示，訪團與TSMC Arizona執行長莊瑞萍及團隊會晤，瞭解台積電亞利桑那州建廠規劃，並就人才培育、技術與產能，以及赴美投資對台灣產業發展之影響等議題深入交流。莊瑞萍表示，台積電赴美投資主要係因應客戶需求，並強調最先進製程及核心研發仍將持續根留台灣。未來台積電將持續強化「技術領先、卓越製造、客戶信任」三大競爭優勢，與供應鏈夥伴攜手提升產業競爭力。    ,https://news.ltn.com.tw/news/politics/breakingnews/5480992
何欣純要成立青年局  「果食男子」品牌業者怒批：盧市府8年不聞問,政治,2026/06/23 12:26,民進黨台中市長參選人何欣純（中），由英國「世界柑橘果醬大賽」得主鍾文平（身右）等人陪同，發表三大青年新政。（記者黃旭磊攝）民進黨台中市長參選人何欣純，上午在南屯區市政辦公室由英國「世界柑橘果醬大賽」得主鍾文平等人陪同，發表「三大青年新政」，何欣純說，台中民眾有1/4是30歲以下年輕人，主政後要成立青年局，並提供兩百萬創業利息補貼。鍾文平與夥伴在台中創辦果醬品牌「果食男子」，去年以經典之作「柴焙龍眼琴酒葡萄柚」果醬，勇奪2025年英國《世界柑橘果醬大賽》，鍾文平在場批評，在西區美術館開店多年，去年以「台灣」名字在近4千瓶果醬品牌中拿獎，全世界只有3個拿到雙金獎，「台中市政府對我們不聞不問」，也沒補助，多透過民進黨部尋求農業部等資源；對此，台中市政府則表示不回應。請繼續往下閱讀...何欣純由本屆最年輕29歲北屯區議員參選人陳信秀、曾咨耀及南屯區市議員參選人張耀中，還有本屆議員張家銨、李天生等人陪同，發表三大青年新政，包括要成立青年局、提供青年創業兩百萬利息補貼及在29區成立創客中心。何欣純說，主政後將補貼青年創業及租金兩年，女性創業最高50萬元創業貸款，也要在豐原車站三號車庫、東勢林業文化園區、台鐵日式宿舍、清水文化園區及大里菸葉廠等閒置場地，由市府主責成立年輕人時尚創客基地，讓年輕人發光發亮。    ,https://news.ltn.com.tw/news/politics/breakingnews/5480969
鳳凰城參訪以神話故事妙喻 韓國瑜：台積電如奶油般帶來商機,政治,2026/06/23 12:25,立法院長韓國瑜應美國邀請率朝野立委訪美，首站抵達鳳凰城參訪台積電，並與鳳凰城台灣半導體供應商協會餐敘。（圖取自民眾黨立委洪毓祥FB）立法院長韓國瑜應美國邀請率朝野立委訪美，首站抵達鳳凰城參訪台積電，韓國瑜以神話故事妙喻，台積電就像奶油，帶領產業界到鳳凰城尋找商機。韓國瑜致詞時表示，在沒有來到鳳凰城之前，在台灣想到台積電，設計中心為何在亞利桑那而不是夏威夷，下班之後可以去游泳，新鮮的空氣、開開心心，不是非常好嗎？我們知道鳳凰城的投資條件，包括土地非常寬闊、水電完全不缺，更重要的是聽完產官學報告後才瞭解到一套有效率的官僚體系、合作友善且綜合性的大學，還有一群孜孜不倦吸引外資願意全身投入服務，這才是鳳凰城最引以為傲的條件。請繼續往下閱讀...韓國瑜指出，鳳凰城亞利桑那的學界、政府部門的一番說明，讓他想到一個神話故事，在古老的神話故事有一個暴君，誰反對他、他就把對方關到一個很高的塔裡面，由於塔太高沒有一個人能逃出來，最後有一個聰明人跑出來，因為他吃早餐的時候都留下一點奶油，抓到一隻螞蟻，並在螞蟻額頭上放一粒奶油、在螞蟻腿上綁絲線，絲線後面再綁更粗的繩子，螞蟻為了吃到奶油，必須不停的爬、從塔地爬到塔頂，最後繩子逐漸下來，這個人就順著繩子跑下來，非常聰明。韓國瑜說，台灣產業的那一滴奶油就是台積電，現在這個奶油選擇鳳凰城，後面很多產業界會跟著這個可貴且重要的大舉來到鳳凰城尋找商機。    ,https://news.ltn.com.tw/news/politics/breakingnews/5480977
新竹基地驚傳氣爆 陸勤部：廠商油地清洗起火、1工人受傷,政治,2026/06/23 12:20,新竹空軍基地傳出火警。（圖擷取自網路）新竹空軍基地今（23）日上午發生火警，現場濃煙竄上高空。陸軍後勤指揮部今天中午說明，是第三地支部新竹油料分庫委商實施油地清洗，疑因廠商施工過程中抽油機故障起火發生氣爆，1名工人受傷緊急送醫、無生命危險，軍方設施未損傷，詳細肇因由警消調查中。新竹空軍基地今天上午驚傳火警，民眾現場目睹巨量黑煙竄上高空。對此，陸勤部說明，轄屬第三地支部新竹油料分庫，在今天上午委商實施油池清洗，疑因廠商施工過程中抽油機故障起火發生氣爆，造成1名工人受傷，目前已送往台大醫院新竹分院醫治，無生命危險。請繼續往下閱讀...陸勤部表示，起火點於油槽外側，軍方設施未損傷。案經通報新竹市消防局前往救援，目前火勢已撲滅，後續將由警消實施調查事件發生原因。    ,https://news.ltn.com.tw/news/politics/breakingnews/5480982
聯手29國反制跨國鎮壓 賴總統祭3箭「制裁加害者」,政治,2026/06/23 12:12,賴總統今出席「全球合作暨訓練架構（GCTF）建構韌性民主以因應跨國鎮壓研討會」開幕典禮時表示，跨國鎮壓已是民主國家的共同挑戰，政府從「預防」、「保護」、「反制」三面向強化應對、完善法制。（圖由總統府提供）「全球合作暨訓練架構（GCTF）建構韌性民主以因應跨國鎮壓研討會」今日開幕，集結美、日、加、澳、英等29國專家。賴總統致詞表示，跨國鎮壓已是民主國家的共同挑戰，威權企圖藉此侵蝕主權、分化社會。對此，台灣建立跨部會機制，從「預防」、「保護」、「反制」三面向強化應對、完善法制，並持續與國際友盟攜手打造即時預警與有效究責的完整保護網。總統賴清德表示，我們身處充滿變動與挑戰的時代，民主國家所面對的威脅，已經超越傳統的軍事層面和地理疆界。威權主義透過新興科技與非法金流，進行系統性的跨國鎮壓、跨境監控、網路攻擊和資訊操弄，企圖分化社會、噤聲異議，侵蝕民主國家的主權，破壞社會的信任。請繼續往下閱讀...賴說，面對這樣的複合式挑戰，沒有任何國家能夠置身事外，也沒有任何國家應該單獨面對。當威權主義企圖輸出恐懼，民主社會就應該建立韌性；當威權勢力企圖分化團結，民主夥伴就應該攜手合作，這正是GCTF作為國際多邊合作架構的核心價值所在。2015年台灣和美國共同成立GCTF以來，迎來日本、澳洲、加拿大及英國相繼加入成為正式夥伴，持續促進全球合作。賴清德指出，台灣走過威權統治的黑暗歲月，深知自由與人權的可貴，因此積極推動數位民主和開放政府，並強化政府、公民社會和地方社區的協作，建構全社會防衛韌性並提升民主韌性。面對跨國鎮壓的挑戰，政府建立跨部會機制，全面檢討相關法制、強化應對作為，從「預防」、「保護」、「反制」三面向著手。賴清德指出，當前錯假訊息、認知作戰往往成為壓制異議者和分化社會的工具，政府透過跨部門合作、科技應用及建立即時澄清專區，提升國人對資訊事實的識別能力與安全警覺。對於境外遭跨境騷擾、恐嚇或鎮壓的國人，動員駐外館處網絡提供緊急協助與必要支援；對於境內國人，我們致力提供防護，也正完善法律體制，要讓加害者受到應有制裁。賴清德說，我們將加強國際交流合作，反制威權脅迫行為，歐洲議會這個月通過決議反制跨國鎮壓，台灣支持歐盟強化因應機制，也將持續與歐盟及其他理念相近國家，共同建立安全可信賴的資訊環境，打造更即時的預警、更有效的究責、更完整的保護網，來維護國家及國人安全。賴總統今出席「全球合作暨訓練架構（GCTF）建構韌性民主以因應跨國鎮壓研討會」開幕典禮，與美、日、加、澳、英等29國專家同台。（圖由總統府提供）    ,https://news.ltn.com.tw/news/politics/breakingnews/5480976
邱于珊被陳清龍逼退選  四叉貓：民眾黨根本沒在管制度,政治,2026/06/23 12:12,民眾黨台中市北屯區議員初選民調由邱于珊（右）勝出。（資料照）民眾黨台中市北屯區議員初選民調由邱于珊勝出，不過邱于珊今透露，昨天遭到民眾黨台中市黨部主委陳清龍要求退選，怒批「民調贏了卻被要求退選」。網紅「四叉貓」劉宇對此直言，民眾黨就是一個沒制度的政黨。邱于珊在臉書貼文指出，民調結果出來是她贏，不過陳清龍昨天卻找她談，希望她退選，邱坦言：「如果贏的人要退。如果輸的人還可以被徵召。那當初為什麼還要做民調？如果制度最後可以被推翻，那民調到底是在做給誰看？」請繼續往下閱讀...邱質疑「如果民調贏的人不能被尊重，那未來誰還願意相信制度？」抱怨「如果在最逆風的時候陪著民眾黨的人，最後卻成為最受傷的人，那基層還能相信什麼？」邱于珊痛心說，創黨主席柯文哲主席曾說「做對的事情，不要害怕」，她只希望，公平不要變成一句口號，制度不要只是一場形式，感嘆一個政黨可以輸掉選舉，但不能失去誠信。四叉貓分析邱于珊的臉書貼文，並諷刺地說：「整篇文章還在講相信制度相信柯文哲，民眾黨的黨主席現在是黃國昌好嘛！」四叉貓認為，民眾黨就是一個沒有制度的政黨，一切都是黨主席說了算，而此次地方選舉，民眾黨根本沒在管制度，不是安插空降就是讓給藍營選，已經氣跑好幾個候選人了。    ,https://news.ltn.com.tw/news/politics/breakingnews/5480883
李四川拜訪萬里基層 允推廣在地漁產、漁業觀光,政治,2026/06/23 12:02,國民黨新北市長參選人李四川出席萬里區青溪婦女會聯歡活動，與鄉親大合照。（圖由李四川競辦提供）國民黨新北市長參選人李四川今（23）日出席萬里區青溪婦女會聯歡活動，身為「討海人子弟」的李四川感性表示，每次來到萬里看到漁港跟海岸線風光，彷彿回到家一樣，他承諾當選後將持續提升漁港基礎建設，優化漁民作業環境，並結合漁業觀光，推廣享譽全國的「萬里蟹」等在地漁產，守護漁民權益及產業發展。今天活動現場包含眾多基層鄉親、民代及婦女會成員齊聚，李四川一抵達會場，許多鄉親熱情高喊「市長好」，並紛紛拿出小物，排隊向李四川索取簽名與合影，氣氛熱烈；短短的距離李四川走了3分鐘才進場，展現在北海岸的高人氣。請繼續往下閱讀...出身屏東小琉球漁村的李四川感性表示，每一次來到萬里，看到漁港的景象及漁民朋友打拚的身影，就彷彿回到了家，跟小時候看到的情景一模一樣。他也提到，過去擔任台北縣工務局長期間，與地方基層攜手闢建萬里地方道路，推動區公所興建，點點滴滴都是一同努力的見證，對萬里特別有感情。李四川說，農漁民與基層鄉親不分黨派，最在意的就是生活能溫飽、能過得更好，未來他會不分顏色，攜手各界共同為地方建設打拚。針對敬老卡升級政策，李四川指出，萬里地區的偏鄉長輩由於大眾交通運輸較少，過去使用敬老卡點數機會也較少，經常看得到、用不完，因此未來當選後他將落實「300點悠遊卡化」，讓萬里長輩可以拿點數到悠遊卡特約機構使用，像是診所就醫費用、藥局買保健品、超商買民生物品等，讓福利更貼近長輩的日常生活。國民黨新北市長參選人李四川前進萬里，受到大批婦女熱情歡迎。（圖由李四川競辦提供）國民黨新北市長參選人李四川前進萬里，有鄉親索取簽名和合照。（圖由李四川競辦提供）國民黨新北市長參選人李四川拜訪萬里基層，許多鄉親熱情高喊「市長好」。（圖由李四川競辦提供）    ,https://news.ltn.com.tw/news/politics/breakingnews/5480959
北市明年推無人自駕公車 吳欣岱批：將市民的生命安全當政治實驗品,政治,2026/06/23 12:01,吳欣岱表示，無人公車的載體本質是電動公車，在現有電動公車面臨「電池自燃、紅色資安漏洞、基礎設施匱乏」等病灶未解前，貿然推動無人自駕，無疑是將市民的生命安全與國家資安當作政治實驗品。（吳欣岱辦公室提供）台北市長蔣萬安昨宣布，2027年下半年在台北市15條公車專用道推動「無人自駕公車」。對此，台北市第二選區（內湖、南港）台灣基進議員參選人吳欣岱表示，蔣萬安的宣告充滿政治煙火與選票算計，無人公車的載體本質是電動公車，在現有電動公車面臨「電池自燃、紅色資安漏洞、基礎設施匱乏」等病灶未解前，貿然推動無人自駕，無疑是將市民的生命安全與國家資安當作政治實驗品。吳欣岱指出，台北市政府推行無人公車的首要病灶，是連「有人」的電動公車都會發生自燃爆炸，無人車的公安根本無人把關。她回顧去年6月，一輛大都會客運電動公車在敦化北路行進中突陷火海，所幸靠司機警覺才及時疏散車上7名乘客；而2024年台北也早有兩起儀表板起火冒煙的事件。身為心臟外科醫師，她深知生死往往只在幾秒之間。請繼續往下閱讀...吳欣岱說，市府至今對電池的強制汰換年限與健康度衰退停駛紅線依然渾沌不明。若在安全規範未到位的情況下，讓載著巨型鋰電池的車輛變成無人駕駛，一旦發生熱失控將淪為市區狂飆的不定時炸彈。吳也呼籲，蔣萬安應拿出首長擔當，偕同中央訂出全國統一的汰換與停駛標準，並落實第三方檢驗。除了公安危機，吳欣岱提到，即紅色供應鏈「木馬屠城」的資安漏洞，無人自駕車極度仰賴海量數據傳輸、遠端更新與全車攝影鏡頭，但北市議會早已揭露，北市公車中仍有「宇通集團」、「比亞迪」等具資安後門疑慮的中國品牌。若市府連現有電動公車的後台數據都無法防堵回傳中國，開放無人公車上路等同將首都高精地圖與市民行蹤赤裸裸攤在紅色監控網前。吳欣岱進一步表示，目前台北電動公車進度嚴重落後，原訂2030年全面電動化恐跳票延至2031年，台北市至今仍有近七成是老舊柴油車。市府由於調度站用地喬不定，東園社宅用地甚至被挪作中繼市場，逼到最後居然打算將造價千萬的高壓充電調度站，設置在華中橋堤外的行水區。面對極端氣候隨時有遭暴雨洪災淹沒的風險，連最基本的用地與台電契約容量都無法解決，專用道根本是荒謬至極。吳欣岱強調，客運業確實面臨高達三成的司機缺工潮，導致台北市三年來累積脫班裁罰破一千二百萬元，市民天天承受減班痛苦。但解決缺工的解方絕非丟出一個肇責法規未明、混流技術不成熟的無人公車來轉移焦點。她說，前市長柯文哲2020年的信義路自駕計畫最終便因技術卡關而無疾而終，蔣萬安不應急著喊出「全球示範基地」的口號，呼籲蔣萬安市長踏實執政，優先建立電池安全汰換機制、阻絕中製資安設備、解決充電站土地問題並改善現有司機的勞動環境，別為了連任將市民當成政治實驗品。    ,https://news.ltn.com.tw/news/politics/breakingnews/5480902
