Title,News_Type,date,content,url
金錢糾紛砸車洩憤！馬公男掌擊玻璃自傷還開嗆 警帶回保護管束,社會,2026/02/18 17:02,澎湖馬公蘇姓男子年初二凌晨砸毀車輛，還發文嗆聲。（記者劉禹慶翻攝）澎湖縣政府警察局馬公分局今（18）日凌晨3時30分接獲報案，指稱馬公市西衛宸威殿前有民眾砸毀車輛。警方立即趕赴現場，發現自小客車前後擋風玻璃遭毀損，隨即於周邊巡查，發現一名男子形跡可疑躲在巷內，經盤查確認為蘇姓男子（93年次）涉有重嫌。蘇男右手掌有明顯傷勢，並當場坦承徒手毀損車輛，警方於凌晨3時50分依規定管束帶返所偵辦。經查，蘇嫌供稱因與車主友人有金錢糾紛，一時情緒失控犯案；實際使用人已提出毀損告訴，全案依毀損罪函送偵辦。蘇嫌於後續警詢中坦承不諱。另經查，該車輛登記車主為劉姓男子，警方多次聯繫未果；目前實際使用人魏姓男子表示已向車主購買該車，但尚未辦理過戶，並已對蘇嫌提出毀損告訴。相關法律程序將持續辦理，並待通知登記車主到案釐清案情，以完備報案程序。請繼續往下閱讀...蘇男當時身上散發濃厚酒味，警方研判有暴力行為，為避免持續危害他人或自傷，依規定予以保護管束帶返派出所處理，並依法偵辦毀損案件。警方呼籲民眾遇有糾紛應循理性合法管道解決，切勿以身試法。    ,https://news.ltn.com.tw/news/society/breakingnews/5345728
警提醒春節須注意施放煙火擾民 否則違反社會秩序維護法,社會,2026/02/18 15:54,新北市警察局三峽分局當場制止施放煙火行為，迅速恢復現場秩序。（記者楊心慧翻攝）春節期間，民眾常施放煙火慶祝，但要注意應遵守相關法令規範，避免影響公共安寧與安全。新北市警察局三峽分局於2月16日晚間至17日凌晨間，接獲多起民眾報案，指三峽區清水街河堤一帶有人施放煙火，噪音擾民，影響周邊住戶安寧，警方獲報後立即啟動應處機制，當場制止施放行為，迅速恢復現場秩序。警方表示，處理過程中有名男子拒絕配合員警盤查，並企圖逃離現場，經員警追緝後依法帶返查證，確認其具合法居留身分，但該男抗拒執行公務行為已違反社會秩序維護法相關規定，警方依法製作筆錄並移送裁處，展現依法行政、嚴正執法立場。請繼續往下閱讀...此外，警方另於萬壽橋周邊查獲4名外籍移工，其中3人持合法居留證件，1人未能出示證件且拒配合查驗，經查為持觀光簽證逾期居留之失聯移工，全案依規定移請新北市專勤隊續行偵辦。三峽分局呼籲，民眾施放煙火應依相關法令規範辦理，切勿任意於公共場所施放，以免影響公共安寧與安全。警方也將持續強化查察與巡邏作為，確保轄區治安平穩，營造安心宜居的生活環境。    ,https://news.ltn.com.tw/news/society/breakingnews/5345691
扒手春節犯案 超商損失近兩萬警鎖定逃逸路線,社會,2026/02/18 15:40,便利商店遭竊的金額近2萬元。示意圖，圖與新聞事件無關。（資料照）農曆春節期間，各行各業上班人手較少，小偷專挑此時犯案，新北市警察局海山分局於今天上午8時許接獲報案，指板橋區一間便利商店於凌晨遭竊，共損失1萬9000元。警方獲報後立即受理，並調閱周邊監視器影像，積極展開追查，已鎖定嫌犯逃逸路線，全案依竊盜罪嫌移送新北地檢署偵辦。據了解，賴姓店員於今天上午6時許欲開門營業，卻發現商店大門敞開，遭竊取現金8600元、香菸70包、充電器1個，共損失約新台幣1萬9000元，賴姓店員立刻報警處裡，希望能盡快抓到兇手。請繼續往下閱讀...經鑑識小組到場採證，並擴大調閱周遭監視器畫面，現已鎖定犯嫌逃逸路線，目前正全力追緝中，全案後續將依竊盜罪嫌移送新北地檢署偵辦。    ,https://news.ltn.com.tw/news/society/breakingnews/5345683
大年初二「見紅」！高雄男夜騎電動滑板車自撞 路人：他騎超快,社會,2026/02/18 15:38,李姓男子夜騎電動滑板車在高雄港旁步道自撞。（警方提供）李姓男子今晨騎著電動滑板車經過愛河灣旁木棧道時，不明原因撞上防撞桿，滿臉是血、送醫救治幸無大礙；路人透露傷者當時騎好快，警方表示會進行酒測。高市苓雅警分局成功所說明，18日凌晨0時25分接獲通報，有人在冬日遊樂園旁跌倒，需要警方協助，所方立刻派員趕抵現場，發現有男子倒在地上，消防隊救護人員第一時間也到達現場進行緊急救護，一旁路人告訴警消「他騎好快」。請繼續往下閱讀...警方調查，李姓男子（47歲）當時騎乘電動滑板車經過碼頭步道，不明原因自撞防撞桿，李男上顎受傷，後由救護車協助送醫治療，意識清楚無大礙，後續會對李男進行酒測。警方呼籲用路人無論駕駛汽、機車或步行，皆須遵守道路交通規則，將持續宣導，並加強違規取締告發，以維護市民交通安全。李姓男子夜騎自撞受傷，滑板車也嚴重受損。（警方提供）    ,https://news.ltn.com.tw/news/society/breakingnews/5345678
幼童負氣離家愁困超商 中山警買麵包暖心助團圓,社會,2026/02/18 14:57,中山二派出所員警獲報趕抵，見男童又餓又怕，隨即自掏腰包購買麵包供其充飢並耐心安撫。（記者鄭景議翻攝）台北市中山區1名幼童年節前因與家人發生爭執，竟負氣離家出走，在寒冬中獨自躲在住家附近的超商座位區流淚。中山警分局中山二派出所員警獲報趕抵，見男童又餓又怕，隨即自掏腰包購買麵包供其充飢並耐心安撫，最後在附近大樓管理員指引下，順利協助心急如焚的母親找回愛子，讓母子平安團圓。北市中山警分局指出，中山二派出所日前接獲轄內超商報案，指稱有1名男童獨自在店內座位區坐了許久，神情無助且身邊無大人陪同，疑似走失。員警獲報立即趕赴現場關懷，發現該名男童因為年幼，無法清楚記住住家地址與聯絡電話，加上天冷想家，忍不住在店內紅了眼眶流下眼淚。請繼續往下閱讀...員警見狀隨即展現暖男一面，除了自掏腰包購買麵包讓男童果腹，更全程在旁溫柔陪伴聊天，成功穩定男童焦慮的情緒。正當警方準備進一步查詢男童身分時，男童母親在附近大樓管理員指引下，也焦急地趕到超商尋人。家屬向警方表示，孩子下午因為與家人口角，一時賭氣就趁人不注意跑出家門。當時室外氣溫偏低，男童不知道能去哪裡，只能躲進住家附近的超商避寒。母親見到孩子平安無事且正吃著警察買的麵包，激動地連連向警方致謝，由衷感謝員警在寒冬中及時伸出援手。中山警分局呼籲，家長應多加留意孩童動向，避免讓幼童獨自留在不易察覺的環境中，並建議可為幼童配戴防走失聯絡資訊名牌。民眾若發現疑似迷途或需要協助的孩童，請立即撥打110通報警方，共同守護孩童安全。    ,https://news.ltn.com.tw/news/society/breakingnews/5345661
驚險畫面曝光！父不滿幼童吵鬧大馬路上竟趕下車 警依法嚴辦,社會,2026/02/18 14:16,新北市新店區發生一名男子丟包小孩事件。（取自threads網友@nicoleweng15）新北市新店區中興路三段16日傍晚驚傳一名父親竟將幼童趕下車事件！新店警分局表示，本案雖無報案紀錄，但獲悉後，立即主動調閱路口監視器畫面展開追查，並聯繫車主及家長到案說明，將依法究辦。有網友在社群網站threads上po出行車記錄器影片，前面一輛車的駕駛竟將孩子拖出車外，並把車門關上，小孩則在大馬路上走動，過程相當驚險，令她相當憤慨，認為大人無論情緒如何不好，都不該丟小孩在路上。請繼續往下閱讀...警方調查發現，涉案駕駛為44歲張姓男子，因幼童在車上吵鬧，他當時竟將幼童趕下車後駛離，其母隨即下車追趕幼童。經調閱路口監視器及實地訪查，確認幼童後續安全無虞、未受傷害。相關情形已通報家防中心，將配合家防中心調查及協助相關事宜。據悉，張男與妻子過往都無虐童紀錄。新店警分局指出，後續將依兒童及少年福利與權益保障法第49條函請社會局裁罰；另有關交通違規部分，將依道路交通管理處罰條例第43條製單舉發，最高可裁處新台幣3萬6000元罰鍰。新店警分局呼籲，民眾如遇有類似婦幼案件，有幼童急需保護之情況，請立即撥打110通報警方到場協助，以免發生憾事。    ,https://news.ltn.com.tw/news/society/breakingnews/5345629
煙火餘燼未熄險釀禍 中和警眼尖發現撲滅化解危機,社會,2026/02/18 13:12,新北市中和區恐龍園區公園昨晚（17日）21時許，員警執行巡邏勤務期間，發現路旁疑有民眾施放煙火後未完全熄滅。（記者楊心慧翻攝）春節期間，民眾常在河堤或是公園內放鞭炮、煙火，但須注意是否未完全熄滅，否則恐有安全問題。新北市中和區恐龍園區公園昨晚（17日）21時許，員警執行巡邏勤務期間，發現路旁疑有民眾施放煙火後未完全熄滅，仍有殘留火苗，員警見狀立即取用巡邏車上滅火器進行撲滅處置，所幸未造成財損或傷亡。中和警分局指出，員警昨天（17日）21時許執行巡邏勤務行經轄內時，發現路旁疑似有民眾施放煙火後未完全熄滅，地面仍殘留火苗與餘燼，在夜間微風助長下，恐有延燒風險。請繼續往下閱讀...巡邏員警見狀不敢大意，立即取用巡邏車上配備的滅火器進行撲滅，同時通報119請消防人員到場支援。警消合作下迅速將殘火完全撲滅，並仔細檢視周邊草叢與地面餘燼，確認無復燃危險後才離開現場，成功化解一場可能擴大的火警意外。中和警分局呼籲，本案未造成人員傷亡或財物損失，但提醒民眾施放煙火後務必確認火源完全熄滅尤其天乾物燥或夜間風勢較大時，火星極易引燃周邊可燃物，稍有不慎便可能釀成災害。中和警分局強調，將持續加強巡邏勤務，守護社區安全，也呼籲民眾共同維護公共環境，避免類似情況再度發生。新北市中和區恐龍園區公園昨晚（17日）21時許，員警執行巡邏勤務期間，發現路旁疑有民眾施放煙火後未完全熄滅。（記者楊心慧翻攝）    ,https://news.ltn.com.tw/news/society/breakingnews/5345600
奇蹟生還！台東獨居翁墜山坡受困3日 靠「木棍引水」撐過死劫,社會,2026/02/18 13:04,池上鄉振興村一名老翁受困3日，池上分駐所救援。（記者黃明堂翻攝）在台東縣池上鄉的一個寧靜村落裡，一場與時間賽跑的生命救援行動過年期間上演。振興村一位獨居長者突然「人間蒸發」，鄰居連敲3日大門都無人回應，驚覺不妙趕緊報警。池上分駐所所長蔡欣妤與警員林泓成接報後火速趕往，今天在在一處山坡菜園內發現該名長者倒臥地面，他3天來在寒冷天氣中躺著靠一根木棍引流水桶的水止渴，撐住生命，被發現時意識清楚。關山分局表示，池上分駐所於今9時47分接獲民眾報案，指稱池上鄉振興村一處民宅內獨居長者連3日敲門均未有人回應，恐其發生意外，遂撥打池上聯合所電話求助警方。所長蔡欣妤與警員林泓成獲報後，立即趕赴現場查訪，惟於屋內也未發現長者蹤影，情況一度令人憂心。請繼續往下閱讀...警方隨即去電請振興村長林宗玉及地方民意代表潘旭瑞協同，擴大搜尋範圍，針對住家周邊逐一查看，並沿鄰近山坡與菜園仔細搜尋。最終在一處山坡菜園內發現該名長者倒臥地面，所幸意識清楚。長者表示，日前前往菜園巡視時不慎跌倒，因地勢偏僻、行動不便，無法自行起身，已在原地受困3日。鄰近有一個水桶，桶內有根木棍，水就沿著棍子流下，期間就靠這樣「舔水」維生，員警聽了都覺得不可思議。警方立即通報119，關山消防分隊迅速到場救援，現場檢測生命徵象穩定，僅體溫略高。但因地勢陡峭不易通行，警消人員合力以擔架固定傷者，步行抬送至道路旁救護車處，全程小心戒護，避免造成二次傷害，隨後送往關山慈濟醫院接受進一步診治。整起救援過程分工明確、配合順暢，展現地方團隊合作默契。池上聯合所所長蔡欣妤呼籲，若家中有獨居長者，家屬應多加關懷並保持聯繫，亦可與村里長及警方建立聯絡機制。池上鄉振興村一名老翁受困3日，靠木棍引水桶水維生。（記者黃明堂翻攝）    ,https://news.ltn.com.tw/news/society/breakingnews/5345598
竹市春節連假布建16部車上AI巡防系統  搭檔機動派出所守護治安,社會,2026/02/18 12:11,新竹市警局今年春節連假期間，結合AI巡防與機動派出所，雙管齊下守護地方治安。（竹市府提供）新竹市府警察局今年春節連假期間，出動16部車上「AI巡防系統」，布建在年貨大街、商圈、市場、廟宇以及熱門景點加強巡邏，可以即時做影像的辨識而做示警，搭檔機動派出所，主打在智慧科技輔助下，全面提升見警率，以「科技偵防」來守護治安。新竹市警察局長陳源輝說，他們從10日起到下週一（23日）為止，期間針對年貨採買熱點跟人潮聚集場所設置機動派出所，提供即時警政諮詢和各項便民服務。也如往年提供舉家外出市民的住居安全維護服務。請繼續往下閱讀...新竹市長高虹安要求，今年春節期間務必做到「治安平穩、交通順暢及民眾安心」，所以警局建置16部車上「AI巡防系統」，於春節期間，在年貨大街、商圈、市場、廟宇以及熱門景點加強巡邏、辨識以及警戒，並配套設置機動派出所，讓科技設備跟機動警力合作，使維護治安可以更即時且迅速、有效。新竹市警局今年春節連假期間，結合AI巡防與機動派出所，雙管齊下守護地方治安。（竹市府提供）    ,https://news.ltn.com.tw/news/society/breakingnews/5345570
喪屍煙彈氾濫暴增20倍！ 新北警「唾液快篩」42天抓832件毒駕,社會,2026/02/18 12:09,2025年11月20日毒品唾液快篩上路後，短短42天內，新北警即查獲毒駕案件832件。（新北市刑事警察大隊提供）俗稱喪屍煙彈的「依托咪酯」濫用情形急速升溫，據新北市警方統計顯示，2024年下半年查獲依托咪酯毒品案件133件，佔全般毒品案件3.85%；然而到2025年全年，查獲件數暴增至2740件，高達31.16%，顯示依托咪酯已成為近年成長最快的新興毒品之一，新北警「唾液快篩」2025年底上路後成效佳，42天抓832件毒駕，將持續採購毒品唾液快篩試劑，強化打擊毒駕作為。施用依托咪酯後常出現意識不清、突發性肌肉失衡及感知扭曲等症狀，行為難以預測，若仍執意駕駛上路，對其他用路人將造成重大威脅。請繼續往下閱讀...為強化防制毒駕，交通部與內政部已於2025年11月完成「違反道路交通管理事件統一裁罰基準及處理細則」修訂，明定可對駕駛人實施毒品唾液快篩檢測，並規範拒測處罰程序，必要時可當場移置保管車輛，達到人車分離效果，遏止潛在事故發生，相關措施自2025年11月20日正式上路。根據新北警數據顯示，新制實施後成效立現，自毒品唾液快篩上路至2025年底止，短短42天內，新北警即查獲毒駕案件832件，占2025年全年取締件數1769件的47%；今年迄今（截至2月12日止）已查獲602件。新北警表示，將持續採購毒品唾液快篩試劑，強化第一線執法量能，確保打擊毒駕作為不中斷。新北市刑大大隊長黃國師強調，毒駕已列為重點查緝項目，警方將持續高強度取締，呼籲駕駛人切勿心存僥倖，警方肩負維護治安重任，永遠站在守護市民安全的第一線。2025年11月20日毒品唾液快篩上路後，短短42天內，新北警即查獲毒駕案件832件。（新北市刑事警察大隊提供）    ,https://news.ltn.com.tw/news/society/breakingnews/5345573
迷途驚魂！初一晚山區失聯 三峽警消寒夜搜山救回釣客,社會,2026/02/18 11:45,新北市三峽警分局於晚間7時許接獲報案，指一名男子前往有木里舊橋頭周邊山區釣魚後失聯。（記者楊心慧翻攝）新北市三峽區昨（17）日晚間傳出山區迷途驚魂！三峽警分局於晚間7時許接獲報案，指稱一名男子下午獨自前往有木里舊橋頭周邊山區釣魚後失聯，家屬多次撥打電話始終無法聯繫，擔心入夜後山區危險重重，焦急報警求助；所幸晚間9時許，警消人員終於順利尋獲陳男，並一路陪同引導安全下山。據了解，54年次的陳姓男子於17日下午4時許獨自入山釣魚，未料天色轉暗後，因對地形不熟，加上山區光線不足，一時迷失方向；隨著夜色漸濃，山區氣溫下降，家屬憂心不已。請繼續往下閱讀...三峽分局插角派出所獲報後，所長陳明麟立即率警員魏昌隆趕赴現場，並結合消防與義消共10餘人展開搜救。夜間山區視線不佳、地勢崎嶇、夜間氣溫偏低，搜救人員分區縝密搜索，不敢有絲毫鬆懈。警消人員終於在21時許順利尋獲陳男，並一路陪同引導安全下山。經現場初步檢視，陳男意識清楚、行動無礙，身體沒有明顯外傷，無需送醫治療，家屬見到人平安歸來，這才放下心中大石，頻頻向警消表達感謝，感謝警消人員於春節期間仍迅速動員、積極搜救，最終平安帶回家人。三峽警分局提醒，民眾從事登山或山區活動前，務必事先規劃路線並告知親友行程，避免單獨入山，並留意日照與天候變化，確保通訊設備電量充足，以降低迷途風險、確保自身安全，尤其夜間山區氣溫驟降，極易發生失溫等危險情況，務必提高警覺。陳男最終獲救。（記者楊心慧翻攝）    ,https://news.ltn.com.tw/news/society/breakingnews/5345560
中正一分局春節進駐華山園區 機動派出所馬力全開反詐,社會,2026/02/18 11:29,中正第一分局為因應馬年春節連假，由忠孝東路派出所結合民防中隊進駐華山文創園區設置機動派出所。（記者鄭景議翻攝）台北市警局中正第一分局為因應馬年春節連假，由忠孝東路派出所結合民防中隊進駐華山文創園區設置機動派出所。警方今日指出，為落實今年度加強重要節日安全維護工作，現場除了強化巡守密度，更鎖定2026年盛行的AI深偽技術等新型詐騙加強宣導，提醒民眾在春節期間務必守住荷包，落實「馬路識詐、馬路守財」，讓大家能平安順遂迎新春。中正第一分局表示，春節前夕是詐騙與扒竊的高峰期，本次行動以治安平穩、交通順暢、民眾安心為3大主軸。根據最新統計，常見詐騙手法前4名依序為網路購物、假投資、解除分期付款及假交友；其中假投資詐騙的財損金額高居首位，占總財損超過6成以上。警方強調，2026年詐騙集團更結合AI與即時化技術，利用深偽視訊冒充親友，或誘導下載APP授權轉帳，手法日益精細導致財損增加迅速。請繼續往下閱讀...為此，忠孝東路派出所員警與民防夥伴在園區內積極宣導，呼籲民眾建立家庭通關密語以辨識身分，並堅持「不點連結」原則。警方提醒，凡是遇到要求金錢、個資或操作ATM、網銀，且出現「保證獲利」、「監管帳戶」、「緊急匯款」或「偵查不公開」等關鍵字，高機率就是詐騙，應立即掛斷並撥打165反詐專線或110報案電話查證。中正第一分局強調，春節期間警力與民力將持續結合，強化華山文創園區等人潮聚集處所的巡守工作，透過機動派出所的設置，提供即時的安全維護與諮詢服務。警方表示，守住財產安全就是守住團圓的喜氣，警方將用行動守護市民，確保馬年新春期間「財不外流」，讓市民安心逛街放心過年。    ,https://news.ltn.com.tw/news/society/breakingnews/5345534
台南南區小年夜汽車過彎失控逆向衝撞機車3人傷  親友上網徵求行車紀錄影片,社會,2026/02/18 11:26,事故現場可看到被撞到分成2截木的機車，可見衝擊力道之大。（記者劉婉君攝）台南市南區新建路上，15日小年夜深夜，發生一起轎車過彎時失控，逆向衝撞多部機車，造成3人受傷送醫，肇事原因警方調查釐清中，傷者親友上網徵求事發當時的行車紀錄器影片。根據民眾在網路上分享的畫面，肇事的轎車逆向擦撞行駛中的機車及衝撞停放在路旁的人車後停下，附近有民眾聽到「碰」的一聲巨響，跑出來查看，現場一片狼藉。請繼續往下閱讀...台南市第6分局交通分隊獲報前往處理，經查肇事轎車由新興路左轉新建路往南行駛時，因過彎失控，擦撞對向行駛中機車及路邊停放的人車，3名傷者均無生命危險，轎車駕駛酒測值為0且持照正常，肇事原因正由警方調查釐清中。現場今天還可看到有機車被撞成2截或是嚴重毀損，停在現場。當地店家表示，昨天到現場清掃，掃出一堆散落的機車零件，連柏油路面也被刮出幾道刮痕。    ,https://news.ltn.com.tw/news/society/breakingnews/5345542
4歲男童好奇進站走失 捷警貼心安撫護送見親母,社會,2026/02/18 10:58,捷運警察隊接獲報案後立即到場，除安撫男童情緒並同步調閱監視器畫面與廣播，隨後在站外連通道尋獲心急如焚的母親。（記者鄭景議翻攝）台北市1名4歲男童上週末與母親前往捷運亞東醫院站時，趁著母親在站外加值悠遊卡的空檔，因一時好奇竟跟隨其他旅客進站而走失。捷運警察隊接獲報案後立即到場，除安撫男童情緒並同步調閱監視器畫面與廣播，隨後在站外連通道尋獲心急如焚的母親，成功讓這對母子在短時間內平安團圓。捷運警察隊第四分隊指出，員警林憲聖日前在執行守望勤務時，接獲通報指稱亞東醫院站有男童走失。經了解，該名4歲男童與母親外出搭車，母親在出站後先至站外加值機加值，沒想到男童疑似被進站的人群吸引，竟獨自跟著其他乘客刷卡進站。所幸有熱心民眾在月台層發現男童落單，隨即將他帶往詢問處請求站務人員協助。請繼續往下閱讀...員警抵達後，發現男童神情焦慮且不斷張望，立即先行安撫其情緒，並與捷運公司站務人員合作，調閱站內監視器畫面確認男童移動動線。同時，警方也通報捷運公司進行全站廣播，並聯繫沿線各站確認是否有家長正在尋找孩童。不久後，員警果然在站外連通道發現正在四處奔尋、情緒激動的男童母親。母親見到孩子在警察陪同下平安無事，終於放下心中大石，對警方及熱心民眾的即時伸援表達由衷感謝。捷運警察隊呼籲，民眾攜帶孩童搭乘MRT時，務必隨時留意孩童動向，避免短暫分離造成危險。警方建議，家長可於孩童隨身物品放置聯絡資訊，或配戴親屬聯絡名牌，若不慎走失應立即撥打110或尋求站務人員協助，警方將第1時間介入確保孩童安全。    ,https://news.ltn.com.tw/news/society/breakingnews/5345516
