Title,News_Type,date,content,url
鄭麗文訪美僑宴傳邀「中國僑胞」 綠委：死忠韓粉也不想挺她,政治,2026/05/13 11:47,國民黨主席鄭麗文。（資料照）國民黨主席鄭麗文6月將啟程訪美，本報揭露，此行長達14天，堪比「總統候選人」訪美規格，還希望僑界幫忙買單食宿、交通，讓僑胞抱怨連連，更歡迎「中國僑胞」參加。對此，民進黨立委許智傑認為，國民黨阻擋1.25兆國防特別預算，也讓許多不分藍綠的旅外台僑難以認同，連以往死忠支持國民黨的韓粉也不想歡迎鄭麗文，才會傳出連中國僑胞也歡迎的傳聞。本報掌握，鄭麗文這次訪美的僑宴，不只歡迎中華民國的僑胞參加，也歡迎「中國僑胞」參加；而且非典型行程，可能會安排鄭麗文與留學生座談，屆時可能不只有台灣留學生，也會有中國留學生參與。僑胞說，黨部表示，鄭麗文「大陸的粉絲很多」，所以歡迎他們參與。請繼續往下閱讀...許智傑分析，國民黨這次阻擋1.25兆國防特別預算，引發美國及全世界民主國家的反感，也讓許多不分藍綠的旅外台僑難以認同，連以往死忠支持國民黨的韓粉也不想歡迎鄭麗文，所以才會傳出連中國僑胞也歡迎的傳聞，可見國民黨已失去廣泛民眾的支持，未來鄭麗文路線恐怕會越來越傾中。    ,https://news.ltn.com.tw/news/politics/breakingnews/5435336
台灣攜手歐盟 於史瓦帝尼啟動「山羊產業提升計畫」,政治,2026/05/13 11:46,國合會與史瓦帝尼政府、歐盟及多個發展夥伴攜手合作，本月8日在史瓦帝尼喬治飯店正式啟動「山羊產業提升計畫」。（國合會提供）國合會與史瓦帝尼政府、歐盟及多個發展夥伴攜手合作，本月8日在史瓦帝尼喬治飯店正式啟動「山羊產業提升計畫」，將透過提升山羊生產效率、優化產業價值鏈，及推動畜牧產業商業化發展，協助改善史瓦帝尼農村生計並強化糧食安全。國合會指出，啟動儀式當天，史瓦帝尼曼齊尼區行政長官Prince Gija Dlamini酋長、史國參議院議長Lindiwe Gwebu-Dlamini、農業部長Mandla Tshawuka、歐盟政治參事馬塔（Jose Bacerra Marta）、我國駐史瓦帝尼大使梁洪昇、國合會駐史瓦帝尼技術團團長薛烜坪等人皆親自出席，見證史瓦帝尼畜牧產業發展邁向新的里程碑。請繼續往下閱讀...國合會駐史瓦帝尼技術團計畫經理簡志豪說明，史瓦帝尼目前山羊數量約為52萬5千隻，多數仍採傳統共同放牧方式飼養，產業長期面臨育種體系不足、營養條件不佳、幼羊死亡率偏高、市場供應不穩定及家畜竊盜等挑戰。本計畫將推廣人工授精技術、飼料作物生產、疫苗接種及商業化養殖模式，逐步提升產業韌性與永續發展能力，並將透過改良育種、動物健康管理、農民培訓、營養支持及市場鏈結等措施，全面提升產業效能與農民收益。梁洪昇於啟動儀式致詞表示，本計畫延續過去水產養殖、養豬及果樹計畫等的成功經驗，進一步帶動農村發展與經濟賦權。代表歐盟發言的馬塔則宣布，歐盟將與台灣合作，透過設備採購支持史瓦帝尼建立山羊人工授精中心，提升育種能力與產業競爭力。史國參議院議長Gwebu-Dlamini對本計畫表達高度肯定，鼓勵婦女與青年積極投入山羊養殖等農業產業，強調農業是推動經濟成長與農村發展的重要引擎。國合會副秘書長謝佩芬表示，本計畫為臺史雙方重要策略合作項目，計畫期程自2026年至2030年，核心目標為設立「國家山羊繁殖中心」、引進優良種羊、強化現代化畜牧管理系統，並於史瓦帝尼全國設立衛星育種場，期待為史瓦帝尼畜牧產業轉型注入新動能。歐盟政治參事馬塔（Jose Bacerra Marta）於「山羊產業提升計畫」啟動儀式致詞。（國合會提供）我國駐史瓦帝尼大使梁洪昇於「山羊產業提升計畫」啟動儀式致詞。（國合會提供）    ,https://news.ltn.com.tw/news/politics/breakingnews/5435338
憂台灣遭中國滲透 許美華曝「這句話」該貼在立法院門口,政治,2026/05/13 11:43,許美華表示，台灣真正的危機從來就不是來自外部，而是內部被中國滲透。（法新社資料照）立法院會8日三讀通過國防特別條例，藍白挾人數優勢下，匡列上限新台幣7800億元，但排除商購及委製案項。對此「紫光奇遊團」成員許美華表示，台灣真正的危機是內部被中國滲透，隱藏在國家內部從事顛覆工作的「第五縱隊」內應現就在立法院。許美華13日在社群媒體Threads發布貼文稱，「我繳稅不是為了養共匪」，這句話應該貼在立法院門口，還有每個藍白立委的家門口。請繼續往下閱讀...許美華進一步在貼文下方留言指出，台灣真正的危機從來就不是來自外部，而是內部被中國滲透。並直言，「現在最大的第五縱隊內應就在立法院。」網友紛紛回應貼文稱，「我也覺得這一張應該印出來當春聯」、「挺台灣」、「這也體現人民素質不高，投出一群賣國賊」。     在 Threads 查看    ,https://news.ltn.com.tw/news/politics/breakingnews/5435201
銘傳教師被爆課堂吹捧中國、教材全是抖音 沈榮欽：校方放任才是真問題,政治,2026/05/13 11:41,有學生在社群平台爆料，銘傳大學通識教師吳惠巧在課堂上為中國從事政治宣傳，還搞錯美國訪中人選、說錯美國國務卿權責、說錯中國取消美國國務卿訪中班機來彰顯中國的偉大、說錯川習已經會面，說錯台灣要與大陸戰爭等等。示意圖。（銘傳大學提供）有學生在社群平台爆料，銘傳大學通識教師吳惠巧在課堂上為中國從事政治宣傳，還搞錯美國訪中人選、說錯美國國務卿權責、說錯中國取消美國國務卿訪中班機來彰顯中國的偉大、說錯川習已經會面，說錯台灣要與大陸戰爭等等。對此，加拿大約克大學副教授沈榮欽表示，吳惠巧醜化美國和台灣來彰顯中國偉大，刻意讓自己的課堂成為中共敘事的宣傳平台，才導致低劣的教學品質，成為中共統戰的一部分。沈榮欽在臉書PO文表示，銘傳大學通識教師吳惠巧在課堂親中反美貶台的言論被學生錄下放在脆引發爭議，關鍵不僅是吳惠巧課堂為中國從事政治宣傳，而是她課堂所說的事實都是錯誤的，例如搞錯美國訪中人選、說錯美國國務卿權責、說錯中國取消美國國務卿訪中班機來彰顯中國的偉大、說錯川習已經會面，說錯台灣要與大陸戰爭等等。請繼續往下閱讀...沈榮欽指出，吳惠巧的上課內容，讓我覺得她雖然是師範大學政治學博士，但似乎對於國際政治一無所知，和那些看抖音認識世界的人並無二致。直到我看到 Dcard 上她的學生評論，才證實這點，吳惠巧銘傳的學生抱怨，上她的「社會問題分析」不僅毫無內容、瘋狂跳針，而且教材用的都是抖音和中國連續劇，聲音還開得巨大，彷彿中國大媽在菜市場討價還價，讓學生上完課耳朵都感到嗡嗡作響。沈榮欽續指，這段話也引起上吳惠巧另一門課「人與宗教」的學生共鳴，說這是她的常態，她在銘傳上的課都是如此。而且後來吳惠巧看到這段批評，除了在課堂發脾氣，卻依舊故我一點不改，校方也不處理，這才是問題所在。沈榮欽直言，吳惠巧的上課內容並不是經過廣泛閱讀與系統性分析而來，而是從抖音吸收「知識」，把抖音虛構的中國宣傳當成真實發生的事件，醜化美國和台灣來彰顯中國偉大，刻意讓自己的課堂成為中共敘事的宣傳平台，才導致低劣的教學品質，成為中共統戰的一部分。     在 Threads 查看    ,https://news.ltn.com.tw/news/politics/breakingnews/5435300
賴清德再缺席彈劾審查會！ 藍白委輪番砲轟「民選皇帝」 批府院聯手搞新三不,政治,2026/05/13 11:39,立法院今天進行第二次對總統提出彈劾案審查會，並邀請總統賴清德列席，賴繼第一次審查會缺席後，今天同樣未現身立院，民進黨團也集體抵制。（記者王藝菘攝）立法院今天進行第二次對總統提出彈劾案審查會，並邀請總統賴清德列席，賴繼第一次審查會缺席後，今天同樣未現身立院，民進黨團也集體抵制。藍白立委輪番上台砲轟賴政府傲慢，直指台灣出現「民選皇帝」，更痛批聯手行政院大搞「不副署、不公布、不執行」新三不運動凌駕憲法。藍白委強調，檢調已淪為執政者的刀與盾，立法院絕非總統府的橡皮圖章，呼籲民眾支持彈劾案。立法院副院長江啟臣今天主持彈劾案審查會，江啟臣在審查會開始時表示，立法院依「立法院職權行使法第43條」規定及第4會期第15次會議決定，邀請被彈劾人總統賴清德進行第二次說明，經聯繫，總統府表示，總統不列席此次全院委員會；依照共識，5月13日、14日繼續審查賴清德彈劾案，若被彈劾人賴清德未列席，由各黨團推派委員發言；由於綠營也未出席，因此審查會由藍白各自推派立委上台發表審查意見。請繼續往下閱讀...藍委羅智強發言時說，要從聶永真最新出爐的綠色名言「合法的飯真香」，這種正義凜然的貪婪，背後正是民進黨執政10年的底氣，綠營最可怕的不只是貪婪，而是「我就是貪、我就是壞、我就是藐視國會、司法清算、收買媒體、賤賣憲法你要怎樣？」而所謂「合法的飯」其實一點都不合法，其涉及背信、圖利甚至貪污，只因綠營打造「辦在野、不辦執政」的檢調體系，只要檢調不辦，就會變成合法的飯，讓檢調淪為執政者的刀與盾。藍委賴士葆指出，賴清德沒到場、民進黨團集體缺席，理由是「彈劾不會過只是一場鬧劇」，按照這個邏輯的話，那請問為什麼行政院長卓榮泰要提覆議八次，卻屢敗屢戰、屢戰屢敗。賴明知國會席次居於少數，卻不謙卑、不向人民低頭，仍一意孤行、蠻幹硬幹。他更直言，目前為止台灣選出一個「民選皇帝」，除了立法院仍保有些許制衡力量外，其餘各院幾乎全面內閣化。白委王安祥表示，賴清德未親自到場，但他仍準備國家能源及不副署兩項議題，希望賴思考。民眾黨提重啟核電公投及《核管法》修法時曾遭大量批評，如今賴政府卻也決定重啟核電，並稱立院通過的法案就必須施行，但目前仍有許多法案處於不公布、不副署狀態，形同違憲，「政府一邊稱不缺電，一邊調漲電價、讓企業面臨斷電風險，最後受苦的還是人民」，此次提出彈劾，就是要對傲慢政府發出警告。藍委陳菁徽則說，賴是現行憲政體制下，首位讓彈劾案在立院正式成案並排入表決議程的總統，這代表人民對政府施政、行政權不尊重國會與民意已忍無可忍，賴領取高薪、享有最多資源，卻對辛苦的護理師說出「羨慕護理師工作」等言論，直言「只要不同意賴政府，就被貼標籤、被抹黑抹紅」，甚至與行政院聯手形成「不副署、不公布、不執行」的新三不運動，總統不是選上就能凌駕憲法，立法院也不是總統府的橡皮圖章，並呼籲民眾支持彈劾案。    ,https://news.ltn.com.tw/news/politics/breakingnews/5435321
不陪藍白搞彈劾總統大戲！民進黨團：連韓國瑜都覺得不值得主持,政治,2026/05/13 11:28,民進黨團幹事長莊瑞雄（中）、書記長范雲（右）、立委黃捷（左）。（記者王藝菘攝）由藍白發動的總統彈劾案將於5月19日舉行投票，立法院將於今、明兩日進行第二次全院委員會審查；賴總統、民進黨團皆未出席。民進黨團今召開記者會批判，今天這場政治大戲已經淪為「罵賴清德總統的比賽」，這種兒戲民進黨團就不奉陪了，況且連立法院長韓國瑜都覺得此政治大戲不值得參與、主持，已帶隊十個立委到歐洲訪問。黨團幹事長莊瑞雄表示，民主進步黨當然不會去陪在野黨朋友的這場鬥爭大戲，國民黨最喜歡講賴清德「毀憲又亂政」，但真正讓整個憲政制度癱瘓的，國人同胞都很清楚，正是國民黨封殺憲法法庭大法官人選，造成整體制度運作窒礙難行請繼續往下閱讀...「總統到底要不要到國會裡面來？」莊瑞雄說，相信賴總統有他自己的考量，如果整個事件是從鬥爭開始，每天罵，罵得不夠，還要從立法院來發起彈劾，不管是社會大眾或站在執政黨的立場，這種戲民進黨團就不奉陪了。莊瑞雄提及，國民黨主席鄭麗文赴中訪問前還要求，與賴總統見面，希望可以為朝野對立降溫；國民黨立法院黨團卻發動彈劾案。彈劾程序在整個憲政設計裡面是多嚴肅的一件事，這種兒戲民主進步黨當然就不奉陪了。莊瑞雄強調，現在立法院應關注的，符合民眾期待的是總預算趕快去排審；此外，海馬士（HIMARS）系統五月底付款期限將至，立法院怎麼樣去解決付款問題，才是民眾希望立法院能多一點點的作為，不然每天淪為這樣的政治鬥爭跟口水，這種政治攻防意義不大。書記長范雲也批判，今天這場政治大戲已經淪為「罵賴清德總統的比賽」，連韓國瑜院長都覺得不值得他主持，所以韓帶隊超過十個立委到歐洲訪問，連韓都覺得政治大戲不值得參與、不值得主持。    ,https://news.ltn.com.tw/news/politics/breakingnews/5435302
富察出獄後須服1年附加刑？國台辦：依法執行刑法,政治,2026/05/13 11:27,八旗文化總編輯富察出獄是否須執行1年附加刑？中國國台辦發言人張晗今日表示，「李延賀案犯罪事實清楚，司法機關依法公開開庭審理，也將依法執行刑法」。（翻攝直播）八旗文化總編輯「富察」李延賀被控犯下「煽動分裂國家罪」，遭中國判處有期徒刑3年、剝奪政治權利1年。據透露，富察將於今年5月出獄，恐因附加刑無法返台；對於富察出獄後是否須執行1年附加刑？中國國台辦發言人張晗今日回應，「李延賀案犯罪事實清楚，司法機關依法公開開庭審理，也將依法執行刑法」。來台多年、具滿族血統的富察已取得台灣身分證，2023年3月他返回上海辦理註銷中國「戶籍」時，遭中共國安單位「秘密拘捕」關押，被捕原因涉及八旗文化出版許多違背中共史觀，以及與中共意識型態相左的書籍。請繼續往下閱讀...2025年2月，上海市第一中級人民法院一審宣判，以「煽動分裂國家罪」判處富察有期徒刑3年、剝奪政治權利1年，並處沒收個人財產人民幣5萬元。今年3月，中國兩會期間，中國最高人民法院、最高人民檢察院「兩高」報告則提到，「貫徹反分裂國家法，嚴懲台獨頑固份子。對煽動分裂國家、破壞國家統一的李延賀依法定罪判刑」。富察被捕至今關押逾3年，針對富察具體出獄時間，以及出獄後是否需執行附加刑1年？張晗在國台辦記者會表示，李延賀案犯罪事實清楚，司法機關依法公開開庭審理，也將依法執行刑法。島內個別媒體一再翻炒司法個案，汙衊抹黑中國司法體制，居心叵測。根據「中華人民共和國刑法」，剝奪政治權利屬「附加刑罰」，適用對象為危害國家安全的罪犯、無期徒刑及死刑犯等。在中國，剝奪項目包含選舉及被選舉權；言論、出版、集會、結社、遊行和示威自由；擔任國家機關職務權利；以及擔任國企、企業、事業單位和人民團體領導的權利。剝奪政治權利之刑期，從有期徒刑執行完畢日起算，中國政府可限制當事人出境。    ,https://news.ltn.com.tw/news/politics/breakingnews/5435284
翁曉玲亂湊LOGO酸聶永真「御用設計師」 慘遭本人打臉,政治,2026/05/13 11:26,平面設計師聶永真因操刀台電LOGO改版，引發議論。（中央社資料照）國內知名平面設計師聶永真因台電LOGO改版陷入爭議，國民黨立委翁曉玲昨（12）日在社群平台列出一系列公部門識別，直言不只台電一案，聶永真過去幾年已操刀改造多個政府機關LOGO，痛批這是花公帑做不必要的「面子工程」。不料，隨即遭聶永真打臉，稱抓錯資料，「抓到其他設計團隊作品囉！」翁曉玲在Threads列出監察院、經濟部、交通部觀光署、數位發展部、經濟部國際貿易署等機關識別設計，並揶揄說「民進黨執政下的標案常客『永真急制』」、「看的出他是民進黨政府鍾愛的御用設計師」。請繼續往下閱讀...翁曉玲質疑，「這些LOGO字體是同一套模板？」，「這些設計是否別出心裁、有特色？乃見仁見智。」「讓大家不滿的是，像監察院、經濟部、交通部觀光署等機關，是有必要花公帑去做不必要的『面子工程』、『形象工程』嗎？」該發文引發網友討論，聶永真本人也留言回應：「資料抓錯了啦，抓到其他設計團隊作品囉（一樣都好美）。」網友目睹這番情景紛紛留言稱「臉好腫喔」，「在造謠喔」，「你人很好還提醒她」，「官方吐槽最致命」，「好丟臉，真的很討厭這種政治人物」。據了解，在翁曉玲列出的政府部門LOGO設計中，交通部觀光署的台灣觀光品牌3.0版「TAIWAN– Waves of Wonder」（台灣魅力．驚喜無限），並非由聶永真團隊設計，而是由國際金獎設計團隊Bito操刀設計。國民黨立委翁曉玲貼出多個政府部門的LOGO，揶揄聶永真是民進黨「御用設計師」。（圖擷取自翁曉玲Threads）    ,https://news.ltn.com.tw/news/politics/breakingnews/5435157
選出中國代理人當市長？ 杜奕瑾示警：中國滲透早已深入地方政治,政治,2026/05/13 11:24,丹轆省班班市的前華裔市長郭華萍。（歐新社資料照）台灣人工智慧實驗室創辦人杜奕瑾表示，全球民主國家近年陸續警覺，中國對地方政治的滲透，已從傳統情報戰轉向更隱蔽的「灰色地帶作戰」。不再只是間諜活動，而是透過商業投資、地方社團、媒體宣傳、假訊息、地下金流及地方選舉等方式，逐步深入民主體系，甚至有人成功當上市長、議員。其中最受矚目的案例發生在菲律賓。丹轆省班班市（Bamban）前華裔市長郭華萍（Alice Guo）遭菲律賓國會調查發現身分背景疑點重重，除指紋與中國籍人士吻合外，還涉嫌與中國博弈園區、詐騙、地下金流及人口販運網絡有關。菲國參議員更公開指控她是「中國代理人」，郭華萍之後逃亡海外遭逮捕，引發國際關注。請繼續往下閱讀...美國近年也出現類似案件。南加州阿凱迪亞市（Arcadia）的華裔市長王愛琳（Eileen Wang）於2026年遭美國司法部起訴，檢方指控她長期替中國政府從事政治宣傳，卻未依《外國代理人登記法》申報，還涉嫌協助中國在美華人社群操作輿論，最後辭職認罪。此外，加拿大、澳洲及紐西蘭近年也相繼示警，中國透過僑界、社團、政治獻金與商業利益，長期建立地方政治影響力。「而台灣，其實早已站在這場滲透戰的最前線。」近年檢調已破獲多起涉及中國資金、地下匯兌、統戰組織、假訊息與地方政治人物案件，從宮廟系統、地方社團到招待里長赴中皆遭關注。台灣近年查獲多起與東南亞詐騙園區有關的案件，其中包括涉及柬埔寨詐騙園區首腦、人口販運與跨境洗錢、器官交易網絡，透過美台協力追查竟然首腦網路在台灣。檢警調查發現，部分詐騙集團背後不僅有中國地下金流體系，更與跨國犯罪、灰色金融及資訊操作網絡交織。這些組織利用台灣民主社會的開放性，建立資金、人脈與地方關係，滲透地方政治與社會組織。平常詐騙、選舉時資助特定人士。相關案例顯示，中國政治滲透已從高層外交轉向地方治理。由於地方政治安全審查較弱、媒體關注較少，加上人脈網絡緊密，成為建立長期影響力的重要入口。聽命於中國 加州華裔市長認罪菲「共諜」市長 人口販運判無期徒刑    ,https://news.ltn.com.tw/news/politics/breakingnews/5435171
民進黨選對會拍板！沈伯洋參選台北市長 上陣對決蔣萬安,政治,2026/05/13 11:16,民進黨選舉對策委員會今天拍板，建議徵召不分區立委沈伯洋參選台北市長。（記者田裕華攝）布局年底百里侯爭霸，民進黨選舉對策委員會今天（13日）上午達成決議，將徵召不分區立委沈伯洋參選台北市長，並提報下午民進黨中執會完成徵召程序。據規劃，中執會後，將由兼任黨主席的總統賴清德召開提名記者會公布人選，並為沈伯洋繫上競選背帶，正式上陣挑戰現任市長蔣萬安。據轉述，選對會今天達成一致決議，將建請中執會徵召沈伯洋，代表民進黨參選台北市的市長。至於目前尚未定奪的新竹縣長提名，以及原提名爭取連任的澎湖縣長陳光復因傷病傳出變數，選對會持續討論但未達成共識，對於後續提名也未設時間表。請繼續往下閱讀...據了解，沈伯洋早於今年三月便積極部署。在競選團隊架構上，由深諳輿情攻防的政策會執行長吳思瑤出任總幹事，同額登記角逐台北市黨部主委的立委吳沛憶擔綱執行總幹事，對接市黨部的輔選量能，負責基層組織與活動。政策面則由熟稔教育文化、兒少權益的不分區立委陳培瑜操刀，後續文宣也會與相關政策及活動進行協作。為強化選戰基本功，沈伯洋團隊目前已舉行十餘場籌備會議。同時，沈近期積極拜會產官學研單位，並盤整檢視台北市議會近年的質詢資料，運用AI建立市政治理的資料庫，將學術研究的嚴謹態度落實為政策主張，力拚一登場便能展示火力。陳培瑜今受訪說明，團隊請教了非常多專家學者，而市政發展願景的落實，必須建立在市民對於台北市的想像之上。因此，第一是先傾聽市民的需求；第二是想像政策可以如何落實，而非打高空的狀態。第三是關於AI的部分，主要是透過比較數據整理，確實地理解從柯文哲執政八年到蔣萬安兩年多以來，台北市為何停滯不前、沒有往前發展，以及團隊未來還可以做哪些事情。    ,https://news.ltn.com.tw/news/politics/breakingnews/5435263
