Title,News_Type,date,content,url
收賴清德春聯嫌棄「誰愛誰拿去」 網友批藍委林倩綺「沒品」,政治,2026/01/22 17:13,國民黨立委林倩綺。（資料照）農曆新年即將到來，各單位及政治人物紛紛發送春聯祝賀，不過國民黨立委林倩綺昨（21日）收到總統賴清德的春聯後，在社群平台嫌棄的說，「誰愛誰拿去」，引起大量網友批評，「一個立委做成這樣也是蠻沒品的」。林倩綺在Threads發文表示，「昨天收到一疊賴總統的春聯，誰愛誰拿去。（青鳥留言+1 我多送一張）」，不過卻引來大量網友怒罵。請繼續往下閱讀...貼文曝光後，網友紛紛表示，「一個立委做成這樣也是蠻沒品的，還沒聽過綠的拿到藍營春聯會像你這樣講話」、「送賴總統春聯大概是你唯一政績」、「無論政治立場，對總統印發的春聯說誰愛誰拿去，真的很沒禮貌」、「原住民夠辛苦了，還有妳這種愛戰網友的無名立委」、「拜託，妳看看妳自己印有誰要拿妳的！一個不有名又不做事的立法委員」。也有網友認為，林倩綺的貼文相當沒格局，「我以為每個國家的立法委員基本概念是要尊重總統，請問現在是立法委員要帶頭撕裂社會嗎？」、「真的是把自己的格局給做小了，跟你同阿美族我覺得有夠丟臉」、「唉......立委還這麼沒品，格局啊！」，網友留言的讚數高達1.5萬，已經遠超過原貼文的6百多讚。對此，面對網友批評，林倩綺也留言回覆，「哇那我們還住在同個土地上，你可能要忍一下了」、「愛拿不拿隨便你」、「沒關係，多印也不會給你」，讓網友相當傻眼。     在 Threads 查看網友紛紛砲轟林倩綺。（擷取自Threads）    ,https://news.ltn.com.tw/news/politics/breakingnews/5318696
在台港人泰拳工作室遭潑漆恐嚇 陸委會：中共唆使2嫌跨境鎮壓,政治,2026/01/22 17:11,陸委會副主委梁文傑說，中共指揮香港人士來台進行跨境鎮壓，嚴正警告任何協力者，若配合中共對台滲透威脅，政府一定依法嚴懲、絕不寬貸。（記者陳鈺馥攝）陸委會今天揭露，曾參與反送中運動的香港維權人士「赴湯」湯偉雄，去年11月遭香港特區政府通緝，詭異的是，在通緝發布後3天，他在台灣的泰拳工作室遭人切斷監視器、潑漆，警方掌握2名港人涉有重嫌。陸委會副主委梁文傑今天強調，中共指揮香港人士來台進行跨境鎮壓，嚴正警告任何協力者，若配合中共對台滲透威脅，政府一定依法嚴懲、絕不寬貸。陸委會今天召開例行記者會，梁文傑說，去年11月下旬，湯偉雄的泰拳工作室大門和牆面被潑紅漆，全案經警方追查，已鎖定兩名香港人士涉有重嫌。我方掌握一男一女，這兩名港人佯裝要學泰拳，於作案前到現場勘查地形，再切斷監視器、潑紅漆，犯案後立刻從桃園機場出境返回香港。請繼續往下閱讀...梁文傑指出，湯偉雄是參與香港反送中的著名人士，去年11月20日遭港府通緝，在發布通緝3天後就發生這樣的案件，相信有一定關聯。嫌犯目的在警告湯偉雄，使其心生恐懼，同時也是恐嚇其他在台港人。梁文傑強調，政府對這起跨境鎮壓案件完全掌握，全力偵辦。他強調，中共指揮香港人士來台跨境鎮壓，政府持續守護國人及在台民眾安全，嚴正警告任何協力者，若配合中共對台滲透及威脅，政府一定依法嚴懲、絕不寬貸。    ,https://news.ltn.com.tw/news/politics/breakingnews/5318795
民眾黨「金釵」獲黨提名喜發文 黃國昌留言1句話慘被酸爆,政治,2026/01/22 16:52,民眾黨提名林子宇（左1）為新北市第五選區（板橋）市議員參選人。（資料照）被外界列為黃國昌四大金釵之一的林子宇，昨獲民眾黨提名為新北市第五選區（板橋）市議員參選人。林子宇昨日在臉書發文宣布喜訊，民眾黨主席黃國昌在下方留言「一定要上、一定會上」，還表示「請看簡訊，有重要工作」結果慘遭網友狠酸。林子宇昨日在臉書發文表示，板橋需要一位行動快、敢監督、會做事的市議員，她已經正式獲得民眾黨提名，她也已經準備好了，會秉持「少年好央叫」的精神與使命感，站在第一線，為市民朋友服務。請繼續往下閱讀...貼文下方，黃國昌現身留言表示：「加油，一定要上、一定會上。」不過他又接著說：「BTW，請看簡訊，有重要工作。」林子宇則回應：「貴黨真硬。」而黃國昌一現身，立刻引發網友批評。網友紛紛留言：「上土城看守所嗎」、「可以給人家下班好好休息嗎」、「什麼工作這麼重要，又要去偷拿國家機密了嗎？」、「什麼重要工作？偷軍事機密嗎」、「狗仔偷拍任務嗎？故意讓大家知道你有多疼這位金釵？」黃國昌留言挨酸。（取自黃國昌臉書）    ,https://news.ltn.com.tw/news/politics/breakingnews/5318642
獨家》與總統密談選新竹縣長？鄭朝方｢還原現場｣：交由縣民選擇,政治,2026/01/22 16:50,針對總統賴清德是否勸進選新竹縣長，竹北市長鄭朝方今天打破沉默，接受本報獨家訪問「還原」當天情形。（記者廖雪茹攝）針對連日媒體報導，總統賴清德去年底到新竹縣，利用空檔與竹北市長鄭朝方密談近2個小時，勸進鄭一肩挑起新竹縣長選舉大樑，鄭朝方今天打破沉默，接受本報獨家訪問「還原」當天情形，單純討論竹北2件事；而對於選舉，鄭則是強調：「連任、不選或者是其他，就交由市民或者是縣民來選擇」。鄭朝方表示，事實上，當天（2025年12月21日）是他抓緊機會，來跟總統懇託關於竹北的2個重要政策。第一是東區市場（水岸市集）的經費，竹北市公所已積極爭取了1年多，非常需要中央的幫忙，但迄今沒有下文。請繼續往下閱讀...第二是更緊急的大新竹高中增班議題，鄭朝方說，因為總預算還卡在立法院沒有審，讓許多家長心急如焚，所以他特別跟總統報告及討論要如何因應。鄭朝方說，距離年底選舉還有一段時間，非常感謝市民、縣民朋友及政治前輩們對他的關心。由於他非常專心在市政，以竹北市長的工作為首要；尤其，現在有多項建設正在推進、即將落成，也是建設大爆發之年，就是讓政策推行和政績表現來說話。鄭朝方強調：「所以面對年底的選舉，我要很誠懇地說：連任、或者是不選、或其他的想法，各項都是一個選項，就交由市民或者是縣民來選擇。」迥異於往年，2026新竹縣長和竹北市長選舉十分熱絡，尚未開打，國民黨已因縣長提名問題，黨內選將競爭激烈。日前有媒體爆料，去年12月21日賴清德赴新竹縣出席「中華民國後備憲兵荷松總會北部地區歷任主委顧問聯誼會第8、第9任會長交接典禮」，活動結束後，賴清德與鄭朝方在新竹縣警察局局長室密談近2個鐘頭，對談中，賴打出「總統牌」勸進鄭朝方成為2026新竹縣選舉的「關鍵力量」；並說，鄭朝方出征縣長機率極高，就待選對會做最後拍板。據悉，雖然媒體報導國民黨黨內戰況猛烈，且外界十分關注鄭朝方的動向，但面對選舉議題，鄭朝方始終採取穩紮穩打、「以靜制動」的策略。而民進黨新竹縣整體選舉佈局雖尚未明朗，但不少地方人士認為，「總統和市長2個人選在新竹縣警察局密談選舉？」這個揣測的可信度有待商榷！    ,https://news.ltn.com.tw/news/politics/breakingnews/5318749
不滿花蓮黨部建請中央徵召游淑貞參選縣長 葉耀輝：以司法行動維護權益,政治,2026/01/22 16:49,前花蓮市長葉耀輝今天下午在孫文學校總校長辦公室主任何啟聖陪同下，到國民黨中央黨部就花蓮縣黨部「提名作業疏失」提出申訴。（記者施曉光攝）針對國民黨花蓮縣黨部昨天公布內參民調結果，並宣布建請黨中央徵召吉安鄉長游淑貞參選花蓮縣長，另一位爭取提名失利的前花蓮市長葉耀輝今天下午在未列入協調對象的孫文學校總校長辦公室主任何啟聖陪同下，到中央黨部就縣黨部「提名作業疏失」提出申訴，葉耀輝受訪指出，將委請法律專家透過司法行動維護自身權益，他並指控花蓮縣黨部主委盧新榮有背信，讓他不當選的意圖。葉耀輝指出，去年9月8日他問盧新榮何時舉辦初選，對方稱在今年5月，因此自己始終都是朝5月初選來做參選準備，「最精采的政見與好東西要到4月才會推出」，沒想到花蓮縣黨部竟在未告知的情況下提前決定採用全民調，但他從未收到縣黨部的書面告知，只是從報紙上得知消息，而且1月13日盧新榮邀他與游淑貞到縣黨部，告知民調從19日開始進行。請繼續往下閱讀...當時他表達應該先舉辦電視辯論會，但游淑貞拒絕上電視，並要求立即做民調，自己認為不妥所以沒有答應參與民調，沒想到離開黨部後才知道縣黨部已決定委請民調公司做民調，並在他沒有催票準備的情況下，悄悄做了民調，有關民調樣本數、各鄉鎮市採樣比例都沒有討論。葉耀輝說，他今天向中央黨部表達最大的遺憾，並將委請法律專家保障自身權益，將採取司法行動，雖然黨部方面強調目前仍處協調階段，但他當場質疑，為何新北市協調這麼久都還沒有結果，花蓮縣卻只用9天時間就做出民調，他認為黨部有大小眼之分，因此要採取法律行動維護權益，因為盧新榮去年9月告訴他今年5月才辦初選，這次協調過於草率，並認為盧新榮有背信，讓他不當選的意圖。對於媒體詢問，黨中央是否承諾延後花蓮縣提名並辦理初選？葉耀輝指出，黨中央方面雖說目前仍屬協調階段，但對於花蓮縣黨建議直接徵召游淑貞，中央黨部未做回應。媒體追問，是否不排除逕自參選？葉耀輝沒有正面回應，只說他有告知盧新榮，仍將按照原定5月初選的期程進行，並將邀請游淑貞參加3場電視辯論會，盧只回應尊重，他並強調自己不是無理取鬧的人，「花蓮有難，我一定挺身而出，在所不惜」，他並為何啟聖說話，強調只要是好人才，都不應該被排除。何啟聖則說，國民黨應該開大門走大路，沒有什麼不能被外界檢驗，這次花蓮縣長提名過程有太多讓外界質疑的地方，他與葉耀輝都支持國民黨主席鄭麗文當初競選時提出國民黨要改革，打破醬缸文化與宮廷政治，因此希望黨部能盡快補正初選疏漏，否則依照「政黨法」規定，初選若有違反正義，就有違法之虞。    ,https://news.ltn.com.tw/news/politics/breakingnews/5318756
侯友宜出席深坑行動治理座談會展現建設決心 打造軌道經濟與低碳觀光新亮點,政治,2026/01/22 16:42,新北市長侯友宜主持深坑區行動治理座談會，會前與里長們打招呼。（記者翁聿煌攝）新北市長侯友宜22日率領市府團隊赴深坑區舉行行動治理座談會，侯友宜表示，市府正全力推動深坑輕軌與基礎建設，並結合已動工的社會住宅積極爭取公益回饋設施，市府將與里長並肩作戰。捷運工程局針對地方引頸期盼的深坑輕軌，表示已於去年11月提交修正報告予中央審議，預期完工後將大幅改善聯外交通；市府也同步規劃於相關建設計畫中納入深坑運動中心，完善在地休閒機能。請繼續往下閱讀...有里長提案希望文山路農業區可以解編，市府團隊於會中說明，已納入第3次通盤檢討計畫，預計3月份辦理地方說明會，目前深坑輕軌案正積極爭取中央核定，一旦路線定案，後續都市計畫程序將陸續銜接，帶動地方整體發展。市府針對深坑老街假日停車需求倍增，交通局表示除優化既有設施，並研議於社會住宅空地開闢停車位；針對校園停車場則需評估聯外動線並持續跨局處溝通，加強觀光與民生品質，深坑區污水下水道建設擬爭取納入中央第7期建設計畫，將於2027年啟動銜接台北市系統，逐步建構健全的水資源環境。市府為推動深坑區觀光旅遊，也積極規劃新建橋梁串聯景美溪左右岸自行車步道，未來將能讓遊客從河岸廊道直通深坑老街，搭配微笑山線二格山與筆架山步道的指引優化及步道巡查作業，以及市府專案補助的老街建築維護，深坑將成為結合歷史底蘊與綠色低碳的觀光典範。    ,https://news.ltn.com.tw/news/politics/breakingnews/5318719
黃國昌又揪總統辯論！ 民進黨：迷戀賴清德程度超越謝龍介,政治,2026/01/22 16:31,民進黨新聞部副主任黃子一今天主持直播節目「午青LIVE」，邀請立委李坤城參與。（圖擷自民進黨YouTube頻道）今年度中央政府總預算案持續卡關，立法院民眾黨團總召黃國昌再邀總統賴清德辯論。對此，民進黨今（22日）強調，賴總統多次在合憲合法前提下表達願赴立法院報告，而黃國昌迷戀總統程度已「超越國民黨立委謝龍介」，呼籲在野黨停止作秀並儘速審理預算。行政院長卓榮泰提議就總預算案展開辯論，黃國昌今對此表示，在野黨接招後，卓揆卻馬上「龜縮」，若卓缺乏勇氣與擔當，賴總統應考慮親自上陣。請繼續往下閱讀...針對在野黨指控賴總統未釋出善意或不到立法院一說，民進黨新聞部副主任黃子一於直播節目「午青LIVE」詳列時間軸並反駁說，從2024年6月24日至今年1月1日，賴總統已十幾次公開表達，願意在合法合憲的前提下到立法院進行國情報告。黃子一續指，賴總統也曾邀請五院院長諮詢，並於2025年6月18日邀請時任國民黨主席朱立倫和黃國昌，於總統府召開簡報會議討論國安議題；去年12月14日及今年1月1日，總統亦表達願意邀立法院長韓國瑜、行政院長共同諮詢。黃質疑，總統已瘋狂釋出善意，在野黨卻找藉口、把事情丟到賴身上。兼任民進黨發言人的立委李坤城則觀察，黃國昌有很大的焦慮感，節目標題下得很好，「迷戀賴清德的程度，黃國昌超越謝龍介」，因為謝龍介過去在台南市議會標榜「一生只監督你一人」，而現在黃國昌不斷將自己拉高到與賴總統同等級，超越謝龍介的男人就是黃國昌。對於在野黨要求總統赴立院進行「一對一即問即答」，李坤城強調，根據憲法增修條文及大法官解釋，立法院質詢對象應為行政院而非總統，要求總統即問即答已被判定違憲。李直言，藍白提案彈劾及國情報告，執政黨不必陪同在立法院搞這齣「爛戲」；黃國昌還要求立法院在全國舉辦巡迴說明會，根本是拿人民納稅錢為個人作秀，呼籲大家「不用陪黃國昌玩」。李坤城並提醒，目前包括軍購特別條例以及佔比約98%的近3兆元總預算案仍被在野黨卡住，而立法院本會期即將於1月31日結束，剩下最後7個工作天，盼國人致電選區立委，要求讓總預算能夠付委審查。    ,https://news.ltn.com.tw/news/politics/breakingnews/5318699
施俊吉憂對美投資GDP先扣15兆  政院：兩者不同、不能加總,政治,2026/01/22 16:27,行政院發言人李慧芝。（行政院）行政院前副院長施俊吉在臉書指出，台美關稅談判，台灣企業直接投資美國2500億美元，加上政府提供2500億美元的信用保證，將使台灣未來數年潛在GDP先扣15兆元。行政院發言人李慧芝今天重申，兩者不同，不能加總；且台灣企業投資賺錢後，台灣大小股東就可以賺錢，也會讓台灣公司擴大在台投資。施俊吉指出，美國商務部公告的Fact Sheet用黑體字將「Direct Investments」 和 「Additional Investments」分別列出。其中，「直接投資」（至少2500億美元，由台灣企業實際注入用於美國建廠擴產）與「額外投資」（至少2500億美元，由台灣政府提供信用擔保以促進「額外」的投資）在文件中被分開列為兩項獨立承諾，性質明顯不同。請繼續往下閱讀...施俊吉說，台灣「直接」加上「額外」投資美國的金額是5000億美元，或台幣15兆元。由於這些投資在美國，不在本國，不能算作是我國的GDP，未來數年潛在的GDP要先扣掉15兆元台幣，以及在台灣創造的附加價值。國發會有責說明，台灣潛在GDP將損失多少金額，GDP的成長率將下降多少百分比。對此，李慧芝說，企業投資與政府信保額度2項不能加總，至於信保機制，也是屆時企業若有需要才會申請。她還強調，企業投資是為了賺錢，企業賺錢大小股東也就會賺錢，並會讓台灣公司擴大在台灣投資，像是台積電在台灣的擴廠計畫速度，就遠大於在美國的擴廠速度。國發會經發處長陳美菊解釋，影響潛在GDP的因素，包括了總要素生產力、資本投入及勞動投入；由於台美產業互補，隨著全球AI需求擴張，不只國際大廠在台加碼投資，國內半導體廠商也持續擴大先進製程投資，而台美雙向投資有著技術外溢、提高生產效率，長期有助提振經濟成長。陳美菊強調，隨著台美貿易協定底定，雙邊貿易不確定降低，近期包括瑞銀、野村、星展、摩根史坦利等國際外資投資銀行皆上修台灣今年經濟成長率逾4%以上，並稱台灣取得比較優化的貿易條件，可鞏固高科技產業優勢，也對傳產製造業復甦帶來契機，對台灣的產業均衡發展有正面效益。    ,https://news.ltn.com.tw/news/politics/breakingnews/5318720
「台美教育倡議」第5次高層對話 制定為期3年合作策略,政治,2026/01/22 16:27,外交部舉辦「台美教育倡議」第五次高層對話成果說明會，外交部政務次長陳明祺（右起）、美國國務院亞太局副助卿孔如璞、美國在台協會副處長梁凱雯等人出席。（記者羅沛德攝）「台美教育倡議」第5次高層對話今天（22日）在台北舉行，美國在台協會（AIT）指出，會中重申雙方將持續深化教育合作的共同承諾，使之成為強化人才培育、提升語言能力、促進民間交流的重要基石，並制定一項為期3年的教育合作策略，也探討擴大地方層級交流的機會。這次台美教育倡議高層對話由外交部次長陳明祺主持，台方與會代表包括國安會副秘書長趙怡翔、教育部次長劉國偉、僑委會副委員長李妍慧，美方代表團則由美國國務院東亞暨太平洋事務局副助卿孔如璞（Robert Koepcke）率領，成員包括AIT華盛頓總部執行理事藍鶯（Ingrid Larson）、AIT台北辦事處副處長梁凱雯（Karin Lang），美國國務院教育與文化事務局（ECA）資深官員以線上方式與會，ECA資深官員Darren Beattie也以事先錄製方式致詞，肯定台灣長期以來堅定地支持美台教育交流。請繼續往下閱讀...陳明祺指出，台美教育高層對話始於2020年，今天是川普第二任期的首場對話。AIT說明，在對話中，美國再次表達將致力維繫並強化與台灣的教育連結，雙方也達成共識，訂定一項為期3年的教育合作策略、建立機制以加強台灣大專院校與美國組織機構之間的合作，同時也探討擴大地方層級交流的機會。陳明祺也說，在今日對話中，確定了台美未來合作將聚焦4項優先領域，分別為建置具競爭力的雙邊人才培養道路、深化華語教學與跨文化影響力、在執行「雙語政策」的同時提升英語教學品質，以及拓展台美教育合作平台。陳明祺說，鑑於人工智慧（AI）的快速發展，台灣與美國夥伴合作，擴大AI在華語教學的應用，並且合作佈局開發值得信賴的正體中文語言資料庫，不僅對全球語言科技標準有所助益，更能確保華語學習免受威權審查及控制。AIT指出，孔如璞在高層對話中說，「透過台美教育倡議，我們正在打造各種合作管道，讓大學、研究機構與地方夥伴能夠攜手合作，直接促進區域穩定與經濟繁榮」，美台雙方也一致肯定美台教育合作的一大支柱傅爾布萊特計畫（Fulbright Program），交流計畫持續培育未來領袖、強化學術合作，並深化長期的夥伴關係。為進一步推動與美國各州的教育合作，孔如璞代表美國國務院簽署一封致各州教育長官委員會（CCSSO）的信函，強調台灣在聯邦、州與地方各層級，都是美國的重要夥伴，信中鼓勵各州教育領導者與位於華府的駐美國台北經濟文化代表處聯繫，瞭解「台美教育倡議」下最新的K-12教育合作機會，並與各州的臺灣華語文學習中心互動交流。孔如璞指出，在台灣華語文學習中心，美國學生能在不受審查、鼓勵自由討論的環境下，透過由台灣支援的課程學習繁體中文。藍鶯致詞時則肯定台灣「在推動地方層級交流方面展現出強大的決心與持續的動能」。外交部政務次長陳明祺（右3）、美國國務院亞太局副助卿孔如璞（左3）、美國在台協會副處長梁凱雯（左2）、國安會副秘書長趙怡翔（右2）、教育部政務次長劉國偉（右1）等人出席「台美教育倡議」第五次高層對話成果說明會。（記者羅沛德攝）    ,https://news.ltn.com.tw/news/politics/breakingnews/5318711
基隆勇消詹能傑殉職 蔣萬安率北車危安演練小組默哀,政治,2026/01/22 16:17,台北市政府22日下午在台北車站舉辦高強度無差別攻擊危安實兵演練，演習結束後，參與人員為火災殉職的基隆市消防局小隊長詹能傑默哀1分鐘。（記者羅沛德攝）基隆市安樂區「台北生活家」社區昨晚深夜惡火，造成前往救災的消防小隊長詹能傑殉職。台北市政府今（22日）於台北車站進行危安演練，台北市長蔣萬安與演練小組一同默哀，「任務結束，辛苦了」，也為其他還在醫院的消防弟兄集氣。今日台北車站演習範圍包含台鐵、高鐵、北捷、機捷、台北地下街、站前地下街、K區地下街、中山地下街，以及微風廣場，共9個事業體，動員340人演練無差別攻擊事件的應變。請繼續往下閱讀...蔣萬安在講評前也特別提到，要藉由此機會為英勇殉職的詹小隊長默哀1分鐘；蔣萬安說，任務結束，辛苦了，也希望替其他還在醫院的消防弟兄集氣。    ,https://news.ltn.com.tw/news/politics/breakingnews/5318664
中國氣球擾台？「簡體字」氣球現蹤彰化芬園驚動軍憲警,政治,2026/01/22 16:16,簡體字氣球現蹤彰化芬園，車輛險撞釀禍。（圖由黃翊愷提供）中國氣球擾台？彰化縣芬園鄉農會總幹事黃翊愷今天（22日）開車行經彰南路五段時，突然有一個紅色巨型空飄汽球擋在車道上，他趕緊閃避所幸未撞擊釀禍，不過卻意外發現氣球綁著寫有簡體字的布條標語「發揮智能力謀發展」，懷疑是從中國空飄越過台灣海峽來到彰化芬園，消息傳出驚動軍憲警等單位前來勘查，初步認為並非擾台的高空氣球，交由黃翊愷帶回。黃翊愷指出，他今天清晨天色微亮外出跑行程，開車行經彰南路五段彎道內側車道時，突然發現前方竟然有一個巨大的紅色物體飄在路中間，車輛快速靠近才看清是一個巨大的紅色汽球飄在半空中，嚇得他趕緊急轉方向盤往右側切出才閃過，車身猛烈晃動，險些翻車；若再慢個幾秒鐘鐵定撞上，屆時後果恐不堪設想。請繼續往下閱讀...黃翊愷為避免後方車輛撞上汽球或要閃避釀禍，立即把車停好後跑到內側車道上把汽球移往路邊，仔細一看還綁著寫有「發揮智能力謀發展」的簡體字，底部還印有「禁止烟火」簡體字，納悶廣告業者怎麼會用簡體字，猜測會不會是從中國空飄來台，在飛越彰化芬園時卡在彰南路中央分隔島上。中國氣球飛抵台灣的消息傳出，包括彰化憲兵隊、軍方後備單位及彰化警分局等單位都來到芬園查看，勘查是否從中國飛抵台灣；據軍方與警方私下表示，這個紅色氣球與擾台的白色氣球不同，不排除從回收場，順著風勢及地形條件情況下飛過來的，因此不予收回；警方並拍照存證，讓黃翊愷帶回。簡體字氣球現蹤彰化芬園，被認為是從中國空飄來台。（記者湯世名攝）簡體字氣球現蹤芬園，地方傳出是從中國空飄來台，軍憲警單位都派員勘查。（記者湯世名攝）簡體字氣球現蹤芬園，地方傳出是從中國空飄來台，驚動軍憲警派員勘查。（記者湯世名攝）    ,https://news.ltn.com.tw/news/politics/breakingnews/5318676
