Title,News_Type,date,content,url
美軍官參與抗議籲彈劾川普與范斯 美國空軍稱將調查,國際,2026/07/03 11:23,美國空軍少校華森1日參加抗議活動，並呼籲彈劾總統川普和副總統范斯，隨後被美國國會警察拘留。（擷自X@OlenaRohoza）美國1名空軍少校1日參加抗議活動，並呼籲彈劾總統川普和副總統范斯。對此美國空軍2日表示，將對1名身穿軍服並在國會大廈台階上參加抗議活動的軍官展開調查。根據《路透》報導，抗議相關影片顯示，華森（Jason Watson）少校參與抗議活動，譴責川普和范斯未經國會授權就對伊朗發動戰爭等行為。他手持抗議標語，要求對川普與范斯進行彈劾與定罪，隨後被美國國會警察拘留。請繼續往下閱讀...美國空軍部長梅因克（Troy Meink）的辦公室在聲明中承認有空軍軍官在國會大廈參加抗議活動，但並未提及華森的名字。聲明強調，調查「將不受阻礙地進行」。該辦公室在X上說「國防部嚴肅對待任何不當行為的指控，包括任何可能損害我軍非黨派性質的行為。」美國軍人的法律對其政治活動有所限制，尤其是在身著軍裝期間。《統一軍事司法法典》第88條也禁止軍官使用「侮辱總統、副總統、國會」和其他美國代表的言論。另外華森暗示，他有「意識到」自身言論的風險。他說「比我是誰更重要的是我要說什麼，以及我願意為此付出什麼代價。」    ,https://news.ltn.com.tw/news/world/breakingnews/5492423
自由說新聞》前線俄軍投降畫面曝！俄國瘋傳「驚人一幕」民怨暴漲！,國際,2026/07/03 11:14,全新的視界！新聞話題不漏接，快訂閱YouTube 【自由追新聞】，記得開啟小鈴鐺哦！    ,https://news.ltn.com.tw/news/world/breakingnews/5492461
川普再提台灣幾乎搶走所有晶片生意 稱卸任前可掌握60％產能,國際,2026/07/03 10:58,美國總統川普表示，台灣幾乎拿走100%的晶片產業，但在關稅措施下，晶片商正從台灣遷回美國。川普也宣稱，在他任期結束前，將有40%至60%的晶片製造落腳美國。（美聯社）多次點名台灣的美國總統川普，繼週三宣稱「台灣在亞利桑那州興建中的晶圓廠規模將擴大1倍」，週四又對美媒宣稱，台灣幾乎拿走100%的晶片產業，但在關稅措施下，晶片商正從台灣遷回美國。川普也宣稱，在他任期結束前，將有40%至60%的晶片製造落腳美國。川普（Donald Trump）2日在接受CNBC節目主持人柯能（Joe Kernen）專訪時，當被問到有報導指出，OpenAI執行長奧特曼（Sam Altman）正討論讓美國政府持有該公司5%股份時，川普不僅未正面回應，還直接轉移話題，除了提及他過去如何要求英特爾（Intel）讓政府入股，也再度點名台灣。請繼續往下閱讀...川普稱之前英特爾遇到一些問題、損失慘重，因為歷任美國總統從未祭出關稅保護，而台灣卻幾乎壟斷了100%的業務，川普稱「幾乎啦！主要是台灣，南韓也佔了一點，但主要還是台灣」、「我當時就說，如果我是總統，這種事絕對不會發生」。隨後川普又說，晶片製造商正將產能移回美國，「我已經讓他們全部搬回來了，他們都在搬回美國」，他們正在亞利桑那州（Arizona）建造晶片工廠，特別是全球最大的晶片公司也在那裡建造他們最大的工廠。川普也稱，「我認為我們將佔據很大的晶片市場，差不多在我卸任的時候，我認為我們將擁有40%至50%，甚至60%的晶片市場份額」。    ,https://news.ltn.com.tw/news/world/breakingnews/5492285
聯合國總部外男子自焚 送醫不治,國際,2026/07/03 10:15,"紐約警察局稱1名男子2日在聯合國總部外自焚，最終因傷重身亡。（擷自X@heatedreports）位於美國紐約市的聯合國總部附近，近日發生1起駭人事件，紐約警察局稱1名男子2日在聯合國總部外自焚，最終因傷重身亡。根據《法新社》報導，紐約市警察局表示，警察局在2日晚上6時32分接到報警表示，1名男子在第一大道和第42街路口自焚。他身上的火勢被撲滅後送往貝爾維尤（Bellevue）醫院，但最終仍因傷勢過重身亡。請繼續往下閱讀...紐約市警察局尚未公布男子自焚動機，調查仍在進行中。《紐約郵報》表示，事發時男子手持一面西藏旗幟，但《法新社》無法獨立查證此說法。相關影片顯示，男子自焚後火焰在他身上劇烈燃燒，一段時間過後他倒在地上。另外聯合國尚未對此事做出回應。????#BREAKING: Watch as a protester sets themselves on fire outside the United Nations headquarters in New York City.????#Manhattan | #NewYorkWatch wild footage captured as a protester sets themselves on fire outside the United Nations headquarters in New York City. Later in the… pic.twitter.com/v5DbMYWVSn— Heated Rep????rts （@heatedreports） July 3, 2026 ????#BREAKING: Watch as a protester sets themselves on fire outside the United Nations headquarters in New York City.????#Manhattan | #NewYorkWatch wild footage captured as a protester sets themselves on fire outside the United Nations headquarters in New York City. Later in the… pic.twitter.com/v5DbMYWVSn    ",https://news.ltn.com.tw/news/world/breakingnews/5492349
土耳其喜劇演員遭捕 脫口秀涉侮辱總統與伊斯蘭教,國際,2026/07/03 10:05,土耳其喜劇演員戈克塔斯2日抵達伊斯坦堡機場時被捕。（擷自X@idgoktas）土耳其喜劇演員戈克塔斯（Deniz Goktas）2日抵達伊斯坦堡機場時被捕，據稱他侮辱了總統艾多根（Recep Tayyip Erdogan）和伊斯蘭教。戈克塔斯被捕之際，土耳其正加強打擊被視為批評土耳其伊斯蘭保守派政府或其價值觀的人士。根據《法新社》報導，戈克塔斯於6月1日在伊斯坦堡進行的脫口秀表演在6月24日被製作成90分鐘的影片上傳到YouTube，至今觀看次數已接近900萬次。戈克塔斯在表演中談到被監禁的艾多根政治對手、伊斯坦堡市長伊瑪莫魯（Ekrem Imamoglu）。伊瑪莫魯去年因腐敗指控被捕，此事引發大規模街頭抗議。請繼續往下閱讀...戈克塔斯的表演被上傳到YouTube後，檢察官對他展開調查。伊斯坦堡檢察官辦公室表示，戈克塔斯在伊斯坦堡機場遭捕後，因公開侮辱宗教價值觀而接受調查。戈克塔斯的律師阿斯蘭（Metin Aslan）補充，他也被指控侮辱艾多根。戈克塔斯在X上說，他在返回土耳其前在國外度假，返回土耳其後遭到逮捕。據阿斯蘭所說，他將在今（3）日出庭。    ,https://news.ltn.com.tw/news/world/breakingnews/5492296
伊朗全國動員！哈米尼國葬登場 路透：欲證明革命熱情依舊,國際,2026/07/03 09:25,伊朗正籌備為已故最高領袖哈米尼舉行為期數天的大規模國葬儀式。（路透資料照）位居統治階層的伊朗高級宗教人士正籌備為已故最高領袖哈米尼（Ayatollah Ali Khamenei）舉行為期數天的大規模國葬儀式，藉此展現民眾對伊斯蘭共和國的支持，並證明革命熱情依然高漲。路透2日報導，哈米尼在今年2月戰爭爆發後不久，美國與以色列首次聯手發起攻擊時喪生。國葬預計於本週末在德黑蘭展開，下週並將在庫姆（Qom）及馬什哈德（Mashhad）舉行大規模送葬遊行，伊拉克也將舉辦相關悼念儀式。請繼續往下閱讀...庫姆主麻日（Friday prayer）領禱人賽義迪（Ayatollah Mohammad Saidi）向伊朗官媒表示：「殉難領袖及其他殉難者葬禮若有大批民眾參與，實際上將成為伊斯蘭共和國的另一場公投。」路透指出，若當局確實將葬禮視為一場公投，顯然德黑蘭並未打算讓結果自然發生。當局希望動員數百萬名支持者湧入伊朗各大城市，提供交通、食宿等安排，藉此展現神權政體在歷經他們口中的「生存之戰」後，依然屹立不搖。哈米尼之死，以及其子穆吉塔巴．哈米尼（Mojtaba Khamenei）接任伊朗第3位最高領袖，被視為伊斯蘭共和國47年歷史中的重要時刻。穆吉塔巴在父親喪命的空襲中同樣身負重傷，自戰爭爆發以來便未曾公開露面。不過，路透引述分析人士說法，在表面的團結與忠誠背後，伊朗民眾對伊斯蘭共和國的支持早已十分薄弱。伊朗各地許多民眾已厭倦數十年來被制裁重創的經濟，也對當局以1979年革命之名肆意鎮壓感到憤怒；如今在這個以年輕人口為主的國家，真正記得那場革命的人多半已垂垂老矣。去年12月及今年1月，因通膨引發的示威席捲街頭，許多示威者高喊要求「哈米尼去死」，當局最終以開槍射殺數以千計示威者的方式平息動亂。戰爭初期，哈米尼遇襲身亡消息開始流傳後，德黑蘭部分居民證實，住宅與公寓窗戶傳出陣陣歡呼聲。如今德黑蘭則瀰漫緊張與沉寂氣氛，與上一位最高領袖、伊朗革命之父何梅尼（Ayatollah Ruhollah Khomeini）下葬時的場面形成鮮明對比。當時，數百萬名悲痛民眾湧入何梅尼送葬隊伍，部分民眾甚至爬上運送靈柩的救護車。伊朗伊斯蘭革命衛隊奮力阻擋人潮，仍讓何梅尼的遺體一度從裹屍布中露出。包括俄羅斯與中國等國官員及外國政要，將於3日出席相關活動表達哀悼。4日，哈米尼靈柩將運往德黑蘭一座清真寺，展開全國巡迴告別儀式首站。他的女兒、女婿、外孫女，以及新任領袖穆吉塔巴的妻子，皆在同一次空襲中喪生，遺體也將一同接受哀悼。當局已提供飯店5折優惠，並將學校、清真寺及體育館改作安置弔唁民眾的場所，同時調整公車及鐵路運輸路線，以配合上述活動。6日，官方規劃於德黑蘭市中心舉行大規模送葬遊行，哈米尼遺體將於7日運往伊朗什葉派宗教中心庫姆舉行儀式。8日，伊拉克聖城納傑夫（Najaf）及卡巴拉（Kerbala）將舉行悼念活動，伊朗在區域內的什葉派代理人網絡重要人士均將出席。哈米尼預定於9日在另一場送葬儀式後，安葬於馬什哈德伊瑪目禮薩（Imam Reza）陵墓附近。該陵墓是伊朗重要宗教聖地。報導稱，維安措施將十分嚴密，德黑蘭及其他城市將實施臨時空域管制；當局並警告美國或以色列若再次發動攻擊，將採取強力回應。    ,https://news.ltn.com.tw/news/world/breakingnews/5492258
50年眼中釘！梵蒂岡強硬重懲分裂派 主教神父信徒全遭制裁,國際,2026/07/03 08:51,SSPX週三在瑞士埃孔（Econe）的修院舉行長達5小時的祝聖彌撒，公然違抗教宗良十四世。（法新社）梵蒂岡週四（2日）強硬回應一個未經教宗同意便自行祝聖主教的傳統派團體，宣布該團體已正式與羅馬天主教會決裂。梵蒂岡將其主教與神父逐出教會，並警告其信眾，他們也面臨教會最嚴厲的制裁「絕罰」。《美聯社》報導，「聖庇護十世司鐸兄弟會」（Society of St. Pius X，SSPX）反對天主教會現代化改革、致力舊式拉丁彌撒，長期與梵蒂岡關係緊張。SSPX雖是天主教右翼邊緣運動，卻已成為梵蒂岡長達50年的眼中釘，因為SSPX自稱「比聖座更加天主教」。請繼續往下閱讀...SSPX不甩教宗喊話「請回頭」，週三在瑞士埃孔（Econe）的修院舉行長達5小時的祝聖彌撒，公然違抗教宗良十四世。現場估計約1萬5500人，且SSPX支持者來自世界各地，在明知違抗教廷的情況下參與儀式。報導指出，梵蒂岡教義部宣布SSPX構成分裂，並將「絕罰」擴大至可能數以千計的天主教徒。絕罰是指被排除在教會共融之外，不能領受部分聖事。這項強硬回應顯示，在嘗試與SSPX協商後，教宗良十四世領導下的梵蒂岡已經忍無可忍。梵蒂岡將SSPX4名新主教以及參與儀式的2名現有SSPX主教逐出教會。SSPX約750名神父屬於分裂者，因此遭絕罰，並宣布他們施行的告解與婚姻聖事無效。梵蒂岡也警告信眾停止參加SSPX彌撒，並下令「正式依附」SSPX即屬分裂者，並遭絕罰。據估計約有40萬至60萬人參加SSPX彌撒。SSPX媒體經理馬比亞爾（Marc-André Mabillard）對制裁嚴厲程度表示震驚並稱「不公」，「這項擴及信眾的絕罰是殘酷的。這不是我們每天所依附的一位父親應有的作為。」並批評梵蒂岡「有一位不想與我們溝通的領袖。這太可怕了。」SSPX祝聖彌撒現場估計約1萬5500人，且SSPX支持者來自世界各地，在明知違抗教廷的情況下參與儀式。（歐新社）    ,https://news.ltn.com.tw/news/world/breakingnews/5492275
限縮出生公民權遭法院駁回 川普擬禁「外國孕婦」入境美國,國際,2026/07/03 08:36,美國最高法院6月30日駁回總統川普限制「出生公民權」的行政命令，引發川普不滿。（路透）美國最高法院6月30日駁回總統川普限制「出生公民權」的行政命令，重新確認在美國出生者即具有美國公民身分，引發川普不滿。外媒最新消息指出，白宮有意尋求替代方案，將目標轉為「事前阻止」，限制外國孕婦入境。美國最高法院6月30日駁回川普限制「出生公民權」的行政命令，重新確認在美國出生者即具有美國公民身分，此為受憲法保障的「出生地原則」。川普在最高法院做出裁定後，在社群發文諷刺：「我要向習主席和偉大國家中國道賀，在他們出生公民權上贏得莫大勝利！」同時也轉向國會施壓，要求共和黨議員立刻推動立法，終結他所說這種「成本高且不公平」的制度。請繼續往下閱讀...根據外媒報導，針對法院裁決駁回川普的行政命令，白宮將焦點轉為限制外國孕婦入境，據指川普政府計畫要求孕婦申報其懷孕狀況或在美國分娩的意圖，美國司法部已向聯邦檢察官發出備忘錄，敦促他們與國土安全部合作。白宮副首席幕僚長米勒（Stephen Miller）表示，白宮將「認真考慮」禁止外國孕婦前往美國。他也強調，美國必須更謹慎評估哪些外國人能入境，即使只是臨時入境，也可能牽涉公共資源與福利問題。米勒也指出，有些人來這裡只是為了在美國土地上生孩子，而這個孩子就能終身擁有美國公民身分。如果一個人在懷孕9個月時來這裡看看，幾週後，她就成了美國終身公民的母親，而這個孩子也將終身享受美國的財政和福利。美國國土安全部長穆林（Markwayne Mullin）也暗示，政府正在考慮限制孕婦入境。他在福斯新聞的節目中指出：「她們可以持旅遊簽證進入美國或其領土，僅僅是為了生孩子」、「她們在生下孩子後，孩子可能會回到中國，在共產主義政權下撫養孩子，即使他們是美國公民。然後再回到美國，在某些情況下，孩子還會去大學，竊取知識產權。這絕對是一個國家安全問題。」曾任國土安全部副部長的庫奇內利（Ken Cuccinelli）指出，根據現行《移民與國籍法》規定，總統有限制特定人士入境的權力，因此國務院可拒發簽證，海關與邊境保護局也能直接攔下懷孕旅客。也有白宮官員強調：本屆政府將毫不妥協地打擊非法移民的驅動因素，以及那些以欺詐手段入境美國僅為生育的外國人。美國國防部長赫格塞斯（Pete Hegseth）也對大規模移民表示擔憂，並敦促歐洲各國採取行動應對這一現象。    ,https://news.ltn.com.tw/news/world/breakingnews/5492244
村上春樹新書《夏帆》午夜開賣 書迷深夜排隊搶購,國際,2026/07/03 07:57,"日本作家村上春樹睽違3年的最新長篇小說《夏帆The Tale of KAHO》週五（3日）開賣。（美聯社）日本作家村上春樹睽違3年的最新長篇小說《夏帆 The Tale of KAHO》週五（3日）開賣。東京都新宿區紀伊國屋書店新宿本店配合發售日，於凌晨0點開賣，儘管已是深夜，仍吸引許多書迷排隊搶購。綜合日媒報導，紀伊國屋書店新宿本店配合發售日舉辦販售活動，事先申請的書迷聚集在店舖1樓正面賣場，眾人一同倒數，一到3日零時，書店立刻開賣新書，現場氣氛熱烈。請繼續往下閱讀...據出版方新潮社表示，《夏帆 The Tale of KAHO》是以文藝雜誌《新潮》2024年6月號至2026年3月號分4次發表的作品為基礎，加筆修改而成，故事主角是26歲的繪本作家夏帆。出版社指出，這是村上春樹長篇小說中，首次由女性單獨擔任主角。77歲的村上春樹表示，繪本作家夏帆是一名極為普通的年輕女性，然而在她周遭，開始發生各式各樣奇妙的事情。「這次的小說中，我是化身成這樣的她來書寫。」他也說，這次創作感覺像是把短篇一篇篇接續起來，最後再稍微修整一下，但整體並沒有太多矛盾之處，故事脈絡也沒有變得奇怪。「寫起來非常開心。」村上春樹1949年出生於京都市，曾獲法蘭茲・卡夫卡獎等多項日本國內外文學獎。代表作包括暢銷作品《挪威的森林》、《發條鳥年代記》、《1Q84》等。這是他繼2023年的《城與不確定的牆》後，再度推出新長篇小說。村上春樹さん最新作『夏帆』発売開始しました！深夜のご来店、ありがとうございます #村上春樹 #夏帆 pic.twitter.com/dXA2dArXEo— 紀伊國屋書店 （Books Kinokuniya） 公式 （@Kinokuniya） July 2, 2026 村上春樹さん最新作『夏帆』発売開始しました！深夜のご来店、ありがとうございます #村上春樹 #夏帆 pic.twitter.com/dXA2dArXEo村上春樹最新長篇小說《夏帆The Tale of KAHO》。（圖擷取X平台）    ",https://news.ltn.com.tw/news/world/breakingnews/5492248
拒配合調查！川普政府：國際刑事法院對美國人沒有管轄權,國際,2026/07/03 07:55,川普政府2日強調，國際刑事法院對美國公民不具司法管轄權。（路透資料照）川普政府2日強調，國際刑事法院（ICC）對美國公民不具司法管轄權。路透報導，美國司法部（U.S. Department of Justice）2日證實，已致函國際刑事法院，通知美方將不會配合ICC展開任何調查，並拒絕承認該法院對美國公民擁有任何司法管轄權。請繼續往下閱讀...美國並非2002年「羅馬規約」（Rome Statute）的締約國，該規約設立了ICC作為終審法院，賦予其起訴國家元首的權力。2020年3月，國際刑事法院檢方曾針對阿富汗展開調查，範圍包括美軍可能涉及的罪行。自2021年以來，ICC已淡化對美方行動的調查，但至今並未正式結案。    ,https://news.ltn.com.tw/news/world/breakingnews/5492254
伊朗又放話！警告油輪須遵守指定航線 否則將面臨「強力回應」,國際,2026/07/03 07:40,伊朗最高聯合軍事指揮部警告，所有通過荷姆茲海峽的油輪，都必須使用其批准的航線，否則將面臨「強力回應」。（路透檔案照）伊朗最高聯合軍事指揮部2日警告，所有通過荷姆茲海峽（Strait of Hormuz）的油輪，都必須使用其批准的航線，否則將面臨「強力回應」。此舉再度加劇這條對國際能源供應至關重要水道的緊張局勢。美聯社報導，這條位於波斯灣狹窄出海口的海峽，已成為尋求永久結束伊朗戰爭談判中的首要議題之一。伊朗國家電視台報導，伊朗軍方作戰指揮部「哈塔姆安比亞中央總部」（Khatam Al-Anbiya）發表前述聲明。在此之前，美國與伊朗外交官1日甫於卡達與調停人員會面。請繼續往下閱讀...目前仍不清楚是什麼引發伊朗的威脅。然而，美國中央司令部（Central Command）曾發布一份關於在巴林與中東國家官員會面的聲明，其中提到「各國領袖強調他們對維持該海峽商業自由流通的共同承諾」。這句話可能激怒德黑蘭。伊朗正準備為已故最高領袖哈米尼（Ayatollah Ali Khamenei）舉行葬禮；哈米尼在2月戰爭爆發之初即告身亡。伊朗的聲明指出：「任何不遵守、偏離指定航線，或無視伊朗伊斯蘭共和國在荷姆茲海峽航行協議的行為，都將面臨武裝部隊立即且強力的回應，進而危及違規船隻的安全。」聲明還說，美軍在該海峽的干預「將面臨迅速且果斷的反應」。作為臨時協議的一部分，伊朗與美國同意允許船隻在60天內免繳費用通行。但德黑蘭當局堅持必須控制船隻的航線，並於日後收取通行費，此舉顛覆了該水道數十年來的慣例。美國與許多波斯灣阿拉伯國家表示，不會同意伊朗對通過該海峽收取費用。阿曼與一個聯合國機構試圖在阿曼海岸附近開闢新航線，上週末卻引發中東各地的襲擊事件，凸顯當前的緊張局勢。儘管發生襲擊事件，荷姆茲海峽的船舶運輸量仍持續回升。根據海事數據公司勞合商情社（Lloyd's List Intelligence）的資料，上週至少有258艘船隻通過該水道，期間包括伊朗對2艘商船的襲擊，高於前一週的138艘。勞氏日報（Lloyd's List）總編輯米德（Richard Meade）2日在一場網路研討會上表示，伊朗在6月25日與27日發動的攻擊，「似乎已被遺忘」。自襲擊發生以來，海峽的交通略有減緩，且仍遠低於戰前每天約130艘船隻通過的水準。米德指出，由於船舶營運商必須在遵守伊朗要求，或冒險航行於由美軍看守的阿曼外海航線之間做出選擇，「這種情況毫無穩定可言」，「航線的選擇是每小時都在變化……而且取決於不斷變動的政治許可與即時安全評估。這絕非新常態。」本週稍早，伊朗國家電視台報導，1艘外國船隻在無視伊朗伊斯蘭革命衛隊（IRGC）的指示後，受困於該海峽。然而，該船隻的外型、通報位置及其他細節顯示，這艘船與伊朗有關，而且似乎已擱淺數月。    ,https://news.ltn.com.tw/news/world/breakingnews/5492209
川普遇刺驚人內幕曝！特勤局漏接102次通報 槍手行蹤全錯過,國際,2026/07/03 07:27,2024年7月13日，時任共和黨總統候選人川普於演說期間遇襲，造成1名旁觀者喪生，川普本人的耳朵也遭子彈擦傷。（美聯社資料照）美國國土安全部（Department of Homeland Security）2日發布的最新報告披露，總統川普於2024年7月在造勢活動現場遭槍擊過程中，美國特勤局（U.S. Secret Service）漏接了賓州巴特勒（Butler）地方執法單位102次有關槍手的無線電通聯，因此未能及時掌握嫌犯行蹤。路透報導，美國國土安全部監察長2日發布報告指出，2024年7月13日當天，特勤局並未與地方執法機關設立聯合通訊室，而地方執法人員當時曾透過無線電持續通報搜尋1名可疑人士，該人士隨後被確認就是槍手庫克斯（Thomas Crooks）。請繼續往下閱讀...報告顯示，「我們發現，特勤局僅收到有關庫克斯的5通電話及3則簡訊。」報告並稱，「因此特勤局人員未針對可疑人士的情況向川普總統的隨扈團隊發出警報。」庫克斯隨後在造勢活動中遭執法人員擊斃。他在時任共和黨總統候選人川普登台演說期間開槍，造成1名旁觀者喪生、多人受傷，川普本人的耳朵也遭子彈擦傷。報告指出，庫克斯當時登上一棟鄰近建築物的屋頂，該處可直接瞄準川普。特勤局尚未立即回應媒體置評請求。報告另指出，庫克斯在犯案前數小時曾操作無人機飛越造勢活動場地，特勤局卻未能發現，原因是其反無人機系統當時無法正常運作。監察長表示，反無人機系統當天僅由1名「訓練不足」的操作員負責，且活動開始前沒有進行設備測試。報告稱，該名操作員花費了數小時嘗試排除故障，在此期間，嫌犯實施了長達近9分鐘的無人機飛行，全程未被發現。這是美國政府監察機構及國會委員會針對槍擊事件展開一系列調查中的最新一份報告，再度指出特勤局在這場造勢活動安全部署上存在重大缺失。    ,https://news.ltn.com.tw/news/world/breakingnews/5492239
