Title,News_Type,date,content,url
想吸收退役軍官當共諜遭拒 前四海幫錢家兆判刑3年2月定讞,社會,2026/07/17 11:27,高雄高等分院今年3月依國家安全法之發展組織未遂罪，將錢男判處3年2月有期徒刑；最高法院駁回錢男的上訴，全案定讞。（記者張文川攝）前四海幫成員錢家兆，被中國福建省廈門市王姓村長以金錢誘惑而淪為共諜，返台試圖吸收金防部文姓退役軍官發展組織及刺探軍事機密，但被對方拒絕，吸收未遂；高雄高分檢獲報偵辦起訴錢家兆，高雄高等分院今年3月依國家安全法之發展組織未遂罪，將錢男判處3年2月有期徒刑；最高法院駁回錢男的上訴，全案定讞。據悉，花蓮高分檢於偵辦空軍戰術戰鬥機聯隊程姓前軍官（另案起訴）涉嫌刺探國防軍機案，赫然發現前四海幫成員錢家兆牽涉其間，他於2015、16年間頻繁往返中國洽談生意，結識中國福建廈門市翔安區澳頭村的王姓村長，對方以金錢誘惑吸收他，錢男同意為中國發展組織。請繼續往下閱讀...錢男為了賺得每月的固定報酬，於2021年5月間，兩度與從金門守備大隊戰車營排長退伍的文姓軍官接觸，要求他利用之前的軍職身分和人脈，吸收其他現役同袍加入，意圖蒐集軍機及發展組織，但文某無意加入而予拒絕。錢男另取得軍方「識別證」及軍隊相關資料，交給王姓村長及所屬對台工作組織。高雄高分檢檢察官接獲情資，指揮調查人員帶著搜索票搜索錢男住處，2025年底偵查終結，依違反國家安全法發展組織未遂罪提起公訴。高雄高等分院認定錢男的不法行為止於未遂，偵審期間自白認罪，依修正前的國安法規定予以遞減其刑，審酌錢男僅為圖獲取小利，接觸退伍軍人欲藉其吸收現役軍人發展組織，念及他自始坦承犯行，犯後態度良好，因未遂而未對國家安全造成實際危害，量處3年2月有期徒刑。錢男上訴，最高法院審理後認為上訴沒有理由，駁回其上訴，全案確定。    ,https://news.ltn.com.tw/news/society/breakingnews/5508384
不忍7旬老父為債四處奔波  孝女捧百萬救家族金字招牌,社會,2026/07/17 11:22,高雄一間20多年的木業公司積欠百萬勞健保費，公司負責人的女兒致電書記官捧百萬元救公司。（記者黃佳琳翻攝）高雄一家老字號木業公司積欠高達150萬元勞健保費，王姓負責人的兒子險被債務壓垮，幸得老父自簽擔保甚至被扣光保險金，女兒更主動「籌百萬全額代償」，只為保住公司金字招牌並讓老父安享晚年。行政執行署高雄分署指出，王姓男子在高雄經營在業界頗具名聲的木業公司，公司負責人登記在兒子名下，但實際負責人卻是王男。由於近年公司陷入經營困境，長期積欠勞、健保費達150萬餘元，被移送到高雄分署強制執行。請繼續往下閱讀...案件移送初期，愛子心切的父親不捨兒子背負債務壓力，主動前往分署申請分期，甚至親簽擔保書以個人名義承擔起全部責任。無奈公司經營仍未見起色，王男中斷繳款，高雄分署隨後廢止分期，對王男名下財產展開強制執行，甚至解除其個人保險契約，強行扣取解約金抵償，但仍有百萬餘元無法結清。眼看債務缺口難補，王男的女兒日前主動從北部致電書記官，表明不忍老父親為了債務每天勞心奔波。她強調，木業公司是家族打拚20多年的成果，且已有業者洽詢收購，為了保住自家金字招牌乾淨過戶給後手，同時讓老父放下重擔安心退休，她決定自己籌措資金，將剩餘百萬欠款一次全額繳清。這場溫暖的「女兒救父」行動，不僅守住了品牌，也讓公司、家屬與國家順利達成三贏結局。    ,https://news.ltn.com.tw/news/society/breakingnews/5508387
持西瓜刀搶便利商店被女店員拒絕 他回「不要就算了」落跑,社會,2026/07/17 11:16,桃園地檢署因恐嚇取財案件，將李姓男子提起公訴。（記者周敏鴻攝）桃園市40歲李姓男子今年2月26日下午2點左右，持西瓜刀走進觀音區建國路1處便利商店，向女店員恫稱：「搶劫，把錢拿出來！」女店員秒回：「不要！」他未逞凶卻回話：「不要就算了！」隨即逃逸，警方循線追查他到案後送辦，桃園地檢署偵結後，已因恐嚇取財案件將李男提起公訴。檢方調查，李男當天駕駛轎車前往觀音區的1處便利商店，拿著西瓜刀走進便利商店後，就想搶錢，遭女店員拒絕後，他悻悻然回答：「不要就算了！」、「我缺錢，沒有錢吃飯！」隨即走出便利商店，開車逃逸。請繼續往下閱讀...警方獲報後追查，很快逮回李男並扣得西瓜刀1把；檢方表示，李男坦承犯案，因他涉嫌恐嚇取財未遂罪嫌，已提起公訴。    ,https://news.ltn.com.tw/news/society/breakingnews/5508362
白色轎車僅擦撞休旅車竟然整個翻覆 宛若特技鏡頭,社會,2026/07/17 11:07,白色轎車擦撞停放路旁休旅車，竟然整個車輛翻覆。（警方提供）59歲范姓婦人昨天中午11點左右，駕駛白色轎車沿桃園市中壢區龍岡路三段往龍岡圓環方向直行，行經外側車道時，向右偏移擦撞到停放路旁黑色休旅車，白色轎車失去平衡，竟然整個車輛翻覆，宛若電影特技鏡頭，范女多處擦挫傷，經測試酒測值為0，肇事原因尚待警方調查。該事故被網友PO網引發討論，直說「這樣也能撞」。網友紛紛留言「我都不知道汽車也要學平衡」、「怎麼會越開越旁邊啦，又不是騎車」、「不知道是在開三小」、「路邊那台車真倒楣」，還有網友質疑划手機，立刻引起回應「沒錯，一堆人開車很快又滑手機就會這樣」。請繼續往下閱讀...警方調查發現，當時黑色休旅車停放在路邊，白色轎車是擦撞到休旅車的左側後，導致白色轎車的右側彈起，失去重心後整個翻過來，警方也通知救護車到場，所幸范女並無大礙導致。白色轎車擦撞停放路旁休旅車，竟然整個車輛翻覆。（警方提供）    ,https://news.ltn.com.tw/news/society/breakingnews/5508355
持刀砍傷友人又性侵女親戚 惡男重判10年,社會,2026/07/17 11:03,潘姓男子因細故持刀將男姓友人砍成重傷後，跑到親戚家躲藏，女親戚好意留宿一晚，潘男竟起色心，強制性侵被害人。屏東地院認為潘男惡性重大，重判10年。（資料照）潘姓男子因細故持刀將男姓友人砍成重傷後，跑到親戚家躲藏，女親戚好意留宿一晚，潘男竟起色心，強制性侵被害人，警方據報將潘男依重傷害及妨害性自主罪送辦，屏東地院認為潘男惡性重大，依強制性交等罪併處潘男10年徒刑，可上訴。潘男今年1月間從外面回到住處後見女友與男性友人在客廳飲酒，雙方因細故發生爭執，潘男不僅砸傷女友，還跑到廚房拿起菜刀猛砍男友人，造成被害人左手臂肌腱斷裂，手部及腕部功能嚴重受損，潘男逞兇後，為躲避警方的追緝，跑到女親戚家躲藏。請繼續往下閱讀...潘男無視親戚家好意留宿，且屋中住有大人及小孩，為逞獸慾竟強制性侵女親戚，行徑惡劣，警方獲報後，隨即到場將他逮捕送辦。屏東地院認為潘男犯案手段兇殘，持刀犯下重傷害罪後，於夜間侵入女被害人家中，並使用暴力手段壓制被害人，強制性交得逞，惡行重大，應予嚴懲，依重傷害及強制性交罪併處10年徒刑。    ,https://news.ltn.com.tw/news/society/breakingnews/5508370
特勤攻堅破跨國詐團   千筆旅日中籍人士個資曝光4嫌收押,社會,2026/07/17 11:01,特勤攻堅在高雄楠梓大樓破跨國詐團。（記者蔡清華翻攝）橋頭地檢署於高雄市楠梓大樓住宅破獲詐團機房，由維安特勤隊突擊攻堅，逮捕4嫌，起獲千筆旅日中籍人士被害人名冊，已有被害人依指示匯款日幣500多萬元，檢警疑中國官方洩露個資給詐團，4嫌向法院聲請羈押禁見獲准。橋頭地檢署日前接獲情資，指不法集團在高雄市楠梓區成立詐騙機房，專組主任檢察官蘇恒毅、檢察官莊承頻指揮警方出動維安特勤隊，7月8日於楠梓區加昌路大樓住宅等處攻堅並執行搜索，破獲以魏姓男子為首之跨國電信詐欺機房，機房內詐團刻意於大門貼上符咒，並有符水、紙錢等物似為求財、保平安。請繼續往下閱讀...經複訊後，認機房內被告4人涉犯組織犯罪防制條例及詐欺等罪嫌重大，且有逃亡、勾串共犯及湮滅證據之虞，向法院聲押獲准。經查，該詐欺集團今年5月起，由魏姓、洪姓二名主嫌共同發起並主持電信詐欺犯罪組織，並招募林、黃二人擔任話務機手，承租高雄市楠梓區加昌路大樓住宅設立機房，專門針對在日本之中國籍人民進行詐騙，由第一線人員假冒中國通信管理局人員謊稱被害人發送違法簡訊；第二線人員假冒中國公安對被害人進行洗腦與監控；最後轉接由第三線人員假冒檢察官，要求被害人將款項匯入指定之人頭帳戶內。檢方發現一份高達1000名旅日中籍人士的名冊，列有詳細的地址、電話等個資，懷疑是由中國官方單位外洩暗助詐團取得，已有被害人依指示匯款日幣599萬餘元。專案小組將進一步擴大偵辦。嫌犯在大門以符咒鎮門。（記者蔡清華翻攝）    ,https://news.ltn.com.tw/news/society/breakingnews/5508372
醉漢清晨路中央亂竄闖車陣 警強制帶回保護管束,社會,2026/07/17 10:58,黃姓男子違規穿越馬路。（記者劉慶侯翻攝）50歲黃姓男子，今日清晨6時左右才結束酒攤，醉茫茫的走在台北市和平西路三段。由於他違規任意穿行街道引起警方注意，員警要攔截時他又在馬路中央竄行，最後警方將他強制帶回保護管束兩小時才結束一場鬧劇。北市警萬華分局龍山派出所員警17日6時許執行巡邏勤務時，於康定路與和平西路三段口見有男子任意穿越馬路，由於時值上班車潮和民眾漸多，員警便上前攔查。請繼續往下閱讀...黃姓男子見警方上前，突然逃竄跑向路口中央，警方以警用機車阻截，攔查時聞到對方身上酒味濃厚，為保護其與他人之安全，對其實施保護管束。後續將該名男子帶返所休息，待其清醒後始讓其離去。警方表示，飲酒應保持節制切勿過量，以免酒後失控而不慎觸法，如有違序違法等情事，警方將依法嚴辦，絕不寬貸，以維護社會秩序與公共安全。黃姓男子在馬路中央四處閃避逃竄，兩輛警車則在後追捕。（記者劉慶侯翻攝）    ,https://news.ltn.com.tw/news/society/breakingnews/5508364
緩刑期間再犯！苗栗警處理車禍求方便結案造假紀錄 判刑1年,社會,2026/07/17 10:54,苗栗地院依犯行使公務員登載不實準公文書罪，判處戴姓警員有期徒刑1年。（資料照）苗栗縣一名戴姓警員，處理機車自摔車禍，明知騎士拒絕就醫而自行離開醫院，為求方便結案，填載「依規定處理」等不實內容。苗栗地院審理，發現他之前已有此類「前科」，依犯行使公務員登載不實準公文書罪，處有期徒刑1年，不予宣告緩刑。戴姓警員於2023年9月17日晚間8點35分許，獲報與另一名同事前往處理一起機車自摔車禍，到場見騎士受傷，現場並已有消防人員進行救護，無法進行酒精測試，遂跟隨救護車到醫院，其同事於警車上待命，由戴姓警員下車進入醫院處理後續事宜。請繼續往下閱讀...不料，戴姓警員詢問醫護人員，得知騎士未經醫護人員救護或抽血檢驗，拒絕就醫而自行離開醫院。他未向同事回報上情，且為求方便結案，於返回派出所後，以電腦連結網路，接續在員警工作紀錄簿、110案件結報系統上虛偽填載「待醫院抽血報告，警方依規定處理」等不實內容，並依層陳核上級主管，損害於警察機關對於案件管理之正確性。戴姓警員被送法辦後，苗栗地院法官審理，查出他於2019年間至2021年4月間，為求功獎，曾犯行使公務員登載不實文書罪共3罪及行使變造公文書罪1罪，被判併應執行有期徒刑2年，緩刑3年。此次在緩刑期間又再犯罪質相同之案，依犯行使公務員登載不實準公文書罪，處有期徒刑1年，不予宣告緩刑。全案可上訴。    ,https://news.ltn.com.tw/news/society/breakingnews/5508357
勞動基金炒股案 操盤手游迺文二審改圖利罪判8年4月、唐楚烈8年,社會,2026/07/17 10:48,高等法院二審今天改依貪污治罪條例之主管事務圖利罪，將游迺文改判8年4月有期徒刑、褫奪公權5年，追徵沒收未扣案犯罪所得19萬餘元。仍可上訴。（資料照）勞動部勞動基金運用局國內投資組前組長游迺文，2020年疫情期間，與時任寶佳集團執行長唐楚烈、投資主管邱裕元合作操控勞動基金，高價承接寶佳集團「倒貨」出脫的18萬張遠東百貨股票，使寶佳獲利逾5.3億元，台北地檢署起訴12人，一審台北地院2022年8月依證券交易法之間接操縱股價罪，將游判處9年徒刑；經上訴，高等法院二審今天改依貪污治罪條例之主管事務圖利罪，將游迺文改判8年4月有期徒刑、褫奪公權5年，追徵沒收未扣案犯罪所得19萬餘元。仍可上訴。寶佳唐楚烈、邱裕元一審被依證交法高買低賣罪各判處8年徒刑，高院今維持唐楚烈的8年徒刑、追徵沒收2965萬元；邱裕元則是改判7年6月，沒收3123萬元，褫奪公權4年。請繼續往下閱讀...配合游迺文的券商操盤手，二審時皆認罪，高院依證券投資顧問法之背信罪，改輕判各1年7月至2年不等徒刑，並予緩刑3年至5年，條件是各向國庫支付60萬元至1000萬元。合議庭同時宣告，寶佳資產管理公司的不法所得4億3737萬餘元、旗下嘉源投資公司的6559萬餘元，扣除應發還被害人的金額及民事賠償金額後，應追徵沒收。北檢起訴指控，游迺文為了動用寶佳集團的政經影響力讓自己升官，竟利用監督勞動基金的職權，指示受勞金局委託代操的投信業者，於2020年新冠疫情爆發後、百貨類股紛紛下跌之際，以勞動基金承接寶佳倒出的大量遠東百貨股票，圖利寶佳集團。唐楚烈、邱裕元則於1年半期間拉抬遠百股價，製造相對成交，引誘投資大眾買進，使遠百股價漲逾37％，遠高於同類股同期的5.25％；2020年新冠疫情爆發後，遠百盈餘大幅衰退，兩人釋出寶佳將介入遠百經營權的流言，炒高股價後，再倒貨給勞動基金，破壞證券市場交易秩序。二審對於投信操盤手的判決，皆依證券投顧法之背信罪判處緩刑，包括復華投信時任投資長邱明強（一審判4年）改判2年、緩刑5年、向國庫支付1000萬元；復華副總經理劉建賢（一審判3年8月）改判1年11月、緩刑4年、向國庫支付300萬元。統一投信副總經理闕志昌、經理孫民承（一審皆判3年8月）同樣改判1年11月、緩刑4年、各向國庫支付600萬、300萬元；經理郭士慶（一審3年4月）改判1年9月，緩刑4年，支付國庫300萬元。統一投信研究員俞建業、復華研究員陳周倫，一審各被輕判8月、10月，但沒緩刑，二審今雖改重判1年7月，但皆緩刑3年，向公庫支付各60萬、80萬元。群益投信副總經理謝志英、共同基金經理人湯明真，一審即獲判無罪，二審今仍維持無罪認定。    ,https://news.ltn.com.tw/news/society/breakingnews/5508325
辣椒水之亂落幕！誤噴柯文哲遭記過拔官 周俊銘獲不起訴,社會,2026/07/17 10:47,周俊銘先後4次朝地面試噴，卻造成辣椒水霧飄散。（資料照）台灣民眾黨前主席柯文哲今年4月到台中逢甲夜市掃街，卻爆出警方誤噴辣椒水，導致現場多人掩鼻咳嗽的「辣椒水之亂」，時任第六分局長周俊銘不僅遭記過、拔官調非主管職，還因傷害罪遭函送法辦，台中地檢署近日偵結，認定周俊銘當下非執行職務，且告訴人已撤回告訴，予以不起訴處分。全案源於4月17日晚間，柯文哲與民眾黨台中市議員參選人劉芩妤在逢甲夜市掃街，當時柯文哲、劉芩妤及隨行志工、支持者突然聞到濃烈刺鼻氣味當場掩鼻、咳嗽，外界一度懷疑有人持辣椒水蓄意攻擊，劉芩妤隔天也報案並提出傷害告訴。請繼續往下閱讀...台中市警局調閱385支監視器畫面才還原真相，原來負責維安的周俊銘因發現隨身攜帶的辣椒水噴頭破裂，為確認是否外洩，先後4次朝地面試噴，卻造成辣椒水霧飄散，波及附近民眾，事後警察局長吳敬田公開向柯文哲、劉芩妤及受影響民眾致歉，並對周俊銘祭出記過、調離主管職等懲處。檢方調查指出，周俊銘噴灑辣椒水時，與劉芩妤及其他民眾距離約8.75公尺至21.1公尺不等，且辣椒水均朝地面噴灑，並非鎖定特定對象，也不是為驅離群眾或採取其他依法行使警察公權力的措施，雖處置有不當，但是難以認定是執行勤務行為。檢方表示，刑法傷害罪原則上屬告訴乃論，只有公務員於執行職務時犯傷害罪才不受限制，由於周俊銘當時並非執行警察職務，加上劉芩妤已撤回告訴，因此依法作出不起訴處分。    ,https://news.ltn.com.tw/news/society/breakingnews/5508313
前輔導長追妹13年被拒  騎車撞她家大門嗆「來世判你們死刑」,社會,2026/07/17 10:43,李姓前輔導長追妹不成由愛生恨，恐嚇她全家被判刑。示意圖（資料照）李姓退伍軍官追求女網友追了13年，遭拒後竟由愛生恨，不僅騎車衝撞女方住家大門，還傳簡訊狠嗆「我斷氣時，你們將跟我一起斷氣」，被法官依恐嚇危害安全罪判處拘役35天。判決指出，曾在軍中擔任輔導長的李姓男子，因追求女網友遭拒，甚至被女網友提告，李男竟由愛生恨，去年9月16日晚間，李男用手機傳送一連串詛咒簡訊給A女，內容恫稱「趕快恢復原狀，我斷氣時，你們將跟我一起斷氣，害我絕子絕孫，你們也將絕子絕孫」等語，甚至揚言死後要詛咒對方「房子下陷」、「來世判你們死刑」。請繼續往下閱讀...女網友收到簡訊後嚇得報警，並控訴李男自2012年間開始追求她，遭拒絕後就經常打電話或發簡訊恐嚇她與家人，還曾騎車瘋狂衝撞她家大門，以及手持棍棒朝她母親揮舞。高雄地方法院審理時，李男坦承有發送簡訊，卻否認恐嚇，辯稱只是希望女網友去跟檢察官說明清楚，並非故意恐嚇。法官認為，李男大專畢業又曾擔任部隊輔導長，具有正常的識別事理能力，「一起斷氣」與「絕子絕孫」等字眼，依社會通念已明確表達欲侵害生命並擴及親屬的加害意圖；結合李男過往持棍棒揮舞、衝撞大門的暴力前科，確實讓女網友及家人產生巨大的安全危害與畏怖感，依恐嚇危害安全罪判處拘役35天，可上訴。    ,https://news.ltn.com.tw/news/society/breakingnews/5508335
中山警邀店家分享防竊經驗 盼建構更完善社區治安防護網,社會,2026/07/17 10:41,台北市警中山分局邀請轄內易遭竊的3大商圈店家，以及轄內曾遭竊店家，參與「115年社區治安會議」。（記者邱俊福翻攝）台北市警中山分局為有效打擊民生竊盜，昨天首度邀請中山捷運站商圈、南西商圈、花博園區等3大商圈易遭竊店家，以及轄內曾遭竊店家，參與「115年社區治安會議」，希望透過分享防竊盜實務經驗與宣導最新防護觀念，緊密結合科技偵查與警政力量，建構更完善的社區治安防護網。中山分局表示，會議除加強防竊，並宣導AI深偽（Deepfake）反詐騙、鼓勵民眾檢舉詐欺車手，更著重點於近期危害甚巨之毒駕、藥駕，強化民眾「識毒、防毒」的觀念；另外，隨著115年地方公職人員選舉將近，台北地方檢察署檢察官到場宣導，強調任何形式的賄選、選舉賭盤、境外勢力介選或選舉暴力，皆會嚴重破壞民主制度，呼籲大家通力合作、共同查緝，維護乾淨、公平的選舉環境。請繼續往下閱讀...同時，中山分局強調， 治安工作不僅需要警方的全力投入，更仰賴社區、學校及民間力量的共同參與，這次會議透過與轄內民眾面對面的近距離溝通，能直接聆聽基層里民與店家的真切建言，未來警方將持續突破傳統宣導局限，展現對治安工作的高度重視與積極作為，打造讓市民安心的宜居環境。    ,https://news.ltn.com.tw/news/society/breakingnews/5508332
詐團騙抵押房地貸款 南投、草屯地政所共擋下2千多萬元,社會,2026/07/17 10:25,詐騙集團想盡辦法榨乾被害人財產，相中不動產設定抵押借款就是其中手法，地政所人員已幫忙阻止多件不動產詐騙設定抵押案。此為示意照。（南投縣警方提供）小心！有南投長輩被詐團誘騙有高獲利投資，找代書到南投地政所將名下價值900萬元的不動產設定抵押借款，被地政所人員擋下；另草屯地政所也曾阻止2件同手法詐騙案，另有20歲年輕人短期內頻繁設定高額抵押，地政所幫忙擋下，事後家屬還在網路公開致謝。台灣以房地產為目標的「地面師」詐騙越來越多，南投地政事務所不久前才有長輩拿著土地所有權狀等資料，到該所辦理不動產設定抵押，他的土地價值900萬元，地政所人員經旁敲側擊發現老人家疑似遭詐騙，聯絡警方到場協助詢問說明，老人家才說，有人「報賺錢好康」，有高獲利的投資，身邊沒有現金才來抵押設定借款，警方和地政所合力勸說後才未辦理。南投縣警方16日下午還在治安回報公開表揚地政所人員。請繼續往下閱讀...據了解，不只南投地政所眼尖發現詐騙房地產抵押設定，草屯地政所也在前兩個月陸續遇到2位民眾想投資賺錢，到該所辦理房地產設定抵押，經地政所人員勸說才沒有辦理，阻止上千萬元不動產被詐騙。此外該地政所還遇到1名20歲年輕男生，頻繁到地政所拿父母不動產證件要辦理高額設定抵押，地政所探詢原因，對方只說「要修繕房屋」，地政所聯絡其家人，家人趕來了解，才知年輕人被網路詐騙欠錢，只好來辦設定抵押借款，經家人阻止才避免家中不動產落入詐騙集團手裡，事後年輕人的媽媽還到地政所官網致謝。地政所人員建議，民眾可免費申辦「地籍異動即時通」，有家人辦不動產異動時，會收到簡訊通知，為財產加一道鎖。20歲年輕人被網路詐騙，到草屯地政所辦不動產設定抵押，地政所幫忙擋下，其家長還上網致謝。（圖擷自網路）    ,https://news.ltn.com.tw/news/society/breakingnews/5508297
獸父多次性侵猥褻親生女 妻怒告揭惡行送辦,社會,2026/07/17 10:19,陳男多次猥褻、性侵親生女，妻怒告揭獸行送辦。（資料照）陳姓男子多次在家中猥褻就讀國中的女兒，造成被害人身心受創，陳妻得知丈夫惡行後，決定報警處理，將陳男依妨害性自主罪送辦，屏東地院認為陳男行為悖逆倫常，惡性非輕，依強制性交及猥褻等罪併處陳男6年徒刑，可上訴。屏東陳男與妻子、女兒同住，卻在女兒就讀國中期間，多次在住家強制猥褻及性侵女兒，令女兒難以隱忍，決定向母親揭發父親獸行，母女倆不再姑息，報警將陳男送辦。請繼續往下閱讀...屏東地院認為陳男為逞一己私慾，悖逆倫常，對親生女兒強制猥褻及強制性交，嚴重影響被害人身心發展，造成被害人精神痛苦，惡性非輕，陳男犯強制性交罪，共2罪，各處4年2月及4年6月徒刑，又犯強制猥褻罪，共2罪，各處10個月及1年2月徒刑，合併應執行6年徒刑。    ,https://news.ltn.com.tw/news/society/breakingnews/5508312
