Title,News_Type,date,content,url
首波婚育宅將開放申請 民進黨：未來3年再釋出1萬戶,政治,2025/10/19 13:25,民進黨今天在社群發文提醒，「婚育宅」即將開放申請，包含台北市、新北市 與高雄市，第1波761戶婚育宅10月27日開放申請。（圖由民進黨提供）民進黨今天在社群發文提醒，「婚育宅」即將開放申請，包含台北市、新北市與高雄市，第1波761戶婚育宅10月27日開放申請，今年將推出1022戶、未來3年預計再釋出1萬戶，未來中央興建的社會住宅，保留至少2成給新婚、育有6歲以下幼兒的家庭優先入住，打造更完善的青年婚育支援系統。民進黨指出，民進黨執政以來，陸續推動0到6歲國家一起養、增設公托準公托、育嬰假彈性化、生育與生殖補助擴大，也幫小家庭減稅，減輕青年朋友成家立業的負擔。請繼續往下閱讀...民進黨表示，現在政府再加碼推出婚育宅，給新婚、育兒家庭更多租屋上的支持，包含台北市、新北市 與高雄市，第1波761戶婚育宅10月27日開放申請，今年將推出1022戶，未來3年預計再釋出1萬戶。民進黨提到，未來中央興建的社會住宅，將保留至少2成給新婚、及育有6歲以下幼兒的家庭優先入住，育兒家庭最高可租12年，比現有社會住宅的租期長1倍，另搭配育兒安全設施補助（防墜、防撞、防燙）每年最高6000元，減輕租屋壓力的同時，讓下一代主人翁能在安全的環境安心成長。民進黨表示，相關政策資訊詳情，請留意內政部公告，民進黨政府將持續打造更完善的青年婚育支援系統，讓每一位努力打拚、想成家生子的年輕朋友，都能擁有最堅實的後盾！熱門賽事、球星動態不漏接    ,https://news.ltn.com.tw/news/politics/breakingnews/5216418
《聽海湧》昔遭列砍預算理由 邱議瑩嗆柯志恩：要選市長先尊重文化,政治,2025/10/19 13:24,民進黨立委邱議瑩與國民黨立委柯志恩。（本報合成，資料照）公視《聽海湧》入圍第60屆金鐘獎14項大獎，昨（18）日勇奪迷你劇集獎等5項大獎。對此，民進黨立委邱議瑩除恭賀劇組外，也點名國民黨立委柯志恩，批評她先前在立法院以「篡改歷史、毀人名節」之說貶抑該劇，呼籲柯應先完整看完作品，認識並尊重高雄影視團隊的實力與用心。事件源於今年1月立法院初審114年度中央政府總預算案時，國民黨團提案刪除公視23億元預算，並指出該黨立委柯志恩細數公視多項爭議，當時更批評《聽海湧》「不願謙卑面對篡改歷史、毀人名節的嚴重爭議」，引發影視圈強烈反彈。最終經協商，國民黨團改為刪減1%，即約2300萬元。請繼續往下閱讀...邱議瑩今（19）日在臉書發文表示，恭喜來自高雄的《聽海湧》勇奪五項大獎，劇組在高雄用心創作出這麼動人的作品，這是高雄的驕傲，也是台劇的光榮，「好的作品，值得被看見，也值得被支持」。邱議瑩直言，遺憾的是，這樣的在地好劇，卻曾被準備參選高雄市長的國民黨立委柯志恩，在立法院用「篡改歷史、毀人名節」來貶抑、踐踏。同時更誠摯建議柯志恩，好好看一遍《聽海湧》，認識並尊重高雄影視團隊的實力與用心。邱議瑩強調，要選高雄市長，柯志恩不僅不支持在地文化創作，還帶頭唱衰、抹煞地方努力，「這樣的人若掌舵城市，將會帶給高雄怎樣的文化想像？」國民黨團批評《聽海湧》「不願謙卑面對竄改歷史、毀人名節的嚴重爭議」，曾提案將公視23億元預算全數刪除，引發輿論譁然。（擷取自邱議瑩臉書）熱門賽事、球星動態不漏接    ,https://news.ltn.com.tw/news/politics/breakingnews/5216395
台日友好！ 新北板橋公所與日本富山魚津市簽觀光MOU,政治,2025/10/19 13:14,新北市板橋區長陳奇正（右）與日本富山縣魚津市市長村椿晃代表簽署觀光交流合作備忘錄。（圖由板橋區公所提供）新北市板橋區公所率團赴日參訪，18日在大阪經濟文化辦事處副處長劉拓、魚津市議會議長金川敏子暨全體議員、新北市議員山田摩衣等人見證下，和日本富山縣魚津市共同簽署「觀光交流合作備忘錄」（MOU），未來雙方將透過文化、觀光、教育及產業等多面向合作，攜手推動互惠發展，促進台日友好。板橋區公所指出，魚津市位於日本富山縣東部，土地面積約200平方公里，人口約3萬8224人，以農、漁業為主要產業，並以豐富的自然景觀與歷史文化為主題推展觀光，近年積極拓展國際交流，去年起陸續與新北市政府教育局、板橋區公所、板橋區宗教寺廟及各級學校進行7次互訪及視訊交流，今年也提供名列世界文化遺產的「船型萬燈祭」特色燈籠在新北燈會展出。請繼續往下閱讀...板橋區長陳奇正表示，魚津市是板橋區在日本簽署備忘錄的第1個友好城市，他感謝山田摩衣居中牽線促成。板橋區是新北市的行政中心，近6年多來在新北市長侯友宜帶領下，積極推動地方重大建設、產業發展、全齡共融公園、觀光與社會福利，打造安居樂業的生活環境，希望未來在地方治理與公共建設經驗與魚津市相互借鏡。魚津市市長村椿晃說，期待雙方未來在觀光文化推廣與教育交流等領域，展開多面向合作。魚津市安排板橋團隊走訪市役所、議會、學校、防災避難公園、舉辦「船型萬燈祭」祭典的諏訪神社、保存超過2000年古森林遺跡的埋沒林博物館，以及日本現存最古老的魚津水族館等知名景點。新北市板橋區公所率團參訪日本富山縣魚津市星之杜小學校。（圖由板橋區公所提供）新北市板橋區公所率團訪日，參訪富山縣魚津市役所。（圖由板橋區公所提供）熱門賽事、球星動態不漏接    ,https://news.ltn.com.tw/news/politics/breakingnews/5216413
「國共內戰」再敗！最大在野黨變紅 綠營點出台灣未來1大危機,政治,2025/10/19 12:54,民進黨新聞部副主任黃子一分析指出，「中共代理人」當選台灣最大在野黨、國會最大黨的黨主席，長期對台灣整體政治環境是一大傷害，令人憂心。（資料照）鄭麗文贏得中國國民黨主席選舉，被視為中共介入台灣政黨選舉首例。民進黨新聞部副主任黃子一認為，「中共代理人」當選台灣最大在野黨、國會最大黨的黨主席，短期或許對綠營是好事，但長期來看，對台灣政治環境是一大傷害，代表有3成台澎金馬人可能認同中國侵台、交出主權，令人憂心。黃子一指出，鄭麗文當選，其實同溫層沒什麼好開心的。當台灣最大在野黨、國會最大黨由中共指定的紅統派人士當選，這不只是國民黨的傷，更是台灣整體政治環境的傷。請繼續往下閱讀...​黃子一表示，「知識藍」、「正常藍」在2016年後就一直無法成為國民黨內的主流聲音，現在就連「根正苗藍」的郝龍斌、趙少康們都無法抵禦中共的介選，「國共內戰」再度戰敗。短期看，國民黨走向極端，2026選舉是否還能像2022年一樣拿下這麼多執政縣市，或許對綠營來說是好事；但長期看，其實很讓人憂心。黃子一指出，​民進黨執政以來，從「台灣獨立」變成「中華民國台灣」，再到「中華民國在台灣」，名稱雖不同，但始終堅持台澎金馬的主權與民主自由；反觀國民黨，從「漢賊不兩立」到「九二共識互相承認彼此是中國」，再到如今由主張「兩岸統一」、「我是中國人」的鄭麗文擔任黨主席。​黃子一認為，現實是，即使國民黨再荒唐，依然有超過3成的基本盤，如果國民黨連「中華民國派」都徹底放棄，成為實質上的統派，那就意味著將有3分之1的台澎金馬人，可能選擇認同中國侵略台灣，交出主權以換取所謂的自由。熱門賽事、球星動態不漏接    ,https://news.ltn.com.tw/news/politics/breakingnews/5216401
幕後》中國親自操刀億元網軍 力拱鄭麗文、打擊郝龍斌,政治,2025/10/19 12:42,黨政人士指出，中共透過組織、輿論與資源3大面向全力拉抬鄭麗文、打擊郝龍斌，光是網軍投入成本就上看億元規模。（資料照）鄭麗文贏得中國國民黨主席選舉，成為中國介入台灣政黨選舉的首例。據透露，中共中央涉台系統9月下旬拍板支持鄭麗文後，即透過組織、輿論與資源3大面向全力拉抬她，同時打擊郝龍斌，前期主打「郝龍斌太老」為主，後期中國介選曝光後，轉而由協力媒體痛批郝「無異於民進黨」；我國安全單位初步掌握，不少攻擊郝的網軍帳號及頻道由中共系統直接經營，投入成本上看億元規模。首先在組織面，根據北京方面消息，中共中央透過國共管道傳話，或當面要求國民黨各派系大老支持鄭麗文，或至少不得支持郝龍斌，國民黨副主席、秘書長層級等人近期赴中都被告知此訊息，其中一名前秘書長隨即轉向全力輔選鄭麗文，負責各派系及地方系統的經營，還遊說「前院長」等級大老公開切割郝龍斌；軍系部分，則由去年出席中國黃埔百年活動的季麟連負責黃復興系統。請繼續往下閱讀...據悉，涉台各級系統、台企聯也在北京交辦下以「認養」方式，透過多次電話、會面緊迫盯人，向所有關係管道的國民黨黨代表「耳提面命」務必支持鄭麗文，或稱郝龍斌當選「不利國共關係」，特別在郝龍斌陣營揭露中共「介選」後，幾乎所有黨代表都接到類似電話，指控郝的做法「無異於民進黨」，如果郝龍斌選上，國民黨將與執政絕緣。其次是輿論面，國台辦通知特定台灣媒體系統提高對鄭麗文的正面報導，包括配合各種選舉活動的媒體露出、現場訪問，談話節目也開始拉抬造勢。前期主打「郝龍斌太老」、「世代交替」，貼上「建制派」標籤，後期在中國介選曝光後，轉而批郝「學民進黨打介選牌」、「破壞國共關係」，兩家立場鮮明的平面媒體最後幾天也以大篇幅社論批判趙少康，實則攻擊郝龍斌。對於中央及網軍系統性的介入，除了趙少康等人揭露，有海量假帳號、AI假影片針對郝龍斌攻擊之外，經安全單位初步了解，不少帳號、頻道來自中宣部、統戰部、解放軍系統旗下經營；民間網路廣告業者也評估，類似操作在商業市場上，預算規模至少億元起跳。第三是資源面，據悉，在中國親北京的台商系統也全力動員，多位財力雄厚的國民黨台商黨代表，不約而同向鄭麗文承諾捐款及輔選。黨政人士提及，由於中國打擊力道之大，郝龍斌在相關人士暗示下，選前接受中天新聞訪問，主動澄清自己沒有指控中共介選，然而，完全沒有影響中國及協力者的攻擊力道，也造就這場選舉的最終結果。熱門賽事、球星動態不漏接    ,https://news.ltn.com.tw/news/politics/breakingnews/5216383
聯合政府？黃國昌：昨晚與柯文哲討論找藍營共同推動,政治,2025/10/19 12:36,台灣民眾黨主席黃國昌今天在新北市汐止受訪時指出，台灣民眾黨期許未來能與準國民黨主席鄭麗文共推聯合政府。（記者俞肇福攝）國民黨主席選舉昨天（18日）晚間落幕，鄭麗文以剛好過半得票勝選。台灣民眾黨主席黃國昌今天上午受訪時表示，這次國民黨主席候選人除了不認識前國大代表蔡志弘、也沒有電話，其餘5名候選人，他都親自撥電話致意，同時盛讚這次選舉展現民主風範，期許未來能與新當選的準國民黨主席鄭麗文共推「聯合政府」。黃國昌今天上午出席其新北市汐止、金山、萬里區主任陳語倢聯合服務處開幕典禮時受訪。媒體詢問鄭麗文當選，昨天是否與鄭通話、聊了些什麼，未來是否舉辦在野論壇？黃國昌說，鄭麗文算是他在台大法律系的學姊，在學校社團有碰過面，他昨晚對她說接下來任重道遠，為了台灣跟台灣人民，「我們接下來還有很多事情大家要持續共同努力」。請繼續往下閱讀...黃國昌表示，對台灣民眾黨而言，社會被總統賴清德搞得四分五裂後，不應再對立跟衝突、再有仇恨，民眾黨願意秉持最大善意跟誠意來推動聯合政府理念，彼此間即使意見不完全一樣，甚至不喜歡對方，「但我們都能坐下來好好討論人民所關心的重要事情」，甚至攜手為人民關心的事情來努力，這才是台灣人民所期待看見的。針對是否將舉辦在野論壇一事？黃國昌想了一下才透露說，他昨晚就和柯文哲在一起，針對聯合政府接下來推動步驟及時程進行非常縝密的討論及規劃，他強調在推動過程中，一定是先談理念、政策跟願景，而不是談任何位置分配。「我們如同所有台灣公民一樣，推動聯合政府一定要先談理念政策，而非職位安排」。針對後續具體行動，黃國昌說，民眾黨目前將以2個軸線推動：首先是籌辦「第一場聯合政府研討會」，探討地方層級的聯合治理理論，並已邀請外國學者線上參與，未來盼能來台發表專題演講。其次，政策會也正規劃「地方政府聯合政府展望」議程，持續深化理論與實務結合。黃強調，民眾黨推動聯合政府「不是為了分配位置」，而是要正視各黨之間理念的異同與可合作空間，「我們一定開大門、走大路，讓大家明白我們的方向」。熱門賽事、球星動態不漏接    ,https://news.ltn.com.tw/news/politics/breakingnews/5216361
四中全會前9上將遭開除黨籍 學者：習抓「大老虎」樹立權威,政治,2025/10/19 12:33,前中共中央軍委副主席何衛東（左）和軍委主席習近平（右）。（路透資料照）中共20日起將在北京舉行四中全會，中國國防部近日先公布包括中央軍委副主席何衛東等9名解放軍上將被開除黨籍軍籍，移交司法。學者今日分析，習近平想在2027年中共「二十一大」延任，會抓軍中「大老虎」對內外展現實現「祖國完全統一」的決心，樹立最高的軍事領導權威。被開除中國共產黨黨籍、軍籍的解放軍9名上將，包括中央軍委副主席、中央政治局委員何衛東，中央軍委委員、軍委政治工作部原主任苗華，軍委政治工作部原常務副主任何宏軍，軍委聯合作戰指揮中心原常務副主任王秀斌，東部戰區原司令員林向陽、陸軍原政委秦樹桐、海軍原政委袁華智、火箭軍原司令員王厚斌、武警部隊原司令員王春寧。請繼續往下閱讀...中共中央軍委機關報《解放軍報》18日發表評論，強調只要搞腐敗就絕不姑息，沒有免罪「丹書鐵券」，沒有「鐵帽子王」；外界關注本次四中全會是否增選中央軍委委員或副主席。對此，成功大學政治系教授洪敬富受訪表示，四中全會主要關注「黨的紀律」等問題，何衛東等中共高階將領涉貪瀆腐敗，被開除的不僅是中央軍委會副主席及高階將領，有的也是中共政治局委員，習近平當初提拔的人，近年紛紛落馬下台。洪敬富指出，這反映出中共高階將領的離心離德及腐敗問題，解放軍不如外在所表現的威嚇。共產黨非常善於宣傳，例如九三閱兵或軍演導彈威嚇，但缺乏實戰演練經驗，解放軍高階將領不見得跟習近平要求的一樣，在2027年要做好武力解放台灣的準備。洪敬富談及，習近平面臨「獨裁者的困境」，雖然位高權重，但下面的人阿諛奉承，習近平是軍委會主委，但你把這些重要軍事將領都移除，底下是整個系統的，不只是何衛東幾名軍事將領而已。洪敬富分析，這些高階將領被拔掉後，再重新培養、軍事備戰都需要相當時間，而且美國情報部門也曾揭露，中國彈道飛彈內的燃料槽內裝水。這不是外界所傳的把反對武統的將領都換掉，就能夠進行對台武統。中國軍隊內部的問題，恐怕習近平都不能夠放心。他研判，習近平想在2027年中共「二十一大」延續第四任，會抓軍中「大老虎」對內外展現實現「祖國完全統一」的決心，在2025年四中全會先處理「腐敗」將領後，便可樹立最高的軍事領導權威。熱門賽事、球星動態不漏接    ,https://news.ltn.com.tw/news/politics/breakingnews/5216385
傳回鍋接國民黨秘書長、任副主席 李乾龍否認：什麼都沒有,政治,2025/10/19 12:22,前立委鄭麗文（右二）當選新任國民黨主席，傳出前秘書長李乾龍（中）可能回鍋接任秘書長並兼任副主席。（資料照）前立委鄭麗文當選新任國民黨主席，外傳支持鄭麗文的國民黨前秘書長李乾龍可能回鍋擔任祕書長並兼任副主席。對此，李乾龍今天回應，昨天投完票就到中國上海參拜媽祖，至今尚未跟鄭麗文見面，「什麼都沒有」。鄭麗文宣布參選國民黨主席初期，就到新北市三重區先嗇宮拜會李乾龍，喊話國民黨必須世代交替、老幹新枝，呼籲透過公平競爭，選出最適合的新領導人，也希望李乾龍成為她的最大助力；當時李乾龍認為，黨內中生代踴躍投入是一股希望，期待更多中生代向國民黨靠近。請繼續往下閱讀...鄭麗文競選期間幾次造勢活動，都看到李乾龍現身力挺，外界盛傳，被視為輔選大將的李乾龍，可能回鍋擔任秘書長，為黨務工作運籌帷幄，也有一說指李乾龍可能兼任副主席，成為鄭麗文的左右手。李乾龍否認說，「沒有這回事」， 昨天他投完票，就馬上前往中國上海，現在在崑山拜媽祖，選後還沒跟鄭麗文見過面，「什麼都沒有」，請媒體不要亂寫。對於鄭麗文擔任黨主席的期許，李乾龍表示，希望兩岸和睦、和諧、和平，遵照鄭麗文的競選理念，堅持九二共識，促進兩岸合作，讓兩岸重回和諧、和平的路。熱門賽事、球星動態不漏接    ,https://news.ltn.com.tw/news/politics/breakingnews/5216371
鄭麗文當選黨主席讓藍憂形象「親共」 黨內要盧秀燕負責,政治,2025/10/19 12:18,國民黨主席選舉由鄭麗文勝出，當初拒絕參選黨主席的盧秀燕引發部分黨內怨言，認為若非盧不選，就不會造成今天的結果。圖為盧秀燕九月底與鄭麗文共餐情形。（資料照）首次上稿12:07更新時間12:18（補充台中方面說法）國民黨主席選舉昨天落幕，這次人選眾多，競爭激烈，最後由前立委鄭麗文勝出，但鄭日前遭質疑親共等中國介選問題，也讓黨內憂心未來國民黨的路線，當初拒絕參選黨主席的盧秀燕更引發部分黨內怨言，認為若非盧不選，就不會造成今天的結果。台中人士則表示，鄭麗文贏是因為大家期待的是世代與正直反宮廷的政治作風，幾位黨主席候選人的路線差異其實不大。請繼續往下閱讀...盧秀燕宣佈不選黨主席前，內部已針對候選人是否一定要兼任黨主席做過相關民調，有高達七成的民意認為不需兼任黨主席。而在盧秀燕宣佈不選後，也有相關民調釋出，進而支持盧秀燕不選的決定。但由於盧不選後，黨內多人競爭，在缺乏「共主」的狀況下，部分陣營私下廝殺嚴重，也種下未來黨內團結的隱患。黨內人士表示，此選舉結果，不僅讓國民黨2028重返執政之路更加困難，2026的地方選舉佈局更是首當其衝，國民黨「親中」的形象不僅無法擺脫，未來更朝「親共」邁進，即便黨內多數都反對，但一定會被民進黨持續操作親共形象，最後也難以挽救。黨內人士直言，黨內唯一共主盧秀燕不選，又要維持中立不指定接班人，雖然最後台中立委多有站台表態，但主要陣營私下已嚴重廝殺，支持者也分裂不滿，會造成這樣的結果不意外。盧秀燕如果是為了個人現階段無法承擔大任，或是又為了台中市民負責，但最終的選擇可能是把自己2028的路走死了。也有黨內人士說，盧秀燕從未公開表態要競逐2028，也許未來2年國民黨形勢不佳，盧也可以和這次黨主席一樣，表態不承擔！但無論如何，造成今天黨內分裂、形象親共的選舉結果，盧秀燕不能完全卸責。雖然選後大家都在喊團結，但國民黨哪一次沒喊？身為共主的盧秀燕要如何安定黨內，是她接下來的課題。台中人士表示，國民黨路線不見得會因為主席換人改變，而目前國民黨真正的戰場劃定者是縣市首長與立院黨團，2026提名修改空間已小，黨主席對政治議程的參與有限。該人士說，鄭郝之間是同一個派系的內戰，雙方都是挺盧，「對盧來說沒有損失」，地方的疑慮很快就會消失，因為提名不會有大的變動。台中人士說，鄭麗文在兩岸上根本沒有新的論述，大家對大陸路線也沒有大的差異，與前主席洪秀柱過去積極提出新的兩岸主張有根本性的不同。與其抱怨誰參與誰沒參與，不如正面來面對為什麼黨員對宮廷政治充滿不耐，充分尊重選舉過程的自由與其結果就是改革的一個部分，黨員已表現其意志。熱門賽事、球星動態不漏接    ,https://news.ltn.com.tw/news/politics/breakingnews/5216341
鄭麗文當選國民黨主席 許美華嗆「大家不演了」：此生不做中國人,政治,2025/10/19 12:00,國民黨新任黨主席鄭麗文。（資料照）中國國民黨主席選舉落幕，前立委鄭麗文以明顯票數擊敗前台北市長郝龍斌，正式當選新任黨主席。對此，反紫光奇遊團成員許美華表示，鄭麗文的核心政見是「讓台灣人能自豪地說出『我是中國人』」，她直言這樣反而好，至少誠實面對立場，「我是沒在怕，反正底線就是此生不做中國人，要戰就來戰！」許美華昨（18）日在臉書發文表示，雖然同溫層對於鄭麗文當選國民黨主席一事普遍很憂慮，但她的心情倒是很平靜。就跟反紫光奇遊團戰友忠憲說的，尼采的「熱愛命運」（Amor fati），這就是台灣人的命運。為了繼續當自由的台灣人，「台灣人要不要當中國人」這個命題，終須一戰。如果認清楚台灣人為了自由終須一戰的命運，與其繼續拖磨，倒不如及早正面對決。請繼續往下閱讀...許美華指出，鄭麗文參選的主要政見就是要讓台灣人能自豪地說出「我是中國人」。她願意直接說出這句話，許美華認為事件好事，至少她誠實講出她的任務，大家都不要再演了，直接直球對決。今天國民黨的「中華民國派」大敗，接下來的台灣，就是民進黨直接面對共產黨，台灣人直接面對中國人的對決了。許美華強調，最近幾年的許多民調數據都顯示，超過七成台灣人自認是台灣人而非中國人，且有六成民眾在台灣遭遇外來侵略時願意挺身保衛家園。不過，她警告，台灣社會又正遭逢源源不絕的資訊認知戰攻擊，配合藍白政治勢力的各種攻擊台灣、統戰洗腦，「洗愈久台灣其實愈危險，我們正在跟時間賽跑」。許美華點出，很多台灣人是不見棺材不掉淚，早早讓大家看到凜冬將至，生死存亡危機迫近，當要做台灣人還是中國人，變成沒有模糊空間的時候，很多台灣人才會認真思考、面對。她也相信，許多支持藍白的選民其實也不願成為中國人，只是沒意識到錯誤投票的後果可能讓台灣失去自由。在這個基礎上，趁早直球對決，對台灣反而可能是條生路。對於混亂艱險的未來，戰友忠憲這兩天講了一句話，很動人。「我們要做的，是在歷史墜落的那一刻，成為讓真理回升的力量。」最後，許美華強調，「我講白話文，我是沒在怕，反正底線就是此生不做中國人，要戰就來戰！」熱門賽事、球星動態不漏接    ,https://news.ltn.com.tw/news/politics/breakingnews/5216249
