Title,News_Type,date,content,url
搶小學生50元吃麵充飢 花蓮男判刑1年「吃牢飯」,社會,2026/04/19 09:15,花蓮地方法院。（記者王錦義攝）花蓮近40歲李姓男子因缺錢花用竟將歪腦筋動到年幼的小學生，在大街上強行搜刮男童口袋內100元，隨即拿去買麵充飢花掉50元。花蓮地方法院近日審結，認為李男正值青壯卻不思正途，竟對毫無反抗能力的兒童下手，依成年人故意對兒童犯搶奪罪，判處有期徒刑1年，犯罪所得50元沒收。檢警調查，去年1月底上午八點多，住在花蓮某部落的李姓男子看還在就讀小學四年級的男童年幼可欺，竟上前以左手搭住男童右肩，冷冷丟下一句「不要動」，隨後強行將右手伸入男童連帽T恤的口袋內，搶走100元現金。男童當場嚇得不敢動彈，只能眼睜睜看著100元被搶走。請繼續往下閱讀...李男得手後，隨即轉身前往附近麵攤花掉50元點餐消費，男童嚇的回去告訴家長，警方獲報通知到案，李男交出花剩下的50元坦承因缺錢買飯才會臨時起意。花蓮地方法院審理後，認為李男出言恐嚇並搭肩，男童因驚嚇，被害男童當時曾嘗試以手護住口袋並喊「不要搶」，因此法官認定李男行為應構成「搶奪罪」。有毒品前科的李姓男子在部落經常惹事，2023年因酒後與親屬發生爭吵，警方獲報後登門處理，李男拿著菜刀威嚇警方「這是我家務事，你不要管，不然我連你也照砍」，然後持刀追逐警員被制伏，之後遭法院依攜帶兇器妨害公務罪處有期徒刑6月；2025年因亂丟垃圾、破壞社區公物遭清潔人員勸告，還徒手毆打清潔人員遭判拘役30天；又因偷鄰居飼養的兩隻雞拿去轉賣被判拘役10天。法官認為，李男身為成年人，卻故意對未滿12歲的兒童行搶，依《兒童及少年福利與權益保障法》必須加重其刑，審酌李男過去有妨害公務、竊盜等多項前科，素行不佳，且僅為了區區100元就對兒童施暴，顯見法治觀念極其薄弱，量處1年徒刑，並沒收犯罪所得50元。    ,https://news.ltn.com.tw/news/society/breakingnews/5408545
火德星君回鑾慈鳳宮庇佑消防弟兄信眾可前往參拜,社會,2026/04/19 09:12,火德星君回鑾慈鳳宮。（慈鳳宮提供）屏東消防局第一大隊屏東分隊供奉由慈鳳宮迎請的火德星君坐鎮，近日因為屏東分院神房整修，火德星君回鑾慈鳳宮安座，供奉於太歲殿，由於火德星君掌管火事及化解災厄，消防兄弟遇到救災時誠心祈求，都能逢凶化吉，相當靈驗，這次回鑾慈鳳宮相當的難得，信徒可以前往參拜。慈鳳宮指出，火德星君是慈鳳宮早期供奉的神明，又稱「火德真君」，全名為「南方火德熒惑執法星君」，主掌天下萬物火事，亦是消防人員的重要守護神，自民國83年起，屏東縣政府消防局第一大隊屏東分隊，特別自慈鳳宮迎請火王爺駐守分隊，長年庇佑第一線消防弟兄，每逢救災艱難時刻，誠心請示火王爺，往往都能逢凶化吉、化險為夷，靈感事蹟廣為流傳，這次分隊神房進行整修工程，經火德星君降示，暫時回鑾屏東慈鳳宮安座，信徒可以前往參拜，祈求平安順遂、消災解厄。請繼續往下閱讀...民間說法火德星君是將軍化身，掌管著民間的火，常常拜奉他的人家裡不會出現火災或者其他的災難，其身分則有多種說法，有炎帝、祝融、回祿等。    ,https://news.ltn.com.tw/news/society/breakingnews/5408539
苗栗男子突持刀殺傷姑姑  警優勢警力逮人,社會,2026/04/19 08:54,苗栗警方將持刀傷人的男子逮捕帶回偵辦。（警方提供）苗栗警察分局昨（18）日傍晚接獲報案，指苗栗市一處社區大樓內有32歲男子持菜刀殺傷75歲姑姑，姑姑負傷逃出屋外，警方據報調派優勢警力到場處理，男子則將自己反鎖於屋內，經員警喝令男子開門不從後，由員警通知鎖匠協助開鎖進入屋內將該男子逮捕，老婦人送醫後幸無大礙，全案今（19）日殺人未遂及家庭暴力防治法等罪嫌移送苗栗地檢署偵辦。據警方初步調查，這名男子與姑姑同住，該男疑因精神狀況不佳，多年前中斷就醫，並未按時服藥，昨天傍晚不明原因突持菜刀，殺傷姑姑，姑姑負傷趕緊逃出，請鄰居報警，警方到場後，隨即將老婦人送醫救治。請繼續往下閱讀...該名男子則將自己反鎖於屋內，經員警喝令男子開門不從後，由員警通知鎖匠協助開鎖進入屋內將該男子逮捕帶回偵辦，因夜間未訊問，今天上午才偵訊，該男子稱因平常與姑姑不和，常起口角。老婦人右手腕、右手前臂及右腳趾被殺傷，患者意識清楚，經送醫後，無生命危險；據指出，老婦人昨晚見姪兒拿菜刀要拿給父親，她出言制止因而起口角，沒想到就被姪兒持刀砍傷。案由警方調查處理中。    ,https://news.ltn.com.tw/news/society/breakingnews/5408533
半月被阻3次怒撕提款單！台中翁爆氣「早投資百萬怎會被騙」 警：見一次擋一次,社會,2026/04/19 08:40,陳翁臨櫃提款被關懷提問。（民眾提供）台中市83歲陳姓老翁自述2年來已匯出百萬元投資土地，非常信任友人，不會被騙，近半個月內又接連前往不同銀行提領20萬到40萬元不等，卻因用途說詞反覆，引起行員與警方高度警覺聯手攔阻，氣得陳翁撕毀提款單離去，警方則表示，仍秉持「來一次、擋一次」信念持續把關，盼為其守住多年辛苦積攢的積蓄。據了解，陳翁近日至銀行臨櫃提領20萬元，起初稱是家用支出，又改口投資證券，甚至一度表示要到南部旅遊，前後說法反覆不一，行員察覺異狀，進一步查詢發現他近期已有多次異常提領紀錄，月初就曾遭攔阻提領40萬，立即通報警方協助。請繼續往下閱讀...第三分局員警到場關懷，陳翁強調曾從事金融業，對投資相當熟悉，不可能受騙，還表示因行動不便，才想一次提領較大金額減少往返，在員警持續追問下，才透露與一名認識10多年房地產友人進行土地投資，2年來已陸續投入近百萬元，但對土地位置與交易細節卻交代不清。員警直言提醒：「錢一直投入卻沒有回收，不會覺得奇怪嗎？」然陳翁仍堅信對方可信，認為只是投資尚未回本，就在警方與行員持續勸說之際，他以為已說出「實情」可順利提款，未料仍遭阻止，當場情緒失控，氣得撕毀提款單離開。未料陳翁離開不到一小時，又轉往另家銀行，改以旅遊與借款為由再次申請提領30萬元，依舊遭警銀聯手攔阻，警方隨即通知其家屬協助關心，並請銀行註記帳戶加強警示，盼能防止其多年積蓄持續流失。員警獲報趕往耐心勸說。（民眾提供）陳翁半月三度提款遭攔阻。（民眾提供）    ,https://news.ltn.com.tw/news/society/breakingnews/5408519
3年零暴力今破功！大甲媽還未到彰化市「一級戰區」 民眾就開打3警官掛彩,社會,2026/04/19 06:05,大甲媽還未到彰化市「一級戰區」，民眾就提前開打，造成多名官警掛彩。（民眾提供）首次上稿 04-18 23:59更新時間 04-19 06:05台中大甲鎮瀾宮「大甲媽」遶境18日跨過大度橋進入彰化市區，鑾轎還沒到「一級戰區」民生地下道，深夜10點50分另一邊的自強路就開打，疑因接駕團體推擠造成場面混亂，員警介入要隔開人馬，造成3名警官掛彩，其中一人被推倒在地流鼻血，現場逮捕2位民眾，以現行犯帶回派出所。請繼續往下閱讀...據初步了解，這場警民推擠造成警官掛彩，起源是有民眾在自強路與永安街口喝酒後傳出鬥毆，員警到場處理，想要隔開人馬，未料反而是員警被推擠進而掛彩，還有一人流鼻血，員警在混亂中壓制一位民眾。彰化分局副分局長楊昭賢表示，這起因為民眾推擠，警方要介入區隔，卻反而造成肢體的碰撞，員警因而跌倒受傷，共有3名員警擦挫傷不等程度受傷，當場逮捕2名滋事分子，後續將針對現場蒐證影像，陸續傳喚相關人員前來說明，並依法究辦。彰化縣警局組成「機動警察隊」，全力針對民生地下道周邊道路進行防範，希望創下三年零暴力紀錄，未料18日深夜提前開打，也宣告零暴力紀錄破功。而這起鬥毆事件發生時，已過晚間10點，現場煙火爆竹聲不斷，也引發民眾質疑與抱怨。彰化縣警局局長陳世煌，也立即指派督察長林英煌前往醫院探視慰問3名受傷員警，希望員警能夠早日恢復。「大甲盃」還沒過民生地下道就開打！ 大甲鎮瀾宮說話了「大甲盃」第二彈！大甲媽遶境彰化市區 一過民生地下道又打了！大甲媽還未到彰化市「一級戰區」，民眾就提前開打，造成多名官警掛彩。（民眾提供）大甲媽「一級戰區」民生地下道還沒到，提前開打造成多名警官掛彩。（脆jacky.627提供）大甲媽「一級戰區」民生地下道還沒到，提前開打造成多名警官掛彩。（脆jacky.627提供）大甲媽「一級戰區」民生地下道還沒到，提前開打造成多名警官掛彩。（脆jacky.627提供）    ,https://news.ltn.com.tw/news/society/breakingnews/5408470
戀愛腦遭騙4帳戶洗錢? 二審逆轉有罪,社會,2026/04/19 05:30,台南女聽「網公」甜喊「水某」，交四帳戶助洗錢151萬。一審認受騙無罪，二審認提供多帳戶即觸法，逆轉判刑5月。（記者王捷攝）王姓女子在交友APP陷入網戀，以為情人要給她錢，結果是提供帳戶協助詐團洗錢一百五十一萬餘元。一審時，王女的律師辯護王女是「戀愛腦」遭感情詐騙，獲判無罪，但二審逆轉，改依交付帳戶罪判處有期徒刑五月，併科罰金十五萬元。王女二〇二四年八月在網路認識自稱「張政」的男子，對方自稱從事精品代購，張男每天噓寒問暖，甜喊王女為「水某」、「老婆」，更承諾「名字要出現在我身分證上」，甚至提出要送情侶錶、出國旅遊等大餅，讓王女深信遇上真愛。王女隨即提供銀行、郵局帳戶，並加開兩個網銀虛擬帳號協助購買泰達幣。請繼續往下閱讀...但張男所屬詐騙集團利用王女的帳戶充當洗錢工具，八名被害人因投資等名義匯款，再將款項購買泰達幣後轉往指定錢包，掩飾所得流向。檢調追查認定，共有一五一萬七四八八元經王女帳戶手流出。一審台南地方法院審理時，法官認王女陷感情圈套而降低警覺，主觀上無洗錢或詐欺犯意，判處無罪。檢方不服而提上訴，主張洗錢防制法修正後，已針對「無正當理由提供三個以上帳戶」明定刑責。素未謀面 法官認定助長犯罪高等法院台南分院認為，王女與張男素未謀面，不具法規要求的信賴基礎，且提供四帳戶顯與交易習慣不符。縱使王女陷入甜言蜜語，但輕率提供帳戶助長犯罪是事實。考量王女未善盡帳戶責任，使犯罪者得以匿蹤，且未賠償被害人。二審撤銷原判決，改依提供三個以上帳戶罪判處五月徒刑，併科罰金十五萬元。    ,https://news.ltn.com.tw/news/society/paper/1751484
乾屍無異味 宛如沉睡木乃伊,社會,2026/04/19 05:30,警方將涉案張男(灰衣背對鏡頭者)帶回偵辦。（警方提供）宜蘭羅東一名九十一歲張姓老婦，死亡至少四年，與她同住的兒子疑似為了詐領老人年金，隱瞞母親死訊。警方會同相關人員入內查看後，發現老婦躺在房內床上，已呈乾屍狀，屍身覆蓋毛毯，衣衫略有破損但大致完整，現場沒有異味，宛如一具沉睡中的「木乃伊」。65歲兒 水電工退休據了解，老婦與退休前從事水電工作的兒子同住，母子二人平時鮮少與鄰居往來。附近鄰居表示，四年多前就未再看見老婦外出，也未聽見屋內傳出交談聲，當時便覺得有些奇怪。老婦的兩名女兒得知母親早已離世後，悲痛萬分。請繼續往下閱讀...早年社工訪視 也碰壁地方人士透露，張家早年曾有社工、里長訪視紀錄，但自二〇二〇年後，訪視人員便不得其門而入。由於屋主張男拒絕開門，相關人員依法也無法入內，就連其他家屬也因並非主要照顧者而無法探視，直到女兒報案、司法介入後，整起案件才因此曝光。奇！室內未開冷氣據指出，老婦被發現時，遺體完整地躺在自己房內床上，面容、頭髮及衣衫大致完整，外觀整潔、無明顯外傷，僅部分衣物破損並黏附於皮膚，宛如一具沉睡中的木乃伊。屋內四周環境也相當乾淨整齊，當時雖未開冷氣、室內溫度偏高，但現場仍無異味，附近鄰居也都未曾聞到屍臭味。根據資深刑警研判，形成「木乃伊化」乾屍的條件，通常必須處於極度乾燥且通風良好的環境，使體內水分逐漸蒸發，細菌因缺乏水分而停止繁殖，進而防止腐敗發生。張婦可能因年邁瘦弱、體內水分較少，加上張男早年持續開冷氣維持屋內低溫，並以頻繁擦拭遺體、替其更換衣物等方式處理，才可能形成未明顯腐敗的乾屍。    ,https://news.ltn.com.tw/news/society/paper/1751482
71歲婦駕車撞進店 夾死49歲用餐男,社會,2026/04/19 05:30,汽車撞入咖啡店內，滿目瘡痍。（記者彭健禮翻攝）苗栗縣頭份市一家連鎖咖啡店，昨天早上七點多，遭一輛汽車衝入，店內一名用餐的顧客賴姓男子遭撞，送醫傷重不治。警方調查，肇事駕駛為七十一歲林姓老婦，沒有酒駕、也沒有毒駕，準備前往買咖啡停車時，疑因操作不慎，致車輛撞入。檢警昨天下午相驗後，將林婦依過失致死罪嫌移送偵辦，檢方諭知十萬元交保。這起事故發生於昨天早上七點四十分許，林姓老婦駕車前往該家連鎖咖啡店買咖啡。她在將車輛停放於店家位於建國路二段的停車位時，突然間整輛車往前衝，撞入店內用餐區，整面落地玻璃碎裂，裡頭的餐桌椅也被撞得東倒西歪，滿目瘡痍。請繼續往下閱讀...當時店內有六名消費者，其中四十九歲賴男坐在背對落地窗的位置，沒辦法看見窗外動態，根本來不及反應，當場被衝入的車輛撞得夾在店內牆壁上。一名當時在店內的女性顧客驚恐地表示，事發當時汽車直接暴衝入店，速度很快，賴男坐在她對面桌，遭汽車夾住。消防人員獲報到場救援，賴男起初有意識，對聲音有反應且躁動，但無法說話，不過在送醫到院後不久突失去生命跡象，經醫院緊急插管急救，仍因傷重宣告不治。疑重踩油門釀禍警方調查，林姓老婦沒有酒駕也沒有毒駕情形，事發後，老婦也疑因飽受驚嚇沉默不語，只說「車子暴衝」，但警方依據咖啡店停車場臨路，停車場地勢為緩斜坡，研判老婦從道路開上停車場時，疑因油門一下子踩得太深，致使車輛衝入而肇禍。    ,https://news.ltn.com.tw/news/society/paper/1751483
91歲老母臥床亡 兒伴屍4年 詐領老人年金,社會,2026/04/19 05:30,宜蘭91歲婦成乾屍，同住兒伴屍至少4年以上，涉詐領老人年金遭宜蘭地檢署聲押，法院裁定無保請回。（資料照）兒無保請回 檢要抗告宜蘭羅東九十一歲張姓老婦，四年無健保就醫紀錄；家屬欲探視也遭同住的六十五歲兒子拒於門外。檢警獲報破門而入，赫然發現老婦躺在臥室已成「乾屍」。老婦兒子張男疑為貪圖老人年金，隱瞞母親死訊，伴屍四年詐領逾廿萬元；宜蘭地檢署聲押張男，卻遭宜蘭地院裁定無保請回，檢方將提抗告。兩女探視 屢遭弟拒絕據了解，張婦與無業的兒子同住；住在附近的兩名女兒，聯繫不上母親，屢次返家要探視，皆遭弟弟拒絕，不讓姊姊進入屋內，以媽媽在熟睡等理由阻擋在外。戶政單位清查也發現，年邁老婦竟長達四年無就醫紀錄，極不尋常。請繼續往下閱讀...鎮長、警員 都被擋門外老婦人女兒擔心與懷疑母親已經過世，向羅東警方報案，員警多次前往訪查，但張男態度強硬，拒絕警察入屋探視。羅東鎮長吳秋齡要頒發九十歲敬老禮金給張婦，也被張男擋在門外。4年無就醫紀錄 啟疑竇宜蘭地檢署檢察官林禹宏據報認為案情不單純，十六日晚上向法院聲請搜索票，指揮警方破門查緝，果真在屋內臥室尋獲死亡多時、已成乾屍的老婦人。警破門而入 婦已成乾屍張男當場被帶回偵辦，面對母親死因及為何隱瞞死訊等問題，皆語焉不詳、避重就輕，聲稱「不可考、忘記了！」檢警追查，張婦近年名下老人年金、重陽敬老禮金及女兒給的安家費等，均遭張男涉嫌隱瞞死訊並持續詐領，金額估超過廿萬元。檢方複訊後，認定張男至少涉犯偽造文書及詐欺等罪，向宜蘭地院聲請羈押；但法院前夜裁定無保請回。法官認為全案已經公開，張男無法繼續詐領，且與家屬也多年未曾往來，無串證虞慮，沒有羈押必要性；檢方不服裁定，認為張男刻意隱匿母親死訊，詐領老人年金至少四年有違常理，將提出抗告。檢追是否涉殺人或遺棄至於老婦確切死因，是否另有隱情？檢方將進行解剖釐清。不排除張男另涉殺人重罪；又或者是對年邁臥病母親，「消極不治療或照顧」而遺棄致死，這已列為後續偵辦重點。    ,https://news.ltn.com.tw/news/society/paper/1751481
粉紅超跑不保佑壞人 黑幫接駕當場被捕,社會,2026/04/19 05:30,威震集團威揚會林姓成員，在北港迎媽祖被逮捕。（記者徐聖倫翻攝）新北市警局刑警大隊十六日收網掃蕩威震集團威揚會，逮捕首惡郭姓男子等五人，並起出制式土耳其衝鋒手槍。警方透露，其中一路幹員當天南下雲林北港拘提幫派成員林姓男子，追查才發現，二十九歲的林男當時竟混在白沙屯媽祖「粉紅超跑」進香人潮中，趁著迎媽祖之際現身，最後當場遭警方活逮。警方事後也忍不住直言：「媽祖娘娘才不會保佑做奸犯科的人。」警方指出，專案小組蒐證期間掌握郭男等人活動情形，發現林男人在雲林，且正參與白沙屯媽祖進香活動。經進一步確認，林男當天會在北港朝天宮一帶迎接「粉紅超跑」，研判正是下手逮人的最佳時機。請繼續往下閱讀...十六日收網時，南下幹員混入路旁民眾中逐一比對、仔細搜索，最後鎖定身穿印有「天上聖母」字樣紅T恤的林男身影。警方一路尾隨，待時機成熟，隨即趁其不備上前壓制逮人。林男突然落網，當場一臉錯愕。警方當場也虧他：「犯罪還敢在媽祖娘娘面前晃來晃去，真白目！」林嫌到案後向警方供稱，自己只是聽命行事，並不覺得有什麼不對；至於參與白沙屯媽祖進香，則純粹出於個人信仰。警方聽完也忍不住訓斥：「媽祖娘娘可沒叫你加入黑幫。」全案警詢後，已依法移送檢方偵辦。    ,https://news.ltn.com.tw/news/society/paper/1751480
黑幫設局逼藥局還債 劫400萬瘦瘦針私賣,社會,2026/04/19 05:30,警方扣回本票、借據、現金、手槍等證物。（記者徐聖倫翻攝）藥局老闆賭線上博弈欠債新北市板橋區某知名藥局老闆，因線上博弈欠債，被威震集團威揚會郭姓會長盯上，表面上稱協助「債務整合」，實則放高利貸，趁其無法償還利息，強索違約金四千萬不成，便洗劫藥局內價值近五百萬元的「猛健樂」與「犀利士」，私下販售處方藥牟利。新北市警局刑警大隊偵一隊十六日據報循線逮捕郭嫌與旗下成員共五人，起獲制式土耳其衝鋒手槍，依組織犯罪、槍砲、重利、恐嚇取財、妨害自由、違反藥事法等多項罪嫌移送檢方偵辦。被威震集團威揚會長盯上警方表示，「犀利士」與俗稱「瘦瘦針」的「猛健樂」屬處方藥，未經醫師診斷自行服用具健康風險，且非法管道來源不明，多屬偽藥或禁藥，隨意販售嚴重違反「藥事法」；警方並強調，未經許可販賣或轉讓相關藥物，最高可處七年以下有期徒刑並科五千萬元罰金。請繼續往下閱讀...​稱債務整合 利率高達30分警方調查，受害的藥局老闆，因沉迷線上博弈，欠下賭債，四十二歲郭男獲悉後，便放高利貸給他為其紓困，利率高達「卅分」，隨後在被害人無法償還利息下，便以各種名目恫嚇被害人支付高額賠償金，金額高達四千萬元。光違約金 就強索四千萬郭男見對方無法支付鉅額賠償金下，便鎖定藥局內的高價藥品，當場搜刮走市價高達九十六萬元的八箱知名壯陽藥「犀利士」。​不久，郭男等人食髓知味，見俗稱「瘦瘦針」的「猛健樂」在醫美市場奇貨可居，再度登門，佯稱要談合作，開口就要藥局「無償提供」三百支；這批藥品市價高達四百萬元，郭男派人強行取走後轉售牟取暴利。警方據報經佈線蒐證，十六日兵分多路查緝，在北市中山區搗破郭男據點，並南下雲林抓捕成員，共逮捕郭男與旗下成員共五人到案，起獲制式土耳其ZORAKI 914衝鋒手槍、子彈十三顆。警方另扣回總額七百六十三萬元的本票卅張，以及借據、筆記型電腦、廿萬元現金等贓證物。警方表示，郭男等人涉及高利貸重利罪，並以本票威逼業者就範，郭男等人對此則堅稱是單純借貸，沒有犯罪。詢後依法移送檢方偵辦。警方起獲制式土耳其衝鋒手槍、子彈。（記者徐聖倫翻攝）郭嫌等5人遭警方移送法辦。（記者徐聖倫翻攝）    ,https://news.ltn.com.tw/news/society/paper/1751479
中國律師來台幫奧地利廠商打官司   「這原因」中檢偵結不起訴,社會,2026/04/18 23:48,中國律師劉蓉芳到台中法院開庭，中檢認為劉男是Baren公司法律顧問，自可代理出庭，難認有意圖營利，近日偵結不起訴。（翻攝網路）台灣腳踏車廠商宥博企業，控告奧地利Baren Bike GmbH公司積欠貨款，對方委任中國律師劉蓉芳來台出庭，遭台灣廠商委任律師當場反對，外界質疑違反律師法，並危及國安，台中地檢署主動簽分偵辦後，認為劉男是Baren公司法律顧問，自可代理出庭，難認有意圖營利，近日偵結不起訴。台灣腳踏車廠商宥博企業公司，控告奧地利Baren Bike GmbH公司積欠台幣6800萬餘元貨款，Baren Bike GmbH委任中國劉姓律師來台出庭，台灣廠商委任律師蔡昆洲當庭反對，事後並在社群披露，「在台中地院驚見中國籍律師擔任訴訟代理人」，認為嚴重衝擊司法主權及國安。請繼續往下閱讀...檢察官主動簽分偵辦暨全國律師聯合會具狀告發，認為涉犯律師法的無律師證書，意圖營利而辦理訴訟事件罪嫌。劉姓律師坦承有受Baren Bike GmbH公司委任為訴訟代理人，但堅決否認有何違反律師法犯行，辯稱在台灣沒有使用律師身分，台灣法院也許可他出庭、對他發出庭通知等語。檢方表示，調查後發現，劉男所收取的5萬元人民幣報酬，是擔任Baren Bike GmbH公司的法律顧問費用，並非受託辦理本案民事案件的對價，因此難認具有律師法第127條第1項的「意圖營利」。檢方並舉高雄高分院的判決強調，現今公司、法人多設有法務部門，並聘僱經理人、助理人員專門從事該公司的法律相關事務，其中亦多有涉及該公司訴訟事務或撰狀、代理出庭的狀況，若將其所涉訴訟相關訴訟行為，即將他執行業務行為視為「未取得律師資格，意圖營利而辦理訴訟事件」的犯罪行為，顯然昧於社會現實。中檢認為，劉男既為Baren公司的法律顧問，自可代理出庭辦理訴訟事件，縱有收取法律顧問費用，亦難認屬「意圖營利」而辦理訴訟事件，因此認定未違反律師法，做出不起訴處分。    ,https://news.ltn.com.tw/news/society/breakingnews/5408463
