Title,News_Type,date,content,url
針孔偷拍引恐慌！洪孟楷痛批部會互踢皮球 提2作為管理源頭,政治,2026/05/14 14:27,國民黨立委洪孟楷要求行政院統籌跨部會管理機制，並建立「高度偽裝型偷拍設備」管理制度，強調隱私安全是基本人權，中央政府別再互踢皮球。（記者羅國嘉攝）醫美診所偷拍案引發社會高度不安，國民黨立委洪孟楷批評中央部會針對針孔攝影機管理「互踢皮球」，洪指NCC、警政署等單位對於源頭管理權責推諉，他公開力挺台北市長蔣萬安提出的「實名制」建議，中央部會應該正視，才能避免下一起偷拍案件再發生，因此要求行政院統籌跨部會管理機制，並建立「高度偽裝型偷拍設備」管理制度，強調隱私安全是基本人權，中央政府別再互踢皮球。洪孟楷指出，上週爆發的醫美診所偷拍事件引發社會高度不安。民眾最擔心的不只是單一個案，而是自己會不會早已受害，或下一個受害者就是自己。事件延燒後，他要求相關部會提出具體防範作為，但遺憾目前看到的仍然彼此推卸責任。請繼續往下閱讀...洪孟楷表示，NCC回覆稱針孔攝影設備管理涉及經濟部，而使用管理則屬警政署權責；警政署回覆經濟部與NCC可將「高度偽裝性」偷拍設備認定為高風險器材；至於經濟部目前仍未回文。他批評繞了一圈卻無單位正面回應「源頭管理」，當針孔攝影機可以輕易取得、隨意購買，就可能成為犯罪工具。民眾也開始擔心百貨公司更衣室、旅宿業房間是否會被偷拍，只要源頭不管理，不安與恐懼就會持續存在。洪孟楷說，看到蔣萬安率先提出中央應研議針孔攝影器材「實名制」購買，這絕對是值得討論、也是可行的方向，尤其日本、韓國等鄰近國家，都早已對高度偽裝型偷拍設備採取更嚴格規範，台灣更不能置身事外。因此，洪要求政府立即啟動2項作為，並重申隱私安全是最基本的人權，源頭管理現在就該啟動，中央政府別再互踢皮球。1.建立「高度偽裝型偷拍設備」管理制度：針對偽裝成煙霧偵測器、插座、掛勾、時鐘等偷拍設備，建立高風險認定清單，要求販售平台揭露、下架與管理機制；並研議購買針孔攝影設備實名制，避免遭違法濫用。2.行政院統籌跨部會管理機制：行政院應責成單一部會擔任主管機關，經濟部、NCC、內政部警政署、數發部、衛福部等相關單位，建立統一主管與檢舉處理機制。唯有中央建立明確規範，地方政府才有一致標準可循，中央地方共同為人民隱私安全把關。    ,https://news.ltn.com.tw/news/politics/breakingnews/5436829
蔡英文東海大學演講人氣爆棚 對川習會問題未表態,政治,2026/05/14 14:23,蔡英文今天下午前往東海大學路義思教堂演講「政治離我們很遠嗎？」，學生一路喊總統好、總統我愛你。（記者蔡淑媛攝）川習會今天登場，美國總統川普稱讚中國國家主席習近平是偉大的領導人，習近平提及台灣問題處理不當，美中兩國可能發生「碰撞或衝突」，前總統蔡英文今天到東海大學演講前被媒體喊話川習會，並未回應。蔡英文下午前往東海大學路義思教堂，對學生演講主題「政治離我們很遠嗎？」吸引大批學生聽講，前進演講廳前，不少學生高喊「總統好」、「總統，我愛妳」、「台灣需要妳」，戶外雖然下大雨，蔡英文仍一路面帶笑容，揮手回應「你好、你好」，態度很親切。請繼續往下閱讀...蔡英文今天以「政治，離我們很遠嗎？」為題，分享8年執政實務觀察，東海校方上月開放報名，名額迅速爆滿，甚至一度當機，受到學生熱烈歡迎。東海大學政治系學會邀請蔡英文演講，學會強調，蔡英文與青年學子進行深度交流，更將首度揭露領導者在面臨重大決策時思考脈絡與她的韌性心路歷程。蔡英文被媒體問及川習會，並未回應。（記者蔡淑媛攝）    ,https://news.ltn.com.tw/news/politics/breakingnews/5436828
林志玲接文策院董事惹議  行政院緩頰：他們在中國發展有壓力,政治,2026/05/14 14:09,林志玲將於6月底接任文化內容策進院董事。（文策院提供）文策院（TAICCA）昨公布新任董事名單，當中包含「台灣名模」林志玲，但她過去曾轉發「慶祝新中國成立」的貼文，引發爭議。行政院發言人李慧芝今（14）日在院會後記者會表示，文化部長李遠閱讀赴中發展且發表統戰言論的藝人回函後，藝人們有描述他們在中國發展承受的壓力，期待更多台灣藝人和文化工作者，把台灣文化內容推向國際。文策院13日公告3位新任董事名單，其中最為矚目的是現年51歲的林志玲。不過，網友找出林志玲2023年曾在微博PO出「慶祝新中國成立74週年」、「我愛你中國」等貼文，還自稱「身為中國人」，引發質疑。請繼續往下閱讀...李慧芝指出，去年陸委會曾經提供20多位赴中發展，並發表統戰言論的藝人名單交由文化部約談。文化部長李遠當時也寫一封信，給想去或正在中國發展的台灣藝人，也有收到很多回函，在回函中，藝人描述在中國發展所承受的壓力，也有人對相關表態並不知情。李慧芝指，李遠當時說，看到這些回函後，更讓人深刻體會到台灣是大家共同的家，也喊話「歡迎藝人回到台灣，讓世界看到台灣」。期待有更多台灣的藝人跟文化工作者，一起把台灣文化內容推向國際，讓更多台灣的故事在國際舞台上發光。    ,https://news.ltn.com.tw/news/politics/breakingnews/5436807
敬老卡升級購物政見誰抄誰？蘇巧慧競辦拋3月廣告：感謝李四川5月跟進,政治,2026/05/14 14:09,民進黨立委、新北市長參選人蘇巧慧2月提出敬老卡升級1000點的政見，蘇巧慧表示這項政見受到長輩肯定。（資料照）新北市長選戰在「敬老卡升級」戰場持續交火，民進黨立委、新北市長參選人蘇巧慧2月提出敬老卡升級1000點的政策後，國民黨參選人李四川於昨日提出600點敬老卡點數300點「悠遊卡化」，李競辦進一步批評蘇巧慧偷改政見、「偷抄」李四川的擴大納入購物。蘇巧慧競辦發言人馬亨亨．夷將則出具蘇巧慧3月的廣告反擊，其中本來就有提到「可以坐公車、也可以買物仔」，「感謝李四川5月跟進蘇巧慧2月的政見」。馬亨亨．夷將說，蘇巧慧2月提出六大福利政見，包括「敬老卡提升到一千點，不會每月歸零、擴大使用功能」，3月起在廣播電台播出廣告，內容就明確提到「可以坐公車、也可以買物仔」，事實證明，是李四川5月跟進蘇巧慧2月的政見。請繼續往下閱讀...「事情很簡單，不用政治口水」，馬亨亨．夷將表示，支持敬老卡1000點擴大使用的市民朋友，就支持蘇巧慧，支持只有300點擴大使用的市民朋友，就支持李四川，「相信長輩們都很聰明，會選蘇巧慧」。    ,https://news.ltn.com.tw/news/politics/breakingnews/5436780
國防特別條例遭砍 國防部：練武之人應有功能都喪失殆盡,政治,2026/05/14 14:01,國防部戰略規劃司長中將黃文啓今（14）日在行政院會後記者會表示，這次遭刪除部分，「重點不在額度多少，也不是比例問題，而是結構問題」。（記者方賓照攝）立法院上週三讀通過國防特別條例，預算上限匡列7800億元，與行政院版1.25兆元相差4700億元，國防部戰略規劃司長黃文啓中將今（14）日在行政院會後記者會表示，這次遭刪除部分，「重點不在額度多少，也不是比例問題，而是結構問題」。練武之人應有的功能都喪失殆盡，指管決策、全域偵知、防衛韌性也完全被刪除，「沒有腦、眼、耳、充分營養，即便有拳腳，也斷了好幾個指頭」，對建軍備戰影響重大，對戰力打擊也無法估計。國防部今（14）日在行政院會報告「國防特別預算未通過案項及其影響」，國防部表示，立法院三讀通過國防特別條例，刪除包括無人機及無人艦艇、強弓飛彈、台灣戰術網路（TTN）及部隊覺知套件（TAK）等商購及委製案。請繼續往下閱讀...黃文啓形容，聯合作戰就像習武之人，必須擁有敏銳腦袋、靈敏目光、有力拳腳、源源不絕能量，也因此政院版國防特別條例區分指管決策、全域偵知、高效打擊、防衛韌性等4個部分。黃文啓強調，練武之人要有的功能都喪失殆盡，指管決策、全域偵知、防衛韌性也完全被刪除，「沒有腦、眼、耳、充分營養，即便有拳腳，也斷了好幾個指頭」，所以不可用一個比例，說只過了62%，其實不是過了62%，對建軍備戰影響重大，對戰力打擊是無法估計的。    ,https://news.ltn.com.tw/news/politics/breakingnews/5436794
借鏡美烏低成本成效 學者籲仿效美軍開放授權規格、促單程無人機量產,政治,2026/05/14 13:59,國防安全研究院副研究員舒孝煌。（資料照）俄烏戰爭與美伊衝突頻頻上演無人機「以小搏大」戰果，然而政府所提國防特別預算的無人機項目遭大砍，行政院擬另提特別條例或追加預算補救。國防安全研究院副研究員舒孝煌今（14）日建議，台灣應思考採用具備源頭打擊能力的低成本無人機。他倡議中科院若能仿效美國空軍開放民用無人機的著作權與規格進行釋商，讓民間廠商以相同規格統包生產，不僅能將單價大幅壓低至台幣10萬到20萬元以利大量生產，亦能達到公平競爭、雨露均霑的效果，有效消耗敵軍防空飛彈。舒孝煌今天受訪分析俄烏與美伊戰場經驗指出，烏克蘭使用長程無人機有效打擊俄軍戰略據點，幾乎快癱瘓其空中戰力；伊朗亦曾透過無人機攻擊造成200多個機場基地受損，顯示遠程無人機襲擾極具成效。他表示，遠距離攻擊可用於騷擾敵人機場、港口與戰略要地等固定目標，藉此擾亂敵方作戰節奏、限制其集結地點；若國軍要採取攻勢性作為，利用這類單程無人機（one-way attack）進行源頭打擊與蜂群攻擊，藉以「消耗敵人的防空飛彈與彈藥」將是非常重要的戰略目標。請繼續往下閱讀...無人系統科技日新月異，對美軍購管道的複雜程序反而成為桎梏，且立法院近日所通過的國防特別條例，更首次設下取得發價書（LOA）才能編列預算的門檻，更令我國軍事採購陷入程序地獄。對此，舒孝煌指出，以烏克蘭為例，其大量採購的無人機全數為商用產品，FPV無人機完全不需要買到軍規標準；美軍的「低成本無人攻擊系統」（LUCAS）則是完全仿造伊朗「見證者-136（Shahed-136）」 規格，下單量高達20萬架。美軍掌握全著作權並向所有符合條件的廠商授權，唯一要求即是「降低成本」，目標將單價從3萬5千美元降至5千美元（約合台幣15萬元左右）。舒孝煌建議，我國亦可循此模式發展。若中科院願意採取開放態度，將核心部分統包，並釋出「劍翔」、「勁蜂二」等無人機的完整著作權與標準規格給予民間釋商，只要廠商能達到降低成本的要求皆可投入生產。如此一來，不同廠商的零件皆可互相組裝成同一架規格相同的無人機，若能將成本降至台幣10萬、20萬元左右，便能實現大量生產。國防部雖長期不願公開討論「源頭打擊」觸動敏感神經，但舒孝煌強調，面對中共龐大的無人機蜂群威脅，國軍必須具備遠程打擊能力以擾亂敵軍作戰節奏。透過低成本無人機襲擾對岸固定的機場、港口與戰略要地，不僅能迫使共軍集結地點受限，更能有效消耗其防空飛彈彈藥，為我方防衛爭取極大的戰略優勢。舒孝煌說，這類用於源頭打擊的單程攻擊無人機，品質要求「只要能夠飛得出去、能飛到目標就可以」。這種一視同仁要求降本的公平競爭釋商模式，一方面能讓國內各家廠商雨露均霑，另一方面也能降低在野黨的反彈聲浪，是值得國軍深思推動的國防自主新方向。國軍無人機預算遭鍘 學者籲清楚說明反制中共作戰需求及目獲配套    ,https://news.ltn.com.tw/news/politics/breakingnews/5436770
國軍無人機預算遭鍘 學者籲清楚說明反制中共作戰需求及目獲配套,政治,2026/05/14 13:54,國防安全研究院副研究員舒孝煌。（資料照）立法院日前在國民黨、民眾黨多數下通過7800億元上限的國防特別條例，商購、委製項目包括無人系統在內遭排除。針對無人系統採購與全域偵知能力對我防衛戰力的影響，國防安全研究院副研究員舒孝煌今（14）日受訪表示，由於無人機技術迭代與需求變化快速，他贊同每年都需編列無人機預算，以利形成計畫性採購並給予廠商持續發展的誘因。同時，他也呼籲國防部必須清楚向國人說明國防戰略，釐清各型無人機的任務定位，並具體說明如何解決遠程火力的「目獲」（目標獲取）問題，才能讓無人機真正成為「戰力倍增器」。舒孝煌今天受訪說，朝野溝通屬於政治問題不予討論，但在軍事層面上，他贊成無人機採購應透過年度性討論與計畫性採購，每年持續下單，才能讓生產廠商具備持續發展的動機與誘因；加上國軍對無人機的需求隨時在變化、技術迭代極快，分年度採購是較佳的應對方式。請繼續往下閱讀...舒孝煌強調，國防部必須想清楚「到底需要怎樣的無人機」，這牽涉到整體的國防戰略。目前國軍大量採購的FPV無人機與小型無人機，主要針對濱海作戰場景；然而今年7月份「濱海作戰指揮部」即將成立，內容涵蓋無人艇等載具，但在空中的部分將搭配何種武器，目前仍屬未知。各界不能僅空泛地談論無人機，必須明確區分微型、小型、長程等不同任務屬性。此外，針對陸軍長程火力的目標獲取能力，舒孝煌也點出隱憂。他指出，無論是射程達90公里的海馬斯（HIMARS）M30火箭彈、射程300公里的ATACMS飛彈，抑或是未來射程約26至30公里的M109A7自走砲，相關的「目獲」系統該如何配套與解決，陸軍至今尚未說明。針對敵情威脅，舒孝煌示警，中共才是「蜂群攻擊」的祖師爺，其具備跨海攻擊能力的無人機數量與材料規模遠比台灣龐大，國軍可能反過來面臨防空武器被中共蜂群消耗的風險。然而目前檢視國軍在低空層反制與反無人機能力上，僅能看到公開版略為空泛的報告，缺乏具體的想法與作為。他主張此議題應冷靜下來公開討論，嚴肅檢討後續國防自主的進行方式，思考如何善用無人機解決當前問題，強化防衛實力，讓無人系統成為真正的「戰力倍增器」。借鏡美烏低成本成效 學者籲仿效美軍開放授權規格、促單程無人機量產    ,https://news.ltn.com.tw/news/politics/breakingnews/5436769
揚言不提名就退黨參選 楊寶楨改口：尊重黨內評估,政治,2026/05/14 13:54,楊寶楨表示，參選中市議員尊重黨內的評估依循機制進行。（翻攝楊寶楨臉書）民眾黨前發言人楊寶楨日前揚言若黨不提名她不排除退黨參選，她今天在臉書發文，參選意志仍然堅定，會尊重黨內的評估及依循機制進行。楊寶楨日前宣布黨中央提名她參選中市議員就退黨，掀起波瀾，也引發很大爭議。對此，楊寶楨表示，她有跟中市黨部主委陳清龍談過，知道黨部想法，正在討論中。請繼續往下閱讀...她今日並在臉書發文，表示謝謝大家的關心，她已與台中市黨部及黨中央進一步聯繫確認，此前在程序上有些誤會，已經有溝通、進行協調。她更強調，她的參選意志仍然堅定，會尊重黨內的評估，及依循機制進行，感謝長官、夥伴，以及支持者和各界的建議指教。    ,https://news.ltn.com.tw/news/politics/breakingnews/5436773
習近平強硬警告台灣議題 行政院回應了,政治,2026/05/14 13:48,行政院發言人李慧芝在院會後記者會僅表示，中國的軍事威脅才是對台海及印太地區的不安全因素，持續強化國防，有效共同嚇阻，才是確保區域和平的最大關鍵。（記者方賓照攝）「川習會」今（14）日在北京人民大會堂登場，外界聚焦美中領導人提及台灣議題，中國國家主席習近平稱，若台灣問題處理不當，美中兩國可能發生「碰撞或衝突」。對此，行政院發言人李慧芝在院會後記者會僅表示，中國的軍事威脅才是對台海及印太地區的不安全因素，持續強化國防，有效共同嚇阻，才是確保區域和平的最大關鍵。美國總統川普與中國國家主席習近平14日在北京展開高峰會。習近平在開場對談中即針對台灣議題發出強硬警告。習近平指出，若台灣問題處理不當，美中兩國可能發生「碰撞或衝突」。這場舉世矚目的元首會談，在雙方對台立場的激烈火花中拉開序幕。請繼續往下閱讀...根據中國官媒《央視新聞》（CCTV）報導，習近平在正式會談中向川普表示，台灣問題是美中關係中「最重要的問題」。習近平強調，一旦此議題處理不當，兩國可能發生「碰撞（collide）或衝突」，這將使整體美中關係陷入高度危險的境地。    ,https://news.ltn.com.tw/news/politics/breakingnews/5436771
5000元再加倍   澎湖西嶼鄉代表許見情提案振興經濟禮金三讀通過,政治,2026/05/14 13:46,西嶼鄉代表許見情提案，振興經濟禮金5000變10000元。（記者劉禹慶攝）澎湖西嶼鄉親小確幸升級！今年澎湖5鄉刮起的振興經濟禮金風，最後1個西嶼鄉，原本鄉公所規劃5000元振興經濟禮金，經鄉代表許見情提案，由5000元「加倍」成1萬元，今（14）日經代表會定期會無異議3讀通過，凡4月30日設籍西嶼民眾，自6月1日至7月31日開放領取。澎湖5鄉1市，由白沙鄉率先發放10000元振興經濟禮金後，由於今年為5合1選舉年，造成各鄉市壓力及跟風潮，望安鄉跟進發放1萬5000元、七美鄉10000元、湖西鄉5000元，剩下西嶼鄉及馬公市尚未動作，西嶼鄉長李添進率領鄉公所同仁研議草案，送交鄉代會審議，每人5000元。請繼續往下閱讀...由於西嶼鄉8000餘人，鄉庫結餘款2億6000多萬元，因此鄉代表許見情提案，由5000元「加碼」至1萬元，獲得代表全體支持同意，今日三讀通過，自6月1日起開始發放，至7月31日止，戶籍落日條款設在4月30日止，隨著西嶼鄉塵埃落定後，澎湖5鄉都發放振興經濟禮金，僅剩人口最多的馬公市沒有動靜，主要是金額過於龐大。由於今年是選舉年，自白沙鄉開了振興經濟禮金第一槍後，讓各鄉市長壓力巨大，望安鄉跟進後，離島七美鄉隨之發放，壓力又回到澎湖本島，湖西鄉旋發放，西嶼鄉也定案，僅剩下人口最密集的馬公市，所有壓力都在馬公市長黃健忠身上，發放1000、2000元無法滿足，比照5000、1萬元發放，金額3億、6億多，馬公市財源籌措不易，恐無法實施。許見情提案三讀通過，西嶼鄉振興經濟禮金發放一萬元。（記者劉禹慶攝）    ,https://news.ltn.com.tw/news/politics/breakingnews/5436766
獨家》「川習會」登場！美方出席人員這名友台高層在場 少了這位談判高手,政治,2026/05/14 13:43,"美中領導人「川習會」今天上午在中國北京人民大會堂「東大廳」舉行。參與會談的雙方核心官員涵蓋外交、國防、經貿等面向。美方人員包括川普總統共11位，中方人員包括國家主席習近平共13位。（美聯社）美中領導人「川習會」今天上午在中國北京人民大會堂「東大廳」舉行。參與會談的雙方核心官員涵蓋外交、國防、經貿等面向。美方人員包括川普總統共11位，中方人員包括國家主席習近平共13位。根據外電，從第一排右起，美方依序是白宮科技政策主任克瑞蕭斯（Michael Kratsios）、副國安顧問嘉布瑞爾（Robert Gabriel）、副幕僚長米勒、國防部長赫格塞斯、國務卿盧比歐、川普總統、美國駐中大使龐德偉、財政部長貝森特、貿易代表葛里爾、另一位白宮副幕僚長布萊爾以及白宮通訊主任張振熙（Steven Cheung）等。請繼續往下閱讀...至於曾經駐台、亦是台海軍事專家的國安會亞洲事務資深主任簡以榮則於後排，全程參與「川習會」。簡以榮在美國總統川普第一任期時負責台灣事務，曾合著專書探討護台的急迫行動，支持台灣發展不對稱作戰。特別的是，過去多次負責與各國進行關稅談判的美國商務部長盧特尼克這次並未參與會談。至於出席的中方官員，從第一排左起，依序是外交部長助理洪磊、駐美大使謝鋒、商務部長王文濤、發改會主任鄭柵潔、副總理何立峰、中央書記處書記蔡奇、習近平、外交部長王毅、國防部長董軍、財政部長藍佛安、外交部副部長馬朝旭、國家主席秘書呂錄華、外交部部長助理蔡偉等人。在「川習會」開場白中，習近平首先表示，中美關係穩定是世界的利好，雙方合則兩利、鬥則俱傷，應當做夥伴而不是對手，相互成就、共同繁榮。川普則讚美習近平，「您是偉大的領導人——我對每個人都是這麼說的。有時候人們不喜歡我這麼說，但我還是要說，因為這是事實」，並且說這次隨團帶了頂尖的美國企業家訪華，期待與中國展開貿易與商務合作，而這將是完全互惠的。美中領導人「川習會」今天上午在中國北京人民大會堂「東大廳」舉行。參與會談的雙方核心官員涵蓋外交、國防、經貿等面向。美方人員包括川普總統共11位，中方人員包括國家主席習近平共13位。（路透）曾經駐台、亦是台海軍事專家的國安會亞洲事務資深主任簡以榮則於後排，全程參與「川習會」。（資料照）    ",https://news.ltn.com.tw/news/politics/breakingnews/5436754
日方關注川習會 重申台海和平重要性,政治,2026/05/14 13:40,"美國總統川普訪問中國，與中國國家主席習近平舉行會談。（美聯社）日本政府發言人、官房長官木原稔，今天上午在美中「川習會」正式舉行之前，重申台灣海峽的和平與穩定對整個國際社會而言都非常重要，而期待有關台灣的問題能以和平方式解決，這是日本一貫以來的立場。木原在今天例行記者會中被問及，日本政府如何看待這場美中領袖會談的重要性，而從維持台灣海峽和平與穩定的觀點來看，政府特別重視哪些重點。木原表示，對於會談討論內容及其成果，日本政府不應預判並加以評論。請繼續往下閱讀...他進一步表示，一般而言日本政府認為，美中關係若能有助於包括日本在內的國際社會穩定，是非常重要的。基於這樣的認識，日本正以高度關注持續注視相關動向。木原強調，台灣海峽的和平與穩定對整個國際社會而言都非常重要，而期待有關台灣的問題能以和平方式解決，這是日本一貫以來的立場。日本政府今後也將在與作為同盟國的美國維持強固信賴關係的基礎上，持續敦促中國善盡符合其立場的責任，這點十分重要。木原強調，台灣海峽的和平與穩定對整個國際社會而言都非常重要。（資料照，法新社）    ",https://news.ltn.com.tw/news/politics/breakingnews/5436761
