Title,News_Type,date,content,url
騙台灣也騙美國！ 「習鄭會」藏4大奪台佈局：逼台「解除武裝」,政治,2026/04/16 11:00,國安人士剖析，北京對習鄭會的佈局，是想在「川習會」前操作「台灣支持統一」的假象，動搖美國對台灣國防的支持。（法新社資料照）國民黨主席鄭麗文訪中會見中共總書記習近平，480萬元團費是向台灣民主基金會申請補助，國民黨也宣稱是合法政黨交流。然而，國安人士剖析，北京對「習鄭會」藏有4大戰略佈局，表面釋出「和平紅利」，實則意圖在「川習會」前操作「台灣支持統一」的假象，將「世界的台灣」納入「一中框架」，進而動搖美國對台防衛的支持，最終達到「解除台灣武裝」的終極目的，「表面送禮包，背後在亮刀」。國安人士分析，北京正藉「習鄭會」推進4大戰略佈局。首先，是將台灣從世界舞台抽離，重新塞回「一中框架」。「十項措施」首度明文將「九二共識、反台獨」列為前提，國共敘事同步將台海問題鎖進「一中框架」，並將國際友盟一概抹成「外力」，同時從技術上排除台灣民選政府的合法地位，實質要將在野黨形塑為北京落實對台控制的代理人。請繼續往下閱讀...其次，是企圖讓正在強化嚇阻能力的台灣「解除武裝」。該人士指出，北京一方面要在「川習會」前對美釋放訊號，操作「台灣多數民意支持統一、支持一中框架」，暗示美方只要停止對台軍售，兩岸問題就能和平解決；另方面透過「實質管治」，藉由特定代理力量拖延、杯葛台灣重大政策進程，尤其是國防相關，為「川習會」鋪陳有利氛圍。第三、以「看得到、吃不到」的紅利分化台灣。國安人士表示，中國刻意拋出所謂「利多」，製造不同政黨、立場間的分歧，比方有些藍營縣市長就對「十項措施」表達肯定，儘管大家都認為難以落實，仍會在內部形成裂痕，整體要形塑「中國願給好處，卻被民進黨政府阻擋」的錯覺，卻掩蓋其附帶台灣社會難以接受的政治前提。最後，是操作「和戰兩手」策略，國安人士透露，中共在營造「創造和平」形象的同時，軍事動作卻悄悄升溫，中共解放軍近日在東海劃設大規模、長達1個多月的5處空域保留區，並在第一島鏈部署大量艦艇；鄭麗文訪中期間，共機、共艦擾台也沒有間斷，這正是典型以和平包裹的軍事壓迫。該人士進一步指出，中國不只鎖定「川習會」前，也瞄準中東戰事升溫之際，趁美方抽掉印太軍力移防中東，加大在印太地區的部署，形成戰略壓制，一方面強化對區域的威脅、施加壓力，另方面分散中東友盟的壓力，牽制美方，使其在多線佈局捉襟見軸。內幕》趕川習會前瓦解台美日抗中陣線 習鄭會3大認知戰軸線曝光歷史驚人重演！連胡會、習鄭會都撞軍購 台灣拒吞「一中」2大關鍵    ,https://news.ltn.com.tw/news/politics/breakingnews/5405496
歷史驚人重演！連胡會、習鄭會都撞軍購 台灣拒吞「一中」2大關鍵,政治,2026/04/16 11:00,「習鄭會」落幕，國安人士認為有2005年「連胡會」的強烈既視感。（美聯社資料照）當「習鄭會」落幕，北京端出被戲稱為「回鍋菜」的10項對台措施，在國安人士眼中，卻帶有2005年「連胡會」的強烈既視感。相隔20年的2場會面，皆逢台灣推動重大國防預算之際，北京企圖複製同一套劇本，卻忽略台灣民意徹底質變，「一中框架」已無人買單，更關鍵的是，台灣在經濟實力上，也不再有理由回到北京設定的「一中框架」中。「習鄭會」、「連胡會」有何相似之處？國安人士指出，2005年連胡會登場前，台灣正準備處理6108億元的重大軍購案，包括潛艦、愛三飛彈等，會後中方祭出34項農漁產品零關稅，並鋪陳後續ECFA等。對照2026的習鄭會，時值台灣推動1.25兆國防特別條例，北京同樣在會後拋出「10項措施」，手法如出一轍，也都選在拒絕「一中框架」的政黨執政時，繞過民選政府、打造國共平台處理兩岸議題，這次更進一步重構「一中框架」下的兩岸關係。請繼續往下閱讀...在國際背景下，該人士分析，2005年連胡會時，中國剛通過「反分裂國家法」，又因為北韓核武危機，六方會談最緊鑼密鼓之時，華府急需拉北京協助；而當前在「川習會」前夕，中東局勢也成為干擾變數，在2個歷史節點上，北京都拿台灣問題作為與美國博弈的籌碼。儘管北京企圖故技重施，但台灣民意結構與經濟體質已發生根本性改變。國安人士指出，根據政大選舉研究中心民調，目前台灣社會的「台灣人認同」穩居6成5，「中國人認同」則從當年的8%下滑到2.4%，面對截然不同的台灣，北京的舊劇本自然無法引發共鳴，不符實際需求的「惠台措施」更顯乏人問津。更現實的因素在於經濟。國安人士回顧，連胡會後，其所屬政黨於2008年到2016年執政，當年會中多數共識都化為國家政策；但對照那8年與2016年至今的總體經濟發展，差異不言可喻，無論是GDP總值、台股資本市場的規模，兩個時代呈現是倍數差異，遑論台灣如今在全球供應鏈及地緣政治的角色，早已不可同日而語。國安人士認為，判斷中國有無善意的核心在於「尊重中華民國與台灣存在的事實，停止對現狀的破壞」，具體可從6大指標檢驗，包括停止軍事騷擾、停止金馬周邊海警執法、停止打壓國際參與及誘拉邦交國、停止統戰滲透與認知作戰、釋放被無理拘押的台灣公民（宗教人士與人權律師），最重要的是與台灣民選政府正式對話。國安人士直言，所謂「十項措施」都涉及公權力，甚至有既有管道能與民選政府對話，中方刻意反其道而行，反而讓帶回倡議的人看起來像「買辦」、陷其於不義，顯然北京無意停止對台「和戰兩手」策略，只想在「川習會」前誘導美方降低對台灣的國防支持，並透過在地協力者，把台灣整體發展進程拖回「一中框架」中。內幕》趕川習會前瓦解台美日抗中陣線 習鄭會3大認知戰軸線曝光騙台灣也騙美國！ 「習鄭會」藏4大奪台佈局：逼台「解除武裝」    ,https://news.ltn.com.tw/news/politics/breakingnews/5405497
內幕》趕川習會前瓦解台美日抗中陣線 習鄭會3大認知戰軸線曝光,政治,2026/04/16 11:00,今年4月10日是「台灣關係法」立法47週年，美國聯邦眾議院外交委員會共和黨團特別在社群平台X發文，貼文的照片將美國總統川普與賴清德總統並列，象徵美台穩固的盟友關係。（圖擷取自美眾議院外委會共和黨團官方X）「習鄭會」上週落幕，國安人士評估，其戰略價值不僅止於對台統戰，更是中共對印太區域發動的認知作戰，北京透過「反日、反美、反軍購」3大主軸，建構對區域宰制的正當基礎，要在「川習會」前營造台灣人不挺美國、不挺軍購，願在中國前提下兩岸交流，削弱民主友盟挺台的正當性，系統地推進「解除台灣武裝」的目標。在反日方面，國安人士指出，中國近期頻以「新軍國主義」標籤攻擊日本，主因是日本已成為印太區域制衡中國威權輸出的領導角色，北京要削弱其正當性，將其形塑為威脅和平的軍國主義復辟者。國共會面時也刻意強調「中華民族共同抗日」的記憶，把台灣拉進北京的抗戰敘事，暗示台日合作是軍國主義復辟，國民黨的發言不只與史實不符，更和中國完全唱同調，更令人感到憂心。請繼續往下閱讀...該人士表示，中方透過一系列敘事，將台日關係定性為背叛民族情感、戀殖、皇民與新軍國主義。值得注意的是，國共反覆強調的「共同政治基礎」，也就是「一中框架」、中華民族及中華文化等。回歸本質，台日之間的共同政治基礎是民主與自由，反觀威權國家與民主國家之間談所謂「共同政治基礎」，顯然是非常反智、違反常識的說法。在反美部分，國安人士說明，國共口徑一致指稱「台海不是外力的棋盤」，然而，台海之所以有這麼多民主國家自由航行，正是為了防範威權擴張。國共將民主友盟定性為「外力」，其實就是要把台灣問題「內政化」、「一中框架化」，對外洗腦「台灣問題原屬中國內部事務，因美國介入才變得複雜」，傳遞「美國若抽手，兩岸問題就能和平解決」的訊息。該人士接著說，「習鄭會」也延續此一論述，強調兩岸問題是中國人自己的事，並稱「中華民族的偉大復興是兩岸人民的偉大復興」，威權國家的偉大復興照理來說對民主國家應是巨大威脅，卻被當成正式的政治語言對外傳遞，邏輯十分錯亂，特別是將民主友盟挺台扭曲為「外力干涉」、「利用台灣牽制中國」，並透過協力者傳達「美國跟民主友盟是外人、不可靠、都是利益的競逐者」的不實訊息。第三個主軸是「反軍購」，國安人士表示，中共一方面想對外塑造「台灣民意不支持軍購、願在一中框架下和平交流，另一方面透過在地協力者在台灣操作「軍購浪費錢」、「強化國防不必要」等風向，企圖削弱台灣自我防衛能力。事實上，中國2009到2017年，軍費都維持兩位數成長，反觀台灣自2008年後一路下滑，2013、2014甚至出現負成長，導致雙方國防投資差距拉大，直到近年才逐步補強。國安人士總結說，北京先是結合國共的歷史敘事削弱日本的區域正當性，接著強化「疑美論」，將美國設定為外部干預者、利益的競逐者，同時內外呼應削弱台灣國防，核心目標是在5月中的川習會前營造氛圍——台灣社會不挺美國、不支持軍購，並願在中國的前提下進行兩岸交流，降低美國協助台灣強化防衛的意願，進而達成「解除台灣武裝」的目標。騙台灣也騙美國！ 「習鄭會」藏4大奪台佈局：逼台「解除武裝」歷史驚人重演！連胡會、習鄭會都撞軍購 台灣拒吞「一中」2大關鍵    ,https://news.ltn.com.tw/news/politics/breakingnews/5405495
白沙屯媽祖超前抵達北辰所 柯文哲夫妻、黃國昌現身 阿北參拜心不在焉,政治,2026/04/16 10:53,白沙屯媽祖今上午9時20分已到北辰派出所，除了雲林縣長張麗善親自到場恭迎媽祖鑾轎，民眾黨前主席柯文哲也與妻子陳佩琪及現任主席黃國昌現身參拜，不過過程中柯文哲不時左顧右盼（見圖），看上去心不在焉。（圖擷自YouTube白沙屯媽祖網路電視台）白沙屯媽祖徒步進香進入第4天，今天一早8點18分就抵達元長鄉及北港鎮交界，比往年提早1個多小時進入北港境內，到今上午9時20分更已到北辰派出所休息，除了雲林縣長張麗善親自到場恭迎媽祖鑾轎，民眾黨前主席柯文哲也與妻子陳佩琪及現任主席黃國昌現身參拜，不過過程中柯文哲不時左顧右盼，看上去心不在焉。今晨3點白沙屯媽祖鑾轎準時從虎尾天后宮出發，一路沿著145縣道快速行進，大約在上午8點18分就已經抵達元長、北港交界處，相較於以往大約10點才會走到北港境內，今年足足提早一個多小時，也讓地方民眾驚呼，「粉紅超跑」的稱號真的不是浪得虛名。請繼續往下閱讀...今上午約9點20分媽祖鑾轎更抵達北辰派出所，並在此停駕，一開始先由雲林縣長張麗善及立委張嘉郡等人一同參拜，在張麗善離開後，黃國昌及柯文哲等人才被唱名並現身，廟方人員在逐一介紹來賓身分時，還一度說不出柯妻陳佩琪的名字，讓現場氣氛一度尷尬，直到廟方人員靠近詢問才確認陳佩琪的身分，陳也趕忙向廟方人員點頭，後續柯文哲則是幾度看向廟方人員。而在參拜過程中，相較於黃國昌與陳佩琪神情專注、持香望向前方，柯文哲則是不時左顧右盼，不知道在尋找什麼，看上去有點心不在焉。民眾黨一行人自現身參拜至離開前後僅約3分鐘。白沙屯媽祖徒步進香進入第4天，今天一早8點18分就抵達元長鄉及北港鎮交界，比往年提早1個多小時進入北港境內，到今上午9時20分更已到北辰派出所。（圖擷自YouTube白沙屯媽祖網路電視台）今上午約9點20分媽祖鑾轎更抵達北辰派出所，並在此停駕，一開始先由雲林縣長張麗善及立委張嘉郡等人一同參拜（見圖），在張麗善離開後，黃國昌及柯文哲等人才被唱名並現身。（圖擷自YouTube白沙屯媽祖網路電視台）白沙屯媽祖今上午9時20分已到北辰派出所，除了雲林縣長張麗善親自到場恭迎媽祖鑾轎，民眾黨前主席柯文哲也與妻子陳佩琪及現任主席黃國昌現身參拜，不過過程中柯文哲不時左顧右盼（見圖），看上去心不在焉。（圖擷自YouTube白沙屯媽祖網路電視台）    ,https://news.ltn.com.tw/news/politics/breakingnews/5405528
總統出訪讓國台辦跳腳再喊「一中」 外交部嗆：中國無權置喙,政治,2026/04/16 10:50,外交部16日表示，中華民國台灣總統出訪既符合國際慣例，也是常態，中國無權置喙。（資料照）總統賴清德22日將啟程訪問非洲友邦史瓦帝尼，中國國台辦昨日跳腳重申「一個中國」原則。對此，外交部今（16）日表示，中華民國台灣總統出訪既符合國際慣例，也是常態，中國無權置喙，呼籲北京當局不要一再成為國際社會的麻煩製造者，及兩岸關係的破壞者。外交部嚴正重申，中華民國台灣為主權獨立國家，與中華人民共和國互不隸屬。我國總統出訪既符合國際慣例，也是常態，中國無權置喙，總統賴清德是中華民國台灣民選的國家元首，更不容許中國惡意污衊。請繼續往下閱讀...外交部表示，我國有權利自主選擇與世界各國交往及發展關係，不接受任何國家以任何理由干涉或打壓，更不會因為遭到恫嚇或干預就自我設限，即使威權政府持續擴張並加重脅迫，台灣不會退縮，只會更勇敢走向世界。外交部指出，中國對台灣粗暴野蠻的打壓，企圖封鎖台灣的外交空間，扼殺我國際人格，不僅無助於兩岸關係良性發展，也傷害台灣人民的權益，呼籲北京當局立即停止，不要一再成為國際社會的麻煩製造者，以及兩岸關係的破壞者。    ,https://news.ltn.com.tw/news/politics/breakingnews/5405589
李乾龍被裝追蹤器卻不報案？ 吳思瑤轟：誣蔑賴總統應公開道歉,政治,2026/04/16 10:47,民進黨政策會執行長吳思瑤。（記者陳政宇攝）國民黨副主席李乾龍的座車傳出被裝追蹤器，國民黨文傳會主委尹乃菁昨指控與總統賴清德有關，但李強調「沒有沒有沒有」，新北市警局也證實李婉拒報案。對此，民進黨政策會執行長吳思瑤今（16日）痛批，國民黨一直是政治栽贓的慣犯，不敢報案就代表心虛，應向誣蔑抹黑賴總統公開道歉。尹乃菁昨表示，李乾龍的確在車燈後照鏡發現追蹤器，並強調在民主國家發生這樣的事情「是足以被彈劾的」，等賴清德總統卸任失去保護傘，國民黨一定會追究到底。新北市警局昨晚發聲明指出，未曾接獲報案，但獲悉後已由副局長林武宏主動聯繫李乾龍，洽詢報案事宜，惟李目前婉拒報案。請繼續往下閱讀...對此，吳思瑤今受訪表示，任何政治人物一旦發現有被不當的政治偵防、不法偷拍或跟蹤，就常理而言，第一時間要做的就是報案；但非常反常的是，國民黨第一時間卻急著潑政治髒水，第一時間賴給賴清德，對總統進行嫁禍及栽贓。吳思瑤進一步質疑，非常地不明白，國民黨為什麼不敢報案？昨天李乾龍說了三次「沒有、沒有、沒有」，自己要向國民黨說「報案、報案、報案」，不報案是在心虛什麼？是在害怕什麼？擔心被查到什麼嗎？還是怕被戳破對於賴總統的惡意栽贓，完全是不實的指控？吳思瑤說，總統府的發言相對是非常委婉、溫良恭儉讓，只要求國民黨應當尋法定程序進行舉發、報警，讓真相可以水落石出。話鋒一轉，吳思瑤直指，國民黨一直是政治栽贓的慣犯，從2019年時任高雄市長的韓國瑜聲稱「國家機器動得很厲害」、被追蹤及不法政治偵防，到現在還用同樣的方法，國民黨發言人第一時間來嫁禍賴總統，這件事情不能溫良恭儉讓。吳思瑤強調，國民黨如果不敢報案，就代表心虛、害怕，希望國民黨具體說明、澄清事實，也應當對於惡質栽贓抹黑賴總統公開道歉，此事孰可忍、孰不可忍。「過去在威權時代，會對政敵進行非法政治偵防的就是國民黨！」吳思瑤表示，在民主台灣的此時此刻，會對政敵來進行偷拍及跟蹤的是台灣民眾黨，但國民黨現在為何還要進行政治操作，將一切賴給賴清德？這種政治的誣蔑非常廉價。    ,https://news.ltn.com.tw/news/politics/breakingnews/5405577
李貞秀被開除還護柯文哲？名嘴黃益中：被賣了還幫人數錢,政治,2026/04/16 10:41,前民眾黨立委李貞秀。（資料照）前民眾黨不分區立委李貞秀遭開除黨籍後，雖然與黨主席黃國昌為首的白營黨中央開撕，但還是繼續幫前主席柯文哲講好話，稱讚他是「好人」。對此，名嘴、公民教師黃益中點出2關鍵，認為她是典型「被人賣了還幫人數錢」。黃益中在臉書發文表示，李貞秀還是認為是現任主席黃國昌主導開除她黨籍，前主席柯文哲在整個過程是不知情的，她還當場唸出寫給柯文哲的簡訊，可是又承認她現在沒有柯文哲的LINE、甚至也沒見到柯本人，「李女士怎麼會認為柯文哲是被底下的人蒙蔽。」請繼續往下閱讀...黃益中分析，沒有柯文哲的默許，他不相信民眾黨包括黃國昌敢這樣開除，「就是偽君子，一個白臉一個黑臉罷了，迪奧貞秀女士，典型『被人賣了還幫人數錢』」。網友紛紛留言表示，「怎麼感覺她比PG（柯文哲妻子陳佩琪）還愛阿北？連藥也是甜的」、「她不願意醒，別逼她，醒了很痛苦」、「我不太認同你的說法，我認為他們全黨在演戲，現在螢幕上她也是在演一齣戲，只是還沒看懂埋什麼梗」、「他不能切開柯，不然跟民眾黨的連結就什麼都沒有了！」、「裝的，只是在突顯這個黨已經不是柯主導的政黨，其實一直是，為首者貪，不知檢討」。    ,https://news.ltn.com.tw/news/politics/breakingnews/5405510
鄭麗文拿民主基金會480萬訪中 府一句話KO：有跟共產黨談民主嗎？,政治,2026/04/16 10:40,總統府發言人郭雅慧。（資料照）國民黨主席鄭麗文上週率團訪問中國並會見中共總書記習近平，今傳出480萬元行程相關經費竟是向外交部捐助成立、立法院長韓國瑜擔任董事長的「台灣民主基金會」申請，全由國庫買單。總統府發言人郭雅慧今被問及此事反問：「這一趟國民黨有跟共產黨談到任何的民主嗎？」針對國民黨主席鄭麗文昨在國民黨中常會重申，願等賴總統出訪回來好好談，就算不談兩岸，為了國內憲政僵局，也片刻都不該再耽擱。郭雅慧回應，國人更期待的是，既然鄭主席已經到中國交流回來，接下來是不是可以趕快審國防特別條例？國人非常期待完整版的國防特別條例能盡速過關，希望立法院不分朝野，共同為國家安全、國家利益儘速完成。    ,https://news.ltn.com.tw/news/politics/breakingnews/5405561
證實鄭麗文訪中申請民主基金會補助 尹乃菁︰民進黨棄台獨黨綱也能比照,政治,2026/04/16 10:35,國民黨文傳會主委尹乃菁表示，國民黨合法向台灣民主基金會提出申請從事政黨交流。（資料照）國民黨主席鄭麗文赴中進行「2026和平之旅」，傳出向民主基金會（Taiwan Foundation for Democracy 簡稱TFD）申請480萬元補助費，引發議論。國民黨文傳會主委尹乃菁今證實此事，她表示，國民黨合法的向台灣民主基金會提出申請從事政黨交流，如果民進黨願意回歸九二共識、放棄台獨黨綱，也可以向民主基金會申請補助，與中國共產黨進行政黨交流。尹乃菁表示，中國國民黨這一次到中國大陸的訪問是向台灣民主基金會來提出申請。民主基金會成立的初衷就是要讓亞洲和世界各國推動台灣的政黨、智庫和亞洲以及世界各國進行交流，來宣揚我們的民主、自由、人權的價值。請繼續往下閱讀...尹乃菁表示，中國國民黨作為在野黨，這一次在鄭麗文主席的率領之下到中國大陸進行「2026和平之旅」，我們就是合法的向台灣民主基金會提出申請，從事政黨交流。而作為在野黨，我們到中國大陸進行訪問，就恰恰的顯示了台灣是個民主、自由體制的國家，執政黨、在野黨會輪替，讓我們正常的跟大陸進行了政黨交流。尹乃菁說，如果民進黨政府它願意回歸到1992年，由兩岸政府授權的白手套，也就是海基會和海協會在香港會談的時候達成的九二共識，兩岸共同的政治基礎，並且廢棄台獨黨綱，民進黨也可以向台灣民主基金會提出政黨交流的申請補助款項，和中國共產黨進行政黨交流。鄭麗文訪中團費480萬用「台灣民主基金會」補助  網怒噴：不要臉    ,https://news.ltn.com.tw/news/politics/breakingnews/5405536
鄭麗文訪中480萬費用國庫買單 孟買春秋痛批：拿公費朝拜,政治,2026/04/16 10:32,國民黨主席鄭麗文日前率團訪中、會晤中共中央總書記習近平引國際關注。（圖擷自新華社）國民黨主席鄭麗文日前率團訪中、會晤中共中央總書記習近平引國際關注，不過有媒體今日指出，鄭麗文訪中團費480萬並非自費，全數由國庫買單。對此，經營臉書粉專「孟買春秋」、作家喬伊斯痛斥，反對黨拿公費去朝拜想併吞台灣的國家，「當台灣人還能多悲哀」。喬伊斯今日於粉專「孟買春秋」發文並附上媒體報導截圖，報導標題為「獨家／有夠瞎！鄭麗文訪中團費480萬竟由台灣民主基金會買單」，報導提及，鄭麗文訪中6天團費總共480萬，這筆費用是向外交部捐助成立，並由立法院長韓國瑜擔任董事長的「台灣民主基金會」申請經費，全由國庫買單。請繼續往下閱讀...喬伊斯嘆說，「反對黨拿公費去朝拜想要併吞台灣的國家，搭的還是他國的商務艙本國籍航空公司賺不到，當台灣人還能多悲哀。」網友看到貼文後相繼留言，有人說「吃你的、用妳的、還可以笑你們，國民黨就是這樣好棒棒」、「吃裡扒外舔共媚匪狗腿，台灣人公敵！」、「難怪氣場這麼強，原來是花人民的錢」、「一開始還在那邊自費，國民黨果然噁心人一流」。針對鄭麗文訪中行，民進黨立委范雲4日曾表示，從登機開始，鄭麗文就被卡進「一中枷鎖」，飛機是中國籍航空、採訪記者資歷與尺度已由國台辦決定、行程由中共決定等，痛批國防條例豈只是國民黨的投名狀？鄭麗文訪中團費480萬傳用台灣民主基金會補助 網怒噴：不要臉鄭習會搭中國航班 范雲：從登機就被卡進「一中枷鎖」    ,https://news.ltn.com.tw/news/politics/breakingnews/5405486
