Title,News_Type,date,content,url
戳破中共「10詐騙禮包」！ 林楚茵：鄭麗文化身習辦發言人謝恩,政治,2026/04/12 18:04,民進黨立委林楚茵。（資料照）國民黨主席鄭麗文與中共總書記習近平會面後，中共今宣布10項惠台措施，提出以反對「台獨」政治基礎前提，開放台灣農產品及食品輸入中國、優惠台商赴中投資等。民進黨立委林楚茵提出三大點戳破「鄭習會」假面具，直言鄭麗文化身習辦發言人配合謝恩林楚茵指出，同一個水果籃、中共到底要送幾次？中共拋出10項「惠台大禮包」，鄭麗文立刻化身「習辦發言人」配合謝恩，但撕開包裝，這根本是「統戰＋脅迫」的詐騙懶人包。請繼續往下閱讀...林楚茵說明，首先，假讓利，真打臉，10項措施裡有高達9項是「回鍋菜」，簡直是一個水果籃來來回回送100次。當初中共用荒謬藉口封殺台灣農漁產品，現在又拿來當「禮物」想詐騙台灣農民，一再來回呼台灣人巴掌，再給過期糖，這算什麼善意？二、明目張膽的政治勒索，林楚茵說，中共這次首度白紙黑字，把「九二共識、反台獨」當作經濟措施的生效前提。擺明把「經濟脅迫」直接公開制度化，要台灣人跪著做生意。林楚茵痛批，國共聯手，掏空台灣，中共繞過中央政府搞「黨對黨」直通管道，還企圖透過金馬基礎建設同城化，把「一國兩制示範區」直接蓋在台灣領土上。她強調，中共的經濟優惠「說禁就禁、說收就收」，這次送來的「空心禮包」不過是詐騙招數故技重施。    ,https://news.ltn.com.tw/news/politics/breakingnews/5401518
侵占政治獻金又一樁！木可買2輛中古胖卡租給柯競總 4.5月淨賺132萬,政治,2026/04/12 17:41,木可公司買入2輛中古「胖卡」小貨車改裝為宣傳車，再租給柯的總統競選總部，2車合計租了7個月，向競總收費200萬元，每車每月租金高達28.5萬元。（資料照）民眾黨前主席柯文哲涉京華城收賄等弊案，一審被判刑17年、褫奪公權6年，其中關於侵占政治獻金方面，判決書指出，由於政治獻金只能租用宣傳車、不能購買宣傳車，柯文哲就轉由木可公司買入2輛中古「胖卡」小貨車改裝為宣傳車，取名為「相信號」、「美好號」，再租給柯的總統競選總部，用以展示販賣木可小物，2車合計租了7個月，向競總收費200萬元，每車每月租金高達28.5萬元，使木可淨賺132萬元，而宣傳車的改裝費用98萬多元也是由競總買單，法院認定這也是侵占政治獻金的一環。判決指出，依照內政部2016年5月19日的函釋，擬參選人收受的政治獻金，「可支用於租用宣傳車輛，不包括購買宣傳車輛」，只能租用、不能購買宣傳車。由於柯競總無法購入車輛，就轉而由木可公司於2023年8月31日、11月1日，分別以53萬5000元、18萬9000元，購入2輛中古的展示用小貨車（Pancar，俗稱胖卡車），距離隔年1月的大選結束日，分別可使用4.5個月、2.5個月，合計約7個月。請繼續往下閱讀...木可公司使用這2輛胖卡車向柯競總收取租金各120萬元、80萬元，共200萬元，換算每月租金高達28萬5714元；選後木可再將其中一輛以5萬元賣出。法官計算，木可在4個半月出租期間，一共淨賺132萬6000元，且宣傳車的改裝費用98萬4218元，也是由競選總部支出，記入政治獻金專戶的支用項目。合議庭依此認定，柯競總為了規避政治獻金支出不可用以購買車輛的規定，竟由未受規範的木可公司購買車輛，轉以更高昂的價錢向競總收取租金，再由競總負責支出木可車輛的改裝費，而宣傳車所販售的募款小物，利潤也是由木可公司賺取。法官指出，如果木可販賣的小物所得不是民眾贊助的政治獻金，何以要由競總的政治獻金專戶來支付宣傳車的租金和改裝費用等成本？因此認定柯等人利用木可侵占競總的政治獻金，至為明確。    ,https://news.ltn.com.tw/news/politics/breakingnews/5401510
自由說新聞》中共紅三代揭「邪惡組織」黑幕！明居正酸爆藍：最差術語內宣,政治,2026/04/12 17:33,全新的視界！新聞話題不漏接，快訂閱YouTube 【自由追新聞】，記得開啟小鈴鐺哦！    ,https://news.ltn.com.tw/news/politics/breakingnews/5401479
中國惠台10項》推馬祖通水電「新四通」 連江縣長：有利民生正面看待,政治,2026/04/12 17:30,針對中國惠台10措施，連江縣長王忠銘說，凡是有利民生建設與經濟改善措施，持正面態度看待。（資料照）中共中央台辦今天宣布10項惠台措施，包括在條件具備下向馬祖通水、通電、通氣、通橋等「新四通」；連江縣長王忠銘表示，凡有助於馬祖民生改善與經濟發展的政策，縣府均持正面態度，並期待兩岸政府攜手合作，促進地方福祉。對此，離島馬祖選出的國民黨立委陳雪生表示，目前馬祖水、電供應無虞，他認為行政院不會同意，他強調，和平很重要，樂見對岸釋出善意、兩岸交流。請繼續往下閱讀...陳雪生表示，馬祖約20年前曾發生缺水危機，靠台灣運水補給，如今馬祖水、電設施陸續完善，水、電供應無虞，他認為，行政院不會同意通水、通電等措施。陳雪生強調，和平很重要，兩岸交流都是好事，也樂見對岸釋出善意，戰爭不會有贏家，民眾心聲期盼不要打仗，也建議中央政府能正視對岸釋出的善意。針對中國惠台10措施，連江縣選出的國民黨立委陳雪生指出，樂見對岸釋出善意，盼我政府能正視。（資料照）    ,https://news.ltn.com.tw/news/politics/breakingnews/5401494
鄭習會直播遭粗暴切斷！ 洪智坤：馬英九也曾被中共鐵拳暴揍2次,政治,2026/04/12 17:24,國民黨黨主席鄭麗文（左）與中國共產黨總書記習近平（右）10日於北京人民大會堂會面。（資料照，中國國民黨提供）國民黨主席鄭麗文今（12）日下午結束訪中行程，中共台辦也在上午宣布10項「惠台」政策措施。前民進黨中執委洪智坤對此形容，這份大禮包實質上是國民黨此次赴中配合演出的「演出費」，不僅政治賞賜意味濃厚，更顯示出中共強勢介入台灣政治、主導國共平台的企圖；鄭麗文也並非首位被中共粗暴中斷直播發言的國民黨政治人物。洪智坤今天在臉書發文表示，如他前天提醒，看到中共國發改委主任鄭柵潔上桌，必然會發「大禮包」，只是今天公布的惠台10項政策，和2018年「惠台31條」與2019年「惠台26條」有明顯的差異，是強勢主導的政治賞賜，是中國國民黨這次到赴中的「演出費」。能不能落實，是另外一回事。請繼續往下閱讀...洪智坤指出，中共開宗明義設定的框架就是：國共黨對黨機制、九二共識反對台獨的政治基礎，強勢介入島內政治的企圖很明顯。洪智坤提到，賴清德總統對於鄭習會的反應是謹慎的，至今只有「妥協不會換來和平」，他的謹慎來自於尚未進行的「川習會」，對美中台與兩岸的影響更大。但是，賴清德終究要回應美國所提「敦促北京當局應與台灣展開有意義的對話」。另外，他之前拒絕與鄭麗文見面，未來要不要與在野黨魁會談也是重點，川習會還是最大的變數。針對鄭麗文此行受到什麼規格的禮遇，洪智坤分析，在中共看來，她就是很配合的演員，中共官媒報導人民大會堂「習鄭會」的畫面，鄭麗文在謙恭傾聽後，吹捧「習總書記成就非凡持續騰飛」、「十五五規劃開局值得期待」，然後，沒有了。如此傑出的表現，給點「演出費」是當然的。至於鄭習會期間直播遭粗暴中斷一事，洪智坤直言，中共畢竟是強勢的，現場工作人員立刻驅趕記者，鄭麗文後半段的直播粗暴中斷。而中共如此強勢而粗暴中斷國民黨領導者發言的情況也並非個案，過去朱立倫、馬英九也曾遭到同樣待遇，包括2015朱習會、2015馬習會、2024馬習二會，「因此鄭麗文也不必太尷尬，馬英九曾經被中共的鐵拳暴揍兩次。」最後洪智坤說，這種可以事前協調的技術性問題，中共偏偏要在眾人面前呈現，只有一個政治訊息：「所謂國共平台，就是共產黨主導的平台。」    ,https://news.ltn.com.tw/news/politics/breakingnews/5401437
中共提惠台10措施  台中議會國民黨團：交流總比交戰好,政治,2026/04/12 17:07,國民黨中市黨團書記長李中表示，兩岸交流比交戰好。（記者蘇金鳳攝）鄭習會結束，針對中共今（12）日宣布的10項兩岸善意措施，台中市政府不回應，中市議會國民黨團書記長李中則表示，「是好事」，雙方有交流、有交談，總比交戰要好，兩岸一起賺錢拼經濟，有什麼不好？呼籲政府應善意回應。鄭習會落幕，國民黨主席鄭麗文今返國，中共提出十項措施，李中表示，鄭習會落幕，中共針對台灣提出10項善意措施，對雙方都有利。他並舉例，青年交流、文化交流及觀光旅遊的開放，對台灣旅遊市場可帶來利多；開放兩岸航班與金馬通水通電等，可帶來許多便利。請繼續往下閱讀...李中表示，至於開放農漁產品展銷，雖有檢驗符合標準等前提，但台灣農漁產外銷到世界各國販售本來就應該符合該國檢驗標準，台灣應努力提升農漁產品質、符合國際檢驗標準，中共開放此展銷，是讓台灣農特產有更多機會開拓中國市場，這是好事。李中強調，中共此舉釋出善意，台灣政府應該也有善意回應，他呼籲民進黨政府不要一味的說風涼話，更應藉由鄭習會開啟的交談、交流，降低兩岸敵對氣氛，兩岸一起發財，應該是好事。    ,https://news.ltn.com.tw/news/politics/breakingnews/5401430
中國對台10措施 農業部：非台灣農產外銷可長期倚賴的市場,政治,2026/04/12 17:03,隨中國在2021年3月起禁運我國鳳梨後，農業部開拓日本市場，日本已成為台灣鳳梨外銷最大市場，美國也將最快於5月正式公告台灣鳳梨可輸入。（資料照，農業部提供）中國公布對台10大措施，稱在92共識、反對台獨基礎上，提供符合檢疫的台灣農產品輸入便利，提供台灣遠洋漁船停泊碼頭等，農業部今（12日）表示，中國數次無預警且不符國際規範也提不出科學依據就禁運我國農產品，可見該市場具高度風險與不確定，會持續拓展多元市場。中國宣布「惠台」措施，包含堅持「92共識」、反對「台獨」政治基礎上建立溝通機制，為符合檢驗檢疫標準的台灣農漁產品輸入中國提供便利，並稱將支持台灣農漁產品參與中國各類展銷會、對接會，拓展銷售渠道，以及研究在符合條件的地區建設服務台灣地區遠洋漁船靠泊和遠洋漁獲上岸碼頭、泊位，為台灣遠洋自捕漁獲物在中銷售提供便利等。請繼續往下閱讀...農業部表示，中國自2021年起在毫無預警並且沒有通知下，就禁運我國鳳梨、釋迦、柑橘水果、石斑魚等農漁產，更忽視我方多次希望諮商並恢復兩岸農產貿易要求，在中國恢復部分產品輸入後，卻只公布部分輸銷名單，但對於標準等都沒有說明，指中國政策具有高度不確定與不透明，作法不符國際規範也沒有科學依據，並非台灣農產品外銷可長期倚賴的穩定市場。農業部表示，將持續開拓多元市場，也指出台灣過去生鮮蔬果輸中佔比從2019年最高73%，降到2022年的1.3%，中國恢復部分品項輸入後，2025年佔比增加到12.6%，但仍比2018年低，其中鳳梨更從過去主要倚賴中國市場，目前轉為主要外銷到價格更好的日本市場。對於中國將提供台灣靠泊和遠洋漁獲物上岸的碼頭、泊位，農業部表示，我國漁船是依我國法律管理，在國外港口整補，必須考量業界需求，以及港口國與我合作及分享資訊關係，以共同打擊IUU漁撈行為，更重要的是我國與中國在遠洋漁業屬競爭關係，台灣漁船仍應停靠符合我國規定與合作需求的各國港口，以利遠洋漁業管理。農業部表示，任何制度透明、符合國際貿易規範及遵循科學證據原則的外銷市場，都會支持並協助產業全力爭取，也呼籲中國應該要遵守國際貿易規範和慣例，和我方重啟科學諮商，恢復台灣農產品輸入、順暢兩岸貿易。    ,https://news.ltn.com.tw/news/politics/breakingnews/5401471
至今還是深信「我們木可的錢」 朱蕙蓉酸：誰來救救陳佩琪！,政治,2026/04/12 17:02,朱蕙蓉表示，誰來救救至今還是深信「我們木可的錢」的陳佩琪。（資料照）前台北市長柯文哲涉京華城等案，一審重判17年，完整判決書於10日公開，認定「木可小物」是政治獻金，並非商業行為。對此，民眾黨創黨黨員朱蕙蓉表示，誰來救救至今還是深信「我們木可的錢」的陳佩琪，直呼，「問題從來不在於『能不能賣小物』，而是在『身分』與『法律紅線』」。朱蕙蓉在臉書發文表示，「木可公關有限公司」如果負責人是一般平民，或是柯氏夫妻退休後自食其力開創新天地的副業，那絕對沒問題。但問題是，當時陳佩琪仍具公職身分，柯文哲是已登記在案、正積極角逐大位的總統候選人，既然身在政壇，就必須受《政治獻金法》與相關廉政倫理的約束。請繼續往下閱讀...朱蕙蓉指出，柯文哲將木可公司「營利單位」直接設在總統競選總部內，利用支持者的政治熱情轉化為私人公司的營收，這在法律與社會觀感上，就是明擺著的「公私不分」。至於陳佩琪糾結的明星肖像權，那是一種純商業行為，但政治人物的肖像權授權給「自己人」的公司來賺支持者的錢，這叫變相洗錢與規避監督。朱蕙蓉批評，法律條文寫得清清楚楚，怎麼就是聽不進去？這邏輯壞掉的程度，看來比李貞秀還讓人頭痛。直呼，「素養與底蘊果然是裝不出來，或是只好不演了？怎麼會開口就只剩傲慢與法盲？或許，只是苦了那些還在幫妳『神功護體』的小草們以及堅守崗位卻岌岌可危的幕僚們？」    ,https://news.ltn.com.tw/news/politics/breakingnews/5401398
轟國共「假惠台真害台」！ 吳思瑤：年底大選是台灣價值vs.共產黨,政治,2026/04/12 16:59,民進黨立委吳思瑤。（資料照）首次上稿 15:47更新時間 16:59國民黨主席鄭麗文與中共總書記習近平會面後，再次重申是對選舉的「大利多」；中共中央台辦今隨即宣布10項惠台措施，提出以反對「台獨」政治基礎前提，開放台灣農產品及食品輸入中國、優惠台商赴中投資等。對此，民進黨立委吳思瑤痛批，鄭麗文路線就是習近平意志，「假和平真投降」、「假惠台真害台」，共產黨以惠台措施力助國民黨，年底大選恐淪台灣價值與共產威權的對決。請繼續往下閱讀...吳思瑤提出五大疑問，首先，鄭麗文路線是票房毒藥，國民黨要照單全收？國民黨已經淪為共產黨駐台支部，鄭麗文路線就是習近平意志，「假和平真投降」、「假惠台真害台」，鄭麗文只有個人之私、政黨算計而無國家大義。以讓渡主權、讓中華民國歸零的代價，換來高風險低誠信的「空心大禮包」，國民黨恐怕未見其利先受其害。「空心大禮包是成年老梗，黔驢技窮還有市場？」吳思瑤續指，國共歷次交手，中方奉送的伴手禮都是換湯不換藥，此次習鄭會十大惠台方案也是老掉重彈，顯見中方要買通台灣的伎倆已近乎黔驢技窮。吳思瑤批評，毫不掩飾的介選本質，台灣人豈會不識？鄭麗文一再預告習鄭會將是選舉利多，顯見共產黨以惠台措施力助國民黨，毫不避諱公然介選。年底大選將淪為台灣價值與共產威權的對決，台灣社會應全力集體反中介選，反制外力干預民主。「糖衣毒藥包藏禍心，政府豈會接受？」吳思瑤質疑，除了介選，中共更企圖長臂管轄，架空台灣公權力，介入台灣內政。國共交換的從金廈共用機場、金馬四通、客運直航、漁業管理、農產品及食品檢驗、觀光開放等事項，都跳過政府公權力，不只毫無法治基礎，更暗藏製造國安破口的禍心，絕不是中方說了算。吳思瑤強調，中共無誠信高風險，政治詐騙狼來了，台灣還會上當？十項惠台措施不過是換湯不換藥的老戲重唱，況且以中國說翻臉就翻臉，「今天開放明天封鎖」的黑紀錄，台灣社會及產業已有抗體，不會再輕信買單。    ,https://news.ltn.com.tw/news/politics/breakingnews/5401371
惠台10項措施 何欣純：不予評論,政治,2026/04/12 16:57,對於中共十項措施，何欣純不予評論。（記者蘇金鳳攝）鄭習會結束，中共今（12）日宣布的10項兩岸措施；對此，民進黨台中市長參選人、立委何欣純表示，沒有評論。國民黨主席鄭麗文7日至12日訪問中國，並進行鄭習會，中共則宣布了兩岸十項措施；民進黨立院黨團幹事長莊瑞雄表示，台灣產業要穩定，而非「今天開、明天關」批評是中共養套殺劇本，並不是真誠的大禮包。請繼續往下閱讀...民進黨中市長參選人、立委何欣純則對中共的10項措施不予評論。    ,https://news.ltn.com.tw/news/politics/breakingnews/5401459
連署反彰化縣長人選空降筆跡好像？ 洪榮章：3人現場親簽,政治,2026/04/12 16:52,3人向國民黨中央連署書，簽名字跡漂亮工整，3人表明，現場親簽，以示負責。（民眾提供）國民黨彰化縣長提名人選未定，最早爭取提名參選的立委謝衣鳯、參議柯呈枋、工策會總幹事洪榮章，共同連署黨中央提出「徵召3人擇優1人參選」，把基層對空降第4人的焦慮，拋回給黨中央，但連署書筆跡被質疑「字好像？」，對此，洪榮章表示，3人現場親簽，只是同一支筆，他強調，連署是順意民意，也是3人都能接受的決定。連日來，藍營基層對空降人選反彈力道大，超乎國民黨中央預期，洪榮章受訪表明，連署書是在彰化完成，他說，他們3人跑行程走基層，一致感受到基層對空降焦慮與態度都炸鍋了，民意要參選人在地經營，過去空降沒有一次成功，他們3人的看法一致就是要團結才能打贏選戰，彼此相同的理念，自然而然就走在一起，發起連署建言，沒有中間人促成。請繼續往下閱讀...連署書曝光，有人好奇怎麼簽名筆跡字都寫得那麼漂亮工整，「好像同一人簽的？」對此，洪榮章嚴正駁斥並表明，只是同一隻筆，但各自由他們自己親簽，簽了名就要向黨中央傳達傾聽民意，距離選舉只剩7個多月了，提名人選不能用空降，律師魏平政不是不好，只是跟在地連結時間短了些，薄弱點，基層希望中央提在地徵召，讓基層能信服，才不會分裂甚至讓基層對國民黨失望。柯呈枋也說，徵召制度應回歸初衷，推出「最在地、最強」的人選。他強調，彰化重視基層經營與人情互動，沒有長期耕耘，很難獲得鄉親支持。謝衣鳯也表示，連署書自己親筆簽名。縣府參議柯呈枋（左起）、立委謝衣鳯、工策會總幹事洪榮章，3人達成共識，共同連署黨中央籲請從他們3人擇1人徵召參選彰化縣長。（民眾提供）    ,https://news.ltn.com.tw/news/politics/breakingnews/5401446
轟鄭麗文「習辦發言人」 民進黨：自我矮化換空白承諾,政治,2026/04/12 16:49,國民黨主席鄭麗文與中共總書記習近平會面後，中共發布10項促進兩岸交流合作措施。（美聯社）針對中共在「習鄭會」後釋出所謂「10項促進兩岸交流合作措施」，民進黨發言人李坤城今痛斥，相關措施中共向來「說禁就禁、說收就收」，兩岸往來只憑中共總書記習近平一念之間，動輒對台經濟脅迫，毫無善意可言；國民黨主席鄭麗文極力配合演出、甚至化身「習辦發言人」，換來口惠而實不至的空白承諾，再度證明「國共協力」只會傷害台灣而已。李坤城批評，鄭麗文在中國極力配合中共演出，甚至化身「習辦發言人」，用自我矮化、傷害國家的方式，換來所謂「利多」或「大禮包」，內容卻充滿「口惠而實不至」的空白承諾、複製中國對台脅迫的惡意模式，以及實現中國瞄準台灣青年與離島地方的吸納統戰目標，再度證明「國共協力」，對台灣造成的只有傷害而已。請繼續往下閱讀...李坤城重申，民進黨從未反對各種民間交流，也支持兩岸在符合「對等、尊嚴」原則上，展開健康有序的互動，但不應建立在各種前提下，也不應該讓學生與青年成為統戰的工具；呼籲中國政府，放棄對台灣政黨的分化與利誘，與其繼續利用「統戰+脅迫」的故技重施，不如正視中華民國台灣的存在，早日與台灣民選合法的執政黨政府進行對話，才是真正的「善意」，也才有可能真正開啟兩岸良性的互動。李坤城表示，中共不講道理、把兩岸交流當「統戰籌碼」與「施壓武器」，對台灣根本毫無「善意」可言，只想透過獨裁者的「欽點御賜」，增加未來統戰與施壓台灣的工具，更藉此分化台灣社會、介入影響年底選舉，中共的「故技重施、黔驢技窮」，台灣人不會再上當。    ,https://news.ltn.com.tw/news/politics/breakingnews/5401461
列藍白大咖「蹭印度」事蹟！李正皓：現在嫌噁心落後笑死人,政治,2026/04/12 16:33,2017年3月31日，時任台北市長柯文哲一早展開印度文化之旅，參訪甘地紀念館。（北市府提供）勞動部長洪申翰日前透露，首批印度移工最快將於今年底引進，此舉再度挑起社會熱議與部分民眾反彈，國民黨立委王鴻薇也表態反對，要求勞動部收回成命。對此，政治評論員李正皓於臉書發文火力全開，翻出藍白陣營大咖過去與印度交流的往事，諷刺兩黨政治人物過去「蹭印度蹭比誰都兇」，如今卻轉頭質疑印度「多噁心、多落後」，吃相相當難看。針對引進印度移工一事，李正皓今天發文 表示，民眾黨創黨主席柯文哲堪稱「全台最大印度粉」。柯文哲擔任台北市長期間，不僅釋出獎勵旅遊方案吸引印度人來台觀光，2017年也曾赴印度舉辦「台北之夜」，更將參訪行程比喻為「西天取經」，甚至稱甘地的非暴力精神為「印度版白色力量」，並於2018年提議引進印度生來台求學工讀。他狠酸，「你們的創黨精神『白色力量』是學印度人的，能粉印度粉成這樣真的不常見，草仔，要轉彎趕緊轉彎，現在還來得及！」請繼續往下閱讀...此外，李正皓也點名國民黨多位政治人物，包括台中市長盧秀燕曾臉繪印度圖騰，要讓大量印度人到台中觀光；台北市長蔣萬安曾提議與印度城市成為姊妹市；時任新北市長朱立倫也曾熱情參與印度文化節踩街遊行、2014年也曾自費休假前往印度見台商，讓李正皓不禁笑虧「愛跟印度人開pa」。他更翻出2017年國民黨立委羅智強的粉專讚數來源被爆出第五名正是印度。最後，李正皓直言，「說實話，我也沒有認為台灣一定要印度移工啦，政策有爭議就暫緩但藍白怎麼可以難看成這樣，平常蹭印度蹭的比誰都兇，現在在那邊說印度多噁心、多落後，笑死人。」    ,https://news.ltn.com.tw/news/politics/breakingnews/5401369
