Title,News_Type,date,content,url
有重大違失！鍾文智炒股重判潛逃 法官陳勇松遭監院彈劾,政治,2025/10/20 16:53,前「連一鮑魚」董事長鍾文智因炒股被重判定讞後逃跑，監察院今日表示，高等法院法官陳勇松於違反辦案程序及職務規定，核有重大違失，9日審查通過監察委員林郁容、葉宜津、高涌誠提案，全案移送懲戒法院審理。（資料照）前「連一鮑魚」董事長鍾文智因炒股被重判定讞後逃跑，監察院今日表示，高等法院法官陳勇松於合議庭評議鍾文智加保、不延長科技監控後，未宣示裁定、依法製作裁定書送達當事人，違反辦案程序及職務規定，損及人民對於司法之信賴，核有重大違失。監察院9日審查通過監察委員林郁容、葉宜津、高涌誠提案，全案移送懲戒法院審理。鍾文智涉違反證交法，被判合計30年5月徒刑，棄保潛逃遭檢方通緝。時任高等法院庭長邱忠義、法官陳勇松因未延長其科技監控等程序有違失，被移送法官評鑑委員會評鑑；法評會8月決議將邱移送司法院人審會議處，陳則須移送職務法庭審理、建議罰俸10個月。請繼續往下閱讀...監察院彈劾文指出，被彈劾人為資深法官，明知合議庭有關被告鍾文智加保不延長科技設備監控之決定，屬得抗告之裁定，須經宣示或送達等程序，始對外發生效力，亦明知系爭審理單未經宣示裁定、依法製作裁定書正本送達當事人，竟僅由書記官以電話片面告知被告鍾文智之辯護人辦理加保及拆除電子監控設備事宜，而未將裁定之內容送達檢察官，導致檢察官無從決定是否提起抗告，顯已嚴重違反訴訟程序。彈劾文續指，被告鍾文智逃匿引發輿論抨擊後，被彈劾人補行製作「評議附件」附卷，並指示書記官抽換電話紀錄，均違反辦案程序及職務規定，嚴重損害人民對於司法之信賴。彈劾文強調，被彈劾人所為，顯已違反法官倫理規範第3條、第15條第1項等規定，情節重大，依法官法第30條第2項第7款及第49條第1項，有懲戒之必要。爰依法提案彈劾，移送懲戒法院職務法庭審理。熱門賽事、球星動態不漏接    ,https://news.ltn.com.tw/news/politics/breakingnews/5217647
BP撂中文「高雄好ㄅㄧㄤˋ」 黃捷曝：市府6、7月就籌備寵粉計畫,政治,2025/10/20 16:40,"BLACKPINK世運主場館演唱會。（取自陳其邁臉書，照片提供：Live Nation Taiwan, YG Entertainment）韓國超人氣女團BLACKPINK結束高雄演唱會，ROSÉ大秀中文稱讚「高雄好ㄅㄧㄤˋ！」讓5萬名BLINK（指BP粉絲）嗨翻；立委黃捷今（20日）透露，就她所知，市府早在6、7月就開始籌備「寵粉計畫」，把粉絲擺在C位，事前的準備工作遠比我們所看到的還多。黃捷表示，副市長李懷仁發文揭開「全城應援」幕後分工，各局處使出渾身解數。就她所知，市府早在6、7月就開始籌備「寵粉計畫」，事前的準備工作，遠比我們所看到的還多，正是「必須非常努力，才能看起來毫不費力」的貼切註解。請繼續往下閱讀...從官方粉紅色號授權、點亮6大地標、舉辦K-pop隨舞大賽、發放商圈夜市券，到市長帶頭換粉紅大頭貼、路上的「Be BLINK、Be Safe」號誌，再用大數據疏運，讓5萬人接駁順暢，連洗手間數量都考量女性需求多增設。黃捷說，還有場館營運、警消安全維護、高效率垃圾清運，甚至交通管制線都用了粉紅色。每一個環節不僅專業、更充滿創意，讓粉絲透過追星愛上這座城市，連韓國網友也在社群留言：「想去高雄！」黃捷稱讚，高雄旅宿、運輸、餐飲業全面成長，7成歌迷留宿高雄，住宿消費提升48%、餐飲消費增長10%，單週末創造3.2億元經濟效益。「這不是偶然，是陳其邁市長帶領團隊以120分的準備，換來市民眼中100分的成果！」市長即使任期接近尾聲，陳其邁依然一刻不鬆懈，珍惜能為城市努力的時間。黃捷認為，城市治理當然不只是演唱會，但若連一場演唱會都能做到如此用心、把粉絲擺在C位，正充分展現市府團隊的格局和溫度。臉書社團「高雄好過日」則指出，這幾天看到前韓國瑜市府官員、藍營政客、名嘴攻擊高雄，大酸開個燈、換個粉紅色有什麼了不起；但高雄能讓「演唱會經濟」不只是曇花一現的活動，重點在於建立起「全城策展能力」，包含點燈要選哪個地標、活動要辦在哪個捷運站，這些也都經過策劃，以歌迷方便、串連景點、接近商圈和飯店為原則，默默地擴大經濟效益。李懷仁也提到，高雄把競爭對象鎖定在香港、新加坡，並認為台灣各城市的觀光應該進一步串聯合作，擴大效益；例如大型演唱會時，住宿效益甚至有15%是外溢到台南，這些指標活動有助於南部觀光串聯。熱門賽事、球星動態不漏接    ",https://news.ltn.com.tw/news/politics/breakingnews/5217622
海巡遠洋漁業巡護25年 管碧玲：總航程可繞地球赤道26圈,政治,2025/10/20 16:19,「巡護八號」從高雄港出航執行「太平洋公海漁業巡護任務」。（海委會提供）海洋委員會海巡署艦隊分署「巡護八號」今天從高雄港出航執行「太平洋公海漁業巡護任務」，預計11月18日返航。海委會主委管碧玲到場加油打氣表示，海巡遠洋漁業巡護歷經25年，已完成69航次，總航程超過56萬浬（約103萬公里），可繞地球赤道26圈，讓國家海域更加安全穩定。管碧玲指出，「越是偏遠的地方，就越能看見海巡的身影，無論是在花蓮光復災區協助災後復原的同仁，或是即將出航、遠赴萬浬公海的海巡弟兄，都是國家安全最堅實的守護者」。請繼續往下閱讀...管碧玲提醒，「巡護八號」務必將「安全」列為首要考量，強調「每一次任務的圓滿，都是建立在平安返航的基礎之上」，船長與帶隊官應隨時掌握航程狀況，關心所有成員的身心健康，確保任務安全順利完成。熱門賽事、球星動態不漏接    ,https://news.ltn.com.tw/news/politics/breakingnews/5217610
鄭麗文點名柯志恩選高雄市長  中常委孫健萍：要初選而非徵召,政治,2025/10/20 16:10,孫健萍認為2026縣市長提名要經過初選程序，而非徵召。（孫健萍提供）針對國民黨新任黨主席鄭麗文今天指「2026要從台灣尾開始贏，並點名柯志恩、謝龍介、蘇清泉」若南台灣你們三人都贏，我們就出頭天了！外界質疑形同已欽定這三人將代表國民黨征戰縣市長，由於國民黨的縣市長提名程序尚未進行，恐有提名程序正義問題；對此，高雄藍營看法不一，中常委孫健萍認為要經過初選程序，而非徵召，市議員白喬茵則認為柯志恩「已定於一尊」，只需補足程序。今年初第一位宣布參選黨主席、後來退選的國民黨中常委孫健萍表示，鄭麗文當選後，國民黨須一改過去黨主席「乾綱獨斷」的一言堂指令型領導，立刻成立「2026與2028重返執政對策小組」，在明年農曆年前公布全國的初選辦法，而非動輒「徵召」，因為徵召非民主常態，常會指定皇親國戚。請繼續往下閱讀...孫健萍說，柯志恩、謝龍介、蘇清泉三人都非常優秀，但一定要透過公平、公正、公開，以科學可驗證的「初選」方式產生，鞏固參選的民主正當性。他舉2018年韓國瑜為例，當時韓的聲勢如日中天，黨中央仍舉辦初選，由韓國瑜與立委陳宜民PK，透過辯論會闡述各自理念，也能帶動議題。孫健萍也曾於2022年宣布投入高雄市長選舉，爭取國民黨黨內提名未果。他強調，如果鄭麗文執意採用徵召方式，恐怕有負於支持他的年輕人。昨天曾呼籲新任黨主席鄭麗文在公開場合發言務必謹慎，不要再喊一些會嚇跑中間選民言論的高雄市議員白喬茵，則認為鄭麗文這番話沒有任何問題，因為「高雄柯志恩、台南謝龍介、屏東蘇清泉」這三人出馬選2026，已是南台灣藍營的共識，高雄市議員也都支持柯志恩再戰，幾乎已定於一尊，沒聽說有其他挑戰者，只要程序上補足即可。熱門賽事、球星動態不漏接    ,https://news.ltn.com.tw/news/politics/breakingnews/5217576
「走讀」涉「勒警」 黃國昌稱「搭肩」偵訊1小時請回,政治,2025/10/20 15:52,民眾黨8月底舉辦「司法改革公民走讀」活動，卻與維安警方爆發推擠衝突，有8名官警受傷；台北地檢署今日首度以違反集會遊行法被告身分傳喚黃國昌出庭說明，黃國昌約下午2時許進入偵查庭，偵訊約1個多小時後請回。（資料照）民眾黨8月底舉辦「司法改革公民走讀」活動，卻與維安警方爆發推擠衝突，有8名官警受傷，涉違反集會遊行法；台北地檢署今日首度以被告身分傳喚黃國昌出庭說明，黃國昌約下午2時許進入偵查庭，偵訊約1個多小時後請回；針對「勒警」指控，黃偵訊後對媒體表示，當時是因為太擠才把手搭在警察肩膀上，否認勒警。黃國昌結束偵訊後對媒體抱怨，過去自己涉集會遊行法，從馬政府到蔡政府，大概被檢察官調查了4、5次，過往偵訊從來沒有超過半小時，但「檢察官今天問了一堆讓我莫名其妙的問題」，例如如何定義集會遊行，黃國昌說：「我第一次在偵訊時被問這種法律定義性的問題，我覺得非常的驚訝，檢察官問了很多這樣的問題」。請繼續往下閱讀...黃國昌還提及：檢察官問他為何勒警察脖子？他則回說：「檢察官你被民進黨的國家機器跟綠色媒體誤導，我從來沒有勒那個警察的脖子，那時候人很擠，我手放在他的肩膀上，我如果勒他脖子，那個警察還跟我有說有笑、聊天，這不是違反經驗法則，太可笑了」。民眾黨因不滿前主席柯文哲被檢調偵辦滿1年，於8月30日在捷運中正紀念堂站口舉行「司法改革 公民走讀」活動，現場約有上百名民眾參與。但因路權問題，警民爆發衝突，抗議者被警方7度舉牌警告、制止、命令解散，期間，黃國昌涉率領群眾衝撞拒馬、和警方推擠，造成8名官警受傷，警方檢視蒐證影像後認定他涉非法集會、對警官勒頸、破壞阻材，於9月間約談黃國昌，但黃國昌並未赴警局接受警詢，警方遂將全案函送給北檢偵辦。熱門賽事、球星動態不漏接    ,https://news.ltn.com.tw/news/politics/breakingnews/5217569
習近平致賀電國民黨 學者：看似祝賀實則政治氣球,政治,2025/10/20 15:41,鄭麗文當選新任國民黨主席，中共總書記習近平發賀電，肯定多年來國共兩黨在堅持「九二共識、反對台獨」共同政治基礎上，推動兩岸交流合作，推進國家統一；中國官媒開始大肆報導並宣傳統一。（擷取自微博）鄭麗文當選成為國民黨準黨魁，中國國家主席習近平隨即發出賀電，從國民黨前主席洪秀柱、吳敦義、江啟臣、朱立倫到鄭麗文，中國發出的賀電不太相同，銘傳大學傳播學者杜聖聰認為賀電如氣球，是飄在權力與語言之間。中共給國民黨的賀電，看似祝賀，實則是一顆顆政治氣球，用來測風向、釋放訊息、暗示態度。這些文字暗藏機鋒，是權謀的語言試劑，誰被提及、誰被忽略、誰被冷處理，全是訊號，每個環節都是權力秩序的符號運作。他認為，這場遊戲並非單向。北京丟出政治氣球，國民黨須懂得如何接，回應太快，顯得依附，太慢，則被指為冷淡；字太軟，被說迎合，太硬又被扣上挑釁。「丟球」與「接球」之間，隱藏著的是權謀、節奏與風險管理。他從洪秀柱到吳敦義解讀中共賀電的意涵，也提到2020年江啟臣當黨主席時，中共「未發賀電」則是最冷的一句話，也是國共兩岸關係的空白，像是一種政治懲戒；北京以沉默取代語言，「不發」比「批評」更有殺傷力。請繼續往下閱讀...而2021年朱立倫復出，中共的賀電像條文，如今鄭麗文成為準黨魁，中共的賀電也充滿「習式新華體」風格，且是回歸高壓語言的版本，中共不再單談「九二共識」，而是納入「民族復興」。對北京而言，這是對國民黨的「再納編」；對國民黨主席而言，則是一次語言壓力測試。對於鄭麗文今天在廣播節目呼應習近平，則形同已被納入對岸的劇本。熱門賽事、球星動態不漏接    ,https://news.ltn.com.tw/news/politics/breakingnews/5217548
鄭麗文甫當選就被喊「別太紅」！ 尹立曝國民黨內部最大毛病,政治,2025/10/20 15:39,國民黨主席當選人鄭麗文拜會立院黨團，與同黨立委舉行便當會，鄭麗文（中）會後在黨團立委陪同下受訪。（記者陳逸寬攝）前立委鄭麗文當選中國國民黨主席，被視為中共首次介入台灣政黨選舉的案例，引發藍營內部對未來路線恐過於傾中甚至親共的憂慮，外界更嘲諷國民黨「正式紅統化」。前高雄市文化局長尹立痛批，國民黨內部對「紅」的恐懼，不是來自外界，而是源於他們害怕真實樣貌被看見。尹立昨（19）日在臉書以「國民黨的恐懼：紅標籤不是別人貼的」為題發文表示，當一個政黨的語言只有北京聽得懂，它就離台灣越來越遠。鄭麗文當選國民黨主席後，藍營不是團結，而是慌亂。藍委柯志恩急忙說：「我相信她會修正，取得共識。」議員白喬茵更直白：「拜託主席發言謹慎，不要再嚇跑中間選民。」請繼續往下閱讀...尹立指出，一個政黨的主席才剛上任，黨內就急著提醒她「別太紅」，這不是祝賀，而是恐懼，恐懼自己真正的樣子會被看見。他認為，柯志恩那句「會修正」最可笑，既然要修正，就代表方向本來就錯了，「修正什麼？修正鄭麗文的統戰思維？修正那種說不出口卻暗暗期待的『一中想像』？」尹立強調，連黨內都知道問題在哪，卻還要假裝沒事，這就是國民黨最大的毛病。白喬茵的話更直接揭穿藍營心魔，地方議員得天天出來滅火、撕標籤，因為黨中央未來講的話太像中國官媒？尹立直言，柯志恩說鄭麗文「懂民眾語言」，又說要跟社會對話，矛盾感十足，這些年，她的語言只有北京聽得懂。國民黨今天最該修正的，不是鄭麗文的言論，而是整個政黨早已被統戰話術麻痺的靈魂。熱門賽事、球星動態不漏接    ,https://news.ltn.com.tw/news/politics/breakingnews/5217481
京華城取消20％爭議容獎虛晃?  許淑華質疑「打假球」洗白批市府擺爛,政治,2025/10/20 14:58,台北市議員許淑華今（20）天在議會關切京華城取消20%爭議容獎的進度。（記者何玉華翻攝）台北市議員許淑華今（20）在台北市議會指出，鼎越開發今年4月向市府掛件申請取消20%的容積獎勵，被退件要求釐清有疑慮的事項後，至今未補件，容積率至今仍為840%，疑似「打假球」洗白，批評都發局態度消極，形同配合演爛戲；都市發展局局長簡瑟芳表示，土地目前還在扣押，建管還是不予施工勘驗，將發文鼎越請其說明遲未補件的情況。許淑華指出，京華城土地所有權人「鼎越開發」4月委由起造人「中國建築經理股份有限公司」，於4月9日行文台北市政府掛件變更都市設計審議案，申請取消有爭議的20%容積獎勵；交通局4月25日回函要求注意變更設計對周邊交通衝擊，都發局5月2日函覆要求釐清變更方案的樓層挑高合理性、開發量減少後停車需求、立體綠化維管措施等議題後，再續行辦理都審程序。請繼續往下閱讀...許淑華說，截至今日，鼎越都未再送件都審，容積率依舊維持840%；北市府僅於8月19日發函提醒，未積極追蹤，怠於行使督促之責。雙邊擺爛，案件遲無進展。且變更案是將原地上3層、17層、19層樓地板挑空，形成變更後地上2層、15層、16層，每層樓高度竟達「8.6至10.3公尺」，總建築高度未變更，質疑建物的安全性、合理性等。許淑華表示，8月19日的公文顯示，中國建經應於6個月內申請複審，也就是10月28日前，逾期未申請或仍不符規定，將依規定予以駁回。要求都發局立即要求業者說明，以免讓取消兩成容獎成為京華城洗白的「假議題」。簡瑟芳表示，目前還沒有完成容積取消20%，土地還在扣押的狀況，建管還是不予施工勘驗；針對都審遲未補件的部分，將發文請其來說明。熱門賽事、球星動態不漏接    ,https://news.ltn.com.tw/news/politics/breakingnews/5217487
黃國昌辦走讀涉「勒警」被北檢傳喚！民眾黨嗆：要約談就來,政治,2025/10/20 14:54,民眾黨8月在北市舉辦「走讀」活動，造成8名官警受傷，其中民眾黨主席黃國昌涉嫌非法集會、對警官勒頸，台北地檢署今日首度傳喚黃國昌出庭釐清案情。（民眾黨提供）民眾黨8月在北市舉辦「走讀」活動，造成8名官警受傷，其中民眾黨主席黃國昌涉嫌非法集會、對警官勒頸，台北地檢署今日首度傳喚黃國昌出庭釐清案情。民眾黨今發文開嗆，「走讀無罪把自由還給人民，要約談是吧？黃國昌來了！」民眾黨指出，「集會遊行法」是威權時代的中國國民黨政府，用以箝制公民政治空間的惡法。對於「集遊法」，民進黨過去諸多有志之士，包含前總統蔡英文、現任總統賴清德都曾大力批判，宣稱要廢除此惡法，把街頭還給人民；結果等到自己大權在握，卻是恣意擴權、禁制區愈劃愈大，俟賴清德總統執政，不容一絲雜質、強力排除異音，連人民「走讀街頭」的權利都要限制、都要箝制、都要剝奪。請繼續往下閱讀...讓人民自由地在公共空間活動，不僅是兩公約所明定，更是我國憲法所保障，民眾黨續指，聯合國人權事務委員會 也在2020年明確論述保障集遊權，認為「應避免將法院、議會、具有歷史意義的地點或其他官方建築等場所的周邊指定為不得舉行集會的區域」、「凡是對在這些公共場所內和周邊集會的限制，都必須有明確理由和嚴格界定。」民眾黨表示，今年8月30日，許多人民和平走讀至愛國東路周圍，希望以親身見聞的方式感受台灣民主與司法之演變，卻碰上警方以重重拒馬、路障、圍欄封鎖，剝奪人民本可自由行走道路與公共空間的權利，更親眼見證國家機器之擴權與警察權之恣意濫權。「當天人民在壓迫下無法走讀，被警方強力限制人身自由，」民眾黨聲稱，甚至在民進黨高層的要求下，以刑事追訴本黨主席黃國昌作為國家機器打壓之手段，對比民進黨政府長期主張集遊法違憲、違反公正公約，其言行不一、嚴重背離過去揭櫫之人權精神，顯得何其諷刺。民眾黨批評，這張傳票，不該發給黃國昌或任何行使自由權利的人民，應該發給民進黨政府，因為面對集遊惡法，犯法的從來不是人民，而是恣意擴權的國家機器，而是壓抑民主社會中公民力量與表意權力、濫用司法工具，一意將異議者強力排除於公共空間外的民進黨政權。熱門賽事、球星動態不漏接    ,https://news.ltn.com.tw/news/politics/breakingnews/5217483
鄭麗文抱怨賴清德只送花籃沒格局 馮光遠酸：派丁字褲小鮮肉跳豔舞,政治,2025/10/20 14:45,國民黨主席當選人鄭麗文拜會立院黨團，與同黨立委舉行便當會，鄭麗文（中）會後在黨團立委陪同下受訪。（記者陳逸寬攝）前立委鄭麗文當選國民黨主席，國民黨中央昨（19）日收到中國國家主席習近平賀電；相較之下，民進黨主席、總統賴清德送上「高票當選」花籃，未致賀電，讓鄭麗文感到「有點遺憾」，並批評「沒有格局，是台灣的悲哀」。對此，作家馮光遠發文嘲諷，直言「民進黨應該派小鮮肉去跳豔舞給她看」。馮光遠今（20）日在臉書發文指出，鄭麗文指責賴清德只送花籃、沒有賀電，讓她覺得有點遺憾，更直呼「沒有這個格局，是台灣的悲哀」。他反諷說，民進黨應該立即檢討改進，「派兩、三個小鮮肉，身著丁字褲至鄭麗文主席辦公室，跳一場讓人臉紅心跳的豔舞供鄭主席欣賞」。請繼續往下閱讀...馮光遠補充，去之前，記得要好好看看鄭麗文當初為連戰主席跳兔女郎舞的影帶，並說「格局盡在其中」。貼文曝光後，引發網友熱議，不僅有人曬出當年鄭麗文穿上兔女郎服飾為連戰跳舞祝壽的照片，還有網友留言回應，「送花籃不就表示祝賀之意嗎？」、「笑死，這樣已經超規格了…是我就給他一條脊椎骨（背骨仔）」、「格局要用對人事物」。熱門賽事、球星動態不漏接    ,https://news.ltn.com.tw/news/politics/breakingnews/5217410
嘉市勞工育樂中心房地標售案  議會三讀通過,政治,2025/10/20 14:44,嘉市議會今天通過市府提出的「勞工育樂中心」房地處分標售案。（資料照）嘉義市議會臨時會今天三讀審議通過市府提出「勞工育樂中心」土地及建物處分案，待報經內政部核准後由市府辦理標售。市府社會處長李思賢表示，會再找其他地方蓋勞工育樂中心，已退場大同技術學院嘉市校區也會列入未來設置勞工育樂中心的考量之一。使用42年的勞工育樂中心，因耐震結構有疑慮，2021年市府與廠商解約後閒置至今。市府考量補強修建或拆除經費不符經濟效益，將勞工育樂中心的3筆土地連同建物規劃處分標售案，送市議會審議，今天在臨時會獲三讀審議通過。請繼續往下閱讀...議員孫貫志說，市民反映大部分縣市都有勞工育樂中心，市府提出標售案後，希望能夠覓地重建勞工育樂中心。議員王浩表示，此案先前在審查時非常多市民反映，拆掉勞工育樂中心很可惜，目前有很多公共建設找不到土地來蓋，勞工育樂中心土地使用分區為住宅區，是否可規劃做為社會住宅？此案通過給予市府處分權利，但希望市府不要將處分標售做為唯一選擇，建議考慮其他作法。市府表示，曾規劃勞工育樂中心ROT案，因建築已使用42年，耐震結構有疑慮，考量結構補強需3千萬元以上，以及公有建物耐用年限約50至60年及建築須符合「發展觀光條例」規定等，不利ROT招商，且補強或拆除建物不符經濟效益，因此規劃土地利用進行標售，標售案基地面積約690.77坪，房地一併標售，總價預估為2億8283萬餘元。嘉市議會臨時會今天進行三讀會。（記者丁偉杰攝）熱門賽事、球星動態不漏接    ,https://news.ltn.com.tw/news/politics/breakingnews/5217431
