Title,News_Type,date,content,url
道路不是賽道！大重機「壓車」過彎挨罰 法院認證危險駕駛行為,社會,2026/05/09 09:30,台三線苗栗路段是不少大型重機騎士熱門路線，也常見騎士上演宛如賽道般的「壓車」過彎。（民眾提供）台三線苗栗路段是不少大型重機騎士熱門路線，常見騎士上演宛如賽道般的「壓車」過彎。黃姓男子因此遭警方認定「危險駕駛行為」告發，被裁罰1萬8000元、吊扣牌照6個月並須參加道安講習。黃男不服提起行政訴訟，不過，法官指出「道路非競技場所」，認定是危險駕駛行為，駁回黃男之訴。黃男於去年10月12日上午7點半許，騎乘大型重機行經苗栗縣獅潭鄉台三線119.7公里彎道時，以「壓車」方式過彎。當時執行防制危險駕駛勤務的大湖警分局員警認定其「危險駕駛行為」，依法舉發；監理機關裁處1萬8000元罰鍰，應參加道路交通安全講習，並吊扣汽車牌照6個月。請繼續往下閱讀...黃男不服，提起行政訴訟。台中高等行政法院地方庭法官當庭勘驗員警採證影像，確認該處為一左彎道，雙向車道間繪設有分向限制線，黃男騎大型重機跟隨前方2輛大型重機沿內側車道過彎；黃男於入彎時將車身傾斜，同時將身體向左探出緊鄰分向限制線，左側膝蓋幾乎貼近路面，出彎時才將車身、身體回正。法官認為，道路是供公眾通行，非屬競技演藝場所，汽機車駕駛人於道路行駛，自應遵守相關交通法令規定，履行安全駕駛義務，以防免危險發生。法官並參以員警提出量測距離照片及採證影像比對照片為憑，黃男過彎速度並不慢，並未依規定減速慢行，做隨時停車之準備。法官認為，黃男以快速傾壓過彎之行駛方式不僅自身易失控肇事，並有危害其他用路人行車安全之虞，客觀綜合觀察，顯有漠視交通法規所課予之交通安全義務，且已達高度威脅其他用路人生命、身體安全之程度，認黃男駕駛行為該當道交條例第43條第1項第1款規定之危險駕駛行為甚明。    ,https://news.ltn.com.tw/news/society/breakingnews/5430957
嘉義監獄「枕邊細語：為愛朗讀」 讓受刑人錄繪本故事送子女,社會,2026/05/09 09:26,嘉義監獄辦理「枕邊細語：為愛朗讀」，由受刑人親口錄製繪本故事送給子女。（嘉義監獄提供）嘉義監獄於母親節前夕策劃系列感人活動，其中「枕邊細語：為愛朗讀」，讓受刑人親口錄製繪本故事送給子女，將思念化作耳畔的陪伴；並結合九華山地藏庵、更生保護會嘉義分會邀請歌手獻唱，透過歌聲與聲音的傳遞，重建受刑人與家庭的親情連結。嘉義監獄指出，觸動心弦的「枕邊細語」，受刑人透過錄音，深情朗讀精選繪本故事，並在結尾錄下對孩子的叮嚀與思念。嘉監將這些音檔製作成專屬QR CODE，讓長期缺乏父親陪伴的孩子，能在睡前聽到父親熟悉的聲音，感受未曾斷絕的關懷。一位參與錄音的收容人哽咽說「以前沒講過故事給兒子聽，希望這段錄音能代替我，陪他度過這段我不在的日子。」請繼續往下閱讀...在嘉義地檢署、嘉義更生分會及地藏庵支持下，邀請到陽光療癒系創作歌手鄭怡琳蒞監演出，演唱多首感人肺腑的應景曲目，讓不少受刑人紅了眼眶。監方也辦理母親節感恩卡片比賽，期盼透過細膩的文字與圖畫，鼓勵收容人向心中掛念的母親表達最深切的愛意與改過的決心。為強化家庭支持力量，嘉義監獄也分別辦理電話與面對面懇親活動，透過話筒讓平時較難遠道而來的家屬，也能傳遞關懷與思念；面對面懇親活動則讓符合條件的收容人再次與家屬相擁，場面令人動容。嘉義監獄強調，穩固的家庭支持系統，是矯正機關鏈結社會安全網的核心力量，藉由一系列活動，轉化為具體的溫暖，賦予收容人回歸社會的勇氣。陽光療癒系創作歌手鄭怡琳到嘉義監獄演唱。（嘉義監獄提供）嘉義監獄母親節前夕策劃一系列活動。（嘉義監獄提供）    ,https://news.ltn.com.tw/news/society/breakingnews/5430951
高雄放貸大亨一家3口被綁付1140萬獲釋！3共犯沒拿到錢還被重判,社會,2026/05/09 09:21,林家母子兩人被綁票，歹徒用大型橘紅色塑膠桶轉移肉票。 （記者黃佳琳翻攝）放貸業者王富灃因身背2000萬元債務，竟與債務人蔣忠穎（通緝中）共謀，鎖定另一名林姓「放貸大亨」進行綁架。他們將被害人一家三口陸續誘出綁架，再「塞進塑膠桶」監禁，成功勒贖1140萬元，涉案的王富灃、周冠亦、鄂偉杰三人分別被判處12年及10年6月重刑。判決指出，王富灃因欠債壓力沉重，與欠他990萬的蔣忠穎一拍即合，由王負責打探林姓被害人的現金流向及作息，蔣男則負責招募周姓、鄂姓友人加入行動。去年5月24日，王男先以購買精品為由，誘出林男之子，隨即由同夥電擊制伏並布蒙雙眼、戴上手銬腳鐐，甚至強行拔走其手腕上的勞力士名錶（價值25萬），最後將人裝入大型橘色塑膠桶內載往監禁處。請繼續往下閱讀...王男等人利用林男之子的手機，假冒其身分誘出其母，同樣以膠帶封口、束縛四肢，並勒索1億元贖金。因林妻稱僅能支付300萬，王男竟嗆聲：「與其拿300萬不如把你們埋一埋！」最後再誘出林男。王男再用林妻的手機將林姓「放貸大亨」騙出，一家三口在24小時內全被綁走，林家的金庫掌握在林男手中，綁匪先押著林男收回610萬元欠款，並返家保險箱裡取走530萬元現金，籌得1140萬元現款後，一家三口才平安獲釋報警。在逃主嫌蔣忠穎在取得鉅額贖金後，竟對共犯周男、鄂男隱瞞已拿錢的事實，僅指示兩人將被害母子載往神農路釋放，隨後自己帶著千萬現金，兩天後火速搭機逃往越南，其餘共犯不僅一毛錢都沒分到，還得面臨牢獄之災。法官審理時指出，王男將被害人像貨物般裝進塑膠桶，手段極其不人道。雖王男因「取贖後釋放被害人」獲得減刑，但考量其位居首謀、情節重大，且至今未賠償被害人分文，依擄人勒贖罪判12年徒刑，周、鄂兩人則依強盜擄人勒贖罪各判處10年6月，可上訴。警方在蓮池潭打撈出手銬等作案工具。 （記者黃佳琳翻攝）    ,https://news.ltn.com.tw/news/society/breakingnews/5430946
光澤診所也涉偷拍！中山店經理、設備商聲押禁見,社會,2026/05/09 08:32,光澤診所中山店經理（戴口罩著西裝）訊後遭到聲押。（資料照）繼連鎖醫美診所愛爾麗集團針孔偷拍案後，另一家知名連鎖醫美診所「光澤」也被爆出疑在診間安裝偽裝成煙霧偵測器的監視設備，新北地檢署昨指揮新北市警方，鎖定新北市的光澤5家分店展開搜索，其中有3家分店被警方扣回疑似連接鏡頭的可疑影像線路及硬碟，帶回3名分店經理釐清案情，其中，中山店陳姓經理及設備商唐姓工程師，改列被告，檢方今晨訊後依妨害秘密、妨害性隱私、個資法及違反兒少性剝削條例等罪嫌將2人聲押禁見。光澤診所在全台有14間分店，其中新北市有5間。該診所昨天發出聲明表示，診所因安全管理、現場記錄及公共秩序維護，設有公開可見的攝影設備，現場所使用的攝影設備為一般可辨識設備，非隱藏式或針孔攝影器材，並無刻意隱瞞或秘密偷拍。請繼續往下閱讀...據了解，愛爾麗偷拍案延燒之際，有網友在Threads發文「板橋府中光O，5樓也有煙霧偵測器，每次除毛雷射都在這間暴露下體。」檢警獲悉後查知，被指涉的是光澤診所板橋中山店。為慎重起見，檢警因此協同衛生局人員，對光澤板橋館前店、中山店均展開搜索。各分店搜索時間均超過8小時，其中警方在板橋中山、板橋館前與三重正義等三家分店，發覺疑有相關裝備遭拆卸痕跡，將3名分店經理帶回調查，另從診間天花板扣得疑似遭拆卸後殘留的監視器影像線路，及辦公室內的硬碟及會員資料。警詢時，3間分店經理初訊時供稱，對於監視系統如何裝設及用途並不知情。3人原本都是證人，但隨著檢警深入調查，不僅有消費者在不知情狀況下遭偷拍隱私部位，且疑有少女受害，因此將中山店陳姓經理及設備商唐姓工程師改列被告；檢方訊後依刑法的無故攝錄性影像罪、無故竊錄他人身體隱私部位罪、違反個資法與兒童及少年性剝削防制條例的拍攝兒少性影像未遂等4罪嫌，且有串滅證之虞聲押禁見2人。    ,https://news.ltn.com.tw/news/society/breakingnews/5430927
抓到了！高雄民宅前爆炸 莽男持煙火炮丟前妻住家卻害到鄰宅,社會,2026/05/09 06:42,警方逮捕吳姓男子（中）法辦。（記者洪定宏翻攝）高雄市大寮區民智街某民宅門口驚傳爆炸，導致鐵捲門與騎樓毀損，警方獲報追查，昨晚逮捕34歲吳姓男子。原來吳男與前妻感情糾紛，為表達不滿，持煙火炮丟擲前妻住家，卻滾至鄰近民宅爆炸，殃及無辜，警方依妨害自由罪法辦吳男。高雄警方指出，5月8日凌晨約1點半獲報，指大寮區民智街某民宅門口發生爆炸案，鑑識採證發現爆裂物品疑似為鞭炮改造的煙火彈，報案人陳女表示未與人結怨，擴大調閱監視器鎖定吳男犯案。請繼續往下閱讀...林園分局與刑大成立專案小組，報請檢方指揮偵辦，昨晚在苓雅區運動中心旁發現涉案車輛及查獲吳男到案。吳男供稱與前妻感情糾紛，為表達不滿，持煙火炮丟擲前妻住家，卻滾至鄰近民宅爆炸。    ,https://news.ltn.com.tw/news/society/breakingnews/5430881
獨家》「台南沒查到針孔」不退費？愛爾麗苦主氣炸：流程還要跑一個月！,社會,2026/05/09 06:27,愛爾麗集團前天發聲明允諾消費者退費，但消費者指控，台南西門店卻以未查獲針孔拒絕退費，好不容易協調後，還要等一個月，憂心業者如果遇到財務狀況，消費者就求助無門。（民眾提供）知名醫美品牌愛爾麗集團捲入針孔風波，前天剛發布聲明允諾退費，但有消費者赴台南西門店退款遭拒，理由是「台南沒查到針孔」，好不容易有消費者通過審核，但退費流程卻長達1個月，擔心業者可能有財務危機、脫產，預計在13日中午要集結抗議。愛爾麗集團在總裁常如山聲押期間，5月7日緊急發表聲明，承諾針對未施作課程，提供不收手續費的全額退費。然而台南的消費者卻不滿，他們依公告親赴愛爾麗西門店辦理時，現場人員以「台南並未查獲針孔」為由，拒絕退費申請，導致消費者與愛爾麗員工發生衝突。請繼續往下閱讀...求助無門的消費者轉向地方民代陳情，經民代介入協調後，台南西門店態度軟化，同意讓其中一名消費者進入退款程序，有其他消費者得知後，也到西門店要求對退費。其中號召抗議的召集人稱，有些消費者購買的課程費高達數十萬，甚至最高到百萬，如今要透過民代協調才有進展，但多數消費者退費過程沒這麼順利，當消費者要求要帶店章時，店員起初還推託店章在台北。召集人說，好不容易通過退費審核，業者又告知退費流程需耗時長達一個月，此冗長作業時間再次引發疑慮。愛爾麗面臨調查、停業，漫長等待充滿不確定性，召集人認為，消費者的焦慮在集團目前的處境，若在等待期間，業者有財務危機或惡意脫產，預繳資金恐將血本無歸。為捍衛權益，部分消費者已串聯，也準備好集體訴訟準備，預計13日赴西門店集結抗議。    ,https://news.ltn.com.tw/news/society/breakingnews/5430876
破紀錄！屏東知名五金行老闆娘遭詐4835萬元  女車手重判並全額賠償,社會,2026/05/09 05:58,屏東警方逮捕詐騙車手，起出上千萬元。（屏東縣警局提供）首次上稿 00:32更新時間 05:58屏東知名五金行張姓老闆娘誤信詐團圈套，投資股票、虛擬貨幣，一個多月被詐騙4835萬元，創屏東縣單一個案被騙最多金額，警方獲報後逮捕中年女車手潘培芬，屏東地院除重判6年半，並要女車手全額賠償4835萬元。請繼續往下閱讀...這個詐騙集團藏身通訊軟體telegram、LINE，潘培芬擔任面交取款車手工作，負責向被害人收取詐得之現金，114年5月初起，以LINE暱稱「超揚投資群組」、「陳美臻」之帳號，向張姓老闆娘佯稱依其指示投資股票、虛擬貨幣可獲利等語，讓張女陸續交付款項給詐團，總計取款8次，共計詐騙4835萬元。女車手潘培芬聽從詐團指示，先到超商列印詐騙集團偽造之「超揚投資股份有限公司存款憑證」及超揚公司工作證後，佯稱是超揚公司之員工前往面交取款，分次取得4835萬元後，即依指示交付詐團其他成員，製造金流斷點，事後僅拿到5萬5千元之酬勞。屏東警方接獲張姓老闆娘家人報案後，在潘女與被害人面交時當場逮捕，潘女雖坦承犯行，但對上游交代不清且表明沒有錢可以賠償張姓被害人，因此被法院羈押至今，並重判6年半。屏東地方法院審理認為，潘培芬為詐欺集團成員，必須負連帶賠償責任，因此判潘女應該賠償詐騙張女全數4835萬元款項，創下詐團最下層車手賠償金額的紀錄。    ,https://news.ltn.com.tw/news/society/breakingnews/5430858
利用職權 索賄綠能業者 前麥寮鄉長蔡長昆 判刑5年半定讞,社會,2026/05/09 05:30,雲林縣麥寮鄉前鄉長蔡長昆任內利用鄉長職權，向綠能業者勒索320萬元，被判刑5年6月定讞，須入監服刑。（資料照）雲林縣麥寮鄉前鄉長蔡長昆，任內利用鄉長職權，向綠能業者達德能源集團勒索三二〇萬元，一審法院依藉勢藉端勒索財物罪將他判刑五年六月，上訴後維持原判；案件再上訴至三審，最高法院認為原判決無違誤，駁回上訴，蔡被判刑五年六月定讞，須入監服刑，法院隨即通知檢方啟動防逃機制。德商開發風電 回饋為名要錢判決指出，二〇二〇年間蔡男得知德國達德集團的創維公司將在鄉內開發陸域風電，利用鄉長職務發文，責令創維公司停工，或以替鄉民爭取回饋金、賠償金為由發動抗爭。蔡的友人、白手套陳英南，則以其與蔡的關係深厚，能左右蔡的決定，向達德集團要求給予「定作管路工程」利益，因陳不符承包條件才未取得承攬工程。請繼續往下閱讀...達德能源公司前董事長王雲怡擔心，若停工一個月的成本損害將超過四千三百萬元，透過雲林縣前議長沈宗隆邀蔡見面，蔡要求在麥寮鄉即將設置的八支風機，每支須給付四十萬元，合計三二〇萬元，雙方達成協議後交款。必須入監服刑 啟動防逃機制收賄案爆發後，蔡長昆在偵查時承認犯行，繳回犯罪所得，雲林地院依貪污治罪條例的藉勢藉端勒索財物罪將他判刑五年六月，褫奪公權四年。蔡認為量刑過重，主張其已在偵查階段坦承犯行及繳回犯罪所得，提起上訴。二審高等法院台南分院認為，蔡的犯罪情節無值得同情之處，一審判決未過重，駁回上訴；最高法院也認為原判決無違誤，全案定讞。    ,https://news.ltn.com.tw/news/society/paper/1754046
詐五金行闆娘近5千萬 車手判6年半還要全賠,社會,2026/05/09 05:30,"警方起出詐騙的上千萬元款項。（屏東縣警局提供）屏東知名五金行張姓老闆娘誤信詐騙集團設下的圈套，加入投資股票群組，連續八次繳交投資款項，短短一個多月被詐騙四千八百三十五萬元。警方獲報逮捕詐團指派取款的女車手潘培芬，屏東地方法院依詐欺取財罪將她判刑六年六月，民事方面則判決潘女須全額賠償張婦損失。潘女所屬詐騙集團在通訊軟體LINE設立「超揚投資群組」，向張婦佯稱投資股票、虛擬貨幣可獲豐厚利潤，張信以為真，自去年七月起，陸續交付款項給假冒投資專員的詐團車手，總計交款八次，金額達四千八百三十五萬元。請繼續往下閱讀...拿地抵押 車手落網才醒潘培芬聽從暱稱「豪豪先生」的詐團高層指示，先到超商列印詐欺集團偽造的「超揚投資股份有限公司存款憑證」及超揚公司工作證後，佯稱是該公司專員，出面向張婦取款，並將得手贓款交給上游詐團成員，以此方式製造金流斷點，潘女多次取款，共拿到五萬五千元酬勞。據了解，張婦對詐團話術深信不移，結果愈陷愈深，直至家人發現張婦向親朋好友及金融單位借錢，還拿土地去抵押，才驚覺事態嚴重，趕緊阻止親友不要再借錢給她，但張婦不相信自己受騙，等到警方逮獲車手潘女後，張婦才醒悟，但被騙的巨款已拿不回來。潘女落網後坦承犯行，但對案情及上游詐騙成員交待不清，並表明沒有錢可以賠償被害人，遭檢方聲押獲准。屏東地院依詐欺取財罪重判潘女六年六月徒刑，裁定續押；張婦向潘女提告求償，法官判決潘女賠償張婦被騙損失的四千八百三十五萬元。屏東警方逮捕女車手並起出詐騙的上千萬元款項。（屏東縣警局提供）    ",https://news.ltn.com.tw/news/society/paper/1754079
針孔到處藏 北市咖啡廳老闆偷拍近10年,社會,2026/05/09 05:30,仟日咖啡廳已永久停業。（取自Google Map）位於台北市大同區的仟日咖啡廳負責人徐維隆，以偽裝成芳香劑、電動刮鬍刀的微型攝影機偷拍女性如廁、洗澡及更衣畫面，犯案地點除了咖啡廳，更包含其位於三重的租屋處以及出遊時所居住的高雄、花蓮、台東民宿，甚至連去韓國、日本都不忘偷拍同團的女性友人，犯案時間橫跨近十年之久；士林地檢署近日依妨害性隱私等罪起訴徐男。用芳香劑、刮鬍刀針孔偷拍調查發現，徐男透過罐狀芳香劑、電動刮鬍刀外觀且具錄影功能之微型攝影機，進行偷拍行為，被害人幾乎無法察覺其惡劣行徑；而他除涉嫌在咖啡廳偷拍，並在前往高雄、花蓮、台東出遊時，在民宿廁所內偷拍同行友人，甚至來其租處的友人。如廁時也被他偷拍。請繼續往下閱讀...誇張的是，徐的偷拍足跡甚至延伸至國外，其中包含二〇一四年、二〇一五年間，其遠赴日本東京、韓國首爾時，偷拍同行友人，並將影片帶回國內，上傳至Google Drive等雲端硬碟備份以利保存。檢警追查發現，徐男偷拍取得的影像內容，包含被害人洗澡時的正面裸體、如廁、更衣影片等，被害女性至少有廿人；且徐男還對偷拍影像分類，用被害人暱稱、角度等為命名檔名，其中包括「廁所正面」、「廁所側面」、「洗澡」、「更衣」以及「NG」字樣等。檢方近日偵結起訴徐男，建請法院沒收本案扣押的手機、平板電腦、筆記型電腦、外接硬碟、記憶卡等。    ,https://news.ltn.com.tw/news/society/paper/1754080
前立委曾蔡美佐在家遭毆 朝天宮董座兒拘提到案,社會,2026/05/09 05:30,朝天宮董事長蔡咏鍀提供另一段影片，強調兒子蔡晉財（紅圈者）是去阻擋勸架，沒有打人。（民眾提供）警再拘10人 已20人到案八十歲前立委、北港朝天宮前董事長曾蔡美佐的住家，前天遭到大約卅名白衣男子攻擊，曾蔡美佐與擔任北港朝天宮董事的兒子曾維斌、以及在場親友共六人被打傷，警方連續兩天拘提廿人偵辦。曾家人PO網指控，發動暴力的帶頭者是雲林縣副議長、朝天宮董事長蔡咏鍀的兒子蔡晉財，而蔡晉財也在第二波調查之列，警方昨天對其初訊後，將蔡男移送雲林地檢署，交由承辦檢察官進一步複訊。蔡咏鍀則說，兒子是去幫忙阻擋的。曾維斌的兒子昨天受訪指出，在網路PO文指控蔡咏鍀兒子帶了將近五十人來叫囂、打人者，是他的妹妹，主要是根據其他被害人看見蔡的兒子在現場，也有影片。請繼續往下閱讀...蔡咏鍀：兒子是幫忙阻擋蔡咏鍀對此回應稱：「他們太過份了，兒子雖有在現場，但是去攔外面的人，怎麼變成兒子打人，現場影片看得很清楚。」曾家：勸架為何要躲兩天不過曾維斌的兒子補充說，被害人看到蔡的兒子是跟那一群人一起來的，也一起走，若是去勸架為什麼要躲兩天，他們已把相關證據交給警方，相信檢警會秉公處理。前天清晨四點多，曾蔡美佐位於雲林北港大同路的住家，瞬間出現三十多名白衣男子靠近，曾蔡美佐走出家門查看時，一群人拿起路旁的交通路牌朝其住家丟砸，接著上演「全武行」，一陣混亂中，曾蔡美佐倒地、蜷縮在地上，送醫診斷為壓迫性骨折，送醫後住院觀察中，曾維斌等人身上也有多處挫傷。警方前天已經先行逮捕十人，其中一名陳姓男子收押、另有二人六萬元交保；警方昨天再度拘提十人到案，包括蔡咏鍀的兒子蔡晉財。發生暴力事件後，一度傳出警方「吃案」，雲林警方昨天強調，此與事實不符，警方對於對於任何暴力犯罪案件均秉持迅速處置、依法偵辦原則，並以保障民眾生命安全為優先。    ,https://news.ltn.com.tw/news/society/paper/1754077
愛爾麗偷拍 石崇良：不可原諒應停業,社會,2026/05/09 05:30,愛爾麗高雄中山店貼出近期無法辦理退費和施做療程的公告。（記者許麗娟攝）偷拍非偶然過失 而是有目的性的行為 要求從速嚴查大型連鎖醫美集團「愛爾麗」近日爆出診間涉裝設針孔攝影設備，病患在不知情下遭偷拍的犯罪事件，還被指涉違規預收醫療費用，引發外界譁然。衛福部部長石崇良昨天重話抨擊，此案並非單一個案，而是集團旗下多家診所都有類似情形，不是偶然過失，而是有目的性的行為，情節重大、不可原諒，已要求地方衛生局從速嚴查，並應給予停業處分。請繼續往下閱讀...石崇良昨晚表示，目前掌握情況顯示，愛爾麗在診間裝設攝影鏡頭，涉及病患隱私侵害，且並非個別員工行為，而是集團性問題，這是明知故犯，衛福部已要求醫事司責成地方衛生局從速、從嚴查辦。預收醫療費也違規石崇良說，除偷拍爭議，愛爾麗還涉及預收醫療費用。衛福部多年前即已明令禁止醫療機構以療程、套裝等方式預收醫療費，但愛爾麗不僅違規預收，且規模龐大、非一兩件個案，光是這一條就已經屬情節重大，可處停業處分。石崇良表示，未來將把「是否有侵害病人隱私的監控行為」納入督考重點，加強醫美診所監督管理，避免類似事件再度發生。高雄兩分店主機被查扣另一方面，新北地檢署查出愛爾麗高層涉緊急指示設備商，將台中（含）以北的十家分店針孔設備拆除，集團總裁常如山等三人已遭羈押偵辦。但位於高雄新興區、左營區的兩家分店，也被高市衛生局發現診療間天花板有拆機痕跡，通報司法機關追查，檢方昨指揮警方搜索，拆下監視器主機並帶走相關顧客名冊。檢警表示，高雄尚無人報案遭偷拍，是否涉及妨害秘密等罪，要視取得的物證再做進一步調查比對。高雄市長陳其邁表示，針對醫美診所爆發偷拍事件，已指示副秘書長王啟川成立「防偷拍專案小組」，鎖定多個潛在風險地點進行聯合稽查。行政院消保處統計，截至昨天傍晚，全台愛爾麗申訴案件為三六二件。消保官表示，愛爾麗聲明尚未施作的課程可全額退費，應公布退費方案，消費者也可先保全證據。    ,https://news.ltn.com.tw/news/society/paper/1754075
