Title,News_Type,date,content,url
川習會落幕  國安官員解析川普談台灣議題背後的3大訊號,政治,2026/05/16 14:10,"「「川習會」落幕，國安人士分析，從川習會以及後續川普接連訪談中關於台灣的政策立場，這當中所釋出的訊號大致一致，就是對台政策不變、維持現狀是關鍵、軍售怎麼賣只跟台灣談這三大訊號。 （法新社資料照）「川習會」落幕，國安官員今（16）日指出，要看清楚川習會以及後續川普接連訪談中關於台灣的政策立場，應該從會談前後，白宮、國務院與川普本人在不同場合的接連表態來整體觀察，而實際觀察，這當中所釋出的訊號大致一致，就是「對台政策不變」、「維持現狀是關鍵」、「軍售怎麼賣只跟台灣談」這三大訊號。他並強調，「川普沒有讓習近平可以跟他對台灣的軍售喊價」。國安官員指出，會談結束後，國務卿盧比歐在北京明確表示：「美國對台政策截至今天、截至這場會談為止，都沒有改變。」這是行政部門在川習會後最直接的政策確認，盧比歐同時駁斥習近平關於台灣問題可能引發衝突的警告，白宮也在社群上推播國務卿的這段表述。請繼續往下閱讀...川普自己則在《Fox News》訪談中，針對美國對台政策是否改變的提問，斷然回答「No, nothing's changed」。這是他自己的確認，時間點在會談之後，受訪環境非外交場合，更是川普本人第一次公開做出這樣明確的立場表示。美國總統和國務卿接連在24小時內做出這樣的表示，訊號非常明確。「維持現狀是核心利益」，國安官員分析，川普在接連的訪談中反覆提到習近平一再跟他表達的台灣獨立問題，有人直接把這解讀為川普正依照北京的要求對台灣劃紅線。但完整觀察川普談話脈絡，包括要中國「冷靜」，反應他在意的不是「獨立」這個概念，他也不想清楚的定義台灣地位，而是不希望任何打破現狀的動作。國安官員認為，川普說不想看到台灣喊獨立、然後美國要飛九千五百英里去打仗，說的是他不想為了一場破壞現狀，傷害美國與各方核心利益的情形被拖進戰爭風險裡，並不是幫北京定義台灣的政治身份，這點非常明確。更不要說，從蔡英文到賴清德兩位前後任總統，都清楚表達過，台灣已經是主權獨立國家，沒有宣布獨立的問題。確保現狀的不受到破壞，就是台灣與包括美國在內所有民主世界的共同目標和利害所在。在對台軍售上，國安官員強調，川普的說法，就是更清楚明確把台灣跟中國區分。川普被問到是否批准超過百億美元的軍售案，他的回答是「可能批，也可能不批」，拒絕透露決策的關鍵考量。盧比歐也說，軍售問題在這次川習會中「並沒有佔據突出地位」，川普更明確的說他沒有給習近平任何回應跟承諾。在空軍一號的訪談中，川普更說到準備和「你知道是誰、目前負責台灣事務的人」溝通再做決定，而這個負責台灣事務的人是誰，指向都很清楚：軍售的商議對象是台灣，不是北京。至於所謂的軍售作為籌碼存在的說法，在這個脈絡上，更接近是對北京的警示，「你不要一直想破壞現狀」。國安官員說，至於川普此前曾提到可能和習近平討論對台軍售，是否與雷根1982年對台六項保證的第二條有所牴觸—美國不在對台軍售前事先徵詢北京。川普被問到這點時，說1982年「是非常久以前的事了」，但包括川普在內都已經清楚表明，儘管習近平提出各種要求，但都只得到一個不回應。「川普沒有讓習近平可以跟他對台灣的軍售喊價」。    ",https://news.ltn.com.tw/news/politics/breakingnews/5439071
向無黨籍招手！白營台中議員拚「坐5望6搶7」成立黨團,政治,2026/05/16 14:08,民眾黨主席黃國昌（右4）為台中6位議員參選人披彩帶授旗。（記者張軒哲攝）台灣民眾黨今（16）日在台中市黨部舉辦「民眾台中隊」誓師大會，全場凍蒜聲此起彼落，民眾黨主席黃國昌親自為六位在地打拼的優質參選人披彩帶、授戰旗，立委陳清龍表示，黃國昌強調「若沒辦法成立民眾黨台中市議會黨團（3席以上），要我提頭來見！」市議員江和樹喊話，除了6席全上，還要向無黨籍議員招手「坐5望6搶7」，不會讓陳清龍「提頭」！「民眾台中隊」誓師大會由台中市黨部發言人吳皇昇主持，包括后豐區議員參選人連小華、西屯區議員參選人劉芩妤、太平區議員參選人許書豪、北屯區議員參選人邱于珊、清沙梧區議員參選人陳永祥，眾人牽高呼口號，展現「台中隊」團結衝第一的強烈氣勢。請繼續往下閱讀...黃國昌表示，台灣民眾黨依黨內程序、前後在台中提名了6位優秀的議員參選人，希望讓民眾黨真正在台中市站穩腳步、在台中市議會成立黨團，相信大家就是一條心，將所有優秀的議員參選人全部送到台中市議會！另外，民眾黨號召近20位通過嚴格訓練、取得正式證照的專業防災士共襄盛舉，成立民眾防災守護隊，進行揭牌儀式，未來這群具備緊急應變能力的防災士將散佈在社會各個角落，成為台中市民最安心的隱形防護網。    ,https://news.ltn.com.tw/news/politics/breakingnews/5438976
高虹安觀球遲到擋舞者表演惹議 錢康明：高習慣晚到,政治,2026/05/16 14:07,新竹市長高虹安觀球遲到擋舞者表演惹議，前文化局長錢康明也給答案稱高虹安習慣晚到。（照片擷取自網路貼文）新竹市長高虹安日前偕副市長林琨翰前往竹北市觀看新竹攻城獅籃球，因遲到且進場時擋到啦啦隊舞者表演引來網友開酸及罵聲，前文化局長錢康明也發文提到，高虹安是愛遲到嗎？他也給出正確答案是高虹安是習慣晚到，過去擔任文化局長時，高虹安出席文化局的活動，沒有一次是準時到的，總是晚到要製造全場焦點。錢康明提到，高虹安出席文化局的活動，沒有一次是準時到的，運氣好的時候，隨行（隨車）秘書可能會準時到，勘查完路線詢問完流程後，高虹安的座車才會姍姍而來，一群老師、里長、市民等待高虹安。或許高虹安在享受千呼萬喚始出來的尊榮感吧。且隨行（隨車）秘書是搭同一輛車的，高虹安的市長座車根本就停在不遠處，或是再繞一圈，為晚到拖點時間。請繼續往下閱讀...有些首長是展現時間規劃的能力，但高虹安則是以晚到製造全場焦點。錢康明更舉例，記得有一次文化局在北大公園，辦台積心築藝術季的展演活動，眼看演出時間將至，擔任開場的高虹安，明明在市長室卻不到活動現場，他與文化局人員在現場急得不得了，電話狂call市長室，直到現場市民人數夠多了，高虹安才晚到現身。然後開場完後，待了一下就走了。錢康明並提到，高虹安讓市民見到她想讓市民見到的那一面，但他卻看到高虹安算KPI的那一面，自詡為科技人的高虹安，對藝術文化及相關項目是比較沒興趣和想法的，總把KPI掛在嘴邊的人，所作所為都是精心策劃的算計。    ,https://news.ltn.com.tw/news/politics/breakingnews/5439030
川習會落幕 江啟臣：「維持我們最高利益就是台海和平現狀」,政治,2026/05/16 14:05,川習會落幕 江啟臣「維持我們最高利益就是台海和平現狀」。（江啟臣辦公室提供）美國總統川普與中國國家主席習近平「川習會」15日落幕，立法院副院長江啟臣今指出，川習會曝台海的關係、美中台三邊的關係持續在變動，維持我們最高的利益就是台海和平的現狀，局勢在變，我們不能以不變應萬變，為政者及政府必須為了國家的利益去思考如何因應這些新的情勢發展。江啟臣說，從這一次的川習會對台灣議題的表態還有回應，可以很清楚地看到，台海的關係、美中台三邊的關係實際上是持續在變動，我們必須對這些變動有所掌握及如何維持我們最高的利益就是台海和平的現狀，因為局勢在變，不能以不變應萬變，為政者、我們的政府必須為了國家的利益去思考如何因應這些新的情勢發展。請繼續往下閱讀...江啟臣更說，要確保我們國家利益還有台海的穩定和平，「3D」很重要，第一個D是民主（Democracy），這是我們的生活方式及我們的價值，但如何維持跟捍衛，必須靠嚇阻（Deterrence）跟對話（Dialogue）。江啟臣說，「嚇阻」包括增加我們的國防實力及其他的軟實力，讓台灣的國際重要性能夠持續被看到，並在國際的產業鏈上扮演關鍵的地位；對話則是為了增進和平、促進和平，實力也是為了確保和平，這兩者其實是相輔相成。江啟臣說，為政者必努力在中華民國的憲政、憲法底下，建構兩岸未來有序健康的一個對話，透過對話促進、增進和平，並另跟其他國際或國家、區域等，也進行對話，讓大家更了解我們的狀況及生存實力，才是真正確保國家安全之道。    ,https://news.ltn.com.tw/news/politics/breakingnews/5439062
自由觀點》國防特別條例7800億 砍彈藥庫存恐降防衛韌性,政治,2026/05/16 14:00,    ,https://news.ltn.com.tw/news/politics/breakingnews/5437304
鄭麗文不認「前人把國民黨敗光說」趙少康酸：說了十個只否認一個？,政治,2026/05/16 13:59,針對國民黨主席鄭麗文昨天引發爭議的發言，前中廣董事長趙少康16日接受媒體採訪，回應相關問題。（記者方賓照攝）國民黨主席鄭麗文昨出席國民黨內部空戰培訓課程，批評前中廣董事長趙少康說話沒人信、前總統馬英九身體差，以及前面的人把國民黨敗光等發言，讓趙少康不忍開酸，「這麼偉大的領袖真是不容易」；國民黨今聲明，鄭麗文並無所謂「敗光光」等相關言論。對此，趙少康回應，除了不承認說了「敗光光」，其他到底還說了什麼？是不是說了十個，只否認其中一個？國民黨表示，昨日內部培訓活動，國民黨全程均有錄音紀錄，鄭麗文於發言過程中，並未提及任何一位前任主席，更無所謂「敗光光」等相關言論。部分媒體及有心人士刻意曲解、以訛傳訛，甚至將鄭主席從未說過的話強行附會、硬塞給她，與事實明顯不符。請繼續往下閱讀...趙少康表示，既然黨中央否認外界質疑，應該沒有什麼國家機密，請國民黨把全程錄音公佈，昭告天下。除了不承認說了「敗光光」，其他到底還說了什麼？是不是說了十個，只否認其中一個？請讓真相大白，以免把鄭主席沒說過的話硬塞給她，對鄭主席產生誤會。    ,https://news.ltn.com.tw/news/politics/breakingnews/5439056
出席法鼓山浴佛祈福 李四川：工程修復災損、宗教撫慰人心,政治,2026/05/16 13:47,國民黨新北市長參選人李四川出席法鼓山「朝山・浴佛・禮觀音」活動，共同為市民祈福。（李四川競辦提供）國民黨新北市長參選人李四川16日出席法鼓山「朝山・浴佛・禮觀音」活動，共同為市民祈福，自許為拿鐵鎚的李四川感性表示，工程人員能在災害後修復橋樑、重建硬體，但災民的心靈重建需要攜手宗教力量，撫慰人心。李四川回憶，2017年颱風重創金山，法鼓山慷慨捐出5000萬元，與市府共同投入災後重建，令他至今感念，面對災害發生，不管橋斷了、路斷了，工程技術或許可以復原，但災民心理的傷害，需要宗教慈悲關懷的力量一起幫助災民，感謝法鼓山長期攜手市府，共同投入公益慈善。請繼續往下閱讀...李四川也肯定法鼓山長期推動心靈環保，推動「洗心淨地」的理念，效法菩薩聞聲救苦精神，並推動環保愛地球，他也表示，未來施政會秉持同樣信念，傾聽市民的聲音，解決市民的困難，讓新北市越來越好。國民黨新北市長參選人李四川（左起）、方丈和尚果暉法師、新北市副市長劉和然共同出席浴佛祈福儀式。（李四川競辦提供）    ,https://news.ltn.com.tw/news/politics/breakingnews/5439041
趙少康大戰鄭麗文地圖砲 國民黨：最後一次說明不再回應,政治,2026/05/16 13:38,國民黨主席鄭麗文。（資料照）國民黨主席鄭麗文昨出席國民黨內部空戰培訓課程，批評前中廣董事長趙少康說話沒人信、前總統馬英九身體差，以及前面的人把國民黨敗光等發言，讓趙少康不忍開酸，「這麼偉大的領袖真是不容易，過去百年都很少有這麼優秀的黨主席」。對此，國民黨聲明，基於對趙少康先生的尊重，針對相關不實傳聞，特此作最後一次說明。鄭麗文日前稱「鄭習會」會讓年底選舉加分，昨還在內部空戰訓練課程說搞定華盛頓，選舉就好選了。趙少康今受訪坦言，近日看到國民黨許多參選人的民調有點緊張，讓他很憂心；趙也直言，「黨中央怎麼樣真的不要管他了啦、黨團也不要管黨中央了！」參選人把年底選舉選好最重要。請繼續往下閱讀...對於國民黨昨宣稱媒體誇大扭曲報導鄭的談話。趙少康今表示，「我透過小編去查證了兩個學員，都說她的確有這樣講」。國民黨今表示，昨日內部培訓活動，國民黨全程均有錄音紀錄，鄭麗文於發言過程中，並未提及任何一位前任主席，更無所謂「敗光光」等相關言論。部分媒體及有心人士刻意曲解、以訛傳訛，甚至將鄭主席從未說過的話強行附會、硬塞給她，與事實明顯不符。黨已就相關內容完成說明，後續不再針對此事另作回應。    ,https://news.ltn.com.tw/news/politics/breakingnews/5439029
板橋座談擠近千人 蘇巧慧：用新北人的眼光讓新北升級,政治,2026/05/16 13:32,"民進黨新北市長參選人蘇巧慧（持麥克風）帶眾人高呼「2026新北會贏！」。（記者黃政嘉攝）民進黨新北市長參選人暨立委蘇巧慧今早在新北市板橋農村公園，與民進黨新北市議員山田摩衣進行基層座談會，現場擠進近千人熱情支持，蘇巧慧向鄉親說，新時代要來了，剩196天「咱作伙走，作伙贏」，她強調應用新北人的眼光看新北、解決新北的問題，讓新北再升級，真正的市長可以把每種專家合在一起才叫「領導力」，她帶眾人高呼「2026新北會贏！」，並力薦山田摩衣是能接軌國際的新世代。今天近千人擠爆座談會現場，蘇巧慧與山田摩衣進場受到鄉親熱烈歡迎，不到50公尺，花近2分鐘才走上台。蘇巧慧表示，現場大家都很高興，這個氣氛是新時代要來了， 2026新的時代要開始了，她說，這個新的時代會停在原地，還是跳一階，往上跟國際接軌，讓整個城市再起，就在這個時代，剩196天而已，從這場開始，「咱作伙走，作伙贏」。請繼續往下閱讀...蘇巧慧說，現在板橋已超過台北市很多地方，但還可以更好，都市更新可以再加快，道路、節點也可以更清楚、方便，讓大公司來設總部，板橋府中商圈有活動但不夠轟動，希望轟動到其他縣市，讓觀光客來新北，她以新北商辦租金比台北市便宜為例，她歡迎企業將總部移來新北，7、8成住新北的員工一定鼓掌贊成，可以多睡半小時不用搭車過橋。她強調，「我們不想再面對台北市而已，我們希望轉頭看看自己的新北，跟我們自己的新北站在一起，我們用新觀念、新技術，做解決新北的老問題，新北可以跳一級」，以新北為主，用新北人的眼光看新北、新北解決新北的問題，讓新北再升級。要讓新北升級不是只有一種專家做得到，它需要每一種人才，「所以真正的市長是可以把每一種專家合在一起的，這個才叫做統合立，這個才叫做領導力」。山田摩衣表示，她在議會一起爭取實現營養午餐免費，升級婦幼安全，也打通通學安全最後一哩路，給孩子最好的教育環境，也發揮她的專業，持續深化台日關係，幫板橋「交朋友」，前年底到日本訪問，與當時的眾議員、現在是日本首相的高市早苗見面，相信今年新北市也即將迎來第一位女市長，蘇巧慧。民進黨新北市長參選人蘇巧慧（戴眼鏡）與鄉親相互熱情擊掌。（記者黃政嘉攝）民進黨新北市長參選人暨立委蘇巧慧（前排左5）今早在新北市板橋農村公園，與民進黨新北市議員山田摩衣 （左4）進行基層座談會。（記者黃政嘉攝）民進黨新北市長參選人暨立委蘇巧慧（戴眼鏡）會後站定點與鄉親握手致意。（記者黃政嘉攝）    ",https://news.ltn.com.tw/news/politics/breakingnews/5439001
北市藍議員選將陳冠安 稱遭「支持台灣獨立」婦人持扇攻擊,政治,2026/05/16 13:23,陳冠安表示，今天跑行程時遭到暴力攻擊。（取自陳冠安臉書）年底就要進行地方選舉，國民黨籍台北市議員參選人陳冠安今（16）日表示，今天首度遇到不同意見的民眾對他暴力攻擊，一名婦人一聽到他是國民黨的，就直接拿起手中的扇子打人，並表示「支持台灣獨立」。陳冠安表示，投身競選，在社群、在市場、在社區遇到不同意見很正常，民主社會，自然存在各種意見，他作為參選人，即使立場不同，也應該多聽取選民的表達，這亦是成熟民主的表徵，甚至遇到言語上的人身攻擊，他也都會禮貌對待。請繼續往下閱讀...不過，他說今天首次遇到暴力攻擊，一位老婦人在公園問他是不是國民黨的，他回答「是」以後，老婦就拿手上的扇子攻擊，並表示她支持台灣獨立，然後繼續揮舞扇子，夾帶拍打，後來一旁路人看不下去，幫忙勸阻，老婦人才被她的看護帶走。陳冠安說，他不認同台獨，也遇過不少台獨人士，多數時間都能對話，雖然常常是單方面對他表達意見，無論這位老婦人的立場如何，他都認為這是婦人個人行為。陳冠安表示，沒有因此受傷，而婦人疑似有失智症狀，他也不願報警追究。他強調，一把扇子不可能讓他心生恐懼，依然持續打拚，繼續監督制衡，正如同參選誓言，能戰鬥到底，就會奮戰到底，但社會的對立、想像的仇恨，才是最讓人深感憂心的部分。    ,https://news.ltn.com.tw/news/politics/breakingnews/5438998
藍白表決立院延會至8/31 公督盟轟：不做正事還推彈劾作秀,政治,2026/05/16 13:23,公督盟執行長張宏林今受訪時嚴厲譴責，批評藍白委在日常國會工作上不做正事，反而推動「彈劾總統」只是作秀。（資料照）民眾黨團昨於院會提出修正動議，建請本會期延長開會至今年8月31日，藍白以人數優勢表決通過。對此，公督盟執行長張宏林今受訪時嚴厲譴責，批評藍白委在日常國會工作上不做正事，反而推動「彈劾總統」只是作秀，上會期應完成的去年預算延宕至今仍未實質審查，卻厚臉皮延會，形同毀台三部曲，更質疑延會是為犯罪立委提供「司法保護傘」進行政治掩護。張宏林指出，立委在日常國會工作上不做正事，反而推動「彈劾總統」，怒批只是作秀。另在審議過程中，召委也未積極排審，去年預算至今已到5月中、甚至接近5月下旬，仍未見任何實質進展。照理說延會應是因應重大議題，但目前連半年前、上一個會期應完成的例行工作都未處理，卻還厚著臉皮要延會，形同荒廢立委職權、自己架空自己，甚至癱瘓台灣憲政運作機制。請繼續往下閱讀...張宏林認為，藍白不要再繼續延續從第11屆就開始毀憲亂政，包含提出違憲法案、癱瘓司法，如今又進一步影響行政運作，形成所謂「毀台的三部曲」，導致行政、司法功能失衡，立法院甚至出現自我閹割功效的情況，這樣的發展等同於破壞整體憲政機關運作，形同「毀憲」，呼籲藍白委儘速回到立法院議程，認真審議法案與預算，不要在外面作秀、搗蛋。「嚴重的不是法案延後，而是預算延後。」張宏林表示，今年的預算應該在去年11月底就審議完畢，但目前已延宕至5月，多項預算仍未啟動審查，若依照目前進度，即使延會至8月底，也可能無法如期完成審議，將導致整體行政機關年度預算執行受阻，甚至可能出現預算核定時程被壓縮，只剩不到半年執行期，對國家會造成重大損失。張宏林說，藍白過去曾透露，現在的延會是為了讓部分犯罪立委提供所謂「司法保護傘」，此舉極為惡劣，本質上就是相互護航、替涉案者提供政治掩護。社會對政治人物涉貪是零容忍，如今卻出現以延會名行護航，甚至公開承認相關目的，是非常糟糕的事情。    ,https://news.ltn.com.tw/news/politics/breakingnews/5439011
川普重申對台政策不變 府：賴總統向來主張維護兩岸現狀,政治,2026/05/16 13:16,總統府發言人郭雅慧。（資料照）「川習會」落幕，美國總統川普接受《福斯新聞》專訪時強調，美國對台政策沒有任何改變，盼台海雙方降溫，且「不希望有人搞獨立」。對此，總統府發言人郭雅慧今（16日）回應，一項清楚的事實是，持續貢獻區域和平與穩定，致力維護兩岸現狀，一直是總統賴清德向來的主張，也是熱愛自由民主的2300萬台灣人的不變堅持。中華民國是主權獨立的民主國家，這是不爭的事實，北京無權對台灣有所主張。對於川普接受媒體訪問的相關內容，郭雅慧表示，府方注意到，包括川普及美國國務卿魯比歐在內，美方多次重申對台灣政策的一貫立場沒有改變。我國感謝川普自第一任期以來，對台海安全的持續支持，台灣也將持續與美國深化合作，透過實力帶來和平，確保台海安全穩定不受威脅破壞，這也是台、美與全球民主國家共同利益所在。請繼續往下閱讀...對於外界關注軍購議題，郭雅慧指出，眾所周知，中國持續升高的軍事威脅，才是包括台海在內印太區域間唯一的不安全因素，也是當前第一島鏈周邊各國與美方合作，積極強化防衛的原因，台灣不能也不會例外。而台美間的軍售，不僅是明載於「台灣關係法」中，美國對台灣的安全承諾，更是對區域威脅的共同嚇阻，我國感謝川普長期以來，對台海安全的持續支持，包括持續提供我國精良的各項裝備，規模與金額屢創新高。郭雅慧說，台美合作向來透過行動證明，我國期與美方持續在「台灣關係法」的堅實承諾下，與全球民主友盟持續合作，共同因應威權國家對地緣安全、全球秩序與穩定帶來的風險。    ,https://news.ltn.com.tw/news/politics/breakingnews/5439003
