Title,News_Type,date,content,url
吸毒悲歌！兒受挫反覆染毒驟逝 咖啡媽媽當清潔工還百萬債,社會,2025/09/12 08:40,温媽媽擔心正面曝光丟了工作，背對鏡頭操作烘豆機。（記者陳彩玲攝）〔記者陳彩玲／台北報導〕「想要拉一個吸毒的人真的非常非常辛苦」，温媽媽憶起去年逝世的兒子紅了眼眶，她花十年的時間相伴，仍不敵兒子反覆從毒品尋求慰藉，曾忍不住怒斥「你去死一死」，但她始終沒鬆手放棄，至今靠著清潔工作，以及兒子親傳的烘豆技能，償還孩子開咖啡廳時留下的百萬元貸款，現在一心只想盡快還清債務，將兒子的咖啡手藝，無償傳承給需要的更生人。擔心正面曝光丟了工作的温媽媽，背對鏡頭一邊操作烘豆機，一邊訴說第一次撞見兒子和高中同學在家服用搖頭丸後迷糊的樣子，她被眼前的場景嚇得說不出話，心如刀割，內心不斷吶喊「我的兒子，這輩子沒救了」，但仍於心不忍，選擇給予改過自新的機會。未料，兒子還是被逮到和同學們在飯店開毒趴，因年滿十八歲，具完全責任能力，必須入監服刑。請繼續往下閱讀...兒子在等待入獄期間，很幸運的受貴人引領接觸到咖啡，因天賦異稟，被知名咖啡廠商相中，希望培育為「國際杯測師」，原本自豪地温媽媽突語塞，無奈地說，但社會對毒品很排斥，廠商知道兒子是毒犯紛紛打退堂鼓，直到後來他出監，努力不懈地拜師學藝，才成功開了第一間店「窗口咖啡」。温媽媽說，當時看見兒子的蛻變相當欣慰，也投入咖啡廳給予支持和陪伴，但好景不常，四年後，風雲變色，店裡的合夥人突悄無聲息地離開，兒子獨自扛下店面，想證明自己有能力，私下借了百萬元的高利貸，也向更保協會台北分會求援，暫時緩解燃眉之急，但壞消息接二連三，店面地段碰上都更，兒子只能選擇放棄。當時面臨工作、經濟挫折和難關的温男，又突然接到女友提出分手的噩耗，讓他生活頓時失去重心，再度回頭找上毒品，所幸後來在更保的協助下完成戒治，重新嘗試展開第二間店，但沒多久碰上疫情，導致生意一落千丈，咖啡廳每月虧損十萬餘元，母子二人每天被錢追著跑，壓得喘不過氣。沒想到，温男又被同父異母的親人以咖啡豆商機誆騙到柬埔寨，以十萬元美金把他賣給人蛇集團，在台孤立無援的温媽媽焦急地四處尋求幫助，才將兒子救回國，但經濟困境始終未解，温男也難以走出親人的背叛和挫敗，再度染上毒品，去年心肌梗塞不幸驟逝，留下温媽媽獨自揹債。温媽媽說，毒品施用者的抗壓性低、再犯率高，只要受到挫折就會走回頭路，當時她看兒子再三陷入，也曾氣憤地說「你去死一死」等重話，但心裡沒想過放棄，一直到現在兒子離開了，也沒有半分怨言。「我反而很感謝他，教會我沖咖啡、烘咖啡的技能，讓我有一技之長。以後老了，坐在路邊也能賣咖啡，我會一直做這件事直到沒有力氣」温媽媽紅著雙眼，咽地說，「因為每一杯咖啡都是我對兒子的思念」。隱身在大安區的「窗口咖啡」工作室，温媽媽承諾會將兒子的咖啡手藝傳承給需要的更生人。（記者陳彩玲攝）熱門賽事、球星動態不漏接    ,https://news.ltn.com.tw/news/society/breakingnews/5175354
曾淪毒海 他在亞杜蘭廚房重生：千萬不要放棄自己,社會,2025/09/12 08:30,53歲阿川在更生人機構「亞杜蘭廚房」走出新人生，分享從墮落到重生的歷程。（記者楊心慧攝）〔記者楊心慧／台北報導〕「以前每天都在害怕，怕沒錢、怕沒毒、怕被抓。現在才知道什麼是真正的自由。」曾因毒品失去家庭、令父親失望至極的53歲阿川，如今在更生人機構「亞杜蘭廚房」走出新人生，分享從墮落到重生的歷程，盼透過藉自身例子，讓大家相信真的有可能戒毒重生，千萬不要放棄自己。阿川小時候生活在林森北路一帶，環境混亂，國小五、六年級就因打架、恐嚇惹上案件，父母婚姻不睦，讓他走上叛逆之路，15歲便出入少觀所，人生提早與監獄掛鉤。請繼續往下閱讀...談起接觸毒品，阿川直言在朋友的驅使下，第一次吸食安非他命，沒想到卻逐漸被毒品控制，甚至成為無法擺脫的枷鎖；原本的家庭也因吸食毒品而摧毀，妻子決定離婚並帶著小孩離開，但真正讓他意識到被毒品毀掉的，卻是父親病榻的場景。阿川憶起當年的場景，眼光泛紅地說，當時80多歲的父親罹癌，需要他陪同化療，他卻屢以「買早餐」為由跑去買毒，甚至讓父親獨自前往醫院，最後父親失望地說：「你忙你的吧！不用陪我。」那一刻，他看見至親徹底絕望的眼神，心裡滿是羞恥與自責。「那時候我真的覺得自己沒救了」阿川回憶，他一度打算吸食過量毒品，耗盡生命，卻還是活了下來，後來有基督徒親友牽線，他進入亞杜蘭機構，重新面對自己。阿川坦言：「以前戒過很多次都失敗，但在『亞杜蘭廚房』卻不同，有團體生活、每天讀聖經、禱告，彼此互相支持，才真的戒掉。」自2017年至今，阿川已完全斷絕毒品、菸酒，他很感謝亞杜蘭廚房，除提供信仰支持，也結合政府資源，助學員考取技能證照，協助重返社會。戒毒過程中，最令阿川感動的是父親態度的轉變，「以前父親在醫院都不敢介紹我，怕丟臉。後來卻驕傲地對醫生、病友說：『這是我兒子，目前在亞杜蘭廚房幫忙，也助人戒毒重生。』讓我很感動，也讓我更堅持下去。」阿川現階段透過陪伴新進個案、上技能課程，體會到工作的意義。「看到家屬因為我們的陪伴而安心，覺得這份工作很有價值。」阿川說，原以為台灣更生保護會沒在做事，加入亞杜蘭廚房後，才發現更保協會其實做了很多事，幫助許多更生人重生。阿川希望社會放下標籤，給更生人機會。「吸毒的人不是沒救，只是需要時間和環境改變。但很多弟兄出機構後找不到工作，只能進工地，環境又讓他們跌倒，但戒毒真的不是不可能，千萬不要放棄自己！」如今的阿川，形容生命最大的改變就是真正的自由，終於不再擔心害怕，能自在過日子才是真正的快樂。53歲阿川在更生人機構「亞杜蘭廚房」走出新人生，分享從墮落到重生的歷程。（記者楊心慧攝）熱門賽事、球星動態不漏接    ,https://news.ltn.com.tw/news/society/breakingnews/5175419
不滿盆栽被移動！男子嗆輸贏還「問候」鄰居老母 判拘還要賠3萬3,社會,2025/09/12 08:23,范男吃上恐嚇罪、公然侮辱罪，被苗栗地院判處拘役50日及罰金3000元，還得賠償鄰居3萬3千元的精神慰撫金。（資料照）〔記者彭健禮／苗栗報導〕苗栗縣范姓男子不滿住家前盆栽被移動與鄰居爆發爭執，他嗆對方拿菜刀出來輸贏「要死大家一起死」，並多次以國罵「問候」鄰居的媽媽。鄰居報警提告，范男吃上恐嚇罪、公然侮辱罪，被判處拘役50日及罰金3000元，還得賠償鄰居3萬3千元的精神慰撫金。范男與鄰居2人因門口盆栽擺放位置問題早有嫌隙。范男於2023年3月6日晚間6點許，不滿鄰居又移動他擺放之花盆位置，雙方發生口角。范男嗆鄰居「菜刀拿出來」、「要死大家一起死」等語，並在門前道路旁，多次以國罵「問候」鄰居的媽媽。請繼續往下閱讀...鄰居報警提告，范男被苗栗地方法院依犯恐嚇危害安全罪，處拘役50日，又犯公然侮辱罪，處罰金3000元。鄰居不甘於大街公共場所受辱，另提民事侵權行為損害賠償告訴，向范男求償10萬元。范男則辯，鄰居說話也不好聽，才口出穢言反擊，屬情緒性回應，無意羞辱或威脅。但法官認為，范男多次口出輕蔑、歧視對方人格之詞語，難認屬情急時偶發單純一、兩句之通俗發語詞或問候語，侵害鄰居名譽權。法官審酌雙方身分、地位、經濟狀況，及爭執起因、情節等情狀，認鄰居請求之精神慰撫金以3萬3千元為適當，逾此部分，不應准許。全案可上訴。熱門賽事、球星動態不漏接    ,https://news.ltn.com.tw/news/society/breakingnews/5175428
按喇叭引爆口角 怒路駕駛下車嗆「輸贏」卻獲無罪,社會,2025/09/12 07:16,蔡男因喇叭爭執嗆聲「鋁棒輸贏」，陳男反嗆「來啊」並錄影。法院認無畏懼情狀，證據不足，依罪疑唯輕判蔡男無罪。示意圖（資料照）〔記者王捷／台南報導〕「來啊！」一句回嗆成了判斷恐嚇是否成立的核心。台南地方法院審理一起鳴喇叭爭執案，蔡姓駕駛被控斜插車道並嗆聲要拿鋁棒輸贏，但法院認為陳姓騎士當場反嗆「來啊」，妻子也邊錄影邊指責，過程毫無畏懼，因此判決蔡男無罪。去年2月27日晚間，新營區新進路與復興路口，蔡男駕駛自小客車與陳姓騎士爆發口角。檢方主張，蔡男因不滿遭鳴喇叭，故意將車輛斜插停在機車前，下車後脫口「我車上有球棒」、「林北一支鋁棒跟你輸贏」，並作勢返車取物，涉嫌妨害自由與恐嚇。請繼續往下閱讀...蔡男則辯稱，當時只是要與對方理論，馬路寬敞，陳姓騎士完全可以繞道離開，他並未限制行動自由；至於嗆聲鋁棒一事，只是情緒性言語，陳男的太太還能自在錄影、毫無畏懼，可見並未造成真正威脅。從錄影畫面得知，陳男的太太聽到蔡男有鋁棒以後，也反問蔡男停在機車道講話還這麼大聲，蔡男則說自己家就在這邊，雙方一來一往，直到警方到場，陳男才抱著孩子去警所。南院勘驗監視器畫面後認為，陳姓騎士早已先停車，並非因被攔停而被迫停下，且道路空間仍能繞行，不構成妨害自由；而錄影內容顯示，陳姓騎士立刻回嗆「來啊」，妻子冷靜錄影並堅持等警方處理，未見退縮畏懼，因此不符恐嚇罪「心生畏懼」要件，因此判處無罪。熱門賽事、球星動態不漏接    ,https://news.ltn.com.tw/news/society/breakingnews/5175361
渣男只要性拒當情侶 女持刀傷人「情堪憫恕」改免囚,社會,2025/09/12 07:12,吳女因感情糾紛，涉嫌刺傷親密黃男，被高雄高分院從輕發落。（記者鮑建信攝）〔記者鮑建信／高雄報導〕高市吳姓女子不滿黃姓男子只想做愛，卻拒絕當情侶，涉嫌持刀砍殺他成傷，被依殺人未遂罪判刑3年2月，高等法院高雄分院則改依重傷害未遂罪判刑2年，並審酌她獲得諒解及符合「情堪憫恕」，宣告緩刑5年。據了解，2022年1月21日，黃男與被告吳女相約到摩鐵，發生親密關係後，因長期對她言語恐嚇、侮辱，且只想發生性行為，卻不願交往成為情侶關係，因而引發吳女不滿，加上黃男出現異常電話，憤而涉嫌持水果刀攻擊，導致他頸部等多處受傷。請繼續往下閱讀...黃男受創後，往旅館大廳逃跑，經店員報警處理，始免於難。高雄地院依殺人未遂罪，判處吳女有期徒刑3年2月，她不服上訴。高雄高分院調查，吳女長期渴望與黃男成為情侶被拒，但對方僅願與其發生性行為，甚至多次羞辱她，最終因累積的怨恨無法發洩，及不滿感情被玩弄憤而行兇，依情堪憫恕減輕其刑。此外，吳女沒有殺人犯意，改重傷害未遂罪論處，並審酌獲得黃男諒解，從輕量處有期徒刑2年，予以緩刑5年，期間付保護管束，及提供60小時義務勞務，仍可上訴。熱門賽事、球星動態不漏接    ,https://news.ltn.com.tw/news/society/breakingnews/5175392
拚了！不甘家人遭詐400萬 女子趴引擎蓋攔阻車手 體力不支跌落,社會,2025/09/12 06:35,女子趴在車手轎車的引擎蓋上，歹徒狂奔近1公里，女子體力不支跌落。（擷取自「記者爆料網」）首次上稿 09-11 23:45更新時間 09-12 06:35〔記者許國楨／台中報導〕台中市太平區街頭11日晚間上演驚悚一幕，一名女子為阻攔詐騙車手，整個人趴在疾駛的轎車引擎蓋上，歹徒狂飆近1公里，女子最後體力不支跌落，所幸僅手腳擦挫傷，警方緊急發動攔截圍捕，20分鐘內逮到車手。請繼續往下閱讀...經查，61歲邱姓婦人日前誤信詐騙集團投資虛擬貨幣的話術，三度面交後慘噴逾400萬元，直到家人察覺異狀，才驚覺落入陷阱，氣憤難平的邱婦與一對兒女密謀「以牙還牙」，假意再投資40萬元，引誘車手現身，準備給對方一點教訓。昨天（11日）傍晚6時許，雙方約在太平區中山路邊碰頭，未料37歲車手吳男發現不對勁，立刻跳上車猛踩油門逃逸，邱婦的30多歲女兒騎機車緊追，眼見車手欲脫逃，竟不顧安危猛撲上車子引擎蓋，轎車在市區疾馳，邱婦的女兒整個人緊抓擋風玻璃前緣，沿路嚇壞目擊民眾。而邱婦的兒子也奮力騎機車追趕，卻仍追不上飛馳的轎車，眼看姊姊被載著高速前進，家屬心急如焚，約1公里後，邱婦女兒因體力不支滑落地面，幸好僅手腳多處擦傷，送醫後並無生命危險。家屬急報警，太平分局隨即動員線上警力展開攔截圍捕，約20分鐘後在大源十八街將吳男攔下，警方隨車搜出7顆含依托咪酯的煙彈及0.25公克安非他命，全案漏夜偵辦中，將依詐欺、毒品、肇事逃逸及公共危險等罪嫌究辦。警方緝獲車手。（民眾提供）熱門賽事、球星動態不漏接    ,https://news.ltn.com.tw/news/society/breakingnews/5175342
捲入中科院鵬園院區標案洩密案 達運光電董事長、女協理聲押,社會,2025/09/12 06:13,達運光電董事長陳碧霜涉入中科院鵬園院區招標資料洩密案。（資料照）首次上稿 00:48更新時間 06:13〔記者余瑞仁／桃園報導〕中山科學研究院資訊通訊研究所林姓技術師涉嫌不當取得並外洩「鵬園院區（屏東九鵬基地）智慧型監控指管系統網電基礎工程」標案資料案，桃園地檢署2日聲請羈押獲准。事涉國防機密，檢方指揮調查局國安站追出，承接多項政府與軍方專案寬頻業務的上市公司達運光電涉案，10日搜索、約談董事長陳碧霜與陳姓女協理，2人11日移送，檢察官訊後向桃園地院聲請羈押禁見陳碧霜，陳姓女協理也於今（12）日凌晨訊後聲請羈押禁見。請繼續往下閱讀...檢方說，檢察官經訊問認為達運光電董事長陳碧霜（女、68歲）、陳姓協理（女、56歲）共同涉犯刑法第132條第3項非公務員洩漏國防以外秘密、同法第342條第2項、第1項背信未遂等罪嫌，罪嫌重大，有勾串共犯、證人及滅證之虞，均當庭逮捕，並向桃園地方法院聲請羈押禁見。中山科學研究院被爆出內部人員洩漏「鵬園院區智慧型監控指管系統網電基礎工程」標案資料，桃園地檢署獲報指揮新北憲兵隊，2日晚間拘提涉案的資訊通訊研究所林姓技術師到案，複訊後向法院聲請羈押獲准；檢方指揮調查局國安站深入追查，蒐證比對分析相關事證，10日持法院核發的搜索票，搜索達運光電公司及陳碧霜、陳姓協理等人住所、辦公室等相關處所共8處，約談2人到案，昨天移送檢察官複訊。桃園地檢署聲押達運光電董事長陳碧霜。（記者余瑞仁攝）熱門賽事、球星動態不漏接    ,https://news.ltn.com.tw/news/society/breakingnews/5175352
嫩模接拍險淪A片女 躲藥妝店報警,社會,2025/09/12 05:30,"20歲女模特兒樂樂曝光「誘騙攝影」過程，提醒相關工作者提高警覺。（樂樂提供）攝影師誤傳訊息「拍Ａ片的事先不要告訴她」〔記者吳柏軒、邱俊福／台北報導〕當心攝影陷阱！廿歲女模特兒「樂樂」在網上披露驚險逃生經歷，她日前與攝影師約在旅館，進行服飾品牌拍攝，前晚剛到旅館門口，竟收到對方誤傳訊息「樂樂來了…要她拍Ａ片的事先不要告訴她」，樂樂驚覺自己差點淪為Ａ片演員，當下躲到藥妝店報警。她表示，房間內應有男優，恐遭硬上或軟磨方式逼自己拍片；記者傳訊被指涉的攝影師IG帳號，至截稿前無回應。請繼續往下閱讀...李女保留法律追訴 警持續了解據了解，轄區台北市警中山分局大直派出所接獲報案時派員趕抵，得知李女（樂樂）進房前得知實情，未進入旅館即離去，未有遭性侵情事，遂當場告知李女是否提告等相關權益，李女表達將保留法律追訴權，暫不提告；警方將持續連繫當事人進行了解，若疑有犯罪行為將偵辦。樂樂表示，最初是友人透過別的女模特兒IG（社交軟體）看到攝影師「YUNGFAKER容××」徵服飾品牌模特兒拍照，有五萬元薪水，經聯繫工作內容、約定好衣服與拍照尺度皆在安全範圍，當晚到達旅館通知對方，結果竟然收到對方誤傳的訊息「樂樂來了，叫Hans下去接她。要她拍Ａ片的事先不要告訴她」，她驚覺不對勁，傳訊質問對方並躲到藥妝店報警。事後樂樂回想，聯繫過程中有別的女模特兒傳訊說認識該攝影師，亦有疑似集團成員用「外流影片」謊言，希望自己拍Ａ片才願協助處理；約拍當天，該攝影師也稱前一組工作是粉絲很多的網紅，自己因而相信對方正常，但恐怕一切都是精心騙局，各種人物設定及交流，都鎖定自己，最終目的是逼拍色情片，她懷疑此事背後有集團操作，並疑有外國人成員故意來亞洲拍片，再把影片拿到國外賣，提醒從事相關工作的女孩要當心留意。樂樂將過程貼到臉書及Threds（脆）上，引發廣大網友關注，迄昨脆的貼文吸引七十六萬次瀏覽與上千留言，其中不乏其他模特兒透露，曾與該攝影師接觸，被要求拍攝大尺度，但故意不匯訂金與放鳥，或對方一聽到模特兒攜伴，就放棄等詭異行徑。不過也有人提醒，應是另一名攝影師「yungfaker」被變態盜用照片，疑似假冒身分機率較大。攝影公司yungfaker昨也在IG發布聲明，近期發現不明人士冒用該公司名義，進行不法詐騙行為，呼籲外界勿輕信任何假帳號。熱門賽事、球星動態不漏接    ",https://news.ltn.com.tw/news/society/paper/1723838
司院通過刑訴等法修正草案／增被害人參與、擴大羈押範圍,社會,2025/09/12 05:30,司法院昨召開院會，通過刑事訴訟法與刑事訴訟法施行法修正草案。（資料照）〔記者楊心慧／台北報導〕憲法法庭去年做出「憲判字第八號」判決，要求更保障人民的生命權、被告的辯護權，以及訴訟中應有的正當法律程序。司法院昨召開院會，通過刑事訴訟法與刑事訴訟法施行法修正草案，包含死刑相關案件要強制律師到場、被害人有更多參與權利、預防性羈押範圍擴大等，近日送行政院會銜後，再送立法院審議。依據一一三年憲判字第八號釋憲意旨，憲法法庭認為故意殺人的態樣廣泛複雜，在立法層面有進一步區別可能，建議有關機關定期檢討是否及如何區別行為樣態，從而限縮死刑的適用範圍，或另訂適當的替代刑罰，例如提高假釋門檻的特殊無期徒刑、更長期的有期徒刑等，以取代死刑。請繼續往下閱讀...刑訴法及刑訴施行法修正草案重點包含，若被告涉殺人或類似重大罪行可能判死刑，且有人死亡，偵查階段須通知法律扶助律師到場辯護；若案件上訴後涉及死刑，最高法院審理要有律師辯護，且須開庭言詞辯論，不能只用書面審理，並授權最高法院訂定相關辯論規則。另外，增訂訴訟參與人及其代理人於科刑資料調查時，可提出被害影響陳述，並就科刑範圍事項，請求詢問被告。針對社會安全需求，增修預防性羈押適用範圍規定，針對新型犯罪（例如兒少性剝削、詐欺犯罪）修正羈押規定，讓法院在特定情況下，可更早限制犯罪嫌疑人自由，以保護社會安全。為保障當事人訴訟權益，並促進訴訟經濟及實踐有效率之刑事審判，修正證據調查程序規定，擴大可由一名法官獨自審理的案件範圍（不用動輒三人合議），以合理分配司法資源，加快審判速度。熱門賽事、球星動態不漏接    ,https://news.ltn.com.tw/news/society/paper/1723841
防攝狼 可下載視訊報案APP 一鍵撥通,社會,2025/09/12 05:30,婦女團體建議提高警覺，並可下載「110視訊報案」APP，可在緊急時刻報案。（圖取自Google play）〔記者吳柏軒／台北報導〕一名女模接服裝拍攝，驚覺自己差點被逼拍Ａ片。勵馨基金會執行長王玥好指出，個人外拍工作，一定要事前簽訂工作契約，最好不要單獨赴約，尤其面對完全陌生的人與環境，可事先將行蹤透露給親友，約定一段時間沒動靜就要前往確認，同時，手機也要設定一鍵撥通功能，可撥打報案電話即時求救，也要自己帶飲料，避免被下藥。女嫫「樂樂」稱，有人提及她有「外流照」，但根本無外流；王玥好對此表示，不要輕信對方，這些都是不肖業者慣用手法，一開始藉此先誘拍泳裝照，到後面可能是裸照，並抓住被害人的恐懼害怕，逼其去做更不堪的事，提醒接到威脅別輕易相信，立刻報警，以及現今AI技術，也恐有DeepFake造假私密影像，即使真有外流影像，也可求助「iWIN網路內容防護機構」即時下架。請繼續往下閱讀...現代婦女基金會性暴力防治組督導張妙如表示，過去確有被害人接受攝影師邀約拍攝時，遭遇性騷擾甚至性侵害，建議不管熟不熟識，外拍、旅拍赴約都要有心理防範，並事前白紙黑字簽定工作契約，過去曾遇過被害人赴約後對方不給費用還性侵，並誤導成性交易糾紛等情。性侵前3名地點 兩方住所及旅館「性侵害發生前三名地點，加害人住所、被害人住所及旅館飯店」張妙如強調，隱密性高的工作場合，警覺性要提高，並制定安全計畫策略，如攜伴、告知親友、不食用對方準備的餐飲，以及提前安排計程車等交通工具，拍攝工作期間要留意手機位置，遇到狀況可立即報警，建議下載警政系統的視訊報案APP。熱門賽事、球星動態不漏接    ,https://news.ltn.com.tw/news/society/paper/1723839
中科院鵬園院區標案外洩 搜索達運光電 董事長聲押,社會,2025/09/12 05:30,上市公司達運光電涉中科院鵬園院區標案外洩，董事長陳碧霜複訊後，檢方聲押。（資料照）〔記者余瑞仁、王憶紅／綜合報導〕承接多項政府與軍方專案寬頻採購案的上市公司達運光電，前天遭桃園地檢署指揮調查局國安站人員搜索，並約談董事長陳碧霜與陳姓主管，昨將二人移送複訊，檢方認定陳碧霜涉案重大，聲請羈押。據了解，該公司疑涉不當取得中山科學研究院資訊通訊研究所林姓技術師外洩的「鵬園院區（屏東九鵬基地）智慧型監控指管系統網電基礎工程」標案資料。中科院被爆出內部人員洩露標案資料，桃檢先是在本月二日指揮新北憲兵隊，拘提林男到案，訊後認定涉案重大，向桃園地院聲請羈押獲准。請繼續往下閱讀...事涉國安 達運光電：配合追查由於案情事涉國安，檢方指揮調查局國安站深入追查，發現林男洩露標案資料的廠商為達運光電，十日前往該公司位於新北市五股區的研發單位搜索，同時帶回陳碧霜與陳姓主管訊問，釐清是否涉及不當取得中科院標案資料等情。另市場傳出，有四名達運光電人員被以被告及證人身分約談。達運光電表示，全力配合檢調追查，營運財務一切正常，對財務業務無重大影響。不過受到偵辦衝擊，達運光電昨天開低走低，午盤過後打入跌停一○五元，並一路鎖到尾盤，成交量達二五○四張。達運光電成立於一九九二年，去年十二月掛牌上市，董事長陳碧霜與總經理戴國源是夫妻，陳負責業務，戴負責技術研發，主要業務寬頻傳輸產品打入北美市場，並進軍東南亞有線電視，智聯網產品則切入軍工產業，獲海巡、國防等部門採購。熱門賽事、球星動態不漏接    ,https://news.ltn.com.tw/news/society/paper/1723790
