Title,News_Type,date,content,url
世足輸球抓狂？智利男美式餐廳喝茫暴走 咆哮店員砸酒杯,社會,2026/06/17 15:33,第一分局公益所副所長梁浩衛今說明案情。（警方提供）台中市西區一間美式餐廳16日上演離譜失控戲碼，一名智利籍男子飲酒後突然對店員大聲咆哮，甚至情緒失控將桌上酒杯掃落砸毀，嚇壞現場顧客，警方趕抵時男子仍情緒激動、不聽勸阻，最後遭保護管束帶回派出所，雖然店家暫不提告，警方仍依社會秩序維護法裁處開罰，網友猜測「該不會是看世足輸球太激動」、「難道押錯隊伍輸到崩潰？」這起事件發生在16日晚間6時48分許，據了解，該名智利籍男子當時獨自在店內用餐，期間陸續飲用了數杯啤酒，未料酒意上頭後，疑因細故與店員發生口角，情緒越來越激動，不僅提高音量怒吼，還將桌上酒杯掃落地面，造成玻璃碎裂四散。請繼續往下閱讀...突如其來脫序舉動讓店員及其他用餐民眾受到驚嚇，店家擔心情勢失控，立即報警求助，第一分局迅速到場處理，發現男子酒氣濃厚、情緒亢奮，經多次耐心勸說，希望他冷靜下來，但男子始終不願配合。由於男子持續喧鬧並影響現場秩序，警方隨即依警察職權行使法，對其實施保護管束並帶返派出所安置，男子返回派出所後酒意逐漸消退，情緒也恢復平穩，但對於自己為何突然失控、與店員發生爭執原因卻三緘其口。由於店家對於酒杯遭砸毀一事暫不提出毀損告訴，但男子在公眾得出入場所喧鬧滋事的行為，已違反社會秩序維護法規定，警方仍將依法裁處，可處一萬元以下罰鍰；網友笑稱「該不會是看世足輸球太激動」、「難道押錯隊伍輸到崩潰？」不過實際失控原因，恐怕只有當事人最清楚。    ,https://news.ltn.com.tw/news/society/breakingnews/5475268
防暴力妨害執業、嚴懲涉詐律師 法務部預告修「律師法」,社會,2026/06/17 15:27,法務部常務次長馮成。（記者陳逸寬攝）近年律師執行職務時遭受暴力威脅事件頻傳，立法院司法及法制委員會今併案審查律師法修正草案，多名立委主張增訂妨害律師執業罪，強化對執業安全的保障；法務部回應，已參考醫療法相關規範擬具修法草案，目前正辦理預告程序至7月20日。此次朝野立委均提出修法版本，其中國民黨立委翁曉玲提案增訂律師法第35條之1，明定任何人以強暴、脅迫、恐嚇或其他非法方法妨害律師執行職務者，處3年以下有期徒刑，得併科30萬元以下罰金；若因而致律師死亡，最重可處無期徒刑，致重傷者則處3年以上、10年以下有期徒刑。請繼續往下閱讀...法務部次長馮成表示，律師依法執行職務，是協助人民落實憲法保障訴訟權的重要一環，對於律師遭受暴力攻擊事件，法務部高度重視，因此參考醫療人員執業安全保障制度，研擬律師法修正草案，目前已進入預告程序。不過，馮成也指出，各版本草案仍有部分內容值得進一步討論。例如部分條文未限於律師接受委任執行職務的情形，規範範圍是否過廣、是否超出保障司法權行使目的，仍有檢討空間。此外，部分提案對傷害律師行為所設刑度，甚至高於現行刑法傷害罪，死亡結果的法定刑亦與故意殺人罪相近，是否符合罪刑相當原則，也有待審慎評估。除執業安全議題外，立委也關注近年屢傳律師涉入詐騙集團、洗錢等案件。多名立委認為，少數不肖律師不僅參與犯罪，甚至替詐團提供法律意見、協助規避查緝，已嚴重損害律師專業形象，應透過修法加重懲處。馮成強調，社會無法接受律師與詐團勾結，律師界本身也普遍支持嚴懲害群之馬，法務部此次修法方向之一，即是調整現行律師懲戒及除名門檻。現行律師法列舉特定貪污、詐欺、侵占、背信等犯罪作為規範對象，可能造成部分重大犯罪未被完整涵蓋，因此修法擬刪除列舉方式，改以「最重本刑5年以上有期徒刑之罪」作為標準，使洗錢、組織犯罪等重大不法行為均能納入規範範圍。    ,https://news.ltn.com.tw/news/society/breakingnews/5475278
兩岸婚促會長鍾錦明涉反滲透法求刑8年半 法院裁定延長境管8月,社會,2026/06/17 15:14,中華兩岸婚姻協調促進會會長鍾錦明。（資料照）前民眾黨新住民委員會主委、且曾列不分區立委名單的中配徐春鶯，涉反滲透法等罪嫌，全案上週辯結，新北地院裁定徐200萬元交保並限制住居、出境、出海及實施電子腳鐐及手機回報科技監控；本案共犯中華兩岸婚姻協調促進會會長鍾錦明、徐的女兒卜啓正、集智顧問負責人羅穎，並未被收押，但有限制出境出海，由於期限將屆滿，合議庭詢問檢辯雙方意見後裁定3人自7月25日起延長限制出境、出海8個月。裁定書指出，3人在去年11月25日起，限制出境、出海8月，由於即將屆滿，合議庭審核卷內相關事證，並訊問3人，認鍾錦明涉反滲透法、卜啓正及羅穎涉犯刑法行使業務上登載不實文書、三人以上共同詐欺取財等罪，嫌疑重大，考量檢方對3人求處重刑，若成立犯罪，自難期待3人有面對刑責之心，且鍾、羅2人與中國人民關係交好、卜啓正之前於海外就學，3人均有海外置產的經濟能力及境外生活能力，有相當理由足認有逃亡之虞，為確保日後審理及執行程序順利進行等一切情狀，認有限制出境、出海必要。請繼續往下閱讀...至於鍾錦明及其辯護人主張，鍾從偵查迄今均有準時到庭，且有固定居所，無逃亡之可能等；卜主張，家中有93歲外公、89歲外婆，且外婆身體狀況不佳，需要照顧2人；羅穎主張，已坦承犯行，家人、小孩、員工都在台灣，且工作上須前往新加坡、香港；合議庭綜合上情，尚無法排除3人逃亡出境致有礙我國司法權有效行使可能，且無較小侵害手段可替代，其等主張亦與是否延長限制出境、出海要件無涉。檢方上週言詞辯論時，對徐涉反滲透法、銀行法、刑法加重詐欺及偽造文書等，求刑總計21年6月、併科罰金2300百萬元，鍾錦明涉反滲透法2罪總計求刑8年6月、併科罰金9百萬元。卜啓正涉詐貸求刑2年6月，羅穎涉詐貸及以偽造文書方式助民革上海市委祖統會副主任孫憲，假商務之名來台，求刑合計4年10月。    ,https://news.ltn.com.tw/news/society/breakingnews/5475255
搶超商稱精神障礙 「還跟店長比讚」法官認具辨識能力,社會,2026/06/17 15:10,許男行搶辯稱患有精神障礙及心智缺陷。（警方提供）去年8月，鹿港鎮發生一起超商強盜案。吳姓男子騎車載送許姓男子前往超商行搶，許男下車後持長棍與水果刀威嚇櫃台人員，吳男則在門口把風接應。兩人得手現金9萬6100元及6包香菸後逃逸，警方於20分鐘內火速逮捕兩人。法院審理時，許男辯稱患有精神障礙及心智缺陷，請求進行精神鑑定。鑑定報告指出，被告雖因精神障礙，致其辨識行為違法之能力降低，但法官發現許男行搶時能與店員互動，甚至對店長比「讚」，顯見並未達「不能辨識行為違法」之程度，因此判處許男有期徒刑7年4月，吳男有期徒刑7年，全案可上訴。請繼續往下閱讀...案發監視器畫面顯示，許男持水果刀進入超商後大肆搜括，店員惟恐發生意外，任由其取走9萬6000元現金與6包香菸。許男離開前，還對店長比出「讚」的手勢。該案審理時，許男辯稱，自己犯案前，曾因幻聽、幻覺等症狀住院治療，要求院方做精神鑑定。然而，醫院鑑定指出，許男雖疑似患有思覺失調症與反社會人格且有幻覺妄想表現，但鑑定過程中疑有「詐病」傾向，且案發時的精神狀態並未影響其犯意。法官勘驗影像後認為，許男當時能清楚對店長說「老闆，你很好」並比讚，顯見其具備辨識能力。法院審酌許男為累犯，判處7年4月，並諭知刑後監護2年（得以保護管束代之）；吳男因參與程度較輕，判處7年徒刑。    ,https://news.ltn.com.tw/news/society/breakingnews/5475246
鐵警攜手水墨大師陳士侯打詐 「鍾馗斬詐扇」全台5處限量發送,社會,2026/06/17 15:08,斬詐扇、香包全台5處同步配發。（記者劉慶侯翻攝）鐵路警察局刑事警察大隊，今（17）日於台北車站舉辦「端陽蒲劍，鍾馗斬詐」識詐宣導會。知名水墨畫家陳士侯大師公益授權鍾馗畫作，以此製作端午限定「鍾馗斬詐扇」500把及「平安香包」570個，全台5處同步配發給民眾。鐵警局刑警大隊表示，此次宣導品融入165打詐儀表板QRCode，民眾掃碼即可即時掌握最新詐騙案類排行與防詐資訊。請繼續往下閱讀...鐵警局表示，根據165打詐儀表板即時統計，當前高發詐騙手法包括假投資、假交友、假檢警、網路購物詐騙等，不法集團手法持續翻新，民眾財產損失屢創新高，其中假投資詐騙財損長期高居榜首，嚴重侵害民眾財產安全。大隊長黃仲玟幽默提醒：「現實生活中，沒有陌生人會主動帶你發財；網路上熱心教你投資的，十之八九是詐騙集團的劇本！」並呼籲民眾保持理性，遇詐立即撥打165。鐵警表示，不輕信：網路上主動接觸的投資機會。不匯款：任何理由要求轉帳前先查證。不遲疑：立即撥打165或110。鐵警攜手水墨大師陳士侯端午打詐宣導出擊。（記者劉慶侯攝）斬詐扇、香包全台5處同步配發。（記者劉慶侯翻攝）    ,https://news.ltn.com.tw/news/society/breakingnews/5475239
竹市府結合警方、計程車駕駛 防詐升級,社會,2026/06/17 15:06,竹市百輛防詐計程車上路，啟動移動式防詐宣導平臺。（記者蔡彰盛攝）為強化全民防詐意識，讓防詐資訊深入市民日常生活，新竹市政府今舉辦「移動防詐網 安全感隨行」反詐誓師活動，由市長高虹安主持，結合新竹市警察局、交通義勇警察大隊、計程車商業同業公會及計程車駕駛員職業工會等單位共同宣誓，宣告新竹市防詐行動全面升級。市府期盼透過公私協力，打造更綿密的防詐守護網絡，守護市民財產安全。高虹安表示，詐騙犯罪已成為全民共同面對的重要課題，近年來假投資、假檢警、假網購，以及利用AI深偽技術進行的新型態詐騙手法層出不窮，民眾只要稍有不慎，就可能蒙受重大財產損失。市府除持續強化查緝打擊及攔阻詐騙能量外，也積極推動多元創新的宣導方式，期盼透過多元宣導管道，提升全民識詐、防詐能力，攜手打造更安全、更有韌性的防詐城市。請繼續往下閱讀...她指出，此次反詐宣導行動結合交通義勇警察大隊、計程車駕駛及相關公會共同響應，運用計程車穿梭城市大街小巷的特性，將防詐資訊融入市民日常生活。今天有105輛計程車參與響應，車身張貼反詐宣導圖卡，化身行動反詐宣傳車，並透過車內後座螢幕播放反詐宣導影片，讓乘客在搭車過程中也能接收最新防詐資訊。市府期盼藉由公私協力推動全民防詐網絡，讓反詐資訊深入新竹市各個角落，提升市民識詐、防詐能力，共同守護財產安全。警察局長陳源輝表示，為擴大防詐宣導觸及範圍，警察局此次攜手計程車業者推動「移動式防詐宣導平臺」，看中計程車具備高機動性、廣泛接觸民眾及深入社區巷弄的特性。透過車身張貼防詐標語、車內放置識詐宣導圖卡等方式，讓每一輛計程車化身穿梭城市的行動宣導站，將識詐觀念傳遞至社區鄰里及市民生活圈，擴大宣導觸及範圍，共同築起守護財產安全的防線。警察局表示，活動現場集結超過百輛張貼防詐宣導標語的計程車整齊列隊，氣勢磅礡，成為全場矚目焦點。啟動儀式後防詐車隊隨即鳴笛啟程，兵分三路巡行本市主要道路，象徵防詐能量全面深入城市各個角落，將識詐、防詐觀念傳遞至更多市民身邊。警察局提醒，近期常見詐騙手法仍以假投資、假交友（投資詐財）、假網購及假檢警等類型為主，詐騙集團不斷翻新話術，甚至結合AI深偽技術提高欺騙性，民眾務必提高警覺。若接獲可疑來電、簡訊或網路訊息，應謹記「1聽、2掛、3查證」原則，冷靜查證資訊真偽，切勿依指示操作ATM、匯款或提供個人資料。如有疑慮，可立即撥打165反詐騙諮詢專線或110報案專線尋求協助，共同防範詐騙，守護自身財產安全。    ,https://news.ltn.com.tw/news/society/breakingnews/5475244
新北列大雨警戒區 災變中心緊急淨空水域、籲用路人留意行車安全,社會,2026/06/17 14:59,新北列大雨警戒區，新北市政府災害應變中心通報水域遊客上岸，呼籲用路人雨天留意行車安全。（記者吳仁捷翻攝）中央氣象署今天下午2時20分起，針對新北市等多個縣市發出大雨特報，全新北市山區、平地與北海岸都列入警戒區，板橋、三峽、淡水等地都列入警戒區，陸續下起大雨，新北市政府災害應變中心針對山區溪流發出暴雨溪水暴漲警示，留意溪水暴漲並儘速通知遊客遠離溪流，新北市災害應變中心、消防局也加強於烏來南、北勢溪、三峽大豹溪、坪林等區防溺機巡，結合各地防溺救難團體，提前警告遊客上岸。新北市消防局表示，今天下午午後對流雲系發展旺盛，中央氣象署研判易有短延時強降雨，今天下午2時20分起，針對新北在內，新竹以北地區及苗栗、中部、宜蘭、花蓮、高雄山區有局部大雨發生的機率，請注意雷擊及強陣風，山區請慎防坍方及落石，低窪地區請慎防積水。請繼續往下閱讀...消防單位說，大雨特報後，各地大雨不斷，除針對山區暴雨溪水暴漲警示，通報原本暑期已在三峽大豹溪、烏來、坪林等水域防溺的消防員、駐點救難團體，呼籲遊客及時上岸，另也呼籲低窪地區民眾加強防範積水，用路人避免輾壓標線或積水打滑。    ,https://news.ltn.com.tw/news/society/breakingnews/5475226
北市中山女高驚傳電梯失速下墜 1女學生受困頭痛送醫,社會,2026/06/17 14:52,台北市中山女高今天清晨發生一起電梯驚魂記。（資料照）台北市中山女高今天清晨發生一起電梯驚魂記，上午7時1分左右，幾名女學生從7樓搭乘電梯時，設備疑似突發故障而失速下墜，警消接獲校方通報後火速趕往現場，抵達時受困人員皆已自行脫困，其中1名女學生因頭痛與肢體不適，在老師陪同下送往台安醫院檢查，所幸無外傷且意識清醒。北市消防局當時接獲有人員受困電梯的通報後，立刻出動消防車與救護車，共計派遣6名人員前往救援，現場初步了解，事發當下電梯內大約有4名學生，經歷墜落意外後均已順利脫險，僅有1名學生表示身體疼痛而安排送醫。至於電梯為何會突然發生故障，仍待相關單位進一步檢修與釐清。    ,https://news.ltn.com.tw/news/society/breakingnews/5475222
台中吊車突「翹孤輪」！ 支撐腳陷地傾斜騰空 吊臂壓毀建案鷹架,社會,2026/06/17 14:51,"吊車因車身失去平衡，吊臂還向工地方向傾倒砸中鷹架。（民眾提供）台中市西屯區福順路一處集合式住宅建案，今（17）日上午進行鋼筋吊掛作業時驚傳意外，一輛吊車才剛架設完成準備作業，後方油壓支撐腳竟突然下陷，導致整輛吊車瞬間失去平衡、車身騰空傾斜宛如「翹孤輪」，吊臂更直接重砸工地鷹架，所幸當時尚未吊掛重物，現場無人受傷，相關單位已介入調查事故原因。市府表示，這座起重機在吊掛作業時傾斜翻覆，現場未造成人員傷亡，如查有違反「職業安全衛生法」規定，可開罰最高30萬元，並勒令停工改善，並已責成承造單位於今日完成修復改善。請繼續往下閱讀...事故發生於上午8時許，當時工地正準備將鋼筋吊運至施工樓層，吊車停妥後陸續展開支撐腳固定車體，未料右後側支撐腳突然往下陷落，伴隨一聲巨響，整輛重達數十噸的吊車當場傾斜，部分輪胎甚至離開地面，車頭高高翹起，驚險畫面讓在場工人嚇出一身冷汗。從現場畫面可見，吊車側傾後吊臂往工地方向倒去，直接壓毀部分施工鷹架，人行道地面則被支撐腳重壓出明顯坑洞，工地人員見狀立即停止作業，並在周邊設置三角錐與封鎖警戒，避免民眾靠近發生危險，施工單位則緊急調派另一輛大型吊車到場協助扶正。據研判，近期中部地區連日降雨，地面下方可能早已出現掏空情形，導致支撐腳受力後無法承受吊車重量而下陷。不過，實際原因仍有待進一步鑑定確認。勞工局指出，至於事故發生原因及責任歸屬，仍待進一步調查釐清，勞檢人員已前往檢查，如查有違反職安法相關規定，將依法處3萬元至30萬元罰鍰，並勒令停工改善。都發局表示，此建案領有合法建照，針對吊車支撐架造成路面及經核准設置的臨時斜坡道受損情形，已責成承造單位於今日完成修復改善，後續並將依相關規定追究應負責任。市府強調，已要求業者完成現場排除及復原作業，並提醒施工單位於進行吊掛作業前，應確實評估地盤承載條件，落實交通維持及職業安全措施，以維護公共安全及工地施工安全。工地吊車傾斜翻覆，吊臂砸中鷹架。（民眾提供）    ",https://news.ltn.com.tw/news/society/breakingnews/5475206
休假警員眼尖識破詐騙集團 當場攔阻取款,社會,2026/06/17 14:45,警方查獲詐騙集團車手龔姓男子，並扣得70萬元現金。（圖由警方提供）詐騙集團成員43歲龔姓男子，16日中午與被害人相約在桃園市桃園區崇法路碰面後，就帶對方到一旁公園準備取款，還好桃園警分局中路派出所休假警員鍾嘉呈看到龔男的第一時間，就直覺他可疑，他一面跟監，一面通報線上巡邏警力支援，成功保住被害人的70萬元現金。警方表示，龔男擔任詐團車手，昨天中午，詐團上游通知他已有被害人上當受騙，要交付70萬元現金投資，要求龔男依約到崇法路等待取款；休假中的鍾嘉呈駕車經過崇法路時，看到龔男站在路旁，卻不時張望、一臉緊張，鍾嘉呈直覺有異，決定待在車內觀察，等到龔男與被害人碰面，他判斷龔男確是詐團成員後，立即通報線上巡邏警力支援。請繼續往下閱讀...支援警力抵達後，立即趨前盤查龔男，追問後確認龔男是車手，警方當場逮捕他並扣得現金70萬元，讓被害人直說「好險，血汗錢差點就飛了」；警方將龔男帶回偵訊，已依詐欺、洗錢防制法等送辦，後續還要向上溯源追查幕後詐團成員。    ,https://news.ltn.com.tw/news/society/breakingnews/5475210
發毒瘋！竹縣男子凌晨亂鬧鄰居 強行開走鄰居車子闖紅燈撞騎士,社會,2026/06/17 14:40,新竹縣吳姓男子（右4）今天凌晨涉嫌「發毒瘋」！三更半夜亂完鄰居後強開走其車子，被毒駕究辦。（竹東警分局提供）新竹縣五峰鄉某部落25歲吳姓男子，今天凌晨2、3點涉嫌吸毒後「發毒瘋」，先是騷擾亂鬧鄰居，最後強行開走鄰居的車子往竹東而去。警方獲報後進行攔截圍捕，吳男到處鼠竄，一度在早上7點半於竹東市區內闖紅燈碰撞到某機車騎士後逃逸，警方8點過後終於將他逮捕到案，經唾液快篩確認又是毒駕者肇禍。竹東分局表示，吳男吸毒吸到神智不清，今天凌晨3點多先是狂亂自己的鄰居，嚇得鄰居不知如何是好，隨後他就強行開走鄰居的自小客車。警方獲報後，根據車牌和路口監視器進行攔截圍捕。請繼續往下閱讀...結果發現吳男早上7點半左右，在竹東鎮東寧路跟中正南路口闖紅燈，以致撞擊到綠燈直行的一名機車騎士，隨即加速逃逸。經警方持續搜尋，終於在早上8時17分把他逮捕到案。警方說，吳嫌落網時的精神狀態仍呈恍惚，經唾液快篩檢測，呈陽性反應，認定他涉嫌毒駕，依違反毒品危害防制條例及公共危險等罪嫌法辦吳男。新竹縣吳姓男子（右4）今天凌晨涉嫌「發毒瘋」！三更半夜亂完鄰居後強開走其車子，被毒駕究辦。（竹東警分局提供）    ,https://news.ltn.com.tw/news/society/breakingnews/5475202
自由觀點》「鐵拳教育」恐太過頭 「這一隊」治校園惡霸,社會,2026/06/17 14:35,    ,https://news.ltn.com.tw/news/society/breakingnews/5475196
遭歹徒持剪刀行搶  台新銀行發聲明︰無客戶及員工受傷,社會,2026/06/17 14:21,新北市板橋區今天上午發生銀行搶案，1位男子在今天上午竟持剪刀到台新銀行恐嚇櫃員交付金錢，警方火速趕抵將他逮捕。（記者徐聖倫翻攝）新北市板橋區今天上午發生銀行搶案，1位男子持剪刀到台新銀行板南分行恐嚇櫃員交付金錢，警方火速趕抵將他逮捕，目前已帶回警局將依搶奪、強盜罪嫌送辦。台新銀行發布聲明，強調銀行已完成相關影像保全作業，後續將全力配合警方調查。位於新北市板橋區館前東路的台新銀行板南分行，今上午11時許發生搶案，一名50歲王姓男子持剪刀斥喝行員「錢拿出來！」行員不敢大意，趕緊啟動與警方的即時連線，並拿出40萬元現鈔給王男。不過，王男拿到錢後並沒有逃跑，而是坐在現場「慢慢數錢」，警方迅速到場將其壓制逮捕。王男供稱，他知道搶銀行最容易被抓，因為沒錢過活，所以想吃「免錢飯」。警詢後，依強盜、竊盜等罪嫌將他移送法辦。請繼續往下閱讀...對此，台新銀行表示，板南分行今（17）日上午發生民眾持利器進入營業場所搶劫事件，因平時即實施防搶演練，分行同仁第一時間即依既定SOP啟動緊急應變作業，並立即通報警方，警方迅速抵達現場後已制伏嫌犯。經確認本案無財務損失，亦無客戶及員工受傷。    ,https://news.ltn.com.tw/news/society/breakingnews/5475157
指女檢收角頭裝潢利益 壹電視前經理誹謗罪二審敗訴、有罪確定,社會,2026/06/17 14:17,曾任年代網際事業公司、壹電視新聞部簡姓經理，被控在LINE群組散布不實訊息。（示意圖）曾任年代網際事業公司、壹電視新聞部簡姓經理，被控在LINE群組散布不實訊息，指稱時任警政署政風室、台灣高等檢察署前檢察官黃姓女子接受已故百億賭王林秉文、地方角頭千萬裝潢房屋，收受鉅額不正利益，涉犯加重誹謗罪。一審台北地院判處有期徒刑3月，得易科罰金；簡姓經理不服提起上訴，高等法院今（17日）駁回上訴，全案定讞。判決指出，黃女於2022年擔任警政署政風室主任期間，因接獲檢舉郭姓男子涉及吸金案，曾將相關資料報請新北地檢署指揮偵辦。後來郭男在檢警執行搜索前出境，引發外界關注與媒體報導。請繼續往下閱讀...一審台北地院認定，簡姓經理於同年11月間，在成員約14人的LINE群組，傳送指稱黃姓主任接受林秉文、地方角頭裝潢房屋等不實內容，足以損害黃女名譽及社會評價。台北地院依散布文字誹謗罪，判處簡姓經理有期徒刑3月，如易科罰金，以新台幣1000元折算1日。案經上訴，高院認為，依卷內事證可認定，簡姓經理發送訊息時，並非基於討論或請群組成員共同查證目的，也未向群組成員說明自己曾進行查證卻未獲結果，顯見其主觀上具有誹謗告訴人名譽的故意。高院判定，相關貼文內容足以貶損黃女人格及社會評價，已構成刑法第310條第2項散布文字加重誹謗罪；原審認事用法及量刑均無違誤，簡姓經理否認犯行及辯護人主張量刑過重，均無理由，因此駁回上訴，維持一審判決。    ,https://news.ltn.com.tw/news/society/breakingnews/5475147
