Title,News_Type,date,content,url
2嫌走私泰國落網 81隻獼猴幸運獲救,國際,2025/11/15 16:34,2名野生動物走私犯在泰柬邊境被逮，大量被塞在藍色網袋內的獼猴得以獲救。（法新社）泰國軍方15日表示，已在柬埔寨邊境攔截2名據信參與國際野生動物走私的嫌犯，當時車上有多達81隻獼猴，此外還查扣到毒品。泰國是野生動物盜獵者的主要中轉站，珍貴的瀕危動物在此被轉往中國、台灣與東南亞的黑市高價出售。請繼續往下閱讀...泰國皇家陸軍士兵14日午後在泰柬邊境的沙繳府（Sa Kaeo）亞蘭內亞來才（Aranyaprathet）地區攔截住走私犯的車，並在車上發現大量獼猴被分裝在藍色網袋內。負責該區的第12遊騎兵軍團在臉書上發表聲明，稱軍方在當地時間14日午後3時20分逮捕2名嫌犯，並檢查其車輛；士兵還查扣俗稱「安公子」的甲基安非他命藥丸與結晶甲安（crystal meth），但未具體說明毒品數量。軍方在臉書上發文說，2名男子應訊時坦承參與1個跨境販運非法集團，將獼猴從泰國運往柬埔寨。泰國軍方已與警方合作，以便根據野生動物保護與毒品法提出告訴。泰國去年曾與東非國家馬達加斯加展開最大規模打擊野生動物走私行動，之後還將近1000隻極度瀕危的狐猴與陸龜送回老家馬達加斯加；今年5月，泰國警方逮捕1名涉嫌將2隻紅毛猩猩幼崽走私進入泰國的男子。熱門賽事、球星動態不漏接    ,https://news.ltn.com.tw/news/world/breakingnews/5247139
引「法國BBC」造謠網友紅到國際了！《法新社》：BBC是英國的,國際,2025/11/15 16:23,《法新社》日前發布事實查核，宣稱此為「毫無根據的傳聞」。（取自法新社）陳姓網友日前在Threads上發文稱「法國BBC」報導台灣「捐了80億歐元」，才讓副總統蕭美琴7日於歐洲議會舉行的對中政策跨國議會聯盟（IPAC）大會中發表演說。他回台後不僅被警方約談到案，《法新社》也在日前發布事實查核，宣稱此為「毫無根據的傳聞」。《法新社》最後還強調：「BBC是英國廣播公司」。陳男日前在Threads帳號「caffrey802」發文指稱，「法國BBC報導台灣捐了80億歐元，然後讓副總統上去噴了20分鐘的口水，80億歐元拿來建設台灣不知道有多少？拿來普發不是比你在上面噴口水來得好！」總統府事後澄清並報警。陳男昨日返抵桃園機場，也立刻被警方約談到案說明。請繼續往下閱讀...《法新社》13日做出事實查核結果報告，並直接附上該名網友的Threads發文。《法新社》指出，台灣政府、IPAC都已經駁斥了這篇貼文中的訊息，台灣事實查核中心、MyGoPen等新聞機構也已經闢謠。《法新社》表示，IPAC執行長裴倫德回應，該名網友貼文是「虛假和誹謗」的說法，裴倫德在電子郵件中表示，已經在尋求法律意見已採取行動，他還補充，蕭美琴是受他的邀請而出席會議。最後，《法新社》還說，該篇貼文聲稱引用「法國BBC」，「但BBC是英國廣播公司」。熱門賽事、球星動態不漏接    ,https://news.ltn.com.tw/news/world/breakingnews/5247113
無意中透露接受核磁共振 川普稱「不知道他們檢查什麼」,國際,2025/11/15 16:10,川普上月初例行健檢時，接受核磁共振檢查，但他14日被問及此事時，稱不知道醫院方面具體上檢查了什麼項目。（法新社）高齡79歲的美國總統川普上個月例行體檢時，接受核磁共振（MRI）檢查，但他14日搭乘空軍一號前往佛州度過週末時，受訪坦言「我不知道他們（醫院）檢查了什麼」，引發更多關於他健康狀況的質疑。美國《國會山莊報》（The Hill）報導，川普針對自己接受核磁共振檢查的問題回應：「我不知道他們檢查了什麼，但無論他們檢查了什麼，他們都檢查得很好，他們說我的檢查結果和他們見過的一樣好。」請繼續往下閱讀...川普補充說，核磁共振檢查是他半年一次的體檢項目，而且「非常例行性」。川普10月前往馬里蘭州華特里德國家軍事醫學中心接受健檢後，他的醫生出具一份報告，稱總統「整體健康狀況極佳」。川普後來無意中透露他接受核磁共振掃描，引發人們對檢查原因的質疑，因為這種檢查通常不是例行健檢的一部分，但此後，關於此事的細節鮮少被披露。白宮新聞秘書李威特近日在被問及川普的核磁共振檢查結果時表示，總統「身體狀況依然極佳」。李威特在白宮新聞記者會上告訴記者：「正如10月10日提供的備忘錄中所述，川普總統在華特里德醫療中心接受高級影像檢查，這是他例行健檢的一部分。所有檢查結果都已由放射科醫生和顧問醫生審閱，他們一致認為川普總統的身體狀況依然極佳。我相信今晚總統與媒體共進晚餐時，你們都會親眼看到這一點。」熱門賽事、球星動態不漏接    ,https://news.ltn.com.tw/news/world/breakingnews/5247084
泰柬和平協議2週即破局 川普再當和事佬,國際,2025/11/15 15:59,在川普（右）見證下，柬埔寨總理洪馬內（中）和泰國總理阿努廷（左）上月26日吉隆坡簽署和平協議，但僅2週就破局。（法新社）隨著泰國與柬埔寨在上月底達成的邊境和平協議破局，斡旋兩國和談的美國總統川普14日表示，他已與兩國領袖通電話，以調解新一輪衝突，並認為兩國「會沒事」。《路透》及《法新社》報導，泰柬長年因邊境主權爭議關係緊繃，今年7月爆發長達5天的衝突，造成至少48人喪生，約30萬人一度流離失所。這兩個東南亞國家之後在川普與馬來西亞首相安華居中斡旋下，於上月26日在吉隆坡達成停火協議。請繼續往下閱讀...然而，泰國本週暫停執行停火協議，並要求柬埔寨道歉，因為泰國10日指控柬埔寨埋設新地雷，造成泰軍受傷，柬埔寨則否認這項指控。兩國12日互控對方在邊境地區開火，柬方稱有平民喪生。川普14日告訴媒體，他已與兩國總理都通了電話，「他們狀況很好，我認為他們會沒事」。川普同日在英國《GB新聞台》（GB News）訪問中談到全球衝突事件，稱「我認為我今天解決一件」，但未提供更多細節。熱門賽事、球星動態不漏接    ,https://news.ltn.com.tw/news/world/breakingnews/5247112
5公斤856元！日本超市米價再創歷史新高,國際,2025/11/15 15:27,日本政府調查顯示，截至本月5日為止，日本超市米的平均售價再創新高。（彭博）《日本放送協會》（NHK）15日報導，截至5日，日本超市米的平均售價創下歷史新高，5公斤裝米的平均價格為4316日圓（約台幣856元）。據報導，日本農林水產省的一項調查涵蓋全國約1000家超市。與前一週相比，米價上漲81日圓（約台幣16元），這是米的平均價格連續第二週上漲。請繼續往下閱讀...最新數據顯示，米價創下自2022年3月開始調查以來的最高紀錄，超過今年5月中旬創下的4285日圓（約台幣849元）紀錄。農林水產省指出，導致米價上漲的因素包括新米價格持續高漲，以及價格較低的政府儲備米銷售下降。另一項針對全國約6000家超市、藥局和其他零售商的調查顯示，5公斤裝米的平均價格為4444日圓（約台幣881元），這個數字也創下自今年2月開始該調查以來的最高紀錄。熱門賽事、球星動態不漏接    ,https://news.ltn.com.tw/news/world/breakingnews/5247069
年產值破1500億！拉麵熱潮席捲日本,國際,2025/11/15 15:15,調查顯示，日本上一個年度的拉麵市場規模高達7900億日圓，為最受歡迎的日式料理。（路透）日本《讀賣新聞》旗下英文報紙《日本新聞》（The Japan News）15日報導，一股前所未有的拉麵熱潮正席捲日本，旅遊業的興盛使這道深受喜愛的國民美食成為國際熱門。在上一個財政年度，日本拉麵餐廳的市場規模達到約7900億日圓（約1566億台幣）的歷史新高，比10年前成長60％。據報導，這股拉麵熱潮的背後是赴日外國旅客數量的持續成長。根據日本國家旅遊局統計，去年赴日外國遊客人數達約3687萬人次，創歷史新高。今年截至9月，已有3165萬人次造訪日本，預計再創新高。然而，真正贏得這波新遊客青睞的是拉麵，取代日本料理的標誌性食物壽司。請繼續往下閱讀...事實上，根據日本觀光廳去年對外國遊客消費情況進行的調查，18.9％的受訪者表示拉麵提供「最令人滿意的用餐體驗」，僅次於肉類菜餚，且比壽司高出4.4個百分點。帝國數據銀行資訊管理科副科長飯島大介（Daisuke Iijima，音譯）表示：「作為一種獨特的日本料理體驗，拉麵在海外享有很高的知名度。在日本，光顧拉麵店已成為一種身分的象徵。」該公司估計，上個財年拉麵餐廳的市場規模達到約7900億日圓的歷史新高，「大量的新連鎖餐廳湧入拉麵市場，利用其受歡迎程度，這一點也十分突出，我們預計市場將進一步成長」。10月中旬一個中午，7位美國遊客正站在東京澀谷區一家味噌拉麵店前，興奮地討論他們要品嚐的拉麵種類。該旅行團參加由日本旅行社籌劃的「東京拉麵之旅」。在3個小時的時間裡，他們會在澀谷區的3家拉麵店之間穿梭，品嚐6碗不同的拉麵。一位68歲的遊客，在家鄉華府，想吃一碗拉麵需要開車1個多小時。他認為日本之旅令人滿意，並說日本的每家餐廳都很正宗，而且口味豐富多樣。儘管這類旅行團每人費用近2萬日圓（約台幣3967元），但主辦單位每年仍會收到數千名外國遊客的預訂。熱門賽事、球星動態不漏接    ,https://news.ltn.com.tw/news/world/breakingnews/5247048
狡猾！日本熊隻被開槍打中「裝死」 獵人上前查看遭攻擊昏迷,國際,2025/11/15 15:00,日本群馬縣獵人開槍打中熊隻．上前查看時遭熊翻身突襲。日本熊出沒警示圖。（歐新社）太狡猾了！日本群馬縣藤岡市60歲男子岸光昭，今（15日）和另外5名獵人一起上山打獵，岸光昭於上午9時30分許開搶打中熊隻．看到牠一動也不動後便上前查看，突遭熊翻身攻擊當場昏迷送醫，至於熊隻則是逃逸無蹤。據《NHK》報導，警方表示，群馬縣從15日起開放山林狩獵，因此岸光昭和獵友結伴前往藤岡三波川山區，孰料卻被裝死的熊隻反擊，導致岸光昭頭部、臉部、手臂被咬傷，送醫時已失去意識。請繼續往下閱讀...警方指出，與岸光昭同行的其他獵人並未受傷，從目擊通報來看這是1隻體重約100公斤的成年熊，在襲擊岸光昭後逃入山中，因此呼籲附近民眾要提高警覺。熱門賽事、球星動態不漏接    ,https://news.ltn.com.tw/news/world/breakingnews/5247016
準備派兵？ 川普：已「大致」決定如何處理委內瑞拉問題,國際,2025/11/15 14:58,川普（右）長期以來一直指控馬杜羅（左）是毒梟首領。（法新社檔案照）在美國於拉丁美洲不斷升級的軍事部署，引發人們擔憂該地區衝突可能擴大之際，美國總統川普14日在搭乘空中一號前往佛州海湖莊園時表示，他已「大致」（sort of ）決定如何處理委內瑞拉問題。《法新社》報導，川普表示：「我不能透露具體細節，但我們在阻止毒品從委內瑞拉流入美國方面取得很大進展。」請繼續往下閱讀...最近幾週，華府已向拉丁美洲部署戰艦、戰機和數千名士兵，並對21艘涉嫌走私毒品的船隻發動襲擊，造成至少80人死亡。世界上最大的航空母艦「福特號」也於11日抵達拉美，公開目標正是幫助打擊該地區的毒品走私活動。然而，委內瑞拉當局擔心，美國這次軍事部署，包括向波多黎各派遣F-35匿蹤戰機及在加勒比海部署美國海軍艦艇，是針對委國總統馬杜羅的一場政權更迭陰謀。《哥倫比亞廣播公司新聞網》（CBS News）12日援引多位消息人士的說法指出，美國高階軍官已向川普提交針對委國潛在軍事行動的最新方案，其中包括對委內瑞拉的陸地打擊。不過，川普曾在2日淡化與委國開戰的可能性，但表示被他指控為毒梟的馬杜羅政權已進入倒數計時。哥倫比亞首位左翼總統裴卓（Gustavo Petro）則聲稱，美國此次軍事部署的最終目的是攫取委國的石油財富，並破壞拉丁美洲的穩定性。委國已宣布在全國範圍內部署軍隊，以應對美國在其沿海日益增強的海軍力量。熱門賽事、球星動態不漏接    ,https://news.ltn.com.tw/news/world/breakingnews/5247027
南韓團隊讓AI測驗大學入學考試 ChatGPT拔頭籌,國際,2025/11/15 14:32,ChatGPT在研究中贏得韓國大學入學考試的最高分。示意照。（美聯社）假設AI是一名參加大學入學考試的學生，它會得到怎樣的成績呢？韓聯社與延世大學教授金時浩（김시호）的研究團隊合作，使用ChatGPT（GPT-5）、Gemini（2.5Flash）、Perplexity（Sonar）的免費版本以及DeepSeek的最新模型，挑戰測驗2026年韓國大學入學考試（대학수학능력시험，簡稱CSAT）的韓語、英語與數學。根據《韓聯社》 報導，研究團隊讓4款熱門AI參加大考，實測如果這些人工智慧是真正的考生，它們可能會就讀哪些大學。為了確保測試環境與考試規定和韓國大學入學考試相同，所有的AI禁止搜尋網路，並被要求自行解決問題。請繼續往下閱讀...在測試中獲得第一名高分的模型是ChatGPT，尤其「數學」表現出色，儘管今年的數學題目，因穿插了大量高難度題目而被評為難度較高的考科，但ChatGPT仍然取得了優秀成績。第二高分則是DeepSeek，它在韓語和英語方面的得分高於GPT，但由於其數學得分較低，導致其總分下降。Gemini在數學方面表現出了較高的準確率，與ChatGPT類似，但可惜其韓語得分墊底。而整體得分最低的是Perplexity，測試過程中經常出錯，例如在測試過程中突然拒絕回答，而且難以準確測量測試時間，此外，還違反CSAT考試規定，像是在考試期間上網搜尋資訊。金時浩（김시호）教授表示：「儘管人工智慧模型取得了顯著進步，但它們在韓語的表現仍然不盡如人意，似乎無法解決我們所設想的高層次問題」。熱門賽事、球星動態不漏接    ,https://news.ltn.com.tw/news/world/breakingnews/5246956
衝著日本？中國突宣布黃海中部17到19日進行「實彈射擊」,國際,2025/11/15 14:19,中國今日宣布，本月17日至19日起，將在黃海中部進行實彈射擊，期間船隻禁止駛入。示意圖。（美聯社）日本首相高市早苗近日發表「台灣有事」言論，中國駐大阪總領事薛劍回以「斬首」爭議發言，引發中、日關係緊張。中國今日宣布，本月17日至19日起，將在黃海中部進行實彈射擊，期間船隻禁止駛入。根據《央視》報導，中國海事局網站今日消息，鹽城海事局發布航行警告，從11月17日至19日起，每日0時至24時，黃海中部部分海域進行實彈射擊，期間禁止船隻駛入。不過，中國並沒有公開詳細的實彈射擊的座標範圍。請繼續往下閱讀...《香港01》報導指出 ，演習區域接近中韓專屬經濟區（EEZ）重疊海域，戰略敏感性高，或對日本、韓國以及當地駐地美軍，都構成潛在的戰略壓力。日本首相高市早苗近日發表「台灣有事」言論後，中日緊張關係加劇。中國駐大阪總領事薛劍回以「斬首高市」發言擴大爭議，日本則反擊要求薛劍道歉，甚至不排除將之驅逐出境；中國今日呼籲公民不要前往日本，日本則回應此舉並不符合兩國領導人先前所確認的互利共贏戰略關係，要求中方處理。熱門賽事、球星動態不漏接    ,https://news.ltn.com.tw/news/world/breakingnews/5246992
太可愛！MLB宣布大谷翔平愛犬Decoy連續3年獲「最有價值狗狗」,國際,2025/11/15 14:06,"官方公布大谷翔平獲獎時全家一起慶祝的影片，只見愛犬Decoy坐在他和妻子田中真美子中間，表情相當驚恐。（取自X）MLB道奇日本二刀流巨星大谷翔平生涯第4度摘下MVP。官方公布大谷翔平獲獎時全家一起慶祝的影片，只見愛犬Decoy坐在他和妻子田中真美子中間，表情相當驚恐；MLB官方也發布一段2023年、2024年以及今年Decoy在大谷獲獎時反應的影片集合宣布：「Decoy連續三年獲得最有價值小狗」。MLB稍早公布MVP得主，毫無意外由大谷翔平獲得，這也是他生涯第4度獲得MVP。獲獎一刻，大谷翔平與田中真美子和愛犬坐在一起鼓掌歡慶，大谷隨後還「強吻」Decoy，面對主人的窒息式愛意，讓Decoy似乎有些不知所措，面露驚恐表情。請繼續往下閱讀...這段畫面流出後引發熱議，還有網友發現，大谷獲獎時穿著棕衣白褲、妻子穿著棕色洋裝，跟Decoy配色一模一樣，直呼這家人真的對Decoy很有愛。另外，MLB官方X也特別發布一支2023年到2025年，大谷獲獎時Decoy的反應合輯，可見2023年年歲尚幼的Decoy還開心與大谷擊掌、玩耍，2024年直接不給面子跑走，2025年則是驚慌失措，每年的反應都相當有趣。MLB也宣布，Decoy連續三年獲得「最有價值小狗」。Decoy is the Most Valuable Pup 3 years in a row! ???? pic.twitter.com/vwcO98tyF4— MLB （@MLB） November 14, 2025 Decoy is the Most Valuable Pup 3 years in a row! ???? pic.twitter.com/vwcO98tyF4熱門賽事、球星動態不漏接    ",https://news.ltn.com.tw/news/world/breakingnews/5246988
蘋果慘了！Apple Watch侵害血氧監測專利 判賠194億元,國際,2025/11/15 13:59,Apple Watch侵害Masimo的血氧監測專利，美國聯邦陪審團裁定賠償6.34億美元。圖為Series 9款式。（法新社）美國加州聯邦陪審團14日裁定，蘋果公司的Apple Watch侵害醫療科技業者Masimo的血氧監測專利，必須賠償6.34億美元（約新台幣194億元）。據《路透》報導，Masimo發言人表示，陪審團認同他們所提出的意見，亦即Apple Watch的運動模式、心率通知功能侵害到Masimo的專利；蘋果則對裁定結果相當不服，將會提出上訴。請繼續往下閱讀...蘋果與Masimo在美國展開持久且多線進行的訴訟，Masimo指控蘋果挖走員工竊取技術，美國貿易法庭曾認定侵害專利權一事成立，於2023年禁止Apple Watch Series 9與Ultra 2這2款智慧手錶輸入美國販售。為了應對禁令，蘋果先是將Apple Watch的血氧監測功能移除，後續獲得美國海關及邊境保衛局批准，已在今年8月推出升級血氧監測功能的智慧手錶。如今Apple Watch又被陪審團認定侵權，美國國際貿易委員會（USITC）之後將召開聽證會，以便確認是否要禁止升級功能的Apple Watch進入美國。熱門賽事、球星動態不漏接    ,https://news.ltn.com.tw/news/world/breakingnews/5246969
中國籲民眾避免赴日 官房長官：將要求中方做出適當回應,國際,2025/11/15 13:38,針對中國外交部呼籲民眾近期避免赴日一事，日本官房長官木原稔要求中方做出適當回應。（路透）針對日本首相高市早苗「台灣有事」的相關說法，除了有中國駐大阪總領事薛劍的「斬首」爭議言論之外，中國外交部14日更突然呼籲民眾近期避免赴日，對此，日本官房長官木原稔今（15日）表示將要求中方做出適當回應。據《產經新聞》報導，在中國外交部發出公告後，中日雙方在今天上午舉行了「局長級」會談，木原稔於新潟市接受採訪時，指出正因為中日之間的立場不同，因此多層次的溝通相當重要。請繼續往下閱讀...木原稔同時強調，中國呼籲公民避免赴日的行為，並不符合兩國領導人先前所確認的互利共贏戰略關係，因此會要求中方適當處理此事。熱門賽事、球星動態不漏接    ,https://news.ltn.com.tw/news/world/breakingnews/5246938
切割艾普斯坦性醜聞 川普下令司法部調查柯林頓與民主黨人士,國際,2025/11/15 12:58,美國眾議院監督委員會民主黨人近日公布新一批艾普斯坦的私人電郵，在其中一封電子郵件中，艾普斯坦寫下「我知道唐納（川普）有多髒」；另一封信中，他更宣稱總統川普不僅「知道那些女孩的事」，還曾與一名性販運受害者在他的住處共度「數小時」。（彭博）美國已故「富豪淫魔」艾普斯坦（Jeffrey Epstein）生前爆出曾性侵多名少女，媒介賣淫服務全球政商名流好友，引發各界熱議。近日傳出艾普斯坦在生前寫給美國總統川普的信中暗示，川普可能知悉他性虐未成年少女，引發外界質疑兩人關係，隨後川普卻是要求司法部調查艾普斯坦和民主黨人的關係，司法部也表示將依川普要求調查前總統柯林頓及摩根大通集團。美國眾議院監督委員會民主黨人，12日公布了新一批已故淫魔富商艾普斯坦（Jeffrey Epstein）的私人電郵，內容比先前更勁爆，在其中一封電子郵件中，艾普斯坦直接寫下「我知道唐納（川普）有多髒」；另一封信中，他更宣稱總統川普不僅「知道那些女孩的事」，還曾與一名性販運受害者在他的住處共度「數小時」。請繼續往下閱讀...此事引起軒然大波，外界再度質疑艾普斯坦與川普的關係，值此敏感時機，川普疑似為轉移焦點，竟要求司法部調查艾普斯坦和民主黨人的關係，這也成為川普接二連三要求聯邦執法部門追查政敵的最新一個案例。據指包含前總統柯林頓、前財政部長薩默斯（Larry Summers）以及參與創辦領英公司（LinkedIn）的民主黨重量級金主霍夫曼（Reid Hoffman）等人都將遭到調查，川普還稱「艾普斯坦是民主黨人，他是民主黨的問題，不是共和黨的問題！」他還要外界別把時間花在川普身上，並稱「我還有國家要治理！」不過針對先前是否知曉艾普斯坦性虐一事，川普則堅稱「一無所知」。摩根大通集團（JPMorgan Chase & Co.）則在聲明中表示，政府掌握了關於艾普斯坦罪行的確鑿信息，卻沒有與我們或其他銀行分享。該集團對於過去與艾普斯坦有來往感到遺憾，艾普斯坦1998年到2013年是客戶，但強調摩根大通並未協助他犯下這些令人髮指的罪行。早先艾普斯坦被捕後，也已經終止與艾普斯坦的合作關係。熱門賽事、球星動態不漏接    ,https://news.ltn.com.tw/news/world/breakingnews/5246902
日拉麵店員工把熊打跑後滿臉血淡定上班  店長曝超狂背景：他是傳奇,國際,2025/11/15 12:39,日本近期熊害頻傳，青森縣傳出店員遭熊襲擊的驚險事件。示意圖。（歐新社）日本熊害頻傳，青森縣近日傳出驚險事件。一間拉麵店的員工清晨開店時遭遇野熊攻擊，不但成功將熊擊退，還負傷準備開店營業，堅毅的舉動在網路上引發熱烈討論。根據《Yahoo! Japan》 報導，事件發生於9日清晨5點左右。當時該名員工準備到店門後方開啟煤氣設備時，突然與一頭黑熊正面相撞，兩者瞬間展開激烈扭打，員工臉部多處受傷，而熊則迅速逃離現場。請繼續往下閱讀...店長回憶，他在5點半抵達店裡時，看到員工滿臉鮮血、仍冷靜地備料，嚇得當場愣住，之後才得知對方竟然剛擊退一頭熊。該員工事後才說，他原本以為迎面而來的是一條大狗，「結果竟是熊」。儘管右眼瞼及鼻子血流不止、臉部明顯腫脹，這名員工仍堅持不需送醫，還說出：「我沒事，我還得開店。」讓店長當場傻眼，最終店長仍強制叫來救護車，將他送往醫院治療。這名57歲的員工身高約160公分，但體格健壯，加入拉麵店前，他曾在透析專門醫院擔任醫務人員，經驗豐富、遇事沉著，因此店內同事都稱他為「傳奇」。店長推測，員工能在面對熊襲時保持冷靜，可能與他有醫療背景、熟悉基本急救及傷勢評估有關，加上穩重性格，才會把這場驚險攻擊視為「小傷」。目前，逃逸的熊尚未被尋獲。拉麵店則決定在周邊增設防熊圍欄，並暫時休業以確保安全。熱門賽事、球星動態不漏接    ,https://news.ltn.com.tw/news/world/breakingnews/5246860
