Title,News_Type,date,content,url
京華城案一審判決11人僅2人無罪 台北地院發言人錄12分鐘影片說分明,社會,2026/03/26 17:34,台北地院行政庭長兼發言人黃柄縉。（記者張文川翻攝）前台北市長、前民眾黨主席柯文哲涉嫌京華城收賄等弊案，檢方起訴柯文哲違背職務收賄罪、主管事務圖利罪、公益侵占罪、背信等4大罪，具體求刑28年半，台北地方法院今宣判，將柯文哲依違背職務收賄罪判處13年、2件公益侵占罪各2年與3年6月、背信罪2年半，合併判處應執行17年有期徒刑，褫奪公權6年，可上訴。台北地院行政庭長兼發言人黃柄縉於宣判後錄製全長12分鐘的影像說明判決主文及11人判刑情形，詳情如下：威京集團主席沈慶京依共犯圖利罪判處10年徒刑，其行賄罪由刑責較重的圖利罪吸收。請繼續往下閱讀... 國民黨台北市議員應曉薇依違背職務收賄罪判刑15年6月。台北市都發局前局長黃景茂依圖利罪判處6年6月徒刑。眾望基金會董事長李文宗依背信罪、公益侵占和違背職務收賄罪，判刑4年6月。木可公司負責人李文娟依公益侵占罪、商業會計法填製不實會計憑證罪，判刑2年4月。會計師端木正依偽造行使準文書罪判刑1年。台北市前副市長彭振聲圖利罪判刑2年緩刑3年。都發局前總工程司邵琇珮圖利罪判1年3月緩刑3年。應曉薇顧問吳順民、威京集團財務經理張志澄2人獲判無罪。威京集團主席沈慶京依共犯圖利罪判處10年徒刑，其行賄罪由刑責較重的圖利罪吸收。請繼續往下閱讀...國民黨台北市議員應曉薇依違背職務收賄罪判刑15年6月。台北市都發局前局長黃景茂依圖利罪判處6年6月徒刑。眾望基金會董事長李文宗依背信罪、公益侵占和違背職務收賄罪，判刑4年6月。木可公司負責人李文娟依公益侵占罪、商業會計法填製不實會計憑證罪，判刑2年4月。會計師端木正依偽造行使準文書罪判刑1年。台北市前副市長彭振聲圖利罪判刑2年緩刑3年。都發局前總工程司邵琇珮圖利罪判1年3月緩刑3年。應曉薇顧問吳順民、威京集團財務經理張志澄2人獲判無罪。    ,https://news.ltn.com.tw/news/society/breakingnews/5383672
柯文哲一審重判17年！威京集團旗下鼎越公司121億不法所得全沒收,社會,2026/03/26 17:26,柯文哲被重判17年。（記者塗建榮攝）台北市前市長柯文哲等11名被告涉犯京華城、政治獻金案，台北地方法院歷經1年審理後於今（26）日宣判，重判柯文哲17年有期徒刑、台北市議員應曉薇15年6月、威京集團主席沈慶京10年。針對沒收金額部分，柯文哲部分為1260萬元、應曉薇5250萬元、威京集團旗下的鼎越公司121億545萬6748元、木可公司6134萬6790元、柯文哲與李文宗共同沒收827萬1095元。台北地院於下午4時許公布判決主文，主文寫道，柯文哲犯貪污治罪條例之違背職務收受賄賂罪，處有期徒刑13年。褫奪公權6年；犯公益侵占罪，處有期徒刑2年；犯共同犯公益侵占罪，處有期徒刑3年6月；犯共同犯背信罪，處有期徒刑2年6月，合併執行17年有期徒刑，褫奪公權6年。請繼續往下閱讀...應曉薇部分犯貪污治罪條例之違背職務收受賄賂罪，處有期徒刑14年，褫奪公權6年；犯洗錢罪，處有期徒刑3年，併科罰金新臺幣1000萬元。有期徒刑部分，應執行有期徒刑15年6月，褫奪公權6年。沈慶京部分，涉犯非公務員與公務員共同犯對主管事務圖利罪，處有期徒刑10年，併科罰金新臺幣2000萬元，褫奪公權5年。黃景茂共同犯公務員對主管事務圖利罪，處有期徒刑6年6月，褫奪公權3年。彭振聲共同犯公務員對主管事務圖利罪，處有期徒刑2年，褫奪公權1年，緩刑3年。邵琇珮共同犯公務員對主管事務圖利罪，處有期徒刑1年3月，褫奪公權1年，緩刑3年。李文宗共同犯公益侵占罪，處有期徒刑3年2月；共同犯背信罪，處有期徒刑2年6月，應執行有期徒刑4年6月。被訴違背職務收賄罪部分無罪。李文娟共同犯公益侵占罪，處有期徒刑2年。犯商業會計法第七十一條第一款之填製不實會計憑證罪，處有期徒刑8月。應執行有期徒刑2年4月。端木正犯行使業務登載不實準文書罪，處有期徒刑1年。吳順民無罪、張志澄無罪。另外，針對不法獲利進行沒收部分，柯文哲應沒收1260萬元。柯文哲、李文宗應共同沒收827萬1095元。應曉薇應沒收5250萬元。鼎越公司應沒收121億545萬6748元。木可公司應沒收6134萬6790元。百日內妻、母離世成「最悲慘被告」 彭振聲認罪獲緩刑3年吳順民替應曉薇施壓官員、張志澄幫小沈找人頭捐柯文哲210萬 2人無罪原因曝北院認定柯文哲收賄210萬 陳智菡無奈：捐給民眾黨 判柯13年沈慶京行賄210萬 李文宗回應「這段話」意謂柯文哲知情找不到金流用「一抹微笑」定罪？ 吳怡萱：法官在反串嗎？柯文哲判刑17年懶人包 溫朗東白話導讀北院新聞稿木可淪政治獻金「資金防火牆」 北院認定柯文哲、李文宗掏空6134萬為柯文哲討公道！ 黃國昌：全國動員令週日上凱道嗆賴清德有希特勒的野心 柯文哲：還好沒有希特勒的能力點名賴清德「我絕對不會投降」 柯文哲：毀掉我還有千千萬萬個小草柯文哲判17年 法新社：台灣「第三勢力」領袖涉貪    ,https://news.ltn.com.tw/news/society/breakingnews/5383680
不認罪還拖延訴訟！ 南投前消保官許麗貞公帑私用涉貪  二審判更重 ,社會,2026/03/26 17:07,涉貪被判刑的南投縣政府前消保官許麗貞（左）。（資料照）任職長達19年的南投縣前消保官許麗貞，任內將「業務推廣費」當成自家零用金，從家庭聚餐到生活用品，全數以公帳核銷，偵查中一度認罪，卻在法院審理時翻供，甚至提出大量與案情無關的證據，試圖拖延訴訟進度，台中高分院法官直指態度反覆、毫無悔意，認一審量刑過輕改判6年、褫奪公權3年。經查，許麗貞任內每月可動用5400元業務推廣費，卻長期以不實名目報支私人開銷，2020年12月，她揪同仁團購漁會禮盒10盒，卻將其中4盒據為己有或轉贈親友，再向同事收款，卻仍以發票向縣府請款；另多次在網路購買擴香組、餐具禮盒等商品，也全數包裝成公務支出核銷。請繼續往下閱讀...更離譜的是，她至少5度攜家人外出用餐，將家庭聚餐費用報為業務推廣費，甚至人在國外旅遊期間，仍向同事索取發票報帳，檢方統計共13次犯行，不法所得達3萬8585元，依《貪污治罪條例》將她起訴。一審法院認定其行為屬長期、慣習性侵占公款，依多項罪名合併判處4年6月，然案件上訴後出現轉折，台中高分院審理時發現，許女不僅全盤否認犯行，還頻繁聲請調查與本案無關證據，導致訴訟延宕，浪費司法資源。合議庭強調，許具法律碩士學歷，理應比一般人更清楚法紀，卻反覆利用職務之便詐領公款，視為私人開銷來源，嚴重破壞公務體系形象，尤其她在偵查中認罪，審理時卻翻供，顯見缺乏悔意，也未見任何自我反省，最終定應執行刑為6年，褫奪公權3年，可上訴。    ,https://news.ltn.com.tw/news/society/breakingnews/5383651
柯文哲一審判17年維持7千萬交保 沈慶京、應曉薇加保3千萬,社會,2026/03/26 17:06,京華城弊案26日宣判，前台北市長柯文哲被判刑17年，且維持7千萬元交保金額，聽判後面帶微笑但神情凝重，全程不發一語隨即上車離去。（記者塗建榮攝）台北市前市長柯文哲等11名被告涉犯京華城案，歷經1年的審理後於今（26）日宣判，柯文哲被重判17年有期徒刑、褫奪公權6年。在審判長江俊彥要求下，柯文哲等4名被告今日到庭聽判，合議庭也於宣判後針對4人的強制處分結果進行調整，柯文哲部分維持7000萬交保，至於台北市議員應曉薇、威京集團總裁沈慶京則被加保3000萬元，眾望基金會董事長李文宗則可以解除電子腳鐐。應曉薇今日於強制處分庭時，向合議庭表示，自己已經沒有加保的能力，強調自己不可能逃跑，如果可以的話希望降保，讓她在家照顧媽媽。應的辯護律師吳佳蓉則說，應曉薇過去都有準時到庭，遵守裁定且已有重保及限制住居、出海、出境及電子腳鐐。此外，應曉薇除是政治人物外，過去還從事演藝工作，不可能逃亡。請繼續往下閱讀...沈慶京否認逃亡意圖，表示如今自己還有某企業要來搶公司的經營權，痛斥對方「趁我病要我命」，且過去為了負擔高額的保金，向友人借款還遲遲未還錢，因此希望至少降保8000萬。沈的辯護律師徐履冰則說，目前判決僅有認定210萬的行賄部分，認為目前應該有降保的空間，並強調會再上訴爭取清白。李文宗則說，自己希望可以解除電子腳鐐，因為科控中心常半夜打來，並表示判決結果並無認定其有收賄，因此希望可以降保，讓他先把一部分的錢還給友人，並強調自己還留有收據。強制處分庭開到下午3時35分，審判長江俊彥宣布休庭15分鐘後會於3時50分宣布裁定結果及理由，但疑似是因為花粉症的關係，江俊彥遲遲至4時12分才宣布裁定結果，並表示柯文哲部分維持7000萬元交保；沈慶京、應曉薇部分，合議庭認為原保已不足以擔保其日後遵期到庭，分別裁定加保3000萬；李文宗部分則解除電子腳鐐。台北市議員應曉薇（中）涉嫌京華城案收賄、侵占政治獻金等案，今由女兒陪同聽判。台北地方法院26日下午判處15年6月有期徒刑，合議庭裁定應曉薇加保3千萬。（記者塗建榮攝）威京集團總裁沈慶京涉嫌京華城案，台北地方法院26日下午判處10年有期徒刑。合議庭裁定沈慶京加保3千萬。（記者塗建榮攝）    ,https://news.ltn.com.tw/news/society/breakingnews/5383636
澎湖副供站前「犁田」人車噴進貨車底 正義吊車路過急救援,社會,2026/03/26 16:52,澎湖副供站前岔路，發生機車犁田騎士連人帶車摔落車底。（澎湖交通觀察日誌提供）澎湖「副食品供應站」前岔路口，今（26）日傳出機車騎士右轉彎之際，突然「犁田」，連人帶車摔落至停等紅綠燈自小貨車車底下，澎湖縣政府消防局接獲通報後，立即派員前往現場搶救，路過吊車及輪胎業者見狀，也加入搶救行列，啟動吊車將受困騎士救出，所幸無生命危險。澎湖縣政府消防局調查指出，今日下午2時36分接獲民眾報案，指稱馬公市東衛里縣道202線發生汽機車交通事故，機車騎士受困於汽車底下，情況緊急，請求消防局派員前往救助。澎湖縣政府消防局獲報，立即派遣馬公分隊出動救護車及器材車共2車5人，由小隊長董明遠率隊前往搶救。請繼續往下閱讀...勤務人員抵達現場，發現是1輛自小貨車與機車發生碰撞事故，機車騎士受困車底，勤務人員隨即展開救援行動，此時恰有祥豪企業行的司機駕駛吊車，和東昇輪胎行的老闆經過，與消防人員一起熱血協助，將事故車輛吊起，加快救援速度。經現場協力處置，於下午2時51分順利將受困騎士（呂姓男子、74年次）救出。經初步評估，傷者身體多處擦傷，意識清楚，消防人員隨即進行傷口清洗與初步處置後，送往衛生福利部澎湖醫院治療。根據馬公警分局調查指出，機車騎士行經該路段右轉，不慎發生「犁田」意外，連人帶車滾落正在停等紅綠燈小貨車車底，所幸小貨車未啟動前行，否則後果不堪設想。祥豪企業行吊車剛好經過，協助吊起小貨車救人。（澎湖縣政府消防局提供）騎士被救出後，消防局人員立即展開救援。（澎湖縣政府消防局提供）    ,https://news.ltn.com.tw/news/society/breakingnews/5383604
妻被小三氣到早產！ 日本女翻譯吃人夫被抓包賠35萬,社會,2026/03/26 16:36,台南人夫出差偷吃女翻譯害妻子早產，摩鐵遭抓包報警後，仍糾纏不休。法院認定嚴重侵害配偶權，判賠35萬元。（記者王捷攝）人夫與日本女翻譯發生婚外情，最誇張的是，妻子親自到汽車旅館抓包並報警後，女翻譯事後繼續「膏膏纏」（台語ko-ko-tînn），甚至大聊情趣睡衣等話題。台南地方法院認定女翻譯侵害配偶權，判處賠償35萬元。​妻子與丈夫於前年7月結婚，丈夫出差日本認識女翻譯。女方明知男方已婚，前年10月起兩人在日本與台中市的汽車旅館發生關係。妻子看見刷卡紀錄大受打擊，導致子宮收縮早產，新生兒住進重症病房數10天，妻子也罹患適應障礙症。沒想到前年12月剛產子，兩人竟又跑去汽車旅館開房間。請繼續往下閱讀...​去年3月，妻子察覺丈夫行蹤有異，追蹤到台南汽車旅館，當場攔截同車的兩人並報案。沒想到被抓包後，女翻譯不僅沒收斂，反而繼續糾纏男方。去年5月及6月間，持續在討論見面細節，女方主動詢問男方喜歡什麼款式的套餐，甚至討論從日本帶情趣睡衣過海關等露骨內容。​審理時女翻譯全盤否認，辯稱只有工作聯繫，還推託社群帳號不是她的。但法官比對頭像照片與對話脈絡，確認帳號就是女方所有。法官還發現，女方曾表示反正都要被告了，不如繼續在日本見面比較不會被打擾。法院認為，女方明知妻子懷孕生產，經歷多次攔阻依然執意破壞他人婚姻。經審酌加害程度，判處應賠償35萬元，全案可上訴。    ,https://news.ltn.com.tw/news/society/breakingnews/5383543
中華電信帳款逾期未付款？詐騙電郵釣魚 勿點擊連結,社會,2026/03/26 16:36,中華電信帳款逾期未付款？有民眾點擊連結險遭詐騙。（民眾提供）連日來有民眾接獲聲稱中華電信寄發的電子郵件，指稱帳款逾期未付款，有人點擊連結，按照指示操作，赫然發現上了詐騙集團的當。警方提醒，最近不少人接到這種電郵，要辨別真偽，首先要認明官方網域，可直接開啟官方App或致電中華電信客服查詢確認，千萬不要點擊來路不明的連結，以免遭到詐騙。收到假冒中華電信詐騙郵件的民眾指出，最近收到「中華電信」寄發的電子郵件，內容約略為「親愛的客戶，您好：我們已注意到您的帳戶仍有未完成付款，為維持服務的完整與連續性，請盡速指定期限內完成付款程序。若逾期未處理，系統將自動暫停部分功能或限制帳戶存取權限，直至款項結清。」請繼續往下閱讀...信件還附上「立即完成付款」的連結，民眾對郵件真實性半信半疑，因此未貿然點擊，而是打開中華電信App，確認自己沒有待繳項目，再致電中華電信客服諮詢，發現是詐騙集團。他遵照指示操作，結果發現竟然是詐騙集團的伎倆。彰化警方提醒，近期有大量冒用中華電信或蝦皮購物名義的詐騙，利用發票中獎、獲得手機或款項逾期未完成付款等話術，誘騙使用者點擊釣魚連結，以騙取個資或金錢，民眾最好先應透過官方管道核實，或撥打165反詐騙專線求證。    ,https://news.ltn.com.tw/news/society/breakingnews/5383594
「就地大號」被錄影抓包！  粗工拿安全帽狂砸工程師,社會,2026/03/26 16:25,沈姓工人在台南工地22樓大號遭錄影，竟持安全帽痛毆詹姓工程師。雖老闆代賠6萬元，法院仍依傷害罪判沈男拘役40日。（記者王捷攝）沈姓工人疑忍不住屎意，在工地公開大號，被詹姓工程師撞見並拿手機錄影蒐證，沈男不滿如廁畫面入鏡惱羞成怒，拿安全帽狂砸對方。台南地方法院依傷害罪判沈男拘役40日。​去年7月上午，沈男在台南市安平區郡平路與永華七街口的國泰Uni Park大樓工地22樓，疑似腹痛難耐直接在現場大號。工程師詹男巡視發現，上前口頭勸導並拿出手機對著現場錄影蒐證，沈男眼見大號畫面被拍下情緒失控，先對詹男飆罵，接著揮拳攻擊詹男頭部，甚至拔下工地安全帽當作武器，朝詹男頭部左側猛烈揮擊，導致詹男頭部、前額與右側手臂受有擦挫傷。詹男隨後前往郭綜合醫院驗傷提告。請繼續往下閱讀...​沈男在警詢時承認雙方拉扯，但矢口否認打人，且在案發後，沈男的老闆已賠償詹男6萬元。法官認為，若沈男沒有傷人，雇主豈會平白無故承擔賠償金？加上雙方互不相識，詹男沒有捏造事實的動機，且醫院診斷證明也與指控傷勢吻合，因此不採信沈男辯詞，認定傷害犯行明確。​法院審酌，沈男因隨地大號遭糾正蒐證，不知自制反以暴力攻擊他人，未思循理性方式解決糾紛。考量他犯後態度、未與被害人達成和解及告訴人受傷程度等一切情狀，依傷害罪判處拘役40日，可易科罰金。此外，沈男經合法傳喚無正當理由不到庭，法院依法逕行判決。    ,https://news.ltn.com.tw/news/society/breakingnews/5383506
京華城宣判》小草群情激憤 男亂入喊「民眾黨挺貪污除罪」被揍,社會,2026/03/26 15:47,一名男子拿著標語「亂入」小草宣講地點，還大喊「民眾黨支持貪污除罪化」，隨即被警方架走，避免衝突升溫。（記者王冠仁翻攝）台北地方法院今天針對前台北市長柯文哲涉入京華城弊案進行宣判，柯被判17年，聚集在北院外的大批小草群情激憤、難以接受，沒想到居然有一名男子拿著標語「亂入」小草宣講地點，還大喊「民眾黨支持貪污除罪化」；小草情緒激動，當場出拳揍人，這名亂入者也隨即被警方架走，避免衝突升溫。台北地院今日下午2時30分宣判，將柯文哲依違背職務收賄罪13年、2件公益侵占罪各2年與3年6月、背信罪2年半，合併判處應執行17年有期徒刑、褫奪公權6年。可上訴。請繼續往下閱讀...消息一出，聚集在北院外的小草相當氣憤，聚集在場外高呼口號。當時有民眾黨人士在發表演說，強調未來二審、三審，都要持續陪伴柯文哲，也批評司法成為打壓政治敵手的工具。沒想到宣講期間，忽然有一名男子拿著標語，竄身其中，還趁著空檔忽然插話大喊「民眾黨支持貪污除罪化」。當時在場小草一時沒有意會過來，直到數秒後才發現對方來亂，於是慌忙拿旗幟遮擋他；但有小草看不下去，立刻出拳揍人。警方發現衝突發生後，立刻趕來將這名亂入男子架走。柯被判17年，聚集在北院外的大批小草群情激憤、難以接受，有人發表演說，此時1名男子（螢光綠上衣）亂入小草宣講現場。（記者王冠仁翻攝）    ,https://news.ltn.com.tw/news/society/breakingnews/5383495
柯文哲收賄一審判17年！當庭向法官說「我絕不逃亡」求降保解除電子監控,社會,2026/03/26 15:46,前台北市長、前民眾黨主席柯文哲涉嫌京華城收賄等弊案，台北地院26日判處17年有期徒刑。（記者塗建榮攝）歷經一年多審理，備受矚目的京華城弊案收賄及政治獻金案今下午正式宣判。台北地方法院一審認定前台北市長柯文哲觸犯違背職務收賄、公益侵占及背信等罪，合併判處有期徒刑17年，並褫奪公權6年。面對重判與檢方請求維持羈押的處分，柯文哲當庭表示：「我一定不會逃亡」，請求審判長考量其配合度，准予降低保金並解除限制住居。柯文哲涉嫌京華城收賄等弊案，檢方依違背職務收賄罪、主管事務圖利罪、公益侵占罪及背信罪等4罪提起公訴，具體求刑28年6月。全案經北院審理一年多，今下午2時30分宣判，將柯文哲依違背職務收賄罪判處13年有期徒刑，另就2件公益侵占罪分別判處2年及3年6月，背信罪判處2年6月，合併定應執行17年有期徒刑，並褫奪公權6年，全案仍可上訴。請繼續往下閱讀...稍早，主任檢察官林俊廷表示，依今日宣判結果，刑度非輕，未來仍將進入上訴及刑罰執行程序，原有羈押原因依然存在，請求法院至少維持現行強制處分。「我一定不會逃亡。」柯文哲在庭上表示，電子監控設備並無必要，也無須限制住居，先前7000萬元交保金是向母親與妹妹借得，經濟壓力沉重，請求法院酌情降低保金。辯護律師鄭深元指出，被告並無逃亡事實，且交互詰問程序已完成，並無串證之虞；檢察官原求刑28年6月，與今日判決刑度差距顯著，顯見逃亡可能性極低。另一名辯護律師陸正義表示，羈押目的在於確保被告到庭，柯文哲一向尊重法院裁定，並均按時報到；先前曾聲請前往日本參加兒子畢業典禮，亦依程序提出申請並尊重法院決定，當時籌措7000萬元交保金已相當勉強。律師蕭奕弘則指出，柯文哲身為政治人物，背負社會高度關注，絕無棄保潛逃可能，並請求法院考量本次判決刑度與檢方求刑落差，准予降低保金並解除限制住居。    ,https://news.ltn.com.tw/news/society/breakingnews/5383505
花蓮市警車超速撞死機車女騎士 肇責雙方各半家屬反彈,社會,2026/03/26 15:33,花蓮市去年9月發生一起警車撞死機車騎士意外，77歲鍾姓婦人清晨外出買菜，行經中央路果菜市場前路口時，遭執勤中的翟姓員警駕駛警車高速撞擊。（資料照）花蓮市去年9月發生一起警車撞死機車騎士意外，77歲鍾姓婦人清晨外出買菜，行經中央路果菜市場前路口時，遭執勤中的翟姓員警駕駛警車高速撞擊，當場噴飛卡入路旁計程車底，送醫不治。交通部公路局行車事故鑑定委員會覆議結果近日出爐，認定雙方肇責各半，但因警車時速高達97公里、遠超過速限50公里，引發家屬強烈不滿，質疑責任判定失衡，直言「無法接受」。事故發生於去年9月17日清晨5點42分，36歲翟姓員警駕駛警車沿中央路三段北往南直行，行經北安路81巷口，鍾姓婦人騎機車準備前往市場，先於路口待轉區停等，隨後騎至中央分隔島觀察車流，待一輛機車及一輛水泥車通過後起步穿越，未料行經南向車道時，遭高速駛來的警車猛烈撞擊，整個人連同機車彈飛滑行，卡進對向路旁停放的計程車底，傷重不治。請繼續往下閱讀...覆議報告指出，翟姓員警行經速限50公里路段，實際車速高達97公里，屬嚴重超速，且通過閃光黃燈路口未減速並注意車前狀況；鍾姓婦人則因行經閃光紅燈路口，未禮讓幹道車先行，雙方肇事責任因此各佔50%。不過家屬質疑，「嚴重超速」與「支線道讓路」之間的責任比例失衡，認為鑑定忽略關鍵因素。家屬指出，從監視器畫面可見，鍾婦在分隔島停等近10秒，確認車輛通過後才起步，若非警車速度過快，理應有足夠時間安全通過，「沒有人能預料會有車輛以接近翻倍速度衝出」，難以接受責任各半的結果。家屬認為，因責任比例認定為各半，理賠金額大幅縮減，扣除強制險後，警方僅需負擔約25萬元，痛批「一條人命竟只值如此」。此外，家屬也指控警方事後態度冷漠，治喪期間翟姓員警僅現身一次，且未感受到真誠道歉，甚至質疑相關處理過程造成二度傷害，已委任律師爭取權益。對此，花蓮警分局回應，本案警方主動向花蓮監理機關申請車輛行車事故鑑定委員會進行肇責鑑定，後續家屬提出異議並申請覆議，結果仍維持雙方各負50%責任；若仍有疑義，家屬亦可另循民間學術機構申請事故判定。警方指出，曾主動申請調解程序，但家屬未出席，尊重其決定。警方強調，除已對涉案員警進行行政處分，涉及過失致死部分亦已移送檢方偵辦，後續將由司法機關釐清責任。警方表示，充分體會家屬失去親人的悲痛，相關爭議將尊重司法最終判決結果。鍾姓婦人遭高速駛來的警車猛烈撞擊，整個人連同機車彈飛滑行，卡進對向路旁停放的計程車底，傷重不治。（資料照）翟姓員警行經速限50公里路段，實際車速高達97公里，屬嚴重超速。（資料照）    ,https://news.ltn.com.tw/news/society/breakingnews/5383447
