Title,News_Type,date,content,url
羅智強批綠營反對718億新興計畫動支 把僵局推入死局,政治,2026/01/21 07:57,立法院昨天召開程序委員會，藍委痛批賴政府。（資料照）針對總預算僵局，立法院藍白黨團上週五在院會提案，根據「預算法」第54條，讓TPASS通勤月票等718億元攸關民生急迫使用的新興計畫預算，在立法院同意下可先動支。國民黨團書記長羅智強表示，但這案表決時，51席綠委全部投反對票，棄民生需求於不顧；民進黨把「僵局」推入「死局」，用意就是以造謠、推責來進攻在野。​羅智強表示，當在野就僵局負責任地提出解方，這場表決卻成為了民進黨政治操作的「照妖鏡」。大家可以發現，執政黨根本沒有想要解決問題，反而更像是想要把「僵局」推入「死局」，用意就是好讓綠營能以造謠、推卸責任來進攻在野。一場表決，照出清德賴總統領導、民進黨執政的三大「原形」。請繼續往下閱讀...​羅智強指出，第一，違法預算製造僵局。即便立法院三讀通過、總統府公告生效，賴總統與行政院長卓榮泰，堅持違法不編列軍人加薪及提高警消退休保障的預算，導致總預算成為無法審查的違法預算。國人實在不明白，軍警消出生入死保家衛民，為何執政黨就是不願為他們依法提升待遇？為什麼殉職時大官民代都搶著致敬英雄，但民進黨卻「今天公祭、明天忘記」，談到加薪卻就是不給？認為軍警消不配、不值得？1.25兆特別軍購政府說買就買，一年300億軍人加薪寧願違法，也沒有任何一點討論空間？​第二，綁架預算，不顧民生。民進黨口口聲聲批評在野卡預算，但不願檢討政府違法在先，更在可以動支新興計畫預算時投票反對。民進黨反對TPASS行政院通勤月票執行計畫，對不起通勤族：民進黨反對生育補助與津貼，對不起家長與下一代；民進黨反對老舊校舍整修補助，對不起學生；民進黨反對橋樑安全、防洪、藥物韌性等718億新興計畫預算動支，對不起相關重大急迫需求下的全體國人。​羅智強表示，第三，綠色執政，對立保證。在國家政事沒有共識時、當在野黨負責任的找解方時，賴總統還走不出大罷免堅持對抗，不做正事，不願面對異見，仍要繼續對槓在野，把政治推向極端對立。​羅智強呼籲賴總統、卓院長懸崖勒馬，一個國家跟國民，不能每天活在選舉裡，若一個執政黨只剩下政治語言跟針對在野的進攻計劃，絕對會和民生脫節、成為人民的災難。    ,https://news.ltn.com.tw/news/politics/breakingnews/5316679
陳佩琪PO照洩廉政官個資 石明謹揭一問題：比想像還嚴重,政治,2026/01/21 07:37,民眾黨前主席柯文哲（左）的妻子陳佩琪（右），昨又於臉書發文批京華城弊案是世紀冤案，她還PO出含有廉政署承辦人全名和手機號碼的照片，遭質疑違法。（資料照）民眾黨前主席柯文哲的妻子陳佩琪，昨又於臉書發文批京華城弊案是世紀冤案，她還PO出含有廉政署承辦人的全名和手機號碼的搜索票照片，遭質疑違法。曾任職北市交通警察大隊的球評石明謹發文直言，陳佩琪的問題比想像中的嚴重，因為這張根本不是搜索票，而是「刑事聲請搜索票書」，在搜索時並不會出示給當事人，只有律師在起訴後的證據清單中才看得到，因此這可能不僅洩露個資，還違反刑事訴訟法。昨日下午陳佩琪於臉書發文，再次提及2024年8月30日遭檢廉搜索一事，痛批「搜索票上瞎掰一堆所謂貪污嫌疑（起訴書上都消失了），法官兩眼一閉都核准、放行」等語，並附上搜索票的照片，上頭有檢察官、法官的核章，以及廉政署承辦人簽收的筆跡及手機號碼，但均未馬賽克，此舉恐怕已觸犯個資法第41條。請繼續往下閱讀...石明謹對此發文批評，這個行為真的很低劣，因為所謂的承辦人其實只是收發文件、去追蓋章跑流程的人員，老實說跟整個案件的偵辦沒有太大關係，但是第三壺鈴竟然把他的姓名、電話、手機全部公開，這就類似你對法官的判決不滿，結果去公布書記官的手機一樣。​石明謹也強調，仔細看了一下，陳佩琪的問題比想像中的嚴重，因為這張根本不是搜索票，而是「刑事聲請搜索票書」。也就是說，這張並不是要給柯文哲的，而是廉政署向檢察官及法官申請搜索票的聲請書，所以才會有承辦人的姓名跟電話，還有署長決行、檢察官、法官核印。​石明謹說明，這張東西在搜索時並不會出示給當事人，這是申請搜索票時的內部文書，只有律師在起訴後的證據清單中才看得到，為的是證明當初申請搜索票，有經過合法程序層層把關。​石明謹直言，律師在閱卷時可以抄錄、複印、拍照，所以這張很可能是律師拍給柯文哲的。石明謹也說，如果是這樣，依照刑事訴訟法第33條第5項，「持有第一項及第二項卷宗及證物內容之人，不得就該內容為非正當目的之使用」。法理上就是除了為當事人辯護所需之外，不得用於其他用途（例如發臉書就有可能不是正當使用）。這件事很可能不但洩露他人個資，還違反刑事訴訟法。在昨下午發文後，陳佩琪昨晚也於該則發文的留言區稱，「我把搜索票上面的承辦人名字和手機號碼刪除了，至於市話轉分機應是公務機，手機無法確定是否公務機，我們醫生有人會把手機PO在個人簡介上，有人則不會，我不小心把承辦人員名字露出來，該負什麼法律責任，該被抓去北檢問，該被羈押幾個月，我都尊重」。    ,https://news.ltn.com.tw/news/politics/breakingnews/5316667
被黃國昌嗆回去重讀法律 詹晉鑒：洩密責任不在時間長短,政治,2026/01/21 07:20,立法院19日召開軍購機密會議，由於涉及國安全程閉門秘密進行，怎料，民眾黨立委黃國昌卻將機密資料帶離會議現場被抓包，引起關注。（資料照）立院外交及國防委員會19日召開秘密會議，邀國防部長報告1.25兆國防特別預算內容，但民眾黨立委黃國昌離開會議室時竟攜出機密資料，引發輿論譁然。民進黨中正萬華市議員參選人「台派戰鬥雞」張銘祐（左）、律師詹晉鑒（右）昨到台北地檢署告發黃國昌，卻遭黃國昌嗆「回去重讀法律」，對此詹晉鑒直言「洩密責任不在時間長短」。詹晉鑒在臉書發文指出，「開完庭發現黃大立委在找我，黃國昌針對我方的告發，竟以『回去重讀法律』等傲慢言詞意圖轉移焦點」。詹晉鑒直言，「作為一名法律人，我深感遺憾，所以只好再次公開為黃委員複習他可能已經遺忘的法律規範」。請繼續往下閱讀...詹晉鑒強調，問題不在黃國昌「做了多久」，而是「做了什麼」。他也為此提出3點說明：其一，依《立法院議事規則》第50條明文規定，秘密會議之紀錄及決議，立法委員、列席人員及本院員工，不得以任何方式對外洩漏。其二，依《刑法》第109條（故意洩漏國防秘密罪）或第110條規定（過失洩漏國防秘密罪），洩漏或交付國防秘密，不以實際交付完成為必要要件，故意或過失皆可成立犯罪。詹晉鑒說明，法律對於國防機密的保護是絕對責任，當你身為立法委員，帶走軍購機密資料，只要這份文件離開了規定的區域，國安風險就已經產生，法律並沒有規定「不小心」就可以無罪。其三，根據《國家機密保護法》的規範，機密資料一旦脫離管制區，就構成了對機密完整性的侵害，黃委員自恃法學博士，難道不知道對於「國防機密」的守護，不容許有一秒鐘的空窗期嗎？詹晉鑒強調，是否涉及《國家安全法》，那是檢調機關依法調查的範疇。他也直言，法律責任的判斷不在「時間長短」，如果照黃委員的邏輯，只要事後歸還，先前的違法行為就能抹滅嗎？難道偷竊被抓到後30秒歸還，就不算竊盜？難道酒駕被攔檢，宣稱只開了30秒，就不算公共危險罪？詹晉鑒指出，法律從來沒有「30秒免責條款」，也沒有「被追回就當沒發生」這種說法，黃國昌這種「30秒不算犯法」的荒謬理論，難道你的法學博士是在卡提諾法學院學的嗎？    ,https://news.ltn.com.tw/news/politics/breakingnews/5316663
中天主播共諜案爆海馬士數據外洩 周軒：先進火箭恐成昂貴煙火,政治,2026/01/21 07:02,中天記者林宸佑。（資料照，記者劉信德攝）檢調近日偵辦中天新聞主播林宸佑共諜案，查出有現役士官兵涉嫌將去年七月甫成軍的美製「海馬士」多管火箭系統操作手冊、參數等機密外洩。林宸佑17日被高雄橋頭地院依涉犯國安法、貪污治罪條例等罪聲押禁見獲准。專家分析，若「作戰參數」與「系統極限數據」遭掌握，解放軍就能反推「死角」、進行戰術規避。政治工作者周軒發文直言，可能讓台灣花大錢買到的先進火箭系統，變成昂貴的煙火，美國也不知道會作何感想？周軒在臉書發文指出，現在看起來，中天記者林宸佑利誘國軍洩密給中國一事，不是只有嚴重而已，是有可能發展成動搖台美同盟的導火線。請繼續往下閱讀...周軒說明，由於此次涉案官兵包含新成軍的飛彈部隊，針對又是剛跟美軍購買的火箭系統，海馬士多管火箭系統。前空軍飛彈預警中心指管長、台灣智庫諮詢委員周宇平在接受媒體訪問時分析，最令人擔憂的是「作戰參數」與「系統極限數據」遭洩漏。一旦解放軍掌握這些數據，就能反推我軍火力的「死角」，進而進行戰術規避。周軒直言，換句話說，這一起案件，也可能讓台灣花大錢買到的先進火箭系統，變成昂貴的煙火。更令人擔心的是，如果參數真的外洩給中國，美國不知道作何感想？    ,https://news.ltn.com.tw/news/politics/breakingnews/5316660
台灣尚勇春聯炒熱台中選情 半小時500張就發光了,政治,2026/01/21 06:04,民進黨議員何文海發放台灣尚勇春聯，半個多小時就發完500張。（記者黃旭磊攝）台中市議員選情逐漸增溫，南屯區民進黨現任議員何文海與台中市長參選人何欣純合體拜年看板，廣受綠營支持者好評，何文海發放金色台灣尚勇春聯，民眾排隊搶500張，半個多小時就發完，由於網路出現「高達360元」春聯行情，何文海呼籲，春聯是春節祝福，不要在網路銷售。台中市南屯區現有4席議員，現任4人包括綠營何文海、藍營朱暖英及劉士州，還有無黨籍的吳佩芸爭取連任，綠營「南屯大叔」張耀中也參選形成「5搶4」局面，民進黨台中市黨部主委許木桂說，將在南屯提名2席參選擴大選區票源。請繼續往下閱讀...台中市議員何文海說，職棒會長、立委蔡其昌自掏腰包，印製金色台灣尚勇春聯實在熱門，半個多小時500張全數發完，接下來1月24日在楓樹里，與何欣純合辦親子拔蘿蔔田園嘉年華，兩梯次各有900多人報名，「過年前選情逐漸增溫」。職棒會長、立委蔡其昌印製金色台灣尚勇春聯。（資料照）    ,https://news.ltn.com.tw/news/politics/breakingnews/5316633
總預算案、國防特別條例仍無望付委》綠批藍白：拿國安做政治操作籌碼,政治,2026/01/21 05:30,民進黨立委沈伯洋昨痛批藍白覺得立法院最大，要凌駕憲法法庭、監察院，現在還想要直接把總統的權限拿到自己身上，自己要提軍購特別條例。（記者劉信德攝）立法院程序委員會昨日開會討論廿三日、廿七日院會議程，藍白再度以人數優勢，將議事日程草案提報院會處理。包括一．二五兆元的「強化防衛韌性及不對稱戰力計畫採購特別條例草案」、歲出規模三兆餘元的今年度中央政府總預算案，至今仍無法被排入議程，民進黨立委高舉「預算不能拖，全民都在等」、「台灣要安全，不要吳三桂」等手板表達訴求；國民黨立委也反擊，賴總統欠軍人薪水已廿天，編足預算馬上審。民進黨發言人韓瑩也痛批藍白，在野黨不顧國際情勢與國家防衛的需求，持續癱瘓預算審查，是否在「等中國同意」？請繼續往下閱讀...難道就是為了讓國民黨主席鄭麗文見到中共領導人？藍白兩黨一再犧牲國家的防衛、人民的安全，無疑是在拿國家安全作為政治操作的籌碼。政院：對國防量能 雙殺行政院發言人李慧芝也質疑，今年度國防部預算已有七五二億元因為總預算未審而無法執行，而立法院又再次阻擋國防特別預算，等於是對於國家國防量能的雙重封殺。行政院於去年八月廿九日將今年度中央政府總預算案函送立法院審議，至今超過四個月仍未付委審查，這也是憲政史上第一次在新年度開始後，總預算案仍未進入委員會審查。在會議主席、國民黨召委翁曉玲關鍵一票支持下，藍白最後表決以十票對九票，將未包括一．二五兆元的國防特別條例草案、今年度中央政府總預算案的議事日程草案提報週五院會處理，民進黨立委預料屆時就算提案增列也會再度被表決擋下，國防特別條例草案與今年度中央政府總預算案仍無望付委。民進黨立委郭昱晴指出，中央政府總預算案送立院審議後，至今已經被擋一四四天，藍白擔心審查軍購的時候，刪除預算被民眾看到，乾脆不審，藍白不幫忙划船就算了，還拿著槳要打同船的人，「這麼見不得台灣好嗎？」藍：編足軍人薪水預算就審 綠委：藍白想拿走總統權限國民黨團書記長羅智強反擊，賴總統已經欠軍人薪水廿天，違法的預算難道要立委們替行政院背書違法審查嗎？政院只要依法編足預算，馬上就能開始審查。民進黨立委沈伯洋當場反駁，藍白現在就是覺得立法院最大，要凌駕憲法法庭、監察院，現在還想要把總統的權限拿到自己身上，自己要提軍購特別條例，總預算也面臨相同問題。    ,https://news.ltn.com.tw/news/politics/paper/1740704
綠營北市長最強王牌？ 鄭麗君：考古題回答超過十年了,政治,2026/01/21 05:30,對於民進黨內屬意她參選台北市長，鄭麗君昨天在行政院記者會表示，「這是考古題了，我應該回答超過十年了，過去我的回答都算數。」（記者塗建榮攝）年底首都市長選戰，行政院副院長鄭麗君因對美關稅談判的亮眼表現，被民進黨內視為「最強王牌」。對於民進黨內屬意她參選台北市長，鄭麗君昨天在行政院記者會表示，「這是考古題了，我應該回答超過十年了，過去我的回答都算數，我是一個做什麼說什麼、說什麼做什麼的人」。我國爭取美國對台關稅十五％不疊加及二三二條款最優惠待遇，領軍談判的鄭麗君備受肯定，民進黨內意見也趨一致，傾向鎖定鄭出戰台北市長。請繼續往下閱讀...黨政人士日前表示，鄭麗君在文化與經貿領域的亮眼實績，以及卓越的政策論述能力，是能牽制國民黨籍台北市長蔣萬安「外溢效應」的最佳王牌，「但還是要尊重她的個人意願」。鄭麗君昨在「台美關稅談判說明記者會」回應媒體提問時說，「最後一題和今天主題無關，這是考古題了，我應該已經回答超過十年了，過去我的回答都算數，我是一個做什麼說什麼、說什麼做什麼的人」。鄭在文化部長任內及卸任文化部長後，曾多次被問及參選問題，但其回答幾乎都是「目前沒有參與選舉的想法。」    ,https://news.ltn.com.tw/news/politics/paper/1740708
趙少康新書發表 藍綠白談大和解咖啡,政治,2026/01/21 05:30,前中廣董事長趙少康昨天在立法院舉辦新書發表會，邀請藍綠白政壇重量級人士站台，場面相當盛大。（記者陳逸寬攝）前中廣董事長趙少康昨天在立法院舉辦「趙少康的時代現場七十少年新書發表會。立法院民眾黨團總召黃國昌出席致詞表示，卅年前，趙和已故的前民進黨主席施明德能坐下來喝大和解咖啡，不是為了個人和一黨之私，是希望幫國家開創新的道路；國民黨團總召傅崐萁也強調，朝野本來就應該要和解，大家要一起同心協力來守護國家才對。民進黨團總召柯建銘致詞時表示，前幾天趙少康傳簡訊邀請他出席新書發表會，他只有回答「OK」，「此時此刻我只想問一句話，什麼時候大和解咖啡續杯比較重要」，語畢獲得滿堂喝采。趙少康表示，如果有機會他也很願意，朝野一起喝大和解咖啡，對台灣、對中華民國是好事，政治不需要一直對抗。請繼續往下閱讀...黃國昌表示，趙少康和施明德有那個氣度、胸襟和視野，為了這個國家、為了台灣坐下來，跨越彼此政治上面的歧見，想要幫當時混濁的台灣政壇打出一個新的道路。卅年前的大和解咖啡，可以帶來很多的啟示與形式。昨也出席的立法院長韓國瑜表示，當年趙少康和施明德喝和解大咖啡，造成台灣政壇極大的震撼，趙開創了太多台灣民主不可思議的先河，實在值得後輩去學習、效法。針對趙少康表達願意促成藍、綠、白三黨喝「大和解咖啡」，國民黨主席鄭麗文昨天下午拜訪前總統馬英九後受訪表示，「喝咖啡我隨時候教、奉陪。」台灣不能再繼續內耗、惡鬥下去，希望能解開賴清德總統的心結，期盼朝野可以理性對話，但直到目前為止，她還沒有感受到民進黨的誠意。    ,https://news.ltn.com.tw/news/politics/paper/1740709
立院無直接向總統問責之權 》賴今明不列席彈劾審查會,政治,2026/01/21 05:30,總統賴清德確定不列席彈劾案審查會。（資料照）國民黨團、民眾黨團對賴清德總統提出彈劾案，立法院今、明兩天召開全院委員會，邀請賴總統就彈劾案說明，不過，立法院昨收到總統府回函，賴總統以「立法院無直接向總統問責之權，亦不能課予憲法所無之義務」為由，確定不列席彈劾案審查會。國民黨昨晚痛批賴總統把憲法當成「自助餐」，平常喊台獨，出事時抱憲法，成了躲在總統府的「縮頭烏龜」，拒絕列席，就是拒絕面對二千三百萬人民的民意。請繼續往下閱讀...賴總統回函指出，立法院十六日咨請本人列席今、明兩日全院委員會說明一案，依憲法法庭判決意旨，立法院無直接向總統問責之權，亦不能課予憲法所無之義務。為符憲政體制，爰不予列席。特此函達。藍白去年在立法院提案彈劾賴總統，立法院十四日、十五日召開首場公聽會，聽取朝野推派的專家學者及立委意見，並於今、明兩日召開全院委員會審查彈劾案，邀請被彈劾人說明十五分鐘後，由立委進行詢問。根據立法院「彈劾案相關事務及時程表」，當被彈劾人未列席審查會時，由各黨團推派的立委發言，每人發言十分鐘；國民黨團、民進黨團各推派十五人，民眾黨團二人。    ,https://news.ltn.com.tw/news/politics/paper/1740705
涉為中國發展組織判無罪 中配周滿芝更審逆轉改判8年刑,政治,2026/01/21 05:30,中配周滿芝被控接受中國資助在台灣發展組織，高等法院高雄分院更審審理後大逆轉，認定她觸犯國安法，昨改判有期徒刑八年。（資料照）「台灣新住民關懷總會」理事長周滿芝，被控接受中國資助在台灣發展組織，高雄高分院認為罪證不足，判決無罪；但高等法院高雄分院更審審理後大逆轉，依據國安局的情資調查報告，認定她觸犯國安法，昨改判有期徒刑八年。仍可上訴。依國安局情資調查報告 周在台成立組織 受中共資助掌控 請繼續往下閱讀...高檢署高雄分署指出，周滿芝原為「陝西省愛國主義志願者協會」成員，二〇一四年間入境台灣，婚後取得身分證，擔任「高雄市新住民姐妹關懷協會」和「台灣新住民關懷總會」理事長，同時加入對岸的統一戰線委員會，受「陝西省愛國主義志願者協會」等單位執行長崔國衛指示，在台發起及籌備成立分會。二〇一七年間，周女到中國會見湖南省統戰部長黃蘭香，尋求贊助在台灣發展組織；隔年五、六月間，她又赴對岸與崔等人見面，簽署「中華海峽兩岸民間愛國促統宣言」，同意在台進行統戰工作。高雄高分院根據調查局函文，查無中國官方對「陝西省愛國主義志願者協會」等單位實質控制等事證，檢方又未舉證周女直接或間收受來自對岸的資金，或有實際會晤中方統戰官員並獲資助，認定罪證不足。檢方不服上訴，高雄高分院更一審指出，據國安局的情資調查報告，「陝西省愛國主義志願者協會」等單位，係受中共統戰系統掌控，周女受指示在台成立「台灣新住民關懷總會」等單位，即為對方發展的附隨組織，已實質威脅中華民國自由民主憲政並危害社會安定秩序，認定有罪。    ,https://news.ltn.com.tw/news/politics/paper/1740752
前長榮航空駐中代表淪共諜 高院判六個月,政治,2026/01/21 05:30,長榮航空前駐中國代表喬思齊，涉嫌為中國情治單位向陸委會官員刺探、蒐集公務上應秘密的委外研究案資料，並試圖以十萬元現金行賄被拒絕。（記者楊心慧攝）長榮航空公司前駐中國代表喬思齊，涉嫌於二〇一二年至二〇一四年間，為中國情治單位向行政院大陸委員會官員刺探、蒐集公務上應秘密的委外研究案資料，並試圖以十萬元現金行賄遭拒；高檢署去年十月依違反國家安全法、貪污治罪條例等罪起訴。台灣高等法院昨宣判，依貪污治罪條例之行求賄賂罪判六月有期徒刑、褫奪公權一年，並沒收人民幣三萬元，可上訴。喬思齊涉行賄陸委會官員 刺探情資法務部調查局國安站獲報後報請高檢署指揮偵辦，檢方去年十月依「為中國地區行政、軍事、黨務或其他公務機構或其設立、指定機構或委託之民間團體刺探、蒐集關於公務上應秘密之文書」、「發展組織未遂」及「非公務員對於公務員關於違背職務之行為行求賄賂」三罪嫌起訴喬思齊。請繼續往下閱讀...高院認定，喬男犯後於偵查及本院審理時均坦承犯行，各應依修正前的國家安全法第五條之一第四條前段及貪污治罪條例第十一條第五項，減輕其刑。高院表示，喬男明知楊姓官員為陸委會官員，可與聞及接觸關於中國政策之研究及綜合規劃、中國情勢之研判等機密事項，明知中國地區中共政權是敵對勢力，不得為中國方面刺探、蒐集關於公務上應秘密文書或發展組織，卻仍協助中國進行情蒐及滲透任務。高院指出，考量喬男犯後坦白承認犯行，且楊姓官員警覺而未造成國家安全發生實害，及刑法第五十七條各款之量刑事項，處有期徒刑六月（不得易科罰金，但得依法易服社會勞動）、褫奪公權一年。    ,https://news.ltn.com.tw/news/politics/paper/1740747
