Title,News_Type,date,content,url
自由爆新聞》最新民調「挺賴清德」一數據創新高！街訪金句嗆爆藍：首都還在南京,政治,2026/05/27 20:34,全新的視界！新聞話題不漏接，快訂閱YouTube 【自由追新聞】，記得開啟小鈴鐺哦！    ,https://news.ltn.com.tw/news/politics/breakingnews/5451955
嗆鄭麗文別轉移焦點 趙少康：請解釋蕭旭岑與台商捧現金合照,政治,2026/05/27 20:00,國民黨主席鄭麗文主持中常會。（記者田裕華攝）前國安會祕書長金溥聰週一公布前馬英九基金會執行長蕭旭岑與台商韓螢煥的「手捧現金」照片。前中廣董事長趙少康今天專訪金溥聰時說，照片有兩種論述傳出，「一種是要跟馬英九交代、另一種是要跟北京交代」。對此，國民黨主席鄭麗文痛批歧視，「與台商為敵」；趙少康則說自己沒有歧視，請鄭麗文釐清、解釋合照，自己只是就事論事，不要轉移焦點。鄭麗文今天接受歷史哥專訪時說，台商都是台灣人，辛苦賺的錢，希望能夠捐給自己所支持的基金會，為什麼就可以上升到「扣紅帽子」的程度？難道我們要跟所有的百萬台商劃清界線嗎？請問跟台商接觸違反了哪一條法令？「台商就不愛台灣嗎？台商就不愛中華民國嗎？台商也是堂堂正正的中華民國國民啊！」難道他們的錢是不合法的、見不得光的嗎？請繼續往下閱讀...鄭麗文說，不能夠這樣的去歧視某一個族群，就好像民進黨看到陸配全面的歧視、打壓，這是違反中華民國憲法的，我們是一個尊重人權的地方。台商賺的是堂堂正正的錢，為兩岸的經濟做出奉獻，關心台灣的公共事務，何罪之有啊？在台灣，不能夠民粹到這種程度，難道我們要跟百萬台商為敵嗎？對此，趙少康說，蕭旭岑與台商捧著大把現金的照片曝光，因為拍這樣的照片實在太不合理，所以他訪問金溥聰時拋出「向誰交代」的疑問，沒想到被鄭麗文用「歧視某個族群」來解讀。趙少康說，「華僑是革命之母」其中又以台商為主，在國家有難時，總是熱心的出錢出力，他不只沒有歧視台商，還對台商的愛國情操深表敬意。只是，蕭旭岑跟台商會長捧現金合照，給外界的感覺就是要「拍照存證」，他只是就事論事，請鄭麗文不要轉移焦點！也請鄭麗文解釋他們為什麼要捧著大筆現金合照？鄭麗文不覺得這樣很奇怪嗎？趙少康說，根據金溥聰受訪時的說法，前總統馬英九對蕭旭岑與王光慈時常結伴前往大陸，感到很不心安。馬英九一生清廉自持，自然不希望有人打著他的名號，在任何地方收受來源不明的款項，也包括大陸，這才是違背馬英九的路線與意願。同時，釐清基金會財務，完全無礙「馬習會」成功以及馬英九致力兩岸和平發展的歷史定位。趙少康最後強調，他沒有要跟鄭麗文辯論的意思，但鄭不斷批評、挑戰他，所以他豈好辯哉，真的是不得不回應，以免被誤導。    ,https://news.ltn.com.tw/news/politics/breakingnews/5451897
柯文哲賣商辦坪數單價創新高 四叉貓：最愛喊居住正義的阿北炒房？,政治,2026/05/27 19:57,柯文哲的4300萬商辦被四叉貓爆料早就已經脫手。（資料照）民眾黨前主席柯文哲前年被抓包拿總統選舉補助款買了4300萬的商辦惹議，當時柯聲稱要買來給黨員當作辦公室使用，還說「用我的名字買監督的力道更大」。不過網紅「四叉貓」劉宇昨天（26日）爆料，這2年來該商辦根本就沒給民眾黨用過，而且早在上個月就賣出，賣出價加上這段時間收的租金，推估賺了200多萬。四叉貓今天（27日）又貼出歷史實價登錄，直指柯文哲賣出該商辦的單價創所在大樓的歷史新高，公開質疑柯文哲「炒房」！民眾黨在2024年總統大選獲得約1.1億元的總統選舉補助款，將其中3分之2（約7381萬）撥入柯文哲的個人帳戶。同年5月，柯文哲動用這筆款項中的4300萬元現金，一次付清買下位於台北市林森南路的濟南大樓商辦，並登記在自己名下。這件事被曝光之後，引發社會輿論熱議，柯文哲辯稱是要做為民眾黨的辦公室，之所以會買在自己名下，是因為這樣「更好監督」。請繼續往下閱讀...但馬上又發現，該商辦在柯文哲買下時，前立委羅福助昔日助理桂焌傑經營的「先發興業股份有限公司」（後改名為庭皓興業）早就承租並在裡頭營業。民眾黨回應稱，基於「買賣不破租賃」原則，讓原租客繼續承租至租約期滿（原定合約至2025年4月底，但後來該公司爆出欠租、約滿不肯搬走的狀況，經法院調解與訴訟，該公司已於去年9月正式搬離），之後再轉為「自用」。不過四叉貓昨天在臉書貼出「不動產交易實價查詢」截圖表示，這2年來該商辦根本就沒有給民眾黨用過，他去查詢還發現，商辦已經在今年4月10日以4380萬元賣出，賺了80萬，加上每月靠商辦收取的5萬多元租金，這2年下來可能賺了200多萬。今天四叉貓又貼出歷史實價登錄紀錄指出，「柯文哲這次賣商辦，坪數單價（89.8萬/坪，當初柯文哲購入為88.2萬/坪）創下中國航運大樓（濟南大樓）的歷史新高，我現在可以說『最愛喊居住正義的柯文哲炒高房價』嗎？不行的話我晚點再問一次。」網友紛紛表示，「小草他們會說不一樣，商辦不是住家，居住正義是要居住」、「$$入我口袋監督力量最大，草最懂的拔拉邏輯」、「居住正義原來只是口號」、「對他來說根本0成本大賺4000多萬」、「這對夫妻的道德觀念真的讓人不敢領教」、「柯貪污犯這麼鬼扯說謊的人，然後還有一堆人支持，難怪台灣做詐騙真的很容易賺飽飽」、「草：柯炒的是商辦，不是住宅，所以沒有違背居住正義」、「打房是口號，炒房是生活！」    ,https://news.ltn.com.tw/news/politics/breakingnews/5451611
搶攻產業界票倉！前進彰濱與中小企業交流  陳素月：我準備好了,政治,2026/05/27 19:54,民進黨彰化縣長參選人陳素月前進彰濱，與廠商進行交流。（記者劉曉欣攝）民進黨彰化縣長參選人、立委陳素月全面搶攻產業選票，今天（27日）前進彰濱產業園區鹿港區，邀請前經濟部長王美花演講，並聆聽中小企業的經營心聲。陳素月強調，她的產業政見已經準備好了，對於產業最憂心的缺工問題，她希望能夠把已經熄燈號的明道大學，變身為培力學院，培養人力也留住人才。王美花表示，她是彰化二水人，她認為在半導體、伺服器以外，無人載具產業是彰化縣中小企業未來發展的一大目標，不只讓傳統產業升級與轉型，而台灣零組件與產品，剛好符合許多國家都指定的非紅供應鏈，目前無人載具領域不只是應用在國防科技上，民用需求也很強烈。請繼續往下閱讀...王美花指出，彰化水五金產業特區仍在走都市計畫變更的程序作業，這是全國首見，一旦完成都市變更，水五金產業特區的合法身分，將有助於國際訂單與品牌的經營。今天有多位工廠老闆都點出，台灣少子化、加上高科技產業大舉擴廠的招工，最直接衝擊就是傳產人力短缺，因此，解決少子化拿出辦法是當務之急；而高科技產業當初也是靠著政府的扶植才能茁壯，傲視全球，希望現在政府能夠給予傳產更多的幫助，讓產業轉型與升級。對於產業界所提出的問題，陳素月強調，少子化是國安問題，中央正全力在解決，她在立法院也會協助。而無人載具產業的崛起，這是彰化傳產升級搶單的好時機，中央與地方政府也應該扮演關鍵的角色，要讓彰化人口不再流失，就要有產業的支撐力，她的產業政見都準備好了，希望透過產業升級，改善彰化勞工長期低薪的苦楚。前經濟部長王美花（前排右4）受民進黨彰化縣參選人陳素月之邀，來到彰濱進行演講。（記者劉曉欣攝）民進黨彰化縣長參選人陳素月聆聽廠商心聲。（記者劉曉欣攝）    ,https://news.ltn.com.tw/news/politics/breakingnews/5451885
黃光芹拋震撼彈！曝黃國昌自爆：傅崐萁說我可以搭檔副總統,政治,2026/05/27 19:40,黃光芹拋震撼彈，表示黃國昌（圖左）曾親口告訴她：「傅崐萁（圖右）跟我說，我可以搭檔副總統！」不過她也強調，傅崐萁本人已經傳達「沒有跟黃國昌這麼說。」（資料照）資深媒體人黃光芹與民眾黨主席黃國昌撕破臉，近日在臉書撰寫《我來說為什麼》系列文大爆料。今日她再拋震撼彈，表示黃國昌曾親口告訴她：「傅崐萁跟我說，我可以搭檔副總統！」不過她也強調，傅崐萁本人已經傳達「沒有跟黃國昌這麼說。」另外，她還聽時代力量昔日幕僚說，黃國昌經常提到，想到國民黨發揮「鯰魚效應」。「這一天或許不遠，他目前正在轉乘中。」黃光芹今日下午在臉書發文表示，身為媒體人她律己甚嚴，不公開別人的簡訊、不轉述與人的私下談話、不透露消息來源。若因這次她罕見破戒，致使她的採訪對象，突然不信任她，「我完全概括承受。」請繼續往下閱讀...黃光芹表示，本日的爆料，她早先有預示標題，也已接獲傅崐萁總召傳達：「我沒有跟黃國昌這麼說！」黃光芹指出，這麼久以來，她均未向傅總召求證，尊重他的否認和澄清。「但我一字不改，是因為黃國昌當下就是這麼跟我說的，我不能改。」黃光芹說，她從不私下竊錄，她料定黃國昌絕對否認，那也就沒有抱怨她透露私下談話內容的權利，「兩者他可以二擇一。」黃光芹表示，自民眾黨成立至今，除了上《民眾之聲》之外，她只有2次走進台玻大樓。其中一次就是因看不慣黃國昌經常修理媒體，跟周榆修提了4點建議，結果被黃國昌找了去。黃光芹回憶，那次談話，原本認為可以15分鐘說完的事，後來搞了超過2個小時。她透露，黃國昌不習慣聆聽，自己才說了個頭，黃就要人先聽他說，而且不容打斷和插嘴。她指出，當黃國昌說出「傅崐萁跟我說，我可以搭檔副總統！」當下其實她蠻訝異的，但也證實了自己先前的揣測。黃光芹表示，像黃國昌這樣一位政黨領袖，因柯文哲落難而臨危授（受）命，接下從天上掉下來的這個政黨，並且毫無底線地搞藍白合，不惜將民眾黨小藍化，一定有他的道理。對一個只有8萬票民意基礎的前立委，一旦因藍白合打開政治局面，猶如劉姥姥進大觀園。如果真如他日前所說，完全站在中研院樓頂為大局，也就罷了。「問題是，他想搭檔副總統，為的是私利。因此，當日前看到他的聲明，我是百感交集。」黃光芹指出，黃國昌不像柯文哲，在司法纏身前有全國的民意支持度。黃國昌就算想複製2024藍白合模式，他不是柯文哲，當然挾黨以自重。這也是他急於膨脹，硬要公布自己是可以勝選最大市新北市長的原因。她當時聽完黃國昌自爆，只回了一句「那你的仇恨值得降低」。黃光芹表示，黃國昌的主席任期到今年底結束，若柯文哲官司無法解套，不可能回任黨主席，民眾黨還在黃國昌的手中。自柯文哲走出看守所後，柯、黃、周榆修結成決策「鐵三角」，柯多次出面力挺黃，「搞不好日後他也會出面打我」；但就她看來，黃與柯，一個望梅止渴、一個飲鴆止渴。柯文哲別無他法，民眾黨泡沫化危機，可能提前到來。黃光芹最後指出，過去時力爆出黃國昌想選總統的錄音檔，如今她曝黃國昌想搭檔副總統。之前，她還聽時力黃的昔日幕僚說，黃國昌經常提到，想到國民黨發揮「鯰魚效應」。這一天或許不遠，他目前正在轉乘中。    ,https://news.ltn.com.tw/news/politics/breakingnews/5451808
和藍白不同調！政院版兒少成長津貼帳戶 不立專法、不修法,政治,2026/05/27 18:59,行政院政務委員陳時中今表示，兒少成長津貼帳戶以作業要點方式處理，維持彈性。（記者鍾麗華攝）賴總統宣布發放0到18歲的成長津貼5000元，其中6至18歲一半發現金，一半存入兒少成長津貼帳戶，行政院政務委員陳時中今表示，此部分不會修法或另立專法，而是以作業要點方式處理，以維持彈性。至於預算部分，主要仍以公務預算支應，目前沒有以舉債方式支應的規劃，但最終仍須由主計單位進一步整體評估財政安排。立法院社福及衛環委員會今天續審國民黨團、台灣民眾黨團擬具「台灣未來帳戶特別條例草案」，及民進黨立委郭國文等18人擬具「台灣兒童及少年投資儲蓄帳戶條例草案」，對於行政院是否修法或另提專法送審，陳時中表示，藍白提專法恐涉財政與憲政爭議，而行政院推動兒少成長津貼帳戶，不會修法或另立專法，而是以作業要點方式處理。請繼續往下閱讀...行政院發言人李慧芝說明，由於該制度屬行政給付，與限制人民權利的干涉行政不同，因此在法律上不必然需要專法授權，現行行政實務中，包括育兒津貼、就學補助及中央擴大租金補貼等，也都是以行政給付方式執行。若以行政命令方式，是否有法制完備性的疑義？未來如果換黨執政，或者是換人執政，政策是否有延續性？而藍白提出的專法三讀後，要如何處理？陳時中表示，即使立法後，未來若政策需要調整，仍須再修法，因此立專法與行政命令在本質上並非完全不同。行政命令更能因應未來財務狀況及受益人需求調整內容，也維持彈性。而且專法要增加預算，「國家財政都亂了」。因應少子女化與人口結構挑戰的最新18項戰略，預估一年新增2050億元預算，總計將挹注3800億元，未來是否舉債因應？陳時中說，將由公務預算支應，目前並沒有計畫用舉債來支付，不過，仍要看主計總處對財務的安排。    ,https://news.ltn.com.tw/news/politics/breakingnews/5451795
台中市生育津貼六都墊底 議員要求比照雙北標準,政治,2026/05/27 18:59,市議員何文海表示，台中市生育津貼比不上其他五都。（市府提供）台灣少子化嚴重，很多縣市政府都以提高生育津貼來鼓勵民眾生小孩，民進黨中市議員何文海表示，市長盧秀燕一再說台中市是宜居幸福城市，而台中市又是全國第2大城市，但是台中市生育津貼卻是六都最後一名，如何增加生育率？要求台中市政府福利比照雙北標準。台中市長盧秀燕表示，補助的縣市不見得可以留住民眾，很多補助很多的縣市反而民眾外移的很多，生育津貼多寡未必跟增加人口有關，要知道民眾真正在乎什麼，如台中市公托是6都最便宜，民眾考量不光是生育，還有養育的問題。請繼續往下閱讀...市議員何文海昨天在市議會指出，根據6都市政資料，各直轄市生育獎勵金存在明顯差距，台中市更是六都之末。他指出，台北市首胎補助4萬元、2胎4萬5千元、3胎5萬元。新北市從今年起調整為首胎4萬元、2胎4萬5千元、3胎5萬元。桃園市則為首胎3萬元、2胎4萬元、3胎5萬元，多胞胎每名加碼1萬元。高雄市不分胎次每胎皆發放3萬元；台南市首胎及2胎2萬元，3胎及4胎3萬元，5胎以後5萬元。何文海表示，在今年實施新制，首胎與次胎補助卻依然停留在2萬元，3胎後則增加1萬元，跟其他五都相差太大。何文海表示，當年輕夫婦決定生養「第一胎」，考慮非常深，若無吸引力，難以打動願意生育的心。此外，何文海認為中台灣各縣市存在緊密的通勤與生活圈關係，若台中市在生育預防性福利上未能展現優勢，恐面臨周邊人口外流與磁吸效應，建議市府應研擬比照雙北或桃園標準，逐步將首胎補助提升至3萬至4萬元，並編列相關預算，以具體政策展現鼓勵生育的決心。台中市今年生育津貼新措施，首胎及次胎二萬，第三胎再加一萬元。（市府提供）    ,https://news.ltn.com.tw/news/politics/breakingnews/5451749
一貫道親被抓國台辦批造謠抹黑 陸委會再籲避免赴中國,政治,2026/05/27 18:57,陸委會再次呼籲一貫道道親避免前往中國。（資料照）海基會22日揭露，5月又有3名台灣一貫道道親在福建與廣東遭中方以不明理由限制人身自由，呼籲台灣道親千萬不要再赴中。中國國台辦今（27）日稱，中國鼓勵支持兩岸各領域交流往來，民進黨出於政治私利，在惡意炒作、造謠抹黑中國。對此，陸委會強調，這些道親赴中國只是宣揚中華傳統文化，講述四書五經，中共卻仍將一貫道視為邪教，非法逮捕拘禁甚至判刑，再次呼籲一貫道道親避免前往。海基會秘書長羅文嘉22日在例行記者會上說，自2019年以來，國人因宗教原因遭中國拘禁的案件共計17件、19人，其中一貫道就佔了13件、14人，比例甚高。一貫道道親傳播的教義皆屬四書五經、不涉及政治，但在中國共產黨眼中被視為洪水猛獸。除海基會多次示警外，一貫道民間組織「發一崇德道務中心」亦發函給海內外道場，明確禁止道親前往中國，以免遭受拘留審判。請繼續往下閱讀...國台辦今天舉行例行記者會，被問到是否能證實3名台灣一貫道親被拘禁，以及具體原因？對此，陳斌華稱，中國一貫鼓勵支持兩岸各領域交流往來，依法保護台灣同胞的正當權益。只要不從事違法犯罪活動，台灣同胞往來中國不必有任何顧慮。陳斌華指稱，民進黨出於政治私利惡意炒作，造謠抹黑中國，企圖製造寒蟬效應，阻撓破壞兩岸交流合作，升高兩岸對立對抗，不得人心，不會得逞。陸委會指出，自2024年1月1日迄今，接獲台灣一貫道道親赴中國後，遭中共有關部門逮捕關押者已有17人。即使這些道親赴中國只是宣揚中華傳統文化，講述四書五經，中共卻仍將一貫道視為邪教，非法逮捕拘禁甚至判刑。由於中共近年持續打壓宗教自由與人權的手段變本加厲，政府必須再次呼籲一貫道道親避免前往，以免遭中共關押。    ,https://news.ltn.com.tw/news/politics/breakingnews/5451819
賴瑞隆、邱議瑩帶路訪美濃 蔡英文：高雄很適合一來再來,政治,2026/05/27 18:43,蔡英文品味六龜山茶。（賴瑞隆團隊提供）前總統蔡英文今再度走訪高雄，由立委賴瑞隆、邱議瑩帶路，體驗美濃米製作的飯捲、品嘗六龜山茶，她開心表示，高雄真的很適合一來再來。繼4月到高雄果嶺與陳其邁、賴瑞隆健行野餐，蔡英文對高雄的熱情與在地風土念念不忘，這次受立委賴瑞隆、邱議瑩邀請，再次走訪高雄，只是這回沒爬山，而是深入田野感受農業魅力。請繼續往下閱讀...除兩位立委陪同，高市議員林富寶、市議員參選人林慧欣也到場，美濃農會總幹事鍾清輝更親自介紹台灣常見米種，蔡英文則嘗試以美濃147米製作飯捲，笑說：「很久沒自己做飯了」；她表示上回到高雄是走進草地與漁港，這次是直接走進農村日常，高雄真的很適合一來再來。賴瑞隆說，美濃是台灣重要農業重鎮，素有「食材珠寶盒」美譽，各式農作物都是高雄的驕傲；其中「147號」更是高雄區農業改良場育成的第一個香米品種，年年獲得國內外獎項。邱議瑩則介紹美濃農會推動的「米存摺」，讓農友可領用契作良質米，地產地銷，讓農民家庭能吃到自己土地種出的好米，這樣的制度正是在地農業最珍貴之處。除體驗米香，六龜區新發社區發展協會理事長湯嘉富也向蔡英文介紹六龜原生山茶，並當場讓蔡英文感受山茶魅。賴瑞隆表示，六龜山茶的故事，讓更多人看見高雄山城的韌性與生命力，前幾天到日本拜會友台政要時，就是以六龜山茶等高雄農產加工品作為伴手禮，讓在地農產品助攻「城市外交」。蔡英文打趣表示，每次和賴瑞隆合體，好像都在吃東西；賴瑞隆趕忙回應，高雄實在有太多美食，而小英根本是「美食家」。美濃農會總幹事鍾清輝親自向蔡英文介紹台灣常見米種與美濃農特產。（賴瑞隆團隊提供）蔡英文以美濃147米製作飯捲，笑說「很久沒自己做飯了」。（賴瑞隆團隊提供）    ,https://news.ltn.com.tw/news/politics/breakingnews/5451805
新聞360》民眾黨「民調狂瀉」又爆新爭議！他曝：幾乎放棄了,政治,2026/05/27 18:42,全新的視界！新聞話題不漏接，快訂閱YouTube 【自由追新聞】，記得開啟小鈴鐺哦！    ,https://news.ltn.com.tw/news/politics/breakingnews/5451846
走出大罷免低谷！賴清德5月民調現黃金交叉 滿意度成功逆轉,政治,2026/05/27 18:31,總統賴清德。（記者田裕華攝）資深媒體人黃暐瀚今天（27日）在社群分享最新國政民調，結果顯示總統賴清德的滿意度從去年6月開始算起，尤其是大罷免結束後雖經歷一段低潮，但近一年時間逐步上升，到現在終於出現「黃金交叉」，執政滿意度首次超越不滿意度！根據《美麗島電子報》今公布的5月國政民調，賴清德的執政滿意度為45.7%，較上月（44.5%）上升1.2個百分點；不滿意度為44.9%，較上月（47.5%）下降2.6個百分點。而且這是賴總統自2025年6月以來，首次出現執政滿意度首次超越不滿意度的黃金交叉，黃暐瀚表示，這又回到了去年大罷免前的狀態。請繼續往下閱讀...從黃暐瀚分享的折線圖可以看到，賴清德的執政滿意度在去年3月曾達到55.6%高點，當時不滿意度為40.6%。大罷免期間明顯受到重挫，去年6月其民調首次出現「死亡交叉」（滿意度44.7%、不滿意度46.8%），8月份更是跌入執政以來的最低谷，不滿意度飆升至60.5%，滿意度崩跌至31.0%。但後續賴清德民調開始呈現「不滿意度漸落、滿意度緩升」的爬坡趨勢，進入2026年後，不滿意度從年初的52.2%逐漸收斂，直到今年5月（44.9%），終於落回去年6月大罷免爆發前的水平（當時為46.8%），也讓滿意度成功重回領先位置。此外，黃暐瀚也分享《震傳媒》公布的最新民調，賴清德的施政滿意度為47.7%，較上月（45.3%）增加2.4個百分點；不滿意度為40.0%，較上月（43.8%）下降3.8個百分點。     在 Threads 查看    ,https://news.ltn.com.tw/news/politics/breakingnews/5451710
南投去年藝文類娛樂稅收不到500萬 田馥甄2場巡演貢獻近半,政治,2026/05/27 18:28,田馥甄2場「田調」巡演，是南投縣去年藝文活動類娛樂稅的最大貢獻者。（資料照，何樂音樂提供）南投縣府公告本月22日起藝文活動、競技比賽、風景遊樂區等停徵娛樂稅，這幾項停徵後，南投縣娛樂稅收將大減一半。據了解，南投縣藝文活動、遊樂區都不多，尤其收費的藝文活動更少，去年藝文活動娛樂稅收不到500萬元，而最大貢獻是知名藝人田馥甄在暨大的2場「田調」巡演，佔該項目近半。財政部修正娛樂稅部分條文，僅保留高爾夫球場、舞廳舞場，及包括網咖、密室逃脫、KTV、夾娃娃機等9項娛樂場所課稅，而像藝文活動、風景遊樂區、競技比賽，從本月22日起停徵娛樂稅。請繼續往下閱讀...南投縣府稅務局指出，南投縣娛樂稅收不多，近年娛樂稅收一年約5000萬元，最大宗就是遊樂區繳交的娛樂稅，但這兩年國旅不景氣，遊樂區的營收也減少，像縣內一家最大的遊樂區，極盛時期徵收的娛樂稅有2000多萬元，但現在只剩1700萬元，5月22日開始停徵遊樂區、藝文活動和競技活動的娛樂稅，未來南投縣娛樂稅收將減少一半。稅務局也說，縣內沒有大型表演場館，售票藝文活動也很少，自然娛樂稅收也少，去年400多萬元，而貢獻最大的就是知名歌手田馥甄的2場「田調」巡演，這2場在國立暨大校園舉辦的演唱會，不只帶來歌迷在埔里等地的消費，且繳交的娛樂稅就有200萬元，佔了藝文項目稅收將近一半。    ,https://news.ltn.com.tw/news/politics/breakingnews/5451817
