Title,News_Type,date,content,url
蕭美琴放眼2040：「捍衛現狀」是台灣追求未來願景基石,政治,2026/06/24 11:38,副總統蕭美琴接受美國《大紀元時報》美國思想領袖（American Thought Leaders）節目專訪，今天播出。（圖由總統府提供）副總統蕭美琴接受美國《大紀元時報》美國思想領袖（American Thought Leaders）節目專訪時表示，國家安全不能只依賴強化國防，需要全社會齊心協力，並將目光投向2030與2040，直言捍衛現狀是台灣追求未來願景的基石，台灣在美國「再工業化」及「AI領導地位」可發揮實質作用，持續深化台美夥伴關係。蕭美琴指出，「全社會防衛韌性」是賴總統非常重視的一項國政願景，雖然我國在軍事投入大量資源強化國防，但國家安全需要全社會齊心協力，包含資安防護及關鍵基礎設施的保護，所謂韌性是指社會遭遇各類衝擊及日常生活的干擾後迅速復原的能力，透過持續建構韌性，台灣才得以迅速復原，並確保社會的凝聚力能長期維持。請繼續往下閱讀...蕭美琴說明，「全社會防衛韌性」的概念，除了前述的資安及關鍵基礎設施等領域外，亦涵蓋通訊韌性、物資儲備及關鍵供應鏈保護等面向，需要包含私部門在內的社會各界共同投入，以在艱難時刻相互扶持。台灣已充分展現此特質，也因而蛻變為一個更強大、更具韌性的社會。當被問到對2030年的台灣有何想像及願景，蕭美琴表示，台灣人共同努力的目標就是打造一個和平、穩定、民主且強大的台灣，讓人民對自己的國家更有信心。我們在地理規模或許是小國家，但人民努力讓台灣成為一個偉大的國家，希望在推動科技進步、促進人類福祉，或維護區域和平穩定等方面扮演重要角色，並希望與國際社會維持緊密連結。若將目光放遠至2040年，蕭美琴指出，我們將地緣政治的「現狀」視為區域內所有利害關係人的最大公約數；而捍衛現狀，並確保區域的穩定、和平與繁榮，是我們追求未來願景的基石。台灣和台灣人民對自己能在世界上扮演的角色越來越具信心，不僅在理念與價值上站在良善的一方，並透過公共衛生、永續發展及社會韌性等面向對國際社會做出貢獻，同時也能深化與美國的合作。    ,https://news.ltn.com.tw/news/politics/breakingnews/5482177
中國新法限縮全世界言論自由 民進黨團：對自己國家這麼沒自信？,政治,2026/06/24 11:29,民進黨立院黨團今早召開輿情回應記者會。（記者羅沛德攝）中國「民族團結進步促進法」將在7月1日生效，當中規定境外人士或組織，若破壞國家統一、民族團結，都將依法追究責任。對此，民進黨立院黨團幹事長莊瑞雄今（24）日質疑，中國限縮全世界的言論自由，是對自己國家多沒自信？中國頒布「民族團結進步促進法」新法，其中第63條規定「中華人民共和國境外的組織和個人，若被認定從事破壞民族團結或民族分裂行為，依法追究責任」，外界擔憂全世界挺台言論被納入爭議範圍，引發寒蟬效應。請繼續往下閱讀...民進黨立院黨團今早召開輿情回應記者會。莊瑞雄表示，中國看起來對自己的法律充滿自信，寫出來後竟管到全世界去，難道是對自己國內、全世界各國人的民主自由，非常懼怕？言論自由在民主國家非常正常，是一般人民生活的日常，也是最基本的底線；不管是在哪個民主國家，都實實在在受到確保。莊瑞雄說，中國用自己國內的法律，企圖對言論自由進行審查，除了是對民主自由充滿恐懼，也是想針對不同人的看法，用法律產生一種威嚇，相信這在國際社會的評價非常糟糕，怎麼會一個國家對自己這麼沒有自信？    ,https://news.ltn.com.tw/news/politics/breakingnews/5482172
未依法申請集會遊行...... 游智彬在金溥聰住家旁抗議 遭警舉牌警告,政治,2026/06/24 11:25,新黨台北市第6選舉區（大安、文山）議員候選人游智彬（右）在國安會前秘書長金溥聰住家旁舉辦記者會，警方在旁舉牌警告。（記者蔡愷恆攝）新黨台北市第6選舉區（大安、文山）議員參選人游智彬今（24）在國安會前秘書長金溥聰住家旁舉辦記者會，公布前總統馬英九的行為觀察表，並揚言號召全民到金溥聰住家抗議、抵制。不料，台北市警局派駐十餘名人力在旁勸導，並表示活動沒有依集會遊行法申請，是違法行為，並現場勸導、舉牌警告一次。記者會在勸導聲下隨即結束。游智彬出示爆料公社網友匿名公布的馬英九的行為觀察表，怒批「馬英九沒有虧待你啊！中華民國沒有虧待你啊！金溥聰為什麼要這樣利用一個病人去踐踏國民黨、踐踏馬英九、踐踏中華民國？」請繼續往下閱讀...游智彬說，馬英九除了忘記作息、忘記總統任期或是出訪中國時間，也在生活很讓人擔心難過，如沒有刮鬍子、短袖襯衫內搭配polo衫，找不到皮夾、手機等日用品。新北市前議員金介壽提到，今天藉由爆料公社的行為觀察表來提醒金溥聰實在是情非得已。金介壽說道，金溥聰一路受馬英九提拔，從台北市副市長到駐美代表，再到國安會秘書長都是高薪；金溥聰應該恩將恩報！怎麼能恩將仇報？游智彬與金介壽也最後感謝現場警察在旁保護，文山一分局警方則無奈舉著「警告行為違法」牌子，並說活動未依集會遊行法申請，經舉牌警告一次後記者會即結束。新黨台北市第6選舉區（大安、文山）議員候選人游智彬今（24）舉辦記者會。（記者蔡愷恆攝）    ,https://news.ltn.com.tw/news/politics/breakingnews/5482159
「制服地圖」創辦人成沈伯洋幕僚？ 徐巧芯酸：綠營瞎挺很像大罷免,政治,2026/06/24 11:25,國民黨立委徐巧芯質疑，號稱資安專家的沈伯洋竟找來此人負責網路社群，到底是對方吹牛還是沈識人不明，應趕快說清楚。徐更狂酸沈伯洋選舉表現荒腔走板，綠營內部卻盲目瞎捧，跟大罷免時期真的很像。（「千秋萬事」提供）媒體爆料涉嫌大量盜用未成年學生照並涉及偷拍的「制服地圖」創辦人江舜智，竟成為民進黨台北市長參選人沈伯洋的競選網站操刀手。對此，國民黨立委徐巧芯質疑，號稱資安專家的沈伯洋竟找來此人負責網路社群，到底是對方吹牛還是沈識人不明，應趕快說清楚。徐更狂酸沈伯洋選舉表現荒腔走板，綠營內部卻盲目瞎捧，跟大罷免時期真的很像。據媒體報導，涉及大量盜用未成年學生照片，並涉及偷拍的「制服地圖」江舜智，搖身一變成為沈伯洋的網站操刀手，徐巧芯指出，沈伯洋不是說自己是資安專家？不是一直在講他對各種認知作戰、網路上的事都非常熟悉？卻找來這樣的人負責網路社群媒體，到底是這個人自己在吹牛，還是真的識人不明，把他找進競選團隊。請繼續往下閱讀...徐巧芯更酸，沈伯洋在這次的選舉，可以說是荒腔走板，蹭無人公車議題，說早在一個月前提配套，但被北市府打臉，去年就向議會說明內容，但最離譜的是，民進黨立委陳培瑜在記者會喊出，要沈伯洋像韓國天團BTS提前退場跟粉絲合影，沈伯洋旁邊的人全部都是瞎捧一通，只要意見不同就出征別人，跟大罷免時期真的很像。民進黨想要抓基本盤，但40％的同溫層越牢固，等於把另外的60％主流民意，推得遠遠的，這是綠營的最大危機。民進黨新北市長參選人蘇巧慧妹妹「蘇巧純」補助案，被質疑涉嫌違反利益迴避，蘇競辦回擊國民黨立委葛如鈞才是公司股東。徐巧芯表示，葛如鈞沒有申請任何國家政府的補助，如果只要有投資就是有問題，根本邏輯不通，投資的人是依法投資，只要今天持有這個公司相關股票的人都有問題，「那別人可以放棄，你要不要全數放棄？」徐巧芯強調，大家質疑的是，蘇巧慧妹妹自稱負責人，卻違反了「公職人員利益衝突迴避法」，拿了政府標案卻沒有揭露，這才是問題核心，而不是有沒有政治人物投資這家公司，爸爸當行政院長，女兒當立委，另一個女兒投標政府的標案沒有揭露，這才是問題。在野黨質疑都是有事實證據，有公開的文件佐證，就是有違反利益衝突法的嫌疑，政府行政部門某種程度還去配合，對於索資調查一拖再拖。至於立陶宛新任總理抱怨「台灣晶片投資沒兌現」，對台表達不滿，徐巧芯說，要問的事情是之前政府到底承諾要給多少？雖然在民進黨執政期間，邦交國數量不斷減少，可是外交預算是不斷增加的。外交部長林佳龍最喜歡講他們做的是總合外交，現在別人要轉向的時候，還是在講「歡迎」，「民主價值」比得上現在立陶宛要發展經濟的趨勢？恐怕在台立外交關係上，我方是出了麻煩。駁徐巧芯、不認識「制服地圖」創辦人 沈伯洋競辦：網站開發由「食夢黑貘」統籌    ,https://news.ltn.com.tw/news/politics/breakingnews/5482154
行銷台灣農產品 陳亭妃喊靠自己：不用靠政治影響、中國影響,政治,2026/06/24 11:21,民進黨立委、台南市長參選人陳亭妃今（24）日赴新北市板橋區合體黨籍立委、新北市長參選人蘇巧慧，行銷台南芒果。（記者黃子暘攝）民進黨立委、台南市長參選人陳亭妃今（24）日赴新北市板橋區合體黨籍立委、新北市長參選人蘇巧慧，行銷台南芒果。陳亭妃表示，台灣農產無論是鳳梨釋迦、芒果，都可以到各處產銷合作，「靠自己就可以了」，真的不用靠政治影響，或是用所謂中國的影響。蘇巧慧則說，板橋交通方便、人口眾多，是台灣重要的產銷平台，未來會保持與各地產銷合作，強強聯手，讓消費者享用台灣最好的農產品。蘇巧慧指出，台灣農民技術非常好，政府近年也大力支持農產，有良好的冷鏈、檢疫技術，讓台灣農產品可以推廣到全世界；板橋交通方便、人口眾多，是台灣重要產銷平台，未來會持續保持與產地產銷合作，強強聯手。請繼續往下閱讀...陳亭妃表示，板橋農會超市與網路通路很受歡迎，感謝蘇巧慧與新北市板橋農會協助行銷台南芒果，希望未來新北、台南持續女力強強聯手，讓大家看到這些優質的農產品，而且必須說，「我們靠自己就可以了」，未來無論是芒果或台東的鳳梨釋迦，很多相關產品都可以到各處產銷合作，真的不用靠政治影響，或所謂中國的影響。民進黨立委、台南市長參選人陳亭妃今（24）日赴新北市板橋區合體黨籍立委、新北市長參選人蘇巧慧，行銷台南芒果。（記者黃子暘攝）    ,https://news.ltn.com.tw/news/politics/breakingnews/5482156
被指過度索資 林延鳳批蔣「威權又無能」：敢公布藍營議員索資施壓？,政治,2026/06/24 11:19,民進黨北市議員林延鳳。（資料照）民進黨台北市長參選人沈伯洋日前接受媒體專訪指出，公務員在意索資問題，議員要資料占了很多時間，把索資SOP化、把這件事情變簡單，就可以實質減壓。北市府回應，年度索資量排名第一不是民進黨籍市議員林延鳳就是簡舒培。林延鳳今（24）日批評，曾有國民黨籍市議員被爆利用索資施壓，蔣市府敢不敢公布？台北市長蔣萬安把索資拿來當作政治鬥爭工具，只會凸顯自己威權又無能。台北市政府副發言人蔡畹鎣昨表示，蔣萬安上任以來，年度索資量排名第一的議員，不是簡舒培就是林延鳳，若沈伯洋真心希望減輕公務人員負擔，或許應該先和身旁黨內一起掃街的議員們溝通，從減少過度索資做起。請繼續往下閱讀...林延鳳表示，本會期她辦公室從4月8日開始算到現在是40件，數量可能排不上前三名，但問政內容與議題曝光度是精實的，應該不是問最多，而是剛好問到市府最不想回答或是答不出來的，如果這樣也能被蔣市府拿來政治攻擊，那就當作蔣市府是在肯定她問政精準，「這份謬讚我會收下也會繼續努力，不辜負市府的『高度關注』」。林延鳳提到，蔣萬安別忘記自己黨籍議員中有幾位，曾被媒體報導把索資當作對局處施壓、為廠商護航與取得標案或是涉入司法案件調查的，蔣萬安把這些統計也算進來？敢不敢公布他們索資內容？林延鳳強調，索資是基於問政監督，不為個人也不護航，心中坦蕩無懼，蔣萬安不要用什麼「不是第一就是第二」這種既不具體不專業、又無從查核的話術來轉移焦點；何況，現在該討論的，不是哪個議員索資幾件，而是內容。她說，沈伯洋提出的，就是把索資流程SOP化，透過AI和數位工具協助整理、查找、回應資料，讓公務員不用每次都被資料追著跑，也讓議員監督市政更有效率，對基層公務員，可以減輕負擔；對市民，也能讓資訊更透明、更快被回應。她批評，蔣萬安完全沒回應SOP制度本身可不可行，也不談流程怎麼優化、效率怎麼提升、資料怎麼數位化，反而忙著點名特定議員，想要扣上「索資欺負公務員」的帽子，請問議員沒索資，公務員就都不會離職了？公務員的缺額都會補足了？還是只有藍白議員索資是監督，綠營議員索資是施壓？蔣萬安把索資拿來當作政治鬥爭工具，只會凸顯自己威權又無能。林延鳳說，議員索資是法律保障的監督權，反映的是問政密度與深度，市府如果真的心疼公務員，就應該檢討為什麼內部資料沒有更系統化、數位化？為什麼承辦每次收到詢問，還要一通一通打去次級單位確認數字？為什麼跨局處橫向協調還是這麼卡？而不是反過來，把氣出在提出制度改革建議的人身上，「蔣萬安把議員監督當麻煩，把問政當打擾，把建議改革講成政治鬥爭，卻還裝作自己尊重制度與民主，這才是真正讓人覺得噁心的地方」。    ,https://news.ltn.com.tw/news/politics/breakingnews/5482112
期待中國政治開放卻換來倒退 蕭美琴喊話各國：互動須納入現實考量,政治,2026/06/24 11:18,副總統蕭美琴接受美國《大紀元時報》美國思想領袖（American Thought Leaders）節目專訪，今天播出。（總統府提供）副總統蕭美琴接受美國《大紀元時報》美國思想領袖（American Thought Leaders）節目專訪時表示，許多國家仍期待與中國交往能帶動其政治體制的開放，但外界預期的開放與進步並未發生，某些領域甚至出現倒退，各國在思索如何與中國適切互動時，必須將現實納入考量；談到台灣人均GDP是中國3倍，蕭強調，台灣更深信民主、自由才是推動經濟成長的動能。被問到加拿大與中國共產黨建立某種戰略夥伴關係，蕭美琴表示，加拿大無疑是與我國理念相近的重要夥伴，台灣也積極尋求各項契機，期盼建立更多元的雙邊關係。近年來台加經濟關係、教育合作持續成長，雙方也在航行自由、海上安全及資安防護等許多核心共同利益領域展開合作，台灣樂意在這些共同利益領域，與全球所有理念相近國家深化合作，並將以務實態度持續推動各項交流。請繼續往下閱讀...蕭美琴坦言，當台灣試圖建立夥伴關係時，不免遭遇因中國脅迫所造成的限制與阻礙，但我國非常珍惜那些能夠抗衡這類脅迫，並抵抗中國企圖孤立及迫使台灣屈從壓力的國家，且絕不將他們的支持視為理所當然。展望未來，我國仍將持續敞開大門，積極拓展與世界各國的新夥伴關係，其中當然也包括加拿大。蕭美琴指出，當前全球多數國家與中國在經貿上皆有一定程度的連結與往來。自冷戰結束後，許多國家抱持著希望與期待，認為與中國交往不僅能促進其經濟自由化，或許還能帶動政治體制的開放。然而，即使中國的經濟顯著成長，但外界預期的政治開放與進步卻未發生；相反地，在某些領域甚至出現倒退。因此，在思索如何與中國適切互動時，必須將此現實納入考量。被問到中國向來被宣傳為經濟成功的典範，但台灣的人均GDP是中國的3倍？蕭美琴坦言，中國自1990年代推動經濟改革開放以來，確實取得顯著成長。然而，台灣更深信民主體制能帶來實質成果，民主不只是一個理想，而是以規則為基礎的秩序、法治、基本人權，以及創新與展現創造力的自由，這些要素才是推動經濟成長的動能。在中國持續宣揚社會主義與共產主義體制之際，台灣堅守信念，深信經濟自由、市場經濟，再加上對我國社會至關重要的政治自由，才是真正能回應人民需求的制度。    ,https://news.ltn.com.tw/news/politics/breakingnews/5482152
看板被「挖臉打包走」 鍾沛君哭笑不得：先等我連任好嗎,政治,2026/06/24 11:15,鍾沛君看板臉被挖走。（鍾沛君提供）台北市議員鍾沛君的選舉布條在端午節連假期間遭人毀損，經查是一法國籍男子所為，嫌犯稱有藝術價值要帶回創作。鍾沛君也透過臉書回應表示哭笑不得，她說她的臉能被有效利用是榮幸，「但答應我，先等我順利連任好嗎」？「議員的臉不見啦！」鍾沛君今（24）日凌晨在臉書發文表示，端午連假時助理通知她，剛掛上不到一個月的看板，標語、電話、姓名俱在，唯獨臉被割下帶走，徒留個黑洞，她嚇了一條，摸不透對方什麼用意，只能先報警。請繼續往下閱讀...所幸，安和所的員警非常專業的循線找到「兇手」，這位法國人聲稱她的看板「能激發創作靈感」，還選在清晨下手，短短90秒內將她的臉「打包帶走」；鍾沛君說，不告而取當然得賠償，對方如數給付後，唯一要求是想要那張被他外帶的臉，讓人哭笑不得。鍾沛君也說，其實每次大選後，她都會將看板贈送給需要的民眾，因此她的臉蓋過田埂、遮過漏水、擋過風雨，「能夠再有效利用是我的榮幸，但答應我，先等我順利連任好嗎」？    ,https://news.ltn.com.tw/news/politics/breakingnews/5482126
秦慧珠批殷瑋遭藍營側翼圍剿 張育萌：不爽國民黨雙標就要被鬥,政治,2026/06/24 11:15,國民黨籍北市議員秦慧珠。（資料照）台北市府研考會主委殷瑋日前在台北市長蔣萬安總質詢時直接與議員對槓，引發各界討論，國民黨台北市議員秦慧珠批評殷瑋「弱化蔣萬安」，卻遭親藍粉專「政客爽」攻擊，發起「拒投秦慧珠」活動，秦慧珠昨再發長文反擊。台灣青年民主協會理事張育萌對此發文感嘆，藍營護航巨嬰蔣萬安，竟然能鬥到發起「拒投秦慧珠」落選運動；他也直言秦慧珠只是不爽國民黨自己雙標，就要被鬥到回家吃自己，這個黨打包也真的剛好而已。張育萌在臉書發文指出，藍營粉專政客爽發起「拒投秦慧珠」，還叫她回家吃自己。這匿名粉專一口氣考古到 2010 年，當時郝龍斌跟蘇貞昌選台北市長，秦慧珠只是說蘇貞昌跑得很勤快，要郝龍斌多加油。現在也被直接翻出來，變成是政客爽指控秦慧珠是「利己主義者」的鐵證。請繼續往下閱讀...張育萌表示，2022年林奕華要接台北市副市長，秦慧珠喊話「馬上辭職」讓大安區立委補選。這樣也不行。同年，王鴻薇可以爽參選立委補選，秦慧珠同樣身為議員，抱怨說「我被當了24小時的備援投手」。這些過往事蹟現在通通被抓出來算總帳。政客爽痛罵秦慧珠「沒有好位置、沒機會選立委，就會跳出來幹自己人」。對此秦慧珠直接反擊，她就是不爽「官員對抗民意代表」。秦慧珠不爽蘇貞昌的答詢方式，也認為卓榮泰院長現在對立委是「戰狼姿態」。張育萌直言，「我不認同秦慧珠這個觀點」，但在秦慧珠的世界觀，官員就是要有「素養和風度」，不能跟議員互槓，也當然不能「反質詢」。張育萌指出，按照這樣的標準，她直接點名殷瑋是「研考會主委」，這個職位負責的是各局處考核，是「幕後組」。在殷瑋之前，研考會主委是俞振華，後來升官當市府副秘。但你我對俞振華一定沒什麼記憶點，因為他不會跟議員爆吵，也幾乎不會搶答，這是秦慧珠不滿殷瑋的主因。現在政客爽發動總攻擊，秦慧珠也沒在客氣、直接反擊，一一細數政客爽罵過趙少康，也罵過黃敬平。秦慧珠嗆說，做梗圖醜化都還可以尊重，但這次政客爽發起「落選運動」，就是「意圖使人不當選罪」的5年以下徒刑。秦慧珠直接點名，政客爽的主持人據說在台中市政府，所以盧秀燕要查清楚。張育萌提到，目前戰局最新進度是，政客爽直接回嗆說秦慧珠是「阿嬤」，還反諷說「議員好大我好怕哦！」然後，接下來就是人身攻擊了。政客爽跟秦慧珠對賭，請秦慧珠趕快告它，如果告不成「到時候選舉照不准幫自己修圖」。政客爽還叫秦慧珠「誠實面對自己，那些修圖修到可怕的照片，不是每個選民眼睛都業障重」。張育萌對此諷刺，「熟悉的國民黨最對味——每次選舉一到，國民黨不內鬥，好像就渾身不對勁」。他也強調，「我完全不想替秦慧珠背書。但議員的天職不就是監督市政嗎？台北市的執政黨就是國民黨啊，不監督國民黨，啊是要監督誰？」張育萌表示，記得蔣萬安還在當立委的時候，質詢蘇貞昌美豬進口，結果被蘇貞昌反問「你在美國吃豬肉嗎？」蔣萬安只能支支吾吾說「我⋯⋯我不會⋯⋯吃豬肉⋯⋯吃這麼多的美國豬⋯⋯」。如果國民黨為了蔣家金孫同仇敵愾，認為這叫「反質詢」，那同樣的道理，為什麼反嗆議員和搶答找架吵，就可以在台北市議會上演？張育萌在文末也酸，蔣萬安還真的是大baby，只要有心，誰都可以是護航蔣寶寶的保母團。秦慧珠只是不爽國民黨自己雙標，就要被鬥到回家吃自己，這個黨打包也真的剛好而已。    ,https://news.ltn.com.tw/news/politics/breakingnews/5481883
