Title,News_Type,date,content,url
打死酒友辯精神疾病發作 法官未採信判刑12年,社會,2026/02/21 10:53,法官則依現場人證及其應訊時反應，認定其犯案時未受病情影響，依傷害致死罪，判處有期徒刑12年。（記者吳昇儒攝）基隆一名林姓男子前年2月20日下午在光一路、華二街口與高姓酒友飲酒，雙方突然發肢體衝突。高男被林男強行掐脖撞擊水泥橋墩，重拳揮打，送醫搶救後不治。林男向法官辯稱，因精神疾病發作，且出自正當防衛才動手傷人。法官則依現場人證及其應訊時反應，認定其犯案時未受病情影響，依傷害致死罪，判處有期徒刑12年。檢警調查，案發當時林男與高男及另一名酒友，在光一路、華二街口飲酒，雙方突然發生衝突，高男倒地後，雙方才分開，約過一分鐘後，各自坐回原位；未料，隔沒多久，又發生第二次衝突。林男掐住高男脖子後，往水泥橋墩推撞，導致高男頭部受到重擊。請繼續往下閱讀...林男持續揮拳猛打對方頭部及身體，導致高男倒地不起，經送醫搶救一小時後，高男因頭部外傷併顱內出血而死亡。林男應訊時，向檢察官表示，自己抵達現場沒多久，就被高男巴頭，還拿酒瓶攻擊，出於正當防衛才把他推開，沒想到過於大力，將其推到橋墩。而林男辯護人也補充，林男經鑑定後，醫師認定其有心智缺陷，審理期間始終有妄想、邏輯鬆散等情況，應適用刑法第19條第2項規定減輕其刑，另也主動跟員警說出實情，屬於自首，應得減刑。法官調閱現場監視器畫面發現，第一次衝突結束後，林男理應離開現場，卻又留下與高男發生第二次衝突；畫面中可見兩人同時起身，林男先將高男推開使其退後，再積極以手掐對方脖子，並將其推到橋墩前持續攻擊，顯然與正當防衛要件不符。此外，林男經精神鑑定時，醫師判斷其屬於思覺失調症患者，但並不因林男罹有該疾病，就認為他所作所為都受到疾病影響。法官認為，不能憑醫學專家鑑定作為判決唯一依據，應以林男犯罪行為時狀態而定，而在場證人也指稱當天林男精神狀況很正常，像正常人一樣，未像偵訊時胡言亂語；事後更辯稱自己是受到攻擊，才會反擊並主張正當防衛，可見非受疾病影響而無故、無法自控攻擊死者。法官認為，林男所為已觸犯傷害致死罪，判處有期徒刑12年，全案仍可上訴。    ,https://news.ltn.com.tw/news/society/breakingnews/5347088
搭計程車掉錢包迅速找回 新加坡女大生感動：台灣人真善良熱心,社會,2026/02/21 10:48,以交換學生身分來台讀書的新加坡籍林姓女大學生（中）順利找回錢包。（警方提供）以交換學生身分來台讀書的新加坡籍林姓女大學生，20日晚間搭乘計程車到桃園市大園區找同學，卻將錢包遺落在計程車上，錢包內有證件、現金，讓她非常緊張，急忙向大園警方求助，還好警方只花了15分鐘就聯絡上計程車司機，迅速找回林姓女大學生的錢包。警方說，24歲的林姓女大學生當晚搭車到大園區中正西路，下車後，她驚覺錢包掉了，嚇了一大跳，急忙前往大園派出所向警方求助，警員蘇柏魁檢視林姓女大學生手機內的叫車系統紀錄後，鎖定計程車的車號，短時間內就聯絡上計程車司機，而計程車司機則早已發現後座有遺留的錢包，也正準備開車到派出所交由警方協尋失主。請繼續往下閱讀...林姓女大學生拿回錢包後，不斷向警方與計程車司機道謝，還感動地說：「台灣人真的好善良、好熱心，讓她留下難忘的春節假期回憶！」    ,https://news.ltn.com.tw/news/society/breakingnews/5347092
女自撞命危卡車內 消防力拔車門仰頭摔！目擊民眾喊要安太歲,社會,2026/02/21 10:46,自小客自撞，車門卡死。（記者劉人瑋攝）今早8時許，台11線發生一起嚴重的自小客自撞事故，女駕駛一度失去生命跡象，肇事車輛車門卡死，都蘭消防分隊警義消到場救援，為了將車門移除，警消雙手猛扳卻勢不可止，抱著被拔除的車門仰頭摔，所幸終能順利將駕駛救出。而目擊的鄭先生說，要不是車輛撞到門口石頭，自己就遭殃，「等下要到廟裡安太歲」年約40歲的女駕駛今早近8時許，由台11線北上路過富山國小時，不知何故車輛突偏離車道、駛向路邊，駕駛一度失去生命跡象，被救出後，始對聲音有反應，然仍意識不清，現已後送急救，警方目前仍在釐清其身分及肇事原因。請繼續往下閱讀...都蘭分隊警義消獲報後立即趕赴現場，但車頭已毀、車門卡死，從後方鑽入亦難將駕駛座放倒救出患者，以破壞器剪破車門連結處仍有部分難以完全剪除，只能徒手硬搿。隊員游政昊雙手死抓車門往後猛扳，剎時車門應聲脫除，但游政昊勢不可止、仰頭摔倒，所幸游執勤時已戴上頭盔，後方救護隊員手中長板背也順勢「捕接」並無大礙。但車頭方向仍扭曲嚴重，被破壞的車門還是提供更多空間以供援救，最終女駕駛透過長背板塞入車中，由右後側車門送出。目擊者鄭先生表示，由於新年期間少有收垃圾，早上9時垃圾車終於要來，所有人都忙著準備，自己當時背對馬路，只聽見碰撞聲，扭頭瞬間見到車輛先是撞到自家門口前的石塊後又再偏移，最終撞到前方路燈停下。鄭先生門口的石塊並不大，卻起了「石敢當」作用，他說，迄今想到還是全身起雞皮疙瘩，自己屬雞、今年犯太歲卻還沒進行儀式，「等下要到廟裡安太歲」。自小客自撞，車門卡死。（記者劉人瑋攝）隊員賣命硬扳車門，仰天後摔。（記者劉人瑋攝）最終還是由後側車門送出，但原本破壞的駕駛座車門也提供更大作業空間。（記者劉人瑋攝）最終還是由後側車門送出，但原本破壞的駕駛座車門也提供更大作業空間。（記者劉人瑋攝）鄭先生說，肇事車先是撞到石頭才又偏移。（記者劉人瑋攝）今早終於輪到這裡收垃圾，鄭先生說，想不到倒個垃圾差點出大事，要去安太歲。（記者劉人瑋攝）    ,https://news.ltn.com.tw/news/society/breakingnews/5347087
移工邀3同鄉搭便車 遇警攔檢他狂奔逃逸！原來是......,社會,2026/02/21 10:37,警方壓制狂奔逃逸的越南籍失聯陳姓移工。（警方提供）越南籍失聯陳姓移工20日深夜11點多，酒後駕駛轎車載著3名同鄉準備去搭車，卻因轎車懸掛已註銷車牌，引來桃園市桃園警分局巡邏員警攔查，豈料陳男將車停下後，立即打開車門狂奔逃逸，只跑了100公尺就被逮，不知他是失聯移工的3名同鄉則都看傻了眼。警方表示，青溪派出所員警巡邏經過桃園區桃鶯路時，發現懸掛註銷車牌的轎車，便趨前示意陳男停車受檢，陳男停下車後，立即狂奔逃逸，留下車內3名越南籍移工一臉茫然；3人告知警方，他們20日晚間聚餐時才結識陳男，因陳男主動邀他們搭便車，他們才上車準備去搭車，「根本不知道他為何要跑」。請繼續往下閱讀...陳男跑出100公尺，就被警方追上並壓制，原來陳男去年已被通報失聯，而陳男滿身酒味，原來是聚餐時喝了酒後還開車，酒測值達0.44MG/L，訊後已被警方依觸犯公共危險罪等送辦。    ,https://news.ltn.com.tw/news/society/breakingnews/5347082
新年壓歲錢當心被騙走 北市去年最多詐騙方式就是假投資,社會,2026/02/21 10:32,警方逮捕到假扮成「理財專員」、去向被害人面交取款的車手。（資料照）過年期間許多民眾都會包紅包給長輩、小孩，不少人會將拿到的壓歲錢拿來儲蓄、投資、購物。對此，台北市警方在新春期間呼籲，民眾拿到紅包後要當心詐騙集團，小心壓歲錢被人騙走，尤其台北市去年度發生的詐騙案件中，第一名的詐騙手法就是假投資。北市警指出，打擊詐騙近年來成為警方的重點工作項目，北市警在2025年共攔阻詐騙2525件，阻詐金額達26億5486萬元，設定的警示帳戶共有11470個。雖然警方宣導防詐、強力打詐，更聯合金融機構加強阻詐，但去年度發生在台北市的詐騙案仍有19396件，財損金額高達161億9757萬元。請繼續往下閱讀...北市警統計，去年度發生的詐騙案件中，前3大詐欺手法分別為假投資4900件、占25.26%；假網路拍賣3716件、占19.16%；購物詐欺2515件、12.97%。警界指出，假投資通常會跟假交友手法連結，詐騙集團會潛伏於社群網站、交友軟體或通訊平台，投放大量詐欺廣告，或是亂槍打鳥胡亂傳訊息，透過噓寒問暖、長期關懷等話術建立信任關係，再誘騙民眾加入「投資群組」，並以偽造獲利截圖、群組成員配合演出等手法，刻意營造「穩賺不賠」的假象，讓民眾誤以為投資真有其事，進而投入資金。警方呼籲，民眾過年後拿到壓歲錢，千萬要當心這些常見的詐騙手法，尤其投資一定要循正規管道，如有疑問要向警方或165反詐騙專線求助。    ,https://news.ltn.com.tw/news/society/breakingnews/5347072
蘇花公路火燒車一家4口逃生 北上交通1小時後排除障礙,社會,2026/02/21 10:20,蘇花公路113.9公里處，今天凌晨發生火燒車，車內4人及時逃生。（圖由讀者提供）蘇花公路113.9公里東澳路段，今天（21日）凌晨發生火燒車，轎車上一家四口及時逃生，這起事故一度造成春節連假北上交通受阻，宜蘭縣消防局派員撲滅火勢，車子已燒得面目全非，事發1小時後排除障礙，恢復正常行駛。宜蘭縣消防局凌晨0時49分獲報，直指蘇花公路113.9公里處發生火燒車，派遣南澳及觀音分隊人員滅火，消防人員到場時，起火轎車變成一團火球，現場陷入火海，所幸車內邱姓駕駛等4人早一步逃出。請繼續往下閱讀...據了解，這輛自小客車從南澳往蘇澳方向行駛，行經事發地點不明原因起火，此時北上車陣動彈不得，沿線大排長龍，消防人員佈線射水，1點14分撲滅火勢，1點52分排除障礙，起火原因尚待調查釐清。蘇澳警分局表示，60歲邱姓駕駛駕車搭載家人北上，不料行進時車輛突然起火，呼籲駕駛人開車上路前務必檢視車輛狀況，春節期間車潮湧現，請遵從警方指示行駛，維護行車安全。消防人員抵達現場時，起火車輛已陷入火海。（圖由讀者提供）宜縣消防人員撲滅火燒車火勢後，車子已燒得面目全非。（圖由警方提供）    ,https://news.ltn.com.tw/news/society/breakingnews/5347070
懷疑前妻被載走 苗栗男把煙火加螺絲釘丟擲「土製炸彈」,社會,2026/02/21 10:00,懷疑前妻被載走，苗栗男把煙火加螺絲釘丟擲「土製炸彈」。圖為苗栗地院。（資料照）男子阿喜（化名）因懷疑前妻被另名男子阿德（化名）載離，阿喜不滿兩人接觸，前往香鋪購買煙火後加入螺絲釘等物後製作成「土製炸彈」後，阿喜去年9月間前往阿德住處丟擲一枚未爆炸、另一枚引爆時閃燃巨大火花；苗栗地院法官近期審理後，依非法製造爆裂物罪，判處阿喜有期徒刑8年，併科罰金4萬元，罰金如易服勞役，以1000元折算1日；阿喜又犯非法使用爆裂物未遂罪，處有期徒刑10個月。判決書指出，阿喜購買煙火後加工填裝螺絲釘作為增傷物，之後再利用紅土、紙片封口並以膠帶緊密纏繞，並置放爆引（芯）作為發火物，製造結構完整、具有殺傷力、破壞性的「土製炸彈」。請繼續往下閱讀...鑑定人指出，阿喜製造的「土製炸彈」內的火藥經秤重為20.4公克，火藥量不少具顯著殺傷力，並依該「土製炸彈」包裝方式判斷應是人工纏繞，且加工程度已經與原廠出廠的市售煙火完全不同。阿喜則稱，並未見過、恐嚇阿德，雖購買煙火但未製作爆裂物；辯護人稱，阿喜點燃的其中一物並未引爆，鑑定人鑑定時也未實際引爆，無法證明該物是否確實爆炸、造成殺傷力、破壞性，且鑑定人只是拆解觀看便推斷出具殺傷力、破壞性，否認該物屬爆裂物。阿喜案發時前往阿德住處，點燃改裝「土製炸彈」丟向對方座車，音導火芯燃燒至中途熄滅，未釀成災禍；阿喜隨後往前行駛後丟擲第二枚「土製炸彈」則引發閃燃巨響。法官認為，包括創製、改造、組合、混合、化合等行為屬製造爆裂物，第一枚土製炸彈熄滅僅是偶發障礙，加上阿喜曾自白要警告阿德等語，故依法判刑。    ,https://news.ltn.com.tw/news/society/breakingnews/5347025
清晨4時馬路放煙火被阻止 竟改往租屋處放險釀火災,社會,2026/02/21 09:40,24歲鄭男在自家陽台放煙火，險釀成火災，警方隨即派遣鶯歌分駐所警力趕赴現場。（記者楊心慧翻攝）新北市鶯歌區育賢街今（21）日清晨傳出施放煙火聲響，驚擾附近住戶安寧，沒想到是一名24歲鄭姓男子在自家陽台放煙火，險釀成火災，警方隨即派遣鶯歌分駐所警力趕赴現場，消防人員亦同步到場協助處理，鄭男涉嫌違反《爆竹煙火管理條例》，後續已移由鶯歌消防分隊依權責續行辦理。有網友在社群網站Threads指出，有民眾原在馬路上放鞭炮，他告知不要放，結果該男子竟躲回家放，清晨4點實在很擾民，「這種放法跟頑劣的性格確定不用將人帶回警局嗎？」請繼續往下閱讀...新北市警察局三峽分局指出，清晨4時10分接獲110通報，指育賢街一處住宅有人在陽台施放煙火，經會同消防人員並徵得房東同意後入內查看，在該戶陽台發現施放後的煙火殘骸。經查確認，租客24歲的鄭男在陽台放煙火。現場雖未造成火災或人員傷亡，但深夜施放煙火已影響周邊住戶安寧。三峽警分局表示，員警已依規定查證身分並抄登相關資料，本案因於集合住宅陽台施放煙火，涉嫌違反爆竹煙火管理條例，後續已移由鶯歌消防分隊依權責續行辦理。警方也提醒，施放爆竹煙火應遵守相關法規及安全規定，切勿於集合住宅或易引發危險之場所施放，以免觸法並危及公共安全。    ,https://news.ltn.com.tw/news/society/breakingnews/5347015
驚！ 海釣客突落海險溺斃 海巡火速搶救脫險,社會,2026/02/21 09:26,男子春節釣魚突踩空落海，海巡火速搶救脫險。（海巡署提供）驚！農曆春節險傳憾事，2名男子大年初四（20日）到彰化縣線西鄉塭仔港附近岸邊海釣時，其中1名男子突然腳滑踩空跌落海裡，在海面上載浮載沉並呼喊「救命啊！」友人見狀趕緊就近向海巡署中部分署第三岸巡隊求救，岸巡人員火速趕往現場以拋繩袋將他救上岸，腳部血流如注，火速將他送醫治療後脫險。海巡署中部分署第三岸巡隊塭仔安檢所指出，這起驚險事件發生在昨天下午2點多，2名男子在春節期間的大年初四前往塭仔港附近海釣，不料其中1人突然失足落海，適逢漲潮期間海面風浪大，男子在海上漂浮，情勢相當危急，幸友人就近向他們求救，立即派遣人員攜帶救生救難裝備前往救援。請繼續往下閱讀...塭仔安檢所人員抵達塭仔泊區，發現男子於水面載浮載沉，立即以拋繩袋及魚雷浮標實施救援，3分鐘後即將民眾援救上岸，經檢視男子意識清楚，僅手腳擦挫傷，實施傷口消毒處置後，將其送往彰濱秀傳醫院治療，解除危機。第三岸巡隊指出，所幸平日宣傳若民眾發生危難、救生或救難等案件，可撥打海巡118免費服務專線，男子的友人就是撥打118專線求救，才避免不幸憾事發生，足見宣導奏效；民眾如欲從事水域遊憩活動，建議下載「Go Ocean」海洋資訊平台App，瞭解各縣市海域狀況，以降低危安風險，確保遊憩安全。男子腳部血流如注，海巡人員緊急包紮。（海巡署提供）    ,https://news.ltn.com.tw/news/society/breakingnews/5347030
新北樹林三德街住宅火警 動員23車49人救出60歲女住戶,社會,2026/02/21 09:22,新北市樹林區三德街26巷3號今（21）日清晨發生住宅火警，新北市消防局凌晨4時01分接獲報案，立即派遣大批人車前往搶救。（記者楊心慧翻攝）新北市樹林區三德街26巷3號今（21）日凌晨發生住宅火警，新北市消防局凌晨4時01分接獲報案，指現場一棟5層樓建築物的5樓冒出大量濃煙，立即派遣23輛消防車、49名消防人員前往，救出一名約60歲女性住戶。消防人員到場後，發現5樓室內明顯起火燃燒，隨即佈設水線入室灌救，全力控制火勢，火勢於凌晨4時19分撲滅，燃燒位置為客廳雜物，燃燒面積約5平方公尺，未進一步延燒至其他樓層。請繼續往下閱讀...救援過程中，消防人員於屋內救出一名約60歲女性住戶，所幸無明顯外傷，意識清楚，為求慎重起見，仍由救護人員預防性送往板橋亞東醫院檢查。本次火警消防局共出動23輛消防車、49名消防人員投入救災。至於詳細起火原因，仍待消防單位進一步調查釐清。新北市樹林區三德街26巷3號今（21）日清晨發生住宅火警。（記者楊心慧翻攝）    ,https://news.ltn.com.tw/news/society/breakingnews/5347022
大逆轉！突因「預謀殺妻」遭訴離 鑑定方知愛子竟是小王種,社會,2026/02/21 09:16,新竹陳女以先生張男在臉書貼利刃照片暗喻計畫殺妻為由，向新竹地院訴請離婚，張男去作親子鑑定後確認孩子竟是小王的種，也反訴提告休妻，新竹地院判准。（情境照）新竹陳女以先生張男在臉書貼利刃照片暗喻計畫殺妻為由，向新竹地院訴請離婚，沒想到開庭後案情大逆轉，張男說原本親友都認為孩子跟他完全不像，他收到妻子的離婚訴狀後才恍然大悟，去作親子鑑定後確認孩子竟是小王的種，也反訴提告休妻，新竹地院判准。陳女說，先生張男生活習慣不良又沉迷於打電動，將家庭環境搞得亂七八糟，屢勸不聽，去年2月15日張男在臉書上張貼一把鋒銳利刃照片，並寫「人家送的，找一天試用看看。如果有一天我離開了，請不要太意外，花錢捅了這一刀，這種感覺…我夾在中間也累了該徹底結束。等我把事情處理完，如果還在的話，會找大家聚一聚」等語，造成她與家人精神恐慌，需時刻注意張男行為，晚上睡覺必須鎖門，害怕張男意圖殺妻。因此提告請求休夫。請繼續往下閱讀...張男則說，家人發現他與孩子長相毫無相似之處，他在收到妻子離婚訴訟文書後，才去做親子鑑定，確認孩子不是他的，他因此情緒崩潰，陷入憂鬱與焦慮，且嚴重缺牙，牙醫表示此乃因長期處於高度壓力及睡眠不足所致。他憤而訴請休妻並求償50萬元。法官調查，陳女於婚姻關係存續中，與不明人士外遇生子，所為顯已違反婚姻忠誠義務，嚴重侵蝕動搖婚姻信賴基礎，婚姻已生重大破綻，且先生直到她訴請離婚後始知悉孩子不是自己的，審理期間亦未見夫妻有何良性互動，可見夫妻感情已嚴重破壞，難期復合，婚姻顯已有重大破綻且難認有何回復之希望，判准離婚。且判陳女需賠償先生50萬元。    ,https://news.ltn.com.tw/news/society/breakingnews/5346965
私裝監視器拍住戶出入  管委會提告排除侵害勝訴,社會,2026/02/21 09:11,私裝監視器拍住戶出入，管委會提告排除侵害勝訴。（情境照）新竹陳姓男子在自家外牆裝設2個監視器，24小時全天候監控社區住戶出入，管委會提告要他拆除，他卻拒拆，新竹地院法官認為他這麼做已使住戶日常進出活動完全暴露於其掌控下，就算鏡頭未朝向車道出入口，但監視器鏡頭顯可經由控制，任意轉動攝影方向，最後判陳男應全數拆除。竹市某公寓大廈管理委員會指控，陳男113年5月3日明知未經管委會同意下，擅自在社區共用走道牆壁上方公共空間，裝設2個監視器鏡頭及底座，分別朝C棟後門出入口及地下室出入口拍攝，長期監視住戶生活作出入家門時間等「非公開活動」，故意不法侵害住戶隱私權，管委會依住戶規約及社區監視器調閱管理規定辦法，請被告拆除，被告竟置之不理，管委會只得訴請排除侵害，以保社區全體住戶權益。請繼續往下閱讀...陳男則說住家後面常有隨地便溺、敲打窗戶騷擾事件發生。監視鏡頭皆攝以側窗邊並非人行走道，不會侵害其他住戶的隱私權，只有宵小不軌之人才會走過去。法官認為，大樓外牆構造上具有維持建物安全與外觀視瞻功能，性質上屬全體區分所有權人共有共用部分，不是陳男可單獨自由處分的專有部分。陳男擅自在外牆鑽孔設機，客觀上已妨害全體共有人對該外牆的完整使用。管委會依住戶規約及社區監視器調閱管理規定辦法要求陳男拆除，於法有據。法官指出，隱私權之保護，不以「私密空間」為限。現代社會中，個人於公共場域的活動資訊（如出入時間、對象），若經他人以機器設備長期、持續錄影監控，將使個人生活作息無所遁形（即資訊拼圖理論），足以對被監控者產生心理壓力，構成對「居住安寧」的侵害。陳男雖抗辯是為了防盜，然而管委會在該公共空間已有既定監視器，陳男私人架設監視器，24小時連續錄攝車道出入口，已使住戶日常進出活動完全暴露於其掌控下。陳男雖抗辯鏡頭未朝向車道出入口，但監視器鏡頭顯可經由控制，任意轉動攝影方向。最後法官判陳男應拆除2個監視器鏡頭及底座。    ,https://news.ltn.com.tw/news/society/breakingnews/5346963
台東酒醉路倒男跳進警車 開40餘公里、警開2槍車禍被逮,社會,2026/02/21 09:00,嫌犯撞車（警方提供）台東一名有酒、毒駕前科葉姓男子酒醉路倒，警方原以為是為民服務前往協助，葉嫌以脫糞為由「屎遁」不想上救護隊擔架，踩過水田一身泥跑掉，想不到警車鑰匙沒拔，葉嫌就此鑽入警車開走，路上狂飆40餘公里、又被警方開2槍，最後與民車對撞才終於被逮。警方表示，20日晚上9時許，119轉報池上鄉忠孝路與忠仁路口有民眾疑似酒醉路倒，發現是當地年約40歲葉男（酒、毒駕前科）。員警處理期間，葉嫌趁隙進入未熄火之巡邏車駕駛座，於晚上9時49分駕車逃逸遭警方攔截圍捕，該車沿台9線北上行駛，晚上10時40分於台9線初鹿段，與一自小客車碰撞，致葉嫌與對方車內2人受傷送醫，葉嫌肋骨斷了數根受傷送醫。請繼續往下閱讀...由警方陳述內容，葉嫌還是開著警車逆向南竄，但從民眾錄影可知，當時葉嫌對著救護人員大喊「等一下！」、「屎要出來了」，錄影民眾竊笑「真的，他屎出來了」。想不到隔了數十分鐘，葉嫌竟獨自穿過滿是泥的水田邁向警車，民眾還大喊「警車有沒有鎖？」、「被開走要寫悔過書」。民眾說著說著，葉嫌就開走警車，又引得民眾大喊「真的開走了！」、「超帥！還記得打方向燈」。警車被開走後，警方也試著攔截圍捕，但葉嫌一路開了時速破百，以台9線多架測速照相情況，警方表示「應該拍了不少警車照，但不能確定」、「要等同事上班才能統計」。途中還在月眉被派出所員警攔下，葉嫌本假意配合，待警方上前時反而加速逃逸，執勤員警對警車開2槍仍被其逃脫，直到南下約20多公里處葉嫌撞車才停下。分局表示，本案因員警執行酒醉路倒戒護勤務期間，涉案男子趁隙駕駛巡邏車逃逸，分局深切檢討，同時全面檢討勤務流程與車輛管理機制，強化教育訓練，杜絕類案再發生。嫌犯撞車（警方提供）    ,https://news.ltn.com.tw/news/society/breakingnews/5346961
