Title,News_Type,date,content,url
傳台資助美軍升級駐菲基地、陸軍司令密訪？ 陸軍駁斥：並非事實,政治,2026/03/07 18:09,陸軍司令呂坤修上將2月26日前往北部地區視導換裝部隊訓練實況。（陸軍司令部提供）美、日、菲三國軍艦上週於南海與巴士海峽展開聯合巡航，航跡首度逼近台灣南側水域。有媒體稱，在美方強化第一島鏈防衛的協調與串聯下，台灣與菲律賓軍事合作檯面下正逐漸白熱化，甚至傳出美方建議由台灣挹注資金，協助升級美軍位於菲律賓的軍事基地，陸軍司令呂坤修上將更為此於2月密訪菲國。針對相關傳聞，陸軍司令部今（7日）嚴正澄清，強調報導並非事實。據聯合報報導，美方建議台灣出資升級菲律賓美軍基地」陸軍司令呂坤修上將二月更為此密訪菲律賓，陸軍司令部今下午以新聞稿回應，相關報導內容並非事實，籲請媒體勿引述未經證實消息內容，臆測涉外交流活動，避免造成民眾誤解與增加未來國際交流困難度。請繼續往下閱讀...近年我國涉外軍事交流雖屢有進展，但仍具高度機敏性。本報此前獨家報導，國防部情報次長謝日升中將於去年（2025年）9月曾罕見身著空軍軍常服、佩戴勳表，與時任國安會諮委、現任國防部副部長徐斯儉出席波蘭「華沙安全論壇」（Warsaw Security Forum），該次公開亮相象徵台歐交流獲實質提升，備受國際矚目；然而，相較將領受邀出席歐洲的國際安全論壇，陸軍司令層級的最高主官若實質密訪鄰近且與中方在南海激烈角力的非邦交國友盟菲律賓，牽動第一島鏈複雜神經，在軍事與外交層面更為敏感。    ,https://news.ltn.com.tw/news/politics/breakingnews/5362415
辦千人見面會衝刺民調  江啟臣：要為台中人圓夢,政治,2026/03/07 17:49,江啟臣在松竹寺舉辦千人見面會。（記者蔡淑媛攝）立法院副院長江啟臣舉行千人見面會衝刺，今天下午在台中市北屯區松竹寺展開第2場見面會，擠進上千人，他強調要為台中人圓夢，讓台中更有錢、更國際，「未來會比現在更好」，朝300萬市民前進，「台中市不一定是首都，但要打造全最幸福的旗艦城市。」立法院副院長江啟臣與立委楊瓊瓔爭取國民黨台中市長提名，預計本月最後一週完成民調。請繼續往下閱讀...江啟臣強調自己8年前就準備好了，8年前與市長盧秀燕黨內競爭市長提名，後來我在中央、她在地方服務，但8年來從未停止準備、準備接棒，現在要讓台中市一棒接一棒，棒棒都強棒，他提出讓台中更好的「一二三四五」的施政目標，「一個願景、兩個定位、三個目標、四大途徑、五大面向」，讓世界看見台中，已經通通準備好了。江啟臣表示，一個願景就是打造台中成為旗艦城市；兩個定位就是成為亞洲的新核心、世界的新都心；三個目標是安全、安定又安心，強調安養樂活、安穩宜居、安居樂業是他的施政目標；四大途徑就是走向國際、讓世界看見台中；產業升級、多元布局；在地平衡、永續發展；產業升級、多元布局；AI治理及智慧城市，還有五大面向及十大重點，包括交通公安、產業就業、健康照護、教育文化、社會福利、韌性永續等是施政重點。江啟臣更直指，台中市會展中心等帶的會參展經濟，不會輸給演唱會經濟，會帶動金流、人流，最後喊話希望大家守住電話，唯一支持江啟臣，至少到月底都要守住電話。立委黃健豪站台則強調，現在才黨內初怎麼能選邊站，因為8年前就講好了，江啟臣8年前與盧市長黨內民調初選，以0.6%服輸，立刻支持盧市長並擔任競選總幹事，這個人情與遠見，要還給江啟臣；陳菁徽則讚江啟臣是7-11，從早到晚都在服務鄉親。江啟臣舉辦見面會，在地北區、北屯國民黨立委黃健豪，以及議員陳文政、陳政顯、陳成添、沈佑蓮、賴順仁，以及議員參選吳宗學、許育璿、顏建程、張永漢等人全員到齊，立委陳菁徽、台北市議員李明賢也到場站台。江啟臣提出讓台中更好的「一二三四五」的施政目標。（記者蔡淑媛攝）江啟臣在松竹寺舉辦千人見面會。（記者蔡淑媛攝）江啟臣辦千人見面會衝刺，現場擠進上千人。（記者蔡淑媛攝）    ,https://news.ltn.com.tw/news/politics/breakingnews/5362390
鄭麗文台東天后宮參拜祈福 力挺議長吳秀華拚年底縣長選戰,政治,2026/03/07 17:30,國民黨主席鄭麗文（左二）與黨徵召台東縣長參選人吳秀華（左三）下午到台東天后宮參拜，並在擴建瓦片簽名。（記者黃明堂攝）國民黨主席鄭麗文今天下午前往台東市天后宮參拜，祈求媽祖庇佑國泰民安、風調雨順。黨徵召台東縣長參選人吳秀華、前台東縣長吳俊立、台東市長陳銘風等多位黨籍公職人員皆陪同出席，展現國民黨在台東的團結氣勢。鄭麗文不僅在祈福瓦片上親筆題下「四時吉祥」四字，更公開呼籲台東鄉親全力支持黨提名候選人吳秀華，期盼她在年底選戰中能獲得鄉親肯定，高票當選。鄭麗文在參拜後，以台語致詞表示，到台東天后宮參拜，祈求天上聖母媽祖保佑、風調雨順，台東縣務蒸蒸日上，希望國民黨能夠繼續為台東縣來服務，也希望能夠讓吳秀華縣長候選人，在年底得到縣民的踴躍支持，高票當選。請繼續往下閱讀...天后宮正為擴建募集瓦片捐贈，鄭麗文捐上紅包，並吳秀華等人在瓦片上簽名，她簽下「四時吉祥」，吳秀華簽「平安幸福」，隨後與廟方人員合影。    ,https://news.ltn.com.tw/news/politics/breakingnews/5362372
童子瑋提婦女政見  乳癌免費篩檢年齡降至30歲,政治,2026/03/07 17:29,基隆市長參選人童子瑋（後排左二）提婦女政見，降低乳癌免費篩檢年齡。（童子瑋辦公室提供）明日國際婦女節，基隆市長參選人童子瑋今天表示，守護女性健康，是城市進步最基本的標準，他也提出婦女政見，未來若當選市長，會將基隆市乳癌免費篩檢年齡降低到30歲女性，早期發現、早期治療，協助女性們活得更安心、更有保障。童子瑋指出，根據衛生福利部的統計數據，「乳癌」是台灣女性癌症發生率第1名，更是十大死因的第4名，同時近年發病年齡正在下降，約有一成患者在40歲以下，目前中央的公費乳癌篩檢僅限40至74歲，但40歲以下的女性正值工作與家庭雙重壓力的高峰，因此他若當選基隆市長，將擴大補助乳癌免費篩檢的年齡。請繼續往下閱讀...童子瑋表示，他會以市府加碼補助的方式，讓30-39歲女性也能免費篩檢乳癌，根據估算約有超過2萬3000位女性受惠。他表示，乳癌不是絕症，只要「早期發現、早期治療」，就能大幅提高治癒率與存活率，讓身邊每一位朋友、同學、姐妹、媽媽、阿嬤都能安心。童子瑋強調，婦女節的意義，不只有祝福，市府應該要用具體的政策，讓女性們活得更安心、更有保障，因為守護女性健康，是城市進步最基本的標準。他會繼續努力，讓基隆成為真正體貼女性的城市。    ,https://news.ltn.com.tw/news/politics/breakingnews/5362371
台中立委稱「編多少預算才能贏大谷」竹市議員劉彥伶：體育預算不是為了「買勝利」,政治,2026/03/07 17:25,台中立委稱「編多少預算才能贏大谷翔平」，新竹市議員劉彥伶認為體育預算從來不是為了「買勝利」。（資料照，記者洪美秀攝）WBC經典棒球賽事正在日本東京進行，台灣隊歷經昨天遭日本隊「扣倒」提前結束比賽後，今天展現「台灣尚勇」的棒球精神，以14比0「扣倒」捷克隊。昨天輸給日本後，有網友在社群發文稱體育署的經費被刪，結果有台中立委留言稱「編多少能贏大谷，你給個數字大家來討論」，此番言論遭炎上，新竹市議員劉彥伶熱衷運動及推動體育運動，她說，體育預算從來不是為了「買勝利」，是為培養選手、支持基層棒球，建立更好的訓練體系與運動科學。劉彥伶提到，台灣隊昨天輸給日本，今天大勝捷克，棒球就是這樣，有輸有贏，也正因如此才讓人著迷。比起比分，她更在意一件事，就是有人嘲諷「編多少預算才能贏大谷翔平」？其實，體育預算從來不是為了「買勝利」，而是為了培養選手、支持基層棒球，建立更好的訓練體系與運動科學，讓台灣的運動員有更好的環境，在世界舞台上拚戰。請繼續往下閱讀...她也說，運動本來就有勝負，願意披上國家隊球衣、為台灣站上國際賽場的人，本身就值得掌聲鼓勵。忘掉昨天，帶著今天的氣勢，明天的台韓大戰，一起為Team Taiwan 集氣，不只在贏球時歡呼，在困難時刻，繼續為台灣加油！台中立委在網友貼文留言稱「編多少預算才能贏大谷翔平」，新竹市議員劉彥伶認為體育預算從來不是為了「買勝利」。（取自網路貼文）    ,https://news.ltn.com.tw/news/politics/breakingnews/5362340
新人參政！蔡嘉峻斗六成立服務處 搶攻雲林山地原住民議員,政治,2026/03/07 17:23,蔡嘉峻（右3）將參選山地原住民議員，今天在斗六成立服務處。（記者李文德攝）地方制度法修法通過，雲林縣下屆將新增平地、山地原住民議員各1席，縣議員蔡永富的兒子蔡嘉峻將參選山地原住民議員，今天下午在斗六市成立服務處。蔡嘉峻表示，希望自己從政，幫縣內原民謀取更多福利。截至2月為止，雲林縣內共有3717位原住民，依法可增加2席原住民保障名額，即山地原住民、平地原住民議員各1席，屆時雲林縣議會議員將從43席增至45席。據指出，山地、平地原住民議員至少都有2名以上人選將角逐，也有不少符合參選資格者積極佈局，有意參選。請繼續往下閱讀...今下午，雲林縣原住民傳統技藝推廣協會榮譽理事長、縣議員蔡永富之子蔡嘉峻，在斗六市成立服務處。雲林縣議長黃凱、縣議員蔡孟真、林文彬、元長鄉長李明明等人前往致意祝福。27歲的蔡嘉峻具有太魯閣族原民身分，文化大學畢業後回到雲林協助家族事業。他表示，目前雲林縣內約有15族原住民，大多因工作關係遷入，由於雲林縣內無原鄉部落，因此長期以來未設立文化健康站，不過目前雲林縣內原民人數多達3700多人，應該設立一個讓雲林原民朋友了解相關福利政策、聚會之處，因此希望自己從政，可以幫縣內原民謀取更多福利。蔡嘉峻指出，他目前已擬定5大政見，雲林縣原住民家庭實際生活需求為出發，全面提升聚落安全與生活品質，更建立完善原民婦女安全支持系統，此外針對體育發展與原住民運動福利爭取，盼建議穩定且具制度保障的體育發展環境，爭取雲林縣原住民青少年運動培訓與獎助制度。蔡嘉峻表示，此外也會統合其他縣市已實施且對原住民具有實質助益的福利政策與制度，雲林不應缺席，主動進行各縣市原住民福利制度的比較與盤點，要求縣府提出具體評估、配套與執行時程，確保族人權益不因縣市不同而受限，再者支持族語、傳統技藝與文化活動推廣，爭取設立雲林縣原住民專責服務窗口，讓政策落實在族人生活之中。蔡永富表示，兒子有能力、熱忱為原民朋友發聲，希望各界能夠給予年輕世代支持，為民喉舌。雲林縣議員蔡永富之子蔡嘉峻（右2），將參選山地原住民議員，今天在斗六成立服務處。（記者李文德攝）雲林縣議員蔡永富（左起）之子蔡嘉峻，將參選山地原住民議員，今天在斗六成立服務處。（記者李文德攝）    ,https://news.ltn.com.tw/news/politics/breakingnews/5362341
北市議員初選林子揚合體吳怡農 主打中央、海外歷練落實社會韌性,政治,2026/03/07 17:16,民進黨籍台北市中山、大同區市議員擬參選人林子揚（中）與「壯闊台灣聯盟」創辦人吳怡農（右）今前往濱江市場拜票。（記者董冠怡攝）民進黨籍台北市中山、大同區議員擬參選人林子揚，今和選過中山區立委、「壯闊台灣聯盟」創辦人吳怡農在濱江市場拜票，兩人背景相似，專業幕僚出身同樣具有國際視野，合體除了象徵中央歷練回饋地方，也想把讓國人更安全的社會韌性概念落實在地方治理，期待一起努力讓台北市更國際化、更安全且更有韌性。吳怡農表示，林子揚長年在外交、僑務及國安領域打拚，帶來的國際4年會有多少成長，還是持續原地踏步，希望能有更多兼具國際視野與服務熱忱的政治工作者進入市議會，為城市發展努力，號召民眾共同支持林子揚。請繼續往下閱讀...林子揚指出，他跟吳怡農過去曾在行政院、國安會及海外服務，台北市作為首都，最需要的是跟國際連結，也肩負著國家發展的重責，市長選舉應聚焦在政策討論，而不是口水，吳怡農對此也有諸多理念，期盼未來有機會、不論在哪一領域，包括台北或整體國家發展，能有繼續討論的空間。    ,https://news.ltn.com.tw/news/politics/breakingnews/5362334
藍營彰化縣長人選三強同場 謝衣鳯：民調我領先,政治,2026/03/07 17:14,國民黨彰化縣黨部新春團拜，縣黨部主委、立委謝衣鳯（前排右3）、縣府參議柯呈枋（前排右1）及工策會總幹事洪榮章（前排左2）等三名，被視為可能角逐縣長提名的人選同場出席。（記者陳冠備攝）國民黨彰化縣長提名人選尚未底定，立委謝衣鳯今天受訪時表示，她將參選彰化縣長，而黨內確實已有進行相關民調，部分結果顯示她的支持度領先。國民黨彰化縣黨部今（7日）在溪湖鎮黨部中山堂舉辦新春團拜，包括黨部主委、立委謝衣鳯、縣府參議柯呈枋及工策會總幹事洪榮章等三名被視為可能角逐縣長提名的人選同場出席，也讓藍營縣長之爭備受關注。請繼續往下閱讀...謝衣鳯受訪時表示，她將參選彰化縣長，提名方式將依黨內機制決定，可能透過協調或民調產生人選。她表示，黨內確實已有進行相關民調，部分結果顯示她的支持度領先，但最終仍會依民主程序與其他參選人討論，希望儘快確定人選，讓基層整隊備戰。另一名表態參選的柯呈枋則表示，不論是團隊內部或外界公布的民調，他與謝衣鳯之間的差距都在誤差範圍內，顯示雙方都具備競爭力，也有機會為國民黨贏得選戰。他強調自己會參選到底，並呼籲黨中央儘快啟動公開、公平的提名機制，讓支持者有所依循，也讓基層能及早整隊。洪榮章則表示，一切以團結勝選為目標，中央若認為他適合承擔責任，他會全力以赴；若中央評估有更適合的人選，他也會尊重決定。他強調，國民黨最重要的是團結迎戰，「若不團結，誰出來選都一樣」，不論黨中央做出什麼決定，他都會全力支持。中央黨部副秘書長兼組發會主委李哲華表示，中央已與三名有意參選者充分交換意見，無論誰出線都有信心贏得選戰，黨中央將儘速推出最具勝算的人選，並要求縣黨部成立提名小組，啟動鄉鎮市長及縣議員提名作業。謝衣鳯（右）表示，彰化縣長提名方式將依黨內機制決定。（記者陳冠備攝）    ,https://news.ltn.com.tw/news/politics/breakingnews/5362337
選立委遭對手抹黑論文發表涉學倫 林志潔：感謝陽明交大與國科會證其清白,政治,2026/03/07 17:05,2023年新竹市立委選舉期間遭對手抹黑論文發表涉學倫問題，陽明交大法律學者林志潔稱感謝陽明交大與國科會證明其清白。（擷取自林志潔臉書）陽明交大法律學者林志潔2023年7月接受民進黨徵召參選新竹市立委，是選舉素人，當時遭時代力量立委候選人邱顯智陣營指控她協助同學修改碩士論文，並與同學一起投稿發表是抄襲學生，甚至提出檢舉、散布黑函抹黑。林志潔今天發文稱，2年多來，經陽明交大學術倫理委員會和國科會學術倫理委員會調查，證明她沒有違反學術倫理，對相關不實抹黑絕不會屈服。林志潔說，做為選舉素人，短短5個多月，受到許多的幫助和鼓勵，最後差數千票未能當選雖遺憾，但過程中新竹隊的全力付出，以清廉服務、科技領航，三大保證和五個安全的未來政策作為訴求，不打負面選舉，也獲市民肯定。只是令人痛心的是，選舉末期，她遭惡意攻擊，不實指控她協助同學修改碩士論文，並與同學一起投稿發表是抄襲學生，雖經她和校友們嚴正澄清，但對手陣營漫天灑花、濫行檢舉、且製作黑函文宣，更惡意用各種網路發文誤導視聽，或落井下石，或煽風點火，以無中生有方式影射或附和。相關證據，她與律師都已整理蒐集。請繼續往下閱讀...林志潔強調，對不實指控，陽明交大學術倫理委員會，以及國科會學術倫理委員會，已進行嚴謹調查，並做出無學倫違反的結論。期間學校和國科會及調查委員秉持公平嚴謹原則處理，更有畢業校友協助查找多年前她撰寫的文章、協助翻譯文獻和來回修改的信件檔案，讓她深受感動。她認為，學倫不只牽涉研究成果，更是誠信問題，然而學倫若無時效規定，或放任檢舉人惡意抹黑他人卻毫無成本，只會讓學術倫理淪為不公平競爭的工具，成為騷擾他人圖利自己的武器，也扭曲學術倫理本質，讓有意投身公共服務的朋友卻步。她對意圖用恫嚇抹黑手段傷害學術和民主制度的惡行，絕不會屈服。最後也證明其清白，她雖遭遇無理的傷害，但也在傷害中見證學術機構中道客觀、實事求是，和溫暖的人性光輝。    ,https://news.ltn.com.tw/news/politics/breakingnews/5362316
有發價書才能編預算？國防部駁：曲解軍購作業制度,政治,2026/03/07 17:02,立法院院會6日處理提案，並進行表決。（記者方賓照攝）行政院版1.25兆元國防特別預算6日終於付委。針對在野黨質疑「有發價書才能編列預算」，國防部今（7日）表示，這是對軍購相關作業制度的曲解。政院版國防特別條例6日終於付委審查，不過一併付委的國民黨版本將預算上限大幅削減為3800億元，且加上往後對美軍購，需待收到美國送來的發價書，才能另擬條例送審等條件。請繼續往下閱讀...針對有媒體報導稱「軍購作業必須具備發價書方能編列預算」，國防部今天表示，國軍建案作業程序，是考量敵情威脅、未來作戰場景與科技發展等因素，循「作戰需求」、「系統分析」、「期程工項」及「整體獲得規劃」之邏輯思維，確認所需籌購之武器裝備。凡對美採購品項，於建案作業期間，即需與美方密切協調，以初步確認項量、交運期程與預算需求。國防部指出，凡新增建案達新臺幣10億元以上者，需先經行政院審查同意，始送請立法院審議。若預算於立法院審議期間，美方仍未完成知會國會程序，則暫列為機密預算；待美方知會國會後，再轉列公開。所謂「美方先提供我發價書，再編列預算」實屬對相關作業制度的曲解。國防部強調，政院版特別條例草案，是經過嚴謹之建案作業程序、符合國軍作戰需求；並已確認供售意願、輸出許可、產能排程等，受到美國政府、國會多次肯定與支持。國防部將持續向立法院各黨團及外交國防、財政委員會溝通說明，期獲得朝野一致支持，提升防衛戰力。另外，有關國民黨版本誤將「AH-1W直升機零附件」等3項購案錯誤納入特別預算條例草案，國防部說明，該3案是於2024年納入作維費需求預算，為開口式合約性質，由2025年編列於公開預算。至於外界質疑「國防報告書不見未來軍購資訊」，國防部回應，「聯合戰力規劃」與「五年兵力整建計畫」等內容，均屬攸關國防安全之機密範疇，不可能列入《國防報告書》等公開文件，這類言論明顯是對國軍建案作業程序的誤解。    ,https://news.ltn.com.tw/news/politics/breakingnews/5362322
動保法修法強化飼主責任 蘇巧慧：持續完善動物照護體系,政治,2026/03/07 17:00,民進黨新北市長參選人、立委蘇巧慧（前中）、議員翁震州（前右）等人與毛寶貝合影。（記者羅國嘉攝）行政院今年初通過《動物保護法》部分條文修正草案，強化飼主責任與動物照護制度。民進黨新北市長參選人、立委蘇巧慧今（7日）出席活動說，近年飼養寵物家庭增加，政府應持續完善動物保護制度與照護體系；議員翁震州也說，新北毛小孩數量已超過高雄與台中，但寵物公園、專屬醫院及生命紀念園區等設施仍不足，盼市府加速規劃相關資源。行政院今年1月8日通過農業部提出的《動物保護法》部分條文修正草案，將函送立法院審議。修法重點包括加強飼主責任、提升動物收容管理、精進寵物產業管理、賦予動物保護檢查員執法權及強化動物保護機制，盼改善執法困境，建構動物友善社會環境。蘇巧慧今與立委吳秉叡、新北市議員翁震州出席「新北青誼扶輪社：踏青日誼起來 寵物公益市集」活動，共同為毛小孩發聲。請繼續往下閱讀...蘇巧慧指出，現在許多家庭已將毛小孩視為重要家人，透過公益市集等活動，不僅能讓飼主交流，也能提升照顧寵物的知識與互動。她感謝新北青誼扶輪社及各單位共同舉辦活動，讓民眾能夠帶著毛小孩一起參與，也能在現場選購寵物相關用品，促進動物友善環境。蘇巧慧說，近年飼養寵物的家庭增加，政府也應更重視動物相關政策。之前她也成功推動修法，強化動物照顧制度，建立獸醫佐（動物醫事助理）制度，協助獸醫執行工作；同時主張為公費獸醫師提供不開業獎金，鼓勵投入照顧搜救犬、緝毒犬等工作犬的醫療照護，從制度面持續完善動物保護與照護體系。翁震州則說，新北市毛小孩數量已超過高雄與台中，但在寵物公園、專屬醫院及生命紀念園區等設施上仍相對不足。他期盼市府加快腳步，為毛小孩打造專屬活動空間、醫療資源及生命紀念園區，讓毛小孩如同家人般獲得更完善的照顧與紀念。不少民種帶自家毛寶貝到新莊參加活動。（記者羅國嘉攝）民進黨新北市長參選人、立委蘇巧慧出席活動說，近年飼養寵物家庭增加，政府應持續完善動物保護制度與照護體系。（記者羅國嘉攝）    ,https://news.ltn.com.tw/news/politics/breakingnews/5362303
