Title,News_Type,date,content,url
花蓮縣府「擋義煮團、救災便當吃了近億元」？ 縣府駁斥還喊告,政治,2025/10/30 19:52,花蓮縣政府強調，開口契約是依照實際執行數量，截至本月底是花了四千多萬元。（花蓮縣府提供）花蓮縣議會明天起舉行定期大會，民進黨議員胡仁順在開會前一天拿到縣府災害準備金、第一第二預備金使用彙整表，整個嚇傻「原來縣府救災便當吃了近億元」，也讓網友看到恍然大悟，質疑「這就是阻擋義煮團的原因」。胡仁順並稱定期會一定要求縣長徐榛蔚說清楚明細！對此花蓮縣政府則是嚴正駁斥，並表示會依法蒐證、嚴辦。「明天議會定期會展開，我看了今年災害準備金、第一第二預備金使用彙整表，非常驚嚇」！花蓮縣議員胡仁順晚間貼出一張表格，上面寫著馬太鞍溪堰塞湖災害，救災工作相關人員的便當餐盒共耗資9166萬7千餘元。請繼續往下閱讀...胡仁順說，縣府在本月22日決標的緊急採購便當經費，從上月23日到本月7日共15天，花了1560萬元吃便當，每天平均採購1萬400個便當，縣府說明這包括國軍、救災人員、災民、志工們，他覺得是合理的。胡仁順進一步說，但截至本月20日共28天，縣府竟花了災準金9166萬7040元，拿來買救災工作相關人員便當餐盒等。若算每個便當100元，共採購了91萬6670個便當，每日平均超過3萬2千個便當。他說，依縣府曾公布的數據，連續假日時最多一天一餐2.5萬個便當、平日約8千個便當，平均下來1天有可能送到3萬個嗎？加上平常還有慈濟、許多義煮團的情況下，怎麼會每天還得買超過3萬2千個便當、花費近億元？他說，明天一讀會後，議會請徐榛蔚縣長進行馬太鞍溪洪災專案報告，下午還有縣長施政報告，一定會把明細問清楚。對此花蓮縣政府嚴正駁斥「與事實全不符」，縣府將蒐集相關證據，對於蓄意造謠者，縣府將依法蒐證，依《災害防救法》第53條及《社會秩序維護法》第63條嚴辦，以正視聽！縣府指出，該採購金額是開口契約，依實際使用量「實支實付」，所以截至10月30日止，實際執行金額為4092萬餘元，絕無所謂「便當花費近億元」情事。縣府估算，每日村鄰長及救災人員等基本需求就有3千個便當，災害初期更有大量志工湧入，整體救災期間累計服務人次估達40萬。縣府也強調，絕無阻擋義煮團進入災區，只要講清楚都開放進入，縣府也和多個義煮團體、義廚群組密切合作，攜手提供災民與救災人員熱食。花蓮受災戶在災難期間找村長領到的便當，炒飯配滷蛋，菜色讓人寧願吃泡麵。（民眾提供）胡仁順今天拿到縣府提供的資料，發現便當竟然花了快一億元。（胡仁順提供）馬太鞍欣綠農園準備的義煮便當，送給國軍官兵。（記者花孟璟攝）慈濟的素食便當菜還有擺盤，看起來好吃多了。（記者花孟璟攝）熱門賽事、球星動態不漏接    ,https://news.ltn.com.tw/news/politics/breakingnews/5229341
促轉會命移交31筆政治檔案移歸國有 國民黨提告抗罰敗訴,政治,2025/10/30 19:39,國民黨中央黨部的黨史館，內有爭議的31筆政治檔案。（資料照）促進轉型正義委員會（已解散，國家發展委員會承受訴訟）2019年命令國民黨將33筆政治檔案移交國家檔案局收歸國有，國民黨於同年8月、9月移歸其中31筆交接給檔案局後，提起復查被駁回，再打行政訴訟，請求撤銷處分；台北高等行政法院今天判決31筆檔案應收歸國有，只認為無法確定檔案是否存在的「台灣謝雪紅處分案」、「帽簷自述」撤銷收歸處分。可上訴。判決指出，促轉會於2018年8月函請國民黨通報所持有的政治檔案，國民黨通報其持有的檔案共有4萬3095筆，促轉會2019年5月1日決議第一階段審定「中央當局對台灣二二八事件之反應與措施」、「蔣渭川跨黨嫌疑案」、等33筆檔案，並命應於文到30天內檔案原件移歸國家檔案管理局。請繼續往下閱讀...這33筆檔案多為二二八事件相關紀錄，包括「台灣事變處辦法案改設省政府」、「處理台灣事變意見書」、「台灣事變之真相」、六屆三中全會臨時動議之「請將台灣省行政長官陳儀撤職查辦」、「中國國民黨戡亂建國總動員方案」、「總統代電劃定全國戒嚴地域案」等。國民黨交出31筆檔案後，另2筆「台灣謝雪紅處分案」只有檔案紙卡、查無原件，「帽簷自述（或稱帽簷述事）」也找不到原件，無從移交。國民黨提起復查被駁回，向北高行提告請求撤銷對33筆檔案的處分；並備位主張若不撤銷處分，則請求國家補償3300萬元。北高行一審判31筆應收歸檔案局，撤銷這2筆查無原件的處分，最高行政法院廢棄發回更審。北高行更一審今日判決認定，基於促進轉型正義、落實自由民主憲政秩序，於促轉條例、政治檔案條例課予國民黨有將國家檔案移歸政府的義務，國民黨身為威權統治時期統治者，促轉會的處分尚未逾越國民黨應負的社會責任與義務，也沒有特別犧牲可言，促轉條例的規定是強制徵集，沒有補償機制，處分並未侵犯人民財產權，將31筆檔案原件收歸國有，處分沒有違誤。至於「台灣謝雪紅處分案」、「帽簷自述」，則因促轉會無法證明原件存在，前者無法證明於2003年後還存在，後者是否為史料原件也狀況不明，國民黨既然已經交出31筆檔案，於情於理都沒有隱匿、拖延交付這2筆檔案的必要性，促轉會未盡查明即予處分移歸，有所違誤，因此撤銷。熱門賽事、球星動態不漏接    ,https://news.ltn.com.tw/news/politics/breakingnews/5229346
京華城案勘驗偵查錄影帶 北檢：黃景茂親口說「奉交下一定要送都委會研議」,政治,2025/10/30 19:19,前台北市都發局長黃景茂出庭應訊。（記者羅沛德攝）台北地院審理前台北市長柯文哲等人涉京華城容積等弊案，今日下午勘驗台北市前都發局長黃景茂去年9月13日在台北地檢署的部分偵訊錄影片段，北檢蒞庭的主任檢察官林俊廷於勘驗後指出，黃景茂偵訊時親口說「我們是奉交下的啦」、「對我是奉交下，一定要提」，依黃的語意顯示奉柯文哲的命令才一定要將京華城陳情案提進都委會，筆錄記載沒有不實，且黃和律師逐行、逐字閱覽筆錄，時間長達20分鐘，並非匆促、沒看清楚就簽名。林俊廷指出，勘驗結果可還原當時偵訊的情況，「奉交下」三字確實是黃景茂自己親口說的，第一次出現在24分6秒，黃景茂說「我們是奉交下啦」，最後一次出現在24分42秒，黃景茂說「對，我是奉交下，一定要，一定要提」，確為黃景茂的親口陳述。請繼續往下閱讀...林俊廷說，黃景茂於偵訊的最前面11分鐘即已多次說，「接到市長指令、市長交辦、市長在便當會交辦」，「請彭振聲副市長跟都發局盡力協助」、「他就是要我們來推動」、「陳情案要交辦」、「直接交辦都發局、要確認市長的意思」。之後檢察官林俊言問黃「2020年4月14日這個交辦，我們看到就是都發局的公務員，認為這樣子還是會有圖利的問題，你怎麼處理啊？」，是因都發局的公務員已在說帖上寫說會有圖利的爭議，但黃景茂還是要繼續辦理送研議，林俊言因此質疑黃是否受長官指示，這個長官可能是彭振聲、也可能是柯文哲，林才不斷地問黃景茂以求確認。林俊廷指出，黃景茂於第14分27秒回答「我們簽給市長後，市長就是經同意要提出研議」，黃未針對4月14日的簽呈回答，林才反覆提出該簽呈確認，「這個清楚的講說有圖利啊」，黃景茂回稱「對」。林俊廷指出，錄影第24分36秒時，林俊言問「你知道違法，你還是把他提進去啊，公文上寫得很清楚啊」，黃景茂回答「對，我是奉交下，一定要，一定要提」，林俊言整理筆錄認為黃景茂知道違法，其明知的依據是4月14日的簽呈、都發局的說帖，但還是依照柯文哲的命令「奉交下」一定要提進去都委會，依此記載於筆錄。林俊廷說，這段對話譯文清楚呈現偵查檢察官的認知，就是都發局公務員已於說帖說明會有圖利爭議的問題，為何還要推進都委會研議，黃景茂也親口說是奉交下才一定要提」。林俊廷強調，訊問時黃景茂可以看著電腦螢幕顯示的筆錄，他與陪偵律師閱覽筆錄20分鐘後也簽名，期間要求更正筆錄也沒問題。至於柯文哲的律師要求法官告發林俊言，林俊廷認為，若律師堅持認為偵查檢察官故意偽造文書，大可自行去浪費司法資源提告，因為根本告不成，無需一直慫恿公訴檢察官或法官要告發，辯方顯得過度一廂情願。檢方指出，柯的律師團製作的偵訊逐字譯文上，還註明林俊言和黃景茂爭吵，勘驗之前律師也屢屢把偵訊過程形容得很誇張、很離譜，拼命詆毀偵查檢察官不正訊問，但勘驗後也證明其實就是很普通的一問一答，沒有爭吵，問案態度其實也非常溫和。熱門賽事、球星動態不漏接    ,https://news.ltn.com.tw/news/politics/breakingnews/5229239
雙帥對決再現？ 吳怡農明壓線交意願表 爭取台北市長提名,政治,2025/10/30 19:17,壯闊台灣聯盟創辦人吳怡農。（資料照）壯闊台灣聯盟創辦人吳怡農今（30日）預告，明天（31日）將赴民進黨中央黨部遞交台北市長參選意願表，盼以自身長期推動公共服務與國際交流經驗，積極爭取黨內支持，成為台北最強戰力。2026台北市長選戰，能否與台北市長蔣萬安再現「雙帥對決」，備受矚目。民進黨布局2026地方選舉，針對非執政的直轄市長、縣市長選舉部分，訂定參選意願表達期限，在10月31日下午5時前，有意參選者可以填寫參選意願表，送至中央黨部。民進黨選對會預計在11月5日開會討論。請繼續往下閱讀...選對會近期盤點各地戰力時，成員提及吳怡農曾表達參選意願，引發話題。吳日前證實，他確實會爭取機會服務市民，也相信社會需要翻過烏煙瘴氣政治的一頁。不過，將持續建議選對會再斟酌，是否需要趕在年底前完成提名。距離投票還有1年多，以台北市的情況來看，沒有必要急著啟動選舉。趕在報名截止前夕，吳怡農今發布採訪通知，預告將赴黨中央遞交台北市長參選意願表。他說明，盼以自身長期推動公共服務與國際交流經驗，積極爭取黨內支持，成為台北最強戰力，為台北市民打造一座更具韌性與前瞻性的首都。熱門賽事、球星動態不漏接    ,https://news.ltn.com.tw/news/politics/breakingnews/5229322
美國以色列公共事務委員會首訪台 林佳龍：盼盟友攜手共抗動亂軸心,政治,2025/10/30 19:13,"外交部長林佳龍30日在臉書分享，他近日歡迎首度來台的美國以色列公共事務委員會（AIPAC）訪問團時強調，台灣始終與所有珍視自由與安全的國家站在一起，期盼全球民主盟友更應團結一致，攜手強化夥伴關係，共同對抗「動亂軸心」。（外交部提供）外交部長林佳龍今（30）日在臉書分享，他近日於猶台文化交流協會，歡迎首度來台的美國以色列公共事務委員會（AIPAC）訪問團。他強調，台灣始終與所有珍視自由與安全的國家站在一起，但和平得來不易、也非理所當然，面對威脅，全球民主盟友更應團結一致，攜手強化夥伴關係，共同對抗「動亂軸心」。AIPAC此次訪團成員逾200人，由會長卡明斯基（Bernard Kaminetsky）、董事會主席圖卿（Michael Tuchin）、執行長布蘭特（Elliot Brandt）、營運長克里斯汀森（Arne Christenson）及國際事務主任施耐德（Stephen Schneider）率領。請繼續往下閱讀...林佳龍今天說，這是近年來AIPAC規模最大的海外訪問團，他並強調，台灣始終與所有珍視自由與安全的國家站在一起，美國是主要安全與貿易夥伴，以色列則是台灣具有潛力的新興夥伴，期盼未來台灣、美國與以色列能在更多領域持續深化合作，攜手推動印太及全球的和平、穩定與繁榮。林佳龍表示，在訪團抵台的第一天，他與AIPAC訪團成員就區域情勢及民主夥伴間的合作進行深入交流；總統賴清德也受邀出席晚宴，並提到台灣將持續發揮半導體產業優勢，結合美國與以色列的研發資源與經驗，攜手深化高科技領域合作，共同強化供應鏈韌性。​林佳龍當天致詞時強調，台灣始終與所有珍視自由與安全的國家站在一起。「然而，和平得來不易，也絕非理所當然」，面對極權勢力跨區域合作所帶來的威脅，全球民主盟友更應團結一致，攜手強化夥伴關係，共同對抗「動亂軸心」。​林佳龍指出，台灣位處「第一島鏈」樞紐，扮演自由航行與全球供應鏈安全的重要角色。每天有全球五成商船通過台灣海峽，超過九成的高階晶片也在台灣製造，並以科技實力、民主韌性，影響著印太地區的和平與穩定。​林佳龍也向訪團分享，台灣政府正積極強化國防、經濟與科技實力，並與國際夥伴深化合作，展現台灣作為可信賴夥伴的決心。他強調，「美國是我們的主要安全與貿易夥伴，歷經不同政府世代，始終堅定支持台灣。」，而以色列則是台灣極具潛力的新興夥伴，擁有卓越人才與創新動能，台以雙邊也在醫療與社會關懷等領域推動多項實質合作計畫，未來合作潛力無限。林佳龍期盼，未來台灣、美國與以色列能在更多領域持續深化合作，攜手推動印太及全球的和平、穩定與繁榮。熱門賽事、球星動態不漏接    ",https://news.ltn.com.tw/news/politics/breakingnews/5229210
負責人職場霸凌最重罰100萬 職安法專章立法院初審通過,政治,2025/10/30 19:12,立法院社會福利及衛生環境委員會初審通過「職業安全衛生法修正草案」，增訂「職場霸凌防治」專章，明定職場霸凌定義、防治措施、雇主接獲申訴後必須通報等；若最高負責人經認定有職場霸凌行為，最高處100萬元罰鍰。（記者謝君臨攝）立法院社會福利及衛生環境委員會今天初審通過「職業安全衛生法修正草案」，增訂「職場霸凌防治」專章，明定職場霸凌定義、防治措施、雇主接獲申訴後必須通報等；若最高負責人經認定有職場霸凌行為，最高處100萬元罰鍰。此外，若雇主違反安全設施，初審通過條文為可處5萬元以上、300萬元以下罰鍰。為強化勞工保障，行政院院會8月通過職安法修正草案，增訂「職場霸凌防治」專章，明訂職場霸凌定義，函請立法院審議。立法院衛環委員會29、30日排審職安法修正草案，朝野立委歷經2天討論，今完成初審。請繼續往下閱讀...初審通過條文增訂「職場霸凌防治」專章，明定「職場霸凌」是指勞工於勞動場所執行職務時，事業單位人員利用職務或權勢等關係，逾越業務上必要且合理範圍，持續以冒犯、威脅、冷落、孤立、侮辱或其他不當言詞行為，導致身心健康遭受危害，而情節重大者不以持續發生為必要。初審通過條文規定，雇主應採取必要措施防治職場霸凌。若接獲勞工申訴遭受霸凌，應避免霸凌情形再度發生，且視需求與情節提供諮詢，或必要協助及保護措施，並進行協調或調查；若接獲被霸凌勞工申訴，雇主應於主管機關指定網站登錄，事件處理結果也應登錄網站，避免選擇性通報。初審通過條文指出，若雇主知悉勞工遭霸凌，卻未採取相關協助或調查機制，可處3萬元以上、75萬元以下罰鍰；若最高負責人經認定有職場霸凌行為，可處1萬元以上、100萬元以下罰鍰。初審通過條文指出，雇主對職場霸凌事件調查應秉持客觀、公正、公平原則，調查時給予當事人充分陳述意見與答辯機會，若僱用勞工達到一定規模，應組成調查小組，小組外聘成員比例不得少於2分之1。初審通過條文規定，勞工遭受職場霸凌應向雇主提起申訴，若被申訴人為最高負責人時，得逕向縣市主管機關提起申訴，而縣市主管機關得請專業人士或民間團體協助，調查小組外聘成員比例同樣不得低於2分之1。初審通過條文明定，若雇主對職場霸凌事件調查結果經認定違反相關準則，且調查程序有重大瑕疵者，主管機關、勞動檢查機構得要求重新調查，雇主不得拒絕。此外，為遏止不法行為，初審通過條文也提高針對雇主違規的刑事罰刑期、罰金及行政罰鍰上限額度。熱門賽事、球星動態不漏接    ,https://news.ltn.com.tw/news/politics/breakingnews/5229301
斷中國操作空間！川習會未提台灣 周玉蔻籲賴政府：掌握爭取民心,政治,2025/10/30 19:04,美國總統川普（左）與中國國家主席習近平（右）。（法新社）全球矚目的川習會今（30）日在韓國釜山舉行，美國總統川普會後立即表示，自己過程中從未提及台灣，阻斷了中國單方面操作台灣議題的空間。對此，媒體人周玉蔻表示，「美日韓熱熱暖陽下，台灣，贏家！」也呼籲賴政府要好好掌握這波運勢爭取民心。周玉蔻今日於臉書粉專表示，「川普2.0首次成功亞洲行！台灣成了贏家！」並解釋，川習會後川普先發制人，立即在返美的空軍一號上宣告會中從未提及台灣，「阻斷了習近平後續新華社單方面發稿操作台灣議題的空間！」請繼續往下閱讀...周玉蔻提到，川普開心滿分達成的協議包括，台灣沒有成為美國爭取利益的籌碼；台灣沒有成為習近平威脅美國的棋子，「一趟亞洲行，川普與日本黃金聯盟，核動力潛艇案搞定蠢蠢欲親中的南韓總統李在明。台灣呢？可以預期的是另一種勝利。」最後，周玉蔻重申，「美日韓熱熱暖陽下，台灣，贏家！台美關稅談判好消息揭曉倒數計時中。」並呼籲，「賴政府可要好好掌握這波運勢爭取民心啊。」熱門賽事、球星動態不漏接    ,https://news.ltn.com.tw/news/politics/breakingnews/5229178
趕走義煮團 花蓮縣府短時間內砸近億買便當 更扯的是這事……,政治,2025/10/30 18:59,傅崐萁和徐榛蔚直到現在仍想將光復鄉洪災所有責任全推給中央。（資料照）花蓮馬太鞍溪堰塞湖溢流重創光復鄉，第一時間各地「超人」們湧入災區救災，但一度傳出徐榛蔚縣府阻撓甚至趕走免費替災民和志工準備熱食的「義煮團」，引發輿論砲轟。如今竟爆出，傅氏王朝不要外界熱心提供的免費熱食，自行採購便當竟花了近億元，但當地議員檢視過往縣府公布的數據，採購便當數量根本和這筆鉅額對不上！光復鄉洪災釀19死逾百人受傷，目前尚有5人下落不明。救災期間花蓮縣府表現荒腔走板，大家長徐榛蔚時常神隱，不敢直面災民；在地立委傅崐萁則是極力護妻，到現在仍力圖將所有責任甩鍋中央，並想方設法從中央挖錢，但美其名為災民爭取用於重建的追加200多億預算，日前舉辦相關座談會卻只邀「自己人」，大批災民根本沒收到通知，到場抗議被擋在門外，傅崐萁挨轟根本只想與友傅人士瓜分這200多億，花蓮議長張峻當天闖入會場與傅崐萁起衝突，讓整件事曝光，輿論進一步延燒。請繼續往下閱讀...如今花蓮「鬼故事」再添一筆，回到災情發生之初，大量「鏟子超人」從外地湧入光復災區協助清淤救災，同時也有不少義煮團到災區幫忙煮飯、提供熱食給災民和志工，但卻傳出被縣府人員阻撓，甚至趕走這些人；還有災民在網上踢爆，縣府一度要求要有所謂「災民識別證」才能領便當，嚴格控制便當發放，結果外界熱心捐贈的便當放到臭掉，最後只能丟棄。徐榛蔚縣府不要外界提供的免費食物，自行採購便當發放，如今又被質疑支出金額高到不合理！民進黨花蓮縣議員胡仁順今天下午在臉書PO出花蓮114年度災害準備金動支案件彙整表，特地以紅框圈出「馬太鞍堰塞湖災害－救災工作相關人員便當餐盒等」、「馬太鞍堰塞湖災害－受災民眾慰助金」這2筆支出細項，可以看到前者花了9166萬7040元，後者則是2億8000萬元。胡仁順表示，「明天議會定期會展開，我看了今年災害準備金、第一第二預備金使用彙整表，非常驚嚇。便當吃了近億元？！10/22決標的緊急採購便當經費，9/23至10/7共15天，是花了1560萬元，每天平均採購1萬400個便當，當時縣府表示這包括國軍、救災人員、災民、志工們，我覺得是合理的。但現在我看到的是，截至10/20共28天，縣府花了災準金9166萬7040元在救災工作相關人員便當餐盒等。若算每個便當100元，共採購了91萬6670個便當，每日平均超過3萬2千個便當！」「以目前縣府公布過的數據，連假時一餐2.5萬個是最多的，平日約8000個。在還有慈濟、多個義煮團的情況下，為什麼會買到每天超過3萬2千個便當、花費近億元？」接著是災民慰助金的部分，「平均每戶8.5萬+6.5萬的慰問（助）金，去哪了？縣府慰助金發放是每戶5萬元，包括縣府1萬元＋捐款專戶4萬元。但縣府災準金動支了2億8千萬元在『受災民眾慰助金』中，若以3325戶算（賑災基金會最新擴大發放戶數），平均每戶是8萬4210元。而縣府捐款專戶則是提撥2億1857萬元作為慰問金，平均每戶是6萬5735元。錢呢？誰有拿到這麼多？」最後胡仁順說：「明天的一讀會後，議會請徐榛蔚縣長進行馬太鞍溪洪災專案報告，下午還有縣長施政報告，我會把這些明細問清楚。」相關新聞請見：花蓮縣府「擋義煮團、救災便當吃了近億元」？ 縣府駁斥還喊告胡仁順今天下午在臉書PO出花蓮114年度災害準備金動支案件彙整表，特地以紅框圈出「馬太鞍堰塞湖災害－救災工作相關人員便當餐盒等」、「馬太鞍堰塞湖災害－受災民眾慰助金」這2筆支出細項。（圖翻攝自胡仁順臉書）熱門賽事、球星動態不漏接    ,https://news.ltn.com.tw/news/politics/breakingnews/5229165
黃國昌批只會放狠話 梁文傑：難道要卑躬屈膝講話？,政治,2025/10/30 18:54,民眾黨主席黃國昌接受電台節目專訪時批評，陸委會只會開記者會，讓發言人梁文傑出來放狠話、講幹話，應該被廢掉。對此，梁文傑今天在例行記者會後說，「難道應該卑躬屈膝的講話嗎？那我就不知道怎麼講話了。」（資料照）民眾黨主席黃國昌今（30）日接受電台節目專訪時批評，陸委會只會開記者會，讓發言人梁文傑出來放狠話、講幹話，應該被廢掉。對此，梁文傑下午在例行記者會後說，他常被抱怨講話太溫和，這還是第一次被說放狠話，「難道應該卑躬屈膝的講話嗎？那我就不知道怎麼講話了。」黃國昌在廣播節目中表示，不排斥與中國國家主席習近平見面，還表示想邀習近平吃雞排，梁文傑大酸黃國昌表示，不確定黃國昌現在還是不是在黑名單上，但現在中共話已講得很清楚，未來要走「愛國者治台形式」，如果能見到習近平就表示「是已經被認可過的」人士，「所以我覺得，其實不需要太急著、倉促的去表態」。請繼續往下閱讀...對於黃國昌批評陸委會只會開記者會，讓發言人梁文傑出來放狠話、講幹話，梁文傑在記者會後被問到此事，他表示，自己常被人抱怨講話太溫和、太慢條斯理，還是第一次被說「放狠話」，如果這樣叫放狠話，難道應該卑躬屈膝的講話嗎？「那我就不知道怎麼講話了」。最後他還向媒體記者說，「我真的只被抱怨講話太溫和，你們不覺得嗎？」熱門賽事、球星動態不漏接    ,https://news.ltn.com.tw/news/politics/breakingnews/5229289
