Title,News_Type,date,content,url
鄭麗文拍「開局者」向中共交作業？邱志偉：彰顯對習近平的重視,政治,2026/06/24 20:07,國民黨主席鄭麗文在紀錄片中，稱讚中共中央總書記習近平很親切。（取自直播畫面）國民黨發布黨主席鄭麗文訪中紀錄片「造局者」，掀起討論。民進黨立委邱志偉今（24日）質疑，國民黨迄今何以持續用親中視角傷害台灣的國際形象，甚至讓人不免懷疑，這是否又是一份向中共交差的影視作業，用來彰顯鄭麗文對中共領導人習近平的重視。「在替誰造局？論國民黨親中敘事的巨大謬誤。」邱志偉今在臉書撰文表示，國民黨的影片名稱取作「造局者」，令人迅速聯想到另一部近期以台灣半導體發展為主軸的紀錄片「造山者」。該片切入視角就讓人尷尬不已，其形容國民黨過去十年的頹喪，彷彿把無法執政的關鍵，都歸因於不夠親中、甚至是「恐中」所致。請繼續往下閱讀...對此，邱志偉列舉歷史事實並反駁說，國民黨正是因為緊抱親中招牌不放，才會在2016年以來的三次總統大選中全部落敗。包括朱立倫在選前與習近平會面，韓國瑜在當選高雄市長後訪問香港中聯辦，侯友宜更堅持擁抱過時的九二共識。處處受親中路線所礙，但鄭麗文居然將敗選歸咎於不夠親中，根本與事實脫節。若套用學術界的用語，鄭從一開始的問題意識、研究假設就全錯了，後面的鋪陳可想而知會有多麼荒唐。邱志偉續指，鄭麗文強調自己一上任就訪中，參訪一堆由中國刻意安排的精選企業，卻絕不會看到當前中國的失業問題、年輕人起薪過低，以致公職考試搶破頭，以及習近平強調「國進民退」原則下對民營企業的打擊。對於鄭習會的互動，邱志偉認為，歷任國民黨主席縱使親中程度有別，但從未有一位主席以如此低姿態、充滿尊卑感的方式描述兩岸領導人會面。若習近平兩三句話，就可以被形容為貼心、窩心，那麼毛澤東甚至曾在國共內戰前夕，於重慶喊過「蔣委員長萬歲」，難道後來就沒有兵戎相見？若國民黨人已忘記國共內戰，不如提早與現在仍在中國北京掛牌的「中國國民黨革命委員會」合併，一起為共產黨與習近平喝采。邱志偉說，前國安會秘書長蘇起自2016年政黨輪替後，就不斷宣傳「美國不會幫台灣」及「中國將主導台海」的理論，並在影片中再度強調美國未來對台支持將減少。邱強調，從整部影片來看，真正對台灣支持減少的是國民黨，把美國推走的也是國民黨，該片不僅與歷史事實脫節，必定成為國民黨難以卸下的巨大包袱。民進黨立委邱志偉。（資料照）    ,https://news.ltn.com.tw/news/politics/breakingnews/5482926
蔣萬安被問「政客爽」答「支持政務官」！網比對笑翻：一稿多用,政治,2026/06/24 19:50,台北市長蔣萬安今（24）日受訪。（記者甘孟霖攝）親藍粉專「政客爽」近日因北市府研考會主委殷瑋爭議，槓上台北市議員秦慧珠。台北市長蔣萬安今（24）日被問及對粉專「政客爽」看法時，突然瞎扯「全力支持政務官」、「特別是首長」，問A答B的回答令許多網友錯愕，直呼難道「政客爽」身分是政務官？對此，有網友發現，過去記者提問殷瑋爭議時，蔣萬安的回答幾乎一模一樣，對此笑稱：「稿量不足」、「一稿多用」；還有網友驚呼：「背得真熟。」蔣萬安今日受訪時，有記者發問：「怎麼看粉專政客爽現在發起拒投秦慧珠的行為？」蔣萬安則回答：「對於市府團隊各政務官，特別是首長，他有理有據能夠站穩立場為政策辯護，這是本來他們應該要做的，我都全力支持。」請繼續往下閱讀...不少網友乍聽之下，還以為蔣萬安指政客爽是「政務官」、「首長」，直呼：「政客爽是政務官？蔣萬安支持拒投秦慧珠？」、「看來蔣萬安知道政客爽是誰」。另有網友比對後發現，過去被問及殷瑋爭議時，蔣萬安曾回答：「對於市府團隊尤其是政務官，為政策來進行有理有據的辯護及說明，我都全力支持。」回答內容與今日幾乎一模一樣。網友才知蔣萬安口中的「政務官」其實指的是殷瑋。相關討論下方，網友紛紛留言表示：「所以蔣不聽是認證政客爽等同於殷瑋？」、「他答不出來，完全背一模一樣的東西給人聽」、「稿量不足」、「他就是個一稿多用很會背稿的草包啊」、「連表情都一模一樣」、「就算一樣的問題，不同場合被問到，回答兩次幾乎一樣的內容也很恐怖吧」。     在 Threads 查看    ,https://news.ltn.com.tw/news/politics/breakingnews/5482510
邱臣遠競選團隊亮相 柯文哲談藍白合：今年是2028總統大選前哨戰,政治,2026/06/24 19:45,民眾黨竹北市長參選人邱臣遠（右2）今天下午在創黨主席柯文哲（左2）陪同下，宣布競選總幹事是翟本喬（左）、競辦發言人黃心愉（右）。（記者黃美珠攝）民眾黨竹北市長參選人邱臣遠競選團隊今天成軍，下午在創黨主席柯文哲陪同下亮相，競辦總幹事是新竹黨部副主委翟本喬，競辦發言人則是民眾黨政策會研究員黃心愉。針對藍白合，柯文哲直言，還是要黨主席黃國昌跟國民黨去協商，他個人交保後迄今沒跟國民黨主席鄭麗文有過任何接觸，未來基於分工，他還是會以自己最愛的全台大輔選為主，不會主動就竹北藍白合去跟鄭麗文接觸。請繼續往下閱讀...他也說，民眾黨今年選戰戰略核心是「變現」，把現有支持度轉化為議員實際席次。上次民眾黨全台提名約80多名議員參選人，但僅上10幾人，這次除新竹東區等少數區域，多數都採「1選區提名1人」的保守策略，再思考如何擴大戰果。柯文哲說，民眾黨在竹北支持度高，如果國民黨從新竹縣長到竹北市長「整碗端去」，很難說服民眾黨支持者來支持國民黨。而今年的主戰場在新北與高雄，桃竹竹苗是中流砥柱，應該更加穩定，所以要推出勝選的人選。畢竟今年是2028總統大選前哨戰，屆時面臨的合作模式，會提前在今年的選舉布局中浮現，所以這次各方都會以更高層次的戰略角度來思考合作與競爭。翟本喬說，白營支持者具高度自主性，會依候選人表現、理念以及是否符合民意期待作出判斷。鄭朝方給外界的印象並非傳統綠色的政治人物，部分白色選民未必排斥。而且竹北教育程度普遍較高，投票時往往會考量城市發展、區域整體利益及政治局勢等因素，傾向從大局角度作出理性選擇。柯文哲（左）說，民眾黨在竹北支持度高，如果國民黨從新竹縣長到竹北市長「整碗端去」，很難說服民眾黨支持者來支持國民黨。（記者黃美珠攝）    ,https://news.ltn.com.tw/news/politics/breakingnews/5482871
柯文哲稱竹縣不能給藍營「整碗捧去」  吳旭智：這是威脅,政治,2026/06/24 19:36,柯文哲稱竹縣不能給藍營「整碗捧去」，國民黨提名的新竹縣議員吳旭智直言「這是威脅」！（記者黃美珠攝）台灣民眾黨創黨主席柯文哲今天下午針對藍白合在竹縣，稱不能給藍營「整碗捧去」，國民黨新竹縣黨部表示，他們尊重柯P說法，但藍營提名參選的縣議員吳旭智乍聞反射性反應就說「這是威脅」！吳旭智說，他尊重邱臣遠競選團隊正式成立，但他的服務團隊這8年來從未打烊，一直陪著地方在努力。從學區劃分、爭取高中、爭取大眾運輸、AI科技教育、親子課程，到幫助特殊氣質孩子與家庭等，這些都不是選舉口號，而是一步一步和市民站在一起、從無到有的成果。請繼續往下閱讀...他是初選民意洗禮而出爐的提名人。所以，如果藍白合是著眼2028要贏，那每一個環節就更應該建立在公平、公正、公開，以及讓藍白支持者都能認同的民意基礎上。吳旭智說，在國民黨初選時，他的團隊就已從服務轉為競選團隊，服務不中斷外，另以爭取竹北勝選做布局而努力，絕對堅持到最後，也相信地方黨部跟中央黨部會積極溝通，促成最後「真正能贏」的藍白合。至於縣黨部書記長莊佶霖則說，竹北市長選舉是依藍白雙方「2026年聯合治理暨地方選舉合作協議」規劃，屬於共同推舉選區。國民黨已完成內參民調，由吳旭智同志勝出作為本黨推薦人選，後續仍待黨中央與台灣民眾黨進一步協調確認共同推舉人選。對於柯文哲的發言，他們予以尊重。但是仍提醒，竹北市是2黨合作的重要選區，未來將以勝選為共同目標，尋求最大共識。    ,https://news.ltn.com.tw/news/politics/breakingnews/5482904
獨家》林睿哲「掛國旗」環球飛行遭檢舉！無奈塗銷 轉往南半球續飛,政治,2026/06/24 19:22,單機環球林睿哲離開松山機場飛往南半球。（「TaiwanADIZ」提供）台灣飛行員林睿哲（Roger）駕駛單引擎飛機挑戰環球飛行，原意為讓世界看見台灣，卻因機身上的「TAIWAN」字樣與國旗圖案遭到不明人士頻繁檢舉，面臨被迫塗銷的困境。林睿哲無奈指出，為了確保後續行程能順利進行，他不願因塗裝問題遭他國主管機關施壓、甚至威脅吊銷執照，最終只能忍痛將機身塗裝撤除，目前已經進入中南半島，照航程推算，有可能落地泰國。林睿哲先前曾表示，擔心國旗事件延燒，24日一早也非常低調從松山機場起飛離台，原定菲律賓的落地行程已經確定取消，預計從飛往中南半島繼續後續的環球行程，估計最有可能降落於泰國曼谷機場。請繼續往下閱讀...長期關注該航程的軍事粉專「TaiwanADIZ」透露，林睿哲先前為求折衷，曾嘗試以圓形圖案取代國旗，試圖將其轉化為抽象圖騰，但仍遭主管機關以「飛機只能有註冊國家的塗裝」為由拒絕，只能妥協「飛行可以順利平安抵達目的地最重要。」但依規定可留下機身編號「N688TW」。飛機在註冊時特意使用了TW，在註冊號上埋下一個伏筆。林睿哲因頻繁遭到惡意檢舉，身心俱疲，為了避免不必要的爭端與政治壓力，今日已低調啟程前往下一站，原本預計停靠菲律賓的航段目前已宣告取消。據飛航軌跡監測以及飛機的航程推算，估計最有可能降落於泰國曼谷機場。軍事粉專「TaiwanADIZ」表示，林睿哲承載著無數國人的熱情與期待返抵松山機場。然而，這段追求夢想的旅程，在離開國門後卻處處受制，甚至必須在異鄉親手撕去象徵家鄉的印記。面對艱困的環境與國際現實的無情，林睿哲選擇將愛國心藏在心底，轉而專注於完成這項跨越三大洋的極限挑戰。期盼他平安完成這趟屬於台灣人的環球壯舉。單機環球林睿哲離開松山機場飛往南半球。（「TaiwanADIZ」提供）單機環球林睿哲遭惡意檢舉後「撕除國旗」 低調轉往南半球續飛。（擷取自飛航網站）    ,https://news.ltn.com.tw/news/politics/breakingnews/5482806
國台辦稱統一不損任何國家利益 我國外交部痛批：毫無外交常識,政治,2026/06/24 19:17,中國國台辦發言人張晗24日謬稱，「中國的統一不會損害任何國家的正當利益，包括其在台灣的經濟利益」。我國外交部下午痛批，該聲明「毫無外交常識」。（資料照）中國國台辦發言人張晗今（24）日謬稱，「中國的統一不會損害任何國家的正當利益，包括其在台灣的經濟利益」。我國外交部下午痛批，該聲明「毫無外交常識」，台灣的未來是由2300萬台灣人民自主決定，不容中國置喙。外交部嚴正重申，中華民國與中華人民共和國兩國各自主權獨立互不隸屬，台灣是民主自由的社會，台灣的未來是由2300萬台灣人民自主決定，不容中國置喙。請繼續往下閱讀...外交部強調，台灣基於國家主權與其他國家交往，參與國際社會各項外交活動，積極為國際社會做出具體貢獻，已成為維護全球和平繁榮不可或缺的關鍵夥伴，從來無需取得中國同意及滿足北京任何預設的政治條件。外交部表示，台灣將持續捍衛中華民國之國家主權與尊嚴，擴大深化與其他國家的實質關係，並爭取更多國際參與，以確保區域及台海的和平、穩定與繁榮。    ,https://news.ltn.com.tw/news/politics/breakingnews/5482903
英法德美關切中國襲擾台灣海域 海委會說話了,政治,2026/06/24 18:58,英、法、德、美關切中國襲擾台灣海域。圖為海巡署登檢越界的中國漁船。（海委會提供）中國近期頻繁派遣海警船赴我東部海域「執法」，強化對台灰色地帶襲擾，英國在台辦事處、法國在台協會、德國在台協會今天發布聯合聲明，重申航行權利與自由及海員與船舶的安全至關重要，必須受到尊重並獲得確保，美國在台協會發言人也表達關切。對此，海委會感謝英、法、德發布聯合聲明，內容清楚表達中國近期在台灣東部海域「假執法，真擴權」的活動，已對區域穩定、航行自由與國際航運安全構成威脅。請繼續往下閱讀...海委會也感謝美國在台協會透過訪談的強烈表態，美方在訪談中，直指中國憑藉力量侵奪我國主權與管轄水域的行動，嚴重破壞區域穩定，不僅加劇區域緊張情勢，也破壞其所聲稱追求的和平解決爭議途徑。海委會表示，台灣海峽與台灣周圍海域的航行自由與航運安全，是全球經貿與繁榮所繫。中國對台灣的海上騷擾及其政治壓迫，不但違反國際法，也損害國際社群的共同利益，必須及時遏止，共同協力拒斥。海委會強調，台灣周圍水域的國際秩序，向來不是台灣一方的事，而是國際社群的事。國際社群的共同行動與一致立場，是維繫國際秩序最有力的方法。    ,https://news.ltn.com.tw/news/politics/breakingnews/5482870
談鳳梨釋迦國台辦稱「容得下台灣農產品」 陸委會：標準養套殺,政治,2026/06/24 18:58,中國2021年9月全面禁止台灣鳳梨釋迦進口，2023年雖允許少數果園或包裝場輸入，但中國當地大量生產鳳梨釋迦後，隔年中共宣布取消零關稅優惠，改徵29%稅率。（資料照）中國廣西、雲南等地，種植鳳梨釋迦面積已超越台灣。中國國台辦發言人張晗今日聲稱，中國擁有超大規模市場，完全容得下來自台灣的農產品；陸委會批評，台灣鳳梨釋迦輸中問題，就是標準的「養套殺」過程。國台辦發言人張晗在例行記者會表示，兩岸的鳳梨釋迦各有特色，中國擁有超大規模市場，完全容得下來自台灣的農產品，將秉持「兩岸一家親」的理念，持續幫助台灣農漁民朋友擴展中國市場，切實增加他們的收益。請繼續往下閱讀...對此，陸委會指出，中國於2021年9月片面暫停台灣釋迦輸中，並對於我方持續要求透過兩岸協議平台進行溝通的提議不予回應；2023年6月起再以附加條件及提及政治前提條件下，有限度恢復台灣釋迦輸中，顯然是基於政治考量。且其政策不穩定，宣稱要幫助台灣農民，卻自2024年起對釋迦及其他水果課徵29%（20%的關稅和9%的增值稅）不等的高稅率。陸委會批評，台灣鳳梨釋迦輸中問題，就是標準的「養套殺」過程，中方讓台灣農民承受貿易不確定性及很大的風險，更遑論真正幫助台灣農民。    ,https://news.ltn.com.tw/news/politics/breakingnews/5482879
中國科研船竄航我經濟海域 陸委會：營造管轄權假象,政治,2026/06/24 18:46,中國「向陽紅22」科研船於宜蘭蘇澳東北方31浬處，以15節的速度，沿著我國限制水域線向北侵入限制水域。（資料照）中國「向陽紅22」科研船，日前在我國東部專屬經濟海域來回航行騷擾。國台辦發言人張晗今日聲稱，中國海洋科考調查船在相關海域作業完全正當合法，是為了海洋生態保護；陸委會批評，中共利用科研船在我國專屬經濟海域航行騷擾，意圖營造對我國海域具有管轄權之假象，企圖以灰色地帶侵擾改變現狀。張晗在國台辦記者會聲稱，為全面了解國家管轄海域、自然生態狀況、海洋生態保護，6月16至18日中國自然資源部在台灣島以東海域，開展海洋環境調查。民進黨當局對正常科考作業進行滋擾，是別有用心的政治操弄。若再藉此滋事挑釁，升高兩岸對立對抗，必遭挫敗。請繼續往下閱讀...張晗更說，民進黨當局頑固堅持台獨分裂立場，顛倒黑白、混淆是非，一方面附和日菲嚴重侵權行徑、出賣民族利益，另一方面妄圖藉此挑動兩岸對立對抗，其惡行遭到兩岸同胞堅決反對，也必將遭到歷史懲罰。對此，陸委會表示，中華民國是主權獨立的國家，與中華人民共和國互不隸屬，依據國際法與聯合國海洋法公約，我國在台灣東部專屬經濟海域擁有主權權利與管轄權。陸委會指出，本會支持海巡弟兄為捍衛國家主權、確保我國海域安全，以強勢作為驅離騷擾我國專屬經濟海域的中共船舶，也嚴厲譴責正告中共，應停止此種蠻橫行徑，勿再成為破壞區域穩定的麻煩製造者。    ,https://news.ltn.com.tw/news/politics/breakingnews/5482869
北市府批「過度索資」造成公務員負擔  秦慧珠：應避免點名議員,政治,2026/06/24 18:41,國民黨市議員秦慧珠。（資料照）台北市政府批評民進黨籍市議員簡舒培、林延鳳等人「過度索資」造成公務員負擔，引發綠營強烈不滿，要求道歉。國民黨籍市議員秦慧珠表示，市府可以數據來論理，應該避免直接點名議員，以免造成不必要的紛爭。秦慧珠表示，市府的辯護邏輯是，有人惡意索資、大量索資，讓基層應接不暇，所以才會有最少三天回覆的原則，她認為市府可以透過索資數量，或是有重複索資情形等造成困擾，不要點名議員，現在是選戰的非常時期，很多問題都會被放大解讀，應該避免不必要的紛爭，之後可能還會有很多跟議員有關的攻防，市府要多謹慎，要既能辯護，又不會造成針對議員的狀況。請繼續往下閱讀...國民黨籍市議員楊植斗則認為，只要不是刻意浪費公務員時間，市府點名索資數量多，也是一種肯定，議員應該要檢視一下是否過去有索取沒用的資料，不能索取上千份，結果能用的只有幾十份。他認為，凡事不是非黑即白，他從當助理到議員，也是經常索資，不能一下要大量的資料，又要求局處當天給，不是在刻意刁難，議員心中也有把尺，社會自有公允，認真問政很好，但要有限度。    ,https://news.ltn.com.tw/news/politics/breakingnews/5482864
答鄭麗文3段話「歪七扭八」 林濁水曝：國台辦心中氣不可言,政治,2026/06/24 18:34,"國民黨主席鄭麗文。（資料照）國民黨主席鄭麗文近日接受《經濟學人》專訪時表示，國民黨反對台灣宣布法理獨立，這點與中國國家主席習近平的立場一致。但若中國在台灣未宣布獨立情況下攻打台灣，「我們一定會反擊」。對此，前立委林濁水指出，中國國台辦今日對於鄭麗文專訪內容重要的三段話，「答得歪七扭八」，心中肯定是「氣不可言」。林濁水今日在臉書發文指出，中國人民網、新華社等官媒，對鄭麗文訪美新聞裝聾作啞足足一個月後，今天國台辦記者會終於回應鄭麗文接受《經濟學人》專訪的內容。內容包括：一、國民黨反對台灣宣布「法理獨立」。二、若在沒有「宣布法理台獨」的前提下中國仍犯台，台灣一定戰鬥還擊。三、國民黨擬加速提出無人機和「國防產業法案」。請繼續往下閱讀...林濁水指出，國台辦當然大大肯定反台獨，但對「法理台獨」四個字（因為法理台獨和事實台獨無法切割），及「一定戰鬥還擊」這句最嚴重的話避而不談，逃避地回應「家人有話好商量」。另外，對於「國防產業法案」也避而不談。林濁水表示，有趣的是，鄭麗文那麼重要的三段話，國台辦答得歪七扭八，肯定心中氣不可言。無論如何，鄭麗文的話中「立場」和她鄭習會中展現的大相逕庭，並非本心，之所以清醒，是被國際大勢、台灣民情政治局勢硬逼出來的。可見站在她面前的「客觀結構」不論她心中怎麼想，口頭上還是得改一改。林濁水最後也表示，這一番「硬碰硬」如果能多多發生，兩岸關係的真相才可能沒有掩飾地呈現出來，問題的解決才有機會。    ",https://news.ltn.com.tw/news/politics/breakingnews/5482794
公教停砍年金8月補發差額？  行政院回應了,政治,2026/06/24 18:29,行政院。（資料照）退休公務員停砍年金相關法案仍在釋憲中，考試院銓敘部今（24日）表示，若8月1日前年金停砍釋憲結果未定，將發放差額。行政院表示，尊重考試院的審定權，也期待憲法法庭能儘速判決、釐清相關法律爭議，作為後續行政執行的重要依據。立法院2025年12月三讀通過修正「公立學校教職員退休資遣撫卹條例」與「公務人員退休資遣撫卹法」，自2024年起停砍公務人員年金，行政院、考試院、民進黨立院黨團等陸續聲請釋憲。請繼續往下閱讀...銓敘部日前發文表示，去年12月28日至今年7月31日應補發退休金差額，最遲今年8月1日補發完成，也已交由各發放機關將重審處分及所得附表送抵退休人員。針對公務人員年金補發差額，銓敘部長施能傑今天在立法院答詢時表示，行政院與考試院皆已聲請釋憲，目前程序仍在進行中，若程序上沒有問題，仍會依規劃於8月1日補發。對於退休公教人員是否跟進補發，行政院發言人李慧芝指出，司法院大法官已於2019年針對年金改革作成解釋，確認年金改革的方向與做法合憲，但在立法院再度修改相關法案，實質上將大幅增加政府財政支出。李慧芝強調，行政院尊重考試院的審定權，目前相關法案已進入釋憲程序，行政院期待憲法法庭能儘速作成判決、釐清相關法律爭議，並作為後續行政執行的重要依據。李慧芝說，政府一向重視並持續照顧軍公教人員權益，自2016年以來，已4度調升軍公教待遇；此外，為展現政府提升國軍待遇、強化留才攬才的決心，自2025年4月起陸續調增國軍5項加給，合計每年增加經費逾新台幣146億元，以志願役加給為例，調幅達30%至50%，而戰鬥部隊加給調幅更達133%至140%。    ,https://news.ltn.com.tw/news/politics/breakingnews/5482845
