Title,News_Type,date,content,url
Telegram援交詐騙！台中老司機想色色 險匯款18萬元,社會,2025/09/13 16:43,七旬翁誤信援交詐騙，欲匯款18萬元。（警方提供）〔記者張軒哲／台中報導〕台中市東勢區71歲老翁在LINE看到援交廣告，點擊加入詐團成員為好友，並加入Telegram APP「暱稱：激活專員」作保密聯繫用。後續歹徒謊稱須支付保證金解鎖約會，郭男匯款1萬8千元後，想藉此獲得特殊服務，前天想依指示至銀行匯款18萬元，行員報警後，郭男才臉紅透露實情，警方成功攔阻18萬元匯款。東勢派出所前日上午，接獲銀行來電告知，疑似有詐騙情事需警方協助，東勢派出所警員詹祐祥、警員蔡耀丞到達現場，向匯款人郭男詢問了解，郭男表示9月在家中上網，在LINE看到援交廣告，對方稱須支付保證金解鎖約會，郭男誤以為匯款後，藉此可獲得性交服務，郭男神情異常，行員心生警覺，便通知派出所警員到場關懷，警員查看郭男對話紀錄後，告知郭男此類假援交詐騙手法，才打消匯款念頭，行員與警員成功攔阻18萬元匯款。請繼續往下閱讀...東勢分局東勢派出所所長周信忠提醒，近期援交詐騙手法層出不窮，詐騙集團利用通訊軟體LINE傳送「特殊交友」訊息，誘騙受害者先支付高額「保證金」與「手續費」，承諾事後安排見面，一旦匯款，對方隨即神隱消失，尤其是來路不明「交易」或「交友」邀約，請多查證，不熟帳號不要加，不合理要求不要理，遇可疑狀況，務必撥打165專線。警方檢視郭男手機對話，研判是援交詐騙。（警方提供）熱門賽事、球星動態不漏接    ,https://news.ltn.com.tw/news/society/breakingnews/5177022
登頂太開心回程踩空！玉峰主峰山友受傷 空勤直升機救援,社會,2025/09/13 16:33,女山友在玉山北岔路風口摔傷，由空勤直升機吊掛下山。（資料照，南投縣消防局提供）〔記者陳鳳麗／南投報導〕攀登玉山主峰的女山友跌倒受傷，由空勤直升機救援下山就醫，該山友受傷原因曝光，並非她體能不夠，而是登頂後太開心，回程沒有注意步道狀況而踩空受傷，玉管處提醒山友，完美的登山行程，不是登頂的瞬間，是安全抵達登山口才結束，回程更要維持穩健步伐。一支19人登山隊5日由塔塔加登山口入山攀登玉山，6日清晨50歲女性山友登頂後，下撤至北岔路風口時摔傷，導致右膝、下巴、左眼撕裂傷，南投縣消防局申請空勤直升機搭載下山就醫，該女友傷勢無大礙，事後告訴玉管處等人員，她當天不是體能不好而摔倒，而是登頂後太開心，回程時還在回憶登頂的歡樂情景，沒注意步道狀況而踩空摔倒受傷。請繼續往下閱讀...玉管處表示，今年在玉山主峰的往返路線，已發生6起創傷或墜谷意外，繼女山友踩空摔倒之後，12日又有山友在主峰線腳扭傷由消防救難人員接應下山，創傷是該園區最常見的山域事故類型，卻也是山友能夠自我掌握且避免的事故，很感謝該名女山友的回饋，提醒其他山友在主峰線注意。玉管處也說，登山行進間一定要留意腳步的踩點是否穩固，行進間不冒險、不衝刺、不拍照、不滑手機、不看風景，隨時注意路況，一步踩穩後再抬起下一步，以減少創傷或墜谷的山域事故。玉管處提醒山友往返主峰線不要分心，一定要維持穩健步伐。（南投縣消防局提供）熱門賽事、球星動態不漏接    ,https://news.ltn.com.tw/news/society/breakingnews/5177041
新竹女偷看同事薪資條 法官判賠1萬,社會,2025/09/13 16:26,彭女偷看同事薪資條，法院判賠償1萬元。（情境照）〔記者廖雪茹／新竹報導〕新竹某科技公司員工劉姓女子控訴彭姓女同事，下班後8次窺視其辦公桌上的私人文書，其中更趁劉女請假而當日正好發放年中獎金，連續3次進入其座位窺視半彌封的薪資條，已嚴重侵害其隱私權，導致她感到被監視的恐懼，飽受精神壓力，因而提告求償50萬元精神撫慰金，新竹地方法院判彭女要賠償1萬元。判決書指出，劉女和彭女為同事，劉女指控彭女於2023年12月至2024年6月期間，共8次於下班時間窺視她辦公桌上的私人文書，劉女認為兩人素無交情，亦非友好關係，彭女竟於下班後多次窺視，其中彭女在去年6月28日的3次窺視更是在她請假，且當天發放年中獎金薪資條，趁同事都下班後，在半小時內進入她的辦公領域3次，僅為滿足私慾，令人感到恐懼與憤怒。請繼續往下閱讀...彭女則說，她在公司十幾年，下班晚走時，都會基於安全考量大概巡視，是因為聽到有聲音才去看一下。而去年6月28日是因為剛好經過劉女位置看到薪資條，基於好奇心進去看，其餘幾次都在劉女位置外看，沒有走進去，也未曾動手翻看，並無侵害劉女隱私。法官調查，彭女5次的窺視行為，僅係刻意探頭看向劉女辦公位置，並未進入劉女座位的隔間內，且時間也僅有幾秒鐘，各次窺視間隔2個禮拜至2個月，難認此舉構成隱私權侵犯。至於彭女去年6月28日的3次窺視行為，法官認為，彭女未經劉女同意，又無何正當理由，於劉女請假、當天發放薪資條情況下，半小時內連續進入劉女相對自主領域低頭窺視劉女桌面上薪資條3次，各次窺視時間均達10秒許，且窺視含有個人隱私資訊的薪資條，甚至刻意查看無人後進入，已構成對於劉女隱私權侵害。法官認為，劉女因隱私遭侵擾感受精神痛苦，請求賠償有據。審酌綜合雙方職務、財力及侵害影響程度，並考量仍為同事關係，請求50萬元過高，應以1萬元為適當。彭女偷看同事薪資條，法院判賠償1萬元。（記者廖雪茹攝）熱門賽事、球星動態不漏接    ,https://news.ltn.com.tw/news/society/breakingnews/5177021
國家防災日將至 南市打火弟兄深入社區、景點宣導體驗,社會,2025/09/13 16:25,南市消防局第五大隊文賢分隊前進奇美博物館舉辦宣導活動，迴響熱烈。（南市消防局提供）〔記者吳俊鋒／台南報導〕結合921國家防災日，台南市消防局安定、文賢等分隊今天各深入社區親子水樂園現場，以及熱門景點奇美博物館，舉辦宣導體驗活動，並透過闖關遊戲，讓大小朋友深刻認識災害的可怕，提升自身緊急應變的能力，培養防災韌性。消防局第五大隊文賢分隊今天前進奇美博物館舉辦防災宣導活動，採多攤位同步進行，靜態攤位為文宣展示與解說，動態攤位則是教學闖關，讓民眾感受藝術薰陶，也能參與消防體驗。請繼續往下閱讀...為協助民眾體驗與操作各項活動，共設計5個關卡站，分別為靜態展示的居家安全宣導之爐火烹調習慣、居家安全宣導之電器使用習慣，以及居家安全宣導之抽菸習慣等，強調防範電氣火災，要遵守 「5不1沒有」原則，也要注意菸蒂處理，避免引發火警，造成財物損失或人命傷亡。動態體驗教學則有CPR教學與AED操作，以及一日小小消防員的著裝，透過寓教於樂的方式，讓防火教育從小扎根，也藉此提升民眾的防災意識與自身緊急應變能力，在災害來臨時，將生命財產的損失降至最低。安定區農會今天也有一場夏季水樂園親子活動，消防局第四大隊安定分隊設置防災宣導區，宣導住家每個居室應有住宅用火災警報器，也可安裝「無線連動式住警器」，讓安全更提升。正值天氣炎熱、用電高峰，現場也宣導使用延長線應注意負載，安定位處曾文溪畔，轄內有嘉南大圳，呼籲民眾戲水，要前往合法水域並注意天氣狀況，實際正確穿戴救生衣；中秋佳節將至，選購合格標示之煙火，居家勿囤積炮竹。為防範一氧化碳中毒，現場也宣導民眾使用燃氣熱水器，務必注意安裝位置與通風，無論冬夏季節都要保持警覺，還有實際操作CPR與AED，搭配有獎徵答活動，吸引大小朋友熱情參與，寓教於樂學防災。第四大隊長蔡國保表示，今年1月的楠西地震、7月丹娜絲颱風、8月豪大雨等，造成台南多處災情，災害來得又快又急，應從生活中培養防災韌性，有準備更安全，減少災害帶來的威脅，亦宣達民眾可加入義消志工或投入防災士行列，提升社區救災能量。消防局長李明峯也強調，面對極端氣候加劇，各式災害發生頻率上升，為了能在緊急時刻迅速應對，居家應備妥「緊急避難包」，裡面內容至少3天份的基本物資，並且放在門口或玄關，萬一停電或夜間緊急撤離，可以拿了就走。市長黃偉哲感謝消防局舉辦防災宣導體驗活動，讓民眾透過實際行動學習防災意識，有效提升火場自救應變能力，並期許藉由深刻的教育體驗，能將消防安全知識傳遞到每個家庭與社區，強化台南整體防火、防災安全。南市消防局第五大隊文賢分隊前進奇美博物館舉辦宣導活動，還有CPR的實際操作。（南市消防局提供）南市消防局第四大隊安定分隊到親子水樂園現場舉辦宣導活動，迴響熱烈。（南市消防局提供）南市消防局第四大隊安定分隊到親子水樂園現場舉辦宣導活動，迴響熱烈。（南市消防局提供）熱門賽事、球星動態不漏接    ,https://news.ltn.com.tw/news/society/breakingnews/5177025
菲籍移工離台前賣帳戶給詐團賺1萬比索  轉機時意外落網,社會,2025/09/13 15:55,菲律賓籍女移工離台前把銀行帳戶賣給詐團賺1萬比索，在台轉機時意外落網，法官駁回聲請具保停止羈押。（記者廖雪茹攝）〔記者廖雪茹／新竹報導〕菲律賓籍移工小莉（化名）在台工作結束，以菲幣比索1萬元代價把在台的銀行帳戶賣給詐欺集團，打算撈一筆錢後離台，而詐團也以詐術騙3名男子得手19萬2000元，警方獲報追查；沒想到，小莉在台灣轉機準備前往他國工作時意外被警方逮到，新竹地方法院判處有期徒刑4個月，並駁回小莉聲請具保停止羈押。判決書指出，小莉在我國境內居留效期已於2023年5月8日屆滿，她卻於2023年底某日，將在台申辦的銀行帳戶、提款卡以及密碼交付給詐欺集團成員，獲取菲幣比索1萬元報酬。詐團透過通訊軟體，以投資虛擬貨幣，保證獲利、穩賺不賠等，於2024年11月間陸續騙取曾男、李男、李男匯款2萬2000元至5萬元不等，合計19萬2000元金額轉入小莉銀行帳戶，隨即提領一空。曾男等被害人事後察覺遭騙後報案，警方循線查獲小莉銀行帳戶，因違反洗錢防制法等案件，經檢察官提起公訴。請繼續往下閱讀...判決書指出，小莉明知把銀行帳戶及密碼提供給他人使用，可能因此幫助詐欺集團遂行詐欺取財、洗錢等犯行，竟因自己暫無在台繼續工作、居留的計畫，為牟詐欺集團允諾報酬，即以菲幣比索1萬元代價，將銀行帳戶提款卡暨密碼交予詐欺集團成員使用，使詐團成員得以作為詐欺取財、洗錢工具。法官審酌，小莉此舉不僅造成告訴人財產上損失，亦徒增尋求救濟困難，並使執法人員難以追查該詐欺集團成員真實身分，小莉行為當無任何可取之處，也未賠償告訴人任何款項，因此依幫助犯洗錢防制法洗錢罪，處有期徒刑4個月，併科罰金新台幣1萬元，服刑期滿或赦免後，驅逐出境。對於小莉聲請具保停止羈押，法官認為，小莉僅因在台轉機方偶然為警方查獲，顯有逃亡之虞，為保全程序進行，認有羈押的必要。熱門賽事、球星動態不漏接    ,https://news.ltn.com.tw/news/society/breakingnews/5176919
克萊斯勒300C改標變身「賓利」上路是否觸法？監理單位這樣說,社會,2025/09/13 15:49,這輛肇事的克萊斯勒300C，將車標改掛賓利上路行駛，有如「山寨車」。（警方提供）〔記者丁偉杰／嘉義報導〕嘉義市忠孝路昨（12）日一輛美國克萊斯勒300C變身而成的Bentley賓利，與另輛Toyota國產車發生碰撞車禍，引起網友熱議，這輛克萊斯勒300C廠牌標誌改掛賓利標誌上路行駛，有如「山寨車」，至於是否觸法？警方說，實務上不會因此開出交通罰單，但若涉及買賣詐欺等行為將觸法。嘉市監理站長吳孟峰說，依道路交通管理處罰條例第16條「未依規定於車身標明指定標識」，可處汽車所有人900元以上1800元以下罰鍰；廣義而言，車標也算是一種指定標識，改車標上路，會不會被開罰單，仍應由警方視實際狀況而定。請繼續往下閱讀...吳孟峰說，改車標不視為改裝車體，驗車時一定不會通過，一旦遇到更改車標，監理單位雖不會主動檢舉裁罰，但會請車主改回原車標。嘉市警局交通隊指出，在交通法規上，改車標不構成車牌變造或號牌偽造，所以不會觸犯「道路交通管理處罰條例」第12條變造號牌；在實務上，警方不會因改車標而開交通罰單，但改車標若涉及買賣詐欺等行為，即觸法。熱門賽事、球星動態不漏接    ,https://news.ltn.com.tw/news/society/breakingnews/5176977
大膽航警長期收賄  放行夾帶加熱菸從公務門入境被收押,社會,2025/09/13 15:35,陳姓航警利用當班機會，放水讓民眾從公務門攜帶大量免稅菸品入境，陳姓警員、楊女聲押禁見，院方今下午將開庭審理本案。（資料照）首次上稿：10:59更新時間：15:35（新增加熱菸）〔記者謝武雄／桃園報導〕航空警察局保警大隊陳姓警員，涉嫌收受楊姓女子賄款，利用工作之便放行楊姓女子從公務門夾帶加熱菸入境，11日又放行楊姓及巫姓女子攜帶449條加熱菸及17組主機入境，被航警局、海關逮個正著，檢察官認為全案涉犯貪污治罪條例對公務員違背職務交付賄賂罪嫌，巫女以6萬元交保；陳姓員警、楊女有勾串、滅證及逃亡之虞且，昨晚間向法院聲請羈押禁見，院方今裁定兩人收押禁見。請繼續往下閱讀...法官認為，陳姓員警所犯為最輕本刑10年以上重罪，他有刪除手機通訊對話情況，另本案犯罪情節仍待調查，有相當理由認被陳姓員警告有滅證、勾串之虞，酌量犯罪情節對公益之侵害，確認有羈押之原因及必要；至於楊女部分，由於涉案時間長達數個月，相關各次犯行、情節及參與人員等均待偵查機關逐一調查，依照被告之入出境頻繁入出境情況，衡酌犯罪行為對公益之侵害甚大，認被告有羈押之原因及必要。據悉，加熱菸在台灣有相當多癮君子使用，但仍未合法，只是坊間都可以買得到，由於很多國家加熱菸是合法的，從國外夾帶加熱菸回國就可獲取暴利；由於楊女以往就有夾帶被海關查獲紀錄，因此被列入入境回國必須檢查行李的名單中，日前海關發現楊女回國卻未清查行李，調查後才發現她走公務門，於是通報航警局，利用楊女、巫女於本月11日回國走公務門時逮個正著。警方在兩女的行李箱中發現449條加熱菸及17組主機，市價約95萬元，扣除國外購入成本約可獲利40萬元以上，至於攜帶加熱菸及主機則是違反菸防制法第15條第1項第3款規定，依該法第26條第2項規定可處5萬元以上、500萬元以下罰鍰。檢方調查發現，陳姓員警曾多次收受楊姓女子賄款，並利用輪值機場入境管制區公務門管制哨之機會，非法放行被告楊姓女子等人攜帶裝有菸品行李自公務通道通關。熱門賽事、球星動態不漏接    ,https://news.ltn.com.tw/news/society/breakingnews/5176648
老鄰居建物糾紛結怨多年 立牌揭個資遭判罰6萬,社會,2025/09/13 15:10,8旬呂翁為了建物糾紛再度槓上老鄰居，被控立板張貼寫有鄰居全名紙張；基隆地院依呂翁違反個人資料保護法判罰6萬元。（示意圖）〔記者林嘉東／基隆報導〕基隆市8旬呂翁與沈姓鄰居為了建物產權糾紛結怨已久；未料呂翁竟在2人興訟多年的建物外，立板張貼、寫著「隔壁沈00詐欺、侵占、偽造文書，訴訟中」等數張紙張，文中不僅披露沈全名，還揭露沈住址等個資。基隆地院審理後，認為呂犯個人資料保護法，判處2月徒刑，得易科6萬元罰金。判決指出，呂翁與沈男為多年鄰居，2人為了1間建物產權興訟多年，去年2月19日下午5時許，呂突然在2人興訟多年的建物外，立板張貼、寫著「隔壁沈00詐欺、侵占、偽造文書，訴訟中」等數張紙張、及載有沈完整姓名住址，與呂告沈的告訴狀及陳報狀等紙張；沈看到後怒告呂違反個人資料保護法，及損害他的名譽、與隱私。請繼續往下閱讀...法院審理時，呂坦承犯行，也當庭向沈道歉，但未與對方達成和解；法官審酌呂年逾80歲，與沈為了建物產權糾紛，爭訟多年，不思謀求和平理性處理糾紛方法，反未經沈同意，張貼載沈的個人資料等文件，不僅洩漏沈個人資料，更激化雙方衝突，依呂犯個人資料保護法「非公務機關非法利用個人資料罪」，判處2月徒刑，得易科6萬元罰金。熱門賽事、球星動態不漏接    ,https://news.ltn.com.tw/news/society/breakingnews/5176901
宜蘭大溪漁港防波堤延長工程  施工浮台船今晨外海沉沒,社會,2025/09/13 14:44,浮台船今晨在宜蘭石城外海沉沒 。（宜蘭縣府提供）首次上稿：13:39更新時間：14:44〔記者王峻祺／宜蘭報導〕宜蘭縣斥資4.3億元投入大溪漁港東防波堤延長工程，原定今天上午10點要進行第2座沉箱定位，未料載運沉箱的施工浮台船，今晨6點多竟在石城外海沉沒，疑因底部破損進水後傾斜沉船，所幸無人員傷亡，縣府評估工程恐受影響延宕，已請廠商釐清事故原因及責任歸屬，損失恐達數千萬元。請繼續往下閱讀...宜蘭縣政府農業處說，「大溪漁港東防波堤延長工程」前年底動工，目前正進行沉箱拖航定位作業，昨天中午12點45分從台北港啟航拖放沉箱，由大漢711、東彥1號拖行放置沉箱的浮台船，並由東彥3號警戒船警戒。今天清晨5點浮台船底部疑破損進水後開始傾斜，有2名工作人員隨即上船檢查，研判已無法搶救即棄船逃生，2人由警戒船接應安全上船，並通報航港局，浮台船於上午6時30分沉沒於石城外海。農業處指出，浮台船無動力，無油污污染疑慮，規範50公尺以內才需打撈，沉船位置水深80公尺，同時研判打撈不符效益及時程，暫定不執行打撈作業。農業處表示，1座沉箱造價2900萬元，補做新沉箱預計工期需3個月，目前評估於原場地台北港製作，同時尋找新的浮台船進行拖航定位，整體工程進度70.25%，原預定明年10月完工，但因發生沉船意外，勢必影響進度，後續責任歸屬及損失尚待釐清，雖有投保但估計損失恐超過數千萬元。載運沉箱的浮台船疑似底部破損進水傾斜後沉船。（宜蘭縣府提供）浮台船疑似底部破損進水傾斜後沉船。（宜蘭縣府提供）熱門賽事、球星動態不漏接    ,https://news.ltn.com.tw/news/society/breakingnews/5176837
收賄放行旅客走公務門走私加熱菸  桃機航警被收押免職,社會,2025/09/13 14:26,陳姓航警涉嫌縱放旅客自公務門走私加熱菸品。（記者劉信德攝）首次上稿:14:26更新時間:21:06〔記者劉信德／桃園機場報導〕桃園國際機場驚傳航警收賄勾結旅客走私案件。財政部關務署臺北關稽查人員於9月11日中午查獲兩名自韓國入境的楊姓、巫姓母女，利用公務門夾帶加熱菸449條及主機17組入境，現場並發現航空警察局警員陳柏融涉嫌縱放，隨即通報航警共同偵辦。桃園地檢署昨（12）日晚間以涉犯貪污治罪條例違背職務收受賄賂罪嫌，向法院聲請羈押陳員及楊女，並於13日裁定予以羈押，並禁止接見通信。請繼續往下閱讀...這對楊姓、巫姓母女早有夾帶加熱菸品記錄，並遭臺北關標為「注檢」名單，也就是通過海關時將被攔下檢查行李。不過此次這對母女並未出現在一般旅客通道，而是走向入境管制區南側海關公務門，台北關攔下二人後，立刻通報航警局共同偵辦此案，並在兩人行李內查獲449條加熱菸與17組主機。涉案的航警陳柏融警專36期，畢業後第一個單位即在航警服務，已從警6年。平日輪值執勤的公務門進出依規定需要刷卡辨識，隨身手提物件也必須通過X光機檢查，全程均有監視器監控記錄，陳員從此公務門放行無證件人員夾帶走私加熱菸的行徑相當大膽。據了解，此案是首次查獲旅客未經海關查驗，直接透過公務門走私加熱菸入境，經查陳員多次收受楊女賄款，利用值勤公務門管制崗哨之便，非法放行其攜帶加熱菸闖關，實際的受賄次數及金額仍待調查。不過航警局已於12日上午召開專案考績會，將陳員兩大過免職，斷然汰除。桃園地檢署也發佈新聞稿指出，本案由肅貪組檢察官曾柏涵指揮偵辦，檢察官訊後認定陳員及楊女涉犯貪瀆，犯罪嫌疑重大且有串證、滅證之虞，向法院聲請羈押禁見獲准；巫女則諭令6萬元交保。臺北關強調，加熱菸屬未經核定通過健康風險評估之菸品，違反《菸害防制法》第15條規定，旅客攜帶入境可處5萬元以上、500萬元以下罰鍰，籲請民眾勿以自用、餽贈或代購為由違規攜帶。海關強調將持續與航警等執法單位合作，加強邊境查緝能量，杜絕走私與貪瀆行為，維護國人健康與邊境安全。陳姓航警涉嫌縱放旅客自公務門走私加熱菸品。（記者劉信德攝）熱門賽事、球星動態不漏接    ,https://news.ltn.com.tw/news/society/breakingnews/5176874
前環保署惡狼李健育涉性侵猥褻4女起訴求重刑  裁定延押2月,社會,2025/09/13 14:05,台中地院裁定自9月16日起延押李健育2個月。（資料照）〔記者許國楨／台中報導〕環境部（原環保署）前環境督察總隊長李健育，涉嫌長期利用職權性侵與猥褻下屬與訓練班學員，在公務車、高鐵及出差住宿期間，對4名女性實施多次強吻、撫胸、正面熊抱，甚至指侵等行為，部分女性因懼其職權長期忍受，檢方在今年6月依強制性交、強制猥褻及利用權勢猥褻等10罪起訴，並建請法院從重量刑。台中地院審理後認為，李健育涉案嫌疑重大，仍需傳喚被害人交互詰問，且其身為前主管及訓練班指導者，與被害人存在權勢關係，有勾串證人及反覆犯罪之虞，為此近日裁定，自9月16日起延押2個月，禁止接見通信，以確保審判順利進行。請繼續往下閱讀...中檢起訴指出，李於2022至2023年間，藉長官權勢在台中市機關處所辦公時間，以及前往外縣市出差機會，對女性所屬職員、學員施加強制猥褻、利用權勢猥褻、強制性交等性侵害行為，被害人合計4人，偵查終結認定他涉嫌觸犯刑法強制猥褻共6罪、利用權勢猥褻共3罪、強制性交共嫌1罪，共計10罪而提起公訴。檢方認為，李時任機關最高長官，本應謹言慎行、潔身自愛，竟為逞一己私慾，恣意侵害受其指揮、監督之下屬，嚴重敗壞官箴，重創所屬機關形象，更造成被害人身心難以抹滅的重大傷害，建請法院從重量刑，以儆效尤。中院則強調，延押有助防止勾串證人及再次犯罪，並保障審判公正，該案經檢方起訴移審後，第一次羈押3月即將屆滿，裁定自9月16日起第1次延長羈押2月，禁止接見通信。熱門賽事、球星動態不漏接    ,https://news.ltn.com.tw/news/society/breakingnews/5176826
