Title,News_Type,date,content,url
資策會告高虹安違著作權法 二審智慧法院判撤銷發回更審,社會,2026/04/16 10:05,新竹市長高虹安。（資料照）新竹市長高虹安被控其的博士論文抄襲資策會依經濟部補助計畫產出的兩篇論文，涉違反著作權法；台北地院刑庭2023年7月認定已逾告訴期，判決刑事自訴不受理，全案上訴二審，智慧財產及商業法院今日判決將原判決撤銷，發回台北地院更審。資策會自訴指控，高虹安的辛辛那提大學博士論文，包含文字、圖片、表格、公式，都複製資策會在2017年產出的兩篇論文，其中一篇被重製約8成、另一篇約3成，且未註明引用出處，就上傳資料庫供大眾下載，涉違反著作權法。請繼續往下閱讀...北院刑事法官認為，旅美教授翁達瑞（本名陳時奮）早在2021年10月就於臉書指控高虹安的博士論文涉嫌抄襲，資策會知悉後即有聯絡高，並發交所屬的科技法律研究所比對相關論文最終認定雖有抄襲問題，但因高虹安未將其理論實際應用，決議不予處理。法官認為，由此可見資策會早已知悉，資策會卻直到知情後1年的2022年10月25日才提出訴訟，已逾著作權法的6個月告訴期限，2023年7月判決自訴不受理。二審開庭時，高虹安強調，博論引用的資策會2篇期刊論文，是她任職資策會參與的研究、擔任第一作者，辛辛那提大學證明她「自我引用」、不涉及抄襲與學術不倫，更重要的是，資策會最初聲明不涉及侵權，就是回應陳時奮2021年的爆料，代表資策會早就知情、本案確實提告逾告訴期。高虹安雖一審刑事獲判公訴不受理，但民事部分，資策會向她求償提訴求償100萬元；智慧財產及商業法院認定，高的博士論文與兩篇著作相同文字或圖表的比例，分占約高達8成或3成以上，且兩著作的研究核心及精髓所在，均複製於博士論文內，已逾越合理必要程度，判決高虹安賠償40萬元，並移除抄襲內容，且須於報紙刊登判決主文等內容。    ,https://news.ltn.com.tw/news/society/breakingnews/5405488
謝宜容涉貪認罪哭求減刑失敗！ 二審駁回上訴仍判4年6月,社會,2026/04/16 10:01,謝宜容圖利案今宣判。（資料照）前勞動部勞動力發展署北分署長謝宜容，指示部屬幫廠商習翌公司量身訂作採購案，圖利金額42萬餘元，另以就業安定基金等預算，購買三節禮盒12盒據為己用；新北地院合議庭以圖利、侵占公有財物共3罪，判處謝宜容4年6月徒刑，褫奪公權3年。謝宜容、檢方皆提起上訴，高院今宣判褫奪公權從3年改2年，其餘駁回上訴。可上訴。謝宜容於2023年新莊本部整修工程採購案公告前，指示部屬與習翌公司開會討論標案內容，甚至拆分工程，避免逾150萬元採購案須加入外部評選委員變數，習翌借牌投標獲利25萬餘元。請繼續往下閱讀...北分署去年所有對外活動、宣傳品的視覺設計採購案，謝也為習翌公司量身訂作，圖利金額17萬餘元；她另涉侵占「就業安定基金或就業保險基金」預算，購買合計2萬餘元的12盒禮盒贈送親友。新北地院合議庭審理時斥責謝女所為損及國家機關、全體公務員形象，審酌偵審認罪、繳回犯罪所得等因素，依貪污治罪條例規定減刑後，以圖利、侵占公有財物共3罪，判處謝宜容4年6月徒刑，褫奪公權3年。同案被告一審判決，北分署劉姓女主任、簡姓男股長、郭姓女督導員3名公務員犯圖利罪，判處1年4月至1年8月不等徒刑，習翌公司負責人兄弟檔林峯白、林峯立分別被判刑2年、1年8月，借牌給習翌投標的徐姓業者判刑5月，上述6人均緩刑但須分別向公庫支付5萬元至15萬元不等金額。案經上訴，高院審理時，謝宜容認罪、請求緩刑，多次情緒激動落淚，強調自己有深切反省，過去太驕傲、自以為是，但不是故意犯罪要圖利任何人，希望高院合議庭能憐憫她，給予減刑。不過高院僅針對褫奪公權部分改判，從3年改為2年，其餘駁回上訴，刑度維持4年6月徒刑。可上訴。    ,https://news.ltn.com.tw/news/society/breakingnews/5405514
台中人口飆破286萬！6/9再釋1張當舖牌照 歷年「搶破頭」場景將上演,社會,2026/04/16 09:57,台中市人口飆破286萬人，市警局宣布將再釋出1家當舖籌設名額。（記者許國楨攝）台中市人口持續攀升，再度帶動特許行業名額釋出！根據統計，截至去年底台中市人口已達286萬8465人，市警局依當舖業法規定，公告將新增籌設1家當舖業，自4月20日起至5月12日開放申請，預計於6月9日下午3時，在潭子區警察局大樓公開抽籤，採公平、公開方式決定最終名額，消息一出再度引發關注。據了解，早期規範每3萬人口設置1家當鋪，但隨著時代變遷，為提供民眾更多元資金需求管道，當舖法變更為每2萬人設置1家，台中市近幾年第1次釋出牌照申請在2018年間，因應人口增加，一口氣開放10張當鋪牌，當時吸引399人送件，經審核符合資格共380人，競爭相當激烈。請繼續往下閱讀...前年台中市人口突破285萬大關，市警局再開放3張當鋪牌照，共115人符合申請資格中籤率還不到3%，難度及搶手程度可想而知，而此次僅釋出1個名額，勢必再掀一波搶申請熱潮。市刑大表示，目前台中市已有294間當鋪，有意參與申請抽籤申請人，需設籍台中市滿1年以上，並提供籌設申請書、身分證影本、戶籍謄本、相關切結書、營業場所、庫房所有權狀及經公證租賃契約影本和所在地安全設備圖說，另為確保營業場所公安，也需向相關主管機關申請營業處所建物登載使用類組、使用區分、商業名稱等證明文件，相關資訊已在市警局與刑警大隊網站及布告欄公告。前年在市警局進行當舖牌照抽籤的情形。（警方提供）當時中籤率還不到3%，難度及搶手程度可想而知。（警方提供）    ,https://news.ltn.com.tw/news/society/breakingnews/5405478
高雄女騎士闖紅燈遭車撞 機車起火釀火燒車,社會,2026/04/16 09:55,火勢撲滅後，機車已被燒到只剩骨架，休旅車的車頭也受波及。（圖由民眾提供）高雄市三民區金鼎路今（16）日上午約7點半發生車禍釀火燒車事件，吳女（51）歲騎乘機車行經金鼎路與資源回收廠便道路口時闖紅燈，遭林女（45歲）駕駛的休旅車撞擊，吳女跌倒在地手腳擦挫傷，但機車瞬間起火燒成骨架，休旅車頭也受波及。三民二分局交通分隊指出，經查，車禍當時林女駕駛休旅車行駛於中區資源回收廠便道往南方向欲左轉金鼎路，吳女騎乘機車沿金鼎路往西直行，因騎士違規闖紅燈，雙方於路口發生碰撞，造成吳姓女騎士手腳擦挫傷，經送醫治療後無大礙。請繼續往下閱讀...此外，機車與休旅車碰撞後，機車瞬間起火，消防人員獲報到場後火勢很快撲滅，但機車已燒成只剩骨架，休旅車則是車頭引擎處也遭火舌波及。警方初步研判，肇因為吳姓女騎士違規闖紅燈，違反道路交通管理處罰條例第53條第1項規定，可處1800至5400元罰鍰。詳細肇因將由交通大隊進一步分析研判。機車騎士遭休旅車撞擊後，騎士跌落一旁，卡在休旅車下方的機車瞬間起火。（圖由民眾提供）休旅車與機車碰撞後釀成火燒車。（圖由民眾提供）消防車抵達現場滅火。（圖由民眾提供）    ,https://news.ltn.com.tw/news/society/breakingnews/5405489
幼童餓肚子在外遊蕩 警上門見毒母讓3幼子暴露毒煙中,社會,2026/04/16 09:54,吸毒四寶媽，任由孩子餓肚子，3個孩子有毒品反應緊急安置，後來又生1個，還無力接回小孩，南投地院准予延長安置聲請。（記者陳鳳麗攝）可憐！一名3、4歲男童肚餓在外遊蕩，警察帶回派出所吃飯，得知還有小弟在家裡，懷孕媽媽在吸毒，警方與社工破門而入，2幼童皆被安置，毛髮驗出3月內有使用毒品，1個月後母親生產，新生兒也有毒品戒斷症狀也獲緊急安置，3人安置1年多，母親葉又遇暴力男友，法院裁定延長安置。3、4歲大的小男童，前年4月在母親租屋處外遊蕩，巡邏警察發現，他告訴警察，媽媽沒有給他吃東西肚子很餓，警方敲門無回應而帶回派出所吃飯，男童聊天中描述媽媽在吸煙，家裡還有弟弟，警方會同社工破門而入，帶出更小的男童，2人緊急安置，當年6月毛髮驗出3個月內有使用安非他命毒品。懷孕毒媽1個多月後再生1子，嬰兒出生沒多久就有毒品戒斷症狀，再予以安置。請繼續往下閱讀...吸毒母親1年多後搬到南投縣居住，3子去年6月也安置到南投縣，母親有來探視1次，2個月後孩子的媽媽再生第4個孩子，孩子生長狀況正常，因男友會暴力相待，不敢帶3個孩子返家。南投縣府評估，老大的生父也是毒品人口，老二、老三父不詳，父親端無法扶養照顧孩子，這個「四寶媽」有意將老大出養，只養較小的2個，縣府繼續向法院聲請延長安置3個月，南投地院准予延長安置的聲請。    ,https://news.ltn.com.tw/news/society/breakingnews/5405491
剴剴案》兒福聯盟社工陳尚潔一審過失致死判2年 偽造文書無罪,社會,2026/04/16 09:32,男童凱剴遭保母虐死案，兒福聯盟社工陳尚潔（右）涉過失致死，一審今日宣判2年徒刑。（資料照）惡保母姊妹檔劉采萱、劉若琳虐死男童剴剴，負責定期查訪的兒福聯盟社工陳尚潔涉嫌目睹剴剴身上有多處瘀傷卻幫惡保母找藉口安撫剴剴外婆，導致剴剴錯失救援機會，並且不實記載剴剴死因為溢奶，2024年8月被檢方依照過失致死罪、偽造文書罪嫌起訴。台北地院歷經1年多審理，今（16）日上午宣判，依過失致予罪處陳尚潔2年有期徒刑，被控偽造文書部分無罪，可上訴。回顧本案，2023年8月剴剴的外婆經兒福聯盟媒介，將剴剴交由劉彩萱照顧，未料不到3個月剴剴遭虐死，後續劉采萱、劉若琳被依虐童致死等3罪起訴，並於今年1月27日分別被高等法院判處無期徒刑、18年有期徒刑。然而，在劉姓姊妹虐死剴剴案的偵辦期間，剴剴親友質疑兒福聯盟社工陳尚潔訪查不實、造假資料，才會導致剴剴錯過黃金救援時間。請繼續往下閱讀...後續檢方查出，陳尚潔非但不實記載剴剴死因為溢奶，平時更未按月視訪後撰寫工作紀錄，反倒是在剴剴案爆發以後，於雲端增補、修改工作紀錄，檢方痛批陳女態度惡劣、狡辯飾詞、藏匿證據、干擾辦案，犯後毫無悔意，依照過失致死罪、偽造文書罪起訴陳女，並建請法院從重量刑。本案於今年2月26日辯論終結，陳尚潔表示，會選擇社工這條路是因為個人信仰，因為她認為自己是命好的孩子，應該付出更多，讓好命更有意義，所以才放棄台大法律系，去念台大社工系。她說，自己越工作越發現，收出養工作很困難，孩子也有很多辛苦，擔心自己沒有被喜歡、被想要，有沒有被新的父母喜愛，而她也盡可能幫助孩子被收養後的生活順利一點。陳尚潔也對剴剴外婆隔空喊話說「我坐在這裡，跟妳是對立的位置，說我不受傷是騙人的，但妳一定承受更多痛苦」、「案件中有太多假消息，以訛傳訛，都是假的，我很認真工作，從來沒有要騙妳」，並強調「在神和人面前，我都很認真。」另外，陳尚潔也指出，當初檢察官勸她認罪才可能減輕刑責或緩刑，她也想過自己是否該大事化小、小事化無，但她不能因為輕鬆而承認根本沒做過的事情，她想跟大家說明社工工作的內容，不是為了她自己，而是為了未來不要再有任何社工遭遇一樣的事情。兒福聯盟社工陳尚潔涉過失致死與偽造文書，一審於今日宣判，剴剴戰士一早就在法庭外集結、聲援。（記者翁靖祐攝）女星郁芳、何嘉文一早也來聽判。（記者翁靖祐攝）    ,https://news.ltn.com.tw/news/society/breakingnews/5405401
酒駕傷亡增5成！豐原警全天候攔查 網議：最近怎麼了？,社會,2026/04/16 08:57,豐原分局白天加強路檢。（警方提供）台中市豐原分局統計轄區酒駕交通事故件數發現，今年1至3月酒駕交通事故受傷人數較去年同期增加13人，增加比例超過50%。為有效降低酒駕事故發生率，警方分析數據後，針對轄內高發重要幹道、易飲酒場所周邊及交通熱點，每日於高發時段編排多處路檢點，14日路檢有取締2起酒駕案件。豐原分局今日指出，路檢勤務執行多日下來，民眾在地方社團議論，「豐原分局最近怎麼了嗎？連白天都常常看到取締酒駕路檢？」前（14）日亦同步規劃執行「環、警、監」聯合稽查勤務，結合環保局及監理單位，針對轄內重點路段及易聚集改裝車輛地點，加強攔查與檢測，對攔查車輛進行噪音及排氣檢驗，本次共攔檢9輛，2輛噪音不合格，對於檢驗不合格之車輛，環保局依「噪音管制法」裁處7200元罰鍰，另2輛排氣檢驗不合格，依「空氣污染防制法」予以裁處3000元罰鍰；監理站則針對改裝排氣管、設備損壞不予修復，依「道路交通管理處罰條例」第16條規定，處900元以上1800元以下罰鍰，取締5件，另改裝頭燈依同條例第18條規定處2400元以上9600元以下罰鍰，取締10件，本次監理站共計取締15件違規車輛。請繼續往下閱讀...豐原分局分局長謝建國呼籲，警方對於酒駕案件，均依相關法令嚴予告發，絕不寬貸，請民眾聚餐飲酒後應選擇以代駕、計程車或大眾運輸工具返家，切勿心存僥倖酒後上路。    ,https://news.ltn.com.tw/news/society/breakingnews/5405432
迎媽祖擺爆竹靠近加油站 消防開勸導單、不排除開罰,社會,2026/04/16 08:47,店家擺爆竹迎媽祖，被消防開勸導單後收回。（圖由消防局提供）白沙屯媽祖進香提倡環保與寧靜，今年在彰化縣境鮮少有信眾燃放鞭炮煙火，不過消防局14日晚間接獲員林市有民眾在路面擺放一整排爆竹準備迎接媽祖，消防員現場勘查發現鄰近加油站，有發生危險之虞，經勸阻後收回，開出勸導單，不過仍有民眾提出影片檢舉，消防局已進一步查證，後續將依調查結果依法辦理，若確有違法將依法開罰3至15萬元罰鍰。彰化縣消防局指出，今年白沙屯媽祖南下進香，他們共執行救護案件14件，多數為身體不適頭暈案件，其次為機車擦撞車禍案件，皆送醫後已康復出院。請繼續往下閱讀...另外，消防局接獲1件檢舉違規施放煙火案，為14日晚間6點多在員林市中山路2段，現場為店家門口擺放一排爆竹準備施放，消防人員獲報到場處理，給予爆竹煙火宣導及開立勸導單，成功勸導民眾收拾煙火未燃放，不過檢舉的民眾表示有拍攝影片，因此當下先開勸導單，並責由轄區第二大隊查處，後續將依調查結果依法辦理。若有涉及違反「彰化縣爆竹煙火施放管制自治條例」規定，即處3萬元以上15萬元以下罰鍰。消防局呼籲信眾以「掌聲代替鞭炮」，減少燃放煙火鞭炮，本持媽祖慈悲心，減少爆竹以環保、寧靜的方式伴隨媽祖進香。白沙屯媽祖進香途中，彰化消防局派員宣導勿燃放爆竹煙火。（圖由消防局提供）白沙屯媽祖進香途中，彰化消防員向信眾宣導勿燃放爆竹煙火。（圖由消防局提供）    ,https://news.ltn.com.tw/news/society/breakingnews/5405423
申辦門號供犯罪集團使用 女子觸犯非法利用個資罪判刑,社會,2026/04/16 08:47,董姓女子申辦手機門號供犯罪集團作為網路註冊、認證帳號用途，被依幫助非法利用個資罪判刑3月。（資料照）董姓女子申請2支手機門號後提供給犯罪集團作為網路註冊、認證帳號用途，以此申請進口有侵權嫌疑的貨物，並在電商網站販售違法商品，導致2名個資被盜用的民眾受害，經報警處理後，循線查獲提供犯罪集團門號的董女，屏東地院依幫助非法利用個人資料罪，併處董女3個月徒刑，可易科罰金及上訴。董女2年前向電信公司申辦2支手機門號後，提供給暱稱「小伍」的犯罪集團成員，該集團取得門號後，再盜取游姓民眾個人資料，然後冒用游男名義向財政部關務署基隆關申報進口有侵權嫌疑貨物，以董女提供的門號作為認證門號，申報進口違法商品，損害游男權益，及關務署基隆關報關資料正確性。請繼續往下閱讀...該集團接著又盜用廖姓民眾個人資料，冒用廖男名義向知名電商網站申辦帳號，並以董女提供的門號作為認證門號，在該網站刊登販售違法商品，損害於廖男權益及電商公司對用戶資料管理的正確性。2名受害民眾發現個資遭盜用，遂報警處理，警方循線查獲提供犯罪集團手機門號的董女送辦；屏東地院認為董女正值青壯年，具謀生能力，竟不思以正當方式獲取所需，僅為貪圖輕鬆獲利，即申辦行動電話門號供不法份子使用，增添警方查緝難度，考量潘女犯後坦承犯行及危害程度，依依幫助非法利用個人資料罪，併處董女3個月徒刑，得易科罰金。    ,https://news.ltn.com.tw/news/society/breakingnews/5405427
西門町棋牌社掛羊頭賣狗肉 警突襲查獲地下麻將賭場,社會,2026/04/16 08:17,警方突襲臨檢暗中經營的地下職業麻將場。（記者劉慶侯翻攝）在台北市西門町商圈的「金夯棋牌社」，涉嫌以掛羊頭賣狗肉方式經營地下麻將賭場，經轄管萬華分局蒐證突襲臨檢，查獲有賭博前科的58歲何姓負責人、1名員工和賭客28人，訊後均依法究辦。北市警萬華分局西門町派出所是根據檢舉線報，指稱位在漢口街二段有棋牌社佯裝合法經營，實則暗營非法職業賭場。警方隨後組成專案小組監控蒐證，掌握「金夯棋牌社」不法事證。請繼續往下閱讀...警方昨日確認現場有多達6、7桌客人正在築方城之戰，立即發動臨檢查緝，當場查獲現場負責人和工作人員各1名、及賭戰正酣的賭客28人，並查扣不法所得7千餘元、監視器鏡頭6顆、麻將牌7副、搬風骰子7顆等證物。警方表示，由何嫌經營的職業賭場為規避查緝，在大門裝設高達6支監視器鏡頭，但仍遭專案小組人員突破，順利蒐得賭客以籌碼兌換現金方式賭博財物，全案詢後將何嫌和員工依營利供給賭博罪移送，另賭客依賭博罪偵辦。警方查扣各類贓證物。（記者劉慶侯翻攝）    ,https://news.ltn.com.tw/news/society/breakingnews/5405402
也算車聚？雲林麥寮3同款車路口相撞！笑問「機率有多少」？,社會,2026/04/16 07:49,麥寮鄉日前發生一起3車碰撞事故，離奇的是3車都同車款，讓民眾大問「機率有多少？好荒唐」（圖由民眾提供）雲林縣麥寮鄉日前發生一起3車碰撞事故，離奇的是3輛車款全都是Toyota的同一車款，所幸無人受傷，3車駕駛酒測值均為0，詳細肇事原因仍待釐清。不過同款車撞擊事故的影片被發布在網路也引起熱烈討論，民眾看了笑問「3輛同款車相撞，機率會有多少」？事發在麥寮鄉光復南路140號前路口，畫面可見2台同車款先相撞後，同車款的黑色車輛再撞擊。眼尖民眾發現，3輛汽車的車型一模一樣，可以一起相撞的機率到底會有多低？更有民眾直呼荒唐。請繼續往下閱讀...警方獲報後前往現場，經調查3台車主分別為43歲陳女、63歲周男、39歲徐女，皆無人受傷。經了解陳女駕車於該路口西往東行駛，行駛該路口闖紅燈，撞上北往南的周男及南往北的徐女，詳細肇事原因仍有待進一步釐清。警方呼籲，民眾行車應安全遵守交通規則，依標誌、標線號誌指示行駛，保持安全車距、切勿疲勞駕駛，並注意往來人車，避免發生交通事故，造成自身或他人生命財產安全之安全。    ,https://news.ltn.com.tw/news/society/breakingnews/5405377
7歲童被迫「關毒氣室」驗出多種毒品反應 母與同居人被判刑,社會,2026/04/16 06:45,高市王婦與同居人涉嫌在住家吸食毒品，影響小孩發育，被高雄高分院判刑。（記者鮑建信攝）高市王姓女子與蔡姓男子同居期間，多次在住處涉嫌吸食毒品，影響她7歲兒子成長，經社工人員發現後報警處理，被高等法院高雄分院依妨害幼兒發育罪，各判處徒刑8月，比原審少1個月。警方調查，被告王女育有7歲大兒子甲童，並自2024年12月間起，與被告蔡男共同在左營區住處生活。2025年3月初，全家搬遷，2人並有吸食海洛因等毒品惡習。請繼續往下閱讀...2024年12月某日起，至2025年3月5日止，2人多次在住處吸食毒品，並因密閉空間，甲童長期暴露在二手煙霧的環境下，身心發展嚴重受到影響。後因社工前往訪視發現，報請檢警處理。辦案人員曾二度採集甲童頭髮送驗，證實有海洛因、甲基安非他命、可待因、安非他命、嗎啡等多種毒品陽性反應，依妨害幼兒發育罪嫌，將王女和蔡男函送橋頭地檢署偵查、起訴。橋頭地院開庭調查，被告2人均坦承犯行，並有毒品等前科，構成累犯，各處有期徒刑9月，2人上訴後，被高雄高分院改判8月，尚未定案。    ,https://news.ltn.com.tw/news/society/breakingnews/5405353
用愛接住2歲遲緩童！表姨無私照料 法院裁定收養,社會,2026/04/16 06:27,連姓男童因生父躲債失聯，2歲時體重僅5公斤且發展遲緩。經表姨接手照顧，大獲改善，台南地院裁定收養。（記者王捷攝）連姓男童因生父躲債失聯、生母無力撫養，營養不良、發育遲緩，到了2歲體重才5公斤，林姓表姨接手照顧，還安排早療改善連童狀況，台南地方法院基於兒童最佳利益原則，裁定林女收養連童，讓兩人成為合法親子。連男童生父3年前因積欠債務不知去向，去年7月更遭台南地檢署發布通緝，長期未盡保護教養義務，也未支付扶養費，生母訴請離婚獲准並取得親權，但因她還要撫養連童的胞兄，兩個兒子加重她的經濟負擔，連童原本是外婆撫養，外婆也因經濟困境與照顧負擔過重，無力繼續承擔責任同意出養。請繼續往下閱讀...林女去年接手照顧後，發現連童2歲了，體重僅5公斤、身高接近80公分，肢體與語言發展明顯落後，提供安定居住環境，並針對發展遲緩安排早期療育，經長期悉心陪伴與專業療育刺激，男童健康大幅好轉，口語表達顯著提升，與林女家人互動親密自然。社工訪視報告顯示，林女收入穩定且具備穩固家庭支持系統，能負擔生活所需，林女充分滿足男童需求，填補其缺失的親情。法官認為，生父未盡教養義務，依法不用他同意出養；而生母及外婆確無撫養能力，出養具備必要性。綜合評估後，法官認定將連童讓林女撫養符合最佳利益，裁定林女收養聲請，賦予兩人法律上的親子關係，保障男童能在完善環境中成長。程序費用1500元由林女負擔。    ,https://news.ltn.com.tw/news/society/breakingnews/5405322
