Title,News_Type,date,content,url
中國竄航台日EEZ擴張管轄權 日政府交涉,國際,2026/06/30 05:30,中國科研船在台灣東部海域來回航行騷擾，航跡遍布台灣和日本的專屬經濟海域（EEZ），中方還派出海警船護航，以宣示其主張的「管轄權」。圖為日本海上保安廳巡邏艦在與那國島海域巡邏。（法新社檔案照）中國在六月中旬派出科學研究船，在台灣東部海域來回航行騷擾，航跡遍布台灣和日本的專屬經濟海域（EEZ），中方還派出海警船護航，以宣示其主張的「管轄權」。日本政府發言人木原稔廿九日表示，日本無法接受這類主張，已透過外交管道多次向中方提出交涉。北京宣示海域管轄權 日不接受主張中國「向陽紅22」科研船本月十二日在蘭嶼東南方海域現蹤，停留數日後，在日本與那國島以南，以及我國東部專屬經濟海域來回航行，十八日闖入台灣蘇澳、宜蘭外海限制水域，與海巡署船艦對峙後，十九日凌晨撤離，朝北方航行。與那國島是日本最西端且距離台灣最近的日本離島，相隔僅約一一〇公里。請繼續往下閱讀...中方「海警護航科研」模式 在日本與那國島、台灣東部海域出沒日本讀賣新聞報導，第十一管區海上保安本部表示，廿八日下午在沖繩縣石垣市尖閣諸島（釣魚台列嶼）日本專屬經濟區內，發現「向陽紅22」正將疑似管線狀物體伸入海中。由於此舉未經日本同意，海保透過無線電要求中方立即停止相關作業。中國科研船過去頻頻出現在日本專屬經濟區，以「合法科學考察」為名，進行「灰色地帶侵擾」。以往科研行動絕大多數時間都沒有海警船護航，但今年出現重大變化。三月底到四月初，「向陽紅22」在釣魚台的日本專屬經濟區作業時，首次被發現有一艘中國武裝海警船隨行。而這次在台灣東部海域的任務，也採取「海警護航科研」的聯合行動模式，而且至少派出兩艘海警船。日海保出動機艦加強監視共同社報導，中國海警局多艘艦艇已開始常態化航行於沖繩縣與那國島南方的日本專屬經濟區，並開始為中國海洋調查船及公務船護航，日本政府也已確認此一動向，並派遣海上保安廳巡邏船和固定翼飛機前往該海域，加強對中國海警船的監視。報導指出，該海域位於台灣東方，中國長期主張擁有「管轄權」，但實際採取行使管轄權的行動極為罕見，凸顯中國對日本與菲律賓將該海域納入海洋邊界劃界談判的反制態度，日中關係恐將進一步惡化。木原在例行記者會上表示，中國海警局船舶等在與那國島南方日本專屬經濟海域內斷續航行，並對該海域提出其主張，日本無法接受，已透過外交管道反覆向中方提出交涉。木原強調，日本政府將堅決維護領土、領海、領空及相關權利，以堅定且冷靜的態度加以因應。對於中國反對日本與菲律賓展開海洋邊界劃界談判，木原也再次說明，日菲展開海洋邊界劃界談判，「在國際法上完全沒有任何問題」。    ,https://news.ltn.com.tw/news/world/paper/1760741
烏克蘭空襲俄煉油廠 普廷坦言面臨燃料短缺,國際,2026/06/30 05:30,烏克蘭近來頻繁對俄羅斯的煉油廠等能源設施發動攻擊，俄國總統普廷28日坦承，國內正面臨燃料供應的「艱困時期」，正在評估實施限制柴油出口的可能性。（路透）烏克蘭近來頻繁對俄羅斯的煉油廠等能源設施發動攻擊，俄國總統普廷廿八日坦承，國內正面臨燃料供應的「艱困時期」，正在評估實施限制柴油出口的可能性。但他也強調，俄軍將持續推進全面奪取烏克蘭東部及南部四個地區的既定軍事目標，並拒絕烏方提出停止對彼此內陸進行長程打擊、以降低衝突的新提案。短缺已擴散至莫斯科普廷在與石油業高層和政府官員的會議中表示，部分地區確實面臨燃料供應短缺問題，加油站也出現大排長龍的情況。他下令提高陸路和海路運輸量，盡快解決克里米亞半島燃料短缺問題，動用儲備汽油穩定供應，同時評估對柴油實施全面出口禁令的利弊，但也提醒針對能源供應的應對措施，必須避免衍生額外問題。路透引述當地居民報導，俄國境內的燃料短缺問題已擴散至莫斯科。請繼續往下閱讀...烏克蘭最新一波對俄國境內能源設施的打擊，鎖定位於南部斯拉揚斯克（Slavyansk）的大型煉油廠，為俄國黑海港口出口燃料油、石腦油和海運燃油等石化工業品的關鍵設施。距離烏國邊境約七百公里的雅羅斯拉夫爾（Yaroslavl）煉油廠也遇襲。俄國曾在二〇二三年實施過全面柴油出口禁令，但僅維持不到兩週便撤銷，原因在於俄國國內的柴油用量難以消化，使得以出口為主的大型油商過量囤積。在另外一場媒體專訪中，普廷指稱，烏克蘭對能源設施的打擊旨在分裂俄國社會，迫使俄軍在兩軍接觸的前線停止推進。他誓言「不會給予他們這樣的機會」，並首度透露，烏克蘭曾提議中止對彼此大後方的深度打擊，以及將戰鬥限制在盧甘斯克、頓內茨克、札波羅熱和赫爾松四個地區。但普廷予以回絕，因為此舉將使烏軍能夠調動其他區域的兵力，專注抵禦俄軍在前述地區的攻勢。    ,https://news.ltn.com.tw/news/world/paper/1760746
秘魯總統大選次輪計票完成　藤森惠子微幅勝出,國際,2026/06/30 05:21,秘魯本月7日舉行總統大選第2輪投票，選務當局歷經數週的計票並於今天完成作業，最終結果顯示，保守派候選人藤森惠子以極小領先幅度勝選。路透社報導，秘魯選務當局最終計票結果指出，藤森惠子拿下922萬3396票，得票率為50.135%，微幅領先左派候選人桑傑士（Roberto Sanchez）的917萬3755票、49.865%得票率。請繼續往下閱讀...藤森惠子是已故秘魯前總統藤森謙也的女兒，她過去3度競選總統，但全數以失敗告終。（編譯：陳彥鈞）1150630    ,https://news.ltn.com.tw/news/world/breakingnews/5488282
疑爭奪子女監護　德國北部1兒福中心槍擊釀6死,國際,2026/06/30 03:21,德國北部一處兒福中心發生一起慘絕人寰槍擊案造成6人喪生，初步調查案件疑為爭奪子女監護權所釀悲劇，已排除恐攻。警方拘捕包含槍擊主嫌在內共3名涉案人士，並證實所有死者皆為成年人。請繼續往下閱讀...據德國「畫報」（Das Bild）揭露的畫面顯示，警方當時在大馬路上展開圍捕，包圍一部右側已爆胎漏氣、卻仍試圖行駛的車輛，大批荷槍實彈警員隨即一擁而上，將車上2人強拉下車並壓制在地。這起槍擊案發生在鄰近港市漢堡（Hamburg）的施塔德（Stade）。明鏡周刊（Der Spiegel）掌握的消息指出，本案很可能源於個人恩怨，初步已排除出於政治或極端主義動機的恐攻。綜合法新社與路透社報導，警方在記者會表示6名死者全數都是這間兒福中心的社工人員。據悉涉嫌開槍男子目前正爭奪3個月大女兒的監護權，槍擊發生當下，女嬰與生母正好就在中心辦公室內，所幸並未受傷。大規模槍擊案在德國極為罕見。前次類似慘案發生在 2023年，當時一名槍手在漢堡一間宗教聚會所開槍射殺 6人後自戕；另在2016年，一名德國伊朗雙重國籍、對大規模殺戮帶有病態幻想的18歲男子，也在慕尼黑犯下槍擊，奪走至少9條人命。（編譯：陳亦偉）1150630    ,https://news.ltn.com.tw/news/world/breakingnews/5488274
美最高法院雙裁定　擴大總統權力但護聯準會獨立,國際,2026/06/30 01:45,美國聯邦最高法院今天做出兩項裁定，一項是認可總統川普可基於任何理由解雇獨立監管機構官員，但同時另一項則明確維護聯準會獨立性，認為聯準會官員不能被隨意撤換。紐約時報指出，在川普開除聯邦貿易委員會（FTC）民主黨籍委員史勞特（Rebecca Kelly Slaughter）一案，9名大法官以6比3允許總統這項解雇案，3位自由派大法官投反對票。史勞特經常與川普施政方向牴觸。請繼續往下閱讀...這項裁定形同擴大總統權力，可能帶來政府架構重大變革，因為這將讓總統能更直接介入獨立機構。但在另一項涉及川普開除聯準會理事庫克（Lisa Cook）案裡，大法官們則以5比4裁定川普不能依未獲證實的房貸詐欺指控而解職庫克，也不能不給庫克答辯機會。川普開除庫克之際，時值他正施壓聯準會要求降低利率。華盛頓郵報指出，在史勞特案裁定裡，大法官形同推翻已有近百年的歷史慣例，即賦予國會制衡力量，規定總統必須有充分理由才能解職獨立監管機構官員。史勞特案的裁定等於認可保守派人士長期主張，即總統應對行政部門擁有不受限制的權力，影響層面涉及20多名聯邦機構首長。但庫克案的裁定裡，大法官則阻止總統對美國央行擁有更大控制力。華爾街日報指出，首席大法官羅伯茲（John Roberts）撰寫這兩項裁定書。在庫克案裡，羅伯茲寫道：「按最高法院過往判例，庫克有權在被解職前獲告知，並享有一定答辯機會。」羅伯茲寫道，若接受川普政府立場，形同允許總統在任何時間、基於任何理由撤換聯準會理事，且事前無須通知、事後也沒有任何司法監督，恐使「須有正當理由才能解職」的保障機制形同具文。羅伯茲明確指出，這場爭議牽涉者遠不只庫克的職位，若允許總統隨意解雇聯準會理事，將損及央行在不受政治壓力下制定政策的能力，而這正是國會當初賦予聯準會獨立地位的核心原因。庫克在被解職後興訟，主張川普開除她之舉違反一項聯邦法律，法條明定總統只有在「正當理由」情況下才能免職聯準會成員。先前兩間下級法院都做出有利庫克的裁定。聯邦最高法院今天的裁定，代表庫克案發還法院更裁期間，庫克仍可留任原職數月甚至數年，而川普目前也尚未提名接替她職位的人選。（編譯：陳亦偉）1150630    ,https://news.ltn.com.tw/news/world/breakingnews/5488262
台灣航海探險家影像硬碟倫敦遭竊　駐英代表處已協助,國際,2026/06/30 01:12,台灣青年航海探險家陳懷璞近日完成橫越南冰洋與南大西洋壯舉，但返程在倫敦入住旅館時，兩顆儲存探險影像紀錄的硬碟遭竊。駐英國代表處今天表示，持續提供他必要協助及聯繫。駐英國代表處告訴中央社，陳懷璞25日下午曾至駐處，駐處當即對他的遭遇展開了解，並引導他盡速向倫敦警方報案。陳懷璞25日晚間完成報案程序，警方隨後於26日上午確認受理。請繼續往下閱讀...駐英國代表處法務秘書在陳懷璞向警方完成報案後，隨即聯繫倫敦都會區警察局（Metropolitan Police）表達駐處關切，同時敦促警方正視此案、籲積極處理。駐處另於26日派員前往陳懷璞下榻的青年旅館，表達政府對他的關心。此外，駐處協助陳懷璞搬離原本的青年旅館，入住其友人安排的教會。陳懷璞預計7月2日搭機返台。駐英國代表處表示，將繼續與陳懷璞保持密切聯繫，持續提供必要協助。陳懷璞25日聯繫駐處、向警方完成報案後，26日在網路上發布影片陳述創傷經驗，並請求各方協助，盼望找回兩顆儲存完整探險影像紀錄的硬碟。據了解，陳懷璞報案後，倫敦警方已數次與他聯繫。（編輯：陳彥鈞）1150630    ,https://news.ltn.com.tw/news/world/breakingnews/5488257
芬蘭總統籲烏俄停火60天　稱烏克蘭狀態佳有利談判,國際,2026/06/30 00:15,芬蘭總統史塔布接受政治新聞網站Politico專訪表示，烏克蘭在軍事與政治與經濟上都處於開戰以來的最佳狀態，呼籲各界把握時機推動無條件的60天停火。他表示，俄羅斯在這場戰爭中面臨戰略失敗。史塔布（Alexander Stubb）在此刻接受Politico專訪，外界解讀是在北約峰會前夕向盟國傳遞信心訊號。該媒體以深入報導美歐政治著稱，在華盛頓決策圈與歐洲外交界均具深度影響力，也是傳遞立場的重要管道。請繼續往下閱讀...史塔布指出，過去6個月烏克蘭在軍事方面占上風：每月造成俄軍死傷高達3萬5000人，俄羅斯補充兵員速度跟不上損耗，烏軍無人機與飛彈打擊聖彼得堡（St. Petersburg）、莫斯科（Moscow）的目標，也讓約4成煉油設施喪失運作。史塔布說，「戰損比現在是1比8，即每1名烏克蘭士兵傷亡，對應8名俄軍傷亡」。他認為，烏克蘭目前的談判地位是開戰以來最有利的，呼籲仿效加薩與伊朗停火的模式，先推動無條件、全面的60天停火，再逐步推進後續談判。史塔布也觀察到俄羅斯境內多數民眾現已希望終止戰爭，他說，「這是好的徵兆。俄羅斯不會因為經濟壓力或士兵傷亡而收手，要等到民心背離才會。」面對北約盟友對川普可能撤回防衛承諾的集體焦慮，史塔布疾呼各國應效法芬蘭人「去洗桑拿再泡個冷水澡」冷靜下來。他直言，川普要歐洲負起更多安全責任，各國不應陷入情緒化反應，而應以現實主義應對防衛責任的轉移。史塔布強調，芬蘭距離俄羅斯柯拉半島（Kola Peninsula），也就是全球最大核武集中地之一，僅100公里。他身為武裝部隊最高統帥，掌握所有與芬蘭安全相關的關鍵資訊，每夜仍能安然入眠。他直言，「北約目前的嚇阻能力，是北約成立以來最強的」，因為盟國整體軍事能力提升，過去讓軍備鬆弛的成員國也重新強化防線。他說芬蘭是「安全提供者，不是安全消耗者」。史塔布自我定位為「價值觀現實主義者」，並將此理念稱為「價值導向的現實主義」（Values-based realism）。他透露與川普的往來公開立場與私下溝通一致，方式相當務實，芬蘭和美國的雙邊關係建立在深度國防合作上：芬蘭剛採購64架F-35戰機，砲兵規模與波蘭並列全歐最大，芬蘭剛與美國達成11艘破冰船的協議，因此雙邊的溝通語言與其他歐洲國家有別。他說，在當下依賴交易、各行其是的時代，一旦拋棄多邊機構與國際規範，每場局部衝突都可能演變為衝擊全球油價、糧價與通膨的連鎖危機。（編輯：陳慧萍/陳正健）1150629    ,https://news.ltn.com.tw/news/world/breakingnews/5488249
持續大雨福建刺刀峽谷發生意外  9人探險5人溺斃,國際,2026/06/29 23:59,中國福建省莆田市仙遊縣「刺刀峽谷」28日發生意外，9名戶外探險者遇險，其中5人溺水死亡，4人獲救。（擷自微博）中國福建省莆田市仙遊縣「刺刀峽谷」28日發生意外，9名戶外探險者遇險，其中5人溺水死亡，4人獲救。刺刀峽谷並非對公眾開放景點，有網友指當地近日持續下雨，發生意外的隊伍可能被捲入瀑布底。據觀察者網報導，福建省莆田市仙遊縣人民政府辦公室29日發布通報，28日下午接獲市民報案，9名戶外探險者在刺刀峽谷發生意外，其中5人溺水。請繼續往下閱讀...仙遊縣人民政府接報後立即啟動應急預案，協調公安、消防救援、應急管理、衛健等部門及西苑鄉幹部、藍天救援隊等趕赴現場搜救。經確認，5人溺水死亡，其餘4人獲救並已轉送到安全地方。後續善後工作進行中。報導表示，刺刀峽谷並非景點，尚未對公眾開放。仙遊縣人民政府提醒市民，野外峽谷地形複雜，潛藏安全風險，必須提高安全防範意識，嚴禁前往未開發、無監管、無安全保障的野外地方展開探險等戶外活動，要守護自身及他人生命安全。公開資料顯示，刺刀峽谷因山體裂縫形似刺刀而得名。峽谷最窄處僅80公分，需側身才能通過，地貌以水流侵蝕形成的幽深峽谷、一線天、懸空洞穴及瀑布群而聞名。據紅星新聞報導，一名28日曾前往刺刀峽谷徒步的網友表示，當地近日持續下雨，水流量較大。該名網友和隊友走至一線天前，發現水流量過大，選擇繞路離開。該名網友表示，當天曾見過發生意外的隊伍，該隊伍來自福州，同樣前往一線天，可能被捲入瀑布底。該區域因瀑布侵蝕形成較大空間，內部存在暗流，旱季時相對安全，但仍需借助繩索及手腳並用才能通行。    ,https://news.ltn.com.tw/news/world/breakingnews/5488228
英國海軍首艘混合戰艦 結合無人系統取代傳統驅逐艦,國際,2026/06/29 23:30,"英國國防部今天宣布擬建造至少6艘「通用戰鬥艦」，取代現役6艘45型（Type 45）防空驅逐艦的功能。圖為英國皇家海軍45型驅逐艦「勇敢號」（HMS Daring）。（法新社）英國持續發展結合載人、無人和自主系統的「混合海軍」（Hybrid Navy），國防部今天宣布擬建造至少6艘「通用戰鬥艦」，這將是英國海軍第一批「混合戰艦」，將整合空中、海上及海下無人系統，提供更具韌性的空防戰力。根據英國國防部資訊，首批至少6艘「通用戰鬥艦」（Common Combat Vessel, CCV）將發揮取代現役6艘45型（Type 45）防空驅逐艦的功能。與傳統防空驅逐艦有重要不同的是，CCV將同時是海、空無人系統的控制樞紐。請繼續往下閱讀...英國國防部強調，CCV預期將讓英國海軍在「不需等比例擴增人員編制或提高支出」的情況下，有效擴展戰力投送範圍，並提升韌性、增強火力。國防部指出，與過去將作戰能力集中於少數幾艘造價高昂的大型軍艦相較，英國海軍將改採「混合海軍」模式，整合無人、自主和有人直接操作的能力，以符合現代戰爭的節奏、型態和特性。按規劃，首批CCV將自2030年代初期開始交付。由於以CCV取代45型防空驅逐艦已定案，原本英國海軍以新一代83型（Type 83）驅逐艦取代45型的計畫確定取消。國防部的資訊顯示，未來CCV將與總計8艘26型（Type 26）反潛巡防艦和5艘31型（Type 31）通用型巡防艦搭配執行任務。26型和31型都是有人員編制的巡防艦，26型的規格和性能較31型優越。至於與CCV搭配執行任務的無人自主系統，英國國防部指出，預計將有91型（Type 91）無人飛彈平台、92型（Type 92）無人水下感測平台、93型（Type 93）超大無人水下載具，以及94型（Type 94）無人水上感測平台。英國國防部形容相關無人自主系統為「劃世代」重大投資。有媒體報導提到，早在2020年即預告的32型（Type 32）巡防艦建案將遭廢除，英國政府一名發言人今天回應中央社詢問表示，一切以即將發布的國防投資計畫（DIP）和官方資訊為準。英國政府正加緊為DIP定案，以利在北大西洋公約組織（NATO）峰會登場前發布。按原規劃，32型巡防艦也具備無人自主系統平台功能。英國國防部在今天的新聞發布未提及32型巡防艦。今年的北約峰會訂7月7日在土耳其首都安卡拉（Ankara）登場。英國國防部另提到，CCV計畫有助英國產業界和專業技能發展，且其結構設計可靈活調整，有利未來拓展出口。國防部強調英國所打造戰艦在國際市場的潛力，包括26型反潛巡防艦已獲挪威、加拿大和澳洲海軍採用。26型巡防艦預計最快2028年才會投入英國海軍服役。英國放棄83型驅逐艦、32型巡防艦 未來水面作戰靠這兩型艦艇挑大樑    ",https://news.ltn.com.tw/news/world/breakingnews/5488208
貨輪遇襲引發美軍事打擊 美駐聯大使：川普不會袖手旁觀,國際,2026/06/29 22:59,美國與伊朗上週末交火後恢復克制，將於30日在杜哈召開會議。（路透）美國與伊朗上週末再次交火，是雙方17日簽署諒解備忘錄（MOU）後首次爆發衝突，引發外界擔憂協議破局，危及復原中的關鍵能源航道荷姆茲海峽運輸。美國駐聯合國大使瓦爾茲（Mike Waltz）接受「福斯新聞」訪問時表明，若德黑蘭以為美國總統川普會對攻擊國際船運的行為袖手旁觀，會是「可悲地錯誤」。英國外交大臣庫柏（Yvette Cooper）譴責伊朗對周邊國家的攻擊行徑，「置公民生命於風險且限制航行自由」；阿拉伯聯合大公國外交部譴責，「由伊朗發動的新一起敵意攻擊，是對這些國家主權的公然侵犯。」請繼續往下閱讀...據匿名美國官員說法，美伊已同意暫時各退一步，維持荷姆茲航行自由並持續進行技術層級對話。川普宣布，雙方30日將在卡達首都杜哈召開會議。伊朗外交部長阿拉奇28日訪問伊拉克時申明，荷姆茲海峽的管理和全面開放由德黑蘭負責，「任何干預或試圖推動與當前協議矛盾的安排，只會使情況更加複雜，延遲荷姆茲海峽恢復常態」。    ,https://news.ltn.com.tw/news/world/breakingnews/5488221
白宮：川普特使魏科夫與庫許納將赴杜哈參加伊朗會談,國際,2026/06/29 22:07,白宮發言人表示，美國總統川普的特使魏科夫和庫許納，將出席明天在卡達首都杜哈舉行的伊朗會談。（法新社檔案照）白宮發言人表示，美國總統川普的特使魏科夫和庫許納，將出席明天在卡達首都杜哈舉行的伊朗會談，同時技術性談判也將在場邊繼續進行。路透社報導，川普今天在社群媒體發文表示，伊朗要求舉行會談，會談將在卡達首都舉行，但他並未透露任何細節。請繼續往下閱讀...白宮發言人李威特（Karoline Leavitt）之後告訴福斯新聞（Fox News），魏科夫（Steve Witkoff）與庫許納（Jared Kushner）將出席這場會談。她表示：「特使魏科夫與庫許納本週將飛往杜哈參加高層級會談，我們將繼續討論諒解備忘錄。在舉行高層級會談的同時，場邊也將進行技術性談判。」美國與伊朗6月17日簽署一份旨在終結長達4個月衝突的14點諒解備忘錄。雙方同意停止敵對行動，並重新開放荷莫茲海峽（Strait of Hormuz），全球1/5的石油和液化天然氣經由這個關鍵水道運輸。伊朗25日攻擊航經荷莫茲海峽的商船後，美伊再度互相攻擊，雙方脆弱的和平協議搖搖欲墜。李威特在「福斯與朋友」（Fox & Friends）節目中表示：「在總統指示下，美國已對商船遭襲事件作出回應。如果類似情況再次發生，我們也會持續回應；但我們希望不會再看到這種情況。總統顯然希望和平進程能夠取得進展。」    ,https://news.ltn.com.tw/news/world/breakingnews/5488187
美伊傳將在卡達會談 伊朗外交部否認,國際,2026/06/29 21:36,伊朗副外交部長加里巴巴迪。（美聯社檔案照）伊朗與美國技術團隊據報導將於近日會面，討論如何落實結束中東戰爭的協議，但伊朗外交部今天予以否認。美國新聞網站Axios昨天引述美方官員報導，德黑蘭與華府當局預計30日在波斯灣國家卡達舉行會議，以解決有關荷莫茲海峽（Strait of Hormuz）這一戰略要道的爭端。請繼續往下閱讀...美國有線電視新聞網（CNN）也引述一位川普（Donald Trump）政府官員的類似說法；不過，白宮尚未發布正式聲明。但伊朗國營電視台引述副外交部長加里巴巴迪（Kazem Gharibabadi）所言指出：「本週未規劃工作小組技術會議。」伊朗與美國最近一次會談於6月21日在瑞士舉行，當時有美國、伊朗、巴基斯坦及卡達4國代表團出席會議。伊朗總統裴澤斯基安（Masoud Pezeshkian）今天表示，解除伊朗遭凍結資金的必要程序「正在進行中」。伊朗總統府引述裴澤斯基安的話表示：「依照既定計畫，卡達持有的總額120億美元資金中，將有60億美元獲准釋出並歸還至伊朗」。    ,https://news.ltn.com.tw/news/world/breakingnews/5488159
川普：伊朗要求會談 週二在卡達杜哈舉行,國際,2026/06/29 20:42,美國總統川普發文宣稱，伊朗方面提出會談請求，美國與伊朗的代表週二會在卡達見面。（法新社檔案照）美國總統川普今（29）日發文宣布，在伊朗政府的請求之下，美國與伊朗代表週二將在卡達首都杜哈（Doha）舉行會談。川普在自家社群平台Trhth Social發文說：「伊朗已要求會面。明天會在杜哈舉行！」請繼續往下閱讀...有線電視新聞網（CNN）報導，伊朗首席談判加里巴巴迪（Kazem Gharibabadi）先前告訴媒體，本週並沒有任何技術工作小組的會面安排。而根據全國廣播公司（NBC）報導，一名消息人士透露，負責執行雙方初步協議的技術團隊預計未來幾天會在杜哈會面。相關新聞美伊傳將在卡達會談 伊朗外交部否認    ,https://news.ltn.com.tw/news/world/breakingnews/5488097
