Title,News_Type,date,content,url
頴川家族「千億股權離奇失蹤」 北院催交資料竟遭10公司已讀不回,社會,2025/11/24 10:32,頴川家族旗下10家公司未依北院命令提交股票去向與保管資料，分別遭處2萬元罰鍰。圖為頴川建忠。（資料照）香蕉大王陳查某之子、身價上看千億元的台裔日籍企業家頴川建忠（本名陳建忠）生前為味王集團榮譽董事長，但他離世後，頴川家族掌控的10家核心控股公司，卻驚傳「千億元股票去向不明」。台北地方法院近期對大洋僑果、僑果實業等10家公司集體裁罰，指相關公司在多次通知下仍未提交股票去向與保管資訊，亦未說明未配合理由，認定已屬無正當理由不從，遂依法裁處罰鍰。北院重訴庭日前裁定，萬果貿易、僑果實業、全青、大洋僑果、浩祥貿易、建隆興業、金元實業、程威、僑果企業、全威投資等多家關係企業，皆未依命提出股票股數、保管位置等文件。法院指出，這些公司在收到調查函文、催告函與正式命令後，多次未回覆，最終依民事訴訟法各裁處2萬元罰鍰，並限期5日內必須提交指定文件給原告。請繼續往下閱讀...此案源於原告頴川欽和、志伊玲華、頴川秀玲等人，向被告陳玲玲等人請求返還股票。原告方主張，被告名下持有多家公司的大量股份，卻長期未說明股票保存狀況。法院審理時曾向被告詢問股權保管情形，被告表示股票並不在其手中，相關資料也未掌握；隨後，原告聲請法院調查證據，要求向10家公司調閱股票資料。北院自今年6月起陸續發出函文，但包括萬果貿易、僑果實業、全青、浩祥貿易等多家公司均未回覆；8月發函催告，仍無任何動靜；直至9月，再裁定命其提出文件後仍遭集體拒絕。法官認為，受罰公司對法院命令「明知且未履行」，已屬無正當理由不提出文書，依民事訴訟法第349條，得處以3萬元以下罰鍰，最終裁定每家公司各罰2萬元。實際上，頴川家族企業近年亦捲入其他司法爭議。水果貿易商「大洋僑果集團」、味王董事長陳清福與多名企業幹部，先前遭大洋僑果創辦人陳查某的孫子頴川欽和指控侵占貨款，北檢未查出侵占事證，但認定陳清福等7人長期沿用農產品交易不開發票、短報營收的慣行，涉製作不實財報並逃漏營業稅3593萬餘元，依違反商業會計法、稅捐稽徵法起訴。北院去年審理時，陳清福等人皆坦承犯行，判處陳清福2年徒刑、緩刑4年並支付公庫30萬元；財務主管林德盛判刑1年2月，全青及萬果監察人陳玲玲等4名主管判刑10月，均獲緩刑2年、須支付公庫8萬至10萬元。另全青及萬果公司登記負責人陳月鳳於審理期間過世，法院對其部分諭知公訴不受理，全案可再上訴。熱門賽事、球星動態不漏接    ,https://news.ltn.com.tw/news/society/breakingnews/5255902
逼少年自打耳光下跪、恐嚇遭「捅屁眼」......女法官周靜妮懲戒結果出爐,社會,2025/11/24 10:29,法官周靜妮審案爭議不斷。（圖取自YouTube，本報合成）苗栗地院少年及家事庭法官周靜妮審案爭議不斷，曾被爆動用私刑，當庭要求少年自打耳光及下跪、恐嚇少年進少觀所會遭「捅屁眼」，還被法官鑑委員會查出周曠職多達300多小時、相當40多天，決議將周移送懲戒，建議免職並不得擔任公務員，司法院2022年2月先將她停職，同年6月她立即辭職，另外，監察院也啟動調查並彈劾，移送懲戒法院審理；懲戒法院職務法庭今輕判周撤職、停止任用3年。監察院、周靜妮均可上訴。資深法界指出，懲戒法院的判決理由必須能夠說服法界和社會大眾，否則此判決結果遠比法評會建議的免職處分減輕許多，疑為輕縱，將落得「官官相護」的質疑。周靜妮未到庭聆判，無法得知她對判決看法。請繼續往下閱讀...周靜妮是司法官訓練所第41期結業的資深法官，但出現不少違失事件，2019年間，周審理1名涉嫌毆打父親的少年時，當庭命少年下跪、自打耳光23下，體驗被打滋味，還恐嚇若收容在少觀所會遭「捅屁眼」，並曾開庭延宕遭社工投訴，竟打電話至苗栗社會處興師問罪，被移送法官評鑑。法評會查出，周靜妮2020年、2021年共曠職高達300多小時，其中包括周未依人事規定請假，或請假不符合規定未經准許等情形，有305件案件未處理，其中有60件是保護令案件。法評會認為周嚴重影響當事人權益，移送懲戒法院議免職，並不再擔任公務員。監察院亦立案調查，不僅發現周靜妮承辦少年案件時，要求少年自打耳光、嚴重曠職、延宕保護令案件處理等多項違失外，周於2015年間值日法官辦理羈押案件時，在被告未拒絕夜間訊問情形下，因她未到場訊問被告，卻以電話指示值班法警與被告溝通，以允諾交保為交換條件換取被告同意不進行夜間訊問，漠視被告的權益，更造成法院調度、訴訟進行的困擾。周於2021年3月19日為答辯其自律案件，直接要求其配屬的書記官向法院檔案室借調卷證，且明知少年、家事案件採不公開審理，必須保密，仍借調卷證並攜出法院外影印，使卷證有外洩的風險。監察院也查出，周2022年2月16日被司法院停職後，雖離職已1個月，皆未辦理離職手續並完成移交工作，屢經法院催促辦理，仍置之不理，更出言威脅協助移交人員，已違反法官倫理規範第3、4、5、6、11、15條及法官法第18條的規定，損害法官公正、中立、獨立的形象，嚴重戕害人民對司法的信賴，更有為個人利益，濫用法官職權情形，有重大違失，將她彈劾，移送懲戒法院進行懲戒，但周在被彈劾前已早一步辭職。熱門賽事、球星動態不漏接    ,https://news.ltn.com.tw/news/society/breakingnews/5255881
小黃司機舉報車手 警用十萬元綑條鋼印找出上一名受害者,社會,2025/11/24 10:14,張榮興到屏東慰勉基層員警。（警方提供）屏東縣東港分局阻詐成效佳，警政署長張榮興11月23日南下東港分局慰勉基層員警，肯定分局近期積極主動查緝詐欺案件的卓越表現，他對日前小黃司機舉報車手後，警方未鬆懈再循著車手手機中線索辦案，從照片裡鈔票上的行員印章戳記追查到潛在被害人是阻止被害人被續詐的可能，再次展現「攻防並進」的反詐決心。東港分局今年共偵破3個詐欺集團、查獲23名犯嫌，其中20人經檢方聲請羈押獲准，羈押率高達86.96%，對詐團宣戰，傳出有詐團已都不再進東港分局收款，張榮興對東港分局打詐專案期間的亮眼績效表達高度肯定。請繼續往下閱讀...張榮興對今年11月11日由小黃司機舉報車手的案子更是印象深刻，原來，當時崁頂所警方逮獲車手後，立刻替受害者討回60萬元，但在偵訊過程中，發現該名車手當天已是二度面交，並坦承當天已在另一鄉鎮面交並得手30萬元，警方從手機內部的鈔票綑綁條的鋼印，抽絲撥繭發現上次面交是麟洛鄉的某金融機構提領後，再至公所前面交，但由於車手行蹤已出現斷點，也通知上一名受害者務必要對車手提告求償，彌補損失並讓車手獲得更重的刑罰。慰勉座談中，分局長高志正也特別代表全體同仁感謝署長的支持，尤其警政署及署長考量東港分局轄內旅遊人口、活動量能及治安需求逐漸變繁重，已於去年12月24日核定調升為「繁重等級」（即俗稱一級分局），大大提振基層士氣。張榮興前來視察還發生插曲，原來，他巧遇昔日2017年間在台南市警局永康分局共事的舊部屬、現任東港派出所所長黃奕鳴，兩人敘舊氣氛溫馨愉快。張榮興到屏東慰勉基層員警。（警方提供）熱門賽事、球星動態不漏接    ,https://news.ltn.com.tw/news/society/breakingnews/5255877
老婦登台東都蘭山跌倒 消防人員啟動行動急診室處置後送醫,社會,2025/11/24 10:09,台東消防局人員到都蘭山救援受傷婦人。（記者黃明堂翻攝）昨天（23日）下午，一支13人登山團前往台東攀登都蘭山步道，團隊中一名60歲婦人不慎跌倒，導致頭部遭受撞擊造成撕裂傷，因傷勢嚴重無法自行下山，同行友人緊急撥打119求救。台東縣消防局指揮中心接獲報案後，立即派遣成功大隊及所屬都蘭分隊警義消前往救援，總計出勤警消7名、義消14名，晚間將婦人救出送醫。消防人員於下午近4點半在步道上接觸患者，經評估發現傷者頭部有明顯撕裂傷，雖生命徵象穩定，但一直出現嘔吐症狀，疑似有腦震盪情形。救護人員不敢大意，立即與遠在市區的醫療指導醫師現場連線，將都蘭山2.5k處作為行動急診室，建立靜脈輸液及斷血炎、清洗傷口、包紮止血等處置，以維持緊急傷病患之血壓及止血。請繼續往下閱讀...考量傷者頭部傷勢及嘔吐情形不宜行走，隨後以捲式擔架將患者妥善包覆固定，由現場警義消人員合力接駁搬運，順利於晚間8點20分將患者運送至登山口，並由救護車送往醫院進行後續檢查。消防局成功大隊呼籲，登山活動具有一定風險，長者或患有慢性病民眾應量力而為。台東消防局人員到都蘭山救援受傷婦人。（記者黃明堂翻攝）熱門賽事、球星動態不漏接    ,https://news.ltn.com.tw/news/society/breakingnews/5255873
怒嗆士官長還想動手 下士被起訴,社會,2025/11/24 10:04,基隆地檢署近日偵結，認定林男涉犯對長官施強暴未遂罪，依法起訴。（記者吳昇儒攝）海軍131艦隊一名林姓下士去年7月間在艦艇船艙內把玩3用電表，被吳姓士官長發現後出言制止。林男非但不聽，甚至隨意棄置，遭到訓斥。林姓下士竟作勢推擠吳姓士官長胸口，士官長展開反擊，直接將對方壓制在艦艇內燃機主機上，隨即向上通報。基隆地檢署近日偵結，認定林男涉犯對長官施強暴未遂罪，依法起訴。檢軍調查，吳姓士官長是林姓下士的直屬長官，案發當時林男在艦艇內把玩3用電表，被吳姓士官長發現後訓斥。林男不予理會更直接將3用電表隨意丟棄，轉身離去，無視長官。請繼續往下閱讀...士官長再次訓斥時，林男竟回頭作勢推擠，準備動手傷人，卻遭到反制，直接吳男被壓制在艦艇內燃機主機上。檢察官偵訊時，林男坦承犯行，並表示已和吳姓士官長達成和解，且於同年10月退伍，吳男也提出刑事撤回告訴狀。檢察官偵訊後，認定林男涉犯對長官施強暴未遂罪，依法起訴，請法官考量雙方已經達成和解，請依法量處適當之刑。熱門賽事、球星動態不漏接    ,https://news.ltn.com.tw/news/society/breakingnews/5255867
妙齡女喝完酒如廁完包包不翼而飛 阿伯偷拿辯「撿到」,社會,2025/11/24 10:02,徐女將包包放置酒吧門口後，跑到附近公園上廁所，但返回時包包不翼而飛，警方調閱監視影像展開地毯式搜索，將涉嫌偷竊楊男查獲。（記者陸運鋒翻攝）22歲徐姓女子在台北市大安區某酒吧消費完，將隨身包包放置在門口後，跑到附近公園上廁所，但返回時包包不翼而飛，警方獲報調閱監視影像展開地毯式搜索，將涉嫌偷竊74歲楊姓男子查獲，而他辯稱「包包是撿到的」，詢後仍移送偵辦。大安警分局今公布影像並指出，徐女在本月16日上午7時許，在大安區忠孝東路四段某酒吧飲酒完，將包包放置於門口後至附近公園上廁所，但返回時卻發現包包已不翼而飛，隨即打110報案。請繼續往下閱讀...警方指出，經調閱監視影像後，得知包包遭一名男子竊取，隨後展開地毯式搜索，最後在附近瑠公公園發現嫌犯楊姓男子，他一度辯稱是「撿到的」，經返回其住處搜索後，尋回徐女的包包，警詢後將楊男依竊盜罪嫌送辦。警方呼籲，民眾出門在外應提高警覺，妥善保管自身財物，避免成為不法分子的目標。警方將繼續加強治安巡邏，以維護市民安全。女子隨身包內放有平板、手機、錢包等物品。（記者陸運鋒翻攝）熱門賽事、球星動態不漏接    ,https://news.ltn.com.tw/news/society/breakingnews/5255863
駕駛恍神？新北鶯歌轎車衝撞路邊大貨車 理貨司機當場斷肢命危,社會,2025/11/24 09:50,鍾姓男子今天凌晨駕車撞入一輛大貨車車尾，當場撞斷理貨司機張男的左腿，張男送醫時命危。（記者吳仁捷翻攝）新北市鶯歌今天凌晨驚傳一名鍾姓男子駕車不慎，撞入路旁大貨車車尾，當時在車後理貨的張姓司機整個人被撞進後車廂，左腿當場撞斷、右腿也粉碎骨折受困，消防單位耗費半小時救出，送醫途中意識改變命危，到院未脫險；警方對肇事鍾男酒測、以唾液驗毒，均無反應，鍾嫌辯稱恍神、疲勞駕駛釀禍，警方朝過失傷害方向偵辦。新北市警察局今天凌晨2時許獲報，新北市鶯歌區八德路往桃園方向，傳出轎車撞擊大貨車，警方到場，發現21歲鍾男駕車撞入車斗開啟的路邊大貨車車尾，大貨車駕駛54歲張男受困車後哀嚎，消防單位也同步趕抵，見張男夾困且斷肢，連忙使用破壞器材救人；消防單位耗費約30分鐘，救出斷肢的張男，發現他右腿也嚴重骨折，連忙送醫但未脫險。請繼續往下閱讀...據了解，遭撞的張男為統一超商物流司機，當時在理貨、下貨，到一旁超商補貨，肇事鍾嫌未透露職業，他車禍後一臉茫然，辯稱當時要回家，精神不濟、恍神衝向路邊，未料撞上當時在車後的司機。警方還原現場，肇事鍾男案發時駕駛轎車，從鶯歌八德路往桃園方向行駛，行經事故地點時，自述恍神撞上停在路邊的營業大貨車，當時司機張男在貨車後方理貨遭撞，張男現場意識清楚，左腿明顯斷裂，送醫途中意識改變，到院急救未脫險。警方到場處理車禍、鑑識人員到場採證，調閲路口監視器影像，佐證、釐清事故原因。鍾姓男子今天凌晨駕車撞入一輛大貨車車尾，當場撞斷理貨司機張男的左腿，張男送醫時命危。（記者吳仁捷翻攝）鍾姓男子今天凌晨駕車撞入一輛大貨車車尾，當場撞斷理貨司機張男的左腿，張男送醫時命危。（記者吳仁捷翻攝）鍾姓男子今天凌晨駕車撞入一輛大貨車車尾，當場撞斷理貨司機張男的左腿，張男送醫時命危。（記者吳仁捷翻攝）圖為車禍現場。（記者吳仁捷翻攝）理貨司機張男被夾，消防員以破壞器材搶救。（記者吳仁捷翻攝）鍾姓男子今天凌晨駕車撞入一輛大貨車車尾，當場撞斷理貨司機張男的左腿命危，車禍肇因仍待調查釐清；圖為肇事車頭撞進大貨車後方。（記者吳仁捷翻攝）新北市鍾姓男子今天凌晨駕車撞入一輛大貨車車尾，當場撞斷理貨司機張男的左腿，張男送醫時命危；圖為肇事車頭撞進大貨車後方。（記者吳仁捷翻攝）熱門賽事、球星動態不漏接    ,https://news.ltn.com.tw/news/society/breakingnews/5255848
港婦吃饗食天堂OHCA 疑身體出狀況非食物噎到,社會,2025/11/24 09:44,1名香港旅客23日晚上與家人到高雄夢時代的饗食天堂自助餐廳用餐，突然暈倒失去生命跡象，經搶救後目前仍在加護病房觀察中。（記者許麗娟攝）來自香港的68歲張姓婦人昨晚與家人到饗食天堂高雄夢時代店用餐，晚間7點半多傳出暈倒失去生命跡象，經緊急搶救後恢復生命跡象，目前仍在醫院加護病房觀察中，不過，據了解，張婦暈倒前有頭暈、嘔吐，加上喉嚨未發現異物，目前血壓狀況還不穩定，疑似是身體出狀況而非被食物噎到。院方指出，張婦昨晚8點10分由救護車送到醫院後，經醫師急救恢復生命徵候，目前血壓狀況還不穩定，還在加護病房觀察中。請繼續往下閱讀...據了解，張婦是在取餐過程突然倒地、失去意識，當時餐廳內用餐的客人中，有2名護理師協助進行施作心肺復甦術，一度傳出張婦是被食物噎到導致，但救護人員到場未發現喉嚨有異物，醫院也沒有檢查到異物，由於家屬告知張婦暈倒前曾有頭暈、嘔吐症狀，加上張婦目前血壓狀況仍不穩定，事發原因仍待進一步釐清。饗食天堂高雄夢時代店傳意外 香港女遊客用餐疑噎到一度命危熱門賽事、球星動態不漏接    ,https://news.ltn.com.tw/news/society/breakingnews/5255851
嘉義養豬場領飼料補助款違規廚餘餵豬 查封土地繳還79餘萬,社會,2025/11/24 09:44,林女的養豬場領有飼料補助款，卻被查到仍用廚餘餵豬。（行政執行署嘉義分署提供）日前非洲豬瘟疫情再起，廚餘餵豬議題受關注。嘉義縣一名林姓女子經營的畜牧場，領有嘉義縣政府養豬場轉用飼料補助款79萬3918元，2022年被查獲仍用廚餘飼養豬隻，經行政法院判決命其繳還補助款，行政執行署嘉義分署受理執行，催繳並查封林女土地，林女才繳還全部補助款。嘉義分署指出，農業部因應國際非洲豬瘟疫情嚴峻，阻絕非洲豬瘟藉由廚餘或其他廢棄物傳播風險，訂定「具廢棄物再利用資格養豬轉用飼料補助要點」，推動養豬場轉用飼料，補貼農民轉用飼料成本差額。請繼續往下閱讀...嘉義縣新港鄉林女經營的畜牧場，申請登記飼養種豬及肉豬636頭，2021年領有縣府「取得廚餘等廢棄物再利用檢核養豬場使用飼料補助計畫」轉型補助款79萬餘元，不過嘉義縣環保局在2022年1月21日，稽查發現林女畜牧場仍使用廚餘飼養豬隻，違反「具廢棄物再利用資格養豬轉用飼料補助要點」第10點規定，縣府命其繳還補助款後，林女提起行政訴訟，高雄高等行政法院判決駁回，林女起訴確定後移送強制執行，嘉義分署執行查封林女新港鄉3筆土地，林女於是向嘉義分署申請分期繳納，將所有補助款79萬餘元全數繳清，撤銷土地查封登記。林女因未繳還補助款，經行政執行署嘉義分署強制執行查封土地，分期還清79萬餘元。（行政執行署嘉義分署提供）熱門賽事、球星動態不漏接    ,https://news.ltn.com.tw/news/society/breakingnews/5255846
「最衰庇護島」又撞了！彰化市彰南路半年來第11撞,社會,2025/11/24 09:43,彰化市彰南路行人庇護島昨晚又被撞，指示牌也被撞斷。（民眾提供）超悲情！彰化市彰南路為改善原本的「扭扭路」，進行大改造，也增設行人庇護島，卻一再傳出車輛「撞上」庇護島的意外。昨天（24日）傍晚再傳出自小客車撞上庇護島事件，也是半年來的第11撞，民眾大嘆這應該是「全國最衰的庇護島」了！警方表示，這起意外發生在昨天傍晚5時許，61歲許女駕駛小客車在彰南路一段與山中街口，往東方向由外側迴轉時撞上庇護島，車子左前保險桿擦損，連帶指示牌也斷裂，許女酒測值為零。請繼續往下閱讀...彰南路經過改造後擺脫「扭扭路」命運，用路人都感受到更安全更好開，但增設用來保護用路人的行人庇護島，卻是一撞再撞，全路段15座庇護島，加上昨天這起意外，半年來已經11撞，當地民眾都說，只要聽到「碰」一聲，就知道應該又有車子「撞上」或是「騎上」庇護島，如果用路人「切西瓜」駕駛習慣不改，根本無法杜絕「庇護島」再一次被撞。彰化市彰南路行人庇護島昨晚又被撞，也是這半年第11撞。（民眾提供）彰化市彰南路行人庇護島昨晚又被撞，指示牌也被撞斷。（民眾提供）熱門賽事、球星動態不漏接    ,https://news.ltn.com.tw/news/society/breakingnews/5255849
南庄加里山登山客腳踝骨折 21名消防員8小時接力抬下山,社會,2025/11/24 09:41,消防人員將受傷男子搬運下山。（圖由消防提供）一行6人的登山隊伍，前往苗栗縣南庄鄉攀登加里山，途經三角點時，其中1名中年男子不慎滑倒腳踝骨折，無法站立、行走；苗栗縣消防隊接獲通報，立即分3梯次21人上山，耗費8小時漏夜將受傷男子搬運下山送醫。苗栗縣消防局今（24日）表示，這起山難救護發生於22日，勤務中心於當天下午1點59分接獲報案，1行6人登山隊伍攀登南庄鄉加里山，其中1人於三角點附近不慎滑倒，致左腳踝受傷，痛得無法站立、行走，派遣人車上山救援。請繼續往下閱讀...消防人員於當天晚間7點接觸到受傷男子，經檢視男子左腳踝疑閉鎖性骨折無法行走，遂使用SKED 捲式擔架進行包紮固定，採人力將男子搬運下山。但山路崎嶇加上夜間視線不佳，救援搬運極為辛苦，經派遣3梯次21人接力，克服陡坡與濕滑泥地，於23日凌晨3點許抵達登山口，交由救護車將受傷男送醫。消防人員漏夜將受傷男子搬運下山。（圖由消防提供）消防人員接觸到受傷男子，經檢視男子左腳踝疑閉鎖性骨折無法行走，包紮固定後以SKED 捲式擔架搬運下山。（圖由消防提供）熱門賽事、球星動態不漏接    ,https://news.ltn.com.tw/news/society/breakingnews/5255844
老農違反375租約損失數百萬還需拆屋還地  險發生以死相諫悲劇,社會,2025/11/24 09:32,91歲張姓老農不諳法令違反375租約，棲身的工寮兼住家被判拆屋還地。（記者蔡宗勳攝）嘉義縣民雄鄉張姓老農承租鄉有地從事養殖漁業，因故停養閒置，遭民雄鄉公所以違反375租約精神提告，法院判決土地需返還還要拆屋。張翁不僅喪失數百萬元權利金，臨老流離失所，揚言以生命抗議。經嘉義縣議員黃啟豪服務處居中不斷協商，公所與張翁在台南高分院達成和解，公所同意張翁夫妻終老或搬離再拆屋還地，解決可能出人命的強制執行。91歲張姓老農1989年間向民雄公所承租1.3甲公有地養魚，抽取地下水做為水源，但後來政府因抽地下水會導致地層下陷要求封井，張翁因缺乏水源致養殖效益大減，而逐年減少放養面積，最終屬於閒置狀態。請繼續往下閱讀...民雄公所於2023年7月6日函文張翁應於該年10月12日前恢復養殖狀態，但張翁並未在期限內改善，遭民雄公所以違約使用為由終止租約，張翁不服，民雄鄉公所提告要求返還土地、拆屋及追討不當得利，法院最終判決張翁應給付民雄鄉公所24萬元7486元，並自2024年7月17日起如未拆屋還地及返還耕地，按年給付民雄公所33萬1950元。張翁敗訴後，頓失求生意志，揚言強制執行時將以死明志，女兒憂心發生悲劇，向議員黃啟豪求助，經服務處向民雄公所據理力爭，協調由張翁提供15坪建地做為擔保設定抵押120萬元，公所同意讓張翁夫妻繼續居住，直到終老或搬離再拆屋，其餘耕地則返還公所。黃啟豪服務處執行長蔡民一指出，張姓老農如果沒有違反租約規定，可在終止租約時獲得當期公告土地現值減除土地增值稅後餘額的3分之1做為補償，也就是張翁因輕忽規定，不僅喪失數百萬元權益，還面臨棲身之處拆除的絕境，所幸和民雄公所磋商過程雖一波數折，但最終圓滿落幕。熱門賽事、球星動態不漏接    ,https://news.ltn.com.tw/news/society/breakingnews/5255835
