Title,News_Type,date,content,url
80歲曾蔡美佐遭惡煞重摔骨裂,社會,2026/05/08 05:30,前立委、前朝天宮董事長曾蔡美佐住家遭數十名白衣男子闖入、打人，警方目前已拘提涉案十人。（取自網路社群「黑色豪門企業」）北港媽遶境 50多名白衣煞直闖前朝天宮董事長家國家重要民俗「北港朝天宮迎媽祖」活動於本月五日起登場，不料昨天凌晨傳出前立委、前朝天宮董事長曾蔡美佐住家遭數十名白衣男子闖入，見人就打，導致曾蔡和其子曾維斌等六人受傷。警方表示，已拘提涉案十人，依聚眾鬥毆、傷害等罪送辦，訊後三人聲押、五人交保。請繼續往下閱讀...警拘10人 3聲押5交保網路社群平台「黑色豪門企業」昨天下午傳出一段影片，數十名白衣男子在曾蔡美佐的住家前叫囂，還能聽到敲打聲，隱約聽到「打呼死」呼喊聲，更有男子拿著一支橘紅色三角錐往住家內丟。白衣男還點名喊打呼死曾蔡美佐表示，昨天凌晨四點左右與兒子曾維斌等六名親友在住家等候千里眼、順風耳將軍隊伍抵達，未料數十名白衣男子進入住家，大喊「曾蔡美佐」，她聽到後先站起來看，結果白衣男子就朝曾維斌毆打，還作勢要朝她毆打，更揚言「打呼死」，接著她被白衣男拉起重摔在地。曾蔡美佐強調，完全不清楚為何這群男子要到住家毆打她，她已經八十多歲了，最近都在台北，前三天才因媽祖遶境回雲林，這場混亂也導致她骨椎疑似骨裂，原本醫生說要開刀，但她年歲已長，希望灌骨漿即可，相關案件就讓警方好好處理。曾維斌表示，住家交通錐、花盆都被當成武器，他仔細觀察白衣男子，先是徒手毆打，再拿出棍棒共兩波攻勢，初判有五十多名男子滋事，不知道對方是誰，已請警方趕緊處理。疑與曾家有舊怨據了解，雙方疑似先前有恩怨，白衣男子這一方藉著酒後壯膽滋事。北港警分局表示，目前警方已拘提主嫌及相關犯嫌等十人到案，全案將依聚眾鬥毆、傷害及違反組織犯罪防制條例等罪嫌法辦。    ,https://news.ltn.com.tw/news/society/paper/1753930
上千人受害 正妹律師領軍討公道,社會,2026/05/08 05:30,愛爾麗針孔風波已經有超過千人受害，部份受害者已經委任李欣庭律師協助處理 。（翻攝自理然法律事務所精英團隊）律師李欣庭也去消費過愛爾麗醫療集團爆發針孔偷拍事件，該集團客戶、會員遍及全台，事發後造成眾多消費者憂惶不安，擔心成為偷拍受害對象，甚至檢警的調查方向認為，也有未成年的兒少受害者。台北市府法務局及新北市法制局統計至昨天下午，已分別受理五十四件及五十七件該診所消費爭議申訴案，將研議啟動團體訴訟。至於「愛爾麗醫美消費者自救會」LINE群組，已突破千人，過去也曾消費過的理然法律事務所所長李欣庭律師，已接受部份消費者委任，負責處理本案。也有未成年兒少受害者台北市法務局主任消保官林傳健指出，已與消費者文教基金會及台灣消費者保護協會保持密切聯繫，針對本案涉及全國連鎖醫療集團、多據點及大量潛在受害者的特性進行評估。請繼續往下閱讀...李欣庭律師表示，目前已協助當事人初步風險篩選，包括是否曾於相關期間至特定門市接受療程；是否曾進入疑似設置設備之診療空間；是否接受需脫衣、更衣等高度私密性療程；療程時間是否與設備存在期間具重疊可能。李欣庭提醒，後續如果可以證實當事人曾於設備存在期間進入診療間等，即使尚未確認影像是否外流，仍可能涉及隱私權及人格權侵害，並作為後續法律救濟之基礎。消基會提醒保留相關證據消基會提醒，曾於相關診所接受療程消費者，若發現自己曾在裝有疑似針孔設備空間內接受療程，應儘保留療程紀錄、收據及會員資料，並保留診所內部照片或社群貼文、預約紀錄與對話截圖、曾進入診療空間位置資訊，及相關心理就醫或精神壓力證明等證據。    ,https://news.ltn.com.tw/news/society/paper/1753928
政院拍板／盜採砂石可判5年罰5千萬,社會,2026/05/08 05:30,近來各地屢傳盜採砂石，嚴重破壞環境景觀也危及公共安全，政院昨通過「土石採取法第三十六條修正草案」，提高罰鍰上限、增訂刑責。圖為台中神岡砂石遭盜採。（資料照）為遏止非法採取土石，行政院會昨通過「土石採取法第三十六條修正草案」，提高罰鍰上限、增訂刑責，未經許可盜採罰鍰提升二倍至最高一千萬元。針對意圖營利者，增訂五年以下有期徒刑，得併科最高五千萬元罰金；如因違法行為致人死傷，最高處無期徒刑、併科一億元罰金。「高雄美濃大峽谷」案引發關注，盜採砂石案嚴重破壞環境景觀也危及公共安全，經濟部去年底著手修改「土石採取法」第卅六條，加重處罰。根據修法草案，修法處罰的行為人，不限於實際從事採取土石行為者，也包含參與的地主、僱主、駕駛及相關人等，均得依法重罰。請繼續往下閱讀...經濟部指出，過去罰則讓部分違法行為人認為即使遭到裁罰仍有利可圖，導致盜採行為持續發生，不僅破壞國土資源，更衍生公共安全風險。此次修法以「嚴懲不法牟利」及「強化環境恢復」為核心，具備「精準打擊、阻斷不法、環境恢復」三大效益。根據草案，未經許可採取土石者，罰鍰上限提高至一千萬元外，針對意圖營利的違法行為人，增訂處五年以下有期徒刑，並得併科最高五千萬元罰金；如因違法行為致人死傷，將依情節加重處罰，最高可處無期徒刑，並得併科一億元罰金。草案也強化沒入機制，查處機關裁罰時，得當場沒入違法行為所使用的機械設備及載運車輛，立即阻斷違法持續擴大；對於意圖營利的違法行為，其使用的相關設備及車輛，不論所有權歸屬，一律強制沒收，以提高違法成本並防止再度流入不法用途。修法也確立整復規範，對於違法場址整復使用的物料、實施方法及相關事項，將由中央主管機關會商相關機關後公告訂定，確保全國整復執行標準明確一致；並明定整復過程不得使用廢棄物，防堵二次污染，若屆期「未依規定」整復者，處以連續處罰。    ,https://news.ltn.com.tw/news/society/paper/1753932
愛爾麗前員工也憂被拍 挺身報案,社會,2026/05/08 05:30,愛爾麗承諾未施作課程全額退費 ，但前往退費的顧客質疑退得不夠爽快。（記者李惠洲攝）愛爾麗集團涉入針孔偷拍客戶風波，引發全國消費者不安，台南一位該集團的前員工，任職期間也不知道竟有偽裝成煙霧偵測器的針孔，暗中窺視著店內一舉一動，近日看到新聞報導後大為惶恐，擔心自己在不知情下遭側錄影像，已主動報警；她表示，為捍衛隱私，因此決定挺身報案。有消費者稱退費遭拒愛爾麗：未施作課程全退費另有消費者表示，前往診所要求退費但遭拒，該民眾為此前往管轄愛爾麗台南市中西區分院的台南市警二分局諮詢，但尚未提出告訴。愛爾麗醫美集團則在昨天下午發出聲明，除向大眾致歉，並表示積極配合司法調查，依法提供資料，基於偵查不公開，現階段不對個案細節額外說明。請繼續往下閱讀...對於消費者退費權益，愛爾麗聲明宣布，全面開放未施作課程退費，為維持作業順暢，集團設立專責窗口提供專人協助，退費流程方面，消費者需先透過線上客服，或向原購買分院預約登記，完成登記手續後，工作人員將依序排程，協助安排後續退費進度，確保消費者權益獲得保障。因退費涉及金額核對與個人資料確認，暫不提供線上退費服務。前新北地檢署檢察官、觀希國際法律事務所所長歐蕙甄律師表示，被害者除能提出刑事告訴，也能依民法一八四條侵權行為規定求償，除財產損失，還可以依照民法第一九五條請求精神慰撫金；法界人士提醒，民眾若認為自己有被偷拍疑慮，向警政機關報案時，最好能提供前往醫美診所的時間區段，以利調查。    ,https://news.ltn.com.tw/news/society/paper/1753929
前口湖鄉長索賄光電400萬 判10年定讞,社會,2026/05/08 05:30,兩年前無黨籍縣議員蕭慧敏涉賄選當選無效，林哲凌（見圖）遞補雲林縣議員，如今林也因收賄判刑十年被解職。（資料照）無黨籍雲林縣議員林哲凌，七年前於口湖鄉長任內，利用核發光電廠建照、批准動工的職務權力，向光電廠商海神光能公司索賄四百萬元，另犯偽造顧問合約、開立不實發票，二審高等法院台南分院去年六月依不違背職務收賄罪將他判刑十年、褫奪公權八年，另依違反商業會計法，判可易科罰金的四月徒刑，沒收四百萬元賄款；最高法院昨駁回林上訴定讞，並通知檢方啟動防逃機制。落選頭 林哲凌遞補上議員即刻解職 檢啟動防逃機制林哲凌曾任兩屆口湖鄉長、三任縣議員，二〇二二年落選第廿屆縣議員，但無黨籍縣議員蕭慧敏因涉賄選被判當選無效確定而解職，林哲凌於二〇二四年一月遞補議員，如今光電收賄案有罪定讞，自定讞日解職。請繼續往下閱讀...判決指出，海神光能公司二〇二〇年規劃於口湖鄉設立「漁電共生」水產養殖設施結合太陽能光電的案場，須由鄉公所核發建照，且經核准才能開工，林透過黃姓女土開業者向廠商表達索賄五百萬元，討價還價降至四百萬元，公所同年八月廿四日核發建照，九月十日核准開工。林否認收賄，辯稱是土地開發的分潤，雲林地院認定林利用職務影響建照與開工程序，四百萬報酬沒有合法依據，構成收賄罪，量刑十年，違商會法另判四月。二審台南高分院認為林利用權勢向企業索賄，廠商為求工程順利而無奈付錢，林的行為嚴重損害國家公信與廠商經營秩序，犯後態度欠佳，駁回林上訴；最高院昨亦維持原判確定。    ,https://news.ltn.com.tw/news/society/paper/1753931
愛爾麗爆偷拍／婦團批系統性侵害的高度惡行,社會,2026/05/08 05:30,愛爾麗醫美集團爆發偷拍案，因偷拍需受害者提告才能懲處，現代婦女基金會呼籲消費者，主動提出相關刑、民事告訴等，勿讓不肖商人輕易脫罪卸責。（記者吳柏軒攝）消基會直指醫倫、消保、人格權侵害、個資及管理失靈 重大制度危機全台有二十家分店、分院的愛爾麗醫美集團爆發大規模偷拍，不少消費者表示不知道有偽裝成煙霧偵測器的針孔攝影機在監控拍攝。現代婦女基金會表示，此事非單一偷拍案件，而是濫用職權，系統性侵害他人身體隱私的高度惡行；消費者文教基金會也認為絕非單純個案，而是涉及醫療倫理、消費者保護、人格權侵害、個人資料保護，及醫療場所監視設備管理失靈的重大制度性危機。請繼續往下閱讀...現行規範相對簡易醫改會籲修正醫療法醫改會呼籲衛福部修正「醫療法」有關患者隱私保護規範，並借機對醫療院所內涉及病患隱私的場所進行全面性盤查。衛福部表示近期將發函各地衛生局，要求衛生單位全面盤查愛爾麗集團旗下診所。婦團強調，愛爾麗集團犯行涉及廣大消費者私密影像，甚至恐涉及長期性暴力產業鏈的重大案件，呼籲檢警持續擴大追查，也籲各縣市依法加重裁罰愛爾麗診所與行為人。現代婦女指出，愛爾麗一邊收取高額醫美費用，一邊側錄消費者身體隱私，甚至可能涉及大規模私密影像蒐集與流通，該行為已超越個人犯罪，是濫用職權，系統性侵害他人身體隱私的高度惡行。醫改會執行長林雅惠表示，醫療法規範診間等涉及患者隱私的空間，錄音錄影需經醫病雙方同意，但現行規範相對簡易，未細部載明相關作業準則；英國等其他國家對錄製範圍、知情同意書格式等均有詳細規範，甚至明確界定「合理必要情境」。林認為，衛福部應明確說明「合理必要的錄製情境」，避免讓診間成為醫療院所錄音錄影灰色地帶。消基會強調，該案凸顯我國對於「半公共空間」防偷拍制度的重大缺口，政府應全面清查高隱私醫療場所監視設備、建立高隱私醫療空間禁止錄影原則、強化醫療場所錄影告知義務、建立醫療消費重大隱私事件強制通報制度，並完善團體訴訟與精神損害賠償制度。愛爾麗集團總經理劉貞華（左）500萬交保、雙手插在口袋步出地檢署。（記者王藝菘攝）愛爾麗集團總裁常如山（左2）、針孔業者謝金亨（左）被聲押禁見。（記者王藝菘攝）    ,https://news.ltn.com.tw/news/society/paper/1753927
愛爾麗偷拍》常如山涉指示滅證 收押,社會,2026/05/08 05:30,愛爾麗偷拍案，愛爾麗總裁常如山（中）、特助張元齡（右）、設備商謝金亨（左）聲押禁見。（記者王藝菘攝）被害者眾多且有少女 特助、設備商也收押新北檢警偵辦愛爾麗連鎖醫美新北板橋店偷拍案，追查發現，至少台中以北就有十家分店裝設煙霧偵測器偽裝的針孔竊錄消費者，且被害者眾多，還有少女受害，集團總裁常如山等高層疑在事件曝光後，指示設備商急拆監視器主機滅證，昨依刑法的無故攝錄性影像罪、無故竊錄他人身體隱私部位罪、違反個資法與兒童及少年性剝削防制條例的拍攝兒少性影像等四罪，聲押禁見常如山、特助張元齡、設備商謝金亨三人，法院於今凌晨零時許裁准三人羈押禁見。同案被告女總經理 500萬交保常男所涉罪嫌，最重者可處一年以上、七年以下徒刑。新北地檢署偵辦認為，常男等三人罪嫌重大且有串、滅證之虞，依此建請羈押禁見；同案被告愛爾麗總經理劉貞華，昨獲五百萬元交保及限制出境出海，劉女否認偷拍，聲稱有告知消費者。請繼續往下閱讀...檢警扣十台主機、數十具針孔檢警追查，愛爾麗在新北板橋、新莊、林口、永和店、台北忠孝、站前、南京店、桃園店、台中文心、崇德等十家分店裝設針孔，另高雄等也有分店疑出現拆除痕跡。案經一名在板橋店做體雕療程的女客戶揭發，謝男當天就開車前往各分店沿途拆卸主機，板橋店主機內容則遭格式化。檢警追至台中攔阻謝男，扣下十台主機及數十具針孔，並找到七名被害者提告，案情直指常男等人疑知情、涉案及緊急指示謝滅證，有集體犯罪之嫌；因分店位於不同縣市，經協調統一移由新北地檢署偵辦。    ,https://news.ltn.com.tw/news/society/paper/1753917
愛爾麗爆偷拍 常如山、特助、針孔業者收押禁見,社會,2026/05/08 01:16,愛爾麗總裁常如山（中）、特助張元齡（右）、針孔業者謝金亨（左）收押禁見。（記者王藝菘攝）新北檢警偵辦愛爾麗連鎖醫美新北板橋店涉針孔偷拍案，懷疑愛爾麗總裁常如山等高層涉案、知情，且在曝光後疑涉指示設備商拆卸監視器主機滅證，已查扣10台主機，找到7名被害者提告，昨天（7日）依妨害秘密、妨害性隱私及違反兒童及少年性剝削防制條例與個資法聲押禁見常如山、特助張元齡、設備商謝金亨共3人，新北地院今晨裁定3人均收押禁見。法官審理認為，3人犯罪嫌疑重大，且常如山除有逃亡之虞外，其與張元齡、謝金亨亦均有勾串共犯、證人、湮滅、偽造、變造證據之虞及羈押之必要，並均禁止接見、通信。請繼續往下閱讀...至於同案被告、愛爾麗總經理劉貞華昨晨訊後500萬元交保並限制出境出海，劉女交保後面對媒體詢問否認偷拍，聲稱有告知消費者，並無被害者；此外，愛爾麗新北4家分店負責人昨天以證人身分接受檢方訊問，訊後請回。本案起於30歲女性顧客5月1日到愛爾麗板橋店做體雕療程，發現店內疑似裝有煙霧偵測器針孔攝影機，除了錄影存證、向警方報案，還在社群發文提醒大家小心；警方3日搜索時發現監視器鏡頭雖存在，主機卻不翼而飛，循線發現是謝金亨所為，緊急報請新北檢指揮偵辦。警方3日晚間在台中發現謝金亨行蹤攔人，在他車上及辦公室查扣愛爾麗濁水溪以北共10家分店監視器主機及數十台針孔設備，但因板橋店主機已遭格式化，且尚須清查被害者身份並確認是否提告，檢方4日訊後先將謝金亨請回，經確認被害者身分確認提告。檢警回溯發現，謝金亨1日疑受人指示，開車到新北4分店、台北忠孝、站前、南京店、桃園店、台中文心、崇德共10家分店拆主機，懷疑常如山等人是背後影武者，不僅知情、涉案，還疑似指示謝金亨拆卸監視器主機滅證，有集體化犯罪嫌疑，拘提常如山等人到案，訊後聲押常如山、張元齡、謝金亨。檢方呼籲，有查扣監視器相關各分店的被害人，如經警方聯繫，請配合確認並斟酌是否提出告訴；相關分店被害人亦可向警方洽詢是否有在監視器畫面保留區間內，並主動報案配合警方偵辦，以利進一步釐清案情。法官裁定愛爾麗總裁常如山、特助張元齡、針孔業者謝金亨收押禁見。（記者劉信德攝）    ,https://news.ltn.com.tw/news/society/breakingnews/5429576
愛爾麗爆針孔偷拍 常如山、特助、設備商羈押禁見,社會,2026/05/08 00:48,愛爾麗總裁常如山（中）、特助張元齡（右）、針孔業者謝金亨（左）羈押禁見。（記者王藝菘攝）新北地檢署偵辦愛爾麗診所疑針孔偷拍案，6日拘提總裁常如山、張姓特助、謝姓廠商等3人到案，訊後依妨害性隱私等罪嫌聲押禁見。昨天晚間新北地院召開羈押庭，深夜裁定3人羈押禁見。新北檢警6日搜索愛爾麗診所板橋、新莊等4間分店，帶回愛爾麗集團總裁常如山等人，複訊後認常如山、張姓特助及謝姓廠商涉妨害性隱私、妨害秘密、兒童及少年性剝削防制條例等罪聲押禁見。請繼續往下閱讀...新北地院7日晚間召開羈押庭，法官認定常如山除有逃亡之虞，與張姓特助、謝姓廠商均有勾串共犯、證人、湮滅、偽造、變造證據之虞及羈押之必要，裁定3人皆羈押禁見。全案源於，一名女網友指1日前往愛爾麗診所板橋店診療間進行體雕，在診療間換衣服時，發現天花板角落不明裝置疑藏有攝影鏡頭。診所人員稱是煙霧偵測器，女子報警後，海山分局3日前往診所搜索，拆開確認裝置內有攝影機，但卻未發現主機。警方循線追查到謝姓廠商1日晚間前往板橋分店疑似拆除器，立即報請新北地檢署主任檢察官周欣蓓指揮偵辦，3日在台中將謝姓廠商拘提到案，並發現謝姓廠商疑受指示，一路開車南下將中部以北10間分店的監視器主機拆除，不排除滅證可能性。檢警也在查扣的偽裝式監視器主機及鏡頭中，清查出多名受害者，目前至少10人完成報案。愛爾麗總裁常如山（中）、特助張元齡（右）、針孔業者謝金亨（左）羈押禁見。（記者劉信德攝）    ,https://news.ltn.com.tw/news/society/breakingnews/5429568
騎機車與小貨車碰撞 印尼移工魂斷彰化鹿港,社會,2026/05/07 23:59,小貨車在彰化鹿港彰濱5路左轉海浴路，與騎機車直行移工發生碰撞。（ruirueirueirui提供）彰化縣鹿港鎮今晚（7日）發生死亡車禍，印尼男移工騎機車在海浴路、彰濱5路口與小貨車發生碰撞，移工當場失去呼吸心跳，送彰濱秀傳醫院搶救宣告不治。彰化縣第三消防大隊說，到場救護時發現移工已無呼吸心跳，左小腿有撕裂傷，送往彰濱秀傳醫院搶救仍回天乏術。而小貨車司機未受傷。請繼續往下閱讀...從影片可看到，小貨車從彰濱5路要左轉海浴路，騎機車移工直行，雙方發生碰撞，機車被壓在車下，零件噴飛一地，這時，騎機車警員也直行彰濱5路看到意外發生，立即停車指揮交通。意外發生地點在彰濱工業區鹿港區的重要路口，彰濱5路是通往彰濱鹿港區最主要的大道，海浴路則是市區通往彰濱的重要聯絡道路，平日車流量大，工業區不乏工廠有輪值夜班或是晚班，這起意外讓路過的人心驚膽顫。機車捲入車底零件噴飛一地。（ruirueirueirui提供）    ,https://news.ltn.com.tw/news/society/breakingnews/5429554
台東市鐵工廠火警冒濃煙  唯一「目擊者」白狗逃出變虎斑,社會,2026/05/07 23:19,幸運逃出的目擊者「阿金」本來應該是白色的。（記者劉人瑋攝）台東市海濱公園一帶傳出火警，一間小型鐵工廠廚房起火，由於附近有許多倉庫，一眾業主、員工紛紛跑回查看，卻被燻得逃出，第一位目擊火警的則是被關在鐵門裡面的白狗，消防隊一開大門，白狗已被燻成黃黑交雜的「虎斑狗」，拔腿就跑。由於當地沒有消防栓，消防隊出動2輛水箱車，所幸燃燒面積不大、僅有2平方公尺，因此火勢20分鐘內就撲滅，研判起火點在廚房。只是屋主表示，廚房幾乎沒使用、今天也沒用火，不知為何燃燒。請繼續往下閱讀...火場附近有禮儀公司和金紙倉庫，警消部署人力提防火勢延燒，雖整場火警不見火焰，但濃煙卻燻得人人難受，許多趕回查看的倉庫員工被燻得直咳逃出。最慘的應該是被關在起火鐵工廠內的白狗「阿金」，消防隊打開鐵門就見牠奪門而出、絕塵而去，數分鐘後似乎又想到看家護院、再度返回現場，這時鄰居才看清原本的白狗被燻黃，身上還出現黑色條紋，黃底黑斑成「虎斑狗」，直到見了飼主才興奮撲上，顯然感到安心不少。所幸火警無人傷亡，詳細起火原因仍待警消進一步調查。消防人員跪地才能更方便穿著沉重的裝備，進入火場。現場可見濃煙從大門不斷冒出。（記者劉人瑋攝）    ,https://news.ltn.com.tw/news/society/breakingnews/5429548
曾蔡美佐北港住家被砸6人掛彩 「白衣惡煞」8嫌到案、3人聲押,社會,2026/05/07 22:46,雲林地檢署將涉案3男向地院聲請羈押，其餘5人皆諭知5萬元交保。（記者李文德攝）前立委、北港朝天宮前董事長曾蔡美佐今（7日）凌晨4點多，遭數十名白衣男闖入住家毆打，她和兒子曾維斌、在場友人共6人被打傷。北港警分局火速拘提10人，現有8人已送至地檢署訊問。檢方表示，訊後陳姓男子等3人涉犯傷害等罪，向雲林地院聲請羈押，其餘皆諭知交保5萬元。今天凌晨4點多，30、40名白衣人浩浩蕩蕩靠近曾蔡美佐位在北港大同路的住家，身穿橘色衣褲的曾蔡美佐走出家門查看，白衣男腳步加快，二話不說掄起拳頭、甚至拿交通錐等物品上演「全武行」，約2分鐘的衝突，導致曾蔡美佐、兒子曾維斌等6人受傷，而曾蔡美佐經診治後已無大礙，目前仍需住院觀察1至2天。請繼續往下閱讀...雲林地檢署檢察長林秀敏指派檢察官彭彥儒，指揮警政署刑事警察局、雲林縣警察局刑警大隊、北港警分局共組專案小組。陸續已有8人至地檢署訊問。檢方表示，訊後認21歲陳男、31歲蔡男、18歲蔡男3人，涉犯妨害秩序、傷害等罪嫌重大，且有滅證、勾串共犯及證人之虞，向雲林地方法院聲請羈押，其餘到案被告，則認尚無羈押必要，分別諭知交保5萬元。檢方強調，對於聚眾暴力犯罪絕不寬貸，對於任何以暴力危害社會秩序，均秉持「速查、速辦、嚴懲」原則，以維護社會治安及民眾安全。曾蔡美佐（紅圈者）一度想上前制止衝突發生。（讀者提供）曾蔡美佐（紅圈者）在一群混亂中被推倒在地，整個人痛苦蜷縮。（讀者提供）    ,https://news.ltn.com.tw/news/society/breakingnews/5429524
