Title,News_Type,date,content,url
苗栗50歲男獨攀東卯山失聯一個多月 登山口附近尋獲遺體,社會,2025/10/11 15:19,警方將黃男遺體運送下山。（民眾提供）苗栗縣苑裡鎮一名50歲黃姓男子8月獨自至谷關東卯山健行失聯，黃父於8月26日報警協尋，谷關警方9月24 日接獲林務局巡山員報案，東卯山登山口有一部銀色轎車已多日停放，警方確認是黃男轎車，經派員多日協尋後，於今（11）日上午於德芙蘭步道往東卯山上736公尺山谷發現黃男背包，並於附近搜尋到一具遺體，確認是黃男遺體。警方調查，黃男未婚，疑似未告知家屬去爬山，直至轎車被發現後，才驚覺可能魂斷山林，遺體運送下山後經警方聯繫家屬指認確認身分，將依規定報請相驗。由於適逢連假期間，秋高氣爽，吸引許多山友爬山健行，和平分局自10月9日起，加強各登山口遊客宣導「登山安全須知」，特別提醒「谷關七雄」等均屬中級山，並不是大坑步道，行前務必充分準備及規劃，並結伴上山，以免發生危險消防人員在東卯山山谷將黃男大體搬運下山。（民眾提供）熱門賽事、球星動態不漏接    ,https://news.ltn.com.tw/news/society/breakingnews/5207813
反毒識詐街舞大賽在華山登場 刑事局邀「電豹女」熱舞開場,社會,2025/10/11 15:17,刑事局與國際扶輪社第3522地區今攜手舉辦反毒識詐公益街舞大賽，邀電豹女孩熱舞開場， 齊聲拒毒防詐（記者邱俊福翻攝）為深化青少年防毒、防詐觀念，刑事警察局與國際扶輪社第3522地區今天攜手在北市華山1914文化園區舉辦「2025青少年反毒識詐公益街舞大賽」活動，活動結合街舞競賽、啦啦隊表演、特勤裝備展示、有獎徵答與園遊會攤位，其中最吸睛的焦點是台灣職業籃球大聯盟 TPBL 台啤永豐雲豹專屬啦啦隊「浪LIVE 電豹女 Leopard Girls」登場，以熱力四射的舞蹈結合反毒識詐小考題與民眾互動，瞬間讓氣氛推向最高潮，也吸引許多民眾熱情參與。刑事局表示，此次活動縱向串聯全國北中南各區學校，橫向連結公務部門（警政、教育單位）及民間社團，更特別邀請電豹女啦啦隊擔任反毒識詐代言，希望傳遞「珍愛自己，拒絕毒品」的重要訊息，引領學子透過正當休閒展現自我，培養自信、健康與正向態度，並強化自我保護意識，遠離詐騙陷阱。請繼續往下閱讀...刑事局並強調，「反毒、反詐」是當前政府最重要的施政重點之一；毒品部分，近年新興毒品不斷出現，常偽裝成零食或咖啡包降低青少年戒心，其中依托咪酯（俗稱「喪屍煙彈」）已由第三級提升為第二級毒品，多以電子菸形式出現，並添加水果風味吸引年輕人，甚至被不肖業者誤導為「合法替代大麻」的選項，然而，其濫用性與危害性絲毫不亞於傳統毒品，提醒青少年切勿購買來路不明的電子菸彈，以免誤觸毒品陷阱，殘害自身健康與前途。詐欺部分，少年涉詐多因同儕引薦與金錢誘惑，加上無技術門檻，致使思慮不周而淪為詐騙集團幫手，常見情形包括以「打工」名義誘使少年擔任詐騙車手，或出借個人帳戶供其利用，對此已要求各地方少年隊的掃黑專責小隊加強蒐報，嚴防幫派組織滲入校園吸收、招募少年，並鎖定重點對象予以打擊。刑事局與國際扶輪社第3522地區今攜手舉辦反毒識詐公益街舞大賽，透過園遊會攤位向民眾宣導毒品與詐騙的危害。（記者邱俊福翻攝）熱門賽事、球星動態不漏接    ,https://news.ltn.com.tw/news/society/breakingnews/5207798
獨家》冷血毒駕男八里撞死騎士 醫院尿遁只想返回現場取毒,社會,2025/10/11 15:03,無良李姓毒蟲（圖中）國慶日下午在新北市八里毒駕，脫困到院無視撞死人，尿遁搭小黃回現場取毒，碰上警方採證逃逸，晚間仍被拘提到案。（記者吳仁捷翻攝）新北市八里國慶日下午驚傳李姓毒蟲在商港一路逆向衝撞路邊多車後，波及騎腳踏車經過的鄭姓男子，消防救出肇事李嫌送醫，但李嫌約於下午6時許尿遁，警方致電詢問逃逸李嫌，他透露搭計程車離院回家休養，卻返回現場想取回車內毒品，但警方早在現場採證，李嫌見狀畏罪逃亡，不久警方在車上發現毒品，晚間10時許在台北市北投一處公園逮獲李嫌，將他拘提到案。新北市119於10日下午4時34分獲報，八里商港一路發生翻車車禍，到場時李姓駕駛受困，消防人員到場，約4時50分許協助脫困送醫，八里分駐所員警約於消防脫困時到場，先後讓傷重失去生命徵象的鄭姓騎士及脫困的李嫌送醫；但鄭男急救至5點45分，傷重不治。請繼續往下閱讀...警方也公布死亡車禍時序，4時33分事故發生、4時37分八里所員警接獲110轉報、4時46分抵達現場、管制交通，由救護人員進行救護；5時30分隊車禍處理人員到達車禍現場，犯嫌送醫；5時50分 急診護士發現嫌犯藉口如廁離開醫院。6時許蘆洲分局 車禍處理人員前往醫院途中，先主動致電詢問犯嫌目前位於何處，犯嫌稱已自行出院並搭乘計程車。晚間6時45分犯嫌返回事故地點，當時鑑識人員正在復勘事故車輛；7時8分鑑識人員回報車內發現毒品；晚間9時許，偵查隊聲請拘票，晚間10時21分許逮獲李嫌。警方從毒駕肇事的李嫌身上及肇事車上，起出大批毒品。（記者吳仁捷翻攝）警方從毒駕肇事的李嫌身上及肇事車上，起出大批毒品。（記者吳仁捷翻攝）熱門賽事、球星動態不漏接    ,https://news.ltn.com.tw/news/society/breakingnews/5207758
3小時狂call80通119！接起來都是「娃娃音」消防大姊姊險抓狂,社會,2025/10/11 15:00,實在是既可愛又令人頭痛！台東縣消防局勤務中心119專線近日傳出亂打報案電話狀況，一名疑似1歲多的小小孩3個小時內打了80通119報案電話。示意圖。（資料照）實在是既可愛又令人頭痛！台東縣消防局勤務中心119專線近日傳出亂打報案電話狀況，一名疑似1歲多的小小孩3個小時內打了80通119報案電話，執勤的大姊姊很有耐心，擔心「可能是大人發生事故」持續溝通，直到後來愈來愈相信小朋友是打來「練習說話」，因此警告他「亂打電話，警察來要抓你囉！」從對話內容來聽，像是「大姊姊哄頑皮小孩」十分可愛，但執勤同仁接了80通這樣電話，心情應該不似外人所想，而是覺得很頭大。台東縣消防局表示，日前晚上8時至11時共接了80通電話，但來電皆未顯示號碼，「其實可以追到手機持有者，但後來也未再來電，而且亂打電話的又是小小孩，因此作罷」。請繼續往下閱讀...來電的小小孩有時未發一語，執勤員因此掛斷，但有時卻是有一搭沒一搭的對話，執勤的大姊姊說了句「喂」，對方也傳來「奶聲」版的「喂」，一聽就知是年紀十分小的小小孩，因此大姊姊再問「有沒有大人？」、「爸爸在旁邊嗎？」、「還是媽媽？阿公阿嬤在旁邊？」，連問數次換來都是奶聲發音無從得知內容，期間也聽得到小小孩怪叫、笑聲。執勤的大姊姊真的是非常有耐心，一直持續溝通、想尋找旁邊是否有大人，同時也擔心大人真的發生事故，小孩才試著求援，許多通電話都是大姊姊在5、6分鐘內不斷試著要他把電話交給大人，或是試圖詢問現場狀況，直到數通電話之後，聽到背景並無大人聲音，小小孩也只是「找人聊天學講話」，這才告誡「警察要來抓你了喔！」。但大姊姊語調實在太溫柔了點，明顯也不想嚇哭小孩，因此嚇阻作用有限，所幸3小時後小小孩即未再來電。消防局表示，執勤的女同仁未婚，沒有帶小孩經驗，相信不會讓她以後不敢生小孩，未來她若有小孩也肯定很有耐心，並強調，依據《消防法》第36條第1項第1款規定：「違反第十八條第二項規定，無故撥打主管機關報案電話，或謊報火警、災害、人命救助、緊急救護情事。」，可處新台幣1萬以上5萬以下罰鍰。但基於為小小孩健康考量，消防局人員私下表示，「都晚上11時了，怎麼會有小孩還沒睡？」、「那麼小的小孩，怎麼可以讓他如此輕易接觸手機等3C產品，這對小孩健康真的很不好」。消防局不是「抓不到人」，而是原諒小孩「想找人聊天」，希望家長能保管好手機以及注意小孩健康。熱門賽事、球星動態不漏接    ,https://news.ltn.com.tw/news/society/breakingnews/5207755
新埔站電扶梯卡鞋4人慘摔1人送醫 北捷公司回應了,社會,2025/10/11 14:47,北捷新埔站今發生電扶梯意外，4人慘摔，1人送醫，北捷提醒旅客這些事。（資料照）新北市捷運新埔站今天（11日）中午發生因旅客鞋子卡入電扶梯，導致造成4人跌倒受傷。台北捷運公司表示，立即請救護車到站，其中1名旅客送醫，另3名旅客表示無須就醫；初步檢查該電扶梯無異常。北捷說明，今中午12點半左右，新埔站大廳往月台電扶梯，因一名旅客鞋子卡於電扶梯，導致電扶梯自趨安全啟動停機，後方2位女性旅客跌倒，波及前方另2位女性旅客。請繼續往下閱讀...北捷表示，站長立刻到現場確認，行控請救護車到站，將其中1位旅客送醫；另3名旅客表示無需就醫，自行離站。經維修人員初步檢查該部電扶梯並無異常，目前持續詳細檢查中。北捷呼籲，旅客搭乘電扶梯時除應「緊握扶手、站穩踏階」外，務必站在踏階中央的「黃色框框」內，不要靠近踏板或側板的縫隙，留意自身安全；如發現電扶梯有其他旅客跌倒或受傷等緊急狀況，可先按壓緊急停機鈕，北捷將立即派員前往處理。熱門賽事、球星動態不漏接    ,https://news.ltn.com.tw/news/society/breakingnews/5207789
偷土地公市價20萬金牌  警2小時人贓俱獲尋回,社會,2025/10/11 14:45,台中呂姓竊嫌，今天凌晨持油壓剪破壞大里一間土地公廟的鐵窗，並偷走4面金牌。（記者陳建志翻攝）金價高漲引發竊嫌覬覦！一名呂姓竊嫌（49歲）今天凌晨4點潛入大里區新潭福德祠，持油壓剪破壞鐵窗後，偷走土地公4面市價約20萬的金牌，呂男得手後躲到大里一家汽車旅館，警方獲報後立刻調閱監視器，鎖定呂男行蹤，不到2個小時就將在汽車旅館呼呼大睡的呂男逮獲，並找回來不及變賣的4面金牌，訊後依竊盜罪嫌移送法辦。台中大里區新和街新潭福德祠，今天凌晨4點左右，一名呂姓竊嫌（49歲）潛入土地公廟，並拿出油壓剪，先破壞土地公廟內的防盜鐵窗，再爬上神桌偷走掛在土地公脖子上的4面金牌。請繼續往下閱讀...直到清晨6點左右，有信徒來燒香拜拜，發現鐵窗遭破壞，土地公的金牌也不翼而飛後，趕緊向警方報案。霧峰分局內新派出所獲報後，立刻組成專案小組，並調閱路口監視器，發現竊嫌騎機車犯案，經持續追緝後，發現呂姓竊嫌（49歲）犯案後逃到大里永隆路一家汽車旅館投宿，約7點多上門將仍在睡夢中的呂嫌逮捕，並找回來不及變賣的4面金牌。呂男落網後表示，因積欠債務才會鋌而走險，一度謊稱金牌已經變賣，不過員警戳破表示時間太短不可能，才坦承原本想等白天才變賣銷贓，沒想到那麼快就被警方查獲，訊後依竊盜罪嫌移送法辦。呂嫌破壞鐵窗爬上神桌後，偷走4面市價約20萬的土地公金牌。（民眾提供）熱門賽事、球星動態不漏接    ,https://news.ltn.com.tw/news/society/breakingnews/5207760
洞洞鞋卡住惹禍？ 捷運板橋新埔站電扶梯突故障4人摔成一團,社會,2025/10/11 14:30,捷運板橋新埔站電扶梯疑因塑膠鞋夾入接縫處意外，導致4人受傷（民眾提供）台北捷運板橋新埔站5號出口有民眾11日中午搭乘手扶電梯時，疑因民眾所穿的塑膠鞋卡入電梯下方接縫處，導致電梯突然停止，有4位民眾跌倒受傷，捷運公司已經協助傷者送醫，詳細事故原因進一步調查中。新北市消防局今天中午12點33分獲報，板橋區捷運新埔站5號出口發生多人受傷意外，救護人員到場，得知共有4人因電扶梯突然停止跌倒，有2人因傷勢輕微自行離去，76歲陳姓婦人因手部骨折送衛生福利部立台北醫院；25歲梁姓女子左腿擦傷，現場包紮治療後離去。請繼續往下閱讀...台北捷運公司表示，11日中午12時30分左右，新埔站大廳往月台電扶梯，因一名旅客鞋子卡於電扶梯，導致電扶梯自行啟動安全停機，致使後方2位女性旅客跌倒，波及前方另2位女性旅客，站長立刻到現場確認，召請救護車到站，將其中1位旅客送醫，另3名旅客表示無需就醫，自行離站，後經維修人員初步檢查該部電扶梯並無異常，目前持續詳細檢查中。北捷呼籲旅客搭乘電扶梯時除應「緊握扶手、站穩踏階」外，務必站在踏階中央的「黃色框框」內，不要靠近踏板或側板的縫隙，留意自身安全；如發現電扶梯有其他旅客跌倒或受傷等緊急狀況時，可先按壓緊急停機鈕，捷運公司會立即派員前往處理。捷運板橋新埔站疑因民眾膠鞋夾入電梯接縫處，導致4人受傷。（民眾提供）熱門賽事、球星動態不漏接    ,https://news.ltn.com.tw/news/society/breakingnews/5207782
遛狗未繫繩惹禍 機車騎士急煞倒地受傷,社會,2025/10/11 14:24,詹姓婦人遛狗未繫繩，造成機車騎士急煞車受傷。（警方提供）龜山一位詹姓婦人於9日深夜在龜山區光榮路遛狗，由於狗未繫繩突然衝出馬路，導致光榮路直行的劉姓騎士（男、18歲）緊急煞車致人車倒地，警、消獲報後到場處理，劉姓機車騎士男並未喝酒，身上有多處擦傷，所幸無生命危險，詹姓婦人對於遛狗未繫繩深感抱歉，雙方也就造成傷害部分進行和解。警方表示，詹姓婦女身為狗的主人，對於狗亂衝造成傷害要負連帶責任，由於傷害罪屬告訴乃論，警方配合兩造態度進行後續處理。熱門賽事、球星動態不漏接    ,https://news.ltn.com.tw/news/society/breakingnews/5207746
真的犁田了！ 駕駛恍神衝進田中 2人僅輕傷,社會,2025/10/11 14:24,杜男疑似恍神不慎將車開進田中翻車。（警方提供）屏東縣恆春鎮昨天發生一起離奇車禍，在恆春鎮仁保路駕駛恍神不慎開進田裡，所幸駕駛杜男及乘客葛姓女子皆無大礙僅輕傷，警方呼籲精神不濟勿勉強上路。恆春分局員警昨天下午4時25分獲報，指在恆春鎮與車城鄉交界的仁保路段發生交通事故，經警方到達現場查看，係22歲的杜姓男子駕駛自小客車因恍神且對路況不熟，致小客車衝進田裡翻車，他與22歲的乘客葛姓女子手部遭玻璃輕微劃傷，後續至恆春基督教醫院診治包紮。請繼續往下閱讀...恆春仁保路為恆春往返車城保力村的支道，該路段是雖然筆直，但因為非省道，大多外地人若要北返大多因路況不熟不會使用這個路段，多為在地人利用避開省道車潮的小路，並在經過保力村、統埔村、田中村及海口村後返回省道台1線再北上。恆春分局表示，經對杜姓駕駛實施酒精濃度檢測，酒測值為0，呼籲駕駛應保持專注，若精神不濟應及時休息，以免發生意外。熱門賽事、球星動態不漏接    ,https://news.ltn.com.tw/news/society/breakingnews/5207763
IG狂曬恩愛成鐵證 酒店妹勾人夫半年篡位落空還要賠錢,社會,2025/10/11 14:22,在酒店上班的女子，結識多金已婚人夫，露骨腥膻對話、及親密自拍，在兩人手機對話紀錄、IG之限時動態中毫無保留。（情境照）高雄市在酒店上班的林姓女子，結識多金已婚人夫，兩人關係快速升溫，露骨腥膻對話及自拍照，在兩人手機對話紀錄、IG之限時動態中毫無保留，林女還意圖篡位逼人夫離婚，均被元配陳女掌握，向法院提告侵權求償，一審法院判林女賠償40萬元，林女上訴二審，法官審酌兩人實際交往不到半年，改判賠20萬元定讞。人妻陳女主張，與丈夫8年婚姻，育有3名未成年子女，去年6月間赫然發現老公手機與林女之親密對話，還在林女的IG曬出兩人交往、親吻的恩愛照。對林女提告請求賠償精神慰撫金80萬元。請繼續往下閱讀...人妻發現兩人對話腥羶露骨：「都快在一起半年了」、「其實主要想做愛」、「忍耐一下回來再做」、「晚安愛你（親嘴圖案）」、「老公晚安愛你（親吻圖案）」、「你啊下面很誠實等到變沙漠就很慘了！」林女還逼迫人夫與元配離婚意圖篡位：「我老話一句眼前的事情能趕快處理趕快處理吧，一直這樣說真的不是辦法，成年人沒有兩個都要，我給你時間但真的不保證有多久，你拖個2-3年我算什麼？」其個人IG上發布其與人夫的接吻照，在貼文內書寫「你說過你是我的山永遠在我身後讓我靠……讓我從跟你在一起到現在從來沒有煩惱。」橋頭地院一審認定其2人之交往行為，顯已逾越普通朋友分際，依社會通念，顯已違反倫理規範，判林女賠償原告40萬元，林女上訴，高等法院高雄分院則以兩人交往不到半年，改判賠償金為20萬元，全案確定。熱門賽事、球星動態不漏接    ,https://news.ltn.com.tw/news/society/breakingnews/5207745
獨家》被警聞有K毒味拒驗尿能免罰？ 警方扣車後急撤單,社會,2025/10/11 14:17,警方聞到蔡男身上有K毒味要求驗尿遭拒，開出毒駕拒測罰單並扣車，但警二分局認定程序不合，決定撤銷罰單並歸還車輛，強調執法須依法且兼顧人權。（民眾提供）酒駕拒測可以扣車，但當警方懷疑有人吸毒開車又拒測呢？警員聞到蔡姓酒店少爺身上有K毒氣味卻未查到毒品，要求蔡男驗尿遭拒後，開拒測罰單並扣車，但警二分局討論後認定程序不合，今天已撤銷罰單，將歸還車輛。事件發生這個月初，警二分局民權派出所警員巡邏時發現蔡男在車旁抽菸等女友，且身上又散發K他命氣味，懷疑他毒駕，但蔡男拒絕警方搜索，當支援警力到達，他仍與警員爭論，自己沒吸毒，車子停在停車格內，憑什麼搜索？後來，警員要求蔡男回警所驗尿初篩，以證明自己沒有吸毒，仍被蔡男拒絕。請繼續往下閱讀...依道路交通管理處罰條例第35條規定，無論酒駕或毒駕拒測，都可處18萬元罰鍰，並當場移置保管車輛並吊銷駕照，警員查看開單系統，也有毒駕拒測的罰單選項，因此開出罰單並扣車。警方在取締酒駕實務上，如果聞到駕駛人有酒味，可用俗稱「酒測指揮棒」的初篩儀器檢測，確認有酒精反應後，再進行正式酒測，但毒品的初篩，必須要用尿液，如果駕駛人拒絕驗尿，警方不但可以開罰，也能請檢察官開強制採驗單驗尿，前提是要有相當證據。警二分局舉例說明，例如蔡男被懷疑吸食K毒，K毒在5公克下是行政罰、超過5公克是刑罰，在沒有涉及刑法的前提下，檢察官也無法開強採單，目前也沒有其他毒品的初篩設備，如果只依嗅覺要求驗尿，恐侵害民眾權益。警方指出，蔡男的案例有些爭議，在經過內部討論後，決定撤銷罰單，並歸還車輛，也提醒員警如果未來要開毒品拒測罰單，應該要有確切證據並依法行政，否則以後在路上聞到民眾身上味道怪怪的，就要求對方到警所採尿，一旦被拒絕就開拒測單、扣車，可能會引發爭議與訴訟，二分局將加強教育訓練，確保執法合法且兼顧人權。熱門賽事、球星動態不漏接    ,https://news.ltn.com.tw/news/society/breakingnews/5207742
埔里國慶日轎車擦撞重機釀1死 驚悚畫面曝,社會,2025/10/11 14:13,南投埔里鎮國慶日發生死亡車禍，56歲戴姓男子傷重送醫不治。（警方提供）南投埔里鎮國慶日發生死亡車禍！56歲戴姓男子10下午1時57分許，駕駛白色轎車經埔里鎮中山路時，疑擦撞同方向行駛的1輛大型重型機車後失控，在原地打轉後再撞及道路護欄，戴男身受重傷，送醫不治，58歲的重機駕駛蔡姓男子及58歲及同年齡范姓女乘客幸未受傷，警方正深入調查事故發生原因。警方調查，戴姓男子10下午1時57分許，駕駛白色轎行經埔里鎮中山路1家甕缸雞店門口時，疑由後擦撞同方向行駛、由蔡姓男子駕駛的大型重型機車，車輛隨即失控，在原地打轉後撞上路邊護欄，由於撞擊力道相當大，車頭嚴重受損，輪胎等零件脫落四散，戴男身受重傷受困車內。請繼續往下閱讀...南投消防局獲報，調派消防人員前往救援，將受困車內的戴男救出，現場施予CPR後送醫急救仍傷重不治，重機駕駛蔡姓男子及後座范姓女乘客均幸未受傷。警方表示，目前正深入調查事故發生原因，惟十次車禍九次快，尤其國慶連假期間出遊民眾多，籲請駕駛人務必遵守交通規則並減速慢行，維護自身及其他用路人安全，避免釀成重大傷亡交通事故。56歲戴姓男子駕駛轎車撞及路邊護欄受困車內，送醫急救不治。（警方提供）熱門賽事、球星動態不漏接    ,https://news.ltn.com.tw/news/society/breakingnews/5207743
可惡！台南學甲又見災區修屋詐騙嫌犯抓到了,社會,2025/10/11 14:09,丹娜絲災後民宅受損，至今仍在修繕。圖與新聞事件無關。（資料照，記者楊金城攝）台南學甲又傳丹娜絲災屋修繕的詐騙案，災民受災又被騙，痛罵犯嫌太可惡，學甲警分局不敢懈怠，不到10天偵辦，昨天在關廟區逮捕35歲林姓通緝犯，警方受理北門區2位、學甲區1位受害人被騙3到40多萬元，清查北門區還有1位災民受騙，今天（11日）依詐欺罪嫌將林男移送檢方歸案。丹娜絲颱風在7月6日造成台南數以萬計的民宅屋頂、圍牆及鐵皮建物受損，因缺工缺料等因素導致災戶修繕困難，學甲陳姓災戶在7月中遭周姓犯嫌冒充包商騙走19萬元，周男被學甲分局逮捕，不料8月中到9月，又接獲有不肖業者趁機以「快速修繕」、「災後優惠施工」等名義行騙，導致災民受騙。請繼續往下閱讀...林姓犯嫌涉嫌洗錢防制法被通緝在案，長期以鐵皮搭建名義招攬生意，他趁丹娜絲風災向北門、學甲區3位被害人收取工程頭期款後，未依約履行施工，甚至避不見面，導致災屋至今仍未修繕。受害的北門文山里、錦湖里災戶，都受到林男詐騙，他收走頭期款，再以缺料待修，拖延施工，被害人在9月中旬報案，控告林嫌詐欺。學甲警方依據工程合約書，鎖定林嫌涉案，追查多日後，昨天將他逮捕到案；分局長巫建德說，災後，詐騙集團及不肖業者常利用民眾急於修復屋損之心態，以低價、限時優惠等手法行騙，呼籲民眾尋找修繕工程時，可善用政府媒合的營造商或查找具有合法登記之公司施工，並應簽訂正式合約明確載明施工內容、付款條件與履約日期，且留意切勿未完工即支付大筆款項，以避免受騙。林嫌（右二）被災戶控告收錢後拖延施工修繕災屋，涉嫌詐欺。（學甲警分局提供）熱門賽事、球星動態不漏接    ,https://news.ltn.com.tw/news/society/breakingnews/5207733
桃園莊敬大池中午發現男浮屍 警方正釐清身分、死因,社會,2025/10/11 13:34,警消人員前往莊敬大池，將溺斃男子屍體撈起。（消防局提供）有民眾於今中午11點48分左右，行經桃園區莊敬大池時，發現有人浮在水面上立刻報警，警消人員到場將人救起，發現是一名男性，已經明顯死亡多時，旁邊還有一輛機車，研判是該男子生前所騎乘，警方正循線追查，並釐清該男子身分及死亡原因。警消人員前往莊敬大池，將溺斃男子屍體撈起。（消防局提供）警消人員前往莊敬大池，將溺斃男子屍體撈起。（消防局提供）熱門賽事、球星動態不漏接    ,https://news.ltn.com.tw/news/society/breakingnews/5207722
