Title,News_Type,date,content,url
使館建案換投資？ 英相訪中仍待確認,國際,2026/01/22 05:30,在英國政府批准中國在倫敦市中心興建新大使館後，英國與中國計畫在首相施凱爾（左）訪問北京期間，重啟被稱為「黃金時代」的經貿對話。右為中國國家主席習近平。（路透檔案照）在英國政府批准中國在倫敦市中心興建「超級大使館」後，路透廿一日引述三名熟悉相關安排的人士報導，英國與中國計畫在首相施凱爾（Keir Starmer）下週預定訪問北京期間，重啟被稱為「黃金時代」（golden era）的經貿對話，預料雙方的多名重量級企業高層將參與其中。包括製藥大廠阿斯特捷利康（AstraZeneca）、英國石油公司（BP）、匯豐銀行（HSBC）、洲際酒店集團（IHG）、捷豹荒原路華（Jaguar Land Rover）、勞斯萊斯（Rolls-Royce）、施羅德投資集團（Schroders），以及渣打銀行（Standard Chartered）等英國企業，將加入重整後的「中英企業家委員會」（UK-China CEO Council）。請繼續往下閱讀...該委員會最早於二〇一八年由時任英國首相梅伊（Theresa May）與中國國務院總理李克強共同構想成立，當時雙方將彼此關係形容為「黃金時代」。企業代表出席名單未敲定消息人士指出，中方企業代表預料將包括中國銀行、中國建設銀行、中國移動、中國工商銀行、中國中車（CRRC）、中國醫藥集團，以及比亞迪等。相關協商已進行一段時間，但消息人士表示，由於施凱爾此行在很大程度上取決於英國政府廿日批准中國在倫敦興建歐洲最大使館的決定，相關的談判一直到近期才真正開始加速推進。施凱爾訪中行程可能生變所有消息來源都一致警告，美國總統川普近期揚言要取得丹麥自治領土格陵蘭，可能使施凱爾的訪中行程生變；而由於使館建案核准決定才剛出爐，訪問的其他安排仍在最後確認階段。消息人士表示，英方最快可能在廿三日對外說明施凱爾的訪中行程與相關安排。目前無法確認哪些企業執行長將會出席。施凱爾此行將是自二〇一八年以來，英國領袖首次訪問中國，試圖在歷經多屆保守黨政府後，重新調整與中國的關係。此前，英國已從北京在歐洲最堅定的支持者之一，轉變為最強烈的批評者之一。但在工黨執政後，施凱爾在去年的一場演說中，指責歷屆保守黨政府在對中關係上「失職」，強調法國總統馬克宏自二〇一八年以來已兩度訪中，德國領袖更四次訪中。    ,https://news.ltn.com.tw/news/world/paper/1740866
川普回任1年 狂秀365成就,國際,2026/01/22 05:30,美國總統川普20日現身白宮新聞簡報會，回顧他在就任1年來的各種豐功偉業，包括拉到台積電等大企業赴美投資，宣稱就連上帝也會為他的成就感到驕傲。（法新社）記者會細數政績 包括拉到台積電等大投資美國總統川普在他重返白宮二度執政滿一週年的廿日現身白宮新聞簡報會，回顧他在過去三六五天的各種豐功偉業，包括為美國拉到台積電等大企業赴美投資，宣稱就連上帝也會為他的成就感到驕傲；但川普也不忘抱怨自己未獲應有肯定、再次辱罵政敵，以及繼續散播包括他在二〇二〇年美國總統大選中並未敗選等的各種謬論。獨白近100分鐘 宣稱上帝會為他驕傲川普在接受記者提問前先獨白近一百分鐘，在媒體面前揮舞著一個臚列他自去年一月廿日以來所達成的三六五項成就的檔案夾，宣稱「上帝會對我所做的工作感到驕傲」。但川普在這場執政一週年成果展的一開始，卻是秀出多張據稱是在明尼蘇達州被移民官員逮捕的人的照片，除了證明他落實打擊非法移民的競選承諾，也不排除有回嗆刻正與移民當局對峙的明州之意。明州明尼阿波利斯市日前有民眾遭移民官員擊斃，引發當地眾怒與街頭抗議。請繼續往下閱讀...此外，從經濟成長、邊境安全、降低通膨、簽署貿易協議降低美國商品出口障礙、企業承諾擴大對美投資、美軍逮捕委內瑞拉前領導人馬杜羅，到空襲伊朗核設施，川普在記者會上細數他在過去一年的政績，還點名包括蘋果、輝達、台積電、日本軟銀、美光等多家美國國內外大企業已承諾擴大投資，及回鍋白宮後發動的關稅戰，有助於強化美國國安與增加稅收。抱怨未能獲得更多肯定 怪罪假新聞儘管民調支持率不佳，川普自認表現優異，召開這場記者會的原因之一，就是他上台一年來把原本一團糟的美國變好，宣稱美國是當今世上最火熱的國家；川普也抱怨未能獲得更多肯定，認為原因可能是他的公關人員做得不好，沒能把他的豐功偉業傳達出去，以及怪罪「假新聞」。川普也重提若干早就被駁斥的謬論，像是他在二〇二〇年大選中並未落敗而是被「搞掉的」，以及他促成處方藥價下降六〇〇％（這在數學上是不可能的），以及美國吸引十八兆美元的外國投資。外交事務方面，川普表示有意就委內瑞拉的未來與該國反對派領袖馬查多合作、大讚馬查多把諾貝爾和平獎獎章送給他，以及再次抱怨挪威諾貝爾委員會。川普演說中一度問記者是否會覺得無聊；該記者會與其說是川普回顧過去一年的勝利繞場，不如說是他再次發表勝選演說。國會參議院少數黨民主黨領袖舒默痛批，川普「只會愈來愈瘋狂與不受歡迎」。    ,https://news.ltn.com.tw/news/world/paper/1740860
川普：不會動武拿下格陵蘭,國際,2026/01/22 05:30,美國總統川普多次強調取得格陵蘭的決心，格陵蘭總理尼爾森廿日呼籲該島民眾，為可能的軍事入侵做好準備。歐盟領袖同日也矢言，會「堅定不移」回應華府在格陵蘭問題上的威脅。（法新社）美國總統川普廿一日在達沃斯世界經濟論壇上發表了迄今最明確的排除動武聲明，表示「不會以武力手段取得格陵蘭」。他強調：「這大概是我做過最重要的聲明，因為人們以為我會動用武力。我不必、不想，也不會動用武力。」但他仍重申美國希望完整取得格陵蘭的主權與所有權，並解釋「因為你需要所有權才能防衛它，不能靠租借來防衛」。川普呼籲與歐洲盟友展開「立即談判」，商討美國可能收購格陵蘭的事宜，並主張只有美國能保護格陵蘭，由美國控制格陵蘭將增強北約的整體安全，而非構成威脅。請繼續往下閱讀...格陵蘭總理尼爾森廿日呼籲該島民眾，為可能的軍事入侵做好準備。歐盟領袖同日也矢言，會「堅定不移」回應華府在格陵蘭問題上的威脅。防軍事入侵 格陵蘭發新版指南尼爾森表示，儘管軍事入侵「依然是一個不太可能的情境」，但「不能排除」，政府將成立由所有地方政府代表組成的任務小組，協助民眾準備因應日常生活受到的擾亂。格陵蘭政府也將發放新版指南，建議民眾家中儲存足供五天的糧食。他強調：「我們必須為所有可能性做好準備，格陵蘭是北大西洋公約組織的成員，如果情勢升高，也會對世界其他地方造成後果。」前英國國防部武官佛爾曼指出，這是正在分裂北美和歐洲的緊急狀況，俄羅斯必定在坐看好戲。不過，若川普真的拿下格陵蘭控制權，將使已大舉投資北極的俄羅斯的竊喜落空。    ,https://news.ltn.com.tw/news/world/paper/1740862
停機近14年 日新潟核電廠最快下月商轉,國際,2026/01/22 05:30,圖為反核人士19日在東京電力公司總部前抗議「柏崎刈羽核電廠」重啟。（圖法新社檔案照）位於日本新潟縣的「柏崎刈羽核電廠」6號機組21日晚間正式重啟，廠方逐步拔出抑制爐心核分裂反應的控制棒，在確認反應穩定持續、達到所謂「臨界」狀態後，將進入正式發電的準備階段，預計本月27日起開始試驗性送電。該機組在福島核災後，於2012年3月起長期停機，這是時隔13年又10個月以來重新運轉，也是東京電力公司旗下首次重啟核電機組，若作業進展順利，預計將於2月26日轉入商業運轉。圖為反核人士19日在東京電力公司總部前抗議「柏崎刈羽核電廠」重啟。（駐日特派員林翠儀）    ,https://news.ltn.com.tw/news/world/paper/1740863
為抗美而親中 華郵：加拿大「終將後悔」,國際,2026/01/22 05:30,加拿大總理卡尼（左）16日在北京人民大會堂，會晤中國國家主席習近平（右）。（路透檔案照）加拿大總理卡尼（Mark Carney）十四日至十七日訪問中國，在與中國國家主席習近平等高層官員會面後，聲稱將推進加中「新型戰略夥伴關係」。華盛頓郵報廿日發表社論指出，由於美國總統川普的霸道行徑，加拿大向中國靠攏並不令人意外，但渥太華此舉顯得目光短淺，與北京交好終將後悔。社論說，川普一直表現得不像個好鄰居，揚言考慮將加拿大變成美國第五十一州，而且不惜動武也要取得格陵蘭的恫嚇言論，可能顛覆北大西洋公約組織（NATO），也讓加拿大極為不安，因此卡尼才會在訪問中國時，說出中國是比美國「更可預測」的夥伴這種言論。請繼續往下閱讀...卡尼是二〇一七年以來首位訪問中國的加拿大總理，此次訪問獲得習近平、國務院總理李強、全國人大常委會委員長趙樂際等高層隆重接待。雙方聯合聲明強調，將重啓兩國經濟財金戰略對話、加強經貿夥伴關係等。美才是加拿大最大貿易夥伴社論指出，川普掀起的關稅狂潮，迫使貿易夥伴另覓出路，這是可以預期的，尤其是在川普也希望與習近平達成協議的情況下，無論美國是否同意，全球貿易都會持續進行。卡尼宣布與習近平達成協議時指出，中國是加拿大第二大貿易夥伴與第三大投資國，卻隻字未提美國才是加拿大最大的貿易夥伴與投資國。社論指出，「務實」與「天真」之間僅有一線之隔，卡尼已開始模糊這條界線。卡尼與習近平不僅就新的貿易條件達成協議，還上演一場政治秀，但對一位美國總統的不滿，無需轉而迎合獨裁者的主張。卡尼聲稱，他與習近平討論格陵蘭情勢與北極議題，以及格陵蘭與丹麥人民的主權問題…「我發現我們在這方面的看法有許多共通之處」。但其實北約內部早有共識，即北極地區必須防範中國與俄羅斯的影響，渥太華與北京在北極地緣戰略上立場一致的說法，若非極不真誠，就是令人憂心地天真。華爾街日報則指出，加中關係回溫，僅止於戰術性「解凍」，兩國的「戰略夥伴關係」實際上高度設防，並非全方位合作，而是將實際合作壓縮到少數幾個受到嚴格管控的貿易領域，因此不應將結果視為習近平的完勝。    ,https://news.ltn.com.tw/news/world/paper/1740867
自民黨選舉公約 重現「台海安全」,國際,2026/01/22 05:30,在首相高市早苗（中）主導下，日本自民黨的眾議院大選選舉公約，再次明記「台灣海峽和平穩定的重要性」。左為自民黨幹事長鈴木俊一，右為自民黨副總裁麻生太郎。（法新社）日本自民黨廿一日公布眾議院大選的選舉公約，再次明記「台灣海峽和平穩定的重要性」。自民黨在二〇二一年的選舉公約上，首次納入台海安全重要性，但在二四年的選舉公約中消失，這次在高市早苗領軍下再次復活。外交政見明記「台海和平穩定重要性」自民黨政調會長小林鷹之傍晚正式發表自民黨眾院選舉公約，以「讓日本列島更加強大、更加富裕」為主題，除了備受關注的財政經濟等政見之外，在外交及安保政見上，包括提前修訂安保三文件、徹底強化國家的情報蒐集與分析功能、設立對外情報機構等也是重點。在外交方面，主張「透過開放性的對話，致力於與中國建立建設性且穩定的關係」，同時明記「台灣海峽的和平與穩定至關重要」。請繼續往下閱讀...高市早苗領軍拚眾院大選 二〇二一年十月岸田文雄政府時期的眾院大選，高市當時為自民黨政調會長，自民黨在她主導下首次將「台灣海峽和平穩定重要性，敦促兩岸問題和平解決」納入眾院選舉公約。公約還明記「歡迎台灣申請加入跨太平洋夥伴全面進步協定（TPP），並支持台灣以觀察員身分參與世界衛生大會（WHA）」。自民黨將台海安全重要性納入公約的背景，主要是當年四月時任首相菅義偉與美國總統拜登，在華府舉行領袖會談時，首次在雙方的聯合聲明中提到此事，這是日美領袖在睽違半世紀後，首次在正式會談中提到台海。也因為日美登高一呼，在接下來包括「七大工業國集團」（G7）峰會等重要國際場合，強調台海和平穩定的重要性成為潮流，二〇二三年在廣島舉行的G7峰會，更進一步強調台海安全「對國際社會的安全與繁榮不可或缺」。二〇二四年石破茂當選自民黨總裁後，高市和挺台的安倍派勢力，淪為自民黨的非主流派，石破本人雖然與台灣關係良好，但黨內親中勢力抬頭，當年眾院大選時，自民黨提出的選舉公約中，關於「台灣海峽和平穩定重要性」的文字遭到刪除，也未見歡迎台灣申請加入TPP和支持台灣以觀察員身分參與世衛的文字，僅保守地聲明「將繼續推動與台灣之間各層次的實務合作」。自民黨內台派勢力復活去年高市當選自民黨總裁，自民黨內親台派勢力復活，而且受到重用。高市去年在國會答詢時提及「台灣有事可能構成日本存亡危機事態」，引發中國強烈反彈，要求她撤回發言，但高市在承受中國施加的各種壓力下，不但未撤回發言，而且在重要的選舉公約中重申台海安全重要性。    ,https://news.ltn.com.tw/news/world/paper/1740864
槍殺安倍晉三 凶手判無期徒刑,國際,2026/01/22 05:30,日本奈良地方法院21日依照檢方求刑，對殺害前首相安倍晉三的山上徹也宣判無期徒刑。（路透檔案照）二〇二二年日本前首相安倍晉三遭槍擊身亡一案，奈良地方法院廿一日在國民參與審判（陪審制）判決中，由審判長田中伸一依照檢方求刑，對四十五歲的被告山上徹也宣判無期徒刑。山上的辯護律師表示，將會研究是否上訴。田中在宣判時指出，犯行的決斷是被告依本人的意志決定，予以嚴懲是恰當的。對於犯案動機，田中認為，無法認定被告的成長背景對犯行產生影響，並強調「被害者本身毫無任何過失」。請繼續往下閱讀...安倍遺孀安倍昭惠廿一日也透過代理律師發表聲明，希望被告能夠正視自己犯下的罪行，切實地付出應有的代價。她也強調，今後將繼續向前，承繼夫婿的遺志，珍惜每一天、踏實地生活下去。安倍昭惠在聲明中表示，隨著奈良地方法院做出判決，她感覺從丈夫突然離世以來的漫長日子，終於劃下階段性的句點。山上的辯護律師在宣判後召開記者會，說明判決後會見山上的情況，指山上看來並沒有特別不同，與平時沒有太大差異。辯護律師指出，判決承認統一教會對被告家庭造成影響屬於遠因，但接受檢方「該影響並未與犯行形成直接因果關係」的主張。辯方將與被告協商，研究是否提出上訴。山上於二〇二二年七月八日中午，在奈良市近鐵大和西大寺站前，使用自製槍枝射殺正在為參議院選舉進行助選演說的安倍，導致其死亡。山上被依殺人罪、違反「刀槍法」等罪名起訴，經陪審員參與的庭審之後，檢方在上月求處無期徒刑。檢辯雙方對於殺人等主要起訴事實，並無爭議，最大焦點在於量刑。辯方主張，最重也應限制在有期徒刑廿年內。一般認為，影響量刑判斷的關鍵，是被告成長背景是否與案件具有直接關聯性，亦即被告是否因遭到舊統一教會所左右、操弄的人生經歷，最終導致本案的發生。成長背景不足以大減刑責檢方指出，被告的動機具有強烈的自我中心性，成長背景對被告犯案決策的影響極為有限，並不足以大幅減輕刑責。此外，檢方指出本案「在戰後歷史上前所未見，造成極其嚴重的結果與深遠的社會影響」。    ,https://news.ltn.com.tw/news/world/paper/1740868
拒絕中國大使館 英居民集資打官司,國際,2026/01/22 05:30,英國政府批准中國在倫敦新建「超級大使館」，引發使館預定地皇家鑄幣廠舊址周邊居民和外界批評聲浪，將提出司法審查，推翻政府的決定。圖為維吾爾族團體20日在英國國會外抗議。（路透）英國政府廿日批准中國在倫敦新建「超級大使館」興建案，引發使館預定地皇家鑄幣廠舊址周邊居民和外界批評聲浪，居民在網路上發起的小額募款，募得的金額也在政府拍板後迅速大幅升高，助居民提出司法審查，推翻政府的決定。小額募款衝至七六一萬餘這項以「皇家鑄幣廠居民協會」名義發起的募款，去年六月展開，目標是十四萬五千英鎊，過去幾週金額一直未能突破三萬五千英鎊，但是在英國政府批准使館案後，廿四小時內湧入大量捐款，到廿一日晚間為止，已經獲得約四千五百筆、累計逾十七萬三五〇〇英鎊（約七六一萬台幣）捐款。請繼續往下閱讀...募款說明一開頭就表示，是要「挑戰中共」，指該預定地二〇一八年被祕密賣給中國政府，居民不僅事先未獲通知、諮詢，也無從置喙，「如今更面對一個敵對政權的威脅」。居民表示，「政府並未聆聽我們的訴求，現在我們只有訴諸法庭」。居民希望司法審查行政機關在行使公權力過程中有無違反、程序不公等情況，以及政府是否早已「內定」批准。居民聲明指出，此事不僅關乎當地社區，也影響流亡港人、維吾爾人、西藏人、台灣人及中國異議人士。他們恐懼在英國土地上再公開抗議，擔心遭到以恐嚇異議人士聞名的政權持續監控與恫嚇。居民強調，此案涉及保護英國公民免於國家權力侵害，捍衛民主、抵抗外國影響，挑戰秘密交易凌駕人民之上，呼籲全球民眾「為民主發聲，唇亡齒寒」。代表當地一百戶社區發起募款的六十五歲居民奈格特接受英國廣播公司訪問時，以「人身安全、安全保障、隱私權」三字概括憂慮。他指出，自中國買下鑄幣廠舊址後，他與兩百名鄰居展開「大衛與哥利亞之戰」，對抗財力龐大的中國。他的公寓距離大使館職員宿舍預定區僅數公尺，擔心居民被視為安全威脅，日常一舉一動遭監視器掌控，甚至「最糟情況是終將被要求搬離」。現居倫敦、任「對中政策跨國議會聯盟」（IPAC）高級分析師的香港民主運動人士鄺頌晴，在政府決定前夕參加十八日反使館示威。她表示，使館計畫危及港人與中國異議人士安全，大使館規模愈大，「壓迫與間諜活動」愈多。部分重新安頓於英國的異議人士甚至曾遭懸賞捉拿，被威脅送入使館換取賞金。她直言這些情況令他們感到「非常非常可怕」。    ,https://news.ltn.com.tw/news/world/paper/1740865
南韓戒嚴「幫凶」 前總理韓悳洙被判23年,國際,2026/01/22 05:30,南韓前國務總理韓悳洙21日因協助並教唆宣布戒嚴，被判處23年有期徒刑。（法新社）南韓前國務總理韓悳洙21日因協助並教唆宣布戒嚴，導致短暫中止民選政府、國家陷入混亂，被判處23年有期徒刑，重於負責調查內亂叛國案的獨立檢察組（獨檢組）提出的15年量刑建議，並以有毀滅證據之虞為由當庭逮捕，立即入獄，成為南韓憲政史上的首例。首爾中央地方法院認為，前總統尹錫悅在2024年12月3日深夜宣布緊急戒嚴，並據此發佈違法命令、動員軍警封鎖國會等，均屬內亂行為，而韓悳洙身為總理，儘管曾向尹錫悅表達關切，卻未「明確反對」或敦促其他內閣成員勸阻尹錫悅，「至少在形式上確保流程合法性，因而在尹錫悅等人發動叛亂的行為中扮演重要角色」。（法新社）    ,https://news.ltn.com.tw/news/world/paper/1740869
"中英對照讀新聞》Sea life thriving on unexploded Nazi bombs, sub discovers潛艇發現海洋生物在未爆炸的納粹炸彈上頭生機勃勃",國際,2026/01/22 05:30,"德國一處海底的納粹時代未爆彈，已成為海洋生物的棲息地。（法新社檔案照）◎孫宇青Marine life is thriving on unexploded Nazi bombs sitting at the bottom of a German bay, a submersible has discovered, even capturing footage of starfishes creeping across a huge chunk of TNT.一艘潛艇在德國一處海灣底部發現未爆炸的納粹炸彈，海洋生物在上頭生機勃勃，甚至還拍到海星爬過一大塊TNT炸藥的畫面。請繼續往下閱讀...The discovery was ""one of those rare but remarkable eureka moments,"" marine biologist Andrey Vedenin told AFP.海洋生物學家安德烈．韋德寧告訴《法新社》，這項發現堪稱「罕見卻非凡的大揭密之一」。The waters off Germany’s coast are estimated to be littered with 1.6 million tons of unexploded munitions left behind from both world wars.據估計，德國近海海域散佈著兩次世界大戰遺留的160萬噸未爆彈。In October of 2024, a team of German scientists went to a previously uncharted dump site in the Baltic Sea’s Luebeck Bay and sent an unmanned submersible 20 metres down to the seafloor.2024年10月，一群德國科學家前往波羅的海呂貝克灣一個先前未知的垃圾棄置海域，並將一艘無人潛艇送入20公尺深的海底。They were surprised when footage from the sub revealed 10 Nazi-era cruise missiles. Then they were stunned when they saw animals covering the surface of the bombs.當潛艇拍攝的畫面顯示其中有10枚納粹時代的巡弋飛彈時，他們大吃一驚。當他們看到炸彈表面覆蓋著動物時，更是驚為天人。新聞辭典submersible：名詞或形容詞，潛水器；可在水下使用的。例句：Undersea geologists sent four unmanned submersibles into the deep water.（海底地質學家向深海發射4艘無人潛水器。）chunk：名詞，大塊、厚塊：一大部分。例句：Though he is only five, he can eat a chunk of steak.（雖然他只有5歲，但他可以吃一大塊牛排。）    ",https://news.ltn.com.tw/news/world/paper/1740888
