Title,News_Type,date,content,url
前德國總理梅克爾烏戰言論 引發波海國家與波蘭強烈反彈,國際,2025/10/08 05:33,前德國總理梅克爾暗示，波羅的海國家和波蘭應為俄羅斯入侵烏克蘭承擔部分責任，引發相關國家官員強烈反彈。（法新社檔案照）前德國總理梅克爾（Angela Merkel）日前在受訪時指稱，波羅的海國家與波蘭2021年力阻歐盟主導與俄羅斯談判，之後俄國便入侵烏克蘭，似乎暗示這些國家必須為此承擔部分責任，引發相關國家官員強烈反彈，前拉脫維亞總理卡林斯（Krišjānis Kariņš）更直指，梅克爾對俄國總統普廷的看法過於天真。綜合美國政治新聞媒體Politico和英國「每日電訊報」報導，在匈牙利反對派媒體「游擊隊」（Partizán）新聞網3日刊出的訪談中，梅克爾談及俄軍2022年入侵烏克蘭前夕的情勢時，指出東歐國家拒絕讓她與普廷及法國總統馬克宏（Emmanuel Macron）直接談判。請繼續往下閱讀...梅克爾說：「2021年6月，我感覺普廷已不再認真看待『明斯克協議』。」這份協議是為了解決2014至2015年間烏克蘭頓巴斯地區衝突的和平協議。「因此我希望能有一個新架構，讓我們歐盟能直接與普廷對話。」當月的歐盟理事會會議上，梅克爾與馬克宏提議，在俄軍集結烏克蘭邊境之際進行直接談判，但波蘭等東歐國家聯合反對。她說：「有些國家不支持這項提議，主要是波羅的海國家，但波蘭也反對。」梅克爾指出，這些國家「害怕我們對俄政策會不一致……總之，會談最終並未發生。之後我卸任，普廷的侵略就開始了。」前拉脫維亞總理卡林斯6日指出，當時包括德國與梅克爾本人在內的許多國家，都對俄羅斯瞭解得不夠透徹，「我一直告訴她，不能『善意地』與普廷打交道，但她認為波羅的海國家錯了。我非常清楚梅克爾的看法，但在烏克蘭發生這一切之後，她還是這麼想，讓我感到震驚。」卡林斯說，普廷會按其一貫風格行事，西方只有兩個選擇，不是屈服就是抵抗；梅克爾如今還說出這樣的話，實在令人驚訝，所幸現任德國總理梅爾茲（Friedrich Merz）並不認同她的觀點。愛沙尼亞外交部長薩克納（Margus Tsahkna）則表示，俄羅斯應對這場戰爭承擔所有責任。他在社群平台X貼文指出：「俄羅斯對烏克蘭的戰爭完全源於一件事，就是拒絕接受蘇聯解體，以及根深蒂固的帝國主義野心。這場侵略的責任全在俄羅斯。」梅克爾的言論在波蘭也引發強烈反彈，尤其是右派議員。前波蘭總理、現任反對黨「法律正義黨」（PiS）副黨魁莫拉維茨奇（Mateusz Morawiecki）在X貼文寫道：「梅克爾透過這場欠思慮的訪問，再次證明她是過去1個世紀以來對歐洲最具破壞性的德國政治人物之一。」PiS歐洲議會議員布達（Waldemar Buda）表示：「當梅克爾說她想再次與普廷達成協議，那可能就會導致烏克蘭被瓜分！他們不懂，正是與普廷做生意，才釀成這場戰爭！」隸屬中間派「波蘭2050」的開發基金與區域政策部長、前駐俄國大使佩烏欽斯卡—納文奇（Katarzyna Pełczyńska-Nałęcz）則指出，梅克爾的言論只會助長俄國宣傳，「暗示戰爭爆發的原因是有人沒有及時與俄羅斯坐下談，或是沒向莫斯科俯首稱臣，這太荒謬了。那只會更糟。」Politico指出，他們對這位過去20年來歐洲最具影響力政治人物的批評，再次凸顯外界所指的「梅克爾對俄政策失敗」，也進一步動搖她的政治遺產，其移民與能源政策如今仍遭繼任者抨擊，並陸續廢止。但前波蘭駐美國大使馬基羅斯基（Marek Magierowski）批評媒體曲解梅克爾的話。他認為，梅克爾只是指出波羅的海國家和波蘭不同意歐盟與俄羅斯的新對話架構，若據此推演出「波蘭要為普廷的戰爭承擔部分責任」的意涵，「這也差得太遠」。不過，馬基羅斯基對梅克爾的執政評價仍十分嚴厲，指其政治生涯「對德國與歐洲而言，是一場徹底的災難。」梅克爾辦公室尚未回應置評請求。熱門賽事、球星動態不漏接    ,https://news.ltn.com.tw/news/world/breakingnews/5203764
美允售戰斧 川普促烏提使用計畫,國際,2025/10/08 05:30,戰斧飛彈（法新社檔案照）針對透過北大西洋公約組織（NATO）向烏克蘭供應「戰斧」（Tomahawk）飛彈，美國總統川普六日表示，已大致做出決定，但由於不樂見烏俄戰爭情勢升級，他希望能先知悉烏克蘭的使用計畫。不願戰事升級 想了解「飛彈要射到哪」川普在白宮向媒體表示，自己「可以說已經做出決定」，但他想了解基輔「要把飛彈射到哪裡，我會提出一些問題，我不想看見事態升級。」請繼續往下閱讀...美國網路媒體「Axios」引述烏克蘭官員和政府消息人士報導，基輔並不知道川普的決定為何。不過，近幾週來，川普政府已對美方是否得以在烏克蘭取得飛彈後保有使用上的掌控權表達關切。射程可達二五〇〇公里的戰斧飛彈是烏克蘭亟欲爭取的武器之一，藉此取得深入打擊俄羅斯境內目標，甚至包括首都莫斯科在內的能力，有助於嚇阻俄羅斯總統普廷，進而在談判桌上爭取更有利的條件。烏克蘭總統澤倫斯基在上月聯合國大會期間，向川普提出供應戰斧飛彈要求。他在接受Axios專訪時提到，只要烏克蘭能夠取得這類強大武器，或許不必動用便可迫使普廷和談。普廷五日警告，若沒有美國直接參與，烏克蘭無法使用戰斧飛彈。因此，華府向烏克蘭供應戰斧飛彈，將使局勢進入一個實質的新階段，導致美俄直接對峙，摧毀雙方關係中的任何正面進展。克里姆林宮發言人佩斯科夫七日回應媒體提問時表示，俄方正等待華府就供應戰斧飛彈議題發表明確聲明。他強調，「若省略各種細節，我們在談的是關於具備核打擊能力的飛彈。因此，這對情勢來說將是嚴重升級。」烏擴大打擊俄能源、石油設施與此同時，烏克蘭也擴大打擊俄羅斯的能源、石油基礎設施，做為莫斯科對烏國城市頻繁空襲的回應。繼六日向俄國發射二五一架無人機後，烏軍七日再發動另外一起大型無人機空襲行動，俄方聲稱共攔截二〇九架。俄國媒體披露，烏克蘭無人機襲擊俄國西伯利亞地區的秋門市，當地距離俄烏戰爭前線逾兩千公里，據稱攻擊目標可能是安蒂平斯基（Antipinsky）煉油廠。俄羅斯則在六日至七日向烏克蘭發射一五四架無人機，約半數遭到攔截，其中一架無人機擊中位於蘇米和波塔瓦地區的鐵路和能源設施，導致超過一千人斷電。熱門賽事、球星動態不漏接    ,https://news.ltn.com.tw/news/world/paper/1727208
謠言終結站》吃布洛芬增中風風險？ 錯誤訊息,國際,2025/10/08 05:30,謠言終結站網傳內容：退休醫師良心提醒！60歲後盡量不要吃布洛芬（ibuprofen）、雙氯芬酸（diclofenac）等止痛藥，否則中風風險暴增3倍？查證結果：MyGoPen查證指出，專家強調，不同患者的條件不同，同一患者也有前後病況的差異，不可一概而論，疾病有一定的病程發展過程和所需時間，傳言污名化布洛芬為錯誤訊息。熱門賽事、球星動態不漏接    ,https://news.ltn.com.tw/news/world/paper/1727209
英法美3學者 共享諾貝爾物理獎,國際,2025/10/08 05:30,德沃雷（取自耶魯大學網站）有助開發下一代量子技術二〇二五年諾貝爾物理學獎七日揭曉，由英國學者克拉克（John Clarke）、法國學者德沃雷（Michel Devoret），以及美國學者馬丁尼斯（John Martinis）等三人，以「發現電路中的宏觀量子力學隧道效應和能量量子化」，為開發下一代量子技術提供機遇所做的貢獻，摘下桂冠。這三位都在美國任教的獲獎者，將平分一千一百萬瑞典克朗（約三五六八萬台幣）獎金。瑞典皇家科學院在聲明中指出，物理學領域的重要問題之一，就是能夠展示量子力學效應的系統最大尺寸是多少，而克拉克、德沃雷和馬丁尼斯在晶片上的實驗，成功揭示量子物理學的實際運作，因而獲得殊榮。三人利用一個手持大小的系統進行電路實驗，展示量子力學穿隧效應和量子化能階。請繼續往下閱讀...量子力學允許粒子直接穿過障礙，過程被稱為穿隧效應（tunnelling）。當有足夠大量的粒子參與這個過程，量子力學效應通常會變得不顯著，而獲獎者的實驗證明，量子力學特性可以透過肉眼，在宏觀上具體表現出來。藉宏觀系統重現量子物理現象在一九八四年至八五年間，克拉克、德沃雷和馬丁尼斯利用一個由超導體構成的電子電路，進行一系列實驗。超導體是一種可以在沒有電阻的情況下傳導電流的元件。在電路中，超導體元件被一層薄薄的非導電材料隔開，形成名為「約瑟夫森接面」（Josephson junction）的裝置。實驗透過精準調整和測量電路的各種屬性，能夠控制及探索電流通過時產生的現象。帶電粒子在超導體中移動，共同構成一個系統，其行為如同單一粒子填充整個電路。宏觀的粒子狀系統最初處於電流流動且無電壓狀態，被困在其中的系統彷彿被一道無法跨越的障礙阻擋。然而，三人實驗中的系統透過穿隧展示量子特性，成功逃離零電壓狀態。系統狀態的改變可以透過電壓出現來檢測。三人展示系統的行為符合量子力學的預測，即具有量子化特性，意味它只吸收或釋放特定數量的能量。諾貝爾物理學委員會主席艾瑞克森（Olle Eriksson）讚揚道，在量子力學出現一百年之際，還能有新發現實屬可喜，且三位獲獎者的發現也相當實用，因為量子力學是所有數位技術的基礎。克拉克受訪時表示，榮獲諾獎是他一生中最大的驚喜，「我完全驚呆」（I’m completely stunned），從未想過自己的研究能夠得獎，但這些研究確實與日常生活息息相關，「我正在用手機說話，而手機之所以能發揮作用，根本原因之一就是這些努力」。他也向兩位共同得獎者致敬。馬丁尼斯（美聯社）克拉克（路透）熱門賽事、球星動態不漏接    ,https://news.ltn.com.tw/news/world/paper/1727204
高市早苗新人事 黨內政權輪替,國際,2025/10/08 05:30,自民黨總裁高市早苗發動黨內「政權輪替」，傳「地下司令」稅制調查會長宮澤洋一也將卸任。（法新社檔案照）主流與非流派易位 岸田、石破、森山派、菅集團紛掃地出門日本自民黨七日敲定主要幹部人事，除了原任黨最高顧問的麻生太郎再任副總裁之外，黨魁高市早苗重用競選舉對手小林鷹之擔任政調會長，捲入政治獻金風暴的萩生田光一出任幹事長代行，均受到矚目。從這份名單可以發現，原屬岸田派、石破派、森山派和菅集團的主流派人馬都被掃地出門，就連難以撼動的「地下司令」稅制調查會長宮澤洋一，也傳出將要卸任。高市的新人事，主流與非流派易位，形同黨內的「政權輪替」。請繼續往下閱讀...七日公布的主要黨幹部名單包括：副總裁麻生太郎、幹事長鈴木俊一、總務會長有村治子、政調會長小林鷹之、選對委員長古屋圭司、國對委員長梶山弘志、組織運動本部長新藤義孝、廣報部長鈴木貴子，以及幹事長代行萩生田光一。副總裁麻生將可發揮穩定執政團隊軍心的實質作用，「黨四役」的幹事長鈴木握有未來選舉的提名權，總務會長有村和選對委員長古屋，也都是高市長年戰友。政調會長為黨提出政策把關，小林雖為競爭對手，但在經濟、安保政策和保守理念上與高市相當接近。萩生田光一擔任幹事長代行，可為高市解決與在野黨協調的棘手問題。「地下司令」宮澤洋一傳將卸任除了黨主要幹部之外，稅制調查會長宮澤洋一也傳出將要退任的消息。稅制調查會隸屬政調會之下，但稅調會長的權力相當大，可說是制定日本稅制改革方針、稅制改正大綱的最終決策者。現年七十五歲的宮澤洋一是前首相宮澤喜一的姪子，也是前首相岸田文雄的表哥，出身財務省，被視為財務省在自民黨的「把關者」。高市主張進行稅制改革，但財務省主張財政健全，因此宮澤傳出將要卸任，意味高市很有機會拿下財政稅制主導權，也是高市能否推動大型減稅計畫的關鍵。川普向高市祝賀 日媒︰語氣有溫度另一方面，美國總統川普六日在自家社群平台「真實社群」（Truth Social）貼文，向高市表達祝賀。川普預定本月底訪問日本，美日雙方正協調於廿八日舉行首次「川高會」，外界對於高市的外交處女秀相當關注。日本媒體指出，川普對外國新領袖致賀並不罕見，但他的語氣並非例行公事式的外交辭令，而是帶有個人情感與溫度，顯示兩人或許會合得來。高市七日也在X平台轉貼川普貼文，表示「非常高興收到川普總統熱情的祝賀之詞。我期待能與川普總統共同努力，進一步強化並深化日美同盟，同時推進『自由且開放的印太』（FOIP）理念。」川普預定月底參加在馬來西亞舉行的東南亞國協（ASEAN）峰會，以及南韓慶州的亞太經濟合作會議（APEC）峰會，可能會在廿七日先訪問日本。日本時事通信報導，川普在日停留期間將與天皇德仁會面，視察美軍橫須賀基地，並可能安排與北韓綁架受害者家屬會面。熱門賽事、球星動態不漏接    ,https://news.ltn.com.tw/news/world/paper/1727206
中英對照讀新聞》Sunken WWII Japanese warship found off Solomon Islands 被擊沉的2戰日本軍艦在索羅門群島外海被發現,國際,2025/10/08 05:30,"2戰時期的日本驅逐艦「照月號」殘骸。（法新社）◎ 管淑平An international research team has located a Japanese World War II destroyer on the deep seabed off Solomon Islands.1支國際研究團隊在索羅門群島外海深海海床上，找到一艘2次世界大戰時期的日本驅逐艦殘骸。請繼續往下閱讀...A team from the US non-profit Ocean Exploration Trust discovered the Imperial Japanese Navy destroyer Teruzuki off the small island nation northeast of Australia.美國非營利組織「海洋探勘信託」的團隊，在這個位於澳洲東北方的小島國外海，發現這艘日本帝國海軍驅逐艦「照月號」。A video image of the wreck shows parts of the 134-metre Teruzuki, which was torpedoed by the US military in 1942, illuminated by lights from the research team’s underwater drones.拍攝殘骸的影片畫面顯示，研究團隊的水下無人載具燈光，照亮了134公尺長的照月號部分船體；該艦在1942年遭美軍魚雷擊沉。Teruzuki’s stern was found more than 200 metres from the hull and was located by high-resolution sonar scans, the Ocean Exploration Trust said.照月號船艉殘骸位置，距離船身超過200公尺，是經由高解析度聲納掃描才找到，海洋探勘信託說。The discovery was made while the team used drones to survey the area in the hope of finding unidentified shipwrecks or other items.該團隊是利用無人載具勘測該海域，希望找出未被確認的沉船或其他殘骸時，發現這艘戰艦。新聞辭典locate：動詞，定位；找出某人或物的位置。例句：We used a map to locate the museum.（我們用地圖找出那座博物館的位置。）torpedo：動詞，用魚雷攻擊。例句：The submarine tried to torpedo the enemy ship.（這艘潛艦設法以魚雷攻擊敵艦。）熱門賽事、球星動態不漏接    ",https://news.ltn.com.tw/news/world/paper/1727255
諾貝爾物理獎得主╱馬丁尼斯與台灣密切合作 發展量子電腦,國際,2025/10/08 05:30,諾貝爾物理獎新科得主馬丁尼斯與台灣合作發展量子電腦，圖為馬汀尼斯2023年在中研院擔任講座發表演說。（取自中研院網站）今年諾貝爾物理學獎昨日揭曉，由英國學者克拉克（John Clarke）、法國學者德沃雷（Michel H. Devoret）及美國學者馬丁尼斯（John M. Martinis）獲獎，國內學者分析三人憑藉宏觀系統重現量子物理現象，是發展超導量子電腦的基礎。中研院更透露，馬丁尼斯與台灣密切合作發展量子電腦，彼此保持緊密關係。廖俊智邀請 任中研院量子計畫顧問中研院院長廖俊智透露，馬丁尼斯與台灣關係密切，早在二〇二一年他離開Google公司後，廖俊智就請他擔任中研院量子計畫顧問，幾乎每週與台灣團隊舉行視訊會議，目前中研院發展新的量子位元，主要就是由他提出構想、台灣團隊執行，雙方也共同發表論文，二〇二三年任中研院講座。請繼續往下閱讀...廖俊智形容馬丁尼斯個性非常直爽，講話直接，但也非常理性，常思考如何激發團隊向心力。副院長周美吟則表示，馬丁尼斯是非常出色的實驗物理學家，所有細節完全掌握，並對事物具創造力。中研院物理研究所特聘研究員陳啟東另補充，老學者克拉克早年非常喜歡台灣，自己就曾在台灣見過他兩、三次，克拉克也曾到他的實驗室參觀，多次參加台灣舉辦的會議等。有關三人成就，周美吟解釋，四十年前，克拉克是教授，德沃雷是博士後，馬丁尼斯還是研究生，他們就發明特殊實驗裝置，利用超導體等材料，呈現約瑟夫森接面效應，在宏觀系統重現量子領域的兩大重要現象，穿隧效應（粒子穿透障礙）與能階（粒子能量與波長之間的聯繫）。陽明交通大學電子物理系教授仲崇厚進一步解釋，古典力學認為粒子無法穿透，但量子力學認為量子物質同時具有粒子性與波動性，電子有一定機率穿透牆壁，但很難被觀測到，獲獎三人便是透過實驗，在宏觀世界下證實量子力學，具開創性。中研院的陳啟東說，這三人在四十年前實驗成功，促成後續相關微波應用，還有高頻線路的混頻器、電壓標準器，如今最熱門的應用題目則是量子電腦基礎元件。陽明交大電子研究所教授李佩雯補充，早期最直接應用是醫療檢測，因發展出可量測非常微弱的磁場變化，促成超導干涉儀，以及MRI（核磁共振）重要組件，如今也朝向成熟的超導量子電腦研究。熱門賽事、球星動態不漏接    ,https://news.ltn.com.tw/news/world/paper/1727205
退將慫恿「政變」 菲參謀總長悍拒,國際,2025/10/08 05:30,菲律賓武裝部隊參謀總長布勞納（法新社檔案照）香港「南華早報」七日報導，菲律賓武裝部隊參謀總長布勞納（Romeo Brawner Jr.）透露，他最近斷然拒絕八名退役將領和上校，呼籲他解決該國貪腐猖獗問題的請求。消息人士形容，此舉是推動「柔性政變」（soft coup）的手段，目的是削弱對總統小馬可仕的支持，改挺副總統薩拉‧杜特蒂。8退役軍官藉口反貪 主張改挺薩拉布勞納三日在向菲律賓外國記者協會（Focap）進行簡報後，接受南早訪問時表示，前述八名退役軍官是在九月廿日向他提出要求，當時菲律賓正值一‧九兆菲律賓披索（約九九六九億台幣）防洪設施傳出貪腐醜聞，而即將爆發全國抗議前夕。請繼續往下閱讀...由退役空軍少將波奎茲（Romeo Poquiz）率領的退役軍官，在阿奎納多軍營（Camp Aguinaldo）提出他們的要求，當時布勞納正在與他的聯合作戰參謀人員開會。波奎茲親自遞交一封信函，請求與軍事首長會面。布勞納說：「我們給了波奎茲將軍一個與我們交談、表達不滿的機會」，但這八名退役軍官的弦外之音昭然若揭：主張更換領導層，改支持副總統薩拉‧杜特蒂。布勞納說：「他們沒有說撤銷（對小馬可仕的）支持，卻說政府裡有太多貪腐官員，包括參議員和眾議員，你要加入這個行動嗎？」布勞納表示，他的答案是堅決的「不」。報導指出，此事提供一個罕見的窗口，讓外界瞭解在小馬可仕面臨迄今最大政治危機之際，菲律賓最高軍事領導層如何因應呼籲撤銷支持這位總統的要求。知情人士指出，布勞納是僅次於小馬可仕的指揮系統最高層，與他進行上述對話，他會認為這是要求撤銷對總統支持的柔性政變，因為只有軍事指揮官才能撤回支持。知情人士指出，這與二〇一一年時任參謀總長雷耶斯（Angelo Reyes）被說服撤回對時任總統艾斯特拉達支持如出一轍。熱門賽事、球星動態不漏接    ,https://news.ltn.com.tw/news/world/paper/1727207
"加薩戰爭有望終結？川普稱存在「真正的機會」",國際,2025/10/08 04:54,以色列今天紀念10月7日哈瑪斯攻擊事件兩週年之際，美國總統川普樂觀表示，結束加薩戰爭一事存在「真正的機會」。法新社報導，以色列和巴勒斯坦伊斯蘭主義組織「哈瑪斯」（Hamas）談判代表正依據川普上月提出的20點計畫，在埃及度假勝地夏姆錫克鎮（Sharm El-Sheikh）舉行間接談判。請繼續往下閱讀...川普在白宮橢圓形辦公室告訴記者：「我們有真正的機會可以做點什麼。」他補充說，美國談判代表也參與了會談。他說：「我認為我們有可能在中東實現和平。這甚至超越了加薩的局勢。我們希望立即釋放人質。」川普表示，如果哈瑪斯和以色列確實達成停火協議，美國會「竭盡所能確保各方都遵守這份協議」。這次會談舉行之際，適逢以色列紀念10月7日攻擊事件兩週年。哈瑪斯高階官員巴荷姆（Fawzi Barhoum）今天稱10月7日的攻擊是對以色列企圖「根除巴勒斯坦志業」的「歷史性回應」。他還說，哈瑪斯正努力「克服所有障礙」，以在埃及達成協議。據路透社報導，美國官員透露，美國特使魏科夫（Steve Witkoff）及川普第一次總統任期內的中東特使庫許納（Jared Kushner）今天將前往埃及加入談判。自2023年10月7日以色列遭攻擊，造成1200人遇害、251人被擄至加薩淪為人質以來，這場戰爭已導致數以萬計巴勒斯坦人喪生，並重創加薩，而這次的會談，似乎是結束這場戰爭迄今最有希望的談判。（編譯：李佩珊）1141008熱門賽事、球星動態不漏接    ,https://news.ltn.com.tw/news/world/breakingnews/5203772
