Title,News_Type,date,content,url
改譯名當沒事？ 魯比歐被制裁卻訪中 毛寧結巴回答記者影片曝,國際,2026/05/13 18:59,"毛寧顯得神色慌亂，表示沒注意到這件事。（取自x）54歲美國國務卿魯比歐（Marco Rubio）因過去大力批評中國人權，遭北京兩度制裁，結果他12日搭上川普總統專機將訪問中國。其實去年1月，中國就悄悄替他更改翻譯名稱，把原先的翻譯「盧比奧」改成「魯比奧」。有網友翻出過去中國外交部記者會影片，當時有媒體詢問此舉是否代表魯比歐已不再被制裁？而發言人毛寧顯得神色慌亂，先表示「我還沒注意到」，接著語塞、結巴一陣子後，才瞎扯「更重要的是英文名字」、「中方制裁針對的是損害中國正當權益的言行」。2025年1月22日中國外交部例行記者會上，《紐約時報》提問，中方是否更改了美國國務卿的中文翻譯？如果屬實，這變動是否意味他已不再被制裁？只見當時毛寧露出尷尬笑容表示：「我還沒注意到。」接著她結結巴巴、支支吾吾表示：「嗯......但是關於，我可以了解一下，嗯，但是我想更重要的是他的英文名字吧。」請繼續往下閱讀...重新整理好思緒之後，她才又說：「關於制裁，我想說的是，我的同事昨天已經介紹了中方的立場，我可以告訴你的是，中方制裁針對的是損害中國正當權益的言行。」X上有網友挖出這段過去影片，不少網友諷刺：「改個譯名就能變臉，挺會玩的」、「中文博大精深」、「哈哈哈，懂了！以後我要是欠銀行錢，就把名字從『欠債鬼』改成『還錢哥』，是不是就能自動銷帳了？」；也有網友說：「其實大家都在看中共的笑話，明明氣他氣得要死，他當參議員時極度友台，積極推動強化台灣防衛能力及加速對台軍售。這也是中共要制裁他的理由......反正毛寧臉皮厚又不怕尷尬。」如今，中國宣布歡迎「『魯』比奧」造訪。今年3月，中國外交部發言人林劍證實，「中方制裁措施針對的是魯比奧（魯比歐）先生擔任聯邦參議員期間的涉華言行」。法新社指出，這是中國找到了外交上的「變通」辦法。媒体提问：美国国务卿鲁比奥中文译名改了=不再被制裁？评论区那些踩缝纫机的，看看1月22日的外交部例行记者会上，发言人毛宁是如何回答的？ https://t.co/nwF99PEnal pic.twitter.com/YCxX2g70v4— 背包健客 （@bbjk666） May 13, 2026 媒体提问：美国国务卿鲁比奥中文译名改了=不再被制裁？评论区那些踩缝纫机的，看看1月22日的外交部例行记者会上，发言人毛宁是如何回答的？ https://t.co/nwF99PEnal pic.twitter.com/YCxX2g70v4    ",https://news.ltn.com.tw/news/world/breakingnews/5435975
中國男涉網路誹謗被捕 網起底曾參選日本市長、狂罵靖國神社,國際,2026/05/13 18:44,"日本靜岡縣熱海市警方今（13）日表示，逮捕一名涉嫌在網路誹謗他人的33歲中國籍男子。（圖擷取自社群平台「X」）日本靜岡縣熱海市警方今（13）日說，逮捕涉嫌在網路誹謗他人的33歲中國籍男子，受害者去年與對方發生車禍事故，遭發文造謠肇事逃逸與敲詐恐嚇，受害者不堪其擾。此外，日媒透露，中國男曾多次發表咒罵靖國神社等爭議言論，消息一出，迅速被不少熱海市民與日本網友起底黑歷史。綜合日媒報導，根據熱海警察署說法，目前住在靜岡縣熱海市綠丘町、自稱公司高層的33歲中國男子，2025年8月因車輛財損事故，認識住在靜岡市駿河區的35歲男子。警方說，中國男子不僅在社群平台公開受害者的真實姓名，還發文聲稱對方涉及肇事逃逸及恐嚇，受害者發現相關貼文後，立即報警求助。請繼續往下閱讀...警方調查，確認中國男子確實有發布一篇涉嫌損害受害者名譽的貼文，雖然貼文已在今年2月刪除，警方還是依法將他逮捕調查。另據警方透露，這名中國男子在接受警方偵訊期間，矢口否認犯行。報導指出，中國男子以在社群發布的爭議言論，他過去常發布咒罵「靖國神社應該倒閉」、「日本是精神病大國」（メンタル精神障害大国）等攻擊性極強言論，還曾砲轟旭日旗是「犯罪旗」，極度仇日的言行在社群被受各界關注。目前這名中國男子被捕消息，在日本社群掀起高度討論，從報導的隻言片語挖出嫌疑人本尊。綜合日本網友推測，熱海市如今住著大量的中國移民，其中最有名的是名為「徐浩予」、1993年出生的中國男子，他在2015年移居日本熱海市，常透過社群平台X發表仇視日本、反天皇等極端言論，也確實發過寫「日本是精神病大國」的貼文。另外，徐浩予曾在去年7月試圖以「非歸化身分」競選熱海市長選舉，引發日本社會譁然，不過他最終臨時無預警退選，但仍預告今年可能會想辦發再次參選。今回の逮捕報道の「中国籍33歳男性」と完全に合致します。 内容は徐浩予本人の過去投稿のスクショです（2025年3月3日投稿）https://t.co/funxoFCsAh pic.twitter.com/o4nE8e8sEA— 保守速 （@hoshusokuhou） May 13, 2026 今回の逮捕報道の「中国籍33歳男性」と完全に合致します。 内容は徐浩予本人の過去投稿のスクショです（2025年3月3日投稿）https://t.co/funxoFCsAh pic.twitter.com/o4nE8e8sEA名誉毀損 ｷﾀ ━━━━（ﾟ∀ﾟ）━━━━!!「靖国神社は閉店すべき」「旭日旗は犯罪旗」と過去にSNSで投稿した中国籍の男 名誉毀損容疑で逮捕 面識ある男性の実名を晒した上に当て逃げや脅迫の犯人呼ばわり 容疑を否認（テレビ静岡） https://t.co/HvVv3nOxfB pic.twitter.com/2JomF9OfKl— @airi_fact_555 （@airi_fact_555） May 13, 2026 名誉毀損 ｷﾀ ━━━━（ﾟ∀ﾟ）━━━━!!「靖国神社は閉店すべき」「旭日旗は犯罪旗」と過去にSNSで投稿した中国籍の男 名誉毀損容疑で逮捕 面識ある男性の実名を晒した上に当て逃げや脅迫の犯人呼ばわり 容疑を否認（テレビ静岡） https://t.co/HvVv3nOxfB pic.twitter.com/2JomF9OfKl【超絶朗報！笑笑笑????????????】徐浩予（と思われる人物）、名誉毀損で逮捕????「靖国神社は閉店すべき」、「旭日旗は犯罪旗」と投稿したり、熱海市に住む中国籍といったら、アイツしかいない笑笑笑???????????? https://t.co/4G6rYHBGKd pic.twitter.com/zvxYnP08vT— 日本人はもう少し怒れ （@YukokuTV1） May 13, 2026 【超絶朗報！笑笑笑????????????】徐浩予（と思われる人物）、名誉毀損で逮捕????「靖国神社は閉店すべき」、「旭日旗は犯罪旗」と投稿したり、熱海市に住む中国籍といったら、アイツしかいない笑笑笑???????????? https://t.co/4G6rYHBGKd pic.twitter.com/zvxYnP08vT徐浩予（須田浩）さんｗｗｗ９月の熱海市市長選挙までに帰化間に合いませんね。帰化の条件には「素行が善良であること」とありますし。*****「靖国神社は閉店すべき」「旭日旗は犯罪旗」と過去にSNSで投稿した中国籍の男 名誉毀損容疑で逮捕…— マルコじいさん （@marco_g_3） May 13, 2026 徐浩予（須田浩）さんｗｗｗ９月の熱海市市長選挙までに帰化間に合いませんね。帰化の条件には「素行が善良であること」とありますし。*****「靖国神社は閉店すべき」「旭日旗は犯罪旗」と過去にSNSで投稿した中国籍の男 名誉毀損容疑で逮捕…あれ、熱海市長選に出るって言ってた徐〇予 逮捕された？「靖国神社は閉店すべき」「旭日旗は犯罪旗」と過去にSNSで投稿した中国籍の男 名誉毀損容疑で逮捕 面識ある男性の実名を晒した上に当て逃げや脅迫の犯人呼ばわり 容疑を否認 https://t.co/naGnV6t03K— 江戸川太郎の保守ニュース速報 （@edogawakutaro） May 13, 2026 あれ、熱海市長選に出るって言ってた徐〇予 逮捕された？「靖国神社は閉店すべき」「旭日旗は犯罪旗」と過去にSNSで投稿した中国籍の男 名誉毀損容疑で逮捕 面識ある男性の実名を晒した上に当て逃げや脅迫の犯人呼ばわり 容疑を否認 https://t.co/naGnV6t03K突發！徐大總統被逮捕了！另外…中國籍？？？???????????? pic.twitter.com/0tdZs9iZla— のらいぬ （@JapanBanZaiLove） May 13, 2026 突發！徐大總統被逮捕了！另外…中國籍？？？???????????? pic.twitter.com/0tdZs9iZla大批日本網友指出，被熱海市警方逮捕的中國人，極有可能是當地惡名昭彰的問題中國移民「徐浩予」。（圖擷取自社群平台「X」）    ",https://news.ltn.com.tw/news/world/breakingnews/5435860
美學者曝「2原因」：川普不會在台灣問題讓步,國際,2026/05/13 18:29,2025年10月，南韓釜山APEC期間，川普、習近平在場邊交談。（路透檔案照）美國總統川普是否會在台灣問題上讓步，以換取更大的利益，成為這次「川習會」的焦點之一，華府智庫「哈德遜研究所」日本事務主席溫斯坦（Kenneth Weinstein）在接受日媒訪問時表示，外界批評川普對台灣防衛並不認真，但他認為這毫無根據，也完全不擔心。他認為，川普若在台灣問題上失敗，美國在全球的主導地位，以及他身為總統的權威都將受到嚴重損害。所以在這次會談中，川普對台灣問題會極度謹慎，不會讓步。溫斯坦是美國知日派學者，立場與川普政府相當接近，川普曾在2020年3月提名他出任美國駐日大使，但因美國參議院審查程序延宕，最終未獲批准。溫斯坦也多次發表對日本時政的看法，去年中國對高市政府連續施壓，他表示，主要目的是為了讓日本「芬蘭化」，並建議高市政府沒有讓步的必要。請繼續往下閱讀...溫斯坦在接受日本朝日新聞專訪，被問及第二次川普政府雖然表明重視包括台灣在內的「第一島鏈」防衛原則，但整體上並未展現強力介入亞洲的姿態，他是如何看待美中關係的前景。溫斯坦表示，外界批評川普對台灣防衛並不認真，但他認為這毫無根據，也完全不擔心。他表示，川普是依靠直覺行動的人，而這種直覺是在紐約房地產業界磨練出來的。川普知道要成為「頂級強者」（top dog）需要什麼。溫斯坦進一步表示，川普如果在台灣問題上失敗，美國在全球的主導地位，以及他身為總統的權威都將受到嚴重損害。川普絕不願讓習近平成為「頂級強者」。因此，在美中領袖會談中，他對台灣問題會極度謹慎，不會讓步。溫斯坦也談到，川普原本試圖透過高關稅措施來矯正與中國的貿易關係，但中國以「停止供應稀土」作為威脅，而這將對美國汽車產業等製造業造成毀滅性打擊。基於這點，川普轉向了「間接戰略」。所謂「間接戰略」，就是攻擊中國在南美最重要的友好國家委內瑞拉，以及在中東最重要的友好國家伊朗。溫斯坦表示，雖然從短期來看，美國在中東部署多個航母打擊群，並投入大量先進武器，確實可能讓外界認為，美國應對中國在台灣海峽與南海挑戰的能力被削弱，但習近平現在沒有能力在這些地區發動任何攻擊。習近平一直在中國共產黨政治局與中央軍委內進行清洗，他很清楚自己正面臨嚴峻問題。溫斯坦認為，在可預見的未來，習近平不會對台灣採取軍事行動。溫斯坦並指出，在對伊朗作戰中，美軍展現出非凡的指揮與控制能力，這也將對中國形成嚇阻。    ,https://news.ltn.com.tw/news/world/breakingnews/5435953
168條軌跡占滿螢幕！俄軍「天竺葵」自殺機迫烏克蘭耗盡防空庫存,國際,2026/05/13 18:13,烏克蘭監控服務「Monitor」於5月13日上午11時27分記錄之影像。地圖上密集的橘色標記，代表168架俄軍自殺無人機同時在空中之軌跡。（圖擷取自Monitor）俄羅斯13日對烏克蘭發動大規模自殺無人機攻勢。烏方監控系統一度同時記錄到168條飛行軌跡，畫面橫跨烏克蘭全境。報導指出，俄軍正利用低成本無人機海，強迫烏克蘭在消耗高價攔截飛彈，與棄守領空之間進行抉擇。軍聞網站《Defence Blog》報導，根據監控服務「Monitor」記錄，大量無人機蹤跡呈現南北向分布，覆蓋了烏克蘭核心的鐵路網絡。鐵路系統是烏克蘭運送重型軍事裝備與物資的物流支柱。目前已知聶伯羅、哈爾科夫與波爾塔瓦等地的鐵路轉運設施受創，實體損毀導致部分運補作業受阻。請繼續往下閱讀...根據《烏克蘭真理報》報導，俄軍首波投入139架「見證者」（Shahed）系列自殺機。這款由伊朗研發、俄國本土更名為「天竺葵」（Geran）的機種，單價僅為攔截飛彈的零頭。俄軍透過數百架同步灌頂，強迫烏方消耗極其珍貴的防空資源。這種不對稱的消耗若持續，烏克蘭的攔截彈藥庫存與雷達能量將面臨極大物理壓力。烏克蘭總統澤倫斯基在聲明中表示，每當戰爭從新聞頭條消失，俄羅斯就會變得更加殘暴。此次空襲發生在各方討論停火協議的時刻。澤倫斯基要求盟國立即落實防空系統增援，強調目前的每日防禦正處於極限邊緣。目前烏克蘭部隊正持續進行損害查證，軍方警告空襲可能仍有餘波。圖為俄產「天竺葵」（見證者）系列自殺無人機殘骸。（路透資料照）    ,https://news.ltn.com.tw/news/world/breakingnews/5435954
走個過場？川普訪中前夕 美中貿易談判不到4小時落幕歷來最短,國際,2026/05/13 17:55,美國財政部長貝森特與中國國務院副總理何立峰，13日在南韓首爾舉行第7輪經貿談判，不到4小時就結束。（歐新社）美國和中國高層官員13日在南韓首爾結束最新一輪貿易談判，全程不到4小時，這是兩國自去年展開談判以來，最短暫的一次會議。香港《南華早報》報導，第7輪談判由中國國務院副總理何立峰與美國財政部長貝森特（Scott Bessent）主導，在美國總統川普預定抵達北京的前幾個小時結束。請繼續往下閱讀...官員們在會後並未對媒體發言，有別於以往通常為期2天、且雙方會在會後舉行記者會的慣例。根據中國新華社在會後發布的簡短報導，雙方代表團討論「解決共同關心的經貿問題」，以及「進一步拓展務實合作」。機場管理單位說，貝森特於首爾時間下午約4點，經由貴賓通道離開位於仁川機場第一航廈的會議地點，啟程前往中國，陪同川普進行國是訪問。這將是美國總統8年多來首度訪問中國，川普上一次的正式訪問，是在2017年其首屆總統任期內。預計有十多位美國頂尖企業領袖將隨同川普出訪，包括輝達（Nvidia）的黃仁勳、蘋果（Apple）的庫克（Tim Cook）、特斯拉（Tesla）與SpaceX的馬斯克（Elon Musk）、波音（Boeing）的歐特柏格（Kelly Ortberg），以及美光（Micron）的梅羅特拉（Sanjay Mehrotra）。川普13日透過社群平台發文說，他將要求習近平主席「『開放』中國，讓這些傑出的人才施展他們的魔法」；「事實上，我保證，當我們聚在一起時（也就是幾個小時後），這將成為我的第一個要求。」這對兩國都有利。在貿易談判當天上午，貝森特與何立峰分別禮貌性拜會南韓總統李在明。南韓總統發言人表示，在與貝森特的會面中，李在明強調需要與美國在強化供應鏈（包括關鍵礦物），以及外匯市場方面強化合作。發言人說，李在明與何立峰會面時，也呼籲進一步與中國合作。儘管貝森特與何立峰3月在巴黎的會面並未達成重大貿易協議，但該次會議被認為替美中的緊繃關係提供亟需的穩定性。去年，貝森特與何立峰曾在日內瓦、倫敦、斯德哥爾摩、馬德里與吉隆坡舉行談判，並於1月在瑞士達沃斯（Davos）的「世界經濟論壇」（WEF）場邊會晤。    ,https://news.ltn.com.tw/news/world/breakingnews/5435893
川習會前何立峰、貝森特經貿磋商 中國稱願與美方合作管控分歧,國際,2026/05/13 17:30,美國財政部長貝森特（見圖）今天在韓國與中國國務院副總理何立峰舉行經貿磋商。（歐新社）美國總統川普即將抵達中國訪問，中國外交部發言人郭嘉昆今天說，中方歡迎川普對中國進行國是訪問，願與美方「擴大合作，管控分歧」。同一時間，中國官方也宣布中國國務院副總理何立峰與美國財政部長貝森特今天已在韓國舉行經貿磋商，雙方進行了「坦誠、深入、建設性」的交流，但未提及磋商結果。請繼續往下閱讀...中國外交部下午舉行例行記者會，川普訪中及即將登場的「川習會」成為媒體關注焦點。央視新聞報導，郭嘉昆說，元首外交對中美關係具有不可替代的戰略引領作用，中方歡迎川普（Donald Trump）總統對中國進行國是訪問。訪問期間，兩國元首將就事關中美關係以及「世界和平與發展的重大問題」深入交換意見。他宣稱，中方願與美方一道秉持平等、尊重、互惠的精神，擴大合作，管控分歧，「為變亂交織的世界注入更多的穩定性和確定性」。另據新華社報導，何立峰與貝森特（Scott Bessent）今天代表中美雙方在韓國舉行經貿磋商。雙方以「兩國元首重要共識」為指引，秉持「相互尊重、和平共處、合作共贏」的原則，就解決彼此關注的經貿問題和進一步拓展務實合作，進行了「坦誠、深入、建設性」的交流。韓媒News1在12日引述機場官員說法指出，美中經貿磋商預計在仁川機場貴賓室舉行。美方官員表示，美中雙方預計將在北京峰會上，同意建立促進雙邊貿易與投資的論壇；同時，中方也可望宣布對波音（Boeing）飛機、美國農產品以及能源相關的採購計畫。北京當局則希望美國放寬先進半導體的出口限制，並對一項限制關鍵晶片製造設備出口至中國的法案表達關切。    ,https://news.ltn.com.tw/news/world/breakingnews/5435853
自由說新聞》美國一動作小粉紅集體崩潰！他曝川普「更大籌碼」讓北京直接破防,國際,2026/05/13 17:24,全新的視界！新聞話題不漏接，快訂閱YouTube 【自由追新聞】，記得開啟小鈴鐺哦！    ,https://news.ltn.com.tw/news/world/breakingnews/5435883
黃仁勳同行！川普率科技巨頭訪中國：要求全面開放市場,國際,2026/05/13 16:59,美國總統川普昨啟程前往中國，將與中國國家主席習近平舉行會晤。（路透社檔案照）美國總統川普昨（12）日啟程前往中國，準備與中國國家主席習近平舉行會晤。川普此行率領包括特斯拉執行長馬斯克、蘋果執行長庫克及輝達執行長黃仁勳在內的十多位科技巨頭隨行。川普表示，抵中後首要任務即是要求習近平「開放」市場，共創兩國互利。據《紐約郵報》報導，川普今日透過社群平台「Truth Social」表示，他正前往中國，並稱讚習近平是位「卓越的領導人」。川普透露，在會面中將要求中國開放市場，讓隨行的企業領袖能「大展身手」，幫助中國發展。他強調，這是兩國「最有利的發展構想」。請繼續往下閱讀...此次隨行名單星光熠熠，除了馬斯克與庫克，川普特別在貼文中澄清，輝達執行長黃仁勳已在空軍一號上。川普特別點名《CNBC》先前報導黃仁勳未受邀是「假新聞」。    ,https://news.ltn.com.tw/news/world/breakingnews/5435585
義大利擬向波斯灣派遣掃雷艦 條件是達成穩定停火,國際,2026/05/13 16:52,義大利今（13）日表示，將派遣2艘掃雷艦靠近波斯灣地區。圖為義大利國防部長克羅塞托。（路透）義大利今（13）日表示，將派遣2艘掃雷艦靠近波斯灣地區，但只有在該地區達成持久停火協議的情況下，才會作為國際行動的一部分部署。根據《法新社》報導，義大利國防部長克羅塞托（Guido Crosetto）在國會發表演說時指出，任何前往荷姆茲海峽的行動都必須事先獲得議員批准。請繼續往下閱讀...克羅塞托強調，部署的前提條件並非美國與伊朗目前的停火協議，而是真正可信賴且穩定的停火，或者是最終的和平。克羅塞托聲稱，掃雷艦需要數週時間才能抵達波斯灣，因此義大利正在「預先部署」這些艦艇，首先部署在東地中海，然後是紅海。克羅塞托說「純粹出於預防考慮，我們正在安排2艘掃雷艦部署在距離荷姆茲海峽相對較近的地方。」    ,https://news.ltn.com.tw/news/world/breakingnews/5435763
歐盟「盾牌行動」保護紅海航運 戰後擬納入荷姆茲海峽,國際,2026/05/13 16:29,歐盟外交與安全政策高級代表卡拉斯今天表示，一旦美伊戰爭結束，歐盟可能將目前在紅海執行的「盾牌行動」擴展至荷姆茲海峽。（法新社）歐盟外交與安全政策高級代表卡拉斯今天表示，一旦美伊戰爭結束，歐洲聯盟（EU）可能將目前在紅海執行的「盾牌行動」（Operation Aspides）擴展至荷姆茲海峽。法新社報導，卡拉斯（Kaja Kallas）在歐盟國防部長會議後說：「盾牌行動在保護紅海航運方面已發揮關鍵作用，這項行動範圍有望擴展至荷姆茲海峽（Strait of Hormuz）。」請繼續往下閱讀...卡拉斯表示，已有部分國家允諾為這項行動增派艦艇，若決定擴大行動範圍，這些增援將大有助益。受到美國總統川普發動美伊戰爭以及這場戰爭對全球經濟衝擊的影響，歐洲各國正設法在衝突結束後，協助恢復航運暢通。法國與英國日前已帶頭就中東地區海軍部署展開相關討論，40多國防長今天舉行新一輪磋商。美伊談判目前似乎陷入僵局，這場談判不僅涉及結束美伊戰爭，也攸關重啟荷姆茲海峽。全球約有5分之1石油及天然氣須經荷姆茲海峽運輸，遭伊朗封鎖後已導致全球能源價格上漲。    ,https://news.ltn.com.tw/news/world/breakingnews/5435769
俄改變策略 澤倫斯基警告嚴防白天無人機攻擊,國際,2026/05/13 16:27,烏克蘭總統澤倫斯基警告，俄國可能會在13日白天發動更多波無人機攻擊。圖為澤倫斯基11日在基輔與來訪的德國防長佩斯托瑞斯舉行會談。（歐新社）俄羅斯看似改變戰略逐漸改採白晝攻擊，烏克蘭總統澤倫斯基13日說，目前已有超過100架無人機現身烏克蘭領空，俄羅斯可能會在13日一整天發動更多波無人機攻擊。澤倫斯基在X平台發文說，「俄羅斯繼續其襲擊而且是肆無忌憚地攻擊─蓄意攻擊我們的鐵路基礎建設與城市中的民用設施」，造成人員死傷；光是12日白天一整天有14個地區遭到攻擊，另有數個地區的港口與能源設施遭夜襲。請繼續往下閱讀...4年多前俄烏開戰以來，俄羅斯主要在夜間發動大規模的無人機與飛彈攻擊；但近幾週來，俄羅斯已多次在白天對烏克蘭發射數百架無人機與飛彈。相較於夜襲，白晝攻擊對百姓生活的破壞力更大。澤倫斯基還說，堅韌地擊退俄羅斯的每一次攻擊至為重要，支持烏克蘭以及不要對俄羅斯挑起的戰爭保持沉默至為重要；每當烏戰不再是頭條新聞就形同鼓勵俄羅斯更為凶殘，外交官盡快落實領導人層級達成的協議，至為重要。根據烏克蘭空軍，自12日傍晚6點（台灣時間同日深夜11點）以來，俄羅斯已出動139架無人機攻擊烏克蘭，其中111架被擊落或遭到干擾。    ,https://news.ltn.com.tw/news/world/breakingnews/5435775
