Title,News_Type,date,content,url
飆車團挨罰67萬 警舉發60件、危駕罰43萬,社會,2026/07/15 05:30,陳男等人透過網路揪團競速、燒胎，噪音、大量煙霧引發民怨。（記者鄭淑婷翻攝）陳姓男子等人揪團於清晨時分在桃園市蘆竹區長興路二段競速飆車、瘋狂燒胎，前後十二分鐘的速度快感，除了面臨刑事責任，交通違規一個都逃不掉，蘆竹警方當時一口氣舉發了六十件交通違規，總罰鍰金額達六十七萬二五〇〇元，其中闖紅燈被開單最多，另一項危險駕駛的罰鍰就超過四十三萬元。陳男等人因競速飆車逐一被拘提到案後，檢方分別諭知三萬至十萬元不等金額交保，總交保金額達五十九萬元，此外，警方也依據陳男等人行為，共舉發了六十件交通違規，罰鍰總額逾六十七萬元，加上將被沒入銷毀的機車、車輛，飆車族短短十二分鐘的競速快感，除了刑事責任，還有金錢慘重損失，估算代價逾兩百萬元。請繼續往下閱讀...警方表示，舉發的六十件交通違規中，以「闖紅燈」卅二件最多，而對道路安全威脅最鉅的「危險駕駛」也取締了十二件，依據近年修法加重後的道路交通管理處罰條例第四十三條規定，危險駕駛最高可處三萬六千元罰鍰，光是此項目的違規者，合計罰鍰就超過四十三萬元。其餘取締項目包括未禮讓行人、企圖規避查緝擅自改裝裝置、逆向行駛、轉彎不依規定及未戴安全帽等。    ,https://news.ltn.com.tw/news/society/paper/1762665
吸金2.5億吞善款 買豪宅養狐狸／前名模判刑10年 兄判21年,社會,2026/07/15 05:30,"前伊林名模蕭瑋葶與哥哥、嫂嫂三人涉嫌侵吞身障協會善款，被重判。（圖翻攝自蕭女IG）「中華民國身障關懷協會（TDCA）」創辦人蕭靖，與掛名協會理事長的妻子陳品君、曾是伊林名模的胞妹蕭瑋葶共同募款，六年間吸金逾二億五千萬元，卻僅將一千多萬元用於公益，大多遭挪用、私吞，買豪宅、名車、養狐狸，花錢毫不手軟。士林地院昨分別依公益侵占、共同詐欺、洗錢、偽造文書、個資法、藏匿人犯等罪，判處蕭靖廿一年有期徒刑，另有五年徒刑可易科罰金，蕭瑋葶判刑十年、陳品君八年，並沒收犯罪所得。可上訴。判決指出，蕭靖籌辦協會時冒用直銷客戶名單資料，向內政部、衛福部報備人頭理監事名單、偽簽會議簽到表，協會實際由蕭靖三人掌控，且無財務稽核機制。請繼續往下閱讀...蕭靖因生意失敗欠債而信用不良，將協會視為改善家庭經濟的工具，與妻、妹挪用善款購買名錶、股票、積架及保時捷等七輛名車、新北林口兩間豪宅、付信用卡費，共侵占九三七〇萬餘元。蕭靖又將林口豪宅登記妹妹名下，製作虛偽薪資、扣繳憑單，營造她是協會工程師、年收入二三〇萬元的假象，向銀行詐貸五二一六萬元。蕭靖二〇二一年另因詐欺案被判刑，逃亡遭通緝，陳品君與蕭瑋葶明知仍收留同居，讓他持續以假名處理協會金流及業務。士院認為三人將大眾善款當作個人金庫，破壞社會對公益團體的信賴，予以重判。    ",https://news.ltn.com.tw/news/society/paper/1762668
竹市音樂教室驚傳命案 頂大教授砍死連襟店長 警開4槍制伏,社會,2026/07/15 05:30,林姓教授行兇後滿手鮮血，隔著音樂教室玻璃與警方對峙。（民眾提供）新竹市三民路昨天下午驚傳命案，四十三歲的台裔美籍陽明交通大學電子研究所教授林男，疑因與四十八歲連襟紀男對於音樂教室產權起嚴重爭執，竟持藍波刀闖入樂器行，當著員工的面砍殺紀男近卅刀，警方據報趕往現場時，與滿手鮮血的林男短暫對峙，最後開四槍分別擊中雙腿，林男負傷就擒送醫開刀戒護，紀男則傷重不治，全案正由檢警漏夜偵辦當中。疑產權起爭執 林男怒砍近30刀據悉，林男交大畢業後就赴美深造，拿到博士且擁有美國籍，林妻的妹妹嫁給在竹市三民路開設樂器行與音樂教室的老闆紀男。昨天下午，林男神情自若走進樂器行，還跟店員點頭示意，不久就與紀男發生嚴重口角衝突，竟拿出預藏的藍波刀朝紀男連砍近卅刀，紀男頸部、身軀多處嚴重刀傷，血流如注倒臥血泊中。請繼續往下閱讀...警為緊急救人 朝林男腿部開槍驚嚇不已的店員報案後，警方據報趕到現場，與林男對峙，行兇後的林男則站在樂器行內，手中仍拿著藍波刀，警方見狀不斷喝斥要他「刀放下」、「丟旁邊」，但林男不從，作勢逃逸，警方為了緊急入內搶救紀男生命，朝林男腿部連開四槍，他中彈後隨即倒在樂器行門口台階不斷哀號，員警上前制伏，戒護送新竹台大醫院開刀急救，無生命危險，但紀男卻傷重不治。據了解，音樂教室位於新竹市巨城商圈，店面位置與生意都不錯，是否因產權問題，導致林男暴怒揮刀斬殺自己連襟，檢警仍將深入調查以釐清案情。    ,https://news.ltn.com.tw/news/society/paper/1762672
蘇澳轉作獎勵 青農涉詐獎金 課員疑圖利都收押,社會,2026/07/15 05:30,蘇澳鎮公所（如圖）農業課遭檢調搜索，邱姓課員與大南澳地區黃姓青農被檢調帶回調查。 （圖由讀者提供）宜蘭縣蘇澳鎮公所農業課前天遭檢調搜索，邱姓課員辦理大南澳地區農田轉作大豆獎勵，被質疑勘查不實，圖利黃姓青農五百多萬元；檢察官昨訊後對邱姓課員及黃姓青農聲請羈押禁見獲准。檢察官前天上午指揮宜蘭縣調站兵分多路，前往蘇澳鎮公所農業課等地搜索，帶回邱姓課員與相關資料，另一方面，大南澳地區黃姓青農等人也一併被帶回調查。請繼續往下閱讀...據了解，邱姓課員是農田休耕承辦人。檢調接獲檢舉，大南澳地區有人轉作大豆申請補助，邱男疑似放水圖利。根據調查，黃姓青農涉嫌製作不實數據多次提出申請，邱姓課員未親自勘查確認，讓黃男向農業部農糧署詐領五百多萬元，檢調懷疑邱從中護航。邱姓課員及黃姓青農經宜蘭地檢署複訊，全案朝違反貪污治罪條例方向偵辦。檢察官認為二人涉案情節重大，並有滅證及勾串之虞，向法官聲押禁見獲准。蘇澳鎮長李明哲盼檢調依法偵辦，被羈押的黃姓青農，與曾獲選百大青農的哥哥，在大南澳地區攜手栽種有機大豆，如今捲入大豆獎助弊案疑雲，讓外界相當訝異。    ,https://news.ltn.com.tw/news/society/paper/1762669
女童逛一中街遭強迫推銷、押訂金    家長已向警方報案,社會,2026/07/15 00:12,女童和同學到一中街逛街，疑似遭店員強迫推銷保養品並限制離去，警方已依涉嫌妨害自由罪偵辦。（擷取自Threads）台中一名小六畢業女童，近日和同學前往一中街逛街，卻被帶往店裡強迫推銷保養品，最後留下100元訂金才脫身，且女童塗抹保養品的皮膚，事後出現嚴重紅腫過敏反應，女童父親痛批店家：「是有多缺錢？連小六生都不放過！」，已向警方報案；第二分局表示，將依涉妨害自由罪嫌偵辦。該名女童的父親，氣憤在網路PO文表示，「我女兒才小六畢業，你也要推銷化妝品，不就我女兒夠聰明，遇到這種的會錄影自保，化妝品推銷不成，修眉毛100加減賺也好，呼籲其他家長若小孩和同學去逛一中街要注意一下」。請繼續往下閱讀...這名女童事後心有餘悸表示，現在去一中街會有陰影，不敢再跟同學去逛了，強調當下被強迫推銷其實很緊張，擔心如果拒絕推銷，不知對方會對她做什麼事，連晚上睡覺都夢到這件事。同行的女同學也說，一開始她們說只要幫忙填表，所以兩人才同意進去，沒想到進去後讓自己和朋友分開，那時自己就很緊張，那個姐姐一直問她很多問題，還給她試用產品塗在手上，還一直問只要900元要不要買？當時告知要再考慮，店員就一直問是在考慮什麼？因很多人看她很緊張，怕不給會發生別的事，才被迫交了100塊訂金。台中市第二分局表示，7月10日下午3點多，已受理一名未成年學生，前往一中街疑似遭強迫推銷案件。該名同學與朋友到商圈店家消費時，店員在介紹保養產品過程中，疑有持續勸說並限制其離去情形。目前本案已依規定受理，並通知相關涉案人到案說明，後續將依涉嫌妨害自由罪嫌函送台中地檢署偵辦。    ,https://news.ltn.com.tw/news/society/breakingnews/5505464
新北11、14歲表姊妹離家萬人關注  中警旅館尋獲帶回男網友調查,社會,2026/07/14 23:27,新北市板橋區一對未成年表姊妹，疑似和男網友相約離家到台中，家屬焦急協尋，第二分局警方今天下午已經在旅館尋獲兩人，並將男網友帶回調查。（記者陳建志攝）新北市一對11歲、14歲的表姊妹，疑因網路交友12日上午從新北板橋家離家，因手機關機聯繫不上，家屬遍尋不著心急如焚，因發現手機最後定位在台中，除向警方報案協尋，也在網路發文請網友協助找人，吸引數萬網友關注，經警方調閱監視器全力比對，終於在今天下午3點多，在台中一家旅館尋獲兩名少女，還有20多歲的男網友，這名男網友是否涉嫌相關刑責，目前警方正在調查釐清中。這對11歲、14歲的表姊妹，疑因網路交友，和男網友相約到台中，7月12日早上9點多，從新北板橋家中離家，家屬發現兩人不見蹤影後四處找人，最後定位在台中市北區三民路3段，一中街附近，立即請警方協助找人。請繼續往下閱讀...因兩人手機並未持續開機，警方無法精準鎖定兩人位置，尋人進度一度受阻，家人焦急在Threads上發文，並公布兩人的照片，請網友協助找人。台中市第二分局警方經全力調閱監視器找人，終於在今天下午3點多，在台中一間旅館內尋獲兩人，當時20多歲的男網友也在場，立即將兩名少女、還有男網友帶回警局，並聯絡少女家人到警局，目前正調查釐清男網友是否涉嫌相關刑責。    ,https://news.ltn.com.tw/news/society/breakingnews/5505451
台東公車司機飆罵長者被炎上！真相曝 吵完掏100元給她……,社會,2026/07/14 23:05,公車司機還掏錢給狂咳的婦人，提醒她去買藥吃。（東台灣客運提供）台東市有公車司機與女乘客互爆粗口，司機甚至抬腳作勢踹人，影片引發網友撻伐。不過，如今真相大白，婦人狂咳，沒口罩又不下車，但她到站前兩人已可好好對話，司機還掏錢要給她買藥治病。司機已依規定停職接受調查，也取得婦人原諒。高齡女乘客昨天（13日）搭公車咳個不停，影片中可見，司機飆罵，要求她戴上口罩，婦人回說，「我沒有口罩啊！」司機要求她下車遭拒，婦人還說，「你給我100塊啊！」雙方接著互爆三字經，司機作勢舉手、抬腳喊，「我想踹死你咧！」乘客飽受驚嚇。請繼續往下閱讀...爆料者質疑，當時車內也有其他乘客未戴口罩，司機卻只要求這名長者配戴，做法令人難以接受。也有網友說，明明就過了強制佩戴口罩時期，為何一定要人戴上口罩，「司機自己也沒戴啊！」但有網友說，疫情後，本就該更注重個人衛生以免傳染他人，「司機有權力拒載，但手段實在太差勁」。客運公司出面解釋後，網友風向改變了。原來，婦人下車前，兩人又能平靜好好對談，司機甚至還真掏出100元給婦人，「自己去買藥吃，藥局就在（站牌）後面，一定要吃藥」。2人脾氣來得快、去得也快，最後司機還展現愛心，只是表達方式令人難以接受。客運公司主管今天帶著司機登門致歉，司機鞠躬道歉時，婦人雙手猛揮，「不用啦！而且你還給我100塊」。但道歉完，兩人坐下來，司機第一句話還是，「你咳嗽到底治好沒？」婦人並未為提出告訴，但客運公司說，依規定，司機需接受懲處、停職調查，公司會再約束所有司機行為舉止。    ,https://news.ltn.com.tw/news/society/breakingnews/5505392
7/14 今彩539頭獎開2注！大樂透連19摃下期飆7億,社會,2026/07/14 22:26,7月14日開獎的第115000170期今彩539頭獎開出2注。（本報合成）7月14日開獎的第115000170期今彩539頭獎開出2注，由台中市南區國光里正氣街62號1樓「金鴻發彩券行」、花蓮縣花蓮市主力里中華路233號1樓「金錢豹投注站」開出。第115000070期大樂透摃龜；大樂透端午加碼開出3組100萬獎項。第115000070期大樂透中獎號碼「10、25、34、36、45、46，特別號：07」。頭獎摃龜；貳獎3注中獎，可得139萬8181元；參獎共69注中獎，每注可得6萬5466元；肆獎共180注中獎，每注可得1萬6132元；伍獎共3979注中獎，每注可得2000元；陸獎共5884注中獎，每注可得1000元；柒獎共6萬2154注中獎，每注可得400元；普獎共7萬1295注中獎，每注可得400元。請繼續往下閱讀...第115000070期49樂合彩中獎號碼為「10、25、34、36、45、46」。四合1注中獎，可得20萬元；三合共77注中獎，每注可得1萬2500元；二合共2478注中獎，每注可得1250元。第115000170期今彩539中獎號碼為「01、06、13、15、37」。頭獎共2注中獎，每注可得800萬元；貳獎共205注中獎，每注可得2萬元；參獎共7618注中獎，每注可得300元；肆獎共7萬5061注中獎，每注可得50元。第115000170期39樂合彩中獎號碼為「01、06、13、15、37」。四合共8注中獎，每注可得21萬2500元；三合共386注中獎，每注可得1萬1250元；二合共1萬3412注中獎，每注可得1125元。第115000170期3星彩中獎號碼為「391」。壹獎共39注中獎，每注可得5000元。第115000170期4星彩中獎號碼為「6156」。壹獎共19注中獎，每注可得5萬元。大樂透實施端午加碼，加開100組100萬元，本期加碼開獎結果為摃龜，尚有6組100萬獎項未開出，將於下期（17日）繼續加開。「大樂透端午加碼」開獎結果確切中獎號碼以台彩網站公告為主，請見「台灣彩券網站」。大樂透、49樂合彩中獎號碼。（擷取自台彩官網）今彩539、39樂合彩、3星彩、4星彩中獎號碼。（擷取自台彩官網）    ,https://news.ltn.com.tw/news/society/breakingnews/5505408
新店耕莘醫院傳工安意外 7旬維修工倒臥冷卻水塔平台亡,社會,2026/07/14 22:18,新北市新店耕莘醫院今晚發生工安意外，死者黃男維修時不知何故倒臥水塔上方平台，經院方搶救仍宣告不治。（記者陸運鋒翻攝）新北市新店耕莘醫院昨天（14日）晚間8時許，發生一起工安意外，維修工黃姓男子被同事發現倒臥在1層樓高的冷卻水塔上方平台，且已失去呼吸心跳，隨後由消防人員救下，但經院方搶救後仍宣告不治，詳細事發原因仍有待調查釐清。新店警分局初步調查，71歲黃男為新店耕莘醫院早班工務，他昨天至院區C棟5樓頂維修冷卻水塔機械時，不知何因倒臥在水塔上方平台，而晚班張姓同事交接班時，驚見黃男已經失去意識，急忙打119報案並通報院方。請繼續往下閱讀...據知，消防局派遣各式救災救護車10輛、消防人員20名到場救援，發現水塔內水深約60公分，隨即從水塔上方平台以吊掛方式將黃男救下，但他已失去呼吸心跳，隨後送進醫院急救，經搶救仍於昨天晚間9時許宣告不治。據查，經警方鑑識人員勘驗採證後，並未發現有外力介入，已排除有他殺之嫌，警方已通知黃男妻子處理後續事宜，至於死因仍待檢方相驗後釐清，而黃男倒臥水塔平台原因，將由勞檢單位進一步調查。    ,https://news.ltn.com.tw/news/society/breakingnews/5505407
男車禍肇逃辯「屎在滾」！喊踩屎去洗腳 法官全不信判6月,社會,2026/07/14 21:59,彰化練姓男子車禍肇逃卻辯「屎在滾」逕自離去。彰化地院審理，依肇事逃逸罪判處6月徒刑。（記者陳冠備攝）彰化練姓男子去年騎車發生車禍，對方騎士倒地受傷，他卻直接閃人。事後被逮，他辯稱，當時不是慌張逃跑，而是因為「屎在滾」，所以先跑到附近草叢解決，結果腳還不小心沾到大便，只好又跑去公廁洗腳，等折返回車禍現場時，人車早已離開。不過這番言論法官聽不下去，仍依肇事逃逸罪判處6月徒刑，得易科罰金。判決書指出，練男去年8月騎機車行經彰化市一處路口時，與另一名機車騎士發生碰撞，兩人雙雙掛彩，對方手腳多處擦傷，練男自己也扭到腳、擦破皮。但離譜的是，他沒報警、沒叫救護車，反而直接騎車落跑，事後被依肇事逃逸罪送辦。請繼續往下閱讀...檢方調查認為，練男說法與現場情況及監視器畫面均不相符，且事故發生後確實未依法留在現場處理，也未確認對方傷勢或報警，認定其涉犯過失傷害及肇事逃逸罪嫌，依法起訴。彰化地院審酌，練男肇事後逕自離去，置傷者於不顧，實屬不該。考量他於坦承犯行，已與被害人達成調解並完成賠償，被害人也撤回過失傷害告訴，加上其從事市場搬運工作、家庭及經濟狀況等因素，依肇事逃逸罪判處有期徒刑6月，可易科罰金。    ,https://news.ltn.com.tw/news/society/breakingnews/5505386
還有10人受困！美籍教授殺害連襟店長持刀對峙    警連開4槍化解危機,社會,2026/07/14 21:26,林姓教授與拔槍的警方對峙。（警方提供）國立陽明交大美籍林姓教授今天下午持刀，進入竹市三民路音樂教室，對連襟店長紀男連砍30刀奪命，新竹市警局晚間公布對峙畫面，表示當時教室內有6名大人、4名小孩，急迫救人下警方連開4槍制伏林男，順利救人。新竹市警局第二分局表示，下午2點46分接獲報案，指三民路音樂教室有人持刀行凶，經員警到場發現，被害人已倒臥血泊中，嫌犯持刀與警方對峙，且被害人亟待搶救，另屋內尚有6名大人、4名小孩受困，可能有安全顧慮。在急迫狀態下，警方依法使用警械制止逮捕嫌疑人林男，隨即119救護人員搶入現場，被害人已失去生命跡象，嫌疑人戒護就醫。請繼續往下閱讀...經初步調查，林姓嫌疑人與紀姓被害人具姻親關係，行凶動機尚待查證。全案依刑法殺人罪嫌移送新竹地檢署偵辦。林姓教授與警方對峙。（警方提供）林姓教授與警方對峙。（警方提供）林姓教授與警方對峙。（警方提供）林姓教授與警方對峙。（警方提供）    ,https://news.ltn.com.tw/news/society/breakingnews/5505340
金門小三通又傳活體走私！ 旅客鼠蹊部綁8龜1鼠欲闖關被逮,社會,2026/07/14 21:25,國人飼養寵物風氣仍盛，龜類也是其中之一。金門小三通今傳查獲旅客走私8隻烏龜。（讀者提供）繼1月前挾帶爬行類寵物闖關，金門小三通今天又傳查獲活體動物走私，1名男子由小三通入境時，疑將8隻烏龜及1隻土撥鼠綁在大腿內側企圖闖關，由於被查獲烏龜疑似保育類動物，仍有待鑑定；土撥鼠基於防疫考量，已施予人道處理，送往檢驗；全案依涉嫌違反野生動物保育法偵辦中。旅客指出，近月來頻傳活體動物闖關，且走私標的「越來越大」，是否通關查驗動線百密一疏，讓不法人士食髓知味，覺得有機可趁？還有待驗證。請繼續往下閱讀...今天下午1點左右，傳出1名從廈門循小三通入境的邱姓男子，被金門水頭港CIQS（邊境管制與安全檢查機制）人員發現動作異常，且男子大腿內側接近鼠蹊部位特別隆起，查緝人員進一步對邱男盤問，果然發現事有「蹊」蹺，最後在他腿部及鼠蹊部位發現綁了8隻烏龜及1隻土撥鼠。查緝單位懷疑，被查獲的烏龜有可能是保育類野生動物，一旦鑑定屬實，即涉嫌違反野生動物保育法，後續將針對動物來源及幕後是否有集團操控，作進一步釐清。這起活體走私已是金門海關近1個月來第4起，從蜥蜴、守宮、甲蟲、烏龜，物種越來 越大，旅客憂心，若是不上緊發條，金門小三通國門恐淪為動物走私轉運站。    ,https://news.ltn.com.tw/news/society/breakingnews/5505350
陽明交大學霸教授砍死連襟 「歐趴糖」網站「給分甜度」達5顆星,社會,2026/07/14 21:15,陽明交大學霸教授砍死連襟讓人震驚，而這名教授在歐趴糖網站中學生給分評價甜度達5顆星。（擷取自歐趴糖網站）涉嫌持藍波刀殺害連襟的國立陽明交通大學電子研究所林姓教授，交大電子工程學系畢業後，取得美國密西根大學碩、博士，後進入陽明交大任教，曾獲電機學院優良教學獎。除在學生心目中是位「佛系」教授，在OPT歐趴糖網站中，學生對林上課及給分的糖度達5顆星。這起教授砍殺連襟的兇殺案也在高等教育界及音樂界引發討論。砍殺連襟的陽明交大林姓教授在OPT歐趴糖網站中學生的評價與給分糖度，會顯示整體評價達4顆星，而給分糖度高達5顆星，課程輕鬆程度（涼度）也達5顆星，僅課程含金量拿到3顆星。很多學生也在網站上討論，覺得這位教授上課氛圍很不錯，上課相對輕鬆，學生的好感度也很高。多數學生也難以置信為何這樣學霸級教授會持刀砍殺連襟，且要置人於死地？請繼續往下閱讀...這起學霸教授砍殺人的兇殺案也在高等教育界及音樂界引發討論，更在竹科園區工程師界引發各種議論。陽明交大學霸教授到音樂教室砍死連襟的兇殺案，震驚教育界及音樂界。（警方提供）    ,https://news.ltn.com.tw/news/society/breakingnews/5505343
6.6億大樂透頭獎你中？ 7/14今彩539獎號也出爐了,社會,2026/07/14 21:02,大樂透、49樂合彩開獎號碼。（擷取自三立iNEWS《全民i彩券》）今天（7月14日）台彩各項開獎獎項及獎號。大樂透：10、25、34、36、45、46，特別號：07。請繼續往下閱讀...49樂合彩：10、25、34、36、45、46。今彩539：01、06、13、15、37。39樂合彩：01、06、13、15、37。3星彩：391。4星彩：6156。確切中獎號碼以台彩網站公告為主，請見「台灣彩券網站」。今彩539、39樂合彩開獎號碼。（擷取自三立iNEWS《全民i彩券》）3星彩開獎號碼。（擷取自三立iNEWS《全民i彩券》）4星彩開獎號碼。（擷取自三立iNEWS《全民i彩券》）    ,https://news.ltn.com.tw/news/society/breakingnews/5505330
陽明交大美籍教授砍死連襟店長  警「連開4槍」目擊影片曝光！,社會,2026/07/14 20:58,警方對林姓男子開槍的影片在網上曝光，可以看到林男中槍後倒地滾下台階（紅圈處）。（圖取自Threads:asd1123098）新竹市今（14日）驚傳陽明交大美籍教授持刀，砍殺自己在當地一間音樂教室工作的連襟，警方獲報到場與之對峙，開4槍將凶嫌壓制，附近有民眾近距離目擊全程，拍下PO網掀熱議。今天下午，一名擁有美國籍的48歲林姓男子，持刀闖進新竹巨城旁三民路上的一間音樂教室，對紀姓店長連刺10多刀，店員見狀嚇壞，趕緊報案。警方獲報到場後，林男持刀與警方短暫對峙，為搶救重傷店長性命，連開4槍制伏林男，將紀姓店長送到新竹台大醫院急救，可因傷勢太過嚴重，紀男仍宣告不治。請繼續往下閱讀...經了解，林男是國立陽明交大電機學院的教授，紀男的妻子是林男妻子的胞妹，也就是林男的連襟，為何林男要下此狠手，還有待調查釐清。事後，有案發現場附近的民眾在Threads上，分享不同視角的目擊影片，可以看到大批員警在案發地外部署戒護，有人持電擊槍，也有人持一般手槍，不斷對屋內失控的林男大喊「放下（刀）！放下（刀）！」，下一秒林男似乎有所動作，緊接著數聲槍響，林男倒地摔下店前台階，隱約可見林男雙腿滿是鮮血，痛得不斷哀號。確認林男失去反抗能力，警方一擁而上將林男壓制。網友們紛紛表示，「新竹的警察敢開槍太好了，真的很可怕耶」、「支持警方面對惡徒大膽用槍」、「下次直接瞄準center mass，別打腿了。不過他中槍後又吃了幾記警棍，倒是看得挺過癮」、「支持警察，開得好」、「看到越來越多警察開槍的新聞，讓我對台灣的治安更有信心了」、「幸好警察沒有受傷」、「已經是現行犯殺人凶手，開槍沒什麼好顧慮的！」     在 Threads 查看     在 Threads 查看不同視角目擊警方開槍，伏服凶嫌後將傷者送醫，傷者仍宣告不治。（圖取自Threads:1leafsalon_daye）    ,https://news.ltn.com.tw/news/society/breakingnews/5505288
