Title,News_Type,date,content,url
已轟炸1.3萬個目標！川普：美伊停火協議可能很快實現,國際,2026/03/30 21:47,美國總統川普表示，美軍已轟炸伊朗1.3萬個目標，還有約3000個目標待處理，「可能很快就能達成協議」。（法新社）美國總統川普對德黑蘭設下4月6日達成協議結束戰爭，否則轟炸該國能源設施的時限。得以開通關鍵能源航道荷姆茲海峽的停火協議是否近在咫尺？川普不願說明細節，強調美軍已轟炸伊朗1.3萬個目標，還有約3000個目標待處理，認為「可能很快就能達成協議」。美軍持續擴大中東軍力部署，除了27日抵達的3500名陸戰隊，還有約2200名陸戰隊整裝上路，第82空降師數千名軍力也奉命赴當地部署。但川普也強調，美伊透過巴基斯坦進行的間接談判進展良好。請繼續往下閱讀...針對美國提出的15點停火方案，德黑蘭已公開回絕。川普29日則在「空軍一號」向媒體傳達相反訊息，聲稱伊朗同意15點協議中的大部分要求，德黑蘭的新管理層非常明理，但仍語帶保留說，「我想我們會達成協議，但也可能不會。」    ,https://news.ltn.com.tw/news/world/breakingnews/5387842
伊朗稱美國和平方案 「不切實際、不合邏輯且過份」,國際,2026/03/30 21:38,埃及、土耳其、沙烏地阿拉伯與巴基斯坦外長致力斡旋美伊和談。（美聯社）路透報導，伊朗30日指出，美國提出的結束中東戰爭方案「不切實際、不合邏輯，而且過份（excessive）」。美國總統川普30日再次要求伊朗立即開放荷姆茲海峽，並快速達成和平協議，否則美國將攻擊其能源基礎設施。全球5分之1的原油與液化天然氣（LNG）供應取道該海峽運輸。請繼續往下閱讀...伊朗外交部發言人巴格赫里（Esmaeil Baghaei）表示，德黑蘭透過中間人取得的訊息顯示，華府願意進行終戰談判。巴基斯坦、埃及、沙烏地阿拉伯與土耳其外交部長29日齊聚巴國首都伊斯蘭城，討論調停事宜。巴格赫里在30日的記者會上批評美國的方案，並表示，「我們的立場很明確，我們是遭受軍事入侵，因此我們所有的努力與力量都聚焦於自我捍衛」。與此同時，一名巴基斯坦安全官員說，目前看來，美國與伊朗的直接會談本週似乎不太可能登場，他補充，「我們正竭力促成會談盡快舉行」。巴格赫里也表示，伊朗國會正考慮退出《核子不擴散條約》。該條約承認各國在不追求核武的前提下，有權發展、研究、生產與使用核能。川普30日在社群媒體上發文說，「雖然已取得重大進展，但如果因任何原因，不能很快達成協議，這種情形可能發生，以及如果荷姆茲海峽不能立即『開放』（Open for Business），我們將炸毀、徹底摧毀他們所有的發電廠、油井與哈格島（以及可能所有的海水淡化廠！），以此來結束我們在伊朗美好的『停留』，這些設施我們刻意未『觸碰』」。    ,https://news.ltn.com.tw/news/world/breakingnews/5387841
美最高法院將審出生公民權 台灣女兒出庭捍衛憲法權利,國際,2026/03/30 21:26,美國最高法院本週將審理在美出生即有公民權的憲法訴訟，代表原告的美國民權聯盟全國法律總監王德棻就是這項原則受惠者，父母來自台灣。（美聯社檔案照）美國最高法院本週將審理在美出生即有公民權的憲法訴訟，代表原告的美國民權聯盟全國法律總監王德棻就是這項原則受惠者，父母來自台灣。她說將以自身經歷捍衛這項憲法權利。美國總統川普（Donald Trump）去年1月20日上任當天簽署取消在美國出生者即有公民權的行政命令，新生兒父母中一人為公民或持有綠卡者才能申請。其後這道命令遭多州法院裁定違反1868年的美國憲法第14修正案，2個聯邦巡迴上訴法院對此發出禁制令。請繼續往下閱讀...美國最高法院去年6月裁定下級法院不得要求於全美執行禁制令，川普政府視為有利其命令，於是就違憲判決提出上訴。美國最高法院4月1日將首度聽取這起憲法訴訟案。「華盛頓郵報」（The Washington Post）報導，美國民權聯盟（American Civil Liberties Union，ACLU）代表因為川普行政命令而將被剝奪美國公民身分的孩子和其父母提出集體訴訟。1日將出庭辯論的王德棻（Cecillia Wang）父母便是台灣留學生，當年生下她時並無美國公民身分。現年55歲的王德棻生於美國俄勒岡州（Oregon），雙親當年是持學生簽證合法來到美國就讀研究所，3年後生下她，她因此具有美國公民身分；但她的父母之後才取得美國永久居留權，其後再歸化為美國公民。王德棻受訪時說：「我會成為1位民權及民事移民律師，有一大部分是受我家庭的移民經歷影響。這起案件和（我辯護過的）其他案件，都是關於捍衛所有人的憲法權利，包括非公民在內。」美國民權聯盟代表的當事人包括1名台灣籍女子，這位在訴訟中化名蘇珊（Susan）的原告已在美國猶他州居住13年，去年4月在美國生下女兒。由於川普的行政命令追溯至去年2月19日之後在美國出生者，使得蘇珊女兒的美國公民資格可能被撤銷，因為直到去年6月提起訴訟時，蘇珊僅持有學生簽證合法居留美國。不過據美國民權聯盟說法，此後蘇珊已取得美國永久居留權。王德棻表示，她曾與蘇珊透過電子郵件聯絡，並表示自己現已過世的雙親也來自台灣。王德棻指出，川普的主張「與所有人對美國公民身分的理解相矛盾。我們的團隊是在捍衛美國的1項傳統」。王德棻曾說，她欣賞加州在歡迎移民方面的歷史，認為這協助創造多元且充滿活力的文化。她也表示，多虧非裔美國人推動的民權運動，促使美國國會在1960年代放寬嚴格的移民法規，讓她的家庭能夠有在美國實現自我的途徑。    ,https://news.ltn.com.tw/news/world/breakingnews/5387825
幫中國吃台灣豆腐？「世界最有禮貌國家」排行榜被日本人罵翻,國際,2026/03/30 20:57,"美國金融公司Remitly近期公布「世界最有禮貌國家」排行榜，中國被列為第4名，引爆大批日本網友質疑。（圖擷取自@BrandonKHill、路透資料照，本報合成）來自美國的數位國際匯款、金融服務公司「Remitly」，近期公布一項名為「世界最有禮貌國家」（The world’s most polite countries）的調查結果與排行榜，日本以壓倒性優勢拿下冠軍。然而，許多日本網友一看到排行第4名的國家是「中國」，立即質疑這個排行榜的可信度，更有日本網友氣憤譴責Remitly，涉嫌幫中國吃台灣豆腐。根據Remitly官網資料顯示，他們詢問來自26個國家的4600人，以自身經歷說出自己認為哪個國家的人民最有禮貌，同時評價自己的禮貌程度，以便了解全球普遍認知與自我認知之間的差異。結果顯示，有1/3的受訪者認為日本人最有禮貌，毫不意外成為「世界最有禮貌國家」冠軍；但在「自認為最有禮貌國家」的排行，日本是倒數第2名。請繼續往下閱讀...Remitly指出，「禮貌」在日本人的日常生活中扮演著舉足輕重的角色，這個國家長期以尊重和睦的文化而聞名，甚至日語也以敬語和禮貌用語為基礎，也進一步強化了體貼他人的重要性。這份排行榜調查結果，在日本社群媒體掀起熱烈討論，不過多數日本網友的關注重點，並非自己國家的排名，而是議論在榜單上名列前茅的「中國」。調查顯示，有約3.07%的受訪者表示他們認為中國人彬彬有禮，而他們認為的「禮貌」，是指受到儒家價值觀影響的傳統文化，也就是強調「尊重」、「階序」以及「社會和諧」，這種禮貌體現在各種面向，從尊敬長輩，到避免直接衝突並以較為含蓄的方式處理分歧，中國人重視維持人際關係，在日常社交互動中展現禮貌與得體。不少日本網友直言，他們無論在日本國內或去海外國家，完全沒有遇過稱得上「有禮貌」的中國人，哪怕撇開小粉紅仇日情結行為，他們看到中國人幾乎都是會直接做出狂飆髒話、大聲喧嘩、亂丟垃圾、破壞環境、隨地大小便等粗魯言行的野蠻人，因此嚴重懷疑Remitly公司是否生活在異次元，或者是收了中國共產黨政府的錢協助大外宣。還有一些日本網友認為，真正名列第4名的國家應該是「台灣」，因為有一些政府組織、公司行號與民間團體會聽令中國政府，做出「把台灣視為中國的一部分」的情況，然而如果有跟台灣人、中國人實際相處過，就會知道哪怕他們都是說中文，但呈現的氣質、談吐、文化或各種生活習慣，完全不可能是同一個國家的人。其他網友則吐槽，「任何一個國家都比第4名有禮貌」、「一個隨地大小便的國家居然排名第4」、「這個榜單是中國人排的嗎？中國怎麼可能第4名」、「一定沒把台灣當國家比較，不然就是台灣被貼標籤吃豆腐」、「單是中國有上榜這點，就代表這個數據完全沒有任何可信度」、「一個禮儀最差、甚至不遵守國際法的國家竟然排名第4，光憑這點就足以讓人懷疑這個排名了」、「Remitly是一家總部位於美國西雅圖的國際匯款公司，簡單說就是替支那洗錢到境外，你會期待他們認知到台灣是台灣？」。世界で最も「礼儀正しい」国ランキング。当然の結果だよね。 pic.twitter.com/upR7rwmQyv— Brandon K. Hill | CEO of btrax ????????x????????/2 （@BrandonKHill） March 28, 2026 世界で最も「礼儀正しい」国ランキング。当然の結果だよね。 pic.twitter.com/upR7rwmQyv世界「最有禮貌」國家排名日本肯定是第一！第四名換成台灣還差不多，怎麼可能是中國？???????????? https://t.co/W9L8f2lIZx— のらいぬ （@JapanBanZaiLove） March 29, 2026 世界「最有禮貌」國家排名日本肯定是第一！第四名換成台灣還差不多，怎麼可能是中國？???????????? https://t.co/W9L8f2lIZx     在 Threads 查看Remitly聲稱，有約3.07%的受訪者表示他們認為中國人彬彬有禮。（圖擷取自「Remitly」官網）    ",https://news.ltn.com.tw/news/world/breakingnews/5387331
最後通牒！若不立即開放荷姆茲海峽 川普：將摧毀伊朗所有發電廠與油井,國際,2026/03/30 20:50,川普要求伊朗立即開放荷姆茲海峽。（法新社）美國總統川普今（30）日指出，如果戰略航道荷姆茲海峽沒有「立即」開放，和平協議不能「很快」達成，美國將「徹底」摧毀伊朗的發電廠、油井與原油出口中樞哈格島（Kharg Island）。川普在「真實社群」發文說，「美國正與一個新的、更加明理的政權進行嚴肅討論，以結束我們在伊朗的軍事行動」。請繼續往下閱讀...川普說，「雖然已取得重大進展，但如果因任何原因，不能很快達成協議，這種情形可能發生，以及如果荷姆茲海峽不能立即『開放』（Open for Business），我們將炸毀、徹底摧毀他們所有的發電廠、油井與哈格島（以及可能所有的海水淡化廠！），以此來結束我們在伊朗美好的『停留』，這些設施我們刻意未『觸碰』」。CNBC報導，川普發表此番言論之際，伊朗戰爭已進入第5週，川普政府正考慮派遣地面部隊佔領哈格島。該島是伊朗石油工業的核心，也是重要的燃料樞紐。    ,https://news.ltn.com.tw/news/world/breakingnews/5387805
美伊緊張對峙  勞伯施奈德籲美國恢復徵兵制,國際,2026/03/30 20:24,美國總統川普的鐵粉、好萊塢知名影星勞伯施奈德近日在社群媒體X發文，呼籲美國恢復徵兵制。（法新社檔案照）在美國與伊朗交戰之際，美國總統川普的鐵粉、好萊塢知名影星勞伯施奈德（Rob Schneider）近日在社群媒體X發文，呼籲美國恢復徵兵制，並稱每位年滿18歲公民都須服2年兵役。美國「新聞週刊」（Newsweek）等媒體報導，勞伯施奈德在X上引用美國前總統甘迺迪（John F. Kennedy）的名言「不要問你的國家能為你做什麼，而要問你能為國家做什麼」，呼籲美國恢復徵兵制。請繼續往下閱讀...他寫道：「我們必須再次承諾，維護一個在上帝庇佑之下、不可分割的國度。因此，我們必須恢復對我國青年的徵兵制。」勞伯施奈德提及：「每一位年滿18歲美國人都須服2年兵役。他們也可以選擇將部分役期以志願形式，在國內或海外服役。」他也寫道：「身為美國公民，讓我們享有無可比擬的自由與機會，令全世界羨慕。然而，我們所珍惜的這些自由並非沒有代價。」勞伯施奈德以「哈拉猛男秀」（Deuce Bigalow: Male Gigolo）、「小姐好辣」（The Hot Chick）等喜劇電影走紅。根據「哈芬登郵報」（HuffPost），勞伯施奈德是川普及其「讓美國再次偉大」（MAGA）運動的鐵桿支持者。    ,https://news.ltn.com.tw/news/world/breakingnews/5387753
美國加強封鎖下 中國共向古巴運送3萬噸大米,國際,2026/03/30 19:57,大米示意圖。（取自免費圖庫pexels）在美國川普政府近來強化對古巴的封鎖下，俄羅斯媒體今天報導，古巴外交部表示，古巴日前已收到來自中國援助的最後一批、總重1.56萬噸的大米，中國方面1月間宣布向古巴援助3萬噸大米自此完成。俄羅斯衛星通訊社報導，古巴外交部透過官網表示，名為Loyalty Hong的輪船，日前將1.56萬噸大米運抵古巴首都哈瓦那港口，以支援古巴的食品供應，這是中國第3艘運送大米等貨物的船隻。請繼續往下閱讀...古巴外交部提到，在中國駐古巴大使館1月間宣布的「人道主義援助架構」內，古巴已收到上述來自中國的最後一批大米，在這項人道主義援助下，中國共向古巴交付了3萬噸大米，並已交付完成。美國總統川普（Donald Trump）今年初派兵赴委內瑞拉強行帶走委國總統馬杜洛（Nicolas Maduro），隨後又對古巴實質上封鎖油源，讓古巴經濟雪上加霜，近期在與以色列聯手攻打伊朗之際又揚言要拿下古巴。而與古巴長期關係良好的中國，對美國的舉動均持反對立場。在此情況下，外電報導古巴總統狄亞士－卡奈（Miguel Diaz-Canel）14日罕見地坦承，古巴民眾因糧食短缺和停電而心生不滿。    ,https://news.ltn.com.tw/news/world/breakingnews/5387761
因應中國軍事擴張 美軍重啟二戰機場強化印太布局,國際,2026/03/30 19:37,美國正著手升級天寧島的機場跑道，因應中國軍事擴張。圖為美軍1架F-15E戰機降落天寧島國際機場。（法新社檔案照）隨著印太地區戰略競爭不斷加劇，美國正悄然修復和翻新第二次世界戰時期在太平洋偏遠島嶼上修建的舊機場，以強化自身防禦能力，因應中國的挑戰。 這些位於天寧島（Tinian）和貝里琉島（Peleliu）上已有80年歷史的機場，最初建於二戰末期，用於打擊日本，如今在美國加強地區軍事佈局的背景下重新投入整修。《德國之聲》報導，在北太平洋，中國船隻頻繁試探南韓和日本的海上權益主張，北京也在台灣附近海域頻繁舉行大規模軍事演習，並聲稱台灣終有一天會與中國「統一」。此外，儘管2016年國際仲裁已否定相關主張，中國仍宣稱南海大部分海域為中國領土。請繼續往下閱讀...特洛伊大學（Troy University ）首爾分校國際關係學教授平克斯頓（Dan Pinkston）表示：「中國無疑是該地區最大的關切所在，這些舉措顯然是在回應中國不斷增強的軍事能力。」平克斯頓指出，中國正試圖突破第一和第二島鏈的限制，以獲得太平洋的自由進入權，而美國恢復這些機場的作戰能力，是為未來可能的局勢升級做準備。分析人士認為，此舉旨在為美國空軍提供替代基地，以分散風險，而不是完全依賴關島北部的安德森空軍基地或日本沖繩島的嘉手納空軍基地。自2023年以來，美國工程人員已開始重鋪天寧島北機場的4條跑道。這些跑道最初建於80年前，每條長約2400公尺。與此同時，美國工程人員從2024年起也在帛琉群島南部的貝里琉島修建長1800公尺的跑道。日本大東文化大學（Daito Bunka University）國際關係教授、軍事問題專家馬洛伊（Garren Mulloy）表示，10年前，美國主要精力還集中在重新評估中東地區的軍事基地，「如今他們已經意識到，自身機場及相關基礎設施在潛在攻擊面前是多麼脆弱」。馬洛伊指出，在此期間，中國在印太地區的行動不斷升級，這個趨勢最初令華府感到震驚，因為過去的美國政府曾認為沒有國家敢在該地區挑戰美國。升級後的基地需要完善的基礎設施，包括新的跑道、滑行道以及停機坪，以防止飛機陷入島嶼上潮濕泥濘的地面。上述2座島嶼常年遭受熱帶風暴的侵襲。此外，還需要電力和水源供應，以及地下燃料儲存設施和加固掩體，以保護飛機、武器及其他物資。分析人士指出，這些基地未來還可能部署雷達和防禦系統。美軍2024年曾受訪指出，正在對部署「愛國者」飛彈防禦系統的選址進行評估。馬洛伊指出，目前雷達和武器系統尚未部署，但相關準備工作正在進行中，在印太地區，美國面臨的首要威脅是中國，但也不能忽視北韓的不確定性，因此為部隊制定備用計劃是明智之舉。馬洛伊表示，北韓曾在2017年宣布1項「周密計劃」，擬使用具備核能力的「火星-12」中程彈道飛彈對關島周邊發動攻擊。該飛彈射程約4500公里，使得安德森空軍基地處於打擊範圍之內。馬洛伊他：「如果該地區爆發重大衝突，無論是在朝鮮半島還是台灣海峽，安德森基地都將成為明顯目標。因此，在整個地區佈局多個替代性設施是明智的戰略。」    ,https://news.ltn.com.tw/news/world/breakingnews/5387756
德軍工巨頭稱烏無人機如「家庭主婦玩樂高」學者：低估新興技術,國際,2026/03/30 19:02,德國軍工巨頭萊茵金屬執行長派培格接受大西洋月刊訪問，形容烏克蘭無人機「像家庭主婦在廚房玩樂高，不是一種創新」，引發熱議。圖為1架透過光纖電纜控制的烏克蘭無人機。（法新社）德國軍工巨頭萊茵金屬執行長派培格接受大西洋月刊訪問，形容烏克蘭無人機「像家庭主婦在廚房玩樂高，不是一種創新」，引發輿論熱議。學者指出，相關言論反映部分歐洲對新興技術的低估。美國雜誌大西洋月刊（The Atlantic）27日刊載德國軍工巨頭萊茵金屬（Rheinmetall）執行長派培格（Armin Papperger）專訪。記者舒斯特（Simon Shuster）詢問他如何看待烏克蘭近年以低成本無人機，有效打擊俄羅斯坦克等傳統裝備時，派培格回應稱「這就像在玩樂高積木」。請繼續往下閱讀...當記者進一步詢問這對萊茵金屬商業模式的意義時，派培格反問「誰是烏克蘭最大的無人機生產商？」並稱相關產品多由「家庭主婦在廚房用3D列印製作零件」，直言烏克蘭無人機不是創新。相關言論隨報導刊出後，在社群媒體迅速發酵。澤倫斯基顧問卡梅辛（Alexander Kamyshin）在社群平台X反駁指出，烏克蘭無人機已摧毀超過1萬1000輛俄羅斯坦克，同時強調烏克蘭女性在軍工系統中與男性並肩工作，值得尊敬。網路上以「#LEGODrones」標籤擴散此話題，不少網友認為，派培格低估烏克蘭在無人機領域的實戰能力，質疑他對當前戰爭型態的理解。柏林全球公共政策研究所（GPPi）共同創辦人班納（Thorsten Benner）批評，派培格的心態是一種「終將被反噬的傲慢」，並以德國汽車產業過去低估中國競爭為例，警告歐洲可能再次低估新興技術帶來的變化。舒斯特指出，烏克蘭目前已成為民主國家中無人機產量最高的國家，且相關技術正吸引歐洲、亞洲與中東多國關注並尋求採購。報導並指出，烏克蘭無人機多由進口零件組裝，包括馬達、攝影機與晶片，其中大多數來自中國，且全球逾8成小型無人機由中國單一企業生產。輿論發酵後，萊茵金屬29日在社群平台X發布聲明，表示對烏克蘭在有限資源下展現的創新能力與戰鬥意志令人敬佩。派培格本人則未回應相關批評。值得注意的是，派培格過去已多次發表類似言論，包括2025年10月及之後的財報說明會與分析師會議，當時未引發廣泛關注。德國產經媒體商報（Handelsblatt）分析，派培格事件彰顯當前戰場現實與傳統軍工產品定位之間的落差。萊茵金屬長期以坦克與火砲等重裝備為核心產品，但在無人機廣泛運用的戰場環境中，其效益受到質疑。萊茵金屬近年也布局無人機與反無人機系統，並推出自殺式無人機等產品，但單價約6萬至8萬美元（約新台幣192萬元至256萬元），與烏方以低成本、大量生產無人機的模式形成顯著差異。    ,https://news.ltn.com.tw/news/world/breakingnews/5387702
伊拉克最大機場深夜多次爆炸！官方證實遇襲 1架軍用運輸機炸毀,國際,2026/03/30 18:35,伊拉克巴格達國際機場附近一處空軍基地遇襲，一架隸屬於伊拉克空軍的安-132運輸機遭摧毀。An-132示意圖，非當事運輸機。（彭博）中東戰火持續延燒，伊拉克最大機場巴格達國際機場（Baghdad International Airport）今日凌晨傳出附近發生多起爆炸事件，伊拉克國防部於台灣時間30日下午證實，位於巴格達機場附近的一處空軍基地遭受攻擊，一架軍用飛機被炸毀。綜合外媒報導，伊拉克國防部表示，巴格達機場西側的穆罕默德阿拉空軍基地（Mohammed Alaa Air Base）於當地時間凌晨1點55分（台灣時間30日上午6點55分）遭遇122毫米「格勒德」火箭彈（122 mm Grad rockets）攻擊，襲擊導致一架隸屬伊拉克空軍的「安東諾夫-132」（Antonov-132）運輸機遭到摧毀，所幸無人員傷亡。請繼續往下閱讀...伊拉克安全部門已展開調查，試圖追查火箭發射來源，並由技術團隊評估基地受損情況。此次襲擊發生之際，中東局勢正因美國與以色列對伊朗的軍事行動而持續升溫。伊朗為了報復美以，對伊拉克、約旦等多個設有美軍基地的波斯灣國家發動無人機與飛彈攻擊，衝突範圍持續擴大。    ,https://news.ltn.com.tw/news/world/breakingnews/5387680
萬那杜外海規模7.3地震 無海嘯威脅,國際,2026/03/30 18:19,南太平洋島國萬那杜外海今天發生規模7.3地震。（圖擷自USGS）美國地質調查所（USGS）通報，南太平洋島國萬那杜外海今天發生規模7.3地震。根據太平洋海嘯警報中心（PTWC），這起地震未引發海嘯威脅。法新社報導，美國地質調查所指出，這起地震發生於萬那杜第二大城盧干維爾（Luganville）東北方約35公里處海域。    ,https://news.ltn.com.tw/news/world/breakingnews/5387675
