Title,News_Type,date,content,url
看守所跨年！台南男灌16瓶啤酒撞死人肇逃 法官裁定續押2月,社會,2025/11/12 21:27,男子吳銘恭疑酒駕撞死人逃匿2日到案，30萬元交保遭駁回，台南地方法院裁定11月14日續押2月禁見，酒駕待釐清。（記者王捷攝）男子吳銘恭在小吃部灌了16瓶啤酒後涉嫌撞死人，還求30萬交保被打臉，台南地方法院認為，他犯後離場又藏匿，仍有逃亡與串證疑慮，很難用具保替代羈押，所以裁定續押並禁見2個月，從11月14日起執行，可能押到跨年。吳銘恭涉嫌酒駕致死，在檢方起訴後，台南地院8月14日訊問，吳男坦承過失致死、過失傷害與肇事逃逸，否認不能安全駕駛致死。從檢方送交的羈押審查資料中可以發現，吳銘恭在小吃部消費單據出現啤酒16瓶與金額8500元等情，法院在原本的裁定認為，是否酒駕與酒測數值仍待釐清，而且吳銘恭否認酒駕的說法與現有資料不吻合，可信度不足，檢方呈現這些說法，用意是認為應該繼續羈押，釐清這些證據。請繼續往下閱讀...法院指出，吳男案發後請友人協助躲避，隔2日才到案，行跡顯示有逃亡與串證可能，基於刑事訴訟法對審判中延長羈押的要件與期間限制，若仍有羈押原因且具必要性，法院可以裁定繼續羈押。合議庭審酌吳男的狀況從收押以來情勢未變，他涉及公共危險致死、不能安全駕駛、過失傷害與肇事逃逸等多罪，情節重大，有續押的必要。羈押期將快到的時候，吳男聲請30萬元交保，他自稱希望外出工作賠償被害人，家中情況也不能讓他逃亡；律師也主張，多名證人已重複受訊，串證可能性低，請求改採具保。法院調卷確認，全案訂於11月24日進行第二次協商程序，但是從客觀情事來看，還是難以保證未來訴訟可以順利進行，因此裁定從11月14日起延長羈押2個月並禁止接見通信。熱門賽事、球星動態不漏接    ,https://news.ltn.com.tw/news/society/breakingnews/5244126
獎落誰家？11/12 今彩539、3星彩、4星彩開獎了,社會,2025/11/12 20:43,今彩539、39樂合彩開獎號碼。（擷取自三立iNEWS《全民i彩券》）今天（11月12日）台彩各項開獎獎項及獎號。今彩539：01、04、09、14、22。請繼續往下閱讀...39樂合彩：01、04、09、14、22。3星彩：781。4星彩：8550。確切中獎號碼以台彩網站公告為主，請見「台灣彩券網站」。3星彩開獎號碼。（擷取自三立iNEWS《全民i彩券》）4星彩開獎號碼。（擷取自三立iNEWS《全民i彩券》）熱門賽事、球星動態不漏接    ,https://news.ltn.com.tw/news/society/breakingnews/5243954
竹聯「明仁會」囚虐逼死詐團成員  主嫌等6人二審加重判刑,社會,2025/11/12 20:43,竹聯幫「明仁會」囚虐逼死詐團成員，高院對6名成員加重判刑。（記者楊國文攝）竹聯幫仁堂明仁會雙和分會分子黃秉森、楊竣祺、鄭向恩等人，懷疑余姓男子私吞詐欺款項180萬元，將余男拘禁4天，持電擊棒等物凌虐及捆綁，余男不堪受虐從8樓廁所窗戶爬出，隨後墜樓死亡，一審依「結夥３人以上強盜罪」等罪，判楊男等6名成員1年10月至8年6月徒刑，檢方和楊男等人均上訴，高等法院今加重改判6人2年至8年9月徒刑。去年6月間，余男墜樓及壓傷路人林女手部，原本以為單純的墜樓死亡案，經檢警追查，發現起因於黃男為首的明仁會分子，涉犯集團性的詐欺犯罪，並懷疑余男侵吞180萬元詐欺款項，6月22日由杜姓男子（通緝中）設局，把余男拐到新北市中和區中山路2段1棟大樓的8樓據點。請繼續往下閱讀...黃男等人沒收余的手機，命令脫去衣物、只著內褲，再以橡膠條、電擊棒及徒手毆打等方式施以凌虐，還有人在旁錄影，打完後拿衣服套住余男頭部及膠帶捆綁，帶到小房間拘禁。余男被迫向親友籌錢，黃等人得手15萬元仍不罷休，同月25日晚間，已遭拘禁96小時的余男，從小房間廁所的窗戶爬出，卻墜落地面，全身多處骨折，送醫途中死亡。檢警查出墜樓真相，逮捕黃、楊等人，到案者起初推說是金錢糾紛，經檢方詳追，查出眾人是懷疑余男私吞詐欺款才設局拘禁、凌虐，最後疑「逼死」被害人，依違反組織犯罪防制條例參與組織罪、刑法強盜及三人以上共同對被害者施以凌虐而剝奪行動自由致死等罪，起訴黃男等6人。新北地院依「結夥3人以上強盜罪」等罪，判楊男等6名成員1年10月至8年6月徒刑，其中黃男判8年6月最重。全案上訴，高等法院認定黃男等6人對被害人余男殘酷凌虐，且拘禁多日，即使其家人已匯款並同意擔任車手還錢，黃男6人仍不讓余男離開，才會發生墜樓死亡意外，一審判刑過輕，將6人刑度全部加重，改判2年至8年9月徒刑，其中黃男重判8年9月，刑責最重。熱門賽事、球星動態不漏接    ,https://news.ltn.com.tw/news/society/breakingnews/5244101
台中太平「番仔路庄」所有權纏訟50年 自救會長疑因敗訴輕生獲救,社會,2025/11/12 20:20,台中太平區番仔路自救會主委林秀芬多年來帶領居民抗爭，今天卻傳出疑因訴訟敗訴輕生獲救。（資料照）台中市太平區新光路一帶的「番仔路庄」所有權纏訟近50年，昨天其中一件訴訟宣判，判決駁回、居民又敗訴，「台中市太平區番仔路自救會」主委林秀芬聆聽後心情低落，今天凌晨3點多到老家想輕生，但因橫梁斷裂墜落摔傷，黎明幼兒園園長林金連發現，趕緊到場協助將她送醫。太平區番仔路自救會之前強調，「番仔路庄」住戶世代在這裡居住超過300年，之前也有繳租金，卻因為「死人和活人買賣」、「代理人變地主」等奇怪的狀況，造成訴訟失利，他們有優先承買權，居民持續進行法院訴訟沒有放棄。請繼續往下閱讀...其中自救會主委林秀芬持續帶領居民進行抗爭、阻擋拆除，之前受訪表示，「番仔路庄」是有300年歷史的聚落，這裡的「土埆厝」保留古建築的美，擋拆是為了保存先民留下的資產，目前已經依文資法程序向市府文化局申請，希望能將整個聚落保存下來，並強調未來只要有人想來拆房子，全村都會團結起來繼續擋拆。不過，居民和地主共進行11件訴訟，其中7件已經定讞、居民都敗訴，因地主提告拆屋還地勝訴，法院之前到林秀芬住家執行強制拆除，居民雖設置路障阻撓，仍被警方和拆屋人員突破完成拆屋，不料昨天其中1件訴訟宣判，法院判決駁回，居民又敗訴，林秀芬為此心情低落。黎明幼兒園園長林金連表示，今天凌晨3點多起床，突然發現林秀芬傳訊息給他，拜託幫忙照顧她的黑狗，因昨天法院判決敗訴，心想「慘了」，趕緊打電話給她，林秀芬接起來說自己在老家輕生，但橫梁斷了摔下來受傷無法動彈，趕緊連絡附近的民眾就近前往照顧並趕到現場。林金連指出，到了現場後發現，林秀芬雖意識清楚，但因摔傷無法動彈，由救護人員送上擔架送醫，檢查發現脊椎疑似有斷裂的情形，目前在醫院治療中。林秀芬疑因昨天1件和地主的訴訟敗訴心情低落，今天凌晨在老家輕生卻摔傷送醫。（擷取自林金連臉書）熱門賽事、球星動態不漏接    ,https://news.ltn.com.tw/news/society/breakingnews/5244082
太子集團豪宅總管凃又文交保檢方抗告 高院裁定駁回確定,社會,2025/11/12 19:44,太子集團台籍核心幹部圖。（本報合成）檢調警日前掃蕩太子控股集團在台開設的公司，以涉嫌組織犯罪、洗錢、賭博等罪，聲押禁見集團的台籍核心幹部辜淑雯、王昱棠、陳志左右手李添的特助李守禮、司機邱子恩4人獲准，另一名幫集團管理台北市11戶「和平大苑」豪宅的「房地產總管」凃又文，涉協助該集團轉移資金，僅被台北地院裁定30萬元交保，台北地檢署以凃女有逃亡及串證之虞提起抗告，高等法院採信一審見解，認定凃女並無串證或滅證之虞，沒有羈押必要，今晚裁定抗告駁回確定。高院裁定指出，北院合議庭認為凃又文涉犯參與組織犯罪、洗錢罪嫌重大，有逃亡之虞，但依據卷內事證，並無串證或滅證之虞，亦無羈押必要，而以30萬元交保並限制住居，並無違誤或不當。請繼續往下閱讀...高院認為，檢察官抗告雖指出，本案尚有共犯未到案，而且凃女確有串證、滅證及逃亡之虞，不過，依凃女到案後情狀及卷內相關事證，凃女並無串證或滅證之虞，且北院諭知的強制處分，對她而言亦有相當強制性，可做為羈押的替代手段，檢方抗告無理由，因此駁回，全案確定。檢警調查出，太子集團來台發展主要是將境外黑錢洗白，一是發展線上博弈，二為置產買「和平大苑」、名車等，２道命令都與陳志及其親信李添有關，調派資金則須通過稽核財務的新加坡籍女子陳秀玲，三人是決策階層，台籍幹部是執行者；在台幹部以辜、王的層級最高，一個負責找工程師撰寫線上博弈程式等，一個負責購買豪宅等任務，凃女則是受聘管理豪宅、繳管理費等工作。在美方發布制裁太子集團相關新聞後，我專案小組迅速掌握太子集團在台北市「和平大苑」地下停車場停放的多輛名車，10月底前往確認車籍資料時，應管委會要求出具公文，管委會將此資訊告知凃女，她獲知後向上回報。李添輾轉獲知此事後，跨海遙控手下把車處理掉，李守禮將勞斯萊斯等4部名車過戶給車商等人，邱子恩則將7輛名車開走藏匿。此外，凃女也涉嫌奉命把台灣太子集團帳戶內部分款項移轉到同集團、未被美方制裁的尼爾公司，被專案小組鎖定偵辦，認定凃女有羈押必要。熱門賽事、球星動態不漏接    ,https://news.ltn.com.tw/news/society/breakingnews/5244054
滿堂紅餐飲公司淪詐團洗錢共犯 檢警拘提20人、負責人遭聲押,社會,2025/11/12 19:05,台北地檢署日前偵辦假投資、假檢警詐騙案件，發現知名餐飲公司蔡姓負責人涉嫌協助詐團洗錢，蔡女被拘提到案，移送台北地檢署複訊。（記者廖振輝攝）首次上稿 16:03更新時間 19:05（新增餐飲公司名稱、負責人全名及處分結果）台北地檢署日前偵辦一起假投資、假檢警詐騙案件時，發現有1億多元贓款流向14家公司，當中包含知名滿堂紅餐飲公司。進一步追查發現，該公司負責人蔡閔如，涉嫌協助詐團洗錢。檢警昨起兵分32路進行搜索，並拘提蔡女等20人到案，釐清案情。全案依加重詐欺、洗錢及組織犯罪等罪嫌偵辦。檢察官訊後，向法院聲請羈押蔡女。請繼續往下閱讀...檢警調查，該詐騙集團利用假檢警、假投資等方式，於今年4到8月間，共詐騙18名被害人，共取得9億多的現金、黃金或是匯入集團指定帳戶中。偵辦人員破獲該集團後，進一步追查贓款流向，發現當中有1億多元分別轉進滿堂紅餐飲公司的帳戶及其他相關帳戶內，共有14家。進一步追查，當中包含滿堂紅餐飲公司在內的9家公司，均由蔡姓女子實質掌控。據悉，蔡女涉嫌利用開設虛假發票等方式，幫忙詐團將錢洗白，再從中領出交付給詐團成員。該類型洗錢手法不同以往，之前查獲的方式，大部分是找殭屍或人頭公司進行洗錢，此次則是透過營業中的公司協助犯罪，較為罕見。台北地檢署檢肅黑金專組主任檢察官曾揚嶺、檢察官陳雅詩昨日起指揮刑事局、台北市中正一分局、中山分局等單位，兵分32路，前往各涉案公司進行搜索，另也拘提蔡姓主嫌等20人到案查證。除了主嫌蔡閔如被聲押外，掛名負責人鍾勝全、雷姓男子，被檢察官諭知50萬元交保，並限制住居；其餘共犯分別依10萬元不等金額交保，亦限制住居。滿堂紅國際餐飲公司掛名負責人鍾勝全複訊後，檢察官諭知50萬元交保，並限制住居。（記者廖振輝攝）熱門賽事、球星動態不漏接    ,https://news.ltn.com.tw/news/society/breakingnews/5243711
李明宗17年前也勒斃姊弟戀女友 醫護人員批：到陰曹地府教化吧！,社會,2025/11/12 19:00,警方17年前在李明宗勒斃歐姓婦人的地點蒐證。（資料照）李明宗2段「姊弟戀」都因對方想分手，他無法控制情緒，衝動勒斃對方，最終悲劇收場，堪稱超恐怖情人。10日負責救護的醫護獲悉案情，在臉書貼文怒斥：「殺人兇手只坐10年牢就放出來了，可教化？到陰曹地府教化吧！」2008年，李明宗32歲時曾在超商工作，認識同在超商工作的45歲歐姓婦人後，雙方開始交往，當時歐婦仍有婚姻關係、丈夫長年在中國經商。2008年7月間，李男不滿歐婦想分手，到歐婦的楊梅住處，向對方女兒謊稱歐婦要他前來，拿了存摺後，隨即離開；當天下午近3點，李男打電話給歐婦女兒說：「我做了傻事，殺了妳媽媽；我太愛你媽媽！」歐婦女兒嚇一大跳，趕忙前往李明宗所說的陳屍地點，歐婦已氣絕多時。請繼續往下閱讀...李明宗勒斃歐婦的案件最終判刑18年6月，李男2019年假釋，後來前往觀音區1處工廠擔任作業員多年，再於去年7月間在美髮店結識周女，展開另一段姊弟戀。豈料周女想要跟李明宗分手，10日清晨與李明宗談判時被勒斃，李男供稱，他因情緒激動又自殘而昏倒，直到醒轉後才報案。當天下午2點多，李男被送醫治療，周女的親友獲知，衝到醫院急診室想要痛毆李男未果，警方說，案發前周女親友似不知李男有殺人案前科，得知後都非常氣憤。目睹過程的醫護人員也PO文痛批：「周姓女子的親友撕心裂肺地想要攻擊李男，但打不到…兇手只坐10年牢就出來了，可教化？到陰曹地府教化吧！」相關新聞：狠殺2女！桃園惡男殺死「前前女友」曾入獄 再殺害前女友而收押桃園惡男勒斃前女友！17年前也曾殺害姊弟戀對象熱門賽事、球星動態不漏接    ,https://news.ltn.com.tw/news/society/breakingnews/5243991
社群冒名招募工作人員、索個資 竹縣府、公所緊喊假的勿信！,社會,2025/11/12 18:55,詐騙無孔不入，湖口鄉公所緊急在網路等管道嚴正聲明，提醒鄉親留意勿上當。（擷取自湖口鄉公所臉書粉專）新竹縣芎林鄉日前有1名婦人，聽信「普發現金1萬元」遭他人盜領，被騙80餘萬元；大新竹跨年晚會、以及竹北市公所、湖口鄉公所等政府機關，近來也陸續發現遭有心人士利用，以招募工作人員、免費課程招生等理由，索取民眾個資，縣府及公所忙著廣為宣導，提醒鄉親務必提高警覺。湖口鄉長吳淑君表示，近期發現有不明人士冒用「湖口鄉公所」名義設立粉絲專頁，以相似名稱與圖像誤導民眾。為免民眾遭人利用受騙，公所緊急在網路等管道嚴正聲明，請鄉親辨識唯一的官方粉專的特徵，包括名稱為「湖口鄉公所」無空格、粉絲數/追蹤數為破萬人、官方頁面顯示「政府機構」認證標示。請繼續往下閱讀...此外，也出現假冒「新竹縣湖口鄉公所」LINE、臉書帳號，聲稱免費課程招生中。吳淑君提醒鄉親，公所不會主動以私訊要求個資、金錢或帳號操作。民眾若接獲可疑訊息，請勿點擊不明連結或回覆個人資料。此外，新竹地區近來屢出現冒充官方招募工作人員的假訊息。新竹縣政府提醒，近期有人在網路散布「2026大新竹跨年晚會 招募工作人員」不實訊息，請鄉親務必提高警覺，不要加陌生帳號、不要提供個資，只要有一絲懷疑，請立即撥打165反詐騙諮詢專線。2025竹北半城路跑預計12月6日登場，竹北市公所日前也在臉書粉專公告，路跑活動未招募任何現場工作人員，請大家務必提高警覺，小心詐騙，避免個資外洩或財務損失。另公所也曾接獲市民反映，收到自稱「新竹縣竹北市公所」LINE帳號訊息，索取個人資料，聲稱可以幫忙報名免費課程，請市民朋友切勿相信！普發現金政策正實施中，縣府警察局也指出，日前芎林鄉1名婦人接獲假檢警電話詐騙，以「普發現金1萬元」遭他人盜領為說詞，要求婦人線上報案，假檢警聲稱婦人涉及洗錢案要求監管帳戶，騙取婦人的存摺及金融卡，最終婦人沒領到1萬元，存摺內80餘萬元已被詐騙車手提領一空，才警覺受騙趕緊報案。湖口鄉長吳淑君提醒鄉親， 公所不會主動以私訊要求個資、金錢或帳號操作。民眾若接獲可疑訊息，請勿點擊不明連結或回覆個人資料。（擷取自網路）竹北市公所在臉書粉專公告，提醒市民務必提高警覺小心詐騙，避免個資外洩或財務損失。（擷取自竹北市公所臉書粉專）竹北市公所在臉書粉專公告，提醒市民務必提高警覺小心詐騙，避免個資外洩或財務損失。（擷取自竹北市公所臉書粉專）近期有人冒充官方，在網路散布「2026大新竹跨年晚會 招募工作人員」不實訊息，新竹縣政府請鄉親務必留意不要受騙。（新竹縣政府提供）熱門賽事、球星動態不漏接    ,https://news.ltn.com.tw/news/society/breakingnews/5243999
長照悲歌！8旬婦悶死照顧52年重障兒 法官判2年半建請總統特赦,社會,2025/11/12 18:29,涉嫌殺子的80歲劉婦被判2年6月徒刑，法官並在判決書中建請總統予以特赦。（資料照）台北市松山區81歲劉姓婦人，長期照料患有重度小兒麻痺的52歲林姓么子，心力交瘁下又擔心自己年事已高，若自身過世，將無人照料兒子，也不想連累其他家人，前年5月以膠帶封住兒子口鼻致死。台北地院今年5月依家暴殺人罪將劉婦減刑輕判2年6月徒刑，並在判決書中建請總統予以特赦；二審高等法院11日開庭，劉婦律師主張劉婦是「謀為同歸於盡」，因兒子真的死了而受到驚嚇才未輕生。二審昨進行準備程序，法官特地問劉婦關於死者生前的狀況，劉婦說兒子只會聽、無法說話，只能用眼神看、示意，她每天會餵他吃4餐，兒子餓了也不會說，家人發現他身體癱軟才會知道他餓了，若他尿急時就會有想下床的較激烈反應，照顧時要很留意兒子的反應和眼神；法官問她為何用膠帶？她回稱本來想用棉被，但擔心不會成功，「用棉被很難死」。請繼續往下閱讀...辯護律師主張劉婦實是「謀為同歸於盡」，但因兒子真的死亡後，受到驚嚇才未輕生，她並非真的想殺害兒子，而是絕望下的表現，劉婦么兒殘疾50多年，無法自理生活，都靠劉婦全心照顧，她不可能再犯，沒有執行刑罰必要，律師請求再減刑或特赦。判決指出，劉婦與90歲林姓丈夫育有3子，么兒自小患有重度小兒麻痺，2023年5月12日清晨趁菲籍看護離開兒子房間時，將門反鎖，將裝有1萬元現金的紅包袋塞入兒子口中，再以口水巾、膠帶摀住兒子口鼻致窒息而亡。看護上午7時許發現林男倒臥床上，口鼻纏著膠帶氣絕，劉婦呆坐一旁不停哭泣，見狀立即通知劉婦二兒媳，兒媳報警處理，警消到場時林男已明顯死亡。劉婦坦承殺子，供稱她身體狀況不佳，擔心自己將不久於人世，老公中風不良於行，另2子也已各組家庭，么子的照顧與醫療費用高昂，她擔心自己過世後無人照料么兒，或造成其他家人的負擔，決定一了百了。台北地院合議庭裁定本案不採行國民法官制，由職業法官合議庭審判長歐陽儀、受命法官蕭淳尹、陪席法官趙書郁審理。殺人罪最輕本刑為10年以上，合議庭認定劉婦符合自首減刑規定。合議庭並考量劉婦照顧兒子半個世紀，還賣房子籌措照顧費，為子跌倒骨折，心臟也裝支架，依刑法59條「情堪憫恕」再減刑，但案發時她僅79歲，不符80歲的再減刑要件，經2次減刑後仍只能判最輕刑期2年6月；且因未達刑期2年以下的緩刑必要條件，因此不得緩刑。一審判決書特地提到，本案源於極其特殊而複雜的動機，且難以再犯，不論從應報、一般預防、特別預防的刑罰目的而言，都沒有執行宣告刑的必要，但若不執行，難以想像可能會使社會上其他照顧者有恃無恐，恣意殺害被照顧者，但劉婦的情況確實特殊，犯罪情狀有顯堪憫恕之處，建請總統依赦免法規定，對她特赦。熱門賽事、球星動態不漏接    ,https://news.ltn.com.tw/news/society/breakingnews/5243947
造謠捐80億歐元換蕭美琴演講 男回國嗆：把反串文當真的腦子有問題,社會,2025/11/12 18:20,陳姓男子（坐輪椅者）貼文「法國BBC報導台灣捐了80億歐元」換來副總統蕭美琴赴歐洲演講，今天入境桃園機場時被警方攔下，要求協助釐清。（記者朱沛雄攝）副總統蕭美琴7日於歐洲議會舉行的對中政策跨國議會聯盟（IPAC）大會中發表演說，帳號caffrey802的陳姓網友發文說，「法國BBC報導台灣捐了80億歐元，然後讓副總統上去噴了20分鐘的口水，80億歐元拿來建設台灣不知道有多少？拿來普發不是比你在上面噴口水來得好！」總統府事後澄清並報警。陳男下午搭機返回台灣，警方到桃園機場請他協助釐清。陳男向媒體記者說，那篇貼文是轉發，一看就知道是反串文，「光是法國BBC就夠扯了，覺得真是太好笑必須要轉發」。陳姓網友涉嫌在網路散布不實言論，遭警方鎖定。刑事警察局掌握他在下午3點左右搭境桃園機場，通知移民署國境事務大隊在陳男通關時攔截。陳男得知警方意圖，同意協助釐清，刑事局員警借助航警局保安大隊一隊辦公室為陳男製作筆錄，陳男完成筆錄後，已經與刑事局員警依同離開桃園機場。請繼續往下閱讀...陳男去製作筆錄途中，媒體問他為何要發這篇文、80億歐元這數字是從哪得知？陳男回應，Threads上很多人在講在轉發，這是一則反串文，光是法國BBC就夠扯了！正常人都看得出是反串文，會把它當真的人是腦子有問題，這個真的太好笑了，必須要轉發。至於這麼做有沒有犯法？陳男說，這就是一則反串文有反什麼法？就是覺得好笑才發文，現在連發自己覺得好笑的文章都不可以了嗎？陳男（坐輪椅者）聲稱只是轉發Threads貼文，正常人都看得出是反串文，會把它當真的人是腦子有問題。（記者朱沛雄攝）陳男（坐輪椅者）入境桃園機場被警方攔下，要求協助釐清。（記者朱沛雄攝）熱門賽事、球星動態不漏接    ,https://news.ltn.com.tw/news/society/breakingnews/5243924
