Title,News_Type,date,content,url
童子瑋允市長任內 基捷一定實質動工,政治,2026/06/14 05:30,民進黨台灣好生活基隆場登場，行政院秘書長張惇涵（前左三）和政務委員季連成（前右二）挺基隆市長參選人童子瑋（前右三）。（記者盧賢秀攝）民主進步黨「台灣好生活」縣市政策說明會昨天基隆場在慶安宮舉行，基隆子弟行政院秘書長張惇涵、基隆女婿行政院政務委員季連成連袂挺基隆市長參選人童子瑋，未來中央地方連線建設基隆。童子瑋表示，「基隆捷運」攸關基隆未來，進度不能延宕，未來若擔任市長，任內一定實質動工，讓基隆產業有發展、市民通勤更便捷。張惇涵說，中央這十年來在基隆已經投入了一千五百多億的預算，讓基隆有脫胎換骨的機會，希望未來中央地方能夠連線，繼續為基隆打拚。季連成則說明掃毒政策，將強力嚇阻毒品、強力掃蕩和重罰，他下週會召集相關部會開始推動防毒的工作。請繼續往下閱讀...童子瑋表示，基隆是全台通勤比例最高的城市之一，將近三分之一的市民每天往返雙北工作、就學，交通不只是建設問題，更是生活品質與城市競爭力問題。未來會從基隆捷運、公車路網、轉運節點與通勤效率等面向著手，讓市民每天通勤更順暢。他承諾未來如果擔任市長，任內基隆捷運一定實質動工。童子瑋強調，基隆現在面對高齡化、少子化、人口外流、交通瓶頸與產業轉型等挑戰，他提出敬老金、身心障礙三節慰問金加倍，「生、托、養、學」四大育兒藍圖，要擴大基隆醫療量能，強化急重症、兒童醫療與巡迴醫療服務，照顧長輩、支持青年、守護孩子。    ,https://news.ltn.com.tw/news/politics/paper/1758750
藍揮刀文化部媒宣費 綠批：向台灣文化宣戰,政治,2026/06/14 05:30,民進黨政策會執行長吳思瑤。（資料照）國民黨立委翁曉玲近日提案，將文化部編列的新台幣四七三八萬元媒宣費全數刪除，並減列影視及流行音樂產業局六成媒宣費。對此，民進黨立委批評，此舉不僅阻撓推廣國內文化政策，並削弱文化外交軟實力，恐使國際僅剩下中國聲音，讓台灣文化人被綁進中國市場；結合中共統戰措施，形同向台灣文化宣戰。拆掉台灣文化的舞台國際恐僅剩中國聲音翁曉玲將矛頭從外交部媒宣費，轉向文化部。民進黨立委吳思瑤昨受訪指出，國民黨從去年起，便將大幅刪減外交相關預算列為既定策略，試圖讓台灣在國際上被「噤聲」；在官方外交面臨打壓的困境下，「文化外交」即是台灣公眾外交的活路。請繼續往下閱讀...吳思瑤回顧，近年台灣不論是搭配東京奧運、巴黎奧運，或是近期的大阪世博，皆成功以文化力將台灣帶向世界。若將國際媒宣費扼殺，不僅是拆除台灣文化團隊的發揮舞台，更將重創文化外交，造成國際上只剩下中國的聲音。當台灣文化力無法走向國際，可能迫使台灣文化人配合中國的對台相關措施，被綁進中國市場。在國內層面，吳思瑤指出，若媒宣費被全數封殺，文化部將無法向大眾推廣，包括文化幣等重大政策，或是各項優質的國內文化展演，直接阻斷文化部門與人民溝通的管道。吳思瑤也透露，因總預算遲未通過審查，許多既存文化館舍的延續性計畫與新額度經費皆無法如期動支。國民黨既不排審預算，又大刀砍預算的做法，正是傷害、壓迫文化。民進黨立委林宜瑾則提出主決議批評，國民黨聯手民眾黨，對台灣文化的針對性打擊從不間斷，先是濫刪、濫凍文化部預算，又排除掉其提出的一切追加需求。劣跡斑斑已屬誇張，但在國民黨主席鄭麗文等「促統頑固分子」跪叩中共總書記習近平後，恐怕將變本加厲。林宜瑾提醒，鄭麗文等人從中國搬回十項統戰措施，其中甚至宣示要協助習近平推動台灣做出符合中共官方觀點的影視作品，明目張膽將獨裁中國的思想審查標準搬到台灣，無非是向台灣文化宣戰，同時也是威脅、挑釁我國民主制度。為了守護並向世界推廣台灣文化，文化部應有更加積極的因應作為。    ,https://news.ltn.com.tw/news/politics/paper/1758680
《不要政治口水》沈伯洋喊蔣萬安回歸市政 公開要求與蔣辯論,政治,2026/06/14 05:30,民進黨台北市長參選人沈伯洋（右二）關切捷運信義東延段進度。（記者方賓照攝）民進黨台北市長參選人沈伯洋昨日行程滿檔，上午前往關切台北捷運信義東延段進度，下午又至後站商圈參加戰鬥陀螺活動，現場還與全國冠軍進行表演賽切磋，五歲的女兒也在現場奶音幫爸爸加油，場面十分溫馨；晚間則至北投石牌福星宮參拜，並與里民互動。沈伯洋昨受訪表示，自從參選這幾個禮拜來，每兩三天都會提出一些市民反映的市政議題，很希望台北市長蔣萬安能回歸到市政討論，親自進行回答並進行辯論。沈伯洋是戰鬥陀螺愛好者，他昨天下午前往後站商圈戰鬥陀螺爭霸戰開幕式，媒體問，台北市議會民眾黨團有送台北市長蔣萬安一顆「蒼龍勇氣」陀螺，這顆陀螺怎麼樣？沈則專業分析，認為這是好陀螺，但已經有點跟不上版本。請繼續往下閱讀...參加戰鬥陀螺賽 女兒奶音加油現場也安排沈伯洋與第一屆三v三最強店家爭霸戰全國冠軍選手陳俊翰對決進行陀螺對戰，沈伯洋特別帶著自己收藏的陀螺前來對戰，比賽規則先取得四分者獲勝，不過全國冠軍實力果然堅強，沈伯洋堅持不久後便以〇比四敗下陣來，但能和愛好者一起玩也讓他非常開心，他笑著與對方握手致意，並頒發獎品陀螺。蔣提監院議題 挨批心不在台北沈伯洋昨受訪說，蔣萬安為什麼對軍購、總預算都不發聲，卻提出監院的議題，顯然蔣的心已經不在台北市，議員有提到周邊商家都很關心捷運，是否串聯周邊讓商家活絡，這件事情才重要，希望蔣能回歸市政討論，我們為市民發聲不是為了政治口水，是因為關心這個城市。沈伯洋在後站商圈也提到，產業發展與補助，過往許多都是針對單一商家，但現在中央有很多補助是針對「聚落型」，如果台北市也有這樣願景針對聚落、整體一起發展的補助，相信會對商圈更好，未來他也會提出這樣的市政願景。    ,https://news.ltn.com.tw/news/politics/paper/1758735
焦點評論》中共兩手策略的政治道具,政治,2026/06/14 05:30,國民黨副主席張榮恭（左）昨於海峽論壇開幕式前，會見中國全國政協主席王滬寧（右）。（國民黨提供）記者方瑋立／特稿第十八屆「海峽論壇」昨在廈門登場，中共全國政協主席王滬寧再彈「一中原則」與「九二共識」老調，大談兩岸融合發展；國民黨副主席張榮恭與金門立委陳玉珍等人則爭相附和，繼黨主席鄭麗文之後，又甘願淪為中共對台統戰的舞台道具。然而，在所謂「兩岸一家親」的話術背後，中共正以海警船為主力，在第一島鏈對各國步步進逼。國民黨的綏靖態度，不只無益於台海現狀穩定，更向國際社會傳遞了嚴重錯誤的降伏訊號。今年四月，鄭麗文才剛風光赴中，標榜著「和平之旅」與習近平握手言歡，現實卻是中共對台軍事施壓絲毫未減，軍機、海警艦侵擾台灣海空域的行徑更是變本加厲，加劇我前線官兵的戍衛壓力。請繼續往下閱讀...放眼當前國際局勢，無論是俄烏戰場或中東情勢皆出現和緩轉折，加上今年預期的三次「川習會」，北京當局已不敢在軍事層面上貿然升溫。取而代之的，是將「灰色地帶」衝突極大化。中共明確將海警、海上民兵等工具「武器化」，作為低限度武力衝突的主力軍隊，頻繁對台灣、日本、菲律賓等第一島鏈的民主盟友進行襲擾與施壓。面對此一威脅，民主盟邦正尋求跨國的海上聯合執法與情報分享，化解經濟海域爭議並組成「聯合戰線」，共同對抗無視國際海洋法、意圖顛覆區域秩序的極權中國。但國內在野陣營竟也附和中國論述，將此扭曲為我「喪權辱國」。中共在第一島鏈頻頻亮劍，國民黨人士當起應聲鳥也得心應手，企圖用民生便利掩蓋暗藏的致命威脅。以預計今年底完工的廈門「翔安機場」為例，該機場距離金門僅約三公里，中方搭配預留金廈大橋金門段、倡議共用航空站等手段，行「招降與招安」之實。一旦中方挑起戰端，那填海造起的廣大停機坪恐瞬間淪為共軍陸航直升機與特戰部隊實施機降、對金門發動突襲的「前進基地」與「機降跳板」，嚴重壓縮我軍防衛縱深及反應時間。這簡直是現代版的特洛伊木馬，而藍營城主卻還在爭相幫忙開城門。值此步步進逼的國安危機，中國正上演一手「極限施壓」、一手「融合發展」的大戲。當中共的「真艦隊」在海上興風作浪，鄭麗文卻還沉迷於中國古裝劇，把被共軍嘲諷為「粉底液將軍」的男星張凌赫，當成兩岸破冰的統戰靈藥。國民黨對著螢幕裡的假將軍猛拋媚眼，卻對眼前步步進逼的真槍實彈視而不見。這種寧可粉墨登場、充當中共統戰舞台道具的「粉底液黨」，才是真正的喪權辱國。    ,https://news.ltn.com.tw/news/politics/paper/1758716
美國防授權法案擬建台戰備庫存 學者：提高台灣續戰力,政治,2026/06/13 23:20,"美國聯邦參議院軍委會通過「2027財政年度國防授權法案」，授權戰爭部為台灣建立戰爭儲備存量計畫。（擷取自美國聯邦參議院官網）美國聯邦參議院軍委會日前通過2027財政年度國防授權法案，內容包括授權戰爭部為台灣建立戰爭儲備存量計畫。學者指出，台灣四面環海，戰時不一定能從境外獲得物資，美國立法部門盼透過建立戰備存量，讓台灣擁有更高的續戰能力。美國聯邦參議院軍委會11日通過2027財政年度國防授權法案（National Defense Authorization Act, NDAA），根據參院軍委會2027財政年度國防授權法案摘要，授權戰爭部為台灣建立戰爭儲備存量（War Reserve Stockpile）計畫。請繼續往下閱讀...台灣大學政治系副教授陳世民告訴中央社記者，中國對台威脅一直存在，當戰爭爆發後，無人能預知會進行多久，例如俄烏戰爭已爆發超過4年、美伊戰爭也尚未停戰，烏克蘭在戰爭爆發後可透過陸路得到歐洲國家支援；但台灣四面環海，中國攻台必然會封鎖台灣周邊，台灣就無法獲得武器裝備，因此建立戰爭儲備對台灣很重要，而美國參議院軍委會顯然看到問題。陳世民說明，俄烏戰爭與美伊戰爭已經凸顯無人載具是未來重要關鍵，若要讓中國軍隊無法登陸台灣，透過無人載具擊毀中國軍機艦是重要關鍵，也就是美方所提讓台海成為「地獄景象」（hellscape）概念；但無人載具等相關生產預算在軍購特別預算被刪除，他期盼台灣能儘早建立無人機產能，以及與美方合作生產無人載具。淡江大學國際事務與戰略研究所副教授林穎佑指出，美國聯邦參議院軍委會通過的2027財政年度國防授權法案包含為台灣建立「戰爭儲備存量」，顯示參院擔心台灣的彈藥存量與備戰韌性有所不足，而美國聯邦眾議院軍委會日前通過2027財政年度國防授權法案，其中包括為「台灣安全合作倡議」提供最高10億美元資金，協助台灣自我防衛。近期帶領學生赴美國華府參訪的林穎佑表示，此代表美國參、眾兩院都有援台方案，透過立法部門來督促行政部門，以各式各樣的方式幫助台灣，美國不是只有行政端的官員、專家關注台海，國會也有許多議員與幕僚關心台灣議題，也顯示台美之間的互動關係，不只行政部門的互動重要，與國會端的互動一樣重要。針對建立戰爭儲備存量的重要性，林穎佑提到，從俄烏戰爭與中東戰事的經驗可發現，武器彈藥的消耗量非常大，且中國海上武力近期許多動態都是在演練拒止、隔離作為，導致台灣在戰時能否從境外獲得運補出現疑問；因此，美方現在的作為，顯然是希望將裝備與彈藥運送至包含台灣在內的第一島鏈，預先建立存量讓台灣有更高的續戰能力。美國聯邦參議院軍委會通過總額高達1.15兆美元的「2027財政年度國防授權法案」。（擷取自美國聯邦參議院官網）    ",https://news.ltn.com.tw/news/politics/breakingnews/5471318
訪視埔里「愚人之友」長照機構  卓揆:長照3.0加碼失智照護,政治,2026/06/13 22:36,行政院長卓榮泰13日訪視南投「愚人之友」綜合長照機構，與住民親切互動。（行政院提供）行政院長卓榮泰今（13日）天訪視南投縣埔里「愚人之友」綜合長照機構時表示，我國全齡失智人口將近40萬人，且持續上升中，並有年輕化趨勢，今年上路的「長照3.0」即編列1153億元預算，並同步升級「失智症防治照護政策綱領暨行動方案3.0」，加強照顧失智民眾。卓榮泰表示，「家，是最好的處方箋」，感謝埔里基督教醫院在過去社福觀念尚未普及的時代，率先在偏鄉地區創院，並於921地震隔年成立「愚人之友基金會」，給予失智者如同家庭一樣的關懷與溫暖。請繼續往下閱讀...卓揆強調，他已指示衛生福利部研議是否將各類失智資源納入「長照3.0」機制，做全面有效的照顧，尤其針對「愚人之友綜合長照機構」執行長李希昌提出的人力配比、收案限制、服務員難尋難留、家屬負擔沉重、不能收自費及喘息個案，也不能聘用外籍機構看護工等訴求，衡量是否能夠提供協助，例如採彈性放寬喘息服務、運用外國技術人力或受過訓練的外籍機構看護工輔佐本國照服員，抑或導入AI人工智慧科技輔具、防跌監測系統，代替人力的幫忙，對於照顧者與被照顧者而言都是非常需要的服務。卓揆也提及「失智友善臺灣777」目標，指目前失智症獲得診斷及服務比率超過7成、失智家庭照顧者可獲得支持和訓練的比率超過7成，但對於全國民眾對失智有正確認識及友善態度7%的設定目標應再檢討予以提高，讓更多民眾對於失智症能有更普遍且正確的認識，進而讓政府在整合社區、企業和社會各方面力量，擬定失智者照護相關政策過程中有更清楚的方向。    ,https://news.ltn.com.tw/news/politics/breakingnews/5471392
出席海峽論壇簽約儀式 張榮恭：台灣禁止縣市長參加是「歷史倒退」,政治,2026/06/13 22:35,國民黨副主席張榮恭今晚出席海峽論壇「十項促進兩岸交流合作的政策措施對接簽約會」。（國民黨提供）國民黨副主席張榮恭今晚出席海峽論壇「十項促進兩岸交流合作的政策措施對接簽約會」時致詞強調，台灣農漁民的產品行銷到大陸來只是為了生計，如果還要遭到抹黑打壓，那絕對「天理不容」。張榮恭質疑，這次首次發生台灣縣市長被禁止參加海峽論壇，令人遺憾。但「歷史不能倒退」，只要對兩岸基層民眾交流合作有利，就沒有什麼力量能阻止自發性的互利行為。請繼續往下閱讀...張榮恭致詞全文如下：尊敬的宋濤主任，各位貴賓，大家傍晚好。稍後我們要共同見證的簽約儀式，是台灣農產品拓展大陸市場新階段的開頭，未來還會有後續，非常值得期待。相信這是關心台灣基層民眾生活的人們共同的願望。台灣各縣市的農特產品，是台灣各地人民辛勤勞動的結晶，也是台灣風土人情的代表。兩岸農漁產品交流合作，是促進兩岸人民相互理解的重要渠道，也是增進台灣基層人民生活福祉最實在的方式，向來是我們中國國民黨所重視。自海峽論壇開辦以來，台灣各地方縣市首長率團來參加，已經形成一個慣例，這是非常稀鬆平常的事，是一個很好的平台和機會，能讓大陸民眾知道台灣各地特色，推銷拓展各縣市農漁特產品能夠到大陸來，有利於增進台灣基層民眾的福祉，對兩岸人民都有利，絕對沒有什麼壞處。上個月大家看到美國總統川普訪問北京，他帶領了17位國際超級的企業家，顯然，這些超級企業家的財富無可限量，但也都還要拓展大陸市場。我們台灣農漁民的產品行銷到大陸來，只是為了生計而已，如果還要遭到抹黑打壓，那絕對「天理不容」。接著，首次發生台灣縣市長被台灣方面禁止來參加海峽論壇的情況，令人遺憾。但歷史不能倒退，只要對兩岸基層民眾交流合作有利，那就沒有什麼力量能阻止自發性的互利行為。過去國民黨執政時期，兩岸交流非常頻繁，大陸遊客絡繹不絕的到台灣觀光旅遊。不僅很方便的品嘗到台灣新鮮美味水果，感受當地民眾的熱情，還可以將一些特產，像鳳梨酥、烏龍茶等帶回大陸分享給親友。兩岸人民之間的情感聯繫，就是要透過親身接觸不斷積累善意。而雙方基層民眾生活福祉的提升，就是要經由經貿往來。今年四月，中央台辦發布「十項促進兩岸交流合作的政策措施」，受到台灣各界的關注。尤其是涉及到航班航點的增加、觀光旅遊的開放，以及農漁產品開放等，都攸關台灣基層民眾福祉，所以特別受到重視。兩岸交流合作，本來就應該是這樣一種相互欣賞、自我提升、互利共贏的過程。大陸方面可以在政策上給予積極的引導和協助，讓更多的大陸消費者，即使沒有到台灣，也能體驗到台灣的美味和人情，有利於兩岸人民和諧相處。今天的簽約儀式，非常感謝兩岸雙方有關方面的努力促成，未來我樂見還有更多的項目持續落實，引領推進台灣社會支持兩岸互利合作的主流民意不斷提升。國民黨將和大家一起持續努力。祝稍後簽約儀式圓滿成功，謝謝大家    ,https://news.ltn.com.tw/news/politics/breakingnews/5471393
75年來首位華人女會長！台灣張麗莉奧地利接任「世界不動產聯合會」會長,政治,2026/06/13 21:42,張麗莉（右）成世界不動產聯合會75年來首位華人女性會長，盧秀燕前往祝賀。（市府提供）世界不動產聯合會（FIABCI） 新舊任會長12日在奧地利交接，新任會長由現任中華民國不動產協進會理事長暨FIABCI台灣分會會長張麗莉接任，成為FIABCI成立75年來首位華人女性會長。正在歐洲訪問的台中市長盧秀燕也前往見證，肯定來自台灣、台中的張麗莉創下歷史，更是該會首位來自台灣的女性世界會長，讓台中市民都感到無比驕傲。請繼續往下閱讀...盧秀燕訪歐行程12日抵達奧地利，先前往巴登市政府會晤國會議員兼市長辛策麗（Carmen Jeitler-Cincelli），就議會體制、城市行銷、觀光產業、教育政策等議題進行交流。盧秀燕指出，巴登市擁有悠久的音樂與藝術傳統，曾是貝多芬、莫札特等音樂家常駐之地；台中則擁有歌劇院、媽祖遶境、爵士音樂節等文化特色，與巴登市的攝影節、皇家帝國節、葡萄酒節等慶典相互輝映，期待未來雙方能建立更緊密的合作關係。當晚盧秀燕另出席「世界不動產聯合會（FIABCI）」新舊任世界會長交接晚宴，現任中華民國不動產協進會理事長暨FIABCI台灣分會會長張麗莉，在FIABCI第76屆世界年會中正式接任2026-2027世界會長一職，也成為FIABCI 成立75年來首位華人女性會長。盧秀燕說，張麗莉自台中，她更創下該會首位來自台灣的女性世界會長歷史，讓台中市與有榮焉，「2026年世界不動產聯合會國際貿易交流會 （2026 FIABCI International Trade Mission）」，今年9月將在台中舉辦，台中市政府將全力支持世界會長張麗莉，確保盛會圓滿成功。張麗莉（中）成世界不動產聯合會75年來首位華人女性會長，盧秀燕前往祝賀。（市府提供）盧秀燕拜會國會議員兼巴登市長辛策麗。（市府提供）    ,https://news.ltn.com.tw/news/politics/breakingnews/5471374
出席海峽論壇開幕式 張榮恭：兩岸一家不可分,政治,2026/06/13 21:27,國民黨副主席張榮恭在海峽論壇開幕致詞。（國民黨提供）國民黨副主席張榮恭今在廈門舉辦的第18屆海峽論壇開幕致詞表示，國民黨對於「和平興台」責無旁貸，兩岸各界應堅定民族認同與政治互信，才能共創和平。他以四句話概括:「中華兒女不忘本，兩岸一家不可分，台灣大陸共攜手，和平繁榮同此心」。願大家共勉。張榮恭表示，福建特別是金門與廈門，過去曾是戰地，是對峙的前線。但兩岸各界都不會容許歷史再逆轉，而須堅定推進交流合作。未來台閩持續推進交流合作，不僅將保障兩岸關係和平發展，也將成為亞太地區和平與繁榮的重要支撐。請繼續往下閱讀...張榮恭表示，來自台灣的男士們，一定記得當年在服兵時，每天必唱一首軍歌：「我愛中華、我愛中華，文化悠久，物博地大，開國五千年，五族共一家，中華兒女最偉大!」面對兩岸關係，我用四句話概括:「中華兒女不忘本，兩岸一家不可分，台灣大陸共攜手，和平繁榮同此心」。願與大家共勉。    ,https://news.ltn.com.tw/news/politics/breakingnews/5471371
深知原民母語傳承不易 「阿美族媳婦」蘇巧慧重申3大原住民族政見,政治,2026/06/13 21:07,民進黨立委、新北市長參選人蘇巧慧（右）今（13）日出席由新北市原住民族Sa’icelen協進會主辦的「新北原住民族語言傳承及文化發展青年論壇」。（蘇巧慧辦公室提供）民進黨立委、新北市長參選人蘇巧慧今（13）日出席由新北市原住民族Sa’icelen協進會主辦的「新北原住民族語言傳承及文化發展青年論壇」。身為阿美族媳婦的她表示，她了解族語承傳不易，因此提出「三大原住民族政見」，其中便希望針對「原住民族語言能力認證獎勵級別」增加初級、中級兩項級別，創造更友善族語學習環境、推動原民母語與傳統文化傳承。與會原民青年向蘇巧慧分享在現代社會學習族語的現實和困境，蘇巧慧回應，她育有2個阿美族孩子，非常了解族語傳承的困難，新北原住民族人口是六都第二高，未來如果有機會，她會將照顧族人的預算翻倍，讓照顧跟著翻倍，同時增加對原民社團補助，並開辦「原住民族租金補貼」，針對家庭成員在新北市無自有房屋的族人，提供租金補貼，還要擴大辦理「歲時祭儀交通補助」，增加補助範圍和項目。請繼續往下閱讀...與會新北市議員宋雨蓁Nikar．Falong、馬見Lahuy．Ipin指出，原住民族的文化在過往威權政府統治下遭到打壓，導致文化和語言嚴重流失，肯定蘇巧慧長期對族人的照顧、對原民母語發展、傳承不遺餘力。宋雨蓁表示，「新北需要一位真正了解族人，和族人站在一起的新北市長」，祝福蘇巧慧年底順利當選。與會烏來區代表布落．馬信說，蘇巧慧的競選主軸「溫暖、創新、會做事」不只是口號，更是她落實在每一天的行動，也期盼新時代的新北市，能夠有創新思維的首長，為族人朋友打造更好的生活。民進黨立委、新北市長參選人蘇巧慧今（13）日出席由新北市原住民族Sa’icelen協進會主辦的「新北原住民族語言傳承及文化發展青年論壇」。（蘇巧慧辦公室提供）    ,https://news.ltn.com.tw/news/politics/breakingnews/5471341
