Title,News_Type,date,content,url
美學者：川普未在台灣問題上讓步  美中立場未改變,國際,2026/05/15 08:05,川普與習近平會後共赴北京歷史悠久的天壇，川普被追問是否談到台灣，他僅說：「很棒的地方…國很美」，並未針對台灣問題做出回應。（美聯社）針對川習會解讀，美國學者祁凱立指出，川普避開在公眾場合回答台灣問題是個好的回應，以免失言偏離美國既有政策，成為北京日後對美交涉依據。前美國駐俄羅斯大使麥弗爾表示，就目前所知情況來看，川普並未在台灣問題上做出未經深思熟慮的讓步。美中兩國元首川普（Donald Trump）與習近平14日在北京舉行會談。雙方在會中談到台灣議題。兩人會後共赴北京歷史悠久的天壇，在短暫接受媒體拍攝時，川普被追問是否談到台灣，他僅說：「很棒的地方…國很美」，並未針對台灣問題做出回應。請繼續往下閱讀...美國政治學者祁凱立（Kharis Templeman）認為這是個正面的結果。祁凱立接受中央社訪問指出，危險的地方在於，川普可能在公開場合脫口說出某些偏離美國既有政策的內容，或設下新的先例，讓中國日後要求美國總統依循相關表述；而川普未說任何話，「我認為那是他能做得最好的事…這對台灣來說也是正面的」。祁凱立表示，北京未必期待川普在台灣議題上失言，但若川普說出偏離美國既有政策的內容，中方將樂見其成。習近平措詞強硬但也並非新的說法。整體來看，這次會談並未顯示美中在台灣議題上的立場出現改變，雙方也不會有任何更深層的相互理解。中方發布的內容指出，習近平於會談上表示「台灣問題是中美關係中最重要的問題」，警告若處理不好，將導致兩國擦槍走火。白宮聲明則未提到習近平針對台灣的發言。祁凱立指出，北京一貫不希望台灣議題和其他議題掛鉤，並強調台灣是核心問題，如果希望美中關係中的其他事情取得進展，就必須按照中方期待來處理台灣問題；而美方立場則是，「我們不一定同意，而且我們會在台灣問題上做我們必須做的事情」。整體而言，祁凱立認為，這次會談不算突破，但仍具重要象徵意義。中方為促成川普到訪展現一定讓步；雙方預計這一年還要碰面，中國也可能在特定議題上加大施壓。關注台灣議題的前美國駐俄羅斯大使麥弗爾（Michael McFaul）今天在X平台上指出，他在會前曾表示，「最糟糕的結果會是，川普過於急切地想宣布一項重大的經濟協議，因此公開釋出一個訊號，就是相較於歷任的總統，他對台灣的支持更少」。麥弗爾說，就目前所知情況，川普並沒有在台灣問題上對習近平做出任何不謹慎的讓步，這算是個好消息，他視為一項勝利，而接下來仍要密切關注後續的發展。    ,https://news.ltn.com.tw/news/world/breakingnews/5437505
川普：習近平承諾不提供伊朗軍事裝備 願助荷姆茲海峽開放,國際,2026/05/15 07:30,川習會14日登場。（美聯社）美國總統川普正訪問中國，昨日並與中國國家主席習近平舉行峰會。針對伊朗議題，川普稱中國國家主席習近平提議，由中國協助確保通過荷姆茲海峽的航行，並承諾中國不會向伊朗提供軍事裝備。不過對此說法中國並未做出回應。據外媒報導，針對伊朗議題，白宮方面稱，川普與習近平於週四舉行了「良好」的會晤，雙方一致認為荷姆茲海峽「必須保持開放，以保障能源自由流動」。白宮也指出，習近平也明確表示，中國反對荷姆茲海峽軍事化，反對任何對其使用收取通行費的做法。請繼續往下閱讀...川普週四在接受福斯新聞（Fox News）採訪時指出，習近平表示不會向伊朗提供軍事裝備，川普並稱「他（習）非常堅定地這麼說。」「他希望能看到荷莫茲海峽開放，因為北京從該地區大量購買石油」。川普也稱習表示「如果我能提供任何幫助，我都願意」。針對雙方是否討論到中國對伊朗的支持，川普則稱：「你說『支持』，他們又沒跟我們打仗什麼的。他說不會提供軍事裝備。這可是個大新聞」。目前中國當局尚未對川普的說法作出回應，由中國外交部發布的川習會談紀錄，也未提及伊朗或荷姆茲海峽。    ,https://news.ltn.com.tw/news/world/breakingnews/5437498
促中國施壓伊朗停戰 川普還沒用殺手鐧,國際,2026/05/15 06:24,美國總統川普（左）與中國國家主席習近平（右）14日參觀天壇。（法新社）首次上稿 5-14 22:45更新時間 5-15 06:24美國總統川普這次訪問中國行前，外界預期美國將尋求身為伊朗重要盟友的中國，協助解決伊朗戰爭，美國國務卿魯比歐也在隨同前往中國途中，表達華府希望北京在促使伊朗停止目前在荷姆茲海峽所作所為上，發揮更積極作用。不過，路透分析認為，北京另有利益考量，美國的盤算未必會如願。請繼續往下閱讀...路透13日報導，根據兩名簡報川習會規劃的消息人士透露，川普幕僚認為，中國是伊朗石油最大買家，也是少數能說服德黑蘭決策者敲定與華府協議的國家之一，華府希望說服北京，現在結束戰爭符合中國利益。然而，中國國家主席習近平或許會同意，在敦促伊朗領導階層回到談判桌上「推一把」，但是不太可能願意切斷對這個北京在中東最重要夥伴的經濟支持，或者停止供應伊朗軍方所需的軍民兩用物資。分析指出，川普雖握有施壓中國的工具，包括威脅制裁中國大型銀行，但是，動用這些手段，美國可能也要付出高到難以承受的代價。中國也另有其他利益要權衡。北京一方面希望荷姆茲海峽恢復開放，這條水道也攸關中國的石油進口；但是另一方面，伊朗是中國在此重要區域的戰略盟友、抗衡美國的力量，這場戰爭雖令中國經濟承受痛苦，卻也分散美國在外交和軍事上，對印太的注意力。華府智庫「戰略暨國際研究中心」（CSIS）高級研究員李文（Henrietta Levin）指出，川普去年在關稅戰上退一步、伊朗戰爭正分散美國在中國「後院」的軍事力量，這些都讓習近平以「高漲的自信」姿態面對川普這次訪問。川普可對中國施壓的選項有限，包括制裁、關稅，和其他一些可能性較低的手段。美方近日已對部分協助伊朗規避制裁的中國實體祭出制裁，但是專家指出，這些行動並未大幅改變相關貿易流動。風險顧問公司Obsidian Risk Advisors常務負責人艾瑞克森（Brett Erickson）說，這是因為華府未動用幾個關鍵籌碼，包括將矛頭鎖定協助與伊朗貿易的中國銀行，美國財政部「就是不願意對真正重要的中國銀行採取任何行動」。華府不願出手制裁中國銀行業，反映出不確定可能會招來什麼報復行動。美國智庫「外交關係協會」（CFR）地緣經濟中心主任費希曼（Edward Fishman）指出，即便制裁中國小型、中型銀行，都可能引發螺旋式升高的報復循環，使雙方重燃代價高昂的貿易戰及3位數關稅，鑑於通膨的衝擊，這將為川普帶來政治傷害。美國若制裁中國大型國有銀行，也可能引發北京動用其最大籌碼：關鍵礦產。中國幾乎壟斷全球稀土精煉和加工，去年貿易戰期間，曾威脅限制稀土之供應，令西方官員警戒，也促使美中達成脆弱的貿易休兵。    ,https://news.ltn.com.tw/news/world/breakingnews/5437365
受訪稱美國對台政策不變 魯比歐：中國武力奪台會是「可怕錯誤」,國際,2026/05/15 06:08,美國總統川普（中）與國務卿魯比歐（右）14日在北京，與中國國家主席習近平及中國官員會談。（歐新社）首次上稿 5-14 22:24更新時間 5-15 06:08隨美國總統川普訪問中國的美國國務卿魯比歐，14日在川普與中國國家主席習近平會談後，接受訪問表示，美國對台灣政策未改變，若中國試圖以武力奪取台灣，會是「可怕的錯誤」。請繼續往下閱讀...根據美聯社、美國國家廣播公司（NBC）14日報導，魯比歐在川普與習近平會談後，接受NBC訪問，被問到習近平向川普提到，台灣是美中兩國關係中最重要的問題，魯比歐提出上述說法。魯比歐證實，習近平在14日的會談中提出台灣問題，他說，「到今天為止、到我們今天舉行過的會談為止，美國對台灣問題的政策沒有改變」；中國通常會在會談提出台灣問題，「我們向來是表明我們的立場，然後接下去討論其他議題」。被問到是否認為中國想侵略台灣，魯比歐表示，「我們認為，透過武力或者任何那種性質的方式達成（中國與台灣統一），會是可怕的錯誤」，並且不只對美國，也會對全世界造成衝擊。    ,https://news.ltn.com.tw/news/world/breakingnews/5437402
川習會後美中關係能改善？ 專家不以為然：中國有太多「前科」,國際,2026/05/15 06:07,川習會備受國際關注。（美聯社）首次上稿 00:37更新時間 06:07川習會14日登場，兩大國領導人互動來非常友好。不過，印太戰略智庫執行長矢板明夫說，美中很多時候都是談了之後問題才浮上檯面，因為中國常常不兌現在談判桌上做出的承諾，惹怒美國。請繼續往下閱讀...矢板明夫14日深夜在臉書發文說，「川習會今天在北京登場。表面上看，是兩個大國領導人的峰會。實際上看，雙方的姿態完全不同。中國非常積極，也非常重視這次溝通。北京鋪紅毯、高規格接待，習近平也把台灣問題放在最重要的位置。這說明，中國最希望透過這次會談，讓美國在台灣問題上做出某種表態，至少希望川普降低對台灣的支持力道。」「但是，從目前公開的訊息來看，中國最期待的台灣問題，並沒有任何實質結果。白宮公布的會談重點，主要是貿易、經濟合作、伊朗、荷姆茲海峽等議題，並沒有出現北京想要的『台灣突破』。這對中國來說，恐怕是最大的失望。」他接著說，「相反地，美國這邊顯得相當輕鬆。川普此行最明顯的目的，是為美國企業爭取利益，打開中國市場。最有象徵性的畫面，就是最後一刻讓輝達執行長黃仁勳登上空軍一號，一起飛往北京。這是一個非常清楚的訊號。川普是帶著美國企業、科技實力和市場籌碼去談判的。當然，因為目前還沒有公布具體協議，最後成果如何，還要繼續觀察。」矢板明夫話鋒一轉寫道，「但我認為，這次川習會仍然可能有一個好的結果。那就是黎智英。川普過去曾表示會向習近平提出黎智英問題。這種事情不一定會在公開場合大聲宣布，但水面下雙方一定有溝通。如果川普回國後不久，黎智英能夠以保外就醫或其他方式，被允許離開香港、到海外接受治療，那將是一個非常重要的人權外交成果。對川普來說，這會讓他的國際聲望繼續高漲；對北京來說，也是一種不必公開認錯、但可以緩和國際壓力的處理方式。」矢板明夫最後直言，「很多人期待美中關係改善，我也希望世界不要走向戰爭。但這幾年的經驗告訴我們，美中關係往往不是『只要開始談，關係就會變好』。相反地，很多時候是一談之後，問題反而更清楚浮上檯面。主要原因很簡單，因為中國在談判桌上常常做出很多承諾，但事後不兌現，惹怒美國。所以，這次川習會不能只看笑容、紅毯和合照。真正要看的，是中國會不會兌現承諾；美國能不能拿到實際利益；以及黎智英能不能重獲自由。」    ,https://news.ltn.com.tw/news/world/breakingnews/5437452
中國制裁是什麼？魯比歐跟習近平握完手  對川普做1動作被拍到！,國際,2026/05/15 06:06,"魯比歐和習近平握手。（路透）首次上稿 5-14 23:22更新時間 5-15 06:06過去遭中國制裁的美國國務卿魯比歐（Marco Rubio），近日隨總統川普訪問中國，14日他和中國國家主席習近平握手的畫面在網上掀起熱烈討論，不少眼尖網友還注意到他握完手之後，朝川普眨了一下眼，引發聯想。請繼續往下閱讀...魯比歐過去擔任參議員時，因為對中強硬立場，2020年兩度（7/13、8/10）遭中國外交部宣布制裁。當時魯比歐相當不以為然，表示中方制裁對他而言就像是一種象徵他挺身捍衛人權、譴責新疆和香港問題的「榮譽勳章」；他甚至還說過，自己根本沒打算去中國。後來川普回鍋白宮，魯比歐上任國務卿，這時中國政府相當尷尬，只好做了些「小動作」，將Rubio的譯名從原本的「盧比奧」改成「魯比奧」，以為這樣就能掩飾曾經制裁現任美國國務卿的事實。本月13日至15日川普訪問北京，魯比歐也隨團出訪，14日上午川習會登場前，習近平也與魯比歐握手，該畫面被拍下後隨即在網上掀起熱議。有眼尖網友還注意到，跟習近平握完手後，魯比歐看向川普，眨了一下眼睛。網友們紛紛幫魯比歐上OS，「魯比歐：總統你看 習禁評（習近平）是不是忘記他在制裁我了」、「盧：你看，我也是照樣進中國還握到手」、「你制裁我，然後幫我改名，然後跟我握手」、「那個要笑不笑的臉有點哭」、「嘴角還偷偷閃現了一小撮微笑」、「他們應該有賭10美金」、「你看，他根本不敢抓我，笑話一個」、「就說他不敢啦」。Interesting little moment during the U.S. delegation visit to China today ????Right after shaking hands with President Xi, Marco Rubio seemed to give a quick playful wink/look toward President Trump behind him.????????????????????@realDonaldTrump @marcorubio pic.twitter.com/ZXgEzfqJAi— 51520 （@bensonlan） May 14, 2026 Interesting little moment during the U.S. delegation visit to China today ????Right after shaking hands with President Xi, Marco Rubio seemed to give a quick playful wink/look toward President Trump behind him.????????????????????@realDonaldTrump @marcorubio pic.twitter.com/ZXgEzfqJAi     在 Threads 查看    ",https://news.ltn.com.tw/news/world/breakingnews/5437249
川普與歐巴馬訪中待遇大不同  顏擇雅揭中共外交兩面手法！,國際,2026/05/15 05:58,川普抵達北京後，中方大陣仗歡迎。（法新社）首次上稿 00:34更新時間 05:58美國總統川普出訪北京與中國國家主席習近平會晤，中方擺出大陣仗盛大歡迎，不少人翻出10年前時任總統歐巴馬訪中的冷清畫面做比較。對此，作家顏擇雅表示，從這邊就能看出，中共吃軟不吃硬！請繼續往下閱讀...顏擇雅14日在臉書發文，「中國歡迎川普的電視畫面，怎麼看怎麼尷尬。但我想，習近平用意應該是要全世界都看到中國對於川普的熱烈歡迎。但我覺得那畫面，跟十年前歐巴馬抵達杭州的畫面實在是太強烈的對比。歐巴馬當年，別說沒有群眾歡迎，中方甚至連下飛機的階梯與紅毯都沒提供。逼得歐巴馬那次只能從空軍一號的機腹下飛機。外媒當時都用『snub』（冷落，怠慢）這個字，意思就是中共在給臉色。」她接著說：「以今天的後見之明，歐巴馬是多邊主義者，對中國算是鴿派，中國怎反而給他那種待遇呢？川普對中國算不算鷹派當然有討論空間。但美中貿易戰是他發動，這點應無疑義。川普治下的美國從歐洲加速抽身，三番兩次恐嚇要併吞格陵蘭，強烈主張要改善美俄關係，種種不可思議的作為，目的都是要對抗中國，這些也沒有疑義。結果北京決定如此盛大歡迎川普到訪。」最後顏擇雅表示，「這傳達出什麼訊息？你對中國彬彬有禮，像歐巴馬那樣，中國就給你臉色看。你作勢要拔槍，中國反而發動群眾歡迎你。這就是這次歡迎場面傳達出來的訊息。」歐巴馬10年前訪中畫面。（法新社）    ,https://news.ltn.com.tw/news/world/breakingnews/5437458
在阿曼灣遭伊朗劫持船隻身分曝 是艘「海上軍火庫」,國際,2026/05/15 05:56,據查證，遭伊朗劫持的船是懸掛洪都拉斯國旗的「Hui Chuan」號。（擷取自MarineTraffic網站）首次上稿 01:10更新時間 05:56英國海事貿易行動中心（UKMTO）說，一艘船在阿曼灣遭劫持，「正駛往伊朗領海」。英國海事安全公司Vanguard則指出，這艘船是「海上軍火庫」，被伊朗軍方扣走。請繼續往下閱讀...Vanguard確認，遭伊朗劫持的船是懸掛宏都拉斯國旗的「Hui Chuan」號。BBC Verify查閱MarineTraffic船舶追蹤數據，它最後一次通報位置是在週三，地點位於阿拉伯聯合大公國富查伊拉（Fujairah）東北方70公里（40英里）。「Hui Chuan」號營運方告訴Vanguard公司，這艘船是「海上軍火庫」，為保護海上船隻免受海盜襲擊的保全公司儲存武器。BBC先前曾報道，這些船駐紮在紅海、亞丁灣和阿曼灣，以便保全人員收發軍火彈藥。    ,https://news.ltn.com.tw/news/world/breakingnews/5437465
美CIA局長哈瓦那會官員　古巴：擬加強安全合作,國際,2026/05/15 05:54,古巴政府在國營媒體發布的聲明中表示，由美國中央情報局（CIA）局長雷克里夫（John Ratcliffe）率領的美國代表團，今天在哈瓦那（Havana）與古巴內政部的對口官員會面。古巴國營媒體「古巴辯論」（Cuba Debate）發布的聲明指出：「雙方也強調，為了兩國安全及區域和國際安全，他們有意發展執法機構之間的雙邊合作。」請繼續往下閱讀...古巴政府也表示，已向美國代表團表明，古巴不會對美國國家安全構成威脅。根據路透社目擊者觀察，在這份聲明發布前，今天下午曾見到一架美國政府專機自哈瓦那國際機場起飛。美國總統川普日前曾表示，這兩個長期敵對國家將「開始對話」。（編譯：李佩珊）1150515    ,https://news.ltn.com.tw/news/world/breakingnews/5437484
川習會：伊朗不能擁有核武 習近平講台灣 美國隻字未提,國際,2026/05/15 05:30,中國國家主席習近平與美國總統川普14日上午在北京人民大會堂舉行雙邊高峰會議。中方出席代表包括習近平在內共有13人，美方包括川普在內共11人（大圖，法新社）。曾負責台灣事務、支持台灣發展不對稱作戰的美國國安會亞洲事務資深主任簡以榮（右下圖，資料照），坐在後排全程列席。美國總統川普與中國國家主席習近平十四日上午在北京人民大會堂舉行高峰會，歷時兩小時十五分。川普表示，雙方對話「極為正面且富有成效」。不過，習近平會談中對台灣問題發出強烈警告，稱若處理失當，可能使兩國「碰撞甚至衝突」。川普抵達後獲高規格接待，並多次稱讚習是「偉大領袖」與「朋友」，表示美中將擁有「美好的共同未來」。川普晚間在國宴中宣布，已邀請習與夫人於九月廿四日訪問白宮。習致詞時引用川普口號，稱中國發展可與「讓美國再次偉大」並行不悖。請繼續往下閱讀...習稱台灣問題 是中美最重要問題習在開場時強調，中美「應成為夥伴而非對手」，並聚焦台灣議題，稱台灣問題是中美關係最重要的問題，台獨與台海和平水火不容，維護台海穩定是中美最大公約數，若處理不當，「兩國可能發生碰撞甚至衝突，使整體中美關係陷入極度危險局面」。習也提及「修昔底德陷阱」，指外界關注中美能否避免因新興強權挑戰既有強權而走向戰爭，並表示期待建立「中美建設性戰略穩定關係」。白宮會後發布會談紀要 未提台灣川普則高度評價與習的私人關係，稱希望建立「有史以來最好的中美關係」。雙方並就國際問題交換意見。白宮會後發布會談紀要，未提及台灣，但表示雙方討論擴大經濟合作與中國增加對美投資，並同意加強打擊芬太尼流入、增加中國採購農產品。雙方也認為荷姆茲海峽應維持開放，反對海峽軍事化以及收取通行費，並同意伊朗不能擁有核武。    ,https://news.ltn.com.tw/news/world/paper/1754815
趁美打伊戰 美情報：中國四處擴展優勢,國際,2026/05/15 05:30,晚宴上川普入座前，與習近平握手並拍了下他的手臂。（法新社）華盛頓郵報十三日獨家披露，一份在美國總統川普展開因伊朗戰爭而推遲的訪中行之際流傳的美國情報評估機密報告顯示，伊朗戰爭已對全球雙強美中的競爭造成影響，北京正利用此戰擴大在軍事、經濟、外交與其他領域上的優勢，該報告讓五角大樓內部警覺到為伊戰付出的地緣政治代價。這份為美國參謀首長聯席會議主席凱恩準備的報告，使用國權四大工具—外交、資訊、軍事與經濟的DIME框架，來評估中國對伊朗衝突的回應。報告中指出，自二月底美伊戰爭爆發以來，中國已對美國在波斯灣地區的盟國軍售，以助其抵禦伊朗飛彈與無人機攻擊。此外，在荷姆茲海峽因戰爭被封鎖後，北京也出面協助世界各國滿足能源需求。請繼續往下閱讀...在此同時，伊戰消耗掉大量在短時間難以補足的美國軍備，令台灣、日本、南韓以及其他盟友擔憂，這可能影響美國在台海衝突時出面干預的能力。至於美國軍事裝備與設施在伊戰中被破壞或受損，則讓北京得以觀察到美國的作戰方式，以及從中學習如何規劃其未來軍事行動。此外，北京還將外界對伊戰的批評納入其大外宣，站在道德制高點上將美國描繪成一個咄咄逼人、秉持單邊主義的沒落大國，藉此轉移外界對中國嚴重侵犯人權與脅迫亞洲各國的注意力。專家指出，該報告發現，像是在北京提供軍火給美國盟友的同時，也強化美中權力均勢正倒向北京的共識。智庫「新美國安全中心」資深研究員史托克斯直言，「伊朗戰爭極大幅改善中國的地緣政治地位。」川普曾稱荷姆茲海峽封閉嚴重影響中國石油供應，但該報告指出，中國憑藉發展再生能源與擁有豐富石油儲備而挺過缺油。智庫「布魯金斯研究所」中國專家何瑞恩說，中國是全球排名第二最不受伊戰能源危機影響的國家，僅次於美國，並藉此在海外拓展邦誼，提供航空燃油與其他短缺的能源產品。包括泰國、澳洲、菲律賓與其他國家，都在伊戰後就能源供應與北京有所接觸以及取得解方。何瑞恩說，這不是利他，而是北京伺機離間美國及其傳統夥伴，因為川普政府一改往例對在能源危機時出面協助友邦不感興趣。    ,https://news.ltn.com.tw/news/world/paper/1754827
