Title,News_Type,date,content,url
英國王撤銷胞弟安德魯王子頭銜 下令搬出皇家莊園,國際,2025/10/31 06:11,英國國王查爾斯3世（右）已撤銷胞弟安德魯（左）的王子頭銜，並令他搬離位於溫莎城堡附近的皇家豪宅。（法新社檔案照）在龐大的輿論與政治壓力下，英國王室30日宣布，國王查爾斯3世已撤銷胞弟安德魯（Andrew）的王子頭銜，並令他搬離位於溫莎城堡（Windsor Castle）附近的皇家豪宅，以懲處他與已故美國性犯罪者艾普斯坦（Jeffrey Epstein）的關係引發醜聞，有損王室形象。路透報導，現年65歲的安德魯是已故英國女王伊莉莎白2世的次子，多年來因為與艾普斯坦的關係且行為多所爭議，飽受輿論抨擊。本月稍早，他已被迫停止使用「約克公爵」（Duke of York）封號。請繼續往下閱讀...查爾斯如今進一步採取行動，正式撤銷安德魯的所有頭銜，使其名號僅剩「安德魯‧蒙巴頓‧溫莎」（Andrew Mountbatten Windsor）。白金漢宮聲明指出，安德魯已正式接獲通知，必須交還皇家莊園（Royal Lodge）租約，搬到英格蘭東部的私人住所。皇家莊園是位於倫敦西郊歷史悠久的王室宮殿，是溫莎城堡周邊莊園內的大型房產。王室聲明強調，儘管安德魯否認針對他的指控，但這些究責措施仍被視為必要，「國王與王后願明確表示，他們的心意與最深切的同情，一直並將繼續與所有形式受虐事件的受害者與倖存者同在。」王宮消息人士透露，這項決定由查爾斯作出，且獲得包括王位繼承人威廉王子在內的王室成員支持。近幾週來，英國媒體開始聚焦於安德魯的財務狀況。「泰晤士報」指出，他在這棟30個房間的豪宅裡住了20年，期間並未支付租金，但在搬入時自費約750萬英鎊（約3億台幣）進行整修。英國國會1個委員會29日質疑，安德魯是否應該繼續住在皇家莊園。這是國會對王室成員罕見的政治介入。安德魯是王位第8順位繼承人，曾在1980年代初與阿根廷的福克蘭戰爭期間服役。但他在2011年被迫辭去英國貿易特使職務，2019年全面退出王室職務，2022年因遭控性行為不當而被剝奪軍方職位與王室贊助，但他始終否認相關指控。去年1項法院裁決也揭露，英國政府認為，安德魯的1名親密商業夥伴是中國間諜。當時，安德魯說他已與該名商人斷絕所有聯繫。熱門賽事、球星動態不漏接    ,https://news.ltn.com.tw/news/world/breakingnews/5229562
睡眠不足恍神時大腦發生這變化 啟動「強制清理」機制,國際,2025/10/31 05:58,研究人員推測，當睡眠不足，大腦會開始補償未能進行的「清潔」工作，即使代價是暫時性失去專注力。示意圖。（情境照）首次上稿 10-30 23:43更新時間 10-31 05:58你是否曾經因為睡眠不足，而在開會或開車時短暫「恍神」？過去一直難以確定，大腦在這種注意力暫時不集中時，究竟發生了什麼事。美國麻省理工學院（MIT）29日發表的研究，揭露這種時刻腦部的運作過程，比表面上看起來的還要複雜。請繼續往下閱讀...《衛報》29日報導，MIT電機工程與電腦科學副教授路易斯（Laura Lewis）與同事楊子農（Zinong Yang，譯音）對26名自願者試驗，受試者在經過一晚充分睡眠、和一晚完全沒睡後，接受兩項專注力測試，一項聽聲音、一項是螢幕出現的十字隨機變成方形時，要盡快反應，測試時以功能性磁振造影和腦電圖，觀察其腦部活動。受試者睡眠不足時，反應慢得多，甚至完全沒反應，而掃描結果顯示，恍神時正好與一波腦脊髓液進出大腦同時發生。這種類似「沖洗」大腦的活動，通常在深層睡眠階段發生，據信有助於大腦「沖掉」一天下來累積的代謝廢物。路易斯說，「當一個人注意力不集中的那一刻，正是這股液體開始一波脈動的時刻」。研究人員推測，當睡眠不足，大腦會開始補償未能進行的「清潔」工作，即使代價是暫時性失去專注力。楊子農說，「你的大腦非常需要睡眠，盡量設法進入類似睡眠的狀態，來修復一些認知功能，你的大腦的液體系統透過反覆在高專注和高流動狀態間切換，來促使大腦修復功能」。這份研究報告29日在《自然神經科學》（Nature Neuroscience）期刊發表。研究中也觀察到，在腦脊髓液波動前約12秒，受試者瞳孔就開始收縮，在恢復專注力後回到正常狀態；此外，呼吸和心率也在恍神時下降。英國失智症研究院（UK DRI）主任威斯登（Bill Wisden）指出，目前還不清楚，這對大腦來說是保護還是有害。倫敦大學學院神經科學家柯多薩奇（Ria Kodosaki）認為，暫時失去專注力或許是大腦保護自己的方式，「可以把它們想成強制短暫進站休補：大腦暫時放下對外部的專注，來進行必要的內部清理」。熱門賽事、球星動態不漏接    ,https://news.ltn.com.tw/news/world/breakingnews/5229534
"美軍拉美轟毒梟只向共和黨簡報  民主黨批違背傳統",國際,2025/10/31 05:45,美國總統川普政府就美軍對加勒比海上疑似毒品船隻動武，舉行一場僅限共和黨參加的簡報。民主黨重量級議員華納今天抨擊這種作法凸顯「國安領域日益黨派化」的危險趨勢。路透社報導，維吉尼亞州聯邦參議員、前參議院情報委員會主席華納（Mark Warner）今天舉行記者會，談及29日在華府舉行的簡報，稱「這不是制度該有的運作方式」。請繼續往下閱讀...華納說：「當攸關應否讓美國軍人陷入危險的決策摻進黨派色彩時，反而會讓軍人子弟更不安全。」他表示，行政部門昨天在簡報中說明動武的法源，不解何以這類資訊需列為機密。美軍近幾週在拉美沿岸攻擊疑涉販毒的船隻，已知造成近60人罹難，也導致美國與委內瑞拉、哥倫比亞之間的緊張升溫。美國國會議員、尤其民主黨人一直要求政府提供更多攻擊任務相關的資訊。傳統上無論何黨執政，美國政府在重大國安行動時，通常會向參眾兩院情報委員會正副主席、眾院議長和少數黨領袖、參院多數黨領袖和少數黨領袖組成的所謂「八人幫」簡報，也常向所有國會議員舉行機密報告。白宮發言人凱利（Anna Kelly）被問到時未直接說明何以29日的簡報排除民主黨議員，反指責民主黨人「在為外國毒品走私者開脫」。她表示，行政部門已舉行過6場跨黨派簡報，並計劃再舉辦更多場次；同時國防部也已安排高層官員回答議員的問題。五角大廈發言人則表示，他們已進行過跨黨派簡報，且將持續舉行。不過五角大廈也未回應為何29日只有共和黨人與會簡報的質疑。五角大廈對攻擊行動鎖定目標者的公開資訊極少，只承認其中有部分來自委內瑞拉、哥倫比亞與厄瓜多；川普政府堅稱遭攻擊者是在運輸毒品，卻未提供證據，也未公開說明為何選擇直接攻擊這些船隻，而非攔截並逮捕船上人員。兩黨參議員們已分別提出決議案，援引美國憲法規定宣戰權屬於國會而非總統為由，要求在國會授權前不得展開這類攻擊，但其中一項決議案以些微差距遭否決，另一項預計將在幾週內表決。（編譯：陳亦偉）1141031熱門賽事、球星動態不漏接    ,https://news.ltn.com.tw/news/world/breakingnews/5229569
川習釜山會成果要點,國際,2025/10/31 05:30,川習釜山會成果要點◎關稅與經貿措施〇美方取消針對中國商品（含港澳）加徵的10%「芬太尼關稅」，對中國商品加徵的24%對等關稅繼續暫停1年，美國對中國進口商品整體關稅從57%降至47%。中方將相應調整反制措施。〇美方暫停對中國海事、物流與造船業的301調查措施1年，美方暫停實施9月29日公布的出口管制1年，中方也暫停10月9日公布的相關出口管制措施。請繼續往下閱讀...◎農產品與稀土供應〇中方立即恢復大量採購美國黃豆及其他農產品。〇雙方達成為期1年、可延展的稀土供應協議。◎禁毒合作與芬太尼問題〇雙方同意加強打擊非法芬太尼貿易，展開禁毒合作。◎晶片與科技議題〇未討論輝達Blackwell人工智慧晶片。〇中方表示將妥善處理TikTok相關問題。◎台灣與地緣政治〇川普明確表示會中未討論台灣議題。〇就烏克蘭議題，川普表示習近平「會協助我們」，共同處理烏克蘭問題。◎領袖互訪與後續磋商〇川普明年4月訪中，習近平也將訪美。〇確認馬德里經貿磋商成果，推進後續合作。製表：國際新聞中心資料來源：綜合外電熱門賽事、球星動態不漏接    ,https://news.ltn.com.tw/news/world/paper/1730205
締結多項協議 川普願再訪亞洲,國際,2025/10/31 05:30,川習會一結束，川普隨即搭上空軍一號啟程返美。他宣稱川習會獲得巨大成功。（法新社）亞洲行成果豐碩 與日韓深化同盟關係美國總統川普卅日結束亞洲訪問行程，從南韓釜山金海空軍基地搭「空軍一號」啟程返美。此行他先後訪問馬來西亞、日本與南韓，締結多項協議成果豐碩，並在亞太經合組織（APEC）峰會期間與中國國家主席習近平舉行雙邊會談，達成關稅下調、恢復黃豆採購等多項共識，但並未與北韓領袖金正恩會面，引發關注。根據韓聯社報導，川普在專機上向媒體坦言，願為會見金正恩再次訪問亞洲地區。他強調：「我們非常忙碌，此次訪問的核心是中美會談。若在此時安排與金正恩見面，可能會被視為（對習近平）失禮之舉。」他仍表達願再次訪問亞洲以促成美國和北韓對話，稱「我會再來，關於金正恩的事宜，我會再次到訪」。請繼續往下閱讀...親送習近平坐車 耳語握手道別川普亞洲行成果豐碩，最大重點是與中國達成階段性貿易共識，雙方同意相關爭端休戰一年。美國有線電視新聞網（CNN）稱美中領袖都為此做出重大讓步。在約一小時四十分的川習會上，兩人互動也倍受外界矚目。會談開始時，川普主動向習近平握手致意，並說：「很高興再次見到你。」習近平回應：「我也是。」隨後，川普向在場媒體表示，這次會面「一定會非常成功」，並笑稱習近平是「非常強硬的談判者」，「這可不是好事」。會談結束後，川普親自送別習近平，一路同行至座車停靠處。兩人在車旁短暫耳語交談、握手道別，看似氣氛融洽。中允採購黃豆、能源 川普大勝英國廣播公司新聞網（BBC）指出，北京同意恢復採購黃豆對川普而言是場勝利，有助川普選票基本盤的美國中西部農民減少損失。川普稍後在專機上發文表示，美中官員將會面，商討可能達成的「能源協議」，中國已同意將開始採購美國能源，「關於從阿拉斯加州大量採購石油和天然氣，可能將有一筆規模相當大的交易發生。」川普此行密集與日、韓、馬來西亞等國互動，深化同盟關係。在馬來西亞，他見證泰國與柬埔寨簽署和平協議，化解邊境衝突，成功塑造「和平締造者」形象。訪日期間，川普與新任首相高市早苗會晤，並獲安排晉見天皇，雙方更簽署「美日關鍵礦產供應安全架構協議」，確保稀土等戰略資源供應。在南韓，總統李在明宣布將推動企業未來十年對美投資三千五百億美元，並深化半導體與電池合作。CNN指出，亞洲領袖透過熱情招待奉承、投其所好贈送黃金禮物等手段，成功拉攏與川普的距離，簡化了貿易談判。例如日本送給川普一顆鑲有金箔的高爾夫球，南韓則贈送川普「新羅金冠」複製品。川習會結束後，美國總統川普一路陪同習近平離開會場，並在他搭上專車前於習身旁耳語。（歐新社）熱門賽事、球星動態不漏接    ,https://news.ltn.com.tw/news/world/paper/1730203
川習會前 川普下令立即恢復核試,國際,2025/10/31 05:30,美國於一九四六年在比基尼環礁進行代號為「十字路口行動」的水下與空中核子試爆的檔案照。（路透）反核武團體：美核彈頭數已落後俄美國總統川普三十日宣布，因「其他國家」進行核試，他已指示國防部恢復核武測試。此舉正值川習會登場前夕，且俄羅斯日前成功測試可攜核彈頭的核動力水下無人載具。俄方否認進行核試，並表示若美國恢復，俄國將比照辦理；中國則呼籲美方遵守「全面禁止核子試爆條約」（CTBT）承諾。很不想重啟 但別無選擇 川普在社群媒體表示，雖不願重啟核試，但因他國行動別無選擇，已指示「戰爭部」（即國防部）在平等基礎上開始測試美國核武，並稱此程序將「立即」展開。他在空軍一號的記者會上重申，美國多年未核試，如今重新開始是「合適的」，但未透露地點與日期。請繼續往下閱讀...先前俄水下核試射成功 川普未明言哪些國家進行核試，但發文曾提及俄羅斯與中國，並宣稱美國核武數量世界第一，俄羅斯第二，中國是遠遠落後的老三，但會在五年內趕上來。然而根據「國際廢除核武運動」（ICAN）統計，全球九個核武國家共擁有約一二三三一枚核彈頭，其中俄羅斯約五五〇〇枚，美國約五〇四四，顯示美國排名實居第二。俄羅斯克里姆林宮發言人佩斯科夫同日表示，未得知任何國家進行核試，華府也未事先通知俄方。他強調俄方近期測試的「海燕」（Burevestnik）巡弋飛彈與「海神」（Poseidon）水下無人載具並非核試，但若他國進行核試，俄方將比照辦理。至於中國外交部發言人郭嘉昆則表示，中方希望美方切實遵守CTBT義務與「暫停核子試爆」承諾，以實際行動維護國際核裁軍與禁核擴散體系，並維護全球戰略平衡與穩定。目前並不清楚川普所說的「測試我們的核武」，指的是核彈頭試爆（最後一次是一九九二年），還是測試可攜帶核彈頭的武器系統。美國自一九九六年以來，就是禁止無論軍事或民用的一切核試的CTBT的締約國，恢復核試恐有違約之虞。川普在空軍一號上還告訴記者，他希望推動非核化，正在與俄羅斯就非核化（裁減核武）進行磋商，希望中國也會加入。熱門賽事、球星動態不漏接    ,https://news.ltn.com.tw/news/world/paper/1730206
南韓造核潛艦 川普未說明技術取得,國際,2025/10/31 05:30,南韓海軍作戰部長張東吉30日在國會審計會議上表示，若南韓確定要取得核動力潛艦，大約需要10年才能完成首艘潛艦建造。（歐新社）甫結束亞洲訪問的美國總統川普於社群平台「真實社群」宣布，已同意南韓建造核子動力潛艦，以取代現役老舊的柴油潛艦，並建議於南韓「韓華集團」收購的費城造船廠建造。此舉一舉實現首爾數十年來發展核動力艦艇的夙願，但同時引發核武擴散的嚴重擔憂。引發核武擴散擔憂川普未說明南韓將如何取得敏感的核動力技術。目前美國僅在一九五〇年代向英國轉移此技術，近年則透過「澳英美三方安全合作夥伴」（AUKUS）協議協助澳洲建造核潛艦。南韓雖具備先進的造船實力，但能否掌握核反應爐技術與安全規範仍是關鍵挑戰。對此，南韓產業部澄清，雙方並未具體討論在費城建造的細節。請繼續往下閱讀...南韓總統李在明廿九日與川普會談時指出，柴油潛艦機動性不足，難以有效監控北韓與中國等其他國家潛艦活動。美方同意南韓建造非核武器的核潛艦，可強化區域嚇阻，並減輕美軍在西太平洋的防衛負擔。此外，李在明也尋求美方支持放寬現行核協議，允許南韓對使用過核燃料進行再處理，以發展更完整的核能產業鏈。南韓國家安保室室長魏聖洛表示，若美方同意，將推動重新檢視現行以民用為主的核協議。「武器管制協會」（ACA）執行主任金波向「路透」指出，若美國試圖避免核武在全球擴張，川普政府就應該拒絕盟友提出這類要求。華府智庫「北緯三十八度」主任陶恩則認為，在俄羅斯與北韓深化核合作的背景下，南韓強化與美核合作實屬必然。首爾慶南大學的北韓專家金東燁批評，川李峰會的結果可總結為「盟友關係的商業化」及「和平的商品化」，「極大化了美國的利益，而非朝鮮半島的自主權」。「華盛頓郵報」分析，南韓的舉措源於對北韓核武進展與中國軍事崛起的不安，但發展核潛艦可能被平壤視為敵意信號，反而加劇區域軍備競賽，並提高未來說服北韓棄核的難度。熱門賽事、球星動態不漏接    ,https://news.ltn.com.tw/news/world/paper/1730208
川習會 沒談台灣 達多項共識 貿易休戰一年,國際,2025/10/31 05:30,美國總統川普（左）與中國國家主席習近平昨在南韓釜山會談，宣布在多項議題達成共識。（美聯社）美國總統川普三十日在南韓釜山與中國國家主席習近平舉行六年來首度面對面會談，歷時一小時四十分，雙方宣布在多項議題達成共識，包括貿易休戰一年，但全程未提及台灣。川普會後啟程返國，在專機上表示，此次會談成果豐碩，若以零到十分評價，他會給「十二分」。雙方共識涵蓋貿易、科技與地緣政治。川普宣布，美國將中國商品關稅從五十七％調降至四十七％，芬太尼相關關稅下調至十％。中方承諾立即恢復採購「大量」美國黃豆與農產品。請繼續往下閱讀...美國財長貝森特三十日表示，中國已同意未來三年每年購買二千五百萬公噸黃豆，並已批准TikTok交易協議。中方同意稀土管制 暫緩1年稀土議題為會談重點。川普說，中國同意暫緩實施新一輪稀土出口管制措施一年，「所有稀土問題已解決，這對全球都是好事」。至於半導體，川普表示，中國將直接與輝達討論採購，美方將擔任協調角色，但先進的Blackwell晶片未在討論之列。在台灣問題上，川普表示台灣議題「從未被提及，實際上根本沒討論過」。在烏克蘭問題上，習表態願與美國合作，協助結束戰爭。川普同時提到，中國長期自俄羅斯進口石油，但雙方未深入討論此議題。川普稱是巨大成功 自評12分川普稱此次會晤是「巨大成功」，他將於明年四月訪中，習隨後回訪美國。在會談開始前，習近平說兩國應該做「夥伴、朋友」，「不應陷入相互報復的惡性循環」。分析指此次共識多屬短期妥協，並非全面協議，難以扭轉兩國供應鏈脫鉤趨勢，但貿易緊張降溫仍有助安撫市場。熱門賽事、球星動態不漏接    ,https://news.ltn.com.tw/news/world/paper/1730181
中國規劃 5年縮小與美俄核差距,國際,2025/10/31 05:30,俄方近期測試的「海燕」巡弋飛彈與「海神」水下無人載具。（路透）香港「南華早報」報導，分析家指出，中國在廿八日公布的「十五五」規劃（第十五個五年規劃，二〇二六至二〇三〇年）中重提加強「戰略威懾」並首度將之與「維護全球戰略平衡穩定」掛勾，顯示北京當局將擴大與現代化其核武庫，以縮小與美國以及俄羅斯的差距。「戰略威懾」通常意指核武力量，中國政府文件過去也曾出現該字眼，但今年的「十五五」計劃是首度將之與全球戰略平衡穩定掛勾。分析家指，這顯示北京雖不見得尋求在核武戰力上與美俄並駕齊驅，但至少要縮小差距。美國智庫「蘭德公司」（RAND）資深國際防務研究員希斯說，中國的目標是維持「可靠的核威懾」，並透過禁止核子擴散來降低核戰風險。請繼續往下閱讀...首稱加強威懾 維護全球穩定希斯說，中國很可能會擴充核武庫，以確保具備可靠的二次打擊能力，可能意指中國核武庫將擴大到有約一千枚核彈頭。希斯說，美國的核武威懾力是用來對付欲攻擊美國及其世界盟國的敵人，但中國的核武威懾力僅用於自保，因此中國可能甘於在核子力量上與美俄達成平衡，而非在核彈頭數量上與美國相當。數據顯示，在全球共一萬多枚核彈頭中，各五千多枚的美俄已佔九成；中國目前有約六百枚，自二〇二三年以來每年新增約一百枚，估計到了二〇三〇年將有約一千枚，以及在二〇三五年以前達最大值約一千五百枚。解放軍退役大校、北京清華大學國際安全與戰略研究中心高級研究員周波說，「十五五」計畫中的承諾，意味中國劍指將其核武庫擴大到一定程度，以確保任何國家都不敢考慮對中國進行先發制人的核打擊；再加上美俄受限於「新戰略武器裁減條約」（New START），僅可各部署不超過一五五〇枚戰略核彈頭，中國增加核彈頭數量，自然能強化戰略平衡感。熱門賽事、球星動態不漏接    ,https://news.ltn.com.tw/news/world/paper/1730207
川普證實 未討論降規版晶片出售,國際,2025/10/31 05:30,輝達29日股價大漲，成為全球首個市值突破五兆美元的企業。圖為輝達執行長黃仁勳於28日在華盛頓特區舉行的Nvidia GTC（GPU技術大會）發表演說。（法新社）美國總統川普卅日表示，他並未與中國國家主席習近平討論批准輝達Blackwell系列人工智慧（AI）晶片銷往中國一事，澆熄市場對美國可能放寬出口管制的預期。川普廿九日暗示他可能協助輝達向中國出口「降規版」Blackwell晶片，引發現任、卸任官員與國會議員的批評，認為美國如果放行，將是重大的「國安錯誤」。川普卅日在空軍一號上對媒體表示，「我們確實討論了晶片問題。中方將與輝達及其他廠商商討採購晶片事宜」；被問及美國是否會批准向中國出口降規版的Blackwell晶片時，川普指出，「我們沒有討論Blackwell晶片」。請繼續往下閱讀...川普廿九日表示，將與習近平討論輝達Blackwell系列產品，這是為了達成美中全面貿易協議的更廣泛會談一部分。這番言論引發投資人預期華府將會放行，導致輝達股價大漲，市值突破五兆美元，卻令華府許多對中鷹派人士擔憂，此舉將使北京取得先進AI晶片，對美國國家安全構成風險。民主黨聯邦參議員昆斯表示，川普的談話令他擔憂，「定義二十一世紀戰鬥的是誰控制了AI，對川普總統而言，為了從中國拿到一些黃豆訂單，而向他們出售這些關鍵的尖端AI晶片，這是個悲劇性錯誤。」若黃豆換晶片 國安錯誤前美國駐中國大使伯恩斯表示，他希望川普政府能「堅守底線」，並說若美國若真的向中國出售降規版Blackwell晶片，將是巨大錯誤。他指出，美企向中國銷售取得的任何利益恐是非常短暫，因中國政府希望在晶片技術自力更生，正如在其他產業上一樣。熱門賽事、球星動態不漏接    ,https://news.ltn.com.tw/news/world/paper/1730204
習近平來了 韓國群眾「天滅中共」標語抗議,國際,2025/10/31 05:30,習近平時隔11年訪韓，南韓反中群眾拿出「天滅中共」、「韓國屬於韓國人」等標語抗議。（特派記者黃靖媗攝）美國總統川普與中國國家主席習近平，昨在南韓釜山金海機場空軍基地內舉行雙邊會談，現場戒備森嚴。川習會現場外有抗議民眾聚集，一邊揮舞美國國旗，一邊大喊「獨裁者習近平滾出去！」、「中共滾出去！」亞太經濟合作會議（APEC）峰會今天在南韓慶州登場，習近平時隔11年訪韓，逾百名南韓反中群眾連日集結場外，拿出「天滅中共」、「停止竊國」、「韓國屬於韓國人」等標語，並揮舞南韓及美國國旗。熱門賽事、球星動態不漏接    ,https://news.ltn.com.tw/news/world/paper/1730182
日韓領袖會,國際,2025/10/31 05:30,日本首相高市早苗三十日與南韓總統李在明舉行首次會談。（法新社）日本首相高市早苗30日訪問南韓，出席在慶州舉辦的亞太經合會峰會，傍晚與南韓總統李在明舉行首次會談，時間約40分鐘。兩人確認建立日韓穩定且面向未來的關係，也將繼續進行兩國領導人互訪的「穿梭外交」。高市預定在31日與中國國家主席習近平舉行雙邊會談。（駐日特派員林翠儀）熱門賽事、球星動態不漏接    ,https://news.ltn.com.tw/news/world/paper/1730209
