Title,News_Type,date,content,url
國民法官還沒審…台中男酒駕撞死老婦被起訴 1個月後也過世,社會,2026/05/20 20:39,台中一名陳姓男子今年元旦酒駕撞死老婦人，遭起訴本應由國民法官法庭進行審判，沒想到陳男起訴1個月後也死亡，台中地院裁定不行國民參審。（記者陳建志攝）台中陳姓男子，今年1月酒後騎車撞死徒步的陳姓老婦人，陳男今年3月24日遭台中地檢署依酒駕致死罪起訴，依法應由國民法官法庭進行審判，不料起訴才1個多月，陳男卻在今年4月27日死亡，台中地院近日以被告已死亡，裁判對象已不存在，裁定不行國民參與審判。這名陳姓男子今年1月1日酒後騎車行經台中烏日區，未注意陳姓婦人過馬路撞上，陳婦重摔倒地，頭部外傷、顱內出血及顱骨骨折，送醫急救仍不治，陳男酒測超標依公共危險罪送辦，台中地檢署在3月24日將他起訴，並在4月13日繫屬台中地院，原本應由國民法官法庭進行審判，沒想到陳男在4月27日死亡。請繼續往下閱讀...台中地檢署檢察官認為，陳男已死，若組成國民法官法庭進行審判，顯然耗費資源而不適當，依國民法官法第6條第1項第5款規定，聲請裁定不行國民參與審判。台中地院認為，被告既已死亡，法院裁判的對象已不存在，在此情況下，已無從藉由國民參與審判彰顯該制度審判價值的重要意義，且被害人家屬也具狀表示因被告病故，請本院諭知公訴不受理判決。台中地院認為，本件確有事實足認行國民參與審判顯不適當的情形，檢方聲請有理由，裁定不行國民參審。    ,https://news.ltn.com.tw/news/society/breakingnews/5443976
地方選舉開打！這區曾爆餐會、贈禮賄選 北檢點名「防4大干擾」,社會,2026/05/20 20:18,王俊力於會中強調，萬華區過去地方選舉曾發生多起賄選案件，查察機關應深入社區加強情資佈建與蒐報。（台北地檢署提供）因應地方公職人員選舉將屆，台北地檢署持續啟動查賄部署，檢察長王俊力今率隊赴萬華分局召開選舉查察座談，要求檢警建立縱向及橫向聯繫機制，強化情資蒐報與查核能量，並針對境外勢力介選、假訊息及選舉賭盤等妨害選舉態樣提前布防。他並強調，應落實法務部嚴查賄選及暴力、斬斷選舉賭盤、防堵假訊息干擾及阻斷境外勢力介選四大重點工作。北檢分析，萬華區為台北市開發最早區域之一，北萬華為西門町商圈等商業娛樂核心，南萬華則以住宅及文教區為主；回顧2018年、2022年地方選舉及2024年總統立委選舉查察案件，轄內曾發生餐會、贈禮等賄選案件，以及選舉賭盤、選舉暴力、黑函與假訊息等妨害選舉情形。請繼續往下閱讀...北檢指出，王俊力檢察長今日偕同選舉查察執行秘書、主任檢察官李仲仁，分區督導主任檢察官曾揚嶺及檢察官李堯樺，前往萬華分局督導選舉查察準備工作；此次座談由北市警局副局長張素菱率相關主管與會，萬華分局長陳勇華及轄內9個派出所主管也共同參與，針對轄區選情及查賄部署進行討論。會中除由萬華分局報告轄區選情外，檢察官李堯樺也分享查賄實務經驗與技巧，並針對近年境外勢力介選態樣及查緝重點進行說明，另與第一線員警就妨害選舉案件偵辦困境交換意見，盼藉此凝聚查察共識、強化團隊合作。王俊力強調，萬華區過去地方選舉曾發生多起賄選案件，查察機關應深入社區加強情資佈建與蒐報，尤其須嚴防地方選舉常見的結構性賄選模式，提前規劃查緝與宣導作為，避免不法行為影響選舉公平。檢察長王俊力今偕同選舉查察執行秘書、主任檢察官李仲仁，分區督導主任檢察官曾揚嶺前往萬華分局督導選舉查察準備工作。（台北地檢署提供）    ,https://news.ltn.com.tw/news/society/breakingnews/5443884
三重公寓火警救出1人瀕死  消防、醫護接力救回未脫險,社會,2026/05/20 19:45,新北市三重今天傍晚傳出火災，消防救出一名住戶失去生命徵象，消防救護員、醫護接力救回，起火原因仍待調查釐清。（警方提供）新北市三重區一棟公寓今天傍晚傳出火災，消防人車趕抵，在火場救出1名55歲住戶，失去生命徵象命危，消防救出後，三重區高階救護隊執行到院前緊急搶救，到院醫護接手，救回一命，恢復呼吸心跳，但未脫險。消防單位初估燃燒面積為25平方公尺，起火原因仍待調查釐清。這起火災發生在今天下午5時36分，三重區光復路一段68巷內一處公寓三樓失火，三重警方獲報轉報消防局，並派遣警力馳赴現場，協助交通疏導及人員疏散。請繼續往下閱讀...消防到場後攻上火場，發現一名住戶受困，救出時失去生命徵象，經消防員到院前急救，到院後醫護接手，救回一命；警方則積極協助周遭交通疏導，呼籲民眾不要靠近現場，以免發生危險，鑑識人員也會同火調人員協助採證。至於起火原因，仍待消防局火調科採證釐清。    ,https://news.ltn.com.tw/news/society/breakingnews/5443920
每天工作20小時！北科大研究生招魂 父痛訴：希望他是最後1個傻子,社會,2026/05/20 19:39,台北科技大學驚傳研究生在校內墜樓身亡。（資料照）24歲台北科技大學吳姓碩士生日前在校內墜樓身亡，家屬今日下午回到事發的億光大樓舉行招魂儀式，2個妹妹在現場不停落淚，站在後方的父母更是一度崩潰大哭。吳爸爸接受媒體訪問時，痛苦地說，學校單位雖然有陸陸續續與家屬接觸，但他至今連兒子的指導教授到底是哪一位都不知道，只希望自己的兒子「是最後一個傻子」。根據吳姓研究生生前的控訴，他曾向朋友抱怨指導教授表裡不一，「不要太相信他」，自今年1月開始，他的論文題目就被更改了4次。教授過往曾口頭承諾，即使不參與特定的產學計畫，也能順利拿到學位畢業，後續卻因為研究進度與意見分歧，多次以「踢出計畫、趕出實驗室」為由出言威脅。更離譜的是，教授為了避免留下任何通訊證據，每次談話時都要求他必須單獨前往辦公室，進行一對一的面對面溝通。請繼續往下閱讀...吳爸爸受訪時痛心地說，他以前總教導孩子一日為師、終身為父，如今發生這般憾事，「我感覺到我非常難過，但是我沒有感覺到另外一方父親的一點點所謂的表示，我真的是難以接受」。談到兒子輕生原因，他忍不住情緒失控落淚表示，「就是論文改來改去的，他很乖、很聽話，早知道這樣，我不要把他帶到這個世界來受這個苦難。」吳爸爸回憶，孩子從小就開朗陽光，喜歡釣魚、也曾是棒球隊成員。兒子大約從今年過年前開始，在心情上有一些轉變，但好像都壓抑在心裡。直到後來，兒子才向他吐露在學校「真的撐不住」，沒想到隨後就發生不幸。據了解，死者在清明連假期間，除了要趕專利內容，同時還得協助處理教授校外的外包報告，每天工時甚至長達20個小時。目前警方與校方已針對相關控訴展開全面調查，並已先暫停涉案教授的教學與指導工作，以釐清確切責任。    ,https://news.ltn.com.tw/news/society/breakingnews/5443905
Threads詐騙頻傳 打詐指揮中心要求修改演算法,社會,2026/05/20 19:35,行政院打詐指揮中心提醒民眾注意社群詐騙內容氾濫。（行政院打詐指揮中心提供）行政院打擊詐欺指揮中心今天表示，Meta所屬社群平台是詐騙集團主要詐騙管道，尤其Threads平台的農產品購物詐騙為大宗，Meta必須立即主動修改演算法與偵測系統，從源頭阻斷重複性詐騙貼文，否則必要時將修法提出相對應管制措施及罰則。打詐指揮中心今天透過新聞稿說明，根據內政部警政署刑事警察局統計，今年1月1日至4月30日止，Meta所屬社群平台涉及詐騙案件數為1萬4073件，案件占比為84.31%，總財損金額為13億6178萬1574元，財損占比為86.2%，顯示Meta所屬社群平台仍是詐騙集團主要詐騙管道。請繼續往下閱讀...打詐指揮中心說，其中Threads平台好發的網路購物詐騙貼文以季節性、時事性商品為主，尤以蒜頭、山竹、荔枝、桃子、酪梨、芒果等偽冒政府機關的農產品為大宗，此外也有倒店為由低價出清iPhone、Switch 2、PS5等，或是以新開幕為由免費贈送進行的詐騙。打詐指揮中心強調，Meta應修正技術漏洞、主動修改演算法與建立「重複詐騙內容識別機制」，及時攔截已被列為詐騙的資訊，而非事後補救，且應建立「官方身分驗證」，針對在地小型商業經營者提供更便捷、可信的「身分驗證服務」，幫助消費者區分合法業者與詐騙帳號，保障合法業者的生存空間。打詐指揮中心還說，若Meta持續消極應對，必要時將針對「詐欺犯罪危害防制條例」再修正案，提出相對應管制措施及罰則，改評估以「受害者人數」或「詐騙貼文篇數」作為裁罰基準課以重罰，要求平台業者在台灣經營必須尊重台灣法治與民眾財產安全。針對詐騙受害者部分，打詐指揮中心表示，政府將全力支持受害者與商家採取法律行動，捍衛網路交易安全，也會強化對平台的監督、持續提升民眾反詐意識。    ,https://news.ltn.com.tw/news/society/breakingnews/5443922
暈船「黃昏之戀」！宜蘭婦險噴60萬元養老金 警埋伏逮女車手,社會,2026/05/20 19:13,王姓女車手遭警方逮捕。（宜蘭警分局提供）宜蘭一名66歲退休婦人「阿霞」（化名），原想透過網路交友譜出一段浪漫「黃昏之戀」，未料遇上「愛情騙子」，在甜言蜜語攻勢下，先遭騙走新台幣20萬元，隨後又被以「投資需求」索要60萬元，對方獅子大開口讓阿霞徹底夢碎驚覺受騙，因不敢讓家人知道，只好偷偷向宜蘭警分局求助，警方趁雙方面交時，當場逮捕取款女車手，成功保住婦人剩餘老本。警方日前接獲詐欺面交情資，指稱轄內一名退休婦人深陷網路交友陷阱，並與詐騙集團約定16日中午，在員山鄉一帶面交60萬元現金；警方立即成立專案小組，提前趕赴現場周邊埋伏監控。請繼續往下閱讀...來自新北市的48歲王姓女車手依約現身，正當她準備向阿霞拿取60萬元現金時，埋伏在旁的員警見時機成熟，隨即一擁而上將她壓制逮捕。警方於現場不僅成功攔阻婦人差點遭騙的60萬元退休金，並當場查扣不法所得贓款及犯案用手機1支。落網的王姓女車手稱，自己透過「Threads（脆）」找到打工機會後，依循指示大老遠跑到宜蘭取款，未料錢還沒拿到，就被警方逮個正著，王女被依違反「洗錢防制法」及「刑法」詐欺等罪嫌，移送宜蘭地檢署偵辦，檢方複訊後向法院聲押獲准。警方呼籲，詐騙集團常利用網路交友軟體假意交往，再假借各類「投資」、「急用」等名義誘騙民眾交付財物，若遇素未謀面的網友，要求面交現金或匯款之可疑狀況，務必保持冷靜，並撥打165反詐騙專線或110報案求證，以免落入詐騙陷阱，賠上畢生積蓄。警方埋伏當場逮捕面交取款的王姓女車手。（宜蘭警分局提供）    ,https://news.ltn.com.tw/news/society/breakingnews/5443792
一團亂！桃園寶慶路2機車碰撞處理中  軍用卡車想繞過卡到樹,社會,2026/05/20 18:52,桃園區寶慶路發生2輛機車碰撞意外。（警方提供）桃園市桃園區寶慶路今天上午約9點，發生2輛機車不慎碰撞意外，警方獲報趕來處理，過程中，1輛軍用卡車行經該路段，為了繞過事故現場，不慎卡到路旁樹木，讓目擊網友直呼：「早上的寶慶路真混亂！車禍跟軍卡無關，軍卡要繞過去被樹卡住。」警方說，當時36歲陳姓男子騎機車準備迴轉，與騎機車直行的林姓女子發生碰撞，林女摔倒致手腳輕微擦挫傷，雙方報警處理後，確認都沒有酒駕，將由警方釐清肇事責任；過程中1輛軍用卡車行經該路段，為了繞過事故現場，軍用卡車靠右行駛，卻不慎卡到路旁樹木，還好軍用卡車上的人員下車後，順利排除樹木後離開。1輛軍用卡車想繞過車禍現場，一度被路旁樹木卡住。（擷取自網路）    ,https://news.ltn.com.tw/news/society/breakingnews/5443830
桃園蘆竹機車對決右轉曳引車 騎士幸僅輕傷,社會,2026/05/20 18:37,陳姓男子駕駛營業貨運曳引車與周姓男子騎機車發生碰撞。（警方提供）55歲陳姓男子今天上午9點左右駕駛營業貨運曳引車行經桃園市蘆竹區南青路、富昌街口，疑右轉未禮讓直行車，與騎機車周姓男子碰撞，幸好周男手腳擦挫傷、無大礙。警方說，陳男駕駛曳引車從南青路準備轉入富昌街時，路口狹窄，刻意將車頭往左偏再右轉，想讓曳引車能順利進入富昌街，同向前進的周男騎著機車不及閃避，與曳引車頭發生碰撞後摔倒；消防隊員緊急將手腳擦挫傷的周男送往林口長庚紀念醫院治療，幸無生命危險。請繼續往下閱讀...警方對於陳男、周男實施酒測，雙方都沒酒駕，初判因曳引車右轉彎未禮讓直行機車釀禍，詳細肇責仍待進一步調查，警方提醒，大型車輛常有視線死角，轉彎時應減速並提高警覺，落實「慢、看、停」原則並禮讓直行車先行，機車騎士則應與大型車輛保持安全距離，以維護自身安全。陳姓男子駕駛營業貨運曳引車與周姓男子騎機車發生碰撞。（警方提供）    ,https://news.ltn.com.tw/news/society/breakingnews/5443795
高市大樓飄異味！楠梓警消破門赫見男屍 檢相驗釐清死因,社會,2026/05/20 18:34,高市一棟大樓飄出異味，警消破門赫見1人死亡，檢方將相驗釐清死因。（民眾提供）高雄市楠梓區一棟大樓今天下午傳出異味，警消破門進入赫見一名徐姓男子陳屍地上；警方勘驗無明顯外傷，初步排除外力介入，報請檢方相驗以釐清死因。楠梓警方今天下午接獲民眾報案，指稱楠梓區一棟大樓傳出異味，警消據報到場破門入內，赫見一名徐姓男子（60歲）倒臥門邊地上，已無呼吸心跳、明顯死亡。請繼續往下閱讀...警方勘驗命案現場，徐男身體無明顯外傷，研判死亡至少1天以上，現場也無打鬥痕跡，初步排除外力介入，已報請檢察官相驗，以釐清真正死因。    ,https://news.ltn.com.tw/news/society/breakingnews/5443839
北科大研究生校內墜樓身亡 檢警完成相驗 悲痛父對死因無異議,社會,2026/05/20 18:24,台北科技大學驚傳研究生在校內墜樓身亡。（資料照）一名即將畢業的24歲台北科技大學碩士生，昨日上午疑似因課業壓力及實驗室高壓等學業問題，在校內億光大樓12樓墜樓身亡。其友人隨後在社群平台轉發其生前留下的控訴，直指長期處於高壓環境並遭受指導教授朝令夕改的對待，最後卻面臨被踢出實驗室的命運。大安分局警方昨獲報到場採證，初步確認無外力介入，檢警昨日已報驗完畢，家屬對死因並無意見。警方調查，昨日上午10時許接獲民眾報案，指稱台北科技大學億光大樓旁有人墜樓。救護人員火速趕抵現場，發現該名男學生倒臥在地面，因傷勢極其嚴重已明顯死亡，因此並未送醫搶救。警方隨後封鎖現場展開採證，並調閱校內監視器畫面。影像顯示，男學生在案發前約10分鐘獨自走上頂樓，過程中並未與任何人員接觸，現場初步排除外力介入。請繼續往下閱讀...警方昨日下午已派員會同檢察官與法醫對遺體進行報驗，男學生的父親接到通知後悲痛趕到協助檢警相驗，對於警方的勘驗與死因結果表示並無異議，目前遺體已由家屬領回處理後事。    ,https://news.ltn.com.tw/news/society/breakingnews/5443722
醫美偷拍疑雲延燒 光澤羅東店查獲可疑攝影設備店長10萬交保,社會,2026/05/20 18:12,宜蘭地檢署檢察官帶隊到光澤診所羅東店（如圖）搜索，查獲可疑攝影設備，店長訊後10萬元交保。（記者江志雄攝）首次上稿 16:15更新時間 18:12 新增宜檢說明案情宜蘭檢警偵辦醫美界偷拍疑雲，使出「回馬槍」取得重大進展，警方會同縣府衛生局8日稽查光澤診所宜蘭羅東店一無所獲，隔天改由檢察官帶隊搜索，查獲疑似針孔攝影設備，將黃姓店長等3人帶回訊問，訊後諭知6萬到10萬元交保，案情急遽升溫。請繼續往下閱讀...宜蘭地檢署今天（20日）傍晚發新聞稿指出，日前接獲新北地檢署橫向聯繫資訊，指稱宜蘭某醫美診所疑似裝設監視錄影設備，由檢察官葉怡材指揮宜蘭縣警局、消防局、衛生局聯合稽查，並執行搜索扣押偽裝型監視錄影設備等物，訊問黃姓等3名被告，認涉犯妨害性隱私罪嫌疑重大，惟無羈押必要，訊後諭知交保。醫美界偷拍風暴延燒，繼愛爾麗集團爆出「煙霧偵測器」偷拍風波後，有14家分店的知名連鎖醫美光澤診所，也被檢舉疑有偷拍情事，新北地檢署8日搜索新北市5家分店，其中3家被查到疑有連接鏡頭的影像線路及硬碟；宜蘭地檢署檢察官則指揮警方及衛生局，到宜蘭羅東店1、2樓營業空間稽查，沒有尋獲可疑密錄設備。宜檢承辦檢察官抽絲剝繭後懷疑另有隱情，9日帶隊進入光澤宜蘭羅東店3到5樓搜索，查獲疑似針孔攝影設備，但未發現竊錄畫面，把黃姓店長、副店長、一名職員帶回訊問釐清案情，黃姓店長10萬元交保，其他2人各以6萬元交保。據了解，光澤診所宜蘭羅東店承租羅東鎮興東路某大樓1到5樓營業，警方首日在1、2樓辦理行政稽查空手而回，第2天由檢察官帶隊進入3到5樓搜索，才掌握可疑事證，此次「回馬槍」讓案情大逆轉，至於是否有偷拍行為？仍待檢方進一步調查。宜蘭警方及衛生局人員8日到光澤診所羅東分店稽查，未發現可疑密錄設備。（資料照，民眾提供）警方8日稽查光澤診所羅東分店一無所獲。（資料照，民眾提供）    ,https://news.ltn.com.tw/news/society/breakingnews/5443476
「違規大戶」無照駕駛左轉撞機車 騎士上班遇橫禍傷重不治,社會,2026/05/20 18:11,黃男無照駕駛租賃車直接撞上機車。（記者姚岳宏翻攝）台北市中山區昨天上午發生1起死亡車禍，47歲黃姓男子無照駕駛租賃小客車，行經吉林路與長春路口準備左轉時，猛烈撞擊對向直行的46歲許姓機車騎士，許男當場失去呼吸心跳，雖緊急送往馬偕醫院搶救，下午1時許仍告不治，肇事黃男酒測及毒品篩檢均為陰性，警詢後依過失致死罪嫌移送台北地檢署偵辦。警方查出肇事的黃姓男子是違規大戶，過去10年間累積超過40筆交通違規紀錄，包含超速、闖紅燈及違規變換車道等，平均每3個月就會違規1次，離譜的是，黃男駕照才剛在今年2月因吊扣期間又違規駕駛遭吊銷，這次警方再製單舉發，並對其租賃車輛執行扣牌與扣車處分。請繼續往下閱讀...昨上午8時23分左右，黃男從桃園租車前往中山區尋找友人，他沿著長春路由西往東方向行駛，左轉吉林路時，疑未注意對向車況，與沿長春路東往西直行的許姓騎士發生碰撞，強大的撞擊力道導致小客車頭毀損，機車左側車身嚴重受創，許男更被人車擊飛倒地。警方接獲報案後趕抵現場，黃男警詢時辯稱轉彎當下，以為前方無車，沒料到機車突然出現，導致他反應不及而肇事；許男家屬接獲噩耗悲痛萬分，表示許男當天早上從汐止騎車出發，目的地是新生北路公司，沒想到在即將抵達上班地點前遭遇橫禍。警方呼籲，行經路口轉彎務必減速慢行，並優先禮讓直行車輛，確保用路安全。許男騎機車即將抵達上班地點，卻遭遇橫禍。（記者姚岳宏翻攝）    ,https://news.ltn.com.tw/news/society/breakingnews/5443784
新北拖吊蟑螂案移審 「小崔」徒弟蔡尚璁20萬交保,社會,2026/05/20 18:04,「小崔拖吊」負責人崔博翔的徒弟蔡尚璁（戴藍色口罩者）、許峯頤（戴黑色口罩者）被依違反組織犯罪等罪起訴。（資料照）「小崔拖吊」負責人崔博翔的徒弟蔡尚璁、許峯頤，涉自立門戶組拖吊蟑螂犯罪集團，利用消費者出車禍或故障時，傳送篇幅極長、內容繁複的高額報價單，以此隱瞞報價引誘被害者回覆同意，等抵達目的地再索取高額拖吊費，共有6人受害，不法所得18萬餘元，新北地檢署上週依違反組織犯罪、詐欺犯罪危害防制條例、刑法加重詐欺等罪嫌起訴蔡、許等8人，全案今移審後，新北地院裁定在押中的蔡20萬元交保、許10萬元交保，均限制住居。檢警調查，許、蔡之前就曾向消費者索取超出慣例的報酬而被告，但因各地檢署認屬民事糾紛而不起訴，遂食髓知味於2024年離職成立宇生、騰至兩家企業社，於網路大量投放關鍵字廣告，待民眾因車輛故障或事故聯繫時，要求消費者加LINE聯繫，傳送篇幅極長、內容繁複的高額報價單，利用消費者處於急迫焦慮的情境，誘使倉促回覆同意。請繼續往下閱讀...檢警調查，集團等到拖吊完成後才告知高額費用，若被害人拒絕，即恫嚇「強行扣車、車輛將遭變賣或報廢」等，並派遣「業務、法務」到場施壓、包圍、滋擾；集團從去年一月起橫行於新北各地向消費者索取金額從4萬元至10萬元不等費用，有5名被害者因而支付12000元至7萬元不等金額。檢警還發現，有被害者找蔡拖吊短短650公尺，就遭索取9萬餘元費用，支付7萬元才脫身；另名被害者從烏來拖吊至新店中興路一段，遭索取10萬餘元，汽車維修廠老闆路見不平出面制止，卻遭恫稱：「我知道你的店開在這裡，你最好不要管」。檢察官王雪鴻指揮新北市刑大偵破此案，認為蔡、許等人犯罪手法具有計畫性、組織性，且被害人數甚多，嚴重危害社會交易秩序及民眾對道路救援服務的信賴，考量許認罪，求刑1年10月，蔡辯稱：「我報的費用不貴，是客人要殺價」不知悔改，蔡犯後態度惡劣，就詐防條例部分求刑6年2月、組織犯罪求刑3年10月，其餘6人分別擔任拖吊司機、助手及收帳人員，請法院量處適當刑度。    ,https://news.ltn.com.tw/news/society/breakingnews/5443726
騙走180萬還不夠！詐團再要150萬 板橋警逮「120歲」車手搭檔,社會,2026/05/20 17:40,埋伏的員警一擁而上將車手逮捕。（記者徐聖倫翻攝）55歲蘇姓女子日前接獲詐騙集團電話，對方自稱司法人員，恐嚇其涉及刑事案件，必須「監管帳戶」並查扣資金。蘇女落入圈套，在短短4天內面交4次，慘賠180萬元，沒想到詐團食髓知味，今日再度索要150萬元，板橋警方接獲報案後迅速部署，在漢生東路一帶當街埋伏，成功將60歲張姓女車手及57歲陳姓收水手一舉擒獲。​據了解，蘇女是在本月12日接到詐團來電，由於對方語氣嚴厲，蘇女慌張下不疑有他，12日至15日間，依指示在板橋各地分批交付大筆現款，等到積蓄被榨乾180萬後，才驚覺自己遇到詐騙，急忙向警方求助。請繼續往下閱讀...​板橋警分局接獲報案，得知詐團食髓知味、再度獅子大開口要求面交150萬元款項，便決定請蘇女配合「釣魚」，與對方相約在漢生東路某處交款。​今天下午2時許，車手張婦現身取款，在一旁負責接應收水手陳男隨後現蹤。埋伏已久的精銳警力見時機成熟，立刻一擁而上將2人壓制逮捕，當場查扣手機及不法所得，這對年過半百的「高齡車手搭檔」只能當街就擒。​警方表示，陳、張2嫌落網後承認受僱於詐團，但集團詳細背景則稱不知，警詢後依詐欺罪嫌將2人移送法辦，並將持續溯源追查幕後的詐騙集團核心。板橋警方接獲報案後迅速部署，在漢生東路一帶當街埋伏，成功擒獲60歲張姓女車手。（記者徐聖倫翻攝）    ,https://news.ltn.com.tw/news/society/breakingnews/5443704
