Title,News_Type,date,content,url
突預告登出民進黨北市黨部 「焦糖哥哥」陳嘉行求職中：考慮回娛樂圈,政治,2026/05/01 14:59,民進黨台北市黨部執行長陳嘉行預告退出黨部。（取自陳嘉行臉書）兒童台主持人「焦糖哥哥」陳嘉行因時常在網路發表評論，轉型成政治網紅，並擔任民進黨台北市黨部執行長。今日他突然發文預告「登出台北市黨部，倒數30天」。此外，他也公開在文中求職，表示若有公司認為他適合，歡迎來談。他甚至也考慮回到娛樂圈工作，有相關工作、試鏡都歡迎聯繫。陳嘉行今日在臉書發文表示，他先前在議員初選中未通過，失業了半年又背了一點債；加入陳時中競選團隊後，在選舉結束後又再度失業，他坦言自己經濟壓力真的不小。加上長期沒運動，身體也出現警訊。連他的愛貓愛犬，身體都在這時候出狀況，伴隨而來的醫藥費、陪病至寵物過世的過程，讓他的身體、精神也累垮了。請繼續往下閱讀...他感謝在自己最無助時，民進黨的林岱樺、王世堅、黃承國，以及「1450夥伴」給了他工作。其中，林岱樺跟他討論了自己最受爭議的同志問題；王世堅信守承諾不透露他在自己的團隊工作，也聽從他的建議學習使用智慧型手機；黃承國則讓他接下市黨部執行長。陳嘉行表示，市黨部時常收到紅白帖邀請，方便去的就會去，這段時間長到足夠讓自己思考，要不要繼續選議員？要不要繼續待在政治場域。「目前的答案顯然都是不要，但未來不知道。」他表示，自己恢復運動習慣加上飲食控制，4個月瘦下8公斤，且很健康。現在雖想到過世的貓狗還會流淚，但她會堅強的活下去，現在也領養了一隻老狗「Baby」，過得很幸福。陳嘉行最後總結，以上是他這4年發生的概況，也是自己工作經歷，更是一篇求職文。「如果您公司有缺人，也認為我適合，歡迎來談談、來聊聊，台北或台中都可以。謝謝。」他也表示，將計劃重新經營自己的社群，也考慮回娛樂圈工作。如果有相關工作、試鏡歡迎聯絡。    ,https://news.ltn.com.tw/news/politics/breakingnews/5422187
鄭麗文為何求見川普盼其表態「反台獨」？吳思瑤曝野心：賣國求榮爭大位,政治,2026/05/01 14:56,民進黨政策會執行長吳思瑤。（資料照）國民黨主席鄭麗文規劃6月訪美，除尋求會晤美國總統川普，並希望川普表態「反對台灣宣布獨立」。民進黨政策會執行長吳思瑤今（1日）批評，鄭麗文不惜犧牲軍購案以換取中共加持，如今欲如法炮製訪美行程，顯見其個人政治野心已超越國家利益，此舉是為了在黨內互別苗頭、爭取大位，台灣社會絕不容政客賣國求榮。對於鄭麗文求見川普、試圖拉高訪美待遇。吳思瑤接受本報訪問時直言，原來鄭麗文嘴上一直說的，「鄭習會」是選舉大利多，說的是她自己的選舉。利益薰心，賣國求榮，以為有中共中央總書記習近平的加持，就天下無敵？真是忘了自己是誰？現在要如法炮製川鄭會，「美國應該會問，妳哪位？」請繼續往下閱讀...吳思瑤說，鄭麗文在中共的助選下當選國民黨主席，不折不扣是中國運用的國民黨主席，鄭先前在「習鄭會」中，獲得習近平14秒握手的加持，卻不惜對軍購案「拖、擋、砍」，以犧牲台灣為代價追求個人的政治權力。吳思瑤進一步解讀，鄭麗文逼迫國民黨內接受3800億元軍購額度，這種操作的出發點就是競逐個人權力，企圖引發國民黨內的路線分歧和內訌，與台中市長盧秀燕、立法院長韓國瑜等人互別苗頭，劍指大位的企圖已經不言可喻。不過，吳思瑤認為，鄭麗文被權力沖昏了頭，誤以為自己能操控美中關係，卻低估了整體局勢。她重申，軍購案是國家當前最重要的任務，不樂見國民黨內為了個人利益，無論是鄭麗文意圖問鼎大位，或是國民黨團總召傅崐萁為了立法院副院長一職，將個人政治權力與中國綁在一起換取發展，這是大錯特錯，台灣社會絕不可能容忍這樣的政客。    ,https://news.ltn.com.tw/news/politics/breakingnews/5422197
戰鬥藍恐被打成「青鳥」？林俊憲諷鄭麗文搞黨內處刑台,政治,2026/05/01 14:45,前中廣董事長趙少康。（資料照）國民黨爆發「軍購之亂」，國民黨中央昨深夜發布聲明直指前中廣董事長趙少康稱「以前什麽時候有黨版過」、「黨版沒有處理加N」的說法失之武斷，內鬨持續。立委林俊憲直言，「我很難理解，為什麼一個保家衛國的軍購案可以把國民黨搞得這麼分崩離析？」林俊憲今日於社群平台發文指出，昨天，國民黨文傳會主委上了趙少康先生的廣播節目，談到立法院的軍購爭議，結果被一路追問到招架不住，最後只好用一句「黨齡尚淺」來化解尷尬。結果今天（1日）一大早，國民黨中央直接出面，駁斥自家政治金童、2024副總統候選人趙少康先生的說法，指稱他說法武斷、以偏概全。請繼續往下閱讀...「哇！這麼好看的鬥爭戲碼，竟然還免費收看。請一定要繼續連載下去。」林俊憲表示，說到底，這整件事其實已經徹底展現國民黨內的權力鬥爭。因為鄭麗文本質上就是一個沒有安全感的領導者，為了鞏固自己的勢力，現在任何與黨中央不一致的意見，都可能被推上處刑台。林俊憲認為，這也是為什麼，會出現副主席講出要開除自家立法院長這種話後，卻什麼也沒發生。「說穿了，因為鄭麗文跟季麟連根本就是一夥的，季不過是把鄭不方便說的話，代為說出口罷了。」林俊憲大酸，「我看照這個進度發展下去，趙少康先生帶領的戰鬥藍，搞不好很快就會被打成『青鳥』了。」     在 Threads 查看國民黨稱黨版軍購3/5黨團大會已通過 趙少康：4/29幹嘛又開會？大場面來了！國民黨臉書開罵趙少康 留言區支持者亂成一鍋粥立委林俊憲和支持者熱情握手。（資料照）    ,https://news.ltn.com.tw/news/politics/breakingnews/5422178
李四川喊路平燈亮水溝通 網諷：聽說藍營連續執政新北20年？,政治,2026/05/01 14:37,粉專「Mr.柯學先生」今發布圖卡。（圖擷取自「Mr.柯學先生」臉書粉專）國民黨新北市長參選人李四川近日出席新北市汽車貨運商業同業公會會員大會，，致詞時大談基層建設規劃。李四川指出，貨運業者最擔心的就是路不平、塞車及卸貨空間不足，並強調這正是他的專業領域，期許年底回到市府後，能落實「路平、燈亮、水溝通」。對此，臉書粉專「Mr.柯學先生」揶揄地說「笑死！老四川是在拆侯友宜的台喔？」粉專「Mr.柯學先生」今日發文並附圖狠酸，圖卡顯示「老四川：我要讓新北路平、燈亮、水溝通！」下方侯友宜則被設計對白稱「……你陰我？」，接著「Mr.柯學先生」酸說「所以現在新北是路爛、燈滅、水溝塞嗎？」請繼續往下閱讀...一名網友於「批踢踢實業坊（PTT）」轉發相關新聞指出，「國民黨長期執政20幾年，我們老人川伯還在路平燈亮水溝通？可見國民黨根本沒好好治理新北，最會做事的川伯都說話了！其實這話猛然一聽我還以為韓導來了，川伯形象已經夠老了，還這種老派的言論」。消息曝光後，許多網友紛紛留言，有人說「聽說藍的連續執政新北20年？」、「猴猴籠某揍歹擠」、「國民黨讓新北浪費了這些年喔，要不要換黨做做看」。國民黨新北市長參選人李四川。（記者黃政嘉攝）    ,https://news.ltn.com.tw/news/politics/breakingnews/5422009
為軍購案季麟連嗆開除韓國瑜！沈榮欽：國民黨發生內鬥是必然的,政治,2026/05/01 14:31,國民黨主席鄭麗文。（資料照）國民黨副主席季麟連不滿立法院長韓國瑜支持8000億軍購版本，日前在中常會表明「建議開除黨籍」，引起黨內議論。對此，加拿大約克大學副教授沈榮欽表示，重點在於，鄭麗文沒等到國民黨地方諸侯與黨內大老集結，就先發制人，以黨中央之姿發動鬥爭，其實仍有其草莽特色。國民黨發生內鬥是必然的，但是這兩種文化衝擊的影響，才是本次國民黨內鬥中最值得一看的門道。沈榮欽在臉書PO文表示，鄭麗文訪問中國時曾經提過，如果鄭麗文見到習近平，就是國民黨內鬥的開始。原因有二，第一，如果習近平指派鄭麗文擔任中共在台代理人，這讓連戰與馬英九情何以堪，從胡錦濤見到連戰開始，連戰人馬就壟斷代理人，馬英九上任後，首要就是將代理人從連戰人馬手中搶過來。鄭麗文如果要取而代之，必然會與現有人馬發生衝突。請繼續往下閱讀...所謂的代理人，一方面是和中共高層能夠接觸，另一方面則是兩岸經貿利益。中共本次宣布的十大惠台措施，便是挹注鄭麗文資源，應付年底選戰以及增加其在國民黨內的籌碼，以補足其聲望不足的困境，但是在經貿利益上，因為本次隨團的只有國民黨務人員，沒有穿梭兩岸的商人，而且中國經濟下行嚴重，中共手上也沒有多少經貿籌碼，這部分鄭麗文人馬還難以取代既有勢力。沈榮欽指出，第二，如果習近平接見鄭麗文，必然會令其野心大為膨脹，想要競逐大位，這就會讓其和盧秀燕、韓國瑜之間產生衝突。鄭麗文之所以能夠當選黨主席，一方面是季麟連操刀於黃復興人馬，另一方面是中共助力，但是在黨內，除了和傅崐萁合作掌控立院之外，地方諸侯和黨內大老，並沒有多少勢力服她，因此鄭習會之後，國民黨內鬥爭已經不可避免。鄭麗文雖然依賴中共壯大，但是要競逐大位，美國關係也十分重要，因此她不會完全聽命中共，也需要照顧美台關係，軍售便是美中的重中之重，但是正如鄭麗文公開表示「鄭習會比軍售重要太多」，在她心中，美中孰輕孰重已經昭然若揭。沈榮欽分析，美國並不是沒有出手，從國會議員聯袂訪台，到盧秀燕到黃國昌相繼訪美，也是動作頻頻。直到鄭麗文野心大增，要求超越盧秀燕規格，甚至不明國際局勢要求見到川普，美方自不願順從鄭麗文介入國民黨內鬥爭，為其拉抬聲勢，鄭麗文原來在立院阻擋軍售虎虎生風，即使盧秀燕、趙少康、朱立倫等人頻頻呼籲8000億版本，韓國瑜暗助，在傅崐萁操刀下，也無濟於事，這背後其實有深層的文化因素，而這又與其深層的權力關係有關。沈榮欽說，鄭麗文等歷屆國民黨主席，真正該關注的並不是規格高低，而是規格背後所反映出的天朝威儀與外交秩序，中共延續歷代朝廷傳統，建構出一整套儀式與獎懲機制，用以規範人的行為。沈榮欽點出，國民黨也是這種傳統的產物，過去國民黨的各種儀式與秩序，成為外人難以窺透，或即使了解也難以進入的障礙，就是因為這種儀式文化背後的權力關係，相較之下，民進黨從草莽出身，並沒有這一整套儀式的文化符號，雖然親民，但有時也被視為「儀式感不足」。直到最近，民進黨才逐漸生成這種文化，正是所謂富過三代，才懂穿衣吃飯的寫照。沈榮欽補充，鄭麗文出身自早期棗莽時代的民進黨，要不是連戰提拔，根本無能進入國民黨這套體系。但是在本質上，鄭麗文仍然是民進黨直來直往的個性，她的鬥爭方式，對傳統國民黨人而言過於激進，但是也正因此，傳統國民黨人反而會感到難以應對。沈榮欽直言，本次季麟連攻擊韓國瑜，背後所反映者，正是這兩種文化的碰撞。固然鄭麗文唆使季麟連的痕跡斑斑，要記者留下聽副主席罵韓國瑜，手段亦顯粗糙，但是重點在於，鄭麗文沒等到國民黨地方諸侯與黨內大老集結，就先發制人，以黨中央之姿發動鬥爭，其實仍有其草莽特色。國民黨發生內鬥是必然的，但是這兩種文化衝擊的影響，才是本次國民黨內鬥中，最值得一看的門道。    ,https://news.ltn.com.tw/news/politics/breakingnews/5421972
跟賴總統只差1歲看起來比較老？ 李四川：坐辦公室跟跑工地不一樣,政治,2026/05/01 14:26,國民黨新北市長參選人李四川（白外套）今早參加國民黨新莊區黨部的母親節團聚活動，與支持者擊掌。（記者黃政嘉攝）國民黨新北市長參選人李四川今早參加國民黨新莊區黨部的母親節團聚活動，祝與會黨員勞工節、母親節快樂，他開場致詞也拿媒體聯訪問及他跟總統賴清德只差1歲，怎麼他比較顯老？李四川說「坐在辦公室跟跑工地是不一樣的」，臉大概回不去了，但他說，這是經驗的累積，並強調心有沒有年輕才是問題，他也承諾，若當選一定會用歲月累積的紮實經驗，繼續奉獻給新北。該活動於新莊區農會大樓舉辦，李四川到場時，黨員熱烈歡呼「李四川凍蒜」，李四川致詞提到，對於媒體問他跟賴清德總統只差1歲，怎麼他看起來比較老？他跟大家說，因為坐在辦公室跟跑工地是不一樣的，他從當公務人員就開始做工程，扛過冷氣、做過水電、打過牆壁，所以這幾天他都跟勞工講，他跟各位一樣手都有長繭，現在比較好一點，前一段時間大概也都坐辦公室，但是臉大概恢復不回去了，讓在場婦女笑聲四起，李四川說，這是經驗的累積，代表他為這個社會、國家，最起碼稍微有點貢獻。請繼續往下閱讀...他表示，他時常講說「老」不是問題，問題是心有沒有年輕，如果一個年輕人的觀念很老，說實在，對社會的貢獻也不大，若一個人年紀大、經驗又豐富，能帶給年輕人未來，說實在，他的年紀就不是很重要了，他也笑說，在座的媽媽跟他一樣，有的手長繭，有的因為顧孩子而忘記晚上要敷臉，累積起來時，就會跟他一樣。李四川說，做工程的人只有把一塊地、把城市變大，說實在，只有媽媽，不但讓孩子長大，而且用心教育，讓孩子對社會、國家有貢獻，這個才叫做偉大，感謝撐起社會安定力量的媽媽們，今天才有繁榮的新北市。他強調，這座城市絕不是靠嘴巴說出來的，而是仰賴勞工的雙手做為安定的後盾，一點一滴打拚而成，他也提到過去推動新莊捷運通車、闢建輔大醫院聯外道路等實際政績，承諾當選後定會將這份用歲月累積的紮實經驗繼續奉獻給新北。國民黨新北市長參選人李四川（持麥克風）致詞提媒體問他跟總統賴清德只差一歲，怎麼他較顯老？李四川說「坐在辦公室跟跑工地是不一樣的」。（記者黃政嘉攝）國民黨新北市長參選人李四川（持麥克風）今出席國民黨新莊區黨部的母親節團聚活動。（記者黃政嘉攝）    ,https://news.ltn.com.tw/news/politics/breakingnews/5422174
「南美矽谷」總統將首度來台國是訪問 擬親訪「這地方」了解科技產業運作,政治,2026/05/01 14:21,巴拉圭總統貝尼亞。（法新社資料照）外交部昨日宣布，台灣位於南美洲邦交國巴拉圭總統貝尼亞（Santiago Peña）應我國政府邀請，訂於5月7日至10日率團來台國是訪問。巴拉圭地處南美心臟，年輕勞動力、綠電及水資源充沛低廉，去年被英國廣播公司（BBC）評為「南美矽谷」，台灣亦在巴國東方市打造「台巴智慧科技園區」，吸引國內科技產業進駐。貝尼亞此次台灣行將特別參訪南部科學園區管理局了解運作，以及接受台灣科技大學頒贈榮譽博士學位，兩國將在科技產業進一步建立夥伴關係。「台巴智慧科技園區」是賴清德總統擔任副總統期間，於2023年8月以特使身份赴巴國出席總統貝尼亞就職典禮，允協助巴國經濟發展及創造就業機會的承諾。兩國並敲定要合力打造成為南美洲智慧科技產業基地及人才搖籃。請繼續往下閱讀...外交部長林佳龍去年7月也曾帶領我國半導體、AI應用、智慧製造、智慧交通、智慧畜牧、冷鏈物流及食品加工等完整供應鏈廠商參團前往園區考察，期藉由此新雁行聯合艦隊進駐巴拉圭，建立「Taiwan+N」的全球產業布局。外交部昨說，貝尼亞此行團員包括外交部長拉米雷斯、工商部長里克爾梅、總統府秘書長西梅內斯等政府高層。此行是貝尼亞總統自2023年8月就任以來第二度訪台，也是首度來台國是訪問。台巴建交迄今69年，過去雙方持續在教育、公衛、農業等領域共同推動合作計畫，近年外交部積極推動「榮邦計畫」，在巴拉圭鎖定科技產業，結合政府與民間力量提升雙邊經貿交流的夥伴關係。英國廣播公司（BBC）曾於去年6月稱巴拉圭為「南美矽谷」，展示其豐沛綠電帶來的龐大商機。另美國國務卿盧比歐更於去年5月公開表示：「巴拉圭可使用與巴西共同營運的『伊泰普水力發電廠』50%電力，巴拉圭正在思考如何使用所分配到的大量綠電，如果投資人善用巴國電力發展人工智慧將會是明智選擇」。    ,https://news.ltn.com.tw/news/politics/breakingnews/5422164
高虹安「Double苦」？ 盧秀燕訪竹市送苦瓜與苦茶油,政治,2026/05/01 14:06,台中市長盧秀燕送苦瓜與苦茶油替高虹安打氣。（記者蔡彰盛攝）台中市長盧秀燕今參訪新竹市，與市長高虹安市政經驗交流，她說高虹安是「全台灣最辛苦的政治人物」，不僅面臨大罷免壓力，更遭司法追殺，是「Double苦」的市長。她還準備苦瓜與苦茶油作為見面禮，勉勵高虹安能「先苦後甘」。盧秀燕說，高虹安在面臨停職使市長任期受干擾情況下，仍能交出亮眼政績，把竹風漁市蓋起來，且大受民眾跟外地遊客歡迎，連她在外縣市都聽聞。請繼續往下閱讀...她說，高虹安是全台灣最辛苦的政治人物，別人面臨一個迫害就很辛苦，高虹安是一路被迫害、一路被追殺。去年全國大罷免風潮中，高虹安就是其中之一，即便面對罷免，高虹安仍獲得12萬票的支持，甚至超過當選市長時的9萬多票，顯示新竹市民有眼光、心疼高虹安受到的不公對待。盧秀燕說，高虹安雖司法沉冤得雪還其清白，卻傳出有人不放手，欲重啟論文案等議題繼續修理高虹安。一般人面對罷免就夠辛苦了，高虹安還要面臨司法追殺，這就是「Double苦」。盧秀燕現場送上兩份別具意義的禮物，一個是苦瓜，象徵司法追殺的苦，另一瓶是「苦茶油」，象徵大罷免的苦。送這些東西是希望高虹安能「先苦後甘，有益健康」，祝福從此以後平步青雲、政治順利。高虹安說，沒料到盧秀燕會帶苦瓜跟苦茶油，她相信吃苦當吃補，雖然苦，但她是堅強的。    ,https://news.ltn.com.tw/news/politics/breakingnews/5422146
鄭麗文想見川普 曾促成「川蔡通話」葉望輝：鄭對美國毫無益處,政治,2026/05/01 13:55,"華府智庫「傳統基金會」資深研究員葉望輝。（資料照）國民黨主席鄭麗文昨日接受彭博新聞（Bloomberg TV）專訪，表達期望6月訪美並與川普總統見面，並推銷所謂反台獨等敘事。對此，華府智庫「傳統基金會」資深研究員葉望輝（Steve Yates）斥責她「不切實際、欠妥考量，荒謬可笑」，美國等地網友也說鄭麗文是「中共代理人」、「美國應該拒絕給她簽證」。美國前愛達荷州共和黨主席、前副總統錢尼時期的副國安顧問葉望輝孰悉美中台關係且高度友台，並促成2016年「川蔡通話」。葉望輝曾事後爆料，當年川普競選總部幕僚詢問意見，他說支持美國總統當選人川普與時任總統蔡英文通話。葉望輝也表示，事實上不像媒體報導川蔡通話是他牽線而成，但如果沒有他影響川普幕僚團，或也沒辦法實現。請繼續往下閱讀...彭博新聞將鄭麗文的專訪放上社群平台X並推文道：「鄭麗文在訪問北京後，表達了與川普總統會面的願望。」對此，葉望輝留言道：「鄭麗文的這一舉動在許多方面都顯得不切實際、欠妥考量，荒謬可笑。她的做法與她所屬政黨的相當一部分成員背道而馳，也只代表了台灣選民中極少數人的立場。同時在印太地區阻撓川普政府的最高國防優先事項，且助長北京分化與脅迫台灣的企圖，對美國的國家利益毫無益處。」美國等各地網友也紛紛認同這說法並給予鄭負面回應。包括指控鄭麗文是「共產黨員」，還有網友說：「鄭麗文對台灣的隱患，大於對岸東風導彈的危害」、「如果川普要見任何人，那應該是中華民國總統賴清德」、「美國應該拒絕給她簽證，她只是中共的代理人」。Impractical, ill-advised, and ridiculous on a number of levels. Cheng's approach is at odds with a sizable chunk of her own party and represents a decidedly minority segment of Taiwan voters. Obstructing Trump's highest defense priority in the Indo-Pacific while helping Beijing… https://t.co/nEQLUdEjLw— Steve Yates （葉望輝） （@SteveYates） April 30, 2026 Impractical, ill-advised, and ridiculous on a number of levels. Cheng's approach is at odds with a sizable chunk of her own party and represents a decidedly minority segment of Taiwan voters. Obstructing Trump's highest defense priority in the Indo-Pacific while helping Beijing… https://t.co/nEQLUdEjLw    ",https://news.ltn.com.tw/news/politics/breakingnews/5422101
鄭麗文宮鬥朱立倫？傳季麟連原要警告朱系卻扯韓國瑜,政治,2026/05/01 13:47,前國民黨主席朱立倫子弟兵、桃園市議員凌濤。（資料照）國民黨副主席季麟連不滿立法院長韓國瑜支持8000億軍購版本，日前在中常會表明「建議開除黨籍」，引起黨內議論。傳出是季麟連代表的黃復興人馬，不滿前國民黨主席朱立倫「扯後腿」，因此透過季麟連在中常會放話，警告子弟兵、桃園市議員凌濤，以及提出8000億軍購的國民黨立委徐巧芯。對此，凌濤今日表示，他一向主張9000億軍購，保衛中華民國，尊重黨團，全力支持韓國瑜院長的調和鼎鼐。凌濤還說，他的「二寶」出生之後，「大寶」難免感受到冷落，這幾天二寶爸單獨帶大寶妹去「教育旅行」，沒有太多時間回應媒體指稱所謂黨務高層的針對。而桃園最近全國首創篩檢增項照顧產婦及新生兒；但最近他從同德國小的家要去南平路，嬰兒推車很不方便，他比較關注如何把人行步道優化。請繼續往下閱讀...前中廣董事長趙少康表示，箭指誰是一回事，結果你那個箭射到的是韓國瑜，這不是很奇怪嗎？而且韓國瑜到現在為止，沒有提出一個數字，他哪有「賣黨求榮」？韓國瑜也沒有說要當總統、要當行政院長。所以不管季麟連原來心裡想要罵誰，但是身為國民黨的副主席，在中常會這麼重要的場合，要記者都留下來聽他講話，結果是罵立法院長、要立法院長下台、要開除他黨籍，這很荒謬。國民黨副主席真的也要自重，不要一個一個都出紕漏，這很麻煩。    ,https://news.ltn.com.tw/news/politics/breakingnews/5422098
TPASS擬增加價搭高鐵方案？ 李四川：正研討計算,政治,2026/05/01 13:32,國民黨新北市長參選人李四川今被問及是否提出TPASS通勤月票接下來可能推出加一定金額可搭高鐵通勤的「升級版」方案？李四川回應，現在在研討跟計算，可能也要跟高鐵協商。（記者黃政嘉攝）國民黨新北市長參選人李四川今早出席國民黨新莊區黨部母親節團聚活動前接受媒體聯訪時，被問及北北基桃一日生活圈的TPASS通勤月票，他是否有提出接下來可能研議推出加一定金額可搭高鐵通勤的「升級版」方案？李四川回應，「我們現在在研討跟計算，可能也要跟高鐵去做協商，如果這個計畫決定以後，我會對外來宣布」。李四川表示，TPASS最早是雙北推出所謂1280元的晉升版，TPASS現在是當然中央也加入，也可以坐火車、客運，原則上，如果假設能夠加一點錢，上、下班也可以坐高鐵，他也跟台北市長蔣萬安說，針對內湖的交通，因為來上班的人大概都是新北、桃園居民，若假設可行，也許在內湖上班的人就不必一定要開車。    ,https://news.ltn.com.tw/news/politics/breakingnews/5422110
