Title,News_Type,date,content,url
行人路怒症？北市男不爽低頭族 捷運站前蓄意撞人,社會,2026/03/25 14:05,孫姓女子向警方表示，近期已有2名同事在仁愛路4段附近遭該名25歲徐姓男子刻意撞擊。（記者鄭景議翻攝）25歲徐姓男子今日上午在台北市大安區仁愛路一帶，疑似因不滿行人邊走邊滑手機，化身為「步行版路怒族」，刻意不閃避並惡意衝撞。1名39歲孫姓女子目擊徐男撞人，隨即上前理論，卻遭徐男踹擊。孫女一路尾隨徐男至捷運忠孝敦化站並報警。大安分局警方獲報趕抵，徐男雖對行為供認不諱，但孫女表示將保留法律追訴權，後續不排除提告。警方調查，今日上午9時許接獲報案稱捷運忠孝敦化站服務台前有民眾發生肢體糾紛。員警到場了解，報案的孫姓女子向警方表示，近期已有2名同事在仁愛路4段附近遭該名徐姓男子刻意撞擊。今日上午孫女再度目睹徐男疑似尋釁撞擊其他路人，憤而上前攔住對方要求道歉，未料徐男毫無悔意，雙方在街頭爆發口角，徐男竟當眾朝孫女出腳踹擊。孫女遭襲後不願讓對方脫身，緊跟在徐男後方進入捷運站，並請求站內捷運警察先行協助攔查。請繼續往下閱讀...徐男面對警方詢問時坦言，因看不慣部分行人走路時長時間低頭使用手機，認為此舉不僅妨礙他人行進且影響交通安全，才決定「不予閃避」以示懲戒，進而導致多次肢體碰撞。警方隨後在現場向雙方說明相關法律權益，孫女強調徐男的出腳行為已屬暴力，會與家人討論後決定是否提起傷害告訴。大安分局呼籲，民眾若遇有行走糾紛應保持理性，切勿採取惡意衝撞或暴力手段解決問題，以免觸法，用路人行走時應隨時注意周遭環境，避免長時間低頭使用手機，以維護自身安全。目前警方已抄錄雙方身分資料備案，若報案人後續提出告訴，警方將依法移送偵辦。    ,https://news.ltn.com.tw/news/society/breakingnews/5382067
中獎11萬變一場空！基隆女倒貼3萬還被控洗錢 法官這原因判無罪,社會,2026/03/25 14:04,黃姓女子誤信詐騙集團「中頭獎11萬元」謊言，依對方指示寄出帳戶提款卡並告知密碼，導致3名被害人被騙走的共11.7萬餘元全遭詐團轉匯走。法官認為，黃女也是被害人，判她無罪。（記者林嘉東攝）基隆市1名黃姓女子前年11月間參與IG抽獎活動，誤信詐騙集團「中頭獎11萬元」謊言，依對方指示寄出帳戶提款卡、密碼，導致3名被害人被騙走的共11.7萬餘元全遭詐團轉匯走，求償無門。檢方調查後，依幫助詐欺及幫助洗錢罪嫌起訴黃女。基隆地院近日審結認為，黃女也是被詐騙的被害人，判她無罪。判決指出，詐團取得黃女帳戶後，分別以「中獎核實」、「信用卡遭盜刷」、「賣貨便網址操作」等手法，詐騙高姓、林姓、李姓等3名被害人共11萬餘元款項，匯款至黃女名下帳戶，隨即遭轉匯提領一空。請繼續往下閱讀...法院審理時，黃女否認犯行稱，她當時在IG看到抽獎活動，對方通知中獎後，聲稱領獎帳戶須有3萬元存款以利核實；為此，她從他行匯入2.5萬元湊足餘額，並依指示寄出提款卡，隨後發現帳戶內原有的3萬餘元全遭領光，才驚覺受騙。法官勘驗黃女與詐團成員的LINE對話紀錄，確認黃女所述抽獎湊足3萬元的過程與事實相符，且黃女銀行交易明細顯示，黃女帳戶內3萬餘元存款，確實遭詐團成員轉匯走。法官認為，黃女因一時失察誤信對方領獎說詞，自身亦為詐騙受害者，依「罪疑唯輕」原則，認定黃女是一時失察誤信對方，並無幫助詐欺與洗錢的犯意，因此判處黃女無罪。    ,https://news.ltn.com.tw/news/society/breakingnews/5382049
棄保潛逃＋1！南投前鄉長吳文忠涉貪重判18年半 二審判決後已離境,社會,2026/03/25 13:57,棄保潛逃的南投縣前仁愛鄉長吳文忠。（資料照）南投縣前仁愛鄉長吳文忠，任內涉嫌大規模收賄與索取工程回扣，歷經多年偵審，最終遭重判18年6個月，但吳早在2023年初台中高分院判決後、最高法院判決前即突然人間蒸發，棄保潛逃遭通緝，近日部分判決確定後，台中地檢署再併案通緝。回顧案情，吳文忠於2018年以無黨籍身分當選南投縣仁愛鄉長，但檢警查出，他在選前即與親信及司機組成「索賄鐵三角」，向廠商開出條件，要求先支付百萬元賄款，換取日後高額工程標案，當選後更利用職權，透過白手套向得標廠商收取5%至15%不等回扣，甚至連前任任內已完工、尚未撥款的工程，也被要求抽成才予以放行。請繼續往下閱讀...檢方清查發現，相關涉貪案件高達54件，不法所得金額龐大，雖然法院審理後認定實際犯罪次數為16次、金額約200多萬元，仍認為其行為嚴重侵蝕公務體系廉潔，依違反貪污治罪條例判處重刑，案件歷經一審、二審及發回更審後，最終以一審判決為基準定讞，刑度為18年6個月，並褫奪公權。經查，台中高分院二審於2022年12月6日判吳文忠18年10月，吳隨即於最高法院判決前的2023年2月1日，就從桃園機場潛逃出境，最高法院於2024年8月14日才駁回部分上訴確定，於當年8月28日送交台中地檢署執行，中檢於當年12月3日發布通緝，另其餘撤銷發回判決確定案件，經台中高分院於今年3月2日始發交中檢執行，中檢收到後，於3月6日採「併案通緝」。    ,https://news.ltn.com.tw/news/society/breakingnews/5382036
勤教分享「姦屍案」！台中警所長描述太露骨惹議 分局回應了,社會,2026/03/25 13:55,台中市第二分局。（記者許國楨攝）台中警界爆出勤教失言爭議！第二分局轄內一名派出所長，近日在所內勤教中分享過往「姦屍案」辦案經驗，卻因內容涉及敏感性與露骨描述，引發基層員警不滿，認未考慮當時仍有女性同仁，質疑言論不當、場合失宜，分局今天表示，已介入調查並依規究責。據了解，該名所長於21日下午勤教時，原本基於經驗傳承，與同仁分享過去偵辦「姦屍案」的過程時，提及「用熱毛巾敷屍體下體20分鐘後就會軟軟的」、「進去後跟正常人一樣會很舒服」、「沒什麼差別」等語，且除敘述案件細節時，還引用嫌犯供述內容，對於犯案手法描述過於直白露骨，甚至涉及性相關細節。請繼續往下閱讀...爆料警員指出，當時在場不僅有男性員警，也包含女性同仁，相關發言讓現場氣氛一度尷尬，部分人感到不適，認為此類內容不應在正式勤務教育場合中出現，還有人透過臉書社團「靠北Police」發文質疑。對此，第二分局回應，經調閱現場影像並訪談與會人員，所長在分享前曾詢問內容是否合適，當時未有人明確表達反對或不適，但該所長在案例選擇與表達方式上確有欠缺周延之處。分局強調，雖然分享內容屬於轉述案件偵辦經驗，但身為單位主管，應具備更高的性別敏感度與專業判斷，避免造成同仁觀感不佳或不必要困擾，已要求相關幹部檢討勤教內容與表達方式，並將依內部規定進行責任追究，同時列為教育案例，加強性別意識與內部溝通訓練。    ,https://news.ltn.com.tw/news/society/breakingnews/5382018
台中麗寶樂園「遛鳥俠」！全裸亂入電玩館3分鐘 嚇壞遊客下場出爐,社會,2026/03/25 12:55,台中地院依公然猥褻罪判處罰金9000元。（資料照）台中知名遊樂園驚傳離譜脫序行為！位於麗寶樂園的探索世界電玩館，去年9月中午人潮眾多之際，竟有一名男子當眾裸露並做出猥褻舉動，過程長達數分鐘，嚇壞現場遊客，案件經警方調查並移送偵辦後，台中地院近日審結，依公然猥褻罪判處罰金9000元，全案仍可上訴。檢警調查指出，林姓男子於2025年9月17日中午12時許，在園區內電玩館活動時，竟無故裸露下體，甚至一邊走動一邊做出不雅動作。由於當時現場人來人往，不少遊客驚見異狀，紛紛側目，有人更立即拿出手機錄影蒐證，並通報園區人員處理。請繼續往下閱讀...園方接獲通報後隨即報警，警方到場後調閱監視器畫面，發現林男行徑誇張，不僅未加遮掩，還在館內四處遊走約2至3分鐘，其間任何經過民眾都可清楚目睹其不當行為，檢方偵訊時，林男坦承犯行，並對自身脫序行為表示認罪。案件進入法院審理後，林男與檢察官達成審判外認罪協商，法官審酌其犯後態度尚可，且已坦承犯行，但公共場所本應維持基本秩序與社會善良風俗，林男行為已嚴重影響他人觀感與安全感，仍須依法處罰以儆效尤，依公然猥褻罪判處罰金9000元。    ,https://news.ltn.com.tw/news/society/breakingnews/5381840
酒後勸架反結怨 狹路相逢背中刀,社會,2026/03/25 12:49,張嫌等人作案後在街頭拔腿逃竄。（記者劉慶侯翻攝）56歲張姓男子，日前在KTV喝酒唱歌時藉機發酒瘋，被39歲的邵姓男子和友人勸阻。怎知張男就此心生怨恨，昨日清晨5時左右，在台北市萬大路遇上邵男，張嫌夥同曾姓、另名張姓男子痛毆對方並持刀刺傷背部後分別逃逸。萬華分局經循線追查，今日凌晨陸續將涉案嫌犯緝獲，依法移送究辦。北市警萬華分局東園街派出所，是24日清晨5時許接獲110報案，指稱萬大路533號前發生街頭鬥毆情事，並且有人中刀受傷倒地。警方派員抵達現場，發現邵姓男子背部有刀傷，立即通報119協助就醫。請繼續往下閱讀...警方全面調閱街頭監視畫面追查，同時根據邵男提供線索比對相關事證後，迅速鎖定張嫌等3人涉有重嫌。警方調查發現嫌犯們在案發後，為規避警方查緝，各自分頭逃竄。專案小組根據監視器一路追蹤，42歲的張姓同夥在昨（24）日中午12時，在中正區懷寧街一帶逮獲，張姓主嫌與45歲的曾姓共犯，則是在同日下午約5時許，在新北市中和景平路被緝捕歸案。警方調查，張嫌等3人前日在萬華區一處KTV唱歌時，張嫌因酒後情緒不穩發酒瘋，邵男友人當下出面勸阻，不料反而雙方結怨，不料24日邵男在萬大路與張嫌等人意外相遇，張嫌等人便藉機報復。警方初步查出，在衝突中是曾男持用水果刀刺傷邵姓被害人，全案訊後，依殺人未遂罪移送台北檢署偵辦。警方查獲涉案水果刀。（記者劉慶侯翻攝）    ,https://news.ltn.com.tw/news/society/breakingnews/5381947
泰女來台遭控制賣淫 母跨國求助警5分鐘救人、瓦解竹聯幫人口販運集團,社會,2026/03/25 12:41,員警在超商內營救被控制賣淫的泰國籍女子。（中壢警分局提供）20歲泰國籍女子「小安」與同鄉陳女被介紹來台坐檯陪酒、聲稱2週可賺6萬元，不料入境後即遭竹聯幫信堂冠信會柯姓組長為首的人口販運集團控制行動、強迫從事性交易，小安的母親因遲遲聯繫不到女兒，持定位資訊向泰國官方求助，警政署接獲訊息立即轉知中壢警分局，短短5分鐘內即救出2女，檢警向上追查瓦解人販集團，桃園地檢檢署今（25）日偵結依組織犯罪、人口販運防制法等罪嫌起訴柯男等9人。檢警調查，「小安」與18歲的陳女在泰國時經友人介紹來台工作，對方稱只要「坐檯陪酒」，短短2週即可賺取新台幣5至6萬元，且雇主還出資支付機票費用，不料2女入境被帶往住宿地點，護照與行李即遭扣留，更被強迫從事性交易，即便月事來潮仍被要求接客，行動亦遭人監控，難以對外求援。請繼續往下閱讀...小安的母親因遲遲聯繫不到女兒，提供女兒先前的手機定位資訊向泰國貿易經濟辦事處求助，案經警政署國際組特勤科轉報，中壢警分局於去11月26日晚間9點接獲通報，立即展開營救行動，員警前往中壢區永興街一處超商清查，獲報後短短5分鐘內即救出被帶往採購生活物資的被害人2女，並當場逮捕負責監控的27歲李女，隨即報請桃園地檢署指揮擴大偵辦。檢警深入追查發現，該集團以竹聯幫信堂冠信會46歲柯姓組長為首，透過45歲黃男及30歲陳女負責招募泰籍女子來台從事陪酒與性交易；26歲黃男負責監控女子外出行蹤；27歲李女與56歲黃男負責整理房務、提供飲食及招攬男客；25歲葉男、39歲詹男及24歲鄒男則擔任馬伕，負責載送女子外出陪酒及性交易，堪稱是黑幫掌控、分工明確的人口販運及應召組織。全案經檢警收網，成功於桃園國際機場攔查企圖出境避風頭的陳女、黃男、葉男及鄒男等4人到案，另持續展開數波查緝行動，將主嫌柯男等9人全數查緝到案，並查扣新台幣、日幣、港幣、泰銖及美金等不法所得共37萬餘元、行動電話13支及筆記型電腦1台等證物。中壢警分局長林鼎泰表示，警方絕不容許犯罪集團以誘騙或控制方式剝削外籍人士牟利，將持續掃蕩幫派犯罪及人口販運等不法行為，並呼籲民眾若發現疑似人口販運或遭非法控制情形，應立即向警方通報，共同守護社會治安與人身安全。竹聯幫信堂冠信會犯罪組織將受害泰國女子控制在這處暗巷內房屋。（中壢警分局提供）竹聯幫信堂冠信會柯姓組長被警方拘提到案。（中壢警分局提供）警方查扣人口販運集團的外幣及新台幣及手機等犯罪證物。（中壢警分局提供）    ,https://news.ltn.com.tw/news/society/breakingnews/5381934
徐春鶯移審新北地院 下午開庭決定延押或交保,社會,2026/03/25 12:30,徐春鶯搭囚車來到新北地院等待下午開庭。（記者徐聖倫翻攝）台灣新住民協會發展理事長徐春鶯，涉嫌透過職務之便長期向中共彙報本國情資，依指示為特定候選人站台，以女兒名義詐貸超過2600萬元，甚至造假經歷讓統戰幹部來台。徐春鶯昨遭新北地檢署依反滲透法、詐欺、偽造文書、銀行法等罪嫌起訴，今上午移審至新北地方法院開庭。據悉，徐春鶯向中共彙報台灣政情、選情、政黨情資等，疑似接受中共指示為柯文哲、黃珊珊等候選人站台；另徐春鶯從事地下匯兌、偽造證明以女兒名義詐貸2697萬元，還為中共統戰幹部假造經歷、隱瞞身份，暗中協助其來台。請繼續往下閱讀...新北地檢昨依反滲透法、詐欺、銀行法、偽造文書等多項罪嫌起訴，並建議新北地院從重量刑。今上午，徐春鶯搭囚車來到新北地院，預計下午將開庭，決定徐春鶯是否延押或交保。    ,https://news.ltn.com.tw/news/society/breakingnews/5381915
奧迪女忽外切內切 還暫停黃網線「瞧」後車 台南警：至少罰6千元,社會,2026/03/25 12:09,白色奧迪轎車女駕駛暫停在台南東區東門路二段的黃網線區內，還開車門瞧了後車，這違規行為被南市一分局警方開出紅單、至少罰六千元台幣。（圖：截取自網路社群wowtchout）有網友在網路社群po文，3月23日傍晚6點半許，1輛白色奧迪轎車行駛在台南東區東門路二段時忽然外切、內切，後方車輛按喇叭示警危險，奧迪女駕駛還把車暫停在黃網線區、開車門看後車，還在停紅燈時下車找後車駕駛理論。警方檢視影像認定女駕駛違反道交條例，已開紅單、至少開罰6千元。po文網友說，白奧迪女駕駛切來切去、還說他逼車，停紅燈時說要叫警察，怎麼不去叫？只會用手指？有網友留言說，如檢舉對方無故停車會過耶。請繼續往下閱讀...轄區市警一分局交通組說明，經查該案已受理民眾檢舉在案，經檢視相關檢舉影像後，確認白車女駕駛違規屬實，已依法製單舉發，白車女駕駛是違反《道路交通管理處罰條例》第43條規定，可處6000元至3萬6000元罰鍰。南市警一分局呼籲，駕駛人在路上行車時應遵守交通規則，切勿驟然減速、煞車或於道路中暫停等危險駕駛行為，以維護其他用路人安全，警方會持續加強取締違規行為。    ,https://news.ltn.com.tw/news/society/breakingnews/5381867
清明連假宜蘭防塞車 警方啟動交通快打,社會,2026/03/25 11:53,清明連假宜蘭防塞車，警方將啟動交通快打機制。（警方提供）宜蘭縣政府預估清明4天連假，將湧入返鄉及出遊潮，國道5號南下路段預估4月3日清晨6點至晚間8點、4日清晨6點至下午5點為車多壅塞時段，針對縣內各景區疏導人車，縣警局將啟動「交通快打機制」，排除突發性壅塞。宜蘭縣府交通處預估，清明連假首日國5雙向車流合計近8萬輛次，次日也有7.5萬輛次，南下車多；5日則開始出現北返車潮。縣內各風景區車流主要集中於4日、5日。請繼續往下閱讀...台鐵因應清明疏運，4月2日至4月7日共計6天，全線加開各級列車總計165班，其中行駛經宜蘭地區包含彰化-台北-花蓮新自強列車EMU3000共8班；彰化-台北-台東新自強列車EMU3000共2班。全台也有86條國道客運指定路線推出6折票價優惠，宜蘭縣府鼓勵民眾搭乘大眾交通工具，力薦購買299元「台灣好行3日券」，不僅省荷包，更能輕鬆暢遊宜蘭各景點。宜蘭縣警察局表示，各分局除編排警力加強墓區及熱門風景區周邊疏導工作外，也將啟動交通快打機制，強化機巡密度及反應能力，針對突發性壅塞路段即時察覺、快速到崗，排除壅塞情事，有效維護人、車流暢行。清明連假宜蘭警方將在重要交通要道，布署警力疏導交通。（警方提供）    ,https://news.ltn.com.tw/news/society/breakingnews/5381859
台東狼師把女學生當小情人 強抱含耳拍臀判刑6個月,社會,2026/03/25 11:41,台東一名張姓國小老師利用與校內女童的師生信任關係，假借載送名義將其帶往山區林道，竟在車內實施猥褻行為。（資料照）台東一名張姓國小老師利用與校內女童的師生信任關係，假借載送名義將其帶往山區林道，竟在車內實施猥褻行為。案經台東地方法院審理，考量張男在審理期間坦承罪行，依對於未滿14歲之女子為猥褻行為罪，判處有期徒刑6個月，得易科罰金。判決書指出，張男於民國112學年度擔任某國小科任教師。113年2月間，他駕車搭載就讀國小六年級的女生前往某林道，張男竟從駕駛座移至後座，將她抱起跨坐在自己腿上，不僅以口含住她右耳，更讓女童躺在腿上拍打其屁股，甚至試圖強行親吻。當時女童因懾於老師的權威不敢大聲反抗，僅能擺頭閃躲隱忍，返家後情緒潰堤向家人哭訴，全案才因此曝光。請繼續往下閱讀...檢警調查發現，張男與女童的互動早已逾越師生分際。根據通訊軟體截圖顯示，張男曾傳送「前世小情人」、「我愛你」等不當訊息，甚至在電郵中稱呼女童為「親愛的寶寶」。校安調查報告也提到，張男曾多次贈送衣服、巧克力等私人物品，顯見其主觀上已將師生關係扭曲為男女情愛。張男甚至還傳訊息給她家人「與其讓她四處交男朋友，不如讓她有個感情的依歸」。法官在判決中嚴厲斥責，張男身為人師，本應守護學生身心發展，卻利用女童思慮未臻成熟、處於弱勢地位的機會，滿足私慾。儘管張男在偵查初期矢口否認，辯稱是「把女童當女兒教育」、「測試女童是否對人人都好」，直到法院準備程序時才改口認罪。法院考量張男最終坦承犯行、態度尚可，但因女童及其家屬感受極大恐懼，案發後至今不願原諒，雙方也未達成和解，因此不予宣告緩刑。    ,https://news.ltn.com.tw/news/society/breakingnews/5381823
滑Tinder急見帥哥 台南護專妹慘收「手槍照」恐嚇,社會,2026/03/25 11:24,警方指出，這是感情詐騙常見的恐嚇手法，呼籲民眾遇到以後先先向警方求助。（民眾提供）就讀護理專科的陳姓女學生，在約會軟體Tinder上看到帥哥，就急著要見面，詐騙集團見她上鉤，竟以手槍照片恐嚇，不然找「黑人小弟處理」，陳女嚇到買5萬元點數作保證金，店員察覺有異，通報警二分局員警到場攔阻，並安撫陳女情緒。​昨天下午5點，陳女到超商準備購買鉅額點數，神情很慌張，店員覺得陳女可能又是陷入感情詐騙的學生，因此通報警二分局民權派出所。一開始陳女只是不斷跟警察說沒事，只是想買點數，但在警方堅持詢問買點數目的時，陳女才坦承在Tinder看到帥哥照片，雙方改以通訊軟體聯繫並相約見面。請繼續往下閱讀...​帥哥聲稱出門需經理同意，要求先付點數確認身分，陳女不接電話，對方竟傳送手槍照片，並恐嚇若不聽從指示，將處理她的家人，員警向陳女說明是典型的假交友詐騙手法，陳女驚覺落入圈套，停止購買點數。​二分局強調，近期網路交友詐騙頻傳，民眾參與社群互動應保持理性，切勿輕信陌生人說詞或洩露個人隱私，面對任何恐嚇言論應保持冷靜，並立即撥打165反詐騙專線或尋求警察機關協助。台南護專女玩交友軟體急見帥哥，遭傳手槍照恐嚇買5萬元點數。幸超商店員機警通報，二分局員警及時攔阻詐騙。（民眾提供）    ,https://news.ltn.com.tw/news/society/breakingnews/5381794
2度出庭拿手機偷錄還現場直播 男遭起訴求重刑,社會,2026/03/25 11:17,台北地檢署今依涉犯妨害祕密、違反個資法等罪，將林男起訴，建請法院從重量刑。（記者吳昇儒攝）44歲林姓男子去年分別因涉犯詐欺案、妨害自由等案件，出庭接受檢察事務官、檢察官偵訊、訊問。林男竟在訊問室、偵查庭內同步直播。事後，被民眾向台北地檢署檢舉，同時也被檢察官等相關在場人員提告。北檢今依涉犯妨害祕密、違反個資法等罪，將林男起訴，並認為林男嚴重損害司法公信力，干擾偵查秩序，建請法院從重量刑。檢方查出，林男於去年9月4日因涉及詐欺案件，與廖姓女子一同被傳喚到台北地檢署第二辦公室第四訊問室內應訊，過程中林男竟利用手機錄下周姓檢察事務官與廖姓女子的訊問內容及廖女的個資資料，同步透過直播軟體，進行直播。請繼續往下閱讀...同年10月1日，林男又因涉及妨害自由案件，與黃姓男子一起到台北地檢署第29偵查庭，卻在應訊期間，用手機錄下劉姓檢察官與黃男的訊問內容，大膽的在現場進行直播，事後又將錄音檔播放給聊天室內的成員觀覽。檢察官偵辦該兩起案件後，林男均不起訴處分確定；但有民眾發現林男曾在網路上直播兩次的訊問內容，便向北檢檢舉；此外，被偷錄音的檢察官、檢察事務官與黃姓當事人也對林男提出告訴。台北地檢署今日偵結，認定林男所為已違反個人資料保護法、妨害秘密等罪，依法提起公訴。檢察官也請法官審酌，林男明知偵訊程序具高度祕密性，竟私自竊錄偵訊內容，並公然於網路平台直播，其行為主觀惡念甚深，嚴重損害司法公信力並干擾偵查秩序，且造成訴訟參與人個資隱私受損，犯後未見悔意，請從重量刑，以儆效尤。    ,https://news.ltn.com.tw/news/society/breakingnews/5381776
