Title,News_Type,date,content,url
台南警方10日追回神像 徐健麟贈「卯兔星君」水墨畫致敬,社會,2025/12/03 13:39,麻豆警偵破神像遭盜案，市府副秘書長徐健麟照原雕像繪「卯兔星君」贈警分局。（麻豆警分局提供）下營九龍太子宮珍貴神像「卯兔星君」遭竊，全台僅此一尊、供奉已有27年。台南麻豆分局警方經監視器比對與跨縣市追緝，僅用10餘日便成功破案，在高雄與台中拘捕3名竊嫌，並尋回失竊金身。為表彰警方辛勞，市府副秘書長徐健麟今（3）日前往麻豆分局，致贈加菜金及親手繪製的「卯兔星君」水墨畫，並題詩紀念破案：「卯兔星君遭賊搬，麻豆神捕旬破案；廟宇香火安民心，警光慧日破諸闇。」徐健麟表示，神像失竊不僅是宗教文物損失，更牽動地方信仰與民心，感謝警方日夜投入偵查，使神像平安歸位，安定地方民眾心情。請繼續往下閱讀...徐健麟的畫作耗時4天完成，師承水墨大師王海峰，參考文化部「人間國寶」木雕大師陳啟村於1999年雕製的神像原作，以水墨技法細膩呈現神韻。陳啟村老師也出席贈畫儀式，感謝市府與警方讓神像回到廟宇，繼續護佑鄉里。市長黃偉哲讚揚警方專業與使命感，強調此次破案意義重大，不僅追回珍貴文物，更守護地方信仰、文化脈絡與市民安心感。徐健麟並勉勵麻豆分局，期望未來在打擊詐欺、掃毒及維護社會秩序等案件上，延續本案「鍥而不捨、使命必達」精神，全力守護台南治安。徐健麟繪製「卯兔星君」耗時4天完成。（麻豆警分局提供）熱門賽事、球星動態不漏接    ,https://news.ltn.com.tw/news/society/breakingnews/5266235
想「坐牢閃兵」失算 他逾期不入營多判5個月,社會,2025/12/03 13:35,穆姓役男誤信刑案判5年以上免役，未申請延緩，導致逾期5日未入營，台南地院依妨害兵役治罪條例判徒刑5月。（資料照）穆姓男子以為自己如果因刑案被判5年以上就不用當兵，乾脆沒理會常備兵徵集令，無故逾期5天未入營，台南地方法院認定他想藉此逃避兵役，依妨害兵役治罪條例判刑5月，可易科罰金。穆男是陸軍常備兵役男，依法必須接受徵集入營服役1年，軍方寄出徵集令，由穆男的母親分別在1月與4月簽收，要他如期到永康區公所與新化區公所集合。請繼續往下閱讀...不過，穆男始終沒有按表列日期報到，直到入營期限屆滿仍沒有出現，案經台南市政府民政局函送偵辦，他到案時否認逃避兵役，他的家人也有轉告徵集令，但他以為自己另有刑事案件，若未來被判決須執行5年以上徒刑，就可以不用當兵，因此請家人到新化區公所辦理延緩入營，他沒有逃避的故意。法院調閱新化區公所函文，確認未受理穆男任何延緩徵集申請，又有陸軍常備徵集令、民政局函及步兵第二○三旅公文等資料，證明他沒有在期限內入營服役。法官認為，穆男明知自己是役齡男子，卻怠於履行兵役義務，事後再以誤解法律為由卸責，說法欠缺具體證據，不足採信。法官並考量穆男犯後否認犯行，還有前案紀錄，綜合其犯行動機、目的、手段及家庭經濟狀況，依妨害兵役治罪條例第4條第5款，量處有期徒刑5月，並定易科罰金1日折算1000元。全案仍可依法提起上訴。熱門賽事、球星動態不漏接    ,https://news.ltn.com.tw/news/society/breakingnews/5266234
民法特留分制度修法方向曝光 擬廢兄弟姊妹份額、導入貢獻制,社會,2025/12/03 13:21,立法院司法及法制委員會邀請法務部部長鄭銘謙就「民法繼承編特留分制度之檢討」進行專題報告，並接受立委質詢（記者田裕華攝）隨著廢除民法特留分的呼聲升高，立法院司法法制委員會今上午進行專題報告，法務部長鄭銘謙提及，因應社會高齡少子化與家庭型態的快速變遷，特留分此項旨在兼顧遺囑自主與親屬基本保障的制度，確有全面檢討之必要，未來修法方向將聚焦於遺囑自主、家庭倫理與弱勢保障之間尋求平衡。鄭銘謙表示，民間近期要求刪除此規定的連署迅速成案，顯示社會對於尊重財產自主處分權、避免手足間繼承爭議的訴求強烈。不過，法務部亦接獲實際陳情案例，例如弟弟因病失意識、由兄弟姊妹實際照顧，但其配偶卻置之不理的情況，凸顯出保留特留分在特殊情況下仍具有互相照顧與保障的社會政策功能。請繼續往下閱讀...鄭銘謙強調，除了兄弟姊妹特留分之外，修法討論的範圍還將涵蓋特留分的比例是否應降低，以及是否應增列特別貢獻制度，以反映繼承人對被繼承人或家業的貢獻。在未來修法過程中，法務部將同時參酌國際立法例。鄭銘謙說，鄰近國家如韓國，其憲法法院已於近年宣告兄弟姊妹特留分違憲；日本則為因應高齡化社會，調整了繼承法，增設生存配偶居住權與特別貢獻規定等，這些都將納入法務部的參考。鄭銘謙指出，法務部面對新一波民意，已回顧2016年曾提出降低特留分比例的修法草案，該草案當時因各界對於代位繼承、特留分降低幅度，以及兄弟姊妹法定繼承人地位等議題意見分歧，尤其外界擔憂可能影響女性繼承保障，最終因屆期不連續而未完成審議。鄭銘謙表示，法務部今年4月委託學者專家，就民法繼承編進行廣泛檢討，研究成果報告預計將於今年12月底出爐，內容涵蓋遺囑自由調整、遺產分割、特留分比例與適用範圍等。法務部規劃將在取得研究報告後，於2026年初召集學者專家召開研修會議，綜合衡酌各方利益後，正式啟動立法程序，提出新版修法草案。熱門賽事、球星動態不漏接    ,https://news.ltn.com.tw/news/society/breakingnews/5266213
少女猜拳輸到脫光遭2少年性侵 加害者家長僅願賠1萬,社會,2025/12/03 12:37,新北地院近日審結，判處兩名少年及其監護人各需賠償少女50萬元。（記者吳昇儒攝）新北市一名廖姓少年去年3月27日凌晨，邀請少女小妤（化名）前往友人家中玩猜拳遊戲，輸家需喝酒或脫一件衣服。結果小妤運氣太差，脫掉全身衣物。未料，廖姓少年約來楊姓少年，見其脫光躺在床上，竟然強行性侵。少女父親得知後，對兩人提告並提告求償，但廖姓少年的父親僅願以1萬元和解。新北地院近日審結，判處兩名少年及其監護人各需賠償少女50萬元。檢警調查，廖、楊2人於案發當時，得知少女因輸拳脫光衣物，僅以棉被覆蓋身軀，竟聯手性侵對方；少女父親得知後，陪同女兒報警，經少年法庭審理後，判處兩名少年入感化教育處所施行感化教育。請繼續往下閱讀...少女父親另也對兩人及其法定代理人提出侵權行為損害賠償告訴，分別求償100萬元。廖姓少年及其父親辯稱，當日晚間是少女自願參加猜拳脫衣遊戲，並未違反其意願要求她脫衣服。廖父更稱，雖然孩子做得不對，但對方顯有過失，願意以1萬元與對方和解，至於少女開出和解金額100萬是天價。楊姓少年法定代理人則稱，已經想辦法盡到監督責任，無法負擔對方請求的100萬元，頂多能負擔1萬元。法官審理後認為，楊、廖姓少年性侵少女造成其身心嚴重傷害，而兩名加害人的法定代理人未提出證據證明有進行監督並未疏懈，或縱加以相當監督，而仍不免發生損害等情形。法官認為，依被害少女受侵害所受精神上痛苦等情狀，兩名加害人及其法定代理人，應負連帶責任賠償各50萬元，共計100萬元。熱門賽事、球星動態不漏接    ,https://news.ltn.com.tw/news/society/breakingnews/5266136
台中東區暗夜濺血！汽車美容店喬債務7煞設局持械痛毆討債3人 ,社會,2025/12/03 12:34,警方到場逮捕涉案嫌犯。（民眾提供）台中東區一間汽車美容店今（3）日凌晨突成暴力現場，7名男女持鋁棒、木棍與武士刀痛毆3名討債男子，警方獲報火速集結20名快打警力趕赴，由於現場鐵門深鎖、嫌犯拒不開門，警方差點破門攻堅，最終仍成功壓制所有涉案人，將7人全數帶回，並查扣多支棍棒、武士刀及K他命，而3名傷者送醫幸無生命危險。事發於今日凌晨2時50分，第三分局接獲報案指稱十甲東路上一間汽車美容店爆發鬥毆，警網趕抵時原本喧鬧場面卻瞬間安靜，店家鐵門緊閉、屋內卻明顯有人影晃動，警方喝令開門未果準備破壞鐵捲門，就在破門器具架好、鐵門即將被破壞前，屋內眾人瞬間態度一百八十度大轉彎，趕緊把門打開，被警方一舉壓制。請繼續往下閱讀...經查，衝突起因於一筆40多萬元債務，積欠款項黃姓女子（29歲），原本與債主徐男（24歲）約在該汽車美容店內協商，未料雙方談判破裂，黃女不但未解決債務，反而找來洪男（34歲）、夏男、連男、黃男、張男與陳男等6名男性友人助陣，演變成7打3的火爆現場。徐男與同行林男、張男3人抵達後，雙方原本只是口角，卻突然從屋內衝出多人，手持鋁棒、木棍、甚至武士刀包圍討債3人痛毆，導致3人頭部、臉部皆流血，雖然意識清楚，但已滿身是傷。警方現場查扣棍棒、武士刀以及鋁棒還搜出毒品K他命，儘管洪男等7人無黑道幫派背景，但行為已構成妨害自由、聚眾鬥毆與毒品罪嫌，警詢後全案移送台中地檢署，後續朝組織犯罪條例偵辦。警方查扣棍棒等證物。（民眾提供）警方查扣一把武士刀。（民眾提供）熱門賽事、球星動態不漏接    ,https://news.ltn.com.tw/news/society/breakingnews/5266135
輕豪宅被狗尿泡爛！房客不認帳 房東找專業公司驗污染濃度超標10倍,社會,2025/12/03 12:17,房客養的狗隨地尿尿把家具泡爛，房東提告獲賠37萬餘元。示意圖，與本新聞無關。（資料照）汪姓女子在苓雅區買下一間輕豪宅，裝潢後租給許姓女子，許女有告知會在屋裡養一隻馬爾濟斯，汪女同意，但另簽寵物協議，要求保持屋內環境乾淨；一年後租約到期，汪女點交時發現屋裡充斥惡臭，但許女不認帳，汪女找專業檢驗公司檢驗臭味來源，發現屋內異味污染物濃度數值超標10倍，提告求償66萬餘元，法官判許女應賠37萬餘元。判決指出，汪姓女子買下平均單價40萬元一坪的輕豪宅後，將裝潢好的房子以每月2萬6500元租給許姓女子，許女租房時有告知會在屋裡養一隻馬爾濟斯，汪女同意房客養狗，要求應保持良好衛生環境、避免產生氣味，並應於交還房屋時，將全屋清潔消毒至無異味的原狀。請繼續往下閱讀...去年9月，租賃到期，汪女帶著房仲人員去點交房子時差點被臭到昏倒，只見房內地板尿漬滲透毀損，沙發、茶几、床墊也都被狗尿泡爛，許女堅稱，自己交屋前已完成清潔，不願意再賠償，汪女無奈，花錢委請檢驗科技公司入屋檢驗臭味來源，報告發現異味污染物濃度數值為100，已超出工業區及農業區以外固定污染源空氣污染物排放標準地區濃度標準10。汪女不滿提告求償66萬餘元，高雄地方法院簡易庭審理時，許女同意賠償部分損壞的家具，但法官綜合相關事證後，算出汪女為了修繕房子至少長達7個月無法出租，加上家具受損程度，判許女應賠37萬餘元，可上訴。熱門賽事、球星動態不漏接    ,https://news.ltn.com.tw/news/society/breakingnews/5266116
男怕酒駕尋母被罰 求助警尋獲,社會,2025/12/03 12:10,男酒後與母口角怕酒駕尋母被罰求助警尋獲。（圖由民眾提供）高雄旗津區53歲魏姓男子男因飲酒問題與母親口角，75歲老母親負氣離家，遲遲未見返家，魏男擔心發生意外，因自己剛喝酒無法騎車外出尋找，不得不在路邊攔警求助，警方在巷口1處昏暗騎樓下發現魏母身影，協助母子團圓。鼓山分局今（3）日表示，員警於前日下午在廟前路旗津老街，被神情慌張的魏男攔下，他表示年邁母親（75歲）自行外出後不知去向，鼓山警方獲報後立即展開地毯式搜索，由於適逢假日，旗津老街遊客眾多，增加尋人難度。請繼續往下閱讀...經了解，魏男當天因飲酒問題與母親發生口角，母親一氣之下負氣離家，魏男見母親久未返家，加上母親年事已大，擔心會發生意外，但因剛飲酒一旦騎車出外尋找，將面臨酒駕被取締，無法騎車外出尋找。魏男恰巧在路邊發現有員警巡邏，立即上前攔住員警求助，警方得知後，立即調派警力於老街周邊擴大搜尋，雖然人潮眾多，但警方仍未放棄，擔心天色漸暗、氣溫驟降，不利年邁的魏母。警方最後在通山路與文正巷騎樓發現獨坐的魏母，通山路與文正巷騎樓發現獨坐的魏母，警方將魏母護送返所安置，並藉機勸導魏男應少飲酒、多關心年邁母親，魏男對警方積極熱心的協助深表感激，並承諾會改善生活習慣。鼓山分局呼籲，家中有年長者或患有失智症之親屬，應多加留意其動向，避免讓其獨自外出，建議可向社福單位申請「愛心手鍊」，或在隨身衣物繡上聯絡方式，以便走失時警方或民眾能迅速聯繫家屬。熱門賽事、球星動態不漏接    ,https://news.ltn.com.tw/news/society/breakingnews/5266110
男子ATM前鬼祟遭鎖定 警放讓他離去抽「喪屍菸彈」逮正著,社會,2025/12/03 12:07,警方現場清點毒品。（記者鄭景議翻攝）台北市信義區1名超商店員，昨日下午發現1名男子在店內操作ATM多次失敗、行跡可疑，機警通報信義分局五分埔派出所。員警到場後，發現該名34歲的張姓男子態度消極且身體不正常抖動，遂使出「欲擒故縱」之計，先假意放張男離開，果不其然張男離開後竟大方地抽起有「喪屍菸彈」的電子煙，當場被員警逮個正著，並查獲毒品依法送辦。警方表示，當時員警到場後協請張男返回派出所釐清資料，過程中張男極不配合，警方經確認其身上並無他人提款卡後，決定先抄登詳細資料，並任他自行離去。請繼續往下閱讀...如警方所料，張男離開派出所後，隨即拿出電子煙，開心抽起疑似含有依托咪酯成分的「喪屍菸彈」。埋伏在後的員警見狀，立即上前表明身分進行查緝。張男驚嚇認栽後，態度隨即丕變轉為配合，並主動交付身上剩餘的毒品咖啡包及搖頭丸。經初檢，持有的毒品均呈陽性反應。信義分局詢後依違反《毒品危害防制條例》將張男移送台北地檢署偵辦。也呼籲民眾，毒品嚴重危害身心健康，不論以何種形式混入電子煙、餅乾、飲品皆屬違法。切勿心存僥倖或因一時好奇而施用毒品，避免觸法害己。本分局將持續加強查察，全力打擊毒品犯罪，守護市民安全。熱門賽事、球星動態不漏接    ,https://news.ltn.com.tw/news/society/breakingnews/5266096
警「趕現場」閃燈開蜂鳴闖紅燈 婦騎車疑未注意相撞,社會,2025/12/03 12:04,新莊警分局交通中隊於事故現場指揮來往車輛，並進行繪測。（記者徐聖倫翻攝）新莊警分局薛姓警員昨晚間獲報前往處理糾紛，他開蜂鳴器、警示燈闖過紅燈路口，不料對向道的騎士47歲劉姓婦人疑似沒聽到，與薛員發生碰撞。所幸這起意外雙方均為輕傷，酒測值亦都為0，詳細肇責待釐清。據悉，新莊警分局昌平派出所薛員當時正值巡邏勤務，他在中央路上接到任務，指示前往宏匯廣場處理一起糾紛，於是他打開警示燈與蜂鳴器，準備闖過中央、中華路口的紅燈。請繼續往下閱讀...中華路上車輛聞聲見到警示燈，紛紛慢下車速閃避，而劉婦疑似沒有聽到蜂鳴器，見眼前為燈號為綠燈就直接騎過，正好與剛起步的薛員發生碰撞。雙方應聲倒地，薛員身上多處擦傷，劉婦則是腳踝扭傷，2人送醫救治後均無大礙。雙方進行酒測，酒測值均為0，劉婦表示自己並沒有注意到警方要出勤，沒有聽到蜂鳴器，才會依燈號行駛。新莊警分局交通分隊後續進事故現場繪測，並調閱相關監視器，詳細肇責待後續釐清。監視器拍下車禍發生全程。（記者徐聖倫翻攝）熱門賽事、球星動態不漏接    ,https://news.ltn.com.tw/news/society/breakingnews/5266106
獨家》基隆調查官涉與越籍人妻交往還幫查個資 調查局送辦,社會,2025/12/03 11:57,調查局追查徐姓調查官風紀問題時，進一步查出他曾利用公務電腦幫交往對象查詢資料，隨即主動立案調查。（記者吳昇儒攝）調查局基隆市調查站一名徐姓調查官涉嫌與越南籍人妻交往，日前遭檢舉後，已被記過處分。調查局北部地區機動工作站卻進一步查出，徐姓調查官涉嫌利用公務電腦，幫越南籍人妻查詢資料，報請基隆地檢署指揮偵辦，近日前往基隆市調查站查扣相關設備，全案將朝違反個人資料保護法等罪偵辦。調查局指出，該案屬於局內「自清」案件，主動立案發交北部地區機動工作站調查，並報請基隆地檢署檢察官指揮偵辦。請繼續往下閱讀...據悉，單身的徐姓調查官先是被傳出與已婚的越南籍人妻交往，遭到對方丈夫檢舉。調查局基隆市調查站調查釐清後，報請局本部進行懲處，調查局近期已與徐員記過處分，且於調查期間發現，徐員涉嫌利用公務電腦幫該名人妻查詢資料，另發交北機站立案偵辦。近日見時機成熟，前往基隆市調查站進行搜查，並查扣相關設備。據了解，徐員原在基隆市調查站內負責偵辦毒品等案件，近年在偵辦案件時，輾轉認識該名越南籍人妻，卻陷入其中與其交往；因徐員後來已經轉為負責國安案件，此次竟透過公務電腦幫忙對方查詢資料。偵辦人員憂心的是，徐員工作內容會接觸到國安機密資料，擔心有外洩給對方的情形，目前已將電腦等相關設備扣回，將逐一比對，釐清有無洩漏。初步調閱，尚未發現有國安資料外洩情形，目前仍朝違反個人資料保護法偵辦。基隆地檢署今則表示，該案由調查局主動報請檢察官指揮偵辦，目前案件仍持續偵辦中，不便透露相關偵辦內容。熱門賽事、球星動態不漏接    ,https://news.ltn.com.tw/news/society/breakingnews/5266093
台中怪男橫躺車道翻滾  民眾傻眼：想製造假車禍？,社會,2025/12/03 11:55,台中一名男子（紅圈處），昨天不明原因躺在大里中興路的行人穿越道和機車優先道上翻滾，警方表示將依法開罰。（民眾提供）台中一名男子，昨天下午3點多，先是在大里區中興路和長春路口的行人穿越道上翻滾，民眾看到擔心被過往的車子輾過都捏了一把冷汗，沒想到沒多久這名男子自己起身，走到一旁又躺在機慢車優先道上，因剛好有公車行經，民眾傻眼問「連公車都要碰瓷？」霧峰分局警方表示，並未接獲民眾報案，因男子已經違反道路交通管理處罰條例，將予以裁罰與勸導。這名身分不明男子，昨天下午3點45分左右，突然躺在大里區中興路和長春路口的行人穿越道上，並左右來回翻滾，引發民眾側目，路過民眾經過看到都狐疑「他到底在幹什麼？」擔心遭行經車輛輾過。請繼續往下閱讀...沒多久男子自行起身，原以為就要離開，沒想到男子走到一旁的機慢車優先道上，又突然躺在路中央，一輛公車剛好到站停靠路邊，擔心壓到他不敢開車，民眾看到傻眼問「連公車都要碰瓷？」覺得男子的行為太危險。霧峰分局警方表示，並未接獲民眾報案或檢舉，不過該名男子行為恐涉道路交通管理處罰條例第78條第1項第4款，可處新台幣500元罰鍰，將通知男子到案說明，予以裁罰與勸導，避免類似行為再次發生。熱門賽事、球星動態不漏接    ,https://news.ltn.com.tw/news/society/breakingnews/5266089
毒品唾液快篩執法上路  瑞芳警18小時查獲2起毒駕,社會,2025/12/03 11:50,新北市瑞芳警分局警員2日受理一起機車與自小客車交通事故時，察覺46歲的廖姓騎士神色恍惚，經施以唾液快篩，呈現安非他命陽性後送辦。。（記者林嘉翻東攝）警政署為有效打擊吸食毒品後駕車案件，運用「毒品唾液快篩」試劑檢測，上月20日上路執法。新北市瑞芳警分局12月起持續強化路檢與巡邏勤務，2天下來查獲2起毒駕案，與1名毒品通緝犯；其中2起毒駕案接連發生，警方18小時緝獲；警訊後，將3人依毒品危害防制條例送辦。12月1日晚間7時許，瑞芳警分局交通分隊員巡邏時，在市區發現一名騎士搖搖晃晃，時速忽快忽慢，上前盤查為29歲許姓男子，經實施測驗觀察紀錄表發現，許男已有多項不能安全駕駛情形，經施以唾液快篩，結果呈K他命陽性反應，採集尿液後依法究辦。請繼續往下閱讀...2日下午1時許，警方處理瑞芳區一起機車與自小客車交通事故時，察覺46歲的廖姓騎士神色恍惚，疑有吸毒等症狀，遂對他施以唾液快篩，呈現安非他命陽性，經採尿後送辦。昨晚10時許，警員掌握可疑毒品人口出沒在建基路，前往追查時發現路上1名男子行經可疑，上前盤查竟是48歲謝姓男子通緝犯，接連被基隆、台北地檢署發布的毒品通緝。瑞芳警分局長沈明義指出，警方現行執法已全面導入「毒品唾液快篩」制度，可於短時間內確認是否施用毒品，將大幅提升攔阻毒駕效率，防止駕駛人心存僥倖上路；警方將持續強化巡邏、路檢勤務，提高見警率，落實毒品查緝作為，守護社區治安與道路安全。新北市瑞芳警分局警員2日受理一起機車與自小客車交通事故時，察覺46歲的廖姓騎士神色恍惚，經施以唾液快篩，呈現安非他命陽性後送辦。（記者林嘉東翻攝）熱門賽事、球星動態不漏接    ,https://news.ltn.com.tw/news/society/breakingnews/5266077
越南女載狗上路倒車不穩 屏警唾液快篩抓出毒駕,社會,2025/12/03 11:50,里港警分局運用新式唾液毒品快篩試劑查獲陳姓越南籍女子涉嫌毒駕。（屏縣里港警分局提供）42歲陳姓越南籍女子開車載著2隻狗上路，因倒車不穩遭警方盯上，經查她所開的車子涉及侵占，又見她精神恍惚，立刻施以新式唾液毒品快篩試劑，呈二級毒品安非他命陽性反應，當場被逮捕，為防車上2隻狗發生危險，警方也暫時將牠們帶回派出所照顧，最後才由她的朋友領回。警政署上（11）月20日起啟用毒品唾液快篩試劑取締毒駕，屏警配合政策全面啟動執法。屏縣里港警分局今（3）日表示，高樹分駐所警員顏煥偵、陳瑀桓近日執行晚間金融機構巡守勤務時，發現一部黑色自小客車形跡可疑，倒車不穩，經查該車涉侵占案，立即盤查，更發現該名越籍陳姓女子精神恍惚，疑似施用毒品，經以唾液快篩初步檢測，呈二級毒品安非他命陽性反應。請繼續往下閱讀...警方依法逮捕陳女後逕行搜索，查獲她涉嫌持有安非他命毒品3小包及吸食器等，經初步檢驗均呈安非他命陽性反應，全案依涉犯毒品危害防制條例、使用贓物罪、侵占罪移請台灣屏東地方檢察署偵辦，並持續向上溯源。警方也調查，陳女所駕車車輛車主登記在友人名下，陳女稱車子是她出錢購買，但友人報案指車子遭到侵占，雙方各說各話，還待釐清。里港警分局長邱逸樵表示，毒品駕車的危害不亞於酒駕，駕駛人施用毒品後會有判斷力下降、反應遲鈍等症狀，往往是釀成重大道路交通事故的主因，為確保用路人安全，里港警分局將持續運用毒品唾液快篩試劑強化查緝能量，展現打擊毒駕的決心，也提醒民眾切勿心存僥倖、施用毒品後駕車，一旦查獲將依法嚴辦。陳姓越南籍女子涉嫌持有安非他命毒品3小包及吸食器。（屏縣里港警分局提供）車上兩隻狗狗一度被帶回派出所照顧。（警方提供）熱門賽事、球星動態不漏接    ,https://news.ltn.com.tw/news/society/breakingnews/5266085
