Title,News_Type,date,content,url
在普廷記者會搶鋒頭 俄國記者公開求婚成功,國際,2025/12/20 18:34,俄羅斯記者巴札諾夫（Kirill Bazhanov）19日在普廷記者會上公開向女友求婚。（美聯社）俄羅斯總統普廷19日舉行年終記者會，回答從民生到烏俄戰爭等各種問題，在眾多提問記者中，有一人特別受到矚目：一名帶著紅領結的年輕記者，展示一塊牌子說，「我要結婚」。《美聯社》報導，俄羅斯葉卡捷琳堡媒體「第4頻道」（Channel 4）的記者巴札諾夫（Kirill Bazhanov），提出這個問題，不是針對普廷，而是他的女友，他在記者會上向女友歐加（Olga）求婚。普廷稱讚巴札諾夫的紅領結打扮，說「你已經準備好去登記結婚了！」巴札諾夫向普廷說，「我們很歡迎您出席婚禮」。請繼續往下閱讀...這場年終記者會充滿各式內政、國際嚴肅議題，包括退休金延後發放、建設工程疏失等問題，以及持續至今將近4年的烏俄戰爭。不過，也有較輕鬆的一面，今年除了記者求婚，還有人問普廷的車牌號碼是多少、是否認為真有一見鍾情的愛情等。這類提問被視為這場經過高度安排的年度媒體活動的一部分，讓普廷有機會藉由對五花八門的問題侃侃而談，塑造自己如父親照顧一般俄羅斯人切身問題的領導人形象。這些問題都是事先提交。在這場歷時4個半小時的記者會進行到後段，記者會主持人宣布，歐加答應了巴札諾夫的求婚，普廷立刻又打趣說，要開始收禮金了。俄羅斯總統普廷19日舉行年終記者會。（路透）    ,https://news.ltn.com.tw/news/world/breakingnews/5284694
做公關洗形象？普廷罕見公開承認：我戀愛中,國際,2025/12/20 18:30,普廷19日舉行年終記者會。（歐新社）俄羅斯總統普廷19日在年終記者會上語出驚人承認，自己戀愛中。不過，這個橋段有可能是當局安排好，藉此軟化普廷的獨裁者形象。《美聯社》報導，這場長達4個半小時的記者會，記者除了提問內政、外交嚴肅議題，也有各種五花八門的問題，接近尾聲時，一名記者問普廷，過去曾說相信一見鍾情，那麼是否正在戀愛？一向高度保密私生活的普廷簡短回答「是」，但是並未透露戀愛對象。請繼續往下閱讀...英國《鏡報》報導，普廷所指的可能是據稱與他已密戀18年、現年42歲的前俄國奧運體操選手卡巴耶娃（Alina Kabaeva）。據稱兩人育有兩名子女：10歲的伊凡（Ivan Spirodonov）和6歲的弗拉迪米爾（Vladimir Spirodonov），均使用假名，普廷也從未公開談過這兩名孩子。報導指出，這個問題可能也是事先安排好的橋段。一種推測是，此舉用意是讓現年73歲的普廷，公開承認他隱藏多年的這個家庭關係；另一種說法是，只是想藉此表達他也是有愛的一面，軟化他冷酷獨裁者形象。不過，先前有報導指稱，普廷背著卡巴耶娃，與俄羅斯選美小姐赫謝娃（Alisa Kharcheva）有染，兩人認識時她17歲，常趁卡巴耶娃不在時，偷偷進普廷官邸。另外，普廷據稱也和銀行家克里沃諾吉赫（Svetlana Krivonogikh）長期有婚外情關係，生下一名女兒，現年22歲。    ,https://news.ltn.com.tw/news/world/breakingnews/5284690
斬俄國石油命脈 烏克蘭首度證實無人機突襲俄裏海鑽油平台,國際,2025/12/20 18:02,烏克蘭20日表示，其無人機近日在裏海對俄羅斯能源設施發動攻擊，擊中俄國石油公司盧克石油（Lukoil）所屬的一座海上鑽油平台。（路透）烏克蘭軍方20日說，無人機近日攻擊俄羅斯在裏海的能源設施，擊中俄國石油公司盧克石油（Lukoil）所屬的海上鑽油平台，鎖定附近一艘軍事巡邏船。這是烏克蘭首度正式承認在裏海攻擊俄國鑽油設施，持續擴大打擊俄方能源基礎設施。據《路透》報導，烏克蘭武裝部隊總參謀部指出，19日這起攻擊，目標是位於裏海的菲拉諾夫斯基（Filanovsky）油田鑽油平台，以無人機擊中，損害程度仍在評估中。請繼續往下閱讀...烏軍指出，這並非鑽油平台本月首次遭到攻擊，12月至少還曾兩度受到無人機襲擊。不過，這次行動是烏克蘭軍方首度對外證實攻擊裏海俄羅斯鑽油設施。除了鑽油平台，烏克蘭軍方也說，行動中同時鎖定一艘在平台附近活動的俄軍巡邏船，相關損害情況仍待確認。烏克蘭方面說，俄羅斯石油與能源基礎設施屬於合法軍事目標，原因在於能源出口收入是莫斯科支撐攻烏的重要財源。2024年至今，烏軍已多次攻擊俄羅斯境內煉油廠與相關設施。近來，烏克蘭擴大攻勢範圍，除了空中無人機，還宣稱在黑海與地中海出動海上無人艇，襲擊俄羅斯所謂的「影子船隊」油輪，顯示其對俄能源運輸與生產鏈的打擊策略正持續升級。    ,https://news.ltn.com.tw/news/world/breakingnews/5284647
27歲大學生遭認定以色列間諜處死 伊朗人權團體批：酷刑逼供,國際,2025/12/20 17:34,伊朗男大生被認定是以色列間諜處死。（路透）伊朗司法部門20日說，當局已處決一名當以色列間諜的男大生。人權團體則質疑相關判決正當性，死刑判決可能建立在遭刑求取得的供詞之上。伊朗與以色列近年衝突升高，涉以色列間諜指控的死刑案件明顯增加。據《路透》報導，伊朗司法機構旗下《米贊通訊社》指出，男子替以色列從事間諜活動、與伊朗反對勢力往來，遭判處死刑，20日執行。官方未進一步公布審判細節與具體證據內容。請繼續往下閱讀...總部位於挪威奧斯陸的「伊朗人權組織」則在社群平台X發文說，遭處決的是27歲的建築系學生阿吉爾．凱沙瓦茲（Aghil Keshavarz）。間諜相關指控係建立在「在酷刑下取得的供詞」，強烈質疑審判程序的公正性。伊朗與以色列長年處於低度但持續的對抗狀態，雙方在情報、網路攻擊與代理行動層面交鋒不斷。伊朗當局過去多年來已處決多名被指控與以色列情報機構摩薩德合作、協助其在伊朗境內行動的人士。    ,https://news.ltn.com.tw/news/world/breakingnews/5284627
北美航太司令部追耶誕老人70年 最溫柔「軍事任務」竟因1通誤撥電話,國際,2025/12/20 17:03,NORAD Tracks Santa首度開放官網直接撥打電話，更支援含中文內9種語言。（圖片擷取自NORAD Tracks Santa官網）每到耶誕夜，全球不少孩子守著地圖等耶誕老公公報到，在美國，還真有一群「軍方人員」全年備戰，只為這一晚追蹤紅衣老人行蹤，北美航太防衛司令部（NORAD）從冷戰時期一路追蹤到太空時代，長達70年來，用雷達、衛星與噴射機，完成世界上最溫馨的「軍事任務」。根據《美聯社》 報導，北美航太司令部（NORAD）是美國與加拿大聯合成立的軍事機構，主要任務是監控北美空域安全、防範飛彈與空中威脅。不過，每年耶誕夜，這個嚴肅的單位卻會畫風突變，化身「耶誕老人情報中心」，為全球孩子即時更新老人的飛行路線。請繼續往下閱讀...依照傳統，從耶誕夜凌晨開始，超過千名志工輪班接聽熱線電話，回答孩子們最關心的問題：「耶誕老人到哪了？會不會找不到我家？」今年更首度開放透過官方網站直接撥打電話，讓北美以外地區也能即時參與，官網還支援包含中文、英文、日文、韓文在內的9種語言。這項看似荒謬卻溫暖的傳統，起源其實相當戲劇化。位於美國科羅拉多斯普林斯的西爾斯百貨在報紙上刊登了一則廣告，鼓勵孩子們通過一個特別的電話號碼給耶誕老人打電話，但是廣告上給出的熱線電話號碼出現了印刷錯誤，原本應該打給「耶誕老人」的電話全部轉接到NORAD前身「大陸防空司令部（CONAD）」，當時，值班的上校接到一通孩子打來的電話，要求和耶誕老人說話，結果他順勢「演下去」，對孩子說：「Ho ho ho，我是耶誕老人。」正是因為這場即興演出，成為傳承70年的年終任務，從防空軍事機構到為孩子們追蹤耶誕老人行蹤，流露出最硬派軍事單位最柔軟的一面。    ,https://news.ltn.com.tw/news/world/breakingnews/5284610
柯克遺孀宣布 「美國轉捩點」！支持范斯競選2028美國總統,國際,2025/12/20 17:03,美國轉捩點執行長艾瑞卡表態支持范斯競選2028美國總統。（路透）31歲的美國知名保守派政治新星柯克（Charlie Kirk）9月10日在校園活動遭槍殺身亡，引發美國社會震撼。遺孀艾瑞卡18日宣布，由柯克創立，現由她擔任執行長的保守派團體「美國轉捩點」（Turning Point USA），將支持副總統范斯（JD Vance）競選2028美國總統。艾瑞卡在美國轉捩點的年度「美國節」會議開幕致詞時表示，「我們會盡可能發揮最大號召力，幫助我丈夫的朋友范斯，競選第48任美國總統。」范斯預計在21日的議程發表演說。請繼續往下閱讀...雖然美國總統川普對爭取第三任期可能性態度曖昧，但無論是理論或實務上皆窒礙難行。川普已表示2028的強力組合將是范斯與國務卿魯比歐，但沒有點名總統大位由誰接棒，范斯也尚未宣布參選。魯比歐則在近期的「浮華世界」專訪表明，如果范斯出馬爭取總統提名，「他將是我們的被提名人，而我將是最早支持他的人之一。」    ,https://news.ltn.com.tw/news/world/breakingnews/5284613
中國公民記者揭新疆集中營暴行 尋求政治庇護險遭遣送親中國家,國際,2025/12/20 16:47,中國異議公民記者關恆被美國移民暨海關執法局（ICE）扣押，險些被送往親中國家烏干達。（擷取自X平台影片）美國政府正式撤回將中國異議公民記者關恆（譯音）遣送烏干達。關恆2021年在中國新疆拍攝維吾爾族「集中營」影片，揭露中共暴行，隨後流亡美國尋求政治庇護。然而，他今年8月因川普政府緊縮移民政策遭美國移民暨海關執法局（ICE）扣押，面臨被遣送到與北京關係密切的烏干達，引發國際人權團體與跨黨派國會議員高度關切。據《路透》報導，關恆曾於2021年在新疆拍攝多部影片，記錄了中共當局對維吾爾族穆斯林實施的集中營虐待與監控。他抵達美國後公開影片，以此申請政治庇護。請繼續往下閱讀...然而，在川普政府加強打擊非法入境的背景下，關恆於今年8月因非法入境遭到ICE扣押。儘管美國政府曾定調中共在新疆的行為是「種族滅絕」，但關恆卻因其移民身分，一度面臨被送往東非國家烏干達的命運。關恆的律師陳艾倫（Allen Chen）說，他們已收到國土安全部（DHS）的信函，確認不再尋求將關恆移送烏干達，但仍不清楚華府是否會繼續嘗試將關恆遣送其他國家。。據《路透》查閱的資料顯示，美國國務院曾致函移民法官支持關恆的庇護申請。國務院民主人權暨勞工局代理副助理部長透納（Julie Turner）在信中指出，中共近年來持續騷擾並報復那些被視為「不忠」的人士，無論他們身處國內還是海外。此外，美國眾議院中國問題特別委員會民主黨領袖克利什納穆希（Raja Krishnamoorthi）也致函國土安全部長諾姆（Kristi Noem），強調美國有「道德責任」支持新疆人權迫害的受害者，呼籲釋放關恆。    ,https://news.ltn.com.tw/news/world/breakingnews/5284574
香港宏福苑大火案增為161死 6失聯個案全釐清,國際,2025/12/20 16:18,香港宏福苑案增為161死，6失聯個案已確認身分。（法新社）香港大埔宏福苑重大火警持續進行善後與鑑證工作。警方最新公布，經DNA鑑定後，於一具遺體驗出一對夫婦的DNA，將死亡人數從160人增至161人，同時，之前未能確認的6名失聯者身份已全數釐清，其中5人死於火災、1人於火災前兩年已離世。根據《香港01》 報導，香港警方今日在大埔宏福苑火災案件記者會上宣布最新鑑定結果，原本已發現的160具遺骸中，有一具經進一步科學鑑證後，確認驗出一對夫婦的DNA，因此將火災死亡人數調整為161人，警方也表示DNA鑑定工作仍在持續進行，不排除未來有更多更新。請繼續往下閱讀...之前被列為「失聯」的6名名單，經全面調查後已全部確認身份。其中5人是在火災中遇難，其餘1人則是在火災發生前兩年已經離世，至此所有失聯個案已結案，警方也結束相關查詢程序。此外，警方也特別關切參與災難遇害者辨認組（DVIU）人員的心理狀況。警務處長周一鳴指出，雖然少有處理大型災後應變，但警方每日皆安排臨床心理學家與現場人員對話交流，以確保同仁心理健康，這項服務也會持續為需要的同僚提供。本起火災是香港近年罕見的重大災難事件，引發社會各界關注。警方強調，餘下鑑證工作仍不能鬆懈，家屬亦可透過查詢中心獲取最新資訊，火場遺體DNA鑑定進度與後續調查結果，將視情況陸續公布。    ,https://news.ltn.com.tw/news/world/breakingnews/5284549
證實遭干擾 !中國南京導航大規模異常 胡錫進要求當局說清楚,國際,2025/12/20 16:11,中國南京導航大規模異常，證實訊號受到干擾。中國導航示意圖。（彭博）中國江蘇省南京市，17日傍晚發生導航大規模異常事件，「南京衛星協會」19日證實是GNSS衛星訊號（包含北斗、GPS）受到臨時干擾，但並未透露原因，《環球時報》前總編輯胡錫進怒斥這種說法不清不楚，要求當局好好解釋。南京衛星協會表示，此次干擾精準針對北斗、GPS的民用頻段，導致定位訊號無法被接收識別，即便之前下載過離線地圖，也會因出現定位漂移、無資料回饋等問題，難以進行有效導航。請繼續往下閱讀...南京衛星協會說，本次導航異常如果是「重大活動安保」所需要的臨時訊號管控措施，也屬於業界常見的安全保障手段，相關訊號在活動結束後已逐步恢復正常。胡錫進對於南京衛星協會的隱晦表述相當不滿，直指外界想知道這到底是一般的演習測試，還是不法勢力惡意搞破壞所造成的，希望南京方面之後能再做出詳細說明，不少網友也力挺「老胡」，批評當局連是誰做的、動機與目的都未解釋。    ,https://news.ltn.com.tw/news/world/breakingnews/5284570
極度貧困與低生育率罕見組合 北韓也面臨人口危機,國際,2025/12/20 15:55,北韓與其他同等貧困國家不同，生育率低迷，可能引爆人口危機。圖為北韓領袖金正恩與孩童同樂。（美聯社）生育率每況愈下是許多先進國家當務之急，但北韓也悄悄躋身低生育率國家之列，卻沒有伴隨這類轉型而來的經濟繁榮。專家警告，極度貧困與家庭規模縮小的罕見組合，可能使北韓政權在一代人的期間內面臨嚴重的人口危機。《韓國時報》（The Korea Times）17日報導，像北韓這樣貧窮的國家，家庭規模通常較大，總和生育率通常為每名婦女生育3個（含）以上子女。然而，聯合國和南韓的數據顯示，北韓婦女平均生育子女數僅1.6至1.8個，遠低於維持人口穩定所需的更替水平，更接近較富裕的東亞國家，而非低收入國家。請繼續往下閱讀...幾乎所有人均國內生產毛額相近的國家都面臨避孕措施和診所資源匱乏的問題，但北韓的情況卻更像是富裕國家，這些國家的婦女推遲結婚，並將大量精力投入到工作和教育中。這種差異導致一些觀察家對數據提出質疑。《韓國時報》訪問的專家表示，鑑於北韓似乎確實在努力提高生育率，他們認為這個數字令人信服。例如，上個月的母親節活動就由平壤當局主導，宣傳生育子女是母親的「責任」。當局也加強對實施墮胎手術的醫生和走私避孕藥具的處罰力度，執法力度在2010年代和2020年代都進一步加強。叛逃到南韓的前北韓醫生崔正勳（Choi Jung‑hoon，音譯）表示：「北韓正在發生類似南韓的變化。」他指出，人們結婚的年齡比過去晚，而且愈來愈多人選擇不結婚。他還補充說，同居而不結婚的情況愈來愈普遍，尤其是在那些希望擁有更靈活的生活、減少國家干預的年輕人中。隨著這些趨勢的蔓延，過去那種「人人都會結婚生子」的觀念正在動搖。崔正勳也表示，墮胎同樣很普遍。他回憶起自己當醫生時，墮胎雖然違法，卻很普遍，而且佔了許多醫生收入的很大一部分，「墮胎是違法的，但數量很多」。儘管北韓貧困，但其醫生和醫院的數量卻比許多經濟水準相近的國家要多，這得益於社會主義醫療體系。專家表示，該國相對密集的醫療網絡，加上對避孕的強烈需求，有助於解釋為何即使在貧困國家，生育率也能急劇下降。專家補充道，子宮內避孕器被認為是北韓境內使用最廣泛的避孕方法。一位在國家資助的智庫中專門研究北韓問題的分析師表示，近年來，中國製造的保險套和避孕藥也有愈來愈多流入北韓。除了這些產品外，外部資訊也發揮關鍵作用。南韓「統一教育研究所」教授姜彩妍（Kang Chae‑yeon，音譯）表示：「由於受到來自國外訊息的影響，晚婚或不結婚的文化在年輕一代中廣泛傳播。」她補充說，這種影響強化女性可以掌控自己人生的觀念，而不僅僅是履行生育子女的「義務」。平壤當局對出生率下降感到擔憂，已將此問題定性為國家危機，並加強提高人口的力度。專家認為，北韓政權將繼續推行提高生育率的政策，但懷疑能否扭轉更深層的趨勢，「歷史表明，一旦一個社會陷入低生育率，就很難逆轉」。    ,https://news.ltn.com.tw/news/world/breakingnews/5284559
580人驚魂！日本京都轎車擅闖平交道 遭電車撞擊起火,國際,2025/12/20 15:14,日本京都府轎車闖越平交道，遭電車撞上後起火。（圖擷自「@mezotaro」X帳號）日本京都府精華町近鐵京都線一處平交道，今（20日）上午11時許有輛轎車擅闖後遭「特急電車」撞擊並起火燃燒，還波及到另輛「急行電車」，所幸580名乘客和乘務員並未受傷。據《NHK》報導，當時是1輛4節車廂的特急電車車頭撞上轎車，隨後拖行了200公尺才停下。從對向駛來的另1輛急行電車，則是有一部分遭到火勢波及，幸好沒有造成乘客傷亡。請繼續往下閱讀...警方透露，起火的轎車上有1人重傷昏迷，疑似為車輛駕駛。據了解，事發平交道設有柵欄和警報裝置，至於轎車為何會侵入鐵道還需要進一步調查。    ,https://news.ltn.com.tw/news/world/breakingnews/5284517
泰國鬆綁午後禁酒令 店家售酒給醉客須扛責,國際,2025/12/20 14:46,泰國售酒新法規定，禁止商家向醉酒客人販售酒類。（示意照）。（資料照）泰國近期取消實施近半世紀的「午後禁酒令」，延長合法販售時段的同時，也首度明文規定，商家不得向醉酒者販售酒類。若明知顧客已有醉態仍繼續售酒，並導致事故發生，業者恐須與肇事者共同負擔民事賠償責任，責任風險大幅提高。綜合外媒報導，依新法規定，酒精飲品合法販售時段調整為每日上午11時至午夜12時，被視為泰國政府兼顧觀光與餐飲產業發展的重要鬆綁措施。然而，修法同時也新增關鍵條文，明確禁止商家向醉酒客人販售酒類，一旦因此造成他人財物損失、受傷或死亡，受害者可依法直接向店家提起損害賠償訴訟。請繼續往下閱讀...該條款與「禁止向未滿20歲者販售酒類」並行，代表酒類銷售行為不再僅以時間與年齡為判斷標準，「是否醉酒」也正式成為業者必須自行把關的法律責任。為協助業者因應新制，泰國精釀啤酒貿易協會於12月18日召開說明會指出，儘管販售時段放寬，但風險實際上轉嫁至第一線銷售端，協會建議，業者應加強員工訓練，學習辨識顧客是否已出現明顯醉態，並在必要時果斷拒售。還有，在店內設置監視器保存影像、張貼清楚告示說明查驗身分與拒售規定，以及主動提供叫車、代駕等資訊，降低酒後駕車風險，只要業者已盡合理注意義務，相關紀錄未來可作為民事訴訟的防禦依據。泰國政府表示，希望在鬆綁管制、帶動經濟的同時，建立負責任的飲酒文化，新法上路後，酒類銷售不僅是生意，更是一項必須審慎承擔的社會責任。    ,https://news.ltn.com.tw/news/world/breakingnews/5284472
阿共陰謀？ 北捷犯案兇嫌墜樓 中媒比本人還先知道,國際,2025/12/20 14:35,有網友懷疑中國媒體的製圖速度比兇嫌墜樓時間還早。（圖取自微博，本報合成）27歲通緝犯張文昨（19日）下午先在北市多次縱火，傍晚又前往台北車站M7、M8出口附近，投擲煙霧彈及持刀隨機砍人，後續步行往捷運中山站出口再次丟煙霧彈和砍人，犯案後衝進附近的誠品南西店，最終在警方包圍下，在6點50分從5樓墜樓身亡。不過有網友發現，中國「看看新聞」的微博貼文卻比張文還早26分鐘知道他要墜樓，疑似搶先在6點24分發圖文曝光張文照片，並強調「流竄到中山站連砍多人後墜樓」，令人不經懷疑案情不單純。因此有網友戲稱這起事件就像是遊戲「狼人殺」，現在狼人想當預言家，甚至還想競選警長，狼人都攤牌了，村民還在亂投票，甚至事件發生沒多久，就有一堆假帳號開始擾亂社群平台，及複製文叢生。請繼續往下閱讀...有中國網友提到，中國社群平台「小紅書」現在最熱門的話題是「轉發台灣隨機砍人的影片」，新聞台都在報導，矛頭指向台灣執政黨腐敗，導致民怨、人民不滿，因而產生的社會現象。而中國網友也普遍認同「台灣不安全」，才會導致殺人案層出不窮，還是中國安全，歸功於偉大的共產黨，盼台灣早日回歸，過上中國人該有的幸福樣子。目前張文被網友找到疑似母親為中國人，從小在中國長大，而該中國網友同時說，若有中國網友稍微帶到張文的身世背景，不僅馬上被刪評論，甚至被舉報說是造謠、打成境外勢力，呼籲台灣網友千萬別妄想跟中國韭菜理論、也別解釋，因為他們沒有腦。中國媒體疑似搶先曝光張文的資訊。（圖取自微博）只要有中國網友提到張文疑似有中國背景，就會被立刻刪文。（圖取自社群平台「Threads」，本報合成）    ,https://news.ltn.com.tw/news/world/breakingnews/5284401
