Title,News_Type,date,content,url
聯合報前編譯向洪秀柱求償 二度敗訴,社會,2025/11/25 13:39,聯合報李姓前女編譯報導指洪秀柱向習近平誇口「已買通島內大批軍政高層」，事後遭解僱，李女向洪求償860萬元，一審判李女敗訴，全案上訴，高院今判決駁回李女上訴。（記者楊國文攝）聯合報國際新聞組李姓前女編譯，不滿3年前撰寫報導稱前國民黨主席洪秀柱向中國國家主席習近平誇口「已買通島內大批軍政高層」、「習對此也深信不疑」等內容，遭聯合報發布啟事指內容不實，又將她解僱，李女認為遭解僱和洪秀柱施壓有關，對洪求償名譽損失、退休金共新台幣860萬元，一審判李女敗訴，上訴後，高等法院今仍判李女敗訴。可上訴三審。全案源於，2022年8月22日下午3時，李女在聯合新聞網發布標題為「消息人士：李上習不下已成定局兩岸更可能開戰」新聞，內文包括「島內洪秀柱等人向習誇口，已買通島內大批軍政高層，只要台海戰爭爆發，島內力量就會積極策應，台海戰爭就會變成月光下的和平進行曲，習對此也深信不疑…」等內容。請繼續往下閱讀...不過，聯合報事後認為此報導欠缺查證，內容也有疑義，不久即撤稿，並在內部調查後，將李女解僱。李女不服，對洪秀柱提起民事侵權行為損害賠償訴訟，李女主張，洪秀柱明知報導為真實，卻故意於媒體前公開指責此報導違反新聞倫理，使她的名譽權受損，要求洪賠償210萬元；另外，洪涉向聯合報施壓，導致她被解僱，嚴重侵害她的工作權，喪失退休金等，另求償650萬元，共向洪請求損害賠償860萬元。洪秀柱答辯表示，該報導內容不實，李女於報導前未盡查證義務，公然詆毀她的名譽，已對李女提起加重誹謗罪告訴，經台北地檢署提起公訴，台北地方法院審理期間，因審判長勸諭，基於不浪費司法資源考量而撤回告訴。李女另控訴她誣告部分，檢方處分不起訴確定，她認為報導不實而發布聲明指此報導為空穴來風，也沒有對聯合報施壓，無賠償責任。台北地院判決李女敗訴，李女不服，提起上訴。高等法院審理認為，李女的報導來源不明且欠缺事實根據，亦未查證，洪秀柱有相當理由確信報導不實，而發表言論指報導乃「空穴來風」、「假新聞」，僅藉此向社會大眾澄清事實，維護其名譽，係基於自衛而善意發表言論，未侵害李女名譽；另外，李女遭解僱難認與洪秀柱的行為有相當因果關係，今仍判李女敗訴。熱門賽事、球星動態不漏接    ,https://news.ltn.com.tw/news/society/breakingnews/5257261
轟！國1彰化段小貨車滿載水管突竄火,社會,2025/11/25 13:28,消防員朝冒煙的塑膠水管噴灑泡沫水線搶救。（消防局提供）轟！1輛小貨車今天（25日）行經國道1號彰化路段時，後方車斗上滿載的塑膠水管突然竄火冒出濃煙，駕駛趕緊將車輛停放路肩後，將一箱箱的塑膠水管搬到路旁，台中與彰化消防局都在據報後派員趕往現場，消防員噴灑泡沫水線後迅速將火勢撲滅，所幸火勢未蔓延，起火原因由國道警方釐清。彰化縣消防局指出，這起火燒車發生在今天上午11點多，該輛小貨車行經國道1號彰化路段時突然冒出濃煙，原來是後方載運的一箱箱塑膠水管冒煙，駕駛趕緊將車輛駛往路肩處置，所幸排除得宜災情未蔓延至整輛貨車。小貨車載運的塑膠水管竄火冒煙，消防員搶救。（消防局提供）熱門賽事、球星動態不漏接    ,https://news.ltn.com.tw/news/society/breakingnews/5257249
男子運動突倒地失去呼吸心跳 警民CPR火速開道救命,社會,2025/11/25 13:21,凃員實施CPR心肺復甦術。（記者陸運鋒翻攝）新北市胡姓男子前（23日）天下午4時許，在國防管理學院運動場運動時，突然倒地失去呼吸心跳，民眾見狀連忙跑到一旁中和交通分隊報案，凃姓員警4人趕抵後，輪流實施CPR心肺復甦術，並通報救護車前來，送醫期間警車火速開道縮時間，成功將胡男從鬼門關前救回。中和警分局今表示，57歲胡男當時在中和民安街運動公園運動時，疑因身體不適倒地失去呼吸心跳，一旁交通分隊接獲報案後，隨即派出凃員、黃員、連員及楊員等4人，攜帶AED前往火速到場，由涂、黃員及民眾輪流實施CPR心肺復甦術，並同步通報119前來救援。請繼續往下閱讀...此外，為使救護車能迅速抵達醫院，員警駕駛警車開道護送救護車，讓2.7公里的路程縮短至6分鐘，而胡男到院後即恢復心跳，成功將病患從鬼門關前拉回。警方指出，此次參與救援的同仁反應迅速、分工明確，打造出一條「生命走廊」，且於短短10多分鐘的黃金時間內，展現警民通力合作，提醒若目擊民眾突倒地，務必第一時間通報119，同時確認是否具備AED與CPR能力之人協助施作。民眾接手實施CPR心肺復甦術。（記者陸運鋒翻攝）熱門賽事、球星動態不漏接    ,https://news.ltn.com.tw/news/society/breakingnews/5257236
女所長智取白牌車司機   逮整車逃逸移工,社會,2025/11/25 13:10,新北市警察局二橋派出所女所長張岸玲（右）單人巡邏，智取超載逃逸移工的白牌車，查獲違規司機及五名逃逸移工送辦。（記者吳仁捷翻攝）新北市警方獲報三峽、鶯歌一帶逃逸外勞出沒情資，於上下班尖峰時段加強取締，二橋派出所長張岸玲當時一人巡邏機動取締，憑藉敏銳觀察，發現一輛休旅車疑似超載，上前攔停，果然發現除駕駛，還搭載五名外籍人士擠在車內，張岸玲急中生智，要台籍駕駛反鎖，將移工控制在車內，八名支援警力趕抵，赫見車上五人全是逃逸移工，依違反入出國及移民法移請移民署新北專勤隊偵辦、遣返。三峽警分局表示，二橋所長張岸玲24日傍晚巡邏途經鶯歌區八德路與桃園交界處，發現一輛轎車疑似超載，攔停時發現車上載有多名移工，眼神閃爍，認為相當可疑，由於當時僅有她一人，她立即呼叫警網支援，八名優勢警力隨即趕抵。請繼續往下閱讀...張岸玲在場警戒時，不時跟駕駛閒聊，表示再確認一下資料，讓駕駛放下戒心，持續安全控管，持電擊棒警戒，確保白牌車駕駛林男反鎖全部車門，車上5名疑似逃逸移工留置車上，將現場風險降至最低。快打警力4分鐘趕抵，迅速周邊封鎖，全案短時間內圓滿處置，五名逃逸移工全數查獲，後續依違反入出國及移民法移請新北專勤隊偵辦。至於白牌車違規部分，警方對林姓駕駛祭出超載、越級駕駛（普通駕照卻以駕駛為業） 、違停，最高處以2萬2千元罰鍰，另違反公路法部分，最低處以十萬元罰鍰，吊扣車牌、駕駛駕照至少四個月，至少吃上十二萬餘元罰單，荷包大失血。警方除依違反道路交通管理處罰條例裁罰，亦將依公路法規定函送主管機關加以裁處。三峽警分局長許再周表示，張岸玲於案情不明、危安未定的情況下，仍能沉著判斷並立即建立現場優勢，有效保護自身與支援同仁安全，展現「冷靜、專業、有勇有謀」的女警領導魅力，也充分顯示警方打擊違法、守護治安的堅定決心。新北市警察局二橋派出所女所長張岸玲單人巡邏，智取超載逃逸移工的白牌車，查獲違規司機及五名逃逸移工送辦；圖為涉案車輛。（記者吳仁捷翻攝）新北市警察局二橋派出所女所長張岸玲單人巡邏，智取超載逃逸移工的白牌車，查獲違規司機及五名逃逸移工送辦；圖為支援警力趕抵。（記者吳仁捷翻攝）新北市警察局二橋派出所女所長張岸玲單人巡邏，智取超載逃逸移工的白牌車，查獲違規司機及五名逃逸移工送辦；圖為支援警力盤查移工。（記者吳仁捷翻攝）新北市警察局二橋派出所女所長張岸玲單人巡邏，智取超載逃逸移工的白牌車，查獲違規司機及五名逃逸移工送辦；圖為支援警力盤查移工。（記者吳仁捷翻攝）熱門賽事、球星動態不漏接    ,https://news.ltn.com.tw/news/society/breakingnews/5257206
台南山上區軍卡失控衝出路面自撞護欄 2士官受傷送醫,社會,2025/11/25 13:03,軍卡失控衝出路面，自撞行道樹，車頭嚴重毀損。（民眾提供）1部載運裝備的軍用卡車，今天經過台20線19.2公里時突然失控，衝出路面，自撞護欄與行道樹後停止，並未翻落山坡，2名士官受傷，緊急送醫，酒測值為0，疑似駕駛恍神所致，肇事原因由警方釐清中。事故發生在今天上午，位於台南山上區路段，初步了解，該部軍卡從官田營區載運床墊，由東向西前進，要去聯保廠，經19.2K下坡處突然失控，車輛往右偏移，衝到外側，撞擊行道樹後停住，所幸並未翻落。請繼續往下閱讀...肇事後，軍卡的車頭嚴重毀損，擋風玻璃碎裂，2人受傷，但意識清楚，新化警分局獲報趕抵，協助送醫，並展開拖吊，全力排除，讓現場恢復通行，駕駛為28歲的陳姓下士班長，自稱當時恍神而失控，確切原因由警方調查中。軍卡失控衝出路面，自撞行道樹，2名士官受傷，緊急送醫。（民眾提供）軍卡失控衝出路面，自撞行道樹後停住，幸未翻落山坡。（民眾提供）熱門賽事、球星動態不漏接    ,https://news.ltn.com.tw/news/society/breakingnews/5257205
海霸王高雄分公司驚傳工安死亡意外 35歲工人高處墜落不治,社會,2025/11/25 12:53,海霸王高雄分公司驚傳工安死亡意外。（讀者提供）今天上午約9點，位於高雄市前鎮漁港旁的海霸王高雄分公司驚傳工安死亡意外，35歲蘇姓工人在4樓等待起重機吊掛堆高機抵達後，他疑似走進堆高機所在的吊掛平台，沒有防護措施的平台不穩定而晃動，導致蘇男與堆高機都墜落地面，救護車將他送醫急救，但仍宣告不治，由勞工局調查墜落原因。回顧去年7月2日下午，海霸王高雄分公司4樓倉庫燃燒紙箱及氨氣，冒出猛烈的火勢及濃煙，所幸無人受困。請繼續往下閱讀...勞檢處接獲通報立即派員入場勘查，初步調查研判，現場工作人員使用移動式起重機，以搭乘設備乘載堆高機及勞工，未有防止其翻轉及脫落的防止墜落措施而肇災。勞檢處已勒令現場停工，雇主涉違職安法第6條第1項規定，可處最高新台幣30萬罰鍰，並將移送檢察機關追究雇主刑事責任。勞工局已指派專人協助罹災勞工家屬辦理慰助事宜，並確保其職災補償權益。呼籲各事業單位使用移動式起重機以搭乘設備乘載或吊升勞工，應有防止其翻轉及脫落的防止墜落措施，以維護勞工作業安全。熱門賽事、球星動態不漏接    ,https://news.ltn.com.tw/news/society/breakingnews/5257185
同事休假他代班  新北五股建案越南移工觸電亡,社會,2025/11/25 12:48,新北市五股驚傳工人在新建大樓清潔時感電傷重身亡，警方查出死者為偉姓越南籍逃逸移工，進一步查出因同事受傷，包商指派前往頂替，未料清潔電箱時觸電，被發現時失去生命徵象到院不治，新北市勞工局、勞檢處派員了解、工務局勒令停工，轉報移民署，一併查察業主雇用逃逸移工等問題。新北市五股區疏洪北路、凌雲路口一處新建集合住宅，24日下午4時許驚傳感電意外！造成事發之際清潔電箱的49歲越南籍偉姓移工，警方等相關單位清查，由於原本施作配電同事受傷，包商要偉男代班頂替工作，未料疑因工作未交接遭電擊傷，當場失去呼吸心跳，到院仍不治，全案由新北市勞檢處、工務局、移民署，進一步相驗釐清偉男死因。請繼續往下閱讀...據了解，偉姓越南籍移工半年前由仲介通報失聯，目前為逃逸移工，至於他為何會出現在工地且釀成感電工安事故身亡，仍待相關單位進一步調查釐清。熱門賽事、球星動態不漏接    ,https://news.ltn.com.tw/news/society/breakingnews/5257159
獨家》這教會只准約會自己人 婚前抱抱親親會公開批鬥,社會,2025/11/25 12:37,TCOC的單身男女若情投意合要交往，必須經過各自的領導同意。示意圖。（AI製成）台灣國際基督教協會（TCOC）被控在內部設下嚴格的「門徒制度」，單身教徒的婚姻也被TCOC領袖掌控。被害人小岡（化名）指稱，教會嚴禁單身男女和組織以外的異性交流，僅能和自己教會的弟兄姊妹約會，且在未被領導認同交往前，不能牽手、擁抱、親吻，更禁止婚前性行為，否則會被以「犯姦淫」公審、批鬥，至於情意相投的兩人是否能成婚，也只有領導能決定。TCOC為塑造獨特性，創造許多教會專用的詞彙，比如「Double Date」、「Go Steady」、「Single Date」、「Break Up」等，均是單身男女間經常使用的單詞。小岡解釋，教會規定單身教徒不能和組織以外的異性吃飯、約會，因此領導會要求單身男性主動邀約單身女性在假日吃飯聊天、互相交流，且嚴厲規定必須兩對、4人一起約會，因此稱為「Double Date」。請繼續往下閱讀...小岡說，每次「Double Date」的時間是下午約5點開始，最晚不能超過晚上9點半，不能有任何情侶間的肢體接觸，通常是男方付錢，女方事後撰寫小卡片，或回贈小禮物，而約會的過程都必須一五一十的告訴自己的領導，若有一對男女「Double Date」後，發現兩人情投意合，想要進到下一步變成男女朋友，必須要有雙方領導同意。領導同意後雙方的關係會進入「Go Steady」，也就是穩定狀態，在教會代表著兩人是情侶關係，一個月可以1次「Single Date」單獨出去約會，但只能牽手，不能擁抱、親吻，更嚴禁性行為，若在婚前逾矩，就會被認定是犯姦淫，領導會在小組會議時，要求逾矩的男、女分開，各自向弟兄、姊妹們公開懺悔，並將事發過程公諸於世。「異端」以神之名斂財？台大校友也受害 社會菁英求助無門傳教？斂財？國際基督教協會被控上億「奉獻」去向不明「門徒制度」綁架教徒？TCOC被控詛咒離開者「下地獄」熱門賽事、球星動態不漏接    ,https://news.ltn.com.tw/news/society/breakingnews/5257019
獨家》「門徒制度」綁架教徒？TCOC被控詛咒離開者「下地獄」,社會,2025/11/25 12:37,曾參與多年的成員指控，台灣國際基督教協會自稱是神的唯一真正教會，還恐嚇退出者會下地獄。（AI製成）台灣國際基督教協會（TCOC）否認與ICOC同教派，但管理方式相同，宣稱是「神的唯一真正教會」，離開者會「下地獄」，且具嚴重「門徒制度」，形成階級化的金字塔型權力結構，頂端領袖以神為名，掌控底層教徒思想，讓人失去獨立思考和判斷的能力。被害人Allen（化名）指出，目前教會不斷流失教徒，近期將觸手伸進銀髮族，創造「樂齡團」，吸引長者加入。Allen曾在教會待了逾10年，他觀察TCOC有五大特徵，第一是創造領袖魅力，領導分階層，從查經班領導、小組長，一直到世界教區領袖，如同直銷組織；再者以基督教教義，樹立「唯一教會」假象，若離開是背叛、會下地獄；第三，剝削經濟，強迫每月收取「十一奉獻」，年底則以傳道為名收取特別奉獻，均是收取現金丟入袋子，追錢的流向就是「懷疑神」。請繼續往下閱讀...最可怕的是嚴重的「門徒制度」，導致時間和生理環境被控制。Allen說，每個人都會有自己的領導，每天以關心為名通話，實際是掌控教徒們的行動和思想，且領袖會制定時間表，如查經班、小組會議、師徒時間、周日活動、男女約會等，教徒都必須參加，等於除了工作、上課，其他時間都泡在教會，用意是隔離社會，讓人失去思辨能力。Allen進一步指出，時常缺席教會活動，或對組織提出意見者，會被列入黑名單，嚴重者禁止出席聚會、不能和教會內的異性約會等，若領導發現教徒有異心，會用不順服神等理由刁難，批判教徒患憂鬱症，沒有服藥不能參加聚會等，凡是被領袖發現教徒有自我認知和意識時，就會被批鬥、逐出組織。許多離開TCOC的教徒，發現自己是遭教會控制，陸續在網路上發布文章，盼不要再有人受害，也因此近年教會人數不斷流逝，但領袖也試圖擴充組織，找銀髮族下手，成立「樂齡團」。另一方面，混入政商名流的圈子，吸收名望人士；Allen說，近期教會正不斷向一名藝文界大老伸爪牙，希望能將此情公諸於世，不再有人受害。「異端」以神之名斂財？台大校友也受害 社會菁英求助無門傳教？斂財？國際基督教協會被控上億「奉獻」去向不明這教會只准約會自己人 婚前抱抱親親會公開批鬥熱門賽事、球星動態不漏接    ,https://news.ltn.com.tw/news/society/breakingnews/5257018
獨家》傳教？斂財？國際基督教協會被控上億「奉獻」去向不明,社會,2025/11/25 12:36,劉姓男子等被害人控訴，教會以神之名斂財，初估至少上億元奉獻不知去向。示意圖。（AI製成）台灣國際基督教協會（TCOC）自1991年來台傳教，巔峰時期有700多名教徒，後來陸續發生主任牧師覃思源涉挪用百萬公款購車、牧師曾國榮講道疑抄襲西雅圖靈糧堂、知名教授兼牧師外遇等事件，教徒降至300餘人，劉姓男子等被害人控訴，教會以神之名斂財，初估至少上億元奉獻不知去向，檢調機關調查中。全案源於1991年，覃思源帶領係屬美國國際基督教（ICOC）教派的傳道團，從香港來台，向台北市政府申請成立「台北市基督教聖經實踐推廣協會」，起初立足台灣大學，專門吸取台大電機、法律、醫學系的菁英分子。劉男指出，後來美國ICOC爆出性侵未成年女孩等醜聞，在台組織為掩蓋真身，以合併名義，將協會解散，改名成立「台灣國際基督教協會（TCOC）」，對外自稱台北國際基督教會大安、松山等，否認自己與ICOC有關連。請繼續往下閱讀...劉男等被害人表示，2012年間，一名曾任教會的財務人員，在會議中向教徒們懺悔，她10年前受覃思源指示挪用教會公款，讓覃男借走100萬元購買CRV休旅車，內部將此稱為「CRV事件」，當時覃男委由律師出具意見書說明，自己只是向教會借款，且已全數還清，並未觸犯刑法。但許多教徒仍認為疑點重重，提出查看教會帳冊，卻被冠上「質疑神」的名號霸凌、踢出教會，多數人不敢有二心。有教徒轉向主管機關請求查帳，意外發現許多骨幹教徒並非協會成員，沒有查帳資格，只有覃男及教會高層才在會員名冊，開始有教徒懷疑被要求繳納的「十一奉獻」、「特別奉獻」，可能被教會高層收進自己口袋，至少上億元奉獻不知去向，當時有數百人紛紛離去。後來又爆出牧師外遇醜聞，以及曾國榮於去年主日講到時，疑似抄襲西雅圖靈糧堂官網每日靈修，被嘲諷為「抄襲牧師」、「抄靈糧牧師」。劉男指出，近年離開TCOC的教徒越來越多，目前有近百名受害者成立群組、粉專，只希望透過網路發聲，不要再有民眾被拉進教會受害。「異端」以神之名斂財？台大校友也受害 社會菁英求助無門「門徒制度」綁架教徒？TCOC被控詛咒離開者「下地獄」這教會只准約會自己人 婚前抱抱親親會公開批鬥熱門賽事、球星動態不漏接    ,https://news.ltn.com.tw/news/society/breakingnews/5257017
獨家》「異端」以神之名斂財？台大校友也受害 社會菁英求助無門,社會,2025/11/25 12:35,海外「異端」ICOC滲入我國。示意圖。（AI製成）近年宗教性侵、虐死案四起，許多團體以信仰為名斂財、詐騙，但法制面碰上無從鑑定教義真假，以及財務流向不透明困境，導致被害人提告無果，多數案件以罪證不足簽結或不起訴。近期，有數10名被害人陷入相同困境，控訴在國外涉性侵、虐待的「國際基督教會」（ICOC），以「台灣國際基督教協會」（TCOC）為名隱身我國，但求助檢調機關無果，只希望不再有其他人落入圈套。該群以劉姓男子為首的受害者指控，「台灣國際基督教協會」是以神之名斂財的「邪教」，以領袖魅力誆稱自己是「神的唯一教會」，許多台大畢業的菁英份子、社會名望人士受騙，被害人觸及學界、醫界、藝文界、媒體圈；過去曾發生教主涉挪用教會公款、牧師講道內容抄襲西雅圖靈糧堂等爭議。請繼續往下閱讀...據了解，台北地檢署曾獲檢舉，分他字案偵辦，覃思源等8名核心幹部遭列被告，但因罪證不足予以簽結。不過，調查局接獲其他案源，目前立案調查中，由於受害者不斷增加，劉男持續協助蒐集證據遞交給檢調。對此，本報昨致電求證，台灣國際基督教協會的李姓男子表示，教會是合法登記的宗教團體，致力於社會公益，也有委託外部會計師進行查核，近一兩年有人不斷投訴、檢舉，造成教會困擾，每個人都有自己的難處和個人特質，會盡力接納和溝通，尊重新聞自由。回顧2013年彰化日月明功虐死案、2020年「少龍」徐浩城（已歿）性侵、猥褻案，一直到2024年台北精舍殺人案，檢察機關在偵辦時，發現其中隱藏許多不符常理的懲處、捐獻，但檢察機關難以將信仰成員間的儀式、教誨、懺悔等行為，視為「假裝宗教以圖私利」，尤其沒有明確捐款承諾、金錢回報或明示詐騙行為，加上被害人自願性高、宗教財務缺乏揭露制度，難以證明犯行。在法制層面上，許多案件只能等到有被害人遭凌虐、毆打致死，檢調單位才有理由介入調查，也導致許多宗教團體以信仰為名，行斂財之實，我國必須重視；許多檢察官認為，宗教自由的保護範圍過大，只要刑法介入宗教領域，就會被視為侵害信仰自由、干涉宗教團體的教義、儀式運作，但如何公開透明，發人省思。傳教？斂財？國際基督教協會被控上億「奉獻」去向不明「門徒制度」綁架教徒？TCOC被控詛咒離開者「下地獄」這教會只准約會自己人 婚前抱抱親親會公開批鬥熱門賽事、球星動態不漏接    ,https://news.ltn.com.tw/news/society/breakingnews/5257014
毒品唾液快篩上路  台中保大攔違停揪拉K毒駕,社會,2025/11/25 12:34,台中市警局保大員警，23日晚間攔查姚姓男子違停，經進行唾液毒品快篩檢測，發現呈陽性反應，當場舉發並將車輛移置保管。（記者陳建志翻攝）為遏止毒駕，警政署從本月20日全面啟用毒品唾液快篩試劑取締毒駕，台中市警局保安警察大隊23日晚間巡邏經北屯區，發現一名姚姓男子（29歲）違停在紅線，上前攔查時，聞到身上散發濃厚愷他命燃燒後餘味，要求姚男配合進行唾液毒品快篩檢測，檢測後果然呈現陽性反應，警方立刻開罰並將車輛移置保管，後續將依尿液檢測結果，以違反公共危險罪（毒駕）函送偵辦。台中市警局保大表示，20日起全面啟用毒品唾液快篩試劑取締毒駕，從20日至24日止，共查獲吸食或持有毒品案10件，其中包括1件毒品唾液快篩陽性的毒駕案件。請繼續往下閱讀...保大第一中隊巡邏員警，前天晚間9點多，巡邏經北屯區軍榮一街發現一部自小客車紅線違停，立即上前攔查，沒想到車上姚姓男子（29歲）一下車，身上就散發濃厚愷他命燃燒後餘味，立刻告知毒品唾液採樣流程及相關法律權利義務後，進行唾液毒品快篩檢測，檢測結果呈陽性反應，立刻依法舉發，即時採取人車分離，將車輛移置保管，避免危害用路人安全，後續將依尿液檢測結果，以違反公共危險罪（毒駕）函送偵辦。警方表示，毒品唾液快篩試劑投入執法後，讓毒駕行為無所遁形，未來駕駛人若經唾液快篩呈陽性反應，將重罰3萬元至12萬元，並吊扣駕照1至2年；若拒絕檢測，罰鍰更將高達18萬元，並吊銷駕照，且仍會追究公共危險罪與毒品等刑責。台中市警局保大以毒品唾液快篩試劑進行檢測，發現姚男拉K呈現陽性反應。（記者陳建志翻攝）熱門賽事、球星動態不漏接    ,https://news.ltn.com.tw/news/society/breakingnews/5257156
