Title,News_Type,date,content,url
租車行淪車手招募站撈千萬 主嫌判9年8月,社會,2026/05/22 05:30,彰化地院審理跨國詐欺案件，認定主嫌江男依加重詐欺、洗錢及組織犯罪等罪，判刑9年8月，另車行負責人莊男、員工郭男分別被判處4年8月、3年8月徒刑。（記者陳冠備攝）租車行淪為招募車手據點！彰化地院審理一起跨國詐欺案發現，詐騙集團在柬埔寨成立機房，從事假投資、假交友詐欺，再透過租車行員工當車手，向被害人收款後，再用虛擬貨幣洗錢，形成「機房、車手、水房」一條龍犯罪鏈，共廿五人受害，損失金額達一五二一萬餘元，一名被害人遭詐損失達五六三萬餘元，主嫌江子麟被依加重詐欺等罪重判九年八月，車行負責人莊男、員工郭男分別判刑四年八月、三年八月徒刑。判決書指出，二〇二四年七月，江男得知友人孫男（通緝中）需要國內虛擬貨幣面交人員，遂與周男、杜男（通緝中）等人共同籌組車手集團，同年九月周男找上租車行負責人莊男，談妥租車、招募車手與取款抽成等合作事宜。請繼續往下閱讀...莊男再找員工郭男加入，郭男擔任面交車手，還招募其他車手，這家車行逐漸成為詐團在國內的重要車手來源。該集團於二〇二四年九至十二月間，共詐得一五二一萬餘元，警方先抓到車手，往上溯源破獲該集團。檢警追查，該集團由柬埔寨的機房，以假投資等話術詐騙台灣人，再由國內車手面交取款，同時透過羅男（另行審結）等人成立洗錢水房，將贓款轉換為泰達幣，層層轉回柬埔寨；其中一名林姓女共犯，還出境到柬埔寨當話務手，並招募國人赴柬埔寨加入機房行騙，共獲利一三六萬元。彰化地院認定，江男位居集團上層，負責收取孫男匯入的虛擬貨幣，換成現金後交給周男、杜男，再層層下發車手薪資，共犯下廿五罪；江男與共犯符合詐欺犯罪危害防制條例的加重量刑要件，依此判處江男執行刑九年八月。周男共犯九罪，他坦承多數犯行及繳回十萬元犯罪所得，判處四年八月徒刑；莊男犯下八罪，判處四年八月；郭男六罪，判處三年八月；林女獲判三年八月。☆自由時報電子報提醒您，防詐騙專線︰165，報案專線︰110☆    ,https://news.ltn.com.tw/news/society/paper/1755734
鹿野豪華民宿藏機房 檢警攻堅逮9人,社會,2026/05/22 05:30,"警方在台東鹿野民宿查獲電信詐騙機房。（記者黃明堂翻攝）詐團扮遊客Long stay 主嫌發監8請回 檢要抗告南台灣檢警破獲一個將機房藏在台東觀光區民宿的電信詐欺集團，該機房隱身​於台東鹿野的豪華包棟民宿，集團成員對外佯裝一般旅客長期住宿，實際上在房內架設電信話務機房；檢警攻堅逮捕六男三女，檢方認為九人涉案重大，有逃亡及串證、滅證之虞，聲請羈押禁見，但法官認為嫌犯已承認犯行，前晚裁定將其中八人請回，僅郭姓主嫌另涉其他案件判刑確定，將他直接發監執行，檢方表示將抗告。請繼續往下閱讀...​據了解，該詐騙集團以三十六歲郭男為首，他帶領五男三女，租下鹿野當地一間環境隱密且高檔的包棟民宿作為掩護，在內部架設電信話務機房，集體假扮成中國公安，跨海對香港地區民眾進行詐騙，但這些人都不會講粵語。扮中國公安詐香港人本案由刑事警察局會同台東縣警察局與屏東縣警察局刑警大隊，報請台東地檢署檢察官張瑋芯指揮偵辦，​經長期蒐證監控，前天見時機成熟，發動拂曉攻堅、搜索行動，當場將郭男等九人逮捕，扣得大批話務機房的相關贓證物。台東地檢於廿日複訊後，認為該集團嫌疑人涉嫌加重詐欺等罪嫌重大，有逃亡、湮滅證據、勾串共犯及反覆實施之虞，向法院聲請羈押，但遭法院裁定請回。​台東地檢署特別呼籲，台東近年觀光產業發展蓬勃，旅宿業者應針對長租客人的身分進行過濾，並主動關心其住宿期間的作息，保持防詐警覺性，切勿讓詐欺集團利用民宿或旅館作為掩護設立機房，共同維護台東觀光環境的純潔與良善。☆自由時報電子報提醒您，防詐騙專線︰165，報案專線︰110☆    ",https://news.ltn.com.tw/news/society/paper/1755733
微縮模型夾藏7公斤海洛因運台 跨境運毒「6層溯源」追緝 逮7人法辦,社會,2026/05/22 05:30,跨境運毒集團偽裝手法升級，利用「微縮模型」與薄度僅0.7公分的PP瓦楞板跨海運毒。（民眾提供）跨境運毒集團偽裝手法再升級，竟利用「微縮模型」與薄度僅零點七公分的PP瓦楞板跨海運毒！刑事警察局南部打擊犯罪中心（簡稱南打）與關務署合作，截獲一只自泰國寄出、內藏黑市價格約四千萬元的七點一九公斤海洛因包裹，歷經「六層溯源」追緝，跨越桃園、台南、高雄等地，攻堅逮捕七名集團成員。海洛因磨成粉 填入瓦楞板空隙 刑事局南打追查，全案由逃亡藏匿於柬埔寨的廿六歲通緝犯柯宇軒，在幕後跨境操盤，為掩人耳目，先將海洛因研磨成細緻粉末，再以「模型達人級」手法，將毒品充填進厚度僅零點七公分的中空PP瓦楞板空隙，再把瓦楞板封入微縮模型的底座，以玩具模型包裹走私來台。請繼續往下閱讀...今年一月初，關務署發覺包裹可疑通報警方，員警小心拆解，果然在包裹內起獲海洛因粉末，再把包裹恢復原狀，等待收貨人提領。包裹闖關 拆解後發現內藏玄機該集團為防警方查緝，製造多處斷點，先是第一層共犯在台南簽收提領包裹後，藏匿於租處，隨後交給第二層共犯轉手暫放，再由第三層共犯將包裹運往高雄茄萣；此時廿八歲陳姓貨主南下監控第四層共犯，將包裹自高雄運回台南，最後交給陳嫌手上。陳嫌一拿到包裹，飛車狂飆至桃園中壢一處透天民宅，找專人拆解包裹。專案小組見時機成熟發動攻堅，將陳嫌等人逮捕，並陸續在全台各地收網，將七人全數逮捕到案，移送台南地檢署偵辦。    ,https://news.ltn.com.tw/news/society/paper/1755705
微縮模型藏毒闖關／夾藏運毒是走私大宗 郵包、行李箱最多,社會,2026/05/22 05:30,跨境運毒集團將海洛因藏於微縮模型及厚度僅0.7公分的PP瓦楞板中，闖關來台。（民眾提供）警方與海關合作，破獲一個將海洛因毒品填進厚度僅零點七公分PP瓦楞板的「微縮模型」運毒集團。刑事警察局毒品查緝中心表示，近年來的跨國走私毒品手法，以夾藏為大宗，其中夾藏方式，以郵包與行李箱最多，執法人員多半是透過情資交流、海關X光查驗，加以攔阻識破，再以貨追人，持續溯源將收貨者與隱身幕後的成員、金主等一網打盡。毒品查緝中心表示，跨國走私運毒至境內的模式，包括夾藏、貨櫃、漁船與人體夾帶等等，其中夾藏的案件占大部分，以郵包、行李箱為主。郵包部分，運毒集團採名目不符的郵包夾藏，正如保三總隊本月宣布破獲一起「海苔」包裝內夾藏五包大麻案，循線逮捕收貨的越南籍阮姓男子。請繼續往下閱讀...另刑事局偵三大隊第一隊今年初查獲從印度寄來夾藏二公斤依托咪酯的國際毒郵包，擴大溯源追查，分別於南投、嘉義、桃園、雲林與高雄等地，緝獲國內四層負責接貨的楊姓等五名嫌犯到案，隨後持續追查至上月底，先後破獲十九處分裝場，再逮林等廿六名嫌犯送辦，當中八人遭檢方聲押獲准。行李箱部分則大都夾藏在夾層或者直接攜帶入境，這些往往在經過海關X光機查驗時，因呈現的不同顏色等態樣，遭到識破。人體夾帶方式，則為直接將毒品吞入腹中，躲避海關查驗，海巡署偵防分署近期就根據接獲的情資，破獲一宗兩名波蘭籍男子體內藏毒案，該兩人將海洛因毒品以乳膠膜層層包裹吞入肚內，企圖走私入境，遭攔截逮捕後，分別各排出近百顆、總重約一公斤的海洛因。今年初，關務署台北關與航警局執行桃園國際機場旅客託運行李X光儀檢查勤務時，也發現一名自泰國搭機入境旅客所攜帶行李箱可疑，經開箱檢查，於多台吹風機內起出夾藏的一點六公斤愷他命，逮捕運毒的泰女，並追出幕後的花蓮籍江姓夫婦。☆少一份毒品就多一份健康，自由時報提醒您遠離毒品☆跨境運毒集團將海洛因藏於微縮模型及厚度僅0.7公分的PP瓦楞板中，闖關來台。（民眾提供）跨境運毒集團將海洛因藏於微縮模型及厚度僅0.7公分的PP瓦楞板中，闖關來台。（民眾提供）    ,https://news.ltn.com.tw/news/society/paper/1755736
傻眼！台中大里現輪椅怪男 車牌當畫布亂塗鴉,社會,2026/05/21 23:49,台中市大里塗城路一帶近日出現一名坐輪椅的怪男，隨意寫字毀損車牌，讓車主傻眼。（記者陳建志翻攝）台中大里區塗城路一帶，近日出現一名坐輪椅的怪男，手上拿著剪刀、簽字筆，隨意破壞民眾的機車車牌，還用簽字筆在車牌寫上「中華日本軍」等字樣，民眾發現後趕緊報案，員警到場後男子已離開，警方已調閱監視器鎖定特定對象，不過因車主還未報案，將待車主報案後，依毀損罪嫌移送台中地檢署偵辦。這名坐輪椅的怪男，近日出現在大里塗城路一帶，隨身攜帶剪刀、簽字筆，不但翹人家車牌，還拿奇異筆在車牌上寫字，初步至少有2輛機車的車牌被毀損，寫上「中華日本軍」等字樣，車主看到都傻眼。請繼續往下閱讀...霧峰分局表示，5月19日晚上6點多接到110報案，指稱大里區塗城路某便利商店前有2輛機車車牌遭毀損。獲報後隨即調閱周邊監視器，已掌握特定犯嫌身分。因目前2名車主都還未報案，將待報案人正式提告後，立即依毀損罪嫌移送台中地檢署偵辦。    ,https://news.ltn.com.tw/news/society/breakingnews/5445391
5/21今彩539頭獎開1注！ 800萬獎落宜蘭  威力彩連23摃,社會,2026/05/21 22:20,5月21日開獎的第115000124期今彩539頭獎開出1注，第115000041期威力彩頭獎摃龜。（擷取自台彩官網、本報合成）5月21日開獎的第115000124期今彩539頭獎開出1注，由宜蘭縣羅東鎮開明里中正路100號的「珍旺彩券行」開出；第115000041期威力彩頭獎則連23期摃龜，下期頭獎上看6億。第115000041期威力彩中獎號碼為「第一區：06、14、22、28、35、38，第二區：01」。頭獎摃龜；貳獎開出1注，可得1015萬9062；參獎共14注中獎，每注可得15萬元；肆獎共127注中獎，每注可得2萬元；伍獎共407注中獎，每注可得4000元；陸獎共3572注中獎，每注可得800元；柒獎共5862注中獎，每注可得400元；捌獎共3萬1590注中獎，每注可得200元；玖獎共4萬4491注中獎，每注可得100元；普獎共7萬1800注中獎，每注可得100元。請繼續往下閱讀...第115000124期今彩539中獎號碼為「09、25、28、34、36」。頭獎開出1注，可得800萬元；貳獎共244注中獎，每注可得2萬元；參獎共7841注中獎，每注可得300元；肆獎共7萬8369注中獎，每注可得50元。第115000124期39樂合彩中獎號碼為「09、25、28、34、36」。四合共11注中獎，每注可得21萬2500萬元；三合共499注中獎，每注可得1萬1250元；二合共1萬6575注中獎，每注可得1125元。第115000124期3星彩中獎號碼為「531」。壹獎共88注中獎，每注可得5000元。第115000124期4星彩中獎號碼為「9823」。壹獎共6注中獎，每注可得5萬元。確切中獎號碼以台彩網站公告為主，請見「台灣彩券網站」。威力彩、今彩539、39樂合彩、3星彩、4星彩中獎號碼。（擷取自台彩官網）    ,https://news.ltn.com.tw/news/society/breakingnews/5445344
母因細故掌摑踹胸、拿衣架痛毆  高雄女國中女生向老師求救,社會,2026/05/21 22:17,高市郭姓婦人僅因細故，涉嫌凌虐就讀國中女兒，被橋頭地院判刑。（記者鮑建信攝）高市郭姓母親僅因細故，涉嫌腳踹就讀國中的女兒胸部、賞巴掌、持衣架毆打，女兒不堪家暴，向老師求救，橋頭地院依違反兒童及少年福利與權益保障法等罪，判處郭母徒刑4月，不得易科罰金。判決書指出，2024年5月18日上午，被告郭婦在左營區住處，因細故與就讀國中的女兒小芳（化名）發生爭執，徒手掌摑她左臉頰，並以腳踹背部及胸部。請繼續往下閱讀...隔天下午，郭婦再度甩小芳巴掌，並持衣架毆打其背部，導致她多處受傷。小芳不堪受暴，向師長求助，經通報社會局，警方並在6月6日前往郭婦住處搜索，查扣衣架等證物。辦案人員釐清案情，製作筆錄後，全案移送橋頭地檢署偵查、起訴，承辦檢察官並聲請法院簡易處刑。法官開庭調查，認定郭婦觸犯2罪，依刑法傷害和違反兒少法等罪各處有期徒刑3月，併執行刑4月，不得易科罰金，可上訴。    ,https://news.ltn.com.tw/news/society/breakingnews/5445326
電郵收「退稅通知」、點進去可領2萬   國稅局澄清：詐騙手法,社會,2026/05/21 22:02,網路流傳的詐騙信件與網站。（擷取自台灣事實查核中心）五月為報稅季，許多詐騙集團也伺機而動，近日有網友收到宣稱「財政部」寄的電子郵件，稱只要點進去驗證個人資訊，就可以退稅2萬多元。對此，台灣事實查核中心警告，國稅局不會經由簡訊、電子郵件主動聯繫退稅事宜，更不會附上所謂申請連結。台灣事實查核中心表示，近期有網友收到宣稱「財政部」寄來的退稅信，內容稱只要點進去驗證個人資訊，並選擇收取退款的信用卡號，就可以退稅2萬多元。國稅局急忙澄清，這是詐騙，退稅不會以電子郵件、簡訊形式通知，也不會要求提供銀行或信用卡資料。請繼續往下閱讀...國稅局指出，他們不會經由簡訊、電子郵件主動聯繫退稅事宜，更不會附上所謂申請連結。如果已經完成綜所稅申報程序，並確定可以退稅，系統會自動在7月下旬，退還至當時民眾填寫的帳戶，並寄發「完成退稅作業」的簡訊，不會附上連結要求民眾補充任何資料。台灣事實查核中心提醒，若看到來路不明的網址，要先養成辨認網址的好習慣。如果是政府的網站，網址結尾一定是「.gov.tw」，不會是一群無意義的亂碼組合，建議民眾先看清楚網址，提高警覺、避免受騙。    ,https://news.ltn.com.tw/news/society/breakingnews/5445288
慘！山老鼠盜伐林木賺5000元 判罰百萬、坐牢14月,社會,2026/05/21 21:59,山老鼠邱姓男子涉嫌盜伐林木，被橋頭地院判囚，併科罰金上百萬元。（記者鮑建信攝）山老鼠邱姓男子夥同友人，開車進入高市六龜國有林班地，涉嫌竊取肖楠木，被橋頭地院依違反森林法，判處1年2月徒刑，併科（同時處罰）罰金102萬元，罰金得易服勞役。判決書指出，2023年2月28日至3月2日，被告邱男夥同林姓友人（死亡、另行判決），駕駛租來小貨車，進入林務局林業試驗所管理的國有林班地靈象山，涉嫌盜伐肖楠木2株並鋸成3塊後，載往製材廠裁切為9塊，邱男獲得5千元報酬。請繼續往下閱讀...案經六龜分局接獲民眾檢舉靈象山上樹木遭盜伐，傳喚邱男到案說明，釐清疑點，並製作筆錄後，依涉嫌違反森林法，函送橋頭地檢署偵查、起訴。承辦法官開庭調查後，審酌邱男坦承不諱，判處有期徒刑1年2月，併科罰金萬元，罰金如易服勞役，以3000元折算1日，仍可上訴。邱男所犯之罪，處1年以上7年以下有期徒刑，併科新臺幣1百萬元以上、2千萬元以下罰金，法官量處徒刑1年2月，算是輕度刑。    ,https://news.ltn.com.tw/news/society/breakingnews/5445324
台61鹿港福興段砂石車停路肩  2車接連撞3人傷、1人意識不清,社會,2026/05/21 21:57,台61線鹿港福興段今晚2起車禍，造成3人受傷，疑是砂石車故障停在路肩，用路人未注意撞上。（民眾提供）台61線鹿港福興段今天（21日）晚間傳出2起意外，砂石車故障停在路肩，先是一輛轎車擦撞，造成駕駛擦傷，副駕駛座傷者意識不清；正當警方在處理這起車禍時，又有一輛轎車撞了上來，造成1人受傷送醫，車禍原因仍有待進一步調查。彰化縣消防局表示，砂石車故障停在台61線180.2公里處的路肩，在晚間將近7點，先是一輛轎車擦撞砂石車左後輪，轎車駕駛與副駕駛都受傷，送往彰濱秀傳醫院，駕駛輕傷，副駕駛則是意識不清，疑似下顎骨骨折、胸部紅腫瘀血，肢體及髖部擦傷。請繼續往下閱讀...正當警方在處理這起意外時，晚間將近8點，又有另一部轎車未注意到砂石車故障停放在路肩而發生追撞，這起意外造成1人受傷。2起意外肇事原因仍待調查釐清。台61線鹿港福興段今晚2起車禍，造成3人受傷，其中1人意識不清。（民眾提供）    ,https://news.ltn.com.tw/news/society/breakingnews/5445322
新人格鬥賽遭重擊 30歲工程師顱內出血亡 對手與拳館負責人函送,社會,2026/05/21 21:42,拳擊格鬥賽示意圖。（取自免費圖庫photo-ac）30歲的陳姓工程師，上週末前往台北市松山區參加一間拳館舉辦的格鬥賽。在與同為新手的學員對打時，頭部數度遭擊中，隨後在擂台上發生腳步不穩等情況，裁判終止比賽後他在台下休息時又感到頭暈不適，在友人陪同下前往醫院掛急診，不料當天下午4點失去意識，經醫院緊急開刀後仍陷入昏迷，在全力搶救數日後，不幸於昨日上午9點多宣告不治。目前松山分局警方通知拳館廖姓負責人、當日對戰的27歲許姓選手等人到案說明，訊後依過失致死罪嫌函送偵辦。警方調查，陳姓工程師是透過同學介紹，到松山區拳館報名上課，接受教練指導已有一年多。由於他屬於新人，因此被安排在接近中午11點的新人賽場次上場。在比賽時遭對手多次擊中頭部，隨後出現腳步凌亂、重心不穩的情形。裁判起初立刻喊暫停，在確認陳男意識清楚後恢復比賽。但在下一回合中，陳男仍持續明顯搖晃，裁判隨即決定終止比賽並宣布對手獲勝。請繼續往下閱讀...據了解，陳男在賽前有簽署了解比賽危險性的同意書，且現場錄影畫面顯示，雙方選手皆有依規定穿戴護具，對手也沒有朝後腦等禁止部位進行違規攻擊。家屬在得知完整事發經過後，已表明對此不再追究。警方昨日通知拳館60歲的廖姓負責人、當日對戰的27歲許姓選手、賽事裁判、拳擊教練與現場救護員等人到案說明並製作筆錄。全案訊後，將廖姓負責人與許姓選手依過失致死罪嫌函送偵辦，並已報請台北地方檢察署完成司法相驗，後續將由檢察官實施調查。松山分局松山派出所副所長葉啟耀說明案情。（記者鄭景議翻攝）    ,https://news.ltn.com.tw/news/society/breakingnews/5445302
環抱女友算性騷  人夫外遇卻告不成 律師揭「婚姻枷鎖」思維轉向,社會,2026/05/21 21:28,黃柏榮表示，戀愛關係中，法律越來越強調個體意願與身體自主；但婚姻制度中的忠誠義務與情感保障，則面臨重新定義。（律師黃柏榮提供）一名男大生因從側後方環抱女友，遭校方性別平等教育委員會認定構成性騷擾，提起行政訴訟後仍遭法院認定處分合法；另有人妻控訴丈夫女性友人深夜通話、牽手互動侵害配偶權，法院則指不應承認「配偶權」概念，判決敗訴。律師黃柏榮分析，兩起案件的標準差異看似矛盾，實際反映司法近年對個人自主與婚姻關係的不同理解。黃柏榮指出，在性平案件中，法院判斷始終圍繞「是否違反當事人意願」，即便雙方原本為情侶關係，若一方先前已表達不願再有肢體接觸，當下也立即推開、反抗，另一方仍持續從背後環抱，法院通常會認為已逾越身體界線。請繼續往下閱讀...黃柏榮認為，「親密關係不是永久授權」，今天願意，不代表未來任何時刻都願意；過去曾有擁抱習慣，也不代表在爭執、冷戰或對方已明確抗拒時，仍可任意碰觸。司法實務目前對性騷擾的認定，已不再侷限於陌生人或職場權勢關係，而是著重行為是否違反對方意願，並造成冒犯、恐懼或壓迫感。相較之下，另一件「侵害配偶權」敗訴，黃柏榮則指，過往民事實務並非毫無標準，法院通常會綜合判斷第三人是否明知對方已婚，雙方是否存在逾越一般社交分際的親密互動，例如性行為、同居、曖昧訊息、開房紀錄、出遊照片、牽手或長期深夜聯繫等，再進一步認定是否破壞婚姻共同生活，導致配偶受有精神痛苦。不過，此次判決引發討論在於，法院不僅認定證據不足，更質疑「配偶權」概念，認為可能將婚姻理解為對人格的占有支配。黃柏榮說，支持與反對意見分歧：前者認為婚姻不應建立在控制之上，後者則憂心通姦除罪化後若再限縮侵害配偶權，受害一方恐更難救濟，並質疑婚姻保障是否因此被削弱。黃柏榮表示，兩起案件某種程度上也反映當代法學思維的轉向，戀愛關係中，法律越來越強調個體意願與身體自主；但婚姻制度中的忠誠義務與情感保障，則正面臨重新定義與調整。    ,https://news.ltn.com.tw/news/society/breakingnews/5445305
台東詐團包民宿架設話務機房 假扮中國公安詐香港人 警逮9嫌,社會,2026/05/21 20:58,警方在台東鹿野某民宿查獲電信詐騙機房。（記者黃明堂翻攝）​刑事警察局南部犯罪打擊中心（偵查第八大隊）19日會同台東縣警察局與屏東縣警察局刑警大隊，在台東地檢署檢察官張瑋芯的指揮下，聯手偵破了一起隱身於台東鹿野豪華包棟民宿內的詐騙集團機房案件。逮捕6男3女，他們假扮中國公安詐騙香港人，檢方聲請羈押，但法官認為嫌犯均坦承犯罪，昨晚裁定請回，僅郭姓主嫌因涉其它案件判刑確定，直接發監執行。檢方表示將抗告。​據了解，該詐騙集團以一名79年次的郭姓男子為主嫌，他帶領包含自己在內的6男3女共9名成員，特地租下鹿野當地一間環境隱密且高檔的包棟民宿作為掩護，並在內部架設電信話務機房，集體假扮成中國公安，跨海對香港民眾進行詐騙。請繼續往下閱讀...​經過警方長期蒐證與監控，見時機成熟於前天發動拂曉搜索，當場將郭嫌等9人逮捕歸案，並扣得大批話務機房相關贓證物。台東地檢署檢察官於訊問後，認為該集團9名嫌疑人涉嫌加重詐欺等罪嫌重大，且有逃亡、湮滅證據、勾串共犯及反覆實施之虞，依法向法院聲請羈押，但法院裁定請回。​台東地檢署特別呼籲，台東近年觀光產業發展蓬勃，旅宿業者應針對長租客人身分進行積極過濾，並主動關心其住宿期間的作息，保持高度防詐警覺性，切勿讓詐欺集團利用民宿或旅館作為掩護設立機房，共同維護台東觀光環境的純潔與良善。    ,https://news.ltn.com.tw/news/society/breakingnews/5445247
台中警盤查路邊違停 失聯移工拔腿跑遭壓制送辦,社會,2026/05/21 20:58,台中太平分局員警，今天傍晚盤查一輛違規停車的自小客貨車，車上杜姓失聯移工心虛拔腿狂奔，當場遭警方制伏。（記者陳建志翻攝）台中市警局太平分局新平派出所員警，今天傍晚5點多巡邏經太平區樹孝路時，發現一輛自小客貨車違規停車，上前盤查時，坐在副駕駛座的越南籍失聯移工杜姓男子（23歲），心虛下車拔腿就要跑，當場被員警壓制在地，清查後發現2024年就逾期居留至今，平日四處打零工賺錢，將他依違反《入出國及移民法》移送移民署專勤隊依法處置。太平分局新平派出所的員警，今天傍晚5點巡邏經太平區樹孝路，發現一輛自小客貨車違規停車，立刻上前盤查，沒想到正要盤查女駕駛，坐在副駕駛座的杜姓男子（23歲）卻神色緊張，接著心虛打開車門拔腿狂奔，員警見狀立刻將他壓制在一旁的人行道上，並呼叫支援警力到場。請繼續往下閱讀...員警將他帶回警局調查，發現他2024年就已經失聯逾期居留，平日四處打零工為生，今天是下班後和沒有逾期居留的女同鄉正要返回租屋處，警方將他依違反《入出國及移民法》移送移民署專勤隊依法處置。太平分局表示，雇主應依規定聘僱外籍移工，如發現非法聘僱或失聯移工，應立即通報相關單位，以免觸法受罰。    ,https://news.ltn.com.tw/news/society/breakingnews/5445286
