Title,News_Type,date,content,url
美政府停擺航管人力短缺 紐約機場航班延誤達2小時,國際,2025/11/02 08:26,受美國聯邦政府關門影響，紐約拉瓜迪亞機場班機延誤嚴重。（路透）美國聯邦政府停擺狀態今天邁入第2個月，美國聯邦航空總署（FAA）昨晚示警，飛航管制人員缺勤激增造成廣泛影響。從德州到紐約的主要機場都出現航班延誤，其中紐約拉瓜迪亞機場航班平均延誤超過2小時。共和黨和民主黨籍國會議員的預算僵局觸發聯邦政府停擺，至今已邁入第2個月。FAA昨晚發布聲明指出，約1萬3000名飛航管制人員已連續數週無薪工作，以確保每天超過5萬次飛行運作的安全。請繼續往下閱讀...FAA示警，隨著週末將至，缺勤人數激增導致多個管制設施的人力更加吃緊，對全美航空系統造成廣泛影響。「目前我們30個核心主要設施之中，有一半面臨人手短缺，而紐約地區的設施中，有將近80%的飛航管制人員缺勤」。當出現人手短缺時，FAA表示，將會減少空中交通流量以維持安全，這可能導致航班延誤或取消。政治網站Politico報導，根據FAA報告，昨晚德州達拉斯-沃斯堡國際機場（Dallas-Fort Worth International Airport）、紐約拉瓜迪亞機場（LaGuardia Airport）及紐瓦克自由國際機場（Newark Liberty International Airport）等地都因人力不足而出現航班延誤的狀況。其中，紐約市地區受到的影響似乎特別嚴重，例如拉瓜迪亞機場航班平均延誤時間超過2小時。FAA呼籲，「政府停擺必須結束」，好讓這些飛航管制人員領取應得的薪酬，並讓旅客免於更多航班中斷及延誤。美國國家航空管制員協會（National Air Traffic Controllers Association）主席丹尼爾斯（Nick Daniels）昨天表示支持一項「乾淨版」臨時撥款法案，以重啟政府運作。美國總統川普（Donald Trump）所屬的共和黨主張先通過一項「乾淨版」臨時撥款法案，純粹維持政府資金支出於現有水準7週，避免政府停擺；民主黨則要求在法案中納入延長健保稅收補助等條款，以確保部分重要社會政策不因資金到期而中斷。不過，兩黨在支出法案上陷入僵局，聯邦政府於10月1日進入關門狀態。Politico指出，在美國政府上一次關門期間，部分飛航管制人員以病假名義缺勤，導致美國關鍵航空樞紐航班大亂，普遍被外界認為加速了政府停擺於2019年初結束。美國政府上次關門是在川普第一任期內，主因是移民議題，關門期間從2018年12月22日持續到隔年1月25日，維持35天，成為美國至今史上最長一次的政府關門。熱門賽事、球星動態不漏接    ,https://news.ltn.com.tw/news/world/breakingnews/5231515
抗議奈及利亞縱容基督徒被殺害  川普警告：美軍將採取軍事行動,國際,2025/11/02 07:31,川普1日在社群媒體「真實社群」發文威脅，若奈及利亞政府繼續縱容基督徒被殺，美國將考慮派遣部隊「荷槍實彈」發起軍事行動。（路透）美國總統川普指責奈及利亞國內針對基督徒的暴力事件，並強調有數千名基督徒遭到激進伊斯蘭主義份子殺害。川普1日在社群媒體「真實社群」（Truth Social）發文威脅，若奈及利亞政府繼續縱容基督徒被殺，美國將停止援助，並考慮派遣部隊「荷槍實彈」發起軍事行動。綜合外媒報導，川普指出，如果奈及利亞政府繼續縱容基督徒被殺，美國將立即停止對奈及利亞的一切援助，並很有可能「荷槍實彈」進入這個早已蒙羞的國家，徹底剷除那些犯下這些可怕暴行的伊斯蘭極端分子。請繼續往下閱讀...川普強調，他已指示「戰爭部」為可能的行動做準備，如果美國發動攻勢，將會是迅速、凶狠且令人痛快地攻擊。川普也警告奈及利亞政府「最好趕快行動」。川普10月31日曾發文強調，基督教在奈及利亞正面臨存亡危機，有數千名基督徒遭到殺害，而幕後兇手就是激進的伊斯蘭主義分子，同時川普也宣布將奈及利亞列為「特別關注國家」。針對川普的說法，奈及利亞總統提努布（Bola Ahmed Tinubu）1日提出反駁，強調將奈及利亞描述為缺乏宗教寬容的國家，並不符合該國實際狀況。提努布表示，「宗教自由與寬容一直是我們集體認同的核心原則，也將永遠如此。奈及利亞反對宗教迫害，也不鼓勵這樣的行為。奈國憲法保障擁有任何信仰的公民。」熱門賽事、球星動態不漏接    ,https://news.ltn.com.tw/news/world/breakingnews/5231502
川普政績落袋！高市早苗：對美5500億美元投資協議不重啟談判,國際,2025/11/02 06:34,高市早苗與川普上月28日首度舉行高峰會。（路透）首次上稿 11-01 22:45更新時間 11-02 06:34路透報導，日本首相高市早苗1日指出，她沒有計畫針對與美國達成的5500億美元投資協議重啟談判。在她就任首相之前曾說，如果該協議有不公平且傷害日本利益的情況，她不排除重新談判。請繼續往下閱讀...報導說，高市早苗結束一週外交活動，包括與美國總統川普舉行高峰會後，告訴記者，「我認為即使首相變動，政府之間的承諾應該不變」。強硬保守派的高市早苗當選日本第一位女性首相，她打破女性的政治天花板，同時也為日本向右轉的重大改變奠定基礎。高市早苗在韓國與亞太地區領導人共同出席亞太經濟合作會議組織（APEC）年度會議，她與中國國家主席習近平、南韓總統李在明會面。高市早苗1日說，她與習近平同意打造具建設性、穩定的關係。習近平告訴高市早苗，兩國不應成為彼此的威脅。在前往南韓前，高市早苗與川普在東京首度會面。她說，她與川普進行了「坦白、直接的討論，並建立了私人關係」。熱門賽事、球星動態不漏接    ,https://news.ltn.com.tw/news/world/breakingnews/5231451
畫面曝！中國功夫大師比「打耳光」 慘遭哈薩克對手KO昏迷,國際,2025/11/02 06:29,趙鴻剛在賽中連挨三掌、當場倒地昏迷。（圖擷取自YouTube）首次上稿 11-01 22:24更新時間 11-02 06:29中國祁家通背拳第9代傳人趙鴻剛以徒手碎磚、拉直鐵板聞名，日前代表中國出戰耳光對打賽「Power Slap」，原被寄望能以「中國功夫」震撼全場，卻在賽中連挨3掌就當場倒地昏迷。這場比賽原本被包裝為「硬氣功vs.力量之戰」，最終演變成中國選手慘敗、哈薩克對手完勝的結局。請繼續往下閱讀...「Power Slap」由美國UFC創辦人打造，以「耳光對打」為主題，強調爆發力與抗擊耐性。這場比賽由趙鴻剛對上哈薩克選手阿曼塔耶夫（Muhammad Amantaev），雙方輪流以全力掌擊對方臉部。開賽第一輪，趙鴻剛面對阿曼塔耶夫猛力出手、掌風呼嘯落臉，眼角當場爆血、臉部歪斜，現場觀眾驚呼不斷，他強忍痛楚回擊，但落點偏移、力道不足，未能造成威脅，氣勢明顯下滑。進入第二輪，趙鴻剛臉部腫脹、神情痛苦，身形開始不穩，而阿曼塔耶夫則神色自若，幾乎毫髮無傷。第三輪趙鴻剛勉強撐住就位，對手阿曼塔耶夫卻改以左手出擊、掌力兇猛、直中右臉，只見他全身僵直、向後倒地、昏迷不醒，裁判火速上前立刻叫停比賽，醫護人員緊急上台救治。賽後，趙鴻剛在社群影片中親口透露，顴骨有點骨裂、右眼角撕裂傷，縫合5針後已無大礙，「我沒事，感謝大家一直以來的支持和關注」。影片曝光後，網友紛紛留言表示「技不如人呀，别玩了，丢人事小，别把自己玩丢了」、「氣功的最大用途，是幫助自己忍痛縫針」、「徒弟倒了師父什麼時候出來？」、「業餘就是業餘...被網友捧幾下就真當自己能打了，現實就是這麼簡單，那些傳武吹還在那吹個不停」。不過，也有網友認為「起碼敢實戰，值得尊重了」、「第一次參加就撐到第三下，算是不錯的結果」、「看見傳武願意站上國際擂台，認真地向世界挑戰，是很值得鼓勵。起碼不要再吹噓自己天下無敵。然後又不打」。中國祁家通背拳第9代傳人趙鴻剛，日前代表中國出戰耳光對打賽「Power Slap」。（圖擷取自YouTube）熱門賽事、球星動態不漏接    ,https://news.ltn.com.tw/news/world/breakingnews/5231421
"敘利亞總統擬訪問華府　可能加入打擊伊斯蘭國聯盟",國際,2025/11/02 05:30,美國敘利亞問題特使巴瑞克今天宣布，敘利亞總統夏拉將訪問華府。如果夏拉成行，這將是敘利亞國家元首首度造訪美國首都。路透社報導，根據白宮官員，夏拉（Ahmad al-Sharaa）將於「11月10日左右」訪問華府；一名敘利亞消息人士則稱夏拉預計於未來兩週內出訪美國。請繼續往下閱讀...巴瑞克（Tom Barrack）在波斯灣國家巴林出席安全會議「麥納瑪對話」（Manama Dialogue）時，他在場邊告訴記者，夏拉此行「有望」宣布敘利亞加入由美國領導的打擊伊斯蘭國（Islamic State）聯盟。巴瑞克談到，美方目標是爭取敘利亞加入華府自2014年起所領導對抗伊斯蘭國的聯盟。伊斯蘭國在其2014年至2017年的巔峰時期，曾掌控約1/3的敘利亞跟伊拉克國土。巴瑞克稍早還提到，以色列與敘利亞在美國居中斡旋下，持續進行減緩緊張局勢的談判，且兩國已接近達成協議，不過他婉拒透露具體日期。敘利亞跟以色列正進行磋商，敘利亞希望能藉此讓以軍停止空襲，並將部隊撤出敘利亞南部。根據前述敘利亞消息人士，美國正推動敘利亞在夏拉訪問華府前，與以色列達成安全協議。（編譯：洪培英）1141102熱門賽事、球星動態不漏接    ,https://news.ltn.com.tw/news/world/breakingnews/5231490
中英對照讀新聞》Jon Bon Jovi ’grateful and humble’ to tour again after vocal cord surgery聲帶手術後再次巡演 邦喬飛感到「感激與謙卑」,國際,2025/11/02 05:30,"邦喬飛在英國溫布利球場宣布2026年全球巡演。（路透） ◎林家宇U.S. rocker Jon Bon Jovi says he is ""grateful and humble"" to be able to return to the stage again following vocal cord surgery as the band that carries his name announced a comeback tour this week.在同名樂團宣布回歸巡演後，美國搖滾歌手邦喬飛表示，對於能夠在接受聲帶手術後再次重返舞台感到「感激與謙卑」。請繼續往下閱讀...The 63 year-old singer underwent surgery in 2022 and needed three years of rehabilitation to regain the strength to sing live again.這位63歲的歌手在2022年接受手術，需要3年時間復健才能重拾再次現場演唱的力量。""I’m excited. I’m also grateful and humble,"" Bon Jovi told Reuters on the sidelines of a press conference for the 2026 tour at Wembley Stadium on Friday.邦喬飛在溫布利球場的2026巡演記者會場邊向路透談到，「我感到興奮以及感激和謙卑。」""(It) has taken a lot of rehabilitation. It’s sort of like an athlete... because you’re retraining... (like) a leg break for a footballer on this field. You have to slowly walk until he can run.""「(過程)經歷了許多復健，這就像是運動員...因為你得反覆訓練...（像是）在這座球場上摔傷腿部的足球員，你必須循序漸進直到能夠跑動。」The band, which Bon Jovi founded in 1983 and is known for hits like ""Livin’ on a Prayer"", ""Always"" and ""It’s My Life"".由邦喬飛在1983年創立的樂團，以「Livin’ on a Prayer」、「Always」和 「It’s My Life」等知名歌曲為人所知。新聞辭典undergo：動詞，經歷、經受。例句：I can’t imagine what he has undergone during that war.（我無法想像他在那場戰爭中所經歷的事物。）rehabilitation：名詞，恢復、修復。例句：His injury would require a long period of rehabilitation.（他所受的傷會需要一段長久的恢復期。）熱門賽事、球星動態不漏接    ",https://news.ltn.com.tw/news/world/paper/1730450
美大軍壓境 委總統急向中俄求救,國際,2025/11/02 05:30,委內瑞拉總統馬杜羅十月卅一日在首都卡拉卡斯會見加勒比海十四國國會議員時，手持一本迷你版的委國憲法。（路透）隨著美軍在加勒比海地區大規模增兵，包括「福特號」航艦打擊群、戰機、戰艦及數千名士兵，美委緊張關係持續升溫。「華盛頓郵報」十月卅一日獨家披露美國政府內部文件指出，委內瑞拉總統馬杜羅正向俄羅斯、中國與伊朗請求軍事支援，以應對潛在的美國攻擊。請求俄國協助加強防空能力根據美方文件顯示，馬杜羅於十月中旬親筆致信俄國總統普廷，由交通部長維拉斯克茲攜帶赴莫斯科，請求俄方協助強化防空系統，包括提供飛彈、防禦雷達，並修復先前購自俄國的數架「蘇愷-30MK2」戰機、八台引擎與五部雷達。此外，委方還計畫採購十四套俄製飛彈系統及後勤支援。馬杜羅強調，「蘇愷-30MK2」是其應對戰爭威脅的關鍵嚇阻力量。請繼續往下閱讀...尋求中國擴大軍事合作馬杜羅也致函中國國家主席習近平，尋求「擴大軍事合作」，以抵禦「美委衝突升級」。信中請求中方加快企業生產雷達偵測系統的進度，推測旨在提升委國空中監控能力。他更將美國在加勒比海地區侵略行為視為對中國的威脅，理由是委中兩國擁有共同的意識形態。接收伊朗軍備、無人機在伊朗方面，維拉斯克茲已協調接收一批軍備與無人機，並計畫訪問德黑蘭。他向伊朗官員表示，委國急需「被動偵測設備」、「全球衛星定位系統（GPS）干擾器」，以及「航程達一千公里的無人機」。俄羅斯雖長期為馬杜羅政權的重要支持者，但克里姆林宮拒絕就此信函置評。俄外交部僅表示支持委國「捍衛國家主權」，並「根據新威脅適度回應夥伴請求」。值得注意的是，一架遭美國制裁的俄國伊爾-76運輸機在上月廿六日繞道非洲，避開西方國家空域，抵達委內瑞拉首都卡拉卡斯，引發外界對秘密軍援的猜測。俄陷烏戰 未表態支持由於俄國深陷烏戰泥淖，同時著眼與其他拉丁美洲夥伴加強合作，目前沒有俄國有意擴大支持委國的跡象，更何況美委僵局可能有利莫斯科，因為可轉移美國對歐洲的注意力。與此同時，美國總統川普卅一日被問到是否正考慮對委國境內發動襲擊時予以否認，但不清楚他的意思是排除發動攻擊的可能性，或只是尚未做出最終決定。熱門賽事、球星動態不漏接    ,https://news.ltn.com.tw/news/world/paper/1730483
美國家情報首長：中東「政權更替」戰略告終,國際,2025/11/02 05:30,美國國家情報首長加巴德在中東演說時表示，美國已對中東地區的「政權更替」策略劃下句點。（美聯社檔案照）美國國家情報首長加巴德十月卅一日在中東國家巴林舉行的年度安全會議「麥納瑪對話」上表示，在川普總統的領導下，華府過去數十年來在中東地區的「政權更替或國家建設」策略，已經告終。加巴德在演說時表示：「數十年來，我們的外交政策陷入了一種適得其反且無止境的循環—政權更替或國家建設。做法千篇一律：推翻政權、試圖強加我們的治理體系、介入那些我們幾乎不了解的衝突，最後離開時，敵人比盟友還多。」她指出，此舉的結果是花費數兆美元、痛失無數人命，以及在許多情況下，製造出更大的安全威脅。請繼續往下閱讀...美國自今年初川普重返白宮執政以來，一改過去在中東促進人權與提倡民主的目標，取而代之的則是強調經濟繁榮與區域穩定，其實際作為包括促成讓以色列與巴勒斯坦激進組織哈瑪斯停止加薩戰火，以及在美軍轟炸伊朗核設施後迫使以色列結束與伊朗之間的十二天戰爭。加巴德說，加薩停火仍然「脆弱」，以及坦承有鑑於聯合國國際原子能總署（IAEA）通報伊朗核設施有新活動之兆，伊朗仍是一大顧慮。但加巴德說：「未來的道路不會簡單或輕鬆，但川普總統非常堅定會繼續走下去」。川普推美國優先 偏孤立主義加巴德的發言，形同重申她本人長期秉持的不干涉主義立場，與她過去在國會及二〇二〇年參選美國總統時批評美國參與海外戰爭的立場一致。此外，川普本人也不支持參與海外戰爭，美國撤離阿富汗就是在川普第一任期達成協議；而他今年初上台後力推的「美國優先」，則有帶有「孤立主義」傾向。熱門賽事、球星動態不漏接    ,https://news.ltn.com.tw/news/world/paper/1730484
美柬關係回溫 重啟吳哥哨兵軍演,國際,2025/11/02 05:30,柬埔寨雲壤海軍基地今年三月的衛星照片。美國和柬埔寨已同意將重啟二〇一七年停止的聯合軍演，並正討論美國戰爭部長赫格塞斯未來訪問雲壤基地事宜。（法新社）「彭博」一日報導，美國和柬埔寨將重啟二〇一七年停止的「吳哥哨兵」（Angkor Sentinel）聯合軍事演習，這是兩國關係升溫的最新跡象。美國戰爭（國防）部長赫格塞斯十月卅一日在馬來西亞舉行的東協國防部長會議期間與柬埔寨防長會晤後，宣布恢復「吳哥哨兵」聯合軍演。該演習於二〇一七年暫停，當時華府批評金邊人權問題惡化和民主倒退。請繼續往下閱讀...這項宣告為美柬關係具有里程碑意義的一週劃上句點，其中包括川普與東南亞多國簽署的貿易協議，以及在他主持下、柬埔寨與泰國簽署的和平協議，以緩和今年稍早造成數十人死亡的柬泰邊界爭端。討論美艦訪雲壤海軍基地據了解，美柬防長也討論赫格塞斯未來隨美國海軍艦艇訪問柬埔寨雲壤海軍基地的事宜。華府方面長期以來一直擔心，根據六年前簽署的一項秘密協議，中國將獲得該海軍基地的獨家軍事使用權，並聲稱該基地最終將成為北京在印太地區的第一個據點。另外，柬埔寨總理韓馬內表示，他與美國聯邦調查局（FBI）局長巴特爾在通話中承諾加強合作。柬埔寨與緬甸和寮國一樣，是跨國犯罪網路的溫床，這些網路從世界各地的受害者手中騙取數十億美元。柬國官員表示，已加強反洗錢法規，並準備嚴厲打擊詐騙中心。熱門賽事、球星動態不漏接    ,https://news.ltn.com.tw/news/world/paper/1730487
謠言終結站》洋蔥切片放腳底治小兒感冒？無科學根據偏方,國際,2025/11/02 05:30,謠言終結站網傳消息：近期馬來語社群媒體流傳「將洋蔥切片放在嬰幼兒腳底並穿襪包覆」可治發燒、咳嗽和鼻塞，引發家長關注與分享。查證結果：法新社向醫療專家查證，澄清此為無科學根據的民間偏方。醫生指出，無證據顯示洋蔥能透過腳底吸收發揮療效，且延誤就醫恐導致嚴重併發症。建議家長勿仰賴偏方，應及早就醫並依專業指導使用退燒藥等科學治療方式。熱門賽事、球星動態不漏接    ,https://news.ltn.com.tw/news/world/paper/1730488
美菲成立新特遣隊 加強南海戰備,國際,2025/11/02 05:30,菲律賓最北端的巴丹群島距離台灣約一百五十公里，是扼守巴士海峽的關鍵。圖為菲律賓軍隊在巴丹群島的雅米島升起國旗。（路透檔案照）美國戰爭部（國防部）十月卅一日表示，美國與菲律賓已成立一支新的聯合特遣隊，以加強合作與提高在包括南海等的地區的軍事戰備。同日，美國、菲律賓、澳洲與紐西蘭結束在南海的兩天聯合演習，中國解放軍一日批評此舉嚴重破壞地區和平穩定。五角大廈是在戰爭部長赫格塞斯與菲律賓國防部長鐵歐多洛於馬來西亞的東南亞國協防長會議上會晤後，做上述宣布。五角大廈發言人帕尼爾在聲明中表示，「特遣隊菲律賓支隊」將加強作戰合作，改善聯合規劃，並提高相互操作性，「特別是在南海地區」。請繼續往下閱讀...此外，菲國軍方一日發表新聞稿表示，美菲紐澳四國在十月卅日到卅一日於南海的菲國聲索海域舉行代號 「多邊海上合作行動」（MMCA）的聯合演習，以強化彼此間的海事合作與加強協同作戰能力。這是菲國今年第七次、自去年MMCA啟動以來第十二次與志同道合國家在「西菲律賓海」菲國對其在南海聲索區域的稱呼舉行最新一輪聯合演習。「西菲律賓海」是菲國對其在南海聲索區域的稱呼。一日，中國解放軍南部戰區發言人田軍里批評菲律賓拉攏域外國家在南海「攪局」，嚴重破壞區域和平穩定，並稱所謂的「聯合巡航」進一步證明菲律賓是「是南海問題攪局者、地區穩定破壞者」。田軍里還說，南部戰區曾組織兵力嚴密跟監，對任何攪局南海、製造熱度的活動「盡在掌握」，以及該戰區部隊持續保持高度戒備，以捍衛領土主權與海洋權益。熱門賽事、球星動態不漏接    ,https://news.ltn.com.tw/news/world/paper/1730486
東協抗中 美防長推聯合海域監測,國際,2025/11/02 05:30,東南亞國協國防部長會議1日在馬來西亞首都吉隆坡舉行，圖為中國國防部長董軍。（法新社）促建立聯合海域情勢感知網美國戰爭部（國防部）部長赫格塞斯一日在東協（ASEAN）國防部長會議上，力促東協國家強化海上力量，力抗中國在南海挑釁、愈加「破壞穩定」行徑，他提出建立聯合海上態勢監測機制，表示美國願意提供所需技術，支持東協國家共同回應中國的威脅。同日，日本防衛大臣小泉進次郎與中國國防部長董軍會晤，對中國軍方的活動表達關切，強調維持台海和平穩定重要性。涵蓋空中、水下無人機系統 願提供所需技術請繼續往下閱讀...赫格塞斯出席東協會議第二天，向東協各國防長提出，建立一套聯合海域情勢感知網，以及涵蓋空中、水下無人機的系統，以更低的成本和風險，強化海域監測，而美國亟欲以其創新能力和規模，與盟邦夥伴分享這些能力。他說，東協國家「都有在貴國主權水域和整個南海，發生脅迫、騷擾和非法活動的經驗」，「你們就身處在我們所有人都面臨的威脅中，來自中國的侵略和在南海與其他地區之行徑」，因此需要發展共同回應的能力，而這包括能夠監視海上行為，確保不論是誰，受威脅的一方「不再孤單」。赫格塞斯前一天與董軍會談，才對北京在台灣周邊和南海行為表達嚴正關切。他一日更進一步舉出中國海警船對菲律賓船隻發射水砲、衝撞等行徑，並表示中國在兩國爭議的黃岩島設立自然保護區「毫無正當性」，形同「實質佔領」。批中挑釁 密切監視中國行徑他批評中國的挑釁行動，挑戰且威脅該區域領土主權，「中國對南海的廣泛領土和海洋主權主張，與其承諾以和平方式解決爭端的說法背道而馳」，「我們不尋求衝突，但是我們必須確保，中國未試圖支配你們或者其他任何國家」。儘管赫格塞斯力促東協和中國，繼續其進行多年的南海行為準則談判，但是他也說，「若無具體行動支撐的準則，也會只是空話」。另外，剛上任的日本防衛大臣小泉進次郎，一日也在東協防長會議場邊，與董軍首次會談，時間約五十分鐘，小泉強調日中在安全領域仍存在眾多懸而未決的議題，並對中國軍方的活動表達擔憂。「朝日新聞」報導，根據日本政府的會後說明，小泉針對中國海警直昇機在釣魚台列嶼（尖閣諸島）周邊，侵犯日本領空、以及中國軍機接近自衛隊飛機等活動，向董軍提出嚴正關切，要求中方立即停止相關行動。此外，他也對南海局勢表達深切憂慮，並強調維持台灣海峽和平與穩定的重要性。小泉指出，兩國須正視具體棘手的問題，而非「視而不見」，強調坦誠討論和持續溝通的重要性。東南亞國協國防部長會議1日在馬來西亞首都吉隆坡舉行，圖為出席相關會議的美國戰爭部長赫格塞斯（中）。（法新社）熱門賽事、球星動態不漏接    ,https://news.ltn.com.tw/news/world/paper/1730482
