Title,News_Type,date,content,url
川普稱莫迪是「殺手」 聲稱曾以250％關稅威脅印巴停火,國際,2025/10/29 15:59,川普形容印度總理莫迪（左）是「外表最和善的傢伙」，但也是個「殺手」（killer）。（美聯社檔案照）《彭博》（Bloomberg）報導，美國總統川普29日在南韓慶州的亞太經合會（APEC）企業領袖會議上表示，他曾以「250％關稅」威脅印度與巴基斯坦，試圖促成兩國早前衝突的解決。川普同時形容印度總理莫迪（Narendra Modi）是「外表最和善的傢伙」，但也是個「殺手」（killer）。川普在發言中聲稱，他曾致電莫迪表示：「我們不能跟你達成貿易協議了，你正準備跟巴基斯坦開戰。」報導指出，川普已多次聲稱自己在此事中扮演調解角色，但此說法已引發印度官員不滿，他們始終否認美方曾進行調停。請繼續往下閱讀...川普在演說中描述，他威脅對兩國課徵250%的關稅後，才促使衝突降溫。他接著形容莫迪是「外表最和善的傢伙」，看起來像是「你會希望他當你父親」的人。但川普隨後又說：「但他（莫迪）是個殺手。他硬漢得要命。」川普並引述莫迪當時對他說的話：「不，我們會打！」《彭博》指出，儘管川普經常有誇大其詞的傾向，但他此番言論，正值莫迪為其政黨下週即將展開的關鍵地方選舉進行競選活動之際，此發言恐將為其政治對手提供攻擊的彈藥。報導稱，這起風波，已損害了先前莫迪與川普之間的緊密關係。印度一直未能說服川普降低對其出口商品加徵的50%關稅，該關稅與印度購買俄羅斯石油有關。熱門賽事、球星動態不漏接    ,https://news.ltn.com.tw/news/world/breakingnews/5227754
空中攔截！老鼠獵食新招 直擊「獵捕飛行中蝙蝠」驚悚瞬間,國際,2025/10/29 15:32,研究團隊首度拍下驚人畫面：一隻褐鼠以後腿站立，直接從半空中攔截並捕食飛行中的蝙蝠。（圖翻攝自《全球生態與保育》期刊）研究人員首度觀察到老鼠會從空中捕食蝙蝠。在德國漢堡附近一處洞穴外的岩壁上，這些充滿冒險精神的獵食者，被記錄到在夜色中直接攔截並攫取牠們的蝙蝠點心。這是一項令人印象深刻的技巧，這些老鼠是在近乎眼盲的黑暗中完成獵殺，這種侵略性行為可能對當地原生的蝙蝠族群構成重大威脅。根據科學網站《IFLScience》報導，研究團隊利用紅外線攝影機，在兩個蝙蝠用以過夜取暖的洞穴外進行觀察，並記錄下入侵的褐鼠（Rattus norvegicus）與試圖進出洞穴的鼠耳蝠屬（Myotis）蝙蝠之間發生的情況。請繼續往下閱讀...攝影機在其中一個洞穴外，共記錄到30次捕食嘗試，以及13次褐鼠成功殺死蝙蝠的事件。研究團隊指出，老鼠主要使用兩種狩獵技巧：捕捉停棲的蝙蝠，以及前所未見的「空中獵捕」。研究作者在論文中解釋：「我們頻繁觀察到老鼠在洞穴入口的平台巡邏。牠們會用後腿站立，以尾巴保持平衡，並舉起前肢來攔截飛行的蝙蝠。」論文寫道：「我們記錄到，有數個個體在半空中抓住了蝙蝠，再一口咬死，然後拖走。」這是此類行為首次被記錄下來。此一行為是在近乎全黑的環境下被記錄到的，這意味著老鼠狩獵時幾乎是眼盲的。研究團隊認為，牠們並非依靠視覺，而是依賴透過觸鬚感受到的氣流，或是其他的觸覺線索。在另一處洞穴，雖然沒有直接目擊到獵捕事件，但熱感應攝影機也多次在入口縫隙周圍看到老鼠，且在附近的岩縫中發現了蝙蝠的屍骸。老鼠是全球分布最廣的入侵動物之一，許多物種已對各地原生生物造成大規模的族群衰退，在島嶼上尤其嚴重。影片證實了老鼠會主動獵食蝙蝠，而另一地點的屍骸證據更表明，這種情況可能不只發生在一處。研究團隊認為，老鼠捕食蝙蝠的數量，可能足以嚴重危害其族群水平，保育措施應著重於保護原生物種。該論文發表於《全球生態與保育》期刊。熱門賽事、球星動態不漏接    ,https://news.ltn.com.tw/news/world/breakingnews/5227649
川普訪問南韓期間 「川金會」確定破局！,國際,2025/10/29 15:29,美國總統川普今（29）日表示，未能安排與金正恩的會面。圖為兩人2019年6月30日於板門店會面。（法新社）美國總統川普今（29）日稍早表示，他預計將在「不久的將來」與北韓領導人金正恩會面。但他晚些時候改口稱，在他訪問南韓期間，未能安排與金正恩的會面，結束先前關於他們可能進行會晤的激烈猜測。根據法新社報導，川普先前就表示，他「非常希望」在亞洲之行期間與金正恩會面，但北韓未公開回應該邀請。川普29日說「我非常了解金正恩，我們確實沒能找到合適的時間。」請繼續往下閱讀...川普指出，他將在與南韓總統李在明舉行會晤時，努力「緩和」南北韓之間的緊張關係。值得注意的是，在川普開始訪問南韓的幾個小時前，北韓宣布在其西部沿海試射飛彈。外界認為此舉有針對川普即將拜訪南韓一事的意味。另外，在川普的第一個總統任期內，金正恩曾三度與他舉行高規格峰會。他們上一次臨時會晤時間為2019年6月30日，地點是位於分隔南北韓非軍事區的板門店。熱門賽事、球星動態不漏接    ,https://news.ltn.com.tw/news/world/breakingnews/5227712
加薩死者數上升到至少50人 民眾擔憂戰爭捲土重來,國際,2025/10/29 15:27,加薩民防機構29日指出，以色列空襲導致加薩走廊至少50人死亡。（路透）以色列指控哈瑪斯在加薩走廊向以軍開火，並向加薩展開空襲。美國總統川普今（29）日稱，「沒有事情」（nothing）能夠影響加薩停火協議。但在川普說出此話的數小時後，加薩民防機構指出死者數上升，稱以色列空襲導致加薩走廊至少50人死亡。加薩民眾深深擔憂，戰爭將再次發生。根據法新社報導，川普29日在空軍一號上表示，任何事情都無法動搖加薩停火協議，但他也說，若以色列士兵被殺，以色列應該予以反擊。請繼續往下閱讀...川普強調停火協議有效性的數小時後，加薩民防機構表示至少50人亡於以色列攻勢。死者中有22名兒童、婦女和老人，另有約200人受傷。民防機構補充，以色列連夜對加薩發動數十次攻擊。加薩民防機構發言人巴薩爾（Mahmoud Bassal ）形容加薩局勢「災難性且令人恐懼」，斥責以色列的空襲是「公然違反停火協議」。加薩走廊的希法（Al-Shifa）醫院表示，其中1次襲擊擊中其後院。阿瓦達（Al-Awda）醫院指出，已接收多具遺體，其中包括4名在加薩中部努塞拉特（Nuseirat）難民營爆炸事件中喪生的兒童。位於加薩的60歲民眾艾哈邁德（Abdul-Hayy al-Hajj Ahmed）聲稱，他擔心戰爭將再次爆發。他說「我們只想休息。但我相信戰爭還會捲土重來。」熱門賽事、球星動態不漏接    ,https://news.ltn.com.tw/news/world/breakingnews/5227650
英23歲女獄警熱戀男囚！祈禱室裡偷情 牢房藏挑逗照,國際,2025/10/29 14:59,英國1名女獄警戴爾被控在獄中與2名服刑男囚發生關係。（圖擷取自X帳號@WinstonAlfred8x）英國法院近日審理一樁獄警涉瀆職案件，23歲的女獄警戴爾（Isabelle Dale）被控在任職期間與2名服刑囚犯發生性關係，她甚至協助情人走私毒品。警方還在她的車上發現據稱是囚犯送她的訂婚戒指。綜合媒體報導，戴爾自2021年開始擔任獄警。她被控在薩里郡（Surrey）的科丁利監獄（HMP Coldingley）與1名叫沙里夫（Shahid Sharif）的囚犯發生性關係。請繼續往下閱讀...檢方指出，2022年7月19日，戴爾被拍到與沙里夫一起進入監獄的祈禱室，他們在裡面待了4分鐘，期間有2名囚犯在門外放哨。祈禱室內沒有攝影機，但2人出來後都在整理衣服。警方逮捕戴爾後，在她的手機裡發現沙里夫傳的訊息，內容包括稱讚她的生殖器，以及「今天一起的感覺真不錯」等字句。這段關係從2021年9月1日持續到2022年12月31日。當時沙里夫正服12年刑期的第3年，事件曝光後，沙里夫被轉移到肯特郡（Kent）的斯威爾塞德監獄（HMP Swaleside）繼續服刑。期間戴爾曾3次前往探視沙里夫，同時與沙里夫及其他同夥共謀，企圖將摻有大麻的信封偷運進該監獄。檢察官透露，警方搜查了沙里夫的牢房，發現大量情書及戴爾寄出的挑逗性照片。除了沙里夫，戴爾還被指控與另1名囚犯發生過關係。戴爾出庭時否認2項「公職人員瀆職罪」及「共謀將A類違禁物品走私入獄」的指控。該案審訊於27日開始，預計持續2週。熱門賽事、球星動態不漏接    ,https://news.ltn.com.tw/news/world/breakingnews/5227472
雞尾酒含工業用清潔劑 美婦人喝了食道穿孔2年後不治,國際,2025/10/29 14:58,美國1位婦人誤喝到添加工業用清潔劑的調酒導致食道穿孔，兩年後離世；示意圖，圖與新聞事件無關。（美聯社資料照）美國奧克拉荷馬州1位30歲女性希爾（Holly Hill）在2023年情人節那天，和丈夫在墨西哥餐廳點了一杯瑪格麗特調酒後，覺得嘴裡「火辣辣的」，並馬上開始嘔吐，就醫發現因為喝的雞尾酒含有工業用清潔劑，導致食道穿孔，事發兩年後不治身亡，希爾家人聲稱死因與誤飲事件有關。《紐約時報》報導，希爾除了是3個孩子的媽媽外，還是小學3年級的老師，希爾的媽媽杭特（Kelly Hunter）在社群平台上表示，在希爾去世前幾天的手術上，醫師發現她食道上的洞還沒有完全癒合，訃聞中也寫到在過去兩年半的時間裡，希爾一邊教書、一邊照顧家人，經歷了漫長而艱辛的醫療歷程。請繼續往下閱讀...希爾因為持續性的健康問題起訴該餐廳後，與餐廳達成保密和解。餐廳尚未發表評論，但於2023年5月曾發表聲明，對事件感到抱歉，並強調這種事情根本不應該發生。奧克拉荷馬州當局正在調查此案。熱門賽事、球星動態不漏接    ,https://news.ltn.com.tw/news/world/breakingnews/5227575
川普與高市早苗再確認台海和平穩定  龐皮歐：維持台灣自由獨立至關重要,國際,2025/10/29 14:20,美國前國務卿龐皮歐。（彭博）美國川普總統亞洲行，與日本首相高市早苗會談，將進一步強化美日同盟，高市除強調要建立同盟的新黃金時代，也表示雙方再次確認台灣海峽和平與穩定的重要性。曾於川普第一任總統任內擔任美國國務卿的龐皮歐，透過臉書等社群平台表示，川普總統的決定性政策，正在全球重建美國的威懾力量；但像中國這樣的敵對者，仍會繼續尋找方法來測試我們的決心。龐皮歐強調，美國維持百分之百承諾，致力於維護台灣自由與獨立，是至關重要的。請繼續往下閱讀...龐皮歐臉書並貼他在八月發表的「自由獨立的台灣對美國安全至關重要」專文。該文指出，台灣利益與美國利益高度相符，在台灣議題上刻意模糊，只會助長北京的侵略姿態。他並進一步強調，華府需要全面的對台策略，包括逐步實現全面外交承認，而現在正是實現戰略清晰的時候；「引來侵略的並不是強硬，而是軟弱」。龐皮歐在該文說，他擔任國務卿期間，協助推動美國對中政策的革命性轉變，其中一部分就是在最大程度上將美台關係從美中關係架構中脫離。離開公職後，他2022年首度公開訪台，呼籲美國正式承認台灣從未是中華人民共和國的一部分，台灣是「自由且獨立的國家」。熱門賽事、球星動態不漏接    ,https://news.ltn.com.tw/news/world/breakingnews/5227475
美日同盟劍指中國！五角大廈：嚇阻中國侵略至關重要,國際,2025/10/29 14:15,美國國防部長赫格塞斯（左）29日在東京會晤日本防衛大臣小泉進次郎（右）。（路透）美國國防部赫格塞斯 （Pete Hegseth）29日表示，美日同盟對於「嚇阻中國的軍事侵略至關重要」。與此同時，日本防衛大臣小泉進次郎也當面證實，將提前達成國防支出佔國內生產毛額（GDP）2 %的目標。法新社指出，此番言論正值美國總統川普與日本新任首相高市早苗28日舉行首次面對面會晤之後，安全議題是當時主要討論主題。法新社並指出，長期奉行和平主義的日本，正採取更為強健的軍事姿態。請繼續往下閱讀...赫格塞斯在與小泉進次郎會晤時表示：「為了應對區域突發事件，並與日本並肩維護我們國家的安全，我們期待繼續強化我們的同盟關係。」高市早苗上週曾表示，她的政府將在本財政年度達成國防支出佔 GDP 2 %的目標，比原定計畫提前2年。小泉29日在東京向赫格塞斯證實：「我們將採取措施，在本財政年度內，比原定計畫更早達到 GDP 2 %的水準。」法新社報導，美國目前約有6萬名軍事人員駐紮日本。華府希望東京投入更多，可能達到與北約 （NATO） 成員國今年6月承諾的GDP 5%標準。小泉也表示：「鑑於日本周邊地區的飛彈能力已顯著增強，我認為持續強化飛彈防禦能力至關重要。」28 日，高市早苗在東京近郊的美國海軍「華盛頓號」航空母艦上，與川普一同向數百名水兵表示，她「致力於從根本上強化」日本的防衛能力，並指出日本正面臨「前所未有的安全威脅」。熱門賽事、球星動態不漏接    ,https://news.ltn.com.tw/news/world/breakingnews/5227602
川習會前釋善意？ 川普首度透露：願以「芬太尼換關稅」,國際,2025/10/29 14:01,"美國總統川普29日於南韓慶州舉行的亞太經合會（APEC）執行長峰會上發表演說。（美聯社）在與中國國家主席習近平的關鍵會晤登場前夕，美國總統川普29日釋出高度樂觀的訊息，不僅預期會談將「非常棒」，更透露他預期將以降低關稅，換取北京在打擊芬太尼問題上的合作。根據法新社報導，川普是在飛往南韓的「空軍一號」專機上，向隨行記者發表上述談話。他表示：「我認為我們將與中國的習近平主席舉行一場很棒的會晤，許多問題都將被解決。」他補充說，美中雙方並非毫無準備就進入會談。請繼續往下閱讀...川普具體透露，他預期將降低對中國商品加徵的關稅，以換取北京承諾遏制芬太尼（fentanyl）前體化學品的出口。美中雙方談判代表皆已證實，一項「框架協議」已經達成，正等待兩國領導人最終敲定。然而，國際危機組織（International Crisis Group, ICG）的分析師楊念祖認為，雙方期望似乎存在「落差」。他分析，美國「渴望達成任何可被川普宣稱為勝利的貿易協議」，而中國則更專注於「建立更多互信、管控長期分歧」。就在川普抵達前數小時，北韓才剛宣布試射了海對地巡弋飛彈，但川普對此不以為意。他向記者表示，他專注於與習近平的會晤，並補充說：「我們之後會在某個時間點與北韓接觸。」對於此行最敏感的台灣議題，川普則表示，他「不確定是否會與習近平討論此事」。川普此行也將與南韓總統李在明舉行峰會，但雙方在貿易談判上仍陷入僵局。熱門賽事、球星動態不漏接    ",https://news.ltn.com.tw/news/world/breakingnews/5227555
曼谷飯店竄火狂燒！房客慌逃陽台畫面曝 53歲爸失足墜樓亡,國際,2025/10/29 13:48,泰國曼谷一間飯店發生火警，住客躲在陽台邊緣等待救援，一名男子不慎從7樓墜落。（本報合成，擷取自泰國消防局臉書）泰國曼谷挽那區（Bangna）一間飯店25日中午驚傳火警，現場濃煙密布、火舌竄出，多名房客急忙逃生，場面一度混亂。其中一名父親為了帶妻女逃命，卻不慎從7樓陽台墜落身亡，妻女獲救後情緒崩潰，悲痛場面令人鼻酸。綜合泰媒報導，事發於中午12時15分，地點位於烏棟素17巷的一棟十層樓飯店。警方與消防局接獲通報後，立刻派出5輛消防車趕往現場搶救。大火從7樓多間客房竄出，火勢猛烈並迅速蔓延，7樓以上的房客一度受困，紛紛跑到陽台求救。請繼續往下閱讀...消防隊畫面顯示，數名房客坐在陽台邊緣等待救援，情況相當危急。53歲泰國男子阿提（音譯）與妻女住在718、719號房，當時一家人被濃煙包圍，阿提試圖從陽台逃生卻不慎墜落地面，送醫後仍傷重不治；其妻女雖幸運脫困，但在現場痛哭失聲。消防隊歷經約1小時撲滅火勢，成功疏散數十名受困房客。共有4人吸入濃煙，包括48歲女子、22歲女子、47歲男子及一名42歲緬甸籍男子，所幸皆無生命危險。初步調查指出，起火點疑似位於704或716號房，火勢因內部裝潢與空調管線迅速擴散，導致4間客房幾乎全毀。警方目前已封鎖現場，待鑑識人員排煙與降溫後再進入調查確切起火原因。熱門賽事、球星動態不漏接    ,https://news.ltn.com.tw/news/world/breakingnews/5227430
圖輯》高市魅力無法擋！川普：任何妳想要的都給,國際,2025/10/29 12:51,"登上「華盛頓號」航空母艦後，川普、高市兩人在美軍印太司令帕帕羅上將（右）的陪同下，輕鬆交談。川普在隨後的演說中，稱他與高市已成為「非常親近的朋友」。（法新社）美國總統川普的亞洲行抵達東京，外界原預期將聚焦於棘手的貿易與國防議題，然而，此行最大的亮點，卻是他與剛上任的日本首位女首相高市早苗之間，迅速建立起的一段「輕鬆的融洽關係」。從一個讓川普印象深刻的「有力握手」開始，兩人之間的互動充滿了超越外交辭令的個人色彩，彷彿重現了川普與其已故摯友、日本前首相安倍晉三之間的化學反應。根據《彭博》報導，川普在會談中直接對高市表示：「任何妳想要的、任何妳需要的幫忙，我們都會在那裡。」這張形同「空白支票」的強力背書，為高市的外交初登場，送上了最貴重的大禮。面對川普的熱情，高市也積極回應。她宣布，為慶祝美國建國250週年，日本明年將向美國贈送250棵櫻花樹，在東京赤坂宮的首次會晤中，川普便對日本首位女首相高市早苗的「非常有力道的握手」印象深刻，為兩人的會晤定下不尋常的個人基調。（路透）儘管在貿易議題上未有重大突破，但在雙邊擴大會議上，兩人展現了高度的互動默契。川普盛讚美日同盟達到「最強健的程度」，高市則對川普的「活力外交」表示欽佩。（彭博）結束在赤坂宮的會談後，川普與高市早苗並肩走上華麗的階梯。兩人輕鬆的姿態，預示著接下來的行程將從嚴肅的國是訪問，轉向更具個人情誼的互動。（路透）川普28日邀請高市搭乘總統專用直升機「陸戰隊一號」，前往神奈川縣的美國海軍橫須賀基地。高市晚間在社群平台X貼出與川普在機上的合照，讓日本網友相當興奮。（取自高市草苗X）在對數千名美軍官兵的演說中，川普盛讚高市早苗是「贏家」。《紐約時報》報導，當川普重述她當選的歷史意義時，高市興奮地揮舞拳頭回應，將現場氣氛推向高潮，也為這段迅速升溫的領袖友誼，留下了最具代表性的一幕。（路透）在赤坂宮檢閱儀隊的莊重儀式中，高市早苗首相的手臂，自然地搭在了川普總統的背後。這個超越傳統外交禮節的舉動，為兩人之間的互動增添了一絲溫暖與默契。（美聯社）熱門賽事、球星動態不漏接    ",https://news.ltn.com.tw/news/world/breakingnews/5227456
悚！不滿手機被玩壞「百萬積分歸零」 大馬9歲童割頸6歲弟,國際,2025/10/29 12:43,兒少網路成癮問題近年在各國愈來愈受到重視。示意圖，非新聞當事人。（美聯社資料照）馬來西亞柔佛州近日發生1起駭人「6歲男童遭利器割頸」案，警方初步調查發現，嫌犯疑是男童的9歲哥哥；哥哥因不滿弟弟玩壞手機，導致手機遊戲內的積分全部消失，因而產生幻覺，下重手傷害弟弟。綜合當地媒體報導，警方指出，9歲的哥哥沉迷網路遊戲，投入長時間累積了高達100萬分的積分。而弟弟使用哥哥的手機時，不慎將手機弄壞，該遊戲積分也瞬間歸零。哥哥之後疑受網路暴力遊戲影響，情緒失控並產生幻覺，稱聽到有聲音告訴他，叫他去傷害弟弟。「他（哥哥）拿家裡的一把刀，刺向弟弟。」請繼續往下閱讀...母親在清晨發現弟弟頸部有嚴重傷痕，隨即送醫急救，弟弟接受手術後情況穩定。警方隨後逮捕兄弟的父母，以協助調查。目前兄弟倆皆由社會福利局照顧，男童還有1名15歲的姊姊。熱門賽事、球星動態不漏接    ,https://news.ltn.com.tw/news/world/breakingnews/5227364
快煮壺煮熱飲、泡麵好方便？ 日飯店發影片說NO︰會壞掉,國際,2025/10/29 12:41,飯店提醒，千萬別把快煮壺拿來煮熱飲或泡泡麵，雖然很方便，但容易故障；示意圖，圖與新聞事件無關。（資料照）飯店客房內有各種設施，目的是讓客人入住舒適，然而這個方便可不能當成隨便，造成飯店清潔人員的不便。日本大阪市的「Hotel B Suites」在官方TikTok上發影片提醒，千萬別把快煮壺拿來煮熱飲或泡泡麵，雖然很方便，但容易故障。日媒「Hint-Point」報導，在影片中，客人異想天開「如果把泡麵放進快煮壺中不用洗，豈不是完美？」飯店工作人員立刻制止說「不可以」，並解釋「這樣會把快煮壺用壞，而且這種使用方式是錯誤的」。請繼續往下閱讀...飯店工作人員強調，請不要像在家裡用鍋煮泡麵那樣，直接用快煮壺煮泡麵，也再次提醒快煮壺的正確用途是「用來燒熱水」，如果直接用快煮壺料理，食材和調味料會附著在壺內，導致壺故障，況且若殘留油漬，還會影響衛生無法使用，不僅給飯店帶來不便，也會給下一位使用者帶來困擾。留言區有網友驚呼「沒想到能這樣使用」，也有網友說「聽說有人拿快煮壺來煮襪子」，甚至有因為工作關係需要經常住飯店的網友提到，他完全不敢用飯店提供的快煮壺和玻璃杯。  @b_suites.official 質問きてた！部屋のケトルでラーメンを作っていい？ #hotelbsuites #難波 ♬ オリジナル楽曲  - HOTEL B Suites／ホテルビースイーツ   熱門賽事、球星動態不漏接    ,https://news.ltn.com.tw/news/world/breakingnews/5227325
以色列襲加薩再釀38死 川普：沒有事情能動搖停火,國際,2025/10/29 11:57,美國總統川普今（29）日表示，「沒有事情」能夠動搖加薩停火協議。（美聯社）以色列指控哈瑪斯在加薩走廊向以軍開火，並向加薩展開空襲。加薩民防機構稱，以色列28日的空襲造成至少38人死亡。對此美國總統川普今（29）日表示，「沒有事情」（nothing）能夠影響加薩停火協議。根據法新社報導，以色列國防部長卡茲指責哈瑪斯襲擊位於加薩的以軍，以色列總理納坦雅胡下令對加薩進行「強力打擊」。雖然卡茲沒透露以軍遇襲地點，但哈瑪斯稱其武裝人員「與拉法槍擊事件無關」。請繼續往下閱讀...川普29日在空軍一號上強調，任何事情都無法動搖加薩停火協議，但他也說，若以色列士兵被殺，以色列應該予以反擊。美國副總統范斯指出，雖然發生了小規模衝突，但停火仍在維持中。范斯稱「我們知道哈瑪斯或加薩走廊其他勢力襲擊1名以色列士兵，但我認為總統（川普）的和平協議將會維持下去。」熱門賽事、球星動態不漏接    ,https://news.ltn.com.tw/news/world/breakingnews/5227318
