Title,News_Type,date,content,url
日本民眾對媒體信任度持續下降 融合新舊成未來方向,國際,2025/10/06 15:11,《讀賣新聞》仍是全球發行量最高的報紙，但日報訂閱數量已從15年前逾1000萬份，下降到2年前的620萬份。（路透）日媒《今日日本》（Japan Today）6日報導，日本總務省指出，2023年日本媒體格局發生重大轉變，所有年齡層的平日網路使用時間首次超過電視後，此一差距在去年進一步擴大。觀察家表示，新媒體格局不僅對傳統新聞業，也對日本民主產生影響。據報導，日本年輕人接觸電視、報紙等傳統媒體的次數與日俱減。儘管《讀賣新聞》仍是全球發行量最高的報紙，但日報訂閱數量已從2010年宣稱超過1000萬份，下降到2023年的620萬份。與此同時，在影音分享平台YouTube上，所有年齡層的用戶都超過80％，某些新聞「解讀者」有時甚至比傳統媒體專業人士更出色。在社群平台Ｘ上，觀點的傳播速度遠超過任何事實查核。請繼續往下閱讀...7月下旬，日本漫畫家倉田真由美批評Ｘ平台上針對1位成人電影女星的歧視性言論。這篇貼文迅速走紅，引起那些對傳統媒體不信任的人們共鳴。她的說法直接點出1個日益嚴重的困境：在這個任何人都可以成為出版商的世界，人們應該如何獲取資訊，以及傳統媒體應該扮演什麼角色？經常擔任電視評論員的倉田說：「年輕人和老年人雖生活在同一個國家，但消化資訊的方式不同，這導致他們的認知脫節，彷彿他們是不同國家的居民。」倉田表示，與電視不同，社群媒體會不斷播送自身支持的觀點，這就形成「回音室效應」，使用者只會接觸到強化他們既有信念的訊息。她表示，日本傳統媒體最讓人不信任的地方在於，它們經常不糾正自己傳播的錯誤訊息，「它們甚至會放任這些訊息繼續傳播。此外，考慮到它們與付費廣告商的關係，或像電視那樣，受廣播法的限制，這就是不信任的根源」。《共同社》分析並報導與7月份參議院選舉相關的YouTube影片指出，在觀看次數最多的100段影片中，約80％是由與政黨或政治人物無關的第三方製作的短片，其中包含挑釁性語言、嚴厲批評或試圖揭穿政治訊息的影片。與此同時，來自新聞機構的影片觀看人數卻寥寥無幾。倉田看出其中一個令人擔憂的趨勢，即人們只想抓住關鍵點，而不想參與整段討論，「他們愈來愈重視獲取盡可能多的訊息，即使這些訊息很膚淺。對於這些觀眾來說，短影音就足夠了，而對於創作者來說，更短的內容更容易製作，從而實現雙贏」。在YouTube上，更高的觀看次數意味更高的收入。挑釁性的語言引人注目，創作者努力用簡短的措辭來吸引觀眾，這導致更極端的措辭。相較之下，新聞機構雖謹慎行事，但它們的觀看次數永遠無法與社交媒體上那些故意引發爭議的影片相媲美。即便如此，電視台也為了吸引目光而炒作事件。在COVID-19疫情、災難和重大事件期間，他們也會反覆播放同樣的片段。幾十年前，年輕人如果根本不看電視或讀報紙，就可以完全遠離政治；如今，即使他們對政治不感興趣或漠不關心，他們關注的網紅或名人也能吸引他們的注意力。倉田認為，最好利用社群媒體和傳統媒體來互補彼此的不足，從兩者中獲取訊息，並找到適合每個媒體消費者的風格。YouTube吸收了電視的優勢，有些影片的剪輯技術甚至堪比電視節目。傳統媒體仍然擁有巨大的影響力，但如果它們繼續走下坡路，那將是一種浪費。展望未來，電視和報紙是時候學習社群媒體的優秀之處了。熱門賽事、球星動態不漏接    ,https://news.ltn.com.tw/news/world/breakingnews/5202145
中國「十一長假」災情頻傳！西藏暴雪千人受困、麥德姆颱風重創華南,國際,2025/10/06 15:09,颱風麥德姆二度登陸中國，重創廣東、海南島等地。（路透）中國「十一」黃金週原本是出遊旺季，卻在假期尾聲遭遇極端天氣夾擊。西藏聖母峰（Mount Everest）東坡營地3日晚間突降暴雪，近千名登山客被困，帳篷遭厚雪壓垮，多人失溫受困；同時，颱風「麥德姆」橫掃華南，昨（5）日先後登陸廣東與廣西，官方緊急撤離數十萬人，其中海南島文昌市更爆發11年來最嚴重的海水倒灌災情。綜合外媒報導，暴雪發生於海拔4500公尺以上的珠峰東坡營地。當地自3日晚間起風雪不斷，部分登山客受困帳篷中，甚至失溫昏迷。一名獲救登山客回憶，「真的又冷又濕，完全沒想過10月會下這麼大的雪」。請繼續往下閱讀...截至目前，已有約350人獲救並撤離至曲當鎮，其餘仍由救難人員和村民協助搜救中。西藏藍天救援隊指出，厚重積雪導致帳篷成片坍塌，許多遊客無法自行脫困。定日縣文旅局自5日起緊急封閉聖母峰景區入口、暫停售票，以利救援進行。除西藏雪災外，中國南方也遭「麥德姆」颱風重創。根據氣象資料，麥德姆颱風中心最大風速達每小時151公里，5日下午先在廣東湛江登陸，6日凌晨又於廣西北海市二度登陸。中國當局啟動最高級別「紅色颱風預警」，廣東、海南共疏散34.7萬人。海南島災情最為慘烈，文昌市鋪前鎮因海水暴漲導致嚴重倒灌，街道、住家全遭淹沒，水深最多達半公尺，部分地區更出現停電停水情況。鄰近海邊的鋪海派出所也受創嚴重，一樓辦公室泡在水中，員警只能撤離至2樓辦公。有居民站在自家二樓無奈看著洪水衝進街道，直言浪比兩層樓還高，驚呼是11年來最兇猛的一次。5日凌晨至上午，文昌灣海域潮位達5.2公尺，超警戒水位1.6公尺，創2014年颱風雷馬遜以來最高紀錄。麥德姆颱風橫掃雷州半島後再登陸廣西，北海市區風勢猛烈，最大陣風達每秒30.4公尺，為2014年以來最強。當局警告，目前颱風雖減弱，但沿海地區仍須嚴防強風與暴雨災情。熱門賽事、球星動態不漏接    ,https://news.ltn.com.tw/news/world/breakingnews/5202090
川普第2任期對中政策疑軟化 引華府鷹派不安,國際,2025/10/06 14:48,華府的對中鷹派人士擔心，川普急於與中國達成貿易協議，又允許部分AI晶片出口中國，暗示對中政策正在軟化。（法新社）英文《日本時報》（The Japan Times）6日分析，美國總統川普在第一個任期內改寫美國對中國政策的規則，擁抱對抗、發動貿易戰，顛覆數十年來的政策。但在他的第二個總統任期內，華府的對中鷹派人士開始擔心川普正在軟化其對中政策。據分析，隨著川普尋求與美國最大的經濟和戰略競爭對手中國達成貿易協議，主張對中國採取更強硬政策的人士擔心，隨著科技業影響力不斷增強，以及總統對他所謂「大交易」的渴望，對中鷹派在政府內部將被邊緣化。請繼續往下閱讀...在川普可能與中國國家主席習近平在未來幾週舉行會晤的情況下，這種擔憂變得更加緊迫。在此之前，中國提出一系列可能顛覆美國數十年政策的要求，包括放鬆投資限制以換取更多資金流入，以及削弱美國對台灣的支持。進一步加劇擔憂的是，川普已表明他願意無視鷹派擔憂，包括達成協議以確保影音分享應用程式TikTok（抖音國際版）的生存，並計畫允許晶片設計大廠輝達向中國出售部分人工智慧晶片。川普還摒除國家安全會議（NSC）中許多主張對中採取更強硬立場的顧問，並削弱該會議的作用，以至於安全和科技專家擔心，已經沒有人能夠反擊那些尋求與北京建立更緊密商業關係的人。在川普第一任內擔任國家安全會議副顧問、負責中國事務的博明（Matthew Pottinger）表示：「北京現在正處於一個有利位置，白宮似乎沒有意識到，其對TikTok的政策以及對晶片出口限制的放鬆，是對中國共產黨的大規模單方面讓步。」從某種程度上來說，鑑於川普公開表示願意與他原本被冷落的國際勢力達成協議，包括俄羅斯總統普廷和北韓領袖金正恩，他的立場並不令人意外。但考慮到美中經濟的緊密聯繫，以及中國在人工智慧、晶片和網路技術方面挑戰美國的能力，川普與中國的關係風險要高得多。上週，輝達執行長黃仁勳在一次採訪中猛烈抨擊對中鷹派人士，緊張局勢就此公開化。身為川普在科技和對中政策方面影響力日益增強的非正式顧問，他表示，鷹派人士戴著「恥辱的徽章」（badge of shame），不愛國。黃的支持者後來辯稱，他的話被斷章取義。這引發川普前顧問巴農等鷹派人士的回應，他們呼籲逮捕黃仁勳，因為他是「中國共產黨的影響力代理人」。支持川普的科技投資者朗斯德爾（Joe Lonsdale ）發文稱，他是一位自豪的對中鷹派人士，「中共是一個邪惡、殘暴的獨裁政權」。黃仁勳和擔任川普人工智慧和加密貨幣沙皇的科技投資者薩克斯（David Sacks）主張，讓北京迷上美國技術符合美國的利益，這樣可以阻止中國企業累積足夠的規模和市場份額，從而壓倒其他市場的美企。薩克斯在接受採訪時表示，試圖挑起對中鷹派與政府中商界人士對立的論調，是基於一種錯誤的二分法，「我們都同意，我們必須贏得與中國的人工智慧競賽，問題在於策略。我們相信，取勝之道在於支持美國的創新、基礎設施、能源和出口」。熱門賽事、球星動態不漏接    ,https://news.ltn.com.tw/news/world/breakingnews/5202125
日本沖繩縣南城市長涉9起性騷 不願下台竟解散議會,國際,2025/10/06 14:46,日本沖繩縣南城市市長古謝景春，涉嫌對職員犯下9起性騷案，在市議會通過不信任案後決定解散議會。（圖擷自古謝景春臉書）日本沖繩縣南城市市長古謝景春，涉嫌對市府職員犯下9起性騷案，市府委任第三方調查後認定存在性騷事實，市議會於9月26日通過不信任案，孰料古謝景春不願下台，今（6日）宣布解散議會。據《沖繩時報》報導，古謝景春會對職員做出親吻等性騷行為，9月22日一段錄音外流更是讓外界震驚，從中可以聽到古謝景春在市長室內要求女職員讓他抱一下，因此市議會4天後表決通過不信任動議。請繼續往下閱讀...按照規定，古謝景春最遲必須在今天決定是要辭職還是解散議會，最終他選擇了後者。古謝景春上午11時許親手將議會解散通知交給了議長中村直哉，之後將在40天內改選議會，目前推測可能會在11月9日投票。古謝景春隨後接受採訪，強調自己絕對沒有性騷，這起爭議遲早會真相大白，但議會卻以市政陷入混亂為由通過不信任案，讓他感到相當不滿。古謝景春表示，若是他下台的話，等於就承認有性騷，因此最終決定解散議會。南城市府表示，議會改選估算需要花費2000萬日圓（約新台幣407萬元），若是新議會繼續提出不信任動議，並在3分之2議員出席的情況下過半數通過，那麼古謝景春就會失去市長一職。熱門賽事、球星動態不漏接    ,https://news.ltn.com.tw/news/world/breakingnews/5202087
好的開始！ 日媒民調：66％民眾對高市早苗「寄予厚望」,國際,2025/10/06 14:33,準備接任首相的高市早苗，在最新民調中的支持率飆至66％。（美聯社）日本執政黨自民黨總裁選舉落幕後，外界關注接下來的新內閣如何帶領國家。最新民調顯示，高市就任總裁之始，支持率就高達66％，顯示民眾普遍認同選舉結果。英文《日本時報》（The Japan Times）6日報導，《日本新聞網》（JNN）在週末進行的民調顯示，有66％民眾表示對高市早苗「寄予厚望」，自民黨支持者對她的認可更高達75％；民眾對自民黨本身的支持率也上升至27.9％，較上月上升4.6％。請繼續往下閱讀...當被問及為何對高市早苗抱有如此高的期望時，25％的受訪者表示「可以信賴她的政策」，而23％的受訪者則表示「其他人都無法勝任」，並認為高市早苗「標誌著一個新的開始」。在26％不認同高市的受訪者中，有26％是本來就反對任何自民黨總裁，20％是不信任高市的人品，另有18％是對其政策感到失望。當被問及高市能否重塑大眾對自民黨的信任時，40％的受訪者表示有信心，而48％的受訪者則表示沒有信心。自民黨在過去一年中因黨內秘密資金醜聞而遭遇三次重大選舉失敗。在政策方面，大多數受訪者呼籲高市推出措施，以抑制通貨膨脹、振興經濟並解決在日外國人問題。針對本月中旬的國會首相指名選舉，65％的受訪者認為高市是最佳人選；其次是立憲民主黨黨魁野田佳彥，支持率為11％；第三則是國民民主黨黨魁玉木雄一郎，支持率為7％。高市若想當選首相，在國會中未佔多數的自民黨－公明黨聯盟必須說服一個反對黨，例如日本民主黨、國民民主黨或日本維新會，在眾議院投票支持她。民調顯示，24％的受訪者表示高市應該與國民民主黨組成聯盟，其次是日本維新會（15％）和立憲民主黨（13％）。不過，也有23％的人表示，沒有必要邀請新政黨加入執政聯盟，在這種情況下，自民黨必須與反對黨逐一合作，以通過立法。熱門賽事、球星動態不漏接    ,https://news.ltn.com.tw/news/world/breakingnews/5202102
高市早苗啟動人事安排  3名「手下敗將」可望入閣,國際,2025/10/06 14:20,日媒披露，高市早苗（右三）已開始內閣人事安排，總裁選舉中落敗的小泉進次郎（左一）、小林鷹之（右一）和茂木敏充（右二）等人，都可望入閣。（路透）日本自民黨新任總裁（黨魁）高市早苗今天開始人事布局工作，《共同社》及《朝日新聞》等日媒6日披露，這次在總裁選舉中敗陣的茂木敏充，可望加入高市內閣。據報導，69歲的茂木敏充，可望在高市內閣中出任外務大臣，而前防衛大臣木原稔則可望出任內閣官房長官。木原稔與高市關係深厚，2021年黨魁選舉時即擔任其競選事務局長；他現任「日華議員懇談會」事務局長，與台灣互動密切，外界關注其在對中、對台與安全政策上的走向。請繼續往下閱讀...此外，高市公開表示，將儘量啟用黨內多位競爭者及其人馬。消息指出，前經濟安全保障擔當大臣小林鷹之可望取得重要閣位，農林水產大臣小泉進次郎也可能轉任其他部會首長。茂木敏充是這次自民黨總裁選舉中第1位宣布參選的議員，擁有豐富的外務大臣、貿易大臣和自民黨幹事長經驗。他主張日本通貨緊縮接近尾聲，日本央行應將非常規寬鬆政策正常化。經濟方面，他承諾提供「數兆日元地區補助」，資金來自盈餘稅收，以支持受通膨困擾的家庭。在這次總裁選舉中，茂木敏充缺乏競爭對手擁有的廣泛公眾號召力，在第一回合投票中，國會議員票僅拿34票，黨員票拿下15票，合計49票，在5名候選人中敬陪末座。熱門賽事、球星動態不漏接    ,https://news.ltn.com.tw/news/world/breakingnews/5202079
3068人同時伏地挺身1分鐘 美防長赫格塞斯帶頭創世界紀錄,國際,2025/10/06 14:13,美國國防部長赫格塞斯5月30日登上杜威號神盾驅逐艦，與官兵做伏地挺身。（圖：美軍太平洋艦隊臉書）根據福斯新聞網（Fox News）等媒體報導，美國國防部長赫格塞斯4日在一場軍校美式足球賽中，帶領超過三千名官兵與球迷一同做伏地挺身，成功刷新了金氏世界紀錄。然而，這場創紀錄的活動，遠不止是軍隊的狂歡，更是這位鷹派防長對軍隊體能標準、甚至對「肥胖將軍」宣戰的強烈政治信號。在馬里蘭州安納波利斯舉行的海軍官校對戰空軍官校的美式足球賽中，赫格塞斯帶領由官校生、軍官和球迷組成的3068人隊伍，同時進行了一分鐘的伏地挺身，打破了「最多人同時做伏地挺身」的金氏世界紀錄。請繼續往下閱讀...此舉讓海軍不僅在球場上以34比31的比數擊敗了空軍，更在場邊一舉刷新了先前由空軍官校所保持的2926人伏地挺身紀錄。然而，這場創紀錄活動只是赫格塞斯當天行程的一部分。報導指出，就在同一天稍早，赫格塞斯才剛開除了海軍參謀長哈里森（Jon Harrison）。赫格塞斯當天深度參與了海軍的慶祝活動，除了帶頭破紀錄，賽後他還進入休息室，向贏得比賽的球員們發表了激昂的演說。這場勝利也讓海軍在爭奪美國三軍官校最高榮譽「總司令盃」（Commander-in-Chief's trophy）的競爭中，佔據了有利位置。在赫格塞斯參與創下紀錄的行動之前，他曾多次發表強硬言論，明確表示將拒絕任命不符合體能標準的「肥胖將軍」，並要求調整整體體能測驗標準。在赫格塞斯強調軍隊體能標準的同時，美軍各軍種正在執行不同的體能測驗制度。《路透》報導，陸軍今年6月起以新版陸軍體能測試取代戰鬥體能測試，項目包括硬舉、伏地挺身、負重衝刺、平板支撐和3.2公里跑步。21個作戰專業的現役士兵必須符合更嚴格標準。海軍體能測驗包含伏地挺身、平板支撐及游泳或跑步等耐力項目。空軍除腰圍與身高比例要求外，測驗項目包括2.4公里跑步、仰臥起坐和伏地挺身。自2026年起，空軍人員每6個月測驗一次，每年實施一次3.2公里跑步測驗，且跑步成績佔總成績50%。2019年成立的太空軍沿用空軍標準，另有專屬的整體健康方法，包括持續性體能訓練、優化健康表現和身體素質建立。美國國防部長赫格塞斯率領超過三千人同時做1分鐘伏地挺身，打破金氏世界紀錄。（圖翻攝自@DOWResponseＸ）熱門賽事、球星動態不漏接    ,https://news.ltn.com.tw/news/world/breakingnews/5202036
日本再傳熊襲！秋田「親子3熊」闖入養老院、咬傷70歲老翁,國際,2025/10/06 14:04,"秋田縣鹿角市、美鄉町皆在今（6）日上午傳出，有3頭親子熊入侵住宅與攻擊人的通報。示意圖。（圖擷取自@livedoornews，社群平台「X」）日本近年頻傳各地有野生熊隻出沒、甚至傷人致死事件，秋田縣鹿角市、美鄉町皆在今（6）日上午傳出，有3頭親子熊入侵住宅與攻擊人的通報。根據當地警方指出，鹿角市一間養老院工作人員通報，有3頭熊入侵院內，被驅趕後往南方移動；美鄉町則是一名70多歲老翁在稻田作業時，被3頭熊圍攻受傷。綜合日媒報導，這2起案件事發地點雖不同，但都在今日一大早發生。今日上午7點前，一名住在美鄉町金澤東根字南外川原地區的70多歲老翁，在自家後方的稻田進行作業期間，突然3頭熊圍攻襲擊，所幸男子自行從熊口逃脫，事後親自打給向消防局通報此事，並表示自己「被熊咬傷左腳踝」，目前老翁已被警消送往大仙市內醫院治療。請繼續往下閱讀...無獨有偶，今日上午7點20分左右，位於鹿角市十和田錦木字下野添的一間養老院，一名工作人員有3頭熊闖入院內，1頭長約100公分、另外2頭約50公分，工作人員當下朝牠們大聲威嚇，促使3頭熊自行從院內離開，並往養老院的南方移動。由於2起通報皆表示出現「3頭熊」，警消與專業人士研判是成年母熊帶著幼熊外出覓食，擔憂牠們仍在案發地點附近活動，已緊急呼籲民眾提高警覺、務必隨身攜帶防熊鈴或噴霧，除了避免接近田野、山林等區域，也請民眾即時通報任何可疑熊蹤，警方等單位則增派人員巡邏，以防止再度發生攻擊事件。【速報】3頭のクマが… 秋田・美郷町でクマ被害 70代男性がけが（ABS秋田放送）#Yahooニュースhttps://t.co/79BtV4e5EQ 畜生、クマがジェットストリームアタック書けてきやがった。もうおしまいだ！— れいな@底なし沼の魔女 （@MegaBlackLabel） October 6, 2025 【速報】3頭のクマが… 秋田・美郷町でクマ被害 70代男性がけが（ABS秋田放送）#Yahooニュースhttps://t.co/79BtV4e5EQ 畜生、クマがジェットストリームアタック書けてきやがった。もうおしまいだ！""介護施設の敷地内にクマ3頭 親子グマか 施設職員の大声で移動 6日 秋田・鹿角市"" https://t.co/3IJLKfKQsO— 鈴蘭（Reiran） （@KoNaBReeZe7815） October 6, 2025 ""介護施設の敷地内にクマ3頭 親子グマか 施設職員の大声で移動 6日 秋田・鹿角市"" https://t.co/3IJLKfKQsO熱門賽事、球星動態不漏接    ",https://news.ltn.com.tw/news/world/breakingnews/5202028
日本千葉縣府驚見不明液體緊急疏散 結果是一袋水......,國際,2025/10/06 13:55,日本千葉縣政府大樓，因袋裝不明液體緊急疏散1樓。圖為千葉縣府。（圖擷自Google街景）虛驚一場！日本千葉縣政府大樓，今（6日）上午8時20分許在1樓大廳驚見裝有不明透明液體的袋子，旋即清空1樓並由消防員處理，最終發現袋子裡面的是水而已。據《產經新聞》報導，千葉縣府大樓位於千葉市中央區，在向千葉市消防局通報不明液體事件後，當局派遣特殊災害對應車等10台消防車輛前往，疏散並封鎖縣府1樓，避免無關人等進出。請繼續往下閱讀...在對袋內液體調查後，確認就只是一般的水，千葉縣府已於上午9時50分許解除封鎖。有縣府官員推測，可能是民眾在袋子裡面裝冰塊，讓需要保冷的物品維持低溫，事後忘了帶走。熱門賽事、球星動態不漏接    ,https://news.ltn.com.tw/news/world/breakingnews/5202055
台灣的借鏡！《路透》調查：中國砸錢養網軍、收買官員全面滲透,國際,2025/10/06 13:47,《路透》最新調查揭露，中國正對菲律賓發動一場全面性的「影響力作戰」（Influence campaign），手段包括資助網軍、收買在地協力者與創立媒體，旨在破壞美菲同盟，此舉被視為對台灣的重要警示。示意圖。（路透）根據《路透》6日一篇長篇深度調查報導，透過外洩的內部文件、前員工及官員的訪談揭露，中國正僱用一家位於馬尼拉的行銷公司，對菲律賓發動一場精心策劃的資訊戰，旨在削弱民眾對政府政策的支持，並分化菲律賓與其安全盟友美國的關係。這家名為InfinitUs的行銷公司，被指控操作一支由假社群帳號組成的「網軍」，在Facebook等平台上大量發表親中言論，同時貶抑西方疫苗、攻擊菲國的南海主權主張以及美菲同盟。請繼續往下閱讀...根據InfinitUs為中國使館製作的工作報告顯示，該公司將這些假帳號稱為一支「軍隊」，其任務是「引導公眾輿論」。除了網軍，InfinitUs還創立了一家看似在地經營的媒體《你好馬尼拉》（Ni Hao Manila），用以包裝親中內容，再由旗下假帳號進行分享擴散。調查更揭露，中國使館透過一個名為「菲中了解協會」（APCU）的組織，向數十名菲國知名人士頒發附有現金的獎項。該協會證實，獎金高達數千美元，是菲律賓平均月薪的好幾倍。獲獎者包括反對美軍進駐的地方官員、前總統杜特蒂女兒的重要幕僚，以及多位學者與作家。菲律賓前國家安全會議高階官員馬拉雅（Jonathan Malaya）表示，政府早已注意到有「第三方代理人」在呼應中國的論點。參議員托倫蒂諾（Francis Tolentino）則直言：「中國的最終目標，就是讓菲律賓變得順從。」報導總結，在北京持續對台灣進行文攻武嚇之際，其如何在與台灣同樣具有重要戰略位置的菲律賓，透過金錢、媒體與網路操作輿論、企圖瓦解其與美國同盟關係，對台灣無疑是重要的警示與借鏡。熱門賽事、球星動態不漏接    ,https://news.ltn.com.tw/news/world/breakingnews/5202009
