Title,News_Type,date,content,url
稱愛子公主不可能繼位、當天皇沒人會娶 日議員中曾根弘文道歉,國際,2026/06/30 15:47,日本自民黨參議員中曾根弘文，指稱德仁天皇獨女愛子公主（見圖）不可能繼位、她當天皇沒人會娶。（法新社）日本自民黨參議員、黨內憲法改正實現本部長中曾根弘文，28日指稱德仁天皇獨女愛子公主不可能繼位、她當天皇沒人會娶，旋即受到各界抨擊，中曾根29日對此道歉。綜合日媒報導，中曾根弘文28日在富山縣高岡市發表演說時談到皇室問題，他直指愛子公主不可能繼承天皇之位，而且若她當上天皇將找不到結婚對象，並且面臨必須要生下「兒子」的極大壓力。請繼續往下閱讀...中曾根弘文是前首相中曾根康弘之子，今年80歲，曾任外務大臣，目前擔任自民黨憲法改革實現本部長。在引發外界批評後，中曾根弘文29日為自己的失言致歉，他表示自己的意思是按照現行《皇室典範》和國會討論來看，天皇必須由男性來繼承，除非進行根本性的修改才能讓愛子公主繼位，至於自己用「不可能」一詞確實不太恰當。中曾根弘文說，愛子公主目前備受媒體和公眾關注，大家對她的期望很高，考慮到這種情況，他覺得愛子公主步入婚姻的殿堂可能會比較困難，這是他個人的想法，或者更確切地說是擔憂，所以就稍微提到一下，當然他是衷心希望愛子公主能夠幸福美滿。至於「生兒壓力」一事，中曾根弘文解釋之後若想讓愛子公主繼位天皇，那麼《皇室典範》相關規定可能要修改成「長子（在日文裡指第一個出生的孩子，不限男女）」繼承制，如此一來，愛子公主繼位後就會有一定要生下小孩的壓力，而自己28日確實失言說成「兒子」，應該要改成「小孩」才對。    ,https://news.ltn.com.tw/news/world/breakingnews/5488925
香港國安法實施6年  中國央視：共394人被補,國際,2026/06/30 15:15,香港國安法實施6年。（資料照）今天是港版國安法實施6週年。根據中國官媒央視新聞今天報導，從國安法實施到今年4月初，香港共有394人涉嫌危害國家安全被捕。前香港特首林鄭月娥在2019年推動修訂「逃犯條例」草案，引發反送中運動，香港官民關係高度緊張、衝突不斷。然而，港府與中國政府未向抗爭者讓步，反而推動實施港版國安法，箝制了香港的多元與有限民主。這也讓香港政治、社會等歷經主權移交以來最大轉折。請繼續往下閱讀...中國官媒央視新聞今天報導稱，從港版國安法實施至2026年4月初，香港共有394人涉嫌危害國家安全被捕，其中208人被檢控、180人被定罪。這篇報導特別提到，包含壹傳媒創辦人黎智英等認罪服法。報導宣稱，在港版國安法的引領下，香港不斷完善國家安全法律制度體系，多部法律相互銜接、相輔相成。報導又稱，2024年3月，香港完成基本法第23條立法，「維護國家安全條例」刊憲實施，細化香港國安法中的罪行定義，新增罪行具體罰則。2025年5月，兩部保障駐港國安公署有效履責的附屬法例刊憲生效。2026年3月，香港國安法第43條實施細則修訂生效。    ,https://news.ltn.com.tw/news/world/breakingnews/5488855
評「中國尊」飛機撞擊事件 BBC指背後有「三大疑點」,國際,2026/06/30 15:12,"北京最高地標中國尊大樓近日遭輕型飛機撞擊。（圖翻攝自X）北京超高層摩天大樓中信大廈「中國尊」，26日遭輕型運動飛機撞擊，造成1死13傷，引發世界關注。《BBC》報導指出背後有三大疑點成為這起事件的核心，包括：禁區、動機、飛行員。報導指出，北京城區上空是防範極嚴的「禁飛區」，這在中國每一本航空管制手冊中都是鐵律。民航界熟知的「北京大拐彎」，就是指從首都或大興機場起降的班機，都必須刻意在空中進行近90度轉向避開市區；且自2026年5月起，北京更收緊管控，全面禁止銷售、攜入無人機，甚至連風箏、孔明燈都在禁飛之列。請繼續往下閱讀...有媒體指，事發前北京塔台控制的離場、進近區域管制都在呼叫該飛機，無人應答後呼叫軍航直升機查看，但抵達之前已經發生事故。這架小飛機恰好命中了全球空域安全的公認難題「低慢小（低高度、慢速度、小型目標）」，傳統雷達極難捕捉。更引人關注的是，遭撞擊的「中國尊」距離中共政治中心中南海僅約6公里，能見度佳時甚至能肉眼眺望內部，離政治核心如此之近，卻在制度與技術上全鏈條失守，引發外界對中國空域管制制度的強烈質疑。針對機上唯一當場死亡的飛行員，中國官方通報中並未提及性別、年齡或姓名，但社交媒體上已瘋傳「劉俊華」這個名字。《金融時報》記者在事發當晚前往飛機起飛的東時雙悅飛行學校，直擊警方大舉搜查現場，並搜查了一輛黑色休旅車，而該車的註冊車主正名為劉俊華。巧合的是，中信集團旗下的中信銀行子公司中信理財，恰好也有一名高階女主管名叫劉俊華，且在事發次日，該公司微信公眾號罕見發布了一篇未附照片、僅具名劉俊華分享企業發展思路的文章。目前官方迄今未確認或否認飛行員身份，這輛車與涉案人的關聯仍是一團謎。航班追蹤平台 FlightRadar24 透露，該飛機當天的飛行軌跡非常「反常」，目前無法排除任何可能。港媒引述航空愛好者估計，飛行員可能擅自關閉了飛機電台，沿著高速公路目視飛行一路進入城區；前美國中情局（CIA）官員偉德寧教授更直白判斷，預計中國國家主席習近平會立刻「往最壞處想」，因擔心是暗殺行動而展開追責並嚴加掩蓋。不過，外界也有「純粹意外」的猜測。由於失事飛機為單發動機輕型飛機，一旦發動機在低空故障，或飛行員發生心臟驟停等「失能」狀況，飛機便可能維持原航向繼續飛行，而高達528公尺的中國尊正是該航線上最顯眼的障礙物。由於輕型機並無黑盒子，這場撞擊究竟是蓄意還是意外，已成了巨大懸念。    ",https://news.ltn.com.tw/news/world/breakingnews/5488524
法國熱浪奪千命 巴黎副市長：美國應扛起全球暖化重大責任,國際,2026/06/30 14:57,巴黎副市長普爾瓦爾近日主張，美國應為法國遭遇的致命熱浪負責。（法新社）法國遭嚴重熱浪侵襲，官方估計死亡人數至少達1000人。巴黎副市長普爾瓦爾（Audrey Pulvar）近日主張，美國應為致命熱浪負責。根據《福斯新聞》（Fox News）報導，普爾瓦爾26日在社群媒體上發文說「親愛的美國記者和社群媒體網紅們，這些天來你們中的一些人一直在批評和嘲笑巴黎，因為這座城市並非每個房間都有空調。我的天，這真是太諷刺了！作為世界第二大溫室氣體排放國，你們對全球暖化以及我們在法國正在經歷的後果負有重大責任。」請繼續往下閱讀...普爾瓦爾指出，美國的城市90%的房間都裝有空調，與法國現狀並非毫無關係。她聲稱，美國作為造成氣候變遷問題的主要責任國，不應該對那些正在努力為人民尋找解決方案的國家指手畫腳。普爾瓦爾強調，如果每個美國城市都能像巴黎和許多歐洲城市一樣努力進行生態轉型，整個世界都會變得更好。她最後說，美國應停止說教並開始行動。    ,https://news.ltn.com.tw/news/world/breakingnews/5488885
中國廣東4屁孩虐殺犬隻 官方籲不要網暴引眾怒,國際,2026/06/30 14:45,"中國廣東4名男孩虐殺犬隻，當局連要求各界不要傳播相關畫面、停止網暴引發眾怒。（圖擷自微博）令人髮指！中國廣東省揭陽市揭東區新亨鎮4名未滿14歲的男孩，近來以殘忍手段虐殺犬隻的影片在網路上瘋傳，當局連忙表示本案涉及未成年人，要求各界不要傳播相關畫面、停止網暴，引發中國網友震怒。從微博流傳的多篇文章可以看到，這4名男孩嘻笑著對母狗潑灑汽油後縱火，導致犬隻被痛苦燒死，並且拿著棍棒將幼犬活活打死，這段殘忍影片PO網後讓民眾憤怒不已，紛紛轉發4人的長相並肉搜姓名。請繼續往下閱讀...新亨鎮政府見狀連忙發布聲明，指稱當地已成立專案小組處理此事，除了要求家長落實監護責任之外，也將4人送往專門學校教育，並強調由於這些都是未成年人，希望網路上不要再散播影片照片。中國網友對於當局試圖摀嘴、禁止各界討論的行為怒不可遏，直喊「這4個根本不是值得被保護的未成年」、「請大家加強網暴力道」、「蠻夷之地」、「讓他們絕戶」，還有人認為「未成年」不應該成為惡魔的擋箭牌，「祖國的未來要交代到這幾個縱火犯的手上嗎？」    ",https://news.ltn.com.tw/news/world/breakingnews/5488837
自由觀點》德國受不了 快跟中國翻臉了,國際,2026/06/30 14:42,    ,https://news.ltn.com.tw/news/world/breakingnews/5488905
超諷刺！倫敦氣候論壇談抗極端高溫 因會場太熱被迫取消,國際,2026/06/30 14:19,歐洲近日遭熱浪侵襲。（法新社）歐洲近日遭熱浪侵襲，這段期間恰逢「倫敦氣候行動週」（London Climate Action Week，LCAW）舉行，結果一場原本聚焦討論應對「極端高溫影響」座談會，竟因會場溫度過高，對與會者恐有健康風險而宣布取消。綜合外媒報導，「倫敦氣候行動週」有一場聚焦討論應對極端高溫影響座談會，原訂在請繼續往下閱讀...倫敦政治經濟學院肖氏圖書館（Shaw Library）舉行，不過當天英國氣象局發布極端高溫紅色預警，預估氣溫將高達37度；由於這棟近百年歷史建築未設置空調系統，考量現場高溫恐對與會者健康造成風險，主辦單位宣布取消活動。主辦方蘇黎世氣候適應力聯盟的發言人表示，他們不能拿與會者的健康冒險。計畫出席這次座談會的氣候專家安德森（Chris Anderson）形容，這是令人印象深刻的諷刺案例，「一場原本要協助脆弱族群因應極端高溫的活動，竟然因為高溫本身而無法舉行。」安德森強調，這也凸顯全球暖化帶來的衝擊，將影響所有國家與族群，而非僅限於發展中國家。    ,https://news.ltn.com.tw/news/world/breakingnews/5488782
世足慘案！「神秘客」重金押注 24小時內狂賠1.3億,國際,2026/06/30 14:16,"日本逼和荷蘭。（路透）世界盃足球賽如火如荼進行中，不少球迷對賽事內容下注，幾家歡樂幾家愁。然而，知名預測市場平台 Polymarket 近日爆發「慘案」，一位名為「FlickRaw」的神祕投注人，竟在不到24小時內慘賠420萬美元（約新台幣1.34億元），在社群平台引發討論。綜合外媒報導，「FlickRaw」先重砸270萬美元（約新台幣8600萬元）在15日的荷蘭、日本戰，若荷蘭贏球，他將抱回583萬美元。眼見荷蘭勝券在握，豈料日本在88分鐘上演絕平，「FlickRaw」的投注金血本無歸。請繼續往下閱讀...不料，「FlickRaw」隔日立刻捲土重來，再下注150萬美元（約新台幣4780萬元）押注比利時戰勝埃及。若結果如他預料，他將抱回240萬美元（約新台幣7648萬元）。結果最後雙方以1比1平手。值得一提的是，除了「FlickRaw」，還有另外一位用戶「leeeroyjenkins」投入860萬美元押比利時獲勝。Polymarket 與傳統體育投注不同，會公開所有投注者的部位、損益，讓球迷能即時觀看市場預測，異常大的獲利與虧損都會即時呈現。    ",https://news.ltn.com.tw/news/world/breakingnews/5488810
泰航空姐運千萬毒品遭澳洲逮捕！ 網怒喊徹查：別讓監視器剛好壞掉,國際,2026/06/30 14:12,泰國國際航空，示意圖。（路透）泰國國際航空（Thai Airways）一名26歲的女性空服員，近日在執行飛行任務抵達澳洲墨爾本時，被海關當場查獲企圖走私高達1公斤、市值約50萬澳元（約新台幣1095萬元）的毒品海洛因。消息傳回泰國，大批網友痛批「國航之恥」，並強烈質疑機場安檢有漏洞，呼籲警方「別讓監視器剛好壞掉」！綜合外媒報導，這名26歲的泰航空姐於本月25日執飛TG465航班，從泰國曼谷飛抵澳洲墨爾本機場。然而，當她在過海關時，澳洲邊境執法局（ABF）官員在對她的隨身行李進行X光檢查時，赫然發現異常。海關隨後對她攜帶的12個托特包進行拆解，竟然在包包的夾層內襯中，搜出總重約1公斤的海洛因。請繼續往下閱讀...澳洲邊境執法局當場將其逮捕，並隨即對該名空姐提出兩項重罪指控，包括「為商業目的進口邊境管制毒品」及「為商業目的持有邊境管制毒品」。在26日的首次聽證會上，法院裁定不准保釋，將其持續羈押。案件預計於9月14日在墨爾本治安法院再次開庭審理。泰國國際航空隨後也在官方臉書發文證實，該名遭到拘留的女子確實為公司旗下空服員，目前泰航正與泰國及澳洲的相關司法機關密切協調，配合釐清事實與法律程序。泰航表示，平日都有定期向員工宣導必須遵守各國法律，對違規者絕不寬貸，目前了解本案純屬該名員工的「個人行為」，公司將全力配合澳洲當局的後續調查。這起重創國家形象的事件曝光後，大批泰國網友灌爆泰航聲明留言區，紛紛怒轟：「這可是我們引以為傲的國家航空公司，怎麼會發生這種事？這會影響整個國家、航空公司、機場的形象，還有之後要前往澳洲的泰國人的形象！」、「空服員每個月賺得已經不少了吧，還要貪什麼？」、「強烈建議登機前先由緝毒犬檢查機組員，直接從源頭滅火，保住公司形象！」更有網友提出質疑並喊話，「要不要從第一個流程開始查起？查清楚這名人員當天進入機場時，經過了哪些檢查程序、接觸了哪些工作人員，再配合監視器畫面一起調查。如果真的這樣查，就會知道整條走私線是誰。希望那天機場裡所有監視器不會『剛好同時壞掉』喔！」    ,https://news.ltn.com.tw/news/world/breakingnews/5488729
李在明震怒！女消防員被長官叫去陪酒24次輕生亡 17人遭停職,國際,2026/06/30 14:09,南韓光山消防署女消防員，15個月內被長官叫去陪酒24次後輕生離世，李在明震怒下令徹查後已有17人被停職。（圖擷自「SBS 뉴스」YT頻道）南韓光州廣域市消防安全本部轄下光山消防署29歲鄭姓女消防員，15個月內被長官叫去陪酒24次，於去年10月3日輕生離世，在家屬四處奔走下消息才得以傳開，總統李在明得知後震怒下令徹查，目前已有17人被勒令「待機發令（暫時停職）」。據《韓聯社》報導，女消防員被迫參加署內飲酒聚會並遭到灌酒，而且還要求她「坐在署長和科長之間」、「來坐科長旁邊」。在消防員走上絕路後，光山消防署還對希望得到真相的遺屬敷衍了事，指稱其在工作上沒有任何異常情況，甚至將責任推給死者未婚夫，謊稱是發生了感情問題。請繼續往下閱讀...南韓總統李在明得知此事後，震怒命令國務調整室展開追查，證實這些單位存在職場霸凌、強迫職員聚餐飲酒、無視死者家屬要求調查等行為。光州消防安全本部29日透露已有17人遭到停職，分別為本部6人、光山消防署9人、消防廳（南韓消防最高機構）2人，另有2人已經退休也會列入究責名單，未來將在收到國務調整室的調查結果後做出進一步懲處。    ,https://news.ltn.com.tw/news/world/breakingnews/5488768
無視川普！美伊代表團齊聚卡達 德黑蘭拒直接談判,國際,2026/06/30 14:08,華府表示，總統川普的特使魏科夫（右）、顧問兼女婿庫許納（左）將於本週前往卡達，參與高層會議。（法新社資料照）伊朗當局宣布將於30日派遣代表團前往卡達展開技術性會議，同時強調不會與美國進行直接談判；另一方面，華府表示，總統川普的特使魏科夫（Steve Witkoff）、顧問兼女婿庫許納（Jared Kushner）將於本週前往卡達，參與高層會議。法新社報導，美國、伊朗必須於8月中旬的期限前，簽署永久和平協議，其中包括針對伊朗極具爭議性的核子計畫達成共識。請繼續往下閱讀...在高層談判代表重返談判桌之前，雙方將先由較低層級外交官展開技術性會談。斡旋方正積極推動談判重啟，作為主要調停國之一，巴基斯坦、卡達已表示，相關會談將於30日恢復。白宮新聞秘書李威特（Karoline Leavitt）29日接受福斯新聞（Fox News）採訪時證實，魏科夫與庫許納正飛往卡達，將與伊方代表會面，而技術性談判也將在高層會議期間同步舉行。不過，伊朗官媒稍後引述外交部發言人巴格哈伊（Baghaei）表示，伊朗專家代表團將於本週前往卡達，但未安排與美方舉行任何會談。伊朗官媒報導指出，雙方仍有多項議題待討論，包括荷姆茲海峽（Strait of Hormuz）的相關安排、對伊朗制裁豁免，以及對伊朗高濃縮鈾庫存的處置方式。    ,https://news.ltn.com.tw/news/world/breakingnews/5488756
巨浪2度打落海！漁夫困太平洋8天靠生魚、雨水續命 台灣漁船伸援救起,國際,2026/06/30 14:03,阿皮烏塔（Junior Apiuta Apiuta）對紐西蘭國防軍揮手。（圖擷取自NZDF官網）一名來自南太平洋庫克群島的42歲漁夫阿皮烏塔（Junior Apiuta Apiuta），日前獨自出海捕魚時，不料小船引擎故障，在太平洋漂流長達8天，期間經歷狂風暴雨和刺骨低溫，甚至兩度被巨浪捲入海中，但他從未放棄希望。最終被紐西蘭空軍發現，並由附近一艘台灣漁船成功救起。英國《衛報》 報導，這場驚魂始於6月11日，當天阿皮烏塔在位於普卡普卡島（Pukapuka）的住家附近打完排球後，便出海捕魚。普卡普卡島介於紐西蘭與夏威夷之間。當天阿皮烏塔跟著盤旋在海面的海鳥出海，因為那代表附近有魚群，但不久，引擎停止運轉，那時他已經捕獲幾條魚，由於沒有工具修理，加上風勢越來越強，他一度猶豫要不要跳下海游回島上，「但我知道自己根本游不到。」於是他選擇留在船上。請繼續往下閱讀...隨著天黑，普卡普卡島的燈光漸漸消失在地平線。儘管第一個晚上平靜度過，然而接下來的幾天，是整趟漂流最煎熬的時刻，除了要對抗惡劣的天氣，還要應付不停襲來的巨浪，每當海浪灌進船內，他只能盡量壓低身體，努力保持船身平衡，避免自己被浪捲入海中，還要不斷把灌進船內的海水舀出去。期間，阿皮烏塔僅靠船上僅存的2瓶飲用水、1個水桶、釣具、1個保冷箱和1塊布苦撐。他持續釣魚，把捕獲的魚切成小塊生吃維生；下雨時，就用水桶收集雨水飲用，夜晚氣溫驟降，他利用布與保冷箱替自己擋風保暖。「到了晚上，我什麼都做不了，真的冷到發抖。」他曾兩度遭巨浪打落海中，他說：「巨浪比我的船還高，從兩側猛烈拍打過來……。」他不斷向上天祈求，希望能看到一艘漁船，或任何能救他的人，到了第3天晚上祈禱結束後，他真的看見遠方一道燈光，他拚命划船想靠近對方，但卻因風浪太強無法靠近。接下來幾天，阿皮烏塔只專注於3件事：節省飲水、保持體溫、想盡辦法讓船不要沉沒。所幸到了第8天，他聽見飛機引擎聲，紐西蘭空軍在空中盤旋，並引導附近漁船駛入該區域搜尋他，最終由台灣籍漁船發現並救起他。    ,https://news.ltn.com.tw/news/world/breakingnews/5488695
高市早苗7/1訪問印度 日印將共同開發AI軍用無人機,國際,2026/06/30 13:43,日本首相高市早苗預定7月1日訪問印度，這是她就任首相後首次訪印，也是她推動升級版「自由且開放的印度太平洋」（FOIP 2.0）構想的重要外交行程。（美聯社）日本首相高市早苗預定7月1日訪問印度，這是她就任首相後首次訪印，也是她推動升級版「自由且開放的印度太平洋」（FOIP 2.0）構想的重要外交行程。預定2日與印度總理莫迪舉行領袖會談，重點將聚焦安全保障、經濟安全及供應鏈合作3大領域。產經新聞今天引述多位消息人士的透露指出，日印政府已敲定方針，將推動共同開發搭載人工智慧（AI）的垂直起降（VTOL）軍用無人機，供基地警戒等用途使用。同時推動海上自衛隊護衛艦通信天線出口印度、雷達共同生產，以及日本企業衛星資料提供印度政府使用等合作，以深化兩國防衛裝備與情報合作，提升印太地區的嚇阻能力。請繼續往下閱讀...報導指出，日本將印度定位為實現FOIP的重要夥伴，近年來持續深化共同演訓及防衛裝備、技術合作。在經濟安全方面，兩國將針對重要礦物及半導體供應鏈達成合作共識。由於中國近期持續限制稀土及軍民兩用產品出口，日本正積極建立「去中國化」供應鏈，印度因擁有豐富礦產資源，被視為日本分散風險的重要夥伴。雙方也將討論強化稀土、半導體等關鍵產業供應鏈韌性。能源合作也是此次會談重點之一。雙方將推動建立壓縮天然氣（CNG）車用生質氣體合作機制，結合日本技術與印度市場，促進低碳能源發展。整體而言，高市此次訪印除了深化日印雙邊合作，更是日本在中國持續以稀土、軍民兩用產品等經濟手段施壓之際，加速建構印太安全與經濟合作網絡的重要一步，也是高市政府推動FOIP戰略、經濟安全與關鍵供應鏈重組的重要布局。    ,https://news.ltn.com.tw/news/world/breakingnews/5488791
被恐攻？伊朗革命衛隊遇襲2死2傷 槍手身分不明,國際,2026/06/30 13:32,伊朗伊斯蘭革命衛隊宣稱，該國29日發生槍擊事件，造成2名成員死亡。（歐新社資料照）伊朗伊斯蘭革命衛隊（IRGC）宣稱，該國29日發生一起槍擊事件，造成2名革命衛隊成員死亡。法新社引述伊朗官媒報導，該國西部克爾曼沙阿省（Kermanshah）29日晚間發生「恐怖攻擊」，造成2名革命衛隊成員死亡，另有2人受傷。請繼續往下閱讀...報導稱，槍手在革命衛隊成員住宅外開火，當局正展開調查，涉案人士身分尚待釐清。正值中東局勢混亂，伊朗當局宣布將於30日派遣代表團前往卡達展開技術性會議，同時強調不會與美國進行直接談判。另一方面，美國表示，特使魏科夫（Steve Witkoff）、總統川普的顧問兼女婿庫許納（Jared Kushner）將於本週前往卡達，參與高層會議。伊朗伊斯蘭革命衛隊被美國、沙烏地阿拉伯、巴林等國列為恐怖組織。    ,https://news.ltn.com.tw/news/world/breakingnews/5488758
