Title,News_Type,date,content,url
彰化彰南路驚悚車禍！麵店一家三口店門口遭撞 老闆父女送醫不治,社會,2026/05/23 11:26,彰化市彰南路3段麵店一家三口在店門口遭小貨車撞上受困，老闆父女失去呼吸心跳，送醫不治。（民眾提供）首次上稿 00:39更新時間 11:26（新增傷者不治、肇事駕駛說法）彰化市彰南路3段在22日晚間9時許傳出嚴重車禍，有3位民眾在自家麵店門口遭到小貨車碰撞並且受困，其中，80歲林姓男子與56歲林姓女兒都沒有呼吸心跳，送醫搶救後宣告不治；69歲妻子黃女意識清楚。48歲李姓駕駛供稱自己肇事原因是睡不飽、疲勞。警方表示，李男酒測值為零，毒品唾液快篩陽性。請繼續往下閱讀...彰化警分局說，林姓家族賣麵，當時已經在收攤，老闆夫妻與女兒站在門口，天外飛來橫禍，另外一名女兒在店內，逃過一劫。初步調查，雙方並不認識，肇禍司機自稱睡不飽才失控撞上，確切肇事原因仍待調查釐清。彰化縣第一消防大隊說，22日晚間9點48分接獲報案，派出消防車5輛、救護車3輛、消防人員16名趕往搶救，到場發現3人遭小貨車撞上，連同駕駛全都受困，消防人員協助脫困送醫。第一消防大隊指出，80歲林父、56歲女兒都失去呼吸心跳，送往彰基搶救宣告不治，69歲老闆娘黃女骨盆痛，意識清楚，送彰化秀傳醫院。48歲李姓貨車駕駛呼吸喘，意識清楚，送彰化秀傳醫院。消防人員到場救援。（民眾提供）    ,https://news.ltn.com.tw/news/society/breakingnews/5446532
「普發1萬」詐騙溯源追出天道盟成員  10嫌被逮送辦,社會,2026/05/23 11:23,警方發動多波搜索拘提，最終成功一舉擒獲潘嫌。（記者蔡清華翻攝）高雄市鳳山警分局去年接獲陳姓民眾報案，表示接獲自稱板橋郵局人員來電，謊稱有人持其證件欲領取「普發一萬元現金」，並佯稱已協助轉報新北市偵二隊偵辦。陳民誤信對方話術，配合所謂「監管財產調查」，陸續解除定存並交付金融卡、黃金金飾等財物，最終遭詐騙106萬元。鳳山分局獲報後立即成立專案小組，報請檢方指揮偵辦，經調閱交付款項及金融帳戶提領影像，鎖定21歲龔姓車手犯嫌，去年11月11日持拘票拘提到案。警方循線持續向上溯源追查，查出該詐騙集團係由天道盟正義會成員潘姓犯嫌（28歲）擔任首腦，並由柯姓犯嫌（26歲）負責收取贓款，再招募邱姓、彭姓及范姓等人擔任收水、控盤及指揮車手等工作，甚至以言語恐嚇及暴力手段控制內部成員。請繼續往下閱讀...警方自去年11月起歷經多次搜索、拘提及蒐證行動，今年1月29日及4月20日發動多波搜索拘提瓦解桃園詐團據點，最終成功一舉擒獲潘嫌及其餘共犯共10人，查扣手機、提款卡、存摺等證物。全案經向法院聲請羈押獲准後，依詐欺、洗錢防制法及組織犯罪條例等罪嫌，移送高雄地方檢察署偵辦。鳳山分局表示，警方將持續針對詐欺集團首腦、洗錢水房及車手全面清剿，守護民眾財產安全。同時提醒民眾，警方及司法機關不會以電話、LINE要求監管財產或交付金融卡、提款密碼，若接獲類似來電，務必提高警覺，切勿依指示操作或交付款項，可立即撥打165反詐騙專線查證，以避免受騙。警方逮捕詐團10嫌送法辦。（記者蔡清華翻攝）    ,https://news.ltn.com.tw/news/society/breakingnews/5446748
直擊驚險瞬間！玉山工作人員失溫、意識不清 黑鷹吊掛救援,社會,2026/05/23 11:22,空勤隊直升機於玉山成功吊掛救援。（空勤隊提供）南投縣信義鄉白洋金礦山屋塔塔加工作站一名男性委外的工作人員昨日出現失溫、肢體無力及意識不清，為爭取救援時效，申請空中救援。空勤隊今日上午派出黑鷹直升機飛至玉山，執行救援任務，將患者順利載運下山，送醫救治。空勤隊清泉崗駐地勤務第二大隊第三隊指出，今（23）日接獲任務，派遣黑鷹直升機起飛至玉山，由特搜隊員劉承閎實施吊籃操作，將患者吊掛上機，隨即起飛定向竹山消訓中心，落地後將傷患交由救護車轉送醫院救治，任務圓滿完成。    ,https://news.ltn.com.tw/news/society/breakingnews/5446753
高雄服飾店驚傳「攝狼」  盯上稚嫩少女偷拍裙底,社會,2026/05/23 11:18,丁姓男子偷拍少女裙底被逮，不賠錢要去坐牢。示意圖。（資料照）丁姓男子逛某知名連鎖服飾店，看到年僅14歲的少女容貌稚嫩，竟假裝蹲下挑選衣服，將手機鏡頭朝上，偷拍少女裙底隱私部位，法官認為丁男未與被害人達成和解，依違反兒少法判刑1年。判決指出，去年10月18日晚間，丁姓男子在三民區某知名連鎖服飾店內逛街，年僅14歲的國中少女正巧經過，丁男竟利用身形掩護先行蹲下，隨後伸手將手機塞入少女裙底，強行攝錄大腿及內褲等隱私影像。雖然少女不知自己被偷拍，但丁男行徑早就被店內機警的路人看在眼裡並報警處理。請繼續往下閱讀...高雄地方法院審理時，丁男坦承犯行，他的辯護律師主張，丁男犯後坦承犯行且配合調查，請求法官酌量減輕其刑並給予緩刑。但法官認為，丁男迄今未能與少女及其法定代理人達成和解或取得諒解，拒絕給他減刑或緩刑機會，依拍攝少年性影像罪判刑1年，可上訴。    ,https://news.ltn.com.tw/news/society/breakingnews/5446740
毒駕釀禍？彰化父女路邊聊天慘遭貨車撞死 肇事車內查獲喪屍煙彈,社會,2026/05/23 11:11,遭小貨車撞擊的火鍋店前一片狼藉。（記者湯世名攝）彰化市彰南路昨天（22日）晚間發生2死3傷車禍，1對林姓夫妻與女兒在路旁與開火鍋店的女婿聊天時，慘遭小貨車猛烈撞擊，造成林男與女兒慘死，黃姓妻子重傷搶救中，彰化警分局在小貨車內搜出毒品喪屍煙彈，李姓駕駛是否有毒駕已進一步抽血驗尿；火鍋店張姓老闆今天（23日）怒轟肇事的小貨車直接朝他們衝過來，他幸運閃過僅受輕傷，但岳父等人都被壓在車底，貨車裡面竟然被發現有毒品，實在太可惡。張姓火鍋店老闆說，他與妻子在彰南路開火鍋店10多年，住在附近的岳父、岳母與姊姊平常假日都會來找他們聊天，並且帶吃的來烹煮；昨晚該店要打烊，他與妻子送岳父一家三口到店外，正在聊天時，突然1輛小貨車直衝而來，他首當其衝被撞傷，但岳父一家三口被壓在小貨車底下，他忍住疼痛上前救人。請繼續往下閱讀...彰化警分局則指出，被壓在小貨車底下的80歲林姓老翁、69歲黃姓妻子與56歲女兒經搶救送醫，林翁與女兒傷重不治，黃姓妻子則在加護病房搶救中；小貨車內則起出數顆喪屍煙彈，李姓駕駛與同車友人都現場接受毒品快篩，李男驗出有毒品陽性反應，其友人則未驗出。開火鍋店的女婿首當其衝被小貨車衝撞，右腳受傷。（記者湯世名攝）彰化市彰南路重大車禍，消防員搶救傷患。（消防局提供）彰化市彰南路重大車禍，消防員搶救壓在車底的傷患。（消防局提供）    ,https://news.ltn.com.tw/news/society/breakingnews/5446741
養生館暗藏春色 文二警聯合北市府強制斷水電,社會,2026/05/23 11:11,台北市文山區一家以養生Spa為名義營業的養生館，因暗中提供半套性交易服務，遭警方接連查獲違規。（記者鄭景議翻攝）台北市文山區一家以養生SPA為名義營業的養生館，因暗中提供半套性交易服務，遭警方接連查獲違規。台北市政府依法裁罰並執行停止供水供電處分，於昨日完成斷水斷電作業。文山二分局表示，警方將持續與市府各局處合作強力查處，運用第三方警政策略，徹底掃除治安污染源。景美派出所先前接獲民眾檢舉，指出該家養生館涉嫌暗中經營性交易。警方加強蒐證與臨檢，並分別於去年6月26日及今年1月13日，當場查獲業者提供半套性交易等不法行為。警方除了將涉案人員依法移送裁罰，也函請台北市政府都市發展局，依都市計畫法裁處罰鍰，並勒令店家停止違規使用，進一步執行斷水斷電處分。請繼續往下閱讀...在市府跨局處協調下，昨日由台北市警察局、都市發展局、台灣電力公司及台北自來水事業處等單位，共同前往該店執行聯合斷水斷電作業，並由警方在現場負責維護安全。斷電與斷水程序均順利完成，防堵業者繼續違規營業。文山二分局呼籲，民眾出租房屋時應慎選承租對象，避免房屋淪為不法業者的營業場所，不僅影響社區治安，更可能損及自身權益。警方強調，對於任何影響治安及公共安全之場所，均會秉持零容忍立場，結合市府各局處力量強力查處，防止違法場所死灰復燃。台北市政府依法裁罰並執行停止供水供電處分，於昨日完成斷水斷電作業。（記者鄭景議翻攝）台北市政府依法裁罰並執行停止供水供電處分，於昨日完成斷水斷電作業。（記者鄭景議翻攝）    ,https://news.ltn.com.tw/news/society/breakingnews/5446736
越南女倒垃圾不慎碰到男子車輛 爆口角慘遭毆打毀損,社會,2026/05/23 10:52,范男（紅圈）毆打阮女被警方法辦。（記者洪定宏翻攝）41歲越南籍阮姓女子倒垃圾，不慎碰觸44歲范姓男子的汽車，竟慘遭范男毆打、毀損店面器具，高雄警方通知范男到案說明，依傷害、恐嚇、毀損罪嫌法辦。高雄警方指出，5月21日晚間7點多，范男將汽車停放在小港區孔鳳路的阮女店門口，阮女倒垃圾時不慎碰觸，雙方發生口角糾紛後衍生衝突，造成阮女頭部、胸部、膝蓋擦挫傷及店家物品毀損。請繼續往下閱讀...小港分局桂陽所員警獲報到場時，范男已開車離開現場，通知他到案說明，確認雙方無債務糾紛，依傷害、恐嚇、毀損罪嫌法辦范男。    ,https://news.ltn.com.tw/news/society/breakingnews/5446726
垃圾車撞倒機車 鏡頭君揪出司機！「1個月無法開車」原因曝,社會,2026/05/23 10:44,垃圾車撞倒機車後逕自離開。（民眾提供）台中市19歲王男近日將機車停放在南區路旁，隔天驚見車身多處受損，懷疑遭撞擊氣得報案，警方調閱大量監視器畫面後，揪出肇事的是一輛民間廢棄物清運車，雖曾下車扶起倒地機車，但駕駛未報警、也沒留下聯絡方式便直接離開，最終遭警方依法舉發，不僅挨罰，駕照還被吊扣1個月。王男21日晚間報案表示，前一天外出後，直到隔日下午才發現機車側邊、車殼與車牌附近都有明顯受損痕跡，仔細回想停車地點，懷疑是在工學北路停放期間遭其他車輛碰撞，由於事故發生已超過一天，增加調查難度，但第三分局交通分隊警員許朝翔仍逐一清查周邊監視器，終於找到事故關鍵畫面。請繼續往下閱讀...畫面顯示，當天中午一輛民間廢棄物清運車準備靠邊停車清運垃圾時，右後方車體不慎勾撞王男停放路旁機車倒地，隨車人員雖立刻下車查看扶正，但一行人完成清運作業後，卻直接駕車離開現場，警方隨即根據車牌通知53歲林姓駕駛到案，林供稱，當時確實有感覺車體碰撞異狀，立即請助手查看，而助手回報「看起來沒有明顯損壞」，他才誤以為情況不嚴重，繼續完成工作後離去，對造成車主困擾感到相當抱歉。警方表示，依道交條例第62條規定，汽車駕駛人發生事故後，即使無人受傷、車損看似輕微，也必須留在現場處理，否則可處1000元以上、3000元以下罰鍰，並吊扣駕照1至3個月，此次吊扣林男駕照1個月，也提醒民眾切勿心存僥倖，以免小擦撞演變成更大法律責任。    ,https://news.ltn.com.tw/news/society/breakingnews/5446714
竹縣警擴大取締酒駕毒駕 昨晚出動百人,社會,2026/05/23 10:41,新竹縣政府警察局本週起擴大執行「取締酒後駕車暨施用毒品後駕車」專案勤務。（新竹縣警察局提供）新竹縣政府警察局本週起擴大執行「取締酒後駕車暨施用毒品後駕車」專案勤務，昨晚動員上百名警力，在轄內重要路口及易肇事路段設置11處施檢組，合計查獲失竊車牌1面、舉發交通違規15件、改裝噪音車12件。警察局表示，為防制施用毒品後駕車危害交通安全，持續強化毒駕查緝作為，配合警政署修正「取締疑似施用毒品後駕車作業程序」及《刑事訴訟法》第101條之1修正條文，全面提升毒駕案件執法強度。請繼續往下閱讀...未來員警如發現駕駛人有施用毒品徵候，經毒品唾液快篩呈陽性反應或拒絕唾液檢測，員警依客觀情狀判斷已達「不能安全駕駛程度」，除依道路交通管理處罰條例舉發外，得依《刑事訴訟法》第88條規定，當場以現行犯或準現行犯逮捕，並建請檢察官向法院聲請「預防性羈押」，全力防堵毒駕上路。警察局自本週起擴大執行「取締酒後駕車暨施用毒品後駕車」專案勤務，勤務期間，針對形跡可疑、行駛不穩、精神恍惚或駕駛行為異常且有施用毒品徵候之駕駛人，立即實施「毒品唾液快篩試劑」檢測並製作案件測試觀察紀錄表；如查獲快篩呈陽性反應者，除依規定舉發外，並以現行犯逮捕移送地檢署偵辦，另建請檢察官向法院聲請羈押。警察局長林建隆表示，今年迄今該局已查獲68件毒駕案件，並依道路交通管理處罰條例第35條規定舉發，後續將依刑法違反公共危險罪移送偵辦。交通警察隊隊長魏才淋呼籲，施用毒品後駕車不僅嚴重影響駕駛人判斷力、反應能力及注意力，極易造成重大交通事故，危害自身及其他用路人生命安全。警方將持續結合巡邏、路檢及各項專案勤務，加強查緝毒駕行為。新竹縣政府警察局昨晚動員上百名警力，在轄內重要路口及易肇事路段設置11處施檢組。（新竹縣警察局提供）新竹縣政府警察局昨晚動員上百名警力，在轄內重要路口及易肇事路段設置11處施檢組。（新竹縣警察局提供）新竹縣政府警察局本週起擴大執行「取締酒後駕車暨施用毒品後駕車」專案勤務。（新竹縣警察局提供）    ,https://news.ltn.com.tw/news/society/breakingnews/5446713
討2萬債務 5煞闖民宅砍傷人搶走手機,社會,2026/05/23 10:38,警方前往犯嫌住處破門。（記者鄭景議翻攝）24歲王姓男子等5人因債務糾紛，涉嫌於今年4月間前往債務人位於台北市文山區興隆路3段的公寓暴力討債，不僅持刀砍傷對方膝蓋，還強行奪走對方的iPhone手機抵債。文山二分局警方接獲醫院通報展開追查，日前持搜索票及拘票，在雙北地區將王男等5嫌全數緝捕到案，起獲7支手機等證物，全案移送法辦。警方調查，被害男子於今年1月間為了要租房，向王男借款2萬多元周轉，事後因未能如期償還，王男便帶著4名友人，於今年4月間找上門。這群惡煞直接闖入被害人位於興隆路的租屋處，除了施以言語恐嚇、拳腳相向，甚至持刀砍傷被害人膝蓋。眾人隨後強行搶走被害人的iPhone手機，宣稱用以折抵債務，隨即逃離現場。請繼續往下閱讀...被害人因傷勢嚴重，隨後前往轄內醫院就醫。醫院發現刀傷可疑，依規定通報警方。景美派出所員警獲報趕抵醫院關切，但被害人因心生畏懼，起初面對詢問時避重就輕，含糊聲稱是在走路時不慎跌倒、被路邊鐵片劃傷。不過，員警發現傷口平整且深，顯非跌倒所致，研判背後另有隱情。專案小組隨即擴大調閱租屋處周邊監視器畫面，發現案發前後確實有王男等5名可疑男子進出大樓。在警方耐心關懷與勸說下，被害人終於放下心防，坦承遭到暴力討債與行搶。警方鎖定王男、23歲洪男、24歲廖男、24歲傅男及24歲彭男等5嫌身分後，報請台北地檢署檢察官指揮偵辦。專案小組日前見時機成熟，持法院核發的搜索票與拘票分頭出擊，順利將王男等5嫌全數拘提到案，並查扣犯案時穿著的衣物及7支手機等證物。王男等5人到案後對於案情避重就輕，互相推託。警訊後將王男等5人依涉嫌刑法殺人未遂、加重強盜、重傷害及妨害自由等罪嫌，移送台北地檢署偵辦。警方查扣犯案時穿著的衣物及7支手機等證物。（記者鄭景議翻攝）    ,https://news.ltn.com.tw/news/society/breakingnews/5446708
夜市攤商酷似「阿翰」拿榴槤追女顧客 高雄警方這樣認定,社會,2026/05/23 10:36,夜市攤商拿榴槤追女顧客。（記者洪定宏翻攝）5月22日晚間約8點半，長相酷似網紅「阿翰」的高雄林園夜市39歲葉姓攤商，拿榴槤追逐35歲朱姓女顧客，警方獲報到場調查，因葉男指控朱女破壞榴槤，但朱女否認，雙方發生爭執，員警認定是消費糾紛，通知夜市管委會協調。不過，朱女透過朋友在社群平台發文指出，她經過一攤賣榴槤的，看看後準備離開，「老闆一路尾隨我說我碰壞他的榴槤，要我買下來，我問那好，壞掉的在哪裡，我買下來！老闆又改口說不用我買，態度問題！」請繼續往下閱讀...朱女指控「這個賣榴槤的非常可怕，單純看到女生就好欺負，所以一路一直尾隨我，不讓我離開，我報警後，他以為我開玩笑，以為我沒有報警，所以很敢一直逼近我，我一直走他一直跟，就是要我買」。網友看到朱女被葉男追逐的自錄影片，留言說「還以為是阿翰在賣榴槤」、「賣榴槤的阿翰不要醬」、「直接報警就好，他敢碰到妳，直接提告性騷擾」。    ,https://news.ltn.com.tw/news/society/breakingnews/5446706
女子4案在身冒用護照想出境 移民官當場識破,社會,2026/05/23 10:32,冒用護照的吳女（右）與護照照片（左）經比對後，外貌特徵明顯不符，遭移民署國境事務大隊移民官識破並依法查處。（移民署提供）移民署國境事務大隊21日晚間查獲一名本國籍吳姓女子持他人護照辦理出境，因外貌與護照照片明顯不符，移民官立即攔下進一步查驗，後續查出她竟是遭司法機關發布毒品、詐欺、洗錢及違反個資法等4案通緝犯，訊後依違反入出國及移民法、護照條例及刑法等罪嫌，移送地檢署偵辦。國境事務大隊指出，當晚7時30分許，移民官於查驗時察覺吳女容貌特徵與護照照片有落差，因此依程序帶往複查。面對詢問，吳女始終堅稱自己就是護照本人，但對於家庭成員姓名及基本資料卻答非所問，頻頻以「太久沒聯絡」、「不知道」等理由搪塞，引起移民官高度警覺。後續她更表示律師未到場前不願配合調查，期間一度情緒激動並稱身體不適，移民署除安排留置調查，也通知駐場醫護到場協助，並提供輪椅使用。請繼續往下閱讀...移民署表示，移民官後續透過專業人臉辨識及查驗技巧持續比對查證，確認持照人與護照照片並非同一人。在移民官耐心勸導下，吳女最終坦承冒用他人護照，並供出真實身分，經進一步查詢後，確認其為遭發布4案通緝的對象。移民署表示，國境查驗仰賴第一線移民官專業經驗與判斷能力，本案即是主動察覺異狀、即時查證成功攔阻通緝犯闖關出境的案例。未來將持續精進國境查驗專業與辨識能力，守護國境安全，也呼籲民眾切勿心存僥倖，以身試法。    ,https://news.ltn.com.tw/news/society/breakingnews/5446696
可怕！無視機車停紅燈 砂石車硬闖追撞釀婦人受傷,社會,2026/05/23 10:23,砂石車闖紅燈追撞前方機車。（記者洪定宏翻攝）68歲張姓男子駕駛砂石車，無視前方58歲程姓女騎士已停紅燈，他硬闖紅燈追撞，更前行數十公尺才停止，所幸程婦僅擦挫傷，高雄警方對張男開出最高5400元罰單。高雄警方指出，5月21日下午1點多，張男沿仁武區澄觀路西向東行駛，至八德街路口時，違規闖紅燈擦撞已停等紅燈的程婦，雙方無酒駕，初步研判張男闖紅燈導致肇事，開出1800元至5400元罰單，詳細肇事原因仍待進一步釐清。請繼續往下閱讀...從路口監視器畫面可見，程婦騎機車看到紅燈已在路口停等區停止，但緊跟在後的砂石車隨即追撞，程婦應聲倒地，砂石車持續前行數十公尺才停止。    ,https://news.ltn.com.tw/news/society/breakingnews/5446685
台中8旬翁迷途「緊抱大盤帽」 意外串起跨世代警民情誼 ,社會,2026/05/23 10:16,陳翁緊抱一頂民防大盤帽。（民眾提供）台中市86歲陳姓老翁前晚外出散步卻迷途，幸好在里長、熱心店家與警方接力協助下，最後順利將陳翁平安護送返家，也讓焦急尋人的家屬放下心中大石，而陳翁一路緊抱不放的一頂「民防大盤帽」，更意外牽起一段跨世代警民情誼，讓這場迷途驚魂多了幾分溫暖。烏日分局龍井分駐所當晚接獲里長通報，有名高齡長者疑迷途需協助，所長王奕程趕赴只見86歲陳翁站在路旁神情無助，不斷望向四周，嘴裡反覆說著原本只是想去運動中心，卻突然對熟悉道路感到陌生，一時之間找不到回家方向。請繼續往下閱讀...由於陳翁無法清楚說出住址與個人資料，現場一度陷入僵局，所幸附近熱心店家認出他似乎住在某個方向，提供大概位置縮小範圍，考量天色昏暗，加上陳翁體力明顯下滑，王員決定先讓長輩坐上巡邏車，再慢慢陪著他尋找返家路。就在攙扶陳翁上車時，王員注意到，他始終把一頂老舊民防大盤帽牢牢抱在胸前，閒聊下，陳翁原本茫然眼神突然亮了起來，語氣帶著驕傲地說：「我以前是龍井分駐所的民防隊員啦！」短短一句話，讓現場氣氛瞬間變得溫暖。同樣身為龍井分駐所一員的王員聽聞後深受感動，對這位曾默默守護地方治安的老前輩肅然起敬，途中特地放慢車速，一邊陪著陳翁聊天，一邊引導他辨認沿途熟悉街景與巷口輪廓，終於憑著記憶指出返家方向，巡邏車抵達住處時，看護一見到陳翁立刻快步上前攙扶，家屬也頻頻向警方與熱心民眾致謝，畫下溫馨句點。警方以巡邏車將陳翁護送回家。（民眾提供）    ,https://news.ltn.com.tw/news/society/breakingnews/5446676
AI造假瘋傳建商總經理酒駕拒測被逮 公司急發聲明喊告揪黑手,社會,2026/05/23 10:11,不肖人士利用AI製圖，以偽造新聞網頁截圖指控高雄知名在地建商本業建設總經理陳前佐酒駕拒測。（記者黃佳琳翻攝）53歲陳姓建築業董座去年10月3度無照酒駕拒測被逮，挨罰54萬元拒繳差點害名下豪宅遭法拍，新聞曝光後，竟有不肖人士利用AI製圖，以偽造新聞網頁截圖指稱犯案者是高雄知名在地建商本業建設總經理陳前佐，陳急發聲明喊冤，並報案提告，追查虛假訊息來源，依法追究相關法律責任。本月21日，行政執行署高雄分署發布新聞，指陳姓建築業董座去年10月3度無照酒駕被逮，陳男拒測當場被查扣車輛及裁罰54萬元，但陳男擺爛拒繳，名下位於高美館的3千萬豪宅被行政執行署查扣，正要執行法拍程序時，陳男趕緊刷卡全額繳清罰款，保住自己的豪宅。請繼續往下閱讀...新聞曝光後，竟有不肖人士在利用AI製圖，以偽造新聞網頁截圖指稱犯案者是高雄知名在地建商本業建設總經理陳前佐，陳前佐得知此事後，趕緊透過公司發聲明，指該流傳截圖與文字內容完全不符合事實，內容是惡意編造、移花接木的虛假訊息，網路上惡意散布、截圖或傳播未經證實的不實言論，已嚴重侵害他的名譽，請網友不要再盲目轉傳、分享或散布該錯誤訊息，他已完成報案提告，將追查虛假訊息之來源，依法追究相關法律責任，絕不姑息。    ,https://news.ltn.com.tw/news/society/breakingnews/5446658
