Title,News_Type,date,content,url
宜蘭大同崙埤村長罷免投票  214票過門檻吳秉宗罷免通過,政治,2026/04/25 18:23,宜蘭大同崙埤村長吳秉宗罷免案，同意票數過罷免門檻。（圖取自內政部全球資訊網）宜蘭縣大同鄉崙埤村長吳秉宗被指控護航「東峻礦場開發案」，遭反對開發方連署罷免，同意票數至少要152票才能成立。宜蘭縣選舉委員會今天舉行罷免案投票，下午4點36分開票結束，同意票數214票，不同意120票，已超過罷免門檻。這也是宜蘭有史以來第2位遭罷免的村長。宜蘭大同崙埤村長吳秉宗罷免案今天投票，崙埤村選舉人數606人，共計338人投票，投票率55.78%。宜蘭縣選委會公告開票統計結果，同意票214張、不同意票120張、無效票4張。請繼續往下閱讀...依選罷法規定，罷免有效同意票數必須多於不同意票數，且同意票數須達原選舉區選舉人總數1/4以上，吳秉宗罷免案已通過罷免門檻，待縣選委會審查後公告停職；依規吳在4年內也禁選同選區、同公職，因此無法參與年底村長選舉。對於罷免案成立，吳秉宗未接電話，無法獲得回應。罷免案導火線起因於東峻礦場開發案，反對方認為，業者要在崙埤村傳統領域開採礦石，吳秉宗對反對聲浪視若無睹，以行政中立為名行護航之實，因此發動連署罷免。依地方制度法規定，吳秉宗罷免案成立，所遺任期不足2年不再補選，將由大同鄉公所派員代理至本屆任期屆滿為止。這也是繼2020年宜蘭員山鄉中華村長許正東遭罷免後，第2位被罷免通過的村長。    ,https://news.ltn.com.tw/news/politics/breakingnews/5415816
出席烏來運動會、蘆洲親子活動 蘇巧慧盼發揚烏來山林、泰雅文化,政治,2026/04/25 18:09,蘇巧慧今（25）日陸戰行程滿檔，先後出席烏來區全區運動會開幕典禮、蘆洲區體育會幼兒體能委員會親子路跑等活動。（蘇巧慧辦公室提供）民進黨立委、新北市長參選人蘇巧慧今（25）日陸戰行程滿檔，先後出席烏來區全區運動會開幕典禮、蘆洲區體育會幼兒體能委員會親子路跑等活動。蘇巧慧說，建設就是一棒接一棒，但要有新觀念、新想法，烏來對她來說不只是有溫泉產業，還有山林文化、泰雅族文化可以說給更多人聽，盼與族人一起讓烏來發光。蘇巧慧說，烏來美好的文化需要更多資源挹注、發揚，也有一些地方真的需要改變，從台北縣長蘇貞昌到現任新北市長侯友宜，都陸續在地方留下民眾可以利用的體育建設等，建設就是一棒接一棒，但要有新觀念、新想法，所以對她來說，烏來溫泉產業一定要調整法規，以便繼續運作，而烏來也並非只有溫泉產業，還有好山好水的山林文化、泰雅族文化可以說給孩子聽。請繼續往下閱讀...身為阿美族媳婦的蘇巧慧強調，族語傳承極其重要，文化要留住根、文化要長大，她對烏來有許多想做的事情，盼與族人一同努力推動烏來發展、發揚泰雅文化。    ,https://news.ltn.com.tw/news/politics/breakingnews/5415796
軍購僵局未解！趙少康籲藍營扭轉反美形象 徐巧芯：對美溝通暢通,政治,2026/04/25 18:06,國民黨立委徐巧芯。（資料照）立法院朝野對於國防特別條例草案的軍購金額仍無共識，下週一（27日）繼續協商，前中廣董事長趙少康提醒國民黨，扭轉反美印象刻不容緩。對於外界質疑國民黨反美，國民黨立委徐巧芯說，事實上，藍營的路線就是保持對中國與美國都能夠對話，與美國的部分，一直聯繫管道都很暢通。    ,https://news.ltn.com.tw/news/politics/breakingnews/5415800
張榮味低調赴中引關注！蘇治芬點名張嘉郡：要保密還是給全民說明？,政治,2026/04/25 17:59,前雲林縣立委蘇治芬。（資料照）前雲林縣長張榮味4月下旬經由金門前往中國，此行背景與實際目的引發各界關注。對此，前雲林縣立委蘇治芬表示，張榮味到中國，幫台灣人發了什麼聲？傳達了什麼訊息？她相信台灣人一定想知道，但張嘉郡要選雲林縣長，是否要保守秘密？還是可以給全國人民一個說明？蘇治芬在臉書發文表示，鄭麗文去中國刻意高調，令人生厭，而張榮味低調的去，在這個時間點，反而像隻悶哼的比特犬，令人又憂又懼。請繼續往下閱讀...她指出，張榮味4月下旬和顏清標在媒體前同框，隔天立刻經金門去中國，身為擁有4+1席立委（丁學忠、3席不分區韓國瑜院長、張嘉郡、許宇甄、1席民眾黨不分區蔡春綢），雲林縣長是他們家，全國農會總幹事是他們家，全國漁會總幹事是他們家，台北農產運銷是他們家，全國合作社場理事主席是他們家，「到中國是誰接待？談了什麼？我當然不知道，但可以確定，不會給他坐『中巴』！」蘇治芬說，張榮味到中國，幫台灣人發了什麼聲？傳達了什麼訊息？她相信台灣人一定想知道，因為以國民黨黨內本土派霸主之勢橫吃了「藍白紅」，是誰給了他力道⋯⋯老共就喜歡培植這種人。她認為，但張嘉郡要選雲林縣長，是否要保守秘密？還是可以給全國人民一個說明？「否則，為什麼我們要投給她？」    ,https://news.ltn.com.tw/news/politics/breakingnews/5415767
柯志恩邀盧秀燕南下助攻 賴瑞隆：歡迎來看高雄的蛻變,政治,2026/04/25 17:55,民進黨高雄市長參選人、立委賴瑞隆（左）歡迎台中市長盧秀燕來高雄看看高雄的蛻變。（記者許麗娟攝）母親節前夕女力當道，代表國民黨參選高雄市長的立委柯志恩，明（26）日將邀台中市長盧秀燕南下高雄助攻，民進黨高雄市黨部主委已確定由黃捷出任，年輕新女力也將為參選高雄市長的立委賴瑞隆拉抬選情，賴、柯兩人今天下午同台高雄市模範勞工表揚，皆表示各有選舉節奏，賴瑞隆也歡迎盧秀燕來看看高雄的蛻變。對手柯志恩邀盧秀燕來高雄幫助拉票，賴瑞隆表示，盧秀燕市長也是他過去在立法院的好同事，歡迎她來高雄看看高雄這幾年的蛻變和成長，每個縣市長參選人都有自己的節奏，會照著自己的節奏走，明天他辦了小港後援會成立大會，他會全力以赴，爭取高雄人的支持。請繼續往下閱讀...至於外界憂心賴瑞隆知名度不夠，立委黃捷當選民進黨高雄市黨部主委將可補足「空戰」。賴瑞隆表示，他過去10年在高市府服務，擔任過新聞局長，擔任立委也連續20次獲「公都盟」評選為優秀立委，也是民進黨中評會主委，在知名度上，經過初選相信高雄人對他也有所了解，知道他對高雄的願景，最近很多人對他刻意的醜化、分化和攻擊，這都是選舉過程的一部分，會照既定節奏，爭取年底最大的勝利。柯志恩則說，盧秀燕在台中的政績有目共睹，也是「媽媽市長」的角色，母親節前來高雄看看她，也與國民黨的議員交流、與高雄鄉親相見歡，可以從她身上學到很多治理城市的方式，未來包括蔣萬安、侯友宜都已答應來高雄讚聲。黃捷當選民進黨高雄市黨部主委，將與雙北市三都黨部準主委吳沛憶、蘇巧慧女力串連。柯志恩笑說，高雄要彰顯女力就是選一個女生市長，並指自己也將有年輕戰隊，會讓大家耳目一新。代表國民黨參選高雄市長的立委柯志恩指不只盧秀燕，包括蔣萬安、侯友宜也都答應來高雄助選。（記者許麗娟攝）    ,https://news.ltn.com.tw/news/politics/breakingnews/5415799
柯文哲嗆民眾「貪污證據拿出來」！黃帝穎秒列3大證據打臉,政治,2026/04/25 17:22,黃帝穎貼出北院判決書表示，至少有三大證據打臉柯文哲。（取自黃帝穎臉書）民眾黨創黨主席柯文哲今早陪同宜蘭縣長參選人陳琬惠至三星市場掃街拜票時，被一名乘坐電動代步車的長者喊「這貪污的那個」。柯文哲則忍不住回嗆，要他把證據拿出來。對此，律師黃帝穎指出，北院判決書至少三大證據打臉柯文哲。柯文哲與陳琬惠一行人，今早前進三星市場與攤商、採買民眾互動。陳琬惠見一名乘坐電動代步車長者後，熱絡上前問候，但民眾卻絲毫不領情，不僅表明不用問好，更將頭轉向柯文哲大罵「這就貪污那個」。柯文哲立刻回嗆：「貪污也要拿人的錢哪，你（證據）拿出來！」請繼續往下閱讀...對此，黃帝穎今日在臉書發文表示，北院判決書至少三大證據打臉柯文哲：第一，朱亞虎認罪行賄柯文哲，210萬元7人頭匯款與京華城案大事記佐證圖利過程；第二、柯文哲私吞謝國樑母親等捐民眾黨600萬元。基隆市長謝國樑與民眾黨元老邱佩琳都作證柯文哲拿了捐給民眾黨的錢；最扯的是第三點，柯文哲假藉肖像權名義侵占政治獻金。一筆金流進到柯文哲帳戶後，轉到柯文哲兒子帳戶去買股票。黃帝穎表示，台北地院完整審理北檢起訴柯文哲案453頁超過29萬字的判決書，也對柯文哲答辯進行回應，柯文哲犯罪證據都在判決書，但柯文哲今天竟嗆民眾「你證據拿出來」，擺明睜眼瞎話。他也諷刺：「柯文哲跟民眾要證據不如回家看判決書，有滿滿的證據。」    ,https://news.ltn.com.tw/news/politics/breakingnews/5415730
又跪中！呂禮詩登共艦稱「不會腿軟」 林智群批：被統成這樣還洋洋得意,政治,2026/04/25 17:10,前海軍艦長呂禮詩。（圖取自YT頻道）海軍退役少校、前艦長呂禮詩近年媚中言行不斷，近日赴中國登艦參觀接受中媒訪問 時再度「跪中」，呂禮詩說：「看到解放軍在進步，看到這些先進裝備，不會腿軟，而是感覺祖國強大了，就代表台灣更安全。」律師林智群臉書發文指中天11傻之一的呂禮詩，參觀了中國軍艦，中國媒體全程拍攝，竟然稱讚解放軍海軍已經準備好了？痛批敵我不分，被統戰成這樣還洋洋得意。軍方同袍也深感不齒。在社群具高人氣的海軍士官長黃振軒直接留言怒轟：「那麼丟臉的艦長，真替他感到可恥！」請繼續往下閱讀...社群也是一片罵聲。有網友說這是「海軍之恥」。還有網友說「舔功真是了得」。有網友甚至說舔共，媚共成這樣，毫無中華民國海軍軍人風格，應取消他終生俸。另有網友提到呂禮詩登共艦說：「看艙內整潔和文宣品，就知道解放軍準備好了。」也引起一串笑罵。網友虧說共軍打仗是靠「打掃衛生和大字報」、「連米袋都要捏線，美軍嚇哭了」、「美國大兵棉被都亂摺，却能精準的執行斬首。內務好看就是紙老虎，唯一的作用就是擺拍裝逼。」還有網友笑說：「呂艦長也準備好了」。根據中媒的報導，4月23日「人民海軍成立77周年紀念日‌」，多地同步舉行艦艇開放日活動。北部戰區海軍艦艇開放活動現場，台灣退役艦長呂禮詩參觀了烏魯木齊艦和濰坊艦。呂禮詩表示，看到解放軍在進步，看到這些先進裝備，不會腿軟，而是感覺祖國強大了，就代表台灣更安全。呂禮詩的親中言論早已不是第一次。去年他在珠海航展聲稱要讓台灣觀眾知道「我們中國有多強」時，陸委會副主委梁文傑 就曾表達遺憾與感嘆。梁當時語重心長地質問：「退役軍官發表這樣的言論，到底是不是對得起他們曾經帶領的部屬，以及目前日夜都在前線捍衛國家的國軍？」    ,https://news.ltn.com.tw/news/politics/breakingnews/5415744
民眾黨桃園提名一波三折 中壢、八德和龜山擬徵召,政治,2026/04/25 17:08,民眾黨桃園市議員提名一波三折。圖為去年9月黨主席黃國昌（中）主持市黨部啟用儀式。（記者謝武雄攝）2026九合一選舉，民眾黨在桃園市市議員提名一波三折，目前僅桃園區徐千晴、平鎮區吳正吉已經公告提名，至於中壢、八德和龜山3區皆有2人以上競爭，都有辦初選，考量3個選區都有爭議，最後黨內選舉決策委員會（選決會）決議將提名權收回，由中央徵召，目前選決會還在評估中。民眾黨副秘書長黃成峻表示，平鎮初選由吳正吉、前市黨部主委高宇彥對決，最後由吳正吉勝出，黨內也完成公告，對於高宇彥對外宣稱參選到底，目前黨部只能儘量勸說，但高宇彥若執意以無黨籍參選到底，黨部也只能祝福。請繼續往下閱讀...他也提到，龜山當初是黨代表曾姸潔、區主任高華宏2人要參選，後來曾姸潔未繳15萬元民調初選費，高華宏則是因為哥哥高華駿也要爭取國民黨提名參選，兄弟同時被提名，給外界觀感不好才未提名，由中央徵召。至於八德初選由江沛育、林晏良對決，雖然江沛育勝出，但被人檢舉干擾競選，因此，中央將八德提名權收回採徵召方式。黃成峻還提到，中壢為媒體人毛嘉慶、前社發部主任張清俊、中央委員林昭印三人相爭，由於相互攻訐議題已脫離問政，部分牽涉私德問題，考量即使勝出也已遍體鱗傷，因此改由中央徵召。黃成峻表示，八德、龜山和中壢，將由選決會尋覓適合人選，不排除空降可能，也不排除放棄提名。    ,https://news.ltn.com.tw/news/politics/breakingnews/5415755
佈局黃捷當高市黨主委吸年輕票 陳其邁：市長議員都要全壘打,政治,2026/04/25 16:59,高雄市長陳其邁指出，高市黨部主委最重要的工作就是要輔選市長跟議員都能夠全壘打，也相信黃捷可以勝任。（記者許麗娟攝）民進黨下屆高雄市黨部主委同額參選，確定由立委黃捷當選，資深媒體人周玉蔻認為高雄市長陳其邁此佈局，是希望以黃捷空戰的優勢條件，帶動高雄市長參選人賴瑞隆的選情，吸引年輕選票。陳其邁今（25）日出席模範勞工表揚大會前受訪表示，主委最重要的工作就是要輔選市長、議員都能夠全壘打，也相信黃捷可以勝任。陳其邁表示，主委的責任非常重，黃捷過去不管是在她的選區或之前的鳳山，以及各項議題的表現，都非常受到年輕人的歡迎，相信由她來擔任主委的工作，一定可以勝任。請繼續往下閱讀...陳其邁強調，選舉也不能鬆懈，也期待高雄市黨部主委可以整合民進黨基層力量，擴張支持的基礎，能夠幫助賴瑞隆當選市長，各區議員選舉也都能交出漂亮的成績單。    ,https://news.ltn.com.tw/news/politics/breakingnews/5415749
沈伯洋「短捲髮」造型曝光！管碧玲大讚：像小泉進次郎,政治,2026/04/25 16:50,管碧玲大讚，沈伯洋的新髮型很像日本防衛大臣小泉進次郎。（記者方賓照攝、法新社/本報合成）民進黨立委沈伯洋出征台北市長的呼聲越來越高，他今天和台北市長蔣萬安、副總統蕭美琴一同出席松山慈惠堂的活動，以一頭帥氣的短捲髮現身，新髮型也讓海委會主委管碧玲大讚，「這造型梳直一點就跟日本防衛大臣小泉進次郎一模一樣，我感覺還不錯！」沈伯洋揮別以往的「爆炸頭」，將頭髮一口氣剪到耳上，以一頭帥氣的「小捲髮」現身，他受訪時說，他前幾個禮拜有把頭髮修短，但沒想到頭髮長那麼快，所以又趕快再把它修短了一次。請繼續往下閱讀...對此，管碧玲在臉書發文表示，沈伯洋的新髮型相當不錯，她稱，沈伯洋是非常柔軟溫暖的人，也是讓女兒深愛的爸爸，新髮型和個性更「適配」。她大讚，這造型梳直一點就跟日本防衛大臣小泉進次郎一模一樣，捲捲的就年輕時尚一些，「我感覺還不錯！」貼文曝光後，網友紛紛表示，「Puma是人才總是能閃閃發光，聽他說話就知道是有料的人」、「變得更清爽又有精神」、「超級帥，一定能打敗萬安」、「帥氣溫暖的Puma，氣勢越來越強」、「學識能力好且多才多藝，不可多得的好人才」。    ,https://news.ltn.com.tw/news/politics/breakingnews/5415712
遭詐團盜「戰鬥陀螺照」行騙  陳聖文怒喊：陀螺戰士會讓你付出代價,政治,2026/04/25 16:44,民進黨台北市議員參選人陳聖文愛玩戰鬥陀螺，並在社群分享。（陳聖文提供）懷舊玩具「戰鬥陀螺」近期又掀起旋風，民進黨台北市議員參選人陳聖文日前也透露自己最近成為「陀螺戰士」，沒想到，今天就有詐騙帳戶使用陳聖文照片，謊稱可以免費送陀螺，陳聖文已報案，更揚言「一定會讓你付出代價」。陳聖文昨（24日）在threads上發文說，身為市議員候選人，就是要親民。有些小朋友會來他服務處，他有空就陪小朋友們玩戰鬥陀螺，玩著玩著自己也越買越多，他的陀螺組合真的很強，「強到把超多小朋友打到不來我服務處了」。他更透露之後也想辦比賽，邀民眾共襄盛舉。請繼續往下閱讀...未料，今就有一名自稱是陳聖文助理的帳號，貼出陳聖文坐擁上千顆陀螺的AI變造照片，並說要提供免費索取，每人限領一顆，條件是要關注帳號、轉發貼文。陳聖文也立刻在社群平台發文澄清：「所有陀螺戰士們大家好，我是陳聖文。這是詐騙！非常明顯、非常可惡的詐騙！請大家一起幫忙檢舉，我也會立刻到派出所報案！這種專門欺騙善良老百姓的詐騙集團，我一定追到底，讓他付出代價。」網路出現陳聖文AI變造照片，謊稱要免費送陀螺。（取自threads）    ,https://news.ltn.com.tw/news/politics/breakingnews/5415677
馬文君下週排案邀顧立雄報告國防創新 王定宇：「無人大軍」只欠預算,政治,2026/04/25 16:28,民進黨立委王定宇。（王定宇辦公室提供）立法院外交及國防委員會由國民黨籍召委馬文君排案，下週一（27日）將邀請國防部長顧立雄針對「國防部創新小組（DIO）將新興科技應用於不對稱作戰之效能分析與未來發展」進行專案報告。民進黨立委王定宇今（25）日對此表示，台灣正仿效美國成立國防創新小組，整合民間與美國實戰技術能量，朝向AI、無人載具及「四足機器人」等方向邁進，目前部隊編制已在更新，「萬事具備只欠預算」，呼籲立院支持國防特別預算，勿延誤國家整體戰力提升。王定宇今天向媒體說，從2020年納卡衝突到近年的烏俄戰爭、加薩衝突及美伊軍事衝突，無人機與AI運算已深刻改變戰爭的本質。台灣國防部雖起步較慢，但在不對稱戰力、無人體系及AI導入上正大步邁進。他透露，目前國軍正建構涵蓋水面、水下、地面及空中的無人體系，包括機動性高、能適應各種地形的「四足機器人」（機器狗）等。請繼續往下閱讀...王定宇強調，AI的導入是重中之重，透過AI強化自主指管決策系統，能協助無人載具在面對敵人干擾或GPS被截斷時，仍具備自主判斷、決策與攻擊擊殺的能力。針對顧立雄將提出的報告內容，王定宇說明，台灣仿效美國成立的國防創新小組（DIO）正進行兩個關鍵整合：一是將中科院與台灣民間龐大的技術能量結合；二是將美國具備實戰經驗與尖端科技的能量與台灣對接，這兩大整合正是台灣快速建立「無人大軍」的關鍵力量。王定宇提到，目前國軍編制正在大幅更新，例如陸軍砲兵單位已從傳統火力單位轉化為無人機單位，無人機大隊、無人機指揮部也陸續建立。他強調，思維與部隊建構完成後，接下來裝備與訓練必須跟上。然而，王定宇也直言，目前「萬事具備只欠東風」，此東風就是最重要的預算支持。他憂心表示，若立法院在國防特別預算端砍掉國內產業投入不對稱戰力的研發預算，或導致預算延宕、將特別預算中的產製經費挪後，將會造成部隊轉換後「有單位卻無裝備」的窘境。王定宇呼籲，無人載具迭代更新極快，需要充足的預算支應研發與裝備交付，這攸關國家存續及民主自由的發展。希望立法院能不分黨派支持國防安全預算，讓台灣人民在安全的基礎上發展經濟與民主。    ,https://news.ltn.com.tw/news/politics/breakingnews/5415716
擋不住台灣！總統指派林佳龍擔任特使 抵達友邦史瓦帝尼參加史王慶典,政治,2026/04/25 16:20,總統賴清德指派外交部長林佳龍擔任特使，25日凌晨抵達友邦史瓦帝尼。（外交部提供）總統賴清德原訂22日起出訪友邦史瓦帝尼，但因中國介入非洲國家臨時取消飛越許可而暫緩。外交部今（25）日證實，賴總統指派外交部長林佳龍擔任特使，於當地時間25日凌晨抵達史瓦帝尼，由史國外交部長戴柏莉（Pholile Shakantu）、商工貿易部長庫馬羅（Manqoba Khumalo）接機，將代表我國參與史國國王恩史瓦帝三世登基40週年暨史王58歲華誕慶典。外交部今天證實，林佳龍已於25日凌晨抵達史瓦帝尼，由史國外交長戴柏莉等官員親自接機。史瓦帝尼政府臉書專頁也發文表示，中華民國台灣外交部長林佳龍今天凌晨抵達恩史瓦帝三世國際機場。史方並指出，林佳龍此次到訪是為了慶祝國王登基40週年暨史王58歲生日，在機場受到戴柏莉與庫馬羅的溫暖接待。請繼續往下閱讀...根據外交部提供的影像，當地台灣僑胞夾道熱烈歡迎林佳龍蒞臨，手舉「歡迎林特使蒞訪史瓦帝尼王國」布條，並由2名台灣囡仔上前獻花。總統賴清德指派外交部長林佳龍擔任特使，25日凌晨抵達友邦史瓦帝尼。（外交部提供）    ,https://news.ltn.com.tw/news/politics/breakingnews/5415698
讚沈伯洋選北市一時之選 陳嘉行：每天在地獄和共匪戰鬥,政治,2026/04/25 16:20,民進黨立委沈伯洋。（資料照）民進黨籍立委沈伯洋參選台北市長呼聲高，民進黨台北市黨部執行長陳嘉行今（25）日發文讚，拚論述、論戰力與執行力，派出一位每天在地獄中跟妖魔鬼怪共匪戰鬥的人，沈伯洋絕對是一時之選。陳嘉行今在臉書發文說，台北市長候選人難產，按程序登記的不被考慮，聲量最高的不能選，不想選的被逼著選，幾經周折，當然只有不怕死又較無派系分歧的沈伯洋出戰。他說，四年前陳時中參選，當時是英系主要統籌，決策小組的組成則是各派系領袖，沈伯洋的派系要派誰出來操盤？目前檯面上當官的應該都不可能，那就是跨派系操盤。他強調「派系操盤」是因為民進黨的本質就是「派系共治」，沒先確認這部分，就會誤以為選舉是沈伯洋一個人的責任，而不是民進黨。請繼續往下閱讀...陳嘉行說，行政院副院長鄭麗君不想選，讓不少支持者惋惜，其實某方面這只是一種得不到才是最好的心態；民調上則是立委王世堅最高，但選舉時常不是派當下民調最高的出來，所以不用糾結在此，鄭麗君跟王世堅都因不同因素，而不可能選。所以，那些人說沈伯洋的問題，在客觀上不是問題；但當沒看到，團隊沒有想辦法改善、轉移、遮掩、轉化，才會成為「問題」。至於沈伯洋的負面聲量，陳嘉行說，只有沒聲量的人才會這樣說，藝人蔡依林曾說：「謝謝那些曾經不看好我的人，謝謝你們給我很大的打擊，讓我一直很努力。」這個就是某些人最愛講的「負面聲量」，但蔡依林仍是蔡依林。在社群媒體的時代，有人喜歡你，就一定有人恨你，只要喜歡你的人多於討厭的，後者講什麼、做什麼傷害你的事，都不足為懼，也不重要，貼沈伯洋「負面聲量」標籤，跟誣指陳時中是一樣的，這種言論實則夾著羨慕嫉妒恨的餡料而已。他也說，這次地方選局無關總統佈局，相對單純，陳時中選台北市長時，因為牽動前總統蔡英文接班人選，各派系動得很凶，這次無關總統人選，所以有些人意興闌珊，這是好事。此外，北市藍綠的基本盤固定，也是不令人意外的事實。台北市議員選得好不好？就看母雞有沒有辦法讓被提名的議員全上；但即便全上，席次還是一樣，基本盤看起來沒有變。所以，要追蹤的反而是「各區的得票數」才知道真正的輸贏成敗在哪。陳嘉行總結說，台北市長候選人，民進黨當然必須派出德行能代表民進黨核心價值跟精神的人。況且，要拚論述、論戰力和執行力，派出一位每天在地獄中跟妖魔鬼怪共匪戰鬥的人，「沈伯洋，絕對是一時之選」！    ,https://news.ltn.com.tw/news/politics/breakingnews/5415711
