Title,News_Type,date,content,url
彰化警分局防搶演練 追逐逮捕驚險刺激,社會,2026/01/29 15:50,彰化警方實施防搶演練，假扮歹徒的員警持槍闖入銀行，過程逼真。（警方提供）年關將近，各縣市警局金融機構防搶演練找梗想破頭！彰化警分局昨天（28日）在彰化商業銀行彰化分行辦理「金融機構防搶暨攔截圍捕演練」，從歹徒行搶、警方獲報後警匪追逐到逮捕搶匪一氣呵成，堪稱緊張刺激，圍觀民眾盛讚是難得一見的高水準防搶演練。演練一開始，兩名員警打扮成頭戴鴨舌帽的「歹徒」，模擬持槍進入銀行後立即對空鳴槍高喊「搶劫！」還喝令銀行員工不准亂動，歹徒得手後正欲離去，恰巧遭遇正在金融機構周邊巡邏的員警察覺異狀，員警立即上前喝止，歹徒見狀心虛，隨即徒步逃竄並鑽入附近小巷企圖躲避追緝。請繼續往下閱讀...警方除現場鑑識，還派出大批員警攔截圍捕。由於員警平時對轄區巷弄地形及周邊路況相當熟悉，支援警力迅速依通報資訊展開攔截圍捕，形成包圍網，最終在小巷內攔到「歹徒」，警方以優勢警力荷槍實彈喝令「歹徒」趴下，當場制伏歹徒。彰化警分局長劉千祥指出，年關近，民眾如欲運用大量現金，請儘量由親友、同事陪同提領，亦可隨時向當地警察機關申請警力護鈔以策安全。「歹徒」持槍闖入銀行行搶，被警方制伏。（警方提供）「歹徒」持槍搶銀行後逃跑，被警方包圍制伏。（警方提供）    ,https://news.ltn.com.tw/news/society/breakingnews/5326216
社群美女裸露廣告誘點擊  誆「先儲值可退回」是騙你加碼,社會,2026/01/29 15:40,民眾點擊廣告後，被引導加入通訊軟體對談。（記者劉慶侯翻攝）台北市警察局今日公布114年12月打詐成效，當月份北市查獲詐騙集團119團1054人，查扣不法所得7274萬餘元；另在警銀聯防與第一線即時關懷下，成功攔阻詐騙金額達2億1884萬餘元。不過，警方發現，詐騙集團現新增以美女裸露廣告方式進行投資詐騙卻有增加趨勢，且主要受害族群集中於30至49歲青壯年及中年族群，值得注意和警覺。台北市刑大大隊長丁靖表示，依「打詐儀錶板」統計，北市114年12月受理詐欺案1524件，財損共8億5905萬餘元，整體趨勢呈收斂，惟詐騙手法仍以「假投資」造成財損最高。詐團常潛伏於社群網站、交友軟體或通訊平台，投放大量廣告，誘騙民眾加入所謂「投資群組」，再以長期關懷、噓寒問暖建立信任，並透過偽造獲利截圖、成員配合演出等方式，營造「穩賺不賠」假象，誘使民眾持續投入資金。請繼續往下閱讀...警方近期另發現，詐騙集團在社群網站投放裸露、挑逗等色情廣告作為導流，鎖定民眾好奇心與私密心理，將既有「假交友」手法包裝升級：由過去常見的「購買遊戲點數換見面」，轉為架設仿真交友會員網站，主打「智慧媒合、快速配對」等話術，誘導民眾「加入會員、儲值升等」，並聲稱「可退回」以降低戒心。警方表示，114年12月相關案件共受理35件、財損達2415萬8698元，進一步分析被害人年齡分布，40至49歲共11件（31.4%）較多，其次為30至39歲共8件（22.9%），顯示主要受害族群集中於30至49歲青壯年及中年族群；其中單一財損最高為952萬1500元，顯示詐團透過「會員制平台」話術，短時間內即可造成重大財損。警方說明，民眾一旦被裸露圖片吸引點擊，後續多轉由通訊軟體一對一接觸，再引導進入所謂交友平台，要求被害人「登記會員並儲值」。常見說法包括「儲值可提高會員等級以利配對」、「儲值後可退回」、「完成帳號開通即可安排見面／約會服務」等，進一步催促匯款。詐團甚至會在初期以小額「加計收益後返還」製造可信假象，誘使被害人持續加碼儲值；待被害人要求退款或發現無法取回款項時，才驚覺受騙。北市警局長林炎田表示，打擊詐欺犯罪為警方重點工作，將持續強化宣導、防制、打擊三項作為：更新識詐宣導重點、深化機關與業者協作阻斷金流、強力追緝涉案集團，全面壓制詐團犯罪空間，讓詐欺集團「騙不了、領不到、跑不掉」。假網站「智慧媒合」詐騙手法。（記者劉慶侯翻攝）    ,https://news.ltn.com.tw/news/society/breakingnews/5326210
女法官霸凌女書記官  自家法官判賠10萬元,社會,2026/01/29 15:39,高雄地院某女法官被控職場霸凌女書記官，自家法官判女法官應賠10萬元。（記者黃佳琳攝）高雄地方法院某女法官被女書記官投訴職場霸凌，高雄地院調查後認定構成霸凌行為，女書記官根據調查報告提出刑、民事告訴，刑事部分尚未偵結，但民事部分已做出判決，雄院法官判女法官應賠10萬元。據了解，女法官和女書記官都是個性比較敏感的人，兩人在工作上的表現都很優秀，但就是個性相處不來，女書記官前年調來高雄地院服務後，被分派到女法官底下工作，兩人因工作上數次發生摩擦，導致一直覺得受到來自上級的壓迫，因此前年11月蒐集相關事證後，向院內提出職場霸凌申訴。請繼續往下閱讀...高雄地院成立調查小組，發現女法官確實在言論上有不妥之處，因此做出霸凌成立的結論，並依規定將女法官送司法院完成懲戒；女書記官則拿著霸凌成立的調查報告，向女法官提出妨害名譽的刑事告訴及民事侵權告訴。刑事部分，目前仍由高雄地檢署偵查中，民事部分，高雄地院法官根據自家調查報告，認定女法官在職場上以「枝微末節之事」對女書記官做出霸凌行為，依雙方身份、地位及經濟能力、加害程度等，判女法官應賠10萬元，可上訴。    ,https://news.ltn.com.tw/news/society/breakingnews/5326281
被控參與詐團掩護還洩密 台南女律師一審無罪,社會,2026/01/29 15:37,何姓女律師被控涉參與詐團掩護洩密，去年檢方起訴求刑8年。但台南地院於29日下午以罪證不足判何女無罪。（資料照，記者王俊忠攝）台南地檢署偵辦何姓女律師涉入詐團案，查出該詐團由莫姓、王姓男子主導，透過網路社群直播，誘使被害人誤信投資寶石能獲利、紛紛付款，事後鑑定那寶石只是「石英染色或灌膠製品」，何女被控幫詐團收款、辯護，還將成員偵查秘密洩漏給莫男，去年9月檢方起訴何女並求刑8年、併科罰金500萬元。今天下午，台南地院以罪證不足、判何女無罪；莫男應執行8年徒刑。去年南檢依組織犯罪防制條例、刑法詐欺取財、洗錢防制法及刑法洩密等罪嫌，起訴何女等5名被告，除了何女被具體求刑；莫男也被求刑16年、併科1000萬罰金；王男求刑6年、併科100萬罰金。請繼續往下閱讀...檢方起訴指出，何姓女律師於2024年8月間起參與莫男、王男指揮的假買賣、假投資詐欺集團，該詐團透過臉書、抖音等網路社群媒體直播，以買賣或投資翡翠、玉石等原石或成品可以獲利，使被害人陷於錯誤而匯款或面交數萬元至數百萬元金錢，事後再以各種理由搪塞並斷絕聯繫，藉以獲取暴利。後來有被害人將購得的寶石送鑑定，發現並非寶石真品，而是石英染色或灌膠等情事才知受騙。受詐騙被害人至少10餘人，詐騙金額逾860萬元台幣（檢方仍持續追查共犯與被害人）。檢方調查，何女擔任此詐團法律顧問，會致電被害人表明律師身分與誆稱寶石的真實性，且曾於2024年10月9日在其經營的法律事務所向被害人收取101萬元現金後，交給莫男指定的詐欺集團成員，何女拿到面交款的1萬元酬勞。此詐團成員被警方查獲時均委任何女為辯護人，何女會將詐團成員所做供述及掌握到檢警偵辦方向及內容回報給莫男。南檢檢察官於2025年1月13日拘提王男到案，何女擔任王男的辯護人、知悉王男指證莫男為集團成員的偵查秘密，竟隨即洩漏此偵查秘密給莫男。    ,https://news.ltn.com.tw/news/society/breakingnews/5326205
防搶演練後2天真歹徒上門 假警察闖銀樓持榔頭重擊老闆娘,社會,2026/01/29 15:34,歹徒身穿警察雨衣進入銀樓。（記者鄭淑婷翻攝）桃園市桃園區中正路1間銀樓，今（29）日中午遭身穿警察雨衣的歹徒闖入疑似行搶，歹徒持塑膠榔頭狂敲老闆娘後逃逸，老闆娘不斷抱頭大喊救命，忍痛按下警鈴報案，歹徒隨即騎機車逃逸，作案用榔頭也掉落在現場，並未搶走銀樓任何財物，警方隨後在附近公園尋獲作案機車，正擴大調閱監視器畫面尋人，該間銀樓2天前才與桃園警分局舉辦春節防搶演練，沒想到2天後遭真的歹徒闖入，被打傷的老闆娘當時也有參與演練，因頭部受傷、手指骨折送醫急救中。該名歹徒身穿警察雨衣、頭戴安全帽及口罩、手套進入銀樓，先是向老闆娘詢問「最近有沒有什麼可疑的人」、「連線都還OK嗎」，老闆娘以為他是警察，回說「沒有、都還可以」，沒想到還在回話時，歹徒突然拿出塑膠榔頭，朝老闆娘頭部狂敲狠擊，老闆娘抱頭蹲下不斷大喊「救命」，負傷按一下警鈴，歹徒隨即奪門而出，騎乘機車揚長而去，榔頭遺落在現場。請繼續往下閱讀...警方獲報後封鎖現場採證，隨即在附近公園尋獲歹徒作案用機車，但人已逃逸無蹤，清查他並未搶走銀樓財物，銀樓一毛未失，作案動機仍待釐清，警方正擴大追緝中。桃園警分局副分局長王智瑋表示，中午時分景福派出所轄區銀樓女員工，遭不明人士持橡膠榔頭攻擊後騎車逃逸，犯嫌行兇過程中，銀樓女員工見其行跡詭異遂提高警覺，被攻擊時高聲呼救並啟動警鈴，但仍遭歹徒攻擊受傷，員警趕抵現場後立即協助送醫治療，所幸女員工無生命危險，該店內亦無財物受損，分局已成立專案小組，目前已鎖定對象，通報各單位啟動線上攔截圍捕，積極查緝犯嫌到案中。因農曆春節將屆，桃園警分局27日才與銀樓合作舉辦防搶演練，由員警扮演的歹徒進入銀樓假購金真搶劫，受傷的老闆娘當時也參有與與，沒想到2天後遭真的歹徒闖入。該路段有多家銀樓，附近店家表示，該名歹徒站在店外已經好幾個小時，穿著像是警察的雨衣，甚至來回巡視好幾趟，後來聽到「碰碰碰」好幾聲趕緊跑出查看，歹徒似乎沒有說要搶東西，進門就問受傷老闆娘最近如何，隨後就出手攻擊，考量近來金價貴，還是得多加防範。（16:31更新）歹徒進入銀樓，向老闆娘詢問最近有無可疑人物等問題後，突然拿出塑膠榔頭攻擊。（記者鄭淑婷翻攝）歹徒身穿警察雨衣進入銀樓，向老闆娘詢問最近有無可疑人物等問題後，突然拿出塑膠榔頭攻擊。（記者鄭淑婷翻攝）歹徒逞凶前騎乘機車在外徘徊。（記者鄭淑婷翻攝）該間銀樓27日才與桃園警分局合作舉辦春節防搶演練。（記者鄭淑婷翻攝）    ,https://news.ltn.com.tw/news/society/breakingnews/5326238
二類電信業者提供30門號給詐團 半年18人受騙、財損355萬,社會,2026/01/29 15:32,警方查扣網路電話交換機（IPPBX）、網路閘道器（Gateway）、手機、存摺等贓證物。（記者邱俊福攝）二類電信業者「台傳科技有限公司」，涉嫌向一類電信業者租用30線市話及節費電話，提供給境外詐騙集團機房串接詐騙電話，向國人行騙，不僅成功規避境外門號攔阻機制，也協助「偽裝」成隱藏號碼，大幅提高詐騙成功率，且避免遭通報停話，短短半年至少有18人受騙、財損355萬元；刑事警察局偵七大隊第一隊經執行4波查緝行動，將該公司負責人洪姓姊弟等5人查緝到案，上月依加重詐欺、組織犯罪、詐欺等罪嫌移送新北地檢署偵辦。警方調查，該公司自去年3月起，以公司與個人名義在多處商辦大樓及民宅內，向中華、遠傳電信等一類電信業者申設30線市話及節費電話供IPPBX （網路電話交換機）使用，並事先設定「顯號功能關閉」，藉此將來自境外詐團的網路電話，轉置為該公司所申設的市話號碼，成功規避境外門號攔阻機制，且「偽裝」成隱藏號碼的市話撥打給被害人。請繼續往下閱讀...詐團租用該公司一個門號一天價格4000元，該公司提供30個門號，每天共進帳12萬元，初估該公司自去年3月至8月，犯案半年來，獲利達2160萬元。警方表示，該境外機房是假冒微信客服人員以「未顯號」電話撥打給民眾，佯稱「誤設微信帳號升級服務，若不解除將自動扣繳年費」為話術，被害人接到後會被引誘登入其偽造的假官網，引導向「線上客服」申請解除服務，並提交證件照、銀行帳號、信用卡正反面照片、刷卡簡訊驗證碼等個資，遂行盜刷，或者命其直接操作ATM，轉帳至詐團提供的指定帳號。去年7月經過濾分析「165」反詐騙資料庫發現這類詐騙案件後，經追查鎖定「台傳科技有限公司」偵辦，不僅逮捕公司負責人洪女，以及公司技術人員洪女的胞弟，並追出協助介紹境外詐騙機房的李男與提供住處借放網路電話交換機等機具的許男、王女等人到案，查扣網路電話交換機（IPPBX）、網路閘道器（Gateway）、手機、存摺等贓證物。    ,https://news.ltn.com.tw/news/society/breakingnews/5326229
帶刀男擅闖新北板橋社區  總幹事眼尖報警,社會,2026/01/29 15:17,警方質問葉男闖進社區的目的。（記者徐聖倫翻攝）新北市板橋某社區大樓總幹事昨天上午替住戶開地下停車場大門，突有1名陌生男子趁機闖進停車場，總幹事發現即刻上前攔下並詢問其目的。而男子瞎稱要找大樓住戶，卻又說不出是哪一戶，且總幹事瞥見男子身上帶刀，隨即報警處理，警方也將男子帶回偵辦。據悉，昨上午9時許，33歲葉姓男子帶著水果刀來到板橋區某社區大樓，趁有汽車駛進停車場，葉男趁隙跟著跑進去，幸好被該社區總幹事發現。他攔下葉男並質問：「你找誰？」葉男稱來找朋友，但又說不出是哪一戶，加上總幹事看到葉男口袋閃出刀光，隨即報警處理。請繼續往下閱讀...警方獲報到場，再次詢問葉男來此社區的目的，葉男依舊支支吾吾，警方立刻令他交出水果刀，並將他帶回警所。葉男面對警方各種問題，一概一問三不知，警詢後依恐嚇、侵入住宅等罪嫌，將葉男移送法辦。社區大樓貼出告示，警告住戶小心有陌生人闖入。（記者徐聖倫翻攝）    ,https://news.ltn.com.tw/news/society/breakingnews/5326200
男傳訊妻子透露死意  警連夜以車追人尋獲時已不治,社會,2026/01/29 15:11,新北市1 名簡姓男昨晚駕車離家後向妻子傳送尋短訊息。警消接獲報案後立即展開協尋、搜救，今天凌晨在基隆河畔尋獲簡男送醫後仍不治。（記者林嘉東翻攝）新北市1名簡姓男子，昨晚駕車離家後向妻子傳送尋短訊息。警消接獲報案後與時間賽跑，以車追人，透過車牌辨識追蹤簡男行蹤，今（29）日凌晨在基隆河畔尋獲簡男後，趕緊將他送醫急救，仍於急救後1小時不治。昨日晚間9時許，瑞芳警分局接獲一名女子焦急報案，稱其丈夫簡男駕車出門後，傳來意圖尋短的訊息，隨後失去聯繫。警方不敢大意，火速透過車牌辨識追蹤，發現簡男車輛最後出現在基隆河沿岸，遂同步通報消防局第六救災救護大隊瑞芳分隊支援，展開徹夜搜救。請繼續往下閱讀...今天凌晨1時許，搜救人員於基隆河安德宮往大寮方向約20公尺處河畔尋獲簡男時，已失去生命跡象（OHCA），趕緊將他送往瑞芳礦工醫院急救，仍於凌晨2時許不治。據悉，簡男酒後曾向妻子承受不小的壓力，感嘆工作狀況不佳，而簡妻在丈夫遺體被尋獲後返回家中，竟發現丈夫出門前就已留下的一封遺書。警方將報請檢方相驗釐清死因。    ,https://news.ltn.com.tw/news/society/breakingnews/5326079
梁育誌姦殺馬國女大生逃死 高雄高分檢：判決違背法令將上訴,社會,2026/01/29 15:07,姦殺馬國女大生凶嫌梁育誌逃死。（記者陳文嬋攝）性侵勒殺馬來西亞鍾姓女大生凶嫌梁育誌三度判死，高等法院高雄分院今更二審改判無期徒刑；高雄高分檢今認為判決有違背法令之處，將依法上訴。凶嫌梁育誌涉犯強制性交、故意殺人、強盜重罪，法院一審、二審均判梁男死刑，最高法院撤銷發回，高等法院高雄分院更一審仍判處死刑，為限縮判處死刑判決條件以來，更審後仍判處死刑首例。請繼續往下閱讀...但高等法院高雄分院今更二審，認定梁育誌非預謀殺人，難認情節最重大之罪，且有教化、矯治可能，改判無期徒刑，褫奪公權終身，又涉犯強盜罪，處有期徒刑8年。高雄高分檢表示，檢察官認為被告具有預謀計劃性的直接故意，在短暫的時間內，順利完成強制性交、強盜、殺人等犯罪行為，嚴重戕害被害人，這些罪行重大的結合犯行應綜合評價，無從切割。高雄高分檢今依更二審所述，認為判決實有違背法令之處，自當依法上訴，詳細上訴理由，待收判後研議。高雄高分院也將依職權上訴。    ,https://news.ltn.com.tw/news/society/breakingnews/5326220
跳土風舞太吵？台中釀割頸血案 警揭「妨害安寧」處理關鍵、自保SOP,社會,2026/01/29 15:01,發生割頸濺血案現場，警方採證調查。（記者張軒哲攝）台中市大雅區今天發生街頭砍人案，長年指導土風舞李姓女老師，清晨疑因長期舞蹈聲響問題，再度與張姓男子爆發口角，張男情緒失控衍生持刀割頸血案，警方指出，近年因妨害安寧糾紛層出不窮，關鍵在於「別私下對嗆、要制度處理」，只要提早通報、依流程介入，多數衝突都能在升溫前化解，避免演變成難以挽回暴力事件。公園跳舞、廣場音樂看似日常，卻可能成為衝突引信，警方指出，深夜0時至清晨6時，若製造聲響妨害公眾安寧，且有至少3戶以上具體反映或記錄，警方即可依《社會秩序維護法》告發，其餘時段則以勸導為主，若屢勸不聽，則轉由環保局介入，針對工地施工、機械設備或大型活動進行噪音稽查。請繼續往下閱讀...實務上，警方也會先請里長、管委會或相關單位協調，調整音量、時段，甚至建議改至室內場地，避免衝突升高，依《社會秩序維護法》第72條第3款規定，製造噪音或深夜喧嘩，妨害公眾安寧者，最高可處6000元罰鍰，該法適用於不易量測、非持續性的噪音，如跳舞聲、拖家具聲、裝潢敲打、寵物吠叫等。警方指出，「公眾安寧」並非只限深夜，只要影響多數特定住戶生活，就可能構成違規，若長期遭噪音困擾，應蒐證而非理論，可錄影、錄音存證，畫面中盡量拍到時間、地點，若能輔以分貝計更具說服力，員警到場若能「身歷其境」聽見噪音，並有鄰居佐證即可依法告發，若未當場發現，也可透過3戶以上具名指證移送。警方強調，噪音問題不是小事，情緒若長期累積，任何一次衝突都可能成為引爆點，唯有透過制度、通報與協調，才能真正保護彼此的安全。    ,https://news.ltn.com.tw/news/society/breakingnews/5326059
天冷開暖氣不等於通風  北市消：防一氧化碳中毒請開窗,社會,2026/01/29 14:57,消防局提醒，防範一氧化碳中毒請務必開窗。（記者姚岳宏翻攝）春節將近氣溫下降，民眾在家中煮火鍋、洗熱水澡的時間變長，卻也讓隱形殺手「一氧化碳」悄悄入侵，台北市消防局最新警示，冬季為一氧化碳中毒的高風險期，呼籲市民在使用燃氣設備時，務必保持室內通風，切勿因天冷而緊閉門窗，以免釀成遺憾。消防局指出，最常見的中毒肇因源於「熱水器安裝不當」，許多住戶將瓦斯熱水器裝設於加蓋陽台或通風不良空間，導致燃燒廢氣無法排出。消防局強調，熱水器應裝設於開放式陽台；若必須裝在室內，則應選用「強制排氣型」產品，並認明CNS與TGAS認證標誌。請繼續往下閱讀...此外，近年盛行的露營卡式爐也是安全死角，消防局特別提醒，絕對不可在帳篷、車內或緊閉門窗的室內使用卡式爐，且應避免使用過大鍋具導致爐體過熱。消防局說，許多民眾誤以為室內開啟冷暖氣就有空氣流動，消防局也澄清「空調循環無法帶走一氧化碳」，唯有開啟窗戶、確保物理上的空氣對流，才是真正的防範之道。消防局提醒，若在室內感到頭暈、噁心、嘔吐、四肢無力或呼吸加速，極可能已處於中毒環境。此時應立即關閉燃氣設備、推開窗戶通風，並迅速撥打 119 求救。另為鼓勵市民改善居家環境，台北市消防局現正推動「燃氣熱水器遷移或更換補助」，經消防人員居家訪視判定具中毒風險且符合資格者，一般住戶每戶補助3000元，低收入戶補助最高可達12000元。補助名額有限，額滿為止，歡迎洽詢鄰近消防分隊。    ,https://news.ltn.com.tw/news/society/breakingnews/5326190
台中女向前任討還物品失控 怒搧1巴掌代價出爐,社會,2026/01/29 14:54,台中高分院改判女子拘役20天，可易科罰金2萬元。（資料照）台中市一名女子與前男友分手後要拿回自己的東西，一時情緒失控，竟揮出「一巴掌」打在前男友臉上，造成左臉挫傷，前男友氣得提告，案件近日在台中高分院二審落幕，女子最終被判拘役20天，可易科罰金，也就是說，這一把掌的代價高達2萬元。經查，這對男女原本交往但未同居，2024年6月某日晚間，女子前往男子處取回物品，雙方爆發爭執，女子一時怒氣上頭，徒手搧了男子一巴掌，雖然傷勢不重，但男子仍決定走法律途徑，案件一審時，台中地院依傷害罪論處，女子不服提出上訴，並表明願意賠償，希望法官從輕量刑。請繼續往下閱讀...台中高分院二審期間，女子在法庭上坦承犯行，雖男子沒有到庭，雙方未能達成和解，但法官認定女子已表悔意，且無前科、素行良好，出手造成傷害也屬輕微，綜合她的職業、家庭與經濟狀況後，撤銷原審宣告刑，改判拘役20天，可易科罰金2萬元，全案確定。    ,https://news.ltn.com.tw/news/society/breakingnews/5326123
台中割頸兇嫌種大麻將入獄服刑 IG發文：人很多很好殺,社會,2026/01/29 14:53,張男行兇後逃上國道挨撞，躺在國道哀號。（民眾提供）台中市大雅區一名62歲李姓土風舞老師今（29）日上午8點至三和公園籃球場教舞，遭住附近的35歲張姓男子持刀刺了8刀，李女開刀插管治療，張男行兇後走上國道故意被車撞，但雙腿骨折送醫；張男在案發前在個人IG寫下長文，他不滿種植大麻遭判刑，抱怨公園噪音等，殺完人就要上路，還向親友喊話「下輩子再當好人、人很多很好殺」，似乎預謀犯案，打算跟李女同歸於盡。據了解，張男身材健美，熱愛衝浪，20多歲時曾經當過職業軍人與健身教練，他在2023年因為種植「火麻」，遭台北市大安分局警方逮捕，經台中地院判刑5年6月，案件一路上訴到最高院，均駁回張男上訴，全案已經定讞，因近日會發監執行，張男疑似憤怒不平，抱怨栽植火麻被警方釣魚查獲判刑，也抱怨三和公園晨昏都有運動民眾製造噪音，公園周邊違規停車嚴重，向當地民代反映都沒用，質疑官官相護。請繼續往下閱讀...由於張男IG長文文末寫下，「歡迎大家來三和公園丟垃圾跟違停，都不會被罰，歡迎來殺人、人很多很好殺」，決定將積恨已久的怨念了結，先殺害李女，再逃上國道輕生，張男目前雙腿骨折重傷、意識不清。    ,https://news.ltn.com.tw/news/society/breakingnews/5326150
