Title,News_Type,date,content,url
半夜「翹孤輪」耍帥慘摔！花蓮國中生被警鎖定送辦,社會,2026/04/15 11:25,花蓮一名國中少年在半夜騎微型電動二輪車，在花蓮市中華路段上演「翹孤輪」特技，不料耍帥不成反當街慘摔。（民眾提供）花蓮一名國中少年在半夜騎微型電動二輪車，在花蓮市中華路段上演「翹孤輪」特技，不料耍帥不成反當街慘摔，過程遭網友拍下上傳引發熱議。花蓮警分局獲報後透過監視器「以車追人」，迅速鎖定該名未成年騎士，除依道路交通管理處罰條例開罰危險駕車，全案更依涉嫌刑法公共危險罪函送花蓮地方法院偵辦。花蓮警分局今指出，這起危險駕駛案件發生在13日凌晨2點多，該名少年騎著微型電動二輪車在中華路段高速狂飆，期間不僅多次變換車道，更公然在路中央拉起龍頭、單輪著地「翹孤輪」炫技。沒想到下一秒疑似重心不穩，整輛車失控打滑，少年連人帶車重摔在地，所幸當時車流量稀少，未造成追撞意外，少年隨後自行爬起離開現場。請繼續往下閱讀...由於危險行徑全被後方民眾目擊拍下，影片轉貼至社群平台後引發網友撻伐，紛紛直呼「這摔法真的不意外」、「半夜演哪齣」。警方獲報後不敢大意，立即調閱周邊監視器畫面，迅速比對出車輛動向並鎖定駕駛人身分。經通知到案說明後，確認駕駛為一名還在就讀國中的未成年少年，因一時興起才在深夜上街耍帥。警方表示，該少年的行為已嚴重妨害公眾往來安全，除依《道路交通管理處罰條例》第73條針對危險駕駛行為舉發裁罰，讓家長面臨行政罰鍰外，因其在開放道路從事飆車及特技行為，已觸犯刑法公共危險罪，警方依法偵處並函送。花蓮警分局藉此呼籲，道路並非競技場，騎士於道路上應嚴格遵守交通規則，切勿從事炫技或其他危險駕駛行為，以免害人害己。警方強調，未來將持續針對易違規路段加強深夜巡邏與執法取締，守護市民行車安全，共同維護社會安寧。花蓮一名國中少年在半夜騎微型電動二輪車，在花蓮市中華路段上演「翹孤輪」特技，不料耍帥不成反當街慘摔。（翻攝網路社群平台instagram）    ,https://news.ltn.com.tw/news/society/breakingnews/5404345
徐巧芯大姑夫婿委任律師游光德棄保潛逃 3男協助偷渡全被收押,社會,2026/04/15 11:23,律師游光德剪斷電子手環棄保潛逃，桃園地檢署指揮專案小組，陸續拘提協助游嫌潛逃的陳姓、郭姓、吳姓男子，並向法院聲押3人獲准，用來偷渡的船隻也一併查扣。（記者鄭淑婷翻攝）律師游光德被控是詐騙集團首腦，且是捲入詐團洗錢案被法辦的國民黨立委徐巧芯大姑劉向婕丈夫杜秉澄的委任律師，游在今年3月22日剪斷電子手環後「坐桶子」偷渡出境，桃園地院已向桃園地檢署告發游嫌棄保潛逃罪，檢方陸續拘提協助游嫌潛逃的陳姓、郭姓、吳姓男子，並向法院聲押3人獲准。游光德因詐欺案件經法院裁定交保，並施以科技設備監控，他為規避司法審判與刑罰執行，蓄意剪斷電子手環後潛逃出境，桃院於3月26日向桃檢告發，檢察長張春暉指派檢察官黃世維指揮台北市刑大、刑事局電信偵查大隊、桃園市警局桃園分局、海巡署偵防分署台北、桃園、台南、北門、澎湖及偵防查緝隊組成專案小組偵辦。請繼續往下閱讀...檢方指出，案經專案小組追查與蒐證，發現陳、郭、吳男等人，明知游嫌為依法受監控的刑事被告，竟基於隱匿人犯及違反入出國及移民法的犯意聯絡，分工謀劃游嫌逃亡路線與接應事宜，專案小組過濾大量行動軌跡後，查明陳男以7萬5000元代價負責承租車輛，並在車內以不詳方式，替游嫌鬆脫電子手環，吳男以10萬元報酬幫忙仲介郭男協助游嫌偷渡，郭男則以50萬元代價，駕駛海釣船於3月22日晚間，將游嫌自台南曾文溪出海口載至澎湖外海，再由不詳船舶接應潛逃出境。檢方表示，專案小組鎖定陳男等3人行蹤後，迅速於3月31日拘提陳男到案，再陸續於4月8、9日分別拘提郭男、吳男到案，查扣被告郭男船隻，檢察官訊問後以3人涉犯隱匿人犯等罪嫌，向法院聲請羈押禁見獲准。桃檢重申，司法公信力不容挑戰，協助刑事被告逃匿不僅嚴重破壞國家刑罰權的行使，更將面臨嚴厲的法律制裁，任何人切勿心存僥倖、以身試法。律師游光德剪斷電子手環棄保潛逃，桃園地檢署指揮專案小組，陸續拘提協助游嫌潛逃的陳姓、郭姓、吳姓男子，並向法院聲押3人獲准，用來偷渡的船隻也一併查扣。（記者鄭淑婷翻攝）    ,https://news.ltn.com.tw/news/society/breakingnews/5404332
「不太舒服」成遺言！台中績優女社工陳屍租屋處 死因出爐,社會,2026/04/15 11:19,救護人員趕抵時，女社工已明顯死亡。救護車示意圖。（資料照）台中市政府一名長年投入第一線服務46歲女社工表現備受肯定，近日因身體不適向同事透露「不太舒服」，原本同事欲陪同就醫卻被婉拒，未料短短數日後，竟傳出陳屍租屋處的不幸消息，讓同事與親友震驚不已，經相驗後死因出爐，確認係因心肺衰竭導致，令人不勝唏噓。事件發生於13日上午11時許，台中市西屯區一處租屋處因遲遲無人應門，引起警覺，由於該名女社工當天未正常到班且失聯，同時擔心發生意外，緊急通報警方與消防人員到場協助，並找來鎖匠破門，沒想到進入屋內後，發現她已明顯死亡多時。請繼續往下閱讀...據了解，死者為台中市政府社會局資深社工，長期服務於家防中心，工作表現優異，過去甚至曾獲表揚，是同事眼中盡責又專業的夥伴，她平時獨自居住，生活單純，曾在10日表達不舒服，13日又未正常到班，同事才會緊急上門找人，原以為僅是單純不適，卻傳出噩耗。案經警方報請檢方會同法醫相驗後確認，女社工近日因感冒身體不適，最終疑因疾病引發心肺衰竭致死，排除外力介入，社會局已第一時間聯繫家屬並全程陪同處理後續事宜，提供必要協助。台中社會局績優女社工上週喊不舒服未上班 住處破門已喪命    ,https://news.ltn.com.tw/news/society/breakingnews/5404325
「媽祖來了」也沒用！香燈腳掛滿結緣品卻未戴安全帽 無照慘領高額罰單,社會,2026/04/15 11:16,林男無照騎機車，遭警方攔查。（民眾提供）國內宗教盛事白沙屯媽祖進香活動頻傳亂象，尤其海線交通大受影響，民眾追媽祖出現許多違規情事，清水分局也陸續開出罰單，因大甲媽進香活動也將於17日出發，警方呼籲民眾遵守通規則。「粉紅超跑」鑾轎於13日凌晨出發徒步前往雲林縣北港朝天宮進香，今年報名人數突破46萬人創下新高，卻也頻傳亂象，有許多民眾追媽祖鑾轎，騎機車沒戴安全帽遭開罰，一名林姓男子並與警方爭執，「媽祖婆來啦！」求警方網開一面，竟發現他未領有機車駕照。請繼續往下閱讀...警方今日指出，前（13）日傍晚49歲林姓男子騎機車戴著白沙屯媽祖橘色帽子，掛著多樣結緣品，卻未戴安全帽行駛。經攔查發現林男未領有機車駕照，依未戴安全帽處500元及未領有機車駕照處1萬8仟至3萬6仟元，警方除當場製單舉發外並移置保管機車及牌照吊扣三個月。警方呼籲，遶境期間執法沒有空窗期，為維護各用路人安全，提醒民眾務必遵守交通法規，勿有違規違法情事。白沙屯媽祖進香人數創新高，亂象頻傳。（記者張軒哲攝）    ,https://news.ltn.com.tw/news/society/breakingnews/5404318
廢棄物堆成山！彰化4環保公司被抄 檢帶回17人、1人收押,社會,2026/04/15 11:12,沒有貯存執照的環保公司，在內部堆置大量事業廢棄物。（彰化地檢署提供）無照環保貯存場的事業廢棄物堆積成山！彰化地檢署接受民眾檢舉，從4月初以來，結合警、調、環保單位，展開大規模取締及查察，共有4間環保公司，因沒有貯存場執照，卻在場內堆置大量事業廢棄物，檢方搜索14個處所，帶回17名被告，其中2人因有逃亡串證之虞，向法官聲請羈押，其中1人准押，另15名被告交保。彰化縣環保局接獲民眾檢舉，發現有業者於轄內處所非法堆置廢棄物。彰化地檢署啟動查緝國土犯罪平台，由國土專組周佩瑩主任檢察官整體規劃，率檢察官鐘祖聲、詹雅萍、卓喆寓聯手指揮相關單位追查。請繼續往下閱讀...專案小組分別於4月1日及7日動員警調環人員共計83人次，發動兩波搜索行動，前往彰化縣彰化市、大村鄉、福興鄉等地，搜索14處所。查獲4間環保公司雖持有乙級廢棄物清除許可證，惟未依法申請設立貯存場或轉運站，竟擅自將清運之廢棄物堆置於廠區內，這些環保公司堆置的廢棄物從790立方公尺至2000立方公尺間，相當於一個標準游泳池的容量，已構成違反廢棄物清理法嫌疑，並對環境造成潛在重大污染風險。檢察官認被告等涉嫌違反廢棄物清理法第46條第3款及第4款規定，犯罪情節重大，向法院聲請羈押2人，其中1人獲准。檢方表示，非法堆置及貯存廢棄物造成環境破壞、危害民眾健康，不利國土永續發展，將持續結合各機關力量，嚴正執法。同時呼籲相關業者務必依法從事廢棄物清除與處理作業，切勿積非成是，心存僥倖；民眾如發現疑似非法棄置廢棄物情事，亦請踴躍通報，共同維護生活環境安全。沒有貯存執照的環保公司，在內部堆置大量事業廢棄物。（彰化地檢署提供）    ,https://news.ltn.com.tw/news/society/breakingnews/5404315
網傳國父紀念館停車場疑狠父踢兒畫面 北市警方介入調查,社會,2026/04/15 11:08,台北市警局信義分局。（記者邱俊福攝）社群網站流傳一段國父紀念館停車場昨天下午疑似父親對小孩出拳還狠踢屁股的影片，轄區台北市警信義分局三張犁派出所據報已掌握相關身分，將通知到案說明並依法辦理，另依規定通報市府相關單位依權責介入關懷輔導。這段影片以「社會事新聞影音」為題，內容疑似一對父母親當時帶著剛放學，穿著國小運動服、背書包的一對男童，父親對其中一名男童出拳打其背部，導致男童倒地趴在地上，母親跑上前制止，父親怒氣未消又出腳狠踢學童屁股。請繼續往下閱讀...影片還PO文「國父紀念館停車場驚見暴力管教，孩童遭狠踢屁股、大力踹背引眾怒。」警方據報經查，案件發生在昨天下午3時50分許，目前已經掌握相關人員身分，將會約談到案說明，依法處理。    ,https://news.ltn.com.tw/news/society/breakingnews/5404316
地球村老闆喬債教唆黑道痛毆女牙醫 北院裁定靜安會夏安80萬交保,社會,2026/04/15 11:06,北院裁定夏安80萬交保。（資料照）去（2025）年5月，地球村美日語老闆陳中義欠沈女1500萬元，卻涉找幫派分子夏尉瀧、周文瀚找來周子鈞將沈姓女牙醫毆打至眼窩骨折、左眼複視至今仍無法執業。台北地檢署於去年9月以詐欺及組織犯罪防制條例等罪起訴陳中義、夏尉瀧（綽號：夏安）、周子鈞等6人。夏尉瀧與周子鈞分別於去年6月、5月就被檢方聲押獲准，直到台北地院於昨（14）日裁定夏尉瀧以80萬元交保、周子鈞以60萬交保，2人皆限制住居、限制出境出海及科技監控。起訴指出，陳中義因為疫情等原因，導致在外欠下多筆債務，為緩解財務惡化便將原抵押給玉山商業銀行的台中市福星路上的不動產拿出，到民間設定二胎，以權狀作為抵押委託蔡姓仲介找金主，後由蔡姓仲介找來沈女及劉姓金主分別提供1500萬元，但要設定權狀之時，陳中義卻提出書面異議，要求駁回登記且其提供擔保的支票，早已跳票。沈女、劉姓金主知道陳中義根本無心提供抵押品，逐提出給付票款訴訟並獲得勝訴。請繼續往下閱讀...陳中義再向郭姓金主借貸時，對方提及可出售該福星路上的不動產，且該處經變更地目後，價值上看20億元。陳中義為求解套，認識了仲介黃今沛，但對方覺得陳男債務太複雜，要他找道上兄弟處理，便介紹靜安會大哥夏尉瀧給其認識。夏男等人找上友人周文瀚協助，加入索討權狀計畫內。陳男等人多次約蔡、劉、沈姓牙醫商談，明、暗示靜安會在幫忙處理債務，想取回權狀遭拒。今年4月28日晚間，則提出以1500萬元換回權狀，仍遭沈女拒絕，引起夏男不滿。夏男透過手下徐若修找來打手周子鈞，並於去年5月19日，派他到沈女開設的牙醫診所「假洗牙真找碴」，痛毆沈女，最後沈女被打到眼窩骨折，左眼出現複視，至今仍無法執業。北院裁定周子鈞60萬交保。（資料照）    ,https://news.ltn.com.tw/news/society/breakingnews/5404300
演習計畫變廢紙！空軍松指部作戰官「不小心丟進碎紙機」起訴,社會,2026/04/15 11:01,台北地檢署今依違反國家機密保護法等罪，起訴蘇姓軍官。（記者吳昇儒攝）任職於空軍松山基地指揮部作戰科的蘇姓作戰官前年簽辦被列為「機密」的演習作戰計畫書，本應交付給專機隊、座機隊等4個單位，卻不慎遺失。直至去年，單位進行督導時，發現少兩份公文，所幸在該科碎紙機內發現殘骸，督導人員認定蘇姓軍官毀棄，依法將他移送法辦。台北地檢署今日偵結，依違反國家機密保護法等罪，提起公訴。檢憲調查，蘇姓軍官負責基地防衛、反空（機）隊等任務，前年負責簽辦兩演習作戰計畫書，本應將列為軍事機密的計畫書轉給專機隊、座機隊、基地勤務隊與補給隊等4個單位，去年4月底前卻疏於保管，不慎將公文放入碎紙機，導致機密公文受到損壞。請繼續往下閱讀...督導人員去年前往該單位進行督導時，發現原應交付給專機隊、座機隊的演習作戰機密公文，並未依規定轉交，循線調查發現是蘇姓軍官出了紕漏，所幸在該辦公室的碎紙機中，找到部分公文殘骸，確認是遭蘇男不慎碎毀，後續交由憲兵單位進行偵辦、移送。檢察官偵訊後，認定蘇男毀損軍事機密公文行為，已經違反國家機密保護法中的過失毀棄、遺失國家機密罪嫌及陸海空軍刑法中過失委棄軍事上應秘密之文書罪嫌，依法提起公訴，並請法官從重處斷。    ,https://news.ltn.com.tw/news/society/breakingnews/5404293
詭異自撞！台中騎士深夜猛撞路邊貨車 緊急開刀保命身分成謎,社會,2026/04/15 10:54,機車突自撞路邊停車格內小貨車，騎士緊急送醫身分待查。（民眾提供）離奇自撞！台中市北區14日深夜驚傳一起詭異車禍，一名身分不明的機車騎士，竟在無明顯外力干擾下，直接撞上路邊停放的小貨車重傷送醫，目前仍在手術中，身分成謎，事故原因更添疑點。台中市第二分局表示14日深夜11時08分接獲報案，指北區學士路251號前發生交通事故，員警火速趕赴現場處理，初步調查，該名男子騎乘機車沿學士路由德化街往梅亭街方向行駛，行經事發路段時，卻突然在外側車道偏移，直接撞上停放於路邊停車格內的營業用小貨車。請繼續往下閱讀...因撞擊力道猛烈，機車毀損嚴重，騎士則倒地不起，救護人員到場後，發現男子全身多處受傷，其中腿部傷勢嚴重，緊急送往醫院搶救，目前正進行開刀手術，由於事發當下無法表達身分，也尚未完成酒測，是否涉及酒駕仍待進一步釐清。警方指出，現場無其他車輛直接碰撞跡象，初判為單一車輛事故，但確切肇事原因，包括是否因疲勞駕駛、精神狀況不佳或其他突發因素導致失控，仍有待調查，並將進一步釐清騎士身分及事故發生經過。    ,https://news.ltn.com.tw/news/society/breakingnews/5404280
深夜碰一聲！屏市22歲男開車自撞分隔島翻車不治,社會,2026/04/15 10:54,小轎車自撞翻覆，22歲男送醫不治。（屏東警分局提供）14日深夜11時33分屏東市復興南路一段一輛由22歲黃姓男子駕駛的小轎車，沿復興南路一段南往北，往屏東市方向高速行駛，附近民眾只聽到「碰」一聲好大聲，小轎車自撞中央分隔島後翻車，車輛零件四散，黃男被壓在車子裡面重傷昏迷，屏東縣消防局獲報後將黃男送醫急救不治，醫院已抽血檢驗以釐清死因。屏東警方表示，這起自撞翻車事故，初步研判肇事原因疑似為22歲黃姓男子車速過快並且快速變換車道才會導致自撞中央分隔島而翻覆，現場汽車零件四散，詳細肇因尚待進一步釐清，另外有無酒駕、毒駕部分已由醫院抽血檢驗，後續已報請檢察官相驗。請繼續往下閱讀...屏東警分局呼籲，夜間行車視線較差，駕駛人不要開快車，應減速慢行並謹慎變換車道，避免因一時疏忽釀成憾事。小轎車自撞中央分隔島後翻覆 。（屏東警分局提供）小轎車自撞翻覆，因撞擊力道大，車上零件四散。（屏東警分局提供）    ,https://news.ltn.com.tw/news/society/breakingnews/5404295
國營事業工程師幽會女同事 定情戒指洩姦情,社會,2026/04/15 10:46,任職於國營企業的李姓工程師與同組黃姓女同事發生婚外情，定情戒指成偷情鐵證。示意圖（資料照）任職於國營事業的李姓工程師與同組黃姓女同事發生婚外情，李男不僅常藉故不回家、搬回老家居住，甚至與黃女在大街上親暱牽手、共用影音帳號，日前老婆意外發現刻有兩人諧音縮寫「13♡51」的定情戒指，氣得告上法院求償百萬，法官判兩人應連帶賠償30萬元。判決指出，李男與妻子結婚多年並育有一子，2024年起，李妻發現丈夫對她的態度變差，動輒吵架離家，李妻查覺有異後展開調查，發現丈夫與黃女多次密集約會，不僅在街頭大方牽手同行，宛如熱戀情侶，更持有代表兩人名字諧音縮寫「13♡51」的定情戒指。請繼續往下閱讀...李妻為此飽受精神折磨，需進行心理諮商，憤而提起離婚訴訟並請求精神慰撫金100萬元。高雄地方法院審理時，李男辯稱婚姻早已破裂，與黃女交往是在妻子提出離婚訴訟後才開始；黃女則喊冤，稱自己個性「大方坦率」，僅是正常社交，否認有不正當男女關係，更辯稱戒指照片僅有一枚，無法證明是定情物。法官檢視相關事證時，發現李男面對妻子質疑外遇時，竟冷回：「有又怎麼樣，沒有又怎麼樣，對現在來說有差嗎？」，還被拍到在一週內多次密集約會，且公然在街頭牽手長達數小時，明顯逾越一般男女社交分際。法官認為，李、黃兩人的不正交往行嚴重侵害李妻的配偶權，考量李男身為國營事業碩士工程師，年收入破百萬，而黃女年收也有70餘萬，因此判兩人應連帶賠償30萬元，可上訴。    ,https://news.ltn.com.tw/news/society/breakingnews/5404283
基院選任10位國民法官 明開審狠父枕頭悶死5歲兒案,社會,2026/04/15 10:43,基隆地院國民法官庭今天選出10名國民法官，明天上午開庭審理去年5月簡姓男子酒後以枕頭悶死5歲兒子案，預計17日宣判。 （記者林嘉東攝）基隆市簡姓男子去年5月酒後以枕頭悶死5歲兒子，被依涉犯成年人故意對兒童犯殺人罪。基隆地院採國民法官制度審理，今天（15日）上午進行選任國民法官程序，於35位候選民眾中，隨機抽選出6位國民法官，4位備位國民法官，將與3名職業法官共組合議庭審理本案。簡男和張姓妻子婚後育有1名5歲男童，簡男與妻子常為生活瑣事與小孩監護權歸屬等事起口角，去年5月14日午後，酒後以枕頭悶死兒子，酒後騎車逃逸，被警方查獲坦承殺兒，酒測值0.33毫克。檢方調查後，將簡男依涉犯成年人故意對兒童犯殺人罪、公共危險罪起訴，基院依法採國民法官制，抽籤由審判長劉桂金、陸怡璇、李岳組成的合議庭進行審理。請繼續往下閱讀...基院上午9點半在第一法庭進行選任國民法官程序，法庭在43位候選人之中，隨機抽選出6位國民法官、4位備位，10人隨即進行宣誓，並進行審前說明，由3位職業法官向其說明程序，至下午1時許，將於明、後天進入密集2天開庭程序，並於17日宣判。依據國民法官法，勞工擔任國民法官，其任職的公司應給予公假，薪水照付，開庭日法院另支付每天3000元日費，若超過晚上6時後加班，每小時加付500元。選任程序則是日領1500元、晚間加班每小時300元。    ,https://news.ltn.com.tw/news/society/breakingnews/5404270
港商藉交流吸收成共諜！現退役6軍人判刑  空軍少校判8年6月最重,社會,2026/04/15 10:39,中籍港人丁小琥8年前就以湖南省芷江媽祖文化交流協會副會長身分來台「交流」，開始接觸我國人士，但他審理期間病逝，高院上個月宣布公訴不受理。（圖：取自鹿港天后宮網站）中國港籍男子丁小琥多次利用商務、觀光名義申請來台，實則吸收我國現役、退役軍人刺探軍事機密，透過退役中校王文豪、譚俊明吸收同僚刺探軍機。高檢署去年11月偵結，依涉犯國家安全法等罪嫌，將丁男等7人起訴，並求處重刑，高院審理期間丁小琥病逝，上個月宣布公訴不受理。高院今宣判，6被告依違反國家安全法及陸海空軍刑法等罪分別被處4年6月至8年6月徒刑。調查局台北市調查處去年發現，丁男多次以商務、觀光名義進出我國，且與退役中校王文豪、譚俊明往來密切，隨即啟動調查。深入追查後發現，3人涉嫌刺探軍事機密，循線查出士官長呂芳契、少校參謀官楊博智、其姊中尉人事官楊千慧與姊夫少校管制官邱翰林等人均涉入其中。請繼續往下閱讀...檢調查出，丁男受中共軍委政治部聯絡局南寧工作站指示來台發展組織，並透過陳俊安以地下匯兌方式洗入逾1112萬元資金，作為蒐購情報之用。丁先吸收退役軍官王文豪、譚俊明及國人張志煒、何聖影（兩人均已身亡）成組織重要成員，再由王、譚2人物色昔日同僚、部屬與受訓同梯，進行遊說。專案小組去年7月24日見時機成熟發動4波偵查行動，搜索21處所、約談13人並查證16人，丁男等7人經高院裁定羈押禁見至今，但高院審理期間，丁男過世，上個月高院公訴不受理。高檢署去年11月偵結，依違反國家安全法等罪起訴丁小琥及6名現、退役軍官，並求處重刑；另台北地檢署亦就丁小琥、陳俊安及王文豪涉洗錢罪部分提起公訴。涉及共諜案的多名現、退役軍人今天判決出爐，高院依違反國家安全法及陸海空軍刑法等罪，分別判處不等刑期，並宣告沒收犯罪所得。其中，退役軍官王文豪、譚俊明分別依為大陸地區發展組織罪判處有期徒刑7年及7年2月，並沒收已繳交的犯罪所得50萬元及8萬3380元。此外，呂芳契因涉為大陸地區發展組織未遂罪被判6年徒刑，沒收17萬元犯罪所得；邱翰林則被認定犯同罪判刑8年6月，未扣案的10萬元犯罪所得宣告沒收，若無法沒收將追徵其價額。楊千慧同樣因涉發展組織罪判處8年徒刑，並沒收10萬元犯罪所得。楊博智則依陸海空軍刑法職務洩漏機密罪，判處有期徒刑4年6月，並沒收8萬元犯罪所得。    ,https://news.ltn.com.tw/news/society/breakingnews/5404260
