Title,News_Type,date,content,url
國台辦批民進黨禁小紅書「怕人民真正了解中國」 王丹譏影射中共高層,政治,2025/12/05 16:03,小紅書。（路透）內政部4日與刑事局詐欺犯罪防制中心召開記者會宣布，將依《詐欺犯罪危害防制條例》自即日起對「小紅書」APP發布「網際網路停止解析及限制接取命令」，暫定為期1年。中國國台辦發言人陳斌華回應稱「民進黨當局......害怕台灣民眾透過各種方式了解中國真實情況」。對此，中國民運人士王丹大酸，「國台辦這是失心瘋了嗎？敢這樣影射中共高層！」據中國媒體報導，針對台灣禁小紅書議題，國務院台辦發言人陳斌華4日回應，民進黨當局的藉口是所謂「資安」，暴露的是他們內心的「不安」。他們害怕台灣民眾通過各種方式瞭解大陸的真實情況，害怕自己費盡心機構建的「資訊繭房」被打破，害怕兩岸同胞借由資訊互通增進瞭解、走近走親。請繼續往下閱讀...王丹昨於臉書粉專「王丹网站 Wang Dan's Page」發文提及，如果民進黨禁小紅書就是「怕人民真正了解中國」，那中國禁的更多，臉書、推特、YouTube都禁，豈不是比民進黨「更怕人民了解中國」？！王丹揶揄，「國台辦這反手一劍，還真是見血封喉，點出了中共封鎖信息的真實的內心想法。」網友看到貼文後紛紛留言，有人說「言下之意是中國怕人民了解真正的自由世界嗎？」、「他們本來就沒有邏輯，所以才會被全世界恥笑」、「搞網管、自我審查的國家，難道是怕自己人民瞭解世界？」熱門賽事、球星動態不漏接    ,https://news.ltn.com.tw/news/politics/breakingnews/5268874
北市研考會民調逾6成市民支持雙城論壇 蔣萬安曝尚未送件陸委會,政治,2025/12/05 15:52,台北市長蔣萬安（左）5日出席市政總質詢，與副市長李四川（右）同答詢。（記者廖振輝攝）台北市研考會近日發布民調指出，七成一市民認同「越緊張越應溝通交流」 六成四支持台北、上海城市交流。國民黨籍市議員汪志冰今（5日）於市政總質詢批評中央頻頻小動作卡雙城論壇，台北市長蔣萬安指出，前15天要向陸委會提出申請，目前還在跟上海確認細節，尚未送件陸委會。汪志冰表示，今年雙城論壇很詭異，到現在已經12月5日都還沒有跡象確定能到上海。蔣萬安表示，如果能順利舉辦，時間會落在12月底，現在還有一些最後的行政細節要確認，依照規定向陸委會申請要在15天前提出，目前在最後階段也會努力溝通和協調。請繼續往下閱讀...蔣萬安說，目前尚在跟上海方做最後確認雙方可行時間，包含台北市議會開議期間哪幾天委員會排程許可等。副市長林奕華說，還有很多細節包括日期、行程等，都還需要協調，MOU的部分，目前兩項都已經確定下來。汪志冰說，研討會民調指出，71%市民認同「越緊張越應溝通交流」，64%支持台北、上海城市交流，有這麼大的民意當基礎，在台北市沒有太大問題，數據也呈現跨年齡、族群的高共識。不過很遺憾，這幾年中央政府處處搞小動作，是否因此上海方有其他考量？林奕華說，這次上海方要來台灣，4位上海台辦幹部也只被核准一位成行。汪志冰批評，這就是動作頻頻。熱門賽事、球星動態不漏接    ,https://news.ltn.com.tw/news/politics/breakingnews/5268817
陳玉珍提「助理除罪化」傅崐萁稱是進步法案 林智群轟：鬼才信你！,政治,2025/12/05 15:50,傅崐萁。（資料照）國民黨立委陳玉珍提出「立法院組織法修正草案」，將立委助理費除罪化，相關草案今天已付委審查。國民黨團總召傅崐萁今受訪回應，助理費的修正是進步法案，修法好好保護民代助理，無須成為民代的共犯。對此，律師林智群酸說，「鬼才信你！助理費就是助理費，相關撥付都有制度，行之有年，為什麼要全部撥到立法委員帳戶，變成你的小金庫，還不用檢附單據核銷？」林智群今於社群平台發文提到，「一堆立法委員因為侵吞助理費被起訴貪污，不就證明了，就算是有制度在那裡，還是有人會想侵吞入己。」請繼續往下閱讀...現在傅崐萁要修法改成助理費直接匯到立法委員帳戶，豈不是一個月變相幫立法委員加薪60幾萬？反正你愛怎麼用就怎麼用，警察抓到也告不了你。林智群怒轟，「藍白多數2年，除了擴權自肥，搞政治鬥爭，爲反對而反對，到底監督了什麼？如果說國民黨是爛，民眾黨就是為虎作倀，什麼第三政黨？小藍教就小藍教，還裝？」臉書粉專「MR.柯學先生」發文酸說，「傅崐萁稱助理費除罪化是為了保護助理，是一個進步的法案？為你示範什麼叫睜眼說瞎話」。     在 Threads 查看助理費除罪化 傅崐萁稱進步法案：是保護這些助理熱門賽事、球星動態不漏接    ,https://news.ltn.com.tw/news/politics/breakingnews/5268789
台中男衝泳池開槍2童陷恐慌 盧秀燕：後續關懷輔導由家長決定,政治,2025/12/05 15:42,台中市長盧秀燕表示，警方處理泳池事件SOP是正確的，至於2名兒童是否要接受輔導，「由家長決定」。（記者蔡淑媛攝）台中在國慶日當天有歹徒吸毒後竟持槍闖進一家民間游泳學校，並對教練、2名孩童扣扳機，幸未擊發，事件竟遲至本月3日因台中地檢署起訴書才曝光，各界撻伐，警方卻說是因兒少法保護兒童才未說明，議員蔡耀頡痛批根本是「雙標！」警方事後未通報教育局和社會局做事後關懷輔導，盧秀燕則指，「要不要後續關懷由家長決定！」台中陳姓男子在國慶日當天喝了毒咖啡包後，攜帶1把手槍和26顆子彈闖入西屯區1間游泳學校，當時泳池中只有葉姓教練指導小兄妹6歲女童、7歲男童練習，陳嫌卻跳入泳池逼近，拿起手槍拉滑套扣扳機，所幸未擊發，接著又繼續持槍到停車場，敲破蔡姓民眾的自小客車擋風玻璃，車內當時還有未成年女童，嚇壞現場民眾，直到員警趕到將他制伏送辦。請繼續往下閱讀...蔡耀頡今在議會質詢指，盧市府辯稱是因兒少法要保護兒童才未提及陳嫌跳泳池對教練、2孩童扣扳機，他再問教育局長蔣偉民、社會局長廖靜芝是否接到警局通報兒少保護和轉介輔導通知，2人則說要回去查，顯見警方根本沒通知兒少保護關懷輔導，2童至今仍陷於恐慌。蔡耀頡進一步批警方是「雙標」，案發時陳嫌對游池2童舉槍扣扳機，接著又去停車場敲破車窗，當時車內有對母子，隔天卻僅對外說明車內有車主和未成年兒童，但對泳池孩童事件卻隻字不提，否則依盧市長習慣，一定會表揚護童教練，質疑盧市府對此事件就是「蓋牌」重大治安事件。對此，盧秀燕表示沒有蓋牌，強調警方的SOP是正確的，對兒少事件不宜敲鑼打鼓，讓人面臨龐大壓力，至於2名兒童是否要接受輔導，「由家長決定！」台中市議員蔡耀頡（右）、江肇國批盧秀燕雙標，蓋牌重大兒少治安事件，警方事後又未通知教育局、社會局輔導關懷。（記者蔡淑媛攝）持槍闖游泳池開槍的陳姓男子，被警方制伏帶回警局偵辦。（民眾提供）熱門賽事、球星動態不漏接    ,https://news.ltn.com.tw/news/politics/breakingnews/5268885
財劃法覆議案遭藍白否決  卓榮泰：無必須執行壓力,政治,2025/12/05 15:25,行政院長卓榮泰回應「財政收支劃分法」修正部分條文覆議案遭否決。（記者鄭景議攝）立法院會今天處理「財政收支劃分法」修正部分條文覆議案，遭藍白多數否決。對此行政院長卓榮泰今日下午前往消防署出席「114年全國消防志工菁英頒獎表揚活動」，接受媒體聯訪時表示，國會一連串強行表決，又拒絕安排行政院到立法院作報告，不讓政院把財劃法錯誤的內容向國人說明，試圖把人民的眼睛耳朵摀起來，對於這種不經議事程序的決議，「行政院沒有必須執行的壓力」。卓榮泰說，從立法院拒絕安排行政院報告，執意表決，大概就知道結果會是如此，最近一直以來，國會審查法案不經討論、逕付二讀、強行表決，審查覆議案，不經報告、不用答詢，也強行表決，這就是要讓真相無法呈現在國人面前。請繼續往下閱讀...卓榮泰指出，政院報告會把財劃法錯誤的內容向國會說明，讓國人清楚，答詢也會讓整個爭議更為清楚明白，但是國會拒絕了這樣的程序，他奉勸國會不要以為把人民的眼睛跟耳朵摀起來，大家就會願意把頭埋在沙子裡，成為一隻鴕鳥，對於這種不經議事程序的決議，行政院沒有必須執行的壓力。熱門賽事、球星動態不漏接    ,https://news.ltn.com.tw/news/politics/breakingnews/5268847
力挺台灣主辦國際護理大會！國際護理協會訪台 林佳龍致謝,政治,2025/12/05 15:24,外交部長林佳龍（右）4日接見「國際護理協會」執行長卡頓（Howard Catton，左）一行。（外交部提供）外交部長林佳龍昨（4）日接見「國際護理協會」（ICN）執行長卡頓（Howard Catton）、全球活動暨會員發展負責人戈伊蘇埃塔（Italo Goyzueta），以及台灣護理學會（TWNA）幹部，感謝ICN對我國TWNA的支持，也肯定TWNA的努力，成功申獲「國際護理協會2027年國際護理大會」在台舉辦。外交部今天發布新聞稿說明，ICN成立於1899年，目前計有140個會員組織，是與世界衛生組織（WHO）有正式合作關係的國際非政府組織，其運作方針與聯合國及WHO健康政策緊密相關。ICN國際護理大會每兩年舉辦一次，是全球最具規模及影響力的國際護理盛會。外交部將持續鼓勵我國民間團體爭取在台舉辦大型國際會議及活動，讓世界看見台灣。請繼續往下閱讀...外交部轉述，林佳龍會中感謝ICN支持「ICN 2027年國際護理大會」在台舉行，並期盼未來與ICN深化合作，共同提升全球健康福祉。卡頓則非常肯定台灣在全球照護系統中的領導地位，並稱許TWNA是ICN重要會員，樂見前述大會在台灣主辦，將為國際護理界及健康政策制定者交流的重要平台。外交部指出，林佳龍本次接見ICN訪團，陪同在座的有TWNA理事長廖美南、副理事長暨ICN理事陳靜敏、副理事長范君瑜、監事暨ICN前第三副理事長黃璉華、秘書長陳淑芬、組長莊子嫻，以及外交部NGO國際事務會執行長江振瑋等人。外交部長林佳龍4日與「國際護理協會」訪團一行及「台灣護理學會」幹部合影，左起外交部NGO國際事務會執行長江振瑋、TWNA副理事長范君瑜、TWNA副理事長暨ICN理事陳靜敏、ICN全球活動暨會員發展負責人Italo Goyzueta、ICN執行長Howard Catton、外交部長林佳龍、TWNA理事長廖美南、TWNA監事暨ICN前第三副理事長黃璉華、TWNA秘書長陳淑芬、TWNA組長莊子嫻。（外交部提供）熱門賽事、球星動態不漏接    ,https://news.ltn.com.tw/news/politics/breakingnews/5268855
柯文哲、黃國昌同台直播 吳靜怡：黃國昌仍活在柯的「太陽底下」,政治,2025/12/05 15:19,黃國昌（左）、柯文哲（右）。（圖擷取自柯文哲YT頻道）民眾黨前主席柯文哲、現任主席黃國昌昨同台直播對談，針對2026縣市首長選舉，民眾黨方已有2人正式表態參選，包含新北市黃國昌、宜蘭縣陳琬惠，這場直播內容中，能看出什麼藍白合的方向？媒體人吳靜怡認為，「黃國昌永遠只是柯文哲這顆太陽下撐陽傘的黨主席而已，連影子都是柯文哲決定的，柯還是大仔」。「有記者問我關於柯文哲和黃國昌的直播，能觀察什麼藍白合的方向？」吳靜怡今於社群平台發文提及，從直播很明白可以看出來，柯文哲告訴黃國昌，藍白民調怎麼比就趕快定調不要複雜，輸的人就輸！也就是你黃國昌新北市到底要不要選、不要囉嗦，如果你要藍白合，輸了就不要鬧，如果你要獨立參選，就徵招自己獨立參選！根本沒有基隆模式，根本也沒有什麼縣市聯合內閣的荒謬模式！請繼續往下閱讀...柯文哲會落實鐵律，黃國昌就是當完兩年就給我下來，明年一批新的立委都是「柯家軍」，黃國昌直播講這麼多，結果就是把黃國昌一堆「摸頭」後促成藍白合一堆爛法案推給柯文哲，意旨都是按照柯文哲當初選總統的政策，更刻意的置換這些荒謬法案都是民進黨當初想法！甚至還表達自己會每週2天到立院開會，這也就是讓柯文哲人馬的立委清楚，黃國昌才是主席。關於全台灣的小雞佈局，柯文哲和黃國昌很意外的避開，甚至完全沒有提到對於政黨最重要的明年選戰，這也讓柯文哲人馬很清楚，柯文哲並沒有完全認同黃國昌針對明年「金釵」等等相關佈局。吳靜怡指出，黃國昌刻意告訴柯文哲他在北所外有幫他爭取戒護就醫，但好笑的就是柯文哲本來當日就要就醫，這場戲，黃國昌自己戳破自己，而特別提到冷錢包，應該就是想要當面跟柯文哲和柯粉解釋「菱傳媒」跟他沒關係，但誰信？！柯文哲透過直播直接呼應陳佩琪的臉書，關於清涼照的部分，這是提早打預防針，更是自己承認檢調掌握的硬碟就是柯文哲自己的。柯文哲曾經選前之夜有20幾萬人觀看，昨日首發5萬多人，應該就是這十講的天花板，除非魔法的手指頭能夠灌更多流量。吳靜怡認為，「結論就是相敬如賓，對於民眾黨的政治操作上，毫無加分！反而看出來，黃國昌永遠只是柯文哲這顆太陽下撐陽傘的黨主席而已，連影子都是柯文哲決定的，柯文哲還是大仔。」熱門賽事、球星動態不漏接    ,https://news.ltn.com.tw/news/politics/breakingnews/5268700
中共東海集結艦艇 台日齊發聲：持續關注、掌握動態,政治,2025/12/05 15:12,「路透」報導，中國正在東亞海域部署大量海軍和海警艦艇，數量高峰一度逾百艘，目前仍有約90艘在區域內活動。中國軍艦示意圖。（資料照）「路透」報導，中國正在東亞海域部署大量海軍和海警艦艇，數量高峰一度逾百艘，目前仍有約90艘在區域內活動。針對共軍動態，我國國防部今表示，國軍運用聯合情監偵手段，可有效掌握共軍動態，並適切應處。日本官房長官木原稔在記者會上就中國艦船的部署表示：「有關周邊的軍事動向，正高度重視、密切關注。」他強調將做好萬全的情報收集和警戒監視工作。路透社日前援引多名情報部門人士的話稱，中國在東亞海域部署了大量海軍和海警局的艦船及警備艇。據稱總計約100艘。中方對日本首相高市早苗涉台國會答辯提出抗議。此外，中方對台灣為加強防衛而編列特別預算的做法表示不滿，外界擔憂其在台灣周邊開展軍事演習。根據報導，此次艦船的部署規模超過了去年12月中國開展的被稱為史上最大規模的海上軍事行動。請繼續往下閱讀...日本共同社報導，日本官房長官木原稔在5日的記者會上就中國艦船的部署表示：「有關我國周邊的軍事動向，正高度重視、密切關注。」他強調將做好萬全的情報收集和警戒監視工作。「路透」也報導，日本防衛大臣小泉進次郎被問及中國在東海的活動時表示，日本已知悉相關報導，並「高度關注」中國軍事動向，但未對具體部署評論。他並說：「中國一直在日本周邊地區擴大和加強軍事活動，我們持續努力蒐集和分析有關中國軍事動向的情報」。他強調，「無論如何，政府將持續深切關注日本周邊發展，並盡一切努力確保徹底的資訊蒐集與監控」。據指出，確認到的情況是中方一度部署超過100艘艦船，本月4日時為90艘以上。活動範圍從黃海南部到東海、南海以及太平洋。據稱3日在西太平洋有4支中國海軍艦隊航行。據悉，中國多在年底開展軍事訓練，台灣方面正持續關注。我國國防部則表示，國軍運用聯合情監偵手段，可有效掌握共軍動態，並適切應處。總統府發言人郭雅慧也說，中國這樣的軍事行動不單單只有局限在印太區域上，共軍分佈是從黃海以南，還有在釣魚台東海往南海，甚至於在西太平洋都有所分佈。她說，這確實對於印太、整個區域造成威脅跟影響。郭指出，賴總統責請國防部，還有國安相關單位都要有完整掌握、及時回報。她強調，國家安全無虞，這部分國人可以安心，政府也有信心可以把這部分做好。熱門賽事、球星動態不漏接    ,https://news.ltn.com.tw/news/politics/breakingnews/5268838
北市議員憂禁小紅書影響微型電商生計 消保官建議網購選國內大型電商,政治,2025/12/05 15:11,內政部昨宣布封鎖小紅書。（路透社）因防詐因素，內政部昨（4日）宣布封鎖中國社群平台「小紅書」。北市議員張斯綱今指出，支持政府打擊詐騙，但台北市大量依賴該平台進行行銷的微型電商、個人工作室及新媒體創作者瞬間失去營生工具，要求產業發展局、法務局介入，啟動產業評估衝擊並輔導。產發局表示，北市數位企業發展中心有提供跨境電商輔導服務，可視需求轉介平台。法務局指出，小紅書為境外社群，且非典型電商，求償風險高，建議消費者優先選用國內大型電商平台。張斯綱指出，台北市是數位行銷與新創產業的重鎮，許多經費有限的年輕創業者、美妝博主、代購業者，長期將「小紅書」作為導流與維繫客戶的主要管道。而中央說斷就斷，也讓業者措手不及，不僅已投放的廣告預算泡湯，更面臨訂單無法出貨、客戶聯繫中斷的「斷鏈」危機。請繼續往下閱讀...他指出，許多年輕人哀鴻遍野，如今平台連線受阻，部分消費者找不到賣家，賣家也無法履約，極可能引發恐慌性退款與詐欺誤會，北市府應立刻緊急因應，包含啟動災損評估、輔導數位轉型、預防消費糾紛等。產發局表示，「台北數位企業發展中心」針對中小企業長期提供跨境電商、數位行銷與平台經營的專業輔導服務，商家或民眾有相關需求，皆可洽詢數位企業發展中心，將提供一對一諮詢，並視個別情形協助轉介至其他合適電商平台。台北市簡任消保官葉家豪表示，小紅書為境外社群平台，且非典型電商網購平台，小紅書上賣家可能多數都在境外，發生退貨、退款或履約爭議時，聯絡不易且可能不適用我國消費者保護法，求償風險較高。他建議，網路購物時，優先選用國內合法具信譽電商平台。針對小紅書平台上成立的交易關係，建議消費者可先以其他聯繫方式，與賣家聯繫確認後續履約情形；若賣家為國內業者，而未如期交付且以信用卡方式支付款項者，可向發卡銀行申請爭議款，或向各縣市政府消費者服務中心提起申訴，以保障自身權益。熱門賽事、球星動態不漏接    ,https://news.ltn.com.tw/news/politics/breakingnews/5268791
逕付二讀！藍營修「衛廣法」若過關 中天直接重返52台,政治,2025/12/05 15:06,國民黨立院黨團提出「衛星廣播電視法」部分條文修正草案，若三讀通過已無執照的中天又會回到原來的52台。（記者方賓照攝）國民黨立院黨團提出「衛星廣播電視法」部分條文修正草案，被稱「 中天條款」，增訂駁回申請的行政處分經撤銷，主管機關應回復原頻道位置及其它權利，若三讀通過，已無執照的中天又會回到原來的52台。國民黨團擬具「衛星廣播電視法部分條文修正草案」，其中最被爭議的點在於第18條、第19條。第18條修正條文為「主管機關對於新聞台換照申請，應以准予換照為原則。衛星廣播電視事業及境外衛星廣播電視事業之分公司或代理商，於執照期間，符合下列要件時，主管機關不得駁回其換照申請」。請繼續往下閱讀...第19條第4項、第5項修正條文，「申請遭駁回的衛星廣播電視事業及境外衛星廣播電視事業之分公司或代理商，如提起行政救濟，於行政救濟程序終結前，執照仍為有效，原頻道位置及其他權利不受影響」；「駁回申請之行政處分經撤銷、廢止或因其他原因失其效力或滅失後，主管機關應回復原頻道位置及其他權利」。這項修正草案若未來三讀通過，效力會溯及既往，適用行政救濟程序終結前的案件，被稱作「中天條款」。中天新聞台在2020年換照時，國家通訊傳播委員會（NCC）以內控自律失靈、違規過多，否決換照，行政訴訟目前仍進行中。我國衛星頻道要經有限通路，一是像MOD的平台、一是有線系統，過去都有要求若業者要用頻道呈現，就要有頻道執照，若主管機關不予換執照，頻道就不能上架。若這項修正草案三讀通過，等於是直接用法條賦予中天新聞台權利，即使仍在行政救濟期間執照仍有效，若行政救濟訴訟期間長達5年、10年，執照也會一直有效。法界人士認為，這等於直接破壞權力分立的原則，立法權直接輾壓行政權和司法權。對此，國家通訊傳播委員會（NCC）表示，尊重立法院，相信立法院會做出符合法治國原理的睿智決定。熱門賽事、球星動態不漏接    ,https://news.ltn.com.tw/news/politics/breakingnews/5268824
藍白為禁用小紅書急跳腳 吳思瑤打臉：修法打詐是朝野共識,政治,2025/12/05 15:05,內政部與刑事局4日宣布，對小紅書啟動「網際網路停止解析與限制接取」命令，封鎖期間暫定一年。（路透）中國社交軟體「小紅書」2年來涉入1706件詐騙案，內政部昨宣布啟動「網際網路停止解析與限制接取」，藍白質疑政府箝制言論自由、連台灣都要翻牆。對此，民進黨政策會執行長吳思瑤今（5日）指出，《打詐條例》是立法院朝野通過的法律，要求各網絡平台配合政府辦案需要並提供資訊，別人都照做、只有小紅書毫不配合，因此不該給予特權。內政部與刑事局昨天宣布，即日起對小紅書發布暫定1年的「網際網路停止解析及限制接取命令」，用戶使用小紅書將會頻繁出現無法加載情形；內政部並強調，小紅書有隱私外洩疑慮，呼籲國人不要使用。請繼續往下閱讀...對於在野黨反彈，吳思瑤今表示，打詐和資安很重要，大家都要政府硬起來，網路詐騙案就是新型詐騙的大宗，非管不可。Google、Meta、Line能做到，為什麼小紅書做不到？小紅書不守法落地，不配合犯罪偵查，不保護用戶資安，成為詐騙犯罪的破口，「小紅書被禁，不是因為來自中國！」吳思瑤說，《打詐條例》是立法院朝野通過的法律，政府強化打詐是全民共識，也是跨黨共識；防治網路詐騙，各黨立委都一再質詢監督強化政策作為，要求各網絡平台要配合政府辦案需要，提供資訊、接受管理。別人都照做，只有小紅書毫不配合，政府溝通無效，被迫採取最終手段。吳思瑤強調，打詐這麼重要，就要一視同仁，不應有例外、不該給特權，要向詐騙集團宣戰。民進黨立委沈伯洋也說，當台灣執法單位要幫忙追查詐騙案件，要幫人民討回公道時，Meta、Google等平台願意配合台灣執法單位調資料，小紅書卻是已讀不回；若小紅書一直已讀不回、在台灣沒有落地，將變成詐騙溫床又無法處理，政府為了保護民眾的財產安全，只好祭出限制接取等措施。熱門賽事、球星動態不漏接    ,https://news.ltn.com.tw/news/politics/breakingnews/5268833
