Title,News_Type,date,content,url
日本雙颱襲擊+梅雨鋒面炸雨 災情頻傳已釀3死,國際,2026/06/27 23:49,米克拉興無花果雙颱襲擊日本，加上梅雨鋒面炸雨，千葉縣車輛宛如陸上舟。（歐新社）受到今年第7號颱風「米克拉」與第8號颱風「無花果」以及梅雨鋒面帶來的豪雨影響，日本多地傳出淹水、土石流災情，截至當地時間今晚7時，已經有3人喪命、數人受傷。日本放送協會（NHK）、共同社和讀賣新聞報導，山口縣平生町昨天晚間7時45分左右發生土石流災情，當地消防單位接獲民眾通報稱「發生土石流，房子塌了」。請繼續往下閱讀...當地消防部門表示，1名70多歲男性住戶被捲入土石流一度失蹤，雖於今天下午尋獲，但送醫後仍宣告不治。另有3位居民送醫，2名40多歲和70多歲的女性分別受重傷，1名20多歲男性受輕傷，3人送醫時皆意識清醒。平生町政府指出，土石流事發地點從25日晚間起，便持續降下斷斷續續的暴雨，可能因此導致地層鬆動。愛媛縣西條市的加茂川今天下午也發生一起意外，3位50至60歲左右、正在進行立式划槳的男子遭溪水沖走。愛媛縣警方透露，3人雖已全數被救起並送醫，但其中2人宣告不治。據了解，事發現場因颱風影響，河川水位暴漲且水流相當湍急。根據警方調查，這3人互為朋友，事發當時他們都有穿著救生衣。另外，廣島縣福山市山區一處農業用埤塘今天凌晨發生潰堤，大量蓄水傾瀉而下，導致16棟住宅有淹水災情。福山市政府表示，目前並未傳出人員受傷。根據日本氣象資訊網站tenki.jp，截至今天下午5時，許多地方的72小時累積降雨量突破100毫米，其中千葉縣君津市坂畑263毫米、千葉縣銚子市243.5毫米、靜岡縣石廊崎245毫米皆刷新當地6月份歷史最高紀錄。截至下午5時30分，千葉縣、神奈川縣、靜岡縣與伊豆群島仍持續發布第4級土石災害警報。交通運輸系統方面，截至晚間9時，日本JR各公司表示，包含東海道新幹線、東北新幹線、北陸新幹線在內，各條新幹線目前都維持正常行駛。但在傳統鐵路部分，JR東日本指出，已有部分區間停駛。今日「全天停駛」的區間，包括總武本線佐倉站至銚子站區間、成田線成田站至銚子站區間、內房線君津站至安房鴨川站區間、外房線上總一之宮站至安房鴨川站區間、久留里線木更津站至上總龜山站區間等。日本道路交通情報中心宣布，截至晚間7時15分，高速公路部分路段實施封閉。主要影響範圍集中在千葉縣內的首都圈中央連絡自動車道，以及東京灣跨海公路連絡道等路段。日本國內各大航空公司則說，東京羽田機場往返和歌山縣南紀白濱機場的部分航班，以及所有往返伊豆群島八丈島機場起降航班今天都將取消。日本氣象廳的資訊顯示，颱風「米克拉」與「無花果」稍早已經減弱為溫帶性低氣壓。不過，由於關東地區與伊豆群島歷經先前降雨，部分區域地層已出現鬆動跡象，氣象廳呼籲民眾，仍須對土石流等災害保持高度警惕。（編譯：黎婧/核稿：陳彥鈞）1150627    ,https://news.ltn.com.tw/news/world/breakingnews/5486395
北京最高樓「中國尊」遭撞！20年來小飛機直升機失事 路透全揭露,國際,2026/06/27 23:21,中國北京最高大樓中信大廈（中國尊）被小飛機撞破。（美聯）目擊者表示，一架車輛大小的飛機昨天撞上北京最高建築。中國首都空域管制嚴格，事件實屬罕見。根據民航主管機關和中國國營媒體報導，路透社整理北京過去20年涉及小型飛機或直升機的部分失事紀錄如下：請繼續往下閱讀...●2022年7月6日：一架觀光直升機在北京昌平區和房山區之間飛行時墜毀，機上兩名機師罹難。●2018年7月30日：一架民用直升機因駕駛失誤，在北京朝陽區某村莊一處停車場墜毀，機上4人受傷。●2015年6月6日：一架小型訓練直升機墜落密雲水庫，造成兩人喪生。●2014年4月10日：一架小型訓練飛機墜入密雲水庫附近河流，導致一名機師死亡、另一人受傷。●2011年8月17日：一架警用直升機執行搜救演練返航途中墜入密雲水庫，5名機組員中有4人罹難。●2008年7月12日：一架直升機在偏遠的平谷區執行農藥噴灑作業時撞上高壓電線後墜毀起火，一名機師身亡。    ,https://news.ltn.com.tw/news/world/breakingnews/5486293
黑煙竄天際！輕航機撞「北京最高樓」 隔日不到2公里傳大火,國際,2026/06/27 23:04,"離中信大廈（後方最右側）不到2公里的東四環華貿橋附近，今日發生火災。（翻攝自X@whyyoutouzhele）昨（26日）才發生輕型飛機撞北京第一高樓「中信大廈」（中國尊），今（27日）下午5時左右，離中信大廈不到2公里的東四環附近傳出火災。由於地點與飛機撞擊大樓的敏感區域高度重疊，引發北京市民恐慌與網路熱議。綜合中國社媒，北京市朝陽區高碑店鄉熏皮廠村北門附近、即東四環華貿橋一帶於今（27日）下午5時左右傳出火警。從流出的現場影像可見，火災現場火勢猛烈，大量黑煙直竄天際，即便從數公里外的遠處，也能看見黑煙將天空染黑，畫面駭人。請繼續往下閱讀...北京市消防隊隨後趕赴現場處置，晚間宣稱火勢已受到控制，無人員傷亡，目前正在進行火場清理，起火原因待調查。值得注意的是，這起火災之所以引發廣泛關注，是因為起火地點離遭輕型飛機撞擊的「中信大廈」直線距離不到2公里，且兩者皆位於北京朝陽區中央商務區（CBD）附近。種種巧合引起中國網友強烈猜測，「經過昨天，保安層級應該大為提升，居然又發生意外」、「不會真的以為這些都是意外事故吧？為啥剛好在發布15人人大代表免除資格的時候呢？」、「在僵化倒退的政權下，這樣的事情會更多，將面臨新的挑戰。」、「這感覺像一連串恐怖襲擊一樣」、「東四環華貿橋起火離中信大廈這麼近，連續出事太蹊蹺了」。6月27日，北京东四环华贸桥附近起火，距昨日遭飞机撞击的中信大厦不足2公里，现场冒出大量浓烟 pic.twitter.com/4kfIduk9MJ— 李老师不是你老师 （@whyyoutouzhele） June 27, 2026 6月27日，北京东四环华贸桥附近起火，距昨日遭飞机撞击的中信大厦不足2公里，现场冒出大量浓烟 pic.twitter.com/4kfIduk9MJ【网友投稿：中国尊附近再现浓烟？】6月27日下午6时左右，北京中国尊附近的华茂桥冒起浓烟，现场有多辆消防车赶赴处置。有微博网友也发布了类似图片。由于前一天中国尊刚发生撞机事件，此次浓烟再次引发外界关注。目前，官方尚未通报具体情况。 pic.twitter.com/gnGDPqXu5N— 王局拍案 （@wangjupaian） June 27, 2026 【网友投稿：中国尊附近再现浓烟？】6月27日下午6时左右，北京中国尊附近的华茂桥冒起浓烟，现场有多辆消防车赶赴处置。有微博网友也发布了类似图片。由于前一天中国尊刚发生撞机事件，此次浓烟再次引发外界关注。目前，官方尚未通报具体情况。 pic.twitter.com/gnGDPqXu5N    ",https://news.ltn.com.tw/news/world/breakingnews/5486396
阿富汗6.0強震 鄰國巴基斯坦也有感,國際,2026/06/27 22:58,阿富汗興都庫什地區發生規模6.0強震。（歐新社資料照）歐洲與地中海地震中心（EMSC）通報，阿富汗今（27）日發生規模6.0強震，震央在興都庫什地區（Hindu ​Kush），首都喀布爾（Kabul）與鄰國巴基斯坦都有感。《路透》報導，歐洲與地中海地震中心測得這起地震的規模為6.0，深度約100公里；巴基斯坦北部的開伯爾-普什圖省（Khyber Pakhtunkhwa）也能感受到明顯搖晃，開伯爾-普什圖省斯瓦特縣（Swat）居民艾哈邁德（Daniyal Ahmad）告訴《路透》，當地居民在恐慌中奪門而出，「瓦特縣這裡地震超大，而且還持續很長一段時間。民眾從他們家裡跑出來，婦女與孩童因恐慌而啜泣。」請繼續往下閱讀...美國地質調查局（USGS）網頁顯示，這起地震發生在台灣時間27日晚間9點34分左右，規模為6.1，深度199公里，震央靠近朱爾姆（Jurm）。    ,https://news.ltn.com.tw/news/world/breakingnews/5486392
美國同盟軍演密集 專家：反映美安全承諾神聖不可侵犯,國際,2026/06/27 22:17,美國及其盟友近期在太平洋地區密集展開軍演。示意圖。（美聯社）亞洲太平洋地區近期不約而同舉行軍事演習，其中又以美國領導，聚焦第一島鏈範圍的聯合軍演為主。「南華早報」引述專家分析，儘管無法斷定同步軍演的情況是否有意為之，仍反映出美國軍方對區域內盟友的安全承諾「神聖不可侵犯」。近期演習包括，由美國陸戰隊與菲律賓聯合主導，在菲國最北端領土巴丹群島省巴丹島的「海上戰士合作」（Kamandag）演習，約投入2000名軍力，旨在提升戰鬥準備、聯合行動和情報共享能力，日本亦低調部署菁英空降旅參與空降演習環節。請繼續往下閱讀...美國與日本同時期在九州、沖繩啟動「堅毅之龍」（Resolute Dragon）演習，參與人數達9000名，專注於防衛日本西南部群島任務。橫跨關島及北馬里亞納群島周邊水域的「勇敢之盾」（Valiant Shield），演習人數達1萬名，也是美國首場部署「泰風」（Typhon）中程飛彈系統的軍演。兩年一度在夏威夷展開的大規模軍演「環太平洋」（RIMPAC），從31國動員超過2.5萬人，一路演訓至7月31日，目的為強化海洋合作，以及維護印度－太平洋自由開放。台灣也在此時期在桃園進行「立即備戰操演」，檢驗10萬名軍力的迅速動員能力。澳洲智庫「洛伊研究所」東南亞計畫主任馬斯頓向南華早報指出，近期的行動模式凸顯出華盛頓第一島鏈政策的優先項目，「對美國太平洋司令部而言，美國對第一島鏈沿線盟友的安全承諾神聖不可侵犯。」    ,https://news.ltn.com.tw/news/world/breakingnews/5486348
洗刷海洛因最大供應國污名！緬甸焚毀逾50噸繳獲毒品,國際,2026/06/27 21:47,"緬甸26日在仰光郊區、曼德勒及撣邦首府東枝等地，焚毀50多噸非法毒品，估黑市價高達新台幣192億元。（美聯社）響應聯合國「國際禁毒日」（禁止藥物濫用和非法販運國際日），緬甸當局於昨（26日）在仰光郊區、曼德勒及撣邦首府東枝等地，同步公開焚毀該國查獲的50多噸非法毒品，估黑市價高達6.03億美元（約合新台幣192億元），不僅創下緬甸歷年反毒紀錄，銷毀的總價值更是去年的兩倍以上。根據《華盛頓郵報》，仰光緝毒警察部隊中校昂密索（Aung Myat Soe）表示，光是仰光一地就集中焚毀了海洛因、鴉片、K他命與冰毒等，高達31種不同類型的化學毒品。請繼續往下閱讀...他透露，這批多達50噸的龐大毒品，絕大多數源自今年1月軍警部隊，在撣邦北部地區的突擊行動。當時警方在叢林深處破獲了12處製毒工廠，起獲該國史上最大批的化學原料、加壓設備與毒品成品。雖然軍政府高調藉由這次燒毀行動，向國際宣示打擊犯罪的決心，但專家與聯合國官員仍普遍抱持懷疑態度。專家直言，這50噸的查獲量，恐怕只是緬甸實際毒品產量的冰山一角。自2021年緬甸軍事政變爆發以來，該國陷入全面內戰，中央法治徹底真空。經濟崩潰導致邊境農民重操舊業廣種罌粟，使得緬甸在近年再度超越阿富汗，重登全球海洛因最大供應國；同時，現代化化學毒品的工業化生產，更是不減反增。Myanmar burns $525 million of illegal drugs; thick black smoke blankets Yangon city Massive drug destruction marks UN anti-drug day Officials say destroyed volume highlights growing drug crisis @BislaDiksha tells you more pic.twitter.com/OQObHhUbUz— WION （@WIONews） June 27, 2026 Myanmar burns $525 million of illegal drugs; thick black smoke blankets Yangon city Massive drug destruction marks UN anti-drug day Officials say destroyed volume highlights growing drug crisis @BislaDiksha tells you more pic.twitter.com/OQObHhUbUz待焚毀的繳獲毒品。（歐新社）    ",https://news.ltn.com.tw/news/world/breakingnews/5486200
才簽框架協議  黎南又遭以色列無人機空襲,國際,2026/06/27 21:38,"黎巴嫩媒體表示，以色列今日又空襲黎巴嫩南部地區。（路透）黎巴嫩媒體表示，以色列今（27日）又空襲了黎巴嫩南部地區，傷亡情況未知。而以色列與黎巴嫩昨（26日）才在美國斡旋之下，簽署了一份攸關雙方和平的初步框架協議。《路透》報導，黎巴嫩官媒指出，一架以色列無人機攻擊了黎巴嫩南部的納巴蒂耶福卡（Nabatieh al-Fawqa）地區，報導中未說明傷亡情況。請繼續往下閱讀...為了防止真主黨攻擊以色列北部地區，以色列出兵佔領部分黎巴嫩南部領土，建立「緩衝區」。納巴蒂耶福卡位於「緩衝區」之外。以色列軍方告訴《路透》，由於以軍在當地並無部隊可部署，因此使用無人機執行了這次行動，攻擊目標是一名對以軍造成威脅的「個體」，但以軍並未提供進一步細節。    ",https://news.ltn.com.tw/news/world/breakingnews/5486342
韓媒指「台灣人其實很窮」？ 網路掀兩派論戰,國際,2026/06/27 21:31,韓媒報導台灣經濟引發網路熱議。台北示意圖。（路透）隨著AI產業發展，台股不斷寫下歷史。但一般人是否也同步感受到經濟成長，時常引發熱議。有網友在社群發文說，韓媒近期一系列報導指稱台灣人「其實很窮」，文章一出引發兩派討論。原PO日前在「Dcard」發文說，韓媒最近進行一篇系列報導，標題為「富裕的台灣 貧困的台灣人」，報導稱台灣GDP成長超過9％，創下48年新高，但消費者信心指數卻降到2023年後新低等。報導還起到，除了科技業，許多傳統產業無法享受到這些經濟成果。另外，高房價也把年輕人推到外圍「蛋殼區」，台灣就是韓國提前到來的未來。原PO問，「不知各位怎麼看？」請繼續往下閱讀...文章一出，引發兩派爭論。一派網友認為有道理，紛紛留言：「確實阿！但一堆玻璃心的人不願意面對事實」、「不然你真的以為台灣有錢的那麼多嗎？」、「不就事實嗎」。但也有網友說：「韓國沒資格說」、「韓國人自己都說朝鮮地獄」、「科技業繳了一堆稅，政府才能補貼各項建設」、「這樣說很不公平，電子業工程師薪資高，也是用命在換」。針對南韓、台灣不同，前桃園市議員王浩宇今天也在臉書發文說，韓國總體產業確實較為多元。民眾能輕易說出韓國的汽車品牌（現代、起亞）或知名娛樂文化產品，但台灣的出口幾乎就是由科技業主導。然而，韓國科技業的「致命傷」就在於過度集中於記憶體晶片。當全球景氣好、記憶體價格高時，韓國經濟就會跟著暴衝；但當庫存過剩、價格崩跌時，韓國股市與出口就會遭受重創。相比之下，台灣擁有台積電（晶圓代工）、聯發科（晶圓設計）、廣達與鴻海（AI 伺服器）等高黏著度的完整生態圈，這造就了台灣在面對全球經濟震盪時，擁有比韓國更強的剛性支撐。    ,https://news.ltn.com.tw/news/world/breakingnews/5486219
瑞士衝上38.8度破紀錄 「冰河流失日」臨界點提早3個月來臨,國際,2026/06/27 21:17,熱浪導致瑞士冰河前一個冬季回補冰雪量融化殆盡。（法新社檔案照）當前歐洲熱浪頻創最高溫紀錄，瑞士連兩日打破該國有史以來6月高溫紀錄。同時，極端高溫正加速瑞士冰河融化，預計去年冬季累積的冰雪將在29日全部融化，是迄今紀錄史上，這個被稱為「冰河流失日」的臨界點，第二早提前來臨。法新社報導，瑞士國家氣象局表示，瑞士北部城市巴塞爾，26日下午3時測得攝氏38.8度，創下瑞士自1897年有紀錄以來最高溫紀錄，也打破同一測站前一天才改寫的38度紀錄。氣象局發文表示，「這波熱浪持續未減」，27日巴塞爾甚至不排除出現攝氏40度。請繼續往下閱讀...連續高溫最直接的衝擊正在瑞士冰河發生。瑞士「瑞士冰河監測」計畫（GLAMOS）負責人、冰河學家胡斯（Matthias Huss）表示，目前這波熱浪，加上5月已出現過一波高溫，又碰上剛過去的北半球冬季降雪偏少，預估上一個冬季累積的冰雪量，到29日將全部融化。這代表達到所謂「冰河流失日」（glacier loss day）臨界點。從這天開始到10月這段期間的冰河融化，不再只是消耗前一個冬季回補的冰量，而是影響瑞士阿爾卑斯山脈整體冰河規模縮小。根據2000年以來的資料，此前瑞士的冰河流失日，僅一次發生在更早時間點，是2022年的6月26日。相較之下，本世紀平均約在8月中旬才達到此臨界點，這已非好事，但胡斯說，今年達到臨界點的時間「比健康狀態早了3個月」。近日才視察隆河冰河（Rhone Glacier）狀況的胡斯說，距離上次造訪僅時隔10天，這條冰河垂直方向就消融了1公尺，「這正是熱浪的影響」。胡斯表示，冰河目前狀態「非常糟」是匯集多項不利因素所致，而今年的情況與2022年「令人驚訝地相似」，冰河表面回補的冰雪量，比2010年到2020年平均值少25%。他強調，單一波熱浪並不是最大問題，關鍵是高溫持續太久，不管是攝氏35度或40度，持續多日的極端高溫，都對冰河非常不利。    ,https://news.ltn.com.tw/news/world/breakingnews/5486339
西歐熱浪肆虐！冷卻用河水溫度飆高 瑞士關閉核反應爐,國際,2026/06/27 21:11,歐洲最古老核電廠、瑞士的貝茲諾（Beznau）核電廠。（法新社）西歐部分地區今天因致命熱浪肆虐，多達1億5000萬人承受攝氏35度高溫，街頭派對與音樂節紛紛取消，酒類銷售也受限。德國測得史上最高溫41.3度，瑞士核電廠反應爐也被迫關閉。法新社報導，英國和法國的衛生當局警告，醫療院所運作因高溫而承受壓力，同時急救電話又激增。請繼續往下閱讀...西班牙已通報數十起與高溫有關的死亡事件，法國也傳出數十人因避暑而溺斃，另有數名嬰兒因被留在悶熱的車內而不幸身亡。根據德國氣象部門初步資料，德國今天出現有記錄以來最高氣溫攝氏41.3度。且預報顯示，這週末氣溫可能再創新高。英國與瑞士同樣刷新各自6月最高溫記錄。英格蘭東部來到攝氏37.3度，位於瑞士西北部的巴塞爾（Basel）則測到攝氏38.8度。歐洲最古老核電廠、瑞士的貝茲諾（Beznau）核電廠營運商表示，由於熱浪導致冷卻用的河水溫度飆高，因此將反應爐關閉。歐洲聯盟（EU）氣候監測機構「哥白尼氣候變化服務」（Copernicus Climate Change Service）副主任勃吉斯（Samantha Burgess）指出，炎熱天氣是來自北非的空氣滯留形成的「熱穹」（heat dome）造成。雖然西歐部分地區今天氣溫略有下降，但更東邊的國家警告，最嚴峻的高溫尚未到來。捷克與匈牙利已針對週末發布紅色高溫警報，預估氣溫最高將達攝氏40度。巴爾幹半島各國未來幾天也預料將面臨令人難耐的高溫。    ,https://news.ltn.com.tw/news/world/breakingnews/5486276
伊朗續轟巴林、再傳油輪遇襲 荷姆茲安全風險升高到「重大」,國際,2026/06/27 20:34,26日荷姆茲海峽上的船隻。（路透）美國26日對伊朗發動空襲，回應伊朗無人機攻擊穿越荷姆茲海峽的長榮海運旗下「長麗輪」貨輪；伊朗隨後對美軍據點發動報復攻擊，27日攻擊巴林，同日荷姆茲海峽再有一艘油輪遇襲。伊朗無人機27日攻擊美國海軍第五艦隊駐紮地巴林，巴林外交部聲明，譴責「數架伊朗無人機」攻擊該國，是「公然地威脅其公民和居民安全」。另外，英國軍方「英國海事貿易行動辦公室」（UKMTO）指出，同日在荷姆茲海峽再有一艘油輪遇襲，船橋受損，但船員均平安、也未傳出環境污染情事。請繼續往下閱讀...就在傳出這起油輪遇襲事件後，美國海軍監管的多國海事機構「聯合海事資訊中心」（Joint Maritime Information Centre）將該海域的安全威脅提高到「重大」（substantial），並表示已擴大靠阿曼一側航道，以容納進、出海峽的雙向交通。伊朗27日這波攻擊顯然是延續前一夜對美軍空襲行動的回應。美軍中央司令部表示，26日空襲伊朗飛彈、無人機儲存地點和沿岸雷達陣地，這是對前一天伊朗自殺式無人機「無端攻擊」懸掛新加坡旗、正在通過該海峽的長麗輪（M/V Ever Lovely）的「強力回應」。中央司令部指控伊朗攻擊行徑「清楚地違反停火」。這是美伊兩國上週簽署旨在結束戰爭的諒解備忘錄後，首度互轟。雙方互控對方違反停火協議，美國副總統范斯警告德黑蘭，若再有進一步攻擊，會以武力回應。    ,https://news.ltn.com.tw/news/world/breakingnews/5486310
荷姆茲海峽又傳油輪遇襲 海事機構：船員安全艦橋受損,國際,2026/06/27 20:34,週六又傳出有油輪在荷姆茲海峽遭到攻擊，英國海事風險管理公司先鋒指出，遭受攻擊的船隻是懸掛巴拿馬旗幟的「基庫號」油輪。（擷取MarineTraffic）英國海事安全機構通報，今（27日）又有油輪在荷姆茲海峽遭到攻擊，所幸船員均平安無事，未傳出傷亡情況。綜合《法新社》、《路透》報導，英國海事貿易行動辦公室（UKMTO）在聲明中指出，「遇襲船隻的艦橋受損，全體船員平安無事。」請繼續往下閱讀...根據英國海事風險管理公司先鋒（Vanguard）的說法，這艘遭受攻擊的船隻，是懸掛巴拿馬旗幟的「基庫號」（KIKU）油輪。伊朗並未對個別船隻遭遇攻擊的事件，發表直接聲明，但伊朗官媒報導，針對未徵得伊朗許可，就企圖穿過荷姆茲海峽的船隻，伊朗革命衛隊已給予「警告射擊」。    ,https://news.ltn.com.tw/news/world/breakingnews/5486291
