Title,News_Type,date,content,url
玻璃碎一地！皮卡深夜撞進修車場 高雄男酒駕送辦,社會,2025/09/26 07:32,高雄一部皮卡車深夜撞入修車廠。（讀者提供）高雄市楠梓區秀群路與加昌路口，一間打烊的汽車修理廠昨天深夜被一部皮卡車撞入，門窗玻璃碎落一地，所幸無人受傷，40歲駕駛簡男經酒測超標，被依公共危險罪嫌移請橋頭地方檢察署偵辦。警方表示，該事故為40歲簡姓男子駕駛皮卡車，沿秀群路北往南行駛，行經加昌路口時，車輛直接撞入路旁汽車修理廠內，當時車場已打烊，到場處理員警發現簡男散發酒氣，經酒測酒精值超標。請繼續往下閱讀...楠梓分局呼籲酒後駕車害人害己，除對自己及他人安全造成危害，更要面臨刑罰及最高12萬元罰鍰，移置保管車輛並吊扣駕照，另需參加道安講習，提醒勿以身試法，得不償失。熱門賽事、球星動態不漏接    ,https://news.ltn.com.tw/news/society/breakingnews/5191399
因遺產起爭執  姊當警察面倒車撞親妹,社會,2025/09/26 06:47,因遺產起爭執，郭女當著警察面前倒車撞親妹。（取自司法院網站）新竹縣在科技業上班的郭女，與妹妹因父親遺產起爭執，不顧警察在場，明知妹妹站在車後方，仍執意倒車而碰撞，新竹地院依傷害罪將郭女判刑。法官調查，去年10月22日清晨6點多，郭女與妹妹因父親遺產歸屬問題起爭執，在郭女位於新竹縣竹北市居所旁、以鐵皮搭蓋半開放式車庫外，妹妹見郭女駕駛原為其父所有的小客車準備外出，遂站在車後方欲阻止郭女駕車離去。請繼續往下閱讀...郭女見狀未加理會，竟基於傷害犯意，駕車以緩慢倒車方式碰撞妹妹，致妹妹受有下腹挫傷、左上肢疼痛無明顯外傷、左膝疼痛無明顯外傷等傷害。郭女矢口否認有何傷害之犯行，稱車上有倒車顯影，她沒有看到妹妹，且倒車時車子也沒有警示，真的不曉得妹妹在後面，也沒有必要當著警察面去衝撞妹妹，但沒有看到妹妹是她的過失，她承認過失傷害。法官認為，當時妹妹站立位置在車輛後方偏左，車上的倒車顯影及倒車警示聲，絕不可能沒有顯示或動作。即便倒車安全輔助系統未能發生作用，郭女上車前即已知妹妹欲阻擋其駕車外出，且妹妹也已站在車輛後方偏左，站立位置並非在車輛視線盲區，郭女應該可以從左右後視鏡及照後鏡中發現妹妹站立車後，卻仍賭氣執意緩慢倒車而碰撞到人，其主觀上有傷害妹妹的故意，堪可認定，其辯詞毫不足採。法官審酌郭女為智識成熟之成年人，遇有衝突紛爭，理應循理性方式解決，竟捨此不為，而對妹妹做出傷害犯行，所為實不足取，考量郭女始終否認犯行，犯後態度非佳，最後依傷害罪判處拘役20天，得易科罰金。熱門賽事、球星動態不漏接    ,https://news.ltn.com.tw/news/society/breakingnews/5191388
教女學生做棉花糖趁機摸臀 色攤販無罪逆轉判刑定讞,社會,2025/09/26 06:43,林姓男子教女學生做棉花糖，涉嫌觸摸臀部。示意圖。（資料照）高市林姓男子在某高中旁，擺攤車販售棉花糖，涉嫌假藉教導製作，趁機觸摸女學生臀部，高等法院高雄分院審理後大逆轉，依違反性騷擾防治法，判處徒刑3月，得易科罰金，並經最高法院維持定讞。檢方指出，林男在高雄某高中學校旁，擺設攤車販售棉花糖，明知未滿18歲穿著運動服學生甲女，前往購買棉花糖時，竟表示要教她製作棉花糖，並於製作過程中，涉嫌乘機以手撫摸她背部及臀部。警方接獲甲女報案，傳喚林男到案說明，製作筆錄後，依涉嫌違反性騷擾防治，函送高雄地檢署偵查、起訴。林男應訊辯稱，只有牽她的手製作棉花糖，沒有摸背部及臀部，否認犯行。高雄地院開庭調查後，判決林男無罪，但檢方不服上訴，高雄高分院據甲女和多名證人指證，認定確有觸摸等不當行為，依違反性騷擾防治法，判處有期徒刑3月，如易科罰金，以1000元折算1日，並經最高法院駁回定讞。熱門賽事、球星動態不漏接    ,https://news.ltn.com.tw/news/society/breakingnews/5191383
幻想在拍「警匪片」 台南男持麵包刀攻擊員警,社會,2025/09/26 06:04,邱姓男子因思覺失調未服藥，幻覺導演要拍警匪片，持麵包刀揮砍警員致傷，法院判刑8月並裁定刑前監護2年。（民眾提供）邱姓男子因思覺失調症未服藥，誤以為自己正在拍攝警匪片，持麵包刀在住處揮舞，警方到場勸阻時，他拒絕放下刀械，還朝員警揮砍造成臉部撕裂傷。台南地院依妨害公務罪判刑8月，並裁定刑前監護2年。法院判決指出，邱男案發前3個月未規則服藥，受幻聽與妄想影響，堅稱「導演要我演警匪片」，因此認定警方無權干涉，反而把執法情境誤認為拍片場景。在徐姓員警試圖上前奪刀時，他竟揮刀攻擊，造成臉頰10公分切割傷。其供述內容與監視器畫面、密錄器影像及醫院診斷證明均能相互印證，法院認定事證明確。請繼續往下閱讀...邱男辯稱自己是遭警方攻擊才下意識反擊，但法官認為，員警當時依法到場處理報案，屬合法執勤，攻擊行為完全不能合理化，持刀揮砍執勤員警，構成強暴妨害公務與傷害罪，雖然兩罪為想像競合，法院從一重處斷，依妨害公務罪論科。精神鑑定結果顯示，邱男符合思覺失調症診斷，行為當時有幻聽「導演指令」干擾，認知與判斷能力顯著減低，但未達完全喪失。嘉南療養院鑑定報告認為，他多次因中斷藥物治療導致病情復發，且幻覺與妄想內容反覆與「警匪片」有關，過去亦有類似持刀襲警紀錄，顯示再犯風險極高。法官考量其攻擊造成警員傷勢不輕，且犯後否認犯行，態度難認良好，對公共安全危害很大，因此判刑8月，並在刑前先入醫療機構施以2年監護，以確保接受妥適治療，避免再次因幻覺妄想而行凶。熱門賽事、球星動態不漏接    ,https://news.ltn.com.tw/news/society/breakingnews/5191357
兩度縱火判無罪 思覺失調男管束2年未癒再延1年,社會,2025/09/26 06:02,姚姓男子2023年兩度縱火，因思覺失調症被判無罪並監護2年。期滿前醫院評估仍欠病識感、再犯風險高，台南地院裁定延長監護1年。（民眾提供）姚姓男子罹患思覺失調症涉嫌縱火，獲判無罪並監護2年。經醫院評估他仍沒病識感，台南地檢署聲請延長監護1年，律師引用「身心障礙者權利公約」認為有歧視疑慮，但台南地方法院依醫院鑑定判斷，裁定延長1年。姚男2023年10月間在陳姓被害人廠房縱火，以打火機點燃去漬油桶後丟向鐵捲門，火勢延燒，造成機具與機車熔損。兩天後，他又在兄長住宅樓梯處縱火，引爆去漬油罐，樓梯嚴重燒損。兩起事件均因消防及時撲滅，未使建物結構喪失效用，屬放火燒燬建築物未遂。請繼續往下閱讀...南院2024年5月判決認定，姚男案發時罹患思覺失調症伴隨酒精使用障礙，出現被害妄想與幻聽，完全喪失辨識能力，依刑法第19條屬不罰，判無罪並下令監護2年，送至高雄市立凱旋醫院執行。監護處分期滿前須評估是否續行，凱旋醫院2025年6月報告指出，姚男在藥物與治療介入下情緒平穩，近期未見暴力行為，但病識感不足，仍固著不實想法，對現實認知偏差，若提前解除監護，復發風險升高。奇美醫院審查後也支持續行。辯護人主張，檢方引用的監護評估意見與醫院報告不同，過於偏頗，且家庭支持不足並非法條延長要件，並引用「身心障礙者權利公約」認延長有歧視疑慮，請求駁回。法院最終認定，姚男雖經治療情緒趨穩，但病識感與現實感不足，家庭亦無力照顧，若貿然解除恐危害公共安全。為兼顧人身自由與社會防衛，裁定延長監護1年，並持續以藥物、心理治療及社區安置規劃降低再犯風險。熱門賽事、球星動態不漏接    ,https://news.ltn.com.tw/news/society/breakingnews/5191356
通緝犯高雄豪宅外遛狗 遭開16槍斃命／影武者藏柬指揮 助槍手坐桶子逃,社會,2025/09/26 05:30,高雄詐欺通緝犯羅天義在女友住處附近遛狗慘遭槍手開十六槍斃命。（資料照）高雄詐欺通緝犯羅天義在女友住處附近遛狗慘遭槍手開十六槍斃命，檢警專案小組經過一個多月抽絲剝繭，掌握槍手自北部南下埋伏狙擊，一直到幕後安排白牌車逃逸，最後疑似於九月二日藏匿漁船偷渡出境，過程全由影武者在柬埔寨指揮，檢警調查最後一塊拼圖於小琉球某漁船涉助槍手逃亡出境，專案人員昨日揮軍至小琉球帶回船長，但船長否認，檢方目前偵訊中。檢警調至小琉球帶回船長高市警方動員刑大等單位，包括南下犯案路線、狙擊後逃逸路徑，以及坐「桶仔」（CT2型漁船）等路線，全部都掌握監視影像，至少帶回十多名「白牌車」司機，以及買賣犯案BMW權利車的人頭、出金人士，直至九月中旬案情明朗。請繼續往下閱讀...檢警專案小組確定槍手由白牌車載往東港華僑市場附近臨海岸邊，海巡單位協助調出入漁船的監視畫面，發現逃逸的槍手一度出現，進而鎖定一艘漁船協助載走槍手駛往菲律賓方向，目前該漁船已返台靠泊在小琉球碼頭，檢警昨天出擊前往小琉球偵訊船長，目前仍在偵訊、搜索中。專案小組表示，死者羅天義於上月廿二日在高市左營區透天豪宅前遛狗，慘遭槍手狙殺十六槍，身中四槍不治，檢警專案小組懷疑命案和龐大的毒品利益糾葛有關，動員數百警力自北到南調閱路口監視器，連港口、山區監視器也不放過。檢警經一個多月追查，不斷與時間賽跑，帶回二、三十名涉案人員並羈押多人，只可惜還是讓凶手在九月二日坐「桶仔」離境，專案人員持續追查，不排除透過國際刑警組織繼續追緝歸案。☆自由時報電子報提醒您，防詐騙專線︰165，報案專線︰110☆高雄通緝犯遭槍擊命案凶嫌偷渡，檢警遠赴小琉球逮助逃共犯船長，槍手棄車逃逸。 （資料照）熱門賽事、球星動態不漏接    ,https://news.ltn.com.tw/news/society/paper/1725718
玷污3女、拍淫片散播 當庭扯謊╱檢斥孫生陷溺性癮 從重量刑,社會,2025/09/26 05:30,"孫生（左圖）捲入性侵醜聞，孫母（右圖）則犯下偷竊罪，母子二人先後遭起訴。（圖取自臉書、資料照）網紅「反骨男孩」前成員孫生，被控於二〇二二年至二〇二四年間，對二名女子及一名少女，犯強制猥褻、性交等行為，另與一名女子合意性交、經同意拍性影像後，竟將影片傳給朋友觀看；台北地檢署昨依刑法成年人故意對少年犯強制性交、強制猥褻、無故播送他人性影像及違反個資法等罪起訴孫生，並痛斥孫陷溺性癮、當庭扯謊，犯後態度惡劣，建請從重量刑。檢方調查，二〇二二年十月五日晚間，孫生前往一名成年被害者住處剪髮，竟在陽台強行猥褻被害者；隔年三月十六日晚間，他前往另一名被害者住處拍攝影片，隔日凌晨二、三時許突然撲上被害者的床鋪強行猥褻。請繼續往下閱讀...佯稱練舞性侵少女檢方查出，同年十月十三日晚間，孫以觀看他練舞為由，將少女帶回家中後，趁被害者專注聆聽音樂之際，強行性侵；去年七月八日晚間在北市林森北路某旅館房間與第四名成年女發生性行為後，經同意拍攝八部性影像，竟涉嫌將影片傳給朋友觀看。檢方痛斥，孫生陷溺性癮，漠視個人主題性及性自主權，或利用友誼信任或藉工作之便，強行玷污多名女性，且戕害未成年少女的身心及人格健全發展，事後一再諉稱對方不曾即時反映不適，慣以金錢或情緒勒索應付不從己意處境，卻未嘗細究自我中心思維之謬，以致積重難返。檢方並認為，孫生又將被害者性影像視為私有財產，恣意供他人觀看，造成被害者惶懼不安，時至今日面對司法程序仍未深切反省，當庭扯謊，甚至糾纏被害者要求配合偽證或拒決理會檢警以期脫身，犯後態度惡劣，建請從重量刑；孫生早在去年就被曾控性騷擾女性友人的閨密，一審台北地院依違反性騷擾防治法，判他五月徒刑，可易科罰金十五萬元。熱門賽事、球星動態不漏接    ",https://news.ltn.com.tw/news/society/paper/1725713
連孫生同學也偷 母子先後起訴,社會,2025/09/26 05:30,"孫生捲入性侵醜聞，孫母則犯下偷竊罪，母子二人先後遭起訴。（圖取自臉書、資料照）網紅團體「反骨男孩」前成員孫生，涉嫌性犯罪遭起訴，他的母親也「不遑多讓」！孫母不僅過去多次犯下竊盜罪入獄，去年底剛出獄不久，又在今年二月間涉嫌於台北市某店面，偷走他人內有現金八千元等財物的皮夾，士林地檢署日前依竊盜罪將她起訴。據了解，孫母曾被台北地方法院判處六個月有期徒刑，並與其他竊盜案件合併執行，總刑期達一年八個月，去年十一月才出獄。未料，才重獲自由三個月，今年二月三日便在台北市士林區一家販賣名床的門市，趁店員不注意時，涉嫌徒手竊走放在櫃檯上的藍色皮夾，內有現金八千元、健保卡及提款卡等物。檢方認為，孫母前科累累、屢勸不改，依法提起公訴。請繼續往下閱讀...孫母前科累累、屢勸不改網路資訊提及，孫生曾透露，自己小學時期曾借住里長辦公室，沒有床鋪只能睡在地板上；小學二年級時，一位同學來找他玩，身上帶的五百元不見了，結果他被誤認偷竊，遭到同學排擠，事後才發現是母親所為。熱門賽事、球星動態不漏接    ",https://news.ltn.com.tw/news/society/paper/1725714
捲入32年前女大生命案 DNA還清白 坐牢19年翻案 呂金鎧判無罪,社會,2025/09/26 05:30,呂金鎧今獲高院再審庭改判無罪，庭後和纏訟32年來支持他的4姊熱情擁抱。（記者楊國文攝）現年六十五歲的麵包師傅呂金鎧，卅二年前捲入女大生遭性侵殺害案，一度判死，他一路喊冤無效，更六審時被判刑廿年入獄，十九年後假釋出監尋求翻案。高等法院依最新的DNA-STR鑑定結果，認為呂應未犯案，加上同案死囚陳錫卿的指控證詞有瑕疵、呂控當初遭刑求等，昨天改判呂男無罪。一路喊冤無效 更6審判刑20年高院宣判後，呂男眼眶泛淚，感謝法官還他清白。台灣冤獄平反協會呼籲檢方不要上訴，若無罪確定將請求刑事補償金，最高可補償約三千四百萬元。高檢署表示，收到判決書再研議是否上訴。請繼續往下閱讀...檢警指控，犯下妨害風化罪的陳錫卿八十二年底假釋，投靠獄中認識、當麵包師的呂男，陳佯稱要聘英文家教，誘使家教中心安排的女大生前來面談，遭陳、呂二人性侵、勒死。一審將二人判死刑，呂男於更六審時被判刑廿年，他念及父母高齡，想早日回家，捨棄上訴後入獄。陳繼續上訴，更七審委託刑事局使用最新鑑定技術，鑑定出女大生下體無呂男DNA，陳則證據確鑿，二〇〇九年獲判死刑定讞。同案死囚稱 被刑求偽稱呂犯案呂獲假釋後，透過冤獄平反協會申冤及向監察院陳情，監察院報告指全案較可能是陳一人犯案；同案被告陳錫卿亦稱，因被刑求而偽稱與呂共同犯案，以求分擔罪責，聲請再審案獲准。高院再審庭認為，依DNA鑑定結果，不能證明呂對女大生強制性交，綜合事證後改判呂男無罪。熱門賽事、球星動態不漏接    ,https://news.ltn.com.tw/news/society/paper/1725628
律師光環當詐團保護傘／「台南仙塔」檢求刑8年罰500萬,社會,2025/09/26 05:30,律師何紫瀅過去接受訪問的畫面。 （翻攝台南律師公會網站）台南地檢署偵辦玉石投資詐欺案，焦點直指「台南仙塔」律師何紫瀅，她被控以事務所為簽約收款據點，以律師光環替詐團增加可信度，檢察官廖羽羚依加重詐欺、洗錢與組織犯起訴，求刑八年併科罰金五百萬元。二〇二四年八月起，歹徒在臉書與抖音經營多個直播與客服據點，對外宣稱投資原石能獲利或標售真貨，誘使被害人轉帳或面交。請繼續往下閱讀...有被害人因金額龐大，在去年十月間到何紫瀅的律師事務所面交現金一百多萬元，由何紫瀅當場收款並影印翡翠合約，隨即交給張姓共犯上繳莫姓主導者；何女並以翡翠都是真的會催促出貨等語安撫。其後認列何女就該次面交取得百分之一報酬，共一萬元。詐團的假買賣合約中，出現兩家公司「嶼麓供應鏈管理」與「永紳數位行銷」，前者在中國查無登記，後者未實際經營玉石買賣而被認定為人頭公司；合約同時載明法律顧問為詮律律師事務所何律師，以增加取信與提高收贓及洗錢成功率。此外，檢方揭露何紫瀅受詐團指示，曾以選任律師名義介入同案被告案件，利用陪偵取得偵查訊息並回傳上層，甚至以與本案無涉的開庭通知對外釋放訊息，檢方評述，此舉形同在司法與詐團間架設保護網，維繫集團運作，致主導者得以長期逍遙法外。檢方認為，何紫瀅背離職業倫理，以律師光環混淆視聽，動搖社會對司法的信任，依加重詐欺、洗錢與組織犯罪等罪起訴，在量刑意見建議中，對何紫瀅各次行為分別求六年徒刑，應執行刑八年併科罰金五百萬元，同時依刑法規定追徵不法報酬。☆自由時報電子報提醒您，防詐騙專線︰165，報案專線︰110☆熱門賽事、球星動態不漏接    ,https://news.ltn.com.tw/news/society/paper/1725717
休學女大生枯瘦脫皮亡 母拘禁致死聲押,社會,2025/09/26 05:30,大甲一處集合式住宅，傳出有住戶在家中死亡。（記者張軒哲攝）台中市大甲區雁門路一處集合式住宅，廿五日傳出一名廿一歲陳姓休學女大學生在家中死亡案件，由於陳女身材枯瘦脫皮，並無外傷，可能活活餓死在房內多日才被發現，父母雖強調並無凌虐情事，但檢方認為疑點重重，複訊後依涉刑法拘禁致死罪嫌重大，將媽媽詹女聲押，今天將解剖遺體，釐清死因。檢︰疑點重重 今解剖大甲派出所所長梁兆瑋表示，昨日上午九時許，五十五歲陳父慌張到派出所報案，稱其次女於家中臥房內死亡，分局鑑識人員立即到場勘驗，發現死者枯瘦，已明顯死亡多日，有脫皮情況，立即成立專案小組展開追查，現場經詢問相關人證後仍有諸多疑點尚待釐清，全案報請台中地檢署指揮偵辦。請繼續往下閱讀...母辯稱多日沒見女兒 發現已亡警方調查，陳女是家中次女，原本就讀大學，目前已休學，並未領有殘障手冊，父親在工廠上班，母親是家管，陳女的姊姊指稱妹妹是正常人，近日並無明顯異狀，五十歲陳母因多日沒見到女兒，才發現女兒房間反鎖，趕緊找鎖匙開門，驚覺女兒躺在床上已死亡，趕緊報警。警方指出，詹女稱女兒休學後，管教嚴格，坦承不讓女兒出房門，也不讓她使用手機，要女兒在房裡好好反省，但否認有凌虐或不讓女兒吃任何東西。但檢警認為疑點重重，不排除陳母涉嫌凌虐女兒，並將她拘禁致死，檢方訊後將陳母聲押調查。里長表示，因里內幅員遼闊，並不認識陳姓一家人，是警方通知里內有人死亡，才得知此事。大樓住戶指出，得知警方有來社區調閱出入監視器，想釐清死者最後進出社區時間，才詢問主委，因為跟這一家人並未互動，並不了解案情。熱門賽事、球星動態不漏接    ,https://news.ltn.com.tw/news/society/paper/1725715
死囚恩將仇報拖友下水╱陳錫卿開庭三度道歉 呂金鎧︰太慢了,社會,2025/09/26 05:30,呂金鎧昨獲高院改判無罪，庭後和四姊擁抱。（記者楊國文攝）六十五歲男子呂金鎧被控犯下三十二年前中興大學女學生遭性侵殺害案，高院更六審判刑廿年定讞，呂服刑十九年後假釋，向高院聲請再審獲准，昨獲判無罪，呂聆判後表示，「我真的沒有錯」，感謝法官相信他是清白的。同案被判死刑的陳錫卿出庭時三度向他道歉，呂說，「太慢了，我最寶貴的青春歲月已過了」。呂金鎧聆判後，在四姊呂秋容等親友、律師團、台灣冤獄平反協會及聲援者陪同下，為死去的女大生默哀卅秒。請繼續往下閱讀...呂金鎧表示，聽到法官宣判「無罪」，第一個感想只有「感恩」兩字，無法短時間說明這三十二年來的辛酸，心中最想告訴在天上的父母：「我沒有犯罪」。現在從事營造工作的呂金鎧，昨從花蓮玉里來台北聽判，他認為，一九九三年時的司法並沒有像現在這麼進步，感謝高院法官相信他是清白的，也給社會一個交代，他也才能告訴天上的父母「你們的兒子真的沒有錯，可以放心做天使」，並熱情擁抱四姊，感謝卅二年來纏訟期間，一路陪伴他到處奔波。對於同案被告陳錫卿當初誣指他涉案，呂金鎧說，對陳一定會有恨，「我三十二年來的冤屈，只有當事人才能體會」，高院再審庭上個月開庭提訊陳出庭，他共道歉三次，呂認為枉費他照顧過陳，陳竟恩將仇報，「我告訴他，向我道歉太慢了，最寶貴的青春歲月已過了」。呂秋容紅著眼眶說，聽到高院宣判呂金鎧無罪，不自覺流下淚來，三十二年來漫長歲月，每次開庭，即使工作要請假，她也一定會到場，「若弟弟被冤枉一輩子，我真的無法對天上的父母交代」。熱門賽事、球星動態不漏接    ,https://news.ltn.com.tw/news/society/paper/1725716
台版地面師案外案 新店戶政人員疑收賄查個資聲押禁見,社會,2025/09/26 03:10,新北市新店戶政事務所員工王子誼（圖中）因涉貪污，檢方今晨將她聲押禁見。（資料照，記者王定傳攝）記者王定傳／台北報導〕檢警調去年破獲全台首見的「台版地面師」偽造遺囑詐騙遺產集團，一審已判決44名被告有罪，檢調持續追查發現，新北市新店戶政事務所員工王子誼，疑收賄接受多家土地開發業者委託，擅查不動產所有人及繼承人戶籍資料；台北地檢署昨指揮調查局台北市調查處兵分20路發動搜索，約談王女及業者共14人，今日凌晨訊後依違反貪污治罪條例等罪聲押禁見王女。檢調調查，該集團首腦、全絨不動產公司負責人蔡尚岳，勾結律師兼民間公證人蔡鴻燊、法院書記官、里長、戶政辦事員、員警等公務員，偽造獨居老人代筆遺囑，過戶其不動產牟利，3年期間詐得近1.5億元。請繼續往下閱讀...台北地檢署去年起訴蔡尚岳等44人，一審台北地院今年7月判決，44人都有罪，其中，蔡尚岳判刑14年、蔡鴻燊重判25年、新北地院書記官游立綸判2年8月、新北市永和區永樂里長許政鎧判3年8月、安和里長鄧長安2年6月，台北市員警駱勁達4年、土城戶籍員葉濬誼2年10月。據了解，檢方去年行動時曾約談王女，訊後諭令20萬元交保，經持續追查發現，王女涉嫌從2014年至2024年，疑接受多家土地開發業者委託，查詢不動產所有人及繼承人戶籍資料，作為都更或土地開發之用，至於王女洩漏的戶籍資料、收賄金額，仍在釐清中。檢察官王貞元昨指揮台北處，持法院核發搜索票，搜索王女、13名業者的住居所及園禾、吉田、廣旭等建設開發公司共20處，並約談王女及業者14人，全案朝「貪污治罪條例」行收賄、「個人資料保護法」非法利用個人資料等罪嫌偵辦。熱門賽事、球星動態不漏接    ,https://news.ltn.com.tw/news/society/breakingnews/5191370
