Title,News_Type,date,content,url
盧秀燕要求為「收大便」道歉 國土署回應土方3配套,政治,2026/01/21 20:10,台中市長盧秀燕。（記者蘇金鳳攝）土方之亂引發關注，台中市長盧秀燕質疑國土署官員將土方形容為穢物，內政部應道歉。國土署回應則重申先前公布的「擴增去化量能」等3項土方配套措施，也已主動協助台中市處置土方去化需求。國土署今年1月1日起實施營建剩餘土石方全流向管理政策，引發業者反彈，各地方去化場所與暫置場量能是否足夠也受矚目。請繼續往下閱讀...媒體報導，國土署營建管理組長李守仁日前在台中市協調會說「自己的大便自己收，沒有叫別人收的」；台中市長盧秀燕今天回應，政府應幫忙解決問題，而非嫌棄、污衊，內政部應約束官員並向營建業者道歉。內政部國土署晚間透過新聞稿重申，目前已與各地方政府凝聚共識，會朝「擴增去化量能」、「簡化土方運送流程」、「GPS雙軌並行並開放小貨車申裝GPS」等3項配套執行；同時，中央也已主動協助調度台中港區內5公頃暫置區，支援台中市營建剩餘土石方去化需求。國土署說明，2025年台中市營建剩餘土石方總出土量約為658萬立方公尺，其中約446萬立方公尺因具經濟價值，已可依「台中市營建剩餘土石方自治條例」規定，直接交易利用。其餘約212萬立方公尺土方，除可運往鄰近縣市進行最終處置，現已新增台中港臨時暫置，並可透過營建產出物跨局處推動平台，盤點轄內工程及市有土地做為暫置與去化使用，後續也可銜接大型工程，落實土方管理秩序與環境永續目標。此外，內政部也透過新聞稿表示，自2023年至2025年，環境部協同內政部警政單位查辦營建廢棄土非法傾倒行為等重大環保犯罪共101案，裁處新台幣2930萬餘元罰鍰，涉及犯罪所得高達新台幣46億4994萬餘元；各地方政府也成立「營建剩餘土石方聯合稽查小組」，去年全國共稽查9677件，裁罰2916件、共5565萬元。內政部指出，警政署近3年已查獲幫派組織涉入棄土相關犯罪28案、266人，查扣不法利益2億1526萬餘元。內政部將持續針對土方清運各環節強化蒐證能量，從嚴偵辦。    ,https://news.ltn.com.tw/news/politics/breakingnews/5317772
美國務院副助卿也來了！GCTF研習營聚焦海纜防護、通訊系統韌性,政治,2026/01/21 20:00,美國國務院副助卿孔如璞開幕致詞。（外交部提供）外交部、交通部、數發部與美國、日本、澳洲、加拿大及英國等駐台機構合作，於今（21）日至23日在台北舉辦「全球合作暨訓練架構（GCTF）強化通訊基礎設施韌性」國際研習營。美國在台協會（AIT）說明，研習營聚焦海底電纜防護與通訊系統韌性，與會者將藉參訪實地瞭解台灣為強化通訊與數位基礎設施韌性，所採取的措施及實務經驗。外交部及AIT指出，本次活動邀請來自26國、197名政府官員、專家學者及產業代表參與，就強化通訊基礎設施韌性與確保關鍵網路安全穩定運作等議題進行交流。請繼續往下閱讀...AIT說明，研習營講者有交通部長陳世凱、數發部次長葉寧、美國國務院副助卿孔如璞（Robert Koepcke）、日本台灣交流協會代表片山和之，也邀請日本電信電話公司副社長執行董事暨事業開發室長柳瀬唯夫發表專題演講。AIT指出，專家討論重點包含海底電纜防護與修復、地面與高空通訊系統韌性，以及衛星通訊在危機情境中的關鍵功能。外交部說明，活動內容以強化通訊基礎設施韌性為主軸，涵蓋天然災害、資安威脅、地緣政治風險及設施老化等挑戰，並從政策與治理、國際合作及公私協力等面向，探討海底電纜防護與修復，以及地面、高空與衛星通訊等重要議題。外交部說，活動期間將透過個案研析與討論，促進政府、產業與學研界交流，分享海底電纜保護、事故應變、替代性通訊技術及跨部門與國際合作等實務經驗。AIT表示，與會者也將參訪台灣太空中心及宜蘭頭城海纜登陸站，實地瞭解台灣為強化通訊與數位基礎設施韌性，所採取的措施與實務經驗。全球合作暨訓練架構由美國在台協會、台灣外交部、日本台灣交流協會、澳洲辦事處、加拿大駐台北貿易辦事處以及英國在台辦事處共同主持，於2015年成立，至今已舉辦逾90場國際研習營。日本台灣交流協會代表片山和之，代表「全球合作暨訓練架構」（GCTF）夥伴國家於開幕致詞。（外交部提供）包括交通部長陳世凱、數發部次長葉寧、美國國務院副助卿孔如璞、日本台灣交流協會代表片山和之，也邀請日本電信電話公司副社長執行董事暨事業開發室長柳瀬唯夫發表專題演講。（外交部提供）    ,https://news.ltn.com.tw/news/politics/breakingnews/5317757
116年科技預算規劃1850億元 力推AI、淨零新創、量子科技,政治,2026/01/21 19:39,國科會主委吳誠文期待，代表全體國民的立法院支持科技預算，共同推動台灣前瞻科研發展。（記者吳柏軒攝）國科會今（21日）召開第19次委員會議，提出116年度政府科技預算先期規劃，總額度1850億元，雖然今年度政府預算尚未通過立法院審查，但國科會主委吳誠文指出，為持續推動前瞻科研，讓台灣各層面發展，仍「心存期待」盼代表全體國民的立院支持科研預算；今也公布未來淨零科技創新方案、量子國家隊第2期計畫等戰略目標。國科會統籌全國科技預算，今年原先編列1800多億元，後因財劃法新法，砍為1601億元，但今年總預算案至今仍未通過立院審議；國科會今舉行第19次委員會議，會後主委吳誠文說明，明年科技預算初步編列1850億元，希望善用台灣科研與產業能量，確保半導體、AI、前瞻製程等優勢源源不絕，進一步推展百工百業發展。請繼續往下閱讀...至於立院預算審查問題，吳誠文「心存期待」立院支持政院預算，且政院也提出新版財劃法，亦照顧到所有地方政府，也盼未來科技預算不因故耽誤太多，且政院都會支持國科會，尤其AI新十大建設方案等，有賴總統跟卓院長指示，是國家命脈的高科技產業重要政策，立法院代表全體國民，相信也會支持。國科會科技辦公室執行秘書張振豪表示，116年科技預算納入重點科技政策的預算需求，包含既有的大南方新矽谷、晶創台灣、次世代通訊、智慧機器人、高齡科暨行動計畫等，以及3項待政院通過的AI新十大建設、淨零科技創新、海洋科技等，要實現台灣成為人工智慧之島願景。科技辦公室副執行秘書呂佩融則說，淨零科技未來推出「淨零科技創新方案」，草案規劃5大主軸，整合永續及前瞻能源、低（減）碳、負碳、循環以及人文社會科學等發展20個次領域主題，要建構去碳能源系統、培育綠領科研人才、創新循環供應體系、提升企業綠色競爭力、建構在地淨零社會力；張振豪補充，未來4年將投入500億元。國科會自然處長賴明治則說，政府5年前啟動量子運算戰略，成立量子國家隊，包含國科會、中研院及經濟部等合作，首期計畫到今年已完成目標，亮點成果有完成10個量子位元、全自製矽光子量子運算晶片等，也掌握先進量子光源、量子中繼與記憶體技術，培育超過350名碩博士與25名博後人才，第2期計畫將在116年啟動，估每年8到10億元投入，持續串聯，建構自主生態系與技術落地。吳誠文強調，將推動量子運算的QPU跟CPU加GPU整合應用，是台灣強項，荷蘭、美國IBM等量子大國技術都看見台灣價值並展開合作。國科會舉行第19次委員會議，初步規劃116年度科技預算，編列1850億元，要實現台灣成為人工智慧之島。（記者吳柏軒攝）國科會推動量子科技，與中研院、經濟部等產官學研共組量子國家隊，第1期5年計畫成果已達標。（記者吳柏軒攝）    ,https://news.ltn.com.tw/news/politics/breakingnews/5317739
林佳龍接見德州州議員陳筱玲 盼隨關稅塵埃落定促進雙向投資,政治,2026/01/21 19:38,外交部長林佳龍（右）21日於外交部接見美國德州州眾議員陳筱玲（左）。（圖擷取自林佳龍臉書）外交部長林佳龍今（21）日於外交部接見美國德州州眾議員陳筱玲（Angie Chen Button）。林佳龍表示，過去一年全球AI產業蓬勃發展，共同見證愈來愈多台灣企業看好德州的投資潛力前往布局，期待隨著台美關稅談判塵埃落定後，進一步促進雙向投資、共創繁榮。林佳龍回顧，去年5月曾率領國經協會、電電公會等產業代表團訪問德州，在陳筱玲安排下，親赴德州眾議會公開接受友台決議，充分展現德州民意對台灣的堅定支持。期間也促成電電公會與德州總商會簽署「德州—台灣經濟合作協議」，為深化台灣與德州雙向投資、建立更緊密的產業夥伴關係，邁出重要一步。請繼續往下閱讀...林佳龍指出，德州擁有廣袤土地、豐沛能源、頂尖人才及便利交通條件，是美國發展AI科技與高科技產業的重要據點，也成為多家台灣電子與資通訊產業投資美國的首選。陳筱玲會中也分享，德州政府正積極擴大發電能量，建置先進輸電設施與天然氣配送管線，同時釋出更多土地規劃作為產業聚落，期待透過強化基礎建設，打造更優質的投資環境。林佳龍進一步強調，資金、技術與人才是企業投資美國最關鍵的成功要素，缺一不可，他認為，未來台灣與德州應聚焦三項合作重點：一是透過教育及產學合作培育人才，強化人才交流；二是建立企業產業聚落，協助企業順利落地發展；三是推動於休士頓市建設「Taiwan Tower」，作為台灣與德州政府共同服務在地台商及促進雙向投資的一站式服務據點。林佳龍表示，自2024年德州州長艾伯特（Greg Abbott）訪問台灣並宣布在台設立德州駐台辦事處、去年5月他率團訪問德州，到此次陳筱玲回訪台灣，一連串密切互動，充分展現台灣與德州關係持續加溫，未來雙方將持續透過台美相互投資，共享AI產業蓬勃發展的商機，建構更強健的經濟韌性。    ,https://news.ltn.com.tw/news/politics/breakingnews/5317737
遭指拿資料「救援」黃國昌 郭國文澄清：書店有賣、再造謠一律提告,政治,2026/01/21 19:32,民進黨立委郭國文於5月17日立法院會，奪走立法院祕書長周萬來懷中的文件後，一路跑出議場。（資料照）民眾黨立委黃國昌19日在立院外交及國防委員會攸關國防特別條例的機密會議中，將機密資料帶出會議室共75秒，其中有42秒不在監視器拍攝範圍中，引發爭議。對此，不少民眾黨支持者「小草」拿出郭國文2024年在立法院「拿走文件」一事「救援」黃國昌。對此，郭國文表示，當時他拿的是立法院秘書長周萬來自己寫的議事規則的書，在網路書店都有，並非機密。他也說，澄清之後，再有造謠者，一律提告。郭國文20日下午在臉書發文表示，他拿走的文件並非機密資料，當時意圖也很清楚「就是議事杯葛」。郭國文說，黃國昌配合國民黨傅崐萁、鄭麗文等紅統派人士表演了約2年，如今又拿走國安機密資料，當然可以被質疑他的動機，到底是不小心還是刻意而為。他也質疑，黃國昌卸任立委前夕觸犯了敏感紅線，為什麼掛著時代力量黨籍的黃國昌立委，做了4年都不會犯這樣的錯呢？請繼續往下閱讀...​郭國文說，對於網路想帶風向，稱當時他在「國會擴權」法案當中，拿走周萬來手中的文件以杯葛議事進行，「說我也拿走機密資料」，他要澄清，那不是機密資料，那是周萬來自己寫的議事規則的書，在網路書店都有，價格約5、600元。​他也解釋，當初拿走文件是為了反制藍白暴力多數，杯葛「國會擴權」法案，事實也證明，這就是一部被宣判違憲的爛法。最後他也宣布，發文後已經做出清楚說明，請造謠者刪文。「若持續造謠，我一律提告。」    ,https://news.ltn.com.tw/news/politics/breakingnews/5317342
前民進黨議員蔡永芳宣布參選 強調「幸福不是一切，人還有責任」,政治,2026/01/21 19:26,蔡永芳（左一）近年來積極投入志工工作，並擔任大成國中交通志工隊長職務。（蔡永芳提供）前桃園市議員蔡永芳昨在餐敘時宣布投入下屆市議員選舉，今天也在臉書以「幸福不是一切，人還有責任」宣布參選；蔡永芳說，據悉，民進黨中央黨部已經核定八德區提名兩人參選桃園市議員，民進黨八德區現任議員為呂林小鳳、許家睿，未來投入選舉，勢必要與兩位現任議員辦理初選。蔡永芳也提到，之前因為助理費的案子鬧得沸沸揚揚，許多支持者都很關心這件事，事實上，從政以來對於助理費絕對是清清白白，最後檢察官查無犯罪事實不起訴處分，並不是法官判決無罪，只是外界並不清楚，也希望透過參選，讓選民知道蔡永芳絕對是清白參選。請繼續往下閱讀...蔡永芳說，原本民進黨桃園市黨部建議八德提名三席，但八德地區應選五席，考量傳統以來八德地區藍大於綠，提名三席極有可能兩人雙雙落馬，據他了解，中央黨部已核定八德提名兩席，以確保民進黨在八德仍保有二席議員席次，未來投入八德選區選舉，會與呂林小鳳、許家睿進行初選。蔡永芳說，投入大成國中志工工作15年，志工服務一直以來都是生活的一部分，如今擔任志工隊長，志工變成生活重心，近半年來熱心支持者一直關心是否參選，但一直沒有下定決心，昨天餐會時，弟弟問及此事，他忽然想起了卡繆的一句話：「幸福不是一切，人還有責任」，所以下定決心參選，因為選民需要他。    ,https://news.ltn.com.tw/news/politics/breakingnews/5317689
民眾黨搶攻彰化縣議員 提名插旗和美、二林選區,政治,2026/01/21 19:16,民眾黨目前在彰化縣議會2席現任，今天縣黨部宣布，再開放和美、二林選區提名，希望縣議會席次成長。（民眾黨縣黨部提供）年底五合一大選，台灣民眾黨首波完成彰化縣議員彰化選區與員林選區提名，民眾黨彰化縣黨部今天宣布，即日起展開第二波縣議員提名作業，目標鎖定和美第三選區（和美、伸港、線西）與二林第八選區（二林、芳苑、大城、竹塘），盼縣議會席次能夠成長。民眾黨現任縣議員吳韋達（彰化選區）、張雪如（員林選區）已在去年11月12日第一波提名完成，本週和美區及二林區議員領表登記，其他議員選區待中央黨部提名排程。而鄉鎮市民代表方面，預計2月初登記。請繼續往下閱讀...彰化縣黨部主委溫宗諭說，本次公告提名選區包含和美區及二林區，各選區提名1名參選人，受理登記時間自1月22日上午9點起，到1月28日下午6點截止，相關登記表單與作業規定已公告於台灣民眾黨官方網站，供黨員下載查詢。歡迎符合資格的黨員同志踴躍領表、登記參選，共同投入地方公共事務，為彰化發展努力。溫宗諭指出，若登記人數超過提名名額，登記完成後由各地方推薦小組評鑑及溝通協調；若仍無法取得共識，將依黨內相關規定，由中央黨部辦理民意調查，決定最終提名人選。    ,https://news.ltn.com.tw/news/politics/breakingnews/5317721
卓榮泰叫陣立院辯論總預算！羅智強列「3長vs3長」迎戰,政治,2026/01/21 18:59,國民黨團回應行政院長卓榮泰辯論總預算之要求。（資料照）針對行政院長卓榮泰要求就總預算案與立法院進行辯論，國民黨立法院黨團書記長羅智強今回應：「正面迎戰！直球對決！民意裁判」；羅智強表示，他堅信真理越辯越明，辯論即是檢驗政府的起點，這絕非口舌之爭，而是一場全國民意的總體檢。國民黨團深信，民意終將站在「顧民意、護法治、爭公義」的一方。國民黨團具體要求舉辦三場正式電視公開辯論，並提升為「三長對三長」的全面對決。第一場：黨團總召傅崐萁對決行政院長卓榮泰；第二場：黨團書記長羅智強對決行政院副院長鄭麗君；第三場：首席副書記長林沛祥對決行政院秘書長張惇涵。請繼續往下閱讀...羅智強表示，本次辯論將針對預算編列的「合法性、合理性、正當性」，以及行政院應落實立法院三讀通過法案的「憲政義務」，向全民說清楚、講明白。國民黨團三長將在辯論中，具體揭露行政院如何公然違法，以捍衛我國的財政紀律及法治精神。羅智強呼籲，卓榮泰說到做到，切勿閃躲，朝野應在最短時間內敲定辯論的時間與地點。國民黨團已整軍待發，為了捍衛法治，我們必須讓公理正義的陽光照進行政院、照進總統府；讓115年中央政府總預算案的違法亂紀之處，全數攤在陽光下供全民檢視，交由全民裁判。羅智強說，當前重大朝野憲政僵局，卓榮泰要求辯論講清楚、說明白，他給予肯定。但羅智強要反問，最該把自己施政作為向人民完整報告的，不該是當今賴清德總統嗎？如果民進黨政府真心要化解當前朝野僵局，必須針對當前的憲政爭議，也來場直球對決，世紀辯論。羅智強請賴清德總統，比照當年雙英辯論（馬英九總統、蔡英文黨主席）來場黨對黨政策、理念、路線的大辯論，這才是對人民負責任具體的表現，也才是身為總統兼黨主席該有的承擔。請賴清德總統、賴清德主席，直球對決，面對民意，不要閃躲。    ,https://news.ltn.com.tw/news/politics/breakingnews/5317710
奧林匹亞橫掃23金 總統接見代表團：盼30年再拚3個諾貝爾獎,政治,2026/01/21 18:52,我國代表隊2025年在國際10項奧林匹亞競賽獲得23金、21銀、6銅及4面榮譽獎佳績，總統賴清德今接見代表團。（總統府提供）我國在2025年國際10項奧林匹亞競賽，奪23金、21銀、6銅及4面榮譽獎，總統賴清德今接見代表團時表示，期待大家繼續深耕研究，期盼台灣未來30年在物理、化學、醫學3個領域，至少增加3位諾貝爾獎得主，也期許同學投入科技產業，提升台灣經濟與科技實力。賴清德表示，2025年10項奧林匹亞競賽涵蓋數學、物理、化學、資訊及地球科學等項目，我國選出55人次參賽，總計獲得23面金牌、21面銀牌、6面銅牌及4面榮譽獎，如此耀眼的成績充分展現台灣科學教育紮實的基礎；參賽同學遠赴海外，克服巨大壓力，在國際舞台上發光發熱，全體國人都與有榮焉。請繼續往下閱讀...賴清德指出，科學是國力之本，所有先進國家都相當重視科學教育，台灣作為缺乏天然資源的科技之島，以先進的科學實力造就當今的榮景，要比其他國家更重視科學教育與人才培育政策，教育部訂定了「參加國際數理學科奧林匹亞競賽及國際科學展覽成績優良學生升學優待辦法」，選手們除了可以申請保送或推薦升學，也有機會申請出國留學。賴清德強調，政府會繼續提供各種機會和資源，打造更好的研究環境，讓同學們在不同領域發揮所長，希望大家與師長繼續深耕科學研究，讓台灣未來30年在物理、化學、醫學3個領域，至少增加3位諾貝爾獎得主；他也期許同學投入科技產業，提升台灣的經濟與科技實力。賴清德進一步指出，行政院正推動「AI 新十大建設」，目標2040年前培育50萬名AI應用人才，「國網雲端算力中心」已完成建置、「智慧創新算力中心」亦即將成立，政府也關注矽光子、量子科技及機器人三項關鍵技術，希望達到三項目標，一、打造創新創業的生態系，成就兆元產值的軟體平台；二、協助百萬家中小微企業導入人工智慧、新興科技，全面提升競爭力；三、希望台灣未來能成為智慧生活圈、智慧島，食衣住行育樂、國防等各領域都有相關應用。賴清德提到，台灣距離上次主辦國際奧林匹亞競賽已經超過10年，為了增加台灣的國際能見度，已經爭取到「2027年第59屆國際化學奧林匹亞競賽」主辦權，相信主辦國際奧林匹亞競賽可以增進台灣學生的國際合作、視野與交流機會，並讓各國學生更加瞭解台灣科學教育的成果。賴清德期盼台灣未來30年在物理、化學、醫學3個領域，至少增加3位諾貝爾獎得主。（總統府提供）    ,https://news.ltn.com.tw/news/politics/breakingnews/5317681
民眾黨再提名10人選議員！許甫、吳怡萱戰北市 林子宇出征板橋,政治,2026/01/21 18:48,許甫（左2）出戰台北市松山信義區議員選舉。（資料照）台灣民眾黨中央委員會今（21）日宣布2026年直轄市、縣市第四波議員提名人選，地區橫跨基隆、雙北、新竹縣、苗栗縣，及澎湖縣；民眾黨主席黃國昌強調，每位被提名人都是即戰力強棒，專業紮實、且具實務歷練和服務熱忱，未來將努力深耕基層、貼近民意，以回應民眾期待、爭取鄉親朋友支持，使家鄉一步步變得更好。另一方面，針對行政院拒絕編列警消退休金預算，該黨也已同步計畫團體訴訟，目前已獲逾千件訴訟資料，預計下（2）月初正式提出訴訟。民眾黨中央委員會指出，第四波直轄市、縣市議員被提名人共10位，包含基隆市中山區呂承祐、台北市松山信義區許甫、台北市中正萬華區吳怡萱、新北市板橋區林子宇、新北市中和區陳怡君、新竹縣湖口鄉陳岫玫、新竹縣新豐鄉徐勝凌、苗栗縣後龍造橋竹南選區蔡君婷、苗栗縣頭份三灣南庄選區林志學、澎湖縣馬公市莊國輝。請繼續往下閱讀...此外，該會昨（20）日下午也已公告今年直轄市、縣市議員第五波提名選區，包含台中市北屯區、彰化縣和美線西伸港選區、彰化縣二林芳苑大城竹塘選區，自明（22）日9點至28日下午6點截止前開放登記。黃國昌強調，民眾黨現已公布2026顧台灣9支箭政策綱領，以「穩社會、顧生養、保安康、壯產業」四大核心願景，讓人民站得更穩、活得更好、走得更遠；與此同時，該黨和國民黨共同政見構思也持續進行中，將在磋商完成後盡速向各界報告。針對行政院不依法編列立法院三讀通過「警察人員人事條例」預算、苛扣警消退休金，台灣民眾黨表示，該黨願無償替退休警消啟動團體訴訟，目前全台各地23個收件站已收取破1300件資料，第一階段收件作業將於本週五（23日）截止，接續馬上進行資料整理與訴訟準備，預計2月初正式提起訴訟；黃國昌強調，台灣民眾黨一定會捍衛警消權益，遏止惡劣政府剝削一生奉獻的警消。民眾黨主席黃國昌表示，10位被提名人兼具專業、歷練與服務熱忱，將全力回應民眾期待，讓家鄉變更好。（記者廖振輝攝）    ,https://news.ltn.com.tw/news/politics/breakingnews/5317588
