Title,News_Type,date,content,url
日本栃木入屋殺人劫財！4嫌竟都16歲高中生 疑「暗黑打工」,國際,2026/05/16 23:04,日本栃木縣民宅遭歹徒闖入殺人劫財，69歲婦遭砍死，2兒被砍傷，被捕4凶嫌竟是高中生。示意圖。（資料照）日本栃木縣一處住宅14日發生強盜殺人案，造成69歲婦人死亡、婦人的2個兒子受傷。警方今天以涉嫌強盜殺人逮捕一名男高中生，至今已有4名少年落網，且全部年僅16歲。警方認為4人就是犯罪執行者，懷疑案件與「匿名流動型犯罪集團」（簡稱「匿流」）有關。NHK、讀賣新聞報導，根據警方調查，栃木縣上三川町一處住宅14日上午9時25分左右遭多名歹徒闖入。歹徒搜刮財物期間，69歲婦人富山英子遭到持刀襲擊，胸口等部位被刺身亡；當時正在屋外務農、趕回家的40多歲長男與30多歲次男，也遭毆打頭部受傷。請繼續往下閱讀...警方15日先後逮捕兩名居住於相模原市的16歲少年，今天又逮捕另一名同住相模原市的16歲男高中生，隨後再於下午5時40分左右，以涉嫌強盜殺人，逮捕住在川崎市的另一名16歲男高中生。至此，被逮捕的少年已增至4人。警方認為，這起案件可能是以「暗黑打工」招募執行者的「匿流」犯罪集團所為，正在持續追查其他涉案人士。警方透過案發現場周邊監視器畫面等線索，鎖定其中一名少年，於15日晚間在相模原市住家附近，趁其外出時將他緊急逮捕。警方同時在附近公園停車場發現一輛白色高級進口汽車，懷疑是犯案集團使用的交通工具。警方今天上午將最先被捕的男高中生移送宇都宮地方檢察廳。該少年供稱，「是同年級朋友邀我加入，其他同夥開車逃跑了」。辦案相關人士透露，至少有4人在現場參與犯案，另外可能還存在負責下達指示的上層。曾任警視廳搜查一課理事官、負責殺人與強盜案件偵辦的副島雅彥分析指出，「對下達指示者而言，即使執行者被捕，只要能拿到錢就無所謂。他們可能是為了逼迫住戶到金融機構提款，因此選擇白天犯案，這是典型的『匿流』犯案模式」。對於執行者都是16歲高中生，副島指出，「由於近年執行者被逮捕的風險很高，犯罪集團可能認為年紀小的更容易控制，於是將招募對象年齡下降至10多歲」。副島表示，這類犯罪已逐漸形成「犯罪商業模式」，犯罪集團不斷研究如何避免被捕，與警方展開攻防。他認為，近年警方透過逐步向上追查的方式接近主謀，已經累積不少成果。這起案件未來可能會與其他案件出現關聯，屆時警方可能結合警視廳及各地警方力量，全力打擊犯罪組織。    ,https://news.ltn.com.tw/news/world/breakingnews/5439519
貓頭鷹栽進水泥堆喪失靜音飛行能力  「接羽術」讓牠重獲新生,國際,2026/05/16 22:58,從水泥攪拌車內被救出的貓頭鷹，去年11月在庇護中心治療。（美聯社）美國猶他州一隻受困預拌混凝土車的未成年大角鴞（great horned owl，學名Bubo virginianus），獲救後經過數月清理、休養和關鍵的「接羽術」後，終於恢復靜音飛行能力，重新回到野外。美聯社16日報導，猶他州一處度假村工地施工人員，去年10月底施工澆灌水泥時，發現這隻大角鴞困在預拌混凝土車攪拌器中，把牠救出後，先以水緊急簡單沖洗，然後送到該州的「動物好友協會」（Best Friends Animal Society）治療。庇護所人員花了好幾天時間，用鑷子小心翼翼地剝除牠臉部、胸口和右翼上已經乾掉的水泥碎屑，再用牙刷、洗碗精清潔羽毛。請繼續往下閱讀...不過，這隻貓頭鷹休養了幾個月時間，遲遲沒有長出新的羽毛。於是5月初為牠進行「接羽」（imping），也就是使用捐贈羽毛接到牠原有的羽軸上。庇護所主管瑞奇瓦斯基（Bart Richwalski）說，「一開始的幾根羽毛，真的讓人非常緊張，但是後來逐漸進入狀況，一切順利進行」。大角鴞部分羽毛邊緣的細緻絨羽，可讓牠們獵食時安靜地飛行，但是這隻貓頭鷹因沾粘水泥磨損其羽毛，飛行時會發出呼呼聲。接羽使用的羽毛，來自一隻體型相近的死亡貓頭鷹，比照牠右翼的形狀逐一接上。接羽手術歷時90分鐘完成，牠的右翼多了10根新的初級飛羽，和1根次級飛羽。但是真正的考驗是牠能否恢復無聲飛行能力。這隻貓頭鷹從麻醉甦醒後，沒多久便起飛，經分貝計測量確認，牠的振翅聲安靜到足以野放。牠也在鳥舍屋頂打開後，短暫盤旋了一陣子，便飛向野外。這幾個月一直照料這隻貓頭鷹的瑞奇瓦斯基說，看見牠飛出去那一刻，「感覺真好，我的心臟好像終於重新開始跳動」。    ,https://news.ltn.com.tw/news/world/breakingnews/5439531
東京大學五月祭收炸彈預告中止 神谷宗幣演講也喊卡,國際,2026/05/16 22:34,"日本東京大學學園祭「五月祭」收到炸彈恐嚇。圖為東大大講堂（安田講堂）。（法新社）日本東京大學學園祭「五月祭」今天因收到炸彈預告，學園祭常任委員會基於安全理由，宣布全面取消當天活動；同樣在東大，參政黨代表神谷宗幣原定今天演講，也因為民眾抗議，在開始前臨時喊卡。朝日新聞、時事通信社報導，東大五月祭於16、17日舉行，但常任委員會表示，由於收到針對委員會及特定企劃團體的炸彈預告郵件，基於安全考量，決定取消當天所有活動，至於17日活動是否舉行仍「未定」。請繼續往下閱讀...常任委在官方社群媒體X帳號發文表示，「委員會及特定企劃團體收到犯罪預告電子郵件，聲稱已在本鄉、彌生校區多處設置炸彈，並將在五月祭期間引爆。與校方及警方協商後，經過慎重評估，認為難以確保來場者、企劃參與者以及委員的安全，因此決定取消今天所有活動」。「五月祭」是東京大學每年初夏舉辦的大型學園祭。全校學生齊心協力舉辦為期兩天的活動，開放給一般民眾自由參加，活動內容豐富多元，從美食攤位到學術展示、表演活動、互動體驗應有盡有。另外，保守派學生社團「右合之衆」原定於中午12時舉辦神谷宗幣演講，不過主辦單位於上午11時30分宣布，因「安全確認上的問題」延後開始時間，接著於下午1時正式宣布取消，並表示這是根據「五月祭常任委員會的判斷」。活動中止後，下午4時左右，大批參觀民眾陸續從東大正門離開。工作人員在門口向民眾喊話，「五月祭已經中止了」。離場人潮排起隊伍，朝附近地下鐵本鄉三丁目站方向移動。1名東大一年級男學生表示，原本計劃帶來自埼玉縣母校的10多名高中學弟妹參觀學校，「難得的活動取消了，真的很遺憾」。另一名2年級學生則說，收到中止通知的時候，「一開始不知道原因，後來聽說是收到炸彈預告，真的很震驚」。神谷宗幣的演講活動開始之前，現場聚集反對人潮。相關人士透露，反對演講的學生在通往會場教室的樓梯靜坐抗議，並與參政黨相關人士發生衝突，導致現場秩序失控。神谷過去曾因被批評發表歧視性言論，引發爭議。他要在東大演講的消息公布後，社群媒體出現大量反對聲浪，本鄉校區正門前今天也出現抗議活動。今日の講演会は会場に聴衆が入れなくされたようで、中止とのこと。待機していましたが、やむなしですね。運営の皆様、お疲れ様でした。来ていただいた皆さんには申し訳ないです。これなら近くで街頭演説でも準備しておいたらよかったですね。今後は代案も考えながらやります。… https://t.co/QuMoojpJ9h— 神谷宗幣【参政党】 （@jinkamiya） May 16, 2026 今日の講演会は会場に聴衆が入れなくされたようで、中止とのこと。待機していましたが、やむなしですね。運営の皆様、お疲れ様でした。来ていただいた皆さんには申し訳ないです。これなら近くで街頭演説でも準備しておいたらよかったですね。今後は代案も考えながらやります。… https://t.co/QuMoojpJ9h對於演講取消，神谷在X發文表示，「今天的演講似乎因為觀眾無法進入會場，因此被迫中止。雖然我一直在現場待命，但也無可奈何。辛苦所有工作人員了，對於特地前來的各位感到非常抱歉。早知如此，或許應該在附近舉辦街頭演說比較好。今後舉辦活動時會一邊思考替代方案」。東大の講演が中止になったので、民主主義ユースフェスティバルの方に足を運んできました。参政党の若者がいっぱいいた????中道の小川代表も来られていて、来週の党首討論頑張りましょうとお話しました。 pic.twitter.com/KwucEa9qZN— 神谷宗幣【参政党】 （@jinkamiya） May 16, 2026 東大の講演が中止になったので、民主主義ユースフェスティバルの方に足を運んできました。参政党の若者がいっぱいいた????中道の小川代表も来られていて、来週の党首討論頑張りましょうとお話しました。 pic.twitter.com/KwucEa9qZN    ",https://news.ltn.com.tw/news/world/breakingnews/5439371
現有療法、疫苗沒轍！民主剛果伊波拉疫情猛 新一波感染已80死,國際,2026/05/16 22:18,電子顯微鏡下的伊波拉病毒。（美聯社檔案照）非洲剛果民主共和國（簡稱民主剛果）東部伊圖里省（Ituri）爆發新一波伊波拉疫情，死亡人數已增加到至少80人，鄰國烏干達也出現感染者，衛生官員正加強篩檢和追蹤接觸者，防止疫情持續外溢。美聯社、路透報導，民主剛果衛生部長康巴（Samuel-Roger Kamba）15日首度證實爆發新一波伊波拉疫情後，到16日已至少80人死亡、246例疑似病例；鄰國烏干達15日也表示出現一起伊波拉確診病例，為自剛果境外移入，該名患者14日過世，該國尚無其他確診病例。請繼續往下閱讀...伊圖里省首府布尼亞居民阿辛威（Jean Marc Asimwe）表示，「每天都有人死…，這樣的情況持續了大約1週，我們1天之內埋2、3人，甚至更多」，他說，當地人到現在都不太清楚「這到底是什麼病」。這次是民主剛果自1976年以來，第17波伊波拉疫情，衛生部表示，檢驗結果確認，這波疫情由罕見的本迪布焦型（Bundibugyo）病毒引起。該國國家生物醫學研究所所長、伊波拉病毒專家穆延貝（Jean-Jacques Muyembe）表示，過去16次中，15次疫情均為薩伊型（Zaire）病毒株引起，這次出現不同型，使因應行動更為複雜，因為現有療法和疫苗都是針對Zaire型病毒株。伊波拉病毒可透過嘔吐物和血液、精液等體液傳播，傳染力強、病情嚴重且通常致命。最新這波疫情疑似指標病例是一名在布尼亞醫院死亡的護理師，發病時間可追溯到4月24日。康巴未說明這名護理師的檢體是否完成檢驗，但表示，患者出現的症狀疑似感染伊波拉。    ,https://news.ltn.com.tw/news/world/breakingnews/5439510
美未附和「中美建設性戰略穩定關係」表述 專家：不願受北京束縛,國際,2026/05/16 22:06,川習會時中方提出建立「中美建設性戰略穩定關係」，會後這項表述並未見於美國官方聲明或從官員口中說出。（路透檔案照）中國國家主席習近平在與美國總統川普的會晤中，提出雙方建立「中美建設性戰略穩定關係」，作為兩國關係未來發展方向，但這項表述並未見於美國官方聲明或從官員口中說出。「美國之音」引述美專家說法，華盛頓不願附和北京的原因，是不希望被中國附加在背後的原則所束縛。專家指出，美國雖然接受「穩定」的概念，但不會依照北京表述定調美中關係未來方向。華府智庫布魯金斯研究所美中關係專家派翠西亞．金說，中美建設性戰略穩定關係並非全新概念，而是北京多年理念的重新包裝，涵蓋新型大國關係和基於相互尊重、和平共處及合作共贏等元素。請繼續往下閱讀...前白宮國安會中國事務主任韋德寧認為，美中之間的巨大差異之一便是中國喜於談論原則，美國則不在乎，認為「建設性戰略穩定關係」會像先前北京提出的「中美新型大國關係」一樣不被美方理會。韋德寧說，雖然美國也期盼穩定，但因為不希望被中國附加在表述背後的原則束縛，因此不樂於使用這類術語。同意這些表述，對華盛頓來說無異於穿上緊身衣。    ,https://news.ltn.com.tw/news/world/breakingnews/5439507
以色列空襲加薩 擊斃哈瑪斯指揮官哈達德,國際,2026/05/16 21:25,哈瑪斯今日在加薩市，為軍事部門指揮官哈達德舉辦葬禮。（法新社）以色列軍方今（16日）宣布，哈瑪斯軍事部門指揮官哈達德（Izz al-Din al-Haddad）已在一次空襲行動中被擊斃。以色列認為哈達德是2023年10月7日，哈瑪斯突襲以色列行動的策劃人之一，他的家人也向媒體證實了死訊。綜合《路透》、《美聯社》報導，以色列軍方指出，主導2023年10月7日哈瑪斯攻擊行動的哈達德在昨日被擊斃；一名哈馬斯高層官員也證實哈達德死於空襲，但哈馬斯尚未公開承認哈達德的死訊。請繼續往下閱讀...哈達德的家屬向《美聯社》透露，哈達德與另外6人，在週五的一場空襲中喪生。哈瑪斯今日在加薩市為哈達德舉辦葬禮，並用哈瑪斯及巴勒斯坦的旗幟蓋住他的遺體。被暱稱為「幽靈」（the ​Ghost）的哈達德，出生於1970年，他在1980年代哈瑪斯成立時加入組織並逐步晉升，歷經眾多高階職務，他也曾是哈瑪斯情報單位「馬吉德」（Majd）的成員，該單位負責追捕與以色列合作的巴勒斯坦人。    ,https://news.ltn.com.tw/news/world/breakingnews/5439454
中國擴張「 海上灰帶」  海警船、民兵船離駐日美軍基地僅241公里,國際,2026/05/16 21:12,菲國公布在中業島海域的中國海上民兵船。（法新社檔案照）中國近年利用漁船、海警船和海上民兵船，升高從黃海、東海到南海的海上活動，根據華爾街日報15日報導，其中在黃海的活動範圍近期更往東延伸，部分船隻一度到達距離美國海軍艦隊重要基地所在地、日本佐世保基地僅約241公里。報導分析地理空間數據分析公司ingeniSPACE和紐西蘭Starboard海事情報公司的船舶追蹤數據，整理出近年中國在這些海域的相關活動。在黃海，約200艘中國漁船近日往東推進，活動軌跡最密集處，是在中國和南韓專屬經濟區重疊海域靠東側邊緣；這些漁船為中國政府指揮的海上船隊一部分。ingeniSPACE營運長傑森．王（Jason Wang）說，「他們的意圖是利用這些軍民兩用船隻，進行控制該海域的非正規戰」。請繼續往下閱讀...十多年來中國在亞洲主權爭議海域部署漁船和海警船，在美國川普政府將軍力投入中東、拉丁美洲和世界其他各地之際，這套策略在太平洋為美國帶來與日俱增的挑戰，龐大的船隊也向其鄰國、向華府釋放訊號：北京有辦法增加美國和其盟邦，在該地區的海軍行動與軍事規劃複雜性。在黃海的中韓重疊海域，2018年起以來已發現數十具數據收集浮標，2024年又新增一批鮭魚養殖箱網。更往南的東海海域，今年4月3日有超過600艘中國漁船集結，排列成一條直線長達至少18小時，類似活動也曾在3月、1月以及去年12月出現。傑森．王認為，中國正藉此威脅這些國家領袖，「我們其實有夠多的船，足以威脅商業航運」。在釣魚台列嶼海域，中國海警船也穩定地提高其存在，去年在此巡邏共達357天；在南海黃岩島（菲國稱「馬辛洛克灘」）去年中國海警船數量加倍，並片面宣佈成立國家保護區，分析家指此舉旨在強化其主權主張。在靠近越南的西沙群島羚羊礁（Antelope Reef）海域，中國從去年12月2日起展開填海造陸，最近幾週該海域所見中國海警、海上民兵船愈加密集，保護這些可能是北京迄今最大規模人工造島工程。北京擅長利用灰色地帶活動，策略性地維持在不至於引發全面戰爭的程度，動用非軍事船隻正是此策略的一環。戰略暨國際研究中心（CSIS）韓國講座主任車維德出，中國以不挑起正面衝突的方式施加影響力，當所有行動累積起來，最終成為主導性勢力，就可迫使其他國家退讓。    ,https://news.ltn.com.tw/news/world/breakingnews/5439475
憾事！英國61歲男受洗溺斃還「全程直播」 牧師被控重罪,國際,2026/05/16 20:44,男子參加教會洗禮儀式時不幸溺斃，且被全程直播。示意圖，圖中人物與新聞無關。（法新社）英國倫敦一名罹患巴金森氏症的男子，在參加教會洗禮儀式時不幸溺斃，且被全程直播，引發關注。負責洗禮的女牧師因涉嫌鼓勵行動不便的信徒進入水中，導致其受困水下長達4分鐘，被控「嚴重疏忽誤殺」（gross negligence manslaughter）。據英國《地鐵報》報導，這起不幸事件發生於2023年10月8日。現年48歲的牧師巴特利（Cheryl Bartley），被指控在一處民宅進行洗禮時，過失導致61歲信徒史密斯（Robert Smith）死亡。請繼續往下閱讀...更悲劇的是，這場「死亡洗禮」全程在教會的臉書上進行直播，意外發生後直播緊急中斷，影片也被刪除。檢察官貝格姆（Amreena Begum）在庭上指出，巴特利明知死者史密斯患有巴金森氏症，卻巴特利仍在洗禮儀式中「鼓勵」史密斯進入水中並保持全身沒入，導致其在水中停留約4分鐘後不幸溺斃。巴特利在20分鐘的庭訊中僅確認姓名與地址等身分資訊，未對指控提出辯解。法官韋恩（David Wain）在聽取雙方陳述後，准許巴特利交保候審，但開出嚴格的保釋條件，包括在訴訟期間嚴禁執行任何洗禮儀式。此案預計將於6月11日移交伯明罕刑事法院繼續審理。    ,https://news.ltn.com.tw/news/world/breakingnews/5439401
熊蓋餓！日本岩手縣破門闖倉庫偷吃米糠 還拉一坨,國際,2026/05/16 20:39,日本岩手縣北上市有黑熊入侵倉庫偷吃米糠食；示意圖，圖與新聞事件無關。（歐新社資料照）日本岩手縣北上市一處住宅今天（16日）上午黑熊入侵，偷吃倉庫貯存的米糠。警方對周邊居民等發出警戒。《岩手可愛電視台》報導，今天上午9點左右，北上市口內町森居民發現，自家敷地倉庫的8袋米糠有2袋遭破壞。隨後檢查房屋四周發現，倉庫木門已被破壞，米糠袋被翻亂，米糠也遭啃食。據悉，倉庫內還留有疑似是黑熊的排泄物。請繼續往下閱讀...此外口內町內，5月9日也曾發生過黑熊侵入住宅範圍內的倉庫、偷吃稻米事件。事發地點周邊為群山環繞的農村地帶。警方提醒周邊居民提高警覺。    ,https://news.ltn.com.tw/news/world/breakingnews/5439413
疑攝取過量發酵果實！法國司機驚見「小鹿亂撞」畫面曝,國際,2026/05/16 20:37,駕駛拍下一頭行為怪異的小鹿，疑因攝取過量發酵果實而「醉酒」。示意圖。（資料照）法國勃根地地區日前出現逗趣景象。一名路過司機拍下一頭行為怪異的小鹿，疑似因攝取過量發酵果實而「醉酒」，在路邊田野上「小鹿亂撞」。據英國《太陽報》報導，這段由法國當地警方發布的影片顯示，一隻小鹿在田野中蹦蹦跳跳，時而原地轉圈，時而不停擺頭，期間還多次跌倒，行為異常好似「喝醉了」。請繼續往下閱讀...警方在社群媒體上打趣表示：「各位先生女士，並非所有『道路使用者』都是清醒的，這段畫面就是證明。」警方解釋，春季時部分野生動物會採食嫩芽、發酵果實或腐爛植物導致「酒醉」，可能發生突然橫穿馬路、在路中央發呆等危險行為。警方提醒，駕駛行經動物棲居地時應提高警覺、提早預防並降低車速，以避免交通意外。    ,https://news.ltn.com.tw/news/world/breakingnews/5439322
社群平台無法鞏固友誼？美研究：社交孤獨危害等同日抽15支菸,國際,2026/05/16 19:40,美國研究顯示，可能越依賴社交媒體，越容易感到孤單，示意圖。（資料照）線上訊息回不完，這代表不會孤單寂寞嗎？美國研究發現這題答案是「NO！」，而且越依賴社交媒體，越容易感到孤單，研究更指出，社交孤立對健康的危害堪比每天吸15支菸！研究在6日發表於《公共衛生報告》（Public Health Reports）。《CNN》報導，研究的主要作者、俄勒岡州立大學公共衛生教授普里馬克（Dr. Brian Primack）表示，「在社群媒體上，與更多親密朋友建立聯繫並不能減輕人們的孤獨感」。並用蘋果口味麥片與蘋果來比喻，線上交流就像是吃蘋果口味的麥片，雖然能填飽肚子，也能提供熱量，味道也不錯，但總歸不能取代蘋果的特殊滋味。請繼續往下閱讀...普里馬克表示，過去的許多研究都集中在社群媒體對兒童的影響上，但這項新研究則深入探討了成年人如何受到網路互動的影響。針對1500多名年齡在30至70歲之間的美國人的調查顯示，社交媒體上，擁有更多從未見過面的社交媒體好友的成年人，更容易感到孤獨。這種差異或許可以解釋，為什麼這麼多人感到孤獨。普里馬克說，這項研究的一個限制在於，目前還不清楚是那些更孤獨的人，在網路上與更多陌生人建立了聯繫，還是與陌生人建立聯繫，導致了他們的孤獨感，但他認為兩者兼而有。沒有參與研究、紐澤西州普林斯頓心理治療中心的臨床心理學家格林伯格（Melissa Greenberg）建議，想要重新在現實生活中「交新朋友」，可以從參加讀書會、去博物館，或電影院的會員專屬活動，或參加健身、藝術課程，當然也可以參與政治活動、加入宗教團體等。格林伯格指出，「人們往往會和有相似興趣的人交朋友，所以做自己感興趣的事情，可能是一個不錯的開始」，同時補充，「最好選擇離家近的地方，因為我們更有可能與住在附近的人建立友誼」，還有記得把手機收起來。該研究也表明，被動使用社群媒體，與憂鬱和焦慮的發生率較高有關，這可能是因為被動使用往往涉及更多的社會比較。然而，對於大多數人來說，主動使用社群媒體，例如發文、評論和發送訊息，似乎並沒有那麼糟糕。因此普里馬克建議，社群媒體用戶應思考自己正在與誰互動，以及是否想繼續保持聯繫。    ,https://news.ltn.com.tw/news/world/breakingnews/5439244
