Title,News_Type,date,content,url
有正職2寶媽賣3帳戶 賺外快下場慘了,社會,2025/11/19 10:55,有正職的2寶媽賣3帳戶，陳女因願與其中兩人調解賠償，南投地院法官判刑8月，併科罰金20萬元，宣告緩刑3年，向公庫捐款1.5萬元。（記者陳鳳麗攝）南投有正職的陳姓2寶媽，將3張提款卡寄給張姓詐團份子，有9人被不同方式詐騙匯款，金額從近10萬元到7000元不等，陳女被警方查獲後，家人錯愕不已，她也深表後悔，南投地院法官以洗錢罪判刑8月，併科罰金20萬元，惟因她初犯，有與2被害人調解賠償，宣告緩刑3年，捐款公庫1.5萬元。陳姓2寶媽是某工廠行政人員，疑似要賺外快，去年8月初到埔里鎮某家超商寄3張提款卡給暱稱「張嘉偉」男子，返家後line對方告知提款卡密碼，2天後就有9人分別被以拍賣網站交易、通知中獎、網路遊戲平台交易等名義匯款，兩天之內經由「張嘉偉」詐騙匯入3帳戶的款項達21萬元，警方循線查到陳女提供的3帳戶，將她移送法辦。請繼續往下閱讀...陳女被法辦才知代誌大條，陳女在南投檢方偵辦期間，表達懊悔也願意跟被害人調解，後來先跟損失1萬多元的兩被害人和解，允諾分11期還款。南投地院法官審理後，陳女雖未直接參與詐欺取財及洗錢，但輕率交付3個帳戶金融卡及密碼供他人使用，讓人金錢損失，助長詐欺犯罪風氣，增加國家查緝犯罪及被害人尋求救濟之困難，危害財產交易安全與社會經濟秩序，因此以洗錢罪名判刑8月，併科罰金20萬元，惟因她沒有前科，也願賠償，因此宣告緩刑3年，但須向公庫支付1.5萬元。熱門賽事、球星動態不漏接    ,https://news.ltn.com.tw/news/society/breakingnews/5250761
彰化轎車衝撞停等紅燈機車1死3傷！女騎士遭輾不治 涉案駕駛逃逸,社會,2025/11/19 10:42,色自小客車從後方追撞3輛正在停等紅燈的機車，64歲高姓女騎士直接被輾過，當場無生命氣息。（民眾提供）彰化縣員林市一名64歲女騎士昨天（18日）下午在停等紅綠燈時，遭後方白色自小客車輾過，女騎士傷重不治，小客車駕駛肇事逃逸。案發地點在員鹿路與新義街口，員林分局表示，昨晚已循線找到涉案車輛，並通知車主到案說明，車主稱其將車輛借給友人使用，分局已鎖定涉案駕駛積極查緝中。請繼續往下閱讀...這起事故發生於下午1時許，監視器畫面顯示，當時路口已有兩名女騎士停在前方等待紅燈，高姓女騎士則從後方緩慢騎上前排隊。未料，一輛白色轎車突然從後方逼近，毫無減速撞上高女並輾壓而過，強大力道還將機車推擠向兩側，還造成張姓女騎士與其72歲蕭姓母親受傷，另一名46歲張姓女騎士也遭波及，幸僅輕傷。消防人員到場時，高姓女騎士已失去生命跡象，救護員立即施以CPR及AED電擊並緊急送往員林基督教醫院搶救，仍因傷勢過重宣告不治。其他3名傷者均送醫治療，無生命危險。熱門賽事、球星動態不漏接    ,https://news.ltn.com.tw/news/society/breakingnews/5250743
指《三立》配合青鳥製造新聞 王鴻薇、徐巧芯被告不起訴,社會,2025/11/19 10:34,國民黨立委王鴻薇。（資料照）國民黨立委王鴻薇今年5月在臉書PO文指：「青鳥側翼罷團派一名戴口罩的女子來，要搭配《三立》製造新聞」、「綠媒為了幫罷團造勢，安排青鳥故意想製造我被嗆」，不僅如此，國民黨發言人楊智伃也在臉書發文意指，罷團派青鳥鬧場，配合特定媒體錄影，為罷免添柴火，另外，國民黨立委徐巧芯、國民黨新北市議員江怡臻及名嘴朱凱翔也在網路直播節目附和王的言論，通通被告，但台北地檢署調查後均予以不起訴。《三立》提告指出，今年5月24日，王鴻薇在臉書發文指：「鴻薇在龍田活動中心反罷宣講時，從來沒有來過的《三立新聞》突然出現，原來是青鳥側翼罷團派一名戴帽子口罩的女子來，要搭配《三立》製造新聞」、「綠媒為了幫罷團造勢，安排青鳥故意想製造我被嗆」等。請繼續往下閱讀...楊智伃當日也在臉書發文指：「本來只有《中天》的攝影機在直播，《三立》的單機突然來到現場拍攝」、「果不其然，一隻罷團派來的青鳥側翼在最後跳出來鬧場，配合特定媒體拍攝，想為接下來一週的政論找畫面、為罷免添柴火」等；朱凱翔是在直播節目上提及王的貼文內容，徐、江聽聞後予以附和，徐更說：「你就算好好地做自己該做的事情，他們（指《三立》）都可以把你做的事情扭曲，或是造謠」而通通被告妨害名譽。檢方認為，王鴻薇所辯當天並未發媒體採訪通知，且她舉辦多場宣講會均未通知《三立》等新聞媒體採訪，當時卻遭不同政治立場嗆聲質疑，《三立》亦在場採訪，認定王並非杜撰，沒有真實惡意，至於楊智仔、朱凱翔、徐巧芯、江怡臻就王鴻薇親身經歷過程，分別發表上述評論，內容也非憑空捏造，亦無犯意。檢方並認為，王等人質疑《三立》對新聞報導取材、安排、呈現方式，關乎媒體的公信力與社會監督功能，涉及新聞自律、採訪倫理與資訊真實性，屬公共事務範疇，因此，對此現象的評論、質疑、分析，皆為社會輿論監督正當行為，與公共利益有關，屬可受公評之事項；王等人依其個人價值判斷，對可受公評之事，所為適當評論，是在言論自由所保障的範疇內。熱門賽事、球星動態不漏接    ,https://news.ltn.com.tw/news/society/breakingnews/5250732
藍營縣市要普發現金？侯漢廷告網友散布謠言踢鐵板,社會,2025/11/19 10:30,侯漢廷告青鳥散布謠言，但法官認為是言論自由裁定不罰。（翻攝侯漢廷臉書）政府普發一萬元現金，多個縣市政府民代也要求藍營執政首長跟進，王姓男子製作圖卡宣傳，卻被台北市議員侯漢廷認為散布謠言報警提告，法官認為，王男貼文的目的是為了訴諸公眾討論，不會讓閱讀者造成誤解，因此認定不構成違反社維法，裁定王男不罰。判決指出，今年7月，網友在臉書分享多張截圖，圖卡中寫出「藍營最快下週提案廢潛艦」、「曹興誠大崩潰，網傳國民黨釋出善意？下屆北市議員有望禮讓」、「藍營縣市超徵稅收，有望補貼市民」等，讓侯大表不滿，認為青鳥惡意造謠，毫無是非底線，散播不實圖卡，連藍營要廢潛艦、禮讓曹興誠這種謠言都能傳，顯然明知錯誤訊息而惡意散播，告發違反社維法。請繼續往下閱讀...警方受理報案後，循線查出製作圖卡的王姓男子到案，王男辯稱，他所發布的內容均有相關新聞與政治消息可以佐證，再配合網友們的討論，並有註明是網路消息，或是引述他人意見，而非無中生有，不算散佈謠言。高雄地方法院簡易庭審理時，法官認為，王男所陳述的內容，應是以自身經驗、理解、判斷與評價，進行個人意見表達及評論，當屬言論自由保障範疇，且他製作的圖卡充斥發表者主觀懷疑，民眾閱讀後理應知悉發佈貼文目的乃在訴諸公眾討論，不致於直接相信圖卡中所述內容為真，因此認定不構成違反社維法，裁定王男不罰，可抗告。侯漢廷告青鳥散布謠言，但法官認為是言論自由裁定不罰。（翻攝侯漢廷臉書）熱門賽事、球星動態不漏接    ,https://news.ltn.com.tw/news/society/breakingnews/5250728
信了「黃仁勳送書」！ 老婦「繞道匯款」砸200萬 銀樓拒做生意拆彈,社會,2025/11/19 10:19,銀樓老闆不願做這筆違背良心的生意，並請警方到場協助。（警方提供）台中一名81歲許姓婦人誤信「黃仁勳送書」廣告，差點落入假冒名人投資陷阱，還因到銀行提款未果，打算以購買價值200萬元黃金方式「繞道匯款」，所幸銀樓老闆察覺不對、拒做「違背良心生意」，並聯手警方苦勸成功阻詐，保住她多年積蓄。事件發生在台中市第三分局立德派出所轄內，許婦到銀樓要求購買200萬元黃金，但付款方式卻異常詭異，她說銀行不讓提領，希望銀樓先開收據，再由銀行直接匯款給店家，銀樓老闆聽完直覺「大事不妙」，因近期銀行阻詐案例頻傳，判斷許婦應是提款受阻後轉用「買黃金繞過銀行」的方式付款，立即婉拒交易並報警求助。請繼續往下閱讀...警方到場時，許婦全身帶著戒心不願透露帳戶資料，甚至急著離開，口中還不停說「到此為止」，員警與老闆耐心安撫直到許婦鬆口，才曝光這場詐騙，她說長年旅居海外，近日返台網路上看到「黃仁勳免費送書」廣告，以為是名人活動而加入。對方先用「送書」建立信任，再由「助理」邀她投資一支「即將上市股票」，聲稱穩賺不賠，她近日到銀行提款時銀行察覺異常，通報警方到場，讓她從白天等到銀行關門仍無法提款，情緒疲累的她認為是銀行「刻意為難」，才打算從黃金交易著手，試圖繞過銀行。警方提醒許婦「如果不是覺得事情不單純，哪個老闆會放棄200萬元的大生意？」一句話讓許婦怔住，終於意識到正被詐騙利用，終於露出笑容打消買黃金念頭，對員警與老闆說：「今天真的遇到貴人了！」員警隨後到場，聯手銀樓老闆阻詐。（警方提供）熱門賽事、球星動態不漏接    ,https://news.ltn.com.tw/news/society/breakingnews/5250725
獸醫師國考 天兵考生竟在考場拿手機查解答,社會,2025/11/19 09:59,吳姓考生國考獸醫師，竟在考場拿手機查解答被逮。（資料照）某科大獸醫系畢業的吳姓男子，為了取得獸醫師執照，報名參加國家考試時，發現題目不會寫，他竟拿出手機打開google搜尋引擎，把題目輸入後找解答，當場被監考人員查獲，檢方偵查時，吳坦承犯行且深表悔意，被檢察官處分緩起訴，但須向公庫支付6萬元。檢方指出，去年7月20日，「113年專門職業及技術人員高等考試獸醫師考試」在輔英科大舉辦，當天第二節考試科目「獸醫藥理學」科目時，32歲吳姓考生因不會作答，他竟從身上掏出手機，打開google搜尋引擎，把題目輸入後找解答，當場被監考人員查獲。請繼續往下閱讀...監考人員根據規定，當場將該科處分扣考不予計分，並禁止吳姓考生繼續參加考試，並將他函送檢方偵辦；高雄地檢署偵查時，吳姓考生坦承犯行，檢察官念他是初犯，且沒有前科，加上犯後態度良好，依涉犯妨害考試罪處分緩起訴，並要求他須向公庫支付6萬元。熱門賽事、球星動態不漏接    ,https://news.ltn.com.tw/news/society/breakingnews/5250687
高雄女中遭冒用制服拍片「乖乖女變壞女孩」 作者挨告不認有錯,社會,2025/11/19 09:51,高雄女中遭冒用制服拍片「乖乖女變壞女孩」，學校提告。（記者黃良傑攝）高雄一名吳姓男子日前拍攝以高雄女中學生「乖乖女變壞女孩」的素材影片PO網，引發學校、家長會、校友不滿，指吳男消費雄女甚至侵權，請來非該校女學生著雄女制服，以影響校譽及涉及商標法提告，警方今將傳吳男到案說明。據了解，吳男也有以雄中學生為題拍類似作品，警方今電話通知並詢問吳男拍影片目的，他自稱是創作，不承認有錯，但網友紛紛留言「太過份了，告死他！」、「不要來蹭雄女」、「造假拍片很沒水準」，也有網友認為沒什麼大不了。請繼續往下閱讀...影片女主角先穿上高雄女中制服，再以將乖乖女變壞女孩為橋段，換下制服改穿性感露臍的服飾，主持人還詢問她是否有男友，可以交雄中男同學，但女主角回自己喜歡「89」，但女主角的制服沒繡學號又成熟，被網友質疑造假雄女學生，校方也嚴正表示，學校並無該名女學生。雄女除提告外，今也發出聲明，針對校外人士拍攝不實影片「改造雄女」，引發輿論案，說明如下：一、本案爭議影片，屬未經雄女師生同意即冒用雄女名義拍攝之情形，且影片內容損及雄女聲譽，已造成師生深感不適，校方已於第一時間循各管道澄清、完成校安通報並至警局報案，將續循法律程序提告以正視聽，並維護校譽。二、學校並於今日向師生宣導，提醒學校師生留意他人邀約訪問之風險，提高自我保護警覺，共同維護校譽；並再次重申，學校校徽、書包、制服、校名均有註冊商標，如有引用須經學校同意始得使用。三、教育局鄭重呼籲，校園為教育之場域，請社會大眾多關注學校師生在各領域的多元表現，此影片已全然背離學校教育活動現況且有違反性別平等教育之意涵，請外界切勿再行轉傳。熱門賽事、球星動態不漏接    ,https://news.ltn.com.tw/news/society/breakingnews/5250679
男閨蜜為她抱不平遭狠刺心臟慘死 嘉義行凶醋男二審仍判14年,社會,2025/11/19 09:49,嘉義王姓男子涉持刀刺死為其前女友黃姓女子出頭的陳姓男子，高等法院台南分院19日仍判王男14年徒刑。（記者王俊忠攝）嘉義1名王姓男子因懷疑黃姓前女友與黃女的陳姓男閨蜜過從甚密，陳男在網路批評王男，王覺得遭羞辱。2024年11月12日凌晨，王男撂多人到黃女父親租屋處與對方談判，王與陳男一度口角後暫歇，稍後，王竟拿出預藏水果刀對陳猛刺2刀、刺穿心臟，陳被送醫仍不治。一審國民法官庭判王男14年徒刑；案子上訴二審，高等法院台南分院19日仍判王男14年刑。據了解，27歲的黃女與33歲的陳男（死者）是閨蜜好友關係，黃女與王男（34歲）分手後，她於2024年11月11日晚間9點許，與陳男、李姓男子在嘉義市1家酒吧喝酒，黃女對陳男兩人訴說她與王男交往時發生的問題。請繼續往下閱讀...陳、李兩男為替黃女出氣，就用陳男手機上的IG社群對王男表達不滿，陳、王雙方在網路隔空互嗆、相約談判，王男覺得受辱、於11月12日凌晨2點許，邀集6名友人一起到嘉義水上鄉黃女父親租用的1處鐵皮屋客廳。當時黃女一方也有黃女與黃父、陳男等5人到場，王男先跟陳男發生口角爭執，在現場眾人勸阻後，原本以為糾紛已結束。當天凌晨3點許，王男趁其他在場人不注意之際、拿出1把預藏的水果刀，朝陳男身上猛刺2刀，先後刺中陳男左手前臂與左側胸腔，還刺穿陳男的心包膜與心臟，陳男被送醫後仍因大量出血、傷重不治。王男與其友人則是在王犯案後開車前往嘉義布袋地區，沿路王男將血衣棄置路邊、並將水果刀凶器丟到海邊。警方獲報後組成專案小組，很快將王男及相關友人查緝到案，依殺人罪嫌法辦王男。熱門賽事、球星動態不漏接    ,https://news.ltn.com.tw/news/society/breakingnews/5250680
狂戀女房仲同業 手機亮實體保險套......付10萬元代價,社會,2025/11/19 09:19,男子手機翻到背面，用保險套暗示想與對方發生性關性，被判2月徒刑。示意圖。（記者顏宏駿攝）彰化縣陳姓房仲，瘋狂追求女同業，但「郎有意，妹無情」，陳男變本加厲，狂發LINE簡訊給對方，要求見面、請客或發生性行為，男方最後栽在亮出保險套給女方看，法院依跟騷法判刑2月確定，被害人進一步提起民事訴訟求償250萬元，最終判決應賠償10萬元精神慰撫金，但其餘求償因舉證不足遭駁回。這起案件發生於2022年間，陳男狂戀女方，展開一連串騷擾行為。他不顧對方明確拒絕，持續透過LINE瘋狂傳訊、電話轟炸，反覆要求請客吃飯、相約見面，甚至威脅要向其所屬公司檢舉女方在業務上的劣行。最嚴重的是，有一次約女方在彰化某超商見面時，竟故意展示放在手機背面的保險套，暗示威脅發生性行為，或要求支付款項，否則將持續騷擾。請繼續往下閱讀...這些持續騷擾行為導致被害女子身心嚴重受創，經診斷罹患慢性創傷後壓力症，出現抑鬱、焦慮、失眠等症狀需長期服藥。女方因此43個月無法工作，加上精神慰撫金，共向陳男求償250萬元。陳男辯稱，被害人首次就診距離騷擾行為已隔4個多月，難以證明與他的行為有直接關聯，且求償金額過高。法官審理後認定，陳男無視被害人意願，反覆要求見面、請客甚至暗示性行為，已超出社會容忍範圍，屬於跟蹤騷擾行為，侵害被害人私人生活自由權，情節重大應負賠償責任。法官表示，雖然被害人提出診斷證明，但首次就診距騷擾事件已隔4個月，且未持續治療，加上稅務資料顯示被害人後續仍有工作收入，因此這部分請求無法支持。審酌雙方學歷、經濟狀況及侵害程度，核定精神慰撫金以10萬元為適當。全案仍可上訴。熱門賽事、球星動態不漏接    ,https://news.ltn.com.tw/news/society/breakingnews/5250642
運將您累了嗎？小黃司機辦證後忘了車停哪 警耐心追查找回,社會,2025/11/19 09:16,警員劉映佑與楊姓小黃司機。（記者劉慶侯翻攝）楊姓計程車司機到台北市交通大隊辦理職業登記證換發手續，不知是否因看到平日經常接觸的交警過於緊張，抑或是工作太疲累，事後居然忘了自己的計程車停在何處，最後還是靠中正二分局南海派出所員警調閱街頭監視器畫面追蹤，才終於找回自己的謀生工具。楊姓小黃司機是日前下午前往南海派出所報案求助，表示當日上午到交通警察大隊辦理計程車職業登記證換發手續，臨時將車輛停放在附近路段，離開後卻一時忘記確切停放地點，遍尋不著，焦急萬分，請求警方協助。請繼續往下閱讀...警員劉映佑了解情況後，透過調閱周邊路口監視器畫面，逐一比對楊男駕駛動線與停車位置，經耐心搜尋，最終在延平南路與愛國西路口發現對方的計程車。劉員立即通知楊男前往確認，確認無誤後順利尋回車輛。楊男對警方積極熱心的協助表達由衷感謝，頻頻致謝，直呼「真的太感謝警察幫忙了！」熱門賽事、球星動態不漏接    ,https://news.ltn.com.tw/news/society/breakingnews/5250629
為了3萬元代收2瓶大麻膏包裹 失業男沒拿到錢還被判刑6年,社會,2025/11/19 09:08,大麻膏屬於第二級毒品。示意照，非本案毒品。（資料照）黃姓男子為了3萬元報酬，代收利用國際包裹闖關的2瓶大麻膏，結果被海關人員發現查扣，依運輸第二級毒品罪將黃男送辦，屏東地院審酌黃男自白坦承犯行及危害程度後，予以減刑，依共同運輸第二級毒品罪判處6年徒刑，可上訴。黃男去年6月間以3萬元代價接受身分不詳「John強」的委託，代收從美國舊金山空運到桃園機場的2瓶機油包裹，海關人員發現包裹有異，進一步查驗後，確定成份並非機油，而是二級毒品大麻膏，重量約2347公克，檢調單位據報後循線將包裹收貨人黃男查緝到案。請繼續往下閱讀...黃男供稱，他因為失業沒有錢看病，透過朋友介紹聯繫上「John強」，他並不清楚「John強」的真實身分，雙方只靠電話聯繫，說好要給他3萬元，但最後他也沒有拿到這筆錢。屏東地院認為，黃男以空運寄送包裹方式運輸大麻，試圖利用正常物流夾藏毒品闖關，嚴重危害我國邊境管制，考量黃男犯後自白坦承犯行及犯罪角色、危害程度等因素，予以酌減輕其刑，依共同運輸第二級毒品罪，判處有期徒刑6年。熱門賽事、球星動態不漏接    ,https://news.ltn.com.tw/news/society/breakingnews/5250628
網路交友花3000元買點數「有好康」 73歲翁反悔竟收血腥照恐嚇,社會,2025/11/19 08:48,蔡姓老翁網路交友不願花錢買點數，沒想到對方立刻傳來血腥照片與恐嚇訊息，嚇得他不知所措。（圖由民眾提供）彰化1名73歲蔡姓老翁日前在網路交友APP結識年輕女子，被甜言蜜語迷得心花怒放，女子還表示，只要幫忙購買3000元apple點數，就有「好康的」（性交易），令蔡男感到心動，走進超商準備付款，但他臨時覺得不對勁想反悔，沒想到對方立刻傳來血腥照片與恐嚇訊息，嚇得他不知所措。所幸店員通報警方到場勸阻，成功阻詐。警方表示，員警到場時發現蔡翁正準備購買3000元點數。員警上前詢問用途，他卻面露難色、一度支吾其詞。直到警方耐心安撫、提及多起類似案例後，他才卸下心防哭訴：日前在交友軟體結識一名年輕正妹，以性交易為誘餌，要求以點數付款，他拒絕後，對方隨即傳來血腥照片和威脅訊息，逼他「一定要買」，否則會對他不利，讓他嚇得跑到超商準備付款。請繼續往下閱讀...員警檢視雙方對話紀錄後，告知蔡翁這是典型的「假交友結合恐嚇」詐騙手法。詐騙集團先以美色或愛情為誘餌，取得信任後便要求購買遊戲點數（因點數追蹤難、變現快）支付，一旦受害者猶豫或拒絕，隨即以暴力、黑道尋仇等話術進行恐嚇，逼迫就範。經員警一番勸說，蔡翁恍然大悟，差點險入陷入詐騙圈套，這才放下心中大石，感謝警方與店員的協助，並順利返家。熱門賽事、球星動態不漏接    ,https://news.ltn.com.tw/news/society/breakingnews/5250604
台中宮廟燒金紙釀民宅火警 法院判賠79萬元,社會,2025/11/19 08:36,台中善修宮舉辦補財庫活動，卻因燃燒紙錢引發鄰宅火警，台中地院判賠79萬元。（記者陳建志攝）台中市善修宮2023年11月舉辦補財庫活動，信徒在金爐燃燒紙錢，卻造成附近杜姓民眾的房子起火受損，杜男事後提告損害賠償，要求善修宮和吳姓董事長要連帶賠償146萬多元，因台中市消防局火場調查，判定金紙餘燼是造成此次起火的原因，台中地院判決宮廟和吳姓董事長要連帶賠償79萬7695元，可上訴。判決指出，財團法人台中市善修宮2023年11月25日下午4點43分至5點6分間，舉辦補財庫活動，信徒在宮中金爐燃燒金紙後，餘燼不慎飄散至附近杜姓民眾的房子，造成起火燃燒受損，包括清運費、鐵工重建費、輕鋼架及油漆、水電、租金，向善修宮及其吳姓董事長，連帶求償146萬3550元。請繼續往下閱讀...吳姓董事長在審理時則否認對善修宮的設置保管有缺失，強調宮廟並非他所有，也不是受僱人，雖掛名為董事長，但並未領取勞務報酬，也不用打卡上班，不須負起連帶賠償責任。並認為杜男的報價單未計算折舊，且所列項目是否確會施作，有無施作必要也不確定，房屋受損重建時間長達2年的租金損失也太高。消防人員作證則指出，從監視器影像可看出，當天下午3點5分善修宮有進行補財庫的儀式，下午4點1分已有很多信徒在燒金紙，而現場金爐上面煙囪的金屬網蓋沒有密封，還留有縫隙，因金紙會往上，餘燼可能就會飛出來，起火處並有看到金紙的殘留物鋁箔，因縱火、電氣因素、菸蒂及爆竹煙火等因素都排除，但金紙餘燼（飛火）引燃可能性無法排除，依專業判斷，認為是金紙餘燼造成此次起火。台中地院法官勘驗現場相關照片，因在火警現場烤漆浪板屋頂西側附近，遺留樹木枯枝落葉受燒碳化、燒失，且燒損殘餘物中發現金紙鋁箔；加上善修宮的金爐煙囪，金屬網罩受燒變色，殘留大量金紙餘灰燼，檢視金屬網罩與鐵蓋，頂部留有空隙未密合，認定金紙餘燼自煙囪頂部縫隙逸出，點燃緊鄰的屋頂枯枝導致此次民宅火警。因金爐煙囪屬善修宮燃燒金紙所需使用的設備，燃燒金紙亦屬善修宮進行宗教祭祀活動的過程，而宮廟吳姓董事長有定期檢查金爐煙囪並使其具有相當安全性的義務，判決善修宮和吳姓董事長要連帶賠償79萬7695元。熱門賽事、球星動態不漏接    ,https://news.ltn.com.tw/news/society/breakingnews/5250593
