Title,News_Type,date,content,url
普發現金1萬陸續入袋 金山警宣導可能詐騙手法,社會,2025/11/14 12:13,新北市警局金山分局偵查隊今天上午在萬里武聖堂舉辦反詐宣導講座，宣導詐團利用普發現金可能運用的詐騙手法，提升市民防詐意識與防詐能力。（記者林嘉東翻攝）普發現金新台幣1萬元上路，內政部統計至10日，相關詐欺被害案件已發生7件，單件財損最高為367萬元。新北市警局金山分局為強化金山市民反詐騙防護意識，今（14日）上午在萬里武聖堂舉辦反詐宣導講座，宣導詐團利用普發現金可能運用的詐騙手法，以淺顯易懂的方式解說詐騙手法及防範技巧，提升市民防詐意識與防詐能力。武聖堂關懷據點長期投入地方公益，不僅是居民信仰的中心，更是凝聚社區力量的重要據點，金山分局識詐宣講團與武聖堂關懷據點合作，今天上午10點在武聖堂舉辦反詐宣導講座，針對當前正在普發現金1萬元的流程進行宣導，並透過案例分享，讓與會者市民能瞭解詐團利用普發現金可能運用的詐騙手法。請繼續往下閱讀...為了關懷據點中的年長者，警方在宣導反詐時，除搭配視覺輔助材料，讓年長者能理解，準備多樣化的反詐小物，如防詐濕紙巾、提袋、吊飾等作為宣導紀念品發送，加深民眾對詐騙行為的辨識能力，遠離詐騙威脅。金山警分局長楊力強說，普發現金新台幣1 萬元上路，內政部統計至10日，相關詐欺被害案件已發生7件，單件財損最高為367萬元，因此打擊詐騙已是治安工作的「重中之重」，唯有地方政府、警力與社區緊密合作，才能建立完善的防詐網絡，未來金山分局會透過更多社區活動結合犯罪預防宣導，提升民眾的防範意識，將識詐知識向下扎根，建立一個安全無虞的社會。新北市警局金山分局偵查隊今天上午在萬里武聖堂舉辦反詐宣導講座，宣導詐團利用普發現金可能運用的詐騙手法，提升市民防詐意識與防詐能力。（記者林嘉東翻攝）熱門賽事、球星動態不漏接    ,https://news.ltn.com.tw/news/society/breakingnews/5245859
房東幫車禍住院的房客拿手機 自己也車禍,社會,2025/11/14 12:04,機車與同方向自小客相撞後倒地，所有車輛繞道而行。（民眾提供）今早10時許，台9線發生一起車禍意外，78歲的彭姓阿公，今天早上聽聞自己的房客因車禍受傷住院並前往探視，得知房客沒有帶手機，於是前往租屋處協助取回，卻與一輛機車發生撞擊，機車騎士安全帽當場噴飛，台9線交通因此受阻。據警方初步調查以及目擊者所言，房東正在路中央迴轉時，年約19歲的男性機車騎士正由南往北前進，閃避不及而撞上。請繼續往下閱讀...房東雖是高齡駕駛，但其駕照已重新通過審核，反觀19歲的機車騎士卻是無照，只是失事路段為雙黃線，不得迴轉，詳細肇事原因仍待釐清。機車與同方向自小客相撞後倒地，所有車輛繞道而行。（民眾提供）機車與同方向自小客相撞後倒地，所有車輛繞道而行。（民眾提供）熱門賽事、球星動態不漏接    ,https://news.ltn.com.tw/news/society/breakingnews/5245828
男駕駛宿醉上路載愛妻就診 文山警開罰後助攔計程車,社會,2025/11/14 11:57,車輛煞不住，停在斑馬線上。（記者鄭景議翻攝）50歲的朱姓男子，昨日上午因急著載愛妻前往台大醫院就診，儘管知道自己仍處於宿醉狀態，仍心存僥倖開車上路。朱男行經北市文山區羅斯福路口時，因煞車不及停在斑馬線上，還剛好停在正在執行交通整理的文山第二分局員警面前，當場被測得酒測值達每公升0.24毫克。警方依法開罰並將轎車移置保管，同時卻也暖心協助朱男攔計程車，讓其妻子能順利就醫。文山第二分局萬盛派出所巡佐湯新政、警員許哲維於日前上午在羅斯福路與萬盛街口執行勤務時，發現一台轎車停等紅燈時煞車不及，佔用了斑馬線。員警見狀上前盤查，發現朱姓駕駛散發濃濃酒氣。請繼續往下閱讀...經了解，朱男坦言前一晚於松山區與友人聚餐飲酒，昨日清晨為載愛妻前往台大醫院就診，擔心遲到才匆忙上路，沒想到因宿醉反應變慢，煞車不及而違規佔用行穿道。警方現場依道路交通管理處罰條例第35條第1項規定舉發，並當場移置保管車輛。員警也體恤朱男情況，隨後協助其攔計程車，讓其妻子能先行赴醫。文山第二分局呼籲，飲酒後無論時間過多久，都應避免駕車。一旦宿醉反應變慢，極易發生危險，切勿心存僥倖，以免觸法。熱門賽事、球星動態不漏接    ,https://news.ltn.com.tw/news/society/breakingnews/5245846
彰化某高職「格鬥賽」大門口開打！網友瘋傳熱議,社會,2025/11/14 11:48,兩派人馬在學校的大門口開打。（民眾提供）南彰化一間高職發生「校園格鬥」，且開打的地方竟然就在學校大門口！這起衝突雖然不到1分鐘，但因為就在學校大門，又於上學時分，許多人目睹拍攝，並PO到網路，結果引發網友瘋傳。畫面中的學生在大門口開打，讓這間學校在網路爆紅，校方也緊急啟動輔導機制，警方也介入處理，希望穩定學生情緒、避免類似狀況再度發生。請繼續往下閱讀...事件發生在13日早上8點07分，正值學生上學尖峰時段。數名學生在校門外馬路上突然發生拉扯，打得難分難捨，周圍聚集不少圍觀同學，氣氛一度緊張。幸好學務主任與幾位老師當時正在校門口執行交通導護，一看到狀況，立刻上前分開雙方，並將相關學生帶離現場。由於處理迅速，衝突未進一步升級為打群架，也未影響其他學生上課安全。雖然衝突不到1分鐘，但最尷尬的莫過於校方，因為衝突過程被路過民眾或學生拍下影片上傳網路，在社群平台瘋傳。警方得知後主動啟動調查，目前已確認有3名學生涉案，初步了解疑似因之前在網路上的留言引發不滿，雙方互看不順眼才在校外爆發衝突。詳細事發原因及責任歸屬，仍由警方進一步釐清中。校方表示，雖然衝突未造成人員受傷，但為避免學生情緒受影響及類似事件重演，將立即為全校學生安排心理輔導與法治教育，加強宣導網路使用規範及衝突處理方式。同時也呼籲學生，遇到問題應尋求師長協助，而非以暴力解決，共同維護校園安全。熱門賽事、球星動態不漏接    ,https://news.ltn.com.tw/news/society/breakingnews/5245824
坦承誤釋人犯北所致歉  將配合究查疏失,社會,2025/11/14 11:43,台北看守所坦承誤釋人犯，向社會致歉。（資料照）台北看守所今年10月誤將新北院裁定接押的人犯釋放，引發譁然。對此，北所發聲明致歉，造成社會及相關單位困擾深感歉意，將配合矯正署及政風單位究查疏失責任，依法嚴處。台北看守所表示，被誤釋的許姓男子因傷害罪入監執行2月有期徒刑，另涉加重妨害自由罪嫌於10月23日出庭後，新北地院裁定接續羈押處分，惟本所疏未查明登載，導致許男10月25日執行期滿後釋放。請繼續往下閱讀...台北看守所指出，本所於10月26日自行查悉上情，主動通報許男案件繫屬的地檢署、法院及轄區警察機關，並立即派員協同警方啟動搜尋、聯繫與查緝作業，經法院陸續發布拘提及境管處分，於同月29日緝捕該員到案，30日再次裁定入所羈押。台北看守所強調，案發後，已立即嚴正檢討收容人釋放及羈押程序，精進作業流程，將加強人員訓練與業務查核機制，杜絕類此事件發生，此次造成社會及相關單位困擾深感歉意，將秉持勿枉勿縱態度，配合矯正署及政風單位究查疏失責任，依法嚴處，絕不寬貸護短。熱門賽事、球星動態不漏接    ,https://news.ltn.com.tw/news/society/breakingnews/5245823
詐領助理費近900萬！國民黨前基市議員韓良圻判刑定讞 基檢啟動防逃機制,社會,2025/11/14 11:27,國民黨籍前基隆市議員韓良圻詐領助理費案，最高法院昨維持二審原判有期徒刑7年4月，全案定讞。（資料照）國民黨籍前基隆市議員韓良圻涉以人頭詐領議員助理費及慰問金近900萬元，一審依貪污治罪條例「利用職務詐取財物罪」判刑8年；上訴二審後，查出犯罪所得為658萬餘元，因此改判有期徒刑7年4月。最高法院昨駁回上訴，全案定讞。基隆地檢署今（14日）啟動防逃機制，確保韓能如期到案執行。韓良圻被控在5任議員期間，以簡姓人頭與乾兒子名義申報公費助理，詐領月薪及春節慰勞金共達889萬7109元，韓另被控教唆兒子韓東叡在無交易情況下，於公司帳冊虛列8萬元工程費，涉犯商業會計法填製不實會計憑證罪。請繼續往下閱讀...基隆地方法院依貪污治罪條例利用職務詐領財物罪，判處韓良圻8年徒刑、褫奪公權4年，並追繳未扣案犯罪所得893萬6738元；另教唆長子韓東叡填製不實會計憑證部分，則依涉犯商業會計法「虛偽填製會計憑證並入帳罪」判刑4月，得易科罰金12萬元。韓的助理楊士弘，依使公務員登載不實文書罪判刑6月，得易科罰金18萬元。基隆地檢署發言人、主任檢察官黃聖表示，韓良圻利用人頭詐領助理費案已判決確定，基隆地檢署依高等檢察署指示啟動防逃機制後，立即依法辦理限制出境、出海處分等相關防逃措施，並於近日核發傳票，傳喚韓到案執行。熱門賽事、球星動態不漏接    ,https://news.ltn.com.tw/news/society/breakingnews/5245802
月薪122萬的引水人登船摔斷腿 10個月無法工作獲賠1296萬元,社會,2025/11/14 11:18,劉姓引水人登船不慎摔斷腿，獲賠1296萬元。示意圖，非當事人（資料照）平均月薪高達122萬元的劉姓引水人，擔任順興輪進入高雄港的引水工作時，爬上繩梯登船不慎摔落，導致左腳挫傷併跟骨粉碎性骨折，長達10個月無法工作，他認為船公司未做好防護作業，提告求償1566萬元，法官認定船公司有責，判賠1296萬元。判決指出，登記在塞席爾國的「順興輪」，負責人則是中國籍蔡姓男子，2021年8月18日，順興輪準備入高雄港裝貨，並補充船上民生物資，高雄引水辦事處派劉姓引水人搭乘交通船，停靠順興輪左舷梯組處，隨後攀爬繩梯欲登上順興輪，但攀爬過程中，順興輪的扶手欄杆未妥善固定，導致劉姓引水人從高處墜落，導致左腳挫傷併跟骨粉碎性骨折。請繼續往下閱讀...劉姓引水人認為船公司未做好防護作業，害他受傷無法工作賺錢，提告求償1566萬元；高雄地方法院審理時，蔡姓男子未到庭辯護，船公司則辯稱，是劉男自己未抓穩登船繩梯而摔下，順興輪所有權人或管理人並無過失，不應該賠錢。但法官綜合相關事證後，發現船上扶手欄杆並非固定式，而屬活動式，每次有人員上下船需求時，皆會重新放下繩梯再重新插上扶手欄杆，曾有監管人提醒船公司扶手攔杆不固定會旋轉，不符合法規，但船公司卻一直沒有改善，因此認定船公司有責，並根據劉姓引水人平均月薪122萬元計算，判船公司和蔡男應連帶賠償1296萬元，可上訴。熱門賽事、球星動態不漏接    ,https://news.ltn.com.tw/news/society/breakingnews/5245793
高雄小港半聯結車變換車道 釀連環車禍,社會,2025/11/14 11:14,白色轎車擦撞後衝過安全島，又與另部轎車碰撞。（民眾提供）高雄市小港區今（14）日發生連環車禍，半聯結車駕駛李男疑因變換車道不當，擦撞同向黃男轎車，致轎車衝過安全島擦撞對向王男的轎車，黃男與副駕乘客2人受傷送醫，警方正釐清事故原因。小港分局小港派出所、小港交通分隊上午9時5分許接獲通報，於小港區中山四路與大業北路口有交通意外事故，旋即派員到場處理，並測繪交通意外事故現場圖及指揮管制與疏導交通。請繼續往下閱讀...經查，53歲李男駕駛半聯結車行經中山四路北上快車道時，疑似變換車道不當，不慎擦撞同向53歲黃男所駕駛的轎車，致該車衝過安全島，又與對向39歲王男所駕駛的轎車發生擦撞。李、王2位駕駛未受傷，另黃男及車上乘客身體擦挫傷，經送小港醫院救治無大礙。案經酒測均無酒駕情事，警方於現場指揮管制與疏導交通，9時55分排除道路障礙，交通恢復順暢。詳細肇事原因，尚待市警局交通警察大隊進一步分析研判釐清。李男駕駛的半聯結車發生擦撞事故。（民眾提供）警方處置小港區中山四路車禍。（民眾提供）熱門賽事、球星動態不漏接    ,https://news.ltn.com.tw/news/society/breakingnews/5245795
宜蘭市代會主席林智勇假車禍詐保 判4年6月定讞,社會,2025/11/14 11:06,判決指出，宜蘭市代會主席林智勇被控以奧迪自撞、再教司機製造假車禍企圖詐保未遂，最高法院維持4年6月刑度，全案定讞。（資料照）曾五連霸的無黨籍宜蘭市民代表會主席林智勇，4年前以市代會公務車製造假車禍，企圖詐領近百萬元保險金未遂。一審依貪污治罪條例「利用職務機會詐取財物未遂」罪，判刑4年6月、褫奪公權3年；二審維持原判。林不服再上訴，最高法院認定原判決認事用法並無違誤，今予以駁回，全案定讞。林智勇目前仍在羈押中，因此無法得知他的回應。他出身政治世家，父親林李榮華曾任宜蘭縣議員，伯父林榮星擔任過宜蘭縣議會議長。他32歲時首次參選宜蘭市代即當選，並隨即出任市代會主席，其後成功五連霸。請繼續往下閱讀...判決指出，林智勇於2021年6月駕駛市價約740萬元的自家灰色奧迪RS7，自撞電桿與水泥護欄。因僅投保丙式車體損失險，不理賠自撞事故，他遂策畫以市代會公務車製造假車禍，企圖申請公務車所投保的任意汽車第三人責任險及超額責任保險（俗稱「超跑險」），第三人車損最高可理賠1050萬元。為此，林先讓奧迪摩擦電線桿，並高喊「從那裡撞下去」，指揮陳姓司機駕駛公務車從後方撞上奧迪，再由司機報案申請理賠。不過，保險公司發現事故電桿未塗上黃黑斜紋，奧迪車頭卻留有黃漆，質疑撞擊痕跡不符，陳男最後匆忙撤回理賠申請。檢方認為，林智勇身為市代會主席，非但未以身作則，反而利用職務圖謀私利，事後還試圖卸責、誤導案情，將罪過推給司機，藐視司法，因此起訴並建請量刑7年、褫奪公權7年。宜蘭地方法院一審依詐取財物未遂罪判刑4年6月、褫奪公權3年；高等法院二審認為，一審未將超跑險理賠金納入詐領未遂範圍，故撤銷部分犯罪事實，但罪名與刑度仍維持原判。本案再經上訴，最高法院認定原判決認事用法並無違誤，今予以駁回，全案確定。熱門賽事、球星動態不漏接    ,https://news.ltn.com.tw/news/society/breakingnews/5245780
8次來台專偷大賣場3C產品  港籍男子機場落網,社會,2025/11/14 11:03,警方現場查扣藍牙耳機4副、觸控筆2支（記者劉慶侯翻攝38歲的吳姓香港籍慣竊，自去年底就鎖定台灣的各3C大賣場作為他劫掠的目標，一旦達到他盜竊的數量後，便迅速搭機離境。台北市刑警大隊根據日前受害的商家，逐步鎖定吳嫌，前日在他抵達桃園機場準備要潛逃出境時，透過國境大隊將他攔阻逮捕，起獲藍牙耳機4副、觸控筆2支等證物。警方初步調查，吳嫌在不到一年的時間內，已來台高達八次左右，幾乎都是將贓物帶回香港銷贓，全案先依竊盜罪移送台北地方檢察署，將再溯源偵辦中。請繼續往下閱讀...台北市近期發生多家3C產品賣場的高單價藍芽耳機連續遭竊案件，造成店家損失慘重。經北市大隊偵查第一隊報案，經警方整合報案情資、調閱監視器，分析犯嫌作案手法、時間，逐步鎖定本月5日才持觀光簽免證自香港入境的吳姓嫌犯。警方根據監視畫面調查，吳嫌在進入大賣場後，一旦鎖定要偷竊的產品，便先在商品櫃旁假裝講手機，趁顧客眾多、店員忙碌之際，以外套掩飾下手行竊。由於警方確認吳嫌是香港籍，且是名慣竊，研判對方得手後應會潛回香港，於是立即通知境管單位先行將他列為境管對象，果然在日前對方要搭機離台時，馬上攔阻，北市刑大偵一隊再前往機場逕行拘提。警方在吳嫌的行李箱內查扣藍牙耳機4副、觸控筆2支，隨後將他押返台北市刑警大隊部進行偵訊調查。警方初步清查，吳嫌自113年11月起開始來台行竊，共計有8次之多，期間都是鎖定各高檔3C大賣場作案，每次得手後將贓物攜回至香港變賣，不法獲利高達新台幣十數萬餘元。全案依竊盜罪移送台北地檢署偵辦。熱門賽事、球星動態不漏接    ,https://news.ltn.com.tw/news/society/breakingnews/5245767
傾倒廢棄物到高屏溪行水區賺黑心錢 2環保蟑螂被判刑,社會,2025/11/14 10:51,屏東縣環保局及警方將取締違法傾倒廢棄物行為列為重點工作。示意圖，非本案廢棄物。（資料照）施男與朱姓婦人未具清運廢棄物執照，陸續將收取來的大廢木材、營建混合物直接載至河床傾倒，無視環保法令，賺取黑心錢，警方發現後依違反廢棄物清理法將2人送辦，屏東地院認為2人行為對環境造成危害，各處1年5個月不等徒刑，可上訴。有多次竊盜、公共危險及違反廢棄物清理法等前科的施男及朱婦，未取得廢棄物清除及處理許可文件，擅自承攬一般廢棄物清運業務，在高雄地區向業者收取2萬5000元費用後，於去年5月間多次將廢木材及營建廢棄物運往雙園大橋下的高屏溪行水區傾倒，無視對河川生態環境的破壞。請繼續往下閱讀...警方據報後，循線將施、朱2人查獲，朱婦應訊時坦承犯行，指施男拿到報酬後，會把錢分給她；屏東地院認為，施、朱2人前科累累，素行非佳，對環境永續發展造成危害，行為顯不足取，施男2次違反廢棄物清理法各處1年5月及1年4月徒刑，待全數犯行確定後，再由檢方聲請應執行刑，朱婦犯廢棄物清理法，判處1年2月徒刑。熱門賽事、球星動態不漏接    ,https://news.ltn.com.tw/news/society/breakingnews/5245754
涉淘空遠航36億 張綱維二審仍判刑15年、客機拍賣250萬元不如豪車,社會,2025/11/14 10:45,"高院今仍判決張綱維14年徒刑、可易科罰金部分判1年，可上訴。（資料照）遠航董事長張綱維被控侵占遠航公司款項，並藉由貸款案將樺福旗下公司債務移轉給遠航，涉淘空遠航、詐貸合庫等近36億元，台北地院依違反證券交易法等罪判刑14年、可易科罰金部份判刑1年；張上訴高等法院仍否認犯罪，因配戴電子腳鐶顯示有7度違規而示警，改被當庭羈押，高檢署主張一審判刑過輕，高院今仍判決張14年徒刑、可易科罰金部分判1年，未扣案犯罪所得新台幣19億8415萬多元沒收，可上訴。同案被告方面，鄭晴文觸犯背信等罪判刑11月、得易科罰金之刑判1年1月、緩刑5年，並向公庫支付新台幣100萬元、提供120小時義務勞務及參加法治教育10場次；陳建州觸犯業務侵占等罪，判決得易科罰金之刑1年、緩刑4年，向公庫支付新台幣20萬元、提供80小時義務勞務及參加法治教育6場次。請繼續往下閱讀...目前羈押中的張綱維未出庭聆判，無法得知他對判決看法。遠航慘遭前董事長張綱維淘空受到牽累，連帶使遠航知名的ＭＤ-82客機落得拍賣命運，法務部行政執行署日前公開拍賣遠航所有的ＭＤ-82客機，該機最初首拍底價為672萬元，歷經減價三拍，底價為230萬4000元，最終以240萬元順利拍定，比起動輒3、400萬元豪車還便宜，令人不勝唏噓。台北地檢署調查，遠航公司因前董事長崔湧等人不法行為，財務出現重大危機，向法院聲請重整獲准。張綱維佯裝樺福集團自有資金充裕將注資遠航公司，詐得重整人資格，並取得遠航公司業務經營及財產管理處分權。檢方調查，張綱維隨後陳報不實重整計畫及隱匿高利貸資金來源，完成增資而獲取復航許可，虛增營收美化財報，並侵占遠航公司資金。張涉嫌在2015年至2016年間以「轉調樺壹款」名義，侵占遠航公司總計新台幣13億多元。張綱維也明知遠航於2015年10月帳上已還清所有關係人代墊款，竟為將樺福集團關係人負債轉嫁拋給遠航公司承擔，於2016年間由遠航向合作金庫銀行台北分行貸款22億多元，並將核貸款用以代償樺福公司等關係人於安泰銀行現欠20億多元。另外，遠航2015年底重整完成，隔年立即暴增嚴重財務赤字，張綱維等人為避免遠航公司遭民航局裁罰影響航權，明知「小坪頂房地」市場成交量低迷，竟於2017年12月29日將「小坪頂房地」過戶給遠航，讓遠航承受大批爛尾樓與難以整合開發的不動產，遭受重大財產損害。檢方依涉犯證交法特別背信等罪，起訴張綱維等人。北院去年9月判張綱維14年徒刑，可易科罰金部份判1年徒刑，未扣案犯罪所得32億多元沒收，並命張配戴電子腳鐶，不得接近機場、港口、海岸線等地；遠航副董事長鄭晴文判刑3年，得易科罰金之刑8月；遠航協理陳建判1年3月得易科罰金之刑；合庫前董事長廖燦昌、放貸時擔任合庫副總的黃伯川等人獲判無罪。全案上訴，高等法院發現，張配戴的電子腳鐶顯示有7度違規遭科技監控示警，其中有2次GPS定位在塭仔頭漁港附近，被認定有逃亡之虞，將他拘提到案並當庭收押。張曾以照顧癌母為由，聲請具保停押，但遭高院駁回。高院開庭時，高檢署上訴主張，一審在虛增公司費用逃漏稅的部份，判決張綱維無罪乃不當，另有多項犯行量刑過輕。張否認犯行，喊冤稱應判他無罪，辯稱遠航是他自己1人獨資的公司，沒有被害人，向銀行貸款都有十足擔保，「不明白犯了什麼罪，讓我身敗名裂」。熱門賽事、球星動態不漏接    ",https://news.ltn.com.tw/news/society/breakingnews/5245720
豐原五口命案偵結起訴！詐1536萬逼死全家 「李團長」起訴求刑15年,社會,2025/11/14 10:43,李女被檢方具體求刑15年。（資料照）台中市豐原五口命案震驚社會，檢方認定「團購主」李女以假投資、龐氏騙局長期詐騙王姓一家五口共1536萬元，更以恐嚇與逼債手法造成被害人承受巨大壓力，最終釀成五人集體輕生悲劇，今正式依詐欺取財、等罪起訴，並具體求刑15年，痛斥其惡行重大、毫無悔意，要求法院從重量刑以昭法紀。這起案件起於王家大女兒加入社群團購，透過美容師好友介紹接觸李女，開始購買並代交「黃金投資」標的。因初期有收到回款與手續費，王家誤以為確有利潤可賺，陸續由家中其他成員加入投資。未料這一切僅是以「舊人資金支付新人回款」的典型龐氏騙局，幕後並無真實投資運作。請繼續往下閱讀...檢方調查指出，李女於108年間事業經營不善欠下龐大債務後，於113年6月起開始以「團購黃金」「代購投資」等名義誘騙王家五口投資，共詐得超過1536萬元，更在期間盜刷另一名被害人信用卡4萬多元供自己花用。檢方自案發後成立專案小組每日開會，調閱金流、約談超過30人，並先後數度搜索台中、彰化等地相關地點，包括當舖業者與李女住處，扣得大量證據。李女於第一次約談時一度以「身體不適」拖延筆錄，但在第二波搜索後，檢方認定其涉案重大且有串證、滅證之虞，向法院聲押禁見獲准。台中地檢署經過數月偵查今日偵結，依詐欺取財、銀行法、洗錢、偽造準私文書、恐嚇取財等罪起訴。檢方痛批，李女長期以虛假投資名義行詐，手段惡劣，釀王家五口喪命，具體求處15年刑期。豐原五口命案始末！李女設「龐氏騙局」詐1536萬不認罪 檢批毫無悔意傳血照、嗆找「神經病」殺人！逼死豐原一家五口 女團購主變態手法曝詐欺逼債變死亡漩渦！豐原五口命案遺書內容曝 血淚控訴「無止盡壓榨」熱門賽事、球星動態不漏接    ,https://news.ltn.com.tw/news/society/breakingnews/5245751
