Title,News_Type,date,content,url
新黨游智彬弄留言牆揪「嗆萊爾」 民眾寫下「這句」大批鄉民叫好,政治,2025/12/03 23:10,游智彬弄了一面留言牆，揪大家一起寫下嗆賴清德的話。（圖翻攝自Threads）新黨副秘書長游智彬日前到日本台灣交流協會前抗議，還上演「斬首日本走狗萊爾校長、譴責高市早苗」行動劇，引發砲轟。最近他還弄了一面留言牆，揪大家一起寫下嗆賴清德的話，結果完全無人響應，反倒引來民眾寫下「共匪滾出台灣」，讓大批鄉民叫好。有網友今天（3日）在Threads分享一張照片，可以看到游智彬的服務處前停了一輛宣傳小貨車，上頭放了「萊爾校長」玩偶，車身貼一幅白布，黑字寫著「嗆萊爾！民怨牆！歡迎留言 中壢戰神守護善政 游智彬」。不過，白布上完全沒有嗆賴清德的留言，反倒有一行「共匪滾出台灣」的紅字。原PO看了說，「誰留的言啦，笑死我了！」請繼續往下閱讀...照片曝光後引發熱議，其他網友紛紛留言，「愛死！共匪無誤」、「笑死，直接留一個最大的」、「用魔法打敗魔法」、「放心，藍白會自動超譯成民眾反綠共獨裁」、「後勁強大」、「之後不開放留言了」、「第一次覺得他的車好看」、「在桃園共匪窩貼臉開大」。結果只有一個人留言，留下的還是「共匪滾出台灣」。（圖翻攝自Threads）熱門賽事、球星動態不漏接    ,https://news.ltn.com.tw/news/politics/breakingnews/5266907
台男轉機被捕滯留杜拜 當地檢方仍未發離境許可,政治,2025/12/03 22:49,雲林陳姓男子在阿布達比轉機時遭全副武裝人員帶走，雖已獲釋，但當地檢方仍未完備內部審核程序，無法核發離境許可。（資料照，陳妻提供）陳姓民眾在阿布達比國際機場遭拘捕，日前獲釋，今天辦理解除旅遊禁令手續。外交部表示，當地檢方仍未完備內部審核程序，因此無法核發離境許可，檢方釐清相關問題後將盡速核發離境許可。雲林一對夫妻11月23日晚間從桃園機場飛往阿布達比轉機，陳姓丈夫在阿布達比登機時遭5名武裝警察帶走，11月26日被移送至杜拜警察局關押，直到11月28日獲釋，但仍須於12月3日前往警局辦理後續相關行政程序。請繼續往下閱讀...外交部晚間回覆中央社提問表示，在杜拜警方要求下，陳姓旅客於當地時間3日上午在駐處人員陪同下，前往警方及檢察署辦理後續解除旅遊禁令行政手續。外交部說明，陳姓旅客獲告知，檢方因近日當地連假，仍未完備對此案的內部審核程序，故當天無法核發離境許可，若相關問題皆釐清無虞，將盡速核發離境許可。駐處將持續提相關協助，直至當事人順利平安返國。外交部強調，將持續全力提供此案民眾必要協助，設法釐清相關原因，並在符合當地法令前提下爭取最大權益。熱門賽事、球星動態不漏接    ,https://news.ltn.com.tw/news/politics/breakingnews/5266986
防藥品斷鏈 政院明拍板「藥事法」放寬專案進口規定,政治,2025/12/03 22:07,行政院會明擬通過「藥事法」修正草案，放寬「非必要藥品」也可專案進口，政委陳時中表示，當有許可證的藥品若有供應不足之虞時也可申請專案進口，但仍要經過審查流程。（記者鍾麗華攝）國內輸液大廠永豐化學因違反「藥事法」，去年5月遭衛福部食藥署勒令停業，導致生理食鹽水缺貨，中央後啟動專案進口救急，但遭質疑於法無據。行政院會明擬通過「藥事法」修正草案，放寬「非必要藥品」也可專案進口，當有許可證的藥品若有供應不足之虞時也可申請專案進口，但仍要經過審查流程。據現行藥事法第27條之2，中央衛生主管機關於接獲通報或得知必要藥品有不足供應之虞時，得登錄於公開網站，並得專案核准該藥品或其替代藥品之製造或輸入，不受第39條的限制。請繼續往下閱讀...行政院政委陳時中指出，修法能幫助政府更清楚掌握「必要藥品」，過去明定廠商停止製造6個月以前、天然災害不可抗力發生的30天內要向食藥署報告，未來為更清楚掌握必要藥品供應，因此修正為要求業者「定期」向食藥署報告許可證藥品的製造、輸入及供應情形，至於「定期」的頻率會再與業者討論，目前傾向3個月。陳時中表示，現行「專案核准」僅限於「必要藥品」，修法增列有「供應不足之虞」時可啟動專案進口，亦即生理食鹽水等不在必要藥品清單上的品項，可用專案核准方式進口，這是符合民眾、社會需要的必要措施，強調相關輸入審查流程不變。配合修正，陳時中說，考量專案核准製造或輸入亦為因應普遍性醫療需求事件，因此藥害救濟法第3條第2款也修正合法藥物的定義，增訂因應具有藥品許可證藥品有供應不足之虞、因應緊急或重大影響公共衛生情事得專案核准製造或輸入藥品，納入藥害救濟制度。熱門賽事、球星動態不漏接    ,https://news.ltn.com.tw/news/politics/breakingnews/5266975
李有宜退黨 莊貽量：民眾黨中央決策越來越集中「小圈圈」,政治,2025/12/03 21:56,莊貽量表示，民眾黨中央決策越來越集中「小圈圈」。（記者王榮祥翻攝）民眾黨前發言人李有宜退黨引起討論，民眾黨前高市黨部主委莊貽量今發文痛陳，民眾黨中央決策越來越集中小圈圈，真正紮根基層的人被邊緣被冷處理，提醒當一個政黨開始只相信小圈子，就會逐漸失去真正願為土地付出的人。莊貽量表示，最近李有宜離開民眾黨引起討論，他覺得這不只是個人去留問題，而是讓本土政治看到一個關鍵現象，當政黨開始只相信小圈子，就會逐漸失去真正願意為土地付出的人。請繼續往下閱讀...他指出，自己看著這段過程，心裡其實非常感慨，政黨若失去在地、就失去一切，台灣政治從來不是靠網路聲量就能打下基礎，也不是靠少數掌權者圈定「自己人」就能擴張版圖，真正能夠改變城市、國家的人，往往是那些默默在基層蹲點、真正聽得進市民需求的人。可是現在卻看到，中央決策越來越集中於小圈圈，真正紮根基層的人被邊緣、被冷處理、被忽略，在地深耕反而不如派系接線重要，這樣的發展不只是民眾黨的問題，更是一個政黨能否走得長遠的試金石。他強調，2026是地方選舉，更是台灣政治的「檢驗」時刻，地方選舉不是舞台秀，不是把幾個外來菁英空降，就能打動城市。2026是一個提醒，台灣需要真正了解地方脈動的人站出來，而不是只會在中央畫地圖的人做主，高雄更是如此。莊貽量說，如果一個政黨不懂得尊重基層，那它在地方就永遠站不穩，自己想說的不是批判，而是提醒，並不是要挑起對立，因為台灣政治已經夠分裂，政治不能變成「圈內人彼此認可、圈外人永遠邊緣」，如果讓排擠文化成為常態，那台灣政治會越來越像一個封閉系統。熱門賽事、球星動態不漏接    ,https://news.ltn.com.tw/news/politics/breakingnews/5266967
議員曝中市要求清潔隊宣傳購物節並錄影存證 批「嫌不夠忙嗎」？,政治,2025/12/03 21:21,江肇國爆市府宣傳台中購物節竟要垃圾車司機錄影回傳。（圖：江肇國提供）台中購物節活動倒數計時1個月，市議員江肇國今爆料接獲清潔隊基層反映，市府除下令清潔隊司機在定點收運垃圾時須廣播宣傳購物節外，更要錄下在購物節布條前宣傳的30秒影片回傳群組證明，基層爆氣大反彈。江肇國痛批，台中市清潔隊為善後非洲豬瘟廚餘清運等，已忙到不可開交，「嫌基層不夠忙嗎」。環保局指出，因垃圾車清運垃圾是接觸民眾最廣的管道之一，向來均會配合各局處進行包括登革熱及消防措施等，並未強制規定要求錄影回傳。請繼續往下閱讀...台中購物節每年自十月廿四日舉辦到十二月廿五日，活動進入倒數一個月，卻傳出清潔隊基層反彈，爆出市府要求清潔隊司機在定點收運垃圾時，除要打開宣傳購物節的廣播外，清潔隊司機還要站在車體上懸掛的購物節布條前面，將「購物節的宣傳廣播」錄影30秒回傳群組。江肇國痛批，台中市垃圾山愈堆愈高，台中爆非洲豬瘟，廚餘善後問題狀況百出，目前只能全送焚化爐燒，一度因廚餘含水量太高焚化爐儲坑滿載下停收，環保局號稱廚餘脫水設備，卻僅上線一天就出狀況暫停，相關業務已讓基層忙翻天，「盧市長還在想著她的購物節」。江肇國指出，台中市長盧秀燕從非洲豬瘟疫情爆發第一天就只顧參加台中購物節的宣傳記者會，也不出席台中市的疫情說明會，證明對盧秀燕來說非洲豬瘟、垃圾山、廚餘坑遠不及購物節重要，但在基層為非洲豬瘟善後忙得分身乏術之餘，市府還要求清潔隊司機錄影存證，「嫌基層不夠忙嗎」。環保局澄清，垃圾車清運垃圾是接觸民眾最廣的管道之一，因此清潔隊幫各局處政令宣導行之有年，包括登革熱、消防防火宣導等，台中購物節也是循往例通知區隊配合宣導，並回報完成狀況，配合宣傳項目，多會透過在垃圾車懸掛宣傳布條及播放宣傳音檔廣播等，並無限制或規範同仁一定的回報形式，也未硬性要求須錄影30秒影像回傳。台中垃圾車因接觸層面廣，市府多會利用政令宣導。（圖：市府提供）熱門賽事、球星動態不漏接    ,https://news.ltn.com.tw/news/politics/breakingnews/5266937
北檢招考檢察官助理26人 月薪5萬起12/16開放報名,政治,2025/12/03 20:59,台北地檢署將招考26名檢察官助理，預計明年初上工，每月薪資約5萬至5萬2000元不等，16日起開放報名。（資料照）為強化檢察官偵查量能，以及配合行政院推動的新世代打擊詐欺策略行動，台北地檢署將招考26名檢察官助理，預計明年初上工，每月薪資約5萬至5萬2000元不等，16日起開放報名。北檢招考簡章指出，考試分為2部分，總成績各佔50%，其中筆試主要考刑事法（刑法、刑事訴訟法、特別刑法），考試時間2小時，選擇及申論或實例題，擇優參加口試；進入口試者，會由面試官就考生一般常識、法律專業知識、儀表、談吐、工作經驗及細心度等綜合評分，此部分未達70分，不予錄取。請繼續往下閱讀...此次北檢將招考26名檢察官助理，成功錄取者適用勞動基準法等相關權利義務，試用期為3個月。每月薪資5萬0076元，若有高等考試、相當高等考試之特種考試、專門職業及技術人員高等考試及格者，每月薪資5萬2301元，報名時間從今年12月16日起，至12月22日止。檢察官助理的工作內容有七大項，包括協助檢察官分析詐欺案件爭點、彙整相關事證資料及製作卷證分析報告、卷證附表等資料；案件法律問題分析、整理及資料蒐集；校對書類及清點、核閱、確認歸檔案件；實行公訴，製作、傳輸、標示電子卷證及製作簡報等資料；辦理詐欺等資料庫之建置、資料輸入及比對業務；協助刑事訴訟相關程序，以及其他交辦事項。熱門賽事、球星動態不漏接    ,https://news.ltn.com.tw/news/politics/breakingnews/5266922
自由爆新聞》台灣人直球對決國台辦！阿北被問一國兩制秒回：狗屁,政治,2025/12/03 20:49,全新的視界！新聞話題不漏接，快訂閱YouTube 【自由追新聞】，記得開啟小鈴鐺哦！熱門賽事、球星動態不漏接    ,https://news.ltn.com.tw/news/politics/breakingnews/5266902
基隆油污事件 市府宣布新增更換濾心補助 每戶千元為限,政治,2025/12/03 20:42,基隆河油污事件，市長謝國樑（左）宣布新增補助更換濾心費用。（記者盧賢秀攝）基隆河受到油污染，基隆市有7萬1175戶用水有油味，原先只有補助購買包裝水費用、醫療費用及清洗水塔的費用，市長謝國樑今天晚上公布，新增更換濾心的費用，每戶可補助新台幣1000元，以1次為限，12月31日前檢具收據、發票及更換濾心照片申請。基隆河11月27日受油污污染，基隆市信義、安樂等5個區共計7萬1175戶自來水有油味，市府原本公布補助受災用戶購買包裝水費用、醫療費用及清洗水塔費用，今晚在暖暖碇內福安宮前進指揮所召開記者會宣布，市政府將動支1.9億元的災害準備金，會盡量投入減災及協助民眾，考量民眾實際需求，新增更換濾心費用補助。請繼續往下閱讀...謝國樑說，民眾若因這次事件更換濾心，請拍攝淨水器安裝環境及更換濾心照片，並檢附收據或發票正本，12月31日前申請，每戶可申請補助1000元，以1次為限，攜帶式簡易濾水壺則不在補助範圍內。基隆河油污事件補助更換濾心。（記者盧賢秀攝）熱門賽事、球星動態不漏接    ,https://news.ltn.com.tw/news/politics/breakingnews/5266910
陳佩琪喊不在意柯有小三還扯賴清德 她吐槽：認證阿北D槽很精彩,政治,2025/12/03 20:30,陳佩琪最近不斷替柯文哲在網上發言。（資料照）前民眾黨主席柯文哲涉京華城等弊案，檢前搜索發現隨身碟有女星清涼照和神祕「Women資料夾」，引發熱議。柯妻陳佩琪今天（3日）宣稱，自己不在意這種事，只要不是被搜到小三趁正宮不在時來到家裡就好，還扯賴清德稱他家一定也有這些東西，讓外界大傻眼。媒體人詹凌瑀忍不住吐槽「神邏輯」，直言這聽起來就像小學生被抓到作弊，還哭著誣賴同學說不定也有小抄。陳佩琪最近不斷替柯文哲在網上發言，今天在臉書發文提到，檢調先前在丈夫隨身碟內找到女星清涼照和「Women資料夾」，「我是不在意啦，只要不是被搜到正宮不在，而是小三在家就好了。至於賴清德家可以蒐到什麼，進去搜一下不就知道了，他案底不少耶， 搞不好也有清涼照、women夾哩！甚或其他驚人的東西也說不定……」。請繼續往下閱讀...對此，詹凌瑀今晚PO文吐槽，「看到陳佩琪醫師的發文，我真的對這對驚世夫妻佩服得五體投地。面對老公柯文哲隨身碟裡被搜出的清涼照和神秘的『Women資料夾』， 陳佩琪竟然能輕描淡寫地說：『我不在意，只要不是正宮不在、小三在家就好』。當年成龍還得低頭承認那是『全天下男人都會犯的錯』，結果到了陳佩琪這裡，直接幫阿北進化到2.0版本：『只要人沒帶回家，這根本不算錯』！」「原來在陳佩琪的宇宙裡，精神出軌或D槽很滿都沒關係，只要『實體小三』沒登堂入室，老公依然是那個清廉正直的好寶寶？這標準卑微到讓人想哭耶。最經典的是，她為了幫柯文哲遮羞，竟然還要拖賴清德下水，『搞不好賴清德家也有』，這到底是護航還是補刀？這聽起來完全就是小學生被抓到作弊，哭著指隔壁同學說『老師！搞不好他的書包裡也有小抄啊！』」最後詹凌瑀直言，「妳這不是在幫柯文哲洗白，妳是在直接認證『對啦，我家阿北的D槽就是這麼精彩，啊不然你想怎樣？』陳佩琪對阿北絕對是真愛！」熱門賽事、球星動態不漏接    ,https://news.ltn.com.tw/news/politics/breakingnews/5266870
民進黨彰化縣長「類初選」民調唯一假想敵 謝衣鳯說話了,政治,2025/12/03 20:20,國民黨立委謝衣鳯（見圖）是民進黨選對會彰化縣長對比式民調唯一假想敵。（資料照）民進黨彰化縣長提名採取「類初選」，假想敵今天（3日）確定就是國民黨立委、彰化縣黨部主委謝衣鳯，對此，她回應，謝謝大家的關心，我們會找出最好的候選人，有信心贏回2026年大選！對於參不參選彰化縣長，謝衣鳯仍然不願鬆口，但也不願意說死，通常就是回答「謝謝」兩個字。但是，北彰化大小場合都可以看到謝衣鳯的身影，讓許多人看得一頭霧水。不過，身為「政三代」的謝衣鳯還是被各界視為國民黨最強戰將，由於弟弟謝典霖是現任議長，地方政壇認為，謝家如何為姊弟做最好的從政安排，就看謝父最後的決定。請繼續往下閱讀...國民黨已表態爭取提名的有前副縣長洪榮章、前立委柯呈枋，對於民進黨「類初選」假想敵是謝衣鳯，兩人都說尊重，因為這是民進黨的民調，他們繼續勤走基層，爭取支持。而民進黨4位表態爭取提名的人選，得知選對會決定採用對比式民調PK謝衣鳯，都覺得「不意外」。彰化市長林世賢就說，這是最切實際的對比式民調，他目前就是全力拚經濟，他很有把握。前彰化市長邱建富說，對於這項決議，不盡滿意但可接受。以往多半是「黨內互比＋對比」，而假想敵都是選擇已公開表態參選的對象，雖然這次的決定不同，願意尊重選對會的判斷。立委陳素月指出，尊重選對會的決定，會全力衝刺爭取支持。立委黃秀芳說，她會努力握住每一雙手來爭取認同，民進黨明年彰化縣長一役大有可為，希望能為彰化帶來改變。熱門賽事、球星動態不漏接    ,https://news.ltn.com.tw/news/politics/breakingnews/5266884
國民黨誰戰雲林縣長？ 張麗善：張嘉郡是不二人選,政治,2025/12/03 20:11,立委張嘉郡。（記者黃淑莉攝）雲林縣長張麗善連任2屆，明年屆滿，下屆縣長人選，她大力推薦姪女、立委張嘉郡是不二人選。對於民進黨選對會今（3）日拍板，建議徵召劉建國，張麗善說，他擔任立委多年，對雲林的奉獻在哪裡？雲林鄉親都比她還清楚。劉建國在2022年本屆縣長選舉挑戰爭取連任的張麗善，開票結果劉以5萬4899票敗選，這次再次代表民進黨參選2026雲林縣長，劉建國表示，他不畏戰、不怯戰，會再次全力以赴，因為雲林不能再等，雲林需要改變。請繼續往下閱讀...張麗善指出，雲林這幾年已奠定相當基礎，包括能見度、觀光量能都提升，並朝向國際化，所以未來的縣長應該要具前瞻性、有遠見擘劃雲林的未來，需要有執行力、行動力，張嘉郡年輕，擔任過3屆立委，歷練足夠，且勤跑基層、親和力夠，懂得如何向中央部會爭取經費，是下屆雲林縣長不二人選。對於張嘉郡的對手劉建國，張麗善說，劉擔任多屆立委，大家對他都很熟悉，但對雲林的奉獻在哪裡？大家比她還要清楚。立委劉建國。（記者黃淑莉攝）雲林縣長張麗善兩屆任期明年屆滿，未來縣長人選強力推薦立委張嘉郡是不二人選。（記者黃淑莉攝）熱門賽事、球星動態不漏接    ,https://news.ltn.com.tw/news/politics/breakingnews/5266883
新竹市議會「包裹表決」通過明年總預算 民進黨團急請內政部函釋,政治,2025/12/03 20:03,新竹市議會昨天在一片混亂及拉扯中以「包裹表決」中通過明年度總預算，民進黨團今緊急函釋內政部，期內政部能行文說明以確保議員審查預算權利。（資料照，記者洪美秀攝）新竹市議會史上頭一遭，昨天（2日）打架拉扯混亂中，連議員都未看到提案，「包裹表決」通過明年度新竹市政府總預算案，民進黨團今天緊急發公文向內政部提出函釋，對於昨天的包裹表決是否符合地方制度法與預算法，請內政部用最急件予以查明；黨團說，將透過一切可行方式，捍衛議員的預算審查權，不讓市府總預算在議會藍白多數暴力下強渡關山。民進黨團總召陳建名指出，今天一早就以服務處及8名市議員名義共同發文給內政部，內文是新竹市議會在審議市政府總預算案，在會期延長期間，多數黨團提案以「包裹審查」（僅限額度）方式通過總預算案，是否符合《地方制度法》、《預算法》及相關議事規則關於總預算審議的精神與法定程序。請繼續往下閱讀...陳建名說，竹市府明年度歲出總額高達467億元，創歷史新高，其中有多項編列預算遭民進黨團質疑其效益評估不足、合宜性不足及編列浮濫等情事，包括普發現金浮編2362.5萬、及債務付息編1.2億等項目，黨團在總預算案二讀會期間，提出392項的刪減動議，要求議會應回歸逐條審查。然議會多數黨團堅持在黨團協商破裂後，於大會中提案採包裹審查方式，擬以概括性限額（僅刪減8000 萬元）通過總預算案，嚴重剝奪少數黨團及市民對重大預算項目實質審議及監督權利。此外，依據《地方制度法》第41條規定，地方立法機關應就總預算案之「歲出規模、計畫績效、優先順序」等原則審議。「包裹審查」方式是否實質違反該條文要求「審慎」審議之精神，未能達成對個別計畫之實質審議？《預算法》及《地方制度法》並未明確禁止「包裹審查」，惟總預算案為議會最重要之議案，若以程序多數強制通過包裹審查，是否構成對少數議員依法行使職權之程序侵害，進而導致該預算案之議事決議存在程序瑕疵？另依《新竹市議會議事法規》第28條及29條規定，對議會多數黨團採包裹表決方式，其程序瑕疵是否違反此上述兩條規定？都請內政部函釋，以確保公民權益。新竹市議會昨天「包裹表決」通過明年度總預算，民進黨團今緊急函釋內政部，期內政部能行文說明以確保議員審查預算權利。（記者洪美秀翻攝）新竹市議會民進黨團緊急函釋內政部，期內政部能行文說明以確保議員審查預算權利。（記者洪美秀翻攝）熱門賽事、球星動態不漏接    ,https://news.ltn.com.tw/news/politics/breakingnews/5266722
中共對日軍演？陳永康：秀肌肉施壓、不會軍事衝突,政治,2025/12/03 19:52,曾任國防部副部長的立委陳永康表示，即使中共對日發動軍演，他的感覺只是秀肌肉施壓，不會產生軍事衝突。（記者廖振輝攝）日中關係緊張，媒體引述國安人士說法表示，若中國未來一週仍找不到台階下，不排除發動「聯合利劍-C」軍演。曾任國防部副部長的立委陳永康表示，即使中共發動軍演，他的感覺只是秀肌肉施壓，不會產生軍事衝突。國立政治大學國際關係研究中心兵棋推演學院下午舉行揭牌儀式，並邀請陳永康發表專題演講。國關中心主任王信賢表示，兵推學院做的是政軍兵推，包括政治、經濟、外交等因素加入，因此兵推是進行和平研究，不一定是要戰爭兵推，而是兵推如何確保和平，培養更多危機管理與團隊合作的人才。請繼續往下閱讀...政大校長李蔡彥致詞表示，學校的發展應該要與社會脈動契合，社會需要什麼樣的人才，學校就會想辦法培養，近年社會關注國家安全的重要性，政大成立國安專班，國關中心成立兵推學院，透過兵推訓練學生在團隊合作、系統分析與領導統御等方面的能力，也能結合社會所關注的議題結合，特別是在國際關係、地緣政治等面向，將所學運用在實務上。媒體於演講後提問，中共於13日發動「聯合利劍-C」軍演的可能性。陳永康表示，無論中國大陸是否會在13日發動「聯合利劍-C」軍演，其實聯合利劍A或B軍演，對台灣來說，只是中共在秀它的肌肉，因為對台灣的航運、航空與海上交通線並沒有任何衝擊，中共是展現能力，但規模並不代表達到犯台階段。至於聯合利劍-C，陳永康表示，中共若對日本進行聯合利劍-C軍演，至於是圍在釣魚台或是在東海某處，現在不敢判斷，「我的感覺只是秀肌肉、施壓，但是不會產生任何的軍事衝突」。熱門賽事、球星動態不漏接    ,https://news.ltn.com.tw/news/politics/breakingnews/5266854
