Title,News_Type,date,content,url
國民黨彰化縣長提名有變數！蕭景田證實明中常會不公布人選,政治,2026/04/14 19:37,新上任的國民黨彰化縣黨部主委蕭景田。（圖擷取蕭景田臉書）國民黨彰化縣長提名持續卡關，外界原預期黨主席鄭麗文出訪中國前後會拍板人選，但至今仍未定案，基層把希望寄託在明（15日）中常會，不過，縣黨部主委蕭景田今（14日）天受訪表示，徵召人選尚未確定，明天還不會公布。蕭景田說，今天他當面與主席鄭麗文討論，針對目前檯面上4位人選進行整體評估，包括個人條件、選戰可能面臨的挑戰及支持度等面向，都還需要進一步討論。他強調，縣長選戰成敗由全黨共同承擔，主席也相當重視結果，提名必須審慎。請繼續往下閱讀...蕭景田指出，目前各方仍各自努力，尚未整合出單一人選，必須等提名確定後，才有條件進行後續整合與分工，因此短期內難以定案。據了解，國民黨傾向以徵召方式產生人選，但黨內要角遲未形成共識，先前傳出可能徵召前考紀會主委、律師魏平政，引發最早爭取提名的3人反彈與基層反對。立委謝衣鳯、縣府參議柯呈枋、工策會總幹事洪榮章，也在4月11日共同連署聲明，要求黨中央回歸在地徵召原則，黨中央也接到共同連署書。謝衣鳯的支持者同時在網路與地方發聲，期待謝家唯才是用，不宜因家族顧慮影響黨內提名布局，否則恐錯失整合時機，也讓基層支持者的焦慮持續升高，失去信心。    ,https://news.ltn.com.tw/news/politics/breakingnews/5403830
黃世杰出戰桃園市長   民進黨議員：非常好的決定,政治,2026/04/14 19:16,民進黨桃園市議員黃瓊慧（左）與黃世杰（右）。（黃瓊慧提供）民進黨布局2026九合一大選，選對會今（14日）拍板，建議徵召法務部政務次長黃世杰參選桃園市長，民進黨桃園市議會多位議員「小雞」對此紛紛表示，黃世杰是桃園在地子弟，對桃園建設瞭若指掌，更具年輕、曾任市政顧問、參議及立委等優勢，一致肯定「是非常好的決定」。民進黨桃園市黨部主委黃傅淑香認為，有人願意挺身承擔責任很好，2026桃園市長與市議員的選戰是相輔相成的，距離投票日還有一段時間，選戰開打民眾就會對參選人熟悉，黃世杰從被提名就開始跑，一定能加深選民的印象，與國民黨市長張善政一較高下。請繼續往下閱讀...民進黨桃園市議會黨團總召許家睿說，黃世杰是桃園出了名的學霸，不管是政策力還是選舉經驗，都是民進黨內一時之選，黃世杰的形象謙和，地方經營扎實，符合桃園選民喜好高學歷、低仇恨值的候選人特質，相較張善政近年偏重福利政策且風格保守，外界普遍認為桃園發展停滯，張市府缺乏創新與競爭力，黃世杰年輕有活力，一定可以帶來新氣象，未來黨團會與市長候選人黃世杰聯合作戰，在議會提出更多前瞻政策與城市發展願景，凸顯進步價值。民進黨議員黃瓊慧表示，「這是非常好的決定」，黃世杰是桃園在地子弟，求學時期是學霸，曾任桃園南區立委，對桃園建設瞭若指掌，未因至中央任職而停止關心桃園，除了在地連結性夠，還是一個不折不扣的「政策控」，對理性的桃園選民來說能端出政策牛肉吸引大家目光，比起只會花錢搞社會福利政策的張善政，黃世杰一定讓大家更有感。議員魏筠也說，黃世杰具備法律專業與扎實國會經驗，且在地出生成長，懂得在地的需求，47歲的年紀與71歲張善政相比，相差快25歲，更有體力與衝勁深入基層，黃世杰不僅理解桃園市政脈絡，更是中生代即戰力，絕對能為桃園帶來更具前瞻性、更有活力的治理新氣象。議員王珮毓盛讚黃世杰兼具專業、溫度與行動力，長期關心桃園、熟悉地方需求，也具備中央與地方歷練，無論是在桃園市政府擔任參議，或在立法院、法務部服務期間，都累積完整的公共事務經驗，她相信了解桃園、熟悉治理、又有溫度的黃世杰，絕對是桃園市長最有力的人選。民進黨桃園市議員鄭淑方（左）、魏筠（右）與黃世杰（中） 。（魏筠提供）民進黨桃園市議員王珮毓（左）與黃世杰（右）。（王珮毓提供）    ,https://news.ltn.com.tw/news/politics/breakingnews/5403806
馬英九查蕭旭岑變內鬥！調查小組批馬辦片面發佈訊息、混淆視聽,政治,2026/04/14 18:54,馬英九基金會前執行長、現任國民黨副主席蕭旭岑。（資料照）馬英九基金會前執行長蕭旭岑、王光慈被控違反財政紀律，馬英九基金會於前天原要開臨時董事會，但7人董事中僅有1人（即馬英九）到場，最後流會。三名董事、三人調查小組成員薛香川、尹啟銘、李德維聯合聲明表示，依法董事會開不成，但基金會卻假借「董事會」之名於會後發表聲明，實屬不當；且三人小組要求提供的資料前天開會前尚未完整提供，遺憾馬英九辦公室又是片面發布訊息，混淆視聽。聲明指出，3月27日董事會決議，當天之後任何人未經三人小組同意不得對外發表任何有關基金會本案訊息，但基金會辦公室無視此決議，至今已有數次違規發表有關新聞。請繼續往下閱讀...聲明表示，13日是調查小組原定要開調查會議的時間，不是三人小組全員到齊參加董事會，用此魚目混珠的講法，極為不妥；且將臨時董事會時間選在調查小組安排要進行調查時間，有故意阻擋調查進行之嫌。三人小組要求提供的相關資料在昨天開會之前尚未完整提供，僅以會議記錄作為搪塞。聲明指出，蕭旭岑、王光慈兩人所涉事件情節如何，不能僅聽基金會辦公室片面之詞，成立三人小組調查就是希望有一個公正的處置，遺憾的是，辦公室又是片面發布訊息，混淆視聽。三人小組至今已開會四次，在四月初的四天長假就開會兩次。調查蕭旭岑小組批沒給事證 馬英九基金會反擊：已給所有董事    ,https://news.ltn.com.tw/news/politics/breakingnews/5403777
民進黨彰化縣黨部副執行長謝翠屏  登記參選縣黨部主委,政治,2026/04/14 18:53,民進黨彰化縣黨部受理黨部主委、全國與縣級黨代表選舉登記，副執行長謝翠屏（右3）在多位重量級人物陪同下，完成參選登記。（縣黨部提供）民進黨彰化縣黨部主委楊富鈞，2屆任期今年屆滿，縣黨部將於5月24日進行主委及全國、縣級黨代表改選，受理參選登記到本週五（17日）截止。縣黨部副執行長謝翠屏今天完成登記，她同時也宣布放棄原規劃參選溪湖區縣議員，力拚成為彰化縣黨部首位女性主委。謝翠屏出身基層，曾連任2屆埔心鄉民代表，2022年參選埔心鄉長落敗，3年多前進入縣黨部擔任副執行長至今。她說，人生要有取捨，若要扛起主委責任，就必須專心投入組織與輔選工作，因此她決定退出縣議員的布局，參選主委。請繼續往下閱讀...「我們一定可以打贏這一仗！」謝翠屏說，黨部副執行長的歷練，讓她具備整合地方與輔選能力，年底彰化縣五合一選舉，她有能力扮演好主委桶箍的角色，她準備就緒，要往做一名專職的主委邁進，希望黨員支持讓她有機會當上主委，扛起年底大選的輔選工作。今天登記現場，包含縣長參選人陳素月、立委黃秀芳、行政院中部聯合服務中心副執行長吳音寧、國策顧問陳永昌，以及黨部評議召集人江天寶等人到場支持，完成參選登記。民進黨彰化縣黨部副執行長謝翠屏，期許自己成為黨部首位女主委，懇請黨員支持給予她機會。（縣黨部提供）謝翠屏（中）在縣長參選人陳素月（右2）與立委黃秀芳（左3）等人陪同下，完成參選縣黨部主委登記。（縣黨部提供）    ,https://news.ltn.com.tw/news/politics/breakingnews/5403783
李貞秀控放消息要5000萬才下台 陳智菡：子虛烏有,政治,2026/04/14 18:44,民眾黨立院黨團主任出面回應前立委李貞秀發言內容。（記者劉信德攝）民眾黨昨天開除陸配李貞秀黨籍。李貞秀今天說，民眾黨團主任陳智菡在4月7日前就已放消息給媒體，說她要求新台幣5000萬元才肯下台。陳智菡表示，這是子虛烏有，所謂5000萬元這件事她從來沒說過，請拿出具體證據。民眾黨中評會昨天開除陸配李貞秀黨籍。民眾黨主席黃國昌今天說，討論請辭事宜時，李貞秀突然提出要用金額補償立委任期薪水等一切福利，拿到錢才願意辭；他聽到很難過，也絕不可能答應這樣的要求。請繼續往下閱讀...李貞秀下午在三立新聞台「前進新台灣」節目中表示，她一直顧慮民眾黨創黨主席柯文哲和黨的聲譽，但黃國昌卻未顧及黨，她不能放任民眾黨成為「時代力量第二」。她跟柯文哲說過，她這會期已報到，必須做好做滿，是為證明陸配參政的正當性，下會期不報到就好。李貞秀說，她也願為保護民眾黨，只做到8月底就請辭，這樣就沒有任何爭議、好聚好散，但在4月7日前，民眾黨團總召陳清龍就曾跟她談，甚至還準備一份黨內的工作要給她，但當時她婉拒，只堅持做滿一個會期。李貞秀表示，如果連這樣都不願答應，那就照黨章來，就算是她失言也已及時道歉，哪條黨規可以損害她立委權益；大家要她相忍為黨請辭她也願意，因為不分區是民眾黨給她的，「但是柯文哲的台灣民眾黨，跟黃國昌沒關係」。李貞秀說，當時有人提到不能讓她馬上沒收入，「該算給妳的，還是會算給妳」，還大概算一下，是他們主動的，陳清龍還說會跟黨內溝通；結果4月7日黨團會議結束後，黃國昌等人卻要她總質詢後就自己請辭，她才堅持要做滿2年。另外，李貞秀也在三立「94要客訴」節目中表示，在4月7日前她就收到訊息，指陳智菡已放消息給媒體，說她要求新台幣5000萬元才肯下台，她向黨內反映，黨內人士說不可能，她還跟陳清龍開玩笑說不用5000萬元，只要500萬元就好。陳智菡下午受訪時表示，就是子虛烏有，李貞秀身為前民代，講話應有基本公信力，所謂5000萬元的這件事她從來沒說過，請拿出具體證據；李貞秀聽了很多莫名的訊息，「有點被害妄想症」，認為大家都要陷害她，到處散布訊息，非常遺憾。陳智菡說，事實不容曲解，在4月7日的會議中，李貞秀是否曾說過當完2年立委的權益應該要給她，「是她先提到金錢問題、過去有金錢壓力，就任前連卡費都繳不出來」，所以與會的人才會問李貞秀這是什麼意思。陳智菡表示，李貞秀具體提到，「我的經濟、我的生活費」，後續還提到福利、租金等，李貞秀還說出「錢可以榮耀上帝」，「錢是她自己說的，清清楚楚」；後續至少2場內部溝通，李貞秀都具體說出這些訊息。懇請李貞秀應思考整個陸配族群、不要毀了陸配參政權。    ,https://news.ltn.com.tw/news/politics/breakingnews/5403716
李貞秀被開除絕地反攻爆內幕  張育萌：黃國昌「職業關燈手」現形,政治,2026/04/14 18:37,立委李貞秀13日被民眾黨中評會宣布開除。（資料照）民眾黨不分區立委李貞秀遭中評會開除黨籍，引爆黨內「宮鬥」大戰。台灣青年世代共好協會理事長張育萌今（14日）發文指出，李貞秀正進行「絕地大反攻」，揭露黃國昌、陳智菡與周榆修等人設局逼宮，甚至對外放話稱她索要 5000萬元補償。他不禁狠酸，黃國昌表面上捍衛中配，私下卻是霸凌黨員的「職業關燈手」。針對李貞秀今天在政論節目大爆料一事，張育萌在臉書發文指出，李貞秀原本承諾自己可以辭職，但這個會期要做完（到8月），因為這是她對中配的承諾，而這也是為什麼柯文哲原本說「給李貞秀一點時間」，但黃國昌的人馬沒有照柯文哲的說法做。李貞秀原本以為都講好了，結果黃國昌找陳智菡、周榆修，再拉著黨團總召陳清龍來施壓。請繼續往下閱讀...張育萌續指，李貞秀回覆「這件事情就照黨規來，如果連這樣都不行，誰想要我走，誰買單！」這句話卻被民眾黨當成開除的理由。李貞秀還加碼爆料稱，周榆修曾直言「妳這樣子立法院沒辦法推動」。他不禁嘲諷，這直接把民眾黨過去「全黨護一人」打得臉超腫，黃國昌和陳智菡不是一天到晚，說民進黨在毀憲亂政，不讓中配質詢是歧視中配嗎？怎麼周榆修在背後竟然怪李貞秀，害「立法院沒辦法推動」？張育萌進一步指出，李貞秀自稱開會時根本沒講到數字，卻被陳智菡反問「那是要怎麼樣？」李則回「那當然啊，不然勒？」讓她驚覺自己直接被設局。此外，她也透露，柯文哲安慰李貞秀時，李還跟柯說「我的五個小孩都過得很好，不用擔心」，也分析給柯文哲聽說「我做第一個會期可以安撫陸配族群，不然現在有些陸配族群在打說是『黃國昌逼我下台』」。然而，黃國昌用力主導，要李貞秀打包走人。李貞秀直接對鏡頭說「我不能讓民眾黨變時代力量第二」。張育萌對此不禁狠酸，「我發瘋，有夠好笑，全世界都知道黃國昌是職業關燈手，民眾黨內根本自己也人人自危。」他並提到，李貞秀說她就職前，周榆修叫她回中國放棄國籍，她當時就說自己沒有雙重國籍，因為憲法稱「大陸」不是外國，這跟李貞秀就職後一再辯解的內容完全一樣。結果，去年12月8日，黃國昌和陳智菡根本演假的，逼李貞秀去放棄國籍，陳智菡還叫李貞秀飛之前，要先跟他們商量怎麼對媒體發布。李貞秀隔天就飛了。因為黨內一直有人在亂捅，所以她誰也不敢講。張育萌直言，怎麼會有個黨這麼離譜，自己檯面上罵民進黨歧視中配，喊得漫天震響，結果私下其實都在演戲，還集體霸凌黨員。張育萌補充，時間回到上週，整個清明連假，都沒人跟李貞秀講什麼，所以她以為自己已經跟柯文哲談好了。就在4月7日，李貞秀準備第一次踏進議場總質詢，對她來說是「史上第一個中配走進大院質詢卓榮泰」。結果當天早上，黃國昌這些人把她攔著，跟她說「你等一下怎麼宣布下台」。李貞秀怕她被自己人攔住，不讓她去總質詢。而在李貞秀「誤講」高虹安拿柯文哲700萬之後，就立刻道歉，但賴香伶、陳琬惠和邱臣遠，一個個跳出來放話，李貞秀直接說「大家都知道是誰的人馬，黃國昌啊。」李貞秀還說，她在4月7日前就收到消息，陳智菡放話給媒體說「李貞秀要求5000萬才肯下來」。對此，張育萌狠批，這個黨根本就是宮鬥教科書，怎麼互相霸凌可以臉不紅、氣不喘？這是哪門子新政治？最後張育萌質疑，主張公開透明不遺餘力的黃國昌，黨團和中評會要不要公布李貞秀的錄音和逐字稿？黃國昌自業自得。平常咆哮說要保護吹哨者、捍衛中配，言猶在耳、餘音繞樑，現在被發現通通都在演。    ,https://news.ltn.com.tw/news/politics/breakingnews/5403700
台中私人招待所如春筍冒出！疑8大行業掩護躲公安檢查,政治,2026/04/14 18:32,"市議員陳文政指很多私人招待所卻公開攬客，還有侍女陪酒，根本不是「私人」。（記者蘇金鳳攝）台中市仍擺脫不了風化城的惡名?市議員陳文政今天市議會抨擊，近年台中出現越來越多打著「私人招待所」名義經營的場所，設有包廂、侍女陪酒、KTV設備、酒類飲料，還透過IG、Google公開攬客，質疑這些場所就是要打「私人」之名，來逃稅、逃避消防及公安的檢查，甚至還設在市政府附近，痛批市府坐視不管。地稅局長沈政安表示，若有提供KTV設備，並以包廂費、低消、包場費、茶資等名目對外收費，確實可能涉及娛樂稅，將依法查核；經發局表示，不管合法非法，都有定期在稽查。請繼續往下閱讀...議員陳文政表示，這些號稱是「私人招待所」，不少設在商辦甚至住宅內，表面自稱私人空間，實際上卻公開招攬消費者上門，內有包廂、美女坐枱，根本已是公開攬客，不是私人招待所。他要質疑的是，這類場所究竟有沒有依法辦理商業登記？登記項目與實際營業內容是否相符？場地使用、消防安全、建築用途，以及是否涉及供酒、視聽歌唱等行為，市府都應主動查明。陳文政強調，這種公開存在、公開攬客的現象早已不是秘密，不能因為掛上「私人招待所」的名稱，就放任業者遊走法律灰色地帶, 到現在這類新型態招待所，四處都有，甚至市府旁都有，市府卻視而不見，還要民眾主動檢舉。陳文政不滿的指出，他曾檢舉一家pub擾民長達半年，但經發局把責任推給都發局，但是都發局早已資料給經發局，經發局就是不查，要求市府正視問題，主動盤點、主動清查，釐清是否涉及違規營業、公安風險與稅負逃漏問題，不能等到發生治安事件才來追究責任。市議員陳文政表示，台中市有很多場所打著私人招待所，避稅避公安檢查，要求市府正視。（記者蘇金鳳攝）    ",https://news.ltn.com.tw/news/politics/breakingnews/5403633
李貞秀台東服務處 3張便條紙「除名」,政治,2026/04/14 18:30,民眾黨台東縣黨部與李貞秀服務處位於同處，原本的門口還張貼有「李貞秀台東服務處」的看板。（民眾提供）民眾黨開鍘李貞秀，李貞秀在政論節目大罵黃國昌，在黨員地方群組內更被罵成了「叛徒」，李貞秀位於台東的服務處像是被塗上「立可白」，把她的名字遮去，待下位接手轄區立委到任再行更名。「誰才是叛徒」成了地方民眾黨員熱議的話題，部分新住民黨員認為，不該全聽信媒體，或許李貞秀一事另有隱情。李貞秀今（14日）出席《94要客訴》節目，除了砲轟黃國昌之外還駁斥「拿錢才離開」等內容，又掀起另一波黨員同聲斥責及爭辯。請繼續往下閱讀...在地方黨部方面，先前傳出台東縣黨部兼李貞秀服務處建築頂樓違建，如今也因中央黨部開鍘李貞秀，地方黨部除了將其除名，黨部外的看板未能及時更新，只能貼上3張便條紙「姑隱其名」。先前檢舉建物的民眾表示，「小草」捐出經費等同於資助房東違建。據黨員稱，目前先遮蔽李貞秀名字，未來有新的立法委員到任後，再行更正。檢舉民眾則表示「為什麼不直接把『立法委員李貞秀服務處』整個割下，或甚至整張貼紙拔下？」、「這根本是傻草切割術」。李貞秀被民眾黨除名之後，台東服務處看板上的名字已用3張便條紙遮蔽。（民眾提供）民眾黨台東縣黨部，日後才被人檢舉頂樓是違建。（民眾提供）    ,https://news.ltn.com.tw/news/politics/breakingnews/5403537
日本四國「挺台灣」海報結緣！日本幸福實現黨首訪高市議會,政治,2026/04/14 18:20,日本幸福實現黨「日台友好議員聯盟」今首度拜會高市議會。（議會提供）日本四國「挺台灣」海報結緣！日本幸福實現黨「日台友好議員聯盟」今首度拜會高市議會，議會國民外交促進會會長鄭孟洳與多位議員共同接待，盼與日本各地議會未來能在產業、觀光及青年交流等面向深化合作。高市議會說明，這次訪團由幸福實現黨幹事長江夏正敏及聯盟會長、茨城縣古河市議員古川一美率領，共18人來訪；訪團此行緣起於日前在日本四國道後商店街懸掛「挺台灣」標語，引發台灣各界關注，議長康裕成隔海表達感謝之意後，促成這次參訪交流。請繼續往下閱讀...高市議會由國民外交促進會會長鄭孟洳代表議長康裕成，偕同湯詠瑜、黃飛鳳、蔡金晏、陳幸富等4位副會長及陳明澤議員共同接待，對日本訪團以實際行動表達對台支持，表達誠摯歡迎與感謝，並強調台日共享民主價值，地方議會交流具重要意義。鄭孟洳表示，高市議會作為地方民主重要平台，除肩負監督市政與反映民意職責外，也積極推動國際交流，透過議會外交拓展城市視野，未來盼與日本各地議會在產業、觀光及青年交流等面向深化合作。江夏正敏幹事長指出，幸福實現黨全力支持台灣自由民主，並感謝高雄市議會的熱情迎接，對於能親自到訪高雄進行面對面交流深感榮幸，也期待未來持續深化日台合作關係。日本四國道後商店街內的挺台灣海報，促成日本幸福實現黨拜訪高市議會機緣。（資料照、記者王榮祥攝）    ,https://news.ltn.com.tw/news/politics/breakingnews/5403746
卓冠廷再爭取翻新鶯歌大湖路人行道 也促下半年打通鶯桃路瓶頸,政治,2026/04/14 18:14,民進黨新北市議員卓冠廷（右）今在議會質詢中，經與新北市工務局長馮兆麟（左）確認，成功爭取鶯歌大湖路人行道下一階段約800萬元翻新預算。（記者黃政嘉攝）民進黨新北市議員卓冠廷今天在議會質詢中，經與新北市工務局確認，成功爭取鶯歌大湖路人行道下一階段約800萬元的翻新預算，鶯歌中山路至中正一路的「迎賓大道」變電箱移設進度，也將優先拓寬分隔島，此外，延宕多年的鶯桃路與鳳吉四街瓶頸路段，將於今年下半年打通，府會盼持續給在地鄉親更安全的交通環境。卓冠廷指出，配合鳳鳴簡易車站完工通車，大湖路作為通往車站重要路線，行人的通行權益至關重要，大湖路人行道的改善歷程，從2023年爭取修補破洞、2024年爭取翻新，到2025年市府與區公所投入273萬元完成約100公尺的示範段，過去長久設計不良，連當地里長會勘都不慎撞到電箱，如今該段道路平整、電桿順利移位，推車與長輩都能安全通行，成效非常好。請繼續往下閱讀...對於大湖路人行道其他尚未改善部分，工務局長馮兆麟今承諾可分段施作，後續548巷至618號路段會先進場，將由工務局支援約800萬元預算，並要求公所於今年上半年開工，逐步完成全段翻新。卓冠廷另表示，樹林與鶯歌間的重要幹道「迎賓大道」，幾十年來變電箱阻擋人行道一直不知如何處理，經他的辦公室團隊與工務局、台電多方協調，去年終於確定將變電箱移至中央分隔島方案，新北市長侯友宜、馮兆麟去年也說會加速推動。關於此方案進度，馮兆麟表示，因該處交通擁擠，未來將優先拓寬分隔島，待台電將變電箱全數移至中央並完成管線地下化後，再分期進行兩側人行道的改善工程，最終目標是將全段人行道徹底翻新。卓冠廷也進一步爭取「延長施作」，馮兆麟承諾將中山路延伸至中正一路的完整段落都納入研議。此外，鶯桃路與鳳吉四街交界的瓶頸路段，長年因地上物租約問題無法解決，卓冠廷追問此案進度何時啟動？馮兆麟回應，該處土地已完成購入，承租戶預計7月搬遷，屆時將拆除建築物，並完成管線遷移，預計今年下半年以前就能將整段道路鋪平，正式打通交通瓶頸。    ,https://news.ltn.com.tw/news/politics/breakingnews/5403712
