Title,News_Type,date,content,url
踹傅崐萁桌被正式起訴 張峻：問心無愧、配合司法程序,政治,2026/03/06 13:14,國民黨立委傅崐萁、鄭天財昨在光復鄉大華活動中心舉行「光復鄉堰塞湖受災區重建座談會卻只邀請傅派議員等人，災民遭擋在外被議長張峻踹桌抗議。（民眾提供）花蓮縣議會無黨籍議長張峻去年10月27日不滿立委傅崐萁在災區辦重建座談會卻未通知光復在地議員，衝進會場踹桌，遭傅提告傷害、恐嚇等罪。對此，張峻今日發文表示，他收到花蓮地檢署對我的起訴書，對於檢察官的起訴，自認問心無愧，也會配合司法程序、尊重司法判決。無論結果如何，只希望社會能看清楚這件事情的來龍去脈。張峻在臉書PO文表示，今天收到花蓮地檢署對張峻的起訴書。檢察官認為，他在114年10月27日那天，在光復重建座談會踢桌子的行為，導致傅崑萁受傷，因此對他提起公訴。請繼續往下閱讀...張峻指出，全國民眾都看得很清楚，當時的影片現在仍然在網路上流傳。張峻踢的是桌子，要表達的是：「既然是災後重建座談，為什麼會變成閉門會議？連在地的民意代表、在地的民眾都要經過篩選，甚至不得其門而入。我踢的不是傅崑萁，而是為了爭取災民最基本的發言權。」張峻續指，或許傅崑萁脆弱的心靈真的受傷了吧，但這並不能改變他顛倒是非、試圖塑造花蓮一言堂的作風。如果他的內心真的因此受到了一點震動，張峻也希望這件事能讓他好好反省自己的作為，光復、花蓮還在從泥沼中努力重生。張峻也仍然站在災民與鄉親的身旁，一起努力、一起前行。未來，只要是為了捍衛鄉親的權益，張峻依然會勇敢站出來。張峻直言，對於檢察官的起訴，他自認問心無愧，也會配合司法程序、尊重司法判決。無論結果如何，他只希望社會能看清楚這件事情的來龍去脈。只要是為了替災民發聲、為鄉親爭取權益，張峻仍然無悔。    ,https://news.ltn.com.tw/news/politics/breakingnews/5361006
藍軍購3800億+N 許毓仁：華府認為國民黨不真正願意支持軍購,政治,2026/03/06 13:14,針對國民黨提出的「3800億＋N」軍購提案，前國民黨黨立委許毓仁表示，在可行性、技術操作與立法慣例上都有問題。（記者方賓照攝）針對國民黨提出的「3800億＋N」軍購提案，前國民黨黨立委許毓仁表示，在可行性、技術操作與立法慣例上都有問題。就他與華府人士的溝通與理解，美方並沒有接受「3800億＋N」這樣的提案，也不存在所說的任何默契。華府若看到這樣一個明顯低於實際需求、又缺乏制度可行性的版本，很容易得出的結論就是，「國民黨並不真正願意支持軍購」。許毓仁指出，在可行性上，分階段編列預算，等於是在向美方傳遞一個訊號：你先決定要賣我什麼，我到時候再準備錢，而且還希望能儘快交貨。這在軍售實務上幾乎不可能。軍購從來不是像 Uber Eats 一樣，今天下單、明天到貨。請繼續往下閱讀...許毓仁說，它牽涉到建案規劃、備料、生產、行政批准、國會程序、總統公布到執行交付，是一整套冗長而嚴肅的流程。更何況，今天全球供應鏈緊張、各地衝突頻仍，並不是台灣想買什麼就一定買得到，也不是想排就排得進去。若仍抱持這種臨時編列、見案加碼的心態，到頭來恐怕只會讓自己陷入「有兵無彈」或「有裝備無系統」的困境。許毓仁接著表示，第二，在技術操作上，這種做法反而會讓國民黨陷入更不利的政治與制度處境。若先行編列3800億元，未來有新的軍購案時，立法院還要再重啟審查、重新編列預算、再進行內部協商與政治攻防。這不只是程序重複，更可能進一步延誤原本就已經拉長的交付期。換句話說，這種做法不是提高效率，而是自己拿石頭砸自己的腳。許毓仁再指出，第三，武器整建本來就是一個中長期、系統性的規劃工程，通常至少以五年為期。若採取這種分段、零碎、臨時性的預算模式，不但無法進行完整的長期規劃，也無法支撐整體戰略佈局。這就像打棒球比賽時一味短打，看起來每一球都在應付，卻沒有下一步的戰術設計與全局思維。結果不只是戰力無法完整形成，連整個系統的準備、整合與後續支援都會受到嚴重影響。許毓仁表示，最後，在立法慣例上，這樣的提案同樣站不住腳。台美軍售長期以來，是建立在「台灣關係法」架構下的重要安全合作機制。通常是由中華民國提出戰備需求，美方再依照自身盤點與評估提出對應清單，雙方在既有程序中完成規劃與執行。這是一套行之有年的慣例。許毓仁強調，過去並沒有這種先分段、再斷續追加、邊走邊編的做法，美方也未必會接受這種打破既有慣例的安排。更重要的是，華府會如何看待這個態度？軍售與貿易一樣，都是台美關係的重中之重。許毓仁說，購買武器、提升防衛能力，當然是一個具體需求；但更深一層，它同時也是政治夥伴關係與戰略信任的體現。華府若看到國民黨提出一個明顯低於實際需求、又缺乏制度可行性的版本，很容易得出的結論就是，「國民黨並不真正願意支持軍購」。這不僅會大幅傷害國民黨與華盛頓之間的夥伴關係，也會對2026與2028的政治布局造成深遠不利影響。許毓仁表示，相較之下，當時國民黨立委徐巧芯提出的8100億版本，或前主席朱立倫提出的9000億版本，至少仍然比較接近現實需求，也仍然保留了與原始版本進行實質斡旋的空間。如今的3800億＋N，與實際防衛需求落差過大，幾乎等於把球直接送到民進黨手上。不只在公共論述上容易被操作為「親共、反美、不願防衛台灣」，在自我防衛需求上也很難提出有說服力的辯護。    ,https://news.ltn.com.tw/news/politics/breakingnews/5360977
黃淑君助陣康家瑋車隊掃街 盼未來共同推動體育事務,政治,2026/03/06 13:08,黃淑君（右）至萬華合體康家瑋（左）車掃。（記者甘孟霖攝）民進黨台北市議員初選民調9日開跑，選前黃金週末，萬華區議員擬參選人康家瑋今（6日）找來新北市議員黃淑君助拳車隊掃街。黃淑君說，板橋與萬華是共同生活圈，康家瑋也很關注體育事務，盼兩人未來能夠合作一起推動體育事務。康家瑋今上午進行車掃前受訪說，初選只剩下最後3天，在最後的階段都會拜託所有兄弟姐妹們前來幫忙，今天找來板橋區的議員黃淑君，因為板橋與萬華有很多共通點，兩邊有4座橋相連，也有許多板橋的鄉親在萬華工作等，希望藉由黃淑君的高人氣，帶動萬華的鄉親來支持他。請繼續往下閱讀...黃淑君說，康家瑋長期關心地方體育活動，也是在地的「艋舺囡仔」，板橋與萬華算是共同生活圈，也希望未來有機會兩人能夠一起合作推動相關運動事務等，尤其康家瑋自從4年前的選舉，也已經在中正、萬華深耕超過2千天，上次只差2通電話，這次呼籲民唯一支持。黃淑君（右）至萬華合體康家瑋（左）車掃。（記者甘孟霖攝）    ,https://news.ltn.com.tw/news/politics/breakingnews/5361007
黃淑君助陣康家瑋車隊掃街 盼未來共同推動體育事務,政治,2026/03/06 13:08,黃淑君（右）至萬華合體康家瑋（左）車掃。（記者甘孟霖攝）民進黨台北市議員初選民調9日開跑，選前黃金週末，萬華區議員擬參選人康家瑋今（6日）找來新北市議員黃淑君助拳車隊掃街。黃淑君說，板橋與萬華是共同生活圈，康家瑋也很關注體育事務，盼兩人未來能夠合作一起推動體育事務。康家瑋今上午進行車掃前受訪說，初選只剩下最後3天，在最後的階段都會拜託所有兄弟姐妹們前來幫忙，今天找來板橋區的議員黃淑君，因為板橋與萬華有很多共通點，兩邊有4座橋相連，也有許多板橋的鄉親在萬華工作等，希望藉由黃淑君的高人氣，帶動萬華的鄉親來支持他。請繼續往下閱讀...黃淑君說，康家瑋長期關心地方體育活動，也是在地的「艋舺囡仔」，板橋與萬華算是共同生活圈，也希望未來有機會兩人能夠一起合作推動相關運動事務等，尤其康家瑋自從4年前的選舉，也已經在中正、萬華深耕超過2千天，上次只差2通電話，這次呼籲民唯一支持。黃淑君（右）至萬華合體康家瑋（左）車掃。（記者甘孟霖攝）    ,https://news.ltn.com.tw/news/politics/breakingnews/5361007
上節目大爆料！陳佩琪爆柯文哲很信靈媒 狂問「我爸說了什麼？」,政治,2026/03/06 13:07,"柯文哲妻子陳佩琪。（資料照，民眾黨提供）前台北市長、民眾黨創黨主席柯文哲涉京華城案，台北地方法院預計3月26日進行宣判。柯妻陳佩琪今日在中廣新聞網接受主持人王淺秋訪問時指出，柯文哲對柯爸過世一直抱有遺憾。她爆料，柯文哲現在很相信靈媒，希望對方告訴他柯爸有沒有說了什麼事情。請繼續往下閱讀...陳佩琪今日受訪時透露，對於柯爸過世，自己沒辦法陪伴一事，對柯文哲心理創傷是最大的。雖然柯文哲是醫生，應該是比較信奉科學的，但他現在非常相信靈媒。她說，當有一些靈媒告訴柯文哲，柯爸來找靈媒說了什麼什麼事情之後，柯文哲真的會去問對方：「我爸爸跟你講了什麼？」「柯文哲希望問問他爸爸，要不要原諒民進黨」，她表示，因為柯文哲無法回到過去，那一段無法參與的愧疚感，讓他變得很相信這方面的東西。另外，柯文哲還會常常問陳佩琪，「我爸爸過世的時候有沒有跟妳講什麼？有沒有要找我？有沒有要交代？」陳佩琪表示，這是柯文哲心中有一種遺憾，所以才到處去問、去跟靈媒溝通。    ",https://news.ltn.com.tw/news/politics/breakingnews/5360988
柯文哲宣判前2天逢兒子東大畢典 陳佩琪：擬聲請解除境管赴日,政治,2026/03/06 12:43,柯文哲妻子陳佩琪。（資料照，民眾黨提供）前台北市長、民眾黨創黨主席柯文哲涉京華城案，台北地方法院預計3月26日進行宣判。柯妻陳佩琪今天表示，長子柯傅堯去年將東京大學博士班的畢業典禮延至3月24日，看看柯有無機會跟他一起去；她將循正常程序向法院聲請解除限制出境，讓柯文哲有機會參加畢業典禮，就是身為父母的平凡願望。京華城弊案去年12月審理終結，訂今年3月26日宣判。陳佩琪今天接受網路節目「千秋萬事」專訪時表示，她的長子在東京大學唸書，2022年那時候COVID-19比較解封，日本當時開放外籍學生去，唸了兩年多在2025年的10月左右，柯傅堯論文通過之後就畢業了。請繼續往下閱讀...陳佩琪指出，「老師說就來參加畢業典禮，但是他（柯傅堯）就說他要把它delay到今年，看看爸爸有沒有機會跟他一起去。」她也提到，他們前不久申請檢察官的檢評會，而日本教授寫信給兒子參加3月24日畢業典禮，因此請柯文哲跟法院申請出國，「不要讓兒子期待又有遺憾。」由於畢業典禮在柯案一審宣判前兩天，陳佩琪說，「我就試著申請看看」，因為從2024年8月到現在，柯文哲在司法上一路挨著打，從來沒有一件事讓她覺得有被公平對待。她強調，他們不是要什麼特權，只是司法上面公平的對待，但真的是不可得。陳佩琪提到，日本教授得知柯文哲的處境後，主動提議寫信協助，「日本的教授還真的說，有這樣子的疑慮哦，那我寫個信件來邀請你，你能不能把它送去法院說，教授寫個信件邀請他要去參加畢業典禮。」    ,https://news.ltn.com.tw/news/politics/breakingnews/5360976
高虹安涉論文抄襲案再上法院 陳時奮批：說謊跟呼吸一樣自然,政治,2026/03/06 12:41,新竹市長高虹安涉論文案再上法院。圖為高虹安今天出席市府活動情形。（記者洪美秀攝）新竹市長高虹安涉貪助理費案，去年12月16日二審高院大逆轉改判偽造文書罪後復職回歸市政，但昨天（5日）又因博士論文與資策會的侵犯著作權案赴高等法院出庭。對此，旅美教授陳時奮（筆名翁達瑞）今天提到，高虹安與資策會的侵犯著作權官司起因來自他揭發高虹安的博士論文大量抄襲資策會的專案計劃報告，而他與高虹安也糾纏多起官司，陳時奮在臉書提到，高虹安再度出庭仍繼續扯謊，而他也將繼續揭發高虹安的扯謊面具。陳時奮也述說3年多前他揭發高虹安的博士論文涉抄襲問題，結果資策會提告高虹安侵犯著作權，台北地院以追訴期限已過裁決不受理。資策會不服上訴，昨天二審辯論終結。而他也因揭發高虹安的學術不倫引發4起官司，包括高虹安提告他誹謗，他獲得不起訴處分。他自訴高虹安誣告，高在兩審被判有罪。另資策會提民事侵權，高虹安一審被判賠。資策會提刑事侵權，昨天二審辯論終結。請繼續往下閱讀...陳時奮認為，高虹安繼續在法庭狡辯，且「說謊跟呼吸一樣自然」。他用具體證據反駁高虹安在審理庭說的3個謊言，包括高提到論文沒有商業用途，實則循慣例讓其博士論文登錄在商業資料庫（ProQuest），供大眾付費下載。高虹安讓她的博士論文成為商業產品，卻沒有事先取得資策會的授權。再者高虹安宣稱辛辛那提大學證實其博士論文無涉版權爭議。但資策會去函辛辛那提大學主張著作權後，OhioLink先暫停高虹安的博士論文下載服務，接著就是永久下架。根據OhioLink的使用規範，學位論文被下架的主因就是侵犯版權。最後陳時奮批高虹安宣稱辛辛那提大學已還她清白，且出函證實其博士沒有學倫爭議。但高虹安出示的不是原件，而是經過編造過的電郵。原件是辛辛那提校方的內部電郵，高虹安不是收件人，電郵的內容也不是學倫調查的結果，而是主管互相討論的個人看法。他還稱高虹安是難纏的訴訟對手，不是因為攻防技巧好，而是擅長說謊，且臉不紅、氣不喘。    ,https://news.ltn.com.tw/news/politics/breakingnews/5360963
國民黨新北黨部公告議員提名辦法 擬提38席,政治,2026/03/06 12:34,國民黨新北市黨部今（6）日公告此屆市議員參選提名登記辦法。圖為國民黨新北市黨部主委黃志雄。（國民黨新北市黨部提供）2026年九合一選舉將於11月28日登場，新北市議員選舉部分，有資深議員要交棒，也有新秀拚出頭。國民黨新北市黨部今（6）日公告此屆市議員參選提名登記辦法，規定3月10日起至12日受理登記，含平地、山地原住民在內，預計提名38席。各區提名額度部分，第一選舉區（淡水區、八里區、三芝區、石門區）提名3席，第二選舉區（五股區、泰山區、林口區）提名4席，第三選舉區（新莊區）提名3席，第四選舉區（三重區、蘆洲區）提名3席，第五選舉區（板橋區）提名5席，第六選舉區（中和區）提名4席，第七選舉區（永和區）提名2席，第八選舉區（土城區、樹林區、三峽區、鶯歌區）提名4席，第九選舉區（新店區、深坑區、石碇區、坪林區、烏來區）提名4席，第十選舉區（瑞芳區、平溪區、雙溪區、貢寮區）提名1席，第十一選舉區（汐止區、金山區、萬里區）提名2席，第十二選舉區（平地原住民）提名2席，第十三選舉區（山地原住民）提名1席；各選區除第七、十、十三選區外，均有1席婦女保障名額。請繼續往下閱讀...其中，第五區因前市議員葉元之於2024年當選立委而空缺一席，目前藍營尚未有新人明確表態爭取，民進黨初選為滿額5人報名，民眾黨1人參選，空缺一席是否可能「藍白合」受矚，另外，該選區資深國民黨市議員周勝考交棒兒子周韋翰參選。第七區藍營資深市議員連斐璠有意屆滿退休，欲接棒的新秀輩出，其中前市府副發言人陳柏翰從第一選區轉戰此區受矚，雖遭對手質疑不在地，但據其過往民政局服務經歷，對地方需求不可謂不了解。第十一區也因前市議員廖先翔於2024年當選立委而空缺一席，民政局機要秘書張珀源、國民黨前發言人蕭敬嚴、藍委羅智強辦公室主任何元楷均爭取出線，相當熱鬧。    ,https://news.ltn.com.tw/news/politics/breakingnews/5360953
民眾黨提政院應與美簽署發價書、譴責行政院長不副署案 均逕付二讀,政治,2026/03/06 12:22,民眾黨團提出的「行政院應與美方簽署發價書」、「譴責行政院長不副署案」，均逕付二讀並交付協商。（記者方賓照攝）立法院院會今（6日）處理民眾黨團提出的「行政院應與美方簽署發價書」、「譴責行政院長不副署案」，均逕付二讀並交付協商，立法院長韓國瑜裁示，由民眾黨團負責召集協商。立法院會今日將朝野國防特別條例草案付委審查，民眾黨團提出「行政院應與美方簽署發價書」案，列入立法院會討論事項。提案指出，若美方發價書明文公布之拖式、標槍飛彈續購及M109A7自走砲等三項對美軍購案簽約期程屆至之前尚未完成相關預算之審議，茲授權行政院先行與美方簽署發價書（LOA），以保障國家戰略利益。行政院應於簽署後應即刻向立法院提出完整相關武器交貨期程報告，回歸審議常軌，履行行政院於預算編列前後完整說明之義務，不得再以「國家安全」為名，規避民主審議與理性監督。請繼續往下閱讀...立法院會今天開會時，朝野黨團討論後達成共識。會議主席、立法院長韓國瑜表示，此案依照黨團共識，不說明及發言，並不表決，逕付二讀交付協商，並由民眾黨團負責召集協商。另外，民眾黨團也提出「譴責行政院長不副署」案，提案指出，行政院院長卓榮泰自就任以來，面對立法院三讀通過之《立法院組織法》、《衛星廣播電視法》、《政黨及其附隨組織不當取得財產處理條例》及提升軍警權益、立法院助理費法制化等修法案，屢屢展現「不副署、不公布、不執行」之怠惰態度。在賴清德總統與卓榮泰院長主導下，行政權恣意否決代表民意之立法權，將自身推向不受監督之絕對權力，破壞權力分立與制衡之民主原則，造就台灣民主史之巨大危機。提案表示，依《中華民國憲法》，三讀通過之法律若遇窒礙難行，行政院依法僅能提出覆議；覆議未獲通過即應依法執行，此乃憲政運作基本秩序。然卓榮泰院長竟一再跨越憲法紅線，逕行以「不副署」之名，行實質否決法律之實。當行政權可無視國會決議、拒絕依法行事，此等行徑若非獨裁，何謂獨裁？提案中提及，卓榮泰院長任內覆議「八戰八敗」，卻不願正視民意反撲。覆議失敗後未回歸制度，反淪為不執行、不作為、不守法之「三無閣揆」，甘願作為架空立法權之打手，將台灣推向全面綠色威權。「為維護國會尊嚴、捍衛國家憲政體制，對行政院院長卓榮泰提出嚴厲之譴責案，正告賴清德總統與卓榮泰院長應立即停止違法濫權『不副署、不公布、不執行』之行徑，回歸憲政運作之基本秩序。」院會處理時，依照黨團共識，此案不說明及發言，依提議進行表決，表決結果，藍白挾人數優勢，以贊成53票、反對29票，贊成者多數，逕付二讀交付協商。    ,https://news.ltn.com.tw/news/politics/breakingnews/5360940
喊要「斬首賴清德」 館長出庭拒不認罪 卓冠廷譏：男子漢怎麼這麼孬,政治,2026/03/06 12:18,卓冠廷（右）今陪同張銘祐（左）參拜、車掃。（記者甘孟霖攝）網紅「館長」陳之漢去年10月5日直播時，暗示支持中國武力犯台，還說出「把賴清德狗頭斬下來」，被新北地檢署依恐嚇公眾等罪嫌起訴，今（6）日開庭兩分鐘就結束，館長拒不認罪。新北市議員卓冠廷說，館長不是渾身肌肉的男子漢大丈夫嗎？怎麼做錯事反而變得很孬不敢認罪。卓冠廷今陪台北市萬華區議員擬參選人張銘祐掃街前受訪說，館長做錯事就要好好認罪，也比較有機會輕判；法官態度很清楚，這麼多案子同擠在今天，館長案只要幾分鐘，法官等的就是一句「對不起，我知道錯了」。請繼續往下閱讀...他說，沒有一個國家允許公眾人物公開說要斬首國家元首，何況館長的用詞都與中共威脅台灣一致，當然會受到很多的檢舉，司法也一定會辦，看的就是犯後態度，只要態度良好就不會重判，但館長還要東扯西扯，還要總統出庭，都是在鬼扯。卓冠廷喊話館長：「你不是肌肉棒子嗎？不是男子漢嗎？大丈夫敢作敢當啊，怎麼會到這種狀況反而變得很孬，不敢面對自己的作為，這樣大家看不下去，不要做錯事了還扯東扯西。」網紅「館長」陳之漢。（資料照）    ,https://news.ltn.com.tw/news/politics/breakingnews/5360949
陳之漢斬首賴清德說出庭  說下次要傳總統作證,政治,2026/03/06 12:14,館長陳之漢因嗆斬首賴清德，到新北地院出庭，他否認犯行，還說下次要傳總統賴清德作證。（記者吳仁捷攝）新北地院今天召開審理庭，審理網紅館長陳之漢，嗆聲「把賴清德狗頭斬下來」，新北檢今年1月偵結，認定館長涉犯恐嚇公眾、恐嚇危害安全及罪嫌提起公訴，新北地院今上午開庭審理，館長到庭，他不認罪，辯稱是遭網友斷章取義，庭訊雖只有2分鐘，但他發言近20分鐘，還說當時是談新聞斬首行動，他比喻對岸也要斬首賴清德，還說如果開庭，也要通知賴清德作證。據了解，網紅館長陳之漢去年10月5日直播時，暗示支持中國武力犯台，還脫口說出：「把賴清德狗頭斬下來」，並喊話中國「兄弟，我等你啊」、「真的我日也思夜也思啊」，被依恐嚇危害安全及恐嚇公眾罪嫌起訴；全案分案進入新北地院審查庭，法官排定今天傳喚陳之漢訊問。請繼續往下閱讀...陳之漢開庭後離開法院時受訪，他透露，今天抱著作戰心情出庭，台灣社會問題太多，一大堆貪官汙吏、奇奇怪怪的全交保，反而自己案子只是對粉絲的提問回應，卻被起訴。館長激動的說，現在司法都這樣玩？起訴我恐嚇公眾罪、危害公眾罪，我只問，講賴清德跟公眾有什麼關係。據了解，法院審查庭成立的目的為增進人力運用效益，調整刑事訴訟案件分案流程，加速案件妥適審結，進而提升裁判品質；這階段開庭時，法官會訊問被告、辯護人對檢察官起訴事實是否為認罪答辯，決定可否適用簡式審判程序、簡易程序等處理；陳之漢若在審查庭開庭時否認犯罪，案件則將移由審理庭審理。檢方調查，陳之漢於Youtube頻道先暗示支持武力犯台，甚至說：「我昨天有看到新聞，斬首打擊」、「精確斬首嘛」、「把賴清德的狗頭斬下來」、「兄弟，我等你啊」、「我日也思夜也思啊」等語，刻意在「武統」議題上，將新聞報導中「中共演練對台斬首行動」，衍伸為將總統首級砍下。陳事後辯稱沒有犯意，只是回應網友、評論新聞、無法命解放軍行動。檢方認為，陳之漢將新聞報導所用軍事術語「斬首行動」，惡意衍伸成將賴清德頭顱砍下的具體犯罪行為，並以「狗頭」極具貶抑的用詞陳述恐嚇言論，顯是出於恐嚇犯意，亦已逸脫「中共計畫對台武統、斬首行動」等大眾認知範圍，其所為難認仍受言論自由保護。    ,https://news.ltn.com.tw/news/politics/breakingnews/5360915
