Title,News_Type,date,content,url
國民黨彰化謝家選不選縣長？ 謝典霖、謝衣鳯都說話了！,政治,2025/12/14 22:39,各界看好彰化立委謝衣鳯參選縣長的實力。（取自謝衣鳯臉書）民進黨彰化縣長提名「類初選」的民調作業即將在12月15日到18日之間登場，對比式民調假想敵的國民黨立委謝衣鳯卻遲未表態。謝衣鳯的弟弟、彰化議長謝典霖今天（14）晚間發文強調，他就是把議長角色做好做滿。謝衣鳯今晚也強調，家人之間都會溝通，身為政治人物都是為服務選民做好選備。謝典霖表示，2026年選舉各地都在進行協調整合，尤其彰化縣對國民黨來說是很重要的選區，對他個人而言，就是全力拚守議會席次，把議長角色做好做滿。請繼續往下閱讀...謝典霖強調，目前各界關心的其他可能性，現階段並未做出任何最後決定，家人之間也都保持理性溝通與討論。相信黨中央會整合地方意見，推出對彰化最有利、最適合的縣長參選人。而謝衣鳯今晚接受記者電訪時表示，目前一切都在討論階段，要推出任何人選，在家庭裡都是要溝通的，她認為無論是當立委或是任何的政治人物，都要做好準備，最重要的是，如何是對選民來說是最好的。謝衣鳯、謝典霖出身彰化溪州謝家，被視為「政三代」，祖父是曾任省議員、立委的謝言信，母親是曾任立委的鄭汝芬，這次謝衣鳯被民進黨視為類初選民調的假想敵，也被認為是實力最看好的對手，但謝衣鳯遲未鬆口，地方有人猜測是否要改派謝典霖上場，今天謝典霖表態要繼續扮演好議長角色，也等於回應各界的聲音。彰化議長謝典霖表態要扮演好議長的角色。（取自謝典霖臉書）    ,https://news.ltn.com.tw/news/politics/breakingnews/5278211
內政部：公地放領土地維持農地農用 兼顧農業永續,政治,2025/12/14 22:24,內政部澄清，政府重啟公地放領政策主要是落實憲法「扶植自耕農」政策，確保放領的農地能繼續維持農用。（資料照，記者游明金攝）針對輿論關切公地放領政策可能影響農業永續發展，內政部今天澄清，政府重啟公地放領政策主要是落實憲法「扶植自耕農」政策，因此將與農業部合作，在國土計畫規範下，確保放領的農地能繼續維持農用，兼顧農業永續發展。內政部今天透過新聞稿表示，政府重啟公地放領政策目的，主要是落實憲法「扶植自耕農」政策，並回應許多農民一輩子期盼，讓長期辛勤耕耘農民可以依法取得承租農地所有權，繼續守護農地。請繼續往下閱讀...內政部說，這次重啟國有平地耕地及邊際養殖用地放領，放領對象必須是民國65年9月24日前即合法承租，且至今仍繼續作耕作或養殖使用的農民。對於申請承領的農地，縣市政府都將會同財政部國有財產署逐一現地調查，確定農地現況必須符合由承租農民自行且繼續耕作情形，才會依規定同意放領；如果有違規建築等未依規定作農業使用的情形，將不予放領。此外，內政部說，依國有耕地放領實施辦法規定，承領農民在繳清地價取得土地後5年內，除因政府公共需要辦理徵收等情形外，也不得將放領取得的土地變更為其他用途使用。同時，目前國土計畫法、農業發展條例、非都市土地使用管制規則等相關規定，對於農地農用及其變更使用程序，也都有嚴謹管制規定，必須符合規定者才能申請變更使用，以確保農業永續發展。內政部強調，政府非常重視農地管理，目前內政部也協助縣市政府以運用無人機、衛星影像資料等科技技術，監控土地違規使用情形，並依據規定執行查察控管，使土地能合於規定使用。    ,https://news.ltn.com.tw/news/politics/breakingnews/5278148
不副署、不公布違憲法案？ 沈伯洋：守護國家沒有鄉愿空間,政治,2025/12/14 21:17,民進黨立委沈伯洋。（資料照，記者廖振輝攝）行政院所提「財劃法覆議案」日前遭立法院否決，府院高層傳已拍板「不副署、不公布」，且對於立法院12日三讀通過的「反年改」修法也擬比照辦理。對於副署與否，民進黨立委沈伯洋表示，這是國家的憲政時刻，能補救的手段，幾乎都已經用完了。若再不進行憲法層級的辯論，那接下來滅亡的將是國家體制。「關於副署與否，是國家的憲政時刻。」沈伯洋指出，很多新同學，可能不知道台灣現在面臨什麼樣的狀況。用最簡單的話來說：「現在的狀況，就是立法院擴張權力，對台灣這個國家進行『斷手斷腳』。」請繼續往下閱讀...「這聽起來很聳動嗎？看看正在發生的事實。」沈伯洋說，憲法法庭被迫停擺1年；民代貪污準備就地合法；政府被迫違法舉債才能維持運作；國防預算動彈不得；政府新興計畫面臨裁撤；中國的參政權準備無限放寬；一般人民參政權利被限縮；為「一國兩制」鋪路的法案都已提出；辛苦的年改被逆轉，基金準備破產。罄竹難書。沈伯洋表示，「只要你想要反抗，他們（指在野黨）就說你「獨裁」。只要你試圖告訴社會大眾真相，他們就說你「分裂社會」。這是做賊喊抓賊，利用民主反民主。」沈伯洋指出，公民運動的努力，讓這場災難延緩了半年。但說真的，能補救的手段，幾乎都已經用完了。如果再不進行憲法層級的辯論，那接下來滅亡的不是哪一個政黨，而是這個國家的體制。「守護國家，我們實在沒有鄉愿的空間。」    ,https://news.ltn.com.tw/news/politics/breakingnews/5278169
不副署修惡版「財劃法」國民黨氣炸 政院：合法合憲,政治,2025/12/14 20:43,行政院發言人李慧芝強調，行政院長卓榮泰會做最後決定，會以合法合憲方式，守護憲政機關的責任。（資料照）藍白惡修「財劃法」掏空中央財源，政院所提財劃法覆議案遭立法院否決，府院高層已拍板「不副署、不公布」。國民黨立委王鴻薇今日痛罵，完全違反從小到大的法學常識；國民黨立委李彥秀則稱民進黨毀憲亂政。對此，行政院發言人李慧芝強調，對立法院違憲違法的再修惡版財劃法，行政院長卓榮泰會做最後決定，會以合法合憲方式，守護憲政機關的責任。行政院「財政收支劃分法」覆議案遭藍白聯手否決，府院高層近日會商後已拍板「不副署、不公布」。至於立法院國民黨團主導、上週五三讀通過的「反年改」停砍年金相關法案，也預計朝「不副署、不公布」規劃。請繼續往下閱讀...李慧芝指出，依憲法第37條規定，「副署」是憲法賦予行政院院長的權限，這是憲法權力分立的基本常識，也是五權憲法相互制衡的基本精神。李慧芝強調，至於對立法院違憲違法的再修惡版財劃法，行政院長卓榮泰會做最後決定，會以合法合憲方式，守護憲政機關的責任。政府一切作為，都是為了守護民主憲政體制，讓國家能繼續前進，行政院會堅持推動福國利民的政策，讓國人能持續獲得更全方位的照顧與支持。另外，藍白後續在立法院可能繼續杯葛行政院版「財劃法」付委審查，阻擋1.25兆元對美軍購的國防預算，甚至將排除救國團適用不當黨產條例、貪污5萬元以下除罪化等爭議法案強行三讀闖關，政院今日也開會討論對策。李慧芝指出，目前立法院尚未交付審查的案件，包括攸關國家建設、全國均衡發展以及民眾權益的政院版「財政收支劃分法」、115年度中央政府總預算，以及涉及國家安全的「強化防衛韌性及不對稱戰力特別條例」，呼籲立法院擱置爭議法案，以國人及國家優先，儘速審議院版財劃法、總預算案以及國防特別條例，以免損害國人福利與權益，延誤國家建設發展及台灣自我防衛能量。    ,https://news.ltn.com.tw/news/politics/breakingnews/5278147
台灣全民安全指引「小橘書」 教你從從容容自救,政治,2025/12/14 20:33,台灣全民安全指引小橘冊屏東準備發放了。（記者葉永騫攝）內政部南下屏東說明台灣全民安全指引小橘冊內容。（記者葉永騫攝）台灣全民安全指引小橘冊全台開始發放了，屏東縣預計24日發送，內政部次長董建宏今天南下屏東舉行宣導會，說明遇到緊急情況時要如何應對，提供全民對於危機來臨時參考，內容有遇到地震、颱風、戰爭等危機，建立民眾危機意識。董建宏指出，這本冊子告知生活中會面對什麼樣的風險，面對這些風險，有什麼要準備好，遇到風險時，要如何處理，尤其是台灣是一個多山多海的地方，但很多漂亮的地方，但也常遇到大的風險，例如颱風、地震等，當遇到問題發生時 要如何自救，比如要準備一個鮮豔的包包，因為半夜或是沒電時遇到地震時容易辨識。他強調，常常認為生活似乎沒什麼大事，但我們要居安思危，每項事情的會發生什麼事情我們都不知道，像莫拉克颱風發生時誰也不知道小林村會在一瞬間就不見，花蓮洪災發生，誰也沒想，所以現在的天氣和過去不同，大家平常要有準備，遇到事情時才知道怎麼處理，這本冊子是救命寶典，平常就是要研讀和練習，才能遇到情況時能從從容容處理。緊急避難包等物品，家戶一定要準備。（記者葉永騫攝）    ,https://news.ltn.com.tw/news/politics/breakingnews/5278141
政院不副署財劃法！綠指藍白可提倒閣 徐巧芯：當我們3歲小孩？,政治,2025/12/14 19:50,國民黨立委徐巧芯。（資料照）「財劃法」覆議案遭立法院否決，府院高層定調「不副署、不公布」，國民黨主席鄭麗文、民眾黨主席黃國昌今接連批評違法亂憲、憲政災難。對此，民進黨發言人李坤城表示，在野黨立委如果不認同，憲法給予對等制衡工具，可以對行政院長提出不信任案、國會全面改選，讓民意做最終制裁。對此，國民黨立委徐巧芯說，為什麼要因為行政院做得很爛，去倒閣讓總統可以解散國會，是行政院不依法行政、違背權力分立的原則，他們該推動的法案會持續進行，「誰要跟你搞什麼倒閣」？國民黨立委王鴻薇也說，「台灣人也都知道倒閣弄不到你賴清德」。「當我們是三歲小孩？」國民黨立委徐巧芯說，要倒閣，綠委51人先簽名，憑什麼民進黨叫國民黨做什麼，我們就要跟著做？今天的問題在賴總統，只要賴總統心態不變，誰當行政院長都一樣，若倒閣成功，總統會下台，那來倒，但只有換一個傀儡，誰跟你玩這個，無聊至極。請繼續往下閱讀...不具名藍委表示，不支持，不敢低估民進黨違法亂紀、亂改遊戲規則的無恥；另有藍委表示，他們是國會多數，綠營想倒閣可以自己發動；也有藍委說，尊重黨團的決定。    ,https://news.ltn.com.tw/news/politics/breakingnews/5278083
彰化毛小孩逆勢成長到13萬 黃秀芳要推友善毛孩大縣,政治,2025/12/14 19:44,立委黃秀芳要打造彰化縣為寵物友善的城市。（黃秀芳提供）民進黨彰化縣長提名採取「類初選」，將於15日到18日進行民調作業，爭取提名的立委黃秀芳表示，彰化縣7年來流失將近7萬人口，但登記犬貓已有13萬隻，這代表越來越多人把毛小孩當家人，未來如果入主縣府，將會推動彰化成為友善毛孩大縣。黃秀芳今天（14日）前進彰化市三民市場與民生市場拜票，她強調，台灣社會正在轉變，彰化縣也不例外，飼養犬貓當寵物的人越來越多，寵物經濟也應該獲得重視，無論是寵物美容、寵物旅館到寵物友善餐廳，或是寵物友善公園，這都是在照顧寵物族的同時，能夠提供更多元的服務與建設。請繼續往下閱讀...黃秀芳強調，她曾經在立法院推動寵物食品安全管理專法，讓寵物的食安獲得保障，除了有主人的寵物以外，流浪動物議題更是社會進步的指標，彰化流浪狗之家目前位於芬園、員林的交界，設備與品質都有待改善，只有提供更好的環境，讓收容成為認養的中繼站，才是解決收容空間不足的問題，也能為更多的流浪動物能夠找到新的主人。    ,https://news.ltn.com.tw/news/politics/breakingnews/5278109
裝修公司得標5.9億炸藥案 福麥駁「賴友友」：擁美獨家10年代理權,政治,2025/12/14 19:39,藍委徐巧芯（左起）、王鴻薇、馬文君日前揭露3月中科院開標1.2億元、標案編號YR13Z07P俗稱「女王陛下炸藥（HMX）」採購案，也由資本額只有0.19億的「福麥國際室內裝修公司」得標。（資料照）國防部決標金額達5.9億元的「RDX海掃更」（旋風炸彈）採購案，由資本額僅1900萬元的「福麥國際室內裝修公司」得標，引發在野黨抨擊。對此，福麥今發聲明嚴正澄清，得標過程禁得起檢驗，已取得美國獨家代理權，具備履約能力，負責人及家人也並無任何政黨背景、絕非「賴友友」，再有不實指控，將追究法律責任。福麥指出，該公司得標前已正式取得美國知名軍工大廠SAE公司為期10年之台灣獨家代理權，相關投標過程合法、程序完備，並非毫無經驗之業者，截至目前為止，已承接中科院2件採購案，其中一件已完成交貨並順利履約；另一件則於得標後兩週內，即取得美國官方核發之輸出許可證，足證其具備實務操作經驗與如期履約之能力。請繼續往下閱讀...福麥表示，福麥公司現任負責人李文慶、前任負責人李淑玲及其家人均無任何政黨黨員身分，在賴清德總統任內及賴清德台南市長任內，均未曾有過任何接觸，彼此間互不認識，媒體報導稱李文慶等人係「賴友友」，影射與高層關係良好，與事實不符，懇請外界勿再以訛傳訛，混淆視聽。福麥說，此案所涉之RDX，為飛彈、火箭及砲彈等重要軍工產品之關鍵原料，目前全球僅有中國及印度輸出，取得過程不易，實務上需透過合法民間管道，間接取得原料，以維護國防安全。福麥強調，相關不實指控與假訊息，已對台灣國防安全與該公司商譽造成嚴重影響，爾後如有不實指控、錯誤報導或惡意散佈，不實訊息致影響本公司或員工之權益，將依法追究相關法律責任。福麥友人進一步透露，福麥公司董事長李文慶、李淑玲、先生蕭青峯都不是造謠所稱民進黨籍，3人沒有跟賴市長或賴總統見面或合影過，最不堪的是，政論與網媒宣稱其弟弟也是重要關係人，現實狀況是，弟弟因中風臥病在床多年，不可能過問公司業務，謠言已對家屬造成雙重傷害。網路粉專指控福麥公司負責人及家族為「賴友友」，福麥透過聲明澄清否認。（圖擷取自臉書）    ,https://news.ltn.com.tw/news/politics/breakingnews/5278110
宣布選台中市長？ 江啟臣：將全力爭取黨內提名,政治,2025/12/14 19:34,面對2026年的台中市長選舉，立法院副院長江啟臣表示，將全力爭取黨內提名，實現大台中願景。（記者歐素美攝）立法院副院長江啟臣最近在台中市區各地懸掛拜年廣告看板，引發討論，江啟臣今晚出席豐原火車站前耶誕樹點燈前接受媒體採訪時表示，歲末年終懸掛「駿馬啟新程，躍進旗艦城」看板，這10個字是他送給所有市民所有的祝福，也是對台中的願景跟期望，並表示，這段時間大家都在講2026年，他將全力爭取黨內提名，設法有機會來實現對整個大台中的願景，從幸福城奔向旗艦城。江啟臣表示，歲末年終掛看板，一方面是要祝福所有市民跟民眾新年快樂，感謝大家一路以來對他的支持鼓勵與愛護，今年特別選擇對他別有意義的標語：「駿馬啟新程，躍進旗艦城」，這10個字是他送給所有市民的祝福，也是對台中的願景跟期望，相信也是很多市民期待的。請繼續往下閱讀...他說，過去在盧市長的努力下，台中已是幸福城，在六都當中，很多幸福指數的評比都是第一名，所以，我們就是一個實質的幸福城，明年馬年希望駿馬奔騰，繼續向前衝，奔向一個旗艦城，許我們做為台灣的旗艦城，打造台灣的旗艦城，成為亞洲的新核心、世界的新核心。江啟臣說，台中是他的故鄉，14年前有機會回鄉服務，非常感謝一路以來栽培支持他的民眾及鄉親，市民對他的期許期待，他責無旁貸，必需對這個城市的未來發展提出願景及實際上能做的政策跟行動，此時此刻對他來講是對台中承諾及願景的一個關鍵時刻，他在這裡出生長大，台中就是他的家，彼此一起長大，更希望的是未來的台中是一座在全世界閃亮的城市，所以他才提出旗艦城這個願景。江啟臣指出，這段時間，相信很多人都在講2026年，他也看到民眾對他的期待，相信他不會讓大家失望，會全力力以赴繼續努力，這些都是對他的鼓勵加油期待，做為民意代表，一路走來如果沒有大家，他很難站在這裡面。江啟臣強調，對未來會全力以赴，該爭取的一定會全力來爭取，對市民來講，必需用具體行動展現台中實踐願景，對黨內來講，也會全力爭取黨內提名，設法有機會來實現對整個大台中的願景，這也是很多市民的期待，我們一起來實現大台中的願景，從幸福城奔向旗艦城。    ,https://news.ltn.com.tw/news/politics/breakingnews/5278115
獨家》炸藥採購案藍營點名「賴友友」 福麥反擊：追究法律責任,政治,2025/12/14 19:20,藍委點名拿下國防部炸藥採購標案的福麥公司為「賴友友」，福麥晚間發聲明，不實指控將追究法律責任。（記者王捷攝）火藥軍購案遭藍營質疑「賴友友」，福麥國際有限公司今晚發表聲明，並否認採購與高層有關係，強調國防部RDX採購案投標程序合法完備，如果繼續傳不實指控，公司將追究法律責任。福麥指出，得標前已正式取得美國知名軍工業者SAE公司為期10年的台灣獨家代理權，得標過程禁得起檢驗，也具備如期履約能力，過去已承接中科院2件採購案，其中1件已完成交貨並順利履約，另1件在得標後2週內即取得美國官方核發的輸出許可證，這是公司具備實務操作經驗的佐證。請繼續往下閱讀...針對外界影射福麥公司負責人是「賴友友」，福麥表示，現任負責人李文慶、前任負責人李淑玲及其家人均無任何政黨黨員身分，在賴清德總統任內及其擔任台南市長任內，均未曾有過任何接觸，彼此互不認識；有媒體報導稱李文慶是「賴友友」，影射與高層關係良好，與事實不符，懇請外界勿再以訛傳訛，混淆視聽。福麥也提到，RDX是飛彈、火箭及砲彈等軍工產品的重要關鍵原料，公司稱目前全球僅中國與印度輸出該關鍵原料，取得不易，在輸入商業實務上，需透過合法民間管道間接取得，以維護國防供應鏈。不實指控與假訊息已對台灣國防安全及公司商譽造成嚴重影響，將秉持合法、專業與負責態度依法履約，確保供應穩定與安全。福麥強調，若有不實指控、錯誤報導或惡意散佈不實訊息影響公司或員工權益，將依法追究相關法律責任。    ,https://news.ltn.com.tw/news/politics/breakingnews/5278101
力挺府院不副署2惡法！台灣基進：抗衡藍白國會獨裁,政治,2025/12/14 19:08,台灣基進黨主席王興煥。（資料照）行政院財政收支劃分法覆議案遭立法院否決，傳府院高層已拍板「不副署、不公布」，藍白上週五三讀通過的反年改停砍年金相關法案，也預計將朝「不副署、不公布」規劃。台灣基進今日表態，支持府院此一抗衡藍白國會獨裁的積極作為，與台灣人民站在一起，反抗國會獨裁，守住台灣得來不易的憲政民主。台灣基進指出，他們過去即主張，對於立法院所通過之存在「明顯違憲性」（Offensichtliche Verfassungswidrigkeit）的法案，在窮盡覆議手段後，總統應拒絕公布，行政院也自應不予副署，避免「國會獨裁」破壞憲政秩序。請繼續往下閱讀...台灣基進續指，面對立法院與行政院的憲政機關衝突，行政院長已提出覆議，總統過去已依據憲法權限召開院際協商會議，都未能阻止藍白國會一再通過毀憲法案。他們認為，總統與行政院作為憲政機關，在憲法法庭被惡意癱瘓時，更應該積極守護憲政主義，不容破壞權力分立的藍白獨裁國會一再肆意摧毀憲政秩序。據現行憲法規定，若行政院長不副署，立法院可以提出倒閣反制，因此並非現行憲政架構下所不許之憲政制衡手段。台灣基進強調，「不副署、不公布」並非違憲毀憲，而是守住憲法底線所必須採取的正當防衛。當立法院不斷以多數暴力反覆踐踏憲政秩序，行政權與總統若仍消極退讓，才是真正對民主與法治的失職。    ,https://news.ltn.com.tw/news/politics/breakingnews/5278062
助理費除罪化草案源於立院法制局？陳培瑜：和韓國瑜脫不了關係,政治,2025/12/14 18:59,立法院民進黨團書記長陳培瑜。（資料照）國民黨立委陳玉珍提出「立委貪污助理費除罪化」修法，引發爭議。據悉，該版本之雛形來自立法院法制局，且原版本在條文中直接載明「回溯條款」，擺明要替修法前涉貪被訴的立委除罪。對此，民進黨團書記長陳培瑜表示，就如同法制局局長郭明政掛名寫的助理費報告一樣，此事和立法院長韓國瑜脫不了關係。「知新聞」報導指出，陳玉珍所提法案出自立法院法制局，且最初始的版本還有「回溯條款」，言明哪天修正施行前，「立委及助理支用涉刑事責任者，不罰。」這才是為了救涉助理費案的國民黨立委顏寬恒。請繼續往下閱讀...對此，陳培瑜表示，她11日在司法及法制委員會時，是第一個請法制局長上台諮詢的委員，原因很簡單，因為她認為法制局在今年所提出的「各國國會公費助理之比較研究—兼論立法委員聘任公費助理相關法制問題研析」這份報告，絕非空穴來風，突然自己想要寫這份報告，且過往報告不會以局長為第一掛名作者。陳培瑜透露，連曾擔任法制局長的同仁也私下對她說，自己以前擔任局長時，很少掛名，那就代表這一份研究報告，一定是相關人士有交代，或是有重要的政治任務。大家都知道立法院公務人員的位置來來去去，都取決於現任立法院長，亦即和韓國瑜有關，所以她認為韓國瑜在這件事情上，請不要置身事外。陳培瑜也說，再加上11日司法委員會排審國會助理相關法案，邀請立法院秘書長周萬來出席，韓國瑜竟幫周萬來排了另外一場協商，藉以避開出席委員會，所以對她來說，她認為這整件事情其實都和韓國瑜他們有關。民進黨團幹事長鍾佳濱則說，在11日司法委員會的詢答中，法務部的說明已明白顯示，單純修「立法院組織法」，不論有無「回溯條款」，都很難替已發生的貪污助理費行為脫罪，除非直接修改「貪污治罪條例」，把侵占助理費除罪化！鍾佳濱認為，由此可見，除了「回溯條款」有涉及為貪污除罪的預謀外，未來更要密切注意所圖未遂後，進一步嚴防其他脫罪意圖的修法！    ,https://news.ltn.com.tw/news/politics/breakingnews/5278092
