Title,News_Type,date,content,url
驚見大量C-17從美、英移動！「大西洋空中走廊」現形,國際,2026/04/04 18:58,"國外航空監控網站發現，大量C-17運輸機正在飛越大西洋前往歐洲與中東地區。（取自粉專王臻明的軍事頻道）中東戰火持續延燒之際，國外航空監控網站發現，大量「全球霸王III」C-17運輸機，正在飛越大西洋前往歐洲與中東地區，儼然形成一條直通戰區的「大西洋空中走廊」。軍事專家王臻明今（4日）在粉專發文引述航空監測網站消息指出，大批的C-17正從美國出發飛越大西洋；同一時間，也有大批C-17從英國飛往中東地區。王臻明表示，綜合這些飛航情報，顯示美國正在建立一條空中運輸走廊，將大量的物資運往中東地區，這也讓人懷疑，美國是否即將展開地面作戰任務，正在集結兵力與運送彈藥與支援物資。請繼續往下閱讀...知名企業家、內容創作者「Mario Nawfal」也在X發文，分享其他航空監測網站消息，表示除了C-17之外，還有C-5運輸機、KC-135加油機等軍機，正不斷地跨越大西洋，飛往歐洲和中東。王臻明也分析，目前戰情最新狀況表示，目前美國已經證實一架F-15E戰機在伊朗境內墜毀，伊朗也展示擊落多架無人機的照片。其中，有一部分不像美國的無人機，反而更像是中國製的翼龍II型無人機。他指出，由於沙烏地阿拉伯與阿拉伯聯合大公國，都曾採購中國的翼龍II型無人機，因此這可能證實這兩個波斯灣國家已經參戰。之前阿拉伯聯合大公國就已公開表示，不排除參與戰事，以打開荷姆茲海峽。「全球霸王III」C-17運輸機。（路透）    ",https://news.ltn.com.tw/news/world/breakingnews/5393434
中東戰火延燒5週 美戰爭部：13官兵亡、365人傷,國際,2026/04/04 18:43,伊朗伊斯蘭革命衛隊釋出鎖定並擊落美軍F-15E戰機的紅外線影片。（取自X@AMK_Mapping_）美國2月28日聯手以色列向伊朗發起軍事行動，這場席捲中東地區的戰事已持續5個星期，根據美國戰爭部公布最新統計數據，截至4月3日，共有13位美軍官兵陣亡，另有365人受傷。這些受傷的美軍人員若依軍種分類，分別是陸軍247人、海軍63人、陸戰隊19人，以及空軍36人。請繼續往下閱讀...美聯社報導，但尚不清楚前述數據是否包含稍早美軍2架戰機墜毀的相關人員。美國有線電視新聞網（CNN）報導，美軍一架F-15戰機和一架A-10戰機今天稍早分別墜毀，使得美國發動戰事迄今，已知被摧毀的載人軍機數量來到7架。    ,https://news.ltn.com.tw/news/world/breakingnews/5393375
西雅圖外海驚見「神秘客」阿拉斯加虎鯨家族千里遠足,國際,2026/04/04 18:38,業餘攝影家Hongming Zheng提供的照片顯示，過去從未出現在華盛頓州外海的3隻虎鯨中的2隻。（美聯社）美國華盛頓州西雅圖外海，最近出現一組「新客」：3隻過去從未被記錄在當地出沒的虎鯨，現身普傑海峽（Puget Sound）水域，給賞鯨客和研究人員驚喜，迅速成為受矚目的海洋明星。《美聯社》3日報導，研究人員長期以來根據虎鯨背鰭形狀和背鰭後側灰白色的「鞍形斑」（saddle patches），來辨識經常出沒薩利希海（Salish Sea）的虎鯨族群，因此，當今年3月這批新來的訪客，先在加拿大溫哥華外海被發現時，令研究人員大感意外，因為並沒有牠們曾出現在該處海域的紀錄。薩利希海位於加拿大卑詩省和美國華盛頓州外海，範圍涵蓋普傑海峽。請繼續往下閱讀...設於華盛頓州的保育組織「虎鯨保育」（Orca Conservancy）執行長塔蘭提諾（Shari Tarantino）說，經過一番搜尋檔案資料後，終於從去年阿拉斯加海域的影像紀錄裡，找到牠們的身影。這3隻虎鯨被編號為T419、T420和T421，推測是同一家族，包括1隻成年雌鯨，以及另外兩隻推測是牠後代的年輕虎鯨，其中1隻是體型相當大的成年年輕雄鯨。編號中的T代表生態習性為「遷徙型」（transient）虎鯨，而非英文「觀光客」（tourist）之意。這群新來的訪客有未曾在當地鯨群身上見過的圓形疤痕，是雪茄達摩鯊（cookie-cutter shark）咬痕。這種鯊魚生活在開闊的大洋，這些疤痕顯示，這些虎鯨曾經在遠洋海域活動。塔蘭提諾說，「我們還無法百分之百肯定牠們來自哪裡，但是根據牠們的外觀以及一些阿拉斯加虎鯨族群在北太平洋的活動範圍廣泛，推測最可能是來自阿拉斯加，可能是阿留申群島一帶」。至於牠們為何從原本棲息地不遠千里而來，塔蘭提諾說，可能是「美食之旅」。遷徙型虎鯨以海洋哺乳類為食，與以鮭魚為主食的定居型不同，而薩利希海峽有很多港灣海豹、海獅等。這一個月來，這3隻虎鯨吸引許多賞鯨愛好者湧入西雅圖，開車10小時來拜訪這群神秘客的鄭姓業餘攝影家（Hongming Zheng）說，「大家．．．非常高興看到這些虎鯨」、「太棒了」。塔蘭提諾說，這批虎鯨「很快就成為倍受大家喜愛的寵兒」，「人們花一輩子時間希望從岸上就能看到虎鯨，而這批虎鯨給大家超乎預期的驚喜」。華盛頓州外海來了初次造訪的3隻虎鯨，照片中為其中一隻在西雅圖外海悠遊。（美聯社）業餘攝影家Hongming Zheng提供的照片顯示，過去從未出現在華盛頓州外海的3隻虎鯨中的一隻。美國國家海洋暨大氣總署（NOAA）研究人員在後方觀察。（美聯社）    ,https://news.ltn.com.tw/news/world/breakingnews/5393412
日本賞櫻季到來 櫻花老樹倒塌構成安全隱憂,國際,2026/04/04 18:38,許多民眾3日在位於日本東京市中心、2日才有1棵櫻花樹倒塌的千鳥淵划船賞櫻。（路透）日本東京進入一年一度的賞櫻季，一場難以預料的安全隱患也隨之浮現：種植於上世紀60年代的東京最受歡迎與最具標誌性的染井吉野櫻，如今多已逐漸老朽衰弱；有些櫻花樹已經倒塌，還有許多需要支架固定。本月2日，東京世田谷區砧公園與市中心皇居護城河畔的千鳥淵綠道，各有1棵櫻花樹倒塌，前者倒下時砸壞圍欄，後者則差點落入皇居護城河，所幸無人受傷。砧公園倒塌的那棵櫻花樹高18公尺，直徑2.5公尺，是園內最老櫻花樹之一，樹齡估計超過60年；今年3月，砧公園曾有另1棵老櫻花樹倒塌，造成1名路人受傷。請繼續往下閱讀...負責公園管理的東京都官員野口正和（音譯）說，東京各公園去年倒了85棵樹，造成3人受傷，不少倒掉的樹是櫻花樹。由於民眾賞櫻時會聚在樹下飲食交流，當局已注意到樹倒隱憂所構成的安全顧慮。上月，東京都議員風間豐（風間ゆたか，音譯）在社群媒體發文呼籲當局採取確切的安全措施，並且提醒，部分樹根裸露或明顯腐爛的櫻花樹看起來很危險。老化與遭內生真菌侵蝕是櫻花樹樹況惡化的諸多主因之一。櫻花樹醫和田博幸說，嚴重傾斜、樹幹低處開花，以及樹底長蘑菇，都是在避開有安全隱患的櫻花樹時需要注意的徵兆。此外，雨後樹幹積水也會增加樹倒風險。和田說，許多日本人日常生活週遭的樹，都是在二戰後不久種的，迄今已有70、80年，日益衰弱，而且老樹還會受到夏季極端高溫與長期乾旱的影響。在3月的櫻花樹倒傷人事件後，官員已趕在賞櫻季來臨前為東京各大公園的樹木做體檢；其中砧公園的800多棵櫻花樹已完成初步檢查，有些被砍，另有些被貼上警語，但本月2日倒下的那棵櫻花樹，並無任何警告標誌。東京都官員野口說，警語只能治標，種新樹才能治本，只能呼籲賞櫻民眾多加小心，「因為（就算）檢查過，也不敢保證絕對安全。」    ,https://news.ltn.com.tw/news/world/breakingnews/5393404
直闖敵境搶救F-15E飛官！美軍「CSAR」超狂救援部隊背景曝光,國際,2026/04/04 18:23,"圖為美國、法國空軍進行聯合演習畫面，示意圖。（法新社）美國官員證實，一架F-15E戰鬥機在伊朗境內遭擊落，駕駛飛官已彈射逃生，但下落不明，伊朗已祭出懸賞，企圖搶先一步抓住這名飛官。而根據外媒報導，美軍已展開戰鬥搜救任務（Combat Search and Rescue，簡稱CSAR）派出特殊部隊，直闖伊朗搶人。根據《BBC》報導，目前針對該名飛官的搜尋任務，正持續在伊朗境內展開。報導指出，CSAR（戰鬥搜救任務）被視為美軍及其盟友準備過程中最複雜、且最具時效性的軍事行動之一。在美國，空軍的精銳單位專門為此類任務接受訓練，並經常預先部署在可能發生墜機的衝突區域附近。若消息屬實，這將成為美軍跨越數十年漫長戰鬥搜救歷史中的最新篇章。請繼續往下閱讀...報導指出，CSAR是一種旨在尋找、援助並營救受困人員（包括遭擊落的飛行員或遭孤立的部隊）的軍事行動。與一般的搜救任務不同，CSAR發生在「敵對」或「具主權爭議」的環境中。在某些情況下任務可能發生在敵軍陣地深處。CSAR任務通常由直升機執行，並有加油機提供支援，其他軍機則在現場進行打擊與巡邏。一位前空降搜救中隊指揮官指出，像伊朗這次的行動，至少需要24名空降搜救員搭乘黑鷹直升機搜尋該區域。該指揮官補充，團隊已做好必要時從飛機跳傘的準備，一旦落地，首要任務就是聯繫失蹤的機組員。尋獲後，搜救員將提供必要的醫療援助，避開敵軍，並移動到可以被撤離的地點。「用『艱險且極度危險』來形容都還太保守了」前指揮官表示：「這就是他們在全球各地接受的訓練內容，他們被稱為美國空軍的『瑞士刀』。」報導提到，此類任務極具時效性，因為敵軍也會同時部署兵力，試圖搶在搜救隊之前抓到美方人員。前美國海軍陸戰隊特種作戰專家哈克特（Jonathan Hackett）指出，搜救隊的首要目標是尋找生命跡象。他表示：「他們會從已知的最後據點往回推算，並根據受困者在險峻地形中可能的移動速度，展開扇形搜索。」哈克特指出，這次在伊朗的行動屬於「非標準輔助回收任務」（non-standard assisted recovery mission），這類任務可能事先已聯繫過當地的在地組織，建立應急計畫以協助救援。CSAR歷史悠久，可追溯至一戰時期飛行員在法國境內即興降落營救同袍。美軍的空降搜救單位則起源於1943年，當時兩名軍醫空降至緬甸協助受傷士兵。隔年，世界上首次直升機救援發生，一名美軍中尉從日軍防線後方救回四名士兵，這也是直升機首次投入實戰。現代CSAR的基礎奠定於越戰。當時著名的「Bat 21」任務雖導致多架軍機損失與多人傷亡，但也促使軍方精進戰術。雖然美軍各軍種都有一定的搜救能力，但尋找與營救人員的主要責任由空軍承擔。這項工作主由「空降搜救員（PJs）」執行，他們隸屬於特種作戰體系。其官方座右銘為「余事卒，以利他人之生（These Things We Do, That Others May Live）」，這象徵著美軍對官兵「絕不拋下任何人」的莊嚴承諾。這些人員同時具備戰鬥員與醫療人員的雙重身分，需經歷美軍公認最艱難的兩年選拔與訓練，包括傘降、潛水、水下爆破、野外求生（SERE）以及平民救護員資格。在地面上，這些團隊由專門的「戰鬥救援官」（Combat Rescue Officers）領導。該部隊近年來的著名任務包括阿富汗與伊拉克：PJs執行了數千次任務，包括2005年營救一名受傷的海豹部隊成員（該事件後被改編成電影）。1999 年塞爾維亞：一架 F-117夜鷹戰機遭擊落，飛行員成功被PJs救回。1995 年波士尼亞：美軍飛行員歐格雷迪（Scott O'Grady）在躲藏六天後，透過空軍與陸戰隊的聯合任務獲救。    ",https://news.ltn.com.tw/news/world/breakingnews/5393280
自由說新聞》美「阿提米絲2號」掀太空新篇章！中國急拉五星旗救援遭群嘲,國際,2026/04/04 17:50,全新的視界！新聞話題不漏接，快訂閱YouTube 【自由追新聞】，記得開啟小鈴鐺哦！    ,https://news.ltn.com.tw/news/world/breakingnews/5393383
41國外長「緊急視訊會議」 施壓德黑蘭重啟荷姆茲,國際,2026/04/04 17:39,針對荷姆茲海峽封鎖危機，逾40國外交官週四（2日）召開緊急視訊會議。（歐新社）針對伊朗與美以戰爭引發的荷姆茲海峽封鎖危機，逾40國外交官週四（2日）召開緊急視訊會議。主導會議的英國外交大臣古柏（Yvette Cooper）痛批，伊朗劫持國際航道並「綁架全球經濟」，導致全球能源與糧食價格飆升。儘管美方缺席且無意介入，但國際社會任試圖透過集體外交施壓，迫使伊朗重啟這條戰略命脈。據《美聯社》報導，荷姆茲海峽作為全球重要的石油與天然氣運輸樞紐，受戰爭影響目前幾近癱瘓。根據航運數據公司「勞氏海事情報」（Lloyd’s List Intelligence）統計，自戰爭爆發以來，該海域已發生23起針對商船的直接攻擊，造成11名船員喪生。目前海峽航運幾乎陷入停頓，僅剩少數規避制裁的伊朗油輪得以通行。請繼續往下閱讀...英國外交大臣古柏於會中指出，伊朗的魯莽攻擊已引發全球性的經濟震盪，不僅燃料短缺，甚至波及肥料與糧價，使各國家庭與企業承受沉重負擔。本次會議參與國，包括英、法、德、日及阿聯在內的41國，正研議加強外交孤立伊朗，並透過經濟手段，防堵德黑蘭當局從管控海峽中獲利。值得關注的是，美國總統川普並未派員出席此會議。川普日前明確表示，確保該航道安全並非美國的義務，強調依賴荷姆茲海峽石油的國家應自行負責。此舉連同川普再度威脅退出北約的言論，讓歐洲盟友倍感壓力。倫敦國王學院中東安全專家羅伯茲（David B. Roberts）分析，英、法等國此次積極主導國際聯盟，除了解決能源燃眉之急，更重要的是為了向川普展示，歐洲有能力且願意分擔防衛責任。儘管法國總統馬克宏直言，在戰火持續下，以武力強行開闢航道並不現實，但英法等國正推動在未來停火後，建立國際護航隊保衛商船安全通過海峽。英國政府表示，下週將召開軍事計畫會議，針對戰後的除雷工作與航運安全進行籌劃。此外，「國際海事組織」（IMO）也正介入斡旋，試圖營救受困於衝突區的2000艘船隻與約2萬名海員。    ,https://news.ltn.com.tw/news/world/breakingnews/5393279
笑不出來！帶「這類教科書」入境  被中國海關丟掉台灣高中生傻了,國際,2026/04/04 17:23,網友帶台灣社會科教科書入境中國，被海關攔下。（擷取自Threads/@iunnvae）一名網友在社群分享，近日到中國入境時被海關攔查，只因行李箱放有台灣的社會科教科書。最終，公民講義被迫在海關丟掉，地理則險些被丟。對此，她無奈提醒網友「如果要去中國記得不要帶社會科類的書」。一名網友在Threads上分享，近日帶著台灣的教科書入境中國，一到中國就馬上被攔下，其中「公民關鍵60」被要求直接現場丟掉，地理課本則是險些被丟，讓原PO唯獨慶幸的是，沒有帶著歷史講義，整起事件讓她無奈表示「笑不出來......」。請繼續往下閱讀...貼文一出，馬上引起網友們關注。網友表示「還好講義沒叫公民關鍵64，不然人都沒了」、「可能因為關鍵64裡面有講中國政治跟習近平等中共的事情，幸好地理倖存」、「記得暑假作業不想寫的可以一起帶去中國，他們會幫你處理掉，還有正當理由」。對此，也有網友分享過去入境中國的經驗「之前也帶了繁體字的小說去中國，一到那邊就被海關拆開細細檢查內容，確認沒問題才放過關」。其實，台灣教科書在中國被攔查一事早有發生，過去中國海關就曾查扣一批透過中華郵政寄到中國的台商子女中學教科書，以地圖未包含南海、台灣、釣魚台、藏南等地區，將台灣標註為國家違反一中原則等理由禁止入境。在當時也引起了兩岸台商圈廣泛議論。     在 Threads 查看    ,https://news.ltn.com.tw/news/world/breakingnews/5393251
烏干達男闖托兒所砍死4童 家長怒欲私刑處死,國際,2026/04/04 16:56,烏干達托兒所發生男子持刀闖入砍殺幼童不幸事件。托兒所示意圖。（情境照）烏干達首都康培拉高檔住宅區加巴（Ggaba），2日上午11點驚傳遭39歲男子奧紐姆（Okello Christopher Onyum）闖入托兒所持刀砍殺，造成4名2到3歲幼童慘死。據《BBC》報導，烏干達警方發言人卡瓦拉（Racheal Kawala）說，奧紐姆曾到加巴幼兒發展計劃學校（Ggaba Early Childhood Development Program School）詢問小孩入學事宜，被告知2日再來了解，孰料，他當天來了後，突然持刀亂砍，3名男童、1名女童當場身亡。請繼續往下閱讀...警方獲報趕到現場發現，憤怒的家長們準備私刑處死奧紐姆，連忙將他上銬帶走，行凶動機和確切犯案過程仍待調查釐清。另外，托兒所內有10名兒童逃過一劫，都已送回父母身邊。    ,https://news.ltn.com.tw/news/world/breakingnews/5393245
美以聯軍又出擊 空襲伊朗西南部石化特區多家企業遇襲,國際,2026/04/04 16:54,美以4日聯手轟炸伊朗西南部的石化特區。圖為1名男子3日拍攝伊朗首都德黑蘭附近的卡拉吉1座被美以炸毀的橋梁。（法新社）伊朗媒體報導，美國與以色列4日聯手轟炸伊朗西南部1處石化特區，該區多家企業遇襲。伊朗法斯通訊社（Fars news agency）引述胡齊斯坦省（Khuzestan）副省長的話報導說：「馬夏（Mahshahr）（Mahshahr）石油化學工業特區發生爆炸。」馬夏是位於伊朗西南部的港口城。請繼續往下閱讀...法斯通訊社還說，美以聯軍對馬夏的攻擊打中該區3家企；伊朗塔斯尼姆通訊社（Tasnim News Agency）則表示，「（攻擊所導致的）損失程度尚不明」。    ,https://news.ltn.com.tw/news/world/breakingnews/5393307
「虛擬人」也要聽黨話！北京祭出嚴管令 禁止未成年與「AI談戀愛」,國際,2026/04/04 16:30,中國國家互聯網信息辦公室（網信辦）週五（3日）發布《數位人服務管理規定》草案，要求所有數位人內容必須顯著標註，並嚴禁為未成年人提供「虛擬親密關係」服務。（路透社）繼影視與遊戲產業後，中國共產黨管控的觸角正式延伸至「數位虛擬人」。中國國家互聯網信息辦公室（網信辦）週五（3日）發布新規草案，要求所有數位人內容必須顯著標註，並嚴禁為未成年人提供「虛擬親密關係」服務。據《路透》報導，這份名為《數位人服務管理規定》草案目前正進行公開徵求意見。新規明確要求，數位人不得傳播任何「危害國家安全」、「煽動顛覆國家政權」或「破壞民族團結」的內容，且服務提供者必須確保數位人的言論與活動符合所謂的「社會主義核心價值觀」。請繼續往下閱讀...針對近年來風靡中國年輕族群的「AI伴侶」，草案祭出嚴厲紅線，禁止向未滿18歲的用戶提供「親密關係」服務，以防止數位人誤導孩童或導致上癮。此外，新規也禁止未經許可使用他人個人資訊製造虛擬形象，或利用數位人規避身分驗證系統。在內容管控方面，服務提供者被要求攔截色情、暴力、恐怖或歧視性資訊。網信辦強調，數位人的治理已提升至「戰略科學問題」，攸關「網路空間安全」與「公共利益」。分析指出，這份新規旨在填補監管空白，確保蓬勃發展的虛擬人產業在黨的「健康發展」框架內運行。這也意味著，在中國未來的數位世界裡，無論是直播帶貨的虛擬主播，還是情感陪伴的AI，都必須先學會「政治正確」。    ,https://news.ltn.com.tw/news/world/breakingnews/5393224
「我不是你未來的妻子」爆紅！  南韓梨花女子大學校布條引網友共鳴,國際,2026/04/04 16:06,"網友拍攝南韓梨花女子大學的布條，直呼「南韓梨花女大的標語永遠不會過時」。（圖擷取自@yumous社群平台「Threads」）南韓梨花女子大學是國人旅遊名單上必去景點，近日有網友在社群平台貼出該校布條寫道「I am your future boss, not your future wife.」（我不會是你未來的妻子，而是你未來的老闆）不少網友分享自身經驗，提到現今台灣社會中，女性成就有時被視為「嫁入好人家」的條件之一，甚至有學校將「官夫人」列為傑出校友，引發對性別角色期待差異的討論。適逢兒童清明連續假期，有些人可能會回老家掃墓，或多或少會遇到親朋好友在問些「近況」，有位網友說道她考上清大，她的阿伯居然回她「能嫁給工程師很好」，這已經是不知道第幾個親戚，忽視她學業上的努力與前景，而把嫁人當作唯一歸宿的案例，讓她感到悲涼。請繼續往下閱讀...有網友就分享到南韓梨花女子大學拍下的布條「I am your future boss, not your future wife.」，直呼「南韓梨花女大的標語永遠不會過時」，留言區的女網友們也紛紛響應「女中應該不用調查，光各行各業名人，女性出類拔萃可能性高過高中混校很多」、「希望這個橫幅標語有一天能被刻在牆上」、「第一次看到這樣的標語覺得很震撼人心」、「我永遠不會忘記中山女高新生入學式那天我看見幾乎所有『傑出校友』的頭銜是XXX夫人時的當下內心受到多大的衝擊和傷害」。     在 Threads 查看    ",https://news.ltn.com.tw/news/world/breakingnews/5393138
伊朗釋出擊落影片！F-15E釋放干擾彈 空中激烈迴避畫面曝光,國際,2026/04/04 15:51,"伊朗伊斯蘭革命衛隊昨日釋出鎖定並擊落美軍F-15E戰機的紅外線影片。（取自X@AMK_Mapping_）伊朗官方媒體昨日宣布擊毀一架美軍F-35戰機，不過軍方人士比對特徵後表示該機應為美軍F-15E戰鬥機。伊朗也釋出軍方攻擊該架戰機的影片，可見戰機在遭到攻擊時，不斷翻騰閃避，並放出干擾彈試圖迴避攻擊。伊朗伊斯蘭革命衛隊昨日釋出鎖定並擊落美軍F-15E戰機的紅外線影片，畫面非常模糊，影片時間也很短，但從畫面可看出，F-15E正不斷激烈迴避，並釋放干擾彈。請繼續往下閱讀...美國官員已經證實，一架雙座F-15戰機於伊朗境內墜毀，美方於3日展開搜救任務。伊朗也在搜尋機上美軍飛官下落，不但祭出賞金，國營電視台更鼓勵民眾看到美軍可直接開火。Earlier the IRGC published footage showing the interception of what appears to be a U.S. F-15 fighter jet, although they claimed this was a separate incident over Qeshm Island in southern Iran, whereas the other fighter jet was reportedly shot down over central Iran.It's… https://t.co/DJMBurL5g3 pic.twitter.com/d9AcIdUFZN— AMK Mapping ???????? （@AMK_Mapping_） April 3, 2026 Earlier the IRGC published footage showing the interception of what appears to be a U.S. F-15 fighter jet, although they claimed this was a separate incident over Qeshm Island in southern Iran, whereas the other fighter jet was reportedly shot down over central Iran.It's… https://t.co/DJMBurL5g3 pic.twitter.com/d9AcIdUFZN    ",https://news.ltn.com.tw/news/world/breakingnews/5393225
