Title,News_Type,date,content,url
高雄交警躲樹後測速挨嗆「議員有事做了」 騎士PO網反被洗臉,社會,2025/10/13 12:34,警方在取締執法路段，於100公尺至300公尺前，應設置測速取締標誌。（警方提供）高雄市1名機車騎士昨天行經楠梓區高楠公路，發現交通警察躲在路樹後方，持測速槍抓超速，且限速僅40公里，將影片PO網公審，還說「左楠的市議員候選人有事做了！」，但網友留言「只要前面有限速警告標誌，沒減速就是自己的問題」，警方也指稱執法符合規定。楠梓警分局表示，10月12日13時許，楠梓警分局交通分隊於楠梓區高楠公路段實施機動測速照相勤務，依據道路交通管理處罰條例第7條之2第3項規定，取締執法路段，在一般道路應於100公尺至300公尺前，設置測速取締標誌。經查影片中員警於高楠公路人行道執法，符合相關規定。請繼續往下閱讀...還有網友留言：「警察在樹下就說人家躲起來」、「怎麼在考場能遵守的事情，到馬路上後就變成還要人提醒？」、「都成年人了，為自己行為負責，少找點藉口不是成長的一部份嗎？」警方表示，高楠公路為楠梓區易生超速行駛路段，且今年度迄今發生A2事故57件、A3事故93件，楠梓分局重申，行車速度超過規定之最高時速，將處新臺幣1200元以上2400元以下罰鍰。超過40公里以上，處新臺幣12000元以上36000元以下罰鍰，並吊扣該汽車牌照6個月。民眾依速限行駛降低事故嚴重程度，也能增加反應時間減少交通事故發生，避免發生危險。熱門賽事、球星動態不漏接    ,https://news.ltn.com.tw/news/society/breakingnews/5209296
稱使用輔助駕駛 女子國道突切入內側車道害1車撞護欄,社會,2025/10/13 12:16,稱使用輔助駕駛，女子國道突切入內側車道害1車撞護欄。圖為肇事梁女休旅車。（警方提供）42歲梁姓女子12日下午4點多駕駛白色休旅車行經國道3號北向138.2公里處、苗栗縣西湖鄉路段時，原本行駛於中線車道的梁女休旅車突然往內切至內側車道撞上原行駛於內側車道的灰色休旅車，導致灰色休旅車撞上中央護欄後停止於內側車道；梁女車輛也因撞擊後反彈至外側車道差點波及另一輛休旅車。國道第二大隊警方今天表示，梁女自稱於事發當時使用輔助駕駛，但不知為何車輛失控突然擦撞原本行駛於內側車道、由52歲郭姓男子駕駛的休旅車，郭男所駕駛車輛被突然「切入」的梁女車輛撞上後整輛車搖晃撞上一旁中央護欄後停止於中線車道，雙方皆無酒駕，警方將持續釐清肇事原因。請繼續往下閱讀...另外，梁女休旅車撞上郭男休旅車後反彈至外側車道，一輛休旅車見狀趕緊切至路肩煞停。國道警方表示，當時事故於下午5點10分排除，所幸未對返鄉車流造成太大影響；國道警方也呼籲，駕車時應保持專注，避免因一時疏忽釀成事故，使用自動輔助駕駛並無法應付所有突發狀況，如未注意車前狀態而肇事致人重傷或死亡，亦將吊扣或吊銷駕照。稱使用輔助駕駛，女子國道突切入內側車道害1車撞護欄。圖為郭男休旅車。（警方提供）熱門賽事、球星動態不漏接    ,https://news.ltn.com.tw/news/society/breakingnews/5209292
新北男倒臥家門150公尺遭計程車輾斃 研判酒醉路倒遇死劫,社會,2025/10/13 12:13,朱男駕駛計程車輾過倒臥在路邊的王男。（記者陸運鋒翻攝）朱姓計程車司機昨天晚間9時許，行經新北市新店北宜路二段一處巷內時，輾過倒臥在路邊的王姓男子，造成王男全身多處重創，送醫搶救後不治，而朱男依過失致死罪嫌偵辦；警方調查後發現，王男經抽血後酒精濃度換算超過0.55毫克，研判他昨返家途中，疑因喝醉酒倒臥距離住家約150公尺遭計程車輾斃，但詳細死因尚待檢方相驗後釐清。據了解，69歲王男已退休，住在距離事發地約150公尺左右，平時有飲酒習慣，他在昨傍晚5時許告知家人要外出後，直到昨晚9時許返家途中，疑似酒醉倒臥在地，遭到計程車輾斃後，家人才知道王男遇上死劫。請繼續往下閱讀...新店警分局調查，43歲朱男昨晚駕駛計程車準備收工返家，當時開往新店北宜路二段391巷附近停車場時，由於天色昏暗、視線不良，輾過倒臥在路邊的69歲王男，而朱男感覺車輪壓到異物，趕緊下車察看才驚覺壓到人了，連忙通報警消前來救援。據知，警消趕抵現場後，發現王男頭部、手部及胸部重創，且已經失去呼吸心跳，隨即實施CPR心肺復甦術，並將其送往台北慈濟醫院搶救，仍於昨晚10時許宣告不治，經抽血檢驗後，酒測值換算超過0.55毫克，不排除是喝醉酒倒臥在返家途中，遭到計程車輾斃。據指出，朱男酒測值為0毫克，研判未注意車前狀況釀禍，已依依過失致死罪嫌偵辦，至於王男詳細死因，仍有待檢方相驗後釐清。王男倒臥在新北市新店北宜路二段巷內，遭計程車輾過身亡。（記者陸運鋒翻攝）熱門賽事、球星動態不漏接    ,https://news.ltn.com.tw/news/society/breakingnews/5209291
花蓮洪災愛心湧現卻遭詐團濫用 刑事局籲捐款務必循官方途徑,社會,2025/10/13 12:10,刑事局今召開記者會提醒民眾，如欲參與捐款、捐物或救災行動，務必循官方途徑辦理，切勿點擊不明連結或輕信陌生訊息。（記者姚岳宏翻攝）花蓮馬太鞍堰塞湖潰流重創光復鄉，近期社會各界愛心湧現，不少民眾主動捐贈物資、款項或擔任志工支援，刑事警察局卻發現，有詐騙集團卻假借救災的名義，結合「假慈善機關詐騙」、「網路購物詐騙」等手法誘騙民眾，今天特別召開記者會提醒民眾，如欲參與捐款、捐物或救災行動，務必循官方途徑辦理，切勿點擊不明連結或輕信陌生訊息。依據「165打詐儀錶板」最新統計，今年9月全國平均每日受理詐騙案件470件、財損新台幣2億2392萬餘元，較去年同期（601件、3億9680萬餘元）分別下降22%與44%，雖然整體詐欺趨勢已有初步下降，但詐團手法不斷翻新，仍須高度警覺。若以財損金額來看，假投資詐騙仍最嚴重，占比高達36.29%；其次是假交友投資詐騙，占22.06%；再來是假檢警詐騙，占13.01%。請繼續往下閱讀...刑事局指出，針對花蓮洪災的假善心詐騙，與過往以高獲利為誘因的詐術不同，而是訴諸公益、關懷與回饋，利用社會共感與人際信任瓦解戒心。其中包括有詐團在社群平台發文表示，免費提供志工雨靴前往花蓮救災，但需自付58元運費，等受害人加入LINE帳號聯繫並完成匯款後，再以「製作感謝名冊」為由，要求其提供完整銀行卡號進行「實名認證」，以騙取人頭帳戶，此外另有謊稱有償提供運彩分析報告，並將所得全數捐贈花蓮災區，引誘民眾匯款交易做公益，實則詐取災難財。今天記者會也邀請長年關注反詐議題的藝人王彩樺出席，以親身經驗倡議全民識詐，她提醒「不貪小便宜、不輕信來訊、多查證來源」，尤其在面對高報酬、需私下聯繫或轉帳操作等情境時，更應保持冷靜，王彩樺也鼓勵大家將防詐意識融入日常生活，從自身做起，多與長輩溝通提醒，讓警覺與識詐成為全民習慣。最後，刑事局說，政府普發現金1萬元措施即將上路，政府不會以簡訊或電子郵件通知領取登入，也不會要求前往ATM或網路銀行進行轉帳操作。民眾應牢記「不點擊、不填輸、不匯款、不轉傳」四不原則，一切以官方資訊為準，警方將持續透過「165打詐儀錶板」揭露詐騙話術與最新案例，強化識詐免疫力，守住社會信任的最後防線。長年關注反詐議題的藝人王彩樺也出席，以親身經驗提醒全民識詐。（記者姚岳宏翻攝）熱門賽事、球星動態不漏接    ,https://news.ltn.com.tw/news/society/breakingnews/5209287
桃園「馬3」違規拒檢竄巷弄撞路邊2車再衝進民宅 警帶回駕駛,社會,2025/10/13 12:07,有網友肉搜出馬3車主身分，沒想到交車才1個多月就撞車。（記者鄭淑婷翻攝）桃園市桃園區1輛「馬3」駕駛違規拒檢加速逃逸，竄進巷弄接連擦撞2輛停放路邊的自小客車後撞進民宅，民宅大門整個遭撞開，車內駕駛、乘客慌張棄車逃逸，莫名遭衝撞讓車主、屋主十分傻眼，當時還有住戶在巷弄內講電話，目睹一切嚇得趕緊跳開，警方鎖定20歲陽姓男子及其友人身分，於今天下午帶回陽男及同車的莊姓友人，陽男供稱，因無照駕駛怕被查獲才會拒檢逃逸，訊後全案依公共危險、毀損等罪嫌函送桃園地檢署偵辦。民眾將肇事影片PO上Threads，有網友肉搜出馬3車主身分，他今年8月26日才發文交車，比對車型、車號與肇事車輛一模一樣，且車主買車時剛當完兵、勞保僅1個月，他還發文讚2015馬3消光黑有夠帥，也不忘感謝業務幫他處理好，沒想到交車才1個多月就撞車，不過，警方循線聯繫上該名車主，初步調查當時車子並不是他開的，他目前被列為關係人。請繼續往下閱讀...警方表示，桃園警分局小檜溪派出所員警昨（12）日晚間7點多巡經桃園區大興路，發現有自小客違規併排停車，隨即進行盤查取締，豈料，該駕駛不願配合，加速沿大興路往市區方向逃逸，並於右轉大業路二段後駛進巷弄意圖躲避，卻不慎擦撞2輛停放路旁的車輛後衝撞民宅停止，駕駛及乘客下車分頭逃逸，警方下午將2人帶回，全案依公共危險、毀損等罪嫌進行偵辦。（15:23更新）有網友肉搜出馬3車主身分，沒想到交車才1個多月就撞車。（記者鄭淑婷翻攝）男子駕駛馬3拒檢逃逸且刻意鑽進巷弄躲藏。（記者鄭淑婷翻攝）男子駕駛馬3鑽進巷弄卻不慎衝撞路邊車輛、民宅，有住戶目擊趕緊跳開。（記者鄭淑婷翻攝）熱門賽事、球星動態不漏接    ,https://news.ltn.com.tw/news/society/breakingnews/5209263
通緝犯拘留所自殘 警押解歸案、北院收押,社會,2025/10/13 10:45,新北市警土城分局員警國慶日逮捕洪姓通緝犯到案（見圖），未料洪嫌在拘留室內自殘送醫，送醫救治無大礙後，警方押解歸案，北院裁定羈押。（記者吳仁捷翻攝）新北市土城分局於國慶日逮獲過失致死、妨害公務的洪姓通緝犯，因嫌犯拒絕夜間偵訊，帶入拘留室留置，未料洪嫌趁看顧員警不察，拆下天花板輕鋼架鐵片，刺頸、手自殘，警方發現衝入救人，送醫縫合並無大礙，土城警分局昨將嫌犯押解歸案，台北地方法院裁定收押。據了解，土城警分局員警於國慶日深夜巡邏，當街查獲49歲洪姓通緝犯，因時間已晚，洪嫌也拒絕夜間訊問，先將他帶進拘留所留置；大約11日上午6時許，洪嫌趁看顧員警不察，攀爬接近天花板，拆下輕鋼架鐵片，朝頸部、手臂自殘，員警見洪嫌流血，衝入制止送醫，所幸並無大礙；土城警方待洪嫌縫合、傷勢穩定，偵訊後押解台北地院歸案，法院以他犯後態度不佳、消極，裁定收押。請繼續往下閱讀...據了解，洪嫌是職業駕駛，2024年初在安坑交流道附近與轎車車禍，造成對方一人身亡，涉及過失致死移送被羈押，起訴後移審台北地院，洪嫌10萬元交保後，審理期間沒出庭，北院於去年底發布通緝。洪嫌國慶日傍晚與前妻外出用餐，清水所巡佐、員警途經，發現洪嫌神情可疑，員警盤查時洪嫌拒捕，還攻擊員警，當場被制伏送辦。熱門賽事、球星動態不漏接    ,https://news.ltn.com.tw/news/society/breakingnews/5209205
台南深夜機車冒大火 酒測達0.93女騎士受傷送醫也送法辦,社會,2025/10/13 10:27,項姓女子所騎的機車倒地後起火燃燒。（民眾提供）台南市安南區海佃路二段一帶，於13日凌晨零時許驚傳有火燒機車狀況，消防局119獲報後派出安南分隊人車前往灌救，火勢很快撲滅；但騎機車的項姓女子肢體多處擦挫傷，幸意識清楚送醫，警方為她酒測發現酒測值高達0.93，依刑法公共危險罪嫌送辦、同時重申喝酒後勿駕車，以免害人害己！這件機車起火案發生在台南安南區海佃路二段362號附近，據了解，27歲的項姓女子騎機車從海佃路二段往南方向（往台南市區方向）行駛，至案發地時突然失控、摔車，項女人車倒地，機車還一路刮行路面約達30公尺後才停下，可能是機車與地面摩擦生熱後起火燃燒。請繼續往下閱讀...消防局安南分隊救災人車獲報趕到現場，看到機車已全面燃燒，即出水灌救，火勢在數分鐘內就被撲滅。而騎機車的項女全身肢體有多處擦挫傷，但沒有被機車大火燒灼的傷勢，她意識清楚，由消防局安南分隊救護車將她送到永康奇美醫院治療。警方依規定對項女做酒測，赫然發現她酒測值竟然高達0.93，依法送辦。警、消人員認為，項女酒測值高達0.93，當時精神狀況應處於爛醉狀態，在如此醉的情形騎機車上路，就有失控摔車發生車禍肇事的高風險，再次呼籲民眾喝酒後切勿駕車、或是喝酒後可搭計程車等大眾交通工具或找代駕代為開車，以策安全。消防人員出水撲滅機車火勢。（民眾提供）起火全面燃燒的機車燒成一堆廢鐵。（民眾提供）騎機車的項姓女子人車倒地後，機車在路面留下長長的刮地痕。（民眾提供）熱門賽事、球星動態不漏接    ,https://news.ltn.com.tw/news/society/breakingnews/5209188
高雄外送員遭小黃撞傷 雙方未酒駕警初判駕駛違規,社會,2025/10/13 10:24,高雄外送員遭小黃撞傷，雙方未酒駕警初判駕駛違規。（民眾提供）網傳高雄外送機車遭計程車擊落，網友紛留言外送人員的辛勞，苓雅分局今表示該車禍雙方均未酒駕，初判疑為計程車轉彎未禮讓直行車輛，實際肇因需待進一步調查、釐清。網傳高雄小黃於四維三路路口未減速轉彎，直接擊落外送機車，人車倒地送醫，被撞的機車當事人上網留言，指控當時他的車速時速大約時速50公里，好奇小黃有職業駕駛，轉彎不停還繼續往前開，還有一對情侶好心問他要不要行車紀錄器。請繼續往下閱讀...苓雅分局今（13）日表示，車禍發生於上月下旬，警方接獲通報車禍，需要警方協助，警方派員到場，經瞭解係許姓男子（69歲）駕駛計程車沿四維三路由西向東行駛；林姓男子（28歲）騎機車沿四維三路由東向西行駛。雙方於四維三路與中山二路口發生碰撞事故，許男往北左轉中山二路，雙方碰撞致肇事，許男未受傷，林男身體擦挫傷，送醫治療，意識清楚無大礙，無人酒駕。警方到場訪查周遭，並調閱監視器佐證，初步分析事故原因為許男轉彎未讓直行車先行，詳細肇事責任待送交通大隊分析研判，本案許男行為違反道路交通管理處罰條例第48條第1項第6款，可處600元以上1800元以下罰鍰。苓雅分局呼籲，用路人無論駕駛汽、機車或步行，皆須遵守道路交通規則，本分局將持續宣導用路人遵守交通規則，並加強違規取締告發，以維護市民交通安全。高雄外送員遭小黃撞傷，經查雙方未酒駕，警初判駕駛違規。（民眾提供）熱門賽事、球星動態不漏接    ,https://news.ltn.com.tw/news/society/breakingnews/5209183
臉書、LINE貸款廣告有詐 嘉縣警教防詐3招,社會,2025/10/13 10:21,嘉義縣警方近日發現詐騙集團假以放貸廣告，詐騙被害民眾錢財。（圖由警方提供）嘉義縣警察局水上分局近來發現，有詐騙集團假冒銀行、貸款公司、金融機構，透過臉書、LINE或Google廣告方式，刊登寫有「低利息、免保人、快速放款」等字眼廣告，要求欲借貸民眾提供個資、金融帳戶或保證金，讓民眾貸款貸不到錢，錢財還被騙走，警方提醒貸款請透過合法銀行或金融公司管道、勿聽信「免保證人」廣告、勿提供金融卡及密碼等3招防詐。警方表示，近來有詐騙集團假冒銀行、金融公司以「協助核貸」、「加速撥款」名義，誘騙民眾提供金融帳戶、提款卡或匯款保證金，還會以貸款需繳保證金或先提供設定費、手續費等理由，要求民眾轉帳，導致民眾的錢被騙走。請繼續往下閱讀...警方說，詐騙集團透過社群網站、臉書、LINE或Google搜尋廣告，以「低利息、免保人、快速放款」等字眼吸引民眾，取得聯繫後再要求提供個資、金融帳戶或臨櫃操作轉帳。部分詐騙甚至會假冒銀行客服，聲稱「貸款核准需驗證帳戶」或「必須先繳清前筆貸款才能撥款」。警方提醒，申辦貸款請透過合法銀行或金融公司管道、不聽信「快速放款」、「免保證人」廣告，以及切勿提供金融帳戶或密碼給他人。正派銀行辦理貸款，絕不會要求民眾先繳保證金或提供提款卡密碼，若對貸款訊息或電話有任何懷疑，可打165反詐騙諮詢專線查證。警方提醒，網路部分貸款廣告恐為詐騙集團詐騙手法，3招防詐守住錢財。（圖由警方提供）熱門賽事、球星動態不漏接    ,https://news.ltn.com.tw/news/society/breakingnews/5209166
女博士欠稅！百萬健保費拖5年 士林分署靠1招全額扣起,社會,2025/10/13 10:21,士林分署單次扣押銀行存款，全額徵起黃姓女博士101萬滯欠稅健保費，示意圖。（記者劉詠韻翻攝）台北市黃姓女博士未依法申報2020年營利所得，遭台北國稅局補徵稅額及裁處罰鍰，合計金額高達94萬餘元；此外，她還積欠多期健保費，總滯欠金額達101萬餘元。法務部行政執行署士林分署受理後，迅速調查其財產並依法扣押銀行存款，全額徵起欠款。黃女因未依法申報2020年營利所得422萬餘元，經台北國稅局補徵稅額67萬餘元，並裁處罰鍰27萬餘元，甚至積欠多期健保費，金額多達101萬元。今年4月至8月間，台北國稅局及衛福部健保署於將案件移送士林分署執行。請繼續往下閱讀...士林分署受理後展開財產調查，發現黃女在金融機構仍有存款可供執行，並依法核發執行命令，扣押其銀行存款債權，最終成功扣足101萬餘元。近日，分署核發收取命令，由金融機構將該筆款項交付移送機關，全額徵起黃女所積欠之稅款、罰鍰及健保費。士林分署提醒，民眾應如實申報所得並依法繳納稅款及健保費，履行國民應盡義務，以免遭補課稅捐、裁處罰鍰及面臨強制執行等不利後果。熱門賽事、球星動態不漏接    ,https://news.ltn.com.tw/news/society/breakingnews/5209184
赴柬埔寨月領8萬變惡夢 女被電擊、軟禁還要還機票錢,社會,2025/10/13 10:15,黃男以高薪誘惑民眾至柬埔寨從事詐騙工作，若不從就持以電擊棒威脅，彰化地方法院審理後依《圖利以詐術使人出國罪》，判黃男3年6月徒刑。（資料照）以為是海外高薪工作的機會，卻是1場噩夢的開始！彰化黃姓男子加入柬埔寨詐騙集團，擔任「人事幹部」，他以月薪7至8萬元等條件，誘騙1名女子赴柬埔寨工作，未料卻將女子軟禁，並以以電擊棒威脅「招不到人就挨電」，連返台都要先償還機票與住宿費。彰化地方法院審理後依《圖利以詐術使人出國罪》，判黃男3年6月徒刑。判決書指出，2022年間，黃男透過通訊軟體聯繫住在彰化的被害女子，聲稱前往柬埔寨擔任「人事工作」即可輕鬆賺取高薪。女子心動答應，出國前曾特別詢問「會不會被限制自由？」黃男等人信誓旦旦保證不會。然而，女子一到柬埔寨的波哥山、中國城等地，立即被沒收證件、限制行動，被迫從事招募「人頭」的工作。請繼續往下閱讀...女子因招不到人想離開，但詐騙集團竟要求她賠償巨額的機票與食宿費用才能脫身，黃男甚至拿著電擊棒，在眾人面前威脅：「業績未達標就會電你們」、「如果不乖，就把你們賣給其他人。」讓被害人身心飽受折磨。後來男子被補但否認犯行，辯稱是詐騙集團冒用手機與女子聯繫，自己同樣是受害者，也曾在柬埔寨遭監控、毆打。但法官不採信，認為女子指證歷歷，並清楚描述黃男持電擊棒恐嚇過她。法官審理後認為，黃男犯後雖矢口否認，但考量他在得知被害人求助訊息後曾協助報警，尚知悔悟，因此依「共同犯圖利以詐術使人出國罪」，判處其3年6個月有期徒刑。熱門賽事、球星動態不漏接    ,https://news.ltn.com.tw/news/society/breakingnews/5209163
小琉球潛水客疑傳漂流 畫面曝光了,社會,2025/10/13 10:13,小琉球花瓶岩海域。（記者陳彥廷攝）屏東小琉球昨天發生一起疑似潛水烏龍事件，1團11人的水肺潛水客從肚仔坪海域下海後，一路往東北游向花瓶岩附近海域，由於當時週遭並無潛水船，民眾誤會以為漂流進行通報，海巡署南部分署派員前往，這才發現集合地點就在花瓶岩外海，過程中的畫面如今也曝光。東北季風有逐漸增強趨勢，昨天這群潛客的浮力袋位置被民眾目擊從肚仔坪一路前進，但到了港邊已上浮，還有潛客在揮手，也被通報是疑似漂流，不過海巡署人員獲報後即前往查證，確認為遊客於該海域從事潛水活動，無遭海流往外海帶之情事。請繼續往下閱讀...不過，由於太接近航道，且潛客還在海面揮手，讓當時往來行經的交通船船長非常緊張，紛紛修正內縮，就有船員事後回想，指以往不曾看過這麼接近的潛水點，加上旁邊明顯沒有潛水業者的船隻，納悶到底是否為漂流情事。海巡署南部分署第五岸巡隊則強調，接獲通報後前往現場與業者確認，由於一般潛水業者的船在潛客下水後，會視浮力袋地點前往帶回潛客，故畫面當下可能尚未拍攝到業者船在旁，而當時行程的最後上船點就在花瓶岩外海。由於實在太接近航道，是否闖入航道及是否涉及《水域遊憩活動管理辦法》相關部分，主管機關大鵬灣國家風景區管理處將要著手釐清。（16:41）熱門賽事、球星動態不漏接    ,https://news.ltn.com.tw/news/society/breakingnews/5209174
所長巡邏眼尖發現可疑「理財專員」攔下盤查逮到車手查扣150萬元,社會,2025/10/13 10:11,警方在蔡嫌身上搜出150萬元。（記者王冠仁翻攝）北市警士林分局士林分局蘭雅派出所長朱宥任與警員吳亭毅執行巡邏勤務時，在台北市德行東路上發現有一名男子的外貌特徵，跟近期被警方掌握的面交車手高度吻合。警方上前盤查，這名蔡姓男子左顧右盼、避重就輕，警方最後在他隨身背包中查扣150萬元，他這才承認自己擔任某投資公司的「取款專員」，還辯稱自己不知道這是詐騙，不過警方仍當場將他逮捕。士林分局蘭雅派出所長朱宥任與警員吳亭毅日前執行巡邏勤務，行經台北市德行東路時，朱眼尖發現路上有一名男子，戴藍牙耳機、身背後背包並手提公事包，特徵與近期常見的面交車手高度吻合。朱、吳兩人尾隨觀察其左顧右盼顯有異常，遂上前盤查。請繼續往下閱讀...蔡面對警方盤問，起先謊稱自己在宜蘭從事養殖業，來台北市要見客戶；警方進一步追問客戶細節，他卻答不出來。警方事後要求檢視她隨身攜帶的公事包，赫然發現內部裝著多捆現金，總金額達150萬元；這時蔡才說自己是擔任某公司的「取款專員」，但辯稱不知道自己從事詐騙工作。警方最後在蔡身上查扣150萬餘元、手機1支、工作證1張，並將蔡依涉嫌詐欺罪、洗錢防制法移送法辦，同時持續向上追查幕後詐騙集團。士林分局表示，詐騙集團常利用各種手段吸收工作不順或待業男子擔任取款車手。警方呼籲，民眾切勿貪圖立即現金收入而誤觸法網，本分局將持續加強查緝，全力打擊詐欺犯罪，守護民眾財產安全。警方查扣蔡嫌用來行騙取款的工作證。（記者王冠仁翻攝）熱門賽事、球星動態不漏接    ,https://news.ltn.com.tw/news/society/breakingnews/5209175
