Title,News_Type,date,content,url
錢麗離台前囂張嗆聲！梁文傑冷回「這句」網讚爆,政治,2025/12/06 18:02,陸委會副主委梁文傑。（資料照）任職於華碩的中國配偶錢麗經營臉書粉絲專頁「中國人民解放軍」，宣揚武統，被內政部等機關註銷台灣身分與戶籍。錢麗近日不斷透過臉書發言，對台灣政府囂張放話、嗆聲，對此，陸委會副主委梁文傑冷冷地提醒錢麗，她的任何言論，都將成為未來再申請來台時的判斷標準。梁文傑今（6日）上午出席永和地方刊物創刊發表會，受訪時被問及錢麗近日發言。梁文傑表示，他們是按照兩岸條例做出相關處置，「那她自己要怎麼說，我們沒有什麼特別意見」。不過梁文傑也提醒：「但是她現在所說的任何話、所發表的任何言論，都會成為她未來如果想要再申請來台灣的一個判斷的基準。」請繼續往下閱讀...梁文傑也說明，有給錢麗停留的機會，但她自己選擇要先回去，至於未來會不會申請回台，那是看她自己的決定。錢麗今天發表聲明稱已經順利返回中國，規劃先休息一段時間。她表示，瞭解到台灣社會已處於不健康的治理氛圍，社會大眾需要時間來冷靜，待大家能理性傾聽再回台。她還嗆聲：「台灣社會已被民進黨台獨政權，營造的仇恨、對立、反中抗中社會氛圍包裹，社會大眾已無冷靜、理性、客觀溝通的可能。」日前她更表示自己遭迫害，高喊：「請給中共在台執政機會。」有粉專轉貼今日梁文傑受訪內容片段，網友紛紛表示：「說得好」、「史上最有感陸委會」、「請直接列進永遠不許入境台灣的名單」、「支持梁文傑」。     在 Threads 查看熱門賽事、球星動態不漏接    ,https://news.ltn.com.tw/news/politics/breakingnews/5269860
林俊憲「愛憲姊妹會」後援會成立 1500人擠爆現場,政治,2025/12/06 17:41,民進黨立委林俊憲「愛憲姊妹會」熱鬧成立，現場擠爆。（記者吳俊鋒攝）民進黨立委林俊憲力拚台南市長初選，今天成立姊妹後援會，湧入逾1500人，現場爆滿。林俊憲重申，他推出的社福政策照顧老少，也扶持年輕族群，共享國內經濟發展的成果，大家攜手打拚美好願景。「愛憲姊妹會」成立大會今天下午在永康桂田酒店登場，支持者擠爆現場，座無虛席，搖旗吶喊，情緒沸騰。請繼續往下閱讀...愛憲姊妹會由議長邱莉莉擔任會長，前議長賴美惠則為榮譽會長，立委郭國文、林宜瑾、賴惠員等人都到場，市長夫人劉育菁也上台助講。近20名議員共襄盛舉，男民代甚至帶著另一伴專程出席，展現力挺決心。林俊憲大進場時，支持者熱情相迎，歡聲雷動，氣氛來到最高潮。林俊憲說明照顧長輩、小孩，以及支持年人的相關政見，在高齡者方面，包含免健保費、加碼敬老禮金、擴增共餐據點，還有帶狀皰疹疫苗的注射等。林俊憲也提出加碼生育獎勵金，以及孕婦看診交通補助等政策，並注射RSV疫苗，垂直保護嬰孩。另外，還有孩子的保母費、私托費的加碼補助，國中、小的學費、餐費也減免，且吃得更好，每週「2果2乳」。林俊憲也說，全力支持鐵路立體化延伸至溪北，台南的交通建設他已全盤規劃，有信心可以向總統賴清德爭取到最大的資源，創造城市美好未來。林俊憲進場時受到支持者熱情歡迎。（記者吳俊鋒攝）力拚台南市長初選的民進黨立委林俊憲成立姊妹後援會，場面熱烈。（記者吳俊鋒攝）力拚台南市長初選的民進黨立委林俊憲成立姊妹後援會，支持者熱情相迎。（記者吳俊鋒攝）力拚台南市長初選的民進黨立委林俊憲成立姊妹後援會，現場大爆滿。（記者吳俊鋒攝）熱門賽事、球星動態不漏接    ,https://news.ltn.com.tw/news/politics/breakingnews/5269972
上次輸王惠美近10萬票！黃秀芳爭取再戰彰化縣長 初選鎖定鹿港拚掃街,政治,2025/12/06 17:24,福興鄉長蔣煙燈（右一）、彰縣議員楊妙月（左二起）、立委陳秀寳等人，今陪同黃秀芳（右二）前進鹿港掃街拜票。（黃秀芳競辦提供）再過一個多星期，民進黨彰化縣長提名人選類初選民調作業就要登場，各參選人倒數衝刺，立委黃秀芳今（6日）天在同屬「正國會」系統立委陳秀寳，以及福興鄉長蔣煙燈、鹿港區縣議員楊妙月、鹿港鎮代表張雅晴等人陪同下，前進鹿港區最熱鬧的傳統市場、第一市場掃街拜票，藉此爭取提名出線。2022年，選前3個多月，黃秀芳獲民進黨徵召參選，挑戰爭取連任的國民黨縣長王惠美，因時間倉促，全縣知名度短時間拉不起來下，挑戰失敗，輸了近10萬票，開票當晚她流淚接受敗選事實，並表明敗選主因在於自己準備時間不足和努力不夠，未來會繼續努力。這次，她提早準備，積極爭取提名。請繼續往下閱讀...黃秀芳上次在鹿港區（鹿港鎮、福興鄉、秀水鄉）得票率都不到4成，僅拿下綠營基本盤，3鄉鎮全輸給超過6成得票率的王惠美，這次，她請該區立委陳秀寳擔任類初選競選總幹事，一路陪著她搶攻該區知名度，提高鄉親認同度。陳秀寳說，掃街過程民眾反應非常熱情，有民眾送上肉粽，也有民眾特地過來找黃秀芳握手，可以深刻感受黃秀芳的好感度與知名度，她認為黃秀芳是有藍圖的角逐者，可以推動縣政聚焦發展，「秀芳有藍圖、秀寳挺秀芳」，呼籲支持者相挺。縣議員楊妙月說，黃秀芳有豐富的服務經驗，呼籲本月15至18日晚上是民進黨縣長初選電話民調，希望鄉親幫忙顧電話。福興鄉長蔣煙燈說，今天嗓子有點啞，但還是拿麥克風為黃秀芳宣傳，因為黃秀芳很認真打拚，若能代表民進黨參選縣長，這是彰化未來的希望，呼籲鄉親全力支持，電話民調唯一支持黃秀芳。熱門賽事、球星動態不漏接    ,https://news.ltn.com.tw/news/politics/breakingnews/5269933
PTT板主對賴瑞隆兒發表「涉違法言論」 情節嚴重被立刻解職,政治,2025/12/06 17:16,PTT政黑板板主遭解職。（取自PTT）民進黨立委賴瑞隆就讀國小的兒子被爆在校涉霸凌同學，賴瑞隆為此出面道歉，並表示會自我檢討、加強教育。相關議題持續延燒，PTT「政黑板」板標今日驚見「賴瑞隆之子應就地正法」標語，疑似板主為「反串」而更改。PTT站方指出，板標內容恐觸犯中華民國法律，並嚴重違反PTT相關規定，行為情節極為重大惡劣，已經立刻移除；稍後也發布公告，表示發布該板標得政黑板板主即刻解除職務。PTT一名小組長今日在政黑板發布公告，表示小組內某看板的板標出現嚴重失當內容。此板標內容恐觸犯中華民國法律，並嚴重違反PTT相關規定，行為情節極為重大惡劣，已移除該板標，同時，嚴正譴責任何形式的暴力、恐嚇或煽動違法行為的言論。「該板標所表達的任何立場，不代表本小組、本群組或本站之立場。」請繼續往下閱讀...該小組長隨後立刻發布判決指出，發布該板標之政黑板板主即刻解職，解職事由為該板主行為嚴重違反PTT站規第五條：法律優位原則，以及板主權力義務規範。判決指出，板主之失當行為已造成本組與本站之名譽嚴重受損，情節重大惡劣。另外，該板主也被註記永久不得再擔任任何看板之板主。板主發表涉違法板標。（取自PTT）熱門賽事、球星動態不漏接    ,https://news.ltn.com.tw/news/politics/breakingnews/5269907
中配錢麗嗆「台灣社會不健康」周玉蔻：收容妳這種中配真的不健康,政治,2025/12/06 16:52,中配錢麗經營解放軍粉專「宣揚武統」，被廢止依親居留。（圖擷自錢麗臉書）中配錢麗今發表聲稱已順利返回中國，她表示，「瞭解到台灣社會已處於不健康的治理氛圍，社會大眾需要時間來冷靜，待大家能理性傾聽再回台」。對此，資深媒體人周玉蔻譏諷道「『台灣社會不健康？』對！收容了錢麗這種中配真的不健康！」周玉蔻今於臉書發文提及，中配被取消居留證後，偷偷溜回中國四川後，居然發文嗆「台灣社會不健康」！請繼續往下閱讀...周玉蔻怒嗆，「對喔，台灣社會收容錢麗，給了錢麗家庭、工作、身分，竟然還被錢麗翻雲覆雨攪和、破壞內部和諧了那麼多年，真的實在很不健康！」，接著大讚「錢麗依法離境了，台灣真是健康！」網友看到留言後相繼留言，有人說「忘恩負義的中國人錢麗！鼓吹武統台灣，應羈押審判！」、「永不得進入台灣！台灣不需要垃圾！」、「幹的好，嚇到很多中配，吃台灣米，喝台灣水，別養出像館長那種白眼狼」。據了解，任職於華碩的中國配偶錢麗因經營臉書粉絲專頁「中國人民解放軍」，宣揚武統，內政部等機關日前審議後，認定其行為「有危害台灣國家安全與社會安定之虞」，註銷其台灣身分與戶籍；華碩日前依規處理，錢麗於2日辦理完成離職程序，並已在3日晚上7時許搭機返回中國。熱門賽事、球星動態不漏接    ,https://news.ltn.com.tw/news/politics/breakingnews/5269811
曝親身經歷！「重度使用者」廣告小妹揭小紅書「特有詐騙手段」,政治,2025/12/06 16:39,在台灣擁有超過300萬用戶的中國APP「小紅書」因未落地，無法可管，被政府封鎖一年。（彭博）在台灣擁有超過300萬用戶的中國APP「小紅書」因未落地，無法可管，被政府封鎖一年，引發許多台灣使用者不滿。自稱是「重度使用者」的網紅「廣告小妹」表示，雖叫做小紅書，但其實它是中國「最不紅色」的平台。不過，查了下被封的原因，她表示可以理解，她還透露，小紅書上的詐騙集團是她交手過比較有手段的一群，「他們不亂槍打鳥，他們是從別版留言區撈人」。廣告小妹今日在臉書發文表示，她本來十分困惑為何要禁止小紅書，但看了原因後能理解，「沒有在台設立負責方，也就無法配合刑事調查。漏洞一天不補，遲早憋一票大的。」她表示：「別的不說，小紅書上的詐騙集團是我交手過比較有手段的。他們不亂槍打鳥，他們是從別版留言區撈人，目標精準。」請繼續往下閱讀...廣告小妹分享，前陣子她在找美國的房子時，給紐約房仲帳號留言，結果被詐騙集團盯上，先是假裝好心不收仲介費幫她找房子，接著套近乎地說他們離她住得很近。下一步使出老招數：我們加個微信比較方便聊。「我又不是年輕白兔，順手給幾個假資料就套出他們壓根對紐約不熟悉，我反手一個舉報加封鎖」。但她也表示：「但不得不承認，要不是我在紐約住了二十幾年，是有可能被騙的。他們的確很勤奮。」她也說：「又聰明又勤奮還能隱身的詐騙，想想都恐怖。」對於外界質疑政府因反中而禁止小紅書，她指出，如果是出於反中，那就沒理由禁小紅書了。有腦的人都知道小紅書已經是最不紅色的平台了，儘管它叫小紅書。廣告小妹表示，小紅書上可以看見中國底層人民無法翻身的淒涼、年輕遊子出國見過世界後對母國的反抗關於熱門政治事件，可以看到來自世界各角落的IP，集結在一起做無聲抗辯。「封了號、限了流，明日捲土重來。」在小紅書上，政治很重要，但是比政治更重要的是真相。她也表示，「我沒看過比小紅書有更多維權者的祖國平台。」她認為，比起親中網紅，小紅書更能看見中國的全貌。熱門賽事、球星動態不漏接    ,https://news.ltn.com.tw/news/politics/breakingnews/5269707
獨家》工作尊嚴蕩然無存！傅崐萁稱助理費除罪化是「進步法案」 藍委助理圈氣炸,政治,2025/12/06 16:36,藍委助理在工作群內對國民黨團總召傅崐萁說法發飆。（讀者提供）立院助理費除罪化修法爭議持續延燒，國民黨團總召傅崐萁昨天公開表示此修法是「進步法案」、「我們是在保護這些助理」，引發藍營助理不滿。國民黨團助理昨天在助理工作群組張貼「1205傅崐萁回覆媒體提問助理費修法媒體相關報導」，有藍委助理今天在底下酸回：「進步法案哈哈哈！」工作尊嚴蕩然無存。國民黨立委陳玉珍提出「立法院組織法修正草案」，新增「補助費用」由立法院撥予立委統籌運用，免檢據核銷；且立委統籌運用項目不限於助理費、助理實施健康檢查費用、助理文康活動費用等。立法說明並指出，立委就所有權歸屬於其之補助費，如何運用及運用妥當與否，僅對選民負政治責任，「非屬貪污治罪條例及刑法之規範範圍」。請繼續往下閱讀...該助理表示，「忍兩天的，實在凍抹條」，表示自己第二屆就進立法院，每月薪水一毛不減準時進戶頭、年終沒少過，很幸運自己被每一位老闆善待，現在年紀大也快退休了，「本人吃自己也無所謂，但是年輕的助理們，你們有像我這麼幸運都遇到好老闆嗎？」如果大家還對這份工作有熱情，可以忍受助理制度如此被糟蹋嗎？走出立院還抬得起頭嗎？工作尊嚴蕩然無存。熱門賽事、球星動態不漏接    ,https://news.ltn.com.tw/news/politics/breakingnews/5269869
出席「桃園HO幸福」親子派對 何志偉：多聽民眾想法來形成好政策,政治,2025/12/06 16:35,總統府副秘書長何志偉（左）出席「桃園HO幸福」親子派對。（記者周敏鴻攝）總統府副秘書長何志偉今天下午到桃園市中壢區興仁公園出席「桃園HO幸福」親子派對，陪民眾一起欣賞YOYO家族唱跳表演與舞台劇，何志偉說，他很喜歡與民眾一起曬太陽、踩草皮，相信多傾聽、多交換意見，就能凝聚民眾想法並形成更好的政策。何志偉說，TPASS造福許多民眾，是好政策，其實就是他7、8年前與民眾聊天的內容，他希望多舉辦、多參加一些親子派對等活動，讓他與民眾多聊天後能提出更多好政策。請繼續往下閱讀...外界猜測民進黨桃園市長候選人明年1、2月間可以確認人選，何志偉說，他並不清楚相關期程，將堅持一步一腳印，傾聽民眾的聲音、幫民眾解決問題，做好自己的工作，讓民眾感受政府的用心。總統府副秘書長何志偉（中）在「桃園HO幸福」親子派對與民眾開心互動。（記者周敏鴻攝）熱門賽事、球星動態不漏接    ,https://news.ltn.com.tw/news/politics/breakingnews/5269849
賴總統：「中華民國」寫在憲法裡 民進黨未改國號有助團結社會,政治,2025/12/06 16:25,總統賴清德出席「《自由中國》的遺產與當代民主的試煉」論壇開幕典禮。（方賓照攝）總統賴清德今天出席「《自由中國》的遺產與當代民主的試煉」論壇致詞時表示，民進黨創立後，傅正跟民主前輩已完成組黨，完成雷震的遺願，雷震希望國號改成「中華台灣民主國」，民進黨沒有這樣做，因為「中華民國」這個名字寫在憲法裡，有助於團結台灣社會，而且特別指出，台灣已經是個主權獨立國家，沒有另行再宣布台灣獨立的必要。賴總統表示，雷震、殷海光跟傅正3位先生都出生長大於中國，都因為愛國，先後加入國民黨抗日，也從事反共的工作，後來他們相逢、相識、相知在台灣，也在台灣為了理想而奮鬥。3個人當中，雷震先生年紀最長，1879年出生，他比殷海光先生長22歲，比傅正先生長30歲。請繼續往下閱讀...他指出，雷震的一生志業就是成立《自由中國》雜誌，在台灣推廣民主、自由、法治的工作，同時也接觸民主反共的大旗，甚至於在《自由中國》發行的時候，他也進行系列的社論，以「今日的問題為名」的系列性社論，第1篇就是由殷海光先生所書寫，題目就是「對反攻大陸的質疑」。賴總統說，雷震先生也跟台灣民主運動非常知名的人士認識，像宜蘭的郭雨新、台北的高玉樹、雲林的李萬居，共同連署要求蔣介石不應該連任。後來發現他所投入的國民黨來到台灣之後，貪污不改、吏治敗壞，當時認為如果台灣或者是中華民國要能夠繼續得到人民的支持，最重要的無非是要成立一個反對黨。他說，雷震先生把成立反對黨當作救國圖存最重要的一件事情，也因此獲罪入獄；包括傅正也一樣。殷海光跟傅正通通都是《自由中國》常投稿的人，因為殷海光的文章質疑反攻大陸的正當性跟必要性，讓雷震、殷海光、傅正等人從此不見容於執政當局；再加上雷震認為當時救亡圖存之道，就是要組黨、組反對黨進行監督，更是不見容於當時的執政當局。賴總統表示，不管雷震或傅正都先後入獄，殷海光即便沒有入獄，但也遭受到當時政府剝奪生存的機會，包括終止他的研究基金、辭退他在學校的任職，也阻卻他謀生的途徑。但這三個人不管是入獄或被剝奪生存機會仍然不改其志。賴總統說，特別是雷震先生出獄之後，除了持續嚮往成立反對黨以外，他甚至寫了「救亡圖存獻議」，獻給當時的政府，就是蔣介石政府。其中最重要的一篇，就是要改國號，要把中華民國改為「中華台灣民主國」。這當然是當時的政府不會接受的，所以雷震先生可以說是壯志未酬。他指出，但傅正先生很有意思，與當時台灣社會有志之士共同組黨。在1986年9月28號，在圓山大飯店，當時組黨的會議主席不是別人，就是游錫堃院長。當時在傅正先生的串聯之下，總共有十人組黨小組，在1986年9月28號仍然在戒嚴的時代成立了民主進步黨。也就是說，雷震先生的遺願由傅正先生跟台灣的後起之秀、勇敢的民主運動人士共同完成。賴總統表示，民進黨創立之後，特別是在1999年針對國家主權通過一個決議文，就是知名的《台灣前途決議文》，決議文內容是指：台灣已經是一個主權獨立的國家，根據憲法名字叫中華民國；主權與中華人民共和國互不隸屬；前途必須由2300萬人民決定。賴總統指出，傅正先生跟台灣民主運動前輩的努力，組黨已經完成雷震先生的遺願。但雷震先生希望改國號，改成「中華台灣民主國」，民進黨沒有這樣做。民進黨認為，保留這個名字，有助於團結台灣社會，而且特別指出，台灣已經是一個主權獨立的國家，所以沒有另行宣布台灣獨立的必要，這也是為了要團結台灣社會。他說，自己的理念是跟雷震先生是一致的，不管台灣的名稱是中華民國，或者是國際社會目前叫我們為台灣。賴總統也提到，去年他當選（總統）的時候，美國國務卿布林肯稱呼他為「台灣第五任民選總統」，他以台灣稱呼我們。國際社會、媒體在報導時提到我們都是指台灣；我們的邦交國或我們自己、國際友人，有時也會稱呼我們為中華民國台灣。但不管稱呼中華民國、中華民國台灣或台灣，都是指台澎金馬2300萬人民。熱門賽事、球星動態不漏接    ,https://news.ltn.com.tw/news/politics/breakingnews/5269795
藍白否決財劃法覆議案 林智群嘆「防護罩被內外夾攻」,政治,2025/12/06 16:23,台灣國旗。（法新社資料照）立法院昨否決行政院提出的財劃法覆議案。對此，律師林智群有感而發嘆說，台灣現在的日常生活，包含民主自由法治、看演唱會等是被保護的，但「現在一堆藍白委員從內部破壞、弱化我們的防護罩，中國從外部文攻武嚇、網軍造謠生事，從外面破壞這個防護罩」。林智群今於社群平台發文提及，台灣現在的日常生活，包含民主自由法治、看演唱會、萬聖節活動是被保護的。被美國保護，若沒有第七艦隊、沒有美援、沒有美國軍售，台灣能撐到現在？被台灣海峽保護（共軍難登陸）。這些保護，就跟防護罩一樣，讓我們的民主自由可以維持現狀。請繼續往下閱讀...林智群坦言，「然後現在一堆藍白委員從內部破壞、弱化我們的防護罩，中國從外部文攻武嚇、網軍造謠生事，從外面破壞這個防護罩。」有些人注意到了，一直看著天空，說：「你看，我們的防護罩出現裂縫了！」，有另一些人連抬頭都不願意，說我只想好好過我的日子，幹嘛一天到晚談政治，好煩喔！覺得你們這些人整天在大驚小怪，防護罩裂掉又怎麼樣，我們的生活還是可以照舊，還懷疑保護者美國是不是想佔我們便宜。林智群痛斥，「這些人就是不見棺材不掉淚，那些想破壞防護罩的藍白委員，哪個不是留了後路（拿綠卡、小孩都美國籍），防護罩破掉後，人家可以跑走（去他們鼓吹對台灣有野心的美國），你可以跑去哪裡？被賣掉的豬仔還幫人家數鈔票，根本是愚蠢之至！」     在 Threads 查看立法院否決覆議案》財劃法1年3修 挖走國庫6811億元熱門賽事、球星動態不漏接    ,https://news.ltn.com.tw/news/politics/breakingnews/5269747
幽靈連署訴訟迄今耗資近4千萬  國民黨立場秉持不碰觸也不知前手操作,政治,2025/12/06 16:22,國民黨中央黨部。（資料照）因為今年兩波立委大罷免活動，國民黨中央黨部以及各地方黨部黨工、志工涉入偽造連署案，目前都已陸續進入地方法院一審程序，為了支應先前交保、裁罰以及律師費用，國民黨迄今已經耗資近4000萬元特別預算，粗估未來至少還需要1000多萬元。由於這些司法案件都是在前任黨主席朱立倫任內爆發，現任黨中央接手後除了持續提供涉案黨工與志工的法律援助，基於避免被司法單位懷疑涉入串連做偽證，國民黨中央法律服務中心提供法扶時所採取的原則，就是僅做法律諮詢及推薦律師，完全不介入前任黨中央與涉案黨工、志工之間的訊息聯絡，而且有關前任中央黨部團隊的操作狀況，現任黨主席鄭麗文的黨務團隊秉持既不碰觸也不知情的立場，只扮演第三方的協助角色。請繼續往下閱讀...黨內知情人士透露，當初辦理黨務交接時，現任黨務幹部也確實沒有接收前任黨中央的相關文書紀錄，只有關於被偵辦、起訴黨工、志工人員統計清冊、律師團名單以及訴訟費用等相關請款單據。黨內人士指出，因偽造連署案被司法調查的黨工、志工人數有近300人，被起訴者有100多人，先前交保、裁定罰款以及訴訟相關費用，幾乎都是中央黨部付的錢，只有極少部分志工、黨工自己付，這些人認為國民黨已經很窮，額度不高的交保金或裁罰金就自行付了，至於律師費用只有台南市志工自己出，其他各地律師費全都是由中央黨部給付。據透露，為了支付訴訟律師費、交保金與罰款，朱立倫任內提撥的3000萬特別預算早已告罄，那些錢絕大多數都是從黨務經費預算提撥，鄭麗文上任後，中央黨部又再兩度追加提撥500萬與300萬。黨內人士表示，過去朱中央的訴訟策略就是認罪協商，由地方黨部黨工扛下責任，雖然認罪協商的作法下，預期未來進入二審的案件理論上會變少，但目前仍抓不準，目前各地案件都已陸續進入一審開庭，進度最快的就是基隆市，已經一審宣判，但檢察官又上訴二審，因此未來還需繼續提撥特別預算，金額粗估至少還要1000多萬元，未來開銷將由鄭麗文與國民黨秘書長李乾龍負責對外募款，並指定以協助黨工訴訟為用途。熱門賽事、球星動態不漏接    ,https://news.ltn.com.tw/news/politics/breakingnews/5269675
