Title,News_Type,date,content,url
屏東縣民進黨主委同額競選 徐富癸促黨內大團結,政治,2026/05/17 18:56,立委徐富癸（中）將接任屏東縣民進黨部主委，近日展開拜會行程（徐富癸服務處提供）民進黨地方黨部主委、黨代表改選24日登場，屏東縣黨部不但主委由立委徐富癸同額競選，18名全國黨代表也同額，由於這次的主委罕見由立委擔任，因此內部凝聚了團結意識，沒有爭議，將全力為年底大選輔選。民進黨屏東縣黨部主委在縣議員羅平道卸任後，立委徐富癸將擔負起責任接下黨部主委的職務，為同額競選，而18個全國黨代表也在協調之下，同額競選，分別縣議員梁育慈、羅平道、潘芳泉、許展維、方文正、方一祥、黃建溢、九如鄉長藍聰信、東港鎮長黃禎祥、吳志江、鄭鈺宸、許慧玲、李明宗、陳進忠、鍾國雄、李建華、鄭忠豪、張擧文，屏東縣出現罕見無競爭情況，黨內一團和氣。請繼續往下閱讀...徐富癸表明，雖然是同額競選，但他希望自己能扮演更好的串聯角色，讓黨部和地方、公職和黨員、青年和基層之間，有更緊密的合作與溝通，尤其年底五合一選舉將近，屏東隊更需要提早整隊、提早準備，不管是縣長、議員、鄉鎮長、代表、村里長，大家都在各自的位置努力，縣黨部除了做好輔選工作，也要成為大家最穩定的後盾，整合資源、協調步調、凝聚士氣。對於這次的選情，民進黨內也針對部分沒有候選人的地區也進行研議，包括屏東市等地區都將進行徵召參選。民進黨屏東縣黨部改選一團和氣。（記者葉永騫攝）    ,https://news.ltn.com.tw/news/politics/breakingnews/5440187
藍委昔稱無人機「回歸年度預算」今又要砍光！賴瑞隆：重傷高雄產業,政治,2026/05/17 18:37,民進黨高雄市長參選人賴瑞隆。（資料照）立法院日前三讀通過7800億元軍購特別條例，大砍政院版4700億元其中包含無人機產業等多項預算，藍白聲稱可回歸年度預算編列；然而，立法院近期審查今年度中央政府總預算案，國民黨籍國防外交委員會召委馬文君卻提案要砍光5億餘元無人機開發預算。民進黨高雄市長參選人、立委賴瑞隆今直言，國民黨不只是讓國防安全打折，更進一步打擊台灣產業發展與未來。賴瑞隆表示，隨著戰事型態改變，無人機已成為當代不對稱作戰核心，也是保護國軍弟兄姊妹生命安全的關鍵。但藍白日前大砍國防特別條例4700億元，削弱自主供應鏈發展，當時包含柯志恩在內的藍委還聲稱可回歸年度預算；如今，國民黨籍召委馬文君卻又提案刪光無人機相關預算，根本前後矛盾、自我打臉。請繼續往下閱讀...「尤其，高雄作為國防產業重鎮！」賴瑞隆續指，從造船、航太扣件、精密零組件到無人載具生態系，都已投入大量心力，準備迎接升級契機與勞工就業機會；柯志恩等藍委卻持續以「綠友友」等不實言論抹黑、唱衰本土軍工產業，嚴重打擊業者信心。賴瑞隆提及，政府已設定2030年無人機產值達400億元目標，未來除國防用途外，待技術成熟後，更可廣泛應用於農業、工業巡檢、災害監測與智慧城市，並延伸至無人船、無人車等能量，帶動台灣整體科技升級。他痛批，藍白一邊喊支持國防，一邊卻砍掉國軍最需要的無人載具與反制系統研發，不只實質衝擊國防根基，更是在傷害高雄產業轉型、削弱國家韌性及未來競爭力，甚至與全球民主國家強化防衛韌性的方向背道而馳，只會「親痛仇快」。賴瑞隆呼籲，大是大非之前，所有藍白立委都應清楚表態，並拿出勇氣停止政黨算計、回歸國家利益，亡羊補牢，與人民站在一起共同守護台灣安全。    ,https://news.ltn.com.tw/news/politics/breakingnews/5440205
創下首位外長赴WHA場邊紀錄 林佳龍27年前就曾發表WHO推案研究報告！,政治,2026/05/17 18:03,財團法人台灣醫界聯盟執行長林世嘉透露，她在1999年接手台灣醫界聯盟基金會後，曾委託當時任教於中正大學的林佳龍，針對推動台灣加入WHO撰寫研究報告〈我國加入世界衛生組織策略之探討〉。（擷取自林世嘉臉書）外交部長林佳龍於世界衛生大會（WHA）開幕前夕現身日內瓦，創下外長首例。財團法人台灣醫界聯盟執行長林世嘉透露，林佳龍早於1999年便曾受託撰寫研究報告，探討推動我國加入世界衛生組織（WHO）策略，她感嘆，這是第一次看到有外交部長如此積極推動、重視WHO推案，並挹注資源，將台灣優勢帶到國際。林世嘉受訪表示，她自1995年推動台灣加入WHO、1997年首次赴日內瓦至今，轉眼30年，第一次看到有外交部長如此積極推動、親自主導，重視WHO推案，並挹注更多資源，把台灣的優勢帶到國際上給大家知道。請繼續往下閱讀...林世嘉透露，她在1999年接手台灣醫界聯盟基金會後，曾委託當時於中正大學任教的林佳龍，針對推動台灣加入WHO撰寫研究報告〈我國加入世界衛生組織策略之探討〉，研析實質作為、國際法等。如今我國推案作為仍在這份研究報告的方向與結構上。林世嘉表示，今年外交部願意主動出擊，也令她相當感動，各部會資源不一，只有衛福部本身的資源不夠，因此林佳龍才召開雙部長會議。她指出，有外交部國經司與外貿協會攜手合作，今年才有這麼多廠商願意赴日內瓦參展，展現台灣國力。林世嘉認為，歐洲很難建交、但也不會斷交，有許多發展空間。在2001年醫界聯盟開始在歐洲進行台灣加入WHO遊說時，當時歐洲各國的外交部、衛生部都沒有支持台灣的意願，與遊說團體的會晤也都是匆匆結束，情勢與現在差異甚鉅；現在林佳龍能在歐洲跑來跑去，願意跨出去、嘗試，讓世界看見台灣，同時也受到歐洲國家接納，令她很感動。林世嘉指出，未來智慧醫療將改變許多醫療現場，所有智慧醫療都不能沒有晶片，而台灣是晶片之島，智慧醫療是資通訊產業與醫療的結合點。台灣目前已經在以數位病理AI協助友邦帛琉掃描，而數位病理AI技術不只有邦交國需要，全世界都有需求。    ,https://news.ltn.com.tw/news/politics/breakingnews/5440185
李四川：打造AI廊帶連起雙北 要把年輕人留在雙北,政治,2026/05/17 17:50,國民黨新北市長參選人李四川16日在董事長開講-粉絲見面會，暢談打造AI廊帶串連雙北。（李四川陣營提供）國民黨新北市長參選人李四川今天（17日）在社群媒體貼文，李四川在《打造AI廊帶連起雙北，要把年輕人留在雙北》影片中，細數打造AI廊帶，從台北市到新北市，AI廊帶不是畫在簡報上，是蓋在地圖上。從內科到北士科、蘆洲、土城、板橋、新店，他要跟台北市長蔣萬安一起，把雙北串成一條線。影片連結：https://www.facebook.com/story.php?story_fbid=1309616224025565&id=1534377361632852李四川在影片中娓娓道來，AI科技產業並不是只有私人企業，也需要政府能夠整合，城市的規劃、產業的聚落能夠配合，才能讓這些企業一起來投資，台北市有個蔣萬安市長 、如果新北市有一個李四川市長，雙北一定合作。請繼續往下閱讀...接下來要談雙北共治，李四川說，雙北共治最重要的就是交通，輝達（Nvidia）進駐北士科，提供將近1萬個工作機會，70%應該都是新北人，AI的廊帶，從內科到北士科，再經過蘆洲，再到土城的鴻海，從板橋到新店。李四川進一步說，台北市政府在輝達（Nvidia）進駐北士科的時候，他跟蔣萬安就已經核定一條橋，跨過基隆河到我們的社子島，年底如果他當選（新北市長），他一定從社子島再做一道橋，到新北市的蘆洲，那蘆社大橋蓋了以後，輕軌就可以延伸到五股，不只有大眾運輸系統，還可以開車從北士科到蘆洲到五股，接快速公路台64到快速公路台65，就可以直接到板橋，到土城的鴻海、到新店，等於AI的廊帶就會整個合在一起，把台北市與新北市連起來。    ,https://news.ltn.com.tw/news/politics/breakingnews/5440167
蔣萬安問民進黨要刪台獨黨綱？ 沈伯洋：咦！他不是學法律的嗎？,政治,2026/05/17 17:38,民進黨籍台北市長參選人沈伯洋。（記者方賓照攝）台北市長蔣萬安今天上午受訪說，中華民國本來就是主權獨立的國家，反問「民進黨要刪除台獨黨綱」嗎？對此，沈伯洋下午回應，現在是「台灣前途決議文」，並疑惑「咦！他不是學法律的嗎？」沈伯洋表示，他對這個可能有點不太了解，現在是「台灣前途決議文」，台灣的前途由全體台灣兩千三百萬人決定，這是我們現在的決議文，「現在沒有台獨黨...（綱），咦，奇怪，他為什麼會？他不是學法律的嗎？」請繼續往下閱讀...另國民黨籍新北市長參選人李四川喊出「雙北共治」、台北市長蔣萬安說一起打拚為市民打造更好的環境，民進黨籍新北市長參選人蘇巧慧說要保有主體性。沈伯洋表示，雙北共治是老議題，也是過往有過的平台，最近李四川說要弄垃圾桶，結果現在蔣萬安又要把垃圾桶移除，光是那麼細微的事情，都沒有辦法達成一致了，那他的雙北共治到底在哪裡？沈伯洋指出，城市與城市之間，本來就有一些合作，比如說交通等等之類的，然城市與城市之間也會有競爭的地方，就像名校之間互相競爭，兩校也會越來越好，所以我們各自提出對城市的願景，然後一起讓城市變好，這才是最重要的目的。關於垃圾與鼠患，他認為，重點不是垃圾桶撤與不撤如此簡單，而是垃圾桶的設計問題，這也是為何世界各國有很多例如智慧型、廚餘型、冷凍型、地下型等多元種類，如果沒有做好相關措施，可能就會成為鼠類的源頭，還有如何嚴格執行垃圾不落地也很重要。    ,https://news.ltn.com.tw/news/politics/breakingnews/5440164
「澎湖人」限定小帽！選舉創意小物引發排隊之亂,政治,2026/05/17 17:37,無黨澎湖縣長參選人許智富，推出澎湖人之帽引發排隊之亂。（記者劉禹慶攝）七美帽爭搶之亂重現馬公？無黨澎湖縣長參選人許智富競選總部，今（17）日發送澎湖人之帽，支持者提前湧入總部大排長龍，選舉創意小物問世，意外引爆排隊索取熱潮，讓外界慨嘆「古有黃巾之亂，今有澎湖人帽之亂！」澎湖縣長參選人許智富，今日在競選總部發放限量競選小帽，活動尚未開始，現場已出現大量支持民眾提前聚集。原本下午2時開始，不到下午1點30分，競選總部外便已大排長龍，不少民眾頂著烈日，只為搶先領取象徵「澎湖精神」的「澎湖人」限定小帽，場面相當熱烈。請繼續往下閱讀...據現場民眾表示，這次小帽設計簡單有質感，推出後在地方社群引發討論，不少支持者更專程從離島及各鄉市前來排隊。有人笑稱：「這不是帽子，是現在澎湖最難搶的入場券！」也有民眾開玩笑表示：「以前是黃巾軍，現在是澎湖人帽軍！」面對現場湧入的大批人潮，許智富也親自向支持者致意，感謝大家一路相挺。許智富表示，這頂帽子不只是競選小物，更代表一種認同感與對澎湖未來的期待，希望透過這份小小心意，凝聚更多關心澎湖的人，一起為家鄉努力。活動現場氣氛熱絡，不少民眾拿到帽子後立即戴上合照，總部外更一度形成滿街都是「澎湖人」的特殊景象，也讓網友笑稱：「這不是發帽子，是澎湖版限定潮流發表會！」許智富競選總部大排長龍，出現排隊索取澎湖人之帽熱潮。（記者劉禹慶攝）    ,https://news.ltn.com.tw/news/politics/breakingnews/5440093
蔣萬安稱數據滲透「可以問他」 沈伯洋妙回：萬事問中央變問伯洋了,政治,2026/05/17 16:52,民進黨籍台北市長參選人沈伯洋。（記者方賓照攝）台北市長蔣萬安今上午出席公開活動受訪時，要民進黨籍參選人沈伯洋說明是「哪一個具體數據被滲透、哪一位被調查的里長覺得被保護，你們可以問問他。」對此，沈下午受訪回應，「本來萬事問中央，現在變成萬事變問伯洋了。」市長每個月應該都有跟各地里長都有座談，所以對於里長現在的需求、里長要怎麼保護，「我認為他應該自己是最清楚才對」。沈伯洋表示，16日已說過，最重要的是資料的取得，2月國共論壇有提到人工智慧（AI）的合作，他舉例，之後市府如像局長等人到了中國，是否有無可能因為這樣的合作，導致資料被中國拿走，事涉資訊安全的問題，每位市民應該都想知道，因此站在市民的角度告訴大家，資訊安全應該要被守護，不要有這樣的風險，「我一直都不知道為什麼他們要糾結在這一點」。請繼續往下閱讀...沈伯洋指出，之前講的很清楚，當你有這樣的交流，就會產生這樣的破口，在節目裡是這樣講、在訪談時也是這樣說，就是因為已經創造了這樣的機會，那我們為什麼要有這樣的機會，讓資料被流出？媒體追問，如里長等高風險族群，會否認為立法明文禁止其赴中或報備較好？沈伯洋強調，一直以來都沒有禁止去，立委可以去中國，但是要透明化，目的在於一旦透明化後，聯審會會告知注意哪些議題，有沒有哪些人在接觸時，要小心自己的資料不要被取得、在台灣哪些事情是違法的，透明化才是最好的保護措施。沈伯洋也重申，我一直以來在講的就只有無限城論壇，對我來講比較重要的事，是帶著我們的里長到世界各地、各國首都去學習，然後交換意見，台灣其實也有很多治理厲害的地方，讓其他的國家知道，這才是首都該做的事。    ,https://news.ltn.com.tw/news/politics/breakingnews/5440102
北市母雞確定 張文潔：民進黨攻防重點不會只有傳統藍綠,政治,2026/05/17 16:52,議員張文潔認為，民進黨這次在北市選戰，希望讓選民感受到「市政監督能力」與「城市治理方向」的差異。（張文潔辦公室提供）2026年九合一大選台北市選戰已進入「母雞帶小雞」階段，民進黨籍台北市議員張文潔認為，各黨基本盤與主軸會越來越清楚，民進黨這次在台北的重點，不會只有傳統藍綠對決，而是希望讓選民感受到「市政監督能力」與「城市治理方向」的差異，因此包含交通、居住、托育、公共安全、青年政策等議題，都會是接下來攻防重點。對議員而言，則會更強調「地方服務及政策論述」的結合，而不只是空戰操作。至於國民黨部分，張文潔認為，蔣萬安目前最大的優勢仍是執政資源與市政曝光，因此藍營策略應該會偏向「母雞穩定帶動基本盤」，並透過行政資源與區域組織鞏固席次。不過，在部分競爭激烈或結構變化中的選區，藍營內部其實也會有世代交替與票源重疊壓力。請繼續往下閱讀...談到民眾黨，張文潔表示，白營目前看起來仍希望在台北維持第三勢力存在感，因此提名策略傾向「能提盡量提」，尤其在年輕票、都會票較集中的區域，會持續積極布局。不過，當藍白在同一選區都「推好推滿」，實際上就代表彼此存在競爭關係，後續是否有合作空間，還是要看選戰後期的整體局勢變化。至於外界關注蔣萬安是否可能替民眾黨議員站台，張文潔認為，雖然在政治上沒有什麼完全不可能，但地方基層感受仍然很重要，蔣萬安是一個對自己的政治利益盤算相當謹慎的人，他應該會直接考量北市不論市長或國民黨內其他人出現跨黨站台，基層支持者與地方組織能否接受的現實問題。張文潔也強調，對選民來說，最後真正關心的，還是候選人能不能回應地方需求、提出具體政見，而不是只有政黨排列組合。台北市選民結構成熟，議題感受度也高，單靠政治操作未必足夠，最終還是會回到候選人的實力與市政表現。    ,https://news.ltn.com.tw/news/politics/breakingnews/5440064
硬頸精神拚市政 李四川爭取客家票：若當選全力完成捷運萬大線,政治,2026/05/17 16:45,國民黨新北市長參選人李四川（中間拿酒杯握手者）今到樹林參加客家團體活動，與鄉親逐桌敬酒、握手。（記者黃政嘉攝）國民黨新北市長參選人李四川今午到樹林參加客家團體活動，與民進黨新北市長參選人蘇巧慧同場不同台，李四川帶著同黨新北隊「小雞」向在場客家鄉親爭取支持，並以客語問候大家，相親也以客語回喊「當選」，李四川表示，做工程的他，自當公務員至今皆秉持類似客家的硬頸精神，步步走下去，他拜託鄉親年底支持他，當選後，他一定會全力將樹林重要的捷運萬大線工程完成。李四川今與國民黨市議員呂家愷、洪佳君等人一起出席新北市樹林區客屬會承辦的客家藝文匯演公益活動，李四川致詞後再逐一敬酒、握手，與客家鄉親互動熱絡。新北市客家社團理事長協會會長湯富龍讚許李四川是做事的人，說他不屈不撓的精神，就像客家人的精神，新北市客家藝文協會理事長李算妹也送上鳳梨，表達對李四川的支持。請繼續往下閱讀...李四川致詞表示，很高興又回到樹林跟客家鄉親在一起，他常常說「咱都拚硬仔」，做工程的人也一樣，他說，這個精神，是他從當公務人員到現在，一定秉持著類似客家的硬頸精神，所有的市政建設再困難，還是一步一步的走下去。「拜託鄉親年底給我支持！」李四川說，樹林現在最重要的是捷運萬大線，包括一期、二期，一期大概明年就可以通車，二期還要再繼續努力，如果年底各位鄉親給他支持，讓他能夠回到新北市，他一定會全力將這個工程盡快把它完成，因此拜託鄉親的支持，還有國民黨在土樹三鶯提名的市議員人選、基層里長，全部高票當選。國民黨新北市長參選人李四川（左5）向說客家鄉親爭取支持，他說，當選後，一定會全力將樹林重要的捷運萬大線工程完成。（記者黃政嘉攝）國民黨新北市長參選人李四川（中）進場時，與客家鄉親握手致意。（記者黃政嘉攝）    ,https://news.ltn.com.tw/news/politics/breakingnews/5440048
密室逃脫釀死案 簡舒培揭市府基層早有動作 批蔣萬安還在卸責拖延,政治,2026/05/17 16:34,北市議員簡舒培表示，現在蔣萬安市政府的治理現況不是基層沒動作，而是高層一路拖延、消極不作為。（擷取自台北市議員簡舒培臉書）台北市密室逃脫接連發生兩起重大公共安全意外，上個月台北市議員參選人陳聖文才遭壓克力銳片刺入腰部，這個月員工測試「女鬼上吊」機關時，頸部遭勒住最終身亡。台北市議員簡舒培怒批，面對已經發生人命傷亡的重大事件，蔣萬安卻還在說：「缺乏統一管理制度，要和中央一起努力。」她表示，10日發生女員工意外事件時，市府基層就已知道事態嚴重，高層卻到14日傍晚才召開府級會議，直言：「問題根本不是沒制度，而是蔣萬安市政府完全沒有積極作為！」簡舒培發文表示，她私下接獲市府基層同仁爆料，在5月10日 「邏思起子」密室逃脫發生女員工意外事件，隔天台北市基層同仁其實就已經開始動起來了。相關單位第一時間就上網搜尋、整理密室逃脫業者資料，開始盤點台北市36家密室逃脫相關場所，準備好跨局處會議所需資料，等著市府高層召開跨局處會議，啟動全面稽查。換句話說，基層早就知道事情嚴重，也早就準備好了。請繼續往下閱讀...簡舒培說，卻一路拖到星期四（5月14日）傍晚，市府高層才終於召開府級會議。更誇張的是，開完會之後，竟然還是沒有拍板何時進行全面大稽查！她問，到底在等什麼？到底在軟弱什麼？難道是要等下一個意外發生嗎？她也指出，台北市政府本來就有權責可以處理！不論是勞工職場安全、消費者人身安全、消費權益保障及公共場所安全管理都有相關法令，可以要求業者改善、可以進行稽查、可以保護消費者與員工安全。問題從來不是「不能做」，而是「不願意做」。簡舒培表示，這就是現在蔣萬安市政府的治理現況；不是基層沒動作，而是高層一路拖延、消極不作為。她說，蔣萬安市政府真的讓人看見什麼叫做：「將帥無能，累死三軍。」基層同仁早就做好準備，但高層卻還在推責任、等風頭、拖時間。就在這樣推來推去、拖來拖去的過程裡，被犧牲掉的，可能就是台北市民的安全，甚至是人民的生命。    ,https://news.ltn.com.tw/news/politics/breakingnews/5440077
換肝名醫仲介病患赴中「換器官」賺千萬 監委田秋堇要查了,政治,2026/05/17 16:05,換肝名醫陳堯俐。（資料照）換肝名醫陳堯俐涉嫌與生技公司黃姓男子等人，非法仲介9名台灣病患赴中國進行肝臟及腎臟移植手術，獲取仲介費1466萬元，彰化地檢署以違反「人體器官移植條例」起訴，並具體求刑6年。彰化地院判處陳2年徒刑，緩刑5年，並需向公庫支付500萬元。監委田秋堇今表示，此案引發外界對於部分醫師涉及仲介器官移植、違反醫療倫理之質疑，已正式申請自動調查。田秋堇指出，據悉，陳姓醫師於任職彰化基督教醫療財團法人彰化基督教醫院期間，因多次有償仲介病患赴中國進行器官移植並提供手術指導，涉違反我國「人體器官移植條例」，經台灣彰化地方法院判決有罪。請繼續往下閱讀...田監委表示，世界醫師會《人體器官組織移植聲明》及《伊斯坦堡宣言》等國際規範，均嚴正反對器官移植旅遊及強摘器官等危害人權行為。鑒於器官移植深切關乎病患之生命權與器捐者之基本人權，且醫師執業承載高度社會信任與倫理責任，如有嚴重違反醫療倫理規範之行為，將對醫界形象與人權價值影響甚鉅。她強調，究我國對於國人赴境外移植器官之溯源機制是否健全？現行相關規範有無缺漏或應予改進之處？主管機關就法院判處陳醫師所涉違反醫師倫理規範行為有無確實行政調查？均有深入瞭解之必要。    ,https://news.ltn.com.tw/news/politics/breakingnews/5440014
